------[ Versions ]------

Program Version : EVEREST v5.30.1900
BenchDLL Version: 2.4.273.0

------[ CPU Info ]------

CPU Type           : AMD K6-III+, 550 MHz (5.5 x 100)
CPU Platform       : Socket 7
Instruction Set    : x86, MMX, 3DNow!
CPUID Manufacturer : AuthenticAMD
CPUID CPU Name     : AMD-K6(tm)-III Processor
CPUID Revision     : 000005D0h
Platform ID        : CBh  (Socket 7)

------[ Logical CPU #0 ]------

allcpu: Valid

CPUID 00000000: 00000001-68747541-444D4163-69746E65
CPUID 00000001: 000005D0-00000000-00000000-008021BF
CPUID 80000000: 80000007-00000000-00000000-00000000
CPUID 80000001: 000006D0-00000000-00000000-C08029BF
CPUID 80000002: 2D444D41-7428364B-492D296D-50204949
CPUID 80000003: 65636F72-726F7373-00000000-00000000
CPUID 80000004: 00000000-00000000-00000000-00000000
CPUID 80000005: 00000000-02800140-20020220-20020220
CPUID 80000006: 00000000-00000000-01004220-00000000
CPUID 80000007: 00000000-00000000-00000000-00000007
CPUID 8FFFFFFF: 4778654E-72656E65-6F697461-444D416E

------[ MSR Registers ]------

MSR C0000087: 0000-0000-006A-D003

PerformanceFrequency = 1193182

Tjmax Temperature = 0 Celsius
