CPUID 00000000: 00000001-68747541-444D4163-69746E65  
CPUID 00000001: 00050FF3-00000800-00002001-078BFBFF  
CPUID 80000000: 80000018-68747541-444D4163-69746E65  
CPUID 80000001: 00050FF3-000004C3-0000001D-EBD3FBFF  
CPUID 80000002: 20444D41-636F7250-6F737365-6F6D2072  
CPUID 80000003: 206C6564-6E6B6E75-006E776F-00000000  
CPUID 80000004: 00000000-00000000-00000000-00000000  
CPUID 80000005: FF08FF08-FF20FF20-40020140-40020140  
CPUID 80000006: 00000000-42004200-04008140-00000000  
CPUID 80000007: 00000000-00000000-00000000-0000003F  
CPUID 80000008: 00003028-00000000-00000000-00000000  
CPUID 80000009: 00000000-00000000-00000000-00000000  
CPUID 8000000A: 00000001-00000040-00000000-00000000  
CPUID 8000000B: 00000000-00000000-00000000-00000000  
CPUID 8000000C: 00000000-00000000-00000000-00000000  
CPUID 8000000D: 00000000-00000000-00000000-00000000  
CPUID 8000000E: 00000000-00000000-00000000-00000000  
CPUID 8000000F: 00000000-00000000-00000000-00000000  
CPUID 80000010: 00000000-00000000-00000000-00000000  
CPUID 80000011: 00000000-00000000-00000000-00000000  
CPUID 80000012: 00000000-00000000-00000000-00000000  
CPUID 80000013: 00000000-00000000-00000000-00000000  
CPUID 80000014: 00000000-00000000-00000000-00000000  
CPUID 80000015: 00000000-00000000-00000000-00000000  
CPUID 80000016: 00000000-00000000-00000000-00000000  
CPUID 80000017: 00000000-00000000-00000000-00000000  
CPUID 80000018: 00000000-00000000-00000000-00000000