------[ Logical CPU #0 ]------

allcpu: Package 0 / Core 0 / Thread 0: Valid

CPUID 00000000: 0000000D-68747541-444D4163-69746E65 [AuthenticAMD]
CPUID 00000001: 00660F01-00020800-7ED8320B-178BFBFF
CPUID 00000002: 00000000-00000000-00000000-00000000
CPUID 00000003: 00000000-00000000-00000000-00000000
CPUID 00000005: 00000040-00000040-00000003-00000000
CPUID 00000006: 00000004-00000000-00000001-00000000
CPUID 00000007: 00000000-000001A9-00000000-00000000
CPUID 00000008: 00000000-00000000-00000000-00000000
CPUID 00000009: 00000000-00000000-00000000-00000000
CPUID 0000000A: 00000000-00000000-00000000-00000000
CPUID 0000000C: 00000000-00000000-00000000-00000000
CPUID 0000000D: 00000007-00000340-000003C0-40000000 [SL 00]
CPUID 0000000D: 00000001-00000000-00000000-00000000 [SL 01]
CPUID 0000000D: 00000100-00000240-00000000-00000000 [SL 02]
CPUID 0000000D: 00000080-00000340-00000000-00000000 [SL 3E]
CPUID 80000000: 8000001E-68747541-444D4163-69746E65 [AuthenticAMD]
CPUID 80000001: 00660F01-00000000-2FABBFFF-2FD3FBFF
CPUID 80000002: 20444D41-6574704F-286E6F72-20296D74 [AMD Opteron(tm) ]
CPUID 80000003: 31323358-50412036-20202055-20202020 [X3216 APU       ]
CPUID 80000004: 20202020-20202020-20202020-00202020 [               ]
CPUID 80000005: FF40FF18-FF40FF30-20080140-60030140
CPUID 80000006: 64006400-64004200-04008140-00000000
CPUID 80000007: 00000000-00000005-00000400-000037D9
CPUID 80000008: 00003030-00000000-00004001-00000000
CPUID 80000009: 00000000-00000000-00000000-00000000
CPUID 8000000A: 00000001-00008000-00000000-0001BCFF
CPUID 8000000B: 00000000-00000000-00000000-00000000
CPUID 8000000C: 00000000-00000000-00000000-00000000
CPUID 8000000D: 00000000-00000000-00000000-00000000
CPUID 8000000E: 00000000-00000000-00000000-00000000
CPUID 8000000F: 00000000-00000000-00000000-00000000
CPUID 80000010: 00000000-00000000-00000000-00000000
CPUID 80000011: 00000000-00000000-00000000-00000000
CPUID 80000012: 00000000-00000000-00000000-00000000
CPUID 80000013: 00000000-00000000-00000000-00000000
CPUID 80000014: 00000000-00000000-00000000-00000000
CPUID 80000015: 00000000-00000000-00000000-00000000
CPUID 80000016: 00000000-00000000-00000000-00000000
CPUID 80000017: 00000000-00000000-00000000-00000000
CPUID 80000018: 00000000-00000000-00000000-00000000
CPUID 80000019: F040F018-64006400-00000000-00000000
CPUID 8000001A: 00000003-00000000-00000000-00000000
CPUID 8000001B: 000007FF-00000000-00000000-00000000
CPUID 8000001C: 00000000-80032013-00010200-E000000F
CPUID 8000001E: 00000010-00000100-00000000-00000000
CPUID 8FFFFFFF: 00000000-00000000-00000000-00000000

------[ Logical CPU #1 ]------

allcpu: Package 0 / Core 1 / Thread 0: Valid

CPUID 00000000: 0000000D-68747541-444D4163-69746E65 [AuthenticAMD]
CPUID 00000001: 00660F01-01020800-7ED8320B-178BFBFF
CPUID 00000002: 00000000-00000000-00000000-00000000
CPUID 00000003: 00000000-00000000-00000000-00000000
CPUID 00000005: 00000040-00000040-00000003-00000000
CPUID 00000006: 00000004-00000000-00000001-00000000
CPUID 00000007: 00000000-000001A9-00000000-00000000
CPUID 00000008: 00000000-00000000-00000000-00000000
CPUID 00000009: 00000000-00000000-00000000-00000000
CPUID 0000000A: 00000000-00000000-00000000-00000000
CPUID 0000000C: 00000000-00000000-00000000-00000000
CPUID 0000000D: 00000007-00000340-000003C0-40000000 [SL 00]
CPUID 0000000D: 00000001-00000000-00000000-00000000 [SL 01]
CPUID 0000000D: 00000100-00000240-00000000-00000000 [SL 02]
CPUID 0000000D: 00000080-00000340-00000000-00000000 [SL 3E]
CPUID 80000000: 8000001E-68747541-444D4163-69746E65 [AuthenticAMD]
CPUID 80000001: 00660F01-00000000-2FABBFFF-2FD3FBFF
CPUID 80000002: 20444D41-6574704F-286E6F72-20296D74 [AMD Opteron(tm) ]
CPUID 80000003: 31323358-50412036-20202055-20202020 [X3216 APU       ]
CPUID 80000004: 20202020-20202020-20202020-00202020 [               ]
CPUID 80000005: FF40FF18-FF40FF30-20080140-60030140
CPUID 80000006: 64006400-64004200-04008140-00000000
CPUID 80000007: 00000000-00000005-00000400-000037D9
CPUID 80000008: 00003030-00000000-00004001-00000000
CPUID 80000009: 00000000-00000000-00000000-00000000
CPUID 8000000A: 00000001-00008000-00000000-0001BCFF
CPUID 8000000B: 00000000-00000000-00000000-00000000
CPUID 8000000C: 00000000-00000000-00000000-00000000
CPUID 8000000D: 00000000-00000000-00000000-00000000
CPUID 8000000E: 00000000-00000000-00000000-00000000
CPUID 8000000F: 00000000-00000000-00000000-00000000
CPUID 80000010: 00000000-00000000-00000000-00000000
CPUID 80000011: 00000000-00000000-00000000-00000000
CPUID 80000012: 00000000-00000000-00000000-00000000
CPUID 80000013: 00000000-00000000-00000000-00000000
CPUID 80000014: 00000000-00000000-00000000-00000000
CPUID 80000015: 00000000-00000000-00000000-00000000
CPUID 80000016: 00000000-00000000-00000000-00000000
CPUID 80000017: 00000000-00000000-00000000-00000000
CPUID 80000018: 00000000-00000000-00000000-00000000
CPUID 80000019: F040F018-64006400-00000000-00000000
CPUID 8000001A: 00000003-00000000-00000000-00000000
CPUID 8000001B: 000007FF-00000000-00000000-00000000
CPUID 8000001C: 00000000-80032013-00010200-E000000F
CPUID 8000001E: 00000011-00000100-00000000-00000000
CPUID 8FFFFFFF: 00000000-00000000-00000000-00000000

------[ All CPUs ]------

CPU   0: APICID   0 / Package 0 / Core  0 / Thread 0: Valid
CPU   1: APICID   1 / Package 0 / Core  1 / Thread 0: Valid

------[ MSR Registers ]------

CPU Clock (Normal): 2994 MHz
CPU Clock (TSC): 1597 MHz
CPU Multiplier: 30.0x
CPB PStates: 5
MSR 0000001B: 0000-0000-FEE0-0900
MSR 0000008B: 0000-0000-0600-6118
MSR 000000E7: 0000-0000-00C6-BFC2 [S200]
MSR 000000E7: 0000-0000-0002-1E61 [S200]
MSR 000000E7: 0000-0000-0001-5C96
MSR 000000E8: 0000-0000-0001-5F5E [S200]
MSR 000000E8: 0000-0000-0001-0C53 [S200]
MSR 000000E8: 0000-0000-0001-4645
MSR C0010004: 0000-0000-0000-0000
MSR C0010005: 0000-0000-0000-0000
MSR C0010006: 0000-0000-0000-0000
MSR C0010007: 0000-0000-0000-0000
MSR C0010015: 0000-0000-1900-1011
MSR C001001F: 0258-4000-0885-0000
MSR C0010055: 0000-0000-0000-0000
MSR C0010058: 0000-0000-F800-0019
MSR C0010061: 0000-0000-0000-0020
MSR C0010062: 0000-0000-0000-0002
MSR C0010063: 0000-0000-0000-0002
MSR C0010064: 8000-0185-0000-500E [30.00x] [1.3000 V] [13.30 A] [PState Pb0]
MSR C0010065: 8000-0173-0000-640C [28.00x] [1.2375 V] [11.50 A] [PState Pb1]
MSR C0010066: 8000-015D-0000-8009 [25.00x] [1.1500 V] [ 9.30 A] [PState Pb2]
MSR C0010067: 8000-0144-0000-A805 [21.00x] [1.0250 V] [ 6.80 A] [PState Pb3]
MSR C0010068: 8000-013A-0000-B856 [19.00x] [0.9750 V] [ 5.80 A] [PState Pb4]
MSR C0010069: 8000-0130-0000-C850 [16.00x] [0.9250 V] [ 4.80 A] [PState P0]
MSR C001006A: 8000-0128-0000-D84C [14.00x] [0.8750 V] [ 4.00 A] [PState P1]
MSR C001006B: 8000-0123-0040-E048 [12.00x] [0.8500 V] [ 3.50 A] [PState P2]
MSR C0010070: 0000-0000-3E47-E048
MSR C0010071: 68BC-0006-6E47-E048 [12.00x] [0.0500V]
MSR C0010071: 68BC-0006-6E47-E048 [12.00x] [0.0500V]
MSR C0010071: 68BC-0006-6E47-E048 [12.00x] [0.0500V]
MSR C0010071: 68BC-0006-6E47-E048 [12.00x] [0.0500V]
MSR C0010071: 68BC-0006-6E47-E048 [12.00x] [0.0500V]
MSR C0010140: 0000-0000-0000-0006
MSR C0010141: 0000-0000-0000-0000
MSR C0011023: 810A-4000-0078-3220
