------[ Logical CPU #0 ]------

allcpu: Package 0 / Core 0 / Thread 0: Valid

CPUID 00000000: 0000000D-68747541-444D4163-69746E65 [AuthenticAMD]
CPUID 00000001: 00630F81-00040800-3E98320B-178BFBFF
CPUID 00000002: 00000000-00000000-00000000-00000000
CPUID 00000003: 00000000-00000000-00000000-00000000
CPUID 00000005: 00000040-00000040-00000003-00000000
CPUID 00000006: 00000000-00000000-00000001-00000000
CPUID 00000007: 00000000-00000009-00000000-00000000
CPUID 00000008: 00000000-00000000-00000000-00000000
CPUID 00000009: 00000000-00000000-00000000-00000000
CPUID 0000000A: 00000000-00000000-00000000-00000000
CPUID 0000000C: 00000000-00000000-00000000-00000000
CPUID 0000000D: 00000007-00000340-000003C0-40000000 [SL 00]
CPUID 0000000D: 00000001-00000000-00000000-00000000 [SL 01]
CPUID 0000000D: 00000100-00000240-00000000-00000000 [SL 02]
CPUID 0000000D: 00000080-00000340-00000000-00000000 [SL 3E]
CPUID 80000000: 8000001E-68747541-444D4163-69746E65 [AuthenticAMD]
CPUID 80000001: 00630F81-10000000-0FEBBFFF-2FD3FBFF
CPUID 80000002: 20444D41-372D3841-4B303736-64615220 [AMD A8-7670K Rad]
CPUID 80000003: 206E6F65-202C3752-43203031-75706D6F [eon R7, 10 Compu]
CPUID 80000004: 43206574-7365726F-2B433420-00204736 [te Cores 4C+6G ]
CPUID 80000005: FF40FF18-FF40FF30-10040140-60030140
CPUID 80000006: 64006400-64004200-08008140-00000000
CPUID 80000007: 00000000-00000001-00000000-000027D9
CPUID 80000008: 00003030-00000000-00004003-00000000
CPUID 80000009: 00000000-00000000-00000000-00000000
CPUID 8000000A: 00000001-00010000-00000000-00001CFF
CPUID 8000000B: 00000000-00000000-00000000-00000000
CPUID 8000000C: 00000000-00000000-00000000-00000000
CPUID 8000000D: 00000000-00000000-00000000-00000000
CPUID 8000000E: 00000000-00000000-00000000-00000000
CPUID 8000000F: 00000000-00000000-00000000-00000000
CPUID 80000010: 00000000-00000000-00000000-00000000
CPUID 80000011: 00000000-00000000-00000000-00000000
CPUID 80000012: 00000000-00000000-00000000-00000000
CPUID 80000013: 00000000-00000000-00000000-00000000
CPUID 80000014: 00000000-00000000-00000000-00000000
CPUID 80000015: 00000000-00000000-00000000-00000000
CPUID 80000016: 00000000-00000000-00000000-00000000
CPUID 80000017: 00000000-00000000-00000000-00000000
CPUID 80000018: 00000000-00000000-00000000-00000000
CPUID 80000019: F040F018-64006400-00000000-00000000
CPUID 8000001A: 00000003-00000000-00000000-00000000
CPUID 8000001B: 000001FF-00000000-00000000-00000000
CPUID 8000001C: 00000000-80032013-00010200-E000000F
CPUID 8000001D: 00000121-00C0003F-0000003F-00000000 [SL 00]
CPUID 8000001D: 00004122-0080003F-000001FF-00000000 [SL 01]
CPUID 8000001D: 00004143-03C0003F-000007FF-00000001 [SL 02]
CPUID 8000001E: 00000010-00000100-00000000-00000000
CPUID 8FFFFFFF: 00000000-00000000-00000000-00000000

L1    Data Cache:    16 KB,  4-way Associative, 64-byte Line
L1  Instr. Cache:    96 KB,  3-way Associative, 64-byte Line
L2 Unified Cache:     2 MB, 16-way Associative, 64-byte Line

------[ Logical CPU #1 ]------

allcpu: Package 0 / Core 1 / Thread 0: Valid

CPUID 00000000: 0000000D-68747541-444D4163-69746E65 [AuthenticAMD]
CPUID 00000001: 00630F81-01040800-3E98320B-178BFBFF
CPUID 00000002: 00000000-00000000-00000000-00000000
CPUID 00000003: 00000000-00000000-00000000-00000000
CPUID 00000005: 00000040-00000040-00000003-00000000
CPUID 00000006: 00000000-00000000-00000001-00000000
CPUID 00000007: 00000000-00000009-00000000-00000000
CPUID 00000008: 00000000-00000000-00000000-00000000
CPUID 00000009: 00000000-00000000-00000000-00000000
CPUID 0000000A: 00000000-00000000-00000000-00000000
CPUID 0000000C: 00000000-00000000-00000000-00000000
CPUID 0000000D: 00000007-00000340-000003C0-40000000 [SL 00]
CPUID 0000000D: 00000001-00000000-00000000-00000000 [SL 01]
CPUID 0000000D: 00000100-00000240-00000000-00000000 [SL 02]
CPUID 0000000D: 00000080-00000340-00000000-00000000 [SL 3E]
CPUID 80000000: 8000001E-68747541-444D4163-69746E65 [AuthenticAMD]
CPUID 80000001: 00630F81-10000000-0FEBBFFF-2FD3FBFF
CPUID 80000002: 20444D41-372D3841-4B303736-64615220 [AMD A8-7670K Rad]
CPUID 80000003: 206E6F65-202C3752-43203031-75706D6F [eon R7, 10 Compu]
CPUID 80000004: 43206574-7365726F-2B433420-00204736 [te Cores 4C+6G ]
CPUID 80000005: FF40FF18-FF40FF30-10040140-60030140
CPUID 80000006: 64006400-64004200-08008140-00000000
CPUID 80000007: 00000000-00000001-00000000-000027D9
CPUID 80000008: 00003030-00000000-00004003-00000000
CPUID 80000009: 00000000-00000000-00000000-00000000
CPUID 8000000A: 00000001-00010000-00000000-00001CFF
CPUID 8000000B: 00000000-00000000-00000000-00000000
CPUID 8000000C: 00000000-00000000-00000000-00000000
CPUID 8000000D: 00000000-00000000-00000000-00000000
CPUID 8000000E: 00000000-00000000-00000000-00000000
CPUID 8000000F: 00000000-00000000-00000000-00000000
CPUID 80000010: 00000000-00000000-00000000-00000000
CPUID 80000011: 00000000-00000000-00000000-00000000
CPUID 80000012: 00000000-00000000-00000000-00000000
CPUID 80000013: 00000000-00000000-00000000-00000000
CPUID 80000014: 00000000-00000000-00000000-00000000
CPUID 80000015: 00000000-00000000-00000000-00000000
CPUID 80000016: 00000000-00000000-00000000-00000000
CPUID 80000017: 00000000-00000000-00000000-00000000
CPUID 80000018: 00000000-00000000-00000000-00000000
CPUID 80000019: F040F018-64006400-00000000-00000000
CPUID 8000001A: 00000003-00000000-00000000-00000000
CPUID 8000001B: 000001FF-00000000-00000000-00000000
CPUID 8000001C: 00000000-80032013-00010200-E000000F
CPUID 8000001D: 00000121-00C0003F-0000003F-00000000 [SL 00]
CPUID 8000001D: 00004122-0080003F-000001FF-00000000 [SL 01]
CPUID 8000001D: 00004143-03C0003F-000007FF-00000001 [SL 02]
CPUID 8000001E: 00000011-00000100-00000000-00000000
CPUID 8FFFFFFF: 00000000-00000000-00000000-00000000

L1    Data Cache:    16 KB,  4-way Associative, 64-byte Line
L1  Instr. Cache:    96 KB,  3-way Associative, 64-byte Line
L2 Unified Cache:     2 MB, 16-way Associative, 64-byte Line

------[ Logical CPU #2 ]------

allcpu: Package 0 / Core 2 / Thread 0: Valid

CPUID 00000000: 0000000D-68747541-444D4163-69746E65 [AuthenticAMD]
CPUID 00000001: 00630F81-02040800-3E98320B-178BFBFF
CPUID 00000002: 00000000-00000000-00000000-00000000
CPUID 00000003: 00000000-00000000-00000000-00000000
CPUID 00000005: 00000040-00000040-00000003-00000000
CPUID 00000006: 00000000-00000000-00000001-00000000
CPUID 00000007: 00000000-00000009-00000000-00000000
CPUID 00000008: 00000000-00000000-00000000-00000000
CPUID 00000009: 00000000-00000000-00000000-00000000
CPUID 0000000A: 00000000-00000000-00000000-00000000
CPUID 0000000C: 00000000-00000000-00000000-00000000
CPUID 0000000D: 00000007-00000340-000003C0-40000000 [SL 00]
CPUID 0000000D: 00000001-00000000-00000000-00000000 [SL 01]
CPUID 0000000D: 00000100-00000240-00000000-00000000 [SL 02]
CPUID 0000000D: 00000080-00000340-00000000-00000000 [SL 3E]
CPUID 80000000: 8000001E-68747541-444D4163-69746E65 [AuthenticAMD]
CPUID 80000001: 00630F81-10000000-0FEBBFFF-2FD3FBFF
CPUID 80000002: 20444D41-372D3841-4B303736-64615220 [AMD A8-7670K Rad]
CPUID 80000003: 206E6F65-202C3752-43203031-75706D6F [eon R7, 10 Compu]
CPUID 80000004: 43206574-7365726F-2B433420-00204736 [te Cores 4C+6G ]
CPUID 80000005: FF40FF18-FF40FF30-10040140-60030140
CPUID 80000006: 64006400-64004200-08008140-00000000
CPUID 80000007: 00000000-00000001-00000000-000027D9
CPUID 80000008: 00003030-00000000-00004003-00000000
CPUID 80000009: 00000000-00000000-00000000-00000000
CPUID 8000000A: 00000001-00010000-00000000-00001CFF
CPUID 8000000B: 00000000-00000000-00000000-00000000
CPUID 8000000C: 00000000-00000000-00000000-00000000
CPUID 8000000D: 00000000-00000000-00000000-00000000
CPUID 8000000E: 00000000-00000000-00000000-00000000
CPUID 8000000F: 00000000-00000000-00000000-00000000
CPUID 80000010: 00000000-00000000-00000000-00000000
CPUID 80000011: 00000000-00000000-00000000-00000000
CPUID 80000012: 00000000-00000000-00000000-00000000
CPUID 80000013: 00000000-00000000-00000000-00000000
CPUID 80000014: 00000000-00000000-00000000-00000000
CPUID 80000015: 00000000-00000000-00000000-00000000
CPUID 80000016: 00000000-00000000-00000000-00000000
CPUID 80000017: 00000000-00000000-00000000-00000000
CPUID 80000018: 00000000-00000000-00000000-00000000
CPUID 80000019: F040F018-64006400-00000000-00000000
CPUID 8000001A: 00000003-00000000-00000000-00000000
CPUID 8000001B: 000001FF-00000000-00000000-00000000
CPUID 8000001C: 00000000-80032013-00010200-E000000F
CPUID 8000001D: 00000121-00C0003F-0000003F-00000000 [SL 00]
CPUID 8000001D: 00004122-0080003F-000001FF-00000000 [SL 01]
CPUID 8000001D: 00004143-03C0003F-000007FF-00000001 [SL 02]
CPUID 8000001E: 00000012-00000101-00000000-00000000
CPUID 8FFFFFFF: 00000000-00000000-00000000-00000000

L1    Data Cache:    16 KB,  4-way Associative, 64-byte Line
L1  Instr. Cache:    96 KB,  3-way Associative, 64-byte Line
L2 Unified Cache:     2 MB, 16-way Associative, 64-byte Line

------[ Logical CPU #3 ]------

allcpu: Package 0 / Core 3 / Thread 0: Valid

CPUID 00000000: 0000000D-68747541-444D4163-69746E65 [AuthenticAMD]
CPUID 00000001: 00630F81-03040800-3E98320B-178BFBFF
CPUID 00000002: 00000000-00000000-00000000-00000000
CPUID 00000003: 00000000-00000000-00000000-00000000
CPUID 00000005: 00000040-00000040-00000003-00000000
CPUID 00000006: 00000000-00000000-00000001-00000000
CPUID 00000007: 00000000-00000009-00000000-00000000
CPUID 00000008: 00000000-00000000-00000000-00000000
CPUID 00000009: 00000000-00000000-00000000-00000000
CPUID 0000000A: 00000000-00000000-00000000-00000000
CPUID 0000000C: 00000000-00000000-00000000-00000000
CPUID 0000000D: 00000007-00000340-000003C0-40000000 [SL 00]
CPUID 0000000D: 00000001-00000000-00000000-00000000 [SL 01]
CPUID 0000000D: 00000100-00000240-00000000-00000000 [SL 02]
CPUID 0000000D: 00000080-00000340-00000000-00000000 [SL 3E]
CPUID 80000000: 8000001E-68747541-444D4163-69746E65 [AuthenticAMD]
CPUID 80000001: 00630F81-10000000-0FEBBFFF-2FD3FBFF
CPUID 80000002: 20444D41-372D3841-4B303736-64615220 [AMD A8-7670K Rad]
CPUID 80000003: 206E6F65-202C3752-43203031-75706D6F [eon R7, 10 Compu]
CPUID 80000004: 43206574-7365726F-2B433420-00204736 [te Cores 4C+6G ]
CPUID 80000005: FF40FF18-FF40FF30-10040140-60030140
CPUID 80000006: 64006400-64004200-08008140-00000000
CPUID 80000007: 00000000-00000001-00000000-000027D9
CPUID 80000008: 00003030-00000000-00004003-00000000
CPUID 80000009: 00000000-00000000-00000000-00000000
CPUID 8000000A: 00000001-00010000-00000000-00001CFF
CPUID 8000000B: 00000000-00000000-00000000-00000000
CPUID 8000000C: 00000000-00000000-00000000-00000000
CPUID 8000000D: 00000000-00000000-00000000-00000000
CPUID 8000000E: 00000000-00000000-00000000-00000000
CPUID 8000000F: 00000000-00000000-00000000-00000000
CPUID 80000010: 00000000-00000000-00000000-00000000
CPUID 80000011: 00000000-00000000-00000000-00000000
CPUID 80000012: 00000000-00000000-00000000-00000000
CPUID 80000013: 00000000-00000000-00000000-00000000
CPUID 80000014: 00000000-00000000-00000000-00000000
CPUID 80000015: 00000000-00000000-00000000-00000000
CPUID 80000016: 00000000-00000000-00000000-00000000
CPUID 80000017: 00000000-00000000-00000000-00000000
CPUID 80000018: 00000000-00000000-00000000-00000000
CPUID 80000019: F040F018-64006400-00000000-00000000
CPUID 8000001A: 00000003-00000000-00000000-00000000
CPUID 8000001B: 000001FF-00000000-00000000-00000000
CPUID 8000001C: 00000000-80032013-00010200-E000000F
CPUID 8000001D: 00000121-00C0003F-0000003F-00000000 [SL 00]
CPUID 8000001D: 00004122-0080003F-000001FF-00000000 [SL 01]
CPUID 8000001D: 00004143-03C0003F-000007FF-00000001 [SL 02]
CPUID 8000001E: 00000013-00000101-00000000-00000000
CPUID 8FFFFFFF: 00000000-00000000-00000000-00000000

L1    Data Cache:    16 KB,  4-way Associative, 64-byte Line
L1  Instr. Cache:    96 KB,  3-way Associative, 64-byte Line
L2 Unified Cache:     2 MB, 16-way Associative, 64-byte Line

------[ All CPUs ]------

CPU   0: APICID   0 / Package 0 / Core  0 / Thread 0: Valid
CPU   1: APICID   1 / Package 0 / Core  1 / Thread 0: Valid
CPU   2: APICID   2 / Package 0 / Core  2 / Thread 0: Valid
CPU   3: APICID   3 / Package 0 / Core  3 / Thread 0: Valid

------[ MSR Registers ]------

CPU Clock (Normal): 1896 MHz
CPU Clock (TSC): 3593 MHz
CPU Multiplier: 19.0x
CPB PStates: 2
MSR 0000001B: 0000-0000-FEE0-0900
MSR 0000008B: 0000-0000-0600-3106
MSR 000000E7: 0000-0000-00D2-FE55 [S200]
MSR 000000E7: 0000-0000-0001-B6A8 [S200]
MSR 000000E7: 0000-0000-0001-EC43
MSR 000000E8: 0000-0000-0001-6C06 [S200]
MSR 000000E8: 0000-0000-0000-FE2C [S200]
MSR 000000E8: 0000-0000-0001-02D1
MSR C0010004: 0000-FFFF-FFC9-6519
MSR C0010005: 0000-0000-0000-0000
MSR C0010006: 0000-0000-0000-0000
MSR C0010007: 0000-0000-0000-0000
MSR C0010015: 0000-0000-0900-1011
MSR C001001F: 0040-4000-0885-0000
MSR C0010055: 0000-0000-0000-0000
MSR C0010058: 0000-0000-F000-0019
MSR C0010061: 0000-0000-0000-0050
MSR C0010062: 0000-0000-0000-0000
MSR C0010063: 0000-0000-0000-0000
MSR C0010064: 8000-01B4-0000-1817 [39.00x] [1.4750 V] [18.00 A] [PState Pb0]
MSR C0010065: 8000-001A-0000-2C15 [37.00x] [1.4125 V] [26.00 A] [PState Pb1]
MSR C0010066: 8000-01DE-0000-3C14 [36.00x] [1.3625 V] [22.20 A] [PState P0]
MSR C0010067: 8000-01AF-0000-5012 [34.00x] [1.3000 V] [17.50 A] [PState P1]
MSR C0010068: 8000-0191-0000-6C0F [31.00x] [1.2125 V] [14.50 A] [PState P2]
MSR C0010069: 8000-017D-0000-7C0C [28.00x] [1.1625 V] [12.50 A] [PState P3]
MSR C001006A: 8000-0157-0000-9C08 [24.00x] [1.0625 V] [ 8.70 A] [PState P4]
MSR C001006B: 8000-0139-0040-AC56 [19.00x] [1.0125 V] [ 5.70 A] [PState P5]
MSR C0010070: 0000-0000-4000-1817
MSR C0010071: 0000-0006-4440-1817 [39.00x] [1.4750V]
MSR C0010071: 0100-0006-4447-1856 [19.00x] [0.6750V]
MSR C0010071: 0000-0006-4447-1856 [19.00x] [0.6750V]
MSR C0010071: 0100-0006-4447-1856 [19.00x] [0.6750V]
MSR C0010071: 0000-0006-4447-1856 [19.00x] [0.6750V]
MSR C0010140: 0000-0000-0000-0004
MSR C0010141: 0000-0000-0000-0000
MSR C0011023: 8102-4004-0078-1220