------[ Versions ]------

Program Version : EVEREST v4.60.1628 Beta
BenchDLL Version: 2.4.257.0

------[ CPU Info ]------

CPU Type           : DualCore AMD Athlon 64 X2 Black Edition, 3200 MHz (16 x 200) 6400+
CPU Alias          : Windsor
CPU Platform       : Socket AM2
CPU Stepping       : JH-F3
Instruction Set    : x86, x86-64, MMX, 3DNow!, SSE, SSE2, SSE3
CPUID Manufacturer : AuthenticAMD
CPUID CPU Name     : AMD Athlon(tm) 64 X2 Dual Core Processor 6400+
CPUID Revision     : 00040F33h
AMD New Brand ID   : 09A7h  (Athlon 64 X2 6400+)
Platform ID        : D5h  (Socket AM2)

------[ Logical CPU #0 ]------

allcpu: Valid

CPUID 00000000: 00000001-68747541-444D4163-69746E65
CPUID 00000001: 00040F33-00020800-00002001-178BFBFF
CPUID 80000000: 80000018-68747541-444D4163-69746E65
CPUID 80000001: 00040F33-000009A7-0000001F-EBD3FBFF
CPUID 80000002: 20444D41-6C687441-74286E6F-3620296D
CPUID 80000003: 32582034-61754420-6F43206C-50206572
CPUID 80000004: 65636F72-726F7373-30343620-00002B30
CPUID 80000005: FF08FF08-FF20FF20-40020140-40020140
CPUID 80000006: 00000000-42004200-04008140-00000000
CPUID 80000007: 00000000-00000000-00000000-0000003F
CPUID 80000008: 00003028-00000000-00000001-00000000
CPUID 80000009: 00000000-00000000-00000000-00000000
CPUID 8000000A: 00000001-00000040-00000000-00000000
CPUID 8000000B: 00000000-00000000-00000000-00000000
CPUID 8000000C: 00000000-00000000-00000000-00000000
CPUID 8000000D: 00000000-00000000-00000000-00000000
CPUID 8000000E: 00000000-00000000-00000000-00000000
CPUID 8000000F: 00000000-00000000-00000000-00000000
CPUID 80000010: 00000000-00000000-00000000-00000000
CPUID 80000011: 00000000-00000000-00000000-00000000
CPUID 80000012: 00000000-00000000-00000000-00000000
CPUID 80000013: 00000000-00000000-00000000-00000000
CPUID 80000014: 00000000-00000000-00000000-00000000
CPUID 80000015: 00000000-00000000-00000000-00000000
CPUID 80000016: 00000000-00000000-00000000-00000000
CPUID 80000017: 00000000-00000000-00000000-00000000
CPUID 80000018: 00000000-00000000-00000000-00000000
CPUID 8FFFFFFF: 00000000-00000000-00000000-00000000

------[ Logical CPU #1 ]------

allcpu: Valid

CPUID 00000000: 00000001-68747541-444D4163-69746E65
CPUID 00000001: 00040F33-01020800-00002001-178BFBFF
CPUID 80000000: 80000018-68747541-444D4163-69746E65
CPUID 80000001: 00040F33-000009A7-0000001F-EBD3FBFF
CPUID 80000002: 20444D41-6C687441-74286E6F-3620296D
CPUID 80000003: 32582034-61754420-6F43206C-50206572
CPUID 80000004: 65636F72-726F7373-30343620-00002B30
CPUID 80000005: FF08FF08-FF20FF20-40020140-40020140
CPUID 80000006: 00000000-42004200-04008140-00000000
CPUID 80000007: 00000000-00000000-00000000-0000003F
CPUID 80000008: 00003028-00000000-00000001-00000000
CPUID 80000009: 00000000-00000000-00000000-00000000
CPUID 8000000A: 00000001-00000040-00000000-00000000
CPUID 8000000B: 00000000-00000000-00000000-00000000
CPUID 8000000C: 00000000-00000000-00000000-00000000
CPUID 8000000D: 00000000-00000000-00000000-00000000
CPUID 8000000E: 00000000-00000000-00000000-00000000
CPUID 8000000F: 00000000-00000000-00000000-00000000
CPUID 80000010: 00000000-00000000-00000000-00000000
CPUID 80000011: 00000000-00000000-00000000-00000000
CPUID 80000012: 00000000-00000000-00000000-00000000
CPUID 80000013: 00000000-00000000-00000000-00000000
CPUID 80000014: 00000000-00000000-00000000-00000000
CPUID 80000015: 00000000-00000000-00000000-00000000
CPUID 80000016: 00000000-00000000-00000000-00000000
CPUID 80000017: 00000000-00000000-00000000-00000000
CPUID 80000018: 00000000-00000000-00000000-00000000
CPUID 8FFFFFFF: 00000000-00000000-00000000-00000000

------[ MSR Registers ]------

MSR 0000001B: 0000-0000-FEE0-0900
MSR C0010015: 0000-0000-0200-0040
MSR C0010042: 3104-1206-0418-0218

PerformanceFrequency = 3200090000

Tjmax Temperature = 0 Celsius
