------[ Versions ]------

Program Version : AIDA64 v4.00.2742 Beta
BenchDLL Version: 4.1.591-x64

------[ CPU Info ]------

CPU Type          : QuadCore AMD A10-6800K, 4300 MHz (43 x 100)
CPU Alias         : Richland
CPU Platform      : Socket FM2
CPU Stepping      : RL-A1
Instruction Set   : x86, x86-64, MMX, SSE, SSE2, SSE3, SSSE3, SSE4.1, SSE4.2, SSE4A, XOP, AVX, FMA, FMA4, AES
CPUID Manufacturer: AuthenticAMD
CPUID CPU Name    : AMD A10-6800K APU with Radeon(tm) HD Graphics
CPUID Revision    : 00610F31h
Platform ID       : D7h  (Socket FM2)
HTT / CMP Units   : 0 / 4
Max. NUMA Node    : 0

Tjmax Temperature              : 0 Celsius
HTC Temperature Limit          : 80 Celsius
CPU TDP                        : 100.0 W
Socket / Min / Max / Target TDP: 100.0 W / 100.0 W / 100.0 W / 100.0 W

------[ Logical CPU #0 ]------

allcpu: Package 0 / Core 0 / Thread 0: Valid

CPUID 00000000: 0000000D-68747541-444D4163-69746E65 [AuthenticAMD]
CPUID 00000001: 00610F31-00040800-3E98320B-178BFBFF
CPUID 00000002: 00000000-00000000-00000000-00000000
CPUID 00000003: 00000000-00000000-00000000-00000000
CPUID 00000005: 00000040-00000040-00000003-00000000
CPUID 00000006: 00000000-00000000-00000001-00000000
CPUID 00000007: 00000000-00000008-00000000-00000000
CPUID 00000008: 00000000-00000000-00000000-00000000
CPUID 00000009: 00000000-00000000-00000000-00000000
CPUID 0000000A: 00000000-00000000-00000000-00000000
CPUID 0000000C: 00000000-00000000-00000000-00000000
CPUID 0000000D: 00000007-00000340-000003C0-40000000
CPUID 0000000D: 00000100-00000240-00000000-00000000
CPUID 80000000: 8000001E-68747541-444D4163-69746E65
CPUID 80000001: 00610F31-20000000-01EBBFFF-2FD3FBFF
CPUID 80000002: 20444D41-2D303141-30303836-5041204B [AMD A10-6800K AP]
CPUID 80000003: 69772055-52206874-6F656461-6D74286E [U with Radeon(tm]
CPUID 80000004: 44482029-61724720-63696870-00202073 [) HD Graphics  ]
CPUID 80000005: FF40FF18-FF40FF30-10040140-40020140
CPUID 80000006: 64006400-64004200-08008140-00000000
CPUID 80000007: 00000000-00000000-00000000-000007D9
CPUID 80000008: 00003030-00000000-00004003-00000000
CPUID 80000009: 00000000-00000000-00000000-00000000
CPUID 8000000A: 00000001-00010000-00000000-00001CFF
CPUID 8000000B: 00000000-00000000-00000000-00000000
CPUID 8000000C: 00000000-00000000-00000000-00000000
CPUID 8000000D: 00000000-00000000-00000000-00000000
CPUID 8000000E: 00000000-00000000-00000000-00000000
CPUID 8000000F: 00000000-00000000-00000000-00000000
CPUID 80000010: 00000000-00000000-00000000-00000000
CPUID 80000011: 00000000-00000000-00000000-00000000
CPUID 80000012: 00000000-00000000-00000000-00000000
CPUID 80000013: 00000000-00000000-00000000-00000000
CPUID 80000014: 00000000-00000000-00000000-00000000
CPUID 80000015: 00000000-00000000-00000000-00000000
CPUID 80000016: 00000000-00000000-00000000-00000000
CPUID 80000017: 00000000-00000000-00000000-00000000
CPUID 80000018: 00000000-00000000-00000000-00000000
CPUID 80000019: F040F018-64006400-00000000-00000000
CPUID 8000001A: 00000003-00000000-00000000-00000000
CPUID 8000001B: 000000FF-00000000-00000000-00000000
CPUID 8000001C: 00000000-80032013-00010200-8000000F
CPUID 8000001D: 00000121-00C0003F-0000003F-00000000
CPUID 8000001D: 00004122-0040003F-000001FF-00000000
CPUID 8000001D: 00004143-03C0003F-000007FF-00000001
CPUID 8000001E: 00000010-00000100-00000000-00000000
CPUID 8FFFFFFF: 00000000-00000000-00000000-00000000 []

L1    Data Cache:     16 KB,  4-way Associative, 64-byte Line
L1  Instr. Cache:     64 KB,  2-way Associative, 64-byte Line
L2 Unified Cache:   2048 KB, 16-way Associative, 64-byte Line

------[ Logical CPU #1 ]------

allcpu: Package 0 / Core 1 / Thread 0: Valid

CPUID 00000000: 0000000D-68747541-444D4163-69746E65 [AuthenticAMD]
CPUID 00000001: 00610F31-01040800-3E98320B-178BFBFF
CPUID 00000002: 00000000-00000000-00000000-00000000
CPUID 00000003: 00000000-00000000-00000000-00000000
CPUID 00000005: 00000040-00000040-00000003-00000000
CPUID 00000006: 00000000-00000000-00000001-00000000
CPUID 00000007: 00000000-00000008-00000000-00000000
CPUID 00000008: 00000000-00000000-00000000-00000000
CPUID 00000009: 00000000-00000000-00000000-00000000
CPUID 0000000A: 00000000-00000000-00000000-00000000
CPUID 0000000C: 00000000-00000000-00000000-00000000
CPUID 0000000D: 00000007-00000340-000003C0-40000000
CPUID 0000000D: 00000100-00000240-00000000-00000000
CPUID 80000000: 8000001E-68747541-444D4163-69746E65
CPUID 80000001: 00610F31-20000000-01EBBFFF-2FD3FBFF
CPUID 80000002: 20444D41-2D303141-30303836-5041204B [AMD A10-6800K AP]
CPUID 80000003: 69772055-52206874-6F656461-6D74286E [U with Radeon(tm]
CPUID 80000004: 44482029-61724720-63696870-00202073 [) HD Graphics  ]
CPUID 80000005: FF40FF18-FF40FF30-10040140-40020140
CPUID 80000006: 64006400-64004200-08008140-00000000
CPUID 80000007: 00000000-00000000-00000000-000007D9
CPUID 80000008: 00003030-00000000-00004003-00000000
CPUID 80000009: 00000000-00000000-00000000-00000000
CPUID 8000000A: 00000001-00010000-00000000-00001CFF
CPUID 8000000B: 00000000-00000000-00000000-00000000
CPUID 8000000C: 00000000-00000000-00000000-00000000
CPUID 8000000D: 00000000-00000000-00000000-00000000
CPUID 8000000E: 00000000-00000000-00000000-00000000
CPUID 8000000F: 00000000-00000000-00000000-00000000
CPUID 80000010: 00000000-00000000-00000000-00000000
CPUID 80000011: 00000000-00000000-00000000-00000000
CPUID 80000012: 00000000-00000000-00000000-00000000
CPUID 80000013: 00000000-00000000-00000000-00000000
CPUID 80000014: 00000000-00000000-00000000-00000000
CPUID 80000015: 00000000-00000000-00000000-00000000
CPUID 80000016: 00000000-00000000-00000000-00000000
CPUID 80000017: 00000000-00000000-00000000-00000000
CPUID 80000018: 00000000-00000000-00000000-00000000
CPUID 80000019: F040F018-64006400-00000000-00000000
CPUID 8000001A: 00000003-00000000-00000000-00000000
CPUID 8000001B: 000000FF-00000000-00000000-00000000
CPUID 8000001C: 00000000-80032013-00010200-8000000F
CPUID 8000001D: 00000121-00C0003F-0000003F-00000000
CPUID 8000001D: 00004122-0040003F-000001FF-00000000
CPUID 8000001D: 00004143-03C0003F-000007FF-00000001
CPUID 8000001E: 00000011-00000100-00000000-00000000
CPUID 8FFFFFFF: 00000000-00000000-00000000-00000000 []

L1    Data Cache:     16 KB,  4-way Associative, 64-byte Line
L1  Instr. Cache:     64 KB,  2-way Associative, 64-byte Line
L2 Unified Cache:   2048 KB, 16-way Associative, 64-byte Line

------[ Logical CPU #2 ]------

allcpu: Package 0 / Core 2 / Thread 0: Valid

CPUID 00000000: 0000000D-68747541-444D4163-69746E65 [AuthenticAMD]
CPUID 00000001: 00610F31-02040800-3E98320B-178BFBFF
CPUID 00000002: 00000000-00000000-00000000-00000000
CPUID 00000003: 00000000-00000000-00000000-00000000
CPUID 00000005: 00000040-00000040-00000003-00000000
CPUID 00000006: 00000000-00000000-00000001-00000000
CPUID 00000007: 00000000-00000008-00000000-00000000
CPUID 00000008: 00000000-00000000-00000000-00000000
CPUID 00000009: 00000000-00000000-00000000-00000000
CPUID 0000000A: 00000000-00000000-00000000-00000000
CPUID 0000000C: 00000000-00000000-00000000-00000000
CPUID 0000000D: 00000007-00000340-000003C0-40000000
CPUID 0000000D: 00000100-00000240-00000000-00000000
CPUID 80000000: 8000001E-68747541-444D4163-69746E65
CPUID 80000001: 00610F31-20000000-01EBBFFF-2FD3FBFF
CPUID 80000002: 20444D41-2D303141-30303836-5041204B [AMD A10-6800K AP]
CPUID 80000003: 69772055-52206874-6F656461-6D74286E [U with Radeon(tm]
CPUID 80000004: 44482029-61724720-63696870-00202073 [) HD Graphics  ]
CPUID 80000005: FF40FF18-FF40FF30-10040140-40020140
CPUID 80000006: 64006400-64004200-08008140-00000000
CPUID 80000007: 00000000-00000000-00000000-000007D9
CPUID 80000008: 00003030-00000000-00004003-00000000
CPUID 80000009: 00000000-00000000-00000000-00000000
CPUID 8000000A: 00000001-00010000-00000000-00001CFF
CPUID 8000000B: 00000000-00000000-00000000-00000000
CPUID 8000000C: 00000000-00000000-00000000-00000000
CPUID 8000000D: 00000000-00000000-00000000-00000000
CPUID 8000000E: 00000000-00000000-00000000-00000000
CPUID 8000000F: 00000000-00000000-00000000-00000000
CPUID 80000010: 00000000-00000000-00000000-00000000
CPUID 80000011: 00000000-00000000-00000000-00000000
CPUID 80000012: 00000000-00000000-00000000-00000000
CPUID 80000013: 00000000-00000000-00000000-00000000
CPUID 80000014: 00000000-00000000-00000000-00000000
CPUID 80000015: 00000000-00000000-00000000-00000000
CPUID 80000016: 00000000-00000000-00000000-00000000
CPUID 80000017: 00000000-00000000-00000000-00000000
CPUID 80000018: 00000000-00000000-00000000-00000000
CPUID 80000019: F040F018-64006400-00000000-00000000
CPUID 8000001A: 00000003-00000000-00000000-00000000
CPUID 8000001B: 000000FF-00000000-00000000-00000000
CPUID 8000001C: 00000000-80032013-00010200-8000000F
CPUID 8000001D: 00000121-00C0003F-0000003F-00000000
CPUID 8000001D: 00004122-0040003F-000001FF-00000000
CPUID 8000001D: 00004143-03C0003F-000007FF-00000001
CPUID 8000001E: 00000012-00000101-00000000-00000000
CPUID 8FFFFFFF: 00000000-00000000-00000000-00000000 []

L1    Data Cache:     16 KB,  4-way Associative, 64-byte Line
L1  Instr. Cache:     64 KB,  2-way Associative, 64-byte Line
L2 Unified Cache:   2048 KB, 16-way Associative, 64-byte Line

------[ Logical CPU #3 ]------

allcpu: Package 0 / Core 3 / Thread 0: Valid

CPUID 00000000: 0000000D-68747541-444D4163-69746E65 [AuthenticAMD]
CPUID 00000001: 00610F31-03040800-3E98320B-178BFBFF
CPUID 00000002: 00000000-00000000-00000000-00000000
CPUID 00000003: 00000000-00000000-00000000-00000000
CPUID 00000005: 00000040-00000040-00000003-00000000
CPUID 00000006: 00000000-00000000-00000001-00000000
CPUID 00000007: 00000000-00000008-00000000-00000000
CPUID 00000008: 00000000-00000000-00000000-00000000
CPUID 00000009: 00000000-00000000-00000000-00000000
CPUID 0000000A: 00000000-00000000-00000000-00000000
CPUID 0000000C: 00000000-00000000-00000000-00000000
CPUID 0000000D: 00000007-00000340-000003C0-40000000
CPUID 0000000D: 00000100-00000240-00000000-00000000
CPUID 80000000: 8000001E-68747541-444D4163-69746E65
CPUID 80000001: 00610F31-20000000-01EBBFFF-2FD3FBFF
CPUID 80000002: 20444D41-2D303141-30303836-5041204B [AMD A10-6800K AP]
CPUID 80000003: 69772055-52206874-6F656461-6D74286E [U with Radeon(tm]
CPUID 80000004: 44482029-61724720-63696870-00202073 [) HD Graphics  ]
CPUID 80000005: FF40FF18-FF40FF30-10040140-40020140
CPUID 80000006: 64006400-64004200-08008140-00000000
CPUID 80000007: 00000000-00000000-00000000-000007D9
CPUID 80000008: 00003030-00000000-00004003-00000000
CPUID 80000009: 00000000-00000000-00000000-00000000
CPUID 8000000A: 00000001-00010000-00000000-00001CFF
CPUID 8000000B: 00000000-00000000-00000000-00000000
CPUID 8000000C: 00000000-00000000-00000000-00000000
CPUID 8000000D: 00000000-00000000-00000000-00000000
CPUID 8000000E: 00000000-00000000-00000000-00000000
CPUID 8000000F: 00000000-00000000-00000000-00000000
CPUID 80000010: 00000000-00000000-00000000-00000000
CPUID 80000011: 00000000-00000000-00000000-00000000
CPUID 80000012: 00000000-00000000-00000000-00000000
CPUID 80000013: 00000000-00000000-00000000-00000000
CPUID 80000014: 00000000-00000000-00000000-00000000
CPUID 80000015: 00000000-00000000-00000000-00000000
CPUID 80000016: 00000000-00000000-00000000-00000000
CPUID 80000017: 00000000-00000000-00000000-00000000
CPUID 80000018: 00000000-00000000-00000000-00000000
CPUID 80000019: F040F018-64006400-00000000-00000000
CPUID 8000001A: 00000003-00000000-00000000-00000000
CPUID 8000001B: 000000FF-00000000-00000000-00000000
CPUID 8000001C: 00000000-80032013-00010200-8000000F
CPUID 8000001D: 00000121-00C0003F-0000003F-00000000
CPUID 8000001D: 00004122-0040003F-000001FF-00000000
CPUID 8000001D: 00004143-03C0003F-000007FF-00000001
CPUID 8000001E: 00000013-00000101-00000000-00000000
CPUID 8FFFFFFF: 00000000-00000000-00000000-00000000 []

L1    Data Cache:     16 KB,  4-way Associative, 64-byte Line
L1  Instr. Cache:     64 KB,  2-way Associative, 64-byte Line
L2 Unified Cache:   2048 KB, 16-way Associative, 64-byte Line

------[ All CPUs ]------

CPU   0: APICID   0 / Package 0 / Core  0 / Thread 0: Valid
CPU   1: APICID   1 / Package 0 / Core  1 / Thread 0: Valid
CPU   2: APICID   2 / Package 0 / Core  2 / Thread 0: Valid
CPU   3: APICID   3 / Package 0 / Core  3 / Thread 0: Valid

------[ MSR Registers ]------

CPU Clock (Normal): 4300 MHz
CPU Clock (TSC): 4100 MHz
CPU Multiplier: 43.0x
CPB PStates: 3
MSR 0000001B: 0000-0000-FEE0-0900
MSR 0000008B: 0000-0000-0600-1119
MSR 000000E7: 0000-0000-04BA-78E4
MSR 000000E8: 0000-0000-04F6-7539
MSR C0010004: 0000-0000-0000-0000
MSR C0010005: 0000-0000-0000-0000
MSR C0010006: 0000-0000-0000-0000
MSR C0010007: 0000-0000-0000-0000
MSR C0010015: 0000-0000-0900-1011
MSR C001001F: 0040-4000-0081-0000
MSR C0010055: 0000-0000-0000-0000
MSR C0010058: 0000-0000-E000-0021
MSR C0010061: 0000-0000-0000-0040
MSR C0010062: 0000-0000-0000-0000
MSR C0010063: 0000-0000-0000-0000
MSR C0010064: 8000-01B9-0000-241C [44.00x] [1.4375 V] [18.50 A] [PState Pb0]
MSR C0010065: 8000-01D5-0000-301B [43.00x] [1.4000 V] [21.30 A] [PState Pb1]
MSR C0010066: 8000-01C2-0000-401A [42.00x] [1.3500 V] [19.40 A] [PState Pb2]
MSR C0010067: 8000-019D-0000-4C19 [41.00x] [1.3125 V] [15.70 A] [PState P0]
MSR C0010068: 8000-0181-0000-6816 [38.00x] [1.2250 V] [12.90 A] [PState P1]
MSR C0010069: 8000-015C-0000-8C10 [32.00x] [1.1125 V] [ 9.20 A] [PState P2]
MSR C001006A: 8000-0140-0000-B00A [26.00x] [1.0000 V] [ 6.40 A] [PState P3]
MSR C001006B: 8000-012C-0040-D004 [20.00x] [0.9000 V] [ 4.40 A] [PState P4]
MSR C0010070: 0000-0000-3E00-241C
MSR C0010071: 0000-0006-3400-241C [44.00x] [1.4375V]
MSR C0010071: 0100-0006-3407-3004 [20.00x] [0.6000V]
MSR C0010071: 0100-0006-3407-3004 [20.00x] [0.6000V]
MSR C0010071: 0100-0006-3407-3004 [20.00x] [0.6000V]
MSR C0010071: 0100-0006-3407-3004 [20.00x] [0.6000V]
MSR C0010140: 0000-0000-0000-0005
MSR C0010141: 0000-0000-0000-0010
MSR C0011023: 8100-4000-0078-0220

PerformanceFrequency = 4003964

CPU Clock M.Method = 6  (APIC K10)
PM Timer Address   = 2056  (0808h)

APIC Clock = 100.00 MHz
APIC Clock = 100.00 MHz
APIC Clock = 100.00 MHz
APIC Clock = 100.00 MHz
APIC Clock = 100.00 MHz
