------[ Versions ]------

Program Version : AIDA64 v5.75.3940 Beta
BenchDLL Version: 4.2.689-x64

------[ CPU Info ]------

CPU Type          : QuadCore AMD A12-9800, 4000 MHz (40 x 100)
CPU Alias         : Bristol Ridge
CPU Platform      : Socket AM4
CPU Stepping      : BR-A1
Instruction Set   : x86, x86-64, MMX, SSE, SSE2, SSE3, SSSE3, SSE4.1, SSE4.2, SSE4A, XOP, AVX, AVX2, FMA, FMA4, AES
CPUID Manufacturer: AuthenticAMD
CPUID CPU Name    : AMD A12-9800 RADEON R7, 12 COMPUTE CORES 4C+8G
CPUID Revision    : 00660F51h
Platform ID       : D1h  (Socket AM4)
HTT / CMP Units   : 0 / 4
Max. NUMA Node    : 0

Tjmax Temperature    : 0 Celsius
HTC Temperature Limit: 100 Celsius
CPU TDP              : 65.0 W

------[ Logical CPU #0 ]------

allcpu: Package 0 / Core 0 / Thread 0: Valid

CPUID 00000000: 0000000D-68747541-444D4163-69746E65 [AuthenticAMD]
CPUID 00000001: 00660F51-00040800-7ED8320B-178BFBFF
CPUID 00000002: 00000000-00000000-00000000-00000000
CPUID 00000003: 00000000-00000000-00000000-00000000
CPUID 00000005: 00000040-00000040-00000003-00000000
CPUID 00000006: 00000004-00000000-00000001-00000000
CPUID 00000007: 00000000-000001A9-00000000-00000000
CPUID 00000008: 00000000-00000000-00000000-00000000
CPUID 00000009: 00000000-00000000-00000000-00000000
CPUID 0000000A: 00000000-00000000-00000000-00000000
CPUID 0000000C: 00000000-00000000-00000000-00000000
CPUID 0000000D: 00000007-00000340-000003C0-40000000 [SL 00]
CPUID 0000000D: 00000001-00000000-00000000-00000000 [SL 01]
CPUID 0000000D: 00000100-00000240-00000000-00000000 [SL 02]
CPUID 0000000D: 00000080-00000340-00000000-00000000 [SL 3E]
CPUID 80000000: 8000001E-68747541-444D4163-69746E65 [AuthenticAMD]
CPUID 80000001: 00660F51-20000000-2FABBFFF-2FD3FBFF
CPUID 80000002: 20444D41-2D323141-30303839-44415220 [AMD A12-9800 RAD]
CPUID 80000003: 204E4F45-202C3752-43203231-55504D4F [EON R7, 12 COMPU]
CPUID 80000004: 43204554-5345524F-2B433420-00204738 [TE CORES 4C+8G ]
CPUID 80000005: FF40FF18-FF40FF30-20080140-60030140
CPUID 80000006: 64006400-64004200-04008140-00000000
CPUID 80000007: 00000000-00000005-00000400-000037D9
CPUID 80000008: 00003030-00000000-00004003-00000000
CPUID 80000009: 00000000-00000000-00000000-00000000
CPUID 8000000A: 00000001-00008000-00000000-0001BCFF
CPUID 8000000B: 00000000-00000000-00000000-00000000
CPUID 8000000C: 00000000-00000000-00000000-00000000
CPUID 8000000D: 00000000-00000000-00000000-00000000
CPUID 8000000E: 00000000-00000000-00000000-00000000
CPUID 8000000F: 00000000-00000000-00000000-00000000
CPUID 80000010: 00000000-00000000-00000000-00000000
CPUID 80000011: 00000000-00000000-00000000-00000000
CPUID 80000012: 00000000-00000000-00000000-00000000
CPUID 80000013: 00000000-00000000-00000000-00000000
CPUID 80000014: 00000000-00000000-00000000-00000000
CPUID 80000015: 00000000-00000000-00000000-00000000
CPUID 80000016: 00000000-00000000-00000000-00000000
CPUID 80000017: 00000000-00000000-00000000-00000000
CPUID 80000018: 00000000-00000000-00000000-00000000
CPUID 80000019: F040F018-64006400-00000000-00000000
CPUID 8000001A: 00000003-00000000-00000000-00000000
CPUID 8000001B: 000007FF-00000000-00000000-00000000
CPUID 8000001C: 00000000-80032013-00010200-E000000F
CPUID 8000001E: 00000010-00000100-00000000-00000000
CPUID 8FFFFFFF: 00000000-00000000-00000000-00000000

------[ Logical CPU #1 ]------

allcpu: Package 0 / Core 1 / Thread 0: Valid

CPUID 00000000: 0000000D-68747541-444D4163-69746E65 [AuthenticAMD]
CPUID 00000001: 00660F51-01040800-7ED8320B-178BFBFF
CPUID 00000002: 00000000-00000000-00000000-00000000
CPUID 00000003: 00000000-00000000-00000000-00000000
CPUID 00000005: 00000040-00000040-00000003-00000000
CPUID 00000006: 00000004-00000000-00000001-00000000
CPUID 00000007: 00000000-000001A9-00000000-00000000
CPUID 00000008: 00000000-00000000-00000000-00000000
CPUID 00000009: 00000000-00000000-00000000-00000000
CPUID 0000000A: 00000000-00000000-00000000-00000000
CPUID 0000000C: 00000000-00000000-00000000-00000000
CPUID 0000000D: 00000007-00000340-000003C0-40000000 [SL 00]
CPUID 0000000D: 00000001-00000000-00000000-00000000 [SL 01]
CPUID 0000000D: 00000100-00000240-00000000-00000000 [SL 02]
CPUID 0000000D: 00000080-00000340-00000000-00000000 [SL 3E]
CPUID 80000000: 8000001E-68747541-444D4163-69746E65 [AuthenticAMD]
CPUID 80000001: 00660F51-20000000-2FABBFFF-2FD3FBFF
CPUID 80000002: 20444D41-2D323141-30303839-44415220 [AMD A12-9800 RAD]
CPUID 80000003: 204E4F45-202C3752-43203231-55504D4F [EON R7, 12 COMPU]
CPUID 80000004: 43204554-5345524F-2B433420-00204738 [TE CORES 4C+8G ]
CPUID 80000005: FF40FF18-FF40FF30-20080140-60030140
CPUID 80000006: 64006400-64004200-04008140-00000000
CPUID 80000007: 00000000-00000005-00000400-000037D9
CPUID 80000008: 00003030-00000000-00004003-00000000
CPUID 80000009: 00000000-00000000-00000000-00000000
CPUID 8000000A: 00000001-00008000-00000000-0001BCFF
CPUID 8000000B: 00000000-00000000-00000000-00000000
CPUID 8000000C: 00000000-00000000-00000000-00000000
CPUID 8000000D: 00000000-00000000-00000000-00000000
CPUID 8000000E: 00000000-00000000-00000000-00000000
CPUID 8000000F: 00000000-00000000-00000000-00000000
CPUID 80000010: 00000000-00000000-00000000-00000000
CPUID 80000011: 00000000-00000000-00000000-00000000
CPUID 80000012: 00000000-00000000-00000000-00000000
CPUID 80000013: 00000000-00000000-00000000-00000000
CPUID 80000014: 00000000-00000000-00000000-00000000
CPUID 80000015: 00000000-00000000-00000000-00000000
CPUID 80000016: 00000000-00000000-00000000-00000000
CPUID 80000017: 00000000-00000000-00000000-00000000
CPUID 80000018: 00000000-00000000-00000000-00000000
CPUID 80000019: F040F018-64006400-00000000-00000000
CPUID 8000001A: 00000003-00000000-00000000-00000000
CPUID 8000001B: 000007FF-00000000-00000000-00000000
CPUID 8000001C: 00000000-80032013-00010200-E000000F
CPUID 8000001E: 00000011-00000100-00000000-00000000
CPUID 8FFFFFFF: 00000000-00000000-00000000-00000000

------[ Logical CPU #2 ]------

allcpu: Package 0 / Core 2 / Thread 0: Valid

CPUID 00000000: 0000000D-68747541-444D4163-69746E65 [AuthenticAMD]
CPUID 00000001: 00660F51-02040800-7ED8320B-178BFBFF
CPUID 00000002: 00000000-00000000-00000000-00000000
CPUID 00000003: 00000000-00000000-00000000-00000000
CPUID 00000005: 00000040-00000040-00000003-00000000
CPUID 00000006: 00000004-00000000-00000001-00000000
CPUID 00000007: 00000000-000001A9-00000000-00000000
CPUID 00000008: 00000000-00000000-00000000-00000000
CPUID 00000009: 00000000-00000000-00000000-00000000
CPUID 0000000A: 00000000-00000000-00000000-00000000
CPUID 0000000C: 00000000-00000000-00000000-00000000
CPUID 0000000D: 00000007-00000340-000003C0-40000000 [SL 00]
CPUID 0000000D: 00000001-00000000-00000000-00000000 [SL 01]
CPUID 0000000D: 00000100-00000240-00000000-00000000 [SL 02]
CPUID 0000000D: 00000080-00000340-00000000-00000000 [SL 3E]
CPUID 80000000: 8000001E-68747541-444D4163-69746E65 [AuthenticAMD]
CPUID 80000001: 00660F51-20000000-2FABBFFF-2FD3FBFF
CPUID 80000002: 20444D41-2D323141-30303839-44415220 [AMD A12-9800 RAD]
CPUID 80000003: 204E4F45-202C3752-43203231-55504D4F [EON R7, 12 COMPU]
CPUID 80000004: 43204554-5345524F-2B433420-00204738 [TE CORES 4C+8G ]
CPUID 80000005: FF40FF18-FF40FF30-20080140-60030140
CPUID 80000006: 64006400-64004200-04008140-00000000
CPUID 80000007: 00000000-00000005-00000400-000037D9
CPUID 80000008: 00003030-00000000-00004003-00000000
CPUID 80000009: 00000000-00000000-00000000-00000000
CPUID 8000000A: 00000001-00008000-00000000-0001BCFF
CPUID 8000000B: 00000000-00000000-00000000-00000000
CPUID 8000000C: 00000000-00000000-00000000-00000000
CPUID 8000000D: 00000000-00000000-00000000-00000000
CPUID 8000000E: 00000000-00000000-00000000-00000000
CPUID 8000000F: 00000000-00000000-00000000-00000000
CPUID 80000010: 00000000-00000000-00000000-00000000
CPUID 80000011: 00000000-00000000-00000000-00000000
CPUID 80000012: 00000000-00000000-00000000-00000000
CPUID 80000013: 00000000-00000000-00000000-00000000
CPUID 80000014: 00000000-00000000-00000000-00000000
CPUID 80000015: 00000000-00000000-00000000-00000000
CPUID 80000016: 00000000-00000000-00000000-00000000
CPUID 80000017: 00000000-00000000-00000000-00000000
CPUID 80000018: 00000000-00000000-00000000-00000000
CPUID 80000019: F040F018-64006400-00000000-00000000
CPUID 8000001A: 00000003-00000000-00000000-00000000
CPUID 8000001B: 000007FF-00000000-00000000-00000000
CPUID 8000001C: 00000000-80032013-00010200-E000000F
CPUID 8000001E: 00000012-00000101-00000000-00000000
CPUID 8FFFFFFF: 00000000-00000000-00000000-00000000

------[ Logical CPU #3 ]------

allcpu: Package 0 / Core 3 / Thread 0: Valid

CPUID 00000000: 0000000D-68747541-444D4163-69746E65 [AuthenticAMD]
CPUID 00000001: 00660F51-03040800-7ED8320B-178BFBFF
CPUID 00000002: 00000000-00000000-00000000-00000000
CPUID 00000003: 00000000-00000000-00000000-00000000
CPUID 00000005: 00000040-00000040-00000003-00000000
CPUID 00000006: 00000004-00000000-00000001-00000000
CPUID 00000007: 00000000-000001A9-00000000-00000000
CPUID 00000008: 00000000-00000000-00000000-00000000
CPUID 00000009: 00000000-00000000-00000000-00000000
CPUID 0000000A: 00000000-00000000-00000000-00000000
CPUID 0000000C: 00000000-00000000-00000000-00000000
CPUID 0000000D: 00000007-00000340-000003C0-40000000 [SL 00]
CPUID 0000000D: 00000001-00000000-00000000-00000000 [SL 01]
CPUID 0000000D: 00000100-00000240-00000000-00000000 [SL 02]
CPUID 0000000D: 00000080-00000340-00000000-00000000 [SL 3E]
CPUID 80000000: 8000001E-68747541-444D4163-69746E65 [AuthenticAMD]
CPUID 80000001: 00660F51-20000000-2FABBFFF-2FD3FBFF
CPUID 80000002: 20444D41-2D323141-30303839-44415220 [AMD A12-9800 RAD]
CPUID 80000003: 204E4F45-202C3752-43203231-55504D4F [EON R7, 12 COMPU]
CPUID 80000004: 43204554-5345524F-2B433420-00204738 [TE CORES 4C+8G ]
CPUID 80000005: FF40FF18-FF40FF30-20080140-60030140
CPUID 80000006: 64006400-64004200-04008140-00000000
CPUID 80000007: 00000000-00000005-00000400-000037D9
CPUID 80000008: 00003030-00000000-00004003-00000000
CPUID 80000009: 00000000-00000000-00000000-00000000
CPUID 8000000A: 00000001-00008000-00000000-0001BCFF
CPUID 8000000B: 00000000-00000000-00000000-00000000
CPUID 8000000C: 00000000-00000000-00000000-00000000
CPUID 8000000D: 00000000-00000000-00000000-00000000
CPUID 8000000E: 00000000-00000000-00000000-00000000
CPUID 8000000F: 00000000-00000000-00000000-00000000
CPUID 80000010: 00000000-00000000-00000000-00000000
CPUID 80000011: 00000000-00000000-00000000-00000000
CPUID 80000012: 00000000-00000000-00000000-00000000
CPUID 80000013: 00000000-00000000-00000000-00000000
CPUID 80000014: 00000000-00000000-00000000-00000000
CPUID 80000015: 00000000-00000000-00000000-00000000
CPUID 80000016: 00000000-00000000-00000000-00000000
CPUID 80000017: 00000000-00000000-00000000-00000000
CPUID 80000018: 00000000-00000000-00000000-00000000
CPUID 80000019: F040F018-64006400-00000000-00000000
CPUID 8000001A: 00000003-00000000-00000000-00000000
CPUID 8000001B: 000007FF-00000000-00000000-00000000
CPUID 8000001C: 00000000-80032013-00010200-E000000F
CPUID 8000001E: 00000013-00000101-00000000-00000000
CPUID 8FFFFFFF: 00000000-00000000-00000000-00000000

------[ All CPUs ]------

CPU   0: APICID   0 / Package 0 / Core  0 / Thread 0: Valid
CPU   1: APICID   1 / Package 0 / Core  1 / Thread 0: Valid
CPU   2: APICID   2 / Package 0 / Core  2 / Thread 0: Valid
CPU   3: APICID   3 / Package 0 / Core  3 / Thread 0: Valid

------[ MSR Registers ]------

CPU Clock (Normal): 3993 MHz
CPU Clock (TSC): 3793 MHz
CPU Multiplier: 40.0x
CPB PStates: 2
MSR 0000001B: 0000-0000-FEE0-0900
MSR 0000008B: 0000-0000-0600-6118
MSR 000000E7: 0000-0000-0467-BDE9 [S200]
MSR 000000E7: 0000-0000-0003-7986 [S200]
MSR 000000E7: 0000-0000-0003-4229
MSR 000000E8: 0000-0000-0003-F28D [S200]
MSR 000000E8: 0000-0000-0003-705A [S200]
MSR 000000E8: 0000-0000-0006-20B7
MSR C0010004: 0000-0000-0000-0000
MSR C0010005: 0000-0000-0000-0000
MSR C0010006: 0000-0000-0000-0000
MSR C0010007: 0000-0000-0000-0000
MSR C0010015: 0000-0000-1900-1011
MSR C001001F: 0258-4000-0885-0000
MSR C0010055: 0000-0000-0000-0000
MSR C0010058: 0000-0000-F800-0019
MSR C0010061: 0000-0000-0000-0050
MSR C0010062: 0000-0000-0000-0000
MSR C0010063: 0000-0000-0000-0000
MSR C0010064: 8000-0022-0000-181A [42.00x] [1.4750 V] [34.00 A] [PState Pb0]
MSR C0010065: 8000-01EB-0000-1A18 [40.00x] [1.4688 V] [23.50 A] [PState Pb1]
MSR C0010066: 8000-01A2-0000-3416 [38.00x] [1.3875 V] [16.20 A] [PState P0]
MSR C0010067: 8000-019C-0000-4C13 [35.00x] [1.3125 V] [15.60 A] [PState P1]
MSR C0010068: 8000-0178-0000-6E0F [31.00x] [1.2063 V] [12.00 A] [PState P2]
MSR C0010069: 8000-0152-0000-9609 [25.00x] [1.0813 V] [ 8.20 A] [PState P3]
MSR C001006A: 8000-0138-0000-B803 [19.00x] [0.9750 V] [ 5.60 A] [PState P4]
MSR C001006B: 8000-0126-0040-DA4C [14.00x] [0.8688 V] [ 3.80 A] [PState P5]
MSR C0010070: 0000-0000-3F00-181A
MSR C0010071: 0180-0006-3F41-2A18 [40.00x] [0.6188V]
MSR C0010071: 0180-0006-5F41-2A18 [40.00x] [0.6188V]
MSR C0010071: 0180-0006-5F41-2A18 [40.00x] [0.6188V]
MSR C0010071: 0280-0006-5F42-3416 [38.00x] [1.3875V]
MSR C0010071: 0280-0006-5F42-3416 [38.00x] [1.3875V]
MSR C0010140: 0000-0000-0000-0004
MSR C0010141: 0000-0000-0000-0000
MSR C0011023: 810A-4000-0078-3220

PerformanceFrequency = 3703986

CPU Clock M.Method = 6  (APIC K10)
PM Timer Address   = 2056  (0808h)

APIC Clock = 99.81 MHz  (AT = 52300 / TT = 15005 / try = 1 / SKL = 0.00 MHz)
APIC Clock = 99.81 MHz  (AT = 52295 / TT = 15004 / try = 1 / SKL = 0.00 MHz)
APIC Clock = 99.81 MHz  (AT = 52296 / TT = 15004 / try = 1 / SKL = 0.00 MHz)
APIC Clock = 99.81 MHz  (AT = 52306 / TT = 15007 / try = 1 / SKL = 0.00 MHz)
APIC Clock = 99.81 MHz  (AT = 52301 / TT = 15005 / try = 1 / SKL = 0.00 MHz)
