------[ Versions ]------

Program Version : EVEREST v5.30.1993 Beta
BenchDLL Version: 2.4.273.0

------[ CPU Info ]------

CPU Type           : AMD Sempron 140, 2700 MHz (13.5 x 200)
CPU Alias          : Sargas
CPU Platform       : Socket AM3
CPU Stepping       : DA-C2
Instruction Set    : x86, x86-64, MMX, 3DNow!, SSE, SSE2, SSE3, SSE4A
CPUID Manufacturer : AuthenticAMD
CPUID CPU Name     : AMD Sempron(tm) 140 Processor
CPUID Revision     : 00100F62h
AMD K10 Brand ID   : 128Ah  (Sempron 140)
Platform ID        : D7h  (Socket AM3)

------[ Logical CPU #0 ]------

allcpu: Package 0 / Core 0 / Thread 0: Valid

CPUID 00000000: 00000005-68747541-444D4163-69746E65
CPUID 00000001: 00100F62-00010800-00802009-078BFBFF
CPUID 00000002: 00000000-00000000-00000000-00000000
CPUID 00000003: 00000000-00000000-00000000-00000000
CPUID 00000005: 00000040-00000040-00000003-00000000
CPUID 80000000: 8000001B-68747541-444D4163-69746E65
CPUID 80000001: 00100F62-1000128A-000037FD-EFD3FBFF
CPUID 80000002: 20444D41-706D6553-286E6F72-20296D74
CPUID 80000003: 20303431-636F7250-6F737365-00000072
CPUID 80000004: 00000000-00000000-00000000-00000000
CPUID 80000005: FF30FF10-FF30FF20-40020140-40020140
CPUID 80000006: 20800000-42004200-04008140-00000000
CPUID 80000007: 00000000-00000000-00000000-000001F9
CPUID 80000008: 00003030-00000000-00002000-00000000
CPUID 80000009: 00000000-00000000-00000000-00000000
CPUID 8000000A: 00000001-00000040-00000000-0000000F
CPUID 8000000B: 00000000-00000000-00000000-00000000
CPUID 8000000C: 00000000-00000000-00000000-00000000
CPUID 8000000D: 00000000-00000000-00000000-00000000
CPUID 8000000E: 00000000-00000000-00000000-00000000
CPUID 8000000F: 00000000-00000000-00000000-00000000
CPUID 80000010: 00000000-00000000-00000000-00000000
CPUID 80000011: 00000000-00000000-00000000-00000000
CPUID 80000012: 00000000-00000000-00000000-00000000
CPUID 80000013: 00000000-00000000-00000000-00000000
CPUID 80000014: 00000000-00000000-00000000-00000000
CPUID 80000015: 00000000-00000000-00000000-00000000
CPUID 80000016: 00000000-00000000-00000000-00000000
CPUID 80000017: 00000000-00000000-00000000-00000000
CPUID 80000018: 00000000-00000000-00000000-00000000
CPUID 80000019: F0300000-60100000-00000000-00000000
CPUID 8000001A: 00000003-00000000-00000000-00000000
CPUID 8000001B: 0000001F-00000000-00000000-00000000
CPUID 8FFFFFFF: 00000000-00000000-00000000-00000000

------[ All CPUs ]------

CPU   0: APICID   0 / Package 0 / Core  0 / Thread 0: Valid

------[ MSR Registers ]------

CPU Clock (Normal): 2706 MHz
CPU Clock (TSC): 2706 MHz
CPU Multiplier: 13.5x
MSR 0000001B: 0000-0000-FEE0-0900
MSR C0010015: 0000-0000-0100-0010
MSR C001001F: 4258-4000-0000-0008
MSR C0010055: 0000-0000-0000-0000
MSR C0010058: 0000-0000-E000-0001
MSR C0010061: 0000-0000-0000-0030
MSR C0010062: 0000-0000-0000-0000
MSR C0010063: 0000-0000-0000-0000
MSR C0010064: 8000-001E-3C00-200B [13.50x]
MSR C0010065: 8000-01F7-3C00-3003 [9.50x]
MSR C0010066: 8000-01EB-3C00-404E [7.50x]
MSR C0010067: 8000-0187-3C00-4C40 [4.00x]
MSR C0010068: 0000-0000-5000-0000
MSR C0010071: 30B6-0083-3C00-200B [13.50x]
MSR C0010140: 0000-0000-0000-0002
MSR C0010141: 0000-0000-0000-0000
MSR C0011023: 0000-0000-1020-0020

PerformanceFrequency = 3579545

Tjmax Temperature = 0 Celsius
