------[ Logical CPU #0 ]------

allcpu: Package 0 / Core 0 / Thread 0: Valid

CPUID 00000000: 0000000D-68747541-444D4163-69746E65 [AuthenticAMD]
CPUID 00000001: 00660F01-00040800-7ED8320B-178BFBFF
CPUID 00000002: 00000000-00000000-00000000-00000000
CPUID 00000003: 00000000-00000000-00000000-00000000
CPUID 00000005: 00000040-00000040-00000003-00000000
CPUID 00000006: 00000004-00000000-00000001-00000000
CPUID 00000007: 00000000-000001A9-00000000-00000000
CPUID 00000008: 00000000-00000000-00000000-00000000
CPUID 00000009: 00000000-00000000-00000000-00000000
CPUID 0000000A: 00000000-00000000-00000000-00000000
CPUID 0000000C: 00000000-00000000-00000000-00000000
CPUID 0000000D: 00000007-00000340-000003C0-40000000 [SL 00]
CPUID 0000000D: 00000001-00000000-00000000-00000000 [SL 01]
CPUID 0000000D: 00000100-00000240-00000000-00000000 [SL 02]
CPUID 0000000D: 00000080-00000340-00000000-00000000 [SL 3E]
CPUID 80000000: 8000001E-68747541-444D4163-69746E65 [AuthenticAMD]
CPUID 80000001: 00660F01-00000000-2FEBBFFF-2FD3FBFF
CPUID 80000002: 20444D41-382D5846-50303038-64615220 [AMD FX-8800P Rad]
CPUID 80000003: 206E6F65-202C3752-43203231-75706D6F [eon R7, 12 Compu]
CPUID 80000004: 43206574-7365726F-2B433420-00204738 [te Cores 4C+8G ]
CPUID 80000005: FF40FF18-FF40FF30-20080140-60030140
CPUID 80000006: 64006400-64004200-04008140-00000000
CPUID 80000007: 00000000-00000005-00000400-000037D9
CPUID 80000008: 00003030-00000000-00004003-00000000
CPUID 80000009: 00000000-00000000-00000000-00000000
CPUID 8000000A: 00000001-00008000-00000000-0001BCFF
CPUID 8000000B: 00000000-00000000-00000000-00000000
CPUID 8000000C: 00000000-00000000-00000000-00000000
CPUID 8000000D: 00000000-00000000-00000000-00000000
CPUID 8000000E: 00000000-00000000-00000000-00000000
CPUID 8000000F: 00000000-00000000-00000000-00000000
CPUID 80000010: 00000000-00000000-00000000-00000000
CPUID 80000011: 00000000-00000000-00000000-00000000
CPUID 80000012: 00000000-00000000-00000000-00000000
CPUID 80000013: 00000000-00000000-00000000-00000000
CPUID 80000014: 00000000-00000000-00000000-00000000
CPUID 80000015: 00000000-00000000-00000000-00000000
CPUID 80000016: 00000000-00000000-00000000-00000000
CPUID 80000017: 00000000-00000000-00000000-00000000
CPUID 80000018: 00000000-00000000-00000000-00000000
CPUID 80000019: F040F018-64006400-00000000-00000000
CPUID 8000001A: 00000003-00000000-00000000-00000000
CPUID 8000001B: 000007FF-00000000-00000000-00000000
CPUID 8000001C: 00000000-80032013-00010200-E000000F
CPUID 8000001D: 00000121-01C0003F-0000003F-00000000 [SL 00]
CPUID 8000001D: 00004122-0080003F-000001FF-00000000 [SL 01]
CPUID 8000001D: 00004143-03C0003F-000003FF-00000001 [SL 02]
CPUID 8000001E: 00000010-00000100-00000000-00000000
CPUID 8FFFFFFF: 00000000-00000000-00000000-00000000

L1    Data Cache:    32 KB,  8-way Associative, 64-byte Line
L1  Instr. Cache:    96 KB,  3-way Associative, 64-byte Line
L2 Unified Cache:     1 MB, 16-way Associative, 64-byte Line

------[ Logical CPU #1 ]------

allcpu: Package 0 / Core 1 / Thread 0: Valid

CPUID 00000000: 0000000D-68747541-444D4163-69746E65 [AuthenticAMD]
CPUID 00000001: 00660F01-01040800-7ED8320B-178BFBFF
CPUID 00000002: 00000000-00000000-00000000-00000000
CPUID 00000003: 00000000-00000000-00000000-00000000
CPUID 00000005: 00000040-00000040-00000003-00000000
CPUID 00000006: 00000004-00000000-00000001-00000000
CPUID 00000007: 00000000-000001A9-00000000-00000000
CPUID 00000008: 00000000-00000000-00000000-00000000
CPUID 00000009: 00000000-00000000-00000000-00000000
CPUID 0000000A: 00000000-00000000-00000000-00000000
CPUID 0000000C: 00000000-00000000-00000000-00000000
CPUID 0000000D: 00000007-00000340-000003C0-40000000 [SL 00]
CPUID 0000000D: 00000001-00000000-00000000-00000000 [SL 01]
CPUID 0000000D: 00000100-00000240-00000000-00000000 [SL 02]
CPUID 0000000D: 00000080-00000340-00000000-00000000 [SL 3E]
CPUID 80000000: 8000001E-68747541-444D4163-69746E65 [AuthenticAMD]
CPUID 80000001: 00660F01-00000000-2FEBBFFF-2FD3FBFF
CPUID 80000002: 20444D41-382D5846-50303038-64615220 [AMD FX-8800P Rad]
CPUID 80000003: 206E6F65-202C3752-43203231-75706D6F [eon R7, 12 Compu]
CPUID 80000004: 43206574-7365726F-2B433420-00204738 [te Cores 4C+8G ]
CPUID 80000005: FF40FF18-FF40FF30-20080140-60030140
CPUID 80000006: 64006400-64004200-04008140-00000000
CPUID 80000007: 00000000-00000005-00000400-000037D9
CPUID 80000008: 00003030-00000000-00004003-00000000
CPUID 80000009: 00000000-00000000-00000000-00000000
CPUID 8000000A: 00000001-00008000-00000000-0001BCFF
CPUID 8000000B: 00000000-00000000-00000000-00000000
CPUID 8000000C: 00000000-00000000-00000000-00000000
CPUID 8000000D: 00000000-00000000-00000000-00000000
CPUID 8000000E: 00000000-00000000-00000000-00000000
CPUID 8000000F: 00000000-00000000-00000000-00000000
CPUID 80000010: 00000000-00000000-00000000-00000000
CPUID 80000011: 00000000-00000000-00000000-00000000
CPUID 80000012: 00000000-00000000-00000000-00000000
CPUID 80000013: 00000000-00000000-00000000-00000000
CPUID 80000014: 00000000-00000000-00000000-00000000
CPUID 80000015: 00000000-00000000-00000000-00000000
CPUID 80000016: 00000000-00000000-00000000-00000000
CPUID 80000017: 00000000-00000000-00000000-00000000
CPUID 80000018: 00000000-00000000-00000000-00000000
CPUID 80000019: F040F018-64006400-00000000-00000000
CPUID 8000001A: 00000003-00000000-00000000-00000000
CPUID 8000001B: 000007FF-00000000-00000000-00000000
CPUID 8000001C: 00000000-80032013-00010200-E000000F
CPUID 8000001D: 00000121-01C0003F-0000003F-00000000 [SL 00]
CPUID 8000001D: 00004122-0080003F-000001FF-00000000 [SL 01]
CPUID 8000001D: 00004143-03C0003F-000003FF-00000001 [SL 02]
CPUID 8000001E: 00000011-00000100-00000000-00000000
CPUID 8FFFFFFF: 00000000-00000000-00000000-00000000

L1    Data Cache:    32 KB,  8-way Associative, 64-byte Line
L1  Instr. Cache:    96 KB,  3-way Associative, 64-byte Line
L2 Unified Cache:     1 MB, 16-way Associative, 64-byte Line

------[ Logical CPU #2 ]------

allcpu: Package 0 / Core 2 / Thread 0: Valid

CPUID 00000000: 0000000D-68747541-444D4163-69746E65 [AuthenticAMD]
CPUID 00000001: 00660F01-02040800-7ED8320B-178BFBFF
CPUID 00000002: 00000000-00000000-00000000-00000000
CPUID 00000003: 00000000-00000000-00000000-00000000
CPUID 00000005: 00000040-00000040-00000003-00000000
CPUID 00000006: 00000004-00000000-00000001-00000000
CPUID 00000007: 00000000-000001A9-00000000-00000000
CPUID 00000008: 00000000-00000000-00000000-00000000
CPUID 00000009: 00000000-00000000-00000000-00000000
CPUID 0000000A: 00000000-00000000-00000000-00000000
CPUID 0000000C: 00000000-00000000-00000000-00000000
CPUID 0000000D: 00000007-00000340-000003C0-40000000 [SL 00]
CPUID 0000000D: 00000001-00000000-00000000-00000000 [SL 01]
CPUID 0000000D: 00000100-00000240-00000000-00000000 [SL 02]
CPUID 0000000D: 00000080-00000340-00000000-00000000 [SL 3E]
CPUID 80000000: 8000001E-68747541-444D4163-69746E65 [AuthenticAMD]
CPUID 80000001: 00660F01-00000000-2FEBBFFF-2FD3FBFF
CPUID 80000002: 20444D41-382D5846-50303038-64615220 [AMD FX-8800P Rad]
CPUID 80000003: 206E6F65-202C3752-43203231-75706D6F [eon R7, 12 Compu]
CPUID 80000004: 43206574-7365726F-2B433420-00204738 [te Cores 4C+8G ]
CPUID 80000005: FF40FF18-FF40FF30-20080140-60030140
CPUID 80000006: 64006400-64004200-04008140-00000000
CPUID 80000007: 00000000-00000005-00000400-000037D9
CPUID 80000008: 00003030-00000000-00004003-00000000
CPUID 80000009: 00000000-00000000-00000000-00000000
CPUID 8000000A: 00000001-00008000-00000000-0001BCFF
CPUID 8000000B: 00000000-00000000-00000000-00000000
CPUID 8000000C: 00000000-00000000-00000000-00000000
CPUID 8000000D: 00000000-00000000-00000000-00000000
CPUID 8000000E: 00000000-00000000-00000000-00000000
CPUID 8000000F: 00000000-00000000-00000000-00000000
CPUID 80000010: 00000000-00000000-00000000-00000000
CPUID 80000011: 00000000-00000000-00000000-00000000
CPUID 80000012: 00000000-00000000-00000000-00000000
CPUID 80000013: 00000000-00000000-00000000-00000000
CPUID 80000014: 00000000-00000000-00000000-00000000
CPUID 80000015: 00000000-00000000-00000000-00000000
CPUID 80000016: 00000000-00000000-00000000-00000000
CPUID 80000017: 00000000-00000000-00000000-00000000
CPUID 80000018: 00000000-00000000-00000000-00000000
CPUID 80000019: F040F018-64006400-00000000-00000000
CPUID 8000001A: 00000003-00000000-00000000-00000000
CPUID 8000001B: 000007FF-00000000-00000000-00000000
CPUID 8000001C: 00000000-80032013-00010200-E000000F
CPUID 8000001D: 00000121-01C0003F-0000003F-00000000 [SL 00]
CPUID 8000001D: 00004122-0080003F-000001FF-00000000 [SL 01]
CPUID 8000001D: 00004143-03C0003F-000003FF-00000001 [SL 02]
CPUID 8000001E: 00000012-00000101-00000000-00000000
CPUID 8FFFFFFF: 00000000-00000000-00000000-00000000

L1    Data Cache:    32 KB,  8-way Associative, 64-byte Line
L1  Instr. Cache:    96 KB,  3-way Associative, 64-byte Line
L2 Unified Cache:     1 MB, 16-way Associative, 64-byte Line

------[ Logical CPU #3 ]------

allcpu: Package 0 / Core 3 / Thread 0: Valid

CPUID 00000000: 0000000D-68747541-444D4163-69746E65 [AuthenticAMD]
CPUID 00000001: 00660F01-03040800-7ED8320B-178BFBFF
CPUID 00000002: 00000000-00000000-00000000-00000000
CPUID 00000003: 00000000-00000000-00000000-00000000
CPUID 00000005: 00000040-00000040-00000003-00000000
CPUID 00000006: 00000004-00000000-00000001-00000000
CPUID 00000007: 00000000-000001A9-00000000-00000000
CPUID 00000008: 00000000-00000000-00000000-00000000
CPUID 00000009: 00000000-00000000-00000000-00000000
CPUID 0000000A: 00000000-00000000-00000000-00000000
CPUID 0000000C: 00000000-00000000-00000000-00000000
CPUID 0000000D: 00000007-00000340-000003C0-40000000 [SL 00]
CPUID 0000000D: 00000001-00000000-00000000-00000000 [SL 01]
CPUID 0000000D: 00000100-00000240-00000000-00000000 [SL 02]
CPUID 0000000D: 00000080-00000340-00000000-00000000 [SL 3E]
CPUID 80000000: 8000001E-68747541-444D4163-69746E65 [AuthenticAMD]
CPUID 80000001: 00660F01-00000000-2FEBBFFF-2FD3FBFF
CPUID 80000002: 20444D41-382D5846-50303038-64615220 [AMD FX-8800P Rad]
CPUID 80000003: 206E6F65-202C3752-43203231-75706D6F [eon R7, 12 Compu]
CPUID 80000004: 43206574-7365726F-2B433420-00204738 [te Cores 4C+8G ]
CPUID 80000005: FF40FF18-FF40FF30-20080140-60030140
CPUID 80000006: 64006400-64004200-04008140-00000000
CPUID 80000007: 00000000-00000005-00000400-000037D9
CPUID 80000008: 00003030-00000000-00004003-00000000
CPUID 80000009: 00000000-00000000-00000000-00000000
CPUID 8000000A: 00000001-00008000-00000000-0001BCFF
CPUID 8000000B: 00000000-00000000-00000000-00000000
CPUID 8000000C: 00000000-00000000-00000000-00000000
CPUID 8000000D: 00000000-00000000-00000000-00000000
CPUID 8000000E: 00000000-00000000-00000000-00000000
CPUID 8000000F: 00000000-00000000-00000000-00000000
CPUID 80000010: 00000000-00000000-00000000-00000000
CPUID 80000011: 00000000-00000000-00000000-00000000
CPUID 80000012: 00000000-00000000-00000000-00000000
CPUID 80000013: 00000000-00000000-00000000-00000000
CPUID 80000014: 00000000-00000000-00000000-00000000
CPUID 80000015: 00000000-00000000-00000000-00000000
CPUID 80000016: 00000000-00000000-00000000-00000000
CPUID 80000017: 00000000-00000000-00000000-00000000
CPUID 80000018: 00000000-00000000-00000000-00000000
CPUID 80000019: F040F018-64006400-00000000-00000000
CPUID 8000001A: 00000003-00000000-00000000-00000000
CPUID 8000001B: 000007FF-00000000-00000000-00000000
CPUID 8000001C: 00000000-80032013-00010200-E000000F
CPUID 8000001D: 00000121-01C0003F-0000003F-00000000 [SL 00]
CPUID 8000001D: 00004122-0080003F-000001FF-00000000 [SL 01]
CPUID 8000001D: 00004143-03C0003F-000003FF-00000001 [SL 02]
CPUID 8000001E: 00000013-00000101-00000000-00000000
CPUID 8FFFFFFF: 00000000-00000000-00000000-00000000

L1    Data Cache:    32 KB,  8-way Associative, 64-byte Line
L1  Instr. Cache:    96 KB,  3-way Associative, 64-byte Line
L2 Unified Cache:     1 MB, 16-way Associative, 64-byte Line

------[ All CPUs ]------

CPU   0: APICID   0 / Package 0 / Core  0 / Thread 0: Valid
CPU   1: APICID   1 / Package 0 / Core  1 / Thread 0: Valid
CPU   2: APICID   2 / Package 0 / Core  2 / Thread 0: Valid
CPU   3: APICID   3 / Package 0 / Core  3 / Thread 0: Valid

------[ MSR Registers ]------

CPU Clock (Normal): 2495 MHz
CPU Clock (TSC): 2096 MHz
CPU Multiplier: 25.0x
CPB PStates: 5
MSR 0000001B: 0000-0000-FEE0-0900
MSR 0000008B: 0000-0000-0600-610B
MSR 000000E7: 0000-0000-00E1-1B82 [S200]
MSR 000000E7: 0000-0000-000E-E4A7 [S200]
MSR 000000E7: 0000-0000-0002-03BB
MSR 000000E8: 0000-0000-0002-CBAC [S200]
MSR 000000E8: 0000-0000-0002-4D31 [S200]
MSR 000000E8: 0000-0000-0002-BF07
MSR C0010004: 0000-0000-0000-0000
MSR C0010005: 0000-0000-0000-0000
MSR C0010006: 0000-0000-0000-0000
MSR C0010007: 0000-0000-0000-0000
MSR C0010015: 0000-0000-1900-1011
MSR C001001F: 0258-4000-0885-0000
MSR C0010055: 0000-0000-0000-0000
MSR C0010058: 0000-0000-F800-0019
MSR C0010061: 0000-0000-0000-0020
MSR C0010062: 0000-0000-0000-0000
MSR C0010063: 0000-0000-0000-0000
MSR C0010064: 8000-0183-0000-4812 [34.00x] [1.3250 V] [13.10 A] [PState Pb0]
MSR C0010065: 8000-0174-0000-5C10 [32.00x] [1.2625 V] [11.60 A] [PState Pb1]
MSR C0010066: 8000-015D-0000-7C0D [29.00x] [1.1625 V] [ 9.30 A] [PState Pb2]
MSR C0010067: 8000-0144-0000-A409 [25.00x] [1.0375 V] [ 6.80 A] [PState Pb3]
MSR C0010068: 8000-013A-0000-B407 [23.00x] [0.9875 V] [ 5.80 A] [PState Pb4]
MSR C0010069: 8000-0133-0000-C005 [21.00x] [0.9500 V] [ 5.10 A] [PState P0]
MSR C001006A: 8000-0128-0000-D854 [18.00x] [0.8750 V] [ 4.00 A] [PState P1]
MSR C001006B: 8000-011D-0040-F04C [14.00x] [0.8000 V] [ 2.90 A] [PState P2]
MSR C0010070: 0000-0000-5200-4812
MSR C0010071: 6BC4-0006-5243-A409 [25.00x] [0.2375V]
MSR C0010071: 6BC4-0006-5243-A409 [25.00x] [0.2375V]
MSR C0010071: 6BC4-0006-7C43-A409 [25.00x] [0.2375V]
MSR C0010071: 6BC4-0006-7C43-A409 [25.00x] [0.2375V]
MSR C0010071: 6BC4-0006-7C43-A409 [25.00x] [0.2375V]
MSR C0010140: 0000-0000-0000-0004
MSR C0010141: 0000-0000-0000-0000
MSR C0011023: 810A-4000-0078-3220
