------[ Versions ]------

Program Version : AIDA64 v5.80.4102 Beta
BenchDLL Version: 4.3.739-x64

------[ CPU Info ]------

CPU Type          : OctalCore AMD Ryzen 7 1700X, 3400 MHz (34 x 100)
CPU Alias         : Summit Ridge
CPU Platform      : Socket AM4
CPU Stepping      : ZP-B1
Instruction Set   : x86, x86-64, MMX, SSE, SSE2, SSE3, SSSE3, SSE4.1, SSE4.2, SSE4A, AVX, AVX2, FMA, AES, SHA
CPUID Manufacturer: AuthenticAMD
CPUID CPU Name    : AMD Ryzen 7 1700X Eight-Core Processor
CPUID Revision    : 00800F11h
Platform ID       : C7h  (Socket AM4)
HTT / CMP Units   : 2 / 8
Max. NUMA Node    : 0

Tjmax Temperature    : 0 Celsius
HTC Temperature Limit: 115 Celsius

------[ Logical CPU #0 ]------

allcpu: Package 0 / Core 0 / Thread 0: Valid

CPUID 00000000: 0000000D-68747541-444D4163-69746E65 [AuthenticAMD]
CPUID 00000001: 00800F11-00100800-7ED8320B-178BFBFF
CPUID 00000002: 00000000-00000000-00000000-00000000
CPUID 00000003: 00000000-00000000-00000000-00000000
CPUID 00000005: 00000040-00000040-00000003-00000000
CPUID 00000006: 00000004-00000000-00000001-00000000
CPUID 00000007: 00000000-209C01A9-00000000-00000000
CPUID 00000008: 00000000-00000000-00000000-00000000
CPUID 00000009: 00000000-00000000-00000000-00000000
CPUID 0000000A: 00000000-00000000-00000000-00000000
CPUID 0000000C: 00000000-00000000-00000000-00000000
CPUID 0000000D: 00000007-00000340-00000340-00000000 [SL 00]
CPUID 0000000D: 0000000F-00000340-00000000-00000000 [SL 01]
CPUID 0000000D: 00000100-00000240-00000000-00000000 [SL 02]
CPUID 80000000: 8000001F-68747541-444D4163-69746E65 [AuthenticAMD]
CPUID 80000001: 00800F11-20000000-35C233FF-2FD3FBFF
CPUID 80000002: 20444D41-657A7952-2037206E-30303731 [AMD Ryzen 7 1700]
CPUID 80000003: 69452058-2D746867-65726F43-6F725020 [X Eight-Core Pro]
CPUID 80000004: 73736563-2020726F-20202020-00202020 [cessor         ]
CPUID 80000005: FF40FF40-FF40FF40-20080140-40040140
CPUID 80000006: 26006400-66006400-02006140-00808140
CPUID 80000007: 00000000-0000001B-00000000-00006599
CPUID 80000008: 00003030-00000007-0000400F-00000000
CPUID 80000009: 00000000-00000000-00000000-00000000
CPUID 8000000A: 00000001-00008000-00000000-0001BCFF
CPUID 8000000B: 00000000-00000000-00000000-00000000
CPUID 8000000C: 00000000-00000000-00000000-00000000
CPUID 8000000D: 00000000-00000000-00000000-00000000
CPUID 8000000E: 00000000-00000000-00000000-00000000
CPUID 8000000F: 00000000-00000000-00000000-00000000
CPUID 80000010: 00000000-00000000-00000000-00000000
CPUID 80000011: 00000000-00000000-00000000-00000000
CPUID 80000012: 00000000-00000000-00000000-00000000
CPUID 80000013: 00000000-00000000-00000000-00000000
CPUID 80000014: 00000000-00000000-00000000-00000000
CPUID 80000015: 00000000-00000000-00000000-00000000
CPUID 80000016: 00000000-00000000-00000000-00000000
CPUID 80000017: 00000000-00000000-00000000-00000000
CPUID 80000018: 00000000-00000000-00000000-00000000
CPUID 80000019: F040F040-00000000-00000000-00000000
CPUID 8000001A: 00000003-00000000-00000000-00000000
CPUID 8000001B: 000003FF-00000000-00000000-00000000
CPUID 8000001C: 00000000-00000000-00000000-00000000
CPUID 8000001D: 00004121-01C0003F-0000003F-00000000 [SL 00]
CPUID 8000001D: 00004122-00C0003F-000000FF-00000000 [SL 01]
CPUID 8000001D: 00004143-01C0003F-000003FF-00000002 [SL 02]
CPUID 8000001D: 0001C163-03C0003F-00001FFF-00000001 [SL 03]
CPUID 8000001E: 00000000-00000100-00000000-00000000
CPUID 8000001F: 00000007-0000016F-0000000F-00000000
CPUID 8FFFFFFF: 00000000-00000000-00000000-00000000

L1    Data Cache:    32 KB,  8-way Associative, 64-byte Line
L1  Instr. Cache:    64 KB,  4-way Associative, 64-byte Line
L2 Unified Cache:   512 KB,  8-way Associative, 64-byte Line
L3 Unified Cache:     8 MB, 16-way Associative, 64-byte Line

------[ Logical CPU #1 ]------

allcpu: Package 0 / Core 0 / Thread 1: Valid, Virtual

CPUID 00000000: 0000000D-68747541-444D4163-69746E65 [AuthenticAMD]
CPUID 00000001: 00800F11-01100800-7ED8320B-178BFBFF
CPUID 00000002: 00000000-00000000-00000000-00000000
CPUID 00000003: 00000000-00000000-00000000-00000000
CPUID 00000005: 00000040-00000040-00000003-00000000
CPUID 00000006: 00000004-00000000-00000001-00000000
CPUID 00000007: 00000000-209C01A9-00000000-00000000
CPUID 00000008: 00000000-00000000-00000000-00000000
CPUID 00000009: 00000000-00000000-00000000-00000000
CPUID 0000000A: 00000000-00000000-00000000-00000000
CPUID 0000000C: 00000000-00000000-00000000-00000000
CPUID 0000000D: 00000007-00000340-00000340-00000000 [SL 00]
CPUID 0000000D: 0000000F-00000340-00000000-00000000 [SL 01]
CPUID 0000000D: 00000100-00000240-00000000-00000000 [SL 02]
CPUID 80000000: 8000001F-68747541-444D4163-69746E65 [AuthenticAMD]
CPUID 80000001: 00800F11-20000000-35C233FF-2FD3FBFF
CPUID 80000002: 20444D41-657A7952-2037206E-30303731 [AMD Ryzen 7 1700]
CPUID 80000003: 69452058-2D746867-65726F43-6F725020 [X Eight-Core Pro]
CPUID 80000004: 73736563-2020726F-20202020-00202020 [cessor         ]
CPUID 80000005: FF40FF40-FF40FF40-20080140-40040140
CPUID 80000006: 26006400-66006400-02006140-00808140
CPUID 80000007: 00000000-0000001B-00000000-00006599
CPUID 80000008: 00003030-00000007-0000400F-00000000
CPUID 80000009: 00000000-00000000-00000000-00000000
CPUID 8000000A: 00000001-00008000-00000000-0001BCFF
CPUID 8000000B: 00000000-00000000-00000000-00000000
CPUID 8000000C: 00000000-00000000-00000000-00000000
CPUID 8000000D: 00000000-00000000-00000000-00000000
CPUID 8000000E: 00000000-00000000-00000000-00000000
CPUID 8000000F: 00000000-00000000-00000000-00000000
CPUID 80000010: 00000000-00000000-00000000-00000000
CPUID 80000011: 00000000-00000000-00000000-00000000
CPUID 80000012: 00000000-00000000-00000000-00000000
CPUID 80000013: 00000000-00000000-00000000-00000000
CPUID 80000014: 00000000-00000000-00000000-00000000
CPUID 80000015: 00000000-00000000-00000000-00000000
CPUID 80000016: 00000000-00000000-00000000-00000000
CPUID 80000017: 00000000-00000000-00000000-00000000
CPUID 80000018: 00000000-00000000-00000000-00000000
CPUID 80000019: F040F040-00000000-00000000-00000000
CPUID 8000001A: 00000003-00000000-00000000-00000000
CPUID 8000001B: 000003FF-00000000-00000000-00000000
CPUID 8000001C: 00000000-00000000-00000000-00000000
CPUID 8000001D: 00004121-01C0003F-0000003F-00000000 [SL 00]
CPUID 8000001D: 00004122-00C0003F-000000FF-00000000 [SL 01]
CPUID 8000001D: 00004143-01C0003F-000003FF-00000002 [SL 02]
CPUID 8000001D: 0001C163-03C0003F-00001FFF-00000001 [SL 03]
CPUID 8000001E: 00000001-00000100-00000000-00000000
CPUID 8000001F: 00000007-0000016F-0000000F-00000000
CPUID 8FFFFFFF: 00000000-00000000-00000000-00000000

L1    Data Cache:    32 KB,  8-way Associative, 64-byte Line
L1  Instr. Cache:    64 KB,  4-way Associative, 64-byte Line
L2 Unified Cache:   512 KB,  8-way Associative, 64-byte Line
L3 Unified Cache:     8 MB, 16-way Associative, 64-byte Line

------[ Logical CPU #2 ]------

allcpu: Package 0 / Core 1 / Thread 0: Valid

CPUID 00000000: 0000000D-68747541-444D4163-69746E65 [AuthenticAMD]
CPUID 00000001: 00800F11-02100800-7ED8320B-178BFBFF
CPUID 00000002: 00000000-00000000-00000000-00000000
CPUID 00000003: 00000000-00000000-00000000-00000000
CPUID 00000005: 00000040-00000040-00000003-00000000
CPUID 00000006: 00000004-00000000-00000001-00000000
CPUID 00000007: 00000000-209C01A9-00000000-00000000
CPUID 00000008: 00000000-00000000-00000000-00000000
CPUID 00000009: 00000000-00000000-00000000-00000000
CPUID 0000000A: 00000000-00000000-00000000-00000000
CPUID 0000000C: 00000000-00000000-00000000-00000000
CPUID 0000000D: 00000007-00000340-00000340-00000000 [SL 00]
CPUID 0000000D: 0000000F-00000340-00000000-00000000 [SL 01]
CPUID 0000000D: 00000100-00000240-00000000-00000000 [SL 02]
CPUID 80000000: 8000001F-68747541-444D4163-69746E65 [AuthenticAMD]
CPUID 80000001: 00800F11-20000000-35C233FF-2FD3FBFF
CPUID 80000002: 20444D41-657A7952-2037206E-30303731 [AMD Ryzen 7 1700]
CPUID 80000003: 69452058-2D746867-65726F43-6F725020 [X Eight-Core Pro]
CPUID 80000004: 73736563-2020726F-20202020-00202020 [cessor         ]
CPUID 80000005: FF40FF40-FF40FF40-20080140-40040140
CPUID 80000006: 26006400-66006400-02006140-00808140
CPUID 80000007: 00000000-0000001B-00000000-00006599
CPUID 80000008: 00003030-00000007-0000400F-00000000
CPUID 80000009: 00000000-00000000-00000000-00000000
CPUID 8000000A: 00000001-00008000-00000000-0001BCFF
CPUID 8000000B: 00000000-00000000-00000000-00000000
CPUID 8000000C: 00000000-00000000-00000000-00000000
CPUID 8000000D: 00000000-00000000-00000000-00000000
CPUID 8000000E: 00000000-00000000-00000000-00000000
CPUID 8000000F: 00000000-00000000-00000000-00000000
CPUID 80000010: 00000000-00000000-00000000-00000000
CPUID 80000011: 00000000-00000000-00000000-00000000
CPUID 80000012: 00000000-00000000-00000000-00000000
CPUID 80000013: 00000000-00000000-00000000-00000000
CPUID 80000014: 00000000-00000000-00000000-00000000
CPUID 80000015: 00000000-00000000-00000000-00000000
CPUID 80000016: 00000000-00000000-00000000-00000000
CPUID 80000017: 00000000-00000000-00000000-00000000
CPUID 80000018: 00000000-00000000-00000000-00000000
CPUID 80000019: F040F040-00000000-00000000-00000000
CPUID 8000001A: 00000003-00000000-00000000-00000000
CPUID 8000001B: 000003FF-00000000-00000000-00000000
CPUID 8000001C: 00000000-00000000-00000000-00000000
CPUID 8000001D: 00004121-01C0003F-0000003F-00000000 [SL 00]
CPUID 8000001D: 00004122-00C0003F-000000FF-00000000 [SL 01]
CPUID 8000001D: 00004143-01C0003F-000003FF-00000002 [SL 02]
CPUID 8000001D: 0001C163-03C0003F-00001FFF-00000001 [SL 03]
CPUID 8000001E: 00000002-00000101-00000000-00000000
CPUID 8000001F: 00000007-0000016F-0000000F-00000000
CPUID 8FFFFFFF: 00000000-00000000-00000000-00000000

L1    Data Cache:    32 KB,  8-way Associative, 64-byte Line
L1  Instr. Cache:    64 KB,  4-way Associative, 64-byte Line
L2 Unified Cache:   512 KB,  8-way Associative, 64-byte Line
L3 Unified Cache:     8 MB, 16-way Associative, 64-byte Line

------[ Logical CPU #3 ]------

allcpu: Package 0 / Core 1 / Thread 1: Valid, Virtual

CPUID 00000000: 0000000D-68747541-444D4163-69746E65 [AuthenticAMD]
CPUID 00000001: 00800F11-03100800-7ED8320B-178BFBFF
CPUID 00000002: 00000000-00000000-00000000-00000000
CPUID 00000003: 00000000-00000000-00000000-00000000
CPUID 00000005: 00000040-00000040-00000003-00000000
CPUID 00000006: 00000004-00000000-00000001-00000000
CPUID 00000007: 00000000-209C01A9-00000000-00000000
CPUID 00000008: 00000000-00000000-00000000-00000000
CPUID 00000009: 00000000-00000000-00000000-00000000
CPUID 0000000A: 00000000-00000000-00000000-00000000
CPUID 0000000C: 00000000-00000000-00000000-00000000
CPUID 0000000D: 00000007-00000340-00000340-00000000 [SL 00]
CPUID 0000000D: 0000000F-00000340-00000000-00000000 [SL 01]
CPUID 0000000D: 00000100-00000240-00000000-00000000 [SL 02]
CPUID 80000000: 8000001F-68747541-444D4163-69746E65 [AuthenticAMD]
CPUID 80000001: 00800F11-20000000-35C233FF-2FD3FBFF
CPUID 80000002: 20444D41-657A7952-2037206E-30303731 [AMD Ryzen 7 1700]
CPUID 80000003: 69452058-2D746867-65726F43-6F725020 [X Eight-Core Pro]
CPUID 80000004: 73736563-2020726F-20202020-00202020 [cessor         ]
CPUID 80000005: FF40FF40-FF40FF40-20080140-40040140
CPUID 80000006: 26006400-66006400-02006140-00808140
CPUID 80000007: 00000000-0000001B-00000000-00006599
CPUID 80000008: 00003030-00000007-0000400F-00000000
CPUID 80000009: 00000000-00000000-00000000-00000000
CPUID 8000000A: 00000001-00008000-00000000-0001BCFF
CPUID 8000000B: 00000000-00000000-00000000-00000000
CPUID 8000000C: 00000000-00000000-00000000-00000000
CPUID 8000000D: 00000000-00000000-00000000-00000000
CPUID 8000000E: 00000000-00000000-00000000-00000000
CPUID 8000000F: 00000000-00000000-00000000-00000000
CPUID 80000010: 00000000-00000000-00000000-00000000
CPUID 80000011: 00000000-00000000-00000000-00000000
CPUID 80000012: 00000000-00000000-00000000-00000000
CPUID 80000013: 00000000-00000000-00000000-00000000
CPUID 80000014: 00000000-00000000-00000000-00000000
CPUID 80000015: 00000000-00000000-00000000-00000000
CPUID 80000016: 00000000-00000000-00000000-00000000
CPUID 80000017: 00000000-00000000-00000000-00000000
CPUID 80000018: 00000000-00000000-00000000-00000000
CPUID 80000019: F040F040-00000000-00000000-00000000
CPUID 8000001A: 00000003-00000000-00000000-00000000
CPUID 8000001B: 000003FF-00000000-00000000-00000000
CPUID 8000001C: 00000000-00000000-00000000-00000000
CPUID 8000001D: 00004121-01C0003F-0000003F-00000000 [SL 00]
CPUID 8000001D: 00004122-00C0003F-000000FF-00000000 [SL 01]
CPUID 8000001D: 00004143-01C0003F-000003FF-00000002 [SL 02]
CPUID 8000001D: 0001C163-03C0003F-00001FFF-00000001 [SL 03]
CPUID 8000001E: 00000003-00000101-00000000-00000000
CPUID 8000001F: 00000007-0000016F-0000000F-00000000
CPUID 8FFFFFFF: 00000000-00000000-00000000-00000000

L1    Data Cache:    32 KB,  8-way Associative, 64-byte Line
L1  Instr. Cache:    64 KB,  4-way Associative, 64-byte Line
L2 Unified Cache:   512 KB,  8-way Associative, 64-byte Line
L3 Unified Cache:     8 MB, 16-way Associative, 64-byte Line

------[ Logical CPU #4 ]------

allcpu: Package 0 / Core 2 / Thread 0: Valid

CPUID 00000000: 0000000D-68747541-444D4163-69746E65 [AuthenticAMD]
CPUID 00000001: 00800F11-04100800-7ED8320B-178BFBFF
CPUID 00000002: 00000000-00000000-00000000-00000000
CPUID 00000003: 00000000-00000000-00000000-00000000
CPUID 00000005: 00000040-00000040-00000003-00000000
CPUID 00000006: 00000004-00000000-00000001-00000000
CPUID 00000007: 00000000-209C01A9-00000000-00000000
CPUID 00000008: 00000000-00000000-00000000-00000000
CPUID 00000009: 00000000-00000000-00000000-00000000
CPUID 0000000A: 00000000-00000000-00000000-00000000
CPUID 0000000C: 00000000-00000000-00000000-00000000
CPUID 0000000D: 00000007-00000340-00000340-00000000 [SL 00]
CPUID 0000000D: 0000000F-00000340-00000000-00000000 [SL 01]
CPUID 0000000D: 00000100-00000240-00000000-00000000 [SL 02]
CPUID 80000000: 8000001F-68747541-444D4163-69746E65 [AuthenticAMD]
CPUID 80000001: 00800F11-20000000-35C233FF-2FD3FBFF
CPUID 80000002: 20444D41-657A7952-2037206E-30303731 [AMD Ryzen 7 1700]
CPUID 80000003: 69452058-2D746867-65726F43-6F725020 [X Eight-Core Pro]
CPUID 80000004: 73736563-2020726F-20202020-00202020 [cessor         ]
CPUID 80000005: FF40FF40-FF40FF40-20080140-40040140
CPUID 80000006: 26006400-66006400-02006140-00808140
CPUID 80000007: 00000000-0000001B-00000000-00006599
CPUID 80000008: 00003030-00000007-0000400F-00000000
CPUID 80000009: 00000000-00000000-00000000-00000000
CPUID 8000000A: 00000001-00008000-00000000-0001BCFF
CPUID 8000000B: 00000000-00000000-00000000-00000000
CPUID 8000000C: 00000000-00000000-00000000-00000000
CPUID 8000000D: 00000000-00000000-00000000-00000000
CPUID 8000000E: 00000000-00000000-00000000-00000000
CPUID 8000000F: 00000000-00000000-00000000-00000000
CPUID 80000010: 00000000-00000000-00000000-00000000
CPUID 80000011: 00000000-00000000-00000000-00000000
CPUID 80000012: 00000000-00000000-00000000-00000000
CPUID 80000013: 00000000-00000000-00000000-00000000
CPUID 80000014: 00000000-00000000-00000000-00000000
CPUID 80000015: 00000000-00000000-00000000-00000000
CPUID 80000016: 00000000-00000000-00000000-00000000
CPUID 80000017: 00000000-00000000-00000000-00000000
CPUID 80000018: 00000000-00000000-00000000-00000000
CPUID 80000019: F040F040-00000000-00000000-00000000
CPUID 8000001A: 00000003-00000000-00000000-00000000
CPUID 8000001B: 000003FF-00000000-00000000-00000000
CPUID 8000001C: 00000000-00000000-00000000-00000000
CPUID 8000001D: 00004121-01C0003F-0000003F-00000000 [SL 00]
CPUID 8000001D: 00004122-00C0003F-000000FF-00000000 [SL 01]
CPUID 8000001D: 00004143-01C0003F-000003FF-00000002 [SL 02]
CPUID 8000001D: 0001C163-03C0003F-00001FFF-00000001 [SL 03]
CPUID 8000001E: 00000004-00000102-00000000-00000000
CPUID 8000001F: 00000007-0000016F-0000000F-00000000
CPUID 8FFFFFFF: 00000000-00000000-00000000-00000000

L1    Data Cache:    32 KB,  8-way Associative, 64-byte Line
L1  Instr. Cache:    64 KB,  4-way Associative, 64-byte Line
L2 Unified Cache:   512 KB,  8-way Associative, 64-byte Line
L3 Unified Cache:     8 MB, 16-way Associative, 64-byte Line

------[ Logical CPU #5 ]------

allcpu: Package 0 / Core 2 / Thread 1: Valid, Virtual

CPUID 00000000: 0000000D-68747541-444D4163-69746E65 [AuthenticAMD]
CPUID 00000001: 00800F11-05100800-7ED8320B-178BFBFF
CPUID 00000002: 00000000-00000000-00000000-00000000
CPUID 00000003: 00000000-00000000-00000000-00000000
CPUID 00000005: 00000040-00000040-00000003-00000000
CPUID 00000006: 00000004-00000000-00000001-00000000
CPUID 00000007: 00000000-209C01A9-00000000-00000000
CPUID 00000008: 00000000-00000000-00000000-00000000
CPUID 00000009: 00000000-00000000-00000000-00000000
CPUID 0000000A: 00000000-00000000-00000000-00000000
CPUID 0000000C: 00000000-00000000-00000000-00000000
CPUID 0000000D: 00000007-00000340-00000340-00000000 [SL 00]
CPUID 0000000D: 0000000F-00000340-00000000-00000000 [SL 01]
CPUID 0000000D: 00000100-00000240-00000000-00000000 [SL 02]
CPUID 80000000: 8000001F-68747541-444D4163-69746E65 [AuthenticAMD]
CPUID 80000001: 00800F11-20000000-35C233FF-2FD3FBFF
CPUID 80000002: 20444D41-657A7952-2037206E-30303731 [AMD Ryzen 7 1700]
CPUID 80000003: 69452058-2D746867-65726F43-6F725020 [X Eight-Core Pro]
CPUID 80000004: 73736563-2020726F-20202020-00202020 [cessor         ]
CPUID 80000005: FF40FF40-FF40FF40-20080140-40040140
CPUID 80000006: 26006400-66006400-02006140-00808140
CPUID 80000007: 00000000-0000001B-00000000-00006599
CPUID 80000008: 00003030-00000007-0000400F-00000000
CPUID 80000009: 00000000-00000000-00000000-00000000
CPUID 8000000A: 00000001-00008000-00000000-0001BCFF
CPUID 8000000B: 00000000-00000000-00000000-00000000
CPUID 8000000C: 00000000-00000000-00000000-00000000
CPUID 8000000D: 00000000-00000000-00000000-00000000
CPUID 8000000E: 00000000-00000000-00000000-00000000
CPUID 8000000F: 00000000-00000000-00000000-00000000
CPUID 80000010: 00000000-00000000-00000000-00000000
CPUID 80000011: 00000000-00000000-00000000-00000000
CPUID 80000012: 00000000-00000000-00000000-00000000
CPUID 80000013: 00000000-00000000-00000000-00000000
CPUID 80000014: 00000000-00000000-00000000-00000000
CPUID 80000015: 00000000-00000000-00000000-00000000
CPUID 80000016: 00000000-00000000-00000000-00000000
CPUID 80000017: 00000000-00000000-00000000-00000000
CPUID 80000018: 00000000-00000000-00000000-00000000
CPUID 80000019: F040F040-00000000-00000000-00000000
CPUID 8000001A: 00000003-00000000-00000000-00000000
CPUID 8000001B: 000003FF-00000000-00000000-00000000
CPUID 8000001C: 00000000-00000000-00000000-00000000
CPUID 8000001D: 00004121-01C0003F-0000003F-00000000 [SL 00]
CPUID 8000001D: 00004122-00C0003F-000000FF-00000000 [SL 01]
CPUID 8000001D: 00004143-01C0003F-000003FF-00000002 [SL 02]
CPUID 8000001D: 0001C163-03C0003F-00001FFF-00000001 [SL 03]
CPUID 8000001E: 00000005-00000102-00000000-00000000
CPUID 8000001F: 00000007-0000016F-0000000F-00000000
CPUID 8FFFFFFF: 00000000-00000000-00000000-00000000

L1    Data Cache:    32 KB,  8-way Associative, 64-byte Line
L1  Instr. Cache:    64 KB,  4-way Associative, 64-byte Line
L2 Unified Cache:   512 KB,  8-way Associative, 64-byte Line
L3 Unified Cache:     8 MB, 16-way Associative, 64-byte Line

------[ Logical CPU #6 ]------

allcpu: Package 0 / Core 3 / Thread 0: Valid

CPUID 00000000: 0000000D-68747541-444D4163-69746E65 [AuthenticAMD]
CPUID 00000001: 00800F11-06100800-7ED8320B-178BFBFF
CPUID 00000002: 00000000-00000000-00000000-00000000
CPUID 00000003: 00000000-00000000-00000000-00000000
CPUID 00000005: 00000040-00000040-00000003-00000000
CPUID 00000006: 00000004-00000000-00000001-00000000
CPUID 00000007: 00000000-209C01A9-00000000-00000000
CPUID 00000008: 00000000-00000000-00000000-00000000
CPUID 00000009: 00000000-00000000-00000000-00000000
CPUID 0000000A: 00000000-00000000-00000000-00000000
CPUID 0000000C: 00000000-00000000-00000000-00000000
CPUID 0000000D: 00000007-00000340-00000340-00000000 [SL 00]
CPUID 0000000D: 0000000F-00000340-00000000-00000000 [SL 01]
CPUID 0000000D: 00000100-00000240-00000000-00000000 [SL 02]
CPUID 80000000: 8000001F-68747541-444D4163-69746E65 [AuthenticAMD]
CPUID 80000001: 00800F11-20000000-35C233FF-2FD3FBFF
CPUID 80000002: 20444D41-657A7952-2037206E-30303731 [AMD Ryzen 7 1700]
CPUID 80000003: 69452058-2D746867-65726F43-6F725020 [X Eight-Core Pro]
CPUID 80000004: 73736563-2020726F-20202020-00202020 [cessor         ]
CPUID 80000005: FF40FF40-FF40FF40-20080140-40040140
CPUID 80000006: 26006400-66006400-02006140-00808140
CPUID 80000007: 00000000-0000001B-00000000-00006599
CPUID 80000008: 00003030-00000007-0000400F-00000000
CPUID 80000009: 00000000-00000000-00000000-00000000
CPUID 8000000A: 00000001-00008000-00000000-0001BCFF
CPUID 8000000B: 00000000-00000000-00000000-00000000
CPUID 8000000C: 00000000-00000000-00000000-00000000
CPUID 8000000D: 00000000-00000000-00000000-00000000
CPUID 8000000E: 00000000-00000000-00000000-00000000
CPUID 8000000F: 00000000-00000000-00000000-00000000
CPUID 80000010: 00000000-00000000-00000000-00000000
CPUID 80000011: 00000000-00000000-00000000-00000000
CPUID 80000012: 00000000-00000000-00000000-00000000
CPUID 80000013: 00000000-00000000-00000000-00000000
CPUID 80000014: 00000000-00000000-00000000-00000000
CPUID 80000015: 00000000-00000000-00000000-00000000
CPUID 80000016: 00000000-00000000-00000000-00000000
CPUID 80000017: 00000000-00000000-00000000-00000000
CPUID 80000018: 00000000-00000000-00000000-00000000
CPUID 80000019: F040F040-00000000-00000000-00000000
CPUID 8000001A: 00000003-00000000-00000000-00000000
CPUID 8000001B: 000003FF-00000000-00000000-00000000
CPUID 8000001C: 00000000-00000000-00000000-00000000
CPUID 8000001D: 00004121-01C0003F-0000003F-00000000 [SL 00]
CPUID 8000001D: 00004122-00C0003F-000000FF-00000000 [SL 01]
CPUID 8000001D: 00004143-01C0003F-000003FF-00000002 [SL 02]
CPUID 8000001D: 0001C163-03C0003F-00001FFF-00000001 [SL 03]
CPUID 8000001E: 00000006-00000103-00000000-00000000
CPUID 8000001F: 00000007-0000016F-0000000F-00000000
CPUID 8FFFFFFF: 00000000-00000000-00000000-00000000

L1    Data Cache:    32 KB,  8-way Associative, 64-byte Line
L1  Instr. Cache:    64 KB,  4-way Associative, 64-byte Line
L2 Unified Cache:   512 KB,  8-way Associative, 64-byte Line
L3 Unified Cache:     8 MB, 16-way Associative, 64-byte Line

------[ Logical CPU #7 ]------

allcpu: Package 0 / Core 3 / Thread 1: Valid, Virtual

CPUID 00000000: 0000000D-68747541-444D4163-69746E65 [AuthenticAMD]
CPUID 00000001: 00800F11-07100800-7ED8320B-178BFBFF
CPUID 00000002: 00000000-00000000-00000000-00000000
CPUID 00000003: 00000000-00000000-00000000-00000000
CPUID 00000005: 00000040-00000040-00000003-00000000
CPUID 00000006: 00000004-00000000-00000001-00000000
CPUID 00000007: 00000000-209C01A9-00000000-00000000
CPUID 00000008: 00000000-00000000-00000000-00000000
CPUID 00000009: 00000000-00000000-00000000-00000000
CPUID 0000000A: 00000000-00000000-00000000-00000000
CPUID 0000000C: 00000000-00000000-00000000-00000000
CPUID 0000000D: 00000007-00000340-00000340-00000000 [SL 00]
CPUID 0000000D: 0000000F-00000340-00000000-00000000 [SL 01]
CPUID 0000000D: 00000100-00000240-00000000-00000000 [SL 02]
CPUID 80000000: 8000001F-68747541-444D4163-69746E65 [AuthenticAMD]
CPUID 80000001: 00800F11-20000000-35C233FF-2FD3FBFF
CPUID 80000002: 20444D41-657A7952-2037206E-30303731 [AMD Ryzen 7 1700]
CPUID 80000003: 69452058-2D746867-65726F43-6F725020 [X Eight-Core Pro]
CPUID 80000004: 73736563-2020726F-20202020-00202020 [cessor         ]
CPUID 80000005: FF40FF40-FF40FF40-20080140-40040140
CPUID 80000006: 26006400-66006400-02006140-00808140
CPUID 80000007: 00000000-0000001B-00000000-00006599
CPUID 80000008: 00003030-00000007-0000400F-00000000
CPUID 80000009: 00000000-00000000-00000000-00000000
CPUID 8000000A: 00000001-00008000-00000000-0001BCFF
CPUID 8000000B: 00000000-00000000-00000000-00000000
CPUID 8000000C: 00000000-00000000-00000000-00000000
CPUID 8000000D: 00000000-00000000-00000000-00000000
CPUID 8000000E: 00000000-00000000-00000000-00000000
CPUID 8000000F: 00000000-00000000-00000000-00000000
CPUID 80000010: 00000000-00000000-00000000-00000000
CPUID 80000011: 00000000-00000000-00000000-00000000
CPUID 80000012: 00000000-00000000-00000000-00000000
CPUID 80000013: 00000000-00000000-00000000-00000000
CPUID 80000014: 00000000-00000000-00000000-00000000
CPUID 80000015: 00000000-00000000-00000000-00000000
CPUID 80000016: 00000000-00000000-00000000-00000000
CPUID 80000017: 00000000-00000000-00000000-00000000
CPUID 80000018: 00000000-00000000-00000000-00000000
CPUID 80000019: F040F040-00000000-00000000-00000000
CPUID 8000001A: 00000003-00000000-00000000-00000000
CPUID 8000001B: 000003FF-00000000-00000000-00000000
CPUID 8000001C: 00000000-00000000-00000000-00000000
CPUID 8000001D: 00004121-01C0003F-0000003F-00000000 [SL 00]
CPUID 8000001D: 00004122-00C0003F-000000FF-00000000 [SL 01]
CPUID 8000001D: 00004143-01C0003F-000003FF-00000002 [SL 02]
CPUID 8000001D: 0001C163-03C0003F-00001FFF-00000001 [SL 03]
CPUID 8000001E: 00000007-00000103-00000000-00000000
CPUID 8000001F: 00000007-0000016F-0000000F-00000000
CPUID 8FFFFFFF: 00000000-00000000-00000000-00000000

L1    Data Cache:    32 KB,  8-way Associative, 64-byte Line
L1  Instr. Cache:    64 KB,  4-way Associative, 64-byte Line
L2 Unified Cache:   512 KB,  8-way Associative, 64-byte Line
L3 Unified Cache:     8 MB, 16-way Associative, 64-byte Line

------[ Logical CPU #8 ]------

allcpu: Package 0 / Core 4 / Thread 0: Valid

CPUID 00000000: 0000000D-68747541-444D4163-69746E65 [AuthenticAMD]
CPUID 00000001: 00800F11-08100800-7ED8320B-178BFBFF
CPUID 00000002: 00000000-00000000-00000000-00000000
CPUID 00000003: 00000000-00000000-00000000-00000000
CPUID 00000005: 00000040-00000040-00000003-00000000
CPUID 00000006: 00000004-00000000-00000001-00000000
CPUID 00000007: 00000000-209C01A9-00000000-00000000
CPUID 00000008: 00000000-00000000-00000000-00000000
CPUID 00000009: 00000000-00000000-00000000-00000000
CPUID 0000000A: 00000000-00000000-00000000-00000000
CPUID 0000000C: 00000000-00000000-00000000-00000000
CPUID 0000000D: 00000007-00000340-00000340-00000000 [SL 00]
CPUID 0000000D: 0000000F-00000340-00000000-00000000 [SL 01]
CPUID 0000000D: 00000100-00000240-00000000-00000000 [SL 02]
CPUID 80000000: 8000001F-68747541-444D4163-69746E65 [AuthenticAMD]
CPUID 80000001: 00800F11-20000000-35C233FF-2FD3FBFF
CPUID 80000002: 20444D41-657A7952-2037206E-30303731 [AMD Ryzen 7 1700]
CPUID 80000003: 69452058-2D746867-65726F43-6F725020 [X Eight-Core Pro]
CPUID 80000004: 73736563-2020726F-20202020-00202020 [cessor         ]
CPUID 80000005: FF40FF40-FF40FF40-20080140-40040140
CPUID 80000006: 26006400-66006400-02006140-00808140
CPUID 80000007: 00000000-0000001B-00000000-00006599
CPUID 80000008: 00003030-00000007-0000400F-00000000
CPUID 80000009: 00000000-00000000-00000000-00000000
CPUID 8000000A: 00000001-00008000-00000000-0001BCFF
CPUID 8000000B: 00000000-00000000-00000000-00000000
CPUID 8000000C: 00000000-00000000-00000000-00000000
CPUID 8000000D: 00000000-00000000-00000000-00000000
CPUID 8000000E: 00000000-00000000-00000000-00000000
CPUID 8000000F: 00000000-00000000-00000000-00000000
CPUID 80000010: 00000000-00000000-00000000-00000000
CPUID 80000011: 00000000-00000000-00000000-00000000
CPUID 80000012: 00000000-00000000-00000000-00000000
CPUID 80000013: 00000000-00000000-00000000-00000000
CPUID 80000014: 00000000-00000000-00000000-00000000
CPUID 80000015: 00000000-00000000-00000000-00000000
CPUID 80000016: 00000000-00000000-00000000-00000000
CPUID 80000017: 00000000-00000000-00000000-00000000
CPUID 80000018: 00000000-00000000-00000000-00000000
CPUID 80000019: F040F040-00000000-00000000-00000000
CPUID 8000001A: 00000003-00000000-00000000-00000000
CPUID 8000001B: 000003FF-00000000-00000000-00000000
CPUID 8000001C: 00000000-00000000-00000000-00000000
CPUID 8000001D: 00004121-01C0003F-0000003F-00000000 [SL 00]
CPUID 8000001D: 00004122-00C0003F-000000FF-00000000 [SL 01]
CPUID 8000001D: 00004143-01C0003F-000003FF-00000002 [SL 02]
CPUID 8000001D: 0001C163-03C0003F-00001FFF-00000001 [SL 03]
CPUID 8000001E: 00000008-00000104-00000000-00000000
CPUID 8000001F: 00000007-0000016F-0000000F-00000000
CPUID 8FFFFFFF: 00000000-00000000-00000000-00000000

L1    Data Cache:    32 KB,  8-way Associative, 64-byte Line
L1  Instr. Cache:    64 KB,  4-way Associative, 64-byte Line
L2 Unified Cache:   512 KB,  8-way Associative, 64-byte Line
L3 Unified Cache:     8 MB, 16-way Associative, 64-byte Line

------[ Logical CPU #9 ]------

allcpu: Package 0 / Core 4 / Thread 1: Valid, Virtual

CPUID 00000000: 0000000D-68747541-444D4163-69746E65 [AuthenticAMD]
CPUID 00000001: 00800F11-09100800-7ED8320B-178BFBFF
CPUID 00000002: 00000000-00000000-00000000-00000000
CPUID 00000003: 00000000-00000000-00000000-00000000
CPUID 00000005: 00000040-00000040-00000003-00000000
CPUID 00000006: 00000004-00000000-00000001-00000000
CPUID 00000007: 00000000-209C01A9-00000000-00000000
CPUID 00000008: 00000000-00000000-00000000-00000000
CPUID 00000009: 00000000-00000000-00000000-00000000
CPUID 0000000A: 00000000-00000000-00000000-00000000
CPUID 0000000C: 00000000-00000000-00000000-00000000
CPUID 0000000D: 00000007-00000340-00000340-00000000 [SL 00]
CPUID 0000000D: 0000000F-00000340-00000000-00000000 [SL 01]
CPUID 0000000D: 00000100-00000240-00000000-00000000 [SL 02]
CPUID 80000000: 8000001F-68747541-444D4163-69746E65 [AuthenticAMD]
CPUID 80000001: 00800F11-20000000-35C233FF-2FD3FBFF
CPUID 80000002: 20444D41-657A7952-2037206E-30303731 [AMD Ryzen 7 1700]
CPUID 80000003: 69452058-2D746867-65726F43-6F725020 [X Eight-Core Pro]
CPUID 80000004: 73736563-2020726F-20202020-00202020 [cessor         ]
CPUID 80000005: FF40FF40-FF40FF40-20080140-40040140
CPUID 80000006: 26006400-66006400-02006140-00808140
CPUID 80000007: 00000000-0000001B-00000000-00006599
CPUID 80000008: 00003030-00000007-0000400F-00000000
CPUID 80000009: 00000000-00000000-00000000-00000000
CPUID 8000000A: 00000001-00008000-00000000-0001BCFF
CPUID 8000000B: 00000000-00000000-00000000-00000000
CPUID 8000000C: 00000000-00000000-00000000-00000000
CPUID 8000000D: 00000000-00000000-00000000-00000000
CPUID 8000000E: 00000000-00000000-00000000-00000000
CPUID 8000000F: 00000000-00000000-00000000-00000000
CPUID 80000010: 00000000-00000000-00000000-00000000
CPUID 80000011: 00000000-00000000-00000000-00000000
CPUID 80000012: 00000000-00000000-00000000-00000000
CPUID 80000013: 00000000-00000000-00000000-00000000
CPUID 80000014: 00000000-00000000-00000000-00000000
CPUID 80000015: 00000000-00000000-00000000-00000000
CPUID 80000016: 00000000-00000000-00000000-00000000
CPUID 80000017: 00000000-00000000-00000000-00000000
CPUID 80000018: 00000000-00000000-00000000-00000000
CPUID 80000019: F040F040-00000000-00000000-00000000
CPUID 8000001A: 00000003-00000000-00000000-00000000
CPUID 8000001B: 000003FF-00000000-00000000-00000000
CPUID 8000001C: 00000000-00000000-00000000-00000000
CPUID 8000001D: 00004121-01C0003F-0000003F-00000000 [SL 00]
CPUID 8000001D: 00004122-00C0003F-000000FF-00000000 [SL 01]
CPUID 8000001D: 00004143-01C0003F-000003FF-00000002 [SL 02]
CPUID 8000001D: 0001C163-03C0003F-00001FFF-00000001 [SL 03]
CPUID 8000001E: 00000009-00000104-00000000-00000000
CPUID 8000001F: 00000007-0000016F-0000000F-00000000
CPUID 8FFFFFFF: 00000000-00000000-00000000-00000000

L1    Data Cache:    32 KB,  8-way Associative, 64-byte Line
L1  Instr. Cache:    64 KB,  4-way Associative, 64-byte Line
L2 Unified Cache:   512 KB,  8-way Associative, 64-byte Line
L3 Unified Cache:     8 MB, 16-way Associative, 64-byte Line

------[ Logical CPU #10 ]------

allcpu: Package 0 / Core 5 / Thread 0: Valid

CPUID 00000000: 0000000D-68747541-444D4163-69746E65 [AuthenticAMD]
CPUID 00000001: 00800F11-0A100800-7ED8320B-178BFBFF
CPUID 00000002: 00000000-00000000-00000000-00000000
CPUID 00000003: 00000000-00000000-00000000-00000000
CPUID 00000005: 00000040-00000040-00000003-00000000
CPUID 00000006: 00000004-00000000-00000001-00000000
CPUID 00000007: 00000000-209C01A9-00000000-00000000
CPUID 00000008: 00000000-00000000-00000000-00000000
CPUID 00000009: 00000000-00000000-00000000-00000000
CPUID 0000000A: 00000000-00000000-00000000-00000000
CPUID 0000000C: 00000000-00000000-00000000-00000000
CPUID 0000000D: 00000007-00000340-00000340-00000000 [SL 00]
CPUID 0000000D: 0000000F-00000340-00000000-00000000 [SL 01]
CPUID 0000000D: 00000100-00000240-00000000-00000000 [SL 02]
CPUID 80000000: 8000001F-68747541-444D4163-69746E65 [AuthenticAMD]
CPUID 80000001: 00800F11-20000000-35C233FF-2FD3FBFF
CPUID 80000002: 20444D41-657A7952-2037206E-30303731 [AMD Ryzen 7 1700]
CPUID 80000003: 69452058-2D746867-65726F43-6F725020 [X Eight-Core Pro]
CPUID 80000004: 73736563-2020726F-20202020-00202020 [cessor         ]
CPUID 80000005: FF40FF40-FF40FF40-20080140-40040140
CPUID 80000006: 26006400-66006400-02006140-00808140
CPUID 80000007: 00000000-0000001B-00000000-00006599
CPUID 80000008: 00003030-00000007-0000400F-00000000
CPUID 80000009: 00000000-00000000-00000000-00000000
CPUID 8000000A: 00000001-00008000-00000000-0001BCFF
CPUID 8000000B: 00000000-00000000-00000000-00000000
CPUID 8000000C: 00000000-00000000-00000000-00000000
CPUID 8000000D: 00000000-00000000-00000000-00000000
CPUID 8000000E: 00000000-00000000-00000000-00000000
CPUID 8000000F: 00000000-00000000-00000000-00000000
CPUID 80000010: 00000000-00000000-00000000-00000000
CPUID 80000011: 00000000-00000000-00000000-00000000
CPUID 80000012: 00000000-00000000-00000000-00000000
CPUID 80000013: 00000000-00000000-00000000-00000000
CPUID 80000014: 00000000-00000000-00000000-00000000
CPUID 80000015: 00000000-00000000-00000000-00000000
CPUID 80000016: 00000000-00000000-00000000-00000000
CPUID 80000017: 00000000-00000000-00000000-00000000
CPUID 80000018: 00000000-00000000-00000000-00000000
CPUID 80000019: F040F040-00000000-00000000-00000000
CPUID 8000001A: 00000003-00000000-00000000-00000000
CPUID 8000001B: 000003FF-00000000-00000000-00000000
CPUID 8000001C: 00000000-00000000-00000000-00000000
CPUID 8000001D: 00004121-01C0003F-0000003F-00000000 [SL 00]
CPUID 8000001D: 00004122-00C0003F-000000FF-00000000 [SL 01]
CPUID 8000001D: 00004143-01C0003F-000003FF-00000002 [SL 02]
CPUID 8000001D: 0001C163-03C0003F-00001FFF-00000001 [SL 03]
CPUID 8000001E: 0000000A-00000105-00000000-00000000
CPUID 8000001F: 00000007-0000016F-0000000F-00000000
CPUID 8FFFFFFF: 00000000-00000000-00000000-00000000

L1    Data Cache:    32 KB,  8-way Associative, 64-byte Line
L1  Instr. Cache:    64 KB,  4-way Associative, 64-byte Line
L2 Unified Cache:   512 KB,  8-way Associative, 64-byte Line
L3 Unified Cache:     8 MB, 16-way Associative, 64-byte Line

------[ Logical CPU #11 ]------

allcpu: Package 0 / Core 5 / Thread 1: Valid, Virtual

CPUID 00000000: 0000000D-68747541-444D4163-69746E65 [AuthenticAMD]
CPUID 00000001: 00800F11-0B100800-7ED8320B-178BFBFF
CPUID 00000002: 00000000-00000000-00000000-00000000
CPUID 00000003: 00000000-00000000-00000000-00000000
CPUID 00000005: 00000040-00000040-00000003-00000000
CPUID 00000006: 00000004-00000000-00000001-00000000
CPUID 00000007: 00000000-209C01A9-00000000-00000000
CPUID 00000008: 00000000-00000000-00000000-00000000
CPUID 00000009: 00000000-00000000-00000000-00000000
CPUID 0000000A: 00000000-00000000-00000000-00000000
CPUID 0000000C: 00000000-00000000-00000000-00000000
CPUID 0000000D: 00000007-00000340-00000340-00000000 [SL 00]
CPUID 0000000D: 0000000F-00000340-00000000-00000000 [SL 01]
CPUID 0000000D: 00000100-00000240-00000000-00000000 [SL 02]
CPUID 80000000: 8000001F-68747541-444D4163-69746E65 [AuthenticAMD]
CPUID 80000001: 00800F11-20000000-35C233FF-2FD3FBFF
CPUID 80000002: 20444D41-657A7952-2037206E-30303731 [AMD Ryzen 7 1700]
CPUID 80000003: 69452058-2D746867-65726F43-6F725020 [X Eight-Core Pro]
CPUID 80000004: 73736563-2020726F-20202020-00202020 [cessor         ]
CPUID 80000005: FF40FF40-FF40FF40-20080140-40040140
CPUID 80000006: 26006400-66006400-02006140-00808140
CPUID 80000007: 00000000-0000001B-00000000-00006599
CPUID 80000008: 00003030-00000007-0000400F-00000000
CPUID 80000009: 00000000-00000000-00000000-00000000
CPUID 8000000A: 00000001-00008000-00000000-0001BCFF
CPUID 8000000B: 00000000-00000000-00000000-00000000
CPUID 8000000C: 00000000-00000000-00000000-00000000
CPUID 8000000D: 00000000-00000000-00000000-00000000
CPUID 8000000E: 00000000-00000000-00000000-00000000
CPUID 8000000F: 00000000-00000000-00000000-00000000
CPUID 80000010: 00000000-00000000-00000000-00000000
CPUID 80000011: 00000000-00000000-00000000-00000000
CPUID 80000012: 00000000-00000000-00000000-00000000
CPUID 80000013: 00000000-00000000-00000000-00000000
CPUID 80000014: 00000000-00000000-00000000-00000000
CPUID 80000015: 00000000-00000000-00000000-00000000
CPUID 80000016: 00000000-00000000-00000000-00000000
CPUID 80000017: 00000000-00000000-00000000-00000000
CPUID 80000018: 00000000-00000000-00000000-00000000
CPUID 80000019: F040F040-00000000-00000000-00000000
CPUID 8000001A: 00000003-00000000-00000000-00000000
CPUID 8000001B: 000003FF-00000000-00000000-00000000
CPUID 8000001C: 00000000-00000000-00000000-00000000
CPUID 8000001D: 00004121-01C0003F-0000003F-00000000 [SL 00]
CPUID 8000001D: 00004122-00C0003F-000000FF-00000000 [SL 01]
CPUID 8000001D: 00004143-01C0003F-000003FF-00000002 [SL 02]
CPUID 8000001D: 0001C163-03C0003F-00001FFF-00000001 [SL 03]
CPUID 8000001E: 0000000B-00000105-00000000-00000000
CPUID 8000001F: 00000007-0000016F-0000000F-00000000
CPUID 8FFFFFFF: 00000000-00000000-00000000-00000000

L1    Data Cache:    32 KB,  8-way Associative, 64-byte Line
L1  Instr. Cache:    64 KB,  4-way Associative, 64-byte Line
L2 Unified Cache:   512 KB,  8-way Associative, 64-byte Line
L3 Unified Cache:     8 MB, 16-way Associative, 64-byte Line

------[ Logical CPU #12 ]------

allcpu: Package 0 / Core 6 / Thread 0: Valid

CPUID 00000000: 0000000D-68747541-444D4163-69746E65 [AuthenticAMD]
CPUID 00000001: 00800F11-0C100800-7ED8320B-178BFBFF
CPUID 00000002: 00000000-00000000-00000000-00000000
CPUID 00000003: 00000000-00000000-00000000-00000000
CPUID 00000005: 00000040-00000040-00000003-00000000
CPUID 00000006: 00000004-00000000-00000001-00000000
CPUID 00000007: 00000000-209C01A9-00000000-00000000
CPUID 00000008: 00000000-00000000-00000000-00000000
CPUID 00000009: 00000000-00000000-00000000-00000000
CPUID 0000000A: 00000000-00000000-00000000-00000000
CPUID 0000000C: 00000000-00000000-00000000-00000000
CPUID 0000000D: 00000007-00000340-00000340-00000000 [SL 00]
CPUID 0000000D: 0000000F-00000340-00000000-00000000 [SL 01]
CPUID 0000000D: 00000100-00000240-00000000-00000000 [SL 02]
CPUID 80000000: 8000001F-68747541-444D4163-69746E65 [AuthenticAMD]
CPUID 80000001: 00800F11-20000000-35C233FF-2FD3FBFF
CPUID 80000002: 20444D41-657A7952-2037206E-30303731 [AMD Ryzen 7 1700]
CPUID 80000003: 69452058-2D746867-65726F43-6F725020 [X Eight-Core Pro]
CPUID 80000004: 73736563-2020726F-20202020-00202020 [cessor         ]
CPUID 80000005: FF40FF40-FF40FF40-20080140-40040140
CPUID 80000006: 26006400-66006400-02006140-00808140
CPUID 80000007: 00000000-0000001B-00000000-00006599
CPUID 80000008: 00003030-00000007-0000400F-00000000
CPUID 80000009: 00000000-00000000-00000000-00000000
CPUID 8000000A: 00000001-00008000-00000000-0001BCFF
CPUID 8000000B: 00000000-00000000-00000000-00000000
CPUID 8000000C: 00000000-00000000-00000000-00000000
CPUID 8000000D: 00000000-00000000-00000000-00000000
CPUID 8000000E: 00000000-00000000-00000000-00000000
CPUID 8000000F: 00000000-00000000-00000000-00000000
CPUID 80000010: 00000000-00000000-00000000-00000000
CPUID 80000011: 00000000-00000000-00000000-00000000
CPUID 80000012: 00000000-00000000-00000000-00000000
CPUID 80000013: 00000000-00000000-00000000-00000000
CPUID 80000014: 00000000-00000000-00000000-00000000
CPUID 80000015: 00000000-00000000-00000000-00000000
CPUID 80000016: 00000000-00000000-00000000-00000000
CPUID 80000017: 00000000-00000000-00000000-00000000
CPUID 80000018: 00000000-00000000-00000000-00000000
CPUID 80000019: F040F040-00000000-00000000-00000000
CPUID 8000001A: 00000003-00000000-00000000-00000000
CPUID 8000001B: 000003FF-00000000-00000000-00000000
CPUID 8000001C: 00000000-00000000-00000000-00000000
CPUID 8000001D: 00004121-01C0003F-0000003F-00000000 [SL 00]
CPUID 8000001D: 00004122-00C0003F-000000FF-00000000 [SL 01]
CPUID 8000001D: 00004143-01C0003F-000003FF-00000002 [SL 02]
CPUID 8000001D: 0001C163-03C0003F-00001FFF-00000001 [SL 03]
CPUID 8000001E: 0000000C-00000106-00000000-00000000
CPUID 8000001F: 00000007-0000016F-0000000F-00000000
CPUID 8FFFFFFF: 00000000-00000000-00000000-00000000

L1    Data Cache:    32 KB,  8-way Associative, 64-byte Line
L1  Instr. Cache:    64 KB,  4-way Associative, 64-byte Line
L2 Unified Cache:   512 KB,  8-way Associative, 64-byte Line
L3 Unified Cache:     8 MB, 16-way Associative, 64-byte Line

------[ Logical CPU #13 ]------

allcpu: Package 0 / Core 6 / Thread 1: Valid, Virtual

CPUID 00000000: 0000000D-68747541-444D4163-69746E65 [AuthenticAMD]
CPUID 00000001: 00800F11-0D100800-7ED8320B-178BFBFF
CPUID 00000002: 00000000-00000000-00000000-00000000
CPUID 00000003: 00000000-00000000-00000000-00000000
CPUID 00000005: 00000040-00000040-00000003-00000000
CPUID 00000006: 00000004-00000000-00000001-00000000
CPUID 00000007: 00000000-209C01A9-00000000-00000000
CPUID 00000008: 00000000-00000000-00000000-00000000
CPUID 00000009: 00000000-00000000-00000000-00000000
CPUID 0000000A: 00000000-00000000-00000000-00000000
CPUID 0000000C: 00000000-00000000-00000000-00000000
CPUID 0000000D: 00000007-00000340-00000340-00000000 [SL 00]
CPUID 0000000D: 0000000F-00000340-00000000-00000000 [SL 01]
CPUID 0000000D: 00000100-00000240-00000000-00000000 [SL 02]
CPUID 80000000: 8000001F-68747541-444D4163-69746E65 [AuthenticAMD]
CPUID 80000001: 00800F11-20000000-35C233FF-2FD3FBFF
CPUID 80000002: 20444D41-657A7952-2037206E-30303731 [AMD Ryzen 7 1700]
CPUID 80000003: 69452058-2D746867-65726F43-6F725020 [X Eight-Core Pro]
CPUID 80000004: 73736563-2020726F-20202020-00202020 [cessor         ]
CPUID 80000005: FF40FF40-FF40FF40-20080140-40040140
CPUID 80000006: 26006400-66006400-02006140-00808140
CPUID 80000007: 00000000-0000001B-00000000-00006599
CPUID 80000008: 00003030-00000007-0000400F-00000000
CPUID 80000009: 00000000-00000000-00000000-00000000
CPUID 8000000A: 00000001-00008000-00000000-0001BCFF
CPUID 8000000B: 00000000-00000000-00000000-00000000
CPUID 8000000C: 00000000-00000000-00000000-00000000
CPUID 8000000D: 00000000-00000000-00000000-00000000
CPUID 8000000E: 00000000-00000000-00000000-00000000
CPUID 8000000F: 00000000-00000000-00000000-00000000
CPUID 80000010: 00000000-00000000-00000000-00000000
CPUID 80000011: 00000000-00000000-00000000-00000000
CPUID 80000012: 00000000-00000000-00000000-00000000
CPUID 80000013: 00000000-00000000-00000000-00000000
CPUID 80000014: 00000000-00000000-00000000-00000000
CPUID 80000015: 00000000-00000000-00000000-00000000
CPUID 80000016: 00000000-00000000-00000000-00000000
CPUID 80000017: 00000000-00000000-00000000-00000000
CPUID 80000018: 00000000-00000000-00000000-00000000
CPUID 80000019: F040F040-00000000-00000000-00000000
CPUID 8000001A: 00000003-00000000-00000000-00000000
CPUID 8000001B: 000003FF-00000000-00000000-00000000
CPUID 8000001C: 00000000-00000000-00000000-00000000
CPUID 8000001D: 00004121-01C0003F-0000003F-00000000 [SL 00]
CPUID 8000001D: 00004122-00C0003F-000000FF-00000000 [SL 01]
CPUID 8000001D: 00004143-01C0003F-000003FF-00000002 [SL 02]
CPUID 8000001D: 0001C163-03C0003F-00001FFF-00000001 [SL 03]
CPUID 8000001E: 0000000D-00000106-00000000-00000000
CPUID 8000001F: 00000007-0000016F-0000000F-00000000
CPUID 8FFFFFFF: 00000000-00000000-00000000-00000000

L1    Data Cache:    32 KB,  8-way Associative, 64-byte Line
L1  Instr. Cache:    64 KB,  4-way Associative, 64-byte Line
L2 Unified Cache:   512 KB,  8-way Associative, 64-byte Line
L3 Unified Cache:     8 MB, 16-way Associative, 64-byte Line

------[ Logical CPU #14 ]------

allcpu: Package 0 / Core 7 / Thread 0: Valid

CPUID 00000000: 0000000D-68747541-444D4163-69746E65 [AuthenticAMD]
CPUID 00000001: 00800F11-0E100800-7ED8320B-178BFBFF
CPUID 00000002: 00000000-00000000-00000000-00000000
CPUID 00000003: 00000000-00000000-00000000-00000000
CPUID 00000005: 00000040-00000040-00000003-00000000
CPUID 00000006: 00000004-00000000-00000001-00000000
CPUID 00000007: 00000000-209C01A9-00000000-00000000
CPUID 00000008: 00000000-00000000-00000000-00000000
CPUID 00000009: 00000000-00000000-00000000-00000000
CPUID 0000000A: 00000000-00000000-00000000-00000000
CPUID 0000000C: 00000000-00000000-00000000-00000000
CPUID 0000000D: 00000007-00000340-00000340-00000000 [SL 00]
CPUID 0000000D: 0000000F-00000340-00000000-00000000 [SL 01]
CPUID 0000000D: 00000100-00000240-00000000-00000000 [SL 02]
CPUID 80000000: 8000001F-68747541-444D4163-69746E65 [AuthenticAMD]
CPUID 80000001: 00800F11-20000000-35C233FF-2FD3FBFF
CPUID 80000002: 20444D41-657A7952-2037206E-30303731 [AMD Ryzen 7 1700]
CPUID 80000003: 69452058-2D746867-65726F43-6F725020 [X Eight-Core Pro]
CPUID 80000004: 73736563-2020726F-20202020-00202020 [cessor         ]
CPUID 80000005: FF40FF40-FF40FF40-20080140-40040140
CPUID 80000006: 26006400-66006400-02006140-00808140
CPUID 80000007: 00000000-0000001B-00000000-00006599
CPUID 80000008: 00003030-00000007-0000400F-00000000
CPUID 80000009: 00000000-00000000-00000000-00000000
CPUID 8000000A: 00000001-00008000-00000000-0001BCFF
CPUID 8000000B: 00000000-00000000-00000000-00000000
CPUID 8000000C: 00000000-00000000-00000000-00000000
CPUID 8000000D: 00000000-00000000-00000000-00000000
CPUID 8000000E: 00000000-00000000-00000000-00000000
CPUID 8000000F: 00000000-00000000-00000000-00000000
CPUID 80000010: 00000000-00000000-00000000-00000000
CPUID 80000011: 00000000-00000000-00000000-00000000
CPUID 80000012: 00000000-00000000-00000000-00000000
CPUID 80000013: 00000000-00000000-00000000-00000000
CPUID 80000014: 00000000-00000000-00000000-00000000
CPUID 80000015: 00000000-00000000-00000000-00000000
CPUID 80000016: 00000000-00000000-00000000-00000000
CPUID 80000017: 00000000-00000000-00000000-00000000
CPUID 80000018: 00000000-00000000-00000000-00000000
CPUID 80000019: F040F040-00000000-00000000-00000000
CPUID 8000001A: 00000003-00000000-00000000-00000000
CPUID 8000001B: 000003FF-00000000-00000000-00000000
CPUID 8000001C: 00000000-00000000-00000000-00000000
CPUID 8000001D: 00004121-01C0003F-0000003F-00000000 [SL 00]
CPUID 8000001D: 00004122-00C0003F-000000FF-00000000 [SL 01]
CPUID 8000001D: 00004143-01C0003F-000003FF-00000002 [SL 02]
CPUID 8000001D: 0001C163-03C0003F-00001FFF-00000001 [SL 03]
CPUID 8000001E: 0000000E-00000107-00000000-00000000
CPUID 8000001F: 00000007-0000016F-0000000F-00000000
CPUID 8FFFFFFF: 00000000-00000000-00000000-00000000

L1    Data Cache:    32 KB,  8-way Associative, 64-byte Line
L1  Instr. Cache:    64 KB,  4-way Associative, 64-byte Line
L2 Unified Cache:   512 KB,  8-way Associative, 64-byte Line
L3 Unified Cache:     8 MB, 16-way Associative, 64-byte Line

------[ Logical CPU #15 ]------

allcpu: Package 0 / Core 7 / Thread 1: Valid, Virtual

CPUID 00000000: 0000000D-68747541-444D4163-69746E65 [AuthenticAMD]
CPUID 00000001: 00800F11-0F100800-7ED8320B-178BFBFF
CPUID 00000002: 00000000-00000000-00000000-00000000
CPUID 00000003: 00000000-00000000-00000000-00000000
CPUID 00000005: 00000040-00000040-00000003-00000000
CPUID 00000006: 00000004-00000000-00000001-00000000
CPUID 00000007: 00000000-209C01A9-00000000-00000000
CPUID 00000008: 00000000-00000000-00000000-00000000
CPUID 00000009: 00000000-00000000-00000000-00000000
CPUID 0000000A: 00000000-00000000-00000000-00000000
CPUID 0000000C: 00000000-00000000-00000000-00000000
CPUID 0000000D: 00000007-00000340-00000340-00000000 [SL 00]
CPUID 0000000D: 0000000F-00000340-00000000-00000000 [SL 01]
CPUID 0000000D: 00000100-00000240-00000000-00000000 [SL 02]
CPUID 80000000: 8000001F-68747541-444D4163-69746E65 [AuthenticAMD]
CPUID 80000001: 00800F11-20000000-35C233FF-2FD3FBFF
CPUID 80000002: 20444D41-657A7952-2037206E-30303731 [AMD Ryzen 7 1700]
CPUID 80000003: 69452058-2D746867-65726F43-6F725020 [X Eight-Core Pro]
CPUID 80000004: 73736563-2020726F-20202020-00202020 [cessor         ]
CPUID 80000005: FF40FF40-FF40FF40-20080140-40040140
CPUID 80000006: 26006400-66006400-02006140-00808140
CPUID 80000007: 00000000-0000001B-00000000-00006599
CPUID 80000008: 00003030-00000007-0000400F-00000000
CPUID 80000009: 00000000-00000000-00000000-00000000
CPUID 8000000A: 00000001-00008000-00000000-0001BCFF
CPUID 8000000B: 00000000-00000000-00000000-00000000
CPUID 8000000C: 00000000-00000000-00000000-00000000
CPUID 8000000D: 00000000-00000000-00000000-00000000
CPUID 8000000E: 00000000-00000000-00000000-00000000
CPUID 8000000F: 00000000-00000000-00000000-00000000
CPUID 80000010: 00000000-00000000-00000000-00000000
CPUID 80000011: 00000000-00000000-00000000-00000000
CPUID 80000012: 00000000-00000000-00000000-00000000
CPUID 80000013: 00000000-00000000-00000000-00000000
CPUID 80000014: 00000000-00000000-00000000-00000000
CPUID 80000015: 00000000-00000000-00000000-00000000
CPUID 80000016: 00000000-00000000-00000000-00000000
CPUID 80000017: 00000000-00000000-00000000-00000000
CPUID 80000018: 00000000-00000000-00000000-00000000
CPUID 80000019: F040F040-00000000-00000000-00000000
CPUID 8000001A: 00000003-00000000-00000000-00000000
CPUID 8000001B: 000003FF-00000000-00000000-00000000
CPUID 8000001C: 00000000-00000000-00000000-00000000
CPUID 8000001D: 00004121-01C0003F-0000003F-00000000 [SL 00]
CPUID 8000001D: 00004122-00C0003F-000000FF-00000000 [SL 01]
CPUID 8000001D: 00004143-01C0003F-000003FF-00000002 [SL 02]
CPUID 8000001D: 0001C163-03C0003F-00001FFF-00000001 [SL 03]
CPUID 8000001E: 0000000F-00000107-00000000-00000000
CPUID 8000001F: 00000007-0000016F-0000000F-00000000
CPUID 8FFFFFFF: 00000000-00000000-00000000-00000000

L1    Data Cache:    32 KB,  8-way Associative, 64-byte Line
L1  Instr. Cache:    64 KB,  4-way Associative, 64-byte Line
L2 Unified Cache:   512 KB,  8-way Associative, 64-byte Line
L3 Unified Cache:     8 MB, 16-way Associative, 64-byte Line

------[ All CPUs ]------

CPU   0: APICID   0 / Package 0 / Core  0 / Thread 0: Valid
CPU   1: APICID   1 / Package 0 / Core  0 / Thread 1: Valid, Virtual
CPU   2: APICID   2 / Package 0 / Core  1 / Thread 0: Valid
CPU   3: APICID   3 / Package 0 / Core  1 / Thread 1: Valid, Virtual
CPU   4: APICID   4 / Package 0 / Core  2 / Thread 0: Valid
CPU   5: APICID   5 / Package 0 / Core  2 / Thread 1: Valid, Virtual
CPU   6: APICID   6 / Package 0 / Core  3 / Thread 0: Valid
CPU   7: APICID   7 / Package 0 / Core  3 / Thread 1: Valid, Virtual
CPU   8: APICID   8 / Package 0 / Core  4 / Thread 0: Valid
CPU   9: APICID   9 / Package 0 / Core  4 / Thread 1: Valid, Virtual
CPU  10: APICID  10 / Package 0 / Core  5 / Thread 0: Valid
CPU  11: APICID  11 / Package 0 / Core  5 / Thread 1: Valid, Virtual
CPU  12: APICID  12 / Package 0 / Core  6 / Thread 0: Valid
CPU  13: APICID  13 / Package 0 / Core  6 / Thread 1: Valid, Virtual
CPU  14: APICID  14 / Package 0 / Core  7 / Thread 0: Valid
CPU  15: APICID  15 / Package 0 / Core  7 / Thread 1: Valid, Virtual

------[ MSR Registers ]------

CPU Clock (Normal): 4193 MHz
CPU Clock (TSC): 3394 MHz
CPU Multiplier: 39.0x
CPB PStates: 0
MSR 0000001B: 0000-0000-FEE0-0900
MSR 0000008B: 0000-0000-0800-110E
MSR 000000E7: 0000-0000-03FD-67EC [S200]
MSR 000000E7: 0000-0000-0002-F65C [S200]
MSR 000000E7: 0000-0000-0002-9A52
MSR 000000E8: 0000-0000-0002-7B98 [S200]
MSR 000000E8: 0000-0000-0003-345D [S200]
MSR 000000E8: 0000-0000-0002-4929
MSR C0010004: 0000-0000-A5D1-FED2
MSR C0010005: 0000-0000-0000-0000
MSR C0010006: 0000-0000-0000-0000
MSR C0010007: 0000-0000-0000-0000
MSR C0010015: 0000-0000-0900-0011
MSR C001001F: 0000-0000-0000-0000
MSR C0010055: 0000-0000-0000-0000
MSR C0010058: 0000-0000-F800-0019
MSR C0010061: 0000-0000-0000-0020
MSR C0010062: 0000-0000-0000-0000
MSR C0010063: 0000-0000-0000-0000
MSR C0010064: 8000-0000-4888-0888 [34.00x] [1.3500 V] [ 3.40 A] [PState P0]
MSR C0010065: 8000-0000-478B-0878 [30.00x] [1.2750 V] [ 3.00 A] [PState P1]
MSR C0010066: 8000-0000-459A-0C84 [22.00x] [0.9000 V] [ 2.20 A] [PState P2]
MSR C0010067: 0000-0000-0000-0000
MSR C0010068: 0000-0000-0000-0000
MSR C0010069: 0000-0000-0000-0000
MSR C001006A: 0000-0000-0000-0000
MSR C001006B: 0000-0000-0000-0000
MSR C0010070: < FAILED >
MSR C0010293: 0000-0000-0014-489C [39.00x] [1.0437V]
MSR C0010293: 0000-0000-0014-488C [35.00x] [1.0437V]
MSR C0010293: 0000-0000-0014-489C [39.00x] [1.0437V]
MSR C0010293: 0000-0000-0014-488C [35.00x] [1.0437V]
MSR C0010293: 0000-0000-0014-488C [35.00x] [1.0437V]
MSR C0010140: 0000-0000-0000-0000
MSR C0010141: 0000-0000-0000-0000
MSR C0010290: 0000-0000-0000-0000
MSR C0010292: 0000-0001-0000-0052
MSR C0010293: 0000-0000-0014-489C
MSR C0010294: 1001-F47F-000F-0912
MSR C0010296: 0000-0000-0048-4848
MSR C0010299: 0000-0000-000A-1003
MSR C001029A: 0000-0000-5E26-3533 [S200]
MSR C001029A: 0000-0000-5E26-4A22 [S200]
MSR C001029A: 0000-0000-5E26-4E21
MSR C001029B: 0000-0000-419E-D8E8 [S200]
MSR C001029B: 0000-0000-41A1-E8CA [S200]
MSR C001029B: 0000-0000-41A4-E213
MSR C0011023: 0002-2000-0000-0000

PerformanceFrequency = 3314085

CPU Clock M.Method = 6  (APIC K10)
PM Timer Address   = 1032  (0408h)

APIC Clock = 99.80 MHz  (AT = 52306 / TT = 15008 / try = 1 / SKL = 0.00 MHz)
APIC Clock = 99.80 MHz  (AT = 52303 / TT = 15007 / try = 1 / SKL = 0.00 MHz)
APIC Clock = 99.80 MHz  (AT = 52316 / TT = 15011 / try = 1 / SKL = 0.00 MHz)
APIC Clock = 99.81 MHz  (AT = 52314 / TT = 15009 / try = 1 / SKL = 0.00 MHz)
APIC Clock = 99.81 MHz  (AT = 52319 / TT = 15011 / try = 1 / SKL = 0.00 MHz)

CPU Clock = 3892.38 MHz / TSC Clock = 3393.58 MHz / CPU Mul = 39.00x
CPU Clock = 3892.08 MHz / TSC Clock = 3393.67 MHz / CPU Mul = 39.00x
CPU Clock = 3493.20 MHz / TSC Clock = 3393.63 MHz / CPU Mul = 35.00x
CPU Clock = 3892.38 MHz / TSC Clock = 3393.62 MHz / CPU Mul = 39.00x
CPU Clock = 3892.27 MHz / TSC Clock = 3393.61 MHz / CPU Mul = 39.00x

CPU Clock Max = 3892.12 MHz / TSC Clock = 3393.68 MHz / CPU Mul = 39.00x
CPU Clock Max = 3892.23 MHz / TSC Clock = 3393.65 MHz / CPU Mul = 39.00x
CPU Clock Max = 3892.19 MHz / TSC Clock = 3393.62 MHz / CPU Mul = 39.00x
CPU Clock Max = 3892.35 MHz / TSC Clock = 3393.58 MHz / CPU Mul = 39.00x
CPU Clock Max = 3892.31 MHz / TSC Clock = 3393.60 MHz / CPU Mul = 39.00x

------[ APIC Base at 00000000-FEE00000 ]------

  0000  00 00 00 00 00 00 00 00 00 00 00 00 00 00 00 00 
  0010  00 00 00 00 00 00 00 00 00 00 00 00 00 00 00 00 
  0020  00 00 00 00 00 00 00 00 00 00 00 00 00 00 00 00 
  0030  10 00 05 80 10 00 05 80 10 00 05 80 10 00 05 80 
  0040  00 00 00 00 00 00 00 00 00 00 00 00 00 00 00 00 
  0050  00 00 00 00 00 00 00 00 00 00 00 00 00 00 00 00 
  0060  00 00 00 00 00 00 00 00 00 00 00 00 00 00 00 00 
  0070  00 00 00 00 00 00 00 00 00 00 00 00 00 00 00 00 
  0080  00 00 00 00 00 00 00 00 00 00 00 00 00 00 00 00 
  0090  00 00 00 00 00 00 00 00 00 00 00 00 00 00 00 00 
  00A0  00 00 00 00 00 00 00 00 00 00 00 00 00 00 00 00 
  00B0  00 00 00 00 00 00 00 00 00 00 00 00 00 00 00 00 
  00C0  00 00 00 00 00 00 00 00 00 00 00 00 00 00 00 00 
  00D0  00 00 00 01 00 00 00 01 00 00 00 01 00 00 00 01 
  00E0  FF FF FF 0F FF FF FF 0F FF FF FF 0F FF FF FF 0F 
  00F0  DF 01 00 00 DF 01 00 00 DF 01 00 00 DF 01 00 00 
  0100  00 00 00 00 00 00 00 00 00 00 00 00 00 00 00 00 
  0110  00 00 00 00 00 00 00 00 00 00 00 00 00 00 00 00 
  0120  00 00 00 00 00 00 00 00 00 00 00 00 00 00 00 00 
  0130  00 00 00 00 00 00 00 00 00 00 00 00 00 00 00 00 
  0140  00 00 00 00 00 00 00 00 00 00 00 00 00 00 00 00 
  0150  00 00 00 00 00 00 00 00 00 00 00 00 00 00 00 00 
  0160  00 00 00 00 00 00 00 00 00 00 00 00 00 00 00 00 
  0170  00 00 00 00 00 00 00 00 00 00 00 00 00 00 00 00 
  0180  00 00 00 00 00 00 00 00 00 00 00 00 00 00 00 00 
  0190  00 00 00 00 00 00 00 00 00 00 00 00 00 00 00 00 
  01A0  00 00 00 00 00 00 00 00 00 00 00 00 00 00 00 00 
  01B0  00 00 00 00 00 00 00 00 00 00 00 00 00 00 00 00 
  01C0  00 00 00 00 00 00 00 00 00 00 00 00 00 00 00 00 
  01D0  00 00 00 00 00 00 00 00 00 00 00 00 00 00 00 00 
  01E0  00 00 00 00 00 00 00 00 00 00 00 00 00 00 00 00 
  01F0  00 00 00 00 00 00 00 00 00 00 00 00 00 00 00 00 
  0200  00 00 00 00 00 00 00 00 00 00 00 00 00 00 00 00 
  0210  00 00 00 00 00 00 00 00 00 00 00 00 00 00 00 00 
  0220  00 00 00 00 00 00 00 00 00 00 00 00 00 00 00 00 
  0230  00 00 00 00 00 00 00 00 00 00 00 00 00 00 00 00 
  0240  00 00 00 00 00 00 00 00 00 00 00 00 00 00 00 00 
  0250  00 00 00 00 00 00 00 00 00 00 00 00 00 00 00 00 
  0260  00 00 00 00 00 00 00 00 00 00 00 00 00 00 00 00 
  0270  00 00 00 00 00 00 00 00 00 00 00 00 00 00 00 00 
  0280  80 00 00 00 80 00 00 00 80 00 00 00 80 00 00 00 
  0290  00 00 00 00 00 00 00 00 00 00 00 00 00 00 00 00 
  02A0  00 00 00 00 00 00 00 00 00 00 00 00 00 00 00 00 
  02B0  00 00 00 00 00 00 00 00 00 00 00 00 00 00 00 00 
  02C0  00 00 00 00 00 00 00 00 00 00 00 00 00 00 00 00 
  02D0  00 00 00 00 00 00 00 00 00 00 00 00 00 00 00 00 
  02E0  00 00 00 00 00 00 00 00 00 00 00 00 00 00 00 00 
  02F0  00 00 00 00 00 00 00 00 00 00 00 00 00 00 00 00 
  0300  2F 08 00 00 2F 08 00 00 2F 08 00 00 2F 08 00 00 
  0310  00 00 00 08 00 00 00 08 00 00 00 08 00 00 00 08 
  0320  D1 00 02 00 D1 00 02 00 D1 00 02 00 D1 00 02 00 
  0330  00 00 01 00 00 00 01 00 00 00 01 00 00 00 01 00 
  0340  FE 00 00 00 FE 00 00 00 FE 00 00 00 FE 00 00 00 
  0350  D8 00 01 00 D8 00 01 00 D8 00 01 00 D8 00 01 00 
  0360  00 04 00 00 00 04 00 00 00 04 00 00 00 04 00 00 
  0370  E2 00 00 00 E2 00 00 00 E2 00 00 00 E2 00 00 00 
  0380  99 2F 00 00 99 2F 00 00 99 2F 00 00 99 2F 00 00 
  0390  41 0F 00 00 41 0F 00 00 41 0F 00 00 41 0F 00 00 
  03A0  00 00 00 00 00 00 00 00 00 00 00 00 00 00 00 00 
  03B0  00 00 00 00 00 00 00 00 00 00 00 00 00 00 00 00 
  03C0  00 00 00 00 00 00 00 00 00 00 00 00 00 00 00 00 
  03D0  00 00 00 00 00 00 00 00 00 00 00 00 00 00 00 00 
  03E0  0A 00 00 00 0A 00 00 00 0A 00 00 00 0A 00 00 00 
  03F0  00 00 00 00 00 00 00 00 00 00 00 00 00 00 00 00 
