------[ Versions ]------

Program Version : AIDA64 v1.80.1482 Beta
BenchDLL Version: 2.7.380-x64

------[ CPU Info ]------

CPU Type           : QuadCore AMD A8-3850, 2900 MHz (29 x 100)
CPU Alias          : Llano
CPU Platform       : Socket FM1
CPU Stepping       : LN1-B0
Instruction Set    : x86, x86-64, MMX, 3DNow!, SSE, SSE2, SSE3, SSE4A
CPUID Manufacturer : AuthenticAMD
CPUID CPU Name     : AMD A8-3850 APU with Radeon(tm) HD Graphics
CPUID Revision     : 00300F10h
AMD K1x Brand ID   : 2B31h  (A8-3850)
Platform ID        : DDh  (Socket FM1)

------[ Logical CPU #0 ]------

allcpu: Package 0 / Core 0 / Thread 0: Valid

CPUID 00000000: 00000006-68747541-444D4163-69746E65
CPUID 00000001: 00300F10-00040800-00802009-178BFBFF
CPUID 00000002: 00000000-00000000-00000000-00000000
CPUID 00000003: 00000000-00000000-00000000-00000000
CPUID 00000005: 00000040-00000040-00000003-00000000
CPUID 00000006: 00000000-00000000-00000001-00000000
CPUID 80000000: 8000001B-68747541-444D4163-69746E65
CPUID 80000001: 00300F10-20002B31-000037FF-EFD3FBFF
CPUID 80000002: 20444D41-332D3841-20303538-20555041
CPUID 80000003: 68746977-64615220-286E6F65-20296D74
CPUID 80000004: 47204448-68706172-00736369-00000000
CPUID 80000005: FF30FF10-FF30FF20-40020140-40020140
CPUID 80000006: 20800000-44004200-04008140-00000000
CPUID 80000007: 00000000-00000000-00000000-000001F9
CPUID 80000008: 00003028-00000000-00002003-00000000
CPUID 80000009: 00000000-00000000-00000000-00000000
CPUID 8000000A: 00000001-00000040-00000000-0000040F
CPUID 8000000B: 00000000-00000000-00000000-00000000
CPUID 8000000C: 00000000-00000000-00000000-00000000
CPUID 8000000D: 00000000-00000000-00000000-00000000
CPUID 8000000E: 00000000-00000000-00000000-00000000
CPUID 8000000F: 00000000-00000000-00000000-00000000
CPUID 80000010: 00000000-00000000-00000000-00000000
CPUID 80000011: 00000000-00000000-00000000-00000000
CPUID 80000012: 00000000-00000000-00000000-00000000
CPUID 80000013: 00000000-00000000-00000000-00000000
CPUID 80000014: 00000000-00000000-00000000-00000000
CPUID 80000015: 00000000-00000000-00000000-00000000
CPUID 80000016: 00000000-00000000-00000000-00000000
CPUID 80000017: 00000000-00000000-00000000-00000000
CPUID 80000018: 00000000-00000000-00000000-00000000
CPUID 80000019: F0300000-60100000-00000000-00000000
CPUID 8000001A: 00000003-00000000-00000000-00000000
CPUID 8000001B: 000000FF-00000000-00000000-00000000
CPUID 8FFFFFFF: 00000000-00000000-00000000-00000000

------[ Logical CPU #1 ]------

allcpu: Package 0 / Core 1 / Thread 0: Valid

CPUID 00000000: 00000006-68747541-444D4163-69746E65
CPUID 00000001: 00300F10-02040800-00802009-178BFBFF
CPUID 00000002: 00000000-00000000-00000000-00000000
CPUID 00000003: 00000000-00000000-00000000-00000000
CPUID 00000005: 00000040-00000040-00000003-00000000
CPUID 00000006: 00000000-00000000-00000001-00000000
CPUID 80000000: 8000001B-68747541-444D4163-69746E65
CPUID 80000001: 00300F10-20002B31-000037FF-EFD3FBFF
CPUID 80000002: 20444D41-332D3841-20303538-20555041
CPUID 80000003: 68746977-64615220-286E6F65-20296D74
CPUID 80000004: 47204448-68706172-00736369-00000000
CPUID 80000005: FF30FF10-FF30FF20-40020140-40020140
CPUID 80000006: 20800000-44004200-04008140-00000000
CPUID 80000007: 00000000-00000000-00000000-000001F9
CPUID 80000008: 00003028-00000000-00002003-00000000
CPUID 80000009: 00000000-00000000-00000000-00000000
CPUID 8000000A: 00000001-00000040-00000000-0000040F
CPUID 8000000B: 00000000-00000000-00000000-00000000
CPUID 8000000C: 00000000-00000000-00000000-00000000
CPUID 8000000D: 00000000-00000000-00000000-00000000
CPUID 8000000E: 00000000-00000000-00000000-00000000
CPUID 8000000F: 00000000-00000000-00000000-00000000
CPUID 80000010: 00000000-00000000-00000000-00000000
CPUID 80000011: 00000000-00000000-00000000-00000000
CPUID 80000012: 00000000-00000000-00000000-00000000
CPUID 80000013: 00000000-00000000-00000000-00000000
CPUID 80000014: 00000000-00000000-00000000-00000000
CPUID 80000015: 00000000-00000000-00000000-00000000
CPUID 80000016: 00000000-00000000-00000000-00000000
CPUID 80000017: 00000000-00000000-00000000-00000000
CPUID 80000018: 00000000-00000000-00000000-00000000
CPUID 80000019: F0300000-60100000-00000000-00000000
CPUID 8000001A: 00000003-00000000-00000000-00000000
CPUID 8000001B: 000000FF-00000000-00000000-00000000
CPUID 8FFFFFFF: 00000000-00000000-00000000-00000000

------[ Logical CPU #2 ]------

allcpu: Package 0 / Core 2 / Thread 0: Valid

CPUID 00000000: 00000006-68747541-444D4163-69746E65
CPUID 00000001: 00300F10-01040800-00802009-178BFBFF
CPUID 00000002: 00000000-00000000-00000000-00000000
CPUID 00000003: 00000000-00000000-00000000-00000000
CPUID 00000005: 00000040-00000040-00000003-00000000
CPUID 00000006: 00000000-00000000-00000001-00000000
CPUID 80000000: 8000001B-68747541-444D4163-69746E65
CPUID 80000001: 00300F10-20002B31-000037FF-EFD3FBFF
CPUID 80000002: 20444D41-332D3841-20303538-20555041
CPUID 80000003: 68746977-64615220-286E6F65-20296D74
CPUID 80000004: 47204448-68706172-00736369-00000000
CPUID 80000005: FF30FF10-FF30FF20-40020140-40020140
CPUID 80000006: 20800000-44004200-04008140-00000000
CPUID 80000007: 00000000-00000000-00000000-000001F9
CPUID 80000008: 00003028-00000000-00002003-00000000
CPUID 80000009: 00000000-00000000-00000000-00000000
CPUID 8000000A: 00000001-00000040-00000000-0000040F
CPUID 8000000B: 00000000-00000000-00000000-00000000
CPUID 8000000C: 00000000-00000000-00000000-00000000
CPUID 8000000D: 00000000-00000000-00000000-00000000
CPUID 8000000E: 00000000-00000000-00000000-00000000
CPUID 8000000F: 00000000-00000000-00000000-00000000
CPUID 80000010: 00000000-00000000-00000000-00000000
CPUID 80000011: 00000000-00000000-00000000-00000000
CPUID 80000012: 00000000-00000000-00000000-00000000
CPUID 80000013: 00000000-00000000-00000000-00000000
CPUID 80000014: 00000000-00000000-00000000-00000000
CPUID 80000015: 00000000-00000000-00000000-00000000
CPUID 80000016: 00000000-00000000-00000000-00000000
CPUID 80000017: 00000000-00000000-00000000-00000000
CPUID 80000018: 00000000-00000000-00000000-00000000
CPUID 80000019: F0300000-60100000-00000000-00000000
CPUID 8000001A: 00000003-00000000-00000000-00000000
CPUID 8000001B: 000000FF-00000000-00000000-00000000
CPUID 8FFFFFFF: 00000000-00000000-00000000-00000000

------[ Logical CPU #3 ]------

allcpu: Package 0 / Core 3 / Thread 0: Valid

CPUID 00000000: 00000006-68747541-444D4163-69746E65
CPUID 00000001: 00300F10-03040800-00802009-178BFBFF
CPUID 00000002: 00000000-00000000-00000000-00000000
CPUID 00000003: 00000000-00000000-00000000-00000000
CPUID 00000005: 00000040-00000040-00000003-00000000
CPUID 00000006: 00000000-00000000-00000001-00000000
CPUID 80000000: 8000001B-68747541-444D4163-69746E65
CPUID 80000001: 00300F10-20002B31-000037FF-EFD3FBFF
CPUID 80000002: 20444D41-332D3841-20303538-20555041
CPUID 80000003: 68746977-64615220-286E6F65-20296D74
CPUID 80000004: 47204448-68706172-00736369-00000000
CPUID 80000005: FF30FF10-FF30FF20-40020140-40020140
CPUID 80000006: 20800000-44004200-04008140-00000000
CPUID 80000007: 00000000-00000000-00000000-000001F9
CPUID 80000008: 00003028-00000000-00002003-00000000
CPUID 80000009: 00000000-00000000-00000000-00000000
CPUID 8000000A: 00000001-00000040-00000000-0000040F
CPUID 8000000B: 00000000-00000000-00000000-00000000
CPUID 8000000C: 00000000-00000000-00000000-00000000
CPUID 8000000D: 00000000-00000000-00000000-00000000
CPUID 8000000E: 00000000-00000000-00000000-00000000
CPUID 8000000F: 00000000-00000000-00000000-00000000
CPUID 80000010: 00000000-00000000-00000000-00000000
CPUID 80000011: 00000000-00000000-00000000-00000000
CPUID 80000012: 00000000-00000000-00000000-00000000
CPUID 80000013: 00000000-00000000-00000000-00000000
CPUID 80000014: 00000000-00000000-00000000-00000000
CPUID 80000015: 00000000-00000000-00000000-00000000
CPUID 80000016: 00000000-00000000-00000000-00000000
CPUID 80000017: 00000000-00000000-00000000-00000000
CPUID 80000018: 00000000-00000000-00000000-00000000
CPUID 80000019: F0300000-60100000-00000000-00000000
CPUID 8000001A: 00000003-00000000-00000000-00000000
CPUID 8000001B: 000000FF-00000000-00000000-00000000
CPUID 8FFFFFFF: 00000000-00000000-00000000-00000000

------[ All CPUs ]------

CPU   0: APICID   0 / Package 0 / Core  0 / Thread 0: Valid
CPU   1: APICID   2 / Package 0 / Core  1 / Thread 0: Valid
CPU   2: APICID   1 / Package 0 / Core  2 / Thread 0: Valid
CPU   3: APICID   3 / Package 0 / Core  3 / Thread 0: Valid

------[ MSR Registers ]------

CPU Clock (Normal): 2871 MHz
CPU Clock (TSC): 2899 MHz
CPU Multiplier: 29.0x
MSR 0000001B: 0000-0000-FEE0-0900
MSR 0000008B: 0000-0000-0300-000F
MSR C0010015: 0000-0000-0100-0010
MSR C001001F: 0400-4000-0000-0200
MSR C0010055: 0000-0000-0000-0000
MSR C0010058: 0000-0000-E000-0021
MSR C0010061: 0000-0000-0000-0070
MSR C0010062: 0000-0000-0000-0000
MSR C0010063: 0000-0000-0000-0000
MSR C0010064: 8000-01C1-0000-18D0 [29.00x] [1.4000V]
MSR C0010065: 8000-01AD-0000-1EA0 [26.00x] [1.3625V]
MSR C0010066: 8000-0196-0000-2670 [23.00x] [1.3125V]
MSR C0010067: 8000-0181-0000-2E40 [20.00x] [1.2625V]
MSR C0010068: 8000-0173-0000-36B1 [18.00x] [1.2125V]
MSR C0010069: 8000-015A-0000-40C2 [14.00x] [1.1500V]
MSR C001006A: 8000-014A-0000-4A62 [11.00x] [1.0875V]
MSR C001006B: 8000-0138-0000-5683 [ 8.00x] [1.0125V]
MSR C0010070: 0000-0000-0000-0000
MSR C0010071: 0029-6067-4600-18D0 [29.00x] [1.4000V]
MSR C0010140: 0000-0000-0000-0004
MSR C0010141: 0000-0000-0000-0000
MSR C0011023: 0000-0000-1020-0020

PerformanceFrequency = 2831992

Tjmax Temperature = 0 Celsius

APIC Clock = 199.99 MHz
APIC Clock = 200.00 MHz
APIC Clock = 199.99 MHz
APIC Clock = 199.99 MHz
APIC Clock = 200.00 MHz
