------[ Versions ]------

Program Version : AIDA64 Engineer v5.90.4220 Beta
BenchDLL Version: 4.3.753-x64
Windows Version : Microsoft Windows 10 Pro 10.0.15063.138 (64-bit)

------[ CPU Info ]------

CPU Type          : QuadCore AMD Ryzen 5 1500X, 3600 MHz (36 x 100)
CPU Alias         : Summit Ridge
CPU Platform      : Socket AM4
CPU Stepping      : ZP-B1
Instruction Set   : x86, x86-64, MMX, SSE, SSE2, SSE3, SSSE3, SSE4.1, SSE4.2, SSE4A, AVX, AVX2, FMA, AES, SHA
CPUID Manufacturer: AuthenticAMD
CPUID CPU Name    : AMD Ryzen 5 1500X Quad-Core Processor
CPUID Revision    : 00800F11h
Platform ID       : C7h  (Socket AM4)
HTT / CMP Units   : 2 / 4
Max. NUMA Node    : 0

Tjmax Temperature       : 0 Celsius
HTC Temperature Limit   : 115 Celsius
CPU Thermal Design Power: 65 W

------[ Motherboard Info ]------

Motherboard ID      : 63-0100-000001-00101111-091015-Chipset$8A06BG0F_BIOS DATE: 04/07/17 17:12:31 VER: 05.0000C
Motherboard Model   : Gigabyte GA-AB350M-Gaming 3
Motherboard Chipset : AMD B350, AMD K17 SCH, AMD K17 IMC

DMI MB Manufacturer : Gigabyte Technology Co., Ltd.
DMI MB Product      : AB350M-Gaming 3-CF
DMI MB Version      : Default string
DMI MB Serial       : Default string
DMI SYS Manufacturer: Gigabyte Technology Co., Ltd.
DMI SYS Product     : AB350M-Gaming 3
DMI SYS Version     : Default string
DMI SYS Serial      : Default string
DMI BIOS Version    : F4


------[ Logical CPU #0 ]------

allcpu: Package 0 / Core 0 / Thread 0: Valid

CPUID 00000000: 0000000D-68747541-444D4163-69746E65 [AuthenticAMD]
CPUID 00000001: 00800F11-00080800-7ED8320B-178BFBFF
CPUID 00000002: 00000000-00000000-00000000-00000000
CPUID 00000003: 00000000-00000000-00000000-00000000
CPUID 00000005: 00000040-00000040-00000003-00000000
CPUID 00000006: 00000004-00000000-00000001-00000000
CPUID 00000007: 00000000-209C01A9-00000000-00000000
CPUID 00000008: 00000000-00000000-00000000-00000000
CPUID 00000009: 00000000-00000000-00000000-00000000
CPUID 0000000A: 00000000-00000000-00000000-00000000
CPUID 0000000C: 00000000-00000000-00000000-00000000
CPUID 0000000D: 00000007-00000340-00000340-00000000 [SL 00]
CPUID 0000000D: 0000000F-00000340-00000000-00000000 [SL 01]
CPUID 0000000D: 00000100-00000240-00000000-00000000 [SL 02]
CPUID 80000000: 8000001F-68747541-444D4163-69746E65 [AuthenticAMD]
CPUID 80000001: 00800F11-20000000-35C233FF-2FD3FBFF
CPUID 80000002: 20444D41-657A7952-2035206E-30303531 [AMD Ryzen 5 1500]
CPUID 80000003: 75512058-432D6461-2065726F-636F7250 [X Quad-Core Proc]
CPUID 80000004: 6F737365-20202072-20202020-00202020 [essor          ]
CPUID 80000005: FF40FF40-FF40FF40-20080140-40040140
CPUID 80000006: 26006400-66006400-02006140-00808140
CPUID 80000007: 00000000-0000001B-00000000-00006599
CPUID 80000008: 00003030-00000007-00004007-00000000
CPUID 80000009: 00000000-00000000-00000000-00000000
CPUID 8000000A: 00000001-00008000-00000000-0001BCFF
CPUID 8000000B: 00000000-00000000-00000000-00000000
CPUID 8000000C: 00000000-00000000-00000000-00000000
CPUID 8000000D: 00000000-00000000-00000000-00000000
CPUID 8000000E: 00000000-00000000-00000000-00000000
CPUID 8000000F: 00000000-00000000-00000000-00000000
CPUID 80000010: 00000000-00000000-00000000-00000000
CPUID 80000011: 00000000-00000000-00000000-00000000
CPUID 80000012: 00000000-00000000-00000000-00000000
CPUID 80000013: 00000000-00000000-00000000-00000000
CPUID 80000014: 00000000-00000000-00000000-00000000
CPUID 80000015: 00000000-00000000-00000000-00000000
CPUID 80000016: 00000000-00000000-00000000-00000000
CPUID 80000017: 00000000-00000000-00000000-00000000
CPUID 80000018: 00000000-00000000-00000000-00000000
CPUID 80000019: F040F040-00000000-00000000-00000000
CPUID 8000001A: 00000003-00000000-00000000-00000000
CPUID 8000001B: 000003FF-00000000-00000000-00000000
CPUID 8000001C: 00000000-00000000-00000000-00000000
CPUID 8000001D: 00004121-01C0003F-0000003F-00000000 [SL 00]
CPUID 8000001D: 00004122-00C0003F-000000FF-00000000 [SL 01]
CPUID 8000001D: 00004143-01C0003F-000003FF-00000002 [SL 02]
CPUID 8000001D: 0000C163-03C0003F-00001FFF-00000001 [SL 03]
CPUID 8000001E: 00000000-00000100-00000000-00000000
CPUID 8000001F: 00000007-0000016F-0000000F-00000000
CPUID 8FFFFFFF: 00000000-00000000-00000000-00000000

L1    Data Cache:    32 KB,  8-way Associative, 64-byte Line
L1  Instr. Cache:    64 KB,  4-way Associative, 64-byte Line
L2 Unified Cache:   512 KB,  8-way Associative, 64-byte Line
L3 Unified Cache:     8 MB, 16-way Associative, 64-byte Line

------[ Logical CPU #1 ]------

allcpu: Package 0 / Core 0 / Thread 1: Valid, Virtual

CPUID 00000000: 0000000D-68747541-444D4163-69746E65 [AuthenticAMD]
CPUID 00000001: 00800F11-01080800-7ED8320B-178BFBFF
CPUID 00000002: 00000000-00000000-00000000-00000000
CPUID 00000003: 00000000-00000000-00000000-00000000
CPUID 00000005: 00000040-00000040-00000003-00000000
CPUID 00000006: 00000004-00000000-00000001-00000000
CPUID 00000007: 00000000-209C01A9-00000000-00000000
CPUID 00000008: 00000000-00000000-00000000-00000000
CPUID 00000009: 00000000-00000000-00000000-00000000
CPUID 0000000A: 00000000-00000000-00000000-00000000
CPUID 0000000C: 00000000-00000000-00000000-00000000
CPUID 0000000D: 00000007-00000340-00000340-00000000 [SL 00]
CPUID 0000000D: 0000000F-00000340-00000000-00000000 [SL 01]
CPUID 0000000D: 00000100-00000240-00000000-00000000 [SL 02]
CPUID 80000000: 8000001F-68747541-444D4163-69746E65 [AuthenticAMD]
CPUID 80000001: 00800F11-20000000-35C233FF-2FD3FBFF
CPUID 80000002: 20444D41-657A7952-2035206E-30303531 [AMD Ryzen 5 1500]
CPUID 80000003: 75512058-432D6461-2065726F-636F7250 [X Quad-Core Proc]
CPUID 80000004: 6F737365-20202072-20202020-00202020 [essor          ]
CPUID 80000005: FF40FF40-FF40FF40-20080140-40040140
CPUID 80000006: 26006400-66006400-02006140-00808140
CPUID 80000007: 00000000-0000001B-00000000-00006599
CPUID 80000008: 00003030-00000007-00004007-00000000
CPUID 80000009: 00000000-00000000-00000000-00000000
CPUID 8000000A: 00000001-00008000-00000000-0001BCFF
CPUID 8000000B: 00000000-00000000-00000000-00000000
CPUID 8000000C: 00000000-00000000-00000000-00000000
CPUID 8000000D: 00000000-00000000-00000000-00000000
CPUID 8000000E: 00000000-00000000-00000000-00000000
CPUID 8000000F: 00000000-00000000-00000000-00000000
CPUID 80000010: 00000000-00000000-00000000-00000000
CPUID 80000011: 00000000-00000000-00000000-00000000
CPUID 80000012: 00000000-00000000-00000000-00000000
CPUID 80000013: 00000000-00000000-00000000-00000000
CPUID 80000014: 00000000-00000000-00000000-00000000
CPUID 80000015: 00000000-00000000-00000000-00000000
CPUID 80000016: 00000000-00000000-00000000-00000000
CPUID 80000017: 00000000-00000000-00000000-00000000
CPUID 80000018: 00000000-00000000-00000000-00000000
CPUID 80000019: F040F040-00000000-00000000-00000000
CPUID 8000001A: 00000003-00000000-00000000-00000000
CPUID 8000001B: 000003FF-00000000-00000000-00000000
CPUID 8000001C: 00000000-00000000-00000000-00000000
CPUID 8000001D: 00004121-01C0003F-0000003F-00000000 [SL 00]
CPUID 8000001D: 00004122-00C0003F-000000FF-00000000 [SL 01]
CPUID 8000001D: 00004143-01C0003F-000003FF-00000002 [SL 02]
CPUID 8000001D: 0000C163-03C0003F-00001FFF-00000001 [SL 03]
CPUID 8000001E: 00000001-00000100-00000000-00000000
CPUID 8000001F: 00000007-0000016F-0000000F-00000000
CPUID 8FFFFFFF: 00000000-00000000-00000000-00000000

L1    Data Cache:    32 KB,  8-way Associative, 64-byte Line
L1  Instr. Cache:    64 KB,  4-way Associative, 64-byte Line
L2 Unified Cache:   512 KB,  8-way Associative, 64-byte Line
L3 Unified Cache:     8 MB, 16-way Associative, 64-byte Line

------[ Logical CPU #2 ]------

allcpu: Package 0 / Core 1 / Thread 0: Valid

CPUID 00000000: 0000000D-68747541-444D4163-69746E65 [AuthenticAMD]
CPUID 00000001: 00800F11-02080800-7ED8320B-178BFBFF
CPUID 00000002: 00000000-00000000-00000000-00000000
CPUID 00000003: 00000000-00000000-00000000-00000000
CPUID 00000005: 00000040-00000040-00000003-00000000
CPUID 00000006: 00000004-00000000-00000001-00000000
CPUID 00000007: 00000000-209C01A9-00000000-00000000
CPUID 00000008: 00000000-00000000-00000000-00000000
CPUID 00000009: 00000000-00000000-00000000-00000000
CPUID 0000000A: 00000000-00000000-00000000-00000000
CPUID 0000000C: 00000000-00000000-00000000-00000000
CPUID 0000000D: 00000007-00000340-00000340-00000000 [SL 00]
CPUID 0000000D: 0000000F-00000340-00000000-00000000 [SL 01]
CPUID 0000000D: 00000100-00000240-00000000-00000000 [SL 02]
CPUID 80000000: 8000001F-68747541-444D4163-69746E65 [AuthenticAMD]
CPUID 80000001: 00800F11-20000000-35C233FF-2FD3FBFF
CPUID 80000002: 20444D41-657A7952-2035206E-30303531 [AMD Ryzen 5 1500]
CPUID 80000003: 75512058-432D6461-2065726F-636F7250 [X Quad-Core Proc]
CPUID 80000004: 6F737365-20202072-20202020-00202020 [essor          ]
CPUID 80000005: FF40FF40-FF40FF40-20080140-40040140
CPUID 80000006: 26006400-66006400-02006140-00808140
CPUID 80000007: 00000000-0000001B-00000000-00006599
CPUID 80000008: 00003030-00000007-00004007-00000000
CPUID 80000009: 00000000-00000000-00000000-00000000
CPUID 8000000A: 00000001-00008000-00000000-0001BCFF
CPUID 8000000B: 00000000-00000000-00000000-00000000
CPUID 8000000C: 00000000-00000000-00000000-00000000
CPUID 8000000D: 00000000-00000000-00000000-00000000
CPUID 8000000E: 00000000-00000000-00000000-00000000
CPUID 8000000F: 00000000-00000000-00000000-00000000
CPUID 80000010: 00000000-00000000-00000000-00000000
CPUID 80000011: 00000000-00000000-00000000-00000000
CPUID 80000012: 00000000-00000000-00000000-00000000
CPUID 80000013: 00000000-00000000-00000000-00000000
CPUID 80000014: 00000000-00000000-00000000-00000000
CPUID 80000015: 00000000-00000000-00000000-00000000
CPUID 80000016: 00000000-00000000-00000000-00000000
CPUID 80000017: 00000000-00000000-00000000-00000000
CPUID 80000018: 00000000-00000000-00000000-00000000
CPUID 80000019: F040F040-00000000-00000000-00000000
CPUID 8000001A: 00000003-00000000-00000000-00000000
CPUID 8000001B: 000003FF-00000000-00000000-00000000
CPUID 8000001C: 00000000-00000000-00000000-00000000
CPUID 8000001D: 00004121-01C0003F-0000003F-00000000 [SL 00]
CPUID 8000001D: 00004122-00C0003F-000000FF-00000000 [SL 01]
CPUID 8000001D: 00004143-01C0003F-000003FF-00000002 [SL 02]
CPUID 8000001D: 0000C163-03C0003F-00001FFF-00000001 [SL 03]
CPUID 8000001E: 00000002-00000101-00000000-00000000
CPUID 8000001F: 00000007-0000016F-0000000F-00000000
CPUID 8FFFFFFF: 00000000-00000000-00000000-00000000

L1    Data Cache:    32 KB,  8-way Associative, 64-byte Line
L1  Instr. Cache:    64 KB,  4-way Associative, 64-byte Line
L2 Unified Cache:   512 KB,  8-way Associative, 64-byte Line
L3 Unified Cache:     8 MB, 16-way Associative, 64-byte Line

------[ Logical CPU #3 ]------

allcpu: Package 0 / Core 1 / Thread 1: Valid, Virtual

CPUID 00000000: 0000000D-68747541-444D4163-69746E65 [AuthenticAMD]
CPUID 00000001: 00800F11-03080800-7ED8320B-178BFBFF
CPUID 00000002: 00000000-00000000-00000000-00000000
CPUID 00000003: 00000000-00000000-00000000-00000000
CPUID 00000005: 00000040-00000040-00000003-00000000
CPUID 00000006: 00000004-00000000-00000001-00000000
CPUID 00000007: 00000000-209C01A9-00000000-00000000
CPUID 00000008: 00000000-00000000-00000000-00000000
CPUID 00000009: 00000000-00000000-00000000-00000000
CPUID 0000000A: 00000000-00000000-00000000-00000000
CPUID 0000000C: 00000000-00000000-00000000-00000000
CPUID 0000000D: 00000007-00000340-00000340-00000000 [SL 00]
CPUID 0000000D: 0000000F-00000340-00000000-00000000 [SL 01]
CPUID 0000000D: 00000100-00000240-00000000-00000000 [SL 02]
CPUID 80000000: 8000001F-68747541-444D4163-69746E65 [AuthenticAMD]
CPUID 80000001: 00800F11-20000000-35C233FF-2FD3FBFF
CPUID 80000002: 20444D41-657A7952-2035206E-30303531 [AMD Ryzen 5 1500]
CPUID 80000003: 75512058-432D6461-2065726F-636F7250 [X Quad-Core Proc]
CPUID 80000004: 6F737365-20202072-20202020-00202020 [essor          ]
CPUID 80000005: FF40FF40-FF40FF40-20080140-40040140
CPUID 80000006: 26006400-66006400-02006140-00808140
CPUID 80000007: 00000000-0000001B-00000000-00006599
CPUID 80000008: 00003030-00000007-00004007-00000000
CPUID 80000009: 00000000-00000000-00000000-00000000
CPUID 8000000A: 00000001-00008000-00000000-0001BCFF
CPUID 8000000B: 00000000-00000000-00000000-00000000
CPUID 8000000C: 00000000-00000000-00000000-00000000
CPUID 8000000D: 00000000-00000000-00000000-00000000
CPUID 8000000E: 00000000-00000000-00000000-00000000
CPUID 8000000F: 00000000-00000000-00000000-00000000
CPUID 80000010: 00000000-00000000-00000000-00000000
CPUID 80000011: 00000000-00000000-00000000-00000000
CPUID 80000012: 00000000-00000000-00000000-00000000
CPUID 80000013: 00000000-00000000-00000000-00000000
CPUID 80000014: 00000000-00000000-00000000-00000000
CPUID 80000015: 00000000-00000000-00000000-00000000
CPUID 80000016: 00000000-00000000-00000000-00000000
CPUID 80000017: 00000000-00000000-00000000-00000000
CPUID 80000018: 00000000-00000000-00000000-00000000
CPUID 80000019: F040F040-00000000-00000000-00000000
CPUID 8000001A: 00000003-00000000-00000000-00000000
CPUID 8000001B: 000003FF-00000000-00000000-00000000
CPUID 8000001C: 00000000-00000000-00000000-00000000
CPUID 8000001D: 00004121-01C0003F-0000003F-00000000 [SL 00]
CPUID 8000001D: 00004122-00C0003F-000000FF-00000000 [SL 01]
CPUID 8000001D: 00004143-01C0003F-000003FF-00000002 [SL 02]
CPUID 8000001D: 0000C163-03C0003F-00001FFF-00000001 [SL 03]
CPUID 8000001E: 00000003-00000101-00000000-00000000
CPUID 8000001F: 00000007-0000016F-0000000F-00000000
CPUID 8FFFFFFF: 00000000-00000000-00000000-00000000

L1    Data Cache:    32 KB,  8-way Associative, 64-byte Line
L1  Instr. Cache:    64 KB,  4-way Associative, 64-byte Line
L2 Unified Cache:   512 KB,  8-way Associative, 64-byte Line
L3 Unified Cache:     8 MB, 16-way Associative, 64-byte Line

------[ Logical CPU #4 ]------

allcpu: Package 0 / Core 2 / Thread 0: Valid

CPUID 00000000: 0000000D-68747541-444D4163-69746E65 [AuthenticAMD]
CPUID 00000001: 00800F11-08080800-7ED8320B-178BFBFF
CPUID 00000002: 00000000-00000000-00000000-00000000
CPUID 00000003: 00000000-00000000-00000000-00000000
CPUID 00000005: 00000040-00000040-00000003-00000000
CPUID 00000006: 00000004-00000000-00000001-00000000
CPUID 00000007: 00000000-209C01A9-00000000-00000000
CPUID 00000008: 00000000-00000000-00000000-00000000
CPUID 00000009: 00000000-00000000-00000000-00000000
CPUID 0000000A: 00000000-00000000-00000000-00000000
CPUID 0000000C: 00000000-00000000-00000000-00000000
CPUID 0000000D: 00000007-00000340-00000340-00000000 [SL 00]
CPUID 0000000D: 0000000F-00000340-00000000-00000000 [SL 01]
CPUID 0000000D: 00000100-00000240-00000000-00000000 [SL 02]
CPUID 80000000: 8000001F-68747541-444D4163-69746E65 [AuthenticAMD]
CPUID 80000001: 00800F11-20000000-35C233FF-2FD3FBFF
CPUID 80000002: 20444D41-657A7952-2035206E-30303531 [AMD Ryzen 5 1500]
CPUID 80000003: 75512058-432D6461-2065726F-636F7250 [X Quad-Core Proc]
CPUID 80000004: 6F737365-20202072-20202020-00202020 [essor          ]
CPUID 80000005: FF40FF40-FF40FF40-20080140-40040140
CPUID 80000006: 26006400-66006400-02006140-00808140
CPUID 80000007: 00000000-0000001B-00000000-00006599
CPUID 80000008: 00003030-00000007-00004007-00000000
CPUID 80000009: 00000000-00000000-00000000-00000000
CPUID 8000000A: 00000001-00008000-00000000-0001BCFF
CPUID 8000000B: 00000000-00000000-00000000-00000000
CPUID 8000000C: 00000000-00000000-00000000-00000000
CPUID 8000000D: 00000000-00000000-00000000-00000000
CPUID 8000000E: 00000000-00000000-00000000-00000000
CPUID 8000000F: 00000000-00000000-00000000-00000000
CPUID 80000010: 00000000-00000000-00000000-00000000
CPUID 80000011: 00000000-00000000-00000000-00000000
CPUID 80000012: 00000000-00000000-00000000-00000000
CPUID 80000013: 00000000-00000000-00000000-00000000
CPUID 80000014: 00000000-00000000-00000000-00000000
CPUID 80000015: 00000000-00000000-00000000-00000000
CPUID 80000016: 00000000-00000000-00000000-00000000
CPUID 80000017: 00000000-00000000-00000000-00000000
CPUID 80000018: 00000000-00000000-00000000-00000000
CPUID 80000019: F040F040-00000000-00000000-00000000
CPUID 8000001A: 00000003-00000000-00000000-00000000
CPUID 8000001B: 000003FF-00000000-00000000-00000000
CPUID 8000001C: 00000000-00000000-00000000-00000000
CPUID 8000001D: 00004121-01C0003F-0000003F-00000000 [SL 00]
CPUID 8000001D: 00004122-00C0003F-000000FF-00000000 [SL 01]
CPUID 8000001D: 00004143-01C0003F-000003FF-00000002 [SL 02]
CPUID 8000001D: 0000C163-03C0003F-00001FFF-00000001 [SL 03]
CPUID 8000001E: 00000008-00000104-00000000-00000000
CPUID 8000001F: 00000007-0000016F-0000000F-00000000
CPUID 8FFFFFFF: 00000000-00000000-00000000-00000000

L1    Data Cache:    32 KB,  8-way Associative, 64-byte Line
L1  Instr. Cache:    64 KB,  4-way Associative, 64-byte Line
L2 Unified Cache:   512 KB,  8-way Associative, 64-byte Line
L3 Unified Cache:     8 MB, 16-way Associative, 64-byte Line

------[ Logical CPU #5 ]------

allcpu: Package 0 / Core 2 / Thread 1: Valid, Virtual

CPUID 00000000: 0000000D-68747541-444D4163-69746E65 [AuthenticAMD]
CPUID 00000001: 00800F11-09080800-7ED8320B-178BFBFF
CPUID 00000002: 00000000-00000000-00000000-00000000
CPUID 00000003: 00000000-00000000-00000000-00000000
CPUID 00000005: 00000040-00000040-00000003-00000000
CPUID 00000006: 00000004-00000000-00000001-00000000
CPUID 00000007: 00000000-209C01A9-00000000-00000000
CPUID 00000008: 00000000-00000000-00000000-00000000
CPUID 00000009: 00000000-00000000-00000000-00000000
CPUID 0000000A: 00000000-00000000-00000000-00000000
CPUID 0000000C: 00000000-00000000-00000000-00000000
CPUID 0000000D: 00000007-00000340-00000340-00000000 [SL 00]
CPUID 0000000D: 0000000F-00000340-00000000-00000000 [SL 01]
CPUID 0000000D: 00000100-00000240-00000000-00000000 [SL 02]
CPUID 80000000: 8000001F-68747541-444D4163-69746E65 [AuthenticAMD]
CPUID 80000001: 00800F11-20000000-35C233FF-2FD3FBFF
CPUID 80000002: 20444D41-657A7952-2035206E-30303531 [AMD Ryzen 5 1500]
CPUID 80000003: 75512058-432D6461-2065726F-636F7250 [X Quad-Core Proc]
CPUID 80000004: 6F737365-20202072-20202020-00202020 [essor          ]
CPUID 80000005: FF40FF40-FF40FF40-20080140-40040140
CPUID 80000006: 26006400-66006400-02006140-00808140
CPUID 80000007: 00000000-0000001B-00000000-00006599
CPUID 80000008: 00003030-00000007-00004007-00000000
CPUID 80000009: 00000000-00000000-00000000-00000000
CPUID 8000000A: 00000001-00008000-00000000-0001BCFF
CPUID 8000000B: 00000000-00000000-00000000-00000000
CPUID 8000000C: 00000000-00000000-00000000-00000000
CPUID 8000000D: 00000000-00000000-00000000-00000000
CPUID 8000000E: 00000000-00000000-00000000-00000000
CPUID 8000000F: 00000000-00000000-00000000-00000000
CPUID 80000010: 00000000-00000000-00000000-00000000
CPUID 80000011: 00000000-00000000-00000000-00000000
CPUID 80000012: 00000000-00000000-00000000-00000000
CPUID 80000013: 00000000-00000000-00000000-00000000
CPUID 80000014: 00000000-00000000-00000000-00000000
CPUID 80000015: 00000000-00000000-00000000-00000000
CPUID 80000016: 00000000-00000000-00000000-00000000
CPUID 80000017: 00000000-00000000-00000000-00000000
CPUID 80000018: 00000000-00000000-00000000-00000000
CPUID 80000019: F040F040-00000000-00000000-00000000
CPUID 8000001A: 00000003-00000000-00000000-00000000
CPUID 8000001B: 000003FF-00000000-00000000-00000000
CPUID 8000001C: 00000000-00000000-00000000-00000000
CPUID 8000001D: 00004121-01C0003F-0000003F-00000000 [SL 00]
CPUID 8000001D: 00004122-00C0003F-000000FF-00000000 [SL 01]
CPUID 8000001D: 00004143-01C0003F-000003FF-00000002 [SL 02]
CPUID 8000001D: 0000C163-03C0003F-00001FFF-00000001 [SL 03]
CPUID 8000001E: 00000009-00000104-00000000-00000000
CPUID 8000001F: 00000007-0000016F-0000000F-00000000
CPUID 8FFFFFFF: 00000000-00000000-00000000-00000000

L1    Data Cache:    32 KB,  8-way Associative, 64-byte Line
L1  Instr. Cache:    64 KB,  4-way Associative, 64-byte Line
L2 Unified Cache:   512 KB,  8-way Associative, 64-byte Line
L3 Unified Cache:     8 MB, 16-way Associative, 64-byte Line

------[ Logical CPU #6 ]------

allcpu: Package 0 / Core 3 / Thread 0: Valid

CPUID 00000000: 0000000D-68747541-444D4163-69746E65 [AuthenticAMD]
CPUID 00000001: 00800F11-0A080800-7ED8320B-178BFBFF
CPUID 00000002: 00000000-00000000-00000000-00000000
CPUID 00000003: 00000000-00000000-00000000-00000000
CPUID 00000005: 00000040-00000040-00000003-00000000
CPUID 00000006: 00000004-00000000-00000001-00000000
CPUID 00000007: 00000000-209C01A9-00000000-00000000
CPUID 00000008: 00000000-00000000-00000000-00000000
CPUID 00000009: 00000000-00000000-00000000-00000000
CPUID 0000000A: 00000000-00000000-00000000-00000000
CPUID 0000000C: 00000000-00000000-00000000-00000000
CPUID 0000000D: 00000007-00000340-00000340-00000000 [SL 00]
CPUID 0000000D: 0000000F-00000340-00000000-00000000 [SL 01]
CPUID 0000000D: 00000100-00000240-00000000-00000000 [SL 02]
CPUID 80000000: 8000001F-68747541-444D4163-69746E65 [AuthenticAMD]
CPUID 80000001: 00800F11-20000000-35C233FF-2FD3FBFF
CPUID 80000002: 20444D41-657A7952-2035206E-30303531 [AMD Ryzen 5 1500]
CPUID 80000003: 75512058-432D6461-2065726F-636F7250 [X Quad-Core Proc]
CPUID 80000004: 6F737365-20202072-20202020-00202020 [essor          ]
CPUID 80000005: FF40FF40-FF40FF40-20080140-40040140
CPUID 80000006: 26006400-66006400-02006140-00808140
CPUID 80000007: 00000000-0000001B-00000000-00006599
CPUID 80000008: 00003030-00000007-00004007-00000000
CPUID 80000009: 00000000-00000000-00000000-00000000
CPUID 8000000A: 00000001-00008000-00000000-0001BCFF
CPUID 8000000B: 00000000-00000000-00000000-00000000
CPUID 8000000C: 00000000-00000000-00000000-00000000
CPUID 8000000D: 00000000-00000000-00000000-00000000
CPUID 8000000E: 00000000-00000000-00000000-00000000
CPUID 8000000F: 00000000-00000000-00000000-00000000
CPUID 80000010: 00000000-00000000-00000000-00000000
CPUID 80000011: 00000000-00000000-00000000-00000000
CPUID 80000012: 00000000-00000000-00000000-00000000
CPUID 80000013: 00000000-00000000-00000000-00000000
CPUID 80000014: 00000000-00000000-00000000-00000000
CPUID 80000015: 00000000-00000000-00000000-00000000
CPUID 80000016: 00000000-00000000-00000000-00000000
CPUID 80000017: 00000000-00000000-00000000-00000000
CPUID 80000018: 00000000-00000000-00000000-00000000
CPUID 80000019: F040F040-00000000-00000000-00000000
CPUID 8000001A: 00000003-00000000-00000000-00000000
CPUID 8000001B: 000003FF-00000000-00000000-00000000
CPUID 8000001C: 00000000-00000000-00000000-00000000
CPUID 8000001D: 00004121-01C0003F-0000003F-00000000 [SL 00]
CPUID 8000001D: 00004122-00C0003F-000000FF-00000000 [SL 01]
CPUID 8000001D: 00004143-01C0003F-000003FF-00000002 [SL 02]
CPUID 8000001D: 0000C163-03C0003F-00001FFF-00000001 [SL 03]
CPUID 8000001E: 0000000A-00000105-00000000-00000000
CPUID 8000001F: 00000007-0000016F-0000000F-00000000
CPUID 8FFFFFFF: 00000000-00000000-00000000-00000000

L1    Data Cache:    32 KB,  8-way Associative, 64-byte Line
L1  Instr. Cache:    64 KB,  4-way Associative, 64-byte Line
L2 Unified Cache:   512 KB,  8-way Associative, 64-byte Line
L3 Unified Cache:     8 MB, 16-way Associative, 64-byte Line

------[ Logical CPU #7 ]------

allcpu: Package 0 / Core 3 / Thread 1: Valid, Virtual

CPUID 00000000: 0000000D-68747541-444D4163-69746E65 [AuthenticAMD]
CPUID 00000001: 00800F11-0B080800-7ED8320B-178BFBFF
CPUID 00000002: 00000000-00000000-00000000-00000000
CPUID 00000003: 00000000-00000000-00000000-00000000
CPUID 00000005: 00000040-00000040-00000003-00000000
CPUID 00000006: 00000004-00000000-00000001-00000000
CPUID 00000007: 00000000-209C01A9-00000000-00000000
CPUID 00000008: 00000000-00000000-00000000-00000000
CPUID 00000009: 00000000-00000000-00000000-00000000
CPUID 0000000A: 00000000-00000000-00000000-00000000
CPUID 0000000C: 00000000-00000000-00000000-00000000
CPUID 0000000D: 00000007-00000340-00000340-00000000 [SL 00]
CPUID 0000000D: 0000000F-00000340-00000000-00000000 [SL 01]
CPUID 0000000D: 00000100-00000240-00000000-00000000 [SL 02]
CPUID 80000000: 8000001F-68747541-444D4163-69746E65 [AuthenticAMD]
CPUID 80000001: 00800F11-20000000-35C233FF-2FD3FBFF
CPUID 80000002: 20444D41-657A7952-2035206E-30303531 [AMD Ryzen 5 1500]
CPUID 80000003: 75512058-432D6461-2065726F-636F7250 [X Quad-Core Proc]
CPUID 80000004: 6F737365-20202072-20202020-00202020 [essor          ]
CPUID 80000005: FF40FF40-FF40FF40-20080140-40040140
CPUID 80000006: 26006400-66006400-02006140-00808140
CPUID 80000007: 00000000-0000001B-00000000-00006599
CPUID 80000008: 00003030-00000007-00004007-00000000
CPUID 80000009: 00000000-00000000-00000000-00000000
CPUID 8000000A: 00000001-00008000-00000000-0001BCFF
CPUID 8000000B: 00000000-00000000-00000000-00000000
CPUID 8000000C: 00000000-00000000-00000000-00000000
CPUID 8000000D: 00000000-00000000-00000000-00000000
CPUID 8000000E: 00000000-00000000-00000000-00000000
CPUID 8000000F: 00000000-00000000-00000000-00000000
CPUID 80000010: 00000000-00000000-00000000-00000000
CPUID 80000011: 00000000-00000000-00000000-00000000
CPUID 80000012: 00000000-00000000-00000000-00000000
CPUID 80000013: 00000000-00000000-00000000-00000000
CPUID 80000014: 00000000-00000000-00000000-00000000
CPUID 80000015: 00000000-00000000-00000000-00000000
CPUID 80000016: 00000000-00000000-00000000-00000000
CPUID 80000017: 00000000-00000000-00000000-00000000
CPUID 80000018: 00000000-00000000-00000000-00000000
CPUID 80000019: F040F040-00000000-00000000-00000000
CPUID 8000001A: 00000003-00000000-00000000-00000000
CPUID 8000001B: 000003FF-00000000-00000000-00000000
CPUID 8000001C: 00000000-00000000-00000000-00000000
CPUID 8000001D: 00004121-01C0003F-0000003F-00000000 [SL 00]
CPUID 8000001D: 00004122-00C0003F-000000FF-00000000 [SL 01]
CPUID 8000001D: 00004143-01C0003F-000003FF-00000002 [SL 02]
CPUID 8000001D: 0000C163-03C0003F-00001FFF-00000001 [SL 03]
CPUID 8000001E: 0000000B-00000105-00000000-00000000
CPUID 8000001F: 00000007-0000016F-0000000F-00000000
CPUID 8FFFFFFF: 00000000-00000000-00000000-00000000

L1    Data Cache:    32 KB,  8-way Associative, 64-byte Line
L1  Instr. Cache:    64 KB,  4-way Associative, 64-byte Line
L2 Unified Cache:   512 KB,  8-way Associative, 64-byte Line
L3 Unified Cache:     8 MB, 16-way Associative, 64-byte Line

------[ All CPUs ]------

CPU   0: APICID   0 / Package 0 / Core  0 / Thread 0: Valid
CPU   1: APICID   1 / Package 0 / Core  0 / Thread 1: Valid, Virtual
CPU   2: APICID   2 / Package 0 / Core  1 / Thread 0: Valid
CPU   3: APICID   3 / Package 0 / Core  1 / Thread 1: Valid, Virtual
CPU   4: APICID   8 / Package 0 / Core  2 / Thread 0: Valid
CPU   5: APICID   9 / Package 0 / Core  2 / Thread 1: Valid, Virtual
CPU   6: APICID  10 / Package 0 / Core  3 / Thread 0: Valid
CPU   7: APICID  11 / Package 0 / Core  3 / Thread 1: Valid, Virtual

------[ MSR Registers ]------

CPU Clock (Normal): 3593 MHz
CPU Clock (TSC): 3493 MHz
CPU Multiplier: 36.0x
CPB PStates: 0
MSR 0000001B: 0000-0000-FEE0-0900
MSR 0000008B: 0000-0000-0800-111C
MSR 000000E7: 0000-0000-00C9-1765 [S200]
MSR 000000E7: 0000-0000-0002-9509 [S200]
MSR 000000E7: 0000-0000-0001-0CA7
MSR 000000E8: 0000-0000-0001-7818 [S200]
MSR 000000E8: 0000-0000-0002-EF48 [S200]
MSR 000000E8: 0000-0000-0001-D604
MSR C0010004: 0000-0000-1468-6772
MSR C0010005: 0000-0000-0000-0000
MSR C0010006: 0000-0000-0000-0000
MSR C0010007: 0000-0000-0000-0000
MSR C0010015: 0000-0000-0900-0011
MSR C001001F: 0000-0000-0000-0000
MSR C0010055: 0000-0000-0000-0000
MSR C0010058: 0000-0000-F800-0019
MSR C0010061: 0000-0000-0000-0020
MSR C0010062: 0000-0000-0000-0000
MSR C0010063: 0000-0000-0000-0000
MSR C0010064: 8000-0000-48CC-888C [35.00x] [1.2375 V] [ 3.50 A] [PState P0]
MSR C0010065: 8000-0000-4790-0878 [30.00x] [1.1500 V] [ 3.00 A] [PState P1]
MSR C0010066: 8000-0000-43DA-907C [15.50x] [0.8875 V] [ 1.50 A] [PState P2]
MSR C0010067: 0000-0000-0000-0000
MSR C0010068: 0000-0000-0000-0000
MSR C0010069: 0000-0000-0000-0000
MSR C001006A: 0000-0000-0000-0000
MSR C001006B: 0000-0000-0000-0000
MSR C0010070: < FAILED >
MSR C0010293: 0000-0000-0011-C890 [36.00x] [1.1062V]
MSR C0010293: 0000-0000-0011-C890 [36.00x] [1.1062V]
MSR C0010293: 0000-0000-0011-C890 [36.00x] [1.1062V]
MSR C0010293: 0000-0000-0011-C89C [39.00x] [1.1062V]
MSR C0010293: 0000-0000-0011-C89C [39.00x] [1.1062V]
MSR C0010140: 0000-0000-0000-0000
MSR C0010141: 0000-0000-0000-0000
MSR C0010290: 0000-0000-0000-0000
MSR C0010292: 0000-0001-0000-0052
MSR C0010293: 0000-0000-0011-C89C
MSR C0010294: 1001-F47F-000F-0912
MSR C0010296: 0000-0000-0048-4848
MSR C0010299: 0000-0000-000A-1003
MSR C001029A: 0000-0000-085E-CDE1 [S200]
MSR C001029A: 0000-0000-085F-5B3C [S200]
MSR C001029A: 0000-0000-085F-D22D
MSR C001029B: 0000-0000-33F6-34C8 [S200]
MSR C001029B: 0000-0000-33FA-25F4 [S200]
MSR C001029B: 0000-0000-33FD-F990
MSR C0011023: 0002-2000-0000-0000

PerformanceFrequency = 3411566

CPU Clock M.Method = 6  (APIC K10)
PM Timer Address   = 2056  (0808h)

APIC Clock = 99.80 MHz  (AT = 52303 / TT = 15007 / try = 1 / SKL = 0.00 MHz)
APIC Clock = 99.80 MHz  (AT = 52303 / TT = 15008 / try = 1 / SKL = 0.00 MHz)
APIC Clock = 99.81 MHz  (AT = 52307 / TT = 15008 / try = 1 / SKL = 0.00 MHz)
APIC Clock = 99.80 MHz  (AT = 52311 / TT = 15010 / try = 1 / SKL = 0.00 MHz)
APIC Clock = 99.80 MHz  (AT = 52307 / TT = 15009 / try = 1 / SKL = 0.00 MHz)

CPU Clock = 3892.34 MHz / TSC Clock = 3493.44 MHz / CPU Mul = 39.00x
CPU Clock = 3592.97 MHz / TSC Clock = 3493.44 MHz / CPU Mul = 36.00x
CPU Clock = 3892.27 MHz / TSC Clock = 3493.40 MHz / CPU Mul = 39.00x
CPU Clock = 3592.79 MHz / TSC Clock = 3493.42 MHz / CPU Mul = 36.00x
CPU Clock = 3592.90 MHz / TSC Clock = 3493.47 MHz / CPU Mul = 36.00x

CPU Clock Max = 3592.80 MHz / TSC Clock = 3493.45 MHz / CPU Mul = 36.00x
CPU Clock Max = 3592.93 MHz / TSC Clock = 3493.41 MHz / CPU Mul = 36.00x
CPU Clock Max = 3892.31 MHz / TSC Clock = 3493.44 MHz / CPU Mul = 39.00x
CPU Clock Max = 3892.23 MHz / TSC Clock = 3493.49 MHz / CPU Mul = 39.00x
CPU Clock Max = 3892.49 MHz / TSC Clock = 3493.45 MHz / CPU Mul = 39.00x

------[ APIC Base at 00000000-FEE00000 ]------

  0000  00 00 00 00 00 00 00 00 00 00 00 00 00 00 00 00 
  0010  00 00 00 00 00 00 00 00 00 00 00 00 00 00 00 00 
  0020  00 00 00 00 00 00 00 00 00 00 00 00 00 00 00 00 
  0030  10 00 05 80 10 00 05 80 10 00 05 80 10 00 05 80 
  0040  00 00 00 00 00 00 00 00 00 00 00 00 00 00 00 00 
  0050  00 00 00 00 00 00 00 00 00 00 00 00 00 00 00 00 
  0060  00 00 00 00 00 00 00 00 00 00 00 00 00 00 00 00 
  0070  00 00 00 00 00 00 00 00 00 00 00 00 00 00 00 00 
  0080  00 00 00 00 00 00 00 00 00 00 00 00 00 00 00 00 
  0090  00 00 00 00 00 00 00 00 00 00 00 00 00 00 00 00 
  00A0  00 00 00 00 00 00 00 00 00 00 00 00 00 00 00 00 
  00B0  00 00 00 00 00 00 00 00 00 00 00 00 00 00 00 00 
  00C0  00 00 00 00 00 00 00 00 00 00 00 00 00 00 00 00 
  00D0  00 00 00 00 00 00 00 00 00 00 00 00 00 00 00 00 
  00E0  FF FF FF FF FF FF FF FF FF FF FF FF FF FF FF FF 
  00F0  DF 01 00 00 DF 01 00 00 DF 01 00 00 DF 01 00 00 
  0100  00 00 00 00 00 00 00 00 00 00 00 00 00 00 00 00 
  0110  00 00 00 00 00 00 00 00 00 00 00 00 00 00 00 00 
  0120  00 00 00 00 00 00 00 00 00 00 00 00 00 00 00 00 
  0130  00 00 00 00 00 00 00 00 00 00 00 00 00 00 00 00 
  0140  00 00 00 00 00 00 00 00 00 00 00 00 00 00 00 00 
  0150  00 00 00 00 00 00 00 00 00 00 00 00 00 00 00 00 
  0160  00 00 00 00 00 00 00 00 00 00 00 00 00 00 00 00 
  0170  00 00 00 00 00 00 00 00 00 00 00 00 00 00 00 00 
  0180  00 00 00 00 00 00 00 00 00 00 00 00 00 00 00 00 
  0190  00 00 00 00 00 00 00 00 00 00 00 00 00 00 00 00 
  01A0  00 00 00 00 00 00 00 00 00 00 00 00 00 00 00 00 
  01B0  00 00 05 00 00 00 05 00 00 00 05 00 00 00 05 00 
  01C0  00 00 04 00 00 00 04 00 00 00 04 00 00 00 04 00 
  01D0  01 00 00 00 01 00 00 00 01 00 00 00 01 00 00 00 
  01E0  00 00 00 00 00 00 00 00 00 00 00 00 00 00 00 00 
  01F0  00 00 00 00 00 00 00 00 00 00 00 00 00 00 00 00 
  0200  00 00 00 00 00 00 00 00 00 00 00 00 00 00 00 00 
  0210  00 00 00 00 00 00 00 00 00 00 00 00 00 00 00 00 
  0220  00 00 00 00 00 00 00 00 00 00 00 00 00 00 00 00 
  0230  00 00 00 00 00 00 00 00 00 00 00 00 00 00 00 00 
  0240  00 00 00 00 00 00 00 00 00 00 00 00 00 00 00 00 
  0250  00 00 00 00 00 00 00 00 00 00 00 00 00 00 00 00 
  0260  00 00 00 00 00 00 00 00 00 00 00 00 00 00 00 00 
  0270  00 00 00 00 00 00 00 00 00 00 00 00 00 00 00 00 
  0280  80 00 00 00 80 00 00 00 80 00 00 00 80 00 00 00 
  0290  00 00 00 00 00 00 00 00 00 00 00 00 00 00 00 00 
  02A0  00 00 00 00 00 00 00 00 00 00 00 00 00 00 00 00 
  02B0  00 00 00 00 00 00 00 00 00 00 00 00 00 00 00 00 
  02C0  00 00 00 00 00 00 00 00 00 00 00 00 00 00 00 00 
  02D0  00 00 00 00 00 00 00 00 00 00 00 00 00 00 00 00 
  02E0  00 00 00 00 00 00 00 00 00 00 00 00 00 00 00 00 
  02F0  00 00 00 00 00 00 00 00 00 00 00 00 00 00 00 00 
  0300  2F 00 00 00 2F 00 00 00 2F 00 00 00 2F 00 00 00 
  0310  00 00 00 03 00 00 00 03 00 00 00 03 00 00 00 03 
  0320  D1 00 03 00 D1 00 03 00 D1 00 03 00 D1 00 03 00 
  0330  00 00 01 00 00 00 01 00 00 00 01 00 00 00 01 00 
  0340  FE 00 00 00 FE 00 00 00 FE 00 00 00 FE 00 00 00 
  0350  D8 00 01 00 D8 00 01 00 D8 00 01 00 D8 00 01 00 
  0360  00 04 00 00 00 04 00 00 00 04 00 00 00 04 00 00 
  0370  E2 00 00 00 E2 00 00 00 E2 00 00 00 E2 00 00 00 
  0380  00 00 00 00 00 00 00 00 00 00 00 00 00 00 00 00 
  0390  00 00 00 00 00 00 00 00 00 00 00 00 00 00 00 00 
  03A0  00 00 00 00 00 00 00 00 00 00 00 00 00 00 00 00 
  03B0  00 00 00 00 00 00 00 00 00 00 00 00 00 00 00 00 
  03C0  00 00 00 00 00 00 00 00 00 00 00 00 00 00 00 00 
  03D0  00 00 00 00 00 00 00 00 00 00 00 00 00 00 00 00 
  03E0  0A 00 00 00 0A 00 00 00 0A 00 00 00 0A 00 00 00 
  03F0  00 00 00 00 00 00 00 00 00 00 00 00 00 00 00 00 
