------[ Versions ]------

Program Version : EVEREST v4.60.1628 Beta
BenchDLL Version: 2.4.257.0

------[ CPU Info ]------

CPU Type           : AMD Athlon XP, 1400 MHz (10.5 x 133) 1600+
CPU Alias          : Palomino
CPU Platform       : Socket A
CPU Stepping       : A5
Instruction Set    : x86, MMX, 3DNow!, SSE
CPUID Manufacturer : AuthenticAMD
CPUID CPU Name     : Athlon XP (Palomin?00+
CPUID Revision     : 00000662h
Platform ID        : D1h  (Socket A)

------[ Logical CPU #0 ]------

allcpu: Valid

CPUID 00000000: 00000001-68747541-444D4163-69746E65
CPUID 00000001: 00000662-00000000-00000000-0383F9FF
CPUID 80000000: 80000008-68747541-444D4163-69746E65
CPUID 80000001: 00000762-00000000-00000000-C1C3F9FF
CPUID 80000002: 6C687441-58206E6F-50282050-6D6F6C61
CPUID 80000003: 3F7F6E69-002B3030-00000000-00000000
CPUID 80000004: 00000000-00000000-00000000-00000000
CPUID 80000005: 0408FF08-FF20FF10-40020140-40020140
CPUID 80000006: 00000000-41004100-01008140-00000000
CPUID 80000007: 00000000-00000000-00000000-00000001
CPUID 80000008: 00002022-00000000-00000000-00000000

------[ MSR Registers ]------

MSR 0000001B: 0000-0000-FEE0-0100
MSR C0010015: 0000-0000-0F00-1008

PerformanceFrequency = 3579545

Tjmax Temperature = 0 Celsius
