------[ Versions ]------

Program Version : AIDA64 Engineer v5.95.4512 Beta
BenchDLL Version: 4.3.770-x64
Windows Version : Microsoft Windows 10 Home 10.0.15063.786 (64-bit)

------[ CPU Info ]------

CPU Type          : Mobile QuadCore AMD Ryzen 5 2500U, 2400 MHz (24 x 100)
CPU Alias         : Raven Ridge
CPU Platform      : Socket FP5
CPU Stepping      : RV-B0
Instruction Set   : x86, x86-64, MMX, SSE, SSE2, SSE3, SSSE3, SSE4.1, SSE4.2, SSE4A, AVX, AVX2, FMA, AES, SHA
CPUID Manufacturer: AuthenticAMD
CPUID CPU Name    : AMD Ryzen 5 2500U with Radeon Vega Mobile Gfx
CPUID Revision    : 00810F10h
Platform ID       : D6h  (Socket FP5)
HTT / CMP Units   : 2 / 4
Max. NUMA Node    : 0

Tjmax Temperature       : 0 Celsius
HTC Temperature Limit   : 115 Celsius
CPU Thermal Design Power: 15 W

------[ Motherboard Info ]------

Motherboard ID      : <DMI>
Motherboard Model   : HP ENVY x360 Convertible 15m-bq1xx
Motherboard Chipset : AMD K17.1 FCH, AMD K17.1 IMC

DMI MB Manufacturer : HP
DMI MB Product      : 83C6
DMI MB Version      : 63.17
DMI MB Serial       : PGSRH1A0GA130A
DMI SYS Manufacturer: HP
DMI SYS Product     : HP ENVY x360 Convertible 15m-bq1xx
DMI SYS Version     : 
DMI SYS Serial      : 8CG74419W6
DMI BIOS Version    : F.11


------[ Logical CPU #0 ]------

allcpu: Package 0 / Core 0 / Thread 0: Valid

CPUID 00000000: 0000000D-68747541-444D4163-69746E65 [AuthenticAMD]
CPUID 00000001: 00810F10-00080800-7ED8320B-178BFBFF
CPUID 00000002: 00000000-00000000-00000000-00000000
CPUID 00000003: 00000000-00000000-00000000-00000000
CPUID 00000005: 00000040-00000040-00000003-00000011
CPUID 00000006: 00000004-00000000-00000001-00000000
CPUID 00000007: 00000000-209C01A9-00000000-00000000
CPUID 00000008: 00000000-00000000-00000000-00000000
CPUID 00000009: 00000000-00000000-00000000-00000000
CPUID 0000000A: 00000000-00000000-00000000-00000000
CPUID 0000000C: 00000000-00000000-00000000-00000000
CPUID 0000000D: 00000007-00000340-00000340-00000000 [SL 00]
CPUID 0000000D: 0000000F-00000340-00000000-00000000 [SL 01]
CPUID 0000000D: 00000100-00000240-00000000-00000000 [SL 02]
CPUID 80000000: 8000001F-68747541-444D4163-69746E65 [AuthenticAMD]
CPUID 80000001: 00810F10-00000000-35C233FF-2FD3FBFF
CPUID 80000002: 20444D41-657A7952-2035206E-30303532 [AMD Ryzen 5 2500]
CPUID 80000003: 69772055-52206874-6F656461-6556206E [U with Radeon Ve]
CPUID 80000004: 4D206167-6C69626F-66472065-00202078 [ga Mobile Gfx  ]
CPUID 80000005: FF40FF40-FF40FF40-20080140-40040140
CPUID 80000006: 26006400-66006400-02006140-00208140
CPUID 80000007: 00000000-0000001B-00000000-00006599
CPUID 80000008: 00003030-00000007-00004007-00000000
CPUID 80000009: 00000000-00000000-00000000-00000000
CPUID 8000000A: 00000001-00008000-00000000-0001BCFF
CPUID 8000000B: 00000000-00000000-00000000-00000000
CPUID 8000000C: 00000000-00000000-00000000-00000000
CPUID 8000000D: 00000000-00000000-00000000-00000000
CPUID 8000000E: 00000000-00000000-00000000-00000000
CPUID 8000000F: 00000000-00000000-00000000-00000000
CPUID 80000010: 00000000-00000000-00000000-00000000
CPUID 80000011: 00000000-00000000-00000000-00000000
CPUID 80000012: 00000000-00000000-00000000-00000000
CPUID 80000013: 00000000-00000000-00000000-00000000
CPUID 80000014: 00000000-00000000-00000000-00000000
CPUID 80000015: 00000000-00000000-00000000-00000000
CPUID 80000016: 00000000-00000000-00000000-00000000
CPUID 80000017: 00000000-00000000-00000000-00000000
CPUID 80000018: 00000000-00000000-00000000-00000000
CPUID 80000019: F040F040-00000000-00000000-00000000
CPUID 8000001A: 00000003-00000000-00000000-00000000
CPUID 8000001B: 000003FF-00000000-00000000-00000000
CPUID 8000001C: 00000000-00000000-00000000-00000000
CPUID 8000001D: 00004121-01C0003F-0000003F-00000000 [SL 00]
CPUID 8000001D: 00004122-00C0003F-000000FF-00000000 [SL 01]
CPUID 8000001D: 00004143-01C0003F-000003FF-00000002 [SL 02]
CPUID 8000001D: 0001C163-03C0003F-00000FFF-00000001 [SL 03]
CPUID 8000001E: 00000000-00000100-00000000-00000000
CPUID 8000001F: 0000000F-0000016F-0000000F-00000000
CPUID 8FFFFFFF: 00000000-00000000-00000000-00000000

L1    Data Cache:    32 KB,  8-way Associative, 64-byte Line
L1  Instr. Cache:    64 KB,  4-way Associative, 64-byte Line
L2 Unified Cache:   512 KB,  8-way Associative, 64-byte Line
L3 Unified Cache:     4 MB, 16-way Associative, 64-byte Line

------[ Logical CPU #1 ]------

allcpu: Package 0 / Core 0 / Thread 1: Valid, Virtual

CPUID 00000000: 0000000D-68747541-444D4163-69746E65 [AuthenticAMD]
CPUID 00000001: 00810F10-01080800-7ED8320B-178BFBFF
CPUID 00000002: 00000000-00000000-00000000-00000000
CPUID 00000003: 00000000-00000000-00000000-00000000
CPUID 00000005: 00000040-00000040-00000003-00000011
CPUID 00000006: 00000004-00000000-00000001-00000000
CPUID 00000007: 00000000-209C01A9-00000000-00000000
CPUID 00000008: 00000000-00000000-00000000-00000000
CPUID 00000009: 00000000-00000000-00000000-00000000
CPUID 0000000A: 00000000-00000000-00000000-00000000
CPUID 0000000C: 00000000-00000000-00000000-00000000
CPUID 0000000D: 00000007-00000340-00000340-00000000 [SL 00]
CPUID 0000000D: 0000000F-00000340-00000000-00000000 [SL 01]
CPUID 0000000D: 00000100-00000240-00000000-00000000 [SL 02]
CPUID 80000000: 8000001F-68747541-444D4163-69746E65 [AuthenticAMD]
CPUID 80000001: 00810F10-00000000-35C233FF-2FD3FBFF
CPUID 80000002: 20444D41-657A7952-2035206E-30303532 [AMD Ryzen 5 2500]
CPUID 80000003: 69772055-52206874-6F656461-6556206E [U with Radeon Ve]
CPUID 80000004: 4D206167-6C69626F-66472065-00202078 [ga Mobile Gfx  ]
CPUID 80000005: FF40FF40-FF40FF40-20080140-40040140
CPUID 80000006: 26006400-66006400-02006140-00208140
CPUID 80000007: 00000000-0000001B-00000000-00006599
CPUID 80000008: 00003030-00000007-00004007-00000000
CPUID 80000009: 00000000-00000000-00000000-00000000
CPUID 8000000A: 00000001-00008000-00000000-0001BCFF
CPUID 8000000B: 00000000-00000000-00000000-00000000
CPUID 8000000C: 00000000-00000000-00000000-00000000
CPUID 8000000D: 00000000-00000000-00000000-00000000
CPUID 8000000E: 00000000-00000000-00000000-00000000
CPUID 8000000F: 00000000-00000000-00000000-00000000
CPUID 80000010: 00000000-00000000-00000000-00000000
CPUID 80000011: 00000000-00000000-00000000-00000000
CPUID 80000012: 00000000-00000000-00000000-00000000
CPUID 80000013: 00000000-00000000-00000000-00000000
CPUID 80000014: 00000000-00000000-00000000-00000000
CPUID 80000015: 00000000-00000000-00000000-00000000
CPUID 80000016: 00000000-00000000-00000000-00000000
CPUID 80000017: 00000000-00000000-00000000-00000000
CPUID 80000018: 00000000-00000000-00000000-00000000
CPUID 80000019: F040F040-00000000-00000000-00000000
CPUID 8000001A: 00000003-00000000-00000000-00000000
CPUID 8000001B: 000003FF-00000000-00000000-00000000
CPUID 8000001C: 00000000-00000000-00000000-00000000
CPUID 8000001D: 00004121-01C0003F-0000003F-00000000 [SL 00]
CPUID 8000001D: 00004122-00C0003F-000000FF-00000000 [SL 01]
CPUID 8000001D: 00004143-01C0003F-000003FF-00000002 [SL 02]
CPUID 8000001D: 0001C163-03C0003F-00000FFF-00000001 [SL 03]
CPUID 8000001E: 00000001-00000100-00000000-00000000
CPUID 8000001F: 0000000F-0000016F-0000000F-00000000
CPUID 8FFFFFFF: 00000000-00000000-00000000-00000000

L1    Data Cache:    32 KB,  8-way Associative, 64-byte Line
L1  Instr. Cache:    64 KB,  4-way Associative, 64-byte Line
L2 Unified Cache:   512 KB,  8-way Associative, 64-byte Line
L3 Unified Cache:     4 MB, 16-way Associative, 64-byte Line

------[ Logical CPU #2 ]------

allcpu: Package 0 / Core 1 / Thread 0: Valid

CPUID 00000000: 0000000D-68747541-444D4163-69746E65 [AuthenticAMD]
CPUID 00000001: 00810F10-02080800-7ED8320B-178BFBFF
CPUID 00000002: 00000000-00000000-00000000-00000000
CPUID 00000003: 00000000-00000000-00000000-00000000
CPUID 00000005: 00000040-00000040-00000003-00000011
CPUID 00000006: 00000004-00000000-00000001-00000000
CPUID 00000007: 00000000-209C01A9-00000000-00000000
CPUID 00000008: 00000000-00000000-00000000-00000000
CPUID 00000009: 00000000-00000000-00000000-00000000
CPUID 0000000A: 00000000-00000000-00000000-00000000
CPUID 0000000C: 00000000-00000000-00000000-00000000
CPUID 0000000D: 00000007-00000340-00000340-00000000 [SL 00]
CPUID 0000000D: 0000000F-00000340-00000000-00000000 [SL 01]
CPUID 0000000D: 00000100-00000240-00000000-00000000 [SL 02]
CPUID 80000000: 8000001F-68747541-444D4163-69746E65 [AuthenticAMD]
CPUID 80000001: 00810F10-00000000-35C233FF-2FD3FBFF
CPUID 80000002: 20444D41-657A7952-2035206E-30303532 [AMD Ryzen 5 2500]
CPUID 80000003: 69772055-52206874-6F656461-6556206E [U with Radeon Ve]
CPUID 80000004: 4D206167-6C69626F-66472065-00202078 [ga Mobile Gfx  ]
CPUID 80000005: FF40FF40-FF40FF40-20080140-40040140
CPUID 80000006: 26006400-66006400-02006140-00208140
CPUID 80000007: 00000000-0000001B-00000000-00006599
CPUID 80000008: 00003030-00000007-00004007-00000000
CPUID 80000009: 00000000-00000000-00000000-00000000
CPUID 8000000A: 00000001-00008000-00000000-0001BCFF
CPUID 8000000B: 00000000-00000000-00000000-00000000
CPUID 8000000C: 00000000-00000000-00000000-00000000
CPUID 8000000D: 00000000-00000000-00000000-00000000
CPUID 8000000E: 00000000-00000000-00000000-00000000
CPUID 8000000F: 00000000-00000000-00000000-00000000
CPUID 80000010: 00000000-00000000-00000000-00000000
CPUID 80000011: 00000000-00000000-00000000-00000000
CPUID 80000012: 00000000-00000000-00000000-00000000
CPUID 80000013: 00000000-00000000-00000000-00000000
CPUID 80000014: 00000000-00000000-00000000-00000000
CPUID 80000015: 00000000-00000000-00000000-00000000
CPUID 80000016: 00000000-00000000-00000000-00000000
CPUID 80000017: 00000000-00000000-00000000-00000000
CPUID 80000018: 00000000-00000000-00000000-00000000
CPUID 80000019: F040F040-00000000-00000000-00000000
CPUID 8000001A: 00000003-00000000-00000000-00000000
CPUID 8000001B: 000003FF-00000000-00000000-00000000
CPUID 8000001C: 00000000-00000000-00000000-00000000
CPUID 8000001D: 00004121-01C0003F-0000003F-00000000 [SL 00]
CPUID 8000001D: 00004122-00C0003F-000000FF-00000000 [SL 01]
CPUID 8000001D: 00004143-01C0003F-000003FF-00000002 [SL 02]
CPUID 8000001D: 0001C163-03C0003F-00000FFF-00000001 [SL 03]
CPUID 8000001E: 00000002-00000101-00000000-00000000
CPUID 8000001F: 0000000F-0000016F-0000000F-00000000
CPUID 8FFFFFFF: 00000000-00000000-00000000-00000000

L1    Data Cache:    32 KB,  8-way Associative, 64-byte Line
L1  Instr. Cache:    64 KB,  4-way Associative, 64-byte Line
L2 Unified Cache:   512 KB,  8-way Associative, 64-byte Line
L3 Unified Cache:     4 MB, 16-way Associative, 64-byte Line

------[ Logical CPU #3 ]------

allcpu: Package 0 / Core 1 / Thread 1: Valid, Virtual

CPUID 00000000: 0000000D-68747541-444D4163-69746E65 [AuthenticAMD]
CPUID 00000001: 00810F10-03080800-7ED8320B-178BFBFF
CPUID 00000002: 00000000-00000000-00000000-00000000
CPUID 00000003: 00000000-00000000-00000000-00000000
CPUID 00000005: 00000040-00000040-00000003-00000011
CPUID 00000006: 00000004-00000000-00000001-00000000
CPUID 00000007: 00000000-209C01A9-00000000-00000000
CPUID 00000008: 00000000-00000000-00000000-00000000
CPUID 00000009: 00000000-00000000-00000000-00000000
CPUID 0000000A: 00000000-00000000-00000000-00000000
CPUID 0000000C: 00000000-00000000-00000000-00000000
CPUID 0000000D: 00000007-00000340-00000340-00000000 [SL 00]
CPUID 0000000D: 0000000F-00000340-00000000-00000000 [SL 01]
CPUID 0000000D: 00000100-00000240-00000000-00000000 [SL 02]
CPUID 80000000: 8000001F-68747541-444D4163-69746E65 [AuthenticAMD]
CPUID 80000001: 00810F10-00000000-35C233FF-2FD3FBFF
CPUID 80000002: 20444D41-657A7952-2035206E-30303532 [AMD Ryzen 5 2500]
CPUID 80000003: 69772055-52206874-6F656461-6556206E [U with Radeon Ve]
CPUID 80000004: 4D206167-6C69626F-66472065-00202078 [ga Mobile Gfx  ]
CPUID 80000005: FF40FF40-FF40FF40-20080140-40040140
CPUID 80000006: 26006400-66006400-02006140-00208140
CPUID 80000007: 00000000-0000001B-00000000-00006599
CPUID 80000008: 00003030-00000007-00004007-00000000
CPUID 80000009: 00000000-00000000-00000000-00000000
CPUID 8000000A: 00000001-00008000-00000000-0001BCFF
CPUID 8000000B: 00000000-00000000-00000000-00000000
CPUID 8000000C: 00000000-00000000-00000000-00000000
CPUID 8000000D: 00000000-00000000-00000000-00000000
CPUID 8000000E: 00000000-00000000-00000000-00000000
CPUID 8000000F: 00000000-00000000-00000000-00000000
CPUID 80000010: 00000000-00000000-00000000-00000000
CPUID 80000011: 00000000-00000000-00000000-00000000
CPUID 80000012: 00000000-00000000-00000000-00000000
CPUID 80000013: 00000000-00000000-00000000-00000000
CPUID 80000014: 00000000-00000000-00000000-00000000
CPUID 80000015: 00000000-00000000-00000000-00000000
CPUID 80000016: 00000000-00000000-00000000-00000000
CPUID 80000017: 00000000-00000000-00000000-00000000
CPUID 80000018: 00000000-00000000-00000000-00000000
CPUID 80000019: F040F040-00000000-00000000-00000000
CPUID 8000001A: 00000003-00000000-00000000-00000000
CPUID 8000001B: 000003FF-00000000-00000000-00000000
CPUID 8000001C: 00000000-00000000-00000000-00000000
CPUID 8000001D: 00004121-01C0003F-0000003F-00000000 [SL 00]
CPUID 8000001D: 00004122-00C0003F-000000FF-00000000 [SL 01]
CPUID 8000001D: 00004143-01C0003F-000003FF-00000002 [SL 02]
CPUID 8000001D: 0001C163-03C0003F-00000FFF-00000001 [SL 03]
CPUID 8000001E: 00000003-00000101-00000000-00000000
CPUID 8000001F: 0000000F-0000016F-0000000F-00000000
CPUID 8FFFFFFF: 00000000-00000000-00000000-00000000

L1    Data Cache:    32 KB,  8-way Associative, 64-byte Line
L1  Instr. Cache:    64 KB,  4-way Associative, 64-byte Line
L2 Unified Cache:   512 KB,  8-way Associative, 64-byte Line
L3 Unified Cache:     4 MB, 16-way Associative, 64-byte Line

------[ Logical CPU #4 ]------

allcpu: Package 0 / Core 2 / Thread 0: Valid

CPUID 00000000: 0000000D-68747541-444D4163-69746E65 [AuthenticAMD]
CPUID 00000001: 00810F10-04080800-7ED8320B-178BFBFF
CPUID 00000002: 00000000-00000000-00000000-00000000
CPUID 00000003: 00000000-00000000-00000000-00000000
CPUID 00000005: 00000040-00000040-00000003-00000011
CPUID 00000006: 00000004-00000000-00000001-00000000
CPUID 00000007: 00000000-209C01A9-00000000-00000000
CPUID 00000008: 00000000-00000000-00000000-00000000
CPUID 00000009: 00000000-00000000-00000000-00000000
CPUID 0000000A: 00000000-00000000-00000000-00000000
CPUID 0000000C: 00000000-00000000-00000000-00000000
CPUID 0000000D: 00000007-00000340-00000340-00000000 [SL 00]
CPUID 0000000D: 0000000F-00000340-00000000-00000000 [SL 01]
CPUID 0000000D: 00000100-00000240-00000000-00000000 [SL 02]
CPUID 80000000: 8000001F-68747541-444D4163-69746E65 [AuthenticAMD]
CPUID 80000001: 00810F10-00000000-35C233FF-2FD3FBFF
CPUID 80000002: 20444D41-657A7952-2035206E-30303532 [AMD Ryzen 5 2500]
CPUID 80000003: 69772055-52206874-6F656461-6556206E [U with Radeon Ve]
CPUID 80000004: 4D206167-6C69626F-66472065-00202078 [ga Mobile Gfx  ]
CPUID 80000005: FF40FF40-FF40FF40-20080140-40040140
CPUID 80000006: 26006400-66006400-02006140-00208140
CPUID 80000007: 00000000-0000001B-00000000-00006599
CPUID 80000008: 00003030-00000007-00004007-00000000
CPUID 80000009: 00000000-00000000-00000000-00000000
CPUID 8000000A: 00000001-00008000-00000000-0001BCFF
CPUID 8000000B: 00000000-00000000-00000000-00000000
CPUID 8000000C: 00000000-00000000-00000000-00000000
CPUID 8000000D: 00000000-00000000-00000000-00000000
CPUID 8000000E: 00000000-00000000-00000000-00000000
CPUID 8000000F: 00000000-00000000-00000000-00000000
CPUID 80000010: 00000000-00000000-00000000-00000000
CPUID 80000011: 00000000-00000000-00000000-00000000
CPUID 80000012: 00000000-00000000-00000000-00000000
CPUID 80000013: 00000000-00000000-00000000-00000000
CPUID 80000014: 00000000-00000000-00000000-00000000
CPUID 80000015: 00000000-00000000-00000000-00000000
CPUID 80000016: 00000000-00000000-00000000-00000000
CPUID 80000017: 00000000-00000000-00000000-00000000
CPUID 80000018: 00000000-00000000-00000000-00000000
CPUID 80000019: F040F040-00000000-00000000-00000000
CPUID 8000001A: 00000003-00000000-00000000-00000000
CPUID 8000001B: 000003FF-00000000-00000000-00000000
CPUID 8000001C: 00000000-00000000-00000000-00000000
CPUID 8000001D: 00004121-01C0003F-0000003F-00000000 [SL 00]
CPUID 8000001D: 00004122-00C0003F-000000FF-00000000 [SL 01]
CPUID 8000001D: 00004143-01C0003F-000003FF-00000002 [SL 02]
CPUID 8000001D: 0001C163-03C0003F-00000FFF-00000001 [SL 03]
CPUID 8000001E: 00000004-00000102-00000000-00000000
CPUID 8000001F: 0000000F-0000016F-0000000F-00000000
CPUID 8FFFFFFF: 00000000-00000000-00000000-00000000

L1    Data Cache:    32 KB,  8-way Associative, 64-byte Line
L1  Instr. Cache:    64 KB,  4-way Associative, 64-byte Line
L2 Unified Cache:   512 KB,  8-way Associative, 64-byte Line
L3 Unified Cache:     4 MB, 16-way Associative, 64-byte Line

------[ Logical CPU #5 ]------

allcpu: Package 0 / Core 2 / Thread 1: Valid, Virtual

CPUID 00000000: 0000000D-68747541-444D4163-69746E65 [AuthenticAMD]
CPUID 00000001: 00810F10-05080800-7ED8320B-178BFBFF
CPUID 00000002: 00000000-00000000-00000000-00000000
CPUID 00000003: 00000000-00000000-00000000-00000000
CPUID 00000005: 00000040-00000040-00000003-00000011
CPUID 00000006: 00000004-00000000-00000001-00000000
CPUID 00000007: 00000000-209C01A9-00000000-00000000
CPUID 00000008: 00000000-00000000-00000000-00000000
CPUID 00000009: 00000000-00000000-00000000-00000000
CPUID 0000000A: 00000000-00000000-00000000-00000000
CPUID 0000000C: 00000000-00000000-00000000-00000000
CPUID 0000000D: 00000007-00000340-00000340-00000000 [SL 00]
CPUID 0000000D: 0000000F-00000340-00000000-00000000 [SL 01]
CPUID 0000000D: 00000100-00000240-00000000-00000000 [SL 02]
CPUID 80000000: 8000001F-68747541-444D4163-69746E65 [AuthenticAMD]
CPUID 80000001: 00810F10-00000000-35C233FF-2FD3FBFF
CPUID 80000002: 20444D41-657A7952-2035206E-30303532 [AMD Ryzen 5 2500]
CPUID 80000003: 69772055-52206874-6F656461-6556206E [U with Radeon Ve]
CPUID 80000004: 4D206167-6C69626F-66472065-00202078 [ga Mobile Gfx  ]
CPUID 80000005: FF40FF40-FF40FF40-20080140-40040140
CPUID 80000006: 26006400-66006400-02006140-00208140
CPUID 80000007: 00000000-0000001B-00000000-00006599
CPUID 80000008: 00003030-00000007-00004007-00000000
CPUID 80000009: 00000000-00000000-00000000-00000000
CPUID 8000000A: 00000001-00008000-00000000-0001BCFF
CPUID 8000000B: 00000000-00000000-00000000-00000000
CPUID 8000000C: 00000000-00000000-00000000-00000000
CPUID 8000000D: 00000000-00000000-00000000-00000000
CPUID 8000000E: 00000000-00000000-00000000-00000000
CPUID 8000000F: 00000000-00000000-00000000-00000000
CPUID 80000010: 00000000-00000000-00000000-00000000
CPUID 80000011: 00000000-00000000-00000000-00000000
CPUID 80000012: 00000000-00000000-00000000-00000000
CPUID 80000013: 00000000-00000000-00000000-00000000
CPUID 80000014: 00000000-00000000-00000000-00000000
CPUID 80000015: 00000000-00000000-00000000-00000000
CPUID 80000016: 00000000-00000000-00000000-00000000
CPUID 80000017: 00000000-00000000-00000000-00000000
CPUID 80000018: 00000000-00000000-00000000-00000000
CPUID 80000019: F040F040-00000000-00000000-00000000
CPUID 8000001A: 00000003-00000000-00000000-00000000
CPUID 8000001B: 000003FF-00000000-00000000-00000000
CPUID 8000001C: 00000000-00000000-00000000-00000000
CPUID 8000001D: 00004121-01C0003F-0000003F-00000000 [SL 00]
CPUID 8000001D: 00004122-00C0003F-000000FF-00000000 [SL 01]
CPUID 8000001D: 00004143-01C0003F-000003FF-00000002 [SL 02]
CPUID 8000001D: 0001C163-03C0003F-00000FFF-00000001 [SL 03]
CPUID 8000001E: 00000005-00000102-00000000-00000000
CPUID 8000001F: 0000000F-0000016F-0000000F-00000000
CPUID 8FFFFFFF: 00000000-00000000-00000000-00000000

L1    Data Cache:    32 KB,  8-way Associative, 64-byte Line
L1  Instr. Cache:    64 KB,  4-way Associative, 64-byte Line
L2 Unified Cache:   512 KB,  8-way Associative, 64-byte Line
L3 Unified Cache:     4 MB, 16-way Associative, 64-byte Line

------[ Logical CPU #6 ]------

allcpu: Package 0 / Core 3 / Thread 0: Valid

CPUID 00000000: 0000000D-68747541-444D4163-69746E65 [AuthenticAMD]
CPUID 00000001: 00810F10-06080800-7ED8320B-178BFBFF
CPUID 00000002: 00000000-00000000-00000000-00000000
CPUID 00000003: 00000000-00000000-00000000-00000000
CPUID 00000005: 00000040-00000040-00000003-00000011
CPUID 00000006: 00000004-00000000-00000001-00000000
CPUID 00000007: 00000000-209C01A9-00000000-00000000
CPUID 00000008: 00000000-00000000-00000000-00000000
CPUID 00000009: 00000000-00000000-00000000-00000000
CPUID 0000000A: 00000000-00000000-00000000-00000000
CPUID 0000000C: 00000000-00000000-00000000-00000000
CPUID 0000000D: 00000007-00000340-00000340-00000000 [SL 00]
CPUID 0000000D: 0000000F-00000340-00000000-00000000 [SL 01]
CPUID 0000000D: 00000100-00000240-00000000-00000000 [SL 02]
CPUID 80000000: 8000001F-68747541-444D4163-69746E65 [AuthenticAMD]
CPUID 80000001: 00810F10-00000000-35C233FF-2FD3FBFF
CPUID 80000002: 20444D41-657A7952-2035206E-30303532 [AMD Ryzen 5 2500]
CPUID 80000003: 69772055-52206874-6F656461-6556206E [U with Radeon Ve]
CPUID 80000004: 4D206167-6C69626F-66472065-00202078 [ga Mobile Gfx  ]
CPUID 80000005: FF40FF40-FF40FF40-20080140-40040140
CPUID 80000006: 26006400-66006400-02006140-00208140
CPUID 80000007: 00000000-0000001B-00000000-00006599
CPUID 80000008: 00003030-00000007-00004007-00000000
CPUID 80000009: 00000000-00000000-00000000-00000000
CPUID 8000000A: 00000001-00008000-00000000-0001BCFF
CPUID 8000000B: 00000000-00000000-00000000-00000000
CPUID 8000000C: 00000000-00000000-00000000-00000000
CPUID 8000000D: 00000000-00000000-00000000-00000000
CPUID 8000000E: 00000000-00000000-00000000-00000000
CPUID 8000000F: 00000000-00000000-00000000-00000000
CPUID 80000010: 00000000-00000000-00000000-00000000
CPUID 80000011: 00000000-00000000-00000000-00000000
CPUID 80000012: 00000000-00000000-00000000-00000000
CPUID 80000013: 00000000-00000000-00000000-00000000
CPUID 80000014: 00000000-00000000-00000000-00000000
CPUID 80000015: 00000000-00000000-00000000-00000000
CPUID 80000016: 00000000-00000000-00000000-00000000
CPUID 80000017: 00000000-00000000-00000000-00000000
CPUID 80000018: 00000000-00000000-00000000-00000000
CPUID 80000019: F040F040-00000000-00000000-00000000
CPUID 8000001A: 00000003-00000000-00000000-00000000
CPUID 8000001B: 000003FF-00000000-00000000-00000000
CPUID 8000001C: 00000000-00000000-00000000-00000000
CPUID 8000001D: 00004121-01C0003F-0000003F-00000000 [SL 00]
CPUID 8000001D: 00004122-00C0003F-000000FF-00000000 [SL 01]
CPUID 8000001D: 00004143-01C0003F-000003FF-00000002 [SL 02]
CPUID 8000001D: 0001C163-03C0003F-00000FFF-00000001 [SL 03]
CPUID 8000001E: 00000006-00000103-00000000-00000000
CPUID 8000001F: 0000000F-0000016F-0000000F-00000000
CPUID 8FFFFFFF: 00000000-00000000-00000000-00000000

L1    Data Cache:    32 KB,  8-way Associative, 64-byte Line
L1  Instr. Cache:    64 KB,  4-way Associative, 64-byte Line
L2 Unified Cache:   512 KB,  8-way Associative, 64-byte Line
L3 Unified Cache:     4 MB, 16-way Associative, 64-byte Line

------[ Logical CPU #7 ]------

allcpu: Package 0 / Core 3 / Thread 1: Valid, Virtual

CPUID 00000000: 0000000D-68747541-444D4163-69746E65 [AuthenticAMD]
CPUID 00000001: 00810F10-07080800-7ED8320B-178BFBFF
CPUID 00000002: 00000000-00000000-00000000-00000000
CPUID 00000003: 00000000-00000000-00000000-00000000
CPUID 00000005: 00000040-00000040-00000003-00000011
CPUID 00000006: 00000004-00000000-00000001-00000000
CPUID 00000007: 00000000-209C01A9-00000000-00000000
CPUID 00000008: 00000000-00000000-00000000-00000000
CPUID 00000009: 00000000-00000000-00000000-00000000
CPUID 0000000A: 00000000-00000000-00000000-00000000
CPUID 0000000C: 00000000-00000000-00000000-00000000
CPUID 0000000D: 00000007-00000340-00000340-00000000 [SL 00]
CPUID 0000000D: 0000000F-00000340-00000000-00000000 [SL 01]
CPUID 0000000D: 00000100-00000240-00000000-00000000 [SL 02]
CPUID 80000000: 8000001F-68747541-444D4163-69746E65 [AuthenticAMD]
CPUID 80000001: 00810F10-00000000-35C233FF-2FD3FBFF
CPUID 80000002: 20444D41-657A7952-2035206E-30303532 [AMD Ryzen 5 2500]
CPUID 80000003: 69772055-52206874-6F656461-6556206E [U with Radeon Ve]
CPUID 80000004: 4D206167-6C69626F-66472065-00202078 [ga Mobile Gfx  ]
CPUID 80000005: FF40FF40-FF40FF40-20080140-40040140
CPUID 80000006: 26006400-66006400-02006140-00208140
CPUID 80000007: 00000000-0000001B-00000000-00006599
CPUID 80000008: 00003030-00000007-00004007-00000000
CPUID 80000009: 00000000-00000000-00000000-00000000
CPUID 8000000A: 00000001-00008000-00000000-0001BCFF
CPUID 8000000B: 00000000-00000000-00000000-00000000
CPUID 8000000C: 00000000-00000000-00000000-00000000
CPUID 8000000D: 00000000-00000000-00000000-00000000
CPUID 8000000E: 00000000-00000000-00000000-00000000
CPUID 8000000F: 00000000-00000000-00000000-00000000
CPUID 80000010: 00000000-00000000-00000000-00000000
CPUID 80000011: 00000000-00000000-00000000-00000000
CPUID 80000012: 00000000-00000000-00000000-00000000
CPUID 80000013: 00000000-00000000-00000000-00000000
CPUID 80000014: 00000000-00000000-00000000-00000000
CPUID 80000015: 00000000-00000000-00000000-00000000
CPUID 80000016: 00000000-00000000-00000000-00000000
CPUID 80000017: 00000000-00000000-00000000-00000000
CPUID 80000018: 00000000-00000000-00000000-00000000
CPUID 80000019: F040F040-00000000-00000000-00000000
CPUID 8000001A: 00000003-00000000-00000000-00000000
CPUID 8000001B: 000003FF-00000000-00000000-00000000
CPUID 8000001C: 00000000-00000000-00000000-00000000
CPUID 8000001D: 00004121-01C0003F-0000003F-00000000 [SL 00]
CPUID 8000001D: 00004122-00C0003F-000000FF-00000000 [SL 01]
CPUID 8000001D: 00004143-01C0003F-000003FF-00000002 [SL 02]
CPUID 8000001D: 0001C163-03C0003F-00000FFF-00000001 [SL 03]
CPUID 8000001E: 00000007-00000103-00000000-00000000
CPUID 8000001F: 0000000F-0000016F-0000000F-00000000
CPUID 8FFFFFFF: 00000000-00000000-00000000-00000000

L1    Data Cache:    32 KB,  8-way Associative, 64-byte Line
L1  Instr. Cache:    64 KB,  4-way Associative, 64-byte Line
L2 Unified Cache:   512 KB,  8-way Associative, 64-byte Line
L3 Unified Cache:     4 MB, 16-way Associative, 64-byte Line

------[ All CPUs ]------

CPU   0: APICID    0 / Package 0 / Core   0 / Thread 0: Valid
CPU   1: APICID    1 / Package 0 / Core   0 / Thread 1: Valid, Virtual
CPU   2: APICID    2 / Package 0 / Core   1 / Thread 0: Valid
CPU   3: APICID    3 / Package 0 / Core   1 / Thread 1: Valid, Virtual
CPU   4: APICID    4 / Package 0 / Core   2 / Thread 0: Valid
CPU   5: APICID    5 / Package 0 / Core   2 / Thread 1: Valid, Virtual
CPU   6: APICID    6 / Package 0 / Core   3 / Thread 0: Valid
CPU   7: APICID    7 / Package 0 / Core   3 / Thread 1: Valid, Virtual

------[ MSR Registers ]------

CPU Clock (Normal): 1599 MHz
CPU Clock (TSC): 1996 MHz
CPU Multiplier: 16.0x
CPB PStates: 0
MSR 0000001B: 0000-0000-FEE0-0900
MSR 0000008B: 0000-0000-0810-1004
MSR 000000E7: 0000-0000-0259-2AC0 [S200]
MSR 000000E7: 0000-0000-0001-4870 [S200]
MSR 000000E7: 0000-0000-0001-5E3C
MSR 000000E8: 0000-0000-0001-3EED [S200]
MSR 000000E8: 0000-0000-0001-79D6 [S200]
MSR 000000E8: 0000-0000-0001-4E4A
MSR C0010004: 0000-FFFF-FFE2-B3F8
MSR C0010005: 0000-0000-0000-0000
MSR C0010006: 0000-0000-0000-0000
MSR C0010007: 0000-0000-0000-0000
MSR C0010015: 0000-0000-0900-0011
MSR C001001F: 0000-0000-0000-0000
MSR C0010055: 0000-0000-0000-0000
MSR C0010058: 0000-0000-F800-0019
MSR C0010061: 0000-0000-0000-0020
MSR C0010062: 0000-0000-0000-0000
MSR C0010063: 0000-0000-0000-0002
MSR C0010064: 8000-0000-450D-4A64 [20.00x] [1.2188 V] [ 2.00 A] [PState P0]
MSR C0010065: 8000-0000-4458-0C66 [17.00x] [0.9500 V] [ 1.70 A] [PState P1]
MSR C0010066: 8000-0000-4419-8C60 [16.00x] [0.9125 V] [ 1.60 A] [PState P2]
MSR C0010067: 0000-0000-4016-0000
MSR C0010068: 0000-0000-4016-0000
MSR C0010069: 0000-0000-4016-0000
MSR C001006A: 0000-0000-4016-0000
MSR C001006B: 0000-0000-4016-0000
MSR C0010070: < FAILED >
MSR C0010293: 0000-0000-009E-CC60 [16.00x] [0.7813V]
MSR C0010293: 0000-0000-009E-CC60 [16.00x] [0.7813V]
MSR C0010293: 0000-0000-009E-CC60 [16.00x] [0.7813V]
MSR C0010293: 0000-0000-009E-CC60 [16.00x] [0.7813V]
MSR C0010293: 0000-0000-009E-CC60 [16.00x] [0.7813V]
MSR C0010140: 0000-0000-0000-0000
MSR C0010141: 0000-0000-0000-0000
MSR C0010290: 0000-0000-0000-0000
MSR C0010292: 0000-0001-0012-0040
MSR C0010293: 0000-0000-009E-CC60
MSR C0010294: 0001-F588-0002-8912
MSR C0010296: 0000-0000-0048-4848
MSR C0010299: 0000-0000-000A-1003
MSR C001029A: 0000-0000-0006-34BA [S200]
MSR C001029A: 0000-0000-0006-3567 [S200]
MSR C001029A: 0000-0000-0006-3583
MSR C001029B: 0000-0000-00A8-01B6 [S200]
MSR C001029B: 0000-0000-00A8-354C [S200]
MSR C001029B: 0000-0000-00A8-5339
MSR C0011023: 0002-2000-0000-0000

PerformanceFrequency = 1949462

CPU Clock M.Method = 6  (APIC K10)
PM Timer Address   = 2056  (0808h)

APIC Clock =  99.92 MHz  (AT = 13097 / TT = 15014 / try = 1 / SKL = 24.98 MHz)
APIC Clock =  99.93 MHz  (AT = 13096 / TT = 15012 / try = 1 / SKL = 24.98 MHz)
APIC Clock =  99.92 MHz  (AT = 13096 / TT = 15013 / try = 1 / SKL = 24.98 MHz)
APIC Clock =  99.92 MHz  (AT = 13097 / TT = 15014 / try = 1 / SKL = 24.98 MHz)
APIC Clock =  99.92 MHz  (AT = 13097 / TT = 15014 / try = 1 / SKL = 24.98 MHz)

CPU Clock = 1598.68 MHz / TSC Clock = 1996.23 MHz / CPU Mul = 16.00x
CPU Clock = 1598.77 MHz / TSC Clock = 1996.25 MHz / CPU Mul = 16.00x
CPU Clock = 1598.66 MHz / TSC Clock = 1996.28 MHz / CPU Mul = 16.00x
CPU Clock = 1598.88 MHz / TSC Clock = 1996.23 MHz / CPU Mul = 16.00x
CPU Clock = 1598.68 MHz / TSC Clock = 1996.25 MHz / CPU Mul = 16.00x

CPU Clock Max = 2398.17 MHz / TSC Clock = 1996.25 MHz / CPU Mul = 24.00x
CPU Clock Max = 2398.24 MHz / TSC Clock = 1996.25 MHz / CPU Mul = 24.00x
CPU Clock Max = 2398.01 MHz / TSC Clock = 1996.26 MHz / CPU Mul = 24.00x
CPU Clock Max = 2398.04 MHz / TSC Clock = 1996.26 MHz / CPU Mul = 24.00x
CPU Clock Max = 2398.15 MHz / TSC Clock = 1996.23 MHz / CPU Mul = 24.00x

------[ APIC Base at 00000000-FEE00000 ]------

  0000  00 00 00 00 00 00 00 00 00 00 00 00 00 00 00 00 
  0010  00 00 00 00 00 00 00 00 00 00 00 00 00 00 00 00 
  0020  00 00 00 00 00 00 00 00 00 00 00 00 00 00 00 00 
  0030  10 00 05 80 10 00 05 80 10 00 05 80 10 00 05 80 
  0040  00 00 00 00 00 00 00 00 00 00 00 00 00 00 00 00 
  0050  00 00 00 00 00 00 00 00 00 00 00 00 00 00 00 00 
  0060  00 00 00 00 00 00 00 00 00 00 00 00 00 00 00 00 
  0070  00 00 00 00 00 00 00 00 00 00 00 00 00 00 00 00 
  0080  00 00 00 00 00 00 00 00 00 00 00 00 00 00 00 00 
  0090  00 00 00 00 00 00 00 00 00 00 00 00 00 00 00 00 
  00A0  00 00 00 00 00 00 00 00 00 00 00 00 00 00 00 00 
  00B0  00 00 00 00 00 00 00 00 00 00 00 00 00 00 00 00 
  00C0  00 00 00 00 00 00 00 00 00 00 00 00 00 00 00 00 
  00D0  00 00 00 01 00 00 00 01 00 00 00 01 00 00 00 01 
  00E0  FF FF FF FF FF FF FF FF FF FF FF FF FF FF FF FF 
  00F0  DF 01 00 00 DF 01 00 00 DF 01 00 00 DF 01 00 00 
  0100  00 00 00 00 00 00 00 00 00 00 00 00 00 00 00 00 
  0110  00 00 00 00 00 00 00 00 00 00 00 00 00 00 00 00 
  0120  00 00 00 00 00 00 00 00 00 00 00 00 00 00 00 00 
  0130  00 00 00 00 00 00 00 00 00 00 00 00 00 00 00 00 
  0140  00 00 00 00 00 00 00 00 00 00 00 00 00 00 00 00 
  0150  00 00 00 00 00 00 00 00 00 00 00 00 00 00 00 00 
  0160  00 00 00 00 00 00 00 00 00 00 00 00 00 00 00 00 
  0170  00 00 00 00 00 00 00 00 00 00 00 00 00 00 00 00 
  0180  00 00 00 00 00 00 00 00 00 00 00 00 00 00 00 00 
  0190  00 00 00 00 00 00 00 00 00 00 00 00 00 00 00 00 
  01A0  00 00 10 00 00 00 10 00 00 00 10 00 00 00 10 00 
  01B0  00 00 00 00 00 00 00 00 00 00 00 00 00 00 00 00 
  01C0  00 00 00 00 00 00 00 00 00 00 00 00 00 00 00 00 
  01D0  01 00 21 00 01 00 21 00 01 00 21 00 01 00 21 00 
  01E0  00 00 00 00 00 00 00 00 00 00 00 00 00 00 00 00 
  01F0  00 00 00 00 00 00 00 00 00 00 00 00 00 00 00 00 
  0200  00 00 00 00 00 00 00 00 00 00 00 00 00 00 00 00 
  0210  00 00 00 00 00 00 00 00 00 00 00 00 00 00 00 00 
  0220  00 00 00 00 00 00 00 00 00 00 00 00 00 00 00 00 
  0230  00 00 00 00 00 00 00 00 00 00 00 00 00 00 00 00 
  0240  00 00 00 00 00 00 00 00 00 00 00 00 00 00 00 00 
  0250  00 00 00 00 00 00 00 00 00 00 00 00 00 00 00 00 
  0260  00 00 00 00 00 00 00 00 00 00 00 00 00 00 00 00 
  0270  00 00 00 00 00 00 00 00 00 00 00 00 00 00 00 00 
  0280  80 00 00 00 80 00 00 00 80 00 00 00 80 00 00 00 
  0290  00 00 00 00 00 00 00 00 00 00 00 00 00 00 00 00 
  02A0  00 00 00 00 00 00 00 00 00 00 00 00 00 00 00 00 
  02B0  00 00 00 00 00 00 00 00 00 00 00 00 00 00 00 00 
  02C0  00 00 00 00 00 00 00 00 00 00 00 00 00 00 00 00 
  02D0  00 00 00 00 00 00 00 00 00 00 00 00 00 00 00 00 
  02E0  00 00 00 00 00 00 00 00 00 00 00 00 00 00 00 00 
  02F0  00 00 00 00 00 00 00 00 00 00 00 00 00 00 00 00 
  0300  E1 08 00 00 E1 08 00 00 E1 08 00 00 E1 08 00 00 
  0310  00 00 00 20 00 00 00 20 00 00 00 20 00 00 00 20 
  0320  D1 00 03 00 D1 00 03 00 D1 00 03 00 D1 00 03 00 
  0330  00 00 01 00 00 00 01 00 00 00 01 00 00 00 01 00 
  0340  FE 00 00 00 FE 00 00 00 FE 00 00 00 FE 00 00 00 
  0350  D8 00 01 00 D8 00 01 00 D8 00 01 00 D8 00 01 00 
  0360  00 04 00 00 00 04 00 00 00 04 00 00 00 04 00 00 
  0370  E2 00 00 00 E2 00 00 00 E2 00 00 00 E2 00 00 00 
  0380  00 00 00 00 00 00 00 00 00 00 00 00 00 00 00 00 
  0390  00 00 00 00 00 00 00 00 00 00 00 00 00 00 00 00 
  03A0  00 00 00 00 00 00 00 00 00 00 00 00 00 00 00 00 
  03B0  00 00 00 00 00 00 00 00 00 00 00 00 00 00 00 00 
  03C0  00 00 00 00 00 00 00 00 00 00 00 00 00 00 00 00 
  03D0  00 00 00 00 00 00 00 00 00 00 00 00 00 00 00 00 
  03E0  0A 00 00 00 0A 00 00 00 0A 00 00 00 0A 00 00 00 
  03F0  00 00 00 00 00 00 00 00 00 00 00 00 00 00 00 00 
