------[ Versions ]------

Program Version : EVEREST v4.60.1628 Beta
BenchDLL Version: 2.4.257.0

------[ CPU Info ]------

CPU Type           : AMD Athlon, 1400 MHz (10.5 x 133)
CPU Alias          : Thunderbird
CPU Platform       : Socket A
CPU Stepping       : A9
Instruction Set    : x86, MMX, 3DNow!
CPUID Manufacturer : AuthenticAMD
CPUID CPU Name     : AMD Athlon(tm) Processor
CPUID Revision     : 00000644h
Platform ID        : D1h  (Socket A)

------[ Logical CPU #0 ]------

allcpu: Valid

CPUID 00000000: 00000001-68747541-444D4163-69746E65
CPUID 00000001: 00000644-00000000-00000000-0183F9FF
CPUID 80000000: 80000006-68747541-444D4163-69746E65
CPUID 80000001: 00000744-00000000-00000000-C1C7F9FF
CPUID 80000002: 20444D41-6C687441-74286E6F-5020296D
CPUID 80000003: 65636F72-726F7373-00000000-00000000
CPUID 80000004: 00000000-00000000-00000000-00000000
CPUID 80000005: 0408FF08-FF18FF10-40020140-40020140
CPUID 80000006: 00000000-41004100-01008140-00000000

------[ MSR Registers ]------

MSR 0000001B: 0000-0000-FEE0-0100
MSR C0010015: 0000-0000-0F00-1008

PerformanceFrequency = 3579545

Tjmax Temperature = 0 Celsius
