------[ Versions ]------

Program Version : EVEREST v5.02.1862 Beta
BenchDLL Version: 2.4.273.0

------[ CPU Info ]------

CPU Type           : 2x DualCore AMD Opteron HE 2210, 1800 MHz (9 x 200)
CPU Alias          : Santa Rosa
CPU Platform       : Socket F
CPU Stepping       : JH-F2
Instruction Set    : x86, x86-64, MMX, 3DNow!, SSE, SSE2, SSE3
CPUID Manufacturer : AuthenticAMD
CPUID CPU Name     : Dual-Core AMD Opteron(tm) Processor 2210 HE
CPUID Revision     : 00040F12h
AMD New Brand ID   : 02CBh  (Opteron HE 2210)
Platform ID        : DAh  (Socket F)

------[ Logical CPU #0 ]------

allcpu: Valid

CPUID 00000000: 00000001-68747541-444D4163-69746E65
CPUID 00000001: 00040F12-00020800-00002001-178BFBFF
CPUID 80000000: 80000018-68747541-444D4163-69746E65
CPUID 80000001: 00040F12-000002CB-0000001F-EBD3FBFF
CPUID 80000002: 6C617544-726F432D-4D412065-704F2044
CPUID 80000003: 6F726574-6D74286E-72502029-7365636F
CPUID 80000004: 20726F73-30313232-00454820-00000000
CPUID 80000005: FF08FF08-FF20FF20-40020140-40020140
CPUID 80000006: 00000000-42004200-04008140-00000000
CPUID 80000007: 00000000-00000000-00000000-0000003F
CPUID 80000008: 00003028-00000000-00000001-00000000
CPUID 80000009: 00000000-00000000-00000000-00000000
CPUID 8000000A: 00000001-00000040-00000000-00000000
CPUID 8000000B: 00000000-00000000-00000000-00000000
CPUID 8000000C: 00000000-00000000-00000000-00000000
CPUID 8000000D: 00000000-00000000-00000000-00000000
CPUID 8000000E: 00000000-00000000-00000000-00000000
CPUID 8000000F: 00000000-00000000-00000000-00000000
CPUID 80000010: 00000000-00000000-00000000-00000000
CPUID 80000011: 00000000-00000000-00000000-00000000
CPUID 80000012: 00000000-00000000-00000000-00000000
CPUID 80000013: 00000000-00000000-00000000-00000000
CPUID 80000014: 00000000-00000000-00000000-00000000
CPUID 80000015: 00000000-00000000-00000000-00000000
CPUID 80000016: 00000000-00000000-00000000-00000000
CPUID 80000017: 00000000-00000000-00000000-00000000
CPUID 80000018: 00000000-00000000-00000000-00000000
CPUID 8FFFFFFF: 00000000-00000000-00000000-00000000

------[ Logical CPU #1 ]------

allcpu: Valid

CPUID 00000000: 00000001-68747541-444D4163-69746E65
CPUID 00000001: 00040F12-01020800-00002001-178BFBFF
CPUID 80000000: 80000018-68747541-444D4163-69746E65
CPUID 80000001: 00040F12-000002CB-0000001F-EBD3FBFF
CPUID 80000002: 6C617544-726F432D-4D412065-704F2044
CPUID 80000003: 6F726574-6D74286E-72502029-7365636F
CPUID 80000004: 20726F73-30313232-00454820-00000000
CPUID 80000005: FF08FF08-FF20FF20-40020140-40020140
CPUID 80000006: 00000000-42004200-04008140-00000000
CPUID 80000007: 00000000-00000000-00000000-0000003F
CPUID 80000008: 00003028-00000000-00000001-00000000
CPUID 80000009: 00000000-00000000-00000000-00000000
CPUID 8000000A: 00000001-00000040-00000000-00000000
CPUID 8000000B: 00000000-00000000-00000000-00000000
CPUID 8000000C: 00000000-00000000-00000000-00000000
CPUID 8000000D: 00000000-00000000-00000000-00000000
CPUID 8000000E: 00000000-00000000-00000000-00000000
CPUID 8000000F: 00000000-00000000-00000000-00000000
CPUID 80000010: 00000000-00000000-00000000-00000000
CPUID 80000011: 00000000-00000000-00000000-00000000
CPUID 80000012: 00000000-00000000-00000000-00000000
CPUID 80000013: 00000000-00000000-00000000-00000000
CPUID 80000014: 00000000-00000000-00000000-00000000
CPUID 80000015: 00000000-00000000-00000000-00000000
CPUID 80000016: 00000000-00000000-00000000-00000000
CPUID 80000017: 00000000-00000000-00000000-00000000
CPUID 80000018: 00000000-00000000-00000000-00000000
CPUID 8FFFFFFF: 00000000-00000000-00000000-00000000

------[ Logical CPU #2 ]------

allcpu: Valid

CPUID 00000000: 00000001-68747541-444D4163-69746E65
CPUID 00000001: 00040F12-02020800-00002001-178BFBFF
CPUID 80000000: 80000018-68747541-444D4163-69746E65
CPUID 80000001: 00040F12-000002CB-0000001F-EBD3FBFF
CPUID 80000002: 6C617544-726F432D-4D412065-704F2044
CPUID 80000003: 6F726574-6D74286E-72502029-7365636F
CPUID 80000004: 20726F73-30313232-00454820-00000000
CPUID 80000005: FF08FF08-FF20FF20-40020140-40020140
CPUID 80000006: 00000000-42004200-04008140-00000000
CPUID 80000007: 00000000-00000000-00000000-0000003F
CPUID 80000008: 00003028-00000000-00000001-00000000
CPUID 80000009: 00000000-00000000-00000000-00000000
CPUID 8000000A: 00000001-00000040-00000000-00000000
CPUID 8000000B: 00000000-00000000-00000000-00000000
CPUID 8000000C: 00000000-00000000-00000000-00000000
CPUID 8000000D: 00000000-00000000-00000000-00000000
CPUID 8000000E: 00000000-00000000-00000000-00000000
CPUID 8000000F: 00000000-00000000-00000000-00000000
CPUID 80000010: 00000000-00000000-00000000-00000000
CPUID 80000011: 00000000-00000000-00000000-00000000
CPUID 80000012: 00000000-00000000-00000000-00000000
CPUID 80000013: 00000000-00000000-00000000-00000000
CPUID 80000014: 00000000-00000000-00000000-00000000
CPUID 80000015: 00000000-00000000-00000000-00000000
CPUID 80000016: 00000000-00000000-00000000-00000000
CPUID 80000017: 00000000-00000000-00000000-00000000
CPUID 80000018: 00000000-00000000-00000000-00000000
CPUID 8FFFFFFF: 00000000-00000000-00000000-00000000

------[ Logical CPU #3 ]------

allcpu: Valid

CPUID 00000000: 00000001-68747541-444D4163-69746E65
CPUID 00000001: 00040F12-03020800-00002001-178BFBFF
CPUID 80000000: 80000018-68747541-444D4163-69746E65
CPUID 80000001: 00040F12-000002CB-0000001F-EBD3FBFF
CPUID 80000002: 6C617544-726F432D-4D412065-704F2044
CPUID 80000003: 6F726574-6D74286E-72502029-7365636F
CPUID 80000004: 20726F73-30313232-00454820-00000000
CPUID 80000005: FF08FF08-FF20FF20-40020140-40020140
CPUID 80000006: 00000000-42004200-04008140-00000000
CPUID 80000007: 00000000-00000000-00000000-0000003F
CPUID 80000008: 00003028-00000000-00000001-00000000
CPUID 80000009: 00000000-00000000-00000000-00000000
CPUID 8000000A: 00000001-00000040-00000000-00000000
CPUID 8000000B: 00000000-00000000-00000000-00000000
CPUID 8000000C: 00000000-00000000-00000000-00000000
CPUID 8000000D: 00000000-00000000-00000000-00000000
CPUID 8000000E: 00000000-00000000-00000000-00000000
CPUID 8000000F: 00000000-00000000-00000000-00000000
CPUID 80000010: 00000000-00000000-00000000-00000000
CPUID 80000011: 00000000-00000000-00000000-00000000
CPUID 80000012: 00000000-00000000-00000000-00000000
CPUID 80000013: 00000000-00000000-00000000-00000000
CPUID 80000014: 00000000-00000000-00000000-00000000
CPUID 80000015: 00000000-00000000-00000000-00000000
CPUID 80000016: 00000000-00000000-00000000-00000000
CPUID 80000017: 00000000-00000000-00000000-00000000
CPUID 80000018: 00000000-00000000-00000000-00000000
CPUID 8FFFFFFF: 00000000-00000000-00000000-00000000

------[ MSR Registers ]------

MSR 0000001B: 0000-0000-FEE0-0900
MSR C0010015: 0000-0000-0200-0040
MSR C0010042: 310C-120E-0C0A-020A
MSR C0010055: 0000-0000-0000-0000

PerformanceFrequency = 1795570000

Tjmax Temperature = 0 Celsius
