------[ Logical CPU #0 ]------

allcpu: Package 0 / Core 0 / Thread 0: Valid

CPUID 00000000: 0000000D-68747541-444D4163-69746E65 [AuthenticAMD]
CPUID 00000001: 00670F00-00020800-7ED8320B-178BFBFF
CPUID 00000002: 00000000-00000000-00000000-00000000
CPUID 00000003: 00000000-00000000-00000000-00000000
CPUID 00000005: 00000040-00000040-00000003-00000000
CPUID 00000006: 00000004-00000000-00000001-00000000
CPUID 00000007: 00000000-000001A9-00000000-00000000
CPUID 00000008: 00000000-00000000-00000000-00000000
CPUID 00000009: 00000000-00000000-00000000-00000000
CPUID 0000000A: 00000000-00000000-00000000-00000000
CPUID 0000000C: 00000000-00000000-00000000-00000000
CPUID 0000000D: 00000007-00000340-000003C0-40000000 [SL 00]
CPUID 0000000D: 00000001-00000000-00000000-00000000 [SL 01]
CPUID 0000000D: 00000100-00000240-00000000-00000000 [SL 02]
CPUID 0000000D: 00000080-00000340-00000000-00000000 [SL 3E]
CPUID 80000000: 8000001E-68747541-444D4163-69746E65 [AuthenticAMD]
CPUID 80000001: 00670F00-00000000-2FABBFFF-2FD3FBFF
CPUID 80000002: 20444D41-392D3941-20303134-45444152 [AMD A9-9410 RADE]
CPUID 80000003: 52204E4F-35202C35-4D4F4320-45545550 [ON R5, 5 COMPUTE]
CPUID 80000004: 524F4320-32205345-47332B43-00202020 [ CORES 2C+3G   ]
CPUID 80000005: FF40FF18-FF40FF30-20080140-60030140
CPUID 80000006: 64006400-64004200-04008140-00000000
CPUID 80000007: 00000000-00000005-00000400-000037D9
CPUID 80000008: 00003030-00000000-00004001-00000000
CPUID 80000009: 00000000-00000000-00000000-00000000
CPUID 8000000A: 00000001-00008000-00000000-0001BCFF
CPUID 8000000B: 00000000-00000000-00000000-00000000
CPUID 8000000C: 00000000-00000000-00000000-00000000
CPUID 8000000D: 00000000-00000000-00000000-00000000
CPUID 8000000E: 00000000-00000000-00000000-00000000
CPUID 8000000F: 00000000-00000000-00000000-00000000
CPUID 80000010: 00000000-00000000-00000000-00000000
CPUID 80000011: 00000000-00000000-00000000-00000000
CPUID 80000012: 00000000-00000000-00000000-00000000
CPUID 80000013: 00000000-00000000-00000000-00000000
CPUID 80000014: 00000000-00000000-00000000-00000000
CPUID 80000015: 00000000-00000000-00000000-00000000
CPUID 80000016: 00000000-00000000-00000000-00000000
CPUID 80000017: 00000000-00000000-00000000-00000000
CPUID 80000018: 00000000-00000000-00000000-00000000
CPUID 80000019: F040F018-64006400-00000000-00000000
CPUID 8000001A: 00000003-00000000-00000000-00000000
CPUID 8000001B: 000007FF-00000000-00000000-00000000
CPUID 8000001C: 00000000-80032013-00010200-E000000F
CPUID 8000001E: 00000010-00000100-00000000-00000000
CPUID 8FFFFFFF: 00000000-00000000-00000000-00000000

------[ Logical CPU #1 ]------

allcpu: Package 0 / Core 1 / Thread 0: Valid

CPUID 00000000: 0000000D-68747541-444D4163-69746E65 [AuthenticAMD]
CPUID 00000001: 00670F00-01020800-7ED8320B-178BFBFF
CPUID 00000002: 00000000-00000000-00000000-00000000
CPUID 00000003: 00000000-00000000-00000000-00000000
CPUID 00000005: 00000040-00000040-00000003-00000000
CPUID 00000006: 00000004-00000000-00000001-00000000
CPUID 00000007: 00000000-000001A9-00000000-00000000
CPUID 00000008: 00000000-00000000-00000000-00000000
CPUID 00000009: 00000000-00000000-00000000-00000000
CPUID 0000000A: 00000000-00000000-00000000-00000000
CPUID 0000000C: 00000000-00000000-00000000-00000000
CPUID 0000000D: 00000007-00000340-000003C0-40000000 [SL 00]
CPUID 0000000D: 00000001-00000000-00000000-00000000 [SL 01]
CPUID 0000000D: 00000100-00000240-00000000-00000000 [SL 02]
CPUID 0000000D: 00000080-00000340-00000000-00000000 [SL 3E]
CPUID 80000000: 8000001E-68747541-444D4163-69746E65 [AuthenticAMD]
CPUID 80000001: 00670F00-00000000-2FABBFFF-2FD3FBFF
CPUID 80000002: 20444D41-392D3941-20303134-45444152 [AMD A9-9410 RADE]
CPUID 80000003: 52204E4F-35202C35-4D4F4320-45545550 [ON R5, 5 COMPUTE]
CPUID 80000004: 524F4320-32205345-47332B43-00202020 [ CORES 2C+3G   ]
CPUID 80000005: FF40FF18-FF40FF30-20080140-60030140
CPUID 80000006: 64006400-64004200-04008140-00000000
CPUID 80000007: 00000000-00000005-00000400-000037D9
CPUID 80000008: 00003030-00000000-00004001-00000000
CPUID 80000009: 00000000-00000000-00000000-00000000
CPUID 8000000A: 00000001-00008000-00000000-0001BCFF
CPUID 8000000B: 00000000-00000000-00000000-00000000
CPUID 8000000C: 00000000-00000000-00000000-00000000
CPUID 8000000D: 00000000-00000000-00000000-00000000
CPUID 8000000E: 00000000-00000000-00000000-00000000
CPUID 8000000F: 00000000-00000000-00000000-00000000
CPUID 80000010: 00000000-00000000-00000000-00000000
CPUID 80000011: 00000000-00000000-00000000-00000000
CPUID 80000012: 00000000-00000000-00000000-00000000
CPUID 80000013: 00000000-00000000-00000000-00000000
CPUID 80000014: 00000000-00000000-00000000-00000000
CPUID 80000015: 00000000-00000000-00000000-00000000
CPUID 80000016: 00000000-00000000-00000000-00000000
CPUID 80000017: 00000000-00000000-00000000-00000000
CPUID 80000018: 00000000-00000000-00000000-00000000
CPUID 80000019: F040F018-64006400-00000000-00000000
CPUID 8000001A: 00000003-00000000-00000000-00000000
CPUID 8000001B: 000007FF-00000000-00000000-00000000
CPUID 8000001C: 00000000-80032013-00010200-E000000F
CPUID 8000001E: 00000011-00000100-00000000-00000000
CPUID 8FFFFFFF: 00000000-00000000-00000000-00000000

------[ All CPUs ]------

CPU   0: APICID   0 / Package 0 / Core  0 / Thread 0: Valid
CPU   1: APICID   1 / Package 0 / Core  1 / Thread 0: Valid

------[ MSR Registers ]------

CPU Clock (Normal): 1397 MHz
CPU Clock (TSC): 2895 MHz
CPU Multiplier: 14.0x
CPB PStates: 2
MSR 0000001B: 0000-0000-FEE0-0900
MSR 0000008B: 0000-0000-0600-6704
MSR 000000E7: 0000-0000-046F-F489 [S200]
MSR 000000E7: 0000-0000-0003-1CAA [S200]
MSR 000000E7: 0000-0000-0014-1ACD
MSR 000000E8: 0000-0000-000A-25DA [S200]
MSR 000000E8: 0000-0000-0003-A70E [S200]
MSR 000000E8: 0000-0000-0002-8E61
MSR C0010004: 0000-0000-0000-0000
MSR C0010005: 0000-0000-0000-0000
MSR C0010006: 0000-0000-0000-0000
MSR C0010007: 0000-0000-0000-0000
MSR C0010015: 0000-0000-1900-1011
MSR C001001F: 0258-4000-0885-0000
MSR C0010055: 0000-0000-0000-0000
MSR C0010058: 0000-0000-F800-0019
MSR C0010061: 0000-0000-0000-0051
MSR C0010062: 0000-0000-0000-0005
MSR C0010063: 0000-0000-0000-0005
MSR C0010064: 8000-0192-0000-4C13 [35.00x] [1.3125 V] [14.60 A] [PState Pb0]
MSR C0010065: 8000-0174-0000-7010 [32.00x] [1.2000 V] [11.60 A] [PState Pb1]
MSR C0010066: 8000-015E-0000-900D [29.00x] [1.1000 V] [ 9.40 A] [PState P0]
MSR C0010067: 8000-014D-0000-A80A [26.00x] [1.0250 V] [ 7.70 A] [PState P1]
MSR C0010068: 8000-013F-0000-C007 [23.00x] [0.9500 V] [ 6.30 A] [PState P2]
MSR C0010069: 8000-0133-0000-D404 [20.00x] [0.8875 V] [ 5.10 A] [PState P3]
MSR C001006A: 8000-0129-0000-E852 [17.00x] [0.8250 V] [ 4.10 A] [PState P4]
MSR C001006B: 8000-0121-0040-F44C [14.00x] [0.7875 V] [ 3.30 A] [PState P5]
MSR C0010070: 0000-0000-6C47-F44C
MSR C0010071: 5BC6-0006-7E47-F44C [14.00x] [-0.0125V]
MSR C0010071: 5BC6-0006-7E47-F44C [14.00x] [-0.0125V]
MSR C0010071: 5BC6-0006-7E47-F44C [14.00x] [-0.0125V]
MSR C0010071: 5BC6-0006-7E47-F44C [14.00x] [-0.0125V]
MSR C0010071: 5BC6-0006-7E47-F44C [14.00x] [-0.0125V]
MSR C0010140: 0000-0000-0000-0004
MSR C0010141: 0000-0000-0000-0000
MSR C0011023: 810A-4000-0078-3220
