------[ Versions ]------

Program Version : AIDA64 v5.81.4105 Beta
BenchDLL Version: 4.3.741-x64

------[ CPU Info ]------

CPU Type          : OctalCore AMD FX-8150, 4200 MHz (21 x 200)
CPU Alias         : Zambezi
CPU Platform      : Socket AM3+
CPU Stepping      : OR-B2
Instruction Set   : x86, x86-64, MMX, SSE, SSE2, SSE3, SSSE3, SSE4.1, SSE4.2, SSE4A, XOP, AVX, FMA4, AES
CPUID Manufacturer: AuthenticAMD
CPUID CPU Name    : AMD FX(tm)-8150 Eight-Core Processor
CPUID Revision    : 00600F12h
Platform ID       : C6h  (Socket AM3+)
HTT / CMP Units   : 0 / 8
Max. NUMA Node    : 0

Tjmax Temperature    : 0 Celsius
HTC Temperature Limit: 90 Celsius
CPU TDP              : 124.8 W

------[ Logical CPU #0 ]------

allcpu: Package 0 / Core 0 / Thread 0: Valid

CPUID 00000000: 0000000D-68747541-444D4163-69746E65 [AuthenticAMD]
CPUID 00000001: 00600F12-00080800-1E98220B-178BFBFF
CPUID 00000002: 00000000-00000000-00000000-00000000
CPUID 00000003: 00000000-00000000-00000000-00000000
CPUID 00000005: 00000040-00000040-00000003-00000000
CPUID 00000006: 00000000-00000000-00000001-00000000
CPUID 00000007: 00000000-00000000-00000000-00000000
CPUID 00000008: 00000000-00000000-00000000-00000000
CPUID 00000009: 00000000-00000000-00000000-00000000
CPUID 0000000A: 00000000-00000000-00000000-00000000
CPUID 0000000C: 00000000-00000000-00000000-00000000
CPUID 0000000D: 00000007-00000340-000003C0-40000000 [SL 00]
CPUID 0000000D: 00000000-00000000-00000000-00000000 [SL 01]
CPUID 0000000D: 00000100-00000240-00000000-00000000 [SL 02]
CPUID 0000000D: 00000080-00000340-00000000-00000000 [SL 3E]
CPUID 80000000: 8000001E-68747541-444D4163-69746E65 [AuthenticAMD]
CPUID 80000001: 00600F12-10000000-01C9BFFF-2FD3FBFF
CPUID 80000002: 20444D41-74285846-382D296D-20303531 [AMD FX(tm)-8150 ]
CPUID 80000003: 68676945-6F432D74-50206572-65636F72 [Eight-Core Proce]
CPUID 80000004: 726F7373-20202020-20202020-00202020 [ssor           ]
CPUID 80000005: FF20FF18-FF20FF30-10040140-40020140
CPUID 80000006: 64000000-64004200-08008140-0040C140
CPUID 80000007: 00000000-00000000-00000000-000003D9
CPUID 80000008: 00003030-00000000-00004007-00000000
CPUID 80000009: 00000000-00000000-00000000-00000000
CPUID 8000000A: 00000001-00010000-00000000-000014FF
CPUID 8000000B: 00000000-00000000-00000000-00000000
CPUID 8000000C: 00000000-00000000-00000000-00000000
CPUID 8000000D: 00000000-00000000-00000000-00000000
CPUID 8000000E: 00000000-00000000-00000000-00000000
CPUID 8000000F: 00000000-00000000-00000000-00000000
CPUID 80000010: 00000000-00000000-00000000-00000000
CPUID 80000011: 00000000-00000000-00000000-00000000
CPUID 80000012: 00000000-00000000-00000000-00000000
CPUID 80000013: 00000000-00000000-00000000-00000000
CPUID 80000014: 00000000-00000000-00000000-00000000
CPUID 80000015: 00000000-00000000-00000000-00000000
CPUID 80000016: 00000000-00000000-00000000-00000000
CPUID 80000017: 00000000-00000000-00000000-00000000
CPUID 80000018: 00000000-00000000-00000000-00000000
CPUID 80000019: F020F018-64000000-00000000-00000000
CPUID 8000001A: 00000003-00000000-00000000-00000000
CPUID 8000001B: 000000FF-00000000-00000000-00000000
CPUID 8000001C: 00000000-80032013-00010200-8000000F
CPUID 8000001D: 00000121-00C0003F-0000003F-00000000 [SL 00]
CPUID 8000001D: 00004122-0040003F-000001FF-00000000 [SL 01]
CPUID 8000001D: 00004143-03C0003F-000007FF-00000001 [SL 02]
CPUID 8000001D: 0001C163-0FC0003F-000007FF-00000001 [SL 03]
CPUID 8000001E: 00000010-00000100-00000000-00000000
CPUID 8FFFFFFF: 00000000-00000000-00000000-00000000

L1    Data Cache:    16 KB,  4-way Associative, 64-byte Line
L1  Instr. Cache:    64 KB,  2-way Associative, 64-byte Line
L2 Unified Cache:     2 MB, 16-way Associative, 64-byte Line
L3 Unified Cache:     8 MB, 64-way Associative, 64-byte Line

------[ Logical CPU #1 ]------

allcpu: Package 0 / Core 1 / Thread 0: Valid

CPUID 00000000: 0000000D-68747541-444D4163-69746E65 [AuthenticAMD]
CPUID 00000001: 00600F12-01080800-1E98220B-178BFBFF
CPUID 00000002: 00000000-00000000-00000000-00000000
CPUID 00000003: 00000000-00000000-00000000-00000000
CPUID 00000005: 00000040-00000040-00000003-00000000
CPUID 00000006: 00000000-00000000-00000001-00000000
CPUID 00000007: 00000000-00000000-00000000-00000000
CPUID 00000008: 00000000-00000000-00000000-00000000
CPUID 00000009: 00000000-00000000-00000000-00000000
CPUID 0000000A: 00000000-00000000-00000000-00000000
CPUID 0000000C: 00000000-00000000-00000000-00000000
CPUID 0000000D: 00000007-00000340-000003C0-40000000 [SL 00]
CPUID 0000000D: 00000000-00000000-00000000-00000000 [SL 01]
CPUID 0000000D: 00000100-00000240-00000000-00000000 [SL 02]
CPUID 0000000D: 00000080-00000340-00000000-00000000 [SL 3E]
CPUID 80000000: 8000001E-68747541-444D4163-69746E65 [AuthenticAMD]
CPUID 80000001: 00600F12-10000000-01C9BFFF-2FD3FBFF
CPUID 80000002: 20444D41-74285846-382D296D-20303531 [AMD FX(tm)-8150 ]
CPUID 80000003: 68676945-6F432D74-50206572-65636F72 [Eight-Core Proce]
CPUID 80000004: 726F7373-20202020-20202020-00202020 [ssor           ]
CPUID 80000005: FF20FF18-FF20FF30-10040140-40020140
CPUID 80000006: 64000000-64004200-08008140-0040C140
CPUID 80000007: 00000000-00000000-00000000-000003D9
CPUID 80000008: 00003030-00000000-00004007-00000000
CPUID 80000009: 00000000-00000000-00000000-00000000
CPUID 8000000A: 00000001-00010000-00000000-000014FF
CPUID 8000000B: 00000000-00000000-00000000-00000000
CPUID 8000000C: 00000000-00000000-00000000-00000000
CPUID 8000000D: 00000000-00000000-00000000-00000000
CPUID 8000000E: 00000000-00000000-00000000-00000000
CPUID 8000000F: 00000000-00000000-00000000-00000000
CPUID 80000010: 00000000-00000000-00000000-00000000
CPUID 80000011: 00000000-00000000-00000000-00000000
CPUID 80000012: 00000000-00000000-00000000-00000000
CPUID 80000013: 00000000-00000000-00000000-00000000
CPUID 80000014: 00000000-00000000-00000000-00000000
CPUID 80000015: 00000000-00000000-00000000-00000000
CPUID 80000016: 00000000-00000000-00000000-00000000
CPUID 80000017: 00000000-00000000-00000000-00000000
CPUID 80000018: 00000000-00000000-00000000-00000000
CPUID 80000019: F020F018-64000000-00000000-00000000
CPUID 8000001A: 00000003-00000000-00000000-00000000
CPUID 8000001B: 000000FF-00000000-00000000-00000000
CPUID 8000001C: 00000000-80032013-00010200-8000000F
CPUID 8000001D: 00000121-00C0003F-0000003F-00000000 [SL 00]
CPUID 8000001D: 00004122-0040003F-000001FF-00000000 [SL 01]
CPUID 8000001D: 00004143-03C0003F-000007FF-00000001 [SL 02]
CPUID 8000001D: 0001C163-0FC0003F-000007FF-00000001 [SL 03]
CPUID 8000001E: 00000011-00000100-00000000-00000000
CPUID 8FFFFFFF: 00000000-00000000-00000000-00000000

L1    Data Cache:    16 KB,  4-way Associative, 64-byte Line
L1  Instr. Cache:    64 KB,  2-way Associative, 64-byte Line
L2 Unified Cache:     2 MB, 16-way Associative, 64-byte Line
L3 Unified Cache:     8 MB, 64-way Associative, 64-byte Line

------[ Logical CPU #2 ]------

allcpu: Package 0 / Core 2 / Thread 0: Valid

CPUID 00000000: 0000000D-68747541-444D4163-69746E65 [AuthenticAMD]
CPUID 00000001: 00600F12-02080800-1E98220B-178BFBFF
CPUID 00000002: 00000000-00000000-00000000-00000000
CPUID 00000003: 00000000-00000000-00000000-00000000
CPUID 00000005: 00000040-00000040-00000003-00000000
CPUID 00000006: 00000000-00000000-00000001-00000000
CPUID 00000007: 00000000-00000000-00000000-00000000
CPUID 00000008: 00000000-00000000-00000000-00000000
CPUID 00000009: 00000000-00000000-00000000-00000000
CPUID 0000000A: 00000000-00000000-00000000-00000000
CPUID 0000000C: 00000000-00000000-00000000-00000000
CPUID 0000000D: 00000007-00000340-000003C0-40000000 [SL 00]
CPUID 0000000D: 00000000-00000000-00000000-00000000 [SL 01]
CPUID 0000000D: 00000100-00000240-00000000-00000000 [SL 02]
CPUID 0000000D: 00000080-00000340-00000000-00000000 [SL 3E]
CPUID 80000000: 8000001E-68747541-444D4163-69746E65 [AuthenticAMD]
CPUID 80000001: 00600F12-10000000-01C9BFFF-2FD3FBFF
CPUID 80000002: 20444D41-74285846-382D296D-20303531 [AMD FX(tm)-8150 ]
CPUID 80000003: 68676945-6F432D74-50206572-65636F72 [Eight-Core Proce]
CPUID 80000004: 726F7373-20202020-20202020-00202020 [ssor           ]
CPUID 80000005: FF20FF18-FF20FF30-10040140-40020140
CPUID 80000006: 64000000-64004200-08008140-0040C140
CPUID 80000007: 00000000-00000000-00000000-000003D9
CPUID 80000008: 00003030-00000000-00004007-00000000
CPUID 80000009: 00000000-00000000-00000000-00000000
CPUID 8000000A: 00000001-00010000-00000000-000014FF
CPUID 8000000B: 00000000-00000000-00000000-00000000
CPUID 8000000C: 00000000-00000000-00000000-00000000
CPUID 8000000D: 00000000-00000000-00000000-00000000
CPUID 8000000E: 00000000-00000000-00000000-00000000
CPUID 8000000F: 00000000-00000000-00000000-00000000
CPUID 80000010: 00000000-00000000-00000000-00000000
CPUID 80000011: 00000000-00000000-00000000-00000000
CPUID 80000012: 00000000-00000000-00000000-00000000
CPUID 80000013: 00000000-00000000-00000000-00000000
CPUID 80000014: 00000000-00000000-00000000-00000000
CPUID 80000015: 00000000-00000000-00000000-00000000
CPUID 80000016: 00000000-00000000-00000000-00000000
CPUID 80000017: 00000000-00000000-00000000-00000000
CPUID 80000018: 00000000-00000000-00000000-00000000
CPUID 80000019: F020F018-64000000-00000000-00000000
CPUID 8000001A: 00000003-00000000-00000000-00000000
CPUID 8000001B: 000000FF-00000000-00000000-00000000
CPUID 8000001C: 00000000-80032013-00010200-8000000F
CPUID 8000001D: 00000121-00C0003F-0000003F-00000000 [SL 00]
CPUID 8000001D: 00004122-0040003F-000001FF-00000000 [SL 01]
CPUID 8000001D: 00004143-03C0003F-000007FF-00000001 [SL 02]
CPUID 8000001D: 0001C163-0FC0003F-000007FF-00000001 [SL 03]
CPUID 8000001E: 00000012-00000101-00000000-00000000
CPUID 8FFFFFFF: 00000000-00000000-00000000-00000000

L1    Data Cache:    16 KB,  4-way Associative, 64-byte Line
L1  Instr. Cache:    64 KB,  2-way Associative, 64-byte Line
L2 Unified Cache:     2 MB, 16-way Associative, 64-byte Line
L3 Unified Cache:     8 MB, 64-way Associative, 64-byte Line

------[ Logical CPU #3 ]------

allcpu: Package 0 / Core 3 / Thread 0: Valid

CPUID 00000000: 0000000D-68747541-444D4163-69746E65 [AuthenticAMD]
CPUID 00000001: 00600F12-03080800-1E98220B-178BFBFF
CPUID 00000002: 00000000-00000000-00000000-00000000
CPUID 00000003: 00000000-00000000-00000000-00000000
CPUID 00000005: 00000040-00000040-00000003-00000000
CPUID 00000006: 00000000-00000000-00000001-00000000
CPUID 00000007: 00000000-00000000-00000000-00000000
CPUID 00000008: 00000000-00000000-00000000-00000000
CPUID 00000009: 00000000-00000000-00000000-00000000
CPUID 0000000A: 00000000-00000000-00000000-00000000
CPUID 0000000C: 00000000-00000000-00000000-00000000
CPUID 0000000D: 00000007-00000340-000003C0-40000000 [SL 00]
CPUID 0000000D: 00000000-00000000-00000000-00000000 [SL 01]
CPUID 0000000D: 00000100-00000240-00000000-00000000 [SL 02]
CPUID 0000000D: 00000080-00000340-00000000-00000000 [SL 3E]
CPUID 80000000: 8000001E-68747541-444D4163-69746E65 [AuthenticAMD]
CPUID 80000001: 00600F12-10000000-01C9BFFF-2FD3FBFF
CPUID 80000002: 20444D41-74285846-382D296D-20303531 [AMD FX(tm)-8150 ]
CPUID 80000003: 68676945-6F432D74-50206572-65636F72 [Eight-Core Proce]
CPUID 80000004: 726F7373-20202020-20202020-00202020 [ssor           ]
CPUID 80000005: FF20FF18-FF20FF30-10040140-40020140
CPUID 80000006: 64000000-64004200-08008140-0040C140
CPUID 80000007: 00000000-00000000-00000000-000003D9
CPUID 80000008: 00003030-00000000-00004007-00000000
CPUID 80000009: 00000000-00000000-00000000-00000000
CPUID 8000000A: 00000001-00010000-00000000-000014FF
CPUID 8000000B: 00000000-00000000-00000000-00000000
CPUID 8000000C: 00000000-00000000-00000000-00000000
CPUID 8000000D: 00000000-00000000-00000000-00000000
CPUID 8000000E: 00000000-00000000-00000000-00000000
CPUID 8000000F: 00000000-00000000-00000000-00000000
CPUID 80000010: 00000000-00000000-00000000-00000000
CPUID 80000011: 00000000-00000000-00000000-00000000
CPUID 80000012: 00000000-00000000-00000000-00000000
CPUID 80000013: 00000000-00000000-00000000-00000000
CPUID 80000014: 00000000-00000000-00000000-00000000
CPUID 80000015: 00000000-00000000-00000000-00000000
CPUID 80000016: 00000000-00000000-00000000-00000000
CPUID 80000017: 00000000-00000000-00000000-00000000
CPUID 80000018: 00000000-00000000-00000000-00000000
CPUID 80000019: F020F018-64000000-00000000-00000000
CPUID 8000001A: 00000003-00000000-00000000-00000000
CPUID 8000001B: 000000FF-00000000-00000000-00000000
CPUID 8000001C: 00000000-80032013-00010200-8000000F
CPUID 8000001D: 00000121-00C0003F-0000003F-00000000 [SL 00]
CPUID 8000001D: 00004122-0040003F-000001FF-00000000 [SL 01]
CPUID 8000001D: 00004143-03C0003F-000007FF-00000001 [SL 02]
CPUID 8000001D: 0001C163-0FC0003F-000007FF-00000001 [SL 03]
CPUID 8000001E: 00000013-00000101-00000000-00000000
CPUID 8FFFFFFF: 00000000-00000000-00000000-00000000

L1    Data Cache:    16 KB,  4-way Associative, 64-byte Line
L1  Instr. Cache:    64 KB,  2-way Associative, 64-byte Line
L2 Unified Cache:     2 MB, 16-way Associative, 64-byte Line
L3 Unified Cache:     8 MB, 64-way Associative, 64-byte Line

------[ Logical CPU #4 ]------

allcpu: Package 0 / Core 4 / Thread 0: Valid

CPUID 00000000: 0000000D-68747541-444D4163-69746E65 [AuthenticAMD]
CPUID 00000001: 00600F12-04080800-1E98220B-178BFBFF
CPUID 00000002: 00000000-00000000-00000000-00000000
CPUID 00000003: 00000000-00000000-00000000-00000000
CPUID 00000005: 00000040-00000040-00000003-00000000
CPUID 00000006: 00000000-00000000-00000001-00000000
CPUID 00000007: 00000000-00000000-00000000-00000000
CPUID 00000008: 00000000-00000000-00000000-00000000
CPUID 00000009: 00000000-00000000-00000000-00000000
CPUID 0000000A: 00000000-00000000-00000000-00000000
CPUID 0000000C: 00000000-00000000-00000000-00000000
CPUID 0000000D: 00000007-00000340-000003C0-40000000 [SL 00]
CPUID 0000000D: 00000000-00000000-00000000-00000000 [SL 01]
CPUID 0000000D: 00000100-00000240-00000000-00000000 [SL 02]
CPUID 0000000D: 00000080-00000340-00000000-00000000 [SL 3E]
CPUID 80000000: 8000001E-68747541-444D4163-69746E65 [AuthenticAMD]
CPUID 80000001: 00600F12-10000000-01C9BFFF-2FD3FBFF
CPUID 80000002: 20444D41-74285846-382D296D-20303531 [AMD FX(tm)-8150 ]
CPUID 80000003: 68676945-6F432D74-50206572-65636F72 [Eight-Core Proce]
CPUID 80000004: 726F7373-20202020-20202020-00202020 [ssor           ]
CPUID 80000005: FF20FF18-FF20FF30-10040140-40020140
CPUID 80000006: 64000000-64004200-08008140-0040C140
CPUID 80000007: 00000000-00000000-00000000-000003D9
CPUID 80000008: 00003030-00000000-00004007-00000000
CPUID 80000009: 00000000-00000000-00000000-00000000
CPUID 8000000A: 00000001-00010000-00000000-000014FF
CPUID 8000000B: 00000000-00000000-00000000-00000000
CPUID 8000000C: 00000000-00000000-00000000-00000000
CPUID 8000000D: 00000000-00000000-00000000-00000000
CPUID 8000000E: 00000000-00000000-00000000-00000000
CPUID 8000000F: 00000000-00000000-00000000-00000000
CPUID 80000010: 00000000-00000000-00000000-00000000
CPUID 80000011: 00000000-00000000-00000000-00000000
CPUID 80000012: 00000000-00000000-00000000-00000000
CPUID 80000013: 00000000-00000000-00000000-00000000
CPUID 80000014: 00000000-00000000-00000000-00000000
CPUID 80000015: 00000000-00000000-00000000-00000000
CPUID 80000016: 00000000-00000000-00000000-00000000
CPUID 80000017: 00000000-00000000-00000000-00000000
CPUID 80000018: 00000000-00000000-00000000-00000000
CPUID 80000019: F020F018-64000000-00000000-00000000
CPUID 8000001A: 00000003-00000000-00000000-00000000
CPUID 8000001B: 000000FF-00000000-00000000-00000000
CPUID 8000001C: 00000000-80032013-00010200-8000000F
CPUID 8000001D: 00000121-00C0003F-0000003F-00000000 [SL 00]
CPUID 8000001D: 00004122-0040003F-000001FF-00000000 [SL 01]
CPUID 8000001D: 00004143-03C0003F-000007FF-00000001 [SL 02]
CPUID 8000001D: 0001C163-0FC0003F-000007FF-00000001 [SL 03]
CPUID 8000001E: 00000014-00000102-00000000-00000000
CPUID 8FFFFFFF: 00000000-00000000-00000000-00000000

L1    Data Cache:    16 KB,  4-way Associative, 64-byte Line
L1  Instr. Cache:    64 KB,  2-way Associative, 64-byte Line
L2 Unified Cache:     2 MB, 16-way Associative, 64-byte Line
L3 Unified Cache:     8 MB, 64-way Associative, 64-byte Line

------[ Logical CPU #5 ]------

allcpu: Package 0 / Core 5 / Thread 0: Valid

CPUID 00000000: 0000000D-68747541-444D4163-69746E65 [AuthenticAMD]
CPUID 00000001: 00600F12-05080800-1E98220B-178BFBFF
CPUID 00000002: 00000000-00000000-00000000-00000000
CPUID 00000003: 00000000-00000000-00000000-00000000
CPUID 00000005: 00000040-00000040-00000003-00000000
CPUID 00000006: 00000000-00000000-00000001-00000000
CPUID 00000007: 00000000-00000000-00000000-00000000
CPUID 00000008: 00000000-00000000-00000000-00000000
CPUID 00000009: 00000000-00000000-00000000-00000000
CPUID 0000000A: 00000000-00000000-00000000-00000000
CPUID 0000000C: 00000000-00000000-00000000-00000000
CPUID 0000000D: 00000007-00000340-000003C0-40000000 [SL 00]
CPUID 0000000D: 00000000-00000000-00000000-00000000 [SL 01]
CPUID 0000000D: 00000100-00000240-00000000-00000000 [SL 02]
CPUID 0000000D: 00000080-00000340-00000000-00000000 [SL 3E]
CPUID 80000000: 8000001E-68747541-444D4163-69746E65 [AuthenticAMD]
CPUID 80000001: 00600F12-10000000-01C9BFFF-2FD3FBFF
CPUID 80000002: 20444D41-74285846-382D296D-20303531 [AMD FX(tm)-8150 ]
CPUID 80000003: 68676945-6F432D74-50206572-65636F72 [Eight-Core Proce]
CPUID 80000004: 726F7373-20202020-20202020-00202020 [ssor           ]
CPUID 80000005: FF20FF18-FF20FF30-10040140-40020140
CPUID 80000006: 64000000-64004200-08008140-0040C140
CPUID 80000007: 00000000-00000000-00000000-000003D9
CPUID 80000008: 00003030-00000000-00004007-00000000
CPUID 80000009: 00000000-00000000-00000000-00000000
CPUID 8000000A: 00000001-00010000-00000000-000014FF
CPUID 8000000B: 00000000-00000000-00000000-00000000
CPUID 8000000C: 00000000-00000000-00000000-00000000
CPUID 8000000D: 00000000-00000000-00000000-00000000
CPUID 8000000E: 00000000-00000000-00000000-00000000
CPUID 8000000F: 00000000-00000000-00000000-00000000
CPUID 80000010: 00000000-00000000-00000000-00000000
CPUID 80000011: 00000000-00000000-00000000-00000000
CPUID 80000012: 00000000-00000000-00000000-00000000
CPUID 80000013: 00000000-00000000-00000000-00000000
CPUID 80000014: 00000000-00000000-00000000-00000000
CPUID 80000015: 00000000-00000000-00000000-00000000
CPUID 80000016: 00000000-00000000-00000000-00000000
CPUID 80000017: 00000000-00000000-00000000-00000000
CPUID 80000018: 00000000-00000000-00000000-00000000
CPUID 80000019: F020F018-64000000-00000000-00000000
CPUID 8000001A: 00000003-00000000-00000000-00000000
CPUID 8000001B: 000000FF-00000000-00000000-00000000
CPUID 8000001C: 00000000-80032013-00010200-8000000F
CPUID 8000001D: 00000121-00C0003F-0000003F-00000000 [SL 00]
CPUID 8000001D: 00004122-0040003F-000001FF-00000000 [SL 01]
CPUID 8000001D: 00004143-03C0003F-000007FF-00000001 [SL 02]
CPUID 8000001D: 0001C163-0FC0003F-000007FF-00000001 [SL 03]
CPUID 8000001E: 00000015-00000102-00000000-00000000
CPUID 8FFFFFFF: 00000000-00000000-00000000-00000000

L1    Data Cache:    16 KB,  4-way Associative, 64-byte Line
L1  Instr. Cache:    64 KB,  2-way Associative, 64-byte Line
L2 Unified Cache:     2 MB, 16-way Associative, 64-byte Line
L3 Unified Cache:     8 MB, 64-way Associative, 64-byte Line

------[ Logical CPU #6 ]------

allcpu: Package 0 / Core 6 / Thread 0: Valid

CPUID 00000000: 0000000D-68747541-444D4163-69746E65 [AuthenticAMD]
CPUID 00000001: 00600F12-06080800-1E98220B-178BFBFF
CPUID 00000002: 00000000-00000000-00000000-00000000
CPUID 00000003: 00000000-00000000-00000000-00000000
CPUID 00000005: 00000040-00000040-00000003-00000000
CPUID 00000006: 00000000-00000000-00000001-00000000
CPUID 00000007: 00000000-00000000-00000000-00000000
CPUID 00000008: 00000000-00000000-00000000-00000000
CPUID 00000009: 00000000-00000000-00000000-00000000
CPUID 0000000A: 00000000-00000000-00000000-00000000
CPUID 0000000C: 00000000-00000000-00000000-00000000
CPUID 0000000D: 00000007-00000340-000003C0-40000000 [SL 00]
CPUID 0000000D: 00000000-00000000-00000000-00000000 [SL 01]
CPUID 0000000D: 00000100-00000240-00000000-00000000 [SL 02]
CPUID 0000000D: 00000080-00000340-00000000-00000000 [SL 3E]
CPUID 80000000: 8000001E-68747541-444D4163-69746E65 [AuthenticAMD]
CPUID 80000001: 00600F12-10000000-01C9BFFF-2FD3FBFF
CPUID 80000002: 20444D41-74285846-382D296D-20303531 [AMD FX(tm)-8150 ]
CPUID 80000003: 68676945-6F432D74-50206572-65636F72 [Eight-Core Proce]
CPUID 80000004: 726F7373-20202020-20202020-00202020 [ssor           ]
CPUID 80000005: FF20FF18-FF20FF30-10040140-40020140
CPUID 80000006: 64000000-64004200-08008140-0040C140
CPUID 80000007: 00000000-00000000-00000000-000003D9
CPUID 80000008: 00003030-00000000-00004007-00000000
CPUID 80000009: 00000000-00000000-00000000-00000000
CPUID 8000000A: 00000001-00010000-00000000-000014FF
CPUID 8000000B: 00000000-00000000-00000000-00000000
CPUID 8000000C: 00000000-00000000-00000000-00000000
CPUID 8000000D: 00000000-00000000-00000000-00000000
CPUID 8000000E: 00000000-00000000-00000000-00000000
CPUID 8000000F: 00000000-00000000-00000000-00000000
CPUID 80000010: 00000000-00000000-00000000-00000000
CPUID 80000011: 00000000-00000000-00000000-00000000
CPUID 80000012: 00000000-00000000-00000000-00000000
CPUID 80000013: 00000000-00000000-00000000-00000000
CPUID 80000014: 00000000-00000000-00000000-00000000
CPUID 80000015: 00000000-00000000-00000000-00000000
CPUID 80000016: 00000000-00000000-00000000-00000000
CPUID 80000017: 00000000-00000000-00000000-00000000
CPUID 80000018: 00000000-00000000-00000000-00000000
CPUID 80000019: F020F018-64000000-00000000-00000000
CPUID 8000001A: 00000003-00000000-00000000-00000000
CPUID 8000001B: 000000FF-00000000-00000000-00000000
CPUID 8000001C: 00000000-80032013-00010200-8000000F
CPUID 8000001D: 00000121-00C0003F-0000003F-00000000 [SL 00]
CPUID 8000001D: 00004122-0040003F-000001FF-00000000 [SL 01]
CPUID 8000001D: 00004143-03C0003F-000007FF-00000001 [SL 02]
CPUID 8000001D: 0001C163-0FC0003F-000007FF-00000001 [SL 03]
CPUID 8000001E: 00000016-00000103-00000000-00000000
CPUID 8FFFFFFF: 00000000-00000000-00000000-00000000

L1    Data Cache:    16 KB,  4-way Associative, 64-byte Line
L1  Instr. Cache:    64 KB,  2-way Associative, 64-byte Line
L2 Unified Cache:     2 MB, 16-way Associative, 64-byte Line
L3 Unified Cache:     8 MB, 64-way Associative, 64-byte Line

------[ Logical CPU #7 ]------

allcpu: Package 0 / Core 7 / Thread 0: Valid

CPUID 00000000: 0000000D-68747541-444D4163-69746E65 [AuthenticAMD]
CPUID 00000001: 00600F12-07080800-1E98220B-178BFBFF
CPUID 00000002: 00000000-00000000-00000000-00000000
CPUID 00000003: 00000000-00000000-00000000-00000000
CPUID 00000005: 00000040-00000040-00000003-00000000
CPUID 00000006: 00000000-00000000-00000001-00000000
CPUID 00000007: 00000000-00000000-00000000-00000000
CPUID 00000008: 00000000-00000000-00000000-00000000
CPUID 00000009: 00000000-00000000-00000000-00000000
CPUID 0000000A: 00000000-00000000-00000000-00000000
CPUID 0000000C: 00000000-00000000-00000000-00000000
CPUID 0000000D: 00000007-00000340-000003C0-40000000 [SL 00]
CPUID 0000000D: 00000000-00000000-00000000-00000000 [SL 01]
CPUID 0000000D: 00000100-00000240-00000000-00000000 [SL 02]
CPUID 0000000D: 00000080-00000340-00000000-00000000 [SL 3E]
CPUID 80000000: 8000001E-68747541-444D4163-69746E65 [AuthenticAMD]
CPUID 80000001: 00600F12-10000000-01C9BFFF-2FD3FBFF
CPUID 80000002: 20444D41-74285846-382D296D-20303531 [AMD FX(tm)-8150 ]
CPUID 80000003: 68676945-6F432D74-50206572-65636F72 [Eight-Core Proce]
CPUID 80000004: 726F7373-20202020-20202020-00202020 [ssor           ]
CPUID 80000005: FF20FF18-FF20FF30-10040140-40020140
CPUID 80000006: 64000000-64004200-08008140-0040C140
CPUID 80000007: 00000000-00000000-00000000-000003D9
CPUID 80000008: 00003030-00000000-00004007-00000000
CPUID 80000009: 00000000-00000000-00000000-00000000
CPUID 8000000A: 00000001-00010000-00000000-000014FF
CPUID 8000000B: 00000000-00000000-00000000-00000000
CPUID 8000000C: 00000000-00000000-00000000-00000000
CPUID 8000000D: 00000000-00000000-00000000-00000000
CPUID 8000000E: 00000000-00000000-00000000-00000000
CPUID 8000000F: 00000000-00000000-00000000-00000000
CPUID 80000010: 00000000-00000000-00000000-00000000
CPUID 80000011: 00000000-00000000-00000000-00000000
CPUID 80000012: 00000000-00000000-00000000-00000000
CPUID 80000013: 00000000-00000000-00000000-00000000
CPUID 80000014: 00000000-00000000-00000000-00000000
CPUID 80000015: 00000000-00000000-00000000-00000000
CPUID 80000016: 00000000-00000000-00000000-00000000
CPUID 80000017: 00000000-00000000-00000000-00000000
CPUID 80000018: 00000000-00000000-00000000-00000000
CPUID 80000019: F020F018-64000000-00000000-00000000
CPUID 8000001A: 00000003-00000000-00000000-00000000
CPUID 8000001B: 000000FF-00000000-00000000-00000000
CPUID 8000001C: 00000000-80032013-00010200-8000000F
CPUID 8000001D: 00000121-00C0003F-0000003F-00000000 [SL 00]
CPUID 8000001D: 00004122-0040003F-000001FF-00000000 [SL 01]
CPUID 8000001D: 00004143-03C0003F-000007FF-00000001 [SL 02]
CPUID 8000001D: 0001C163-0FC0003F-000007FF-00000001 [SL 03]
CPUID 8000001E: 00000017-00000103-00000000-00000000
CPUID 8FFFFFFF: 00000000-00000000-00000000-00000000

L1    Data Cache:    16 KB,  4-way Associative, 64-byte Line
L1  Instr. Cache:    64 KB,  2-way Associative, 64-byte Line
L2 Unified Cache:     2 MB, 16-way Associative, 64-byte Line
L3 Unified Cache:     8 MB, 64-way Associative, 64-byte Line

------[ All CPUs ]------

CPU   0: APICID   0 / Package 0 / Core  0 / Thread 0: Valid
CPU   1: APICID   1 / Package 0 / Core  1 / Thread 0: Valid
CPU   2: APICID   2 / Package 0 / Core  2 / Thread 0: Valid
CPU   3: APICID   3 / Package 0 / Core  3 / Thread 0: Valid
CPU   4: APICID   4 / Package 0 / Core  4 / Thread 0: Valid
CPU   5: APICID   5 / Package 0 / Core  5 / Thread 0: Valid
CPU   6: APICID   6 / Package 0 / Core  6 / Thread 0: Valid
CPU   7: APICID   7 / Package 0 / Core  7 / Thread 0: Valid

------[ MSR Registers ]------

CPU Clock (Normal): 1405 MHz
CPU Clock (TSC): 3612 MHz
CPU Multiplier: 7.0x
CPB PStates: 2
MSR 0000001B: 0000-0000-FEE0-0900
MSR 0000008B: 0000-0000-0600-0629
MSR 000000E7: 0000-0000-00DA-1CC7 [S200]
MSR 000000E7: 0000-0000-0001-9B73 [S200]
MSR 000000E7: 0000-0000-0001-966B
MSR 000000E8: 0000-0000-0000-F0F0 [S200]
MSR 000000E8: 0000-0000-0000-9E34 [S200]
MSR 000000E8: 0000-0000-0000-9D9C
MSR C0010004: 0000-0000-077C-BEC5
MSR C0010005: 0000-0000-0000-0000
MSR C0010006: 0000-0000-0000-0000
MSR C0010007: 0000-0000-0000-0000
MSR C0010015: 0000-0000-0100-1011
MSR C001001F: 0040-4000-0081-0008
MSR C0010055: 0000-0000-2000-0800
MSR C0010058: 0000-0000-E000-0021
MSR C0010061: 0000-0000-0000-0040
MSR C0010062: 0000-0000-0000-0000
MSR C0010063: 0000-0000-0000-0000
MSR C0010064: 8000-01B1-0000-161A [21.00x] [1.4125 V] [17.70 A] [PState Pb0]
MSR C0010065: 8000-01B1-0000-1617 [19.50x] [1.4125 V] [17.70 A] [PState Pb1]
MSR C0010066: 8000-0173-0000-2C14 [18.00x] [1.2750 V] [11.50 A] [PState P0]
MSR C0010067: 8000-0163-0000-3611 [16.50x] [1.2125 V] [ 9.90 A] [PState P1]
MSR C0010068: 8000-0149-0000-4A0B [13.50x] [1.0875 V] [ 7.30 A] [PState P2]
MSR C0010069: 8000-0131-0000-6005 [10.50x] [0.9500 V] [ 4.90 A] [PState P3]
MSR C001006A: 8000-0120-0000-704C [ 7.00x] [0.8500 V] [ 3.20 A] [PState P4]
MSR C001006B: 0000-0000-0000-0000
MSR C0010070: 0000-0000-4000-161A
MSR C0010071: 0000-0006-4000-161A [21.00x] [1.4125V]
MSR C0010071: 0000-0006-4006-164C [ 7.00x] [1.4125V]
MSR C0010071: 0100-0006-4006-164C [ 7.00x] [1.4125V]
MSR C0010071: 0100-0006-4006-164C [ 7.00x] [1.4125V]
MSR C0010071: 0000-0006-4006-164C [ 7.00x] [1.4125V]
MSR C0010140: 0000-0000-0000-0005
MSR C0010141: 0000-0000-0000-0010
MSR C0011023: 8000-4000-0000-0220

PerformanceFrequency = 3527519

CPU Clock M.Method = 6  (APIC K10)
PM Timer Address   = 2056  (0808h)

APIC Clock = 200.67 MHz  (AT = 105156 / TT = 15006 / try = 1 / SKL = 0.00 MHz)
APIC Clock = 200.64 MHz  (AT = 105151 / TT = 15008 / try = 1 / SKL = 0.00 MHz)
APIC Clock = 200.68 MHz  (AT = 105139 / TT = 15003 / try = 1 / SKL = 0.00 MHz)
APIC Clock = 200.67 MHz  (AT = 105164 / TT = 15007 / try = 1 / SKL = 0.00 MHz)
APIC Clock = 200.66 MHz  (AT = 105144 / TT = 15005 / try = 1 / SKL = 0.00 MHz)

CPU Clock = 1404.77 MHz / TSC Clock = 3612.12 MHz / CPU Mul = 7.00x
CPU Clock = 1404.70 MHz / TSC Clock = 3612.09 MHz / CPU Mul = 7.00x
CPU Clock = 4213.99 MHz / TSC Clock = 3612.15 MHz / CPU Mul = 21.00x
CPU Clock = 1404.66 MHz / TSC Clock = 3612.10 MHz / CPU Mul = 7.00x
CPU Clock = 1404.64 MHz / TSC Clock = 3612.06 MHz / CPU Mul = 7.00x

CPU Clock Max = 4214.03 MHz / TSC Clock = 3612.03 MHz / CPU Mul = 21.00x
CPU Clock Max = 4214.07 MHz / TSC Clock = 3612.11 MHz / CPU Mul = 21.00x
CPU Clock Max = 4213.83 MHz / TSC Clock = 3612.08 MHz / CPU Mul = 21.00x
CPU Clock Max = 4214.07 MHz / TSC Clock = 3612.13 MHz / CPU Mul = 21.00x
CPU Clock Max = 4213.99 MHz / TSC Clock = 3612.08 MHz / CPU Mul = 21.00x

------[ APIC Base at 00000000-FEE00000 ]------

  0000  00 00 00 00 00 00 00 00 00 00 00 00 00 00 00 00 
  0010  00 00 00 00 00 00 00 00 00 00 00 00 00 00 00 00 
  0020  00 00 00 10 00 00 00 00 00 00 00 10 00 00 00 00 
  0030  10 00 05 80 00 00 00 00 10 00 05 80 00 00 00 00 
  0040  00 00 00 00 00 00 00 00 00 00 00 00 00 00 00 00 
  0050  00 00 00 00 00 00 00 00 00 00 00 00 00 00 00 00 
  0060  00 00 00 00 00 00 00 00 00 00 00 00 00 00 00 00 
  0070  00 00 00 00 00 00 00 00 00 00 00 00 00 00 00 00 
  0080  00 00 00 00 00 00 00 00 00 00 00 00 00 00 00 00 
  0090  00 00 00 00 00 00 00 00 00 00 00 00 00 00 00 00 
  00A0  00 00 00 00 00 00 00 00 00 00 00 00 00 00 00 00 
  00B0  00 00 00 00 00 00 00 00 00 00 00 00 00 00 00 00 
  00C0  AD 00 DE 00 00 00 00 00 AD 00 DE 00 00 00 00 00 
  00D0  00 00 00 01 00 00 00 00 00 00 00 01 00 00 00 00 
  00E0  FF FF FF FF 00 00 00 00 FF FF FF FF 00 00 00 00 
  00F0  3F 01 00 00 00 00 00 00 3F 01 00 00 00 00 00 00 
  0100  00 00 00 00 00 00 00 00 00 00 00 00 00 00 00 00 
  0110  00 00 00 00 00 00 00 00 00 00 00 00 00 00 00 00 
  0120  00 00 00 00 00 00 00 00 00 00 00 00 00 00 00 00 
  0130  00 00 00 00 00 00 00 00 00 00 00 00 00 00 00 00 
  0140  00 00 00 00 00 00 00 00 00 00 00 00 00 00 00 00 
  0150  00 00 00 00 00 00 00 00 00 00 00 00 00 00 00 00 
  0160  00 00 00 00 00 00 00 00 00 00 00 00 00 00 00 00 
  0170  00 00 00 00 00 00 00 00 00 00 00 00 00 00 00 00 
  0180  00 00 00 00 00 00 00 00 00 00 00 00 00 00 00 00 
  0190  00 00 00 00 00 00 00 00 00 00 00 00 00 00 00 00 
  01A0  00 00 00 00 00 00 00 00 00 00 00 00 00 00 00 00 
  01B0  04 00 04 00 00 00 00 00 04 00 04 00 00 00 00 00 
  01C0  04 00 00 00 00 00 00 00 04 00 00 00 00 00 00 00 
  01D0  0C 00 0E 00 00 00 00 00 0C 00 0E 00 00 00 00 00 
  01E0  00 00 00 00 00 00 00 00 00 00 00 00 00 00 00 00 
  01F0  00 00 00 00 00 00 00 00 00 00 00 00 00 00 00 00 
  0200  00 00 00 00 00 00 00 00 00 00 00 00 00 00 00 00 
  0210  00 00 00 00 00 00 00 00 00 00 00 00 00 00 00 00 
  0220  00 00 00 00 00 00 00 00 00 00 00 00 00 00 00 00 
  0230  00 00 00 00 00 00 00 00 00 00 00 00 00 00 00 00 
  0240  00 00 00 00 00 00 00 00 00 00 00 00 00 00 00 00 
  0250  00 00 00 00 00 00 00 00 00 00 00 00 00 00 00 00 
  0260  00 00 00 00 00 00 00 00 00 00 00 00 00 00 00 00 
  0270  00 00 00 00 00 00 00 00 00 00 00 00 00 00 00 00 
  0280  80 00 00 00 00 00 00 00 80 00 00 00 00 00 00 00 
  0290  00 00 00 00 00 00 00 00 00 00 00 00 00 00 00 00 
  02A0  00 00 00 00 00 00 00 00 00 00 00 00 00 00 00 00 
  02B0  00 00 00 00 00 00 00 00 00 00 00 00 00 00 00 00 
  02C0  00 00 00 00 00 00 00 00 00 00 00 00 00 00 00 00 
  02D0  00 00 00 00 00 00 00 00 00 00 00 00 00 00 00 00 
  02E0  00 00 00 00 00 00 00 00 00 00 00 00 00 00 00 00 
  02F0  00 00 00 00 00 00 00 00 00 00 00 00 00 00 00 00 
  0300  2F 00 02 00 00 00 00 00 2F 00 02 00 00 00 00 00 
  0310  00 00 00 17 00 00 00 00 00 00 00 17 00 00 00 00 
  0320  FD 00 03 00 00 00 00 00 FD 00 03 00 00 00 00 00 
  0330  00 00 01 00 00 00 00 00 00 00 01 00 00 00 00 00 
  0340  FE 00 00 00 00 00 00 00 FE 00 00 00 00 00 00 00 
  0350  3F 00 01 00 00 00 00 00 3F 00 01 00 00 00 00 00 
  0360  FF 04 00 00 00 00 00 00 FF 04 00 00 00 00 00 00 
  0370  E3 00 00 00 00 00 00 00 E3 00 00 00 00 00 00 00 
  0380  00 00 00 00 00 00 00 00 00 00 00 00 00 00 00 00 
  0390  00 00 00 00 00 00 00 00 00 00 00 00 00 00 00 00 
  03A0  00 00 00 00 00 00 00 00 00 00 00 00 00 00 00 00 
  03B0  00 00 00 00 00 00 00 00 00 00 00 00 00 00 00 00 
  03C0  00 00 00 00 00 00 00 00 00 00 00 00 00 00 00 00 
  03D0  00 00 00 00 00 00 00 00 00 00 00 00 00 00 00 00 
  03E0  0B 00 00 00 00 00 00 00 0B 00 00 00 00 00 00 00 
  03F0  00 00 00 00 00 00 00 00 00 00 00 00 00 00 00 00 
