------[ Logical CPU #0 ]------

allcpu: Package 0 / Core 0 / Thread 0: Valid

CPUID 00000000: 0000000D-68747541-444D4163-69746E65 [AuthenticAMD]
CPUID 00000001: 00810F81-00080800-7ED8320B-178BFBFF
CPUID 00000002: 00000000-00000000-00000000-00000000
CPUID 00000003: 00000000-00000000-00000000-00000000
CPUID 00000005: 00000040-00000040-00000003-00000011
CPUID 00000006: 00000004-00000000-00000001-00000000
CPUID 00000007: 00000000-209C01A9-00000000-00000000
CPUID 00000008: 00000000-00000000-00000000-00000000
CPUID 00000009: 00000000-00000000-00000000-00000000
CPUID 0000000A: 00000000-00000000-00000000-00000000
CPUID 0000000C: 00000000-00000000-00000000-00000000
CPUID 0000000D: 00000007-00000340-00000340-00000000 [SL 00] [x87]
CPUID 0000000D: 0000000F-00000340-00000000-00000000 [SL 01] [SSE]
CPUID 0000000D: 00000100-00000240-00000000-00000000 [SL 02] [AVX]
CPUID 80000000: 8000001F-68747541-444D4163-69746E65 [AuthenticAMD]
CPUID 80000001: 00810F81-00000000-35C233FF-2FD3FBFF
CPUID 80000002: 20444D41-657A7952-2035206E-30353533 [AMD Ryzen 5 3550]
CPUID 80000003: 69772048-52206874-6F656461-6556206E [H with Radeon Ve]
CPUID 80000004: 4D206167-6C69626F-66472065-00202078 [ga Mobile Gfx  ]
CPUID 80000005: FF40FF40-FF40FF40-20080140-40040140 [L1D: 32 KB / L1I: 64 KB]
CPUID 80000006: 26006400-66006400-02006140-00208140 [L2: 512 KB] / L3: 4096 KB]
CPUID 80000007: 00000000-0000001B-00000000-00006599
CPUID 80000008: 00003030-00001007-00004007-00000000
CPUID 80000009: 00000000-00000000-00000000-00000000
CPUID 8000000A: 00000001-00008000-00000000-0001BCFF
CPUID 8000000B: 00000000-00000000-00000000-00000000
CPUID 8000000C: 00000000-00000000-00000000-00000000
CPUID 8000000D: 00000000-00000000-00000000-00000000
CPUID 8000000E: 00000000-00000000-00000000-00000000
CPUID 8000000F: 00000000-00000000-00000000-00000000
CPUID 80000010: 00000000-00000000-00000000-00000000
CPUID 80000011: 00000000-00000000-00000000-00000000
CPUID 80000012: 00000000-00000000-00000000-00000000
CPUID 80000013: 00000000-00000000-00000000-00000000
CPUID 80000014: 00000000-00000000-00000000-00000000
CPUID 80000015: 00000000-00000000-00000000-00000000
CPUID 80000016: 00000000-00000000-00000000-00000000
CPUID 80000017: 00000000-00000000-00000000-00000000
CPUID 80000018: 00000000-00000000-00000000-00000000
CPUID 80000019: F040F040-00000000-00000000-00000000
CPUID 8000001A: 00000003-00000000-00000000-00000000
CPUID 8000001B: 000003FF-00000000-00000000-00000000
CPUID 8000001C: 00000000-00000000-00000000-00000000
CPUID 8000001D: 00004121-01C0003F-0000003F-00000000 [SL 00] [L1D: 32 KB]
CPUID 8000001D: 00004122-00C0003F-000000FF-00000000 [SL 01] [L1I: 64 KB]
CPUID 8000001D: 00004143-01C0003F-000003FF-00000002 [SL 02] [L2U: 512 KB]
CPUID 8000001D: 0001C163-03C0003F-00000FFF-00000001 [SL 03] [L3U: 4 MB]
CPUID 8000001E: 00000000-00000100-00000000-00000000
CPUID 8000001F: 0000000F-0000016F-0000000F-00000000
CPUID 8FFFFFFF: 00000000-00000000-00000000-00000000

L1    Data Cache:    32 KB,  8-way Associative, 64-byte Line
L1  Instr. Cache:    64 KB,  4-way Associative, 64-byte Line
L2 Unified Cache:   512 KB,  8-way Associative, 64-byte Line
L3 Unified Cache:     4 MB, 16-way Associative, 64-byte Line

------[ Logical CPU #1 ]------

allcpu: Package 0 / Core 0 / Thread 1: Valid, Virtual

CPUID 00000000: 0000000D-68747541-444D4163-69746E65 [AuthenticAMD]
CPUID 00000001: 00810F81-01080800-7ED8320B-178BFBFF
CPUID 00000002: 00000000-00000000-00000000-00000000
CPUID 00000003: 00000000-00000000-00000000-00000000
CPUID 00000005: 00000040-00000040-00000003-00000011
CPUID 00000006: 00000004-00000000-00000001-00000000
CPUID 00000007: 00000000-209C01A9-00000000-00000000
CPUID 00000008: 00000000-00000000-00000000-00000000
CPUID 00000009: 00000000-00000000-00000000-00000000
CPUID 0000000A: 00000000-00000000-00000000-00000000
CPUID 0000000C: 00000000-00000000-00000000-00000000
CPUID 0000000D: 00000007-00000340-00000340-00000000 [SL 00] [x87]
CPUID 0000000D: 0000000F-00000340-00000000-00000000 [SL 01] [SSE]
CPUID 0000000D: 00000100-00000240-00000000-00000000 [SL 02] [AVX]
CPUID 80000000: 8000001F-68747541-444D4163-69746E65 [AuthenticAMD]
CPUID 80000001: 00810F81-00000000-35C233FF-2FD3FBFF
CPUID 80000002: 20444D41-657A7952-2035206E-30353533 [AMD Ryzen 5 3550]
CPUID 80000003: 69772048-52206874-6F656461-6556206E [H with Radeon Ve]
CPUID 80000004: 4D206167-6C69626F-66472065-00202078 [ga Mobile Gfx  ]
CPUID 80000005: FF40FF40-FF40FF40-20080140-40040140 [L1D: 32 KB / L1I: 64 KB]
CPUID 80000006: 26006400-66006400-02006140-00208140 [L2: 512 KB] / L3: 4096 KB]
CPUID 80000007: 00000000-0000001B-00000000-00006599
CPUID 80000008: 00003030-00001007-00004007-00000000
CPUID 80000009: 00000000-00000000-00000000-00000000
CPUID 8000000A: 00000001-00008000-00000000-0001BCFF
CPUID 8000000B: 00000000-00000000-00000000-00000000
CPUID 8000000C: 00000000-00000000-00000000-00000000
CPUID 8000000D: 00000000-00000000-00000000-00000000
CPUID 8000000E: 00000000-00000000-00000000-00000000
CPUID 8000000F: 00000000-00000000-00000000-00000000
CPUID 80000010: 00000000-00000000-00000000-00000000
CPUID 80000011: 00000000-00000000-00000000-00000000
CPUID 80000012: 00000000-00000000-00000000-00000000
CPUID 80000013: 00000000-00000000-00000000-00000000
CPUID 80000014: 00000000-00000000-00000000-00000000
CPUID 80000015: 00000000-00000000-00000000-00000000
CPUID 80000016: 00000000-00000000-00000000-00000000
CPUID 80000017: 00000000-00000000-00000000-00000000
CPUID 80000018: 00000000-00000000-00000000-00000000
CPUID 80000019: F040F040-00000000-00000000-00000000
CPUID 8000001A: 00000003-00000000-00000000-00000000
CPUID 8000001B: 000003FF-00000000-00000000-00000000
CPUID 8000001C: 00000000-00000000-00000000-00000000
CPUID 8000001D: 00004121-01C0003F-0000003F-00000000 [SL 00] [L1D: 32 KB]
CPUID 8000001D: 00004122-00C0003F-000000FF-00000000 [SL 01] [L1I: 64 KB]
CPUID 8000001D: 00004143-01C0003F-000003FF-00000002 [SL 02] [L2U: 512 KB]
CPUID 8000001D: 0001C163-03C0003F-00000FFF-00000001 [SL 03] [L3U: 4 MB]
CPUID 8000001E: 00000001-00000100-00000000-00000000
CPUID 8000001F: 0000000F-0000016F-0000000F-00000000
CPUID 8FFFFFFF: 00000000-00000000-00000000-00000000

L1    Data Cache:    32 KB,  8-way Associative, 64-byte Line
L1  Instr. Cache:    64 KB,  4-way Associative, 64-byte Line
L2 Unified Cache:   512 KB,  8-way Associative, 64-byte Line
L3 Unified Cache:     4 MB, 16-way Associative, 64-byte Line

------[ Logical CPU #2 ]------

allcpu: Package 0 / Core 1 / Thread 0: Valid

CPUID 00000000: 0000000D-68747541-444D4163-69746E65 [AuthenticAMD]
CPUID 00000001: 00810F81-02080800-7ED8320B-178BFBFF
CPUID 00000002: 00000000-00000000-00000000-00000000
CPUID 00000003: 00000000-00000000-00000000-00000000
CPUID 00000005: 00000040-00000040-00000003-00000011
CPUID 00000006: 00000004-00000000-00000001-00000000
CPUID 00000007: 00000000-209C01A9-00000000-00000000
CPUID 00000008: 00000000-00000000-00000000-00000000
CPUID 00000009: 00000000-00000000-00000000-00000000
CPUID 0000000A: 00000000-00000000-00000000-00000000
CPUID 0000000C: 00000000-00000000-00000000-00000000
CPUID 0000000D: 00000007-00000340-00000340-00000000 [SL 00] [x87]
CPUID 0000000D: 0000000F-00000340-00000000-00000000 [SL 01] [SSE]
CPUID 0000000D: 00000100-00000240-00000000-00000000 [SL 02] [AVX]
CPUID 80000000: 8000001F-68747541-444D4163-69746E65 [AuthenticAMD]
CPUID 80000001: 00810F81-00000000-35C233FF-2FD3FBFF
CPUID 80000002: 20444D41-657A7952-2035206E-30353533 [AMD Ryzen 5 3550]
CPUID 80000003: 69772048-52206874-6F656461-6556206E [H with Radeon Ve]
CPUID 80000004: 4D206167-6C69626F-66472065-00202078 [ga Mobile Gfx  ]
CPUID 80000005: FF40FF40-FF40FF40-20080140-40040140 [L1D: 32 KB / L1I: 64 KB]
CPUID 80000006: 26006400-66006400-02006140-00208140 [L2: 512 KB] / L3: 4096 KB]
CPUID 80000007: 00000000-0000001B-00000000-00006599
CPUID 80000008: 00003030-00001007-00004007-00000000
CPUID 80000009: 00000000-00000000-00000000-00000000
CPUID 8000000A: 00000001-00008000-00000000-0001BCFF
CPUID 8000000B: 00000000-00000000-00000000-00000000
CPUID 8000000C: 00000000-00000000-00000000-00000000
CPUID 8000000D: 00000000-00000000-00000000-00000000
CPUID 8000000E: 00000000-00000000-00000000-00000000
CPUID 8000000F: 00000000-00000000-00000000-00000000
CPUID 80000010: 00000000-00000000-00000000-00000000
CPUID 80000011: 00000000-00000000-00000000-00000000
CPUID 80000012: 00000000-00000000-00000000-00000000
CPUID 80000013: 00000000-00000000-00000000-00000000
CPUID 80000014: 00000000-00000000-00000000-00000000
CPUID 80000015: 00000000-00000000-00000000-00000000
CPUID 80000016: 00000000-00000000-00000000-00000000
CPUID 80000017: 00000000-00000000-00000000-00000000
CPUID 80000018: 00000000-00000000-00000000-00000000
CPUID 80000019: F040F040-00000000-00000000-00000000
CPUID 8000001A: 00000003-00000000-00000000-00000000
CPUID 8000001B: 000003FF-00000000-00000000-00000000
CPUID 8000001C: 00000000-00000000-00000000-00000000
CPUID 8000001D: 00004121-01C0003F-0000003F-00000000 [SL 00] [L1D: 32 KB]
CPUID 8000001D: 00004122-00C0003F-000000FF-00000000 [SL 01] [L1I: 64 KB]
CPUID 8000001D: 00004143-01C0003F-000003FF-00000002 [SL 02] [L2U: 512 KB]
CPUID 8000001D: 0001C163-03C0003F-00000FFF-00000001 [SL 03] [L3U: 4 MB]
CPUID 8000001E: 00000002-00000101-00000000-00000000
CPUID 8000001F: 0000000F-0000016F-0000000F-00000000
CPUID 8FFFFFFF: 00000000-00000000-00000000-00000000

L1    Data Cache:    32 KB,  8-way Associative, 64-byte Line
L1  Instr. Cache:    64 KB,  4-way Associative, 64-byte Line
L2 Unified Cache:   512 KB,  8-way Associative, 64-byte Line
L3 Unified Cache:     4 MB, 16-way Associative, 64-byte Line

------[ Logical CPU #3 ]------

allcpu: Package 0 / Core 1 / Thread 1: Valid, Virtual

CPUID 00000000: 0000000D-68747541-444D4163-69746E65 [AuthenticAMD]
CPUID 00000001: 00810F81-03080800-7ED8320B-178BFBFF
CPUID 00000002: 00000000-00000000-00000000-00000000
CPUID 00000003: 00000000-00000000-00000000-00000000
CPUID 00000005: 00000040-00000040-00000003-00000011
CPUID 00000006: 00000004-00000000-00000001-00000000
CPUID 00000007: 00000000-209C01A9-00000000-00000000
CPUID 00000008: 00000000-00000000-00000000-00000000
CPUID 00000009: 00000000-00000000-00000000-00000000
CPUID 0000000A: 00000000-00000000-00000000-00000000
CPUID 0000000C: 00000000-00000000-00000000-00000000
CPUID 0000000D: 00000007-00000340-00000340-00000000 [SL 00] [x87]
CPUID 0000000D: 0000000F-00000340-00000000-00000000 [SL 01] [SSE]
CPUID 0000000D: 00000100-00000240-00000000-00000000 [SL 02] [AVX]
CPUID 80000000: 8000001F-68747541-444D4163-69746E65 [AuthenticAMD]
CPUID 80000001: 00810F81-00000000-35C233FF-2FD3FBFF
CPUID 80000002: 20444D41-657A7952-2035206E-30353533 [AMD Ryzen 5 3550]
CPUID 80000003: 69772048-52206874-6F656461-6556206E [H with Radeon Ve]
CPUID 80000004: 4D206167-6C69626F-66472065-00202078 [ga Mobile Gfx  ]
CPUID 80000005: FF40FF40-FF40FF40-20080140-40040140 [L1D: 32 KB / L1I: 64 KB]
CPUID 80000006: 26006400-66006400-02006140-00208140 [L2: 512 KB] / L3: 4096 KB]
CPUID 80000007: 00000000-0000001B-00000000-00006599
CPUID 80000008: 00003030-00001007-00004007-00000000
CPUID 80000009: 00000000-00000000-00000000-00000000
CPUID 8000000A: 00000001-00008000-00000000-0001BCFF
CPUID 8000000B: 00000000-00000000-00000000-00000000
CPUID 8000000C: 00000000-00000000-00000000-00000000
CPUID 8000000D: 00000000-00000000-00000000-00000000
CPUID 8000000E: 00000000-00000000-00000000-00000000
CPUID 8000000F: 00000000-00000000-00000000-00000000
CPUID 80000010: 00000000-00000000-00000000-00000000
CPUID 80000011: 00000000-00000000-00000000-00000000
CPUID 80000012: 00000000-00000000-00000000-00000000
CPUID 80000013: 00000000-00000000-00000000-00000000
CPUID 80000014: 00000000-00000000-00000000-00000000
CPUID 80000015: 00000000-00000000-00000000-00000000
CPUID 80000016: 00000000-00000000-00000000-00000000
CPUID 80000017: 00000000-00000000-00000000-00000000
CPUID 80000018: 00000000-00000000-00000000-00000000
CPUID 80000019: F040F040-00000000-00000000-00000000
CPUID 8000001A: 00000003-00000000-00000000-00000000
CPUID 8000001B: 000003FF-00000000-00000000-00000000
CPUID 8000001C: 00000000-00000000-00000000-00000000
CPUID 8000001D: 00004121-01C0003F-0000003F-00000000 [SL 00] [L1D: 32 KB]
CPUID 8000001D: 00004122-00C0003F-000000FF-00000000 [SL 01] [L1I: 64 KB]
CPUID 8000001D: 00004143-01C0003F-000003FF-00000002 [SL 02] [L2U: 512 KB]
CPUID 8000001D: 0001C163-03C0003F-00000FFF-00000001 [SL 03] [L3U: 4 MB]
CPUID 8000001E: 00000003-00000101-00000000-00000000
CPUID 8000001F: 0000000F-0000016F-0000000F-00000000
CPUID 8FFFFFFF: 00000000-00000000-00000000-00000000

L1    Data Cache:    32 KB,  8-way Associative, 64-byte Line
L1  Instr. Cache:    64 KB,  4-way Associative, 64-byte Line
L2 Unified Cache:   512 KB,  8-way Associative, 64-byte Line
L3 Unified Cache:     4 MB, 16-way Associative, 64-byte Line

------[ Logical CPU #4 ]------

allcpu: Package 0 / Core 2 / Thread 0: Valid

CPUID 00000000: 0000000D-68747541-444D4163-69746E65 [AuthenticAMD]
CPUID 00000001: 00810F81-04080800-7ED8320B-178BFBFF
CPUID 00000002: 00000000-00000000-00000000-00000000
CPUID 00000003: 00000000-00000000-00000000-00000000
CPUID 00000005: 00000040-00000040-00000003-00000011
CPUID 00000006: 00000004-00000000-00000001-00000000
CPUID 00000007: 00000000-209C01A9-00000000-00000000
CPUID 00000008: 00000000-00000000-00000000-00000000
CPUID 00000009: 00000000-00000000-00000000-00000000
CPUID 0000000A: 00000000-00000000-00000000-00000000
CPUID 0000000C: 00000000-00000000-00000000-00000000
CPUID 0000000D: 00000007-00000340-00000340-00000000 [SL 00] [x87]
CPUID 0000000D: 0000000F-00000340-00000000-00000000 [SL 01] [SSE]
CPUID 0000000D: 00000100-00000240-00000000-00000000 [SL 02] [AVX]
CPUID 80000000: 8000001F-68747541-444D4163-69746E65 [AuthenticAMD]
CPUID 80000001: 00810F81-00000000-35C233FF-2FD3FBFF
CPUID 80000002: 20444D41-657A7952-2035206E-30353533 [AMD Ryzen 5 3550]
CPUID 80000003: 69772048-52206874-6F656461-6556206E [H with Radeon Ve]
CPUID 80000004: 4D206167-6C69626F-66472065-00202078 [ga Mobile Gfx  ]
CPUID 80000005: FF40FF40-FF40FF40-20080140-40040140 [L1D: 32 KB / L1I: 64 KB]
CPUID 80000006: 26006400-66006400-02006140-00208140 [L2: 512 KB] / L3: 4096 KB]
CPUID 80000007: 00000000-0000001B-00000000-00006599
CPUID 80000008: 00003030-00001007-00004007-00000000
CPUID 80000009: 00000000-00000000-00000000-00000000
CPUID 8000000A: 00000001-00008000-00000000-0001BCFF
CPUID 8000000B: 00000000-00000000-00000000-00000000
CPUID 8000000C: 00000000-00000000-00000000-00000000
CPUID 8000000D: 00000000-00000000-00000000-00000000
CPUID 8000000E: 00000000-00000000-00000000-00000000
CPUID 8000000F: 00000000-00000000-00000000-00000000
CPUID 80000010: 00000000-00000000-00000000-00000000
CPUID 80000011: 00000000-00000000-00000000-00000000
CPUID 80000012: 00000000-00000000-00000000-00000000
CPUID 80000013: 00000000-00000000-00000000-00000000
CPUID 80000014: 00000000-00000000-00000000-00000000
CPUID 80000015: 00000000-00000000-00000000-00000000
CPUID 80000016: 00000000-00000000-00000000-00000000
CPUID 80000017: 00000000-00000000-00000000-00000000
CPUID 80000018: 00000000-00000000-00000000-00000000
CPUID 80000019: F040F040-00000000-00000000-00000000
CPUID 8000001A: 00000003-00000000-00000000-00000000
CPUID 8000001B: 000003FF-00000000-00000000-00000000
CPUID 8000001C: 00000000-00000000-00000000-00000000
CPUID 8000001D: 00004121-01C0003F-0000003F-00000000 [SL 00] [L1D: 32 KB]
CPUID 8000001D: 00004122-00C0003F-000000FF-00000000 [SL 01] [L1I: 64 KB]
CPUID 8000001D: 00004143-01C0003F-000003FF-00000002 [SL 02] [L2U: 512 KB]
CPUID 8000001D: 0001C163-03C0003F-00000FFF-00000001 [SL 03] [L3U: 4 MB]
CPUID 8000001E: 00000004-00000102-00000000-00000000
CPUID 8000001F: 0000000F-0000016F-0000000F-00000000
CPUID 8FFFFFFF: 00000000-00000000-00000000-00000000

L1    Data Cache:    32 KB,  8-way Associative, 64-byte Line
L1  Instr. Cache:    64 KB,  4-way Associative, 64-byte Line
L2 Unified Cache:   512 KB,  8-way Associative, 64-byte Line
L3 Unified Cache:     4 MB, 16-way Associative, 64-byte Line

------[ Logical CPU #5 ]------

allcpu: Package 0 / Core 2 / Thread 1: Valid, Virtual

CPUID 00000000: 0000000D-68747541-444D4163-69746E65 [AuthenticAMD]
CPUID 00000001: 00810F81-05080800-7ED8320B-178BFBFF
CPUID 00000002: 00000000-00000000-00000000-00000000
CPUID 00000003: 00000000-00000000-00000000-00000000
CPUID 00000005: 00000040-00000040-00000003-00000011
CPUID 00000006: 00000004-00000000-00000001-00000000
CPUID 00000007: 00000000-209C01A9-00000000-00000000
CPUID 00000008: 00000000-00000000-00000000-00000000
CPUID 00000009: 00000000-00000000-00000000-00000000
CPUID 0000000A: 00000000-00000000-00000000-00000000
CPUID 0000000C: 00000000-00000000-00000000-00000000
CPUID 0000000D: 00000007-00000340-00000340-00000000 [SL 00] [x87]
CPUID 0000000D: 0000000F-00000340-00000000-00000000 [SL 01] [SSE]
CPUID 0000000D: 00000100-00000240-00000000-00000000 [SL 02] [AVX]
CPUID 80000000: 8000001F-68747541-444D4163-69746E65 [AuthenticAMD]
CPUID 80000001: 00810F81-00000000-35C233FF-2FD3FBFF
CPUID 80000002: 20444D41-657A7952-2035206E-30353533 [AMD Ryzen 5 3550]
CPUID 80000003: 69772048-52206874-6F656461-6556206E [H with Radeon Ve]
CPUID 80000004: 4D206167-6C69626F-66472065-00202078 [ga Mobile Gfx  ]
CPUID 80000005: FF40FF40-FF40FF40-20080140-40040140 [L1D: 32 KB / L1I: 64 KB]
CPUID 80000006: 26006400-66006400-02006140-00208140 [L2: 512 KB] / L3: 4096 KB]
CPUID 80000007: 00000000-0000001B-00000000-00006599
CPUID 80000008: 00003030-00001007-00004007-00000000
CPUID 80000009: 00000000-00000000-00000000-00000000
CPUID 8000000A: 00000001-00008000-00000000-0001BCFF
CPUID 8000000B: 00000000-00000000-00000000-00000000
CPUID 8000000C: 00000000-00000000-00000000-00000000
CPUID 8000000D: 00000000-00000000-00000000-00000000
CPUID 8000000E: 00000000-00000000-00000000-00000000
CPUID 8000000F: 00000000-00000000-00000000-00000000
CPUID 80000010: 00000000-00000000-00000000-00000000
CPUID 80000011: 00000000-00000000-00000000-00000000
CPUID 80000012: 00000000-00000000-00000000-00000000
CPUID 80000013: 00000000-00000000-00000000-00000000
CPUID 80000014: 00000000-00000000-00000000-00000000
CPUID 80000015: 00000000-00000000-00000000-00000000
CPUID 80000016: 00000000-00000000-00000000-00000000
CPUID 80000017: 00000000-00000000-00000000-00000000
CPUID 80000018: 00000000-00000000-00000000-00000000
CPUID 80000019: F040F040-00000000-00000000-00000000
CPUID 8000001A: 00000003-00000000-00000000-00000000
CPUID 8000001B: 000003FF-00000000-00000000-00000000
CPUID 8000001C: 00000000-00000000-00000000-00000000
CPUID 8000001D: 00004121-01C0003F-0000003F-00000000 [SL 00] [L1D: 32 KB]
CPUID 8000001D: 00004122-00C0003F-000000FF-00000000 [SL 01] [L1I: 64 KB]
CPUID 8000001D: 00004143-01C0003F-000003FF-00000002 [SL 02] [L2U: 512 KB]
CPUID 8000001D: 0001C163-03C0003F-00000FFF-00000001 [SL 03] [L3U: 4 MB]
CPUID 8000001E: 00000005-00000102-00000000-00000000
CPUID 8000001F: 0000000F-0000016F-0000000F-00000000
CPUID 8FFFFFFF: 00000000-00000000-00000000-00000000

L1    Data Cache:    32 KB,  8-way Associative, 64-byte Line
L1  Instr. Cache:    64 KB,  4-way Associative, 64-byte Line
L2 Unified Cache:   512 KB,  8-way Associative, 64-byte Line
L3 Unified Cache:     4 MB, 16-way Associative, 64-byte Line

------[ Logical CPU #6 ]------

allcpu: Package 0 / Core 3 / Thread 0: Valid

CPUID 00000000: 0000000D-68747541-444D4163-69746E65 [AuthenticAMD]
CPUID 00000001: 00810F81-06080800-7ED8320B-178BFBFF
CPUID 00000002: 00000000-00000000-00000000-00000000
CPUID 00000003: 00000000-00000000-00000000-00000000
CPUID 00000005: 00000040-00000040-00000003-00000011
CPUID 00000006: 00000004-00000000-00000001-00000000
CPUID 00000007: 00000000-209C01A9-00000000-00000000
CPUID 00000008: 00000000-00000000-00000000-00000000
CPUID 00000009: 00000000-00000000-00000000-00000000
CPUID 0000000A: 00000000-00000000-00000000-00000000
CPUID 0000000C: 00000000-00000000-00000000-00000000
CPUID 0000000D: 00000007-00000340-00000340-00000000 [SL 00] [x87]
CPUID 0000000D: 0000000F-00000340-00000000-00000000 [SL 01] [SSE]
CPUID 0000000D: 00000100-00000240-00000000-00000000 [SL 02] [AVX]
CPUID 80000000: 8000001F-68747541-444D4163-69746E65 [AuthenticAMD]
CPUID 80000001: 00810F81-00000000-35C233FF-2FD3FBFF
CPUID 80000002: 20444D41-657A7952-2035206E-30353533 [AMD Ryzen 5 3550]
CPUID 80000003: 69772048-52206874-6F656461-6556206E [H with Radeon Ve]
CPUID 80000004: 4D206167-6C69626F-66472065-00202078 [ga Mobile Gfx  ]
CPUID 80000005: FF40FF40-FF40FF40-20080140-40040140 [L1D: 32 KB / L1I: 64 KB]
CPUID 80000006: 26006400-66006400-02006140-00208140 [L2: 512 KB] / L3: 4096 KB]
CPUID 80000007: 00000000-0000001B-00000000-00006599
CPUID 80000008: 00003030-00001007-00004007-00000000
CPUID 80000009: 00000000-00000000-00000000-00000000
CPUID 8000000A: 00000001-00008000-00000000-0001BCFF
CPUID 8000000B: 00000000-00000000-00000000-00000000
CPUID 8000000C: 00000000-00000000-00000000-00000000
CPUID 8000000D: 00000000-00000000-00000000-00000000
CPUID 8000000E: 00000000-00000000-00000000-00000000
CPUID 8000000F: 00000000-00000000-00000000-00000000
CPUID 80000010: 00000000-00000000-00000000-00000000
CPUID 80000011: 00000000-00000000-00000000-00000000
CPUID 80000012: 00000000-00000000-00000000-00000000
CPUID 80000013: 00000000-00000000-00000000-00000000
CPUID 80000014: 00000000-00000000-00000000-00000000
CPUID 80000015: 00000000-00000000-00000000-00000000
CPUID 80000016: 00000000-00000000-00000000-00000000
CPUID 80000017: 00000000-00000000-00000000-00000000
CPUID 80000018: 00000000-00000000-00000000-00000000
CPUID 80000019: F040F040-00000000-00000000-00000000
CPUID 8000001A: 00000003-00000000-00000000-00000000
CPUID 8000001B: 000003FF-00000000-00000000-00000000
CPUID 8000001C: 00000000-00000000-00000000-00000000
CPUID 8000001D: 00004121-01C0003F-0000003F-00000000 [SL 00] [L1D: 32 KB]
CPUID 8000001D: 00004122-00C0003F-000000FF-00000000 [SL 01] [L1I: 64 KB]
CPUID 8000001D: 00004143-01C0003F-000003FF-00000002 [SL 02] [L2U: 512 KB]
CPUID 8000001D: 0001C163-03C0003F-00000FFF-00000001 [SL 03] [L3U: 4 MB]
CPUID 8000001E: 00000006-00000103-00000000-00000000
CPUID 8000001F: 0000000F-0000016F-0000000F-00000000
CPUID 8FFFFFFF: 00000000-00000000-00000000-00000000

L1    Data Cache:    32 KB,  8-way Associative, 64-byte Line
L1  Instr. Cache:    64 KB,  4-way Associative, 64-byte Line
L2 Unified Cache:   512 KB,  8-way Associative, 64-byte Line
L3 Unified Cache:     4 MB, 16-way Associative, 64-byte Line

------[ Logical CPU #7 ]------

allcpu: Package 0 / Core 3 / Thread 1: Valid, Virtual

CPUID 00000000: 0000000D-68747541-444D4163-69746E65 [AuthenticAMD]
CPUID 00000001: 00810F81-07080800-7ED8320B-178BFBFF
CPUID 00000002: 00000000-00000000-00000000-00000000
CPUID 00000003: 00000000-00000000-00000000-00000000
CPUID 00000005: 00000040-00000040-00000003-00000011
CPUID 00000006: 00000004-00000000-00000001-00000000
CPUID 00000007: 00000000-209C01A9-00000000-00000000
CPUID 00000008: 00000000-00000000-00000000-00000000
CPUID 00000009: 00000000-00000000-00000000-00000000
CPUID 0000000A: 00000000-00000000-00000000-00000000
CPUID 0000000C: 00000000-00000000-00000000-00000000
CPUID 0000000D: 00000007-00000340-00000340-00000000 [SL 00] [x87]
CPUID 0000000D: 0000000F-00000340-00000000-00000000 [SL 01] [SSE]
CPUID 0000000D: 00000100-00000240-00000000-00000000 [SL 02] [AVX]
CPUID 80000000: 8000001F-68747541-444D4163-69746E65 [AuthenticAMD]
CPUID 80000001: 00810F81-00000000-35C233FF-2FD3FBFF
CPUID 80000002: 20444D41-657A7952-2035206E-30353533 [AMD Ryzen 5 3550]
CPUID 80000003: 69772048-52206874-6F656461-6556206E [H with Radeon Ve]
CPUID 80000004: 4D206167-6C69626F-66472065-00202078 [ga Mobile Gfx  ]
CPUID 80000005: FF40FF40-FF40FF40-20080140-40040140 [L1D: 32 KB / L1I: 64 KB]
CPUID 80000006: 26006400-66006400-02006140-00208140 [L2: 512 KB] / L3: 4096 KB]
CPUID 80000007: 00000000-0000001B-00000000-00006599
CPUID 80000008: 00003030-00001007-00004007-00000000
CPUID 80000009: 00000000-00000000-00000000-00000000
CPUID 8000000A: 00000001-00008000-00000000-0001BCFF
CPUID 8000000B: 00000000-00000000-00000000-00000000
CPUID 8000000C: 00000000-00000000-00000000-00000000
CPUID 8000000D: 00000000-00000000-00000000-00000000
CPUID 8000000E: 00000000-00000000-00000000-00000000
CPUID 8000000F: 00000000-00000000-00000000-00000000
CPUID 80000010: 00000000-00000000-00000000-00000000
CPUID 80000011: 00000000-00000000-00000000-00000000
CPUID 80000012: 00000000-00000000-00000000-00000000
CPUID 80000013: 00000000-00000000-00000000-00000000
CPUID 80000014: 00000000-00000000-00000000-00000000
CPUID 80000015: 00000000-00000000-00000000-00000000
CPUID 80000016: 00000000-00000000-00000000-00000000
CPUID 80000017: 00000000-00000000-00000000-00000000
CPUID 80000018: 00000000-00000000-00000000-00000000
CPUID 80000019: F040F040-00000000-00000000-00000000
CPUID 8000001A: 00000003-00000000-00000000-00000000
CPUID 8000001B: 000003FF-00000000-00000000-00000000
CPUID 8000001C: 00000000-00000000-00000000-00000000
CPUID 8000001D: 00004121-01C0003F-0000003F-00000000 [SL 00] [L1D: 32 KB]
CPUID 8000001D: 00004122-00C0003F-000000FF-00000000 [SL 01] [L1I: 64 KB]
CPUID 8000001D: 00004143-01C0003F-000003FF-00000002 [SL 02] [L2U: 512 KB]
CPUID 8000001D: 0001C163-03C0003F-00000FFF-00000001 [SL 03] [L3U: 4 MB]
CPUID 8000001E: 00000007-00000103-00000000-00000000
CPUID 8000001F: 0000000F-0000016F-0000000F-00000000
CPUID 8FFFFFFF: 00000000-00000000-00000000-00000000

L1    Data Cache:    32 KB,  8-way Associative, 64-byte Line
L1  Instr. Cache:    64 KB,  4-way Associative, 64-byte Line
L2 Unified Cache:   512 KB,  8-way Associative, 64-byte Line
L3 Unified Cache:     4 MB, 16-way Associative, 64-byte Line

------[ All CPUs ]------

CPU   0: APICID    0 / Package 0 / Core   0 / Thread 0: Valid
CPU   1: APICID    1 / Package 0 / Core   0 / Thread 1: Valid, Virtual
CPU   2: APICID    2 / Package 0 / Core   1 / Thread 0: Valid
CPU   3: APICID    3 / Package 0 / Core   1 / Thread 1: Valid, Virtual
CPU   4: APICID    4 / Package 0 / Core   2 / Thread 0: Valid
CPU   5: APICID    5 / Package 0 / Core   2 / Thread 1: Valid, Virtual
CPU   6: APICID    6 / Package 0 / Core   3 / Thread 0: Valid
CPU   7: APICID    7 / Package 0 / Core   3 / Thread 1: Valid, Virtual

------[ MSR Registers ]------

CPU Clock (Normal): 2773 MHz
CPU Clock (TSC): 2096 MHz
CPU Multiplier: 27.8x
CPB PStates: 0
MSR 0000001B: 0000-0000-FEE0-0900
MSR 0000008B: 0000-0000-0810-8102
MSR 000000E7: 0000-0000-01E4-2543 [S200]
MSR 000000E7: 0000-0000-0000-7BDE [S200]
MSR 000000E7: 0000-0000-0001-E576
MSR 000000E8: 0000-0000-0001-7698 [S200]
MSR 000000E8: 0000-0000-0001-0FD0 [S200]
MSR 000000E8: 0000-0000-0000-AFFB
MSR C0010004: 0000-0000-0000-0000
MSR C0010005: 0000-0000-0000-0000
MSR C0010006: 0000-0000-0000-0000
MSR C0010007: 0000-0000-0000-0000
MSR C0010015: 0000-0000-0900-0011
MSR C001001F: 0000-0000-0000-0000
MSR C0010055: 0000-0000-0000-0000
MSR C0010058: 0000-0000-F800-0019
MSR C0010061: 0000-0000-0000-0020
MSR C0010062: 0000-0000-0000-0002
MSR C0010063: 0000-0000-0000-0002
MSR C0010064: 8000-0000-454D-4A69 [21.00x] [1.2188 V] [ 2.10 A] [PState P0]
MSR C0010065: 8000-0000-4458-0C66 [17.00x] [0.9500 V] [ 1.70 A] [PState P1]
MSR C0010066: 8000-0000-4399-8E62 [14.00x] [0.9125 V] [ 1.40 A] [PState P2]
MSR C0010067: 0000-0000-4016-0000
MSR C0010068: 0000-0000-4016-0000
MSR C0010069: 0000-0000-4016-0000
MSR C001006A: 0000-0000-4016-0000
MSR C001006B: 0000-0000-4016-0000
MSR C0010070: < FAILED >
MSR C0010293: 0000-0000-00A1-0E62 [14.00x] [0.7250V]
MSR C0010293: 0000-0000-00A0-8E62 [14.00x] [0.7375V]
MSR C0010293: 0000-0000-00A1-0E62 [14.00x] [0.7250V]
MSR C0010293: 0000-0000-00A1-0E62 [14.00x] [0.7250V]
MSR C0010293: 0000-0000-00A1-0E62 [14.00x] [0.7250V]
MSR C0010140: 0000-0000-0000-0000
MSR C0010141: 0000-0000-0000-0000
MSR C0010290: 0000-0000-0000-0000
MSR C0010292: 0000-0001-0012-8040
MSR C0010293: 0000-0000-00A1-0E62
MSR C0010294: 0001-F59C-0007-8912
MSR C0010296: 0000-0000-0048-4848
MSR C0010299: 0000-0000-000A-1003
MSR C001029A: 0000-0000-0440-F739 [S200]
MSR C001029A: 0000-0000-0440-F743 [S200]
MSR C001029A: 0000-0000-0440-F754
MSR C001029B: 0000-0000-236F-2BC2 [S200]
MSR C001029B: 0000-0000-236F-618E [S200]
MSR C001029B: 0000-0000-236F-96EB
MSR C0011023: 0002-2000-0000-0000
