------[ Logical CPU #0 ]------

allcpu: Package 0 / Core 0 / Thread 0: Valid

CPUID 00000000: 0000000D-68747541-444D4163-69746E65 [AuthenticAMD]
CPUID 00000001: 00730F01-00020800-7ED8220B-178BFBFF
CPUID 00000002: 00000000-00000000-00000000-00000000
CPUID 00000003: 00000000-00000000-00000000-00000000
CPUID 00000005: 00000040-00000040-00000003-00000000
CPUID 00000006: 00000000-00000000-00000001-00000000
CPUID 00000007: 00000000-00000008-00000000-00000000
CPUID 00000008: 00000000-00000000-00000000-00000000
CPUID 00000009: 00000000-00000000-00000000-00000000
CPUID 0000000A: 00000000-00000000-00000000-00000000
CPUID 0000000C: 00000000-00000000-00000000-00000000
CPUID 0000000D: 00000007-00000340-00000340-00000000 [SL 00]
CPUID 0000000D: 00000001-00000000-00000000-00000000 [SL 01]
CPUID 0000000D: 00000100-00000240-00000000-00000000 [SL 02]
CPUID 80000000: 8000001E-68747541-444D4163-69746E65 [AuthenticAMD]
CPUID 80000001: 00730F01-00000000-1D4037FF-2FD3FBFF
CPUID 80000002: 20444D41-322D5847-434A3231-434F5320 [AMD GX-212JC SOC]
CPUID 80000003: 74697720-61522068-6E6F6564-294D5428 [ with Radeon(TM)]
CPUID 80000004: 45325220-61724720-63696870-00202073 [ R2E Graphics  ]
CPUID 80000005: FF08FF08-FF28FF20-20080140-20020140
CPUID 80000006: 21000000-42004200-04008140-00000000
CPUID 80000007: 00000000-00000001-00002800-000033D9
CPUID 80000008: 00003028-00000000-00003001-00000000
CPUID 80000009: 00000000-00000000-00000000-00000000
CPUID 8000000A: 00000001-00000008-00000000-00001CDF
CPUID 8000000B: 00000000-00000000-00000000-00000000
CPUID 8000000C: 00000000-00000000-00000000-00000000
CPUID 8000000D: 00000000-00000000-00000000-00000000
CPUID 8000000E: 00000000-00000000-00000000-00000000
CPUID 8000000F: 00000000-00000000-00000000-00000000
CPUID 80000010: 00000000-00000000-00000000-00000000
CPUID 80000011: 00000000-00000000-00000000-00000000
CPUID 80000012: 00000000-00000000-00000000-00000000
CPUID 80000013: 00000000-00000000-00000000-00000000
CPUID 80000014: 00000000-00000000-00000000-00000000
CPUID 80000015: 00000000-00000000-00000000-00000000
CPUID 80000016: 00000000-00000000-00000000-00000000
CPUID 80000017: 00000000-00000000-00000000-00000000
CPUID 80000018: 00000000-00000000-00000000-00000000
CPUID 80000019: 00000000-00000000-00000000-00000000
CPUID 8000001A: 00000003-00000000-00000000-00000000
CPUID 8000001B: 000000FF-00000000-00000000-00000000
CPUID 8000001C: 00000000-00000000-00000000-00000000
CPUID 8000001D: 00000121-01C0003F-0000003F-00000000 [SL 00]
CPUID 8000001D: 00000122-0040003F-000000FF-00000000 [SL 01]
CPUID 8000001D: 00004143-03C0003F-000003FF-00000002 [SL 02]
CPUID 8000001E: 00000000-00000000-00000000-00000000
CPUID 8FFFFFFF: 4C4C4548-494B204F-21595454-5E2D5E20 [HELLO KITTY! ^-^]

L1    Data Cache:    32 KB,  8-way Associative, 64-byte Line
L1  Instr. Cache:    32 KB,  2-way Associative, 64-byte Line
L2 Unified Cache:     1 MB, 16-way Associative, 64-byte Line

------[ Logical CPU #1 ]------

allcpu: Package 0 / Core 1 / Thread 0: Valid

CPUID 00000000: 0000000D-68747541-444D4163-69746E65 [AuthenticAMD]
CPUID 00000001: 00730F01-01020800-7ED8220B-178BFBFF
CPUID 00000002: 00000000-00000000-00000000-00000000
CPUID 00000003: 00000000-00000000-00000000-00000000
CPUID 00000005: 00000040-00000040-00000003-00000000
CPUID 00000006: 00000000-00000000-00000001-00000000
CPUID 00000007: 00000000-00000008-00000000-00000000
CPUID 00000008: 00000000-00000000-00000000-00000000
CPUID 00000009: 00000000-00000000-00000000-00000000
CPUID 0000000A: 00000000-00000000-00000000-00000000
CPUID 0000000C: 00000000-00000000-00000000-00000000
CPUID 0000000D: 00000007-00000340-00000340-00000000 [SL 00]
CPUID 0000000D: 00000001-00000000-00000000-00000000 [SL 01]
CPUID 0000000D: 00000100-00000240-00000000-00000000 [SL 02]
CPUID 80000000: 8000001E-68747541-444D4163-69746E65 [AuthenticAMD]
CPUID 80000001: 00730F01-00000000-1D4037FF-2FD3FBFF
CPUID 80000002: 20444D41-322D5847-434A3231-434F5320 [AMD GX-212JC SOC]
CPUID 80000003: 74697720-61522068-6E6F6564-294D5428 [ with Radeon(TM)]
CPUID 80000004: 45325220-61724720-63696870-00202073 [ R2E Graphics  ]
CPUID 80000005: FF08FF08-FF28FF20-20080140-20020140
CPUID 80000006: 21000000-42004200-04008140-00000000
CPUID 80000007: 00000000-00000001-00002800-000033D9
CPUID 80000008: 00003028-00000000-00003001-00000000
CPUID 80000009: 00000000-00000000-00000000-00000000
CPUID 8000000A: 00000001-00000008-00000000-00001CDF
CPUID 8000000B: 00000000-00000000-00000000-00000000
CPUID 8000000C: 00000000-00000000-00000000-00000000
CPUID 8000000D: 00000000-00000000-00000000-00000000
CPUID 8000000E: 00000000-00000000-00000000-00000000
CPUID 8000000F: 00000000-00000000-00000000-00000000
CPUID 80000010: 00000000-00000000-00000000-00000000
CPUID 80000011: 00000000-00000000-00000000-00000000
CPUID 80000012: 00000000-00000000-00000000-00000000
CPUID 80000013: 00000000-00000000-00000000-00000000
CPUID 80000014: 00000000-00000000-00000000-00000000
CPUID 80000015: 00000000-00000000-00000000-00000000
CPUID 80000016: 00000000-00000000-00000000-00000000
CPUID 80000017: 00000000-00000000-00000000-00000000
CPUID 80000018: 00000000-00000000-00000000-00000000
CPUID 80000019: 00000000-00000000-00000000-00000000
CPUID 8000001A: 00000003-00000000-00000000-00000000
CPUID 8000001B: 000000FF-00000000-00000000-00000000
CPUID 8000001C: 00000000-00000000-00000000-00000000
CPUID 8000001D: 00000121-01C0003F-0000003F-00000000 [SL 00]
CPUID 8000001D: 00000122-0040003F-000000FF-00000000 [SL 01]
CPUID 8000001D: 00004143-03C0003F-000003FF-00000002 [SL 02]
CPUID 8000001E: 00000001-00000001-00000000-00000000
CPUID 8FFFFFFF: 4C4C4548-494B204F-21595454-5E2D5E20 [HELLO KITTY! ^-^]

L1    Data Cache:    32 KB,  8-way Associative, 64-byte Line
L1  Instr. Cache:    32 KB,  2-way Associative, 64-byte Line
L2 Unified Cache:     1 MB, 16-way Associative, 64-byte Line

------[ All CPUs ]------

CPU   0: APICID   0 / Package 0 / Core  0 / Thread 0: Valid
CPU   1: APICID   1 / Package 0 / Core  1 / Thread 0: Valid

------[ MSR Registers ]------

CPU Clock (Normal): 1397 MHz
CPU Clock (TSC): 1198 MHz
CPU Multiplier: 14.0x
CPB PStates: 1
MSR 0000001B: 0000-0000-FEE0-0900
MSR 0000008B: 0000-0000-0703-0104
MSR 000000E7: 0000-0000-0046-DCA9 [S200]
MSR 000000E7: 0000-0000-0000-B1A4 [S200]
MSR 000000E7: 0000-0000-0000-B81B
MSR 000000E8: 0000-0000-0001-37D7 [S200]
MSR 000000E8: 0000-0000-001E-2BB5 [S200]
MSR 000000E8: 0000-0000-0001-4F05
MSR C0010004: 0000-0000-0000-0000
MSR C0010005: 0000-0000-0000-0000
MSR C0010006: 0000-0000-0000-0000
MSR C0010007: 0000-0000-0000-0000
MSR C0010015: 0000-0000-0100-0011
MSR C001001F: 40C8-4000-0085-0000
MSR C0010055: 0000-0000-0000-0000
MSR C0010058: 0000-0000-E000-0021
MSR C0010061: 0000-0000-0000-0030
MSR C0010062: 0000-0000-0000-0000
MSR C0010063: 0000-0000-0000-0000
MSR C0010064: 8000-02BE-0000-C44C [14.00x] [0.9375 V] [ 1.90 A] [PState Pb0]
MSR C0010065: 8000-02A0-0000-D448 [12.00x] [0.8875 V] [ 1.60 A] [PState P0]
MSR C0010066: 8000-027D-0000-E844 [10.00x] [0.8250 V] [ 1.25 A] [PState P1]
MSR C0010067: 8000-0269-0040-F440 [ 8.00x] [0.7875 V] [ 1.05 A] [PState P2]
MSR C0010068: 0000-0255-0040-FCE0
MSR C0010069: 0000-0000-0041-FE00
MSR C001006A: 0000-0000-0041-FE00
MSR C001006B: 0000-0000-0041-FE00
MSR C0010070: 0000-0000-7200-C44C
MSR C0010071: 381C-0002-7240-C44C [14.00x] [0.9375V]
MSR C0010071: 381C-0002-7240-C44C [14.00x] [0.9375V]
MSR C0010071: 381C-0002-7240-C44C [14.00x] [0.9375V]
MSR C0010071: 381C-0002-7240-C44C [14.00x] [0.9375V]
MSR C0010071: 381C-0002-7240-C44C [14.00x] [0.9375V]
MSR C0010140: 0000-0000-0000-0000
MSR C0010141: 0000-0000-0000-0000
MSR C0011023: 0000-0000-0000-0000
