------[ Versions ]------

Program Version : EVEREST v4.10.1072 Beta
BenchDLL Version: 2.2.186.0

------[ CPU Info ]------

CPU Type           : Unknown, 1200 MHz
Instruction Set    : x86, MMX, SSE, SSE2, SSE3
CPUID Manufacturer : CentaurHauls
CPUID CPU Name     : VIA C7-M Processor 1200MHz
CPUID Revision     : 000006D0h
Platform ID        : 00h  (Unknown)

------[ Logical CPU #0 ]------

allcpu: Valid

CPUID 00000000: 00000001-746E6543-736C7561-48727561
CPUID 00000001: 000006D0-00000800-00004181-A7C9BBFF
CPUID 80000000: 80000006-00000000-00000000-00000000
CPUID 80000001: 00000000-00000000-00000000-00100000
CPUID 80000002: 20202020-20202020-20202020-20202020
CPUID 80000003: 20202020-41495620-2D374320-7250204D
CPUID 80000004: 7365636F-20726F73-30303231-007A484D
CPUID 80000005: 00000000-08800880-40040140-40040140
CPUID 80000006: 00000000-00000000-0080A140-00000000
CPUID C0000000: C0000003-00000000-00000000-00000000
CPUID C0000001: 00000000-00000001-00000000-0000FFCC
CPUID C0000002: 00003A00-04000C09-04060C09-43040000
CPUID C0000003: 94D53FDE-7980BEBF-366B736B-ED908777

------[ MSR Registers ]------

MSR 0000002A: 0000-0000-4304-0000
MSR 00001153: 0406-0C09-FEFF-FFFF
MSR 0000019A: 0000-0000-0000-0000
MSR 0000019B: 0000-0000-0000-0000
MSR 0000019C: 0000-0000-0000-0000
MSR 0000019D: 0000-0000-0001-0406

PerformanceFrequency = 3579545
