------[ Logical CPU #0 ]------

allcpu: Package 0 / Core 0 / Thread 0: Valid

CPUID 00000000: 0000000D-746E6543-736C7561-48727561 [CentaurHauls]
CPUID 00000001: 000006FE-00040800-76DA63AB-BFCBFBFF
CPUID 00000002: 00000001-00000000-00000000-00000000
CPUID 00000003: 00000000-00000000-00000000-00000000
CPUID 00000004: 0C000121-01C0003F-0000003F-00000000 [SL 00]
CPUID 00000004: 0C000122-01C0003F-0000003F-00000000 [SL 01]
CPUID 00000004: 0C00C143-03C0003F-000007FF-00000000 [SL 02]
CPUID 00000005: 00000040-00000040-00000003-00022220
CPUID 00000006: 00000003-00000000-00000000-00000000
CPUID 00000007: 00000000-000C25AB-00000000-00000000
CPUID 00000008: 00000000-00000000-00000000-00000000
CPUID 00000009: 00000000-00000000-00000000-00000000
CPUID 0000000A: 06280202-00000000-00000000-00000503
CPUID 0000000B: 00000000-00000001-00000100-00000000 [SL 00]
CPUID 0000000B: 00000002-00000004-00000201-00000000 [SL 01]
CPUID 0000000C: 00000000-00000000-00000000-00000000
CPUID 0000000D: 00000007-00000240-00000340-00000000 [SL 00] [x87]
CPUID 0000000D: 00000001-00000000-00000000-00000000 [SL 01] [SSE]
CPUID 0000000D: 00000100-00000240-00000000-00000000 [SL 02] [AVX]
CPUID 80000000: 80000008-00000000-00000000-00000000
CPUID 80000001: 00000000-00000000-00000121-2C100800
CPUID 80000002: 20202020-20202020-20202020-4F41485A [            ZHAO]
CPUID 80000003: 204E4958-5869614B-206E6169-432D585A [XIN KaiXian ZX-C]
CPUID 80000004: 3443202B-40303835-33382E31-007A4847 [+ C4580@1.83GHz]
CPUID 80000005: 04200420-06600660-20080140-20080140
CPUID 80000006: 00000000-00000000-08008140-00000000
CPUID 80000007: 00000000-00000000-00000000-00000000
CPUID 80000008: 00003024-00000000-00000000-00000000
CPUID C0000000: C0000004-00000000-00000000-00000000
CPUID C0000001: 000006FE-00000000-00000000-1EC33DFC
CPUID C0000002: 00000000-00000000-00000000-00000000
CPUID C0000003: 00000000-00000000-00000000-00000000
CPUID C0000004: 00000028-08000B5E-08510B5D-00000000

L1    Data Cache:    32 KB,  8-way Associative, 64-byte Line
L1  Instr. Cache:    32 KB,  8-way Associative, 64-byte Line
L2 Unified Cache:     2 MB, 16-way Associative, 64-byte Line

------[ Logical CPU #1 ]------

allcpu: Package 0 / Core 1 / Thread 0: Valid

CPUID 00000000: 0000000D-746E6543-736C7561-48727561 [CentaurHauls]
CPUID 00000001: 000006FE-01040800-76DA63AB-BFCBFBFF
CPUID 00000002: 00000001-00000000-00000000-00000000
CPUID 00000003: 00000000-00000000-00000000-00000000
CPUID 00000004: 0C000121-01C0003F-0000003F-00000000 [SL 00]
CPUID 00000004: 0C000122-01C0003F-0000003F-00000000 [SL 01]
CPUID 00000004: 0C00C143-03C0003F-000007FF-00000000 [SL 02]
CPUID 00000005: 00000040-00000040-00000003-00022220
CPUID 00000006: 00000003-00000000-00000000-00000000
CPUID 00000007: 00000000-000C25AB-00000000-00000000
CPUID 00000008: 00000000-00000000-00000000-00000000
CPUID 00000009: 00000000-00000000-00000000-00000000
CPUID 0000000A: 06280202-00000000-00000000-00000503
CPUID 0000000B: 00000000-00000001-00000100-00000001 [SL 00]
CPUID 0000000B: 00000002-00000004-00000201-00000001 [SL 01]
CPUID 0000000C: 00000000-00000000-00000000-00000000
CPUID 0000000D: 00000007-00000240-00000340-00000000 [SL 00] [x87]
CPUID 0000000D: 00000001-00000000-00000000-00000000 [SL 01] [SSE]
CPUID 0000000D: 00000100-00000240-00000000-00000000 [SL 02] [AVX]
CPUID 80000000: 80000008-00000000-00000000-00000000
CPUID 80000001: 00000000-00000000-00000121-2C100800
CPUID 80000002: 20202020-20202020-20202020-4F41485A [            ZHAO]
CPUID 80000003: 204E4958-5869614B-206E6169-432D585A [XIN KaiXian ZX-C]
CPUID 80000004: 3443202B-40303835-33382E31-007A4847 [+ C4580@1.83GHz]
CPUID 80000005: 04200420-06600660-20080140-20080140
CPUID 80000006: 00000000-00000000-08008140-00000000
CPUID 80000007: 00000000-00000000-00000000-00000000
CPUID 80000008: 00003024-00000000-00000000-00000000
CPUID C0000000: C0000004-00000000-00000000-00000000
CPUID C0000001: 000006FE-00000000-00000000-1EC33DFC
CPUID C0000002: 00000000-00000000-00000000-00000000
CPUID C0000003: 00000000-00000000-00000000-00000000
CPUID C0000004: 00000028-08000B5E-08510B5D-00000000

L1    Data Cache:    32 KB,  8-way Associative, 64-byte Line
L1  Instr. Cache:    32 KB,  8-way Associative, 64-byte Line
L2 Unified Cache:     2 MB, 16-way Associative, 64-byte Line

------[ Logical CPU #2 ]------

allcpu: Package 0 / Core 2 / Thread 0: Valid

CPUID 00000000: 0000000D-746E6543-736C7561-48727561 [CentaurHauls]
CPUID 00000001: 000006FE-02040800-76DA63AB-BFCBFBFF
CPUID 00000002: 00000001-00000000-00000000-00000000
CPUID 00000003: 00000000-00000000-00000000-00000000
CPUID 00000004: 0C000121-01C0003F-0000003F-00000000 [SL 00]
CPUID 00000004: 0C000122-01C0003F-0000003F-00000000 [SL 01]
CPUID 00000004: 0C00C143-03C0003F-000007FF-00000000 [SL 02]
CPUID 00000005: 00000040-00000040-00000003-00022220
CPUID 00000006: 00000003-00000000-00000000-00000000
CPUID 00000007: 00000000-000C25AB-00000000-00000000
CPUID 00000008: 00000000-00000000-00000000-00000000
CPUID 00000009: 00000000-00000000-00000000-00000000
CPUID 0000000A: 06280202-00000000-00000000-00000503
CPUID 0000000B: 00000000-00000001-00000100-00000002 [SL 00]
CPUID 0000000B: 00000002-00000004-00000201-00000002 [SL 01]
CPUID 0000000C: 00000000-00000000-00000000-00000000
CPUID 0000000D: 00000007-00000240-00000340-00000000 [SL 00] [x87]
CPUID 0000000D: 00000001-00000000-00000000-00000000 [SL 01] [SSE]
CPUID 0000000D: 00000100-00000240-00000000-00000000 [SL 02] [AVX]
CPUID 80000000: 80000008-00000000-00000000-00000000
CPUID 80000001: 00000000-00000000-00000121-2C100800
CPUID 80000002: 20202020-20202020-20202020-4F41485A [            ZHAO]
CPUID 80000003: 204E4958-5869614B-206E6169-432D585A [XIN KaiXian ZX-C]
CPUID 80000004: 3443202B-40303835-33382E31-007A4847 [+ C4580@1.83GHz]
CPUID 80000005: 04200420-06600660-20080140-20080140
CPUID 80000006: 00000000-00000000-08008140-00000000
CPUID 80000007: 00000000-00000000-00000000-00000000
CPUID 80000008: 00003024-00000000-00000000-00000000
CPUID C0000000: C0000004-00000000-00000000-00000000
CPUID C0000001: 000006FE-00000000-00000000-1EC33DFC
CPUID C0000002: 00000000-00000000-00000000-00000000
CPUID C0000003: 00000000-00000000-00000000-00000000
CPUID C0000004: 00000027-08000B5E-08510B5D-00000000

L1    Data Cache:    32 KB,  8-way Associative, 64-byte Line
L1  Instr. Cache:    32 KB,  8-way Associative, 64-byte Line
L2 Unified Cache:     2 MB, 16-way Associative, 64-byte Line

------[ Logical CPU #3 ]------

allcpu: Package 0 / Core 3 / Thread 0: Valid

CPUID 00000000: 0000000D-746E6543-736C7561-48727561 [CentaurHauls]
CPUID 00000001: 000006FE-03040800-76DA63AB-BFCBFBFF
CPUID 00000002: 00000001-00000000-00000000-00000000
CPUID 00000003: 00000000-00000000-00000000-00000000
CPUID 00000004: 0C000121-01C0003F-0000003F-00000000 [SL 00]
CPUID 00000004: 0C000122-01C0003F-0000003F-00000000 [SL 01]
CPUID 00000004: 0C00C143-03C0003F-000007FF-00000000 [SL 02]
CPUID 00000005: 00000040-00000040-00000003-00022220
CPUID 00000006: 00000003-00000000-00000000-00000000
CPUID 00000007: 00000000-000C25AB-00000000-00000000
CPUID 00000008: 00000000-00000000-00000000-00000000
CPUID 00000009: 00000000-00000000-00000000-00000000
CPUID 0000000A: 06280202-00000000-00000000-00000503
CPUID 0000000B: 00000000-00000001-00000100-00000003 [SL 00]
CPUID 0000000B: 00000002-00000004-00000201-00000003 [SL 01]
CPUID 0000000C: 00000000-00000000-00000000-00000000
CPUID 0000000D: 00000007-00000240-00000340-00000000 [SL 00] [x87]
CPUID 0000000D: 00000001-00000000-00000000-00000000 [SL 01] [SSE]
CPUID 0000000D: 00000100-00000240-00000000-00000000 [SL 02] [AVX]
CPUID 80000000: 80000008-00000000-00000000-00000000
CPUID 80000001: 00000000-00000000-00000121-2C100800
CPUID 80000002: 20202020-20202020-20202020-4F41485A [            ZHAO]
CPUID 80000003: 204E4958-5869614B-206E6169-432D585A [XIN KaiXian ZX-C]
CPUID 80000004: 3443202B-40303835-33382E31-007A4847 [+ C4580@1.83GHz]
CPUID 80000005: 04200420-06600660-20080140-20080140
CPUID 80000006: 00000000-00000000-08008140-00000000
CPUID 80000007: 00000000-00000000-00000000-00000000
CPUID 80000008: 00003024-00000000-00000000-00000000
CPUID C0000000: C0000004-00000000-00000000-00000000
CPUID C0000001: 000006FE-00000000-00000000-1EC33DFC
CPUID C0000002: 00000000-00000000-00000000-00000000
CPUID C0000003: 00000000-00000000-00000000-00000000
CPUID C0000004: 00000027-08000B5E-08510B5D-00000000

L1    Data Cache:    32 KB,  8-way Associative, 64-byte Line
L1  Instr. Cache:    32 KB,  8-way Associative, 64-byte Line
L2 Unified Cache:     2 MB, 16-way Associative, 64-byte Line

------[ All CPUs ]------

CPU   0: APICID    0 / Package 0 / Core   0 / Thread 0: Valid
CPU   1: APICID    1 / Package 0 / Core   1 / Thread 0: Valid
CPU   2: APICID    2 / Package 0 / Core   2 / Thread 0: Valid
CPU   3: APICID    3 / Package 0 / Core   3 / Thread 0: Valid

------[ MSR Registers ]------

MSR 0000001B: 0000-0000-FEE0-0900
MSR 0000002A: 0000-0000-02C0-0000
MSR 0000003A: 0000-0000-0000-0005
MSR 0000008B: 0000-0205-0000-0000
MSR 000000CD: 0000-0000-0000-0004
MSR 00000198: 0851-0B5D-0800-0B5E [S200]
MSR 00000198: 0851-0B5D-0800-0B5E [S200]
MSR 00000198: 0851-0B5D-0800-0B5E
MSR 00000199: 0000-0000-0000-0B5D
MSR 0000019A: 0000-0000-0000-0002
MSR 0000019B: 0000-0000-0000-0000
MSR 0000019C: 0000-0000-8842-0000 [S200]
MSR 0000019C: 0000-0000-8843-0000 [S200]
MSR 0000019C: 0000-0000-8841-0000
MSR 0000019D: 0000-0000-0000-0851
MSR 000001A0: 0000-0000-0095-3C89
MSR 00000480: 00D8-0400-0000-0007
MSR 00000481: 0000-003F-0000-0016
MSR 00000482: FFF9-FFFE-0401-E172
MSR 00000483: 003F-FFFF-0003-6DFF
MSR 00000484: 0000-FFFF-0000-11FF
MSR 00000485: 0000-0000-0004-01E0
MSR 00000486: 0000-0000-8000-0021
MSR 00000487: 0000-0000-FFFF-FFFF
MSR 00000488: 0000-0000-0000-2000
MSR 00000489: 0000-0000-0037-27FF
MSR 0000048A: 0000-0000-0000-002A
MSR 0000048B: 0000-1CFE-0000-0000
MSR 0000048C: 0000-0F01-0613-4141
MSR 0000048D: 0000-003F-0000-0016
MSR 0000048E: FFF9-FFFE-0400-6172
MSR 0000048F: 003F-FFFF-0003-6DFB
MSR 00000490: 0000-FFFF-0000-11FB
MSR 00001107: 0FC6-037D-3C34-030E
MSR 00001140: 0000-0000-0000-0000
MSR 00001141: 0000-0000-0000-0000
MSR 00001142: 0000-0000-0000-0000
MSR 00001152: 0000-0000-0000-0000
MSR 00001153: 0000-0000-0000-0000
MSR 00001154: 0000-0000-0000-0000
MSR 00001160: 0000-0000-0000-0000
MSR 00001161: 0000-0000-0000-0000
MSR 00001164: 0000-0000-0000-0000
MSR 00001165: 0000-0000-0000-0000
MSR 00001166: 0000-0000-0000-0000
MSR 00001167: 0000-0000-0000-0000
MSR 00001168: 0000-0000-0000-0000
MSR 0000116A: 0000-0000-0000-0000
MSR 0000116B: 0000-0000-0000-0000
MSR 0000116C: 0000-0000-0000-0000
MSR 00001203: 0000-0040-0000-0018
MSR 0000120E: 0180-0700-0000-2100
MSR 00001234: 0000-0000-0000-0000
MSR 00001246: 0000-0000-0000-0000
MSR 00001406: 0000-0000-EA62-A800
MSR 00001407: 0000-0000-2A75-A090
MSR 00001423: 0000-0000-0000-0028
MSR 00001424: 0070-3000-0E00-0028
MSR 00001425: 0000-0000-0000-0000
MSR 00001435: 0000-0000-0800-0847
MSR 00001466: 0000-0008-0000-0051
