------[ Versions ]------

Program Version : EVEREST v5.30.2005 Beta
BenchDLL Version: 2.4.273.0

------[ CPU Info ]------

CPU Type           : VIA Nano L3050, 1800 MHz (9 x 200)
CPU Alias          : Isaiah CNB
Instruction Set    : x86, x86-64, MMX, SSE, SSE2, SSE3, SSSE3, SSE4.1
CPUID Manufacturer : CentaurHauls
CPUID CPU Name     : VIA Nano L3050@1800MHz
CPUID Revision     : 000006F8h
Platform ID        : 00h  (Unknown)

------[ Logical CPU #0 ]------

allcpu: Package 0 / Core 0 / Thread 0: Valid

CPUID 00000000: 0000000A-746E6543-736C7561-48727561
CPUID 00000001: 000006F8-00010800-008863A9-AFC9FBFF
CPUID 00000002: 02B3B001-00000000-00000000-2C04307D
CPUID 00000003: 00000000-00000000-00000000-00000000
CPUID 00000005: 00000040-00000040-00000003-00022220
CPUID 00000006: 00000000-00000000-00000000-00000000
CPUID 00000007: 00000000-00000000-00000000-00000000
CPUID 00000008: 00000000-00000000-00000000-00000000
CPUID 00000009: 00000000-00000000-00000000-00000000
CPUID 0000000A: 06280202-00000000-00000000-00000503
CPUID 80000000: 80000008-00000000-00000000-00000000
CPUID 80000001: 00000000-00000000-00000001-20100800
CPUID 80000002: 20202020-20202020-20202020-20202020
CPUID 80000003: 20202020-20202020-41495620-6E614E20
CPUID 80000004: 334C206F-40303530-30303831-007A484D
CPUID 80000005: 00000000-08800880-40100140-40100140
CPUID 80000006: 00000000-00000000-04008140-00000000
CPUID 80000007: 00000000-00000000-00000000-00000000
CPUID 80000008: 00003024-00000000-00000000-00000000
CPUID C0000000: C0000004-00000000-00000000-00000000
CPUID C0000001: 000006F8-00000000-00000000-1EC33DCC
CPUID C0000002: 00000000-00000000-00000000-00000000
CPUID C0000003: 00000000-00000000-00000000-00000000
CPUID C0000004: 0000002A-08001265-08571265-00000000

------[ All CPUs ]------

CPU   0: APICID   0 / Package 0 / Core  0 / Thread 0: Valid

------[ MSR Registers ]------

MSR 0000001B: 0000-0000-FEE0-0900
MSR 0000002A: 0000-0000-0480-0000
MSR 000000CD: 0000-0000-0000-0002
MSR 00000198: 0857-1265-0800-1265
MSR 00000199: 0000-0000-0000-1265
MSR 0000019A: 0000-0000-0000-0002
MSR 0000019B: 0000-0000-0000-0000
MSR 0000019C: 0000-0000-8840-0000
MSR 0000019D: 0000-0000-0000-0857
MSR 000001A0: 0000-0002-8695-3C89
MSR 00001153: 0000-0000-0000-0000
MSR 00001154: 0000-0000-0000-0000

PerformanceFrequency = 14318180

Tjmax Temperature = 0 Celsius
