CPUID 00000000: 0000000A-746E6543-736C7561-48727561
CPUID 00000001: 000006F2-00010800-00006389-AFC9FBFF
CPUID 00000002: 02B3B001-00000000-00000000-2C04307D
CPUID 00000003: 00000000-00000000-00000000-00000000
CPUID 00000005: 00000040-00000040-00000003-00022220
CPUID 00000006: 00000000-00000000-00000000-00000000
CPUID 00000007: 00000000-00000000-00000000-00000000
CPUID 00000008: 00000000-00000000-00000000-00000000
CPUID 00000009: 00000000-00000000-00000000-00000000
CPUID 0000000A: 06280302-00000000-00000000-00000503
CPUID 80000000: 80000008-00000000-00000000-00000000
CPUID 80000001: 00000000-00000000-00000001-2A100800
CPUID 80000002: 20202020-20202020-20202020-20202020
CPUID 80000003: 20202020-49562020-4E432041-72702041
CPUID 80000004: 7365636F-20726F73-30303831-207A484D
CPUID 80000005: 00000000-08800880-40100140-40100140
CPUID 80000006: 00000000-00000000-04008140-00000000
CPUID 80000007: 00000000-00000000-00000000-00000000
CPUID 80000008: 00003028-00000000-00000000-00000000
CPUID C0000000: C0000004-00000000-00000000-00000000
CPUID C0000001: 000006F2-00000000-00000000-00070DCC
CPUID C0000002: 00000000-00000000-00000000-00000000
CPUID C0000003: 00000000-00000000-00000000-00000000
CPUID C0000004: 00000035-0800121F-0819121F-00000000 