------[ Versions ]------

Program Version : EVEREST v4.20.1242 Beta
BenchDLL Version: 2.3.215.0

------[ CPU Info ]------

CPU Type           : IDT WinChip 2B, 200 MHz (3 x 67)
CPU Alias          : WinChip 2, C6+
CPU Platform       : Socket 7
Instruction Set    : x86, MMX, 3DNow!
CPUID Manufacturer : CentaurHauls
CPUID CPU Name     : IDT WinChip 2-3D
CPUID Revision     : 0000058Ah
Platform ID        : CBh  (Socket 7)

------[ Logical CPU #0 ]------

allcpu: Valid

CPUID 00000000: 00000001-746E6543-736C7561-48727561
CPUID 00000001: 0000058A-00000000-00000000-008000B5
CPUID 80000000: 80000005-00000000-00000000-00000000
CPUID 80000001: 0000058A-00000000-00000000-808000B5
CPUID 80000002: 20544449-436E6957-20706968-44332D32
CPUID 80000003: 00000000-00000000-00000000-00000000
CPUID 80000004: 00000000-00000000-00000000-00000000
CPUID 80000005: 80000005-08800880-20040120-20020120
CPUID 80860000: 80860000-00000000-00000000-00000000
CPUID C0000000: C0000005-00000000-00000000-00000000
CPUID C0000001: 0000058A-00000000-00000000-808000B5
CPUID C0000002: 20544449-436E6957-20706968-44332D32
CPUID C0000003: 00000000-00000000-00000000-00000000
CPUID C0000004: 00000000-00000000-00000000-00000000
CPUID C0000005: C0000005-08800880-20040120-20020120

------[ MSR Registers ]------

MSR 0000010A: 0000-0000-0000-0001

PerformanceFrequency = 1193182

Tjmax Temperature = 0 Celsius
