------[ Versions ]------

Program Version : EVEREST v4.60.1628 Beta
BenchDLL Version: 2.4.257.0

------[ CPU Info ]------

CPU Type           : VIA C3, 800 MHz (6 x 133)
CPU Alias          : WinChip 5C, Ezra
Instruction Set    : x86, MMX, 3DNow!
CPUID Manufacturer : CentaurHauls
CPUID CPU Name     : VIA Ezra
CPUID Revision     : 00000678h
Platform ID        : 00h  (Unknown)

------[ Logical CPU #0 ]------

allcpu: Valid

CPUID 00000000: 00000001-746E6543-736C7561-48727561
CPUID 00000001: 00000678-00000000-00000000-00803135
CPUID 80000000: 80000006-00000000-00000000-00000000
CPUID 80000001: 00000678-00000000-00000000-80803135
CPUID 80000002: 20414956-61727A45-00000000-00000000
CPUID 80000003: 00000000-00000000-00000000-00000000
CPUID 80000004: 00000000-00000000-00000000-00000000
CPUID 80000005: 00000000-08800880-40040120-40040120
CPUID 80000006: 00000000-00000000-40040120-00000000

------[ MSR Registers ]------

MSR 0000002A: 0000-0000-C2C4-0000

PerformanceFrequency = 3579545

Tjmax Temperature = 0 Celsius
