------[ Versions ]------

Program Version : AIDA64 Extreme v5.92.4358 Beta
BenchDLL Version: 4.3.759-x64
Windows Version : Microsoft Windows 10 Pro 10.0.15063.608 (64-bit)

------[ CPU Info ]------

CPU Type          : 16-Core Intel Atom C3958, 2000 MHz (20 x 100)
CPU Alias         : Denverton
CPU Stepping      : B0
Instruction Set   : x86, x86-64, MMX, SSE, SSE2, SSE3, SSSE3, SSE4.1, SSE4.2, AES, SHA
CPUID Manufacturer: GenuineIntel
CPUID CPU Name    : Intel(R) Atom(TM) CPU C3958 @ 2.00GHz
CPUID Revision    : 000506F1h
IA Brand ID       : 00h  (Unknown)
Platform ID       : FFh  (Unknown)
HTT / CMP Units   : 0 / 16
Max. NUMA Node    : 0

Tjmax Temperature        : 95 Celsius
HTC Temperature Limit    : 0 Celsius
CPU TDP                  : 31 W
CPU TDC                  : 33 A
CPU Max Power Limit      : 62 W / 40.00 sec
CPU Power Limit 1 (Long) : 31 W / 10.00 sec  (Unlocked)
CPU Power Limit 2 (Short): 37 W / 7.81 ms  (Unlocked)

------[ Motherboard Info ]------

Motherboard ID      : 63-0100-000001-00101111-090216-Chipset$0AAAA000_BIOS DATE: 07/19/17 18:39:27 VER: 05.0000D
Motherboard Model   : Gigabyte MA10-ST0

DMI MB Manufacturer : GIGABYTE
DMI MB Product      : MA10-ST0
DMI MB Version      : 01234567
DMI MB Serial       : HG6P5200033
DMI SYS Manufacturer: GIGABYTE
DMI SYS Product     : MA10-ST0
DMI SYS Version     : 0100
DMI SYS Serial      : 01234567890123456789AB
DMI BIOS Version    : F02


------[ Logical CPU #0 ]------

allcpu: Package 0 / Core 0 / Thread 0: Valid

CPUID 00000000: 00000015-756E6547-6C65746E-49656E69 [GenuineIntel]
CPUID 00000001: 000506F1-00200800-4FF8EBBF-BFEBFBFF
CPUID 00000002: 6164A001-0000FFC4-00000000-00000000
CPUID 00000003: 00000000-00000000-00000000-00000000
CPUID 00000004: 3C000121-0140003F-0000003F-00000001 [SL 00]
CPUID 00000004: 3C000122-01C0003F-0000003F-00000001 [SL 01]
CPUID 00000004: 3C00C143-03C0003F-000007FF-00000001 [SL 02]
CPUID 00000005: 00000040-00000040-00000003-00002020
CPUID 00000006: 00000055-00000002-00000009-00000000
CPUID 00000007: 00000000-2294E283-00000000-00000000
CPUID 00000008: 00000000-00000000-00000000-00000000
CPUID 00000009: 00000000-00000000-00000000-00000000
CPUID 0000000A: 07300404-00000000-00000000-00000603
CPUID 0000000B: 00000001-00000001-00000100-00000000 [SL 00]
CPUID 0000000B: 00000005-00000010-00000201-00000000 [SL 01]
CPUID 0000000C: 00000000-00000000-00000000-00000000
CPUID 0000000D: 0000001B-00000440-00000440-00000000 [SL 00]
CPUID 0000000D: 0000000F-000002C0-00000100-00000000 [SL 01]
CPUID 0000000E: 00000000-00000000-00000000-00000000
CPUID 0000000F: 00000000-00000000-00000000-00000000 [SL 00]
CPUID 0000000F: 00000000-00000000-00000000-00000000 [SL 01]
CPUID 00000010: 00000000-00000004-00000000-00000000 [SL 00]
CPUID 00000010: 00000000-00000000-00000000-00000000 [SL 01]
CPUID 00000011: 00000000-00000000-00000000-00000000
CPUID 00000012: 00000000-00000000-00000000-00000000 [SL 00]
CPUID 00000012: 00000000-00000000-00000000-00000000 [SL 01]
CPUID 00000013: 00000000-00000000-00000000-00000000
CPUID 00000014: 00000001-0000000F-80000007-00000000 [SL 00]
CPUID 00000014: 02490002-003FFFFF-00000000-00000000 [SL 01]
CPUID 00000015: 00000003-000000F0-00000000-00000000 [80.00x / 0]
CPUID 80000000: 80000008-00000000-00000000-00000000
CPUID 80000001: 00000000-00000000-00000101-2C100000
CPUID 80000002: 65746E49-2952286C-6F744120-4D54286D [Intel(R) Atom(TM]
CPUID 80000003: 50432029-33432055-20383539-2E322040 [) CPU C3958 @ 2.]
CPUID 80000004: 48473030-0000007A-00000000-00000000 [00GHz]
CPUID 80000005: 00000000-00000000-00000000-00000000
CPUID 80000006: 00000000-00000000-08008040-00000000
CPUID 80000007: 00000000-00000000-00000000-00000100
CPUID 80000008: 00003027-00000000-00000000-00000000

L1    Data Cache:    24 KB,  6-way Associative, 64-byte Line
L1  Instr. Cache:    32 KB,  8-way Associative, 64-byte Line
L2 Unified Cache:     2 MB, 16-way Associative, 64-byte Line

------[ Logical CPU #1 ]------

allcpu: Package 0 / Core 1 / Thread 0: Valid

CPUID 00000000: 00000015-756E6547-6C65746E-49656E69 [GenuineIntel]
CPUID 00000001: 000506F1-02200800-4FF8EBBF-BFEBFBFF
CPUID 00000002: 6164A001-0000FFC4-00000000-00000000
CPUID 00000003: 00000000-00000000-00000000-00000000
CPUID 00000004: 3C000121-0140003F-0000003F-00000001 [SL 00]
CPUID 00000004: 3C000122-01C0003F-0000003F-00000001 [SL 01]
CPUID 00000004: 3C00C143-03C0003F-000007FF-00000001 [SL 02]
CPUID 00000005: 00000040-00000040-00000003-00002020
CPUID 00000006: 00000055-00000002-00000009-00000000
CPUID 00000007: 00000000-2294E283-00000000-00000000
CPUID 00000008: 00000000-00000000-00000000-00000000
CPUID 00000009: 00000000-00000000-00000000-00000000
CPUID 0000000A: 07300404-00000000-00000000-00000603
CPUID 0000000B: 00000001-00000001-00000100-00000002 [SL 00]
CPUID 0000000B: 00000005-00000010-00000201-00000002 [SL 01]
CPUID 0000000C: 00000000-00000000-00000000-00000000
CPUID 0000000D: 0000001B-00000440-00000440-00000000 [SL 00]
CPUID 0000000D: 0000000F-000002C0-00000100-00000000 [SL 01]
CPUID 0000000E: 00000000-00000000-00000000-00000000
CPUID 0000000F: 00000000-00000000-00000000-00000000 [SL 00]
CPUID 0000000F: 00000000-00000000-00000000-00000000 [SL 01]
CPUID 00000010: 00000000-00000004-00000000-00000000 [SL 00]
CPUID 00000010: 00000000-00000000-00000000-00000000 [SL 01]
CPUID 00000011: 00000000-00000000-00000000-00000000
CPUID 00000012: 00000000-00000000-00000000-00000000 [SL 00]
CPUID 00000012: 00000000-00000000-00000000-00000000 [SL 01]
CPUID 00000013: 00000000-00000000-00000000-00000000
CPUID 00000014: 00000001-0000000F-80000007-00000000 [SL 00]
CPUID 00000014: 02490002-003FFFFF-00000000-00000000 [SL 01]
CPUID 00000015: 00000003-000000F0-00000000-00000000 [80.00x / 0]
CPUID 80000000: 80000008-00000000-00000000-00000000
CPUID 80000001: 00000000-00000000-00000101-2C100000
CPUID 80000002: 65746E49-2952286C-6F744120-4D54286D [Intel(R) Atom(TM]
CPUID 80000003: 50432029-33432055-20383539-2E322040 [) CPU C3958 @ 2.]
CPUID 80000004: 48473030-0000007A-00000000-00000000 [00GHz]
CPUID 80000005: 00000000-00000000-00000000-00000000
CPUID 80000006: 00000000-00000000-08008040-00000000
CPUID 80000007: 00000000-00000000-00000000-00000100
CPUID 80000008: 00003027-00000000-00000000-00000000

L1    Data Cache:    24 KB,  6-way Associative, 64-byte Line
L1  Instr. Cache:    32 KB,  8-way Associative, 64-byte Line
L2 Unified Cache:     2 MB, 16-way Associative, 64-byte Line

------[ Logical CPU #2 ]------

allcpu: Package 0 / Core 2 / Thread 0: Valid

CPUID 00000000: 00000015-756E6547-6C65746E-49656E69 [GenuineIntel]
CPUID 00000001: 000506F1-04200800-4FF8EBBF-BFEBFBFF
CPUID 00000002: 6164A001-0000FFC4-00000000-00000000
CPUID 00000003: 00000000-00000000-00000000-00000000
CPUID 00000004: 3C000121-0140003F-0000003F-00000001 [SL 00]
CPUID 00000004: 3C000122-01C0003F-0000003F-00000001 [SL 01]
CPUID 00000004: 3C00C143-03C0003F-000007FF-00000001 [SL 02]
CPUID 00000005: 00000040-00000040-00000003-00002020
CPUID 00000006: 00000055-00000002-00000009-00000000
CPUID 00000007: 00000000-2294E283-00000000-00000000
CPUID 00000008: 00000000-00000000-00000000-00000000
CPUID 00000009: 00000000-00000000-00000000-00000000
CPUID 0000000A: 07300404-00000000-00000000-00000603
CPUID 0000000B: 00000001-00000001-00000100-00000004 [SL 00]
CPUID 0000000B: 00000005-00000010-00000201-00000004 [SL 01]
CPUID 0000000C: 00000000-00000000-00000000-00000000
CPUID 0000000D: 0000001B-00000440-00000440-00000000 [SL 00]
CPUID 0000000D: 0000000F-000002C0-00000100-00000000 [SL 01]
CPUID 0000000E: 00000000-00000000-00000000-00000000
CPUID 0000000F: 00000000-00000000-00000000-00000000 [SL 00]
CPUID 0000000F: 00000000-00000000-00000000-00000000 [SL 01]
CPUID 00000010: 00000000-00000004-00000000-00000000 [SL 00]
CPUID 00000010: 00000000-00000000-00000000-00000000 [SL 01]
CPUID 00000011: 00000000-00000000-00000000-00000000
CPUID 00000012: 00000000-00000000-00000000-00000000 [SL 00]
CPUID 00000012: 00000000-00000000-00000000-00000000 [SL 01]
CPUID 00000013: 00000000-00000000-00000000-00000000
CPUID 00000014: 00000001-0000000F-80000007-00000000 [SL 00]
CPUID 00000014: 02490002-003FFFFF-00000000-00000000 [SL 01]
CPUID 00000015: 00000003-000000F0-00000000-00000000 [80.00x / 0]
CPUID 80000000: 80000008-00000000-00000000-00000000
CPUID 80000001: 00000000-00000000-00000101-2C100000
CPUID 80000002: 65746E49-2952286C-6F744120-4D54286D [Intel(R) Atom(TM]
CPUID 80000003: 50432029-33432055-20383539-2E322040 [) CPU C3958 @ 2.]
CPUID 80000004: 48473030-0000007A-00000000-00000000 [00GHz]
CPUID 80000005: 00000000-00000000-00000000-00000000
CPUID 80000006: 00000000-00000000-08008040-00000000
CPUID 80000007: 00000000-00000000-00000000-00000100
CPUID 80000008: 00003027-00000000-00000000-00000000

L1    Data Cache:    24 KB,  6-way Associative, 64-byte Line
L1  Instr. Cache:    32 KB,  8-way Associative, 64-byte Line
L2 Unified Cache:     2 MB, 16-way Associative, 64-byte Line

------[ Logical CPU #3 ]------

allcpu: Package 0 / Core 3 / Thread 0: Valid

CPUID 00000000: 00000015-756E6547-6C65746E-49656E69 [GenuineIntel]
CPUID 00000001: 000506F1-06200800-4FF8EBBF-BFEBFBFF
CPUID 00000002: 6164A001-0000FFC4-00000000-00000000
CPUID 00000003: 00000000-00000000-00000000-00000000
CPUID 00000004: 3C000121-0140003F-0000003F-00000001 [SL 00]
CPUID 00000004: 3C000122-01C0003F-0000003F-00000001 [SL 01]
CPUID 00000004: 3C00C143-03C0003F-000007FF-00000001 [SL 02]
CPUID 00000005: 00000040-00000040-00000003-00002020
CPUID 00000006: 00000055-00000002-00000009-00000000
CPUID 00000007: 00000000-2294E283-00000000-00000000
CPUID 00000008: 00000000-00000000-00000000-00000000
CPUID 00000009: 00000000-00000000-00000000-00000000
CPUID 0000000A: 07300404-00000000-00000000-00000603
CPUID 0000000B: 00000001-00000001-00000100-00000006 [SL 00]
CPUID 0000000B: 00000005-00000010-00000201-00000006 [SL 01]
CPUID 0000000C: 00000000-00000000-00000000-00000000
CPUID 0000000D: 0000001B-00000440-00000440-00000000 [SL 00]
CPUID 0000000D: 0000000F-000002C0-00000100-00000000 [SL 01]
CPUID 0000000E: 00000000-00000000-00000000-00000000
CPUID 0000000F: 00000000-00000000-00000000-00000000 [SL 00]
CPUID 0000000F: 00000000-00000000-00000000-00000000 [SL 01]
CPUID 00000010: 00000000-00000004-00000000-00000000 [SL 00]
CPUID 00000010: 00000000-00000000-00000000-00000000 [SL 01]
CPUID 00000011: 00000000-00000000-00000000-00000000
CPUID 00000012: 00000000-00000000-00000000-00000000 [SL 00]
CPUID 00000012: 00000000-00000000-00000000-00000000 [SL 01]
CPUID 00000013: 00000000-00000000-00000000-00000000
CPUID 00000014: 00000001-0000000F-80000007-00000000 [SL 00]
CPUID 00000014: 02490002-003FFFFF-00000000-00000000 [SL 01]
CPUID 00000015: 00000003-000000F0-00000000-00000000 [80.00x / 0]
CPUID 80000000: 80000008-00000000-00000000-00000000
CPUID 80000001: 00000000-00000000-00000101-2C100000
CPUID 80000002: 65746E49-2952286C-6F744120-4D54286D [Intel(R) Atom(TM]
CPUID 80000003: 50432029-33432055-20383539-2E322040 [) CPU C3958 @ 2.]
CPUID 80000004: 48473030-0000007A-00000000-00000000 [00GHz]
CPUID 80000005: 00000000-00000000-00000000-00000000
CPUID 80000006: 00000000-00000000-08008040-00000000
CPUID 80000007: 00000000-00000000-00000000-00000100
CPUID 80000008: 00003027-00000000-00000000-00000000

L1    Data Cache:    24 KB,  6-way Associative, 64-byte Line
L1  Instr. Cache:    32 KB,  8-way Associative, 64-byte Line
L2 Unified Cache:     2 MB, 16-way Associative, 64-byte Line

------[ Logical CPU #4 ]------

allcpu: Package 0 / Core 4 / Thread 0: Valid

CPUID 00000000: 00000015-756E6547-6C65746E-49656E69 [GenuineIntel]
CPUID 00000001: 000506F1-08200800-4FF8EBBF-BFEBFBFF
CPUID 00000002: 6164A001-0000FFC4-00000000-00000000
CPUID 00000003: 00000000-00000000-00000000-00000000
CPUID 00000004: 3C000121-0140003F-0000003F-00000001 [SL 00]
CPUID 00000004: 3C000122-01C0003F-0000003F-00000001 [SL 01]
CPUID 00000004: 3C00C143-03C0003F-000007FF-00000001 [SL 02]
CPUID 00000005: 00000040-00000040-00000003-00002020
CPUID 00000006: 00000055-00000002-00000009-00000000
CPUID 00000007: 00000000-2294E283-00000000-00000000
CPUID 00000008: 00000000-00000000-00000000-00000000
CPUID 00000009: 00000000-00000000-00000000-00000000
CPUID 0000000A: 07300404-00000000-00000000-00000603
CPUID 0000000B: 00000001-00000001-00000100-00000008 [SL 00]
CPUID 0000000B: 00000005-00000010-00000201-00000008 [SL 01]
CPUID 0000000C: 00000000-00000000-00000000-00000000
CPUID 0000000D: 0000001B-00000440-00000440-00000000 [SL 00]
CPUID 0000000D: 0000000F-000002C0-00000100-00000000 [SL 01]
CPUID 0000000E: 00000000-00000000-00000000-00000000
CPUID 0000000F: 00000000-00000000-00000000-00000000 [SL 00]
CPUID 0000000F: 00000000-00000000-00000000-00000000 [SL 01]
CPUID 00000010: 00000000-00000004-00000000-00000000 [SL 00]
CPUID 00000010: 00000000-00000000-00000000-00000000 [SL 01]
CPUID 00000011: 00000000-00000000-00000000-00000000
CPUID 00000012: 00000000-00000000-00000000-00000000 [SL 00]
CPUID 00000012: 00000000-00000000-00000000-00000000 [SL 01]
CPUID 00000013: 00000000-00000000-00000000-00000000
CPUID 00000014: 00000001-0000000F-80000007-00000000 [SL 00]
CPUID 00000014: 02490002-003FFFFF-00000000-00000000 [SL 01]
CPUID 00000015: 00000003-000000F0-00000000-00000000 [80.00x / 0]
CPUID 80000000: 80000008-00000000-00000000-00000000
CPUID 80000001: 00000000-00000000-00000101-2C100000
CPUID 80000002: 65746E49-2952286C-6F744120-4D54286D [Intel(R) Atom(TM]
CPUID 80000003: 50432029-33432055-20383539-2E322040 [) CPU C3958 @ 2.]
CPUID 80000004: 48473030-0000007A-00000000-00000000 [00GHz]
CPUID 80000005: 00000000-00000000-00000000-00000000
CPUID 80000006: 00000000-00000000-08008040-00000000
CPUID 80000007: 00000000-00000000-00000000-00000100
CPUID 80000008: 00003027-00000000-00000000-00000000

L1    Data Cache:    24 KB,  6-way Associative, 64-byte Line
L1  Instr. Cache:    32 KB,  8-way Associative, 64-byte Line
L2 Unified Cache:     2 MB, 16-way Associative, 64-byte Line

------[ Logical CPU #5 ]------

allcpu: Package 0 / Core 5 / Thread 0: Valid

CPUID 00000000: 00000015-756E6547-6C65746E-49656E69 [GenuineIntel]
CPUID 00000001: 000506F1-0A200800-4FF8EBBF-BFEBFBFF
CPUID 00000002: 6164A001-0000FFC4-00000000-00000000
CPUID 00000003: 00000000-00000000-00000000-00000000
CPUID 00000004: 3C000121-0140003F-0000003F-00000001 [SL 00]
CPUID 00000004: 3C000122-01C0003F-0000003F-00000001 [SL 01]
CPUID 00000004: 3C00C143-03C0003F-000007FF-00000001 [SL 02]
CPUID 00000005: 00000040-00000040-00000003-00002020
CPUID 00000006: 00000055-00000002-00000009-00000000
CPUID 00000007: 00000000-2294E283-00000000-00000000
CPUID 00000008: 00000000-00000000-00000000-00000000
CPUID 00000009: 00000000-00000000-00000000-00000000
CPUID 0000000A: 07300404-00000000-00000000-00000603
CPUID 0000000B: 00000001-00000001-00000100-0000000A [SL 00]
CPUID 0000000B: 00000005-00000010-00000201-0000000A [SL 01]
CPUID 0000000C: 00000000-00000000-00000000-00000000
CPUID 0000000D: 0000001B-00000440-00000440-00000000 [SL 00]
CPUID 0000000D: 0000000F-000002C0-00000100-00000000 [SL 01]
CPUID 0000000E: 00000000-00000000-00000000-00000000
CPUID 0000000F: 00000000-00000000-00000000-00000000 [SL 00]
CPUID 0000000F: 00000000-00000000-00000000-00000000 [SL 01]
CPUID 00000010: 00000000-00000004-00000000-00000000 [SL 00]
CPUID 00000010: 00000000-00000000-00000000-00000000 [SL 01]
CPUID 00000011: 00000000-00000000-00000000-00000000
CPUID 00000012: 00000000-00000000-00000000-00000000 [SL 00]
CPUID 00000012: 00000000-00000000-00000000-00000000 [SL 01]
CPUID 00000013: 00000000-00000000-00000000-00000000
CPUID 00000014: 00000001-0000000F-80000007-00000000 [SL 00]
CPUID 00000014: 02490002-003FFFFF-00000000-00000000 [SL 01]
CPUID 00000015: 00000003-000000F0-00000000-00000000 [80.00x / 0]
CPUID 80000000: 80000008-00000000-00000000-00000000
CPUID 80000001: 00000000-00000000-00000101-2C100000
CPUID 80000002: 65746E49-2952286C-6F744120-4D54286D [Intel(R) Atom(TM]
CPUID 80000003: 50432029-33432055-20383539-2E322040 [) CPU C3958 @ 2.]
CPUID 80000004: 48473030-0000007A-00000000-00000000 [00GHz]
CPUID 80000005: 00000000-00000000-00000000-00000000
CPUID 80000006: 00000000-00000000-08008040-00000000
CPUID 80000007: 00000000-00000000-00000000-00000100
CPUID 80000008: 00003027-00000000-00000000-00000000

L1    Data Cache:    24 KB,  6-way Associative, 64-byte Line
L1  Instr. Cache:    32 KB,  8-way Associative, 64-byte Line
L2 Unified Cache:     2 MB, 16-way Associative, 64-byte Line

------[ Logical CPU #6 ]------

allcpu: Package 0 / Core 6 / Thread 0: Valid

CPUID 00000000: 00000015-756E6547-6C65746E-49656E69 [GenuineIntel]
CPUID 00000001: 000506F1-0C200800-4FF8EBBF-BFEBFBFF
CPUID 00000002: 6164A001-0000FFC4-00000000-00000000
CPUID 00000003: 00000000-00000000-00000000-00000000
CPUID 00000004: 3C000121-0140003F-0000003F-00000001 [SL 00]
CPUID 00000004: 3C000122-01C0003F-0000003F-00000001 [SL 01]
CPUID 00000004: 3C00C143-03C0003F-000007FF-00000001 [SL 02]
CPUID 00000005: 00000040-00000040-00000003-00002020
CPUID 00000006: 00000055-00000002-00000009-00000000
CPUID 00000007: 00000000-2294E283-00000000-00000000
CPUID 00000008: 00000000-00000000-00000000-00000000
CPUID 00000009: 00000000-00000000-00000000-00000000
CPUID 0000000A: 07300404-00000000-00000000-00000603
CPUID 0000000B: 00000001-00000001-00000100-0000000C [SL 00]
CPUID 0000000B: 00000005-00000010-00000201-0000000C [SL 01]
CPUID 0000000C: 00000000-00000000-00000000-00000000
CPUID 0000000D: 0000001B-00000440-00000440-00000000 [SL 00]
CPUID 0000000D: 0000000F-000002C0-00000100-00000000 [SL 01]
CPUID 0000000E: 00000000-00000000-00000000-00000000
CPUID 0000000F: 00000000-00000000-00000000-00000000 [SL 00]
CPUID 0000000F: 00000000-00000000-00000000-00000000 [SL 01]
CPUID 00000010: 00000000-00000004-00000000-00000000 [SL 00]
CPUID 00000010: 00000000-00000000-00000000-00000000 [SL 01]
CPUID 00000011: 00000000-00000000-00000000-00000000
CPUID 00000012: 00000000-00000000-00000000-00000000 [SL 00]
CPUID 00000012: 00000000-00000000-00000000-00000000 [SL 01]
CPUID 00000013: 00000000-00000000-00000000-00000000
CPUID 00000014: 00000001-0000000F-80000007-00000000 [SL 00]
CPUID 00000014: 02490002-003FFFFF-00000000-00000000 [SL 01]
CPUID 00000015: 00000003-000000F0-00000000-00000000 [80.00x / 0]
CPUID 80000000: 80000008-00000000-00000000-00000000
CPUID 80000001: 00000000-00000000-00000101-2C100000
CPUID 80000002: 65746E49-2952286C-6F744120-4D54286D [Intel(R) Atom(TM]
CPUID 80000003: 50432029-33432055-20383539-2E322040 [) CPU C3958 @ 2.]
CPUID 80000004: 48473030-0000007A-00000000-00000000 [00GHz]
CPUID 80000005: 00000000-00000000-00000000-00000000
CPUID 80000006: 00000000-00000000-08008040-00000000
CPUID 80000007: 00000000-00000000-00000000-00000100
CPUID 80000008: 00003027-00000000-00000000-00000000

L1    Data Cache:    24 KB,  6-way Associative, 64-byte Line
L1  Instr. Cache:    32 KB,  8-way Associative, 64-byte Line
L2 Unified Cache:     2 MB, 16-way Associative, 64-byte Line

------[ Logical CPU #7 ]------

allcpu: Package 0 / Core 7 / Thread 0: Valid

CPUID 00000000: 00000015-756E6547-6C65746E-49656E69 [GenuineIntel]
CPUID 00000001: 000506F1-0E200800-4FF8EBBF-BFEBFBFF
CPUID 00000002: 6164A001-0000FFC4-00000000-00000000
CPUID 00000003: 00000000-00000000-00000000-00000000
CPUID 00000004: 3C000121-0140003F-0000003F-00000001 [SL 00]
CPUID 00000004: 3C000122-01C0003F-0000003F-00000001 [SL 01]
CPUID 00000004: 3C00C143-03C0003F-000007FF-00000001 [SL 02]
CPUID 00000005: 00000040-00000040-00000003-00002020
CPUID 00000006: 00000055-00000002-00000009-00000000
CPUID 00000007: 00000000-2294E283-00000000-00000000
CPUID 00000008: 00000000-00000000-00000000-00000000
CPUID 00000009: 00000000-00000000-00000000-00000000
CPUID 0000000A: 07300404-00000000-00000000-00000603
CPUID 0000000B: 00000001-00000001-00000100-0000000E [SL 00]
CPUID 0000000B: 00000005-00000010-00000201-0000000E [SL 01]
CPUID 0000000C: 00000000-00000000-00000000-00000000
CPUID 0000000D: 0000001B-00000440-00000440-00000000 [SL 00]
CPUID 0000000D: 0000000F-000002C0-00000100-00000000 [SL 01]
CPUID 0000000E: 00000000-00000000-00000000-00000000
CPUID 0000000F: 00000000-00000000-00000000-00000000 [SL 00]
CPUID 0000000F: 00000000-00000000-00000000-00000000 [SL 01]
CPUID 00000010: 00000000-00000004-00000000-00000000 [SL 00]
CPUID 00000010: 00000000-00000000-00000000-00000000 [SL 01]
CPUID 00000011: 00000000-00000000-00000000-00000000
CPUID 00000012: 00000000-00000000-00000000-00000000 [SL 00]
CPUID 00000012: 00000000-00000000-00000000-00000000 [SL 01]
CPUID 00000013: 00000000-00000000-00000000-00000000
CPUID 00000014: 00000001-0000000F-80000007-00000000 [SL 00]
CPUID 00000014: 02490002-003FFFFF-00000000-00000000 [SL 01]
CPUID 00000015: 00000003-000000F0-00000000-00000000 [80.00x / 0]
CPUID 80000000: 80000008-00000000-00000000-00000000
CPUID 80000001: 00000000-00000000-00000101-2C100000
CPUID 80000002: 65746E49-2952286C-6F744120-4D54286D [Intel(R) Atom(TM]
CPUID 80000003: 50432029-33432055-20383539-2E322040 [) CPU C3958 @ 2.]
CPUID 80000004: 48473030-0000007A-00000000-00000000 [00GHz]
CPUID 80000005: 00000000-00000000-00000000-00000000
CPUID 80000006: 00000000-00000000-08008040-00000000
CPUID 80000007: 00000000-00000000-00000000-00000100
CPUID 80000008: 00003027-00000000-00000000-00000000

L1    Data Cache:    24 KB,  6-way Associative, 64-byte Line
L1  Instr. Cache:    32 KB,  8-way Associative, 64-byte Line
L2 Unified Cache:     2 MB, 16-way Associative, 64-byte Line

------[ Logical CPU #8 ]------

allcpu: Package 0 / Core 8 / Thread 0: Valid

CPUID 00000000: 00000015-756E6547-6C65746E-49656E69 [GenuineIntel]
CPUID 00000001: 000506F1-10200800-4FF8EBBF-BFEBFBFF
CPUID 00000002: 6164A001-0000FFC4-00000000-00000000
CPUID 00000003: 00000000-00000000-00000000-00000000
CPUID 00000004: 3C000121-0140003F-0000003F-00000001 [SL 00]
CPUID 00000004: 3C000122-01C0003F-0000003F-00000001 [SL 01]
CPUID 00000004: 3C00C143-03C0003F-000007FF-00000001 [SL 02]
CPUID 00000005: 00000040-00000040-00000003-00002020
CPUID 00000006: 00000055-00000002-00000009-00000000
CPUID 00000007: 00000000-2294E283-00000000-00000000
CPUID 00000008: 00000000-00000000-00000000-00000000
CPUID 00000009: 00000000-00000000-00000000-00000000
CPUID 0000000A: 07300404-00000000-00000000-00000603
CPUID 0000000B: 00000001-00000001-00000100-00000010 [SL 00]
CPUID 0000000B: 00000005-00000010-00000201-00000010 [SL 01]
CPUID 0000000C: 00000000-00000000-00000000-00000000
CPUID 0000000D: 0000001B-00000440-00000440-00000000 [SL 00]
CPUID 0000000D: 0000000F-000002C0-00000100-00000000 [SL 01]
CPUID 0000000E: 00000000-00000000-00000000-00000000
CPUID 0000000F: 00000000-00000000-00000000-00000000 [SL 00]
CPUID 0000000F: 00000000-00000000-00000000-00000000 [SL 01]
CPUID 00000010: 00000000-00000004-00000000-00000000 [SL 00]
CPUID 00000010: 00000000-00000000-00000000-00000000 [SL 01]
CPUID 00000011: 00000000-00000000-00000000-00000000
CPUID 00000012: 00000000-00000000-00000000-00000000 [SL 00]
CPUID 00000012: 00000000-00000000-00000000-00000000 [SL 01]
CPUID 00000013: 00000000-00000000-00000000-00000000
CPUID 00000014: 00000001-0000000F-80000007-00000000 [SL 00]
CPUID 00000014: 02490002-003FFFFF-00000000-00000000 [SL 01]
CPUID 00000015: 00000003-000000F0-00000000-00000000 [80.00x / 0]
CPUID 80000000: 80000008-00000000-00000000-00000000
CPUID 80000001: 00000000-00000000-00000101-2C100000
CPUID 80000002: 65746E49-2952286C-6F744120-4D54286D [Intel(R) Atom(TM]
CPUID 80000003: 50432029-33432055-20383539-2E322040 [) CPU C3958 @ 2.]
CPUID 80000004: 48473030-0000007A-00000000-00000000 [00GHz]
CPUID 80000005: 00000000-00000000-00000000-00000000
CPUID 80000006: 00000000-00000000-08008040-00000000
CPUID 80000007: 00000000-00000000-00000000-00000100
CPUID 80000008: 00003027-00000000-00000000-00000000

L1    Data Cache:    24 KB,  6-way Associative, 64-byte Line
L1  Instr. Cache:    32 KB,  8-way Associative, 64-byte Line
L2 Unified Cache:     2 MB, 16-way Associative, 64-byte Line

------[ Logical CPU #9 ]------

allcpu: Package 0 / Core 9 / Thread 0: Valid

CPUID 00000000: 00000015-756E6547-6C65746E-49656E69 [GenuineIntel]
CPUID 00000001: 000506F1-12200800-4FF8EBBF-BFEBFBFF
CPUID 00000002: 6164A001-0000FFC4-00000000-00000000
CPUID 00000003: 00000000-00000000-00000000-00000000
CPUID 00000004: 3C000121-0140003F-0000003F-00000001 [SL 00]
CPUID 00000004: 3C000122-01C0003F-0000003F-00000001 [SL 01]
CPUID 00000004: 3C00C143-03C0003F-000007FF-00000001 [SL 02]
CPUID 00000005: 00000040-00000040-00000003-00002020
CPUID 00000006: 00000055-00000002-00000009-00000000
CPUID 00000007: 00000000-2294E283-00000000-00000000
CPUID 00000008: 00000000-00000000-00000000-00000000
CPUID 00000009: 00000000-00000000-00000000-00000000
CPUID 0000000A: 07300404-00000000-00000000-00000603
CPUID 0000000B: 00000001-00000001-00000100-00000012 [SL 00]
CPUID 0000000B: 00000005-00000010-00000201-00000012 [SL 01]
CPUID 0000000C: 00000000-00000000-00000000-00000000
CPUID 0000000D: 0000001B-00000440-00000440-00000000 [SL 00]
CPUID 0000000D: 0000000F-000002C0-00000100-00000000 [SL 01]
CPUID 0000000E: 00000000-00000000-00000000-00000000
CPUID 0000000F: 00000000-00000000-00000000-00000000 [SL 00]
CPUID 0000000F: 00000000-00000000-00000000-00000000 [SL 01]
CPUID 00000010: 00000000-00000004-00000000-00000000 [SL 00]
CPUID 00000010: 00000000-00000000-00000000-00000000 [SL 01]
CPUID 00000011: 00000000-00000000-00000000-00000000
CPUID 00000012: 00000000-00000000-00000000-00000000 [SL 00]
CPUID 00000012: 00000000-00000000-00000000-00000000 [SL 01]
CPUID 00000013: 00000000-00000000-00000000-00000000
CPUID 00000014: 00000001-0000000F-80000007-00000000 [SL 00]
CPUID 00000014: 02490002-003FFFFF-00000000-00000000 [SL 01]
CPUID 00000015: 00000003-000000F0-00000000-00000000 [80.00x / 0]
CPUID 80000000: 80000008-00000000-00000000-00000000
CPUID 80000001: 00000000-00000000-00000101-2C100000
CPUID 80000002: 65746E49-2952286C-6F744120-4D54286D [Intel(R) Atom(TM]
CPUID 80000003: 50432029-33432055-20383539-2E322040 [) CPU C3958 @ 2.]
CPUID 80000004: 48473030-0000007A-00000000-00000000 [00GHz]
CPUID 80000005: 00000000-00000000-00000000-00000000
CPUID 80000006: 00000000-00000000-08008040-00000000
CPUID 80000007: 00000000-00000000-00000000-00000100
CPUID 80000008: 00003027-00000000-00000000-00000000

L1    Data Cache:    24 KB,  6-way Associative, 64-byte Line
L1  Instr. Cache:    32 KB,  8-way Associative, 64-byte Line
L2 Unified Cache:     2 MB, 16-way Associative, 64-byte Line

------[ Logical CPU #10 ]------

allcpu: Package 0 / Core 10 / Thread 0: Valid

CPUID 00000000: 00000015-756E6547-6C65746E-49656E69 [GenuineIntel]
CPUID 00000001: 000506F1-14200800-4FF8EBBF-BFEBFBFF
CPUID 00000002: 6164A001-0000FFC4-00000000-00000000
CPUID 00000003: 00000000-00000000-00000000-00000000
CPUID 00000004: 3C000121-0140003F-0000003F-00000001 [SL 00]
CPUID 00000004: 3C000122-01C0003F-0000003F-00000001 [SL 01]
CPUID 00000004: 3C00C143-03C0003F-000007FF-00000001 [SL 02]
CPUID 00000005: 00000040-00000040-00000003-00002020
CPUID 00000006: 00000055-00000002-00000009-00000000
CPUID 00000007: 00000000-2294E283-00000000-00000000
CPUID 00000008: 00000000-00000000-00000000-00000000
CPUID 00000009: 00000000-00000000-00000000-00000000
CPUID 0000000A: 07300404-00000000-00000000-00000603
CPUID 0000000B: 00000001-00000001-00000100-00000014 [SL 00]
CPUID 0000000B: 00000005-00000010-00000201-00000014 [SL 01]
CPUID 0000000C: 00000000-00000000-00000000-00000000
CPUID 0000000D: 0000001B-00000440-00000440-00000000 [SL 00]
CPUID 0000000D: 0000000F-000002C0-00000100-00000000 [SL 01]
CPUID 0000000E: 00000000-00000000-00000000-00000000
CPUID 0000000F: 00000000-00000000-00000000-00000000 [SL 00]
CPUID 0000000F: 00000000-00000000-00000000-00000000 [SL 01]
CPUID 00000010: 00000000-00000004-00000000-00000000 [SL 00]
CPUID 00000010: 00000000-00000000-00000000-00000000 [SL 01]
CPUID 00000011: 00000000-00000000-00000000-00000000
CPUID 00000012: 00000000-00000000-00000000-00000000 [SL 00]
CPUID 00000012: 00000000-00000000-00000000-00000000 [SL 01]
CPUID 00000013: 00000000-00000000-00000000-00000000
CPUID 00000014: 00000001-0000000F-80000007-00000000 [SL 00]
CPUID 00000014: 02490002-003FFFFF-00000000-00000000 [SL 01]
CPUID 00000015: 00000003-000000F0-00000000-00000000 [80.00x / 0]
CPUID 80000000: 80000008-00000000-00000000-00000000
CPUID 80000001: 00000000-00000000-00000101-2C100000
CPUID 80000002: 65746E49-2952286C-6F744120-4D54286D [Intel(R) Atom(TM]
CPUID 80000003: 50432029-33432055-20383539-2E322040 [) CPU C3958 @ 2.]
CPUID 80000004: 48473030-0000007A-00000000-00000000 [00GHz]
CPUID 80000005: 00000000-00000000-00000000-00000000
CPUID 80000006: 00000000-00000000-08008040-00000000
CPUID 80000007: 00000000-00000000-00000000-00000100
CPUID 80000008: 00003027-00000000-00000000-00000000

L1    Data Cache:    24 KB,  6-way Associative, 64-byte Line
L1  Instr. Cache:    32 KB,  8-way Associative, 64-byte Line
L2 Unified Cache:     2 MB, 16-way Associative, 64-byte Line

------[ Logical CPU #11 ]------

allcpu: Package 0 / Core 11 / Thread 0: Valid

CPUID 00000000: 00000015-756E6547-6C65746E-49656E69 [GenuineIntel]
CPUID 00000001: 000506F1-16200800-4FF8EBBF-BFEBFBFF
CPUID 00000002: 6164A001-0000FFC4-00000000-00000000
CPUID 00000003: 00000000-00000000-00000000-00000000
CPUID 00000004: 3C000121-0140003F-0000003F-00000001 [SL 00]
CPUID 00000004: 3C000122-01C0003F-0000003F-00000001 [SL 01]
CPUID 00000004: 3C00C143-03C0003F-000007FF-00000001 [SL 02]
CPUID 00000005: 00000040-00000040-00000003-00002020
CPUID 00000006: 00000055-00000002-00000009-00000000
CPUID 00000007: 00000000-2294E283-00000000-00000000
CPUID 00000008: 00000000-00000000-00000000-00000000
CPUID 00000009: 00000000-00000000-00000000-00000000
CPUID 0000000A: 07300404-00000000-00000000-00000603
CPUID 0000000B: 00000001-00000001-00000100-00000016 [SL 00]
CPUID 0000000B: 00000005-00000010-00000201-00000016 [SL 01]
CPUID 0000000C: 00000000-00000000-00000000-00000000
CPUID 0000000D: 0000001B-00000440-00000440-00000000 [SL 00]
CPUID 0000000D: 0000000F-000002C0-00000100-00000000 [SL 01]
CPUID 0000000E: 00000000-00000000-00000000-00000000
CPUID 0000000F: 00000000-00000000-00000000-00000000 [SL 00]
CPUID 0000000F: 00000000-00000000-00000000-00000000 [SL 01]
CPUID 00000010: 00000000-00000004-00000000-00000000 [SL 00]
CPUID 00000010: 00000000-00000000-00000000-00000000 [SL 01]
CPUID 00000011: 00000000-00000000-00000000-00000000
CPUID 00000012: 00000000-00000000-00000000-00000000 [SL 00]
CPUID 00000012: 00000000-00000000-00000000-00000000 [SL 01]
CPUID 00000013: 00000000-00000000-00000000-00000000
CPUID 00000014: 00000001-0000000F-80000007-00000000 [SL 00]
CPUID 00000014: 02490002-003FFFFF-00000000-00000000 [SL 01]
CPUID 00000015: 00000003-000000F0-00000000-00000000 [80.00x / 0]
CPUID 80000000: 80000008-00000000-00000000-00000000
CPUID 80000001: 00000000-00000000-00000101-2C100000
CPUID 80000002: 65746E49-2952286C-6F744120-4D54286D [Intel(R) Atom(TM]
CPUID 80000003: 50432029-33432055-20383539-2E322040 [) CPU C3958 @ 2.]
CPUID 80000004: 48473030-0000007A-00000000-00000000 [00GHz]
CPUID 80000005: 00000000-00000000-00000000-00000000
CPUID 80000006: 00000000-00000000-08008040-00000000
CPUID 80000007: 00000000-00000000-00000000-00000100
CPUID 80000008: 00003027-00000000-00000000-00000000

L1    Data Cache:    24 KB,  6-way Associative, 64-byte Line
L1  Instr. Cache:    32 KB,  8-way Associative, 64-byte Line
L2 Unified Cache:     2 MB, 16-way Associative, 64-byte Line

------[ Logical CPU #12 ]------

allcpu: Package 0 / Core 12 / Thread 0: Valid

CPUID 00000000: 00000015-756E6547-6C65746E-49656E69 [GenuineIntel]
CPUID 00000001: 000506F1-18200800-4FF8EBBF-BFEBFBFF
CPUID 00000002: 6164A001-0000FFC4-00000000-00000000
CPUID 00000003: 00000000-00000000-00000000-00000000
CPUID 00000004: 3C000121-0140003F-0000003F-00000001 [SL 00]
CPUID 00000004: 3C000122-01C0003F-0000003F-00000001 [SL 01]
CPUID 00000004: 3C00C143-03C0003F-000007FF-00000001 [SL 02]
CPUID 00000005: 00000040-00000040-00000003-00002020
CPUID 00000006: 00000055-00000002-00000009-00000000
CPUID 00000007: 00000000-2294E283-00000000-00000000
CPUID 00000008: 00000000-00000000-00000000-00000000
CPUID 00000009: 00000000-00000000-00000000-00000000
CPUID 0000000A: 07300404-00000000-00000000-00000603
CPUID 0000000B: 00000001-00000001-00000100-00000018 [SL 00]
CPUID 0000000B: 00000005-00000010-00000201-00000018 [SL 01]
CPUID 0000000C: 00000000-00000000-00000000-00000000
CPUID 0000000D: 0000001B-00000440-00000440-00000000 [SL 00]
CPUID 0000000D: 0000000F-000002C0-00000100-00000000 [SL 01]
CPUID 0000000E: 00000000-00000000-00000000-00000000
CPUID 0000000F: 00000000-00000000-00000000-00000000 [SL 00]
CPUID 0000000F: 00000000-00000000-00000000-00000000 [SL 01]
CPUID 00000010: 00000000-00000004-00000000-00000000 [SL 00]
CPUID 00000010: 00000000-00000000-00000000-00000000 [SL 01]
CPUID 00000011: 00000000-00000000-00000000-00000000
CPUID 00000012: 00000000-00000000-00000000-00000000 [SL 00]
CPUID 00000012: 00000000-00000000-00000000-00000000 [SL 01]
CPUID 00000013: 00000000-00000000-00000000-00000000
CPUID 00000014: 00000001-0000000F-80000007-00000000 [SL 00]
CPUID 00000014: 02490002-003FFFFF-00000000-00000000 [SL 01]
CPUID 00000015: 00000003-000000F0-00000000-00000000 [80.00x / 0]
CPUID 80000000: 80000008-00000000-00000000-00000000
CPUID 80000001: 00000000-00000000-00000101-2C100000
CPUID 80000002: 65746E49-2952286C-6F744120-4D54286D [Intel(R) Atom(TM]
CPUID 80000003: 50432029-33432055-20383539-2E322040 [) CPU C3958 @ 2.]
CPUID 80000004: 48473030-0000007A-00000000-00000000 [00GHz]
CPUID 80000005: 00000000-00000000-00000000-00000000
CPUID 80000006: 00000000-00000000-08008040-00000000
CPUID 80000007: 00000000-00000000-00000000-00000100
CPUID 80000008: 00003027-00000000-00000000-00000000

L1    Data Cache:    24 KB,  6-way Associative, 64-byte Line
L1  Instr. Cache:    32 KB,  8-way Associative, 64-byte Line
L2 Unified Cache:     2 MB, 16-way Associative, 64-byte Line

------[ Logical CPU #13 ]------

allcpu: Package 0 / Core 13 / Thread 0: Valid

CPUID 00000000: 00000015-756E6547-6C65746E-49656E69 [GenuineIntel]
CPUID 00000001: 000506F1-1A200800-4FF8EBBF-BFEBFBFF
CPUID 00000002: 6164A001-0000FFC4-00000000-00000000
CPUID 00000003: 00000000-00000000-00000000-00000000
CPUID 00000004: 3C000121-0140003F-0000003F-00000001 [SL 00]
CPUID 00000004: 3C000122-01C0003F-0000003F-00000001 [SL 01]
CPUID 00000004: 3C00C143-03C0003F-000007FF-00000001 [SL 02]
CPUID 00000005: 00000040-00000040-00000003-00002020
CPUID 00000006: 00000055-00000002-00000009-00000000
CPUID 00000007: 00000000-2294E283-00000000-00000000
CPUID 00000008: 00000000-00000000-00000000-00000000
CPUID 00000009: 00000000-00000000-00000000-00000000
CPUID 0000000A: 07300404-00000000-00000000-00000603
CPUID 0000000B: 00000001-00000001-00000100-0000001A [SL 00]
CPUID 0000000B: 00000005-00000010-00000201-0000001A [SL 01]
CPUID 0000000C: 00000000-00000000-00000000-00000000
CPUID 0000000D: 0000001B-00000440-00000440-00000000 [SL 00]
CPUID 0000000D: 0000000F-000002C0-00000100-00000000 [SL 01]
CPUID 0000000E: 00000000-00000000-00000000-00000000
CPUID 0000000F: 00000000-00000000-00000000-00000000 [SL 00]
CPUID 0000000F: 00000000-00000000-00000000-00000000 [SL 01]
CPUID 00000010: 00000000-00000004-00000000-00000000 [SL 00]
CPUID 00000010: 00000000-00000000-00000000-00000000 [SL 01]
CPUID 00000011: 00000000-00000000-00000000-00000000
CPUID 00000012: 00000000-00000000-00000000-00000000 [SL 00]
CPUID 00000012: 00000000-00000000-00000000-00000000 [SL 01]
CPUID 00000013: 00000000-00000000-00000000-00000000
CPUID 00000014: 00000001-0000000F-80000007-00000000 [SL 00]
CPUID 00000014: 02490002-003FFFFF-00000000-00000000 [SL 01]
CPUID 00000015: 00000003-000000F0-00000000-00000000 [80.00x / 0]
CPUID 80000000: 80000008-00000000-00000000-00000000
CPUID 80000001: 00000000-00000000-00000101-2C100000
CPUID 80000002: 65746E49-2952286C-6F744120-4D54286D [Intel(R) Atom(TM]
CPUID 80000003: 50432029-33432055-20383539-2E322040 [) CPU C3958 @ 2.]
CPUID 80000004: 48473030-0000007A-00000000-00000000 [00GHz]
CPUID 80000005: 00000000-00000000-00000000-00000000
CPUID 80000006: 00000000-00000000-08008040-00000000
CPUID 80000007: 00000000-00000000-00000000-00000100
CPUID 80000008: 00003027-00000000-00000000-00000000

L1    Data Cache:    24 KB,  6-way Associative, 64-byte Line
L1  Instr. Cache:    32 KB,  8-way Associative, 64-byte Line
L2 Unified Cache:     2 MB, 16-way Associative, 64-byte Line

------[ Logical CPU #14 ]------

allcpu: Package 0 / Core 14 / Thread 0: Valid

CPUID 00000000: 00000015-756E6547-6C65746E-49656E69 [GenuineIntel]
CPUID 00000001: 000506F1-1C200800-4FF8EBBF-BFEBFBFF
CPUID 00000002: 6164A001-0000FFC4-00000000-00000000
CPUID 00000003: 00000000-00000000-00000000-00000000
CPUID 00000004: 3C000121-0140003F-0000003F-00000001 [SL 00]
CPUID 00000004: 3C000122-01C0003F-0000003F-00000001 [SL 01]
CPUID 00000004: 3C00C143-03C0003F-000007FF-00000001 [SL 02]
CPUID 00000005: 00000040-00000040-00000003-00002020
CPUID 00000006: 00000055-00000002-00000009-00000000
CPUID 00000007: 00000000-2294E283-00000000-00000000
CPUID 00000008: 00000000-00000000-00000000-00000000
CPUID 00000009: 00000000-00000000-00000000-00000000
CPUID 0000000A: 07300404-00000000-00000000-00000603
CPUID 0000000B: 00000001-00000001-00000100-0000001C [SL 00]
CPUID 0000000B: 00000005-00000010-00000201-0000001C [SL 01]
CPUID 0000000C: 00000000-00000000-00000000-00000000
CPUID 0000000D: 0000001B-00000440-00000440-00000000 [SL 00]
CPUID 0000000D: 0000000F-000002C0-00000100-00000000 [SL 01]
CPUID 0000000E: 00000000-00000000-00000000-00000000
CPUID 0000000F: 00000000-00000000-00000000-00000000 [SL 00]
CPUID 0000000F: 00000000-00000000-00000000-00000000 [SL 01]
CPUID 00000010: 00000000-00000004-00000000-00000000 [SL 00]
CPUID 00000010: 00000000-00000000-00000000-00000000 [SL 01]
CPUID 00000011: 00000000-00000000-00000000-00000000
CPUID 00000012: 00000000-00000000-00000000-00000000 [SL 00]
CPUID 00000012: 00000000-00000000-00000000-00000000 [SL 01]
CPUID 00000013: 00000000-00000000-00000000-00000000
CPUID 00000014: 00000001-0000000F-80000007-00000000 [SL 00]
CPUID 00000014: 02490002-003FFFFF-00000000-00000000 [SL 01]
CPUID 00000015: 00000003-000000F0-00000000-00000000 [80.00x / 0]
CPUID 80000000: 80000008-00000000-00000000-00000000
CPUID 80000001: 00000000-00000000-00000101-2C100000
CPUID 80000002: 65746E49-2952286C-6F744120-4D54286D [Intel(R) Atom(TM]
CPUID 80000003: 50432029-33432055-20383539-2E322040 [) CPU C3958 @ 2.]
CPUID 80000004: 48473030-0000007A-00000000-00000000 [00GHz]
CPUID 80000005: 00000000-00000000-00000000-00000000
CPUID 80000006: 00000000-00000000-08008040-00000000
CPUID 80000007: 00000000-00000000-00000000-00000100
CPUID 80000008: 00003027-00000000-00000000-00000000

L1    Data Cache:    24 KB,  6-way Associative, 64-byte Line
L1  Instr. Cache:    32 KB,  8-way Associative, 64-byte Line
L2 Unified Cache:     2 MB, 16-way Associative, 64-byte Line

------[ Logical CPU #15 ]------

allcpu: Package 0 / Core 15 / Thread 0: Valid

CPUID 00000000: 00000015-756E6547-6C65746E-49656E69 [GenuineIntel]
CPUID 00000001: 000506F1-1E200800-4FF8EBBF-BFEBFBFF
CPUID 00000002: 6164A001-0000FFC4-00000000-00000000
CPUID 00000003: 00000000-00000000-00000000-00000000
CPUID 00000004: 3C000121-0140003F-0000003F-00000001 [SL 00]
CPUID 00000004: 3C000122-01C0003F-0000003F-00000001 [SL 01]
CPUID 00000004: 3C00C143-03C0003F-000007FF-00000001 [SL 02]
CPUID 00000005: 00000040-00000040-00000003-00002020
CPUID 00000006: 00000055-00000002-00000009-00000000
CPUID 00000007: 00000000-2294E283-00000000-00000000
CPUID 00000008: 00000000-00000000-00000000-00000000
CPUID 00000009: 00000000-00000000-00000000-00000000
CPUID 0000000A: 07300404-00000000-00000000-00000603
CPUID 0000000B: 00000001-00000001-00000100-0000001E [SL 00]
CPUID 0000000B: 00000005-00000010-00000201-0000001E [SL 01]
CPUID 0000000C: 00000000-00000000-00000000-00000000
CPUID 0000000D: 0000001B-00000440-00000440-00000000 [SL 00]
CPUID 0000000D: 0000000F-000002C0-00000100-00000000 [SL 01]
CPUID 0000000E: 00000000-00000000-00000000-00000000
CPUID 0000000F: 00000000-00000000-00000000-00000000 [SL 00]
CPUID 0000000F: 00000000-00000000-00000000-00000000 [SL 01]
CPUID 00000010: 00000000-00000004-00000000-00000000 [SL 00]
CPUID 00000010: 00000000-00000000-00000000-00000000 [SL 01]
CPUID 00000011: 00000000-00000000-00000000-00000000
CPUID 00000012: 00000000-00000000-00000000-00000000 [SL 00]
CPUID 00000012: 00000000-00000000-00000000-00000000 [SL 01]
CPUID 00000013: 00000000-00000000-00000000-00000000
CPUID 00000014: 00000001-0000000F-80000007-00000000 [SL 00]
CPUID 00000014: 02490002-003FFFFF-00000000-00000000 [SL 01]
CPUID 00000015: 00000003-000000F0-00000000-00000000 [80.00x / 0]
CPUID 80000000: 80000008-00000000-00000000-00000000
CPUID 80000001: 00000000-00000000-00000101-2C100000
CPUID 80000002: 65746E49-2952286C-6F744120-4D54286D [Intel(R) Atom(TM]
CPUID 80000003: 50432029-33432055-20383539-2E322040 [) CPU C3958 @ 2.]
CPUID 80000004: 48473030-0000007A-00000000-00000000 [00GHz]
CPUID 80000005: 00000000-00000000-00000000-00000000
CPUID 80000006: 00000000-00000000-08008040-00000000
CPUID 80000007: 00000000-00000000-00000000-00000100
CPUID 80000008: 00003027-00000000-00000000-00000000

L1    Data Cache:    24 KB,  6-way Associative, 64-byte Line
L1  Instr. Cache:    32 KB,  8-way Associative, 64-byte Line
L2 Unified Cache:     2 MB, 16-way Associative, 64-byte Line

------[ All CPUs ]------

CPU   0: APICID    0 / Package 0 / Core   0 / Thread 0: Valid
CPU   1: APICID    2 / Package 0 / Core   1 / Thread 0: Valid
CPU   2: APICID    4 / Package 0 / Core   2 / Thread 0: Valid
CPU   3: APICID    6 / Package 0 / Core   3 / Thread 0: Valid
CPU   4: APICID    8 / Package 0 / Core   4 / Thread 0: Valid
CPU   5: APICID   10 / Package 0 / Core   5 / Thread 0: Valid
CPU   6: APICID   12 / Package 0 / Core   6 / Thread 0: Valid
CPU   7: APICID   14 / Package 0 / Core   7 / Thread 0: Valid
CPU   8: APICID   16 / Package 0 / Core   8 / Thread 0: Valid
CPU   9: APICID   18 / Package 0 / Core   9 / Thread 0: Valid
CPU  10: APICID   20 / Package 0 / Core  10 / Thread 0: Valid
CPU  11: APICID   22 / Package 0 / Core  11 / Thread 0: Valid
CPU  12: APICID   24 / Package 0 / Core  12 / Thread 0: Valid
CPU  13: APICID   26 / Package 0 / Core  13 / Thread 0: Valid
CPU  14: APICID   28 / Package 0 / Core  14 / Thread 0: Valid
CPU  15: APICID   30 / Package 0 / Core  15 / Thread 0: Valid

------[ MSR Registers ]------

MSR 00000017: 0000-0000-0000-0000 [PlatID = 0]
MSR 0000001B: 0000-0000-FEE0-0D00
MSR 0000002A: 0000-0000-0000-0000
MSR 00000035: 0000-0000-0000-0000
MSR 0000008B: 0000-0016-0000-0000
MSR 000000CD: < FAILED >
MSR 000000CE: 0004-0821-F881-1400 [eD = 0]
MSR 000000E7: 0000-2595-5C7C-45B8 [S200]
MSR 000000E7: 0000-2595-5D3E-21B0 [S200]
MSR 000000E7: 0000-2595-5DAA-496C
MSR 000000E8: 0000-250A-61AF-C453 [S200]
MSR 000000E8: 0000-250A-6225-2F8B [S200]
MSR 000000E8: 0000-250A-6291-BC37
MSR 000000EE: < FAILED >
MSR 0000011E: < FAILED >
MSR 00000194: < FAILED >
MSR 00000198: 0000-21C2-0000-1400 [S200]
MSR 00000198: 0000-21C2-0000-1400 [S200]
MSR 00000198: 0000-21C2-0000-1400
MSR 00000199: 0000-0000-0000-1400
MSR 0000019A: 0000-0000-0000-0000
MSR 0000019B: 0000-0000-0000-0000
MSR 0000019C: 0000-0000-8840-0000 [S200]
MSR 0000019C: 0000-0000-8840-0000 [S200]
MSR 0000019C: 0000-0000-8841-0000
MSR 0000019D: 0000-0000-0000-0000
MSR 000001A0: 0000-0000-0085-0089
MSR 000001A2: 0000-0000-005F-1400
MSR 000001A4: 0000-0000-0000-0000
MSR 000001AA: 0000-0000-0000-0000
MSR 000001AC: < FAILED >
MSR 000001AD: 1414-1414-1414-1414
MSR 000001B0: 0000-0000-0000-0000
MSR 000001B1: 0000-0000-883D-0000
MSR 000001B2: 0000-0000-0000-0000
MSR 000001FC: 0000-0000-4024-005F
MSR 00000300: < FAILED >
MSR 0000030A: 0000-0000-0000-0000 [S200]
MSR 0000030A: 0000-0000-0000-0000 [S200]
MSR 0000030A: 0000-0000-0000-0000
MSR 0000030B: 0000-0000-0000-0000 [S200]
MSR 0000030B: 0000-0000-0000-0000 [S200]
MSR 0000030B: 0000-0000-0000-0000
MSR 00000480: 00DA-0400-0000-0011
MSR 00000481: 0000-00FF-0000-0016
MSR 00000482: FFF9-FFFE-0401-E172
MSR 00000483: 01FF-FFFF-0003-6DFF
MSR 00000484: 0003-FFFF-0000-11FF
MSR 00000485: 0000-0000-6004-C1E7
MSR 00000486: 0000-0000-8000-0021
MSR 00000487: 0000-0000-FFFF-FFFF
MSR 00000488: 0000-0000-0000-2000
MSR 00000489: 0000-0000-0035-27FF
MSR 0000048A: 0000-0000-0000-002E
MSR 0000048B: 001D-6FFF-0000-0000
MSR 0000048C: 0000-0F01-0633-4141
MSR 0000048D: 0000-00FF-0000-0016
MSR 0000048E: FFF9-FFFE-0400-6172
MSR 0000048F: 01FF-FFFF-0003-6DFB
MSR 00000490: 0003-FFFF-0000-11FB
MSR 00000601: 0000-0000-0000-0108
MSR 00000602: < FAILED >
MSR 00000603: 0000-0000-0000-0003
MSR 00000604: < FAILED >
MSR 00000606: 0000-0000-330A-0E08
MSR 0000060A: 0000-0000-0000-0000
MSR 0000060B: 0000-0000-0000-0000
MSR 0000060C: 0000-0000-0000-0000
MSR 0000060D: 0000-006E-00BD-C310
MSR 00000610: 0007-A500-005B-9F00
MSR 00000611: 0000-0000-6991-A4C1 [S200]
MSR 00000611: 0000-0000-6992-02EC [S200]
MSR 00000611: 0000-0000-6992-608A
MSR 00000613: 0000-0000-0000-0000
MSR 00000614: 002F-3E00-0F00-1F00
MSR 00000618: 0000-0000-0000-0000
MSR 00000619: 0000-0000-07E8-F7D8 [S200]
MSR 00000619: 0000-0000-07E8-F7D8 [S200]
MSR 00000619: 0000-0000-07E8-F7D8
MSR 0000061B: 0000-0000-0000-58F0
MSR 0000061C: 002F-0000-0000-0118
MSR 00000638: < FAILED >
MSR 00000639: 0000-0000-A820-4EE1 [S200]
MSR 00000639: 0000-0000-A820-4F58 [S200]
MSR 00000639: 0000-0000-A820-4FBB
MSR 0000063A: < FAILED >
MSR 0000063B: < FAILED >
MSR 00000640: < FAILED >
MSR 00000641: 0000-0000-0000-0000 [S200]
MSR 00000641: 0000-0000-0000-0000 [S200]
MSR 00000641: 0000-0000-0000-0000
MSR 00000642: < FAILED >
MSR 00000660: 0000-0396-6B15-8920
MSR 00000661: < FAILED >
MSR 00000662: < FAILED >
MSR 00000663: < FAILED >
MSR 00000664: < FAILED >
MSR 00000665: < FAILED >
MSR 00000666: < FAILED >
MSR 00000667: < FAILED >
MSR 00000668: < FAILED >
MSR 00000669: < FAILED >
MSR 0000066A: < FAILED >
MSR 0000066B: < FAILED >
MSR 0000066C: < FAILED >
MSR 0000066D: < FAILED >
MSR 0000066E: < FAILED >
MSR 0000066F: < FAILED >
MSR 00000670: < FAILED >
MSR 00000671: < FAILED >
MSR 00000672: < FAILED >
MSR 00000673: < FAILED >
MSR 00000674: < FAILED >
MSR 00000675: < FAILED >
MSR 00000676: < FAILED >
MSR 00000677: < FAILED >
MSR 00000832: 0000-0000-0003-00D1
MSR 00000838: 0000-0000-0000-0000
MSR 00000839: 0000-0000-0000-0000
MSR 0000083E: 0000-0000-0000-000A

PerformanceFrequency = 24000000

CPU Clock M.Method = 1  (TSC PIT)
PM Timer Address   = 0  (0000h)

APIC Clock =   0.00 MHz  (AT = 0 / TT = 0 / try = 0 / SKL = 0.00 MHz)
APIC Clock =   0.00 MHz  (AT = 0 / TT = 0 / try = 0 / SKL = 0.00 MHz)
APIC Clock =   0.00 MHz  (AT = 0 / TT = 0 / try = 0 / SKL = 0.00 MHz)
APIC Clock =   0.00 MHz  (AT = 0 / TT = 0 / try = 0 / SKL = 0.00 MHz)
APIC Clock =   0.00 MHz  (AT = 0 / TT = 0 / try = 0 / SKL = 0.00 MHz)

CPU Clock = 2000.01 MHz / TSC Clock = 2000.01 MHz / CPU Mul = 20.00x
CPU Clock = 1997.00 MHz / TSC Clock = 1997.00 MHz / CPU Mul = 20.00x
CPU Clock = 2000.00 MHz / TSC Clock = 2000.00 MHz / CPU Mul = 20.00x
CPU Clock = 2000.00 MHz / TSC Clock = 2000.00 MHz / CPU Mul = 20.00x
CPU Clock = 2000.00 MHz / TSC Clock = 2000.00 MHz / CPU Mul = 20.00x

CPU Clock Max = 2000.00 MHz / TSC Clock = 2000.00 MHz / CPU Mul = 20.00x
CPU Clock Max = 1999.99 MHz / TSC Clock = 1999.99 MHz / CPU Mul = 20.00x
CPU Clock Max = 2000.00 MHz / TSC Clock = 2000.00 MHz / CPU Mul = 20.00x
CPU Clock Max = 2000.00 MHz / TSC Clock = 2000.00 MHz / CPU Mul = 20.00x
CPU Clock Max = 2000.00 MHz / TSC Clock = 2000.00 MHz / CPU Mul = 20.00x

INTPERFCTR2 =    0.00 MHz / INTPERFCTR1 (TSC) =    0.00 MHz
INTPERFCTR2 =    0.00 MHz / INTPERFCTR1 (TSC) =    0.00 MHz
INTPERFCTR2 =    0.00 MHz / INTPERFCTR1 (TSC) =    0.00 MHz
INTPERFCTR2 =    0.00 MHz / INTPERFCTR1 (TSC) =    0.00 MHz
INTPERFCTR2 =    0.00 MHz / INTPERFCTR1 (TSC) =    0.00 MHz
