------[ Logical CPU #0 ]------

allcpu: Package 0 / Core 0 / Thread 0: Valid

CPUID 00000000: 00000016-756E6547-6C65746E-49656E69 [GenuineIntel]
CPUID 00000001: 00050654-00100800-7FFEFBFF-BFEBFBFF
CPUID 00000002: 76036301-00F0B6FF-00000000-00C30000
CPUID 00000003: 00000000-00000000-00000000-00000000
CPUID 00000004: 1C004121-01C0003F-0000003F-00000000 [SL 00]
CPUID 00000004: 1C004122-01C0003F-0000003F-00000000 [SL 01]
CPUID 00000004: 1C004143-03C0003F-000003FF-00000000 [SL 02]
CPUID 00000004: 1C03C163-0280003F-00002FFF-00000004 [SL 03]
CPUID 00000005: 00000040-00000040-00000003-00002020
CPUID 00000006: 00000EF5-00000002-00000009-00000000
CPUID 00000007: 00000000-D39FFFFB-00000008-00000000
CPUID 00000008: 00000000-00000000-00000000-00000000
CPUID 00000009: 00000000-00000000-00000000-00000000
CPUID 0000000A: 07300804-00000000-00000000-00000603
CPUID 0000000B: 00000001-00000001-00000100-00000000 [SL 00]
CPUID 0000000B: 00000004-00000006-00000201-00000000 [SL 01]
CPUID 0000000C: 00000000-00000000-00000000-00000000
CPUID 0000000D: 000002FF-00000340-00000A88-00000000 [SL 00]
CPUID 0000000D: 0000000F-00000340-00000100-00000000 [SL 01]
CPUID 0000000D: 00000100-00000240-00000000-00000000 [SL 02]
CPUID 0000000D: 00000040-000003C0-00000000-00000000 [SL 03]
CPUID 0000000D: 00000040-00000400-00000000-00000000 [SL 04]
CPUID 0000000D: 00000040-00000440-00000000-00000000 [SL 05]
CPUID 0000000D: 00000200-00000480-00000000-00000000 [SL 06]
CPUID 0000000D: 00000400-00000680-00000000-00000000 [SL 07]
CPUID 0000000D: 00000080-00000000-00000001-00000000 [SL 08]
CPUID 0000000D: 00000008-00000A80-00000000-00000000 [SL 09]
CPUID 0000000E: 00000000-00000000-00000000-00000000
CPUID 0000000F: 00000000-0000002F-00000000-00000002 [SL 00]
CPUID 0000000F: 00000000-00006000-0000002F-00000007 [SL 01]
CPUID 00000010: 00000000-0000000A-00000000-00000000 [SL 00]
CPUID 00000010: 0000000A-00000600-00000004-0000000F [SL 01]
CPUID 00000011: 00000000-00000000-00000000-00000000
CPUID 00000012: 00000000-00000000-00000000-00000000 [SL 00]
CPUID 00000012: 00000000-00000000-00000000-00000000 [SL 01]
CPUID 00000013: 00000000-00000000-00000000-00000000
CPUID 00000014: 00000001-0000000F-00000007-00000000 [SL 00]
CPUID 00000014: 02490002-003F3FFF-00000000-00000000 [SL 01]
CPUID 00000015: 00000002-00000088-00000000-00000000 [68.00x / 0]
CPUID 00000016: 000006A4-000006A4-00000064-00000000 [1700 / 1700 / 100]
CPUID 80000000: 80000008-00000000-00000000-00000000
CPUID 80000001: 00000000-00000000-00000121-2C100000
CPUID 80000002: 65746E49-2952286C-6F655820-2952286E [Intel(R) Xeon(R)]
CPUID 80000003: 6F724220-20657A6E-34303133-55504320 [ Bronze 3104 CPU]
CPUID 80000004: 31204020-4730372E-00007A48-00000000 [ @ 1.70GHz]
CPUID 80000005: 00000000-00000000-00000000-00000000
CPUID 80000006: 00000000-00000000-01006040-00000000
CPUID 80000007: 00000000-00000000-00000000-00000100
CPUID 80000008: 0000302E-00000000-00000000-00000000

L1    Data Cache:    32 KB,  8-way Associative, 64-byte Line
L1  Instr. Cache:    32 KB,  8-way Associative, 64-byte Line
L2 Unified Cache:     1 MB, 16-way Associative, 64-byte Line
L3 Unified Cache:  8448 KB, 11-way Associative, 64-byte Line

------[ Logical CPU #1 ]------

allcpu: Package 0 / Core 1 / Thread 0: Valid

CPUID 00000000: 00000016-756E6547-6C65746E-49656E69 [GenuineIntel]
CPUID 00000001: 00050654-02100800-7FFEFBFF-BFEBFBFF
CPUID 00000002: 76036301-00F0B6FF-00000000-00C30000
CPUID 00000003: 00000000-00000000-00000000-00000000
CPUID 00000004: 1C004121-01C0003F-0000003F-00000000 [SL 00]
CPUID 00000004: 1C004122-01C0003F-0000003F-00000000 [SL 01]
CPUID 00000004: 1C004143-03C0003F-000003FF-00000000 [SL 02]
CPUID 00000004: 1C03C163-0280003F-00002FFF-00000004 [SL 03]
CPUID 00000005: 00000040-00000040-00000003-00002020
CPUID 00000006: 00000EF5-00000002-00000009-00000000
CPUID 00000007: 00000000-D39FFFFB-00000008-00000000
CPUID 00000008: 00000000-00000000-00000000-00000000
CPUID 00000009: 00000000-00000000-00000000-00000000
CPUID 0000000A: 07300804-00000000-00000000-00000603
CPUID 0000000B: 00000001-00000001-00000100-00000002 [SL 00]
CPUID 0000000B: 00000004-00000006-00000201-00000002 [SL 01]
CPUID 0000000C: 00000000-00000000-00000000-00000000
CPUID 0000000D: 000002FF-00000340-00000A88-00000000 [SL 00]
CPUID 0000000D: 0000000F-00000340-00000100-00000000 [SL 01]
CPUID 0000000D: 00000100-00000240-00000000-00000000 [SL 02]
CPUID 0000000D: 00000040-000003C0-00000000-00000000 [SL 03]
CPUID 0000000D: 00000040-00000400-00000000-00000000 [SL 04]
CPUID 0000000D: 00000040-00000440-00000000-00000000 [SL 05]
CPUID 0000000D: 00000200-00000480-00000000-00000000 [SL 06]
CPUID 0000000D: 00000400-00000680-00000000-00000000 [SL 07]
CPUID 0000000D: 00000080-00000000-00000001-00000000 [SL 08]
CPUID 0000000D: 00000008-00000A80-00000000-00000000 [SL 09]
CPUID 0000000E: 00000000-00000000-00000000-00000000
CPUID 0000000F: 00000000-0000002F-00000000-00000002 [SL 00]
CPUID 0000000F: 00000000-00006000-0000002F-00000007 [SL 01]
CPUID 00000010: 00000000-0000000A-00000000-00000000 [SL 00]
CPUID 00000010: 0000000A-00000600-00000004-0000000F [SL 01]
CPUID 00000011: 00000000-00000000-00000000-00000000
CPUID 00000012: 00000000-00000000-00000000-00000000 [SL 00]
CPUID 00000012: 00000000-00000000-00000000-00000000 [SL 01]
CPUID 00000013: 00000000-00000000-00000000-00000000
CPUID 00000014: 00000001-0000000F-00000007-00000000 [SL 00]
CPUID 00000014: 02490002-003F3FFF-00000000-00000000 [SL 01]
CPUID 00000015: 00000002-00000088-00000000-00000000 [68.00x / 0]
CPUID 00000016: 000006A4-000006A4-00000064-00000000 [1700 / 1700 / 100]
CPUID 80000000: 80000008-00000000-00000000-00000000
CPUID 80000001: 00000000-00000000-00000121-2C100000
CPUID 80000002: 65746E49-2952286C-6F655820-2952286E [Intel(R) Xeon(R)]
CPUID 80000003: 6F724220-20657A6E-34303133-55504320 [ Bronze 3104 CPU]
CPUID 80000004: 31204020-4730372E-00007A48-00000000 [ @ 1.70GHz]
CPUID 80000005: 00000000-00000000-00000000-00000000
CPUID 80000006: 00000000-00000000-01006040-00000000
CPUID 80000007: 00000000-00000000-00000000-00000100
CPUID 80000008: 0000302E-00000000-00000000-00000000

L1    Data Cache:    32 KB,  8-way Associative, 64-byte Line
L1  Instr. Cache:    32 KB,  8-way Associative, 64-byte Line
L2 Unified Cache:     1 MB, 16-way Associative, 64-byte Line
L3 Unified Cache:  8448 KB, 11-way Associative, 64-byte Line

------[ Logical CPU #2 ]------

allcpu: Package 0 / Core 2 / Thread 0: Valid

CPUID 00000000: 00000016-756E6547-6C65746E-49656E69 [GenuineIntel]
CPUID 00000001: 00050654-04100800-7FFEFBFF-BFEBFBFF
CPUID 00000002: 76036301-00F0B6FF-00000000-00C30000
CPUID 00000003: 00000000-00000000-00000000-00000000
CPUID 00000004: 1C004121-01C0003F-0000003F-00000000 [SL 00]
CPUID 00000004: 1C004122-01C0003F-0000003F-00000000 [SL 01]
CPUID 00000004: 1C004143-03C0003F-000003FF-00000000 [SL 02]
CPUID 00000004: 1C03C163-0280003F-00002FFF-00000004 [SL 03]
CPUID 00000005: 00000040-00000040-00000003-00002020
CPUID 00000006: 00000EF5-00000002-00000009-00000000
CPUID 00000007: 00000000-D39FFFFB-00000008-00000000
CPUID 00000008: 00000000-00000000-00000000-00000000
CPUID 00000009: 00000000-00000000-00000000-00000000
CPUID 0000000A: 07300804-00000000-00000000-00000603
CPUID 0000000B: 00000001-00000001-00000100-00000004 [SL 00]
CPUID 0000000B: 00000004-00000006-00000201-00000004 [SL 01]
CPUID 0000000C: 00000000-00000000-00000000-00000000
CPUID 0000000D: 000002FF-00000340-00000A88-00000000 [SL 00]
CPUID 0000000D: 0000000F-00000340-00000100-00000000 [SL 01]
CPUID 0000000D: 00000100-00000240-00000000-00000000 [SL 02]
CPUID 0000000D: 00000040-000003C0-00000000-00000000 [SL 03]
CPUID 0000000D: 00000040-00000400-00000000-00000000 [SL 04]
CPUID 0000000D: 00000040-00000440-00000000-00000000 [SL 05]
CPUID 0000000D: 00000200-00000480-00000000-00000000 [SL 06]
CPUID 0000000D: 00000400-00000680-00000000-00000000 [SL 07]
CPUID 0000000D: 00000080-00000000-00000001-00000000 [SL 08]
CPUID 0000000D: 00000008-00000A80-00000000-00000000 [SL 09]
CPUID 0000000E: 00000000-00000000-00000000-00000000
CPUID 0000000F: 00000000-0000002F-00000000-00000002 [SL 00]
CPUID 0000000F: 00000000-00006000-0000002F-00000007 [SL 01]
CPUID 00000010: 00000000-0000000A-00000000-00000000 [SL 00]
CPUID 00000010: 0000000A-00000600-00000004-0000000F [SL 01]
CPUID 00000011: 00000000-00000000-00000000-00000000
CPUID 00000012: 00000000-00000000-00000000-00000000 [SL 00]
CPUID 00000012: 00000000-00000000-00000000-00000000 [SL 01]
CPUID 00000013: 00000000-00000000-00000000-00000000
CPUID 00000014: 00000001-0000000F-00000007-00000000 [SL 00]
CPUID 00000014: 02490002-003F3FFF-00000000-00000000 [SL 01]
CPUID 00000015: 00000002-00000088-00000000-00000000 [68.00x / 0]
CPUID 00000016: 000006A4-000006A4-00000064-00000000 [1700 / 1700 / 100]
CPUID 80000000: 80000008-00000000-00000000-00000000
CPUID 80000001: 00000000-00000000-00000121-2C100000
CPUID 80000002: 65746E49-2952286C-6F655820-2952286E [Intel(R) Xeon(R)]
CPUID 80000003: 6F724220-20657A6E-34303133-55504320 [ Bronze 3104 CPU]
CPUID 80000004: 31204020-4730372E-00007A48-00000000 [ @ 1.70GHz]
CPUID 80000005: 00000000-00000000-00000000-00000000
CPUID 80000006: 00000000-00000000-01006040-00000000
CPUID 80000007: 00000000-00000000-00000000-00000100
CPUID 80000008: 0000302E-00000000-00000000-00000000

L1    Data Cache:    32 KB,  8-way Associative, 64-byte Line
L1  Instr. Cache:    32 KB,  8-way Associative, 64-byte Line
L2 Unified Cache:     1 MB, 16-way Associative, 64-byte Line
L3 Unified Cache:  8448 KB, 11-way Associative, 64-byte Line

------[ Logical CPU #3 ]------

allcpu: Package 0 / Core 3 / Thread 0: Valid

CPUID 00000000: 00000016-756E6547-6C65746E-49656E69 [GenuineIntel]
CPUID 00000001: 00050654-06100800-7FFEFBFF-BFEBFBFF
CPUID 00000002: 76036301-00F0B6FF-00000000-00C30000
CPUID 00000003: 00000000-00000000-00000000-00000000
CPUID 00000004: 1C004121-01C0003F-0000003F-00000000 [SL 00]
CPUID 00000004: 1C004122-01C0003F-0000003F-00000000 [SL 01]
CPUID 00000004: 1C004143-03C0003F-000003FF-00000000 [SL 02]
CPUID 00000004: 1C03C163-0280003F-00002FFF-00000004 [SL 03]
CPUID 00000005: 00000040-00000040-00000003-00002020
CPUID 00000006: 00000EF5-00000002-00000009-00000000
CPUID 00000007: 00000000-D39FFFFB-00000008-00000000
CPUID 00000008: 00000000-00000000-00000000-00000000
CPUID 00000009: 00000000-00000000-00000000-00000000
CPUID 0000000A: 07300804-00000000-00000000-00000603
CPUID 0000000B: 00000001-00000001-00000100-00000006 [SL 00]
CPUID 0000000B: 00000004-00000006-00000201-00000006 [SL 01]
CPUID 0000000C: 00000000-00000000-00000000-00000000
CPUID 0000000D: 000002FF-00000340-00000A88-00000000 [SL 00]
CPUID 0000000D: 0000000F-00000340-00000100-00000000 [SL 01]
CPUID 0000000D: 00000100-00000240-00000000-00000000 [SL 02]
CPUID 0000000D: 00000040-000003C0-00000000-00000000 [SL 03]
CPUID 0000000D: 00000040-00000400-00000000-00000000 [SL 04]
CPUID 0000000D: 00000040-00000440-00000000-00000000 [SL 05]
CPUID 0000000D: 00000200-00000480-00000000-00000000 [SL 06]
CPUID 0000000D: 00000400-00000680-00000000-00000000 [SL 07]
CPUID 0000000D: 00000080-00000000-00000001-00000000 [SL 08]
CPUID 0000000D: 00000008-00000A80-00000000-00000000 [SL 09]
CPUID 0000000E: 00000000-00000000-00000000-00000000
CPUID 0000000F: 00000000-0000002F-00000000-00000002 [SL 00]
CPUID 0000000F: 00000000-00006000-0000002F-00000007 [SL 01]
CPUID 00000010: 00000000-0000000A-00000000-00000000 [SL 00]
CPUID 00000010: 0000000A-00000600-00000004-0000000F [SL 01]
CPUID 00000011: 00000000-00000000-00000000-00000000
CPUID 00000012: 00000000-00000000-00000000-00000000 [SL 00]
CPUID 00000012: 00000000-00000000-00000000-00000000 [SL 01]
CPUID 00000013: 00000000-00000000-00000000-00000000
CPUID 00000014: 00000001-0000000F-00000007-00000000 [SL 00]
CPUID 00000014: 02490002-003F3FFF-00000000-00000000 [SL 01]
CPUID 00000015: 00000002-00000088-00000000-00000000 [68.00x / 0]
CPUID 00000016: 000006A4-000006A4-00000064-00000000 [1700 / 1700 / 100]
CPUID 80000000: 80000008-00000000-00000000-00000000
CPUID 80000001: 00000000-00000000-00000121-2C100000
CPUID 80000002: 65746E49-2952286C-6F655820-2952286E [Intel(R) Xeon(R)]
CPUID 80000003: 6F724220-20657A6E-34303133-55504320 [ Bronze 3104 CPU]
CPUID 80000004: 31204020-4730372E-00007A48-00000000 [ @ 1.70GHz]
CPUID 80000005: 00000000-00000000-00000000-00000000
CPUID 80000006: 00000000-00000000-01006040-00000000
CPUID 80000007: 00000000-00000000-00000000-00000100
CPUID 80000008: 0000302E-00000000-00000000-00000000

L1    Data Cache:    32 KB,  8-way Associative, 64-byte Line
L1  Instr. Cache:    32 KB,  8-way Associative, 64-byte Line
L2 Unified Cache:     1 MB, 16-way Associative, 64-byte Line
L3 Unified Cache:  8448 KB, 11-way Associative, 64-byte Line

------[ Logical CPU #4 ]------

allcpu: Package 0 / Core 4 / Thread 0: Valid

CPUID 00000000: 00000016-756E6547-6C65746E-49656E69 [GenuineIntel]
CPUID 00000001: 00050654-08100800-7FFEFBFF-BFEBFBFF
CPUID 00000002: 76036301-00F0B6FF-00000000-00C30000
CPUID 00000003: 00000000-00000000-00000000-00000000
CPUID 00000004: 1C004121-01C0003F-0000003F-00000000 [SL 00]
CPUID 00000004: 1C004122-01C0003F-0000003F-00000000 [SL 01]
CPUID 00000004: 1C004143-03C0003F-000003FF-00000000 [SL 02]
CPUID 00000004: 1C03C163-0280003F-00002FFF-00000004 [SL 03]
CPUID 00000005: 00000040-00000040-00000003-00002020
CPUID 00000006: 00000EF5-00000002-00000009-00000000
CPUID 00000007: 00000000-D39FFFFB-00000008-00000000
CPUID 00000008: 00000000-00000000-00000000-00000000
CPUID 00000009: 00000000-00000000-00000000-00000000
CPUID 0000000A: 07300804-00000000-00000000-00000603
CPUID 0000000B: 00000001-00000001-00000100-00000008 [SL 00]
CPUID 0000000B: 00000004-00000006-00000201-00000008 [SL 01]
CPUID 0000000C: 00000000-00000000-00000000-00000000
CPUID 0000000D: 000002FF-00000340-00000A88-00000000 [SL 00]
CPUID 0000000D: 0000000F-00000340-00000100-00000000 [SL 01]
CPUID 0000000D: 00000100-00000240-00000000-00000000 [SL 02]
CPUID 0000000D: 00000040-000003C0-00000000-00000000 [SL 03]
CPUID 0000000D: 00000040-00000400-00000000-00000000 [SL 04]
CPUID 0000000D: 00000040-00000440-00000000-00000000 [SL 05]
CPUID 0000000D: 00000200-00000480-00000000-00000000 [SL 06]
CPUID 0000000D: 00000400-00000680-00000000-00000000 [SL 07]
CPUID 0000000D: 00000080-00000000-00000001-00000000 [SL 08]
CPUID 0000000D: 00000008-00000A80-00000000-00000000 [SL 09]
CPUID 0000000E: 00000000-00000000-00000000-00000000
CPUID 0000000F: 00000000-0000002F-00000000-00000002 [SL 00]
CPUID 0000000F: 00000000-00006000-0000002F-00000007 [SL 01]
CPUID 00000010: 00000000-0000000A-00000000-00000000 [SL 00]
CPUID 00000010: 0000000A-00000600-00000004-0000000F [SL 01]
CPUID 00000011: 00000000-00000000-00000000-00000000
CPUID 00000012: 00000000-00000000-00000000-00000000 [SL 00]
CPUID 00000012: 00000000-00000000-00000000-00000000 [SL 01]
CPUID 00000013: 00000000-00000000-00000000-00000000
CPUID 00000014: 00000001-0000000F-00000007-00000000 [SL 00]
CPUID 00000014: 02490002-003F3FFF-00000000-00000000 [SL 01]
CPUID 00000015: 00000002-00000088-00000000-00000000 [68.00x / 0]
CPUID 00000016: 000006A4-000006A4-00000064-00000000 [1700 / 1700 / 100]
CPUID 80000000: 80000008-00000000-00000000-00000000
CPUID 80000001: 00000000-00000000-00000121-2C100000
CPUID 80000002: 65746E49-2952286C-6F655820-2952286E [Intel(R) Xeon(R)]
CPUID 80000003: 6F724220-20657A6E-34303133-55504320 [ Bronze 3104 CPU]
CPUID 80000004: 31204020-4730372E-00007A48-00000000 [ @ 1.70GHz]
CPUID 80000005: 00000000-00000000-00000000-00000000
CPUID 80000006: 00000000-00000000-01006040-00000000
CPUID 80000007: 00000000-00000000-00000000-00000100
CPUID 80000008: 0000302E-00000000-00000000-00000000

L1    Data Cache:    32 KB,  8-way Associative, 64-byte Line
L1  Instr. Cache:    32 KB,  8-way Associative, 64-byte Line
L2 Unified Cache:     1 MB, 16-way Associative, 64-byte Line
L3 Unified Cache:  8448 KB, 11-way Associative, 64-byte Line

------[ Logical CPU #5 ]------

allcpu: Package 0 / Core 5 / Thread 0: Valid

CPUID 00000000: 00000016-756E6547-6C65746E-49656E69 [GenuineIntel]
CPUID 00000001: 00050654-0A100800-7FFEFBFF-BFEBFBFF
CPUID 00000002: 76036301-00F0B6FF-00000000-00C30000
CPUID 00000003: 00000000-00000000-00000000-00000000
CPUID 00000004: 1C004121-01C0003F-0000003F-00000000 [SL 00]
CPUID 00000004: 1C004122-01C0003F-0000003F-00000000 [SL 01]
CPUID 00000004: 1C004143-03C0003F-000003FF-00000000 [SL 02]
CPUID 00000004: 1C03C163-0280003F-00002FFF-00000004 [SL 03]
CPUID 00000005: 00000040-00000040-00000003-00002020
CPUID 00000006: 00000EF5-00000002-00000009-00000000
CPUID 00000007: 00000000-D39FFFFB-00000008-00000000
CPUID 00000008: 00000000-00000000-00000000-00000000
CPUID 00000009: 00000000-00000000-00000000-00000000
CPUID 0000000A: 07300804-00000000-00000000-00000603
CPUID 0000000B: 00000001-00000001-00000100-0000000A [SL 00]
CPUID 0000000B: 00000004-00000006-00000201-0000000A [SL 01]
CPUID 0000000C: 00000000-00000000-00000000-00000000
CPUID 0000000D: 000002FF-00000340-00000A88-00000000 [SL 00]
CPUID 0000000D: 0000000F-00000340-00000100-00000000 [SL 01]
CPUID 0000000D: 00000100-00000240-00000000-00000000 [SL 02]
CPUID 0000000D: 00000040-000003C0-00000000-00000000 [SL 03]
CPUID 0000000D: 00000040-00000400-00000000-00000000 [SL 04]
CPUID 0000000D: 00000040-00000440-00000000-00000000 [SL 05]
CPUID 0000000D: 00000200-00000480-00000000-00000000 [SL 06]
CPUID 0000000D: 00000400-00000680-00000000-00000000 [SL 07]
CPUID 0000000D: 00000080-00000000-00000001-00000000 [SL 08]
CPUID 0000000D: 00000008-00000A80-00000000-00000000 [SL 09]
CPUID 0000000E: 00000000-00000000-00000000-00000000
CPUID 0000000F: 00000000-0000002F-00000000-00000002 [SL 00]
CPUID 0000000F: 00000000-00006000-0000002F-00000007 [SL 01]
CPUID 00000010: 00000000-0000000A-00000000-00000000 [SL 00]
CPUID 00000010: 0000000A-00000600-00000004-0000000F [SL 01]
CPUID 00000011: 00000000-00000000-00000000-00000000
CPUID 00000012: 00000000-00000000-00000000-00000000 [SL 00]
CPUID 00000012: 00000000-00000000-00000000-00000000 [SL 01]
CPUID 00000013: 00000000-00000000-00000000-00000000
CPUID 00000014: 00000001-0000000F-00000007-00000000 [SL 00]
CPUID 00000014: 02490002-003F3FFF-00000000-00000000 [SL 01]
CPUID 00000015: 00000002-00000088-00000000-00000000 [68.00x / 0]
CPUID 00000016: 000006A4-000006A4-00000064-00000000 [1700 / 1700 / 100]
CPUID 80000000: 80000008-00000000-00000000-00000000
CPUID 80000001: 00000000-00000000-00000121-2C100000
CPUID 80000002: 65746E49-2952286C-6F655820-2952286E [Intel(R) Xeon(R)]
CPUID 80000003: 6F724220-20657A6E-34303133-55504320 [ Bronze 3104 CPU]
CPUID 80000004: 31204020-4730372E-00007A48-00000000 [ @ 1.70GHz]
CPUID 80000005: 00000000-00000000-00000000-00000000
CPUID 80000006: 00000000-00000000-01006040-00000000
CPUID 80000007: 00000000-00000000-00000000-00000100
CPUID 80000008: 0000302E-00000000-00000000-00000000

L1    Data Cache:    32 KB,  8-way Associative, 64-byte Line
L1  Instr. Cache:    32 KB,  8-way Associative, 64-byte Line
L2 Unified Cache:     1 MB, 16-way Associative, 64-byte Line
L3 Unified Cache:  8448 KB, 11-way Associative, 64-byte Line

------[ Logical CPU #6 ]------

allcpu: Package 1 / Core 0 / Thread 0: Valid

CPUID 00000000: 00000016-756E6547-6C65746E-49656E69 [GenuineIntel]
CPUID 00000001: 00050654-10100800-7FFEFBFF-BFEBFBFF
CPUID 00000002: 76036301-00F0B6FF-00000000-00C30000
CPUID 00000003: 00000000-00000000-00000000-00000000
CPUID 00000004: 1C004121-01C0003F-0000003F-00000000 [SL 00]
CPUID 00000004: 1C004122-01C0003F-0000003F-00000000 [SL 01]
CPUID 00000004: 1C004143-03C0003F-000003FF-00000000 [SL 02]
CPUID 00000004: 1C03C163-0280003F-00002FFF-00000004 [SL 03]
CPUID 00000005: 00000040-00000040-00000003-00002020
CPUID 00000006: 00000EF5-00000002-00000009-00000000
CPUID 00000007: 00000000-D39FFFFB-00000008-00000000
CPUID 00000008: 00000000-00000000-00000000-00000000
CPUID 00000009: 00000000-00000000-00000000-00000000
CPUID 0000000A: 07300804-00000000-00000000-00000603
CPUID 0000000B: 00000001-00000001-00000100-00000010 [SL 00]
CPUID 0000000B: 00000004-00000006-00000201-00000010 [SL 01]
CPUID 0000000C: 00000000-00000000-00000000-00000000
CPUID 0000000D: 000002FF-00000340-00000A88-00000000 [SL 00]
CPUID 0000000D: 0000000F-00000340-00000100-00000000 [SL 01]
CPUID 0000000D: 00000100-00000240-00000000-00000000 [SL 02]
CPUID 0000000D: 00000040-000003C0-00000000-00000000 [SL 03]
CPUID 0000000D: 00000040-00000400-00000000-00000000 [SL 04]
CPUID 0000000D: 00000040-00000440-00000000-00000000 [SL 05]
CPUID 0000000D: 00000200-00000480-00000000-00000000 [SL 06]
CPUID 0000000D: 00000400-00000680-00000000-00000000 [SL 07]
CPUID 0000000D: 00000080-00000000-00000001-00000000 [SL 08]
CPUID 0000000D: 00000008-00000A80-00000000-00000000 [SL 09]
CPUID 0000000E: 00000000-00000000-00000000-00000000
CPUID 0000000F: 00000000-0000002F-00000000-00000002 [SL 00]
CPUID 0000000F: 00000000-00006000-0000002F-00000007 [SL 01]
CPUID 00000010: 00000000-0000000A-00000000-00000000 [SL 00]
CPUID 00000010: 0000000A-00000600-00000004-0000000F [SL 01]
CPUID 00000011: 00000000-00000000-00000000-00000000
CPUID 00000012: 00000000-00000000-00000000-00000000 [SL 00]
CPUID 00000012: 00000000-00000000-00000000-00000000 [SL 01]
CPUID 00000013: 00000000-00000000-00000000-00000000
CPUID 00000014: 00000001-0000000F-00000007-00000000 [SL 00]
CPUID 00000014: 02490002-003F3FFF-00000000-00000000 [SL 01]
CPUID 00000015: 00000002-00000088-00000000-00000000 [68.00x / 0]
CPUID 00000016: 000006A4-000006A4-00000064-00000000 [1700 / 1700 / 100]
CPUID 80000000: 80000008-00000000-00000000-00000000
CPUID 80000001: 00000000-00000000-00000121-2C100000
CPUID 80000002: 65746E49-2952286C-6F655820-2952286E [Intel(R) Xeon(R)]
CPUID 80000003: 6F724220-20657A6E-34303133-55504320 [ Bronze 3104 CPU]
CPUID 80000004: 31204020-4730372E-00007A48-00000000 [ @ 1.70GHz]
CPUID 80000005: 00000000-00000000-00000000-00000000
CPUID 80000006: 00000000-00000000-01006040-00000000
CPUID 80000007: 00000000-00000000-00000000-00000100
CPUID 80000008: 0000302E-00000000-00000000-00000000

L1    Data Cache:    32 KB,  8-way Associative, 64-byte Line
L1  Instr. Cache:    32 KB,  8-way Associative, 64-byte Line
L2 Unified Cache:     1 MB, 16-way Associative, 64-byte Line
L3 Unified Cache:  8448 KB, 11-way Associative, 64-byte Line

------[ Logical CPU #7 ]------

allcpu: Package 1 / Core 1 / Thread 0: Valid

CPUID 00000000: 00000016-756E6547-6C65746E-49656E69 [GenuineIntel]
CPUID 00000001: 00050654-12100800-7FFEFBFF-BFEBFBFF
CPUID 00000002: 76036301-00F0B6FF-00000000-00C30000
CPUID 00000003: 00000000-00000000-00000000-00000000
CPUID 00000004: 1C004121-01C0003F-0000003F-00000000 [SL 00]
CPUID 00000004: 1C004122-01C0003F-0000003F-00000000 [SL 01]
CPUID 00000004: 1C004143-03C0003F-000003FF-00000000 [SL 02]
CPUID 00000004: 1C03C163-0280003F-00002FFF-00000004 [SL 03]
CPUID 00000005: 00000040-00000040-00000003-00002020
CPUID 00000006: 00000EF5-00000002-00000009-00000000
CPUID 00000007: 00000000-D39FFFFB-00000008-00000000
CPUID 00000008: 00000000-00000000-00000000-00000000
CPUID 00000009: 00000000-00000000-00000000-00000000
CPUID 0000000A: 07300804-00000000-00000000-00000603
CPUID 0000000B: 00000001-00000001-00000100-00000012 [SL 00]
CPUID 0000000B: 00000004-00000006-00000201-00000012 [SL 01]
CPUID 0000000C: 00000000-00000000-00000000-00000000
CPUID 0000000D: 000002FF-00000340-00000A88-00000000 [SL 00]
CPUID 0000000D: 0000000F-00000340-00000100-00000000 [SL 01]
CPUID 0000000D: 00000100-00000240-00000000-00000000 [SL 02]
CPUID 0000000D: 00000040-000003C0-00000000-00000000 [SL 03]
CPUID 0000000D: 00000040-00000400-00000000-00000000 [SL 04]
CPUID 0000000D: 00000040-00000440-00000000-00000000 [SL 05]
CPUID 0000000D: 00000200-00000480-00000000-00000000 [SL 06]
CPUID 0000000D: 00000400-00000680-00000000-00000000 [SL 07]
CPUID 0000000D: 00000080-00000000-00000001-00000000 [SL 08]
CPUID 0000000D: 00000008-00000A80-00000000-00000000 [SL 09]
CPUID 0000000E: 00000000-00000000-00000000-00000000
CPUID 0000000F: 00000000-0000002F-00000000-00000002 [SL 00]
CPUID 0000000F: 00000000-00006000-0000002F-00000007 [SL 01]
CPUID 00000010: 00000000-0000000A-00000000-00000000 [SL 00]
CPUID 00000010: 0000000A-00000600-00000004-0000000F [SL 01]
CPUID 00000011: 00000000-00000000-00000000-00000000
CPUID 00000012: 00000000-00000000-00000000-00000000 [SL 00]
CPUID 00000012: 00000000-00000000-00000000-00000000 [SL 01]
CPUID 00000013: 00000000-00000000-00000000-00000000
CPUID 00000014: 00000001-0000000F-00000007-00000000 [SL 00]
CPUID 00000014: 02490002-003F3FFF-00000000-00000000 [SL 01]
CPUID 00000015: 00000002-00000088-00000000-00000000 [68.00x / 0]
CPUID 00000016: 000006A4-000006A4-00000064-00000000 [1700 / 1700 / 100]
CPUID 80000000: 80000008-00000000-00000000-00000000
CPUID 80000001: 00000000-00000000-00000121-2C100000
CPUID 80000002: 65746E49-2952286C-6F655820-2952286E [Intel(R) Xeon(R)]
CPUID 80000003: 6F724220-20657A6E-34303133-55504320 [ Bronze 3104 CPU]
CPUID 80000004: 31204020-4730372E-00007A48-00000000 [ @ 1.70GHz]
CPUID 80000005: 00000000-00000000-00000000-00000000
CPUID 80000006: 00000000-00000000-01006040-00000000
CPUID 80000007: 00000000-00000000-00000000-00000100
CPUID 80000008: 0000302E-00000000-00000000-00000000

L1    Data Cache:    32 KB,  8-way Associative, 64-byte Line
L1  Instr. Cache:    32 KB,  8-way Associative, 64-byte Line
L2 Unified Cache:     1 MB, 16-way Associative, 64-byte Line
L3 Unified Cache:  8448 KB, 11-way Associative, 64-byte Line

------[ Logical CPU #8 ]------

allcpu: Package 1 / Core 2 / Thread 0: Valid

CPUID 00000000: 00000016-756E6547-6C65746E-49656E69 [GenuineIntel]
CPUID 00000001: 00050654-14100800-7FFEFBFF-BFEBFBFF
CPUID 00000002: 76036301-00F0B6FF-00000000-00C30000
CPUID 00000003: 00000000-00000000-00000000-00000000
CPUID 00000004: 1C004121-01C0003F-0000003F-00000000 [SL 00]
CPUID 00000004: 1C004122-01C0003F-0000003F-00000000 [SL 01]
CPUID 00000004: 1C004143-03C0003F-000003FF-00000000 [SL 02]
CPUID 00000004: 1C03C163-0280003F-00002FFF-00000004 [SL 03]
CPUID 00000005: 00000040-00000040-00000003-00002020
CPUID 00000006: 00000EF5-00000002-00000009-00000000
CPUID 00000007: 00000000-D39FFFFB-00000008-00000000
CPUID 00000008: 00000000-00000000-00000000-00000000
CPUID 00000009: 00000000-00000000-00000000-00000000
CPUID 0000000A: 07300804-00000000-00000000-00000603
CPUID 0000000B: 00000001-00000001-00000100-00000014 [SL 00]
CPUID 0000000B: 00000004-00000006-00000201-00000014 [SL 01]
CPUID 0000000C: 00000000-00000000-00000000-00000000
CPUID 0000000D: 000002FF-00000340-00000A88-00000000 [SL 00]
CPUID 0000000D: 0000000F-00000340-00000100-00000000 [SL 01]
CPUID 0000000D: 00000100-00000240-00000000-00000000 [SL 02]
CPUID 0000000D: 00000040-000003C0-00000000-00000000 [SL 03]
CPUID 0000000D: 00000040-00000400-00000000-00000000 [SL 04]
CPUID 0000000D: 00000040-00000440-00000000-00000000 [SL 05]
CPUID 0000000D: 00000200-00000480-00000000-00000000 [SL 06]
CPUID 0000000D: 00000400-00000680-00000000-00000000 [SL 07]
CPUID 0000000D: 00000080-00000000-00000001-00000000 [SL 08]
CPUID 0000000D: 00000008-00000A80-00000000-00000000 [SL 09]
CPUID 0000000E: 00000000-00000000-00000000-00000000
CPUID 0000000F: 00000000-0000002F-00000000-00000002 [SL 00]
CPUID 0000000F: 00000000-00006000-0000002F-00000007 [SL 01]
CPUID 00000010: 00000000-0000000A-00000000-00000000 [SL 00]
CPUID 00000010: 0000000A-00000600-00000004-0000000F [SL 01]
CPUID 00000011: 00000000-00000000-00000000-00000000
CPUID 00000012: 00000000-00000000-00000000-00000000 [SL 00]
CPUID 00000012: 00000000-00000000-00000000-00000000 [SL 01]
CPUID 00000013: 00000000-00000000-00000000-00000000
CPUID 00000014: 00000001-0000000F-00000007-00000000 [SL 00]
CPUID 00000014: 02490002-003F3FFF-00000000-00000000 [SL 01]
CPUID 00000015: 00000002-00000088-00000000-00000000 [68.00x / 0]
CPUID 00000016: 000006A4-000006A4-00000064-00000000 [1700 / 1700 / 100]
CPUID 80000000: 80000008-00000000-00000000-00000000
CPUID 80000001: 00000000-00000000-00000121-2C100000
CPUID 80000002: 65746E49-2952286C-6F655820-2952286E [Intel(R) Xeon(R)]
CPUID 80000003: 6F724220-20657A6E-34303133-55504320 [ Bronze 3104 CPU]
CPUID 80000004: 31204020-4730372E-00007A48-00000000 [ @ 1.70GHz]
CPUID 80000005: 00000000-00000000-00000000-00000000
CPUID 80000006: 00000000-00000000-01006040-00000000
CPUID 80000007: 00000000-00000000-00000000-00000100
CPUID 80000008: 0000302E-00000000-00000000-00000000

L1    Data Cache:    32 KB,  8-way Associative, 64-byte Line
L1  Instr. Cache:    32 KB,  8-way Associative, 64-byte Line
L2 Unified Cache:     1 MB, 16-way Associative, 64-byte Line
L3 Unified Cache:  8448 KB, 11-way Associative, 64-byte Line

------[ Logical CPU #9 ]------

allcpu: Package 1 / Core 3 / Thread 0: Valid

CPUID 00000000: 00000016-756E6547-6C65746E-49656E69 [GenuineIntel]
CPUID 00000001: 00050654-16100800-7FFEFBFF-BFEBFBFF
CPUID 00000002: 76036301-00F0B6FF-00000000-00C30000
CPUID 00000003: 00000000-00000000-00000000-00000000
CPUID 00000004: 1C004121-01C0003F-0000003F-00000000 [SL 00]
CPUID 00000004: 1C004122-01C0003F-0000003F-00000000 [SL 01]
CPUID 00000004: 1C004143-03C0003F-000003FF-00000000 [SL 02]
CPUID 00000004: 1C03C163-0280003F-00002FFF-00000004 [SL 03]
CPUID 00000005: 00000040-00000040-00000003-00002020
CPUID 00000006: 00000EF5-00000002-00000009-00000000
CPUID 00000007: 00000000-D39FFFFB-00000008-00000000
CPUID 00000008: 00000000-00000000-00000000-00000000
CPUID 00000009: 00000000-00000000-00000000-00000000
CPUID 0000000A: 07300804-00000000-00000000-00000603
CPUID 0000000B: 00000001-00000001-00000100-00000016 [SL 00]
CPUID 0000000B: 00000004-00000006-00000201-00000016 [SL 01]
CPUID 0000000C: 00000000-00000000-00000000-00000000
CPUID 0000000D: 000002FF-00000340-00000A88-00000000 [SL 00]
CPUID 0000000D: 0000000F-00000340-00000100-00000000 [SL 01]
CPUID 0000000D: 00000100-00000240-00000000-00000000 [SL 02]
CPUID 0000000D: 00000040-000003C0-00000000-00000000 [SL 03]
CPUID 0000000D: 00000040-00000400-00000000-00000000 [SL 04]
CPUID 0000000D: 00000040-00000440-00000000-00000000 [SL 05]
CPUID 0000000D: 00000200-00000480-00000000-00000000 [SL 06]
CPUID 0000000D: 00000400-00000680-00000000-00000000 [SL 07]
CPUID 0000000D: 00000080-00000000-00000001-00000000 [SL 08]
CPUID 0000000D: 00000008-00000A80-00000000-00000000 [SL 09]
CPUID 0000000E: 00000000-00000000-00000000-00000000
CPUID 0000000F: 00000000-0000002F-00000000-00000002 [SL 00]
CPUID 0000000F: 00000000-00006000-0000002F-00000007 [SL 01]
CPUID 00000010: 00000000-0000000A-00000000-00000000 [SL 00]
CPUID 00000010: 0000000A-00000600-00000004-0000000F [SL 01]
CPUID 00000011: 00000000-00000000-00000000-00000000
CPUID 00000012: 00000000-00000000-00000000-00000000 [SL 00]
CPUID 00000012: 00000000-00000000-00000000-00000000 [SL 01]
CPUID 00000013: 00000000-00000000-00000000-00000000
CPUID 00000014: 00000001-0000000F-00000007-00000000 [SL 00]
CPUID 00000014: 02490002-003F3FFF-00000000-00000000 [SL 01]
CPUID 00000015: 00000002-00000088-00000000-00000000 [68.00x / 0]
CPUID 00000016: 000006A4-000006A4-00000064-00000000 [1700 / 1700 / 100]
CPUID 80000000: 80000008-00000000-00000000-00000000
CPUID 80000001: 00000000-00000000-00000121-2C100000
CPUID 80000002: 65746E49-2952286C-6F655820-2952286E [Intel(R) Xeon(R)]
CPUID 80000003: 6F724220-20657A6E-34303133-55504320 [ Bronze 3104 CPU]
CPUID 80000004: 31204020-4730372E-00007A48-00000000 [ @ 1.70GHz]
CPUID 80000005: 00000000-00000000-00000000-00000000
CPUID 80000006: 00000000-00000000-01006040-00000000
CPUID 80000007: 00000000-00000000-00000000-00000100
CPUID 80000008: 0000302E-00000000-00000000-00000000

L1    Data Cache:    32 KB,  8-way Associative, 64-byte Line
L1  Instr. Cache:    32 KB,  8-way Associative, 64-byte Line
L2 Unified Cache:     1 MB, 16-way Associative, 64-byte Line
L3 Unified Cache:  8448 KB, 11-way Associative, 64-byte Line

------[ Logical CPU #10 ]------

allcpu: Package 1 / Core 4 / Thread 0: Valid

CPUID 00000000: 00000016-756E6547-6C65746E-49656E69 [GenuineIntel]
CPUID 00000001: 00050654-18100800-7FFEFBFF-BFEBFBFF
CPUID 00000002: 76036301-00F0B6FF-00000000-00C30000
CPUID 00000003: 00000000-00000000-00000000-00000000
CPUID 00000004: 1C004121-01C0003F-0000003F-00000000 [SL 00]
CPUID 00000004: 1C004122-01C0003F-0000003F-00000000 [SL 01]
CPUID 00000004: 1C004143-03C0003F-000003FF-00000000 [SL 02]
CPUID 00000004: 1C03C163-0280003F-00002FFF-00000004 [SL 03]
CPUID 00000005: 00000040-00000040-00000003-00002020
CPUID 00000006: 00000EF5-00000002-00000009-00000000
CPUID 00000007: 00000000-D39FFFFB-00000008-00000000
CPUID 00000008: 00000000-00000000-00000000-00000000
CPUID 00000009: 00000000-00000000-00000000-00000000
CPUID 0000000A: 07300804-00000000-00000000-00000603
CPUID 0000000B: 00000001-00000001-00000100-00000018 [SL 00]
CPUID 0000000B: 00000004-00000006-00000201-00000018 [SL 01]
CPUID 0000000C: 00000000-00000000-00000000-00000000
CPUID 0000000D: 000002FF-00000340-00000A88-00000000 [SL 00]
CPUID 0000000D: 0000000F-00000340-00000100-00000000 [SL 01]
CPUID 0000000D: 00000100-00000240-00000000-00000000 [SL 02]
CPUID 0000000D: 00000040-000003C0-00000000-00000000 [SL 03]
CPUID 0000000D: 00000040-00000400-00000000-00000000 [SL 04]
CPUID 0000000D: 00000040-00000440-00000000-00000000 [SL 05]
CPUID 0000000D: 00000200-00000480-00000000-00000000 [SL 06]
CPUID 0000000D: 00000400-00000680-00000000-00000000 [SL 07]
CPUID 0000000D: 00000080-00000000-00000001-00000000 [SL 08]
CPUID 0000000D: 00000008-00000A80-00000000-00000000 [SL 09]
CPUID 0000000E: 00000000-00000000-00000000-00000000
CPUID 0000000F: 00000000-0000002F-00000000-00000002 [SL 00]
CPUID 0000000F: 00000000-00006000-0000002F-00000007 [SL 01]
CPUID 00000010: 00000000-0000000A-00000000-00000000 [SL 00]
CPUID 00000010: 0000000A-00000600-00000004-0000000F [SL 01]
CPUID 00000011: 00000000-00000000-00000000-00000000
CPUID 00000012: 00000000-00000000-00000000-00000000 [SL 00]
CPUID 00000012: 00000000-00000000-00000000-00000000 [SL 01]
CPUID 00000013: 00000000-00000000-00000000-00000000
CPUID 00000014: 00000001-0000000F-00000007-00000000 [SL 00]
CPUID 00000014: 02490002-003F3FFF-00000000-00000000 [SL 01]
CPUID 00000015: 00000002-00000088-00000000-00000000 [68.00x / 0]
CPUID 00000016: 000006A4-000006A4-00000064-00000000 [1700 / 1700 / 100]
CPUID 80000000: 80000008-00000000-00000000-00000000
CPUID 80000001: 00000000-00000000-00000121-2C100000
CPUID 80000002: 65746E49-2952286C-6F655820-2952286E [Intel(R) Xeon(R)]
CPUID 80000003: 6F724220-20657A6E-34303133-55504320 [ Bronze 3104 CPU]
CPUID 80000004: 31204020-4730372E-00007A48-00000000 [ @ 1.70GHz]
CPUID 80000005: 00000000-00000000-00000000-00000000
CPUID 80000006: 00000000-00000000-01006040-00000000
CPUID 80000007: 00000000-00000000-00000000-00000100
CPUID 80000008: 0000302E-00000000-00000000-00000000

L1    Data Cache:    32 KB,  8-way Associative, 64-byte Line
L1  Instr. Cache:    32 KB,  8-way Associative, 64-byte Line
L2 Unified Cache:     1 MB, 16-way Associative, 64-byte Line
L3 Unified Cache:  8448 KB, 11-way Associative, 64-byte Line

------[ Logical CPU #11 ]------

allcpu: Package 1 / Core 5 / Thread 0: Valid

CPUID 00000000: 00000016-756E6547-6C65746E-49656E69 [GenuineIntel]
CPUID 00000001: 00050654-1A100800-7FFEFBFF-BFEBFBFF
CPUID 00000002: 76036301-00F0B6FF-00000000-00C30000
CPUID 00000003: 00000000-00000000-00000000-00000000
CPUID 00000004: 1C004121-01C0003F-0000003F-00000000 [SL 00]
CPUID 00000004: 1C004122-01C0003F-0000003F-00000000 [SL 01]
CPUID 00000004: 1C004143-03C0003F-000003FF-00000000 [SL 02]
CPUID 00000004: 1C03C163-0280003F-00002FFF-00000004 [SL 03]
CPUID 00000005: 00000040-00000040-00000003-00002020
CPUID 00000006: 00000EF5-00000002-00000009-00000000
CPUID 00000007: 00000000-D39FFFFB-00000008-00000000
CPUID 00000008: 00000000-00000000-00000000-00000000
CPUID 00000009: 00000000-00000000-00000000-00000000
CPUID 0000000A: 07300804-00000000-00000000-00000603
CPUID 0000000B: 00000001-00000001-00000100-0000001A [SL 00]
CPUID 0000000B: 00000004-00000006-00000201-0000001A [SL 01]
CPUID 0000000C: 00000000-00000000-00000000-00000000
CPUID 0000000D: 000002FF-00000340-00000A88-00000000 [SL 00]
CPUID 0000000D: 0000000F-00000340-00000100-00000000 [SL 01]
CPUID 0000000D: 00000100-00000240-00000000-00000000 [SL 02]
CPUID 0000000D: 00000040-000003C0-00000000-00000000 [SL 03]
CPUID 0000000D: 00000040-00000400-00000000-00000000 [SL 04]
CPUID 0000000D: 00000040-00000440-00000000-00000000 [SL 05]
CPUID 0000000D: 00000200-00000480-00000000-00000000 [SL 06]
CPUID 0000000D: 00000400-00000680-00000000-00000000 [SL 07]
CPUID 0000000D: 00000080-00000000-00000001-00000000 [SL 08]
CPUID 0000000D: 00000008-00000A80-00000000-00000000 [SL 09]
CPUID 0000000E: 00000000-00000000-00000000-00000000
CPUID 0000000F: 00000000-0000002F-00000000-00000002 [SL 00]
CPUID 0000000F: 00000000-00006000-0000002F-00000007 [SL 01]
CPUID 00000010: 00000000-0000000A-00000000-00000000 [SL 00]
CPUID 00000010: 0000000A-00000600-00000004-0000000F [SL 01]
CPUID 00000011: 00000000-00000000-00000000-00000000
CPUID 00000012: 00000000-00000000-00000000-00000000 [SL 00]
CPUID 00000012: 00000000-00000000-00000000-00000000 [SL 01]
CPUID 00000013: 00000000-00000000-00000000-00000000
CPUID 00000014: 00000001-0000000F-00000007-00000000 [SL 00]
CPUID 00000014: 02490002-003F3FFF-00000000-00000000 [SL 01]
CPUID 00000015: 00000002-00000088-00000000-00000000 [68.00x / 0]
CPUID 00000016: 000006A4-000006A4-00000064-00000000 [1700 / 1700 / 100]
CPUID 80000000: 80000008-00000000-00000000-00000000
CPUID 80000001: 00000000-00000000-00000121-2C100000
CPUID 80000002: 65746E49-2952286C-6F655820-2952286E [Intel(R) Xeon(R)]
CPUID 80000003: 6F724220-20657A6E-34303133-55504320 [ Bronze 3104 CPU]
CPUID 80000004: 31204020-4730372E-00007A48-00000000 [ @ 1.70GHz]
CPUID 80000005: 00000000-00000000-00000000-00000000
CPUID 80000006: 00000000-00000000-01006040-00000000
CPUID 80000007: 00000000-00000000-00000000-00000100
CPUID 80000008: 0000302E-00000000-00000000-00000000

L1    Data Cache:    32 KB,  8-way Associative, 64-byte Line
L1  Instr. Cache:    32 KB,  8-way Associative, 64-byte Line
L2 Unified Cache:     1 MB, 16-way Associative, 64-byte Line
L3 Unified Cache:  8448 KB, 11-way Associative, 64-byte Line

------[ All CPUs ]------

CPU   0: APICID    0 / Package 0 / Core   0 / Thread 0: Valid
CPU   1: APICID    2 / Package 0 / Core   1 / Thread 0: Valid
CPU   2: APICID    4 / Package 0 / Core   2 / Thread 0: Valid
CPU   3: APICID    6 / Package 0 / Core   3 / Thread 0: Valid
CPU   4: APICID    8 / Package 0 / Core   4 / Thread 0: Valid
CPU   5: APICID   10 / Package 0 / Core   5 / Thread 0: Valid
CPU   6: APICID   16 / Package 1 / Core   0 / Thread 0: Valid
CPU   7: APICID   18 / Package 1 / Core   1 / Thread 0: Valid
CPU   8: APICID   20 / Package 1 / Core   2 / Thread 0: Valid
CPU   9: APICID   22 / Package 1 / Core   3 / Thread 0: Valid
CPU  10: APICID   24 / Package 1 / Core   4 / Thread 0: Valid
CPU  11: APICID   26 / Package 1 / Core   5 / Thread 0: Valid

------[ MSR Registers ]------

MSR 00000017: 0000-0000-0000-0000 [PlatID = 0]
MSR 0000001B: 0000-0000-FEE0-0900
MSR 00000035: 0000-0000-0006-0006
MSR 0000008B: 0200-0026-0000-0000
MSR 000000CE: 0007-082C-F381-1100 [eD = 0]
MSR 000000E7: 0000-0000-0007-7D71 [S200]
MSR 000000E7: 0000-0000-0001-0494 [S200]
MSR 000000E7: 0000-0000-0001-0A82
MSR 000000E8: 0000-0000-0000-AAF8 [S200]
MSR 000000E8: 0000-0000-0000-A94D [S200]
MSR 000000E8: 0000-0000-0000-91A6
MSR 00000194: 0000-0000-0000-0000
MSR 00000198: 0000-1505-0000-0800 [S200]
MSR 00000198: 0000-1505-0000-0800 [S200]
MSR 00000198: 0000-1505-0000-0800
MSR 00000199: 0000-0000-0000-1100
MSR 0000019A: 0000-0000-0000-0000
MSR 0000019B: 0000-0000-0000-0000
MSR 0000019C: 0000-0000-8840-0000 [S200]
MSR 0000019C: 0000-0000-8840-0000 [S200]
MSR 0000019C: 0000-0000-883F-0000
MSR 0000019D: 0000-0000-0000-0000
MSR 000001A0: 0000-0000-0085-0089
MSR 000001A2: 0000-0000-0059-0A00
MSR 000001A4: 0000-0000-0000-0000
MSR 000001AA: 0000-0000-0040-3040
MSR 000001AC: < FAILED >
MSR 000001AD: 1111-1111-1111-1111
MSR 000001AE: 1C18-1410-0C06-0402
MSR 000001AF: < FAILED >
MSR 000001B0: 0000-0000-0000-0000
MSR 000001B1: 0000-0000-883E-0000
MSR 000001B2: 0000-0000-0000-0000
MSR 000001FC: 0000-0000-2924-005B
MSR 00000300: 8000-0000-5D3A-1700
MSR 0000030A: 0000-0000-0000-0000 [S200]
MSR 0000030A: 0000-0000-0000-0000 [S200]
MSR 0000030A: 0000-0000-0000-0000
MSR 0000030B: 0000-0000-0000-0000 [S200]
MSR 0000030B: 0000-0000-0000-0000 [S200]
MSR 0000030B: 0000-0000-0000-0000
MSR 00000480: 00DA-0400-0000-0004
MSR 00000481: 0000-00FF-0000-0016
MSR 00000482: FFF9-FFFE-0401-E172
MSR 00000483: 01FF-FFFF-0003-6DFF
MSR 00000484: 0003-FFFF-0000-11FF
MSR 00000485: 0000-0000-7004-C1E7
MSR 00000486: 0000-0000-8000-0021
MSR 00000487: 0000-0000-FFFF-FFFF
MSR 00000488: 0000-0000-0000-2000
MSR 00000489: 0000-0000-0077-67FF
MSR 0000048A: 0000-0000-0000-002E
MSR 0000048B: 025F-7FFF-0000-0000
MSR 0000048C: 0000-0F01-0673-4141
MSR 0000048D: 0000-00FF-0000-0016
MSR 0000048E: FFF9-FFFE-0400-6172
MSR 0000048F: 01FF-FFFF-0003-6DFB
MSR 00000490: 0003-FFFF-0000-11FB
MSR 00000601: 0000-0000-8000-0330
MSR 00000602: < FAILED >
MSR 00000603: 0016-0000-0017-1717
MSR 00000604: < FAILED >
MSR 00000606: 0000-0000-000A-0E03
MSR 0000060A: 0000-0000-0000-0000
MSR 0000060B: 0000-0000-0000-0000
MSR 0000060C: 0000-0000-0000-0000
MSR 0000060D: 0000-002A-B5F7-AA39
MSR 00000610: 0003-8330-0014-82A8
MSR 00000611: 0000-0000-06F8-EE31 [S200]
MSR 00000611: 0000-0000-06F9-A169 [S200]
MSR 00000611: 0000-0000-06FA-3C3E
MSR 00000613: 0000-0000-0000-0000
MSR 00000614: 000F-05D8-0208-02A8
MSR 00000618: 0000-0000-0000-0000
MSR 00000619: 0000-0000-0510-EC3E [S200]
MSR 00000619: 0000-0000-0511-4143 [S200]
MSR 00000619: 0000-0000-0511-92D0
MSR 0000061B: 0000-0000-0000-0000
MSR 0000061C: 000F-00C6-0036-00C0
MSR 0000061E: < FAILED >
MSR 00000620: 0000-0000-0000-0C12
MSR 00000621: 0000-0000-0000-000C
MSR 00000638: 0000-0000-0000-0000
MSR 00000639: 0000-0000-0000-0000 [S200]
MSR 00000639: 0000-0000-0000-0000 [S200]
MSR 00000639: 0000-0000-0000-0000
MSR 0000063A: < FAILED >
MSR 0000063B: < FAILED >
MSR 00000640: < FAILED >
MSR 00000641: < FAILED >
MSR 00000642: < FAILED >
MSR 00000648: 0000-0000-0000-0011
MSR 00000649: 0104-05D8-0008-02A8
MSR 0000064A: 0104-05D8-0008-02A8
MSR 0000064B: 0000-0000-8000-0000
MSR 0000064C: 0000-0000-0000-00FF
MSR 00000690: 0000-0000-0000-0000
MSR 000006B0: < FAILED >
MSR 000006B1: 0000-0000-0000-0000
MSR 00000770: 0000-0000-0000-0000
MSR 00000771: < FAILED >
MSR 00000772: < FAILED >
MSR 00000773: 0000-0000-0000-0000
MSR 00000774: < FAILED >
MSR 00000777: < FAILED >
