------[ Versions ]------

Program Version : EVEREST v4.60.1636 Beta
BenchDLL Version: 2.4.257.0

------[ CPU Info ]------

CPU Type           : Mobile DualCore Intel Core 2 Duo P8400, 2400 MHz (9 x 267)
CPU Alias          : Penryn-3M
CPU Platform       : Socket 479
CPU Stepping       : C0/M0
Instruction Set    : x86, x86-64, MMX, SSE, SSE2, SSE3, SSSE3, SSE4.1
CPUID Manufacturer : GenuineIntel
CPUID CPU Name     : Intel(R) Core(TM)2 Duo CPU P8400 @ 2.26GHz
CPUID Revision     : 00010676h
IA Brand ID        : 00h  (Unknown)
Platform ID        : 20h  (Socket 479)

------[ Logical CPU #0 ]------

allcpu: Valid

CPUID 00000000: 0000000A-756E6547-6C65746E-49656E69
CPUID 00000001: 00010676-00020800-0008E3FD-BFEBFBFF
CPUID 00000002: 05B0B101-005657F0-00000000-2CB43048
CPUID 00000003: 00000000-00000000-00000000-00000000
CPUID 00000004: 04000121-01C0003F-0000003F-00000001
CPUID 00000004: 04000122-01C0003F-0000003F-00000001
CPUID 00000004: 04004143-02C0003F-00000FFF-00000001
CPUID 00000005: 00000040-00000040-00000003-03122220
CPUID 00000006: 00000001-00000002-00000001-00000000
CPUID 00000007: 00000000-00000000-00000000-00000000
CPUID 00000008: 00000400-00000000-00000000-00000000
CPUID 00000009: 00000000-00000000-00000000-00000000
CPUID 0000000A: 07280202-00000000-00000000-00000503
CPUID 80000000: 80000008-00000000-00000000-00000000
CPUID 80000001: 00000000-00000000-00000001-20100000
CPUID 80000002: 65746E49-2952286C-726F4320-4D542865
CPUID 80000003: 44203229-43206F75-20205550-50202020
CPUID 80000004: 30303438-20402020-36322E32-007A4847
CPUID 80000005: 00000000-00000000-00000000-00000000
CPUID 80000006: 00000000-00000000-0C006040-00000000
CPUID 80000007: 00000000-00000000-00000000-00000000
CPUID 80000008: 00003024-00000000-00000000-00000000

L1    Data Cache:     32 KB,  8-way Associative, 64-byte Line
L1  Instr. Cache:     32 KB,  8-way Associative, 64-byte Line
L2 Unified Cache:   3072 KB, 12-way Associative, 64-byte Line

------[ Logical CPU #1 ]------

allcpu: Valid

CPUID 00000000: 0000000A-756E6547-6C65746E-49656E69
CPUID 00000001: 00010676-01020800-0008E3FD-BFEBFBFF
CPUID 00000002: 05B0B101-005657F0-00000000-2CB43048
CPUID 00000003: 00000000-00000000-00000000-00000000
CPUID 00000004: 04000121-01C0003F-0000003F-00000001
CPUID 00000004: 04000122-01C0003F-0000003F-00000001
CPUID 00000004: 04004143-02C0003F-00000FFF-00000001
CPUID 00000005: 00000040-00000040-00000003-03122220
CPUID 00000006: 00000001-00000002-00000001-00000000
CPUID 00000007: 00000000-00000000-00000000-00000000
CPUID 00000008: 00000400-00000000-00000000-00000000
CPUID 00000009: 00000000-00000000-00000000-00000000
CPUID 0000000A: 07280202-00000000-00000000-00000503
CPUID 80000000: 80000008-00000000-00000000-00000000
CPUID 80000001: 00000000-00000000-00000001-20100000
CPUID 80000002: 65746E49-2952286C-726F4320-4D542865
CPUID 80000003: 44203229-43206F75-20205550-50202020
CPUID 80000004: 30303438-20402020-36322E32-007A4847
CPUID 80000005: 00000000-00000000-00000000-00000000
CPUID 80000006: 00000000-00000000-0C006040-00000000
CPUID 80000007: 00000000-00000000-00000000-00000000
CPUID 80000008: 00003024-00000000-00000000-00000000

L1    Data Cache:     32 KB,  8-way Associative, 64-byte Line
L1  Instr. Cache:     32 KB,  8-way Associative, 64-byte Line
L2 Unified Cache:   3072 KB, 12-way Associative, 64-byte Line

------[ MSR Registers ]------

MSR 00000017: 001C-0000-B9F4-C822 [PlatID = 7]
MSR 0000001B: 0000-0000-FEE0-0900
MSR 0000002A: 0000-0000-420C-0800
MSR 0000008B: 0000-060C-0000-0000
MSR 000000CD: 0000-0000-0000-01E0
MSR 000000CE: 8017-0927-4345-0611
MSR 000000E7: 0000-0055-BF80-EF25
MSR 000000E8: 0000-0056-4DE3-141A
MSR 000000EE: 0000-0000-9EB9-1000
MSR 0000011E: 0000-0000-7478-2119
MSR 00000198: 0617-0927-0600-0927
MSR 00000199: 0000-0000-0000-0927
MSR 0000019A: 0000-0000-0000-0002
MSR 0000019B: 0000-0000-0000-0000
MSR 0000019C: 0000-0000-883A-0000
MSR 0000019D: 0000-0000-0000-0617
MSR 000001A0: 0000-0013-6497-0489

PerformanceFrequency = 3579545

Tjmax Temperature = 105 Celsius
