------[ Versions ]------

Program Version : AIDA64 Engineer v5.99.4905 Beta
BenchDLL Version: 4.3.793-x64
Windows Version : Microsoft Windows XP Professional x64 Edition 5.2.3790 Service Pack 2 (64-bit)

------[ CPU Info ]------

CPU Type          : QuadCore Intel Core 2 Extreme QX9650, 3000 MHz (9 x 333)
CPU Alias         : Yorkfield
CPU Platform      : LGA775
CPU Stepping      : C0
Instruction Set   : x86, x86-64, MMX, SSE, SSE2, SSE3, SSSE3, SSE4.1
CPUID Manufacturer: GenuineIntel
CPUID CPU Name    : Intel(R) Core(TM)2 Extreme CPU X9650 @ 3.00GHz
CPUID Revision    : 00010676h
IA Brand ID       : 00h  (Unknown)
Platform ID       : 42h  (LGA775)
HTT / CMP Units   : 0 / 4
Max. NUMA Node    : 0

Tjmax Temperature    : 95 Celsius
HTC Temperature Limit: 0 Celsius
CPU TDP              : 130 W

------[ Motherboard Info ]------

Motherboard ID      : 07/17/2008-P35-ICH9-6A89OG0OC-00
Motherboard Model   : Gigabyte GA-EP35C-DS3R
Motherboard Chipset : Intel Bearlake P35

Award BIOS Type     : Award Modular BIOS v6.00PG
Award BIOS Message  : EP35C-DS3R F3

DMI MB Manufacturer : Gigabyte Technology Co., Ltd.
DMI MB Product      : EP35C-DS3R
DMI MB Version      : x.x
DMI MB Serial       : 
DMI SYS Manufacturer: Gigabyte Technology Co., Ltd.
DMI SYS Product     : EP35C-DS3R
DMI SYS Version     : 
DMI SYS Serial      : 
DMI BIOS Version    : F3


------[ Logical CPU #0 ]------

allcpu: Package 0 / Core 0 / Thread 0: Valid

CPUID 00000000: 0000000A-756E6547-6C65746E-49656E69 [GenuineIntel]
CPUID 00000001: 00010676-00040800-0008E3BD-BFEBFBFF
CPUID 00000002: 05B0B101-005657F0-00000000-2CB4304E
CPUID 00000003: 00000000-00000000-00000000-00000000
CPUID 00000004: 0C000121-01C0003F-0000003F-00000001 [SL 00]
CPUID 00000004: 0C000122-01C0003F-0000003F-00000001 [SL 01]
CPUID 00000004: 0C004143-05C0003F-00000FFF-00000001 [SL 02]
CPUID 00000005: 00000040-00000040-00000003-00000020
CPUID 00000006: 00000001-00000002-00000001-00000000
CPUID 00000007: 00000000-00000000-00000000-00000000
CPUID 00000008: 00000400-00000000-00000000-00000000
CPUID 00000009: 00000000-00000000-00000000-00000000
CPUID 0000000A: 07280202-00000000-00000000-00000503
CPUID 80000000: 80000008-00000000-00000000-00000000
CPUID 80000001: 00000000-00000000-00000001-20100000
CPUID 80000002: 65746E49-2952286C-726F4320-4D542865 [Intel(R) Core(TM]
CPUID 80000003: 45203229-65727478-4320656D-58205550 [)2 Extreme CPU X]
CPUID 80000004: 30353639-20402020-30302E33-007A4847 [9650  @ 3.00GHz]
CPUID 80000005: 00000000-00000000-00000000-00000000
CPUID 80000006: 00000000-00000000-18008040-00000000
CPUID 80000007: 00000000-00000000-00000000-00000000
CPUID 80000008: 00003024-00000000-00000000-00000000

L1    Data Cache:    32 KB,  8-way Associative, 64-byte Line
L1  Instr. Cache:    32 KB,  8-way Associative, 64-byte Line
L2 Unified Cache:     6 MB, 24-way Associative, 64-byte Line

------[ Logical CPU #1 ]------

allcpu: Package 0 / Core 1 / Thread 0: Valid

CPUID 00000000: 0000000A-756E6547-6C65746E-49656E69 [GenuineIntel]
CPUID 00000001: 00010676-01040800-0008E3BD-BFEBFBFF
CPUID 00000002: 05B0B101-005657F0-00000000-2CB4304E
CPUID 00000003: 00000000-00000000-00000000-00000000
CPUID 00000004: 0C000121-01C0003F-0000003F-00000001 [SL 00]
CPUID 00000004: 0C000122-01C0003F-0000003F-00000001 [SL 01]
CPUID 00000004: 0C004143-05C0003F-00000FFF-00000001 [SL 02]
CPUID 00000005: 00000040-00000040-00000003-00000020
CPUID 00000006: 00000001-00000002-00000001-00000000
CPUID 00000007: 00000000-00000000-00000000-00000000
CPUID 00000008: 00000400-00000000-00000000-00000000
CPUID 00000009: 00000000-00000000-00000000-00000000
CPUID 0000000A: 07280202-00000000-00000000-00000503
CPUID 80000000: 80000008-00000000-00000000-00000000
CPUID 80000001: 00000000-00000000-00000001-20100000
CPUID 80000002: 65746E49-2952286C-726F4320-4D542865 [Intel(R) Core(TM]
CPUID 80000003: 45203229-65727478-4320656D-58205550 [)2 Extreme CPU X]
CPUID 80000004: 30353639-20402020-30302E33-007A4847 [9650  @ 3.00GHz]
CPUID 80000005: 00000000-00000000-00000000-00000000
CPUID 80000006: 00000000-00000000-18008040-00000000
CPUID 80000007: 00000000-00000000-00000000-00000000
CPUID 80000008: 00003024-00000000-00000000-00000000

L1    Data Cache:    32 KB,  8-way Associative, 64-byte Line
L1  Instr. Cache:    32 KB,  8-way Associative, 64-byte Line
L2 Unified Cache:     6 MB, 24-way Associative, 64-byte Line

------[ Logical CPU #2 ]------

allcpu: Package 0 / Core 2 / Thread 0: Valid

CPUID 00000000: 0000000A-756E6547-6C65746E-49656E69 [GenuineIntel]
CPUID 00000001: 00010676-02040800-0008E3BD-BFEBFBFF
CPUID 00000002: 05B0B101-005657F0-00000000-2CB4304E
CPUID 00000003: 00000000-00000000-00000000-00000000
CPUID 00000004: 0C000121-01C0003F-0000003F-00000001 [SL 00]
CPUID 00000004: 0C000122-01C0003F-0000003F-00000001 [SL 01]
CPUID 00000004: 0C004143-05C0003F-00000FFF-00000001 [SL 02]
CPUID 00000005: 00000040-00000040-00000003-00000020
CPUID 00000006: 00000001-00000002-00000001-00000000
CPUID 00000007: 00000000-00000000-00000000-00000000
CPUID 00000008: 00000400-00000000-00000000-00000000
CPUID 00000009: 00000000-00000000-00000000-00000000
CPUID 0000000A: 07280202-00000000-00000000-00000503
CPUID 80000000: 80000008-00000000-00000000-00000000
CPUID 80000001: 00000000-00000000-00000001-20100000
CPUID 80000002: 65746E49-2952286C-726F4320-4D542865 [Intel(R) Core(TM]
CPUID 80000003: 45203229-65727478-4320656D-58205550 [)2 Extreme CPU X]
CPUID 80000004: 30353639-20402020-30302E33-007A4847 [9650  @ 3.00GHz]
CPUID 80000005: 00000000-00000000-00000000-00000000
CPUID 80000006: 00000000-00000000-18008040-00000000
CPUID 80000007: 00000000-00000000-00000000-00000000
CPUID 80000008: 00003024-00000000-00000000-00000000

L1    Data Cache:    32 KB,  8-way Associative, 64-byte Line
L1  Instr. Cache:    32 KB,  8-way Associative, 64-byte Line
L2 Unified Cache:     6 MB, 24-way Associative, 64-byte Line

------[ Logical CPU #3 ]------

allcpu: Package 0 / Core 3 / Thread 0: Valid

CPUID 00000000: 0000000A-756E6547-6C65746E-49656E69 [GenuineIntel]
CPUID 00000001: 00010676-03040800-0008E3BD-BFEBFBFF
CPUID 00000002: 05B0B101-005657F0-00000000-2CB4304E
CPUID 00000003: 00000000-00000000-00000000-00000000
CPUID 00000004: 0C000121-01C0003F-0000003F-00000001 [SL 00]
CPUID 00000004: 0C000122-01C0003F-0000003F-00000001 [SL 01]
CPUID 00000004: 0C004143-05C0003F-00000FFF-00000001 [SL 02]
CPUID 00000005: 00000040-00000040-00000003-00000020
CPUID 00000006: 00000001-00000002-00000001-00000000
CPUID 00000007: 00000000-00000000-00000000-00000000
CPUID 00000008: 00000400-00000000-00000000-00000000
CPUID 00000009: 00000000-00000000-00000000-00000000
CPUID 0000000A: 07280202-00000000-00000000-00000503
CPUID 80000000: 80000008-00000000-00000000-00000000
CPUID 80000001: 00000000-00000000-00000001-20100000
CPUID 80000002: 65746E49-2952286C-726F4320-4D542865 [Intel(R) Core(TM]
CPUID 80000003: 45203229-65727478-4320656D-58205550 [)2 Extreme CPU X]
CPUID 80000004: 30353639-20402020-30302E33-007A4847 [9650  @ 3.00GHz]
CPUID 80000005: 00000000-00000000-00000000-00000000
CPUID 80000006: 00000000-00000000-18008040-00000000
CPUID 80000007: 00000000-00000000-00000000-00000000
CPUID 80000008: 00003024-00000000-00000000-00000000

L1    Data Cache:    32 KB,  8-way Associative, 64-byte Line
L1  Instr. Cache:    32 KB,  8-way Associative, 64-byte Line
L2 Unified Cache:     6 MB, 24-way Associative, 64-byte Line

------[ All CPUs ]------

CPU   0: APICID    0 / Package 0 / Core   0 / Thread 0: Valid
CPU   1: APICID    1 / Package 0 / Core   1 / Thread 0: Valid
CPU   2: APICID    2 / Package 0 / Core   2 / Thread 0: Valid
CPU   3: APICID    3 / Package 0 / Core   3 / Thread 0: Valid

------[ MSR Registers ]------

MSR 00000017: 0C10-0000-88C4-091F [PlatID = 4]
MSR 0000001B: 0000-0000-FEE0-0900
MSR 0000002A: 0000-0000-4248-0000
MSR 0000008B: 0000-060C-0000-0000
MSR 000000CD: 0000-0000-0000-0804
MSR 000000CE: 0016-091F-7F7F-0712
MSR 000000E7: 0000-01A6-55F0-C900 [S200]
MSR 000000E7: 0000-01A6-5626-4F1D [S200]
MSR 000000E7: 0000-01A6-565D-1D18
MSR 000000E8: 0000-01A6-565D-7E32 [S200]
MSR 000000E8: 0000-01A6-5687-030E [S200]
MSR 000000E8: 0000-01A6-56AF-9E68
MSR 000000EE: 0000-0000-877D-4B00
MSR 0000011E: 0000-0000-BE70-2111
MSR 00000198: 0616-091F-8600-091F [S200]
MSR 00000198: 0616-091F-8600-091F [S200]
MSR 00000198: 0616-091F-8600-091F
MSR 00000199: 0000-0000-0000-091F
MSR 0000019A: 0000-0000-0000-0008
MSR 0000019B: 0000-0000-0000-0000
MSR 0000019C: 0000-0000-883D-0000 [S200]
MSR 0000019C: 0000-0000-883D-0000 [S200]
MSR 0000019C: 0000-0000-883D-0000
MSR 0000019D: 0000-0000-0000-0616
MSR 000001A0: 0000-0040-6087-2489
MSR 00000480: 005A-0800-0000-000D
MSR 00000481: 0000-003F-0000-0016
MSR 00000482: F7F9-FFFE-0401-E172
MSR 00000483: 0003-FFFF-0003-6DFF
MSR 00000484: 0000-3FFF-0000-11FF
MSR 00000485: 0000-0000-0004-03C0
MSR 00000486: 0000-0000-8000-0021
MSR 00000487: 0000-0000-FFFF-FFFF
MSR 00000488: 0000-0000-0000-2000
MSR 00000489: 0000-0000-0000-27FF
MSR 0000048A: 0000-0000-0000-002C
MSR 0000048B: 0000-0041-0000-0000

PerformanceFrequency = 3000000000

CPU Clock M.Method = 2  (TSC PMT)
PM Timer Address   = 1032  (0408h)

APIC Clock = 333.29 MHz  (AT = 174662 / TT = 15007 / try = 1 / SKL = 0.00 MHz)
APIC Clock = 333.31 MHz  (AT = 174637 / TT = 15004 / try = 1 / SKL = 0.00 MHz)
APIC Clock = 333.31 MHz  (AT = 174650 / TT = 15005 / try = 1 / SKL = 0.00 MHz)
APIC Clock = 333.36 MHz  (AT = 174675 / TT = 15005 / try = 1 / SKL = 0.00 MHz)
APIC Clock = 333.33 MHz  (AT = 174637 / TT = 15003 / try = 1 / SKL = 0.00 MHz)

CPU Clock = 2999.98 MHz / TSC Clock = 2999.98 MHz / CPU Mul =  9.00x
CPU Clock = 3000.01 MHz / TSC Clock = 3000.01 MHz / CPU Mul =  9.00x
CPU Clock = 3000.02 MHz / TSC Clock = 3000.02 MHz / CPU Mul =  9.00x
CPU Clock = 3000.00 MHz / TSC Clock = 3000.00 MHz / CPU Mul =  9.00x
CPU Clock = 3000.00 MHz / TSC Clock = 3000.00 MHz / CPU Mul =  9.00x

CPU Clock Max = 3000.00 MHz / TSC Clock = 3000.00 MHz / CPU Mul =  9.00x
CPU Clock Max = 3000.00 MHz / TSC Clock = 3000.00 MHz / CPU Mul =  9.00x
CPU Clock Max = 2999.99 MHz / TSC Clock = 2999.99 MHz / CPU Mul =  9.00x
CPU Clock Max = 2999.99 MHz / TSC Clock = 2999.99 MHz / CPU Mul =  9.00x
CPU Clock Max = 3000.00 MHz / TSC Clock = 3000.00 MHz / CPU Mul =  9.00x

INTPERFCTR2 = 3000.02 MHz / INTPERFCTR1 (TSC) = 3000.02 MHz
INTPERFCTR2 = 2999.99 MHz / INTPERFCTR1 (TSC) = 2999.99 MHz
INTPERFCTR2 = 3000.00 MHz / INTPERFCTR1 (TSC) = 3000.00 MHz
INTPERFCTR2 = 3000.00 MHz / INTPERFCTR1 (TSC) = 3000.00 MHz
INTPERFCTR2 = 3000.02 MHz / INTPERFCTR1 (TSC) = 3000.02 MHz
