------[ Versions ]------

Program Version : AIDA64 v5.20.3455 Beta
BenchDLL Version: 4.1.633-x64

------[ CPU Info ]------

CPU Type          : QuadCore Intel Celeron N3150, 2083 MHz (26 x 80)
CPU Alias         : Braswell
CPU Platform      : FCBGA1170
CPU Stepping      : C0
Instruction Set   : x86, x86-64, MMX, SSE, SSE2, SSE3, SSSE3, SSE4.1, SSE4.2, AES
CPUID Manufacturer: GenuineIntel
CPUID CPU Name    : Intel(R) Celeron(R) CPU N3150 @ 1.60GHz
CPUID Revision    : 000406C3h
IA Brand ID       : 00h  (Unknown)
Platform ID       : 31h  (FCBGA1170)
HTT / CMP Units   : 0 / 4
Max. NUMA Node    : 0

Tjmax Temperature          : 90 Celsius
HTC Temperature Limit      : 0 Celsius
CPU Max Power Limit        : -1 W / -1000000.00 us
CPU Power Limit 1 (Long)   : 5.9 W / 28.00 sec  (Unlocked)
CPU Power Limit 2 (Short)  : 14.7 W / 10.00 sec  (Unlocked)
Max Turbo Boost Multipliers: 1C: 26x, 2C: 26x, 3C: 26x, 4C: 26x

------[ Logical CPU #0 ]------

allcpu: Package 0 / Core 0 / Thread 0: Valid

CPUID 00000000: 0000000B-756E6547-6C65746E-49656E69 [GenuineIntel]
CPUID 00000001: 000406C3-00100800-43D8E3BF-BFEBFBFF
CPUID 00000002: 61B4A001-0000FFC2-00000000-00000000
CPUID 00000003: 00000000-00000000-00000000-00000000
CPUID 00000004: 1C000121-0140003F-0000003F-00000001 [SL 00]
CPUID 00000004: 1C000122-01C0003F-0000003F-00000001 [SL 01]
CPUID 00000004: 1C00C143-03C0003F-000003FF-00000001 [SL 02]
CPUID 00000005: 00000040-00000040-00000003-33000020
CPUID 00000006: 00000007-00000002-00000009-00000000
CPUID 00000007: 00000000-00002282-00000000-00000000
CPUID 00000008: 00000000-00000000-00000000-00000000
CPUID 00000009: 00000000-00000000-00000000-00000000
CPUID 0000000A: 07280203-00000000-00000000-00000503
CPUID 0000000B: 00000001-00000001-00000100-00000000 [SL 00]
CPUID 0000000B: 00000004-00000004-00000201-00000000 [SL 01]
CPUID 80000000: 80000008-00000000-00000000-00000000
CPUID 80000001: 00000000-00000000-00000101-28100000
CPUID 80000002: 20202020-6E492020-286C6574-43202952 [      Intel(R) C]
CPUID 80000003: 72656C65-52286E6F-50432029-4E202055 [eleron(R) CPU  N]
CPUID 80000004: 30353133-20402020-30362E31-007A4847 [3150  @ 1.60GHz]
CPUID 80000005: 00000000-00000000-00000000-00000000
CPUID 80000006: 00000000-00000000-04008040-00000000
CPUID 80000007: 00000000-00000000-00000000-00000100
CPUID 80000008: 00003024-00000000-00000000-00000000

L1    Data Cache:    24 KB,  6-way Associative, 64-byte Line
L1  Instr. Cache:    32 KB,  8-way Associative, 64-byte Line
L2 Unified Cache:     1 MB, 16-way Associative, 64-byte Line

------[ Logical CPU #1 ]------

allcpu: Package 0 / Core 1 / Thread 0: Valid

CPUID 00000000: 0000000B-756E6547-6C65746E-49656E69 [GenuineIntel]
CPUID 00000001: 000406C3-02100800-43D8E3BF-BFEBFBFF
CPUID 00000002: 61B4A001-0000FFC2-00000000-00000000
CPUID 00000003: 00000000-00000000-00000000-00000000
CPUID 00000004: 1C000121-0140003F-0000003F-00000001 [SL 00]
CPUID 00000004: 1C000122-01C0003F-0000003F-00000001 [SL 01]
CPUID 00000004: 1C00C143-03C0003F-000003FF-00000001 [SL 02]
CPUID 00000005: 00000040-00000040-00000003-33000020
CPUID 00000006: 00000007-00000002-00000009-00000000
CPUID 00000007: 00000000-00002282-00000000-00000000
CPUID 00000008: 00000000-00000000-00000000-00000000
CPUID 00000009: 00000000-00000000-00000000-00000000
CPUID 0000000A: 07280203-00000000-00000000-00000503
CPUID 0000000B: 00000001-00000001-00000100-00000002 [SL 00]
CPUID 0000000B: 00000004-00000004-00000201-00000002 [SL 01]
CPUID 80000000: 80000008-00000000-00000000-00000000
CPUID 80000001: 00000000-00000000-00000101-28100000
CPUID 80000002: 20202020-6E492020-286C6574-43202952 [      Intel(R) C]
CPUID 80000003: 72656C65-52286E6F-50432029-4E202055 [eleron(R) CPU  N]
CPUID 80000004: 30353133-20402020-30362E31-007A4847 [3150  @ 1.60GHz]
CPUID 80000005: 00000000-00000000-00000000-00000000
CPUID 80000006: 00000000-00000000-04008040-00000000
CPUID 80000007: 00000000-00000000-00000000-00000100
CPUID 80000008: 00003024-00000000-00000000-00000000

L1    Data Cache:    24 KB,  6-way Associative, 64-byte Line
L1  Instr. Cache:    32 KB,  8-way Associative, 64-byte Line
L2 Unified Cache:     1 MB, 16-way Associative, 64-byte Line

------[ Logical CPU #2 ]------

allcpu: Package 0 / Core 2 / Thread 0: Valid

CPUID 00000000: 0000000B-756E6547-6C65746E-49656E69 [GenuineIntel]
CPUID 00000001: 000406C3-04100800-43D8E3BF-BFEBFBFF
CPUID 00000002: 61B4A001-0000FFC2-00000000-00000000
CPUID 00000003: 00000000-00000000-00000000-00000000
CPUID 00000004: 1C000121-0140003F-0000003F-00000001 [SL 00]
CPUID 00000004: 1C000122-01C0003F-0000003F-00000001 [SL 01]
CPUID 00000004: 1C00C143-03C0003F-000003FF-00000001 [SL 02]
CPUID 00000005: 00000040-00000040-00000003-33000020
CPUID 00000006: 00000007-00000002-00000009-00000000
CPUID 00000007: 00000000-00002282-00000000-00000000
CPUID 00000008: 00000000-00000000-00000000-00000000
CPUID 00000009: 00000000-00000000-00000000-00000000
CPUID 0000000A: 07280203-00000000-00000000-00000503
CPUID 0000000B: 00000001-00000001-00000100-00000004 [SL 00]
CPUID 0000000B: 00000004-00000004-00000201-00000004 [SL 01]
CPUID 80000000: 80000008-00000000-00000000-00000000
CPUID 80000001: 00000000-00000000-00000101-28100000
CPUID 80000002: 20202020-6E492020-286C6574-43202952 [      Intel(R) C]
CPUID 80000003: 72656C65-52286E6F-50432029-4E202055 [eleron(R) CPU  N]
CPUID 80000004: 30353133-20402020-30362E31-007A4847 [3150  @ 1.60GHz]
CPUID 80000005: 00000000-00000000-00000000-00000000
CPUID 80000006: 00000000-00000000-04008040-00000000
CPUID 80000007: 00000000-00000000-00000000-00000100
CPUID 80000008: 00003024-00000000-00000000-00000000

L1    Data Cache:    24 KB,  6-way Associative, 64-byte Line
L1  Instr. Cache:    32 KB,  8-way Associative, 64-byte Line
L2 Unified Cache:     1 MB, 16-way Associative, 64-byte Line

------[ Logical CPU #3 ]------

allcpu: Package 0 / Core 3 / Thread 0: Valid

CPUID 00000000: 0000000B-756E6547-6C65746E-49656E69 [GenuineIntel]
CPUID 00000001: 000406C3-06100800-43D8E3BF-BFEBFBFF
CPUID 00000002: 61B4A001-0000FFC2-00000000-00000000
CPUID 00000003: 00000000-00000000-00000000-00000000
CPUID 00000004: 1C000121-0140003F-0000003F-00000001 [SL 00]
CPUID 00000004: 1C000122-01C0003F-0000003F-00000001 [SL 01]
CPUID 00000004: 1C00C143-03C0003F-000003FF-00000001 [SL 02]
CPUID 00000005: 00000040-00000040-00000003-33000020
CPUID 00000006: 00000007-00000002-00000009-00000000
CPUID 00000007: 00000000-00002282-00000000-00000000
CPUID 00000008: 00000000-00000000-00000000-00000000
CPUID 00000009: 00000000-00000000-00000000-00000000
CPUID 0000000A: 07280203-00000000-00000000-00000503
CPUID 0000000B: 00000001-00000001-00000100-00000006 [SL 00]
CPUID 0000000B: 00000004-00000004-00000201-00000006 [SL 01]
CPUID 80000000: 80000008-00000000-00000000-00000000
CPUID 80000001: 00000000-00000000-00000101-28100000
CPUID 80000002: 20202020-6E492020-286C6574-43202952 [      Intel(R) C]
CPUID 80000003: 72656C65-52286E6F-50432029-4E202055 [eleron(R) CPU  N]
CPUID 80000004: 30353133-20402020-30362E31-007A4847 [3150  @ 1.60GHz]
CPUID 80000005: 00000000-00000000-00000000-00000000
CPUID 80000006: 00000000-00000000-04008040-00000000
CPUID 80000007: 00000000-00000000-00000000-00000100
CPUID 80000008: 00003024-00000000-00000000-00000000

L1    Data Cache:    24 KB,  6-way Associative, 64-byte Line
L1  Instr. Cache:    32 KB,  8-way Associative, 64-byte Line
L2 Unified Cache:     1 MB, 16-way Associative, 64-byte Line

------[ All CPUs ]------

CPU   0: APICID   0 / Package 0 / Core  0 / Thread 0: Valid
CPU   1: APICID   2 / Package 0 / Core  1 / Thread 0: Valid
CPU   2: APICID   4 / Package 0 / Core  2 / Thread 0: Valid
CPU   3: APICID   6 / Package 0 / Core  3 / Thread 0: Valid

------[ MSR Registers ]------

MSR 00000017: 0000-00F0-9004-1A53 [PlatID = 0]
MSR 0000001B: 0000-0000-FEE0-0900
MSR 0000002A: 0000-0000-4008-0000
MSR 00000035: < FAILED >
MSR 0000008B: 0000-033C-0000-0000
MSR 000000CD: 0000-0000-0000-0004
MSR 000000CE: 0000-0600-0200-1400 [eD = 0]
MSR 000000E7: 0000-0000-0021-3144 [S200]
MSR 000000E7: 0000-0000-0007-D758 [S200]
MSR 000000E7: 0000-0000-0006-60D0
MSR 000000E8: 0000-0000-0002-299E [S200]
MSR 000000E8: 0000-0000-0000-A440 [S200]
MSR 000000E8: 0000-0000-0004-8942
MSR 000000EE: 0000-0000-0238-0002
MSR 0000011E: 0000-0000-7E28-010F
MSR 00000194: 0000-0000-0000-0000
MSR 00000198: 0000-8200-0000-062D [S200]
MSR 00000198: 0000-8200-0000-062D [S200]
MSR 00000198: 0000-8200-0000-062D
MSR 00000199: 0000-0000-0000-062D
MSR 0000019A: 0000-0000-0000-0000
MSR 0000019B: 0000-0000-0000-0000
MSR 0000019C: 0000-0000-882C-0000 [S200]
MSR 0000019C: 0000-0000-882C-0000 [S200]
MSR 0000019C: 0000-0000-882C-0000
MSR 0000019D: 0000-0000-0000-062D
MSR 000001A0: 0000-0000-0085-0089
MSR 000001A2: 0000-0000-005A-0000
MSR 000001A4: < FAILED >
MSR 000001AA: < FAILED >
MSR 000001AC: < FAILED >
MSR 000001AD: 0000-0000-0000-0000
MSR 000001B0: 0000-0000-0000-0005
MSR 000001B1: < FAILED >
MSR 000001B2: < FAILED >
MSR 000001FC: 0000-0000-0000-0002
MSR 00000300: < FAILED >
MSR 00000480: 00DA-0400-0000-0002
MSR 00000481: 0000-007F-0000-0016
MSR 00000482: FFF9-FFFE-0401-E172
MSR 00000483: 007F-FFFF-0003-6DFF
MSR 00000484: 0000-FFFF-0000-11FF
MSR 00000485: 0000-0000-0004-81E6
MSR 00000486: 0000-0000-8000-0021
MSR 00000487: 0000-0000-FFFF-FFFF
MSR 00000488: 0000-0000-0000-2000
MSR 00000489: 0000-0000-0010-27FF
MSR 0000048A: 0000-0000-0000-002E
MSR 0000048B: 0000-28EF-0000-0000
MSR 0000048C: 0000-0F01-0611-4141
MSR 0000048D: 0000-007F-0000-0016
MSR 0000048E: FFF9-FFFE-0400-6172
MSR 0000048F: 007F-FFFF-0003-6DFB
MSR 00000490: 0000-FFFF-0000-11FB
MSR 00000601: 0000-0000-0000-0000
MSR 00000602: < FAILED >
MSR 00000603: < FAILED >
MSR 00000604: < FAILED >
MSR 00000606: 0000-0000-0000-0505
MSR 0000060A: < FAILED >
MSR 0000060B: < FAILED >
MSR 0000060C: < FAILED >
MSR 0000060D: 0000-0000-0000-0000
MSR 00000610: 0014-81D5-0038-80BC
MSR 00000611: 0000-0000-015C-FA80 [S200]
MSR 00000611: 0000-0000-015D-0DE4 [S200]
MSR 00000611: 0000-0000-015D-2143
MSR 00000613: < FAILED >
MSR 00000614: < FAILED >
MSR 00000618: < FAILED >
MSR 00000619: < FAILED >
MSR 0000061B: < FAILED >
MSR 0000061C: < FAILED >
MSR 00000638: 0000-0000-0000-0000
MSR 00000639: 0000-0000-00B2-1D0E [S200]
MSR 00000639: 0000-0000-00B2-1ED8 [S200]
MSR 00000639: 0000-0000-00B2-2091
MSR 0000063A: < FAILED >
MSR 0000063B: < FAILED >
MSR 00000640: < FAILED >
MSR 00000641: < FAILED >
MSR 00000642: < FAILED >
MSR 00000660: 0000-0055-A8FE-A83C
MSR 00000661: 0000-0000-0000-0000
MSR 00000662: 0000-0000-0000-0000
MSR 00000663: 0000-0000-0000-0000
MSR 00000664: 0000-0001-E852-FA8C
MSR 00000665: 0000-0000-0000-0000
MSR 00000666: 0000-0000-0000-0000
MSR 00000667: 0000-0000-0000-0019
MSR 00000668: 0000-0000-1313-0F0B
MSR 00000669: 0000-0000-0304-000C
MSR 0000066A: 0000-0000-0014-0602
MSR 0000066B: 0000-0000-0041-2D2D
MSR 0000066C: 0000-0000-1A1A-1A1A
MSR 0000066D: 0000-0000-5353-5353
MSR 0000066E: 0000-0000-0000-0000
MSR 0000066F: 0000-0000-0000-0000
MSR 00000670: 0000-0000-0000-0002
MSR 00000671: 0000-0000-0000-200B
MSR 00000672: 0000-0000-0000-0000
MSR 00000673: 0000-0000-0000-0305
MSR 00000674: 0000-0000-0405-500D
MSR 00000675: 0000-0000-0000-0027
MSR 00000676: 0000-0000-0000-0000
MSR 00000677: 0000-0000-0000-0000

PerformanceFrequency = 1562587

CPU Clock M.Method = 8  (APIC SNB)
PM Timer Address   = 1032  (0408h)
APIC Clock = 79.99 MHz  (AT = 41953 / TT = 15020 / try = 1)
APIC Clock = 80.05 MHz  (AT = 41947 / TT = 15005 / try = 1)
APIC Clock = 79.94 MHz  (AT = 41937 / TT = 15023 / try = 1)
APIC Clock = 80.00 MHz  (AT = 41961 / TT = 15020 / try = 1)
APIC Clock = 80.06 MHz  (AT = 41953 / TT = 15006 / try = 1)

------[ APIC Base at 00000000-FEE00000 ]------

  0000  00 00 00 00 00 00 00 00 00 00 00 00 00 00 00 00 
  0010  00 00 00 00 00 00 00 00 00 00 00 00 00 00 00 00 
  0020  00 00 00 00 00 00 00 00 00 00 00 00 00 00 00 00 
  0030  14 00 05 00 00 00 00 00 00 00 00 00 00 00 00 00 
  0040  00 00 00 00 00 00 00 00 00 00 00 00 00 00 00 00 
  0050  00 00 00 00 00 00 00 00 00 00 00 00 00 00 00 00 
  0060  00 00 00 00 00 00 00 00 00 00 00 00 00 00 00 00 
  0070  00 00 00 00 00 00 00 00 00 00 00 00 00 00 00 00 
  0080  00 00 00 00 00 00 00 00 00 00 00 00 00 00 00 00 
  0090  00 00 00 00 00 00 00 00 00 00 00 00 00 00 00 00 
  00A0  00 00 00 00 00 00 00 00 00 00 00 00 00 00 00 00 
  00B0  00 00 00 00 00 00 00 00 00 00 00 00 00 00 00 00 
  00C0  00 00 00 00 00 00 00 00 00 00 00 00 00 00 00 00 
  00D0  00 00 00 01 00 00 00 00 00 00 00 00 00 00 00 00 
  00E0  FF FF FF FF 00 00 00 00 00 00 00 00 00 00 00 00 
  00F0  3F 01 00 00 00 00 00 00 00 00 00 00 00 00 00 00 
  0100  00 00 00 00 00 00 00 00 00 00 00 00 00 00 00 00 
  0110  00 00 00 00 00 00 00 00 00 00 00 00 00 00 00 00 
  0120  00 00 00 00 00 00 00 00 00 00 00 00 00 00 00 00 
  0130  00 00 00 00 00 00 00 00 00 00 00 00 00 00 00 00 
  0140  00 00 00 00 00 00 00 00 00 00 00 00 00 00 00 00 
  0150  00 00 00 00 00 00 00 00 00 00 00 00 00 00 00 00 
  0160  00 00 00 00 00 00 00 00 00 00 00 00 00 00 00 00 
  0170  00 00 00 00 00 00 00 00 00 00 00 00 00 00 00 00 
  0180  00 00 00 00 00 00 00 00 00 00 00 00 00 00 00 00 
  0190  00 00 00 00 00 00 00 00 00 00 00 00 00 00 00 00 
  01A0  00 00 00 00 00 00 00 00 00 00 00 00 00 00 00 00 
  01B0  00 00 00 00 00 00 00 00 00 00 00 00 00 00 00 00 
  01C0  00 00 00 00 00 00 00 00 00 00 00 00 00 00 00 00 
  01D0  04 00 06 00 00 00 00 00 00 00 00 00 00 00 00 00 
  01E0  00 00 00 00 00 00 00 00 00 00 00 00 00 00 00 00 
  01F0  00 00 00 00 00 00 00 00 00 00 00 00 00 00 00 00 
  0200  00 00 00 00 00 00 00 00 00 00 00 00 00 00 00 00 
  0210  00 00 00 00 00 00 00 00 00 00 00 00 00 00 00 00 
  0220  00 00 00 00 00 00 00 00 00 00 00 00 00 00 00 00 
  0230  00 00 00 00 00 00 00 00 00 00 00 00 00 00 00 00 
  0240  00 00 00 00 00 00 00 00 00 00 00 00 00 00 00 00 
  0250  00 00 00 00 00 00 00 00 00 00 00 00 00 00 00 00 
  0260  00 00 00 00 00 00 00 00 00 00 00 00 00 00 00 00 
  0270  00 00 00 00 00 00 00 00 00 00 00 00 00 00 00 00 
  0280  00 00 00 00 00 00 00 00 00 00 00 00 00 00 00 00 
  0290  00 00 00 00 00 00 00 00 00 00 00 00 00 00 00 00 
  02A0  00 00 00 00 00 00 00 00 00 00 00 00 00 00 00 00 
  02B0  00 00 00 00 00 00 00 00 00 00 00 00 00 00 00 00 
  02C0  00 00 00 00 00 00 00 00 00 00 00 00 00 00 00 00 
  02D0  00 00 00 00 00 00 00 00 00 00 00 00 00 00 00 00 
  02E0  00 00 00 00 00 00 00 00 00 00 00 00 00 00 00 00 
  02F0  00 00 00 00 00 00 00 00 00 00 00 00 00 00 00 00 
  0300  D1 08 00 00 00 00 00 00 00 00 00 00 00 00 00 00 
  0310  00 00 00 08 00 00 00 00 00 00 00 00 00 00 00 00 
  0320  FD 00 03 00 00 00 00 00 00 00 00 00 00 00 00 00 
  0330  00 00 01 00 00 00 00 00 00 00 00 00 00 00 00 00 
  0340  FE 00 00 00 00 00 00 00 00 00 00 00 00 00 00 00 
  0350  3F 00 01 00 00 00 00 00 00 00 00 00 00 00 00 00 
  0360  FF 04 00 00 00 00 00 00 00 00 00 00 00 00 00 00 
  0370  E3 00 00 00 00 00 00 00 00 00 00 00 00 00 00 00 
  0380  00 00 00 00 00 00 00 00 00 00 00 00 00 00 00 00 
  0390  00 00 00 00 00 00 00 00 00 00 00 00 00 00 00 00 
  03A0  00 00 00 00 00 00 00 00 00 00 00 00 00 00 00 00 
  03B0  00 00 00 00 00 00 00 00 00 00 00 00 00 00 00 00 
  03C0  00 00 00 00 00 00 00 00 00 00 00 00 00 00 00 00 
  03D0  00 00 00 00 00 00 00 00 00 00 00 00 00 00 00 00 
  03E0  0B 00 00 00 00 00 00 00 00 00 00 00 00 00 00 00 
  03F0  00 00 00 00 00 00 00 00 00 00 00 00 00 00 00 00 
