------[ Versions ]------

Program Version : EVEREST v2.81.616 Beta
BenchDLL Version: 2.0.139.0

------[ CPU Info ]------

CPU Type           : 2x DualCore , 3000 MHz (18 x 167)
CPU Alias          : Tulsa
CPU Stepping       : A0/A1
Instruction Set    : x86, x86-64, MMX, SSE, SSE2, SSE3
CPUID Manufacturer : GenuineIntel
CPUID CPU Name     : Genuine Intel(R) CPU 3.00GHz
CPUID Revision     : 00000F66h
IA Brand ID        : 00h  (Unknown)
Platform ID        : 28h  (LGA771 MP)

------[ Logical CPU #0 ]------

allcpu: Valid

CPUID 00000000: 00000006-756E6547-6C65746E-49656E69
CPUID 00000001: 00000F66-08040800-0000E5BD-BFEBFBFF
CPUID 00000002: 605B5001-00000000-00000000-007C704A
CPUID 00000003: 00000000-00000000-00000000-00000000
CPUID 00000004: 04004121-01C0003F-0000001F-00000000
CPUID 00000005: 00000040-00000040-00000000-00000000
CPUID 00000006: 00000000-00000000-00000001-00000000
CPUID 80000000: 80000008-00000000-00000000-00000000
CPUID 80000001: 00000000-00000000-00000001-20100000
CPUID 80000002: 20202020-20202020-20202020-20202020
CPUID 80000003: 47202020-69756E65-4920656E-6C65746E
CPUID 80000004: 20295228-20555043-30302E33-007A4847
CPUID 80000005: 00000000-00000000-00000000-00000000
CPUID 80000006: 00000000-00000000-04006040-00000000
CPUID 80000007: 00000000-00000000-00000000-00000000
CPUID 80000008: 00003028-00000000-00000000-00000000

------[ Logical CPU #1 ]------

allcpu: Valid

CPUID 00000000: 00000006-756E6547-6C65746E-49656E69
CPUID 00000001: 00000F66-0E040800-0000E5BD-BFEBFBFF
CPUID 00000002: 605B5001-00000000-00000000-007C704A
CPUID 00000003: 00000000-00000000-00000000-00000000
CPUID 00000004: 04004121-01C0003F-0000001F-00000000
CPUID 00000005: 00000040-00000040-00000000-00000000
CPUID 00000006: 00000000-00000000-00000001-00000000
CPUID 80000000: 80000008-00000000-00000000-00000000
CPUID 80000001: 00000000-00000000-00000001-20100000
CPUID 80000002: 20202020-20202020-20202020-20202020
CPUID 80000003: 47202020-69756E65-4920656E-6C65746E
CPUID 80000004: 20295228-20555043-30302E33-007A4847
CPUID 80000005: 00000000-00000000-00000000-00000000
CPUID 80000006: 00000000-00000000-04006040-00000000
CPUID 80000007: 00000000-00000000-00000000-00000000
CPUID 80000008: 00003028-00000000-00000000-00000000

------[ Logical CPU #2 ]------

allcpu: Valid

CPUID 00000000: 00000006-756E6547-6C65746E-49656E69
CPUID 00000001: 00000F66-0A040800-0000E5BD-BFEBFBFF
CPUID 00000002: 605B5001-00000000-00000000-007C704A
CPUID 00000003: 00000000-00000000-00000000-00000000
CPUID 00000004: 04004121-01C0003F-0000001F-00000000
CPUID 00000005: 00000040-00000040-00000000-00000000
CPUID 00000006: 00000000-00000000-00000001-00000000
CPUID 80000000: 80000008-00000000-00000000-00000000
CPUID 80000001: 00000000-00000000-00000001-20100000
CPUID 80000002: 20202020-20202020-20202020-20202020
CPUID 80000003: 47202020-69756E65-4920656E-6C65746E
CPUID 80000004: 20295228-20555043-30302E33-007A4847
CPUID 80000005: 00000000-00000000-00000000-00000000
CPUID 80000006: 00000000-00000000-04006040-00000000
CPUID 80000007: 00000000-00000000-00000000-00000000
CPUID 80000008: 00003028-00000000-00000000-00000000

------[ Logical CPU #3 ]------

allcpu: Valid

CPUID 00000000: 00000006-756E6547-6C65746E-49656E69
CPUID 00000001: 00000F66-0C040800-0000E5BD-BFEBFBFF
CPUID 00000002: 605B5001-00000000-00000000-007C704A
CPUID 00000003: 00000000-00000000-00000000-00000000
CPUID 00000004: 04004121-01C0003F-0000001F-00000000
CPUID 00000005: 00000040-00000040-00000000-00000000
CPUID 00000006: 00000000-00000000-00000001-00000000
CPUID 80000000: 80000008-00000000-00000000-00000000
CPUID 80000001: 00000000-00000000-00000001-20100000
CPUID 80000002: 20202020-20202020-20202020-20202020
CPUID 80000003: 47202020-69756E65-4920656E-6C65746E
CPUID 80000004: 20295228-20555043-30302E33-007A4847
CPUID 80000005: 00000000-00000000-00000000-00000000
CPUID 80000006: 00000000-00000000-04006040-00000000
CPUID 80000007: 00000000-00000000-00000000-00000000
CPUID 80000008: 00003028-00000000-00000000-00000000

------[ Logical CPU #4 ]------

allcpu: Valid, Virtual

CPUID 00000000: 00000006-756E6547-6C65746E-49656E69
CPUID 00000001: 00000F66-09040800-0000E5BD-BFEBFBFF
CPUID 00000002: 605B5001-00000000-00000000-007C704A
CPUID 00000003: 00000000-00000000-00000000-00000000
CPUID 00000004: 04004121-01C0003F-0000001F-00000000
CPUID 00000005: 00000040-00000040-00000000-00000000
CPUID 00000006: 00000000-00000000-00000001-00000000
CPUID 80000000: 80000008-00000000-00000000-00000000
CPUID 80000001: 00000000-00000000-00000001-20100000
CPUID 80000002: 20202020-20202020-20202020-20202020
CPUID 80000003: 47202020-69756E65-4920656E-6C65746E
CPUID 80000004: 20295228-20555043-30302E33-007A4847
CPUID 80000005: 00000000-00000000-00000000-00000000
CPUID 80000006: 00000000-00000000-04006040-00000000
CPUID 80000007: 00000000-00000000-00000000-00000000
CPUID 80000008: 00003028-00000000-00000000-00000000

------[ Logical CPU #5 ]------

allcpu: Valid, Virtual

CPUID 00000000: 00000006-756E6547-6C65746E-49656E69
CPUID 00000001: 00000F66-0F040800-0000E5BD-BFEBFBFF
CPUID 00000002: 605B5001-00000000-00000000-007C704A
CPUID 00000003: 00000000-00000000-00000000-00000000
CPUID 00000004: 04004121-01C0003F-0000001F-00000000
CPUID 00000005: 00000040-00000040-00000000-00000000
CPUID 00000006: 00000000-00000000-00000001-00000000
CPUID 80000000: 80000008-00000000-00000000-00000000
CPUID 80000001: 00000000-00000000-00000001-20100000
CPUID 80000002: 20202020-20202020-20202020-20202020
CPUID 80000003: 47202020-69756E65-4920656E-6C65746E
CPUID 80000004: 20295228-20555043-30302E33-007A4847
CPUID 80000005: 00000000-00000000-00000000-00000000
CPUID 80000006: 00000000-00000000-04006040-00000000
CPUID 80000007: 00000000-00000000-00000000-00000000
CPUID 80000008: 00003028-00000000-00000000-00000000

------[ Logical CPU #6 ]------

allcpu: Valid, Virtual

CPUID 00000000: 00000006-756E6547-6C65746E-49656E69
CPUID 00000001: 00000F66-0B040800-0000E5BD-BFEBFBFF
CPUID 00000002: 605B5001-00000000-00000000-007C704A
CPUID 00000003: 00000000-00000000-00000000-00000000
CPUID 00000004: 04004121-01C0003F-0000001F-00000000
CPUID 00000005: 00000040-00000040-00000000-00000000
CPUID 00000006: 00000000-00000000-00000001-00000000
CPUID 80000000: 80000008-00000000-00000000-00000000
CPUID 80000001: 00000000-00000000-00000001-20100000
CPUID 80000002: 20202020-20202020-20202020-20202020
CPUID 80000003: 47202020-69756E65-4920656E-6C65746E
CPUID 80000004: 20295228-20555043-30302E33-007A4847
CPUID 80000005: 00000000-00000000-00000000-00000000
CPUID 80000006: 00000000-00000000-04006040-00000000
CPUID 80000007: 00000000-00000000-00000000-00000000
CPUID 80000008: 00003028-00000000-00000000-00000000

------[ Logical CPU #7 ]------

allcpu: Valid, Virtual

CPUID 00000000: 00000006-756E6547-6C65746E-49656E69
CPUID 00000001: 00000F66-0D040800-0000E5BD-BFEBFBFF
CPUID 00000002: 605B5001-00000000-00000000-007C704A
CPUID 00000003: 00000000-00000000-00000000-00000000
CPUID 00000004: 04004121-01C0003F-0000001F-00000000
CPUID 00000005: 00000040-00000040-00000000-00000000
CPUID 00000006: 00000000-00000000-00000001-00000000
CPUID 80000000: 80000008-00000000-00000000-00000000
CPUID 80000001: 00000000-00000000-00000001-20100000
CPUID 80000002: 20202020-20202020-20202020-20202020
CPUID 80000003: 47202020-69756E65-4920656E-6C65746E
CPUID 80000004: 20295228-20555043-30302E33-007A4847
CPUID 80000005: 00000000-00000000-00000000-00000000
CPUID 80000006: 00000000-00000000-04006040-00000000
CPUID 80000007: 00000000-00000000-00000000-00000000
CPUID 80000008: 00003028-00000000-00000000-00000000

------[ MSR Registers ]------

MSR 00000017: 0004-0000-0000-0000
MSR 0000002A: 0000-0000-0000-0020
MSR 0000002C: 0000-0000-1203-0412
MSR 0000008B: 0000-0000-0000-0000
MSR 00000198: 0000-1226-0000-1226
MSR 00000199: 0000-0000-0000-1226
MSR 0000019A: 0000-0000-0000-0000
MSR 0000019B: 0000-0000-0000-0000
MSR 0000019C: 0000-0000-0000-0000
MSR 0000019D: 0000-0000-0000-0E1E
MSR 000001A0: 0000-0000-22AD-2281

PerformanceFrequency = 2992550000
