------[ Logical CPU #0 ]------

allcpu: Package 0 / Core 0 / Thread 0: Valid

CPUID 00000000: 0000000A-756E6547-6C65746E-49656E69 [GenuineIntel]
CPUID 00000001: 00020661-00020800-0040E3BD-BFE9FBFF
CPUID 00000002: 4FBA5901-0E3080C0-00000000-00000000
CPUID 00000003: 00000000-00000000-00000000-00000000
CPUID 00000004: 00004121-0140003F-0000003F-00000001 [SL 00] [L1D: 24 KB]
CPUID 00000004: 00004122-01C0003F-0000003F-00000001 [SL 01] [L1I: 32 KB]
CPUID 00000004: 00004143-01C0003F-000003FF-00000001 [SL 02] [L2U: 512 KB]
CPUID 00000005: 00000040-00000040-00000003-03020220
CPUID 00000006: 00000001-00000002-00000001-00000000
CPUID 00000007: 00000000-00000000-00000000-00000000
CPUID 00000008: 00000000-00000000-00000000-00000000
CPUID 00000009: 00000000-00000000-00000000-00000000
CPUID 0000000A: 07280203-00000000-00000000-00000503
CPUID 80000000: 80000008-00000000-00000000-00000000
CPUID 80000001: 00000000-00000000-00000001-20100000
CPUID 80000002: 20202020-20202020-746E4920-52286C65 [         Intel(R]
CPUID 80000003: 74412029-54286D6F-4320294D-45205550 [) Atom(TM) CPU E]
CPUID 80000004: 20303836-20402020-30362E31-007A4847 [680   @ 1.60GHz]
CPUID 80000005: 00000000-00000000-00000000-00000000 [L1D: 0 KB / L1I: 0 KB]
CPUID 80000006: 00000000-00000000-02006040-00000000 [L2: 512 KB] / L3: 0 KB]
CPUID 80000007: 00000000-00000000-00000000-00000000
CPUID 80000008: 00003020-00000000-00000000-00000000

L1    Data Cache:    24 KB,  6-way Associative, 64-byte Line
L1  Instr. Cache:    32 KB,  8-way Associative, 64-byte Line
L2 Unified Cache:   512 KB,  8-way Associative, 64-byte Line

------[ Logical CPU #1 ]------

allcpu: Package 0 / Core 0 / Thread 1: Valid, Virtual

CPUID 00000000: 0000000A-756E6547-6C65746E-49656E69 [GenuineIntel]
CPUID 00000001: 00020661-01020800-0040E3BD-BFE9FBFF
CPUID 00000002: 4FBA5901-0E3080C0-00000000-00000000
CPUID 00000003: 00000000-00000000-00000000-00000000
CPUID 00000004: 00004121-0140003F-0000003F-00000001 [SL 00] [L1D: 24 KB]
CPUID 00000004: 00004122-01C0003F-0000003F-00000001 [SL 01] [L1I: 32 KB]
CPUID 00000004: 00004143-01C0003F-000003FF-00000001 [SL 02] [L2U: 512 KB]
CPUID 00000005: 00000040-00000040-00000003-03020220
CPUID 00000006: 00000001-00000002-00000001-00000000
CPUID 00000007: 00000000-00000000-00000000-00000000
CPUID 00000008: 00000000-00000000-00000000-00000000
CPUID 00000009: 00000000-00000000-00000000-00000000
CPUID 0000000A: 07280203-00000000-00000000-00000503
CPUID 80000000: 80000008-00000000-00000000-00000000
CPUID 80000001: 00000000-00000000-00000001-20100000
CPUID 80000002: 20202020-20202020-746E4920-52286C65 [         Intel(R]
CPUID 80000003: 74412029-54286D6F-4320294D-45205550 [) Atom(TM) CPU E]
CPUID 80000004: 20303836-20402020-30362E31-007A4847 [680   @ 1.60GHz]
CPUID 80000005: 00000000-00000000-00000000-00000000 [L1D: 0 KB / L1I: 0 KB]
CPUID 80000006: 00000000-00000000-02006040-00000000 [L2: 512 KB] / L3: 0 KB]
CPUID 80000007: 00000000-00000000-00000000-00000000
CPUID 80000008: 00003020-00000000-00000000-00000000

L1    Data Cache:    24 KB,  6-way Associative, 64-byte Line
L1  Instr. Cache:    32 KB,  8-way Associative, 64-byte Line
L2 Unified Cache:   512 KB,  8-way Associative, 64-byte Line

------[ All CPUs ]------

CPU   0: APICID    0 / Package 0 / Core   0 / Thread 0: Valid
CPU   1: APICID    1 / Package 0 / Core   0 / Thread 1: Valid, Virtual

------[ MSR Registers ]------

MSR 00000017: 0004-0000-9015-D01D [PlatID = 1]
MSR 0000001B: 0000-0000-FEE0-0900
MSR 0000002A: 0000-0000-4348-0000
MSR 0000008B: 0000-0105-0000-0000
MSR 000000CD: 0000-0000-0000-0005
MSR 000000CE: 1D16-1000-5656-0000
MSR 000000E7: 0000-0000-000D-2670 [S200]
MSR 000000E7: 0000-0000-002F-A2C0 [S200]
MSR 000000E7: 0000-0000-01E5-D450
MSR 000000E8: 0000-0000-018B-71D8 [S200]
MSR 000000E8: 0000-0000-0012-E2D2 [S200]
MSR 000000E8: 0000-0000-0002-0AD2
MSR 000000EE: 0000-0000-0238-0002
MSR 0000011E: 0000-0000-3000-011F
MSR 00000198: 0616-101D-0600-061A [S200]
MSR 00000198: 0616-101D-0600-0D1A [S200]
MSR 00000198: 0616-101D-0600-0D1A
MSR 00000199: 0000-0000-0000-0D18
MSR 0000019A: 0000-0000-0000-0002
MSR 0000019B: 0000-0000-00B2-A410
MSR 0000019C: 0000-0000-882B-0100 [S200]
MSR 0000019C: 0000-0000-882B-0100 [S200]
MSR 0000019C: 0000-0000-882B-0100
MSR 0000019D: 0000-0000-0000-0616
MSR 000001A0: 0000-0003-6497-2488
MSR 00000480: 005A-0400-0000-0009
MSR 00000481: 0000-003F-0000-0016
MSR 00000482: 77F9-FFFE-0401-E172
MSR 00000483: 0003-EFFF-0003-6DFF
MSR 00000484: 0000-1FFF-0000-11FF
MSR 00000485: 0000-0000-0004-03C0
MSR 00000486: 0000-0000-8000-0021
MSR 00000487: 0000-0000-FFFF-FFFF
MSR 00000488: 0000-0000-0000-2000
MSR 00000489: 0000-0000-0000-27FF
MSR 0000048A: 0000-0000-0000-002C
