------[ Logical CPU #0 ]------

allcpu: Package 0 / Core 0 / Thread 0: Valid

CPUID 00000000: 00000016-756E6547-6C65746E-49656E69 [GenuineIntel]
CPUID 00000001: 000506E3-00100800-4FFAEBBF-BFEBFBFF
CPUID 00000002: 76036301-00F0B6FF-00000000-00C30000
CPUID 00000003: 00000000-00000000-00000000-00000000
CPUID 00000004: 1C004121-01C0003F-0000003F-00000000 [SL 00]
CPUID 00000004: 1C004122-01C0003F-0000003F-00000000 [SL 01]
CPUID 00000004: 1C004143-00C0003F-000003FF-00000000 [SL 02]
CPUID 00000004: 1C03C163-02C0003F-00000FFF-00000006 [SL 03]
CPUID 00000005: 00000040-00000040-00000003-00142120
CPUID 00000006: 000007F5-00000002-00000001-00000000
CPUID 00000007: 00000000-02942603-00000000-00000000
CPUID 00000008: 00000000-00000000-00000000-00000000
CPUID 00000009: 00000000-00000000-00000000-00000000
CPUID 0000000A: 07300804-00000000-00000000-00000603
CPUID 0000000B: 00000001-00000001-00000100-00000000 [SL 00]
CPUID 0000000B: 00000004-00000002-00000201-00000000 [SL 01]
CPUID 0000000C: 00000000-00000000-00000000-00000000
CPUID 0000000D: 00000003-00000240-00000240-00000000 [SL 00]
CPUID 0000000D: 0000000F-00000240-00000100-00000000 [SL 01]
CPUID 0000000E: 00000000-00000000-00000000-00000000
CPUID 0000000F: 00000000-00000000-00000000-00000000 [SL 00]
CPUID 0000000F: 00000000-00000000-00000000-00000000 [SL 01]
CPUID 00000010: 00000000-00000000-00000000-00000000 [SL 00]
CPUID 00000010: 00000000-00000000-00000000-00000000 [SL 01]
CPUID 00000011: 00000000-00000000-00000000-00000000
CPUID 00000012: 00000000-00000000-00000000-00000000 [SL 00]
CPUID 00000012: 00000000-00000000-00000000-00000000 [SL 01]
CPUID 00000013: 00000000-00000000-00000000-00000000
CPUID 00000014: 00000001-0000000F-00000007-00000000 [SL 00]
CPUID 00000014: 02490002-003F3FFF-00000000-00000000 [SL 01]
CPUID 00000015: 00000002-00000114-00000000-00000000 [138.00x]
CPUID 00000016: 00000CE4-00000CE4-00000064-00000000
CPUID 80000000: 80000008-00000000-00000000-00000000
CPUID 80000001: 00000000-00000000-00000121-2C100000
CPUID 80000002: 65746E49-2952286C-6E655020-6D756974 [Intel(R) Pentium]
CPUID 80000003: 20295228-20555043-30343447-20402030 [(R) CPU G4400 @ ]
CPUID 80000004: 30332E33-007A4847-00000000-00000000 [3.30GHz]
CPUID 80000005: 00000000-00000000-00000000-00000000
CPUID 80000006: 00000000-00000000-01006040-00000000
CPUID 80000007: 00000000-00000000-00000000-00000100
CPUID 80000008: 00003027-00000000-00000000-00000000

L1    Data Cache:    32 KB,  8-way Associative, 64-byte Line
L1  Instr. Cache:    32 KB,  8-way Associative, 64-byte Line
L2 Unified Cache:   256 KB,  4-way Associative, 64-byte Line
L3 Unified Cache:     3 MB, 12-way Associative, 64-byte Line

------[ Logical CPU #1 ]------

allcpu: Package 0 / Core 1 / Thread 0: Valid

CPUID 00000000: 00000016-756E6547-6C65746E-49656E69 [GenuineIntel]
CPUID 00000001: 000506E3-02100800-4FFAEBBF-BFEBFBFF
CPUID 00000002: 76036301-00F0B6FF-00000000-00C30000
CPUID 00000003: 00000000-00000000-00000000-00000000
CPUID 00000004: 1C004121-01C0003F-0000003F-00000000 [SL 00]
CPUID 00000004: 1C004122-01C0003F-0000003F-00000000 [SL 01]
CPUID 00000004: 1C004143-00C0003F-000003FF-00000000 [SL 02]
CPUID 00000004: 1C03C163-02C0003F-00000FFF-00000006 [SL 03]
CPUID 00000005: 00000040-00000040-00000003-00142120
CPUID 00000006: 000007F5-00000002-00000001-00000000
CPUID 00000007: 00000000-02942603-00000000-00000000
CPUID 00000008: 00000000-00000000-00000000-00000000
CPUID 00000009: 00000000-00000000-00000000-00000000
CPUID 0000000A: 07300804-00000000-00000000-00000603
CPUID 0000000B: 00000001-00000001-00000100-00000002 [SL 00]
CPUID 0000000B: 00000004-00000002-00000201-00000002 [SL 01]
CPUID 0000000C: 00000000-00000000-00000000-00000000
CPUID 0000000D: 00000003-00000240-00000240-00000000 [SL 00]
CPUID 0000000D: 0000000F-00000240-00000100-00000000 [SL 01]
CPUID 0000000E: 00000000-00000000-00000000-00000000
CPUID 0000000F: 00000000-00000000-00000000-00000000 [SL 00]
CPUID 0000000F: 00000000-00000000-00000000-00000000 [SL 01]
CPUID 00000010: 00000000-00000000-00000000-00000000 [SL 00]
CPUID 00000010: 00000000-00000000-00000000-00000000 [SL 01]
CPUID 00000011: 00000000-00000000-00000000-00000000
CPUID 00000012: 00000000-00000000-00000000-00000000 [SL 00]
CPUID 00000012: 00000000-00000000-00000000-00000000 [SL 01]
CPUID 00000013: 00000000-00000000-00000000-00000000
CPUID 00000014: 00000001-0000000F-00000007-00000000 [SL 00]
CPUID 00000014: 02490002-003F3FFF-00000000-00000000 [SL 01]
CPUID 00000015: 00000002-00000114-00000000-00000000 [138.00x]
CPUID 00000016: 00000CE4-00000CE4-00000064-00000000
CPUID 80000000: 80000008-00000000-00000000-00000000
CPUID 80000001: 00000000-00000000-00000121-2C100000
CPUID 80000002: 65746E49-2952286C-6E655020-6D756974 [Intel(R) Pentium]
CPUID 80000003: 20295228-20555043-30343447-20402030 [(R) CPU G4400 @ ]
CPUID 80000004: 30332E33-007A4847-00000000-00000000 [3.30GHz]
CPUID 80000005: 00000000-00000000-00000000-00000000
CPUID 80000006: 00000000-00000000-01006040-00000000
CPUID 80000007: 00000000-00000000-00000000-00000100
CPUID 80000008: 00003027-00000000-00000000-00000000

L1    Data Cache:    32 KB,  8-way Associative, 64-byte Line
L1  Instr. Cache:    32 KB,  8-way Associative, 64-byte Line
L2 Unified Cache:   256 KB,  4-way Associative, 64-byte Line
L3 Unified Cache:     3 MB, 12-way Associative, 64-byte Line

------[ All CPUs ]------

CPU   0: APICID   0 / Package 0 / Core  0 / Thread 0: Valid
CPU   1: APICID   2 / Package 0 / Core  1 / Thread 0: Valid

------[ MSR Registers ]------

MSR 00000017: 0004-0000-0000-0000 [PlatID = 1]
MSR 0000001B: 0000-0000-FEE0-0900
MSR 00000035: 0000-0000-0002-0002
MSR 0000008B: 0000-0039-0000-0000
MSR 000000CE: 0008-0838-F101-2100 [eD = 0]
MSR 000000E7: 0000-0000-0003-F7CC [S200]
MSR 000000E7: 0000-0000-0000-DC74 [S200]
MSR 000000E7: 0000-0000-0000-D504
MSR 000000E8: 0000-0000-0001-0F96 [S200]
MSR 000000E8: 0000-0000-0001-9974 [S200]
MSR 000000E8: 0000-0000-0000-EE40
MSR 00000194: 0000-0000-0001-0000
MSR 00000198: 0000-2215-0000-2100 [S200]
MSR 00000198: 0000-222E-0000-2100 [S200]
MSR 00000198: 0000-2236-0000-2100
MSR 00000199: 0000-0000-0000-2100
MSR 0000019A: 0000-0000-0000-0000
MSR 0000019B: 0000-0000-0000-0000
MSR 0000019C: 0000-0000-884E-0000 [S200]
MSR 0000019C: 0000-0000-884E-0000 [S200]
MSR 0000019C: 0000-0000-884E-0000
MSR 0000019D: 0000-0000-0000-0000
MSR 000001A0: 0000-0000-0085-0089
MSR 000001A2: 0000-0000-0064-1000
MSR 000001A4: 0000-0000-0000-0000
MSR 000001AA: 0000-0000-0000-18C0
MSR 000001AC: < FAILED >
MSR 000001AD: 0000-0000-2121-2121
MSR 000001B0: < FAILED >
MSR 000001B1: 0000-0000-884C-0000
MSR 000001B2: 0000-0000-0000-0000
MSR 000001FC: 0000-0000-0038-005F
MSR 00000300: < FAILED >
MSR 0000030A: 0000-0000-01A6-91C1 [S200]
MSR 0000030A: 0000-0000-01A6-91C1 [S200]
MSR 0000030A: 0000-0000-01A6-91C1
MSR 0000030B: 0000-0000-01A8-1AF6 [S200]
MSR 0000030B: 0000-0000-01A8-1AF6 [S200]
MSR 0000030B: 0000-0000-01A8-1AF6
MSR 00000480: 00DA-0400-0000-0004
MSR 00000481: 0000-007F-0000-0016
MSR 00000482: FFF9-FFFE-0401-E172
MSR 00000483: 017F-FFFF-0003-6DFF
MSR 00000484: 0002-FFFF-0000-11FF
MSR 00000485: 0000-0000-7004-C1E7
MSR 00000486: 0000-0000-8000-0021
MSR 00000487: 0000-0000-FFFF-FFFF
MSR 00000488: 0000-0000-0000-2000
MSR 00000489: 0000-0000-0027-27FF
MSR 0000048A: 0000-0000-0000-002E
MSR 0000048B: 001F-1CFF-0000-0000
MSR 0000048C: 0000-0F01-0633-4141
MSR 0000048D: 0000-007F-0000-0016
MSR 0000048E: FFF9-FFFE-0400-6172
MSR 0000048F: 017F-FFFF-0003-6DFB
MSR 00000490: 0002-FFFF-0000-11FB
MSR 00000601: 0000-0000-0000-0000
MSR 00000602: < FAILED >
MSR 00000603: 0036-0000-0036-3636
MSR 00000604: < FAILED >
MSR 00000606: 0000-0000-000A-0E03
MSR 0000060A: 0000-0000-0000-884E
MSR 0000060B: 0000-0000-0000-8876
MSR 0000060C: 0000-0000-0000-8894
MSR 0000060D: 0000-00ED-42DE-F735
MSR 00000610: 0042-FFD0-001A-EA82
MSR 00000611: 0000-0000-0515-77F6 [S200]
MSR 00000611: 0000-0000-0515-8FA2 [S200]
MSR 00000611: 0000-0000-0515-A6CF
MSR 00000613: 0000-0000-0000-0000
MSR 00000614: 0000-0000-0000-0208
MSR 00000618: 0014-8FFA-0014-8FFA
MSR 00000619: 0000-0000-00C5-DB72 [S200]
MSR 00000619: 0000-0000-00C5-E46D [S200]
MSR 00000619: 0000-0000-00C5-ED73
MSR 0000061B: 0000-0000-0000-0000
MSR 0000061C: < FAILED >
MSR 0000061E: < FAILED >
MSR 00000620: 0000-0000-0000-0821
MSR 00000621: 0000-0000-0000-0021
MSR 00000638: 0000-0000-0000-0000
MSR 00000639: 0000-0000-03F8-D863 [S200]
MSR 00000639: 0000-0000-03F8-DB9B [S200]
MSR 00000639: 0000-0000-03F8-DEE5
MSR 0000063A: 0000-0000-0000-0010
MSR 0000063B: < FAILED >
MSR 00000640: 0000-0000-0000-0000
MSR 00000641: 0000-0000-0000-04C9 [S200]
MSR 00000641: 0000-0000-0000-04C9 [S200]
MSR 00000641: 0000-0000-0000-04C9
MSR 00000642: 0000-0000-0000-0010
MSR 00000648: 0000-0000-0000-0021
MSR 00000649: 0000-0000-0000-0000
MSR 0000064A: 0000-0000-0000-0000
MSR 0000064B: 0000-0000-8000-0000
MSR 0000064C: 0000-0000-0000-0000
MSR 00000690: 0000-0000-0000-0000
MSR 000006B0: 0000-0000-0000-0000
MSR 000006B1: 0000-0000-0000-0000
