------[ Versions ]------

Program Version : EVEREST v4.60.1628 Beta
BenchDLL Version: 2.4.257.0

------[ CPU Info ]------

CPU Type           : 2x Intel Pentium III-S, 1266 MHz (9.5 x 133)
CPU Alias          : Tualatin, A80530
CPU Platform       : Socket 370
CPU Stepping       : tA1
Instruction Set    : x86, MMX, SSE
CPUID Manufacturer : GenuineIntel
CPUID CPU Name     : Intel(R) Pentium(R) III CPU family 1266MHz
CPUID Revision     : 000006B1h
IA Brand ID        : 04h  (Intel Pentium III-S)
Platform ID        : 04h  (Socket 370)

------[ Logical CPU #0 ]------

allcpu: Valid

CPUID 00000000: 00000002-756E6547-6C65746E-49656E69
CPUID 00000001: 000006B1-00000004-00000000-0383FBFF
CPUID 00000002: 03020101-00000000-00000000-0C040883
CPUID 80000000: 80000004-00000000-00000000-00000000
CPUID 80000001: 00000000-00000000-00000000-00000000
CPUID 80000002: 65746E49-2952286C-6E655020-6D756974
CPUID 80000003: 20295228-20494949-20555043-696D6166
CPUID 80000004: 2020796C-20202020-36363231-007A484D

------[ Logical CPU #1 ]------

allcpu: Valid

CPUID 00000000: 00000002-756E6547-6C65746E-49656E69
CPUID 00000001: 000006B1-00000004-00000000-0383FBFF
CPUID 00000002: 03020101-00000000-00000000-0C040883
CPUID 80000000: 80000004-00000000-00000000-00000000
CPUID 80000001: 00000000-00000000-00000000-00000000
CPUID 80000002: 65746E49-2952286C-6E655020-6D756974
CPUID 80000003: 20295228-20494949-20555043-696D6166
CPUID 80000004: 2020796C-20202020-36363231-007A484D

------[ MSR Registers ]------

MSR 00000017: 9492-0000-0000-0000 [PlatID = 4]
MSR 0000001B: 0000-0000-FEE0-0900
MSR 0000002A: 0000-0000-CD34-0000
MSR 0000008B: 0000-001C-0000-0000
MSR 0000011E: 0000-0000-0074-47E1

PerformanceFrequency = 1263100000

Tjmax Temperature = 0 Celsius
