------[ Versions ]------

Program Version : EVEREST v4.60.1629 Beta
BenchDLL Version: 2.4.257.0

------[ CPU Info ]------

CPU Type           : 2x Intel Xeon, 3066 MHz (23 x 133)
CPU Alias          : Gallatin DP
CPU Platform       : Socket 604 DP
CPU Stepping       : M0
Instruction Set    : x86, MMX, SSE, SSE2
CPUID Manufacturer : GenuineIntel
CPUID CPU Name     : Intel(R) Xeon(TM) CPU 3.06GHz
CPUID Revision     : 00000F25h
IA Brand ID        : 0Bh  (Intel Xeon)
Platform ID        : 24h  (Socket 604 DP)

------[ Logical CPU #0 ]------

allcpu: Valid

CPUID 00000000: 00000002-756E6547-6C65746E-49656E69
CPUID 00000001: 00000F25-0002080B-00004400-BFEBFBFF
CPUID 00000002: 665B5001-00000000-00000000-007B7023
CPUID 80000000: 80000004-00000000-00000000-00000000
CPUID 80000001: 00000000-00000000-00000000-00000000
CPUID 80000002: 20202020-20202020-20202020-20202020
CPUID 80000003: 6E492020-286C6574-58202952-286E6F65
CPUID 80000004: 20294D54-20555043-36302E33-007A4847

------[ Logical CPU #1 ]------

allcpu: Valid

CPUID 00000000: 00000002-756E6547-6C65746E-49656E69
CPUID 00000001: 00000F25-0602080B-00004400-BFEBFBFF
CPUID 00000002: 665B5001-00000000-00000000-007B7023
CPUID 80000000: 80000004-00000000-00000000-00000000
CPUID 80000001: 00000000-00000000-00000000-00000000
CPUID 80000002: 20202020-20202020-20202020-20202020
CPUID 80000003: 6E492020-286C6574-58202952-286E6F65
CPUID 80000004: 20294D54-20555043-36302E33-007A4847

------[ Logical CPU #2 ]------

allcpu: Valid, Virtual

CPUID 00000000: 00000002-756E6547-6C65746E-49656E69
CPUID 00000001: 00000F25-0102080B-00004400-BFEBFBFF
CPUID 00000002: 665B5001-00000000-00000000-007B7023
CPUID 80000000: 80000004-00000000-00000000-00000000
CPUID 80000001: 00000000-00000000-00000000-00000000
CPUID 80000002: 20202020-20202020-20202020-20202020
CPUID 80000003: 6E492020-286C6574-58202952-286E6F65
CPUID 80000004: 20294D54-20555043-36302E33-007A4847

------[ Logical CPU #3 ]------

allcpu: Valid, Virtual

CPUID 00000000: 00000002-756E6547-6C65746E-49656E69
CPUID 00000001: 00000F25-0702080B-00004400-BFEBFBFF
CPUID 00000002: 665B5001-00000000-00000000-007B7023
CPUID 80000000: 80000004-00000000-00000000-00000000
CPUID 80000001: 00000000-00000000-00000000-00000000
CPUID 80000002: 20202020-20202020-20202020-20202020
CPUID 80000003: 6E492020-286C6574-58202952-286E6F65
CPUID 80000004: 20294D54-20555043-36302E33-007A4847

------[ MSR Registers ]------

MSR 00000017: 0002-0000-0000-0000 [PlatID = 0]
MSR 0000001B: 0000-0000-FEE0-0900
MSR 0000002A: 0000-0000-0000-0080
MSR 0000002C: 0000-0000-1701-0B17
MSR 0000008B: 0000-0029-0000-0000
MSR 0000019A: 0000-0000-0000-0008
MSR 0000019B: 0000-0000-0000-0000
MSR 0000019C: 0000-0000-0000-0000
MSR 000001A0: 0000-0000-0000-0089

PerformanceFrequency = 3073710000

Tjmax Temperature = 0 Celsius
