------[ Versions ]------

Program Version : AIDA64 Engineer v5.95.4550 Beta
BenchDLL Version: 4.3.770-x64
Windows Version : Microsoft Windows 10 Pro 10.0.14393.0 (64-bit)

------[ CPU Info ]------

CPU Type          : QuadCore Intel Celeron J4105, 2400 MHz (24 x 100)
CPU Alias         : Gemini Lake-D
CPU Platform      : FCBGA1296
CPU Stepping      : B0
Instruction Set   : x86, x86-64, MMX, SSE, SSE2, SSE3, SSSE3, SSE4.1, SSE4.2, AES, SHA
CPUID Manufacturer: GenuineIntel
CPUID CPU Name    : Intel(R) Celeron(R) J4105 CPU @ 1.50GHz
CPUID Revision    : 000706A1h
IA Brand ID       : 00h  (Unknown)
Platform ID       : 3Ch  (FCBGA1296)
HTT / CMP Units   : 0 / 4
Max. NUMA Node    : 0

Tjmax Temperature          : 105 Celsius
HTC Temperature Limit      : 0 Celsius
CPU TDP                    : 10 W
CPU TDC                    : 25 A
CPU Max Power Limit        : Unlimited Power / Unlimited Time
CPU Power Limit 1 (Long)   : 10 W / 8.00 sec  (Unlocked)
CPU Power Limit 2 (Short)  : 25 W / Unlimited Time  (Unlocked)
Max Turbo Boost Multipliers: 1C: 25x, 2C: 24x, 3C: 24x, 4C: 24x

------[ Motherboard Info ]------

Motherboard ID      : <DMI>
Motherboard Model   : ASRock J4105-ITX
Motherboard Chipset : Intel Gemini Lake

DMI MB Manufacturer : ASRock
DMI MB Product      : J4105-ITX
DMI MB Version      : 
DMI MB Serial       : M80-B1004200178
DMI SYS Manufacturer: To Be Filled By O.E.M.
DMI SYS Product     : To Be Filled By O.E.M.
DMI SYS Version     : To Be Filled By O.E.M.
DMI SYS Serial      : To Be Filled By O.E.M.
DMI BIOS Version    : P1.00


------[ Logical CPU #0 ]------

allcpu: Package 0 / Core 0 / Thread 0: Valid

CPUID 00000000: 00000018-756E6547-6C65746E-49656E69 [GenuineIntel]
CPUID 00000001: 000706A1-00400800-4FF8EBBF-BFEBFBFF
CPUID 00000002: 00FEFF01-00000000-00000000-00000000
CPUID 00000003: 00000000-00000000-00000000-00000000
CPUID 00000004: 7C000121-0140003F-0000003F-00000001 [SL 00]
CPUID 00000004: 7C000122-01C0003F-0000003F-00000001 [SL 01]
CPUID 00000004: 7C01C143-03C0003F-00000FFF-00000001 [SL 02]
CPUID 00000005: 00000040-00000040-00000003-11242020
CPUID 00000006: 00000057-00000002-00000001-00000000
CPUID 00000007: 00000000-2294E287-40400004-2C000000
CPUID 00000008: 00000000-00000000-00000000-00000000
CPUID 00000009: 00000000-00000000-00000000-00000000
CPUID 0000000A: 07300404-00000000-00000000-00008603
CPUID 0000000B: 00000001-00000001-00000100-00000000 [SL 00]
CPUID 0000000B: 00000006-00000004-00000201-00000000 [SL 01]
CPUID 0000000C: 00000000-00000000-00000000-00000000
CPUID 0000000D: 0000001B-00000440-00000440-00000000 [SL 00]
CPUID 0000000D: 0000000F-000002C0-00000100-00000000 [SL 01]
CPUID 0000000E: 00000000-00000000-00000000-00000000
CPUID 0000000F: 00000000-00000000-00000000-00000000 [SL 00]
CPUID 0000000F: 00000000-00000000-00000000-00000000 [SL 01]
CPUID 00000010: 00000000-00000004-00000000-00000000 [SL 00]
CPUID 00000010: 00000000-00000000-00000000-00000000 [SL 01]
CPUID 00000011: 00000000-00000000-00000000-00000000
CPUID 00000012: 00000000-00000000-00000000-00000000 [SL 00]
CPUID 00000012: 00000000-00000000-00000000-00000000 [SL 01]
CPUID 00000013: 00000000-00000000-00000000-00000000
CPUID 00000014: 00000001-0000003F-80000007-00000000 [SL 00]
CPUID 00000014: 02490002-003FFFFF-00000000-00000000 [SL 01]
CPUID 00000015: 00000003-000000EA-0124F800-00000000 [78.00x / 19200000]
CPUID 00000016: 00000000-00000000-00000000-00000000 [0 / 0 / 0]
CPUID 00000017: 00000000-00000000-00000000-00000000 [SL 00]
CPUID 00000018: 00000004-00000000-00000000-00000000 [SL 00]
CPUID 00000018: 00000000-00200001-00000001-00000121 [SL 01]
CPUID 00000018: 00000000-00040001-00000080-00000043 [SL 02]
CPUID 00000018: 00000000-00040006-00000008-00000043 [SL 03]
CPUID 00000018: 00000000-00300001-00000001-00000122 [SL 04]
CPUID 80000000: 80000008-00000000-00000000-00000000
CPUID 80000001: 00000000-00000000-00000101-2C100000
CPUID 80000002: 65746E49-2952286C-6C654320-6E6F7265 [Intel(R) Celeron]
CPUID 80000003: 20295228-3031344A-50432035-20402055 [(R) J4105 CPU @ ]
CPUID 80000004: 30352E31-007A4847-00000000-00000000 [1.50GHz]
CPUID 80000005: 00000000-00000000-00000000-00000000
CPUID 80000006: 00000000-00000000-10008040-00000000
CPUID 80000007: 00000000-00000000-00000000-00000100
CPUID 80000008: 00003027-00000000-00000000-00000000

L1    Data Cache:    24 KB,  6-way Associative, 64-byte Line
L1  Instr. Cache:    32 KB,  8-way Associative, 64-byte Line
L2 Unified Cache:     4 MB, 16-way Associative, 64-byte Line

------[ Logical CPU #1 ]------

allcpu: Package 0 / Core 1 / Thread 0: Valid

CPUID 00000000: 00000018-756E6547-6C65746E-49656E69 [GenuineIntel]
CPUID 00000001: 000706A1-02400800-4FF8EBBF-BFEBFBFF
CPUID 00000002: 00FEFF01-00000000-00000000-00000000
CPUID 00000003: 00000000-00000000-00000000-00000000
CPUID 00000004: 7C000121-0140003F-0000003F-00000001 [SL 00]
CPUID 00000004: 7C000122-01C0003F-0000003F-00000001 [SL 01]
CPUID 00000004: 7C01C143-03C0003F-00000FFF-00000001 [SL 02]
CPUID 00000005: 00000040-00000040-00000003-11242020
CPUID 00000006: 00000057-00000002-00000001-00000000
CPUID 00000007: 00000000-2294E287-40400004-2C000000
CPUID 00000008: 00000000-00000000-00000000-00000000
CPUID 00000009: 00000000-00000000-00000000-00000000
CPUID 0000000A: 07300404-00000000-00000000-00008603
CPUID 0000000B: 00000001-00000001-00000100-00000002 [SL 00]
CPUID 0000000B: 00000006-00000004-00000201-00000002 [SL 01]
CPUID 0000000C: 00000000-00000000-00000000-00000000
CPUID 0000000D: 0000001B-00000440-00000440-00000000 [SL 00]
CPUID 0000000D: 0000000F-000002C0-00000100-00000000 [SL 01]
CPUID 0000000E: 00000000-00000000-00000000-00000000
CPUID 0000000F: 00000000-00000000-00000000-00000000 [SL 00]
CPUID 0000000F: 00000000-00000000-00000000-00000000 [SL 01]
CPUID 00000010: 00000000-00000004-00000000-00000000 [SL 00]
CPUID 00000010: 00000000-00000000-00000000-00000000 [SL 01]
CPUID 00000011: 00000000-00000000-00000000-00000000
CPUID 00000012: 00000000-00000000-00000000-00000000 [SL 00]
CPUID 00000012: 00000000-00000000-00000000-00000000 [SL 01]
CPUID 00000013: 00000000-00000000-00000000-00000000
CPUID 00000014: 00000001-0000003F-80000007-00000000 [SL 00]
CPUID 00000014: 02490002-003FFFFF-00000000-00000000 [SL 01]
CPUID 00000015: 00000003-000000EA-0124F800-00000000 [78.00x / 19200000]
CPUID 00000016: 00000000-00000000-00000000-00000000 [0 / 0 / 0]
CPUID 00000017: 00000000-00000000-00000000-00000000 [SL 00]
CPUID 00000018: 00000004-00000000-00000000-00000000 [SL 00]
CPUID 00000018: 00000000-00200001-00000001-00000121 [SL 01]
CPUID 00000018: 00000000-00040001-00000080-00000043 [SL 02]
CPUID 00000018: 00000000-00040006-00000008-00000043 [SL 03]
CPUID 00000018: 00000000-00300001-00000001-00000122 [SL 04]
CPUID 80000000: 80000008-00000000-00000000-00000000
CPUID 80000001: 00000000-00000000-00000101-2C100000
CPUID 80000002: 65746E49-2952286C-6C654320-6E6F7265 [Intel(R) Celeron]
CPUID 80000003: 20295228-3031344A-50432035-20402055 [(R) J4105 CPU @ ]
CPUID 80000004: 30352E31-007A4847-00000000-00000000 [1.50GHz]
CPUID 80000005: 00000000-00000000-00000000-00000000
CPUID 80000006: 00000000-00000000-10008040-00000000
CPUID 80000007: 00000000-00000000-00000000-00000100
CPUID 80000008: 00003027-00000000-00000000-00000000

L1    Data Cache:    24 KB,  6-way Associative, 64-byte Line
L1  Instr. Cache:    32 KB,  8-way Associative, 64-byte Line
L2 Unified Cache:     4 MB, 16-way Associative, 64-byte Line

------[ Logical CPU #2 ]------

allcpu: Package 0 / Core 2 / Thread 0: Valid

CPUID 00000000: 00000018-756E6547-6C65746E-49656E69 [GenuineIntel]
CPUID 00000001: 000706A1-04400800-4FF8EBBF-BFEBFBFF
CPUID 00000002: 00FEFF01-00000000-00000000-00000000
CPUID 00000003: 00000000-00000000-00000000-00000000
CPUID 00000004: 7C000121-0140003F-0000003F-00000001 [SL 00]
CPUID 00000004: 7C000122-01C0003F-0000003F-00000001 [SL 01]
CPUID 00000004: 7C01C143-03C0003F-00000FFF-00000001 [SL 02]
CPUID 00000005: 00000040-00000040-00000003-11242020
CPUID 00000006: 00000057-00000002-00000001-00000000
CPUID 00000007: 00000000-2294E287-40400004-2C000000
CPUID 00000008: 00000000-00000000-00000000-00000000
CPUID 00000009: 00000000-00000000-00000000-00000000
CPUID 0000000A: 07300404-00000000-00000000-00008603
CPUID 0000000B: 00000001-00000001-00000100-00000004 [SL 00]
CPUID 0000000B: 00000006-00000004-00000201-00000004 [SL 01]
CPUID 0000000C: 00000000-00000000-00000000-00000000
CPUID 0000000D: 0000001B-00000440-00000440-00000000 [SL 00]
CPUID 0000000D: 0000000F-000002C0-00000100-00000000 [SL 01]
CPUID 0000000E: 00000000-00000000-00000000-00000000
CPUID 0000000F: 00000000-00000000-00000000-00000000 [SL 00]
CPUID 0000000F: 00000000-00000000-00000000-00000000 [SL 01]
CPUID 00000010: 00000000-00000004-00000000-00000000 [SL 00]
CPUID 00000010: 00000000-00000000-00000000-00000000 [SL 01]
CPUID 00000011: 00000000-00000000-00000000-00000000
CPUID 00000012: 00000000-00000000-00000000-00000000 [SL 00]
CPUID 00000012: 00000000-00000000-00000000-00000000 [SL 01]
CPUID 00000013: 00000000-00000000-00000000-00000000
CPUID 00000014: 00000001-0000003F-80000007-00000000 [SL 00]
CPUID 00000014: 02490002-003FFFFF-00000000-00000000 [SL 01]
CPUID 00000015: 00000003-000000EA-0124F800-00000000 [78.00x / 19200000]
CPUID 00000016: 00000000-00000000-00000000-00000000 [0 / 0 / 0]
CPUID 00000017: 00000000-00000000-00000000-00000000 [SL 00]
CPUID 00000018: 00000004-00000000-00000000-00000000 [SL 00]
CPUID 00000018: 00000000-00200001-00000001-00000121 [SL 01]
CPUID 00000018: 00000000-00040001-00000080-00000043 [SL 02]
CPUID 00000018: 00000000-00040006-00000008-00000043 [SL 03]
CPUID 00000018: 00000000-00300001-00000001-00000122 [SL 04]
CPUID 80000000: 80000008-00000000-00000000-00000000
CPUID 80000001: 00000000-00000000-00000101-2C100000
CPUID 80000002: 65746E49-2952286C-6C654320-6E6F7265 [Intel(R) Celeron]
CPUID 80000003: 20295228-3031344A-50432035-20402055 [(R) J4105 CPU @ ]
CPUID 80000004: 30352E31-007A4847-00000000-00000000 [1.50GHz]
CPUID 80000005: 00000000-00000000-00000000-00000000
CPUID 80000006: 00000000-00000000-10008040-00000000
CPUID 80000007: 00000000-00000000-00000000-00000100
CPUID 80000008: 00003027-00000000-00000000-00000000

L1    Data Cache:    24 KB,  6-way Associative, 64-byte Line
L1  Instr. Cache:    32 KB,  8-way Associative, 64-byte Line
L2 Unified Cache:     4 MB, 16-way Associative, 64-byte Line

------[ Logical CPU #3 ]------

allcpu: Package 0 / Core 3 / Thread 0: Valid

CPUID 00000000: 00000018-756E6547-6C65746E-49656E69 [GenuineIntel]
CPUID 00000001: 000706A1-06400800-4FF8EBBF-BFEBFBFF
CPUID 00000002: 00FEFF01-00000000-00000000-00000000
CPUID 00000003: 00000000-00000000-00000000-00000000
CPUID 00000004: 7C000121-0140003F-0000003F-00000001 [SL 00]
CPUID 00000004: 7C000122-01C0003F-0000003F-00000001 [SL 01]
CPUID 00000004: 7C01C143-03C0003F-00000FFF-00000001 [SL 02]
CPUID 00000005: 00000040-00000040-00000003-11242020
CPUID 00000006: 00000057-00000002-00000001-00000000
CPUID 00000007: 00000000-2294E287-40400004-2C000000
CPUID 00000008: 00000000-00000000-00000000-00000000
CPUID 00000009: 00000000-00000000-00000000-00000000
CPUID 0000000A: 07300404-00000000-00000000-00008603
CPUID 0000000B: 00000001-00000001-00000100-00000006 [SL 00]
CPUID 0000000B: 00000006-00000004-00000201-00000006 [SL 01]
CPUID 0000000C: 00000000-00000000-00000000-00000000
CPUID 0000000D: 0000001B-00000440-00000440-00000000 [SL 00]
CPUID 0000000D: 0000000F-000002C0-00000100-00000000 [SL 01]
CPUID 0000000E: 00000000-00000000-00000000-00000000
CPUID 0000000F: 00000000-00000000-00000000-00000000 [SL 00]
CPUID 0000000F: 00000000-00000000-00000000-00000000 [SL 01]
CPUID 00000010: 00000000-00000004-00000000-00000000 [SL 00]
CPUID 00000010: 00000000-00000000-00000000-00000000 [SL 01]
CPUID 00000011: 00000000-00000000-00000000-00000000
CPUID 00000012: 00000000-00000000-00000000-00000000 [SL 00]
CPUID 00000012: 00000000-00000000-00000000-00000000 [SL 01]
CPUID 00000013: 00000000-00000000-00000000-00000000
CPUID 00000014: 00000001-0000003F-80000007-00000000 [SL 00]
CPUID 00000014: 02490002-003FFFFF-00000000-00000000 [SL 01]
CPUID 00000015: 00000003-000000EA-0124F800-00000000 [78.00x / 19200000]
CPUID 00000016: 00000000-00000000-00000000-00000000 [0 / 0 / 0]
CPUID 00000017: 00000000-00000000-00000000-00000000 [SL 00]
CPUID 00000018: 00000004-00000000-00000000-00000000 [SL 00]
CPUID 00000018: 00000000-00200001-00000001-00000121 [SL 01]
CPUID 00000018: 00000000-00040001-00000080-00000043 [SL 02]
CPUID 00000018: 00000000-00040006-00000008-00000043 [SL 03]
CPUID 00000018: 00000000-00300001-00000001-00000122 [SL 04]
CPUID 80000000: 80000008-00000000-00000000-00000000
CPUID 80000001: 00000000-00000000-00000101-2C100000
CPUID 80000002: 65746E49-2952286C-6C654320-6E6F7265 [Intel(R) Celeron]
CPUID 80000003: 20295228-3031344A-50432035-20402055 [(R) J4105 CPU @ ]
CPUID 80000004: 30352E31-007A4847-00000000-00000000 [1.50GHz]
CPUID 80000005: 00000000-00000000-00000000-00000000
CPUID 80000006: 00000000-00000000-10008040-00000000
CPUID 80000007: 00000000-00000000-00000000-00000100
CPUID 80000008: 00003027-00000000-00000000-00000000

L1    Data Cache:    24 KB,  6-way Associative, 64-byte Line
L1  Instr. Cache:    32 KB,  8-way Associative, 64-byte Line
L2 Unified Cache:     4 MB, 16-way Associative, 64-byte Line

------[ All CPUs ]------

CPU   0: APICID    0 / Package 0 / Core   0 / Thread 0: Valid
CPU   1: APICID    2 / Package 0 / Core   1 / Thread 0: Valid
CPU   2: APICID    4 / Package 0 / Core   2 / Thread 0: Valid
CPU   3: APICID    6 / Package 0 / Core   3 / Thread 0: Valid

------[ MSR Registers ]------

MSR 00000017: 0000-0000-0000-0000 [PlatID = 0]
MSR 0000001B: 0000-0000-FEE0-0900
MSR 0000002A: 0000-0000-0000-0000
MSR 00000035: 0000-0000-0004-0004
MSR 0000008B: 0000-0020-0000-0000
MSR 000000CD: < FAILED >
MSR 000000CE: 0004-0821-F001-0F00 [eD = 0]
MSR 000000E7: 0000-018F-6E30-D1E0 [S200]
MSR 000000E7: 0000-018F-7116-D0BC [S200]
MSR 000000E7: 0000-018F-7400-7ADA
MSR 000000E8: 0000-0272-255D-C57F [S200]
MSR 000000E8: 0000-0272-28EA-4D4F [S200]
MSR 000000E8: 0000-0272-2A86-A75E
MSR 000000EE: < FAILED >
MSR 0000010A: 0000-0000-0000-0002
MSR 0000011E: < FAILED >
MSR 00000194: < FAILED >
MSR 00000198: 0000-2599-0000-1800 [S200]
MSR 00000198: 0000-2599-0000-1800 [S200]
MSR 00000198: 0000-2599-0000-1800
MSR 00000199: 0000-0000-0000-1900
MSR 0000019A: 0000-0000-0000-0000
MSR 0000019B: 0000-0000-0000-0010
MSR 0000019C: 0000-0000-8839-0000 [S200]
MSR 0000019C: 0000-0000-8839-0000 [S200]
MSR 0000019C: 0000-0000-8838-0000
MSR 0000019D: 0000-0000-0000-0000
MSR 000001A0: 0000-0000-0085-0089
MSR 000001A2: 0000-0000-0069-0000
MSR 000001A4: 0000-0000-0000-0000
MSR 000001AA: 0000-0000-0040-0000
MSR 000001AC: < FAILED >
MSR 000001AD: 0000-0000-1818-1819
MSR 000001B0: < FAILED >
MSR 000001B1: 0000-0000-8838-0000
MSR 000001B2: 0000-0000-0000-0000
MSR 000001FC: 0000-0000-0020-005F
MSR 00000300: < FAILED >
MSR 0000030A: 0000-0000-016E-24BF [S200]
MSR 0000030A: 0000-0000-016E-24BF [S200]
MSR 0000030A: 0000-0000-016E-24BF
MSR 0000030B: 0000-00F9-A914-68D0 [S200]
MSR 0000030B: 0000-00F9-AB2C-013C [S200]
MSR 0000030B: 0000-00F9-AD23-53C0
MSR 00000480: 00DA-0400-0000-0011
MSR 00000481: 0000-00FF-0000-0016
MSR 00000482: FFF9-FFFE-0401-E172
MSR 00000483: 01FF-FFFF-0003-6DFF
MSR 00000484: 0003-FFFF-0000-11FF
MSR 00000485: 0000-0000-6004-C1E7
MSR 00000486: 0000-0000-8000-0021
MSR 00000487: 0000-0000-FFFF-FFFF
MSR 00000488: 0000-0000-0000-2000
MSR 00000489: 0000-0000-0035-2FFF
MSR 0000048A: 0000-0000-0000-002E
MSR 0000048B: 025D-EFFF-0000-0000
MSR 0000048C: 0000-0F01-0673-4141
MSR 0000048D: 0000-00FF-0000-0016
MSR 0000048E: FFF9-FFFE-0400-6172
MSR 0000048F: 01FF-FFFF-0003-6DFB
MSR 00000490: 0003-FFFF-0000-11FB
MSR 00000601: 0000-0000-0000-00C8
MSR 00000602: < FAILED >
MSR 00000603: 0000-0000-0008-FF0B
MSR 00000604: < FAILED >
MSR 00000606: 0000-0000-330A-0E08
MSR 0000060A: 0000-0000-0000-0000
MSR 0000060B: 0000-0000-0000-8893
MSR 0000060C: 0000-0000-0000-8893
MSR 0000060D: 0000-0005-3951-AED0
MSR 00000610: 0000-9900-001B-8A00
MSR 00000611: 0000-0000-0C91-0345 [S200]
MSR 00000611: 0000-0000-0C91-2085 [S200]
MSR 00000611: 0000-0000-0C91-3EA9
MSR 00000613: 0000-0000-0000-0000
MSR 00000614: 0000-0000-0000-0A00
MSR 00000618: 0000-0000-0000-0000
MSR 00000619: 0000-0000-0144-6C3E [S200]
MSR 00000619: 0000-0000-0144-6DE2 [S200]
MSR 00000619: 0000-0000-0144-6F3B
MSR 0000061B: 0000-0000-0000-58F0
MSR 0000061C: < FAILED >
MSR 00000638: < FAILED >
MSR 00000639: 0000-0000-0036-6C1A [S200]
MSR 00000639: 0000-0000-0036-6C73 [S200]
MSR 00000639: 0000-0000-0036-6CAE
MSR 0000063A: < FAILED >
MSR 0000063B: < FAILED >
MSR 00000640: < FAILED >
MSR 00000641: 0000-0000-00A0-D160 [S200]
MSR 00000641: 0000-0000-00A0-D6A8 [S200]
MSR 00000641: 0000-0000-00A0-DC0E
MSR 00000642: < FAILED >
MSR 00000660: 0000-005E-1A71-7F5A
MSR 00000661: < FAILED >
MSR 00000662: < FAILED >
MSR 00000663: < FAILED >
MSR 00000664: < FAILED >
MSR 00000665: < FAILED >
MSR 00000666: < FAILED >
MSR 00000667: < FAILED >
MSR 00000668: < FAILED >
MSR 00000669: < FAILED >
MSR 0000066A: < FAILED >
MSR 0000066B: < FAILED >
MSR 0000066C: < FAILED >
MSR 0000066D: < FAILED >
MSR 0000066E: < FAILED >
MSR 0000066F: < FAILED >
MSR 00000670: < FAILED >
MSR 00000671: < FAILED >
MSR 00000672: < FAILED >
MSR 00000673: < FAILED >
MSR 00000674: < FAILED >
MSR 00000675: < FAILED >
MSR 00000676: < FAILED >
MSR 00000677: < FAILED >

PerformanceFrequency = 1462501

CPU Clock M.Method = 8  (APIC SNB)
PM Timer Address   = 1032  (0408h)

APIC Clock = 100.01 MHz  (AT = 10058 / TT = 15000 / try = 1 / SKL = 0.00 MHz)
APIC Clock = 100.01 MHz  (AT = 10291 / TT = 15348 / try = 1 / SKL = 0.00 MHz)
APIC Clock = 100.00 MHz  (AT = 10057 / TT = 15000 / try = 1 / SKL = 0.00 MHz)
APIC Clock = 100.00 MHz  (AT = 10057 / TT = 15000 / try = 1 / SKL = 0.00 MHz)
APIC Clock = 100.00 MHz  (AT = 10057 / TT = 15000 / try = 1 / SKL = 0.00 MHz)

CPU Clock = 2399.97 MHz / TSC Clock = 1499.98 MHz / CPU Mul = 24.00x
CPU Clock = 2399.97 MHz / TSC Clock = 1499.98 MHz / CPU Mul = 24.00x
CPU Clock = 2399.97 MHz / TSC Clock = 1499.98 MHz / CPU Mul = 24.00x
CPU Clock = 2400.20 MHz / TSC Clock = 1500.13 MHz / CPU Mul = 24.00x
CPU Clock = 2400.20 MHz / TSC Clock = 1500.13 MHz / CPU Mul = 24.00x

CPU Clock Max = 2399.97 MHz / TSC Clock = 1499.98 MHz / CPU Mul = 24.00x
CPU Clock Max = 2400.20 MHz / TSC Clock = 1500.13 MHz / CPU Mul = 24.00x
CPU Clock Max = 2500.21 MHz / TSC Clock = 1500.13 MHz / CPU Mul = 25.00x
CPU Clock Max = 2400.20 MHz / TSC Clock = 1500.13 MHz / CPU Mul = 24.00x
CPU Clock Max = 2400.20 MHz / TSC Clock = 1500.13 MHz / CPU Mul = 24.00x

INTPERFCTR2 = 2393.38 MHz / INTPERFCTR1 (TSC) = 1497.60 MHz
INTPERFCTR2 = 2393.38 MHz / INTPERFCTR1 (TSC) = 1497.60 MHz
INTPERFCTR2 = 2389.08 MHz / INTPERFCTR1 (TSC) = 1494.84 MHz
INTPERFCTR2 = 2479.74 MHz / INTPERFCTR1 (TSC) = 1493.78 MHz
INTPERFCTR2 = 2490.53 MHz / INTPERFCTR1 (TSC) = 1496.47 MHz

------[ APIC Base at 00000000-FEE00000 ]------

  0000  00 00 00 00 00 00 00 00 00 00 00 00 00 00 00 00 
  0010  00 00 00 00 00 00 00 00 00 00 00 00 00 00 00 00 
  0020  00 00 00 00 00 00 00 00 00 00 00 00 00 00 00 00 
  0030  14 00 06 01 00 00 00 00 00 00 00 00 00 00 00 00 
  0040  00 00 00 00 00 00 00 00 00 00 00 00 00 00 00 00 
  0050  00 00 00 00 00 00 00 00 00 00 00 00 00 00 00 00 
  0060  00 00 00 00 00 00 00 00 00 00 00 00 00 00 00 00 
  0070  00 00 00 00 00 00 00 00 00 00 00 00 00 00 00 00 
  0080  00 00 00 00 00 00 00 00 00 00 00 00 00 00 00 00 
  0090  00 00 00 00 00 00 00 00 00 00 00 00 00 00 00 00 
  00A0  00 00 00 00 00 00 00 00 00 00 00 00 00 00 00 00 
  00B0  00 00 00 00 00 00 00 00 00 00 00 00 00 00 00 00 
  00C0  00 00 00 00 00 00 00 00 00 00 00 00 00 00 00 00 
  00D0  00 00 00 01 00 00 00 00 00 00 00 00 00 00 00 00 
  00E0  FF FF FF FF 00 00 00 00 00 00 00 00 00 00 00 00 
  00F0  DF 01 00 00 00 00 00 00 00 00 00 00 00 00 00 00 
  0100  00 00 00 00 00 00 00 00 00 00 00 00 00 00 00 00 
  0110  00 00 00 00 00 00 00 00 00 00 00 00 00 00 00 00 
  0120  00 00 00 00 00 00 00 00 00 00 00 00 00 00 00 00 
  0130  00 00 00 00 00 00 00 00 00 00 00 00 00 00 00 00 
  0140  00 00 00 00 00 00 00 00 00 00 00 00 00 00 00 00 
  0150  00 00 00 00 00 00 00 00 00 00 00 00 00 00 00 00 
  0160  00 00 00 00 00 00 00 00 00 00 00 00 00 00 00 00 
  0170  00 00 00 00 00 00 00 00 00 00 00 00 00 00 00 00 
  0180  00 00 00 00 00 00 00 00 00 00 00 00 00 00 00 00 
  0190  00 00 00 00 00 00 00 00 00 00 00 00 00 00 00 00 
  01A0  00 00 00 00 00 00 00 00 00 00 00 00 00 00 00 00 
  01B0  00 00 04 00 00 00 00 00 00 00 00 00 00 00 00 00 
  01C0  00 00 04 00 00 00 00 00 00 00 00 00 00 00 00 00 
  01D0  00 00 04 00 00 00 00 00 00 00 00 00 00 00 00 00 
  01E0  00 00 00 00 00 00 00 00 00 00 00 00 00 00 00 00 
  01F0  00 00 00 00 00 00 00 00 00 00 00 00 00 00 00 00 
  0200  00 00 00 00 00 00 00 00 00 00 00 00 00 00 00 00 
  0210  00 00 00 00 00 00 00 00 00 00 00 00 00 00 00 00 
  0220  00 00 00 00 00 00 00 00 00 00 00 00 00 00 00 00 
  0230  00 00 00 00 00 00 00 00 00 00 00 00 00 00 00 00 
  0240  00 00 00 00 00 00 00 00 00 00 00 00 00 00 00 00 
  0250  00 00 00 00 00 00 00 00 00 00 00 00 00 00 00 00 
  0260  00 00 00 00 00 00 00 00 00 00 00 00 00 00 00 00 
  0270  04 00 00 00 00 00 00 00 00 00 00 00 00 00 00 00 
  0280  80 00 00 00 00 00 00 00 00 00 00 00 00 00 00 00 
  0290  00 00 00 00 00 00 00 00 00 00 00 00 00 00 00 00 
  02A0  00 00 00 00 00 00 00 00 00 00 00 00 00 00 00 00 
  02B0  00 00 00 00 00 00 00 00 00 00 00 00 00 00 00 00 
  02C0  00 00 00 00 00 00 00 00 00 00 00 00 00 00 00 00 
  02D0  00 00 00 00 00 00 00 00 00 00 00 00 00 00 00 00 
  02E0  00 00 00 00 00 00 00 00 00 00 00 00 00 00 00 00 
  02F0  35 00 00 00 00 00 00 00 00 00 00 00 00 00 00 00 
  0300  2F 08 00 00 00 00 00 00 00 00 00 00 00 00 00 00 
  0310  00 00 00 08 00 00 00 00 00 00 00 00 00 00 00 00 
  0320  D1 00 02 00 00 00 00 00 00 00 00 00 00 00 00 00 
  0330  00 00 01 00 00 00 00 00 00 00 00 00 00 00 00 00 
  0340  FE 00 00 00 00 00 00 00 00 00 00 00 00 00 00 00 
  0350  D8 00 01 00 00 00 00 00 00 00 00 00 00 00 00 00 
  0360  00 84 00 00 00 00 00 00 00 00 00 00 00 00 00 00 
  0370  E2 00 00 00 00 00 00 00 00 00 00 00 00 00 00 00 
  0380  28 09 00 00 00 00 00 00 00 00 00 00 00 00 00 00 
  0390  59 00 00 00 00 00 00 00 00 00 00 00 00 00 00 00 
  03A0  00 00 00 00 00 00 00 00 00 00 00 00 00 00 00 00 
  03B0  00 00 00 00 00 00 00 00 00 00 00 00 00 00 00 00 
  03C0  00 00 00 00 00 00 00 00 00 00 00 00 00 00 00 00 
  03D0  00 00 00 00 00 00 00 00 00 00 00 00 00 00 00 00 
  03E0  0A 00 00 00 00 00 00 00 00 00 00 00 00 00 00 00 
  03F0  00 00 00 00 00 00 00 00 00 00 00 00 00 00 00 00 
