------[ Versions ]------

Program Version : EVEREST v4.60.1629 Beta
BenchDLL Version: 2.4.257.0

------[ CPU Info ]------

CPU Type           : Mobile Intel Pentium M 730, 1600 MHz (12 x 133)
CPU Alias          : Dothan
CPU Platform       : Mobile uPGA2
CPU Stepping       : C0
Instruction Set    : x86, MMX, SSE, SSE2
CPUID Manufacturer : GenuineIntel
CPUID CPU Name     : Intel(R) Pentium(R) M processor 1.60GHz
CPUID Revision     : 000006D8h
IA Brand ID        : 16h  (Intel Pentium M)
Platform ID        : 05h  (Mobile uPGA2)

------[ Logical CPU #0 ]------

allcpu: Valid

CPUID 00000000: 00000002-756E6547-6C65746E-49656E69
CPUID 00000001: 000006D8-00000816-00000180-AFE9FBFF
CPUID 00000002: 02B3B001-000000F0-00000000-2C04307D
CPUID 80000000: 80000008-00000000-00000000-00000000
CPUID 80000001: 00000000-00000000-00000000-00100000
CPUID 80000002: 20202020-20202020-65746E49-2952286C
CPUID 80000003: 6E655020-6D756974-20295228-7270204D
CPUID 80000004: 7365636F-20726F73-30362E31-007A4847
CPUID 80000005: 00000000-00000000-00000000-00000000
CPUID 80000006: 00000000-00000000-08006040-00000000
CPUID 80000007: 00000000-00000000-00000000-00000000
CPUID 80000008: 00002020-00000000-00000000-00000000

------[ MSR Registers ]------

MSR 00000017: 0014-0000-D024-8626 [PlatID = 5]
MSR 0000001B: 0000-0000-FEE0-0900
MSR 0000002A: 0000-0000-4308-0000
MSR 0000008B: 0000-0020-0000-0000
MSR 000000CD: 0000-0000-0000-0311
MSR 000000CE: 2612-0C00-0000-0311
MSR 0000011E: 0000-0000-0034-272B
MSR 00000198: 0612-0C26-0600-0C26
MSR 00000199: 0000-0000-0000-0C26
MSR 0000019A: 0000-0000-0000-0002
MSR 0000019B: 0000-0000-0000-0000
MSR 0000019C: 0000-0000-0000-0000
MSR 0000019D: 0000-0000-0000-0612
MSR 000001A0: 0000-0000-0011-1488

PerformanceFrequency = 3579545

Tjmax Temperature = 0 Celsius
