------[ Logical CPU #0 ]------

allcpu: Package 0 / Core 0 / Thread 0: Valid

CPUID 00000000: 00000014-756E6547-6C65746E-49656E69 [GenuineIntel]
CPUID 00000001: 00050662-00100800-7FFEFBFF-BFEBFBFF
CPUID 00000002: 76036301-00F0B5FF-00000000-00C30000
CPUID 00000003: 00000000-00000000-00000000-00000000
CPUID 00000004: 1C004121-01C0003F-0000003F-00000000 [SL 00]
CPUID 00000004: 1C004122-01C0003F-0000003F-00000000 [SL 01]
CPUID 00000004: 1C004143-01C0003F-000001FF-00000000 [SL 02]
CPUID 00000004: 1C03C163-02C0003F-00003FFF-00000006 [SL 03]
CPUID 00000005: 00000040-00000040-00000003-00002120
CPUID 00000006: 00000075-00000002-00000009-00000000
CPUID 00000007: 00000000-021CBFBB-00000000-00000000
CPUID 00000008: 00000000-00000000-00000000-00000000
CPUID 00000009: 00000001-00000000-00000000-00000000
CPUID 0000000A: 07300403-00000000-00000000-00000603
CPUID 0000000B: 00000001-00000002-00000100-00000000 [SL 00]
CPUID 0000000B: 00000004-00000010-00000201-00000000 [SL 01]
CPUID 0000000C: 00000000-00000000-00000000-00000000
CPUID 0000000D: 00000007-00000340-00000340-00000000 [SL 00]
CPUID 0000000D: 00000001-00000000-00000000-00000000 [SL 01]
CPUID 0000000D: 00000100-00000240-00000000-00000000 [SL 02]
CPUID 0000000E: 00000000-00000000-00000000-00000000
CPUID 0000000F: 00000000-0000003F-00000000-00000002 [SL 00]
CPUID 0000000F: 00000000-00008000-0000003F-00000007 [SL 01]
CPUID 00000010: 00000000-00000002-00000000-00000000 [SL 00]
CPUID 00000010: 0000000B-00000C00-00000000-0000000F [SL 01]
CPUID 00000011: 00000000-00000000-00000000-00000000
CPUID 00000012: 00000000-00000000-00000000-00000000 [SL 00]
CPUID 00000012: 00000000-00000000-00000000-00000000 [SL 01]
CPUID 00000013: 00000000-00000000-00000000-00000000
CPUID 00000014: 00000000-00000001-00000001-00000000 [SL 00]
CPUID 80000000: 80000008-00000000-00000000-00000000
CPUID 80000001: 00000000-00000000-00000121-2C100000
CPUID 80000002: 65746E49-2952286C-6F655820-2952286E [Intel(R) Xeon(R)]
CPUID 80000003: 55504320-312D4420-20303435-2E322040 [ CPU D-1540 @ 2.]
CPUID 80000004: 48473030-0000007A-00000000-00000000 [00GHz]
CPUID 80000005: 00000000-00000000-00000000-00000000
CPUID 80000006: 00000000-00000000-01006040-00000000
CPUID 80000007: 00000000-00000000-00000000-00000100
CPUID 80000008: 0000302E-00000000-00000000-00000000

L1    Data Cache:    32 KB,  8-way Associative, 64-byte Line
L1  Instr. Cache:    32 KB,  8-way Associative, 64-byte Line
L2 Unified Cache:   256 KB,  8-way Associative, 64-byte Line
L3 Unified Cache:    12 MB, 12-way Associative, 64-byte Line

------[ Logical CPU #1 ]------

allcpu: Package 0 / Core 0 / Thread 1: Valid, Virtual

CPUID 00000000: 00000014-756E6547-6C65746E-49656E69 [GenuineIntel]
CPUID 00000001: 00050662-01100800-7FFEFBFF-BFEBFBFF
CPUID 00000002: 76036301-00F0B5FF-00000000-00C30000
CPUID 00000003: 00000000-00000000-00000000-00000000
CPUID 00000004: 1C004121-01C0003F-0000003F-00000000 [SL 00]
CPUID 00000004: 1C004122-01C0003F-0000003F-00000000 [SL 01]
CPUID 00000004: 1C004143-01C0003F-000001FF-00000000 [SL 02]
CPUID 00000004: 1C03C163-02C0003F-00003FFF-00000006 [SL 03]
CPUID 00000005: 00000040-00000040-00000003-00002120
CPUID 00000006: 00000075-00000002-00000009-00000000
CPUID 00000007: 00000000-021CBFBB-00000000-00000000
CPUID 00000008: 00000000-00000000-00000000-00000000
CPUID 00000009: 00000001-00000000-00000000-00000000
CPUID 0000000A: 07300403-00000000-00000000-00000603
CPUID 0000000B: 00000001-00000002-00000100-00000001 [SL 00]
CPUID 0000000B: 00000004-00000010-00000201-00000001 [SL 01]
CPUID 0000000C: 00000000-00000000-00000000-00000000
CPUID 0000000D: 00000007-00000340-00000340-00000000 [SL 00]
CPUID 0000000D: 00000001-00000000-00000000-00000000 [SL 01]
CPUID 0000000D: 00000100-00000240-00000000-00000000 [SL 02]
CPUID 0000000E: 00000000-00000000-00000000-00000000
CPUID 0000000F: 00000000-0000003F-00000000-00000002 [SL 00]
CPUID 0000000F: 00000000-00008000-0000003F-00000007 [SL 01]
CPUID 00000010: 00000000-00000002-00000000-00000000 [SL 00]
CPUID 00000010: 0000000B-00000C00-00000000-0000000F [SL 01]
CPUID 00000011: 00000000-00000000-00000000-00000000
CPUID 00000012: 00000000-00000000-00000000-00000000 [SL 00]
CPUID 00000012: 00000000-00000000-00000000-00000000 [SL 01]
CPUID 00000013: 00000000-00000000-00000000-00000000
CPUID 00000014: 00000000-00000001-00000001-00000000 [SL 00]
CPUID 80000000: 80000008-00000000-00000000-00000000
CPUID 80000001: 00000000-00000000-00000121-2C100000
CPUID 80000002: 65746E49-2952286C-6F655820-2952286E [Intel(R) Xeon(R)]
CPUID 80000003: 55504320-312D4420-20303435-2E322040 [ CPU D-1540 @ 2.]
CPUID 80000004: 48473030-0000007A-00000000-00000000 [00GHz]
CPUID 80000005: 00000000-00000000-00000000-00000000
CPUID 80000006: 00000000-00000000-01006040-00000000
CPUID 80000007: 00000000-00000000-00000000-00000100
CPUID 80000008: 0000302E-00000000-00000000-00000000

L1    Data Cache:    32 KB,  8-way Associative, 64-byte Line
L1  Instr. Cache:    32 KB,  8-way Associative, 64-byte Line
L2 Unified Cache:   256 KB,  8-way Associative, 64-byte Line
L3 Unified Cache:    12 MB, 12-way Associative, 64-byte Line

------[ Logical CPU #2 ]------

allcpu: Package 0 / Core 1 / Thread 0: Valid

CPUID 00000000: 00000014-756E6547-6C65746E-49656E69 [GenuineIntel]
CPUID 00000001: 00050662-02100800-7FFEFBFF-BFEBFBFF
CPUID 00000002: 76036301-00F0B5FF-00000000-00C30000
CPUID 00000003: 00000000-00000000-00000000-00000000
CPUID 00000004: 1C004121-01C0003F-0000003F-00000000 [SL 00]
CPUID 00000004: 1C004122-01C0003F-0000003F-00000000 [SL 01]
CPUID 00000004: 1C004143-01C0003F-000001FF-00000000 [SL 02]
CPUID 00000004: 1C03C163-02C0003F-00003FFF-00000006 [SL 03]
CPUID 00000005: 00000040-00000040-00000003-00002120
CPUID 00000006: 00000075-00000002-00000009-00000000
CPUID 00000007: 00000000-021CBFBB-00000000-00000000
CPUID 00000008: 00000000-00000000-00000000-00000000
CPUID 00000009: 00000001-00000000-00000000-00000000
CPUID 0000000A: 07300403-00000000-00000000-00000603
CPUID 0000000B: 00000001-00000002-00000100-00000002 [SL 00]
CPUID 0000000B: 00000004-00000010-00000201-00000002 [SL 01]
CPUID 0000000C: 00000000-00000000-00000000-00000000
CPUID 0000000D: 00000007-00000340-00000340-00000000 [SL 00]
CPUID 0000000D: 00000001-00000000-00000000-00000000 [SL 01]
CPUID 0000000D: 00000100-00000240-00000000-00000000 [SL 02]
CPUID 0000000E: 00000000-00000000-00000000-00000000
CPUID 0000000F: 00000000-0000003F-00000000-00000002 [SL 00]
CPUID 0000000F: 00000000-00008000-0000003F-00000007 [SL 01]
CPUID 00000010: 00000000-00000002-00000000-00000000 [SL 00]
CPUID 00000010: 0000000B-00000C00-00000000-0000000F [SL 01]
CPUID 00000011: 00000000-00000000-00000000-00000000
CPUID 00000012: 00000000-00000000-00000000-00000000 [SL 00]
CPUID 00000012: 00000000-00000000-00000000-00000000 [SL 01]
CPUID 00000013: 00000000-00000000-00000000-00000000
CPUID 00000014: 00000000-00000001-00000001-00000000 [SL 00]
CPUID 80000000: 80000008-00000000-00000000-00000000
CPUID 80000001: 00000000-00000000-00000121-2C100000
CPUID 80000002: 65746E49-2952286C-6F655820-2952286E [Intel(R) Xeon(R)]
CPUID 80000003: 55504320-312D4420-20303435-2E322040 [ CPU D-1540 @ 2.]
CPUID 80000004: 48473030-0000007A-00000000-00000000 [00GHz]
CPUID 80000005: 00000000-00000000-00000000-00000000
CPUID 80000006: 00000000-00000000-01006040-00000000
CPUID 80000007: 00000000-00000000-00000000-00000100
CPUID 80000008: 0000302E-00000000-00000000-00000000

L1    Data Cache:    32 KB,  8-way Associative, 64-byte Line
L1  Instr. Cache:    32 KB,  8-way Associative, 64-byte Line
L2 Unified Cache:   256 KB,  8-way Associative, 64-byte Line
L3 Unified Cache:    12 MB, 12-way Associative, 64-byte Line

------[ Logical CPU #3 ]------

allcpu: Package 0 / Core 1 / Thread 1: Valid, Virtual

CPUID 00000000: 00000014-756E6547-6C65746E-49656E69 [GenuineIntel]
CPUID 00000001: 00050662-03100800-7FFEFBFF-BFEBFBFF
CPUID 00000002: 76036301-00F0B5FF-00000000-00C30000
CPUID 00000003: 00000000-00000000-00000000-00000000
CPUID 00000004: 1C004121-01C0003F-0000003F-00000000 [SL 00]
CPUID 00000004: 1C004122-01C0003F-0000003F-00000000 [SL 01]
CPUID 00000004: 1C004143-01C0003F-000001FF-00000000 [SL 02]
CPUID 00000004: 1C03C163-02C0003F-00003FFF-00000006 [SL 03]
CPUID 00000005: 00000040-00000040-00000003-00002120
CPUID 00000006: 00000075-00000002-00000009-00000000
CPUID 00000007: 00000000-021CBFBB-00000000-00000000
CPUID 00000008: 00000000-00000000-00000000-00000000
CPUID 00000009: 00000001-00000000-00000000-00000000
CPUID 0000000A: 07300403-00000000-00000000-00000603
CPUID 0000000B: 00000001-00000002-00000100-00000003 [SL 00]
CPUID 0000000B: 00000004-00000010-00000201-00000003 [SL 01]
CPUID 0000000C: 00000000-00000000-00000000-00000000
CPUID 0000000D: 00000007-00000340-00000340-00000000 [SL 00]
CPUID 0000000D: 00000001-00000000-00000000-00000000 [SL 01]
CPUID 0000000D: 00000100-00000240-00000000-00000000 [SL 02]
CPUID 0000000E: 00000000-00000000-00000000-00000000
CPUID 0000000F: 00000000-0000003F-00000000-00000002 [SL 00]
CPUID 0000000F: 00000000-00008000-0000003F-00000007 [SL 01]
CPUID 00000010: 00000000-00000002-00000000-00000000 [SL 00]
CPUID 00000010: 0000000B-00000C00-00000000-0000000F [SL 01]
CPUID 00000011: 00000000-00000000-00000000-00000000
CPUID 00000012: 00000000-00000000-00000000-00000000 [SL 00]
CPUID 00000012: 00000000-00000000-00000000-00000000 [SL 01]
CPUID 00000013: 00000000-00000000-00000000-00000000
CPUID 00000014: 00000000-00000001-00000001-00000000 [SL 00]
CPUID 80000000: 80000008-00000000-00000000-00000000
CPUID 80000001: 00000000-00000000-00000121-2C100000
CPUID 80000002: 65746E49-2952286C-6F655820-2952286E [Intel(R) Xeon(R)]
CPUID 80000003: 55504320-312D4420-20303435-2E322040 [ CPU D-1540 @ 2.]
CPUID 80000004: 48473030-0000007A-00000000-00000000 [00GHz]
CPUID 80000005: 00000000-00000000-00000000-00000000
CPUID 80000006: 00000000-00000000-01006040-00000000
CPUID 80000007: 00000000-00000000-00000000-00000100
CPUID 80000008: 0000302E-00000000-00000000-00000000

L1    Data Cache:    32 KB,  8-way Associative, 64-byte Line
L1  Instr. Cache:    32 KB,  8-way Associative, 64-byte Line
L2 Unified Cache:   256 KB,  8-way Associative, 64-byte Line
L3 Unified Cache:    12 MB, 12-way Associative, 64-byte Line

------[ Logical CPU #4 ]------

allcpu: Package 0 / Core 2 / Thread 0: Valid

CPUID 00000000: 00000014-756E6547-6C65746E-49656E69 [GenuineIntel]
CPUID 00000001: 00050662-04100800-7FFEFBFF-BFEBFBFF
CPUID 00000002: 76036301-00F0B5FF-00000000-00C30000
CPUID 00000003: 00000000-00000000-00000000-00000000
CPUID 00000004: 1C004121-01C0003F-0000003F-00000000 [SL 00]
CPUID 00000004: 1C004122-01C0003F-0000003F-00000000 [SL 01]
CPUID 00000004: 1C004143-01C0003F-000001FF-00000000 [SL 02]
CPUID 00000004: 1C03C163-02C0003F-00003FFF-00000006 [SL 03]
CPUID 00000005: 00000040-00000040-00000003-00002120
CPUID 00000006: 00000075-00000002-00000009-00000000
CPUID 00000007: 00000000-021CBFBB-00000000-00000000
CPUID 00000008: 00000000-00000000-00000000-00000000
CPUID 00000009: 00000001-00000000-00000000-00000000
CPUID 0000000A: 07300403-00000000-00000000-00000603
CPUID 0000000B: 00000001-00000002-00000100-00000004 [SL 00]
CPUID 0000000B: 00000004-00000010-00000201-00000004 [SL 01]
CPUID 0000000C: 00000000-00000000-00000000-00000000
CPUID 0000000D: 00000007-00000340-00000340-00000000 [SL 00]
CPUID 0000000D: 00000001-00000000-00000000-00000000 [SL 01]
CPUID 0000000D: 00000100-00000240-00000000-00000000 [SL 02]
CPUID 0000000E: 00000000-00000000-00000000-00000000
CPUID 0000000F: 00000000-0000003F-00000000-00000002 [SL 00]
CPUID 0000000F: 00000000-00008000-0000003F-00000007 [SL 01]
CPUID 00000010: 00000000-00000002-00000000-00000000 [SL 00]
CPUID 00000010: 0000000B-00000C00-00000000-0000000F [SL 01]
CPUID 00000011: 00000000-00000000-00000000-00000000
CPUID 00000012: 00000000-00000000-00000000-00000000 [SL 00]
CPUID 00000012: 00000000-00000000-00000000-00000000 [SL 01]
CPUID 00000013: 00000000-00000000-00000000-00000000
CPUID 00000014: 00000000-00000001-00000001-00000000 [SL 00]
CPUID 80000000: 80000008-00000000-00000000-00000000
CPUID 80000001: 00000000-00000000-00000121-2C100000
CPUID 80000002: 65746E49-2952286C-6F655820-2952286E [Intel(R) Xeon(R)]
CPUID 80000003: 55504320-312D4420-20303435-2E322040 [ CPU D-1540 @ 2.]
CPUID 80000004: 48473030-0000007A-00000000-00000000 [00GHz]
CPUID 80000005: 00000000-00000000-00000000-00000000
CPUID 80000006: 00000000-00000000-01006040-00000000
CPUID 80000007: 00000000-00000000-00000000-00000100
CPUID 80000008: 0000302E-00000000-00000000-00000000

L1    Data Cache:    32 KB,  8-way Associative, 64-byte Line
L1  Instr. Cache:    32 KB,  8-way Associative, 64-byte Line
L2 Unified Cache:   256 KB,  8-way Associative, 64-byte Line
L3 Unified Cache:    12 MB, 12-way Associative, 64-byte Line

------[ Logical CPU #5 ]------

allcpu: Package 0 / Core 2 / Thread 1: Valid, Virtual

CPUID 00000000: 00000014-756E6547-6C65746E-49656E69 [GenuineIntel]
CPUID 00000001: 00050662-05100800-7FFEFBFF-BFEBFBFF
CPUID 00000002: 76036301-00F0B5FF-00000000-00C30000
CPUID 00000003: 00000000-00000000-00000000-00000000
CPUID 00000004: 1C004121-01C0003F-0000003F-00000000 [SL 00]
CPUID 00000004: 1C004122-01C0003F-0000003F-00000000 [SL 01]
CPUID 00000004: 1C004143-01C0003F-000001FF-00000000 [SL 02]
CPUID 00000004: 1C03C163-02C0003F-00003FFF-00000006 [SL 03]
CPUID 00000005: 00000040-00000040-00000003-00002120
CPUID 00000006: 00000075-00000002-00000009-00000000
CPUID 00000007: 00000000-021CBFBB-00000000-00000000
CPUID 00000008: 00000000-00000000-00000000-00000000
CPUID 00000009: 00000001-00000000-00000000-00000000
CPUID 0000000A: 07300403-00000000-00000000-00000603
CPUID 0000000B: 00000001-00000002-00000100-00000005 [SL 00]
CPUID 0000000B: 00000004-00000010-00000201-00000005 [SL 01]
CPUID 0000000C: 00000000-00000000-00000000-00000000
CPUID 0000000D: 00000007-00000340-00000340-00000000 [SL 00]
CPUID 0000000D: 00000001-00000000-00000000-00000000 [SL 01]
CPUID 0000000D: 00000100-00000240-00000000-00000000 [SL 02]
CPUID 0000000E: 00000000-00000000-00000000-00000000
CPUID 0000000F: 00000000-0000003F-00000000-00000002 [SL 00]
CPUID 0000000F: 00000000-00008000-0000003F-00000007 [SL 01]
CPUID 00000010: 00000000-00000002-00000000-00000000 [SL 00]
CPUID 00000010: 0000000B-00000C00-00000000-0000000F [SL 01]
CPUID 00000011: 00000000-00000000-00000000-00000000
CPUID 00000012: 00000000-00000000-00000000-00000000 [SL 00]
CPUID 00000012: 00000000-00000000-00000000-00000000 [SL 01]
CPUID 00000013: 00000000-00000000-00000000-00000000
CPUID 00000014: 00000000-00000001-00000001-00000000 [SL 00]
CPUID 80000000: 80000008-00000000-00000000-00000000
CPUID 80000001: 00000000-00000000-00000121-2C100000
CPUID 80000002: 65746E49-2952286C-6F655820-2952286E [Intel(R) Xeon(R)]
CPUID 80000003: 55504320-312D4420-20303435-2E322040 [ CPU D-1540 @ 2.]
CPUID 80000004: 48473030-0000007A-00000000-00000000 [00GHz]
CPUID 80000005: 00000000-00000000-00000000-00000000
CPUID 80000006: 00000000-00000000-01006040-00000000
CPUID 80000007: 00000000-00000000-00000000-00000100
CPUID 80000008: 0000302E-00000000-00000000-00000000

L1    Data Cache:    32 KB,  8-way Associative, 64-byte Line
L1  Instr. Cache:    32 KB,  8-way Associative, 64-byte Line
L2 Unified Cache:   256 KB,  8-way Associative, 64-byte Line
L3 Unified Cache:    12 MB, 12-way Associative, 64-byte Line

------[ Logical CPU #6 ]------

allcpu: Package 0 / Core 3 / Thread 0: Valid

CPUID 00000000: 00000014-756E6547-6C65746E-49656E69 [GenuineIntel]
CPUID 00000001: 00050662-06100800-7FFEFBFF-BFEBFBFF
CPUID 00000002: 76036301-00F0B5FF-00000000-00C30000
CPUID 00000003: 00000000-00000000-00000000-00000000
CPUID 00000004: 1C004121-01C0003F-0000003F-00000000 [SL 00]
CPUID 00000004: 1C004122-01C0003F-0000003F-00000000 [SL 01]
CPUID 00000004: 1C004143-01C0003F-000001FF-00000000 [SL 02]
CPUID 00000004: 1C03C163-02C0003F-00003FFF-00000006 [SL 03]
CPUID 00000005: 00000040-00000040-00000003-00002120
CPUID 00000006: 00000075-00000002-00000009-00000000
CPUID 00000007: 00000000-021CBFBB-00000000-00000000
CPUID 00000008: 00000000-00000000-00000000-00000000
CPUID 00000009: 00000001-00000000-00000000-00000000
CPUID 0000000A: 07300403-00000000-00000000-00000603
CPUID 0000000B: 00000001-00000002-00000100-00000006 [SL 00]
CPUID 0000000B: 00000004-00000010-00000201-00000006 [SL 01]
CPUID 0000000C: 00000000-00000000-00000000-00000000
CPUID 0000000D: 00000007-00000340-00000340-00000000 [SL 00]
CPUID 0000000D: 00000001-00000000-00000000-00000000 [SL 01]
CPUID 0000000D: 00000100-00000240-00000000-00000000 [SL 02]
CPUID 0000000E: 00000000-00000000-00000000-00000000
CPUID 0000000F: 00000000-0000003F-00000000-00000002 [SL 00]
CPUID 0000000F: 00000000-00008000-0000003F-00000007 [SL 01]
CPUID 00000010: 00000000-00000002-00000000-00000000 [SL 00]
CPUID 00000010: 0000000B-00000C00-00000000-0000000F [SL 01]
CPUID 00000011: 00000000-00000000-00000000-00000000
CPUID 00000012: 00000000-00000000-00000000-00000000 [SL 00]
CPUID 00000012: 00000000-00000000-00000000-00000000 [SL 01]
CPUID 00000013: 00000000-00000000-00000000-00000000
CPUID 00000014: 00000000-00000001-00000001-00000000 [SL 00]
CPUID 80000000: 80000008-00000000-00000000-00000000
CPUID 80000001: 00000000-00000000-00000121-2C100000
CPUID 80000002: 65746E49-2952286C-6F655820-2952286E [Intel(R) Xeon(R)]
CPUID 80000003: 55504320-312D4420-20303435-2E322040 [ CPU D-1540 @ 2.]
CPUID 80000004: 48473030-0000007A-00000000-00000000 [00GHz]
CPUID 80000005: 00000000-00000000-00000000-00000000
CPUID 80000006: 00000000-00000000-01006040-00000000
CPUID 80000007: 00000000-00000000-00000000-00000100
CPUID 80000008: 0000302E-00000000-00000000-00000000

L1    Data Cache:    32 KB,  8-way Associative, 64-byte Line
L1  Instr. Cache:    32 KB,  8-way Associative, 64-byte Line
L2 Unified Cache:   256 KB,  8-way Associative, 64-byte Line
L3 Unified Cache:    12 MB, 12-way Associative, 64-byte Line

------[ Logical CPU #7 ]------

allcpu: Package 0 / Core 3 / Thread 1: Valid, Virtual

CPUID 00000000: 00000014-756E6547-6C65746E-49656E69 [GenuineIntel]
CPUID 00000001: 00050662-07100800-7FFEFBFF-BFEBFBFF
CPUID 00000002: 76036301-00F0B5FF-00000000-00C30000
CPUID 00000003: 00000000-00000000-00000000-00000000
CPUID 00000004: 1C004121-01C0003F-0000003F-00000000 [SL 00]
CPUID 00000004: 1C004122-01C0003F-0000003F-00000000 [SL 01]
CPUID 00000004: 1C004143-01C0003F-000001FF-00000000 [SL 02]
CPUID 00000004: 1C03C163-02C0003F-00003FFF-00000006 [SL 03]
CPUID 00000005: 00000040-00000040-00000003-00002120
CPUID 00000006: 00000075-00000002-00000009-00000000
CPUID 00000007: 00000000-021CBFBB-00000000-00000000
CPUID 00000008: 00000000-00000000-00000000-00000000
CPUID 00000009: 00000001-00000000-00000000-00000000
CPUID 0000000A: 07300403-00000000-00000000-00000603
CPUID 0000000B: 00000001-00000002-00000100-00000007 [SL 00]
CPUID 0000000B: 00000004-00000010-00000201-00000007 [SL 01]
CPUID 0000000C: 00000000-00000000-00000000-00000000
CPUID 0000000D: 00000007-00000340-00000340-00000000 [SL 00]
CPUID 0000000D: 00000001-00000000-00000000-00000000 [SL 01]
CPUID 0000000D: 00000100-00000240-00000000-00000000 [SL 02]
CPUID 0000000E: 00000000-00000000-00000000-00000000
CPUID 0000000F: 00000000-0000003F-00000000-00000002 [SL 00]
CPUID 0000000F: 00000000-00008000-0000003F-00000007 [SL 01]
CPUID 00000010: 00000000-00000002-00000000-00000000 [SL 00]
CPUID 00000010: 0000000B-00000C00-00000000-0000000F [SL 01]
CPUID 00000011: 00000000-00000000-00000000-00000000
CPUID 00000012: 00000000-00000000-00000000-00000000 [SL 00]
CPUID 00000012: 00000000-00000000-00000000-00000000 [SL 01]
CPUID 00000013: 00000000-00000000-00000000-00000000
CPUID 00000014: 00000000-00000001-00000001-00000000 [SL 00]
CPUID 80000000: 80000008-00000000-00000000-00000000
CPUID 80000001: 00000000-00000000-00000121-2C100000
CPUID 80000002: 65746E49-2952286C-6F655820-2952286E [Intel(R) Xeon(R)]
CPUID 80000003: 55504320-312D4420-20303435-2E322040 [ CPU D-1540 @ 2.]
CPUID 80000004: 48473030-0000007A-00000000-00000000 [00GHz]
CPUID 80000005: 00000000-00000000-00000000-00000000
CPUID 80000006: 00000000-00000000-01006040-00000000
CPUID 80000007: 00000000-00000000-00000000-00000100
CPUID 80000008: 0000302E-00000000-00000000-00000000

L1    Data Cache:    32 KB,  8-way Associative, 64-byte Line
L1  Instr. Cache:    32 KB,  8-way Associative, 64-byte Line
L2 Unified Cache:   256 KB,  8-way Associative, 64-byte Line
L3 Unified Cache:    12 MB, 12-way Associative, 64-byte Line

------[ Logical CPU #8 ]------

allcpu: Package 0 / Core 4 / Thread 0: Valid

CPUID 00000000: 00000014-756E6547-6C65746E-49656E69 [GenuineIntel]
CPUID 00000001: 00050662-08100800-7FFEFBFF-BFEBFBFF
CPUID 00000002: 76036301-00F0B5FF-00000000-00C30000
CPUID 00000003: 00000000-00000000-00000000-00000000
CPUID 00000004: 1C004121-01C0003F-0000003F-00000000 [SL 00]
CPUID 00000004: 1C004122-01C0003F-0000003F-00000000 [SL 01]
CPUID 00000004: 1C004143-01C0003F-000001FF-00000000 [SL 02]
CPUID 00000004: 1C03C163-02C0003F-00003FFF-00000006 [SL 03]
CPUID 00000005: 00000040-00000040-00000003-00002120
CPUID 00000006: 00000075-00000002-00000009-00000000
CPUID 00000007: 00000000-021CBFBB-00000000-00000000
CPUID 00000008: 00000000-00000000-00000000-00000000
CPUID 00000009: 00000001-00000000-00000000-00000000
CPUID 0000000A: 07300403-00000000-00000000-00000603
CPUID 0000000B: 00000001-00000002-00000100-00000008 [SL 00]
CPUID 0000000B: 00000004-00000010-00000201-00000008 [SL 01]
CPUID 0000000C: 00000000-00000000-00000000-00000000
CPUID 0000000D: 00000007-00000340-00000340-00000000 [SL 00]
CPUID 0000000D: 00000001-00000000-00000000-00000000 [SL 01]
CPUID 0000000D: 00000100-00000240-00000000-00000000 [SL 02]
CPUID 0000000E: 00000000-00000000-00000000-00000000
CPUID 0000000F: 00000000-0000003F-00000000-00000002 [SL 00]
CPUID 0000000F: 00000000-00008000-0000003F-00000007 [SL 01]
CPUID 00000010: 00000000-00000002-00000000-00000000 [SL 00]
CPUID 00000010: 0000000B-00000C00-00000000-0000000F [SL 01]
CPUID 00000011: 00000000-00000000-00000000-00000000
CPUID 00000012: 00000000-00000000-00000000-00000000 [SL 00]
CPUID 00000012: 00000000-00000000-00000000-00000000 [SL 01]
CPUID 00000013: 00000000-00000000-00000000-00000000
CPUID 00000014: 00000000-00000001-00000001-00000000 [SL 00]
CPUID 80000000: 80000008-00000000-00000000-00000000
CPUID 80000001: 00000000-00000000-00000121-2C100000
CPUID 80000002: 65746E49-2952286C-6F655820-2952286E [Intel(R) Xeon(R)]
CPUID 80000003: 55504320-312D4420-20303435-2E322040 [ CPU D-1540 @ 2.]
CPUID 80000004: 48473030-0000007A-00000000-00000000 [00GHz]
CPUID 80000005: 00000000-00000000-00000000-00000000
CPUID 80000006: 00000000-00000000-01006040-00000000
CPUID 80000007: 00000000-00000000-00000000-00000100
CPUID 80000008: 0000302E-00000000-00000000-00000000

L1    Data Cache:    32 KB,  8-way Associative, 64-byte Line
L1  Instr. Cache:    32 KB,  8-way Associative, 64-byte Line
L2 Unified Cache:   256 KB,  8-way Associative, 64-byte Line
L3 Unified Cache:    12 MB, 12-way Associative, 64-byte Line

------[ Logical CPU #9 ]------

allcpu: Package 0 / Core 4 / Thread 1: Valid, Virtual

CPUID 00000000: 00000014-756E6547-6C65746E-49656E69 [GenuineIntel]
CPUID 00000001: 00050662-09100800-7FFEFBFF-BFEBFBFF
CPUID 00000002: 76036301-00F0B5FF-00000000-00C30000
CPUID 00000003: 00000000-00000000-00000000-00000000
CPUID 00000004: 1C004121-01C0003F-0000003F-00000000 [SL 00]
CPUID 00000004: 1C004122-01C0003F-0000003F-00000000 [SL 01]
CPUID 00000004: 1C004143-01C0003F-000001FF-00000000 [SL 02]
CPUID 00000004: 1C03C163-02C0003F-00003FFF-00000006 [SL 03]
CPUID 00000005: 00000040-00000040-00000003-00002120
CPUID 00000006: 00000075-00000002-00000009-00000000
CPUID 00000007: 00000000-021CBFBB-00000000-00000000
CPUID 00000008: 00000000-00000000-00000000-00000000
CPUID 00000009: 00000001-00000000-00000000-00000000
CPUID 0000000A: 07300403-00000000-00000000-00000603
CPUID 0000000B: 00000001-00000002-00000100-00000009 [SL 00]
CPUID 0000000B: 00000004-00000010-00000201-00000009 [SL 01]
CPUID 0000000C: 00000000-00000000-00000000-00000000
CPUID 0000000D: 00000007-00000340-00000340-00000000 [SL 00]
CPUID 0000000D: 00000001-00000000-00000000-00000000 [SL 01]
CPUID 0000000D: 00000100-00000240-00000000-00000000 [SL 02]
CPUID 0000000E: 00000000-00000000-00000000-00000000
CPUID 0000000F: 00000000-0000003F-00000000-00000002 [SL 00]
CPUID 0000000F: 00000000-00008000-0000003F-00000007 [SL 01]
CPUID 00000010: 00000000-00000002-00000000-00000000 [SL 00]
CPUID 00000010: 0000000B-00000C00-00000000-0000000F [SL 01]
CPUID 00000011: 00000000-00000000-00000000-00000000
CPUID 00000012: 00000000-00000000-00000000-00000000 [SL 00]
CPUID 00000012: 00000000-00000000-00000000-00000000 [SL 01]
CPUID 00000013: 00000000-00000000-00000000-00000000
CPUID 00000014: 00000000-00000001-00000001-00000000 [SL 00]
CPUID 80000000: 80000008-00000000-00000000-00000000
CPUID 80000001: 00000000-00000000-00000121-2C100000
CPUID 80000002: 65746E49-2952286C-6F655820-2952286E [Intel(R) Xeon(R)]
CPUID 80000003: 55504320-312D4420-20303435-2E322040 [ CPU D-1540 @ 2.]
CPUID 80000004: 48473030-0000007A-00000000-00000000 [00GHz]
CPUID 80000005: 00000000-00000000-00000000-00000000
CPUID 80000006: 00000000-00000000-01006040-00000000
CPUID 80000007: 00000000-00000000-00000000-00000100
CPUID 80000008: 0000302E-00000000-00000000-00000000

L1    Data Cache:    32 KB,  8-way Associative, 64-byte Line
L1  Instr. Cache:    32 KB,  8-way Associative, 64-byte Line
L2 Unified Cache:   256 KB,  8-way Associative, 64-byte Line
L3 Unified Cache:    12 MB, 12-way Associative, 64-byte Line

------[ Logical CPU #10 ]------

allcpu: Package 0 / Core 5 / Thread 0: Valid

CPUID 00000000: 00000014-756E6547-6C65746E-49656E69 [GenuineIntel]
CPUID 00000001: 00050662-0A100800-7FFEFBFF-BFEBFBFF
CPUID 00000002: 76036301-00F0B5FF-00000000-00C30000
CPUID 00000003: 00000000-00000000-00000000-00000000
CPUID 00000004: 1C004121-01C0003F-0000003F-00000000 [SL 00]
CPUID 00000004: 1C004122-01C0003F-0000003F-00000000 [SL 01]
CPUID 00000004: 1C004143-01C0003F-000001FF-00000000 [SL 02]
CPUID 00000004: 1C03C163-02C0003F-00003FFF-00000006 [SL 03]
CPUID 00000005: 00000040-00000040-00000003-00002120
CPUID 00000006: 00000075-00000002-00000009-00000000
CPUID 00000007: 00000000-021CBFBB-00000000-00000000
CPUID 00000008: 00000000-00000000-00000000-00000000
CPUID 00000009: 00000001-00000000-00000000-00000000
CPUID 0000000A: 07300403-00000000-00000000-00000603
CPUID 0000000B: 00000001-00000002-00000100-0000000A [SL 00]
CPUID 0000000B: 00000004-00000010-00000201-0000000A [SL 01]
CPUID 0000000C: 00000000-00000000-00000000-00000000
CPUID 0000000D: 00000007-00000340-00000340-00000000 [SL 00]
CPUID 0000000D: 00000001-00000000-00000000-00000000 [SL 01]
CPUID 0000000D: 00000100-00000240-00000000-00000000 [SL 02]
CPUID 0000000E: 00000000-00000000-00000000-00000000
CPUID 0000000F: 00000000-0000003F-00000000-00000002 [SL 00]
CPUID 0000000F: 00000000-00008000-0000003F-00000007 [SL 01]
CPUID 00000010: 00000000-00000002-00000000-00000000 [SL 00]
CPUID 00000010: 0000000B-00000C00-00000000-0000000F [SL 01]
CPUID 00000011: 00000000-00000000-00000000-00000000
CPUID 00000012: 00000000-00000000-00000000-00000000 [SL 00]
CPUID 00000012: 00000000-00000000-00000000-00000000 [SL 01]
CPUID 00000013: 00000000-00000000-00000000-00000000
CPUID 00000014: 00000000-00000001-00000001-00000000 [SL 00]
CPUID 80000000: 80000008-00000000-00000000-00000000
CPUID 80000001: 00000000-00000000-00000121-2C100000
CPUID 80000002: 65746E49-2952286C-6F655820-2952286E [Intel(R) Xeon(R)]
CPUID 80000003: 55504320-312D4420-20303435-2E322040 [ CPU D-1540 @ 2.]
CPUID 80000004: 48473030-0000007A-00000000-00000000 [00GHz]
CPUID 80000005: 00000000-00000000-00000000-00000000
CPUID 80000006: 00000000-00000000-01006040-00000000
CPUID 80000007: 00000000-00000000-00000000-00000100
CPUID 80000008: 0000302E-00000000-00000000-00000000

L1    Data Cache:    32 KB,  8-way Associative, 64-byte Line
L1  Instr. Cache:    32 KB,  8-way Associative, 64-byte Line
L2 Unified Cache:   256 KB,  8-way Associative, 64-byte Line
L3 Unified Cache:    12 MB, 12-way Associative, 64-byte Line

------[ Logical CPU #11 ]------

allcpu: Package 0 / Core 5 / Thread 1: Valid, Virtual

CPUID 00000000: 00000014-756E6547-6C65746E-49656E69 [GenuineIntel]
CPUID 00000001: 00050662-0B100800-7FFEFBFF-BFEBFBFF
CPUID 00000002: 76036301-00F0B5FF-00000000-00C30000
CPUID 00000003: 00000000-00000000-00000000-00000000
CPUID 00000004: 1C004121-01C0003F-0000003F-00000000 [SL 00]
CPUID 00000004: 1C004122-01C0003F-0000003F-00000000 [SL 01]
CPUID 00000004: 1C004143-01C0003F-000001FF-00000000 [SL 02]
CPUID 00000004: 1C03C163-02C0003F-00003FFF-00000006 [SL 03]
CPUID 00000005: 00000040-00000040-00000003-00002120
CPUID 00000006: 00000075-00000002-00000009-00000000
CPUID 00000007: 00000000-021CBFBB-00000000-00000000
CPUID 00000008: 00000000-00000000-00000000-00000000
CPUID 00000009: 00000001-00000000-00000000-00000000
CPUID 0000000A: 07300403-00000000-00000000-00000603
CPUID 0000000B: 00000001-00000002-00000100-0000000B [SL 00]
CPUID 0000000B: 00000004-00000010-00000201-0000000B [SL 01]
CPUID 0000000C: 00000000-00000000-00000000-00000000
CPUID 0000000D: 00000007-00000340-00000340-00000000 [SL 00]
CPUID 0000000D: 00000001-00000000-00000000-00000000 [SL 01]
CPUID 0000000D: 00000100-00000240-00000000-00000000 [SL 02]
CPUID 0000000E: 00000000-00000000-00000000-00000000
CPUID 0000000F: 00000000-0000003F-00000000-00000002 [SL 00]
CPUID 0000000F: 00000000-00008000-0000003F-00000007 [SL 01]
CPUID 00000010: 00000000-00000002-00000000-00000000 [SL 00]
CPUID 00000010: 0000000B-00000C00-00000000-0000000F [SL 01]
CPUID 00000011: 00000000-00000000-00000000-00000000
CPUID 00000012: 00000000-00000000-00000000-00000000 [SL 00]
CPUID 00000012: 00000000-00000000-00000000-00000000 [SL 01]
CPUID 00000013: 00000000-00000000-00000000-00000000
CPUID 00000014: 00000000-00000001-00000001-00000000 [SL 00]
CPUID 80000000: 80000008-00000000-00000000-00000000
CPUID 80000001: 00000000-00000000-00000121-2C100000
CPUID 80000002: 65746E49-2952286C-6F655820-2952286E [Intel(R) Xeon(R)]
CPUID 80000003: 55504320-312D4420-20303435-2E322040 [ CPU D-1540 @ 2.]
CPUID 80000004: 48473030-0000007A-00000000-00000000 [00GHz]
CPUID 80000005: 00000000-00000000-00000000-00000000
CPUID 80000006: 00000000-00000000-01006040-00000000
CPUID 80000007: 00000000-00000000-00000000-00000100
CPUID 80000008: 0000302E-00000000-00000000-00000000

L1    Data Cache:    32 KB,  8-way Associative, 64-byte Line
L1  Instr. Cache:    32 KB,  8-way Associative, 64-byte Line
L2 Unified Cache:   256 KB,  8-way Associative, 64-byte Line
L3 Unified Cache:    12 MB, 12-way Associative, 64-byte Line

------[ Logical CPU #12 ]------

allcpu: Package 0 / Core 6 / Thread 0: Valid

CPUID 00000000: 00000014-756E6547-6C65746E-49656E69 [GenuineIntel]
CPUID 00000001: 00050662-0C100800-7FFEFBFF-BFEBFBFF
CPUID 00000002: 76036301-00F0B5FF-00000000-00C30000
CPUID 00000003: 00000000-00000000-00000000-00000000
CPUID 00000004: 1C004121-01C0003F-0000003F-00000000 [SL 00]
CPUID 00000004: 1C004122-01C0003F-0000003F-00000000 [SL 01]
CPUID 00000004: 1C004143-01C0003F-000001FF-00000000 [SL 02]
CPUID 00000004: 1C03C163-02C0003F-00003FFF-00000006 [SL 03]
CPUID 00000005: 00000040-00000040-00000003-00002120
CPUID 00000006: 00000075-00000002-00000009-00000000
CPUID 00000007: 00000000-021CBFBB-00000000-00000000
CPUID 00000008: 00000000-00000000-00000000-00000000
CPUID 00000009: 00000001-00000000-00000000-00000000
CPUID 0000000A: 07300403-00000000-00000000-00000603
CPUID 0000000B: 00000001-00000002-00000100-0000000C [SL 00]
CPUID 0000000B: 00000004-00000010-00000201-0000000C [SL 01]
CPUID 0000000C: 00000000-00000000-00000000-00000000
CPUID 0000000D: 00000007-00000340-00000340-00000000 [SL 00]
CPUID 0000000D: 00000001-00000000-00000000-00000000 [SL 01]
CPUID 0000000D: 00000100-00000240-00000000-00000000 [SL 02]
CPUID 0000000E: 00000000-00000000-00000000-00000000
CPUID 0000000F: 00000000-0000003F-00000000-00000002 [SL 00]
CPUID 0000000F: 00000000-00008000-0000003F-00000007 [SL 01]
CPUID 00000010: 00000000-00000002-00000000-00000000 [SL 00]
CPUID 00000010: 0000000B-00000C00-00000000-0000000F [SL 01]
CPUID 00000011: 00000000-00000000-00000000-00000000
CPUID 00000012: 00000000-00000000-00000000-00000000 [SL 00]
CPUID 00000012: 00000000-00000000-00000000-00000000 [SL 01]
CPUID 00000013: 00000000-00000000-00000000-00000000
CPUID 00000014: 00000000-00000001-00000001-00000000 [SL 00]
CPUID 80000000: 80000008-00000000-00000000-00000000
CPUID 80000001: 00000000-00000000-00000121-2C100000
CPUID 80000002: 65746E49-2952286C-6F655820-2952286E [Intel(R) Xeon(R)]
CPUID 80000003: 55504320-312D4420-20303435-2E322040 [ CPU D-1540 @ 2.]
CPUID 80000004: 48473030-0000007A-00000000-00000000 [00GHz]
CPUID 80000005: 00000000-00000000-00000000-00000000
CPUID 80000006: 00000000-00000000-01006040-00000000
CPUID 80000007: 00000000-00000000-00000000-00000100
CPUID 80000008: 0000302E-00000000-00000000-00000000

L1    Data Cache:    32 KB,  8-way Associative, 64-byte Line
L1  Instr. Cache:    32 KB,  8-way Associative, 64-byte Line
L2 Unified Cache:   256 KB,  8-way Associative, 64-byte Line
L3 Unified Cache:    12 MB, 12-way Associative, 64-byte Line

------[ Logical CPU #13 ]------

allcpu: Package 0 / Core 6 / Thread 1: Valid, Virtual

CPUID 00000000: 00000014-756E6547-6C65746E-49656E69 [GenuineIntel]
CPUID 00000001: 00050662-0D100800-7FFEFBFF-BFEBFBFF
CPUID 00000002: 76036301-00F0B5FF-00000000-00C30000
CPUID 00000003: 00000000-00000000-00000000-00000000
CPUID 00000004: 1C004121-01C0003F-0000003F-00000000 [SL 00]
CPUID 00000004: 1C004122-01C0003F-0000003F-00000000 [SL 01]
CPUID 00000004: 1C004143-01C0003F-000001FF-00000000 [SL 02]
CPUID 00000004: 1C03C163-02C0003F-00003FFF-00000006 [SL 03]
CPUID 00000005: 00000040-00000040-00000003-00002120
CPUID 00000006: 00000075-00000002-00000009-00000000
CPUID 00000007: 00000000-021CBFBB-00000000-00000000
CPUID 00000008: 00000000-00000000-00000000-00000000
CPUID 00000009: 00000001-00000000-00000000-00000000
CPUID 0000000A: 07300403-00000000-00000000-00000603
CPUID 0000000B: 00000001-00000002-00000100-0000000D [SL 00]
CPUID 0000000B: 00000004-00000010-00000201-0000000D [SL 01]
CPUID 0000000C: 00000000-00000000-00000000-00000000
CPUID 0000000D: 00000007-00000340-00000340-00000000 [SL 00]
CPUID 0000000D: 00000001-00000000-00000000-00000000 [SL 01]
CPUID 0000000D: 00000100-00000240-00000000-00000000 [SL 02]
CPUID 0000000E: 00000000-00000000-00000000-00000000
CPUID 0000000F: 00000000-0000003F-00000000-00000002 [SL 00]
CPUID 0000000F: 00000000-00008000-0000003F-00000007 [SL 01]
CPUID 00000010: 00000000-00000002-00000000-00000000 [SL 00]
CPUID 00000010: 0000000B-00000C00-00000000-0000000F [SL 01]
CPUID 00000011: 00000000-00000000-00000000-00000000
CPUID 00000012: 00000000-00000000-00000000-00000000 [SL 00]
CPUID 00000012: 00000000-00000000-00000000-00000000 [SL 01]
CPUID 00000013: 00000000-00000000-00000000-00000000
CPUID 00000014: 00000000-00000001-00000001-00000000 [SL 00]
CPUID 80000000: 80000008-00000000-00000000-00000000
CPUID 80000001: 00000000-00000000-00000121-2C100000
CPUID 80000002: 65746E49-2952286C-6F655820-2952286E [Intel(R) Xeon(R)]
CPUID 80000003: 55504320-312D4420-20303435-2E322040 [ CPU D-1540 @ 2.]
CPUID 80000004: 48473030-0000007A-00000000-00000000 [00GHz]
CPUID 80000005: 00000000-00000000-00000000-00000000
CPUID 80000006: 00000000-00000000-01006040-00000000
CPUID 80000007: 00000000-00000000-00000000-00000100
CPUID 80000008: 0000302E-00000000-00000000-00000000

L1    Data Cache:    32 KB,  8-way Associative, 64-byte Line
L1  Instr. Cache:    32 KB,  8-way Associative, 64-byte Line
L2 Unified Cache:   256 KB,  8-way Associative, 64-byte Line
L3 Unified Cache:    12 MB, 12-way Associative, 64-byte Line

------[ Logical CPU #14 ]------

allcpu: Package 0 / Core 7 / Thread 0: Valid

CPUID 00000000: 00000014-756E6547-6C65746E-49656E69 [GenuineIntel]
CPUID 00000001: 00050662-0E100800-7FFEFBFF-BFEBFBFF
CPUID 00000002: 76036301-00F0B5FF-00000000-00C30000
CPUID 00000003: 00000000-00000000-00000000-00000000
CPUID 00000004: 1C004121-01C0003F-0000003F-00000000 [SL 00]
CPUID 00000004: 1C004122-01C0003F-0000003F-00000000 [SL 01]
CPUID 00000004: 1C004143-01C0003F-000001FF-00000000 [SL 02]
CPUID 00000004: 1C03C163-02C0003F-00003FFF-00000006 [SL 03]
CPUID 00000005: 00000040-00000040-00000003-00002120
CPUID 00000006: 00000075-00000002-00000009-00000000
CPUID 00000007: 00000000-021CBFBB-00000000-00000000
CPUID 00000008: 00000000-00000000-00000000-00000000
CPUID 00000009: 00000001-00000000-00000000-00000000
CPUID 0000000A: 07300403-00000000-00000000-00000603
CPUID 0000000B: 00000001-00000002-00000100-0000000E [SL 00]
CPUID 0000000B: 00000004-00000010-00000201-0000000E [SL 01]
CPUID 0000000C: 00000000-00000000-00000000-00000000
CPUID 0000000D: 00000007-00000340-00000340-00000000 [SL 00]
CPUID 0000000D: 00000001-00000000-00000000-00000000 [SL 01]
CPUID 0000000D: 00000100-00000240-00000000-00000000 [SL 02]
CPUID 0000000E: 00000000-00000000-00000000-00000000
CPUID 0000000F: 00000000-0000003F-00000000-00000002 [SL 00]
CPUID 0000000F: 00000000-00008000-0000003F-00000007 [SL 01]
CPUID 00000010: 00000000-00000002-00000000-00000000 [SL 00]
CPUID 00000010: 0000000B-00000C00-00000000-0000000F [SL 01]
CPUID 00000011: 00000000-00000000-00000000-00000000
CPUID 00000012: 00000000-00000000-00000000-00000000 [SL 00]
CPUID 00000012: 00000000-00000000-00000000-00000000 [SL 01]
CPUID 00000013: 00000000-00000000-00000000-00000000
CPUID 00000014: 00000000-00000001-00000001-00000000 [SL 00]
CPUID 80000000: 80000008-00000000-00000000-00000000
CPUID 80000001: 00000000-00000000-00000121-2C100000
CPUID 80000002: 65746E49-2952286C-6F655820-2952286E [Intel(R) Xeon(R)]
CPUID 80000003: 55504320-312D4420-20303435-2E322040 [ CPU D-1540 @ 2.]
CPUID 80000004: 48473030-0000007A-00000000-00000000 [00GHz]
CPUID 80000005: 00000000-00000000-00000000-00000000
CPUID 80000006: 00000000-00000000-01006040-00000000
CPUID 80000007: 00000000-00000000-00000000-00000100
CPUID 80000008: 0000302E-00000000-00000000-00000000

L1    Data Cache:    32 KB,  8-way Associative, 64-byte Line
L1  Instr. Cache:    32 KB,  8-way Associative, 64-byte Line
L2 Unified Cache:   256 KB,  8-way Associative, 64-byte Line
L3 Unified Cache:    12 MB, 12-way Associative, 64-byte Line

------[ Logical CPU #15 ]------

allcpu: Package 0 / Core 7 / Thread 1: Valid, Virtual

CPUID 00000000: 00000014-756E6547-6C65746E-49656E69 [GenuineIntel]
CPUID 00000001: 00050662-0F100800-7FFEFBFF-BFEBFBFF
CPUID 00000002: 76036301-00F0B5FF-00000000-00C30000
CPUID 00000003: 00000000-00000000-00000000-00000000
CPUID 00000004: 1C004121-01C0003F-0000003F-00000000 [SL 00]
CPUID 00000004: 1C004122-01C0003F-0000003F-00000000 [SL 01]
CPUID 00000004: 1C004143-01C0003F-000001FF-00000000 [SL 02]
CPUID 00000004: 1C03C163-02C0003F-00003FFF-00000006 [SL 03]
CPUID 00000005: 00000040-00000040-00000003-00002120
CPUID 00000006: 00000075-00000002-00000009-00000000
CPUID 00000007: 00000000-021CBFBB-00000000-00000000
CPUID 00000008: 00000000-00000000-00000000-00000000
CPUID 00000009: 00000001-00000000-00000000-00000000
CPUID 0000000A: 07300403-00000000-00000000-00000603
CPUID 0000000B: 00000001-00000002-00000100-0000000F [SL 00]
CPUID 0000000B: 00000004-00000010-00000201-0000000F [SL 01]
CPUID 0000000C: 00000000-00000000-00000000-00000000
CPUID 0000000D: 00000007-00000340-00000340-00000000 [SL 00]
CPUID 0000000D: 00000001-00000000-00000000-00000000 [SL 01]
CPUID 0000000D: 00000100-00000240-00000000-00000000 [SL 02]
CPUID 0000000E: 00000000-00000000-00000000-00000000
CPUID 0000000F: 00000000-0000003F-00000000-00000002 [SL 00]
CPUID 0000000F: 00000000-00008000-0000003F-00000007 [SL 01]
CPUID 00000010: 00000000-00000002-00000000-00000000 [SL 00]
CPUID 00000010: 0000000B-00000C00-00000000-0000000F [SL 01]
CPUID 00000011: 00000000-00000000-00000000-00000000
CPUID 00000012: 00000000-00000000-00000000-00000000 [SL 00]
CPUID 00000012: 00000000-00000000-00000000-00000000 [SL 01]
CPUID 00000013: 00000000-00000000-00000000-00000000
CPUID 00000014: 00000000-00000001-00000001-00000000 [SL 00]
CPUID 80000000: 80000008-00000000-00000000-00000000
CPUID 80000001: 00000000-00000000-00000121-2C100000
CPUID 80000002: 65746E49-2952286C-6F655820-2952286E [Intel(R) Xeon(R)]
CPUID 80000003: 55504320-312D4420-20303435-2E322040 [ CPU D-1540 @ 2.]
CPUID 80000004: 48473030-0000007A-00000000-00000000 [00GHz]
CPUID 80000005: 00000000-00000000-00000000-00000000
CPUID 80000006: 00000000-00000000-01006040-00000000
CPUID 80000007: 00000000-00000000-00000000-00000100
CPUID 80000008: 0000302E-00000000-00000000-00000000

L1    Data Cache:    32 KB,  8-way Associative, 64-byte Line
L1  Instr. Cache:    32 KB,  8-way Associative, 64-byte Line
L2 Unified Cache:   256 KB,  8-way Associative, 64-byte Line
L3 Unified Cache:    12 MB, 12-way Associative, 64-byte Line

------[ All CPUs ]------

CPU   0: APICID   0 / Package 0 / Core  0 / Thread 0: Valid
CPU   1: APICID   1 / Package 0 / Core  0 / Thread 1: Valid, Virtual
CPU   2: APICID   2 / Package 0 / Core  1 / Thread 0: Valid
CPU   3: APICID   3 / Package 0 / Core  1 / Thread 1: Valid, Virtual
CPU   4: APICID   4 / Package 0 / Core  2 / Thread 0: Valid
CPU   5: APICID   5 / Package 0 / Core  2 / Thread 1: Valid, Virtual
CPU   6: APICID   6 / Package 0 / Core  3 / Thread 0: Valid
CPU   7: APICID   7 / Package 0 / Core  3 / Thread 1: Valid, Virtual
CPU   8: APICID   8 / Package 0 / Core  4 / Thread 0: Valid
CPU   9: APICID   9 / Package 0 / Core  4 / Thread 1: Valid, Virtual
CPU  10: APICID  10 / Package 0 / Core  5 / Thread 0: Valid
CPU  11: APICID  11 / Package 0 / Core  5 / Thread 1: Valid, Virtual
CPU  12: APICID  12 / Package 0 / Core  6 / Thread 0: Valid
CPU  13: APICID  13 / Package 0 / Core  6 / Thread 1: Valid, Virtual
CPU  14: APICID  14 / Package 0 / Core  7 / Thread 0: Valid
CPU  15: APICID  15 / Package 0 / Core  7 / Thread 1: Valid, Virtual

------[ MSR Registers ]------

MSR 00000017: 0010-0000-0000-0000 [PlatID = 4]
MSR 0000001B: 0000-0000-FEE0-0900
MSR 00000035: 0000-0000-0008-0010
MSR 0000008B: 0000-0007-0000-0000
MSR 000000CE: 0008-0833-F281-1400 [eD = 0]
MSR 000000E7: 0000-0000-000B-B28C [S200]
MSR 000000E7: 0000-0000-0000-B144 [S200]
MSR 000000E7: 0000-0000-0000-A84A
MSR 000000E8: 0000-0000-0000-C5A6 [S200]
MSR 000000E8: 0000-0000-0000-784F [S200]
MSR 000000E8: 0000-0000-0000-C5BD
MSR 00000194: 0000-0000-0000-0000
MSR 00000198: 0000-1C11-0000-1400 [S200]
MSR 00000198: 0000-1C11-0000-1400 [S200]
MSR 00000198: 0000-1C11-0000-1400
MSR 00000199: 0000-0000-0000-1400
MSR 0000019A: 0000-0000-0000-0000
MSR 0000019B: 0000-0000-0000-0000
MSR 0000019C: 0000-0000-8800-0000 [S200]
MSR 0000019C: 0000-0000-8800-0000 [S200]
MSR 0000019C: 0000-0000-8800-0000
MSR 0000019D: 0000-0000-0000-0000
MSR 000001A0: 0000-0040-0084-0089
MSR 000001A2: 0000-0000-005C-0A00
MSR 000001A4: 0000-0000-0000-0000
MSR 000001AA: 0000-0000-0040-2000
MSR 000001AC: 0000-0000-0000-0000
MSR 000001AD: 1919-1919-1A1A-1A1A
MSR 000001AE: 1919-1919-1919-1919
MSR 000001AF: 1919-1919-1919-1919
MSR 000001B0: 0000-0000-0000-0000
MSR 000001B1: 0000-0000-8800-0000
MSR 000001B2: 0000-0000-0000-0000
MSR 000001FC: 0000-0000-2924-005B
MSR 00000300: 0000-0000-8000-FF00
MSR 00000480: 00DA-0400-0000-0012
MSR 00000481: 0000-00FF-0000-0016
MSR 00000482: FFF9-FFFE-0401-E172
MSR 00000483: 007F-FFFF-0003-6DFF
MSR 00000484: 0000-FFFF-0000-11FF
MSR 00000485: 0000-0000-3004-81E5
MSR 00000486: 0000-0000-8000-0021
MSR 00000487: 0000-0000-FFFF-FFFF
MSR 00000488: 0000-0000-0000-2000
MSR 00000489: 0000-0000-0037-67FF
MSR 0000048A: 0000-0000-0000-002A
MSR 0000048B: 0007-7FFF-0000-0000
MSR 0000048C: 0000-0F01-0633-4141
MSR 0000048D: 0000-00FF-0000-0016
MSR 0000048E: FFF9-FFFE-0400-6172
MSR 0000048F: 007F-FFFF-0003-6DFB
MSR 00000490: 0000-FFFF-0000-11FB
MSR 00000601: 0000-0000-8000-01F0
MSR 00000602: < FAILED >
MSR 00000603: 0016-0000-0026-2626
MSR 00000604: < FAILED >
MSR 00000606: 0000-0000-000A-0E03
MSR 0000060A: 0000-0000-0000-0000
MSR 0000060B: 0000-0000-0000-0000
MSR 0000060C: 0000-0000-0000-0000
MSR 0000060D: 0000-0007-B452-5254
MSR 00000610: 0007-81B0-0015-8168
MSR 00000611: 0000-0000-0322-89E2 [S200]
MSR 00000611: 0000-0000-0323-0677 [S200]
MSR 00000611: 0000-0000-0323-739E
MSR 00000613: 0000-0000-0000-0000
MSR 00000614: 002F-02D0-00E0-0168
MSR 00000618: 0000-0000-0000-0000
MSR 00000619: 0000-0000-0864-1A41 [S200]
MSR 00000619: 0000-0000-0864-83E3 [S200]
MSR 00000619: 0000-0000-0864-EAC0
MSR 0000061B: 0000-0000-0000-0029
MSR 0000061C: 002F-00B2-001B-00AA
MSR 0000061E: < FAILED >
MSR 00000620: 0000-0000-0000-0C13
MSR 00000621: 0000-0000-0000-000C
MSR 00000638: 0000-0000-0000-0000
MSR 00000639: 0000-0000-0000-0000 [S200]
MSR 00000639: 0000-0000-0000-0000 [S200]
MSR 00000639: 0000-0000-0000-0000
MSR 0000063A: < FAILED >
MSR 0000063B: < FAILED >
MSR 00000640: < FAILED >
MSR 00000641: < FAILED >
MSR 00000642: < FAILED >
MSR 00000648: 0000-0000-0000-0014
MSR 00000649: 0070-02D0-000F-0168
MSR 0000064A: 0070-02D0-0000-0000
MSR 0000064B: 0000-0000-8000-0000
MSR 0000064C: 0000-0000-0000-0014
MSR 00000690: 0000-0000-0000-0000
MSR 000006B0: < FAILED >
MSR 000006B1: 0000-0000-0000-0000
