------[ Versions ]------

Program Version : EVEREST v5.50.2119 Beta
BenchDLL Version: 2.5.292.0

------[ CPU Info ]------

CPU Type           : DualCore Intel Atom 330, 1600 MHz (12 x 133)
CPU Alias          : Diamondville-DC
CPU Platform       : FCBGA8
CPU Stepping       : C0
Instruction Set    : x86, x86-64, MMX, SSE, SSE2, SSE3, SSSE3
CPUID Manufacturer : GenuineIntel
CPUID CPU Name     : Intel(R) Atom(TM) CPU 330 @ 1.60GHz
CPUID Revision     : 000106C2h
IA Brand ID        : 00h  (Unknown)
Platform ID        : E2h  (FCBGA8)

------[ Logical CPU #0 ]------

allcpu: Package 0 / Core 0 / Thread 0: Valid

CPUID 00000000: 0000000A-756E6547-6C65746E-49656E69
CPUID 00000001: 000106C2-00040800-0040E31D-BFE9FBFF
CPUID 00000002: 4FBA5901-0E3080C0-00000000-00000000
CPUID 00000003: 00000000-00000000-00000000-00000000
CPUID 00000004: 04004121-0140003F-0000003F-00000001
CPUID 00000004: 04004122-01C0003F-0000003F-00000001
CPUID 00000004: 04004143-01C0003F-000003FF-00000001
CPUID 00000005: 00000040-00000040-00000003-00000010
CPUID 00000006: 00000001-00000002-00000001-00000000
CPUID 00000007: 00000000-00000000-00000000-00000000
CPUID 00000008: 00000000-00000000-00000000-00000000
CPUID 00000009: 00000000-00000000-00000000-00000000
CPUID 0000000A: 07280203-00000000-00000000-00002501
CPUID 80000000: 80000008-00000000-00000000-00000000
CPUID 80000001: 00000000-00000000-00000001-20100000
CPUID 80000002: 20202020-20202020-746E4920-52286C65
CPUID 80000003: 74412029-54286D6F-4320294D-20205550
CPUID 80000004: 20303333-20402020-30362E31-007A4847
CPUID 80000005: 00000000-00000000-00000000-00000000
CPUID 80000006: 00000000-00000000-02008040-00000000
CPUID 80000007: 00000000-00000000-00000000-00000000
CPUID 80000008: 00003020-00000000-00000000-00000000

L1    Data Cache:     24 KB,  6-way Associative, 64-byte Line
L1  Instr. Cache:     32 KB,  8-way Associative, 64-byte Line
L2 Unified Cache:    512 KB,  8-way Associative, 64-byte Line

------[ Logical CPU #1 ]------

allcpu: Package 0 / Core 1 / Thread 0: Valid

CPUID 00000000: 0000000A-756E6547-6C65746E-49656E69
CPUID 00000001: 000106C2-02040800-0040E31D-BFE9FBFF
CPUID 00000002: 4FBA5901-0E3080C0-00000000-00000000
CPUID 00000003: 00000000-00000000-00000000-00000000
CPUID 00000004: 04004121-0140003F-0000003F-00000001
CPUID 00000004: 04004122-01C0003F-0000003F-00000001
CPUID 00000004: 04004143-01C0003F-000003FF-00000001
CPUID 00000005: 00000040-00000040-00000003-00000010
CPUID 00000006: 00000001-00000002-00000001-00000000
CPUID 00000007: 00000000-00000000-00000000-00000000
CPUID 00000008: 00000000-00000000-00000000-00000000
CPUID 00000009: 00000000-00000000-00000000-00000000
CPUID 0000000A: 07280203-00000000-00000000-00002501
CPUID 80000000: 80000008-00000000-00000000-00000000
CPUID 80000001: 00000000-00000000-00000001-20100000
CPUID 80000002: 20202020-20202020-746E4920-52286C65
CPUID 80000003: 74412029-54286D6F-4320294D-20205550
CPUID 80000004: 20303333-20402020-30362E31-007A4847
CPUID 80000005: 00000000-00000000-00000000-00000000
CPUID 80000006: 00000000-00000000-02008040-00000000
CPUID 80000007: 00000000-00000000-00000000-00000000
CPUID 80000008: 00003020-00000000-00000000-00000000

L1    Data Cache:     24 KB,  6-way Associative, 64-byte Line
L1  Instr. Cache:     32 KB,  8-way Associative, 64-byte Line
L2 Unified Cache:    512 KB,  8-way Associative, 64-byte Line

------[ Logical CPU #2 ]------

allcpu: Package 0 / Core 0 / Thread 1: Valid, Virtual

CPUID 00000000: 0000000A-756E6547-6C65746E-49656E69
CPUID 00000001: 000106C2-01040800-0040E31D-BFE9FBFF
CPUID 00000002: 4FBA5901-0E3080C0-00000000-00000000
CPUID 00000003: 00000000-00000000-00000000-00000000
CPUID 00000004: 04004121-0140003F-0000003F-00000001
CPUID 00000004: 04004122-01C0003F-0000003F-00000001
CPUID 00000004: 04004143-01C0003F-000003FF-00000001
CPUID 00000005: 00000040-00000040-00000003-00000010
CPUID 00000006: 00000001-00000002-00000001-00000000
CPUID 00000007: 00000000-00000000-00000000-00000000
CPUID 00000008: 00000000-00000000-00000000-00000000
CPUID 00000009: 00000000-00000000-00000000-00000000
CPUID 0000000A: 07280203-00000000-00000000-00002501
CPUID 80000000: 80000008-00000000-00000000-00000000
CPUID 80000001: 00000000-00000000-00000001-20100000
CPUID 80000002: 20202020-20202020-746E4920-52286C65
CPUID 80000003: 74412029-54286D6F-4320294D-20205550
CPUID 80000004: 20303333-20402020-30362E31-007A4847
CPUID 80000005: 00000000-00000000-00000000-00000000
CPUID 80000006: 00000000-00000000-02008040-00000000
CPUID 80000007: 00000000-00000000-00000000-00000000
CPUID 80000008: 00003020-00000000-00000000-00000000

L1    Data Cache:     24 KB,  6-way Associative, 64-byte Line
L1  Instr. Cache:     32 KB,  8-way Associative, 64-byte Line
L2 Unified Cache:    512 KB,  8-way Associative, 64-byte Line

------[ Logical CPU #3 ]------

allcpu: Package 0 / Core 1 / Thread 1: Valid, Virtual

CPUID 00000000: 0000000A-756E6547-6C65746E-49656E69
CPUID 00000001: 000106C2-03040800-0040E31D-BFE9FBFF
CPUID 00000002: 4FBA5901-0E3080C0-00000000-00000000
CPUID 00000003: 00000000-00000000-00000000-00000000
CPUID 00000004: 04004121-0140003F-0000003F-00000001
CPUID 00000004: 04004122-01C0003F-0000003F-00000001
CPUID 00000004: 04004143-01C0003F-000003FF-00000001
CPUID 00000005: 00000040-00000040-00000003-00000010
CPUID 00000006: 00000001-00000002-00000001-00000000
CPUID 00000007: 00000000-00000000-00000000-00000000
CPUID 00000008: 00000000-00000000-00000000-00000000
CPUID 00000009: 00000000-00000000-00000000-00000000
CPUID 0000000A: 07280203-00000000-00000000-00002501
CPUID 80000000: 80000008-00000000-00000000-00000000
CPUID 80000001: 00000000-00000000-00000001-20100000
CPUID 80000002: 20202020-20202020-746E4920-52286C65
CPUID 80000003: 74412029-54286D6F-4320294D-20205550
CPUID 80000004: 20303333-20402020-30362E31-007A4847
CPUID 80000005: 00000000-00000000-00000000-00000000
CPUID 80000006: 00000000-00000000-02008040-00000000
CPUID 80000007: 00000000-00000000-00000000-00000000
CPUID 80000008: 00003020-00000000-00000000-00000000

L1    Data Cache:     24 KB,  6-way Associative, 64-byte Line
L1  Instr. Cache:     32 KB,  8-way Associative, 64-byte Line
L2 Unified Cache:    512 KB,  8-way Associative, 64-byte Line

------[ All CPUs ]------

CPU   0: APICID   0 / Package 0 / Core  0 / Thread 0: Valid
CPU   1: APICID   2 / Package 0 / Core  1 / Thread 0: Valid
CPU   2: APICID   1 / Package 0 / Core  0 / Thread 1: Valid, Virtual
CPU   3: APICID   3 / Package 0 / Core  1 / Thread 1: Valid, Virtual

------[ MSR Registers ]------

MSR 00000017: 000C-0000-8836-AC1B [PlatID = 3]
MSR 0000001B: 0000-0000-FEE0-0900
MSR 0000002A: 0000-0000-C308-1400
MSR 0000008B: 0000-0219-0000-0000
MSR 000000CD: 0000-0000-0000-0101
MSR 000000CE: 1B1B-0C00-4E4E-0000
MSR 000000E7: 0000-003C-215A-8784
MSR 000000E8: 0000-0040-5331-5A68
MSR 000000EE: 0000-0000-0338-4103
MSR 0000011E: 0000-0000-7E00-011F
MSR 00000198: 0C1B-0C1B-0600-0C1B
MSR 00000199: 0000-0000-0000-0C1B
MSR 0000019A: 0000-0000-0000-0002
MSR 0000019B: 0000-0000-0000-0000
MSR 0000019C: 0000-0000-883F-0000
MSR 0000019D: 0000-0000-0000-061B
MSR 000001A0: 0000-0000-6084-0488

PerformanceFrequency = 3579545

Tjmax Temperature = 125 Celsius
