------[ Versions ]------

Program Version : EVEREST v4.60.1628 Beta
BenchDLL Version: 2.4.257.0

------[ CPU Info ]------

CPU Type           : DualCore Intel Pentium Extreme Edition 955, 3466 MHz (13 x 267)
CPU Alias          : Presler
CPU Platform       : LGA775
CPU Stepping       : B1
Instruction Set    : x86, x86-64, MMX, SSE, SSE2, SSE3
CPUID Manufacturer : GenuineIntel
CPUID CPU Name     : Genuine Intel(R) CPU 3.46GHz
CPUID Revision     : 00000F62h
IA Brand ID        : 00h  (Unknown)
Platform ID        : 2Ah  (LGA775)

------[ Logical CPU #0 ]------

allcpu: Valid

CPUID 00000000: 00000006-756E6547-6C65746E-49656E69
CPUID 00000001: 00000F62-00040800-0000E43D-BFEBFBFF
CPUID 00000002: 605B5001-00000000-00000000-007D7040
CPUID 00000003: 00000000-00000000-00000000-00000000
CPUID 00000004: 04004121-01C0003F-0000001F-00000000
CPUID 00000004: 04004143-01C0103F-000007FF-00000000
CPUID 00000005: 00000040-00000040-00000000-00000000
CPUID 00000006: 00000000-00000000-00000000-00000000
CPUID 80000000: 80000008-00000000-00000000-00000000
CPUID 80000001: 00000000-00000000-00000001-20100000
CPUID 80000002: 20202020-20202020-20202020-20202020
CPUID 80000003: 47202020-69756E65-4920656E-6C65746E
CPUID 80000004: 20295228-20555043-36342E33-007A4847
CPUID 80000005: 00000000-00000000-00000000-00000000
CPUID 80000006: 00000000-00000000-08006040-00000000
CPUID 80000007: 00000000-00000000-00000000-00000000
CPUID 80000008: 00003024-00000000-00000000-00000000

L1    Data Cache:     16 KB,  8-way Associative, 64-byte Line
L2 Unified Cache:   2048 KB,  8-way Associative, 64-byte Line

------[ Logical CPU #1 ]------

allcpu: Valid

CPUID 00000000: 00000006-756E6547-6C65746E-49656E69
CPUID 00000001: 00000F62-02040800-0000E43D-BFEBFBFF
CPUID 00000002: 605B5001-00000000-00000000-007D7040
CPUID 00000003: 00000000-00000000-00000000-00000000
CPUID 00000004: 04004121-01C0003F-0000001F-00000000
CPUID 00000004: 04004143-01C0103F-000007FF-00000000
CPUID 00000005: 00000040-00000040-00000000-00000000
CPUID 00000006: 00000000-00000000-00000000-00000000
CPUID 80000000: 80000008-00000000-00000000-00000000
CPUID 80000001: 00000000-00000000-00000001-20100000
CPUID 80000002: 20202020-20202020-20202020-20202020
CPUID 80000003: 47202020-69756E65-4920656E-6C65746E
CPUID 80000004: 20295228-20555043-36342E33-007A4847
CPUID 80000005: 00000000-00000000-00000000-00000000
CPUID 80000006: 00000000-00000000-08006040-00000000
CPUID 80000007: 00000000-00000000-00000000-00000000
CPUID 80000008: 00003024-00000000-00000000-00000000

L1    Data Cache:     16 KB,  8-way Associative, 64-byte Line
L2 Unified Cache:   2048 KB,  8-way Associative, 64-byte Line

------[ Logical CPU #2 ]------

allcpu: Valid, Virtual

CPUID 00000000: 00000006-756E6547-6C65746E-49656E69
CPUID 00000001: 00000F62-01040800-0000E43D-BFEBFBFF
CPUID 00000002: 605B5001-00000000-00000000-007D7040
CPUID 00000003: 00000000-00000000-00000000-00000000
CPUID 00000004: 04004121-01C0003F-0000001F-00000000
CPUID 00000004: 04004143-01C0103F-000007FF-00000000
CPUID 00000005: 00000040-00000040-00000000-00000000
CPUID 00000006: 00000000-00000000-00000000-00000000
CPUID 80000000: 80000008-00000000-00000000-00000000
CPUID 80000001: 00000000-00000000-00000001-20100000
CPUID 80000002: 20202020-20202020-20202020-20202020
CPUID 80000003: 47202020-69756E65-4920656E-6C65746E
CPUID 80000004: 20295228-20555043-36342E33-007A4847
CPUID 80000005: 00000000-00000000-00000000-00000000
CPUID 80000006: 00000000-00000000-08006040-00000000
CPUID 80000007: 00000000-00000000-00000000-00000000
CPUID 80000008: 00003024-00000000-00000000-00000000

L1    Data Cache:     16 KB,  8-way Associative, 64-byte Line
L2 Unified Cache:   2048 KB,  8-way Associative, 64-byte Line

------[ Logical CPU #3 ]------

allcpu: Valid, Virtual

CPUID 00000000: 00000006-756E6547-6C65746E-49656E69
CPUID 00000001: 00000F62-03040800-0000E43D-BFEBFBFF
CPUID 00000002: 605B5001-00000000-00000000-007D7040
CPUID 00000003: 00000000-00000000-00000000-00000000
CPUID 00000004: 04004121-01C0003F-0000001F-00000000
CPUID 00000004: 04004143-01C0103F-000007FF-00000000
CPUID 00000005: 00000040-00000040-00000000-00000000
CPUID 00000006: 00000000-00000000-00000000-00000000
CPUID 80000000: 80000008-00000000-00000000-00000000
CPUID 80000001: 00000000-00000000-00000001-20100000
CPUID 80000002: 20202020-20202020-20202020-20202020
CPUID 80000003: 47202020-69756E65-4920656E-6C65746E
CPUID 80000004: 20295228-20555043-36342E33-007A4847
CPUID 80000005: 00000000-00000000-00000000-00000000
CPUID 80000006: 00000000-00000000-08006040-00000000
CPUID 80000007: 00000000-00000000-00000000-00000000
CPUID 80000008: 00003024-00000000-00000000-00000000

L1    Data Cache:     16 KB,  8-way Associative, 64-byte Line
L2 Unified Cache:   2048 KB,  8-way Associative, 64-byte Line

------[ MSR Registers ]------

MSR 00000017: 0008-0000-0000-0000 [PlatID = 2]
MSR 0000001B: 0000-0000-FEE0-0900
MSR 0000002A: 0000-0000-0000-0000
MSR 0000002C: 0000-0000-0D00-303C
MSR 0000008B: 0000-000F-0000-0000
MSR 00000198: 0000-0D26-8000-0D26
MSR 00000199: 0000-0000-0000-0D26
MSR 0000019A: 0000-0000-0000-0000
MSR 0000019B: 0000-0000-0000-0000
MSR 0000019C: 0000-0000-0000-0000
MSR 0000019D: 0000-0000-0000-0C23
MSR 000001A0: 0000-0000-20A4-0489

PerformanceFrequency = 3466830000

Tjmax Temperature = 0 Celsius
