CPU#000 AffMask: 0x0000000000000001 
CPUID 00000000: 00000016-756E6547-6C65746E-49656E69 [GenuineIntel]
CPUID 00000001: 000906E9-00100800-7FFAFBBF-BFEBFBFF 
CPUID 00000002: 76036301-00F0B5FF-00000000-00C30000 
CPUID 00000003: 00000000-00000000-00000000-00000000 
CPUID 00000004: 1C004121-01C0003F-0000003F-00000000 [SL 00]
CPUID 00000004: 1C004122-01C0003F-0000003F-00000000 [SL 01]
CPUID 00000004: 1C004143-00C0003F-000003FF-00000000 [SL 02]
CPUID 00000004: 1C03C163-03C0003F-00001FFF-00000006 [SL 03]
CPUID 00000005: 00000040-00000040-00000003-00142120 
CPUID 00000006: 000027F7-00000002-00000009-00000000 
CPUID 00000007: 00000000-029C6FBB-00000000-00000000 [SL 00]
CPUID 00000008: 00000000-00000000-00000000-00000000 
CPUID 00000009: 00000000-00000000-00000000-00000000 
CPUID 0000000A: 07300404-00000000-00000000-00000603 
CPUID 0000000B: 00000001-00000002-00000100-00000000 [SL 00]
CPUID 0000000B: 00000004-00000008-00000201-00000000 [SL 01]
CPUID 0000000C: 00000000-00000000-00000000-00000000 
CPUID 0000000D: 0000001F-00000440-00000440-00000000 [SL 00]
CPUID 0000000D: 0000000F-000003C0-00000100-00000000 [SL 01]
CPUID 0000000D: 00000100-00000240-00000000-00000000 [SL 02]
CPUID 0000000D: 00000040-000003C0-00000000-00000000 [SL 03]
CPUID 0000000D: 00000040-00000400-00000000-00000000 [SL 04]
CPUID 0000000E: 00000000-00000000-00000000-00000000 
CPUID 0000000F: 00000000-00000000-00000000-00000000 [SL 00]
CPUID 00000010: 00000000-00000000-00000000-00000000 [SL 00]
CPUID 00000011: 00000000-00000000-00000000-00000000 
CPUID 00000012: 00000000-00000000-00000000-00000000 [SL 00]
CPUID 00000013: 00000000-00000000-00000000-00000000 
CPUID 00000014: 00000001-0000000F-00000007-00000000 [SL 00]
CPUID 00000014: 00000000-00000000-00000000-00000000 [SL 01]
CPUID 00000015: 00000002-00000156-00000000-00000000 [171 / 0]
CPUID 00000016: 000010CC-00001194-00000064-00000000 [4300 / 4500 / 100]
CPUID 80000000: 80000008-00000000-00000000-00000000 
CPUID 80000001: 00000000-00000000-00000121-2C100800 
CPUID 80000002: 65746E49-2952286C-726F4320-4D542865 [Intel(R) Core(TM]
CPUID 80000003: 37692029-3437372D-43205830-40205550 [) i7-7740X CPU @]
CPUID 80000004: 332E3420-7A484730-00000000-00000000 [ 4.30GHz]
CPUID 80000005: 00000000-00000000-00000000-00000000 
CPUID 80000006: 00000000-00000000-01006040-00000000 
CPUID 80000007: 00000000-00000000-00000000-00000100 
CPUID 80000008: 00003027-00000000-00000000-00000000 

CPU#001 AffMask: 0x0000000000000002 
CPUID 00000000: 00000016-756E6547-6C65746E-49656E69 [GenuineIntel]
CPUID 00000001: 000906E9-01100800-7FFAFBBF-BFEBFBFF 
CPUID 00000002: 76036301-00F0B5FF-00000000-00C30000 
CPUID 00000003: 00000000-00000000-00000000-00000000 
CPUID 00000004: 1C004121-01C0003F-0000003F-00000000 [SL 00]
CPUID 00000004: 1C004122-01C0003F-0000003F-00000000 [SL 01]
CPUID 00000004: 1C004143-00C0003F-000003FF-00000000 [SL 02]
CPUID 00000004: 1C03C163-03C0003F-00001FFF-00000006 [SL 03]
CPUID 00000005: 00000040-00000040-00000003-00142120 
CPUID 00000006: 000027F7-00000002-00000009-00000000 
CPUID 00000007: 00000000-029C6FBB-00000000-00000000 [SL 00]
CPUID 00000008: 00000000-00000000-00000000-00000000 
CPUID 00000009: 00000000-00000000-00000000-00000000 
CPUID 0000000A: 07300404-00000000-00000000-00000603 
CPUID 0000000B: 00000001-00000002-00000100-00000001 [SL 00]
CPUID 0000000B: 00000004-00000008-00000201-00000001 [SL 01]
CPUID 0000000C: 00000000-00000000-00000000-00000000 
CPUID 0000000D: 0000001F-00000440-00000440-00000000 [SL 00]
CPUID 0000000D: 0000000F-000003C0-00000100-00000000 [SL 01]
CPUID 0000000D: 00000100-00000240-00000000-00000000 [SL 02]
CPUID 0000000D: 00000040-000003C0-00000000-00000000 [SL 03]
CPUID 0000000D: 00000040-00000400-00000000-00000000 [SL 04]
CPUID 0000000E: 00000000-00000000-00000000-00000000 
CPUID 0000000F: 00000000-00000000-00000000-00000000 [SL 00]
CPUID 00000010: 00000000-00000000-00000000-00000000 [SL 00]
CPUID 00000011: 00000000-00000000-00000000-00000000 
CPUID 00000012: 00000000-00000000-00000000-00000000 [SL 00]
CPUID 00000013: 00000000-00000000-00000000-00000000 
CPUID 00000014: 00000001-0000000F-00000007-00000000 [SL 00]
CPUID 00000014: 00000000-00000000-00000000-00000000 [SL 01]
CPUID 00000015: 00000002-00000156-00000000-00000000 [171 / 0]
CPUID 00000016: 000010CC-00001194-00000064-00000000 [4300 / 4500 / 100]
CPUID 80000000: 80000008-00000000-00000000-00000000 
CPUID 80000001: 00000000-00000000-00000121-2C100800 
CPUID 80000002: 65746E49-2952286C-726F4320-4D542865 [Intel(R) Core(TM]
CPUID 80000003: 37692029-3437372D-43205830-40205550 [) i7-7740X CPU @]
CPUID 80000004: 332E3420-7A484730-00000000-00000000 [ 4.30GHz]
CPUID 80000005: 00000000-00000000-00000000-00000000 
CPUID 80000006: 00000000-00000000-01006040-00000000 
CPUID 80000007: 00000000-00000000-00000000-00000100 
CPUID 80000008: 00003027-00000000-00000000-00000000 

CPU#002 AffMask: 0x0000000000000004 
CPUID 00000000: 00000016-756E6547-6C65746E-49656E69 [GenuineIntel]
CPUID 00000001: 000906E9-02100800-7FFAFBBF-BFEBFBFF 
CPUID 00000002: 76036301-00F0B5FF-00000000-00C30000 
CPUID 00000003: 00000000-00000000-00000000-00000000 
CPUID 00000004: 1C004121-01C0003F-0000003F-00000000 [SL 00]
CPUID 00000004: 1C004122-01C0003F-0000003F-00000000 [SL 01]
CPUID 00000004: 1C004143-00C0003F-000003FF-00000000 [SL 02]
CPUID 00000004: 1C03C163-03C0003F-00001FFF-00000006 [SL 03]
CPUID 00000005: 00000040-00000040-00000003-00142120 
CPUID 00000006: 000027F7-00000002-00000009-00000000 
CPUID 00000007: 00000000-029C6FBB-00000000-00000000 [SL 00]
CPUID 00000008: 00000000-00000000-00000000-00000000 
CPUID 00000009: 00000000-00000000-00000000-00000000 
CPUID 0000000A: 07300404-00000000-00000000-00000603 
CPUID 0000000B: 00000001-00000002-00000100-00000002 [SL 00]
CPUID 0000000B: 00000004-00000008-00000201-00000002 [SL 01]
CPUID 0000000C: 00000000-00000000-00000000-00000000 
CPUID 0000000D: 0000001F-00000440-00000440-00000000 [SL 00]
CPUID 0000000D: 0000000F-000003C0-00000100-00000000 [SL 01]
CPUID 0000000D: 00000100-00000240-00000000-00000000 [SL 02]
CPUID 0000000D: 00000040-000003C0-00000000-00000000 [SL 03]
CPUID 0000000D: 00000040-00000400-00000000-00000000 [SL 04]
CPUID 0000000E: 00000000-00000000-00000000-00000000 
CPUID 0000000F: 00000000-00000000-00000000-00000000 [SL 00]
CPUID 00000010: 00000000-00000000-00000000-00000000 [SL 00]
CPUID 00000011: 00000000-00000000-00000000-00000000 
CPUID 00000012: 00000000-00000000-00000000-00000000 [SL 00]
CPUID 00000013: 00000000-00000000-00000000-00000000 
CPUID 00000014: 00000001-0000000F-00000007-00000000 [SL 00]
CPUID 00000014: 00000000-00000000-00000000-00000000 [SL 01]
CPUID 00000015: 00000002-00000156-00000000-00000000 [171 / 0]
CPUID 00000016: 000010CC-00001194-00000064-00000000 [4300 / 4500 / 100]
CPUID 80000000: 80000008-00000000-00000000-00000000 
CPUID 80000001: 00000000-00000000-00000121-2C100800 
CPUID 80000002: 65746E49-2952286C-726F4320-4D542865 [Intel(R) Core(TM]
CPUID 80000003: 37692029-3437372D-43205830-40205550 [) i7-7740X CPU @]
CPUID 80000004: 332E3420-7A484730-00000000-00000000 [ 4.30GHz]
CPUID 80000005: 00000000-00000000-00000000-00000000 
CPUID 80000006: 00000000-00000000-01006040-00000000 
CPUID 80000007: 00000000-00000000-00000000-00000100 
CPUID 80000008: 00003027-00000000-00000000-00000000 

CPU#003 AffMask: 0x0000000000000008 
CPUID 00000000: 00000016-756E6547-6C65746E-49656E69 [GenuineIntel]
CPUID 00000001: 000906E9-03100800-7FFAFBBF-BFEBFBFF 
CPUID 00000002: 76036301-00F0B5FF-00000000-00C30000 
CPUID 00000003: 00000000-00000000-00000000-00000000 
CPUID 00000004: 1C004121-01C0003F-0000003F-00000000 [SL 00]
CPUID 00000004: 1C004122-01C0003F-0000003F-00000000 [SL 01]
CPUID 00000004: 1C004143-00C0003F-000003FF-00000000 [SL 02]
CPUID 00000004: 1C03C163-03C0003F-00001FFF-00000006 [SL 03]
CPUID 00000005: 00000040-00000040-00000003-00142120 
CPUID 00000006: 000027F7-00000002-00000009-00000000 
CPUID 00000007: 00000000-029C6FBB-00000000-00000000 [SL 00]
CPUID 00000008: 00000000-00000000-00000000-00000000 
CPUID 00000009: 00000000-00000000-00000000-00000000 
CPUID 0000000A: 07300404-00000000-00000000-00000603 
CPUID 0000000B: 00000001-00000002-00000100-00000003 [SL 00]
CPUID 0000000B: 00000004-00000008-00000201-00000003 [SL 01]
CPUID 0000000C: 00000000-00000000-00000000-00000000 
CPUID 0000000D: 0000001F-00000440-00000440-00000000 [SL 00]
CPUID 0000000D: 0000000F-000003C0-00000100-00000000 [SL 01]
CPUID 0000000D: 00000100-00000240-00000000-00000000 [SL 02]
CPUID 0000000D: 00000040-000003C0-00000000-00000000 [SL 03]
CPUID 0000000D: 00000040-00000400-00000000-00000000 [SL 04]
CPUID 0000000E: 00000000-00000000-00000000-00000000 
CPUID 0000000F: 00000000-00000000-00000000-00000000 [SL 00]
CPUID 00000010: 00000000-00000000-00000000-00000000 [SL 00]
CPUID 00000011: 00000000-00000000-00000000-00000000 
CPUID 00000012: 00000000-00000000-00000000-00000000 [SL 00]
CPUID 00000013: 00000000-00000000-00000000-00000000 
CPUID 00000014: 00000001-0000000F-00000007-00000000 [SL 00]
CPUID 00000014: 00000000-00000000-00000000-00000000 [SL 01]
CPUID 00000015: 00000002-00000156-00000000-00000000 [171 / 0]
CPUID 00000016: 000010CC-00001194-00000064-00000000 [4300 / 4500 / 100]
CPUID 80000000: 80000008-00000000-00000000-00000000 
CPUID 80000001: 00000000-00000000-00000121-2C100800 
CPUID 80000002: 65746E49-2952286C-726F4320-4D542865 [Intel(R) Core(TM]
CPUID 80000003: 37692029-3437372D-43205830-40205550 [) i7-7740X CPU @]
CPUID 80000004: 332E3420-7A484730-00000000-00000000 [ 4.30GHz]
CPUID 80000005: 00000000-00000000-00000000-00000000 
CPUID 80000006: 00000000-00000000-01006040-00000000 
CPUID 80000007: 00000000-00000000-00000000-00000100 
CPUID 80000008: 00003027-00000000-00000000-00000000 

CPU#004 AffMask: 0x0000000000000010 
CPUID 00000000: 00000016-756E6547-6C65746E-49656E69 [GenuineIntel]
CPUID 00000001: 000906E9-04100800-7FFAFBBF-BFEBFBFF 
CPUID 00000002: 76036301-00F0B5FF-00000000-00C30000 
CPUID 00000003: 00000000-00000000-00000000-00000000 
CPUID 00000004: 1C004121-01C0003F-0000003F-00000000 [SL 00]
CPUID 00000004: 1C004122-01C0003F-0000003F-00000000 [SL 01]
CPUID 00000004: 1C004143-00C0003F-000003FF-00000000 [SL 02]
CPUID 00000004: 1C03C163-03C0003F-00001FFF-00000006 [SL 03]
CPUID 00000005: 00000040-00000040-00000003-00142120 
CPUID 00000006: 000027F7-00000002-00000009-00000000 
CPUID 00000007: 00000000-029C6FBB-00000000-00000000 [SL 00]
CPUID 00000008: 00000000-00000000-00000000-00000000 
CPUID 00000009: 00000000-00000000-00000000-00000000 
CPUID 0000000A: 07300404-00000000-00000000-00000603 
CPUID 0000000B: 00000001-00000002-00000100-00000004 [SL 00]
CPUID 0000000B: 00000004-00000008-00000201-00000004 [SL 01]
CPUID 0000000C: 00000000-00000000-00000000-00000000 
CPUID 0000000D: 0000001F-00000440-00000440-00000000 [SL 00]
CPUID 0000000D: 0000000F-000003C0-00000100-00000000 [SL 01]
CPUID 0000000D: 00000100-00000240-00000000-00000000 [SL 02]
CPUID 0000000D: 00000040-000003C0-00000000-00000000 [SL 03]
CPUID 0000000D: 00000040-00000400-00000000-00000000 [SL 04]
CPUID 0000000E: 00000000-00000000-00000000-00000000 
CPUID 0000000F: 00000000-00000000-00000000-00000000 [SL 00]
CPUID 00000010: 00000000-00000000-00000000-00000000 [SL 00]
CPUID 00000011: 00000000-00000000-00000000-00000000 
CPUID 00000012: 00000000-00000000-00000000-00000000 [SL 00]
CPUID 00000013: 00000000-00000000-00000000-00000000 
CPUID 00000014: 00000001-0000000F-00000007-00000000 [SL 00]
CPUID 00000014: 00000000-00000000-00000000-00000000 [SL 01]
CPUID 00000015: 00000002-00000156-00000000-00000000 [171 / 0]
CPUID 00000016: 000010CC-00001194-00000064-00000000 [4300 / 4500 / 100]
CPUID 80000000: 80000008-00000000-00000000-00000000 
CPUID 80000001: 00000000-00000000-00000121-2C100800 
CPUID 80000002: 65746E49-2952286C-726F4320-4D542865 [Intel(R) Core(TM]
CPUID 80000003: 37692029-3437372D-43205830-40205550 [) i7-7740X CPU @]
CPUID 80000004: 332E3420-7A484730-00000000-00000000 [ 4.30GHz]
CPUID 80000005: 00000000-00000000-00000000-00000000 
CPUID 80000006: 00000000-00000000-01006040-00000000 
CPUID 80000007: 00000000-00000000-00000000-00000100 
CPUID 80000008: 00003027-00000000-00000000-00000000 

CPU#005 AffMask: 0x0000000000000020 
CPUID 00000000: 00000016-756E6547-6C65746E-49656E69 [GenuineIntel]
CPUID 00000001: 000906E9-05100800-7FFAFBBF-BFEBFBFF 
CPUID 00000002: 76036301-00F0B5FF-00000000-00C30000 
CPUID 00000003: 00000000-00000000-00000000-00000000 
CPUID 00000004: 1C004121-01C0003F-0000003F-00000000 [SL 00]
CPUID 00000004: 1C004122-01C0003F-0000003F-00000000 [SL 01]
CPUID 00000004: 1C004143-00C0003F-000003FF-00000000 [SL 02]
CPUID 00000004: 1C03C163-03C0003F-00001FFF-00000006 [SL 03]
CPUID 00000005: 00000040-00000040-00000003-00142120 
CPUID 00000006: 000027F7-00000002-00000009-00000000 
CPUID 00000007: 00000000-029C6FBB-00000000-00000000 [SL 00]
CPUID 00000008: 00000000-00000000-00000000-00000000 
CPUID 00000009: 00000000-00000000-00000000-00000000 
CPUID 0000000A: 07300404-00000000-00000000-00000603 
CPUID 0000000B: 00000001-00000002-00000100-00000005 [SL 00]
CPUID 0000000B: 00000004-00000008-00000201-00000005 [SL 01]
CPUID 0000000C: 00000000-00000000-00000000-00000000 
CPUID 0000000D: 0000001F-00000440-00000440-00000000 [SL 00]
CPUID 0000000D: 0000000F-000003C0-00000100-00000000 [SL 01]
CPUID 0000000D: 00000100-00000240-00000000-00000000 [SL 02]
CPUID 0000000D: 00000040-000003C0-00000000-00000000 [SL 03]
CPUID 0000000D: 00000040-00000400-00000000-00000000 [SL 04]
CPUID 0000000E: 00000000-00000000-00000000-00000000 
CPUID 0000000F: 00000000-00000000-00000000-00000000 [SL 00]
CPUID 00000010: 00000000-00000000-00000000-00000000 [SL 00]
CPUID 00000011: 00000000-00000000-00000000-00000000 
CPUID 00000012: 00000000-00000000-00000000-00000000 [SL 00]
CPUID 00000013: 00000000-00000000-00000000-00000000 
CPUID 00000014: 00000001-0000000F-00000007-00000000 [SL 00]
CPUID 00000014: 00000000-00000000-00000000-00000000 [SL 01]
CPUID 00000015: 00000002-00000156-00000000-00000000 [171 / 0]
CPUID 00000016: 000010CC-00001194-00000064-00000000 [4300 / 4500 / 100]
CPUID 80000000: 80000008-00000000-00000000-00000000 
CPUID 80000001: 00000000-00000000-00000121-2C100800 
CPUID 80000002: 65746E49-2952286C-726F4320-4D542865 [Intel(R) Core(TM]
CPUID 80000003: 37692029-3437372D-43205830-40205550 [) i7-7740X CPU @]
CPUID 80000004: 332E3420-7A484730-00000000-00000000 [ 4.30GHz]
CPUID 80000005: 00000000-00000000-00000000-00000000 
CPUID 80000006: 00000000-00000000-01006040-00000000 
CPUID 80000007: 00000000-00000000-00000000-00000100 
CPUID 80000008: 00003027-00000000-00000000-00000000 

CPU#006 AffMask: 0x0000000000000040 
CPUID 00000000: 00000016-756E6547-6C65746E-49656E69 [GenuineIntel]
CPUID 00000001: 000906E9-06100800-7FFAFBBF-BFEBFBFF 
CPUID 00000002: 76036301-00F0B5FF-00000000-00C30000 
CPUID 00000003: 00000000-00000000-00000000-00000000 
CPUID 00000004: 1C004121-01C0003F-0000003F-00000000 [SL 00]
CPUID 00000004: 1C004122-01C0003F-0000003F-00000000 [SL 01]
CPUID 00000004: 1C004143-00C0003F-000003FF-00000000 [SL 02]
CPUID 00000004: 1C03C163-03C0003F-00001FFF-00000006 [SL 03]
CPUID 00000005: 00000040-00000040-00000003-00142120 
CPUID 00000006: 000027F7-00000002-00000009-00000000 
CPUID 00000007: 00000000-029C6FBB-00000000-00000000 [SL 00]
CPUID 00000008: 00000000-00000000-00000000-00000000 
CPUID 00000009: 00000000-00000000-00000000-00000000 
CPUID 0000000A: 07300404-00000000-00000000-00000603 
CPUID 0000000B: 00000001-00000002-00000100-00000006 [SL 00]
CPUID 0000000B: 00000004-00000008-00000201-00000006 [SL 01]
CPUID 0000000C: 00000000-00000000-00000000-00000000 
CPUID 0000000D: 0000001F-00000440-00000440-00000000 [SL 00]
CPUID 0000000D: 0000000F-000003C0-00000100-00000000 [SL 01]
CPUID 0000000D: 00000100-00000240-00000000-00000000 [SL 02]
CPUID 0000000D: 00000040-000003C0-00000000-00000000 [SL 03]
CPUID 0000000D: 00000040-00000400-00000000-00000000 [SL 04]
CPUID 0000000E: 00000000-00000000-00000000-00000000 
CPUID 0000000F: 00000000-00000000-00000000-00000000 [SL 00]
CPUID 00000010: 00000000-00000000-00000000-00000000 [SL 00]
CPUID 00000011: 00000000-00000000-00000000-00000000 
CPUID 00000012: 00000000-00000000-00000000-00000000 [SL 00]
CPUID 00000013: 00000000-00000000-00000000-00000000 
CPUID 00000014: 00000001-0000000F-00000007-00000000 [SL 00]
CPUID 00000014: 00000000-00000000-00000000-00000000 [SL 01]
CPUID 00000015: 00000002-00000156-00000000-00000000 [171 / 0]
CPUID 00000016: 000010CC-00001194-00000064-00000000 [4300 / 4500 / 100]
CPUID 80000000: 80000008-00000000-00000000-00000000 
CPUID 80000001: 00000000-00000000-00000121-2C100800 
CPUID 80000002: 65746E49-2952286C-726F4320-4D542865 [Intel(R) Core(TM]
CPUID 80000003: 37692029-3437372D-43205830-40205550 [) i7-7740X CPU @]
CPUID 80000004: 332E3420-7A484730-00000000-00000000 [ 4.30GHz]
CPUID 80000005: 00000000-00000000-00000000-00000000 
CPUID 80000006: 00000000-00000000-01006040-00000000 
CPUID 80000007: 00000000-00000000-00000000-00000100 
CPUID 80000008: 00003027-00000000-00000000-00000000 

CPU#007 AffMask: 0x0000000000000080 
CPUID 00000000: 00000016-756E6547-6C65746E-49656E69 [GenuineIntel]
CPUID 00000001: 000906E9-07100800-7FFAFBBF-BFEBFBFF 
CPUID 00000002: 76036301-00F0B5FF-00000000-00C30000 
CPUID 00000003: 00000000-00000000-00000000-00000000 
CPUID 00000004: 1C004121-01C0003F-0000003F-00000000 [SL 00]
CPUID 00000004: 1C004122-01C0003F-0000003F-00000000 [SL 01]
CPUID 00000004: 1C004143-00C0003F-000003FF-00000000 [SL 02]
CPUID 00000004: 1C03C163-03C0003F-00001FFF-00000006 [SL 03]
CPUID 00000005: 00000040-00000040-00000003-00142120 
CPUID 00000006: 000027F7-00000002-00000009-00000000 
CPUID 00000007: 00000000-029C6FBB-00000000-00000000 [SL 00]
CPUID 00000008: 00000000-00000000-00000000-00000000 
CPUID 00000009: 00000000-00000000-00000000-00000000 
CPUID 0000000A: 07300404-00000000-00000000-00000603 
CPUID 0000000B: 00000001-00000002-00000100-00000007 [SL 00]
CPUID 0000000B: 00000004-00000008-00000201-00000007 [SL 01]
CPUID 0000000C: 00000000-00000000-00000000-00000000 
CPUID 0000000D: 0000001F-00000440-00000440-00000000 [SL 00]
CPUID 0000000D: 0000000F-000003C0-00000100-00000000 [SL 01]
CPUID 0000000D: 00000100-00000240-00000000-00000000 [SL 02]
CPUID 0000000D: 00000040-000003C0-00000000-00000000 [SL 03]
CPUID 0000000D: 00000040-00000400-00000000-00000000 [SL 04]
CPUID 0000000E: 00000000-00000000-00000000-00000000 
CPUID 0000000F: 00000000-00000000-00000000-00000000 [SL 00]
CPUID 00000010: 00000000-00000000-00000000-00000000 [SL 00]
CPUID 00000011: 00000000-00000000-00000000-00000000 
CPUID 00000012: 00000000-00000000-00000000-00000000 [SL 00]
CPUID 00000013: 00000000-00000000-00000000-00000000 
CPUID 00000014: 00000001-0000000F-00000007-00000000 [SL 00]
CPUID 00000014: 00000000-00000000-00000000-00000000 [SL 01]
CPUID 00000015: 00000002-00000156-00000000-00000000 [171 / 0]
CPUID 00000016: 000010CC-00001194-00000064-00000000 [4300 / 4500 / 100]
CPUID 80000000: 80000008-00000000-00000000-00000000 
CPUID 80000001: 00000000-00000000-00000121-2C100800 
CPUID 80000002: 65746E49-2952286C-726F4320-4D542865 [Intel(R) Core(TM]
CPUID 80000003: 37692029-3437372D-43205830-40205550 [) i7-7740X CPU @]
CPUID 80000004: 332E3420-7A484730-00000000-00000000 [ 4.30GHz]
CPUID 80000005: 00000000-00000000-00000000-00000000 
CPUID 80000006: 00000000-00000000-01006040-00000000 
CPUID 80000007: 00000000-00000000-00000000-00000100 
CPUID 80000008: 00003027-00000000-00000000-00000000 
