------[ Versions ]------

Program Version : EVEREST v4.60.1629 Beta
BenchDLL Version: 2.4.257.0

------[ CPU Info ]------

CPU Type           : Intel Pentium 4, 2400 MHz (18 x 133)
CPU Alias          : Northwood
CPU Platform       : Socket 478
CPU Stepping       : C1
Instruction Set    : x86, MMX, SSE, SSE2
CPUID Manufacturer : GenuineIntel
CPUID CPU Name     : Intel(R) Pentium(R) 4 CPU 2.40GHz
CPUID Revision     : 00000F27h
IA Brand ID        : 09h  (Intel Pentium 4)
Platform ID        : 1Fh  (Socket 478)

------[ Logical CPU #0 ]------

allcpu: Valid

CPUID 00000000: 00000002-756E6547-6C65746E-49656E69
CPUID 00000001: 00000F27-00010809-00004400-BFEBFBFF
CPUID 00000002: 665B5101-00000000-00000000-007B7040
CPUID 80000000: 80000004-00000000-00000000-00000000
CPUID 80000001: 00000000-00000000-00000000-00000000
CPUID 80000002: 20202020-20202020-20202020-6E492020
CPUID 80000003: 286C6574-50202952-69746E65-52286D75
CPUID 80000004: 20342029-20555043-30342E32-007A4847

------[ MSR Registers ]------

MSR 00000017: 000A-0000-0000-0000 [PlatID = 2]
MSR 0000001B: 0000-0000-FEE0-0900
MSR 0000002A: 0000-0000-0000-0000
MSR 0000002C: 0000-0000-1211-0012
MSR 0000008B: 0000-0037-0000-0000
MSR 0000019A: 0000-0000-0000-0002
MSR 0000019B: 0000-0000-0000-0000
MSR 0000019C: 0000-0000-0000-0000
MSR 000001A0: 0000-0000-0000-00E1

PerformanceFrequency = 3579545

Tjmax Temperature = 0 Celsius
