------[ Versions ]------

Program Version : AIDA64 Engineer v5.99.4905 Beta
BenchDLL Version: 4.3.793-x64
Windows Version : Microsoft Windows XP Professional x64 Edition 5.2.3790 Service Pack 2 (64-bit)

------[ CPU Info ]------

CPU Type          : DualCore Intel Core 2 Extreme X6800, 2933 MHz (11 x 267)
CPU Alias         : Conroe
CPU Platform      : LGA775
CPU Stepping      : B2
Instruction Set   : x86, x86-64, MMX, SSE, SSE2, SSE3, SSSE3
CPUID Manufacturer: GenuineIntel
CPUID CPU Name    : Intel(R) Core(TM)2 CPU X6800 @ 2.93GHz
CPUID Revision    : 000006F6h
IA Brand ID       : 00h  (Unknown)
Platform ID       : 42h  (LGA775)
HTT / CMP Units   : 0 / 2
Max. NUMA Node    : 0

Tjmax Temperature    : 80 Celsius
HTC Temperature Limit: 0 Celsius

------[ Motherboard Info ]------

Motherboard ID      : 11/06/2007-i965-W627EHG-6A79LA1AC-22
Motherboard Model   : Abit AB9 / AB9 Wi-Fi
Motherboard Chipset : Intel Broadwater P965

Award BIOS Type     : Phoenix - AwardBIOS v6.00PG
Award BIOS Message  : 

DMI MB Manufacturer : http://www.abit.com.tw/
DMI MB Product      : AB9/AB9RPO(Intel965+ICH8)
DMI MB Version      : 1.x (BIOS:15)
DMI MB Serial       : 
DMI SYS Manufacturer: OEM
DMI SYS Product     : OEM
DMI SYS Version     : OEM
DMI SYS Serial      : OEM
DMI BIOS Version    : 


------[ Logical CPU #0 ]------

allcpu: Package 0 / Core 0 / Thread 0: Valid

CPUID 00000000: 0000000A-756E6547-6C65746E-49656E69 [GenuineIntel]
CPUID 00000001: 000006F6-00020800-0000E3BD-BFEBFBFF
CPUID 00000002: 05B0B101-005657F0-00000000-2CB43049
CPUID 00000003: 00000000-00000000-00000000-00000000
CPUID 00000004: 04000121-01C0003F-0000003F-00000001 [SL 00]
CPUID 00000004: 04000122-01C0003F-0000003F-00000001 [SL 01]
CPUID 00000004: 04004143-03C0003F-00000FFF-00000001 [SL 02]
CPUID 00000005: 00000040-00000040-00000003-00000020
CPUID 00000006: 00000001-00000002-00000001-00000000
CPUID 00000007: 00000000-00000000-00000000-00000000
CPUID 00000008: 00000400-00000000-00000000-00000000
CPUID 00000009: 00000000-00000000-00000000-00000000
CPUID 0000000A: 07280202-00000000-00000000-00000000
CPUID 80000000: 80000008-00000000-00000000-00000000
CPUID 80000001: 00000000-00000000-00000001-20100000
CPUID 80000002: 65746E49-2952286C-726F4320-4D542865 [Intel(R) Core(TM]
CPUID 80000003: 43203229-20205550-20202020-58202020 [)2 CPU         X]
CPUID 80000004: 30303836-20402020-33392E32-007A4847 [6800  @ 2.93GHz]
CPUID 80000005: 00000000-00000000-00000000-00000000
CPUID 80000006: 00000000-00000000-10008040-00000000
CPUID 80000007: 00000000-00000000-00000000-00000000
CPUID 80000008: 00003024-00000000-00000000-00000000

L1    Data Cache:    32 KB,  8-way Associative, 64-byte Line
L1  Instr. Cache:    32 KB,  8-way Associative, 64-byte Line
L2 Unified Cache:     4 MB, 16-way Associative, 64-byte Line

------[ Logical CPU #1 ]------

allcpu: Package 0 / Core 1 / Thread 0: Valid

CPUID 00000000: 0000000A-756E6547-6C65746E-49656E69 [GenuineIntel]
CPUID 00000001: 000006F6-01020800-0000E3BD-BFEBFBFF
CPUID 00000002: 05B0B101-005657F0-00000000-2CB43049
CPUID 00000003: 00000000-00000000-00000000-00000000
CPUID 00000004: 04000121-01C0003F-0000003F-00000001 [SL 00]
CPUID 00000004: 04000122-01C0003F-0000003F-00000001 [SL 01]
CPUID 00000004: 04004143-03C0003F-00000FFF-00000001 [SL 02]
CPUID 00000005: 00000040-00000040-00000003-00000020
CPUID 00000006: 00000001-00000002-00000001-00000000
CPUID 00000007: 00000000-00000000-00000000-00000000
CPUID 00000008: 00000400-00000000-00000000-00000000
CPUID 00000009: 00000000-00000000-00000000-00000000
CPUID 0000000A: 07280202-00000000-00000000-00000000
CPUID 80000000: 80000008-00000000-00000000-00000000
CPUID 80000001: 00000000-00000000-00000001-20100000
CPUID 80000002: 65746E49-2952286C-726F4320-4D542865 [Intel(R) Core(TM]
CPUID 80000003: 43203229-20205550-20202020-58202020 [)2 CPU         X]
CPUID 80000004: 30303836-20402020-33392E32-007A4847 [6800  @ 2.93GHz]
CPUID 80000005: 00000000-00000000-00000000-00000000
CPUID 80000006: 00000000-00000000-10008040-00000000
CPUID 80000007: 00000000-00000000-00000000-00000000
CPUID 80000008: 00003024-00000000-00000000-00000000

L1    Data Cache:    32 KB,  8-way Associative, 64-byte Line
L1  Instr. Cache:    32 KB,  8-way Associative, 64-byte Line
L2 Unified Cache:     4 MB, 16-way Associative, 64-byte Line

------[ All CPUs ]------

CPU   0: APICID    0 / Package 0 / Core   0 / Thread 0: Valid
CPU   1: APICID    1 / Package 0 / Core   1 / Thread 0: Valid

------[ MSR Registers ]------

MSR 00000017: 0000-0000-8804-0B28 [PlatID = 0]
MSR 0000001B: 0000-0000-FEE0-0900
MSR 0000002A: 0000-0000-42C8-0000
MSR 0000008B: 0000-0044-0000-0000
MSR 000000CD: 0000-0000-0000-0800
MSR 000000CE: 001B-0B28-7F7F-071B
MSR 000000E7: 0000-0193-6DE1-3CE1 [S200]
MSR 000000E7: 0000-0193-6E58-A7A4 [S200]
MSR 000000E7: 0000-0193-6E83-2D16
MSR 000000E8: 0000-0193-6E83-934F [S200]
MSR 000000E8: 0000-0193-6EAE-5730 [S200]
MSR 000000E8: 0000-0193-6EDE-265D
MSR 000000EE: A800-0000-C17D-4300
MSR 0000011E: 0000-0000-BE70-2109
MSR 00000198: 0B28-0B28-8600-0B28 [S200]
MSR 00000198: 0B28-0B28-8600-0B28 [S200]
MSR 00000198: 0B28-0B28-8600-0B28
MSR 00000199: 0000-0000-0000-0B28
MSR 0000019A: 0000-0000-0000-0002
MSR 0000019B: 0000-0000-0000-0008
MSR 0000019C: 0000-0000-882C-0000 [S200]
MSR 0000019C: 0000-0000-882C-0000 [S200]
MSR 0000019C: 0000-0000-882C-0000
MSR 0000019D: 0000-0000-0000-061B
MSR 000001A0: 0000-0040-6097-2489
MSR 00000480: 001A-0400-0000-0007
MSR 00000481: 0000-001F-0000-0016
MSR 00000482: 77B9-FFFE-0401-E172
MSR 00000483: 0003-EFFF-0003-6DFF
MSR 00000484: 0000-1FFF-0000-11FF
MSR 00000485: 0000-0000-0004-03C0
MSR 00000486: 0000-0000-8000-0021
MSR 00000487: 0000-0000-FFFF-FFFF
MSR 00000488: 0000-0000-0000-2000
MSR 00000489: 0000-0000-0000-27FF
MSR 0000048A: 0000-0000-0000-002C

PerformanceFrequency = 2937000000

CPU Clock M.Method = 2  (TSC PMT)
PM Timer Address   = 1032  (0408h)

APIC Clock = 266.98 MHz  (AT = 139894 / TT = 15005 / try = 1 / SKL = 0.00 MHz)
APIC Clock = 267.00 MHz  (AT = 139911 / TT = 15006 / try = 1 / SKL = 0.00 MHz)
APIC Clock = 267.01 MHz  (AT = 139909 / TT = 15005 / try = 1 / SKL = 0.00 MHz)
APIC Clock = 266.99 MHz  (AT = 139901 / TT = 15005 / try = 1 / SKL = 0.00 MHz)
APIC Clock = 267.00 MHz  (AT = 139903 / TT = 15005 / try = 1 / SKL = 0.00 MHz)

CPU Clock = 2937.00 MHz / TSC Clock = 2937.00 MHz / CPU Mul = 11.00x
CPU Clock = 2937.00 MHz / TSC Clock = 2937.00 MHz / CPU Mul = 11.00x
CPU Clock = 2937.01 MHz / TSC Clock = 2937.01 MHz / CPU Mul = 11.00x
CPU Clock = 2937.00 MHz / TSC Clock = 2937.00 MHz / CPU Mul = 11.00x
CPU Clock = 2937.00 MHz / TSC Clock = 2937.00 MHz / CPU Mul = 11.00x

CPU Clock Max = 2936.97 MHz / TSC Clock = 2936.97 MHz / CPU Mul = 11.00x
CPU Clock Max = 2937.00 MHz / TSC Clock = 2937.00 MHz / CPU Mul = 11.00x
CPU Clock Max = 2937.00 MHz / TSC Clock = 2937.00 MHz / CPU Mul = 11.00x
CPU Clock Max = 2936.98 MHz / TSC Clock = 2936.98 MHz / CPU Mul = 11.00x
CPU Clock Max = 2936.98 MHz / TSC Clock = 2936.98 MHz / CPU Mul = 11.00x

INTPERFCTR2 = 2937.00 MHz / INTPERFCTR1 (TSC) = 2937.00 MHz
INTPERFCTR2 = 2937.02 MHz / INTPERFCTR1 (TSC) = 2937.02 MHz
INTPERFCTR2 = 2937.02 MHz / INTPERFCTR1 (TSC) = 2937.02 MHz
INTPERFCTR2 = 2937.02 MHz / INTPERFCTR1 (TSC) = 2937.02 MHz
INTPERFCTR2 = 2936.99 MHz / INTPERFCTR1 (TSC) = 2936.99 MHz
