------[ Versions ]------

Program Version : AIDA64 v2.00.1772 Beta
BenchDLL Version: 2.7.391-x64

------[ CPU Info ]------

CPU Type           : DualCore Intel Atom D2500, 1866 MHz (14 x 133)
CPU Alias          : Cedarview-D
CPU Platform       : uFCBGA559
CPU Stepping       : B0/B1/B2
Instruction Set    : x86, x86-64, MMX, SSE, SSE2, SSE3, SSSE3
CPUID Manufacturer : GenuineIntel
CPUID CPU Name     : Intel(R) Atom(TM) CPU D2500 @ 1.86GHz
CPUID Revision     : 00030661h
IA Brand ID        : 00h  (Unknown)
Platform ID        : EFh  (uFCBGA559)
HTT / CMP Units    : 0 / 2
Tjmax Temperature  : 100 Celsius

------[ Logical CPU #0 ]------

allcpu: Package 0 / Core 0 / Thread 0: Valid

CPUID 00000000: 0000000A-756E6547-6C65746E-49656E69
CPUID 00000001: 00030661-00020800-0040E31D-BFEBFBFF
CPUID 00000002: 4FBA5901-0E3080C0-00000000-00000000
CPUID 00000003: 00000000-00000000-00000000-00000000
CPUID 00000004: 04000121-0140003F-0000003F-00000001
CPUID 00000004: 04000122-01C0003F-0000003F-00000001
CPUID 00000004: 04000143-01C0003F-000003FF-00000001
CPUID 00000005: 00000040-00000040-00000003-00000010
CPUID 00000006: 00000005-00000002-00000003-00000000
CPUID 00000007: 00000000-00000000-00000000-00000000
CPUID 00000008: 00000000-00000000-00000000-00000000
CPUID 00000009: 00000000-00000000-00000000-00000000
CPUID 0000000A: 07280203-00000000-00000000-00000503
CPUID 80000000: 80000008-00000000-00000000-00000000
CPUID 80000001: 00000000-00000000-00000001-20100000
CPUID 80000002: 20202020-20202020-65746E49-2952286C
CPUID 80000003: 6F744120-4D54286D-50432029-32442055
CPUID 80000004: 20303035-20402020-36382E31-007A4847
CPUID 80000005: 00000000-00000000-00000000-00000000
CPUID 80000006: 00000000-00000000-02006040-00000000
CPUID 80000007: 00000000-00000000-00000000-00000100
CPUID 80000008: 00003024-00000000-00000000-00000000

L1    Data Cache:     24 KB,  6-way Associative, 64-byte Line
L1  Instr. Cache:     32 KB,  8-way Associative, 64-byte Line
L2 Unified Cache:    512 KB,  8-way Associative, 64-byte Line

------[ Logical CPU #1 ]------

allcpu: Package 0 / Core 1 / Thread 0: Valid

CPUID 00000000: 0000000A-756E6547-6C65746E-49656E69
CPUID 00000001: 00030661-01020800-0040E31D-BFEBFBFF
CPUID 00000002: 4FBA5901-0E3080C0-00000000-00000000
CPUID 00000003: 00000000-00000000-00000000-00000000
CPUID 00000004: 04000121-0140003F-0000003F-00000001
CPUID 00000004: 04000122-01C0003F-0000003F-00000001
CPUID 00000004: 04000143-01C0003F-000003FF-00000001
CPUID 00000005: 00000040-00000040-00000003-00000010
CPUID 00000006: 00000005-00000002-00000003-00000000
CPUID 00000007: 00000000-00000000-00000000-00000000
CPUID 00000008: 00000000-00000000-00000000-00000000
CPUID 00000009: 00000000-00000000-00000000-00000000
CPUID 0000000A: 07280203-00000000-00000000-00000503
CPUID 80000000: 80000008-00000000-00000000-00000000
CPUID 80000001: 00000000-00000000-00000001-20100000
CPUID 80000002: 20202020-20202020-65746E49-2952286C
CPUID 80000003: 6F744120-4D54286D-50432029-32442055
CPUID 80000004: 20303035-20402020-36382E31-007A4847
CPUID 80000005: 00000000-00000000-00000000-00000000
CPUID 80000006: 00000000-00000000-02006040-00000000
CPUID 80000007: 00000000-00000000-00000000-00000100
CPUID 80000008: 00003024-00000000-00000000-00000000

L1    Data Cache:     24 KB,  6-way Associative, 64-byte Line
L1  Instr. Cache:     32 KB,  8-way Associative, 64-byte Line
L2 Unified Cache:    512 KB,  8-way Associative, 64-byte Line

------[ All CPUs ]------

CPU   0: APICID   0 / Package 0 / Core  0 / Thread 0: Valid
CPU   1: APICID   1 / Package 0 / Core  1 / Thread 0: Valid

------[ MSR Registers ]------

MSR 00000017: 0008-00F0-88A6-CE9F [PlatID = 2]
MSR 0000001B: 0000-0000-FEE0-0900
MSR 0000002A: 0000-0000-C388-1400
MSR 0000008B: 0000-010A-0000-0000
MSR 000000CD: 0000-0000-0000-0001
MSR 000000CE: 5F5F-0E00-5F5F-0000
MSR 000000E7: 0000-0036-7BA5-C3AF
MSR 000000E8: 0000-0033-DE30-29E5
MSR 000000EE: 0000-0000-0238-4003
MSR 0000011E: 0000-0000-7E00-010F
MSR 00000198: 0E5F-0E5F-0600-0E5F
MSR 00000199: 0000-0000-0000-0E5F
MSR 0000019A: 0000-0000-0000-0002
MSR 0000019B: 0000-0000-0000-0000
MSR 0000019C: 0000-0000-883C-0000
MSR 0000019D: 0000-0000-0000-065F
MSR 000001A0: 0000-0000-6884-0088

PerformanceFrequency = 1818408

CPU Clock M.Method = 2  (TSC PMT)
PM Timer Address   = 1032  (0408h)

APIC Clock = 133.00 MHz
APIC Clock = 133.00 MHz
APIC Clock = 133.01 MHz
APIC Clock = 133.01 MHz
APIC Clock = 133.00 MHz
