------[ Versions ]------

Program Version : EVEREST v4.60.1629 Beta
BenchDLL Version: 2.4.257.0

------[ CPU Info ]------

CPU Type           : Mobile Intel Celeron 215, 1333 MHz (10 x 133)
CPU Alias          : Yonah-512
CPU Platform       : Socket 479
CPU Stepping       : C0
Instruction Set    : x86, MMX, SSE, SSE2, SSE3
CPUID Manufacturer : GenuineIntel
CPUID CPU Name     : Intel(R) Celeron(R) CPU 215 @ 1.33GHz
CPUID Revision     : 000006E8h
IA Brand ID        : 00h  (Unknown)
Platform ID        : 20h  (Socket 479)

------[ Logical CPU #0 ]------

allcpu: Valid

CPUID 00000000: 0000000A-756E6547-6C65746E-49656E69
CPUID 00000001: 000006E8-00010800-0000C109-AFE9FBFF
CPUID 00000002: 02B3B001-000000F0-00000000-2C04307F
CPUID 00000003: 00000000-00000000-00000000-00000000
CPUID 00000004: 00000121-01C0003F-0000003F-00000001
CPUID 00000004: 00000122-01C0003F-0000003F-00000001
CPUID 00000004: 00000143-0040003F-00000FFF-00000001
CPUID 00000005: 00000040-00000040-00000003-00000010
CPUID 00000006: 00000001-00000002-00000001-00000000
CPUID 00000007: 00000000-00000000-00000000-00000000
CPUID 00000008: 00000000-00000000-00000000-00000000
CPUID 00000009: 00000000-00000000-00000000-00000000
CPUID 0000000A: 07280201-00000000-00000000-00000000
CPUID 80000000: 80000008-00000000-00000000-00000000
CPUID 80000001: 00000000-00000000-00000000-00100000
CPUID 80000002: 65746E49-2952286C-6C654320-6E6F7265
CPUID 80000003: 20295228-20555043-20202020-20202020
CPUID 80000004: 35313220-20402020-33332E31-007A4847
CPUID 80000005: 00000000-00000000-00000000-00000000
CPUID 80000006: 00000000-00000000-02002040-00000000
CPUID 80000007: 00000000-00000000-00000000-00000000
CPUID 80000008: 00002020-00000000-00000000-00000000

L1    Data Cache:     32 KB,  8-way Associative, 64-byte Line
L1  Instr. Cache:     32 KB,  8-way Associative, 64-byte Line
L2 Unified Cache:    512 KB,  2-way Associative, 64-byte Line

------[ MSR Registers ]------

MSR 00000017: 0018-0000-EF06-852C [PlatID = 6]
MSR 0000001B: 0000-0000-FEE0-0900
MSR 0000002A: 0000-0000-4288-0000
MSR 0000008B: 0000-003F-0000-0000
MSR 000000CD: 0000-0000-0000-0101
MSR 000000CE: 2C2C-0A00-6C6C-0000
MSR 000000E7: 0000-003B-C2B7-3E0C
MSR 000000E8: 0000-003B-C2B7-5AF4
MSR 000000EE: F800-0000-02B9-4352
MSR 0000011E: 0000-0000-BE74-2103
MSR 00000198: 0A2C-0A2C-0600-0A2C
MSR 00000199: 0000-0000-0000-0A2C
MSR 0000019A: 0000-0000-0000-0002
MSR 0000019B: 0000-0000-0000-0000
MSR 0000019C: 0000-0000-8843-0000
MSR 0000019D: 0000-0000-0000-062C
MSR 000001A0: 0000-0000-6084-3488

PerformanceFrequency = 3579545

Tjmax Temperature = 100 Celsius
