CPUID 00000000: 00000002 756e6547 6c65746e 49656e69
CPUID 00000001: 00000590 00000000 00010200 8000237b
CPUID 00000002: 00000000 00000000 00000000 00000000
CPUID 80000000: 80000008 00000000 00000000 00000000
CPUID 80000001: 00000000 00000000 00000000 00010000
CPUID 80000002: 00000000 00000000 00000000 00000000
CPUID 80000003: 00000000 00000000 00000000 00000000
CPUID 80000004: 00000000 00000000 00000000 00000000
CPUID 80000005: 00000000 00000000 00000000 00000000
CPUID 80000006: 00000000 00000000 00000000 00000000
CPUID 80000007: 00000000 00000000 00000000 00000000
CPUID 80000008: 00002020 00000000 00000000 00000000
