------[ Logical CPU #0 ]------

allcpu: Valid

CPUID 00000000: 00000003-756E6547-6C65746E-49656E69
CPUID 00000001: 00000673-00000000-00000000-0387FBFF
CPUID 00000002: 03020101-00000000-00000000-0C040844
CPUID 00000003: 00000000-00000000-063F02B2-0003F437

------[ Logical CPU #1 ]------

allcpu: Valid

CPUID 00000000: 00000003-756E6547-6C65746E-49656E69
CPUID 00000001: 00000673-00000000-00000000-0387FBFF
CPUID 00000002: 03020101-00000000-00000000-0C040844
CPUID 00000003: 00000000-00000000-ACC70366-000151C5

------[ Logical CPU #2 ]------

allcpu: Valid

CPUID 00000000: 00000003-756E6547-6C65746E-49656E69
CPUID 00000001: 00000673-00000000-00000000-0387FBFF
CPUID 00000002: 03020101-00000000-00000000-0C040844
CPUID 00000003: 00000000-00000000-F5297DD1-0002C32D

------[ Logical CPU #3 ]------

allcpu: Valid

CPUID 00000000: 00000003-756E6547-6C65746E-49656E69
CPUID 00000001: 00000673-00000000-00000000-0387FBFF
CPUID 00000002: 03020101-00000000-00000000-0C040844
CPUID 00000003: 00000000-00000000-F196CD7C-000000FD

------[ Logical CPU #4 ]------

allcpu: Valid

CPUID 00000000: 00000003-756E6547-6C65746E-49656E69
CPUID 00000001: 00000673-00000000-00000000-0387FBFF
CPUID 00000002: 03020101-00000000-00000000-0C040844
CPUID 00000003: 00000000-00000000-C6CADBE7-0003F185

------[ Logical CPU #5 ]------

allcpu: Valid

CPUID 00000000: 00000003-756E6547-6C65746E-49656E69
CPUID 00000001: 00000673-00000000-00000000-0387FBFF
CPUID 00000002: 03020101-00000000-00000000-0C040844
CPUID 00000003: 00000000-00000000-1B50BC4D-00011728

------[ Logical CPU #6 ]------

allcpu: Valid

CPUID 00000000: 00000003-756E6547-6C65746E-49656E69
CPUID 00000001: 00000673-00000000-00000000-0387FBFF
CPUID 00000002: 03020101-00000000-00000000-0C040844
CPUID 00000003: 00000000-00000000-4B995DEA-00037587

------[ Logical CPU #7 ]------

allcpu: Valid

CPUID 00000000: 00000003-756E6547-6C65746E-49656E69
CPUID 00000001: 00000673-00000000-00000000-0387FBFF
CPUID 00000002: 03020101-00000000-00000000-0C040844
CPUID 00000003: 00000000-00000000-8BCE9534-00000E5B

------[ MSR Registers ]------

MSR 00000017: E168-0000-0000-0000
MSR 0000002A: 0000-0000-C529-565A
MSR 0000011E: 0000-0000-1174-85F7
MSR 0000008B: 0000-002E-0000-0000

PerformanceFrequency = 550020000
