------[ Logical CPU #0 ]------

allcpu: Package 0 / Core 0 / Thread 0: Valid

CPUID 00000000: 00000016-756E6547-6C65746E-49656E69 [GenuineIntel]
CPUID 00000001: 00050654-00100800-7FFEFBBF-BFEBFBFF
CPUID 00000002: 76036301-00F0B5FF-00000000-00C30000
CPUID 00000003: 00000000-00000000-00000000-00000000
CPUID 00000004: 1C004121-01C0003F-0000003F-00000000 [SL 00]
CPUID 00000004: 1C004122-01C0003F-0000003F-00000000 [SL 01]
CPUID 00000004: 1C004143-03C0003F-000003FF-00000000 [SL 02]
CPUID 00000004: 1C03C163-0280003F-00002FFF-00000004 [SL 03]
CPUID 00000005: 00000040-00000040-00000003-00002020
CPUID 00000006: 00000077-00000002-00000009-00000000
CPUID 00000007: 00000000-D39FFFFB-00000000-00000000
CPUID 00000008: 00000000-00000000-00000000-00000000
CPUID 00000009: 00000000-00000000-00000000-00000000
CPUID 0000000A: 07300404-00000000-00000000-00000603
CPUID 0000000B: 00000001-00000002-00000100-00000000 [SL 00]
CPUID 0000000B: 00000004-0000000C-00000201-00000000 [SL 01]
CPUID 0000000C: 00000000-00000000-00000000-00000000
CPUID 0000000D: 000000FF-00000A80-00000A80-00000000 [SL 00]
CPUID 0000000D: 0000000F-00000A00-00000100-00000000 [SL 01]
CPUID 0000000D: 00000100-00000240-00000000-00000000 [SL 02]
CPUID 0000000D: 00000040-000003C0-00000000-00000000 [SL 03]
CPUID 0000000D: 00000040-00000400-00000000-00000000 [SL 04]
CPUID 0000000D: 00000040-00000440-00000000-00000000 [SL 05]
CPUID 0000000D: 00000200-00000480-00000000-00000000 [SL 06]
CPUID 0000000D: 00000400-00000680-00000000-00000000 [SL 07]
CPUID 0000000D: 00000080-00000000-00000001-00000000 [SL 08]
CPUID 0000000E: 00000000-00000000-00000000-00000000
CPUID 0000000F: 00000000-0000002F-00000000-00000002 [SL 00]
CPUID 0000000F: 00000000-00006000-0000002F-00000007 [SL 01]
CPUID 00000010: 00000000-0000000A-00000000-00000000 [SL 00]
CPUID 00000010: 0000000A-00000600-00000004-0000000F [SL 01]
CPUID 00000011: 00000000-00000000-00000000-00000000
CPUID 00000012: 00000000-00000000-00000000-00000000 [SL 00]
CPUID 00000012: 00000000-00000000-00000000-00000000 [SL 01]
CPUID 00000013: 00000000-00000000-00000000-00000000
CPUID 00000014: 00000001-0000000F-00000007-00000000 [SL 00]
CPUID 00000014: 02490002-003F3FFF-00000000-00000000 [SL 01]
CPUID 00000015: 00000002-00000124-00000000-00000000 [146.00x / 0]
CPUID 00000016: 00000DAC-0000125C-00000064-00000000 [3500 / 4700 / 100]
CPUID 80000000: 80000008-00000000-00000000-00000000
CPUID 80000001: 00000000-00000000-00000121-2C100000
CPUID 80000002: 65746E49-2952286C-726F4320-4D542865 [Intel(R) Core(TM]
CPUID 80000003: 37692029-3038372D-43205830-40205550 [) i7-7800X CPU @]
CPUID 80000004: 352E3320-7A484730-00000000-00000000 [ 3.50GHz]
CPUID 80000005: 00000000-00000000-00000000-00000000
CPUID 80000006: 00000000-00000000-01006040-00000000
CPUID 80000007: 00000000-00000000-00000000-00000100
CPUID 80000008: 0000302E-00000000-00000000-00000000

L1    Data Cache:    32 KB,  8-way Associative, 64-byte Line
L1  Instr. Cache:    32 KB,  8-way Associative, 64-byte Line
L2 Unified Cache:     1 MB, 16-way Associative, 64-byte Line
L3 Unified Cache:  8448 KB, 11-way Associative, 64-byte Line

------[ Logical CPU #1 ]------

allcpu: Package 0 / Core 0 / Thread 1: Valid, Virtual

CPUID 00000000: 00000016-756E6547-6C65746E-49656E69 [GenuineIntel]
CPUID 00000001: 00050654-01100800-7FFEFBBF-BFEBFBFF
CPUID 00000002: 76036301-00F0B5FF-00000000-00C30000
CPUID 00000003: 00000000-00000000-00000000-00000000
CPUID 00000004: 1C004121-01C0003F-0000003F-00000000 [SL 00]
CPUID 00000004: 1C004122-01C0003F-0000003F-00000000 [SL 01]
CPUID 00000004: 1C004143-03C0003F-000003FF-00000000 [SL 02]
CPUID 00000004: 1C03C163-0280003F-00002FFF-00000004 [SL 03]
CPUID 00000005: 00000040-00000040-00000003-00002020
CPUID 00000006: 00000077-00000002-00000009-00000000
CPUID 00000007: 00000000-D39FFFFB-00000000-00000000
CPUID 00000008: 00000000-00000000-00000000-00000000
CPUID 00000009: 00000000-00000000-00000000-00000000
CPUID 0000000A: 07300404-00000000-00000000-00000603
CPUID 0000000B: 00000001-00000002-00000100-00000001 [SL 00]
CPUID 0000000B: 00000004-0000000C-00000201-00000001 [SL 01]
CPUID 0000000C: 00000000-00000000-00000000-00000000
CPUID 0000000D: 000000FF-00000A80-00000A80-00000000 [SL 00]
CPUID 0000000D: 0000000F-00000A00-00000100-00000000 [SL 01]
CPUID 0000000D: 00000100-00000240-00000000-00000000 [SL 02]
CPUID 0000000D: 00000040-000003C0-00000000-00000000 [SL 03]
CPUID 0000000D: 00000040-00000400-00000000-00000000 [SL 04]
CPUID 0000000D: 00000040-00000440-00000000-00000000 [SL 05]
CPUID 0000000D: 00000200-00000480-00000000-00000000 [SL 06]
CPUID 0000000D: 00000400-00000680-00000000-00000000 [SL 07]
CPUID 0000000D: 00000080-00000000-00000001-00000000 [SL 08]
CPUID 0000000E: 00000000-00000000-00000000-00000000
CPUID 0000000F: 00000000-0000002F-00000000-00000002 [SL 00]
CPUID 0000000F: 00000000-00006000-0000002F-00000007 [SL 01]
CPUID 00000010: 00000000-0000000A-00000000-00000000 [SL 00]
CPUID 00000010: 0000000A-00000600-00000004-0000000F [SL 01]
CPUID 00000011: 00000000-00000000-00000000-00000000
CPUID 00000012: 00000000-00000000-00000000-00000000 [SL 00]
CPUID 00000012: 00000000-00000000-00000000-00000000 [SL 01]
CPUID 00000013: 00000000-00000000-00000000-00000000
CPUID 00000014: 00000001-0000000F-00000007-00000000 [SL 00]
CPUID 00000014: 02490002-003F3FFF-00000000-00000000 [SL 01]
CPUID 00000015: 00000002-00000124-00000000-00000000 [146.00x / 0]
CPUID 00000016: 00000DAC-0000125C-00000064-00000000 [3500 / 4700 / 100]
CPUID 80000000: 80000008-00000000-00000000-00000000
CPUID 80000001: 00000000-00000000-00000121-2C100000
CPUID 80000002: 65746E49-2952286C-726F4320-4D542865 [Intel(R) Core(TM]
CPUID 80000003: 37692029-3038372D-43205830-40205550 [) i7-7800X CPU @]
CPUID 80000004: 352E3320-7A484730-00000000-00000000 [ 3.50GHz]
CPUID 80000005: 00000000-00000000-00000000-00000000
CPUID 80000006: 00000000-00000000-01006040-00000000
CPUID 80000007: 00000000-00000000-00000000-00000100
CPUID 80000008: 0000302E-00000000-00000000-00000000

L1    Data Cache:    32 KB,  8-way Associative, 64-byte Line
L1  Instr. Cache:    32 KB,  8-way Associative, 64-byte Line
L2 Unified Cache:     1 MB, 16-way Associative, 64-byte Line
L3 Unified Cache:  8448 KB, 11-way Associative, 64-byte Line

------[ Logical CPU #2 ]------

allcpu: Package 0 / Core 1 / Thread 0: Valid

CPUID 00000000: 00000016-756E6547-6C65746E-49656E69 [GenuineIntel]
CPUID 00000001: 00050654-02100800-7FFEFBBF-BFEBFBFF
CPUID 00000002: 76036301-00F0B5FF-00000000-00C30000
CPUID 00000003: 00000000-00000000-00000000-00000000
CPUID 00000004: 1C004121-01C0003F-0000003F-00000000 [SL 00]
CPUID 00000004: 1C004122-01C0003F-0000003F-00000000 [SL 01]
CPUID 00000004: 1C004143-03C0003F-000003FF-00000000 [SL 02]
CPUID 00000004: 1C03C163-0280003F-00002FFF-00000004 [SL 03]
CPUID 00000005: 00000040-00000040-00000003-00002020
CPUID 00000006: 00000077-00000002-00000009-00000000
CPUID 00000007: 00000000-D39FFFFB-00000000-00000000
CPUID 00000008: 00000000-00000000-00000000-00000000
CPUID 00000009: 00000000-00000000-00000000-00000000
CPUID 0000000A: 07300404-00000000-00000000-00000603
CPUID 0000000B: 00000001-00000002-00000100-00000002 [SL 00]
CPUID 0000000B: 00000004-0000000C-00000201-00000002 [SL 01]
CPUID 0000000C: 00000000-00000000-00000000-00000000
CPUID 0000000D: 000000FF-00000A80-00000A80-00000000 [SL 00]
CPUID 0000000D: 0000000F-00000A00-00000100-00000000 [SL 01]
CPUID 0000000D: 00000100-00000240-00000000-00000000 [SL 02]
CPUID 0000000D: 00000040-000003C0-00000000-00000000 [SL 03]
CPUID 0000000D: 00000040-00000400-00000000-00000000 [SL 04]
CPUID 0000000D: 00000040-00000440-00000000-00000000 [SL 05]
CPUID 0000000D: 00000200-00000480-00000000-00000000 [SL 06]
CPUID 0000000D: 00000400-00000680-00000000-00000000 [SL 07]
CPUID 0000000D: 00000080-00000000-00000001-00000000 [SL 08]
CPUID 0000000E: 00000000-00000000-00000000-00000000
CPUID 0000000F: 00000000-0000002F-00000000-00000002 [SL 00]
CPUID 0000000F: 00000000-00006000-0000002F-00000007 [SL 01]
CPUID 00000010: 00000000-0000000A-00000000-00000000 [SL 00]
CPUID 00000010: 0000000A-00000600-00000004-0000000F [SL 01]
CPUID 00000011: 00000000-00000000-00000000-00000000
CPUID 00000012: 00000000-00000000-00000000-00000000 [SL 00]
CPUID 00000012: 00000000-00000000-00000000-00000000 [SL 01]
CPUID 00000013: 00000000-00000000-00000000-00000000
CPUID 00000014: 00000001-0000000F-00000007-00000000 [SL 00]
CPUID 00000014: 02490002-003F3FFF-00000000-00000000 [SL 01]
CPUID 00000015: 00000002-00000124-00000000-00000000 [146.00x / 0]
CPUID 00000016: 00000DAC-0000125C-00000064-00000000 [3500 / 4700 / 100]
CPUID 80000000: 80000008-00000000-00000000-00000000
CPUID 80000001: 00000000-00000000-00000121-2C100000
CPUID 80000002: 65746E49-2952286C-726F4320-4D542865 [Intel(R) Core(TM]
CPUID 80000003: 37692029-3038372D-43205830-40205550 [) i7-7800X CPU @]
CPUID 80000004: 352E3320-7A484730-00000000-00000000 [ 3.50GHz]
CPUID 80000005: 00000000-00000000-00000000-00000000
CPUID 80000006: 00000000-00000000-01006040-00000000
CPUID 80000007: 00000000-00000000-00000000-00000100
CPUID 80000008: 0000302E-00000000-00000000-00000000

L1    Data Cache:    32 KB,  8-way Associative, 64-byte Line
L1  Instr. Cache:    32 KB,  8-way Associative, 64-byte Line
L2 Unified Cache:     1 MB, 16-way Associative, 64-byte Line
L3 Unified Cache:  8448 KB, 11-way Associative, 64-byte Line

------[ Logical CPU #3 ]------

allcpu: Package 0 / Core 1 / Thread 1: Valid, Virtual

CPUID 00000000: 00000016-756E6547-6C65746E-49656E69 [GenuineIntel]
CPUID 00000001: 00050654-03100800-7FFEFBBF-BFEBFBFF
CPUID 00000002: 76036301-00F0B5FF-00000000-00C30000
CPUID 00000003: 00000000-00000000-00000000-00000000
CPUID 00000004: 1C004121-01C0003F-0000003F-00000000 [SL 00]
CPUID 00000004: 1C004122-01C0003F-0000003F-00000000 [SL 01]
CPUID 00000004: 1C004143-03C0003F-000003FF-00000000 [SL 02]
CPUID 00000004: 1C03C163-0280003F-00002FFF-00000004 [SL 03]
CPUID 00000005: 00000040-00000040-00000003-00002020
CPUID 00000006: 00000077-00000002-00000009-00000000
CPUID 00000007: 00000000-D39FFFFB-00000000-00000000
CPUID 00000008: 00000000-00000000-00000000-00000000
CPUID 00000009: 00000000-00000000-00000000-00000000
CPUID 0000000A: 07300404-00000000-00000000-00000603
CPUID 0000000B: 00000001-00000002-00000100-00000003 [SL 00]
CPUID 0000000B: 00000004-0000000C-00000201-00000003 [SL 01]
CPUID 0000000C: 00000000-00000000-00000000-00000000
CPUID 0000000D: 000000FF-00000A80-00000A80-00000000 [SL 00]
CPUID 0000000D: 0000000F-00000A00-00000100-00000000 [SL 01]
CPUID 0000000D: 00000100-00000240-00000000-00000000 [SL 02]
CPUID 0000000D: 00000040-000003C0-00000000-00000000 [SL 03]
CPUID 0000000D: 00000040-00000400-00000000-00000000 [SL 04]
CPUID 0000000D: 00000040-00000440-00000000-00000000 [SL 05]
CPUID 0000000D: 00000200-00000480-00000000-00000000 [SL 06]
CPUID 0000000D: 00000400-00000680-00000000-00000000 [SL 07]
CPUID 0000000D: 00000080-00000000-00000001-00000000 [SL 08]
CPUID 0000000E: 00000000-00000000-00000000-00000000
CPUID 0000000F: 00000000-0000002F-00000000-00000002 [SL 00]
CPUID 0000000F: 00000000-00006000-0000002F-00000007 [SL 01]
CPUID 00000010: 00000000-0000000A-00000000-00000000 [SL 00]
CPUID 00000010: 0000000A-00000600-00000004-0000000F [SL 01]
CPUID 00000011: 00000000-00000000-00000000-00000000
CPUID 00000012: 00000000-00000000-00000000-00000000 [SL 00]
CPUID 00000012: 00000000-00000000-00000000-00000000 [SL 01]
CPUID 00000013: 00000000-00000000-00000000-00000000
CPUID 00000014: 00000001-0000000F-00000007-00000000 [SL 00]
CPUID 00000014: 02490002-003F3FFF-00000000-00000000 [SL 01]
CPUID 00000015: 00000002-00000124-00000000-00000000 [146.00x / 0]
CPUID 00000016: 00000DAC-0000125C-00000064-00000000 [3500 / 4700 / 100]
CPUID 80000000: 80000008-00000000-00000000-00000000
CPUID 80000001: 00000000-00000000-00000121-2C100000
CPUID 80000002: 65746E49-2952286C-726F4320-4D542865 [Intel(R) Core(TM]
CPUID 80000003: 37692029-3038372D-43205830-40205550 [) i7-7800X CPU @]
CPUID 80000004: 352E3320-7A484730-00000000-00000000 [ 3.50GHz]
CPUID 80000005: 00000000-00000000-00000000-00000000
CPUID 80000006: 00000000-00000000-01006040-00000000
CPUID 80000007: 00000000-00000000-00000000-00000100
CPUID 80000008: 0000302E-00000000-00000000-00000000

L1    Data Cache:    32 KB,  8-way Associative, 64-byte Line
L1  Instr. Cache:    32 KB,  8-way Associative, 64-byte Line
L2 Unified Cache:     1 MB, 16-way Associative, 64-byte Line
L3 Unified Cache:  8448 KB, 11-way Associative, 64-byte Line

------[ Logical CPU #4 ]------

allcpu: Package 0 / Core 2 / Thread 0: Valid

CPUID 00000000: 00000016-756E6547-6C65746E-49656E69 [GenuineIntel]
CPUID 00000001: 00050654-04100800-7FFEFBBF-BFEBFBFF
CPUID 00000002: 76036301-00F0B5FF-00000000-00C30000
CPUID 00000003: 00000000-00000000-00000000-00000000
CPUID 00000004: 1C004121-01C0003F-0000003F-00000000 [SL 00]
CPUID 00000004: 1C004122-01C0003F-0000003F-00000000 [SL 01]
CPUID 00000004: 1C004143-03C0003F-000003FF-00000000 [SL 02]
CPUID 00000004: 1C03C163-0280003F-00002FFF-00000004 [SL 03]
CPUID 00000005: 00000040-00000040-00000003-00002020
CPUID 00000006: 00000077-00000002-00000009-00000000
CPUID 00000007: 00000000-D39FFFFB-00000000-00000000
CPUID 00000008: 00000000-00000000-00000000-00000000
CPUID 00000009: 00000000-00000000-00000000-00000000
CPUID 0000000A: 07300404-00000000-00000000-00000603
CPUID 0000000B: 00000001-00000002-00000100-00000004 [SL 00]
CPUID 0000000B: 00000004-0000000C-00000201-00000004 [SL 01]
CPUID 0000000C: 00000000-00000000-00000000-00000000
CPUID 0000000D: 000000FF-00000A80-00000A80-00000000 [SL 00]
CPUID 0000000D: 0000000F-00000A00-00000100-00000000 [SL 01]
CPUID 0000000D: 00000100-00000240-00000000-00000000 [SL 02]
CPUID 0000000D: 00000040-000003C0-00000000-00000000 [SL 03]
CPUID 0000000D: 00000040-00000400-00000000-00000000 [SL 04]
CPUID 0000000D: 00000040-00000440-00000000-00000000 [SL 05]
CPUID 0000000D: 00000200-00000480-00000000-00000000 [SL 06]
CPUID 0000000D: 00000400-00000680-00000000-00000000 [SL 07]
CPUID 0000000D: 00000080-00000000-00000001-00000000 [SL 08]
CPUID 0000000E: 00000000-00000000-00000000-00000000
CPUID 0000000F: 00000000-0000002F-00000000-00000002 [SL 00]
CPUID 0000000F: 00000000-00006000-0000002F-00000007 [SL 01]
CPUID 00000010: 00000000-0000000A-00000000-00000000 [SL 00]
CPUID 00000010: 0000000A-00000600-00000004-0000000F [SL 01]
CPUID 00000011: 00000000-00000000-00000000-00000000
CPUID 00000012: 00000000-00000000-00000000-00000000 [SL 00]
CPUID 00000012: 00000000-00000000-00000000-00000000 [SL 01]
CPUID 00000013: 00000000-00000000-00000000-00000000
CPUID 00000014: 00000001-0000000F-00000007-00000000 [SL 00]
CPUID 00000014: 02490002-003F3FFF-00000000-00000000 [SL 01]
CPUID 00000015: 00000002-00000124-00000000-00000000 [146.00x / 0]
CPUID 00000016: 00000DAC-0000125C-00000064-00000000 [3500 / 4700 / 100]
CPUID 80000000: 80000008-00000000-00000000-00000000
CPUID 80000001: 00000000-00000000-00000121-2C100000
CPUID 80000002: 65746E49-2952286C-726F4320-4D542865 [Intel(R) Core(TM]
CPUID 80000003: 37692029-3038372D-43205830-40205550 [) i7-7800X CPU @]
CPUID 80000004: 352E3320-7A484730-00000000-00000000 [ 3.50GHz]
CPUID 80000005: 00000000-00000000-00000000-00000000
CPUID 80000006: 00000000-00000000-01006040-00000000
CPUID 80000007: 00000000-00000000-00000000-00000100
CPUID 80000008: 0000302E-00000000-00000000-00000000

L1    Data Cache:    32 KB,  8-way Associative, 64-byte Line
L1  Instr. Cache:    32 KB,  8-way Associative, 64-byte Line
L2 Unified Cache:     1 MB, 16-way Associative, 64-byte Line
L3 Unified Cache:  8448 KB, 11-way Associative, 64-byte Line

------[ Logical CPU #5 ]------

allcpu: Package 0 / Core 2 / Thread 1: Valid, Virtual

CPUID 00000000: 00000016-756E6547-6C65746E-49656E69 [GenuineIntel]
CPUID 00000001: 00050654-05100800-7FFEFBBF-BFEBFBFF
CPUID 00000002: 76036301-00F0B5FF-00000000-00C30000
CPUID 00000003: 00000000-00000000-00000000-00000000
CPUID 00000004: 1C004121-01C0003F-0000003F-00000000 [SL 00]
CPUID 00000004: 1C004122-01C0003F-0000003F-00000000 [SL 01]
CPUID 00000004: 1C004143-03C0003F-000003FF-00000000 [SL 02]
CPUID 00000004: 1C03C163-0280003F-00002FFF-00000004 [SL 03]
CPUID 00000005: 00000040-00000040-00000003-00002020
CPUID 00000006: 00000077-00000002-00000009-00000000
CPUID 00000007: 00000000-D39FFFFB-00000000-00000000
CPUID 00000008: 00000000-00000000-00000000-00000000
CPUID 00000009: 00000000-00000000-00000000-00000000
CPUID 0000000A: 07300404-00000000-00000000-00000603
CPUID 0000000B: 00000001-00000002-00000100-00000005 [SL 00]
CPUID 0000000B: 00000004-0000000C-00000201-00000005 [SL 01]
CPUID 0000000C: 00000000-00000000-00000000-00000000
CPUID 0000000D: 000000FF-00000A80-00000A80-00000000 [SL 00]
CPUID 0000000D: 0000000F-00000A00-00000100-00000000 [SL 01]
CPUID 0000000D: 00000100-00000240-00000000-00000000 [SL 02]
CPUID 0000000D: 00000040-000003C0-00000000-00000000 [SL 03]
CPUID 0000000D: 00000040-00000400-00000000-00000000 [SL 04]
CPUID 0000000D: 00000040-00000440-00000000-00000000 [SL 05]
CPUID 0000000D: 00000200-00000480-00000000-00000000 [SL 06]
CPUID 0000000D: 00000400-00000680-00000000-00000000 [SL 07]
CPUID 0000000D: 00000080-00000000-00000001-00000000 [SL 08]
CPUID 0000000E: 00000000-00000000-00000000-00000000
CPUID 0000000F: 00000000-0000002F-00000000-00000002 [SL 00]
CPUID 0000000F: 00000000-00006000-0000002F-00000007 [SL 01]
CPUID 00000010: 00000000-0000000A-00000000-00000000 [SL 00]
CPUID 00000010: 0000000A-00000600-00000004-0000000F [SL 01]
CPUID 00000011: 00000000-00000000-00000000-00000000
CPUID 00000012: 00000000-00000000-00000000-00000000 [SL 00]
CPUID 00000012: 00000000-00000000-00000000-00000000 [SL 01]
CPUID 00000013: 00000000-00000000-00000000-00000000
CPUID 00000014: 00000001-0000000F-00000007-00000000 [SL 00]
CPUID 00000014: 02490002-003F3FFF-00000000-00000000 [SL 01]
CPUID 00000015: 00000002-00000124-00000000-00000000 [146.00x / 0]
CPUID 00000016: 00000DAC-0000125C-00000064-00000000 [3500 / 4700 / 100]
CPUID 80000000: 80000008-00000000-00000000-00000000
CPUID 80000001: 00000000-00000000-00000121-2C100000
CPUID 80000002: 65746E49-2952286C-726F4320-4D542865 [Intel(R) Core(TM]
CPUID 80000003: 37692029-3038372D-43205830-40205550 [) i7-7800X CPU @]
CPUID 80000004: 352E3320-7A484730-00000000-00000000 [ 3.50GHz]
CPUID 80000005: 00000000-00000000-00000000-00000000
CPUID 80000006: 00000000-00000000-01006040-00000000
CPUID 80000007: 00000000-00000000-00000000-00000100
CPUID 80000008: 0000302E-00000000-00000000-00000000

L1    Data Cache:    32 KB,  8-way Associative, 64-byte Line
L1  Instr. Cache:    32 KB,  8-way Associative, 64-byte Line
L2 Unified Cache:     1 MB, 16-way Associative, 64-byte Line
L3 Unified Cache:  8448 KB, 11-way Associative, 64-byte Line

------[ Logical CPU #6 ]------

allcpu: Package 0 / Core 3 / Thread 0: Valid

CPUID 00000000: 00000016-756E6547-6C65746E-49656E69 [GenuineIntel]
CPUID 00000001: 00050654-06100800-7FFEFBBF-BFEBFBFF
CPUID 00000002: 76036301-00F0B5FF-00000000-00C30000
CPUID 00000003: 00000000-00000000-00000000-00000000
CPUID 00000004: 1C004121-01C0003F-0000003F-00000000 [SL 00]
CPUID 00000004: 1C004122-01C0003F-0000003F-00000000 [SL 01]
CPUID 00000004: 1C004143-03C0003F-000003FF-00000000 [SL 02]
CPUID 00000004: 1C03C163-0280003F-00002FFF-00000004 [SL 03]
CPUID 00000005: 00000040-00000040-00000003-00002020
CPUID 00000006: 00000077-00000002-00000009-00000000
CPUID 00000007: 00000000-D39FFFFB-00000000-00000000
CPUID 00000008: 00000000-00000000-00000000-00000000
CPUID 00000009: 00000000-00000000-00000000-00000000
CPUID 0000000A: 07300404-00000000-00000000-00000603
CPUID 0000000B: 00000001-00000002-00000100-00000006 [SL 00]
CPUID 0000000B: 00000004-0000000C-00000201-00000006 [SL 01]
CPUID 0000000C: 00000000-00000000-00000000-00000000
CPUID 0000000D: 000000FF-00000A80-00000A80-00000000 [SL 00]
CPUID 0000000D: 0000000F-00000A00-00000100-00000000 [SL 01]
CPUID 0000000D: 00000100-00000240-00000000-00000000 [SL 02]
CPUID 0000000D: 00000040-000003C0-00000000-00000000 [SL 03]
CPUID 0000000D: 00000040-00000400-00000000-00000000 [SL 04]
CPUID 0000000D: 00000040-00000440-00000000-00000000 [SL 05]
CPUID 0000000D: 00000200-00000480-00000000-00000000 [SL 06]
CPUID 0000000D: 00000400-00000680-00000000-00000000 [SL 07]
CPUID 0000000D: 00000080-00000000-00000001-00000000 [SL 08]
CPUID 0000000E: 00000000-00000000-00000000-00000000
CPUID 0000000F: 00000000-0000002F-00000000-00000002 [SL 00]
CPUID 0000000F: 00000000-00006000-0000002F-00000007 [SL 01]
CPUID 00000010: 00000000-0000000A-00000000-00000000 [SL 00]
CPUID 00000010: 0000000A-00000600-00000004-0000000F [SL 01]
CPUID 00000011: 00000000-00000000-00000000-00000000
CPUID 00000012: 00000000-00000000-00000000-00000000 [SL 00]
CPUID 00000012: 00000000-00000000-00000000-00000000 [SL 01]
CPUID 00000013: 00000000-00000000-00000000-00000000
CPUID 00000014: 00000001-0000000F-00000007-00000000 [SL 00]
CPUID 00000014: 02490002-003F3FFF-00000000-00000000 [SL 01]
CPUID 00000015: 00000002-00000124-00000000-00000000 [146.00x / 0]
CPUID 00000016: 00000DAC-0000125C-00000064-00000000 [3500 / 4700 / 100]
CPUID 80000000: 80000008-00000000-00000000-00000000
CPUID 80000001: 00000000-00000000-00000121-2C100000
CPUID 80000002: 65746E49-2952286C-726F4320-4D542865 [Intel(R) Core(TM]
CPUID 80000003: 37692029-3038372D-43205830-40205550 [) i7-7800X CPU @]
CPUID 80000004: 352E3320-7A484730-00000000-00000000 [ 3.50GHz]
CPUID 80000005: 00000000-00000000-00000000-00000000
CPUID 80000006: 00000000-00000000-01006040-00000000
CPUID 80000007: 00000000-00000000-00000000-00000100
CPUID 80000008: 0000302E-00000000-00000000-00000000

L1    Data Cache:    32 KB,  8-way Associative, 64-byte Line
L1  Instr. Cache:    32 KB,  8-way Associative, 64-byte Line
L2 Unified Cache:     1 MB, 16-way Associative, 64-byte Line
L3 Unified Cache:  8448 KB, 11-way Associative, 64-byte Line

------[ Logical CPU #7 ]------

allcpu: Package 0 / Core 3 / Thread 1: Valid, Virtual

CPUID 00000000: 00000016-756E6547-6C65746E-49656E69 [GenuineIntel]
CPUID 00000001: 00050654-07100800-7FFEFBBF-BFEBFBFF
CPUID 00000002: 76036301-00F0B5FF-00000000-00C30000
CPUID 00000003: 00000000-00000000-00000000-00000000
CPUID 00000004: 1C004121-01C0003F-0000003F-00000000 [SL 00]
CPUID 00000004: 1C004122-01C0003F-0000003F-00000000 [SL 01]
CPUID 00000004: 1C004143-03C0003F-000003FF-00000000 [SL 02]
CPUID 00000004: 1C03C163-0280003F-00002FFF-00000004 [SL 03]
CPUID 00000005: 00000040-00000040-00000003-00002020
CPUID 00000006: 00000077-00000002-00000009-00000000
CPUID 00000007: 00000000-D39FFFFB-00000000-00000000
CPUID 00000008: 00000000-00000000-00000000-00000000
CPUID 00000009: 00000000-00000000-00000000-00000000
CPUID 0000000A: 07300404-00000000-00000000-00000603
CPUID 0000000B: 00000001-00000002-00000100-00000007 [SL 00]
CPUID 0000000B: 00000004-0000000C-00000201-00000007 [SL 01]
CPUID 0000000C: 00000000-00000000-00000000-00000000
CPUID 0000000D: 000000FF-00000A80-00000A80-00000000 [SL 00]
CPUID 0000000D: 0000000F-00000A00-00000100-00000000 [SL 01]
CPUID 0000000D: 00000100-00000240-00000000-00000000 [SL 02]
CPUID 0000000D: 00000040-000003C0-00000000-00000000 [SL 03]
CPUID 0000000D: 00000040-00000400-00000000-00000000 [SL 04]
CPUID 0000000D: 00000040-00000440-00000000-00000000 [SL 05]
CPUID 0000000D: 00000200-00000480-00000000-00000000 [SL 06]
CPUID 0000000D: 00000400-00000680-00000000-00000000 [SL 07]
CPUID 0000000D: 00000080-00000000-00000001-00000000 [SL 08]
CPUID 0000000E: 00000000-00000000-00000000-00000000
CPUID 0000000F: 00000000-0000002F-00000000-00000002 [SL 00]
CPUID 0000000F: 00000000-00006000-0000002F-00000007 [SL 01]
CPUID 00000010: 00000000-0000000A-00000000-00000000 [SL 00]
CPUID 00000010: 0000000A-00000600-00000004-0000000F [SL 01]
CPUID 00000011: 00000000-00000000-00000000-00000000
CPUID 00000012: 00000000-00000000-00000000-00000000 [SL 00]
CPUID 00000012: 00000000-00000000-00000000-00000000 [SL 01]
CPUID 00000013: 00000000-00000000-00000000-00000000
CPUID 00000014: 00000001-0000000F-00000007-00000000 [SL 00]
CPUID 00000014: 02490002-003F3FFF-00000000-00000000 [SL 01]
CPUID 00000015: 00000002-00000124-00000000-00000000 [146.00x / 0]
CPUID 00000016: 00000DAC-0000125C-00000064-00000000 [3500 / 4700 / 100]
CPUID 80000000: 80000008-00000000-00000000-00000000
CPUID 80000001: 00000000-00000000-00000121-2C100000
CPUID 80000002: 65746E49-2952286C-726F4320-4D542865 [Intel(R) Core(TM]
CPUID 80000003: 37692029-3038372D-43205830-40205550 [) i7-7800X CPU @]
CPUID 80000004: 352E3320-7A484730-00000000-00000000 [ 3.50GHz]
CPUID 80000005: 00000000-00000000-00000000-00000000
CPUID 80000006: 00000000-00000000-01006040-00000000
CPUID 80000007: 00000000-00000000-00000000-00000100
CPUID 80000008: 0000302E-00000000-00000000-00000000

L1    Data Cache:    32 KB,  8-way Associative, 64-byte Line
L1  Instr. Cache:    32 KB,  8-way Associative, 64-byte Line
L2 Unified Cache:     1 MB, 16-way Associative, 64-byte Line
L3 Unified Cache:  8448 KB, 11-way Associative, 64-byte Line

------[ Logical CPU #8 ]------

allcpu: Package 0 / Core 4 / Thread 0: Valid

CPUID 00000000: 00000016-756E6547-6C65746E-49656E69 [GenuineIntel]
CPUID 00000001: 00050654-08100800-7FFEFBBF-BFEBFBFF
CPUID 00000002: 76036301-00F0B5FF-00000000-00C30000
CPUID 00000003: 00000000-00000000-00000000-00000000
CPUID 00000004: 1C004121-01C0003F-0000003F-00000000 [SL 00]
CPUID 00000004: 1C004122-01C0003F-0000003F-00000000 [SL 01]
CPUID 00000004: 1C004143-03C0003F-000003FF-00000000 [SL 02]
CPUID 00000004: 1C03C163-0280003F-00002FFF-00000004 [SL 03]
CPUID 00000005: 00000040-00000040-00000003-00002020
CPUID 00000006: 00000077-00000002-00000009-00000000
CPUID 00000007: 00000000-D39FFFFB-00000000-00000000
CPUID 00000008: 00000000-00000000-00000000-00000000
CPUID 00000009: 00000000-00000000-00000000-00000000
CPUID 0000000A: 07300404-00000000-00000000-00000603
CPUID 0000000B: 00000001-00000002-00000100-00000008 [SL 00]
CPUID 0000000B: 00000004-0000000C-00000201-00000008 [SL 01]
CPUID 0000000C: 00000000-00000000-00000000-00000000
CPUID 0000000D: 000000FF-00000A80-00000A80-00000000 [SL 00]
CPUID 0000000D: 0000000F-00000A00-00000100-00000000 [SL 01]
CPUID 0000000D: 00000100-00000240-00000000-00000000 [SL 02]
CPUID 0000000D: 00000040-000003C0-00000000-00000000 [SL 03]
CPUID 0000000D: 00000040-00000400-00000000-00000000 [SL 04]
CPUID 0000000D: 00000040-00000440-00000000-00000000 [SL 05]
CPUID 0000000D: 00000200-00000480-00000000-00000000 [SL 06]
CPUID 0000000D: 00000400-00000680-00000000-00000000 [SL 07]
CPUID 0000000D: 00000080-00000000-00000001-00000000 [SL 08]
CPUID 0000000E: 00000000-00000000-00000000-00000000
CPUID 0000000F: 00000000-0000002F-00000000-00000002 [SL 00]
CPUID 0000000F: 00000000-00006000-0000002F-00000007 [SL 01]
CPUID 00000010: 00000000-0000000A-00000000-00000000 [SL 00]
CPUID 00000010: 0000000A-00000600-00000004-0000000F [SL 01]
CPUID 00000011: 00000000-00000000-00000000-00000000
CPUID 00000012: 00000000-00000000-00000000-00000000 [SL 00]
CPUID 00000012: 00000000-00000000-00000000-00000000 [SL 01]
CPUID 00000013: 00000000-00000000-00000000-00000000
CPUID 00000014: 00000001-0000000F-00000007-00000000 [SL 00]
CPUID 00000014: 02490002-003F3FFF-00000000-00000000 [SL 01]
CPUID 00000015: 00000002-00000124-00000000-00000000 [146.00x / 0]
CPUID 00000016: 00000DAC-0000125C-00000064-00000000 [3500 / 4700 / 100]
CPUID 80000000: 80000008-00000000-00000000-00000000
CPUID 80000001: 00000000-00000000-00000121-2C100000
CPUID 80000002: 65746E49-2952286C-726F4320-4D542865 [Intel(R) Core(TM]
CPUID 80000003: 37692029-3038372D-43205830-40205550 [) i7-7800X CPU @]
CPUID 80000004: 352E3320-7A484730-00000000-00000000 [ 3.50GHz]
CPUID 80000005: 00000000-00000000-00000000-00000000
CPUID 80000006: 00000000-00000000-01006040-00000000
CPUID 80000007: 00000000-00000000-00000000-00000100
CPUID 80000008: 0000302E-00000000-00000000-00000000

L1    Data Cache:    32 KB,  8-way Associative, 64-byte Line
L1  Instr. Cache:    32 KB,  8-way Associative, 64-byte Line
L2 Unified Cache:     1 MB, 16-way Associative, 64-byte Line
L3 Unified Cache:  8448 KB, 11-way Associative, 64-byte Line

------[ Logical CPU #9 ]------

allcpu: Package 0 / Core 4 / Thread 1: Valid, Virtual

CPUID 00000000: 00000016-756E6547-6C65746E-49656E69 [GenuineIntel]
CPUID 00000001: 00050654-09100800-7FFEFBBF-BFEBFBFF
CPUID 00000002: 76036301-00F0B5FF-00000000-00C30000
CPUID 00000003: 00000000-00000000-00000000-00000000
CPUID 00000004: 1C004121-01C0003F-0000003F-00000000 [SL 00]
CPUID 00000004: 1C004122-01C0003F-0000003F-00000000 [SL 01]
CPUID 00000004: 1C004143-03C0003F-000003FF-00000000 [SL 02]
CPUID 00000004: 1C03C163-0280003F-00002FFF-00000004 [SL 03]
CPUID 00000005: 00000040-00000040-00000003-00002020
CPUID 00000006: 00000077-00000002-00000009-00000000
CPUID 00000007: 00000000-D39FFFFB-00000000-00000000
CPUID 00000008: 00000000-00000000-00000000-00000000
CPUID 00000009: 00000000-00000000-00000000-00000000
CPUID 0000000A: 07300404-00000000-00000000-00000603
CPUID 0000000B: 00000001-00000002-00000100-00000009 [SL 00]
CPUID 0000000B: 00000004-0000000C-00000201-00000009 [SL 01]
CPUID 0000000C: 00000000-00000000-00000000-00000000
CPUID 0000000D: 000000FF-00000A80-00000A80-00000000 [SL 00]
CPUID 0000000D: 0000000F-00000A00-00000100-00000000 [SL 01]
CPUID 0000000D: 00000100-00000240-00000000-00000000 [SL 02]
CPUID 0000000D: 00000040-000003C0-00000000-00000000 [SL 03]
CPUID 0000000D: 00000040-00000400-00000000-00000000 [SL 04]
CPUID 0000000D: 00000040-00000440-00000000-00000000 [SL 05]
CPUID 0000000D: 00000200-00000480-00000000-00000000 [SL 06]
CPUID 0000000D: 00000400-00000680-00000000-00000000 [SL 07]
CPUID 0000000D: 00000080-00000000-00000001-00000000 [SL 08]
CPUID 0000000E: 00000000-00000000-00000000-00000000
CPUID 0000000F: 00000000-0000002F-00000000-00000002 [SL 00]
CPUID 0000000F: 00000000-00006000-0000002F-00000007 [SL 01]
CPUID 00000010: 00000000-0000000A-00000000-00000000 [SL 00]
CPUID 00000010: 0000000A-00000600-00000004-0000000F [SL 01]
CPUID 00000011: 00000000-00000000-00000000-00000000
CPUID 00000012: 00000000-00000000-00000000-00000000 [SL 00]
CPUID 00000012: 00000000-00000000-00000000-00000000 [SL 01]
CPUID 00000013: 00000000-00000000-00000000-00000000
CPUID 00000014: 00000001-0000000F-00000007-00000000 [SL 00]
CPUID 00000014: 02490002-003F3FFF-00000000-00000000 [SL 01]
CPUID 00000015: 00000002-00000124-00000000-00000000 [146.00x / 0]
CPUID 00000016: 00000DAC-0000125C-00000064-00000000 [3500 / 4700 / 100]
CPUID 80000000: 80000008-00000000-00000000-00000000
CPUID 80000001: 00000000-00000000-00000121-2C100000
CPUID 80000002: 65746E49-2952286C-726F4320-4D542865 [Intel(R) Core(TM]
CPUID 80000003: 37692029-3038372D-43205830-40205550 [) i7-7800X CPU @]
CPUID 80000004: 352E3320-7A484730-00000000-00000000 [ 3.50GHz]
CPUID 80000005: 00000000-00000000-00000000-00000000
CPUID 80000006: 00000000-00000000-01006040-00000000
CPUID 80000007: 00000000-00000000-00000000-00000100
CPUID 80000008: 0000302E-00000000-00000000-00000000

L1    Data Cache:    32 KB,  8-way Associative, 64-byte Line
L1  Instr. Cache:    32 KB,  8-way Associative, 64-byte Line
L2 Unified Cache:     1 MB, 16-way Associative, 64-byte Line
L3 Unified Cache:  8448 KB, 11-way Associative, 64-byte Line

------[ Logical CPU #10 ]------

allcpu: Package 0 / Core 5 / Thread 0: Valid

CPUID 00000000: 00000016-756E6547-6C65746E-49656E69 [GenuineIntel]
CPUID 00000001: 00050654-0A100800-7FFEFBBF-BFEBFBFF
CPUID 00000002: 76036301-00F0B5FF-00000000-00C30000
CPUID 00000003: 00000000-00000000-00000000-00000000
CPUID 00000004: 1C004121-01C0003F-0000003F-00000000 [SL 00]
CPUID 00000004: 1C004122-01C0003F-0000003F-00000000 [SL 01]
CPUID 00000004: 1C004143-03C0003F-000003FF-00000000 [SL 02]
CPUID 00000004: 1C03C163-0280003F-00002FFF-00000004 [SL 03]
CPUID 00000005: 00000040-00000040-00000003-00002020
CPUID 00000006: 00000077-00000002-00000009-00000000
CPUID 00000007: 00000000-D39FFFFB-00000000-00000000
CPUID 00000008: 00000000-00000000-00000000-00000000
CPUID 00000009: 00000000-00000000-00000000-00000000
CPUID 0000000A: 07300404-00000000-00000000-00000603
CPUID 0000000B: 00000001-00000002-00000100-0000000A [SL 00]
CPUID 0000000B: 00000004-0000000C-00000201-0000000A [SL 01]
CPUID 0000000C: 00000000-00000000-00000000-00000000
CPUID 0000000D: 000000FF-00000A80-00000A80-00000000 [SL 00]
CPUID 0000000D: 0000000F-00000A00-00000100-00000000 [SL 01]
CPUID 0000000D: 00000100-00000240-00000000-00000000 [SL 02]
CPUID 0000000D: 00000040-000003C0-00000000-00000000 [SL 03]
CPUID 0000000D: 00000040-00000400-00000000-00000000 [SL 04]
CPUID 0000000D: 00000040-00000440-00000000-00000000 [SL 05]
CPUID 0000000D: 00000200-00000480-00000000-00000000 [SL 06]
CPUID 0000000D: 00000400-00000680-00000000-00000000 [SL 07]
CPUID 0000000D: 00000080-00000000-00000001-00000000 [SL 08]
CPUID 0000000E: 00000000-00000000-00000000-00000000
CPUID 0000000F: 00000000-0000002F-00000000-00000002 [SL 00]
CPUID 0000000F: 00000000-00006000-0000002F-00000007 [SL 01]
CPUID 00000010: 00000000-0000000A-00000000-00000000 [SL 00]
CPUID 00000010: 0000000A-00000600-00000004-0000000F [SL 01]
CPUID 00000011: 00000000-00000000-00000000-00000000
CPUID 00000012: 00000000-00000000-00000000-00000000 [SL 00]
CPUID 00000012: 00000000-00000000-00000000-00000000 [SL 01]
CPUID 00000013: 00000000-00000000-00000000-00000000
CPUID 00000014: 00000001-0000000F-00000007-00000000 [SL 00]
CPUID 00000014: 02490002-003F3FFF-00000000-00000000 [SL 01]
CPUID 00000015: 00000002-00000124-00000000-00000000 [146.00x / 0]
CPUID 00000016: 00000DAC-0000125C-00000064-00000000 [3500 / 4700 / 100]
CPUID 80000000: 80000008-00000000-00000000-00000000
CPUID 80000001: 00000000-00000000-00000121-2C100000
CPUID 80000002: 65746E49-2952286C-726F4320-4D542865 [Intel(R) Core(TM]
CPUID 80000003: 37692029-3038372D-43205830-40205550 [) i7-7800X CPU @]
CPUID 80000004: 352E3320-7A484730-00000000-00000000 [ 3.50GHz]
CPUID 80000005: 00000000-00000000-00000000-00000000
CPUID 80000006: 00000000-00000000-01006040-00000000
CPUID 80000007: 00000000-00000000-00000000-00000100
CPUID 80000008: 0000302E-00000000-00000000-00000000

L1    Data Cache:    32 KB,  8-way Associative, 64-byte Line
L1  Instr. Cache:    32 KB,  8-way Associative, 64-byte Line
L2 Unified Cache:     1 MB, 16-way Associative, 64-byte Line
L3 Unified Cache:  8448 KB, 11-way Associative, 64-byte Line

------[ Logical CPU #11 ]------

allcpu: Package 0 / Core 5 / Thread 1: Valid, Virtual

CPUID 00000000: 00000016-756E6547-6C65746E-49656E69 [GenuineIntel]
CPUID 00000001: 00050654-0B100800-7FFEFBBF-BFEBFBFF
CPUID 00000002: 76036301-00F0B5FF-00000000-00C30000
CPUID 00000003: 00000000-00000000-00000000-00000000
CPUID 00000004: 1C004121-01C0003F-0000003F-00000000 [SL 00]
CPUID 00000004: 1C004122-01C0003F-0000003F-00000000 [SL 01]
CPUID 00000004: 1C004143-03C0003F-000003FF-00000000 [SL 02]
CPUID 00000004: 1C03C163-0280003F-00002FFF-00000004 [SL 03]
CPUID 00000005: 00000040-00000040-00000003-00002020
CPUID 00000006: 00000077-00000002-00000009-00000000
CPUID 00000007: 00000000-D39FFFFB-00000000-00000000
CPUID 00000008: 00000000-00000000-00000000-00000000
CPUID 00000009: 00000000-00000000-00000000-00000000
CPUID 0000000A: 07300404-00000000-00000000-00000603
CPUID 0000000B: 00000001-00000002-00000100-0000000B [SL 00]
CPUID 0000000B: 00000004-0000000C-00000201-0000000B [SL 01]
CPUID 0000000C: 00000000-00000000-00000000-00000000
CPUID 0000000D: 000000FF-00000A80-00000A80-00000000 [SL 00]
CPUID 0000000D: 0000000F-00000A00-00000100-00000000 [SL 01]
CPUID 0000000D: 00000100-00000240-00000000-00000000 [SL 02]
CPUID 0000000D: 00000040-000003C0-00000000-00000000 [SL 03]
CPUID 0000000D: 00000040-00000400-00000000-00000000 [SL 04]
CPUID 0000000D: 00000040-00000440-00000000-00000000 [SL 05]
CPUID 0000000D: 00000200-00000480-00000000-00000000 [SL 06]
CPUID 0000000D: 00000400-00000680-00000000-00000000 [SL 07]
CPUID 0000000D: 00000080-00000000-00000001-00000000 [SL 08]
CPUID 0000000E: 00000000-00000000-00000000-00000000
CPUID 0000000F: 00000000-0000002F-00000000-00000002 [SL 00]
CPUID 0000000F: 00000000-00006000-0000002F-00000007 [SL 01]
CPUID 00000010: 00000000-0000000A-00000000-00000000 [SL 00]
CPUID 00000010: 0000000A-00000600-00000004-0000000F [SL 01]
CPUID 00000011: 00000000-00000000-00000000-00000000
CPUID 00000012: 00000000-00000000-00000000-00000000 [SL 00]
CPUID 00000012: 00000000-00000000-00000000-00000000 [SL 01]
CPUID 00000013: 00000000-00000000-00000000-00000000
CPUID 00000014: 00000001-0000000F-00000007-00000000 [SL 00]
CPUID 00000014: 02490002-003F3FFF-00000000-00000000 [SL 01]
CPUID 00000015: 00000002-00000124-00000000-00000000 [146.00x / 0]
CPUID 00000016: 00000DAC-0000125C-00000064-00000000 [3500 / 4700 / 100]
CPUID 80000000: 80000008-00000000-00000000-00000000
CPUID 80000001: 00000000-00000000-00000121-2C100000
CPUID 80000002: 65746E49-2952286C-726F4320-4D542865 [Intel(R) Core(TM]
CPUID 80000003: 37692029-3038372D-43205830-40205550 [) i7-7800X CPU @]
CPUID 80000004: 352E3320-7A484730-00000000-00000000 [ 3.50GHz]
CPUID 80000005: 00000000-00000000-00000000-00000000
CPUID 80000006: 00000000-00000000-01006040-00000000
CPUID 80000007: 00000000-00000000-00000000-00000100
CPUID 80000008: 0000302E-00000000-00000000-00000000

L1    Data Cache:    32 KB,  8-way Associative, 64-byte Line
L1  Instr. Cache:    32 KB,  8-way Associative, 64-byte Line
L2 Unified Cache:     1 MB, 16-way Associative, 64-byte Line
L3 Unified Cache:  8448 KB, 11-way Associative, 64-byte Line

------[ All CPUs ]------

CPU   0: APICID    0 / Package 0 / Core   0 / Thread 0: Valid
CPU   1: APICID    1 / Package 0 / Core   0 / Thread 1: Valid, Virtual
CPU   2: APICID    2 / Package 0 / Core   1 / Thread 0: Valid
CPU   3: APICID    3 / Package 0 / Core   1 / Thread 1: Valid, Virtual
CPU   4: APICID    4 / Package 0 / Core   2 / Thread 0: Valid
CPU   5: APICID    5 / Package 0 / Core   2 / Thread 1: Valid, Virtual
CPU   6: APICID    6 / Package 0 / Core   3 / Thread 0: Valid
CPU   7: APICID    7 / Package 0 / Core   3 / Thread 1: Valid, Virtual
CPU   8: APICID    8 / Package 0 / Core   4 / Thread 0: Valid
CPU   9: APICID    9 / Package 0 / Core   4 / Thread 1: Valid, Virtual
CPU  10: APICID   10 / Package 0 / Core   5 / Thread 0: Valid
CPU  11: APICID   11 / Package 0 / Core   5 / Thread 1: Valid, Virtual

------[ MSR Registers ]------

MSR 00000017: 0008-0000-0000-0000 [PlatID = 2]
MSR 0000001B: 0000-0000-FEE0-0900
MSR 00000035: 0000-0000-0006-000C
MSR 0000008B: 0200-0021-0000-0000
MSR 000000CE: 0007-0C2C-F301-2300 [eD = 0]
MSR 000000E7: 0000-0089-CECA-0C73 [S200]
MSR 000000E7: 0000-0089-D02E-4598 [S200]
MSR 000000E7: 0000-0089-D1BA-C882
MSR 000000E8: 0000-0089-F600-9A69 [S200]
MSR 000000E8: 0000-0089-F805-9516 [S200]
MSR 000000E8: 0000-0089-F891-F2D0
MSR 00000194: 0000-0000-000E-0000
MSR 00000198: 0000-2760-0000-0C00 [S200]
MSR 00000198: 0000-2760-0000-0C00 [S200]
MSR 00000198: 0000-2760-0000-0C00
MSR 00000199: 0000-0000-0000-0C00
MSR 0000019A: 0000-0000-0000-0000
MSR 0000019B: 0000-0000-0000-0000
MSR 0000019C: 0000-0000-884F-0000 [S200]
MSR 0000019C: 0000-0000-884F-0000 [S200]
MSR 0000019C: 0000-0000-884E-0000
MSR 0000019D: 0000-0000-0000-0000
MSR 000001A0: 0000-0000-0085-0089
MSR 000001A2: 0000-0000-0069-0A00
MSR 000001A4: 0000-0000-0000-0000
MSR 000001AA: 0000-0000-0040-2000
MSR 000001AC: < FAILED >
MSR 000001AD: 2F2F-2F2F-2F2F-2F2F
MSR 000001AE: 1C18-1410-0C06-0402
MSR 000001AF: < FAILED >
MSR 000001B0: 0000-0000-0000-0006
MSR 000001B1: 0000-0000-884D-0000
MSR 000001B2: 0000-0000-0000-0000
MSR 000001FC: 0000-0000-292C-0059
MSR 00000300: 8000-0000-B264-1600
MSR 0000030A: 0000-0000-0000-0000 [S200]
MSR 0000030A: 0000-0000-0000-0000 [S200]
MSR 0000030A: 0000-0000-0000-0000
MSR 0000030B: 0000-0000-0000-0000 [S200]
MSR 0000030B: 0000-0000-0000-0000 [S200]
MSR 0000030B: 0000-0000-0000-0000
MSR 00000480: 00DA-0400-0000-0004
MSR 00000481: 0000-00FF-0000-0016
MSR 00000482: FFF9-FFFE-0401-E172
MSR 00000483: 01FF-FFFF-0003-6DFF
MSR 00000484: 0003-FFFF-0000-11FF
MSR 00000485: 0000-0000-7004-C1E7
MSR 00000486: 0000-0000-8000-0021
MSR 00000487: 0000-0000-FFFF-FFFF
MSR 00000488: 0000-0000-0000-2000
MSR 00000489: 0000-0000-0037-27FF
MSR 0000048A: 0000-0000-0000-002E
MSR 0000048B: 025D-3FFF-0000-0000
MSR 0000048C: 0000-0F01-0673-4141
MSR 0000048D: 0000-00FF-0000-0016
MSR 0000048E: FFF9-FFFE-0400-6172
MSR 0000048F: 01FF-FFFF-0003-6DFB
MSR 00000490: 0003-FFFF-0000-11FB
MSR 00000601: 0000-0000-0000-1FFF
MSR 00000602: < FAILED >
MSR 00000603: 0016-0000-0017-1717
MSR 00000604: < FAILED >
MSR 00000606: 0000-0000-000A-0E03
MSR 0000060A: 0000-0000-0000-0000
MSR 0000060B: 0000-0000-0000-0000
MSR 0000060C: 0000-0000-0000-0000
MSR 0000060D: 0000-0000-0000-0000
MSR 00000610: 0003-FFF8-0014-FFF8
MSR 00000611: 0000-0000-00DA-9BAB [S200]
MSR 00000611: 0000-0000-00DA-AAB1 [S200]
MSR 00000611: 0000-0000-00DA-B9B1
MSR 00000613: 0000-0000-0000-0000
MSR 00000614: 0000-09A0-0168-03D0
MSR 00000618: 0000-0000-0000-0000
MSR 00000619: 0000-0000-0000-0000 [S200]
MSR 00000619: 0000-0000-0000-0000 [S200]
MSR 00000619: 0000-0000-0000-0000
MSR 0000061B: 0000-0000-0000-0000
MSR 0000061C: 000F-0160-0024-00C4
MSR 0000061E: 0000-0000-0000-0000
MSR 00000620: 0000-0000-0000-0818
MSR 00000621: 0000-0000-0000-0008
MSR 00000638: 0000-0000-0000-0000
MSR 00000639: 0000-0000-0000-0000 [S200]
MSR 00000639: 0000-0000-0000-0000 [S200]
MSR 00000639: 0000-0000-0000-0000
MSR 0000063A: < FAILED >
MSR 0000063B: < FAILED >
MSR 00000640: < FAILED >
MSR 00000641: < FAILED >
MSR 00000642: < FAILED >
MSR 00000648: 0000-0000-0000-0023
MSR 00000649: 00B4-0000-001E-0460
MSR 0000064A: 00B4-0000-001E-0460
MSR 0000064B: 0000-0000-8000-0000
MSR 0000064C: 0000-0000-0000-0000
MSR 00000690: 0000-0000-0000-0000
MSR 000006B0: < FAILED >
MSR 000006B1: 0000-0000-0000-0000
