------[ Versions ]------

Program Version : EVEREST v4.60.1628 Beta
BenchDLL Version: 2.4.257.0

------[ CPU Info ]------

CPU Type           : Transmeta Crusoe TM5800, 1000 MHz
Instruction Set    : x86, MMX
CPUID Manufacturer : TransmetaCPU
CPUID CPU Name     : Transmeta(tm) Crusoe(tm) Processor TM5800
CPUID Revision     : 00000543h
Platform ID        : 00h  (Unknown)

------[ Logical CPU #0 ]------

allcpu: Valid

CPUID 00000000: 00000003-756E6547-3638784D-54656E69
CPUID 00000001: 00000543-00000000-00000000-0084893F
CPUID 00000002: 00000000-00000000-00000000-00000000
CPUID 00000003: 00000000-229B3189-0061A48B-000068D6
CPUID 80000000: 80000006-6E617254-55504361-74656D73
CPUID 80000001: 00000543-00000000-00000000-0081813F
CPUID 80000002: 6E617254-74656D73-6D742861-72432029
CPUID 80000003: 656F7375-296D7428-6F725020-73736563
CPUID 80000004: 5420726F-3038354D-00000030-00000000
CPUID 80000005: 00000000-04FF04FF-40100120-40080140
CPUID 80000006: 00000000-00000000-02004180-00000000
CPUID 80860000: 80860007-6E617254-55504361-74656D73
CPUID 80860001: 00000543-01050002-000003E8-000001CE
CPUID 80860002: 00000000-0404030A-000000B8-00000000
CPUID 80860003: 33303032-38313630-3A353120-6F203732
CPUID 80860004: 63696666-206C6169-656C6572-20657361
CPUID 80860005: 2E342E34-00312333-00000000-00000000
CPUID 80860006: 00000000-00000000-00000000-00000000
CPUID 80860007: 000003E8-00000578-00000064-000048CB

------[ MSR Registers ]------

MSR 80868010: 0000-0064-0000-0064
MSR 80868011: 0000-0000-0000-0000
MSR 80868018: 0000-0006-0000-0006
MSR 80868019: 0000-0000-0000-0000
MSR 8086801A: 0000-0320-0000-012C
MSR 8086801B: 0000-0003-0000-0004
MSR 8086801C: 0000-0000-0000-0009
MSR 8086801D: 0000-0000-0000-8F3D
MSR 80868030: 0000-0000-0000-00FF
MSR 80868031: 0000-0000-0000-0000
MSR 80868032: 0000-0000-0000-0000
MSR 80868033: 0000-0000-0000-0000
MSR 80868034: 1006-9883-1510-041B
MSR 80868035: 0000-0000-0000-2000
MSR 80868036: 0000-0162-0000-0062
MSR 80868037: 0000-0000-0000-1B21

PerformanceFrequency = 3579545

Tjmax Temperature = 0 Celsius
