------[ Versions ]------

Program Version : EVEREST v4.60.1628 Beta
BenchDLL Version: 2.4.257.0

------[ CPU Info ]------

CPU Type           : Intel Celeron, 1715 MHz (17 x 101)
CPU Alias          : Willamette-128
CPU Platform       : Socket 478
CPU Stepping       : E0
Instruction Set    : x86, MMX, SSE, SSE2
CPUID Manufacturer : GenuineIntel
CPUID CPU Name     : Intel(R) Celeron(R) CPU 1.70GHz
CPUID Revision     : 00000F13h
IA Brand ID        : 0Ah  (Intel Celeron)
Platform ID        : 1Fh  (Socket 478)

------[ Logical CPU #0 ]------

allcpu: Valid

CPUID 00000000: 00000002-756E6547-6C65746E-49656E69
CPUID 00000001: 00000F13-0001080A-00000000-3FEBFBFF
CPUID 00000002: 665B5001-00000000-00000000-00397040
CPUID 80000000: 80000004-00000000-00000000-00000000
CPUID 80000001: 00000000-00000000-00000000-00000000
CPUID 80000002: 20202020-20202020-20202020-20202020
CPUID 80000003: 65746E49-2952286C-6C654320-6E6F7265
CPUID 80000004: 20295228-20555043-30372E31-007A4847

------[ MSR Registers ]------

MSR 00000017: 0008-0000-0000-0000 [PlatID = 2]
MSR 0000001B: 0000-0000-FEE0-0900
MSR 0000002A: 0000-0000-0000-4100
MSR 0000002C: 0000-0000-8A01-FE00
MSR 0000008B: 0000-0004-0000-0000
MSR 0000019A: 0000-0000-0000-0000
MSR 0000019B: 0000-0000-0000-0000
MSR 0000019C: 0000-0000-0000-0000
MSR 000001A0: 0000-0000-0000-0081

PerformanceFrequency = 3579545

Tjmax Temperature = 0 Celsius
