------[ Versions ]------

Program Version : EVEREST v5.00.1650
BenchDLL Version: 2.4.257.0

------[ CPU Info ]------

CPU Type           : DualCore Intel Core 2 Duo E6700, 2666 MHz (10 x 267)
CPU Alias          : Conroe
CPU Platform       : LGA775
CPU Stepping       : B0
Instruction Set    : x86, x86-64, MMX, SSE, SSE2, SSE3, SSSE3
CPUID Manufacturer : GenuineIntel
CPUID CPU Name     : Genuine Intel(R) CPU @ 2.66GHz
CPUID Revision     : 000006F4h
IA Brand ID        : 00h  (Unknown)
Platform ID        : 2Ah  (LGA775)

------[ Logical CPU #0 ]------

allcpu: Valid

CPUID 00000000: 0000000A-756E6547-6C65746E-49656E69
CPUID 00000001: 000006F4-00020800-0000E3BD-BFEBFBFF
CPUID 00000002: 05B0B101-005657F0-00000000-2CB43049
CPUID 00000003: 00000000-00000000-00000000-00000000
CPUID 00000004: 04000121-01C0003F-0000003F-00000001
CPUID 00000004: 04000122-01C0003F-0000003F-00000001
CPUID 00000004: 04004143-03C0003F-00000FFF-00000001
CPUID 00000005: 00000040-00000040-00000003-00000020
CPUID 00000006: 00000001-00000002-00000001-00000000
CPUID 00000007: 00000000-00000000-00000000-00000000
CPUID 00000008: 00000400-00000000-00000000-00000000
CPUID 00000009: 00000000-00000000-00000000-00000000
CPUID 0000000A: 07280202-00000000-00000000-00000000
CPUID 80000000: 80000008-00000000-00000000-00000000
CPUID 80000001: 00000000-00000000-00000001-20100000
CPUID 80000002: 756E6547-20656E69-65746E49-2952286C
CPUID 80000003: 55504320-20202020-20202020-20202020
CPUID 80000004: 20202020-20402020-36362E32-007A4847
CPUID 80000005: 00000000-00000000-00000000-00000000
CPUID 80000006: 00000000-00000000-10008040-00000000
CPUID 80000007: 00000000-00000000-00000000-00000000
CPUID 80000008: 00003024-00000000-00000000-00000000

L1    Data Cache:     32 KB,  8-way Associative, 64-byte Line
L1  Instr. Cache:     32 KB,  8-way Associative, 64-byte Line
L2 Unified Cache:   4096 KB, 16-way Associative, 64-byte Line

------[ Logical CPU #1 ]------

allcpu: Valid

CPUID 00000000: 0000000A-756E6547-6C65746E-49656E69
CPUID 00000001: 000006F4-01020800-0000E3BD-BFEBFBFF
CPUID 00000002: 05B0B101-005657F0-00000000-2CB43049
CPUID 00000003: 00000000-00000000-00000000-00000000
CPUID 00000004: 04000121-01C0003F-0000003F-00000001
CPUID 00000004: 04000122-01C0003F-0000003F-00000001
CPUID 00000004: 04004143-03C0003F-00000FFF-00000001
CPUID 00000005: 00000040-00000040-00000003-00000020
CPUID 00000006: 00000001-00000002-00000001-00000000
CPUID 00000007: 00000000-00000000-00000000-00000000
CPUID 00000008: 00000400-00000000-00000000-00000000
CPUID 00000009: 00000000-00000000-00000000-00000000
CPUID 0000000A: 07280202-00000000-00000000-00000000
CPUID 80000000: 80000008-00000000-00000000-00000000
CPUID 80000001: 00000000-00000000-00000001-20100000
CPUID 80000002: 756E6547-20656E69-65746E49-2952286C
CPUID 80000003: 55504320-20202020-20202020-20202020
CPUID 80000004: 20202020-20402020-36362E32-007A4847
CPUID 80000005: 00000000-00000000-00000000-00000000
CPUID 80000006: 00000000-00000000-10008040-00000000
CPUID 80000007: 00000000-00000000-00000000-00000000
CPUID 80000008: 00003024-00000000-00000000-00000000

L1    Data Cache:     32 KB,  8-way Associative, 64-byte Line
L1  Instr. Cache:     32 KB,  8-way Associative, 64-byte Line
L2 Unified Cache:   4096 KB, 16-way Associative, 64-byte Line

------[ MSR Registers ]------

MSR 00000017: 0000-0000-8004-0A28 [PlatID = 0]
MSR 0000001B: 0000-0000-FEE0-0900
MSR 0000002A: 0000-0000-4288-0000
MSR 0000008B: 0000-0026-0000-0000
MSR 000000CD: 0000-0000-0000-0800
MSR 000000CE: 001D-0A28-7F5D-071D
MSR 000000E7: 0000-000B-F5D9-40BC
MSR 000000E8: 0000-000B-F5D9-639E
MSR 000000EE: 0000-0000-817D-4300
MSR 0000011E: 0000-0000-BE70-2129
MSR 00000198: 0A28-0A28-0600-0A28
MSR 00000199: 0000-0000-0000-0A28
MSR 0000019A: 0000-0000-0000-0002
MSR 0000019B: 0000-0000-0000-0008
MSR 0000019C: 0000-0000-8821-0000
MSR 0000019D: 0000-0000-0000-061D
MSR 000001A0: 0000-0040-6097-2489

PerformanceFrequency = 2670030000

Tjmax Temperature = 100 Celsius
