------[ Versions ]------

Program Version : AIDA64 v2.85.2440 Beta
BenchDLL Version: 4.0.560-x64

------[ CPU Info ]------

CPU Type           : 2x OctalCore Intel Xeon, 3000 MHz (30 x 100)
CPU Alias          : Sandy Bridge-EP
CPU Platform       : LGA2011 DP
CPU Stepping       : C0
Instruction Set    : x86, x86-64, MMX, SSE, SSE2, SSE3, SSSE3, SSE4.1, SSE4.2, AES, AVX
CPUID Manufacturer : GenuineIntel
CPUID CPU Name     : Genuine Intel(R) CPU @ 2.60GHz
CPUID Revision     : 000206D5h
IA Brand ID        : 00h  (Unknown)
Platform ID        : 3Ah  (LGA2011 DP)
HTT / CMP Units    : 2 / 8
Tjmax Temperature  : 100 Celsius
Max. NUMA Node     : 1 -> NUMA is active!

------[ Logical CPU #0 ]------

allcpu: Package 0 / Core 0 / Thread 0: Valid

CPUID 00000000: 0000000D-756E6547-6C65746E-49656E69 [GenuineIntel]
CPUID 00000001: 000206D5-00200800-1FBEE3FF-BFEBFBFF
CPUID 00000002: 76035A01-00F0B2FF-00000000-00CA0000
CPUID 00000003: 00000000-00000000-00000000-00000000
CPUID 00000004: 3C004121-01C0003F-0000003F-00000000
CPUID 00000004: 3C004122-01C0003F-0000003F-00000000
CPUID 00000004: 3C004143-01C0003F-000001FF-00000000
CPUID 00000004: 3C07C163-04C0003F-00003FFF-00000006
CPUID 00000005: 00000040-00000040-00000003-00021120
CPUID 00000006: 00000077-00000002-00000009-00000000
CPUID 00000007: 00000000-00000000-00000000-00000000
CPUID 00000008: 00000000-00000000-00000000-00000000
CPUID 00000009: 00000001-00000000-00000000-00000000
CPUID 0000000A: 07300403-00000000-00000000-00000603
CPUID 0000000B: 00000001-00000002-00000100-00000000
CPUID 0000000B: 00000005-00000010-00000201-00000000
CPUID 0000000C: 00000000-00000000-00000000-00000000
CPUID 0000000D: 00000007-00000340-00000340-00000000
CPUID 0000000D: 00000100-00000240-00000000-00000000
CPUID 80000000: 80000008-00000000-00000000-00000000
CPUID 80000001: 00000000-00000000-00000001-2C100000
CPUID 80000002: 20202020-20202020-20202020-20202020 [                ]
CPUID 80000003: 756E6547-20656E69-65746E49-2952286C [Genuine Intel(R)]
CPUID 80000004: 55504320-20402020-30362E32-007A4847 [ CPU  @ 2.60GHz]
CPUID 80000005: 00000000-00000000-00000000-00000000
CPUID 80000006: 00000000-00000000-01006040-00000000
CPUID 80000007: 00000000-00000000-00000000-00000100
CPUID 80000008: 0000302E-00000000-00000000-00000000

L1    Data Cache:     32 KB,  8-way Associative, 64-byte Line
L1  Instr. Cache:     32 KB,  8-way Associative, 64-byte Line
L2 Unified Cache:    256 KB,  8-way Associative, 64-byte Line
L3 Unified Cache:  20480 KB, 20-way Associative, 64-byte Line

------[ Logical CPU #1 ]------

allcpu: Package 0 / Core 0 / Thread 1: Valid, Virtual

CPUID 00000000: 0000000D-756E6547-6C65746E-49656E69 [GenuineIntel]
CPUID 00000001: 000206D5-01200800-1FBEE3FF-BFEBFBFF
CPUID 00000002: 76035A01-00F0B2FF-00000000-00CA0000
CPUID 00000003: 00000000-00000000-00000000-00000000
CPUID 00000004: 3C004121-01C0003F-0000003F-00000000
CPUID 00000004: 3C004122-01C0003F-0000003F-00000000
CPUID 00000004: 3C004143-01C0003F-000001FF-00000000
CPUID 00000004: 3C07C163-04C0003F-00003FFF-00000006
CPUID 00000005: 00000040-00000040-00000003-00021120
CPUID 00000006: 00000077-00000002-00000009-00000000
CPUID 00000007: 00000000-00000000-00000000-00000000
CPUID 00000008: 00000000-00000000-00000000-00000000
CPUID 00000009: 00000001-00000000-00000000-00000000
CPUID 0000000A: 07300403-00000000-00000000-00000603
CPUID 0000000B: 00000001-00000002-00000100-00000001
CPUID 0000000B: 00000005-00000010-00000201-00000001
CPUID 0000000C: 00000000-00000000-00000000-00000000
CPUID 0000000D: 00000007-00000340-00000340-00000000
CPUID 0000000D: 00000100-00000240-00000000-00000000
CPUID 80000000: 80000008-00000000-00000000-00000000
CPUID 80000001: 00000000-00000000-00000001-2C100000
CPUID 80000002: 20202020-20202020-20202020-20202020 [                ]
CPUID 80000003: 756E6547-20656E69-65746E49-2952286C [Genuine Intel(R)]
CPUID 80000004: 55504320-20402020-30362E32-007A4847 [ CPU  @ 2.60GHz]
CPUID 80000005: 00000000-00000000-00000000-00000000
CPUID 80000006: 00000000-00000000-01006040-00000000
CPUID 80000007: 00000000-00000000-00000000-00000100
CPUID 80000008: 0000302E-00000000-00000000-00000000

L1    Data Cache:     32 KB,  8-way Associative, 64-byte Line
L1  Instr. Cache:     32 KB,  8-way Associative, 64-byte Line
L2 Unified Cache:    256 KB,  8-way Associative, 64-byte Line
L3 Unified Cache:  20480 KB, 20-way Associative, 64-byte Line

------[ Logical CPU #2 ]------

allcpu: Package 0 / Core 1 / Thread 0: Valid

CPUID 00000000: 0000000D-756E6547-6C65746E-49656E69 [GenuineIntel]
CPUID 00000001: 000206D5-02200800-1FBEE3FF-BFEBFBFF
CPUID 00000002: 76035A01-00F0B2FF-00000000-00CA0000
CPUID 00000003: 00000000-00000000-00000000-00000000
CPUID 00000004: 3C004121-01C0003F-0000003F-00000000
CPUID 00000004: 3C004122-01C0003F-0000003F-00000000
CPUID 00000004: 3C004143-01C0003F-000001FF-00000000
CPUID 00000004: 3C07C163-04C0003F-00003FFF-00000006
CPUID 00000005: 00000040-00000040-00000003-00021120
CPUID 00000006: 00000077-00000002-00000009-00000000
CPUID 00000007: 00000000-00000000-00000000-00000000
CPUID 00000008: 00000000-00000000-00000000-00000000
CPUID 00000009: 00000001-00000000-00000000-00000000
CPUID 0000000A: 07300403-00000000-00000000-00000603
CPUID 0000000B: 00000001-00000002-00000100-00000002
CPUID 0000000B: 00000005-00000010-00000201-00000002
CPUID 0000000C: 00000000-00000000-00000000-00000000
CPUID 0000000D: 00000007-00000340-00000340-00000000
CPUID 0000000D: 00000100-00000240-00000000-00000000
CPUID 80000000: 80000008-00000000-00000000-00000000
CPUID 80000001: 00000000-00000000-00000001-2C100000
CPUID 80000002: 20202020-20202020-20202020-20202020 [                ]
CPUID 80000003: 756E6547-20656E69-65746E49-2952286C [Genuine Intel(R)]
CPUID 80000004: 55504320-20402020-30362E32-007A4847 [ CPU  @ 2.60GHz]
CPUID 80000005: 00000000-00000000-00000000-00000000
CPUID 80000006: 00000000-00000000-01006040-00000000
CPUID 80000007: 00000000-00000000-00000000-00000100
CPUID 80000008: 0000302E-00000000-00000000-00000000

L1    Data Cache:     32 KB,  8-way Associative, 64-byte Line
L1  Instr. Cache:     32 KB,  8-way Associative, 64-byte Line
L2 Unified Cache:    256 KB,  8-way Associative, 64-byte Line
L3 Unified Cache:  20480 KB, 20-way Associative, 64-byte Line

------[ Logical CPU #3 ]------

allcpu: Package 0 / Core 1 / Thread 1: Valid, Virtual

CPUID 00000000: 0000000D-756E6547-6C65746E-49656E69 [GenuineIntel]
CPUID 00000001: 000206D5-03200800-1FBEE3FF-BFEBFBFF
CPUID 00000002: 76035A01-00F0B2FF-00000000-00CA0000
CPUID 00000003: 00000000-00000000-00000000-00000000
CPUID 00000004: 3C004121-01C0003F-0000003F-00000000
CPUID 00000004: 3C004122-01C0003F-0000003F-00000000
CPUID 00000004: 3C004143-01C0003F-000001FF-00000000
CPUID 00000004: 3C07C163-04C0003F-00003FFF-00000006
CPUID 00000005: 00000040-00000040-00000003-00021120
CPUID 00000006: 00000077-00000002-00000009-00000000
CPUID 00000007: 00000000-00000000-00000000-00000000
CPUID 00000008: 00000000-00000000-00000000-00000000
CPUID 00000009: 00000001-00000000-00000000-00000000
CPUID 0000000A: 07300403-00000000-00000000-00000603
CPUID 0000000B: 00000001-00000002-00000100-00000003
CPUID 0000000B: 00000005-00000010-00000201-00000003
CPUID 0000000C: 00000000-00000000-00000000-00000000
CPUID 0000000D: 00000007-00000340-00000340-00000000
CPUID 0000000D: 00000100-00000240-00000000-00000000
CPUID 80000000: 80000008-00000000-00000000-00000000
CPUID 80000001: 00000000-00000000-00000001-2C100000
CPUID 80000002: 20202020-20202020-20202020-20202020 [                ]
CPUID 80000003: 756E6547-20656E69-65746E49-2952286C [Genuine Intel(R)]
CPUID 80000004: 55504320-20402020-30362E32-007A4847 [ CPU  @ 2.60GHz]
CPUID 80000005: 00000000-00000000-00000000-00000000
CPUID 80000006: 00000000-00000000-01006040-00000000
CPUID 80000007: 00000000-00000000-00000000-00000100
CPUID 80000008: 0000302E-00000000-00000000-00000000

L1    Data Cache:     32 KB,  8-way Associative, 64-byte Line
L1  Instr. Cache:     32 KB,  8-way Associative, 64-byte Line
L2 Unified Cache:    256 KB,  8-way Associative, 64-byte Line
L3 Unified Cache:  20480 KB, 20-way Associative, 64-byte Line

------[ Logical CPU #4 ]------

allcpu: Package 0 / Core 2 / Thread 0: Valid

CPUID 00000000: 0000000D-756E6547-6C65746E-49656E69 [GenuineIntel]
CPUID 00000001: 000206D5-04200800-1FBEE3FF-BFEBFBFF
CPUID 00000002: 76035A01-00F0B2FF-00000000-00CA0000
CPUID 00000003: 00000000-00000000-00000000-00000000
CPUID 00000004: 3C004121-01C0003F-0000003F-00000000
CPUID 00000004: 3C004122-01C0003F-0000003F-00000000
CPUID 00000004: 3C004143-01C0003F-000001FF-00000000
CPUID 00000004: 3C07C163-04C0003F-00003FFF-00000006
CPUID 00000005: 00000040-00000040-00000003-00021120
CPUID 00000006: 00000077-00000002-00000009-00000000
CPUID 00000007: 00000000-00000000-00000000-00000000
CPUID 00000008: 00000000-00000000-00000000-00000000
CPUID 00000009: 00000001-00000000-00000000-00000000
CPUID 0000000A: 07300403-00000000-00000000-00000603
CPUID 0000000B: 00000001-00000002-00000100-00000004
CPUID 0000000B: 00000005-00000010-00000201-00000004
CPUID 0000000C: 00000000-00000000-00000000-00000000
CPUID 0000000D: 00000007-00000340-00000340-00000000
CPUID 0000000D: 00000100-00000240-00000000-00000000
CPUID 80000000: 80000008-00000000-00000000-00000000
CPUID 80000001: 00000000-00000000-00000001-2C100000
CPUID 80000002: 20202020-20202020-20202020-20202020 [                ]
CPUID 80000003: 756E6547-20656E69-65746E49-2952286C [Genuine Intel(R)]
CPUID 80000004: 55504320-20402020-30362E32-007A4847 [ CPU  @ 2.60GHz]
CPUID 80000005: 00000000-00000000-00000000-00000000
CPUID 80000006: 00000000-00000000-01006040-00000000
CPUID 80000007: 00000000-00000000-00000000-00000100
CPUID 80000008: 0000302E-00000000-00000000-00000000

L1    Data Cache:     32 KB,  8-way Associative, 64-byte Line
L1  Instr. Cache:     32 KB,  8-way Associative, 64-byte Line
L2 Unified Cache:    256 KB,  8-way Associative, 64-byte Line
L3 Unified Cache:  20480 KB, 20-way Associative, 64-byte Line

------[ Logical CPU #5 ]------

allcpu: Package 0 / Core 2 / Thread 1: Valid, Virtual

CPUID 00000000: 0000000D-756E6547-6C65746E-49656E69 [GenuineIntel]
CPUID 00000001: 000206D5-05200800-1FBEE3FF-BFEBFBFF
CPUID 00000002: 76035A01-00F0B2FF-00000000-00CA0000
CPUID 00000003: 00000000-00000000-00000000-00000000
CPUID 00000004: 3C004121-01C0003F-0000003F-00000000
CPUID 00000004: 3C004122-01C0003F-0000003F-00000000
CPUID 00000004: 3C004143-01C0003F-000001FF-00000000
CPUID 00000004: 3C07C163-04C0003F-00003FFF-00000006
CPUID 00000005: 00000040-00000040-00000003-00021120
CPUID 00000006: 00000077-00000002-00000009-00000000
CPUID 00000007: 00000000-00000000-00000000-00000000
CPUID 00000008: 00000000-00000000-00000000-00000000
CPUID 00000009: 00000001-00000000-00000000-00000000
CPUID 0000000A: 07300403-00000000-00000000-00000603
CPUID 0000000B: 00000001-00000002-00000100-00000005
CPUID 0000000B: 00000005-00000010-00000201-00000005
CPUID 0000000C: 00000000-00000000-00000000-00000000
CPUID 0000000D: 00000007-00000340-00000340-00000000
CPUID 0000000D: 00000100-00000240-00000000-00000000
CPUID 80000000: 80000008-00000000-00000000-00000000
CPUID 80000001: 00000000-00000000-00000001-2C100000
CPUID 80000002: 20202020-20202020-20202020-20202020 [                ]
CPUID 80000003: 756E6547-20656E69-65746E49-2952286C [Genuine Intel(R)]
CPUID 80000004: 55504320-20402020-30362E32-007A4847 [ CPU  @ 2.60GHz]
CPUID 80000005: 00000000-00000000-00000000-00000000
CPUID 80000006: 00000000-00000000-01006040-00000000
CPUID 80000007: 00000000-00000000-00000000-00000100
CPUID 80000008: 0000302E-00000000-00000000-00000000

L1    Data Cache:     32 KB,  8-way Associative, 64-byte Line
L1  Instr. Cache:     32 KB,  8-way Associative, 64-byte Line
L2 Unified Cache:    256 KB,  8-way Associative, 64-byte Line
L3 Unified Cache:  20480 KB, 20-way Associative, 64-byte Line

------[ Logical CPU #6 ]------

allcpu: Package 0 / Core 3 / Thread 0: Valid

CPUID 00000000: 0000000D-756E6547-6C65746E-49656E69 [GenuineIntel]
CPUID 00000001: 000206D5-06200800-1FBEE3FF-BFEBFBFF
CPUID 00000002: 76035A01-00F0B2FF-00000000-00CA0000
CPUID 00000003: 00000000-00000000-00000000-00000000
CPUID 00000004: 3C004121-01C0003F-0000003F-00000000
CPUID 00000004: 3C004122-01C0003F-0000003F-00000000
CPUID 00000004: 3C004143-01C0003F-000001FF-00000000
CPUID 00000004: 3C07C163-04C0003F-00003FFF-00000006
CPUID 00000005: 00000040-00000040-00000003-00021120
CPUID 00000006: 00000077-00000002-00000009-00000000
CPUID 00000007: 00000000-00000000-00000000-00000000
CPUID 00000008: 00000000-00000000-00000000-00000000
CPUID 00000009: 00000001-00000000-00000000-00000000
CPUID 0000000A: 07300403-00000000-00000000-00000603
CPUID 0000000B: 00000001-00000002-00000100-00000006
CPUID 0000000B: 00000005-00000010-00000201-00000006
CPUID 0000000C: 00000000-00000000-00000000-00000000
CPUID 0000000D: 00000007-00000340-00000340-00000000
CPUID 0000000D: 00000100-00000240-00000000-00000000
CPUID 80000000: 80000008-00000000-00000000-00000000
CPUID 80000001: 00000000-00000000-00000001-2C100000
CPUID 80000002: 20202020-20202020-20202020-20202020 [                ]
CPUID 80000003: 756E6547-20656E69-65746E49-2952286C [Genuine Intel(R)]
CPUID 80000004: 55504320-20402020-30362E32-007A4847 [ CPU  @ 2.60GHz]
CPUID 80000005: 00000000-00000000-00000000-00000000
CPUID 80000006: 00000000-00000000-01006040-00000000
CPUID 80000007: 00000000-00000000-00000000-00000100
CPUID 80000008: 0000302E-00000000-00000000-00000000

L1    Data Cache:     32 KB,  8-way Associative, 64-byte Line
L1  Instr. Cache:     32 KB,  8-way Associative, 64-byte Line
L2 Unified Cache:    256 KB,  8-way Associative, 64-byte Line
L3 Unified Cache:  20480 KB, 20-way Associative, 64-byte Line

------[ Logical CPU #7 ]------

allcpu: Package 0 / Core 3 / Thread 1: Valid, Virtual

CPUID 00000000: 0000000D-756E6547-6C65746E-49656E69 [GenuineIntel]
CPUID 00000001: 000206D5-07200800-1FBEE3FF-BFEBFBFF
CPUID 00000002: 76035A01-00F0B2FF-00000000-00CA0000
CPUID 00000003: 00000000-00000000-00000000-00000000
CPUID 00000004: 3C004121-01C0003F-0000003F-00000000
CPUID 00000004: 3C004122-01C0003F-0000003F-00000000
CPUID 00000004: 3C004143-01C0003F-000001FF-00000000
CPUID 00000004: 3C07C163-04C0003F-00003FFF-00000006
CPUID 00000005: 00000040-00000040-00000003-00021120
CPUID 00000006: 00000077-00000002-00000009-00000000
CPUID 00000007: 00000000-00000000-00000000-00000000
CPUID 00000008: 00000000-00000000-00000000-00000000
CPUID 00000009: 00000001-00000000-00000000-00000000
CPUID 0000000A: 07300403-00000000-00000000-00000603
CPUID 0000000B: 00000001-00000002-00000100-00000007
CPUID 0000000B: 00000005-00000010-00000201-00000007
CPUID 0000000C: 00000000-00000000-00000000-00000000
CPUID 0000000D: 00000007-00000340-00000340-00000000
CPUID 0000000D: 00000100-00000240-00000000-00000000
CPUID 80000000: 80000008-00000000-00000000-00000000
CPUID 80000001: 00000000-00000000-00000001-2C100000
CPUID 80000002: 20202020-20202020-20202020-20202020 [                ]
CPUID 80000003: 756E6547-20656E69-65746E49-2952286C [Genuine Intel(R)]
CPUID 80000004: 55504320-20402020-30362E32-007A4847 [ CPU  @ 2.60GHz]
CPUID 80000005: 00000000-00000000-00000000-00000000
CPUID 80000006: 00000000-00000000-01006040-00000000
CPUID 80000007: 00000000-00000000-00000000-00000100
CPUID 80000008: 0000302E-00000000-00000000-00000000

L1    Data Cache:     32 KB,  8-way Associative, 64-byte Line
L1  Instr. Cache:     32 KB,  8-way Associative, 64-byte Line
L2 Unified Cache:    256 KB,  8-way Associative, 64-byte Line
L3 Unified Cache:  20480 KB, 20-way Associative, 64-byte Line

------[ Logical CPU #8 ]------

allcpu: Package 0 / Core 4 / Thread 0: Valid

CPUID 00000000: 0000000D-756E6547-6C65746E-49656E69 [GenuineIntel]
CPUID 00000001: 000206D5-08200800-1FBEE3FF-BFEBFBFF
CPUID 00000002: 76035A01-00F0B2FF-00000000-00CA0000
CPUID 00000003: 00000000-00000000-00000000-00000000
CPUID 00000004: 3C004121-01C0003F-0000003F-00000000
CPUID 00000004: 3C004122-01C0003F-0000003F-00000000
CPUID 00000004: 3C004143-01C0003F-000001FF-00000000
CPUID 00000004: 3C07C163-04C0003F-00003FFF-00000006
CPUID 00000005: 00000040-00000040-00000003-00021120
CPUID 00000006: 00000077-00000002-00000009-00000000
CPUID 00000007: 00000000-00000000-00000000-00000000
CPUID 00000008: 00000000-00000000-00000000-00000000
CPUID 00000009: 00000001-00000000-00000000-00000000
CPUID 0000000A: 07300403-00000000-00000000-00000603
CPUID 0000000B: 00000001-00000002-00000100-00000008
CPUID 0000000B: 00000005-00000010-00000201-00000008
CPUID 0000000C: 00000000-00000000-00000000-00000000
CPUID 0000000D: 00000007-00000340-00000340-00000000
CPUID 0000000D: 00000100-00000240-00000000-00000000
CPUID 80000000: 80000008-00000000-00000000-00000000
CPUID 80000001: 00000000-00000000-00000001-2C100000
CPUID 80000002: 20202020-20202020-20202020-20202020 [                ]
CPUID 80000003: 756E6547-20656E69-65746E49-2952286C [Genuine Intel(R)]
CPUID 80000004: 55504320-20402020-30362E32-007A4847 [ CPU  @ 2.60GHz]
CPUID 80000005: 00000000-00000000-00000000-00000000
CPUID 80000006: 00000000-00000000-01006040-00000000
CPUID 80000007: 00000000-00000000-00000000-00000100
CPUID 80000008: 0000302E-00000000-00000000-00000000

L1    Data Cache:     32 KB,  8-way Associative, 64-byte Line
L1  Instr. Cache:     32 KB,  8-way Associative, 64-byte Line
L2 Unified Cache:    256 KB,  8-way Associative, 64-byte Line
L3 Unified Cache:  20480 KB, 20-way Associative, 64-byte Line

------[ Logical CPU #9 ]------

allcpu: Package 0 / Core 4 / Thread 1: Valid, Virtual

CPUID 00000000: 0000000D-756E6547-6C65746E-49656E69 [GenuineIntel]
CPUID 00000001: 000206D5-09200800-1FBEE3FF-BFEBFBFF
CPUID 00000002: 76035A01-00F0B2FF-00000000-00CA0000
CPUID 00000003: 00000000-00000000-00000000-00000000
CPUID 00000004: 3C004121-01C0003F-0000003F-00000000
CPUID 00000004: 3C004122-01C0003F-0000003F-00000000
CPUID 00000004: 3C004143-01C0003F-000001FF-00000000
CPUID 00000004: 3C07C163-04C0003F-00003FFF-00000006
CPUID 00000005: 00000040-00000040-00000003-00021120
CPUID 00000006: 00000077-00000002-00000009-00000000
CPUID 00000007: 00000000-00000000-00000000-00000000
CPUID 00000008: 00000000-00000000-00000000-00000000
CPUID 00000009: 00000001-00000000-00000000-00000000
CPUID 0000000A: 07300403-00000000-00000000-00000603
CPUID 0000000B: 00000001-00000002-00000100-00000009
CPUID 0000000B: 00000005-00000010-00000201-00000009
CPUID 0000000C: 00000000-00000000-00000000-00000000
CPUID 0000000D: 00000007-00000340-00000340-00000000
CPUID 0000000D: 00000100-00000240-00000000-00000000
CPUID 80000000: 80000008-00000000-00000000-00000000
CPUID 80000001: 00000000-00000000-00000001-2C100000
CPUID 80000002: 20202020-20202020-20202020-20202020 [                ]
CPUID 80000003: 756E6547-20656E69-65746E49-2952286C [Genuine Intel(R)]
CPUID 80000004: 55504320-20402020-30362E32-007A4847 [ CPU  @ 2.60GHz]
CPUID 80000005: 00000000-00000000-00000000-00000000
CPUID 80000006: 00000000-00000000-01006040-00000000
CPUID 80000007: 00000000-00000000-00000000-00000100
CPUID 80000008: 0000302E-00000000-00000000-00000000

L1    Data Cache:     32 KB,  8-way Associative, 64-byte Line
L1  Instr. Cache:     32 KB,  8-way Associative, 64-byte Line
L2 Unified Cache:    256 KB,  8-way Associative, 64-byte Line
L3 Unified Cache:  20480 KB, 20-way Associative, 64-byte Line

------[ Logical CPU #10 ]------

allcpu: Package 0 / Core 5 / Thread 0: Valid

CPUID 00000000: 0000000D-756E6547-6C65746E-49656E69 [GenuineIntel]
CPUID 00000001: 000206D5-0A200800-1FBEE3FF-BFEBFBFF
CPUID 00000002: 76035A01-00F0B2FF-00000000-00CA0000
CPUID 00000003: 00000000-00000000-00000000-00000000
CPUID 00000004: 3C004121-01C0003F-0000003F-00000000
CPUID 00000004: 3C004122-01C0003F-0000003F-00000000
CPUID 00000004: 3C004143-01C0003F-000001FF-00000000
CPUID 00000004: 3C07C163-04C0003F-00003FFF-00000006
CPUID 00000005: 00000040-00000040-00000003-00021120
CPUID 00000006: 00000077-00000002-00000009-00000000
CPUID 00000007: 00000000-00000000-00000000-00000000
CPUID 00000008: 00000000-00000000-00000000-00000000
CPUID 00000009: 00000001-00000000-00000000-00000000
CPUID 0000000A: 07300403-00000000-00000000-00000603
CPUID 0000000B: 00000001-00000002-00000100-0000000A
CPUID 0000000B: 00000005-00000010-00000201-0000000A
CPUID 0000000C: 00000000-00000000-00000000-00000000
CPUID 0000000D: 00000007-00000340-00000340-00000000
CPUID 0000000D: 00000100-00000240-00000000-00000000
CPUID 80000000: 80000008-00000000-00000000-00000000
CPUID 80000001: 00000000-00000000-00000001-2C100000
CPUID 80000002: 20202020-20202020-20202020-20202020 [                ]
CPUID 80000003: 756E6547-20656E69-65746E49-2952286C [Genuine Intel(R)]
CPUID 80000004: 55504320-20402020-30362E32-007A4847 [ CPU  @ 2.60GHz]
CPUID 80000005: 00000000-00000000-00000000-00000000
CPUID 80000006: 00000000-00000000-01006040-00000000
CPUID 80000007: 00000000-00000000-00000000-00000100
CPUID 80000008: 0000302E-00000000-00000000-00000000

L1    Data Cache:     32 KB,  8-way Associative, 64-byte Line
L1  Instr. Cache:     32 KB,  8-way Associative, 64-byte Line
L2 Unified Cache:    256 KB,  8-way Associative, 64-byte Line
L3 Unified Cache:  20480 KB, 20-way Associative, 64-byte Line

------[ Logical CPU #11 ]------

allcpu: Package 0 / Core 5 / Thread 1: Valid, Virtual

CPUID 00000000: 0000000D-756E6547-6C65746E-49656E69 [GenuineIntel]
CPUID 00000001: 000206D5-0B200800-1FBEE3FF-BFEBFBFF
CPUID 00000002: 76035A01-00F0B2FF-00000000-00CA0000
CPUID 00000003: 00000000-00000000-00000000-00000000
CPUID 00000004: 3C004121-01C0003F-0000003F-00000000
CPUID 00000004: 3C004122-01C0003F-0000003F-00000000
CPUID 00000004: 3C004143-01C0003F-000001FF-00000000
CPUID 00000004: 3C07C163-04C0003F-00003FFF-00000006
CPUID 00000005: 00000040-00000040-00000003-00021120
CPUID 00000006: 00000077-00000002-00000009-00000000
CPUID 00000007: 00000000-00000000-00000000-00000000
CPUID 00000008: 00000000-00000000-00000000-00000000
CPUID 00000009: 00000001-00000000-00000000-00000000
CPUID 0000000A: 07300403-00000000-00000000-00000603
CPUID 0000000B: 00000001-00000002-00000100-0000000B
CPUID 0000000B: 00000005-00000010-00000201-0000000B
CPUID 0000000C: 00000000-00000000-00000000-00000000
CPUID 0000000D: 00000007-00000340-00000340-00000000
CPUID 0000000D: 00000100-00000240-00000000-00000000
CPUID 80000000: 80000008-00000000-00000000-00000000
CPUID 80000001: 00000000-00000000-00000001-2C100000
CPUID 80000002: 20202020-20202020-20202020-20202020 [                ]
CPUID 80000003: 756E6547-20656E69-65746E49-2952286C [Genuine Intel(R)]
CPUID 80000004: 55504320-20402020-30362E32-007A4847 [ CPU  @ 2.60GHz]
CPUID 80000005: 00000000-00000000-00000000-00000000
CPUID 80000006: 00000000-00000000-01006040-00000000
CPUID 80000007: 00000000-00000000-00000000-00000100
CPUID 80000008: 0000302E-00000000-00000000-00000000

L1    Data Cache:     32 KB,  8-way Associative, 64-byte Line
L1  Instr. Cache:     32 KB,  8-way Associative, 64-byte Line
L2 Unified Cache:    256 KB,  8-way Associative, 64-byte Line
L3 Unified Cache:  20480 KB, 20-way Associative, 64-byte Line

------[ Logical CPU #12 ]------

allcpu: Package 0 / Core 6 / Thread 0: Valid

CPUID 00000000: 0000000D-756E6547-6C65746E-49656E69 [GenuineIntel]
CPUID 00000001: 000206D5-0C200800-1FBEE3FF-BFEBFBFF
CPUID 00000002: 76035A01-00F0B2FF-00000000-00CA0000
CPUID 00000003: 00000000-00000000-00000000-00000000
CPUID 00000004: 3C004121-01C0003F-0000003F-00000000
CPUID 00000004: 3C004122-01C0003F-0000003F-00000000
CPUID 00000004: 3C004143-01C0003F-000001FF-00000000
CPUID 00000004: 3C07C163-04C0003F-00003FFF-00000006
CPUID 00000005: 00000040-00000040-00000003-00021120
CPUID 00000006: 00000077-00000002-00000009-00000000
CPUID 00000007: 00000000-00000000-00000000-00000000
CPUID 00000008: 00000000-00000000-00000000-00000000
CPUID 00000009: 00000001-00000000-00000000-00000000
CPUID 0000000A: 07300403-00000000-00000000-00000603
CPUID 0000000B: 00000001-00000002-00000100-0000000C
CPUID 0000000B: 00000005-00000010-00000201-0000000C
CPUID 0000000C: 00000000-00000000-00000000-00000000
CPUID 0000000D: 00000007-00000340-00000340-00000000
CPUID 0000000D: 00000100-00000240-00000000-00000000
CPUID 80000000: 80000008-00000000-00000000-00000000
CPUID 80000001: 00000000-00000000-00000001-2C100000
CPUID 80000002: 20202020-20202020-20202020-20202020 [                ]
CPUID 80000003: 756E6547-20656E69-65746E49-2952286C [Genuine Intel(R)]
CPUID 80000004: 55504320-20402020-30362E32-007A4847 [ CPU  @ 2.60GHz]
CPUID 80000005: 00000000-00000000-00000000-00000000
CPUID 80000006: 00000000-00000000-01006040-00000000
CPUID 80000007: 00000000-00000000-00000000-00000100
CPUID 80000008: 0000302E-00000000-00000000-00000000

L1    Data Cache:     32 KB,  8-way Associative, 64-byte Line
L1  Instr. Cache:     32 KB,  8-way Associative, 64-byte Line
L2 Unified Cache:    256 KB,  8-way Associative, 64-byte Line
L3 Unified Cache:  20480 KB, 20-way Associative, 64-byte Line

------[ Logical CPU #13 ]------

allcpu: Package 0 / Core 6 / Thread 1: Valid, Virtual

CPUID 00000000: 0000000D-756E6547-6C65746E-49656E69 [GenuineIntel]
CPUID 00000001: 000206D5-0D200800-1FBEE3FF-BFEBFBFF
CPUID 00000002: 76035A01-00F0B2FF-00000000-00CA0000
CPUID 00000003: 00000000-00000000-00000000-00000000
CPUID 00000004: 3C004121-01C0003F-0000003F-00000000
CPUID 00000004: 3C004122-01C0003F-0000003F-00000000
CPUID 00000004: 3C004143-01C0003F-000001FF-00000000
CPUID 00000004: 3C07C163-04C0003F-00003FFF-00000006
CPUID 00000005: 00000040-00000040-00000003-00021120
CPUID 00000006: 00000077-00000002-00000009-00000000
CPUID 00000007: 00000000-00000000-00000000-00000000
CPUID 00000008: 00000000-00000000-00000000-00000000
CPUID 00000009: 00000001-00000000-00000000-00000000
CPUID 0000000A: 07300403-00000000-00000000-00000603
CPUID 0000000B: 00000001-00000002-00000100-0000000D
CPUID 0000000B: 00000005-00000010-00000201-0000000D
CPUID 0000000C: 00000000-00000000-00000000-00000000
CPUID 0000000D: 00000007-00000340-00000340-00000000
CPUID 0000000D: 00000100-00000240-00000000-00000000
CPUID 80000000: 80000008-00000000-00000000-00000000
CPUID 80000001: 00000000-00000000-00000001-2C100000
CPUID 80000002: 20202020-20202020-20202020-20202020 [                ]
CPUID 80000003: 756E6547-20656E69-65746E49-2952286C [Genuine Intel(R)]
CPUID 80000004: 55504320-20402020-30362E32-007A4847 [ CPU  @ 2.60GHz]
CPUID 80000005: 00000000-00000000-00000000-00000000
CPUID 80000006: 00000000-00000000-01006040-00000000
CPUID 80000007: 00000000-00000000-00000000-00000100
CPUID 80000008: 0000302E-00000000-00000000-00000000

L1    Data Cache:     32 KB,  8-way Associative, 64-byte Line
L1  Instr. Cache:     32 KB,  8-way Associative, 64-byte Line
L2 Unified Cache:    256 KB,  8-way Associative, 64-byte Line
L3 Unified Cache:  20480 KB, 20-way Associative, 64-byte Line

------[ Logical CPU #14 ]------

allcpu: Package 0 / Core 7 / Thread 0: Valid

CPUID 00000000: 0000000D-756E6547-6C65746E-49656E69 [GenuineIntel]
CPUID 00000001: 000206D5-0E200800-1FBEE3FF-BFEBFBFF
CPUID 00000002: 76035A01-00F0B2FF-00000000-00CA0000
CPUID 00000003: 00000000-00000000-00000000-00000000
CPUID 00000004: 3C004121-01C0003F-0000003F-00000000
CPUID 00000004: 3C004122-01C0003F-0000003F-00000000
CPUID 00000004: 3C004143-01C0003F-000001FF-00000000
CPUID 00000004: 3C07C163-04C0003F-00003FFF-00000006
CPUID 00000005: 00000040-00000040-00000003-00021120
CPUID 00000006: 00000077-00000002-00000009-00000000
CPUID 00000007: 00000000-00000000-00000000-00000000
CPUID 00000008: 00000000-00000000-00000000-00000000
CPUID 00000009: 00000001-00000000-00000000-00000000
CPUID 0000000A: 07300403-00000000-00000000-00000603
CPUID 0000000B: 00000001-00000002-00000100-0000000E
CPUID 0000000B: 00000005-00000010-00000201-0000000E
CPUID 0000000C: 00000000-00000000-00000000-00000000
CPUID 0000000D: 00000007-00000340-00000340-00000000
CPUID 0000000D: 00000100-00000240-00000000-00000000
CPUID 80000000: 80000008-00000000-00000000-00000000
CPUID 80000001: 00000000-00000000-00000001-2C100000
CPUID 80000002: 20202020-20202020-20202020-20202020 [                ]
CPUID 80000003: 756E6547-20656E69-65746E49-2952286C [Genuine Intel(R)]
CPUID 80000004: 55504320-20402020-30362E32-007A4847 [ CPU  @ 2.60GHz]
CPUID 80000005: 00000000-00000000-00000000-00000000
CPUID 80000006: 00000000-00000000-01006040-00000000
CPUID 80000007: 00000000-00000000-00000000-00000100
CPUID 80000008: 0000302E-00000000-00000000-00000000

L1    Data Cache:     32 KB,  8-way Associative, 64-byte Line
L1  Instr. Cache:     32 KB,  8-way Associative, 64-byte Line
L2 Unified Cache:    256 KB,  8-way Associative, 64-byte Line
L3 Unified Cache:  20480 KB, 20-way Associative, 64-byte Line

------[ Logical CPU #15 ]------

allcpu: Package 0 / Core 7 / Thread 1: Valid, Virtual

CPUID 00000000: 0000000D-756E6547-6C65746E-49656E69 [GenuineIntel]
CPUID 00000001: 000206D5-0F200800-1FBEE3FF-BFEBFBFF
CPUID 00000002: 76035A01-00F0B2FF-00000000-00CA0000
CPUID 00000003: 00000000-00000000-00000000-00000000
CPUID 00000004: 3C004121-01C0003F-0000003F-00000000
CPUID 00000004: 3C004122-01C0003F-0000003F-00000000
CPUID 00000004: 3C004143-01C0003F-000001FF-00000000
CPUID 00000004: 3C07C163-04C0003F-00003FFF-00000006
CPUID 00000005: 00000040-00000040-00000003-00021120
CPUID 00000006: 00000077-00000002-00000009-00000000
CPUID 00000007: 00000000-00000000-00000000-00000000
CPUID 00000008: 00000000-00000000-00000000-00000000
CPUID 00000009: 00000001-00000000-00000000-00000000
CPUID 0000000A: 07300403-00000000-00000000-00000603
CPUID 0000000B: 00000001-00000002-00000100-0000000F
CPUID 0000000B: 00000005-00000010-00000201-0000000F
CPUID 0000000C: 00000000-00000000-00000000-00000000
CPUID 0000000D: 00000007-00000340-00000340-00000000
CPUID 0000000D: 00000100-00000240-00000000-00000000
CPUID 80000000: 80000008-00000000-00000000-00000000
CPUID 80000001: 00000000-00000000-00000001-2C100000
CPUID 80000002: 20202020-20202020-20202020-20202020 [                ]
CPUID 80000003: 756E6547-20656E69-65746E49-2952286C [Genuine Intel(R)]
CPUID 80000004: 55504320-20402020-30362E32-007A4847 [ CPU  @ 2.60GHz]
CPUID 80000005: 00000000-00000000-00000000-00000000
CPUID 80000006: 00000000-00000000-01006040-00000000
CPUID 80000007: 00000000-00000000-00000000-00000100
CPUID 80000008: 0000302E-00000000-00000000-00000000

L1    Data Cache:     32 KB,  8-way Associative, 64-byte Line
L1  Instr. Cache:     32 KB,  8-way Associative, 64-byte Line
L2 Unified Cache:    256 KB,  8-way Associative, 64-byte Line
L3 Unified Cache:  20480 KB, 20-way Associative, 64-byte Line

------[ Logical CPU #16 ]------

allcpu: Package 1 / Core 0 / Thread 0: Valid

CPUID 00000000: 0000000D-756E6547-6C65746E-49656E69 [GenuineIntel]
CPUID 00000001: 000206D5-20200800-1FBEE3FF-BFEBFBFF
CPUID 00000002: 76035A01-00F0B2FF-00000000-00CA0000
CPUID 00000003: 00000000-00000000-00000000-00000000
CPUID 00000004: 3C004121-01C0003F-0000003F-00000000
CPUID 00000004: 3C004122-01C0003F-0000003F-00000000
CPUID 00000004: 3C004143-01C0003F-000001FF-00000000
CPUID 00000004: 3C07C163-04C0003F-00003FFF-00000006
CPUID 00000005: 00000040-00000040-00000003-00021120
CPUID 00000006: 00000077-00000002-00000009-00000000
CPUID 00000007: 00000000-00000000-00000000-00000000
CPUID 00000008: 00000000-00000000-00000000-00000000
CPUID 00000009: 00000001-00000000-00000000-00000000
CPUID 0000000A: 07300403-00000000-00000000-00000603
CPUID 0000000B: 00000001-00000002-00000100-00000020
CPUID 0000000B: 00000005-00000010-00000201-00000020
CPUID 0000000C: 00000000-00000000-00000000-00000000
CPUID 0000000D: 00000007-00000340-00000340-00000000
CPUID 0000000D: 00000100-00000240-00000000-00000000
CPUID 80000000: 80000008-00000000-00000000-00000000
CPUID 80000001: 00000000-00000000-00000001-2C100000
CPUID 80000002: 20202020-20202020-20202020-20202020 [                ]
CPUID 80000003: 756E6547-20656E69-65746E49-2952286C [Genuine Intel(R)]
CPUID 80000004: 55504320-20402020-30362E32-007A4847 [ CPU  @ 2.60GHz]
CPUID 80000005: 00000000-00000000-00000000-00000000
CPUID 80000006: 00000000-00000000-01006040-00000000
CPUID 80000007: 00000000-00000000-00000000-00000100
CPUID 80000008: 0000302E-00000000-00000000-00000000

L1    Data Cache:     32 KB,  8-way Associative, 64-byte Line
L1  Instr. Cache:     32 KB,  8-way Associative, 64-byte Line
L2 Unified Cache:    256 KB,  8-way Associative, 64-byte Line
L3 Unified Cache:  20480 KB, 20-way Associative, 64-byte Line

------[ Logical CPU #17 ]------

allcpu: Package 1 / Core 0 / Thread 1: Valid, Virtual

CPUID 00000000: 0000000D-756E6547-6C65746E-49656E69 [GenuineIntel]
CPUID 00000001: 000206D5-21200800-1FBEE3FF-BFEBFBFF
CPUID 00000002: 76035A01-00F0B2FF-00000000-00CA0000
CPUID 00000003: 00000000-00000000-00000000-00000000
CPUID 00000004: 3C004121-01C0003F-0000003F-00000000
CPUID 00000004: 3C004122-01C0003F-0000003F-00000000
CPUID 00000004: 3C004143-01C0003F-000001FF-00000000
CPUID 00000004: 3C07C163-04C0003F-00003FFF-00000006
CPUID 00000005: 00000040-00000040-00000003-00021120
CPUID 00000006: 00000077-00000002-00000009-00000000
CPUID 00000007: 00000000-00000000-00000000-00000000
CPUID 00000008: 00000000-00000000-00000000-00000000
CPUID 00000009: 00000001-00000000-00000000-00000000
CPUID 0000000A: 07300403-00000000-00000000-00000603
CPUID 0000000B: 00000001-00000002-00000100-00000021
CPUID 0000000B: 00000005-00000010-00000201-00000021
CPUID 0000000C: 00000000-00000000-00000000-00000000
CPUID 0000000D: 00000007-00000340-00000340-00000000
CPUID 0000000D: 00000100-00000240-00000000-00000000
CPUID 80000000: 80000008-00000000-00000000-00000000
CPUID 80000001: 00000000-00000000-00000001-2C100000
CPUID 80000002: 20202020-20202020-20202020-20202020 [                ]
CPUID 80000003: 756E6547-20656E69-65746E49-2952286C [Genuine Intel(R)]
CPUID 80000004: 55504320-20402020-30362E32-007A4847 [ CPU  @ 2.60GHz]
CPUID 80000005: 00000000-00000000-00000000-00000000
CPUID 80000006: 00000000-00000000-01006040-00000000
CPUID 80000007: 00000000-00000000-00000000-00000100
CPUID 80000008: 0000302E-00000000-00000000-00000000

L1    Data Cache:     32 KB,  8-way Associative, 64-byte Line
L1  Instr. Cache:     32 KB,  8-way Associative, 64-byte Line
L2 Unified Cache:    256 KB,  8-way Associative, 64-byte Line
L3 Unified Cache:  20480 KB, 20-way Associative, 64-byte Line

------[ Logical CPU #18 ]------

allcpu: Package 1 / Core 1 / Thread 0: Valid

CPUID 00000000: 0000000D-756E6547-6C65746E-49656E69 [GenuineIntel]
CPUID 00000001: 000206D5-22200800-1FBEE3FF-BFEBFBFF
CPUID 00000002: 76035A01-00F0B2FF-00000000-00CA0000
CPUID 00000003: 00000000-00000000-00000000-00000000
CPUID 00000004: 3C004121-01C0003F-0000003F-00000000
CPUID 00000004: 3C004122-01C0003F-0000003F-00000000
CPUID 00000004: 3C004143-01C0003F-000001FF-00000000
CPUID 00000004: 3C07C163-04C0003F-00003FFF-00000006
CPUID 00000005: 00000040-00000040-00000003-00021120
CPUID 00000006: 00000077-00000002-00000009-00000000
CPUID 00000007: 00000000-00000000-00000000-00000000
CPUID 00000008: 00000000-00000000-00000000-00000000
CPUID 00000009: 00000001-00000000-00000000-00000000
CPUID 0000000A: 07300403-00000000-00000000-00000603
CPUID 0000000B: 00000001-00000002-00000100-00000022
CPUID 0000000B: 00000005-00000010-00000201-00000022
CPUID 0000000C: 00000000-00000000-00000000-00000000
CPUID 0000000D: 00000007-00000340-00000340-00000000
CPUID 0000000D: 00000100-00000240-00000000-00000000
CPUID 80000000: 80000008-00000000-00000000-00000000
CPUID 80000001: 00000000-00000000-00000001-2C100000
CPUID 80000002: 20202020-20202020-20202020-20202020 [                ]
CPUID 80000003: 756E6547-20656E69-65746E49-2952286C [Genuine Intel(R)]
CPUID 80000004: 55504320-20402020-30362E32-007A4847 [ CPU  @ 2.60GHz]
CPUID 80000005: 00000000-00000000-00000000-00000000
CPUID 80000006: 00000000-00000000-01006040-00000000
CPUID 80000007: 00000000-00000000-00000000-00000100
CPUID 80000008: 0000302E-00000000-00000000-00000000

L1    Data Cache:     32 KB,  8-way Associative, 64-byte Line
L1  Instr. Cache:     32 KB,  8-way Associative, 64-byte Line
L2 Unified Cache:    256 KB,  8-way Associative, 64-byte Line
L3 Unified Cache:  20480 KB, 20-way Associative, 64-byte Line

------[ Logical CPU #19 ]------

allcpu: Package 1 / Core 1 / Thread 1: Valid, Virtual

CPUID 00000000: 0000000D-756E6547-6C65746E-49656E69 [GenuineIntel]
CPUID 00000001: 000206D5-23200800-1FBEE3FF-BFEBFBFF
CPUID 00000002: 76035A01-00F0B2FF-00000000-00CA0000
CPUID 00000003: 00000000-00000000-00000000-00000000
CPUID 00000004: 3C004121-01C0003F-0000003F-00000000
CPUID 00000004: 3C004122-01C0003F-0000003F-00000000
CPUID 00000004: 3C004143-01C0003F-000001FF-00000000
CPUID 00000004: 3C07C163-04C0003F-00003FFF-00000006
CPUID 00000005: 00000040-00000040-00000003-00021120
CPUID 00000006: 00000077-00000002-00000009-00000000
CPUID 00000007: 00000000-00000000-00000000-00000000
CPUID 00000008: 00000000-00000000-00000000-00000000
CPUID 00000009: 00000001-00000000-00000000-00000000
CPUID 0000000A: 07300403-00000000-00000000-00000603
CPUID 0000000B: 00000001-00000002-00000100-00000023
CPUID 0000000B: 00000005-00000010-00000201-00000023
CPUID 0000000C: 00000000-00000000-00000000-00000000
CPUID 0000000D: 00000007-00000340-00000340-00000000
CPUID 0000000D: 00000100-00000240-00000000-00000000
CPUID 80000000: 80000008-00000000-00000000-00000000
CPUID 80000001: 00000000-00000000-00000001-2C100000
CPUID 80000002: 20202020-20202020-20202020-20202020 [                ]
CPUID 80000003: 756E6547-20656E69-65746E49-2952286C [Genuine Intel(R)]
CPUID 80000004: 55504320-20402020-30362E32-007A4847 [ CPU  @ 2.60GHz]
CPUID 80000005: 00000000-00000000-00000000-00000000
CPUID 80000006: 00000000-00000000-01006040-00000000
CPUID 80000007: 00000000-00000000-00000000-00000100
CPUID 80000008: 0000302E-00000000-00000000-00000000

L1    Data Cache:     32 KB,  8-way Associative, 64-byte Line
L1  Instr. Cache:     32 KB,  8-way Associative, 64-byte Line
L2 Unified Cache:    256 KB,  8-way Associative, 64-byte Line
L3 Unified Cache:  20480 KB, 20-way Associative, 64-byte Line

------[ Logical CPU #20 ]------

allcpu: Package 1 / Core 2 / Thread 0: Valid

CPUID 00000000: 0000000D-756E6547-6C65746E-49656E69 [GenuineIntel]
CPUID 00000001: 000206D5-24200800-1FBEE3FF-BFEBFBFF
CPUID 00000002: 76035A01-00F0B2FF-00000000-00CA0000
CPUID 00000003: 00000000-00000000-00000000-00000000
CPUID 00000004: 3C004121-01C0003F-0000003F-00000000
CPUID 00000004: 3C004122-01C0003F-0000003F-00000000
CPUID 00000004: 3C004143-01C0003F-000001FF-00000000
CPUID 00000004: 3C07C163-04C0003F-00003FFF-00000006
CPUID 00000005: 00000040-00000040-00000003-00021120
CPUID 00000006: 00000077-00000002-00000009-00000000
CPUID 00000007: 00000000-00000000-00000000-00000000
CPUID 00000008: 00000000-00000000-00000000-00000000
CPUID 00000009: 00000001-00000000-00000000-00000000
CPUID 0000000A: 07300403-00000000-00000000-00000603
CPUID 0000000B: 00000001-00000002-00000100-00000024
CPUID 0000000B: 00000005-00000010-00000201-00000024
CPUID 0000000C: 00000000-00000000-00000000-00000000
CPUID 0000000D: 00000007-00000340-00000340-00000000
CPUID 0000000D: 00000100-00000240-00000000-00000000
CPUID 80000000: 80000008-00000000-00000000-00000000
CPUID 80000001: 00000000-00000000-00000001-2C100000
CPUID 80000002: 20202020-20202020-20202020-20202020 [                ]
CPUID 80000003: 756E6547-20656E69-65746E49-2952286C [Genuine Intel(R)]
CPUID 80000004: 55504320-20402020-30362E32-007A4847 [ CPU  @ 2.60GHz]
CPUID 80000005: 00000000-00000000-00000000-00000000
CPUID 80000006: 00000000-00000000-01006040-00000000
CPUID 80000007: 00000000-00000000-00000000-00000100
CPUID 80000008: 0000302E-00000000-00000000-00000000

L1    Data Cache:     32 KB,  8-way Associative, 64-byte Line
L1  Instr. Cache:     32 KB,  8-way Associative, 64-byte Line
L2 Unified Cache:    256 KB,  8-way Associative, 64-byte Line
L3 Unified Cache:  20480 KB, 20-way Associative, 64-byte Line

------[ Logical CPU #21 ]------

allcpu: Package 1 / Core 2 / Thread 1: Valid, Virtual

CPUID 00000000: 0000000D-756E6547-6C65746E-49656E69 [GenuineIntel]
CPUID 00000001: 000206D5-25200800-1FBEE3FF-BFEBFBFF
CPUID 00000002: 76035A01-00F0B2FF-00000000-00CA0000
CPUID 00000003: 00000000-00000000-00000000-00000000
CPUID 00000004: 3C004121-01C0003F-0000003F-00000000
CPUID 00000004: 3C004122-01C0003F-0000003F-00000000
CPUID 00000004: 3C004143-01C0003F-000001FF-00000000
CPUID 00000004: 3C07C163-04C0003F-00003FFF-00000006
CPUID 00000005: 00000040-00000040-00000003-00021120
CPUID 00000006: 00000077-00000002-00000009-00000000
CPUID 00000007: 00000000-00000000-00000000-00000000
CPUID 00000008: 00000000-00000000-00000000-00000000
CPUID 00000009: 00000001-00000000-00000000-00000000
CPUID 0000000A: 07300403-00000000-00000000-00000603
CPUID 0000000B: 00000001-00000002-00000100-00000025
CPUID 0000000B: 00000005-00000010-00000201-00000025
CPUID 0000000C: 00000000-00000000-00000000-00000000
CPUID 0000000D: 00000007-00000340-00000340-00000000
CPUID 0000000D: 00000100-00000240-00000000-00000000
CPUID 80000000: 80000008-00000000-00000000-00000000
CPUID 80000001: 00000000-00000000-00000001-2C100000
CPUID 80000002: 20202020-20202020-20202020-20202020 [                ]
CPUID 80000003: 756E6547-20656E69-65746E49-2952286C [Genuine Intel(R)]
CPUID 80000004: 55504320-20402020-30362E32-007A4847 [ CPU  @ 2.60GHz]
CPUID 80000005: 00000000-00000000-00000000-00000000
CPUID 80000006: 00000000-00000000-01006040-00000000
CPUID 80000007: 00000000-00000000-00000000-00000100
CPUID 80000008: 0000302E-00000000-00000000-00000000

L1    Data Cache:     32 KB,  8-way Associative, 64-byte Line
L1  Instr. Cache:     32 KB,  8-way Associative, 64-byte Line
L2 Unified Cache:    256 KB,  8-way Associative, 64-byte Line
L3 Unified Cache:  20480 KB, 20-way Associative, 64-byte Line

------[ Logical CPU #22 ]------

allcpu: Package 1 / Core 3 / Thread 0: Valid

CPUID 00000000: 0000000D-756E6547-6C65746E-49656E69 [GenuineIntel]
CPUID 00000001: 000206D5-26200800-1FBEE3FF-BFEBFBFF
CPUID 00000002: 76035A01-00F0B2FF-00000000-00CA0000
CPUID 00000003: 00000000-00000000-00000000-00000000
CPUID 00000004: 3C004121-01C0003F-0000003F-00000000
CPUID 00000004: 3C004122-01C0003F-0000003F-00000000
CPUID 00000004: 3C004143-01C0003F-000001FF-00000000
CPUID 00000004: 3C07C163-04C0003F-00003FFF-00000006
CPUID 00000005: 00000040-00000040-00000003-00021120
CPUID 00000006: 00000077-00000002-00000009-00000000
CPUID 00000007: 00000000-00000000-00000000-00000000
CPUID 00000008: 00000000-00000000-00000000-00000000
CPUID 00000009: 00000001-00000000-00000000-00000000
CPUID 0000000A: 07300403-00000000-00000000-00000603
CPUID 0000000B: 00000001-00000002-00000100-00000026
CPUID 0000000B: 00000005-00000010-00000201-00000026
CPUID 0000000C: 00000000-00000000-00000000-00000000
CPUID 0000000D: 00000007-00000340-00000340-00000000
CPUID 0000000D: 00000100-00000240-00000000-00000000
CPUID 80000000: 80000008-00000000-00000000-00000000
CPUID 80000001: 00000000-00000000-00000001-2C100000
CPUID 80000002: 20202020-20202020-20202020-20202020 [                ]
CPUID 80000003: 756E6547-20656E69-65746E49-2952286C [Genuine Intel(R)]
CPUID 80000004: 55504320-20402020-30362E32-007A4847 [ CPU  @ 2.60GHz]
CPUID 80000005: 00000000-00000000-00000000-00000000
CPUID 80000006: 00000000-00000000-01006040-00000000
CPUID 80000007: 00000000-00000000-00000000-00000100
CPUID 80000008: 0000302E-00000000-00000000-00000000

L1    Data Cache:     32 KB,  8-way Associative, 64-byte Line
L1  Instr. Cache:     32 KB,  8-way Associative, 64-byte Line
L2 Unified Cache:    256 KB,  8-way Associative, 64-byte Line
L3 Unified Cache:  20480 KB, 20-way Associative, 64-byte Line

------[ Logical CPU #23 ]------

allcpu: Package 1 / Core 3 / Thread 1: Valid, Virtual

CPUID 00000000: 0000000D-756E6547-6C65746E-49656E69 [GenuineIntel]
CPUID 00000001: 000206D5-27200800-1FBEE3FF-BFEBFBFF
CPUID 00000002: 76035A01-00F0B2FF-00000000-00CA0000
CPUID 00000003: 00000000-00000000-00000000-00000000
CPUID 00000004: 3C004121-01C0003F-0000003F-00000000
CPUID 00000004: 3C004122-01C0003F-0000003F-00000000
CPUID 00000004: 3C004143-01C0003F-000001FF-00000000
CPUID 00000004: 3C07C163-04C0003F-00003FFF-00000006
CPUID 00000005: 00000040-00000040-00000003-00021120
CPUID 00000006: 00000077-00000002-00000009-00000000
CPUID 00000007: 00000000-00000000-00000000-00000000
CPUID 00000008: 00000000-00000000-00000000-00000000
CPUID 00000009: 00000001-00000000-00000000-00000000
CPUID 0000000A: 07300403-00000000-00000000-00000603
CPUID 0000000B: 00000001-00000002-00000100-00000027
CPUID 0000000B: 00000005-00000010-00000201-00000027
CPUID 0000000C: 00000000-00000000-00000000-00000000
CPUID 0000000D: 00000007-00000340-00000340-00000000
CPUID 0000000D: 00000100-00000240-00000000-00000000
CPUID 80000000: 80000008-00000000-00000000-00000000
CPUID 80000001: 00000000-00000000-00000001-2C100000
CPUID 80000002: 20202020-20202020-20202020-20202020 [                ]
CPUID 80000003: 756E6547-20656E69-65746E49-2952286C [Genuine Intel(R)]
CPUID 80000004: 55504320-20402020-30362E32-007A4847 [ CPU  @ 2.60GHz]
CPUID 80000005: 00000000-00000000-00000000-00000000
CPUID 80000006: 00000000-00000000-01006040-00000000
CPUID 80000007: 00000000-00000000-00000000-00000100
CPUID 80000008: 0000302E-00000000-00000000-00000000

L1    Data Cache:     32 KB,  8-way Associative, 64-byte Line
L1  Instr. Cache:     32 KB,  8-way Associative, 64-byte Line
L2 Unified Cache:    256 KB,  8-way Associative, 64-byte Line
L3 Unified Cache:  20480 KB, 20-way Associative, 64-byte Line

------[ Logical CPU #24 ]------

allcpu: Package 1 / Core 4 / Thread 0: Valid

CPUID 00000000: 0000000D-756E6547-6C65746E-49656E69 [GenuineIntel]
CPUID 00000001: 000206D5-28200800-1FBEE3FF-BFEBFBFF
CPUID 00000002: 76035A01-00F0B2FF-00000000-00CA0000
CPUID 00000003: 00000000-00000000-00000000-00000000
CPUID 00000004: 3C004121-01C0003F-0000003F-00000000
CPUID 00000004: 3C004122-01C0003F-0000003F-00000000
CPUID 00000004: 3C004143-01C0003F-000001FF-00000000
CPUID 00000004: 3C07C163-04C0003F-00003FFF-00000006
CPUID 00000005: 00000040-00000040-00000003-00021120
CPUID 00000006: 00000077-00000002-00000009-00000000
CPUID 00000007: 00000000-00000000-00000000-00000000
CPUID 00000008: 00000000-00000000-00000000-00000000
CPUID 00000009: 00000001-00000000-00000000-00000000
CPUID 0000000A: 07300403-00000000-00000000-00000603
CPUID 0000000B: 00000001-00000002-00000100-00000028
CPUID 0000000B: 00000005-00000010-00000201-00000028
CPUID 0000000C: 00000000-00000000-00000000-00000000
CPUID 0000000D: 00000007-00000340-00000340-00000000
CPUID 0000000D: 00000100-00000240-00000000-00000000
CPUID 80000000: 80000008-00000000-00000000-00000000
CPUID 80000001: 00000000-00000000-00000001-2C100000
CPUID 80000002: 20202020-20202020-20202020-20202020 [                ]
CPUID 80000003: 756E6547-20656E69-65746E49-2952286C [Genuine Intel(R)]
CPUID 80000004: 55504320-20402020-30362E32-007A4847 [ CPU  @ 2.60GHz]
CPUID 80000005: 00000000-00000000-00000000-00000000
CPUID 80000006: 00000000-00000000-01006040-00000000
CPUID 80000007: 00000000-00000000-00000000-00000100
CPUID 80000008: 0000302E-00000000-00000000-00000000

L1    Data Cache:     32 KB,  8-way Associative, 64-byte Line
L1  Instr. Cache:     32 KB,  8-way Associative, 64-byte Line
L2 Unified Cache:    256 KB,  8-way Associative, 64-byte Line
L3 Unified Cache:  20480 KB, 20-way Associative, 64-byte Line

------[ Logical CPU #25 ]------

allcpu: Package 1 / Core 4 / Thread 1: Valid, Virtual

CPUID 00000000: 0000000D-756E6547-6C65746E-49656E69 [GenuineIntel]
CPUID 00000001: 000206D5-29200800-1FBEE3FF-BFEBFBFF
CPUID 00000002: 76035A01-00F0B2FF-00000000-00CA0000
CPUID 00000003: 00000000-00000000-00000000-00000000
CPUID 00000004: 3C004121-01C0003F-0000003F-00000000
CPUID 00000004: 3C004122-01C0003F-0000003F-00000000
CPUID 00000004: 3C004143-01C0003F-000001FF-00000000
CPUID 00000004: 3C07C163-04C0003F-00003FFF-00000006
CPUID 00000005: 00000040-00000040-00000003-00021120
CPUID 00000006: 00000077-00000002-00000009-00000000
CPUID 00000007: 00000000-00000000-00000000-00000000
CPUID 00000008: 00000000-00000000-00000000-00000000
CPUID 00000009: 00000001-00000000-00000000-00000000
CPUID 0000000A: 07300403-00000000-00000000-00000603
CPUID 0000000B: 00000001-00000002-00000100-00000029
CPUID 0000000B: 00000005-00000010-00000201-00000029
CPUID 0000000C: 00000000-00000000-00000000-00000000
CPUID 0000000D: 00000007-00000340-00000340-00000000
CPUID 0000000D: 00000100-00000240-00000000-00000000
CPUID 80000000: 80000008-00000000-00000000-00000000
CPUID 80000001: 00000000-00000000-00000001-2C100000
CPUID 80000002: 20202020-20202020-20202020-20202020 [                ]
CPUID 80000003: 756E6547-20656E69-65746E49-2952286C [Genuine Intel(R)]
CPUID 80000004: 55504320-20402020-30362E32-007A4847 [ CPU  @ 2.60GHz]
CPUID 80000005: 00000000-00000000-00000000-00000000
CPUID 80000006: 00000000-00000000-01006040-00000000
CPUID 80000007: 00000000-00000000-00000000-00000100
CPUID 80000008: 0000302E-00000000-00000000-00000000

L1    Data Cache:     32 KB,  8-way Associative, 64-byte Line
L1  Instr. Cache:     32 KB,  8-way Associative, 64-byte Line
L2 Unified Cache:    256 KB,  8-way Associative, 64-byte Line
L3 Unified Cache:  20480 KB, 20-way Associative, 64-byte Line

------[ Logical CPU #26 ]------

allcpu: Package 1 / Core 5 / Thread 0: Valid

CPUID 00000000: 0000000D-756E6547-6C65746E-49656E69 [GenuineIntel]
CPUID 00000001: 000206D5-2A200800-1FBEE3FF-BFEBFBFF
CPUID 00000002: 76035A01-00F0B2FF-00000000-00CA0000
CPUID 00000003: 00000000-00000000-00000000-00000000
CPUID 00000004: 3C004121-01C0003F-0000003F-00000000
CPUID 00000004: 3C004122-01C0003F-0000003F-00000000
CPUID 00000004: 3C004143-01C0003F-000001FF-00000000
CPUID 00000004: 3C07C163-04C0003F-00003FFF-00000006
CPUID 00000005: 00000040-00000040-00000003-00021120
CPUID 00000006: 00000077-00000002-00000009-00000000
CPUID 00000007: 00000000-00000000-00000000-00000000
CPUID 00000008: 00000000-00000000-00000000-00000000
CPUID 00000009: 00000001-00000000-00000000-00000000
CPUID 0000000A: 07300403-00000000-00000000-00000603
CPUID 0000000B: 00000001-00000002-00000100-0000002A
CPUID 0000000B: 00000005-00000010-00000201-0000002A
CPUID 0000000C: 00000000-00000000-00000000-00000000
CPUID 0000000D: 00000007-00000340-00000340-00000000
CPUID 0000000D: 00000100-00000240-00000000-00000000
CPUID 80000000: 80000008-00000000-00000000-00000000
CPUID 80000001: 00000000-00000000-00000001-2C100000
CPUID 80000002: 20202020-20202020-20202020-20202020 [                ]
CPUID 80000003: 756E6547-20656E69-65746E49-2952286C [Genuine Intel(R)]
CPUID 80000004: 55504320-20402020-30362E32-007A4847 [ CPU  @ 2.60GHz]
CPUID 80000005: 00000000-00000000-00000000-00000000
CPUID 80000006: 00000000-00000000-01006040-00000000
CPUID 80000007: 00000000-00000000-00000000-00000100
CPUID 80000008: 0000302E-00000000-00000000-00000000

L1    Data Cache:     32 KB,  8-way Associative, 64-byte Line
L1  Instr. Cache:     32 KB,  8-way Associative, 64-byte Line
L2 Unified Cache:    256 KB,  8-way Associative, 64-byte Line
L3 Unified Cache:  20480 KB, 20-way Associative, 64-byte Line

------[ Logical CPU #27 ]------

allcpu: Package 1 / Core 5 / Thread 1: Valid, Virtual

CPUID 00000000: 0000000D-756E6547-6C65746E-49656E69 [GenuineIntel]
CPUID 00000001: 000206D5-2B200800-1FBEE3FF-BFEBFBFF
CPUID 00000002: 76035A01-00F0B2FF-00000000-00CA0000
CPUID 00000003: 00000000-00000000-00000000-00000000
CPUID 00000004: 3C004121-01C0003F-0000003F-00000000
CPUID 00000004: 3C004122-01C0003F-0000003F-00000000
CPUID 00000004: 3C004143-01C0003F-000001FF-00000000
CPUID 00000004: 3C07C163-04C0003F-00003FFF-00000006
CPUID 00000005: 00000040-00000040-00000003-00021120
CPUID 00000006: 00000077-00000002-00000009-00000000
CPUID 00000007: 00000000-00000000-00000000-00000000
CPUID 00000008: 00000000-00000000-00000000-00000000
CPUID 00000009: 00000001-00000000-00000000-00000000
CPUID 0000000A: 07300403-00000000-00000000-00000603
CPUID 0000000B: 00000001-00000002-00000100-0000002B
CPUID 0000000B: 00000005-00000010-00000201-0000002B
CPUID 0000000C: 00000000-00000000-00000000-00000000
CPUID 0000000D: 00000007-00000340-00000340-00000000
CPUID 0000000D: 00000100-00000240-00000000-00000000
CPUID 80000000: 80000008-00000000-00000000-00000000
CPUID 80000001: 00000000-00000000-00000001-2C100000
CPUID 80000002: 20202020-20202020-20202020-20202020 [                ]
CPUID 80000003: 756E6547-20656E69-65746E49-2952286C [Genuine Intel(R)]
CPUID 80000004: 55504320-20402020-30362E32-007A4847 [ CPU  @ 2.60GHz]
CPUID 80000005: 00000000-00000000-00000000-00000000
CPUID 80000006: 00000000-00000000-01006040-00000000
CPUID 80000007: 00000000-00000000-00000000-00000100
CPUID 80000008: 0000302E-00000000-00000000-00000000

L1    Data Cache:     32 KB,  8-way Associative, 64-byte Line
L1  Instr. Cache:     32 KB,  8-way Associative, 64-byte Line
L2 Unified Cache:    256 KB,  8-way Associative, 64-byte Line
L3 Unified Cache:  20480 KB, 20-way Associative, 64-byte Line

------[ Logical CPU #28 ]------

allcpu: Package 1 / Core 6 / Thread 0: Valid

CPUID 00000000: 0000000D-756E6547-6C65746E-49656E69 [GenuineIntel]
CPUID 00000001: 000206D5-2C200800-1FBEE3FF-BFEBFBFF
CPUID 00000002: 76035A01-00F0B2FF-00000000-00CA0000
CPUID 00000003: 00000000-00000000-00000000-00000000
CPUID 00000004: 3C004121-01C0003F-0000003F-00000000
CPUID 00000004: 3C004122-01C0003F-0000003F-00000000
CPUID 00000004: 3C004143-01C0003F-000001FF-00000000
CPUID 00000004: 3C07C163-04C0003F-00003FFF-00000006
CPUID 00000005: 00000040-00000040-00000003-00021120
CPUID 00000006: 00000077-00000002-00000009-00000000
CPUID 00000007: 00000000-00000000-00000000-00000000
CPUID 00000008: 00000000-00000000-00000000-00000000
CPUID 00000009: 00000001-00000000-00000000-00000000
CPUID 0000000A: 07300403-00000000-00000000-00000603
CPUID 0000000B: 00000001-00000002-00000100-0000002C
CPUID 0000000B: 00000005-00000010-00000201-0000002C
CPUID 0000000C: 00000000-00000000-00000000-00000000
CPUID 0000000D: 00000007-00000340-00000340-00000000
CPUID 0000000D: 00000100-00000240-00000000-00000000
CPUID 80000000: 80000008-00000000-00000000-00000000
CPUID 80000001: 00000000-00000000-00000001-2C100000
CPUID 80000002: 20202020-20202020-20202020-20202020 [                ]
CPUID 80000003: 756E6547-20656E69-65746E49-2952286C [Genuine Intel(R)]
CPUID 80000004: 55504320-20402020-30362E32-007A4847 [ CPU  @ 2.60GHz]
CPUID 80000005: 00000000-00000000-00000000-00000000
CPUID 80000006: 00000000-00000000-01006040-00000000
CPUID 80000007: 00000000-00000000-00000000-00000100
CPUID 80000008: 0000302E-00000000-00000000-00000000

L1    Data Cache:     32 KB,  8-way Associative, 64-byte Line
L1  Instr. Cache:     32 KB,  8-way Associative, 64-byte Line
L2 Unified Cache:    256 KB,  8-way Associative, 64-byte Line
L3 Unified Cache:  20480 KB, 20-way Associative, 64-byte Line

------[ Logical CPU #29 ]------

allcpu: Package 1 / Core 6 / Thread 1: Valid, Virtual

CPUID 00000000: 0000000D-756E6547-6C65746E-49656E69 [GenuineIntel]
CPUID 00000001: 000206D5-2D200800-1FBEE3FF-BFEBFBFF
CPUID 00000002: 76035A01-00F0B2FF-00000000-00CA0000
CPUID 00000003: 00000000-00000000-00000000-00000000
CPUID 00000004: 3C004121-01C0003F-0000003F-00000000
CPUID 00000004: 3C004122-01C0003F-0000003F-00000000
CPUID 00000004: 3C004143-01C0003F-000001FF-00000000
CPUID 00000004: 3C07C163-04C0003F-00003FFF-00000006
CPUID 00000005: 00000040-00000040-00000003-00021120
CPUID 00000006: 00000077-00000002-00000009-00000000
CPUID 00000007: 00000000-00000000-00000000-00000000
CPUID 00000008: 00000000-00000000-00000000-00000000
CPUID 00000009: 00000001-00000000-00000000-00000000
CPUID 0000000A: 07300403-00000000-00000000-00000603
CPUID 0000000B: 00000001-00000002-00000100-0000002D
CPUID 0000000B: 00000005-00000010-00000201-0000002D
CPUID 0000000C: 00000000-00000000-00000000-00000000
CPUID 0000000D: 00000007-00000340-00000340-00000000
CPUID 0000000D: 00000100-00000240-00000000-00000000
CPUID 80000000: 80000008-00000000-00000000-00000000
CPUID 80000001: 00000000-00000000-00000001-2C100000
CPUID 80000002: 20202020-20202020-20202020-20202020 [                ]
CPUID 80000003: 756E6547-20656E69-65746E49-2952286C [Genuine Intel(R)]
CPUID 80000004: 55504320-20402020-30362E32-007A4847 [ CPU  @ 2.60GHz]
CPUID 80000005: 00000000-00000000-00000000-00000000
CPUID 80000006: 00000000-00000000-01006040-00000000
CPUID 80000007: 00000000-00000000-00000000-00000100
CPUID 80000008: 0000302E-00000000-00000000-00000000

L1    Data Cache:     32 KB,  8-way Associative, 64-byte Line
L1  Instr. Cache:     32 KB,  8-way Associative, 64-byte Line
L2 Unified Cache:    256 KB,  8-way Associative, 64-byte Line
L3 Unified Cache:  20480 KB, 20-way Associative, 64-byte Line

------[ Logical CPU #30 ]------

allcpu: Package 1 / Core 7 / Thread 0: Valid

CPUID 00000000: 0000000D-756E6547-6C65746E-49656E69 [GenuineIntel]
CPUID 00000001: 000206D5-2E200800-1FBEE3FF-BFEBFBFF
CPUID 00000002: 76035A01-00F0B2FF-00000000-00CA0000
CPUID 00000003: 00000000-00000000-00000000-00000000
CPUID 00000004: 3C004121-01C0003F-0000003F-00000000
CPUID 00000004: 3C004122-01C0003F-0000003F-00000000
CPUID 00000004: 3C004143-01C0003F-000001FF-00000000
CPUID 00000004: 3C07C163-04C0003F-00003FFF-00000006
CPUID 00000005: 00000040-00000040-00000003-00021120
CPUID 00000006: 00000077-00000002-00000009-00000000
CPUID 00000007: 00000000-00000000-00000000-00000000
CPUID 00000008: 00000000-00000000-00000000-00000000
CPUID 00000009: 00000001-00000000-00000000-00000000
CPUID 0000000A: 07300403-00000000-00000000-00000603
CPUID 0000000B: 00000001-00000002-00000100-0000002E
CPUID 0000000B: 00000005-00000010-00000201-0000002E
CPUID 0000000C: 00000000-00000000-00000000-00000000
CPUID 0000000D: 00000007-00000340-00000340-00000000
CPUID 0000000D: 00000100-00000240-00000000-00000000
CPUID 80000000: 80000008-00000000-00000000-00000000
CPUID 80000001: 00000000-00000000-00000001-2C100000
CPUID 80000002: 20202020-20202020-20202020-20202020 [                ]
CPUID 80000003: 756E6547-20656E69-65746E49-2952286C [Genuine Intel(R)]
CPUID 80000004: 55504320-20402020-30362E32-007A4847 [ CPU  @ 2.60GHz]
CPUID 80000005: 00000000-00000000-00000000-00000000
CPUID 80000006: 00000000-00000000-01006040-00000000
CPUID 80000007: 00000000-00000000-00000000-00000100
CPUID 80000008: 0000302E-00000000-00000000-00000000

L1    Data Cache:     32 KB,  8-way Associative, 64-byte Line
L1  Instr. Cache:     32 KB,  8-way Associative, 64-byte Line
L2 Unified Cache:    256 KB,  8-way Associative, 64-byte Line
L3 Unified Cache:  20480 KB, 20-way Associative, 64-byte Line

------[ Logical CPU #31 ]------

allcpu: Package 1 / Core 7 / Thread 1: Valid, Virtual

CPUID 00000000: 0000000D-756E6547-6C65746E-49656E69 [GenuineIntel]
CPUID 00000001: 000206D5-2F200800-1FBEE3FF-BFEBFBFF
CPUID 00000002: 76035A01-00F0B2FF-00000000-00CA0000
CPUID 00000003: 00000000-00000000-00000000-00000000
CPUID 00000004: 3C004121-01C0003F-0000003F-00000000
CPUID 00000004: 3C004122-01C0003F-0000003F-00000000
CPUID 00000004: 3C004143-01C0003F-000001FF-00000000
CPUID 00000004: 3C07C163-04C0003F-00003FFF-00000006
CPUID 00000005: 00000040-00000040-00000003-00021120
CPUID 00000006: 00000077-00000002-00000009-00000000
CPUID 00000007: 00000000-00000000-00000000-00000000
CPUID 00000008: 00000000-00000000-00000000-00000000
CPUID 00000009: 00000001-00000000-00000000-00000000
CPUID 0000000A: 07300403-00000000-00000000-00000603
CPUID 0000000B: 00000001-00000002-00000100-0000002F
CPUID 0000000B: 00000005-00000010-00000201-0000002F
CPUID 0000000C: 00000000-00000000-00000000-00000000
CPUID 0000000D: 00000007-00000340-00000340-00000000
CPUID 0000000D: 00000100-00000240-00000000-00000000
CPUID 80000000: 80000008-00000000-00000000-00000000
CPUID 80000001: 00000000-00000000-00000001-2C100000
CPUID 80000002: 20202020-20202020-20202020-20202020 [                ]
CPUID 80000003: 756E6547-20656E69-65746E49-2952286C [Genuine Intel(R)]
CPUID 80000004: 55504320-20402020-30362E32-007A4847 [ CPU  @ 2.60GHz]
CPUID 80000005: 00000000-00000000-00000000-00000000
CPUID 80000006: 00000000-00000000-01006040-00000000
CPUID 80000007: 00000000-00000000-00000000-00000100
CPUID 80000008: 0000302E-00000000-00000000-00000000

L1    Data Cache:     32 KB,  8-way Associative, 64-byte Line
L1  Instr. Cache:     32 KB,  8-way Associative, 64-byte Line
L2 Unified Cache:    256 KB,  8-way Associative, 64-byte Line
L3 Unified Cache:  20480 KB, 20-way Associative, 64-byte Line

------[ All CPUs ]------

CPU   0: APICID   0 / Package 0 / Core  0 / Thread 0: Valid
CPU   1: APICID   1 / Package 0 / Core  0 / Thread 1: Valid, Virtual
CPU   2: APICID   2 / Package 0 / Core  1 / Thread 0: Valid
CPU   3: APICID   3 / Package 0 / Core  1 / Thread 1: Valid, Virtual
CPU   4: APICID   4 / Package 0 / Core  2 / Thread 0: Valid
CPU   5: APICID   5 / Package 0 / Core  2 / Thread 1: Valid, Virtual
CPU   6: APICID   6 / Package 0 / Core  3 / Thread 0: Valid
CPU   7: APICID   7 / Package 0 / Core  3 / Thread 1: Valid, Virtual
CPU   8: APICID   8 / Package 0 / Core  4 / Thread 0: Valid
CPU   9: APICID   9 / Package 0 / Core  4 / Thread 1: Valid, Virtual
CPU  10: APICID  10 / Package 0 / Core  5 / Thread 0: Valid
CPU  11: APICID  11 / Package 0 / Core  5 / Thread 1: Valid, Virtual
CPU  12: APICID  12 / Package 0 / Core  6 / Thread 0: Valid
CPU  13: APICID  13 / Package 0 / Core  6 / Thread 1: Valid, Virtual
CPU  14: APICID  14 / Package 0 / Core  7 / Thread 0: Valid
CPU  15: APICID  15 / Package 0 / Core  7 / Thread 1: Valid, Virtual
CPU  16: APICID  32 / Package 1 / Core  0 / Thread 0: Valid
CPU  17: APICID  33 / Package 1 / Core  0 / Thread 1: Valid, Virtual
CPU  18: APICID  34 / Package 1 / Core  1 / Thread 0: Valid
CPU  19: APICID  35 / Package 1 / Core  1 / Thread 1: Valid, Virtual
CPU  20: APICID  36 / Package 1 / Core  2 / Thread 0: Valid
CPU  21: APICID  37 / Package 1 / Core  2 / Thread 1: Valid, Virtual
CPU  22: APICID  38 / Package 1 / Core  3 / Thread 0: Valid
CPU  23: APICID  39 / Package 1 / Core  3 / Thread 1: Valid, Virtual
CPU  24: APICID  40 / Package 1 / Core  4 / Thread 0: Valid
CPU  25: APICID  41 / Package 1 / Core  4 / Thread 1: Valid, Virtual
CPU  26: APICID  42 / Package 1 / Core  5 / Thread 0: Valid
CPU  27: APICID  43 / Package 1 / Core  5 / Thread 1: Valid, Virtual
CPU  28: APICID  44 / Package 1 / Core  6 / Thread 0: Valid
CPU  29: APICID  45 / Package 1 / Core  6 / Thread 1: Valid, Virtual
CPU  30: APICID  46 / Package 1 / Core  7 / Thread 0: Valid
CPU  31: APICID  47 / Package 1 / Core  7 / Thread 1: Valid, Virtual

------[ MSR Registers ]------

MSR 00000017: 0000-0000-0000-0000 [PlatID = 0]
MSR 0000001B: 0000-0000-FEE0-0900
MSR 00000035: 0000-0000-0008-0010
MSR 0000008B: 0000-050B-0000-0000
MSR 000000CE: 0000-0C00-6C01-1A00
MSR 000000E7: 0000-0000-000D-A103
MSR 000000E8: 0000-0000-000B-7DB2
MSR 00000194: 0000-0000-0001-1A00
MSR 00000198: 0000-2430-0000-2100
MSR 00000199: 0000-0000-0000-2100
MSR 0000019A: 0000-0000-0000-0000
MSR 0000019B: 0000-0000-0000-0000
MSR 0000019C: 0000-0000-8840-0000
MSR 0000019D: 0000-0000-0000-0000
MSR 000001A0: 0000-0000-0085-0089
MSR 000001A2: 0000-0000-0064-0A00
MSR 000001A4: 0000-0000-0000-0000
MSR 000001AA: 0000-0000-0040-0000
MSR 000001AC: < FAILED >
MSR 000001AD: 1E1E-1F1F-2020-2121
MSR 000001B0: 0000-0000-0000-0005
MSR 000001B1: 0000-0000-883B-0000
MSR 000001B2: 0000-0000-0000-0000
MSR 000001FC: 0000-0000-2104-005F
MSR 00000300: 0000-0000-8000-7F00
MSR 00000480: 00DA-0400-0000-0010
MSR 00000481: 0000-007F-0000-0016
MSR 00000482: FFF9-FFFE-0401-E172
MSR 00000483: 007F-FFFF-0003-6DFF
MSR 00000484: 0000-FFFF-0000-11FF
MSR 00000485: 0000-0000-1004-01E5
MSR 00000486: 0000-0000-8000-0021
MSR 00000487: 0000-0000-FFFF-FFFF
MSR 00000488: 0000-0000-0000-2000
MSR 00000489: 0000-0000-0006-67FF
MSR 0000048A: 0000-0000-0000-002A
MSR 0000048B: 0000-04FF-0000-0000
MSR 0000048C: 0000-0F01-0613-4141
MSR 0000048D: 0000-007F-0000-0016
MSR 0000048E: FFF9-FFFE-0400-6172
MSR 0000048F: 007F-FFFF-0003-6DFB
MSR 00000490: 0000-FFFF-0000-11FB
MSR 00000606: 0000-0000-000A-1003
MSR 0000060A: 0000-0000-0000-0000
MSR 0000060B: 0000-0000-0000-0000
MSR 0000060C: 0000-0000-0000-0000
MSR 0000060D: 0000-0043-6104-1DB8
MSR 00000610: 0006-8450-0014-8398
MSR 00000611: 0000-0000-5CD0-F812
MSR 00000613: 0000-0000-0000-0000
MSR 00000614: 002F-0548-0148-0398
MSR 00000618: 0000-0000-0000-0000
MSR 00000619: 0000-0000-0E66-508D
MSR 0000061B: 0000-0000-0000-0000
MSR 0000061C: 0028-0258-0078-0118
MSR 00000638: 0000-0000-0000-0000
MSR 00000639: 0000-0000-404E-1E5D
MSR 0000063A: 0000-0000-0000-0000
MSR 0000063B: 0000-0000-0000-0000
MSR 00000640: < FAILED >
MSR 00000641: < FAILED >
MSR 00000642: < FAILED >

PerformanceFrequency = 2539101

CPU Clock M.Method = 8  (APIC SNB)
PM Timer Address   = 1032  (0408h)

APIC Clock = 100.00 MHz
APIC Clock = 100.00 MHz
APIC Clock = 100.00 MHz
APIC Clock = 100.00 MHz
APIC Clock = 100.00 MHz
