------[ Versions ]------

Program Version : EVEREST v4.60.1629 Beta
BenchDLL Version: 2.4.257.0

------[ CPU Info ]------

CPU Type           : Intel Celeron 420, 1600 MHz (8 x 200)
CPU Alias          : Conroe-L
CPU Platform       : LGA775
CPU Stepping       : A1
Instruction Set    : x86, x86-64, MMX, SSE, SSE2, SSE3, SSSE3
CPUID Manufacturer : GenuineIntel
CPUID CPU Name     : Intel(R) Celeron(R) CPU 420 @ 1.60GHz
CPUID Revision     : 00010661h
IA Brand ID        : 00h  (Unknown)
Platform ID        : 2Ah  (LGA775)

------[ Logical CPU #0 ]------

allcpu: Valid

CPUID 00000000: 0000000A-756E6547-6C65746E-49656E69
CPUID 00000001: 00010661-00010800-0000E31D-AFEBFBFF
CPUID 00000002: 05B0B101-005657F0-00000000-2CB4307F
CPUID 00000003: 00000000-00000000-00000000-00000000
CPUID 00000004: 00000121-01C0003F-0000003F-00000001
CPUID 00000004: 00000122-01C0003F-0000003F-00000001
CPUID 00000004: 00000143-0040003F-00000FFF-00000001
CPUID 00000005: 00000040-00000040-00000003-00000220
CPUID 00000006: 00000001-00000002-00000001-00000000
CPUID 00000007: 00000000-00000000-00000000-00000000
CPUID 00000008: 00000400-00000000-00000000-00000000
CPUID 00000009: 00000000-00000000-00000000-00000000
CPUID 0000000A: 07280202-00000000-00000000-00000000
CPUID 80000000: 80000008-00000000-00000000-00000000
CPUID 80000001: 00000000-00000000-00000001-20100000
CPUID 80000002: 65746E49-2952286C-6C654320-6E6F7265
CPUID 80000003: 20295228-20555043-20202020-20202020
CPUID 80000004: 30323420-20402020-30362E31-007A4847
CPUID 80000005: 00000000-00000000-00000000-00000000
CPUID 80000006: 00000000-00000000-02002040-00000000
CPUID 80000007: 00000000-00000000-00000000-00000000
CPUID 80000008: 00003024-00000000-00000000-00000000

L1    Data Cache:     32 KB,  8-way Associative, 64-byte Line
L1  Instr. Cache:     32 KB,  8-way Associative, 64-byte Line
L2 Unified Cache:    512 KB,  2-way Associative, 64-byte Line

------[ MSR Registers ]------

MSR 00000017: 0000-0000-8C06-8826 [PlatID = 0]
MSR 0000001B: 0000-0000-FEE0-0900
MSR 0000002A: 0000-0000-4208-0000
MSR 0000008B: 0000-0032-0000-0000
MSR 000000CD: 0000-0000-0000-0802
MSR 000000CE: 0016-0826-7F7F-0714
MSR 000000E7: 0000-0001-41D9-F5B8
MSR 000000E8: 0000-0001-41DA-1608
MSR 000000EE: A800-0000-017D-4752
MSR 0000011E: 0000-0000-BE70-2103
MSR 00000198: 0826-0826-0600-0826
MSR 00000199: 0000-0000-0000-0826
MSR 0000019A: 0000-0000-0000-0002
MSR 0000019B: 0000-0000-0000-0010
MSR 0000019C: 0000-0000-882E-0000
MSR 0000019D: 0000-0000-0000-0616
MSR 000001A0: 0000-0040-6086-2089

PerformanceFrequency = 3579545

Tjmax Temperature = 100 Celsius
