------[ Versions ]------

Program Version : EVEREST v4.60.1629 Beta
BenchDLL Version: 2.4.257.0

------[ CPU Info ]------

CPU Type           : Mobile DualCore Intel Core Duo T2500, 2000 MHz (12 x 167)
CPU Alias          : Yonah
CPU Platform       : Socket 479
CPU Stepping       : B0
Instruction Set    : x86, MMX, SSE, SSE2, SSE3
CPUID Manufacturer : GenuineIntel
CPUID CPU Name     : Intel(R) Pentium(R) M CPU 000 @ 2.00GHz
CPUID Revision     : 000006E4h
IA Brand ID        : 00h  (Unknown)
Platform ID        : 20h  (Socket 479)

------[ Logical CPU #0 ]------

allcpu: Valid

CPUID 00000000: 0000000A-756E6547-6C65746E-49656E69
CPUID 00000001: 000006E4-00020800-0000C1A9-BFE9FBFF
CPUID 00000002: 02B3B001-000000F0-00000000-2C04307D
CPUID 00000003: 00000000-00000000-00000000-00000000
CPUID 00000004: 04000121-01C0003F-0000003F-00000001
CPUID 00000004: 04000122-01C0003F-0000003F-00000001
CPUID 00000004: 04004143-01C0003F-00000FFF-00000001
CPUID 00000005: 00000040-00000040-00000003-00022220
CPUID 00000006: 00000001-00000002-00000001-00000000
CPUID 00000007: 00000000-00000000-00000000-00000000
CPUID 00000008: 00000000-00000000-00000000-00000000
CPUID 00000009: 00000000-00000000-00000000-00000000
CPUID 0000000A: 07280201-00000000-00000000-00000000
CPUID 80000000: 80000008-00000000-00000000-00000000
CPUID 80000001: 00000000-00000000-00000000-00100000
CPUID 80000002: 65746E49-2952286C-6E655020-6D756974
CPUID 80000003: 20295228-5043204D-20202055-20202020
CPUID 80000004: 30303020-20402020-30302E32-007A4847
CPUID 80000005: 00000000-00000000-00000000-00000000
CPUID 80000006: 00000000-00000000-08006040-00000000
CPUID 80000007: 00000000-00000000-00000000-00000000
CPUID 80000008: 00002020-00000000-00000000-00000000

L1    Data Cache:     32 KB,  8-way Associative, 64-byte Line
L1  Instr. Cache:     32 KB,  8-way Associative, 64-byte Line
L2 Unified Cache:   2048 KB,  8-way Associative, 64-byte Line

------[ Logical CPU #1 ]------

allcpu: Valid

CPUID 00000000: 0000000A-756E6547-6C65746E-49656E69
CPUID 00000001: 000006E4-01020800-0000C1A9-BFE9FBFF
CPUID 00000002: 02B3B001-000000F0-00000000-2C04307D
CPUID 00000003: 00000000-00000000-00000000-00000000
CPUID 00000004: 04000121-01C0003F-0000003F-00000001
CPUID 00000004: 04000122-01C0003F-0000003F-00000001
CPUID 00000004: 04004143-01C0003F-00000FFF-00000001
CPUID 00000005: 00000040-00000040-00000003-00022220
CPUID 00000006: 00000001-00000002-00000001-00000000
CPUID 00000007: 00000000-00000000-00000000-00000000
CPUID 00000008: 00000000-00000000-00000000-00000000
CPUID 00000009: 00000000-00000000-00000000-00000000
CPUID 0000000A: 07280201-00000000-00000000-00000000
CPUID 80000000: 80000008-00000000-00000000-00000000
CPUID 80000001: 00000000-00000000-00000000-00100000
CPUID 80000002: 65746E49-2952286C-6E655020-6D756974
CPUID 80000003: 20295228-5043204D-20202055-20202020
CPUID 80000004: 30303020-20402020-30302E32-007A4847
CPUID 80000005: 00000000-00000000-00000000-00000000
CPUID 80000006: 00000000-00000000-08006040-00000000
CPUID 80000007: 00000000-00000000-00000000-00000000
CPUID 80000008: 00002020-00000000-00000000-00000000

L1    Data Cache:     32 KB,  8-way Associative, 64-byte Line
L1  Instr. Cache:     32 KB,  8-way Associative, 64-byte Line
L2 Unified Cache:   2048 KB,  8-way Associative, 64-byte Line

------[ MSR Registers ]------

MSR 00000017: 0014-0000-D804-862C [PlatID = 5]
MSR 0000001B: 0000-0000-FEE0-0900
MSR 0000002A: 0000-0000-4308-0000
MSR 0000008B: 0000-0026-0000-0000
MSR 000000CD: 0000-0000-0000-0133
MSR 000000CE: 2C17-0C00-3F47-0000
MSR 000000E7: 0000-003A-CB38-7C60
MSR 000000E8: 0000-003A-8B7C-0600
MSR 000000EE: 0000-0000-82B9-0000
MSR 0000011E: 0000-0000-BE74-211F
MSR 00000198: 0617-0C2C-0600-0C2C
MSR 00000199: 0000-0000-0023-0C2C
MSR 0000019A: 0000-0000-0000-0002
MSR 0000019B: 0000-0000-0000-0000
MSR 0000019C: 0000-0000-883F-0000
MSR 0000019D: 0000-0000-0000-0617
MSR 000001A0: 0000-0000-6097-3488

PerformanceFrequency = 2000050000

Tjmax Temperature = 100 Celsius
