------[ Versions ]------

Program Version : AIDA64 v1.70.1400
BenchDLL Version: 2.7.363-x64

------[ CPU Info ]------

CPU Type           : QuadCore Intel Core i7-2600, 3600 MHz (36 x 100)
CPU Alias          : Sandy Bridge-DT
CPU Platform       : LGA1155
CPU Stepping       : D2
Instruction Set    : x86, x86-64, MMX, SSE, SSE2, SSE3, SSSE3, SSE4.1, SSE4.2, AES, AVX
CPUID Manufacturer : GenuineIntel
CPUID CPU Name     : Intel(R) Core(TM) i7-2600 CPU @ 3.40GHz
CPUID Revision     : 000206A7h
IA Brand ID        : 00h  (Unknown)
Platform ID        : 2Dh  (LGA1155)

------[ Logical CPU #0 ]------

allcpu: Package 0 / Core 0 / Thread 0: Valid

CPUID 00000000: 0000000D-756E6547-6C65746E-49656E69
CPUID 00000001: 000206A7-00100800-1FBAE3FF-BFEBFBFF
CPUID 00000002: 76035A01-00F0B2FF-00000000-00CA0000
CPUID 00000003: 00000000-00000000-00000000-00000000
CPUID 00000004: 1C004121-01C0003F-0000003F-00000000
CPUID 00000004: 1C004122-01C0003F-0000003F-00000000
CPUID 00000004: 1C004143-01C0003F-000001FF-00000000
CPUID 00000004: 1C03C163-03C0003F-00001FFF-00000006
CPUID 00000005: 00000040-00000040-00000003-00001120
CPUID 00000006: 00000075-00000002-00000009-00000000
CPUID 00000007: 00000000-00000000-00000000-00000000
CPUID 00000008: 00000000-00000000-00000000-00000000
CPUID 00000009: 00000000-00000000-00000000-00000000
CPUID 0000000A: 07300403-00000000-00000000-00000603
CPUID 0000000B: 00000001-00000002-00000100-00000000
CPUID 0000000B: 00000004-00000008-00000201-00000000
CPUID 0000000C: 00000000-00000000-00000000-00000000
CPUID 0000000D: 00000007-00000340-00000340-00000000
CPUID 0000000D: 00000100-00000240-00000000-00000000
CPUID 80000000: 80000008-00000000-00000000-00000000
CPUID 80000001: 00000000-00000000-00000001-28100000
CPUID 80000002: 20202020-20202020-65746E49-2952286C
CPUID 80000003: 726F4320-4D542865-37692029-3036322D
CPUID 80000004: 50432030-20402055-30342E33-007A4847
CPUID 80000005: 00000000-00000000-00000000-00000000
CPUID 80000006: 00000000-00000000-01006040-00000000
CPUID 80000007: 00000000-00000000-00000000-00000100
CPUID 80000008: 00003024-00000000-00000000-00000000

L1    Data Cache:     32 KB,  8-way Associative, 64-byte Line
L1  Instr. Cache:     32 KB,  8-way Associative, 64-byte Line
L2 Unified Cache:    256 KB,  8-way Associative, 64-byte Line
L3 Unified Cache:   8192 KB, 16-way Associative, 64-byte Line

------[ Logical CPU #1 ]------

allcpu: Package 0 / Core 0 / Thread 1: Valid, Virtual

CPUID 00000000: 0000000D-756E6547-6C65746E-49656E69
CPUID 00000001: 000206A7-01100800-1FBAE3FF-BFEBFBFF
CPUID 00000002: 76035A01-00F0B2FF-00000000-00CA0000
CPUID 00000003: 00000000-00000000-00000000-00000000
CPUID 00000004: 1C004121-01C0003F-0000003F-00000000
CPUID 00000004: 1C004122-01C0003F-0000003F-00000000
CPUID 00000004: 1C004143-01C0003F-000001FF-00000000
CPUID 00000004: 1C03C163-03C0003F-00001FFF-00000006
CPUID 00000005: 00000040-00000040-00000003-00001120
CPUID 00000006: 00000075-00000002-00000009-00000000
CPUID 00000007: 00000000-00000000-00000000-00000000
CPUID 00000008: 00000000-00000000-00000000-00000000
CPUID 00000009: 00000000-00000000-00000000-00000000
CPUID 0000000A: 07300403-00000000-00000000-00000603
CPUID 0000000B: 00000001-00000002-00000100-00000001
CPUID 0000000B: 00000004-00000008-00000201-00000001
CPUID 0000000C: 00000000-00000000-00000000-00000000
CPUID 0000000D: 00000007-00000340-00000340-00000000
CPUID 0000000D: 00000100-00000240-00000000-00000000
CPUID 80000000: 80000008-00000000-00000000-00000000
CPUID 80000001: 00000000-00000000-00000001-28100000
CPUID 80000002: 20202020-20202020-65746E49-2952286C
CPUID 80000003: 726F4320-4D542865-37692029-3036322D
CPUID 80000004: 50432030-20402055-30342E33-007A4847
CPUID 80000005: 00000000-00000000-00000000-00000000
CPUID 80000006: 00000000-00000000-01006040-00000000
CPUID 80000007: 00000000-00000000-00000000-00000100
CPUID 80000008: 00003024-00000000-00000000-00000000

L1    Data Cache:     32 KB,  8-way Associative, 64-byte Line
L1  Instr. Cache:     32 KB,  8-way Associative, 64-byte Line
L2 Unified Cache:    256 KB,  8-way Associative, 64-byte Line
L3 Unified Cache:   8192 KB, 16-way Associative, 64-byte Line

------[ Logical CPU #2 ]------

allcpu: Package 0 / Core 1 / Thread 0: Valid

CPUID 00000000: 0000000D-756E6547-6C65746E-49656E69
CPUID 00000001: 000206A7-02100800-1FBAE3FF-BFEBFBFF
CPUID 00000002: 76035A01-00F0B2FF-00000000-00CA0000
CPUID 00000003: 00000000-00000000-00000000-00000000
CPUID 00000004: 1C004121-01C0003F-0000003F-00000000
CPUID 00000004: 1C004122-01C0003F-0000003F-00000000
CPUID 00000004: 1C004143-01C0003F-000001FF-00000000
CPUID 00000004: 1C03C163-03C0003F-00001FFF-00000006
CPUID 00000005: 00000040-00000040-00000003-00001120
CPUID 00000006: 00000075-00000002-00000009-00000000
CPUID 00000007: 00000000-00000000-00000000-00000000
CPUID 00000008: 00000000-00000000-00000000-00000000
CPUID 00000009: 00000000-00000000-00000000-00000000
CPUID 0000000A: 07300403-00000000-00000000-00000603
CPUID 0000000B: 00000001-00000002-00000100-00000002
CPUID 0000000B: 00000004-00000008-00000201-00000002
CPUID 0000000C: 00000000-00000000-00000000-00000000
CPUID 0000000D: 00000007-00000340-00000340-00000000
CPUID 0000000D: 00000100-00000240-00000000-00000000
CPUID 80000000: 80000008-00000000-00000000-00000000
CPUID 80000001: 00000000-00000000-00000001-28100000
CPUID 80000002: 20202020-20202020-65746E49-2952286C
CPUID 80000003: 726F4320-4D542865-37692029-3036322D
CPUID 80000004: 50432030-20402055-30342E33-007A4847
CPUID 80000005: 00000000-00000000-00000000-00000000
CPUID 80000006: 00000000-00000000-01006040-00000000
CPUID 80000007: 00000000-00000000-00000000-00000100
CPUID 80000008: 00003024-00000000-00000000-00000000

L1    Data Cache:     32 KB,  8-way Associative, 64-byte Line
L1  Instr. Cache:     32 KB,  8-way Associative, 64-byte Line
L2 Unified Cache:    256 KB,  8-way Associative, 64-byte Line
L3 Unified Cache:   8192 KB, 16-way Associative, 64-byte Line

------[ Logical CPU #3 ]------

allcpu: Package 0 / Core 1 / Thread 1: Valid, Virtual

CPUID 00000000: 0000000D-756E6547-6C65746E-49656E69
CPUID 00000001: 000206A7-03100800-1FBAE3FF-BFEBFBFF
CPUID 00000002: 76035A01-00F0B2FF-00000000-00CA0000
CPUID 00000003: 00000000-00000000-00000000-00000000
CPUID 00000004: 1C004121-01C0003F-0000003F-00000000
CPUID 00000004: 1C004122-01C0003F-0000003F-00000000
CPUID 00000004: 1C004143-01C0003F-000001FF-00000000
CPUID 00000004: 1C03C163-03C0003F-00001FFF-00000006
CPUID 00000005: 00000040-00000040-00000003-00001120
CPUID 00000006: 00000075-00000002-00000009-00000000
CPUID 00000007: 00000000-00000000-00000000-00000000
CPUID 00000008: 00000000-00000000-00000000-00000000
CPUID 00000009: 00000000-00000000-00000000-00000000
CPUID 0000000A: 07300403-00000000-00000000-00000603
CPUID 0000000B: 00000001-00000002-00000100-00000003
CPUID 0000000B: 00000004-00000008-00000201-00000003
CPUID 0000000C: 00000000-00000000-00000000-00000000
CPUID 0000000D: 00000007-00000340-00000340-00000000
CPUID 0000000D: 00000100-00000240-00000000-00000000
CPUID 80000000: 80000008-00000000-00000000-00000000
CPUID 80000001: 00000000-00000000-00000001-28100000
CPUID 80000002: 20202020-20202020-65746E49-2952286C
CPUID 80000003: 726F4320-4D542865-37692029-3036322D
CPUID 80000004: 50432030-20402055-30342E33-007A4847
CPUID 80000005: 00000000-00000000-00000000-00000000
CPUID 80000006: 00000000-00000000-01006040-00000000
CPUID 80000007: 00000000-00000000-00000000-00000100
CPUID 80000008: 00003024-00000000-00000000-00000000

L1    Data Cache:     32 KB,  8-way Associative, 64-byte Line
L1  Instr. Cache:     32 KB,  8-way Associative, 64-byte Line
L2 Unified Cache:    256 KB,  8-way Associative, 64-byte Line
L3 Unified Cache:   8192 KB, 16-way Associative, 64-byte Line

------[ Logical CPU #4 ]------

allcpu: Package 0 / Core 2 / Thread 0: Valid

CPUID 00000000: 0000000D-756E6547-6C65746E-49656E69
CPUID 00000001: 000206A7-04100800-1FBAE3FF-BFEBFBFF
CPUID 00000002: 76035A01-00F0B2FF-00000000-00CA0000
CPUID 00000003: 00000000-00000000-00000000-00000000
CPUID 00000004: 1C004121-01C0003F-0000003F-00000000
CPUID 00000004: 1C004122-01C0003F-0000003F-00000000
CPUID 00000004: 1C004143-01C0003F-000001FF-00000000
CPUID 00000004: 1C03C163-03C0003F-00001FFF-00000006
CPUID 00000005: 00000040-00000040-00000003-00001120
CPUID 00000006: 00000075-00000002-00000009-00000000
CPUID 00000007: 00000000-00000000-00000000-00000000
CPUID 00000008: 00000000-00000000-00000000-00000000
CPUID 00000009: 00000000-00000000-00000000-00000000
CPUID 0000000A: 07300403-00000000-00000000-00000603
CPUID 0000000B: 00000001-00000002-00000100-00000004
CPUID 0000000B: 00000004-00000008-00000201-00000004
CPUID 0000000C: 00000000-00000000-00000000-00000000
CPUID 0000000D: 00000007-00000340-00000340-00000000
CPUID 0000000D: 00000100-00000240-00000000-00000000
CPUID 80000000: 80000008-00000000-00000000-00000000
CPUID 80000001: 00000000-00000000-00000001-28100000
CPUID 80000002: 20202020-20202020-65746E49-2952286C
CPUID 80000003: 726F4320-4D542865-37692029-3036322D
CPUID 80000004: 50432030-20402055-30342E33-007A4847
CPUID 80000005: 00000000-00000000-00000000-00000000
CPUID 80000006: 00000000-00000000-01006040-00000000
CPUID 80000007: 00000000-00000000-00000000-00000100
CPUID 80000008: 00003024-00000000-00000000-00000000

L1    Data Cache:     32 KB,  8-way Associative, 64-byte Line
L1  Instr. Cache:     32 KB,  8-way Associative, 64-byte Line
L2 Unified Cache:    256 KB,  8-way Associative, 64-byte Line
L3 Unified Cache:   8192 KB, 16-way Associative, 64-byte Line

------[ Logical CPU #5 ]------

allcpu: Package 0 / Core 2 / Thread 1: Valid, Virtual

CPUID 00000000: 0000000D-756E6547-6C65746E-49656E69
CPUID 00000001: 000206A7-05100800-1FBAE3FF-BFEBFBFF
CPUID 00000002: 76035A01-00F0B2FF-00000000-00CA0000
CPUID 00000003: 00000000-00000000-00000000-00000000
CPUID 00000004: 1C004121-01C0003F-0000003F-00000000
CPUID 00000004: 1C004122-01C0003F-0000003F-00000000
CPUID 00000004: 1C004143-01C0003F-000001FF-00000000
CPUID 00000004: 1C03C163-03C0003F-00001FFF-00000006
CPUID 00000005: 00000040-00000040-00000003-00001120
CPUID 00000006: 00000075-00000002-00000009-00000000
CPUID 00000007: 00000000-00000000-00000000-00000000
CPUID 00000008: 00000000-00000000-00000000-00000000
CPUID 00000009: 00000000-00000000-00000000-00000000
CPUID 0000000A: 07300403-00000000-00000000-00000603
CPUID 0000000B: 00000001-00000002-00000100-00000005
CPUID 0000000B: 00000004-00000008-00000201-00000005
CPUID 0000000C: 00000000-00000000-00000000-00000000
CPUID 0000000D: 00000007-00000340-00000340-00000000
CPUID 0000000D: 00000100-00000240-00000000-00000000
CPUID 80000000: 80000008-00000000-00000000-00000000
CPUID 80000001: 00000000-00000000-00000001-28100000
CPUID 80000002: 20202020-20202020-65746E49-2952286C
CPUID 80000003: 726F4320-4D542865-37692029-3036322D
CPUID 80000004: 50432030-20402055-30342E33-007A4847
CPUID 80000005: 00000000-00000000-00000000-00000000
CPUID 80000006: 00000000-00000000-01006040-00000000
CPUID 80000007: 00000000-00000000-00000000-00000100
CPUID 80000008: 00003024-00000000-00000000-00000000

L1    Data Cache:     32 KB,  8-way Associative, 64-byte Line
L1  Instr. Cache:     32 KB,  8-way Associative, 64-byte Line
L2 Unified Cache:    256 KB,  8-way Associative, 64-byte Line
L3 Unified Cache:   8192 KB, 16-way Associative, 64-byte Line

------[ Logical CPU #6 ]------

allcpu: Package 0 / Core 3 / Thread 0: Valid

CPUID 00000000: 0000000D-756E6547-6C65746E-49656E69
CPUID 00000001: 000206A7-06100800-1FBAE3FF-BFEBFBFF
CPUID 00000002: 76035A01-00F0B2FF-00000000-00CA0000
CPUID 00000003: 00000000-00000000-00000000-00000000
CPUID 00000004: 1C004121-01C0003F-0000003F-00000000
CPUID 00000004: 1C004122-01C0003F-0000003F-00000000
CPUID 00000004: 1C004143-01C0003F-000001FF-00000000
CPUID 00000004: 1C03C163-03C0003F-00001FFF-00000006
CPUID 00000005: 00000040-00000040-00000003-00001120
CPUID 00000006: 00000075-00000002-00000009-00000000
CPUID 00000007: 00000000-00000000-00000000-00000000
CPUID 00000008: 00000000-00000000-00000000-00000000
CPUID 00000009: 00000000-00000000-00000000-00000000
CPUID 0000000A: 07300403-00000000-00000000-00000603
CPUID 0000000B: 00000001-00000002-00000100-00000006
CPUID 0000000B: 00000004-00000008-00000201-00000006
CPUID 0000000C: 00000000-00000000-00000000-00000000
CPUID 0000000D: 00000007-00000340-00000340-00000000
CPUID 0000000D: 00000100-00000240-00000000-00000000
CPUID 80000000: 80000008-00000000-00000000-00000000
CPUID 80000001: 00000000-00000000-00000001-28100000
CPUID 80000002: 20202020-20202020-65746E49-2952286C
CPUID 80000003: 726F4320-4D542865-37692029-3036322D
CPUID 80000004: 50432030-20402055-30342E33-007A4847
CPUID 80000005: 00000000-00000000-00000000-00000000
CPUID 80000006: 00000000-00000000-01006040-00000000
CPUID 80000007: 00000000-00000000-00000000-00000100
CPUID 80000008: 00003024-00000000-00000000-00000000

L1    Data Cache:     32 KB,  8-way Associative, 64-byte Line
L1  Instr. Cache:     32 KB,  8-way Associative, 64-byte Line
L2 Unified Cache:    256 KB,  8-way Associative, 64-byte Line
L3 Unified Cache:   8192 KB, 16-way Associative, 64-byte Line

------[ Logical CPU #7 ]------

allcpu: Package 0 / Core 3 / Thread 1: Valid, Virtual

CPUID 00000000: 0000000D-756E6547-6C65746E-49656E69
CPUID 00000001: 000206A7-07100800-1FBAE3FF-BFEBFBFF
CPUID 00000002: 76035A01-00F0B2FF-00000000-00CA0000
CPUID 00000003: 00000000-00000000-00000000-00000000
CPUID 00000004: 1C004121-01C0003F-0000003F-00000000
CPUID 00000004: 1C004122-01C0003F-0000003F-00000000
CPUID 00000004: 1C004143-01C0003F-000001FF-00000000
CPUID 00000004: 1C03C163-03C0003F-00001FFF-00000006
CPUID 00000005: 00000040-00000040-00000003-00001120
CPUID 00000006: 00000075-00000002-00000009-00000000
CPUID 00000007: 00000000-00000000-00000000-00000000
CPUID 00000008: 00000000-00000000-00000000-00000000
CPUID 00000009: 00000000-00000000-00000000-00000000
CPUID 0000000A: 07300403-00000000-00000000-00000603
CPUID 0000000B: 00000001-00000002-00000100-00000007
CPUID 0000000B: 00000004-00000008-00000201-00000007
CPUID 0000000C: 00000000-00000000-00000000-00000000
CPUID 0000000D: 00000007-00000340-00000340-00000000
CPUID 0000000D: 00000100-00000240-00000000-00000000
CPUID 80000000: 80000008-00000000-00000000-00000000
CPUID 80000001: 00000000-00000000-00000001-28100000
CPUID 80000002: 20202020-20202020-65746E49-2952286C
CPUID 80000003: 726F4320-4D542865-37692029-3036322D
CPUID 80000004: 50432030-20402055-30342E33-007A4847
CPUID 80000005: 00000000-00000000-00000000-00000000
CPUID 80000006: 00000000-00000000-01006040-00000000
CPUID 80000007: 00000000-00000000-00000000-00000100
CPUID 80000008: 00003024-00000000-00000000-00000000

L1    Data Cache:     32 KB,  8-way Associative, 64-byte Line
L1  Instr. Cache:     32 KB,  8-way Associative, 64-byte Line
L2 Unified Cache:    256 KB,  8-way Associative, 64-byte Line
L3 Unified Cache:   8192 KB, 16-way Associative, 64-byte Line

------[ All CPUs ]------

CPU   0: APICID   0 / Package 0 / Core  0 / Thread 0: Valid
CPU   1: APICID   1 / Package 0 / Core  0 / Thread 1: Valid, Virtual
CPU   2: APICID   2 / Package 0 / Core  1 / Thread 0: Valid
CPU   3: APICID   3 / Package 0 / Core  1 / Thread 1: Valid, Virtual
CPU   4: APICID   4 / Package 0 / Core  2 / Thread 0: Valid
CPU   5: APICID   5 / Package 0 / Core  2 / Thread 1: Valid, Virtual
CPU   6: APICID   6 / Package 0 / Core  3 / Thread 0: Valid
CPU   7: APICID   7 / Package 0 / Core  3 / Thread 1: Valid, Virtual

------[ MSR Registers ]------

MSR 00000017: 0004-0000-0000-0000 [PlatID = 1]
MSR 0000001B: 0000-0000-FEE0-0900
MSR 00000035: 0000-0000-0004-0008
MSR 0000008B: 0000-0014-0000-0000
MSR 000000CE: 0000-1000-7001-2200
MSR 000000E7: 0000-0000-00F0-3906
MSR 000000E8: 0000-0000-00EF-5DD5
MSR 00000194: 0000-0000-0008-0000
MSR 00000198: 0000-2526-0000-2200
MSR 00000199: 0000-0000-0000-2600
MSR 0000019A: 0000-0000-0000-0000
MSR 0000019B: 0000-0000-0000-0000
MSR 0000019C: 0000-0000-8842-0000
MSR 0000019D: 0000-0000-0000-0000
MSR 000001A0: 0000-0040-0085-0089
MSR 000001A2: 0000-0000-0063-1300
MSR 000001A4: 0000-0000-0000-0000
MSR 000001AA: 0000-0000-0040-0000
MSR 000001AD: 0000-0000-2324-2526
MSR 000001B0: 0000-0000-0000-0000
MSR 000001B1: 0000-0000-8840-0000
MSR 000001B2: 0000-0000-0000-0000
MSR 000001FC: 0000-0000-0004-005F
MSR 00000606: 0000-0000-000A-1003
MSR 0000060A: 0000-0000-0000-8850
MSR 0000060B: 0000-0000-0000-8868
MSR 0000060C: 0000-0000-0000-886D
MSR 0000060D: 0000-1F3D-3B79-16D8
MSR 00000610: 8000-87F8-0014-87F8
MSR 00000611: 0000-0000-0471-819A
MSR 00000614: 0000-0000-01E0-02F8
MSR 00000638: 0000-0000-0000-0000
MSR 00000639: 0000-0000-40F9-E6CC
MSR 0000063A: 0000-0000-0000-0000
MSR 00000640: 0000-0000-0000-0000
MSR 00000641: 0000-0000-0000-0000
MSR 00000642: 0000-0000-0000-0010

PerformanceFrequency = 3331201

Tjmax Temperature = 99 Celsius

APIC Clock = 100.33 MHz
APIC Clock = 100.33 MHz
APIC Clock = 100.33 MHz
APIC Clock = 100.33 MHz
APIC Clock = 100.33 MHz
