CPUID 00000000: 00000014-756E6547-6C65746E-49656E69
CPUID 00000001: 00040671-00100800-7FFAFBBF-BFEBFBFF
CPUID 00000002: 76036301-00F0B5FF-00000000-00C30000
CPUID 00000003: 00000000-00000000-00000000-00000000
CPUID 00000004: 1C004121-01C0003F-0000003F-00000000
CPUID 00000004: 1C004122-01C0003F-0000003F-00000000
CPUID 00000004: 1C004143-01C0003F-000001FF-00000000
CPUID 00000004: 1C03C163-02C0003F-00001FFF-00000006
CPUID 00000004: 1C03C183-03C0F03F-00001FFF-00000004
CPUID 00000005: 00000040-00000040-00000003-00002120
CPUID 00000006: 00000077-00000002-00000001-00000000
CPUID 00000007: 00000000-021C2FBB-00000000-00000000
CPUID 00000008: 00000000-00000000-00000000-00000000
CPUID 00000009: 00000000-00000000-00000000-00000000
CPUID 0000000A: 07300403-00000000-00000000-00000603
CPUID 0000000B: 00000001-00000002-00000100-00000000
CPUID 0000000B: 00000004-00000008-00000201-00000000
CPUID 0000000C: 00000000-00000001-00000001-00000000
CPUID 0000000D: 00000007-00000240-00000340-00000000
CPUID 0000000E: 00000000-00000000-00000000-00000000
CPUID 0000000F: 00000000-00000000-00000000-00000000
CPUID 00000010: 00000000-00000000-00000000-00000000
CPUID 00000011: 00000000-00000000-00000000-00000000
CPUID 00000012: 00000000-00000000-00000000-00000000
CPUID 00000013: 00000000-00000000-00000000-00000000
CPUID 00000014: 00000000-00000001-00000001-00000000
CPUID 80000000: 80000008-00000000-00000000-00000000
CPUID 80000001: 00000000-00000000-00000121-2C100000
CPUID 80000002: 65746E49-2952286C-726F4320-4D542865
CPUID 80000003: 37692029-3737352D-43204335-40205550
CPUID 80000004: 332E3320-7A484730-00000000-00000000
CPUID 80000005: 00000000-00000000-00000000-00000000
CPUID 80000006: 00000000-00000000-01006040-00000000
CPUID 80000007: 00000000-00000000-00000000-00000100
CPUID 80000008: 00003027-00000000-00000000-00000000

CPUID 00000000: 00000014-756E6547-6C65746E-49656E69
CPUID 00000001: 00040671-01100800-7FFAFBBF-BFEBFBFF
CPUID 00000002: 76036301-00F0B5FF-00000000-00C30000
CPUID 00000003: 00000000-00000000-00000000-00000000
CPUID 00000004: 1C004121-01C0003F-0000003F-00000000
CPUID 00000004: 1C004122-01C0003F-0000003F-00000000
CPUID 00000004: 1C004143-01C0003F-000001FF-00000000
CPUID 00000004: 1C03C163-02C0003F-00001FFF-00000006
CPUID 00000004: 1C03C183-03C0F03F-00001FFF-00000004
CPUID 00000005: 00000040-00000040-00000003-00002120
CPUID 00000006: 00000077-00000002-00000001-00000000
CPUID 00000007: 00000000-021C2FBB-00000000-00000000
CPUID 00000008: 00000000-00000000-00000000-00000000
CPUID 00000009: 00000000-00000000-00000000-00000000
CPUID 0000000A: 07300403-00000000-00000000-00000603
CPUID 0000000B: 00000001-00000002-00000100-00000001
CPUID 0000000B: 00000004-00000008-00000201-00000001
CPUID 0000000C: 00000000-00000001-00000001-00000000
CPUID 0000000D: 00000007-00000240-00000340-00000000
CPUID 0000000E: 00000000-00000000-00000000-00000000
CPUID 0000000F: 00000000-00000000-00000000-00000000
CPUID 00000010: 00000000-00000000-00000000-00000000
CPUID 00000011: 00000000-00000000-00000000-00000000
CPUID 00000012: 00000000-00000000-00000000-00000000
CPUID 00000013: 00000000-00000000-00000000-00000000
CPUID 00000014: 00000000-00000001-00000001-00000000
CPUID 80000000: 80000008-00000000-00000000-00000000
CPUID 80000001: 00000000-00000000-00000121-2C100000
CPUID 80000002: 65746E49-2952286C-726F4320-4D542865
CPUID 80000003: 37692029-3737352D-43204335-40205550
CPUID 80000004: 332E3320-7A484730-00000000-00000000
CPUID 80000005: 00000000-00000000-00000000-00000000
CPUID 80000006: 00000000-00000000-01006040-00000000
CPUID 80000007: 00000000-00000000-00000000-00000100
CPUID 80000008: 00003027-00000000-00000000-00000000

CPUID 00000000: 00000014-756E6547-6C65746E-49656E69
CPUID 00000001: 00040671-02100800-7FFAFBBF-BFEBFBFF
CPUID 00000002: 76036301-00F0B5FF-00000000-00C30000
CPUID 00000003: 00000000-00000000-00000000-00000000
CPUID 00000004: 1C004121-01C0003F-0000003F-00000000
CPUID 00000004: 1C004122-01C0003F-0000003F-00000000
CPUID 00000004: 1C004143-01C0003F-000001FF-00000000
CPUID 00000004: 1C03C163-02C0003F-00001FFF-00000006
CPUID 00000004: 1C03C183-03C0F03F-00001FFF-00000004
CPUID 00000005: 00000040-00000040-00000003-00002120
CPUID 00000006: 00000077-00000002-00000001-00000000
CPUID 00000007: 00000000-021C2FBB-00000000-00000000
CPUID 00000008: 00000000-00000000-00000000-00000000
CPUID 00000009: 00000000-00000000-00000000-00000000
CPUID 0000000A: 07300403-00000000-00000000-00000603
CPUID 0000000B: 00000001-00000002-00000100-00000002
CPUID 0000000B: 00000004-00000008-00000201-00000002
CPUID 0000000C: 00000000-00000001-00000001-00000000
CPUID 0000000D: 00000007-00000240-00000340-00000000
CPUID 0000000E: 00000000-00000000-00000000-00000000
CPUID 0000000F: 00000000-00000000-00000000-00000000
CPUID 00000010: 00000000-00000000-00000000-00000000
CPUID 00000011: 00000000-00000000-00000000-00000000
CPUID 00000012: 00000000-00000000-00000000-00000000
CPUID 00000013: 00000000-00000000-00000000-00000000
CPUID 00000014: 00000000-00000001-00000001-00000000
CPUID 80000000: 80000008-00000000-00000000-00000000
CPUID 80000001: 00000000-00000000-00000121-2C100000
CPUID 80000002: 65746E49-2952286C-726F4320-4D542865
CPUID 80000003: 37692029-3737352D-43204335-40205550
CPUID 80000004: 332E3320-7A484730-00000000-00000000
CPUID 80000005: 00000000-00000000-00000000-00000000
CPUID 80000006: 00000000-00000000-01006040-00000000
CPUID 80000007: 00000000-00000000-00000000-00000100
CPUID 80000008: 00003027-00000000-00000000-00000000

CPUID 00000000: 00000014-756E6547-6C65746E-49656E69
CPUID 00000001: 00040671-03100800-7FFAFBBF-BFEBFBFF
CPUID 00000002: 76036301-00F0B5FF-00000000-00C30000
CPUID 00000003: 00000000-00000000-00000000-00000000
CPUID 00000004: 1C004121-01C0003F-0000003F-00000000
CPUID 00000004: 1C004122-01C0003F-0000003F-00000000
CPUID 00000004: 1C004143-01C0003F-000001FF-00000000
CPUID 00000004: 1C03C163-02C0003F-00001FFF-00000006
CPUID 00000004: 1C03C183-03C0F03F-00001FFF-00000004
CPUID 00000005: 00000040-00000040-00000003-00002120
CPUID 00000006: 00000077-00000002-00000001-00000000
CPUID 00000007: 00000000-021C2FBB-00000000-00000000
CPUID 00000008: 00000000-00000000-00000000-00000000
CPUID 00000009: 00000000-00000000-00000000-00000000
CPUID 0000000A: 07300403-00000000-00000000-00000603
CPUID 0000000B: 00000001-00000002-00000100-00000003
CPUID 0000000B: 00000004-00000008-00000201-00000003
CPUID 0000000C: 00000000-00000001-00000001-00000000
CPUID 0000000D: 00000007-00000240-00000340-00000000
CPUID 0000000E: 00000000-00000000-00000000-00000000
CPUID 0000000F: 00000000-00000000-00000000-00000000
CPUID 00000010: 00000000-00000000-00000000-00000000
CPUID 00000011: 00000000-00000000-00000000-00000000
CPUID 00000012: 00000000-00000000-00000000-00000000
CPUID 00000013: 00000000-00000000-00000000-00000000
CPUID 00000014: 00000000-00000001-00000001-00000000
CPUID 80000000: 80000008-00000000-00000000-00000000
CPUID 80000001: 00000000-00000000-00000121-2C100000
CPUID 80000002: 65746E49-2952286C-726F4320-4D542865
CPUID 80000003: 37692029-3737352D-43204335-40205550
CPUID 80000004: 332E3320-7A484730-00000000-00000000
CPUID 80000005: 00000000-00000000-00000000-00000000
CPUID 80000006: 00000000-00000000-01006040-00000000
CPUID 80000007: 00000000-00000000-00000000-00000100
CPUID 80000008: 00003027-00000000-00000000-00000000

CPUID 00000000: 00000014-756E6547-6C65746E-49656E69
CPUID 00000001: 00040671-04100800-7FFAFBBF-BFEBFBFF
CPUID 00000002: 76036301-00F0B5FF-00000000-00C30000
CPUID 00000003: 00000000-00000000-00000000-00000000
CPUID 00000004: 1C004121-01C0003F-0000003F-00000000
CPUID 00000004: 1C004122-01C0003F-0000003F-00000000
CPUID 00000004: 1C004143-01C0003F-000001FF-00000000
CPUID 00000004: 1C03C163-02C0003F-00001FFF-00000006
CPUID 00000004: 1C03C183-03C0F03F-00001FFF-00000004
CPUID 00000005: 00000040-00000040-00000003-00002120
CPUID 00000006: 00000077-00000002-00000001-00000000
CPUID 00000007: 00000000-021C2FBB-00000000-00000000
CPUID 00000008: 00000000-00000000-00000000-00000000
CPUID 00000009: 00000000-00000000-00000000-00000000
CPUID 0000000A: 07300403-00000000-00000000-00000603
CPUID 0000000B: 00000001-00000002-00000100-00000004
CPUID 0000000B: 00000004-00000008-00000201-00000004
CPUID 0000000C: 00000000-00000001-00000001-00000000
CPUID 0000000D: 00000007-00000240-00000340-00000000
CPUID 0000000E: 00000000-00000000-00000000-00000000
CPUID 0000000F: 00000000-00000000-00000000-00000000
CPUID 00000010: 00000000-00000000-00000000-00000000
CPUID 00000011: 00000000-00000000-00000000-00000000
CPUID 00000012: 00000000-00000000-00000000-00000000
CPUID 00000013: 00000000-00000000-00000000-00000000
CPUID 00000014: 00000000-00000001-00000001-00000000
CPUID 80000000: 80000008-00000000-00000000-00000000
CPUID 80000001: 00000000-00000000-00000121-2C100000
CPUID 80000002: 65746E49-2952286C-726F4320-4D542865
CPUID 80000003: 37692029-3737352D-43204335-40205550
CPUID 80000004: 332E3320-7A484730-00000000-00000000
CPUID 80000005: 00000000-00000000-00000000-00000000
CPUID 80000006: 00000000-00000000-01006040-00000000
CPUID 80000007: 00000000-00000000-00000000-00000100
CPUID 80000008: 00003027-00000000-00000000-00000000

CPUID 00000000: 00000014-756E6547-6C65746E-49656E69
CPUID 00000001: 00040671-05100800-7FFAFBBF-BFEBFBFF
CPUID 00000002: 76036301-00F0B5FF-00000000-00C30000
CPUID 00000003: 00000000-00000000-00000000-00000000
CPUID 00000004: 1C004121-01C0003F-0000003F-00000000
CPUID 00000004: 1C004122-01C0003F-0000003F-00000000
CPUID 00000004: 1C004143-01C0003F-000001FF-00000000
CPUID 00000004: 1C03C163-02C0003F-00001FFF-00000006
CPUID 00000004: 1C03C183-03C0F03F-00001FFF-00000004
CPUID 00000005: 00000040-00000040-00000003-00002120
CPUID 00000006: 00000077-00000002-00000001-00000000
CPUID 00000007: 00000000-021C2FBB-00000000-00000000
CPUID 00000008: 00000000-00000000-00000000-00000000
CPUID 00000009: 00000000-00000000-00000000-00000000
CPUID 0000000A: 07300403-00000000-00000000-00000603
CPUID 0000000B: 00000001-00000002-00000100-00000005
CPUID 0000000B: 00000004-00000008-00000201-00000005
CPUID 0000000C: 00000000-00000001-00000001-00000000
CPUID 0000000D: 00000007-00000240-00000340-00000000
CPUID 0000000E: 00000000-00000000-00000000-00000000
CPUID 0000000F: 00000000-00000000-00000000-00000000
CPUID 00000010: 00000000-00000000-00000000-00000000
CPUID 00000011: 00000000-00000000-00000000-00000000
CPUID 00000012: 00000000-00000000-00000000-00000000
CPUID 00000013: 00000000-00000000-00000000-00000000
CPUID 00000014: 00000000-00000001-00000001-00000000
CPUID 80000000: 80000008-00000000-00000000-00000000
CPUID 80000001: 00000000-00000000-00000121-2C100000
CPUID 80000002: 65746E49-2952286C-726F4320-4D542865
CPUID 80000003: 37692029-3737352D-43204335-40205550
CPUID 80000004: 332E3320-7A484730-00000000-00000000
CPUID 80000005: 00000000-00000000-00000000-00000000
CPUID 80000006: 00000000-00000000-01006040-00000000
CPUID 80000007: 00000000-00000000-00000000-00000100
CPUID 80000008: 00003027-00000000-00000000-00000000

CPUID 00000000: 00000014-756E6547-6C65746E-49656E69
CPUID 00000001: 00040671-06100800-7FFAFBBF-BFEBFBFF
CPUID 00000002: 76036301-00F0B5FF-00000000-00C30000
CPUID 00000003: 00000000-00000000-00000000-00000000
CPUID 00000004: 1C004121-01C0003F-0000003F-00000000
CPUID 00000004: 1C004122-01C0003F-0000003F-00000000
CPUID 00000004: 1C004143-01C0003F-000001FF-00000000
CPUID 00000004: 1C03C163-02C0003F-00001FFF-00000006
CPUID 00000004: 1C03C183-03C0F03F-00001FFF-00000004
CPUID 00000005: 00000040-00000040-00000003-00002120
CPUID 00000006: 00000077-00000002-00000001-00000000
CPUID 00000007: 00000000-021C2FBB-00000000-00000000
CPUID 00000008: 00000000-00000000-00000000-00000000
CPUID 00000009: 00000000-00000000-00000000-00000000
CPUID 0000000A: 07300403-00000000-00000000-00000603
CPUID 0000000B: 00000001-00000002-00000100-00000006
CPUID 0000000B: 00000004-00000008-00000201-00000006
CPUID 0000000C: 00000000-00000001-00000001-00000000
CPUID 0000000D: 00000007-00000240-00000340-00000000
CPUID 0000000E: 00000000-00000000-00000000-00000000
CPUID 0000000F: 00000000-00000000-00000000-00000000
CPUID 00000010: 00000000-00000000-00000000-00000000
CPUID 00000011: 00000000-00000000-00000000-00000000
CPUID 00000012: 00000000-00000000-00000000-00000000
CPUID 00000013: 00000000-00000000-00000000-00000000
CPUID 00000014: 00000000-00000001-00000001-00000000
CPUID 80000000: 80000008-00000000-00000000-00000000
CPUID 80000001: 00000000-00000000-00000121-2C100000
CPUID 80000002: 65746E49-2952286C-726F4320-4D542865
CPUID 80000003: 37692029-3737352D-43204335-40205550
CPUID 80000004: 332E3320-7A484730-00000000-00000000
CPUID 80000005: 00000000-00000000-00000000-00000000
CPUID 80000006: 00000000-00000000-01006040-00000000
CPUID 80000007: 00000000-00000000-00000000-00000100
CPUID 80000008: 00003027-00000000-00000000-00000000

CPUID 00000000: 00000014-756E6547-6C65746E-49656E69
CPUID 00000001: 00040671-07100800-7FFAFBBF-BFEBFBFF
CPUID 00000002: 76036301-00F0B5FF-00000000-00C30000
CPUID 00000003: 00000000-00000000-00000000-00000000
CPUID 00000004: 1C004121-01C0003F-0000003F-00000000
CPUID 00000004: 1C004122-01C0003F-0000003F-00000000
CPUID 00000004: 1C004143-01C0003F-000001FF-00000000
CPUID 00000004: 1C03C163-02C0003F-00001FFF-00000006
CPUID 00000004: 1C03C183-03C0F03F-00001FFF-00000004
CPUID 00000005: 00000040-00000040-00000003-00002120
CPUID 00000006: 00000077-00000002-00000001-00000000
CPUID 00000007: 00000000-021C2FBB-00000000-00000000
CPUID 00000008: 00000000-00000000-00000000-00000000
CPUID 00000009: 00000000-00000000-00000000-00000000
CPUID 0000000A: 07300403-00000000-00000000-00000603
CPUID 0000000B: 00000001-00000002-00000100-00000007
CPUID 0000000B: 00000004-00000008-00000201-00000007
CPUID 0000000C: 00000000-00000001-00000001-00000000
CPUID 0000000D: 00000007-00000240-00000340-00000000
CPUID 0000000E: 00000000-00000000-00000000-00000000
CPUID 0000000F: 00000000-00000000-00000000-00000000
CPUID 00000010: 00000000-00000000-00000000-00000000
CPUID 00000011: 00000000-00000000-00000000-00000000
CPUID 00000012: 00000000-00000000-00000000-00000000
CPUID 00000013: 00000000-00000000-00000000-00000000
CPUID 00000014: 00000000-00000001-00000001-00000000
CPUID 80000000: 80000008-00000000-00000000-00000000
CPUID 80000001: 00000000-00000000-00000121-2C100000
CPUID 80000002: 65746E49-2952286C-726F4320-4D542865
CPUID 80000003: 37692029-3737352D-43204335-40205550
CPUID 80000004: 332E3320-7A484730-00000000-00000000
CPUID 80000005: 00000000-00000000-00000000-00000000
CPUID 80000006: 00000000-00000000-01006040-00000000
CPUID 80000007: 00000000-00000000-00000000-00000100
CPUID 80000008: 00003027-00000000-00000000-00000000