------[ Logical CPU #0 ]------

allcpu: Package 0 / Core 0 / Thread 0: Valid

CPUID 00000000: 0000000B-756E6547-6C65746E-49656E69 [GenuineIntel]
CPUID 00000001: 000106D1-00080800-000CE3BD-BFEBFBFF
CPUID 00000002: 05B0B101-4C5657F0-00000000-2CB43048
CPUID 00000003: 00000000-00000000-00000000-00000000
CPUID 00000004: 1C000121-01C0003F-0000003F-00000001 [SL 00]
CPUID 00000004: 1C000122-01C0003F-0000003F-00000001 [SL 01]
CPUID 00000004: 1C004143-02C0003F-00000FFF-00000001 [SL 02]
CPUID 00000004: 1C01C163-02C0003F-00003FFF-00000002 [SL 03]
CPUID 00000005: 00000040-00000040-00000003-00002220
CPUID 00000006: 00000001-00000002-00000001-00000000
CPUID 00000007: 00000000-00000000-00000000-00000000
CPUID 00000008: 00000400-00000000-00000000-00000000
CPUID 00000009: 00000000-00000000-00000000-00000000
CPUID 0000000A: 07280202-00000000-00000000-00000503
CPUID 0000000B: 00000000-00000001-00000100-00000000 [SL 00]
CPUID 0000000B: 00000003-00000006-00000201-00000000 [SL 01]
CPUID 80000000: 80000008-00000000-00000000-00000000
CPUID 80000001: 00000000-00000000-00000001-20100000
CPUID 80000002: 65746E49-2952286C-6F655820-2952286E [Intel(R) Xeon(R)]
CPUID 80000003: 55504320-20202020-20202020-45202020 [ CPU           E]
CPUID 80000004: 30353437-20402020-30342E32-007A4847 [7450  @ 2.40GHz]
CPUID 80000005: 00000000-00000000-00000000-00000000
CPUID 80000006: 00000000-00000000-0C006040-00000000
CPUID 80000007: 00000000-00000000-00000000-00000000
CPUID 80000008: 00003028-00000000-00000000-00000000

L1    Data Cache:    32 KB,  8-way Associative, 64-byte Line
L1  Instr. Cache:    32 KB,  8-way Associative, 64-byte Line
L2 Unified Cache:     3 MB, 12-way Associative, 64-byte Line
L3 Unified Cache:    12 MB, 12-way Associative, 64-byte Line

------[ Logical CPU #1 ]------

allcpu: Package 0 / Core 1 / Thread 0: Valid

CPUID 00000000: 0000000B-756E6547-6C65746E-49656E69 [GenuineIntel]
CPUID 00000001: 000106D1-01080800-000CE3BD-BFEBFBFF
CPUID 00000002: 05B0B101-4C5657F0-00000000-2CB43048
CPUID 00000003: 00000000-00000000-00000000-00000000
CPUID 00000004: 1C000121-01C0003F-0000003F-00000001 [SL 00]
CPUID 00000004: 1C000122-01C0003F-0000003F-00000001 [SL 01]
CPUID 00000004: 1C004143-02C0003F-00000FFF-00000001 [SL 02]
CPUID 00000004: 1C01C163-02C0003F-00003FFF-00000002 [SL 03]
CPUID 00000005: 00000040-00000040-00000003-00002220
CPUID 00000006: 00000001-00000002-00000001-00000000
CPUID 00000007: 00000000-00000000-00000000-00000000
CPUID 00000008: 00000400-00000000-00000000-00000000
CPUID 00000009: 00000000-00000000-00000000-00000000
CPUID 0000000A: 07280202-00000000-00000000-00000503
CPUID 0000000B: 00000000-00000001-00000100-00000001 [SL 00]
CPUID 0000000B: 00000003-00000006-00000201-00000001 [SL 01]
CPUID 80000000: 80000008-00000000-00000000-00000000
CPUID 80000001: 00000000-00000000-00000001-20100000
CPUID 80000002: 65746E49-2952286C-6F655820-2952286E [Intel(R) Xeon(R)]
CPUID 80000003: 55504320-20202020-20202020-45202020 [ CPU           E]
CPUID 80000004: 30353437-20402020-30342E32-007A4847 [7450  @ 2.40GHz]
CPUID 80000005: 00000000-00000000-00000000-00000000
CPUID 80000006: 00000000-00000000-0C006040-00000000
CPUID 80000007: 00000000-00000000-00000000-00000000
CPUID 80000008: 00003028-00000000-00000000-00000000

L1    Data Cache:    32 KB,  8-way Associative, 64-byte Line
L1  Instr. Cache:    32 KB,  8-way Associative, 64-byte Line
L2 Unified Cache:     3 MB, 12-way Associative, 64-byte Line
L3 Unified Cache:    12 MB, 12-way Associative, 64-byte Line

------[ Logical CPU #2 ]------

allcpu: Package 0 / Core 2 / Thread 0: Valid

CPUID 00000000: 0000000B-756E6547-6C65746E-49656E69 [GenuineIntel]
CPUID 00000001: 000106D1-02080800-000CE3BD-BFEBFBFF
CPUID 00000002: 05B0B101-4C5657F0-00000000-2CB43048
CPUID 00000003: 00000000-00000000-00000000-00000000
CPUID 00000004: 1C000121-01C0003F-0000003F-00000001 [SL 00]
CPUID 00000004: 1C000122-01C0003F-0000003F-00000001 [SL 01]
CPUID 00000004: 1C004143-02C0003F-00000FFF-00000001 [SL 02]
CPUID 00000004: 1C01C163-02C0003F-00003FFF-00000002 [SL 03]
CPUID 00000005: 00000040-00000040-00000003-00002220
CPUID 00000006: 00000001-00000002-00000001-00000000
CPUID 00000007: 00000000-00000000-00000000-00000000
CPUID 00000008: 00000400-00000000-00000000-00000000
CPUID 00000009: 00000000-00000000-00000000-00000000
CPUID 0000000A: 07280202-00000000-00000000-00000503
CPUID 0000000B: 00000000-00000001-00000100-00000002 [SL 00]
CPUID 0000000B: 00000003-00000006-00000201-00000002 [SL 01]
CPUID 80000000: 80000008-00000000-00000000-00000000
CPUID 80000001: 00000000-00000000-00000001-20100000
CPUID 80000002: 65746E49-2952286C-6F655820-2952286E [Intel(R) Xeon(R)]
CPUID 80000003: 55504320-20202020-20202020-45202020 [ CPU           E]
CPUID 80000004: 30353437-20402020-30342E32-007A4847 [7450  @ 2.40GHz]
CPUID 80000005: 00000000-00000000-00000000-00000000
CPUID 80000006: 00000000-00000000-0C006040-00000000
CPUID 80000007: 00000000-00000000-00000000-00000000
CPUID 80000008: 00003028-00000000-00000000-00000000

L1    Data Cache:    32 KB,  8-way Associative, 64-byte Line
L1  Instr. Cache:    32 KB,  8-way Associative, 64-byte Line
L2 Unified Cache:     3 MB, 12-way Associative, 64-byte Line
L3 Unified Cache:    12 MB, 12-way Associative, 64-byte Line

------[ Logical CPU #3 ]------

allcpu: Package 0 / Core 3 / Thread 0: Valid

CPUID 00000000: 0000000B-756E6547-6C65746E-49656E69 [GenuineIntel]
CPUID 00000001: 000106D1-03080800-000CE3BD-BFEBFBFF
CPUID 00000002: 05B0B101-4C5657F0-00000000-2CB43048
CPUID 00000003: 00000000-00000000-00000000-00000000
CPUID 00000004: 1C000121-01C0003F-0000003F-00000001 [SL 00]
CPUID 00000004: 1C000122-01C0003F-0000003F-00000001 [SL 01]
CPUID 00000004: 1C004143-02C0003F-00000FFF-00000001 [SL 02]
CPUID 00000004: 1C01C163-02C0003F-00003FFF-00000002 [SL 03]
CPUID 00000005: 00000040-00000040-00000003-00002220
CPUID 00000006: 00000001-00000002-00000001-00000000
CPUID 00000007: 00000000-00000000-00000000-00000000
CPUID 00000008: 00000400-00000000-00000000-00000000
CPUID 00000009: 00000000-00000000-00000000-00000000
CPUID 0000000A: 07280202-00000000-00000000-00000503
CPUID 0000000B: 00000000-00000001-00000100-00000003 [SL 00]
CPUID 0000000B: 00000003-00000006-00000201-00000003 [SL 01]
CPUID 80000000: 80000008-00000000-00000000-00000000
CPUID 80000001: 00000000-00000000-00000001-20100000
CPUID 80000002: 65746E49-2952286C-6F655820-2952286E [Intel(R) Xeon(R)]
CPUID 80000003: 55504320-20202020-20202020-45202020 [ CPU           E]
CPUID 80000004: 30353437-20402020-30342E32-007A4847 [7450  @ 2.40GHz]
CPUID 80000005: 00000000-00000000-00000000-00000000
CPUID 80000006: 00000000-00000000-0C006040-00000000
CPUID 80000007: 00000000-00000000-00000000-00000000
CPUID 80000008: 00003028-00000000-00000000-00000000

L1    Data Cache:    32 KB,  8-way Associative, 64-byte Line
L1  Instr. Cache:    32 KB,  8-way Associative, 64-byte Line
L2 Unified Cache:     3 MB, 12-way Associative, 64-byte Line
L3 Unified Cache:    12 MB, 12-way Associative, 64-byte Line

------[ Logical CPU #4 ]------

allcpu: Package 0 / Core 4 / Thread 0: Valid

CPUID 00000000: 0000000B-756E6547-6C65746E-49656E69 [GenuineIntel]
CPUID 00000001: 000106D1-04080800-000CE3BD-BFEBFBFF
CPUID 00000002: 05B0B101-4C5657F0-00000000-2CB43048
CPUID 00000003: 00000000-00000000-00000000-00000000
CPUID 00000004: 1C000121-01C0003F-0000003F-00000001 [SL 00]
CPUID 00000004: 1C000122-01C0003F-0000003F-00000001 [SL 01]
CPUID 00000004: 1C004143-02C0003F-00000FFF-00000001 [SL 02]
CPUID 00000004: 1C01C163-02C0003F-00003FFF-00000002 [SL 03]
CPUID 00000005: 00000040-00000040-00000003-00002220
CPUID 00000006: 00000001-00000002-00000001-00000000
CPUID 00000007: 00000000-00000000-00000000-00000000
CPUID 00000008: 00000400-00000000-00000000-00000000
CPUID 00000009: 00000000-00000000-00000000-00000000
CPUID 0000000A: 07280202-00000000-00000000-00000503
CPUID 0000000B: 00000000-00000001-00000100-00000004 [SL 00]
CPUID 0000000B: 00000003-00000006-00000201-00000004 [SL 01]
CPUID 80000000: 80000008-00000000-00000000-00000000
CPUID 80000001: 00000000-00000000-00000001-20100000
CPUID 80000002: 65746E49-2952286C-6F655820-2952286E [Intel(R) Xeon(R)]
CPUID 80000003: 55504320-20202020-20202020-45202020 [ CPU           E]
CPUID 80000004: 30353437-20402020-30342E32-007A4847 [7450  @ 2.40GHz]
CPUID 80000005: 00000000-00000000-00000000-00000000
CPUID 80000006: 00000000-00000000-0C006040-00000000
CPUID 80000007: 00000000-00000000-00000000-00000000
CPUID 80000008: 00003028-00000000-00000000-00000000

L1    Data Cache:    32 KB,  8-way Associative, 64-byte Line
L1  Instr. Cache:    32 KB,  8-way Associative, 64-byte Line
L2 Unified Cache:     3 MB, 12-way Associative, 64-byte Line
L3 Unified Cache:    12 MB, 12-way Associative, 64-byte Line

------[ Logical CPU #5 ]------

allcpu: Package 0 / Core 5 / Thread 0: Valid

CPUID 00000000: 0000000B-756E6547-6C65746E-49656E69 [GenuineIntel]
CPUID 00000001: 000106D1-05080800-000CE3BD-BFEBFBFF
CPUID 00000002: 05B0B101-4C5657F0-00000000-2CB43048
CPUID 00000003: 00000000-00000000-00000000-00000000
CPUID 00000004: 1C000121-01C0003F-0000003F-00000001 [SL 00]
CPUID 00000004: 1C000122-01C0003F-0000003F-00000001 [SL 01]
CPUID 00000004: 1C004143-02C0003F-00000FFF-00000001 [SL 02]
CPUID 00000004: 1C01C163-02C0003F-00003FFF-00000002 [SL 03]
CPUID 00000005: 00000040-00000040-00000003-00002220
CPUID 00000006: 00000001-00000002-00000001-00000000
CPUID 00000007: 00000000-00000000-00000000-00000000
CPUID 00000008: 00000400-00000000-00000000-00000000
CPUID 00000009: 00000000-00000000-00000000-00000000
CPUID 0000000A: 07280202-00000000-00000000-00000503
CPUID 0000000B: 00000000-00000001-00000100-00000005 [SL 00]
CPUID 0000000B: 00000003-00000006-00000201-00000005 [SL 01]
CPUID 80000000: 80000008-00000000-00000000-00000000
CPUID 80000001: 00000000-00000000-00000001-20100000
CPUID 80000002: 65746E49-2952286C-6F655820-2952286E [Intel(R) Xeon(R)]
CPUID 80000003: 55504320-20202020-20202020-45202020 [ CPU           E]
CPUID 80000004: 30353437-20402020-30342E32-007A4847 [7450  @ 2.40GHz]
CPUID 80000005: 00000000-00000000-00000000-00000000
CPUID 80000006: 00000000-00000000-0C006040-00000000
CPUID 80000007: 00000000-00000000-00000000-00000000
CPUID 80000008: 00003028-00000000-00000000-00000000

L1    Data Cache:    32 KB,  8-way Associative, 64-byte Line
L1  Instr. Cache:    32 KB,  8-way Associative, 64-byte Line
L2 Unified Cache:     3 MB, 12-way Associative, 64-byte Line
L3 Unified Cache:    12 MB, 12-way Associative, 64-byte Line

------[ Logical CPU #6 ]------

allcpu: Package 1 / Core 0 / Thread 0: Valid

CPUID 00000000: 0000000B-756E6547-6C65746E-49656E69 [GenuineIntel]
CPUID 00000001: 000106D1-08080800-000CE3BD-BFEBFBFF
CPUID 00000002: 05B0B101-4C5657F0-00000000-2CB43048
CPUID 00000003: 00000000-00000000-00000000-00000000
CPUID 00000004: 1C000121-01C0003F-0000003F-00000001 [SL 00]
CPUID 00000004: 1C000122-01C0003F-0000003F-00000001 [SL 01]
CPUID 00000004: 1C004143-02C0003F-00000FFF-00000001 [SL 02]
CPUID 00000004: 1C01C163-02C0003F-00003FFF-00000002 [SL 03]
CPUID 00000005: 00000040-00000040-00000003-00002220
CPUID 00000006: 00000001-00000002-00000001-00000000
CPUID 00000007: 00000000-00000000-00000000-00000000
CPUID 00000008: 00000400-00000000-00000000-00000000
CPUID 00000009: 00000000-00000000-00000000-00000000
CPUID 0000000A: 07280202-00000000-00000000-00000503
CPUID 0000000B: 00000000-00000001-00000100-00000008 [SL 00]
CPUID 0000000B: 00000003-00000006-00000201-00000008 [SL 01]
CPUID 80000000: 80000008-00000000-00000000-00000000
CPUID 80000001: 00000000-00000000-00000001-20100000
CPUID 80000002: 65746E49-2952286C-6F655820-2952286E [Intel(R) Xeon(R)]
CPUID 80000003: 55504320-20202020-20202020-45202020 [ CPU           E]
CPUID 80000004: 30353437-20402020-30342E32-007A4847 [7450  @ 2.40GHz]
CPUID 80000005: 00000000-00000000-00000000-00000000
CPUID 80000006: 00000000-00000000-0C006040-00000000
CPUID 80000007: 00000000-00000000-00000000-00000000
CPUID 80000008: 00003028-00000000-00000000-00000000

L1    Data Cache:    32 KB,  8-way Associative, 64-byte Line
L1  Instr. Cache:    32 KB,  8-way Associative, 64-byte Line
L2 Unified Cache:     3 MB, 12-way Associative, 64-byte Line
L3 Unified Cache:    12 MB, 12-way Associative, 64-byte Line

------[ Logical CPU #7 ]------

allcpu: Package 1 / Core 1 / Thread 0: Valid

CPUID 00000000: 0000000B-756E6547-6C65746E-49656E69 [GenuineIntel]
CPUID 00000001: 000106D1-09080800-000CE3BD-BFEBFBFF
CPUID 00000002: 05B0B101-4C5657F0-00000000-2CB43048
CPUID 00000003: 00000000-00000000-00000000-00000000
CPUID 00000004: 1C000121-01C0003F-0000003F-00000001 [SL 00]
CPUID 00000004: 1C000122-01C0003F-0000003F-00000001 [SL 01]
CPUID 00000004: 1C004143-02C0003F-00000FFF-00000001 [SL 02]
CPUID 00000004: 1C01C163-02C0003F-00003FFF-00000002 [SL 03]
CPUID 00000005: 00000040-00000040-00000003-00002220
CPUID 00000006: 00000001-00000002-00000001-00000000
CPUID 00000007: 00000000-00000000-00000000-00000000
CPUID 00000008: 00000400-00000000-00000000-00000000
CPUID 00000009: 00000000-00000000-00000000-00000000
CPUID 0000000A: 07280202-00000000-00000000-00000503
CPUID 0000000B: 00000000-00000001-00000100-00000009 [SL 00]
CPUID 0000000B: 00000003-00000006-00000201-00000009 [SL 01]
CPUID 80000000: 80000008-00000000-00000000-00000000
CPUID 80000001: 00000000-00000000-00000001-20100000
CPUID 80000002: 65746E49-2952286C-6F655820-2952286E [Intel(R) Xeon(R)]
CPUID 80000003: 55504320-20202020-20202020-45202020 [ CPU           E]
CPUID 80000004: 30353437-20402020-30342E32-007A4847 [7450  @ 2.40GHz]
CPUID 80000005: 00000000-00000000-00000000-00000000
CPUID 80000006: 00000000-00000000-0C006040-00000000
CPUID 80000007: 00000000-00000000-00000000-00000000
CPUID 80000008: 00003028-00000000-00000000-00000000

L1    Data Cache:    32 KB,  8-way Associative, 64-byte Line
L1  Instr. Cache:    32 KB,  8-way Associative, 64-byte Line
L2 Unified Cache:     3 MB, 12-way Associative, 64-byte Line
L3 Unified Cache:    12 MB, 12-way Associative, 64-byte Line

------[ Logical CPU #8 ]------

allcpu: Package 1 / Core 2 / Thread 0: Valid

CPUID 00000000: 0000000B-756E6547-6C65746E-49656E69 [GenuineIntel]
CPUID 00000001: 000106D1-0A080800-000CE3BD-BFEBFBFF
CPUID 00000002: 05B0B101-4C5657F0-00000000-2CB43048
CPUID 00000003: 00000000-00000000-00000000-00000000
CPUID 00000004: 1C000121-01C0003F-0000003F-00000001 [SL 00]
CPUID 00000004: 1C000122-01C0003F-0000003F-00000001 [SL 01]
CPUID 00000004: 1C004143-02C0003F-00000FFF-00000001 [SL 02]
CPUID 00000004: 1C01C163-02C0003F-00003FFF-00000002 [SL 03]
CPUID 00000005: 00000040-00000040-00000003-00002220
CPUID 00000006: 00000001-00000002-00000001-00000000
CPUID 00000007: 00000000-00000000-00000000-00000000
CPUID 00000008: 00000400-00000000-00000000-00000000
CPUID 00000009: 00000000-00000000-00000000-00000000
CPUID 0000000A: 07280202-00000000-00000000-00000503
CPUID 0000000B: 00000000-00000001-00000100-0000000A [SL 00]
CPUID 0000000B: 00000003-00000006-00000201-0000000A [SL 01]
CPUID 80000000: 80000008-00000000-00000000-00000000
CPUID 80000001: 00000000-00000000-00000001-20100000
CPUID 80000002: 65746E49-2952286C-6F655820-2952286E [Intel(R) Xeon(R)]
CPUID 80000003: 55504320-20202020-20202020-45202020 [ CPU           E]
CPUID 80000004: 30353437-20402020-30342E32-007A4847 [7450  @ 2.40GHz]
CPUID 80000005: 00000000-00000000-00000000-00000000
CPUID 80000006: 00000000-00000000-0C006040-00000000
CPUID 80000007: 00000000-00000000-00000000-00000000
CPUID 80000008: 00003028-00000000-00000000-00000000

L1    Data Cache:    32 KB,  8-way Associative, 64-byte Line
L1  Instr. Cache:    32 KB,  8-way Associative, 64-byte Line
L2 Unified Cache:     3 MB, 12-way Associative, 64-byte Line
L3 Unified Cache:    12 MB, 12-way Associative, 64-byte Line

------[ Logical CPU #9 ]------

allcpu: Package 1 / Core 3 / Thread 0: Valid

CPUID 00000000: 0000000B-756E6547-6C65746E-49656E69 [GenuineIntel]
CPUID 00000001: 000106D1-0B080800-000CE3BD-BFEBFBFF
CPUID 00000002: 05B0B101-4C5657F0-00000000-2CB43048
CPUID 00000003: 00000000-00000000-00000000-00000000
CPUID 00000004: 1C000121-01C0003F-0000003F-00000001 [SL 00]
CPUID 00000004: 1C000122-01C0003F-0000003F-00000001 [SL 01]
CPUID 00000004: 1C004143-02C0003F-00000FFF-00000001 [SL 02]
CPUID 00000004: 1C01C163-02C0003F-00003FFF-00000002 [SL 03]
CPUID 00000005: 00000040-00000040-00000003-00002220
CPUID 00000006: 00000001-00000002-00000001-00000000
CPUID 00000007: 00000000-00000000-00000000-00000000
CPUID 00000008: 00000400-00000000-00000000-00000000
CPUID 00000009: 00000000-00000000-00000000-00000000
CPUID 0000000A: 07280202-00000000-00000000-00000503
CPUID 0000000B: 00000000-00000001-00000100-0000000B [SL 00]
CPUID 0000000B: 00000003-00000006-00000201-0000000B [SL 01]
CPUID 80000000: 80000008-00000000-00000000-00000000
CPUID 80000001: 00000000-00000000-00000001-20100000
CPUID 80000002: 65746E49-2952286C-6F655820-2952286E [Intel(R) Xeon(R)]
CPUID 80000003: 55504320-20202020-20202020-45202020 [ CPU           E]
CPUID 80000004: 30353437-20402020-30342E32-007A4847 [7450  @ 2.40GHz]
CPUID 80000005: 00000000-00000000-00000000-00000000
CPUID 80000006: 00000000-00000000-0C006040-00000000
CPUID 80000007: 00000000-00000000-00000000-00000000
CPUID 80000008: 00003028-00000000-00000000-00000000

L1    Data Cache:    32 KB,  8-way Associative, 64-byte Line
L1  Instr. Cache:    32 KB,  8-way Associative, 64-byte Line
L2 Unified Cache:     3 MB, 12-way Associative, 64-byte Line
L3 Unified Cache:    12 MB, 12-way Associative, 64-byte Line

------[ Logical CPU #10 ]------

allcpu: Package 1 / Core 4 / Thread 0: Valid

CPUID 00000000: 0000000B-756E6547-6C65746E-49656E69 [GenuineIntel]
CPUID 00000001: 000106D1-0C080800-000CE3BD-BFEBFBFF
CPUID 00000002: 05B0B101-4C5657F0-00000000-2CB43048
CPUID 00000003: 00000000-00000000-00000000-00000000
CPUID 00000004: 1C000121-01C0003F-0000003F-00000001 [SL 00]
CPUID 00000004: 1C000122-01C0003F-0000003F-00000001 [SL 01]
CPUID 00000004: 1C004143-02C0003F-00000FFF-00000001 [SL 02]
CPUID 00000004: 1C01C163-02C0003F-00003FFF-00000002 [SL 03]
CPUID 00000005: 00000040-00000040-00000003-00002220
CPUID 00000006: 00000001-00000002-00000001-00000000
CPUID 00000007: 00000000-00000000-00000000-00000000
CPUID 00000008: 00000400-00000000-00000000-00000000
CPUID 00000009: 00000000-00000000-00000000-00000000
CPUID 0000000A: 07280202-00000000-00000000-00000503
CPUID 0000000B: 00000000-00000001-00000100-0000000C [SL 00]
CPUID 0000000B: 00000003-00000006-00000201-0000000C [SL 01]
CPUID 80000000: 80000008-00000000-00000000-00000000
CPUID 80000001: 00000000-00000000-00000001-20100000
CPUID 80000002: 65746E49-2952286C-6F655820-2952286E [Intel(R) Xeon(R)]
CPUID 80000003: 55504320-20202020-20202020-45202020 [ CPU           E]
CPUID 80000004: 30353437-20402020-30342E32-007A4847 [7450  @ 2.40GHz]
CPUID 80000005: 00000000-00000000-00000000-00000000
CPUID 80000006: 00000000-00000000-0C006040-00000000
CPUID 80000007: 00000000-00000000-00000000-00000000
CPUID 80000008: 00003028-00000000-00000000-00000000

L1    Data Cache:    32 KB,  8-way Associative, 64-byte Line
L1  Instr. Cache:    32 KB,  8-way Associative, 64-byte Line
L2 Unified Cache:     3 MB, 12-way Associative, 64-byte Line
L3 Unified Cache:    12 MB, 12-way Associative, 64-byte Line

------[ Logical CPU #11 ]------

allcpu: Package 1 / Core 5 / Thread 0: Valid

CPUID 00000000: 0000000B-756E6547-6C65746E-49656E69 [GenuineIntel]
CPUID 00000001: 000106D1-0D080800-000CE3BD-BFEBFBFF
CPUID 00000002: 05B0B101-4C5657F0-00000000-2CB43048
CPUID 00000003: 00000000-00000000-00000000-00000000
CPUID 00000004: 1C000121-01C0003F-0000003F-00000001 [SL 00]
CPUID 00000004: 1C000122-01C0003F-0000003F-00000001 [SL 01]
CPUID 00000004: 1C004143-02C0003F-00000FFF-00000001 [SL 02]
CPUID 00000004: 1C01C163-02C0003F-00003FFF-00000002 [SL 03]
CPUID 00000005: 00000040-00000040-00000003-00002220
CPUID 00000006: 00000001-00000002-00000001-00000000
CPUID 00000007: 00000000-00000000-00000000-00000000
CPUID 00000008: 00000400-00000000-00000000-00000000
CPUID 00000009: 00000000-00000000-00000000-00000000
CPUID 0000000A: 07280202-00000000-00000000-00000503
CPUID 0000000B: 00000000-00000001-00000100-0000000D [SL 00]
CPUID 0000000B: 00000003-00000006-00000201-0000000D [SL 01]
CPUID 80000000: 80000008-00000000-00000000-00000000
CPUID 80000001: 00000000-00000000-00000001-20100000
CPUID 80000002: 65746E49-2952286C-6F655820-2952286E [Intel(R) Xeon(R)]
CPUID 80000003: 55504320-20202020-20202020-45202020 [ CPU           E]
CPUID 80000004: 30353437-20402020-30342E32-007A4847 [7450  @ 2.40GHz]
CPUID 80000005: 00000000-00000000-00000000-00000000
CPUID 80000006: 00000000-00000000-0C006040-00000000
CPUID 80000007: 00000000-00000000-00000000-00000000
CPUID 80000008: 00003028-00000000-00000000-00000000

L1    Data Cache:    32 KB,  8-way Associative, 64-byte Line
L1  Instr. Cache:    32 KB,  8-way Associative, 64-byte Line
L2 Unified Cache:     3 MB, 12-way Associative, 64-byte Line
L3 Unified Cache:    12 MB, 12-way Associative, 64-byte Line

------[ Logical CPU #12 ]------

allcpu: Package 2 / Core 0 / Thread 0: Valid

CPUID 00000000: 0000000B-756E6547-6C65746E-49656E69 [GenuineIntel]
CPUID 00000001: 000106D1-10080800-000CE3BD-BFEBFBFF
CPUID 00000002: 05B0B101-4C5657F0-00000000-2CB43048
CPUID 00000003: 00000000-00000000-00000000-00000000
CPUID 00000004: 1C000121-01C0003F-0000003F-00000001 [SL 00]
CPUID 00000004: 1C000122-01C0003F-0000003F-00000001 [SL 01]
CPUID 00000004: 1C004143-02C0003F-00000FFF-00000001 [SL 02]
CPUID 00000004: 1C01C163-02C0003F-00003FFF-00000002 [SL 03]
CPUID 00000005: 00000040-00000040-00000003-00002220
CPUID 00000006: 00000001-00000002-00000001-00000000
CPUID 00000007: 00000000-00000000-00000000-00000000
CPUID 00000008: 00000400-00000000-00000000-00000000
CPUID 00000009: 00000000-00000000-00000000-00000000
CPUID 0000000A: 07280202-00000000-00000000-00000503
CPUID 0000000B: 00000000-00000001-00000100-00000010 [SL 00]
CPUID 0000000B: 00000003-00000006-00000201-00000010 [SL 01]
CPUID 80000000: 80000008-00000000-00000000-00000000
CPUID 80000001: 00000000-00000000-00000001-20100000
CPUID 80000002: 65746E49-2952286C-6F655820-2952286E [Intel(R) Xeon(R)]
CPUID 80000003: 55504320-20202020-20202020-45202020 [ CPU           E]
CPUID 80000004: 30353437-20402020-30342E32-007A4847 [7450  @ 2.40GHz]
CPUID 80000005: 00000000-00000000-00000000-00000000
CPUID 80000006: 00000000-00000000-0C006040-00000000
CPUID 80000007: 00000000-00000000-00000000-00000000
CPUID 80000008: 00003028-00000000-00000000-00000000

L1    Data Cache:    32 KB,  8-way Associative, 64-byte Line
L1  Instr. Cache:    32 KB,  8-way Associative, 64-byte Line
L2 Unified Cache:     3 MB, 12-way Associative, 64-byte Line
L3 Unified Cache:    12 MB, 12-way Associative, 64-byte Line

------[ Logical CPU #13 ]------

allcpu: Package 2 / Core 1 / Thread 0: Valid

CPUID 00000000: 0000000B-756E6547-6C65746E-49656E69 [GenuineIntel]
CPUID 00000001: 000106D1-11080800-000CE3BD-BFEBFBFF
CPUID 00000002: 05B0B101-4C5657F0-00000000-2CB43048
CPUID 00000003: 00000000-00000000-00000000-00000000
CPUID 00000004: 1C000121-01C0003F-0000003F-00000001 [SL 00]
CPUID 00000004: 1C000122-01C0003F-0000003F-00000001 [SL 01]
CPUID 00000004: 1C004143-02C0003F-00000FFF-00000001 [SL 02]
CPUID 00000004: 1C01C163-02C0003F-00003FFF-00000002 [SL 03]
CPUID 00000005: 00000040-00000040-00000003-00002220
CPUID 00000006: 00000001-00000002-00000001-00000000
CPUID 00000007: 00000000-00000000-00000000-00000000
CPUID 00000008: 00000400-00000000-00000000-00000000
CPUID 00000009: 00000000-00000000-00000000-00000000
CPUID 0000000A: 07280202-00000000-00000000-00000503
CPUID 0000000B: 00000000-00000001-00000100-00000011 [SL 00]
CPUID 0000000B: 00000003-00000006-00000201-00000011 [SL 01]
CPUID 80000000: 80000008-00000000-00000000-00000000
CPUID 80000001: 00000000-00000000-00000001-20100000
CPUID 80000002: 65746E49-2952286C-6F655820-2952286E [Intel(R) Xeon(R)]
CPUID 80000003: 55504320-20202020-20202020-45202020 [ CPU           E]
CPUID 80000004: 30353437-20402020-30342E32-007A4847 [7450  @ 2.40GHz]
CPUID 80000005: 00000000-00000000-00000000-00000000
CPUID 80000006: 00000000-00000000-0C006040-00000000
CPUID 80000007: 00000000-00000000-00000000-00000000
CPUID 80000008: 00003028-00000000-00000000-00000000

L1    Data Cache:    32 KB,  8-way Associative, 64-byte Line
L1  Instr. Cache:    32 KB,  8-way Associative, 64-byte Line
L2 Unified Cache:     3 MB, 12-way Associative, 64-byte Line
L3 Unified Cache:    12 MB, 12-way Associative, 64-byte Line

------[ Logical CPU #14 ]------

allcpu: Package 2 / Core 2 / Thread 0: Valid

CPUID 00000000: 0000000B-756E6547-6C65746E-49656E69 [GenuineIntel]
CPUID 00000001: 000106D1-12080800-000CE3BD-BFEBFBFF
CPUID 00000002: 05B0B101-4C5657F0-00000000-2CB43048
CPUID 00000003: 00000000-00000000-00000000-00000000
CPUID 00000004: 1C000121-01C0003F-0000003F-00000001 [SL 00]
CPUID 00000004: 1C000122-01C0003F-0000003F-00000001 [SL 01]
CPUID 00000004: 1C004143-02C0003F-00000FFF-00000001 [SL 02]
CPUID 00000004: 1C01C163-02C0003F-00003FFF-00000002 [SL 03]
CPUID 00000005: 00000040-00000040-00000003-00002220
CPUID 00000006: 00000001-00000002-00000001-00000000
CPUID 00000007: 00000000-00000000-00000000-00000000
CPUID 00000008: 00000400-00000000-00000000-00000000
CPUID 00000009: 00000000-00000000-00000000-00000000
CPUID 0000000A: 07280202-00000000-00000000-00000503
CPUID 0000000B: 00000000-00000001-00000100-00000012 [SL 00]
CPUID 0000000B: 00000003-00000006-00000201-00000012 [SL 01]
CPUID 80000000: 80000008-00000000-00000000-00000000
CPUID 80000001: 00000000-00000000-00000001-20100000
CPUID 80000002: 65746E49-2952286C-6F655820-2952286E [Intel(R) Xeon(R)]
CPUID 80000003: 55504320-20202020-20202020-45202020 [ CPU           E]
CPUID 80000004: 30353437-20402020-30342E32-007A4847 [7450  @ 2.40GHz]
CPUID 80000005: 00000000-00000000-00000000-00000000
CPUID 80000006: 00000000-00000000-0C006040-00000000
CPUID 80000007: 00000000-00000000-00000000-00000000
CPUID 80000008: 00003028-00000000-00000000-00000000

L1    Data Cache:    32 KB,  8-way Associative, 64-byte Line
L1  Instr. Cache:    32 KB,  8-way Associative, 64-byte Line
L2 Unified Cache:     3 MB, 12-way Associative, 64-byte Line
L3 Unified Cache:    12 MB, 12-way Associative, 64-byte Line

------[ Logical CPU #15 ]------

allcpu: Package 2 / Core 3 / Thread 0: Valid

CPUID 00000000: 0000000B-756E6547-6C65746E-49656E69 [GenuineIntel]
CPUID 00000001: 000106D1-13080800-000CE3BD-BFEBFBFF
CPUID 00000002: 05B0B101-4C5657F0-00000000-2CB43048
CPUID 00000003: 00000000-00000000-00000000-00000000
CPUID 00000004: 1C000121-01C0003F-0000003F-00000001 [SL 00]
CPUID 00000004: 1C000122-01C0003F-0000003F-00000001 [SL 01]
CPUID 00000004: 1C004143-02C0003F-00000FFF-00000001 [SL 02]
CPUID 00000004: 1C01C163-02C0003F-00003FFF-00000002 [SL 03]
CPUID 00000005: 00000040-00000040-00000003-00002220
CPUID 00000006: 00000001-00000002-00000001-00000000
CPUID 00000007: 00000000-00000000-00000000-00000000
CPUID 00000008: 00000400-00000000-00000000-00000000
CPUID 00000009: 00000000-00000000-00000000-00000000
CPUID 0000000A: 07280202-00000000-00000000-00000503
CPUID 0000000B: 00000000-00000001-00000100-00000013 [SL 00]
CPUID 0000000B: 00000003-00000006-00000201-00000013 [SL 01]
CPUID 80000000: 80000008-00000000-00000000-00000000
CPUID 80000001: 00000000-00000000-00000001-20100000
CPUID 80000002: 65746E49-2952286C-6F655820-2952286E [Intel(R) Xeon(R)]
CPUID 80000003: 55504320-20202020-20202020-45202020 [ CPU           E]
CPUID 80000004: 30353437-20402020-30342E32-007A4847 [7450  @ 2.40GHz]
CPUID 80000005: 00000000-00000000-00000000-00000000
CPUID 80000006: 00000000-00000000-0C006040-00000000
CPUID 80000007: 00000000-00000000-00000000-00000000
CPUID 80000008: 00003028-00000000-00000000-00000000

L1    Data Cache:    32 KB,  8-way Associative, 64-byte Line
L1  Instr. Cache:    32 KB,  8-way Associative, 64-byte Line
L2 Unified Cache:     3 MB, 12-way Associative, 64-byte Line
L3 Unified Cache:    12 MB, 12-way Associative, 64-byte Line

------[ Logical CPU #16 ]------

allcpu: Package 2 / Core 4 / Thread 0: Valid

CPUID 00000000: 0000000B-756E6547-6C65746E-49656E69 [GenuineIntel]
CPUID 00000001: 000106D1-14080800-000CE3BD-BFEBFBFF
CPUID 00000002: 05B0B101-4C5657F0-00000000-2CB43048
CPUID 00000003: 00000000-00000000-00000000-00000000
CPUID 00000004: 1C000121-01C0003F-0000003F-00000001 [SL 00]
CPUID 00000004: 1C000122-01C0003F-0000003F-00000001 [SL 01]
CPUID 00000004: 1C004143-02C0003F-00000FFF-00000001 [SL 02]
CPUID 00000004: 1C01C163-02C0003F-00003FFF-00000002 [SL 03]
CPUID 00000005: 00000040-00000040-00000003-00002220
CPUID 00000006: 00000001-00000002-00000001-00000000
CPUID 00000007: 00000000-00000000-00000000-00000000
CPUID 00000008: 00000400-00000000-00000000-00000000
CPUID 00000009: 00000000-00000000-00000000-00000000
CPUID 0000000A: 07280202-00000000-00000000-00000503
CPUID 0000000B: 00000000-00000001-00000100-00000014 [SL 00]
CPUID 0000000B: 00000003-00000006-00000201-00000014 [SL 01]
CPUID 80000000: 80000008-00000000-00000000-00000000
CPUID 80000001: 00000000-00000000-00000001-20100000
CPUID 80000002: 65746E49-2952286C-6F655820-2952286E [Intel(R) Xeon(R)]
CPUID 80000003: 55504320-20202020-20202020-45202020 [ CPU           E]
CPUID 80000004: 30353437-20402020-30342E32-007A4847 [7450  @ 2.40GHz]
CPUID 80000005: 00000000-00000000-00000000-00000000
CPUID 80000006: 00000000-00000000-0C006040-00000000
CPUID 80000007: 00000000-00000000-00000000-00000000
CPUID 80000008: 00003028-00000000-00000000-00000000

L1    Data Cache:    32 KB,  8-way Associative, 64-byte Line
L1  Instr. Cache:    32 KB,  8-way Associative, 64-byte Line
L2 Unified Cache:     3 MB, 12-way Associative, 64-byte Line
L3 Unified Cache:    12 MB, 12-way Associative, 64-byte Line

------[ Logical CPU #17 ]------

allcpu: Package 2 / Core 5 / Thread 0: Valid

CPUID 00000000: 0000000B-756E6547-6C65746E-49656E69 [GenuineIntel]
CPUID 00000001: 000106D1-15080800-000CE3BD-BFEBFBFF
CPUID 00000002: 05B0B101-4C5657F0-00000000-2CB43048
CPUID 00000003: 00000000-00000000-00000000-00000000
CPUID 00000004: 1C000121-01C0003F-0000003F-00000001 [SL 00]
CPUID 00000004: 1C000122-01C0003F-0000003F-00000001 [SL 01]
CPUID 00000004: 1C004143-02C0003F-00000FFF-00000001 [SL 02]
CPUID 00000004: 1C01C163-02C0003F-00003FFF-00000002 [SL 03]
CPUID 00000005: 00000040-00000040-00000003-00002220
CPUID 00000006: 00000001-00000002-00000001-00000000
CPUID 00000007: 00000000-00000000-00000000-00000000
CPUID 00000008: 00000400-00000000-00000000-00000000
CPUID 00000009: 00000000-00000000-00000000-00000000
CPUID 0000000A: 07280202-00000000-00000000-00000503
CPUID 0000000B: 00000000-00000001-00000100-00000015 [SL 00]
CPUID 0000000B: 00000003-00000006-00000201-00000015 [SL 01]
CPUID 80000000: 80000008-00000000-00000000-00000000
CPUID 80000001: 00000000-00000000-00000001-20100000
CPUID 80000002: 65746E49-2952286C-6F655820-2952286E [Intel(R) Xeon(R)]
CPUID 80000003: 55504320-20202020-20202020-45202020 [ CPU           E]
CPUID 80000004: 30353437-20402020-30342E32-007A4847 [7450  @ 2.40GHz]
CPUID 80000005: 00000000-00000000-00000000-00000000
CPUID 80000006: 00000000-00000000-0C006040-00000000
CPUID 80000007: 00000000-00000000-00000000-00000000
CPUID 80000008: 00003028-00000000-00000000-00000000

L1    Data Cache:    32 KB,  8-way Associative, 64-byte Line
L1  Instr. Cache:    32 KB,  8-way Associative, 64-byte Line
L2 Unified Cache:     3 MB, 12-way Associative, 64-byte Line
L3 Unified Cache:    12 MB, 12-way Associative, 64-byte Line

------[ Logical CPU #18 ]------

allcpu: Package 3 / Core 0 / Thread 0: Valid

CPUID 00000000: 0000000B-756E6547-6C65746E-49656E69 [GenuineIntel]
CPUID 00000001: 000106D1-18080800-000CE3BD-BFEBFBFF
CPUID 00000002: 05B0B101-4C5657F0-00000000-2CB43048
CPUID 00000003: 00000000-00000000-00000000-00000000
CPUID 00000004: 1C000121-01C0003F-0000003F-00000001 [SL 00]
CPUID 00000004: 1C000122-01C0003F-0000003F-00000001 [SL 01]
CPUID 00000004: 1C004143-02C0003F-00000FFF-00000001 [SL 02]
CPUID 00000004: 1C01C163-02C0003F-00003FFF-00000002 [SL 03]
CPUID 00000005: 00000040-00000040-00000003-00002220
CPUID 00000006: 00000001-00000002-00000001-00000000
CPUID 00000007: 00000000-00000000-00000000-00000000
CPUID 00000008: 00000400-00000000-00000000-00000000
CPUID 00000009: 00000000-00000000-00000000-00000000
CPUID 0000000A: 07280202-00000000-00000000-00000503
CPUID 0000000B: 00000000-00000001-00000100-00000018 [SL 00]
CPUID 0000000B: 00000003-00000006-00000201-00000018 [SL 01]
CPUID 80000000: 80000008-00000000-00000000-00000000
CPUID 80000001: 00000000-00000000-00000001-20100000
CPUID 80000002: 65746E49-2952286C-6F655820-2952286E [Intel(R) Xeon(R)]
CPUID 80000003: 55504320-20202020-20202020-45202020 [ CPU           E]
CPUID 80000004: 30353437-20402020-30342E32-007A4847 [7450  @ 2.40GHz]
CPUID 80000005: 00000000-00000000-00000000-00000000
CPUID 80000006: 00000000-00000000-0C006040-00000000
CPUID 80000007: 00000000-00000000-00000000-00000000
CPUID 80000008: 00003028-00000000-00000000-00000000

L1    Data Cache:    32 KB,  8-way Associative, 64-byte Line
L1  Instr. Cache:    32 KB,  8-way Associative, 64-byte Line
L2 Unified Cache:     3 MB, 12-way Associative, 64-byte Line
L3 Unified Cache:    12 MB, 12-way Associative, 64-byte Line

------[ Logical CPU #19 ]------

allcpu: Package 3 / Core 1 / Thread 0: Valid

CPUID 00000000: 0000000B-756E6547-6C65746E-49656E69 [GenuineIntel]
CPUID 00000001: 000106D1-19080800-000CE3BD-BFEBFBFF
CPUID 00000002: 05B0B101-4C5657F0-00000000-2CB43048
CPUID 00000003: 00000000-00000000-00000000-00000000
CPUID 00000004: 1C000121-01C0003F-0000003F-00000001 [SL 00]
CPUID 00000004: 1C000122-01C0003F-0000003F-00000001 [SL 01]
CPUID 00000004: 1C004143-02C0003F-00000FFF-00000001 [SL 02]
CPUID 00000004: 1C01C163-02C0003F-00003FFF-00000002 [SL 03]
CPUID 00000005: 00000040-00000040-00000003-00002220
CPUID 00000006: 00000001-00000002-00000001-00000000
CPUID 00000007: 00000000-00000000-00000000-00000000
CPUID 00000008: 00000400-00000000-00000000-00000000
CPUID 00000009: 00000000-00000000-00000000-00000000
CPUID 0000000A: 07280202-00000000-00000000-00000503
CPUID 0000000B: 00000000-00000001-00000100-00000019 [SL 00]
CPUID 0000000B: 00000003-00000006-00000201-00000019 [SL 01]
CPUID 80000000: 80000008-00000000-00000000-00000000
CPUID 80000001: 00000000-00000000-00000001-20100000
CPUID 80000002: 65746E49-2952286C-6F655820-2952286E [Intel(R) Xeon(R)]
CPUID 80000003: 55504320-20202020-20202020-45202020 [ CPU           E]
CPUID 80000004: 30353437-20402020-30342E32-007A4847 [7450  @ 2.40GHz]
CPUID 80000005: 00000000-00000000-00000000-00000000
CPUID 80000006: 00000000-00000000-0C006040-00000000
CPUID 80000007: 00000000-00000000-00000000-00000000
CPUID 80000008: 00003028-00000000-00000000-00000000

L1    Data Cache:    32 KB,  8-way Associative, 64-byte Line
L1  Instr. Cache:    32 KB,  8-way Associative, 64-byte Line
L2 Unified Cache:     3 MB, 12-way Associative, 64-byte Line
L3 Unified Cache:    12 MB, 12-way Associative, 64-byte Line

------[ Logical CPU #20 ]------

allcpu: Package 3 / Core 2 / Thread 0: Valid

CPUID 00000000: 0000000B-756E6547-6C65746E-49656E69 [GenuineIntel]
CPUID 00000001: 000106D1-1A080800-000CE3BD-BFEBFBFF
CPUID 00000002: 05B0B101-4C5657F0-00000000-2CB43048
CPUID 00000003: 00000000-00000000-00000000-00000000
CPUID 00000004: 1C000121-01C0003F-0000003F-00000001 [SL 00]
CPUID 00000004: 1C000122-01C0003F-0000003F-00000001 [SL 01]
CPUID 00000004: 1C004143-02C0003F-00000FFF-00000001 [SL 02]
CPUID 00000004: 1C01C163-02C0003F-00003FFF-00000002 [SL 03]
CPUID 00000005: 00000040-00000040-00000003-00002220
CPUID 00000006: 00000001-00000002-00000001-00000000
CPUID 00000007: 00000000-00000000-00000000-00000000
CPUID 00000008: 00000400-00000000-00000000-00000000
CPUID 00000009: 00000000-00000000-00000000-00000000
CPUID 0000000A: 07280202-00000000-00000000-00000503
CPUID 0000000B: 00000000-00000001-00000100-0000001A [SL 00]
CPUID 0000000B: 00000003-00000006-00000201-0000001A [SL 01]
CPUID 80000000: 80000008-00000000-00000000-00000000
CPUID 80000001: 00000000-00000000-00000001-20100000
CPUID 80000002: 65746E49-2952286C-6F655820-2952286E [Intel(R) Xeon(R)]
CPUID 80000003: 55504320-20202020-20202020-45202020 [ CPU           E]
CPUID 80000004: 30353437-20402020-30342E32-007A4847 [7450  @ 2.40GHz]
CPUID 80000005: 00000000-00000000-00000000-00000000
CPUID 80000006: 00000000-00000000-0C006040-00000000
CPUID 80000007: 00000000-00000000-00000000-00000000
CPUID 80000008: 00003028-00000000-00000000-00000000

L1    Data Cache:    32 KB,  8-way Associative, 64-byte Line
L1  Instr. Cache:    32 KB,  8-way Associative, 64-byte Line
L2 Unified Cache:     3 MB, 12-way Associative, 64-byte Line
L3 Unified Cache:    12 MB, 12-way Associative, 64-byte Line

------[ Logical CPU #21 ]------

allcpu: Package 3 / Core 3 / Thread 0: Valid

CPUID 00000000: 0000000B-756E6547-6C65746E-49656E69 [GenuineIntel]
CPUID 00000001: 000106D1-1B080800-000CE3BD-BFEBFBFF
CPUID 00000002: 05B0B101-4C5657F0-00000000-2CB43048
CPUID 00000003: 00000000-00000000-00000000-00000000
CPUID 00000004: 1C000121-01C0003F-0000003F-00000001 [SL 00]
CPUID 00000004: 1C000122-01C0003F-0000003F-00000001 [SL 01]
CPUID 00000004: 1C004143-02C0003F-00000FFF-00000001 [SL 02]
CPUID 00000004: 1C01C163-02C0003F-00003FFF-00000002 [SL 03]
CPUID 00000005: 00000040-00000040-00000003-00002220
CPUID 00000006: 00000001-00000002-00000001-00000000
CPUID 00000007: 00000000-00000000-00000000-00000000
CPUID 00000008: 00000400-00000000-00000000-00000000
CPUID 00000009: 00000000-00000000-00000000-00000000
CPUID 0000000A: 07280202-00000000-00000000-00000503
CPUID 0000000B: 00000000-00000001-00000100-0000001B [SL 00]
CPUID 0000000B: 00000003-00000006-00000201-0000001B [SL 01]
CPUID 80000000: 80000008-00000000-00000000-00000000
CPUID 80000001: 00000000-00000000-00000001-20100000
CPUID 80000002: 65746E49-2952286C-6F655820-2952286E [Intel(R) Xeon(R)]
CPUID 80000003: 55504320-20202020-20202020-45202020 [ CPU           E]
CPUID 80000004: 30353437-20402020-30342E32-007A4847 [7450  @ 2.40GHz]
CPUID 80000005: 00000000-00000000-00000000-00000000
CPUID 80000006: 00000000-00000000-0C006040-00000000
CPUID 80000007: 00000000-00000000-00000000-00000000
CPUID 80000008: 00003028-00000000-00000000-00000000

L1    Data Cache:    32 KB,  8-way Associative, 64-byte Line
L1  Instr. Cache:    32 KB,  8-way Associative, 64-byte Line
L2 Unified Cache:     3 MB, 12-way Associative, 64-byte Line
L3 Unified Cache:    12 MB, 12-way Associative, 64-byte Line

------[ Logical CPU #22 ]------

allcpu: Package 3 / Core 4 / Thread 0: Valid

CPUID 00000000: 0000000B-756E6547-6C65746E-49656E69 [GenuineIntel]
CPUID 00000001: 000106D1-1C080800-000CE3BD-BFEBFBFF
CPUID 00000002: 05B0B101-4C5657F0-00000000-2CB43048
CPUID 00000003: 00000000-00000000-00000000-00000000
CPUID 00000004: 1C000121-01C0003F-0000003F-00000001 [SL 00]
CPUID 00000004: 1C000122-01C0003F-0000003F-00000001 [SL 01]
CPUID 00000004: 1C004143-02C0003F-00000FFF-00000001 [SL 02]
CPUID 00000004: 1C01C163-02C0003F-00003FFF-00000002 [SL 03]
CPUID 00000005: 00000040-00000040-00000003-00002220
CPUID 00000006: 00000001-00000002-00000001-00000000
CPUID 00000007: 00000000-00000000-00000000-00000000
CPUID 00000008: 00000400-00000000-00000000-00000000
CPUID 00000009: 00000000-00000000-00000000-00000000
CPUID 0000000A: 07280202-00000000-00000000-00000503
CPUID 0000000B: 00000000-00000001-00000100-0000001C [SL 00]
CPUID 0000000B: 00000003-00000006-00000201-0000001C [SL 01]
CPUID 80000000: 80000008-00000000-00000000-00000000
CPUID 80000001: 00000000-00000000-00000001-20100000
CPUID 80000002: 65746E49-2952286C-6F655820-2952286E [Intel(R) Xeon(R)]
CPUID 80000003: 55504320-20202020-20202020-45202020 [ CPU           E]
CPUID 80000004: 30353437-20402020-30342E32-007A4847 [7450  @ 2.40GHz]
CPUID 80000005: 00000000-00000000-00000000-00000000
CPUID 80000006: 00000000-00000000-0C006040-00000000
CPUID 80000007: 00000000-00000000-00000000-00000000
CPUID 80000008: 00003028-00000000-00000000-00000000

L1    Data Cache:    32 KB,  8-way Associative, 64-byte Line
L1  Instr. Cache:    32 KB,  8-way Associative, 64-byte Line
L2 Unified Cache:     3 MB, 12-way Associative, 64-byte Line
L3 Unified Cache:    12 MB, 12-way Associative, 64-byte Line

------[ Logical CPU #23 ]------

allcpu: Package 3 / Core 5 / Thread 0: Valid

CPUID 00000000: 0000000B-756E6547-6C65746E-49656E69 [GenuineIntel]
CPUID 00000001: 000106D1-1D080800-000CE3BD-BFEBFBFF
CPUID 00000002: 05B0B101-4C5657F0-00000000-2CB43048
CPUID 00000003: 00000000-00000000-00000000-00000000
CPUID 00000004: 1C000121-01C0003F-0000003F-00000001 [SL 00]
CPUID 00000004: 1C000122-01C0003F-0000003F-00000001 [SL 01]
CPUID 00000004: 1C004143-02C0003F-00000FFF-00000001 [SL 02]
CPUID 00000004: 1C01C163-02C0003F-00003FFF-00000002 [SL 03]
CPUID 00000005: 00000040-00000040-00000003-00002220
CPUID 00000006: 00000001-00000002-00000001-00000000
CPUID 00000007: 00000000-00000000-00000000-00000000
CPUID 00000008: 00000400-00000000-00000000-00000000
CPUID 00000009: 00000000-00000000-00000000-00000000
CPUID 0000000A: 07280202-00000000-00000000-00000503
CPUID 0000000B: 00000000-00000001-00000100-0000001D [SL 00]
CPUID 0000000B: 00000003-00000006-00000201-0000001D [SL 01]
CPUID 80000000: 80000008-00000000-00000000-00000000
CPUID 80000001: 00000000-00000000-00000001-20100000
CPUID 80000002: 65746E49-2952286C-6F655820-2952286E [Intel(R) Xeon(R)]
CPUID 80000003: 55504320-20202020-20202020-45202020 [ CPU           E]
CPUID 80000004: 30353437-20402020-30342E32-007A4847 [7450  @ 2.40GHz]
CPUID 80000005: 00000000-00000000-00000000-00000000
CPUID 80000006: 00000000-00000000-0C006040-00000000
CPUID 80000007: 00000000-00000000-00000000-00000000
CPUID 80000008: 00003028-00000000-00000000-00000000

L1    Data Cache:    32 KB,  8-way Associative, 64-byte Line
L1  Instr. Cache:    32 KB,  8-way Associative, 64-byte Line
L2 Unified Cache:     3 MB, 12-way Associative, 64-byte Line
L3 Unified Cache:    12 MB, 12-way Associative, 64-byte Line

------[ All CPUs ]------

CPU   0: APICID   0 / Package 0 / Core  0 / Thread 0: Valid
CPU   1: APICID   1 / Package 0 / Core  1 / Thread 0: Valid
CPU   2: APICID   2 / Package 0 / Core  2 / Thread 0: Valid
CPU   3: APICID   3 / Package 0 / Core  3 / Thread 0: Valid
CPU   4: APICID   4 / Package 0 / Core  4 / Thread 0: Valid
CPU   5: APICID   5 / Package 0 / Core  5 / Thread 0: Valid
CPU   6: APICID   8 / Package 1 / Core  0 / Thread 0: Valid
CPU   7: APICID   9 / Package 1 / Core  1 / Thread 0: Valid
CPU   8: APICID  10 / Package 1 / Core  2 / Thread 0: Valid
CPU   9: APICID  11 / Package 1 / Core  3 / Thread 0: Valid
CPU  10: APICID  12 / Package 1 / Core  4 / Thread 0: Valid
CPU  11: APICID  13 / Package 1 / Core  5 / Thread 0: Valid
CPU  12: APICID  16 / Package 2 / Core  0 / Thread 0: Valid
CPU  13: APICID  17 / Package 2 / Core  1 / Thread 0: Valid
CPU  14: APICID  18 / Package 2 / Core  2 / Thread 0: Valid
CPU  15: APICID  19 / Package 2 / Core  3 / Thread 0: Valid
CPU  16: APICID  20 / Package 2 / Core  4 / Thread 0: Valid
CPU  17: APICID  21 / Package 2 / Core  5 / Thread 0: Valid
CPU  18: APICID  24 / Package 3 / Core  0 / Thread 0: Valid
CPU  19: APICID  25 / Package 3 / Core  1 / Thread 0: Valid
CPU  20: APICID  26 / Package 3 / Core  2 / Thread 0: Valid
CPU  21: APICID  27 / Package 3 / Core  3 / Thread 0: Valid
CPU  22: APICID  28 / Package 3 / Core  4 / Thread 0: Valid
CPU  23: APICID  29 / Package 3 / Core  5 / Thread 0: Valid

------[ MSR Registers ]------

MSR 00000017: 000C-0000-8834-091F [PlatID = 3]
MSR 0000001B: 0000-0000-FEE0-0900
MSR 0000002A: 0000-0000-C248-1400
MSR 0000008B: 0000-0026-0000-0000
MSR 000000CD: 0000-0000-0000-0808
MSR 000000CE: 001A-091F-0000-0715
MSR 000000E7: 0000-00B9-0181-5E17 [S200]
MSR 000000E7: 0000-00B9-02D9-19E7 [S200]
MSR 000000E7: 0000-00B9-02E4-7B05
MSR 000000E8: 0000-00EC-AD04-6846 [S200]
MSR 000000E8: 0000-00EC-AD09-D536 [S200]
MSR 000000E8: 0000-00EC-AD30-604D
MSR 000000EE: 0100-0000-8778-4101
MSR 0000011E: 0000-0000-BE70-2119
MSR 00000198: 091F-091F-0830-081F [S200]
MSR 00000198: 091F-091F-0830-081F [S200]
MSR 00000198: 091F-091F-0832-081F
MSR 00000199: 0000-0000-0000-091F
MSR 0000019A: 0000-0000-0000-0002
MSR 0000019B: 0000-0000-0000-0000
MSR 0000019C: 0000-0000-8840-0000 [S200]
MSR 0000019C: 0000-0000-8840-0000 [S200]
MSR 0000019C: 0000-0000-8840-0000
MSR 0000019D: 0000-0000-0000-081A
MSR 000001A0: 0000-0040-62B5-2489
MSR 00000480: 005A-0800-0000-000D
MSR 00000481: 0000-003F-0000-0016
MSR 00000482: F7F9-FFFE-0401-E172
MSR 00000483: 0003-FFFF-0003-6DFF
MSR 00000484: 0000-3FFF-0000-11FF
MSR 00000485: 0000-0000-0004-03C0
MSR 00000486: 0000-0000-8000-0021
MSR 00000487: 0000-0000-FFFF-FFFF
MSR 00000488: 0000-0000-0000-2000
MSR 00000489: 0000-0000-0000-27FF
MSR 0000048A: 0000-0000-0000-002C
MSR 0000048B: 0000-0041-0000-0000
