------[ Versions ]------

Program Version : AIDA64 Engineer v5.92.4329 Beta
BenchDLL Version: 4.3.759-x64
Windows Version : Microsoft Windows 10 Pro 10.0.15063.502 (64-bit)

------[ CPU Info ]------

CPU Type          : HexaCore Intel Core i7-7800X, 3500 MHz (35 x 100)
CPU Alias         : Skylake-X
CPU Platform      : LGA2066
CPU Stepping      : U0
Instruction Set   : x86, x86-64, MMX, SSE, SSE2, SSE3, SSSE3, SSE4.1, SSE4.2, AVX, AVX2, AVX-512, FMA, AES
CPUID Manufacturer: GenuineIntel
CPUID CPU Name    : Intel(R) Core(TM) i7-7800X CPU @ 3.50GHz
CPUID Revision    : 00050654h
IA Brand ID       : 00h  (Unknown)
Platform ID       : 4Fh  (LGA2066)
HTT / CMP Units   : 2 / 6
Max. NUMA Node    : 0

Tjmax Temperature          : 100 Celsius
HTC Temperature Limit      : 0 Celsius
CPU TDP                    : 122 W
DRAM TDP                   : 19.5 W
CPU TDC                    : 1023 A
CPU Max Power Limit        : 308 W / Unlimited Time
CPU Power Limit 1 (Long)   : 3408.3 W / 8.00 sec  (Unlocked)
CPU Power Limit 2 (Short)  : 4090 W / 2.44 ms  (Unlocked)
Max Turbo Boost Multipliers: 2C: 40x, 4C: 40x, 6C: 40x

------[ Motherboard Info ]------

Motherboard ID      : <DMI>
Motherboard Model   : Gigabyte GA-X299 UD4
Motherboard Chipset : Intel Union Point X299, Intel Skylake-X

DMI MB Manufacturer : Gigabyte Technology Co., Ltd.
DMI MB Product      : X299 UD4-CF
DMI MB Version      : x.x
DMI MB Serial       : Default string
DMI SYS Manufacturer: Gigabyte Technology Co., Ltd.
DMI SYS Product     : X299 UD4
DMI SYS Version     : Default string
DMI SYS Serial      : Default string
DMI BIOS Version    : F4d


------[ Logical CPU #0 ]------

allcpu: Package 0 / Core 0 / Thread 0: Valid

CPUID 00000000: 00000016-756E6547-6C65746E-49656E69 [GenuineIntel]
CPUID 00000001: 00050654-00100800-7FFEFBBF-BFEBFBFF
CPUID 00000002: 76036301-00F0B5FF-00000000-00C30000
CPUID 00000003: 00000000-00000000-00000000-00000000
CPUID 00000004: 1C004121-01C0003F-0000003F-00000000 [SL 00]
CPUID 00000004: 1C004122-01C0003F-0000003F-00000000 [SL 01]
CPUID 00000004: 1C004143-03C0003F-000003FF-00000000 [SL 02]
CPUID 00000004: 1C03C163-0280003F-00002FFF-00000004 [SL 03]
CPUID 00000005: 00000040-00000040-00000003-00002020
CPUID 00000006: 00000075-00000002-00000009-00000000
CPUID 00000007: 00000000-D39FFFFB-00000000-00000000
CPUID 00000008: 00000000-00000000-00000000-00000000
CPUID 00000009: 00000000-00000000-00000000-00000000
CPUID 0000000A: 07300404-00000000-00000000-00000603
CPUID 0000000B: 00000001-00000002-00000100-00000000 [SL 00]
CPUID 0000000B: 00000004-0000000C-00000201-00000000 [SL 01]
CPUID 0000000C: 00000000-00000000-00000000-00000000
CPUID 0000000D: 000000FF-00000A80-00000A80-00000000 [SL 00]
CPUID 0000000D: 0000000F-00000A00-00000100-00000000 [SL 01]
CPUID 0000000D: 00000100-00000240-00000000-00000000 [SL 02]
CPUID 0000000D: 00000040-000003C0-00000000-00000000 [SL 03]
CPUID 0000000D: 00000040-00000400-00000000-00000000 [SL 04]
CPUID 0000000D: 00000040-00000440-00000000-00000000 [SL 05]
CPUID 0000000D: 00000200-00000480-00000000-00000000 [SL 06]
CPUID 0000000D: 00000400-00000680-00000000-00000000 [SL 07]
CPUID 0000000D: 00000080-00000000-00000001-00000000 [SL 08]
CPUID 0000000E: 00000000-00000000-00000000-00000000
CPUID 0000000F: 00000000-0000002F-00000000-00000002 [SL 00]
CPUID 0000000F: 00000000-00006000-0000002F-00000007 [SL 01]
CPUID 00000010: 00000000-0000000A-00000000-00000000 [SL 00]
CPUID 00000010: 0000000A-00000600-00000004-0000000F [SL 01]
CPUID 00000011: 00000000-00000000-00000000-00000000
CPUID 00000012: 00000000-00000000-00000000-00000000 [SL 00]
CPUID 00000012: 00000000-00000000-00000000-00000000 [SL 01]
CPUID 00000013: 00000000-00000000-00000000-00000000
CPUID 00000014: 00000001-0000000F-00000007-00000000 [SL 00]
CPUID 00000014: 02490002-003F3FFF-00000000-00000000 [SL 01]
CPUID 00000015: 00000002-00000124-00000000-00000000 [146.00x / 0]
CPUID 00000016: 00000DAC-00000FA0-00000064-00000000 [3500 / 4000 / 100]
CPUID 80000000: 80000008-00000000-00000000-00000000
CPUID 80000001: 00000000-00000000-00000121-2C100000
CPUID 80000002: 65746E49-2952286C-726F4320-4D542865 [Intel(R) Core(TM]
CPUID 80000003: 37692029-3038372D-43205830-40205550 [) i7-7800X CPU @]
CPUID 80000004: 352E3320-7A484730-00000000-00000000 [ 3.50GHz]
CPUID 80000005: 00000000-00000000-00000000-00000000
CPUID 80000006: 00000000-00000000-01006040-00000000
CPUID 80000007: 00000000-00000000-00000000-00000100
CPUID 80000008: 0000302E-00000000-00000000-00000000

L1    Data Cache:    32 KB,  8-way Associative, 64-byte Line
L1  Instr. Cache:    32 KB,  8-way Associative, 64-byte Line
L2 Unified Cache:     1 MB, 16-way Associative, 64-byte Line
L3 Unified Cache:  8448 KB, 11-way Associative, 64-byte Line

------[ Logical CPU #1 ]------

allcpu: Package 0 / Core 0 / Thread 1: Valid, Virtual

CPUID 00000000: 00000016-756E6547-6C65746E-49656E69 [GenuineIntel]
CPUID 00000001: 00050654-01100800-7FFEFBBF-BFEBFBFF
CPUID 00000002: 76036301-00F0B5FF-00000000-00C30000
CPUID 00000003: 00000000-00000000-00000000-00000000
CPUID 00000004: 1C004121-01C0003F-0000003F-00000000 [SL 00]
CPUID 00000004: 1C004122-01C0003F-0000003F-00000000 [SL 01]
CPUID 00000004: 1C004143-03C0003F-000003FF-00000000 [SL 02]
CPUID 00000004: 1C03C163-0280003F-00002FFF-00000004 [SL 03]
CPUID 00000005: 00000040-00000040-00000003-00002020
CPUID 00000006: 00000075-00000002-00000009-00000000
CPUID 00000007: 00000000-D39FFFFB-00000000-00000000
CPUID 00000008: 00000000-00000000-00000000-00000000
CPUID 00000009: 00000000-00000000-00000000-00000000
CPUID 0000000A: 07300404-00000000-00000000-00000603
CPUID 0000000B: 00000001-00000002-00000100-00000001 [SL 00]
CPUID 0000000B: 00000004-0000000C-00000201-00000001 [SL 01]
CPUID 0000000C: 00000000-00000000-00000000-00000000
CPUID 0000000D: 000000FF-00000A80-00000A80-00000000 [SL 00]
CPUID 0000000D: 0000000F-00000A00-00000100-00000000 [SL 01]
CPUID 0000000D: 00000100-00000240-00000000-00000000 [SL 02]
CPUID 0000000D: 00000040-000003C0-00000000-00000000 [SL 03]
CPUID 0000000D: 00000040-00000400-00000000-00000000 [SL 04]
CPUID 0000000D: 00000040-00000440-00000000-00000000 [SL 05]
CPUID 0000000D: 00000200-00000480-00000000-00000000 [SL 06]
CPUID 0000000D: 00000400-00000680-00000000-00000000 [SL 07]
CPUID 0000000D: 00000080-00000000-00000001-00000000 [SL 08]
CPUID 0000000E: 00000000-00000000-00000000-00000000
CPUID 0000000F: 00000000-0000002F-00000000-00000002 [SL 00]
CPUID 0000000F: 00000000-00006000-0000002F-00000007 [SL 01]
CPUID 00000010: 00000000-0000000A-00000000-00000000 [SL 00]
CPUID 00000010: 0000000A-00000600-00000004-0000000F [SL 01]
CPUID 00000011: 00000000-00000000-00000000-00000000
CPUID 00000012: 00000000-00000000-00000000-00000000 [SL 00]
CPUID 00000012: 00000000-00000000-00000000-00000000 [SL 01]
CPUID 00000013: 00000000-00000000-00000000-00000000
CPUID 00000014: 00000001-0000000F-00000007-00000000 [SL 00]
CPUID 00000014: 02490002-003F3FFF-00000000-00000000 [SL 01]
CPUID 00000015: 00000002-00000124-00000000-00000000 [146.00x / 0]
CPUID 00000016: 00000DAC-00000FA0-00000064-00000000 [3500 / 4000 / 100]
CPUID 80000000: 80000008-00000000-00000000-00000000
CPUID 80000001: 00000000-00000000-00000121-2C100000
CPUID 80000002: 65746E49-2952286C-726F4320-4D542865 [Intel(R) Core(TM]
CPUID 80000003: 37692029-3038372D-43205830-40205550 [) i7-7800X CPU @]
CPUID 80000004: 352E3320-7A484730-00000000-00000000 [ 3.50GHz]
CPUID 80000005: 00000000-00000000-00000000-00000000
CPUID 80000006: 00000000-00000000-01006040-00000000
CPUID 80000007: 00000000-00000000-00000000-00000100
CPUID 80000008: 0000302E-00000000-00000000-00000000

L1    Data Cache:    32 KB,  8-way Associative, 64-byte Line
L1  Instr. Cache:    32 KB,  8-way Associative, 64-byte Line
L2 Unified Cache:     1 MB, 16-way Associative, 64-byte Line
L3 Unified Cache:  8448 KB, 11-way Associative, 64-byte Line

------[ Logical CPU #2 ]------

allcpu: Package 0 / Core 1 / Thread 0: Valid

CPUID 00000000: 00000016-756E6547-6C65746E-49656E69 [GenuineIntel]
CPUID 00000001: 00050654-02100800-7FFEFBBF-BFEBFBFF
CPUID 00000002: 76036301-00F0B5FF-00000000-00C30000
CPUID 00000003: 00000000-00000000-00000000-00000000
CPUID 00000004: 1C004121-01C0003F-0000003F-00000000 [SL 00]
CPUID 00000004: 1C004122-01C0003F-0000003F-00000000 [SL 01]
CPUID 00000004: 1C004143-03C0003F-000003FF-00000000 [SL 02]
CPUID 00000004: 1C03C163-0280003F-00002FFF-00000004 [SL 03]
CPUID 00000005: 00000040-00000040-00000003-00002020
CPUID 00000006: 00000075-00000002-00000009-00000000
CPUID 00000007: 00000000-D39FFFFB-00000000-00000000
CPUID 00000008: 00000000-00000000-00000000-00000000
CPUID 00000009: 00000000-00000000-00000000-00000000
CPUID 0000000A: 07300404-00000000-00000000-00000603
CPUID 0000000B: 00000001-00000002-00000100-00000002 [SL 00]
CPUID 0000000B: 00000004-0000000C-00000201-00000002 [SL 01]
CPUID 0000000C: 00000000-00000000-00000000-00000000
CPUID 0000000D: 000000FF-00000A80-00000A80-00000000 [SL 00]
CPUID 0000000D: 0000000F-00000A00-00000100-00000000 [SL 01]
CPUID 0000000D: 00000100-00000240-00000000-00000000 [SL 02]
CPUID 0000000D: 00000040-000003C0-00000000-00000000 [SL 03]
CPUID 0000000D: 00000040-00000400-00000000-00000000 [SL 04]
CPUID 0000000D: 00000040-00000440-00000000-00000000 [SL 05]
CPUID 0000000D: 00000200-00000480-00000000-00000000 [SL 06]
CPUID 0000000D: 00000400-00000680-00000000-00000000 [SL 07]
CPUID 0000000D: 00000080-00000000-00000001-00000000 [SL 08]
CPUID 0000000E: 00000000-00000000-00000000-00000000
CPUID 0000000F: 00000000-0000002F-00000000-00000002 [SL 00]
CPUID 0000000F: 00000000-00006000-0000002F-00000007 [SL 01]
CPUID 00000010: 00000000-0000000A-00000000-00000000 [SL 00]
CPUID 00000010: 0000000A-00000600-00000004-0000000F [SL 01]
CPUID 00000011: 00000000-00000000-00000000-00000000
CPUID 00000012: 00000000-00000000-00000000-00000000 [SL 00]
CPUID 00000012: 00000000-00000000-00000000-00000000 [SL 01]
CPUID 00000013: 00000000-00000000-00000000-00000000
CPUID 00000014: 00000001-0000000F-00000007-00000000 [SL 00]
CPUID 00000014: 02490002-003F3FFF-00000000-00000000 [SL 01]
CPUID 00000015: 00000002-00000124-00000000-00000000 [146.00x / 0]
CPUID 00000016: 00000DAC-00000FA0-00000064-00000000 [3500 / 4000 / 100]
CPUID 80000000: 80000008-00000000-00000000-00000000
CPUID 80000001: 00000000-00000000-00000121-2C100000
CPUID 80000002: 65746E49-2952286C-726F4320-4D542865 [Intel(R) Core(TM]
CPUID 80000003: 37692029-3038372D-43205830-40205550 [) i7-7800X CPU @]
CPUID 80000004: 352E3320-7A484730-00000000-00000000 [ 3.50GHz]
CPUID 80000005: 00000000-00000000-00000000-00000000
CPUID 80000006: 00000000-00000000-01006040-00000000
CPUID 80000007: 00000000-00000000-00000000-00000100
CPUID 80000008: 0000302E-00000000-00000000-00000000

L1    Data Cache:    32 KB,  8-way Associative, 64-byte Line
L1  Instr. Cache:    32 KB,  8-way Associative, 64-byte Line
L2 Unified Cache:     1 MB, 16-way Associative, 64-byte Line
L3 Unified Cache:  8448 KB, 11-way Associative, 64-byte Line

------[ Logical CPU #3 ]------

allcpu: Package 0 / Core 1 / Thread 1: Valid, Virtual

CPUID 00000000: 00000016-756E6547-6C65746E-49656E69 [GenuineIntel]
CPUID 00000001: 00050654-03100800-7FFEFBBF-BFEBFBFF
CPUID 00000002: 76036301-00F0B5FF-00000000-00C30000
CPUID 00000003: 00000000-00000000-00000000-00000000
CPUID 00000004: 1C004121-01C0003F-0000003F-00000000 [SL 00]
CPUID 00000004: 1C004122-01C0003F-0000003F-00000000 [SL 01]
CPUID 00000004: 1C004143-03C0003F-000003FF-00000000 [SL 02]
CPUID 00000004: 1C03C163-0280003F-00002FFF-00000004 [SL 03]
CPUID 00000005: 00000040-00000040-00000003-00002020
CPUID 00000006: 00000075-00000002-00000009-00000000
CPUID 00000007: 00000000-D39FFFFB-00000000-00000000
CPUID 00000008: 00000000-00000000-00000000-00000000
CPUID 00000009: 00000000-00000000-00000000-00000000
CPUID 0000000A: 07300404-00000000-00000000-00000603
CPUID 0000000B: 00000001-00000002-00000100-00000003 [SL 00]
CPUID 0000000B: 00000004-0000000C-00000201-00000003 [SL 01]
CPUID 0000000C: 00000000-00000000-00000000-00000000
CPUID 0000000D: 000000FF-00000A80-00000A80-00000000 [SL 00]
CPUID 0000000D: 0000000F-00000A00-00000100-00000000 [SL 01]
CPUID 0000000D: 00000100-00000240-00000000-00000000 [SL 02]
CPUID 0000000D: 00000040-000003C0-00000000-00000000 [SL 03]
CPUID 0000000D: 00000040-00000400-00000000-00000000 [SL 04]
CPUID 0000000D: 00000040-00000440-00000000-00000000 [SL 05]
CPUID 0000000D: 00000200-00000480-00000000-00000000 [SL 06]
CPUID 0000000D: 00000400-00000680-00000000-00000000 [SL 07]
CPUID 0000000D: 00000080-00000000-00000001-00000000 [SL 08]
CPUID 0000000E: 00000000-00000000-00000000-00000000
CPUID 0000000F: 00000000-0000002F-00000000-00000002 [SL 00]
CPUID 0000000F: 00000000-00006000-0000002F-00000007 [SL 01]
CPUID 00000010: 00000000-0000000A-00000000-00000000 [SL 00]
CPUID 00000010: 0000000A-00000600-00000004-0000000F [SL 01]
CPUID 00000011: 00000000-00000000-00000000-00000000
CPUID 00000012: 00000000-00000000-00000000-00000000 [SL 00]
CPUID 00000012: 00000000-00000000-00000000-00000000 [SL 01]
CPUID 00000013: 00000000-00000000-00000000-00000000
CPUID 00000014: 00000001-0000000F-00000007-00000000 [SL 00]
CPUID 00000014: 02490002-003F3FFF-00000000-00000000 [SL 01]
CPUID 00000015: 00000002-00000124-00000000-00000000 [146.00x / 0]
CPUID 00000016: 00000DAC-00000FA0-00000064-00000000 [3500 / 4000 / 100]
CPUID 80000000: 80000008-00000000-00000000-00000000
CPUID 80000001: 00000000-00000000-00000121-2C100000
CPUID 80000002: 65746E49-2952286C-726F4320-4D542865 [Intel(R) Core(TM]
CPUID 80000003: 37692029-3038372D-43205830-40205550 [) i7-7800X CPU @]
CPUID 80000004: 352E3320-7A484730-00000000-00000000 [ 3.50GHz]
CPUID 80000005: 00000000-00000000-00000000-00000000
CPUID 80000006: 00000000-00000000-01006040-00000000
CPUID 80000007: 00000000-00000000-00000000-00000100
CPUID 80000008: 0000302E-00000000-00000000-00000000

L1    Data Cache:    32 KB,  8-way Associative, 64-byte Line
L1  Instr. Cache:    32 KB,  8-way Associative, 64-byte Line
L2 Unified Cache:     1 MB, 16-way Associative, 64-byte Line
L3 Unified Cache:  8448 KB, 11-way Associative, 64-byte Line

------[ Logical CPU #4 ]------

allcpu: Package 0 / Core 2 / Thread 0: Valid

CPUID 00000000: 00000016-756E6547-6C65746E-49656E69 [GenuineIntel]
CPUID 00000001: 00050654-04100800-7FFEFBBF-BFEBFBFF
CPUID 00000002: 76036301-00F0B5FF-00000000-00C30000
CPUID 00000003: 00000000-00000000-00000000-00000000
CPUID 00000004: 1C004121-01C0003F-0000003F-00000000 [SL 00]
CPUID 00000004: 1C004122-01C0003F-0000003F-00000000 [SL 01]
CPUID 00000004: 1C004143-03C0003F-000003FF-00000000 [SL 02]
CPUID 00000004: 1C03C163-0280003F-00002FFF-00000004 [SL 03]
CPUID 00000005: 00000040-00000040-00000003-00002020
CPUID 00000006: 00000075-00000002-00000009-00000000
CPUID 00000007: 00000000-D39FFFFB-00000000-00000000
CPUID 00000008: 00000000-00000000-00000000-00000000
CPUID 00000009: 00000000-00000000-00000000-00000000
CPUID 0000000A: 07300404-00000000-00000000-00000603
CPUID 0000000B: 00000001-00000002-00000100-00000004 [SL 00]
CPUID 0000000B: 00000004-0000000C-00000201-00000004 [SL 01]
CPUID 0000000C: 00000000-00000000-00000000-00000000
CPUID 0000000D: 000000FF-00000A80-00000A80-00000000 [SL 00]
CPUID 0000000D: 0000000F-00000A00-00000100-00000000 [SL 01]
CPUID 0000000D: 00000100-00000240-00000000-00000000 [SL 02]
CPUID 0000000D: 00000040-000003C0-00000000-00000000 [SL 03]
CPUID 0000000D: 00000040-00000400-00000000-00000000 [SL 04]
CPUID 0000000D: 00000040-00000440-00000000-00000000 [SL 05]
CPUID 0000000D: 00000200-00000480-00000000-00000000 [SL 06]
CPUID 0000000D: 00000400-00000680-00000000-00000000 [SL 07]
CPUID 0000000D: 00000080-00000000-00000001-00000000 [SL 08]
CPUID 0000000E: 00000000-00000000-00000000-00000000
CPUID 0000000F: 00000000-0000002F-00000000-00000002 [SL 00]
CPUID 0000000F: 00000000-00006000-0000002F-00000007 [SL 01]
CPUID 00000010: 00000000-0000000A-00000000-00000000 [SL 00]
CPUID 00000010: 0000000A-00000600-00000004-0000000F [SL 01]
CPUID 00000011: 00000000-00000000-00000000-00000000
CPUID 00000012: 00000000-00000000-00000000-00000000 [SL 00]
CPUID 00000012: 00000000-00000000-00000000-00000000 [SL 01]
CPUID 00000013: 00000000-00000000-00000000-00000000
CPUID 00000014: 00000001-0000000F-00000007-00000000 [SL 00]
CPUID 00000014: 02490002-003F3FFF-00000000-00000000 [SL 01]
CPUID 00000015: 00000002-00000124-00000000-00000000 [146.00x / 0]
CPUID 00000016: 00000DAC-00000FA0-00000064-00000000 [3500 / 4000 / 100]
CPUID 80000000: 80000008-00000000-00000000-00000000
CPUID 80000001: 00000000-00000000-00000121-2C100000
CPUID 80000002: 65746E49-2952286C-726F4320-4D542865 [Intel(R) Core(TM]
CPUID 80000003: 37692029-3038372D-43205830-40205550 [) i7-7800X CPU @]
CPUID 80000004: 352E3320-7A484730-00000000-00000000 [ 3.50GHz]
CPUID 80000005: 00000000-00000000-00000000-00000000
CPUID 80000006: 00000000-00000000-01006040-00000000
CPUID 80000007: 00000000-00000000-00000000-00000100
CPUID 80000008: 0000302E-00000000-00000000-00000000

L1    Data Cache:    32 KB,  8-way Associative, 64-byte Line
L1  Instr. Cache:    32 KB,  8-way Associative, 64-byte Line
L2 Unified Cache:     1 MB, 16-way Associative, 64-byte Line
L3 Unified Cache:  8448 KB, 11-way Associative, 64-byte Line

------[ Logical CPU #5 ]------

allcpu: Package 0 / Core 2 / Thread 1: Valid, Virtual

CPUID 00000000: 00000016-756E6547-6C65746E-49656E69 [GenuineIntel]
CPUID 00000001: 00050654-05100800-7FFEFBBF-BFEBFBFF
CPUID 00000002: 76036301-00F0B5FF-00000000-00C30000
CPUID 00000003: 00000000-00000000-00000000-00000000
CPUID 00000004: 1C004121-01C0003F-0000003F-00000000 [SL 00]
CPUID 00000004: 1C004122-01C0003F-0000003F-00000000 [SL 01]
CPUID 00000004: 1C004143-03C0003F-000003FF-00000000 [SL 02]
CPUID 00000004: 1C03C163-0280003F-00002FFF-00000004 [SL 03]
CPUID 00000005: 00000040-00000040-00000003-00002020
CPUID 00000006: 00000075-00000002-00000009-00000000
CPUID 00000007: 00000000-D39FFFFB-00000000-00000000
CPUID 00000008: 00000000-00000000-00000000-00000000
CPUID 00000009: 00000000-00000000-00000000-00000000
CPUID 0000000A: 07300404-00000000-00000000-00000603
CPUID 0000000B: 00000001-00000002-00000100-00000005 [SL 00]
CPUID 0000000B: 00000004-0000000C-00000201-00000005 [SL 01]
CPUID 0000000C: 00000000-00000000-00000000-00000000
CPUID 0000000D: 000000FF-00000A80-00000A80-00000000 [SL 00]
CPUID 0000000D: 0000000F-00000A00-00000100-00000000 [SL 01]
CPUID 0000000D: 00000100-00000240-00000000-00000000 [SL 02]
CPUID 0000000D: 00000040-000003C0-00000000-00000000 [SL 03]
CPUID 0000000D: 00000040-00000400-00000000-00000000 [SL 04]
CPUID 0000000D: 00000040-00000440-00000000-00000000 [SL 05]
CPUID 0000000D: 00000200-00000480-00000000-00000000 [SL 06]
CPUID 0000000D: 00000400-00000680-00000000-00000000 [SL 07]
CPUID 0000000D: 00000080-00000000-00000001-00000000 [SL 08]
CPUID 0000000E: 00000000-00000000-00000000-00000000
CPUID 0000000F: 00000000-0000002F-00000000-00000002 [SL 00]
CPUID 0000000F: 00000000-00006000-0000002F-00000007 [SL 01]
CPUID 00000010: 00000000-0000000A-00000000-00000000 [SL 00]
CPUID 00000010: 0000000A-00000600-00000004-0000000F [SL 01]
CPUID 00000011: 00000000-00000000-00000000-00000000
CPUID 00000012: 00000000-00000000-00000000-00000000 [SL 00]
CPUID 00000012: 00000000-00000000-00000000-00000000 [SL 01]
CPUID 00000013: 00000000-00000000-00000000-00000000
CPUID 00000014: 00000001-0000000F-00000007-00000000 [SL 00]
CPUID 00000014: 02490002-003F3FFF-00000000-00000000 [SL 01]
CPUID 00000015: 00000002-00000124-00000000-00000000 [146.00x / 0]
CPUID 00000016: 00000DAC-00000FA0-00000064-00000000 [3500 / 4000 / 100]
CPUID 80000000: 80000008-00000000-00000000-00000000
CPUID 80000001: 00000000-00000000-00000121-2C100000
CPUID 80000002: 65746E49-2952286C-726F4320-4D542865 [Intel(R) Core(TM]
CPUID 80000003: 37692029-3038372D-43205830-40205550 [) i7-7800X CPU @]
CPUID 80000004: 352E3320-7A484730-00000000-00000000 [ 3.50GHz]
CPUID 80000005: 00000000-00000000-00000000-00000000
CPUID 80000006: 00000000-00000000-01006040-00000000
CPUID 80000007: 00000000-00000000-00000000-00000100
CPUID 80000008: 0000302E-00000000-00000000-00000000

L1    Data Cache:    32 KB,  8-way Associative, 64-byte Line
L1  Instr. Cache:    32 KB,  8-way Associative, 64-byte Line
L2 Unified Cache:     1 MB, 16-way Associative, 64-byte Line
L3 Unified Cache:  8448 KB, 11-way Associative, 64-byte Line

------[ Logical CPU #6 ]------

allcpu: Package 0 / Core 3 / Thread 0: Valid

CPUID 00000000: 00000016-756E6547-6C65746E-49656E69 [GenuineIntel]
CPUID 00000001: 00050654-06100800-7FFEFBBF-BFEBFBFF
CPUID 00000002: 76036301-00F0B5FF-00000000-00C30000
CPUID 00000003: 00000000-00000000-00000000-00000000
CPUID 00000004: 1C004121-01C0003F-0000003F-00000000 [SL 00]
CPUID 00000004: 1C004122-01C0003F-0000003F-00000000 [SL 01]
CPUID 00000004: 1C004143-03C0003F-000003FF-00000000 [SL 02]
CPUID 00000004: 1C03C163-0280003F-00002FFF-00000004 [SL 03]
CPUID 00000005: 00000040-00000040-00000003-00002020
CPUID 00000006: 00000075-00000002-00000009-00000000
CPUID 00000007: 00000000-D39FFFFB-00000000-00000000
CPUID 00000008: 00000000-00000000-00000000-00000000
CPUID 00000009: 00000000-00000000-00000000-00000000
CPUID 0000000A: 07300404-00000000-00000000-00000603
CPUID 0000000B: 00000001-00000002-00000100-00000006 [SL 00]
CPUID 0000000B: 00000004-0000000C-00000201-00000006 [SL 01]
CPUID 0000000C: 00000000-00000000-00000000-00000000
CPUID 0000000D: 000000FF-00000A80-00000A80-00000000 [SL 00]
CPUID 0000000D: 0000000F-00000A00-00000100-00000000 [SL 01]
CPUID 0000000D: 00000100-00000240-00000000-00000000 [SL 02]
CPUID 0000000D: 00000040-000003C0-00000000-00000000 [SL 03]
CPUID 0000000D: 00000040-00000400-00000000-00000000 [SL 04]
CPUID 0000000D: 00000040-00000440-00000000-00000000 [SL 05]
CPUID 0000000D: 00000200-00000480-00000000-00000000 [SL 06]
CPUID 0000000D: 00000400-00000680-00000000-00000000 [SL 07]
CPUID 0000000D: 00000080-00000000-00000001-00000000 [SL 08]
CPUID 0000000E: 00000000-00000000-00000000-00000000
CPUID 0000000F: 00000000-0000002F-00000000-00000002 [SL 00]
CPUID 0000000F: 00000000-00006000-0000002F-00000007 [SL 01]
CPUID 00000010: 00000000-0000000A-00000000-00000000 [SL 00]
CPUID 00000010: 0000000A-00000600-00000004-0000000F [SL 01]
CPUID 00000011: 00000000-00000000-00000000-00000000
CPUID 00000012: 00000000-00000000-00000000-00000000 [SL 00]
CPUID 00000012: 00000000-00000000-00000000-00000000 [SL 01]
CPUID 00000013: 00000000-00000000-00000000-00000000
CPUID 00000014: 00000001-0000000F-00000007-00000000 [SL 00]
CPUID 00000014: 02490002-003F3FFF-00000000-00000000 [SL 01]
CPUID 00000015: 00000002-00000124-00000000-00000000 [146.00x / 0]
CPUID 00000016: 00000DAC-00000FA0-00000064-00000000 [3500 / 4000 / 100]
CPUID 80000000: 80000008-00000000-00000000-00000000
CPUID 80000001: 00000000-00000000-00000121-2C100000
CPUID 80000002: 65746E49-2952286C-726F4320-4D542865 [Intel(R) Core(TM]
CPUID 80000003: 37692029-3038372D-43205830-40205550 [) i7-7800X CPU @]
CPUID 80000004: 352E3320-7A484730-00000000-00000000 [ 3.50GHz]
CPUID 80000005: 00000000-00000000-00000000-00000000
CPUID 80000006: 00000000-00000000-01006040-00000000
CPUID 80000007: 00000000-00000000-00000000-00000100
CPUID 80000008: 0000302E-00000000-00000000-00000000

L1    Data Cache:    32 KB,  8-way Associative, 64-byte Line
L1  Instr. Cache:    32 KB,  8-way Associative, 64-byte Line
L2 Unified Cache:     1 MB, 16-way Associative, 64-byte Line
L3 Unified Cache:  8448 KB, 11-way Associative, 64-byte Line

------[ Logical CPU #7 ]------

allcpu: Package 0 / Core 3 / Thread 1: Valid, Virtual

CPUID 00000000: 00000016-756E6547-6C65746E-49656E69 [GenuineIntel]
CPUID 00000001: 00050654-07100800-7FFEFBBF-BFEBFBFF
CPUID 00000002: 76036301-00F0B5FF-00000000-00C30000
CPUID 00000003: 00000000-00000000-00000000-00000000
CPUID 00000004: 1C004121-01C0003F-0000003F-00000000 [SL 00]
CPUID 00000004: 1C004122-01C0003F-0000003F-00000000 [SL 01]
CPUID 00000004: 1C004143-03C0003F-000003FF-00000000 [SL 02]
CPUID 00000004: 1C03C163-0280003F-00002FFF-00000004 [SL 03]
CPUID 00000005: 00000040-00000040-00000003-00002020
CPUID 00000006: 00000075-00000002-00000009-00000000
CPUID 00000007: 00000000-D39FFFFB-00000000-00000000
CPUID 00000008: 00000000-00000000-00000000-00000000
CPUID 00000009: 00000000-00000000-00000000-00000000
CPUID 0000000A: 07300404-00000000-00000000-00000603
CPUID 0000000B: 00000001-00000002-00000100-00000007 [SL 00]
CPUID 0000000B: 00000004-0000000C-00000201-00000007 [SL 01]
CPUID 0000000C: 00000000-00000000-00000000-00000000
CPUID 0000000D: 000000FF-00000A80-00000A80-00000000 [SL 00]
CPUID 0000000D: 0000000F-00000A00-00000100-00000000 [SL 01]
CPUID 0000000D: 00000100-00000240-00000000-00000000 [SL 02]
CPUID 0000000D: 00000040-000003C0-00000000-00000000 [SL 03]
CPUID 0000000D: 00000040-00000400-00000000-00000000 [SL 04]
CPUID 0000000D: 00000040-00000440-00000000-00000000 [SL 05]
CPUID 0000000D: 00000200-00000480-00000000-00000000 [SL 06]
CPUID 0000000D: 00000400-00000680-00000000-00000000 [SL 07]
CPUID 0000000D: 00000080-00000000-00000001-00000000 [SL 08]
CPUID 0000000E: 00000000-00000000-00000000-00000000
CPUID 0000000F: 00000000-0000002F-00000000-00000002 [SL 00]
CPUID 0000000F: 00000000-00006000-0000002F-00000007 [SL 01]
CPUID 00000010: 00000000-0000000A-00000000-00000000 [SL 00]
CPUID 00000010: 0000000A-00000600-00000004-0000000F [SL 01]
CPUID 00000011: 00000000-00000000-00000000-00000000
CPUID 00000012: 00000000-00000000-00000000-00000000 [SL 00]
CPUID 00000012: 00000000-00000000-00000000-00000000 [SL 01]
CPUID 00000013: 00000000-00000000-00000000-00000000
CPUID 00000014: 00000001-0000000F-00000007-00000000 [SL 00]
CPUID 00000014: 02490002-003F3FFF-00000000-00000000 [SL 01]
CPUID 00000015: 00000002-00000124-00000000-00000000 [146.00x / 0]
CPUID 00000016: 00000DAC-00000FA0-00000064-00000000 [3500 / 4000 / 100]
CPUID 80000000: 80000008-00000000-00000000-00000000
CPUID 80000001: 00000000-00000000-00000121-2C100000
CPUID 80000002: 65746E49-2952286C-726F4320-4D542865 [Intel(R) Core(TM]
CPUID 80000003: 37692029-3038372D-43205830-40205550 [) i7-7800X CPU @]
CPUID 80000004: 352E3320-7A484730-00000000-00000000 [ 3.50GHz]
CPUID 80000005: 00000000-00000000-00000000-00000000
CPUID 80000006: 00000000-00000000-01006040-00000000
CPUID 80000007: 00000000-00000000-00000000-00000100
CPUID 80000008: 0000302E-00000000-00000000-00000000

L1    Data Cache:    32 KB,  8-way Associative, 64-byte Line
L1  Instr. Cache:    32 KB,  8-way Associative, 64-byte Line
L2 Unified Cache:     1 MB, 16-way Associative, 64-byte Line
L3 Unified Cache:  8448 KB, 11-way Associative, 64-byte Line

------[ Logical CPU #8 ]------

allcpu: Package 0 / Core 4 / Thread 0: Valid

CPUID 00000000: 00000016-756E6547-6C65746E-49656E69 [GenuineIntel]
CPUID 00000001: 00050654-08100800-7FFEFBBF-BFEBFBFF
CPUID 00000002: 76036301-00F0B5FF-00000000-00C30000
CPUID 00000003: 00000000-00000000-00000000-00000000
CPUID 00000004: 1C004121-01C0003F-0000003F-00000000 [SL 00]
CPUID 00000004: 1C004122-01C0003F-0000003F-00000000 [SL 01]
CPUID 00000004: 1C004143-03C0003F-000003FF-00000000 [SL 02]
CPUID 00000004: 1C03C163-0280003F-00002FFF-00000004 [SL 03]
CPUID 00000005: 00000040-00000040-00000003-00002020
CPUID 00000006: 00000075-00000002-00000009-00000000
CPUID 00000007: 00000000-D39FFFFB-00000000-00000000
CPUID 00000008: 00000000-00000000-00000000-00000000
CPUID 00000009: 00000000-00000000-00000000-00000000
CPUID 0000000A: 07300404-00000000-00000000-00000603
CPUID 0000000B: 00000001-00000002-00000100-00000008 [SL 00]
CPUID 0000000B: 00000004-0000000C-00000201-00000008 [SL 01]
CPUID 0000000C: 00000000-00000000-00000000-00000000
CPUID 0000000D: 000000FF-00000A80-00000A80-00000000 [SL 00]
CPUID 0000000D: 0000000F-00000A00-00000100-00000000 [SL 01]
CPUID 0000000D: 00000100-00000240-00000000-00000000 [SL 02]
CPUID 0000000D: 00000040-000003C0-00000000-00000000 [SL 03]
CPUID 0000000D: 00000040-00000400-00000000-00000000 [SL 04]
CPUID 0000000D: 00000040-00000440-00000000-00000000 [SL 05]
CPUID 0000000D: 00000200-00000480-00000000-00000000 [SL 06]
CPUID 0000000D: 00000400-00000680-00000000-00000000 [SL 07]
CPUID 0000000D: 00000080-00000000-00000001-00000000 [SL 08]
CPUID 0000000E: 00000000-00000000-00000000-00000000
CPUID 0000000F: 00000000-0000002F-00000000-00000002 [SL 00]
CPUID 0000000F: 00000000-00006000-0000002F-00000007 [SL 01]
CPUID 00000010: 00000000-0000000A-00000000-00000000 [SL 00]
CPUID 00000010: 0000000A-00000600-00000004-0000000F [SL 01]
CPUID 00000011: 00000000-00000000-00000000-00000000
CPUID 00000012: 00000000-00000000-00000000-00000000 [SL 00]
CPUID 00000012: 00000000-00000000-00000000-00000000 [SL 01]
CPUID 00000013: 00000000-00000000-00000000-00000000
CPUID 00000014: 00000001-0000000F-00000007-00000000 [SL 00]
CPUID 00000014: 02490002-003F3FFF-00000000-00000000 [SL 01]
CPUID 00000015: 00000002-00000124-00000000-00000000 [146.00x / 0]
CPUID 00000016: 00000DAC-00000FA0-00000064-00000000 [3500 / 4000 / 100]
CPUID 80000000: 80000008-00000000-00000000-00000000
CPUID 80000001: 00000000-00000000-00000121-2C100000
CPUID 80000002: 65746E49-2952286C-726F4320-4D542865 [Intel(R) Core(TM]
CPUID 80000003: 37692029-3038372D-43205830-40205550 [) i7-7800X CPU @]
CPUID 80000004: 352E3320-7A484730-00000000-00000000 [ 3.50GHz]
CPUID 80000005: 00000000-00000000-00000000-00000000
CPUID 80000006: 00000000-00000000-01006040-00000000
CPUID 80000007: 00000000-00000000-00000000-00000100
CPUID 80000008: 0000302E-00000000-00000000-00000000

L1    Data Cache:    32 KB,  8-way Associative, 64-byte Line
L1  Instr. Cache:    32 KB,  8-way Associative, 64-byte Line
L2 Unified Cache:     1 MB, 16-way Associative, 64-byte Line
L3 Unified Cache:  8448 KB, 11-way Associative, 64-byte Line

------[ Logical CPU #9 ]------

allcpu: Package 0 / Core 4 / Thread 1: Valid, Virtual

CPUID 00000000: 00000016-756E6547-6C65746E-49656E69 [GenuineIntel]
CPUID 00000001: 00050654-09100800-7FFEFBBF-BFEBFBFF
CPUID 00000002: 76036301-00F0B5FF-00000000-00C30000
CPUID 00000003: 00000000-00000000-00000000-00000000
CPUID 00000004: 1C004121-01C0003F-0000003F-00000000 [SL 00]
CPUID 00000004: 1C004122-01C0003F-0000003F-00000000 [SL 01]
CPUID 00000004: 1C004143-03C0003F-000003FF-00000000 [SL 02]
CPUID 00000004: 1C03C163-0280003F-00002FFF-00000004 [SL 03]
CPUID 00000005: 00000040-00000040-00000003-00002020
CPUID 00000006: 00000075-00000002-00000009-00000000
CPUID 00000007: 00000000-D39FFFFB-00000000-00000000
CPUID 00000008: 00000000-00000000-00000000-00000000
CPUID 00000009: 00000000-00000000-00000000-00000000
CPUID 0000000A: 07300404-00000000-00000000-00000603
CPUID 0000000B: 00000001-00000002-00000100-00000009 [SL 00]
CPUID 0000000B: 00000004-0000000C-00000201-00000009 [SL 01]
CPUID 0000000C: 00000000-00000000-00000000-00000000
CPUID 0000000D: 000000FF-00000A80-00000A80-00000000 [SL 00]
CPUID 0000000D: 0000000F-00000A00-00000100-00000000 [SL 01]
CPUID 0000000D: 00000100-00000240-00000000-00000000 [SL 02]
CPUID 0000000D: 00000040-000003C0-00000000-00000000 [SL 03]
CPUID 0000000D: 00000040-00000400-00000000-00000000 [SL 04]
CPUID 0000000D: 00000040-00000440-00000000-00000000 [SL 05]
CPUID 0000000D: 00000200-00000480-00000000-00000000 [SL 06]
CPUID 0000000D: 00000400-00000680-00000000-00000000 [SL 07]
CPUID 0000000D: 00000080-00000000-00000001-00000000 [SL 08]
CPUID 0000000E: 00000000-00000000-00000000-00000000
CPUID 0000000F: 00000000-0000002F-00000000-00000002 [SL 00]
CPUID 0000000F: 00000000-00006000-0000002F-00000007 [SL 01]
CPUID 00000010: 00000000-0000000A-00000000-00000000 [SL 00]
CPUID 00000010: 0000000A-00000600-00000004-0000000F [SL 01]
CPUID 00000011: 00000000-00000000-00000000-00000000
CPUID 00000012: 00000000-00000000-00000000-00000000 [SL 00]
CPUID 00000012: 00000000-00000000-00000000-00000000 [SL 01]
CPUID 00000013: 00000000-00000000-00000000-00000000
CPUID 00000014: 00000001-0000000F-00000007-00000000 [SL 00]
CPUID 00000014: 02490002-003F3FFF-00000000-00000000 [SL 01]
CPUID 00000015: 00000002-00000124-00000000-00000000 [146.00x / 0]
CPUID 00000016: 00000DAC-00000FA0-00000064-00000000 [3500 / 4000 / 100]
CPUID 80000000: 80000008-00000000-00000000-00000000
CPUID 80000001: 00000000-00000000-00000121-2C100000
CPUID 80000002: 65746E49-2952286C-726F4320-4D542865 [Intel(R) Core(TM]
CPUID 80000003: 37692029-3038372D-43205830-40205550 [) i7-7800X CPU @]
CPUID 80000004: 352E3320-7A484730-00000000-00000000 [ 3.50GHz]
CPUID 80000005: 00000000-00000000-00000000-00000000
CPUID 80000006: 00000000-00000000-01006040-00000000
CPUID 80000007: 00000000-00000000-00000000-00000100
CPUID 80000008: 0000302E-00000000-00000000-00000000

L1    Data Cache:    32 KB,  8-way Associative, 64-byte Line
L1  Instr. Cache:    32 KB,  8-way Associative, 64-byte Line
L2 Unified Cache:     1 MB, 16-way Associative, 64-byte Line
L3 Unified Cache:  8448 KB, 11-way Associative, 64-byte Line

------[ Logical CPU #10 ]------

allcpu: Package 0 / Core 5 / Thread 0: Valid

CPUID 00000000: 00000016-756E6547-6C65746E-49656E69 [GenuineIntel]
CPUID 00000001: 00050654-0A100800-7FFEFBBF-BFEBFBFF
CPUID 00000002: 76036301-00F0B5FF-00000000-00C30000
CPUID 00000003: 00000000-00000000-00000000-00000000
CPUID 00000004: 1C004121-01C0003F-0000003F-00000000 [SL 00]
CPUID 00000004: 1C004122-01C0003F-0000003F-00000000 [SL 01]
CPUID 00000004: 1C004143-03C0003F-000003FF-00000000 [SL 02]
CPUID 00000004: 1C03C163-0280003F-00002FFF-00000004 [SL 03]
CPUID 00000005: 00000040-00000040-00000003-00002020
CPUID 00000006: 00000075-00000002-00000009-00000000
CPUID 00000007: 00000000-D39FFFFB-00000000-00000000
CPUID 00000008: 00000000-00000000-00000000-00000000
CPUID 00000009: 00000000-00000000-00000000-00000000
CPUID 0000000A: 07300404-00000000-00000000-00000603
CPUID 0000000B: 00000001-00000002-00000100-0000000A [SL 00]
CPUID 0000000B: 00000004-0000000C-00000201-0000000A [SL 01]
CPUID 0000000C: 00000000-00000000-00000000-00000000
CPUID 0000000D: 000000FF-00000A80-00000A80-00000000 [SL 00]
CPUID 0000000D: 0000000F-00000A00-00000100-00000000 [SL 01]
CPUID 0000000D: 00000100-00000240-00000000-00000000 [SL 02]
CPUID 0000000D: 00000040-000003C0-00000000-00000000 [SL 03]
CPUID 0000000D: 00000040-00000400-00000000-00000000 [SL 04]
CPUID 0000000D: 00000040-00000440-00000000-00000000 [SL 05]
CPUID 0000000D: 00000200-00000480-00000000-00000000 [SL 06]
CPUID 0000000D: 00000400-00000680-00000000-00000000 [SL 07]
CPUID 0000000D: 00000080-00000000-00000001-00000000 [SL 08]
CPUID 0000000E: 00000000-00000000-00000000-00000000
CPUID 0000000F: 00000000-0000002F-00000000-00000002 [SL 00]
CPUID 0000000F: 00000000-00006000-0000002F-00000007 [SL 01]
CPUID 00000010: 00000000-0000000A-00000000-00000000 [SL 00]
CPUID 00000010: 0000000A-00000600-00000004-0000000F [SL 01]
CPUID 00000011: 00000000-00000000-00000000-00000000
CPUID 00000012: 00000000-00000000-00000000-00000000 [SL 00]
CPUID 00000012: 00000000-00000000-00000000-00000000 [SL 01]
CPUID 00000013: 00000000-00000000-00000000-00000000
CPUID 00000014: 00000001-0000000F-00000007-00000000 [SL 00]
CPUID 00000014: 02490002-003F3FFF-00000000-00000000 [SL 01]
CPUID 00000015: 00000002-00000124-00000000-00000000 [146.00x / 0]
CPUID 00000016: 00000DAC-00000FA0-00000064-00000000 [3500 / 4000 / 100]
CPUID 80000000: 80000008-00000000-00000000-00000000
CPUID 80000001: 00000000-00000000-00000121-2C100000
CPUID 80000002: 65746E49-2952286C-726F4320-4D542865 [Intel(R) Core(TM]
CPUID 80000003: 37692029-3038372D-43205830-40205550 [) i7-7800X CPU @]
CPUID 80000004: 352E3320-7A484730-00000000-00000000 [ 3.50GHz]
CPUID 80000005: 00000000-00000000-00000000-00000000
CPUID 80000006: 00000000-00000000-01006040-00000000
CPUID 80000007: 00000000-00000000-00000000-00000100
CPUID 80000008: 0000302E-00000000-00000000-00000000

L1    Data Cache:    32 KB,  8-way Associative, 64-byte Line
L1  Instr. Cache:    32 KB,  8-way Associative, 64-byte Line
L2 Unified Cache:     1 MB, 16-way Associative, 64-byte Line
L3 Unified Cache:  8448 KB, 11-way Associative, 64-byte Line

------[ Logical CPU #11 ]------

allcpu: Package 0 / Core 5 / Thread 1: Valid, Virtual

CPUID 00000000: 00000016-756E6547-6C65746E-49656E69 [GenuineIntel]
CPUID 00000001: 00050654-0B100800-7FFEFBBF-BFEBFBFF
CPUID 00000002: 76036301-00F0B5FF-00000000-00C30000
CPUID 00000003: 00000000-00000000-00000000-00000000
CPUID 00000004: 1C004121-01C0003F-0000003F-00000000 [SL 00]
CPUID 00000004: 1C004122-01C0003F-0000003F-00000000 [SL 01]
CPUID 00000004: 1C004143-03C0003F-000003FF-00000000 [SL 02]
CPUID 00000004: 1C03C163-0280003F-00002FFF-00000004 [SL 03]
CPUID 00000005: 00000040-00000040-00000003-00002020
CPUID 00000006: 00000075-00000002-00000009-00000000
CPUID 00000007: 00000000-D39FFFFB-00000000-00000000
CPUID 00000008: 00000000-00000000-00000000-00000000
CPUID 00000009: 00000000-00000000-00000000-00000000
CPUID 0000000A: 07300404-00000000-00000000-00000603
CPUID 0000000B: 00000001-00000002-00000100-0000000B [SL 00]
CPUID 0000000B: 00000004-0000000C-00000201-0000000B [SL 01]
CPUID 0000000C: 00000000-00000000-00000000-00000000
CPUID 0000000D: 000000FF-00000A80-00000A80-00000000 [SL 00]
CPUID 0000000D: 0000000F-00000A00-00000100-00000000 [SL 01]
CPUID 0000000D: 00000100-00000240-00000000-00000000 [SL 02]
CPUID 0000000D: 00000040-000003C0-00000000-00000000 [SL 03]
CPUID 0000000D: 00000040-00000400-00000000-00000000 [SL 04]
CPUID 0000000D: 00000040-00000440-00000000-00000000 [SL 05]
CPUID 0000000D: 00000200-00000480-00000000-00000000 [SL 06]
CPUID 0000000D: 00000400-00000680-00000000-00000000 [SL 07]
CPUID 0000000D: 00000080-00000000-00000001-00000000 [SL 08]
CPUID 0000000E: 00000000-00000000-00000000-00000000
CPUID 0000000F: 00000000-0000002F-00000000-00000002 [SL 00]
CPUID 0000000F: 00000000-00006000-0000002F-00000007 [SL 01]
CPUID 00000010: 00000000-0000000A-00000000-00000000 [SL 00]
CPUID 00000010: 0000000A-00000600-00000004-0000000F [SL 01]
CPUID 00000011: 00000000-00000000-00000000-00000000
CPUID 00000012: 00000000-00000000-00000000-00000000 [SL 00]
CPUID 00000012: 00000000-00000000-00000000-00000000 [SL 01]
CPUID 00000013: 00000000-00000000-00000000-00000000
CPUID 00000014: 00000001-0000000F-00000007-00000000 [SL 00]
CPUID 00000014: 02490002-003F3FFF-00000000-00000000 [SL 01]
CPUID 00000015: 00000002-00000124-00000000-00000000 [146.00x / 0]
CPUID 00000016: 00000DAC-00000FA0-00000064-00000000 [3500 / 4000 / 100]
CPUID 80000000: 80000008-00000000-00000000-00000000
CPUID 80000001: 00000000-00000000-00000121-2C100000
CPUID 80000002: 65746E49-2952286C-726F4320-4D542865 [Intel(R) Core(TM]
CPUID 80000003: 37692029-3038372D-43205830-40205550 [) i7-7800X CPU @]
CPUID 80000004: 352E3320-7A484730-00000000-00000000 [ 3.50GHz]
CPUID 80000005: 00000000-00000000-00000000-00000000
CPUID 80000006: 00000000-00000000-01006040-00000000
CPUID 80000007: 00000000-00000000-00000000-00000100
CPUID 80000008: 0000302E-00000000-00000000-00000000

L1    Data Cache:    32 KB,  8-way Associative, 64-byte Line
L1  Instr. Cache:    32 KB,  8-way Associative, 64-byte Line
L2 Unified Cache:     1 MB, 16-way Associative, 64-byte Line
L3 Unified Cache:  8448 KB, 11-way Associative, 64-byte Line

------[ All CPUs ]------

CPU   0: APICID    0 / Package 0 / Core   0 / Thread 0: Valid
CPU   1: APICID    1 / Package 0 / Core   0 / Thread 1: Valid, Virtual
CPU   2: APICID    2 / Package 0 / Core   1 / Thread 0: Valid
CPU   3: APICID    3 / Package 0 / Core   1 / Thread 1: Valid, Virtual
CPU   4: APICID    4 / Package 0 / Core   2 / Thread 0: Valid
CPU   5: APICID    5 / Package 0 / Core   2 / Thread 1: Valid, Virtual
CPU   6: APICID    6 / Package 0 / Core   3 / Thread 0: Valid
CPU   7: APICID    7 / Package 0 / Core   3 / Thread 1: Valid, Virtual
CPU   8: APICID    8 / Package 0 / Core   4 / Thread 0: Valid
CPU   9: APICID    9 / Package 0 / Core   4 / Thread 1: Valid, Virtual
CPU  10: APICID   10 / Package 0 / Core   5 / Thread 0: Valid
CPU  11: APICID   11 / Package 0 / Core   5 / Thread 1: Valid, Virtual

------[ MSR Registers ]------

MSR 00000017: 0008-0000-0000-0000 [PlatID = 2]
MSR 0000001B: 0000-0000-FEE0-0900
MSR 00000035: 0000-0000-0006-000C
MSR 0000008B: 0200-0026-0000-0000
MSR 000000CE: 0007-0C2C-F301-2300 [eD = 0]
MSR 000000E7: 0000-02C5-E251-1A88 [S200]
MSR 000000E7: 0000-02C5-E280-51D4 [S200]
MSR 000000E7: 0000-02C5-E2A2-37F0
MSR 000000E8: 0000-02C5-E29F-033C [S200]
MSR 000000E8: 0000-02C5-E2C2-9235 [S200]
MSR 000000E8: 0000-02C5-E2E5-8FCC
MSR 00000194: 0000-0000-000E-0000
MSR 00000198: 0000-1EE5-0000-2300 [S200]
MSR 00000198: 0000-1EE9-0000-2300 [S200]
MSR 00000198: 0000-1EE9-0000-2300
MSR 00000199: 0000-0000-0000-2800
MSR 0000019A: 0000-0000-0000-0000
MSR 0000019B: 0000-0000-0000-0000
MSR 0000019C: 0000-0000-883F-0000 [S200]
MSR 0000019C: 0000-0000-883F-0000 [S200]
MSR 0000019C: 0000-0000-883F-0000
MSR 0000019D: 0000-0000-0000-0000
MSR 000001A0: 0000-0040-0085-0089
MSR 000001A2: 0000-0000-0064-0A00
MSR 000001A4: 0000-0000-0000-0000
MSR 000001AA: 0000-0000-0040-0001
MSR 000001AC: < FAILED >
MSR 000001AD: 2828-2828-2828-2828
MSR 000001AE: 1C18-1410-0C06-0402
MSR 000001AF: < FAILED >
MSR 000001B0: 0000-0000-0000-0000
MSR 000001B1: 0000-0000-883F-0000
MSR 000001B2: 0000-0000-0000-0000
MSR 000001FC: 0000-0000-213C-0059
MSR 00000300: 8000-0000-B264-1600
MSR 0000030A: 0000-0000-0325-C85D [S200]
MSR 0000030A: 0000-0000-0325-C85D [S200]
MSR 0000030A: 0000-0000-0325-C85D
MSR 0000030B: 0000-0000-0326-B226 [S200]
MSR 0000030B: 0000-0000-0326-B226 [S200]
MSR 0000030B: 0000-0000-0326-B226
MSR 00000480: 00DA-0400-0000-0004
MSR 00000481: 0000-00FF-0000-0016
MSR 00000482: FFF9-FFFE-0401-E172
MSR 00000483: 01FF-FFFF-0003-6DFF
MSR 00000484: 0003-FFFF-0000-11FF
MSR 00000485: 0000-0000-7004-C1E7
MSR 00000486: 0000-0000-8000-0021
MSR 00000487: 0000-0000-FFFF-FFFF
MSR 00000488: 0000-0000-0000-2000
MSR 00000489: 0000-0000-0037-27FF
MSR 0000048A: 0000-0000-0000-002E
MSR 0000048B: 025D-3FFF-0000-0000
MSR 0000048C: 0000-0F01-0673-4141
MSR 0000048D: 0000-00FF-0000-0016
MSR 0000048E: FFF9-FFFE-0400-6172
MSR 0000048F: 01FF-FFFF-0003-6DFB
MSR 00000490: 0003-FFFF-0000-11FB
MSR 00000601: 0000-0000-0000-1FF8
MSR 00000602: < FAILED >
MSR 00000603: 0016-0000-0017-1717
MSR 00000604: < FAILED >
MSR 00000606: 0000-0000-000A-0E03
MSR 0000060A: 0000-0000-0000-0000
MSR 0000060B: 0000-0000-0000-0000
MSR 0000060C: 0000-0000-0000-0000
MSR 0000060D: 0000-0000-0000-0000
MSR 00000610: 0043-FFD0-001A-EA82
MSR 00000611: 0000-0000-B957-FD27 [S200]
MSR 00000611: 0000-0000-B95A-1DDB [S200]
MSR 00000611: 0000-0000-B95C-40C7
MSR 00000613: 0000-0000-0000-0000
MSR 00000614: 0000-09A0-0168-03D0
MSR 00000618: 0000-0000-0000-0000
MSR 00000619: 0000-0000-0E08-40E2 [S200]
MSR 00000619: 0000-0000-0E08-4939 [S200]
MSR 00000619: 0000-0000-0E08-52B5
MSR 0000061B: 0000-0000-0000-0000
MSR 0000061C: 000F-00A4-0010-009C
MSR 0000061E: 0000-0000-0000-0000
MSR 00000620: 0000-0000-0000-0818
MSR 00000621: 0000-0000-0000-0018
MSR 00000638: 0000-0000-0000-0000
MSR 00000639: 0000-0000-0000-0000 [S200]
MSR 00000639: 0000-0000-0000-0000 [S200]
MSR 00000639: 0000-0000-0000-0000
MSR 0000063A: < FAILED >
MSR 0000063B: < FAILED >
MSR 00000640: < FAILED >
MSR 00000641: < FAILED >
MSR 00000642: < FAILED >
MSR 00000648: 0000-0000-0000-0023
MSR 00000649: 00B4-0000-001E-0460
MSR 0000064A: 00B4-0000-001E-0460
MSR 0000064B: 0000-0000-0000-0000
MSR 0000064C: 0000-0000-0000-0000
MSR 00000690: 0000-0000-0000-0000
MSR 000006B0: < FAILED >
MSR 000006B1: 0000-0000-0000-0000

PerformanceFrequency = 3421875

CPU Clock M.Method = 9  (APIC SKL)
PM Timer Address   = 6152  (1808h)

APIC Clock = 100.00 MHz  (AT = 12576 / TT = 15005 / try = 1 / SKL = 24.00 MHz)
APIC Clock = 100.01 MHz  (AT = 12576 / TT = 15004 / try = 1 / SKL = 24.00 MHz)
APIC Clock = 100.01 MHz  (AT = 12577 / TT = 15005 / try = 1 / SKL = 24.00 MHz)
APIC Clock = 100.00 MHz  (AT = 12575 / TT = 15004 / try = 1 / SKL = 24.00 MHz)
APIC Clock = 100.01 MHz  (AT = 12576 / TT = 15004 / try = 1 / SKL = 24.00 MHz)

CPU Clock = 3500.11 MHz / TSC Clock = 3504.11 MHz / CPU Mul = 35.00x
CPU Clock = 3500.29 MHz / TSC Clock = 3504.29 MHz / CPU Mul = 35.00x
CPU Clock = 3499.78 MHz / TSC Clock = 3503.78 MHz / CPU Mul = 35.00x
CPU Clock = 3500.29 MHz / TSC Clock = 3504.29 MHz / CPU Mul = 35.00x
CPU Clock = 3499.78 MHz / TSC Clock = 3503.78 MHz / CPU Mul = 35.00x

CPU Clock Max = 3499.83 MHz / TSC Clock = 3503.83 MHz / CPU Mul = 35.00x
CPU Clock Max = 3500.06 MHz / TSC Clock = 3504.06 MHz / CPU Mul = 35.00x
CPU Clock Max = 3499.83 MHz / TSC Clock = 3503.83 MHz / CPU Mul = 35.00x
CPU Clock Max = 3499.78 MHz / TSC Clock = 3503.78 MHz / CPU Mul = 35.00x
CPU Clock Max = 3500.29 MHz / TSC Clock = 3504.29 MHz / CPU Mul = 35.00x

INTPERFCTR2 = 3500.03 MHz / INTPERFCTR1 (TSC) = 3504.00 MHz
INTPERFCTR2 = 3500.04 MHz / INTPERFCTR1 (TSC) = 3504.02 MHz
INTPERFCTR2 = 3500.06 MHz / INTPERFCTR1 (TSC) = 3504.04 MHz
INTPERFCTR2 = 3500.01 MHz / INTPERFCTR1 (TSC) = 3503.98 MHz
INTPERFCTR2 = 3500.05 MHz / INTPERFCTR1 (TSC) = 3504.03 MHz

------[ OC MailBox ]------

C 01 / P1 00 / P2 00: 00000750
C 01 / P1 01 / P2 00: 00000000
C 01 / P1 02 / P2 00: 00000750
C 01 / P1 03 / P2 00: 00000400
C 01 / P1 04 / P2 00: 00000000
C 02 / P1 00 / P2 00: 28282828
C 02 / P1 00 / P2 01: 28282828
C 02 / P1 00 / P2 02: 26262626
C 02 / P1 00 / P2 03: 28282828
C 02 / P1 01 / P2 00: 28282828
C 02 / P1 01 / P2 01: 28282828
C 02 / P1 01 / P2 02: 26262626
C 02 / P1 01 / P2 03: 26262828
C 02 / P1 02 / P2 00: 28282828
C 02 / P1 02 / P2 01: 28282828
C 02 / P1 02 / P2 02: 26262626
C 02 / P1 02 / P2 03: 26262626
C 02 / P1 03 / P2 00: 28282828
C 02 / P1 03 / P2 01: 28282828
C 02 / P1 03 / P2 02: 26262626
C 02 / P1 03 / P2 03: 26262626
C 02 / P1 04 / P2 00: 28282828
C 02 / P1 04 / P2 01: 28282828
C 02 / P1 04 / P2 02: 26262626
C 02 / P1 04 / P2 03: 26262626
C 02 / P1 05 / P2 00: 28282828
C 02 / P1 05 / P2 01: 28282828
C 02 / P1 05 / P2 02: 26262626
C 02 / P1 05 / P2 03: 26262626
C 02 / P1 06 / P2 00: 28282828
C 02 / P1 06 / P2 01: 28282828
C 02 / P1 06 / P2 02: 26262626
C 02 / P1 06 / P2 03: 26262626
C 02 / P1 07 / P2 00: 00000000
C 02 / P1 07 / P2 01: 00000000
C 02 / P1 07 / P2 02: 00000000
C 02 / P1 07 / P2 03: 00000000
C 05 / P1 00 / P2 00: 00000000
C 10 / P1 00 / P2 00: 00000028
C 10 / P1 01 / P2 00: 00000000
C 10 / P1 02 / P2 00: 00000000
C 10 / P1 03 / P2 00: 06600000
C 10 / P1 04 / P2 00: 00000000
C 12 / P1 00 / P2 00: 00000000
C 12 / P1 01 / P2 00: 00000000
C 12 / P1 02 / P2 00: 00000000
C 14 / P1 00 / P2 00: 00000007
C 16 / P1 00 / P2 00: 00000000
C 18 / P1 00 / P2 00: 00000000
C 1A / P1 00 / P2 00: 00000000
C 1C / P1 00 / P2 00: 00000000  [CPU0]
C 1C / P1 00 / P2 00: 00000000  [CPU1]
C 1C / P1 00 / P2 00: 00000000  [CPU2]
C 1C / P1 00 / P2 00: 00000000  [CPU3]
C 1C / P1 00 / P2 00: 00000000  [CPU4]
C 1C / P1 00 / P2 00: 00000000  [CPU5]
C 1C / P1 00 / P2 00: 00000000  [CPU6]
C 1C / P1 00 / P2 00: 00000000  [CPU7]
C 1C / P1 00 / P2 00: 00000000  [CPU8]
C 1C / P1 00 / P2 00: 00000000  [CPU9]
C 1C / P1 00 / P2 00: 00000000  [CPU10]
C 1C / P1 00 / P2 00: 00000000  [CPU11]

------[ APIC Base at 00000000-FEE00000 ]------

  0000  00 00 00 00 00 00 00 00 00 00 00 00 00 00 00 00 
  0010  00 00 00 00 00 00 00 00 00 00 00 00 00 00 00 00 
  0020  00 00 00 0B 00 00 00 00 00 00 00 00 00 00 00 00 
  0030  15 00 06 01 00 00 00 00 00 00 00 00 00 00 00 00 
  0040  00 00 00 00 00 00 00 00 00 00 00 00 00 00 00 00 
  0050  00 00 00 00 00 00 00 00 00 00 00 00 00 00 00 00 
  0060  00 00 00 00 00 00 00 00 00 00 00 00 00 00 00 00 
  0070  00 00 00 00 00 00 00 00 00 00 00 00 00 00 00 00 
  0080  00 00 00 00 00 00 00 00 00 00 00 00 00 00 00 00 
  0090  00 00 00 00 00 00 00 00 00 00 00 00 00 00 00 00 
  00A0  00 00 00 00 00 00 00 00 00 00 00 00 00 00 00 00 
  00B0  00 00 00 00 00 00 00 00 00 00 00 00 00 00 00 00 
  00C0  00 00 00 00 00 00 00 00 00 00 00 00 00 00 00 00 
  00D0  00 00 00 28 00 00 00 00 00 00 00 00 00 00 00 00 
  00E0  FF FF FF 0F 00 00 00 00 00 00 00 00 00 00 00 00 
  00F0  DF 01 00 00 00 00 00 00 00 00 00 00 00 00 00 00 
  0100  00 00 00 00 00 00 00 00 00 00 00 00 00 00 00 00 
  0110  00 00 00 00 00 00 00 00 00 00 00 00 00 00 00 00 
  0120  00 00 00 00 00 00 00 00 00 00 00 00 00 00 00 00 
  0130  00 00 00 00 00 00 00 00 00 00 00 00 00 00 00 00 
  0140  00 00 00 00 00 00 00 00 00 00 00 00 00 00 00 00 
  0150  00 00 00 00 00 00 00 00 00 00 00 00 00 00 00 00 
  0160  00 00 00 00 00 00 00 00 00 00 00 00 00 00 00 00 
  0170  00 00 00 00 00 00 00 00 00 00 00 00 00 00 00 00 
  0180  00 00 00 00 00 00 00 00 00 00 00 00 00 00 00 00 
  0190  00 00 00 00 00 00 00 00 00 00 00 00 00 00 00 00 
  01A0  00 00 00 00 00 00 00 00 00 00 00 00 00 00 00 00 
  01B0  00 00 00 00 00 00 00 00 00 00 00 00 00 00 00 00 
  01C0  00 00 00 00 00 00 00 00 00 00 00 00 00 00 00 00 
  01D0  00 00 00 00 00 00 00 00 00 00 00 00 00 00 00 00 
  01E0  00 00 00 00 00 00 00 00 00 00 00 00 00 00 00 00 
  01F0  00 00 00 00 00 00 00 00 00 00 00 00 00 00 00 00 
  0200  00 00 00 00 00 00 00 00 00 00 00 00 00 00 00 00 
  0210  00 00 00 00 00 00 00 00 00 00 00 00 00 00 00 00 
  0220  00 00 00 00 00 00 00 00 00 00 00 00 00 00 00 00 
  0230  00 00 00 00 00 00 00 00 00 00 00 00 00 00 00 00 
  0240  00 00 00 00 00 00 00 00 00 00 00 00 00 00 00 00 
  0250  00 00 00 00 00 00 00 00 00 00 00 00 00 00 00 00 
  0260  00 00 00 00 00 00 00 00 00 00 00 00 00 00 00 00 
  0270  00 00 00 00 00 00 00 00 00 00 00 00 00 00 00 00 
  0280  80 00 00 00 00 00 00 00 00 00 00 00 00 00 00 00 
  0290  00 00 00 00 00 00 00 00 00 00 00 00 00 00 00 00 
  02A0  00 00 00 00 00 00 00 00 00 00 00 00 00 00 00 00 
  02B0  00 00 00 00 00 00 00 00 00 00 00 00 00 00 00 00 
  02C0  00 00 00 00 00 00 00 00 00 00 00 00 00 00 00 00 
  02D0  00 00 00 00 00 00 00 00 00 00 00 00 00 00 00 00 
  02E0  00 00 00 00 00 00 00 00 00 00 00 00 00 00 00 00 
  02F0  35 00 00 00 00 00 00 00 00 00 00 00 00 00 00 00 
  0300  2F 08 00 00 00 00 00 00 00 00 00 00 00 00 00 00 
  0310  00 00 00 01 00 00 00 00 00 00 00 00 00 00 00 00 
  0320  D1 00 03 00 00 00 00 00 00 00 00 00 00 00 00 00 
  0330  00 00 01 00 00 00 00 00 00 00 00 00 00 00 00 00 
  0340  FE 00 00 00 00 00 00 00 00 00 00 00 00 00 00 00 
  0350  D8 00 01 00 00 00 00 00 00 00 00 00 00 00 00 00 
  0360  00 84 00 00 00 00 00 00 00 00 00 00 00 00 00 00 
  0370  E2 00 00 00 00 00 00 00 00 00 00 00 00 00 00 00 
  0380  00 00 00 00 00 00 00 00 00 00 00 00 00 00 00 00 
  0390  00 00 00 00 00 00 00 00 00 00 00 00 00 00 00 00 
  03A0  00 00 00 00 00 00 00 00 00 00 00 00 00 00 00 00 
  03B0  00 00 00 00 00 00 00 00 00 00 00 00 00 00 00 00 
  03C0  00 00 00 00 00 00 00 00 00 00 00 00 00 00 00 00 
  03D0  00 00 00 00 00 00 00 00 00 00 00 00 00 00 00 00 
  03E0  0A 00 00 00 00 00 00 00 00 00 00 00 00 00 00 00 
  03F0  00 00 00 00 00 00 00 00 00 00 00 00 00 00 00 00 
