------[ Versions ]------

Program Version : EVEREST v4.00.976
BenchDLL Version: 2.1.184.0

------[ CPU Info ]------

CPU Type           : 2x QuadCore Intel Core 2 Quad Q6400, 2133 MHz (8 x 267)
CPU Alias          : Kentsfield-2M
CPU Stepping       : E0
Instruction Set    : x86, x86-64, MMX, SSE, SSE2, SSE3, SSSE3
CPUID Manufacturer : GenuineIntel
CPUID CPU Name     : Genuine Intel(R) CPU @ 2.13GHz
CPUID Revision     : 000006F9h
IA Brand ID        : 00h  (Unknown)
Platform ID        : FFh  (Unknown)

------[ Logical CPU #0 ]------

allcpu: Valid

CPUID 00000000: 0000000A-756E6547-6C65746E-49656E69
CPUID 00000001: 000006F9-00040800-0004E3BD-BFEBFBFF
CPUID 00000002: 05B0B101-005657F0-00000000-2CB4307D
CPUID 00000003: 00000000-00000000-00000000-00000000
CPUID 00000004: 0C000121-01C0003F-0000003F-00000001
CPUID 00000005: 00000040-00000040-00000003-00000020
CPUID 00000006: 00000001-00000002-00000001-00000000
CPUID 00000007: 00000000-00000000-00000000-00000000
CPUID 00000008: 00000400-00000000-00000000-00000000
CPUID 00000009: 00000001-00000000-00000000-00000000
CPUID 0000000A: 07280202-00000000-00000000-00000503
CPUID 80000000: 80000008-00000000-00000000-00000000
CPUID 80000001: 00000000-00000000-00000001-20100000
CPUID 80000002: 756E6547-20656E69-65746E49-2952286C
CPUID 80000003: 55504320-20202020-20202020-20202020
CPUID 80000004: 20202020-20402020-33312E32-007A4847
CPUID 80000005: 00000000-00000000-00000000-00000000
CPUID 80000006: 00000000-00000000-08006040-00000000
CPUID 80000007: 00000000-00000000-00000000-00000000
CPUID 80000008: 00003028-00000000-00000000-00000000

------[ Logical CPU #1 ]------

allcpu: Valid

CPUID 00000000: 0000000A-756E6547-6C65746E-49656E69
CPUID 00000001: 000006F9-02040800-0004E3BD-BFEBFBFF
CPUID 00000002: 05B0B101-005657F0-00000000-2CB4307D
CPUID 00000003: 00000000-00000000-00000000-00000000
CPUID 00000004: 0C000121-01C0003F-0000003F-00000001
CPUID 00000005: 00000040-00000040-00000003-00000020
CPUID 00000006: 00000001-00000002-00000001-00000000
CPUID 00000007: 00000000-00000000-00000000-00000000
CPUID 00000008: 00000400-00000000-00000000-00000000
CPUID 00000009: 00000001-00000000-00000000-00000000
CPUID 0000000A: 07280202-00000000-00000000-00000503
CPUID 80000000: 80000008-00000000-00000000-00000000
CPUID 80000001: 00000000-00000000-00000001-20100000
CPUID 80000002: 756E6547-20656E69-65746E49-2952286C
CPUID 80000003: 55504320-20202020-20202020-20202020
CPUID 80000004: 20202020-20402020-33312E32-007A4847
CPUID 80000005: 00000000-00000000-00000000-00000000
CPUID 80000006: 00000000-00000000-08006040-00000000
CPUID 80000007: 00000000-00000000-00000000-00000000
CPUID 80000008: 00003028-00000000-00000000-00000000

------[ Logical CPU #2 ]------

allcpu: Valid

CPUID 00000000: 0000000A-756E6547-6C65746E-49656E69
CPUID 00000001: 000006F9-08040800-0004E3BD-BFEBFBFF
CPUID 00000002: 05B0B101-005657F0-00000000-2CB4307D
CPUID 00000003: 00000000-00000000-00000000-00000000
CPUID 00000004: 0C000121-01C0003F-0000003F-00000001
CPUID 00000005: 00000040-00000040-00000003-00000020
CPUID 00000006: 00000001-00000002-00000001-00000000
CPUID 00000007: 00000000-00000000-00000000-00000000
CPUID 00000008: 00000400-00000000-00000000-00000000
CPUID 00000009: 00000001-00000000-00000000-00000000
CPUID 0000000A: 07280202-00000000-00000000-00000503
CPUID 80000000: 80000008-00000000-00000000-00000000
CPUID 80000001: 00000000-00000000-00000001-20100000
CPUID 80000002: 756E6547-20656E69-65746E49-2952286C
CPUID 80000003: 55504320-20202020-20202020-20202020
CPUID 80000004: 20202020-20402020-33312E32-007A4847
CPUID 80000005: 00000000-00000000-00000000-00000000
CPUID 80000006: 00000000-00000000-08006040-00000000
CPUID 80000007: 00000000-00000000-00000000-00000000
CPUID 80000008: 00003028-00000000-00000000-00000000

------[ Logical CPU #3 ]------

allcpu: Valid

CPUID 00000000: 0000000A-756E6547-6C65746E-49656E69
CPUID 00000001: 000006F9-0A040800-0004E3BD-BFEBFBFF
CPUID 00000002: 05B0B101-005657F0-00000000-2CB4307D
CPUID 00000003: 00000000-00000000-00000000-00000000
CPUID 00000004: 0C000121-01C0003F-0000003F-00000001
CPUID 00000005: 00000040-00000040-00000003-00000020
CPUID 00000006: 00000001-00000002-00000001-00000000
CPUID 00000007: 00000000-00000000-00000000-00000000
CPUID 00000008: 00000400-00000000-00000000-00000000
CPUID 00000009: 00000001-00000000-00000000-00000000
CPUID 0000000A: 07280202-00000000-00000000-00000503
CPUID 80000000: 80000008-00000000-00000000-00000000
CPUID 80000001: 00000000-00000000-00000001-20100000
CPUID 80000002: 756E6547-20656E69-65746E49-2952286C
CPUID 80000003: 55504320-20202020-20202020-20202020
CPUID 80000004: 20202020-20402020-33312E32-007A4847
CPUID 80000005: 00000000-00000000-00000000-00000000
CPUID 80000006: 00000000-00000000-08006040-00000000
CPUID 80000007: 00000000-00000000-00000000-00000000
CPUID 80000008: 00003028-00000000-00000000-00000000

------[ Logical CPU #4 ]------

allcpu: Valid

CPUID 00000000: 0000000A-756E6547-6C65746E-49656E69
CPUID 00000001: 000006F9-01040800-0004E3BD-BFEBFBFF
CPUID 00000002: 05B0B101-005657F0-00000000-2CB4307D
CPUID 00000003: 00000000-00000000-00000000-00000000
CPUID 00000004: 0C000121-01C0003F-0000003F-00000001
CPUID 00000005: 00000040-00000040-00000003-00000020
CPUID 00000006: 00000001-00000002-00000001-00000000
CPUID 00000007: 00000000-00000000-00000000-00000000
CPUID 00000008: 00000400-00000000-00000000-00000000
CPUID 00000009: 00000001-00000000-00000000-00000000
CPUID 0000000A: 07280202-00000000-00000000-00000503
CPUID 80000000: 80000008-00000000-00000000-00000000
CPUID 80000001: 00000000-00000000-00000001-20100000
CPUID 80000002: 756E6547-20656E69-65746E49-2952286C
CPUID 80000003: 55504320-20202020-20202020-20202020
CPUID 80000004: 20202020-20402020-33312E32-007A4847
CPUID 80000005: 00000000-00000000-00000000-00000000
CPUID 80000006: 00000000-00000000-08006040-00000000
CPUID 80000007: 00000000-00000000-00000000-00000000
CPUID 80000008: 00003028-00000000-00000000-00000000

------[ Logical CPU #5 ]------

allcpu: Valid

CPUID 00000000: 0000000A-756E6547-6C65746E-49656E69
CPUID 00000001: 000006F9-03040800-0004E3BD-BFEBFBFF
CPUID 00000002: 05B0B101-005657F0-00000000-2CB4307D
CPUID 00000003: 00000000-00000000-00000000-00000000
CPUID 00000004: 0C000121-01C0003F-0000003F-00000001
CPUID 00000005: 00000040-00000040-00000003-00000020
CPUID 00000006: 00000001-00000002-00000001-00000000
CPUID 00000007: 00000000-00000000-00000000-00000000
CPUID 00000008: 00000400-00000000-00000000-00000000
CPUID 00000009: 00000001-00000000-00000000-00000000
CPUID 0000000A: 07280202-00000000-00000000-00000503
CPUID 80000000: 80000008-00000000-00000000-00000000
CPUID 80000001: 00000000-00000000-00000001-20100000
CPUID 80000002: 756E6547-20656E69-65746E49-2952286C
CPUID 80000003: 55504320-20202020-20202020-20202020
CPUID 80000004: 20202020-20402020-33312E32-007A4847
CPUID 80000005: 00000000-00000000-00000000-00000000
CPUID 80000006: 00000000-00000000-08006040-00000000
CPUID 80000007: 00000000-00000000-00000000-00000000
CPUID 80000008: 00003028-00000000-00000000-00000000

------[ Logical CPU #6 ]------

allcpu: Valid

CPUID 00000000: 0000000A-756E6547-6C65746E-49656E69
CPUID 00000001: 000006F9-09040800-0004E3BD-BFEBFBFF
CPUID 00000002: 05B0B101-005657F0-00000000-2CB4307D
CPUID 00000003: 00000000-00000000-00000000-00000000
CPUID 00000004: 0C000121-01C0003F-0000003F-00000001
CPUID 00000005: 00000040-00000040-00000003-00000020
CPUID 00000006: 00000001-00000002-00000001-00000000
CPUID 00000007: 00000000-00000000-00000000-00000000
CPUID 00000008: 00000400-00000000-00000000-00000000
CPUID 00000009: 00000001-00000000-00000000-00000000
CPUID 0000000A: 07280202-00000000-00000000-00000503
CPUID 80000000: 80000008-00000000-00000000-00000000
CPUID 80000001: 00000000-00000000-00000001-20100000
CPUID 80000002: 756E6547-20656E69-65746E49-2952286C
CPUID 80000003: 55504320-20202020-20202020-20202020
CPUID 80000004: 20202020-20402020-33312E32-007A4847
CPUID 80000005: 00000000-00000000-00000000-00000000
CPUID 80000006: 00000000-00000000-08006040-00000000
CPUID 80000007: 00000000-00000000-00000000-00000000
CPUID 80000008: 00003028-00000000-00000000-00000000

------[ Logical CPU #7 ]------

allcpu: Valid

CPUID 00000000: 0000000A-756E6547-6C65746E-49656E69
CPUID 00000001: 000006F9-0B040800-0004E3BD-BFEBFBFF
CPUID 00000002: 05B0B101-005657F0-00000000-2CB4307D
CPUID 00000003: 00000000-00000000-00000000-00000000
CPUID 00000004: 0C000121-01C0003F-0000003F-00000001
CPUID 00000005: 00000040-00000040-00000003-00000020
CPUID 00000006: 00000001-00000002-00000001-00000000
CPUID 00000007: 00000000-00000000-00000000-00000000
CPUID 00000008: 00000400-00000000-00000000-00000000
CPUID 00000009: 00000001-00000000-00000000-00000000
CPUID 0000000A: 07280202-00000000-00000000-00000503
CPUID 80000000: 80000008-00000000-00000000-00000000
CPUID 80000001: 00000000-00000000-00000001-20100000
CPUID 80000002: 756E6547-20656E69-65746E49-2952286C
CPUID 80000003: 55504320-20202020-20202020-20202020
CPUID 80000004: 20202020-20402020-33312E32-007A4847
CPUID 80000005: 00000000-00000000-00000000-00000000
CPUID 80000006: 00000000-00000000-08006040-00000000
CPUID 80000007: 00000000-00000000-00000000-00000000
CPUID 80000008: 00003028-00000000-00000000-00000000

------[ MSR Registers ]------

MSR 00000017: 000C-0000-8230-0820
MSR 0000002A: 0000-0000-C208-149E
MSR 0000008B: 0000-0084-0000-0000
MSR 000000CD: 0000-0000-0000-0800
MSR 000000E7: 0000-006E-B4ED-C738
MSR 000000E8: 0000-006E-802F-44A4
MSR 000000EE: 0500-0000-C37D-4B01
MSR 0000011E: 0000-0000-BE70-2107
MSR 00000198: 0820-0820-0600-0820
MSR 00000199: 0000-0000-0000-0820
MSR 0000019A: 0000-0000-0000-0002
MSR 0000019B: 0000-0000-0000-0000
MSR 0000019C: 0000-0000-8834-0000
MSR 0000019D: 0000-0000-0000-061B
MSR 000001A0: 0000-0060-62B5-2489

PerformanceFrequency = 2127930000
