------[ Versions ]------

Program Version : AIDA64 v5.75.3945 Beta
BenchDLL Version: 4.2.685-x64

------[ CPU Info ]------

CPU Type          : QuadCore , 466 MHz (24 x 19)
CPU Alias         : Apollo Lake
Instruction Set   : x86, x86-64, MMX, SSE, SSE2, SSE3, SSSE3, SSE4.1, SSE4.2, AES, SHA
CPUID Manufacturer: GenuineIntel
CPUID CPU Name    : Intel(R) Pentium(R) CPU N4200 @ 1.10GHz
CPUID Revision    : 000506C9h
IA Brand ID       : 00h  (Unknown)
Platform ID       : FFh  (Unknown)
HTT / CMP Units   : 0 / 4
Max. NUMA Node    : 0

Tjmax Temperature    : 105 Celsius
HTC Temperature Limit: 0 Celsius
CPU TDP              : 6 W
CPU TDC              : 21 A
CPU Max Power Limit  : Unlimited Power / Unlimited Time

------[ Logical CPU #0 ]------

allcpu: Package 0 / Core 0 / Thread 0: Valid

CPUID 00000000: 00000015-756E6547-6C65746E-49656E69 [GenuineIntel]
CPUID 00000001: 000506C9-00200800-4FF8EBBF-BFEBFBFF
CPUID 00000002: 6164A001-0000FFC4-00000000-00000000
CPUID 00000003: 00000000-00000000-00000000-00000000
CPUID 00000004: 3C000121-0140003F-0000003F-00000001 [SL 00]
CPUID 00000004: 3C000122-01C0003F-0000003F-00000001 [SL 01]
CPUID 00000004: 3C00C143-03C0003F-000003FF-00000001 [SL 02]
CPUID 00000005: 00000040-00000040-00000003-11242020
CPUID 00000006: 00000055-00000002-00000001-00000000
CPUID 00000007: 00000000-2294E283-00000000-00000000
CPUID 00000008: 00000000-00000000-00000000-00000000
CPUID 00000009: 00000000-00000000-00000000-00000000
CPUID 0000000A: 07300404-00000000-00000000-00000603
CPUID 0000000B: 00000001-00000001-00000100-00000000 [SL 00]
CPUID 0000000B: 00000005-00000004-00000201-00000000 [SL 01]
CPUID 0000000C: 00000000-00000000-00000000-00000000
CPUID 0000000D: 0000001B-00000440-00000440-00000000 [SL 00]
CPUID 0000000D: 0000000F-000002C0-00000100-00000000 [SL 01]
CPUID 0000000E: 00000000-00000000-00000000-00000000
CPUID 0000000F: 00000000-00000000-00000000-00000000 [SL 00]
CPUID 0000000F: 00000000-00000000-00000000-00000000 [SL 01]
CPUID 00000010: 00000000-00000004-00000000-00000000 [SL 00]
CPUID 00000010: 00000000-00000000-00000000-00000000 [SL 01]
CPUID 00000011: 00000000-00000000-00000000-00000000
CPUID 00000012: 00000000-00000000-00000000-00000000 [SL 00]
CPUID 00000012: 00000000-00000000-00000000-00000000 [SL 01]
CPUID 00000013: 00000000-00000000-00000000-00000000
CPUID 00000014: 00000001-0000000F-80000007-00000000 [SL 00]
CPUID 00000014: 02490002-003FFFFF-00000000-00000000 [SL 01]
CPUID 00000015: 00000003-000000AB-0124F800-00000000 [57.00x]
CPUID 80000000: 80000008-00000000-00000000-00000000
CPUID 80000001: 00000000-00000000-00000101-2C100000
CPUID 80000002: 65746E49-2952286C-6E655020-6D756974 [Intel(R) Pentium]
CPUID 80000003: 20295228-20555043-3032344E-20402030 [(R) CPU N4200 @ ]
CPUID 80000004: 30312E31-007A4847-00000000-00000000 [1.10GHz]
CPUID 80000005: 00000000-00000000-00000000-00000000
CPUID 80000006: 00000000-00000000-04008040-00000000
CPUID 80000007: 00000000-00000000-00000000-00000100
CPUID 80000008: 00003027-00000000-00000000-00000000

L1    Data Cache:    24 KB,  6-way Associative, 64-byte Line
L1  Instr. Cache:    32 KB,  8-way Associative, 64-byte Line
L2 Unified Cache:     1 MB, 16-way Associative, 64-byte Line

------[ Logical CPU #1 ]------

allcpu: Package 0 / Core 1 / Thread 0: Valid

CPUID 00000000: 00000015-756E6547-6C65746E-49656E69 [GenuineIntel]
CPUID 00000001: 000506C9-02200800-4FF8EBBF-BFEBFBFF
CPUID 00000002: 6164A001-0000FFC4-00000000-00000000
CPUID 00000003: 00000000-00000000-00000000-00000000
CPUID 00000004: 3C000121-0140003F-0000003F-00000001 [SL 00]
CPUID 00000004: 3C000122-01C0003F-0000003F-00000001 [SL 01]
CPUID 00000004: 3C00C143-03C0003F-000003FF-00000001 [SL 02]
CPUID 00000005: 00000040-00000040-00000003-11242020
CPUID 00000006: 00000055-00000002-00000001-00000000
CPUID 00000007: 00000000-2294E283-00000000-00000000
CPUID 00000008: 00000000-00000000-00000000-00000000
CPUID 00000009: 00000000-00000000-00000000-00000000
CPUID 0000000A: 07300404-00000000-00000000-00000603
CPUID 0000000B: 00000001-00000001-00000100-00000002 [SL 00]
CPUID 0000000B: 00000005-00000004-00000201-00000002 [SL 01]
CPUID 0000000C: 00000000-00000000-00000000-00000000
CPUID 0000000D: 0000001B-00000440-00000440-00000000 [SL 00]
CPUID 0000000D: 0000000F-000002C0-00000100-00000000 [SL 01]
CPUID 0000000E: 00000000-00000000-00000000-00000000
CPUID 0000000F: 00000000-00000000-00000000-00000000 [SL 00]
CPUID 0000000F: 00000000-00000000-00000000-00000000 [SL 01]
CPUID 00000010: 00000000-00000004-00000000-00000000 [SL 00]
CPUID 00000010: 00000000-00000000-00000000-00000000 [SL 01]
CPUID 00000011: 00000000-00000000-00000000-00000000
CPUID 00000012: 00000000-00000000-00000000-00000000 [SL 00]
CPUID 00000012: 00000000-00000000-00000000-00000000 [SL 01]
CPUID 00000013: 00000000-00000000-00000000-00000000
CPUID 00000014: 00000001-0000000F-80000007-00000000 [SL 00]
CPUID 00000014: 02490002-003FFFFF-00000000-00000000 [SL 01]
CPUID 00000015: 00000003-000000AB-0124F800-00000000 [57.00x]
CPUID 80000000: 80000008-00000000-00000000-00000000
CPUID 80000001: 00000000-00000000-00000101-2C100000
CPUID 80000002: 65746E49-2952286C-6E655020-6D756974 [Intel(R) Pentium]
CPUID 80000003: 20295228-20555043-3032344E-20402030 [(R) CPU N4200 @ ]
CPUID 80000004: 30312E31-007A4847-00000000-00000000 [1.10GHz]
CPUID 80000005: 00000000-00000000-00000000-00000000
CPUID 80000006: 00000000-00000000-04008040-00000000
CPUID 80000007: 00000000-00000000-00000000-00000100
CPUID 80000008: 00003027-00000000-00000000-00000000

L1    Data Cache:    24 KB,  6-way Associative, 64-byte Line
L1  Instr. Cache:    32 KB,  8-way Associative, 64-byte Line
L2 Unified Cache:     1 MB, 16-way Associative, 64-byte Line

------[ Logical CPU #2 ]------

allcpu: Package 0 / Core 2 / Thread 0: Valid

CPUID 00000000: 00000015-756E6547-6C65746E-49656E69 [GenuineIntel]
CPUID 00000001: 000506C9-04200800-4FF8EBBF-BFEBFBFF
CPUID 00000002: 6164A001-0000FFC4-00000000-00000000
CPUID 00000003: 00000000-00000000-00000000-00000000
CPUID 00000004: 3C000121-0140003F-0000003F-00000001 [SL 00]
CPUID 00000004: 3C000122-01C0003F-0000003F-00000001 [SL 01]
CPUID 00000004: 3C00C143-03C0003F-000003FF-00000001 [SL 02]
CPUID 00000005: 00000040-00000040-00000003-11242020
CPUID 00000006: 00000055-00000002-00000001-00000000
CPUID 00000007: 00000000-2294E283-00000000-00000000
CPUID 00000008: 00000000-00000000-00000000-00000000
CPUID 00000009: 00000000-00000000-00000000-00000000
CPUID 0000000A: 07300404-00000000-00000000-00000603
CPUID 0000000B: 00000001-00000001-00000100-00000004 [SL 00]
CPUID 0000000B: 00000005-00000004-00000201-00000004 [SL 01]
CPUID 0000000C: 00000000-00000000-00000000-00000000
CPUID 0000000D: 0000001B-00000440-00000440-00000000 [SL 00]
CPUID 0000000D: 0000000F-000002C0-00000100-00000000 [SL 01]
CPUID 0000000E: 00000000-00000000-00000000-00000000
CPUID 0000000F: 00000000-00000000-00000000-00000000 [SL 00]
CPUID 0000000F: 00000000-00000000-00000000-00000000 [SL 01]
CPUID 00000010: 00000000-00000004-00000000-00000000 [SL 00]
CPUID 00000010: 00000000-00000000-00000000-00000000 [SL 01]
CPUID 00000011: 00000000-00000000-00000000-00000000
CPUID 00000012: 00000000-00000000-00000000-00000000 [SL 00]
CPUID 00000012: 00000000-00000000-00000000-00000000 [SL 01]
CPUID 00000013: 00000000-00000000-00000000-00000000
CPUID 00000014: 00000001-0000000F-80000007-00000000 [SL 00]
CPUID 00000014: 02490002-003FFFFF-00000000-00000000 [SL 01]
CPUID 00000015: 00000003-000000AB-0124F800-00000000 [57.00x]
CPUID 80000000: 80000008-00000000-00000000-00000000
CPUID 80000001: 00000000-00000000-00000101-2C100000
CPUID 80000002: 65746E49-2952286C-6E655020-6D756974 [Intel(R) Pentium]
CPUID 80000003: 20295228-20555043-3032344E-20402030 [(R) CPU N4200 @ ]
CPUID 80000004: 30312E31-007A4847-00000000-00000000 [1.10GHz]
CPUID 80000005: 00000000-00000000-00000000-00000000
CPUID 80000006: 00000000-00000000-04008040-00000000
CPUID 80000007: 00000000-00000000-00000000-00000100
CPUID 80000008: 00003027-00000000-00000000-00000000

L1    Data Cache:    24 KB,  6-way Associative, 64-byte Line
L1  Instr. Cache:    32 KB,  8-way Associative, 64-byte Line
L2 Unified Cache:     1 MB, 16-way Associative, 64-byte Line

------[ Logical CPU #3 ]------

allcpu: Package 0 / Core 3 / Thread 0: Valid

CPUID 00000000: 00000015-756E6547-6C65746E-49656E69 [GenuineIntel]
CPUID 00000001: 000506C9-06200800-4FF8EBBF-BFEBFBFF
CPUID 00000002: 6164A001-0000FFC4-00000000-00000000
CPUID 00000003: 00000000-00000000-00000000-00000000
CPUID 00000004: 3C000121-0140003F-0000003F-00000001 [SL 00]
CPUID 00000004: 3C000122-01C0003F-0000003F-00000001 [SL 01]
CPUID 00000004: 3C00C143-03C0003F-000003FF-00000001 [SL 02]
CPUID 00000005: 00000040-00000040-00000003-11242020
CPUID 00000006: 00000055-00000002-00000001-00000000
CPUID 00000007: 00000000-2294E283-00000000-00000000
CPUID 00000008: 00000000-00000000-00000000-00000000
CPUID 00000009: 00000000-00000000-00000000-00000000
CPUID 0000000A: 07300404-00000000-00000000-00000603
CPUID 0000000B: 00000001-00000001-00000100-00000006 [SL 00]
CPUID 0000000B: 00000005-00000004-00000201-00000006 [SL 01]
CPUID 0000000C: 00000000-00000000-00000000-00000000
CPUID 0000000D: 0000001B-00000440-00000440-00000000 [SL 00]
CPUID 0000000D: 0000000F-000002C0-00000100-00000000 [SL 01]
CPUID 0000000E: 00000000-00000000-00000000-00000000
CPUID 0000000F: 00000000-00000000-00000000-00000000 [SL 00]
CPUID 0000000F: 00000000-00000000-00000000-00000000 [SL 01]
CPUID 00000010: 00000000-00000004-00000000-00000000 [SL 00]
CPUID 00000010: 00000000-00000000-00000000-00000000 [SL 01]
CPUID 00000011: 00000000-00000000-00000000-00000000
CPUID 00000012: 00000000-00000000-00000000-00000000 [SL 00]
CPUID 00000012: 00000000-00000000-00000000-00000000 [SL 01]
CPUID 00000013: 00000000-00000000-00000000-00000000
CPUID 00000014: 00000001-0000000F-80000007-00000000 [SL 00]
CPUID 00000014: 02490002-003FFFFF-00000000-00000000 [SL 01]
CPUID 00000015: 00000003-000000AB-0124F800-00000000 [57.00x]
CPUID 80000000: 80000008-00000000-00000000-00000000
CPUID 80000001: 00000000-00000000-00000101-2C100000
CPUID 80000002: 65746E49-2952286C-6E655020-6D756974 [Intel(R) Pentium]
CPUID 80000003: 20295228-20555043-3032344E-20402030 [(R) CPU N4200 @ ]
CPUID 80000004: 30312E31-007A4847-00000000-00000000 [1.10GHz]
CPUID 80000005: 00000000-00000000-00000000-00000000
CPUID 80000006: 00000000-00000000-04008040-00000000
CPUID 80000007: 00000000-00000000-00000000-00000100
CPUID 80000008: 00003027-00000000-00000000-00000000

L1    Data Cache:    24 KB,  6-way Associative, 64-byte Line
L1  Instr. Cache:    32 KB,  8-way Associative, 64-byte Line
L2 Unified Cache:     1 MB, 16-way Associative, 64-byte Line

------[ All CPUs ]------

CPU   0: APICID   0 / Package 0 / Core  0 / Thread 0: Valid
CPU   1: APICID   2 / Package 0 / Core  1 / Thread 0: Valid
CPU   2: APICID   4 / Package 0 / Core  2 / Thread 0: Valid
CPU   3: APICID   6 / Package 0 / Core  3 / Thread 0: Valid

------[ MSR Registers ]------

MSR 00000017: 0000-0000-0000-0000 [PlatID = 0]
MSR 0000001B: 0000-0000-FEE0-0D00
MSR 0000002A: 0000-0000-0000-0000
MSR 00000035: 0000-0000-0004-0004
MSR 0000008B: 0000-0018-0000-0000
MSR 000000CD: < FAILED >
MSR 000000CE: 0004-0821-F001-0B00 [eD = 0]
MSR 000000E7: 0000-0000-2C9E-78A5 [S200]
MSR 000000E7: 0000-0000-2D62-61F1 [S200]
MSR 000000E7: 0000-0000-2E2A-5784
MSR 000000E8: 0000-0000-2E17-B704 [S200]
MSR 000000E8: 0000-0000-2E19-8A63 [S200]
MSR 000000E8: 0000-0000-2E29-2BDA
MSR 000000EE: < FAILED >
MSR 0000011E: < FAILED >
MSR 00000194: < FAILED >
MSR 00000198: 0000-268F-0000-0B00 [S200]
MSR 00000198: 0000-268F-0000-0B00 [S200]
MSR 00000198: 0000-268F-0000-0B00
MSR 00000199: 0000-0000-0000-1900
MSR 0000019A: 0000-0000-0000-0000
MSR 0000019B: 0000-0000-0000-0000
MSR 0000019C: 0000-0000-8830-0000 [S200]
MSR 0000019C: 0000-0000-8830-0000 [S200]
MSR 0000019C: 0000-0000-8830-0000
MSR 0000019D: 0000-0000-0000-0000
MSR 000001A0: 0000-0040-0085-0089
MSR 000001A2: 0000-0000-0869-0000
MSR 000001A4: 0000-0000-0000-0000
MSR 000001AA: 0000-0000-0000-0000
MSR 000001AC: < FAILED >
MSR 000001AD: 0000-0000-1818-1819
MSR 000001B0: < FAILED >
MSR 000001B1: 0000-0000-882D-0800
MSR 000001B2: 0000-0000-0000-0000
MSR 000001FC: 0000-0000-0020-005D
MSR 00000300: < FAILED >
MSR 0000030A: 0000-0000-00FC-A991 [S200]
MSR 0000030A: 0000-0000-00FC-A991 [S200]
MSR 0000030A: 0000-0000-00FC-A991
MSR 0000030B: 0000-0000-00FB-F42D [S200]
MSR 0000030B: 0000-0000-00FB-F42D [S200]
MSR 0000030B: 0000-0000-00FB-F42D
MSR 00000480: 00DA-0400-0000-0011
MSR 00000481: 0000-00FF-0000-0016
MSR 00000482: FFF9-FFFE-0401-E172
MSR 00000483: 01FF-FFFF-0003-6DFF
MSR 00000484: 0003-FFFF-0000-11FF
MSR 00000485: 0000-0000-6004-C1E7
MSR 00000486: 0000-0000-8000-0021
MSR 00000487: 0000-0000-FFFF-FFFF
MSR 00000488: 0000-0000-0000-2000
MSR 00000489: 0000-0000-0035-27FF
MSR 0000048A: 0000-0000-0000-002E
MSR 0000048B: 001D-6FFF-0000-0000
MSR 0000048C: 0000-0F01-0633-4141
MSR 0000048D: 0000-00FF-0000-0016
MSR 0000048E: FFF9-FFFE-0400-6172
MSR 0000048F: 01FF-FFFF-0003-6DFB
MSR 00000490: 0003-FFFF-0000-11FB
MSR 00000601: 0000-0000-0000-00A8
MSR 00000602: < FAILED >
MSR 00000603: 0000-0000-0008-FF0B
MSR 00000604: < FAILED >
MSR 00000606: 0000-0000-330A-0E08
MSR 0000060A: 0000-0000-0000-0000
MSR 0000060B: 0000-0000-0000-8893
MSR 0000060C: 0000-0000-0000-8893
MSR 0000060D: 0000-0000-6052-0E8D
MSR 00000610: 0000-0000-0000-0000
MSR 00000611: 0000-0000-0364-A3EE [S200]
MSR 00000611: 0000-0000-0364-E4BA [S200]
MSR 00000611: 0000-0000-0365-24B1
MSR 00000613: 0000-0000-0000-0000
MSR 00000614: 0000-0000-0000-0600
MSR 00000618: 0000-0000-0000-0000
MSR 00000619: 0000-0000-006D-E3DF [S200]
MSR 00000619: 0000-0000-006D-E967 [S200]
MSR 00000619: 0000-0000-006D-EEEE
MSR 0000061B: 0000-0000-0000-58F0
MSR 0000061C: < FAILED >
MSR 00000638: < FAILED >
MSR 00000639: 0000-0000-004F-A53D [S200]
MSR 00000639: 0000-0000-004F-A56E [S200]
MSR 00000639: 0000-0000-004F-A5CB
MSR 0000063A: < FAILED >
MSR 0000063B: < FAILED >
MSR 00000640: < FAILED >
MSR 00000641: 0000-0000-0585-9EFD [S200]
MSR 00000641: 0000-0000-0586-2031 [S200]
MSR 00000641: 0000-0000-0586-A156
MSR 00000642: < FAILED >
MSR 00000660: 0000-0002-1AD3-5BAE
MSR 00000661: < FAILED >
MSR 00000662: < FAILED >
MSR 00000663: < FAILED >
MSR 00000664: < FAILED >
MSR 00000665: < FAILED >
MSR 00000666: < FAILED >
MSR 00000667: < FAILED >
MSR 00000668: < FAILED >
MSR 00000669: < FAILED >
MSR 0000066A: < FAILED >
MSR 0000066B: < FAILED >
MSR 0000066C: < FAILED >
MSR 0000066D: < FAILED >
MSR 0000066E: < FAILED >
MSR 0000066F: < FAILED >
MSR 00000670: < FAILED >
MSR 00000671: < FAILED >
MSR 00000672: < FAILED >
MSR 00000673: < FAILED >
MSR 00000674: < FAILED >
MSR 00000675: < FAILED >
MSR 00000676: < FAILED >
MSR 00000677: < FAILED >
MSR 00000832: 0000-0000-0002-00D1
MSR 00000838: 0000-0000-0000-0928
MSR 00000839: 0000-0000-0000-08CA
MSR 0000083E: 0000-0000-0000-000A

PerformanceFrequency = 1068750

CPU Clock M.Method = 8  (APIC SNB)
PM Timer Address   = 1032  (0408h)

APIC Clock = 19.20 MHz  (AT = 10057 / TT = 15001 / try = 1 / SKL = 0.00 MHz)
APIC Clock = 19.20 MHz  (AT = 10057 / TT = 15001 / try = 1 / SKL = 0.00 MHz)
APIC Clock = 19.20 MHz  (AT = 10057 / TT = 15001 / try = 1 / SKL = 0.00 MHz)
APIC Clock = 19.20 MHz  (AT = 10057 / TT = 15001 / try = 1 / SKL = 0.00 MHz)
APIC Clock = 19.20 MHz  (AT = 10057 / TT = 15001 / try = 1 / SKL = 0.00 MHz)

INTPERFCTR2 = 1097.48 MHz / INTPERFCTR1 (TSC) = 1094.41 MHz
INTPERFCTR2 = 1097.46 MHz / INTPERFCTR1 (TSC) = 1094.39 MHz
INTPERFCTR2 = 1097.48 MHz / INTPERFCTR1 (TSC) = 1094.41 MHz
INTPERFCTR2 = 1097.46 MHz / INTPERFCTR1 (TSC) = 1094.38 MHz
INTPERFCTR2 = 1097.45 MHz / INTPERFCTR1 (TSC) = 1094.38 MHz
