------[ Versions ]------

Program Version : AIDA64 v4.00.2723 Beta
BenchDLL Version: 4.1.591-x64

------[ CPU Info ]------

CPU Type          : OctalCore Intel Atom C2750, 2400 MHz (24 x 100)
CPU Alias         : Avoton
CPU Platform      : FCBGA1283
CPU Stepping      : B0
Instruction Set   : x86, x86-64, MMX, SSE, SSE2, SSE3, SSSE3, SSE4.1, SSE4.2, AES
CPUID Manufacturer: GenuineIntel
CPUID CPU Name    : Intel(R) Atom(TM) CPU C2750 @ 2.40GHz
CPUID Revision    : 000406D8h
IA Brand ID       : 00h  (Unknown)
Platform ID       : 33h  (FCBGA1283)
HTT / CMP Units   : 0 / 8
Max. NUMA Node    : 0

Tjmax Temperature          : 98 Celsius
HTC Temperature Limit      : 0 Celsius
CPU Max Power Limit        : -1 W / -1000000.00 us
CPU Power Limit 1 (Long)   : 312.5 W / 10.00 sec  (Unlocked)
CPU Power Limit 2 (Short)  : 375 W / 9.77 ms  (Unlocked)
Max Turbo Boost Multipliers: 1C: 26x, 2C: 26x, 3C: 26x, 4C: 26x

------[ Logical CPU #0 ]------

allcpu: Package 0 / Core 0 / Thread 0: Valid

CPUID 00000000: 0000000B-756E6547-6C65746E-49656E69 [GenuineIntel]
CPUID 00000001: 000406D8-00100800-43D8E3BF-BFEBFBFF
CPUID 00000002: 61B3A001-0000FFC2-00000000-00000000
CPUID 00000003: 00000000-00000000-00000000-00000000
CPUID 00000004: 1C000121-0140003F-0000003F-00000001
CPUID 00000004: 1C000122-01C0003F-0000003F-00000001
CPUID 00000004: 1C00C143-03C0003F-000003FF-00000001
CPUID 00000005: 00000040-00000040-00000003-03000020
CPUID 00000006: 00000005-00000002-00000009-00000000
CPUID 00000007: 00000000-00002282-00000000-00000000
CPUID 00000008: 00000000-00000000-00000000-00000000
CPUID 00000009: 00000000-00000000-00000000-00000000
CPUID 0000000A: 07280203-00000000-00000000-00004503
CPUID 0000000B: 00000001-00000001-00000100-00000000
CPUID 0000000B: 00000004-00000008-00000201-00000000
CPUID 80000000: 80000008-00000000-00000000-00000000
CPUID 80000001: 00000000-00000000-00000101-28100000
CPUID 80000002: 20202020-20202020-65746E49-2952286C [        Intel(R)]
CPUID 80000003: 6F744120-4D54286D-50432029-43202055 [ Atom(TM) CPU  C]
CPUID 80000004: 30353732-20402020-30342E32-007A4847 [2750  @ 2.40GHz]
CPUID 80000005: 00000000-00000000-00000000-00000000
CPUID 80000006: 00000000-00000000-04008040-00000000
CPUID 80000007: 00000000-00000000-00000000-00000100
CPUID 80000008: 00003024-00000000-00000000-00000000

L1    Data Cache:     24 KB,  6-way Associative, 64-byte Line
L1  Instr. Cache:     32 KB,  8-way Associative, 64-byte Line
L2 Unified Cache:   1024 KB, 16-way Associative, 64-byte Line

------[ Logical CPU #1 ]------

allcpu: Package 0 / Core 1 / Thread 0: Valid

CPUID 00000000: 0000000B-756E6547-6C65746E-49656E69 [GenuineIntel]
CPUID 00000001: 000406D8-02100800-43D8E3BF-BFEBFBFF
CPUID 00000002: 61B3A001-0000FFC2-00000000-00000000
CPUID 00000003: 00000000-00000000-00000000-00000000
CPUID 00000004: 1C000121-0140003F-0000003F-00000001
CPUID 00000004: 1C000122-01C0003F-0000003F-00000001
CPUID 00000004: 1C00C143-03C0003F-000003FF-00000001
CPUID 00000005: 00000040-00000040-00000003-03000020
CPUID 00000006: 00000005-00000002-00000009-00000000
CPUID 00000007: 00000000-00002282-00000000-00000000
CPUID 00000008: 00000000-00000000-00000000-00000000
CPUID 00000009: 00000000-00000000-00000000-00000000
CPUID 0000000A: 07280203-00000000-00000000-00004503
CPUID 0000000B: 00000001-00000001-00000100-00000002
CPUID 0000000B: 00000004-00000008-00000201-00000002
CPUID 80000000: 80000008-00000000-00000000-00000000
CPUID 80000001: 00000000-00000000-00000101-28100000
CPUID 80000002: 20202020-20202020-65746E49-2952286C [        Intel(R)]
CPUID 80000003: 6F744120-4D54286D-50432029-43202055 [ Atom(TM) CPU  C]
CPUID 80000004: 30353732-20402020-30342E32-007A4847 [2750  @ 2.40GHz]
CPUID 80000005: 00000000-00000000-00000000-00000000
CPUID 80000006: 00000000-00000000-04008040-00000000
CPUID 80000007: 00000000-00000000-00000000-00000100
CPUID 80000008: 00003024-00000000-00000000-00000000

L1    Data Cache:     24 KB,  6-way Associative, 64-byte Line
L1  Instr. Cache:     32 KB,  8-way Associative, 64-byte Line
L2 Unified Cache:   1024 KB, 16-way Associative, 64-byte Line

------[ Logical CPU #2 ]------

allcpu: Package 0 / Core 2 / Thread 0: Valid

CPUID 00000000: 0000000B-756E6547-6C65746E-49656E69 [GenuineIntel]
CPUID 00000001: 000406D8-04100800-43D8E3BF-BFEBFBFF
CPUID 00000002: 61B3A001-0000FFC2-00000000-00000000
CPUID 00000003: 00000000-00000000-00000000-00000000
CPUID 00000004: 1C000121-0140003F-0000003F-00000001
CPUID 00000004: 1C000122-01C0003F-0000003F-00000001
CPUID 00000004: 1C00C143-03C0003F-000003FF-00000001
CPUID 00000005: 00000040-00000040-00000003-03000020
CPUID 00000006: 00000005-00000002-00000009-00000000
CPUID 00000007: 00000000-00002282-00000000-00000000
CPUID 00000008: 00000000-00000000-00000000-00000000
CPUID 00000009: 00000000-00000000-00000000-00000000
CPUID 0000000A: 07280203-00000000-00000000-00004503
CPUID 0000000B: 00000001-00000001-00000100-00000004
CPUID 0000000B: 00000004-00000008-00000201-00000004
CPUID 80000000: 80000008-00000000-00000000-00000000
CPUID 80000001: 00000000-00000000-00000101-28100000
CPUID 80000002: 20202020-20202020-65746E49-2952286C [        Intel(R)]
CPUID 80000003: 6F744120-4D54286D-50432029-43202055 [ Atom(TM) CPU  C]
CPUID 80000004: 30353732-20402020-30342E32-007A4847 [2750  @ 2.40GHz]
CPUID 80000005: 00000000-00000000-00000000-00000000
CPUID 80000006: 00000000-00000000-04008040-00000000
CPUID 80000007: 00000000-00000000-00000000-00000100
CPUID 80000008: 00003024-00000000-00000000-00000000

L1    Data Cache:     24 KB,  6-way Associative, 64-byte Line
L1  Instr. Cache:     32 KB,  8-way Associative, 64-byte Line
L2 Unified Cache:   1024 KB, 16-way Associative, 64-byte Line

------[ Logical CPU #3 ]------

allcpu: Package 0 / Core 3 / Thread 0: Valid

CPUID 00000000: 0000000B-756E6547-6C65746E-49656E69 [GenuineIntel]
CPUID 00000001: 000406D8-06100800-43D8E3BF-BFEBFBFF
CPUID 00000002: 61B3A001-0000FFC2-00000000-00000000
CPUID 00000003: 00000000-00000000-00000000-00000000
CPUID 00000004: 1C000121-0140003F-0000003F-00000001
CPUID 00000004: 1C000122-01C0003F-0000003F-00000001
CPUID 00000004: 1C00C143-03C0003F-000003FF-00000001
CPUID 00000005: 00000040-00000040-00000003-03000020
CPUID 00000006: 00000005-00000002-00000009-00000000
CPUID 00000007: 00000000-00002282-00000000-00000000
CPUID 00000008: 00000000-00000000-00000000-00000000
CPUID 00000009: 00000000-00000000-00000000-00000000
CPUID 0000000A: 07280203-00000000-00000000-00004503
CPUID 0000000B: 00000001-00000001-00000100-00000006
CPUID 0000000B: 00000004-00000008-00000201-00000006
CPUID 80000000: 80000008-00000000-00000000-00000000
CPUID 80000001: 00000000-00000000-00000101-28100000
CPUID 80000002: 20202020-20202020-65746E49-2952286C [        Intel(R)]
CPUID 80000003: 6F744120-4D54286D-50432029-43202055 [ Atom(TM) CPU  C]
CPUID 80000004: 30353732-20402020-30342E32-007A4847 [2750  @ 2.40GHz]
CPUID 80000005: 00000000-00000000-00000000-00000000
CPUID 80000006: 00000000-00000000-04008040-00000000
CPUID 80000007: 00000000-00000000-00000000-00000100
CPUID 80000008: 00003024-00000000-00000000-00000000

L1    Data Cache:     24 KB,  6-way Associative, 64-byte Line
L1  Instr. Cache:     32 KB,  8-way Associative, 64-byte Line
L2 Unified Cache:   1024 KB, 16-way Associative, 64-byte Line

------[ Logical CPU #4 ]------

allcpu: Package 0 / Core 4 / Thread 0: Valid

CPUID 00000000: 0000000B-756E6547-6C65746E-49656E69 [GenuineIntel]
CPUID 00000001: 000406D8-08100800-43D8E3BF-BFEBFBFF
CPUID 00000002: 61B3A001-0000FFC2-00000000-00000000
CPUID 00000003: 00000000-00000000-00000000-00000000
CPUID 00000004: 1C000121-0140003F-0000003F-00000001
CPUID 00000004: 1C000122-01C0003F-0000003F-00000001
CPUID 00000004: 1C00C143-03C0003F-000003FF-00000001
CPUID 00000005: 00000040-00000040-00000003-03000020
CPUID 00000006: 00000005-00000002-00000009-00000000
CPUID 00000007: 00000000-00002282-00000000-00000000
CPUID 00000008: 00000000-00000000-00000000-00000000
CPUID 00000009: 00000000-00000000-00000000-00000000
CPUID 0000000A: 07280203-00000000-00000000-00004503
CPUID 0000000B: 00000001-00000001-00000100-00000008
CPUID 0000000B: 00000004-00000008-00000201-00000008
CPUID 80000000: 80000008-00000000-00000000-00000000
CPUID 80000001: 00000000-00000000-00000101-28100000
CPUID 80000002: 20202020-20202020-65746E49-2952286C [        Intel(R)]
CPUID 80000003: 6F744120-4D54286D-50432029-43202055 [ Atom(TM) CPU  C]
CPUID 80000004: 30353732-20402020-30342E32-007A4847 [2750  @ 2.40GHz]
CPUID 80000005: 00000000-00000000-00000000-00000000
CPUID 80000006: 00000000-00000000-04008040-00000000
CPUID 80000007: 00000000-00000000-00000000-00000100
CPUID 80000008: 00003024-00000000-00000000-00000000

L1    Data Cache:     24 KB,  6-way Associative, 64-byte Line
L1  Instr. Cache:     32 KB,  8-way Associative, 64-byte Line
L2 Unified Cache:   1024 KB, 16-way Associative, 64-byte Line

------[ Logical CPU #5 ]------

allcpu: Package 0 / Core 5 / Thread 0: Valid

CPUID 00000000: 0000000B-756E6547-6C65746E-49656E69 [GenuineIntel]
CPUID 00000001: 000406D8-0A100800-43D8E3BF-BFEBFBFF
CPUID 00000002: 61B3A001-0000FFC2-00000000-00000000
CPUID 00000003: 00000000-00000000-00000000-00000000
CPUID 00000004: 1C000121-0140003F-0000003F-00000001
CPUID 00000004: 1C000122-01C0003F-0000003F-00000001
CPUID 00000004: 1C00C143-03C0003F-000003FF-00000001
CPUID 00000005: 00000040-00000040-00000003-03000020
CPUID 00000006: 00000005-00000002-00000009-00000000
CPUID 00000007: 00000000-00002282-00000000-00000000
CPUID 00000008: 00000000-00000000-00000000-00000000
CPUID 00000009: 00000000-00000000-00000000-00000000
CPUID 0000000A: 07280203-00000000-00000000-00004503
CPUID 0000000B: 00000001-00000001-00000100-0000000A
CPUID 0000000B: 00000004-00000008-00000201-0000000A
CPUID 80000000: 80000008-00000000-00000000-00000000
CPUID 80000001: 00000000-00000000-00000101-28100000
CPUID 80000002: 20202020-20202020-65746E49-2952286C [        Intel(R)]
CPUID 80000003: 6F744120-4D54286D-50432029-43202055 [ Atom(TM) CPU  C]
CPUID 80000004: 30353732-20402020-30342E32-007A4847 [2750  @ 2.40GHz]
CPUID 80000005: 00000000-00000000-00000000-00000000
CPUID 80000006: 00000000-00000000-04008040-00000000
CPUID 80000007: 00000000-00000000-00000000-00000100
CPUID 80000008: 00003024-00000000-00000000-00000000

L1    Data Cache:     24 KB,  6-way Associative, 64-byte Line
L1  Instr. Cache:     32 KB,  8-way Associative, 64-byte Line
L2 Unified Cache:   1024 KB, 16-way Associative, 64-byte Line

------[ Logical CPU #6 ]------

allcpu: Package 0 / Core 6 / Thread 0: Valid

CPUID 00000000: 0000000B-756E6547-6C65746E-49656E69 [GenuineIntel]
CPUID 00000001: 000406D8-0C100800-43D8E3BF-BFEBFBFF
CPUID 00000002: 61B3A001-0000FFC2-00000000-00000000
CPUID 00000003: 00000000-00000000-00000000-00000000
CPUID 00000004: 1C000121-0140003F-0000003F-00000001
CPUID 00000004: 1C000122-01C0003F-0000003F-00000001
CPUID 00000004: 1C00C143-03C0003F-000003FF-00000001
CPUID 00000005: 00000040-00000040-00000003-03000020
CPUID 00000006: 00000005-00000002-00000009-00000000
CPUID 00000007: 00000000-00002282-00000000-00000000
CPUID 00000008: 00000000-00000000-00000000-00000000
CPUID 00000009: 00000000-00000000-00000000-00000000
CPUID 0000000A: 07280203-00000000-00000000-00004503
CPUID 0000000B: 00000001-00000001-00000100-0000000C
CPUID 0000000B: 00000004-00000008-00000201-0000000C
CPUID 80000000: 80000008-00000000-00000000-00000000
CPUID 80000001: 00000000-00000000-00000101-28100000
CPUID 80000002: 20202020-20202020-65746E49-2952286C [        Intel(R)]
CPUID 80000003: 6F744120-4D54286D-50432029-43202055 [ Atom(TM) CPU  C]
CPUID 80000004: 30353732-20402020-30342E32-007A4847 [2750  @ 2.40GHz]
CPUID 80000005: 00000000-00000000-00000000-00000000
CPUID 80000006: 00000000-00000000-04008040-00000000
CPUID 80000007: 00000000-00000000-00000000-00000100
CPUID 80000008: 00003024-00000000-00000000-00000000

L1    Data Cache:     24 KB,  6-way Associative, 64-byte Line
L1  Instr. Cache:     32 KB,  8-way Associative, 64-byte Line
L2 Unified Cache:   1024 KB, 16-way Associative, 64-byte Line

------[ Logical CPU #7 ]------

allcpu: Package 0 / Core 7 / Thread 0: Valid

CPUID 00000000: 0000000B-756E6547-6C65746E-49656E69 [GenuineIntel]
CPUID 00000001: 000406D8-0E100800-43D8E3BF-BFEBFBFF
CPUID 00000002: 61B3A001-0000FFC2-00000000-00000000
CPUID 00000003: 00000000-00000000-00000000-00000000
CPUID 00000004: 1C000121-0140003F-0000003F-00000001
CPUID 00000004: 1C000122-01C0003F-0000003F-00000001
CPUID 00000004: 1C00C143-03C0003F-000003FF-00000001
CPUID 00000005: 00000040-00000040-00000003-03000020
CPUID 00000006: 00000005-00000002-00000009-00000000
CPUID 00000007: 00000000-00002282-00000000-00000000
CPUID 00000008: 00000000-00000000-00000000-00000000
CPUID 00000009: 00000000-00000000-00000000-00000000
CPUID 0000000A: 07280203-00000000-00000000-00004503
CPUID 0000000B: 00000001-00000001-00000100-0000000E
CPUID 0000000B: 00000004-00000008-00000201-0000000E
CPUID 80000000: 80000008-00000000-00000000-00000000
CPUID 80000001: 00000000-00000000-00000101-28100000
CPUID 80000002: 20202020-20202020-65746E49-2952286C [        Intel(R)]
CPUID 80000003: 6F744120-4D54286D-50432029-43202055 [ Atom(TM) CPU  C]
CPUID 80000004: 30353732-20402020-30342E32-007A4847 [2750  @ 2.40GHz]
CPUID 80000005: 00000000-00000000-00000000-00000000
CPUID 80000006: 00000000-00000000-04008040-00000000
CPUID 80000007: 00000000-00000000-00000000-00000100
CPUID 80000008: 00003024-00000000-00000000-00000000

L1    Data Cache:     24 KB,  6-way Associative, 64-byte Line
L1  Instr. Cache:     32 KB,  8-way Associative, 64-byte Line
L2 Unified Cache:   1024 KB, 16-way Associative, 64-byte Line

------[ All CPUs ]------

CPU   0: APICID   0 / Package 0 / Core  0 / Thread 0: Valid
CPU   1: APICID   2 / Package 0 / Core  1 / Thread 0: Valid
CPU   2: APICID   4 / Package 0 / Core  2 / Thread 0: Valid
CPU   3: APICID   6 / Package 0 / Core  3 / Thread 0: Valid
CPU   4: APICID   8 / Package 0 / Core  4 / Thread 0: Valid
CPU   5: APICID  10 / Package 0 / Core  5 / Thread 0: Valid
CPU   6: APICID  12 / Package 0 / Core  6 / Thread 0: Valid
CPU   7: APICID  14 / Package 0 / Core  7 / Thread 0: Valid

------[ MSR Registers ]------

MSR 00000017: 0000-0000-1004-1A54 [PlatID = 0]
MSR 0000001B: 0000-0000-FEE0-0900
MSR 0000002A: 0000-0000-4008-0000
MSR 00000035: < FAILED >
MSR 0000008B: 0000-0116-0000-0000
MSR 000000CD: 0000-0000-0000-0001
MSR 000000CE: 0000-0C00-8000-1800
MSR 000000E7: 0000-0000-02E8-DFC8
MSR 000000E8: 0000-0000-02E9-08F0
MSR 000000EE: 0000-0000-0238-0002
MSR 0000011E: 0000-0000-7E28-01FF
MSR 00000194: 0000-0000-0000-0000
MSR 00000198: 0000-8E00-0000-1847
MSR 00000199: 0000-0000-0000-1847
MSR 0000019A: 0000-0000-0000-0000
MSR 0000019B: 0000-0000-000A-0507
MSR 0000019C: 0000-0000-883A-0000
MSR 0000019D: 0000-0000-0000-0C18
MSR 000001A0: 0000-0040-0085-0089
MSR 000001A2: 0000-0000-0062-0000
MSR 000001A4: 0000-0000-0000-0000
MSR 000001AA: < FAILED >
MSR 000001AC: < FAILED >
MSR 000001AD: 0000-0000-0000-0000
MSR 000001B0: 0000-0000-0000-0005
MSR 000001B1: < FAILED >
MSR 000001B2: < FAILED >
MSR 000001FC: 0000-0000-0000-0000
MSR 00000300: < FAILED >
MSR 00000480: 00DA-0400-0000-0002
MSR 00000481: 0000-007F-0000-0016
MSR 00000482: FFF9-FFFE-0401-E172
MSR 00000483: 007F-FFFF-0003-6DFF
MSR 00000484: 0000-FFFF-0000-11FF
MSR 00000485: 0000-0000-0004-81E6
MSR 00000486: 0000-0000-8000-0021
MSR 00000487: 0000-0000-FFFF-FFFF
MSR 00000488: 0000-0000-0000-2000
MSR 00000489: 0000-0000-0010-27FF
MSR 0000048A: 0000-0000-0000-002E
MSR 0000048B: 0000-28EF-0000-0000
MSR 0000048C: 0000-0F01-0611-4141
MSR 0000048D: 0000-007F-0000-0016
MSR 0000048E: FFF9-FFFE-0400-6172
MSR 0000048F: 007F-FFFF-0003-6DFB
MSR 00000490: 0000-FFFF-0000-11FB
MSR 00000601: 0000-0000-0000-0000
MSR 00000602: < FAILED >
MSR 00000603: < FAILED >
MSR 00000604: < FAILED >
MSR 00000606: 0000-0000-000A-1003
MSR 0000060A: < FAILED >
MSR 0000060B: < FAILED >
MSR 0000060C: < FAILED >
MSR 0000060D: 0000-0000-0000-0000
MSR 00000610: 0046-8BB8-005B-89C4
MSR 00000611: 0000-0000-0000-0000
MSR 00000613: < FAILED >
MSR 00000614: < FAILED >
MSR 00000618: < FAILED >
MSR 00000619: < FAILED >
MSR 0000061B: < FAILED >
MSR 0000061C: < FAILED >
MSR 00000638: 0000-0000-0002-0000
MSR 00000639: 0000-0000-0000-0000
MSR 0000063A: < FAILED >
MSR 0000063B: < FAILED >
MSR 00000640: < FAILED >
MSR 00000641: < FAILED >
MSR 00000642: < FAILED >
MSR 0000066A: 0000-0000-0018-0C0C
MSR 0000066B: 0000-0000-8047-1818
MSR 0000066C: 0000-0000-1A1A-1A1A
MSR 00000676: 0000-0000-0000-0000

PerformanceFrequency = 2343935

CPU Clock M.Method = 8  (APIC SNB)
PM Timer Address   = 1032  (0408h)

APIC Clock = 100.02 MHz
APIC Clock = 100.00 MHz
APIC Clock = 100.01 MHz
APIC Clock = 100.00 MHz
APIC Clock = 100.01 MHz

------[ APIC Base at 00000000-FEE00000 ]------

  0000  00 00 00 00 00 00 00 00 00 00 00 00 00 00 00 00 
  0010  00 00 00 00 00 00 00 00 00 00 00 00 00 00 00 00 
  0020  00 00 00 00 00 00 00 00 00 00 00 00 00 00 00 00 
  0030  14 00 05 00 00 00 00 00 00 00 00 00 00 00 00 00 
  0040  00 00 00 00 00 00 00 00 00 00 00 00 00 00 00 00 
  0050  00 00 00 00 00 00 00 00 00 00 00 00 00 00 00 00 
  0060  00 00 00 00 00 00 00 00 00 00 00 00 00 00 00 00 
  0070  00 00 00 00 00 00 00 00 00 00 00 00 00 00 00 00 
  0080  00 00 00 00 00 00 00 00 00 00 00 00 00 00 00 00 
  0090  00 00 00 00 00 00 00 00 00 00 00 00 00 00 00 00 
  00A0  00 00 00 00 00 00 00 00 00 00 00 00 00 00 00 00 
  00B0  00 00 00 00 00 00 00 00 00 00 00 00 00 00 00 00 
  00C0  00 00 00 00 00 00 00 00 00 00 00 00 00 00 00 00 
  00D0  00 00 00 01 00 00 00 00 00 00 00 00 00 00 00 00 
  00E0  FF FF FF FF 00 00 00 00 00 00 00 00 00 00 00 00 
  00F0  3F 01 00 00 00 00 00 00 00 00 00 00 00 00 00 00 
  0100  00 00 00 00 00 00 00 00 00 00 00 00 00 00 00 00 
  0110  00 00 00 00 00 00 00 00 00 00 00 00 00 00 00 00 
  0120  00 00 00 00 00 00 00 00 00 00 00 00 00 00 00 00 
  0130  00 00 00 00 00 00 00 00 00 00 00 00 00 00 00 00 
  0140  00 00 00 00 00 00 00 00 00 00 00 00 00 00 00 00 
  0150  00 00 00 00 00 00 00 00 00 00 00 00 00 00 00 00 
  0160  00 00 00 00 00 00 00 00 00 00 00 00 00 00 00 00 
  0170  00 00 00 00 00 00 00 00 00 00 00 00 00 00 00 00 
  0180  00 00 00 00 00 00 00 00 00 00 00 00 00 00 00 00 
  0190  00 00 00 00 00 00 00 00 00 00 00 00 00 00 00 00 
  01A0  00 00 02 00 00 00 00 00 00 00 00 00 00 00 00 00 
  01B0  00 00 00 00 00 00 00 00 00 00 00 00 00 00 00 00 
  01C0  00 00 00 00 00 00 00 00 00 00 00 00 00 00 00 00 
  01D0  00 00 06 00 00 00 00 00 00 00 00 00 00 00 00 00 
  01E0  00 00 00 00 00 00 00 00 00 00 00 00 00 00 00 00 
  01F0  00 00 00 00 00 00 00 00 00 00 00 00 00 00 00 00 
  0200  00 00 00 00 00 00 00 00 00 00 00 00 00 00 00 00 
  0210  00 00 00 00 00 00 00 00 00 00 00 00 00 00 00 00 
  0220  00 00 00 00 00 00 00 00 00 00 00 00 00 00 00 00 
  0230  00 00 00 00 00 00 00 00 00 00 00 00 00 00 00 00 
  0240  00 00 00 00 00 00 00 00 00 00 00 00 00 00 00 00 
  0250  00 00 00 00 00 00 00 00 00 00 00 00 00 00 00 00 
  0260  00 00 00 00 00 00 00 00 00 00 00 00 00 00 00 00 
  0270  08 00 00 00 00 00 00 00 00 00 00 00 00 00 00 00 
  0280  80 00 00 00 00 00 00 00 00 00 00 00 00 00 00 00 
  0290  00 00 00 00 00 00 00 00 00 00 00 00 00 00 00 00 
  02A0  00 00 00 00 00 00 00 00 00 00 00 00 00 00 00 00 
  02B0  00 00 00 00 00 00 00 00 00 00 00 00 00 00 00 00 
  02C0  00 00 00 00 00 00 00 00 00 00 00 00 00 00 00 00 
  02D0  00 00 00 00 00 00 00 00 00 00 00 00 00 00 00 00 
  02E0  00 00 00 00 00 00 00 00 00 00 00 00 00 00 00 00 
  02F0  00 00 00 00 00 00 00 00 00 00 00 00 00 00 00 00 
  0300  2F 00 00 00 00 00 00 00 00 00 00 00 00 00 00 00 
  0310  00 00 00 08 00 00 00 00 00 00 00 00 00 00 00 00 
  0320  FD 00 03 00 00 00 00 00 00 00 00 00 00 00 00 00 
  0330  00 00 01 00 00 00 00 00 00 00 00 00 00 00 00 00 
  0340  FE 00 00 00 00 00 00 00 00 00 00 00 00 00 00 00 
  0350  3F 00 01 00 00 00 00 00 00 00 00 00 00 00 00 00 
  0360  FF 04 00 00 00 00 00 00 00 00 00 00 00 00 00 00 
  0370  E3 00 00 00 00 00 00 00 00 00 00 00 00 00 00 00 
  0380  00 00 00 00 00 00 00 00 00 00 00 00 00 00 00 00 
  0390  00 00 00 00 00 00 00 00 00 00 00 00 00 00 00 00 
  03A0  00 00 00 00 00 00 00 00 00 00 00 00 00 00 00 00 
  03B0  00 00 00 00 00 00 00 00 00 00 00 00 00 00 00 00 
  03C0  00 00 00 00 00 00 00 00 00 00 00 00 00 00 00 00 
  03D0  00 00 00 00 00 00 00 00 00 00 00 00 00 00 00 00 
  03E0  0B 00 00 00 00 00 00 00 00 00 00 00 00 00 00 00 
  03F0  00 00 00 00 00 00 00 00 00 00 00 00 00 00 00 00 
