------[ Versions ]------

Program Version : AIDA64 v3.00.2594 Beta
BenchDLL Version: 4.1.578-x64

------[ CPU Info ]------

CPU Type          : HexaCore Intel Core i7-4930K, 3400 MHz (34 x 100)
CPU Alias         : Ivy Bridge-E
CPU Platform      : LGA2011
CPU Stepping      : C0/M0/S0/C1/M1/S1
Instruction Set   : x86, x86-64, MMX, SSE, SSE2, SSE3, SSSE3, SSE4.1, SSE4.2, AVX, AES
CPUID Manufacturer: GenuineIntel
CPUID CPU Name    : Intel(R) Core(TM) i7-4930K CPU @ 3.40GHz
CPUID Revision    : 000306E4h
IA Brand ID       : 00h  (Unknown)
Platform ID       : 3Dh  (LGA2011)
HTT / CMP Units   : 2 / 6
Max. NUMA Node    : 0

Tjmax Temperature          : 95 Celsius
CPU TDP                    : 130 W
DRAM TDP                   : 35 W
CPU TDC                    : 1000 A
CPU Max Power Limit        : Unlimited Power / Unlimited Time
CPU Power Limit 1 (Long)   : 3408.3 W / 40.00 sec  (Unlocked)
CPU Power Limit 2 (Short)  : 4090 W / 40.00 sec  (Unlocked)
Max Turbo Boost Multipliers: 1C: 39x, 2C: 37x, 3C: 37x, 4C: 37x, 5C: 36x, 6C: 36x, 7C: 36x, 8C: 36x, 9C: 39x, 10C: 37x, 11C: 37x, 12C: 37x, 13C: 36x, 14C: 36x, 15C: 36x, 16C: 36x

------[ Logical CPU #0 ]------

allcpu: Package 0 / Core 0 / Thread 0: Valid

CPUID 00000000: 0000000D-756E6547-6C65746E-49656E69 [GenuineIntel]
CPUID 00000001: 000306E4-00200800-7FBEE3BF-BFEBFBFF
CPUID 00000002: 76036301-00F0B2FF-00000000-00CA0000
CPUID 00000003: 00000000-00000000-00000000-00000000
CPUID 00000004: 3C004121-01C0003F-0000003F-00000000
CPUID 00000004: 3C004122-01C0003F-0000003F-00000000
CPUID 00000004: 3C004143-01C0003F-000001FF-00000000
CPUID 00000004: 3C07C163-03C0003F-00002FFF-00000006
CPUID 00000005: 00000040-00000040-00000003-00001120
CPUID 00000006: 00000075-00000002-00000009-00000000
CPUID 00000007: 00000000-00000281-00000000-00000000
CPUID 00000008: 00000000-00000000-00000000-00000000
CPUID 00000009: 00000001-00000000-00000000-00000000
CPUID 0000000A: 07300403-00000000-00000000-00000603
CPUID 0000000B: 00000001-00000002-00000100-00000000
CPUID 0000000B: 00000005-0000000C-00000201-00000000
CPUID 0000000C: 00000000-00000000-00000000-00000000
CPUID 0000000D: 00000007-00000340-00000340-00000000
CPUID 0000000D: 00000100-00000240-00000000-00000000
CPUID 80000000: 80000008-00000000-00000000-00000000
CPUID 80000001: 00000000-00000000-00000001-2C100000
CPUID 80000002: 20202020-49202020-6C65746E-20295228 [       Intel(R) ]
CPUID 80000003: 65726F43-294D5428-2D376920-30333934 [Core(TM) i7-4930]
CPUID 80000004: 5043204B-20402055-30342E33-007A4847 [K CPU @ 3.40GHz]
CPUID 80000005: 00000000-00000000-00000000-00000000
CPUID 80000006: 00000000-00000000-01006040-00000000
CPUID 80000007: 00000000-00000000-00000000-00000100
CPUID 80000008: 0000302E-00000000-00000000-00000000

L1    Data Cache:     32 KB,  8-way Associative, 64-byte Line
L1  Instr. Cache:     32 KB,  8-way Associative, 64-byte Line
L2 Unified Cache:    256 KB,  8-way Associative, 64-byte Line
L3 Unified Cache:  12288 KB, 16-way Associative, 64-byte Line

------[ Logical CPU #1 ]------

allcpu: Package 0 / Core 0 / Thread 1: Valid, Virtual

CPUID 00000000: 0000000D-756E6547-6C65746E-49656E69 [GenuineIntel]
CPUID 00000001: 000306E4-01200800-7FBEE3BF-BFEBFBFF
CPUID 00000002: 76036301-00F0B2FF-00000000-00CA0000
CPUID 00000003: 00000000-00000000-00000000-00000000
CPUID 00000004: 3C004121-01C0003F-0000003F-00000000
CPUID 00000004: 3C004122-01C0003F-0000003F-00000000
CPUID 00000004: 3C004143-01C0003F-000001FF-00000000
CPUID 00000004: 3C07C163-03C0003F-00002FFF-00000006
CPUID 00000005: 00000040-00000040-00000003-00001120
CPUID 00000006: 00000075-00000002-00000009-00000000
CPUID 00000007: 00000000-00000281-00000000-00000000
CPUID 00000008: 00000000-00000000-00000000-00000000
CPUID 00000009: 00000001-00000000-00000000-00000000
CPUID 0000000A: 07300403-00000000-00000000-00000603
CPUID 0000000B: 00000001-00000002-00000100-00000001
CPUID 0000000B: 00000005-0000000C-00000201-00000001
CPUID 0000000C: 00000000-00000000-00000000-00000000
CPUID 0000000D: 00000007-00000340-00000340-00000000
CPUID 0000000D: 00000100-00000240-00000000-00000000
CPUID 80000000: 80000008-00000000-00000000-00000000
CPUID 80000001: 00000000-00000000-00000001-2C100000
CPUID 80000002: 20202020-49202020-6C65746E-20295228 [       Intel(R) ]
CPUID 80000003: 65726F43-294D5428-2D376920-30333934 [Core(TM) i7-4930]
CPUID 80000004: 5043204B-20402055-30342E33-007A4847 [K CPU @ 3.40GHz]
CPUID 80000005: 00000000-00000000-00000000-00000000
CPUID 80000006: 00000000-00000000-01006040-00000000
CPUID 80000007: 00000000-00000000-00000000-00000100
CPUID 80000008: 0000302E-00000000-00000000-00000000

L1    Data Cache:     32 KB,  8-way Associative, 64-byte Line
L1  Instr. Cache:     32 KB,  8-way Associative, 64-byte Line
L2 Unified Cache:    256 KB,  8-way Associative, 64-byte Line
L3 Unified Cache:  12288 KB, 16-way Associative, 64-byte Line

------[ Logical CPU #2 ]------

allcpu: Package 0 / Core 1 / Thread 0: Valid

CPUID 00000000: 0000000D-756E6547-6C65746E-49656E69 [GenuineIntel]
CPUID 00000001: 000306E4-02200800-7FBEE3BF-BFEBFBFF
CPUID 00000002: 76036301-00F0B2FF-00000000-00CA0000
CPUID 00000003: 00000000-00000000-00000000-00000000
CPUID 00000004: 3C004121-01C0003F-0000003F-00000000
CPUID 00000004: 3C004122-01C0003F-0000003F-00000000
CPUID 00000004: 3C004143-01C0003F-000001FF-00000000
CPUID 00000004: 3C07C163-03C0003F-00002FFF-00000006
CPUID 00000005: 00000040-00000040-00000003-00001120
CPUID 00000006: 00000075-00000002-00000009-00000000
CPUID 00000007: 00000000-00000281-00000000-00000000
CPUID 00000008: 00000000-00000000-00000000-00000000
CPUID 00000009: 00000001-00000000-00000000-00000000
CPUID 0000000A: 07300403-00000000-00000000-00000603
CPUID 0000000B: 00000001-00000002-00000100-00000002
CPUID 0000000B: 00000005-0000000C-00000201-00000002
CPUID 0000000C: 00000000-00000000-00000000-00000000
CPUID 0000000D: 00000007-00000340-00000340-00000000
CPUID 0000000D: 00000100-00000240-00000000-00000000
CPUID 80000000: 80000008-00000000-00000000-00000000
CPUID 80000001: 00000000-00000000-00000001-2C100000
CPUID 80000002: 20202020-49202020-6C65746E-20295228 [       Intel(R) ]
CPUID 80000003: 65726F43-294D5428-2D376920-30333934 [Core(TM) i7-4930]
CPUID 80000004: 5043204B-20402055-30342E33-007A4847 [K CPU @ 3.40GHz]
CPUID 80000005: 00000000-00000000-00000000-00000000
CPUID 80000006: 00000000-00000000-01006040-00000000
CPUID 80000007: 00000000-00000000-00000000-00000100
CPUID 80000008: 0000302E-00000000-00000000-00000000

L1    Data Cache:     32 KB,  8-way Associative, 64-byte Line
L1  Instr. Cache:     32 KB,  8-way Associative, 64-byte Line
L2 Unified Cache:    256 KB,  8-way Associative, 64-byte Line
L3 Unified Cache:  12288 KB, 16-way Associative, 64-byte Line

------[ Logical CPU #3 ]------

allcpu: Package 0 / Core 1 / Thread 1: Valid, Virtual

CPUID 00000000: 0000000D-756E6547-6C65746E-49656E69 [GenuineIntel]
CPUID 00000001: 000306E4-03200800-7FBEE3BF-BFEBFBFF
CPUID 00000002: 76036301-00F0B2FF-00000000-00CA0000
CPUID 00000003: 00000000-00000000-00000000-00000000
CPUID 00000004: 3C004121-01C0003F-0000003F-00000000
CPUID 00000004: 3C004122-01C0003F-0000003F-00000000
CPUID 00000004: 3C004143-01C0003F-000001FF-00000000
CPUID 00000004: 3C07C163-03C0003F-00002FFF-00000006
CPUID 00000005: 00000040-00000040-00000003-00001120
CPUID 00000006: 00000075-00000002-00000009-00000000
CPUID 00000007: 00000000-00000281-00000000-00000000
CPUID 00000008: 00000000-00000000-00000000-00000000
CPUID 00000009: 00000001-00000000-00000000-00000000
CPUID 0000000A: 07300403-00000000-00000000-00000603
CPUID 0000000B: 00000001-00000002-00000100-00000003
CPUID 0000000B: 00000005-0000000C-00000201-00000003
CPUID 0000000C: 00000000-00000000-00000000-00000000
CPUID 0000000D: 00000007-00000340-00000340-00000000
CPUID 0000000D: 00000100-00000240-00000000-00000000
CPUID 80000000: 80000008-00000000-00000000-00000000
CPUID 80000001: 00000000-00000000-00000001-2C100000
CPUID 80000002: 20202020-49202020-6C65746E-20295228 [       Intel(R) ]
CPUID 80000003: 65726F43-294D5428-2D376920-30333934 [Core(TM) i7-4930]
CPUID 80000004: 5043204B-20402055-30342E33-007A4847 [K CPU @ 3.40GHz]
CPUID 80000005: 00000000-00000000-00000000-00000000
CPUID 80000006: 00000000-00000000-01006040-00000000
CPUID 80000007: 00000000-00000000-00000000-00000100
CPUID 80000008: 0000302E-00000000-00000000-00000000

L1    Data Cache:     32 KB,  8-way Associative, 64-byte Line
L1  Instr. Cache:     32 KB,  8-way Associative, 64-byte Line
L2 Unified Cache:    256 KB,  8-way Associative, 64-byte Line
L3 Unified Cache:  12288 KB, 16-way Associative, 64-byte Line

------[ Logical CPU #4 ]------

allcpu: Package 0 / Core 2 / Thread 0: Valid

CPUID 00000000: 0000000D-756E6547-6C65746E-49656E69 [GenuineIntel]
CPUID 00000001: 000306E4-04200800-7FBEE3BF-BFEBFBFF
CPUID 00000002: 76036301-00F0B2FF-00000000-00CA0000
CPUID 00000003: 00000000-00000000-00000000-00000000
CPUID 00000004: 3C004121-01C0003F-0000003F-00000000
CPUID 00000004: 3C004122-01C0003F-0000003F-00000000
CPUID 00000004: 3C004143-01C0003F-000001FF-00000000
CPUID 00000004: 3C07C163-03C0003F-00002FFF-00000006
CPUID 00000005: 00000040-00000040-00000003-00001120
CPUID 00000006: 00000075-00000002-00000009-00000000
CPUID 00000007: 00000000-00000281-00000000-00000000
CPUID 00000008: 00000000-00000000-00000000-00000000
CPUID 00000009: 00000001-00000000-00000000-00000000
CPUID 0000000A: 07300403-00000000-00000000-00000603
CPUID 0000000B: 00000001-00000002-00000100-00000004
CPUID 0000000B: 00000005-0000000C-00000201-00000004
CPUID 0000000C: 00000000-00000000-00000000-00000000
CPUID 0000000D: 00000007-00000340-00000340-00000000
CPUID 0000000D: 00000100-00000240-00000000-00000000
CPUID 80000000: 80000008-00000000-00000000-00000000
CPUID 80000001: 00000000-00000000-00000001-2C100000
CPUID 80000002: 20202020-49202020-6C65746E-20295228 [       Intel(R) ]
CPUID 80000003: 65726F43-294D5428-2D376920-30333934 [Core(TM) i7-4930]
CPUID 80000004: 5043204B-20402055-30342E33-007A4847 [K CPU @ 3.40GHz]
CPUID 80000005: 00000000-00000000-00000000-00000000
CPUID 80000006: 00000000-00000000-01006040-00000000
CPUID 80000007: 00000000-00000000-00000000-00000100
CPUID 80000008: 0000302E-00000000-00000000-00000000

L1    Data Cache:     32 KB,  8-way Associative, 64-byte Line
L1  Instr. Cache:     32 KB,  8-way Associative, 64-byte Line
L2 Unified Cache:    256 KB,  8-way Associative, 64-byte Line
L3 Unified Cache:  12288 KB, 16-way Associative, 64-byte Line

------[ Logical CPU #5 ]------

allcpu: Package 0 / Core 2 / Thread 1: Valid, Virtual

CPUID 00000000: 0000000D-756E6547-6C65746E-49656E69 [GenuineIntel]
CPUID 00000001: 000306E4-05200800-7FBEE3BF-BFEBFBFF
CPUID 00000002: 76036301-00F0B2FF-00000000-00CA0000
CPUID 00000003: 00000000-00000000-00000000-00000000
CPUID 00000004: 3C004121-01C0003F-0000003F-00000000
CPUID 00000004: 3C004122-01C0003F-0000003F-00000000
CPUID 00000004: 3C004143-01C0003F-000001FF-00000000
CPUID 00000004: 3C07C163-03C0003F-00002FFF-00000006
CPUID 00000005: 00000040-00000040-00000003-00001120
CPUID 00000006: 00000075-00000002-00000009-00000000
CPUID 00000007: 00000000-00000281-00000000-00000000
CPUID 00000008: 00000000-00000000-00000000-00000000
CPUID 00000009: 00000001-00000000-00000000-00000000
CPUID 0000000A: 07300403-00000000-00000000-00000603
CPUID 0000000B: 00000001-00000002-00000100-00000005
CPUID 0000000B: 00000005-0000000C-00000201-00000005
CPUID 0000000C: 00000000-00000000-00000000-00000000
CPUID 0000000D: 00000007-00000340-00000340-00000000
CPUID 0000000D: 00000100-00000240-00000000-00000000
CPUID 80000000: 80000008-00000000-00000000-00000000
CPUID 80000001: 00000000-00000000-00000001-2C100000
CPUID 80000002: 20202020-49202020-6C65746E-20295228 [       Intel(R) ]
CPUID 80000003: 65726F43-294D5428-2D376920-30333934 [Core(TM) i7-4930]
CPUID 80000004: 5043204B-20402055-30342E33-007A4847 [K CPU @ 3.40GHz]
CPUID 80000005: 00000000-00000000-00000000-00000000
CPUID 80000006: 00000000-00000000-01006040-00000000
CPUID 80000007: 00000000-00000000-00000000-00000100
CPUID 80000008: 0000302E-00000000-00000000-00000000

L1    Data Cache:     32 KB,  8-way Associative, 64-byte Line
L1  Instr. Cache:     32 KB,  8-way Associative, 64-byte Line
L2 Unified Cache:    256 KB,  8-way Associative, 64-byte Line
L3 Unified Cache:  12288 KB, 16-way Associative, 64-byte Line

------[ Logical CPU #6 ]------

allcpu: Package 0 / Core 3 / Thread 0: Valid

CPUID 00000000: 0000000D-756E6547-6C65746E-49656E69 [GenuineIntel]
CPUID 00000001: 000306E4-06200800-7FBEE3BF-BFEBFBFF
CPUID 00000002: 76036301-00F0B2FF-00000000-00CA0000
CPUID 00000003: 00000000-00000000-00000000-00000000
CPUID 00000004: 3C004121-01C0003F-0000003F-00000000
CPUID 00000004: 3C004122-01C0003F-0000003F-00000000
CPUID 00000004: 3C004143-01C0003F-000001FF-00000000
CPUID 00000004: 3C07C163-03C0003F-00002FFF-00000006
CPUID 00000005: 00000040-00000040-00000003-00001120
CPUID 00000006: 00000075-00000002-00000009-00000000
CPUID 00000007: 00000000-00000281-00000000-00000000
CPUID 00000008: 00000000-00000000-00000000-00000000
CPUID 00000009: 00000001-00000000-00000000-00000000
CPUID 0000000A: 07300403-00000000-00000000-00000603
CPUID 0000000B: 00000001-00000002-00000100-00000006
CPUID 0000000B: 00000005-0000000C-00000201-00000006
CPUID 0000000C: 00000000-00000000-00000000-00000000
CPUID 0000000D: 00000007-00000340-00000340-00000000
CPUID 0000000D: 00000100-00000240-00000000-00000000
CPUID 80000000: 80000008-00000000-00000000-00000000
CPUID 80000001: 00000000-00000000-00000001-2C100000
CPUID 80000002: 20202020-49202020-6C65746E-20295228 [       Intel(R) ]
CPUID 80000003: 65726F43-294D5428-2D376920-30333934 [Core(TM) i7-4930]
CPUID 80000004: 5043204B-20402055-30342E33-007A4847 [K CPU @ 3.40GHz]
CPUID 80000005: 00000000-00000000-00000000-00000000
CPUID 80000006: 00000000-00000000-01006040-00000000
CPUID 80000007: 00000000-00000000-00000000-00000100
CPUID 80000008: 0000302E-00000000-00000000-00000000

L1    Data Cache:     32 KB,  8-way Associative, 64-byte Line
L1  Instr. Cache:     32 KB,  8-way Associative, 64-byte Line
L2 Unified Cache:    256 KB,  8-way Associative, 64-byte Line
L3 Unified Cache:  12288 KB, 16-way Associative, 64-byte Line

------[ Logical CPU #7 ]------

allcpu: Package 0 / Core 3 / Thread 1: Valid, Virtual

CPUID 00000000: 0000000D-756E6547-6C65746E-49656E69 [GenuineIntel]
CPUID 00000001: 000306E4-07200800-7FBEE3BF-BFEBFBFF
CPUID 00000002: 76036301-00F0B2FF-00000000-00CA0000
CPUID 00000003: 00000000-00000000-00000000-00000000
CPUID 00000004: 3C004121-01C0003F-0000003F-00000000
CPUID 00000004: 3C004122-01C0003F-0000003F-00000000
CPUID 00000004: 3C004143-01C0003F-000001FF-00000000
CPUID 00000004: 3C07C163-03C0003F-00002FFF-00000006
CPUID 00000005: 00000040-00000040-00000003-00001120
CPUID 00000006: 00000075-00000002-00000009-00000000
CPUID 00000007: 00000000-00000281-00000000-00000000
CPUID 00000008: 00000000-00000000-00000000-00000000
CPUID 00000009: 00000001-00000000-00000000-00000000
CPUID 0000000A: 07300403-00000000-00000000-00000603
CPUID 0000000B: 00000001-00000002-00000100-00000007
CPUID 0000000B: 00000005-0000000C-00000201-00000007
CPUID 0000000C: 00000000-00000000-00000000-00000000
CPUID 0000000D: 00000007-00000340-00000340-00000000
CPUID 0000000D: 00000100-00000240-00000000-00000000
CPUID 80000000: 80000008-00000000-00000000-00000000
CPUID 80000001: 00000000-00000000-00000001-2C100000
CPUID 80000002: 20202020-49202020-6C65746E-20295228 [       Intel(R) ]
CPUID 80000003: 65726F43-294D5428-2D376920-30333934 [Core(TM) i7-4930]
CPUID 80000004: 5043204B-20402055-30342E33-007A4847 [K CPU @ 3.40GHz]
CPUID 80000005: 00000000-00000000-00000000-00000000
CPUID 80000006: 00000000-00000000-01006040-00000000
CPUID 80000007: 00000000-00000000-00000000-00000100
CPUID 80000008: 0000302E-00000000-00000000-00000000

L1    Data Cache:     32 KB,  8-way Associative, 64-byte Line
L1  Instr. Cache:     32 KB,  8-way Associative, 64-byte Line
L2 Unified Cache:    256 KB,  8-way Associative, 64-byte Line
L3 Unified Cache:  12288 KB, 16-way Associative, 64-byte Line

------[ Logical CPU #8 ]------

allcpu: Package 0 / Core 4 / Thread 0: Valid

CPUID 00000000: 0000000D-756E6547-6C65746E-49656E69 [GenuineIntel]
CPUID 00000001: 000306E4-08200800-7FBEE3BF-BFEBFBFF
CPUID 00000002: 76036301-00F0B2FF-00000000-00CA0000
CPUID 00000003: 00000000-00000000-00000000-00000000
CPUID 00000004: 3C004121-01C0003F-0000003F-00000000
CPUID 00000004: 3C004122-01C0003F-0000003F-00000000
CPUID 00000004: 3C004143-01C0003F-000001FF-00000000
CPUID 00000004: 3C07C163-03C0003F-00002FFF-00000006
CPUID 00000005: 00000040-00000040-00000003-00001120
CPUID 00000006: 00000075-00000002-00000009-00000000
CPUID 00000007: 00000000-00000281-00000000-00000000
CPUID 00000008: 00000000-00000000-00000000-00000000
CPUID 00000009: 00000001-00000000-00000000-00000000
CPUID 0000000A: 07300403-00000000-00000000-00000603
CPUID 0000000B: 00000001-00000002-00000100-00000008
CPUID 0000000B: 00000005-0000000C-00000201-00000008
CPUID 0000000C: 00000000-00000000-00000000-00000000
CPUID 0000000D: 00000007-00000340-00000340-00000000
CPUID 0000000D: 00000100-00000240-00000000-00000000
CPUID 80000000: 80000008-00000000-00000000-00000000
CPUID 80000001: 00000000-00000000-00000001-2C100000
CPUID 80000002: 20202020-49202020-6C65746E-20295228 [       Intel(R) ]
CPUID 80000003: 65726F43-294D5428-2D376920-30333934 [Core(TM) i7-4930]
CPUID 80000004: 5043204B-20402055-30342E33-007A4847 [K CPU @ 3.40GHz]
CPUID 80000005: 00000000-00000000-00000000-00000000
CPUID 80000006: 00000000-00000000-01006040-00000000
CPUID 80000007: 00000000-00000000-00000000-00000100
CPUID 80000008: 0000302E-00000000-00000000-00000000

L1    Data Cache:     32 KB,  8-way Associative, 64-byte Line
L1  Instr. Cache:     32 KB,  8-way Associative, 64-byte Line
L2 Unified Cache:    256 KB,  8-way Associative, 64-byte Line
L3 Unified Cache:  12288 KB, 16-way Associative, 64-byte Line

------[ Logical CPU #9 ]------

allcpu: Package 0 / Core 4 / Thread 1: Valid, Virtual

CPUID 00000000: 0000000D-756E6547-6C65746E-49656E69 [GenuineIntel]
CPUID 00000001: 000306E4-09200800-7FBEE3BF-BFEBFBFF
CPUID 00000002: 76036301-00F0B2FF-00000000-00CA0000
CPUID 00000003: 00000000-00000000-00000000-00000000
CPUID 00000004: 3C004121-01C0003F-0000003F-00000000
CPUID 00000004: 3C004122-01C0003F-0000003F-00000000
CPUID 00000004: 3C004143-01C0003F-000001FF-00000000
CPUID 00000004: 3C07C163-03C0003F-00002FFF-00000006
CPUID 00000005: 00000040-00000040-00000003-00001120
CPUID 00000006: 00000075-00000002-00000009-00000000
CPUID 00000007: 00000000-00000281-00000000-00000000
CPUID 00000008: 00000000-00000000-00000000-00000000
CPUID 00000009: 00000001-00000000-00000000-00000000
CPUID 0000000A: 07300403-00000000-00000000-00000603
CPUID 0000000B: 00000001-00000002-00000100-00000009
CPUID 0000000B: 00000005-0000000C-00000201-00000009
CPUID 0000000C: 00000000-00000000-00000000-00000000
CPUID 0000000D: 00000007-00000340-00000340-00000000
CPUID 0000000D: 00000100-00000240-00000000-00000000
CPUID 80000000: 80000008-00000000-00000000-00000000
CPUID 80000001: 00000000-00000000-00000001-2C100000
CPUID 80000002: 20202020-49202020-6C65746E-20295228 [       Intel(R) ]
CPUID 80000003: 65726F43-294D5428-2D376920-30333934 [Core(TM) i7-4930]
CPUID 80000004: 5043204B-20402055-30342E33-007A4847 [K CPU @ 3.40GHz]
CPUID 80000005: 00000000-00000000-00000000-00000000
CPUID 80000006: 00000000-00000000-01006040-00000000
CPUID 80000007: 00000000-00000000-00000000-00000100
CPUID 80000008: 0000302E-00000000-00000000-00000000

L1    Data Cache:     32 KB,  8-way Associative, 64-byte Line
L1  Instr. Cache:     32 KB,  8-way Associative, 64-byte Line
L2 Unified Cache:    256 KB,  8-way Associative, 64-byte Line
L3 Unified Cache:  12288 KB, 16-way Associative, 64-byte Line

------[ Logical CPU #10 ]------

allcpu: Package 0 / Core 5 / Thread 0: Valid

CPUID 00000000: 0000000D-756E6547-6C65746E-49656E69 [GenuineIntel]
CPUID 00000001: 000306E4-0A200800-7FBEE3BF-BFEBFBFF
CPUID 00000002: 76036301-00F0B2FF-00000000-00CA0000
CPUID 00000003: 00000000-00000000-00000000-00000000
CPUID 00000004: 3C004121-01C0003F-0000003F-00000000
CPUID 00000004: 3C004122-01C0003F-0000003F-00000000
CPUID 00000004: 3C004143-01C0003F-000001FF-00000000
CPUID 00000004: 3C07C163-03C0003F-00002FFF-00000006
CPUID 00000005: 00000040-00000040-00000003-00001120
CPUID 00000006: 00000075-00000002-00000009-00000000
CPUID 00000007: 00000000-00000281-00000000-00000000
CPUID 00000008: 00000000-00000000-00000000-00000000
CPUID 00000009: 00000001-00000000-00000000-00000000
CPUID 0000000A: 07300403-00000000-00000000-00000603
CPUID 0000000B: 00000001-00000002-00000100-0000000A
CPUID 0000000B: 00000005-0000000C-00000201-0000000A
CPUID 0000000C: 00000000-00000000-00000000-00000000
CPUID 0000000D: 00000007-00000340-00000340-00000000
CPUID 0000000D: 00000100-00000240-00000000-00000000
CPUID 80000000: 80000008-00000000-00000000-00000000
CPUID 80000001: 00000000-00000000-00000001-2C100000
CPUID 80000002: 20202020-49202020-6C65746E-20295228 [       Intel(R) ]
CPUID 80000003: 65726F43-294D5428-2D376920-30333934 [Core(TM) i7-4930]
CPUID 80000004: 5043204B-20402055-30342E33-007A4847 [K CPU @ 3.40GHz]
CPUID 80000005: 00000000-00000000-00000000-00000000
CPUID 80000006: 00000000-00000000-01006040-00000000
CPUID 80000007: 00000000-00000000-00000000-00000100
CPUID 80000008: 0000302E-00000000-00000000-00000000

L1    Data Cache:     32 KB,  8-way Associative, 64-byte Line
L1  Instr. Cache:     32 KB,  8-way Associative, 64-byte Line
L2 Unified Cache:    256 KB,  8-way Associative, 64-byte Line
L3 Unified Cache:  12288 KB, 16-way Associative, 64-byte Line

------[ Logical CPU #11 ]------

allcpu: Package 0 / Core 5 / Thread 1: Valid, Virtual

CPUID 00000000: 0000000D-756E6547-6C65746E-49656E69 [GenuineIntel]
CPUID 00000001: 000306E4-0B200800-7FBEE3BF-BFEBFBFF
CPUID 00000002: 76036301-00F0B2FF-00000000-00CA0000
CPUID 00000003: 00000000-00000000-00000000-00000000
CPUID 00000004: 3C004121-01C0003F-0000003F-00000000
CPUID 00000004: 3C004122-01C0003F-0000003F-00000000
CPUID 00000004: 3C004143-01C0003F-000001FF-00000000
CPUID 00000004: 3C07C163-03C0003F-00002FFF-00000006
CPUID 00000005: 00000040-00000040-00000003-00001120
CPUID 00000006: 00000075-00000002-00000009-00000000
CPUID 00000007: 00000000-00000281-00000000-00000000
CPUID 00000008: 00000000-00000000-00000000-00000000
CPUID 00000009: 00000001-00000000-00000000-00000000
CPUID 0000000A: 07300403-00000000-00000000-00000603
CPUID 0000000B: 00000001-00000002-00000100-0000000B
CPUID 0000000B: 00000005-0000000C-00000201-0000000B
CPUID 0000000C: 00000000-00000000-00000000-00000000
CPUID 0000000D: 00000007-00000340-00000340-00000000
CPUID 0000000D: 00000100-00000240-00000000-00000000
CPUID 80000000: 80000008-00000000-00000000-00000000
CPUID 80000001: 00000000-00000000-00000001-2C100000
CPUID 80000002: 20202020-49202020-6C65746E-20295228 [       Intel(R) ]
CPUID 80000003: 65726F43-294D5428-2D376920-30333934 [Core(TM) i7-4930]
CPUID 80000004: 5043204B-20402055-30342E33-007A4847 [K CPU @ 3.40GHz]
CPUID 80000005: 00000000-00000000-00000000-00000000
CPUID 80000006: 00000000-00000000-01006040-00000000
CPUID 80000007: 00000000-00000000-00000000-00000100
CPUID 80000008: 0000302E-00000000-00000000-00000000

L1    Data Cache:     32 KB,  8-way Associative, 64-byte Line
L1  Instr. Cache:     32 KB,  8-way Associative, 64-byte Line
L2 Unified Cache:    256 KB,  8-way Associative, 64-byte Line
L3 Unified Cache:  12288 KB, 16-way Associative, 64-byte Line

------[ All CPUs ]------

CPU   0: APICID   0 / Package 0 / Core  0 / Thread 0: Valid
CPU   1: APICID   1 / Package 0 / Core  0 / Thread 1: Valid, Virtual
CPU   2: APICID   2 / Package 0 / Core  1 / Thread 0: Valid
CPU   3: APICID   3 / Package 0 / Core  1 / Thread 1: Valid, Virtual
CPU   4: APICID   4 / Package 0 / Core  2 / Thread 0: Valid
CPU   5: APICID   5 / Package 0 / Core  2 / Thread 1: Valid, Virtual
CPU   6: APICID   6 / Package 0 / Core  3 / Thread 0: Valid
CPU   7: APICID   7 / Package 0 / Core  3 / Thread 1: Valid, Virtual
CPU   8: APICID   8 / Package 0 / Core  4 / Thread 0: Valid
CPU   9: APICID   9 / Package 0 / Core  4 / Thread 1: Valid, Virtual
CPU  10: APICID  10 / Package 0 / Core  5 / Thread 0: Valid
CPU  11: APICID  11 / Package 0 / Core  5 / Thread 1: Valid, Virtual

------[ MSR Registers ]------

MSR 00000017: 0008-0000-0000-0000 [PlatID = 2]
MSR 0000001B: 0000-0000-FEE0-0900
MSR 00000035: 0000-0000-0006-000C
MSR 0000008B: 0000-0416-0000-0000
MSR 000000CE: 0000-0C10-F001-2200
MSR 000000E7: 0000-007B-EBB4-6939
MSR 000000E8: 0000-0079-16A5-B565
MSR 00000194: 0000-0000-000E-0000
MSR 00000198: 0000-2177-0000-2200
MSR 00000199: 0000-0000-0000-2700
MSR 0000019A: 0000-0000-0000-0000
MSR 0000019B: 0000-0000-0000-0000
MSR 0000019C: 0000-0000-8832-0000
MSR 0000019D: 0000-0000-0000-0000
MSR 000001A0: 0000-0040-0085-0089
MSR 000001A2: 0000-0000-005F-0A00
MSR 000001A4: 0000-0000-0000-0000
MSR 000001AA: 0000-0000-0000-0000
MSR 000001AC: < FAILED >
MSR 000001AD: 2424-2424-2525-2527
MSR 000001AE: 2424-2424-2525-2527
MSR 000001AF: < FAILED >
MSR 000001B0: 0000-0000-0000-0007
MSR 000001B1: 0000-0000-8832-0000
MSR 000001B2: 0000-0000-0000-0000
MSR 000001FC: 0000-0000-2104-0059
MSR 00000300: 0000-0000-8000-FF00
MSR 00000480: 00DA-0400-0000-0010
MSR 00000481: 0000-007F-0000-0016
MSR 00000482: FFF9-FFFE-0401-E172
MSR 00000483: 007F-FFFF-0003-6DFF
MSR 00000484: 0000-FFFF-0000-11FF
MSR 00000485: 0000-0000-1004-01E5
MSR 00000486: 0000-0000-8000-0021
MSR 00000487: 0000-0000-FFFF-FFFF
MSR 00000488: 0000-0000-0000-2000
MSR 00000489: 0000-0000-0017-27FF
MSR 0000048A: 0000-0000-0000-002A
MSR 0000048B: 0000-0CFF-0000-0000
MSR 0000048C: 0000-0F01-0613-4141
MSR 0000048D: 0000-007F-0000-0016
MSR 0000048E: FFF9-FFFE-0400-6172
MSR 0000048F: 007F-FFFF-0003-6DFB
MSR 00000490: 0000-FFFF-0000-11FB
MSR 00000601: 1814-1494-0000-1F40
MSR 00000602: < FAILED >
MSR 00000603: 0000-0000-8015-1515
MSR 00000604: < FAILED >
MSR 00000606: 0000-0000-000A-1003
MSR 0000060A: 0000-0000-0000-0000
MSR 0000060B: 0000-0000-0000-0000
MSR 0000060C: 0000-0000-0000-0000
MSR 0000060D: 0000-0000-0000-0000
MSR 00000610: 005E-FFD0-005E-EA82
MSR 00000611: 0000-0000-2E15-FBDC
MSR 00000613: 0000-0000-0000-0000
MSR 00000614: 0000-0000-01E0-0410
MSR 00000618: 0000-0000-0000-0000
MSR 00000619: 0000-0000-0000-0000
MSR 0000061B: 0000-0000-0000-0000
MSR 0000061C: 002F-0258-0078-0118
MSR 00000638: 0000-0000-005E-FFD0
MSR 00000639: 0000-0000-2483-D267
MSR 0000063A: 0000-0000-0000-0000
MSR 0000063B: 0000-0000-0000-0000
MSR 00000640: < FAILED >
MSR 00000641: < FAILED >
MSR 00000642: < FAILED >
MSR 00000648: < FAILED >
MSR 00000649: < FAILED >
MSR 0000064A: < FAILED >
MSR 0000064B: < FAILED >
MSR 0000064C: < FAILED >

PerformanceFrequency = 3320419

CPU Clock M.Method = 8  (APIC SNB)
PM Timer Address   = 1032  (0408h)

APIC Clock = 100.00 MHz
APIC Clock = 100.00 MHz
APIC Clock = 100.00 MHz
APIC Clock = 100.00 MHz
APIC Clock = 100.00 MHz
