------[ Versions ]------

Program Version : EVEREST v4.60.1637 Beta
BenchDLL Version: 2.4.257.0

------[ CPU Info ]------

CPU Type           : QuadCore Intel Core 2 Extreme QX9650, 3000 MHz (9 x 333)
CPU Alias          : Yorkfield
CPU Platform       : LGA775
CPU Stepping       : C0
Instruction Set    : x86, x86-64, MMX, SSE, SSE2, SSE3, SSSE3, SSE4.1
CPUID Manufacturer : GenuineIntel
CPUID CPU Name     : Intel(R) Core(TM)2 Extreme CPU X9650 @ 3.00GHz
CPUID Revision     : 00010676h
IA Brand ID        : 00h  (Unknown)
Platform ID        : 2Ah  (LGA775)

------[ Logical CPU #0 ]------

allcpu: Valid

CPUID 00000000: 0000000A-756E6547-6C65746E-49656E69
CPUID 00000001: 00010676-00040800-0008E3BD-BFEBFBFF
CPUID 00000002: 05B0B101-005657F0-00000000-2CB4304E
CPUID 00000003: 00000000-00000000-00000000-00000000
CPUID 00000004: 0C000121-01C0003F-0000003F-00000001
CPUID 00000004: 0C000122-01C0003F-0000003F-00000001
CPUID 00000004: 0C004143-05C0003F-00000FFF-00000001
CPUID 00000005: 00000040-00000040-00000003-00000020
CPUID 00000006: 00000001-00000002-00000001-00000000
CPUID 00000007: 00000000-00000000-00000000-00000000
CPUID 00000008: 00000400-00000000-00000000-00000000
CPUID 00000009: 00000000-00000000-00000000-00000000
CPUID 0000000A: 07280202-00000000-00000000-00000503
CPUID 80000000: 80000008-00000000-00000000-00000000
CPUID 80000001: 00000000-00000000-00000001-20100000
CPUID 80000002: 65746E49-2952286C-726F4320-4D542865
CPUID 80000003: 45203229-65727478-4320656D-58205550
CPUID 80000004: 30353639-20402020-30302E33-007A4847
CPUID 80000005: 00000000-00000000-00000000-00000000
CPUID 80000006: 00000000-00000000-18008040-00000000
CPUID 80000007: 00000000-00000000-00000000-00000000
CPUID 80000008: 00003024-00000000-00000000-00000000

L1    Data Cache:     32 KB,  8-way Associative, 64-byte Line
L1  Instr. Cache:     32 KB,  8-way Associative, 64-byte Line
L2 Unified Cache:   6144 KB, 24-way Associative, 64-byte Line

------[ Logical CPU #1 ]------

allcpu: Valid

CPUID 00000000: 0000000A-756E6547-6C65746E-49656E69
CPUID 00000001: 00010676-02040800-0008E3BD-BFEBFBFF
CPUID 00000002: 05B0B101-005657F0-00000000-2CB4304E
CPUID 00000003: 00000000-00000000-00000000-00000000
CPUID 00000004: 0C000121-01C0003F-0000003F-00000001
CPUID 00000004: 0C000122-01C0003F-0000003F-00000001
CPUID 00000004: 0C004143-05C0003F-00000FFF-00000001
CPUID 00000005: 00000040-00000040-00000003-00000020
CPUID 00000006: 00000001-00000002-00000001-00000000
CPUID 00000007: 00000000-00000000-00000000-00000000
CPUID 00000008: 00000400-00000000-00000000-00000000
CPUID 00000009: 00000000-00000000-00000000-00000000
CPUID 0000000A: 07280202-00000000-00000000-00000503
CPUID 80000000: 80000008-00000000-00000000-00000000
CPUID 80000001: 00000000-00000000-00000001-20100000
CPUID 80000002: 65746E49-2952286C-726F4320-4D542865
CPUID 80000003: 45203229-65727478-4320656D-58205550
CPUID 80000004: 30353639-20402020-30302E33-007A4847
CPUID 80000005: 00000000-00000000-00000000-00000000
CPUID 80000006: 00000000-00000000-18008040-00000000
CPUID 80000007: 00000000-00000000-00000000-00000000
CPUID 80000008: 00003024-00000000-00000000-00000000

L1    Data Cache:     32 KB,  8-way Associative, 64-byte Line
L1  Instr. Cache:     32 KB,  8-way Associative, 64-byte Line
L2 Unified Cache:   6144 KB, 24-way Associative, 64-byte Line

------[ Logical CPU #2 ]------

allcpu: Valid

CPUID 00000000: 0000000A-756E6547-6C65746E-49656E69
CPUID 00000001: 00010676-03040800-0008E3BD-BFEBFBFF
CPUID 00000002: 05B0B101-005657F0-00000000-2CB4304E
CPUID 00000003: 00000000-00000000-00000000-00000000
CPUID 00000004: 0C000121-01C0003F-0000003F-00000001
CPUID 00000004: 0C000122-01C0003F-0000003F-00000001
CPUID 00000004: 0C004143-05C0003F-00000FFF-00000001
CPUID 00000005: 00000040-00000040-00000003-00000020
CPUID 00000006: 00000001-00000002-00000001-00000000
CPUID 00000007: 00000000-00000000-00000000-00000000
CPUID 00000008: 00000400-00000000-00000000-00000000
CPUID 00000009: 00000000-00000000-00000000-00000000
CPUID 0000000A: 07280202-00000000-00000000-00000503
CPUID 80000000: 80000008-00000000-00000000-00000000
CPUID 80000001: 00000000-00000000-00000001-20100000
CPUID 80000002: 65746E49-2952286C-726F4320-4D542865
CPUID 80000003: 45203229-65727478-4320656D-58205550
CPUID 80000004: 30353639-20402020-30302E33-007A4847
CPUID 80000005: 00000000-00000000-00000000-00000000
CPUID 80000006: 00000000-00000000-18008040-00000000
CPUID 80000007: 00000000-00000000-00000000-00000000
CPUID 80000008: 00003024-00000000-00000000-00000000

L1    Data Cache:     32 KB,  8-way Associative, 64-byte Line
L1  Instr. Cache:     32 KB,  8-way Associative, 64-byte Line
L2 Unified Cache:   6144 KB, 24-way Associative, 64-byte Line

------[ Logical CPU #3 ]------

allcpu: Valid

CPUID 00000000: 0000000A-756E6547-6C65746E-49656E69
CPUID 00000001: 00010676-01040800-0008E3BD-BFEBFBFF
CPUID 00000002: 05B0B101-005657F0-00000000-2CB4304E
CPUID 00000003: 00000000-00000000-00000000-00000000
CPUID 00000004: 0C000121-01C0003F-0000003F-00000001
CPUID 00000004: 0C000122-01C0003F-0000003F-00000001
CPUID 00000004: 0C004143-05C0003F-00000FFF-00000001
CPUID 00000005: 00000040-00000040-00000003-00000020
CPUID 00000006: 00000001-00000002-00000001-00000000
CPUID 00000007: 00000000-00000000-00000000-00000000
CPUID 00000008: 00000400-00000000-00000000-00000000
CPUID 00000009: 00000000-00000000-00000000-00000000
CPUID 0000000A: 07280202-00000000-00000000-00000503
CPUID 80000000: 80000008-00000000-00000000-00000000
CPUID 80000001: 00000000-00000000-00000001-20100000
CPUID 80000002: 65746E49-2952286C-726F4320-4D542865
CPUID 80000003: 45203229-65727478-4320656D-58205550
CPUID 80000004: 30353639-20402020-30302E33-007A4847
CPUID 80000005: 00000000-00000000-00000000-00000000
CPUID 80000006: 00000000-00000000-18008040-00000000
CPUID 80000007: 00000000-00000000-00000000-00000000
CPUID 80000008: 00003024-00000000-00000000-00000000

L1    Data Cache:     32 KB,  8-way Associative, 64-byte Line
L1  Instr. Cache:     32 KB,  8-way Associative, 64-byte Line
L2 Unified Cache:   6144 KB, 24-way Associative, 64-byte Line

------[ MSR Registers ]------

MSR 00000017: 0C10-0000-88C4-091F [PlatID = 4]
MSR 0000001B: 0000-0000-FEE0-0900
MSR 0000002A: 0000-0000-4248-0000
MSR 0000008B: 0000-060C-0000-0000
MSR 000000CD: 0000-0000-0000-0804
MSR 000000CE: 0016-091F-7F7F-0712
MSR 000000E7: 0000-0046-503B-B1C1
MSR 000000E8: 0000-0046-503B-D41A
MSR 000000EE: 0000-0000-877D-4B00
MSR 0000011E: 0000-0000-BE70-2111
MSR 00000198: 0616-091F-8600-091F
MSR 00000199: 0000-0000-0000-091F
MSR 0000019A: 0000-0000-0000-0008
MSR 0000019B: 0000-0000-0000-0000
MSR 0000019C: 0000-0000-883D-0000
MSR 0000019D: 0000-0000-0000-0616
MSR 000001A0: 0000-0040-6086-2489

PerformanceFrequency = 3000050000

Tjmax Temperature = 95 Celsius
