------[ Versions ]------

Program Version : AIDA64 v4.70.3200
BenchDLL Version: 4.1.622-x64

------[ CPU Info ]------

CPU Type          : HexaCore Intel Core i7-5820K, 3300 MHz (33 x 100)
CPU Alias         : Haswell-E
CPU Platform      : LGA2011-v3
CPU Stepping      : R2
Instruction Set   : x86, x86-64, MMX, SSE, SSE2, SSE3, SSSE3, SSE4.1, SSE4.2, AVX, AVX2, FMA, AES
CPUID Manufacturer: GenuineIntel
CPUID CPU Name    : Intel(R) Core(TM) i7-5820K CPU @ 3.30GHz
CPUID Revision    : 000306F2h
IA Brand ID       : 00h  (Unknown)
Platform ID       : 44h  (LGA2011-v3)
HTT / CMP Units   : 2 / 6
Max. NUMA Node    : 0

Tjmax Temperature          : 94 Celsius
HTC Temperature Limit      : 0 Celsius
CPU TDP                    : 140 W
DRAM TDP                   : 11 W
CPU TDC                    : 1000 A
CPU Max Power Limit        : Unlimited Power / Unlimited Time
CPU Power Limit 1 (Long)   : 3408.3 W / 1.00 sec  (Unlocked)
CPU Power Limit 2 (Short)  : 4090 W / 7.81 ms  (Unlocked)
Max Turbo Boost Multipliers: 1C: 36x, 2C: 36x, 3C: 34x, 4C: 34x, 5C: 34x, 6C: 34x

------[ Logical CPU #0 ]------

allcpu: Package 0 / Core 0 / Thread 0: Valid

CPUID 00000000: 0000000F-756E6547-6C65746E-49656E69 [GenuineIntel]
CPUID 00000001: 000306F2-00100800-7FFEFBBF-BFEBFBFF
CPUID 00000002: 76036301-00F0B5FF-00000000-00C10000
CPUID 00000003: 00000000-00000000-00000000-00000000
CPUID 00000004: 1C004121-01C0003F-0000003F-00000000 [SL 00]
CPUID 00000004: 1C004122-01C0003F-0000003F-00000000 [SL 01]
CPUID 00000004: 1C004143-01C0003F-000001FF-00000000 [SL 02]
CPUID 00000004: 1C03C163-04C0003F-00002FFF-00000006 [SL 03]
CPUID 00000005: 00000040-00000040-00000003-00002120
CPUID 00000006: 00000075-00000002-00000009-00000000
CPUID 00000007: 00000000-000037AB-00000000-00000000
CPUID 00000008: 00000000-00000000-00000000-00000000
CPUID 00000009: 00000001-00000000-00000000-00000000
CPUID 0000000A: 07300403-00000000-00000000-00000603
CPUID 0000000B: 00000001-00000002-00000100-00000000 [SL 00]
CPUID 0000000B: 00000004-0000000C-00000201-00000000 [SL 01]
CPUID 0000000C: 00000000-00000000-00000000-00000000
CPUID 0000000D: 00000007-00000340-00000340-00000000 [SL 00]
CPUID 0000000D: 00000001-00000000-00000000-00000000 [SL 01]
CPUID 0000000D: 00000100-00000240-00000000-00000000 [SL 02]
CPUID 0000000E: 00000000-00000000-00000000-00000000
CPUID 0000000F: 00000000-00000017-00000000-00000002 [SL 00]
CPUID 0000000F: 00000000-00006000-00000017-00000001 [SL 01]
CPUID 80000000: 80000008-00000000-00000000-00000000
CPUID 80000001: 00000000-00000000-00000021-2C100000
CPUID 80000002: 65746E49-2952286C-726F4320-4D542865 [Intel(R) Core(TM]
CPUID 80000003: 37692029-3238352D-43204B30-40205550 [) i7-5820K CPU @]
CPUID 80000004: 332E3320-7A484730-00000000-00000000 [ 3.30GHz]
CPUID 80000005: 00000000-00000000-00000000-00000000
CPUID 80000006: 00000000-00000000-01006040-00000000
CPUID 80000007: 00000000-00000000-00000000-00000100
CPUID 80000008: 0000302E-00000000-00000000-00000000

L1    Data Cache:    32 KB,  8-way Associative, 64-byte Line
L1  Instr. Cache:    32 KB,  8-way Associative, 64-byte Line
L2 Unified Cache:   256 KB,  8-way Associative, 64-byte Line
L3 Unified Cache:    15 MB, 20-way Associative, 64-byte Line

------[ Logical CPU #1 ]------

allcpu: Package 0 / Core 0 / Thread 1: Valid, Virtual

CPUID 00000000: 0000000F-756E6547-6C65746E-49656E69 [GenuineIntel]
CPUID 00000001: 000306F2-01100800-7FFEFBBF-BFEBFBFF
CPUID 00000002: 76036301-00F0B5FF-00000000-00C10000
CPUID 00000003: 00000000-00000000-00000000-00000000
CPUID 00000004: 1C004121-01C0003F-0000003F-00000000 [SL 00]
CPUID 00000004: 1C004122-01C0003F-0000003F-00000000 [SL 01]
CPUID 00000004: 1C004143-01C0003F-000001FF-00000000 [SL 02]
CPUID 00000004: 1C03C163-04C0003F-00002FFF-00000006 [SL 03]
CPUID 00000005: 00000040-00000040-00000003-00002120
CPUID 00000006: 00000075-00000002-00000009-00000000
CPUID 00000007: 00000000-000037AB-00000000-00000000
CPUID 00000008: 00000000-00000000-00000000-00000000
CPUID 00000009: 00000001-00000000-00000000-00000000
CPUID 0000000A: 07300403-00000000-00000000-00000603
CPUID 0000000B: 00000001-00000002-00000100-00000001 [SL 00]
CPUID 0000000B: 00000004-0000000C-00000201-00000001 [SL 01]
CPUID 0000000C: 00000000-00000000-00000000-00000000
CPUID 0000000D: 00000007-00000340-00000340-00000000 [SL 00]
CPUID 0000000D: 00000001-00000000-00000000-00000000 [SL 01]
CPUID 0000000D: 00000100-00000240-00000000-00000000 [SL 02]
CPUID 0000000E: 00000000-00000000-00000000-00000000
CPUID 0000000F: 00000000-00000017-00000000-00000002 [SL 00]
CPUID 0000000F: 00000000-00006000-00000017-00000001 [SL 01]
CPUID 80000000: 80000008-00000000-00000000-00000000
CPUID 80000001: 00000000-00000000-00000021-2C100000
CPUID 80000002: 65746E49-2952286C-726F4320-4D542865 [Intel(R) Core(TM]
CPUID 80000003: 37692029-3238352D-43204B30-40205550 [) i7-5820K CPU @]
CPUID 80000004: 332E3320-7A484730-00000000-00000000 [ 3.30GHz]
CPUID 80000005: 00000000-00000000-00000000-00000000
CPUID 80000006: 00000000-00000000-01006040-00000000
CPUID 80000007: 00000000-00000000-00000000-00000100
CPUID 80000008: 0000302E-00000000-00000000-00000000

L1    Data Cache:    32 KB,  8-way Associative, 64-byte Line
L1  Instr. Cache:    32 KB,  8-way Associative, 64-byte Line
L2 Unified Cache:   256 KB,  8-way Associative, 64-byte Line
L3 Unified Cache:    15 MB, 20-way Associative, 64-byte Line

------[ Logical CPU #2 ]------

allcpu: Package 0 / Core 1 / Thread 0: Valid

CPUID 00000000: 0000000F-756E6547-6C65746E-49656E69 [GenuineIntel]
CPUID 00000001: 000306F2-02100800-7FFEFBBF-BFEBFBFF
CPUID 00000002: 76036301-00F0B5FF-00000000-00C10000
CPUID 00000003: 00000000-00000000-00000000-00000000
CPUID 00000004: 1C004121-01C0003F-0000003F-00000000 [SL 00]
CPUID 00000004: 1C004122-01C0003F-0000003F-00000000 [SL 01]
CPUID 00000004: 1C004143-01C0003F-000001FF-00000000 [SL 02]
CPUID 00000004: 1C03C163-04C0003F-00002FFF-00000006 [SL 03]
CPUID 00000005: 00000040-00000040-00000003-00002120
CPUID 00000006: 00000075-00000002-00000009-00000000
CPUID 00000007: 00000000-000037AB-00000000-00000000
CPUID 00000008: 00000000-00000000-00000000-00000000
CPUID 00000009: 00000001-00000000-00000000-00000000
CPUID 0000000A: 07300403-00000000-00000000-00000603
CPUID 0000000B: 00000001-00000002-00000100-00000002 [SL 00]
CPUID 0000000B: 00000004-0000000C-00000201-00000002 [SL 01]
CPUID 0000000C: 00000000-00000000-00000000-00000000
CPUID 0000000D: 00000007-00000340-00000340-00000000 [SL 00]
CPUID 0000000D: 00000001-00000000-00000000-00000000 [SL 01]
CPUID 0000000D: 00000100-00000240-00000000-00000000 [SL 02]
CPUID 0000000E: 00000000-00000000-00000000-00000000
CPUID 0000000F: 00000000-00000017-00000000-00000002 [SL 00]
CPUID 0000000F: 00000000-00006000-00000017-00000001 [SL 01]
CPUID 80000000: 80000008-00000000-00000000-00000000
CPUID 80000001: 00000000-00000000-00000021-2C100000
CPUID 80000002: 65746E49-2952286C-726F4320-4D542865 [Intel(R) Core(TM]
CPUID 80000003: 37692029-3238352D-43204B30-40205550 [) i7-5820K CPU @]
CPUID 80000004: 332E3320-7A484730-00000000-00000000 [ 3.30GHz]
CPUID 80000005: 00000000-00000000-00000000-00000000
CPUID 80000006: 00000000-00000000-01006040-00000000
CPUID 80000007: 00000000-00000000-00000000-00000100
CPUID 80000008: 0000302E-00000000-00000000-00000000

L1    Data Cache:    32 KB,  8-way Associative, 64-byte Line
L1  Instr. Cache:    32 KB,  8-way Associative, 64-byte Line
L2 Unified Cache:   256 KB,  8-way Associative, 64-byte Line
L3 Unified Cache:    15 MB, 20-way Associative, 64-byte Line

------[ Logical CPU #3 ]------

allcpu: Package 0 / Core 1 / Thread 1: Valid, Virtual

CPUID 00000000: 0000000F-756E6547-6C65746E-49656E69 [GenuineIntel]
CPUID 00000001: 000306F2-03100800-7FFEFBBF-BFEBFBFF
CPUID 00000002: 76036301-00F0B5FF-00000000-00C10000
CPUID 00000003: 00000000-00000000-00000000-00000000
CPUID 00000004: 1C004121-01C0003F-0000003F-00000000 [SL 00]
CPUID 00000004: 1C004122-01C0003F-0000003F-00000000 [SL 01]
CPUID 00000004: 1C004143-01C0003F-000001FF-00000000 [SL 02]
CPUID 00000004: 1C03C163-04C0003F-00002FFF-00000006 [SL 03]
CPUID 00000005: 00000040-00000040-00000003-00002120
CPUID 00000006: 00000075-00000002-00000009-00000000
CPUID 00000007: 00000000-000037AB-00000000-00000000
CPUID 00000008: 00000000-00000000-00000000-00000000
CPUID 00000009: 00000001-00000000-00000000-00000000
CPUID 0000000A: 07300403-00000000-00000000-00000603
CPUID 0000000B: 00000001-00000002-00000100-00000003 [SL 00]
CPUID 0000000B: 00000004-0000000C-00000201-00000003 [SL 01]
CPUID 0000000C: 00000000-00000000-00000000-00000000
CPUID 0000000D: 00000007-00000340-00000340-00000000 [SL 00]
CPUID 0000000D: 00000001-00000000-00000000-00000000 [SL 01]
CPUID 0000000D: 00000100-00000240-00000000-00000000 [SL 02]
CPUID 0000000E: 00000000-00000000-00000000-00000000
CPUID 0000000F: 00000000-00000017-00000000-00000002 [SL 00]
CPUID 0000000F: 00000000-00006000-00000017-00000001 [SL 01]
CPUID 80000000: 80000008-00000000-00000000-00000000
CPUID 80000001: 00000000-00000000-00000021-2C100000
CPUID 80000002: 65746E49-2952286C-726F4320-4D542865 [Intel(R) Core(TM]
CPUID 80000003: 37692029-3238352D-43204B30-40205550 [) i7-5820K CPU @]
CPUID 80000004: 332E3320-7A484730-00000000-00000000 [ 3.30GHz]
CPUID 80000005: 00000000-00000000-00000000-00000000
CPUID 80000006: 00000000-00000000-01006040-00000000
CPUID 80000007: 00000000-00000000-00000000-00000100
CPUID 80000008: 0000302E-00000000-00000000-00000000

L1    Data Cache:    32 KB,  8-way Associative, 64-byte Line
L1  Instr. Cache:    32 KB,  8-way Associative, 64-byte Line
L2 Unified Cache:   256 KB,  8-way Associative, 64-byte Line
L3 Unified Cache:    15 MB, 20-way Associative, 64-byte Line

------[ Logical CPU #4 ]------

allcpu: Package 0 / Core 2 / Thread 0: Valid

CPUID 00000000: 0000000F-756E6547-6C65746E-49656E69 [GenuineIntel]
CPUID 00000001: 000306F2-04100800-7FFEFBBF-BFEBFBFF
CPUID 00000002: 76036301-00F0B5FF-00000000-00C10000
CPUID 00000003: 00000000-00000000-00000000-00000000
CPUID 00000004: 1C004121-01C0003F-0000003F-00000000 [SL 00]
CPUID 00000004: 1C004122-01C0003F-0000003F-00000000 [SL 01]
CPUID 00000004: 1C004143-01C0003F-000001FF-00000000 [SL 02]
CPUID 00000004: 1C03C163-04C0003F-00002FFF-00000006 [SL 03]
CPUID 00000005: 00000040-00000040-00000003-00002120
CPUID 00000006: 00000075-00000002-00000009-00000000
CPUID 00000007: 00000000-000037AB-00000000-00000000
CPUID 00000008: 00000000-00000000-00000000-00000000
CPUID 00000009: 00000001-00000000-00000000-00000000
CPUID 0000000A: 07300403-00000000-00000000-00000603
CPUID 0000000B: 00000001-00000002-00000100-00000004 [SL 00]
CPUID 0000000B: 00000004-0000000C-00000201-00000004 [SL 01]
CPUID 0000000C: 00000000-00000000-00000000-00000000
CPUID 0000000D: 00000007-00000340-00000340-00000000 [SL 00]
CPUID 0000000D: 00000001-00000000-00000000-00000000 [SL 01]
CPUID 0000000D: 00000100-00000240-00000000-00000000 [SL 02]
CPUID 0000000E: 00000000-00000000-00000000-00000000
CPUID 0000000F: 00000000-00000017-00000000-00000002 [SL 00]
CPUID 0000000F: 00000000-00006000-00000017-00000001 [SL 01]
CPUID 80000000: 80000008-00000000-00000000-00000000
CPUID 80000001: 00000000-00000000-00000021-2C100000
CPUID 80000002: 65746E49-2952286C-726F4320-4D542865 [Intel(R) Core(TM]
CPUID 80000003: 37692029-3238352D-43204B30-40205550 [) i7-5820K CPU @]
CPUID 80000004: 332E3320-7A484730-00000000-00000000 [ 3.30GHz]
CPUID 80000005: 00000000-00000000-00000000-00000000
CPUID 80000006: 00000000-00000000-01006040-00000000
CPUID 80000007: 00000000-00000000-00000000-00000100
CPUID 80000008: 0000302E-00000000-00000000-00000000

L1    Data Cache:    32 KB,  8-way Associative, 64-byte Line
L1  Instr. Cache:    32 KB,  8-way Associative, 64-byte Line
L2 Unified Cache:   256 KB,  8-way Associative, 64-byte Line
L3 Unified Cache:    15 MB, 20-way Associative, 64-byte Line

------[ Logical CPU #5 ]------

allcpu: Package 0 / Core 2 / Thread 1: Valid, Virtual

CPUID 00000000: 0000000F-756E6547-6C65746E-49656E69 [GenuineIntel]
CPUID 00000001: 000306F2-05100800-7FFEFBBF-BFEBFBFF
CPUID 00000002: 76036301-00F0B5FF-00000000-00C10000
CPUID 00000003: 00000000-00000000-00000000-00000000
CPUID 00000004: 1C004121-01C0003F-0000003F-00000000 [SL 00]
CPUID 00000004: 1C004122-01C0003F-0000003F-00000000 [SL 01]
CPUID 00000004: 1C004143-01C0003F-000001FF-00000000 [SL 02]
CPUID 00000004: 1C03C163-04C0003F-00002FFF-00000006 [SL 03]
CPUID 00000005: 00000040-00000040-00000003-00002120
CPUID 00000006: 00000075-00000002-00000009-00000000
CPUID 00000007: 00000000-000037AB-00000000-00000000
CPUID 00000008: 00000000-00000000-00000000-00000000
CPUID 00000009: 00000001-00000000-00000000-00000000
CPUID 0000000A: 07300403-00000000-00000000-00000603
CPUID 0000000B: 00000001-00000002-00000100-00000005 [SL 00]
CPUID 0000000B: 00000004-0000000C-00000201-00000005 [SL 01]
CPUID 0000000C: 00000000-00000000-00000000-00000000
CPUID 0000000D: 00000007-00000340-00000340-00000000 [SL 00]
CPUID 0000000D: 00000001-00000000-00000000-00000000 [SL 01]
CPUID 0000000D: 00000100-00000240-00000000-00000000 [SL 02]
CPUID 0000000E: 00000000-00000000-00000000-00000000
CPUID 0000000F: 00000000-00000017-00000000-00000002 [SL 00]
CPUID 0000000F: 00000000-00006000-00000017-00000001 [SL 01]
CPUID 80000000: 80000008-00000000-00000000-00000000
CPUID 80000001: 00000000-00000000-00000021-2C100000
CPUID 80000002: 65746E49-2952286C-726F4320-4D542865 [Intel(R) Core(TM]
CPUID 80000003: 37692029-3238352D-43204B30-40205550 [) i7-5820K CPU @]
CPUID 80000004: 332E3320-7A484730-00000000-00000000 [ 3.30GHz]
CPUID 80000005: 00000000-00000000-00000000-00000000
CPUID 80000006: 00000000-00000000-01006040-00000000
CPUID 80000007: 00000000-00000000-00000000-00000100
CPUID 80000008: 0000302E-00000000-00000000-00000000

L1    Data Cache:    32 KB,  8-way Associative, 64-byte Line
L1  Instr. Cache:    32 KB,  8-way Associative, 64-byte Line
L2 Unified Cache:   256 KB,  8-way Associative, 64-byte Line
L3 Unified Cache:    15 MB, 20-way Associative, 64-byte Line

------[ Logical CPU #6 ]------

allcpu: Package 0 / Core 3 / Thread 0: Valid

CPUID 00000000: 0000000F-756E6547-6C65746E-49656E69 [GenuineIntel]
CPUID 00000001: 000306F2-06100800-7FFEFBBF-BFEBFBFF
CPUID 00000002: 76036301-00F0B5FF-00000000-00C10000
CPUID 00000003: 00000000-00000000-00000000-00000000
CPUID 00000004: 1C004121-01C0003F-0000003F-00000000 [SL 00]
CPUID 00000004: 1C004122-01C0003F-0000003F-00000000 [SL 01]
CPUID 00000004: 1C004143-01C0003F-000001FF-00000000 [SL 02]
CPUID 00000004: 1C03C163-04C0003F-00002FFF-00000006 [SL 03]
CPUID 00000005: 00000040-00000040-00000003-00002120
CPUID 00000006: 00000075-00000002-00000009-00000000
CPUID 00000007: 00000000-000037AB-00000000-00000000
CPUID 00000008: 00000000-00000000-00000000-00000000
CPUID 00000009: 00000001-00000000-00000000-00000000
CPUID 0000000A: 07300403-00000000-00000000-00000603
CPUID 0000000B: 00000001-00000002-00000100-00000006 [SL 00]
CPUID 0000000B: 00000004-0000000C-00000201-00000006 [SL 01]
CPUID 0000000C: 00000000-00000000-00000000-00000000
CPUID 0000000D: 00000007-00000340-00000340-00000000 [SL 00]
CPUID 0000000D: 00000001-00000000-00000000-00000000 [SL 01]
CPUID 0000000D: 00000100-00000240-00000000-00000000 [SL 02]
CPUID 0000000E: 00000000-00000000-00000000-00000000
CPUID 0000000F: 00000000-00000017-00000000-00000002 [SL 00]
CPUID 0000000F: 00000000-00006000-00000017-00000001 [SL 01]
CPUID 80000000: 80000008-00000000-00000000-00000000
CPUID 80000001: 00000000-00000000-00000021-2C100000
CPUID 80000002: 65746E49-2952286C-726F4320-4D542865 [Intel(R) Core(TM]
CPUID 80000003: 37692029-3238352D-43204B30-40205550 [) i7-5820K CPU @]
CPUID 80000004: 332E3320-7A484730-00000000-00000000 [ 3.30GHz]
CPUID 80000005: 00000000-00000000-00000000-00000000
CPUID 80000006: 00000000-00000000-01006040-00000000
CPUID 80000007: 00000000-00000000-00000000-00000100
CPUID 80000008: 0000302E-00000000-00000000-00000000

L1    Data Cache:    32 KB,  8-way Associative, 64-byte Line
L1  Instr. Cache:    32 KB,  8-way Associative, 64-byte Line
L2 Unified Cache:   256 KB,  8-way Associative, 64-byte Line
L3 Unified Cache:    15 MB, 20-way Associative, 64-byte Line

------[ Logical CPU #7 ]------

allcpu: Package 0 / Core 3 / Thread 1: Valid, Virtual

CPUID 00000000: 0000000F-756E6547-6C65746E-49656E69 [GenuineIntel]
CPUID 00000001: 000306F2-07100800-7FFEFBBF-BFEBFBFF
CPUID 00000002: 76036301-00F0B5FF-00000000-00C10000
CPUID 00000003: 00000000-00000000-00000000-00000000
CPUID 00000004: 1C004121-01C0003F-0000003F-00000000 [SL 00]
CPUID 00000004: 1C004122-01C0003F-0000003F-00000000 [SL 01]
CPUID 00000004: 1C004143-01C0003F-000001FF-00000000 [SL 02]
CPUID 00000004: 1C03C163-04C0003F-00002FFF-00000006 [SL 03]
CPUID 00000005: 00000040-00000040-00000003-00002120
CPUID 00000006: 00000075-00000002-00000009-00000000
CPUID 00000007: 00000000-000037AB-00000000-00000000
CPUID 00000008: 00000000-00000000-00000000-00000000
CPUID 00000009: 00000001-00000000-00000000-00000000
CPUID 0000000A: 07300403-00000000-00000000-00000603
CPUID 0000000B: 00000001-00000002-00000100-00000007 [SL 00]
CPUID 0000000B: 00000004-0000000C-00000201-00000007 [SL 01]
CPUID 0000000C: 00000000-00000000-00000000-00000000
CPUID 0000000D: 00000007-00000340-00000340-00000000 [SL 00]
CPUID 0000000D: 00000001-00000000-00000000-00000000 [SL 01]
CPUID 0000000D: 00000100-00000240-00000000-00000000 [SL 02]
CPUID 0000000E: 00000000-00000000-00000000-00000000
CPUID 0000000F: 00000000-00000017-00000000-00000002 [SL 00]
CPUID 0000000F: 00000000-00006000-00000017-00000001 [SL 01]
CPUID 80000000: 80000008-00000000-00000000-00000000
CPUID 80000001: 00000000-00000000-00000021-2C100000
CPUID 80000002: 65746E49-2952286C-726F4320-4D542865 [Intel(R) Core(TM]
CPUID 80000003: 37692029-3238352D-43204B30-40205550 [) i7-5820K CPU @]
CPUID 80000004: 332E3320-7A484730-00000000-00000000 [ 3.30GHz]
CPUID 80000005: 00000000-00000000-00000000-00000000
CPUID 80000006: 00000000-00000000-01006040-00000000
CPUID 80000007: 00000000-00000000-00000000-00000100
CPUID 80000008: 0000302E-00000000-00000000-00000000

L1    Data Cache:    32 KB,  8-way Associative, 64-byte Line
L1  Instr. Cache:    32 KB,  8-way Associative, 64-byte Line
L2 Unified Cache:   256 KB,  8-way Associative, 64-byte Line
L3 Unified Cache:    15 MB, 20-way Associative, 64-byte Line

------[ Logical CPU #8 ]------

allcpu: Package 0 / Core 4 / Thread 0: Valid

CPUID 00000000: 0000000F-756E6547-6C65746E-49656E69 [GenuineIntel]
CPUID 00000001: 000306F2-08100800-7FFEFBBF-BFEBFBFF
CPUID 00000002: 76036301-00F0B5FF-00000000-00C10000
CPUID 00000003: 00000000-00000000-00000000-00000000
CPUID 00000004: 1C004121-01C0003F-0000003F-00000000 [SL 00]
CPUID 00000004: 1C004122-01C0003F-0000003F-00000000 [SL 01]
CPUID 00000004: 1C004143-01C0003F-000001FF-00000000 [SL 02]
CPUID 00000004: 1C03C163-04C0003F-00002FFF-00000006 [SL 03]
CPUID 00000005: 00000040-00000040-00000003-00002120
CPUID 00000006: 00000075-00000002-00000009-00000000
CPUID 00000007: 00000000-000037AB-00000000-00000000
CPUID 00000008: 00000000-00000000-00000000-00000000
CPUID 00000009: 00000001-00000000-00000000-00000000
CPUID 0000000A: 07300403-00000000-00000000-00000603
CPUID 0000000B: 00000001-00000002-00000100-00000008 [SL 00]
CPUID 0000000B: 00000004-0000000C-00000201-00000008 [SL 01]
CPUID 0000000C: 00000000-00000000-00000000-00000000
CPUID 0000000D: 00000007-00000340-00000340-00000000 [SL 00]
CPUID 0000000D: 00000001-00000000-00000000-00000000 [SL 01]
CPUID 0000000D: 00000100-00000240-00000000-00000000 [SL 02]
CPUID 0000000E: 00000000-00000000-00000000-00000000
CPUID 0000000F: 00000000-00000017-00000000-00000002 [SL 00]
CPUID 0000000F: 00000000-00006000-00000017-00000001 [SL 01]
CPUID 80000000: 80000008-00000000-00000000-00000000
CPUID 80000001: 00000000-00000000-00000021-2C100000
CPUID 80000002: 65746E49-2952286C-726F4320-4D542865 [Intel(R) Core(TM]
CPUID 80000003: 37692029-3238352D-43204B30-40205550 [) i7-5820K CPU @]
CPUID 80000004: 332E3320-7A484730-00000000-00000000 [ 3.30GHz]
CPUID 80000005: 00000000-00000000-00000000-00000000
CPUID 80000006: 00000000-00000000-01006040-00000000
CPUID 80000007: 00000000-00000000-00000000-00000100
CPUID 80000008: 0000302E-00000000-00000000-00000000

L1    Data Cache:    32 KB,  8-way Associative, 64-byte Line
L1  Instr. Cache:    32 KB,  8-way Associative, 64-byte Line
L2 Unified Cache:   256 KB,  8-way Associative, 64-byte Line
L3 Unified Cache:    15 MB, 20-way Associative, 64-byte Line

------[ Logical CPU #9 ]------

allcpu: Package 0 / Core 4 / Thread 1: Valid, Virtual

CPUID 00000000: 0000000F-756E6547-6C65746E-49656E69 [GenuineIntel]
CPUID 00000001: 000306F2-09100800-7FFEFBBF-BFEBFBFF
CPUID 00000002: 76036301-00F0B5FF-00000000-00C10000
CPUID 00000003: 00000000-00000000-00000000-00000000
CPUID 00000004: 1C004121-01C0003F-0000003F-00000000 [SL 00]
CPUID 00000004: 1C004122-01C0003F-0000003F-00000000 [SL 01]
CPUID 00000004: 1C004143-01C0003F-000001FF-00000000 [SL 02]
CPUID 00000004: 1C03C163-04C0003F-00002FFF-00000006 [SL 03]
CPUID 00000005: 00000040-00000040-00000003-00002120
CPUID 00000006: 00000075-00000002-00000009-00000000
CPUID 00000007: 00000000-000037AB-00000000-00000000
CPUID 00000008: 00000000-00000000-00000000-00000000
CPUID 00000009: 00000001-00000000-00000000-00000000
CPUID 0000000A: 07300403-00000000-00000000-00000603
CPUID 0000000B: 00000001-00000002-00000100-00000009 [SL 00]
CPUID 0000000B: 00000004-0000000C-00000201-00000009 [SL 01]
CPUID 0000000C: 00000000-00000000-00000000-00000000
CPUID 0000000D: 00000007-00000340-00000340-00000000 [SL 00]
CPUID 0000000D: 00000001-00000000-00000000-00000000 [SL 01]
CPUID 0000000D: 00000100-00000240-00000000-00000000 [SL 02]
CPUID 0000000E: 00000000-00000000-00000000-00000000
CPUID 0000000F: 00000000-00000017-00000000-00000002 [SL 00]
CPUID 0000000F: 00000000-00006000-00000017-00000001 [SL 01]
CPUID 80000000: 80000008-00000000-00000000-00000000
CPUID 80000001: 00000000-00000000-00000021-2C100000
CPUID 80000002: 65746E49-2952286C-726F4320-4D542865 [Intel(R) Core(TM]
CPUID 80000003: 37692029-3238352D-43204B30-40205550 [) i7-5820K CPU @]
CPUID 80000004: 332E3320-7A484730-00000000-00000000 [ 3.30GHz]
CPUID 80000005: 00000000-00000000-00000000-00000000
CPUID 80000006: 00000000-00000000-01006040-00000000
CPUID 80000007: 00000000-00000000-00000000-00000100
CPUID 80000008: 0000302E-00000000-00000000-00000000

L1    Data Cache:    32 KB,  8-way Associative, 64-byte Line
L1  Instr. Cache:    32 KB,  8-way Associative, 64-byte Line
L2 Unified Cache:   256 KB,  8-way Associative, 64-byte Line
L3 Unified Cache:    15 MB, 20-way Associative, 64-byte Line

------[ Logical CPU #10 ]------

allcpu: Package 0 / Core 5 / Thread 0: Valid

CPUID 00000000: 0000000F-756E6547-6C65746E-49656E69 [GenuineIntel]
CPUID 00000001: 000306F2-0A100800-7FFEFBBF-BFEBFBFF
CPUID 00000002: 76036301-00F0B5FF-00000000-00C10000
CPUID 00000003: 00000000-00000000-00000000-00000000
CPUID 00000004: 1C004121-01C0003F-0000003F-00000000 [SL 00]
CPUID 00000004: 1C004122-01C0003F-0000003F-00000000 [SL 01]
CPUID 00000004: 1C004143-01C0003F-000001FF-00000000 [SL 02]
CPUID 00000004: 1C03C163-04C0003F-00002FFF-00000006 [SL 03]
CPUID 00000005: 00000040-00000040-00000003-00002120
CPUID 00000006: 00000075-00000002-00000009-00000000
CPUID 00000007: 00000000-000037AB-00000000-00000000
CPUID 00000008: 00000000-00000000-00000000-00000000
CPUID 00000009: 00000001-00000000-00000000-00000000
CPUID 0000000A: 07300403-00000000-00000000-00000603
CPUID 0000000B: 00000001-00000002-00000100-0000000A [SL 00]
CPUID 0000000B: 00000004-0000000C-00000201-0000000A [SL 01]
CPUID 0000000C: 00000000-00000000-00000000-00000000
CPUID 0000000D: 00000007-00000340-00000340-00000000 [SL 00]
CPUID 0000000D: 00000001-00000000-00000000-00000000 [SL 01]
CPUID 0000000D: 00000100-00000240-00000000-00000000 [SL 02]
CPUID 0000000E: 00000000-00000000-00000000-00000000
CPUID 0000000F: 00000000-00000017-00000000-00000002 [SL 00]
CPUID 0000000F: 00000000-00006000-00000017-00000001 [SL 01]
CPUID 80000000: 80000008-00000000-00000000-00000000
CPUID 80000001: 00000000-00000000-00000021-2C100000
CPUID 80000002: 65746E49-2952286C-726F4320-4D542865 [Intel(R) Core(TM]
CPUID 80000003: 37692029-3238352D-43204B30-40205550 [) i7-5820K CPU @]
CPUID 80000004: 332E3320-7A484730-00000000-00000000 [ 3.30GHz]
CPUID 80000005: 00000000-00000000-00000000-00000000
CPUID 80000006: 00000000-00000000-01006040-00000000
CPUID 80000007: 00000000-00000000-00000000-00000100
CPUID 80000008: 0000302E-00000000-00000000-00000000

L1    Data Cache:    32 KB,  8-way Associative, 64-byte Line
L1  Instr. Cache:    32 KB,  8-way Associative, 64-byte Line
L2 Unified Cache:   256 KB,  8-way Associative, 64-byte Line
L3 Unified Cache:    15 MB, 20-way Associative, 64-byte Line

------[ Logical CPU #11 ]------

allcpu: Package 0 / Core 5 / Thread 1: Valid, Virtual

CPUID 00000000: 0000000F-756E6547-6C65746E-49656E69 [GenuineIntel]
CPUID 00000001: 000306F2-0B100800-7FFEFBBF-BFEBFBFF
CPUID 00000002: 76036301-00F0B5FF-00000000-00C10000
CPUID 00000003: 00000000-00000000-00000000-00000000
CPUID 00000004: 1C004121-01C0003F-0000003F-00000000 [SL 00]
CPUID 00000004: 1C004122-01C0003F-0000003F-00000000 [SL 01]
CPUID 00000004: 1C004143-01C0003F-000001FF-00000000 [SL 02]
CPUID 00000004: 1C03C163-04C0003F-00002FFF-00000006 [SL 03]
CPUID 00000005: 00000040-00000040-00000003-00002120
CPUID 00000006: 00000075-00000002-00000009-00000000
CPUID 00000007: 00000000-000037AB-00000000-00000000
CPUID 00000008: 00000000-00000000-00000000-00000000
CPUID 00000009: 00000001-00000000-00000000-00000000
CPUID 0000000A: 07300403-00000000-00000000-00000603
CPUID 0000000B: 00000001-00000002-00000100-0000000B [SL 00]
CPUID 0000000B: 00000004-0000000C-00000201-0000000B [SL 01]
CPUID 0000000C: 00000000-00000000-00000000-00000000
CPUID 0000000D: 00000007-00000340-00000340-00000000 [SL 00]
CPUID 0000000D: 00000001-00000000-00000000-00000000 [SL 01]
CPUID 0000000D: 00000100-00000240-00000000-00000000 [SL 02]
CPUID 0000000E: 00000000-00000000-00000000-00000000
CPUID 0000000F: 00000000-00000017-00000000-00000002 [SL 00]
CPUID 0000000F: 00000000-00006000-00000017-00000001 [SL 01]
CPUID 80000000: 80000008-00000000-00000000-00000000
CPUID 80000001: 00000000-00000000-00000021-2C100000
CPUID 80000002: 65746E49-2952286C-726F4320-4D542865 [Intel(R) Core(TM]
CPUID 80000003: 37692029-3238352D-43204B30-40205550 [) i7-5820K CPU @]
CPUID 80000004: 332E3320-7A484730-00000000-00000000 [ 3.30GHz]
CPUID 80000005: 00000000-00000000-00000000-00000000
CPUID 80000006: 00000000-00000000-01006040-00000000
CPUID 80000007: 00000000-00000000-00000000-00000100
CPUID 80000008: 0000302E-00000000-00000000-00000000

L1    Data Cache:    32 KB,  8-way Associative, 64-byte Line
L1  Instr. Cache:    32 KB,  8-way Associative, 64-byte Line
L2 Unified Cache:   256 KB,  8-way Associative, 64-byte Line
L3 Unified Cache:    15 MB, 20-way Associative, 64-byte Line

------[ All CPUs ]------

CPU   0: APICID   0 / Package 0 / Core  0 / Thread 0: Valid
CPU   1: APICID   1 / Package 0 / Core  0 / Thread 1: Valid, Virtual
CPU   2: APICID   2 / Package 0 / Core  1 / Thread 0: Valid
CPU   3: APICID   3 / Package 0 / Core  1 / Thread 1: Valid, Virtual
CPU   4: APICID   4 / Package 0 / Core  2 / Thread 0: Valid
CPU   5: APICID   5 / Package 0 / Core  2 / Thread 1: Valid, Virtual
CPU   6: APICID   6 / Package 0 / Core  3 / Thread 0: Valid
CPU   7: APICID   7 / Package 0 / Core  3 / Thread 1: Valid, Virtual
CPU   8: APICID   8 / Package 0 / Core  4 / Thread 0: Valid
CPU   9: APICID   9 / Package 0 / Core  4 / Thread 1: Valid, Virtual
CPU  10: APICID  10 / Package 0 / Core  5 / Thread 0: Valid
CPU  11: APICID  11 / Package 0 / Core  5 / Thread 1: Valid, Virtual

------[ MSR Registers ]------

MSR 00000017: 0008-0000-0000-0000 [PlatID = 2]
MSR 0000001B: 0000-0000-FEE0-0900
MSR 00000035: 0000-0000-0006-000C
MSR 0000008B: 0000-0025-0000-0000
MSR 000000CE: 0008-0C3B-F381-2100
MSR 000000E7: 0000-0000-000B-B8A4
MSR 000000E8: 0000-0000-000B-D136
MSR 00000194: 0000-0000-000E-0000
MSR 00000198: 0000-20F2-0000-2100
MSR 00000199: 0000-0000-0000-2400
MSR 0000019A: 0000-0000-0000-0000
MSR 0000019B: 0000-0000-0000-0000
MSR 0000019C: 0000-0000-883F-0000
MSR 0000019D: 0000-0000-0000-0000
MSR 000001A0: 0000-0040-0085-0089
MSR 000001A2: 0000-0000-005E-0A00
MSR 000001A4: 0000-0000-0000-0000
MSR 000001AA: 0000-0000-0040-0001
MSR 000001AC: < FAILED >
MSR 000001AD: 2222-2222-2222-2424
MSR 000001AE: 2222-2222-2222-2222
MSR 000001AF: 0000-0000-0000-2222
MSR 000001B0: 0000-0000-0000-0005
MSR 000001B1: 0000-0000-883B-0000
MSR 000001B2: 0000-0000-0000-0000
MSR 000001FC: 0000-0000-2304-0059
MSR 00000300: 0000-0000-8000-FF00
MSR 00000480: 00DA-0400-0000-0012
MSR 00000481: 0000-00FF-0000-0016
MSR 00000482: FFF9-FFFE-0401-E172
MSR 00000483: 007F-FFFF-0003-6DFF
MSR 00000484: 0000-FFFF-0000-11FF
MSR 00000485: 0000-0000-3004-81E5
MSR 00000486: 0000-0000-8000-0021
MSR 00000487: 0000-0000-FFFF-FFFF
MSR 00000488: 0000-0000-0000-2000
MSR 00000489: 0000-0000-0017-27FF
MSR 0000048A: 0000-0000-0000-002A
MSR 0000048B: 0000-3FFF-0000-0000
MSR 0000048C: 0000-0F01-0633-4141
MSR 0000048D: 0000-00FF-0000-0016
MSR 0000048E: FFF9-FFFE-0400-6172
MSR 0000048F: 007F-FFFF-0003-6DFB
MSR 00000490: 0000-FFFF-0000-11FB
MSR 00000601: 0000-0000-0000-1F40
MSR 00000602: < FAILED >
MSR 00000603: 0016-0000-001C-1C1C
MSR 00000604: < FAILED >
MSR 00000606: 0000-0000-000A-0E03
MSR 0000060A: 0000-0000-0000-0000
MSR 0000060B: 0000-0000-0000-0000
MSR 0000060C: 0000-0000-0000-0000
MSR 0000060D: 0000-2876-5014-1584
MSR 00000610: 0007-FFD0-0014-EA82
MSR 00000611: 0000-0000-C849-F214
MSR 00000613: 0000-0000-0000-0000
MSR 00000614: 0000-0000-0178-0460
MSR 00000618: 0000-0000-0000-0000
MSR 00000619: 0000-0000-0000-0000
MSR 0000061B: 0000-0000-0000-0000
MSR 0000061C: 002F-005C-0012-0058
MSR 0000061E: 0000-0000-0000-0000
MSR 00000620: 0000-0000-0000-0C1E
MSR 00000621: 0000-0000-0000-0015
MSR 00000638: 0000-0000-0014-FFD0
MSR 00000639: 0000-0000-0000-0000
MSR 0000063A: < FAILED >
MSR 0000063B: < FAILED >
MSR 00000640: < FAILED >
MSR 00000641: < FAILED >
MSR 00000642: < FAILED >
MSR 00000648: 0000-0000-0000-0021
MSR 00000649: 00BC-0000-001E-0460
MSR 0000064A: 00BC-0000-0000-0000
MSR 0000064B: 0000-0000-0000-0000
MSR 0000064C: 0000-0000-0000-0000
MSR 00000690: 0000-0000-C100-0000
MSR 000006B0: < FAILED >
MSR 000006B1: 0000-0000-0000-0000

PerformanceFrequency = 3222910

CPU Clock M.Method = 8  (APIC SNB)
PM Timer Address   = 1032  (0408h)

APIC Clock = 100.18 MHz
APIC Clock = 100.19 MHz
APIC Clock = 100.20 MHz
APIC Clock = 100.17 MHz
APIC Clock = 100.17 MHz
