------[ Versions ]------

Program Version : AIDA64 v1.20.1183 Beta
BenchDLL Version: 2.7.333-x64

------[ CPU Info ]------

CPU Type           : HexaCore Intel Core i7 Extreme 990X, 3466 MHz (26 x 133)
CPU Alias          : Gulftown
CPU Platform       : LGA1366
CPU Stepping       : B1
Instruction Set    : x86, x86-64, MMX, SSE, SSE2, SSE3, SSSE3, SSE4.1, SSE4.2, AES
CPUID Manufacturer : GenuineIntel
CPUID CPU Name     : Intel(R) Core(TM) i7 CPU X 990 @ 3.47GHz
CPUID Revision     : 000206C2h
IA Brand ID        : 00h  (Unknown)
Platform ID        : 2Eh  (LGA1366)

------[ Logical CPU #0 ]------

allcpu: Package 0 / Core 0 / Thread 0: Valid

CPUID 00000000: 0000000B-756E6547-6C65746E-49656E69
CPUID 00000001: 000206C2-00200800-029AE3BF-BFEBFBFF
CPUID 00000002: 55035A01-00F0B2FF-00000000-00CA0000
CPUID 00000003: 00000000-00000000-00000000-00000000
CPUID 00000004: 3C004121-01C0003F-0000003F-00000000
CPUID 00000004: 3C004122-00C0003F-0000007F-00000000
CPUID 00000004: 3C004143-01C0003F-000001FF-00000000
CPUID 00000004: 3C07C163-03C0003F-00002FFF-00000002
CPUID 00000005: 00000040-00000040-00000003-00001120
CPUID 00000006: 00000005-00000002-00000001-00000000
CPUID 00000007: 00000000-00000000-00000000-00000000
CPUID 00000008: 00000000-00000000-00000000-00000000
CPUID 00000009: 00000000-00000000-00000000-00000000
CPUID 0000000A: 07300403-00000004-00000000-00000603
CPUID 0000000B: 00000001-00000002-00000100-00000000
CPUID 0000000B: 00000005-0000000C-00000201-00000000
CPUID 80000000: 80000008-00000000-00000000-00000000
CPUID 80000001: 00000000-00000000-00000001-2C100000
CPUID 80000002: 65746E49-2952286C-726F4320-4D542865
CPUID 80000003: 37692029-55504320-20202020-58202020
CPUID 80000004: 30393920-20402020-37342E33-007A4847
CPUID 80000005: 00000000-00000000-00000000-00000000
CPUID 80000006: 00000000-00000000-01006040-00000000
CPUID 80000007: 00000000-00000000-00000000-00000100
CPUID 80000008: 00003024-00000000-00000000-00000000

L1    Data Cache:     32 KB,  8-way Associative, 64-byte Line
L1  Instr. Cache:     32 KB,  4-way Associative, 64-byte Line
L2 Unified Cache:    256 KB,  8-way Associative, 64-byte Line
L3 Unified Cache:  12288 KB, 16-way Associative, 64-byte Line

------[ Logical CPU #1 ]------

allcpu: Package 0 / Core 0 / Thread 1: Valid, Virtual

CPUID 00000000: 0000000B-756E6547-6C65746E-49656E69
CPUID 00000001: 000206C2-01200800-029AE3BF-BFEBFBFF
CPUID 00000002: 55035A01-00F0B2FF-00000000-00CA0000
CPUID 00000003: 00000000-00000000-00000000-00000000
CPUID 00000004: 3C004121-01C0003F-0000003F-00000000
CPUID 00000004: 3C004122-00C0003F-0000007F-00000000
CPUID 00000004: 3C004143-01C0003F-000001FF-00000000
CPUID 00000004: 3C07C163-03C0003F-00002FFF-00000002
CPUID 00000005: 00000040-00000040-00000003-00001120
CPUID 00000006: 00000005-00000002-00000001-00000000
CPUID 00000007: 00000000-00000000-00000000-00000000
CPUID 00000008: 00000000-00000000-00000000-00000000
CPUID 00000009: 00000000-00000000-00000000-00000000
CPUID 0000000A: 07300403-00000004-00000000-00000603
CPUID 0000000B: 00000001-00000002-00000100-00000001
CPUID 0000000B: 00000005-0000000C-00000201-00000001
CPUID 80000000: 80000008-00000000-00000000-00000000
CPUID 80000001: 00000000-00000000-00000001-2C100000
CPUID 80000002: 65746E49-2952286C-726F4320-4D542865
CPUID 80000003: 37692029-55504320-20202020-58202020
CPUID 80000004: 30393920-20402020-37342E33-007A4847
CPUID 80000005: 00000000-00000000-00000000-00000000
CPUID 80000006: 00000000-00000000-01006040-00000000
CPUID 80000007: 00000000-00000000-00000000-00000100
CPUID 80000008: 00003024-00000000-00000000-00000000

L1    Data Cache:     32 KB,  8-way Associative, 64-byte Line
L1  Instr. Cache:     32 KB,  4-way Associative, 64-byte Line
L2 Unified Cache:    256 KB,  8-way Associative, 64-byte Line
L3 Unified Cache:  12288 KB, 16-way Associative, 64-byte Line

------[ Logical CPU #2 ]------

allcpu: Package 0 / Core 1 / Thread 0: Valid

CPUID 00000000: 0000000B-756E6547-6C65746E-49656E69
CPUID 00000001: 000206C2-02200800-029AE3BF-BFEBFBFF
CPUID 00000002: 55035A01-00F0B2FF-00000000-00CA0000
CPUID 00000003: 00000000-00000000-00000000-00000000
CPUID 00000004: 3C004121-01C0003F-0000003F-00000000
CPUID 00000004: 3C004122-00C0003F-0000007F-00000000
CPUID 00000004: 3C004143-01C0003F-000001FF-00000000
CPUID 00000004: 3C07C163-03C0003F-00002FFF-00000002
CPUID 00000005: 00000040-00000040-00000003-00001120
CPUID 00000006: 00000005-00000002-00000001-00000000
CPUID 00000007: 00000000-00000000-00000000-00000000
CPUID 00000008: 00000000-00000000-00000000-00000000
CPUID 00000009: 00000000-00000000-00000000-00000000
CPUID 0000000A: 07300403-00000004-00000000-00000603
CPUID 0000000B: 00000001-00000002-00000100-00000002
CPUID 0000000B: 00000005-0000000C-00000201-00000002
CPUID 80000000: 80000008-00000000-00000000-00000000
CPUID 80000001: 00000000-00000000-00000001-2C100000
CPUID 80000002: 65746E49-2952286C-726F4320-4D542865
CPUID 80000003: 37692029-55504320-20202020-58202020
CPUID 80000004: 30393920-20402020-37342E33-007A4847
CPUID 80000005: 00000000-00000000-00000000-00000000
CPUID 80000006: 00000000-00000000-01006040-00000000
CPUID 80000007: 00000000-00000000-00000000-00000100
CPUID 80000008: 00003024-00000000-00000000-00000000

L1    Data Cache:     32 KB,  8-way Associative, 64-byte Line
L1  Instr. Cache:     32 KB,  4-way Associative, 64-byte Line
L2 Unified Cache:    256 KB,  8-way Associative, 64-byte Line
L3 Unified Cache:  12288 KB, 16-way Associative, 64-byte Line

------[ Logical CPU #3 ]------

allcpu: Package 0 / Core 1 / Thread 1: Valid, Virtual

CPUID 00000000: 0000000B-756E6547-6C65746E-49656E69
CPUID 00000001: 000206C2-03200800-029AE3BF-BFEBFBFF
CPUID 00000002: 55035A01-00F0B2FF-00000000-00CA0000
CPUID 00000003: 00000000-00000000-00000000-00000000
CPUID 00000004: 3C004121-01C0003F-0000003F-00000000
CPUID 00000004: 3C004122-00C0003F-0000007F-00000000
CPUID 00000004: 3C004143-01C0003F-000001FF-00000000
CPUID 00000004: 3C07C163-03C0003F-00002FFF-00000002
CPUID 00000005: 00000040-00000040-00000003-00001120
CPUID 00000006: 00000005-00000002-00000001-00000000
CPUID 00000007: 00000000-00000000-00000000-00000000
CPUID 00000008: 00000000-00000000-00000000-00000000
CPUID 00000009: 00000000-00000000-00000000-00000000
CPUID 0000000A: 07300403-00000004-00000000-00000603
CPUID 0000000B: 00000001-00000002-00000100-00000003
CPUID 0000000B: 00000005-0000000C-00000201-00000003
CPUID 80000000: 80000008-00000000-00000000-00000000
CPUID 80000001: 00000000-00000000-00000001-2C100000
CPUID 80000002: 65746E49-2952286C-726F4320-4D542865
CPUID 80000003: 37692029-55504320-20202020-58202020
CPUID 80000004: 30393920-20402020-37342E33-007A4847
CPUID 80000005: 00000000-00000000-00000000-00000000
CPUID 80000006: 00000000-00000000-01006040-00000000
CPUID 80000007: 00000000-00000000-00000000-00000100
CPUID 80000008: 00003024-00000000-00000000-00000000

L1    Data Cache:     32 KB,  8-way Associative, 64-byte Line
L1  Instr. Cache:     32 KB,  4-way Associative, 64-byte Line
L2 Unified Cache:    256 KB,  8-way Associative, 64-byte Line
L3 Unified Cache:  12288 KB, 16-way Associative, 64-byte Line

------[ Logical CPU #4 ]------

allcpu: Package 0 / Core 2 / Thread 0: Valid

CPUID 00000000: 0000000B-756E6547-6C65746E-49656E69
CPUID 00000001: 000206C2-04200800-029AE3BF-BFEBFBFF
CPUID 00000002: 55035A01-00F0B2FF-00000000-00CA0000
CPUID 00000003: 00000000-00000000-00000000-00000000
CPUID 00000004: 3C004121-01C0003F-0000003F-00000000
CPUID 00000004: 3C004122-00C0003F-0000007F-00000000
CPUID 00000004: 3C004143-01C0003F-000001FF-00000000
CPUID 00000004: 3C07C163-03C0003F-00002FFF-00000002
CPUID 00000005: 00000040-00000040-00000003-00001120
CPUID 00000006: 00000005-00000002-00000001-00000000
CPUID 00000007: 00000000-00000000-00000000-00000000
CPUID 00000008: 00000000-00000000-00000000-00000000
CPUID 00000009: 00000000-00000000-00000000-00000000
CPUID 0000000A: 07300403-00000004-00000000-00000603
CPUID 0000000B: 00000001-00000002-00000100-00000004
CPUID 0000000B: 00000005-0000000C-00000201-00000004
CPUID 80000000: 80000008-00000000-00000000-00000000
CPUID 80000001: 00000000-00000000-00000001-2C100000
CPUID 80000002: 65746E49-2952286C-726F4320-4D542865
CPUID 80000003: 37692029-55504320-20202020-58202020
CPUID 80000004: 30393920-20402020-37342E33-007A4847
CPUID 80000005: 00000000-00000000-00000000-00000000
CPUID 80000006: 00000000-00000000-01006040-00000000
CPUID 80000007: 00000000-00000000-00000000-00000100
CPUID 80000008: 00003024-00000000-00000000-00000000

L1    Data Cache:     32 KB,  8-way Associative, 64-byte Line
L1  Instr. Cache:     32 KB,  4-way Associative, 64-byte Line
L2 Unified Cache:    256 KB,  8-way Associative, 64-byte Line
L3 Unified Cache:  12288 KB, 16-way Associative, 64-byte Line

------[ Logical CPU #5 ]------

allcpu: Package 0 / Core 2 / Thread 1: Valid, Virtual

CPUID 00000000: 0000000B-756E6547-6C65746E-49656E69
CPUID 00000001: 000206C2-05200800-029AE3BF-BFEBFBFF
CPUID 00000002: 55035A01-00F0B2FF-00000000-00CA0000
CPUID 00000003: 00000000-00000000-00000000-00000000
CPUID 00000004: 3C004121-01C0003F-0000003F-00000000
CPUID 00000004: 3C004122-00C0003F-0000007F-00000000
CPUID 00000004: 3C004143-01C0003F-000001FF-00000000
CPUID 00000004: 3C07C163-03C0003F-00002FFF-00000002
CPUID 00000005: 00000040-00000040-00000003-00001120
CPUID 00000006: 00000005-00000002-00000001-00000000
CPUID 00000007: 00000000-00000000-00000000-00000000
CPUID 00000008: 00000000-00000000-00000000-00000000
CPUID 00000009: 00000000-00000000-00000000-00000000
CPUID 0000000A: 07300403-00000004-00000000-00000603
CPUID 0000000B: 00000001-00000002-00000100-00000005
CPUID 0000000B: 00000005-0000000C-00000201-00000005
CPUID 80000000: 80000008-00000000-00000000-00000000
CPUID 80000001: 00000000-00000000-00000001-2C100000
CPUID 80000002: 65746E49-2952286C-726F4320-4D542865
CPUID 80000003: 37692029-55504320-20202020-58202020
CPUID 80000004: 30393920-20402020-37342E33-007A4847
CPUID 80000005: 00000000-00000000-00000000-00000000
CPUID 80000006: 00000000-00000000-01006040-00000000
CPUID 80000007: 00000000-00000000-00000000-00000100
CPUID 80000008: 00003024-00000000-00000000-00000000

L1    Data Cache:     32 KB,  8-way Associative, 64-byte Line
L1  Instr. Cache:     32 KB,  4-way Associative, 64-byte Line
L2 Unified Cache:    256 KB,  8-way Associative, 64-byte Line
L3 Unified Cache:  12288 KB, 16-way Associative, 64-byte Line

------[ Logical CPU #6 ]------

allcpu: Package 0 / Core 3 / Thread 0: Valid

CPUID 00000000: 0000000B-756E6547-6C65746E-49656E69
CPUID 00000001: 000206C2-10200800-029AE3BF-BFEBFBFF
CPUID 00000002: 55035A01-00F0B2FF-00000000-00CA0000
CPUID 00000003: 00000000-00000000-00000000-00000000
CPUID 00000004: 3C004121-01C0003F-0000003F-00000000
CPUID 00000004: 3C004122-00C0003F-0000007F-00000000
CPUID 00000004: 3C004143-01C0003F-000001FF-00000000
CPUID 00000004: 3C07C163-03C0003F-00002FFF-00000002
CPUID 00000005: 00000040-00000040-00000003-00001120
CPUID 00000006: 00000005-00000002-00000001-00000000
CPUID 00000007: 00000000-00000000-00000000-00000000
CPUID 00000008: 00000000-00000000-00000000-00000000
CPUID 00000009: 00000000-00000000-00000000-00000000
CPUID 0000000A: 07300403-00000004-00000000-00000603
CPUID 0000000B: 00000001-00000002-00000100-00000010
CPUID 0000000B: 00000005-0000000C-00000201-00000010
CPUID 80000000: 80000008-00000000-00000000-00000000
CPUID 80000001: 00000000-00000000-00000001-2C100000
CPUID 80000002: 65746E49-2952286C-726F4320-4D542865
CPUID 80000003: 37692029-55504320-20202020-58202020
CPUID 80000004: 30393920-20402020-37342E33-007A4847
CPUID 80000005: 00000000-00000000-00000000-00000000
CPUID 80000006: 00000000-00000000-01006040-00000000
CPUID 80000007: 00000000-00000000-00000000-00000100
CPUID 80000008: 00003024-00000000-00000000-00000000

L1    Data Cache:     32 KB,  8-way Associative, 64-byte Line
L1  Instr. Cache:     32 KB,  4-way Associative, 64-byte Line
L2 Unified Cache:    256 KB,  8-way Associative, 64-byte Line
L3 Unified Cache:  12288 KB, 16-way Associative, 64-byte Line

------[ Logical CPU #7 ]------

allcpu: Package 0 / Core 3 / Thread 1: Valid, Virtual

CPUID 00000000: 0000000B-756E6547-6C65746E-49656E69
CPUID 00000001: 000206C2-11200800-029AE3BF-BFEBFBFF
CPUID 00000002: 55035A01-00F0B2FF-00000000-00CA0000
CPUID 00000003: 00000000-00000000-00000000-00000000
CPUID 00000004: 3C004121-01C0003F-0000003F-00000000
CPUID 00000004: 3C004122-00C0003F-0000007F-00000000
CPUID 00000004: 3C004143-01C0003F-000001FF-00000000
CPUID 00000004: 3C07C163-03C0003F-00002FFF-00000002
CPUID 00000005: 00000040-00000040-00000003-00001120
CPUID 00000006: 00000005-00000002-00000001-00000000
CPUID 00000007: 00000000-00000000-00000000-00000000
CPUID 00000008: 00000000-00000000-00000000-00000000
CPUID 00000009: 00000000-00000000-00000000-00000000
CPUID 0000000A: 07300403-00000004-00000000-00000603
CPUID 0000000B: 00000001-00000002-00000100-00000011
CPUID 0000000B: 00000005-0000000C-00000201-00000011
CPUID 80000000: 80000008-00000000-00000000-00000000
CPUID 80000001: 00000000-00000000-00000001-2C100000
CPUID 80000002: 65746E49-2952286C-726F4320-4D542865
CPUID 80000003: 37692029-55504320-20202020-58202020
CPUID 80000004: 30393920-20402020-37342E33-007A4847
CPUID 80000005: 00000000-00000000-00000000-00000000
CPUID 80000006: 00000000-00000000-01006040-00000000
CPUID 80000007: 00000000-00000000-00000000-00000100
CPUID 80000008: 00003024-00000000-00000000-00000000

L1    Data Cache:     32 KB,  8-way Associative, 64-byte Line
L1  Instr. Cache:     32 KB,  4-way Associative, 64-byte Line
L2 Unified Cache:    256 KB,  8-way Associative, 64-byte Line
L3 Unified Cache:  12288 KB, 16-way Associative, 64-byte Line

------[ Logical CPU #8 ]------

allcpu: Package 0 / Core 4 / Thread 0: Valid

CPUID 00000000: 0000000B-756E6547-6C65746E-49656E69
CPUID 00000001: 000206C2-12200800-029AE3BF-BFEBFBFF
CPUID 00000002: 55035A01-00F0B2FF-00000000-00CA0000
CPUID 00000003: 00000000-00000000-00000000-00000000
CPUID 00000004: 3C004121-01C0003F-0000003F-00000000
CPUID 00000004: 3C004122-00C0003F-0000007F-00000000
CPUID 00000004: 3C004143-01C0003F-000001FF-00000000
CPUID 00000004: 3C07C163-03C0003F-00002FFF-00000002
CPUID 00000005: 00000040-00000040-00000003-00001120
CPUID 00000006: 00000005-00000002-00000001-00000000
CPUID 00000007: 00000000-00000000-00000000-00000000
CPUID 00000008: 00000000-00000000-00000000-00000000
CPUID 00000009: 00000000-00000000-00000000-00000000
CPUID 0000000A: 07300403-00000004-00000000-00000603
CPUID 0000000B: 00000001-00000002-00000100-00000012
CPUID 0000000B: 00000005-0000000C-00000201-00000012
CPUID 80000000: 80000008-00000000-00000000-00000000
CPUID 80000001: 00000000-00000000-00000001-2C100000
CPUID 80000002: 65746E49-2952286C-726F4320-4D542865
CPUID 80000003: 37692029-55504320-20202020-58202020
CPUID 80000004: 30393920-20402020-37342E33-007A4847
CPUID 80000005: 00000000-00000000-00000000-00000000
CPUID 80000006: 00000000-00000000-01006040-00000000
CPUID 80000007: 00000000-00000000-00000000-00000100
CPUID 80000008: 00003024-00000000-00000000-00000000

L1    Data Cache:     32 KB,  8-way Associative, 64-byte Line
L1  Instr. Cache:     32 KB,  4-way Associative, 64-byte Line
L2 Unified Cache:    256 KB,  8-way Associative, 64-byte Line
L3 Unified Cache:  12288 KB, 16-way Associative, 64-byte Line

------[ Logical CPU #9 ]------

allcpu: Package 0 / Core 4 / Thread 1: Valid, Virtual

CPUID 00000000: 0000000B-756E6547-6C65746E-49656E69
CPUID 00000001: 000206C2-13200800-029AE3BF-BFEBFBFF
CPUID 00000002: 55035A01-00F0B2FF-00000000-00CA0000
CPUID 00000003: 00000000-00000000-00000000-00000000
CPUID 00000004: 3C004121-01C0003F-0000003F-00000000
CPUID 00000004: 3C004122-00C0003F-0000007F-00000000
CPUID 00000004: 3C004143-01C0003F-000001FF-00000000
CPUID 00000004: 3C07C163-03C0003F-00002FFF-00000002
CPUID 00000005: 00000040-00000040-00000003-00001120
CPUID 00000006: 00000005-00000002-00000001-00000000
CPUID 00000007: 00000000-00000000-00000000-00000000
CPUID 00000008: 00000000-00000000-00000000-00000000
CPUID 00000009: 00000000-00000000-00000000-00000000
CPUID 0000000A: 07300403-00000004-00000000-00000603
CPUID 0000000B: 00000001-00000002-00000100-00000013
CPUID 0000000B: 00000005-0000000C-00000201-00000013
CPUID 80000000: 80000008-00000000-00000000-00000000
CPUID 80000001: 00000000-00000000-00000001-2C100000
CPUID 80000002: 65746E49-2952286C-726F4320-4D542865
CPUID 80000003: 37692029-55504320-20202020-58202020
CPUID 80000004: 30393920-20402020-37342E33-007A4847
CPUID 80000005: 00000000-00000000-00000000-00000000
CPUID 80000006: 00000000-00000000-01006040-00000000
CPUID 80000007: 00000000-00000000-00000000-00000100
CPUID 80000008: 00003024-00000000-00000000-00000000

L1    Data Cache:     32 KB,  8-way Associative, 64-byte Line
L1  Instr. Cache:     32 KB,  4-way Associative, 64-byte Line
L2 Unified Cache:    256 KB,  8-way Associative, 64-byte Line
L3 Unified Cache:  12288 KB, 16-way Associative, 64-byte Line

------[ Logical CPU #10 ]------

allcpu: Package 0 / Core 5 / Thread 0: Valid

CPUID 00000000: 0000000B-756E6547-6C65746E-49656E69
CPUID 00000001: 000206C2-14200800-029AE3BF-BFEBFBFF
CPUID 00000002: 55035A01-00F0B2FF-00000000-00CA0000
CPUID 00000003: 00000000-00000000-00000000-00000000
CPUID 00000004: 3C004121-01C0003F-0000003F-00000000
CPUID 00000004: 3C004122-00C0003F-0000007F-00000000
CPUID 00000004: 3C004143-01C0003F-000001FF-00000000
CPUID 00000004: 3C07C163-03C0003F-00002FFF-00000002
CPUID 00000005: 00000040-00000040-00000003-00001120
CPUID 00000006: 00000005-00000002-00000001-00000000
CPUID 00000007: 00000000-00000000-00000000-00000000
CPUID 00000008: 00000000-00000000-00000000-00000000
CPUID 00000009: 00000000-00000000-00000000-00000000
CPUID 0000000A: 07300403-00000004-00000000-00000603
CPUID 0000000B: 00000001-00000002-00000100-00000014
CPUID 0000000B: 00000005-0000000C-00000201-00000014
CPUID 80000000: 80000008-00000000-00000000-00000000
CPUID 80000001: 00000000-00000000-00000001-2C100000
CPUID 80000002: 65746E49-2952286C-726F4320-4D542865
CPUID 80000003: 37692029-55504320-20202020-58202020
CPUID 80000004: 30393920-20402020-37342E33-007A4847
CPUID 80000005: 00000000-00000000-00000000-00000000
CPUID 80000006: 00000000-00000000-01006040-00000000
CPUID 80000007: 00000000-00000000-00000000-00000100
CPUID 80000008: 00003024-00000000-00000000-00000000

L1    Data Cache:     32 KB,  8-way Associative, 64-byte Line
L1  Instr. Cache:     32 KB,  4-way Associative, 64-byte Line
L2 Unified Cache:    256 KB,  8-way Associative, 64-byte Line
L3 Unified Cache:  12288 KB, 16-way Associative, 64-byte Line

------[ Logical CPU #11 ]------

allcpu: Package 0 / Core 5 / Thread 1: Valid, Virtual

CPUID 00000000: 0000000B-756E6547-6C65746E-49656E69
CPUID 00000001: 000206C2-15200800-029AE3BF-BFEBFBFF
CPUID 00000002: 55035A01-00F0B2FF-00000000-00CA0000
CPUID 00000003: 00000000-00000000-00000000-00000000
CPUID 00000004: 3C004121-01C0003F-0000003F-00000000
CPUID 00000004: 3C004122-00C0003F-0000007F-00000000
CPUID 00000004: 3C004143-01C0003F-000001FF-00000000
CPUID 00000004: 3C07C163-03C0003F-00002FFF-00000002
CPUID 00000005: 00000040-00000040-00000003-00001120
CPUID 00000006: 00000005-00000002-00000001-00000000
CPUID 00000007: 00000000-00000000-00000000-00000000
CPUID 00000008: 00000000-00000000-00000000-00000000
CPUID 00000009: 00000000-00000000-00000000-00000000
CPUID 0000000A: 07300403-00000004-00000000-00000603
CPUID 0000000B: 00000001-00000002-00000100-00000015
CPUID 0000000B: 00000005-0000000C-00000201-00000015
CPUID 80000000: 80000008-00000000-00000000-00000000
CPUID 80000001: 00000000-00000000-00000001-2C100000
CPUID 80000002: 65746E49-2952286C-726F4320-4D542865
CPUID 80000003: 37692029-55504320-20202020-58202020
CPUID 80000004: 30393920-20402020-37342E33-007A4847
CPUID 80000005: 00000000-00000000-00000000-00000000
CPUID 80000006: 00000000-00000000-01006040-00000000
CPUID 80000007: 00000000-00000000-00000000-00000100
CPUID 80000008: 00003024-00000000-00000000-00000000

L1    Data Cache:     32 KB,  8-way Associative, 64-byte Line
L1  Instr. Cache:     32 KB,  4-way Associative, 64-byte Line
L2 Unified Cache:    256 KB,  8-way Associative, 64-byte Line
L3 Unified Cache:  12288 KB, 16-way Associative, 64-byte Line

------[ All CPUs ]------

CPU   0: APICID   0 / Package 0 / Core  0 / Thread 0: Valid
CPU   1: APICID   1 / Package 0 / Core  0 / Thread 1: Valid, Virtual
CPU   2: APICID   2 / Package 0 / Core  1 / Thread 0: Valid
CPU   3: APICID   3 / Package 0 / Core  1 / Thread 1: Valid, Virtual
CPU   4: APICID   4 / Package 0 / Core  2 / Thread 0: Valid
CPU   5: APICID   5 / Package 0 / Core  2 / Thread 1: Valid, Virtual
CPU   6: APICID  16 / Package 0 / Core  3 / Thread 0: Valid
CPU   7: APICID  17 / Package 0 / Core  3 / Thread 1: Valid, Virtual
CPU   8: APICID  18 / Package 0 / Core  4 / Thread 0: Valid
CPU   9: APICID  19 / Package 0 / Core  4 / Thread 1: Valid, Virtual
CPU  10: APICID  20 / Package 0 / Core  5 / Thread 0: Valid
CPU  11: APICID  21 / Package 0 / Core  5 / Thread 1: Valid, Virtual

------[ MSR Registers ]------

MSR 00000017: 0004-0000-0000-0000 [PlatID = 1]
MSR 0000001B: 0000-0000-FEE0-0900
MSR 00000035: 0000-0000-0006-000C
MSR 0000008B: 0000-0013-0000-0000
MSR 000000CE: 0000-0C00-3801-1A03
MSR 000000E7: 0000-0053-8B38-77D6
MSR 000000E8: 0000-0053-20E0-3B5A
MSR 00000194: 0000-0000-0001-1A00
MSR 00000198: 0000-0000-0000-001A
MSR 00000199: 0000-0000-0000-001A
MSR 0000019A: 0000-0000-0000-0002
MSR 0000019B: 0000-0000-0000-0010
MSR 0000019C: 0000-0000-8845-0000
MSR 0000019D: 0000-0000-0000-0000
MSR 000001A0: 0000-0040-0084-0089
MSR 000001A2: 0000-0000-0065-1400
MSR 000001A4: 0000-0000-0000-0000
MSR 000001AA: 0000-0000-0040-0000
MSR 000001AC: 0000-0000-0370-0410
MSR 000001AD: 0000-1B1B-1B1B-1C1C
MSR 000001FC: 0000-0000-0000-0005
MSR 00000300: 0000-0000-F800-000D

PerformanceFrequency = 3385605

Tjmax Temperature = 101 Celsius
