------[ Versions ]------

Program Version : EVEREST v4.60.1628 Beta
BenchDLL Version: 2.4.257.0

------[ CPU Info ]------

CPU Type           : Mobile Intel Celeron M 320, 1300 MHz (13 x 100)
CPU Alias          : Banias-512
CPU Platform       : Mobile uFCPGA/uFCBGA
CPU Stepping       : B1
Instruction Set    : x86, MMX, SSE, SSE2
CPUID Manufacturer : GenuineIntel
CPUID CPU Name     : Intel(R) Celeron(R) M processor 1300MHz
CPUID Revision     : 00000695h
IA Brand ID        : 12h  (Intel Celeron M)
Platform ID        : 07h  (Mobile uFCPGA/uFCBGA)

------[ Logical CPU #0 ]------

allcpu: Valid

CPUID 00000000: 00000002-756E6547-6C65746E-49656E69
CPUID 00000001: 00000695-00000812-00000000-A7E9FBBF
CPUID 00000002: 02B3B001-00000000-00000000-2C043086
CPUID 80000000: 80000004-00000000-00000000-00000000
CPUID 80000001: 00000000-00000000-00000000-00000000
CPUID 80000002: 65746E49-2952286C-6C654320-6E6F7265
CPUID 80000003: 20295228-7270204D-7365636F-20726F73
CPUID 80000004: 20202020-20202020-30303331-007A484D

------[ MSR Registers ]------

MSR 00000017: 001C-0000-F207-86A9 [PlatID = 7]
MSR 0000001B: 0000-0000-FEE0-0900
MSR 0000002A: 0000-0000-4348-0081
MSR 0000008B: 0000-0047-0000-0000
MSR 0000011E: 0000-0000-003C-052B
MSR 00000198: 0D29-0D29-0600-0D29
MSR 00000199: 0000-0000-0000-0D29
MSR 0000019A: 0000-0000-0000-0008
MSR 0000019B: 0000-0000-0000-0000
MSR 0000019C: 0000-0000-0000-0000
MSR 000001A0: 0000-0000-0000-1088

PerformanceFrequency = 3579545

Tjmax Temperature = 0 Celsius
