------[ Versions ]------

Program Version : EVEREST v4.60.1628 Beta
BenchDLL Version: 2.4.257.0

------[ CPU Info ]------

CPU Type           : Intel Pentium 4, 1600 MHz (16 x 100)
CPU Alias          : Northwood
CPU Platform       : Socket 478
CPU Stepping       : B0
Instruction Set    : x86, MMX, SSE, SSE2
CPUID Manufacturer : GenuineIntel
CPUID CPU Name     : Intel(R) Pentium(R) 4 CPU 1.60GHz
CPUID Revision     : 00000F24h
IA Brand ID        : 09h  (Intel Pentium 4)
Platform ID        : 1Fh  (Socket 478)

------[ Logical CPU #0 ]------

allcpu: Valid

CPUID 00000000: 00000002-756E6547-6C65746E-49656E69
CPUID 00000001: 00000F24-00010809-00000000-3FEBFBFF
CPUID 00000002: 665B5001-00000000-00000000-007B7040
CPUID 80000000: 80000004-00000000-00000000-00000000
CPUID 80000001: 00000000-00000000-00000000-00000000
CPUID 80000002: 20202020-20202020-20202020-6E492020
CPUID 80000003: 286C6574-50202952-69746E65-52286D75
CPUID 80000004: 20342029-20555043-30362E31-007A4847

------[ MSR Registers ]------

MSR 00000017: 000A-0000-0000-0000 [PlatID = 2]
MSR 0000001B: 0000-0000-FEE0-0900
MSR 0000002A: 0000-0000-0000-0000
MSR 0000002C: 0000-0000-1010-0010
MSR 0000008B: 0000-001E-0000-0000
MSR 0000019A: 0000-0000-0000-0008
MSR 0000019B: 0000-0000-0000-0000
MSR 0000019C: 0000-0000-0000-0000
MSR 000001A0: 0000-0000-0000-00A9

PerformanceFrequency = 3579545

Tjmax Temperature = 0 Celsius
