------[ Versions ]------

Program Version : AIDA64 v5.80.4082 Beta
BenchDLL Version: 4.3.718-x64

------[ CPU Info ]------

CPU Type          : QuadCore Intel Core i7-7700K, 4500 MHz (45 x 100)
CPU Alias         : Kaby Lake-S
CPU Platform      : LGA1151
CPU Stepping      : B0
Instruction Set   : x86, x86-64, MMX, SSE, SSE2, SSE3, SSSE3, SSE4.1, SSE4.2, AVX, AVX2, FMA, AES
CPUID Manufacturer: GenuineIntel
CPUID CPU Name    : Intel(R) Core(TM) i7-7700K CPU @ 4.20GHz
CPUID Revision    : 000906E9h
IA Brand ID       : 00h  (Unknown)
Platform ID       : 40h  (LGA1151)
HTT / CMP Units   : 2 / 4
Max. NUMA Node    : 0

Tjmax Temperature          : 100 Celsius
HTC Temperature Limit      : 0 Celsius
CPU TDP                    : 91 W
CPU Max Power Limit        : Unlimited Power / Unlimited Time
CPU Power Limit 1 (Long)   : 4095 W / 1.00 sec  (Unlocked)
CPU Power Limit 2 (Short)  : 4095 W / 2.44 ms  (Unlocked)
Max Turbo Boost Multipliers: 1C: 45x, 2C: 45x, 3C: 45x, 4C: 45x

------[ Logical CPU #0 ]------

allcpu: Package 0 / Core 0 / Thread 0: Valid

CPUID 00000000: 00000016-756E6547-6C65746E-49656E69 [GenuineIntel]
CPUID 00000001: 000906E9-00100800-7FFAFBBF-BFEBFBFF
CPUID 00000002: 76036301-00F0B5FF-00000000-00C30000
CPUID 00000003: 00000000-00000000-00000000-00000000
CPUID 00000004: 1C004121-01C0003F-0000003F-00000000 [SL 00]
CPUID 00000004: 1C004122-01C0003F-0000003F-00000000 [SL 01]
CPUID 00000004: 1C004143-00C0003F-000003FF-00000000 [SL 02]
CPUID 00000004: 1C03C163-03C0003F-00001FFF-00000006 [SL 03]
CPUID 00000005: 00000040-00000040-00000003-00142120
CPUID 00000006: 000027F5-00000002-00000009-00000000
CPUID 00000007: 00000000-029C6FBF-00000000-00000000
CPUID 00000008: 00000000-00000000-00000000-00000000
CPUID 00000009: 00000000-00000000-00000000-00000000
CPUID 0000000A: 07300404-00000000-00000000-00000603
CPUID 0000000B: 00000001-00000002-00000100-00000000 [SL 00]
CPUID 0000000B: 00000004-00000008-00000201-00000000 [SL 01]
CPUID 0000000C: 00000000-00000000-00000000-00000000
CPUID 0000000D: 0000001F-00000440-00000440-00000000 [SL 00]
CPUID 0000000D: 0000000F-000003C0-00000100-00000000 [SL 01]
CPUID 0000000D: 00000100-00000240-00000000-00000000 [SL 02]
CPUID 0000000D: 00000040-000003C0-00000000-00000000 [SL 03]
CPUID 0000000D: 00000040-00000400-00000000-00000000 [SL 04]
CPUID 0000000E: 00000000-00000000-00000000-00000000
CPUID 0000000F: 00000000-00000000-00000000-00000000 [SL 00]
CPUID 0000000F: 00000000-00000000-00000000-00000000 [SL 01]
CPUID 00000010: 00000000-00000000-00000000-00000000 [SL 00]
CPUID 00000010: 00000000-00000000-00000000-00000000 [SL 01]
CPUID 00000011: 00000000-00000000-00000000-00000000
CPUID 00000012: 00000000-00000000-00000000-00000000 [SL 00]
CPUID 00000012: 00000000-00000000-00000000-00000000 [SL 01]
CPUID 00000013: 00000000-00000000-00000000-00000000
CPUID 00000014: 00000001-0000000F-00000007-00000000 [SL 00]
CPUID 00000014: 02490002-003F3FFF-00000000-00000000 [SL 01]
CPUID 00000015: 00000002-0000015E-00000000-00000000 [175.00x / 0]
CPUID 00000016: 00001068-00001194-00000064-00000000 [4200 / 4500 / 100]
CPUID 80000000: 80000008-00000000-00000000-00000000
CPUID 80000001: 00000000-00000000-00000121-2C100000
CPUID 80000002: 65746E49-2952286C-726F4320-4D542865 [Intel(R) Core(TM]
CPUID 80000003: 37692029-3037372D-43204B30-40205550 [) i7-7700K CPU @]
CPUID 80000004: 322E3420-7A484730-00000000-00000000 [ 4.20GHz]
CPUID 80000005: 00000000-00000000-00000000-00000000
CPUID 80000006: 00000000-00000000-01006040-00000000
CPUID 80000007: 00000000-00000000-00000000-00000100
CPUID 80000008: 00003027-00000000-00000000-00000000

L1    Data Cache:    32 KB,  8-way Associative, 64-byte Line
L1  Instr. Cache:    32 KB,  8-way Associative, 64-byte Line
L2 Unified Cache:   256 KB,  4-way Associative, 64-byte Line
L3 Unified Cache:     8 MB, 16-way Associative, 64-byte Line

------[ Logical CPU #1 ]------

allcpu: Package 0 / Core 0 / Thread 1: Valid, Virtual

CPUID 00000000: 00000016-756E6547-6C65746E-49656E69 [GenuineIntel]
CPUID 00000001: 000906E9-01100800-7FFAFBBF-BFEBFBFF
CPUID 00000002: 76036301-00F0B5FF-00000000-00C30000
CPUID 00000003: 00000000-00000000-00000000-00000000
CPUID 00000004: 1C004121-01C0003F-0000003F-00000000 [SL 00]
CPUID 00000004: 1C004122-01C0003F-0000003F-00000000 [SL 01]
CPUID 00000004: 1C004143-00C0003F-000003FF-00000000 [SL 02]
CPUID 00000004: 1C03C163-03C0003F-00001FFF-00000006 [SL 03]
CPUID 00000005: 00000040-00000040-00000003-00142120
CPUID 00000006: 000027F5-00000002-00000009-00000000
CPUID 00000007: 00000000-029C6FBF-00000000-00000000
CPUID 00000008: 00000000-00000000-00000000-00000000
CPUID 00000009: 00000000-00000000-00000000-00000000
CPUID 0000000A: 07300404-00000000-00000000-00000603
CPUID 0000000B: 00000001-00000002-00000100-00000001 [SL 00]
CPUID 0000000B: 00000004-00000008-00000201-00000001 [SL 01]
CPUID 0000000C: 00000000-00000000-00000000-00000000
CPUID 0000000D: 0000001F-00000440-00000440-00000000 [SL 00]
CPUID 0000000D: 0000000F-000003C0-00000100-00000000 [SL 01]
CPUID 0000000D: 00000100-00000240-00000000-00000000 [SL 02]
CPUID 0000000D: 00000040-000003C0-00000000-00000000 [SL 03]
CPUID 0000000D: 00000040-00000400-00000000-00000000 [SL 04]
CPUID 0000000E: 00000000-00000000-00000000-00000000
CPUID 0000000F: 00000000-00000000-00000000-00000000 [SL 00]
CPUID 0000000F: 00000000-00000000-00000000-00000000 [SL 01]
CPUID 00000010: 00000000-00000000-00000000-00000000 [SL 00]
CPUID 00000010: 00000000-00000000-00000000-00000000 [SL 01]
CPUID 00000011: 00000000-00000000-00000000-00000000
CPUID 00000012: 00000000-00000000-00000000-00000000 [SL 00]
CPUID 00000012: 00000000-00000000-00000000-00000000 [SL 01]
CPUID 00000013: 00000000-00000000-00000000-00000000
CPUID 00000014: 00000001-0000000F-00000007-00000000 [SL 00]
CPUID 00000014: 02490002-003F3FFF-00000000-00000000 [SL 01]
CPUID 00000015: 00000002-0000015E-00000000-00000000 [175.00x / 0]
CPUID 00000016: 00001068-00001194-00000064-00000000 [4200 / 4500 / 100]
CPUID 80000000: 80000008-00000000-00000000-00000000
CPUID 80000001: 00000000-00000000-00000121-2C100000
CPUID 80000002: 65746E49-2952286C-726F4320-4D542865 [Intel(R) Core(TM]
CPUID 80000003: 37692029-3037372D-43204B30-40205550 [) i7-7700K CPU @]
CPUID 80000004: 322E3420-7A484730-00000000-00000000 [ 4.20GHz]
CPUID 80000005: 00000000-00000000-00000000-00000000
CPUID 80000006: 00000000-00000000-01006040-00000000
CPUID 80000007: 00000000-00000000-00000000-00000100
CPUID 80000008: 00003027-00000000-00000000-00000000

L1    Data Cache:    32 KB,  8-way Associative, 64-byte Line
L1  Instr. Cache:    32 KB,  8-way Associative, 64-byte Line
L2 Unified Cache:   256 KB,  4-way Associative, 64-byte Line
L3 Unified Cache:     8 MB, 16-way Associative, 64-byte Line

------[ Logical CPU #2 ]------

allcpu: Package 0 / Core 1 / Thread 0: Valid

CPUID 00000000: 00000016-756E6547-6C65746E-49656E69 [GenuineIntel]
CPUID 00000001: 000906E9-02100800-7FFAFBBF-BFEBFBFF
CPUID 00000002: 76036301-00F0B5FF-00000000-00C30000
CPUID 00000003: 00000000-00000000-00000000-00000000
CPUID 00000004: 1C004121-01C0003F-0000003F-00000000 [SL 00]
CPUID 00000004: 1C004122-01C0003F-0000003F-00000000 [SL 01]
CPUID 00000004: 1C004143-00C0003F-000003FF-00000000 [SL 02]
CPUID 00000004: 1C03C163-03C0003F-00001FFF-00000006 [SL 03]
CPUID 00000005: 00000040-00000040-00000003-00142120
CPUID 00000006: 000027F5-00000002-00000009-00000000
CPUID 00000007: 00000000-029C6FBF-00000000-00000000
CPUID 00000008: 00000000-00000000-00000000-00000000
CPUID 00000009: 00000000-00000000-00000000-00000000
CPUID 0000000A: 07300404-00000000-00000000-00000603
CPUID 0000000B: 00000001-00000002-00000100-00000002 [SL 00]
CPUID 0000000B: 00000004-00000008-00000201-00000002 [SL 01]
CPUID 0000000C: 00000000-00000000-00000000-00000000
CPUID 0000000D: 0000001F-00000440-00000440-00000000 [SL 00]
CPUID 0000000D: 0000000F-000003C0-00000100-00000000 [SL 01]
CPUID 0000000D: 00000100-00000240-00000000-00000000 [SL 02]
CPUID 0000000D: 00000040-000003C0-00000000-00000000 [SL 03]
CPUID 0000000D: 00000040-00000400-00000000-00000000 [SL 04]
CPUID 0000000E: 00000000-00000000-00000000-00000000
CPUID 0000000F: 00000000-00000000-00000000-00000000 [SL 00]
CPUID 0000000F: 00000000-00000000-00000000-00000000 [SL 01]
CPUID 00000010: 00000000-00000000-00000000-00000000 [SL 00]
CPUID 00000010: 00000000-00000000-00000000-00000000 [SL 01]
CPUID 00000011: 00000000-00000000-00000000-00000000
CPUID 00000012: 00000000-00000000-00000000-00000000 [SL 00]
CPUID 00000012: 00000000-00000000-00000000-00000000 [SL 01]
CPUID 00000013: 00000000-00000000-00000000-00000000
CPUID 00000014: 00000001-0000000F-00000007-00000000 [SL 00]
CPUID 00000014: 02490002-003F3FFF-00000000-00000000 [SL 01]
CPUID 00000015: 00000002-0000015E-00000000-00000000 [175.00x / 0]
CPUID 00000016: 00001068-00001194-00000064-00000000 [4200 / 4500 / 100]
CPUID 80000000: 80000008-00000000-00000000-00000000
CPUID 80000001: 00000000-00000000-00000121-2C100000
CPUID 80000002: 65746E49-2952286C-726F4320-4D542865 [Intel(R) Core(TM]
CPUID 80000003: 37692029-3037372D-43204B30-40205550 [) i7-7700K CPU @]
CPUID 80000004: 322E3420-7A484730-00000000-00000000 [ 4.20GHz]
CPUID 80000005: 00000000-00000000-00000000-00000000
CPUID 80000006: 00000000-00000000-01006040-00000000
CPUID 80000007: 00000000-00000000-00000000-00000100
CPUID 80000008: 00003027-00000000-00000000-00000000

L1    Data Cache:    32 KB,  8-way Associative, 64-byte Line
L1  Instr. Cache:    32 KB,  8-way Associative, 64-byte Line
L2 Unified Cache:   256 KB,  4-way Associative, 64-byte Line
L3 Unified Cache:     8 MB, 16-way Associative, 64-byte Line

------[ Logical CPU #3 ]------

allcpu: Package 0 / Core 1 / Thread 1: Valid, Virtual

CPUID 00000000: 00000016-756E6547-6C65746E-49656E69 [GenuineIntel]
CPUID 00000001: 000906E9-03100800-7FFAFBBF-BFEBFBFF
CPUID 00000002: 76036301-00F0B5FF-00000000-00C30000
CPUID 00000003: 00000000-00000000-00000000-00000000
CPUID 00000004: 1C004121-01C0003F-0000003F-00000000 [SL 00]
CPUID 00000004: 1C004122-01C0003F-0000003F-00000000 [SL 01]
CPUID 00000004: 1C004143-00C0003F-000003FF-00000000 [SL 02]
CPUID 00000004: 1C03C163-03C0003F-00001FFF-00000006 [SL 03]
CPUID 00000005: 00000040-00000040-00000003-00142120
CPUID 00000006: 000027F5-00000002-00000009-00000000
CPUID 00000007: 00000000-029C6FBF-00000000-00000000
CPUID 00000008: 00000000-00000000-00000000-00000000
CPUID 00000009: 00000000-00000000-00000000-00000000
CPUID 0000000A: 07300404-00000000-00000000-00000603
CPUID 0000000B: 00000001-00000002-00000100-00000003 [SL 00]
CPUID 0000000B: 00000004-00000008-00000201-00000003 [SL 01]
CPUID 0000000C: 00000000-00000000-00000000-00000000
CPUID 0000000D: 0000001F-00000440-00000440-00000000 [SL 00]
CPUID 0000000D: 0000000F-000003C0-00000100-00000000 [SL 01]
CPUID 0000000D: 00000100-00000240-00000000-00000000 [SL 02]
CPUID 0000000D: 00000040-000003C0-00000000-00000000 [SL 03]
CPUID 0000000D: 00000040-00000400-00000000-00000000 [SL 04]
CPUID 0000000E: 00000000-00000000-00000000-00000000
CPUID 0000000F: 00000000-00000000-00000000-00000000 [SL 00]
CPUID 0000000F: 00000000-00000000-00000000-00000000 [SL 01]
CPUID 00000010: 00000000-00000000-00000000-00000000 [SL 00]
CPUID 00000010: 00000000-00000000-00000000-00000000 [SL 01]
CPUID 00000011: 00000000-00000000-00000000-00000000
CPUID 00000012: 00000000-00000000-00000000-00000000 [SL 00]
CPUID 00000012: 00000000-00000000-00000000-00000000 [SL 01]
CPUID 00000013: 00000000-00000000-00000000-00000000
CPUID 00000014: 00000001-0000000F-00000007-00000000 [SL 00]
CPUID 00000014: 02490002-003F3FFF-00000000-00000000 [SL 01]
CPUID 00000015: 00000002-0000015E-00000000-00000000 [175.00x / 0]
CPUID 00000016: 00001068-00001194-00000064-00000000 [4200 / 4500 / 100]
CPUID 80000000: 80000008-00000000-00000000-00000000
CPUID 80000001: 00000000-00000000-00000121-2C100000
CPUID 80000002: 65746E49-2952286C-726F4320-4D542865 [Intel(R) Core(TM]
CPUID 80000003: 37692029-3037372D-43204B30-40205550 [) i7-7700K CPU @]
CPUID 80000004: 322E3420-7A484730-00000000-00000000 [ 4.20GHz]
CPUID 80000005: 00000000-00000000-00000000-00000000
CPUID 80000006: 00000000-00000000-01006040-00000000
CPUID 80000007: 00000000-00000000-00000000-00000100
CPUID 80000008: 00003027-00000000-00000000-00000000

L1    Data Cache:    32 KB,  8-way Associative, 64-byte Line
L1  Instr. Cache:    32 KB,  8-way Associative, 64-byte Line
L2 Unified Cache:   256 KB,  4-way Associative, 64-byte Line
L3 Unified Cache:     8 MB, 16-way Associative, 64-byte Line

------[ Logical CPU #4 ]------

allcpu: Package 0 / Core 2 / Thread 0: Valid

CPUID 00000000: 00000016-756E6547-6C65746E-49656E69 [GenuineIntel]
CPUID 00000001: 000906E9-04100800-7FFAFBBF-BFEBFBFF
CPUID 00000002: 76036301-00F0B5FF-00000000-00C30000
CPUID 00000003: 00000000-00000000-00000000-00000000
CPUID 00000004: 1C004121-01C0003F-0000003F-00000000 [SL 00]
CPUID 00000004: 1C004122-01C0003F-0000003F-00000000 [SL 01]
CPUID 00000004: 1C004143-00C0003F-000003FF-00000000 [SL 02]
CPUID 00000004: 1C03C163-03C0003F-00001FFF-00000006 [SL 03]
CPUID 00000005: 00000040-00000040-00000003-00142120
CPUID 00000006: 000027F5-00000002-00000009-00000000
CPUID 00000007: 00000000-029C6FBF-00000000-00000000
CPUID 00000008: 00000000-00000000-00000000-00000000
CPUID 00000009: 00000000-00000000-00000000-00000000
CPUID 0000000A: 07300404-00000000-00000000-00000603
CPUID 0000000B: 00000001-00000002-00000100-00000004 [SL 00]
CPUID 0000000B: 00000004-00000008-00000201-00000004 [SL 01]
CPUID 0000000C: 00000000-00000000-00000000-00000000
CPUID 0000000D: 0000001F-00000440-00000440-00000000 [SL 00]
CPUID 0000000D: 0000000F-000003C0-00000100-00000000 [SL 01]
CPUID 0000000D: 00000100-00000240-00000000-00000000 [SL 02]
CPUID 0000000D: 00000040-000003C0-00000000-00000000 [SL 03]
CPUID 0000000D: 00000040-00000400-00000000-00000000 [SL 04]
CPUID 0000000E: 00000000-00000000-00000000-00000000
CPUID 0000000F: 00000000-00000000-00000000-00000000 [SL 00]
CPUID 0000000F: 00000000-00000000-00000000-00000000 [SL 01]
CPUID 00000010: 00000000-00000000-00000000-00000000 [SL 00]
CPUID 00000010: 00000000-00000000-00000000-00000000 [SL 01]
CPUID 00000011: 00000000-00000000-00000000-00000000
CPUID 00000012: 00000000-00000000-00000000-00000000 [SL 00]
CPUID 00000012: 00000000-00000000-00000000-00000000 [SL 01]
CPUID 00000013: 00000000-00000000-00000000-00000000
CPUID 00000014: 00000001-0000000F-00000007-00000000 [SL 00]
CPUID 00000014: 02490002-003F3FFF-00000000-00000000 [SL 01]
CPUID 00000015: 00000002-0000015E-00000000-00000000 [175.00x / 0]
CPUID 00000016: 00001068-00001194-00000064-00000000 [4200 / 4500 / 100]
CPUID 80000000: 80000008-00000000-00000000-00000000
CPUID 80000001: 00000000-00000000-00000121-2C100000
CPUID 80000002: 65746E49-2952286C-726F4320-4D542865 [Intel(R) Core(TM]
CPUID 80000003: 37692029-3037372D-43204B30-40205550 [) i7-7700K CPU @]
CPUID 80000004: 322E3420-7A484730-00000000-00000000 [ 4.20GHz]
CPUID 80000005: 00000000-00000000-00000000-00000000
CPUID 80000006: 00000000-00000000-01006040-00000000
CPUID 80000007: 00000000-00000000-00000000-00000100
CPUID 80000008: 00003027-00000000-00000000-00000000

L1    Data Cache:    32 KB,  8-way Associative, 64-byte Line
L1  Instr. Cache:    32 KB,  8-way Associative, 64-byte Line
L2 Unified Cache:   256 KB,  4-way Associative, 64-byte Line
L3 Unified Cache:     8 MB, 16-way Associative, 64-byte Line

------[ Logical CPU #5 ]------

allcpu: Package 0 / Core 2 / Thread 1: Valid, Virtual

CPUID 00000000: 00000016-756E6547-6C65746E-49656E69 [GenuineIntel]
CPUID 00000001: 000906E9-05100800-7FFAFBBF-BFEBFBFF
CPUID 00000002: 76036301-00F0B5FF-00000000-00C30000
CPUID 00000003: 00000000-00000000-00000000-00000000
CPUID 00000004: 1C004121-01C0003F-0000003F-00000000 [SL 00]
CPUID 00000004: 1C004122-01C0003F-0000003F-00000000 [SL 01]
CPUID 00000004: 1C004143-00C0003F-000003FF-00000000 [SL 02]
CPUID 00000004: 1C03C163-03C0003F-00001FFF-00000006 [SL 03]
CPUID 00000005: 00000040-00000040-00000003-00142120
CPUID 00000006: 000027F5-00000002-00000009-00000000
CPUID 00000007: 00000000-029C6FBF-00000000-00000000
CPUID 00000008: 00000000-00000000-00000000-00000000
CPUID 00000009: 00000000-00000000-00000000-00000000
CPUID 0000000A: 07300404-00000000-00000000-00000603
CPUID 0000000B: 00000001-00000002-00000100-00000005 [SL 00]
CPUID 0000000B: 00000004-00000008-00000201-00000005 [SL 01]
CPUID 0000000C: 00000000-00000000-00000000-00000000
CPUID 0000000D: 0000001F-00000440-00000440-00000000 [SL 00]
CPUID 0000000D: 0000000F-000003C0-00000100-00000000 [SL 01]
CPUID 0000000D: 00000100-00000240-00000000-00000000 [SL 02]
CPUID 0000000D: 00000040-000003C0-00000000-00000000 [SL 03]
CPUID 0000000D: 00000040-00000400-00000000-00000000 [SL 04]
CPUID 0000000E: 00000000-00000000-00000000-00000000
CPUID 0000000F: 00000000-00000000-00000000-00000000 [SL 00]
CPUID 0000000F: 00000000-00000000-00000000-00000000 [SL 01]
CPUID 00000010: 00000000-00000000-00000000-00000000 [SL 00]
CPUID 00000010: 00000000-00000000-00000000-00000000 [SL 01]
CPUID 00000011: 00000000-00000000-00000000-00000000
CPUID 00000012: 00000000-00000000-00000000-00000000 [SL 00]
CPUID 00000012: 00000000-00000000-00000000-00000000 [SL 01]
CPUID 00000013: 00000000-00000000-00000000-00000000
CPUID 00000014: 00000001-0000000F-00000007-00000000 [SL 00]
CPUID 00000014: 02490002-003F3FFF-00000000-00000000 [SL 01]
CPUID 00000015: 00000002-0000015E-00000000-00000000 [175.00x / 0]
CPUID 00000016: 00001068-00001194-00000064-00000000 [4200 / 4500 / 100]
CPUID 80000000: 80000008-00000000-00000000-00000000
CPUID 80000001: 00000000-00000000-00000121-2C100000
CPUID 80000002: 65746E49-2952286C-726F4320-4D542865 [Intel(R) Core(TM]
CPUID 80000003: 37692029-3037372D-43204B30-40205550 [) i7-7700K CPU @]
CPUID 80000004: 322E3420-7A484730-00000000-00000000 [ 4.20GHz]
CPUID 80000005: 00000000-00000000-00000000-00000000
CPUID 80000006: 00000000-00000000-01006040-00000000
CPUID 80000007: 00000000-00000000-00000000-00000100
CPUID 80000008: 00003027-00000000-00000000-00000000

L1    Data Cache:    32 KB,  8-way Associative, 64-byte Line
L1  Instr. Cache:    32 KB,  8-way Associative, 64-byte Line
L2 Unified Cache:   256 KB,  4-way Associative, 64-byte Line
L3 Unified Cache:     8 MB, 16-way Associative, 64-byte Line

------[ Logical CPU #6 ]------

allcpu: Package 0 / Core 3 / Thread 0: Valid

CPUID 00000000: 00000016-756E6547-6C65746E-49656E69 [GenuineIntel]
CPUID 00000001: 000906E9-06100800-7FFAFBBF-BFEBFBFF
CPUID 00000002: 76036301-00F0B5FF-00000000-00C30000
CPUID 00000003: 00000000-00000000-00000000-00000000
CPUID 00000004: 1C004121-01C0003F-0000003F-00000000 [SL 00]
CPUID 00000004: 1C004122-01C0003F-0000003F-00000000 [SL 01]
CPUID 00000004: 1C004143-00C0003F-000003FF-00000000 [SL 02]
CPUID 00000004: 1C03C163-03C0003F-00001FFF-00000006 [SL 03]
CPUID 00000005: 00000040-00000040-00000003-00142120
CPUID 00000006: 000027F5-00000002-00000009-00000000
CPUID 00000007: 00000000-029C6FBF-00000000-00000000
CPUID 00000008: 00000000-00000000-00000000-00000000
CPUID 00000009: 00000000-00000000-00000000-00000000
CPUID 0000000A: 07300404-00000000-00000000-00000603
CPUID 0000000B: 00000001-00000002-00000100-00000006 [SL 00]
CPUID 0000000B: 00000004-00000008-00000201-00000006 [SL 01]
CPUID 0000000C: 00000000-00000000-00000000-00000000
CPUID 0000000D: 0000001F-00000440-00000440-00000000 [SL 00]
CPUID 0000000D: 0000000F-000003C0-00000100-00000000 [SL 01]
CPUID 0000000D: 00000100-00000240-00000000-00000000 [SL 02]
CPUID 0000000D: 00000040-000003C0-00000000-00000000 [SL 03]
CPUID 0000000D: 00000040-00000400-00000000-00000000 [SL 04]
CPUID 0000000E: 00000000-00000000-00000000-00000000
CPUID 0000000F: 00000000-00000000-00000000-00000000 [SL 00]
CPUID 0000000F: 00000000-00000000-00000000-00000000 [SL 01]
CPUID 00000010: 00000000-00000000-00000000-00000000 [SL 00]
CPUID 00000010: 00000000-00000000-00000000-00000000 [SL 01]
CPUID 00000011: 00000000-00000000-00000000-00000000
CPUID 00000012: 00000000-00000000-00000000-00000000 [SL 00]
CPUID 00000012: 00000000-00000000-00000000-00000000 [SL 01]
CPUID 00000013: 00000000-00000000-00000000-00000000
CPUID 00000014: 00000001-0000000F-00000007-00000000 [SL 00]
CPUID 00000014: 02490002-003F3FFF-00000000-00000000 [SL 01]
CPUID 00000015: 00000002-0000015E-00000000-00000000 [175.00x / 0]
CPUID 00000016: 00001068-00001194-00000064-00000000 [4200 / 4500 / 100]
CPUID 80000000: 80000008-00000000-00000000-00000000
CPUID 80000001: 00000000-00000000-00000121-2C100000
CPUID 80000002: 65746E49-2952286C-726F4320-4D542865 [Intel(R) Core(TM]
CPUID 80000003: 37692029-3037372D-43204B30-40205550 [) i7-7700K CPU @]
CPUID 80000004: 322E3420-7A484730-00000000-00000000 [ 4.20GHz]
CPUID 80000005: 00000000-00000000-00000000-00000000
CPUID 80000006: 00000000-00000000-01006040-00000000
CPUID 80000007: 00000000-00000000-00000000-00000100
CPUID 80000008: 00003027-00000000-00000000-00000000

L1    Data Cache:    32 KB,  8-way Associative, 64-byte Line
L1  Instr. Cache:    32 KB,  8-way Associative, 64-byte Line
L2 Unified Cache:   256 KB,  4-way Associative, 64-byte Line
L3 Unified Cache:     8 MB, 16-way Associative, 64-byte Line

------[ Logical CPU #7 ]------

allcpu: Package 0 / Core 3 / Thread 1: Valid, Virtual

CPUID 00000000: 00000016-756E6547-6C65746E-49656E69 [GenuineIntel]
CPUID 00000001: 000906E9-07100800-7FFAFBBF-BFEBFBFF
CPUID 00000002: 76036301-00F0B5FF-00000000-00C30000
CPUID 00000003: 00000000-00000000-00000000-00000000
CPUID 00000004: 1C004121-01C0003F-0000003F-00000000 [SL 00]
CPUID 00000004: 1C004122-01C0003F-0000003F-00000000 [SL 01]
CPUID 00000004: 1C004143-00C0003F-000003FF-00000000 [SL 02]
CPUID 00000004: 1C03C163-03C0003F-00001FFF-00000006 [SL 03]
CPUID 00000005: 00000040-00000040-00000003-00142120
CPUID 00000006: 000027F5-00000002-00000009-00000000
CPUID 00000007: 00000000-029C6FBF-00000000-00000000
CPUID 00000008: 00000000-00000000-00000000-00000000
CPUID 00000009: 00000000-00000000-00000000-00000000
CPUID 0000000A: 07300404-00000000-00000000-00000603
CPUID 0000000B: 00000001-00000002-00000100-00000007 [SL 00]
CPUID 0000000B: 00000004-00000008-00000201-00000007 [SL 01]
CPUID 0000000C: 00000000-00000000-00000000-00000000
CPUID 0000000D: 0000001F-00000440-00000440-00000000 [SL 00]
CPUID 0000000D: 0000000F-000003C0-00000100-00000000 [SL 01]
CPUID 0000000D: 00000100-00000240-00000000-00000000 [SL 02]
CPUID 0000000D: 00000040-000003C0-00000000-00000000 [SL 03]
CPUID 0000000D: 00000040-00000400-00000000-00000000 [SL 04]
CPUID 0000000E: 00000000-00000000-00000000-00000000
CPUID 0000000F: 00000000-00000000-00000000-00000000 [SL 00]
CPUID 0000000F: 00000000-00000000-00000000-00000000 [SL 01]
CPUID 00000010: 00000000-00000000-00000000-00000000 [SL 00]
CPUID 00000010: 00000000-00000000-00000000-00000000 [SL 01]
CPUID 00000011: 00000000-00000000-00000000-00000000
CPUID 00000012: 00000000-00000000-00000000-00000000 [SL 00]
CPUID 00000012: 00000000-00000000-00000000-00000000 [SL 01]
CPUID 00000013: 00000000-00000000-00000000-00000000
CPUID 00000014: 00000001-0000000F-00000007-00000000 [SL 00]
CPUID 00000014: 02490002-003F3FFF-00000000-00000000 [SL 01]
CPUID 00000015: 00000002-0000015E-00000000-00000000 [175.00x / 0]
CPUID 00000016: 00001068-00001194-00000064-00000000 [4200 / 4500 / 100]
CPUID 80000000: 80000008-00000000-00000000-00000000
CPUID 80000001: 00000000-00000000-00000121-2C100000
CPUID 80000002: 65746E49-2952286C-726F4320-4D542865 [Intel(R) Core(TM]
CPUID 80000003: 37692029-3037372D-43204B30-40205550 [) i7-7700K CPU @]
CPUID 80000004: 322E3420-7A484730-00000000-00000000 [ 4.20GHz]
CPUID 80000005: 00000000-00000000-00000000-00000000
CPUID 80000006: 00000000-00000000-01006040-00000000
CPUID 80000007: 00000000-00000000-00000000-00000100
CPUID 80000008: 00003027-00000000-00000000-00000000

L1    Data Cache:    32 KB,  8-way Associative, 64-byte Line
L1  Instr. Cache:    32 KB,  8-way Associative, 64-byte Line
L2 Unified Cache:   256 KB,  4-way Associative, 64-byte Line
L3 Unified Cache:     8 MB, 16-way Associative, 64-byte Line

------[ All CPUs ]------

CPU   0: APICID   0 / Package 0 / Core  0 / Thread 0: Valid
CPU   1: APICID   1 / Package 0 / Core  0 / Thread 1: Valid, Virtual
CPU   2: APICID   2 / Package 0 / Core  1 / Thread 0: Valid
CPU   3: APICID   3 / Package 0 / Core  1 / Thread 1: Valid, Virtual
CPU   4: APICID   4 / Package 0 / Core  2 / Thread 0: Valid
CPU   5: APICID   5 / Package 0 / Core  2 / Thread 1: Valid, Virtual
CPU   6: APICID   6 / Package 0 / Core  3 / Thread 0: Valid
CPU   7: APICID   7 / Package 0 / Core  3 / Thread 1: Valid, Virtual

------[ MSR Registers ]------

MSR 00000017: 0004-0000-0000-0000 [PlatID = 1]
MSR 0000001B: 0000-0000-FEE0-0D00
MSR 00000035: 0000-0000-0004-0008
MSR 0000008B: 0000-0042-0000-0000
MSR 000000CE: 0008-0838-F101-2A00 [eD = 0]
MSR 000000E7: 0000-0041-9952-8BEB [S200]
MSR 000000E7: 0000-0041-9C8E-4C31 [S200]
MSR 000000E7: 0000-0041-9E9C-DBE9
MSR 000000E8: 0000-0041-96DA-4EDB [S200]
MSR 000000E8: 0000-0041-98C1-8446 [S200]
MSR 000000E8: 0000-0041-9B20-5522
MSR 00000194: 0000-0000-000F-0000
MSR 00000198: 0000-270A-0000-2A00 [S200]
MSR 00000198: 0000-268F-0000-2A00 [S200]
MSR 00000198: 0000-26B8-0000-2A00
MSR 00000199: 0000-0000-0000-FF00
MSR 0000019A: 0000-0000-0000-0000
MSR 0000019B: 0000-0000-0000-0010
MSR 0000019C: 0000-0000-883D-0000 [S200]
MSR 0000019C: 0000-0000-883D-0000 [S200]
MSR 0000019C: 0000-0000-883D-0000
MSR 0000019D: 0000-0000-0000-0000
MSR 000001A0: 0000-0040-0085-0089
MSR 000001A2: 0000-0000-0064-1400
MSR 000001A4: 0000-0000-0000-0000
MSR 000001AA: 0000-0000-0040-1CC0
MSR 000001AC: < FAILED >
MSR 000001AD: 0000-0000-2D2D-2D2D
MSR 000001B0: 0000-0000-0000-0006
MSR 000001B1: 0000-0000-883A-0000
MSR 000001B2: 0000-0000-0000-0000
MSR 000001FC: 0000-0000-003C-005D
MSR 00000300: < FAILED >
MSR 0000030A: 0000-0000-03C6-E794 [S200]
MSR 0000030A: 0000-0000-03C6-E794 [S200]
MSR 0000030A: 0000-0000-03C6-E794
MSR 0000030B: 0000-0000-03C6-E5E1 [S200]
MSR 0000030B: 0000-0000-03C6-E5E1 [S200]
MSR 0000030B: 0000-0000-03C6-E5E1
MSR 00000480: 00DA-0400-0000-0004
MSR 00000481: 0000-007F-0000-0016
MSR 00000482: FFF9-FFFE-0401-E172
MSR 00000483: 01FF-FFFF-0003-6DFF
MSR 00000484: 0003-FFFF-0000-11FF
MSR 00000485: 0000-0000-7004-C1E7
MSR 00000486: 0000-0000-8000-0021
MSR 00000487: 0000-0000-FFFF-FFFF
MSR 00000488: 0000-0000-0000-2000
MSR 00000489: 0000-0000-0037-27FF
MSR 0000048A: 0000-0000-0000-002E
MSR 0000048B: 005F-FCFF-0000-0000
MSR 0000048C: 0000-0F01-0673-4141
MSR 0000048D: 0000-007F-0000-0016
MSR 0000048E: FFF9-FFFE-0400-6172
MSR 0000048F: 01FF-FFFF-0003-6DFB
MSR 00000490: 0003-FFFF-0000-11FB
MSR 00000601: 0000-0000-0000-0000
MSR 00000602: < FAILED >
MSR 00000603: 0036-0000-0036-3636
MSR 00000604: < FAILED >
MSR 00000606: 0000-0000-000A-0E03
MSR 0000060A: 0000-0000-0000-884E
MSR 0000060B: 0000-0000-0000-8876
MSR 0000060C: 0000-0000-0000-8894
MSR 0000060D: 0000-0000-0000-0000
MSR 00000610: 0042-FFF8-0015-FFF8
MSR 00000611: 0000-0000-4291-57B7 [S200]
MSR 00000611: 0000-0000-4291-75EF [S200]
MSR 00000611: 0000-0000-4291-99E0
MSR 00000613: 0000-0000-0000-0000
MSR 00000614: 0000-0000-0000-02D8
MSR 00000618: 0054-00DE-0000-0000
MSR 00000619: 0000-0000-0815-7273 [S200]
MSR 00000619: 0000-0000-0815-7F24 [S200]
MSR 00000619: 0000-0000-0815-8B8A
MSR 0000061B: 0000-0000-0000-0000
MSR 0000061C: < FAILED >
MSR 0000061E: < FAILED >
MSR 00000620: 0000-0000-0000-082A
MSR 00000621: 0000-0000-0000-0028
MSR 00000638: 0000-0000-0000-0000
MSR 00000639: 0000-0000-3A13-ACB8 [S200]
MSR 00000639: 0000-0000-3A13-BD4E [S200]
MSR 00000639: 0000-0000-3A13-CCD7
MSR 0000063A: 0000-0000-0000-0009
MSR 0000063B: < FAILED >
MSR 00000640: 0000-0000-0000-0000
MSR 00000641: 0000-0000-0107-DF37 [S200]
MSR 00000641: 0000-0000-0107-DFC2 [S200]
MSR 00000641: 0000-0000-0107-E051
MSR 00000642: 0000-0000-0000-000D
MSR 00000648: 0000-0000-0000-002A
MSR 00000649: 0000-0000-0000-0000
MSR 0000064A: 0000-0000-0000-0000
MSR 0000064B: 0000-0000-8000-0000
MSR 0000064C: 0000-0000-0000-0000
MSR 00000690: 0000-0000-0000-0000
MSR 000006B0: 0000-0000-0000-0000
MSR 000006B1: 0000-0000-0000-0000
MSR 00000770: 0000-0000-0000-0000
MSR 00000771: < FAILED >
MSR 00000772: < FAILED >
MSR 00000773: 0000-0000-0000-0000
MSR 00000774: < FAILED >
MSR 00000777: < FAILED >
MSR 00000832: 0000-0000-0002-00D1
MSR 00000838: 0000-0000-0000-0B72
MSR 00000839: 0000-0000-0000-0B4D
MSR 0000083E: 0000-0000-0000-000A

PerformanceFrequency = 4101553

CPU Clock M.Method = 9  (APIC SKL)
PM Timer Address   = 6152  (1808h)

APIC Clock = 100.00 MHz  (AT = 12575 / TT = 15004 / try = 1 / SKL = 24.00 MHz)
APIC Clock = 100.00 MHz  (AT = 12574 / TT = 15003 / try = 1 / SKL = 24.00 MHz)
APIC Clock = 100.00 MHz  (AT = 12574 / TT = 15005 / try = 1 / SKL = 24.00 MHz)
APIC Clock = 100.00 MHz  (AT = 12573 / TT = 15003 / try = 1 / SKL = 24.00 MHz)
APIC Clock = 99.98 MHz  (AT = 12573 / TT = 15002 / try = 1 / SKL = 24.00 MHz)

CPU Clock = 4201.01 MHz / TSC Clock = 4199.74 MHz / CPU Mul = 42.00x
CPU Clock = 4200.00 MHz / TSC Clock = 4200.30 MHz / CPU Mul = 42.00x
CPU Clock = 4200.00 MHz / TSC Clock = 4200.07 MHz / CPU Mul = 42.00x
CPU Clock = 4198.99 MHz / TSC Clock = 4199.96 MHz / CPU Mul = 42.00x
CPU Clock = 4201.01 MHz / TSC Clock = 4199.74 MHz / CPU Mul = 42.00x

CPU Clock Max = 4198.99 MHz / TSC Clock = 4199.74 MHz / CPU Mul = 42.00x
CPU Clock Max = 4197.94 MHz / TSC Clock = 4200.07 MHz / CPU Mul = 42.00x
CPU Clock Max = 4200.00 MHz / TSC Clock = 4200.07 MHz / CPU Mul = 42.00x
CPU Clock Max = 4196.93 MHz / TSC Clock = 4199.74 MHz / CPU Mul = 42.00x
CPU Clock Max = 4198.99 MHz / TSC Clock = 4199.74 MHz / CPU Mul = 42.00x

INTPERFCTR2 = 4200.02 MHz / INTPERFCTR1 (TSC) = 4200.02 MHz
INTPERFCTR2 = 4200.04 MHz / INTPERFCTR1 (TSC) = 4200.04 MHz
INTPERFCTR2 = 4200.00 MHz / INTPERFCTR1 (TSC) = 4200.00 MHz
INTPERFCTR2 = 4199.99 MHz / INTPERFCTR1 (TSC) = 4199.99 MHz
INTPERFCTR2 = 4200.00 MHz / INTPERFCTR1 (TSC) = 4200.01 MHz

------[ OC MailBox ]------

C 01 / P1 00 / P2 00: 00000753
C 01 / P1 01 / P2 00: 0000073C
C 01 / P1 02 / P2 00: 00000753
C 01 / P1 03 / P2 00: 0000073C
C 02 / P1 00 / P2 00: 53535353
C 02 / P1 00 / P2 01: < FAILED >
C 05 / P1 00 / P2 00: 000186B8
C 10 / P1 00 / P2 00: 00000000
C 10 / P1 01 / P2 00: 00000017
C 10 / P1 02 / P2 00: 00000000
C 10 / P1 03 / P2 00: 00000017
C 12 / P1 00 / P2 00: 00000000
C 14 / P1 00 / P2 00: 00000004
