------[ Versions ]------

Program Version : AIDA64 v5.30.3556 Beta
BenchDLL Version: 4.1.643-x64

------[ CPU Info ]------

CPU Type          : QuadCore Intel Core i7-6700K, 4000 MHz (40 x 100)
CPU Alias         : Skylake-S
CPU Platform      : LGA1151
CPU Stepping      : R0
Instruction Set   : x86, x86-64, MMX, SSE, SSE2, SSE3, SSSE3, SSE4.1, SSE4.2, AVX, AVX2, FMA, AES
CPUID Manufacturer: GenuineIntel
CPUID CPU Name    : Intel(R) Core(TM) i7-6700K CPU @ 4.00GHz
CPUID Revision    : 000506E3h
IA Brand ID       : 00h  (Unknown)
Platform ID       : 3Fh  (LGA1151)
HTT / CMP Units   : 2 / 4
Max. NUMA Node    : 0

Tjmax Temperature          : 100 Celsius
HTC Temperature Limit      : 0 Celsius
CPU TDP                    : 95 W
CPU Max Power Limit        : Unlimited Power / Unlimited Time
CPU Power Limit 1 (Long)   : 3408.3 W / 8.00 sec  (Unlocked)
CPU Power Limit 2 (Short)  : 4090 W / 2.44 ms  (Unlocked)
Max Turbo Boost Multipliers: 1C: 42x, 2C: 40x, 3C: 40x, 4C: 40x

------[ Logical CPU #0 ]------

allcpu: Package 0 / Core 0 / Thread 0: Valid

CPUID 00000000: 00000016-756E6547-6C65746E-49656E69 [GenuineIntel]
CPUID 00000001: 000506E3-00100800-7FFAFBBF-BFEBFBFF
CPUID 00000002: 76036301-00F0B5FF-00000000-00C30000
CPUID 00000003: 00000000-00000000-00000000-00000000
CPUID 00000004: 1C004121-01C0003F-0000003F-00000000 [SL 00]
CPUID 00000004: 1C004122-01C0003F-0000003F-00000000 [SL 01]
CPUID 00000004: 1C004143-00C0003F-000003FF-00000000 [SL 02]
CPUID 00000004: 1C03C163-03C0003F-00001FFF-00000006 [SL 03]
CPUID 00000005: 00000040-00000040-00000003-00142120
CPUID 00000006: 000007F7-00000002-00000001-00000000
CPUID 00000007: 00000000-029C6FBB-00000000-00000000
CPUID 00000008: 00000000-00000000-00000000-00000000
CPUID 00000009: 00000000-00000000-00000000-00000000
CPUID 0000000A: 07300404-00000000-00000000-00000603
CPUID 0000000B: 00000001-00000002-00000100-00000000 [SL 00]
CPUID 0000000B: 00000004-00000008-00000201-00000000 [SL 01]
CPUID 0000000C: 00000000-00000000-00000000-00000000
CPUID 0000000D: 0000001F-00000440-00000440-00000000 [SL 00]
CPUID 0000000D: 0000000F-000003C0-00000100-00000000 [SL 01]
CPUID 0000000D: 00000100-00000240-00000000-00000000 [SL 02]
CPUID 0000000D: 00000040-000003C0-00000000-00000000 [SL 03]
CPUID 0000000D: 00000040-00000400-00000000-00000000 [SL 04]
CPUID 0000000E: 00000000-00000000-00000000-00000000
CPUID 0000000F: 00000000-00000000-00000000-00000000 [SL 00]
CPUID 0000000F: 00000000-00000000-00000000-00000000 [SL 01]
CPUID 00000010: 00000000-00000000-00000000-00000000 [SL 00]
CPUID 00000010: 00000000-00000000-00000000-00000000 [SL 01]
CPUID 00000011: 00000000-00000000-00000000-00000000
CPUID 00000012: 00000000-00000000-00000000-00000000 [SL 00]
CPUID 00000012: 00000000-00000000-00000000-00000000 [SL 01]
CPUID 00000013: 00000000-00000000-00000000-00000000
CPUID 00000014: 00000001-0000000F-00000007-00000000 [SL 00]
CPUID 00000014: 02490002-003F3FFF-00000000-00000000 [SL 01]
CPUID 00000015: 00000002-0000014E-00000000-00000000 [167.00x]
CPUID 00000016: 00000FA0-00001068-00000064-00000000
CPUID 80000000: 80000008-00000000-00000000-00000000
CPUID 80000001: 00000000-00000000-00000121-2C100000
CPUID 80000002: 65746E49-2952286C-726F4320-4D542865 [Intel(R) Core(TM]
CPUID 80000003: 37692029-3037362D-43204B30-40205550 [) i7-6700K CPU @]
CPUID 80000004: 302E3420-7A484730-00000000-00000000 [ 4.00GHz]
CPUID 80000005: 00000000-00000000-00000000-00000000
CPUID 80000006: 00000000-00000000-01006040-00000000
CPUID 80000007: 00000000-00000000-00000000-00000100
CPUID 80000008: 00003027-00000000-00000000-00000000

L1    Data Cache:    32 KB,  8-way Associative, 64-byte Line
L1  Instr. Cache:    32 KB,  8-way Associative, 64-byte Line
L2 Unified Cache:   256 KB,  4-way Associative, 64-byte Line
L3 Unified Cache:     8 MB, 16-way Associative, 64-byte Line

------[ Logical CPU #1 ]------

allcpu: Package 0 / Core 0 / Thread 1: Valid, Virtual

CPUID 00000000: 00000016-756E6547-6C65746E-49656E69 [GenuineIntel]
CPUID 00000001: 000506E3-01100800-7FFAFBBF-BFEBFBFF
CPUID 00000002: 76036301-00F0B5FF-00000000-00C30000
CPUID 00000003: 00000000-00000000-00000000-00000000
CPUID 00000004: 1C004121-01C0003F-0000003F-00000000 [SL 00]
CPUID 00000004: 1C004122-01C0003F-0000003F-00000000 [SL 01]
CPUID 00000004: 1C004143-00C0003F-000003FF-00000000 [SL 02]
CPUID 00000004: 1C03C163-03C0003F-00001FFF-00000006 [SL 03]
CPUID 00000005: 00000040-00000040-00000003-00142120
CPUID 00000006: 000007F7-00000002-00000001-00000000
CPUID 00000007: 00000000-029C6FBB-00000000-00000000
CPUID 00000008: 00000000-00000000-00000000-00000000
CPUID 00000009: 00000000-00000000-00000000-00000000
CPUID 0000000A: 07300404-00000000-00000000-00000603
CPUID 0000000B: 00000001-00000002-00000100-00000001 [SL 00]
CPUID 0000000B: 00000004-00000008-00000201-00000001 [SL 01]
CPUID 0000000C: 00000000-00000000-00000000-00000000
CPUID 0000000D: 0000001F-00000440-00000440-00000000 [SL 00]
CPUID 0000000D: 0000000F-000003C0-00000100-00000000 [SL 01]
CPUID 0000000D: 00000100-00000240-00000000-00000000 [SL 02]
CPUID 0000000D: 00000040-000003C0-00000000-00000000 [SL 03]
CPUID 0000000D: 00000040-00000400-00000000-00000000 [SL 04]
CPUID 0000000E: 00000000-00000000-00000000-00000000
CPUID 0000000F: 00000000-00000000-00000000-00000000 [SL 00]
CPUID 0000000F: 00000000-00000000-00000000-00000000 [SL 01]
CPUID 00000010: 00000000-00000000-00000000-00000000 [SL 00]
CPUID 00000010: 00000000-00000000-00000000-00000000 [SL 01]
CPUID 00000011: 00000000-00000000-00000000-00000000
CPUID 00000012: 00000000-00000000-00000000-00000000 [SL 00]
CPUID 00000012: 00000000-00000000-00000000-00000000 [SL 01]
CPUID 00000013: 00000000-00000000-00000000-00000000
CPUID 00000014: 00000001-0000000F-00000007-00000000 [SL 00]
CPUID 00000014: 02490002-003F3FFF-00000000-00000000 [SL 01]
CPUID 00000015: 00000002-0000014E-00000000-00000000 [167.00x]
CPUID 00000016: 00000FA0-00001068-00000064-00000000
CPUID 80000000: 80000008-00000000-00000000-00000000
CPUID 80000001: 00000000-00000000-00000121-2C100000
CPUID 80000002: 65746E49-2952286C-726F4320-4D542865 [Intel(R) Core(TM]
CPUID 80000003: 37692029-3037362D-43204B30-40205550 [) i7-6700K CPU @]
CPUID 80000004: 302E3420-7A484730-00000000-00000000 [ 4.00GHz]
CPUID 80000005: 00000000-00000000-00000000-00000000
CPUID 80000006: 00000000-00000000-01006040-00000000
CPUID 80000007: 00000000-00000000-00000000-00000100
CPUID 80000008: 00003027-00000000-00000000-00000000

L1    Data Cache:    32 KB,  8-way Associative, 64-byte Line
L1  Instr. Cache:    32 KB,  8-way Associative, 64-byte Line
L2 Unified Cache:   256 KB,  4-way Associative, 64-byte Line
L3 Unified Cache:     8 MB, 16-way Associative, 64-byte Line

------[ Logical CPU #2 ]------

allcpu: Package 0 / Core 1 / Thread 0: Valid

CPUID 00000000: 00000016-756E6547-6C65746E-49656E69 [GenuineIntel]
CPUID 00000001: 000506E3-02100800-7FFAFBBF-BFEBFBFF
CPUID 00000002: 76036301-00F0B5FF-00000000-00C30000
CPUID 00000003: 00000000-00000000-00000000-00000000
CPUID 00000004: 1C004121-01C0003F-0000003F-00000000 [SL 00]
CPUID 00000004: 1C004122-01C0003F-0000003F-00000000 [SL 01]
CPUID 00000004: 1C004143-00C0003F-000003FF-00000000 [SL 02]
CPUID 00000004: 1C03C163-03C0003F-00001FFF-00000006 [SL 03]
CPUID 00000005: 00000040-00000040-00000003-00142120
CPUID 00000006: 000007F7-00000002-00000001-00000000
CPUID 00000007: 00000000-029C6FBB-00000000-00000000
CPUID 00000008: 00000000-00000000-00000000-00000000
CPUID 00000009: 00000000-00000000-00000000-00000000
CPUID 0000000A: 07300404-00000000-00000000-00000603
CPUID 0000000B: 00000001-00000002-00000100-00000002 [SL 00]
CPUID 0000000B: 00000004-00000008-00000201-00000002 [SL 01]
CPUID 0000000C: 00000000-00000000-00000000-00000000
CPUID 0000000D: 0000001F-00000440-00000440-00000000 [SL 00]
CPUID 0000000D: 0000000F-000003C0-00000100-00000000 [SL 01]
CPUID 0000000D: 00000100-00000240-00000000-00000000 [SL 02]
CPUID 0000000D: 00000040-000003C0-00000000-00000000 [SL 03]
CPUID 0000000D: 00000040-00000400-00000000-00000000 [SL 04]
CPUID 0000000E: 00000000-00000000-00000000-00000000
CPUID 0000000F: 00000000-00000000-00000000-00000000 [SL 00]
CPUID 0000000F: 00000000-00000000-00000000-00000000 [SL 01]
CPUID 00000010: 00000000-00000000-00000000-00000000 [SL 00]
CPUID 00000010: 00000000-00000000-00000000-00000000 [SL 01]
CPUID 00000011: 00000000-00000000-00000000-00000000
CPUID 00000012: 00000000-00000000-00000000-00000000 [SL 00]
CPUID 00000012: 00000000-00000000-00000000-00000000 [SL 01]
CPUID 00000013: 00000000-00000000-00000000-00000000
CPUID 00000014: 00000001-0000000F-00000007-00000000 [SL 00]
CPUID 00000014: 02490002-003F3FFF-00000000-00000000 [SL 01]
CPUID 00000015: 00000002-0000014E-00000000-00000000 [167.00x]
CPUID 00000016: 00000FA0-00001068-00000064-00000000
CPUID 80000000: 80000008-00000000-00000000-00000000
CPUID 80000001: 00000000-00000000-00000121-2C100000
CPUID 80000002: 65746E49-2952286C-726F4320-4D542865 [Intel(R) Core(TM]
CPUID 80000003: 37692029-3037362D-43204B30-40205550 [) i7-6700K CPU @]
CPUID 80000004: 302E3420-7A484730-00000000-00000000 [ 4.00GHz]
CPUID 80000005: 00000000-00000000-00000000-00000000
CPUID 80000006: 00000000-00000000-01006040-00000000
CPUID 80000007: 00000000-00000000-00000000-00000100
CPUID 80000008: 00003027-00000000-00000000-00000000

L1    Data Cache:    32 KB,  8-way Associative, 64-byte Line
L1  Instr. Cache:    32 KB,  8-way Associative, 64-byte Line
L2 Unified Cache:   256 KB,  4-way Associative, 64-byte Line
L3 Unified Cache:     8 MB, 16-way Associative, 64-byte Line

------[ Logical CPU #3 ]------

allcpu: Package 0 / Core 1 / Thread 1: Valid, Virtual

CPUID 00000000: 00000016-756E6547-6C65746E-49656E69 [GenuineIntel]
CPUID 00000001: 000506E3-03100800-7FFAFBBF-BFEBFBFF
CPUID 00000002: 76036301-00F0B5FF-00000000-00C30000
CPUID 00000003: 00000000-00000000-00000000-00000000
CPUID 00000004: 1C004121-01C0003F-0000003F-00000000 [SL 00]
CPUID 00000004: 1C004122-01C0003F-0000003F-00000000 [SL 01]
CPUID 00000004: 1C004143-00C0003F-000003FF-00000000 [SL 02]
CPUID 00000004: 1C03C163-03C0003F-00001FFF-00000006 [SL 03]
CPUID 00000005: 00000040-00000040-00000003-00142120
CPUID 00000006: 000007F7-00000002-00000001-00000000
CPUID 00000007: 00000000-029C6FBB-00000000-00000000
CPUID 00000008: 00000000-00000000-00000000-00000000
CPUID 00000009: 00000000-00000000-00000000-00000000
CPUID 0000000A: 07300404-00000000-00000000-00000603
CPUID 0000000B: 00000001-00000002-00000100-00000003 [SL 00]
CPUID 0000000B: 00000004-00000008-00000201-00000003 [SL 01]
CPUID 0000000C: 00000000-00000000-00000000-00000000
CPUID 0000000D: 0000001F-00000440-00000440-00000000 [SL 00]
CPUID 0000000D: 0000000F-000003C0-00000100-00000000 [SL 01]
CPUID 0000000D: 00000100-00000240-00000000-00000000 [SL 02]
CPUID 0000000D: 00000040-000003C0-00000000-00000000 [SL 03]
CPUID 0000000D: 00000040-00000400-00000000-00000000 [SL 04]
CPUID 0000000E: 00000000-00000000-00000000-00000000
CPUID 0000000F: 00000000-00000000-00000000-00000000 [SL 00]
CPUID 0000000F: 00000000-00000000-00000000-00000000 [SL 01]
CPUID 00000010: 00000000-00000000-00000000-00000000 [SL 00]
CPUID 00000010: 00000000-00000000-00000000-00000000 [SL 01]
CPUID 00000011: 00000000-00000000-00000000-00000000
CPUID 00000012: 00000000-00000000-00000000-00000000 [SL 00]
CPUID 00000012: 00000000-00000000-00000000-00000000 [SL 01]
CPUID 00000013: 00000000-00000000-00000000-00000000
CPUID 00000014: 00000001-0000000F-00000007-00000000 [SL 00]
CPUID 00000014: 02490002-003F3FFF-00000000-00000000 [SL 01]
CPUID 00000015: 00000002-0000014E-00000000-00000000 [167.00x]
CPUID 00000016: 00000FA0-00001068-00000064-00000000
CPUID 80000000: 80000008-00000000-00000000-00000000
CPUID 80000001: 00000000-00000000-00000121-2C100000
CPUID 80000002: 65746E49-2952286C-726F4320-4D542865 [Intel(R) Core(TM]
CPUID 80000003: 37692029-3037362D-43204B30-40205550 [) i7-6700K CPU @]
CPUID 80000004: 302E3420-7A484730-00000000-00000000 [ 4.00GHz]
CPUID 80000005: 00000000-00000000-00000000-00000000
CPUID 80000006: 00000000-00000000-01006040-00000000
CPUID 80000007: 00000000-00000000-00000000-00000100
CPUID 80000008: 00003027-00000000-00000000-00000000

L1    Data Cache:    32 KB,  8-way Associative, 64-byte Line
L1  Instr. Cache:    32 KB,  8-way Associative, 64-byte Line
L2 Unified Cache:   256 KB,  4-way Associative, 64-byte Line
L3 Unified Cache:     8 MB, 16-way Associative, 64-byte Line

------[ Logical CPU #4 ]------

allcpu: Package 0 / Core 2 / Thread 0: Valid

CPUID 00000000: 00000016-756E6547-6C65746E-49656E69 [GenuineIntel]
CPUID 00000001: 000506E3-04100800-7FFAFBBF-BFEBFBFF
CPUID 00000002: 76036301-00F0B5FF-00000000-00C30000
CPUID 00000003: 00000000-00000000-00000000-00000000
CPUID 00000004: 1C004121-01C0003F-0000003F-00000000 [SL 00]
CPUID 00000004: 1C004122-01C0003F-0000003F-00000000 [SL 01]
CPUID 00000004: 1C004143-00C0003F-000003FF-00000000 [SL 02]
CPUID 00000004: 1C03C163-03C0003F-00001FFF-00000006 [SL 03]
CPUID 00000005: 00000040-00000040-00000003-00142120
CPUID 00000006: 000007F7-00000002-00000001-00000000
CPUID 00000007: 00000000-029C6FBB-00000000-00000000
CPUID 00000008: 00000000-00000000-00000000-00000000
CPUID 00000009: 00000000-00000000-00000000-00000000
CPUID 0000000A: 07300404-00000000-00000000-00000603
CPUID 0000000B: 00000001-00000002-00000100-00000004 [SL 00]
CPUID 0000000B: 00000004-00000008-00000201-00000004 [SL 01]
CPUID 0000000C: 00000000-00000000-00000000-00000000
CPUID 0000000D: 0000001F-00000440-00000440-00000000 [SL 00]
CPUID 0000000D: 0000000F-000003C0-00000100-00000000 [SL 01]
CPUID 0000000D: 00000100-00000240-00000000-00000000 [SL 02]
CPUID 0000000D: 00000040-000003C0-00000000-00000000 [SL 03]
CPUID 0000000D: 00000040-00000400-00000000-00000000 [SL 04]
CPUID 0000000E: 00000000-00000000-00000000-00000000
CPUID 0000000F: 00000000-00000000-00000000-00000000 [SL 00]
CPUID 0000000F: 00000000-00000000-00000000-00000000 [SL 01]
CPUID 00000010: 00000000-00000000-00000000-00000000 [SL 00]
CPUID 00000010: 00000000-00000000-00000000-00000000 [SL 01]
CPUID 00000011: 00000000-00000000-00000000-00000000
CPUID 00000012: 00000000-00000000-00000000-00000000 [SL 00]
CPUID 00000012: 00000000-00000000-00000000-00000000 [SL 01]
CPUID 00000013: 00000000-00000000-00000000-00000000
CPUID 00000014: 00000001-0000000F-00000007-00000000 [SL 00]
CPUID 00000014: 02490002-003F3FFF-00000000-00000000 [SL 01]
CPUID 00000015: 00000002-0000014E-00000000-00000000 [167.00x]
CPUID 00000016: 00000FA0-00001068-00000064-00000000
CPUID 80000000: 80000008-00000000-00000000-00000000
CPUID 80000001: 00000000-00000000-00000121-2C100000
CPUID 80000002: 65746E49-2952286C-726F4320-4D542865 [Intel(R) Core(TM]
CPUID 80000003: 37692029-3037362D-43204B30-40205550 [) i7-6700K CPU @]
CPUID 80000004: 302E3420-7A484730-00000000-00000000 [ 4.00GHz]
CPUID 80000005: 00000000-00000000-00000000-00000000
CPUID 80000006: 00000000-00000000-01006040-00000000
CPUID 80000007: 00000000-00000000-00000000-00000100
CPUID 80000008: 00003027-00000000-00000000-00000000

L1    Data Cache:    32 KB,  8-way Associative, 64-byte Line
L1  Instr. Cache:    32 KB,  8-way Associative, 64-byte Line
L2 Unified Cache:   256 KB,  4-way Associative, 64-byte Line
L3 Unified Cache:     8 MB, 16-way Associative, 64-byte Line

------[ Logical CPU #5 ]------

allcpu: Package 0 / Core 2 / Thread 1: Valid, Virtual

CPUID 00000000: 00000016-756E6547-6C65746E-49656E69 [GenuineIntel]
CPUID 00000001: 000506E3-05100800-7FFAFBBF-BFEBFBFF
CPUID 00000002: 76036301-00F0B5FF-00000000-00C30000
CPUID 00000003: 00000000-00000000-00000000-00000000
CPUID 00000004: 1C004121-01C0003F-0000003F-00000000 [SL 00]
CPUID 00000004: 1C004122-01C0003F-0000003F-00000000 [SL 01]
CPUID 00000004: 1C004143-00C0003F-000003FF-00000000 [SL 02]
CPUID 00000004: 1C03C163-03C0003F-00001FFF-00000006 [SL 03]
CPUID 00000005: 00000040-00000040-00000003-00142120
CPUID 00000006: 000007F7-00000002-00000001-00000000
CPUID 00000007: 00000000-029C6FBB-00000000-00000000
CPUID 00000008: 00000000-00000000-00000000-00000000
CPUID 00000009: 00000000-00000000-00000000-00000000
CPUID 0000000A: 07300404-00000000-00000000-00000603
CPUID 0000000B: 00000001-00000002-00000100-00000005 [SL 00]
CPUID 0000000B: 00000004-00000008-00000201-00000005 [SL 01]
CPUID 0000000C: 00000000-00000000-00000000-00000000
CPUID 0000000D: 0000001F-00000440-00000440-00000000 [SL 00]
CPUID 0000000D: 0000000F-000003C0-00000100-00000000 [SL 01]
CPUID 0000000D: 00000100-00000240-00000000-00000000 [SL 02]
CPUID 0000000D: 00000040-000003C0-00000000-00000000 [SL 03]
CPUID 0000000D: 00000040-00000400-00000000-00000000 [SL 04]
CPUID 0000000E: 00000000-00000000-00000000-00000000
CPUID 0000000F: 00000000-00000000-00000000-00000000 [SL 00]
CPUID 0000000F: 00000000-00000000-00000000-00000000 [SL 01]
CPUID 00000010: 00000000-00000000-00000000-00000000 [SL 00]
CPUID 00000010: 00000000-00000000-00000000-00000000 [SL 01]
CPUID 00000011: 00000000-00000000-00000000-00000000
CPUID 00000012: 00000000-00000000-00000000-00000000 [SL 00]
CPUID 00000012: 00000000-00000000-00000000-00000000 [SL 01]
CPUID 00000013: 00000000-00000000-00000000-00000000
CPUID 00000014: 00000001-0000000F-00000007-00000000 [SL 00]
CPUID 00000014: 02490002-003F3FFF-00000000-00000000 [SL 01]
CPUID 00000015: 00000002-0000014E-00000000-00000000 [167.00x]
CPUID 00000016: 00000FA0-00001068-00000064-00000000
CPUID 80000000: 80000008-00000000-00000000-00000000
CPUID 80000001: 00000000-00000000-00000121-2C100000
CPUID 80000002: 65746E49-2952286C-726F4320-4D542865 [Intel(R) Core(TM]
CPUID 80000003: 37692029-3037362D-43204B30-40205550 [) i7-6700K CPU @]
CPUID 80000004: 302E3420-7A484730-00000000-00000000 [ 4.00GHz]
CPUID 80000005: 00000000-00000000-00000000-00000000
CPUID 80000006: 00000000-00000000-01006040-00000000
CPUID 80000007: 00000000-00000000-00000000-00000100
CPUID 80000008: 00003027-00000000-00000000-00000000

L1    Data Cache:    32 KB,  8-way Associative, 64-byte Line
L1  Instr. Cache:    32 KB,  8-way Associative, 64-byte Line
L2 Unified Cache:   256 KB,  4-way Associative, 64-byte Line
L3 Unified Cache:     8 MB, 16-way Associative, 64-byte Line

------[ Logical CPU #6 ]------

allcpu: Package 0 / Core 3 / Thread 0: Valid

CPUID 00000000: 00000016-756E6547-6C65746E-49656E69 [GenuineIntel]
CPUID 00000001: 000506E3-06100800-7FFAFBBF-BFEBFBFF
CPUID 00000002: 76036301-00F0B5FF-00000000-00C30000
CPUID 00000003: 00000000-00000000-00000000-00000000
CPUID 00000004: 1C004121-01C0003F-0000003F-00000000 [SL 00]
CPUID 00000004: 1C004122-01C0003F-0000003F-00000000 [SL 01]
CPUID 00000004: 1C004143-00C0003F-000003FF-00000000 [SL 02]
CPUID 00000004: 1C03C163-03C0003F-00001FFF-00000006 [SL 03]
CPUID 00000005: 00000040-00000040-00000003-00142120
CPUID 00000006: 000007F7-00000002-00000001-00000000
CPUID 00000007: 00000000-029C6FBB-00000000-00000000
CPUID 00000008: 00000000-00000000-00000000-00000000
CPUID 00000009: 00000000-00000000-00000000-00000000
CPUID 0000000A: 07300404-00000000-00000000-00000603
CPUID 0000000B: 00000001-00000002-00000100-00000006 [SL 00]
CPUID 0000000B: 00000004-00000008-00000201-00000006 [SL 01]
CPUID 0000000C: 00000000-00000000-00000000-00000000
CPUID 0000000D: 0000001F-00000440-00000440-00000000 [SL 00]
CPUID 0000000D: 0000000F-000003C0-00000100-00000000 [SL 01]
CPUID 0000000D: 00000100-00000240-00000000-00000000 [SL 02]
CPUID 0000000D: 00000040-000003C0-00000000-00000000 [SL 03]
CPUID 0000000D: 00000040-00000400-00000000-00000000 [SL 04]
CPUID 0000000E: 00000000-00000000-00000000-00000000
CPUID 0000000F: 00000000-00000000-00000000-00000000 [SL 00]
CPUID 0000000F: 00000000-00000000-00000000-00000000 [SL 01]
CPUID 00000010: 00000000-00000000-00000000-00000000 [SL 00]
CPUID 00000010: 00000000-00000000-00000000-00000000 [SL 01]
CPUID 00000011: 00000000-00000000-00000000-00000000
CPUID 00000012: 00000000-00000000-00000000-00000000 [SL 00]
CPUID 00000012: 00000000-00000000-00000000-00000000 [SL 01]
CPUID 00000013: 00000000-00000000-00000000-00000000
CPUID 00000014: 00000001-0000000F-00000007-00000000 [SL 00]
CPUID 00000014: 02490002-003F3FFF-00000000-00000000 [SL 01]
CPUID 00000015: 00000002-0000014E-00000000-00000000 [167.00x]
CPUID 00000016: 00000FA0-00001068-00000064-00000000
CPUID 80000000: 80000008-00000000-00000000-00000000
CPUID 80000001: 00000000-00000000-00000121-2C100000
CPUID 80000002: 65746E49-2952286C-726F4320-4D542865 [Intel(R) Core(TM]
CPUID 80000003: 37692029-3037362D-43204B30-40205550 [) i7-6700K CPU @]
CPUID 80000004: 302E3420-7A484730-00000000-00000000 [ 4.00GHz]
CPUID 80000005: 00000000-00000000-00000000-00000000
CPUID 80000006: 00000000-00000000-01006040-00000000
CPUID 80000007: 00000000-00000000-00000000-00000100
CPUID 80000008: 00003027-00000000-00000000-00000000

L1    Data Cache:    32 KB,  8-way Associative, 64-byte Line
L1  Instr. Cache:    32 KB,  8-way Associative, 64-byte Line
L2 Unified Cache:   256 KB,  4-way Associative, 64-byte Line
L3 Unified Cache:     8 MB, 16-way Associative, 64-byte Line

------[ Logical CPU #7 ]------

allcpu: Package 0 / Core 3 / Thread 1: Valid, Virtual

CPUID 00000000: 00000016-756E6547-6C65746E-49656E69 [GenuineIntel]
CPUID 00000001: 000506E3-07100800-7FFAFBBF-BFEBFBFF
CPUID 00000002: 76036301-00F0B5FF-00000000-00C30000
CPUID 00000003: 00000000-00000000-00000000-00000000
CPUID 00000004: 1C004121-01C0003F-0000003F-00000000 [SL 00]
CPUID 00000004: 1C004122-01C0003F-0000003F-00000000 [SL 01]
CPUID 00000004: 1C004143-00C0003F-000003FF-00000000 [SL 02]
CPUID 00000004: 1C03C163-03C0003F-00001FFF-00000006 [SL 03]
CPUID 00000005: 00000040-00000040-00000003-00142120
CPUID 00000006: 000007F7-00000002-00000001-00000000
CPUID 00000007: 00000000-029C6FBB-00000000-00000000
CPUID 00000008: 00000000-00000000-00000000-00000000
CPUID 00000009: 00000000-00000000-00000000-00000000
CPUID 0000000A: 07300404-00000000-00000000-00000603
CPUID 0000000B: 00000001-00000002-00000100-00000007 [SL 00]
CPUID 0000000B: 00000004-00000008-00000201-00000007 [SL 01]
CPUID 0000000C: 00000000-00000000-00000000-00000000
CPUID 0000000D: 0000001F-00000440-00000440-00000000 [SL 00]
CPUID 0000000D: 0000000F-000003C0-00000100-00000000 [SL 01]
CPUID 0000000D: 00000100-00000240-00000000-00000000 [SL 02]
CPUID 0000000D: 00000040-000003C0-00000000-00000000 [SL 03]
CPUID 0000000D: 00000040-00000400-00000000-00000000 [SL 04]
CPUID 0000000E: 00000000-00000000-00000000-00000000
CPUID 0000000F: 00000000-00000000-00000000-00000000 [SL 00]
CPUID 0000000F: 00000000-00000000-00000000-00000000 [SL 01]
CPUID 00000010: 00000000-00000000-00000000-00000000 [SL 00]
CPUID 00000010: 00000000-00000000-00000000-00000000 [SL 01]
CPUID 00000011: 00000000-00000000-00000000-00000000
CPUID 00000012: 00000000-00000000-00000000-00000000 [SL 00]
CPUID 00000012: 00000000-00000000-00000000-00000000 [SL 01]
CPUID 00000013: 00000000-00000000-00000000-00000000
CPUID 00000014: 00000001-0000000F-00000007-00000000 [SL 00]
CPUID 00000014: 02490002-003F3FFF-00000000-00000000 [SL 01]
CPUID 00000015: 00000002-0000014E-00000000-00000000 [167.00x]
CPUID 00000016: 00000FA0-00001068-00000064-00000000
CPUID 80000000: 80000008-00000000-00000000-00000000
CPUID 80000001: 00000000-00000000-00000121-2C100000
CPUID 80000002: 65746E49-2952286C-726F4320-4D542865 [Intel(R) Core(TM]
CPUID 80000003: 37692029-3037362D-43204B30-40205550 [) i7-6700K CPU @]
CPUID 80000004: 302E3420-7A484730-00000000-00000000 [ 4.00GHz]
CPUID 80000005: 00000000-00000000-00000000-00000000
CPUID 80000006: 00000000-00000000-01006040-00000000
CPUID 80000007: 00000000-00000000-00000000-00000100
CPUID 80000008: 00003027-00000000-00000000-00000000

L1    Data Cache:    32 KB,  8-way Associative, 64-byte Line
L1  Instr. Cache:    32 KB,  8-way Associative, 64-byte Line
L2 Unified Cache:   256 KB,  4-way Associative, 64-byte Line
L3 Unified Cache:     8 MB, 16-way Associative, 64-byte Line

------[ All CPUs ]------

CPU   0: APICID   0 / Package 0 / Core  0 / Thread 0: Valid
CPU   1: APICID   1 / Package 0 / Core  0 / Thread 1: Valid, Virtual
CPU   2: APICID   2 / Package 0 / Core  1 / Thread 0: Valid
CPU   3: APICID   3 / Package 0 / Core  1 / Thread 1: Valid, Virtual
CPU   4: APICID   4 / Package 0 / Core  2 / Thread 0: Valid
CPU   5: APICID   5 / Package 0 / Core  2 / Thread 1: Valid, Virtual
CPU   6: APICID   6 / Package 0 / Core  3 / Thread 0: Valid
CPU   7: APICID   7 / Package 0 / Core  3 / Thread 1: Valid, Virtual

------[ MSR Registers ]------

MSR 00000017: 0004-0000-0000-0000 [PlatID = 1]
MSR 0000001B: 0000-0000-FEE0-0900
MSR 00000035: 0000-0000-0004-0008
MSR 0000008B: 0000-0023-0000-0000
MSR 000000CE: 0008-0838-F101-2800 [eD = 0]
MSR 000000E7: 0000-0083-66DB-1D26 [S200]
MSR 000000E7: 0000-0083-6897-08DE [S200]
MSR 000000E7: 0000-0083-69B6-E1B2
MSR 000000E8: 0000-007E-3218-AB29 [S200]
MSR 000000E8: 0000-007E-3263-1AF9 [S200]
MSR 000000E8: 0000-007E-32A4-592E
MSR 00000194: 0000-0000-000F-0000
MSR 00000198: 0000-17E5-0000-0800 [S200]
MSR 00000198: 0000-185A-0000-0800 [S200]
MSR 00000198: 0000-17F7-0000-0800
MSR 00000199: 0000-0000-0000-0800
MSR 0000019A: 0000-0000-0000-0000
MSR 0000019B: 0000-0000-0000-0000
MSR 0000019C: 0000-0000-8847-0000 [S200]
MSR 0000019C: 0000-0000-8847-0000 [S200]
MSR 0000019C: 0000-0000-8848-0000
MSR 0000019D: 0000-0000-0000-0000
MSR 000001A0: 0000-0000-0085-0089
MSR 000001A2: 0000-0000-0064-1400
MSR 000001A4: 0000-0000-0000-0000
MSR 000001AA: 0000-0000-0000-18C0
MSR 000001AC: < FAILED >
MSR 000001AD: 0000-0000-2828-282A
MSR 000001B0: < FAILED >
MSR 000001B1: 0000-0000-8844-0000
MSR 000001B2: 0000-0000-0000-0000
MSR 000001FC: 0000-0000-0038-005F
MSR 00000300: < FAILED >
MSR 0000030A: 0000-0000-0000-0000 [S200]
MSR 0000030A: 0000-0000-0000-0000 [S200]
MSR 0000030A: 0000-0000-0000-0000
MSR 0000030B: 0000-0000-0000-0000 [S200]
MSR 0000030B: 0000-0000-0000-0000 [S200]
MSR 0000030B: 0000-0000-0000-0000
MSR 00000480: 00DA-0400-0000-0004
MSR 00000481: 0000-007F-0000-0016
MSR 00000482: FFF9-FFFE-0401-E172
MSR 00000483: 01FF-FFFF-0003-6DFF
MSR 00000484: 0003-FFFF-0000-11FF
MSR 00000485: 0000-0000-7004-C1E7
MSR 00000486: 0000-0000-8000-0021
MSR 00000487: 0000-0000-FFFF-FFFF
MSR 00000488: 0000-0000-0000-2000
MSR 00000489: 0000-0000-0037-27FF
MSR 0000048A: 0000-0000-0000-002E
MSR 0000048B: 001F-7CFF-0000-0000
MSR 0000048C: 0000-0F01-0633-4141
MSR 0000048D: 0000-007F-0000-0016
MSR 0000048E: FFF9-FFFE-0400-6172
MSR 0000048F: 01FF-FFFF-0003-6DFB
MSR 00000490: 0003-FFFF-0000-11FB
MSR 00000601: 0000-0000-0000-0000
MSR 00000602: < FAILED >
MSR 00000603: 0036-0000-0036-3636
MSR 00000604: < FAILED >
MSR 00000606: 0000-0000-000A-0E03
MSR 0000060A: 0000-0000-0000-884E
MSR 0000060B: 0000-0000-0000-8876
MSR 0000060C: 0000-0000-0000-8894
MSR 0000060D: 0000-003C-DC7A-C4E8
MSR 00000610: 0042-FFD0-001A-EA82
MSR 00000611: 0000-0000-070D-DE88 [S200]
MSR 00000611: 0000-0000-070D-FB68 [S200]
MSR 00000611: 0000-0000-070E-180E
MSR 00000613: 0000-0000-0000-0000
MSR 00000614: 0000-0000-0000-02F8
MSR 00000618: 0014-8FFA-0014-8FFA
MSR 00000619: 0000-0000-009D-B1EE [S200]
MSR 00000619: 0000-0000-009D-C912 [S200]
MSR 00000619: 0000-0000-009D-E047
MSR 0000061B: 0000-0000-0000-0000
MSR 0000061C: < FAILED >
MSR 0000061E: < FAILED >
MSR 00000620: 0000-0000-0000-0828
MSR 00000621: 0000-0000-0000-0008
MSR 00000638: 0000-0000-0000-0000
MSR 00000639: 0000-0000-0689-C46A [S200]
MSR 00000639: 0000-0000-0689-C7FD [S200]
MSR 00000639: 0000-0000-0689-CC27
MSR 0000063A: 0000-0000-0000-0009
MSR 0000063B: < FAILED >
MSR 00000640: 0000-0000-0000-0000
MSR 00000641: 0000-0000-0001-CF47 [S200]
MSR 00000641: 0000-0000-0001-CF47 [S200]
MSR 00000641: 0000-0000-0001-CF47
MSR 00000642: 0000-0000-0000-000D
MSR 00000648: 0000-0000-0000-0028
MSR 00000649: 0000-0000-0000-0000
MSR 0000064A: 0000-0000-0000-0000
MSR 0000064B: 0000-0000-8000-0000
MSR 0000064C: 0000-0000-0000-0000
MSR 00000690: 0000-0000-0000-0000
MSR 000006B0: 0000-0000-0000-0000
MSR 000006B1: 0000-0000-0000-0000

PerformanceFrequency = 3914055

CPU Clock M.Method = 9  (APIC SKL)
PM Timer Address   = 6152  (1808h)

APIC Clock = 99.95 MHz  (AT = 12577 / TT = 15005 / try = 1 / SKL = 24.00 MHz)
APIC Clock = 100.00 MHz  (AT = 12576 / TT = 15003 / try = 1 / SKL = 24.00 MHz)
APIC Clock = 100.00 MHz  (AT = 12575 / TT = 15005 / try = 1 / SKL = 24.00 MHz)
APIC Clock = 99.98 MHz  (AT = 12576 / TT = 15005 / try = 1 / SKL = 24.00 MHz)
APIC Clock = 100.00 MHz  (AT = 12578 / TT = 15007 / try = 1 / SKL = 24.00 MHz)

INTPERFCTR2 = 797.33 MHz / INTPERFCTR1 (TSC) = 3994.62 MHz
INTPERFCTR2 = 1700.00 MHz / INTPERFCTR1 (TSC) = 4008.00 MHz
INTPERFCTR2 = 800.00 MHz / INTPERFCTR1 (TSC) = 4008.01 MHz
INTPERFCTR2 = 800.00 MHz / INTPERFCTR1 (TSC) = 4008.02 MHz
INTPERFCTR2 = 800.00 MHz / INTPERFCTR1 (TSC) = 4008.00 MHz

------[ OC MailBox ]------

C 01 / P1 00 / P2 00: 00000753
C 01 / P1 01 / P2 00: 0000073C
C 01 / P1 02 / P2 00: 00000753
C 01 / P1 03 / P2 00: 0000073C
C 02 / P1 00 / P2 00: 53535353
C 02 / P1 00 / P2 01: < FAILED >
C 05 / P1 00 / P2 00: 0001866F
C 10 / P1 00 / P2 00: 0000002A
C 10 / P1 01 / P2 00: 00000000
C 10 / P1 02 / P2 00: 00000028
C 10 / P1 03 / P2 00: 00000000
C 12 / P1 00 / P2 00: 00000000
C 14 / P1 00 / P2 00: 00000000

------[ APIC Base at 00000000-FEE00000 ]------

  0000  00 00 00 00 00 00 00 00 00 00 00 00 00 00 00 00 
  0010  00 00 00 00 00 00 00 00 00 00 00 00 00 00 00 00 
  0020  00 00 00 00 00 00 00 00 00 00 00 00 00 00 00 00 
  0030  15 00 06 01 00 00 00 00 00 00 00 00 00 00 00 00 
  0040  00 00 00 00 00 00 00 00 00 00 00 00 00 00 00 00 
  0050  00 00 00 00 00 00 00 00 00 00 00 00 00 00 00 00 
  0060  00 00 00 00 00 00 00 00 00 00 00 00 00 00 00 00 
  0070  00 00 00 00 00 00 00 00 00 00 00 00 00 00 00 00 
  0080  00 00 00 00 00 00 00 00 00 00 00 00 00 00 00 00 
  0090  00 00 00 00 00 00 00 00 00 00 00 00 00 00 00 00 
  00A0  00 00 00 00 00 00 00 00 00 00 00 00 00 00 00 00 
  00B0  00 00 00 00 00 00 00 00 00 00 00 00 00 00 00 00 
  00C0  00 00 00 00 00 00 00 00 00 00 00 00 00 00 00 00 
  00D0  00 00 00 01 00 00 00 00 00 00 00 00 00 00 00 00 
  00E0  FF FF FF FF 00 00 00 00 00 00 00 00 00 00 00 00 
  00F0  DF 01 00 00 00 00 00 00 00 00 00 00 00 00 00 00 
  0100  00 00 00 00 00 00 00 00 00 00 00 00 00 00 00 00 
  0110  00 00 00 00 00 00 00 00 00 00 00 00 00 00 00 00 
  0120  00 00 00 00 00 00 00 00 00 00 00 00 00 00 00 00 
  0130  00 00 00 00 00 00 00 00 00 00 00 00 00 00 00 00 
  0140  00 00 00 00 00 00 00 00 00 00 00 00 00 00 00 00 
  0150  00 00 00 00 00 00 00 00 00 00 00 00 00 00 00 00 
  0160  00 00 00 00 00 00 00 00 00 00 00 00 00 00 00 00 
  0170  00 00 00 00 00 00 00 00 00 00 00 00 00 00 00 00 
  0180  00 00 00 00 00 00 00 00 00 00 00 00 00 00 00 00 
  0190  00 00 00 00 00 00 00 00 00 00 00 00 00 00 00 00 
  01A0  00 00 00 00 00 00 00 00 00 00 00 00 00 00 00 00 
  01B0  00 00 00 00 00 00 00 00 00 00 00 00 00 00 00 00 
  01C0  00 00 04 00 00 00 00 00 00 00 00 00 00 00 00 00 
  01D0  00 00 00 00 00 00 00 00 00 00 00 00 00 00 00 00 
  01E0  00 00 00 00 00 00 00 00 00 00 00 00 00 00 00 00 
  01F0  00 00 00 00 00 00 00 00 00 00 00 00 00 00 00 00 
  0200  00 00 00 00 00 00 00 00 00 00 00 00 00 00 00 00 
  0210  00 00 00 00 00 00 00 00 00 00 00 00 00 00 00 00 
  0220  00 00 00 00 00 00 00 00 00 00 00 00 00 00 00 00 
  0230  00 00 00 00 00 00 00 00 00 00 00 00 00 00 00 00 
  0240  00 00 00 00 00 00 00 00 00 00 00 00 00 00 00 00 
  0250  00 00 00 00 00 00 00 00 00 00 00 00 00 00 00 00 
  0260  00 00 00 00 00 00 00 00 00 00 00 00 00 00 00 00 
  0270  00 00 00 00 00 00 00 00 00 00 00 00 00 00 00 00 
  0280  00 00 00 00 00 00 00 00 00 00 00 00 00 00 00 00 
  0290  00 00 00 00 00 00 00 00 00 00 00 00 00 00 00 00 
  02A0  00 00 00 00 00 00 00 00 00 00 00 00 00 00 00 00 
  02B0  00 00 00 00 00 00 00 00 00 00 00 00 00 00 00 00 
  02C0  00 00 00 00 00 00 00 00 00 00 00 00 00 00 00 00 
  02D0  00 00 00 00 00 00 00 00 00 00 00 00 00 00 00 00 
  02E0  00 00 00 00 00 00 00 00 00 00 00 00 00 00 00 00 
  02F0  35 00 00 00 00 00 00 00 00 00 00 00 00 00 00 00 
  0300  2F 08 00 00 00 00 00 00 00 00 00 00 00 00 00 00 
  0310  00 00 00 08 00 00 00 00 00 00 00 00 00 00 00 00 
  0320  D1 00 03 00 00 00 00 00 00 00 00 00 00 00 00 00 
  0330  00 00 01 00 00 00 00 00 00 00 00 00 00 00 00 00 
  0340  FE 00 00 00 00 00 00 00 00 00 00 00 00 00 00 00 
  0350  D8 00 01 00 00 00 00 00 00 00 00 00 00 00 00 00 
  0360  00 04 00 00 00 00 00 00 00 00 00 00 00 00 00 00 
  0370  E2 00 00 00 00 00 00 00 00 00 00 00 00 00 00 00 
  0380  00 00 00 00 00 00 00 00 00 00 00 00 00 00 00 00 
  0390  00 00 00 00 00 00 00 00 00 00 00 00 00 00 00 00 
  03A0  00 00 00 00 00 00 00 00 00 00 00 00 00 00 00 00 
  03B0  00 00 00 00 00 00 00 00 00 00 00 00 00 00 00 00 
  03C0  00 00 00 00 00 00 00 00 00 00 00 00 00 00 00 00 
  03D0  00 00 00 00 00 00 00 00 00 00 00 00 00 00 00 00 
  03E0  0A 00 00 00 00 00 00 00 00 00 00 00 00 00 00 00 
  03F0  00 00 00 00 00 00 00 00 00 00 00 00 00 00 00 00 
