------[ Versions ]------

Program Version : AIDA64 v1.20.1183 Beta
BenchDLL Version: 2.7.333-x64

------[ CPU Info ]------

CPU Type           : QuadCore Intel Core i5 2400, 3100 MHz (31 x 100)
CPU Alias          : Sandy Bridge
CPU Platform       : LGA1155
CPU Stepping       : D2
Instruction Set    : x86, x86-64, MMX, SSE, SSE2, SSE3, SSSE3, SSE4.1, SSE4.2, AES, AVX
CPUID Manufacturer : GenuineIntel
CPUID CPU Name     : Intel(R) Core(TM) i5-2400 CPU @ 3.10GHz
CPUID Revision     : 000206A7h
IA Brand ID        : 00h  (Unknown)
Platform ID        : 2Ch  (LGA1155)

------[ Logical CPU #0 ]------

allcpu: Package 0 / Core 0 / Thread 0: Valid

CPUID 00000000: 0000000D-756E6547-6C65746E-49656E69
CPUID 00000001: 000206A7-00100800-1FBAE3FF-BFEBFBFF
CPUID 00000002: 76035A01-00F0B0FF-00000000-00CA0000
CPUID 00000003: 00000000-00000000-00000000-00000000
CPUID 00000004: 1C004121-01C0003F-0000003F-00000000
CPUID 00000004: 1C004122-01C0003F-0000003F-00000000
CPUID 00000004: 1C004143-01C0003F-000001FF-00000000
CPUID 00000004: 1C03C163-02C0003F-00001FFF-00000006
CPUID 00000005: 00000040-00000040-00000003-00001120
CPUID 00000006: 00000075-00000002-00000009-00000000
CPUID 00000007: 00000000-00000000-00000000-00000000
CPUID 00000008: 00000000-00000000-00000000-00000000
CPUID 00000009: 00000000-00000000-00000000-00000000
CPUID 0000000A: 07300803-00000000-00000000-00000603
CPUID 0000000B: 00000001-00000001-00000100-00000000
CPUID 0000000B: 00000004-00000004-00000201-00000000
CPUID 0000000C: 00000000-00000000-00000000-00000000
CPUID 0000000D: 00000007-00000340-00000340-00000000
CPUID 0000000D: 00000100-00000240-00000000-00000000
CPUID 80000000: 80000008-00000000-00000000-00000000
CPUID 80000001: 00000000-00000000-00000001-28100000
CPUID 80000002: 20202020-20202020-65746E49-2952286C
CPUID 80000003: 726F4320-4D542865-35692029-3034322D
CPUID 80000004: 50432030-20402055-30312E33-007A4847
CPUID 80000005: 00000000-00000000-00000000-00000000
CPUID 80000006: 00000000-00000000-01006040-00000000
CPUID 80000007: 00000000-00000000-00000000-00000100
CPUID 80000008: 00003024-00000000-00000000-00000000

L1    Data Cache:     32 KB,  8-way Associative, 64-byte Line
L1  Instr. Cache:     32 KB,  8-way Associative, 64-byte Line
L2 Unified Cache:    256 KB,  8-way Associative, 64-byte Line
L3 Unified Cache:   6144 KB, 12-way Associative, 64-byte Line

------[ Logical CPU #1 ]------

allcpu: Package 0 / Core 1 / Thread 0: Valid

CPUID 00000000: 0000000D-756E6547-6C65746E-49656E69
CPUID 00000001: 000206A7-02100800-1FBAE3FF-BFEBFBFF
CPUID 00000002: 76035A01-00F0B0FF-00000000-00CA0000
CPUID 00000003: 00000000-00000000-00000000-00000000
CPUID 00000004: 1C004121-01C0003F-0000003F-00000000
CPUID 00000004: 1C004122-01C0003F-0000003F-00000000
CPUID 00000004: 1C004143-01C0003F-000001FF-00000000
CPUID 00000004: 1C03C163-02C0003F-00001FFF-00000006
CPUID 00000005: 00000040-00000040-00000003-00001120
CPUID 00000006: 00000075-00000002-00000009-00000000
CPUID 00000007: 00000000-00000000-00000000-00000000
CPUID 00000008: 00000000-00000000-00000000-00000000
CPUID 00000009: 00000000-00000000-00000000-00000000
CPUID 0000000A: 07300803-00000000-00000000-00000603
CPUID 0000000B: 00000001-00000001-00000100-00000002
CPUID 0000000B: 00000004-00000004-00000201-00000002
CPUID 0000000C: 00000000-00000000-00000000-00000000
CPUID 0000000D: 00000007-00000340-00000340-00000000
CPUID 0000000D: 00000100-00000240-00000000-00000000
CPUID 80000000: 80000008-00000000-00000000-00000000
CPUID 80000001: 00000000-00000000-00000001-28100000
CPUID 80000002: 20202020-20202020-65746E49-2952286C
CPUID 80000003: 726F4320-4D542865-35692029-3034322D
CPUID 80000004: 50432030-20402055-30312E33-007A4847
CPUID 80000005: 00000000-00000000-00000000-00000000
CPUID 80000006: 00000000-00000000-01006040-00000000
CPUID 80000007: 00000000-00000000-00000000-00000100
CPUID 80000008: 00003024-00000000-00000000-00000000

L1    Data Cache:     32 KB,  8-way Associative, 64-byte Line
L1  Instr. Cache:     32 KB,  8-way Associative, 64-byte Line
L2 Unified Cache:    256 KB,  8-way Associative, 64-byte Line
L3 Unified Cache:   6144 KB, 12-way Associative, 64-byte Line

------[ Logical CPU #2 ]------

allcpu: Package 0 / Core 2 / Thread 0: Valid

CPUID 00000000: 0000000D-756E6547-6C65746E-49656E69
CPUID 00000001: 000206A7-04100800-1FBAE3FF-BFEBFBFF
CPUID 00000002: 76035A01-00F0B0FF-00000000-00CA0000
CPUID 00000003: 00000000-00000000-00000000-00000000
CPUID 00000004: 1C004121-01C0003F-0000003F-00000000
CPUID 00000004: 1C004122-01C0003F-0000003F-00000000
CPUID 00000004: 1C004143-01C0003F-000001FF-00000000
CPUID 00000004: 1C03C163-02C0003F-00001FFF-00000006
CPUID 00000005: 00000040-00000040-00000003-00001120
CPUID 00000006: 00000075-00000002-00000009-00000000
CPUID 00000007: 00000000-00000000-00000000-00000000
CPUID 00000008: 00000000-00000000-00000000-00000000
CPUID 00000009: 00000000-00000000-00000000-00000000
CPUID 0000000A: 07300803-00000000-00000000-00000603
CPUID 0000000B: 00000001-00000001-00000100-00000004
CPUID 0000000B: 00000004-00000004-00000201-00000004
CPUID 0000000C: 00000000-00000000-00000000-00000000
CPUID 0000000D: 00000007-00000340-00000340-00000000
CPUID 0000000D: 00000100-00000240-00000000-00000000
CPUID 80000000: 80000008-00000000-00000000-00000000
CPUID 80000001: 00000000-00000000-00000001-28100000
CPUID 80000002: 20202020-20202020-65746E49-2952286C
CPUID 80000003: 726F4320-4D542865-35692029-3034322D
CPUID 80000004: 50432030-20402055-30312E33-007A4847
CPUID 80000005: 00000000-00000000-00000000-00000000
CPUID 80000006: 00000000-00000000-01006040-00000000
CPUID 80000007: 00000000-00000000-00000000-00000100
CPUID 80000008: 00003024-00000000-00000000-00000000

L1    Data Cache:     32 KB,  8-way Associative, 64-byte Line
L1  Instr. Cache:     32 KB,  8-way Associative, 64-byte Line
L2 Unified Cache:    256 KB,  8-way Associative, 64-byte Line
L3 Unified Cache:   6144 KB, 12-way Associative, 64-byte Line

------[ Logical CPU #3 ]------

allcpu: Package 0 / Core 3 / Thread 0: Valid

CPUID 00000000: 0000000D-756E6547-6C65746E-49656E69
CPUID 00000001: 000206A7-06100800-1FBAE3FF-BFEBFBFF
CPUID 00000002: 76035A01-00F0B0FF-00000000-00CA0000
CPUID 00000003: 00000000-00000000-00000000-00000000
CPUID 00000004: 1C004121-01C0003F-0000003F-00000000
CPUID 00000004: 1C004122-01C0003F-0000003F-00000000
CPUID 00000004: 1C004143-01C0003F-000001FF-00000000
CPUID 00000004: 1C03C163-02C0003F-00001FFF-00000006
CPUID 00000005: 00000040-00000040-00000003-00001120
CPUID 00000006: 00000075-00000002-00000009-00000000
CPUID 00000007: 00000000-00000000-00000000-00000000
CPUID 00000008: 00000000-00000000-00000000-00000000
CPUID 00000009: 00000000-00000000-00000000-00000000
CPUID 0000000A: 07300803-00000000-00000000-00000603
CPUID 0000000B: 00000001-00000001-00000100-00000006
CPUID 0000000B: 00000004-00000004-00000201-00000006
CPUID 0000000C: 00000000-00000000-00000000-00000000
CPUID 0000000D: 00000007-00000340-00000340-00000000
CPUID 0000000D: 00000100-00000240-00000000-00000000
CPUID 80000000: 80000008-00000000-00000000-00000000
CPUID 80000001: 00000000-00000000-00000001-28100000
CPUID 80000002: 20202020-20202020-65746E49-2952286C
CPUID 80000003: 726F4320-4D542865-35692029-3034322D
CPUID 80000004: 50432030-20402055-30312E33-007A4847
CPUID 80000005: 00000000-00000000-00000000-00000000
CPUID 80000006: 00000000-00000000-01006040-00000000
CPUID 80000007: 00000000-00000000-00000000-00000100
CPUID 80000008: 00003024-00000000-00000000-00000000

L1    Data Cache:     32 KB,  8-way Associative, 64-byte Line
L1  Instr. Cache:     32 KB,  8-way Associative, 64-byte Line
L2 Unified Cache:    256 KB,  8-way Associative, 64-byte Line
L3 Unified Cache:   6144 KB, 12-way Associative, 64-byte Line

------[ All CPUs ]------

CPU   0: APICID   0 / Package 0 / Core  0 / Thread 0: Valid
CPU   1: APICID   2 / Package 0 / Core  1 / Thread 0: Valid
CPU   2: APICID   4 / Package 0 / Core  2 / Thread 0: Valid
CPU   3: APICID   6 / Package 0 / Core  3 / Thread 0: Valid

------[ MSR Registers ]------

MSR 00000017: 0004-0000-0000-0000 [PlatID = 1]
MSR 0000001B: 0000-0000-FEE0-0900
MSR 00000035: 0000-0000-0004-0004
MSR 0000008B: 0000-0006-0000-0000
MSR 000000CE: 0000-1000-7801-1F00
MSR 000000E7: 0000-004A-FB06-46CD
MSR 000000E8: 0000-0049-71AF-3D67
MSR 00000194: 0000-0000-0009-1F00
MSR 00000198: 0000-2808-0000-1F00
MSR 00000199: 0000-0000-0000-1F00
MSR 0000019A: 0000-0000-0000-0002
MSR 0000019B: 0000-0000-0000-0010
MSR 0000019C: 0000-0000-8832-0000
MSR 0000019D: 0000-0000-0000-0000
MSR 000001A0: 0000-0040-0084-0089
MSR 000001A2: 0000-0000-0063-1400
MSR 000001A4: 0000-0000-0000-0000
MSR 000001AA: 0000-0000-0040-0000
MSR 000001AD: 0000-0000-2021-2122
MSR 000001FC: 0000-0000-0004-005F

PerformanceFrequency = 3020566

Tjmax Temperature = 99 Celsius
