------[ Logical CPU #0 ]------

allcpu: Package 0 / Core 0 / Thread 0: Valid

CPUID 00000000: 0000000B-756E6547-6C65746E-49656E69 [GenuineIntel]
CPUID 00000001: 000406C3-00100800-43D8E3BF-BFEBFBFF
CPUID 00000002: 61B4A001-0000FFC2-00000000-00000000
CPUID 00000003: 00000000-00000000-00000000-00000000
CPUID 00000004: 1C000121-0140003F-0000003F-00000001 [SL 00]
CPUID 00000004: 1C000122-01C0003F-0000003F-00000001 [SL 01]
CPUID 00000004: 1C00C143-03C0003F-000003FF-00000001 [SL 02]
CPUID 00000005: 00000040-00000040-00000003-33000020
CPUID 00000006: 00000007-00000002-00000009-00000000
CPUID 00000007: 00000000-00002282-00000000-00000000
CPUID 00000008: 00000000-00000000-00000000-00000000
CPUID 00000009: 00000000-00000000-00000000-00000000
CPUID 0000000A: 07280203-00000000-00000000-00000503
CPUID 0000000B: 00000001-00000001-00000100-00000000 [SL 00]
CPUID 0000000B: 00000004-00000004-00000201-00000000 [SL 01]
CPUID 80000000: 80000008-00000000-00000000-00000000
CPUID 80000001: 00000000-00000000-00000101-28100000
CPUID 80000002: 20202020-6E492020-286C6574-41202952 [      Intel(R) A]
CPUID 80000003: 286D6F74-20294D54-5A2D3778-30303738 [tom(TM) x7-Z8700]
CPUID 80000004: 50432020-20402055-30362E31-007A4847 [  CPU @ 1.60GHz]
CPUID 80000005: 00000000-00000000-00000000-00000000
CPUID 80000006: 00000000-00000000-04008040-00000000
CPUID 80000007: 00000000-00000000-00000000-00000100
CPUID 80000008: 00003024-00000000-00000000-00000000

L1    Data Cache:    24 KB,  6-way Associative, 64-byte Line
L1  Instr. Cache:    32 KB,  8-way Associative, 64-byte Line
L2 Unified Cache:     1 MB, 16-way Associative, 64-byte Line

------[ Logical CPU #1 ]------

allcpu: Package 0 / Core 1 / Thread 0: Valid

CPUID 00000000: 0000000B-756E6547-6C65746E-49656E69 [GenuineIntel]
CPUID 00000001: 000406C3-02100800-43D8E3BF-BFEBFBFF
CPUID 00000002: 61B4A001-0000FFC2-00000000-00000000
CPUID 00000003: 00000000-00000000-00000000-00000000
CPUID 00000004: 1C000121-0140003F-0000003F-00000001 [SL 00]
CPUID 00000004: 1C000122-01C0003F-0000003F-00000001 [SL 01]
CPUID 00000004: 1C00C143-03C0003F-000003FF-00000001 [SL 02]
CPUID 00000005: 00000040-00000040-00000003-33000020
CPUID 00000006: 00000007-00000002-00000009-00000000
CPUID 00000007: 00000000-00002282-00000000-00000000
CPUID 00000008: 00000000-00000000-00000000-00000000
CPUID 00000009: 00000000-00000000-00000000-00000000
CPUID 0000000A: 07280203-00000000-00000000-00000503
CPUID 0000000B: 00000001-00000001-00000100-00000002 [SL 00]
CPUID 0000000B: 00000004-00000004-00000201-00000002 [SL 01]
CPUID 80000000: 80000008-00000000-00000000-00000000
CPUID 80000001: 00000000-00000000-00000101-28100000
CPUID 80000002: 20202020-6E492020-286C6574-41202952 [      Intel(R) A]
CPUID 80000003: 286D6F74-20294D54-5A2D3778-30303738 [tom(TM) x7-Z8700]
CPUID 80000004: 50432020-20402055-30362E31-007A4847 [  CPU @ 1.60GHz]
CPUID 80000005: 00000000-00000000-00000000-00000000
CPUID 80000006: 00000000-00000000-04008040-00000000
CPUID 80000007: 00000000-00000000-00000000-00000100
CPUID 80000008: 00003024-00000000-00000000-00000000

L1    Data Cache:    24 KB,  6-way Associative, 64-byte Line
L1  Instr. Cache:    32 KB,  8-way Associative, 64-byte Line
L2 Unified Cache:     1 MB, 16-way Associative, 64-byte Line

------[ Logical CPU #2 ]------

allcpu: Package 0 / Core 2 / Thread 0: Valid

CPUID 00000000: 0000000B-756E6547-6C65746E-49656E69 [GenuineIntel]
CPUID 00000001: 000406C3-04100800-43D8E3BF-BFEBFBFF
CPUID 00000002: 61B4A001-0000FFC2-00000000-00000000
CPUID 00000003: 00000000-00000000-00000000-00000000
CPUID 00000004: 1C000121-0140003F-0000003F-00000001 [SL 00]
CPUID 00000004: 1C000122-01C0003F-0000003F-00000001 [SL 01]
CPUID 00000004: 1C00C143-03C0003F-000003FF-00000001 [SL 02]
CPUID 00000005: 00000040-00000040-00000003-33000020
CPUID 00000006: 00000007-00000002-00000009-00000000
CPUID 00000007: 00000000-00002282-00000000-00000000
CPUID 00000008: 00000000-00000000-00000000-00000000
CPUID 00000009: 00000000-00000000-00000000-00000000
CPUID 0000000A: 07280203-00000000-00000000-00000503
CPUID 0000000B: 00000001-00000001-00000100-00000004 [SL 00]
CPUID 0000000B: 00000004-00000004-00000201-00000004 [SL 01]
CPUID 80000000: 80000008-00000000-00000000-00000000
CPUID 80000001: 00000000-00000000-00000101-28100000
CPUID 80000002: 20202020-6E492020-286C6574-41202952 [      Intel(R) A]
CPUID 80000003: 286D6F74-20294D54-5A2D3778-30303738 [tom(TM) x7-Z8700]
CPUID 80000004: 50432020-20402055-30362E31-007A4847 [  CPU @ 1.60GHz]
CPUID 80000005: 00000000-00000000-00000000-00000000
CPUID 80000006: 00000000-00000000-04008040-00000000
CPUID 80000007: 00000000-00000000-00000000-00000100
CPUID 80000008: 00003024-00000000-00000000-00000000

L1    Data Cache:    24 KB,  6-way Associative, 64-byte Line
L1  Instr. Cache:    32 KB,  8-way Associative, 64-byte Line
L2 Unified Cache:     1 MB, 16-way Associative, 64-byte Line

------[ Logical CPU #3 ]------

allcpu: Package 0 / Core 3 / Thread 0: Valid

CPUID 00000000: 0000000B-756E6547-6C65746E-49656E69 [GenuineIntel]
CPUID 00000001: 000406C3-06100800-43D8E3BF-BFEBFBFF
CPUID 00000002: 61B4A001-0000FFC2-00000000-00000000
CPUID 00000003: 00000000-00000000-00000000-00000000
CPUID 00000004: 1C000121-0140003F-0000003F-00000001 [SL 00]
CPUID 00000004: 1C000122-01C0003F-0000003F-00000001 [SL 01]
CPUID 00000004: 1C00C143-03C0003F-000003FF-00000001 [SL 02]
CPUID 00000005: 00000040-00000040-00000003-33000020
CPUID 00000006: 00000007-00000002-00000009-00000000
CPUID 00000007: 00000000-00002282-00000000-00000000
CPUID 00000008: 00000000-00000000-00000000-00000000
CPUID 00000009: 00000000-00000000-00000000-00000000
CPUID 0000000A: 07280203-00000000-00000000-00000503
CPUID 0000000B: 00000001-00000001-00000100-00000006 [SL 00]
CPUID 0000000B: 00000004-00000004-00000201-00000006 [SL 01]
CPUID 80000000: 80000008-00000000-00000000-00000000
CPUID 80000001: 00000000-00000000-00000101-28100000
CPUID 80000002: 20202020-6E492020-286C6574-41202952 [      Intel(R) A]
CPUID 80000003: 286D6F74-20294D54-5A2D3778-30303738 [tom(TM) x7-Z8700]
CPUID 80000004: 50432020-20402055-30362E31-007A4847 [  CPU @ 1.60GHz]
CPUID 80000005: 00000000-00000000-00000000-00000000
CPUID 80000006: 00000000-00000000-04008040-00000000
CPUID 80000007: 00000000-00000000-00000000-00000100
CPUID 80000008: 00003024-00000000-00000000-00000000

L1    Data Cache:    24 KB,  6-way Associative, 64-byte Line
L1  Instr. Cache:    32 KB,  8-way Associative, 64-byte Line
L2 Unified Cache:     1 MB, 16-way Associative, 64-byte Line

------[ All CPUs ]------

CPU   0: APICID   0 / Package 0 / Core  0 / Thread 0: Valid
CPU   1: APICID   2 / Package 0 / Core  1 / Thread 0: Valid
CPU   2: APICID   4 / Package 0 / Core  2 / Thread 0: Valid
CPU   3: APICID   6 / Package 0 / Core  3 / Thread 0: Valid

------[ MSR Registers ]------

MSR 00000017: 0000-00F0-9004-1E5A [PlatID = 0]
MSR 0000001B: 0000-0000-FEE0-0900
MSR 0000002A: 0000-0000-4008-0000
MSR 00000035: < FAILED >
MSR 0000008B: 0000-0336-0000-0000
MSR 000000CD: 0000-0000-0000-0004
MSR 000000CE: 0000-0600-0600-1400 [eD = 0]
MSR 000000E7: 0000-0000-0009-3C10 [S200]
MSR 000000E7: 0000-0000-0002-76DC [S200]
MSR 000000E7: 0000-0000-0002-1304
MSR 000000E8: 0000-0000-0000-E8EC [S200]
MSR 000000E8: 0000-0000-0001-1238 [S200]
MSR 000000E8: 0000-0000-0002-C880
MSR 000000EE: 0000-0000-0238-0002
MSR 0000011E: 0000-0000-7E28-010F
MSR 00000194: 0000-0000-0000-0000
MSR 00000198: 0000-7A00-0000-062D [S200]
MSR 00000198: 0000-7A00-0000-062D [S200]
MSR 00000198: 0000-7A00-0000-062D
MSR 00000199: 0000-0000-0000-062D
MSR 0000019A: 0000-0000-0000-0000
MSR 0000019B: 0000-0000-0000-0000
MSR 0000019C: 0000-0000-8836-0000 [S200]
MSR 0000019C: 0000-0000-8836-0000 [S200]
MSR 0000019C: 0000-0000-8836-0000
MSR 0000019D: 0000-0000-0000-062D
MSR 000001A0: 0000-0000-0085-0089
MSR 000001A2: 0000-0000-035A-0000
MSR 000001A4: < FAILED >
MSR 000001AA: < FAILED >
MSR 000001AC: < FAILED >
MSR 000001AD: 0000-0000-0000-0000
MSR 000001B0: 0000-0000-0000-0006
MSR 000001B1: < FAILED >
MSR 000001B2: < FAILED >
MSR 000001FC: 0000-0000-0000-0000
MSR 00000300: < FAILED >
MSR 00000480: 00DA-0400-0000-0002
MSR 00000481: 0000-007F-0000-0016
MSR 00000482: FFF9-FFFE-0401-E172
MSR 00000483: 007F-FFFF-0003-6DFF
MSR 00000484: 0000-FFFF-0000-11FF
MSR 00000485: 0000-0000-0004-81E6
MSR 00000486: 0000-0000-8000-0021
MSR 00000487: 0000-0000-FFFF-FFFF
MSR 00000488: 0000-0000-0000-2000
MSR 00000489: 0000-0000-0010-27FF
MSR 0000048A: 0000-0000-0000-002E
MSR 0000048B: 0000-28EF-0000-0000
MSR 0000048C: 0000-0F01-0611-4141
MSR 0000048D: 0000-007F-0000-0016
MSR 0000048E: FFF9-FFFE-0400-6172
MSR 0000048F: 007F-FFFF-0003-6DFB
MSR 00000490: 0000-FFFF-0000-11FB
MSR 00000601: 0000-0000-0000-0000
MSR 00000602: < FAILED >
MSR 00000603: < FAILED >
MSR 00000604: < FAILED >
MSR 00000606: 0000-0000-0000-0505
MSR 0000060A: < FAILED >
MSR 0000060B: < FAILED >
MSR 0000060C: < FAILED >
MSR 0000060D: 0000-0000-0000-0000
MSR 00000610: 0014-8132-0002-80FA
MSR 00000611: 0000-0000-19D8-1594 [S200]
MSR 00000611: 0000-0000-19D8-27C7 [S200]
MSR 00000611: 0000-0000-19D8-39C3
MSR 00000613: < FAILED >
MSR 00000614: < FAILED >
MSR 00000618: < FAILED >
MSR 00000619: < FAILED >
MSR 0000061B: < FAILED >
MSR 0000061C: < FAILED >
MSR 00000638: 0000-0000-0000-0000
MSR 00000639: 0000-0000-09CE-97A8 [S200]
MSR 00000639: 0000-0000-09CE-9B01 [S200]
MSR 00000639: 0000-0000-09CE-9B9A
MSR 0000063A: < FAILED >
MSR 0000063B: < FAILED >
MSR 00000640: < FAILED >
MSR 00000641: < FAILED >
MSR 00000642: < FAILED >
MSR 00000660: 0000-01A8-A934-2094
MSR 00000661: 0000-0000-0000-0000
MSR 00000662: 0000-0000-0000-0000
MSR 00000663: 0000-0000-0000-0000
MSR 00000664: 0000-085D-51D2-1A34
MSR 00000665: 0000-0000-0000-0000
MSR 00000666: 0000-0000-0000-0000
MSR 00000667: 0000-0000-0000-0016
MSR 00000668: 0000-0000-1313-0F0B
MSR 00000669: 0000-0000-0304-000C
MSR 0000066A: 0000-0000-0014-0602
MSR 0000066B: 0000-0000-003D-2D2D
MSR 0000066C: 0000-0000-1E1E-1E1E
MSR 0000066D: 0000-0000-5A5A-5A5A
MSR 0000066E: 0000-0000-0000-0000
MSR 0000066F: 0000-0000-0000-0000
MSR 00000670: 0000-0000-0000-0002
MSR 00000671: 0000-0000-0000-200B
MSR 00000672: 0000-0000-0000-0000
MSR 00000673: 0000-0000-0000-0305
MSR 00000674: 0000-0000-0405-500D
MSR 00000675: 0000-0000-0000-0027
MSR 00000676: 0000-0000-0000-0000
MSR 00000677: 0000-0000-0000-0000
