CPUID Registers (CPU #1):
CPUID 00000000: 0000000B-756E6547-6C65746E-49656E69
CPUID 00000001: 000106D1-00080800-000CE3BD-BFEBFBFF
CPUID 00000002: 05B0B101-4C5657F0-00000000-2CB43048
CPUID 00000003: 00000000-00000000-00000000-00000000
CPUID 00000004: 1C000121-01C0003F-0000003F-00000001
CPUID 00000004: 1C000122-01C0003F-0000003F-00000001
CPUID 00000004: 1C004143-02C0003F-00000FFF-00000001
CPUID 00000004: 1C01C163-02C0003F-00003FFF-00000002
CPUID 00000005: 00000040-00000040-00000003-00002220
CPUID 00000006: 00000001-00000002-00000001-00000000
CPUID 00000007: 00000000-00000000-00000000-00000000
CPUID 00000008: 00000400-00000000-00000000-00000000
CPUID 00000009: 00000000-00000000-00000000-00000000
CPUID 0000000A: 07280202-00000000-00000000-00000503
CPUID 0000000B: 00000000-00000001-00000100-00000000
CPUID 0000000B: 00000003-00000006-00000201-00000000
CPUID 80000000: 80000008-00000000-00000000-00000000
CPUID 80000001: 00000000-00000000-00000001-20100000
CPUID 80000002: 756E6547-20656E69-65746E49-2952286C
CPUID 80000003: 55504320-20202020-20202020-20202020
CPUID 80000004: 20202020-20402020-30342E32-007A4847
CPUID 80000005: 00000000-00000000-00000000-00000000
CPUID 80000006: 00000000-00000000-0C006040-00000000
CPUID 80000007: 00000000-00000000-00000000-00000000
CPUID 80000008: 00003028-00000000-00000000-00000000

CPUID Registers (CPU #2):
CPUID 00000000: 0000000B-756E6547-6C65746E-49656E69
CPUID 00000001: 000106D1-01080800-000CE3BD-BFEBFBFF
CPUID 00000002: 05B0B101-4C5657F0-00000000-2CB43048
CPUID 00000003: 00000000-00000000-00000000-00000000
CPUID 00000004: 1C000121-01C0003F-0000003F-00000001
CPUID 00000004: 1C000122-01C0003F-0000003F-00000001
CPUID 00000004: 1C004143-02C0003F-00000FFF-00000001
CPUID 00000004: 1C01C163-02C0003F-00003FFF-00000002
CPUID 00000005: 00000040-00000040-00000003-00002220
CPUID 00000006: 00000001-00000002-00000001-00000000
CPUID 00000007: 00000000-00000000-00000000-00000000
CPUID 00000008: 00000400-00000000-00000000-00000000
CPUID 00000009: 00000000-00000000-00000000-00000000
CPUID 0000000A: 07280202-00000000-00000000-00000503
CPUID 0000000B: 00000000-00000001-00000100-00000001
CPUID 0000000B: 00000003-00000006-00000201-00000001
CPUID 80000000: 80000008-00000000-00000000-00000000
CPUID 80000001: 00000000-00000000-00000001-20100000
CPUID 80000002: 756E6547-20656E69-65746E49-2952286C
CPUID 80000003: 55504320-20202020-20202020-20202020
CPUID 80000004: 20202020-20402020-30342E32-007A4847
CPUID 80000005: 00000000-00000000-00000000-00000000
CPUID 80000006: 00000000-00000000-0C006040-00000000
CPUID 80000007: 00000000-00000000-00000000-00000000
CPUID 80000008: 00003028-00000000-00000000-00000000

CPUID Registers (CPU #3):
CPUID 00000000: 0000000B-756E6547-6C65746E-49656E69
CPUID 00000001: 000106D1-02080800-000CE3BD-BFEBFBFF
CPUID 00000002: 05B0B101-4C5657F0-00000000-2CB43048
CPUID 00000003: 00000000-00000000-00000000-00000000
CPUID 00000004: 1C000121-01C0003F-0000003F-00000001
CPUID 00000004: 1C000122-01C0003F-0000003F-00000001
CPUID 00000004: 1C004143-02C0003F-00000FFF-00000001
CPUID 00000004: 1C01C163-02C0003F-00003FFF-00000002
CPUID 00000005: 00000040-00000040-00000003-00002220
CPUID 00000006: 00000001-00000002-00000001-00000000
CPUID 00000007: 00000000-00000000-00000000-00000000
CPUID 00000008: 00000400-00000000-00000000-00000000
CPUID 00000009: 00000000-00000000-00000000-00000000
CPUID 0000000A: 07280202-00000000-00000000-00000503
CPUID 0000000B: 00000000-00000001-00000100-00000002
CPUID 0000000B: 00000003-00000006-00000201-00000002
CPUID 80000000: 80000008-00000000-00000000-00000000
CPUID 80000001: 00000000-00000000-00000001-20100000
CPUID 80000002: 756E6547-20656E69-65746E49-2952286C
CPUID 80000003: 55504320-20202020-20202020-20202020
CPUID 80000004: 20202020-20402020-30342E32-007A4847
CPUID 80000005: 00000000-00000000-00000000-00000000
CPUID 80000006: 00000000-00000000-0C006040-00000000
CPUID 80000007: 00000000-00000000-00000000-00000000
CPUID 80000008: 00003028-00000000-00000000-00000000

CPUID Registers (CPU #4):
CPUID 00000000: 0000000B-756E6547-6C65746E-49656E69
CPUID 00000001: 000106D1-03080800-000CE3BD-BFEBFBFF
CPUID 00000002: 05B0B101-4C5657F0-00000000-2CB43048
CPUID 00000003: 00000000-00000000-00000000-00000000
CPUID 00000004: 1C000121-01C0003F-0000003F-00000001
CPUID 00000004: 1C000122-01C0003F-0000003F-00000001
CPUID 00000004: 1C004143-02C0003F-00000FFF-00000001
CPUID 00000004: 1C01C163-02C0003F-00003FFF-00000002
CPUID 00000005: 00000040-00000040-00000003-00002220
CPUID 00000006: 00000001-00000002-00000001-00000000
CPUID 00000007: 00000000-00000000-00000000-00000000
CPUID 00000008: 00000400-00000000-00000000-00000000
CPUID 00000009: 00000000-00000000-00000000-00000000
CPUID 0000000A: 07280202-00000000-00000000-00000503
CPUID 0000000B: 00000000-00000001-00000100-00000003
CPUID 0000000B: 00000003-00000006-00000201-00000003
CPUID 80000000: 80000008-00000000-00000000-00000000
CPUID 80000001: 00000000-00000000-00000001-20100000
CPUID 80000002: 756E6547-20656E69-65746E49-2952286C
CPUID 80000003: 55504320-20202020-20202020-20202020
CPUID 80000004: 20202020-20402020-30342E32-007A4847
CPUID 80000005: 00000000-00000000-00000000-00000000
CPUID 80000006: 00000000-00000000-0C006040-00000000
CPUID 80000007: 00000000-00000000-00000000-00000000
CPUID 80000008: 00003028-00000000-00000000-00000000

CPUID Registers (CPU #5):
CPUID 00000000: 0000000B-756E6547-6C65746E-49656E69
CPUID 00000001: 000106D1-04080800-000CE3BD-BFEBFBFF
CPUID 00000002: 05B0B101-4C5657F0-00000000-2CB43048
CPUID 00000003: 00000000-00000000-00000000-00000000
CPUID 00000004: 1C000121-01C0003F-0000003F-00000001
CPUID 00000004: 1C000122-01C0003F-0000003F-00000001
CPUID 00000004: 1C004143-02C0003F-00000FFF-00000001
CPUID 00000004: 1C01C163-02C0003F-00003FFF-00000002
CPUID 00000005: 00000040-00000040-00000003-00002220
CPUID 00000006: 00000001-00000002-00000001-00000000
CPUID 00000007: 00000000-00000000-00000000-00000000
CPUID 00000008: 00000400-00000000-00000000-00000000
CPUID 00000009: 00000000-00000000-00000000-00000000
CPUID 0000000A: 07280202-00000000-00000000-00000503
CPUID 0000000B: 00000000-00000001-00000100-00000004
CPUID 0000000B: 00000003-00000006-00000201-00000004
CPUID 80000000: 80000008-00000000-00000000-00000000
CPUID 80000001: 00000000-00000000-00000001-20100000
CPUID 80000002: 756E6547-20656E69-65746E49-2952286C
CPUID 80000003: 55504320-20202020-20202020-20202020
CPUID 80000004: 20202020-20402020-30342E32-007A4847
CPUID 80000005: 00000000-00000000-00000000-00000000
CPUID 80000006: 00000000-00000000-0C006040-00000000
CPUID 80000007: 00000000-00000000-00000000-00000000
CPUID 80000008: 00003028-00000000-00000000-00000000

CPUID Registers (CPU #6):
CPUID 00000000: 0000000B-756E6547-6C65746E-49656E69
CPUID 00000001: 000106D1-05080800-000CE3BD-BFEBFBFF
CPUID 00000002: 05B0B101-4C5657F0-00000000-2CB43048
CPUID 00000003: 00000000-00000000-00000000-00000000
CPUID 00000004: 1C000121-01C0003F-0000003F-00000001
CPUID 00000004: 1C000122-01C0003F-0000003F-00000001
CPUID 00000004: 1C004143-02C0003F-00000FFF-00000001
CPUID 00000004: 1C01C163-02C0003F-00003FFF-00000002
CPUID 00000005: 00000040-00000040-00000003-00002220
CPUID 00000006: 00000001-00000002-00000001-00000000
CPUID 00000007: 00000000-00000000-00000000-00000000
CPUID 00000008: 00000400-00000000-00000000-00000000
CPUID 00000009: 00000000-00000000-00000000-00000000
CPUID 0000000A: 07280202-00000000-00000000-00000503
CPUID 0000000B: 00000000-00000001-00000100-00000005
CPUID 0000000B: 00000003-00000006-00000201-00000005
CPUID 80000000: 80000008-00000000-00000000-00000000
CPUID 80000001: 00000000-00000000-00000001-20100000
CPUID 80000002: 756E6547-20656E69-65746E49-2952286C
CPUID 80000003: 55504320-20202020-20202020-20202020
CPUID 80000004: 20202020-20402020-30342E32-007A4847
CPUID 80000005: 00000000-00000000-00000000-00000000
CPUID 80000006: 00000000-00000000-0C006040-00000000
CPUID 80000007: 00000000-00000000-00000000-00000000
CPUID 80000008: 00003028-00000000-00000000-00000000

CPUID Registers (CPU #7):
CPUID 00000000: 0000000B-756E6547-6C65746E-49656E69
CPUID 00000001: 000106D1-08080800-000CE3BD-BFEBFBFF
CPUID 00000002: 05B0B101-4C5657F0-00000000-2CB43048
CPUID 00000003: 00000000-00000000-00000000-00000000
CPUID 00000004: 1C000121-01C0003F-0000003F-00000001
CPUID 00000004: 1C000122-01C0003F-0000003F-00000001
CPUID 00000004: 1C004143-02C0003F-00000FFF-00000001
CPUID 00000004: 1C01C163-02C0003F-00003FFF-00000002
CPUID 00000005: 00000040-00000040-00000003-00002220
CPUID 00000006: 00000001-00000002-00000001-00000000
CPUID 00000007: 00000000-00000000-00000000-00000000
CPUID 00000008: 00000400-00000000-00000000-00000000
CPUID 00000009: 00000000-00000000-00000000-00000000
CPUID 0000000A: 07280202-00000000-00000000-00000503
CPUID 0000000B: 00000000-00000001-00000100-00000008
CPUID 0000000B: 00000003-00000006-00000201-00000008
CPUID 80000000: 80000008-00000000-00000000-00000000
CPUID 80000001: 00000000-00000000-00000001-20100000
CPUID 80000002: 756E6547-20656E69-65746E49-2952286C
CPUID 80000003: 55504320-20202020-20202020-20202020
CPUID 80000004: 20202020-20402020-30342E32-007A4847
CPUID 80000005: 00000000-00000000-00000000-00000000
CPUID 80000006: 00000000-00000000-0C006040-00000000
CPUID 80000007: 00000000-00000000-00000000-00000000
CPUID 80000008: 00003028-00000000-00000000-00000000

CPUID Registers (CPU #8):
CPUID 00000000: 0000000B-756E6547-6C65746E-49656E69
CPUID 00000001: 000106D1-09080800-000CE3BD-BFEBFBFF
CPUID 00000002: 05B0B101-4C5657F0-00000000-2CB43048
CPUID 00000003: 00000000-00000000-00000000-00000000
CPUID 00000004: 1C000121-01C0003F-0000003F-00000001
CPUID 00000004: 1C000122-01C0003F-0000003F-00000001
CPUID 00000004: 1C004143-02C0003F-00000FFF-00000001
CPUID 00000004: 1C01C163-02C0003F-00003FFF-00000002
CPUID 00000005: 00000040-00000040-00000003-00002220
CPUID 00000006: 00000001-00000002-00000001-00000000
CPUID 00000007: 00000000-00000000-00000000-00000000
CPUID 00000008: 00000400-00000000-00000000-00000000
CPUID 00000009: 00000000-00000000-00000000-00000000
CPUID 0000000A: 07280202-00000000-00000000-00000503
CPUID 0000000B: 00000000-00000001-00000100-00000009
CPUID 0000000B: 00000003-00000006-00000201-00000009
CPUID 80000000: 80000008-00000000-00000000-00000000
CPUID 80000001: 00000000-00000000-00000001-20100000
CPUID 80000002: 756E6547-20656E69-65746E49-2952286C
CPUID 80000003: 55504320-20202020-20202020-20202020
CPUID 80000004: 20202020-20402020-30342E32-007A4847
CPUID 80000005: 00000000-00000000-00000000-00000000
CPUID 80000006: 00000000-00000000-0C006040-00000000
CPUID 80000007: 00000000-00000000-00000000-00000000
CPUID 80000008: 00003028-00000000-00000000-00000000

CPUID Registers (CPU #9):
CPUID 00000000: 0000000B-756E6547-6C65746E-49656E69
CPUID 00000001: 000106D1-0A080800-000CE3BD-BFEBFBFF
CPUID 00000002: 05B0B101-4C5657F0-00000000-2CB43048
CPUID 00000003: 00000000-00000000-00000000-00000000
CPUID 00000004: 1C000121-01C0003F-0000003F-00000001
CPUID 00000004: 1C000122-01C0003F-0000003F-00000001
CPUID 00000004: 1C004143-02C0003F-00000FFF-00000001
CPUID 00000004: 1C01C163-02C0003F-00003FFF-00000002
CPUID 00000005: 00000040-00000040-00000003-00002220
CPUID 00000006: 00000001-00000002-00000001-00000000
CPUID 00000007: 00000000-00000000-00000000-00000000
CPUID 00000008: 00000400-00000000-00000000-00000000
CPUID 00000009: 00000000-00000000-00000000-00000000
CPUID 0000000A: 07280202-00000000-00000000-00000503
CPUID 0000000B: 00000000-00000001-00000100-0000000A
CPUID 0000000B: 00000003-00000006-00000201-0000000A
CPUID 80000000: 80000008-00000000-00000000-00000000
CPUID 80000001: 00000000-00000000-00000001-20100000
CPUID 80000002: 756E6547-20656E69-65746E49-2952286C
CPUID 80000003: 55504320-20202020-20202020-20202020
CPUID 80000004: 20202020-20402020-30342E32-007A4847
CPUID 80000005: 00000000-00000000-00000000-00000000
CPUID 80000006: 00000000-00000000-0C006040-00000000
CPUID 80000007: 00000000-00000000-00000000-00000000
CPUID 80000008: 00003028-00000000-00000000-00000000

CPUID Registers (CPU #10):
CPUID 00000000: 0000000B-756E6547-6C65746E-49656E69
CPUID 00000001: 000106D1-0B080800-000CE3BD-BFEBFBFF
CPUID 00000002: 05B0B101-4C5657F0-00000000-2CB43048
CPUID 00000003: 00000000-00000000-00000000-00000000
CPUID 00000004: 1C000121-01C0003F-0000003F-00000001
CPUID 00000004: 1C000122-01C0003F-0000003F-00000001
CPUID 00000004: 1C004143-02C0003F-00000FFF-00000001
CPUID 00000004: 1C01C163-02C0003F-00003FFF-00000002
CPUID 00000005: 00000040-00000040-00000003-00002220
CPUID 00000006: 00000001-00000002-00000001-00000000
CPUID 00000007: 00000000-00000000-00000000-00000000
CPUID 00000008: 00000400-00000000-00000000-00000000
CPUID 00000009: 00000000-00000000-00000000-00000000
CPUID 0000000A: 07280202-00000000-00000000-00000503
CPUID 0000000B: 00000000-00000001-00000100-0000000B
CPUID 0000000B: 00000003-00000006-00000201-0000000B
CPUID 80000000: 80000008-00000000-00000000-00000000
CPUID 80000001: 00000000-00000000-00000001-20100000
CPUID 80000002: 756E6547-20656E69-65746E49-2952286C
CPUID 80000003: 55504320-20202020-20202020-20202020
CPUID 80000004: 20202020-20402020-30342E32-007A4847
CPUID 80000005: 00000000-00000000-00000000-00000000
CPUID 80000006: 00000000-00000000-0C006040-00000000
CPUID 80000007: 00000000-00000000-00000000-00000000
CPUID 80000008: 00003028-00000000-00000000-00000000

CPUID Registers (CPU #11):
CPUID 00000000: 0000000B-756E6547-6C65746E-49656E69
CPUID 00000001: 000106D1-0C080800-000CE3BD-BFEBFBFF
CPUID 00000002: 05B0B101-4C5657F0-00000000-2CB43048
CPUID 00000003: 00000000-00000000-00000000-00000000
CPUID 00000004: 1C000121-01C0003F-0000003F-00000001
CPUID 00000004: 1C000122-01C0003F-0000003F-00000001
CPUID 00000004: 1C004143-02C0003F-00000FFF-00000001
CPUID 00000004: 1C01C163-02C0003F-00003FFF-00000002
CPUID 00000005: 00000040-00000040-00000003-00002220
CPUID 00000006: 00000001-00000002-00000001-00000000
CPUID 00000007: 00000000-00000000-00000000-00000000
CPUID 00000008: 00000400-00000000-00000000-00000000
CPUID 00000009: 00000000-00000000-00000000-00000000
CPUID 0000000A: 07280202-00000000-00000000-00000503
CPUID 0000000B: 00000000-00000001-00000100-0000000C
CPUID 0000000B: 00000003-00000006-00000201-0000000C
CPUID 80000000: 80000008-00000000-00000000-00000000
CPUID 80000001: 00000000-00000000-00000001-20100000
CPUID 80000002: 756E6547-20656E69-65746E49-2952286C
CPUID 80000003: 55504320-20202020-20202020-20202020
CPUID 80000004: 20202020-20402020-30342E32-007A4847
CPUID 80000005: 00000000-00000000-00000000-00000000
CPUID 80000006: 00000000-00000000-0C006040-00000000
CPUID 80000007: 00000000-00000000-00000000-00000000
CPUID 80000008: 00003028-00000000-00000000-00000000

CPUID Registers (CPU #12):
CPUID 00000000: 0000000B-756E6547-6C65746E-49656E69
CPUID 00000001: 000106D1-0D080800-000CE3BD-BFEBFBFF
CPUID 00000002: 05B0B101-4C5657F0-00000000-2CB43048
CPUID 00000003: 00000000-00000000-00000000-00000000
CPUID 00000004: 1C000121-01C0003F-0000003F-00000001
CPUID 00000004: 1C000122-01C0003F-0000003F-00000001
CPUID 00000004: 1C004143-02C0003F-00000FFF-00000001
CPUID 00000004: 1C01C163-02C0003F-00003FFF-00000002
CPUID 00000005: 00000040-00000040-00000003-00002220
CPUID 00000006: 00000001-00000002-00000001-00000000
CPUID 00000007: 00000000-00000000-00000000-00000000
CPUID 00000008: 00000400-00000000-00000000-00000000
CPUID 00000009: 00000000-00000000-00000000-00000000
CPUID 0000000A: 07280202-00000000-00000000-00000503
CPUID 0000000B: 00000000-00000001-00000100-0000000D
CPUID 0000000B: 00000003-00000006-00000201-0000000D
CPUID 80000000: 80000008-00000000-00000000-00000000
CPUID 80000001: 00000000-00000000-00000001-20100000
CPUID 80000002: 756E6547-20656E69-65746E49-2952286C
CPUID 80000003: 55504320-20202020-20202020-20202020
CPUID 80000004: 20202020-20402020-30342E32-007A4847
CPUID 80000005: 00000000-00000000-00000000-00000000
CPUID 80000006: 00000000-00000000-0C006040-00000000
CPUID 80000007: 00000000-00000000-00000000-00000000
CPUID 80000008: 00003028-00000000-00000000-00000000

CPUID Registers (CPU #13):
CPUID 00000000: 0000000B-756E6547-6C65746E-49656E69
CPUID 00000001: 000106D1-10080800-000CE3BD-BFEBFBFF
CPUID 00000002: 05B0B101-4C5657F0-00000000-2CB43048
CPUID 00000003: 00000000-00000000-00000000-00000000
CPUID 00000004: 1C000121-01C0003F-0000003F-00000001
CPUID 00000004: 1C000122-01C0003F-0000003F-00000001
CPUID 00000004: 1C004143-02C0003F-00000FFF-00000001
CPUID 00000004: 1C01C163-02C0003F-00003FFF-00000002
CPUID 00000005: 00000040-00000040-00000003-00002220
CPUID 00000006: 00000001-00000002-00000001-00000000
CPUID 00000007: 00000000-00000000-00000000-00000000
CPUID 00000008: 00000400-00000000-00000000-00000000
CPUID 00000009: 00000000-00000000-00000000-00000000
CPUID 0000000A: 07280202-00000000-00000000-00000503
CPUID 0000000B: 00000000-00000001-00000100-00000010
CPUID 0000000B: 00000003-00000006-00000201-00000010
CPUID 80000000: 80000008-00000000-00000000-00000000
CPUID 80000001: 00000000-00000000-00000001-20100000
CPUID 80000002: 756E6547-20656E69-65746E49-2952286C
CPUID 80000003: 55504320-20202020-20202020-20202020
CPUID 80000004: 20202020-20402020-30342E32-007A4847
CPUID 80000005: 00000000-00000000-00000000-00000000
CPUID 80000006: 00000000-00000000-0C006040-00000000
CPUID 80000007: 00000000-00000000-00000000-00000000
CPUID 80000008: 00003028-00000000-00000000-00000000

CPUID Registers (CPU #14):
CPUID 00000000: 0000000B-756E6547-6C65746E-49656E69
CPUID 00000001: 000106D1-11080800-000CE3BD-BFEBFBFF
CPUID 00000002: 05B0B101-4C5657F0-00000000-2CB43048
CPUID 00000003: 00000000-00000000-00000000-00000000
CPUID 00000004: 1C000121-01C0003F-0000003F-00000001
CPUID 00000004: 1C000122-01C0003F-0000003F-00000001
CPUID 00000004: 1C004143-02C0003F-00000FFF-00000001
CPUID 00000004: 1C01C163-02C0003F-00003FFF-00000002
CPUID 00000005: 00000040-00000040-00000003-00002220
CPUID 00000006: 00000001-00000002-00000001-00000000
CPUID 00000007: 00000000-00000000-00000000-00000000
CPUID 00000008: 00000400-00000000-00000000-00000000
CPUID 00000009: 00000000-00000000-00000000-00000000
CPUID 0000000A: 07280202-00000000-00000000-00000503
CPUID 0000000B: 00000000-00000001-00000100-00000011
CPUID 0000000B: 00000003-00000006-00000201-00000011
CPUID 80000000: 80000008-00000000-00000000-00000000
CPUID 80000001: 00000000-00000000-00000001-20100000
CPUID 80000002: 756E6547-20656E69-65746E49-2952286C
CPUID 80000003: 55504320-20202020-20202020-20202020
CPUID 80000004: 20202020-20402020-30342E32-007A4847
CPUID 80000005: 00000000-00000000-00000000-00000000
CPUID 80000006: 00000000-00000000-0C006040-00000000
CPUID 80000007: 00000000-00000000-00000000-00000000
CPUID 80000008: 00003028-00000000-00000000-00000000

CPUID Registers (CPU #15):
CPUID 00000000: 0000000B-756E6547-6C65746E-49656E69
CPUID 00000001: 000106D1-12080800-000CE3BD-BFEBFBFF
CPUID 00000002: 05B0B101-4C5657F0-00000000-2CB43048
CPUID 00000003: 00000000-00000000-00000000-00000000
CPUID 00000004: 1C000121-01C0003F-0000003F-00000001
CPUID 00000004: 1C000122-01C0003F-0000003F-00000001
CPUID 00000004: 1C004143-02C0003F-00000FFF-00000001
CPUID 00000004: 1C01C163-02C0003F-00003FFF-00000002
CPUID 00000005: 00000040-00000040-00000003-00002220
CPUID 00000006: 00000001-00000002-00000001-00000000
CPUID 00000007: 00000000-00000000-00000000-00000000
CPUID 00000008: 00000400-00000000-00000000-00000000
CPUID 00000009: 00000000-00000000-00000000-00000000
CPUID 0000000A: 07280202-00000000-00000000-00000503
CPUID 0000000B: 00000000-00000001-00000100-00000012
CPUID 0000000B: 00000003-00000006-00000201-00000012
CPUID 80000000: 80000008-00000000-00000000-00000000
CPUID 80000001: 00000000-00000000-00000001-20100000
CPUID 80000002: 756E6547-20656E69-65746E49-2952286C
CPUID 80000003: 55504320-20202020-20202020-20202020
CPUID 80000004: 20202020-20402020-30342E32-007A4847
CPUID 80000005: 00000000-00000000-00000000-00000000
CPUID 80000006: 00000000-00000000-0C006040-00000000
CPUID 80000007: 00000000-00000000-00000000-00000000
CPUID 80000008: 00003028-00000000-00000000-00000000

CPUID Registers (CPU #16):
CPUID 00000000: 0000000B-756E6547-6C65746E-49656E69
CPUID 00000001: 000106D1-13080800-000CE3BD-BFEBFBFF
CPUID 00000002: 05B0B101-4C5657F0-00000000-2CB43048
CPUID 00000003: 00000000-00000000-00000000-00000000
CPUID 00000004: 1C000121-01C0003F-0000003F-00000001
CPUID 00000004: 1C000122-01C0003F-0000003F-00000001
CPUID 00000004: 1C004143-02C0003F-00000FFF-00000001
CPUID 00000004: 1C01C163-02C0003F-00003FFF-00000002
CPUID 00000005: 00000040-00000040-00000003-00002220
CPUID 00000006: 00000001-00000002-00000001-00000000
CPUID 00000007: 00000000-00000000-00000000-00000000
CPUID 00000008: 00000400-00000000-00000000-00000000
CPUID 00000009: 00000000-00000000-00000000-00000000
CPUID 0000000A: 07280202-00000000-00000000-00000503
CPUID 0000000B: 00000000-00000001-00000100-00000013
CPUID 0000000B: 00000003-00000006-00000201-00000013
CPUID 80000000: 80000008-00000000-00000000-00000000
CPUID 80000001: 00000000-00000000-00000001-20100000
CPUID 80000002: 756E6547-20656E69-65746E49-2952286C
CPUID 80000003: 55504320-20202020-20202020-20202020
CPUID 80000004: 20202020-20402020-30342E32-007A4847
CPUID 80000005: 00000000-00000000-00000000-00000000
CPUID 80000006: 00000000-00000000-0C006040-00000000
CPUID 80000007: 00000000-00000000-00000000-00000000
CPUID 80000008: 00003028-00000000-00000000-00000000

CPUID Registers (CPU #17):
CPUID 00000000: 0000000B-756E6547-6C65746E-49656E69
CPUID 00000001: 000106D1-14080800-000CE3BD-BFEBFBFF
CPUID 00000002: 05B0B101-4C5657F0-00000000-2CB43048
CPUID 00000003: 00000000-00000000-00000000-00000000
CPUID 00000004: 1C000121-01C0003F-0000003F-00000001
CPUID 00000004: 1C000122-01C0003F-0000003F-00000001
CPUID 00000004: 1C004143-02C0003F-00000FFF-00000001
CPUID 00000004: 1C01C163-02C0003F-00003FFF-00000002
CPUID 00000005: 00000040-00000040-00000003-00002220
CPUID 00000006: 00000001-00000002-00000001-00000000
CPUID 00000007: 00000000-00000000-00000000-00000000
CPUID 00000008: 00000400-00000000-00000000-00000000
CPUID 00000009: 00000000-00000000-00000000-00000000
CPUID 0000000A: 07280202-00000000-00000000-00000503
CPUID 0000000B: 00000000-00000001-00000100-00000014
CPUID 0000000B: 00000003-00000006-00000201-00000014
CPUID 80000000: 80000008-00000000-00000000-00000000
CPUID 80000001: 00000000-00000000-00000001-20100000
CPUID 80000002: 756E6547-20656E69-65746E49-2952286C
CPUID 80000003: 55504320-20202020-20202020-20202020
CPUID 80000004: 20202020-20402020-30342E32-007A4847
CPUID 80000005: 00000000-00000000-00000000-00000000
CPUID 80000006: 00000000-00000000-0C006040-00000000
CPUID 80000007: 00000000-00000000-00000000-00000000
CPUID 80000008: 00003028-00000000-00000000-00000000

CPUID Registers (CPU #18):
CPUID 00000000: 0000000B-756E6547-6C65746E-49656E69
CPUID 00000001: 000106D1-15080800-000CE3BD-BFEBFBFF
CPUID 00000002: 05B0B101-4C5657F0-00000000-2CB43048
CPUID 00000003: 00000000-00000000-00000000-00000000
CPUID 00000004: 1C000121-01C0003F-0000003F-00000001
CPUID 00000004: 1C000122-01C0003F-0000003F-00000001
CPUID 00000004: 1C004143-02C0003F-00000FFF-00000001
CPUID 00000004: 1C01C163-02C0003F-00003FFF-00000002
CPUID 00000005: 00000040-00000040-00000003-00002220
CPUID 00000006: 00000001-00000002-00000001-00000000
CPUID 00000007: 00000000-00000000-00000000-00000000
CPUID 00000008: 00000400-00000000-00000000-00000000
CPUID 00000009: 00000000-00000000-00000000-00000000
CPUID 0000000A: 07280202-00000000-00000000-00000503
CPUID 0000000B: 00000000-00000001-00000100-00000015
CPUID 0000000B: 00000003-00000006-00000201-00000015
CPUID 80000000: 80000008-00000000-00000000-00000000
CPUID 80000001: 00000000-00000000-00000001-20100000
CPUID 80000002: 756E6547-20656E69-65746E49-2952286C
CPUID 80000003: 55504320-20202020-20202020-20202020
CPUID 80000004: 20202020-20402020-30342E32-007A4847
CPUID 80000005: 00000000-00000000-00000000-00000000
CPUID 80000006: 00000000-00000000-0C006040-00000000
CPUID 80000007: 00000000-00000000-00000000-00000000
CPUID 80000008: 00003028-00000000-00000000-00000000

CPUID Registers (CPU #19):
CPUID 00000000: 0000000B-756E6547-6C65746E-49656E69
CPUID 00000001: 000106D1-18080800-000CE3BD-BFEBFBFF
CPUID 00000002: 05B0B101-4C5657F0-00000000-2CB43048
CPUID 00000003: 00000000-00000000-00000000-00000000
CPUID 00000004: 1C000121-01C0003F-0000003F-00000001
CPUID 00000004: 1C000122-01C0003F-0000003F-00000001
CPUID 00000004: 1C004143-02C0003F-00000FFF-00000001
CPUID 00000004: 1C01C163-02C0003F-00003FFF-00000002
CPUID 00000005: 00000040-00000040-00000003-00002220
CPUID 00000006: 00000001-00000002-00000001-00000000
CPUID 00000007: 00000000-00000000-00000000-00000000
CPUID 00000008: 00000400-00000000-00000000-00000000
CPUID 00000009: 00000000-00000000-00000000-00000000
CPUID 0000000A: 07280202-00000000-00000000-00000503
CPUID 0000000B: 00000000-00000001-00000100-00000018
CPUID 0000000B: 00000003-00000006-00000201-00000018
CPUID 80000000: 80000008-00000000-00000000-00000000
CPUID 80000001: 00000000-00000000-00000001-20100000
CPUID 80000002: 756E6547-20656E69-65746E49-2952286C
CPUID 80000003: 55504320-20202020-20202020-20202020
CPUID 80000004: 20202020-20402020-30342E32-007A4847
CPUID 80000005: 00000000-00000000-00000000-00000000
CPUID 80000006: 00000000-00000000-0C006040-00000000
CPUID 80000007: 00000000-00000000-00000000-00000000
CPUID 80000008: 00003028-00000000-00000000-00000000

CPUID Registers (CPU #20):
CPUID 00000000: 0000000B-756E6547-6C65746E-49656E69
CPUID 00000001: 000106D1-19080800-000CE3BD-BFEBFBFF
CPUID 00000002: 05B0B101-4C5657F0-00000000-2CB43048
CPUID 00000003: 00000000-00000000-00000000-00000000
CPUID 00000004: 1C000121-01C0003F-0000003F-00000001
CPUID 00000004: 1C000122-01C0003F-0000003F-00000001
CPUID 00000004: 1C004143-02C0003F-00000FFF-00000001
CPUID 00000004: 1C01C163-02C0003F-00003FFF-00000002
CPUID 00000005: 00000040-00000040-00000003-00002220
CPUID 00000006: 00000001-00000002-00000001-00000000
CPUID 00000007: 00000000-00000000-00000000-00000000
CPUID 00000008: 00000400-00000000-00000000-00000000
CPUID 00000009: 00000000-00000000-00000000-00000000
CPUID 0000000A: 07280202-00000000-00000000-00000503
CPUID 0000000B: 00000000-00000001-00000100-00000019
CPUID 0000000B: 00000003-00000006-00000201-00000019
CPUID 80000000: 80000008-00000000-00000000-00000000
CPUID 80000001: 00000000-00000000-00000001-20100000
CPUID 80000002: 756E6547-20656E69-65746E49-2952286C
CPUID 80000003: 55504320-20202020-20202020-20202020
CPUID 80000004: 20202020-20402020-30342E32-007A4847
CPUID 80000005: 00000000-00000000-00000000-00000000
CPUID 80000006: 00000000-00000000-0C006040-00000000
CPUID 80000007: 00000000-00000000-00000000-00000000
CPUID 80000008: 00003028-00000000-00000000-00000000

CPUID Registers (CPU #21):
CPUID 00000000: 0000000B-756E6547-6C65746E-49656E69
CPUID 00000001: 000106D1-1A080800-000CE3BD-BFEBFBFF
CPUID 00000002: 05B0B101-4C5657F0-00000000-2CB43048
CPUID 00000003: 00000000-00000000-00000000-00000000
CPUID 00000004: 1C000121-01C0003F-0000003F-00000001
CPUID 00000004: 1C000122-01C0003F-0000003F-00000001
CPUID 00000004: 1C004143-02C0003F-00000FFF-00000001
CPUID 00000004: 1C01C163-02C0003F-00003FFF-00000002
CPUID 00000005: 00000040-00000040-00000003-00002220
CPUID 00000006: 00000001-00000002-00000001-00000000
CPUID 00000007: 00000000-00000000-00000000-00000000
CPUID 00000008: 00000400-00000000-00000000-00000000
CPUID 00000009: 00000000-00000000-00000000-00000000
CPUID 0000000A: 07280202-00000000-00000000-00000503
CPUID 0000000B: 00000000-00000001-00000100-0000001A
CPUID 0000000B: 00000003-00000006-00000201-0000001A
CPUID 80000000: 80000008-00000000-00000000-00000000
CPUID 80000001: 00000000-00000000-00000001-20100000
CPUID 80000002: 756E6547-20656E69-65746E49-2952286C
CPUID 80000003: 55504320-20202020-20202020-20202020
CPUID 80000004: 20202020-20402020-30342E32-007A4847
CPUID 80000005: 00000000-00000000-00000000-00000000
CPUID 80000006: 00000000-00000000-0C006040-00000000
CPUID 80000007: 00000000-00000000-00000000-00000000
CPUID 80000008: 00003028-00000000-00000000-00000000

CPUID Registers (CPU #22):
CPUID 00000000: 0000000B-756E6547-6C65746E-49656E69
CPUID 00000001: 000106D1-1B080800-000CE3BD-BFEBFBFF
CPUID 00000002: 05B0B101-4C5657F0-00000000-2CB43048
CPUID 00000003: 00000000-00000000-00000000-00000000
CPUID 00000004: 1C000121-01C0003F-0000003F-00000001
CPUID 00000004: 1C000122-01C0003F-0000003F-00000001
CPUID 00000004: 1C004143-02C0003F-00000FFF-00000001
CPUID 00000004: 1C01C163-02C0003F-00003FFF-00000002
CPUID 00000005: 00000040-00000040-00000003-00002220
CPUID 00000006: 00000001-00000002-00000001-00000000
CPUID 00000007: 00000000-00000000-00000000-00000000
CPUID 00000008: 00000400-00000000-00000000-00000000
CPUID 00000009: 00000000-00000000-00000000-00000000
CPUID 0000000A: 07280202-00000000-00000000-00000503
CPUID 0000000B: 00000000-00000001-00000100-0000001B
CPUID 0000000B: 00000003-00000006-00000201-0000001B
CPUID 80000000: 80000008-00000000-00000000-00000000
CPUID 80000001: 00000000-00000000-00000001-20100000
CPUID 80000002: 756E6547-20656E69-65746E49-2952286C
CPUID 80000003: 55504320-20202020-20202020-20202020
CPUID 80000004: 20202020-20402020-30342E32-007A4847
CPUID 80000005: 00000000-00000000-00000000-00000000
CPUID 80000006: 00000000-00000000-0C006040-00000000
CPUID 80000007: 00000000-00000000-00000000-00000000
CPUID 80000008: 00003028-00000000-00000000-00000000

CPUID Registers (CPU #23):
CPUID 00000000: 0000000B-756E6547-6C65746E-49656E69
CPUID 00000001: 000106D1-1C080800-000CE3BD-BFEBFBFF
CPUID 00000002: 05B0B101-4C5657F0-00000000-2CB43048
CPUID 00000003: 00000000-00000000-00000000-00000000
CPUID 00000004: 1C000121-01C0003F-0000003F-00000001
CPUID 00000004: 1C000122-01C0003F-0000003F-00000001
CPUID 00000004: 1C004143-02C0003F-00000FFF-00000001
CPUID 00000004: 1C01C163-02C0003F-00003FFF-00000002
CPUID 00000005: 00000040-00000040-00000003-00002220
CPUID 00000006: 00000001-00000002-00000001-00000000
CPUID 00000007: 00000000-00000000-00000000-00000000
CPUID 00000008: 00000400-00000000-00000000-00000000
CPUID 00000009: 00000000-00000000-00000000-00000000
CPUID 0000000A: 07280202-00000000-00000000-00000503
CPUID 0000000B: 00000000-00000001-00000100-0000001C
CPUID 0000000B: 00000003-00000006-00000201-0000001C
CPUID 80000000: 80000008-00000000-00000000-00000000
CPUID 80000001: 00000000-00000000-00000001-20100000
CPUID 80000002: 756E6547-20656E69-65746E49-2952286C
CPUID 80000003: 55504320-20202020-20202020-20202020
CPUID 80000004: 20202020-20402020-30342E32-007A4847
CPUID 80000005: 00000000-00000000-00000000-00000000
CPUID 80000006: 00000000-00000000-0C006040-00000000
CPUID 80000007: 00000000-00000000-00000000-00000000
CPUID 80000008: 00003028-00000000-00000000-00000000

CPUID Registers (CPU #24):
CPUID 00000000: 0000000B-756E6547-6C65746E-49656E69
CPUID 00000001: 000106D1-1D080800-000CE3BD-BFEBFBFF
CPUID 00000002: 05B0B101-4C5657F0-00000000-2CB43048
CPUID 00000003: 00000000-00000000-00000000-00000000
CPUID 00000004: 1C000121-01C0003F-0000003F-00000001
CPUID 00000004: 1C000122-01C0003F-0000003F-00000001
CPUID 00000004: 1C004143-02C0003F-00000FFF-00000001
CPUID 00000004: 1C01C163-02C0003F-00003FFF-00000002
CPUID 00000005: 00000040-00000040-00000003-00002220
CPUID 00000006: 00000001-00000002-00000001-00000000
CPUID 00000007: 00000000-00000000-00000000-00000000
CPUID 00000008: 00000400-00000000-00000000-00000000
CPUID 00000009: 00000000-00000000-00000000-00000000
CPUID 0000000A: 07280202-00000000-00000000-00000503
CPUID 0000000B: 00000000-00000001-00000100-0000001D
CPUID 0000000B: 00000003-00000006-00000201-0000001D
CPUID 80000000: 80000008-00000000-00000000-00000000
CPUID 80000001: 00000000-00000000-00000001-20100000
CPUID 80000002: 756E6547-20656E69-65746E49-2952286C
CPUID 80000003: 55504320-20202020-20202020-20202020
CPUID 80000004: 20202020-20402020-30342E32-007A4847
CPUID 80000005: 00000000-00000000-00000000-00000000
CPUID 80000006: 00000000-00000000-0C006040-00000000
CPUID 80000007: 00000000-00000000-00000000-00000000
CPUID 80000008: 00003028-00000000-00000000-00000000
