------[ Versions ]------

Program Version : EVEREST v4.60.1628 Beta
BenchDLL Version: 2.4.257.0

------[ CPU Info ]------

CPU Type           : Transmeta Efficeon TM86x0, 1000 MHz
CPU Alias          : Astro
Instruction Set    : x86, MMX, SSE, SSE2
CPUID Manufacturer : TransmetaCPU
CPUID CPU Name     : Transmeta Efficeon(tm) Processor TM8000
CPUID Revision     : 00000F24h
Platform ID        : 00h  (Unknown)

------[ Logical CPU #0 ]------

allcpu: Valid

CPUID 00000000: 00000003-756E6547-3638784D-54656E69
CPUID 00000001: 00000F24-00011000-00000000-2FCFF9FF
CPUID 00000002: 00000001-00000000-00000000-00000000
CPUID 00000003: 0000000C-24C01189-2000030F-015B380A
CPUID 80000000: 80000008-6E617254-55504361-74656D73
CPUID 80000001: 00000F24-00000000-00000000-01C3F1FF
CPUID 80000002: 6E617254-74656D73-66452061-65636966
CPUID 80000003: 74286E6F-5020296D-65636F72-726F7373
CPUID 80000004: 384D5420-00303030-00000000-00000000
CPUID 80000005: 00000000-04FF04FF-40080120-80040140
CPUID 80000006: 00000000-00000000-04004180-00000000
CPUID 80000007: 00000000-00000000-00000000-00000000
CPUID 80000008: 00002020-00000000-00000000-00000000
CPUID 80860000: 80860007-6E617254-55504361-74656D73
CPUID 80860001: 00000F24-02000000-000003E8-0000142A
CPUID 80860002: 24C01101-06000401-0000003E-00000000
CPUID 80860003: 34303032-33323730-3A303220-6F203134
CPUID 80860004: 63696666-206C6169-656C6572-20657361
CPUID 80860005: 2E302E36-00362334-00000000-00000000
CPUID 80860006: 00000000-00000000-00000000-00000000
CPUID 80860007: 000003E8-00000578-00000064-00000000

------[ MSR Registers ]------

MSR 0000019A: 0000-0000-0000-0002
MSR 0000019B: 0000-0000-0000-0000
MSR 0000019C: 0000-0000-0000-0000
MSR 80868010: 0000-0064-0000-0064
MSR 80868011: 0000-0000-0000-0001
MSR 80868018: 0000-0004-0000-0000
MSR 80868019: 0000-000C-0000-0064
MSR 8086801A: 0000-0578-0000-03E8
MSR 8086801B: 0000-0007-0000-0007
MSR 8086801C: 0000-0007-0000-0007
MSR 8086801D: 0000-0007-0000-0007
MSR 80868030: 0000-0007-0000-0007
MSR 80868031: 0000-0007-0000-0007
MSR 80868032: 0000-0007-0000-0007
MSR 80868033: 0000-0007-0000-0007
MSR 80868034: 0000-0007-0000-0007
MSR 80868035: 0000-0007-0000-0007
MSR 80868036: 0000-0007-0000-0007
MSR 80868037: 0000-0007-0000-0007

PerformanceFrequency = 3579545

Tjmax Temperature = 0 Celsius
