------[ Versions ]------

Program Version : EVEREST v5.00.1656 Beta
BenchDLL Version: 2.4.258.0

------[ CPU Info ]------

CPU Type           : 2x Intel Xeon, 3400 MHz (17 x 200)
CPU Alias          : Irwindale
CPU Platform       : Socket 604 DP
CPU Stepping       : R0
Instruction Set    : x86, x86-64, MMX, SSE, SSE2, SSE3
CPUID Manufacturer : GenuineIntel
CPUID CPU Name     : Intel(R) Xeon(TM) CPU 3.40GHz
CPUID Revision     : 00000F4Ah
IA Brand ID        : 00h  (Unknown)
Platform ID        : 24h  (Socket 604 DP)

------[ Logical CPU #0 ]------

allcpu: Valid

CPUID 00000000: 00000005-756E6547-6C65746E-49656E69
CPUID 00000001: 00000F4A-00020800-0000649D-BFEBFBFF
CPUID 00000002: 605B5001-00000000-00000000-007D7040
CPUID 00000003: 00000000-00000000-00000000-00000000
CPUID 00000004: 00004121-01C0003F-0000001F-00000000
CPUID 00000004: 00004143-01C0103F-000007FF-00000000
CPUID 00000005: 00000040-00000040-00000000-00000000
CPUID 80000000: 80000008-00000000-00000000-00000000
CPUID 80000001: 00000000-00000000-00000001-20100000
CPUID 80000002: 20202020-20202020-20202020-20202020
CPUID 80000003: 6E492020-286C6574-58202952-286E6F65
CPUID 80000004: 20294D54-20555043-30342E33-007A4847
CPUID 80000005: 00000000-00000000-00000000-00000000
CPUID 80000006: 00000000-00000000-08006040-00000000
CPUID 80000007: 00000000-00000000-00000000-00000000
CPUID 80000008: 00003024-00000000-00000000-00000000

L1    Data Cache:     16 KB,  8-way Associative, 64-byte Line
L2 Unified Cache:   2048 KB,  8-way Associative, 64-byte Line

------[ Logical CPU #1 ]------

allcpu: Valid

CPUID 00000000: 00000005-756E6547-6C65746E-49656E69
CPUID 00000001: 00000F4A-06020800-0000649D-BFEBFBFF
CPUID 00000002: 605B5001-00000000-00000000-007D7040
CPUID 00000003: 00000000-00000000-00000000-00000000
CPUID 00000004: 00004121-01C0003F-0000001F-00000000
CPUID 00000004: 00004143-01C0103F-000007FF-00000000
CPUID 00000005: 00000040-00000040-00000000-00000000
CPUID 80000000: 80000008-00000000-00000000-00000000
CPUID 80000001: 00000000-00000000-00000001-20100000
CPUID 80000002: 20202020-20202020-20202020-20202020
CPUID 80000003: 6E492020-286C6574-58202952-286E6F65
CPUID 80000004: 20294D54-20555043-30342E33-007A4847
CPUID 80000005: 00000000-00000000-00000000-00000000
CPUID 80000006: 00000000-00000000-08006040-00000000
CPUID 80000007: 00000000-00000000-00000000-00000000
CPUID 80000008: 00003024-00000000-00000000-00000000

L1    Data Cache:     16 KB,  8-way Associative, 64-byte Line
L2 Unified Cache:   2048 KB,  8-way Associative, 64-byte Line

------[ Logical CPU #2 ]------

allcpu: Valid, Virtual

CPUID 00000000: 00000005-756E6547-6C65746E-49656E69
CPUID 00000001: 00000F4A-01020800-0000649D-BFEBFBFF
CPUID 00000002: 605B5001-00000000-00000000-007D7040
CPUID 00000003: 00000000-00000000-00000000-00000000
CPUID 00000004: 00004121-01C0003F-0000001F-00000000
CPUID 00000004: 00004143-01C0103F-000007FF-00000000
CPUID 00000005: 00000040-00000040-00000000-00000000
CPUID 80000000: 80000008-00000000-00000000-00000000
CPUID 80000001: 00000000-00000000-00000001-20100000
CPUID 80000002: 20202020-20202020-20202020-20202020
CPUID 80000003: 6E492020-286C6574-58202952-286E6F65
CPUID 80000004: 20294D54-20555043-30342E33-007A4847
CPUID 80000005: 00000000-00000000-00000000-00000000
CPUID 80000006: 00000000-00000000-08006040-00000000
CPUID 80000007: 00000000-00000000-00000000-00000000
CPUID 80000008: 00003024-00000000-00000000-00000000

L1    Data Cache:     16 KB,  8-way Associative, 64-byte Line
L2 Unified Cache:   2048 KB,  8-way Associative, 64-byte Line

------[ Logical CPU #3 ]------

allcpu: Valid, Virtual

CPUID 00000000: 00000005-756E6547-6C65746E-49656E69
CPUID 00000001: 00000F4A-07020800-0000649D-BFEBFBFF
CPUID 00000002: 605B5001-00000000-00000000-007D7040
CPUID 00000003: 00000000-00000000-00000000-00000000
CPUID 00000004: 00004121-01C0003F-0000001F-00000000
CPUID 00000004: 00004143-01C0103F-000007FF-00000000
CPUID 00000005: 00000040-00000040-00000000-00000000
CPUID 80000000: 80000008-00000000-00000000-00000000
CPUID 80000001: 00000000-00000000-00000001-20100000
CPUID 80000002: 20202020-20202020-20202020-20202020
CPUID 80000003: 6E492020-286C6574-58202952-286E6F65
CPUID 80000004: 20294D54-20555043-30342E33-007A4847
CPUID 80000005: 00000000-00000000-00000000-00000000
CPUID 80000006: 00000000-00000000-08006040-00000000
CPUID 80000007: 00000000-00000000-00000000-00000000
CPUID 80000008: 00003024-00000000-00000000-00000000

L1    Data Cache:     16 KB,  8-way Associative, 64-byte Line
L2 Unified Cache:   2048 KB,  8-way Associative, 64-byte Line

------[ MSR Registers ]------

MSR 00000017: 0002-0000-0000-0000 [PlatID = 0]
MSR 0000001B: 0000-0000-FEE0-0900
MSR 0000002A: 0000-0000-0000-0080
MSR 0000002C: 0000-0000-1102-0311
MSR 0000008B: 0000-0002-0000-0000
MSR 00000198: 0000-112D-0000-112D
MSR 00000199: 0000-0000-0000-112D
MSR 0000019A: 0000-0000-0000-0002
MSR 0000019B: 0000-0000-0000-0000
MSR 0000019C: 0000-0000-0000-0000
MSR 0000019D: 0000-0000-0000-0E21
MSR 000001A0: 0000-0000-20A5-0489
MSR 000001A1: 0000-0000-0007-112D

PerformanceFrequency = 3391570000

Tjmax Temperature = 0 Celsius
