------[ Versions ]------

Program Version : AIDA64 Engineer v5.97.4661 Beta
BenchDLL Version: 4.3.784-x32
Windows Version : Microsoft Windows 10 Pro 10.0.17711.1000 (64-bit)

------[ CPU Info ]------

CPU Type          : OctalCore Qualcomm Snapdragon 835, 1600 MHz
Instruction Set   : x86, MMX, SSE, SSE2, SSE3, SSSE3, SSE4.1, AES
CPUID Manufacturer: Virtual CPU
CPUID CPU Name    : Virtual CPU @ 2.20GHz
CPUID Revision    : 00000F4Ah
Platform ID       : 00h  (Unknown)
HTT / CMP Units   : 0 / 8
Max. NUMA Node    : 0

Tjmax Temperature    : 0 Celsius
HTC Temperature Limit: 0 Celsius

------[ Motherboard Info ]------

Motherboard ID      : <DMI>
Motherboard Model   : Lenovo Miix 630-12Q35

DMI MB Manufacturer : LENOVO
DMI MB Product      : LNVNB161216
DMI MB Version      : SDK0Q84437 WIN
DMI MB Serial       : HA0WVHND
DMI SYS Manufacturer: LENOVO
DMI SYS Product     : 81F1
DMI SYS Version     : Lenovo Miix 630-12Q35
DMI SYS Serial      : HA0WVHND
DMI BIOS Version    : 8WCN25WW


------[ Logical CPU #0 ]------

allcpu: Package 0 / Core 0 / Thread 0: Valid

CPUID 00000000: 0000000D-74726956-20555043-206C6175 [Virtual CPU ]
CPUID 00000001: 00000F4A-00080000-02880203-17808111
CPUID 00000002: 09030101-0070800D-00000000-00000000
CPUID 00000003: 00000000-00000000-00000000-00000000
CPUID 00000005: 00000000-00000000-00000000-00000000
CPUID 00000006: 00000000-00000000-00000000-00000000
CPUID 00000007: 00000000-00000000-00000000-00000000
CPUID 00000008: 00000000-00000000-00000000-00000000
CPUID 00000009: 00000000-00000000-00000000-00000000
CPUID 0000000A: 00000000-00000000-00000000-00000000
CPUID 0000000C: 00000000-00000000-00000000-00000000
CPUID 0000000D: 00000000-00000000-00000000-00000000 [SL 00] [x87]
CPUID 0000000D: 00000000-00000000-00000000-00000000 [SL 01] [SSE]
CPUID 80000000: 80000008-74726956-20555043-206C6175 [Virtual CPU ]
CPUID 80000001: 00000F4A-00000000-00000100-08100000
CPUID 80000002: 20202020-20202020-20202020-20202020 [                ]
CPUID 80000003: 20202020-20202020-69562020-61757472 [          Virtua]
CPUID 80000004: 5043206C-20402055-30322E32-007A4847 [l CPU @ 2.20GHz]
CPUID 80000005: 00000000-00000000-00000000-00000000
CPUID 80000006: 00000000-00000000-02006040-00000000
CPUID 80000007: 00000000-00000000-00000000-00000100
CPUID 80000008: 00002020-00000000-00003007-00000000

------[ Logical CPU #1 ]------

allcpu: Package 0 / Core 1 / Thread 0: Valid

CPUID 00000000: 0000000D-74726956-20555043-206C6175 [Virtual CPU ]
CPUID 00000001: 00000F4A-01080000-02880203-17808111
CPUID 00000002: 09030101-0070800D-00000000-00000000
CPUID 00000003: 00000000-00000000-00000000-00000000
CPUID 00000005: 00000000-00000000-00000000-00000000
CPUID 00000006: 00000000-00000000-00000000-00000000
CPUID 00000007: 00000000-00000000-00000000-00000000
CPUID 00000008: 00000000-00000000-00000000-00000000
CPUID 00000009: 00000000-00000000-00000000-00000000
CPUID 0000000A: 00000000-00000000-00000000-00000000
CPUID 0000000C: 00000000-00000000-00000000-00000000
CPUID 0000000D: 00000000-00000000-00000000-00000000 [SL 00] [x87]
CPUID 0000000D: 00000000-00000000-00000000-00000000 [SL 01] [SSE]
CPUID 80000000: 80000008-74726956-20555043-206C6175 [Virtual CPU ]
CPUID 80000001: 00000F4A-00000000-00000100-08100000
CPUID 80000002: 20202020-20202020-20202020-20202020 [                ]
CPUID 80000003: 20202020-20202020-69562020-61757472 [          Virtua]
CPUID 80000004: 5043206C-20402055-30322E32-007A4847 [l CPU @ 2.20GHz]
CPUID 80000005: 00000000-00000000-00000000-00000000
CPUID 80000006: 00000000-00000000-02006040-00000000
CPUID 80000007: 00000000-00000000-00000000-00000100
CPUID 80000008: 00002020-00000000-00003007-00000000

------[ Logical CPU #2 ]------

allcpu: Package 0 / Core 2 / Thread 0: Valid

CPUID 00000000: 0000000D-74726956-20555043-206C6175 [Virtual CPU ]
CPUID 00000001: 00000F4A-02080000-02880203-17808111
CPUID 00000002: 09030101-0070800D-00000000-00000000
CPUID 00000003: 00000000-00000000-00000000-00000000
CPUID 00000005: 00000000-00000000-00000000-00000000
CPUID 00000006: 00000000-00000000-00000000-00000000
CPUID 00000007: 00000000-00000000-00000000-00000000
CPUID 00000008: 00000000-00000000-00000000-00000000
CPUID 00000009: 00000000-00000000-00000000-00000000
CPUID 0000000A: 00000000-00000000-00000000-00000000
CPUID 0000000C: 00000000-00000000-00000000-00000000
CPUID 0000000D: 00000000-00000000-00000000-00000000 [SL 00] [x87]
CPUID 0000000D: 00000000-00000000-00000000-00000000 [SL 01] [SSE]
CPUID 80000000: 80000008-74726956-20555043-206C6175 [Virtual CPU ]
CPUID 80000001: 00000F4A-00000000-00000100-08100000
CPUID 80000002: 20202020-20202020-20202020-20202020 [                ]
CPUID 80000003: 20202020-20202020-69562020-61757472 [          Virtua]
CPUID 80000004: 5043206C-20402055-30322E32-007A4847 [l CPU @ 2.20GHz]
CPUID 80000005: 00000000-00000000-00000000-00000000
CPUID 80000006: 00000000-00000000-02006040-00000000
CPUID 80000007: 00000000-00000000-00000000-00000100
CPUID 80000008: 00002020-00000000-00003007-00000000

------[ Logical CPU #3 ]------

allcpu: Package 0 / Core 3 / Thread 0: Valid

CPUID 00000000: 0000000D-74726956-20555043-206C6175 [Virtual CPU ]
CPUID 00000001: 00000F4A-03080000-02880203-17808111
CPUID 00000002: 09030101-0070800D-00000000-00000000
CPUID 00000003: 00000000-00000000-00000000-00000000
CPUID 00000005: 00000000-00000000-00000000-00000000
CPUID 00000006: 00000000-00000000-00000000-00000000
CPUID 00000007: 00000000-00000000-00000000-00000000
CPUID 00000008: 00000000-00000000-00000000-00000000
CPUID 00000009: 00000000-00000000-00000000-00000000
CPUID 0000000A: 00000000-00000000-00000000-00000000
CPUID 0000000C: 00000000-00000000-00000000-00000000
CPUID 0000000D: 00000000-00000000-00000000-00000000 [SL 00] [x87]
CPUID 0000000D: 00000000-00000000-00000000-00000000 [SL 01] [SSE]
CPUID 80000000: 80000008-74726956-20555043-206C6175 [Virtual CPU ]
CPUID 80000001: 00000F4A-00000000-00000100-08100000
CPUID 80000002: 20202020-20202020-20202020-20202020 [                ]
CPUID 80000003: 20202020-20202020-69562020-61757472 [          Virtua]
CPUID 80000004: 5043206C-20402055-30322E32-007A4847 [l CPU @ 2.20GHz]
CPUID 80000005: 00000000-00000000-00000000-00000000
CPUID 80000006: 00000000-00000000-02006040-00000000
CPUID 80000007: 00000000-00000000-00000000-00000100
CPUID 80000008: 00002020-00000000-00003007-00000000

------[ Logical CPU #4 ]------

allcpu: Package 0 / Core 4 / Thread 0: Valid

CPUID 00000000: 0000000D-74726956-20555043-206C6175 [Virtual CPU ]
CPUID 00000001: 00000F4A-04080000-02880203-17808111
CPUID 00000002: 09030101-0070800D-00000000-00000000
CPUID 00000003: 00000000-00000000-00000000-00000000
CPUID 00000005: 00000000-00000000-00000000-00000000
CPUID 00000006: 00000000-00000000-00000000-00000000
CPUID 00000007: 00000000-00000000-00000000-00000000
CPUID 00000008: 00000000-00000000-00000000-00000000
CPUID 00000009: 00000000-00000000-00000000-00000000
CPUID 0000000A: 00000000-00000000-00000000-00000000
CPUID 0000000C: 00000000-00000000-00000000-00000000
CPUID 0000000D: 00000000-00000000-00000000-00000000 [SL 00] [x87]
CPUID 0000000D: 00000000-00000000-00000000-00000000 [SL 01] [SSE]
CPUID 80000000: 80000008-74726956-20555043-206C6175 [Virtual CPU ]
CPUID 80000001: 00000F4A-00000000-00000100-08100000
CPUID 80000002: 20202020-20202020-20202020-20202020 [                ]
CPUID 80000003: 20202020-20202020-69562020-61757472 [          Virtua]
CPUID 80000004: 5043206C-20402055-30322E32-007A4847 [l CPU @ 2.20GHz]
CPUID 80000005: 00000000-00000000-00000000-00000000
CPUID 80000006: 00000000-00000000-02006040-00000000
CPUID 80000007: 00000000-00000000-00000000-00000100
CPUID 80000008: 00002020-00000000-00003007-00000000

------[ Logical CPU #5 ]------

allcpu: Package 0 / Core 5 / Thread 0: Valid

CPUID 00000000: 0000000D-74726956-20555043-206C6175 [Virtual CPU ]
CPUID 00000001: 00000F4A-05080000-02880203-17808111
CPUID 00000002: 09030101-0070800D-00000000-00000000
CPUID 00000003: 00000000-00000000-00000000-00000000
CPUID 00000005: 00000000-00000000-00000000-00000000
CPUID 00000006: 00000000-00000000-00000000-00000000
CPUID 00000007: 00000000-00000000-00000000-00000000
CPUID 00000008: 00000000-00000000-00000000-00000000
CPUID 00000009: 00000000-00000000-00000000-00000000
CPUID 0000000A: 00000000-00000000-00000000-00000000
CPUID 0000000C: 00000000-00000000-00000000-00000000
CPUID 0000000D: 00000000-00000000-00000000-00000000 [SL 00] [x87]
CPUID 0000000D: 00000000-00000000-00000000-00000000 [SL 01] [SSE]
CPUID 80000000: 80000008-74726956-20555043-206C6175 [Virtual CPU ]
CPUID 80000001: 00000F4A-00000000-00000100-08100000
CPUID 80000002: 20202020-20202020-20202020-20202020 [                ]
CPUID 80000003: 20202020-20202020-69562020-61757472 [          Virtua]
CPUID 80000004: 5043206C-20402055-30322E32-007A4847 [l CPU @ 2.20GHz]
CPUID 80000005: 00000000-00000000-00000000-00000000
CPUID 80000006: 00000000-00000000-02006040-00000000
CPUID 80000007: 00000000-00000000-00000000-00000100
CPUID 80000008: 00002020-00000000-00003007-00000000

------[ Logical CPU #6 ]------

allcpu: Package 0 / Core 6 / Thread 0: Valid

CPUID 00000000: 0000000D-74726956-20555043-206C6175 [Virtual CPU ]
CPUID 00000001: 00000F4A-06080000-02880203-17808111
CPUID 00000002: 09030101-0070800D-00000000-00000000
CPUID 00000003: 00000000-00000000-00000000-00000000
CPUID 00000005: 00000000-00000000-00000000-00000000
CPUID 00000006: 00000000-00000000-00000000-00000000
CPUID 00000007: 00000000-00000000-00000000-00000000
CPUID 00000008: 00000000-00000000-00000000-00000000
CPUID 00000009: 00000000-00000000-00000000-00000000
CPUID 0000000A: 00000000-00000000-00000000-00000000
CPUID 0000000C: 00000000-00000000-00000000-00000000
CPUID 0000000D: 00000000-00000000-00000000-00000000 [SL 00] [x87]
CPUID 0000000D: 00000000-00000000-00000000-00000000 [SL 01] [SSE]
CPUID 80000000: 80000008-74726956-20555043-206C6175 [Virtual CPU ]
CPUID 80000001: 00000F4A-00000000-00000100-08100000
CPUID 80000002: 20202020-20202020-20202020-20202020 [                ]
CPUID 80000003: 20202020-20202020-69562020-61757472 [          Virtua]
CPUID 80000004: 5043206C-20402055-30322E32-007A4847 [l CPU @ 2.20GHz]
CPUID 80000005: 00000000-00000000-00000000-00000000
CPUID 80000006: 00000000-00000000-02006040-00000000
CPUID 80000007: 00000000-00000000-00000000-00000100
CPUID 80000008: 00002020-00000000-00003007-00000000

------[ Logical CPU #7 ]------

allcpu: Package 0 / Core 7 / Thread 0: Valid

CPUID 00000000: 0000000D-74726956-20555043-206C6175 [Virtual CPU ]
CPUID 00000001: 00000F4A-07080000-02880203-17808111
CPUID 00000002: 09030101-0070800D-00000000-00000000
CPUID 00000003: 00000000-00000000-00000000-00000000
CPUID 00000005: 00000000-00000000-00000000-00000000
CPUID 00000006: 00000000-00000000-00000000-00000000
CPUID 00000007: 00000000-00000000-00000000-00000000
CPUID 00000008: 00000000-00000000-00000000-00000000
CPUID 00000009: 00000000-00000000-00000000-00000000
CPUID 0000000A: 00000000-00000000-00000000-00000000
CPUID 0000000C: 00000000-00000000-00000000-00000000
CPUID 0000000D: 00000000-00000000-00000000-00000000 [SL 00] [x87]
CPUID 0000000D: 00000000-00000000-00000000-00000000 [SL 01] [SSE]
CPUID 80000000: 80000008-74726956-20555043-206C6175 [Virtual CPU ]
CPUID 80000001: 00000F4A-00000000-00000100-08100000
CPUID 80000002: 20202020-20202020-20202020-20202020 [                ]
CPUID 80000003: 20202020-20202020-69562020-61757472 [          Virtua]
CPUID 80000004: 5043206C-20402055-30322E32-007A4847 [l CPU @ 2.20GHz]
CPUID 80000005: 00000000-00000000-00000000-00000000
CPUID 80000006: 00000000-00000000-02006040-00000000
CPUID 80000007: 00000000-00000000-00000000-00000100
CPUID 80000008: 00002020-00000000-00003007-00000000

------[ All CPUs ]------

CPU   0: APICID    0 / Package 0 / Core   0 / Thread 0: Valid
CPU   1: APICID    1 / Package 0 / Core   1 / Thread 0: Valid
CPU   2: APICID    2 / Package 0 / Core   2 / Thread 0: Valid
CPU   3: APICID    3 / Package 0 / Core   3 / Thread 0: Valid
CPU   4: APICID    4 / Package 0 / Core   4 / Thread 0: Valid
CPU   5: APICID    5 / Package 0 / Core   5 / Thread 0: Valid
CPU   6: APICID    6 / Package 0 / Core   6 / Thread 0: Valid
CPU   7: APICID    7 / Package 0 / Core   7 / Thread 0: Valid

------[ MSR Registers ]------


PerformanceFrequency = 19200000

CPU Clock M.Method = 12  (Classic)
PM Timer Address   = <unknown>

APIC Clock =   0.00 MHz  (AT = 0 / TT = 0 / try = 0 / SKL = 0.00 MHz)
APIC Clock =   0.00 MHz  (AT = 0 / TT = 0 / try = 0 / SKL = 0.00 MHz)
APIC Clock =   0.00 MHz  (AT = 0 / TT = 0 / try = 0 / SKL = 0.00 MHz)
APIC Clock =   0.00 MHz  (AT = 0 / TT = 0 / try = 0 / SKL = 0.00 MHz)
APIC Clock =   0.00 MHz  (AT = 0 / TT = 0 / try = 0 / SKL = 0.00 MHz)

CPU Clock = 1594.44 MHz / TSC Clock = 1594.44 MHz / CPU Mul =  0.00x
CPU Clock = 1594.70 MHz / TSC Clock = 1594.70 MHz / CPU Mul =  0.00x
CPU Clock = 1592.53 MHz / TSC Clock = 1592.53 MHz / CPU Mul =  0.00x
CPU Clock = 1592.53 MHz / TSC Clock = 1592.53 MHz / CPU Mul =  0.00x
CPU Clock = 1592.42 MHz / TSC Clock = 1592.42 MHz / CPU Mul =  0.00x

CPU Clock Max = 1590.59 MHz / TSC Clock = 1590.59 MHz / CPU Mul =  0.00x
CPU Clock Max = 1592.08 MHz / TSC Clock = 1592.08 MHz / CPU Mul =  0.00x
CPU Clock Max = 1594.41 MHz / TSC Clock = 1594.41 MHz / CPU Mul =  0.00x
CPU Clock Max = 1594.46 MHz / TSC Clock = 1594.46 MHz / CPU Mul =  0.00x
CPU Clock Max = 1592.49 MHz / TSC Clock = 1592.49 MHz / CPU Mul =  0.00x
