CPU#000 AffMask: 0x0000000000000001 
CPUID 00000000: 0000000D-68747541-444D4163-69746E65 [AuthenticAMD]
CPUID 00000001: 00600F01-00080800-02982203-17888111 
CPUID 00000002: 09030101-0070800D-00000000-00000000 
CPUID 00000003: 00000000-00000000-00000000-00000000 
CPUID 00000005: 00000000-00000000-00000000-00000000 
CPUID 00000006: 00000000-00000000-00000000-00000000 
CPUID 00000007: 00000000-00000000-00000000-00000000 [SL 00]
CPUID 00000008: 00000000-00000000-00000000-00000000 
CPUID 00000009: 00000000-00000000-00000000-00000000 
CPUID 0000000A: 00000000-00000000-00000000-00000000 
CPUID 0000000B: 00000000-00000000-00000000-00000000 [SL 00]
CPUID 0000000B: 00000000-00000000-00000000-00000000 [SL 01]
CPUID 0000000C: 00000000-00000000-00000000-00000000 
CPUID 0000000D: 00000000-00000000-00000000-00000000 [SL 00] [X87]
CPUID 0000000D: 00000000-00000000-00000000-00000000 [SL 01] [SSE]
CPUID 80000000: 80000008-68747541-444D4163-69746E65 [AuthenticAMD]
CPUID 80000001: 00600F01-00000000-00000101-28100800 
CPUID 80000002: 20202020-20202020-20202020-20202020 [                ]
CPUID 80000003: 20202020-20202020-69562020-61757472 [          Virtua]
CPUID 80000004: 5043206C-20402055-34322E33-007A4847 [l CPU @ 3.24GHz]
CPUID 80000005: 00000000-00000000-20040140-20020140 [L1D 32 KiB L1I 32 KiB]
CPUID 80000006: 00000000-00000000-02006040-00000000 [L2 512 KiB]
CPUID 80000007: 00000000-00000000-00000000-00000100 
CPUID 80000008: 00002020-00000000-00003007-00000000 

CPU#001 AffMask: 0x0000000000000002 
CPUID 00000000: 0000000D-68747541-444D4163-69746E65 [AuthenticAMD]
CPUID 00000001: 00600F01-01080800-02982203-17888111 
CPUID 00000002: 09030101-0070800D-00000000-00000000 
CPUID 00000003: 00000000-00000000-00000000-00000000 
CPUID 00000005: 00000000-00000000-00000000-00000000 
CPUID 00000006: 00000000-00000000-00000000-00000000 
CPUID 00000007: 00000000-00000000-00000000-00000000 [SL 00]
CPUID 00000008: 00000000-00000000-00000000-00000000 
CPUID 00000009: 00000000-00000000-00000000-00000000 
CPUID 0000000A: 00000000-00000000-00000000-00000000 
CPUID 0000000B: 00000000-00000000-00000000-00000000 [SL 00]
CPUID 0000000B: 00000000-00000000-00000000-00000000 [SL 01]
CPUID 0000000C: 00000000-00000000-00000000-00000000 
CPUID 0000000D: 00000000-00000000-00000000-00000000 [SL 00] [X87]
CPUID 0000000D: 00000000-00000000-00000000-00000000 [SL 01] [SSE]
CPUID 80000000: 80000008-68747541-444D4163-69746E65 [AuthenticAMD]
CPUID 80000001: 00600F01-00000000-00000101-28100800 
CPUID 80000002: 20202020-20202020-20202020-20202020 [                ]
CPUID 80000003: 20202020-20202020-69562020-61757472 [          Virtua]
CPUID 80000004: 5043206C-20402055-34322E33-007A4847 [l CPU @ 3.24GHz]
CPUID 80000005: 00000000-00000000-20040140-20020140 [L1D 32 KiB L1I 32 KiB]
CPUID 80000006: 00000000-00000000-02006040-00000000 [L2 512 KiB]
CPUID 80000007: 00000000-00000000-00000000-00000100 
CPUID 80000008: 00002020-00000000-00003007-00000000 

CPU#002 AffMask: 0x0000000000000004 
CPUID 00000000: 0000000D-68747541-444D4163-69746E65 [AuthenticAMD]
CPUID 00000001: 00600F01-02080800-02982203-17888111 
CPUID 00000002: 09030101-0070800D-00000000-00000000 
CPUID 00000003: 00000000-00000000-00000000-00000000 
CPUID 00000005: 00000000-00000000-00000000-00000000 
CPUID 00000006: 00000000-00000000-00000000-00000000 
CPUID 00000007: 00000000-00000000-00000000-00000000 [SL 00]
CPUID 00000008: 00000000-00000000-00000000-00000000 
CPUID 00000009: 00000000-00000000-00000000-00000000 
CPUID 0000000A: 00000000-00000000-00000000-00000000 
CPUID 0000000B: 00000000-00000000-00000000-00000000 [SL 00]
CPUID 0000000B: 00000000-00000000-00000000-00000000 [SL 01]
CPUID 0000000C: 00000000-00000000-00000000-00000000 
CPUID 0000000D: 00000000-00000000-00000000-00000000 [SL 00] [X87]
CPUID 0000000D: 00000000-00000000-00000000-00000000 [SL 01] [SSE]
CPUID 80000000: 80000008-68747541-444D4163-69746E65 [AuthenticAMD]
CPUID 80000001: 00600F01-00000000-00000101-28100800 
CPUID 80000002: 20202020-20202020-20202020-20202020 [                ]
CPUID 80000003: 20202020-20202020-69562020-61757472 [          Virtua]
CPUID 80000004: 5043206C-20402055-34322E33-007A4847 [l CPU @ 3.24GHz]
CPUID 80000005: 00000000-00000000-20040140-20020140 [L1D 32 KiB L1I 32 KiB]
CPUID 80000006: 00000000-00000000-02006040-00000000 [L2 512 KiB]
CPUID 80000007: 00000000-00000000-00000000-00000100 
CPUID 80000008: 00002020-00000000-00003007-00000000 

CPU#003 AffMask: 0x0000000000000008 
CPUID 00000000: 0000000D-68747541-444D4163-69746E65 [AuthenticAMD]
CPUID 00000001: 00600F01-03080800-02982203-17888111 
CPUID 00000002: 09030101-0070800D-00000000-00000000 
CPUID 00000003: 00000000-00000000-00000000-00000000 
CPUID 00000005: 00000000-00000000-00000000-00000000 
CPUID 00000006: 00000000-00000000-00000000-00000000 
CPUID 00000007: 00000000-00000000-00000000-00000000 [SL 00]
CPUID 00000008: 00000000-00000000-00000000-00000000 
CPUID 00000009: 00000000-00000000-00000000-00000000 
CPUID 0000000A: 00000000-00000000-00000000-00000000 
CPUID 0000000B: 00000000-00000000-00000000-00000000 [SL 00]
CPUID 0000000B: 00000000-00000000-00000000-00000000 [SL 01]
CPUID 0000000C: 00000000-00000000-00000000-00000000 
CPUID 0000000D: 00000000-00000000-00000000-00000000 [SL 00] [X87]
CPUID 0000000D: 00000000-00000000-00000000-00000000 [SL 01] [SSE]
CPUID 80000000: 80000008-68747541-444D4163-69746E65 [AuthenticAMD]
CPUID 80000001: 00600F01-00000000-00000101-28100800 
CPUID 80000002: 20202020-20202020-20202020-20202020 [                ]
CPUID 80000003: 20202020-20202020-69562020-61757472 [          Virtua]
CPUID 80000004: 5043206C-20402055-34322E33-007A4847 [l CPU @ 3.24GHz]
CPUID 80000005: 00000000-00000000-20040140-20020140 [L1D 32 KiB L1I 32 KiB]
CPUID 80000006: 00000000-00000000-02006040-00000000 [L2 512 KiB]
CPUID 80000007: 00000000-00000000-00000000-00000100 
CPUID 80000008: 00002020-00000000-00003007-00000000 

CPU#004 AffMask: 0x0000000000000010 
CPUID 00000000: 0000000D-68747541-444D4163-69746E65 [AuthenticAMD]
CPUID 00000001: 00600F01-04080800-02982203-17888111 
CPUID 00000002: 09030101-0070800D-00000000-00000000 
CPUID 00000003: 00000000-00000000-00000000-00000000 
CPUID 00000005: 00000000-00000000-00000000-00000000 
CPUID 00000006: 00000000-00000000-00000000-00000000 
CPUID 00000007: 00000000-00000000-00000000-00000000 [SL 00]
CPUID 00000008: 00000000-00000000-00000000-00000000 
CPUID 00000009: 00000000-00000000-00000000-00000000 
CPUID 0000000A: 00000000-00000000-00000000-00000000 
CPUID 0000000B: 00000000-00000000-00000000-00000000 [SL 00]
CPUID 0000000B: 00000000-00000000-00000000-00000000 [SL 01]
CPUID 0000000C: 00000000-00000000-00000000-00000000 
CPUID 0000000D: 00000000-00000000-00000000-00000000 [SL 00] [X87]
CPUID 0000000D: 00000000-00000000-00000000-00000000 [SL 01] [SSE]
CPUID 80000000: 80000008-68747541-444D4163-69746E65 [AuthenticAMD]
CPUID 80000001: 00600F01-00000000-00000101-28100800 
CPUID 80000002: 20202020-20202020-20202020-20202020 [                ]
CPUID 80000003: 20202020-20202020-69562020-61757472 [          Virtua]
CPUID 80000004: 5043206C-20402055-34322E33-007A4847 [l CPU @ 3.24GHz]
CPUID 80000005: 00000000-00000000-20040140-20020140 [L1D 32 KiB L1I 32 KiB]
CPUID 80000006: 00000000-00000000-02006040-00000000 [L2 512 KiB]
CPUID 80000007: 00000000-00000000-00000000-00000100 
CPUID 80000008: 00002020-00000000-00003007-00000000 

CPU#005 AffMask: 0x0000000000000020 
CPUID 00000000: 0000000D-68747541-444D4163-69746E65 [AuthenticAMD]
CPUID 00000001: 00600F01-05080800-02982203-17888111 
CPUID 00000002: 09030101-0070800D-00000000-00000000 
CPUID 00000003: 00000000-00000000-00000000-00000000 
CPUID 00000005: 00000000-00000000-00000000-00000000 
CPUID 00000006: 00000000-00000000-00000000-00000000 
CPUID 00000007: 00000000-00000000-00000000-00000000 [SL 00]
CPUID 00000008: 00000000-00000000-00000000-00000000 
CPUID 00000009: 00000000-00000000-00000000-00000000 
CPUID 0000000A: 00000000-00000000-00000000-00000000 
CPUID 0000000B: 00000000-00000000-00000000-00000000 [SL 00]
CPUID 0000000B: 00000000-00000000-00000000-00000000 [SL 01]
CPUID 0000000C: 00000000-00000000-00000000-00000000 
CPUID 0000000D: 00000000-00000000-00000000-00000000 [SL 00] [X87]
CPUID 0000000D: 00000000-00000000-00000000-00000000 [SL 01] [SSE]
CPUID 80000000: 80000008-68747541-444D4163-69746E65 [AuthenticAMD]
CPUID 80000001: 00600F01-00000000-00000101-28100800 
CPUID 80000002: 20202020-20202020-20202020-20202020 [                ]
CPUID 80000003: 20202020-20202020-69562020-61757472 [          Virtua]
CPUID 80000004: 5043206C-20402055-34322E33-007A4847 [l CPU @ 3.24GHz]
CPUID 80000005: 00000000-00000000-20040140-20020140 [L1D 32 KiB L1I 32 KiB]
CPUID 80000006: 00000000-00000000-02006040-00000000 [L2 512 KiB]
CPUID 80000007: 00000000-00000000-00000000-00000100 
CPUID 80000008: 00002020-00000000-00003007-00000000 

CPU#006 AffMask: 0x0000000000000040 
CPUID 00000000: 0000000D-68747541-444D4163-69746E65 [AuthenticAMD]
CPUID 00000001: 00600F01-06080800-02982203-17888111 
CPUID 00000002: 09030101-0070800D-00000000-00000000 
CPUID 00000003: 00000000-00000000-00000000-00000000 
CPUID 00000005: 00000000-00000000-00000000-00000000 
CPUID 00000006: 00000000-00000000-00000000-00000000 
CPUID 00000007: 00000000-00000000-00000000-00000000 [SL 00]
CPUID 00000008: 00000000-00000000-00000000-00000000 
CPUID 00000009: 00000000-00000000-00000000-00000000 
CPUID 0000000A: 00000000-00000000-00000000-00000000 
CPUID 0000000B: 00000000-00000000-00000000-00000000 [SL 00]
CPUID 0000000B: 00000000-00000000-00000000-00000000 [SL 01]
CPUID 0000000C: 00000000-00000000-00000000-00000000 
CPUID 0000000D: 00000000-00000000-00000000-00000000 [SL 00] [X87]
CPUID 0000000D: 00000000-00000000-00000000-00000000 [SL 01] [SSE]
CPUID 80000000: 80000008-68747541-444D4163-69746E65 [AuthenticAMD]
CPUID 80000001: 00600F01-00000000-00000101-28100800 
CPUID 80000002: 20202020-20202020-20202020-20202020 [                ]
CPUID 80000003: 20202020-20202020-69562020-61757472 [          Virtua]
CPUID 80000004: 5043206C-20402055-34322E33-007A4847 [l CPU @ 3.24GHz]
CPUID 80000005: 00000000-00000000-20040140-20020140 [L1D 32 KiB L1I 32 KiB]
CPUID 80000006: 00000000-00000000-02006040-00000000 [L2 512 KiB]
CPUID 80000007: 00000000-00000000-00000000-00000100 
CPUID 80000008: 00002020-00000000-00003007-00000000 

CPU#007 AffMask: 0x0000000000000080 
CPUID 00000000: 0000000D-68747541-444D4163-69746E65 [AuthenticAMD]
CPUID 00000001: 00600F01-07080800-02982203-17888111 
CPUID 00000002: 09030101-0070800D-00000000-00000000 
CPUID 00000003: 00000000-00000000-00000000-00000000 
CPUID 00000005: 00000000-00000000-00000000-00000000 
CPUID 00000006: 00000000-00000000-00000000-00000000 
CPUID 00000007: 00000000-00000000-00000000-00000000 [SL 00]
CPUID 00000008: 00000000-00000000-00000000-00000000 
CPUID 00000009: 00000000-00000000-00000000-00000000 
CPUID 0000000A: 00000000-00000000-00000000-00000000 
CPUID 0000000B: 00000000-00000000-00000000-00000000 [SL 00]
CPUID 0000000B: 00000000-00000000-00000000-00000000 [SL 01]
CPUID 0000000C: 00000000-00000000-00000000-00000000 
CPUID 0000000D: 00000000-00000000-00000000-00000000 [SL 00] [X87]
CPUID 0000000D: 00000000-00000000-00000000-00000000 [SL 01] [SSE]
CPUID 80000000: 80000008-68747541-444D4163-69746E65 [AuthenticAMD]
CPUID 80000001: 00600F01-00000000-00000101-28100800 
CPUID 80000002: 20202020-20202020-20202020-20202020 [                ]
CPUID 80000003: 20202020-20202020-69562020-61757472 [          Virtua]
CPUID 80000004: 5043206C-20402055-34322E33-007A4847 [l CPU @ 3.24GHz]
CPUID 80000005: 00000000-00000000-20040140-20020140 [L1D 32 KiB L1I 32 KiB]
CPUID 80000006: 00000000-00000000-02006040-00000000 [L2 512 KiB]
CPUID 80000007: 00000000-00000000-00000000-00000100 
CPUID 80000008: 00002020-00000000-00003007-00000000 
