CPU#000 AffMask: 0x00000001 
CPUID 00000000: 0000000D-74726956-20555043-206C6175 [Virtual CPU ]
CPUID 00000001: 00000F4A-00080000-02982203-17808111 
CPUID 00000002: 09030101-0070800D-00000000-00000000 
CPUID 00000003: 00000000-00000000-00000000-00000000 
CPUID 00000005: 00000000-00000000-00000000-00000000 
CPUID 00000006: 00000000-00000000-00000000-00000000 
CPUID 00000007: 00000000-00000000-00000000-00000000 [SL 00]
CPUID 00000008: 00000000-00000000-00000000-00000000 
CPUID 00000009: 00000000-00000000-00000000-00000000 
CPUID 0000000A: 00000000-00000000-00000000-00000000 
CPUID 0000000B: 00000000-00000000-00000000-00000000 [SL 00]
CPUID 0000000B: 00000000-00000000-00000000-00000000 [SL 01]
CPUID 0000000C: 00000000-00000000-00000000-00000000 
CPUID 0000000D: 00000000-00000000-00000000-00000000 [SL 00] [X87]
CPUID 0000000D: 00000000-00000000-00000000-00000000 [SL 01] [SSE]
CPUID 80000000: 80000008-74726956-20555043-206C6175 [Virtual CPU ]
CPUID 80000001: 00000F4A-00000000-00000101-28100000 
CPUID 80000002: 20202020-20202020-20202020-20202020 [                ]
CPUID 80000003: 20202020-20202020-69562020-61757472 [          Virtua]
CPUID 80000004: 5043206C-20402055-34322E33-007A4847 [l CPU @ 3.24GHz]
CPUID 80000005: 00000000-00000000-00000000-00000000 []
CPUID 80000006: 00000000-00000000-02006040-00000000 [L2 512 KiB]
CPUID 80000007: 00000000-00000000-00000000-00000100 
CPUID 80000008: 00002020-00000000-00003007-00000000 

CPU#001 AffMask: 0x00000002 
CPUID 00000000: 0000000D-74726956-20555043-206C6175 [Virtual CPU ]
CPUID 00000001: 00000F4A-01080000-02982203-17808111 
CPUID 00000002: 09030101-0070800D-00000000-00000000 
CPUID 00000003: 00000000-00000000-00000000-00000000 
CPUID 00000005: 00000000-00000000-00000000-00000000 
CPUID 00000006: 00000000-00000000-00000000-00000000 
CPUID 00000007: 00000000-00000000-00000000-00000000 [SL 00]
CPUID 00000008: 00000000-00000000-00000000-00000000 
CPUID 00000009: 00000000-00000000-00000000-00000000 
CPUID 0000000A: 00000000-00000000-00000000-00000000 
CPUID 0000000B: 00000000-00000000-00000000-00000000 [SL 00]
CPUID 0000000B: 00000000-00000000-00000000-00000000 [SL 01]
CPUID 0000000C: 00000000-00000000-00000000-00000000 
CPUID 0000000D: 00000000-00000000-00000000-00000000 [SL 00] [X87]
CPUID 0000000D: 00000000-00000000-00000000-00000000 [SL 01] [SSE]
CPUID 80000000: 80000008-74726956-20555043-206C6175 [Virtual CPU ]
CPUID 80000001: 00000F4A-00000000-00000101-28100000 
CPUID 80000002: 20202020-20202020-20202020-20202020 [                ]
CPUID 80000003: 20202020-20202020-69562020-61757472 [          Virtua]
CPUID 80000004: 5043206C-20402055-34322E33-007A4847 [l CPU @ 3.24GHz]
CPUID 80000005: 00000000-00000000-00000000-00000000 []
CPUID 80000006: 00000000-00000000-02006040-00000000 [L2 512 KiB]
CPUID 80000007: 00000000-00000000-00000000-00000100 
CPUID 80000008: 00002020-00000000-00003007-00000000 

CPU#002 AffMask: 0x00000004 
CPUID 00000000: 0000000D-74726956-20555043-206C6175 [Virtual CPU ]
CPUID 00000001: 00000F4A-02080000-02982203-17808111 
CPUID 00000002: 09030101-0070800D-00000000-00000000 
CPUID 00000003: 00000000-00000000-00000000-00000000 
CPUID 00000005: 00000000-00000000-00000000-00000000 
CPUID 00000006: 00000000-00000000-00000000-00000000 
CPUID 00000007: 00000000-00000000-00000000-00000000 [SL 00]
CPUID 00000008: 00000000-00000000-00000000-00000000 
CPUID 00000009: 00000000-00000000-00000000-00000000 
CPUID 0000000A: 00000000-00000000-00000000-00000000 
CPUID 0000000B: 00000000-00000000-00000000-00000000 [SL 00]
CPUID 0000000B: 00000000-00000000-00000000-00000000 [SL 01]
CPUID 0000000C: 00000000-00000000-00000000-00000000 
CPUID 0000000D: 00000000-00000000-00000000-00000000 [SL 00] [X87]
CPUID 0000000D: 00000000-00000000-00000000-00000000 [SL 01] [SSE]
CPUID 80000000: 80000008-74726956-20555043-206C6175 [Virtual CPU ]
CPUID 80000001: 00000F4A-00000000-00000101-28100000 
CPUID 80000002: 20202020-20202020-20202020-20202020 [                ]
CPUID 80000003: 20202020-20202020-69562020-61757472 [          Virtua]
CPUID 80000004: 5043206C-20402055-34322E33-007A4847 [l CPU @ 3.24GHz]
CPUID 80000005: 00000000-00000000-00000000-00000000 []
CPUID 80000006: 00000000-00000000-02006040-00000000 [L2 512 KiB]
CPUID 80000007: 00000000-00000000-00000000-00000100 
CPUID 80000008: 00002020-00000000-00003007-00000000 

CPU#003 AffMask: 0x00000008 
CPUID 00000000: 0000000D-74726956-20555043-206C6175 [Virtual CPU ]
CPUID 00000001: 00000F4A-03080000-02982203-17808111 
CPUID 00000002: 09030101-0070800D-00000000-00000000 
CPUID 00000003: 00000000-00000000-00000000-00000000 
CPUID 00000005: 00000000-00000000-00000000-00000000 
CPUID 00000006: 00000000-00000000-00000000-00000000 
CPUID 00000007: 00000000-00000000-00000000-00000000 [SL 00]
CPUID 00000008: 00000000-00000000-00000000-00000000 
CPUID 00000009: 00000000-00000000-00000000-00000000 
CPUID 0000000A: 00000000-00000000-00000000-00000000 
CPUID 0000000B: 00000000-00000000-00000000-00000000 [SL 00]
CPUID 0000000B: 00000000-00000000-00000000-00000000 [SL 01]
CPUID 0000000C: 00000000-00000000-00000000-00000000 
CPUID 0000000D: 00000000-00000000-00000000-00000000 [SL 00] [X87]
CPUID 0000000D: 00000000-00000000-00000000-00000000 [SL 01] [SSE]
CPUID 80000000: 80000008-74726956-20555043-206C6175 [Virtual CPU ]
CPUID 80000001: 00000F4A-00000000-00000101-28100000 
CPUID 80000002: 20202020-20202020-20202020-20202020 [                ]
CPUID 80000003: 20202020-20202020-69562020-61757472 [          Virtua]
CPUID 80000004: 5043206C-20402055-34322E33-007A4847 [l CPU @ 3.24GHz]
CPUID 80000005: 00000000-00000000-00000000-00000000 []
CPUID 80000006: 00000000-00000000-02006040-00000000 [L2 512 KiB]
CPUID 80000007: 00000000-00000000-00000000-00000100 
CPUID 80000008: 00002020-00000000-00003007-00000000 

CPU#004 AffMask: 0x00000010 
CPUID 00000000: 0000000D-74726956-20555043-206C6175 [Virtual CPU ]
CPUID 00000001: 00000F4A-04080000-02982203-17808111 
CPUID 00000002: 09030101-0070800D-00000000-00000000 
CPUID 00000003: 00000000-00000000-00000000-00000000 
CPUID 00000005: 00000000-00000000-00000000-00000000 
CPUID 00000006: 00000000-00000000-00000000-00000000 
CPUID 00000007: 00000000-00000000-00000000-00000000 [SL 00]
CPUID 00000008: 00000000-00000000-00000000-00000000 
CPUID 00000009: 00000000-00000000-00000000-00000000 
CPUID 0000000A: 00000000-00000000-00000000-00000000 
CPUID 0000000B: 00000000-00000000-00000000-00000000 [SL 00]
CPUID 0000000B: 00000000-00000000-00000000-00000000 [SL 01]
CPUID 0000000C: 00000000-00000000-00000000-00000000 
CPUID 0000000D: 00000000-00000000-00000000-00000000 [SL 00] [X87]
CPUID 0000000D: 00000000-00000000-00000000-00000000 [SL 01] [SSE]
CPUID 80000000: 80000008-74726956-20555043-206C6175 [Virtual CPU ]
CPUID 80000001: 00000F4A-00000000-00000101-28100000 
CPUID 80000002: 20202020-20202020-20202020-20202020 [                ]
CPUID 80000003: 20202020-20202020-69562020-61757472 [          Virtua]
CPUID 80000004: 5043206C-20402055-34322E33-007A4847 [l CPU @ 3.24GHz]
CPUID 80000005: 00000000-00000000-00000000-00000000 []
CPUID 80000006: 00000000-00000000-02006040-00000000 [L2 512 KiB]
CPUID 80000007: 00000000-00000000-00000000-00000100 
CPUID 80000008: 00002020-00000000-00003007-00000000 

CPU#005 AffMask: 0x00000020 
CPUID 00000000: 0000000D-74726956-20555043-206C6175 [Virtual CPU ]
CPUID 00000001: 00000F4A-05080000-02982203-17808111 
CPUID 00000002: 09030101-0070800D-00000000-00000000 
CPUID 00000003: 00000000-00000000-00000000-00000000 
CPUID 00000005: 00000000-00000000-00000000-00000000 
CPUID 00000006: 00000000-00000000-00000000-00000000 
CPUID 00000007: 00000000-00000000-00000000-00000000 [SL 00]
CPUID 00000008: 00000000-00000000-00000000-00000000 
CPUID 00000009: 00000000-00000000-00000000-00000000 
CPUID 0000000A: 00000000-00000000-00000000-00000000 
CPUID 0000000B: 00000000-00000000-00000000-00000000 [SL 00]
CPUID 0000000B: 00000000-00000000-00000000-00000000 [SL 01]
CPUID 0000000C: 00000000-00000000-00000000-00000000 
CPUID 0000000D: 00000000-00000000-00000000-00000000 [SL 00] [X87]
CPUID 0000000D: 00000000-00000000-00000000-00000000 [SL 01] [SSE]
CPUID 80000000: 80000008-74726956-20555043-206C6175 [Virtual CPU ]
CPUID 80000001: 00000F4A-00000000-00000101-28100000 
CPUID 80000002: 20202020-20202020-20202020-20202020 [                ]
CPUID 80000003: 20202020-20202020-69562020-61757472 [          Virtua]
CPUID 80000004: 5043206C-20402055-34322E33-007A4847 [l CPU @ 3.24GHz]
CPUID 80000005: 00000000-00000000-00000000-00000000 []
CPUID 80000006: 00000000-00000000-02006040-00000000 [L2 512 KiB]
CPUID 80000007: 00000000-00000000-00000000-00000100 
CPUID 80000008: 00002020-00000000-00003007-00000000 

CPU#006 AffMask: 0x00000040 
CPUID 00000000: 0000000D-74726956-20555043-206C6175 [Virtual CPU ]
CPUID 00000001: 00000F4A-06080000-02982203-17808111 
CPUID 00000002: 09030101-0070800D-00000000-00000000 
CPUID 00000003: 00000000-00000000-00000000-00000000 
CPUID 00000005: 00000000-00000000-00000000-00000000 
CPUID 00000006: 00000000-00000000-00000000-00000000 
CPUID 00000007: 00000000-00000000-00000000-00000000 [SL 00]
CPUID 00000008: 00000000-00000000-00000000-00000000 
CPUID 00000009: 00000000-00000000-00000000-00000000 
CPUID 0000000A: 00000000-00000000-00000000-00000000 
CPUID 0000000B: 00000000-00000000-00000000-00000000 [SL 00]
CPUID 0000000B: 00000000-00000000-00000000-00000000 [SL 01]
CPUID 0000000C: 00000000-00000000-00000000-00000000 
CPUID 0000000D: 00000000-00000000-00000000-00000000 [SL 00] [X87]
CPUID 0000000D: 00000000-00000000-00000000-00000000 [SL 01] [SSE]
CPUID 80000000: 80000008-74726956-20555043-206C6175 [Virtual CPU ]
CPUID 80000001: 00000F4A-00000000-00000101-28100000 
CPUID 80000002: 20202020-20202020-20202020-20202020 [                ]
CPUID 80000003: 20202020-20202020-69562020-61757472 [          Virtua]
CPUID 80000004: 5043206C-20402055-34322E33-007A4847 [l CPU @ 3.24GHz]
CPUID 80000005: 00000000-00000000-00000000-00000000 []
CPUID 80000006: 00000000-00000000-02006040-00000000 [L2 512 KiB]
CPUID 80000007: 00000000-00000000-00000000-00000100 
CPUID 80000008: 00002020-00000000-00003007-00000000 

CPU#007 AffMask: 0x00000080 
CPUID 00000000: 0000000D-74726956-20555043-206C6175 [Virtual CPU ]
CPUID 00000001: 00000F4A-07080000-02982203-17808111 
CPUID 00000002: 09030101-0070800D-00000000-00000000 
CPUID 00000003: 00000000-00000000-00000000-00000000 
CPUID 00000005: 00000000-00000000-00000000-00000000 
CPUID 00000006: 00000000-00000000-00000000-00000000 
CPUID 00000007: 00000000-00000000-00000000-00000000 [SL 00]
CPUID 00000008: 00000000-00000000-00000000-00000000 
CPUID 00000009: 00000000-00000000-00000000-00000000 
CPUID 0000000A: 00000000-00000000-00000000-00000000 
CPUID 0000000B: 00000000-00000000-00000000-00000000 [SL 00]
CPUID 0000000B: 00000000-00000000-00000000-00000000 [SL 01]
CPUID 0000000C: 00000000-00000000-00000000-00000000 
CPUID 0000000D: 00000000-00000000-00000000-00000000 [SL 00] [X87]
CPUID 0000000D: 00000000-00000000-00000000-00000000 [SL 01] [SSE]
CPUID 80000000: 80000008-74726956-20555043-206C6175 [Virtual CPU ]
CPUID 80000001: 00000F4A-00000000-00000101-28100000 
CPUID 80000002: 20202020-20202020-20202020-20202020 [                ]
CPUID 80000003: 20202020-20202020-69562020-61757472 [          Virtua]
CPUID 80000004: 5043206C-20402055-34322E33-007A4847 [l CPU @ 3.24GHz]
CPUID 80000005: 00000000-00000000-00000000-00000000 []
CPUID 80000006: 00000000-00000000-02006040-00000000 [L2 512 KiB]
CPUID 80000007: 00000000-00000000-00000000-00000100 
CPUID 80000008: 00002020-00000000-00003007-00000000 
