------[ Versions ]------

Program Version : AIDA64 Engineer v5.97.4661 Beta
BenchDLL Version: 4.3.784-x32
Windows Version : Microsoft Windows 10 Pro 10.0.16299.371 (32-bit)

------[ CPU Info ]------

CPU Type          : 4x , 1583 MHz
Instruction Set   : x86, MMX, SSE, SSE2, SSE3, SSSE3, SSE4.1, AES
CPUID Manufacturer: Virtual CPU
CPUID CPU Name    : Virtual CPU @ 2.20GHz
CPUID Revision    : 0001067Fh
Platform ID       : 00h  (Unknown)
HTT / CMP Units   : 8 / 0
Max. NUMA Node    : 0

Tjmax Temperature    : 0 Celsius
HTC Temperature Limit: 0 Celsius

------[ Motherboard Info ]------

Motherboard ID      : <DMI>
Motherboard Model   : Lenovo LNVNB161216

DMI MB Manufacturer : LENOVO
DMI MB Product      : LNVNB161216
DMI MB Version      : SDK0Q84437 WIN
DMI MB Serial       : HA0WVHND
DMI SYS Manufacturer: LENOVO
DMI SYS Product     : 81F1
DMI SYS Version     : Lenovo Miix 630-12Q35
DMI SYS Serial      : HA0WVHND
DMI BIOS Version    : 8WCN25WW


------[ Logical CPU #0 ]------

allcpu: Package 0 / Core 0 / Thread 0: Valid

CPUID 00000000: 00000003-74726956-20555043-206C6175 [Virtual CPU ]
CPUID 00000001: 0001067F-00080000-02880203-17808111
CPUID 00000002: 09030101-0070800D-00000000-00000000
CPUID 00000003: 00000000-00000000-00000000-00000000
CPUID 80000000: 80000007-00000000-00000000-00000000
CPUID 80000001: 00000000-00000000-00000000-00000000
CPUID 80000002: 20202020-20202020-20202020-20202020 [                ]
CPUID 80000003: 20202020-20202020-69562020-61757472 [          Virtua]
CPUID 80000004: 5043206C-20402055-30322E32-007A4847 [l CPU @ 2.20GHz]
CPUID 80000005: 00000000-00000000-00000000-00000000
CPUID 80000006: 00000000-00000000-02006040-00000000
CPUID 80000007: 00000000-00000000-00000000-00000100

------[ Logical CPU #1 ]------

allcpu: Package 0 / Core 0 / Thread 1: Valid, Virtual

CPUID 00000000: 00000003-74726956-20555043-206C6175 [Virtual CPU ]
CPUID 00000001: 0001067F-01080000-02880203-17808111
CPUID 00000002: 09030101-0070800D-00000000-00000000
CPUID 00000003: 00000000-00000000-00000000-00000000
CPUID 80000000: 80000007-00000000-00000000-00000000
CPUID 80000001: 00000000-00000000-00000000-00000000
CPUID 80000002: 20202020-20202020-20202020-20202020 [                ]
CPUID 80000003: 20202020-20202020-69562020-61757472 [          Virtua]
CPUID 80000004: 5043206C-20402055-30322E32-007A4847 [l CPU @ 2.20GHz]
CPUID 80000005: 00000000-00000000-00000000-00000000
CPUID 80000006: 00000000-00000000-02006040-00000000
CPUID 80000007: 00000000-00000000-00000000-00000100

------[ Logical CPU #2 ]------

allcpu: Package 1 / Core 0 / Thread 0: Valid

CPUID 00000000: 00000003-74726956-20555043-206C6175 [Virtual CPU ]
CPUID 00000001: 0001067F-02080000-02880203-17808111
CPUID 00000002: 09030101-0070800D-00000000-00000000
CPUID 00000003: 00000000-00000000-00000000-00000000
CPUID 80000000: 80000007-00000000-00000000-00000000
CPUID 80000001: 00000000-00000000-00000000-00000000
CPUID 80000002: 20202020-20202020-20202020-20202020 [                ]
CPUID 80000003: 20202020-20202020-69562020-61757472 [          Virtua]
CPUID 80000004: 5043206C-20402055-30322E32-007A4847 [l CPU @ 2.20GHz]
CPUID 80000005: 00000000-00000000-00000000-00000000
CPUID 80000006: 00000000-00000000-02006040-00000000
CPUID 80000007: 00000000-00000000-00000000-00000100

------[ Logical CPU #3 ]------

allcpu: Package 1 / Core 0 / Thread 1: Valid, Virtual

CPUID 00000000: 00000003-74726956-20555043-206C6175 [Virtual CPU ]
CPUID 00000001: 0001067F-03080000-02880203-17808111
CPUID 00000002: 09030101-0070800D-00000000-00000000
CPUID 00000003: 00000000-00000000-00000000-00000000
CPUID 80000000: 80000007-00000000-00000000-00000000
CPUID 80000001: 00000000-00000000-00000000-00000000
CPUID 80000002: 20202020-20202020-20202020-20202020 [                ]
CPUID 80000003: 20202020-20202020-69562020-61757472 [          Virtua]
CPUID 80000004: 5043206C-20402055-30322E32-007A4847 [l CPU @ 2.20GHz]
CPUID 80000005: 00000000-00000000-00000000-00000000
CPUID 80000006: 00000000-00000000-02006040-00000000
CPUID 80000007: 00000000-00000000-00000000-00000100

------[ Logical CPU #4 ]------

allcpu: Package 2 / Core 0 / Thread 0: Valid

CPUID 00000000: 00000003-74726956-20555043-206C6175 [Virtual CPU ]
CPUID 00000001: 0001067F-04080000-02880203-17808111
CPUID 00000002: 09030101-0070800D-00000000-00000000
CPUID 00000003: 00000000-00000000-00000000-00000000
CPUID 80000000: 80000007-00000000-00000000-00000000
CPUID 80000001: 00000000-00000000-00000000-00000000
CPUID 80000002: 20202020-20202020-20202020-20202020 [                ]
CPUID 80000003: 20202020-20202020-69562020-61757472 [          Virtua]
CPUID 80000004: 5043206C-20402055-30322E32-007A4847 [l CPU @ 2.20GHz]
CPUID 80000005: 00000000-00000000-00000000-00000000
CPUID 80000006: 00000000-00000000-02006040-00000000
CPUID 80000007: 00000000-00000000-00000000-00000100

------[ Logical CPU #5 ]------

allcpu: Package 2 / Core 0 / Thread 1: Valid, Virtual

CPUID 00000000: 00000003-74726956-20555043-206C6175 [Virtual CPU ]
CPUID 00000001: 0001067F-05080000-02880203-17808111
CPUID 00000002: 09030101-0070800D-00000000-00000000
CPUID 00000003: 00000000-00000000-00000000-00000000
CPUID 80000000: 80000007-00000000-00000000-00000000
CPUID 80000001: 00000000-00000000-00000000-00000000
CPUID 80000002: 20202020-20202020-20202020-20202020 [                ]
CPUID 80000003: 20202020-20202020-69562020-61757472 [          Virtua]
CPUID 80000004: 5043206C-20402055-30322E32-007A4847 [l CPU @ 2.20GHz]
CPUID 80000005: 00000000-00000000-00000000-00000000
CPUID 80000006: 00000000-00000000-02006040-00000000
CPUID 80000007: 00000000-00000000-00000000-00000100

------[ Logical CPU #6 ]------

allcpu: Package 3 / Core 0 / Thread 0: Valid

CPUID 00000000: 00000003-74726956-20555043-206C6175 [Virtual CPU ]
CPUID 00000001: 0001067F-06080000-02880203-17808111
CPUID 00000002: 09030101-0070800D-00000000-00000000
CPUID 00000003: 00000000-00000000-00000000-00000000
CPUID 80000000: 80000007-00000000-00000000-00000000
CPUID 80000001: 00000000-00000000-00000000-00000000
CPUID 80000002: 20202020-20202020-20202020-20202020 [                ]
CPUID 80000003: 20202020-20202020-69562020-61757472 [          Virtua]
CPUID 80000004: 5043206C-20402055-30322E32-007A4847 [l CPU @ 2.20GHz]
CPUID 80000005: 00000000-00000000-00000000-00000000
CPUID 80000006: 00000000-00000000-02006040-00000000
CPUID 80000007: 00000000-00000000-00000000-00000100

------[ Logical CPU #7 ]------

allcpu: Package 3 / Core 0 / Thread 1: Valid, Virtual

CPUID 00000000: 00000003-74726956-20555043-206C6175 [Virtual CPU ]
CPUID 00000001: 0001067F-07080000-02880203-17808111
CPUID 00000002: 09030101-0070800D-00000000-00000000
CPUID 00000003: 00000000-00000000-00000000-00000000
CPUID 80000000: 80000007-00000000-00000000-00000000
CPUID 80000001: 00000000-00000000-00000000-00000000
CPUID 80000002: 20202020-20202020-20202020-20202020 [                ]
CPUID 80000003: 20202020-20202020-69562020-61757472 [          Virtua]
CPUID 80000004: 5043206C-20402055-30322E32-007A4847 [l CPU @ 2.20GHz]
CPUID 80000005: 00000000-00000000-00000000-00000000
CPUID 80000006: 00000000-00000000-02006040-00000000
CPUID 80000007: 00000000-00000000-00000000-00000100

------[ All CPUs ]------

CPU   0: APICID    0 / Package 0 / Core   0 / Thread 0: Valid
CPU   1: APICID    1 / Package 0 / Core   0 / Thread 1: Valid, Virtual
CPU   2: APICID    2 / Package 1 / Core   0 / Thread 0: Valid
CPU   3: APICID    3 / Package 1 / Core   0 / Thread 1: Valid, Virtual
CPU   4: APICID    4 / Package 2 / Core   0 / Thread 0: Valid
CPU   5: APICID    5 / Package 2 / Core   0 / Thread 1: Valid, Virtual
CPU   6: APICID    6 / Package 3 / Core   0 / Thread 0: Valid
CPU   7: APICID    7 / Package 3 / Core   0 / Thread 1: Valid, Virtual

------[ MSR Registers ]------


PerformanceFrequency = 19200000

CPU Clock M.Method = 12  (Classic)
PM Timer Address   = <unknown>

APIC Clock =   0.00 MHz  (AT = 0 / TT = 0 / try = 0 / SKL = 0.00 MHz)
APIC Clock =   0.00 MHz  (AT = 0 / TT = 0 / try = 0 / SKL = 0.00 MHz)
APIC Clock =   0.00 MHz  (AT = 0 / TT = 0 / try = 0 / SKL = 0.00 MHz)
APIC Clock =   0.00 MHz  (AT = 0 / TT = 0 / try = 0 / SKL = 0.00 MHz)
APIC Clock =   0.00 MHz  (AT = 0 / TT = 0 / try = 0 / SKL = 0.00 MHz)

CPU Clock = 1592.69 MHz / TSC Clock = 1592.69 MHz / CPU Mul =  0.00x
CPU Clock = 1594.30 MHz / TSC Clock = 1594.30 MHz / CPU Mul =  0.00x
CPU Clock = 1594.59 MHz / TSC Clock = 1594.59 MHz / CPU Mul =  0.00x
CPU Clock = 1592.56 MHz / TSC Clock = 1592.56 MHz / CPU Mul =  0.00x
CPU Clock = 1592.61 MHz / TSC Clock = 1592.61 MHz / CPU Mul =  0.00x

CPU Clock Max = 1594.59 MHz / TSC Clock = 1594.59 MHz / CPU Mul =  0.00x
CPU Clock Max = 1594.52 MHz / TSC Clock = 1594.52 MHz / CPU Mul =  0.00x
CPU Clock Max = 1592.62 MHz / TSC Clock = 1592.62 MHz / CPU Mul =  0.00x
CPU Clock Max = 1592.57 MHz / TSC Clock = 1592.57 MHz / CPU Mul =  0.00x
CPU Clock Max = 1594.62 MHz / TSC Clock = 1594.62 MHz / CPU Mul =  0.00x
