------[ CPUID Registers / Logical CPU #0 ]------

allcpu: Package 0 / Core 0 / Thread 0: Valid

CPUID 00000000: 0000000D-74726956-20555043-206C6175 [Virtual CPU ]
CPUID 00000001: 00000F4A-00080000-02880203-17808111
CPUID 00000002: 09030101-0070800D-00000000-00000000
CPUID 00000003: 00000000-00000000-00000000-00000000
CPUID 00000005: 00000000-00000000-00000000-00000000
CPUID 00000006: 00000000-00000000-00000000-00000000
CPUID 00000007: 00000000-00000000-00000000-00000000
CPUID 00000008: 00000000-00000000-00000000-00000000
CPUID 00000009: 00000000-00000000-00000000-00000000
CPUID 0000000A: 00000000-00000000-00000000-00000000
CPUID 0000000C: 00000000-00000000-00000000-00000000
CPUID 0000000D: 00000000-00000000-00000000-00000000 [SL 00] [x87]
CPUID 0000000D: 00000000-00000000-00000000-00000000 [SL 01] [SSE]
CPUID 80000000: 80000008-74726956-20555043-206C6175 [Virtual CPU ]
CPUID 80000001: 00000F4A-00000000-00000100-08100000
CPUID 80000002: 20202020-20202020-20202020-20202020 [                ]
CPUID 80000003: 20202020-20202020-69562020-61757472 [          Virtua]
CPUID 80000004: 5043206C-20402055-34372E32-007A4847 [l CPU @ 2.74GHz]
CPUID 80000005: 00000000-00000000-00000000-00000000 [L1D: 0 KB / L1I: 0 KB]
CPUID 80000006: 00000000-00000000-02006040-00000000 [L2: 512 KB] / L3: 0 KB]
CPUID 80000007: 00000000-00000000-00000000-00000100
CPUID 80000008: 00002020-00000000-00003007-00000000

------[ CPUID Registers / Logical CPU #1 ]------

allcpu: Package 0 / Core 1 / Thread 0: Valid

CPUID 00000000: 0000000D-74726956-20555043-206C6175 [Virtual CPU ]
CPUID 00000001: 00000F4A-01080000-02880203-17808111
CPUID 00000002: 09030101-0070800D-00000000-00000000
CPUID 00000003: 00000000-00000000-00000000-00000000
CPUID 00000005: 00000000-00000000-00000000-00000000
CPUID 00000006: 00000000-00000000-00000000-00000000
CPUID 00000007: 00000000-00000000-00000000-00000000
CPUID 00000008: 00000000-00000000-00000000-00000000
CPUID 00000009: 00000000-00000000-00000000-00000000
CPUID 0000000A: 00000000-00000000-00000000-00000000
CPUID 0000000C: 00000000-00000000-00000000-00000000
CPUID 0000000D: 00000000-00000000-00000000-00000000 [SL 00] [x87]
CPUID 0000000D: 00000000-00000000-00000000-00000000 [SL 01] [SSE]
CPUID 80000000: 80000008-74726956-20555043-206C6175 [Virtual CPU ]
CPUID 80000001: 00000F4A-00000000-00000100-08100000
CPUID 80000002: 20202020-20202020-20202020-20202020 [                ]
CPUID 80000003: 20202020-20202020-69562020-61757472 [          Virtua]
CPUID 80000004: 5043206C-20402055-34372E32-007A4847 [l CPU @ 2.74GHz]
CPUID 80000005: 00000000-00000000-00000000-00000000 [L1D: 0 KB / L1I: 0 KB]
CPUID 80000006: 00000000-00000000-02006040-00000000 [L2: 512 KB] / L3: 0 KB]
CPUID 80000007: 00000000-00000000-00000000-00000100
CPUID 80000008: 00002020-00000000-00003007-00000000

------[ CPUID Registers / Logical CPU #2 ]------

allcpu: Package 0 / Core 2 / Thread 0: Valid

CPUID 00000000: 0000000D-74726956-20555043-206C6175 [Virtual CPU ]
CPUID 00000001: 00000F4A-02080000-02880203-17808111
CPUID 00000002: 09030101-0070800D-00000000-00000000
CPUID 00000003: 00000000-00000000-00000000-00000000
CPUID 00000005: 00000000-00000000-00000000-00000000
CPUID 00000006: 00000000-00000000-00000000-00000000
CPUID 00000007: 00000000-00000000-00000000-00000000
CPUID 00000008: 00000000-00000000-00000000-00000000
CPUID 00000009: 00000000-00000000-00000000-00000000
CPUID 0000000A: 00000000-00000000-00000000-00000000
CPUID 0000000C: 00000000-00000000-00000000-00000000
CPUID 0000000D: 00000000-00000000-00000000-00000000 [SL 00] [x87]
CPUID 0000000D: 00000000-00000000-00000000-00000000 [SL 01] [SSE]
CPUID 80000000: 80000008-74726956-20555043-206C6175 [Virtual CPU ]
CPUID 80000001: 00000F4A-00000000-00000100-08100000
CPUID 80000002: 20202020-20202020-20202020-20202020 [                ]
CPUID 80000003: 20202020-20202020-69562020-61757472 [          Virtua]
CPUID 80000004: 5043206C-20402055-34372E32-007A4847 [l CPU @ 2.74GHz]
CPUID 80000005: 00000000-00000000-00000000-00000000 [L1D: 0 KB / L1I: 0 KB]
CPUID 80000006: 00000000-00000000-02006040-00000000 [L2: 512 KB] / L3: 0 KB]
CPUID 80000007: 00000000-00000000-00000000-00000100
CPUID 80000008: 00002020-00000000-00003007-00000000

------[ CPUID Registers / Logical CPU #3 ]------

allcpu: Package 0 / Core 3 / Thread 0: Valid

CPUID 00000000: 0000000D-74726956-20555043-206C6175 [Virtual CPU ]
CPUID 00000001: 00000F4A-03080000-02880203-17808111
CPUID 00000002: 09030101-0070800D-00000000-00000000
CPUID 00000003: 00000000-00000000-00000000-00000000
CPUID 00000005: 00000000-00000000-00000000-00000000
CPUID 00000006: 00000000-00000000-00000000-00000000
CPUID 00000007: 00000000-00000000-00000000-00000000
CPUID 00000008: 00000000-00000000-00000000-00000000
CPUID 00000009: 00000000-00000000-00000000-00000000
CPUID 0000000A: 00000000-00000000-00000000-00000000
CPUID 0000000C: 00000000-00000000-00000000-00000000
CPUID 0000000D: 00000000-00000000-00000000-00000000 [SL 00] [x87]
CPUID 0000000D: 00000000-00000000-00000000-00000000 [SL 01] [SSE]
CPUID 80000000: 80000008-74726956-20555043-206C6175 [Virtual CPU ]
CPUID 80000001: 00000F4A-00000000-00000100-08100000
CPUID 80000002: 20202020-20202020-20202020-20202020 [                ]
CPUID 80000003: 20202020-20202020-69562020-61757472 [          Virtua]
CPUID 80000004: 5043206C-20402055-34372E32-007A4847 [l CPU @ 2.74GHz]
CPUID 80000005: 00000000-00000000-00000000-00000000 [L1D: 0 KB / L1I: 0 KB]
CPUID 80000006: 00000000-00000000-02006040-00000000 [L2: 512 KB] / L3: 0 KB]
CPUID 80000007: 00000000-00000000-00000000-00000100
CPUID 80000008: 00002020-00000000-00003007-00000000

------[ CPUID Registers / Logical CPU #4 ]------

allcpu: Package 0 / Core 4 / Thread 0: Valid

CPUID 00000000: 0000000D-74726956-20555043-206C6175 [Virtual CPU ]
CPUID 00000001: 00000F4A-04080000-02880203-17808111
CPUID 00000002: 09030101-0070800D-00000000-00000000
CPUID 00000003: 00000000-00000000-00000000-00000000
CPUID 00000005: 00000000-00000000-00000000-00000000
CPUID 00000006: 00000000-00000000-00000000-00000000
CPUID 00000007: 00000000-00000000-00000000-00000000
CPUID 00000008: 00000000-00000000-00000000-00000000
CPUID 00000009: 00000000-00000000-00000000-00000000
CPUID 0000000A: 00000000-00000000-00000000-00000000
CPUID 0000000C: 00000000-00000000-00000000-00000000
CPUID 0000000D: 00000000-00000000-00000000-00000000 [SL 00] [x87]
CPUID 0000000D: 00000000-00000000-00000000-00000000 [SL 01] [SSE]
CPUID 80000000: 80000008-74726956-20555043-206C6175 [Virtual CPU ]
CPUID 80000001: 00000F4A-00000000-00000100-08100000
CPUID 80000002: 20202020-20202020-20202020-20202020 [                ]
CPUID 80000003: 20202020-20202020-69562020-61757472 [          Virtua]
CPUID 80000004: 5043206C-20402055-34372E32-007A4847 [l CPU @ 2.74GHz]
CPUID 80000005: 00000000-00000000-00000000-00000000 [L1D: 0 KB / L1I: 0 KB]
CPUID 80000006: 00000000-00000000-02006040-00000000 [L2: 512 KB] / L3: 0 KB]
CPUID 80000007: 00000000-00000000-00000000-00000100
CPUID 80000008: 00002020-00000000-00003007-00000000

------[ CPUID Registers / Logical CPU #5 ]------

allcpu: Package 0 / Core 5 / Thread 0: Valid

CPUID 00000000: 0000000D-74726956-20555043-206C6175 [Virtual CPU ]
CPUID 00000001: 00000F4A-05080000-02880203-17808111
CPUID 00000002: 09030101-0070800D-00000000-00000000
CPUID 00000003: 00000000-00000000-00000000-00000000
CPUID 00000005: 00000000-00000000-00000000-00000000
CPUID 00000006: 00000000-00000000-00000000-00000000
CPUID 00000007: 00000000-00000000-00000000-00000000
CPUID 00000008: 00000000-00000000-00000000-00000000
CPUID 00000009: 00000000-00000000-00000000-00000000
CPUID 0000000A: 00000000-00000000-00000000-00000000
CPUID 0000000C: 00000000-00000000-00000000-00000000
CPUID 0000000D: 00000000-00000000-00000000-00000000 [SL 00] [x87]
CPUID 0000000D: 00000000-00000000-00000000-00000000 [SL 01] [SSE]
CPUID 80000000: 80000008-74726956-20555043-206C6175 [Virtual CPU ]
CPUID 80000001: 00000F4A-00000000-00000100-08100000
CPUID 80000002: 20202020-20202020-20202020-20202020 [                ]
CPUID 80000003: 20202020-20202020-69562020-61757472 [          Virtua]
CPUID 80000004: 5043206C-20402055-34372E32-007A4847 [l CPU @ 2.74GHz]
CPUID 80000005: 00000000-00000000-00000000-00000000 [L1D: 0 KB / L1I: 0 KB]
CPUID 80000006: 00000000-00000000-02006040-00000000 [L2: 512 KB] / L3: 0 KB]
CPUID 80000007: 00000000-00000000-00000000-00000100
CPUID 80000008: 00002020-00000000-00003007-00000000

------[ CPUID Registers / Logical CPU #6 ]------

allcpu: Package 0 / Core 6 / Thread 0: Valid

CPUID 00000000: 0000000D-74726956-20555043-206C6175 [Virtual CPU ]
CPUID 00000001: 00000F4A-06080000-02880203-17808111
CPUID 00000002: 09030101-0070800D-00000000-00000000
CPUID 00000003: 00000000-00000000-00000000-00000000
CPUID 00000005: 00000000-00000000-00000000-00000000
CPUID 00000006: 00000000-00000000-00000000-00000000
CPUID 00000007: 00000000-00000000-00000000-00000000
CPUID 00000008: 00000000-00000000-00000000-00000000
CPUID 00000009: 00000000-00000000-00000000-00000000
CPUID 0000000A: 00000000-00000000-00000000-00000000
CPUID 0000000C: 00000000-00000000-00000000-00000000
CPUID 0000000D: 00000000-00000000-00000000-00000000 [SL 00] [x87]
CPUID 0000000D: 00000000-00000000-00000000-00000000 [SL 01] [SSE]
CPUID 80000000: 80000008-74726956-20555043-206C6175 [Virtual CPU ]
CPUID 80000001: 00000F4A-00000000-00000100-08100000
CPUID 80000002: 20202020-20202020-20202020-20202020 [                ]
CPUID 80000003: 20202020-20202020-69562020-61757472 [          Virtua]
CPUID 80000004: 5043206C-20402055-34372E32-007A4847 [l CPU @ 2.74GHz]
CPUID 80000005: 00000000-00000000-00000000-00000000 [L1D: 0 KB / L1I: 0 KB]
CPUID 80000006: 00000000-00000000-02006040-00000000 [L2: 512 KB] / L3: 0 KB]
CPUID 80000007: 00000000-00000000-00000000-00000100
CPUID 80000008: 00002020-00000000-00003007-00000000

------[ CPUID Registers / Logical CPU #7 ]------

allcpu: Package 0 / Core 7 / Thread 0: Valid

CPUID 00000000: 0000000D-74726956-20555043-206C6175 [Virtual CPU ]
CPUID 00000001: 00000F4A-07080000-02880203-17808111
CPUID 00000002: 09030101-0070800D-00000000-00000000
CPUID 00000003: 00000000-00000000-00000000-00000000
CPUID 00000005: 00000000-00000000-00000000-00000000
CPUID 00000006: 00000000-00000000-00000000-00000000
CPUID 00000007: 00000000-00000000-00000000-00000000
CPUID 00000008: 00000000-00000000-00000000-00000000
CPUID 00000009: 00000000-00000000-00000000-00000000
CPUID 0000000A: 00000000-00000000-00000000-00000000
CPUID 0000000C: 00000000-00000000-00000000-00000000
CPUID 0000000D: 00000000-00000000-00000000-00000000 [SL 00] [x87]
CPUID 0000000D: 00000000-00000000-00000000-00000000 [SL 01] [SSE]
CPUID 80000000: 80000008-74726956-20555043-206C6175 [Virtual CPU ]
CPUID 80000001: 00000F4A-00000000-00000100-08100000
CPUID 80000002: 20202020-20202020-20202020-20202020 [                ]
CPUID 80000003: 20202020-20202020-69562020-61757472 [          Virtua]
CPUID 80000004: 5043206C-20402055-34372E32-007A4847 [l CPU @ 2.74GHz]
CPUID 80000005: 00000000-00000000-00000000-00000000 [L1D: 0 KB / L1I: 0 KB]
CPUID 80000006: 00000000-00000000-02006040-00000000 [L2: 512 KB] / L3: 0 KB]
CPUID 80000007: 00000000-00000000-00000000-00000100
CPUID 80000008: 00002020-00000000-00003007-00000000

------[ All CPUs ]------

CPU   0: APICID    0 / Package 0 / Core   0 / Thread 0: Valid
CPU   1: APICID    1 / Package 0 / Core   1 / Thread 0: Valid
CPU   2: APICID    2 / Package 0 / Core   2 / Thread 0: Valid
CPU   3: APICID    3 / Package 0 / Core   3 / Thread 0: Valid
CPU   4: APICID    4 / Package 0 / Core   4 / Thread 0: Valid
CPU   5: APICID    5 / Package 0 / Core   5 / Thread 0: Valid
CPU   6: APICID    6 / Package 0 / Core   6 / Thread 0: Valid
CPU   7: APICID    7 / Package 0 / Core   7 / Thread 0: Valid

------[ MSR Registers / Logical CPU #0 ]------


------[ MSR Registers / Logical CPU #1 ]------


------[ MSR Registers / Logical CPU #2 ]------


------[ MSR Registers / Logical CPU #3 ]------


------[ MSR Registers / Logical CPU #4 ]------


------[ MSR Registers / Logical CPU #5 ]------


------[ MSR Registers / Logical CPU #6 ]------


------[ MSR Registers / Logical CPU #7 ]------

