------[ Versions ]------

Program Version : EVEREST v4.10.1095 Beta
BenchDLL Version: 2.2.186.0

------[ CPU Info ]------

CPU Type           : DualCore Intel Core 2 Duo E6750, 2666 MHz (8 x 333)
CPU Alias          : Conroe
CPU Platform       : LGA775
CPU Stepping       : G0
Instruction Set    : x86, x86-64, MMX, SSE, SSE2, SSE3, SSSE3
CPUID Manufacturer : GenuineIntel
CPUID CPU Name     : Intel(R) Core(TM)2 Duo CPU E6750 @ 2.66GHz
CPUID Revision     : 000006FBh
IA Brand ID        : 00h  (Unknown)
Platform ID        : 29h  (LGA775)

------[ Logical CPU #0 ]------

allcpu: Valid

CPUID 00000000: 0000000A-756E6547-6C65746E-49656E69
CPUID 00000001: 000006FB-00020800-0000E3FD-BFEBFBFF
CPUID 00000002: 05B0B101-005657F0-00000000-2CB43049
CPUID 00000003: 00000000-00000000-00000000-00000000
CPUID 00000004: 04000121-01C0003F-0000003F-00000001
CPUID 00000005: 00000040-00000040-00000003-00000220
CPUID 00000006: 00000001-00000002-00000001-00000000
CPUID 00000007: 00000000-00000000-00000000-00000000
CPUID 00000008: 00000400-00000000-00000000-00000000
CPUID 00000009: 00000000-00000000-00000000-00000000
CPUID 0000000A: 07280202-00000000-00000000-00000503
CPUID 80000000: 80000008-00000000-00000000-00000000
CPUID 80000001: 00000000-00000000-00000001-20100000
CPUID 80000002: 65746E49-2952286C-726F4320-4D542865
CPUID 80000003: 44203229-43206F75-20205550-45202020
CPUID 80000004: 30353736-20402020-36362E32-007A4847
CPUID 80000005: 00000000-00000000-00000000-00000000
CPUID 80000006: 00000000-00000000-10008040-00000000
CPUID 80000007: 00000000-00000000-00000000-00000000
CPUID 80000008: 00003024-00000000-00000000-00000000

------[ Logical CPU #1 ]------

allcpu: Valid

CPUID 00000000: 0000000A-756E6547-6C65746E-49656E69
CPUID 00000001: 000006FB-01020800-0000E3FD-BFEBFBFF
CPUID 00000002: 05B0B101-005657F0-00000000-2CB43049
CPUID 00000003: 00000000-00000000-00000000-00000000
CPUID 00000004: 04000121-01C0003F-0000003F-00000001
CPUID 00000005: 00000040-00000040-00000003-00000220
CPUID 00000006: 00000001-00000002-00000001-00000000
CPUID 00000007: 00000000-00000000-00000000-00000000
CPUID 00000008: 00000400-00000000-00000000-00000000
CPUID 00000009: 00000000-00000000-00000000-00000000
CPUID 0000000A: 07280202-00000000-00000000-00000503
CPUID 80000000: 80000008-00000000-00000000-00000000
CPUID 80000001: 00000000-00000000-00000001-20100000
CPUID 80000002: 65746E49-2952286C-726F4320-4D542865
CPUID 80000003: 44203229-43206F75-20205550-45202020
CPUID 80000004: 30353736-20402020-36362E32-007A4847
CPUID 80000005: 00000000-00000000-00000000-00000000
CPUID 80000006: 00000000-00000000-10008040-00000000
CPUID 80000007: 00000000-00000000-00000000-00000000
CPUID 80000008: 00003024-00000000-00000000-00000000

------[ MSR Registers ]------

MSR 00000017: 0000-0000-8800-8824
MSR 0000002A: 0000-0000-4208-0000
MSR 0000008B: 0000-00B3-0000-0000
MSR 000000CD: 0000-0000-0000-0804
MSR 000000E7: 0000-07B0-53D7-3270
MSR 000000E8: 0000-07B0-53D7-5F88
MSR 000000EE: A800-0000-C37D-5300
MSR 0000011E: 0000-0000-BE70-2109
MSR 00000198: 0824-0824-0600-0824
MSR 00000199: 0000-0000-0000-0824
MSR 0000019A: 0000-0000-0000-0008
MSR 0000019B: 0000-0000-0000-0000
MSR 0000019C: 0000-0000-8834-0000
MSR 0000019D: 0000-0000-0000-0612
MSR 000001A0: 0000-0040-6086-2489

PerformanceFrequency = 14318180
