------[ Versions ]------

Program Version : AIDA64 Engineer v6.25.5426 Beta
BenchDLL Version: 4.5.825.8-x64
Windows Version : Microsoft Windows 10 Home 10.0.18363.836 (64-bit)

------[ CPU Info ]------

CPU Type          : DualCore Intel Core i3-10110U, 4100 MHz (41 x 100)
CPU Alias         : Comet Lake-U
CPU Platform      : BGA1528
CPU Stepping      : V0
Instruction Set   : x86, x86-64, MMX, SSE, SSE2, SSE3, SSSE3, SSE4.1, SSE4.2, AVX, AVX2, FMA, AES
CPUID Manufacturer: GenuineIntel
CPUID CPU Name    : Intel(R) Core(TM) i3-10110U CPU @ 2.10GHz
CPUID Revision    : 000806ECh
IA Brand ID       : 00h  (Unknown)
Platform ID       : 35h  (BGA1528)
HTT / CMP Units   : 2 / 2
Max. NUMA Node    : 0

Tjmax Temperature          : 100 Celsius
HTC Temperature Limit      : 0 Celsius
CPU TDP                    : 15 W
CPU TDC                    : 51 A
CPU Max Power Limit        : Unlimited Power / Unlimited Time
CPU Power Limit 1 (Long)   : 30 W / 28.00 sec  (Unlocked)
CPU Power Limit 2 (Short)  : 40 W / 2.44 ms  (Unlocked)
Max Turbo Boost Multipliers: 1C: 41x, 2C: 37x

------[ Motherboard Info ]------

Motherboard ID      : <DMI>
Motherboard Model   : Intel Frost Canyon NUC10i3FNH
Motherboard Chipset : Intel Comet Point-LP, Intel Comet Lake-U

DMI MB Manufacturer : Intel Corporation
DMI MB Product      : NUC10i3FNB
DMI MB Version      : K61362-302
DMI MB Serial       : GEFN94700B6U
DMI SYS Manufacturer: Intel(R) Client Systems
DMI SYS Product     : NUC10i3FNH
DMI SYS Version     : K61356-302
DMI SYS Serial      : GEFN94700B6U
DMI BIOS Version    : FNCML357.0039.2020.0312.1734


------[ CPUID Registers / Logical CPU #0 ]------

allcpu: Package 0 / Core 0 / Thread 0: Valid

CPUID 00000000: 00000016-756E6547-6C65746E-49656E69 [GenuineIntel]
CPUID 00000001: 000806EC-00100800-7FFAFBBF-BFEBFBFF
CPUID 00000002: 76036301-00F0B5FF-00000000-00C30000
CPUID 00000003: 00000000-00000000-00000000-00000000
CPUID 00000004: 1C004121-01C0003F-0000003F-00000000 [SL 00] [L1D: 32 KB]
CPUID 00000004: 1C004122-01C0003F-0000003F-00000000 [SL 01] [L1I: 32 KB]
CPUID 00000004: 1C004143-00C0003F-000003FF-00000000 [SL 02] [L2U: 256 KB]
CPUID 00000004: 1C03C163-03C0003F-00000FFF-00000006 [SL 03] [L3U: 4 MB]
CPUID 00000005: 00000040-00000040-00000003-11142120
CPUID 00000006: 000027F5-00000002-00000009-00000000
CPUID 00000007: 00000000-029C67AF-00000000-BC000400 [SL 00]
CPUID 00000008: 00000000-00000000-00000000-00000000
CPUID 00000009: 00000000-00000000-00000000-00000000
CPUID 0000000A: 07300404-00000000-00000000-00000603
CPUID 0000000B: 00000001-00000002-00000100-00000000 [SL 00]
CPUID 0000000B: 00000004-00000004-00000201-00000000 [SL 01]
CPUID 0000000C: 00000000-00000000-00000000-00000000
CPUID 0000000D: 0000001F-00000440-00000440-00000000 [SL 00] [x87]
CPUID 0000000D: 0000000F-00000440-00000100-00000000 [SL 01] [SSE]
CPUID 0000000D: 00000100-00000240-00000000-00000000 [SL 02] [AVX]
CPUID 0000000D: 00000040-000003C0-00000000-00000000 [SL 03] [MPX BNDREGS]
CPUID 0000000D: 00000040-00000400-00000000-00000000 [SL 04] [MPX BNDCSR]
CPUID 0000000D: 00000080-00000000-00000001-00000000 [SL 08] [PT]
CPUID 0000000E: 00000000-00000000-00000000-00000000
CPUID 0000000F: 00000000-00000000-00000000-00000000 [SL 00]
CPUID 0000000F: 00000000-00000000-00000000-00000000 [SL 01]
CPUID 00000010: 00000000-00000000-00000000-00000000 [SL 00]
CPUID 00000010: 00000000-00000000-00000000-00000000 [SL 01]
CPUID 00000011: 00000000-00000000-00000000-00000000
CPUID 00000012: 00000001-00000000-00000000-0000241F [SL 00]
CPUID 00000012: 00000036-00000000-0000001F-00000000 [SL 01]
CPUID 00000012: 70200001-00000000-05E00001-00000000 [SL 02]
CPUID 00000013: 00000000-00000000-00000000-00000000
CPUID 00000014: 00000001-0000000F-00000007-00000000 [SL 00]
CPUID 00000014: 02490002-003F3FFF-00000000-00000000 [SL 01]
CPUID 00000015: 00000002-000000D8-00000000-00000000 [108.00x / 0]
CPUID 00000016: 00000A28-00001004-00000064-00000000 [2600 / 4100 / 100]
CPUID 80000000: 80000008-00000000-00000000-00000000
CPUID 80000001: 00000000-00000000-00000121-2C100000
CPUID 80000002: 65746E49-2952286C-726F4320-4D542865 [Intel(R) Core(TM]
CPUID 80000003: 33692029-3130312D-20553031-20555043 [) i3-10110U CPU ]
CPUID 80000004: 2E322040-48473031-0000007A-00000000 [@ 2.10GHz]
CPUID 80000005: 00000000-00000000-00000000-00000000 [L1D: 0 KB / L1I: 0 KB]
CPUID 80000006: 00000000-00000000-01006040-00000000 [L2: 256 KB] / L3: 0 KB]
CPUID 80000007: 00000000-00000000-00000000-00000100
CPUID 80000008: 00003027-00000000-00000000-00000000

L1    Data Cache:    32 KB,  8-way Associative, 64-byte Line
L1  Instr. Cache:    32 KB,  8-way Associative, 64-byte Line
L2 Unified Cache:   256 KB,  4-way Associative, 64-byte Line
L3 Unified Cache:     4 MB, 16-way Associative, 64-byte Line

------[ CPUID Registers / Logical CPU #1 ]------

allcpu: Package 0 / Core 0 / Thread 1: Valid, Virtual

CPUID 00000000: 00000016-756E6547-6C65746E-49656E69 [GenuineIntel]
CPUID 00000001: 000806EC-01100800-7FFAFBBF-BFEBFBFF
CPUID 00000002: 76036301-00F0B5FF-00000000-00C30000
CPUID 00000003: 00000000-00000000-00000000-00000000
CPUID 00000004: 1C004121-01C0003F-0000003F-00000000 [SL 00] [L1D: 32 KB]
CPUID 00000004: 1C004122-01C0003F-0000003F-00000000 [SL 01] [L1I: 32 KB]
CPUID 00000004: 1C004143-00C0003F-000003FF-00000000 [SL 02] [L2U: 256 KB]
CPUID 00000004: 1C03C163-03C0003F-00000FFF-00000006 [SL 03] [L3U: 4 MB]
CPUID 00000005: 00000040-00000040-00000003-11142120
CPUID 00000006: 000027F5-00000002-00000009-00000000
CPUID 00000007: 00000000-029C67AF-00000000-BC000400 [SL 00]
CPUID 00000008: 00000000-00000000-00000000-00000000
CPUID 00000009: 00000000-00000000-00000000-00000000
CPUID 0000000A: 07300404-00000000-00000000-00000603
CPUID 0000000B: 00000001-00000002-00000100-00000001 [SL 00]
CPUID 0000000B: 00000004-00000004-00000201-00000001 [SL 01]
CPUID 0000000C: 00000000-00000000-00000000-00000000
CPUID 0000000D: 0000001F-00000440-00000440-00000000 [SL 00] [x87]
CPUID 0000000D: 0000000F-00000440-00000100-00000000 [SL 01] [SSE]
CPUID 0000000D: 00000100-00000240-00000000-00000000 [SL 02] [AVX]
CPUID 0000000D: 00000040-000003C0-00000000-00000000 [SL 03] [MPX BNDREGS]
CPUID 0000000D: 00000040-00000400-00000000-00000000 [SL 04] [MPX BNDCSR]
CPUID 0000000D: 00000080-00000000-00000001-00000000 [SL 08] [PT]
CPUID 0000000E: 00000000-00000000-00000000-00000000
CPUID 0000000F: 00000000-00000000-00000000-00000000 [SL 00]
CPUID 0000000F: 00000000-00000000-00000000-00000000 [SL 01]
CPUID 00000010: 00000000-00000000-00000000-00000000 [SL 00]
CPUID 00000010: 00000000-00000000-00000000-00000000 [SL 01]
CPUID 00000011: 00000000-00000000-00000000-00000000
CPUID 00000012: 00000001-00000000-00000000-0000241F [SL 00]
CPUID 00000012: 00000036-00000000-0000001F-00000000 [SL 01]
CPUID 00000012: 70200001-00000000-05E00001-00000000 [SL 02]
CPUID 00000013: 00000000-00000000-00000000-00000000
CPUID 00000014: 00000001-0000000F-00000007-00000000 [SL 00]
CPUID 00000014: 02490002-003F3FFF-00000000-00000000 [SL 01]
CPUID 00000015: 00000002-000000D8-00000000-00000000 [108.00x / 0]
CPUID 00000016: 00000A28-00001004-00000064-00000000 [2600 / 4100 / 100]
CPUID 80000000: 80000008-00000000-00000000-00000000
CPUID 80000001: 00000000-00000000-00000121-2C100000
CPUID 80000002: 65746E49-2952286C-726F4320-4D542865 [Intel(R) Core(TM]
CPUID 80000003: 33692029-3130312D-20553031-20555043 [) i3-10110U CPU ]
CPUID 80000004: 2E322040-48473031-0000007A-00000000 [@ 2.10GHz]
CPUID 80000005: 00000000-00000000-00000000-00000000 [L1D: 0 KB / L1I: 0 KB]
CPUID 80000006: 00000000-00000000-01006040-00000000 [L2: 256 KB] / L3: 0 KB]
CPUID 80000007: 00000000-00000000-00000000-00000100
CPUID 80000008: 00003027-00000000-00000000-00000000

L1    Data Cache:    32 KB,  8-way Associative, 64-byte Line
L1  Instr. Cache:    32 KB,  8-way Associative, 64-byte Line
L2 Unified Cache:   256 KB,  4-way Associative, 64-byte Line
L3 Unified Cache:     4 MB, 16-way Associative, 64-byte Line

------[ CPUID Registers / Logical CPU #2 ]------

allcpu: Package 0 / Core 1 / Thread 0: Valid

CPUID 00000000: 00000016-756E6547-6C65746E-49656E69 [GenuineIntel]
CPUID 00000001: 000806EC-02100800-7FFAFBBF-BFEBFBFF
CPUID 00000002: 76036301-00F0B5FF-00000000-00C30000
CPUID 00000003: 00000000-00000000-00000000-00000000
CPUID 00000004: 1C004121-01C0003F-0000003F-00000000 [SL 00] [L1D: 32 KB]
CPUID 00000004: 1C004122-01C0003F-0000003F-00000000 [SL 01] [L1I: 32 KB]
CPUID 00000004: 1C004143-00C0003F-000003FF-00000000 [SL 02] [L2U: 256 KB]
CPUID 00000004: 1C03C163-03C0003F-00000FFF-00000006 [SL 03] [L3U: 4 MB]
CPUID 00000005: 00000040-00000040-00000003-11142120
CPUID 00000006: 000027F5-00000002-00000009-00000000
CPUID 00000007: 00000000-029C67AF-00000000-BC000400 [SL 00]
CPUID 00000008: 00000000-00000000-00000000-00000000
CPUID 00000009: 00000000-00000000-00000000-00000000
CPUID 0000000A: 07300404-00000000-00000000-00000603
CPUID 0000000B: 00000001-00000002-00000100-00000002 [SL 00]
CPUID 0000000B: 00000004-00000004-00000201-00000002 [SL 01]
CPUID 0000000C: 00000000-00000000-00000000-00000000
CPUID 0000000D: 0000001F-00000440-00000440-00000000 [SL 00] [x87]
CPUID 0000000D: 0000000F-00000440-00000100-00000000 [SL 01] [SSE]
CPUID 0000000D: 00000100-00000240-00000000-00000000 [SL 02] [AVX]
CPUID 0000000D: 00000040-000003C0-00000000-00000000 [SL 03] [MPX BNDREGS]
CPUID 0000000D: 00000040-00000400-00000000-00000000 [SL 04] [MPX BNDCSR]
CPUID 0000000D: 00000080-00000000-00000001-00000000 [SL 08] [PT]
CPUID 0000000E: 00000000-00000000-00000000-00000000
CPUID 0000000F: 00000000-00000000-00000000-00000000 [SL 00]
CPUID 0000000F: 00000000-00000000-00000000-00000000 [SL 01]
CPUID 00000010: 00000000-00000000-00000000-00000000 [SL 00]
CPUID 00000010: 00000000-00000000-00000000-00000000 [SL 01]
CPUID 00000011: 00000000-00000000-00000000-00000000
CPUID 00000012: 00000001-00000000-00000000-0000241F [SL 00]
CPUID 00000012: 00000036-00000000-0000001F-00000000 [SL 01]
CPUID 00000012: 70200001-00000000-05E00001-00000000 [SL 02]
CPUID 00000013: 00000000-00000000-00000000-00000000
CPUID 00000014: 00000001-0000000F-00000007-00000000 [SL 00]
CPUID 00000014: 02490002-003F3FFF-00000000-00000000 [SL 01]
CPUID 00000015: 00000002-000000D8-00000000-00000000 [108.00x / 0]
CPUID 00000016: 00000A28-00001004-00000064-00000000 [2600 / 4100 / 100]
CPUID 80000000: 80000008-00000000-00000000-00000000
CPUID 80000001: 00000000-00000000-00000121-2C100000
CPUID 80000002: 65746E49-2952286C-726F4320-4D542865 [Intel(R) Core(TM]
CPUID 80000003: 33692029-3130312D-20553031-20555043 [) i3-10110U CPU ]
CPUID 80000004: 2E322040-48473031-0000007A-00000000 [@ 2.10GHz]
CPUID 80000005: 00000000-00000000-00000000-00000000 [L1D: 0 KB / L1I: 0 KB]
CPUID 80000006: 00000000-00000000-01006040-00000000 [L2: 256 KB] / L3: 0 KB]
CPUID 80000007: 00000000-00000000-00000000-00000100
CPUID 80000008: 00003027-00000000-00000000-00000000

L1    Data Cache:    32 KB,  8-way Associative, 64-byte Line
L1  Instr. Cache:    32 KB,  8-way Associative, 64-byte Line
L2 Unified Cache:   256 KB,  4-way Associative, 64-byte Line
L3 Unified Cache:     4 MB, 16-way Associative, 64-byte Line

------[ CPUID Registers / Logical CPU #3 ]------

allcpu: Package 0 / Core 1 / Thread 1: Valid, Virtual

CPUID 00000000: 00000016-756E6547-6C65746E-49656E69 [GenuineIntel]
CPUID 00000001: 000806EC-03100800-7FFAFBBF-BFEBFBFF
CPUID 00000002: 76036301-00F0B5FF-00000000-00C30000
CPUID 00000003: 00000000-00000000-00000000-00000000
CPUID 00000004: 1C004121-01C0003F-0000003F-00000000 [SL 00] [L1D: 32 KB]
CPUID 00000004: 1C004122-01C0003F-0000003F-00000000 [SL 01] [L1I: 32 KB]
CPUID 00000004: 1C004143-00C0003F-000003FF-00000000 [SL 02] [L2U: 256 KB]
CPUID 00000004: 1C03C163-03C0003F-00000FFF-00000006 [SL 03] [L3U: 4 MB]
CPUID 00000005: 00000040-00000040-00000003-11142120
CPUID 00000006: 000027F5-00000002-00000009-00000000
CPUID 00000007: 00000000-029C67AF-00000000-BC000400 [SL 00]
CPUID 00000008: 00000000-00000000-00000000-00000000
CPUID 00000009: 00000000-00000000-00000000-00000000
CPUID 0000000A: 07300404-00000000-00000000-00000603
CPUID 0000000B: 00000001-00000002-00000100-00000003 [SL 00]
CPUID 0000000B: 00000004-00000004-00000201-00000003 [SL 01]
CPUID 0000000C: 00000000-00000000-00000000-00000000
CPUID 0000000D: 0000001F-00000440-00000440-00000000 [SL 00] [x87]
CPUID 0000000D: 0000000F-00000440-00000100-00000000 [SL 01] [SSE]
CPUID 0000000D: 00000100-00000240-00000000-00000000 [SL 02] [AVX]
CPUID 0000000D: 00000040-000003C0-00000000-00000000 [SL 03] [MPX BNDREGS]
CPUID 0000000D: 00000040-00000400-00000000-00000000 [SL 04] [MPX BNDCSR]
CPUID 0000000D: 00000080-00000000-00000001-00000000 [SL 08] [PT]
CPUID 0000000E: 00000000-00000000-00000000-00000000
CPUID 0000000F: 00000000-00000000-00000000-00000000 [SL 00]
CPUID 0000000F: 00000000-00000000-00000000-00000000 [SL 01]
CPUID 00000010: 00000000-00000000-00000000-00000000 [SL 00]
CPUID 00000010: 00000000-00000000-00000000-00000000 [SL 01]
CPUID 00000011: 00000000-00000000-00000000-00000000
CPUID 00000012: 00000001-00000000-00000000-0000241F [SL 00]
CPUID 00000012: 00000036-00000000-0000001F-00000000 [SL 01]
CPUID 00000012: 70200001-00000000-05E00001-00000000 [SL 02]
CPUID 00000013: 00000000-00000000-00000000-00000000
CPUID 00000014: 00000001-0000000F-00000007-00000000 [SL 00]
CPUID 00000014: 02490002-003F3FFF-00000000-00000000 [SL 01]
CPUID 00000015: 00000002-000000D8-00000000-00000000 [108.00x / 0]
CPUID 00000016: 00000A28-00001004-00000064-00000000 [2600 / 4100 / 100]
CPUID 80000000: 80000008-00000000-00000000-00000000
CPUID 80000001: 00000000-00000000-00000121-2C100000
CPUID 80000002: 65746E49-2952286C-726F4320-4D542865 [Intel(R) Core(TM]
CPUID 80000003: 33692029-3130312D-20553031-20555043 [) i3-10110U CPU ]
CPUID 80000004: 2E322040-48473031-0000007A-00000000 [@ 2.10GHz]
CPUID 80000005: 00000000-00000000-00000000-00000000 [L1D: 0 KB / L1I: 0 KB]
CPUID 80000006: 00000000-00000000-01006040-00000000 [L2: 256 KB] / L3: 0 KB]
CPUID 80000007: 00000000-00000000-00000000-00000100
CPUID 80000008: 00003027-00000000-00000000-00000000

L1    Data Cache:    32 KB,  8-way Associative, 64-byte Line
L1  Instr. Cache:    32 KB,  8-way Associative, 64-byte Line
L2 Unified Cache:   256 KB,  4-way Associative, 64-byte Line
L3 Unified Cache:     4 MB, 16-way Associative, 64-byte Line

------[ All CPUs ]------

CPU   0: APICID    0 / Package 0 / Core   0 / Thread 0: Valid
CPU   1: APICID    1 / Package 0 / Core   0 / Thread 1: Valid, Virtual
CPU   2: APICID    2 / Package 0 / Core   1 / Thread 0: Valid
CPU   3: APICID    3 / Package 0 / Core   1 / Thread 1: Valid, Virtual

------[ MSR Registers / Logical CPU #0 ]------

MSR 00000017: 0008-0000-0000-0000 [PlatID = 2]
MSR 0000001B: 0000-0000-FEE0-0D00
MSR 00000035: 0000-0000-0002-0004
MSR 00000048: 0000-0000-0000-0001
MSR 00000049: < FAILED >
MSR 0000008B: 0000-00C6-0000-0000
MSR 000000CE: 0004-043D-F101-1A00 [eD = 0]
MSR 000000E7: 0000-0000-A44E-5630 [S200]
MSR 000000E7: 0000-0000-A85A-6B80 [S200]
MSR 000000E7: 0000-0000-AB8C-0308
MSR 000000E8: 0000-0000-8A8D-796F [S200]
MSR 000000E8: 0000-0000-8C65-C86E [S200]
MSR 000000E8: 0000-0000-901F-A9E1
MSR 0000010A: 0000-0000-0000-002B
MSR 0000010B: < FAILED >
MSR 00000194: 0000-0000-0001-0000
MSR 00000198: 0000-1738-0000-1500 [S200]
MSR 00000198: 0000-174F-0000-1500 [S200]
MSR 00000198: 0000-1784-0000-1500
MSR 00000199: 0000-0000-0000-1400
MSR 0000019A: 0000-0000-0000-0000
MSR 0000019B: 0000-0000-0000-0010
MSR 0000019C: 0000-0000-883D-0000 [S200]
MSR 0000019C: 0000-0000-883E-0000 [S200]
MSR 0000019C: 0000-0000-883B-0000
MSR 0000019D: 0000-0000-0000-0000
MSR 000001A0: 0000-0040-0085-0089
MSR 000001A2: 0000-0000-0064-0000
MSR 000001A4: 0000-0000-0000-0000
MSR 000001AA: 0000-0000-0040-1CC0
MSR 000001AC: < FAILED >
MSR 000001AD: 0000-0000-2525-2529
MSR 000001B0: 0000-0000-0000-0006
MSR 000001B1: 0000-0000-883A-0000
MSR 000001B2: 0000-0000-0000-0000
MSR 000001FC: 0000-0000-0024-005D
MSR 00000300: < FAILED >
MSR 0000030A: 0000-0000-DC5C-ECDF [S200]
MSR 0000030A: 0000-0000-E56A-768C [S200]
MSR 0000030A: 0000-0000-E824-4940
MSR 0000030B: 0000-0001-1F37-8AD8 [S200]
MSR 0000030B: 0000-0001-23C8-DCE4 [S200]
MSR 0000030B: 0000-0001-260F-AE78
MSR 00000480: 00DA-0400-0000-0004
MSR 00000481: 0000-007F-0000-0016
MSR 00000482: FFF9-FFFE-0401-E172
MSR 00000483: 01FF-FFFF-0003-6DFF
MSR 00000484: 0003-FFFF-0000-11FF
MSR 00000485: 0000-0000-7004-C1E7
MSR 00000486: 0000-0000-8000-0021
MSR 00000487: 0000-0000-FFFF-FFFF
MSR 00000488: 0000-0000-0000-2000
MSR 00000489: 0000-0000-0037-27FF
MSR 0000048A: 0000-0000-0000-002E
MSR 0000048B: 005F-BCFF-0000-0000
MSR 0000048C: 0000-0F01-0673-4141
MSR 0000048D: 0000-007F-0000-0016
MSR 0000048E: FFF9-FFFE-0400-6172
MSR 0000048F: 01FF-FFFF-0003-6DFB
MSR 00000490: 0003-FFFF-0000-11FB
MSR 00000601: 0000-0000-0000-0198
MSR 00000602: < FAILED >
MSR 00000603: 0036-0000-0036-3636
MSR 00000604: < FAILED >
MSR 00000606: 0000-0000-000A-0E03
MSR 0000060A: 0000-0000-0000-884E
MSR 0000060B: 0000-0000-0000-8876
MSR 0000060C: 0000-0000-0000-8894
MSR 0000060D: 0000-0011-2A71-E804
MSR 00000610: 0042-8140-00DD-80F0
MSR 00000611: 0000-0000-0158-8839 [S200]
MSR 00000611: 0000-0000-0158-9EC1 [S200]
MSR 00000611: 0000-0000-0158-AFF8
MSR 00000613: 0000-0000-0000-0000
MSR 00000614: 0000-0000-0000-0078
MSR 00000618: 0054-00DE-0000-0000
MSR 00000619: 0000-0000-001C-2A73 [S200]
MSR 00000619: 0000-0000-001C-2F34 [S200]
MSR 00000619: 0000-0000-001C-33A7
MSR 0000061B: 0000-0000-0000-0000
MSR 0000061C: < FAILED >
MSR 0000061E: < FAILED >
MSR 00000620: 0000-0000-0000-0426
MSR 00000621: 0000-0000-0000-0012
MSR 00000638: 0000-0000-0000-0000
MSR 00000639: 0000-0000-00F2-F150 [S200]
MSR 00000639: 0000-0000-00F2-F572 [S200]
MSR 00000639: 0000-0000-00F2-FFF8
MSR 0000063A: 0000-0000-0000-0009
MSR 0000063B: < FAILED >
MSR 00000640: 0000-0000-0000-0000
MSR 00000641: 0000-0000-000F-264B [S200]
MSR 00000641: 0000-0000-000F-279C [S200]
MSR 00000641: 0000-0000-000F-284E
MSR 00000642: 0000-0000-0000-000D
MSR 00000648: 0000-0000-0000-0015
MSR 00000649: 0000-0000-0008-0050
MSR 0000064A: 0000-0000-001A-00C8
MSR 0000064B: 0000-0000-0000-0000
MSR 0000064C: 0000-0000-0000-0014
MSR 00000690: 0000-0000-0000-0000
MSR 000006B0: 0000-0000-0000-0000
MSR 000006B1: 0000-0000-0000-0000
MSR 00000770: 0000-0000-0000-0001
MSR 00000771: 0000-0000-010E-1529
MSR 00000772: < FAILED >
MSR 00000773: 0000-0000-0000-0001
MSR 00000774: 0000-019E-5400-2915
MSR 00000777: 0000-0000-0000-0004
MSR 00000832: 0000-0000-0003-00D1
MSR 00000838: 0000-0000-0000-0000
MSR 00000839: 0000-0000-0000-0000
MSR 0000083E: 0000-0000-0000-000A

------[ MSR Registers / Logical CPU #1 ]------

MSR 00000017: 0008-0000-0000-0000 [PlatID = 2]
MSR 0000001B: 0000-0000-FEE0-0C00
MSR 00000035: 0000-0000-0002-0004
MSR 00000048: 0000-0000-0000-0001
MSR 00000049: < FAILED >
MSR 0000008B: 0000-00C6-0000-0000
MSR 000000CE: 0004-043D-F101-1A00 [eD = 0]
MSR 000000E7: 0000-0023-221E-A1D9
MSR 000000E8: 0000-002D-12A9-15B9
MSR 0000010A: 0000-0000-0000-002B
MSR 0000010B: < FAILED >
MSR 00000194: 0000-0000-0001-0000
MSR 00000198: 0000-1701-0000-1500
MSR 00000199: 0000-0000-0000-1400
MSR 0000019A: 0000-0000-0000-0000
MSR 0000019B: 0000-0000-0000-0010
MSR 0000019C: 0000-0000-883A-0000
MSR 0000019D: 0000-0000-0000-0000
MSR 000001A0: 0000-0040-0085-0089
MSR 000001A2: 0000-0000-0064-0000
MSR 000001A4: 0000-0000-0000-0000
MSR 000001AA: 0000-0000-0040-1CC0
MSR 000001AC: < FAILED >
MSR 000001AD: 0000-0000-2525-2529
MSR 000001B0: 0000-0000-0000-0006
MSR 000001B1: 0000-0000-883A-0000
MSR 000001B2: 0000-0000-0000-0000
MSR 000001FC: 0000-0000-0024-005D
MSR 00000300: < FAILED >
MSR 0000030A: 0000-0008-D5DD-1D07
MSR 0000030B: 0000-000B-12E7-DC60
MSR 00000480: 00DA-0400-0000-0004
MSR 00000481: 0000-007F-0000-0016
MSR 00000482: FFF9-FFFE-0401-E172
MSR 00000483: 01FF-FFFF-0003-6DFF
MSR 00000484: 0003-FFFF-0000-11FF
MSR 00000485: 0000-0000-7004-C1E7
MSR 00000486: 0000-0000-8000-0021
MSR 00000487: 0000-0000-FFFF-FFFF
MSR 00000488: 0000-0000-0000-2000
MSR 00000489: 0000-0000-0037-27FF
MSR 0000048A: 0000-0000-0000-002E
MSR 0000048B: 005F-BCFF-0000-0000
MSR 0000048C: 0000-0F01-0673-4141
MSR 0000048D: 0000-007F-0000-0016
MSR 0000048E: FFF9-FFFE-0400-6172
MSR 0000048F: 01FF-FFFF-0003-6DFB
MSR 00000490: 0003-FFFF-0000-11FB
MSR 00000601: 0000-0000-0000-0198
MSR 00000602: < FAILED >
MSR 00000603: 0036-0000-0036-3636
MSR 00000604: < FAILED >
MSR 00000606: 0000-0000-000A-0E03
MSR 0000060A: 0000-0000-0000-884E
MSR 0000060B: 0000-0000-0000-8876
MSR 0000060C: 0000-0000-0000-8894
MSR 0000060D: 0000-0011-483A-81B6
MSR 00000610: 0042-8140-00DD-80F0
MSR 00000611: 0000-0000-0159-1ABF
MSR 00000613: 0000-0000-0000-0000
MSR 00000614: 0000-0000-0000-0078
MSR 00000618: 0054-00DE-0000-0000
MSR 00000619: 0000-0000-001C-44D0
MSR 0000061B: 0000-0000-0000-0000
MSR 0000061C: < FAILED >
MSR 0000061E: < FAILED >
MSR 00000620: 0000-0000-0000-0426
MSR 00000621: 0000-0000-0000-0012
MSR 00000638: 0000-0000-0000-0000
MSR 00000639: 0000-0000-00F3-0E55
MSR 0000063A: 0000-0000-0000-0009
MSR 0000063B: < FAILED >
MSR 00000640: 0000-0000-0000-0000
MSR 00000641: 0000-0000-000F-2898
MSR 00000642: 0000-0000-0000-000D
MSR 00000648: 0000-0000-0000-0015
MSR 00000649: 0000-0000-0008-0050
MSR 0000064A: 0000-0000-001A-00C8
MSR 0000064B: 0000-0000-0000-0000
MSR 0000064C: 0000-0000-0000-0014
MSR 00000690: 0000-0000-0000-0000
MSR 000006B0: 0000-0000-0000-0000
MSR 000006B1: 0000-0000-0000-0000
MSR 00000770: 0000-0000-0000-0001
MSR 00000771: 0000-0000-0111-1529
MSR 00000772: < FAILED >
MSR 00000773: 0000-0000-0000-0001
MSR 00000774: 0000-019E-5400-2915
MSR 00000777: 0000-0000-0000-0004
MSR 00000832: 0000-0000-0003-00D1
MSR 00000838: 0000-0000-0000-0000
MSR 00000839: 0000-0000-0000-0000
MSR 0000083E: 0000-0000-0000-000A

------[ MSR Registers / Logical CPU #2 ]------

MSR 00000017: 0008-0000-0000-0000 [PlatID = 2]
MSR 0000001B: 0000-0000-FEE0-0C00
MSR 00000035: 0000-0000-0002-0004
MSR 00000048: 0000-0000-0000-0001
MSR 00000049: < FAILED >
MSR 0000008B: 0000-00C6-0000-0000
MSR 000000CE: 0004-043D-F101-1A00 [eD = 0]
MSR 000000E7: 0000-0025-F5BA-AC21
MSR 000000E8: 0000-0030-4C21-9F8D
MSR 0000010A: 0000-0000-0000-002B
MSR 0000010B: < FAILED >
MSR 00000194: 0000-0000-0001-0000
MSR 00000198: 0000-1702-0000-1500
MSR 00000199: 0000-0000-0000-1400
MSR 0000019A: 0000-0000-0000-0000
MSR 0000019B: 0000-0000-0000-0010
MSR 0000019C: 0000-0000-8840-0000
MSR 0000019D: 0000-0000-0000-0000
MSR 000001A0: 0000-0040-0085-0089
MSR 000001A2: 0000-0000-0064-0000
MSR 000001A4: 0000-0000-0000-0000
MSR 000001AA: 0000-0000-0040-1CC0
MSR 000001AC: < FAILED >
MSR 000001AD: 0000-0000-2525-2529
MSR 000001B0: 0000-0000-0000-0006
MSR 000001B1: 0000-0000-883B-0000
MSR 000001B2: 0000-0000-0000-0000
MSR 000001FC: 0000-0000-0024-005D
MSR 00000300: < FAILED >
MSR 0000030A: 0000-0009-64BC-1373
MSR 0000030B: 0000-000B-C9DB-F058
MSR 00000480: 00DA-0400-0000-0004
MSR 00000481: 0000-007F-0000-0016
MSR 00000482: FFF9-FFFE-0401-E172
MSR 00000483: 01FF-FFFF-0003-6DFF
MSR 00000484: 0003-FFFF-0000-11FF
MSR 00000485: 0000-0000-7004-C1E7
MSR 00000486: 0000-0000-8000-0021
MSR 00000487: 0000-0000-FFFF-FFFF
MSR 00000488: 0000-0000-0000-2000
MSR 00000489: 0000-0000-0037-27FF
MSR 0000048A: 0000-0000-0000-002E
MSR 0000048B: 005F-BCFF-0000-0000
MSR 0000048C: 0000-0F01-0673-4141
MSR 0000048D: 0000-007F-0000-0016
MSR 0000048E: FFF9-FFFE-0400-6172
MSR 0000048F: 01FF-FFFF-0003-6DFB
MSR 00000490: 0003-FFFF-0000-11FB
MSR 00000601: 0000-0000-0000-0198
MSR 00000602: < FAILED >
MSR 00000603: 0036-0000-0036-3636
MSR 00000604: < FAILED >
MSR 00000606: 0000-0000-000A-0E03
MSR 0000060A: 0000-0000-0000-884E
MSR 0000060B: 0000-0000-0000-8876
MSR 0000060C: 0000-0000-0000-8894
MSR 0000060D: 0000-0011-483A-81B6
MSR 00000610: 0042-8140-00DD-80F0
MSR 00000611: 0000-0000-0159-1B21
MSR 00000613: 0000-0000-0000-0000
MSR 00000614: 0000-0000-0000-0078
MSR 00000618: 0054-00DE-0000-0000
MSR 00000619: 0000-0000-001C-44DB
MSR 0000061B: 0000-0000-0000-0000
MSR 0000061C: < FAILED >
MSR 0000061E: < FAILED >
MSR 00000620: 0000-0000-0000-0426
MSR 00000621: 0000-0000-0000-0012
MSR 00000638: 0000-0000-0000-0000
MSR 00000639: 0000-0000-00F3-0E7E
MSR 0000063A: 0000-0000-0000-0009
MSR 0000063B: < FAILED >
MSR 00000640: 0000-0000-0000-0000
MSR 00000641: 0000-0000-000F-2898
MSR 00000642: 0000-0000-0000-000D
MSR 00000648: 0000-0000-0000-0015
MSR 00000649: 0000-0000-0008-0050
MSR 0000064A: 0000-0000-001A-00C8
MSR 0000064B: 0000-0000-0000-0000
MSR 0000064C: 0000-0000-0000-0014
MSR 00000690: 0000-0000-0000-0000
MSR 000006B0: 0000-0000-0000-0000
MSR 000006B1: 0000-0000-0000-0000
MSR 00000770: 0000-0000-0000-0001
MSR 00000771: 0000-0000-0111-1529
MSR 00000772: < FAILED >
MSR 00000773: 0000-0000-0000-0001
MSR 00000774: 0000-019E-5400-2915
MSR 00000777: 0000-0000-0000-0004
MSR 00000832: 0000-0000-0003-00D1
MSR 00000838: 0000-0000-0000-0000
MSR 00000839: 0000-0000-0000-0000
MSR 0000083E: 0000-0000-0000-000A

------[ MSR Registers / Logical CPU #3 ]------

MSR 00000017: 0008-0000-0000-0000 [PlatID = 2]
MSR 0000001B: 0000-0000-FEE0-0C00
MSR 00000035: 0000-0000-0002-0004
MSR 00000048: 0000-0000-0000-0001
MSR 00000049: < FAILED >
MSR 0000008B: 0000-00C6-0000-0000
MSR 000000CE: 0004-043D-F101-1A00 [eD = 0]
MSR 000000E7: 0000-0026-BE85-6598
MSR 000000E8: 0000-002F-D4B6-8891
MSR 0000010A: 0000-0000-0000-002B
MSR 0000010B: < FAILED >
MSR 00000194: 0000-0000-0001-0000
MSR 00000198: 0000-16FD-0000-1500
MSR 00000199: 0000-0000-0000-1400
MSR 0000019A: 0000-0000-0000-0000
MSR 0000019B: 0000-0000-0000-0010
MSR 0000019C: 0000-0000-8840-0000
MSR 0000019D: 0000-0000-0000-0000
MSR 000001A0: 0000-0040-0085-0089
MSR 000001A2: 0000-0000-0064-0000
MSR 000001A4: 0000-0000-0000-0000
MSR 000001AA: 0000-0000-0040-1CC0
MSR 000001AC: < FAILED >
MSR 000001AD: 0000-0000-2525-2529
MSR 000001B0: 0000-0000-0000-0006
MSR 000001B1: 0000-0000-883B-0000
MSR 000001B2: 0000-0000-0000-0000
MSR 000001FC: 0000-0000-0024-005D
MSR 00000300: < FAILED >
MSR 0000030A: 0000-0009-6488-5E53
MSR 0000030B: 0000-000B-C998-6FEC
MSR 00000480: 00DA-0400-0000-0004
MSR 00000481: 0000-007F-0000-0016
MSR 00000482: FFF9-FFFE-0401-E172
MSR 00000483: 01FF-FFFF-0003-6DFF
MSR 00000484: 0003-FFFF-0000-11FF
MSR 00000485: 0000-0000-7004-C1E7
MSR 00000486: 0000-0000-8000-0021
MSR 00000487: 0000-0000-FFFF-FFFF
MSR 00000488: 0000-0000-0000-2000
MSR 00000489: 0000-0000-0037-27FF
MSR 0000048A: 0000-0000-0000-002E
MSR 0000048B: 005F-BCFF-0000-0000
MSR 0000048C: 0000-0F01-0673-4141
MSR 0000048D: 0000-007F-0000-0016
MSR 0000048E: FFF9-FFFE-0400-6172
MSR 0000048F: 01FF-FFFF-0003-6DFB
MSR 00000490: 0003-FFFF-0000-11FB
MSR 00000601: 0000-0000-0000-0198
MSR 00000602: < FAILED >
MSR 00000603: 0036-0000-0036-3636
MSR 00000604: < FAILED >
MSR 00000606: 0000-0000-000A-0E03
MSR 0000060A: 0000-0000-0000-884E
MSR 0000060B: 0000-0000-0000-8876
MSR 0000060C: 0000-0000-0000-8894
MSR 0000060D: 0000-0011-483A-81B6
MSR 00000610: 0042-8140-00DD-80F0
MSR 00000611: 0000-0000-0159-1B21
MSR 00000613: 0000-0000-0000-0000
MSR 00000614: 0000-0000-0000-0078
MSR 00000618: 0054-00DE-0000-0000
MSR 00000619: 0000-0000-001C-44DB
MSR 0000061B: 0000-0000-0000-0000
MSR 0000061C: < FAILED >
MSR 0000061E: < FAILED >
MSR 00000620: 0000-0000-0000-0426
MSR 00000621: 0000-0000-0000-0012
MSR 00000638: 0000-0000-0000-0000
MSR 00000639: 0000-0000-00F3-0E9B
MSR 0000063A: 0000-0000-0000-0009
MSR 0000063B: < FAILED >
MSR 00000640: 0000-0000-0000-0000
MSR 00000641: 0000-0000-000F-2898
MSR 00000642: 0000-0000-0000-000D
MSR 00000648: 0000-0000-0000-0015
MSR 00000649: 0000-0000-0008-0050
MSR 0000064A: 0000-0000-001A-00C8
MSR 0000064B: 0000-0000-0000-0000
MSR 0000064C: 0000-0000-0000-0014
MSR 00000690: 0000-0000-0000-0000
MSR 000006B0: 0000-0000-0000-0000
MSR 000006B1: 0000-0000-0000-0000
MSR 00000770: 0000-0000-0000-0001
MSR 00000771: 0000-0000-0111-1529
MSR 00000772: < FAILED >
MSR 00000773: 0000-0000-0000-0001
MSR 00000774: 0000-019E-5400-2915
MSR 00000777: 0000-0000-0000-0004
MSR 00000832: 0000-0000-0002-00D1
MSR 00000838: 0000-0000-0000-0B71
MSR 00000839: 0000-0000-0000-07DF
MSR 0000083E: 0000-0000-0000-000A

PerformanceFrequency = 10000000

CPU Clock M.Method = 9  (APIC SKL)
PM Timer Address   = 6152  (1808h)

APIC Clock =  99.73 MHz  (AT = 12576 / TT = 15005 / try = 1 / SKL = 24.00 MHz)
APIC Clock =  99.73 MHz  (AT = 12576 / TT = 15005 / try = 1 / SKL = 24.00 MHz)
APIC Clock =  99.73 MHz  (AT = 12576 / TT = 15005 / try = 1 / SKL = 24.00 MHz)
APIC Clock =  99.73 MHz  (AT = 12576 / TT = 15005 / try = 1 / SKL = 24.00 MHz)
APIC Clock =  99.73 MHz  (AT = 12576 / TT = 15005 / try = 1 / SKL = 24.00 MHz)

CPU Clock = 2094.35 MHz / TSC Clock = 2592.08 MHz / CPU Mul = 21.00x
CPU Clock = 2094.35 MHz / TSC Clock = 2592.08 MHz / CPU Mul = 21.00x
CPU Clock = 2094.35 MHz / TSC Clock = 2592.08 MHz / CPU Mul = 21.00x
CPU Clock = 2094.35 MHz / TSC Clock = 2592.08 MHz / CPU Mul = 21.00x
CPU Clock = 2094.35 MHz / TSC Clock = 2592.08 MHz / CPU Mul = 21.00x

CPU Clock Max = 2094.35 MHz / TSC Clock = 2592.08 MHz / CPU Mul = 21.00x
CPU Clock Max = 2094.35 MHz / TSC Clock = 2592.08 MHz / CPU Mul = 21.00x
CPU Clock Max = 2094.35 MHz / TSC Clock = 2592.08 MHz / CPU Mul = 21.00x
CPU Clock Max = 2094.35 MHz / TSC Clock = 2592.08 MHz / CPU Mul = 21.00x
CPU Clock Max = 2094.35 MHz / TSC Clock = 2592.08 MHz / CPU Mul = 21.00x

INTPERFCTR2 = 2095.15 MHz / INTPERFCTR1 (TSC) = 2592.03 MHz
INTPERFCTR2 = 2087.90 MHz / INTPERFCTR1 (TSC) = 2583.07 MHz
INTPERFCTR2 = 2089.25 MHz / INTPERFCTR1 (TSC) = 2584.74 MHz
INTPERFCTR2 = 2095.13 MHz / INTPERFCTR1 (TSC) = 2592.02 MHz
INTPERFCTR2 = 2095.10 MHz / INTPERFCTR1 (TSC) = 2591.98 MHz

------[ OC MailBox ]------

C 01 / P1 00 / P2 00: 00000629
C 01 / P1 01 / P2 00: 00000614
C 01 / P1 02 / P2 00: 00000626
C 01 / P1 03 / P2 00: 00000614
C 01 / P1 04 / P2 00: 00000400
C 02 / P1 00 / P2 00: 25252529
C 02 / P1 00 / P2 01: < FAILED >
C 02 / P1 00 / P2 02: < FAILED >
C 02 / P1 00 / P2 03: < FAILED >
C 02 / P1 01 / P2 00: 00000000
C 02 / P1 01 / P2 01: < FAILED >
C 02 / P1 01 / P2 02: < FAILED >
C 02 / P1 01 / P2 03: < FAILED >
C 02 / P1 02 / P2 00: 00000000
C 02 / P1 02 / P2 01: < FAILED >
C 02 / P1 02 / P2 02: < FAILED >
C 02 / P1 02 / P2 03: < FAILED >
C 02 / P1 03 / P2 00: 00000000
C 02 / P1 03 / P2 01: < FAILED >
C 02 / P1 03 / P2 02: < FAILED >
C 02 / P1 03 / P2 03: < FAILED >
C 02 / P1 04 / P2 00: 00000000
C 02 / P1 04 / P2 01: < FAILED >
C 02 / P1 04 / P2 02: < FAILED >
C 02 / P1 04 / P2 03: < FAILED >
C 02 / P1 05 / P2 00: 00000000
C 02 / P1 05 / P2 01: < FAILED >
C 02 / P1 05 / P2 02: < FAILED >
C 02 / P1 05 / P2 03: < FAILED >
C 02 / P1 06 / P2 00: 00000000
C 02 / P1 06 / P2 01: < FAILED >
C 02 / P1 06 / P2 02: < FAILED >
C 02 / P1 06 / P2 03: < FAILED >
C 02 / P1 07 / P2 00: 00000000
C 02 / P1 07 / P2 01: < FAILED >
C 02 / P1 07 / P2 02: < FAILED >
C 02 / P1 07 / P2 03: < FAILED >
C 03 / P1 00 / P2 00: 00000414
C 04 / P1 00 / P2 00: 20108002
C 05 / P1 00 / P2 00: 00018593
C 10 / P1 00 / P2 00: 00000000
C 10 / P1 01 / P2 00: 00000000
C 10 / P1 02 / P2 00: 00000000
C 10 / P1 03 / P2 00: 00000000
C 10 / P1 04 / P2 00: 00000000
C 12 / P1 00 / P2 00: 00000000
C 12 / P1 01 / P2 00: 00000000
C 12 / P1 02 / P2 00: 00000000
C 14 / P1 00 / P2 00: 00000000
C 16 / P1 00 / P2 00: 0000008C
C 18 / P1 00 / P2 00: 00000000
C 1A / P1 00 / P2 00: 00000000
C 1C / P1 00 / P2 00: 00000000  [CPU0]
C 1C / P1 00 / P2 00: 00000000  [CPU1]
C 1C / P1 00 / P2 00: 00000000  [CPU2]
C 1C / P1 00 / P2 00: 00000000  [CPU3]

------[ APIC Base at 00000000-FEE00000 ]------

  0000  FF FF FF FF FF FF FF FF FF FF FF FF FF FF FF FF 
  0010  FF FF FF FF FF FF FF FF FF FF FF FF FF FF FF FF 
  0020  FF FF FF FF FF FF FF FF FF FF FF FF FF FF FF FF 
  0030  FF FF FF FF FF FF FF FF FF FF FF FF FF FF FF FF 
  0040  FF FF FF FF FF FF FF FF FF FF FF FF FF FF FF FF 
  0050  FF FF FF FF FF FF FF FF FF FF FF FF FF FF FF FF 
  0060  FF FF FF FF FF FF FF FF FF FF FF FF FF FF FF FF 
  0070  FF FF FF FF FF FF FF FF FF FF FF FF FF FF FF FF 
  0080  FF FF FF FF FF FF FF FF FF FF FF FF FF FF FF FF 
  0090  FF FF FF FF FF FF FF FF FF FF FF FF FF FF FF FF 
  00A0  FF FF FF FF FF FF FF FF FF FF FF FF FF FF FF FF 
  00B0  FF FF FF FF FF FF FF FF FF FF FF FF FF FF FF FF 
  00C0  FF FF FF FF FF FF FF FF FF FF FF FF FF FF FF FF 
  00D0  FF FF FF FF FF FF FF FF FF FF FF FF FF FF FF FF 
  00E0  FF FF FF FF FF FF FF FF FF FF FF FF FF FF FF FF 
  00F0  FF FF FF FF FF FF FF FF FF FF FF FF FF FF FF FF 
  0100  FF FF FF FF FF FF FF FF FF FF FF FF FF FF FF FF 
  0110  FF FF FF FF FF FF FF FF FF FF FF FF FF FF FF FF 
  0120  FF FF FF FF FF FF FF FF FF FF FF FF FF FF FF FF 
  0130  FF FF FF FF FF FF FF FF FF FF FF FF FF FF FF FF 
  0140  FF FF FF FF FF FF FF FF FF FF FF FF FF FF FF FF 
  0150  FF FF FF FF FF FF FF FF FF FF FF FF FF FF FF FF 
  0160  FF FF FF FF FF FF FF FF FF FF FF FF FF FF FF FF 
  0170  FF FF FF FF FF FF FF FF FF FF FF FF FF FF FF FF 
  0180  FF FF FF FF FF FF FF FF FF FF FF FF FF FF FF FF 
  0190  FF FF FF FF FF FF FF FF FF FF FF FF FF FF FF FF 
  01A0  FF FF FF FF FF FF FF FF FF FF FF FF FF FF FF FF 
  01B0  FF FF FF FF FF FF FF FF FF FF FF FF FF FF FF FF 
  01C0  FF FF FF FF FF FF FF FF FF FF FF FF FF FF FF FF 
  01D0  FF FF FF FF FF FF FF FF FF FF FF FF FF FF FF FF 
  01E0  FF FF FF FF FF FF FF FF FF FF FF FF FF FF FF FF 
  01F0  FF FF FF FF FF FF FF FF FF FF FF FF FF FF FF FF 
  0200  FF FF FF FF FF FF FF FF FF FF FF FF FF FF FF FF 
  0210  FF FF FF FF FF FF FF FF FF FF FF FF FF FF FF FF 
  0220  FF FF FF FF FF FF FF FF FF FF FF FF FF FF FF FF 
  0230  FF FF FF FF FF FF FF FF FF FF FF FF FF FF FF FF 
  0240  FF FF FF FF FF FF FF FF FF FF FF FF FF FF FF FF 
  0250  FF FF FF FF FF FF FF FF FF FF FF FF FF FF FF FF 
  0260  FF FF FF FF FF FF FF FF FF FF FF FF FF FF FF FF 
  0270  FF FF FF FF FF FF FF FF FF FF FF FF FF FF FF FF 
  0280  FF FF FF FF FF FF FF FF FF FF FF FF FF FF FF FF 
  0290  FF FF FF FF FF FF FF FF FF FF FF FF FF FF FF FF 
  02A0  FF FF FF FF FF FF FF FF FF FF FF FF FF FF FF FF 
  02B0  FF FF FF FF FF FF FF FF FF FF FF FF FF FF FF FF 
  02C0  FF FF FF FF FF FF FF FF FF FF FF FF FF FF FF FF 
  02D0  FF FF FF FF FF FF FF FF FF FF FF FF FF FF FF FF 
  02E0  FF FF FF FF FF FF FF FF FF FF FF FF FF FF FF FF 
  02F0  FF FF FF FF FF FF FF FF FF FF FF FF FF FF FF FF 
  0300  FF FF FF FF FF FF FF FF FF FF FF FF FF FF FF FF 
  0310  FF FF FF FF FF FF FF FF FF FF FF FF FF FF FF FF 
  0320  FF FF FF FF FF FF FF FF FF FF FF FF FF FF FF FF 
  0330  FF FF FF FF FF FF FF FF FF FF FF FF FF FF FF FF 
  0340  FF FF FF FF FF FF FF FF FF FF FF FF FF FF FF FF 
  0350  FF FF FF FF FF FF FF FF FF FF FF FF FF FF FF FF 
  0360  FF FF FF FF FF FF FF FF FF FF FF FF FF FF FF FF 
  0370  FF FF FF FF FF FF FF FF FF FF FF FF FF FF FF FF 
  0380  FF FF FF FF FF FF FF FF FF FF FF FF FF FF FF FF 
  0390  FF FF FF FF FF FF FF FF FF FF FF FF FF FF FF FF 
  03A0  FF FF FF FF FF FF FF FF FF FF FF FF FF FF FF FF 
  03B0  FF FF FF FF FF FF FF FF FF FF FF FF FF FF FF FF 
  03C0  FF FF FF FF FF FF FF FF FF FF FF FF FF FF FF FF 
  03D0  FF FF FF FF FF FF FF FF FF FF FF FF FF FF FF FF 
  03E0  FF FF FF FF FF FF FF FF FF FF FF FF FF FF FF FF 
  03F0  FF FF FF FF FF FF FF FF FF FF FF FF FF FF FF FF 
