------[ Versions ]------

Program Version : AIDA64 Engineer v6.32.5600
BenchDLL Version: 4.5.841.8-x64
Windows Version : Microsoft Windows 10 Pro 10.0.19042.985 (64-bit)
GetProductInfo  : 0x00000030

------[ CPU Info ]------

CPU Type          : QuadCore Intel Celeron N5100, 1075 MHz (28 x 38)
CPU Alias         : Jasper Lake-M
CPU Stepping      : A0
Instruction Set   : x86, x86-64, MMX, SSE, SSE2, SSE3, SSSE3, SSE4.1, SSE4.2, AES, SHA
CPUID Manufacturer: GenuineIntel
CPUID CPU Name    : Intel(R) Celeron(R) N5100 @ 1.10GHz
CPUID Revision    : 000906C0h
IA Brand ID       : 00h  (Unknown)
Platform ID       : FFh  (Unknown)
HTT / CMP Units   : 0 / 4
Max. NUMA Node    : 0

Tjmax Temperature          : 105 Celsius
HTC Temperature Limit      : 0 Celsius
CPU TDP                    : 6 W
CPU TDC                    : 60 A
CPU Max Power Limit        : Unlimited Power / Unlimited Time
CPU Power Limit 1 (Long)   : 9 W / 8.00 sec  (Unlocked)
CPU Power Limit 2 (Short)  : 15 W / 2.44 ms  (Unlocked)
Max Turbo Boost Multipliers: 1C: 28x, 2C: 28x, 3C: 28x, 4C: 28x

------[ Motherboard Info ]------

Motherboard ID      : <DMI>
Motherboard Model   : INET Z156

DMI MB Manufacturer : INET
DMI MB Product      : Z156
DMI MB Version      : Default string
DMI MB Serial       : Default string
DMI SYS Manufacturer: INET
DMI SYS Product     : Z156
DMI SYS Version     : Default string
DMI SYS Serial      : Default string
DMI BIOS Version    : Z156D.2102014.02


------[ CPUID Registers / Logical CPU #0 ]------

allcpu: Package 0 / Core 0 / Thread 0: Valid

CPUID 00000000: 0000001B-756E6547-6C65746E-49656E69 [GenuineIntel]
CPUID 00000001: 000906C0-00800800-4FF8EBBF-BFEBFBFF
CPUID 00000002: 00FEFF01-00000000-00000000-00000000
CPUID 00000003: 00000000-00000000-00000000-00000000
CPUID 00000004: FC000121-01C0003F-0000003F-00000000 [SL 00] [L1D: 32 KB]
CPUID 00000004: FC000122-01C0003F-0000003F-00000000 [SL 01] [L1I: 32 KB]
CPUID 00000004: FC01C143-02C0003F-000007FF-00000000 [SL 02] [L2U: 1536 KB]
CPUID 00000004: FC1FC163-03C0003F-00000FFF-00000006 [SL 03] [L3U: 4 MB]
CPUID 00000005: 00000040-00000040-00000003-11122020
CPUID 00000006: 00178FF7-00000002-00000009-00000000
CPUID 00000007: 00000000-2394A2C3-18400124-FC000400 [SL 00]
CPUID 00000008: 00000000-00000000-00000000-00000000
CPUID 00000009: 00000000-00000000-00000000-00000000
CPUID 0000000A: 07300405-00000000-00000007-00008603
CPUID 0000000B: 00000001-00000001-00000100-00000000 [SL 00]
CPUID 0000000B: 00000007-00000004-00000201-00000000 [SL 01]
CPUID 0000000C: 00000000-00000000-00000000-00000000
CPUID 0000000D: 00000003-00000240-00000240-00000000 [SL 00] [x87]
CPUID 0000000D: 0000000F-000002C0-00000100-00000000 [SL 01] [SSE]
CPUID 0000000D: 00000080-00000000-00000001-00000000 [SL 08] [PT]
CPUID 0000000E: 00000000-00000000-00000000-00000000
CPUID 0000000F: 00000000-00000000-00000000-00000000 [SL 00]
CPUID 0000000F: 00000000-00000000-00000000-00000000 [SL 01]
CPUID 00000010: 00000000-00000004-00000000-00000000 [SL 00]
CPUID 00000010: 00000000-00000000-00000000-00000000 [SL 01]
CPUID 00000011: 00000000-00000000-00000000-00000000
CPUID 00000012: 00000000-00000000-00000000-00000000 [SL 00]
CPUID 00000012: 00000000-00000000-00000000-00000000 [SL 01]
CPUID 00000013: 00000000-00000000-00000000-00000000
CPUID 00000014: 00000001-0000007F-80000007-00000000 [SL 00]
CPUID 00000014: 02490002-003FFFFF-00000000-00000000 [SL 01]
CPUID 00000015: 00000002-0000003A-0249F000-00000000 [29.00x / 38400000]
CPUID 00000016: 0000044C-00000AF0-00000064-00000000 [1100 / 2800 / 100]
CPUID 00000017: 00000000-00000000-00000000-00000000 [SL 00]
CPUID 00000018: 00000005-00000000-00000000-00000000 [SL 00]
CPUID 00000018: 00000000-00300001-00000001-00000121 [SL 01]
CPUID 00000018: 00000000-00040001-00000100-00000043 [SL 02]
CPUID 00000018: 00000000-00040006-00000010-00000043 [SL 03]
CPUID 00000018: 00000000-00300001-00000001-00000122 [SL 04]
CPUID 00000018: 00000000-00000000-00000000-00000000 [SL 05]
CPUID 00000019: 00000000-00000000-00000000-00000000
CPUID 0000001A: 20000000-00000000-00000000-00000000
CPUID 0000001B: 00000000-00000000-00000000-00000000
CPUID 80000000: 80000008-00000000-00000000-00000000
CPUID 80000001: 00000000-00000000-00000101-28100000
CPUID 80000002: 65746E49-2952286C-6C654320-6E6F7265 [Intel(R) Celeron]
CPUID 80000003: 20295228-3031354E-20402030-30312E31 [(R) N5100 @ 1.10]
CPUID 80000004: 007A4847-00000000-00000000-00000000 [GHz]
CPUID 80000005: 00000000-00000000-00000000-00000000 [L1D: 0 KB / L1I: 0 KB]
CPUID 80000006: 00000000-00000000-06006040-00000000 [L2: 1536 KB] / L3: 0 KB]
CPUID 80000007: 00000000-00000000-00000000-00000100
CPUID 80000008: 00003027-00000000-00000000-00000000

L1    Data Cache:    32 KB,  8-way Associative, 64-byte Line
L1  Instr. Cache:    32 KB,  8-way Associative, 64-byte Line
L2 Unified Cache:  1536 KB, 12-way Associative, 64-byte Line
L3 Unified Cache:     4 MB, 16-way Associative, 64-byte Line

------[ CPUID Registers / Logical CPU #1 ]------

allcpu: Package 0 / Core 1 / Thread 0: Valid

CPUID 00000000: 0000001B-756E6547-6C65746E-49656E69 [GenuineIntel]
CPUID 00000001: 000906C0-02800800-4FF8EBBF-BFEBFBFF
CPUID 00000002: 00FEFF01-00000000-00000000-00000000
CPUID 00000003: 00000000-00000000-00000000-00000000
CPUID 00000004: FC000121-01C0003F-0000003F-00000000 [SL 00] [L1D: 32 KB]
CPUID 00000004: FC000122-01C0003F-0000003F-00000000 [SL 01] [L1I: 32 KB]
CPUID 00000004: FC01C143-02C0003F-000007FF-00000000 [SL 02] [L2U: 1536 KB]
CPUID 00000004: FC1FC163-03C0003F-00000FFF-00000006 [SL 03] [L3U: 4 MB]
CPUID 00000005: 00000040-00000040-00000003-11122020
CPUID 00000006: 00178FF7-00000002-00000009-00000000
CPUID 00000007: 00000000-2394A2C3-18400124-FC000400 [SL 00]
CPUID 00000008: 00000000-00000000-00000000-00000000
CPUID 00000009: 00000000-00000000-00000000-00000000
CPUID 0000000A: 07300405-00000000-00000007-00008603
CPUID 0000000B: 00000001-00000001-00000100-00000002 [SL 00]
CPUID 0000000B: 00000007-00000004-00000201-00000002 [SL 01]
CPUID 0000000C: 00000000-00000000-00000000-00000000
CPUID 0000000D: 00000003-00000240-00000240-00000000 [SL 00] [x87]
CPUID 0000000D: 0000000F-000002C0-00000100-00000000 [SL 01] [SSE]
CPUID 0000000D: 00000080-00000000-00000001-00000000 [SL 08] [PT]
CPUID 0000000E: 00000000-00000000-00000000-00000000
CPUID 0000000F: 00000000-00000000-00000000-00000000 [SL 00]
CPUID 0000000F: 00000000-00000000-00000000-00000000 [SL 01]
CPUID 00000010: 00000000-00000004-00000000-00000000 [SL 00]
CPUID 00000010: 00000000-00000000-00000000-00000000 [SL 01]
CPUID 00000011: 00000000-00000000-00000000-00000000
CPUID 00000012: 00000000-00000000-00000000-00000000 [SL 00]
CPUID 00000012: 00000000-00000000-00000000-00000000 [SL 01]
CPUID 00000013: 00000000-00000000-00000000-00000000
CPUID 00000014: 00000001-0000007F-80000007-00000000 [SL 00]
CPUID 00000014: 02490002-003FFFFF-00000000-00000000 [SL 01]
CPUID 00000015: 00000002-0000003A-0249F000-00000000 [29.00x / 38400000]
CPUID 00000016: 0000044C-00000AF0-00000064-00000000 [1100 / 2800 / 100]
CPUID 00000017: 00000000-00000000-00000000-00000000 [SL 00]
CPUID 00000018: 00000005-00000000-00000000-00000000 [SL 00]
CPUID 00000018: 00000000-00300001-00000001-00000121 [SL 01]
CPUID 00000018: 00000000-00040001-00000100-00000043 [SL 02]
CPUID 00000018: 00000000-00040006-00000010-00000043 [SL 03]
CPUID 00000018: 00000000-00300001-00000001-00000122 [SL 04]
CPUID 00000018: 00000000-00000000-00000000-00000000 [SL 05]
CPUID 00000019: 00000000-00000000-00000000-00000000
CPUID 0000001A: 20000000-00000000-00000000-00000000
CPUID 0000001B: 00000000-00000000-00000000-00000000
CPUID 80000000: 80000008-00000000-00000000-00000000
CPUID 80000001: 00000000-00000000-00000101-28100000
CPUID 80000002: 65746E49-2952286C-6C654320-6E6F7265 [Intel(R) Celeron]
CPUID 80000003: 20295228-3031354E-20402030-30312E31 [(R) N5100 @ 1.10]
CPUID 80000004: 007A4847-00000000-00000000-00000000 [GHz]
CPUID 80000005: 00000000-00000000-00000000-00000000 [L1D: 0 KB / L1I: 0 KB]
CPUID 80000006: 00000000-00000000-06006040-00000000 [L2: 1536 KB] / L3: 0 KB]
CPUID 80000007: 00000000-00000000-00000000-00000100
CPUID 80000008: 00003027-00000000-00000000-00000000

L1    Data Cache:    32 KB,  8-way Associative, 64-byte Line
L1  Instr. Cache:    32 KB,  8-way Associative, 64-byte Line
L2 Unified Cache:  1536 KB, 12-way Associative, 64-byte Line
L3 Unified Cache:     4 MB, 16-way Associative, 64-byte Line

------[ CPUID Registers / Logical CPU #2 ]------

allcpu: Package 0 / Core 2 / Thread 0: Valid

CPUID 00000000: 0000001B-756E6547-6C65746E-49656E69 [GenuineIntel]
CPUID 00000001: 000906C0-04800800-4FF8EBBF-BFEBFBFF
CPUID 00000002: 00FEFF01-00000000-00000000-00000000
CPUID 00000003: 00000000-00000000-00000000-00000000
CPUID 00000004: FC000121-01C0003F-0000003F-00000000 [SL 00] [L1D: 32 KB]
CPUID 00000004: FC000122-01C0003F-0000003F-00000000 [SL 01] [L1I: 32 KB]
CPUID 00000004: FC01C143-02C0003F-000007FF-00000000 [SL 02] [L2U: 1536 KB]
CPUID 00000004: FC1FC163-03C0003F-00000FFF-00000006 [SL 03] [L3U: 4 MB]
CPUID 00000005: 00000040-00000040-00000003-11122020
CPUID 00000006: 00178FF7-00000002-00000009-00000000
CPUID 00000007: 00000000-2394A2C3-18400124-FC000400 [SL 00]
CPUID 00000008: 00000000-00000000-00000000-00000000
CPUID 00000009: 00000000-00000000-00000000-00000000
CPUID 0000000A: 07300405-00000000-00000007-00008603
CPUID 0000000B: 00000001-00000001-00000100-00000004 [SL 00]
CPUID 0000000B: 00000007-00000004-00000201-00000004 [SL 01]
CPUID 0000000C: 00000000-00000000-00000000-00000000
CPUID 0000000D: 00000003-00000240-00000240-00000000 [SL 00] [x87]
CPUID 0000000D: 0000000F-000002C0-00000100-00000000 [SL 01] [SSE]
CPUID 0000000D: 00000080-00000000-00000001-00000000 [SL 08] [PT]
CPUID 0000000E: 00000000-00000000-00000000-00000000
CPUID 0000000F: 00000000-00000000-00000000-00000000 [SL 00]
CPUID 0000000F: 00000000-00000000-00000000-00000000 [SL 01]
CPUID 00000010: 00000000-00000004-00000000-00000000 [SL 00]
CPUID 00000010: 00000000-00000000-00000000-00000000 [SL 01]
CPUID 00000011: 00000000-00000000-00000000-00000000
CPUID 00000012: 00000000-00000000-00000000-00000000 [SL 00]
CPUID 00000012: 00000000-00000000-00000000-00000000 [SL 01]
CPUID 00000013: 00000000-00000000-00000000-00000000
CPUID 00000014: 00000001-0000007F-80000007-00000000 [SL 00]
CPUID 00000014: 02490002-003FFFFF-00000000-00000000 [SL 01]
CPUID 00000015: 00000002-0000003A-0249F000-00000000 [29.00x / 38400000]
CPUID 00000016: 0000044C-00000AF0-00000064-00000000 [1100 / 2800 / 100]
CPUID 00000017: 00000000-00000000-00000000-00000000 [SL 00]
CPUID 00000018: 00000005-00000000-00000000-00000000 [SL 00]
CPUID 00000018: 00000000-00300001-00000001-00000121 [SL 01]
CPUID 00000018: 00000000-00040001-00000100-00000043 [SL 02]
CPUID 00000018: 00000000-00040006-00000010-00000043 [SL 03]
CPUID 00000018: 00000000-00300001-00000001-00000122 [SL 04]
CPUID 00000018: 00000000-00000000-00000000-00000000 [SL 05]
CPUID 00000019: 00000000-00000000-00000000-00000000
CPUID 0000001A: 20000000-00000000-00000000-00000000
CPUID 0000001B: 00000000-00000000-00000000-00000000
CPUID 80000000: 80000008-00000000-00000000-00000000
CPUID 80000001: 00000000-00000000-00000101-28100000
CPUID 80000002: 65746E49-2952286C-6C654320-6E6F7265 [Intel(R) Celeron]
CPUID 80000003: 20295228-3031354E-20402030-30312E31 [(R) N5100 @ 1.10]
CPUID 80000004: 007A4847-00000000-00000000-00000000 [GHz]
CPUID 80000005: 00000000-00000000-00000000-00000000 [L1D: 0 KB / L1I: 0 KB]
CPUID 80000006: 00000000-00000000-06006040-00000000 [L2: 1536 KB] / L3: 0 KB]
CPUID 80000007: 00000000-00000000-00000000-00000100
CPUID 80000008: 00003027-00000000-00000000-00000000

L1    Data Cache:    32 KB,  8-way Associative, 64-byte Line
L1  Instr. Cache:    32 KB,  8-way Associative, 64-byte Line
L2 Unified Cache:  1536 KB, 12-way Associative, 64-byte Line
L3 Unified Cache:     4 MB, 16-way Associative, 64-byte Line

------[ CPUID Registers / Logical CPU #3 ]------

allcpu: Package 0 / Core 3 / Thread 0: Valid

CPUID 00000000: 0000001B-756E6547-6C65746E-49656E69 [GenuineIntel]
CPUID 00000001: 000906C0-06800800-4FF8EBBF-BFEBFBFF
CPUID 00000002: 00FEFF01-00000000-00000000-00000000
CPUID 00000003: 00000000-00000000-00000000-00000000
CPUID 00000004: FC000121-01C0003F-0000003F-00000000 [SL 00] [L1D: 32 KB]
CPUID 00000004: FC000122-01C0003F-0000003F-00000000 [SL 01] [L1I: 32 KB]
CPUID 00000004: FC01C143-02C0003F-000007FF-00000000 [SL 02] [L2U: 1536 KB]
CPUID 00000004: FC1FC163-03C0003F-00000FFF-00000006 [SL 03] [L3U: 4 MB]
CPUID 00000005: 00000040-00000040-00000003-11122020
CPUID 00000006: 00178FF7-00000002-00000009-00000000
CPUID 00000007: 00000000-2394A2C3-18400124-FC000400 [SL 00]
CPUID 00000008: 00000000-00000000-00000000-00000000
CPUID 00000009: 00000000-00000000-00000000-00000000
CPUID 0000000A: 07300405-00000000-00000007-00008603
CPUID 0000000B: 00000001-00000001-00000100-00000006 [SL 00]
CPUID 0000000B: 00000007-00000004-00000201-00000006 [SL 01]
CPUID 0000000C: 00000000-00000000-00000000-00000000
CPUID 0000000D: 00000003-00000240-00000240-00000000 [SL 00] [x87]
CPUID 0000000D: 0000000F-000002C0-00000100-00000000 [SL 01] [SSE]
CPUID 0000000D: 00000080-00000000-00000001-00000000 [SL 08] [PT]
CPUID 0000000E: 00000000-00000000-00000000-00000000
CPUID 0000000F: 00000000-00000000-00000000-00000000 [SL 00]
CPUID 0000000F: 00000000-00000000-00000000-00000000 [SL 01]
CPUID 00000010: 00000000-00000004-00000000-00000000 [SL 00]
CPUID 00000010: 00000000-00000000-00000000-00000000 [SL 01]
CPUID 00000011: 00000000-00000000-00000000-00000000
CPUID 00000012: 00000000-00000000-00000000-00000000 [SL 00]
CPUID 00000012: 00000000-00000000-00000000-00000000 [SL 01]
CPUID 00000013: 00000000-00000000-00000000-00000000
CPUID 00000014: 00000001-0000007F-80000007-00000000 [SL 00]
CPUID 00000014: 02490002-003FFFFF-00000000-00000000 [SL 01]
CPUID 00000015: 00000002-0000003A-0249F000-00000000 [29.00x / 38400000]
CPUID 00000016: 0000044C-00000AF0-00000064-00000000 [1100 / 2800 / 100]
CPUID 00000017: 00000000-00000000-00000000-00000000 [SL 00]
CPUID 00000018: 00000005-00000000-00000000-00000000 [SL 00]
CPUID 00000018: 00000000-00300001-00000001-00000121 [SL 01]
CPUID 00000018: 00000000-00040001-00000100-00000043 [SL 02]
CPUID 00000018: 00000000-00040006-00000010-00000043 [SL 03]
CPUID 00000018: 00000000-00300001-00000001-00000122 [SL 04]
CPUID 00000018: 00000000-00000000-00000000-00000000 [SL 05]
CPUID 00000019: 00000000-00000000-00000000-00000000
CPUID 0000001A: 20000000-00000000-00000000-00000000
CPUID 0000001B: 00000000-00000000-00000000-00000000
CPUID 80000000: 80000008-00000000-00000000-00000000
CPUID 80000001: 00000000-00000000-00000101-28100000
CPUID 80000002: 65746E49-2952286C-6C654320-6E6F7265 [Intel(R) Celeron]
CPUID 80000003: 20295228-3031354E-20402030-30312E31 [(R) N5100 @ 1.10]
CPUID 80000004: 007A4847-00000000-00000000-00000000 [GHz]
CPUID 80000005: 00000000-00000000-00000000-00000000 [L1D: 0 KB / L1I: 0 KB]
CPUID 80000006: 00000000-00000000-06006040-00000000 [L2: 1536 KB] / L3: 0 KB]
CPUID 80000007: 00000000-00000000-00000000-00000100
CPUID 80000008: 00003027-00000000-00000000-00000000

L1    Data Cache:    32 KB,  8-way Associative, 64-byte Line
L1  Instr. Cache:    32 KB,  8-way Associative, 64-byte Line
L2 Unified Cache:  1536 KB, 12-way Associative, 64-byte Line
L3 Unified Cache:     4 MB, 16-way Associative, 64-byte Line

------[ All CPUs ]------

CPU   0: APICID    0 / Package 0 / Core   0 / Thread 0: Valid
CPU   1: APICID    2 / Package 0 / Core   1 / Thread 0: Valid
CPU   2: APICID    4 / Package 0 / Core   2 / Thread 0: Valid
CPU   3: APICID    6 / Package 0 / Core   3 / Thread 0: Valid

------[ MSR Registers / Logical CPU #0 ]------

MSR 00000017: 0000-0000-0000-0000 [PlatID = 0]
MSR 0000001B: 0000-0000-FEE0-0D00
MSR 0000002A: 0000-0000-0000-0000
MSR 00000035: 0000-0000-0004-0004
MSR 00000048: 0000-0000-0000-0001
MSR 00000049: < FAILED >
MSR 0000008B: 0000-0019-0000-0000
MSR 000000CD: < FAILED >
MSR 000000CE: 0004-0830-F081-0B00 [eD = 0]
MSR 000000E7: 0000-000E-F8AE-931E [S200]
MSR 000000E7: 0000-000E-F983-DEF2 [S200]
MSR 000000E7: 0000-000E-FA3B-516D
MSR 000000E8: 0000-0022-1831-6CC6 [S200]
MSR 000000E8: 0000-0022-19CF-4B0E [S200]
MSR 000000E8: 0000-0022-1C45-2893
MSR 000000EE: < FAILED >
MSR 0000010A: 0000-0000-0000-006B
MSR 0000010B: < FAILED >
MSR 0000011E: < FAILED >
MSR 00000194: 0000-0000-0001-0000
MSR 00000198: 0000-1A28-0000-1400 [S200]
MSR 00000198: 0000-2266-0000-1C00 [S200]
MSR 00000198: 0000-163D-0000-0B00
MSR 00000199: 0000-0000-0000-1C00
MSR 0000019A: 0000-0000-0000-0000
MSR 0000019B: 0000-0000-0000-0010
MSR 0000019C: 0000-0000-883B-0A82 [S200]
MSR 0000019C: 0000-0000-883B-0A82 [S200]
MSR 0000019C: 0000-0000-883B-0A82
MSR 0000019D: 0000-0000-0000-0000
MSR 000001A0: 0000-0000-0085-0089
MSR 000001A2: 0000-0000-8069-0000
MSR 000001A4: 0000-0000-0000-0004
MSR 000001AA: 0000-0000-0040-10C0
MSR 000001AC: < FAILED >
MSR 000001AD: 1C1C-1C1C-1C1C-1C1C
MSR 000001B0: 0000-0000-0000-0006
MSR 000001B1: 0000-0000-8833-0A82
MSR 000001B2: 0000-0000-0000-0000
MSR 000001FC: 0000-0000-0824-005F
MSR 00000300: < FAILED >
MSR 0000030A: 0000-0000-0277-A3DD [S200]
MSR 0000030A: 0000-0000-0277-A3DD [S200]
MSR 0000030A: 0000-0000-0277-A3DD
MSR 0000030B: 0000-0000-00FF-5B36 [S200]
MSR 0000030B: 0000-0000-00FF-5B36 [S200]
MSR 0000030B: 0000-0000-00FF-5B36
MSR 00000480: 00DA-0500-0000-0013
MSR 00000481: 0000-00FF-0000-0016
MSR 00000482: FFF9-FFFE-0401-E172
MSR 00000483: 037F-FFFF-0003-6DFF
MSR 00000484: 0006-FFFF-0000-11FF
MSR 00000485: 0000-0000-7004-C1E7
MSR 00000486: 0000-0000-8000-0021
MSR 00000487: 0000-0000-FFFF-FFFF
MSR 00000488: 0000-0000-0000-2000
MSR 00000489: 0000-0000-0035-2FFF
MSR 0000048A: 0000-0000-0000-002E
MSR 0000048B: 07DD-6FFF-0000-0000
MSR 0000048C: 0000-0F01-0671-4141
MSR 0000048D: 0000-00FF-0000-0016
MSR 0000048E: FFF9-FFFE-0400-6172
MSR 0000048F: 037F-FFFF-0003-6DFB
MSR 00000490: 0006-FFFF-0000-11FB
MSR 00000601: 0000-0000-0000-01E0
MSR 00000602: < FAILED >
MSR 00000603: 0036-0000-0036-3636
MSR 00000604: < FAILED >
MSR 00000606: 0000-0000-000A-0E03
MSR 0000060A: 0000-0000-0000-0000
MSR 0000060B: 0000-0000-0000-0000
MSR 0000060C: 0000-0000-0000-0000
MSR 0000060D: 0000-0000-0000-0000
MSR 00000610: 0042-8078-001B-8048
MSR 00000611: 0000-0000-07EB-8C7B [S200]
MSR 00000611: 0000-0000-07EB-AB25 [S200]
MSR 00000611: 0000-0000-07EB-CD21
MSR 00000613: 0000-0000-0000-0000
MSR 00000614: 0000-0000-0000-0030
MSR 00000618: 0054-00DE-0000-0000
MSR 00000619: 0000-0000-0000-0000 [S200]
MSR 00000619: 0000-0000-0000-0000 [S200]
MSR 00000619: 0000-0000-0000-0000
MSR 0000061B: 0000-0000-0000-0000
MSR 0000061C: < FAILED >
MSR 00000638: 0000-0000-0000-0000
MSR 00000639: 0000-0000-01AA-10C4 [S200]
MSR 00000639: 0000-0000-01AA-12C1 [S200]
MSR 00000639: 0000-0000-01AA-1526
MSR 0000063A: 0000-0000-0000-0009
MSR 0000063B: < FAILED >
MSR 00000640: 0000-0000-0000-0000
MSR 00000641: 0000-0000-0161-7863 [S200]
MSR 00000641: 0000-0000-0161-7CFB [S200]
MSR 00000641: 0000-0000-0161-810C
MSR 00000642: 0000-0000-0000-000D
MSR 00000660: 0000-000A-61B6-FF4D
MSR 00000661: < FAILED >
MSR 00000662: < FAILED >
MSR 00000663: < FAILED >
MSR 00000664: 0000-0068-6781-CFEB
MSR 00000665: < FAILED >
MSR 00000666: < FAILED >
MSR 00000667: < FAILED >
MSR 00000668: < FAILED >
MSR 00000669: < FAILED >
MSR 0000066A: < FAILED >
MSR 0000066B: < FAILED >
MSR 0000066C: < FAILED >
MSR 0000066D: < FAILED >
MSR 0000066E: < FAILED >
MSR 0000066F: < FAILED >
MSR 00000670: < FAILED >
MSR 00000671: < FAILED >
MSR 00000672: < FAILED >
MSR 00000673: < FAILED >
MSR 00000674: < FAILED >
MSR 00000675: < FAILED >
MSR 00000676: < FAILED >
MSR 00000677: < FAILED >
MSR 00000770: 0000-0000-0000-0001
MSR 00000771: 0000-0000-0108-0B1C
MSR 00000772: 0000-019E-5400-1C0B
MSR 00000773: 0000-0000-0000-0005
MSR 00000774: 0000-059E-5400-1C0B
MSR 00000777: 0000-0000-0000-0004
MSR 00000832: 0000-0000-0003-00D1
MSR 00000838: 0000-0000-0000-0000
MSR 00000839: 0000-0000-0000-0000
MSR 0000083E: 0000-0000-0000-000A

------[ MSR Registers / Logical CPU #1 ]------

MSR 00000017: 0000-0000-0000-0000 [PlatID = 0]
MSR 0000001B: 0000-0000-FEE0-0C00
MSR 0000002A: 0000-0000-0000-0000
MSR 00000035: 0000-0000-0004-0004
MSR 00000048: 0000-0000-0000-0001
MSR 00000049: < FAILED >
MSR 0000008B: 0000-0019-0000-0000
MSR 000000CD: < FAILED >
MSR 000000CE: 0004-0830-F081-0B00 [eD = 0]
MSR 000000E7: 0000-0091-0EA8-7225
MSR 000000E8: 0000-00AF-98E0-CD8E
MSR 000000EE: < FAILED >
MSR 0000010A: 0000-0000-0000-006B
MSR 0000010B: < FAILED >
MSR 0000011E: < FAILED >
MSR 00000194: 0000-0000-0001-0000
MSR 00000198: 0000-227A-0000-1C00
MSR 00000199: 0000-0000-0000-1C00
MSR 0000019A: 0000-0000-0000-0000
MSR 0000019B: 0000-0000-0000-0010
MSR 0000019C: 0000-0000-883B-0A82
MSR 0000019D: 0000-0000-0000-0000
MSR 000001A0: 0000-0000-0085-0089
MSR 000001A2: 0000-0000-8069-0000
MSR 000001A4: 0000-0000-0000-0000
MSR 000001AA: 0000-0000-0040-10C0
MSR 000001AC: < FAILED >
MSR 000001AD: 1C1C-1C1C-1C1C-1C1C
MSR 000001B0: 0000-0000-0000-0006
MSR 000001B1: 0000-0000-8835-0A82
MSR 000001B2: 0000-0000-0000-0000
MSR 000001FC: 0000-0000-0824-005F
MSR 00000300: < FAILED >
MSR 0000030A: 0000-0000-01AB-62E3
MSR 0000030B: 0000-0000-00AA-5886
MSR 00000480: 00DA-0500-0000-0013
MSR 00000481: 0000-00FF-0000-0016
MSR 00000482: FFF9-FFFE-0401-E172
MSR 00000483: 037F-FFFF-0003-6DFF
MSR 00000484: 0006-FFFF-0000-11FF
MSR 00000485: 0000-0000-7004-C1E7
MSR 00000486: 0000-0000-8000-0021
MSR 00000487: 0000-0000-FFFF-FFFF
MSR 00000488: 0000-0000-0000-2000
MSR 00000489: 0000-0000-0035-2FFF
MSR 0000048A: 0000-0000-0000-002E
MSR 0000048B: 07DD-6FFF-0000-0000
MSR 0000048C: 0000-0F01-0671-4141
MSR 0000048D: 0000-00FF-0000-0016
MSR 0000048E: FFF9-FFFE-0400-6172
MSR 0000048F: 037F-FFFF-0003-6DFB
MSR 00000490: 0006-FFFF-0000-11FB
MSR 00000601: 0000-0000-0000-01E0
MSR 00000602: < FAILED >
MSR 00000603: 0036-0000-0036-3636
MSR 00000604: < FAILED >
MSR 00000606: 0000-0000-000A-0E03
MSR 0000060A: 0000-0000-0000-0000
MSR 0000060B: 0000-0000-0000-0000
MSR 0000060C: 0000-0000-0000-0000
MSR 0000060D: 0000-0000-0000-0000
MSR 00000610: 0042-8078-001B-8048
MSR 00000611: 0000-0000-07EC-8DDE
MSR 00000613: 0000-0000-0000-0000
MSR 00000614: 0000-0000-0000-0030
MSR 00000618: 0054-00DE-0000-0000
MSR 00000619: 0000-0000-0000-0000
MSR 0000061B: 0000-0000-0000-0000
MSR 0000061C: < FAILED >
MSR 00000638: 0000-0000-0000-0000
MSR 00000639: 0000-0000-01AA-1BA3
MSR 0000063A: 0000-0000-0000-0009
MSR 0000063B: < FAILED >
MSR 00000640: 0000-0000-0000-0000
MSR 00000641: 0000-0000-0161-81CA
MSR 00000642: 0000-0000-0000-000D
MSR 00000660: 0000-0027-EA0B-0117
MSR 00000661: < FAILED >
MSR 00000662: < FAILED >
MSR 00000663: < FAILED >
MSR 00000664: 0000-0068-6781-CFEB
MSR 00000665: < FAILED >
MSR 00000666: < FAILED >
MSR 00000667: < FAILED >
MSR 00000668: < FAILED >
MSR 00000669: < FAILED >
MSR 0000066A: < FAILED >
MSR 0000066B: < FAILED >
MSR 0000066C: < FAILED >
MSR 0000066D: < FAILED >
MSR 0000066E: < FAILED >
MSR 0000066F: < FAILED >
MSR 00000670: < FAILED >
MSR 00000671: < FAILED >
MSR 00000672: < FAILED >
MSR 00000673: < FAILED >
MSR 00000674: < FAILED >
MSR 00000675: < FAILED >
MSR 00000676: < FAILED >
MSR 00000677: < FAILED >
MSR 00000770: 0000-0000-0000-0001
MSR 00000771: 0000-0000-0108-0B1C
MSR 00000772: 0000-019E-5400-1C0B
MSR 00000773: 0000-0000-0000-0005
MSR 00000774: 0000-059E-0000-1C0B
MSR 00000777: 0000-0000-0000-0004
MSR 00000832: 0000-0000-0002-00D1
MSR 00000838: 0000-0000-0000-124F
MSR 00000839: 0000-0000-0000-0C2C
MSR 0000083E: 0000-0000-0000-000A

------[ MSR Registers / Logical CPU #2 ]------

MSR 00000017: 0000-0000-0000-0000 [PlatID = 0]
MSR 0000001B: 0000-0000-FEE0-0C00
MSR 0000002A: 0000-0000-0000-0000
MSR 00000035: 0000-0000-0004-0004
MSR 00000048: 0000-0000-0000-0001
MSR 00000049: < FAILED >
MSR 0000008B: 0000-0019-0000-0000
MSR 000000CD: < FAILED >
MSR 000000CE: 0004-0830-F081-0B00 [eD = 0]
MSR 000000E7: 0000-004D-9D45-A678
MSR 000000E8: 0000-0066-2946-5DB5
MSR 000000EE: < FAILED >
MSR 0000010A: 0000-0000-0000-006B
MSR 0000010B: < FAILED >
MSR 0000011E: < FAILED >
MSR 00000194: 0000-0000-0001-0000
MSR 00000198: 0000-227A-0000-1C00
MSR 00000199: 0000-0000-0000-1C00
MSR 0000019A: 0000-0000-0000-0000
MSR 0000019B: 0000-0000-0000-0010
MSR 0000019C: 0000-0000-883A-0A82
MSR 0000019D: 0000-0000-0000-0000
MSR 000001A0: 0000-0000-0085-0089
MSR 000001A2: 0000-0000-8069-0000
MSR 000001A4: 0000-0000-0000-0000
MSR 000001AA: 0000-0000-0040-10C0
MSR 000001AC: < FAILED >
MSR 000001AD: 1C1C-1C1C-1C1C-1C1C
MSR 000001B0: 0000-0000-0000-0006
MSR 000001B1: 0000-0000-8835-0A82
MSR 000001B2: 0000-0000-0000-0000
MSR 000001FC: 0000-0000-0824-005F
MSR 00000300: < FAILED >
MSR 0000030A: 0000-0000-01AB-900E
MSR 0000030B: 0000-0000-00AA-6A4F
MSR 00000480: 00DA-0500-0000-0013
MSR 00000481: 0000-00FF-0000-0016
MSR 00000482: FFF9-FFFE-0401-E172
MSR 00000483: 037F-FFFF-0003-6DFF
MSR 00000484: 0006-FFFF-0000-11FF
MSR 00000485: 0000-0000-7004-C1E7
MSR 00000486: 0000-0000-8000-0021
MSR 00000487: 0000-0000-FFFF-FFFF
MSR 00000488: 0000-0000-0000-2000
MSR 00000489: 0000-0000-0035-2FFF
MSR 0000048A: 0000-0000-0000-002E
MSR 0000048B: 07DD-6FFF-0000-0000
MSR 0000048C: 0000-0F01-0671-4141
MSR 0000048D: 0000-00FF-0000-0016
MSR 0000048E: FFF9-FFFE-0400-6172
MSR 0000048F: 037F-FFFF-0003-6DFB
MSR 00000490: 0006-FFFF-0000-11FB
MSR 00000601: 0000-0000-0000-01E0
MSR 00000602: < FAILED >
MSR 00000603: 0036-0000-0036-3636
MSR 00000604: < FAILED >
MSR 00000606: 0000-0000-000A-0E03
MSR 0000060A: 0000-0000-0000-0000
MSR 0000060B: 0000-0000-0000-0000
MSR 0000060C: 0000-0000-0000-0000
MSR 0000060D: 0000-0000-0000-0000
MSR 00000610: 0042-8078-001B-8048
MSR 00000611: 0000-0000-07EC-8E18
MSR 00000613: 0000-0000-0000-0000
MSR 00000614: 0000-0000-0000-0030
MSR 00000618: 0054-00DE-0000-0000
MSR 00000619: 0000-0000-0000-0000
MSR 0000061B: 0000-0000-0000-0000
MSR 0000061C: < FAILED >
MSR 00000638: 0000-0000-0000-0000
MSR 00000639: 0000-0000-01AA-1BBC
MSR 0000063A: 0000-0000-0000-0009
MSR 0000063B: < FAILED >
MSR 00000640: 0000-0000-0000-0000
MSR 00000641: 0000-0000-0161-81D2
MSR 00000642: 0000-0000-0000-000D
MSR 00000660: 0000-000A-8930-DF93
MSR 00000661: < FAILED >
MSR 00000662: < FAILED >
MSR 00000663: < FAILED >
MSR 00000664: 0000-0068-6781-CFEB
MSR 00000665: < FAILED >
MSR 00000666: < FAILED >
MSR 00000667: < FAILED >
MSR 00000668: < FAILED >
MSR 00000669: < FAILED >
MSR 0000066A: < FAILED >
MSR 0000066B: < FAILED >
MSR 0000066C: < FAILED >
MSR 0000066D: < FAILED >
MSR 0000066E: < FAILED >
MSR 0000066F: < FAILED >
MSR 00000670: < FAILED >
MSR 00000671: < FAILED >
MSR 00000672: < FAILED >
MSR 00000673: < FAILED >
MSR 00000674: < FAILED >
MSR 00000675: < FAILED >
MSR 00000676: < FAILED >
MSR 00000677: < FAILED >
MSR 00000770: 0000-0000-0000-0001
MSR 00000771: 0000-0000-0108-0B1C
MSR 00000772: 0000-019E-5400-1C0B
MSR 00000773: 0000-0000-0000-0005
MSR 00000774: 0000-059E-0000-1C0B
MSR 00000777: 0000-0000-0000-0004
MSR 00000832: 0000-0000-0003-00D1
MSR 00000838: 0000-0000-0000-0000
MSR 00000839: 0000-0000-0000-0000
MSR 0000083E: 0000-0000-0000-000A

------[ MSR Registers / Logical CPU #3 ]------

MSR 00000017: 0000-0000-0000-0000 [PlatID = 0]
MSR 0000001B: 0000-0000-FEE0-0C00
MSR 0000002A: 0000-0000-0000-0000
MSR 00000035: 0000-0000-0004-0004
MSR 00000048: 0000-0000-0000-0001
MSR 00000049: < FAILED >
MSR 0000008B: 0000-0019-0000-0000
MSR 000000CD: < FAILED >
MSR 000000CE: 0004-0830-F081-0B00 [eD = 0]
MSR 000000E7: 0000-0064-C3E8-DFA9
MSR 000000E8: 0000-0086-5B18-8621
MSR 000000EE: < FAILED >
MSR 0000010A: 0000-0000-0000-006B
MSR 0000010B: < FAILED >
MSR 0000011E: < FAILED >
MSR 00000194: 0000-0000-0001-0000
MSR 00000198: 0000-227A-0000-1C00
MSR 00000199: 0000-0000-0000-1C00
MSR 0000019A: 0000-0000-0000-0000
MSR 0000019B: 0000-0000-0000-0010
MSR 0000019C: 0000-0000-8839-0A82
MSR 0000019D: 0000-0000-0000-0000
MSR 000001A0: 0000-0000-0085-0089
MSR 000001A2: 0000-0000-8069-0000
MSR 000001A4: 0000-0000-0000-0000
MSR 000001AA: 0000-0000-0040-10C0
MSR 000001AC: < FAILED >
MSR 000001AD: 1C1C-1C1C-1C1C-1C1C
MSR 000001B0: 0000-0000-0000-0006
MSR 000001B1: 0000-0000-8836-0A82
MSR 000001B2: 0000-0000-0000-0000
MSR 000001FC: 0000-0000-0824-005F
MSR 00000300: < FAILED >
MSR 0000030A: 0000-0000-01AB-0E63
MSR 0000030B: 0000-0000-00AA-36E1
MSR 00000480: 00DA-0500-0000-0013
MSR 00000481: 0000-00FF-0000-0016
MSR 00000482: FFF9-FFFE-0401-E172
MSR 00000483: 037F-FFFF-0003-6DFF
MSR 00000484: 0006-FFFF-0000-11FF
MSR 00000485: 0000-0000-7004-C1E7
MSR 00000486: 0000-0000-8000-0021
MSR 00000487: 0000-0000-FFFF-FFFF
MSR 00000488: 0000-0000-0000-2000
MSR 00000489: 0000-0000-0035-2FFF
MSR 0000048A: 0000-0000-0000-002E
MSR 0000048B: 07DD-6FFF-0000-0000
MSR 0000048C: 0000-0F01-0671-4141
MSR 0000048D: 0000-00FF-0000-0016
MSR 0000048E: FFF9-FFFE-0400-6172
MSR 0000048F: 037F-FFFF-0003-6DFB
MSR 00000490: 0006-FFFF-0000-11FB
MSR 00000601: 0000-0000-0000-01E0
MSR 00000602: < FAILED >
MSR 00000603: 0036-0000-0036-3636
MSR 00000604: < FAILED >
MSR 00000606: 0000-0000-000A-0E03
MSR 0000060A: 0000-0000-0000-0000
MSR 0000060B: 0000-0000-0000-0000
MSR 0000060C: 0000-0000-0000-0000
MSR 0000060D: 0000-0000-0000-0000
MSR 00000610: 0042-8078-001B-8048
MSR 00000611: 0000-0000-07EC-8E4D
MSR 00000613: 0000-0000-0000-0000
MSR 00000614: 0000-0000-0000-0030
MSR 00000618: 0054-00DE-0000-0000
MSR 00000619: 0000-0000-0000-0000
MSR 0000061B: 0000-0000-0000-0000
MSR 0000061C: < FAILED >
MSR 00000638: 0000-0000-0000-0000
MSR 00000639: 0000-0000-01AA-1BD2
MSR 0000063A: 0000-0000-0000-0009
MSR 0000063B: < FAILED >
MSR 00000640: 0000-0000-0000-0000
MSR 00000641: 0000-0000-0161-81DA
MSR 00000642: 0000-0000-0000-000D
MSR 00000660: 0000-0007-FCDB-B4A2
MSR 00000661: < FAILED >
MSR 00000662: < FAILED >
MSR 00000663: < FAILED >
MSR 00000664: 0000-0068-6781-CFEB
MSR 00000665: < FAILED >
MSR 00000666: < FAILED >
MSR 00000667: < FAILED >
MSR 00000668: < FAILED >
MSR 00000669: < FAILED >
MSR 0000066A: < FAILED >
MSR 0000066B: < FAILED >
MSR 0000066C: < FAILED >
MSR 0000066D: < FAILED >
MSR 0000066E: < FAILED >
MSR 0000066F: < FAILED >
MSR 00000670: < FAILED >
MSR 00000671: < FAILED >
MSR 00000672: < FAILED >
MSR 00000673: < FAILED >
MSR 00000674: < FAILED >
MSR 00000675: < FAILED >
MSR 00000676: < FAILED >
MSR 00000677: < FAILED >
MSR 00000770: 0000-0000-0000-0001
MSR 00000771: 0000-0000-0108-0B1C
MSR 00000772: 0000-019E-5400-1C0B
MSR 00000773: 0000-0000-0000-0005
MSR 00000774: 0000-059E-0000-1C0B
MSR 00000777: 0000-0000-0000-0004
MSR 00000832: 0000-0000-0003-00D1
MSR 00000838: 0000-0000-0000-0000
MSR 00000839: 0000-0000-0000-0000
MSR 0000083E: 0000-0000-0000-000A

PerformanceFrequency = 10000000

CPU Clock M.Method = 8  (APIC SNB)
PM Timer Address   = 6152  (1808h)

APIC Clock =  38.40 MHz  (AT = 20114 / TT = 15000 / try = 1 / SKL = 0.00 MHz)
APIC Clock =  38.40 MHz  (AT = 20114 / TT = 15000 / try = 1 / SKL = 0.00 MHz)
APIC Clock =  38.40 MHz  (AT = 20114 / TT = 15000 / try = 1 / SKL = 0.00 MHz)
APIC Clock =  38.40 MHz  (AT = 20114 / TT = 15000 / try = 1 / SKL = 0.00 MHz)
APIC Clock =  38.40 MHz  (AT = 20114 / TT = 15000 / try = 1 / SKL = 0.00 MHz)

CPU Clock =  422.39 MHz / TSC Clock =  422.39 MHz / CPU Mul = 11.00x
CPU Clock =  422.39 MHz / TSC Clock =  422.39 MHz / CPU Mul = 11.00x
CPU Clock =  422.39 MHz / TSC Clock =  422.39 MHz / CPU Mul = 11.00x
CPU Clock =  422.39 MHz / TSC Clock =  422.39 MHz / CPU Mul = 11.00x
CPU Clock = 1075.18 MHz / TSC Clock =  422.39 MHz / CPU Mul = 28.00x

CPU Clock Max = 1075.18 MHz / TSC Clock =  422.39 MHz / CPU Mul = 28.00x
CPU Clock Max = 1075.18 MHz / TSC Clock =  422.39 MHz / CPU Mul = 28.00x
CPU Clock Max =  422.39 MHz / TSC Clock =  422.39 MHz / CPU Mul = 11.00x
CPU Clock Max =  422.39 MHz / TSC Clock =  422.39 MHz / CPU Mul = 11.00x
CPU Clock Max = 1075.18 MHz / TSC Clock =  422.39 MHz / CPU Mul = 28.00x

INTPERFCTR2 = 2793.93 MHz / INTPERFCTR1 (TSC) = 1113.59 MHz
INTPERFCTR2 = 2793.94 MHz / INTPERFCTR1 (TSC) = 1113.60 MHz
INTPERFCTR2 = 1739.38 MHz / INTPERFCTR1 (TSC) = 1108.85 MHz
INTPERFCTR2 = 2793.96 MHz / INTPERFCTR1 (TSC) = 1113.60 MHz
INTPERFCTR2 = 1708.50 MHz / INTPERFCTR1 (TSC) = 1108.65 MHz
