CPUID 00000000: 00000002-756E6547-6C65746E-49656E69
CPUID 00000001: 00000590-00010200-00000000-0000237B
CPUID 00000002: 00000001-00000000-00000000-00000000
CPUID 00000003: 00000000-00000000-00000000-00000000
CPUID 00000004: 00000000-00000000-00000000-00000000
CPUID 00000005: 00000000-00000000-00000000-00000000
CPUID 00000006: 00000000-00000000-00000000-00000000
CPUID 00000007: 00000001-00000080-00000000-00000000	[SMEP]
CPUID 00000007: 00000000-00000000-00000000-00000000
CPUID 80000000: 80000008-00000000-00000000-00000000
CPUID 80000001: 00000000-00000000-00000000-00100000     [NX]
CPUID 80000002: 00000000-00000000-00000000-00000000
CPUID 80000003: 00000000-00000000-00000000-00000000
CPUID 80000004: 00000000-00000000-00000000-00000000
CPUID 80000005: 00000000-00000000-00000000-00000000
CPUID 80000006: 00000000-00000000-00000000-00000000
CPUID 80000007: 00000000-00000000-00000000-00000000
CPUID 80000008: 00002020-00000000-00000000-00000000
