CPUID Registers (CPU #1):
CPUID 00000000  	0000000D-756E6547-6C65746E-49656E69
CPUID 00000001  	000206A7-00100800-0D9AE3BF-BFEBFBFF
CPUID 00000002  	76035A01-00F0B0FF-00000000-00CA0000
CPUID 00000003  	00000000-00000000-00000000-00000000
CPUID 00000004  	1C004121-01C0003F-0000003F-00000000
CPUID 00000004  	1C004122-01C0003F-0000003F-00000000
CPUID 00000004  	1C004143-01C0003F-000001FF-00000000
CPUID 00000004  	1C03C163-02C0003F-00000FFF-00000006
CPUID 00000005  	00000040-00000040-00000003-00001120
CPUID 00000006  	00000075-00000002-00000009-00000000
CPUID 00000007  	00000000-00000000-00000000-00000000
CPUID 00000008  	00000000-00000000-00000000-00000000
CPUID 00000009  	00000000-00000000-00000000-00000000
CPUID 0000000A  	07300803-00000000-00000000-00000603
CPUID 0000000B  	00000001-00000001-00000100-00000000
CPUID 0000000B  	00000004-00000002-00000201-00000000
CPUID 0000000C  	00000000-00000000-00000000-00000000
CPUID 0000000D  	00000003-00000240-00000240-00000000
CPUID 80000000  	80000008-00000000-00000000-00000000
CPUID 80000001  	00000000-00000000-00000001-28000000
CPUID 80000002  	20202020-20202020-746E4920-52286C65
CPUID 80000003  	65502029-7569746E-2952286D-55504320
CPUID 80000004  	34384720-20402030-30382E32-007A4847
CPUID 80000005  	00000000-00000000-00000000-00000000
CPUID 80000006  	00000000-00000000-01006040-00000000
CPUID 80000007  	00000000-00000000-00000000-00000100
CPUID 80000008  	00003024-00000000-00000000-00000000

CPUID Registers (CPU #2):
CPUID 00000000  	0000000D-756E6547-6C65746E-49656E69
CPUID 00000001  	000206A7-02100800-0D9AE3BF-BFEBFBFF
CPUID 00000002  	76035A01-00F0B0FF-00000000-00CA0000
CPUID 00000003  	00000000-00000000-00000000-00000000
CPUID 00000004  	1C004121-01C0003F-0000003F-00000000
CPUID 00000004  	1C004122-01C0003F-0000003F-00000000
CPUID 00000004  	1C004143-01C0003F-000001FF-00000000
CPUID 00000004  	1C03C163-02C0003F-00000FFF-00000006
CPUID 00000005  	00000040-00000040-00000003-00001120
CPUID 00000006  	00000075-00000002-00000009-00000000
CPUID 00000007  	00000000-00000000-00000000-00000000
CPUID 00000008  	00000000-00000000-00000000-00000000
CPUID 00000009  	00000000-00000000-00000000-00000000
CPUID 0000000A  	07300803-00000000-00000000-00000603
CPUID 0000000B  	00000001-00000001-00000100-00000002
CPUID 0000000B  	00000004-00000002-00000201-00000002
CPUID 0000000C  	00000000-00000000-00000000-00000000
CPUID 0000000D  	00000003-00000240-00000240-00000000
CPUID 80000000  	80000008-00000000-00000000-00000000
CPUID 80000001  	00000000-00000000-00000001-28000000
CPUID 80000002  	20202020-20202020-746E4920-52286C65
CPUID 80000003  	65502029-7569746E-2952286D-55504320
CPUID 80000004  	34384720-20402030-30382E32-007A4847
CPUID 80000005  	00000000-00000000-00000000-00000000
CPUID 80000006  	00000000-00000000-01006040-00000000
CPUID 80000007  	00000000-00000000-00000000-00000100
CPUID 80000008  	00003024-00000000-00000000-00000000