CPUID 00000000: 0000000B-756E6547-6C65746E-49656E69
CPUID 00000001: 000106A1-00100800-00BCE3BD-B7EBFBFF
CPUID 00000002: 55035A01-00F0B2E4-00000000-09CA210D
CPUID 00000003: 00000000-00000000-00000000-00000000
CPUID 00000004: 1C004121-00C0003F-0000003F-00000000
CPUID 00000004: 1C004122-00C0003F-0000007F-00000000
CPUID 00000004: 1C004143-01C0003F-000001FF-00000000
CPUID 00000004: 1C03C163-03C0003F-00001FFF-00000002
CPUID 00000005: 00000040-00000040-00000003-00000020
CPUID 00000006: 00000001-00000002-00000000-00000000
CPUID 00000007: 00000000-00000000-00000000-00000000
CPUID 00000008: 00000000-00000000-00000000-00000000
CPUID 00000009: 00000000-00000000-00000000-00000000
CPUID 0000000A: 07300403-00000000-00000000-00000603
CPUID 0000000B: 00000001-00000002-00000100-00000000
CPUID 0000000B: 00000004-00000008-00000201-00000000
CPUID 80000000: 80000008-00000000-00000000-00000000
CPUID 80000001: 00000000-00000000-00000001-28100000
CPUID 80000002: 756E6547-20656E69-65746E49-2952286C
CPUID 80000003: 55504320-20202020-20202020-20202020
CPUID 80000004: 30303020-20402020-33313E32-007A4847
CPUID 80000005: 00000000-00000000-00000000-00000000
CPUID 80000006: 00000000-00000000-01006040-00000000
CPUID 80000007: 00000000-00000000-00000000-00000100
CPUID 80000008: 00003028-00000000-00000000-00000000