------[ Versions ]------

Program Version : AIDA64 Engineer v6.60.5906 Beta
BenchDLL Version: 4.5.865.8-x64
Windows Version : Microsoft Windows 10 Enterprise 10.0.19044.1415 (64-bit)
GetProductInfo  : 0x00000004

------[ CPU Info ]------

CPU Type          : DualCore Intel Core i3-7100, 3900 MHz (39 x 100)
CPU Alias         : Kaby Lake-S
CPU Platform      : LGA1151
CPU Stepping      : S0
Instruction Set   : x86, x86-64, MMX, SSE, SSE2, SSE3, SSSE3, SSE4.1, SSE4.2, AVX, AVX2, FMA, AES
CPUID Manufacturer: GenuineIntel
CPUID CPU Name    : Intel(R) Core(TM) i3-7100 CPU @ 3.90GHz
CPUID Revision    : 000906E9h
IA Brand ID       : 00h  (Unknown)
Platform ID       : 4Ch  (LGA1151)
HTT / CMP Units   : 2 / 2
Max. NUMA Node    : 0

Tjmax Temperature        : 100 Celsius
HTC Temperature Limit    : 0 Celsius
CPU TDP                  : 51 W
CPU Max Power Limit      : Unlimited Power / Unlimited Time
CPU Power Limit 1 (Long) : 51 W / 8.00 sec  (Unlocked)
CPU Power Limit 2 (Short): 63.8 W / 2.44 ms  (Unlocked)

------[ Motherboard Info ]------

Motherboard ID      : 63-0100-000001-00101111-091015-Chipset$0AAAA000_BIOS DATE: 09/24/19 14:45:12 VER: 05.0000C
Motherboard Model   : Asus B250 Mining Expert
Motherboard Chipset : Intel Kaby Point B250, Intel Kaby Lake-S

DMI MB Manufacturer : ASUSTeK COMPUTER INC.
DMI MB Product      : B250 MINING EXPERT
DMI MB Version      : Rev X.0x
DMI MB Serial       : MB-1234567890
DMI SYS Manufacturer: System manufacturer
DMI SYS Product     : System Product Name
DMI SYS Version     : System Version
DMI SYS Serial      : System Serial Number
DMI BIOS Version    : 1208


------[ CPUID Registers / Logical CPU #0 ]------

allcpu: Package 0 / Core 0 / Thread 0: Valid

CPUID 00000000: 00000016-756E6547-6C65746E-49656E69 [GenuineIntel]
CPUID 00000001: 000906E9-00100800-7FFAFBBF-BFEBFBFF
CPUID 00000002: 76036301-00F0B5FF-00000000-00C30000
CPUID 00000003: 00000000-00000000-00000000-00000000
CPUID 00000004: 1C004121-01C0003F-0000003F-00000000 [SL 00] [L1D: 32 KB]
CPUID 00000004: 1C004122-01C0003F-0000003F-00000000 [SL 01] [L1I: 32 KB]
CPUID 00000004: 1C004143-00C0003F-000003FF-00000000 [SL 02] [L2U: 256 KB]
CPUID 00000004: 1C03C163-02C0003F-00000FFF-00000006 [SL 03] [L3U: 3 MB]
CPUID 00000005: 00000040-00000040-00000003-00142120
CPUID 00000006: 000027F5-00000002-00000001-00000000
CPUID 00000007: 00000000-029C67AF-00000000-9C002600 [SL 00]
CPUID 00000008: 00000000-00000000-00000000-00000000
CPUID 00000009: 00000000-00000000-00000000-00000000
CPUID 0000000A: 07300404-00000000-00000000-00000603
CPUID 0000000B: 00000001-00000002-00000100-00000000 [SL 00]
CPUID 0000000B: 00000004-00000004-00000201-00000000 [SL 01]
CPUID 0000000C: 00000000-00000000-00000000-00000000
CPUID 0000000D: 0000001F-00000440-00000440-00000000 [SL 00] [x87]
CPUID 0000000D: 0000000F-00000440-00000100-00000000 [SL 01] [SSE]
CPUID 0000000D: 00000100-00000240-00000000-00000000 [SL 02] [AVX]
CPUID 0000000D: 00000040-000003C0-00000000-00000000 [SL 03] [MPX BNDREGS]
CPUID 0000000D: 00000040-00000400-00000000-00000000 [SL 04] [MPX BNDCSR]
CPUID 0000000D: 00000080-00000000-00000001-00000000 [SL 08] [PT]
CPUID 0000000E: 00000000-00000000-00000000-00000000
CPUID 0000000F: 00000000-00000000-00000000-00000000 [SL 00]
CPUID 0000000F: 00000000-00000000-00000000-00000000 [SL 01]
CPUID 00000010: 00000000-00000000-00000000-00000000 [SL 00]
CPUID 00000010: 00000000-00000000-00000000-00000000 [SL 01]
CPUID 00000011: 00000000-00000000-00000000-00000000
CPUID 00000012: 00000000-00000000-00000000-00000000 [SL 00]
CPUID 00000012: 00000000-00000000-00000000-00000000 [SL 01]
CPUID 00000013: 00000000-00000000-00000000-00000000
CPUID 00000014: 00000001-0000000F-00000007-00000000 [SL 00]
CPUID 00000014: 02490002-003F3FFF-00000000-00000000 [SL 01]
CPUID 00000015: 00000002-00000146-00000000-00000000 [163.00x / 0]
CPUID 00000016: 00000F3C-00000F3C-00000064-00000000 [3900 / 3900 / 100]
CPUID 80000000: 80000008-00000000-00000000-00000000
CPUID 80000001: 00000000-00000000-00000121-2C100000
CPUID 80000002: 65746E49-2952286C-726F4320-4D542865 [Intel(R) Core(TM]
CPUID 80000003: 33692029-3031372D-50432030-20402055 [) i3-7100 CPU @ ]
CPUID 80000004: 30392E33-007A4847-00000000-00000000 [3.90GHz]
CPUID 80000005: 00000000-00000000-00000000-00000000 [L1D: 0 KB / L1I: 0 KB]
CPUID 80000006: 00000000-00000000-01006040-00000000 [L2: 256 KB] / L3: 0 KB]
CPUID 80000007: 00000000-00000000-00000000-00000100
CPUID 80000008: 00003027-00000000-00000000-00000000

L1    Data Cache:    32 KB,  8-way Associative, 64-byte Line
L1  Instr. Cache:    32 KB,  8-way Associative, 64-byte Line
L2 Unified Cache:   256 KB,  4-way Associative, 64-byte Line
L3 Unified Cache:     3 MB, 12-way Associative, 64-byte Line

------[ CPUID Registers / Logical CPU #1 ]------

allcpu: Package 0 / Core 0 / Thread 1: Valid, Virtual

CPUID 00000000: 00000016-756E6547-6C65746E-49656E69 [GenuineIntel]
CPUID 00000001: 000906E9-01100800-7FFAFBBF-BFEBFBFF
CPUID 00000002: 76036301-00F0B5FF-00000000-00C30000
CPUID 00000003: 00000000-00000000-00000000-00000000
CPUID 00000004: 1C004121-01C0003F-0000003F-00000000 [SL 00] [L1D: 32 KB]
CPUID 00000004: 1C004122-01C0003F-0000003F-00000000 [SL 01] [L1I: 32 KB]
CPUID 00000004: 1C004143-00C0003F-000003FF-00000000 [SL 02] [L2U: 256 KB]
CPUID 00000004: 1C03C163-02C0003F-00000FFF-00000006 [SL 03] [L3U: 3 MB]
CPUID 00000005: 00000040-00000040-00000003-00142120
CPUID 00000006: 000027F5-00000002-00000001-00000000
CPUID 00000007: 00000000-029C67AF-00000000-9C002600 [SL 00]
CPUID 00000008: 00000000-00000000-00000000-00000000
CPUID 00000009: 00000000-00000000-00000000-00000000
CPUID 0000000A: 07300404-00000000-00000000-00000603
CPUID 0000000B: 00000001-00000002-00000100-00000001 [SL 00]
CPUID 0000000B: 00000004-00000004-00000201-00000001 [SL 01]
CPUID 0000000C: 00000000-00000000-00000000-00000000
CPUID 0000000D: 0000001F-00000440-00000440-00000000 [SL 00] [x87]
CPUID 0000000D: 0000000F-00000440-00000100-00000000 [SL 01] [SSE]
CPUID 0000000D: 00000100-00000240-00000000-00000000 [SL 02] [AVX]
CPUID 0000000D: 00000040-000003C0-00000000-00000000 [SL 03] [MPX BNDREGS]
CPUID 0000000D: 00000040-00000400-00000000-00000000 [SL 04] [MPX BNDCSR]
CPUID 0000000D: 00000080-00000000-00000001-00000000 [SL 08] [PT]
CPUID 0000000E: 00000000-00000000-00000000-00000000
CPUID 0000000F: 00000000-00000000-00000000-00000000 [SL 00]
CPUID 0000000F: 00000000-00000000-00000000-00000000 [SL 01]
CPUID 00000010: 00000000-00000000-00000000-00000000 [SL 00]
CPUID 00000010: 00000000-00000000-00000000-00000000 [SL 01]
CPUID 00000011: 00000000-00000000-00000000-00000000
CPUID 00000012: 00000000-00000000-00000000-00000000 [SL 00]
CPUID 00000012: 00000000-00000000-00000000-00000000 [SL 01]
CPUID 00000013: 00000000-00000000-00000000-00000000
CPUID 00000014: 00000001-0000000F-00000007-00000000 [SL 00]
CPUID 00000014: 02490002-003F3FFF-00000000-00000000 [SL 01]
CPUID 00000015: 00000002-00000146-00000000-00000000 [163.00x / 0]
CPUID 00000016: 00000F3C-00000F3C-00000064-00000000 [3900 / 3900 / 100]
CPUID 80000000: 80000008-00000000-00000000-00000000
CPUID 80000001: 00000000-00000000-00000121-2C100000
CPUID 80000002: 65746E49-2952286C-726F4320-4D542865 [Intel(R) Core(TM]
CPUID 80000003: 33692029-3031372D-50432030-20402055 [) i3-7100 CPU @ ]
CPUID 80000004: 30392E33-007A4847-00000000-00000000 [3.90GHz]
CPUID 80000005: 00000000-00000000-00000000-00000000 [L1D: 0 KB / L1I: 0 KB]
CPUID 80000006: 00000000-00000000-01006040-00000000 [L2: 256 KB] / L3: 0 KB]
CPUID 80000007: 00000000-00000000-00000000-00000100
CPUID 80000008: 00003027-00000000-00000000-00000000

L1    Data Cache:    32 KB,  8-way Associative, 64-byte Line
L1  Instr. Cache:    32 KB,  8-way Associative, 64-byte Line
L2 Unified Cache:   256 KB,  4-way Associative, 64-byte Line
L3 Unified Cache:     3 MB, 12-way Associative, 64-byte Line

------[ CPUID Registers / Logical CPU #2 ]------

allcpu: Package 0 / Core 1 / Thread 0: Valid

CPUID 00000000: 00000016-756E6547-6C65746E-49656E69 [GenuineIntel]
CPUID 00000001: 000906E9-02100800-7FFAFBBF-BFEBFBFF
CPUID 00000002: 76036301-00F0B5FF-00000000-00C30000
CPUID 00000003: 00000000-00000000-00000000-00000000
CPUID 00000004: 1C004121-01C0003F-0000003F-00000000 [SL 00] [L1D: 32 KB]
CPUID 00000004: 1C004122-01C0003F-0000003F-00000000 [SL 01] [L1I: 32 KB]
CPUID 00000004: 1C004143-00C0003F-000003FF-00000000 [SL 02] [L2U: 256 KB]
CPUID 00000004: 1C03C163-02C0003F-00000FFF-00000006 [SL 03] [L3U: 3 MB]
CPUID 00000005: 00000040-00000040-00000003-00142120
CPUID 00000006: 000027F5-00000002-00000001-00000000
CPUID 00000007: 00000000-029C67AF-00000000-9C002600 [SL 00]
CPUID 00000008: 00000000-00000000-00000000-00000000
CPUID 00000009: 00000000-00000000-00000000-00000000
CPUID 0000000A: 07300404-00000000-00000000-00000603
CPUID 0000000B: 00000001-00000002-00000100-00000002 [SL 00]
CPUID 0000000B: 00000004-00000004-00000201-00000002 [SL 01]
CPUID 0000000C: 00000000-00000000-00000000-00000000
CPUID 0000000D: 0000001F-00000440-00000440-00000000 [SL 00] [x87]
CPUID 0000000D: 0000000F-00000440-00000100-00000000 [SL 01] [SSE]
CPUID 0000000D: 00000100-00000240-00000000-00000000 [SL 02] [AVX]
CPUID 0000000D: 00000040-000003C0-00000000-00000000 [SL 03] [MPX BNDREGS]
CPUID 0000000D: 00000040-00000400-00000000-00000000 [SL 04] [MPX BNDCSR]
CPUID 0000000D: 00000080-00000000-00000001-00000000 [SL 08] [PT]
CPUID 0000000E: 00000000-00000000-00000000-00000000
CPUID 0000000F: 00000000-00000000-00000000-00000000 [SL 00]
CPUID 0000000F: 00000000-00000000-00000000-00000000 [SL 01]
CPUID 00000010: 00000000-00000000-00000000-00000000 [SL 00]
CPUID 00000010: 00000000-00000000-00000000-00000000 [SL 01]
CPUID 00000011: 00000000-00000000-00000000-00000000
CPUID 00000012: 00000000-00000000-00000000-00000000 [SL 00]
CPUID 00000012: 00000000-00000000-00000000-00000000 [SL 01]
CPUID 00000013: 00000000-00000000-00000000-00000000
CPUID 00000014: 00000001-0000000F-00000007-00000000 [SL 00]
CPUID 00000014: 02490002-003F3FFF-00000000-00000000 [SL 01]
CPUID 00000015: 00000002-00000146-00000000-00000000 [163.00x / 0]
CPUID 00000016: 00000F3C-00000F3C-00000064-00000000 [3900 / 3900 / 100]
CPUID 80000000: 80000008-00000000-00000000-00000000
CPUID 80000001: 00000000-00000000-00000121-2C100000
CPUID 80000002: 65746E49-2952286C-726F4320-4D542865 [Intel(R) Core(TM]
CPUID 80000003: 33692029-3031372D-50432030-20402055 [) i3-7100 CPU @ ]
CPUID 80000004: 30392E33-007A4847-00000000-00000000 [3.90GHz]
CPUID 80000005: 00000000-00000000-00000000-00000000 [L1D: 0 KB / L1I: 0 KB]
CPUID 80000006: 00000000-00000000-01006040-00000000 [L2: 256 KB] / L3: 0 KB]
CPUID 80000007: 00000000-00000000-00000000-00000100
CPUID 80000008: 00003027-00000000-00000000-00000000

L1    Data Cache:    32 KB,  8-way Associative, 64-byte Line
L1  Instr. Cache:    32 KB,  8-way Associative, 64-byte Line
L2 Unified Cache:   256 KB,  4-way Associative, 64-byte Line
L3 Unified Cache:     3 MB, 12-way Associative, 64-byte Line

------[ CPUID Registers / Logical CPU #3 ]------

allcpu: Package 0 / Core 1 / Thread 1: Valid, Virtual

CPUID 00000000: 00000016-756E6547-6C65746E-49656E69 [GenuineIntel]
CPUID 00000001: 000906E9-03100800-7FFAFBBF-BFEBFBFF
CPUID 00000002: 76036301-00F0B5FF-00000000-00C30000
CPUID 00000003: 00000000-00000000-00000000-00000000
CPUID 00000004: 1C004121-01C0003F-0000003F-00000000 [SL 00] [L1D: 32 KB]
CPUID 00000004: 1C004122-01C0003F-0000003F-00000000 [SL 01] [L1I: 32 KB]
CPUID 00000004: 1C004143-00C0003F-000003FF-00000000 [SL 02] [L2U: 256 KB]
CPUID 00000004: 1C03C163-02C0003F-00000FFF-00000006 [SL 03] [L3U: 3 MB]
CPUID 00000005: 00000040-00000040-00000003-00142120
CPUID 00000006: 000027F5-00000002-00000001-00000000
CPUID 00000007: 00000000-029C67AF-00000000-9C002600 [SL 00]
CPUID 00000008: 00000000-00000000-00000000-00000000
CPUID 00000009: 00000000-00000000-00000000-00000000
CPUID 0000000A: 07300404-00000000-00000000-00000603
CPUID 0000000B: 00000001-00000002-00000100-00000003 [SL 00]
CPUID 0000000B: 00000004-00000004-00000201-00000003 [SL 01]
CPUID 0000000C: 00000000-00000000-00000000-00000000
CPUID 0000000D: 0000001F-00000440-00000440-00000000 [SL 00] [x87]
CPUID 0000000D: 0000000F-00000440-00000100-00000000 [SL 01] [SSE]
CPUID 0000000D: 00000100-00000240-00000000-00000000 [SL 02] [AVX]
CPUID 0000000D: 00000040-000003C0-00000000-00000000 [SL 03] [MPX BNDREGS]
CPUID 0000000D: 00000040-00000400-00000000-00000000 [SL 04] [MPX BNDCSR]
CPUID 0000000D: 00000080-00000000-00000001-00000000 [SL 08] [PT]
CPUID 0000000E: 00000000-00000000-00000000-00000000
CPUID 0000000F: 00000000-00000000-00000000-00000000 [SL 00]
CPUID 0000000F: 00000000-00000000-00000000-00000000 [SL 01]
CPUID 00000010: 00000000-00000000-00000000-00000000 [SL 00]
CPUID 00000010: 00000000-00000000-00000000-00000000 [SL 01]
CPUID 00000011: 00000000-00000000-00000000-00000000
CPUID 00000012: 00000000-00000000-00000000-00000000 [SL 00]
CPUID 00000012: 00000000-00000000-00000000-00000000 [SL 01]
CPUID 00000013: 00000000-00000000-00000000-00000000
CPUID 00000014: 00000001-0000000F-00000007-00000000 [SL 00]
CPUID 00000014: 02490002-003F3FFF-00000000-00000000 [SL 01]
CPUID 00000015: 00000002-00000146-00000000-00000000 [163.00x / 0]
CPUID 00000016: 00000F3C-00000F3C-00000064-00000000 [3900 / 3900 / 100]
CPUID 80000000: 80000008-00000000-00000000-00000000
CPUID 80000001: 00000000-00000000-00000121-2C100000
CPUID 80000002: 65746E49-2952286C-726F4320-4D542865 [Intel(R) Core(TM]
CPUID 80000003: 33692029-3031372D-50432030-20402055 [) i3-7100 CPU @ ]
CPUID 80000004: 30392E33-007A4847-00000000-00000000 [3.90GHz]
CPUID 80000005: 00000000-00000000-00000000-00000000 [L1D: 0 KB / L1I: 0 KB]
CPUID 80000006: 00000000-00000000-01006040-00000000 [L2: 256 KB] / L3: 0 KB]
CPUID 80000007: 00000000-00000000-00000000-00000100
CPUID 80000008: 00003027-00000000-00000000-00000000

L1    Data Cache:    32 KB,  8-way Associative, 64-byte Line
L1  Instr. Cache:    32 KB,  8-way Associative, 64-byte Line
L2 Unified Cache:   256 KB,  4-way Associative, 64-byte Line
L3 Unified Cache:     3 MB, 12-way Associative, 64-byte Line

------[ All CPUs ]------

CPU   0: APICID    0 / Package 0 / Core   0 / Thread 0: Valid
CPU   1: APICID    1 / Package 0 / Core   0 / Thread 1: Valid, Virtual
CPU   2: APICID    2 / Package 0 / Core   1 / Thread 0: Valid
CPU   3: APICID    3 / Package 0 / Core   1 / Thread 1: Valid, Virtual

------[ MSR Registers / Logical CPU #0 ]------

MSR 00000017: 0004-0000-0000-0000 [PlatID = 1]
MSR 0000001B: 0000-0000-FEE0-0900
MSR 00000035: 0000-0000-0002-0004
MSR 00000048: 0000-0000-0000-0000
MSR 00000049: < FAILED >
MSR 0000008B: 0000-00DE-0000-0000
MSR 000000CE: 0008-0838-F101-2700 [eD = 0]
MSR 000000E7: 0000-0124-F196-BFCA [S200]
MSR 000000E7: 0000-0124-F362-047E [S200]
MSR 000000E7: 0000-0124-F5B4-49D2
MSR 000000E8: 0000-0124-F05A-BE10 [S200]
MSR 000000E8: 0000-0124-F0AB-5366 [S200]
MSR 000000E8: 0000-0124-F16B-3881
MSR 0000010B: < FAILED >
MSR 00000194: 0000-0000-0001-0000
MSR 00000198: 0000-2499-0000-2700 [S200]
MSR 00000198: 0000-2568-0000-2700 [S200]
MSR 00000198: 0000-2472-0000-2700
MSR 00000199: 0000-0000-0000-2700
MSR 0000019A: 0000-0000-0000-0000
MSR 0000019B: 0000-0000-0000-0010
MSR 0000019C: 0000-0000-8848-0800 [S200]
MSR 0000019C: 0000-0000-8848-0800 [S200]
MSR 0000019C: 0000-0000-8848-0800
MSR 0000019D: 0000-0000-0000-0000
MSR 000001A0: 0000-0000-0085-0089
MSR 000001A2: 0000-0000-0064-1441
MSR 000001A4: 0000-0000-0000-0000
MSR 000001AA: 0000-0000-0040-1CC0
MSR 000001AC: < FAILED >
MSR 000001AD: 0000-0000-2727-2727
MSR 000001B0: < FAILED >
MSR 000001B1: 0000-0000-8846-0800
MSR 000001B2: 0000-0000-0000-0000
MSR 000001FC: 0000-0000-0030-1CC1
MSR 00000300: < FAILED >
MSR 0000030A: 0000-0000-037F-CB5C [S200]
MSR 0000030A: 0000-0000-037F-CB5C [S200]
MSR 0000030A: 0000-0000-037F-CB5C
MSR 0000030B: 0000-0000-0384-A4C6 [S200]
MSR 0000030B: 0000-0000-0384-A4C6 [S200]
MSR 0000030B: 0000-0000-0384-A4C6
MSR 00000480: 00DA-0400-0000-0004
MSR 00000481: 0000-007F-0000-0016
MSR 00000482: FFF9-FFFE-0401-E172
MSR 00000483: 01FF-FFFF-0003-6DFF
MSR 00000484: 0003-FFFF-0000-11FF
MSR 00000485: 0000-0000-7004-C1E7
MSR 00000486: 0000-0000-8000-0021
MSR 00000487: 0000-0000-FFFF-FFFF
MSR 00000488: 0000-0000-0000-2000
MSR 00000489: 0000-0000-0037-27FF
MSR 0000048A: 0000-0000-0000-002E
MSR 0000048B: 005F-BCFF-0000-0000
MSR 0000048C: 0000-0F01-0673-4141
MSR 0000048D: 0000-007F-0000-0016
MSR 0000048E: FFF9-FFFE-0400-6172
MSR 0000048F: 01FF-FFFF-0003-6DFB
MSR 00000490: 0003-FFFF-0000-11FB
MSR 00000601: 0000-0000-0000-0000
MSR 00000602: < FAILED >
MSR 00000603: 0036-0000-0036-3636
MSR 00000604: < FAILED >
MSR 00000606: 0000-0000-000A-0E03
MSR 0000060A: 0000-0000-0000-884E
MSR 0000060B: 0000-0000-0000-8876
MSR 0000060C: 0000-0000-0000-8894
MSR 0000060D: 0000-0000-0000-0000
MSR 00000610: 0042-81FE-001B-8198
MSR 00000611: 0000-0000-1465-9319 [S200]
MSR 00000611: 0000-0000-1465-B589 [S200]
MSR 00000611: 0000-0000-1465-E1C7
MSR 00000613: 0000-0000-0000-0016
MSR 00000614: 0000-0000-0000-0198
MSR 00000618: 0054-00DE-0000-0000
MSR 00000619: 0000-0000-013B-60AD [S200]
MSR 00000619: 0000-0000-013B-6405 [S200]
MSR 00000619: 0000-0000-013B-66FA
MSR 0000061B: 0000-0000-0000-0000
MSR 0000061C: < FAILED >
MSR 0000061E: < FAILED >
MSR 00000620: 0000-0000-0000-0824
MSR 00000621: 0000-0000-0000-0024
MSR 00000638: 0000-0000-0000-0000
MSR 00000639: 0000-0000-0AC8-43F4 [S200]
MSR 00000639: 0000-0000-0AC8-592F [S200]
MSR 00000639: 0000-0000-0AC8-6059
MSR 0000063A: 0000-0000-0000-0009
MSR 0000063B: < FAILED >
MSR 00000640: 0000-0000-0000-0000
MSR 00000641: 0000-0000-000C-A934 [S200]
MSR 00000641: 0000-0000-000C-A956 [S200]
MSR 00000641: 0000-0000-000C-A962
MSR 00000642: 0000-0000-0000-000D
MSR 00000648: 0000-0000-0000-0027
MSR 00000649: 0000-0000-0000-0000
MSR 0000064A: 0000-0000-0000-0000
MSR 0000064B: 0000-0000-8000-0000
MSR 0000064C: 0000-0000-0000-0000
MSR 00000690: 0000-0000-0000-0000
MSR 000006B0: 0000-0000-0000-0000
MSR 000006B1: 0000-0000-0100-0000
MSR 00000770: 0000-0000-0000-0000
MSR 00000771: < FAILED >
MSR 00000772: < FAILED >
MSR 00000773: 0000-0000-0000-0000
MSR 00000774: < FAILED >
MSR 00000777: < FAILED >

------[ MSR Registers / Logical CPU #1 ]------

MSR 00000017: 0004-0000-0000-0000 [PlatID = 1]
MSR 0000001B: 0000-0000-FEE0-0800
MSR 00000035: 0000-0000-0002-0004
MSR 00000048: 0000-0000-0000-0000
MSR 00000049: < FAILED >
MSR 0000008B: 0000-00DE-0000-0000
MSR 000000CE: 0008-0838-F101-2700 [eD = 0]
MSR 000000E7: 0000-007A-82E1-655B
MSR 000000E8: 0000-007A-7B7F-B114
MSR 0000010B: < FAILED >
MSR 00000194: 0000-0000-0001-0000
MSR 00000198: 0000-23E7-0000-2700
MSR 00000199: 0000-0000-0000-2700
MSR 0000019A: 0000-0000-0000-0000
MSR 0000019B: 0000-0000-0000-0010
MSR 0000019C: 0000-0000-883D-0800
MSR 0000019D: 0000-0000-0000-0000
MSR 000001A0: 0000-0000-0085-0089
MSR 000001A2: 0000-0000-0064-1441
MSR 000001A4: 0000-0000-0000-0000
MSR 000001AA: 0000-0000-0040-1CC0
MSR 000001AC: < FAILED >
MSR 000001AD: 0000-0000-2727-2727
MSR 000001B0: < FAILED >
MSR 000001B1: 0000-0000-883D-0800
MSR 000001B2: 0000-0000-0000-0000
MSR 000001FC: 0000-0000-0030-1CC1
MSR 00000300: < FAILED >
MSR 0000030A: 0000-0000-0000-0000
MSR 0000030B: 0000-0000-0000-0000
MSR 00000480: 00DA-0400-0000-0004
MSR 00000481: 0000-007F-0000-0016
MSR 00000482: FFF9-FFFE-0401-E172
MSR 00000483: 01FF-FFFF-0003-6DFF
MSR 00000484: 0003-FFFF-0000-11FF
MSR 00000485: 0000-0000-7004-C1E7
MSR 00000486: 0000-0000-8000-0021
MSR 00000487: 0000-0000-FFFF-FFFF
MSR 00000488: 0000-0000-0000-2000
MSR 00000489: 0000-0000-0037-27FF
MSR 0000048A: 0000-0000-0000-002E
MSR 0000048B: 005F-BCFF-0000-0000
MSR 0000048C: 0000-0F01-0673-4141
MSR 0000048D: 0000-007F-0000-0016
MSR 0000048E: FFF9-FFFE-0400-6172
MSR 0000048F: 01FF-FFFF-0003-6DFB
MSR 00000490: 0003-FFFF-0000-11FB
MSR 00000601: 0000-0000-0000-0000
MSR 00000602: < FAILED >
MSR 00000603: 0036-0000-0036-3636
MSR 00000604: < FAILED >
MSR 00000606: 0000-0000-000A-0E03
MSR 0000060A: 0000-0000-0000-884E
MSR 0000060B: 0000-0000-0000-8876
MSR 0000060C: 0000-0000-0000-8894
MSR 0000060D: 0000-0000-0000-0000
MSR 00000610: 0042-81FE-001B-8198
MSR 00000611: 0000-0000-1466-DDBB
MSR 00000613: 0000-0000-0000-0016
MSR 00000614: 0000-0000-0000-0198
MSR 00000618: 0054-00DE-0000-0000
MSR 00000619: 0000-0000-013B-7459
MSR 0000061B: 0000-0000-0000-0000
MSR 0000061C: < FAILED >
MSR 0000061E: < FAILED >
MSR 00000620: 0000-0000-0000-0824
MSR 00000621: 0000-0000-0000-0024
MSR 00000638: 0000-0000-0000-0000
MSR 00000639: 0000-0000-0AC8-83B2
MSR 0000063A: 0000-0000-0000-0009
MSR 0000063B: < FAILED >
MSR 00000640: 0000-0000-0000-0000
MSR 00000641: 0000-0000-000C-A962
MSR 00000642: 0000-0000-0000-000D
MSR 00000648: 0000-0000-0000-0027
MSR 00000649: 0000-0000-0000-0000
MSR 0000064A: 0000-0000-0000-0000
MSR 0000064B: 0000-0000-8000-0000
MSR 0000064C: 0000-0000-0000-0000
MSR 00000690: 0000-0000-0000-0000
MSR 000006B0: 0000-0000-0000-0000
MSR 000006B1: 0000-0000-0100-0000
MSR 00000770: 0000-0000-0000-0000
MSR 00000771: < FAILED >
MSR 00000772: < FAILED >
MSR 00000773: 0000-0000-0000-0000
MSR 00000774: < FAILED >
MSR 00000777: < FAILED >

------[ MSR Registers / Logical CPU #2 ]------

MSR 00000017: 0004-0000-0000-0000 [PlatID = 1]
MSR 0000001B: 0000-0000-FEE0-0800
MSR 00000035: 0000-0000-0002-0004
MSR 00000048: 0000-0000-0000-0000
MSR 00000049: < FAILED >
MSR 0000008B: 0000-00DE-0000-0000
MSR 000000CE: 0008-0838-F101-2700 [eD = 0]
MSR 000000E7: 0000-00ED-11A9-508D
MSR 000000E8: 0000-00ED-03B4-15FA
MSR 0000010B: < FAILED >
MSR 00000194: 0000-0000-0001-0000
MSR 00000198: 0000-2316-0000-2700
MSR 00000199: 0000-0000-0000-2700
MSR 0000019A: 0000-0000-0000-0000
MSR 0000019B: 0000-0000-0000-0010
MSR 0000019C: 0000-0000-8847-0800
MSR 0000019D: 0000-0000-0000-0000
MSR 000001A0: 0000-0000-0085-0089
MSR 000001A2: 0000-0000-0064-1441
MSR 000001A4: 0000-0000-0000-0000
MSR 000001AA: 0000-0000-0040-1CC0
MSR 000001AC: < FAILED >
MSR 000001AD: 0000-0000-2727-2727
MSR 000001B0: < FAILED >
MSR 000001B1: 0000-0000-883D-0800
MSR 000001B2: 0000-0000-0000-0000
MSR 000001FC: 0000-0000-0030-1CC1
MSR 00000300: < FAILED >
MSR 0000030A: 0000-0000-0000-0000
MSR 0000030B: 0000-0000-0000-0000
MSR 00000480: 00DA-0400-0000-0004
MSR 00000481: 0000-007F-0000-0016
MSR 00000482: FFF9-FFFE-0401-E172
MSR 00000483: 01FF-FFFF-0003-6DFF
MSR 00000484: 0003-FFFF-0000-11FF
MSR 00000485: 0000-0000-7004-C1E7
MSR 00000486: 0000-0000-8000-0021
MSR 00000487: 0000-0000-FFFF-FFFF
MSR 00000488: 0000-0000-0000-2000
MSR 00000489: 0000-0000-0037-27FF
MSR 0000048A: 0000-0000-0000-002E
MSR 0000048B: 005F-BCFF-0000-0000
MSR 0000048C: 0000-0F01-0673-4141
MSR 0000048D: 0000-007F-0000-0016
MSR 0000048E: FFF9-FFFE-0400-6172
MSR 0000048F: 01FF-FFFF-0003-6DFB
MSR 00000490: 0003-FFFF-0000-11FB
MSR 00000601: 0000-0000-0000-0000
MSR 00000602: < FAILED >
MSR 00000603: 0036-0000-0036-3636
MSR 00000604: < FAILED >
MSR 00000606: 0000-0000-000A-0E03
MSR 0000060A: 0000-0000-0000-884E
MSR 0000060B: 0000-0000-0000-8876
MSR 0000060C: 0000-0000-0000-8894
MSR 0000060D: 0000-0000-0000-0000
MSR 00000610: 0042-81FE-001B-8198
MSR 00000611: 0000-0000-1466-DDBB
MSR 00000613: 0000-0000-0000-0016
MSR 00000614: 0000-0000-0000-0198
MSR 00000618: 0054-00DE-0000-0000
MSR 00000619: 0000-0000-013B-7459
MSR 0000061B: 0000-0000-0000-0000
MSR 0000061C: < FAILED >
MSR 0000061E: < FAILED >
MSR 00000620: 0000-0000-0000-0824
MSR 00000621: 0000-0000-0000-0024
MSR 00000638: 0000-0000-0000-0000
MSR 00000639: 0000-0000-0AC8-8428
MSR 0000063A: 0000-0000-0000-0009
MSR 0000063B: < FAILED >
MSR 00000640: 0000-0000-0000-0000
MSR 00000641: 0000-0000-000C-A962
MSR 00000642: 0000-0000-0000-000D
MSR 00000648: 0000-0000-0000-0027
MSR 00000649: 0000-0000-0000-0000
MSR 0000064A: 0000-0000-0000-0000
MSR 0000064B: 0000-0000-8000-0000
MSR 0000064C: 0000-0000-0000-0000
MSR 00000690: 0000-0000-0000-0000
MSR 000006B0: 0000-0000-0000-0000
MSR 000006B1: 0000-0000-0100-0000
MSR 00000770: 0000-0000-0000-0000
MSR 00000771: < FAILED >
MSR 00000772: < FAILED >
MSR 00000773: 0000-0000-0000-0000
MSR 00000774: < FAILED >
MSR 00000777: < FAILED >

------[ MSR Registers / Logical CPU #3 ]------

MSR 00000017: 0004-0000-0000-0000 [PlatID = 1]
MSR 0000001B: 0000-0000-FEE0-0800
MSR 00000035: 0000-0000-0002-0004
MSR 00000048: 0000-0000-0000-0000
MSR 00000049: < FAILED >
MSR 0000008B: 0000-00DE-0000-0000
MSR 000000CE: 0008-0838-F101-2700 [eD = 0]
MSR 000000E7: 0000-00AE-0043-9147
MSR 000000E8: 0000-00AD-FAFA-ABC8
MSR 0000010B: < FAILED >
MSR 00000194: 0000-0000-0001-0000
MSR 00000198: 0000-22FD-0000-2700
MSR 00000199: 0000-0000-0000-2700
MSR 0000019A: 0000-0000-0000-0000
MSR 0000019B: 0000-0000-0000-0010
MSR 0000019C: 0000-0000-8846-0800
MSR 0000019D: 0000-0000-0000-0000
MSR 000001A0: 0000-0000-0085-0089
MSR 000001A2: 0000-0000-0064-1441
MSR 000001A4: 0000-0000-0000-0000
MSR 000001AA: 0000-0000-0040-1CC0
MSR 000001AC: < FAILED >
MSR 000001AD: 0000-0000-2727-2727
MSR 000001B0: < FAILED >
MSR 000001B1: 0000-0000-883F-0800
MSR 000001B2: 0000-0000-0000-0000
MSR 000001FC: 0000-0000-0030-1CC1
MSR 00000300: < FAILED >
MSR 0000030A: 0000-0000-0000-0000
MSR 0000030B: 0000-0000-0000-0000
MSR 00000480: 00DA-0400-0000-0004
MSR 00000481: 0000-007F-0000-0016
MSR 00000482: FFF9-FFFE-0401-E172
MSR 00000483: 01FF-FFFF-0003-6DFF
MSR 00000484: 0003-FFFF-0000-11FF
MSR 00000485: 0000-0000-7004-C1E7
MSR 00000486: 0000-0000-8000-0021
MSR 00000487: 0000-0000-FFFF-FFFF
MSR 00000488: 0000-0000-0000-2000
MSR 00000489: 0000-0000-0037-27FF
MSR 0000048A: 0000-0000-0000-002E
MSR 0000048B: 005F-BCFF-0000-0000
MSR 0000048C: 0000-0F01-0673-4141
MSR 0000048D: 0000-007F-0000-0016
MSR 0000048E: FFF9-FFFE-0400-6172
MSR 0000048F: 01FF-FFFF-0003-6DFB
MSR 00000490: 0003-FFFF-0000-11FB
MSR 00000601: 0000-0000-0000-0000
MSR 00000602: < FAILED >
MSR 00000603: 0036-0000-0036-3636
MSR 00000604: < FAILED >
MSR 00000606: 0000-0000-000A-0E03
MSR 0000060A: 0000-0000-0000-884E
MSR 0000060B: 0000-0000-0000-8876
MSR 0000060C: 0000-0000-0000-8894
MSR 0000060D: 0000-0000-0000-0000
MSR 00000610: 0042-81FE-001B-8198
MSR 00000611: 0000-0000-1466-DEA5
MSR 00000613: 0000-0000-0000-0016
MSR 00000614: 0000-0000-0000-0198
MSR 00000618: 0054-00DE-0000-0000
MSR 00000619: 0000-0000-013B-7462
MSR 0000061B: 0000-0000-0000-0000
MSR 0000061C: < FAILED >
MSR 0000061E: < FAILED >
MSR 00000620: 0000-0000-0000-0824
MSR 00000621: 0000-0000-0000-0024
MSR 00000638: 0000-0000-0000-0000
MSR 00000639: 0000-0000-0AC8-849D
MSR 0000063A: 0000-0000-0000-0009
MSR 0000063B: < FAILED >
MSR 00000640: 0000-0000-0000-0000
MSR 00000641: 0000-0000-000C-A96E
MSR 00000642: 0000-0000-0000-000D
MSR 00000648: 0000-0000-0000-0027
MSR 00000649: 0000-0000-0000-0000
MSR 0000064A: 0000-0000-0000-0000
MSR 0000064B: 0000-0000-8000-0000
MSR 0000064C: 0000-0000-0000-0000
MSR 00000690: 0000-0000-0000-0000
MSR 000006B0: 0000-0000-0000-0000
MSR 000006B1: 0000-0000-0100-0000
MSR 00000770: 0000-0000-0000-0000
MSR 00000771: < FAILED >
MSR 00000772: < FAILED >
MSR 00000773: 0000-0000-0000-0000
MSR 00000774: < FAILED >
MSR 00000777: < FAILED >

PerformanceFrequency = 10000000

CPU Clock M.Method = 9  (APIC SKL)
PM Timer Address   = 2312  (0908h)

APIC Clock =  99.78 MHz  (AT = 12574 / TT = 15003 / try = 1 / SKL = 24.00 MHz)
APIC Clock =  99.78 MHz  (AT = 12574 / TT = 15003 / try = 1 / SKL = 24.00 MHz)
APIC Clock =  99.78 MHz  (AT = 12574 / TT = 15003 / try = 1 / SKL = 24.00 MHz)
APIC Clock =  99.78 MHz  (AT = 12574 / TT = 15003 / try = 1 / SKL = 24.00 MHz)
APIC Clock =  99.78 MHz  (AT = 12574 / TT = 15003 / try = 1 / SKL = 24.00 MHz)

CPU Clock = 3891.42 MHz / TSC Clock = 3912.02 MHz / CPU Mul = 39.00x
CPU Clock = 3891.42 MHz / TSC Clock = 3912.02 MHz / CPU Mul = 39.00x
CPU Clock = 3891.42 MHz / TSC Clock = 3912.02 MHz / CPU Mul = 39.00x
CPU Clock = 3891.42 MHz / TSC Clock = 3912.02 MHz / CPU Mul = 39.00x
CPU Clock = 3891.42 MHz / TSC Clock = 3912.02 MHz / CPU Mul = 39.00x

CPU Clock Max = 3891.42 MHz / TSC Clock = 3912.02 MHz / CPU Mul = 39.00x
CPU Clock Max = 3891.42 MHz / TSC Clock = 3912.02 MHz / CPU Mul = 39.00x
CPU Clock Max = 3891.42 MHz / TSC Clock = 3912.02 MHz / CPU Mul = 39.00x
CPU Clock Max = 3891.42 MHz / TSC Clock = 3912.02 MHz / CPU Mul = 39.00x
CPU Clock Max = 3891.42 MHz / TSC Clock = 3912.02 MHz / CPU Mul = 39.00x

INTPERFCTR2 = 3890.95 MHz / INTPERFCTR1 (TSC) = 3912.02 MHz
INTPERFCTR2 = 3890.96 MHz / INTPERFCTR1 (TSC) = 3912.04 MHz
INTPERFCTR2 = 3890.98 MHz / INTPERFCTR1 (TSC) = 3912.06 MHz
INTPERFCTR2 = 3890.98 MHz / INTPERFCTR1 (TSC) = 3912.04 MHz
INTPERFCTR2 = 3890.91 MHz / INTPERFCTR1 (TSC) = 3911.97 MHz

------[ OC MailBox ]------

C 01 / P1 00 / P2 00: 00000627
C 01 / P1 01 / P2 00: 00000616
C 01 / P1 02 / P2 00: 00000624
C 01 / P1 03 / P2 00: 00000616
C 01 / P1 04 / P2 00: 00000400
C 02 / P1 00 / P2 00: 27272727
C 02 / P1 00 / P2 01: < FAILED >
C 02 / P1 00 / P2 02: < FAILED >
C 02 / P1 00 / P2 03: < FAILED >
C 02 / P1 01 / P2 00: 00000000
C 02 / P1 01 / P2 01: < FAILED >
C 02 / P1 01 / P2 02: < FAILED >
C 02 / P1 01 / P2 03: < FAILED >
C 02 / P1 02 / P2 00: 00000000
C 02 / P1 02 / P2 01: < FAILED >
C 02 / P1 02 / P2 02: < FAILED >
C 02 / P1 02 / P2 03: < FAILED >
C 02 / P1 03 / P2 00: 00000000
C 02 / P1 03 / P2 01: < FAILED >
C 02 / P1 03 / P2 02: < FAILED >
C 02 / P1 03 / P2 03: < FAILED >
C 02 / P1 04 / P2 00: 00000000
C 02 / P1 04 / P2 01: < FAILED >
C 02 / P1 04 / P2 02: < FAILED >
C 02 / P1 04 / P2 03: < FAILED >
C 02 / P1 05 / P2 00: 00000000
C 02 / P1 05 / P2 01: < FAILED >
C 02 / P1 05 / P2 02: < FAILED >
C 02 / P1 05 / P2 03: < FAILED >
C 02 / P1 06 / P2 00: 00000000
C 02 / P1 06 / P2 01: < FAILED >
C 02 / P1 06 / P2 02: < FAILED >
C 02 / P1 06 / P2 03: < FAILED >
C 02 / P1 07 / P2 00: 00000000
C 02 / P1 07 / P2 01: < FAILED >
C 02 / P1 07 / P2 02: < FAILED >
C 02 / P1 07 / P2 03: < FAILED >
C 03 / P1 00 / P2 00: 00000410
C 04 / P1 00 / P2 00: 80108012
C 05 / P1 00 / P2 00: 000185C4
C 10 / P1 00 / P2 00: 00000000
C 10 / P1 01 / P2 00: 00000000
C 10 / P1 02 / P2 00: 00000000
C 10 / P1 03 / P2 00: 00000000
C 10 / P1 04 / P2 00: 00000000
C 12 / P1 00 / P2 00: 00000000
C 12 / P1 01 / P2 00: 00000000
C 12 / P1 02 / P2 00: 00000000
C 14 / P1 00 / P2 00: 00000000
C 16 / P1 00 / P2 00: 00000224
C 18 / P1 00 / P2 00: 00000000
C 1A / P1 00 / P2 00: 00000000
C 1C / P1 00 / P2 00: 00000000  [CPU0]
C 1C / P1 00 / P2 00: 00000000  [CPU1]
C 1C / P1 00 / P2 00: 00000000  [CPU2]
C 1C / P1 00 / P2 00: 00000000  [CPU3]
