------[ Versions ]------

Program Version : AIDA64 Engineer v8.25.8223 Beta
LLKD Version    : 1021
BenchDLL Version: 4.7.927.8-x64
Windows Version : Microsoft Windows 11 Pro 10.0.28000.1764 (64-bit)
GetProductInfo  : 0x00000030

------[ CPU Info ]------

CPU Type          : QuadCore Intel Core i7-6700K, 4000 MHz (40 x 100)
CPU Alias         : Skylake-S
CPU Platform      : LGA1151
CPU Stepping      : R0
Instruction Set   : x86, x86-64, MMX, SSE, SSE2, SSE3, SSSE3, SSE4.1, SSE4.2, AVX, AVX2, FMA, AES
CPUID Manufacturer: GenuineIntel
CPUID CPU Name    : Intel(R) Core(TM) i7-6700K CPU @ 4.00GHz
CPUID Revision    : 000506E3h
IA Brand ID       : 00h  (Unknown)
Platform ID       : 0059h  (LGA1151)
SMT / CMP Units   : 2 / 4
Max. NUMA Node    : 0

Tjmax Temperature          : 100 Celsius
HTC Temperature Limit      : 0 Celsius
CPU TDP                    : 95 W
CPU Max Power Limit        : Unlimited Power / Unlimited Time
CPU Power Limit 1 (Long)   : 4095.9 W / 16.00 sec  (Unlocked)
CPU Power Limit 2 (Short)  : 4095.9 W / 2.44 ms  (Unlocked)
Max Turbo Boost Multipliers: 1C: 42x, 2C: 42x, 3C: 42x, 4C: 42x

------[ Motherboard Info ]------

Motherboard ID      : 63-0100-000001-00101111-040416-Chipset$0AAAA000_BIOS DATE: 07/02/18 13:32:44 VER: V2.D0
Motherboard Model   : MSI Z170A-G45 Gaming (MS-7977)
Motherboard Chipset : Intel Sunrise Point Z170, Intel Skylake-S

DMI MB Manufacturer : MSI
DMI MB Product      : Z170A-G45 GAMING (MS-7977)
DMI MB Version      : 1.0
DMI MB Serial       : F816497256
DMI SYS Manufacturer: MSI
DMI SYS Product     : MS-7977
DMI SYS Version     : 1.0
DMI SYS Serial      : Default string
DMI BIOS Version    : 2.D0


------[ CPUID Registers / Logical CPU #0 ]------

allcpu: Package 0 / Core 0 / Thread 0: Valid

CPUID 00000000: 00000016-756E6547-6C65746E-49656E69 [GenuineIntel]
CPUID 00000001: 000506E3-00100800-7FFAFBBF-BFEBFBFF
CPUID 00000002: 76036301-00F0B5FF-00000000-00C30000
CPUID 00000003: 00000000-00000000-00000000-00000000
CPUID 00000004: 1C004121-01C0003F-0000003F-00000000 [SL 00] [L1D: 32 KB]
CPUID 00000004: 1C004122-01C0003F-0000003F-00000000 [SL 01] [L1I: 32 KB]
CPUID 00000004: 1C004143-00C0003F-000003FF-00000000 [SL 02] [L2U: 256 KB]
CPUID 00000004: 1C03C163-03C0003F-00001FFF-00000006 [SL 03] [L3U: 8 MB]
CPUID 00000005: 00000040-00000040-00000003-00142120
CPUID 00000006: 000027F5-00000002-00000009-00000000
CPUID 00000007: 00000000-029C6FBF-00000000-9C002400 [SL 00]
CPUID 00000008: 00000000-00000000-00000000-00000000
CPUID 00000009: 00000000-00000000-00000000-00000000
CPUID 0000000A: 07300404-00000000-00000000-00000603
CPUID 0000000B: 00000001-00000002-00000100-00000000 [SL 00]
CPUID 0000000B: 00000004-00000008-00000201-00000000 [SL 01]
CPUID 0000000C: 00000000-00000000-00000000-00000000
CPUID 0000000D: 0000001F-00000440-00000440-00000000 [SL 00] [x87]
CPUID 0000000D: 0000000F-00000440-00000100-00000000 [SL 01] [SSE]
CPUID 0000000D: 00000100-00000240-00000000-00000000 [SL 02] [AVX]
CPUID 0000000D: 00000040-000003C0-00000000-00000000 [SL 03] [MPX BNDREGS]
CPUID 0000000D: 00000040-00000400-00000000-00000000 [SL 04] [MPX BNDCSR]
CPUID 0000000D: 00000080-00000000-00000001-00000000 [SL 08] [PT]
CPUID 0000000E: 00000000-00000000-00000000-00000000
CPUID 0000000F: 00000000-00000000-00000000-00000000 [SL 00]
CPUID 0000000F: 00000000-00000000-00000000-00000000 [SL 01]
CPUID 00000010: 00000000-00000000-00000000-00000000 [SL 00]
CPUID 00000010: 00000000-00000000-00000000-00000000 [SL 01]
CPUID 00000011: 00000000-00000000-00000000-00000000
CPUID 00000012: 00000000-00000000-00000000-00000000 [SL 00]
CPUID 00000012: 00000000-00000000-00000000-00000000 [SL 01]
CPUID 00000013: 00000000-00000000-00000000-00000000
CPUID 00000014: 00000001-0000000F-00000007-00000000 [SL 00]
CPUID 00000014: 02490002-003F3FFF-00000000-00000000 [SL 01]
CPUID 00000015: 00000002-0000014E-00000000-00000000 [167.00x / 0 / 0.00]
CPUID 00000016: 00000FA0-00001068-00000064-00000000 [4000 / 4200 / 100]
CPUID 80000000: 80000008-00000000-00000000-00000000
CPUID 80000001: 00000000-00000000-00000121-2C100800
CPUID 80000002: 65746E49-2952286C-726F4320-4D542865 [Intel(R) Core(TM]
CPUID 80000003: 37692029-3037362D-43204B30-40205550 [) i7-6700K CPU @]
CPUID 80000004: 302E3420-7A484730-00000000-00000000 [ 4.00GHz]
CPUID 80000005: 00000000-00000000-00000000-00000000 [L1D: 0 KB / L1I: 0 KB]
CPUID 80000006: 00000000-00000000-01006040-00000000 [L2: 256 KB / L3: 0 KB]
CPUID 80000007: 00000000-00000000-00000000-00000100
CPUID 80000008: 00003027-00000000-00000000-00000000

L1    Data Cache:    32 KB,  8-way Associative, 64-byte Line
L1  Instr. Cache:    32 KB,  8-way Associative, 64-byte Line
L2 Unified Cache:   256 KB,  4-way Associative, 64-byte Line
L3 Unified Cache:     8 MB, 16-way Associative, 64-byte Line

------[ CPUID Registers / Logical CPU #1 ]------

allcpu: Package 0 / Core 0 / Thread 1: Valid, Virtual

CPUID 00000000: 00000016-756E6547-6C65746E-49656E69 [GenuineIntel]
CPUID 00000001: 000506E3-01100800-7FFAFBBF-BFEBFBFF
CPUID 00000002: 76036301-00F0B5FF-00000000-00C30000
CPUID 00000003: 00000000-00000000-00000000-00000000
CPUID 00000004: 1C004121-01C0003F-0000003F-00000000 [SL 00] [L1D: 32 KB]
CPUID 00000004: 1C004122-01C0003F-0000003F-00000000 [SL 01] [L1I: 32 KB]
CPUID 00000004: 1C004143-00C0003F-000003FF-00000000 [SL 02] [L2U: 256 KB]
CPUID 00000004: 1C03C163-03C0003F-00001FFF-00000006 [SL 03] [L3U: 8 MB]
CPUID 00000005: 00000040-00000040-00000003-00142120
CPUID 00000006: 000027F5-00000002-00000009-00000000
CPUID 00000007: 00000000-029C6FBF-00000000-9C002400 [SL 00]
CPUID 00000008: 00000000-00000000-00000000-00000000
CPUID 00000009: 00000000-00000000-00000000-00000000
CPUID 0000000A: 07300404-00000000-00000000-00000603
CPUID 0000000B: 00000001-00000002-00000100-00000001 [SL 00]
CPUID 0000000B: 00000004-00000008-00000201-00000001 [SL 01]
CPUID 0000000C: 00000000-00000000-00000000-00000000
CPUID 0000000D: 0000001F-00000440-00000440-00000000 [SL 00] [x87]
CPUID 0000000D: 0000000F-00000440-00000100-00000000 [SL 01] [SSE]
CPUID 0000000D: 00000100-00000240-00000000-00000000 [SL 02] [AVX]
CPUID 0000000D: 00000040-000003C0-00000000-00000000 [SL 03] [MPX BNDREGS]
CPUID 0000000D: 00000040-00000400-00000000-00000000 [SL 04] [MPX BNDCSR]
CPUID 0000000D: 00000080-00000000-00000001-00000000 [SL 08] [PT]
CPUID 0000000E: 00000000-00000000-00000000-00000000
CPUID 0000000F: 00000000-00000000-00000000-00000000 [SL 00]
CPUID 0000000F: 00000000-00000000-00000000-00000000 [SL 01]
CPUID 00000010: 00000000-00000000-00000000-00000000 [SL 00]
CPUID 00000010: 00000000-00000000-00000000-00000000 [SL 01]
CPUID 00000011: 00000000-00000000-00000000-00000000
CPUID 00000012: 00000000-00000000-00000000-00000000 [SL 00]
CPUID 00000012: 00000000-00000000-00000000-00000000 [SL 01]
CPUID 00000013: 00000000-00000000-00000000-00000000
CPUID 00000014: 00000001-0000000F-00000007-00000000 [SL 00]
CPUID 00000014: 02490002-003F3FFF-00000000-00000000 [SL 01]
CPUID 00000015: 00000002-0000014E-00000000-00000000 [167.00x / 0 / 0.00]
CPUID 00000016: 00000FA0-00001068-00000064-00000000 [4000 / 4200 / 100]
CPUID 80000000: 80000008-00000000-00000000-00000000
CPUID 80000001: 00000000-00000000-00000121-2C100800
CPUID 80000002: 65746E49-2952286C-726F4320-4D542865 [Intel(R) Core(TM]
CPUID 80000003: 37692029-3037362D-43204B30-40205550 [) i7-6700K CPU @]
CPUID 80000004: 302E3420-7A484730-00000000-00000000 [ 4.00GHz]
CPUID 80000005: 00000000-00000000-00000000-00000000 [L1D: 0 KB / L1I: 0 KB]
CPUID 80000006: 00000000-00000000-01006040-00000000 [L2: 256 KB / L3: 0 KB]
CPUID 80000007: 00000000-00000000-00000000-00000100
CPUID 80000008: 00003027-00000000-00000000-00000000

L1    Data Cache:    32 KB,  8-way Associative, 64-byte Line
L1  Instr. Cache:    32 KB,  8-way Associative, 64-byte Line
L2 Unified Cache:   256 KB,  4-way Associative, 64-byte Line
L3 Unified Cache:     8 MB, 16-way Associative, 64-byte Line

------[ CPUID Registers / Logical CPU #2 ]------

allcpu: Package 0 / Core 1 / Thread 0: Valid

CPUID 00000000: 00000016-756E6547-6C65746E-49656E69 [GenuineIntel]
CPUID 00000001: 000506E3-02100800-7FFAFBBF-BFEBFBFF
CPUID 00000002: 76036301-00F0B5FF-00000000-00C30000
CPUID 00000003: 00000000-00000000-00000000-00000000
CPUID 00000004: 1C004121-01C0003F-0000003F-00000000 [SL 00] [L1D: 32 KB]
CPUID 00000004: 1C004122-01C0003F-0000003F-00000000 [SL 01] [L1I: 32 KB]
CPUID 00000004: 1C004143-00C0003F-000003FF-00000000 [SL 02] [L2U: 256 KB]
CPUID 00000004: 1C03C163-03C0003F-00001FFF-00000006 [SL 03] [L3U: 8 MB]
CPUID 00000005: 00000040-00000040-00000003-00142120
CPUID 00000006: 000027F5-00000002-00000009-00000000
CPUID 00000007: 00000000-029C6FBF-00000000-9C002400 [SL 00]
CPUID 00000008: 00000000-00000000-00000000-00000000
CPUID 00000009: 00000000-00000000-00000000-00000000
CPUID 0000000A: 07300404-00000000-00000000-00000603
CPUID 0000000B: 00000001-00000002-00000100-00000002 [SL 00]
CPUID 0000000B: 00000004-00000008-00000201-00000002 [SL 01]
CPUID 0000000C: 00000000-00000000-00000000-00000000
CPUID 0000000D: 0000001F-00000440-00000440-00000000 [SL 00] [x87]
CPUID 0000000D: 0000000F-00000440-00000100-00000000 [SL 01] [SSE]
CPUID 0000000D: 00000100-00000240-00000000-00000000 [SL 02] [AVX]
CPUID 0000000D: 00000040-000003C0-00000000-00000000 [SL 03] [MPX BNDREGS]
CPUID 0000000D: 00000040-00000400-00000000-00000000 [SL 04] [MPX BNDCSR]
CPUID 0000000D: 00000080-00000000-00000001-00000000 [SL 08] [PT]
CPUID 0000000E: 00000000-00000000-00000000-00000000
CPUID 0000000F: 00000000-00000000-00000000-00000000 [SL 00]
CPUID 0000000F: 00000000-00000000-00000000-00000000 [SL 01]
CPUID 00000010: 00000000-00000000-00000000-00000000 [SL 00]
CPUID 00000010: 00000000-00000000-00000000-00000000 [SL 01]
CPUID 00000011: 00000000-00000000-00000000-00000000
CPUID 00000012: 00000000-00000000-00000000-00000000 [SL 00]
CPUID 00000012: 00000000-00000000-00000000-00000000 [SL 01]
CPUID 00000013: 00000000-00000000-00000000-00000000
CPUID 00000014: 00000001-0000000F-00000007-00000000 [SL 00]
CPUID 00000014: 02490002-003F3FFF-00000000-00000000 [SL 01]
CPUID 00000015: 00000002-0000014E-00000000-00000000 [167.00x / 0 / 0.00]
CPUID 00000016: 00000FA0-00001068-00000064-00000000 [4000 / 4200 / 100]
CPUID 80000000: 80000008-00000000-00000000-00000000
CPUID 80000001: 00000000-00000000-00000121-2C100800
CPUID 80000002: 65746E49-2952286C-726F4320-4D542865 [Intel(R) Core(TM]
CPUID 80000003: 37692029-3037362D-43204B30-40205550 [) i7-6700K CPU @]
CPUID 80000004: 302E3420-7A484730-00000000-00000000 [ 4.00GHz]
CPUID 80000005: 00000000-00000000-00000000-00000000 [L1D: 0 KB / L1I: 0 KB]
CPUID 80000006: 00000000-00000000-01006040-00000000 [L2: 256 KB / L3: 0 KB]
CPUID 80000007: 00000000-00000000-00000000-00000100
CPUID 80000008: 00003027-00000000-00000000-00000000

L1    Data Cache:    32 KB,  8-way Associative, 64-byte Line
L1  Instr. Cache:    32 KB,  8-way Associative, 64-byte Line
L2 Unified Cache:   256 KB,  4-way Associative, 64-byte Line
L3 Unified Cache:     8 MB, 16-way Associative, 64-byte Line

------[ CPUID Registers / Logical CPU #3 ]------

allcpu: Package 0 / Core 1 / Thread 1: Valid, Virtual

CPUID 00000000: 00000016-756E6547-6C65746E-49656E69 [GenuineIntel]
CPUID 00000001: 000506E3-03100800-7FFAFBBF-BFEBFBFF
CPUID 00000002: 76036301-00F0B5FF-00000000-00C30000
CPUID 00000003: 00000000-00000000-00000000-00000000
CPUID 00000004: 1C004121-01C0003F-0000003F-00000000 [SL 00] [L1D: 32 KB]
CPUID 00000004: 1C004122-01C0003F-0000003F-00000000 [SL 01] [L1I: 32 KB]
CPUID 00000004: 1C004143-00C0003F-000003FF-00000000 [SL 02] [L2U: 256 KB]
CPUID 00000004: 1C03C163-03C0003F-00001FFF-00000006 [SL 03] [L3U: 8 MB]
CPUID 00000005: 00000040-00000040-00000003-00142120
CPUID 00000006: 000027F5-00000002-00000009-00000000
CPUID 00000007: 00000000-029C6FBF-00000000-9C002400 [SL 00]
CPUID 00000008: 00000000-00000000-00000000-00000000
CPUID 00000009: 00000000-00000000-00000000-00000000
CPUID 0000000A: 07300404-00000000-00000000-00000603
CPUID 0000000B: 00000001-00000002-00000100-00000003 [SL 00]
CPUID 0000000B: 00000004-00000008-00000201-00000003 [SL 01]
CPUID 0000000C: 00000000-00000000-00000000-00000000
CPUID 0000000D: 0000001F-00000440-00000440-00000000 [SL 00] [x87]
CPUID 0000000D: 0000000F-00000440-00000100-00000000 [SL 01] [SSE]
CPUID 0000000D: 00000100-00000240-00000000-00000000 [SL 02] [AVX]
CPUID 0000000D: 00000040-000003C0-00000000-00000000 [SL 03] [MPX BNDREGS]
CPUID 0000000D: 00000040-00000400-00000000-00000000 [SL 04] [MPX BNDCSR]
CPUID 0000000D: 00000080-00000000-00000001-00000000 [SL 08] [PT]
CPUID 0000000E: 00000000-00000000-00000000-00000000
CPUID 0000000F: 00000000-00000000-00000000-00000000 [SL 00]
CPUID 0000000F: 00000000-00000000-00000000-00000000 [SL 01]
CPUID 00000010: 00000000-00000000-00000000-00000000 [SL 00]
CPUID 00000010: 00000000-00000000-00000000-00000000 [SL 01]
CPUID 00000011: 00000000-00000000-00000000-00000000
CPUID 00000012: 00000000-00000000-00000000-00000000 [SL 00]
CPUID 00000012: 00000000-00000000-00000000-00000000 [SL 01]
CPUID 00000013: 00000000-00000000-00000000-00000000
CPUID 00000014: 00000001-0000000F-00000007-00000000 [SL 00]
CPUID 00000014: 02490002-003F3FFF-00000000-00000000 [SL 01]
CPUID 00000015: 00000002-0000014E-00000000-00000000 [167.00x / 0 / 0.00]
CPUID 00000016: 00000FA0-00001068-00000064-00000000 [4000 / 4200 / 100]
CPUID 80000000: 80000008-00000000-00000000-00000000
CPUID 80000001: 00000000-00000000-00000121-2C100800
CPUID 80000002: 65746E49-2952286C-726F4320-4D542865 [Intel(R) Core(TM]
CPUID 80000003: 37692029-3037362D-43204B30-40205550 [) i7-6700K CPU @]
CPUID 80000004: 302E3420-7A484730-00000000-00000000 [ 4.00GHz]
CPUID 80000005: 00000000-00000000-00000000-00000000 [L1D: 0 KB / L1I: 0 KB]
CPUID 80000006: 00000000-00000000-01006040-00000000 [L2: 256 KB / L3: 0 KB]
CPUID 80000007: 00000000-00000000-00000000-00000100
CPUID 80000008: 00003027-00000000-00000000-00000000

L1    Data Cache:    32 KB,  8-way Associative, 64-byte Line
L1  Instr. Cache:    32 KB,  8-way Associative, 64-byte Line
L2 Unified Cache:   256 KB,  4-way Associative, 64-byte Line
L3 Unified Cache:     8 MB, 16-way Associative, 64-byte Line

------[ CPUID Registers / Logical CPU #4 ]------

allcpu: Package 0 / Core 2 / Thread 0: Valid

CPUID 00000000: 00000016-756E6547-6C65746E-49656E69 [GenuineIntel]
CPUID 00000001: 000506E3-04100800-7FFAFBBF-BFEBFBFF
CPUID 00000002: 76036301-00F0B5FF-00000000-00C30000
CPUID 00000003: 00000000-00000000-00000000-00000000
CPUID 00000004: 1C004121-01C0003F-0000003F-00000000 [SL 00] [L1D: 32 KB]
CPUID 00000004: 1C004122-01C0003F-0000003F-00000000 [SL 01] [L1I: 32 KB]
CPUID 00000004: 1C004143-00C0003F-000003FF-00000000 [SL 02] [L2U: 256 KB]
CPUID 00000004: 1C03C163-03C0003F-00001FFF-00000006 [SL 03] [L3U: 8 MB]
CPUID 00000005: 00000040-00000040-00000003-00142120
CPUID 00000006: 000027F5-00000002-00000009-00000000
CPUID 00000007: 00000000-029C6FBF-00000000-9C002400 [SL 00]
CPUID 00000008: 00000000-00000000-00000000-00000000
CPUID 00000009: 00000000-00000000-00000000-00000000
CPUID 0000000A: 07300404-00000000-00000000-00000603
CPUID 0000000B: 00000001-00000002-00000100-00000004 [SL 00]
CPUID 0000000B: 00000004-00000008-00000201-00000004 [SL 01]
CPUID 0000000C: 00000000-00000000-00000000-00000000
CPUID 0000000D: 0000001F-00000440-00000440-00000000 [SL 00] [x87]
CPUID 0000000D: 0000000F-00000440-00000100-00000000 [SL 01] [SSE]
CPUID 0000000D: 00000100-00000240-00000000-00000000 [SL 02] [AVX]
CPUID 0000000D: 00000040-000003C0-00000000-00000000 [SL 03] [MPX BNDREGS]
CPUID 0000000D: 00000040-00000400-00000000-00000000 [SL 04] [MPX BNDCSR]
CPUID 0000000D: 00000080-00000000-00000001-00000000 [SL 08] [PT]
CPUID 0000000E: 00000000-00000000-00000000-00000000
CPUID 0000000F: 00000000-00000000-00000000-00000000 [SL 00]
CPUID 0000000F: 00000000-00000000-00000000-00000000 [SL 01]
CPUID 00000010: 00000000-00000000-00000000-00000000 [SL 00]
CPUID 00000010: 00000000-00000000-00000000-00000000 [SL 01]
CPUID 00000011: 00000000-00000000-00000000-00000000
CPUID 00000012: 00000000-00000000-00000000-00000000 [SL 00]
CPUID 00000012: 00000000-00000000-00000000-00000000 [SL 01]
CPUID 00000013: 00000000-00000000-00000000-00000000
CPUID 00000014: 00000001-0000000F-00000007-00000000 [SL 00]
CPUID 00000014: 02490002-003F3FFF-00000000-00000000 [SL 01]
CPUID 00000015: 00000002-0000014E-00000000-00000000 [167.00x / 0 / 0.00]
CPUID 00000016: 00000FA0-00001068-00000064-00000000 [4000 / 4200 / 100]
CPUID 80000000: 80000008-00000000-00000000-00000000
CPUID 80000001: 00000000-00000000-00000121-2C100800
CPUID 80000002: 65746E49-2952286C-726F4320-4D542865 [Intel(R) Core(TM]
CPUID 80000003: 37692029-3037362D-43204B30-40205550 [) i7-6700K CPU @]
CPUID 80000004: 302E3420-7A484730-00000000-00000000 [ 4.00GHz]
CPUID 80000005: 00000000-00000000-00000000-00000000 [L1D: 0 KB / L1I: 0 KB]
CPUID 80000006: 00000000-00000000-01006040-00000000 [L2: 256 KB / L3: 0 KB]
CPUID 80000007: 00000000-00000000-00000000-00000100
CPUID 80000008: 00003027-00000000-00000000-00000000

L1    Data Cache:    32 KB,  8-way Associative, 64-byte Line
L1  Instr. Cache:    32 KB,  8-way Associative, 64-byte Line
L2 Unified Cache:   256 KB,  4-way Associative, 64-byte Line
L3 Unified Cache:     8 MB, 16-way Associative, 64-byte Line

------[ CPUID Registers / Logical CPU #5 ]------

allcpu: Package 0 / Core 2 / Thread 1: Valid, Virtual

CPUID 00000000: 00000016-756E6547-6C65746E-49656E69 [GenuineIntel]
CPUID 00000001: 000506E3-05100800-7FFAFBBF-BFEBFBFF
CPUID 00000002: 76036301-00F0B5FF-00000000-00C30000
CPUID 00000003: 00000000-00000000-00000000-00000000
CPUID 00000004: 1C004121-01C0003F-0000003F-00000000 [SL 00] [L1D: 32 KB]
CPUID 00000004: 1C004122-01C0003F-0000003F-00000000 [SL 01] [L1I: 32 KB]
CPUID 00000004: 1C004143-00C0003F-000003FF-00000000 [SL 02] [L2U: 256 KB]
CPUID 00000004: 1C03C163-03C0003F-00001FFF-00000006 [SL 03] [L3U: 8 MB]
CPUID 00000005: 00000040-00000040-00000003-00142120
CPUID 00000006: 000027F5-00000002-00000009-00000000
CPUID 00000007: 00000000-029C6FBF-00000000-9C002400 [SL 00]
CPUID 00000008: 00000000-00000000-00000000-00000000
CPUID 00000009: 00000000-00000000-00000000-00000000
CPUID 0000000A: 07300404-00000000-00000000-00000603
CPUID 0000000B: 00000001-00000002-00000100-00000005 [SL 00]
CPUID 0000000B: 00000004-00000008-00000201-00000005 [SL 01]
CPUID 0000000C: 00000000-00000000-00000000-00000000
CPUID 0000000D: 0000001F-00000440-00000440-00000000 [SL 00] [x87]
CPUID 0000000D: 0000000F-00000440-00000100-00000000 [SL 01] [SSE]
CPUID 0000000D: 00000100-00000240-00000000-00000000 [SL 02] [AVX]
CPUID 0000000D: 00000040-000003C0-00000000-00000000 [SL 03] [MPX BNDREGS]
CPUID 0000000D: 00000040-00000400-00000000-00000000 [SL 04] [MPX BNDCSR]
CPUID 0000000D: 00000080-00000000-00000001-00000000 [SL 08] [PT]
CPUID 0000000E: 00000000-00000000-00000000-00000000
CPUID 0000000F: 00000000-00000000-00000000-00000000 [SL 00]
CPUID 0000000F: 00000000-00000000-00000000-00000000 [SL 01]
CPUID 00000010: 00000000-00000000-00000000-00000000 [SL 00]
CPUID 00000010: 00000000-00000000-00000000-00000000 [SL 01]
CPUID 00000011: 00000000-00000000-00000000-00000000
CPUID 00000012: 00000000-00000000-00000000-00000000 [SL 00]
CPUID 00000012: 00000000-00000000-00000000-00000000 [SL 01]
CPUID 00000013: 00000000-00000000-00000000-00000000
CPUID 00000014: 00000001-0000000F-00000007-00000000 [SL 00]
CPUID 00000014: 02490002-003F3FFF-00000000-00000000 [SL 01]
CPUID 00000015: 00000002-0000014E-00000000-00000000 [167.00x / 0 / 0.00]
CPUID 00000016: 00000FA0-00001068-00000064-00000000 [4000 / 4200 / 100]
CPUID 80000000: 80000008-00000000-00000000-00000000
CPUID 80000001: 00000000-00000000-00000121-2C100800
CPUID 80000002: 65746E49-2952286C-726F4320-4D542865 [Intel(R) Core(TM]
CPUID 80000003: 37692029-3037362D-43204B30-40205550 [) i7-6700K CPU @]
CPUID 80000004: 302E3420-7A484730-00000000-00000000 [ 4.00GHz]
CPUID 80000005: 00000000-00000000-00000000-00000000 [L1D: 0 KB / L1I: 0 KB]
CPUID 80000006: 00000000-00000000-01006040-00000000 [L2: 256 KB / L3: 0 KB]
CPUID 80000007: 00000000-00000000-00000000-00000100
CPUID 80000008: 00003027-00000000-00000000-00000000

L1    Data Cache:    32 KB,  8-way Associative, 64-byte Line
L1  Instr. Cache:    32 KB,  8-way Associative, 64-byte Line
L2 Unified Cache:   256 KB,  4-way Associative, 64-byte Line
L3 Unified Cache:     8 MB, 16-way Associative, 64-byte Line

------[ CPUID Registers / Logical CPU #6 ]------

allcpu: Package 0 / Core 3 / Thread 0: Valid

CPUID 00000000: 00000016-756E6547-6C65746E-49656E69 [GenuineIntel]
CPUID 00000001: 000506E3-06100800-7FFAFBBF-BFEBFBFF
CPUID 00000002: 76036301-00F0B5FF-00000000-00C30000
CPUID 00000003: 00000000-00000000-00000000-00000000
CPUID 00000004: 1C004121-01C0003F-0000003F-00000000 [SL 00] [L1D: 32 KB]
CPUID 00000004: 1C004122-01C0003F-0000003F-00000000 [SL 01] [L1I: 32 KB]
CPUID 00000004: 1C004143-00C0003F-000003FF-00000000 [SL 02] [L2U: 256 KB]
CPUID 00000004: 1C03C163-03C0003F-00001FFF-00000006 [SL 03] [L3U: 8 MB]
CPUID 00000005: 00000040-00000040-00000003-00142120
CPUID 00000006: 000027F5-00000002-00000009-00000000
CPUID 00000007: 00000000-029C6FBF-00000000-9C002400 [SL 00]
CPUID 00000008: 00000000-00000000-00000000-00000000
CPUID 00000009: 00000000-00000000-00000000-00000000
CPUID 0000000A: 07300404-00000000-00000000-00000603
CPUID 0000000B: 00000001-00000002-00000100-00000006 [SL 00]
CPUID 0000000B: 00000004-00000008-00000201-00000006 [SL 01]
CPUID 0000000C: 00000000-00000000-00000000-00000000
CPUID 0000000D: 0000001F-00000440-00000440-00000000 [SL 00] [x87]
CPUID 0000000D: 0000000F-00000440-00000100-00000000 [SL 01] [SSE]
CPUID 0000000D: 00000100-00000240-00000000-00000000 [SL 02] [AVX]
CPUID 0000000D: 00000040-000003C0-00000000-00000000 [SL 03] [MPX BNDREGS]
CPUID 0000000D: 00000040-00000400-00000000-00000000 [SL 04] [MPX BNDCSR]
CPUID 0000000D: 00000080-00000000-00000001-00000000 [SL 08] [PT]
CPUID 0000000E: 00000000-00000000-00000000-00000000
CPUID 0000000F: 00000000-00000000-00000000-00000000 [SL 00]
CPUID 0000000F: 00000000-00000000-00000000-00000000 [SL 01]
CPUID 00000010: 00000000-00000000-00000000-00000000 [SL 00]
CPUID 00000010: 00000000-00000000-00000000-00000000 [SL 01]
CPUID 00000011: 00000000-00000000-00000000-00000000
CPUID 00000012: 00000000-00000000-00000000-00000000 [SL 00]
CPUID 00000012: 00000000-00000000-00000000-00000000 [SL 01]
CPUID 00000013: 00000000-00000000-00000000-00000000
CPUID 00000014: 00000001-0000000F-00000007-00000000 [SL 00]
CPUID 00000014: 02490002-003F3FFF-00000000-00000000 [SL 01]
CPUID 00000015: 00000002-0000014E-00000000-00000000 [167.00x / 0 / 0.00]
CPUID 00000016: 00000FA0-00001068-00000064-00000000 [4000 / 4200 / 100]
CPUID 80000000: 80000008-00000000-00000000-00000000
CPUID 80000001: 00000000-00000000-00000121-2C100800
CPUID 80000002: 65746E49-2952286C-726F4320-4D542865 [Intel(R) Core(TM]
CPUID 80000003: 37692029-3037362D-43204B30-40205550 [) i7-6700K CPU @]
CPUID 80000004: 302E3420-7A484730-00000000-00000000 [ 4.00GHz]
CPUID 80000005: 00000000-00000000-00000000-00000000 [L1D: 0 KB / L1I: 0 KB]
CPUID 80000006: 00000000-00000000-01006040-00000000 [L2: 256 KB / L3: 0 KB]
CPUID 80000007: 00000000-00000000-00000000-00000100
CPUID 80000008: 00003027-00000000-00000000-00000000

L1    Data Cache:    32 KB,  8-way Associative, 64-byte Line
L1  Instr. Cache:    32 KB,  8-way Associative, 64-byte Line
L2 Unified Cache:   256 KB,  4-way Associative, 64-byte Line
L3 Unified Cache:     8 MB, 16-way Associative, 64-byte Line

------[ CPUID Registers / Logical CPU #7 ]------

allcpu: Package 0 / Core 3 / Thread 1: Valid, Virtual

CPUID 00000000: 00000016-756E6547-6C65746E-49656E69 [GenuineIntel]
CPUID 00000001: 000506E3-07100800-7FFAFBBF-BFEBFBFF
CPUID 00000002: 76036301-00F0B5FF-00000000-00C30000
CPUID 00000003: 00000000-00000000-00000000-00000000
CPUID 00000004: 1C004121-01C0003F-0000003F-00000000 [SL 00] [L1D: 32 KB]
CPUID 00000004: 1C004122-01C0003F-0000003F-00000000 [SL 01] [L1I: 32 KB]
CPUID 00000004: 1C004143-00C0003F-000003FF-00000000 [SL 02] [L2U: 256 KB]
CPUID 00000004: 1C03C163-03C0003F-00001FFF-00000006 [SL 03] [L3U: 8 MB]
CPUID 00000005: 00000040-00000040-00000003-00142120
CPUID 00000006: 000027F5-00000002-00000009-00000000
CPUID 00000007: 00000000-029C6FBF-00000000-9C002400 [SL 00]
CPUID 00000008: 00000000-00000000-00000000-00000000
CPUID 00000009: 00000000-00000000-00000000-00000000
CPUID 0000000A: 07300404-00000000-00000000-00000603
CPUID 0000000B: 00000001-00000002-00000100-00000007 [SL 00]
CPUID 0000000B: 00000004-00000008-00000201-00000007 [SL 01]
CPUID 0000000C: 00000000-00000000-00000000-00000000
CPUID 0000000D: 0000001F-00000440-00000440-00000000 [SL 00] [x87]
CPUID 0000000D: 0000000F-00000440-00000100-00000000 [SL 01] [SSE]
CPUID 0000000D: 00000100-00000240-00000000-00000000 [SL 02] [AVX]
CPUID 0000000D: 00000040-000003C0-00000000-00000000 [SL 03] [MPX BNDREGS]
CPUID 0000000D: 00000040-00000400-00000000-00000000 [SL 04] [MPX BNDCSR]
CPUID 0000000D: 00000080-00000000-00000001-00000000 [SL 08] [PT]
CPUID 0000000E: 00000000-00000000-00000000-00000000
CPUID 0000000F: 00000000-00000000-00000000-00000000 [SL 00]
CPUID 0000000F: 00000000-00000000-00000000-00000000 [SL 01]
CPUID 00000010: 00000000-00000000-00000000-00000000 [SL 00]
CPUID 00000010: 00000000-00000000-00000000-00000000 [SL 01]
CPUID 00000011: 00000000-00000000-00000000-00000000
CPUID 00000012: 00000000-00000000-00000000-00000000 [SL 00]
CPUID 00000012: 00000000-00000000-00000000-00000000 [SL 01]
CPUID 00000013: 00000000-00000000-00000000-00000000
CPUID 00000014: 00000001-0000000F-00000007-00000000 [SL 00]
CPUID 00000014: 02490002-003F3FFF-00000000-00000000 [SL 01]
CPUID 00000015: 00000002-0000014E-00000000-00000000 [167.00x / 0 / 0.00]
CPUID 00000016: 00000FA0-00001068-00000064-00000000 [4000 / 4200 / 100]
CPUID 80000000: 80000008-00000000-00000000-00000000
CPUID 80000001: 00000000-00000000-00000121-2C100800
CPUID 80000002: 65746E49-2952286C-726F4320-4D542865 [Intel(R) Core(TM]
CPUID 80000003: 37692029-3037362D-43204B30-40205550 [) i7-6700K CPU @]
CPUID 80000004: 302E3420-7A484730-00000000-00000000 [ 4.00GHz]
CPUID 80000005: 00000000-00000000-00000000-00000000 [L1D: 0 KB / L1I: 0 KB]
CPUID 80000006: 00000000-00000000-01006040-00000000 [L2: 256 KB / L3: 0 KB]
CPUID 80000007: 00000000-00000000-00000000-00000100
CPUID 80000008: 00003027-00000000-00000000-00000000

L1    Data Cache:    32 KB,  8-way Associative, 64-byte Line
L1  Instr. Cache:    32 KB,  8-way Associative, 64-byte Line
L2 Unified Cache:   256 KB,  4-way Associative, 64-byte Line
L3 Unified Cache:     8 MB, 16-way Associative, 64-byte Line

------[ All CPUs ]------

CPU   0: APICID    0 / Package 0 / Core   0 / Thread 0: Valid
CPU   1: APICID    1 / Package 0 / Core   0 / Thread 1: Valid, Virtual
CPU   2: APICID    2 / Package 0 / Core   1 / Thread 0: Valid
CPU   3: APICID    3 / Package 0 / Core   1 / Thread 1: Valid, Virtual
CPU   4: APICID    4 / Package 0 / Core   2 / Thread 0: Valid
CPU   5: APICID    5 / Package 0 / Core   2 / Thread 1: Valid, Virtual
CPU   6: APICID    6 / Package 0 / Core   3 / Thread 0: Valid
CPU   7: APICID    7 / Package 0 / Core   3 / Thread 1: Valid, Virtual

------[ MSR Registers / Logical CPU #0 ]------

MSR 00000017: 0004-0000-0000-0000 [PlatID = 1]
MSR 0000001B: 0000-0000-FEE0-0900
MSR 00000035: 0000-0000-0004-0008
MSR 00000048: 0000-0000-0000-0000
MSR 00000049: < FAILED >
MSR 0000008B: 0000-00D6-0000-0000
MSR 000000CE: 0008-0838-F101-2800 [eD = 0]
MSR 000000E7: 0000-000F-44F8-DE5C [S200]
MSR 000000E7: 0000-000F-45C1-ABBC [S200]
MSR 000000E7: 0000-000F-4764-E3F4
MSR 000000E8: 0000-000E-5E27-2091 [S200]
MSR 000000E8: 0000-000E-5E46-4565 [S200]
MSR 000000E8: 0000-000E-5E69-1F81
MSR 0000010B: < FAILED >
MSR 00000194: 0000-0000-000F-0000
MSR 00000198: 0000-273E-0000-2800 [S200]
MSR 00000198: 0000-2713-0000-2800 [S200]
MSR 00000198: 0000-2713-0000-2800
MSR 00000199: 0000-0000-0000-2800
MSR 0000019A: 0000-0000-0000-0000
MSR 0000019B: 0000-0000-0000-0010
MSR 0000019C: 0000-0000-8845-0800 [S200]
MSR 0000019C: 0000-0000-8844-0800 [S200]
MSR 0000019C: 0000-0000-8845-0800
MSR 0000019D: 0000-0000-0000-0000
MSR 000001A0: 0000-0040-0084-0089
MSR 000001A2: 0000-0000-0064-1400
MSR 000001A4: 0000-0000-0000-0000
MSR 000001AA: 0000-0000-0040-1CC0
MSR 000001AC: < FAILED >
MSR 000001AD: 0000-0000-2A2A-2A2A
MSR 000001B0: 0000-0000-0000-0000
MSR 000001B1: 0000-0000-8841-0800
MSR 000001B2: 0000-0000-0000-0000
MSR 000001FC: 0000-0000-003C-005D
MSR 00000300: < FAILED >
MSR 0000030A: 0000-0000-0000-0000 [S200]
MSR 0000030A: 0000-0000-0000-0000 [S200]
MSR 0000030A: 0000-0000-0000-0000
MSR 0000030B: 0000-0000-0000-0000 [S200]
MSR 0000030B: 0000-0000-0000-0000 [S200]
MSR 0000030B: 0000-0000-0000-0000
MSR 00000480: 00DA-0400-0000-0004
MSR 00000481: 0000-007F-0000-0016
MSR 00000482: FFF9-FFFE-0401-E172
MSR 00000483: 01FF-FFFF-0003-6DFF
MSR 00000484: 0003-FFFF-0000-11FF
MSR 00000485: 0000-0000-7004-C1E7
MSR 00000486: 0000-0000-8000-0021
MSR 00000487: 0000-0000-FFFF-FFFF
MSR 00000488: 0000-0000-0000-2000
MSR 00000489: 0000-0000-0037-27FF
MSR 0000048A: 0000-0000-0000-002E
MSR 0000048B: 001F-FCFF-0000-0000
MSR 0000048C: 0000-0F01-0633-4141
MSR 0000048D: 0000-007F-0000-0016
MSR 0000048E: FFF9-FFFE-0400-6172
MSR 0000048F: 01FF-FFFF-0003-6DFB
MSR 00000490: 0003-FFFF-0000-11FB
MSR 00000601: 0000-0000-8000-0000
MSR 00000602: < FAILED >
MSR 00000603: 0036-0000-0036-3636
MSR 00000604: < FAILED >
MSR 00000606: 0000-0000-000A-0E03
MSR 0000060A: 0000-0000-0000-0000
MSR 0000060B: 0000-0000-0000-0000
MSR 0000060C: 0000-0000-0000-0000
MSR 0000060D: 0000-0000-0000-0000
MSR 00000610: 0042-FFFF-001D-FFFF
MSR 00000611: 0000-0000-0173-AED9 [S200]
MSR 00000611: 0000-0000-0174-9625 [S200]
MSR 00000611: 0000-0000-0175-85D1
MSR 00000613: 0000-0000-0000-0002
MSR 00000614: 0000-0000-0000-02F8
MSR 00000618: 0000-0000-0000-0000
MSR 00000619: 0000-0000-0016-942D [S200]
MSR 00000619: 0000-0000-0016-A7C4 [S200]
MSR 00000619: 0000-0000-0016-BB6F
MSR 0000061B: 0000-0000-0000-0000
MSR 0000061C: < FAILED >
MSR 0000061E: < FAILED >
MSR 00000620: 0000-0000-0000-0828
MSR 00000621: 0000-0000-0000-0028
MSR 00000638: 0000-0000-0000-0000
MSR 00000639: 0000-0000-00FE-21E4 [S200]
MSR 00000639: 0000-0000-00FE-BAF5 [S200]
MSR 00000639: 0000-0000-00FF-53B9
MSR 0000063A: 0000-0000-0000-0010
MSR 0000063B: < FAILED >
MSR 00000640: 0000-0000-0000-0000
MSR 00000641: 0000-0000-0000-0000 [S200]
MSR 00000641: 0000-0000-0000-0000 [S200]
MSR 00000641: 0000-0000-0000-0000
MSR 00000642: 0000-0000-0000-0010
MSR 00000648: 0000-0000-0000-0028
MSR 00000649: 0000-0000-0000-0000
MSR 0000064A: 0000-0000-0000-0000
MSR 0000064B: 0000-0000-8000-0000
MSR 0000064C: 0000-0000-0000-0000
MSR 00000690: 0000-0000-0000-0000
MSR 000006B0: 0000-0000-0000-0000
MSR 000006B1: 0000-0000-0000-0000
MSR 00000770: 0000-0000-0000-0000
MSR 00000771: < FAILED >
MSR 00000772: < FAILED >
MSR 00000773: 0000-0000-0000-0000
MSR 00000774: < FAILED >
MSR 00000777: < FAILED >

------[ MSR Registers / Logical CPU #1 ]------

MSR 00000017: 0004-0000-0000-0000 [PlatID = 1]
MSR 0000001B: 0000-0000-FEE0-0800
MSR 00000035: 0000-0000-0004-0008
MSR 00000048: 0000-0000-0000-0000
MSR 00000049: < FAILED >
MSR 0000008B: 0000-00D6-0000-0000
MSR 000000CE: 0008-0838-F101-2800 [eD = 0]
MSR 000000E7: 0000-0005-A2C1-6C94
MSR 000000E8: 0000-0005-A07A-9E60
MSR 0000010B: < FAILED >
MSR 00000194: 0000-0000-000F-0000
MSR 00000198: 0000-272E-0000-2800
MSR 00000199: 0000-0000-0000-2800
MSR 0000019A: 0000-0000-0000-0000
MSR 0000019B: 0000-0000-0000-0010
MSR 0000019C: 0000-0000-883C-0800
MSR 0000019D: 0000-0000-0000-0000
MSR 000001A0: 0000-0040-0084-0089
MSR 000001A2: 0000-0000-0064-1400
MSR 000001A4: 0000-0000-0000-0000
MSR 000001AA: 0000-0000-0040-1CC0
MSR 000001AC: < FAILED >
MSR 000001AD: 0000-0000-2A2A-2A2A
MSR 000001B0: 0000-0000-0000-0000
MSR 000001B1: 0000-0000-883C-0800
MSR 000001B2: 0000-0000-0000-0000
MSR 000001FC: 0000-0000-003C-005D
MSR 00000300: < FAILED >
MSR 0000030A: 0000-0000-0000-0000
MSR 0000030B: 0000-0000-0000-0000
MSR 00000480: 00DA-0400-0000-0004
MSR 00000481: 0000-007F-0000-0016
MSR 00000482: FFF9-FFFE-0401-E172
MSR 00000483: 01FF-FFFF-0003-6DFF
MSR 00000484: 0003-FFFF-0000-11FF
MSR 00000485: 0000-0000-7004-C1E7
MSR 00000486: 0000-0000-8000-0021
MSR 00000487: 0000-0000-FFFF-FFFF
MSR 00000488: 0000-0000-0000-2000
MSR 00000489: 0000-0000-0037-27FF
MSR 0000048A: 0000-0000-0000-002E
MSR 0000048B: 001F-FCFF-0000-0000
MSR 0000048C: 0000-0F01-0633-4141
MSR 0000048D: 0000-007F-0000-0016
MSR 0000048E: FFF9-FFFE-0400-6172
MSR 0000048F: 01FF-FFFF-0003-6DFB
MSR 00000490: 0003-FFFF-0000-11FB
MSR 00000601: 0000-0000-8000-0000
MSR 00000602: < FAILED >
MSR 00000603: 0036-0000-0036-3636
MSR 00000604: < FAILED >
MSR 00000606: 0000-0000-000A-0E03
MSR 0000060A: 0000-0000-0000-0000
MSR 0000060B: 0000-0000-0000-0000
MSR 0000060C: 0000-0000-0000-0000
MSR 0000060D: 0000-0000-0000-0000
MSR 00000610: 0042-FFFF-001D-FFFF
MSR 00000611: 0000-0000-017A-FA98
MSR 00000613: 0000-0000-0000-0002
MSR 00000614: 0000-0000-0000-02F8
MSR 00000618: 0000-0000-0000-0000
MSR 00000619: 0000-0000-0017-09B0
MSR 0000061B: 0000-0000-0000-0000
MSR 0000061C: < FAILED >
MSR 0000061E: < FAILED >
MSR 00000620: 0000-0000-0000-0828
MSR 00000621: 0000-0000-0000-0028
MSR 00000638: 0000-0000-0000-0000
MSR 00000639: 0000-0000-0100-8B28
MSR 0000063A: 0000-0000-0000-0010
MSR 0000063B: < FAILED >
MSR 00000640: 0000-0000-0000-0000
MSR 00000641: 0000-0000-0000-0000
MSR 00000642: 0000-0000-0000-0010
MSR 00000648: 0000-0000-0000-0028
MSR 00000649: 0000-0000-0000-0000
MSR 0000064A: 0000-0000-0000-0000
MSR 0000064B: 0000-0000-8000-0000
MSR 0000064C: 0000-0000-0000-0000
MSR 00000690: 0000-0000-0000-0000
MSR 000006B0: 0000-0000-0000-0000
MSR 000006B1: 0000-0000-0000-0000
MSR 00000770: 0000-0000-0000-0000
MSR 00000771: < FAILED >
MSR 00000772: < FAILED >
MSR 00000773: 0000-0000-0000-0000
MSR 00000774: < FAILED >
MSR 00000777: < FAILED >

------[ MSR Registers / Logical CPU #2 ]------

MSR 00000017: 0004-0000-0000-0000 [PlatID = 1]
MSR 0000001B: 0000-0000-FEE0-0800
MSR 00000035: 0000-0000-0004-0008
MSR 00000048: 0000-0000-0000-0000
MSR 00000049: < FAILED >
MSR 0000008B: 0000-00D6-0000-0000
MSR 000000CE: 0008-0838-F101-2800 [eD = 0]
MSR 000000E7: 0000-000B-3C81-987C
MSR 000000E8: 0000-000B-36CD-7B7E
MSR 0000010B: < FAILED >
MSR 00000194: 0000-0000-000F-0000
MSR 00000198: 0000-272A-0000-2800
MSR 00000199: 0000-0000-0000-2800
MSR 0000019A: 0000-0000-0000-0000
MSR 0000019B: 0000-0000-0000-0010
MSR 0000019C: 0000-0000-8841-0800
MSR 0000019D: 0000-0000-0000-0000
MSR 000001A0: 0000-0040-0084-0089
MSR 000001A2: 0000-0000-0064-1400
MSR 000001A4: 0000-0000-0000-0000
MSR 000001AA: 0000-0000-0040-1CC0
MSR 000001AC: < FAILED >
MSR 000001AD: 0000-0000-2A2A-2A2A
MSR 000001B0: 0000-0000-0000-0000
MSR 000001B1: 0000-0000-883C-0800
MSR 000001B2: 0000-0000-0000-0000
MSR 000001FC: 0000-0000-003C-005D
MSR 00000300: < FAILED >
MSR 0000030A: 0000-0000-0000-0000
MSR 0000030B: 0000-0000-0000-0000
MSR 00000480: 00DA-0400-0000-0004
MSR 00000481: 0000-007F-0000-0016
MSR 00000482: FFF9-FFFE-0401-E172
MSR 00000483: 01FF-FFFF-0003-6DFF
MSR 00000484: 0003-FFFF-0000-11FF
MSR 00000485: 0000-0000-7004-C1E7
MSR 00000486: 0000-0000-8000-0021
MSR 00000487: 0000-0000-FFFF-FFFF
MSR 00000488: 0000-0000-0000-2000
MSR 00000489: 0000-0000-0037-27FF
MSR 0000048A: 0000-0000-0000-002E
MSR 0000048B: 001F-FCFF-0000-0000
MSR 0000048C: 0000-0F01-0633-4141
MSR 0000048D: 0000-007F-0000-0016
MSR 0000048E: FFF9-FFFE-0400-6172
MSR 0000048F: 01FF-FFFF-0003-6DFB
MSR 00000490: 0003-FFFF-0000-11FB
MSR 00000601: 0000-0000-8000-0000
MSR 00000602: < FAILED >
MSR 00000603: 0036-0000-0036-3636
MSR 00000604: < FAILED >
MSR 00000606: 0000-0000-000A-0E03
MSR 0000060A: 0000-0000-0000-0000
MSR 0000060B: 0000-0000-0000-0000
MSR 0000060C: 0000-0000-0000-0000
MSR 0000060D: 0000-0000-0000-0000
MSR 00000610: 0042-FFFF-001D-FFFF
MSR 00000611: 0000-0000-017A-FA98
MSR 00000613: 0000-0000-0000-0002
MSR 00000614: 0000-0000-0000-02F8
MSR 00000618: 0000-0000-0000-0000
MSR 00000619: 0000-0000-0017-09B0
MSR 0000061B: 0000-0000-0000-0000
MSR 0000061C: < FAILED >
MSR 0000061E: < FAILED >
MSR 00000620: 0000-0000-0000-0828
MSR 00000621: 0000-0000-0000-0028
MSR 00000638: 0000-0000-0000-0000
MSR 00000639: 0000-0000-0100-8C6D
MSR 0000063A: 0000-0000-0000-0010
MSR 0000063B: < FAILED >
MSR 00000640: 0000-0000-0000-0000
MSR 00000641: 0000-0000-0000-0000
MSR 00000642: 0000-0000-0000-0010
MSR 00000648: 0000-0000-0000-0028
MSR 00000649: 0000-0000-0000-0000
MSR 0000064A: 0000-0000-0000-0000
MSR 0000064B: 0000-0000-8000-0000
MSR 0000064C: 0000-0000-0000-0000
MSR 00000690: 0000-0000-0000-0000
MSR 000006B0: 0000-0000-0000-0000
MSR 000006B1: 0000-0000-0000-0000
MSR 00000770: 0000-0000-0000-0000
MSR 00000771: < FAILED >
MSR 00000772: < FAILED >
MSR 00000773: 0000-0000-0000-0000
MSR 00000774: < FAILED >
MSR 00000777: < FAILED >

------[ MSR Registers / Logical CPU #3 ]------

MSR 00000017: 0004-0000-0000-0000 [PlatID = 1]
MSR 0000001B: 0000-0000-FEE0-0800
MSR 00000035: 0000-0000-0004-0008
MSR 00000048: 0000-0000-0000-0000
MSR 00000049: < FAILED >
MSR 0000008B: 0000-00D6-0000-0000
MSR 000000CE: 0008-0838-F101-2800 [eD = 0]
MSR 000000E7: 0000-0006-4AC8-CFE4
MSR 000000E8: 0000-0006-4749-410F
MSR 0000010B: < FAILED >
MSR 00000194: 0000-0000-000F-0000
MSR 00000198: 0000-2708-0000-2800
MSR 00000199: 0000-0000-0000-2800
MSR 0000019A: 0000-0000-0000-0000
MSR 0000019B: 0000-0000-0000-0010
MSR 0000019C: 0000-0000-8841-0800
MSR 0000019D: 0000-0000-0000-0000
MSR 000001A0: 0000-0040-0084-0089
MSR 000001A2: 0000-0000-0064-1400
MSR 000001A4: 0000-0000-0000-0000
MSR 000001AA: 0000-0000-0040-1CC0
MSR 000001AC: < FAILED >
MSR 000001AD: 0000-0000-2A2A-2A2A
MSR 000001B0: 0000-0000-0000-0000
MSR 000001B1: 0000-0000-883E-0800
MSR 000001B2: 0000-0000-0000-0000
MSR 000001FC: 0000-0000-003C-005D
MSR 00000300: < FAILED >
MSR 0000030A: 0000-0000-0000-0000
MSR 0000030B: 0000-0000-0000-0000
MSR 00000480: 00DA-0400-0000-0004
MSR 00000481: 0000-007F-0000-0016
MSR 00000482: FFF9-FFFE-0401-E172
MSR 00000483: 01FF-FFFF-0003-6DFF
MSR 00000484: 0003-FFFF-0000-11FF
MSR 00000485: 0000-0000-7004-C1E7
MSR 00000486: 0000-0000-8000-0021
MSR 00000487: 0000-0000-FFFF-FFFF
MSR 00000488: 0000-0000-0000-2000
MSR 00000489: 0000-0000-0037-27FF
MSR 0000048A: 0000-0000-0000-002E
MSR 0000048B: 001F-FCFF-0000-0000
MSR 0000048C: 0000-0F01-0633-4141
MSR 0000048D: 0000-007F-0000-0016
MSR 0000048E: FFF9-FFFE-0400-6172
MSR 0000048F: 01FF-FFFF-0003-6DFB
MSR 00000490: 0003-FFFF-0000-11FB
MSR 00000601: 0000-0000-8000-0000
MSR 00000602: < FAILED >
MSR 00000603: 0036-0000-0036-3636
MSR 00000604: < FAILED >
MSR 00000606: 0000-0000-000A-0E03
MSR 0000060A: 0000-0000-0000-0000
MSR 0000060B: 0000-0000-0000-0000
MSR 0000060C: 0000-0000-0000-0000
MSR 0000060D: 0000-0000-0000-0000
MSR 00000610: 0042-FFFF-001D-FFFF
MSR 00000611: 0000-0000-017A-FCD7
MSR 00000613: 0000-0000-0000-0002
MSR 00000614: 0000-0000-0000-02F8
MSR 00000618: 0000-0000-0000-0000
MSR 00000619: 0000-0000-0017-09DA
MSR 0000061B: 0000-0000-0000-0000
MSR 0000061C: < FAILED >
MSR 0000061E: < FAILED >
MSR 00000620: 0000-0000-0000-0828
MSR 00000621: 0000-0000-0000-0028
MSR 00000638: 0000-0000-0000-0000
MSR 00000639: 0000-0000-0100-8D46
MSR 0000063A: 0000-0000-0000-0010
MSR 0000063B: < FAILED >
MSR 00000640: 0000-0000-0000-0000
MSR 00000641: 0000-0000-0000-0000
MSR 00000642: 0000-0000-0000-0010
MSR 00000648: 0000-0000-0000-0028
MSR 00000649: 0000-0000-0000-0000
MSR 0000064A: 0000-0000-0000-0000
MSR 0000064B: 0000-0000-8000-0000
MSR 0000064C: 0000-0000-0000-0000
MSR 00000690: 0000-0000-0000-0000
MSR 000006B0: 0000-0000-0000-0000
MSR 000006B1: 0000-0000-0000-0000
MSR 00000770: 0000-0000-0000-0000
MSR 00000771: < FAILED >
MSR 00000772: < FAILED >
MSR 00000773: 0000-0000-0000-0000
MSR 00000774: < FAILED >
MSR 00000777: < FAILED >

------[ MSR Registers / Logical CPU #4 ]------

MSR 00000017: 0004-0000-0000-0000 [PlatID = 1]
MSR 0000001B: 0000-0000-FEE0-0800
MSR 00000035: 0000-0000-0004-0008
MSR 00000048: 0000-0000-0000-0000
MSR 00000049: < FAILED >
MSR 0000008B: 0000-00D6-0000-0000
MSR 000000CE: 0008-0838-F101-2800 [eD = 0]
MSR 000000E7: 0000-0007-B145-8EA8
MSR 000000E8: 0000-0007-AC4D-874E
MSR 0000010B: < FAILED >
MSR 00000194: 0000-0000-000F-0000
MSR 00000198: 0000-2704-0000-2800
MSR 00000199: 0000-0000-0000-2800
MSR 0000019A: 0000-0000-0000-0000
MSR 0000019B: 0000-0000-0000-0010
MSR 0000019C: 0000-0000-8845-0800
MSR 0000019D: 0000-0000-0000-0000
MSR 000001A0: 0000-0040-0084-0089
MSR 000001A2: 0000-0000-0064-1400
MSR 000001A4: 0000-0000-0000-0000
MSR 000001AA: 0000-0000-0040-1CC0
MSR 000001AC: < FAILED >
MSR 000001AD: 0000-0000-2A2A-2A2A
MSR 000001B0: 0000-0000-0000-0000
MSR 000001B1: 0000-0000-883E-0800
MSR 000001B2: 0000-0000-0000-0000
MSR 000001FC: 0000-0000-003C-005D
MSR 00000300: < FAILED >
MSR 0000030A: 0000-0000-0000-0000
MSR 0000030B: 0000-0000-0000-0000
MSR 00000480: 00DA-0400-0000-0004
MSR 00000481: 0000-007F-0000-0016
MSR 00000482: FFF9-FFFE-0401-E172
MSR 00000483: 01FF-FFFF-0003-6DFF
MSR 00000484: 0003-FFFF-0000-11FF
MSR 00000485: 0000-0000-7004-C1E7
MSR 00000486: 0000-0000-8000-0021
MSR 00000487: 0000-0000-FFFF-FFFF
MSR 00000488: 0000-0000-0000-2000
MSR 00000489: 0000-0000-0037-27FF
MSR 0000048A: 0000-0000-0000-002E
MSR 0000048B: 001F-FCFF-0000-0000
MSR 0000048C: 0000-0F01-0633-4141
MSR 0000048D: 0000-007F-0000-0016
MSR 0000048E: FFF9-FFFE-0400-6172
MSR 0000048F: 01FF-FFFF-0003-6DFB
MSR 00000490: 0003-FFFF-0000-11FB
MSR 00000601: 0000-0000-8000-0000
MSR 00000602: < FAILED >
MSR 00000603: 0036-0000-0036-3636
MSR 00000604: < FAILED >
MSR 00000606: 0000-0000-000A-0E03
MSR 0000060A: 0000-0000-0000-0000
MSR 0000060B: 0000-0000-0000-0000
MSR 0000060C: 0000-0000-0000-0000
MSR 0000060D: 0000-0000-0000-0000
MSR 00000610: 0042-FFFF-001D-FFFF
MSR 00000611: 0000-0000-017A-FE87
MSR 00000613: 0000-0000-0000-0002
MSR 00000614: 0000-0000-0000-02F8
MSR 00000618: 0000-0000-0000-0000
MSR 00000619: 0000-0000-0017-09F3
MSR 0000061B: 0000-0000-0000-0000
MSR 0000061C: < FAILED >
MSR 0000061E: < FAILED >
MSR 00000620: 0000-0000-0000-0828
MSR 00000621: 0000-0000-0000-0028
MSR 00000638: 0000-0000-0000-0000
MSR 00000639: 0000-0000-0100-8E1C
MSR 0000063A: 0000-0000-0000-0010
MSR 0000063B: < FAILED >
MSR 00000640: 0000-0000-0000-0000
MSR 00000641: 0000-0000-0000-0000
MSR 00000642: 0000-0000-0000-0010
MSR 00000648: 0000-0000-0000-0028
MSR 00000649: 0000-0000-0000-0000
MSR 0000064A: 0000-0000-0000-0000
MSR 0000064B: 0000-0000-8000-0000
MSR 0000064C: 0000-0000-0000-0000
MSR 00000690: 0000-0000-0000-0000
MSR 000006B0: 0000-0000-0000-0000
MSR 000006B1: 0000-0000-0000-0000
MSR 00000770: 0000-0000-0000-0000
MSR 00000771: < FAILED >
MSR 00000772: < FAILED >
MSR 00000773: 0000-0000-0000-0000
MSR 00000774: < FAILED >
MSR 00000777: < FAILED >

------[ MSR Registers / Logical CPU #5 ]------

MSR 00000017: 0004-0000-0000-0000 [PlatID = 1]
MSR 0000001B: 0000-0000-FEE0-0800
MSR 00000035: 0000-0000-0004-0008
MSR 00000048: 0000-0000-0000-0000
MSR 00000049: < FAILED >
MSR 0000008B: 0000-00D6-0000-0000
MSR 000000CE: 0008-0838-F101-2800 [eD = 0]
MSR 000000E7: 0000-0006-31F8-08DC
MSR 000000E8: 0000-0006-2DBE-7C4F
MSR 0000010B: < FAILED >
MSR 00000194: 0000-0000-000F-0000
MSR 00000198: 0000-2705-0000-2800
MSR 00000199: 0000-0000-0000-2800
MSR 0000019A: 0000-0000-0000-0000
MSR 0000019B: 0000-0000-0000-0010
MSR 0000019C: 0000-0000-8844-0800
MSR 0000019D: 0000-0000-0000-0000
MSR 000001A0: 0000-0040-0084-0089
MSR 000001A2: 0000-0000-0064-1400
MSR 000001A4: 0000-0000-0000-0000
MSR 000001AA: 0000-0000-0040-1CC0
MSR 000001AC: < FAILED >
MSR 000001AD: 0000-0000-2A2A-2A2A
MSR 000001B0: 0000-0000-0000-0000
MSR 000001B1: 0000-0000-883F-0800
MSR 000001B2: 0000-0000-0000-0000
MSR 000001FC: 0000-0000-003C-005D
MSR 00000300: < FAILED >
MSR 0000030A: 0000-0000-0000-0000
MSR 0000030B: 0000-0000-0000-0000
MSR 00000480: 00DA-0400-0000-0004
MSR 00000481: 0000-007F-0000-0016
MSR 00000482: FFF9-FFFE-0401-E172
MSR 00000483: 01FF-FFFF-0003-6DFF
MSR 00000484: 0003-FFFF-0000-11FF
MSR 00000485: 0000-0000-7004-C1E7
MSR 00000486: 0000-0000-8000-0021
MSR 00000487: 0000-0000-FFFF-FFFF
MSR 00000488: 0000-0000-0000-2000
MSR 00000489: 0000-0000-0037-27FF
MSR 0000048A: 0000-0000-0000-002E
MSR 0000048B: 001F-FCFF-0000-0000
MSR 0000048C: 0000-0F01-0633-4141
MSR 0000048D: 0000-007F-0000-0016
MSR 0000048E: FFF9-FFFE-0400-6172
MSR 0000048F: 01FF-FFFF-0003-6DFB
MSR 00000490: 0003-FFFF-0000-11FB
MSR 00000601: 0000-0000-8000-0000
MSR 00000602: < FAILED >
MSR 00000603: 0036-0000-0036-3636
MSR 00000604: < FAILED >
MSR 00000606: 0000-0000-000A-0E03
MSR 0000060A: 0000-0000-0000-0000
MSR 0000060B: 0000-0000-0000-0000
MSR 0000060C: 0000-0000-0000-0000
MSR 0000060D: 0000-0000-0000-0000
MSR 00000610: 0042-FFFF-001D-FFFF
MSR 00000611: 0000-0000-017A-FE87
MSR 00000613: 0000-0000-0000-0002
MSR 00000614: 0000-0000-0000-02F8
MSR 00000618: 0000-0000-0000-0000
MSR 00000619: 0000-0000-0017-09F3
MSR 0000061B: 0000-0000-0000-0000
MSR 0000061C: < FAILED >
MSR 0000061E: < FAILED >
MSR 00000620: 0000-0000-0000-0828
MSR 00000621: 0000-0000-0000-0028
MSR 00000638: 0000-0000-0000-0000
MSR 00000639: 0000-0000-0100-8EE9
MSR 0000063A: 0000-0000-0000-0010
MSR 0000063B: < FAILED >
MSR 00000640: 0000-0000-0000-0000
MSR 00000641: 0000-0000-0000-0000
MSR 00000642: 0000-0000-0000-0010
MSR 00000648: 0000-0000-0000-0028
MSR 00000649: 0000-0000-0000-0000
MSR 0000064A: 0000-0000-0000-0000
MSR 0000064B: 0000-0000-8000-0000
MSR 0000064C: 0000-0000-0000-0000
MSR 00000690: 0000-0000-0000-0000
MSR 000006B0: 0000-0000-0000-0000
MSR 000006B1: 0000-0000-0000-0000
MSR 00000770: 0000-0000-0000-0000
MSR 00000771: < FAILED >
MSR 00000772: < FAILED >
MSR 00000773: 0000-0000-0000-0000
MSR 00000774: < FAILED >
MSR 00000777: < FAILED >

------[ MSR Registers / Logical CPU #6 ]------

MSR 00000017: 0004-0000-0000-0000 [PlatID = 1]
MSR 0000001B: 0000-0000-FEE0-0800
MSR 00000035: 0000-0000-0004-0008
MSR 00000048: 0000-0000-0000-0000
MSR 00000049: < FAILED >
MSR 0000008B: 0000-00D6-0000-0000
MSR 000000CE: 0008-0838-F101-2800 [eD = 0]
MSR 000000E7: 0000-0006-C09E-B804
MSR 000000E8: 0000-0006-BBA5-A389
MSR 0000010B: < FAILED >
MSR 00000194: 0000-0000-000F-0000
MSR 00000198: 0000-2704-0000-2800
MSR 00000199: 0000-0000-0000-2800
MSR 0000019A: 0000-0000-0000-0000
MSR 0000019B: 0000-0000-0000-0010
MSR 0000019C: 0000-0000-8845-0800
MSR 0000019D: 0000-0000-0000-0000
MSR 000001A0: 0000-0040-0084-0089
MSR 000001A2: 0000-0000-0064-1400
MSR 000001A4: 0000-0000-0000-0000
MSR 000001AA: 0000-0000-0040-1CC0
MSR 000001AC: < FAILED >
MSR 000001AD: 0000-0000-2A2A-2A2A
MSR 000001B0: 0000-0000-0000-0000
MSR 000001B1: 0000-0000-883F-0800
MSR 000001B2: 0000-0000-0000-0000
MSR 000001FC: 0000-0000-003C-005D
MSR 00000300: < FAILED >
MSR 0000030A: 0000-0000-0000-0000
MSR 0000030B: 0000-0000-0000-0000
MSR 00000480: 00DA-0400-0000-0004
MSR 00000481: 0000-007F-0000-0016
MSR 00000482: FFF9-FFFE-0401-E172
MSR 00000483: 01FF-FFFF-0003-6DFF
MSR 00000484: 0003-FFFF-0000-11FF
MSR 00000485: 0000-0000-7004-C1E7
MSR 00000486: 0000-0000-8000-0021
MSR 00000487: 0000-0000-FFFF-FFFF
MSR 00000488: 0000-0000-0000-2000
MSR 00000489: 0000-0000-0037-27FF
MSR 0000048A: 0000-0000-0000-002E
MSR 0000048B: 001F-FCFF-0000-0000
MSR 0000048C: 0000-0F01-0633-4141
MSR 0000048D: 0000-007F-0000-0016
MSR 0000048E: FFF9-FFFE-0400-6172
MSR 0000048F: 01FF-FFFF-0003-6DFB
MSR 00000490: 0003-FFFF-0000-11FB
MSR 00000601: 0000-0000-8000-0000
MSR 00000602: < FAILED >
MSR 00000603: 0036-0000-0036-3636
MSR 00000604: < FAILED >
MSR 00000606: 0000-0000-000A-0E03
MSR 0000060A: 0000-0000-0000-0000
MSR 0000060B: 0000-0000-0000-0000
MSR 0000060C: 0000-0000-0000-0000
MSR 0000060D: 0000-0000-0000-0000
MSR 00000610: 0042-FFFF-001D-FFFF
MSR 00000611: 0000-0000-017B-004B
MSR 00000613: 0000-0000-0000-0002
MSR 00000614: 0000-0000-0000-02F8
MSR 00000618: 0000-0000-0000-0000
MSR 00000619: 0000-0000-0017-0A0E
MSR 0000061B: 0000-0000-0000-0000
MSR 0000061C: < FAILED >
MSR 0000061E: < FAILED >
MSR 00000620: 0000-0000-0000-0828
MSR 00000621: 0000-0000-0000-0028
MSR 00000638: 0000-0000-0000-0000
MSR 00000639: 0000-0000-0100-8FBE
MSR 0000063A: 0000-0000-0000-0010
MSR 0000063B: < FAILED >
MSR 00000640: 0000-0000-0000-0000
MSR 00000641: 0000-0000-0000-0000
MSR 00000642: 0000-0000-0000-0010
MSR 00000648: 0000-0000-0000-0028
MSR 00000649: 0000-0000-0000-0000
MSR 0000064A: 0000-0000-0000-0000
MSR 0000064B: 0000-0000-8000-0000
MSR 0000064C: 0000-0000-0000-0000
MSR 00000690: 0000-0000-0000-0000
MSR 000006B0: 0000-0000-0000-0000
MSR 000006B1: 0000-0000-0000-0000
MSR 00000770: 0000-0000-0000-0000
MSR 00000771: < FAILED >
MSR 00000772: < FAILED >
MSR 00000773: 0000-0000-0000-0000
MSR 00000774: < FAILED >
MSR 00000777: < FAILED >

------[ MSR Registers / Logical CPU #7 ]------

MSR 00000017: 0004-0000-0000-0000 [PlatID = 1]
MSR 0000001B: 0000-0000-FEE0-0800
MSR 00000035: 0000-0000-0004-0008
MSR 00000048: 0000-0000-0000-0000
MSR 00000049: < FAILED >
MSR 0000008B: 0000-00D6-0000-0000
MSR 000000CE: 0008-0838-F101-2800 [eD = 0]
MSR 000000E7: 0000-0006-822D-7048
MSR 000000E8: 0000-0006-7DF3-4D78
MSR 0000010B: < FAILED >
MSR 00000194: 0000-0000-000F-0000
MSR 00000198: 0000-2702-0000-2800
MSR 00000199: 0000-0000-0000-2800
MSR 0000019A: 0000-0000-0000-0000
MSR 0000019B: 0000-0000-0000-0010
MSR 0000019C: 0000-0000-8846-0800
MSR 0000019D: 0000-0000-0000-0000
MSR 000001A0: 0000-0040-0084-0089
MSR 000001A2: 0000-0000-0064-1400
MSR 000001A4: 0000-0000-0000-0000
MSR 000001AA: 0000-0000-0040-1CC0
MSR 000001AC: < FAILED >
MSR 000001AD: 0000-0000-2A2A-2A2A
MSR 000001B0: 0000-0000-0000-0000
MSR 000001B1: 0000-0000-8840-0800
MSR 000001B2: 0000-0000-0000-0000
MSR 000001FC: 0000-0000-003C-005D
MSR 00000300: < FAILED >
MSR 0000030A: 0000-0000-0000-0000
MSR 0000030B: 0000-0000-0000-0000
MSR 00000480: 00DA-0400-0000-0004
MSR 00000481: 0000-007F-0000-0016
MSR 00000482: FFF9-FFFE-0401-E172
MSR 00000483: 01FF-FFFF-0003-6DFF
MSR 00000484: 0003-FFFF-0000-11FF
MSR 00000485: 0000-0000-7004-C1E7
MSR 00000486: 0000-0000-8000-0021
MSR 00000487: 0000-0000-FFFF-FFFF
MSR 00000488: 0000-0000-0000-2000
MSR 00000489: 0000-0000-0037-27FF
MSR 0000048A: 0000-0000-0000-002E
MSR 0000048B: 001F-FCFF-0000-0000
MSR 0000048C: 0000-0F01-0633-4141
MSR 0000048D: 0000-007F-0000-0016
MSR 0000048E: FFF9-FFFE-0400-6172
MSR 0000048F: 01FF-FFFF-0003-6DFB
MSR 00000490: 0003-FFFF-0000-11FB
MSR 00000601: 0000-0000-8000-0000
MSR 00000602: < FAILED >
MSR 00000603: 0036-0000-0036-3636
MSR 00000604: < FAILED >
MSR 00000606: 0000-0000-000A-0E03
MSR 0000060A: 0000-0000-0000-0000
MSR 0000060B: 0000-0000-0000-0000
MSR 0000060C: 0000-0000-0000-0000
MSR 0000060D: 0000-0000-0000-0000
MSR 00000610: 0042-FFFF-001D-FFFF
MSR 00000611: 0000-0000-017B-01FD
MSR 00000613: 0000-0000-0000-0002
MSR 00000614: 0000-0000-0000-02F8
MSR 00000618: 0000-0000-0000-0000
MSR 00000619: 0000-0000-0017-0A27
MSR 0000061B: 0000-0000-0000-0000
MSR 0000061C: < FAILED >
MSR 0000061E: < FAILED >
MSR 00000620: 0000-0000-0000-0828
MSR 00000621: 0000-0000-0000-0028
MSR 00000638: 0000-0000-0000-0000
MSR 00000639: 0000-0000-0100-9092
MSR 0000063A: 0000-0000-0000-0010
MSR 0000063B: < FAILED >
MSR 00000640: 0000-0000-0000-0000
MSR 00000641: 0000-0000-0000-0000
MSR 00000642: 0000-0000-0000-0010
MSR 00000648: 0000-0000-0000-0028
MSR 00000649: 0000-0000-0000-0000
MSR 0000064A: 0000-0000-0000-0000
MSR 0000064B: 0000-0000-8000-0000
MSR 0000064C: 0000-0000-0000-0000
MSR 00000690: 0000-0000-0000-0000
MSR 000006B0: 0000-0000-0000-0000
MSR 000006B1: 0000-0000-0000-0000
MSR 00000770: 0000-0000-0000-0000
MSR 00000771: < FAILED >
MSR 00000772: < FAILED >
MSR 00000773: 0000-0000-0000-0000
MSR 00000774: < FAILED >
MSR 00000777: < FAILED >

PerformanceFrequency = 10000000

CPU Clock M.Method = 10  (APIC SKL)
PM Timer Address   = 6152  (1808h)

APIC Clock = 100.05 MHz  (AT = 12575 / TT = 15004 / try = 1 / SKL = 24.00 MHz)
APIC Clock = 100.05 MHz  (AT = 12575 / TT = 15004 / try = 1 / SKL = 24.00 MHz)
APIC Clock = 100.05 MHz  (AT = 12575 / TT = 15004 / try = 1 / SKL = 24.00 MHz)
APIC Clock = 100.05 MHz  (AT = 12575 / TT = 15004 / try = 1 / SKL = 24.00 MHz)
APIC Clock = 100.05 MHz  (AT = 12575 / TT = 15004 / try = 1 / SKL = 24.00 MHz)

CPU Clock = 4001.96 MHz / TSC Clock = 4008.07 MHz / CPU Mul = 40.00x
CPU Clock = 4001.96 MHz / TSC Clock = 4008.07 MHz / CPU Mul = 40.00x
CPU Clock = 4001.96 MHz / TSC Clock = 4008.07 MHz / CPU Mul = 40.00x
CPU Clock = 4001.96 MHz / TSC Clock = 4008.07 MHz / CPU Mul = 40.00x
CPU Clock = 4001.96 MHz / TSC Clock = 4008.07 MHz / CPU Mul = 40.00x

CPU Clock Max = 4001.96 MHz / TSC Clock = 4008.07 MHz / CPU Mul = 40.00x
CPU Clock Max = 4001.96 MHz / TSC Clock = 4008.07 MHz / CPU Mul = 40.00x
CPU Clock Max = 4001.96 MHz / TSC Clock = 4008.07 MHz / CPU Mul = 40.00x
CPU Clock Max = 4001.96 MHz / TSC Clock = 4008.07 MHz / CPU Mul = 40.00x
CPU Clock Max = 4001.96 MHz / TSC Clock = 4008.07 MHz / CPU Mul = 40.00x

INTPERFCTR2 = 3999.97 MHz / INTPERFCTR1 (TSC) = 4008.07 MHz
INTPERFCTR2 = 3999.96 MHz / INTPERFCTR1 (TSC) = 4008.05 MHz
INTPERFCTR2 = 3999.85 MHz / INTPERFCTR1 (TSC) = 4007.94 MHz
INTPERFCTR2 = 3999.89 MHz / INTPERFCTR1 (TSC) = 4007.99 MHz
INTPERFCTR2 = 3999.94 MHz / INTPERFCTR1 (TSC) = 4008.03 MHz

------[ OC MailBox ]------

C 01 / P1 00 / P2 00: 00000753
C 01 / P1 01 / P2 00: 0000073C
C 01 / P1 02 / P2 00: 00000753
C 01 / P1 03 / P2 00: 0000073C
C 01 / P1 04 / P2 00: 00000400
C 02 / P1 00 / P2 00: 53535353
C 02 / P1 00 / P2 01: < FAILED >
C 02 / P1 00 / P2 02: < FAILED >
C 02 / P1 00 / P2 03: < FAILED >
C 02 / P1 01 / P2 00: 00000000
C 02 / P1 01 / P2 01: < FAILED >
C 02 / P1 01 / P2 02: < FAILED >
C 02 / P1 01 / P2 03: < FAILED >
C 02 / P1 02 / P2 00: 00000000
C 02 / P1 02 / P2 01: < FAILED >
C 02 / P1 02 / P2 02: < FAILED >
C 02 / P1 02 / P2 03: < FAILED >
C 02 / P1 03 / P2 00: 00000000
C 02 / P1 03 / P2 01: < FAILED >
C 02 / P1 03 / P2 02: < FAILED >
C 02 / P1 03 / P2 03: < FAILED >
C 02 / P1 04 / P2 00: 00000000
C 02 / P1 04 / P2 01: < FAILED >
C 02 / P1 04 / P2 02: < FAILED >
C 02 / P1 04 / P2 03: < FAILED >
C 02 / P1 05 / P2 00: 00000000
C 02 / P1 05 / P2 01: < FAILED >
C 02 / P1 05 / P2 02: < FAILED >
C 02 / P1 05 / P2 03: < FAILED >
C 02 / P1 06 / P2 00: 00000000
C 02 / P1 06 / P2 01: < FAILED >
C 02 / P1 06 / P2 02: < FAILED >
C 02 / P1 06 / P2 03: < FAILED >
C 02 / P1 07 / P2 00: 00000000
C 02 / P1 07 / P2 01: < FAILED >
C 02 / P1 07 / P2 02: < FAILED >
C 02 / P1 07 / P2 03: < FAILED >
C 03 / P1 00 / P2 00: 00000812
C 03 / P1 01 / P2 00: 00000812
C 03 / P1 02 / P2 00: 00000812
C 03 / P1 03 / P2 00: 00000812
C 04 / P1 00 / P2 00: 80108012
C 05 / P1 00 / P2 00: 00018688
C 10 / P1 00 / P2 00: 00000000
C 10 / P1 01 / P2 00: 00000017
C 10 / P1 02 / P2 00: 00000000
C 10 / P1 03 / P2 00: 00000017
C 10 / P1 04 / P2 00: 00000000
C 12 / P1 00 / P2 00: 00000000
C 12 / P1 01 / P2 00: 00000000
C 12 / P1 02 / P2 00: 00000000
C 14 / P1 00 / P2 00: 00000000
C 16 / P1 00 / P2 00: 000003FF
C 18 / P1 00 / P2 00: 00000001
C 1A / P1 00 / P2 00: 00000000
C 1C / P1 00 / P2 00: 00000000  [CPU0]
C 1C / P1 00 / P2 00: 00000000  [CPU1]
C 1C / P1 00 / P2 00: 00000000  [CPU2]
C 1C / P1 00 / P2 00: 00000000  [CPU3]
C 1C / P1 00 / P2 00: 00000000  [CPU4]
C 1C / P1 00 / P2 00: 00000000  [CPU5]
C 1C / P1 00 / P2 00: 00000000  [CPU6]
C 1C / P1 00 / P2 00: 00000000  [CPU7]
