------[ CPUID Registers / Logical CPU #0 ]------

allcpu: Package 0 / Core 0 / Thread 0: Valid, Intel Atom

CPUID 00000000: 00000020-756E6547-6C65746E-49656E69 [GenuineIntel]
CPUID 00000001: 000B06E0-00800800-7FFAFBFF-BFEBFBFF
CPUID 00000002: 00FEFF01-000000F0-00000000-00000000
CPUID 00000003: 00000000-00000000-00000000-00000000
CPUID 00000004: FC004121-01C0003F-0000003F-00000000 [SL 00] [L1D: 32 KB]
CPUID 00000004: FC004122-01C0003F-0000007F-00000000 [SL 01] [L1I: 64 KB]
CPUID 00000004: FC01C143-03C0003F-000007FF-00000000 [SL 02] [L2U: 2 MB]
CPUID 00000004: FC1FC163-02C0003F-00001FFF-00000004 [SL 03] [L3U: 6 MB]
CPUID 00000005: 00000040-00000040-00000003-10102020
CPUID 00000006: 00578FF7-00000002-00000009-00000000
CPUID 00000007: 00000002-239CA7EB-98C007AC-FC184410 [SL 00]
CPUID 00000007: 00000810-00000000-00000000-00040000 [SL 01]
CPUID 00000007: 00000000-00000000-00000000-00000037 [SL 02]
CPUID 00000008: 00000000-00000000-00000000-00000000
CPUID 00000009: 00000000-00000000-00000000-00000000
CPUID 0000000A: 07300605-00000000-00000007-00008603
CPUID 0000000B: 00000001-00000001-00000100-00000000 [SL 00]
CPUID 0000000B: 00000007-00000008-00000201-00000000 [SL 01]
CPUID 0000000C: 00000000-00000000-00000000-00000000
CPUID 0000000D: 00000207-00000340-00000A88-00000000 [SL 00] [x87]
CPUID 0000000D: 0000000F-000003D0-00019900-00000000 [SL 01] [SSE]
CPUID 0000000D: 00000100-00000240-00000000-00000000 [SL 02] [AVX]
CPUID 0000000D: 00000080-00000000-00000001-00000000 [SL 08] [PT]
CPUID 0000000D: 00000008-00000A80-00000000-00000000 [SL 09] [PKRU]
CPUID 0000000D: 00000010-00000000-00000001-00000000 [SL 0B] [CET_U]
CPUID 0000000D: 00000018-00000000-00000001-00000000 [SL 0C] [CET_S]
CPUID 0000000D: 00000328-00000000-00000001-00000000 [SL 0F] [LBR]
CPUID 0000000D: 00000008-00000000-00000001-00000000 [SL 10] [HWP]
CPUID 0000000E: 00000000-00000000-00000000-00000000
CPUID 0000000F: 00000000-00000000-00000000-00000000 [SL 00]
CPUID 0000000F: 00000000-00000000-00000000-00000000 [SL 01]
CPUID 00000010: 00000000-00000004-00000000-00000000 [SL 00]
CPUID 00000010: 00000000-00000000-00000000-00000000 [SL 01]
CPUID 00000011: 00000000-00000000-00000000-00000000
CPUID 00000012: 00000000-00000000-00000000-00000000 [SL 00]
CPUID 00000012: 00000000-00000000-00000000-00000000 [SL 01]
CPUID 00000013: 00000000-00000000-00000000-00000000
CPUID 00000014: 00000001-000001FF-80000007-00000000 [SL 00]
CPUID 00000014: 02490002-003FFFFF-00000000-00000000 [SL 01]
CPUID 00000015: 00000002-00000062-0249F000-00000000 [49.00x / 38400000 / 1881.60]
CPUID 00000016: 0000076C-00000F3C-00000064-00000000 [1900 / 3900 / 100]
CPUID 00000017: 00000000-00000000-00000000-00000000 [SL 00]
CPUID 00000018: 00000004-00000000-00000000-00000000 [SL 00]
CPUID 00000018: 00000000-00300001-00000001-00000121 [SL 01]
CPUID 00000018: 00000000-00040003-00000200-00000043 [SL 02]
CPUID 00000018: 00000000-00400001-00000001-00000122 [SL 03]
CPUID 00000018: 00000000-00080008-00000001-00000143 [SL 04]
CPUID 00000019: 00000007-00000014-00000003-00000000
CPUID 0000001A: 20000001-00000000-00000000-00000000 [Atom: Gracemont]
CPUID 0000001C: C000000B-00000007-00000007-00000000
CPUID 0000001D: 00000000-00000000-00000000-00000000 [SL 00]
CPUID 0000001E: 00000000-00000000-00000000-00000000 [SL 00]
CPUID 0000001F: 00000001-00000001-00000100-00000000 [SL 00]
CPUID 0000001F: 00000003-00000004-00000201-00000000 [SL 01]
CPUID 0000001F: 00000007-00000008-00000302-00000000 [SL 02]
CPUID 00000020: 00000000-00000000-00000000-00000000 [SL 00]
CPUID 80000000: 80000008-00000000-00000000-00000000
CPUID 80000001: 00000000-00000000-00000121-2C100000
CPUID 80000002: 65746E49-2952286C-726F4320-4D542865 [Intel(R) Core(TM]
CPUID 80000003: 20332029-3535334E-00000000-00000000 [) 3 N355]
CPUID 80000004: 00000000-00000000-00000000-00000000 []
CPUID 80000005: 00000000-00000000-00000000-00000000 [L1D: 0 KB / L1I: 0 KB]
CPUID 80000006: 00000000-00000000-08008040-00000000 [L2: 2048 KB / L3: 0 KB]
CPUID 80000007: 00000000-00000000-00000000-00000100
CPUID 80000008: 00003027-00000000-00000000-00000000

L1    Data Cache:    32 KB,  8-way Associative, 64-byte Line
L1  Instr. Cache:    64 KB,  8-way Associative, 64-byte Line
L2 Unified Cache:     2 MB, 16-way Associative, 64-byte Line
L3 Unified Cache:     6 MB, 12-way Associative, 64-byte Line

------[ CPUID Registers / Logical CPU #1 ]------

allcpu: Package 0 / Core 1 / Thread 0: Valid, Intel Atom

CPUID 00000000: 00000020-756E6547-6C65746E-49656E69 [GenuineIntel]
CPUID 00000001: 000B06E0-02800800-7FFAFBFF-BFEBFBFF
CPUID 00000002: 00FEFF01-000000F0-00000000-00000000
CPUID 00000003: 00000000-00000000-00000000-00000000
CPUID 00000004: FC004121-01C0003F-0000003F-00000000 [SL 00] [L1D: 32 KB]
CPUID 00000004: FC004122-01C0003F-0000007F-00000000 [SL 01] [L1I: 64 KB]
CPUID 00000004: FC01C143-03C0003F-000007FF-00000000 [SL 02] [L2U: 2 MB]
CPUID 00000004: FC1FC163-02C0003F-00001FFF-00000004 [SL 03] [L3U: 6 MB]
CPUID 00000005: 00000040-00000040-00000003-10102020
CPUID 00000006: 00578FF7-00000002-00000009-00000000
CPUID 00000007: 00000002-239CA7EB-98C007AC-FC184410 [SL 00]
CPUID 00000007: 00000810-00000000-00000000-00040000 [SL 01]
CPUID 00000007: 00000000-00000000-00000000-00000037 [SL 02]
CPUID 00000008: 00000000-00000000-00000000-00000000
CPUID 00000009: 00000000-00000000-00000000-00000000
CPUID 0000000A: 07300605-00000000-00000007-00008603
CPUID 0000000B: 00000001-00000001-00000100-00000002 [SL 00]
CPUID 0000000B: 00000007-00000008-00000201-00000002 [SL 01]
CPUID 0000000C: 00000000-00000000-00000000-00000000
CPUID 0000000D: 00000207-00000340-00000A88-00000000 [SL 00] [x87]
CPUID 0000000D: 0000000F-000003D0-00019900-00000000 [SL 01] [SSE]
CPUID 0000000D: 00000100-00000240-00000000-00000000 [SL 02] [AVX]
CPUID 0000000D: 00000080-00000000-00000001-00000000 [SL 08] [PT]
CPUID 0000000D: 00000008-00000A80-00000000-00000000 [SL 09] [PKRU]
CPUID 0000000D: 00000010-00000000-00000001-00000000 [SL 0B] [CET_U]
CPUID 0000000D: 00000018-00000000-00000001-00000000 [SL 0C] [CET_S]
CPUID 0000000D: 00000328-00000000-00000001-00000000 [SL 0F] [LBR]
CPUID 0000000D: 00000008-00000000-00000001-00000000 [SL 10] [HWP]
CPUID 0000000E: 00000000-00000000-00000000-00000000
CPUID 0000000F: 00000000-00000000-00000000-00000000 [SL 00]
CPUID 0000000F: 00000000-00000000-00000000-00000000 [SL 01]
CPUID 00000010: 00000000-00000004-00000000-00000000 [SL 00]
CPUID 00000010: 00000000-00000000-00000000-00000000 [SL 01]
CPUID 00000011: 00000000-00000000-00000000-00000000
CPUID 00000012: 00000000-00000000-00000000-00000000 [SL 00]
CPUID 00000012: 00000000-00000000-00000000-00000000 [SL 01]
CPUID 00000013: 00000000-00000000-00000000-00000000
CPUID 00000014: 00000001-000001FF-80000007-00000000 [SL 00]
CPUID 00000014: 02490002-003FFFFF-00000000-00000000 [SL 01]
CPUID 00000015: 00000002-00000062-0249F000-00000000 [49.00x / 38400000 / 1881.60]
CPUID 00000016: 0000076C-00000F3C-00000064-00000000 [1900 / 3900 / 100]
CPUID 00000017: 00000000-00000000-00000000-00000000 [SL 00]
CPUID 00000018: 00000004-00000000-00000000-00000000 [SL 00]
CPUID 00000018: 00000000-00300001-00000001-00000121 [SL 01]
CPUID 00000018: 00000000-00040003-00000200-00000043 [SL 02]
CPUID 00000018: 00000000-00400001-00000001-00000122 [SL 03]
CPUID 00000018: 00000000-00080008-00000001-00000143 [SL 04]
CPUID 00000019: 00000007-00000014-00000003-00000000
CPUID 0000001A: 20000001-00000000-00000000-00000000 [Atom: Gracemont]
CPUID 0000001C: C000000B-00000007-00000007-00000000
CPUID 0000001D: 00000000-00000000-00000000-00000000 [SL 00]
CPUID 0000001E: 00000000-00000000-00000000-00000000 [SL 00]
CPUID 0000001F: 00000001-00000001-00000100-00000002 [SL 00]
CPUID 0000001F: 00000003-00000004-00000201-00000002 [SL 01]
CPUID 0000001F: 00000007-00000008-00000302-00000002 [SL 02]
CPUID 00000020: 00000000-00000000-00000000-00000000 [SL 00]
CPUID 80000000: 80000008-00000000-00000000-00000000
CPUID 80000001: 00000000-00000000-00000121-2C100000
CPUID 80000002: 65746E49-2952286C-726F4320-4D542865 [Intel(R) Core(TM]
CPUID 80000003: 20332029-3535334E-00000000-00000000 [) 3 N355]
CPUID 80000004: 00000000-00000000-00000000-00000000 []
CPUID 80000005: 00000000-00000000-00000000-00000000 [L1D: 0 KB / L1I: 0 KB]
CPUID 80000006: 00000000-00000000-08008040-00000000 [L2: 2048 KB / L3: 0 KB]
CPUID 80000007: 00000000-00000000-00000000-00000100
CPUID 80000008: 00003027-00000000-00000000-00000000

L1    Data Cache:    32 KB,  8-way Associative, 64-byte Line
L1  Instr. Cache:    64 KB,  8-way Associative, 64-byte Line
L2 Unified Cache:     2 MB, 16-way Associative, 64-byte Line
L3 Unified Cache:     6 MB, 12-way Associative, 64-byte Line

------[ CPUID Registers / Logical CPU #2 ]------

allcpu: Package 0 / Core 2 / Thread 0: Valid, Intel Atom

CPUID 00000000: 00000020-756E6547-6C65746E-49656E69 [GenuineIntel]
CPUID 00000001: 000B06E0-04800800-7FFAFBFF-BFEBFBFF
CPUID 00000002: 00FEFF01-000000F0-00000000-00000000
CPUID 00000003: 00000000-00000000-00000000-00000000
CPUID 00000004: FC004121-01C0003F-0000003F-00000000 [SL 00] [L1D: 32 KB]
CPUID 00000004: FC004122-01C0003F-0000007F-00000000 [SL 01] [L1I: 64 KB]
CPUID 00000004: FC01C143-03C0003F-000007FF-00000000 [SL 02] [L2U: 2 MB]
CPUID 00000004: FC1FC163-02C0003F-00001FFF-00000004 [SL 03] [L3U: 6 MB]
CPUID 00000005: 00000040-00000040-00000003-10102020
CPUID 00000006: 00578FF7-00000002-00000009-00000000
CPUID 00000007: 00000002-239CA7EB-98C007AC-FC184410 [SL 00]
CPUID 00000007: 00000810-00000000-00000000-00040000 [SL 01]
CPUID 00000007: 00000000-00000000-00000000-00000037 [SL 02]
CPUID 00000008: 00000000-00000000-00000000-00000000
CPUID 00000009: 00000000-00000000-00000000-00000000
CPUID 0000000A: 07300605-00000000-00000007-00008603
CPUID 0000000B: 00000001-00000001-00000100-00000004 [SL 00]
CPUID 0000000B: 00000007-00000008-00000201-00000004 [SL 01]
CPUID 0000000C: 00000000-00000000-00000000-00000000
CPUID 0000000D: 00000207-00000340-00000A88-00000000 [SL 00] [x87]
CPUID 0000000D: 0000000F-000003D0-00019900-00000000 [SL 01] [SSE]
CPUID 0000000D: 00000100-00000240-00000000-00000000 [SL 02] [AVX]
CPUID 0000000D: 00000080-00000000-00000001-00000000 [SL 08] [PT]
CPUID 0000000D: 00000008-00000A80-00000000-00000000 [SL 09] [PKRU]
CPUID 0000000D: 00000010-00000000-00000001-00000000 [SL 0B] [CET_U]
CPUID 0000000D: 00000018-00000000-00000001-00000000 [SL 0C] [CET_S]
CPUID 0000000D: 00000328-00000000-00000001-00000000 [SL 0F] [LBR]
CPUID 0000000D: 00000008-00000000-00000001-00000000 [SL 10] [HWP]
CPUID 0000000E: 00000000-00000000-00000000-00000000
CPUID 0000000F: 00000000-00000000-00000000-00000000 [SL 00]
CPUID 0000000F: 00000000-00000000-00000000-00000000 [SL 01]
CPUID 00000010: 00000000-00000004-00000000-00000000 [SL 00]
CPUID 00000010: 00000000-00000000-00000000-00000000 [SL 01]
CPUID 00000011: 00000000-00000000-00000000-00000000
CPUID 00000012: 00000000-00000000-00000000-00000000 [SL 00]
CPUID 00000012: 00000000-00000000-00000000-00000000 [SL 01]
CPUID 00000013: 00000000-00000000-00000000-00000000
CPUID 00000014: 00000001-000001FF-80000007-00000000 [SL 00]
CPUID 00000014: 02490002-003FFFFF-00000000-00000000 [SL 01]
CPUID 00000015: 00000002-00000062-0249F000-00000000 [49.00x / 38400000 / 1881.60]
CPUID 00000016: 0000076C-00000F3C-00000064-00000000 [1900 / 3900 / 100]
CPUID 00000017: 00000000-00000000-00000000-00000000 [SL 00]
CPUID 00000018: 00000004-00000000-00000000-00000000 [SL 00]
CPUID 00000018: 00000000-00300001-00000001-00000121 [SL 01]
CPUID 00000018: 00000000-00040003-00000200-00000043 [SL 02]
CPUID 00000018: 00000000-00400001-00000001-00000122 [SL 03]
CPUID 00000018: 00000000-00080008-00000001-00000143 [SL 04]
CPUID 00000019: 00000007-00000014-00000003-00000000
CPUID 0000001A: 20000001-00000000-00000000-00000000 [Atom: Gracemont]
CPUID 0000001C: C000000B-00000007-00000007-00000000
CPUID 0000001D: 00000000-00000000-00000000-00000000 [SL 00]
CPUID 0000001E: 00000000-00000000-00000000-00000000 [SL 00]
CPUID 0000001F: 00000001-00000001-00000100-00000004 [SL 00]
CPUID 0000001F: 00000003-00000004-00000201-00000004 [SL 01]
CPUID 0000001F: 00000007-00000008-00000302-00000004 [SL 02]
CPUID 00000020: 00000000-00000000-00000000-00000000 [SL 00]
CPUID 80000000: 80000008-00000000-00000000-00000000
CPUID 80000001: 00000000-00000000-00000121-2C100000
CPUID 80000002: 65746E49-2952286C-726F4320-4D542865 [Intel(R) Core(TM]
CPUID 80000003: 20332029-3535334E-00000000-00000000 [) 3 N355]
CPUID 80000004: 00000000-00000000-00000000-00000000 []
CPUID 80000005: 00000000-00000000-00000000-00000000 [L1D: 0 KB / L1I: 0 KB]
CPUID 80000006: 00000000-00000000-08008040-00000000 [L2: 2048 KB / L3: 0 KB]
CPUID 80000007: 00000000-00000000-00000000-00000100
CPUID 80000008: 00003027-00000000-00000000-00000000

L1    Data Cache:    32 KB,  8-way Associative, 64-byte Line
L1  Instr. Cache:    64 KB,  8-way Associative, 64-byte Line
L2 Unified Cache:     2 MB, 16-way Associative, 64-byte Line
L3 Unified Cache:     6 MB, 12-way Associative, 64-byte Line

------[ CPUID Registers / Logical CPU #3 ]------

allcpu: Package 0 / Core 3 / Thread 0: Valid, Intel Atom

CPUID 00000000: 00000020-756E6547-6C65746E-49656E69 [GenuineIntel]
CPUID 00000001: 000B06E0-06800800-7FFAFBFF-BFEBFBFF
CPUID 00000002: 00FEFF01-000000F0-00000000-00000000
CPUID 00000003: 00000000-00000000-00000000-00000000
CPUID 00000004: FC004121-01C0003F-0000003F-00000000 [SL 00] [L1D: 32 KB]
CPUID 00000004: FC004122-01C0003F-0000007F-00000000 [SL 01] [L1I: 64 KB]
CPUID 00000004: FC01C143-03C0003F-000007FF-00000000 [SL 02] [L2U: 2 MB]
CPUID 00000004: FC1FC163-02C0003F-00001FFF-00000004 [SL 03] [L3U: 6 MB]
CPUID 00000005: 00000040-00000040-00000003-10102020
CPUID 00000006: 00578FF7-00000002-00000009-00000000
CPUID 00000007: 00000002-239CA7EB-98C007AC-FC184410 [SL 00]
CPUID 00000007: 00000810-00000000-00000000-00040000 [SL 01]
CPUID 00000007: 00000000-00000000-00000000-00000037 [SL 02]
CPUID 00000008: 00000000-00000000-00000000-00000000
CPUID 00000009: 00000000-00000000-00000000-00000000
CPUID 0000000A: 07300605-00000000-00000007-00008603
CPUID 0000000B: 00000001-00000001-00000100-00000006 [SL 00]
CPUID 0000000B: 00000007-00000008-00000201-00000006 [SL 01]
CPUID 0000000C: 00000000-00000000-00000000-00000000
CPUID 0000000D: 00000207-00000340-00000A88-00000000 [SL 00] [x87]
CPUID 0000000D: 0000000F-000003D0-00019900-00000000 [SL 01] [SSE]
CPUID 0000000D: 00000100-00000240-00000000-00000000 [SL 02] [AVX]
CPUID 0000000D: 00000080-00000000-00000001-00000000 [SL 08] [PT]
CPUID 0000000D: 00000008-00000A80-00000000-00000000 [SL 09] [PKRU]
CPUID 0000000D: 00000010-00000000-00000001-00000000 [SL 0B] [CET_U]
CPUID 0000000D: 00000018-00000000-00000001-00000000 [SL 0C] [CET_S]
CPUID 0000000D: 00000328-00000000-00000001-00000000 [SL 0F] [LBR]
CPUID 0000000D: 00000008-00000000-00000001-00000000 [SL 10] [HWP]
CPUID 0000000E: 00000000-00000000-00000000-00000000
CPUID 0000000F: 00000000-00000000-00000000-00000000 [SL 00]
CPUID 0000000F: 00000000-00000000-00000000-00000000 [SL 01]
CPUID 00000010: 00000000-00000004-00000000-00000000 [SL 00]
CPUID 00000010: 00000000-00000000-00000000-00000000 [SL 01]
CPUID 00000011: 00000000-00000000-00000000-00000000
CPUID 00000012: 00000000-00000000-00000000-00000000 [SL 00]
CPUID 00000012: 00000000-00000000-00000000-00000000 [SL 01]
CPUID 00000013: 00000000-00000000-00000000-00000000
CPUID 00000014: 00000001-000001FF-80000007-00000000 [SL 00]
CPUID 00000014: 02490002-003FFFFF-00000000-00000000 [SL 01]
CPUID 00000015: 00000002-00000062-0249F000-00000000 [49.00x / 38400000 / 1881.60]
CPUID 00000016: 0000076C-00000F3C-00000064-00000000 [1900 / 3900 / 100]
CPUID 00000017: 00000000-00000000-00000000-00000000 [SL 00]
CPUID 00000018: 00000004-00000000-00000000-00000000 [SL 00]
CPUID 00000018: 00000000-00300001-00000001-00000121 [SL 01]
CPUID 00000018: 00000000-00040003-00000200-00000043 [SL 02]
CPUID 00000018: 00000000-00400001-00000001-00000122 [SL 03]
CPUID 00000018: 00000000-00080008-00000001-00000143 [SL 04]
CPUID 00000019: 00000007-00000014-00000003-00000000
CPUID 0000001A: 20000001-00000000-00000000-00000000 [Atom: Gracemont]
CPUID 0000001C: C000000B-00000007-00000007-00000000
CPUID 0000001D: 00000000-00000000-00000000-00000000 [SL 00]
CPUID 0000001E: 00000000-00000000-00000000-00000000 [SL 00]
CPUID 0000001F: 00000001-00000001-00000100-00000006 [SL 00]
CPUID 0000001F: 00000003-00000004-00000201-00000006 [SL 01]
CPUID 0000001F: 00000007-00000008-00000302-00000006 [SL 02]
CPUID 00000020: 00000000-00000000-00000000-00000000 [SL 00]
CPUID 80000000: 80000008-00000000-00000000-00000000
CPUID 80000001: 00000000-00000000-00000121-2C100000
CPUID 80000002: 65746E49-2952286C-726F4320-4D542865 [Intel(R) Core(TM]
CPUID 80000003: 20332029-3535334E-00000000-00000000 [) 3 N355]
CPUID 80000004: 00000000-00000000-00000000-00000000 []
CPUID 80000005: 00000000-00000000-00000000-00000000 [L1D: 0 KB / L1I: 0 KB]
CPUID 80000006: 00000000-00000000-08008040-00000000 [L2: 2048 KB / L3: 0 KB]
CPUID 80000007: 00000000-00000000-00000000-00000100
CPUID 80000008: 00003027-00000000-00000000-00000000

L1    Data Cache:    32 KB,  8-way Associative, 64-byte Line
L1  Instr. Cache:    64 KB,  8-way Associative, 64-byte Line
L2 Unified Cache:     2 MB, 16-way Associative, 64-byte Line
L3 Unified Cache:     6 MB, 12-way Associative, 64-byte Line

------[ CPUID Registers / Logical CPU #4 ]------

allcpu: Package 0 / Core 4 / Thread 0: Valid, Intel Atom

CPUID 00000000: 00000020-756E6547-6C65746E-49656E69 [GenuineIntel]
CPUID 00000001: 000B06E0-08800800-7FFAFBFF-BFEBFBFF
CPUID 00000002: 00FEFF01-000000F0-00000000-00000000
CPUID 00000003: 00000000-00000000-00000000-00000000
CPUID 00000004: FC004121-01C0003F-0000003F-00000000 [SL 00] [L1D: 32 KB]
CPUID 00000004: FC004122-01C0003F-0000007F-00000000 [SL 01] [L1I: 64 KB]
CPUID 00000004: FC01C143-03C0003F-000007FF-00000000 [SL 02] [L2U: 2 MB]
CPUID 00000004: FC1FC163-02C0003F-00001FFF-00000004 [SL 03] [L3U: 6 MB]
CPUID 00000005: 00000040-00000040-00000003-10102020
CPUID 00000006: 00578FF7-00000002-00000009-00000000
CPUID 00000007: 00000002-239CA7EB-98C007AC-FC184410 [SL 00]
CPUID 00000007: 00000810-00000000-00000000-00040000 [SL 01]
CPUID 00000007: 00000000-00000000-00000000-00000037 [SL 02]
CPUID 00000008: 00000000-00000000-00000000-00000000
CPUID 00000009: 00000000-00000000-00000000-00000000
CPUID 0000000A: 07300605-00000000-00000007-00008603
CPUID 0000000B: 00000001-00000001-00000100-00000008 [SL 00]
CPUID 0000000B: 00000007-00000008-00000201-00000008 [SL 01]
CPUID 0000000C: 00000000-00000000-00000000-00000000
CPUID 0000000D: 00000207-00000340-00000A88-00000000 [SL 00] [x87]
CPUID 0000000D: 0000000F-000003D0-00019900-00000000 [SL 01] [SSE]
CPUID 0000000D: 00000100-00000240-00000000-00000000 [SL 02] [AVX]
CPUID 0000000D: 00000080-00000000-00000001-00000000 [SL 08] [PT]
CPUID 0000000D: 00000008-00000A80-00000000-00000000 [SL 09] [PKRU]
CPUID 0000000D: 00000010-00000000-00000001-00000000 [SL 0B] [CET_U]
CPUID 0000000D: 00000018-00000000-00000001-00000000 [SL 0C] [CET_S]
CPUID 0000000D: 00000328-00000000-00000001-00000000 [SL 0F] [LBR]
CPUID 0000000D: 00000008-00000000-00000001-00000000 [SL 10] [HWP]
CPUID 0000000E: 00000000-00000000-00000000-00000000
CPUID 0000000F: 00000000-00000000-00000000-00000000 [SL 00]
CPUID 0000000F: 00000000-00000000-00000000-00000000 [SL 01]
CPUID 00000010: 00000000-00000004-00000000-00000000 [SL 00]
CPUID 00000010: 00000000-00000000-00000000-00000000 [SL 01]
CPUID 00000011: 00000000-00000000-00000000-00000000
CPUID 00000012: 00000000-00000000-00000000-00000000 [SL 00]
CPUID 00000012: 00000000-00000000-00000000-00000000 [SL 01]
CPUID 00000013: 00000000-00000000-00000000-00000000
CPUID 00000014: 00000001-000001FF-80000007-00000000 [SL 00]
CPUID 00000014: 02490002-003FFFFF-00000000-00000000 [SL 01]
CPUID 00000015: 00000002-00000062-0249F000-00000000 [49.00x / 38400000 / 1881.60]
CPUID 00000016: 0000076C-00000F3C-00000064-00000000 [1900 / 3900 / 100]
CPUID 00000017: 00000000-00000000-00000000-00000000 [SL 00]
CPUID 00000018: 00000004-00000000-00000000-00000000 [SL 00]
CPUID 00000018: 00000000-00300001-00000001-00000121 [SL 01]
CPUID 00000018: 00000000-00040003-00000200-00000043 [SL 02]
CPUID 00000018: 00000000-00400001-00000001-00000122 [SL 03]
CPUID 00000018: 00000000-00080008-00000001-00000143 [SL 04]
CPUID 00000019: 00000007-00000014-00000003-00000000
CPUID 0000001A: 20000001-00000000-00000000-00000000 [Atom: Gracemont]
CPUID 0000001C: C000000B-00000007-00000007-00000000
CPUID 0000001D: 00000000-00000000-00000000-00000000 [SL 00]
CPUID 0000001E: 00000000-00000000-00000000-00000000 [SL 00]
CPUID 0000001F: 00000001-00000001-00000100-00000008 [SL 00]
CPUID 0000001F: 00000003-00000004-00000201-00000008 [SL 01]
CPUID 0000001F: 00000007-00000008-00000302-00000008 [SL 02]
CPUID 00000020: 00000000-00000000-00000000-00000000 [SL 00]
CPUID 80000000: 80000008-00000000-00000000-00000000
CPUID 80000001: 00000000-00000000-00000121-2C100000
CPUID 80000002: 65746E49-2952286C-726F4320-4D542865 [Intel(R) Core(TM]
CPUID 80000003: 20332029-3535334E-00000000-00000000 [) 3 N355]
CPUID 80000004: 00000000-00000000-00000000-00000000 []
CPUID 80000005: 00000000-00000000-00000000-00000000 [L1D: 0 KB / L1I: 0 KB]
CPUID 80000006: 00000000-00000000-08008040-00000000 [L2: 2048 KB / L3: 0 KB]
CPUID 80000007: 00000000-00000000-00000000-00000100
CPUID 80000008: 00003027-00000000-00000000-00000000

L1    Data Cache:    32 KB,  8-way Associative, 64-byte Line
L1  Instr. Cache:    64 KB,  8-way Associative, 64-byte Line
L2 Unified Cache:     2 MB, 16-way Associative, 64-byte Line
L3 Unified Cache:     6 MB, 12-way Associative, 64-byte Line

------[ CPUID Registers / Logical CPU #5 ]------

allcpu: Package 0 / Core 5 / Thread 0: Valid, Intel Atom

CPUID 00000000: 00000020-756E6547-6C65746E-49656E69 [GenuineIntel]
CPUID 00000001: 000B06E0-0A800800-7FFAFBFF-BFEBFBFF
CPUID 00000002: 00FEFF01-000000F0-00000000-00000000
CPUID 00000003: 00000000-00000000-00000000-00000000
CPUID 00000004: FC004121-01C0003F-0000003F-00000000 [SL 00] [L1D: 32 KB]
CPUID 00000004: FC004122-01C0003F-0000007F-00000000 [SL 01] [L1I: 64 KB]
CPUID 00000004: FC01C143-03C0003F-000007FF-00000000 [SL 02] [L2U: 2 MB]
CPUID 00000004: FC1FC163-02C0003F-00001FFF-00000004 [SL 03] [L3U: 6 MB]
CPUID 00000005: 00000040-00000040-00000003-10102020
CPUID 00000006: 00578FF7-00000002-00000009-00000000
CPUID 00000007: 00000002-239CA7EB-98C007AC-FC184410 [SL 00]
CPUID 00000007: 00000810-00000000-00000000-00040000 [SL 01]
CPUID 00000007: 00000000-00000000-00000000-00000037 [SL 02]
CPUID 00000008: 00000000-00000000-00000000-00000000
CPUID 00000009: 00000000-00000000-00000000-00000000
CPUID 0000000A: 07300605-00000000-00000007-00008603
CPUID 0000000B: 00000001-00000001-00000100-0000000A [SL 00]
CPUID 0000000B: 00000007-00000008-00000201-0000000A [SL 01]
CPUID 0000000C: 00000000-00000000-00000000-00000000
CPUID 0000000D: 00000207-00000340-00000A88-00000000 [SL 00] [x87]
CPUID 0000000D: 0000000F-000003D0-00019900-00000000 [SL 01] [SSE]
CPUID 0000000D: 00000100-00000240-00000000-00000000 [SL 02] [AVX]
CPUID 0000000D: 00000080-00000000-00000001-00000000 [SL 08] [PT]
CPUID 0000000D: 00000008-00000A80-00000000-00000000 [SL 09] [PKRU]
CPUID 0000000D: 00000010-00000000-00000001-00000000 [SL 0B] [CET_U]
CPUID 0000000D: 00000018-00000000-00000001-00000000 [SL 0C] [CET_S]
CPUID 0000000D: 00000328-00000000-00000001-00000000 [SL 0F] [LBR]
CPUID 0000000D: 00000008-00000000-00000001-00000000 [SL 10] [HWP]
CPUID 0000000E: 00000000-00000000-00000000-00000000
CPUID 0000000F: 00000000-00000000-00000000-00000000 [SL 00]
CPUID 0000000F: 00000000-00000000-00000000-00000000 [SL 01]
CPUID 00000010: 00000000-00000004-00000000-00000000 [SL 00]
CPUID 00000010: 00000000-00000000-00000000-00000000 [SL 01]
CPUID 00000011: 00000000-00000000-00000000-00000000
CPUID 00000012: 00000000-00000000-00000000-00000000 [SL 00]
CPUID 00000012: 00000000-00000000-00000000-00000000 [SL 01]
CPUID 00000013: 00000000-00000000-00000000-00000000
CPUID 00000014: 00000001-000001FF-80000007-00000000 [SL 00]
CPUID 00000014: 02490002-003FFFFF-00000000-00000000 [SL 01]
CPUID 00000015: 00000002-00000062-0249F000-00000000 [49.00x / 38400000 / 1881.60]
CPUID 00000016: 0000076C-00000F3C-00000064-00000000 [1900 / 3900 / 100]
CPUID 00000017: 00000000-00000000-00000000-00000000 [SL 00]
CPUID 00000018: 00000004-00000000-00000000-00000000 [SL 00]
CPUID 00000018: 00000000-00300001-00000001-00000121 [SL 01]
CPUID 00000018: 00000000-00040003-00000200-00000043 [SL 02]
CPUID 00000018: 00000000-00400001-00000001-00000122 [SL 03]
CPUID 00000018: 00000000-00080008-00000001-00000143 [SL 04]
CPUID 00000019: 00000007-00000014-00000003-00000000
CPUID 0000001A: 20000001-00000000-00000000-00000000 [Atom: Gracemont]
CPUID 0000001C: C000000B-00000007-00000007-00000000
CPUID 0000001D: 00000000-00000000-00000000-00000000 [SL 00]
CPUID 0000001E: 00000000-00000000-00000000-00000000 [SL 00]
CPUID 0000001F: 00000001-00000001-00000100-0000000A [SL 00]
CPUID 0000001F: 00000003-00000004-00000201-0000000A [SL 01]
CPUID 0000001F: 00000007-00000008-00000302-0000000A [SL 02]
CPUID 00000020: 00000000-00000000-00000000-00000000 [SL 00]
CPUID 80000000: 80000008-00000000-00000000-00000000
CPUID 80000001: 00000000-00000000-00000121-2C100000
CPUID 80000002: 65746E49-2952286C-726F4320-4D542865 [Intel(R) Core(TM]
CPUID 80000003: 20332029-3535334E-00000000-00000000 [) 3 N355]
CPUID 80000004: 00000000-00000000-00000000-00000000 []
CPUID 80000005: 00000000-00000000-00000000-00000000 [L1D: 0 KB / L1I: 0 KB]
CPUID 80000006: 00000000-00000000-08008040-00000000 [L2: 2048 KB / L3: 0 KB]
CPUID 80000007: 00000000-00000000-00000000-00000100
CPUID 80000008: 00003027-00000000-00000000-00000000

L1    Data Cache:    32 KB,  8-way Associative, 64-byte Line
L1  Instr. Cache:    64 KB,  8-way Associative, 64-byte Line
L2 Unified Cache:     2 MB, 16-way Associative, 64-byte Line
L3 Unified Cache:     6 MB, 12-way Associative, 64-byte Line

------[ CPUID Registers / Logical CPU #6 ]------

allcpu: Package 0 / Core 6 / Thread 0: Valid, Intel Atom

CPUID 00000000: 00000020-756E6547-6C65746E-49656E69 [GenuineIntel]
CPUID 00000001: 000B06E0-0C800800-7FFAFBFF-BFEBFBFF
CPUID 00000002: 00FEFF01-000000F0-00000000-00000000
CPUID 00000003: 00000000-00000000-00000000-00000000
CPUID 00000004: FC004121-01C0003F-0000003F-00000000 [SL 00] [L1D: 32 KB]
CPUID 00000004: FC004122-01C0003F-0000007F-00000000 [SL 01] [L1I: 64 KB]
CPUID 00000004: FC01C143-03C0003F-000007FF-00000000 [SL 02] [L2U: 2 MB]
CPUID 00000004: FC1FC163-02C0003F-00001FFF-00000004 [SL 03] [L3U: 6 MB]
CPUID 00000005: 00000040-00000040-00000003-10102020
CPUID 00000006: 00578FF7-00000002-00000009-00000000
CPUID 00000007: 00000002-239CA7EB-98C007AC-FC184410 [SL 00]
CPUID 00000007: 00000810-00000000-00000000-00040000 [SL 01]
CPUID 00000007: 00000000-00000000-00000000-00000037 [SL 02]
CPUID 00000008: 00000000-00000000-00000000-00000000
CPUID 00000009: 00000000-00000000-00000000-00000000
CPUID 0000000A: 07300605-00000000-00000007-00008603
CPUID 0000000B: 00000001-00000001-00000100-0000000C [SL 00]
CPUID 0000000B: 00000007-00000008-00000201-0000000C [SL 01]
CPUID 0000000C: 00000000-00000000-00000000-00000000
CPUID 0000000D: 00000207-00000340-00000A88-00000000 [SL 00] [x87]
CPUID 0000000D: 0000000F-000003D0-00019900-00000000 [SL 01] [SSE]
CPUID 0000000D: 00000100-00000240-00000000-00000000 [SL 02] [AVX]
CPUID 0000000D: 00000080-00000000-00000001-00000000 [SL 08] [PT]
CPUID 0000000D: 00000008-00000A80-00000000-00000000 [SL 09] [PKRU]
CPUID 0000000D: 00000010-00000000-00000001-00000000 [SL 0B] [CET_U]
CPUID 0000000D: 00000018-00000000-00000001-00000000 [SL 0C] [CET_S]
CPUID 0000000D: 00000328-00000000-00000001-00000000 [SL 0F] [LBR]
CPUID 0000000D: 00000008-00000000-00000001-00000000 [SL 10] [HWP]
CPUID 0000000E: 00000000-00000000-00000000-00000000
CPUID 0000000F: 00000000-00000000-00000000-00000000 [SL 00]
CPUID 0000000F: 00000000-00000000-00000000-00000000 [SL 01]
CPUID 00000010: 00000000-00000004-00000000-00000000 [SL 00]
CPUID 00000010: 00000000-00000000-00000000-00000000 [SL 01]
CPUID 00000011: 00000000-00000000-00000000-00000000
CPUID 00000012: 00000000-00000000-00000000-00000000 [SL 00]
CPUID 00000012: 00000000-00000000-00000000-00000000 [SL 01]
CPUID 00000013: 00000000-00000000-00000000-00000000
CPUID 00000014: 00000001-000001FF-80000007-00000000 [SL 00]
CPUID 00000014: 02490002-003FFFFF-00000000-00000000 [SL 01]
CPUID 00000015: 00000002-00000062-0249F000-00000000 [49.00x / 38400000 / 1881.60]
CPUID 00000016: 0000076C-00000F3C-00000064-00000000 [1900 / 3900 / 100]
CPUID 00000017: 00000000-00000000-00000000-00000000 [SL 00]
CPUID 00000018: 00000004-00000000-00000000-00000000 [SL 00]
CPUID 00000018: 00000000-00300001-00000001-00000121 [SL 01]
CPUID 00000018: 00000000-00040003-00000200-00000043 [SL 02]
CPUID 00000018: 00000000-00400001-00000001-00000122 [SL 03]
CPUID 00000018: 00000000-00080008-00000001-00000143 [SL 04]
CPUID 00000019: 00000007-00000014-00000003-00000000
CPUID 0000001A: 20000001-00000000-00000000-00000000 [Atom: Gracemont]
CPUID 0000001C: C000000B-00000007-00000007-00000000
CPUID 0000001D: 00000000-00000000-00000000-00000000 [SL 00]
CPUID 0000001E: 00000000-00000000-00000000-00000000 [SL 00]
CPUID 0000001F: 00000001-00000001-00000100-0000000C [SL 00]
CPUID 0000001F: 00000003-00000004-00000201-0000000C [SL 01]
CPUID 0000001F: 00000007-00000008-00000302-0000000C [SL 02]
CPUID 00000020: 00000000-00000000-00000000-00000000 [SL 00]
CPUID 80000000: 80000008-00000000-00000000-00000000
CPUID 80000001: 00000000-00000000-00000121-2C100000
CPUID 80000002: 65746E49-2952286C-726F4320-4D542865 [Intel(R) Core(TM]
CPUID 80000003: 20332029-3535334E-00000000-00000000 [) 3 N355]
CPUID 80000004: 00000000-00000000-00000000-00000000 []
CPUID 80000005: 00000000-00000000-00000000-00000000 [L1D: 0 KB / L1I: 0 KB]
CPUID 80000006: 00000000-00000000-08008040-00000000 [L2: 2048 KB / L3: 0 KB]
CPUID 80000007: 00000000-00000000-00000000-00000100
CPUID 80000008: 00003027-00000000-00000000-00000000

L1    Data Cache:    32 KB,  8-way Associative, 64-byte Line
L1  Instr. Cache:    64 KB,  8-way Associative, 64-byte Line
L2 Unified Cache:     2 MB, 16-way Associative, 64-byte Line
L3 Unified Cache:     6 MB, 12-way Associative, 64-byte Line

------[ CPUID Registers / Logical CPU #7 ]------

allcpu: Package 0 / Core 7 / Thread 0: Valid, Intel Atom

CPUID 00000000: 00000020-756E6547-6C65746E-49656E69 [GenuineIntel]
CPUID 00000001: 000B06E0-0E800800-7FFAFBFF-BFEBFBFF
CPUID 00000002: 00FEFF01-000000F0-00000000-00000000
CPUID 00000003: 00000000-00000000-00000000-00000000
CPUID 00000004: FC004121-01C0003F-0000003F-00000000 [SL 00] [L1D: 32 KB]
CPUID 00000004: FC004122-01C0003F-0000007F-00000000 [SL 01] [L1I: 64 KB]
CPUID 00000004: FC01C143-03C0003F-000007FF-00000000 [SL 02] [L2U: 2 MB]
CPUID 00000004: FC1FC163-02C0003F-00001FFF-00000004 [SL 03] [L3U: 6 MB]
CPUID 00000005: 00000040-00000040-00000003-10102020
CPUID 00000006: 00578FF7-00000002-00000009-00000000
CPUID 00000007: 00000002-239CA7EB-98C007AC-FC184410 [SL 00]
CPUID 00000007: 00000810-00000000-00000000-00040000 [SL 01]
CPUID 00000007: 00000000-00000000-00000000-00000037 [SL 02]
CPUID 00000008: 00000000-00000000-00000000-00000000
CPUID 00000009: 00000000-00000000-00000000-00000000
CPUID 0000000A: 07300605-00000000-00000007-00008603
CPUID 0000000B: 00000001-00000001-00000100-0000000E [SL 00]
CPUID 0000000B: 00000007-00000008-00000201-0000000E [SL 01]
CPUID 0000000C: 00000000-00000000-00000000-00000000
CPUID 0000000D: 00000207-00000340-00000A88-00000000 [SL 00] [x87]
CPUID 0000000D: 0000000F-000003D0-00019900-00000000 [SL 01] [SSE]
CPUID 0000000D: 00000100-00000240-00000000-00000000 [SL 02] [AVX]
CPUID 0000000D: 00000080-00000000-00000001-00000000 [SL 08] [PT]
CPUID 0000000D: 00000008-00000A80-00000000-00000000 [SL 09] [PKRU]
CPUID 0000000D: 00000010-00000000-00000001-00000000 [SL 0B] [CET_U]
CPUID 0000000D: 00000018-00000000-00000001-00000000 [SL 0C] [CET_S]
CPUID 0000000D: 00000328-00000000-00000001-00000000 [SL 0F] [LBR]
CPUID 0000000D: 00000008-00000000-00000001-00000000 [SL 10] [HWP]
CPUID 0000000E: 00000000-00000000-00000000-00000000
CPUID 0000000F: 00000000-00000000-00000000-00000000 [SL 00]
CPUID 0000000F: 00000000-00000000-00000000-00000000 [SL 01]
CPUID 00000010: 00000000-00000004-00000000-00000000 [SL 00]
CPUID 00000010: 00000000-00000000-00000000-00000000 [SL 01]
CPUID 00000011: 00000000-00000000-00000000-00000000
CPUID 00000012: 00000000-00000000-00000000-00000000 [SL 00]
CPUID 00000012: 00000000-00000000-00000000-00000000 [SL 01]
CPUID 00000013: 00000000-00000000-00000000-00000000
CPUID 00000014: 00000001-000001FF-80000007-00000000 [SL 00]
CPUID 00000014: 02490002-003FFFFF-00000000-00000000 [SL 01]
CPUID 00000015: 00000002-00000062-0249F000-00000000 [49.00x / 38400000 / 1881.60]
CPUID 00000016: 0000076C-00000F3C-00000064-00000000 [1900 / 3900 / 100]
CPUID 00000017: 00000000-00000000-00000000-00000000 [SL 00]
CPUID 00000018: 00000004-00000000-00000000-00000000 [SL 00]
CPUID 00000018: 00000000-00300001-00000001-00000121 [SL 01]
CPUID 00000018: 00000000-00040003-00000200-00000043 [SL 02]
CPUID 00000018: 00000000-00400001-00000001-00000122 [SL 03]
CPUID 00000018: 00000000-00080008-00000001-00000143 [SL 04]
CPUID 00000019: 00000007-00000014-00000003-00000000
CPUID 0000001A: 20000001-00000000-00000000-00000000 [Atom: Gracemont]
CPUID 0000001C: C000000B-00000007-00000007-00000000
CPUID 0000001D: 00000000-00000000-00000000-00000000 [SL 00]
CPUID 0000001E: 00000000-00000000-00000000-00000000 [SL 00]
CPUID 0000001F: 00000001-00000001-00000100-0000000E [SL 00]
CPUID 0000001F: 00000003-00000004-00000201-0000000E [SL 01]
CPUID 0000001F: 00000007-00000008-00000302-0000000E [SL 02]
CPUID 00000020: 00000000-00000000-00000000-00000000 [SL 00]
CPUID 80000000: 80000008-00000000-00000000-00000000
CPUID 80000001: 00000000-00000000-00000121-2C100000
CPUID 80000002: 65746E49-2952286C-726F4320-4D542865 [Intel(R) Core(TM]
CPUID 80000003: 20332029-3535334E-00000000-00000000 [) 3 N355]
CPUID 80000004: 00000000-00000000-00000000-00000000 []
CPUID 80000005: 00000000-00000000-00000000-00000000 [L1D: 0 KB / L1I: 0 KB]
CPUID 80000006: 00000000-00000000-08008040-00000000 [L2: 2048 KB / L3: 0 KB]
CPUID 80000007: 00000000-00000000-00000000-00000100
CPUID 80000008: 00003027-00000000-00000000-00000000

L1    Data Cache:    32 KB,  8-way Associative, 64-byte Line
L1  Instr. Cache:    64 KB,  8-way Associative, 64-byte Line
L2 Unified Cache:     2 MB, 16-way Associative, 64-byte Line
L3 Unified Cache:     6 MB, 12-way Associative, 64-byte Line

------[ All CPUs ]------

CPU   0: APICID    0 / Package 0 / Core   0 / Thread 0: Valid
CPU   1: APICID    2 / Package 0 / Core   1 / Thread 0: Valid
CPU   2: APICID    4 / Package 0 / Core   2 / Thread 0: Valid
CPU   3: APICID    6 / Package 0 / Core   3 / Thread 0: Valid
CPU   4: APICID    8 / Package 0 / Core   4 / Thread 0: Valid
CPU   5: APICID   10 / Package 0 / Core   5 / Thread 0: Valid
CPU   6: APICID   12 / Package 0 / Core   6 / Thread 0: Valid
CPU   7: APICID   14 / Package 0 / Core   7 / Thread 0: Valid

------[ MSR Registers / Logical CPU #0 ]------

MSR 00000017: 000C-0000-0000-0000 [PlatID = 3]
MSR 0000001B: 0000-0000-FEE0-0D00
MSR 0000002A: 0000-0000-0000-0000
MSR 00000035: 0000-0000-0008-0008
MSR 00000048: 0000-0000-0000-0001
MSR 00000049: < FAILED >
MSR 0000008B: 0000-001A-0000-0000
MSR 000000CD: < FAILED >
MSR 000000CE: 0804-083B-F081-1300 [eD = 0]
MSR 000000E7: 0000-022C-DD93-5B50 [S200]
MSR 000000E7: 0000-022C-DF11-41E4 [S200]
MSR 000000E7: 0000-022C-DFC0-F6E8
MSR 000000E8: 0000-02CA-8CFB-B6C4 [S200]
MSR 000000E8: 0000-02CA-8E3D-E558 [S200]
MSR 000000E8: 0000-02CA-8F6F-BCB4
MSR 000000EE: < FAILED >
MSR 0000010A: 0000-0000-1580-FD6B
MSR 0000010B: < FAILED >
MSR 0000011E: < FAILED >
MSR 00000194: 0000-0000-0011-0000
MSR 00000198: 0000-28A3-0000-2700 [S200]
MSR 00000198: 0000-23D2-0000-2100 [S200]
MSR 00000198: 0000-2534-0000-2300
MSR 00000199: 0000-0000-0000-1300
MSR 0000019A: 0000-0000-0000-0000
MSR 0000019B: 0000-0000-0000-0010
MSR 0000019C: 0000-0000-8834-2000 [S200]
MSR 0000019C: 0000-0000-8834-2000 [S200]
MSR 0000019C: 0000-0000-8835-2000
MSR 0000019D: 0000-0000-0000-0000
MSR 000001A0: 0000-0000-0085-0089
MSR 000001A2: 0000-0000-8069-0000
MSR 000001A4: 0000-0000-0000-0000
MSR 000001AA: 0000-0000-0000-30C2
MSR 000001AC: < FAILED >
MSR 000001AD: 1E1F-2021-2323-2527
MSR 000001AE: 0807-0605-0403-0201
MSR 000001AF: < FAILED >
MSR 000001B0: 0000-0000-0000-0006
MSR 000001B1: 0000-0000-8833-0000
MSR 000001B2: 0000-0000-0000-0000
MSR 000001FC: 0000-0000-00E4-005B
MSR 00000300: < FAILED >
MSR 0000030A: 0000-0000-0000-0000 [S200]
MSR 0000030A: 0000-0000-0000-0000 [S200]
MSR 0000030A: 0000-0000-0000-0000
MSR 0000030B: 0000-0000-0000-0000 [S200]
MSR 0000030B: 0000-0000-0000-0000 [S200]
MSR 0000030B: 0000-0000-0000-0000
MSR 00000480: 03DA-0500-0000-0013
MSR 00000481: 0000-00FF-0000-0016
MSR 00000482: FFFB-FFFE-0401-E172
MSR 00000483: F77F-FFFF-0003-6DFF
MSR 00000484: 0076-FFFF-0000-11FF
MSR 00000485: 0000-0000-7004-C1E7
MSR 00000486: 0000-0000-8000-0021
MSR 00000487: 0000-0000-FFFF-FFFF
MSR 00000488: 0000-0000-0000-2000
MSR 00000489: 0000-0000-01FF-6FFF
MSR 0000048A: 0000-0000-0000-002E
MSR 0000048B: 075D-7FFF-0000-0000
MSR 0000048C: 0000-0F01-06F3-4141
MSR 0000048D: 0000-00FF-0000-0016
MSR 0000048E: FFFB-FFFE-0400-6172
MSR 0000048F: F77F-FFFF-0003-6DFB
MSR 00000490: 0076-FFFF-0000-11FB
MSR 00000601: 0000-0000-0000-01E0
MSR 00000602: < FAILED >
MSR 00000603: 0036-0000-0036-3636
MSR 00000604: < FAILED >
MSR 00000606: 0000-0000-000A-0E03
MSR 0000060A: 0000-0000-0000-0000
MSR 0000060B: 0000-0000-0000-0000
MSR 0000060C: 0000-0000-0000-0000
MSR 0000060D: 0000-01FA-4FCC-8B76
MSR 00000610: 0042-8118-0099-80E0
MSR 00000611: 0000-0000-3D5D-4E56 [S200]
MSR 00000611: 0000-0000-3D5D-9620 [S200]
MSR 00000611: 0000-0000-3D5D-DECA
MSR 00000613: 0000-0000-0000-0000
MSR 00000614: 0000-0000-0000-0078
MSR 00000618: 0000-0000-0000-0000
MSR 00000619: 0000-0000-0000-0000 [S200]
MSR 00000619: 0000-0000-0000-0000 [S200]
MSR 00000619: 0000-0000-0000-0000
MSR 0000061B: 0000-0000-0000-0000
MSR 0000061C: < FAILED >
MSR 0000061E: < FAILED >
MSR 00000620: 0000-0000-0000-0421
MSR 00000621: 0000-0000-0000-001D
MSR 00000638: 0000-0000-0000-0000
MSR 00000639: 0000-0000-176A-14FB [S200]
MSR 00000639: 0000-0000-176A-2693 [S200]
MSR 00000639: 0000-0000-176A-3721
MSR 0000063A: 0000-0000-0000-0009
MSR 0000063B: < FAILED >
MSR 00000640: 0000-0000-0000-0000
MSR 00000641: 0000-0000-003E-BCD2 [S200]
MSR 00000641: 0000-0000-003E-BCD9 [S200]
MSR 00000641: 0000-0000-003E-BCD9
MSR 00000642: 0000-0000-0000-000D
MSR 00000648: 0000-0000-0000-0013
MSR 00000649: 0000-0000-000A-0048
MSR 0000064A: 0000-0000-0000-0000
MSR 0000064B: 0000-0000-0000-0000
MSR 0000064C: 0000-0000-0000-0012
MSR 00000660: 0000-0143-4301-1C0B
MSR 00000661: < FAILED >
MSR 00000662: < FAILED >
MSR 00000663: < FAILED >
MSR 00000664: 0000-04A6-0BAF-A0F5
MSR 00000665: < FAILED >
MSR 00000666: < FAILED >
MSR 00000667: < FAILED >
MSR 00000668: < FAILED >
MSR 00000669: < FAILED >
MSR 0000066A: < FAILED >
MSR 0000066B: < FAILED >
MSR 0000066C: < FAILED >
MSR 0000066D: < FAILED >
MSR 0000066E: < FAILED >
MSR 0000066F: < FAILED >
MSR 00000670: < FAILED >
MSR 00000671: < FAILED >
MSR 00000672: < FAILED >
MSR 00000673: < FAILED >
MSR 00000674: < FAILED >
MSR 00000675: < FAILED >
MSR 00000676: < FAILED >
MSR 00000677: < FAILED >
MSR 00000690: < FAILED >
MSR 000006B0: 0000-0000-0100-0000
MSR 000006B1: 0000-0000-0100-0000
MSR 00000770: 0000-0000-0000-0001
MSR 00000771: 0000-0000-0109-1327
MSR 00000772: 0000-019E-0000-2713
MSR 00000773: 0000-0000-0000-0005
MSR 00000774: 0000-059E-0000-2713
MSR 00000777: 0000-0000-0000-0004
MSR 00000832: 0000-0000-0002-00D1
MSR 00000838: 0000-0000-0000-0209
MSR 00000839: 0000-0000-0000-01B6
MSR 0000083E: 0000-0000-0000-000A

------[ MSR Registers / Logical CPU #1 ]------

MSR 00000017: 000C-0000-0000-0000 [PlatID = 3]
MSR 0000001B: 0000-0000-FEE0-0C00
MSR 0000002A: 0000-0000-0000-0000
MSR 00000035: 0000-0000-0008-0008
MSR 00000048: 0000-0000-0000-0001
MSR 00000049: < FAILED >
MSR 0000008B: 0000-001A-0000-0000
MSR 000000CD: < FAILED >
MSR 000000CE: 0804-083B-F081-1300 [eD = 0]
MSR 000000E7: 0000-02C9-9B30-E804
MSR 000000E8: 0000-03B8-2BBB-7C25
MSR 000000EE: < FAILED >
MSR 0000010A: 0000-0000-1580-FD6B
MSR 0000010B: < FAILED >
MSR 0000011E: < FAILED >
MSR 00000194: 0000-0000-0011-0000
MSR 00000198: 0000-2779-0000-2700
MSR 00000199: 0000-0000-0000-1300
MSR 0000019A: 0000-0000-0000-0000
MSR 0000019B: 0000-0000-0000-0010
MSR 0000019C: 0000-0000-8831-2000
MSR 0000019D: 0000-0000-0000-0000
MSR 000001A0: 0000-0000-0085-0089
MSR 000001A2: 0000-0000-8069-0000
MSR 000001A4: 0000-0000-0000-0000
MSR 000001AA: 0000-0000-0000-30C2
MSR 000001AC: < FAILED >
MSR 000001AD: 1E1F-2021-2323-2527
MSR 000001AE: 0807-0605-0403-0201
MSR 000001AF: < FAILED >
MSR 000001B0: 0000-0000-0000-0006
MSR 000001B1: 0000-0000-8831-0000
MSR 000001B2: 0000-0000-0000-0000
MSR 000001FC: 0000-0000-00E4-005B
MSR 00000300: < FAILED >
MSR 0000030A: 0000-0000-0000-0000
MSR 0000030B: 0000-0000-0000-0000
MSR 00000480: 03DA-0500-0000-0013
MSR 00000481: 0000-00FF-0000-0016
MSR 00000482: FFFB-FFFE-0401-E172
MSR 00000483: F77F-FFFF-0003-6DFF
MSR 00000484: 0076-FFFF-0000-11FF
MSR 00000485: 0000-0000-7004-C1E7
MSR 00000486: 0000-0000-8000-0021
MSR 00000487: 0000-0000-FFFF-FFFF
MSR 00000488: 0000-0000-0000-2000
MSR 00000489: 0000-0000-01FF-6FFF
MSR 0000048A: 0000-0000-0000-002E
MSR 0000048B: 075D-7FFF-0000-0000
MSR 0000048C: 0000-0F01-06F3-4141
MSR 0000048D: 0000-00FF-0000-0016
MSR 0000048E: FFFB-FFFE-0400-6172
MSR 0000048F: F77F-FFFF-0003-6DFB
MSR 00000490: 0076-FFFF-0000-11FB
MSR 00000601: 0000-0000-0000-01E0
MSR 00000602: < FAILED >
MSR 00000603: 0036-0000-0036-3636
MSR 00000604: < FAILED >
MSR 00000606: 0000-0000-000A-0E03
MSR 0000060A: 0000-0000-0000-0000
MSR 0000060B: 0000-0000-0000-0000
MSR 0000060C: 0000-0000-0000-0000
MSR 0000060D: 0000-01FA-8555-6C14
MSR 00000610: 0042-8118-0099-80E0
MSR 00000611: 0000-0000-3D5F-9390
MSR 00000613: 0000-0000-0000-0000
MSR 00000614: 0000-0000-0000-0078
MSR 00000618: 0000-0000-0000-0000
MSR 00000619: 0000-0000-0000-0000
MSR 0000061B: 0000-0000-0000-0000
MSR 0000061C: < FAILED >
MSR 0000061E: < FAILED >
MSR 00000620: 0000-0000-0000-0421
MSR 00000621: 0000-0000-0000-001F
MSR 00000638: 0000-0000-0000-0000
MSR 00000639: 0000-0000-176A-5F9A
MSR 0000063A: 0000-0000-0000-0009
MSR 0000063B: < FAILED >
MSR 00000640: 0000-0000-0000-0000
MSR 00000641: 0000-0000-003E-BCD9
MSR 00000642: 0000-0000-0000-000D
MSR 00000648: 0000-0000-0000-0013
MSR 00000649: 0000-0000-000A-0048
MSR 0000064A: 0000-0000-0000-0000
MSR 0000064B: 0000-0000-0000-0000
MSR 0000064C: 0000-0000-0000-0012
MSR 00000660: 0000-01A2-C199-D8DC
MSR 00000661: < FAILED >
MSR 00000662: < FAILED >
MSR 00000663: < FAILED >
MSR 00000664: 0000-04A6-0BAF-A0F5
MSR 00000665: < FAILED >
MSR 00000666: < FAILED >
MSR 00000667: < FAILED >
MSR 00000668: < FAILED >
MSR 00000669: < FAILED >
MSR 0000066A: < FAILED >
MSR 0000066B: < FAILED >
MSR 0000066C: < FAILED >
MSR 0000066D: < FAILED >
MSR 0000066E: < FAILED >
MSR 0000066F: < FAILED >
MSR 00000670: < FAILED >
MSR 00000671: < FAILED >
MSR 00000672: < FAILED >
MSR 00000673: < FAILED >
MSR 00000674: < FAILED >
MSR 00000675: < FAILED >
MSR 00000676: < FAILED >
MSR 00000677: < FAILED >
MSR 00000690: < FAILED >
MSR 000006B0: 0000-0000-0100-0000
MSR 000006B1: 0000-0000-0100-0000
MSR 00000770: 0000-0000-0000-0001
MSR 00000771: 0000-0000-010D-1327
MSR 00000772: 0000-019E-0000-2713
MSR 00000773: 0000-0000-0000-0005
MSR 00000774: 0000-0400-0027-2713
MSR 00000777: 0000-0000-0000-0004
MSR 00000832: 0000-0000-0002-00D1
MSR 00000838: 0000-0000-0000-0209
MSR 00000839: 0000-0000-0000-013C
MSR 0000083E: 0000-0000-0000-000A

------[ MSR Registers / Logical CPU #2 ]------

MSR 00000017: 000C-0000-0000-0000 [PlatID = 3]
MSR 0000001B: 0000-0000-FEE0-0C00
MSR 0000002A: 0000-0000-0000-0000
MSR 00000035: 0000-0000-0008-0008
MSR 00000048: 0000-0000-0000-0001
MSR 00000049: < FAILED >
MSR 0000008B: 0000-001A-0000-0000
MSR 000000CD: < FAILED >
MSR 000000CE: 0804-083B-F081-1300 [eD = 0]
MSR 000000E7: 0000-0246-A791-BB84
MSR 000000E8: 0000-02BF-0262-6C51
MSR 000000EE: < FAILED >
MSR 0000010A: 0000-0000-1580-FD6B
MSR 0000010B: < FAILED >
MSR 0000011E: < FAILED >
MSR 00000194: 0000-0000-0011-0000
MSR 00000198: 0000-27C0-0000-2700
MSR 00000199: 0000-0000-0000-1300
MSR 0000019A: 0000-0000-0000-0000
MSR 0000019B: 0000-0000-0000-0010
MSR 0000019C: 0000-0000-8831-2000
MSR 0000019D: 0000-0000-0000-0000
MSR 000001A0: 0000-0000-0085-0089
MSR 000001A2: 0000-0000-8069-0000
MSR 000001A4: 0000-0000-0000-0000
MSR 000001AA: 0000-0000-0000-30C2
MSR 000001AC: < FAILED >
MSR 000001AD: 1E1F-2021-2323-2527
MSR 000001AE: 0807-0605-0403-0201
MSR 000001AF: < FAILED >
MSR 000001B0: 0000-0000-0000-0006
MSR 000001B1: 0000-0000-8831-0000
MSR 000001B2: 0000-0000-0000-0000
MSR 000001FC: 0000-0000-00E4-005B
MSR 00000300: < FAILED >
MSR 0000030A: 0000-0000-0000-0000
MSR 0000030B: 0000-0000-0000-0000
MSR 00000480: 03DA-0500-0000-0013
MSR 00000481: 0000-00FF-0000-0016
MSR 00000482: FFFB-FFFE-0401-E172
MSR 00000483: F77F-FFFF-0003-6DFF
MSR 00000484: 0076-FFFF-0000-11FF
MSR 00000485: 0000-0000-7004-C1E7
MSR 00000486: 0000-0000-8000-0021
MSR 00000487: 0000-0000-FFFF-FFFF
MSR 00000488: 0000-0000-0000-2000
MSR 00000489: 0000-0000-01FF-6FFF
MSR 0000048A: 0000-0000-0000-002E
MSR 0000048B: 075D-7FFF-0000-0000
MSR 0000048C: 0000-0F01-06F3-4141
MSR 0000048D: 0000-00FF-0000-0016
MSR 0000048E: FFFB-FFFE-0400-6172
MSR 0000048F: F77F-FFFF-0003-6DFB
MSR 00000490: 0076-FFFF-0000-11FB
MSR 00000601: 0000-0000-0000-01E0
MSR 00000602: < FAILED >
MSR 00000603: 0036-0000-0036-3636
MSR 00000604: < FAILED >
MSR 00000606: 0000-0000-000A-0E03
MSR 0000060A: 0000-0000-0000-0000
MSR 0000060B: 0000-0000-0000-0000
MSR 0000060C: 0000-0000-0000-0000
MSR 0000060D: 0000-01FA-8555-6C14
MSR 00000610: 0042-8118-0099-80E0
MSR 00000611: 0000-0000-3D5F-94AA
MSR 00000613: 0000-0000-0000-0000
MSR 00000614: 0000-0000-0000-0078
MSR 00000618: 0000-0000-0000-0000
MSR 00000619: 0000-0000-0000-0000
MSR 0000061B: 0000-0000-0000-0000
MSR 0000061C: < FAILED >
MSR 0000061E: < FAILED >
MSR 00000620: 0000-0000-0000-0421
MSR 00000621: 0000-0000-0000-001F
MSR 00000638: 0000-0000-0000-0000
MSR 00000639: 0000-0000-176A-6040
MSR 0000063A: 0000-0000-0000-0009
MSR 0000063B: < FAILED >
MSR 00000640: 0000-0000-0000-0000
MSR 00000641: 0000-0000-003E-BCD9
MSR 00000642: 0000-0000-0000-000D
MSR 00000648: 0000-0000-0000-0013
MSR 00000649: 0000-0000-000A-0048
MSR 0000064A: 0000-0000-0000-0000
MSR 0000064B: 0000-0000-0000-0000
MSR 0000064C: 0000-0000-0000-0012
MSR 00000660: 0000-00E3-82A0-7DC1
MSR 00000661: < FAILED >
MSR 00000662: < FAILED >
MSR 00000663: < FAILED >
MSR 00000664: 0000-04A6-0BAF-A0F5
MSR 00000665: < FAILED >
MSR 00000666: < FAILED >
MSR 00000667: < FAILED >
MSR 00000668: < FAILED >
MSR 00000669: < FAILED >
MSR 0000066A: < FAILED >
MSR 0000066B: < FAILED >
MSR 0000066C: < FAILED >
MSR 0000066D: < FAILED >
MSR 0000066E: < FAILED >
MSR 0000066F: < FAILED >
MSR 00000670: < FAILED >
MSR 00000671: < FAILED >
MSR 00000672: < FAILED >
MSR 00000673: < FAILED >
MSR 00000674: < FAILED >
MSR 00000675: < FAILED >
MSR 00000676: < FAILED >
MSR 00000677: < FAILED >
MSR 00000690: < FAILED >
MSR 000006B0: 0000-0000-0100-0000
MSR 000006B1: 0000-0000-0100-0000
MSR 00000770: 0000-0000-0000-0001
MSR 00000771: 0000-0000-010E-1327
MSR 00000772: 0000-019E-0000-2713
MSR 00000773: 0000-0000-0000-0005
MSR 00000774: 0000-0400-0027-2713
MSR 00000777: 0000-0000-0000-0004
MSR 00000832: 0000-0000-0002-00D1
MSR 00000838: 0000-0000-0000-0209
MSR 00000839: 0000-0000-0000-013D
MSR 0000083E: 0000-0000-0000-000A

------[ MSR Registers / Logical CPU #3 ]------

MSR 00000017: 000C-0000-0000-0000 [PlatID = 3]
MSR 0000001B: 0000-0000-FEE0-0C00
MSR 0000002A: 0000-0000-0000-0000
MSR 00000035: 0000-0000-0008-0008
MSR 00000048: 0000-0000-0000-0001
MSR 00000049: < FAILED >
MSR 0000008B: 0000-001A-0000-0000
MSR 000000CD: < FAILED >
MSR 000000CE: 0804-083B-F081-1300 [eD = 0]
MSR 000000E7: 0000-0134-588D-25B8
MSR 000000E8: 0000-01B9-14D1-39BD
MSR 000000EE: < FAILED >
MSR 0000010A: 0000-0000-1580-FD6B
MSR 0000010B: < FAILED >
MSR 0000011E: < FAILED >
MSR 00000194: 0000-0000-0011-0000
MSR 00000198: 0000-27D9-0000-2700
MSR 00000199: 0000-0000-0000-1300
MSR 0000019A: 0000-0000-0000-0000
MSR 0000019B: 0000-0000-0000-0010
MSR 0000019C: 0000-0000-8831-2000
MSR 0000019D: 0000-0000-0000-0000
MSR 000001A0: 0000-0000-0085-0089
MSR 000001A2: 0000-0000-8069-0000
MSR 000001A4: 0000-0000-0000-0000
MSR 000001AA: 0000-0000-0000-30C2
MSR 000001AC: < FAILED >
MSR 000001AD: 1E1F-2021-2323-2527
MSR 000001AE: 0807-0605-0403-0201
MSR 000001AF: < FAILED >
MSR 000001B0: 0000-0000-0000-0006
MSR 000001B1: 0000-0000-8831-0000
MSR 000001B2: 0000-0000-0000-0000
MSR 000001FC: 0000-0000-00E4-005B
MSR 00000300: < FAILED >
MSR 0000030A: 0000-0000-0000-0000
MSR 0000030B: 0000-0000-0000-0000
MSR 00000480: 03DA-0500-0000-0013
MSR 00000481: 0000-00FF-0000-0016
MSR 00000482: FFFB-FFFE-0401-E172
MSR 00000483: F77F-FFFF-0003-6DFF
MSR 00000484: 0076-FFFF-0000-11FF
MSR 00000485: 0000-0000-7004-C1E7
MSR 00000486: 0000-0000-8000-0021
MSR 00000487: 0000-0000-FFFF-FFFF
MSR 00000488: 0000-0000-0000-2000
MSR 00000489: 0000-0000-01FF-6FFF
MSR 0000048A: 0000-0000-0000-002E
MSR 0000048B: 075D-7FFF-0000-0000
MSR 0000048C: 0000-0F01-06F3-4141
MSR 0000048D: 0000-00FF-0000-0016
MSR 0000048E: FFFB-FFFE-0400-6172
MSR 0000048F: F77F-FFFF-0003-6DFB
MSR 00000490: 0076-FFFF-0000-11FB
MSR 00000601: 0000-0000-0000-01E0
MSR 00000602: < FAILED >
MSR 00000603: 0036-0000-0036-3636
MSR 00000604: < FAILED >
MSR 00000606: 0000-0000-000A-0E03
MSR 0000060A: 0000-0000-0000-0000
MSR 0000060B: 0000-0000-0000-0000
MSR 0000060C: 0000-0000-0000-0000
MSR 0000060D: 0000-01FA-8555-6C14
MSR 00000610: 0042-8118-0099-80E0
MSR 00000611: 0000-0000-3D5F-94AA
MSR 00000613: 0000-0000-0000-0000
MSR 00000614: 0000-0000-0000-0078
MSR 00000618: 0000-0000-0000-0000
MSR 00000619: 0000-0000-0000-0000
MSR 0000061B: 0000-0000-0000-0000
MSR 0000061C: < FAILED >
MSR 0000061E: < FAILED >
MSR 00000620: 0000-0000-0000-0421
MSR 00000621: 0000-0000-0000-001F
MSR 00000638: 0000-0000-0000-0000
MSR 00000639: 0000-0000-176A-6040
MSR 0000063A: 0000-0000-0000-0009
MSR 0000063B: < FAILED >
MSR 00000640: 0000-0000-0000-0000
MSR 00000641: 0000-0000-003E-BCD9
MSR 00000642: 0000-0000-0000-000D
MSR 00000648: 0000-0000-0000-0013
MSR 00000649: 0000-0000-000A-0048
MSR 0000064A: 0000-0000-0000-0000
MSR 0000064B: 0000-0000-0000-0000
MSR 0000064C: 0000-0000-0000-0012
MSR 00000660: 0000-00AC-0AE6-3FD6
MSR 00000661: < FAILED >
MSR 00000662: < FAILED >
MSR 00000663: < FAILED >
MSR 00000664: 0000-04A6-0BAF-A0F5
MSR 00000665: < FAILED >
MSR 00000666: < FAILED >
MSR 00000667: < FAILED >
MSR 00000668: < FAILED >
MSR 00000669: < FAILED >
MSR 0000066A: < FAILED >
MSR 0000066B: < FAILED >
MSR 0000066C: < FAILED >
MSR 0000066D: < FAILED >
MSR 0000066E: < FAILED >
MSR 0000066F: < FAILED >
MSR 00000670: < FAILED >
MSR 00000671: < FAILED >
MSR 00000672: < FAILED >
MSR 00000673: < FAILED >
MSR 00000674: < FAILED >
MSR 00000675: < FAILED >
MSR 00000676: < FAILED >
MSR 00000677: < FAILED >
MSR 00000690: < FAILED >
MSR 000006B0: 0000-0000-0100-0000
MSR 000006B1: 0000-0000-0100-0000
MSR 00000770: 0000-0000-0000-0001
MSR 00000771: 0000-0000-010F-1327
MSR 00000772: 0000-019E-0000-2713
MSR 00000773: 0000-0000-0000-0005
MSR 00000774: 0000-0400-0027-2713
MSR 00000777: 0000-0000-0000-0004
MSR 00000832: 0000-0000-0002-00D1
MSR 00000838: 0000-0000-0000-0209
MSR 00000839: 0000-0000-0000-0148
MSR 0000083E: 0000-0000-0000-000A

------[ MSR Registers / Logical CPU #4 ]------

MSR 00000017: 000C-0000-0000-0000 [PlatID = 3]
MSR 0000001B: 0000-0000-FEE0-0C00
MSR 0000002A: 0000-0000-0000-0000
MSR 00000035: 0000-0000-0008-0008
MSR 00000048: 0000-0000-0000-0001
MSR 00000049: < FAILED >
MSR 0000008B: 0000-001A-0000-0000
MSR 000000CD: < FAILED >
MSR 000000CE: 0804-083B-F081-1300 [eD = 0]
MSR 000000E7: 0000-0320-7F1A-5BF0
MSR 000000E8: 0000-043F-EA3D-ABB8
MSR 000000EE: < FAILED >
MSR 0000010A: 0000-0000-1580-FD6B
MSR 0000010B: < FAILED >
MSR 0000011E: < FAILED >
MSR 00000194: 0000-0000-0011-0000
MSR 00000198: 0000-27A6-0000-2700
MSR 00000199: 0000-0000-0000-1300
MSR 0000019A: 0000-0000-0000-0000
MSR 0000019B: 0000-0000-0000-0010
MSR 0000019C: 0000-0000-8836-2000
MSR 0000019D: 0000-0000-0000-0000
MSR 000001A0: 0000-0000-0085-0089
MSR 000001A2: 0000-0000-8069-0000
MSR 000001A4: 0000-0000-0000-0000
MSR 000001AA: 0000-0000-0000-30C2
MSR 000001AC: < FAILED >
MSR 000001AD: 1E1F-2021-2323-2527
MSR 000001AE: 0807-0605-0403-0201
MSR 000001AF: < FAILED >
MSR 000001B0: 0000-0000-0000-0006
MSR 000001B1: 0000-0000-8831-0000
MSR 000001B2: 0000-0000-0000-0000
MSR 000001FC: 0000-0000-00E4-005B
MSR 00000300: < FAILED >
MSR 0000030A: 0000-0000-0000-0000
MSR 0000030B: 0000-0000-0000-0000
MSR 00000480: 03DA-0500-0000-0013
MSR 00000481: 0000-00FF-0000-0016
MSR 00000482: FFFB-FFFE-0401-E172
MSR 00000483: F77F-FFFF-0003-6DFF
MSR 00000484: 0076-FFFF-0000-11FF
MSR 00000485: 0000-0000-7004-C1E7
MSR 00000486: 0000-0000-8000-0021
MSR 00000487: 0000-0000-FFFF-FFFF
MSR 00000488: 0000-0000-0000-2000
MSR 00000489: 0000-0000-01FF-6FFF
MSR 0000048A: 0000-0000-0000-002E
MSR 0000048B: 075D-7FFF-0000-0000
MSR 0000048C: 0000-0F01-06F3-4141
MSR 0000048D: 0000-00FF-0000-0016
MSR 0000048E: FFFB-FFFE-0400-6172
MSR 0000048F: F77F-FFFF-0003-6DFB
MSR 00000490: 0076-FFFF-0000-11FB
MSR 00000601: 0000-0000-0000-01E0
MSR 00000602: < FAILED >
MSR 00000603: 0036-0000-0036-3636
MSR 00000604: < FAILED >
MSR 00000606: 0000-0000-000A-0E03
MSR 0000060A: 0000-0000-0000-0000
MSR 0000060B: 0000-0000-0000-0000
MSR 0000060C: 0000-0000-0000-0000
MSR 0000060D: 0000-01FA-8555-6C14
MSR 00000610: 0042-8118-0099-80E0
MSR 00000611: 0000-0000-3D5F-963F
MSR 00000613: 0000-0000-0000-0000
MSR 00000614: 0000-0000-0000-0078
MSR 00000618: 0000-0000-0000-0000
MSR 00000619: 0000-0000-0000-0000
MSR 0000061B: 0000-0000-0000-0000
MSR 0000061C: < FAILED >
MSR 0000061E: < FAILED >
MSR 00000620: 0000-0000-0000-0421
MSR 00000621: 0000-0000-0000-0021
MSR 00000638: 0000-0000-0000-0000
MSR 00000639: 0000-0000-176A-612C
MSR 0000063A: 0000-0000-0000-0009
MSR 0000063B: < FAILED >
MSR 00000640: 0000-0000-0000-0000
MSR 00000641: 0000-0000-003E-BCD9
MSR 00000642: 0000-0000-0000-000D
MSR 00000648: 0000-0000-0000-0013
MSR 00000649: 0000-0000-000A-0048
MSR 0000064A: 0000-0000-0000-0000
MSR 0000064B: 0000-0000-0000-0000
MSR 0000064C: 0000-0000-0000-0012
MSR 00000660: 0000-01A5-2347-9236
MSR 00000661: < FAILED >
MSR 00000662: < FAILED >
MSR 00000663: < FAILED >
MSR 00000664: 0000-0569-53C5-F581
MSR 00000665: < FAILED >
MSR 00000666: < FAILED >
MSR 00000667: < FAILED >
MSR 00000668: < FAILED >
MSR 00000669: < FAILED >
MSR 0000066A: < FAILED >
MSR 0000066B: < FAILED >
MSR 0000066C: < FAILED >
MSR 0000066D: < FAILED >
MSR 0000066E: < FAILED >
MSR 0000066F: < FAILED >
MSR 00000670: < FAILED >
MSR 00000671: < FAILED >
MSR 00000672: < FAILED >
MSR 00000673: < FAILED >
MSR 00000674: < FAILED >
MSR 00000675: < FAILED >
MSR 00000676: < FAILED >
MSR 00000677: < FAILED >
MSR 00000690: < FAILED >
MSR 000006B0: 0000-0000-0100-0000
MSR 000006B1: 0000-0000-0100-0000
MSR 00000770: 0000-0000-0000-0001
MSR 00000771: 0000-0000-0110-1327
MSR 00000772: 0000-019E-0000-2713
MSR 00000773: 0000-0000-0000-0005
MSR 00000774: 0000-0400-0027-2713
MSR 00000777: 0000-0000-0000-0004
MSR 00000832: 0000-0000-0002-00D1
MSR 00000838: 0000-0000-0000-012B
MSR 00000839: 0000-0000-0000-00EB
MSR 0000083E: 0000-0000-0000-000A

------[ MSR Registers / Logical CPU #5 ]------

MSR 00000017: 000C-0000-0000-0000 [PlatID = 3]
MSR 0000001B: 0000-0000-FEE0-0C00
MSR 0000002A: 0000-0000-0000-0000
MSR 00000035: 0000-0000-0008-0008
MSR 00000048: 0000-0000-0000-0001
MSR 00000049: < FAILED >
MSR 0000008B: 0000-001A-0000-0000
MSR 000000CD: < FAILED >
MSR 000000CE: 0804-083B-F081-1300 [eD = 0]
MSR 000000E7: 0000-01E4-78F9-FCAC
MSR 000000E8: 0000-029A-7A3A-F6A3
MSR 000000EE: < FAILED >
MSR 0000010A: 0000-0000-1580-FD6B
MSR 0000010B: < FAILED >
MSR 0000011E: < FAILED >
MSR 00000194: 0000-0000-0011-0000
MSR 00000198: 0000-27AE-0000-2700
MSR 00000199: 0000-0000-0000-1300
MSR 0000019A: 0000-0000-0000-0000
MSR 0000019B: 0000-0000-0000-0010
MSR 0000019C: 0000-0000-8834-2000
MSR 0000019D: 0000-0000-0000-0000
MSR 000001A0: 0000-0000-0085-0089
MSR 000001A2: 0000-0000-8069-0000
MSR 000001A4: 0000-0000-0000-0000
MSR 000001AA: 0000-0000-0000-30C2
MSR 000001AC: < FAILED >
MSR 000001AD: 1E1F-2021-2323-2527
MSR 000001AE: 0807-0605-0403-0201
MSR 000001AF: < FAILED >
MSR 000001B0: 0000-0000-0000-0006
MSR 000001B1: 0000-0000-8831-0000
MSR 000001B2: 0000-0000-0000-0000
MSR 000001FC: 0000-0000-00E4-005B
MSR 00000300: < FAILED >
MSR 0000030A: 0000-0000-0000-0000
MSR 0000030B: 0000-0000-0000-0000
MSR 00000480: 03DA-0500-0000-0013
MSR 00000481: 0000-00FF-0000-0016
MSR 00000482: FFFB-FFFE-0401-E172
MSR 00000483: F77F-FFFF-0003-6DFF
MSR 00000484: 0076-FFFF-0000-11FF
MSR 00000485: 0000-0000-7004-C1E7
MSR 00000486: 0000-0000-8000-0021
MSR 00000487: 0000-0000-FFFF-FFFF
MSR 00000488: 0000-0000-0000-2000
MSR 00000489: 0000-0000-01FF-6FFF
MSR 0000048A: 0000-0000-0000-002E
MSR 0000048B: 075D-7FFF-0000-0000
MSR 0000048C: 0000-0F01-06F3-4141
MSR 0000048D: 0000-00FF-0000-0016
MSR 0000048E: FFFB-FFFE-0400-6172
MSR 0000048F: F77F-FFFF-0003-6DFB
MSR 00000490: 0076-FFFF-0000-11FB
MSR 00000601: 0000-0000-0000-01E0
MSR 00000602: < FAILED >
MSR 00000603: 0036-0000-0036-3636
MSR 00000604: < FAILED >
MSR 00000606: 0000-0000-000A-0E03
MSR 0000060A: 0000-0000-0000-0000
MSR 0000060B: 0000-0000-0000-0000
MSR 0000060C: 0000-0000-0000-0000
MSR 0000060D: 0000-01FA-8555-6C14
MSR 00000610: 0042-8118-0099-80E0
MSR 00000611: 0000-0000-3D5F-96E6
MSR 00000613: 0000-0000-0000-0000
MSR 00000614: 0000-0000-0000-0078
MSR 00000618: 0000-0000-0000-0000
MSR 00000619: 0000-0000-0000-0000
MSR 0000061B: 0000-0000-0000-0000
MSR 0000061C: < FAILED >
MSR 0000061E: < FAILED >
MSR 00000620: 0000-0000-0000-0421
MSR 00000621: 0000-0000-0000-0021
MSR 00000638: 0000-0000-0000-0000
MSR 00000639: 0000-0000-176A-618E
MSR 0000063A: 0000-0000-0000-0009
MSR 0000063B: < FAILED >
MSR 00000640: 0000-0000-0000-0000
MSR 00000641: 0000-0000-003E-BCD9
MSR 00000642: 0000-0000-0000-000D
MSR 00000648: 0000-0000-0000-0013
MSR 00000649: 0000-0000-000A-0048
MSR 0000064A: 0000-0000-0000-0000
MSR 0000064B: 0000-0000-0000-0000
MSR 0000064C: 0000-0000-0000-0012
MSR 00000660: 0000-00E8-FD55-B209
MSR 00000661: < FAILED >
MSR 00000662: < FAILED >
MSR 00000663: < FAILED >
MSR 00000664: 0000-0569-53C5-F581
MSR 00000665: < FAILED >
MSR 00000666: < FAILED >
MSR 00000667: < FAILED >
MSR 00000668: < FAILED >
MSR 00000669: < FAILED >
MSR 0000066A: < FAILED >
MSR 0000066B: < FAILED >
MSR 0000066C: < FAILED >
MSR 0000066D: < FAILED >
MSR 0000066E: < FAILED >
MSR 0000066F: < FAILED >
MSR 00000670: < FAILED >
MSR 00000671: < FAILED >
MSR 00000672: < FAILED >
MSR 00000673: < FAILED >
MSR 00000674: < FAILED >
MSR 00000675: < FAILED >
MSR 00000676: < FAILED >
MSR 00000677: < FAILED >
MSR 00000690: < FAILED >
MSR 000006B0: 0000-0000-0100-0000
MSR 000006B1: 0000-0000-0100-0000
MSR 00000770: 0000-0000-0000-0001
MSR 00000771: 0000-0000-0111-1327
MSR 00000772: 0000-019E-0000-2713
MSR 00000773: 0000-0000-0000-0005
MSR 00000774: 0000-0400-0027-2713
MSR 00000777: 0000-0000-0000-0004
MSR 00000832: 0000-0000-0002-00D1
MSR 00000838: 0000-0000-0000-012B
MSR 00000839: 0000-0000-0000-0068
MSR 0000083E: 0000-0000-0000-000A

------[ MSR Registers / Logical CPU #6 ]------

MSR 00000017: 000C-0000-0000-0000 [PlatID = 3]
MSR 0000001B: 0000-0000-FEE0-0C00
MSR 0000002A: 0000-0000-0000-0000
MSR 00000035: 0000-0000-0008-0008
MSR 00000048: 0000-0000-0000-0001
MSR 00000049: < FAILED >
MSR 0000008B: 0000-001A-0000-0000
MSR 000000CD: < FAILED >
MSR 000000CE: 0804-083B-F081-1300 [eD = 0]
MSR 000000E7: 0000-0116-F484-2AB8
MSR 000000E8: 0000-019A-71F5-C721
MSR 000000EE: < FAILED >
MSR 0000010A: 0000-0000-1580-FD6B
MSR 0000010B: < FAILED >
MSR 0000011E: < FAILED >
MSR 00000194: 0000-0000-0011-0000
MSR 00000198: 0000-27AC-0000-2700
MSR 00000199: 0000-0000-0000-1300
MSR 0000019A: 0000-0000-0000-0000
MSR 0000019B: 0000-0000-0000-0010
MSR 0000019C: 0000-0000-8834-2000
MSR 0000019D: 0000-0000-0000-0000
MSR 000001A0: 0000-0000-0085-0089
MSR 000001A2: 0000-0000-8069-0000
MSR 000001A4: 0000-0000-0000-0000
MSR 000001AA: 0000-0000-0000-30C2
MSR 000001AC: < FAILED >
MSR 000001AD: 1E1F-2021-2323-2527
MSR 000001AE: 0807-0605-0403-0201
MSR 000001AF: < FAILED >
MSR 000001B0: 0000-0000-0000-0006
MSR 000001B1: 0000-0000-8831-0000
MSR 000001B2: 0000-0000-0000-0000
MSR 000001FC: 0000-0000-00E4-005B
MSR 00000300: < FAILED >
MSR 0000030A: 0000-0000-0000-0000
MSR 0000030B: 0000-0000-0000-0000
MSR 00000480: 03DA-0500-0000-0013
MSR 00000481: 0000-00FF-0000-0016
MSR 00000482: FFFB-FFFE-0401-E172
MSR 00000483: F77F-FFFF-0003-6DFF
MSR 00000484: 0076-FFFF-0000-11FF
MSR 00000485: 0000-0000-7004-C1E7
MSR 00000486: 0000-0000-8000-0021
MSR 00000487: 0000-0000-FFFF-FFFF
MSR 00000488: 0000-0000-0000-2000
MSR 00000489: 0000-0000-01FF-6FFF
MSR 0000048A: 0000-0000-0000-002E
MSR 0000048B: 075D-7FFF-0000-0000
MSR 0000048C: 0000-0F01-06F3-4141
MSR 0000048D: 0000-00FF-0000-0016
MSR 0000048E: FFFB-FFFE-0400-6172
MSR 0000048F: F77F-FFFF-0003-6DFB
MSR 00000490: 0076-FFFF-0000-11FB
MSR 00000601: 0000-0000-0000-01E0
MSR 00000602: < FAILED >
MSR 00000603: 0036-0000-0036-3636
MSR 00000604: < FAILED >
MSR 00000606: 0000-0000-000A-0E03
MSR 0000060A: 0000-0000-0000-0000
MSR 0000060B: 0000-0000-0000-0000
MSR 0000060C: 0000-0000-0000-0000
MSR 0000060D: 0000-01FA-8555-6C14
MSR 00000610: 0042-8118-0099-80E0
MSR 00000611: 0000-0000-3D5F-97C0
MSR 00000613: 0000-0000-0000-0000
MSR 00000614: 0000-0000-0000-0078
MSR 00000618: 0000-0000-0000-0000
MSR 00000619: 0000-0000-0000-0000
MSR 0000061B: 0000-0000-0000-0000
MSR 0000061C: < FAILED >
MSR 0000061E: < FAILED >
MSR 00000620: 0000-0000-0000-0421
MSR 00000621: 0000-0000-0000-0021
MSR 00000638: 0000-0000-0000-0000
MSR 00000639: 0000-0000-176A-620E
MSR 0000063A: 0000-0000-0000-0009
MSR 0000063B: < FAILED >
MSR 00000640: 0000-0000-0000-0000
MSR 00000641: 0000-0000-003E-BCD9
MSR 00000642: 0000-0000-0000-000D
MSR 00000648: 0000-0000-0000-0013
MSR 00000649: 0000-0000-000A-0048
MSR 0000064A: 0000-0000-0000-0000
MSR 0000064B: 0000-0000-0000-0000
MSR 0000064C: 0000-0000-0000-0012
MSR 00000660: 0000-0077-C44E-CC2B
MSR 00000661: < FAILED >
MSR 00000662: < FAILED >
MSR 00000663: < FAILED >
MSR 00000664: 0000-0569-53C5-F581
MSR 00000665: < FAILED >
MSR 00000666: < FAILED >
MSR 00000667: < FAILED >
MSR 00000668: < FAILED >
MSR 00000669: < FAILED >
MSR 0000066A: < FAILED >
MSR 0000066B: < FAILED >
MSR 0000066C: < FAILED >
MSR 0000066D: < FAILED >
MSR 0000066E: < FAILED >
MSR 0000066F: < FAILED >
MSR 00000670: < FAILED >
MSR 00000671: < FAILED >
MSR 00000672: < FAILED >
MSR 00000673: < FAILED >
MSR 00000674: < FAILED >
MSR 00000675: < FAILED >
MSR 00000676: < FAILED >
MSR 00000677: < FAILED >
MSR 00000690: < FAILED >
MSR 000006B0: 0000-0000-0100-0000
MSR 000006B1: 0000-0000-0100-0000
MSR 00000770: 0000-0000-0000-0001
MSR 00000771: 0000-0000-0112-1327
MSR 00000772: 0000-019E-0000-2713
MSR 00000773: 0000-0000-0000-0005
MSR 00000774: 0000-0400-0027-2713
MSR 00000777: 0000-0000-0000-0004
MSR 00000832: 0000-0000-0000-00D1
MSR 00000838: 0000-0000-0000-0258
MSR 00000839: 0000-0000-0000-0226
MSR 0000083E: 0000-0000-0000-000A

------[ MSR Registers / Logical CPU #7 ]------

MSR 00000017: 000C-0000-0000-0000 [PlatID = 3]
MSR 0000001B: 0000-0000-FEE0-0C00
MSR 0000002A: 0000-0000-0000-0000
MSR 00000035: 0000-0000-0008-0008
MSR 00000048: 0000-0000-0000-0001
MSR 00000049: < FAILED >
MSR 0000008B: 0000-001A-0000-0000
MSR 000000CD: < FAILED >
MSR 000000CE: 0804-083B-F081-1300 [eD = 0]
MSR 000000E7: 0000-00FA-A513-D118
MSR 000000E8: 0000-0178-6949-E90E
MSR 000000EE: < FAILED >
MSR 0000010A: 0000-0000-1580-FD6B
MSR 0000010B: < FAILED >
MSR 0000011E: < FAILED >
MSR 00000194: 0000-0000-0011-0000
MSR 00000198: 0000-279D-0000-2700
MSR 00000199: 0000-0000-0000-1300
MSR 0000019A: 0000-0000-0000-0000
MSR 0000019B: 0000-0000-0000-0010
MSR 0000019C: 0000-0000-8834-2000
MSR 0000019D: 0000-0000-0000-0000
MSR 000001A0: 0000-0000-0085-0089
MSR 000001A2: 0000-0000-8069-0000
MSR 000001A4: 0000-0000-0000-0000
MSR 000001AA: 0000-0000-0000-30C2
MSR 000001AC: < FAILED >
MSR 000001AD: 1E1F-2021-2323-2527
MSR 000001AE: 0807-0605-0403-0201
MSR 000001AF: < FAILED >
MSR 000001B0: 0000-0000-0000-0006
MSR 000001B1: 0000-0000-8831-0000
MSR 000001B2: 0000-0000-0000-0000
MSR 000001FC: 0000-0000-00E4-005B
MSR 00000300: < FAILED >
MSR 0000030A: 0000-0000-0000-0000
MSR 0000030B: 0000-0000-0000-0000
MSR 00000480: 03DA-0500-0000-0013
MSR 00000481: 0000-00FF-0000-0016
MSR 00000482: FFFB-FFFE-0401-E172
MSR 00000483: F77F-FFFF-0003-6DFF
MSR 00000484: 0076-FFFF-0000-11FF
MSR 00000485: 0000-0000-7004-C1E7
MSR 00000486: 0000-0000-8000-0021
MSR 00000487: 0000-0000-FFFF-FFFF
MSR 00000488: 0000-0000-0000-2000
MSR 00000489: 0000-0000-01FF-6FFF
MSR 0000048A: 0000-0000-0000-002E
MSR 0000048B: 075D-7FFF-0000-0000
MSR 0000048C: 0000-0F01-06F3-4141
MSR 0000048D: 0000-00FF-0000-0016
MSR 0000048E: FFFB-FFFE-0400-6172
MSR 0000048F: F77F-FFFF-0003-6DFB
MSR 00000490: 0076-FFFF-0000-11FB
MSR 00000601: 0000-0000-0000-01E0
MSR 00000602: < FAILED >
MSR 00000603: 0036-0000-0036-3636
MSR 00000604: < FAILED >
MSR 00000606: 0000-0000-000A-0E03
MSR 0000060A: 0000-0000-0000-0000
MSR 0000060B: 0000-0000-0000-0000
MSR 0000060C: 0000-0000-0000-0000
MSR 0000060D: 0000-01FA-8555-6C14
MSR 00000610: 0042-8118-0099-80E0
MSR 00000611: 0000-0000-3D5F-986F
MSR 00000613: 0000-0000-0000-0000
MSR 00000614: 0000-0000-0000-0078
MSR 00000618: 0000-0000-0000-0000
MSR 00000619: 0000-0000-0000-0000
MSR 0000061B: 0000-0000-0000-0000
MSR 0000061C: < FAILED >
MSR 0000061E: < FAILED >
MSR 00000620: 0000-0000-0000-0421
MSR 00000621: 0000-0000-0000-0021
MSR 00000638: 0000-0000-0000-0000
MSR 00000639: 0000-0000-176A-6278
MSR 0000063A: 0000-0000-0000-0009
MSR 0000063B: < FAILED >
MSR 00000640: 0000-0000-0000-0000
MSR 00000641: 0000-0000-003E-BCD9
MSR 00000642: 0000-0000-0000-000D
MSR 00000648: 0000-0000-0000-0013
MSR 00000649: 0000-0000-000A-0048
MSR 0000064A: 0000-0000-0000-0000
MSR 0000064B: 0000-0000-0000-0000
MSR 0000064C: 0000-0000-0000-0012
MSR 00000660: 0000-0081-242A-3AB6
MSR 00000661: < FAILED >
MSR 00000662: < FAILED >
MSR 00000663: < FAILED >
MSR 00000664: 0000-0569-53C5-F581
MSR 00000665: < FAILED >
MSR 00000666: < FAILED >
MSR 00000667: < FAILED >
MSR 00000668: < FAILED >
MSR 00000669: < FAILED >
MSR 0000066A: < FAILED >
MSR 0000066B: < FAILED >
MSR 0000066C: < FAILED >
MSR 0000066D: < FAILED >
MSR 0000066E: < FAILED >
MSR 0000066F: < FAILED >
MSR 00000670: < FAILED >
MSR 00000671: < FAILED >
MSR 00000672: < FAILED >
MSR 00000673: < FAILED >
MSR 00000674: < FAILED >
MSR 00000675: < FAILED >
MSR 00000676: < FAILED >
MSR 00000677: < FAILED >
MSR 00000690: < FAILED >
MSR 000006B0: 0000-0000-0100-0000
MSR 000006B1: 0000-0000-0100-0000
MSR 00000770: 0000-0000-0000-0001
MSR 00000771: 0000-0000-0113-1327
MSR 00000772: 0000-019E-0000-2713
MSR 00000773: 0000-0000-0000-0005
MSR 00000774: 0000-0400-0027-2713
MSR 00000777: 0000-0000-0000-0004
MSR 00000832: 0000-0000-0000-00D1
MSR 00000838: 0000-0000-0000-0258
MSR 00000839: 0000-0000-0000-022B
MSR 0000083E: 0000-0000-0000-000A
