------[ Versions ]------

Program Version : EVEREST v4.60.1629 Beta
BenchDLL Version: 2.4.257.0

------[ CPU Info ]------

CPU Type           : 2x QuadCore Intel Xeon E5462, 2800 MHz (7 x 400)
CPU Alias          : Harpertown
CPU Platform       : LGA771 DP
CPU Stepping       : C0/M0
Instruction Set    : x86, x86-64, MMX, SSE, SSE2, SSE3, SSSE3, SSE4.1
CPUID Manufacturer : GenuineIntel
CPUID CPU Name     : Intel(R) Xeon(R) CPU E5462 @ 2.80GHz
CPUID Revision     : 00010676h
IA Brand ID        : 00h  (Unknown)
Platform ID        : 28h  (LGA771 DP)

------[ Logical CPU #0 ]------

allcpu: Valid

CPUID 00000000: 0000000A-756E6547-6C65746E-49656E69
CPUID 00000001: 00010676-00040800-000CE3BD-BFEBFBFF
CPUID 00000002: 05B0B101-005657F0-00000000-2CB4304E
CPUID 00000003: 00000000-00000000-00000000-00000000
CPUID 00000004: 0C000121-01C0003F-0000003F-00000001
CPUID 00000004: 0C000122-01C0003F-0000003F-00000001
CPUID 00000004: 0C004143-05C0003F-00000FFF-00000001
CPUID 00000005: 00000040-00000040-00000003-00002220
CPUID 00000006: 00000001-00000002-00000001-00000000
CPUID 00000007: 00000000-00000000-00000000-00000000
CPUID 00000008: 00000400-00000000-00000000-00000000
CPUID 00000009: 00000000-00000000-00000000-00000000
CPUID 0000000A: 07280202-00000000-00000000-00000503
CPUID 80000000: 80000008-00000000-00000000-00000000
CPUID 80000001: 00000000-00000000-00000001-20100000
CPUID 80000002: 65746E49-2952286C-6F655820-2952286E
CPUID 80000003: 55504320-20202020-20202020-45202020
CPUID 80000004: 32363435-20402020-30382E32-007A4847
CPUID 80000005: 00000000-00000000-00000000-00000000
CPUID 80000006: 00000000-00000000-18008040-00000000
CPUID 80000007: 00000000-00000000-00000000-00000000
CPUID 80000008: 00003026-00000000-00000000-00000000

L1    Data Cache:     32 KB,  8-way Associative, 64-byte Line
L1  Instr. Cache:     32 KB,  8-way Associative, 64-byte Line
L2 Unified Cache:   6144 KB, 24-way Associative, 64-byte Line

------[ Logical CPU #1 ]------

allcpu: Valid

CPUID 00000000: 0000000A-756E6547-6C65746E-49656E69
CPUID 00000001: 00010676-02040800-000CE3BD-BFEBFBFF
CPUID 00000002: 05B0B101-005657F0-00000000-2CB4304E
CPUID 00000003: 00000000-00000000-00000000-00000000
CPUID 00000004: 0C000121-01C0003F-0000003F-00000001
CPUID 00000004: 0C000122-01C0003F-0000003F-00000001
CPUID 00000004: 0C004143-05C0003F-00000FFF-00000001
CPUID 00000005: 00000040-00000040-00000003-00002220
CPUID 00000006: 00000001-00000002-00000001-00000000
CPUID 00000007: 00000000-00000000-00000000-00000000
CPUID 00000008: 00000400-00000000-00000000-00000000
CPUID 00000009: 00000000-00000000-00000000-00000000
CPUID 0000000A: 07280202-00000000-00000000-00000503
CPUID 80000000: 80000008-00000000-00000000-00000000
CPUID 80000001: 00000000-00000000-00000001-20100000
CPUID 80000002: 65746E49-2952286C-6F655820-2952286E
CPUID 80000003: 55504320-20202020-20202020-45202020
CPUID 80000004: 32363435-20402020-30382E32-007A4847
CPUID 80000005: 00000000-00000000-00000000-00000000
CPUID 80000006: 00000000-00000000-18008040-00000000
CPUID 80000007: 00000000-00000000-00000000-00000000
CPUID 80000008: 00003026-00000000-00000000-00000000

L1    Data Cache:     32 KB,  8-way Associative, 64-byte Line
L1  Instr. Cache:     32 KB,  8-way Associative, 64-byte Line
L2 Unified Cache:   6144 KB, 24-way Associative, 64-byte Line

------[ Logical CPU #2 ]------

allcpu: Valid

CPUID 00000000: 0000000A-756E6547-6C65746E-49656E69
CPUID 00000001: 00010676-04040800-000CE3BD-BFEBFBFF
CPUID 00000002: 05B0B101-005657F0-00000000-2CB4304E
CPUID 00000003: 00000000-00000000-00000000-00000000
CPUID 00000004: 0C000121-01C0003F-0000003F-00000001
CPUID 00000004: 0C000122-01C0003F-0000003F-00000001
CPUID 00000004: 0C004143-05C0003F-00000FFF-00000001
CPUID 00000005: 00000040-00000040-00000003-00002220
CPUID 00000006: 00000001-00000002-00000001-00000000
CPUID 00000007: 00000000-00000000-00000000-00000000
CPUID 00000008: 00000400-00000000-00000000-00000000
CPUID 00000009: 00000000-00000000-00000000-00000000
CPUID 0000000A: 07280202-00000000-00000000-00000503
CPUID 80000000: 80000008-00000000-00000000-00000000
CPUID 80000001: 00000000-00000000-00000001-20100000
CPUID 80000002: 65746E49-2952286C-6F655820-2952286E
CPUID 80000003: 55504320-20202020-20202020-45202020
CPUID 80000004: 32363435-20402020-30382E32-007A4847
CPUID 80000005: 00000000-00000000-00000000-00000000
CPUID 80000006: 00000000-00000000-18008040-00000000
CPUID 80000007: 00000000-00000000-00000000-00000000
CPUID 80000008: 00003026-00000000-00000000-00000000

L1    Data Cache:     32 KB,  8-way Associative, 64-byte Line
L1  Instr. Cache:     32 KB,  8-way Associative, 64-byte Line
L2 Unified Cache:   6144 KB, 24-way Associative, 64-byte Line

------[ Logical CPU #3 ]------

allcpu: Valid

CPUID 00000000: 0000000A-756E6547-6C65746E-49656E69
CPUID 00000001: 00010676-06040800-000CE3BD-BFEBFBFF
CPUID 00000002: 05B0B101-005657F0-00000000-2CB4304E
CPUID 00000003: 00000000-00000000-00000000-00000000
CPUID 00000004: 0C000121-01C0003F-0000003F-00000001
CPUID 00000004: 0C000122-01C0003F-0000003F-00000001
CPUID 00000004: 0C004143-05C0003F-00000FFF-00000001
CPUID 00000005: 00000040-00000040-00000003-00002220
CPUID 00000006: 00000001-00000002-00000001-00000000
CPUID 00000007: 00000000-00000000-00000000-00000000
CPUID 00000008: 00000400-00000000-00000000-00000000
CPUID 00000009: 00000000-00000000-00000000-00000000
CPUID 0000000A: 07280202-00000000-00000000-00000503
CPUID 80000000: 80000008-00000000-00000000-00000000
CPUID 80000001: 00000000-00000000-00000001-20100000
CPUID 80000002: 65746E49-2952286C-6F655820-2952286E
CPUID 80000003: 55504320-20202020-20202020-45202020
CPUID 80000004: 32363435-20402020-30382E32-007A4847
CPUID 80000005: 00000000-00000000-00000000-00000000
CPUID 80000006: 00000000-00000000-18008040-00000000
CPUID 80000007: 00000000-00000000-00000000-00000000
CPUID 80000008: 00003026-00000000-00000000-00000000

L1    Data Cache:     32 KB,  8-way Associative, 64-byte Line
L1  Instr. Cache:     32 KB,  8-way Associative, 64-byte Line
L2 Unified Cache:   6144 KB, 24-way Associative, 64-byte Line

------[ Logical CPU #4 ]------

allcpu: Valid

CPUID 00000000: 0000000A-756E6547-6C65746E-49656E69
CPUID 00000001: 00010676-01040800-000CE3BD-BFEBFBFF
CPUID 00000002: 05B0B101-005657F0-00000000-2CB4304E
CPUID 00000003: 00000000-00000000-00000000-00000000
CPUID 00000004: 0C000121-01C0003F-0000003F-00000001
CPUID 00000004: 0C000122-01C0003F-0000003F-00000001
CPUID 00000004: 0C004143-05C0003F-00000FFF-00000001
CPUID 00000005: 00000040-00000040-00000003-00002220
CPUID 00000006: 00000001-00000002-00000001-00000000
CPUID 00000007: 00000000-00000000-00000000-00000000
CPUID 00000008: 00000400-00000000-00000000-00000000
CPUID 00000009: 00000000-00000000-00000000-00000000
CPUID 0000000A: 07280202-00000000-00000000-00000503
CPUID 80000000: 80000008-00000000-00000000-00000000
CPUID 80000001: 00000000-00000000-00000001-20100000
CPUID 80000002: 65746E49-2952286C-6F655820-2952286E
CPUID 80000003: 55504320-20202020-20202020-45202020
CPUID 80000004: 32363435-20402020-30382E32-007A4847
CPUID 80000005: 00000000-00000000-00000000-00000000
CPUID 80000006: 00000000-00000000-18008040-00000000
CPUID 80000007: 00000000-00000000-00000000-00000000
CPUID 80000008: 00003026-00000000-00000000-00000000

L1    Data Cache:     32 KB,  8-way Associative, 64-byte Line
L1  Instr. Cache:     32 KB,  8-way Associative, 64-byte Line
L2 Unified Cache:   6144 KB, 24-way Associative, 64-byte Line

------[ Logical CPU #5 ]------

allcpu: Valid

CPUID 00000000: 0000000A-756E6547-6C65746E-49656E69
CPUID 00000001: 00010676-03040800-000CE3BD-BFEBFBFF
CPUID 00000002: 05B0B101-005657F0-00000000-2CB4304E
CPUID 00000003: 00000000-00000000-00000000-00000000
CPUID 00000004: 0C000121-01C0003F-0000003F-00000001
CPUID 00000004: 0C000122-01C0003F-0000003F-00000001
CPUID 00000004: 0C004143-05C0003F-00000FFF-00000001
CPUID 00000005: 00000040-00000040-00000003-00002220
CPUID 00000006: 00000001-00000002-00000001-00000000
CPUID 00000007: 00000000-00000000-00000000-00000000
CPUID 00000008: 00000400-00000000-00000000-00000000
CPUID 00000009: 00000000-00000000-00000000-00000000
CPUID 0000000A: 07280202-00000000-00000000-00000503
CPUID 80000000: 80000008-00000000-00000000-00000000
CPUID 80000001: 00000000-00000000-00000001-20100000
CPUID 80000002: 65746E49-2952286C-6F655820-2952286E
CPUID 80000003: 55504320-20202020-20202020-45202020
CPUID 80000004: 32363435-20402020-30382E32-007A4847
CPUID 80000005: 00000000-00000000-00000000-00000000
CPUID 80000006: 00000000-00000000-18008040-00000000
CPUID 80000007: 00000000-00000000-00000000-00000000
CPUID 80000008: 00003026-00000000-00000000-00000000

L1    Data Cache:     32 KB,  8-way Associative, 64-byte Line
L1  Instr. Cache:     32 KB,  8-way Associative, 64-byte Line
L2 Unified Cache:   6144 KB, 24-way Associative, 64-byte Line

------[ Logical CPU #6 ]------

allcpu: Valid

CPUID 00000000: 0000000A-756E6547-6C65746E-49656E69
CPUID 00000001: 00010676-05040800-000CE3BD-BFEBFBFF
CPUID 00000002: 05B0B101-005657F0-00000000-2CB4304E
CPUID 00000003: 00000000-00000000-00000000-00000000
CPUID 00000004: 0C000121-01C0003F-0000003F-00000001
CPUID 00000004: 0C000122-01C0003F-0000003F-00000001
CPUID 00000004: 0C004143-05C0003F-00000FFF-00000001
CPUID 00000005: 00000040-00000040-00000003-00002220
CPUID 00000006: 00000001-00000002-00000001-00000000
CPUID 00000007: 00000000-00000000-00000000-00000000
CPUID 00000008: 00000400-00000000-00000000-00000000
CPUID 00000009: 00000000-00000000-00000000-00000000
CPUID 0000000A: 07280202-00000000-00000000-00000503
CPUID 80000000: 80000008-00000000-00000000-00000000
CPUID 80000001: 00000000-00000000-00000001-20100000
CPUID 80000002: 65746E49-2952286C-6F655820-2952286E
CPUID 80000003: 55504320-20202020-20202020-45202020
CPUID 80000004: 32363435-20402020-30382E32-007A4847
CPUID 80000005: 00000000-00000000-00000000-00000000
CPUID 80000006: 00000000-00000000-18008040-00000000
CPUID 80000007: 00000000-00000000-00000000-00000000
CPUID 80000008: 00003026-00000000-00000000-00000000

L1    Data Cache:     32 KB,  8-way Associative, 64-byte Line
L1  Instr. Cache:     32 KB,  8-way Associative, 64-byte Line
L2 Unified Cache:   6144 KB, 24-way Associative, 64-byte Line

------[ Logical CPU #7 ]------

allcpu: Valid

CPUID 00000000: 0000000A-756E6547-6C65746E-49656E69
CPUID 00000001: 00010676-07040800-000CE3BD-BFEBFBFF
CPUID 00000002: 05B0B101-005657F0-00000000-2CB4304E
CPUID 00000003: 00000000-00000000-00000000-00000000
CPUID 00000004: 0C000121-01C0003F-0000003F-00000001
CPUID 00000004: 0C000122-01C0003F-0000003F-00000001
CPUID 00000004: 0C004143-05C0003F-00000FFF-00000001
CPUID 00000005: 00000040-00000040-00000003-00002220
CPUID 00000006: 00000001-00000002-00000001-00000000
CPUID 00000007: 00000000-00000000-00000000-00000000
CPUID 00000008: 00000400-00000000-00000000-00000000
CPUID 00000009: 00000000-00000000-00000000-00000000
CPUID 0000000A: 07280202-00000000-00000000-00000503
CPUID 80000000: 80000008-00000000-00000000-00000000
CPUID 80000001: 00000000-00000000-00000001-20100000
CPUID 80000002: 65746E49-2952286C-6F655820-2952286E
CPUID 80000003: 55504320-20202020-20202020-45202020
CPUID 80000004: 32363435-20402020-30382E32-007A4847
CPUID 80000005: 00000000-00000000-00000000-00000000
CPUID 80000006: 00000000-00000000-18008040-00000000
CPUID 80000007: 00000000-00000000-00000000-00000000
CPUID 80000008: 00003026-00000000-00000000-00000000

L1    Data Cache:     32 KB,  8-way Associative, 64-byte Line
L1  Instr. Cache:     32 KB,  8-way Associative, 64-byte Line
L2 Unified Cache:   6144 KB, 24-way Associative, 64-byte Line

------[ MSR Registers ]------

MSR 00000017: 0018-0000-8064-0720 [PlatID = 6]
MSR 0000001B: 0000-0000-FEE0-0900
MSR 0000002A: 0000-0000-C1C8-149E
MSR 0000008B: 0000-0000-0000-0000
MSR 000000CD: 0000-0000-0000-080E
MSR 000000CE: 001A-0720-7F7F-0713
MSR 000000E7: 0000-0044-317A-A23D
MSR 000000E8: 0000-0044-317A-C361
MSR 000000EE: 0400-0000-877C-4B01
MSR 0000011E: 0000-0000-BE70-2111
MSR 00000198: 0720-0720-0600-0720
MSR 00000199: 0000-0000-0000-0720
MSR 0000019A: 0000-0000-0000-0002
MSR 0000019B: 0000-0000-0000-0000
MSR 0000019C: 0000-0000-8846-0000
MSR 0000019D: 0000-0000-0000-061A
MSR 000001A0: 0000-0040-60B4-2489

PerformanceFrequency = 2793030000

Tjmax Temperature = 85 Celsius
