------[ Versions ]------

Program Version : AIDA64 Engineer v6.60.5900
BenchDLL Version: 4.5.865.8-x64
Windows Version : Microsoft Windows 10 Enterprise 10.0.19043.1348 (64-bit)
GetProductInfo  : 0x00000004

------[ CPU Info ]------

CPU Type          : HexaCore Intel Xeon W3670, 3200 MHz (24 x 133)
CPU Alias         : Gulftown
CPU Platform      : LGA1366
CPU Stepping      : B1
Instruction Set   : x86, x86-64, MMX, SSE, SSE2, SSE3, SSSE3, SSE4.1, SSE4.2, AES
CPUID Manufacturer: GenuineIntel
CPUID CPU Name    : Intel(R) Xeon(R) CPU W3670 @ 3.20GHz
CPUID Revision    : 000206C2h
IA Brand ID       : 00h  (Unknown)
Platform ID       : 53h  (LGA1366)
HTT / CMP Units   : 2 / 6
Max. NUMA Node    : 0

Tjmax Temperature          : 101 Celsius
HTC Temperature Limit      : 0 Celsius
CPU TDP                    : 130 W
CPU TDC                    : 110 A
Max Turbo Boost Multipliers: 1C: 26x, 2C: 26x, 3C: 25x, 4C: 25x, 5C: 25x, 6C: 25x

------[ Motherboard Info ]------

Motherboard ID      : <DMI>
Motherboard Model   : Lenovo 4105J6G
Motherboard Chipset : Intel Tylersburg X58, Intel Westmere

DMI MB Manufacturer : LENOVO
DMI MB Product      : LENOVO
DMI MB Version      : NONE
DMI MB Serial       : NONE
DMI SYS Manufacturer: LENOVO
DMI SYS Product     : 4105J6G
DMI SYS Version     : ThinkStation XXXX
DMI SYS Serial      : S4HVR52
DMI BIOS Version    : 60KT47AUS


------[ CPUID Registers / Logical CPU #0 ]------

allcpu: Package 0 / Core 0 / Thread 0: Valid

CPUID 00000000: 0000000B-756E6547-6C65746E-49656E69 [GenuineIntel]
CPUID 00000001: 000206C2-00200800-029EE3FF-BFEBFBFF
CPUID 00000002: 55035A01-00F0B2FF-00000000-00CA0000
CPUID 00000003: 00000000-00000000-00000000-00000000
CPUID 00000004: 3C004121-01C0003F-0000003F-00000000 [SL 00] [L1D: 32 KB]
CPUID 00000004: 3C004122-00C0003F-0000007F-00000000 [SL 01] [L1I: 32 KB]
CPUID 00000004: 3C004143-01C0003F-000001FF-00000000 [SL 02] [L2U: 256 KB]
CPUID 00000004: 3C07C163-03C0003F-00002FFF-00000002 [SL 03] [L3U: 12 MB]
CPUID 00000005: 00000040-00000040-00000003-00001120
CPUID 00000006: 00000005-00000002-00000009-00000000
CPUID 00000007: 00000000-00000000-00000000-9C000000 [SL 00]
CPUID 00000008: 00000000-00000000-00000000-00000000
CPUID 00000009: 00000000-00000000-00000000-00000000
CPUID 0000000A: 07300403-00000004-00000000-00000603
CPUID 0000000B: 00000001-00000002-00000100-00000000 [SL 00]
CPUID 0000000B: 00000005-0000000C-00000201-00000000 [SL 01]
CPUID 80000000: 80000008-00000000-00000000-00000000
CPUID 80000001: 00000000-00000000-00000001-2C100000
CPUID 80000002: 65746E49-2952286C-6F655820-2952286E [Intel(R) Xeon(R)]
CPUID 80000003: 55504320-20202020-20202020-57202020 [ CPU           W]
CPUID 80000004: 30373633-20402020-30322E33-007A4847 [3670  @ 3.20GHz]
CPUID 80000005: 00000000-00000000-00000000-00000000 [L1D: 0 KB / L1I: 0 KB]
CPUID 80000006: 00000000-00000000-01006040-00000000 [L2: 256 KB] / L3: 0 KB]
CPUID 80000007: 00000000-00000000-00000000-00000100
CPUID 80000008: 00003024-00000000-00000000-00000000

L1    Data Cache:    32 KB,  8-way Associative, 64-byte Line
L1  Instr. Cache:    32 KB,  4-way Associative, 64-byte Line
L2 Unified Cache:   256 KB,  8-way Associative, 64-byte Line
L3 Unified Cache:    12 MB, 16-way Associative, 64-byte Line

------[ CPUID Registers / Logical CPU #1 ]------

allcpu: Package 0 / Core 0 / Thread 1: Valid, Virtual

CPUID 00000000: 0000000B-756E6547-6C65746E-49656E69 [GenuineIntel]
CPUID 00000001: 000206C2-01200800-029EE3FF-BFEBFBFF
CPUID 00000002: 55035A01-00F0B2FF-00000000-00CA0000
CPUID 00000003: 00000000-00000000-00000000-00000000
CPUID 00000004: 3C004121-01C0003F-0000003F-00000000 [SL 00] [L1D: 32 KB]
CPUID 00000004: 3C004122-00C0003F-0000007F-00000000 [SL 01] [L1I: 32 KB]
CPUID 00000004: 3C004143-01C0003F-000001FF-00000000 [SL 02] [L2U: 256 KB]
CPUID 00000004: 3C07C163-03C0003F-00002FFF-00000002 [SL 03] [L3U: 12 MB]
CPUID 00000005: 00000040-00000040-00000003-00001120
CPUID 00000006: 00000005-00000002-00000009-00000000
CPUID 00000007: 00000000-00000000-00000000-9C000000 [SL 00]
CPUID 00000008: 00000000-00000000-00000000-00000000
CPUID 00000009: 00000000-00000000-00000000-00000000
CPUID 0000000A: 07300403-00000004-00000000-00000603
CPUID 0000000B: 00000001-00000002-00000100-00000001 [SL 00]
CPUID 0000000B: 00000005-0000000C-00000201-00000001 [SL 01]
CPUID 80000000: 80000008-00000000-00000000-00000000
CPUID 80000001: 00000000-00000000-00000001-2C100000
CPUID 80000002: 65746E49-2952286C-6F655820-2952286E [Intel(R) Xeon(R)]
CPUID 80000003: 55504320-20202020-20202020-57202020 [ CPU           W]
CPUID 80000004: 30373633-20402020-30322E33-007A4847 [3670  @ 3.20GHz]
CPUID 80000005: 00000000-00000000-00000000-00000000 [L1D: 0 KB / L1I: 0 KB]
CPUID 80000006: 00000000-00000000-01006040-00000000 [L2: 256 KB] / L3: 0 KB]
CPUID 80000007: 00000000-00000000-00000000-00000100
CPUID 80000008: 00003024-00000000-00000000-00000000

L1    Data Cache:    32 KB,  8-way Associative, 64-byte Line
L1  Instr. Cache:    32 KB,  4-way Associative, 64-byte Line
L2 Unified Cache:   256 KB,  8-way Associative, 64-byte Line
L3 Unified Cache:    12 MB, 16-way Associative, 64-byte Line

------[ CPUID Registers / Logical CPU #2 ]------

allcpu: Package 0 / Core 1 / Thread 0: Valid

CPUID 00000000: 0000000B-756E6547-6C65746E-49656E69 [GenuineIntel]
CPUID 00000001: 000206C2-02200800-029EE3FF-BFEBFBFF
CPUID 00000002: 55035A01-00F0B2FF-00000000-00CA0000
CPUID 00000003: 00000000-00000000-00000000-00000000
CPUID 00000004: 3C004121-01C0003F-0000003F-00000000 [SL 00] [L1D: 32 KB]
CPUID 00000004: 3C004122-00C0003F-0000007F-00000000 [SL 01] [L1I: 32 KB]
CPUID 00000004: 3C004143-01C0003F-000001FF-00000000 [SL 02] [L2U: 256 KB]
CPUID 00000004: 3C07C163-03C0003F-00002FFF-00000002 [SL 03] [L3U: 12 MB]
CPUID 00000005: 00000040-00000040-00000003-00001120
CPUID 00000006: 00000005-00000002-00000009-00000000
CPUID 00000007: 00000000-00000000-00000000-9C000000 [SL 00]
CPUID 00000008: 00000000-00000000-00000000-00000000
CPUID 00000009: 00000000-00000000-00000000-00000000
CPUID 0000000A: 07300403-00000004-00000000-00000603
CPUID 0000000B: 00000001-00000002-00000100-00000002 [SL 00]
CPUID 0000000B: 00000005-0000000C-00000201-00000002 [SL 01]
CPUID 80000000: 80000008-00000000-00000000-00000000
CPUID 80000001: 00000000-00000000-00000001-2C100000
CPUID 80000002: 65746E49-2952286C-6F655820-2952286E [Intel(R) Xeon(R)]
CPUID 80000003: 55504320-20202020-20202020-57202020 [ CPU           W]
CPUID 80000004: 30373633-20402020-30322E33-007A4847 [3670  @ 3.20GHz]
CPUID 80000005: 00000000-00000000-00000000-00000000 [L1D: 0 KB / L1I: 0 KB]
CPUID 80000006: 00000000-00000000-01006040-00000000 [L2: 256 KB] / L3: 0 KB]
CPUID 80000007: 00000000-00000000-00000000-00000100
CPUID 80000008: 00003024-00000000-00000000-00000000

L1    Data Cache:    32 KB,  8-way Associative, 64-byte Line
L1  Instr. Cache:    32 KB,  4-way Associative, 64-byte Line
L2 Unified Cache:   256 KB,  8-way Associative, 64-byte Line
L3 Unified Cache:    12 MB, 16-way Associative, 64-byte Line

------[ CPUID Registers / Logical CPU #3 ]------

allcpu: Package 0 / Core 1 / Thread 1: Valid, Virtual

CPUID 00000000: 0000000B-756E6547-6C65746E-49656E69 [GenuineIntel]
CPUID 00000001: 000206C2-03200800-029EE3FF-BFEBFBFF
CPUID 00000002: 55035A01-00F0B2FF-00000000-00CA0000
CPUID 00000003: 00000000-00000000-00000000-00000000
CPUID 00000004: 3C004121-01C0003F-0000003F-00000000 [SL 00] [L1D: 32 KB]
CPUID 00000004: 3C004122-00C0003F-0000007F-00000000 [SL 01] [L1I: 32 KB]
CPUID 00000004: 3C004143-01C0003F-000001FF-00000000 [SL 02] [L2U: 256 KB]
CPUID 00000004: 3C07C163-03C0003F-00002FFF-00000002 [SL 03] [L3U: 12 MB]
CPUID 00000005: 00000040-00000040-00000003-00001120
CPUID 00000006: 00000005-00000002-00000009-00000000
CPUID 00000007: 00000000-00000000-00000000-9C000000 [SL 00]
CPUID 00000008: 00000000-00000000-00000000-00000000
CPUID 00000009: 00000000-00000000-00000000-00000000
CPUID 0000000A: 07300403-00000004-00000000-00000603
CPUID 0000000B: 00000001-00000002-00000100-00000003 [SL 00]
CPUID 0000000B: 00000005-0000000C-00000201-00000003 [SL 01]
CPUID 80000000: 80000008-00000000-00000000-00000000
CPUID 80000001: 00000000-00000000-00000001-2C100000
CPUID 80000002: 65746E49-2952286C-6F655820-2952286E [Intel(R) Xeon(R)]
CPUID 80000003: 55504320-20202020-20202020-57202020 [ CPU           W]
CPUID 80000004: 30373633-20402020-30322E33-007A4847 [3670  @ 3.20GHz]
CPUID 80000005: 00000000-00000000-00000000-00000000 [L1D: 0 KB / L1I: 0 KB]
CPUID 80000006: 00000000-00000000-01006040-00000000 [L2: 256 KB] / L3: 0 KB]
CPUID 80000007: 00000000-00000000-00000000-00000100
CPUID 80000008: 00003024-00000000-00000000-00000000

L1    Data Cache:    32 KB,  8-way Associative, 64-byte Line
L1  Instr. Cache:    32 KB,  4-way Associative, 64-byte Line
L2 Unified Cache:   256 KB,  8-way Associative, 64-byte Line
L3 Unified Cache:    12 MB, 16-way Associative, 64-byte Line

------[ CPUID Registers / Logical CPU #4 ]------

allcpu: Package 0 / Core 2 / Thread 0: Valid

CPUID 00000000: 0000000B-756E6547-6C65746E-49656E69 [GenuineIntel]
CPUID 00000001: 000206C2-04200800-029EE3FF-BFEBFBFF
CPUID 00000002: 55035A01-00F0B2FF-00000000-00CA0000
CPUID 00000003: 00000000-00000000-00000000-00000000
CPUID 00000004: 3C004121-01C0003F-0000003F-00000000 [SL 00] [L1D: 32 KB]
CPUID 00000004: 3C004122-00C0003F-0000007F-00000000 [SL 01] [L1I: 32 KB]
CPUID 00000004: 3C004143-01C0003F-000001FF-00000000 [SL 02] [L2U: 256 KB]
CPUID 00000004: 3C07C163-03C0003F-00002FFF-00000002 [SL 03] [L3U: 12 MB]
CPUID 00000005: 00000040-00000040-00000003-00001120
CPUID 00000006: 00000005-00000002-00000009-00000000
CPUID 00000007: 00000000-00000000-00000000-9C000000 [SL 00]
CPUID 00000008: 00000000-00000000-00000000-00000000
CPUID 00000009: 00000000-00000000-00000000-00000000
CPUID 0000000A: 07300403-00000004-00000000-00000603
CPUID 0000000B: 00000001-00000002-00000100-00000004 [SL 00]
CPUID 0000000B: 00000005-0000000C-00000201-00000004 [SL 01]
CPUID 80000000: 80000008-00000000-00000000-00000000
CPUID 80000001: 00000000-00000000-00000001-2C100000
CPUID 80000002: 65746E49-2952286C-6F655820-2952286E [Intel(R) Xeon(R)]
CPUID 80000003: 55504320-20202020-20202020-57202020 [ CPU           W]
CPUID 80000004: 30373633-20402020-30322E33-007A4847 [3670  @ 3.20GHz]
CPUID 80000005: 00000000-00000000-00000000-00000000 [L1D: 0 KB / L1I: 0 KB]
CPUID 80000006: 00000000-00000000-01006040-00000000 [L2: 256 KB] / L3: 0 KB]
CPUID 80000007: 00000000-00000000-00000000-00000100
CPUID 80000008: 00003024-00000000-00000000-00000000

L1    Data Cache:    32 KB,  8-way Associative, 64-byte Line
L1  Instr. Cache:    32 KB,  4-way Associative, 64-byte Line
L2 Unified Cache:   256 KB,  8-way Associative, 64-byte Line
L3 Unified Cache:    12 MB, 16-way Associative, 64-byte Line

------[ CPUID Registers / Logical CPU #5 ]------

allcpu: Package 0 / Core 2 / Thread 1: Valid, Virtual

CPUID 00000000: 0000000B-756E6547-6C65746E-49656E69 [GenuineIntel]
CPUID 00000001: 000206C2-05200800-029EE3FF-BFEBFBFF
CPUID 00000002: 55035A01-00F0B2FF-00000000-00CA0000
CPUID 00000003: 00000000-00000000-00000000-00000000
CPUID 00000004: 3C004121-01C0003F-0000003F-00000000 [SL 00] [L1D: 32 KB]
CPUID 00000004: 3C004122-00C0003F-0000007F-00000000 [SL 01] [L1I: 32 KB]
CPUID 00000004: 3C004143-01C0003F-000001FF-00000000 [SL 02] [L2U: 256 KB]
CPUID 00000004: 3C07C163-03C0003F-00002FFF-00000002 [SL 03] [L3U: 12 MB]
CPUID 00000005: 00000040-00000040-00000003-00001120
CPUID 00000006: 00000005-00000002-00000009-00000000
CPUID 00000007: 00000000-00000000-00000000-9C000000 [SL 00]
CPUID 00000008: 00000000-00000000-00000000-00000000
CPUID 00000009: 00000000-00000000-00000000-00000000
CPUID 0000000A: 07300403-00000004-00000000-00000603
CPUID 0000000B: 00000001-00000002-00000100-00000005 [SL 00]
CPUID 0000000B: 00000005-0000000C-00000201-00000005 [SL 01]
CPUID 80000000: 80000008-00000000-00000000-00000000
CPUID 80000001: 00000000-00000000-00000001-2C100000
CPUID 80000002: 65746E49-2952286C-6F655820-2952286E [Intel(R) Xeon(R)]
CPUID 80000003: 55504320-20202020-20202020-57202020 [ CPU           W]
CPUID 80000004: 30373633-20402020-30322E33-007A4847 [3670  @ 3.20GHz]
CPUID 80000005: 00000000-00000000-00000000-00000000 [L1D: 0 KB / L1I: 0 KB]
CPUID 80000006: 00000000-00000000-01006040-00000000 [L2: 256 KB] / L3: 0 KB]
CPUID 80000007: 00000000-00000000-00000000-00000100
CPUID 80000008: 00003024-00000000-00000000-00000000

L1    Data Cache:    32 KB,  8-way Associative, 64-byte Line
L1  Instr. Cache:    32 KB,  4-way Associative, 64-byte Line
L2 Unified Cache:   256 KB,  8-way Associative, 64-byte Line
L3 Unified Cache:    12 MB, 16-way Associative, 64-byte Line

------[ CPUID Registers / Logical CPU #6 ]------

allcpu: Package 0 / Core 3 / Thread 0: Valid

CPUID 00000000: 0000000B-756E6547-6C65746E-49656E69 [GenuineIntel]
CPUID 00000001: 000206C2-10200800-029EE3FF-BFEBFBFF
CPUID 00000002: 55035A01-00F0B2FF-00000000-00CA0000
CPUID 00000003: 00000000-00000000-00000000-00000000
CPUID 00000004: 3C004121-01C0003F-0000003F-00000000 [SL 00] [L1D: 32 KB]
CPUID 00000004: 3C004122-00C0003F-0000007F-00000000 [SL 01] [L1I: 32 KB]
CPUID 00000004: 3C004143-01C0003F-000001FF-00000000 [SL 02] [L2U: 256 KB]
CPUID 00000004: 3C07C163-03C0003F-00002FFF-00000002 [SL 03] [L3U: 12 MB]
CPUID 00000005: 00000040-00000040-00000003-00001120
CPUID 00000006: 00000005-00000002-00000009-00000000
CPUID 00000007: 00000000-00000000-00000000-9C000000 [SL 00]
CPUID 00000008: 00000000-00000000-00000000-00000000
CPUID 00000009: 00000000-00000000-00000000-00000000
CPUID 0000000A: 07300403-00000004-00000000-00000603
CPUID 0000000B: 00000001-00000002-00000100-00000010 [SL 00]
CPUID 0000000B: 00000005-0000000C-00000201-00000010 [SL 01]
CPUID 80000000: 80000008-00000000-00000000-00000000
CPUID 80000001: 00000000-00000000-00000001-2C100000
CPUID 80000002: 65746E49-2952286C-6F655820-2952286E [Intel(R) Xeon(R)]
CPUID 80000003: 55504320-20202020-20202020-57202020 [ CPU           W]
CPUID 80000004: 30373633-20402020-30322E33-007A4847 [3670  @ 3.20GHz]
CPUID 80000005: 00000000-00000000-00000000-00000000 [L1D: 0 KB / L1I: 0 KB]
CPUID 80000006: 00000000-00000000-01006040-00000000 [L2: 256 KB] / L3: 0 KB]
CPUID 80000007: 00000000-00000000-00000000-00000100
CPUID 80000008: 00003024-00000000-00000000-00000000

L1    Data Cache:    32 KB,  8-way Associative, 64-byte Line
L1  Instr. Cache:    32 KB,  4-way Associative, 64-byte Line
L2 Unified Cache:   256 KB,  8-way Associative, 64-byte Line
L3 Unified Cache:    12 MB, 16-way Associative, 64-byte Line

------[ CPUID Registers / Logical CPU #7 ]------

allcpu: Package 0 / Core 3 / Thread 1: Valid, Virtual

CPUID 00000000: 0000000B-756E6547-6C65746E-49656E69 [GenuineIntel]
CPUID 00000001: 000206C2-11200800-029EE3FF-BFEBFBFF
CPUID 00000002: 55035A01-00F0B2FF-00000000-00CA0000
CPUID 00000003: 00000000-00000000-00000000-00000000
CPUID 00000004: 3C004121-01C0003F-0000003F-00000000 [SL 00] [L1D: 32 KB]
CPUID 00000004: 3C004122-00C0003F-0000007F-00000000 [SL 01] [L1I: 32 KB]
CPUID 00000004: 3C004143-01C0003F-000001FF-00000000 [SL 02] [L2U: 256 KB]
CPUID 00000004: 3C07C163-03C0003F-00002FFF-00000002 [SL 03] [L3U: 12 MB]
CPUID 00000005: 00000040-00000040-00000003-00001120
CPUID 00000006: 00000005-00000002-00000009-00000000
CPUID 00000007: 00000000-00000000-00000000-9C000000 [SL 00]
CPUID 00000008: 00000000-00000000-00000000-00000000
CPUID 00000009: 00000000-00000000-00000000-00000000
CPUID 0000000A: 07300403-00000004-00000000-00000603
CPUID 0000000B: 00000001-00000002-00000100-00000011 [SL 00]
CPUID 0000000B: 00000005-0000000C-00000201-00000011 [SL 01]
CPUID 80000000: 80000008-00000000-00000000-00000000
CPUID 80000001: 00000000-00000000-00000001-2C100000
CPUID 80000002: 65746E49-2952286C-6F655820-2952286E [Intel(R) Xeon(R)]
CPUID 80000003: 55504320-20202020-20202020-57202020 [ CPU           W]
CPUID 80000004: 30373633-20402020-30322E33-007A4847 [3670  @ 3.20GHz]
CPUID 80000005: 00000000-00000000-00000000-00000000 [L1D: 0 KB / L1I: 0 KB]
CPUID 80000006: 00000000-00000000-01006040-00000000 [L2: 256 KB] / L3: 0 KB]
CPUID 80000007: 00000000-00000000-00000000-00000100
CPUID 80000008: 00003024-00000000-00000000-00000000

L1    Data Cache:    32 KB,  8-way Associative, 64-byte Line
L1  Instr. Cache:    32 KB,  4-way Associative, 64-byte Line
L2 Unified Cache:   256 KB,  8-way Associative, 64-byte Line
L3 Unified Cache:    12 MB, 16-way Associative, 64-byte Line

------[ CPUID Registers / Logical CPU #8 ]------

allcpu: Package 0 / Core 4 / Thread 0: Valid

CPUID 00000000: 0000000B-756E6547-6C65746E-49656E69 [GenuineIntel]
CPUID 00000001: 000206C2-12200800-029EE3FF-BFEBFBFF
CPUID 00000002: 55035A01-00F0B2FF-00000000-00CA0000
CPUID 00000003: 00000000-00000000-00000000-00000000
CPUID 00000004: 3C004121-01C0003F-0000003F-00000000 [SL 00] [L1D: 32 KB]
CPUID 00000004: 3C004122-00C0003F-0000007F-00000000 [SL 01] [L1I: 32 KB]
CPUID 00000004: 3C004143-01C0003F-000001FF-00000000 [SL 02] [L2U: 256 KB]
CPUID 00000004: 3C07C163-03C0003F-00002FFF-00000002 [SL 03] [L3U: 12 MB]
CPUID 00000005: 00000040-00000040-00000003-00001120
CPUID 00000006: 00000005-00000002-00000009-00000000
CPUID 00000007: 00000000-00000000-00000000-9C000000 [SL 00]
CPUID 00000008: 00000000-00000000-00000000-00000000
CPUID 00000009: 00000000-00000000-00000000-00000000
CPUID 0000000A: 07300403-00000004-00000000-00000603
CPUID 0000000B: 00000001-00000002-00000100-00000012 [SL 00]
CPUID 0000000B: 00000005-0000000C-00000201-00000012 [SL 01]
CPUID 80000000: 80000008-00000000-00000000-00000000
CPUID 80000001: 00000000-00000000-00000001-2C100000
CPUID 80000002: 65746E49-2952286C-6F655820-2952286E [Intel(R) Xeon(R)]
CPUID 80000003: 55504320-20202020-20202020-57202020 [ CPU           W]
CPUID 80000004: 30373633-20402020-30322E33-007A4847 [3670  @ 3.20GHz]
CPUID 80000005: 00000000-00000000-00000000-00000000 [L1D: 0 KB / L1I: 0 KB]
CPUID 80000006: 00000000-00000000-01006040-00000000 [L2: 256 KB] / L3: 0 KB]
CPUID 80000007: 00000000-00000000-00000000-00000100
CPUID 80000008: 00003024-00000000-00000000-00000000

L1    Data Cache:    32 KB,  8-way Associative, 64-byte Line
L1  Instr. Cache:    32 KB,  4-way Associative, 64-byte Line
L2 Unified Cache:   256 KB,  8-way Associative, 64-byte Line
L3 Unified Cache:    12 MB, 16-way Associative, 64-byte Line

------[ CPUID Registers / Logical CPU #9 ]------

allcpu: Package 0 / Core 4 / Thread 1: Valid, Virtual

CPUID 00000000: 0000000B-756E6547-6C65746E-49656E69 [GenuineIntel]
CPUID 00000001: 000206C2-13200800-029EE3FF-BFEBFBFF
CPUID 00000002: 55035A01-00F0B2FF-00000000-00CA0000
CPUID 00000003: 00000000-00000000-00000000-00000000
CPUID 00000004: 3C004121-01C0003F-0000003F-00000000 [SL 00] [L1D: 32 KB]
CPUID 00000004: 3C004122-00C0003F-0000007F-00000000 [SL 01] [L1I: 32 KB]
CPUID 00000004: 3C004143-01C0003F-000001FF-00000000 [SL 02] [L2U: 256 KB]
CPUID 00000004: 3C07C163-03C0003F-00002FFF-00000002 [SL 03] [L3U: 12 MB]
CPUID 00000005: 00000040-00000040-00000003-00001120
CPUID 00000006: 00000005-00000002-00000009-00000000
CPUID 00000007: 00000000-00000000-00000000-9C000000 [SL 00]
CPUID 00000008: 00000000-00000000-00000000-00000000
CPUID 00000009: 00000000-00000000-00000000-00000000
CPUID 0000000A: 07300403-00000004-00000000-00000603
CPUID 0000000B: 00000001-00000002-00000100-00000013 [SL 00]
CPUID 0000000B: 00000005-0000000C-00000201-00000013 [SL 01]
CPUID 80000000: 80000008-00000000-00000000-00000000
CPUID 80000001: 00000000-00000000-00000001-2C100000
CPUID 80000002: 65746E49-2952286C-6F655820-2952286E [Intel(R) Xeon(R)]
CPUID 80000003: 55504320-20202020-20202020-57202020 [ CPU           W]
CPUID 80000004: 30373633-20402020-30322E33-007A4847 [3670  @ 3.20GHz]
CPUID 80000005: 00000000-00000000-00000000-00000000 [L1D: 0 KB / L1I: 0 KB]
CPUID 80000006: 00000000-00000000-01006040-00000000 [L2: 256 KB] / L3: 0 KB]
CPUID 80000007: 00000000-00000000-00000000-00000100
CPUID 80000008: 00003024-00000000-00000000-00000000

L1    Data Cache:    32 KB,  8-way Associative, 64-byte Line
L1  Instr. Cache:    32 KB,  4-way Associative, 64-byte Line
L2 Unified Cache:   256 KB,  8-way Associative, 64-byte Line
L3 Unified Cache:    12 MB, 16-way Associative, 64-byte Line

------[ CPUID Registers / Logical CPU #10 ]------

allcpu: Package 0 / Core 5 / Thread 0: Valid

CPUID 00000000: 0000000B-756E6547-6C65746E-49656E69 [GenuineIntel]
CPUID 00000001: 000206C2-14200800-029EE3FF-BFEBFBFF
CPUID 00000002: 55035A01-00F0B2FF-00000000-00CA0000
CPUID 00000003: 00000000-00000000-00000000-00000000
CPUID 00000004: 3C004121-01C0003F-0000003F-00000000 [SL 00] [L1D: 32 KB]
CPUID 00000004: 3C004122-00C0003F-0000007F-00000000 [SL 01] [L1I: 32 KB]
CPUID 00000004: 3C004143-01C0003F-000001FF-00000000 [SL 02] [L2U: 256 KB]
CPUID 00000004: 3C07C163-03C0003F-00002FFF-00000002 [SL 03] [L3U: 12 MB]
CPUID 00000005: 00000040-00000040-00000003-00001120
CPUID 00000006: 00000005-00000002-00000009-00000000
CPUID 00000007: 00000000-00000000-00000000-9C000000 [SL 00]
CPUID 00000008: 00000000-00000000-00000000-00000000
CPUID 00000009: 00000000-00000000-00000000-00000000
CPUID 0000000A: 07300403-00000004-00000000-00000603
CPUID 0000000B: 00000001-00000002-00000100-00000014 [SL 00]
CPUID 0000000B: 00000005-0000000C-00000201-00000014 [SL 01]
CPUID 80000000: 80000008-00000000-00000000-00000000
CPUID 80000001: 00000000-00000000-00000001-2C100000
CPUID 80000002: 65746E49-2952286C-6F655820-2952286E [Intel(R) Xeon(R)]
CPUID 80000003: 55504320-20202020-20202020-57202020 [ CPU           W]
CPUID 80000004: 30373633-20402020-30322E33-007A4847 [3670  @ 3.20GHz]
CPUID 80000005: 00000000-00000000-00000000-00000000 [L1D: 0 KB / L1I: 0 KB]
CPUID 80000006: 00000000-00000000-01006040-00000000 [L2: 256 KB] / L3: 0 KB]
CPUID 80000007: 00000000-00000000-00000000-00000100
CPUID 80000008: 00003024-00000000-00000000-00000000

L1    Data Cache:    32 KB,  8-way Associative, 64-byte Line
L1  Instr. Cache:    32 KB,  4-way Associative, 64-byte Line
L2 Unified Cache:   256 KB,  8-way Associative, 64-byte Line
L3 Unified Cache:    12 MB, 16-way Associative, 64-byte Line

------[ CPUID Registers / Logical CPU #11 ]------

allcpu: Package 0 / Core 5 / Thread 1: Valid, Virtual

CPUID 00000000: 0000000B-756E6547-6C65746E-49656E69 [GenuineIntel]
CPUID 00000001: 000206C2-15200800-029EE3FF-BFEBFBFF
CPUID 00000002: 55035A01-00F0B2FF-00000000-00CA0000
CPUID 00000003: 00000000-00000000-00000000-00000000
CPUID 00000004: 3C004121-01C0003F-0000003F-00000000 [SL 00] [L1D: 32 KB]
CPUID 00000004: 3C004122-00C0003F-0000007F-00000000 [SL 01] [L1I: 32 KB]
CPUID 00000004: 3C004143-01C0003F-000001FF-00000000 [SL 02] [L2U: 256 KB]
CPUID 00000004: 3C07C163-03C0003F-00002FFF-00000002 [SL 03] [L3U: 12 MB]
CPUID 00000005: 00000040-00000040-00000003-00001120
CPUID 00000006: 00000005-00000002-00000009-00000000
CPUID 00000007: 00000000-00000000-00000000-9C000000 [SL 00]
CPUID 00000008: 00000000-00000000-00000000-00000000
CPUID 00000009: 00000000-00000000-00000000-00000000
CPUID 0000000A: 07300403-00000004-00000000-00000603
CPUID 0000000B: 00000001-00000002-00000100-00000015 [SL 00]
CPUID 0000000B: 00000005-0000000C-00000201-00000015 [SL 01]
CPUID 80000000: 80000008-00000000-00000000-00000000
CPUID 80000001: 00000000-00000000-00000001-2C100000
CPUID 80000002: 65746E49-2952286C-6F655820-2952286E [Intel(R) Xeon(R)]
CPUID 80000003: 55504320-20202020-20202020-57202020 [ CPU           W]
CPUID 80000004: 30373633-20402020-30322E33-007A4847 [3670  @ 3.20GHz]
CPUID 80000005: 00000000-00000000-00000000-00000000 [L1D: 0 KB / L1I: 0 KB]
CPUID 80000006: 00000000-00000000-01006040-00000000 [L2: 256 KB] / L3: 0 KB]
CPUID 80000007: 00000000-00000000-00000000-00000100
CPUID 80000008: 00003024-00000000-00000000-00000000

L1    Data Cache:    32 KB,  8-way Associative, 64-byte Line
L1  Instr. Cache:    32 KB,  4-way Associative, 64-byte Line
L2 Unified Cache:   256 KB,  8-way Associative, 64-byte Line
L3 Unified Cache:    12 MB, 16-way Associative, 64-byte Line

------[ All CPUs ]------

CPU   0: APICID    0 / Package 0 / Core   0 / Thread 0: Valid
CPU   1: APICID    1 / Package 0 / Core   0 / Thread 1: Valid, Virtual
CPU   2: APICID    2 / Package 0 / Core   1 / Thread 0: Valid
CPU   3: APICID    3 / Package 0 / Core   1 / Thread 1: Valid, Virtual
CPU   4: APICID    4 / Package 0 / Core   2 / Thread 0: Valid
CPU   5: APICID    5 / Package 0 / Core   2 / Thread 1: Valid, Virtual
CPU   6: APICID   16 / Package 0 / Core   3 / Thread 0: Valid
CPU   7: APICID   17 / Package 0 / Core   3 / Thread 1: Valid, Virtual
CPU   8: APICID   18 / Package 0 / Core   4 / Thread 0: Valid
CPU   9: APICID   19 / Package 0 / Core   4 / Thread 1: Valid, Virtual
CPU  10: APICID   20 / Package 0 / Core   5 / Thread 0: Valid
CPU  11: APICID   21 / Package 0 / Core   5 / Thread 1: Valid, Virtual

------[ MSR Registers / Logical CPU #0 ]------

MSR 00000017: 0000-0000-0000-0000 [PlatID = 0]
MSR 0000001B: 0000-0000-FEE0-0900
MSR 00000035: 0000-0000-0006-000C
MSR 00000048: 0000-0000-0000-0000
MSR 00000049: < FAILED >
MSR 0000008B: 0000-001F-0000-0000
MSR 000000CE: 0000-0C00-0401-1803
MSR 000000E7: 0000-00B3-E7B1-411C [S200]
MSR 000000E7: 0000-00B3-EBC9-2498 [S200]
MSR 000000E7: 0000-00B3-EDDE-2920
MSR 000000E8: 0000-00B2-893F-5A4E [S200]
MSR 000000E8: 0000-00B2-93C4-3FD6 [S200]
MSR 000000E8: 0000-00B2-9498-C0DE
MSR 0000010B: < FAILED >
MSR 00000194: 0000-0000-0001-1800
MSR 00000198: 0000-0000-0000-000C [S200]
MSR 00000198: 0000-0000-0000-000C [S200]
MSR 00000198: 0000-0000-0000-000C
MSR 00000199: 0000-0000-0000-000C
MSR 0000019A: 0000-0000-0000-0000
MSR 0000019B: 0000-0000-0000-0000
MSR 0000019C: 0000-0000-883E-0000 [S200]
MSR 0000019C: 0000-0000-883E-0000 [S200]
MSR 0000019C: 0000-0000-883E-0000
MSR 0000019D: 0000-0000-0000-0000
MSR 000001A0: 0000-0040-0085-0089
MSR 000001A2: 0000-0000-0065-1400
MSR 000001A4: 0000-0000-0000-0000
MSR 000001AA: 0000-0000-0040-0002
MSR 000001AC: 0000-0000-0370-0410
MSR 000001AD: 0000-1919-1919-1A1A
MSR 000001FC: 0000-0000-0000-0004
MSR 00000300: 0000-0000-F800-000D
MSR 0000030A: 0000-0000-0203-2026 [S200]
MSR 0000030A: 0000-0000-0203-2026 [S200]
MSR 0000030A: 0000-0000-0203-2026
MSR 0000030B: 0000-0000-02DE-CC28 [S200]
MSR 0000030B: 0000-0000-02DE-CC28 [S200]
MSR 0000030B: 0000-0000-02DE-CC28
MSR 00000480: 00DA-0400-0000-000F
MSR 00000481: 0000-007F-0000-0016
MSR 00000482: FFF9-FFFE-0401-E172
MSR 00000483: 007F-FFFF-0003-6DFF
MSR 00000484: 0000-FFFF-0000-11FF
MSR 00000485: 0000-0000-0004-01E7
MSR 00000486: 0000-0000-8000-0021
MSR 00000487: 0000-0000-FFFF-FFFF
MSR 00000488: 0000-0000-0000-2000
MSR 00000489: 0000-0000-0002-67FF
MSR 0000048A: 0000-0000-0000-002A
MSR 0000048B: 0000-04FF-0000-0000
MSR 0000048C: 0000-0F01-0613-4141
MSR 0000048D: 0000-007F-0000-0016
MSR 0000048E: FFF9-FFFE-0400-6172
MSR 0000048F: 007F-FFFF-0003-6DFB
MSR 00000490: 0000-FFFF-0000-11FB

------[ MSR Registers / Logical CPU #1 ]------

MSR 00000017: 0000-0000-0000-0000 [PlatID = 0]
MSR 0000001B: 0000-0000-FEE0-0800
MSR 00000035: 0000-0000-0006-000C
MSR 00000048: 0000-0000-0000-0000
MSR 00000049: < FAILED >
MSR 0000008B: 0000-001F-0000-0000
MSR 000000CE: 0000-0C00-0401-1803
MSR 000000E7: 0000-0054-D9C0-FCA3
MSR 000000E8: 0000-0050-2F26-11E6
MSR 0000010B: < FAILED >
MSR 00000194: 0000-0000-0001-1800
MSR 00000198: 0000-0000-0000-000C
MSR 00000199: 0000-0000-0000-000C
MSR 0000019A: 0000-0000-0000-0000
MSR 0000019B: 0000-0000-0000-0000
MSR 0000019C: 0000-0000-883D-0000
MSR 0000019D: 0000-0000-0000-0000
MSR 000001A0: 0000-0040-0085-0089
MSR 000001A2: 0000-0000-0065-1400
MSR 000001A4: 0000-0000-0000-0000
MSR 000001AA: 0000-0000-0040-0002
MSR 000001AC: 0000-0000-0370-0410
MSR 000001AD: 0000-1919-1919-1A1A
MSR 000001FC: 0000-0000-0000-0004
MSR 00000300: 0000-0000-F800-000D
MSR 0000030A: 0000-0000-0000-0000
MSR 0000030B: 0000-0000-0000-0000
MSR 00000480: 00DA-0400-0000-000F
MSR 00000481: 0000-007F-0000-0016
MSR 00000482: FFF9-FFFE-0401-E172
MSR 00000483: 007F-FFFF-0003-6DFF
MSR 00000484: 0000-FFFF-0000-11FF
MSR 00000485: 0000-0000-0004-01E7
MSR 00000486: 0000-0000-8000-0021
MSR 00000487: 0000-0000-FFFF-FFFF
MSR 00000488: 0000-0000-0000-2000
MSR 00000489: 0000-0000-0002-67FF
MSR 0000048A: 0000-0000-0000-002A
MSR 0000048B: 0000-04FF-0000-0000
MSR 0000048C: 0000-0F01-0613-4141
MSR 0000048D: 0000-007F-0000-0016
MSR 0000048E: FFF9-FFFE-0400-6172
MSR 0000048F: 007F-FFFF-0003-6DFB
MSR 00000490: 0000-FFFF-0000-11FB

------[ MSR Registers / Logical CPU #2 ]------

MSR 00000017: 0000-0000-0000-0000 [PlatID = 0]
MSR 0000001B: 0000-0000-FEE0-0800
MSR 00000035: 0000-0000-0006-000C
MSR 00000048: 0000-0000-0000-0000
MSR 00000049: < FAILED >
MSR 0000008B: 0000-001F-0000-0000
MSR 000000CE: 0000-0C00-0401-1803
MSR 000000E7: 0000-0114-668D-2747
MSR 000000E8: 0000-010A-0F10-76B0
MSR 0000010B: < FAILED >
MSR 00000194: 0000-0000-0001-1800
MSR 00000198: 0000-0000-0000-000C
MSR 00000199: 0000-0000-0000-000C
MSR 0000019A: 0000-0000-0000-0000
MSR 0000019B: 0000-0000-0000-0000
MSR 0000019C: 0000-0000-8838-0000
MSR 0000019D: 0000-0000-0000-0000
MSR 000001A0: 0000-0040-0085-0089
MSR 000001A2: 0000-0000-0065-1400
MSR 000001A4: 0000-0000-0000-0000
MSR 000001AA: 0000-0000-0040-0002
MSR 000001AC: 0000-0000-0370-0410
MSR 000001AD: 0000-1919-1919-1A1A
MSR 000001FC: 0000-0000-0000-0004
MSR 00000300: 0000-0000-F800-000D
MSR 0000030A: 0000-0000-0000-0000
MSR 0000030B: 0000-0000-0000-0000
MSR 00000480: 00DA-0400-0000-000F
MSR 00000481: 0000-007F-0000-0016
MSR 00000482: FFF9-FFFE-0401-E172
MSR 00000483: 007F-FFFF-0003-6DFF
MSR 00000484: 0000-FFFF-0000-11FF
MSR 00000485: 0000-0000-0004-01E7
MSR 00000486: 0000-0000-8000-0021
MSR 00000487: 0000-0000-FFFF-FFFF
MSR 00000488: 0000-0000-0000-2000
MSR 00000489: 0000-0000-0002-67FF
MSR 0000048A: 0000-0000-0000-002A
MSR 0000048B: 0000-04FF-0000-0000
MSR 0000048C: 0000-0F01-0613-4141
MSR 0000048D: 0000-007F-0000-0016
MSR 0000048E: FFF9-FFFE-0400-6172
MSR 0000048F: 007F-FFFF-0003-6DFB
MSR 00000490: 0000-FFFF-0000-11FB

------[ MSR Registers / Logical CPU #3 ]------

MSR 00000017: 0000-0000-0000-0000 [PlatID = 0]
MSR 0000001B: 0000-0000-FEE0-0800
MSR 00000035: 0000-0000-0006-000C
MSR 00000048: 0000-0000-0000-0000
MSR 00000049: < FAILED >
MSR 0000008B: 0000-001F-0000-0000
MSR 000000CE: 0000-0C00-0401-1803
MSR 000000E7: 0000-0046-3935-5512
MSR 000000E8: 0000-0041-BB8B-0D56
MSR 0000010B: < FAILED >
MSR 00000194: 0000-0000-0001-1800
MSR 00000198: 0000-0000-0000-000C
MSR 00000199: 0000-0000-0000-000C
MSR 0000019A: 0000-0000-0000-0000
MSR 0000019B: 0000-0000-0000-0000
MSR 0000019C: 0000-0000-8838-0000
MSR 0000019D: 0000-0000-0000-0000
MSR 000001A0: 0000-0040-0085-0089
MSR 000001A2: 0000-0000-0065-1400
MSR 000001A4: 0000-0000-0000-0000
MSR 000001AA: 0000-0000-0040-0002
MSR 000001AC: 0000-0000-0370-0410
MSR 000001AD: 0000-1919-1919-1A1A
MSR 000001FC: 0000-0000-0000-0004
MSR 00000300: 0000-0000-F800-000D
MSR 0000030A: 0000-0000-0000-0000
MSR 0000030B: 0000-0000-0000-0000
MSR 00000480: 00DA-0400-0000-000F
MSR 00000481: 0000-007F-0000-0016
MSR 00000482: FFF9-FFFE-0401-E172
MSR 00000483: 007F-FFFF-0003-6DFF
MSR 00000484: 0000-FFFF-0000-11FF
MSR 00000485: 0000-0000-0004-01E7
MSR 00000486: 0000-0000-8000-0021
MSR 00000487: 0000-0000-FFFF-FFFF
MSR 00000488: 0000-0000-0000-2000
MSR 00000489: 0000-0000-0002-67FF
MSR 0000048A: 0000-0000-0000-002A
MSR 0000048B: 0000-04FF-0000-0000
MSR 0000048C: 0000-0F01-0613-4141
MSR 0000048D: 0000-007F-0000-0016
MSR 0000048E: FFF9-FFFE-0400-6172
MSR 0000048F: 007F-FFFF-0003-6DFB
MSR 00000490: 0000-FFFF-0000-11FB

------[ MSR Registers / Logical CPU #4 ]------

MSR 00000017: 0000-0000-0000-0000 [PlatID = 0]
MSR 0000001B: 0000-0000-FEE0-0800
MSR 00000035: 0000-0000-0006-000C
MSR 00000048: 0000-0000-0000-0000
MSR 00000049: < FAILED >
MSR 0000008B: 0000-001F-0000-0000
MSR 000000CE: 0000-0C00-0401-1803
MSR 000000E7: 0000-0079-5B5A-D58D
MSR 000000E8: 0000-0072-F4A5-82C9
MSR 0000010B: < FAILED >
MSR 00000194: 0000-0000-0001-1800
MSR 00000198: 0000-0000-0000-000C
MSR 00000199: 0000-0000-0000-000C
MSR 0000019A: 0000-0000-0000-0000
MSR 0000019B: 0000-0000-0000-0000
MSR 0000019C: 0000-0000-883B-0000
MSR 0000019D: 0000-0000-0000-0000
MSR 000001A0: 0000-0040-0085-0089
MSR 000001A2: 0000-0000-0065-1400
MSR 000001A4: 0000-0000-0000-0000
MSR 000001AA: 0000-0000-0040-0002
MSR 000001AC: 0000-0000-0370-0410
MSR 000001AD: 0000-1919-1919-1A1A
MSR 000001FC: 0000-0000-0000-0004
MSR 00000300: 0000-0000-F800-000D
MSR 0000030A: 0000-0000-0000-0000
MSR 0000030B: 0000-0000-0000-0000
MSR 00000480: 00DA-0400-0000-000F
MSR 00000481: 0000-007F-0000-0016
MSR 00000482: FFF9-FFFE-0401-E172
MSR 00000483: 007F-FFFF-0003-6DFF
MSR 00000484: 0000-FFFF-0000-11FF
MSR 00000485: 0000-0000-0004-01E7
MSR 00000486: 0000-0000-8000-0021
MSR 00000487: 0000-0000-FFFF-FFFF
MSR 00000488: 0000-0000-0000-2000
MSR 00000489: 0000-0000-0002-67FF
MSR 0000048A: 0000-0000-0000-002A
MSR 0000048B: 0000-04FF-0000-0000
MSR 0000048C: 0000-0F01-0613-4141
MSR 0000048D: 0000-007F-0000-0016
MSR 0000048E: FFF9-FFFE-0400-6172
MSR 0000048F: 007F-FFFF-0003-6DFB
MSR 00000490: 0000-FFFF-0000-11FB

------[ MSR Registers / Logical CPU #5 ]------

MSR 00000017: 0000-0000-0000-0000 [PlatID = 0]
MSR 0000001B: 0000-0000-FEE0-0800
MSR 00000035: 0000-0000-0006-000C
MSR 00000048: 0000-0000-0000-0000
MSR 00000049: < FAILED >
MSR 0000008B: 0000-001F-0000-0000
MSR 000000CE: 0000-0C00-0401-1803
MSR 000000E7: 0000-0094-C836-ECB9
MSR 000000E8: 0000-0090-D2F0-A957
MSR 0000010B: < FAILED >
MSR 00000194: 0000-0000-0001-1800
MSR 00000198: 0000-0000-0000-0018
MSR 00000199: 0000-0000-0000-0019
MSR 0000019A: 0000-0000-0000-0000
MSR 0000019B: 0000-0000-0000-0000
MSR 0000019C: 0000-0000-8836-0000
MSR 0000019D: 0000-0000-0000-0000
MSR 000001A0: 0000-0040-0085-0089
MSR 000001A2: 0000-0000-0065-1400
MSR 000001A4: 0000-0000-0000-0000
MSR 000001AA: 0000-0000-0040-0002
MSR 000001AC: 0000-0000-0370-0410
MSR 000001AD: 0000-1919-1919-1A1A
MSR 000001FC: 0000-0000-0000-0004
MSR 00000300: 0000-0000-F800-000D
MSR 0000030A: 0000-0000-0000-0000
MSR 0000030B: 0000-0000-0000-0000
MSR 00000480: 00DA-0400-0000-000F
MSR 00000481: 0000-007F-0000-0016
MSR 00000482: FFF9-FFFE-0401-E172
MSR 00000483: 007F-FFFF-0003-6DFF
MSR 00000484: 0000-FFFF-0000-11FF
MSR 00000485: 0000-0000-0004-01E7
MSR 00000486: 0000-0000-8000-0021
MSR 00000487: 0000-0000-FFFF-FFFF
MSR 00000488: 0000-0000-0000-2000
MSR 00000489: 0000-0000-0002-67FF
MSR 0000048A: 0000-0000-0000-002A
MSR 0000048B: 0000-04FF-0000-0000
MSR 0000048C: 0000-0F01-0613-4141
MSR 0000048D: 0000-007F-0000-0016
MSR 0000048E: FFF9-FFFE-0400-6172
MSR 0000048F: 007F-FFFF-0003-6DFB
MSR 00000490: 0000-FFFF-0000-11FB

------[ MSR Registers / Logical CPU #6 ]------

MSR 00000017: 0000-0000-0000-0000 [PlatID = 0]
MSR 0000001B: 0000-0000-FEE0-0800
MSR 00000035: 0000-0000-0006-000C
MSR 00000048: 0000-0000-0000-0000
MSR 00000049: < FAILED >
MSR 0000008B: 0000-001F-0000-0000
MSR 000000CE: 0000-0C00-0401-1803
MSR 000000E7: 0000-0090-EDAB-56E2
MSR 000000E8: 0000-008A-F550-61FC
MSR 0000010B: < FAILED >
MSR 00000194: 0000-0000-0001-1800
MSR 00000198: 0000-0000-0000-0018
MSR 00000199: 0000-0000-0000-0019
MSR 0000019A: 0000-0000-0000-0000
MSR 0000019B: 0000-0000-0000-0000
MSR 0000019C: 0000-0000-883E-0000
MSR 0000019D: 0000-0000-0000-0000
MSR 000001A0: 0000-0040-0085-0089
MSR 000001A2: 0000-0000-0065-1400
MSR 000001A4: 0000-0000-0000-0000
MSR 000001AA: 0000-0000-0040-0002
MSR 000001AC: 0000-0000-0370-0410
MSR 000001AD: 0000-1919-1919-1A1A
MSR 000001FC: 0000-0000-0000-0004
MSR 00000300: 0000-0000-F800-000D
MSR 0000030A: 0000-0000-0000-0000
MSR 0000030B: 0000-0000-0000-0000
MSR 00000480: 00DA-0400-0000-000F
MSR 00000481: 0000-007F-0000-0016
MSR 00000482: FFF9-FFFE-0401-E172
MSR 00000483: 007F-FFFF-0003-6DFF
MSR 00000484: 0000-FFFF-0000-11FF
MSR 00000485: 0000-0000-0004-01E7
MSR 00000486: 0000-0000-8000-0021
MSR 00000487: 0000-0000-FFFF-FFFF
MSR 00000488: 0000-0000-0000-2000
MSR 00000489: 0000-0000-0002-67FF
MSR 0000048A: 0000-0000-0000-002A
MSR 0000048B: 0000-04FF-0000-0000
MSR 0000048C: 0000-0F01-0613-4141
MSR 0000048D: 0000-007F-0000-0016
MSR 0000048E: FFF9-FFFE-0400-6172
MSR 0000048F: 007F-FFFF-0003-6DFB
MSR 00000490: 0000-FFFF-0000-11FB

------[ MSR Registers / Logical CPU #7 ]------

MSR 00000017: 0000-0000-0000-0000 [PlatID = 0]
MSR 0000001B: 0000-0000-FEE0-0800
MSR 00000035: 0000-0000-0006-000C
MSR 00000048: 0000-0000-0000-0000
MSR 00000049: < FAILED >
MSR 0000008B: 0000-001F-0000-0000
MSR 000000CE: 0000-0C00-0401-1803
MSR 000000E7: 0000-0077-7C1C-8104
MSR 000000E8: 0000-0074-E318-97D1
MSR 0000010B: < FAILED >
MSR 00000194: 0000-0000-0001-1800
MSR 00000198: 0000-0000-0000-0018
MSR 00000199: 0000-0000-0000-0019
MSR 0000019A: 0000-0000-0000-0000
MSR 0000019B: 0000-0000-0000-0000
MSR 0000019C: 0000-0000-883D-0000
MSR 0000019D: 0000-0000-0000-0000
MSR 000001A0: 0000-0040-0085-0089
MSR 000001A2: 0000-0000-0065-1400
MSR 000001A4: 0000-0000-0000-0000
MSR 000001AA: 0000-0000-0040-0002
MSR 000001AC: 0000-0000-0370-0410
MSR 000001AD: 0000-1919-1919-1A1A
MSR 000001FC: 0000-0000-0000-0004
MSR 00000300: 0000-0000-F800-000D
MSR 0000030A: 0000-0000-0000-0000
MSR 0000030B: 0000-0000-0000-0000
MSR 00000480: 00DA-0400-0000-000F
MSR 00000481: 0000-007F-0000-0016
MSR 00000482: FFF9-FFFE-0401-E172
MSR 00000483: 007F-FFFF-0003-6DFF
MSR 00000484: 0000-FFFF-0000-11FF
MSR 00000485: 0000-0000-0004-01E7
MSR 00000486: 0000-0000-8000-0021
MSR 00000487: 0000-0000-FFFF-FFFF
MSR 00000488: 0000-0000-0000-2000
MSR 00000489: 0000-0000-0002-67FF
MSR 0000048A: 0000-0000-0000-002A
MSR 0000048B: 0000-04FF-0000-0000
MSR 0000048C: 0000-0F01-0613-4141
MSR 0000048D: 0000-007F-0000-0016
MSR 0000048E: FFF9-FFFE-0400-6172
MSR 0000048F: 007F-FFFF-0003-6DFB
MSR 00000490: 0000-FFFF-0000-11FB

------[ MSR Registers / Logical CPU #8 ]------

MSR 00000017: 0000-0000-0000-0000 [PlatID = 0]
MSR 0000001B: 0000-0000-FEE0-0800
MSR 00000035: 0000-0000-0006-000C
MSR 00000048: 0000-0000-0000-0000
MSR 00000049: < FAILED >
MSR 0000008B: 0000-001F-0000-0000
MSR 000000CE: 0000-0C00-0401-1803
MSR 000000E7: 0000-0087-F04C-4074
MSR 000000E8: 0000-0082-73EB-BB08
MSR 0000010B: < FAILED >
MSR 00000194: 0000-0000-0001-1800
MSR 00000198: 0000-0000-0000-0018
MSR 00000199: 0000-0000-0000-0019
MSR 0000019A: 0000-0000-0000-0000
MSR 0000019B: 0000-0000-0000-0000
MSR 0000019C: 0000-0000-883C-0000
MSR 0000019D: 0000-0000-0000-0000
MSR 000001A0: 0000-0040-0085-0089
MSR 000001A2: 0000-0000-0065-1400
MSR 000001A4: 0000-0000-0000-0000
MSR 000001AA: 0000-0000-0040-0002
MSR 000001AC: 0000-0000-0370-0410
MSR 000001AD: 0000-1919-1919-1A1A
MSR 000001FC: 0000-0000-0000-0004
MSR 00000300: 0000-0000-F800-000D
MSR 0000030A: 0000-0000-0000-0000
MSR 0000030B: 0000-0000-0000-0000
MSR 00000480: 00DA-0400-0000-000F
MSR 00000481: 0000-007F-0000-0016
MSR 00000482: FFF9-FFFE-0401-E172
MSR 00000483: 007F-FFFF-0003-6DFF
MSR 00000484: 0000-FFFF-0000-11FF
MSR 00000485: 0000-0000-0004-01E7
MSR 00000486: 0000-0000-8000-0021
MSR 00000487: 0000-0000-FFFF-FFFF
MSR 00000488: 0000-0000-0000-2000
MSR 00000489: 0000-0000-0002-67FF
MSR 0000048A: 0000-0000-0000-002A
MSR 0000048B: 0000-04FF-0000-0000
MSR 0000048C: 0000-0F01-0613-4141
MSR 0000048D: 0000-007F-0000-0016
MSR 0000048E: FFF9-FFFE-0400-6172
MSR 0000048F: 007F-FFFF-0003-6DFB
MSR 00000490: 0000-FFFF-0000-11FB

------[ MSR Registers / Logical CPU #9 ]------

MSR 00000017: 0000-0000-0000-0000 [PlatID = 0]
MSR 0000001B: 0000-0000-FEE0-0800
MSR 00000035: 0000-0000-0006-000C
MSR 00000048: 0000-0000-0000-0000
MSR 00000049: < FAILED >
MSR 0000008B: 0000-001F-0000-0000
MSR 000000CE: 0000-0C00-0401-1803
MSR 000000E7: 0000-003D-2070-D214
MSR 000000E8: 0000-0039-47C4-9547
MSR 0000010B: < FAILED >
MSR 00000194: 0000-0000-0001-1800
MSR 00000198: 0000-0000-0000-0018
MSR 00000199: 0000-0000-0000-0019
MSR 0000019A: 0000-0000-0000-0000
MSR 0000019B: 0000-0000-0000-0000
MSR 0000019C: 0000-0000-883C-0000
MSR 0000019D: 0000-0000-0000-0000
MSR 000001A0: 0000-0040-0085-0089
MSR 000001A2: 0000-0000-0065-1400
MSR 000001A4: 0000-0000-0000-0000
MSR 000001AA: 0000-0000-0040-0002
MSR 000001AC: 0000-0000-0370-0410
MSR 000001AD: 0000-1919-1919-1A1A
MSR 000001FC: 0000-0000-0000-0004
MSR 00000300: 0000-0000-F800-000D
MSR 0000030A: 0000-0000-0000-0000
MSR 0000030B: 0000-0000-0000-0000
MSR 00000480: 00DA-0400-0000-000F
MSR 00000481: 0000-007F-0000-0016
MSR 00000482: FFF9-FFFE-0401-E172
MSR 00000483: 007F-FFFF-0003-6DFF
MSR 00000484: 0000-FFFF-0000-11FF
MSR 00000485: 0000-0000-0004-01E7
MSR 00000486: 0000-0000-8000-0021
MSR 00000487: 0000-0000-FFFF-FFFF
MSR 00000488: 0000-0000-0000-2000
MSR 00000489: 0000-0000-0002-67FF
MSR 0000048A: 0000-0000-0000-002A
MSR 0000048B: 0000-04FF-0000-0000
MSR 0000048C: 0000-0F01-0613-4141
MSR 0000048D: 0000-007F-0000-0016
MSR 0000048E: FFF9-FFFE-0400-6172
MSR 0000048F: 007F-FFFF-0003-6DFB
MSR 00000490: 0000-FFFF-0000-11FB

------[ MSR Registers / Logical CPU #10 ]------

MSR 00000017: 0000-0000-0000-0000 [PlatID = 0]
MSR 0000001B: 0000-0000-FEE0-0800
MSR 00000035: 0000-0000-0006-000C
MSR 00000048: 0000-0000-0000-0000
MSR 00000049: < FAILED >
MSR 0000008B: 0000-001F-0000-0000
MSR 000000CE: 0000-0C00-0401-1803
MSR 000000E7: 0000-0094-05B3-A22E
MSR 000000E8: 0000-008D-F460-F16D
MSR 0000010B: < FAILED >
MSR 00000194: 0000-0000-0001-1800
MSR 00000198: 0000-0000-0000-0018
MSR 00000199: 0000-0000-0000-0019
MSR 0000019A: 0000-0000-0000-0000
MSR 0000019B: 0000-0000-0000-0000
MSR 0000019C: 0000-0000-883E-0000
MSR 0000019D: 0000-0000-0000-0000
MSR 000001A0: 0000-0040-0085-0089
MSR 000001A2: 0000-0000-0065-1400
MSR 000001A4: 0000-0000-0000-0000
MSR 000001AA: 0000-0000-0040-0002
MSR 000001AC: 0000-0000-0370-0410
MSR 000001AD: 0000-1919-1919-1A1A
MSR 000001FC: 0000-0000-0000-0004
MSR 00000300: 0000-0000-F800-000D
MSR 0000030A: 0000-0000-0000-0000
MSR 0000030B: 0000-0000-0000-0000
MSR 00000480: 00DA-0400-0000-000F
MSR 00000481: 0000-007F-0000-0016
MSR 00000482: FFF9-FFFE-0401-E172
MSR 00000483: 007F-FFFF-0003-6DFF
MSR 00000484: 0000-FFFF-0000-11FF
MSR 00000485: 0000-0000-0004-01E7
MSR 00000486: 0000-0000-8000-0021
MSR 00000487: 0000-0000-FFFF-FFFF
MSR 00000488: 0000-0000-0000-2000
MSR 00000489: 0000-0000-0002-67FF
MSR 0000048A: 0000-0000-0000-002A
MSR 0000048B: 0000-04FF-0000-0000
MSR 0000048C: 0000-0F01-0613-4141
MSR 0000048D: 0000-007F-0000-0016
MSR 0000048E: FFF9-FFFE-0400-6172
MSR 0000048F: 007F-FFFF-0003-6DFB
MSR 00000490: 0000-FFFF-0000-11FB

------[ MSR Registers / Logical CPU #11 ]------

MSR 00000017: 0000-0000-0000-0000 [PlatID = 0]
MSR 0000001B: 0000-0000-FEE0-0800
MSR 00000035: 0000-0000-0006-000C
MSR 00000048: 0000-0000-0000-0000
MSR 00000049: < FAILED >
MSR 0000008B: 0000-001F-0000-0000
MSR 000000CE: 0000-0C00-0401-1803
MSR 000000E7: 0000-007A-EADB-627A
MSR 000000E8: 0000-0077-8142-9966
MSR 0000010B: < FAILED >
MSR 00000194: 0000-0000-0001-1800
MSR 00000198: 0000-0000-0000-0018
MSR 00000199: 0000-0000-0000-0019
MSR 0000019A: 0000-0000-0000-0000
MSR 0000019B: 0000-0000-0000-0000
MSR 0000019C: 0000-0000-883E-0000
MSR 0000019D: 0000-0000-0000-0000
MSR 000001A0: 0000-0040-0085-0089
MSR 000001A2: 0000-0000-0065-1400
MSR 000001A4: 0000-0000-0000-0000
MSR 000001AA: 0000-0000-0040-0002
MSR 000001AC: 0000-0000-0370-0410
MSR 000001AD: 0000-1919-1919-1A1A
MSR 000001FC: 0000-0000-0000-0004
MSR 00000300: 0000-0000-F800-000D
MSR 0000030A: 0000-0000-0000-0000
MSR 0000030B: 0000-0000-0000-0000
MSR 00000480: 00DA-0400-0000-000F
MSR 00000481: 0000-007F-0000-0016
MSR 00000482: FFF9-FFFE-0401-E172
MSR 00000483: 007F-FFFF-0003-6DFF
MSR 00000484: 0000-FFFF-0000-11FF
MSR 00000485: 0000-0000-0004-01E7
MSR 00000486: 0000-0000-8000-0021
MSR 00000487: 0000-0000-FFFF-FFFF
MSR 00000488: 0000-0000-0000-2000
MSR 00000489: 0000-0000-0002-67FF
MSR 0000048A: 0000-0000-0000-002A
MSR 0000048B: 0000-04FF-0000-0000
MSR 0000048C: 0000-0F01-0613-4141
MSR 0000048D: 0000-007F-0000-0016
MSR 0000048E: FFF9-FFFE-0400-6172
MSR 0000048F: 007F-FFFF-0003-6DFB
MSR 00000490: 0000-FFFF-0000-11FB

PerformanceFrequency = 10000000

CPU Clock M.Method = 7  (APIC NHM)
PM Timer Address   = 4104  (1008h)

APIC Clock = 133.01 MHz  (AT = 69707 / TT = 15007 / try = 1 / SKL = 0.00 MHz)
APIC Clock = 133.01 MHz  (AT = 69707 / TT = 15007 / try = 1 / SKL = 0.00 MHz)
APIC Clock = 133.01 MHz  (AT = 69707 / TT = 15007 / try = 1 / SKL = 0.00 MHz)
APIC Clock = 133.01 MHz  (AT = 69707 / TT = 15007 / try = 1 / SKL = 0.00 MHz)
APIC Clock = 133.01 MHz  (AT = 69707 / TT = 15007 / try = 1 / SKL = 0.00 MHz)

CPU Clock = 2261.25 MHz / TSC Clock = 3192.36 MHz / CPU Mul = 17.00x
CPU Clock = 3192.36 MHz / TSC Clock = 3192.36 MHz / CPU Mul = 24.00x
CPU Clock = 1596.18 MHz / TSC Clock = 3192.36 MHz / CPU Mul = 12.00x
CPU Clock = 1596.18 MHz / TSC Clock = 3192.36 MHz / CPU Mul = 12.00x
CPU Clock = 3192.36 MHz / TSC Clock = 3192.36 MHz / CPU Mul = 24.00x

CPU Clock Max = 3192.36 MHz / TSC Clock = 3192.36 MHz / CPU Mul = 24.00x
CPU Clock Max = 3192.36 MHz / TSC Clock = 3192.36 MHz / CPU Mul = 24.00x
CPU Clock Max = 3192.36 MHz / TSC Clock = 3192.36 MHz / CPU Mul = 24.00x
CPU Clock Max = 3192.36 MHz / TSC Clock = 3192.36 MHz / CPU Mul = 24.00x
CPU Clock Max = 3192.36 MHz / TSC Clock = 3192.36 MHz / CPU Mul = 24.00x

INTPERFCTR2 = 3192.00 MHz / INTPERFCTR1 (TSC) = 3192.00 MHz
INTPERFCTR2 = 3192.01 MHz / INTPERFCTR1 (TSC) = 3192.01 MHz
INTPERFCTR2 = 3188.49 MHz / INTPERFCTR1 (TSC) = 3191.46 MHz
INTPERFCTR2 = 1596.01 MHz / INTPERFCTR1 (TSC) = 3192.01 MHz
INTPERFCTR2 = 1596.00 MHz / INTPERFCTR1 (TSC) = 3191.99 MHz
