------[ Versions ]------

Program Version : AIDA64 Engineer v7.60.7306 Beta
LLKD Version    : 1014
BenchDLL Version: 4.7.911.8-x64
Windows Version : Microsoft Windows 11 Pro 10.0.26100.3194 (64-bit)
GetProductInfo  : 0x00000030

------[ CPU Info ]------

CPU Type          : 4C+4c Intel Core Ultra 9 288V, 4200 MHz (42 x 100)
CPU Alias         : Lunar Lake-MX
CPU Platform      : BGA2833
CPU Stepping      : B0
Instruction Set   : x86, x86-64, MMX, SSE, SSE2, SSE3, SSSE3, SSE4.1, SSE4.2, AVX, AVX2, FMA, AES, SHA, SHA512, SM3, SM4
CPUID Manufacturer: GenuineIntel
CPUID CPU Name    : Intel(R) Core(TM) Ultra 9 288V
CPUID Revision    : 000B06D1h
IA Brand ID       : 00h  (Unknown)
Platform ID       : 3Fh  (BGA2833)
SMT / CMP Units   : 0 / 8
Max. NUMA Node    : 0

Tjmax Temperature          : 100 Celsius
HTC Temperature Limit      : 0 Celsius
CPU TDP                    : 30 W
CPU TDC                    : 95 A
CPU Max Power Limit        : Unlimited Power / Unlimited Time
CPU Power Limit 1 (Long)   : 37 W / 28.00 sec  (Unlocked)
CPU Power Limit 2 (Short)  : 37 W / Unlimited Time  (Unlocked)
Max Turbo Boost Multipliers: 1C: 51x, 2C: 50x, 3C: 45x, 4C: 42x, 5C: 42x, 6C: 42x, 7C: 42x, 8C: 42x

------[ Motherboard Info ]------

Motherboard ID      : <DMI>
Motherboard Model   : Asus Lunar Canyon NUC 14 Pro AI NUC14LNK
Motherboard Chipset : Intel Lunar Lake-MX

DMI MB Manufacturer : ASUSTeK COMPUTER INC.
DMI MB Product      : NUC14LNK
DMI MB Version      : 
DMI MB Serial       : 2410CG019100044
DMI SYS Manufacturer: ASUSTeK COMPUTER INC.
DMI SYS Product     : NUC14LNK
DMI SYS Version     : 
DMI SYS Serial      : T1ASCG000264SML
DMI BIOS Version    : LNLNLLNK.0006.2024.1210.1520


------[ CPUID Registers / Logical CPU #0 ]------

allcpu: Package 0 / Core 0 / Thread 0: Valid, Intel Core

CPUID 00000000: 00000023-756E6547-6C65746E-49656E69 [GenuineIntel]
CPUID 00000001: 000B06D1-00800800-7FFAFBFF-BFEBFBFF
CPUID 00000002: 00FEFF01-000000F0-00000000-00000000
CPUID 00000003: 00000000-00000000-00000000-00000000
CPUID 00000004: FC004121-02C0003F-0000003F-00000000 [SL 00] [L1D: 48+192 KB]
CPUID 00000004: FC004122-03C0003F-0000003F-00000000 [SL 01] [L1I: 64 KB]
CPUID 00000004: FC01C143-0240003F-00000FFF-00000000 [SL 02] [L2U: 2560 KB]
CPUID 00000004: FC0FC163-02C0003F-00003FFF-00000004 [SL 03] [L3U: 12 MB]
CPUID 00000005: 00000040-00000040-00000003-10002020
CPUID 00000006: 00DFCFF7-00000002-00000409-00000003
CPUID 00000007: 00000002-239CA7EB-994027AC-FC1CC430 [SL 00]
CPUID 00000007: 44C009D7-00000003-00000000-00040430 [SL 01]
CPUID 00000007: 00000000-00000000-00000000-000000BF [SL 02]
CPUID 00000008: 00000000-00000000-00000000-00000000
CPUID 00000009: 00000000-00000000-00000000-00000000
CPUID 0000000A: 0D300806-00000280-00000007-00008603
CPUID 0000000B: 00000001-00000001-00000100-00000000 [SL 00]
CPUID 0000000B: 00000007-00000008-00000201-00000000 [SL 01]
CPUID 0000000C: 00000000-00000000-00000000-00000000
CPUID 0000000D: 00000207-00000340-00000A88-00000000 [SL 00] [x87]
CPUID 0000000D: 0000000F-000003D0-0001D900-00000000 [SL 01] [SSE]
CPUID 0000000D: 00000100-00000240-00000000-00000000 [SL 02] [AVX]
CPUID 0000000D: 00000080-00000000-00000001-00000000 [SL 08] [PT]
CPUID 0000000D: 00000008-00000A80-00000000-00000000 [SL 09] [PKRU]
CPUID 0000000D: 00000010-00000000-00000001-00000000 [SL 0B] [CET_U]
CPUID 0000000D: 00000018-00000000-00000001-00000000 [SL 0C] [CET_S]
CPUID 0000000D: 00000030-00000000-00000001-00000000 [SL 0E] [UINTR]
CPUID 0000000D: 00000328-00000000-00000001-00000000 [SL 0F] [LBR]
CPUID 0000000D: 00000008-00000000-00000001-00000000 [SL 10] [HWP]
CPUID 0000000E: 00000000-00000000-00000000-00000000
CPUID 0000000F: 00000000-00000000-00000000-00000000 [SL 00]
CPUID 0000000F: 00000000-00000000-00000000-00000000 [SL 01]
CPUID 00000010: 00000000-00000040-00000000-00000000 [SL 00]
CPUID 00000010: 00000000-00000000-00000000-00000000 [SL 01]
CPUID 00000011: 00000000-00000000-00000000-00000000
CPUID 00000012: 00000000-00000000-00000000-00000000 [SL 00]
CPUID 00000012: 00000000-00000000-00000000-00000000 [SL 01]
CPUID 00000013: 00000000-00000000-00000000-00000000
CPUID 00000014: 00000001-0000015F-00000007-00000000 [SL 00]
CPUID 00000014: 02490002-003F003F-00000000-00000000 [SL 01]
CPUID 00000015: 00000002-000000AC-0249F000-00000000 [86.00x / 38400000 / 3302.40]
CPUID 00000016: 00000CE4-000013EC-00000064-00000000 [3300 / 5100 / 100]
CPUID 00000017: 00000000-00000000-00000000-00000000 [SL 00]
CPUID 00000018: 00000008-00000000-00000000-00000000 [SL 00]
CPUID 00000018: 00000000-00080001-00000020-00004022 [SL 01]
CPUID 00000018: 00000000-00080006-00000004-00004022 [SL 02]
CPUID 00000018: 00000000-0010000F-00000001-00004125 [SL 03]
CPUID 00000018: 00000000-00080001-00000010-00004024 [SL 04]
CPUID 00000018: 00000000-00040006-00000008-00004024 [SL 05]
CPUID 00000018: 00000000-00080008-00000001-00004124 [SL 06]
CPUID 00000018: 00000000-00080007-00000080-00004043 [SL 07]
CPUID 00000018: 00000000-00080009-00000080-00004043 [SL 08]
CPUID 00000019: 00000000-00000000-00000000-00000000
CPUID 0000001A: 40000003-00000000-00000000-00000000 [Core: Lion Cove]
CPUID 0000001B: 00000001-00000001-00000002-00000000 [SL 00]
CPUID 0000001C: 4000000B-00000007-000F0007-00000000
CPUID 0000001D: 00000000-00000000-00000000-00000000 [SL 00]
CPUID 0000001E: 00000000-00000000-00000000-00000000 [SL 00]
CPUID 0000001F: 00000001-00000001-00000100-00000000 [SL 00]
CPUID 0000001F: 00000003-00000001-00000201-00000000 [SL 01]
CPUID 0000001F: 00000007-00000008-00000302-00000000 [SL 02]
CPUID 00000020: 00000000-00000001-00000000-00000000 [SL 00]
CPUID 00000021: 00000000-00000000-00000000-00000000
CPUID 00000022: 00000000-00000000-00000000-00000000
CPUID 00000023: 0000000B-00000003-00000000-00000000 [SL 00]
CPUID 00000023: 000003FF-0000000F-00000000-00000000 [SL 01]
CPUID 00000023: 00000000-00000000-00000000-00000000 [SL 02]
CPUID 00000023: 00001DFF-00000000-00000000-00000000 [SL 03]
CPUID 00000023: 00000000-00000000-00000000-00000000 [SL 04]
CPUID 00000023: 00000000-00000000-00000000-00000000 [SL 05]
CPUID 00000023: 00000000-00000000-00000000-00000000 [SL 06]
CPUID 00000023: 00000000-00000000-00000000-00000000 [SL 07]
CPUID 00000023: 00000000-00000000-00000000-00000000 [SL 08]
CPUID 00000023: 00000000-00000000-00000000-00000000 [SL 09]
CPUID 00000023: 00000000-00000000-00000000-00000000 [SL 0A]
CPUID 00000023: 00000000-00000000-00000000-00000000 [SL 0B]
CPUID 80000000: 80000008-00000000-00000000-00000000
CPUID 80000001: 00000000-00000000-00000121-2C100000
CPUID 80000002: 65746E49-2952286C-726F4320-4D542865 [Intel(R) Core(TM]
CPUID 80000003: 6C552029-20617274-38322039-00005638 [) Ultra 9 288V]
CPUID 80000004: 00000000-00000000-00000000-00000000 []
CPUID 80000005: 00000000-00000000-00000000-00000000 [L1D: 0 KB / L1I: 0 KB]
CPUID 80000006: 00000000-00000000-0A007040-00000000 [L2: 2560 KB / L3: 0 KB]
CPUID 80000007: 00000000-00000000-00000000-00000100
CPUID 80000008: 0000302A-00000200-00000000-00000000

L0+L1    Data Cache: 48+192 KB, 12-way Associative, 64-byte Line
L1     Instr. Cache:     64 KB, 16-way Associative, 64-byte Line
L2    Unified Cache:   2560 KB, 10-way Associative, 64-byte Line
L3    Unified Cache:     12 MB, 12-way Associative, 64-byte Line

------[ CPUID Registers / Logical CPU #1 ]------

allcpu: Package 0 / Core 1 / Thread 0: Valid, Intel Core

CPUID 00000000: 00000023-756E6547-6C65746E-49656E69 [GenuineIntel]
CPUID 00000001: 000B06D1-08800800-7FFAFBFF-BFEBFBFF
CPUID 00000002: 00FEFF01-000000F0-00000000-00000000
CPUID 00000003: 00000000-00000000-00000000-00000000
CPUID 00000004: FC004121-02C0003F-0000003F-00000000 [SL 00] [L1D: 48+192 KB]
CPUID 00000004: FC004122-03C0003F-0000003F-00000000 [SL 01] [L1I: 64 KB]
CPUID 00000004: FC01C143-0240003F-00000FFF-00000000 [SL 02] [L2U: 2560 KB]
CPUID 00000004: FC0FC163-02C0003F-00003FFF-00000004 [SL 03] [L3U: 12 MB]
CPUID 00000005: 00000040-00000040-00000003-10002020
CPUID 00000006: 00DFCFF7-00000002-00000409-00010003
CPUID 00000007: 00000002-239CA7EB-994027AC-FC1CC430 [SL 00]
CPUID 00000007: 44C009D7-00000003-00000000-00040430 [SL 01]
CPUID 00000007: 00000000-00000000-00000000-000000BF [SL 02]
CPUID 00000008: 00000000-00000000-00000000-00000000
CPUID 00000009: 00000000-00000000-00000000-00000000
CPUID 0000000A: 0D300806-00000280-00000007-00008603
CPUID 0000000B: 00000001-00000001-00000100-00000008 [SL 00]
CPUID 0000000B: 00000007-00000008-00000201-00000008 [SL 01]
CPUID 0000000C: 00000000-00000000-00000000-00000000
CPUID 0000000D: 00000207-00000340-00000A88-00000000 [SL 00] [x87]
CPUID 0000000D: 0000000F-000003D0-0001D900-00000000 [SL 01] [SSE]
CPUID 0000000D: 00000100-00000240-00000000-00000000 [SL 02] [AVX]
CPUID 0000000D: 00000080-00000000-00000001-00000000 [SL 08] [PT]
CPUID 0000000D: 00000008-00000A80-00000000-00000000 [SL 09] [PKRU]
CPUID 0000000D: 00000010-00000000-00000001-00000000 [SL 0B] [CET_U]
CPUID 0000000D: 00000018-00000000-00000001-00000000 [SL 0C] [CET_S]
CPUID 0000000D: 00000030-00000000-00000001-00000000 [SL 0E] [UINTR]
CPUID 0000000D: 00000328-00000000-00000001-00000000 [SL 0F] [LBR]
CPUID 0000000D: 00000008-00000000-00000001-00000000 [SL 10] [HWP]
CPUID 0000000E: 00000000-00000000-00000000-00000000
CPUID 0000000F: 00000000-00000000-00000000-00000000 [SL 00]
CPUID 0000000F: 00000000-00000000-00000000-00000000 [SL 01]
CPUID 00000010: 00000000-00000040-00000000-00000000 [SL 00]
CPUID 00000010: 00000000-00000000-00000000-00000000 [SL 01]
CPUID 00000011: 00000000-00000000-00000000-00000000
CPUID 00000012: 00000000-00000000-00000000-00000000 [SL 00]
CPUID 00000012: 00000000-00000000-00000000-00000000 [SL 01]
CPUID 00000013: 00000000-00000000-00000000-00000000
CPUID 00000014: 00000001-0000015F-00000007-00000000 [SL 00]
CPUID 00000014: 02490002-003F003F-00000000-00000000 [SL 01]
CPUID 00000015: 00000002-000000AC-0249F000-00000000 [86.00x / 38400000 / 3302.40]
CPUID 00000016: 00000CE4-000013EC-00000064-00000000 [3300 / 5100 / 100]
CPUID 00000017: 00000000-00000000-00000000-00000000 [SL 00]
CPUID 00000018: 00000008-00000000-00000000-00000000 [SL 00]
CPUID 00000018: 00000000-00080001-00000020-00004022 [SL 01]
CPUID 00000018: 00000000-00080006-00000004-00004022 [SL 02]
CPUID 00000018: 00000000-0010000F-00000001-00004125 [SL 03]
CPUID 00000018: 00000000-00080001-00000010-00004024 [SL 04]
CPUID 00000018: 00000000-00040006-00000008-00004024 [SL 05]
CPUID 00000018: 00000000-00080008-00000001-00004124 [SL 06]
CPUID 00000018: 00000000-00080007-00000080-00004043 [SL 07]
CPUID 00000018: 00000000-00080009-00000080-00004043 [SL 08]
CPUID 00000019: 00000000-00000000-00000000-00000000
CPUID 0000001A: 40000003-00000000-00000000-00000000 [Core: Lion Cove]
CPUID 0000001B: 00000001-00000001-00000002-00000000 [SL 00]
CPUID 0000001C: 4000000B-00000007-000F0007-00000000
CPUID 0000001D: 00000000-00000000-00000000-00000000 [SL 00]
CPUID 0000001E: 00000000-00000000-00000000-00000000 [SL 00]
CPUID 0000001F: 00000001-00000001-00000100-00000008 [SL 00]
CPUID 0000001F: 00000003-00000001-00000201-00000008 [SL 01]
CPUID 0000001F: 00000007-00000008-00000302-00000008 [SL 02]
CPUID 00000020: 00000000-00000001-00000000-00000000 [SL 00]
CPUID 00000021: 00000000-00000000-00000000-00000000
CPUID 00000022: 00000000-00000000-00000000-00000000
CPUID 00000023: 0000000B-00000003-00000000-00000000 [SL 00]
CPUID 00000023: 000003FF-0000000F-00000000-00000000 [SL 01]
CPUID 00000023: 00000000-00000000-00000000-00000000 [SL 02]
CPUID 00000023: 00001DFF-00000000-00000000-00000000 [SL 03]
CPUID 00000023: 00000000-00000000-00000000-00000000 [SL 04]
CPUID 00000023: 00000000-00000000-00000000-00000000 [SL 05]
CPUID 00000023: 00000000-00000000-00000000-00000000 [SL 06]
CPUID 00000023: 00000000-00000000-00000000-00000000 [SL 07]
CPUID 00000023: 00000000-00000000-00000000-00000000 [SL 08]
CPUID 00000023: 00000000-00000000-00000000-00000000 [SL 09]
CPUID 00000023: 00000000-00000000-00000000-00000000 [SL 0A]
CPUID 00000023: 00000000-00000000-00000000-00000000 [SL 0B]
CPUID 80000000: 80000008-00000000-00000000-00000000
CPUID 80000001: 00000000-00000000-00000121-2C100000
CPUID 80000002: 65746E49-2952286C-726F4320-4D542865 [Intel(R) Core(TM]
CPUID 80000003: 6C552029-20617274-38322039-00005638 [) Ultra 9 288V]
CPUID 80000004: 00000000-00000000-00000000-00000000 []
CPUID 80000005: 00000000-00000000-00000000-00000000 [L1D: 0 KB / L1I: 0 KB]
CPUID 80000006: 00000000-00000000-0A007040-00000000 [L2: 2560 KB / L3: 0 KB]
CPUID 80000007: 00000000-00000000-00000000-00000100
CPUID 80000008: 0000302A-00000200-00000000-00000000

L0+L1    Data Cache: 48+192 KB, 12-way Associative, 64-byte Line
L1     Instr. Cache:     64 KB, 16-way Associative, 64-byte Line
L2    Unified Cache:   2560 KB, 10-way Associative, 64-byte Line
L3    Unified Cache:     12 MB, 12-way Associative, 64-byte Line

------[ CPUID Registers / Logical CPU #2 ]------

allcpu: Package 0 / Core 2 / Thread 0: Valid, Intel Core

CPUID 00000000: 00000023-756E6547-6C65746E-49656E69 [GenuineIntel]
CPUID 00000001: 000B06D1-10800800-7FFAFBFF-BFEBFBFF
CPUID 00000002: 00FEFF01-000000F0-00000000-00000000
CPUID 00000003: 00000000-00000000-00000000-00000000
CPUID 00000004: FC004121-02C0003F-0000003F-00000000 [SL 00] [L1D: 48+192 KB]
CPUID 00000004: FC004122-03C0003F-0000003F-00000000 [SL 01] [L1I: 64 KB]
CPUID 00000004: FC01C143-0240003F-00000FFF-00000000 [SL 02] [L2U: 2560 KB]
CPUID 00000004: FC0FC163-02C0003F-00003FFF-00000004 [SL 03] [L3U: 12 MB]
CPUID 00000005: 00000040-00000040-00000003-10002020
CPUID 00000006: 00DFCFF7-00000002-00000409-00020003
CPUID 00000007: 00000002-239CA7EB-994027AC-FC1CC430 [SL 00]
CPUID 00000007: 44C009D7-00000003-00000000-00040430 [SL 01]
CPUID 00000007: 00000000-00000000-00000000-000000BF [SL 02]
CPUID 00000008: 00000000-00000000-00000000-00000000
CPUID 00000009: 00000000-00000000-00000000-00000000
CPUID 0000000A: 0D300806-00000280-00000007-00008603
CPUID 0000000B: 00000001-00000001-00000100-00000010 [SL 00]
CPUID 0000000B: 00000007-00000008-00000201-00000010 [SL 01]
CPUID 0000000C: 00000000-00000000-00000000-00000000
CPUID 0000000D: 00000207-00000340-00000A88-00000000 [SL 00] [x87]
CPUID 0000000D: 0000000F-000003D0-0001D900-00000000 [SL 01] [SSE]
CPUID 0000000D: 00000100-00000240-00000000-00000000 [SL 02] [AVX]
CPUID 0000000D: 00000080-00000000-00000001-00000000 [SL 08] [PT]
CPUID 0000000D: 00000008-00000A80-00000000-00000000 [SL 09] [PKRU]
CPUID 0000000D: 00000010-00000000-00000001-00000000 [SL 0B] [CET_U]
CPUID 0000000D: 00000018-00000000-00000001-00000000 [SL 0C] [CET_S]
CPUID 0000000D: 00000030-00000000-00000001-00000000 [SL 0E] [UINTR]
CPUID 0000000D: 00000328-00000000-00000001-00000000 [SL 0F] [LBR]
CPUID 0000000D: 00000008-00000000-00000001-00000000 [SL 10] [HWP]
CPUID 0000000E: 00000000-00000000-00000000-00000000
CPUID 0000000F: 00000000-00000000-00000000-00000000 [SL 00]
CPUID 0000000F: 00000000-00000000-00000000-00000000 [SL 01]
CPUID 00000010: 00000000-00000040-00000000-00000000 [SL 00]
CPUID 00000010: 00000000-00000000-00000000-00000000 [SL 01]
CPUID 00000011: 00000000-00000000-00000000-00000000
CPUID 00000012: 00000000-00000000-00000000-00000000 [SL 00]
CPUID 00000012: 00000000-00000000-00000000-00000000 [SL 01]
CPUID 00000013: 00000000-00000000-00000000-00000000
CPUID 00000014: 00000001-0000015F-00000007-00000000 [SL 00]
CPUID 00000014: 02490002-003F003F-00000000-00000000 [SL 01]
CPUID 00000015: 00000002-000000AC-0249F000-00000000 [86.00x / 38400000 / 3302.40]
CPUID 00000016: 00000CE4-000013EC-00000064-00000000 [3300 / 5100 / 100]
CPUID 00000017: 00000000-00000000-00000000-00000000 [SL 00]
CPUID 00000018: 00000008-00000000-00000000-00000000 [SL 00]
CPUID 00000018: 00000000-00080001-00000020-00004022 [SL 01]
CPUID 00000018: 00000000-00080006-00000004-00004022 [SL 02]
CPUID 00000018: 00000000-0010000F-00000001-00004125 [SL 03]
CPUID 00000018: 00000000-00080001-00000010-00004024 [SL 04]
CPUID 00000018: 00000000-00040006-00000008-00004024 [SL 05]
CPUID 00000018: 00000000-00080008-00000001-00004124 [SL 06]
CPUID 00000018: 00000000-00080007-00000080-00004043 [SL 07]
CPUID 00000018: 00000000-00080009-00000080-00004043 [SL 08]
CPUID 00000019: 00000000-00000000-00000000-00000000
CPUID 0000001A: 40000003-00000000-00000000-00000000 [Core: Lion Cove]
CPUID 0000001B: 00000001-00000001-00000002-00000000 [SL 00]
CPUID 0000001C: 4000000B-00000007-000F0007-00000000
CPUID 0000001D: 00000000-00000000-00000000-00000000 [SL 00]
CPUID 0000001E: 00000000-00000000-00000000-00000000 [SL 00]
CPUID 0000001F: 00000001-00000001-00000100-00000010 [SL 00]
CPUID 0000001F: 00000003-00000001-00000201-00000010 [SL 01]
CPUID 0000001F: 00000007-00000008-00000302-00000010 [SL 02]
CPUID 00000020: 00000000-00000001-00000000-00000000 [SL 00]
CPUID 00000021: 00000000-00000000-00000000-00000000
CPUID 00000022: 00000000-00000000-00000000-00000000
CPUID 00000023: 0000000B-00000003-00000000-00000000 [SL 00]
CPUID 00000023: 000003FF-0000000F-00000000-00000000 [SL 01]
CPUID 00000023: 00000000-00000000-00000000-00000000 [SL 02]
CPUID 00000023: 00001DFF-00000000-00000000-00000000 [SL 03]
CPUID 00000023: 00000000-00000000-00000000-00000000 [SL 04]
CPUID 00000023: 00000000-00000000-00000000-00000000 [SL 05]
CPUID 00000023: 00000000-00000000-00000000-00000000 [SL 06]
CPUID 00000023: 00000000-00000000-00000000-00000000 [SL 07]
CPUID 00000023: 00000000-00000000-00000000-00000000 [SL 08]
CPUID 00000023: 00000000-00000000-00000000-00000000 [SL 09]
CPUID 00000023: 00000000-00000000-00000000-00000000 [SL 0A]
CPUID 00000023: 00000000-00000000-00000000-00000000 [SL 0B]
CPUID 80000000: 80000008-00000000-00000000-00000000
CPUID 80000001: 00000000-00000000-00000121-2C100000
CPUID 80000002: 65746E49-2952286C-726F4320-4D542865 [Intel(R) Core(TM]
CPUID 80000003: 6C552029-20617274-38322039-00005638 [) Ultra 9 288V]
CPUID 80000004: 00000000-00000000-00000000-00000000 []
CPUID 80000005: 00000000-00000000-00000000-00000000 [L1D: 0 KB / L1I: 0 KB]
CPUID 80000006: 00000000-00000000-0A007040-00000000 [L2: 2560 KB / L3: 0 KB]
CPUID 80000007: 00000000-00000000-00000000-00000100
CPUID 80000008: 0000302A-00000200-00000000-00000000

L0+L1    Data Cache: 48+192 KB, 12-way Associative, 64-byte Line
L1     Instr. Cache:     64 KB, 16-way Associative, 64-byte Line
L2    Unified Cache:   2560 KB, 10-way Associative, 64-byte Line
L3    Unified Cache:     12 MB, 12-way Associative, 64-byte Line

------[ CPUID Registers / Logical CPU #3 ]------

allcpu: Package 0 / Core 3 / Thread 0: Valid, Intel Core

CPUID 00000000: 00000023-756E6547-6C65746E-49656E69 [GenuineIntel]
CPUID 00000001: 000B06D1-18800800-7FFAFBFF-BFEBFBFF
CPUID 00000002: 00FEFF01-000000F0-00000000-00000000
CPUID 00000003: 00000000-00000000-00000000-00000000
CPUID 00000004: FC004121-02C0003F-0000003F-00000000 [SL 00] [L1D: 48+192 KB]
CPUID 00000004: FC004122-03C0003F-0000003F-00000000 [SL 01] [L1I: 64 KB]
CPUID 00000004: FC01C143-0240003F-00000FFF-00000000 [SL 02] [L2U: 2560 KB]
CPUID 00000004: FC0FC163-02C0003F-00003FFF-00000004 [SL 03] [L3U: 12 MB]
CPUID 00000005: 00000040-00000040-00000003-10002020
CPUID 00000006: 00DFCFF7-00000002-00000409-00030003
CPUID 00000007: 00000002-239CA7EB-994027AC-FC1CC430 [SL 00]
CPUID 00000007: 44C009D7-00000003-00000000-00040430 [SL 01]
CPUID 00000007: 00000000-00000000-00000000-000000BF [SL 02]
CPUID 00000008: 00000000-00000000-00000000-00000000
CPUID 00000009: 00000000-00000000-00000000-00000000
CPUID 0000000A: 0D300806-00000280-00000007-00008603
CPUID 0000000B: 00000001-00000001-00000100-00000018 [SL 00]
CPUID 0000000B: 00000007-00000008-00000201-00000018 [SL 01]
CPUID 0000000C: 00000000-00000000-00000000-00000000
CPUID 0000000D: 00000207-00000340-00000A88-00000000 [SL 00] [x87]
CPUID 0000000D: 0000000F-000003D0-0001D900-00000000 [SL 01] [SSE]
CPUID 0000000D: 00000100-00000240-00000000-00000000 [SL 02] [AVX]
CPUID 0000000D: 00000080-00000000-00000001-00000000 [SL 08] [PT]
CPUID 0000000D: 00000008-00000A80-00000000-00000000 [SL 09] [PKRU]
CPUID 0000000D: 00000010-00000000-00000001-00000000 [SL 0B] [CET_U]
CPUID 0000000D: 00000018-00000000-00000001-00000000 [SL 0C] [CET_S]
CPUID 0000000D: 00000030-00000000-00000001-00000000 [SL 0E] [UINTR]
CPUID 0000000D: 00000328-00000000-00000001-00000000 [SL 0F] [LBR]
CPUID 0000000D: 00000008-00000000-00000001-00000000 [SL 10] [HWP]
CPUID 0000000E: 00000000-00000000-00000000-00000000
CPUID 0000000F: 00000000-00000000-00000000-00000000 [SL 00]
CPUID 0000000F: 00000000-00000000-00000000-00000000 [SL 01]
CPUID 00000010: 00000000-00000040-00000000-00000000 [SL 00]
CPUID 00000010: 00000000-00000000-00000000-00000000 [SL 01]
CPUID 00000011: 00000000-00000000-00000000-00000000
CPUID 00000012: 00000000-00000000-00000000-00000000 [SL 00]
CPUID 00000012: 00000000-00000000-00000000-00000000 [SL 01]
CPUID 00000013: 00000000-00000000-00000000-00000000
CPUID 00000014: 00000001-0000015F-00000007-00000000 [SL 00]
CPUID 00000014: 02490002-003F003F-00000000-00000000 [SL 01]
CPUID 00000015: 00000002-000000AC-0249F000-00000000 [86.00x / 38400000 / 3302.40]
CPUID 00000016: 00000CE4-000013EC-00000064-00000000 [3300 / 5100 / 100]
CPUID 00000017: 00000000-00000000-00000000-00000000 [SL 00]
CPUID 00000018: 00000008-00000000-00000000-00000000 [SL 00]
CPUID 00000018: 00000000-00080001-00000020-00004022 [SL 01]
CPUID 00000018: 00000000-00080006-00000004-00004022 [SL 02]
CPUID 00000018: 00000000-0010000F-00000001-00004125 [SL 03]
CPUID 00000018: 00000000-00080001-00000010-00004024 [SL 04]
CPUID 00000018: 00000000-00040006-00000008-00004024 [SL 05]
CPUID 00000018: 00000000-00080008-00000001-00004124 [SL 06]
CPUID 00000018: 00000000-00080007-00000080-00004043 [SL 07]
CPUID 00000018: 00000000-00080009-00000080-00004043 [SL 08]
CPUID 00000019: 00000000-00000000-00000000-00000000
CPUID 0000001A: 40000003-00000000-00000000-00000000 [Core: Lion Cove]
CPUID 0000001B: 00000001-00000001-00000002-00000000 [SL 00]
CPUID 0000001C: 4000000B-00000007-000F0007-00000000
CPUID 0000001D: 00000000-00000000-00000000-00000000 [SL 00]
CPUID 0000001E: 00000000-00000000-00000000-00000000 [SL 00]
CPUID 0000001F: 00000001-00000001-00000100-00000018 [SL 00]
CPUID 0000001F: 00000003-00000001-00000201-00000018 [SL 01]
CPUID 0000001F: 00000007-00000008-00000302-00000018 [SL 02]
CPUID 00000020: 00000000-00000001-00000000-00000000 [SL 00]
CPUID 00000021: 00000000-00000000-00000000-00000000
CPUID 00000022: 00000000-00000000-00000000-00000000
CPUID 00000023: 0000000B-00000003-00000000-00000000 [SL 00]
CPUID 00000023: 000003FF-0000000F-00000000-00000000 [SL 01]
CPUID 00000023: 00000000-00000000-00000000-00000000 [SL 02]
CPUID 00000023: 00001DFF-00000000-00000000-00000000 [SL 03]
CPUID 00000023: 00000000-00000000-00000000-00000000 [SL 04]
CPUID 00000023: 00000000-00000000-00000000-00000000 [SL 05]
CPUID 00000023: 00000000-00000000-00000000-00000000 [SL 06]
CPUID 00000023: 00000000-00000000-00000000-00000000 [SL 07]
CPUID 00000023: 00000000-00000000-00000000-00000000 [SL 08]
CPUID 00000023: 00000000-00000000-00000000-00000000 [SL 09]
CPUID 00000023: 00000000-00000000-00000000-00000000 [SL 0A]
CPUID 00000023: 00000000-00000000-00000000-00000000 [SL 0B]
CPUID 80000000: 80000008-00000000-00000000-00000000
CPUID 80000001: 00000000-00000000-00000121-2C100000
CPUID 80000002: 65746E49-2952286C-726F4320-4D542865 [Intel(R) Core(TM]
CPUID 80000003: 6C552029-20617274-38322039-00005638 [) Ultra 9 288V]
CPUID 80000004: 00000000-00000000-00000000-00000000 []
CPUID 80000005: 00000000-00000000-00000000-00000000 [L1D: 0 KB / L1I: 0 KB]
CPUID 80000006: 00000000-00000000-0A007040-00000000 [L2: 2560 KB / L3: 0 KB]
CPUID 80000007: 00000000-00000000-00000000-00000100
CPUID 80000008: 0000302A-00000200-00000000-00000000

L0+L1    Data Cache: 48+192 KB, 12-way Associative, 64-byte Line
L1     Instr. Cache:     64 KB, 16-way Associative, 64-byte Line
L2    Unified Cache:   2560 KB, 10-way Associative, 64-byte Line
L3    Unified Cache:     12 MB, 12-way Associative, 64-byte Line

------[ CPUID Registers / Logical CPU #4 ]------

allcpu: Package 0 / Core 4 / Thread 0: Valid, Intel Atom LP

CPUID 00000000: 00000023-756E6547-6C65746E-49656E69 [GenuineIntel]
CPUID 00000001: 000B06D1-40800800-7FFAFBFF-BFEBFBFF
CPUID 00000002: 00FEFF01-000000F0-00000000-00000000
CPUID 00000003: 00000000-00000000-00000000-00000000
CPUID 00000004: FC000121-01C0003F-0000003F-00000001 [SL 00] [L1D: 32 KB]
CPUID 00000004: FC000122-01C0003F-0000007F-00000001 [SL 01] [L1I: 64 KB]
CPUID 00000004: FC01C143-03C0003F-00000FFF-00000001 [SL 02] [L2U: 4 MB]
CPUID 00000005: 00000040-00000040-00000003-10002020
CPUID 00000006: 00DFCFF7-00000002-00000409-00040003
CPUID 00000007: 00000002-239CA7EB-994027AC-FC1CC430 [SL 00]
CPUID 00000007: 44C009D7-00000003-00000000-00040430 [SL 01]
CPUID 00000007: 00000000-00000000-00000000-000000BF [SL 02]
CPUID 00000008: 00000000-00000000-00000000-00000000
CPUID 00000009: 00000000-00000000-00000000-00000000
CPUID 0000000A: 0D300806-00000280-00000007-00008603
CPUID 0000000B: 00000001-00000001-00000100-00000040 [SL 00]
CPUID 0000000B: 00000007-00000008-00000201-00000040 [SL 01]
CPUID 0000000C: 00000000-00000000-00000000-00000000
CPUID 0000000D: 00000207-00000340-00000A88-00000000 [SL 00] [x87]
CPUID 0000000D: 0000000F-000003D0-0001D900-00000000 [SL 01] [SSE]
CPUID 0000000D: 00000100-00000240-00000000-00000000 [SL 02] [AVX]
CPUID 0000000D: 00000080-00000000-00000001-00000000 [SL 08] [PT]
CPUID 0000000D: 00000008-00000A80-00000000-00000000 [SL 09] [PKRU]
CPUID 0000000D: 00000010-00000000-00000001-00000000 [SL 0B] [CET_U]
CPUID 0000000D: 00000018-00000000-00000001-00000000 [SL 0C] [CET_S]
CPUID 0000000D: 00000030-00000000-00000001-00000000 [SL 0E] [UINTR]
CPUID 0000000D: 00000328-00000000-00000001-00000000 [SL 0F] [LBR]
CPUID 0000000D: 00000008-00000000-00000001-00000000 [SL 10] [HWP]
CPUID 0000000E: 00000000-00000000-00000000-00000000
CPUID 0000000F: 00000000-00000000-00000000-00000000 [SL 00]
CPUID 0000000F: 00000000-00000000-00000000-00000000 [SL 01]
CPUID 00000010: 00000000-00000040-00000000-00000000 [SL 00]
CPUID 00000010: 00000000-00000000-00000000-00000000 [SL 01]
CPUID 00000011: 00000000-00000000-00000000-00000000
CPUID 00000012: 00000000-00000000-00000000-00000000 [SL 00]
CPUID 00000012: 00000000-00000000-00000000-00000000 [SL 01]
CPUID 00000013: 00000000-00000000-00000000-00000000
CPUID 00000014: 00000001-0000015F-80000007-00000000 [SL 00]
CPUID 00000014: 02490002-003F003F-00000000-00000000 [SL 01]
CPUID 00000015: 00000002-000000AC-0249F000-00000000 [86.00x / 38400000 / 3302.40]
CPUID 00000016: 00000CE4-00000E74-00000064-00000000 [3300 / 3700 / 100]
CPUID 00000017: 00000000-00000000-00000000-00000000 [SL 00]
CPUID 00000018: 00000004-00000000-00000000-00000000 [SL 00]
CPUID 00000018: 00000000-00300003-00000001-00000121 [SL 01]
CPUID 00000018: 00000000-00040003-00000400-00000043 [SL 02]
CPUID 00000018: 00000000-00800001-00000001-00000122 [SL 03]
CPUID 00000018: 00000000-00080008-00000001-00000143 [SL 04]
CPUID 00000019: 00000000-00000000-00000000-00000000
CPUID 0000001A: 20000003-00000000-00000000-00000000 [Atom: Skymont]
CPUID 0000001B: 00000001-00000001-00000002-00000000 [SL 00]
CPUID 0000001C: C000000B-00000007-000F0007-00000000
CPUID 0000001D: 00000000-00000000-00000000-00000000 [SL 00]
CPUID 0000001E: 00000000-00000000-00000000-00000000 [SL 00]
CPUID 0000001F: 00000001-00000001-00000100-00000040 [SL 00]
CPUID 0000001F: 00000003-00000004-00000201-00000040 [SL 01]
CPUID 0000001F: 00000007-00000008-00000302-00000040 [SL 02]
CPUID 00000020: 00000000-00000001-00000000-00000000 [SL 00]
CPUID 00000021: 00000000-00000000-00000000-00000000
CPUID 00000022: 00000000-00000000-00000000-00000000
CPUID 00000023: 0000000F-00000003-00000008-00000000 [SL 00]
CPUID 00000023: 000000FF-00000077-00000000-00000000 [SL 01]
CPUID 00000023: 000000FC-00000003-000000FC-00000003 [SL 02]
CPUID 00000023: 00001F7F-00000000-00000000-00000000 [SL 03]
CPUID 00000023: 00000000-00000000-00000000-00000000 [SL 04]
CPUID 00000023: 00000000-00000000-00000000-00000000 [SL 05]
CPUID 00000023: 00000000-00000000-00000000-00000000 [SL 06]
CPUID 00000023: 00000000-00000000-00000000-00000000 [SL 07]
CPUID 00000023: 00000000-00000000-00000000-00000000 [SL 08]
CPUID 00000023: 00000000-00000000-00000000-00000000 [SL 09]
CPUID 00000023: 00000000-00000000-00000000-00000000 [SL 0A]
CPUID 00000023: 00000000-00000000-00000000-00000000 [SL 0B]
CPUID 00000023: 00000000-00000000-00000000-00000000 [SL 0C]
CPUID 00000023: 00000000-00000000-00000000-00000000 [SL 0D]
CPUID 00000023: 00000000-00000000-00000000-00000000 [SL 0E]
CPUID 00000023: 00000000-00000000-00000000-00000000 [SL 0F]
CPUID 80000000: 80000008-00000000-00000000-00000000
CPUID 80000001: 00000000-00000000-00000121-2C100000
CPUID 80000002: 65746E49-2952286C-726F4320-4D542865 [Intel(R) Core(TM]
CPUID 80000003: 6C552029-20617274-38322039-00005638 [) Ultra 9 288V]
CPUID 80000004: 00000000-00000000-00000000-00000000 []
CPUID 80000005: 00000000-00000000-00000000-00000000 [L1D: 0 KB / L1I: 0 KB]
CPUID 80000006: 00000000-00000000-10008040-00000000 [L2: 4096 KB / L3: 0 KB]
CPUID 80000007: 00000000-00000000-00000000-00000100
CPUID 80000008: 0000302A-00000200-00000000-00000000

L1    Data Cache:    32 KB,  8-way Associative, 64-byte Line
L1  Instr. Cache:    64 KB,  8-way Associative, 64-byte Line
L2 Unified Cache:     4 MB, 16-way Associative, 64-byte Line

------[ CPUID Registers / Logical CPU #5 ]------

allcpu: Package 0 / Core 5 / Thread 0: Valid, Intel Atom LP

CPUID 00000000: 00000023-756E6547-6C65746E-49656E69 [GenuineIntel]
CPUID 00000001: 000B06D1-42800800-7FFAFBFF-BFEBFBFF
CPUID 00000002: 00FEFF01-000000F0-00000000-00000000
CPUID 00000003: 00000000-00000000-00000000-00000000
CPUID 00000004: FC000121-01C0003F-0000003F-00000001 [SL 00] [L1D: 32 KB]
CPUID 00000004: FC000122-01C0003F-0000007F-00000001 [SL 01] [L1I: 64 KB]
CPUID 00000004: FC01C143-03C0003F-00000FFF-00000001 [SL 02] [L2U: 4 MB]
CPUID 00000005: 00000040-00000040-00000003-10002020
CPUID 00000006: 00DFCFF7-00000002-00000409-00050003
CPUID 00000007: 00000002-239CA7EB-994027AC-FC1CC430 [SL 00]
CPUID 00000007: 44C009D7-00000003-00000000-00040430 [SL 01]
CPUID 00000007: 00000000-00000000-00000000-000000BF [SL 02]
CPUID 00000008: 00000000-00000000-00000000-00000000
CPUID 00000009: 00000000-00000000-00000000-00000000
CPUID 0000000A: 0D300806-00000280-00000007-00008603
CPUID 0000000B: 00000001-00000001-00000100-00000042 [SL 00]
CPUID 0000000B: 00000007-00000008-00000201-00000042 [SL 01]
CPUID 0000000C: 00000000-00000000-00000000-00000000
CPUID 0000000D: 00000207-00000340-00000A88-00000000 [SL 00] [x87]
CPUID 0000000D: 0000000F-000003D0-0001D900-00000000 [SL 01] [SSE]
CPUID 0000000D: 00000100-00000240-00000000-00000000 [SL 02] [AVX]
CPUID 0000000D: 00000080-00000000-00000001-00000000 [SL 08] [PT]
CPUID 0000000D: 00000008-00000A80-00000000-00000000 [SL 09] [PKRU]
CPUID 0000000D: 00000010-00000000-00000001-00000000 [SL 0B] [CET_U]
CPUID 0000000D: 00000018-00000000-00000001-00000000 [SL 0C] [CET_S]
CPUID 0000000D: 00000030-00000000-00000001-00000000 [SL 0E] [UINTR]
CPUID 0000000D: 00000328-00000000-00000001-00000000 [SL 0F] [LBR]
CPUID 0000000D: 00000008-00000000-00000001-00000000 [SL 10] [HWP]
CPUID 0000000E: 00000000-00000000-00000000-00000000
CPUID 0000000F: 00000000-00000000-00000000-00000000 [SL 00]
CPUID 0000000F: 00000000-00000000-00000000-00000000 [SL 01]
CPUID 00000010: 00000000-00000040-00000000-00000000 [SL 00]
CPUID 00000010: 00000000-00000000-00000000-00000000 [SL 01]
CPUID 00000011: 00000000-00000000-00000000-00000000
CPUID 00000012: 00000000-00000000-00000000-00000000 [SL 00]
CPUID 00000012: 00000000-00000000-00000000-00000000 [SL 01]
CPUID 00000013: 00000000-00000000-00000000-00000000
CPUID 00000014: 00000001-0000015F-80000007-00000000 [SL 00]
CPUID 00000014: 02490002-003F003F-00000000-00000000 [SL 01]
CPUID 00000015: 00000002-000000AC-0249F000-00000000 [86.00x / 38400000 / 3302.40]
CPUID 00000016: 00000CE4-00000E74-00000064-00000000 [3300 / 3700 / 100]
CPUID 00000017: 00000000-00000000-00000000-00000000 [SL 00]
CPUID 00000018: 00000004-00000000-00000000-00000000 [SL 00]
CPUID 00000018: 00000000-00300003-00000001-00000121 [SL 01]
CPUID 00000018: 00000000-00040003-00000400-00000043 [SL 02]
CPUID 00000018: 00000000-00800001-00000001-00000122 [SL 03]
CPUID 00000018: 00000000-00080008-00000001-00000143 [SL 04]
CPUID 00000019: 00000000-00000000-00000000-00000000
CPUID 0000001A: 20000003-00000000-00000000-00000000 [Atom: Skymont]
CPUID 0000001B: 00000001-00000001-00000002-00000000 [SL 00]
CPUID 0000001C: C000000B-00000007-000F0007-00000000
CPUID 0000001D: 00000000-00000000-00000000-00000000 [SL 00]
CPUID 0000001E: 00000000-00000000-00000000-00000000 [SL 00]
CPUID 0000001F: 00000001-00000001-00000100-00000042 [SL 00]
CPUID 0000001F: 00000003-00000004-00000201-00000042 [SL 01]
CPUID 0000001F: 00000007-00000008-00000302-00000042 [SL 02]
CPUID 00000020: 00000000-00000001-00000000-00000000 [SL 00]
CPUID 00000021: 00000000-00000000-00000000-00000000
CPUID 00000022: 00000000-00000000-00000000-00000000
CPUID 00000023: 0000000F-00000003-00000008-00000000 [SL 00]
CPUID 00000023: 000000FF-00000077-00000000-00000000 [SL 01]
CPUID 00000023: 000000FC-00000003-000000FC-00000003 [SL 02]
CPUID 00000023: 00001F7F-00000000-00000000-00000000 [SL 03]
CPUID 00000023: 00000000-00000000-00000000-00000000 [SL 04]
CPUID 00000023: 00000000-00000000-00000000-00000000 [SL 05]
CPUID 00000023: 00000000-00000000-00000000-00000000 [SL 06]
CPUID 00000023: 00000000-00000000-00000000-00000000 [SL 07]
CPUID 00000023: 00000000-00000000-00000000-00000000 [SL 08]
CPUID 00000023: 00000000-00000000-00000000-00000000 [SL 09]
CPUID 00000023: 00000000-00000000-00000000-00000000 [SL 0A]
CPUID 00000023: 00000000-00000000-00000000-00000000 [SL 0B]
CPUID 00000023: 00000000-00000000-00000000-00000000 [SL 0C]
CPUID 00000023: 00000000-00000000-00000000-00000000 [SL 0D]
CPUID 00000023: 00000000-00000000-00000000-00000000 [SL 0E]
CPUID 00000023: 00000000-00000000-00000000-00000000 [SL 0F]
CPUID 80000000: 80000008-00000000-00000000-00000000
CPUID 80000001: 00000000-00000000-00000121-2C100000
CPUID 80000002: 65746E49-2952286C-726F4320-4D542865 [Intel(R) Core(TM]
CPUID 80000003: 6C552029-20617274-38322039-00005638 [) Ultra 9 288V]
CPUID 80000004: 00000000-00000000-00000000-00000000 []
CPUID 80000005: 00000000-00000000-00000000-00000000 [L1D: 0 KB / L1I: 0 KB]
CPUID 80000006: 00000000-00000000-10008040-00000000 [L2: 4096 KB / L3: 0 KB]
CPUID 80000007: 00000000-00000000-00000000-00000100
CPUID 80000008: 0000302A-00000200-00000000-00000000

L1    Data Cache:    32 KB,  8-way Associative, 64-byte Line
L1  Instr. Cache:    64 KB,  8-way Associative, 64-byte Line
L2 Unified Cache:     4 MB, 16-way Associative, 64-byte Line

------[ CPUID Registers / Logical CPU #6 ]------

allcpu: Package 0 / Core 6 / Thread 0: Valid, Intel Atom LP

CPUID 00000000: 00000023-756E6547-6C65746E-49656E69 [GenuineIntel]
CPUID 00000001: 000B06D1-44800800-7FFAFBFF-BFEBFBFF
CPUID 00000002: 00FEFF01-000000F0-00000000-00000000
CPUID 00000003: 00000000-00000000-00000000-00000000
CPUID 00000004: FC000121-01C0003F-0000003F-00000001 [SL 00] [L1D: 32 KB]
CPUID 00000004: FC000122-01C0003F-0000007F-00000001 [SL 01] [L1I: 64 KB]
CPUID 00000004: FC01C143-03C0003F-00000FFF-00000001 [SL 02] [L2U: 4 MB]
CPUID 00000005: 00000040-00000040-00000003-10002020
CPUID 00000006: 00DFCFF7-00000002-00000409-00060003
CPUID 00000007: 00000002-239CA7EB-994027AC-FC1CC430 [SL 00]
CPUID 00000007: 44C009D7-00000003-00000000-00040430 [SL 01]
CPUID 00000007: 00000000-00000000-00000000-000000BF [SL 02]
CPUID 00000008: 00000000-00000000-00000000-00000000
CPUID 00000009: 00000000-00000000-00000000-00000000
CPUID 0000000A: 0D300806-00000280-00000007-00008603
CPUID 0000000B: 00000001-00000001-00000100-00000044 [SL 00]
CPUID 0000000B: 00000007-00000008-00000201-00000044 [SL 01]
CPUID 0000000C: 00000000-00000000-00000000-00000000
CPUID 0000000D: 00000207-00000340-00000A88-00000000 [SL 00] [x87]
CPUID 0000000D: 0000000F-000003D0-0001D900-00000000 [SL 01] [SSE]
CPUID 0000000D: 00000100-00000240-00000000-00000000 [SL 02] [AVX]
CPUID 0000000D: 00000080-00000000-00000001-00000000 [SL 08] [PT]
CPUID 0000000D: 00000008-00000A80-00000000-00000000 [SL 09] [PKRU]
CPUID 0000000D: 00000010-00000000-00000001-00000000 [SL 0B] [CET_U]
CPUID 0000000D: 00000018-00000000-00000001-00000000 [SL 0C] [CET_S]
CPUID 0000000D: 00000030-00000000-00000001-00000000 [SL 0E] [UINTR]
CPUID 0000000D: 00000328-00000000-00000001-00000000 [SL 0F] [LBR]
CPUID 0000000D: 00000008-00000000-00000001-00000000 [SL 10] [HWP]
CPUID 0000000E: 00000000-00000000-00000000-00000000
CPUID 0000000F: 00000000-00000000-00000000-00000000 [SL 00]
CPUID 0000000F: 00000000-00000000-00000000-00000000 [SL 01]
CPUID 00000010: 00000000-00000040-00000000-00000000 [SL 00]
CPUID 00000010: 00000000-00000000-00000000-00000000 [SL 01]
CPUID 00000011: 00000000-00000000-00000000-00000000
CPUID 00000012: 00000000-00000000-00000000-00000000 [SL 00]
CPUID 00000012: 00000000-00000000-00000000-00000000 [SL 01]
CPUID 00000013: 00000000-00000000-00000000-00000000
CPUID 00000014: 00000001-0000015F-80000007-00000000 [SL 00]
CPUID 00000014: 02490002-003F003F-00000000-00000000 [SL 01]
CPUID 00000015: 00000002-000000AC-0249F000-00000000 [86.00x / 38400000 / 3302.40]
CPUID 00000016: 00000CE4-00000E74-00000064-00000000 [3300 / 3700 / 100]
CPUID 00000017: 00000000-00000000-00000000-00000000 [SL 00]
CPUID 00000018: 00000004-00000000-00000000-00000000 [SL 00]
CPUID 00000018: 00000000-00300003-00000001-00000121 [SL 01]
CPUID 00000018: 00000000-00040003-00000400-00000043 [SL 02]
CPUID 00000018: 00000000-00800001-00000001-00000122 [SL 03]
CPUID 00000018: 00000000-00080008-00000001-00000143 [SL 04]
CPUID 00000019: 00000000-00000000-00000000-00000000
CPUID 0000001A: 20000003-00000000-00000000-00000000 [Atom: Skymont]
CPUID 0000001B: 00000001-00000001-00000002-00000000 [SL 00]
CPUID 0000001C: C000000B-00000007-000F0007-00000000
CPUID 0000001D: 00000000-00000000-00000000-00000000 [SL 00]
CPUID 0000001E: 00000000-00000000-00000000-00000000 [SL 00]
CPUID 0000001F: 00000001-00000001-00000100-00000044 [SL 00]
CPUID 0000001F: 00000003-00000004-00000201-00000044 [SL 01]
CPUID 0000001F: 00000007-00000008-00000302-00000044 [SL 02]
CPUID 00000020: 00000000-00000001-00000000-00000000 [SL 00]
CPUID 00000021: 00000000-00000000-00000000-00000000
CPUID 00000022: 00000000-00000000-00000000-00000000
CPUID 00000023: 0000000F-00000003-00000008-00000000 [SL 00]
CPUID 00000023: 000000FF-00000077-00000000-00000000 [SL 01]
CPUID 00000023: 000000FC-00000003-000000FC-00000003 [SL 02]
CPUID 00000023: 00001F7F-00000000-00000000-00000000 [SL 03]
CPUID 00000023: 00000000-00000000-00000000-00000000 [SL 04]
CPUID 00000023: 00000000-00000000-00000000-00000000 [SL 05]
CPUID 00000023: 00000000-00000000-00000000-00000000 [SL 06]
CPUID 00000023: 00000000-00000000-00000000-00000000 [SL 07]
CPUID 00000023: 00000000-00000000-00000000-00000000 [SL 08]
CPUID 00000023: 00000000-00000000-00000000-00000000 [SL 09]
CPUID 00000023: 00000000-00000000-00000000-00000000 [SL 0A]
CPUID 00000023: 00000000-00000000-00000000-00000000 [SL 0B]
CPUID 00000023: 00000000-00000000-00000000-00000000 [SL 0C]
CPUID 00000023: 00000000-00000000-00000000-00000000 [SL 0D]
CPUID 00000023: 00000000-00000000-00000000-00000000 [SL 0E]
CPUID 00000023: 00000000-00000000-00000000-00000000 [SL 0F]
CPUID 80000000: 80000008-00000000-00000000-00000000
CPUID 80000001: 00000000-00000000-00000121-2C100000
CPUID 80000002: 65746E49-2952286C-726F4320-4D542865 [Intel(R) Core(TM]
CPUID 80000003: 6C552029-20617274-38322039-00005638 [) Ultra 9 288V]
CPUID 80000004: 00000000-00000000-00000000-00000000 []
CPUID 80000005: 00000000-00000000-00000000-00000000 [L1D: 0 KB / L1I: 0 KB]
CPUID 80000006: 00000000-00000000-10008040-00000000 [L2: 4096 KB / L3: 0 KB]
CPUID 80000007: 00000000-00000000-00000000-00000100
CPUID 80000008: 0000302A-00000200-00000000-00000000

L1    Data Cache:    32 KB,  8-way Associative, 64-byte Line
L1  Instr. Cache:    64 KB,  8-way Associative, 64-byte Line
L2 Unified Cache:     4 MB, 16-way Associative, 64-byte Line

------[ CPUID Registers / Logical CPU #7 ]------

allcpu: Package 0 / Core 7 / Thread 0: Valid, Intel Atom LP

CPUID 00000000: 00000023-756E6547-6C65746E-49656E69 [GenuineIntel]
CPUID 00000001: 000B06D1-46800800-7FFAFBFF-BFEBFBFF
CPUID 00000002: 00FEFF01-000000F0-00000000-00000000
CPUID 00000003: 00000000-00000000-00000000-00000000
CPUID 00000004: FC000121-01C0003F-0000003F-00000001 [SL 00] [L1D: 32 KB]
CPUID 00000004: FC000122-01C0003F-0000007F-00000001 [SL 01] [L1I: 64 KB]
CPUID 00000004: FC01C143-03C0003F-00000FFF-00000001 [SL 02] [L2U: 4 MB]
CPUID 00000005: 00000040-00000040-00000003-10002020
CPUID 00000006: 00DFCFF7-00000002-00000409-00070003
CPUID 00000007: 00000002-239CA7EB-994027AC-FC1CC430 [SL 00]
CPUID 00000007: 44C009D7-00000003-00000000-00040430 [SL 01]
CPUID 00000007: 00000000-00000000-00000000-000000BF [SL 02]
CPUID 00000008: 00000000-00000000-00000000-00000000
CPUID 00000009: 00000000-00000000-00000000-00000000
CPUID 0000000A: 0D300806-00000280-00000007-00008603
CPUID 0000000B: 00000001-00000001-00000100-00000046 [SL 00]
CPUID 0000000B: 00000007-00000008-00000201-00000046 [SL 01]
CPUID 0000000C: 00000000-00000000-00000000-00000000
CPUID 0000000D: 00000207-00000340-00000A88-00000000 [SL 00] [x87]
CPUID 0000000D: 0000000F-000003D0-0001D900-00000000 [SL 01] [SSE]
CPUID 0000000D: 00000100-00000240-00000000-00000000 [SL 02] [AVX]
CPUID 0000000D: 00000080-00000000-00000001-00000000 [SL 08] [PT]
CPUID 0000000D: 00000008-00000A80-00000000-00000000 [SL 09] [PKRU]
CPUID 0000000D: 00000010-00000000-00000001-00000000 [SL 0B] [CET_U]
CPUID 0000000D: 00000018-00000000-00000001-00000000 [SL 0C] [CET_S]
CPUID 0000000D: 00000030-00000000-00000001-00000000 [SL 0E] [UINTR]
CPUID 0000000D: 00000328-00000000-00000001-00000000 [SL 0F] [LBR]
CPUID 0000000D: 00000008-00000000-00000001-00000000 [SL 10] [HWP]
CPUID 0000000E: 00000000-00000000-00000000-00000000
CPUID 0000000F: 00000000-00000000-00000000-00000000 [SL 00]
CPUID 0000000F: 00000000-00000000-00000000-00000000 [SL 01]
CPUID 00000010: 00000000-00000040-00000000-00000000 [SL 00]
CPUID 00000010: 00000000-00000000-00000000-00000000 [SL 01]
CPUID 00000011: 00000000-00000000-00000000-00000000
CPUID 00000012: 00000000-00000000-00000000-00000000 [SL 00]
CPUID 00000012: 00000000-00000000-00000000-00000000 [SL 01]
CPUID 00000013: 00000000-00000000-00000000-00000000
CPUID 00000014: 00000001-0000015F-80000007-00000000 [SL 00]
CPUID 00000014: 02490002-003F003F-00000000-00000000 [SL 01]
CPUID 00000015: 00000002-000000AC-0249F000-00000000 [86.00x / 38400000 / 3302.40]
CPUID 00000016: 00000CE4-00000E74-00000064-00000000 [3300 / 3700 / 100]
CPUID 00000017: 00000000-00000000-00000000-00000000 [SL 00]
CPUID 00000018: 00000004-00000000-00000000-00000000 [SL 00]
CPUID 00000018: 00000000-00300003-00000001-00000121 [SL 01]
CPUID 00000018: 00000000-00040003-00000400-00000043 [SL 02]
CPUID 00000018: 00000000-00800001-00000001-00000122 [SL 03]
CPUID 00000018: 00000000-00080008-00000001-00000143 [SL 04]
CPUID 00000019: 00000000-00000000-00000000-00000000
CPUID 0000001A: 20000003-00000000-00000000-00000000 [Atom: Skymont]
CPUID 0000001B: 00000001-00000001-00000002-00000000 [SL 00]
CPUID 0000001C: C000000B-00000007-000F0007-00000000
CPUID 0000001D: 00000000-00000000-00000000-00000000 [SL 00]
CPUID 0000001E: 00000000-00000000-00000000-00000000 [SL 00]
CPUID 0000001F: 00000001-00000001-00000100-00000046 [SL 00]
CPUID 0000001F: 00000003-00000004-00000201-00000046 [SL 01]
CPUID 0000001F: 00000007-00000008-00000302-00000046 [SL 02]
CPUID 00000020: 00000000-00000001-00000000-00000000 [SL 00]
CPUID 00000021: 00000000-00000000-00000000-00000000
CPUID 00000022: 00000000-00000000-00000000-00000000
CPUID 00000023: 0000000F-00000003-00000008-00000000 [SL 00]
CPUID 00000023: 000000FF-00000077-00000000-00000000 [SL 01]
CPUID 00000023: 000000FC-00000003-000000FC-00000003 [SL 02]
CPUID 00000023: 00001F7F-00000000-00000000-00000000 [SL 03]
CPUID 00000023: 00000000-00000000-00000000-00000000 [SL 04]
CPUID 00000023: 00000000-00000000-00000000-00000000 [SL 05]
CPUID 00000023: 00000000-00000000-00000000-00000000 [SL 06]
CPUID 00000023: 00000000-00000000-00000000-00000000 [SL 07]
CPUID 00000023: 00000000-00000000-00000000-00000000 [SL 08]
CPUID 00000023: 00000000-00000000-00000000-00000000 [SL 09]
CPUID 00000023: 00000000-00000000-00000000-00000000 [SL 0A]
CPUID 00000023: 00000000-00000000-00000000-00000000 [SL 0B]
CPUID 00000023: 00000000-00000000-00000000-00000000 [SL 0C]
CPUID 00000023: 00000000-00000000-00000000-00000000 [SL 0D]
CPUID 00000023: 00000000-00000000-00000000-00000000 [SL 0E]
CPUID 00000023: 00000000-00000000-00000000-00000000 [SL 0F]
CPUID 80000000: 80000008-00000000-00000000-00000000
CPUID 80000001: 00000000-00000000-00000121-2C100000
CPUID 80000002: 65746E49-2952286C-726F4320-4D542865 [Intel(R) Core(TM]
CPUID 80000003: 6C552029-20617274-38322039-00005638 [) Ultra 9 288V]
CPUID 80000004: 00000000-00000000-00000000-00000000 []
CPUID 80000005: 00000000-00000000-00000000-00000000 [L1D: 0 KB / L1I: 0 KB]
CPUID 80000006: 00000000-00000000-10008040-00000000 [L2: 4096 KB / L3: 0 KB]
CPUID 80000007: 00000000-00000000-00000000-00000100
CPUID 80000008: 0000302A-00000200-00000000-00000000

L1    Data Cache:    32 KB,  8-way Associative, 64-byte Line
L1  Instr. Cache:    64 KB,  8-way Associative, 64-byte Line
L2 Unified Cache:     4 MB, 16-way Associative, 64-byte Line

------[ All CPUs ]------

CPU   0: APICID    0 / Package 0 / Core   0 / Thread 0: Valid
CPU   1: APICID    8 / Package 0 / Core   1 / Thread 0: Valid
CPU   2: APICID   16 / Package 0 / Core   2 / Thread 0: Valid
CPU   3: APICID   24 / Package 0 / Core   3 / Thread 0: Valid
CPU   4: APICID   64 / Package 0 / Core   4 / Thread 0: Valid
CPU   5: APICID   66 / Package 0 / Core   5 / Thread 0: Valid
CPU   6: APICID   68 / Package 0 / Core   6 / Thread 0: Valid
CPU   7: APICID   70 / Package 0 / Core   7 / Thread 0: Valid

------[ MSR Registers / Logical CPU #0 ]------

MSR 00000017: 001C-0000-0000-0000 [PlatID = 7]
MSR 0000001B: 0000-0000-FEE0-0900
MSR 00000035: 0000-0000-0008-0008
MSR 00000048: 0000-0000-0000-0001
MSR 00000049: < FAILED >
MSR 0000008B: 0000-0116-0000-0000
MSR 000000CE: 0804-043B-F081-2100 [eD = 0]
MSR 000000E7: 0000-005F-FCBE-2034 [S200]
MSR 000000E7: 0000-0060-0BA1-928A [S200]
MSR 000000E7: 0000-0060-191E-C4FA
MSR 000000E8: 0000-005B-1697-1338 [S200]
MSR 000000E8: 0000-005B-2127-C839 [S200]
MSR 000000E8: 0000-005B-2320-213B
MSR 0000010A: 0000-0000-0DF9-FD6B
MSR 0000010B: < FAILED >
MSR 00000194: 0000-0000-0011-0000
MSR 00000198: 0000-1323-0000-0F00 [S200]
MSR 00000198: 0000-1375-0000-1000 [S200]
MSR 00000198: 0000-23B7-0000-3200
MSR 00000199: 0000-0000-0000-2100
MSR 0000019A: 0000-0000-0000-0000
MSR 0000019B: 0000-0000-0000-0010
MSR 0000019C: 0000-0000-8833-0000 [S200]
MSR 0000019C: 0000-0000-8833-0000 [S200]
MSR 0000019C: 0000-0000-8833-0000
MSR 0000019D: 0000-0000-0000-0000
MSR 000001A0: 0000-0000-0085-0089
MSR 000001A2: 0000-0000-8564-0000
MSR 000001A4: 0000-0000-0000-0000
MSR 000001AA: 0000-0000-0000-30C2
MSR 000001AC: < FAILED >
MSR 000001AD: 2A2A-2A2A-2A2D-3233
MSR 000001AE: 0807-0605-0403-0201
MSR 000001AF: < FAILED >
MSR 000001B0: 0000-0000-0000-0006
MSR 000001B1: 0000-0000-8832-0000
MSR 000001B2: 0000-0000-0200-0000
MSR 000001FC: 0000-0000-00E4-005B
MSR 00000300: < FAILED >
MSR 0000030A: 0000-0000-0000-0000 [S200]
MSR 0000030A: 0000-0000-0000-0000 [S200]
MSR 0000030A: 0000-0000-0000-0000
MSR 0000030B: 0000-0000-0000-0000 [S200]
MSR 0000030B: 0000-0000-0000-0000 [S200]
MSR 0000030B: 0000-0000-0000-0000
MSR 00000480: 03DA-0600-0000-0015
MSR 00000481: 0000-00FF-0000-0016
MSR 00000482: FFFB-FFFE-0401-E172
MSR 00000483: FF7F-FFFF-0003-6DFF
MSR 00000484: 007E-FFFF-0000-11FF
MSR 00000485: 0000-0000-7004-C1E7
MSR 00000486: 0000-0000-8000-0021
MSR 00000487: 0000-0000-FFFF-FFFF
MSR 00000488: 0000-0000-0000-2000
MSR 00000489: 0000-0000-1BF7-6FFF
MSR 0000048A: 0000-0000-0000-002E
MSR 0000048B: CF5F-7FFF-0000-0000
MSR 0000048C: 0001-0F01-06F3-4141
MSR 0000048D: 0000-00FF-0000-0016
MSR 0000048E: FFFB-FFFE-0400-6172
MSR 0000048F: FF7F-FFFF-0003-6DFB
MSR 00000490: 007E-FFFF-0000-11FB
MSR 00000601: 0000-0000-0000-02F8
MSR 00000602: < FAILED >
MSR 00000603: 0036-0000-0036-3636
MSR 00000604: < FAILED >
MSR 00000606: 0000-0000-000A-0E03
MSR 0000060A: 0000-0000-0000-0000
MSR 0000060B: 0000-0000-0000-0000
MSR 0000060C: 0000-0000-0000-0000
MSR 0000060D: 0000-0011-618F-0572
MSR 00000610: 0000-8128-00DD-8128
MSR 00000611: 0000-0000-0827-6FFA [S200]
MSR 00000611: 0000-0000-0827-E56A [S200]
MSR 00000611: 0000-0000-0828-54FB
MSR 00000613: 0000-0000-0000-0000
MSR 00000614: 0000-0000-0000-00F0
MSR 00000618: 0000-0000-0000-0000
MSR 00000619: 0000-0000-0022-B0D0 [S200]
MSR 00000619: 0000-0000-0022-B2EC [S200]
MSR 00000619: 0000-0000-0022-B57B
MSR 0000061B: 0000-0000-0000-0000
MSR 0000061C: < FAILED >
MSR 0000061E: < FAILED >
MSR 00000620: 0000-0000-0000-042E
MSR 00000621: 0000-0000-138A-000F
MSR 00000638: 0000-0000-0000-0000
MSR 00000639: 0000-0000-0476-5E69 [S200]
MSR 00000639: 0000-0000-0476-9CCA [S200]
MSR 00000639: 0000-0000-0476-CD4B
MSR 0000063A: 0000-0000-0000-0000
MSR 0000063B: < FAILED >
MSR 00000640: 0000-0000-0000-0000
MSR 00000641: 0000-0000-0001-33F4 [S200]
MSR 00000641: 0000-0000-0001-3410 [S200]
MSR 00000641: 0000-0000-0001-341B
MSR 00000642: 0000-0000-0000-0010
MSR 00000648: 0000-0000-0000-0021
MSR 00000649: 0000-0000-0016-0088
MSR 0000064A: 0000-0000-0000-0000
MSR 0000064B: 0000-0000-0000-0000
MSR 0000064C: 0000-0000-0000-0020
MSR 00000650: 2525-2525-2525-2525
MSR 00000651: 0807-0605-0403-0201
MSR 00000690: < FAILED >
MSR 000006B0: 0000-0000-1000-0000
MSR 000006B1: 0000-0000-0000-0000
MSR 00000770: 0000-0000-0000-0001
MSR 00000771: 0000-0000-0112-263A
MSR 00000772: 0000-0000-8000-FF01
MSR 00000773: 0000-0000-0000-0005
MSR 00000774: 0000-019E-5400-3A02
MSR 00000777: 0000-0000-0000-0000

------[ MSR Registers / Logical CPU #1 ]------

MSR 00000017: 001C-0000-0000-0000 [PlatID = 7]
MSR 0000001B: 0000-0000-FEE0-0800
MSR 00000035: 0000-0000-0008-0008
MSR 00000048: 0000-0000-0000-0001
MSR 00000049: < FAILED >
MSR 0000008B: 0000-0116-0000-0000
MSR 000000CE: 0804-043B-F081-2100 [eD = 0]
MSR 000000E7: 0000-00C2-36B3-48DA
MSR 000000E8: 0000-00AF-D29E-724A
MSR 0000010A: 0000-0000-0DF9-FD6B
MSR 0000010B: < FAILED >
MSR 00000194: 0000-0000-0011-0000
MSR 00000198: 0000-2513-0000-2D00
MSR 00000199: 0000-0000-0000-2100
MSR 0000019A: 0000-0000-0000-0000
MSR 0000019B: 0000-0000-0000-0010
MSR 0000019C: 0000-0000-8835-0000
MSR 0000019D: 0000-0000-0000-0000
MSR 000001A0: 0000-0000-0085-0089
MSR 000001A2: 0000-0000-8564-0000
MSR 000001A4: 0000-0000-0000-0000
MSR 000001AA: 0000-0000-0000-30C2
MSR 000001AC: < FAILED >
MSR 000001AD: 2A2A-2A2A-2A2D-3233
MSR 000001AE: 0807-0605-0403-0201
MSR 000001AF: < FAILED >
MSR 000001B0: 0000-0000-0000-0006
MSR 000001B1: 0000-0000-882B-0000
MSR 000001B2: 0000-0000-0200-0000
MSR 000001FC: 0000-0000-00E4-005B
MSR 00000300: < FAILED >
MSR 0000030A: 0000-0000-0000-0000
MSR 0000030B: 0000-0000-0000-0000
MSR 00000480: 03DA-0600-0000-0015
MSR 00000481: 0000-00FF-0000-0016
MSR 00000482: FFFB-FFFE-0401-E172
MSR 00000483: FF7F-FFFF-0003-6DFF
MSR 00000484: 007E-FFFF-0000-11FF
MSR 00000485: 0000-0000-7004-C1E7
MSR 00000486: 0000-0000-8000-0021
MSR 00000487: 0000-0000-FFFF-FFFF
MSR 00000488: 0000-0000-0000-2000
MSR 00000489: 0000-0000-1BF7-6FFF
MSR 0000048A: 0000-0000-0000-002E
MSR 0000048B: CF5F-7FFF-0000-0000
MSR 0000048C: 0001-0F01-06F3-4141
MSR 0000048D: 0000-00FF-0000-0016
MSR 0000048E: FFFB-FFFE-0400-6172
MSR 0000048F: FF7F-FFFF-0003-6DFB
MSR 00000490: 007E-FFFF-0000-11FB
MSR 00000601: 0000-0000-0000-02F8
MSR 00000602: < FAILED >
MSR 00000603: 0036-0000-0036-3636
MSR 00000604: < FAILED >
MSR 00000606: 0000-0000-000A-0E03
MSR 0000060A: 0000-0000-0000-0000
MSR 0000060B: 0000-0000-0000-0000
MSR 0000060C: 0000-0000-0000-0000
MSR 0000060D: 0000-0011-618F-0572
MSR 00000610: 0000-8128-00DD-8128
MSR 00000611: 0000-0000-082A-FE8B
MSR 00000613: 0000-0000-0000-0000
MSR 00000614: 0000-0000-0000-00F0
MSR 00000618: 0000-0000-0000-0000
MSR 00000619: 0000-0000-0022-BEC9
MSR 0000061B: 0000-0000-0000-0000
MSR 0000061C: < FAILED >
MSR 0000061E: < FAILED >
MSR 00000620: 0000-0000-0000-042E
MSR 00000621: 0000-0000-2179-002E
MSR 00000638: 0000-0000-0000-0000
MSR 00000639: 0000-0000-0477-3DBA
MSR 0000063A: 0000-0000-0000-0000
MSR 0000063B: < FAILED >
MSR 00000640: 0000-0000-0000-0000
MSR 00000641: 0000-0000-0001-341B
MSR 00000642: 0000-0000-0000-0010
MSR 00000648: 0000-0000-0000-0021
MSR 00000649: 0000-0000-0016-0088
MSR 0000064A: 0000-0000-0000-0000
MSR 0000064B: 0000-0000-0000-0000
MSR 0000064C: 0000-0000-0000-0020
MSR 00000650: 2525-2525-2525-2525
MSR 00000651: 0807-0605-0403-0201
MSR 00000690: < FAILED >
MSR 000006B0: 0000-0000-1000-0000
MSR 000006B1: 0000-0000-0000-0000
MSR 00000770: 0000-0000-0000-0001
MSR 00000771: 0000-0000-0113-263B
MSR 00000772: 0000-0000-8000-FF01
MSR 00000773: 0000-0000-0000-0005
MSR 00000774: 0000-019E-5400-3B02
MSR 00000777: 0000-0000-0000-0000

------[ MSR Registers / Logical CPU #2 ]------

MSR 00000017: 001C-0000-0000-0000 [PlatID = 7]
MSR 0000001B: 0000-0000-FEE0-0800
MSR 00000035: 0000-0000-0008-0008
MSR 00000048: 0000-0000-0000-0001
MSR 00000049: < FAILED >
MSR 0000008B: 0000-0116-0000-0000
MSR 000000CE: 0804-043B-F081-2100 [eD = 0]
MSR 000000E7: 0000-004F-3A63-994F
MSR 000000E8: 0000-0048-2D7F-BF82
MSR 0000010A: 0000-0000-0DF9-FD6B
MSR 0000010B: < FAILED >
MSR 00000194: 0000-0000-0011-0000
MSR 00000198: 0000-2379-0000-3200
MSR 00000199: 0000-0000-0000-2100
MSR 0000019A: 0000-0000-0000-0000
MSR 0000019B: 0000-0000-0000-0010
MSR 0000019C: 0000-0000-8831-0000
MSR 0000019D: 0000-0000-0000-0000
MSR 000001A0: 0000-0000-0085-0089
MSR 000001A2: 0000-0000-8564-0000
MSR 000001A4: 0000-0000-0000-0000
MSR 000001AA: 0000-0000-0000-30C2
MSR 000001AC: < FAILED >
MSR 000001AD: 2A2A-2A2A-2A2D-3233
MSR 000001AE: 0807-0605-0403-0201
MSR 000001AF: < FAILED >
MSR 000001B0: 0000-0000-0000-0006
MSR 000001B1: 0000-0000-882B-0000
MSR 000001B2: 0000-0000-0200-0000
MSR 000001FC: 0000-0000-00E4-005B
MSR 00000300: < FAILED >
MSR 0000030A: 0000-0000-0000-0000
MSR 0000030B: 0000-0000-0000-0000
MSR 00000480: 03DA-0600-0000-0015
MSR 00000481: 0000-00FF-0000-0016
MSR 00000482: FFFB-FFFE-0401-E172
MSR 00000483: FF7F-FFFF-0003-6DFF
MSR 00000484: 007E-FFFF-0000-11FF
MSR 00000485: 0000-0000-7004-C1E7
MSR 00000486: 0000-0000-8000-0021
MSR 00000487: 0000-0000-FFFF-FFFF
MSR 00000488: 0000-0000-0000-2000
MSR 00000489: 0000-0000-1BF7-6FFF
MSR 0000048A: 0000-0000-0000-002E
MSR 0000048B: CF5F-7FFF-0000-0000
MSR 0000048C: 0001-0F01-06F3-4141
MSR 0000048D: 0000-00FF-0000-0016
MSR 0000048E: FFFB-FFFE-0400-6172
MSR 0000048F: FF7F-FFFF-0003-6DFB
MSR 00000490: 007E-FFFF-0000-11FB
MSR 00000601: 0000-0000-0000-02F8
MSR 00000602: < FAILED >
MSR 00000603: 0036-0000-0036-3636
MSR 00000604: < FAILED >
MSR 00000606: 0000-0000-000A-0E03
MSR 0000060A: 0000-0000-0000-0000
MSR 0000060B: 0000-0000-0000-0000
MSR 0000060C: 0000-0000-0000-0000
MSR 0000060D: 0000-0011-618F-0572
MSR 00000610: 0000-8128-00DD-8128
MSR 00000611: 0000-0000-082A-FFA8
MSR 00000613: 0000-0000-0000-0000
MSR 00000614: 0000-0000-0000-00F0
MSR 00000618: 0000-0000-0000-0000
MSR 00000619: 0000-0000-0022-BECD
MSR 0000061B: 0000-0000-0000-0000
MSR 0000061C: < FAILED >
MSR 0000061E: < FAILED >
MSR 00000620: 0000-0000-0000-042E
MSR 00000621: 0000-0000-2179-002E
MSR 00000638: 0000-0000-0000-0000
MSR 00000639: 0000-0000-0477-3E9B
MSR 0000063A: 0000-0000-0000-0000
MSR 0000063B: < FAILED >
MSR 00000640: 0000-0000-0000-0000
MSR 00000641: 0000-0000-0001-341B
MSR 00000642: 0000-0000-0000-0010
MSR 00000648: 0000-0000-0000-0021
MSR 00000649: 0000-0000-0016-0088
MSR 0000064A: 0000-0000-0000-0000
MSR 0000064B: 0000-0000-0000-0000
MSR 0000064C: 0000-0000-0000-0020
MSR 00000650: 2525-2525-2525-2525
MSR 00000651: 0807-0605-0403-0201
MSR 00000690: < FAILED >
MSR 000006B0: 0000-0000-1000-0000
MSR 000006B1: 0000-0000-0000-0000
MSR 00000770: 0000-0000-0000-0001
MSR 00000771: 0000-0000-0113-263A
MSR 00000772: 0000-0000-8000-FF01
MSR 00000773: 0000-0000-0000-0005
MSR 00000774: 0000-019E-5400-3A02
MSR 00000777: 0000-0000-0000-0000

------[ MSR Registers / Logical CPU #3 ]------

MSR 00000017: 001C-0000-0000-0000 [PlatID = 7]
MSR 0000001B: 0000-0000-FEE0-0800
MSR 00000035: 0000-0000-0008-0008
MSR 00000048: 0000-0000-0000-0001
MSR 00000049: < FAILED >
MSR 0000008B: 0000-0116-0000-0000
MSR 000000CE: 0804-043B-F081-2100 [eD = 0]
MSR 000000E7: 0000-005A-D127-5AC4
MSR 000000E8: 0000-0052-6F90-F9FE
MSR 0000010A: 0000-0000-0DF9-FD6B
MSR 0000010B: < FAILED >
MSR 00000194: 0000-0000-0011-0000
MSR 00000198: 0000-23CB-0000-3200
MSR 00000199: 0000-0000-0000-2100
MSR 0000019A: 0000-0000-0000-0000
MSR 0000019B: 0000-0000-0000-0010
MSR 0000019C: 0000-0000-8834-0000
MSR 0000019D: 0000-0000-0000-0000
MSR 000001A0: 0000-0000-0085-0089
MSR 000001A2: 0000-0000-8564-0000
MSR 000001A4: 0000-0000-0000-0000
MSR 000001AA: 0000-0000-0000-30C2
MSR 000001AC: < FAILED >
MSR 000001AD: 2A2A-2A2A-2A2D-3233
MSR 000001AE: 0807-0605-0403-0201
MSR 000001AF: < FAILED >
MSR 000001B0: 0000-0000-0000-0006
MSR 000001B1: 0000-0000-882B-0000
MSR 000001B2: 0000-0000-0200-0000
MSR 000001FC: 0000-0000-00E4-005B
MSR 00000300: < FAILED >
MSR 0000030A: 0000-0000-0000-0000
MSR 0000030B: 0000-0000-0000-0000
MSR 00000480: 03DA-0600-0000-0015
MSR 00000481: 0000-00FF-0000-0016
MSR 00000482: FFFB-FFFE-0401-E172
MSR 00000483: FF7F-FFFF-0003-6DFF
MSR 00000484: 007E-FFFF-0000-11FF
MSR 00000485: 0000-0000-7004-C1E7
MSR 00000486: 0000-0000-8000-0021
MSR 00000487: 0000-0000-FFFF-FFFF
MSR 00000488: 0000-0000-0000-2000
MSR 00000489: 0000-0000-1BF7-6FFF
MSR 0000048A: 0000-0000-0000-002E
MSR 0000048B: CF5F-7FFF-0000-0000
MSR 0000048C: 0001-0F01-06F3-4141
MSR 0000048D: 0000-00FF-0000-0016
MSR 0000048E: FFFB-FFFE-0400-6172
MSR 0000048F: FF7F-FFFF-0003-6DFB
MSR 00000490: 007E-FFFF-0000-11FB
MSR 00000601: 0000-0000-0000-02F8
MSR 00000602: < FAILED >
MSR 00000603: 0036-0000-0036-3636
MSR 00000604: < FAILED >
MSR 00000606: 0000-0000-000A-0E03
MSR 0000060A: 0000-0000-0000-0000
MSR 0000060B: 0000-0000-0000-0000
MSR 0000060C: 0000-0000-0000-0000
MSR 0000060D: 0000-0011-618F-0572
MSR 00000610: 0000-8128-00DD-8128
MSR 00000611: 0000-0000-082B-00C6
MSR 00000613: 0000-0000-0000-0000
MSR 00000614: 0000-0000-0000-00F0
MSR 00000618: 0000-0000-0000-0000
MSR 00000619: 0000-0000-0022-BED1
MSR 0000061B: 0000-0000-0000-0000
MSR 0000061C: < FAILED >
MSR 0000061E: < FAILED >
MSR 00000620: 0000-0000-0000-042E
MSR 00000621: 0000-0000-2179-002E
MSR 00000638: 0000-0000-0000-0000
MSR 00000639: 0000-0000-0477-3F7D
MSR 0000063A: 0000-0000-0000-0000
MSR 0000063B: < FAILED >
MSR 00000640: 0000-0000-0000-0000
MSR 00000641: 0000-0000-0001-341B
MSR 00000642: 0000-0000-0000-0010
MSR 00000648: 0000-0000-0000-0021
MSR 00000649: 0000-0000-0016-0088
MSR 0000064A: 0000-0000-0000-0000
MSR 0000064B: 0000-0000-0000-0000
MSR 0000064C: 0000-0000-0000-0020
MSR 00000650: 2525-2525-2525-2525
MSR 00000651: 0807-0605-0403-0201
MSR 00000690: < FAILED >
MSR 000006B0: 0000-0000-1000-0000
MSR 000006B1: 0000-0000-0000-0000
MSR 00000770: 0000-0000-0000-0001
MSR 00000771: 0000-0000-0113-263A
MSR 00000772: 0000-0000-8000-FF01
MSR 00000773: 0000-0000-0000-0005
MSR 00000774: 0000-019E-5400-3A02
MSR 00000777: 0000-0000-0000-0000

------[ MSR Registers / Logical CPU #4 ]------

MSR 00000017: 001C-0000-0000-0000 [PlatID = 7]
MSR 0000001B: 0000-0000-FEE0-0800
MSR 0000002A: 0000-0000-0000-0000
MSR 00000035: 0000-0000-0008-0008
MSR 00000048: 0000-0000-0000-0001
MSR 00000049: < FAILED >
MSR 0000008B: 0000-0116-0000-0000
MSR 000000CD: < FAILED >
MSR 000000CE: 0804-043B-F081-2100 [eD = 0]
MSR 000000E7: 0000-006B-44B3-D86C
MSR 000000E8: 0000-006C-802E-116E
MSR 000000EE: < FAILED >
MSR 0000010A: 0000-0000-0DF9-FD6B
MSR 0000010B: < FAILED >
MSR 0000011E: < FAILED >
MSR 00000194: 0000-0000-0011-0000
MSR 00000198: 0000-1F46-0000-2500
MSR 00000199: 0000-0000-0000-2100
MSR 0000019A: 0000-0000-0000-0000
MSR 0000019B: 0000-0000-0000-0010
MSR 0000019C: 0000-0000-8831-0000
MSR 0000019D: 0000-0000-0000-0000
MSR 000001A0: 0000-0000-0085-0089
MSR 000001A2: 0000-0000-8564-0000
MSR 000001A4: 0000-0000-0000-0000
MSR 000001AA: 0000-0000-0000-30C2
MSR 000001AC: < FAILED >
MSR 000001AD: 2A2A-2A2A-2A2D-3233
MSR 000001AE: 0807-0605-0403-0201
MSR 000001AF: < FAILED >
MSR 000001B0: 0000-0000-0000-0006
MSR 000001B1: 0000-0000-882C-0000
MSR 000001B2: 0000-0000-0200-0000
MSR 000001FC: 0000-0000-00E4-005B
MSR 00000300: < FAILED >
MSR 0000030A: 0000-0000-0000-0000
MSR 0000030B: 0000-0000-0000-0000
MSR 00000480: 03DA-0600-0000-0015
MSR 00000481: 0000-00FF-0000-0016
MSR 00000482: FFFB-FFFE-0401-E172
MSR 00000483: FF7F-FFFF-0003-6DFF
MSR 00000484: 007E-FFFF-0000-11FF
MSR 00000485: 0000-0000-7004-C1E7
MSR 00000486: 0000-0000-8000-0021
MSR 00000487: 0000-0000-FFFF-FFFF
MSR 00000488: 0000-0000-0000-2000
MSR 00000489: 0000-0000-1BF7-6FFF
MSR 0000048A: 0000-0000-0000-002E
MSR 0000048B: CF5F-7FFF-0000-0000
MSR 0000048C: 0001-0F01-06F3-4141
MSR 0000048D: 0000-00FF-0000-0016
MSR 0000048E: FFFB-FFFE-0400-6172
MSR 0000048F: FF7F-FFFF-0003-6DFB
MSR 00000490: 007E-FFFF-0000-11FB
MSR 00000601: 0000-0000-0000-02F8
MSR 00000602: < FAILED >
MSR 00000603: 0036-0000-0036-3636
MSR 00000604: < FAILED >
MSR 00000606: 0000-0000-000A-0E03
MSR 0000060A: 0000-0000-0000-0000
MSR 0000060B: 0000-0000-0000-0000
MSR 0000060C: 0000-0000-0000-0000
MSR 0000060D: 0000-0011-618F-0572
MSR 00000610: 0000-8128-00DD-8128
MSR 00000611: 0000-0000-082B-020D
MSR 00000613: 0000-0000-0000-0000
MSR 00000614: 0000-0000-0000-00F0
MSR 00000618: 0000-0000-0000-0000
MSR 00000619: 0000-0000-0022-BED9
MSR 0000061B: 0000-0000-0000-0000
MSR 0000061C: < FAILED >
MSR 0000061E: < FAILED >
MSR 00000620: 0000-0000-0000-042E
MSR 00000621: 0000-0000-138A-000F
MSR 00000638: 0000-0000-0000-0000
MSR 00000639: 0000-0000-0477-4053
MSR 0000063A: 0000-0000-0000-0000
MSR 0000063B: < FAILED >
MSR 00000640: 0000-0000-0000-0000
MSR 00000641: 0000-0000-0001-341B
MSR 00000642: 0000-0000-0000-0010
MSR 00000648: 0000-0000-0000-0021
MSR 00000649: 0000-0000-0016-0088
MSR 0000064A: 0000-0000-0000-0000
MSR 0000064B: 0000-0000-0000-0000
MSR 0000064C: 0000-0000-0000-0020
MSR 00000650: 2525-2525-2525-2525
MSR 00000651: 0807-0605-0403-0201
MSR 00000660: 0000-0125-8700-F79A
MSR 00000661: < FAILED >
MSR 00000662: < FAILED >
MSR 00000663: < FAILED >
MSR 00000664: 0000-0205-8A17-4006
MSR 00000665: < FAILED >
MSR 00000666: < FAILED >
MSR 00000667: < FAILED >
MSR 00000668: < FAILED >
MSR 00000669: < FAILED >
MSR 0000066A: < FAILED >
MSR 0000066B: < FAILED >
MSR 0000066C: < FAILED >
MSR 0000066D: < FAILED >
MSR 0000066E: < FAILED >
MSR 0000066F: < FAILED >
MSR 00000670: < FAILED >
MSR 00000671: < FAILED >
MSR 00000672: < FAILED >
MSR 00000673: < FAILED >
MSR 00000674: < FAILED >
MSR 00000675: < FAILED >
MSR 00000676: < FAILED >
MSR 00000677: < FAILED >
MSR 00000690: < FAILED >
MSR 000006B0: 0000-0000-1000-0000
MSR 000006B1: 0000-0000-0000-0000
MSR 00000770: 0000-0000-0000-0001
MSR 00000771: 0000-0000-0116-2125
MSR 00000772: 0000-0000-8000-FF01
MSR 00000773: 0000-0000-0000-0005
MSR 00000774: 0000-019E-5400-2521
MSR 00000777: 0000-0000-0000-0000

------[ MSR Registers / Logical CPU #5 ]------

MSR 00000017: 001C-0000-0000-0000 [PlatID = 7]
MSR 0000001B: 0000-0000-FEE0-0800
MSR 0000002A: 0000-0000-0000-0000
MSR 00000035: 0000-0000-0008-0008
MSR 00000048: 0000-0000-0000-0001
MSR 00000049: < FAILED >
MSR 0000008B: 0000-0116-0000-0000
MSR 000000CD: < FAILED >
MSR 000000CE: 0804-043B-F081-2100 [eD = 0]
MSR 000000E7: 0000-007A-5BA1-8080
MSR 000000E8: 0000-007B-F523-5B24
MSR 000000EE: < FAILED >
MSR 0000010A: 0000-0000-0DF9-FD6B
MSR 0000010B: < FAILED >
MSR 0000011E: < FAILED >
MSR 00000194: 0000-0000-0011-0000
MSR 00000198: 0000-1F48-0000-2500
MSR 00000199: 0000-0000-0000-2100
MSR 0000019A: 0000-0000-0000-0000
MSR 0000019B: 0000-0000-0000-0010
MSR 0000019C: 0000-0000-8831-0000
MSR 0000019D: 0000-0000-0000-0000
MSR 000001A0: 0000-0000-0085-0089
MSR 000001A2: 0000-0000-8564-0000
MSR 000001A4: 0000-0000-0000-0000
MSR 000001AA: 0000-0000-0000-30C2
MSR 000001AC: < FAILED >
MSR 000001AD: 2A2A-2A2A-2A2D-3233
MSR 000001AE: 0807-0605-0403-0201
MSR 000001AF: < FAILED >
MSR 000001B0: 0000-0000-0000-0006
MSR 000001B1: 0000-0000-882D-0000
MSR 000001B2: 0000-0000-0200-0000
MSR 000001FC: 0000-0000-00E4-005B
MSR 00000300: < FAILED >
MSR 0000030A: 0000-0000-0000-0000
MSR 0000030B: 0000-0000-0000-0000
MSR 00000480: 03DA-0600-0000-0015
MSR 00000481: 0000-00FF-0000-0016
MSR 00000482: FFFB-FFFE-0401-E172
MSR 00000483: FF7F-FFFF-0003-6DFF
MSR 00000484: 007E-FFFF-0000-11FF
MSR 00000485: 0000-0000-7004-C1E7
MSR 00000486: 0000-0000-8000-0021
MSR 00000487: 0000-0000-FFFF-FFFF
MSR 00000488: 0000-0000-0000-2000
MSR 00000489: 0000-0000-1BF7-6FFF
MSR 0000048A: 0000-0000-0000-002E
MSR 0000048B: CF5F-7FFF-0000-0000
MSR 0000048C: 0001-0F01-06F3-4141
MSR 0000048D: 0000-00FF-0000-0016
MSR 0000048E: FFFB-FFFE-0400-6172
MSR 0000048F: FF7F-FFFF-0003-6DFB
MSR 00000490: 007E-FFFF-0000-11FB
MSR 00000601: 0000-0000-0000-02F8
MSR 00000602: < FAILED >
MSR 00000603: 0036-0000-0036-3636
MSR 00000604: < FAILED >
MSR 00000606: 0000-0000-000A-0E03
MSR 0000060A: 0000-0000-0000-0000
MSR 0000060B: 0000-0000-0000-0000
MSR 0000060C: 0000-0000-0000-0000
MSR 0000060D: 0000-0011-618F-0572
MSR 00000610: 0000-8128-00DD-8128
MSR 00000611: 0000-0000-082B-0455
MSR 00000613: 0000-0000-0000-0000
MSR 00000614: 0000-0000-0000-00F0
MSR 00000618: 0000-0000-0000-0000
MSR 00000619: 0000-0000-0022-BEE0
MSR 0000061B: 0000-0000-0000-0000
MSR 0000061C: < FAILED >
MSR 0000061E: < FAILED >
MSR 00000620: 0000-0000-0000-042E
MSR 00000621: 0000-0000-0000-0000
MSR 00000638: 0000-0000-0000-0000
MSR 00000639: 0000-0000-0477-40FE
MSR 0000063A: 0000-0000-0000-0000
MSR 0000063B: < FAILED >
MSR 00000640: 0000-0000-0000-0000
MSR 00000641: 0000-0000-0001-341B
MSR 00000642: 0000-0000-0000-0010
MSR 00000648: 0000-0000-0000-0021
MSR 00000649: 0000-0000-0016-0088
MSR 0000064A: 0000-0000-0000-0000
MSR 0000064B: 0000-0000-0000-0000
MSR 0000064C: 0000-0000-0000-0020
MSR 00000650: 2525-2525-2525-2525
MSR 00000651: 0807-0605-0403-0201
MSR 00000660: 0000-010F-C4EB-9CD8
MSR 00000661: < FAILED >
MSR 00000662: < FAILED >
MSR 00000663: < FAILED >
MSR 00000664: 0000-0205-8A17-4006
MSR 00000665: < FAILED >
MSR 00000666: < FAILED >
MSR 00000667: < FAILED >
MSR 00000668: < FAILED >
MSR 00000669: < FAILED >
MSR 0000066A: < FAILED >
MSR 0000066B: < FAILED >
MSR 0000066C: < FAILED >
MSR 0000066D: < FAILED >
MSR 0000066E: < FAILED >
MSR 0000066F: < FAILED >
MSR 00000670: < FAILED >
MSR 00000671: < FAILED >
MSR 00000672: < FAILED >
MSR 00000673: < FAILED >
MSR 00000674: < FAILED >
MSR 00000675: < FAILED >
MSR 00000676: < FAILED >
MSR 00000677: < FAILED >
MSR 00000690: < FAILED >
MSR 000006B0: 0000-0000-1000-0000
MSR 000006B1: 0000-0000-0000-0000
MSR 00000770: 0000-0000-0000-0001
MSR 00000771: 0000-0000-0116-2125
MSR 00000772: 0000-0000-8000-FF01
MSR 00000773: 0000-0000-0000-0005
MSR 00000774: 0000-019E-5400-2521
MSR 00000777: 0000-0000-0000-0000

------[ MSR Registers / Logical CPU #6 ]------

MSR 00000017: 001C-0000-0000-0000 [PlatID = 7]
MSR 0000001B: 0000-0000-FEE0-0800
MSR 0000002A: 0000-0000-0000-0000
MSR 00000035: 0000-0000-0008-0008
MSR 00000048: 0000-0000-0000-0001
MSR 00000049: < FAILED >
MSR 0000008B: 0000-0116-0000-0000
MSR 000000CD: < FAILED >
MSR 000000CE: 0804-043B-F081-2100 [eD = 0]
MSR 000000E7: 0000-0084-17DE-B4C4
MSR 000000E8: 0000-0085-A7A5-00E9
MSR 000000EE: < FAILED >
MSR 0000010A: 0000-0000-0DF9-FD6B
MSR 0000010B: < FAILED >
MSR 0000011E: < FAILED >
MSR 00000194: 0000-0000-0011-0000
MSR 00000198: 0000-1F19-0000-2500
MSR 00000199: 0000-0000-0000-2100
MSR 0000019A: 0000-0000-0000-0000
MSR 0000019B: 0000-0000-0000-0010
MSR 0000019C: 0000-0000-8831-0000
MSR 0000019D: 0000-0000-0000-0000
MSR 000001A0: 0000-0000-0085-0089
MSR 000001A2: 0000-0000-8564-0000
MSR 000001A4: 0000-0000-0000-0000
MSR 000001AA: 0000-0000-0000-30C2
MSR 000001AC: < FAILED >
MSR 000001AD: 2A2A-2A2A-2A2D-3233
MSR 000001AE: 0807-0605-0403-0201
MSR 000001AF: < FAILED >
MSR 000001B0: 0000-0000-0000-0006
MSR 000001B1: 0000-0000-882E-0000
MSR 000001B2: 0000-0000-0200-0000
MSR 000001FC: 0000-0000-00E4-005B
MSR 00000300: < FAILED >
MSR 0000030A: 0000-0000-0000-0000
MSR 0000030B: 0000-0000-0000-0000
MSR 00000480: 03DA-0600-0000-0015
MSR 00000481: 0000-00FF-0000-0016
MSR 00000482: FFFB-FFFE-0401-E172
MSR 00000483: FF7F-FFFF-0003-6DFF
MSR 00000484: 007E-FFFF-0000-11FF
MSR 00000485: 0000-0000-7004-C1E7
MSR 00000486: 0000-0000-8000-0021
MSR 00000487: 0000-0000-FFFF-FFFF
MSR 00000488: 0000-0000-0000-2000
MSR 00000489: 0000-0000-1BF7-6FFF
MSR 0000048A: 0000-0000-0000-002E
MSR 0000048B: CF5F-7FFF-0000-0000
MSR 0000048C: 0001-0F01-06F3-4141
MSR 0000048D: 0000-00FF-0000-0016
MSR 0000048E: FFFB-FFFE-0400-6172
MSR 0000048F: FF7F-FFFF-0003-6DFB
MSR 00000490: 007E-FFFF-0000-11FB
MSR 00000601: 0000-0000-0000-02F8
MSR 00000602: < FAILED >
MSR 00000603: 0036-0000-0036-3636
MSR 00000604: < FAILED >
MSR 00000606: 0000-0000-000A-0E03
MSR 0000060A: 0000-0000-0000-0000
MSR 0000060B: 0000-0000-0000-0000
MSR 0000060C: 0000-0000-0000-0000
MSR 0000060D: 0000-0011-618F-0572
MSR 00000610: 0000-8128-00DD-8128
MSR 00000611: 0000-0000-082B-0500
MSR 00000613: 0000-0000-0000-0000
MSR 00000614: 0000-0000-0000-00F0
MSR 00000618: 0000-0000-0000-0000
MSR 00000619: 0000-0000-0022-BEE3
MSR 0000061B: 0000-0000-0000-0000
MSR 0000061C: < FAILED >
MSR 0000061E: < FAILED >
MSR 00000620: 0000-0000-0000-042E
MSR 00000621: 0000-0000-138A-000F
MSR 00000638: 0000-0000-0000-0000
MSR 00000639: 0000-0000-0477-416A
MSR 0000063A: 0000-0000-0000-0000
MSR 0000063B: < FAILED >
MSR 00000640: 0000-0000-0000-0000
MSR 00000641: 0000-0000-0001-341B
MSR 00000642: 0000-0000-0000-0010
MSR 00000648: 0000-0000-0000-0021
MSR 00000649: 0000-0000-0016-0088
MSR 0000064A: 0000-0000-0000-0000
MSR 0000064B: 0000-0000-0000-0000
MSR 0000064C: 0000-0000-0000-0020
MSR 00000650: 2525-2525-2525-2525
MSR 00000651: 0807-0605-0403-0201
MSR 00000660: 0000-0123-346E-E1F2
MSR 00000661: < FAILED >
MSR 00000662: < FAILED >
MSR 00000663: < FAILED >
MSR 00000664: 0000-0205-8A17-4006
MSR 00000665: < FAILED >
MSR 00000666: < FAILED >
MSR 00000667: < FAILED >
MSR 00000668: < FAILED >
MSR 00000669: < FAILED >
MSR 0000066A: < FAILED >
MSR 0000066B: < FAILED >
MSR 0000066C: < FAILED >
MSR 0000066D: < FAILED >
MSR 0000066E: < FAILED >
MSR 0000066F: < FAILED >
MSR 00000670: < FAILED >
MSR 00000671: < FAILED >
MSR 00000672: < FAILED >
MSR 00000673: < FAILED >
MSR 00000674: < FAILED >
MSR 00000675: < FAILED >
MSR 00000676: < FAILED >
MSR 00000677: < FAILED >
MSR 00000690: < FAILED >
MSR 000006B0: 0000-0000-1000-0000
MSR 000006B1: 0000-0000-0000-0000
MSR 00000770: 0000-0000-0000-0001
MSR 00000771: 0000-0000-0116-2125
MSR 00000772: 0000-0000-8000-FF01
MSR 00000773: 0000-0000-0000-0005
MSR 00000774: 0000-019E-5400-2521
MSR 00000777: 0000-0000-0000-0000

------[ MSR Registers / Logical CPU #7 ]------

MSR 00000017: 001C-0000-0000-0000 [PlatID = 7]
MSR 0000001B: 0000-0000-FEE0-0800
MSR 0000002A: 0000-0000-0000-0000
MSR 00000035: 0000-0000-0008-0008
MSR 00000048: 0000-0000-0000-0001
MSR 00000049: < FAILED >
MSR 0000008B: 0000-0116-0000-0000
MSR 000000CD: < FAILED >
MSR 000000CE: 0804-043B-F081-2100 [eD = 0]
MSR 000000E7: 0000-0078-58BE-A234
MSR 000000E8: 0000-007A-08D8-5CEB
MSR 000000EE: < FAILED >
MSR 0000010A: 0000-0000-0DF9-FD6B
MSR 0000010B: < FAILED >
MSR 0000011E: < FAILED >
MSR 00000194: 0000-0000-0011-0000
MSR 00000198: 0000-1F77-0000-2500
MSR 00000199: 0000-0000-0000-2100
MSR 0000019A: 0000-0000-0000-0000
MSR 0000019B: 0000-0000-0000-0010
MSR 0000019C: 0000-0000-8831-0000
MSR 0000019D: 0000-0000-0000-0000
MSR 000001A0: 0000-0000-0085-0089
MSR 000001A2: 0000-0000-8564-0000
MSR 000001A4: 0000-0000-0000-0000
MSR 000001AA: 0000-0000-0000-30C2
MSR 000001AC: < FAILED >
MSR 000001AD: 2A2A-2A2A-2A2D-3233
MSR 000001AE: 0807-0605-0403-0201
MSR 000001AF: < FAILED >
MSR 000001B0: 0000-0000-0000-0006
MSR 000001B1: 0000-0000-882E-0000
MSR 000001B2: 0000-0000-0200-0000
MSR 000001FC: 0000-0000-00E4-005B
MSR 00000300: < FAILED >
MSR 0000030A: 0000-0000-0000-0000
MSR 0000030B: 0000-0000-0000-0000
MSR 00000480: 03DA-0600-0000-0015
MSR 00000481: 0000-00FF-0000-0016
MSR 00000482: FFFB-FFFE-0401-E172
MSR 00000483: FF7F-FFFF-0003-6DFF
MSR 00000484: 007E-FFFF-0000-11FF
MSR 00000485: 0000-0000-7004-C1E7
MSR 00000486: 0000-0000-8000-0021
MSR 00000487: 0000-0000-FFFF-FFFF
MSR 00000488: 0000-0000-0000-2000
MSR 00000489: 0000-0000-1BF7-6FFF
MSR 0000048A: 0000-0000-0000-002E
MSR 0000048B: CF5F-7FFF-0000-0000
MSR 0000048C: 0001-0F01-06F3-4141
MSR 0000048D: 0000-00FF-0000-0016
MSR 0000048E: FFFB-FFFE-0400-6172
MSR 0000048F: FF7F-FFFF-0003-6DFB
MSR 00000490: 007E-FFFF-0000-11FB
MSR 00000601: 0000-0000-0000-02F8
MSR 00000602: < FAILED >
MSR 00000603: 0036-0000-0036-3636
MSR 00000604: < FAILED >
MSR 00000606: 0000-0000-000A-0E03
MSR 0000060A: 0000-0000-0000-0000
MSR 0000060B: 0000-0000-0000-0000
MSR 0000060C: 0000-0000-0000-0000
MSR 0000060D: 0000-0011-618F-0572
MSR 00000610: 0000-8128-00DD-8128
MSR 00000611: 0000-0000-082B-063F
MSR 00000613: 0000-0000-0000-0000
MSR 00000614: 0000-0000-0000-00F0
MSR 00000618: 0000-0000-0000-0000
MSR 00000619: 0000-0000-0022-BEEB
MSR 0000061B: 0000-0000-0000-0000
MSR 0000061C: < FAILED >
MSR 0000061E: < FAILED >
MSR 00000620: 0000-0000-0000-042E
MSR 00000621: 0000-0000-0000-0000
MSR 00000638: 0000-0000-0000-0000
MSR 00000639: 0000-0000-0477-4233
MSR 0000063A: 0000-0000-0000-0000
MSR 0000063B: < FAILED >
MSR 00000640: 0000-0000-0000-0000
MSR 00000641: 0000-0000-0001-341B
MSR 00000642: 0000-0000-0000-0010
MSR 00000648: 0000-0000-0000-0021
MSR 00000649: 0000-0000-0016-0088
MSR 0000064A: 0000-0000-0000-0000
MSR 0000064B: 0000-0000-0000-0000
MSR 0000064C: 0000-0000-0000-0020
MSR 00000650: 2525-2525-2525-2525
MSR 00000651: 0807-0605-0403-0201
MSR 00000660: 0000-0130-1528-84E0
MSR 00000661: < FAILED >
MSR 00000662: < FAILED >
MSR 00000663: < FAILED >
MSR 00000664: 0000-0205-8A17-4006
MSR 00000665: < FAILED >
MSR 00000666: < FAILED >
MSR 00000667: < FAILED >
MSR 00000668: < FAILED >
MSR 00000669: < FAILED >
MSR 0000066A: < FAILED >
MSR 0000066B: < FAILED >
MSR 0000066C: < FAILED >
MSR 0000066D: < FAILED >
MSR 0000066E: < FAILED >
MSR 0000066F: < FAILED >
MSR 00000670: < FAILED >
MSR 00000671: < FAILED >
MSR 00000672: < FAILED >
MSR 00000673: < FAILED >
MSR 00000674: < FAILED >
MSR 00000675: < FAILED >
MSR 00000676: < FAILED >
MSR 00000677: < FAILED >
MSR 00000690: < FAILED >
MSR 000006B0: 0000-0000-1000-0000
MSR 000006B1: 0000-0000-0000-0000
MSR 00000770: 0000-0000-0000-0001
MSR 00000771: 0000-0000-0115-2125
MSR 00000772: 0000-0000-8000-FF01
MSR 00000773: 0000-0000-0000-0005
MSR 00000774: 0000-019E-5400-2521
MSR 00000777: 0000-0000-0000-0000

PerformanceFrequency = 10000000

CPU Clock M.Method = 9  (APIC SKL)
PM Timer Address   = 6152  (1808h)

APIC Clock = 100.00 MHz  (AT = 0 / TT = 0 / try = 0 / SKL = 0.00 MHz)
APIC Clock = 100.00 MHz  (AT = 0 / TT = 0 / try = 0 / SKL = 0.00 MHz)
APIC Clock = 100.00 MHz  (AT = 0 / TT = 0 / try = 0 / SKL = 0.00 MHz)
APIC Clock = 100.00 MHz  (AT = 0 / TT = 0 / try = 0 / SKL = 0.00 MHz)
APIC Clock = 100.00 MHz  (AT = 0 / TT = 0 / try = 0 / SKL = 0.00 MHz)

CPU Clock = 1300.00 MHz / TSC Clock = 3302.40 MHz / CPU Mul = 13.00x
CPU Clock = 1800.00 MHz / TSC Clock = 3302.40 MHz / CPU Mul = 18.00x
CPU Clock = 1600.00 MHz / TSC Clock = 3302.40 MHz / CPU Mul = 16.00x
CPU Clock = 2000.00 MHz / TSC Clock = 3302.40 MHz / CPU Mul = 20.00x
CPU Clock = 1600.00 MHz / TSC Clock = 3302.40 MHz / CPU Mul = 16.00x

CPU Clock Max = 4500.00 MHz / TSC Clock = 3302.40 MHz / CPU Mul = 45.00x
CPU Clock Max = 4500.00 MHz / TSC Clock = 3302.40 MHz / CPU Mul = 45.00x
CPU Clock Max = 1900.00 MHz / TSC Clock = 3302.40 MHz / CPU Mul = 19.00x
CPU Clock Max = 2800.00 MHz / TSC Clock = 3302.40 MHz / CPU Mul = 28.00x
CPU Clock Max = 4200.00 MHz / TSC Clock = 3302.40 MHz / CPU Mul = 42.00x

INTPERFCTR2 = 4958.44 MHz / INTPERFCTR1 (TSC) = 3303.01 MHz
INTPERFCTR2 = 4301.67 MHz / INTPERFCTR1 (TSC) = 3302.55 MHz
INTPERFCTR2 = 4355.07 MHz / INTPERFCTR1 (TSC) = 3302.48 MHz
INTPERFCTR2 = 4215.37 MHz / INTPERFCTR1 (TSC) = 3302.02 MHz
INTPERFCTR2 = 4166.75 MHz / INTPERFCTR1 (TSC) = 3302.13 MHz

------[ OC MailBox ]------

C 01 / P1 00 / P2 00: 00000000
C 01 / P1 01 / P2 00: 00000000
C 01 / P1 02 / P2 00: 00000000
C 01 / P1 03 / P2 00: 00000000
C 01 / P1 04 / P2 00: 00000000
C 02 / P1 00 / P2 00: 00000000
C 02 / P1 00 / P2 01: 00000000
C 02 / P1 00 / P2 02: 00000000
C 02 / P1 00 / P2 03: 00000000
C 02 / P1 01 / P2 00: 00000000
C 02 / P1 01 / P2 01: 00000000
C 02 / P1 01 / P2 02: 00000000
C 02 / P1 01 / P2 03: 00000000
C 02 / P1 02 / P2 00: 00000000
C 02 / P1 02 / P2 01: 00000000
C 02 / P1 02 / P2 02: 00000000
C 02 / P1 02 / P2 03: 00000000
C 02 / P1 03 / P2 00: 00000000
C 02 / P1 03 / P2 01: 00000000
C 02 / P1 03 / P2 02: 00000000
C 02 / P1 03 / P2 03: 00000000
C 02 / P1 04 / P2 00: 00000000
C 02 / P1 04 / P2 01: 00000000
C 02 / P1 04 / P2 02: 00000000
C 02 / P1 04 / P2 03: 00000000
C 02 / P1 05 / P2 00: 00000000
C 02 / P1 05 / P2 01: 00000000
C 02 / P1 05 / P2 02: 00000000
C 02 / P1 05 / P2 03: 00000000
C 02 / P1 06 / P2 00: 00000000
C 02 / P1 06 / P2 01: 00000000
C 02 / P1 06 / P2 02: 00000000
C 02 / P1 06 / P2 03: 00000000
C 02 / P1 07 / P2 00: 00000000
C 02 / P1 07 / P2 01: 00000000
C 02 / P1 07 / P2 02: 00000000
C 02 / P1 07 / P2 03: 00000000
C 03 / P1 00 / P2 00: 00000000
C 03 / P1 01 / P2 00: 00000000
C 03 / P1 02 / P2 00: 00000000
C 03 / P1 03 / P2 00: 00000000
C 04 / P1 00 / P2 00: 00000000
C 05 / P1 00 / P2 00: 00000000
C 10 / P1 00 / P2 00: 00000000
C 10 / P1 01 / P2 00: 00000000
C 10 / P1 02 / P2 00: 00000000
C 10 / P1 03 / P2 00: 00000000
C 10 / P1 04 / P2 00: 00000000
C 12 / P1 00 / P2 00: 00000000
C 12 / P1 01 / P2 00: 00000000
C 12 / P1 02 / P2 00: 00000000
C 14 / P1 00 / P2 00: 00000000
C 16 / P1 00 / P2 00: 00000000
C 18 / P1 00 / P2 00: 00000000
C 1A / P1 00 / P2 00: 00000000
C 1C / P1 00 / P2 00: 00000000  [CPU0]
C 1C / P1 00 / P2 00: 00000000  [CPU1]
C 1C / P1 00 / P2 00: 00000000  [CPU2]
C 1C / P1 00 / P2 00: 00000000  [CPU3]
C 1C / P1 00 / P2 00: 00000000  [CPU4]
C 1C / P1 00 / P2 00: 00000000  [CPU5]
C 1C / P1 00 / P2 00: 00000000  [CPU6]
C 1C / P1 00 / P2 00: 00000000  [CPU7]
