------[ Versions ]------

Program Version : EVEREST v4.60.1628 Beta
BenchDLL Version: 2.4.257.0

------[ CPU Info ]------

CPU Type           : Intel Pentium 4 Extreme Edition, 3733 MHz (14 x 267)
CPU Alias          : Prescott-2M
CPU Platform       : LGA775
CPU Stepping       : N0
Instruction Set    : x86, x86-64, MMX, SSE, SSE2, SSE3
CPUID Manufacturer : GenuineIntel
CPUID CPU Name     : Intel(R) Pentium(R) 4 CPU 3.73GHz
CPUID Revision     : 00000F43h
IA Brand ID        : 00h  (Unknown)
Platform ID        : 2Ah  (LGA775)

------[ Logical CPU #0 ]------

allcpu: Valid

CPUID 00000000: 00000005-756E6547-6C65746E-49656E69
CPUID 00000001: 00000F43-00020800-0000641D-BFEBFBFF
CPUID 00000002: 605B5001-00000000-00000000-007D7040
CPUID 00000003: 00000000-00000000-00000000-00000000
CPUID 00000004: 00004121-01C0003F-0000001F-00000000
CPUID 00000004: 00004143-01C0103F-000007FF-00000000
CPUID 00000005: 00000040-00000040-00000000-00000000
CPUID 80000000: 80000008-00000000-00000000-00000000
CPUID 80000001: 00000000-00000000-00000000-20100000
CPUID 80000002: 20202020-20202020-20202020-6E492020
CPUID 80000003: 286C6574-50202952-69746E65-52286D75
CPUID 80000004: 20342029-20555043-33372E33-007A4847
CPUID 80000005: 00000000-00000000-00000000-00000000
CPUID 80000006: 00000000-00000000-08006040-00000000
CPUID 80000007: 00000000-00000000-00000000-00000000
CPUID 80000008: 00003024-00000000-00000000-00000000

L1    Data Cache:     16 KB,  8-way Associative, 64-byte Line
L2 Unified Cache:   2048 KB,  8-way Associative, 64-byte Line

------[ Logical CPU #1 ]------

allcpu: Valid, Virtual

CPUID 00000000: 00000005-756E6547-6C65746E-49656E69
CPUID 00000001: 00000F43-01020800-0000641D-BFEBFBFF
CPUID 00000002: 605B5001-00000000-00000000-007D7040
CPUID 00000003: 00000000-00000000-00000000-00000000
CPUID 00000004: 00004121-01C0003F-0000001F-00000000
CPUID 00000004: 00004143-01C0103F-000007FF-00000000
CPUID 00000005: 00000040-00000040-00000000-00000000
CPUID 80000000: 80000008-00000000-00000000-00000000
CPUID 80000001: 00000000-00000000-00000000-20100000
CPUID 80000002: 20202020-20202020-20202020-6E492020
CPUID 80000003: 286C6574-50202952-69746E65-52286D75
CPUID 80000004: 20342029-20555043-33372E33-007A4847
CPUID 80000005: 00000000-00000000-00000000-00000000
CPUID 80000006: 00000000-00000000-08006040-00000000
CPUID 80000007: 00000000-00000000-00000000-00000000
CPUID 80000008: 00003024-00000000-00000000-00000000

L1    Data Cache:     16 KB,  8-way Associative, 64-byte Line
L2 Unified Cache:   2048 KB,  8-way Associative, 64-byte Line

------[ MSR Registers ]------

MSR 00000017: 0012-0000-0000-0000 [PlatID = 4]
MSR 0000001B: 0000-0000-FEE0-0900
MSR 0000002A: 0000-0000-0000-0000
MSR 0000002C: 0000-0000-0E10-000E
MSR 0000008B: 0000-0005-0000-0000
MSR 0000019A: 0000-0000-0000-0000
MSR 0000019B: 0000-0000-0000-0000
MSR 0000019C: 0000-0000-0000-0000
MSR 0000019D: 0000-0000-0000-0E2C
MSR 000001A0: 0000-0000-22A4-0489
MSR 000001A1: 0000-0000-0006-0000

PerformanceFrequency = 3723870000

Tjmax Temperature = 0 Celsius
