------[ Versions ]------

Program Version : AIDA64 Engineer v6.60.5933 Beta
BenchDLL Version: 4.5.867.8-x64
Windows Version : Microsoft Windows 11 Pro 10.0.22000.556 (64-bit)
GetProductInfo  : 0x00000030

------[ CPU Info ]------

CPU Type          : 2C+8c Intel Core i3-1220P, 1000 MHz (10 x 100)
CPU Alias         : Alder Lake-P
CPU Platform      : FCBGA1744
CPU Stepping      : R0
Instruction Set   : x86, x86-64, MMX, SSE, SSE2, SSE3, SSSE3, SSE4.1, SSE4.2, AVX, AVX2, FMA, AES, SHA
CPUID Manufacturer: GenuineIntel
CPUID CPU Name    : 12th Gen Intel(R) Core(TM) i3-1220P
CPUID Revision    : 000906A4h
IA Brand ID       : 00h  (Unknown)
Platform ID       : 47h  (FCBGA1744)
HTT / CMP Units   : 0 / 10
Max. NUMA Node    : 0

Tjmax Temperature          : 100 Celsius
HTC Temperature Limit      : 0 Celsius
CPU TDP                    : 28 W
CPU TDC                    : 80 A
CPU Max Power Limit        : Unlimited Power / Unlimited Time
CPU Power Limit 1 (Long)   : 20 W / 28.00 sec  (Unlocked)
CPU Power Limit 2 (Short)  : 39 W / 2.44 ms  (Unlocked)
Max Turbo Boost Multipliers: 1C: 44x, 2C: 38x, 3C: 38x, 4C: 38x, 5C: 38x, 6C: 38x, 7C: 38x, 8C: 38x

------[ Motherboard Info ]------

Motherboard ID      : <DMI>
Motherboard Model   : Intel Wallstreet Canyon NUC12WSBi3
Motherboard Chipset : Intel Alder Point-P, Intel Alder Lake-P

DMI MB Manufacturer : Intel Corporation
DMI MB Product      : NUC12WSBi3
DMI MB Version      : M36953-300
DMI MB Serial       : BTWS203002J5
DMI SYS Manufacturer: Intel(R) Client Systems
DMI SYS Product     : NUC12WSHi3
DMI SYS Version     : M46710-300
DMI SYS Serial      : BTWS203002J5
DMI BIOS Version    : WSADL357.0061.2021.1207.1705


------[ CPUID Registers / Logical CPU #0 ]------

allcpu: Package 0 / Core 0 / Thread 0: Valid

CPUID 00000000: 00000020-756E6547-6C65746E-49656E69 [GenuineIntel]
CPUID 00000001: 000906A4-00400800-7FFAFBBF-BFEBFBFF
CPUID 00000002: 00FEFF01-000000F0-00000000-00000000
CPUID 00000003: 00000000-00000000-00000000-00000000
CPUID 00000004: 7C004121-02C0003F-0000003F-00000000 [SL 00] [L1D: 48 KB]
CPUID 00000004: 7C004122-01C0003F-0000003F-00000000 [SL 01] [L1I: 32 KB]
CPUID 00000004: 7C01C143-0240003F-000007FF-00000000 [SL 02] [L2U: 1280 KB]
CPUID 00000004: 7C0FC163-02C0003F-00003FFF-00000004 [SL 03] [L3U: 12 MB]
CPUID 00000005: 00000040-00000040-00000003-10102020
CPUID 00000006: 00DF8FF7-00000002-00000409-00000003
CPUID 00000007: 00000001-239CA7EB-984007AC-FC18C410 [SL 00]
CPUID 00000007: 00400810-00000000-00000000-00000000 [SL 01]
CPUID 00000008: 00000000-00000000-00000000-00000000
CPUID 00000009: 00000000-00000000-00000000-00000000
CPUID 0000000A: 07300605-00000000-00000007-00008603
CPUID 0000000B: 00000001-00000002-00000100-00000000 [SL 00]
CPUID 0000000B: 00000006-0000000C-00000201-00000000 [SL 01]
CPUID 0000000C: 00000000-00000000-00000000-00000000
CPUID 0000000D: 00000207-00000340-00000A88-00000000 [SL 00] [x87]
CPUID 0000000D: 0000000F-000003D0-00019900-00000000 [SL 01] [SSE]
CPUID 0000000D: 00000100-00000240-00000000-00000000 [SL 02] [AVX]
CPUID 0000000D: 00000080-00000000-00000001-00000000 [SL 08] [PT]
CPUID 0000000D: 00000008-00000A80-00000000-00000000 [SL 09] [PKRU]
CPUID 0000000D: 00000010-00000000-00000001-00000000 [SL 0B]
CPUID 0000000D: 00000018-00000000-00000001-00000000 [SL 0C]
CPUID 0000000D: 00000328-00000000-00000001-00000000 [SL 0F]
CPUID 0000000D: 00000008-00000000-00000001-00000000 [SL 10]
CPUID 0000000E: 00000000-00000000-00000000-00000000
CPUID 0000000F: 00000000-00000000-00000000-00000000 [SL 00]
CPUID 0000000F: 00000000-00000000-00000000-00000000 [SL 01]
CPUID 00000010: 00000000-00000004-00000000-00000000 [SL 00]
CPUID 00000010: 00000000-00000000-00000000-00000000 [SL 01]
CPUID 00000011: 00000000-00000000-00000000-00000000
CPUID 00000012: 00000000-00000000-00000000-00000000 [SL 00]
CPUID 00000012: 00000000-00000000-00000000-00000000 [SL 01]
CPUID 00000013: 00000000-00000000-00000000-00000000
CPUID 00000014: 00000001-0000005F-00000007-00000000 [SL 00]
CPUID 00000014: 02490002-003F003F-00000000-00000000 [SL 01]
CPUID 00000015: 00000002-00000034-0249F000-00000000 [26.00x / 38400000]
CPUID 00000016: 000003E8-00001130-00000064-00000000 [1000 / 4400 / 100]
CPUID 00000017: 00000000-00000000-00000000-00000000 [SL 00]
CPUID 00000018: 00000008-00000000-00000000-00000000 [SL 00]
CPUID 00000018: 00000000-00080001-00000020-00004022 [SL 01]
CPUID 00000018: 00000000-00080006-00000004-00004022 [SL 02]
CPUID 00000018: 00000000-0010000F-00000001-00004125 [SL 03]
CPUID 00000018: 00000000-00040001-00000010-00004024 [SL 04]
CPUID 00000018: 00000000-00040006-00000008-00004024 [SL 05]
CPUID 00000018: 00000000-00080008-00000001-00004124 [SL 06]
CPUID 00000018: 00000000-00080007-00000080-00004043 [SL 07]
CPUID 00000018: 00000000-00080009-00000080-00004043 [SL 08]
CPUID 00000019: 00000000-00000000-00000000-00000000
CPUID 0000001A: 40000001-00000000-00000000-00000000 [Core]
CPUID 0000001B: 00000000-00000000-00000000-00000000
CPUID 0000001C: 4000000B-00000007-00000007-00000000
CPUID 0000001D: 00000000-00000000-00000000-00000000
CPUID 0000001E: 00000000-00000000-00000000-00000000
CPUID 0000001F: 00000001-00000002-00000100-00000000 [SL 00]
CPUID 0000001F: 00000006-0000000C-00000201-00000000 [SL 01]
CPUID 00000020: 00000000-00000001-00000000-00000000
CPUID 80000000: 80000008-00000000-00000000-00000000
CPUID 80000001: 00000000-00000000-00000121-2C100000
CPUID 80000002: 68743231-6E654720-746E4920-52286C65 [12th Gen Intel(R]
CPUID 80000003: 6F432029-54286572-6920294D-32312D33 [) Core(TM) i3-12]
CPUID 80000004: 00503032-00000000-00000000-00000000 [20P]
CPUID 80000005: 00000000-00000000-00000000-00000000 [L1D: 0 KB / L1I: 0 KB]
CPUID 80000006: 00000000-00000000-05007040-00000000 [L2: 1280 KB] / L3: 0 KB]
CPUID 80000007: 00000000-00000000-00000000-00000100
CPUID 80000008: 00003027-00000000-00000000-00000000

L1    Data Cache:    48 KB, 12-way Associative, 64-byte Line
L1  Instr. Cache:    32 KB,  8-way Associative, 64-byte Line
L2 Unified Cache:  1280 KB, 10-way Associative, 64-byte Line
L3 Unified Cache:    12 MB, 12-way Associative, 64-byte Line

------[ CPUID Registers / Logical CPU #1 ]------

allcpu: Package 0 / Core 0 / Thread 1: Valid, Virtual

CPUID 00000000: 00000020-756E6547-6C65746E-49656E69 [GenuineIntel]
CPUID 00000001: 000906A4-01400800-7FFAFBBF-BFEBFBFF
CPUID 00000002: 00FEFF01-000000F0-00000000-00000000
CPUID 00000003: 00000000-00000000-00000000-00000000
CPUID 00000004: 7C004121-02C0003F-0000003F-00000000 [SL 00] [L1D: 48 KB]
CPUID 00000004: 7C004122-01C0003F-0000003F-00000000 [SL 01] [L1I: 32 KB]
CPUID 00000004: 7C01C143-0240003F-000007FF-00000000 [SL 02] [L2U: 1280 KB]
CPUID 00000004: 7C0FC163-02C0003F-00003FFF-00000004 [SL 03] [L3U: 12 MB]
CPUID 00000005: 00000040-00000040-00000003-10102020
CPUID 00000006: 00DF8FF7-00000002-00000409-00000003
CPUID 00000007: 00000001-239CA7EB-984007AC-FC18C410 [SL 00]
CPUID 00000007: 00400810-00000000-00000000-00000000 [SL 01]
CPUID 00000008: 00000000-00000000-00000000-00000000
CPUID 00000009: 00000000-00000000-00000000-00000000
CPUID 0000000A: 07300605-00000000-00000007-00008603
CPUID 0000000B: 00000001-00000002-00000100-00000001 [SL 00]
CPUID 0000000B: 00000006-0000000C-00000201-00000001 [SL 01]
CPUID 0000000C: 00000000-00000000-00000000-00000000
CPUID 0000000D: 00000207-00000340-00000A88-00000000 [SL 00] [x87]
CPUID 0000000D: 0000000F-000003D0-00019900-00000000 [SL 01] [SSE]
CPUID 0000000D: 00000100-00000240-00000000-00000000 [SL 02] [AVX]
CPUID 0000000D: 00000080-00000000-00000001-00000000 [SL 08] [PT]
CPUID 0000000D: 00000008-00000A80-00000000-00000000 [SL 09] [PKRU]
CPUID 0000000D: 00000010-00000000-00000001-00000000 [SL 0B]
CPUID 0000000D: 00000018-00000000-00000001-00000000 [SL 0C]
CPUID 0000000D: 00000328-00000000-00000001-00000000 [SL 0F]
CPUID 0000000D: 00000008-00000000-00000001-00000000 [SL 10]
CPUID 0000000E: 00000000-00000000-00000000-00000000
CPUID 0000000F: 00000000-00000000-00000000-00000000 [SL 00]
CPUID 0000000F: 00000000-00000000-00000000-00000000 [SL 01]
CPUID 00000010: 00000000-00000004-00000000-00000000 [SL 00]
CPUID 00000010: 00000000-00000000-00000000-00000000 [SL 01]
CPUID 00000011: 00000000-00000000-00000000-00000000
CPUID 00000012: 00000000-00000000-00000000-00000000 [SL 00]
CPUID 00000012: 00000000-00000000-00000000-00000000 [SL 01]
CPUID 00000013: 00000000-00000000-00000000-00000000
CPUID 00000014: 00000001-0000005F-00000007-00000000 [SL 00]
CPUID 00000014: 02490002-003F003F-00000000-00000000 [SL 01]
CPUID 00000015: 00000002-00000034-0249F000-00000000 [26.00x / 38400000]
CPUID 00000016: 000003E8-00001130-00000064-00000000 [1000 / 4400 / 100]
CPUID 00000017: 00000000-00000000-00000000-00000000 [SL 00]
CPUID 00000018: 00000008-00000000-00000000-00000000 [SL 00]
CPUID 00000018: 00000000-00080001-00000020-00004022 [SL 01]
CPUID 00000018: 00000000-00080006-00000004-00004022 [SL 02]
CPUID 00000018: 00000000-0010000F-00000001-00004125 [SL 03]
CPUID 00000018: 00000000-00040001-00000010-00004024 [SL 04]
CPUID 00000018: 00000000-00040006-00000008-00004024 [SL 05]
CPUID 00000018: 00000000-00080008-00000001-00004124 [SL 06]
CPUID 00000018: 00000000-00080007-00000080-00004043 [SL 07]
CPUID 00000018: 00000000-00080009-00000080-00004043 [SL 08]
CPUID 00000019: 00000000-00000000-00000000-00000000
CPUID 0000001A: 40000001-00000000-00000000-00000000 [Core]
CPUID 0000001B: 00000000-00000000-00000000-00000000
CPUID 0000001C: 4000000B-00000007-00000007-00000000
CPUID 0000001D: 00000000-00000000-00000000-00000000
CPUID 0000001E: 00000000-00000000-00000000-00000000
CPUID 0000001F: 00000001-00000002-00000100-00000001 [SL 00]
CPUID 0000001F: 00000006-0000000C-00000201-00000001 [SL 01]
CPUID 00000020: 00000000-00000001-00000000-00000000
CPUID 80000000: 80000008-00000000-00000000-00000000
CPUID 80000001: 00000000-00000000-00000121-2C100000
CPUID 80000002: 68743231-6E654720-746E4920-52286C65 [12th Gen Intel(R]
CPUID 80000003: 6F432029-54286572-6920294D-32312D33 [) Core(TM) i3-12]
CPUID 80000004: 00503032-00000000-00000000-00000000 [20P]
CPUID 80000005: 00000000-00000000-00000000-00000000 [L1D: 0 KB / L1I: 0 KB]
CPUID 80000006: 00000000-00000000-05007040-00000000 [L2: 1280 KB] / L3: 0 KB]
CPUID 80000007: 00000000-00000000-00000000-00000100
CPUID 80000008: 00003027-00000000-00000000-00000000

L1    Data Cache:    48 KB, 12-way Associative, 64-byte Line
L1  Instr. Cache:    32 KB,  8-way Associative, 64-byte Line
L2 Unified Cache:  1280 KB, 10-way Associative, 64-byte Line
L3 Unified Cache:    12 MB, 12-way Associative, 64-byte Line

------[ CPUID Registers / Logical CPU #2 ]------

allcpu: Package 0 / Core 1 / Thread 0: Valid

CPUID 00000000: 00000020-756E6547-6C65746E-49656E69 [GenuineIntel]
CPUID 00000001: 000906A4-08400800-7FFAFBBF-BFEBFBFF
CPUID 00000002: 00FEFF01-000000F0-00000000-00000000
CPUID 00000003: 00000000-00000000-00000000-00000000
CPUID 00000004: 7C004121-02C0003F-0000003F-00000000 [SL 00] [L1D: 48 KB]
CPUID 00000004: 7C004122-01C0003F-0000003F-00000000 [SL 01] [L1I: 32 KB]
CPUID 00000004: 7C01C143-0240003F-000007FF-00000000 [SL 02] [L2U: 1280 KB]
CPUID 00000004: 7C0FC163-02C0003F-00003FFF-00000004 [SL 03] [L3U: 12 MB]
CPUID 00000005: 00000040-00000040-00000003-10102020
CPUID 00000006: 00DF8FF7-00000002-00000409-00010003
CPUID 00000007: 00000001-239CA7EB-984007AC-FC18C410 [SL 00]
CPUID 00000007: 00400810-00000000-00000000-00000000 [SL 01]
CPUID 00000008: 00000000-00000000-00000000-00000000
CPUID 00000009: 00000000-00000000-00000000-00000000
CPUID 0000000A: 07300605-00000000-00000007-00008603
CPUID 0000000B: 00000001-00000002-00000100-00000008 [SL 00]
CPUID 0000000B: 00000006-0000000C-00000201-00000008 [SL 01]
CPUID 0000000C: 00000000-00000000-00000000-00000000
CPUID 0000000D: 00000207-00000340-00000A88-00000000 [SL 00] [x87]
CPUID 0000000D: 0000000F-000003D0-00019900-00000000 [SL 01] [SSE]
CPUID 0000000D: 00000100-00000240-00000000-00000000 [SL 02] [AVX]
CPUID 0000000D: 00000080-00000000-00000001-00000000 [SL 08] [PT]
CPUID 0000000D: 00000008-00000A80-00000000-00000000 [SL 09] [PKRU]
CPUID 0000000D: 00000010-00000000-00000001-00000000 [SL 0B]
CPUID 0000000D: 00000018-00000000-00000001-00000000 [SL 0C]
CPUID 0000000D: 00000328-00000000-00000001-00000000 [SL 0F]
CPUID 0000000D: 00000008-00000000-00000001-00000000 [SL 10]
CPUID 0000000E: 00000000-00000000-00000000-00000000
CPUID 0000000F: 00000000-00000000-00000000-00000000 [SL 00]
CPUID 0000000F: 00000000-00000000-00000000-00000000 [SL 01]
CPUID 00000010: 00000000-00000004-00000000-00000000 [SL 00]
CPUID 00000010: 00000000-00000000-00000000-00000000 [SL 01]
CPUID 00000011: 00000000-00000000-00000000-00000000
CPUID 00000012: 00000000-00000000-00000000-00000000 [SL 00]
CPUID 00000012: 00000000-00000000-00000000-00000000 [SL 01]
CPUID 00000013: 00000000-00000000-00000000-00000000
CPUID 00000014: 00000001-0000005F-00000007-00000000 [SL 00]
CPUID 00000014: 02490002-003F003F-00000000-00000000 [SL 01]
CPUID 00000015: 00000002-00000034-0249F000-00000000 [26.00x / 38400000]
CPUID 00000016: 000003E8-00001130-00000064-00000000 [1000 / 4400 / 100]
CPUID 00000017: 00000000-00000000-00000000-00000000 [SL 00]
CPUID 00000018: 00000008-00000000-00000000-00000000 [SL 00]
CPUID 00000018: 00000000-00080001-00000020-00004022 [SL 01]
CPUID 00000018: 00000000-00080006-00000004-00004022 [SL 02]
CPUID 00000018: 00000000-0010000F-00000001-00004125 [SL 03]
CPUID 00000018: 00000000-00040001-00000010-00004024 [SL 04]
CPUID 00000018: 00000000-00040006-00000008-00004024 [SL 05]
CPUID 00000018: 00000000-00080008-00000001-00004124 [SL 06]
CPUID 00000018: 00000000-00080007-00000080-00004043 [SL 07]
CPUID 00000018: 00000000-00080009-00000080-00004043 [SL 08]
CPUID 00000019: 00000000-00000000-00000000-00000000
CPUID 0000001A: 40000001-00000000-00000000-00000000 [Core]
CPUID 0000001B: 00000000-00000000-00000000-00000000
CPUID 0000001C: 4000000B-00000007-00000007-00000000
CPUID 0000001D: 00000000-00000000-00000000-00000000
CPUID 0000001E: 00000000-00000000-00000000-00000000
CPUID 0000001F: 00000001-00000002-00000100-00000008 [SL 00]
CPUID 0000001F: 00000006-0000000C-00000201-00000008 [SL 01]
CPUID 00000020: 00000000-00000001-00000000-00000000
CPUID 80000000: 80000008-00000000-00000000-00000000
CPUID 80000001: 00000000-00000000-00000121-2C100000
CPUID 80000002: 68743231-6E654720-746E4920-52286C65 [12th Gen Intel(R]
CPUID 80000003: 6F432029-54286572-6920294D-32312D33 [) Core(TM) i3-12]
CPUID 80000004: 00503032-00000000-00000000-00000000 [20P]
CPUID 80000005: 00000000-00000000-00000000-00000000 [L1D: 0 KB / L1I: 0 KB]
CPUID 80000006: 00000000-00000000-05007040-00000000 [L2: 1280 KB] / L3: 0 KB]
CPUID 80000007: 00000000-00000000-00000000-00000100
CPUID 80000008: 00003027-00000000-00000000-00000000

L1    Data Cache:    48 KB, 12-way Associative, 64-byte Line
L1  Instr. Cache:    32 KB,  8-way Associative, 64-byte Line
L2 Unified Cache:  1280 KB, 10-way Associative, 64-byte Line
L3 Unified Cache:    12 MB, 12-way Associative, 64-byte Line

------[ CPUID Registers / Logical CPU #3 ]------

allcpu: Package 0 / Core 1 / Thread 1: Valid, Virtual

CPUID 00000000: 00000020-756E6547-6C65746E-49656E69 [GenuineIntel]
CPUID 00000001: 000906A4-09400800-7FFAFBBF-BFEBFBFF
CPUID 00000002: 00FEFF01-000000F0-00000000-00000000
CPUID 00000003: 00000000-00000000-00000000-00000000
CPUID 00000004: 7C004121-02C0003F-0000003F-00000000 [SL 00] [L1D: 48 KB]
CPUID 00000004: 7C004122-01C0003F-0000003F-00000000 [SL 01] [L1I: 32 KB]
CPUID 00000004: 7C01C143-0240003F-000007FF-00000000 [SL 02] [L2U: 1280 KB]
CPUID 00000004: 7C0FC163-02C0003F-00003FFF-00000004 [SL 03] [L3U: 12 MB]
CPUID 00000005: 00000040-00000040-00000003-10102020
CPUID 00000006: 00DF8FF7-00000002-00000409-00010003
CPUID 00000007: 00000001-239CA7EB-984007AC-FC18C410 [SL 00]
CPUID 00000007: 00400810-00000000-00000000-00000000 [SL 01]
CPUID 00000008: 00000000-00000000-00000000-00000000
CPUID 00000009: 00000000-00000000-00000000-00000000
CPUID 0000000A: 07300605-00000000-00000007-00008603
CPUID 0000000B: 00000001-00000002-00000100-00000009 [SL 00]
CPUID 0000000B: 00000006-0000000C-00000201-00000009 [SL 01]
CPUID 0000000C: 00000000-00000000-00000000-00000000
CPUID 0000000D: 00000207-00000340-00000A88-00000000 [SL 00] [x87]
CPUID 0000000D: 0000000F-000003D0-00019900-00000000 [SL 01] [SSE]
CPUID 0000000D: 00000100-00000240-00000000-00000000 [SL 02] [AVX]
CPUID 0000000D: 00000080-00000000-00000001-00000000 [SL 08] [PT]
CPUID 0000000D: 00000008-00000A80-00000000-00000000 [SL 09] [PKRU]
CPUID 0000000D: 00000010-00000000-00000001-00000000 [SL 0B]
CPUID 0000000D: 00000018-00000000-00000001-00000000 [SL 0C]
CPUID 0000000D: 00000328-00000000-00000001-00000000 [SL 0F]
CPUID 0000000D: 00000008-00000000-00000001-00000000 [SL 10]
CPUID 0000000E: 00000000-00000000-00000000-00000000
CPUID 0000000F: 00000000-00000000-00000000-00000000 [SL 00]
CPUID 0000000F: 00000000-00000000-00000000-00000000 [SL 01]
CPUID 00000010: 00000000-00000004-00000000-00000000 [SL 00]
CPUID 00000010: 00000000-00000000-00000000-00000000 [SL 01]
CPUID 00000011: 00000000-00000000-00000000-00000000
CPUID 00000012: 00000000-00000000-00000000-00000000 [SL 00]
CPUID 00000012: 00000000-00000000-00000000-00000000 [SL 01]
CPUID 00000013: 00000000-00000000-00000000-00000000
CPUID 00000014: 00000001-0000005F-00000007-00000000 [SL 00]
CPUID 00000014: 02490002-003F003F-00000000-00000000 [SL 01]
CPUID 00000015: 00000002-00000034-0249F000-00000000 [26.00x / 38400000]
CPUID 00000016: 000003E8-00001130-00000064-00000000 [1000 / 4400 / 100]
CPUID 00000017: 00000000-00000000-00000000-00000000 [SL 00]
CPUID 00000018: 00000008-00000000-00000000-00000000 [SL 00]
CPUID 00000018: 00000000-00080001-00000020-00004022 [SL 01]
CPUID 00000018: 00000000-00080006-00000004-00004022 [SL 02]
CPUID 00000018: 00000000-0010000F-00000001-00004125 [SL 03]
CPUID 00000018: 00000000-00040001-00000010-00004024 [SL 04]
CPUID 00000018: 00000000-00040006-00000008-00004024 [SL 05]
CPUID 00000018: 00000000-00080008-00000001-00004124 [SL 06]
CPUID 00000018: 00000000-00080007-00000080-00004043 [SL 07]
CPUID 00000018: 00000000-00080009-00000080-00004043 [SL 08]
CPUID 00000019: 00000000-00000000-00000000-00000000
CPUID 0000001A: 40000001-00000000-00000000-00000000 [Core]
CPUID 0000001B: 00000000-00000000-00000000-00000000
CPUID 0000001C: 4000000B-00000007-00000007-00000000
CPUID 0000001D: 00000000-00000000-00000000-00000000
CPUID 0000001E: 00000000-00000000-00000000-00000000
CPUID 0000001F: 00000001-00000002-00000100-00000009 [SL 00]
CPUID 0000001F: 00000006-0000000C-00000201-00000009 [SL 01]
CPUID 00000020: 00000000-00000001-00000000-00000000
CPUID 80000000: 80000008-00000000-00000000-00000000
CPUID 80000001: 00000000-00000000-00000121-2C100000
CPUID 80000002: 68743231-6E654720-746E4920-52286C65 [12th Gen Intel(R]
CPUID 80000003: 6F432029-54286572-6920294D-32312D33 [) Core(TM) i3-12]
CPUID 80000004: 00503032-00000000-00000000-00000000 [20P]
CPUID 80000005: 00000000-00000000-00000000-00000000 [L1D: 0 KB / L1I: 0 KB]
CPUID 80000006: 00000000-00000000-05007040-00000000 [L2: 1280 KB] / L3: 0 KB]
CPUID 80000007: 00000000-00000000-00000000-00000100
CPUID 80000008: 00003027-00000000-00000000-00000000

L1    Data Cache:    48 KB, 12-way Associative, 64-byte Line
L1  Instr. Cache:    32 KB,  8-way Associative, 64-byte Line
L2 Unified Cache:  1280 KB, 10-way Associative, 64-byte Line
L3 Unified Cache:    12 MB, 12-way Associative, 64-byte Line

------[ CPUID Registers / Logical CPU #4 ]------

allcpu: Package 0 / Core 2 / Thread 0: Valid

CPUID 00000000: 00000020-756E6547-6C65746E-49656E69 [GenuineIntel]
CPUID 00000001: 000906A4-10400800-7FFAFBBF-BFEBFBFF
CPUID 00000002: 00FEFF01-00000000-00000000-00000000
CPUID 00000003: 00000000-00000000-00000000-00000000
CPUID 00000004: 7C004121-01C0003F-0000003F-00000000 [SL 00] [L1D: 32 KB]
CPUID 00000004: 7C004122-01C0003F-0000007F-00000000 [SL 01] [L1I: 64 KB]
CPUID 00000004: 7C01C143-03C0003F-000007FF-00000000 [SL 02] [L2U: 2 MB]
CPUID 00000004: 7C0FC163-02C0003F-00003FFF-00000004 [SL 03] [L3U: 12 MB]
CPUID 00000005: 00000040-00000040-00000003-10102020
CPUID 00000006: 00DF8FF7-00000002-00000409-00020003
CPUID 00000007: 00000001-239CA7EB-984007AC-FC18C410 [SL 00]
CPUID 00000007: 00400810-00000000-00000000-00000000 [SL 01]
CPUID 00000008: 00000000-00000000-00000000-00000000
CPUID 00000009: 00000000-00000000-00000000-00000000
CPUID 0000000A: 07300605-00000000-00000007-00008603
CPUID 0000000B: 00000001-00000001-00000100-00000010 [SL 00]
CPUID 0000000B: 00000006-0000000C-00000201-00000010 [SL 01]
CPUID 0000000C: 00000000-00000000-00000000-00000000
CPUID 0000000D: 00000207-00000340-00000A88-00000000 [SL 00] [x87]
CPUID 0000000D: 0000000F-000003D0-00019900-00000000 [SL 01] [SSE]
CPUID 0000000D: 00000100-00000240-00000000-00000000 [SL 02] [AVX]
CPUID 0000000D: 00000080-00000000-00000001-00000000 [SL 08] [PT]
CPUID 0000000D: 00000008-00000A80-00000000-00000000 [SL 09] [PKRU]
CPUID 0000000D: 00000010-00000000-00000001-00000000 [SL 0B]
CPUID 0000000D: 00000018-00000000-00000001-00000000 [SL 0C]
CPUID 0000000D: 00000328-00000000-00000001-00000000 [SL 0F]
CPUID 0000000D: 00000008-00000000-00000001-00000000 [SL 10]
CPUID 0000000E: 00000000-00000000-00000000-00000000
CPUID 0000000F: 00000000-00000000-00000000-00000000 [SL 00]
CPUID 0000000F: 00000000-00000000-00000000-00000000 [SL 01]
CPUID 00000010: 00000000-00000004-00000000-00000000 [SL 00]
CPUID 00000010: 00000000-00000000-00000000-00000000 [SL 01]
CPUID 00000011: 00000000-00000000-00000000-00000000
CPUID 00000012: 00000000-00000000-00000000-00000000 [SL 00]
CPUID 00000012: 00000000-00000000-00000000-00000000 [SL 01]
CPUID 00000013: 00000000-00000000-00000000-00000000
CPUID 00000014: 00000001-0000005F-80000007-00000000 [SL 00]
CPUID 00000014: 02490002-003F003F-00000000-00000000 [SL 01]
CPUID 00000015: 00000002-00000034-0249F000-00000000 [26.00x / 38400000]
CPUID 00000016: 000003E8-00000CE4-00000064-00000000 [1000 / 3300 / 100]
CPUID 00000017: 00000000-00000000-00000000-00000000 [SL 00]
CPUID 00000018: 00000004-00000000-00000000-00000000 [SL 00]
CPUID 00000018: 00000000-00300001-00000001-00000121 [SL 01]
CPUID 00000018: 00000000-00040003-00000200-00000043 [SL 02]
CPUID 00000018: 00000000-00400001-00000001-00000122 [SL 03]
CPUID 00000018: 00000000-00080008-00000001-00000143 [SL 04]
CPUID 00000019: 00000000-00000000-00000000-00000000
CPUID 0000001A: 20000001-00000000-00000000-00000000 [Atom]
CPUID 0000001B: 00000000-00000000-00000000-00000000
CPUID 0000001C: C000000B-00000007-00000007-00000000
CPUID 0000001D: 00000000-00000000-00000000-00000000
CPUID 0000001E: 00000000-00000000-00000000-00000000
CPUID 0000001F: 00000001-00000001-00000100-00000010 [SL 00]
CPUID 0000001F: 00000006-0000000C-00000201-00000010 [SL 01]
CPUID 00000020: 00000000-00000001-00000000-00000000
CPUID 80000000: 80000008-00000000-00000000-00000000
CPUID 80000001: 00000000-00000000-00000121-2C100000
CPUID 80000002: 68743231-6E654720-746E4920-52286C65 [12th Gen Intel(R]
CPUID 80000003: 6F432029-54286572-6920294D-32312D33 [) Core(TM) i3-12]
CPUID 80000004: 00503032-00000000-00000000-00000000 [20P]
CPUID 80000005: 00000000-00000000-00000000-00000000 [L1D: 0 KB / L1I: 0 KB]
CPUID 80000006: 00000000-00000000-08008040-00000000 [L2: 2048 KB] / L3: 0 KB]
CPUID 80000007: 00000000-00000000-00000000-00000100
CPUID 80000008: 00003027-00000000-00000000-00000000

L1    Data Cache:    32 KB,  8-way Associative, 64-byte Line
L1  Instr. Cache:    64 KB,  8-way Associative, 64-byte Line
L2 Unified Cache:     2 MB, 16-way Associative, 64-byte Line
L3 Unified Cache:    12 MB, 12-way Associative, 64-byte Line

------[ CPUID Registers / Logical CPU #5 ]------

allcpu: Package 0 / Core 3 / Thread 0: Valid

CPUID 00000000: 00000020-756E6547-6C65746E-49656E69 [GenuineIntel]
CPUID 00000001: 000906A4-12400800-7FFAFBBF-BFEBFBFF
CPUID 00000002: 00FEFF01-00000000-00000000-00000000
CPUID 00000003: 00000000-00000000-00000000-00000000
CPUID 00000004: 7C004121-01C0003F-0000003F-00000000 [SL 00] [L1D: 32 KB]
CPUID 00000004: 7C004122-01C0003F-0000007F-00000000 [SL 01] [L1I: 64 KB]
CPUID 00000004: 7C01C143-03C0003F-000007FF-00000000 [SL 02] [L2U: 2 MB]
CPUID 00000004: 7C0FC163-02C0003F-00003FFF-00000004 [SL 03] [L3U: 12 MB]
CPUID 00000005: 00000040-00000040-00000003-10102020
CPUID 00000006: 00DF8FF7-00000002-00000409-00020003
CPUID 00000007: 00000001-239CA7EB-984007AC-FC18C410 [SL 00]
CPUID 00000007: 00400810-00000000-00000000-00000000 [SL 01]
CPUID 00000008: 00000000-00000000-00000000-00000000
CPUID 00000009: 00000000-00000000-00000000-00000000
CPUID 0000000A: 07300605-00000000-00000007-00008603
CPUID 0000000B: 00000001-00000001-00000100-00000012 [SL 00]
CPUID 0000000B: 00000006-0000000C-00000201-00000012 [SL 01]
CPUID 0000000C: 00000000-00000000-00000000-00000000
CPUID 0000000D: 00000207-00000340-00000A88-00000000 [SL 00] [x87]
CPUID 0000000D: 0000000F-000003D0-00019900-00000000 [SL 01] [SSE]
CPUID 0000000D: 00000100-00000240-00000000-00000000 [SL 02] [AVX]
CPUID 0000000D: 00000080-00000000-00000001-00000000 [SL 08] [PT]
CPUID 0000000D: 00000008-00000A80-00000000-00000000 [SL 09] [PKRU]
CPUID 0000000D: 00000010-00000000-00000001-00000000 [SL 0B]
CPUID 0000000D: 00000018-00000000-00000001-00000000 [SL 0C]
CPUID 0000000D: 00000328-00000000-00000001-00000000 [SL 0F]
CPUID 0000000D: 00000008-00000000-00000001-00000000 [SL 10]
CPUID 0000000E: 00000000-00000000-00000000-00000000
CPUID 0000000F: 00000000-00000000-00000000-00000000 [SL 00]
CPUID 0000000F: 00000000-00000000-00000000-00000000 [SL 01]
CPUID 00000010: 00000000-00000004-00000000-00000000 [SL 00]
CPUID 00000010: 00000000-00000000-00000000-00000000 [SL 01]
CPUID 00000011: 00000000-00000000-00000000-00000000
CPUID 00000012: 00000000-00000000-00000000-00000000 [SL 00]
CPUID 00000012: 00000000-00000000-00000000-00000000 [SL 01]
CPUID 00000013: 00000000-00000000-00000000-00000000
CPUID 00000014: 00000001-0000005F-80000007-00000000 [SL 00]
CPUID 00000014: 02490002-003F003F-00000000-00000000 [SL 01]
CPUID 00000015: 00000002-00000034-0249F000-00000000 [26.00x / 38400000]
CPUID 00000016: 000003E8-00000CE4-00000064-00000000 [1000 / 3300 / 100]
CPUID 00000017: 00000000-00000000-00000000-00000000 [SL 00]
CPUID 00000018: 00000004-00000000-00000000-00000000 [SL 00]
CPUID 00000018: 00000000-00300001-00000001-00000121 [SL 01]
CPUID 00000018: 00000000-00040003-00000200-00000043 [SL 02]
CPUID 00000018: 00000000-00400001-00000001-00000122 [SL 03]
CPUID 00000018: 00000000-00080008-00000001-00000143 [SL 04]
CPUID 00000019: 00000000-00000000-00000000-00000000
CPUID 0000001A: 20000001-00000000-00000000-00000000 [Atom]
CPUID 0000001B: 00000000-00000000-00000000-00000000
CPUID 0000001C: C000000B-00000007-00000007-00000000
CPUID 0000001D: 00000000-00000000-00000000-00000000
CPUID 0000001E: 00000000-00000000-00000000-00000000
CPUID 0000001F: 00000001-00000001-00000100-00000012 [SL 00]
CPUID 0000001F: 00000006-0000000C-00000201-00000012 [SL 01]
CPUID 00000020: 00000000-00000001-00000000-00000000
CPUID 80000000: 80000008-00000000-00000000-00000000
CPUID 80000001: 00000000-00000000-00000121-2C100000
CPUID 80000002: 68743231-6E654720-746E4920-52286C65 [12th Gen Intel(R]
CPUID 80000003: 6F432029-54286572-6920294D-32312D33 [) Core(TM) i3-12]
CPUID 80000004: 00503032-00000000-00000000-00000000 [20P]
CPUID 80000005: 00000000-00000000-00000000-00000000 [L1D: 0 KB / L1I: 0 KB]
CPUID 80000006: 00000000-00000000-08008040-00000000 [L2: 2048 KB] / L3: 0 KB]
CPUID 80000007: 00000000-00000000-00000000-00000100
CPUID 80000008: 00003027-00000000-00000000-00000000

L1    Data Cache:    32 KB,  8-way Associative, 64-byte Line
L1  Instr. Cache:    64 KB,  8-way Associative, 64-byte Line
L2 Unified Cache:     2 MB, 16-way Associative, 64-byte Line
L3 Unified Cache:    12 MB, 12-way Associative, 64-byte Line

------[ CPUID Registers / Logical CPU #6 ]------

allcpu: Package 0 / Core 4 / Thread 0: Valid

CPUID 00000000: 00000020-756E6547-6C65746E-49656E69 [GenuineIntel]
CPUID 00000001: 000906A4-14400800-7FFAFBBF-BFEBFBFF
CPUID 00000002: 00FEFF01-00000000-00000000-00000000
CPUID 00000003: 00000000-00000000-00000000-00000000
CPUID 00000004: 7C004121-01C0003F-0000003F-00000000 [SL 00] [L1D: 32 KB]
CPUID 00000004: 7C004122-01C0003F-0000007F-00000000 [SL 01] [L1I: 64 KB]
CPUID 00000004: 7C01C143-03C0003F-000007FF-00000000 [SL 02] [L2U: 2 MB]
CPUID 00000004: 7C0FC163-02C0003F-00003FFF-00000004 [SL 03] [L3U: 12 MB]
CPUID 00000005: 00000040-00000040-00000003-10102020
CPUID 00000006: 00DF8FF7-00000002-00000409-00020003
CPUID 00000007: 00000001-239CA7EB-984007AC-FC18C410 [SL 00]
CPUID 00000007: 00400810-00000000-00000000-00000000 [SL 01]
CPUID 00000008: 00000000-00000000-00000000-00000000
CPUID 00000009: 00000000-00000000-00000000-00000000
CPUID 0000000A: 07300605-00000000-00000007-00008603
CPUID 0000000B: 00000001-00000001-00000100-00000014 [SL 00]
CPUID 0000000B: 00000006-0000000C-00000201-00000014 [SL 01]
CPUID 0000000C: 00000000-00000000-00000000-00000000
CPUID 0000000D: 00000207-00000340-00000A88-00000000 [SL 00] [x87]
CPUID 0000000D: 0000000F-000003D0-00019900-00000000 [SL 01] [SSE]
CPUID 0000000D: 00000100-00000240-00000000-00000000 [SL 02] [AVX]
CPUID 0000000D: 00000080-00000000-00000001-00000000 [SL 08] [PT]
CPUID 0000000D: 00000008-00000A80-00000000-00000000 [SL 09] [PKRU]
CPUID 0000000D: 00000010-00000000-00000001-00000000 [SL 0B]
CPUID 0000000D: 00000018-00000000-00000001-00000000 [SL 0C]
CPUID 0000000D: 00000328-00000000-00000001-00000000 [SL 0F]
CPUID 0000000D: 00000008-00000000-00000001-00000000 [SL 10]
CPUID 0000000E: 00000000-00000000-00000000-00000000
CPUID 0000000F: 00000000-00000000-00000000-00000000 [SL 00]
CPUID 0000000F: 00000000-00000000-00000000-00000000 [SL 01]
CPUID 00000010: 00000000-00000004-00000000-00000000 [SL 00]
CPUID 00000010: 00000000-00000000-00000000-00000000 [SL 01]
CPUID 00000011: 00000000-00000000-00000000-00000000
CPUID 00000012: 00000000-00000000-00000000-00000000 [SL 00]
CPUID 00000012: 00000000-00000000-00000000-00000000 [SL 01]
CPUID 00000013: 00000000-00000000-00000000-00000000
CPUID 00000014: 00000001-0000005F-80000007-00000000 [SL 00]
CPUID 00000014: 02490002-003F003F-00000000-00000000 [SL 01]
CPUID 00000015: 00000002-00000034-0249F000-00000000 [26.00x / 38400000]
CPUID 00000016: 000003E8-00000CE4-00000064-00000000 [1000 / 3300 / 100]
CPUID 00000017: 00000000-00000000-00000000-00000000 [SL 00]
CPUID 00000018: 00000004-00000000-00000000-00000000 [SL 00]
CPUID 00000018: 00000000-00300001-00000001-00000121 [SL 01]
CPUID 00000018: 00000000-00040003-00000200-00000043 [SL 02]
CPUID 00000018: 00000000-00400001-00000001-00000122 [SL 03]
CPUID 00000018: 00000000-00080008-00000001-00000143 [SL 04]
CPUID 00000019: 00000000-00000000-00000000-00000000
CPUID 0000001A: 20000001-00000000-00000000-00000000 [Atom]
CPUID 0000001B: 00000000-00000000-00000000-00000000
CPUID 0000001C: C000000B-00000007-00000007-00000000
CPUID 0000001D: 00000000-00000000-00000000-00000000
CPUID 0000001E: 00000000-00000000-00000000-00000000
CPUID 0000001F: 00000001-00000001-00000100-00000014 [SL 00]
CPUID 0000001F: 00000006-0000000C-00000201-00000014 [SL 01]
CPUID 00000020: 00000000-00000001-00000000-00000000
CPUID 80000000: 80000008-00000000-00000000-00000000
CPUID 80000001: 00000000-00000000-00000121-2C100000
CPUID 80000002: 68743231-6E654720-746E4920-52286C65 [12th Gen Intel(R]
CPUID 80000003: 6F432029-54286572-6920294D-32312D33 [) Core(TM) i3-12]
CPUID 80000004: 00503032-00000000-00000000-00000000 [20P]
CPUID 80000005: 00000000-00000000-00000000-00000000 [L1D: 0 KB / L1I: 0 KB]
CPUID 80000006: 00000000-00000000-08008040-00000000 [L2: 2048 KB] / L3: 0 KB]
CPUID 80000007: 00000000-00000000-00000000-00000100
CPUID 80000008: 00003027-00000000-00000000-00000000

L1    Data Cache:    32 KB,  8-way Associative, 64-byte Line
L1  Instr. Cache:    64 KB,  8-way Associative, 64-byte Line
L2 Unified Cache:     2 MB, 16-way Associative, 64-byte Line
L3 Unified Cache:    12 MB, 12-way Associative, 64-byte Line

------[ CPUID Registers / Logical CPU #7 ]------

allcpu: Package 0 / Core 5 / Thread 0: Valid

CPUID 00000000: 00000020-756E6547-6C65746E-49656E69 [GenuineIntel]
CPUID 00000001: 000906A4-16400800-7FFAFBBF-BFEBFBFF
CPUID 00000002: 00FEFF01-00000000-00000000-00000000
CPUID 00000003: 00000000-00000000-00000000-00000000
CPUID 00000004: 7C004121-01C0003F-0000003F-00000000 [SL 00] [L1D: 32 KB]
CPUID 00000004: 7C004122-01C0003F-0000007F-00000000 [SL 01] [L1I: 64 KB]
CPUID 00000004: 7C01C143-03C0003F-000007FF-00000000 [SL 02] [L2U: 2 MB]
CPUID 00000004: 7C0FC163-02C0003F-00003FFF-00000004 [SL 03] [L3U: 12 MB]
CPUID 00000005: 00000040-00000040-00000003-10102020
CPUID 00000006: 00DF8FF7-00000002-00000409-00020003
CPUID 00000007: 00000001-239CA7EB-984007AC-FC18C410 [SL 00]
CPUID 00000007: 00400810-00000000-00000000-00000000 [SL 01]
CPUID 00000008: 00000000-00000000-00000000-00000000
CPUID 00000009: 00000000-00000000-00000000-00000000
CPUID 0000000A: 07300605-00000000-00000007-00008603
CPUID 0000000B: 00000001-00000001-00000100-00000016 [SL 00]
CPUID 0000000B: 00000006-0000000C-00000201-00000016 [SL 01]
CPUID 0000000C: 00000000-00000000-00000000-00000000
CPUID 0000000D: 00000207-00000340-00000A88-00000000 [SL 00] [x87]
CPUID 0000000D: 0000000F-000003D0-00019900-00000000 [SL 01] [SSE]
CPUID 0000000D: 00000100-00000240-00000000-00000000 [SL 02] [AVX]
CPUID 0000000D: 00000080-00000000-00000001-00000000 [SL 08] [PT]
CPUID 0000000D: 00000008-00000A80-00000000-00000000 [SL 09] [PKRU]
CPUID 0000000D: 00000010-00000000-00000001-00000000 [SL 0B]
CPUID 0000000D: 00000018-00000000-00000001-00000000 [SL 0C]
CPUID 0000000D: 00000328-00000000-00000001-00000000 [SL 0F]
CPUID 0000000D: 00000008-00000000-00000001-00000000 [SL 10]
CPUID 0000000E: 00000000-00000000-00000000-00000000
CPUID 0000000F: 00000000-00000000-00000000-00000000 [SL 00]
CPUID 0000000F: 00000000-00000000-00000000-00000000 [SL 01]
CPUID 00000010: 00000000-00000004-00000000-00000000 [SL 00]
CPUID 00000010: 00000000-00000000-00000000-00000000 [SL 01]
CPUID 00000011: 00000000-00000000-00000000-00000000
CPUID 00000012: 00000000-00000000-00000000-00000000 [SL 00]
CPUID 00000012: 00000000-00000000-00000000-00000000 [SL 01]
CPUID 00000013: 00000000-00000000-00000000-00000000
CPUID 00000014: 00000001-0000005F-80000007-00000000 [SL 00]
CPUID 00000014: 02490002-003F003F-00000000-00000000 [SL 01]
CPUID 00000015: 00000002-00000034-0249F000-00000000 [26.00x / 38400000]
CPUID 00000016: 000003E8-00000CE4-00000064-00000000 [1000 / 3300 / 100]
CPUID 00000017: 00000000-00000000-00000000-00000000 [SL 00]
CPUID 00000018: 00000004-00000000-00000000-00000000 [SL 00]
CPUID 00000018: 00000000-00300001-00000001-00000121 [SL 01]
CPUID 00000018: 00000000-00040003-00000200-00000043 [SL 02]
CPUID 00000018: 00000000-00400001-00000001-00000122 [SL 03]
CPUID 00000018: 00000000-00080008-00000001-00000143 [SL 04]
CPUID 00000019: 00000000-00000000-00000000-00000000
CPUID 0000001A: 20000001-00000000-00000000-00000000 [Atom]
CPUID 0000001B: 00000000-00000000-00000000-00000000
CPUID 0000001C: C000000B-00000007-00000007-00000000
CPUID 0000001D: 00000000-00000000-00000000-00000000
CPUID 0000001E: 00000000-00000000-00000000-00000000
CPUID 0000001F: 00000001-00000001-00000100-00000016 [SL 00]
CPUID 0000001F: 00000006-0000000C-00000201-00000016 [SL 01]
CPUID 00000020: 00000000-00000001-00000000-00000000
CPUID 80000000: 80000008-00000000-00000000-00000000
CPUID 80000001: 00000000-00000000-00000121-2C100000
CPUID 80000002: 68743231-6E654720-746E4920-52286C65 [12th Gen Intel(R]
CPUID 80000003: 6F432029-54286572-6920294D-32312D33 [) Core(TM) i3-12]
CPUID 80000004: 00503032-00000000-00000000-00000000 [20P]
CPUID 80000005: 00000000-00000000-00000000-00000000 [L1D: 0 KB / L1I: 0 KB]
CPUID 80000006: 00000000-00000000-08008040-00000000 [L2: 2048 KB] / L3: 0 KB]
CPUID 80000007: 00000000-00000000-00000000-00000100
CPUID 80000008: 00003027-00000000-00000000-00000000

L1    Data Cache:    32 KB,  8-way Associative, 64-byte Line
L1  Instr. Cache:    64 KB,  8-way Associative, 64-byte Line
L2 Unified Cache:     2 MB, 16-way Associative, 64-byte Line
L3 Unified Cache:    12 MB, 12-way Associative, 64-byte Line

------[ CPUID Registers / Logical CPU #8 ]------

allcpu: Package 0 / Core 6 / Thread 0: Valid

CPUID 00000000: 00000020-756E6547-6C65746E-49656E69 [GenuineIntel]
CPUID 00000001: 000906A4-18400800-7FFAFBBF-BFEBFBFF
CPUID 00000002: 00FEFF01-00000000-00000000-00000000
CPUID 00000003: 00000000-00000000-00000000-00000000
CPUID 00000004: 7C004121-01C0003F-0000003F-00000000 [SL 00] [L1D: 32 KB]
CPUID 00000004: 7C004122-01C0003F-0000007F-00000000 [SL 01] [L1I: 64 KB]
CPUID 00000004: 7C01C143-03C0003F-000007FF-00000000 [SL 02] [L2U: 2 MB]
CPUID 00000004: 7C0FC163-02C0003F-00003FFF-00000004 [SL 03] [L3U: 12 MB]
CPUID 00000005: 00000040-00000040-00000003-10102020
CPUID 00000006: 00DF8FF7-00000002-00000409-00030003
CPUID 00000007: 00000001-239CA7EB-984007AC-FC18C410 [SL 00]
CPUID 00000007: 00400810-00000000-00000000-00000000 [SL 01]
CPUID 00000008: 00000000-00000000-00000000-00000000
CPUID 00000009: 00000000-00000000-00000000-00000000
CPUID 0000000A: 07300605-00000000-00000007-00008603
CPUID 0000000B: 00000001-00000001-00000100-00000018 [SL 00]
CPUID 0000000B: 00000006-0000000C-00000201-00000018 [SL 01]
CPUID 0000000C: 00000000-00000000-00000000-00000000
CPUID 0000000D: 00000207-00000340-00000A88-00000000 [SL 00] [x87]
CPUID 0000000D: 0000000F-000003D0-00019900-00000000 [SL 01] [SSE]
CPUID 0000000D: 00000100-00000240-00000000-00000000 [SL 02] [AVX]
CPUID 0000000D: 00000080-00000000-00000001-00000000 [SL 08] [PT]
CPUID 0000000D: 00000008-00000A80-00000000-00000000 [SL 09] [PKRU]
CPUID 0000000D: 00000010-00000000-00000001-00000000 [SL 0B]
CPUID 0000000D: 00000018-00000000-00000001-00000000 [SL 0C]
CPUID 0000000D: 00000328-00000000-00000001-00000000 [SL 0F]
CPUID 0000000D: 00000008-00000000-00000001-00000000 [SL 10]
CPUID 0000000E: 00000000-00000000-00000000-00000000
CPUID 0000000F: 00000000-00000000-00000000-00000000 [SL 00]
CPUID 0000000F: 00000000-00000000-00000000-00000000 [SL 01]
CPUID 00000010: 00000000-00000004-00000000-00000000 [SL 00]
CPUID 00000010: 00000000-00000000-00000000-00000000 [SL 01]
CPUID 00000011: 00000000-00000000-00000000-00000000
CPUID 00000012: 00000000-00000000-00000000-00000000 [SL 00]
CPUID 00000012: 00000000-00000000-00000000-00000000 [SL 01]
CPUID 00000013: 00000000-00000000-00000000-00000000
CPUID 00000014: 00000001-0000005F-80000007-00000000 [SL 00]
CPUID 00000014: 02490002-003F003F-00000000-00000000 [SL 01]
CPUID 00000015: 00000002-00000034-0249F000-00000000 [26.00x / 38400000]
CPUID 00000016: 000003E8-00000CE4-00000064-00000000 [1000 / 3300 / 100]
CPUID 00000017: 00000000-00000000-00000000-00000000 [SL 00]
CPUID 00000018: 00000004-00000000-00000000-00000000 [SL 00]
CPUID 00000018: 00000000-00300001-00000001-00000121 [SL 01]
CPUID 00000018: 00000000-00040003-00000200-00000043 [SL 02]
CPUID 00000018: 00000000-00400001-00000001-00000122 [SL 03]
CPUID 00000018: 00000000-00080008-00000001-00000143 [SL 04]
CPUID 00000019: 00000000-00000000-00000000-00000000
CPUID 0000001A: 20000001-00000000-00000000-00000000 [Atom]
CPUID 0000001B: 00000000-00000000-00000000-00000000
CPUID 0000001C: C000000B-00000007-00000007-00000000
CPUID 0000001D: 00000000-00000000-00000000-00000000
CPUID 0000001E: 00000000-00000000-00000000-00000000
CPUID 0000001F: 00000001-00000001-00000100-00000018 [SL 00]
CPUID 0000001F: 00000006-0000000C-00000201-00000018 [SL 01]
CPUID 00000020: 00000000-00000001-00000000-00000000
CPUID 80000000: 80000008-00000000-00000000-00000000
CPUID 80000001: 00000000-00000000-00000121-2C100000
CPUID 80000002: 68743231-6E654720-746E4920-52286C65 [12th Gen Intel(R]
CPUID 80000003: 6F432029-54286572-6920294D-32312D33 [) Core(TM) i3-12]
CPUID 80000004: 00503032-00000000-00000000-00000000 [20P]
CPUID 80000005: 00000000-00000000-00000000-00000000 [L1D: 0 KB / L1I: 0 KB]
CPUID 80000006: 00000000-00000000-08008040-00000000 [L2: 2048 KB] / L3: 0 KB]
CPUID 80000007: 00000000-00000000-00000000-00000100
CPUID 80000008: 00003027-00000000-00000000-00000000

L1    Data Cache:    32 KB,  8-way Associative, 64-byte Line
L1  Instr. Cache:    64 KB,  8-way Associative, 64-byte Line
L2 Unified Cache:     2 MB, 16-way Associative, 64-byte Line
L3 Unified Cache:    12 MB, 12-way Associative, 64-byte Line

------[ CPUID Registers / Logical CPU #9 ]------

allcpu: Package 0 / Core 7 / Thread 0: Valid

CPUID 00000000: 00000020-756E6547-6C65746E-49656E69 [GenuineIntel]
CPUID 00000001: 000906A4-1A400800-7FFAFBBF-BFEBFBFF
CPUID 00000002: 00FEFF01-00000000-00000000-00000000
CPUID 00000003: 00000000-00000000-00000000-00000000
CPUID 00000004: 7C004121-01C0003F-0000003F-00000000 [SL 00] [L1D: 32 KB]
CPUID 00000004: 7C004122-01C0003F-0000007F-00000000 [SL 01] [L1I: 64 KB]
CPUID 00000004: 7C01C143-03C0003F-000007FF-00000000 [SL 02] [L2U: 2 MB]
CPUID 00000004: 7C0FC163-02C0003F-00003FFF-00000004 [SL 03] [L3U: 12 MB]
CPUID 00000005: 00000040-00000040-00000003-10102020
CPUID 00000006: 00DF8FF7-00000002-00000409-00030003
CPUID 00000007: 00000001-239CA7EB-984007AC-FC18C410 [SL 00]
CPUID 00000007: 00400810-00000000-00000000-00000000 [SL 01]
CPUID 00000008: 00000000-00000000-00000000-00000000
CPUID 00000009: 00000000-00000000-00000000-00000000
CPUID 0000000A: 07300605-00000000-00000007-00008603
CPUID 0000000B: 00000001-00000001-00000100-0000001A [SL 00]
CPUID 0000000B: 00000006-0000000C-00000201-0000001A [SL 01]
CPUID 0000000C: 00000000-00000000-00000000-00000000
CPUID 0000000D: 00000207-00000340-00000A88-00000000 [SL 00] [x87]
CPUID 0000000D: 0000000F-000003D0-00019900-00000000 [SL 01] [SSE]
CPUID 0000000D: 00000100-00000240-00000000-00000000 [SL 02] [AVX]
CPUID 0000000D: 00000080-00000000-00000001-00000000 [SL 08] [PT]
CPUID 0000000D: 00000008-00000A80-00000000-00000000 [SL 09] [PKRU]
CPUID 0000000D: 00000010-00000000-00000001-00000000 [SL 0B]
CPUID 0000000D: 00000018-00000000-00000001-00000000 [SL 0C]
CPUID 0000000D: 00000328-00000000-00000001-00000000 [SL 0F]
CPUID 0000000D: 00000008-00000000-00000001-00000000 [SL 10]
CPUID 0000000E: 00000000-00000000-00000000-00000000
CPUID 0000000F: 00000000-00000000-00000000-00000000 [SL 00]
CPUID 0000000F: 00000000-00000000-00000000-00000000 [SL 01]
CPUID 00000010: 00000000-00000004-00000000-00000000 [SL 00]
CPUID 00000010: 00000000-00000000-00000000-00000000 [SL 01]
CPUID 00000011: 00000000-00000000-00000000-00000000
CPUID 00000012: 00000000-00000000-00000000-00000000 [SL 00]
CPUID 00000012: 00000000-00000000-00000000-00000000 [SL 01]
CPUID 00000013: 00000000-00000000-00000000-00000000
CPUID 00000014: 00000001-0000005F-80000007-00000000 [SL 00]
CPUID 00000014: 02490002-003F003F-00000000-00000000 [SL 01]
CPUID 00000015: 00000002-00000034-0249F000-00000000 [26.00x / 38400000]
CPUID 00000016: 000003E8-00000CE4-00000064-00000000 [1000 / 3300 / 100]
CPUID 00000017: 00000000-00000000-00000000-00000000 [SL 00]
CPUID 00000018: 00000004-00000000-00000000-00000000 [SL 00]
CPUID 00000018: 00000000-00300001-00000001-00000121 [SL 01]
CPUID 00000018: 00000000-00040003-00000200-00000043 [SL 02]
CPUID 00000018: 00000000-00400001-00000001-00000122 [SL 03]
CPUID 00000018: 00000000-00080008-00000001-00000143 [SL 04]
CPUID 00000019: 00000000-00000000-00000000-00000000
CPUID 0000001A: 20000001-00000000-00000000-00000000 [Atom]
CPUID 0000001B: 00000000-00000000-00000000-00000000
CPUID 0000001C: C000000B-00000007-00000007-00000000
CPUID 0000001D: 00000000-00000000-00000000-00000000
CPUID 0000001E: 00000000-00000000-00000000-00000000
CPUID 0000001F: 00000001-00000001-00000100-0000001A [SL 00]
CPUID 0000001F: 00000006-0000000C-00000201-0000001A [SL 01]
CPUID 00000020: 00000000-00000001-00000000-00000000
CPUID 80000000: 80000008-00000000-00000000-00000000
CPUID 80000001: 00000000-00000000-00000121-2C100000
CPUID 80000002: 68743231-6E654720-746E4920-52286C65 [12th Gen Intel(R]
CPUID 80000003: 6F432029-54286572-6920294D-32312D33 [) Core(TM) i3-12]
CPUID 80000004: 00503032-00000000-00000000-00000000 [20P]
CPUID 80000005: 00000000-00000000-00000000-00000000 [L1D: 0 KB / L1I: 0 KB]
CPUID 80000006: 00000000-00000000-08008040-00000000 [L2: 2048 KB] / L3: 0 KB]
CPUID 80000007: 00000000-00000000-00000000-00000100
CPUID 80000008: 00003027-00000000-00000000-00000000

L1    Data Cache:    32 KB,  8-way Associative, 64-byte Line
L1  Instr. Cache:    64 KB,  8-way Associative, 64-byte Line
L2 Unified Cache:     2 MB, 16-way Associative, 64-byte Line
L3 Unified Cache:    12 MB, 12-way Associative, 64-byte Line

------[ CPUID Registers / Logical CPU #10 ]------

allcpu: Package 0 / Core 8 / Thread 0: Valid

CPUID 00000000: 00000020-756E6547-6C65746E-49656E69 [GenuineIntel]
CPUID 00000001: 000906A4-1C400800-7FFAFBBF-BFEBFBFF
CPUID 00000002: 00FEFF01-00000000-00000000-00000000
CPUID 00000003: 00000000-00000000-00000000-00000000
CPUID 00000004: 7C004121-01C0003F-0000003F-00000000 [SL 00] [L1D: 32 KB]
CPUID 00000004: 7C004122-01C0003F-0000007F-00000000 [SL 01] [L1I: 64 KB]
CPUID 00000004: 7C01C143-03C0003F-000007FF-00000000 [SL 02] [L2U: 2 MB]
CPUID 00000004: 7C0FC163-02C0003F-00003FFF-00000004 [SL 03] [L3U: 12 MB]
CPUID 00000005: 00000040-00000040-00000003-10102020
CPUID 00000006: 00DF8FF7-00000002-00000409-00030003
CPUID 00000007: 00000001-239CA7EB-984007AC-FC18C410 [SL 00]
CPUID 00000007: 00400810-00000000-00000000-00000000 [SL 01]
CPUID 00000008: 00000000-00000000-00000000-00000000
CPUID 00000009: 00000000-00000000-00000000-00000000
CPUID 0000000A: 07300605-00000000-00000007-00008603
CPUID 0000000B: 00000001-00000001-00000100-0000001C [SL 00]
CPUID 0000000B: 00000006-0000000C-00000201-0000001C [SL 01]
CPUID 0000000C: 00000000-00000000-00000000-00000000
CPUID 0000000D: 00000207-00000340-00000A88-00000000 [SL 00] [x87]
CPUID 0000000D: 0000000F-000003D0-00019900-00000000 [SL 01] [SSE]
CPUID 0000000D: 00000100-00000240-00000000-00000000 [SL 02] [AVX]
CPUID 0000000D: 00000080-00000000-00000001-00000000 [SL 08] [PT]
CPUID 0000000D: 00000008-00000A80-00000000-00000000 [SL 09] [PKRU]
CPUID 0000000D: 00000010-00000000-00000001-00000000 [SL 0B]
CPUID 0000000D: 00000018-00000000-00000001-00000000 [SL 0C]
CPUID 0000000D: 00000328-00000000-00000001-00000000 [SL 0F]
CPUID 0000000D: 00000008-00000000-00000001-00000000 [SL 10]
CPUID 0000000E: 00000000-00000000-00000000-00000000
CPUID 0000000F: 00000000-00000000-00000000-00000000 [SL 00]
CPUID 0000000F: 00000000-00000000-00000000-00000000 [SL 01]
CPUID 00000010: 00000000-00000004-00000000-00000000 [SL 00]
CPUID 00000010: 00000000-00000000-00000000-00000000 [SL 01]
CPUID 00000011: 00000000-00000000-00000000-00000000
CPUID 00000012: 00000000-00000000-00000000-00000000 [SL 00]
CPUID 00000012: 00000000-00000000-00000000-00000000 [SL 01]
CPUID 00000013: 00000000-00000000-00000000-00000000
CPUID 00000014: 00000001-0000005F-80000007-00000000 [SL 00]
CPUID 00000014: 02490002-003F003F-00000000-00000000 [SL 01]
CPUID 00000015: 00000002-00000034-0249F000-00000000 [26.00x / 38400000]
CPUID 00000016: 000003E8-00000CE4-00000064-00000000 [1000 / 3300 / 100]
CPUID 00000017: 00000000-00000000-00000000-00000000 [SL 00]
CPUID 00000018: 00000004-00000000-00000000-00000000 [SL 00]
CPUID 00000018: 00000000-00300001-00000001-00000121 [SL 01]
CPUID 00000018: 00000000-00040003-00000200-00000043 [SL 02]
CPUID 00000018: 00000000-00400001-00000001-00000122 [SL 03]
CPUID 00000018: 00000000-00080008-00000001-00000143 [SL 04]
CPUID 00000019: 00000000-00000000-00000000-00000000
CPUID 0000001A: 20000001-00000000-00000000-00000000 [Atom]
CPUID 0000001B: 00000000-00000000-00000000-00000000
CPUID 0000001C: C000000B-00000007-00000007-00000000
CPUID 0000001D: 00000000-00000000-00000000-00000000
CPUID 0000001E: 00000000-00000000-00000000-00000000
CPUID 0000001F: 00000001-00000001-00000100-0000001C [SL 00]
CPUID 0000001F: 00000006-0000000C-00000201-0000001C [SL 01]
CPUID 00000020: 00000000-00000001-00000000-00000000
CPUID 80000000: 80000008-00000000-00000000-00000000
CPUID 80000001: 00000000-00000000-00000121-2C100000
CPUID 80000002: 68743231-6E654720-746E4920-52286C65 [12th Gen Intel(R]
CPUID 80000003: 6F432029-54286572-6920294D-32312D33 [) Core(TM) i3-12]
CPUID 80000004: 00503032-00000000-00000000-00000000 [20P]
CPUID 80000005: 00000000-00000000-00000000-00000000 [L1D: 0 KB / L1I: 0 KB]
CPUID 80000006: 00000000-00000000-08008040-00000000 [L2: 2048 KB] / L3: 0 KB]
CPUID 80000007: 00000000-00000000-00000000-00000100
CPUID 80000008: 00003027-00000000-00000000-00000000

L1    Data Cache:    32 KB,  8-way Associative, 64-byte Line
L1  Instr. Cache:    64 KB,  8-way Associative, 64-byte Line
L2 Unified Cache:     2 MB, 16-way Associative, 64-byte Line
L3 Unified Cache:    12 MB, 12-way Associative, 64-byte Line

------[ CPUID Registers / Logical CPU #11 ]------

allcpu: Package 0 / Core 9 / Thread 0: Valid

CPUID 00000000: 00000020-756E6547-6C65746E-49656E69 [GenuineIntel]
CPUID 00000001: 000906A4-1E400800-7FFAFBBF-BFEBFBFF
CPUID 00000002: 00FEFF01-00000000-00000000-00000000
CPUID 00000003: 00000000-00000000-00000000-00000000
CPUID 00000004: 7C004121-01C0003F-0000003F-00000000 [SL 00] [L1D: 32 KB]
CPUID 00000004: 7C004122-01C0003F-0000007F-00000000 [SL 01] [L1I: 64 KB]
CPUID 00000004: 7C01C143-03C0003F-000007FF-00000000 [SL 02] [L2U: 2 MB]
CPUID 00000004: 7C0FC163-02C0003F-00003FFF-00000004 [SL 03] [L3U: 12 MB]
CPUID 00000005: 00000040-00000040-00000003-10102020
CPUID 00000006: 00DF8FF7-00000002-00000409-00030003
CPUID 00000007: 00000001-239CA7EB-984007AC-FC18C410 [SL 00]
CPUID 00000007: 00400810-00000000-00000000-00000000 [SL 01]
CPUID 00000008: 00000000-00000000-00000000-00000000
CPUID 00000009: 00000000-00000000-00000000-00000000
CPUID 0000000A: 07300605-00000000-00000007-00008603
CPUID 0000000B: 00000001-00000001-00000100-0000001E [SL 00]
CPUID 0000000B: 00000006-0000000C-00000201-0000001E [SL 01]
CPUID 0000000C: 00000000-00000000-00000000-00000000
CPUID 0000000D: 00000207-00000340-00000A88-00000000 [SL 00] [x87]
CPUID 0000000D: 0000000F-000003D0-00019900-00000000 [SL 01] [SSE]
CPUID 0000000D: 00000100-00000240-00000000-00000000 [SL 02] [AVX]
CPUID 0000000D: 00000080-00000000-00000001-00000000 [SL 08] [PT]
CPUID 0000000D: 00000008-00000A80-00000000-00000000 [SL 09] [PKRU]
CPUID 0000000D: 00000010-00000000-00000001-00000000 [SL 0B]
CPUID 0000000D: 00000018-00000000-00000001-00000000 [SL 0C]
CPUID 0000000D: 00000328-00000000-00000001-00000000 [SL 0F]
CPUID 0000000D: 00000008-00000000-00000001-00000000 [SL 10]
CPUID 0000000E: 00000000-00000000-00000000-00000000
CPUID 0000000F: 00000000-00000000-00000000-00000000 [SL 00]
CPUID 0000000F: 00000000-00000000-00000000-00000000 [SL 01]
CPUID 00000010: 00000000-00000004-00000000-00000000 [SL 00]
CPUID 00000010: 00000000-00000000-00000000-00000000 [SL 01]
CPUID 00000011: 00000000-00000000-00000000-00000000
CPUID 00000012: 00000000-00000000-00000000-00000000 [SL 00]
CPUID 00000012: 00000000-00000000-00000000-00000000 [SL 01]
CPUID 00000013: 00000000-00000000-00000000-00000000
CPUID 00000014: 00000001-0000005F-80000007-00000000 [SL 00]
CPUID 00000014: 02490002-003F003F-00000000-00000000 [SL 01]
CPUID 00000015: 00000002-00000034-0249F000-00000000 [26.00x / 38400000]
CPUID 00000016: 000003E8-00000CE4-00000064-00000000 [1000 / 3300 / 100]
CPUID 00000017: 00000000-00000000-00000000-00000000 [SL 00]
CPUID 00000018: 00000004-00000000-00000000-00000000 [SL 00]
CPUID 00000018: 00000000-00300001-00000001-00000121 [SL 01]
CPUID 00000018: 00000000-00040003-00000200-00000043 [SL 02]
CPUID 00000018: 00000000-00400001-00000001-00000122 [SL 03]
CPUID 00000018: 00000000-00080008-00000001-00000143 [SL 04]
CPUID 00000019: 00000000-00000000-00000000-00000000
CPUID 0000001A: 20000001-00000000-00000000-00000000 [Atom]
CPUID 0000001B: 00000000-00000000-00000000-00000000
CPUID 0000001C: C000000B-00000007-00000007-00000000
CPUID 0000001D: 00000000-00000000-00000000-00000000
CPUID 0000001E: 00000000-00000000-00000000-00000000
CPUID 0000001F: 00000001-00000001-00000100-0000001E [SL 00]
CPUID 0000001F: 00000006-0000000C-00000201-0000001E [SL 01]
CPUID 00000020: 00000000-00000001-00000000-00000000
CPUID 80000000: 80000008-00000000-00000000-00000000
CPUID 80000001: 00000000-00000000-00000121-2C100000
CPUID 80000002: 68743231-6E654720-746E4920-52286C65 [12th Gen Intel(R]
CPUID 80000003: 6F432029-54286572-6920294D-32312D33 [) Core(TM) i3-12]
CPUID 80000004: 00503032-00000000-00000000-00000000 [20P]
CPUID 80000005: 00000000-00000000-00000000-00000000 [L1D: 0 KB / L1I: 0 KB]
CPUID 80000006: 00000000-00000000-08008040-00000000 [L2: 2048 KB] / L3: 0 KB]
CPUID 80000007: 00000000-00000000-00000000-00000100
CPUID 80000008: 00003027-00000000-00000000-00000000

L1    Data Cache:    32 KB,  8-way Associative, 64-byte Line
L1  Instr. Cache:    64 KB,  8-way Associative, 64-byte Line
L2 Unified Cache:     2 MB, 16-way Associative, 64-byte Line
L3 Unified Cache:    12 MB, 12-way Associative, 64-byte Line

------[ All CPUs ]------

CPU   0: APICID    0 / Package 0 / Core   0 / Thread 0: Valid
CPU   1: APICID    1 / Package 0 / Core   0 / Thread 1: Valid, Virtual
CPU   2: APICID    8 / Package 0 / Core   1 / Thread 0: Valid
CPU   3: APICID    9 / Package 0 / Core   1 / Thread 1: Valid, Virtual
CPU   4: APICID   16 / Package 0 / Core   2 / Thread 0: Valid
CPU   5: APICID   18 / Package 0 / Core   3 / Thread 0: Valid
CPU   6: APICID   20 / Package 0 / Core   4 / Thread 0: Valid
CPU   7: APICID   22 / Package 0 / Core   5 / Thread 0: Valid
CPU   8: APICID   24 / Package 0 / Core   6 / Thread 0: Valid
CPU   9: APICID   26 / Package 0 / Core   7 / Thread 0: Valid
CPU  10: APICID   28 / Package 0 / Core   8 / Thread 0: Valid
CPU  11: APICID   30 / Package 0 / Core   9 / Thread 0: Valid

------[ MSR Registers / Logical CPU #0 ]------

MSR 00000017: 001C-0000-0000-0000 [PlatID = 7]
MSR 0000001B: 0000-0000-FEE0-0D00
MSR 00000035: 0000-0000-000A-000C
MSR 00000048: 0000-0000-0000-0001
MSR 00000049: < FAILED >
MSR 0000008B: 0000-0413-0000-0000
MSR 000000CE: 0004-043D-F981-0A00 [eD = 0]
MSR 000000E7: 0000-009D-1262-CB72 [S200]
MSR 000000E7: 0000-009D-12E6-C4E0 [S200]
MSR 000000E7: 0000-009D-1304-46C8
MSR 000000E8: 0000-0112-6793-61BC [S200]
MSR 000000E8: 0000-0112-67AA-3275 [S200]
MSR 000000E8: 0000-0112-67B6-B759
MSR 0000010A: 0000-0000-0000-0D6B
MSR 0000010B: < FAILED >
MSR 00000194: 0000-0000-0011-0A00
MSR 00000198: 0000-15F7-0000-0600 [S200]
MSR 00000198: 0000-1638-0000-0600 [S200]
MSR 00000198: 0000-160D-0000-0700
MSR 00000199: 0000-0000-0000-0A00
MSR 0000019A: 0000-0000-0000-0000
MSR 0000019B: 0000-0000-0000-0010
MSR 0000019C: 0000-0000-8836-2800 [S200]
MSR 0000019C: 0000-0000-8836-2800 [S200]
MSR 0000019C: 0000-0000-8837-2800
MSR 0000019D: 0000-0000-0000-0000
MSR 000001A0: 0000-0000-0085-0089
MSR 000001A2: 0000-0000-8064-0000
MSR 000001A4: 0000-0000-0000-0000
MSR 000001AA: 0000-0000-0000-30C2
MSR 000001AC: < FAILED >
MSR 000001AD: 2626-2626-2626-262C
MSR 000001AE: 0807-0605-0403-0201
MSR 000001AF: < FAILED >
MSR 000001B0: 0000-0000-0000-0006
MSR 000001B1: 0000-0000-8835-0800
MSR 000001B2: 0000-0000-0200-0000
MSR 000001FC: 0000-0000-00EC-0059
MSR 00000300: < FAILED >
MSR 0000030A: 0000-0000-00E5-C986 [S200]
MSR 0000030A: 0000-0000-00E5-C986 [S200]
MSR 0000030A: 0000-0000-00E5-C986
MSR 0000030B: 0000-0000-00E5-F0D0 [S200]
MSR 0000030B: 0000-0000-00E5-F0D0 [S200]
MSR 0000030B: 0000-0000-00E5-F0D0
MSR 00000480: 03DA-0500-0000-0013
MSR 00000481: 0000-00FF-0000-0016
MSR 00000482: FFFB-FFFE-0401-E172
MSR 00000483: F77F-FFFF-0003-6DFF
MSR 00000484: 0076-FFFF-0000-11FF
MSR 00000485: 0000-0000-7004-C1E7
MSR 00000486: 0000-0000-8000-0021
MSR 00000487: 0000-0000-FFFF-FFFF
MSR 00000488: 0000-0000-0000-2000
MSR 00000489: 0000-0000-01F7-2FFF
MSR 0000048A: 0000-0000-0000-002E
MSR 0000048B: 075D-7FFF-0000-0000
MSR 0000048C: 0000-0F01-06F3-4141
MSR 0000048D: 0000-00FF-0000-0016
MSR 0000048E: FFFB-FFFE-0400-6172
MSR 0000048F: F77F-FFFF-0003-6DFB
MSR 00000490: 0076-FFFF-0000-11FB
MSR 00000601: 0000-0000-0000-0280
MSR 00000602: < FAILED >
MSR 00000603: 0036-0000-0036-3636
MSR 00000604: < FAILED >
MSR 00000606: 0000-0000-000A-0E03
MSR 0000060A: 0000-0000-0000-0000
MSR 0000060B: 0000-0000-0000-0000
MSR 0000060C: 0000-0000-0000-0000
MSR 0000060D: 0000-00C4-8D14-B736
MSR 00000610: 0042-8138-00DD-80A0
MSR 00000611: 0000-0000-11CA-D8E5 [S200]
MSR 00000611: 0000-0000-11CB-1734 [S200]
MSR 00000611: 0000-0000-11CB-5644
MSR 00000613: 0000-0000-0000-0000
MSR 00000614: 0000-0000-0000-00E0
MSR 00000618: 0000-0000-0000-0000
MSR 00000619: 0000-0000-0000-0000 [S200]
MSR 00000619: 0000-0000-0000-0000 [S200]
MSR 00000619: 0000-0000-0000-0000
MSR 0000061B: 0000-0000-0000-0000
MSR 0000061C: < FAILED >
MSR 0000061E: < FAILED >
MSR 00000620: 0000-0000-0000-0426
MSR 00000621: 0000-0000-0000-0004
MSR 00000638: 0000-0000-0000-0000
MSR 00000639: 0000-0000-0708-B183 [S200]
MSR 00000639: 0000-0000-0708-B2EA [S200]
MSR 00000639: 0000-0000-0708-B735
MSR 0000063A: 0000-0000-0000-0010
MSR 0000063B: < FAILED >
MSR 00000640: 0000-0000-0000-0000
MSR 00000641: 0000-0000-0000-0019 [S200]
MSR 00000641: 0000-0000-0000-0019 [S200]
MSR 00000641: 0000-0000-0000-0019
MSR 00000642: 0000-0000-0000-0010
MSR 00000648: 0000-0000-0000-000A
MSR 00000649: 0000-0000-000A-00A0
MSR 0000064A: 0000-0000-000A-0118
MSR 0000064B: 0000-0000-0000-0000
MSR 0000064C: 0000-0000-0000-0009
MSR 00000690: < FAILED >
MSR 000006B0: 0000-0000-0000-0000
MSR 000006B1: 0000-0000-0500-0000
MSR 00000770: 0000-0000-0000-0001
MSR 00000771: 0000-0000-0108-0D38
MSR 00000772: 0000-0000-8000-FF01
MSR 00000773: 0000-0000-0000-0005
MSR 00000774: 0000-019E-5400-3801
MSR 00000777: 0000-0000-0000-0004
MSR 00000832: 0000-0000-0003-00D1
MSR 00000838: 0000-0000-0000-0000
MSR 00000839: 0000-0000-0000-0000
MSR 0000083E: 0000-0000-0000-000A

------[ MSR Registers / Logical CPU #1 ]------

MSR 00000017: 001C-0000-0000-0000 [PlatID = 7]
MSR 0000001B: 0000-0000-FEE0-0C00
MSR 00000035: 0000-0000-000A-000C
MSR 00000048: 0000-0000-0000-0001
MSR 00000049: < FAILED >
MSR 0000008B: 0000-0413-0000-0000
MSR 000000CE: 0004-043D-F981-0A00 [eD = 0]
MSR 000000E7: 0000-00C0-97DF-36E6
MSR 000000E8: 0000-0119-C93E-2231
MSR 0000010A: 0000-0000-0000-0D6B
MSR 0000010B: < FAILED >
MSR 00000194: 0000-0000-0011-0A00
MSR 00000198: 0000-15F6-0000-0700
MSR 00000199: 0000-0000-0000-0A00
MSR 0000019A: 0000-0000-0000-0000
MSR 0000019B: 0000-0000-0000-0010
MSR 0000019C: 0000-0000-8836-2800
MSR 0000019D: 0000-0000-0000-0000
MSR 000001A0: 0000-0000-0085-0089
MSR 000001A2: 0000-0000-8064-0000
MSR 000001A4: 0000-0000-0000-0000
MSR 000001AA: 0000-0000-0000-30C2
MSR 000001AC: < FAILED >
MSR 000001AD: 2626-2626-2626-262C
MSR 000001AE: 0807-0605-0403-0201
MSR 000001AF: < FAILED >
MSR 000001B0: 0000-0000-0000-0006
MSR 000001B1: 0000-0000-8836-0800
MSR 000001B2: 0000-0000-0200-0000
MSR 000001FC: 0000-0000-00EC-0059
MSR 00000300: < FAILED >
MSR 0000030A: 0000-0000-0000-0000
MSR 0000030B: 0000-0000-0000-0000
MSR 00000480: 03DA-0500-0000-0013
MSR 00000481: 0000-00FF-0000-0016
MSR 00000482: FFFB-FFFE-0401-E172
MSR 00000483: F77F-FFFF-0003-6DFF
MSR 00000484: 0076-FFFF-0000-11FF
MSR 00000485: 0000-0000-7004-C1E7
MSR 00000486: 0000-0000-8000-0021
MSR 00000487: 0000-0000-FFFF-FFFF
MSR 00000488: 0000-0000-0000-2000
MSR 00000489: 0000-0000-01F7-2FFF
MSR 0000048A: 0000-0000-0000-002E
MSR 0000048B: 075D-7FFF-0000-0000
MSR 0000048C: 0000-0F01-06F3-4141
MSR 0000048D: 0000-00FF-0000-0016
MSR 0000048E: FFFB-FFFE-0400-6172
MSR 0000048F: F77F-FFFF-0003-6DFB
MSR 00000490: 0076-FFFF-0000-11FB
MSR 00000601: 0000-0000-0000-0280
MSR 00000602: < FAILED >
MSR 00000603: 0036-0000-0036-3636
MSR 00000604: < FAILED >
MSR 00000606: 0000-0000-000A-0E03
MSR 0000060A: 0000-0000-0000-0000
MSR 0000060B: 0000-0000-0000-0000
MSR 0000060C: 0000-0000-0000-0000
MSR 0000060D: 0000-00C4-EA48-180E
MSR 00000610: 0042-8138-00DD-80A0
MSR 00000611: 0000-0000-11CC-D5C1
MSR 00000613: 0000-0000-0000-0000
MSR 00000614: 0000-0000-0000-00E0
MSR 00000618: 0000-0000-0000-0000
MSR 00000619: 0000-0000-0000-0000
MSR 0000061B: 0000-0000-0000-0000
MSR 0000061C: < FAILED >
MSR 0000061E: < FAILED >
MSR 00000620: 0000-0000-0000-0426
MSR 00000621: 0000-0000-0000-0004
MSR 00000638: 0000-0000-0000-0000
MSR 00000639: 0000-0000-0708-BA20
MSR 0000063A: 0000-0000-0000-0010
MSR 0000063B: < FAILED >
MSR 00000640: 0000-0000-0000-0000
MSR 00000641: 0000-0000-0000-0019
MSR 00000642: 0000-0000-0000-0010
MSR 00000648: 0000-0000-0000-000A
MSR 00000649: 0000-0000-000A-00A0
MSR 0000064A: 0000-0000-000A-0118
MSR 0000064B: 0000-0000-0000-0000
MSR 0000064C: 0000-0000-0000-0009
MSR 00000690: < FAILED >
MSR 000006B0: 0000-0000-0000-0000
MSR 000006B1: 0000-0000-0500-0000
MSR 00000770: 0000-0000-0000-0001
MSR 00000771: 0000-0000-0109-0D38
MSR 00000772: 0000-0000-8000-FF01
MSR 00000773: 0000-0000-0000-0005
MSR 00000774: 0000-019E-5400-3801
MSR 00000777: 0000-0000-0000-0004
MSR 00000832: 0000-0000-0003-00D1
MSR 00000838: 0000-0000-0000-0000
MSR 00000839: 0000-0000-0000-0000
MSR 0000083E: 0000-0000-0000-000A

------[ MSR Registers / Logical CPU #2 ]------

MSR 00000017: 001C-0000-0000-0000 [PlatID = 7]
MSR 0000001B: 0000-0000-FEE0-0C00
MSR 00000035: 0000-0000-000A-000C
MSR 00000048: 0000-0000-0000-0001
MSR 00000049: < FAILED >
MSR 0000008B: 0000-0413-0000-0000
MSR 000000CE: 0004-043D-F981-0A00 [eD = 0]
MSR 000000E7: 0000-0088-BB4B-5ADE
MSR 000000E8: 0000-00D9-B023-3B58
MSR 0000010A: 0000-0000-0000-0D6B
MSR 0000010B: < FAILED >
MSR 00000194: 0000-0000-0011-0A00
MSR 00000198: 0000-1640-0000-0900
MSR 00000199: 0000-0000-0000-0A00
MSR 0000019A: 0000-0000-0000-0000
MSR 0000019B: 0000-0000-0000-0010
MSR 0000019C: 0000-0000-883A-2800
MSR 0000019D: 0000-0000-0000-0000
MSR 000001A0: 0000-0000-0085-0089
MSR 000001A2: 0000-0000-8064-0000
MSR 000001A4: 0000-0000-0000-0000
MSR 000001AA: 0000-0000-0000-30C2
MSR 000001AC: < FAILED >
MSR 000001AD: 2626-2626-2626-262C
MSR 000001AE: 0807-0605-0403-0201
MSR 000001AF: < FAILED >
MSR 000001B0: 0000-0000-0000-0006
MSR 000001B1: 0000-0000-8836-0800
MSR 000001B2: 0000-0000-0200-0000
MSR 000001FC: 0000-0000-00EC-0059
MSR 00000300: < FAILED >
MSR 0000030A: 0000-0000-0000-0000
MSR 0000030B: 0000-0000-0000-0000
MSR 00000480: 03DA-0500-0000-0013
MSR 00000481: 0000-00FF-0000-0016
MSR 00000482: FFFB-FFFE-0401-E172
MSR 00000483: F77F-FFFF-0003-6DFF
MSR 00000484: 0076-FFFF-0000-11FF
MSR 00000485: 0000-0000-7004-C1E7
MSR 00000486: 0000-0000-8000-0021
MSR 00000487: 0000-0000-FFFF-FFFF
MSR 00000488: 0000-0000-0000-2000
MSR 00000489: 0000-0000-01F7-2FFF
MSR 0000048A: 0000-0000-0000-002E
MSR 0000048B: 075D-7FFF-0000-0000
MSR 0000048C: 0000-0F01-06F3-4141
MSR 0000048D: 0000-00FF-0000-0016
MSR 0000048E: FFFB-FFFE-0400-6172
MSR 0000048F: F77F-FFFF-0003-6DFB
MSR 00000490: 0076-FFFF-0000-11FB
MSR 00000601: 0000-0000-0000-0280
MSR 00000602: < FAILED >
MSR 00000603: 0036-0000-0036-3636
MSR 00000604: < FAILED >
MSR 00000606: 0000-0000-000A-0E03
MSR 0000060A: 0000-0000-0000-0000
MSR 0000060B: 0000-0000-0000-0000
MSR 0000060C: 0000-0000-0000-0000
MSR 0000060D: 0000-00C4-EA48-180E
MSR 00000610: 0042-8138-00DD-80A0
MSR 00000611: 0000-0000-11CC-D753
MSR 00000613: 0000-0000-0000-0000
MSR 00000614: 0000-0000-0000-00E0
MSR 00000618: 0000-0000-0000-0000
MSR 00000619: 0000-0000-0000-0000
MSR 0000061B: 0000-0000-0000-0000
MSR 0000061C: < FAILED >
MSR 0000061E: < FAILED >
MSR 00000620: 0000-0000-0000-0426
MSR 00000621: 0000-0000-0000-0005
MSR 00000638: 0000-0000-0000-0000
MSR 00000639: 0000-0000-0708-BA6D
MSR 0000063A: 0000-0000-0000-0010
MSR 0000063B: < FAILED >
MSR 00000640: 0000-0000-0000-0000
MSR 00000641: 0000-0000-0000-0019
MSR 00000642: 0000-0000-0000-0010
MSR 00000648: 0000-0000-0000-000A
MSR 00000649: 0000-0000-000A-00A0
MSR 0000064A: 0000-0000-000A-0118
MSR 0000064B: 0000-0000-0000-0000
MSR 0000064C: 0000-0000-0000-0009
MSR 00000690: < FAILED >
MSR 000006B0: 0000-0000-0000-0000
MSR 000006B1: 0000-0000-0500-0000
MSR 00000770: 0000-0000-0000-0001
MSR 00000771: 0000-0000-010B-0D38
MSR 00000772: 0000-0000-8000-FF01
MSR 00000773: 0000-0000-0000-0005
MSR 00000774: 0000-019E-5400-3801
MSR 00000777: 0000-0000-0000-0004
MSR 00000832: 0000-0000-0002-00D1
MSR 00000838: 0000-0000-0000-124F
MSR 00000839: 0000-0000-0000-048D
MSR 0000083E: 0000-0000-0000-000A

------[ MSR Registers / Logical CPU #3 ]------

MSR 00000017: 001C-0000-0000-0000 [PlatID = 7]
MSR 0000001B: 0000-0000-FEE0-0C00
MSR 00000035: 0000-0000-000A-000C
MSR 00000048: 0000-0000-0000-0001
MSR 00000049: < FAILED >
MSR 0000008B: 0000-0413-0000-0000
MSR 000000CE: 0004-043D-F981-0A00 [eD = 0]
MSR 000000E7: 0000-00BF-3992-6F50
MSR 000000E8: 0000-0118-FF82-0431
MSR 0000010A: 0000-0000-0000-0D6B
MSR 0000010B: < FAILED >
MSR 00000194: 0000-0000-0011-0A00
MSR 00000198: 0000-15F2-0000-0800
MSR 00000199: 0000-0000-0000-0A00
MSR 0000019A: 0000-0000-0000-0000
MSR 0000019B: 0000-0000-0000-0010
MSR 0000019C: 0000-0000-8839-2800
MSR 0000019D: 0000-0000-0000-0000
MSR 000001A0: 0000-0000-0085-0089
MSR 000001A2: 0000-0000-8064-0000
MSR 000001A4: 0000-0000-0000-0000
MSR 000001AA: 0000-0000-0000-30C2
MSR 000001AC: < FAILED >
MSR 000001AD: 2626-2626-2626-262C
MSR 000001AE: 0807-0605-0403-0201
MSR 000001AF: < FAILED >
MSR 000001B0: 0000-0000-0000-0006
MSR 000001B1: 0000-0000-8836-0800
MSR 000001B2: 0000-0000-0200-0000
MSR 000001FC: 0000-0000-00EC-0059
MSR 00000300: < FAILED >
MSR 0000030A: 0000-0000-0000-0000
MSR 0000030B: 0000-0000-0000-0000
MSR 00000480: 03DA-0500-0000-0013
MSR 00000481: 0000-00FF-0000-0016
MSR 00000482: FFFB-FFFE-0401-E172
MSR 00000483: F77F-FFFF-0003-6DFF
MSR 00000484: 0076-FFFF-0000-11FF
MSR 00000485: 0000-0000-7004-C1E7
MSR 00000486: 0000-0000-8000-0021
MSR 00000487: 0000-0000-FFFF-FFFF
MSR 00000488: 0000-0000-0000-2000
MSR 00000489: 0000-0000-01F7-2FFF
MSR 0000048A: 0000-0000-0000-002E
MSR 0000048B: 075D-7FFF-0000-0000
MSR 0000048C: 0000-0F01-06F3-4141
MSR 0000048D: 0000-00FF-0000-0016
MSR 0000048E: FFFB-FFFE-0400-6172
MSR 0000048F: F77F-FFFF-0003-6DFB
MSR 00000490: 0076-FFFF-0000-11FB
MSR 00000601: 0000-0000-0000-0280
MSR 00000602: < FAILED >
MSR 00000603: 0036-0000-0036-3636
MSR 00000604: < FAILED >
MSR 00000606: 0000-0000-000A-0E03
MSR 0000060A: 0000-0000-0000-0000
MSR 0000060B: 0000-0000-0000-0000
MSR 0000060C: 0000-0000-0000-0000
MSR 0000060D: 0000-00C4-EA48-180E
MSR 00000610: 0042-8138-00DD-80A0
MSR 00000611: 0000-0000-11CC-D862
MSR 00000613: 0000-0000-0000-0000
MSR 00000614: 0000-0000-0000-00E0
MSR 00000618: 0000-0000-0000-0000
MSR 00000619: 0000-0000-0000-0000
MSR 0000061B: 0000-0000-0000-0000
MSR 0000061C: < FAILED >
MSR 0000061E: < FAILED >
MSR 00000620: 0000-0000-0000-0426
MSR 00000621: 0000-0000-0000-0004
MSR 00000638: 0000-0000-0000-0000
MSR 00000639: 0000-0000-0708-BAA3
MSR 0000063A: 0000-0000-0000-0010
MSR 0000063B: < FAILED >
MSR 00000640: 0000-0000-0000-0000
MSR 00000641: 0000-0000-0000-0019
MSR 00000642: 0000-0000-0000-0010
MSR 00000648: 0000-0000-0000-000A
MSR 00000649: 0000-0000-000A-00A0
MSR 0000064A: 0000-0000-000A-0118
MSR 0000064B: 0000-0000-0000-0000
MSR 0000064C: 0000-0000-0000-0009
MSR 00000690: < FAILED >
MSR 000006B0: 0000-0000-0000-0000
MSR 000006B1: 0000-0000-0500-0000
MSR 00000770: 0000-0000-0000-0001
MSR 00000771: 0000-0000-010B-0D38
MSR 00000772: 0000-0000-8000-FF01
MSR 00000773: 0000-0000-0000-0005
MSR 00000774: 0000-019E-5400-3801
MSR 00000777: 0000-0000-0000-0004
MSR 00000832: 0000-0000-0003-00D1
MSR 00000838: 0000-0000-0000-0000
MSR 00000839: 0000-0000-0000-0000
MSR 0000083E: 0000-0000-0000-000A

------[ MSR Registers / Logical CPU #4 ]------

MSR 00000017: 001C-0000-0000-0000 [PlatID = 7]
MSR 0000001B: 0000-0000-FEE0-0C00
MSR 0000002A: 0000-0000-0000-0000
MSR 00000035: 0000-0000-000A-000C
MSR 00000048: 0000-0000-0000-0001
MSR 00000049: < FAILED >
MSR 0000008B: 0000-0413-0000-0000
MSR 000000CD: < FAILED >
MSR 000000CE: 0004-043D-F981-0A00 [eD = 0]
MSR 000000E7: 0000-0077-2FAF-A540
MSR 000000E8: 0000-0092-6D20-045C
MSR 000000EE: < FAILED >
MSR 0000010A: 0000-0000-0000-0D6B
MSR 0000010B: < FAILED >
MSR 0000011E: < FAILED >
MSR 00000194: 0000-0000-0011-0A00
MSR 00000198: 0000-22BC-0000-2000
MSR 00000199: 0000-0000-0000-0A00
MSR 0000019A: 0000-0000-0000-0000
MSR 0000019B: 0000-0000-0000-0010
MSR 0000019C: 0000-0000-8839-2800
MSR 0000019D: 0000-0000-0000-0000
MSR 000001A0: 0000-0000-0085-0089
MSR 000001A2: 0000-0000-8064-0000
MSR 000001A4: 0000-0000-0000-0000
MSR 000001AA: 0000-0000-0000-30C2
MSR 000001AC: < FAILED >
MSR 000001AD: 2626-2626-2626-262C
MSR 000001AE: 0807-0605-0403-0201
MSR 000001AF: < FAILED >
MSR 000001B0: 0000-0000-0000-0006
MSR 000001B1: 0000-0000-8836-0800
MSR 000001B2: 0000-0000-0200-0000
MSR 000001FC: 0000-0000-00EC-0059
MSR 00000300: < FAILED >
MSR 0000030A: 0000-0000-0000-0000
MSR 0000030B: 0000-0000-0000-0000
MSR 00000480: 03DA-0500-0000-0013
MSR 00000481: 0000-00FF-0000-0016
MSR 00000482: FFFB-FFFE-0401-E172
MSR 00000483: F77F-FFFF-0003-6DFF
MSR 00000484: 0076-FFFF-0000-11FF
MSR 00000485: 0000-0000-7004-C1E7
MSR 00000486: 0000-0000-8000-0021
MSR 00000487: 0000-0000-FFFF-FFFF
MSR 00000488: 0000-0000-0000-2000
MSR 00000489: 0000-0000-01F7-2FFF
MSR 0000048A: 0000-0000-0000-002E
MSR 0000048B: 075D-7FFF-0000-0000
MSR 0000048C: 0000-0F01-06F3-4141
MSR 0000048D: 0000-00FF-0000-0016
MSR 0000048E: FFFB-FFFE-0400-6172
MSR 0000048F: F77F-FFFF-0003-6DFB
MSR 00000490: 0076-FFFF-0000-11FB
MSR 00000601: 0000-0000-0000-0280
MSR 00000602: < FAILED >
MSR 00000603: 0036-0000-0036-3636
MSR 00000604: < FAILED >
MSR 00000606: 0000-0000-000A-0E03
MSR 0000060A: 0000-0000-0000-0000
MSR 0000060B: 0000-0000-0000-0000
MSR 0000060C: 0000-0000-0000-0000
MSR 0000060D: 0000-00C4-EA48-180E
MSR 00000610: 0042-8138-00DD-80A0
MSR 00000611: 0000-0000-11CC-D8BF
MSR 00000613: 0000-0000-0000-0000
MSR 00000614: 0000-0000-0000-00E0
MSR 00000618: 0000-0000-0000-0000
MSR 00000619: 0000-0000-0000-0000
MSR 0000061B: 0000-0000-0000-0000
MSR 0000061C: < FAILED >
MSR 0000061E: < FAILED >
MSR 00000620: 0000-0000-0000-0426
MSR 00000621: 0000-0000-0000-001C
MSR 00000638: 0000-0000-0000-0000
MSR 00000639: 0000-0000-0708-BAB3
MSR 0000063A: 0000-0000-0000-0010
MSR 0000063B: < FAILED >
MSR 00000640: 0000-0000-0000-0000
MSR 00000641: 0000-0000-0000-0019
MSR 00000642: 0000-0000-0000-0010
MSR 00000648: 0000-0000-0000-000A
MSR 00000649: 0000-0000-000A-00A0
MSR 0000064A: 0000-0000-000A-0118
MSR 0000064B: 0000-0000-0000-0000
MSR 0000064C: 0000-0000-0000-0009
MSR 00000660: 0000-000C-E2D4-6742
MSR 00000661: < FAILED >
MSR 00000662: < FAILED >
MSR 00000663: < FAILED >
MSR 00000664: 0000-0106-3A74-764A
MSR 00000665: < FAILED >
MSR 00000666: < FAILED >
MSR 00000667: < FAILED >
MSR 00000668: < FAILED >
MSR 00000669: < FAILED >
MSR 0000066A: < FAILED >
MSR 0000066B: < FAILED >
MSR 0000066C: < FAILED >
MSR 0000066D: < FAILED >
MSR 0000066E: < FAILED >
MSR 0000066F: < FAILED >
MSR 00000670: < FAILED >
MSR 00000671: < FAILED >
MSR 00000672: < FAILED >
MSR 00000673: < FAILED >
MSR 00000674: < FAILED >
MSR 00000675: < FAILED >
MSR 00000676: < FAILED >
MSR 00000677: < FAILED >
MSR 00000690: < FAILED >
MSR 000006B0: 0000-0000-0000-0000
MSR 000006B1: 0000-0000-0500-0000
MSR 00000770: 0000-0000-0000-0001
MSR 00000771: 0000-0000-0108-0721
MSR 00000772: 0000-0000-8000-FF01
MSR 00000773: 0000-0000-0000-0005
MSR 00000774: 0000-019E-5400-2107
MSR 00000777: 0000-0000-0000-0004
MSR 00000832: 0000-0000-0003-00D1
MSR 00000838: 0000-0000-0000-0000
MSR 00000839: 0000-0000-0000-0000
MSR 0000083E: 0000-0000-0000-000A

------[ MSR Registers / Logical CPU #5 ]------

MSR 00000017: 001C-0000-0000-0000 [PlatID = 7]
MSR 0000001B: 0000-0000-FEE0-0C00
MSR 0000002A: 0000-0000-0000-0000
MSR 00000035: 0000-0000-000A-000C
MSR 00000048: 0000-0000-0000-0001
MSR 00000049: < FAILED >
MSR 0000008B: 0000-0413-0000-0000
MSR 000000CD: < FAILED >
MSR 000000CE: 0004-043D-F981-0A00 [eD = 0]
MSR 000000E7: 0000-0094-71C9-BCA0
MSR 000000E8: 0000-00AB-497B-EC43
MSR 000000EE: < FAILED >
MSR 0000010A: 0000-0000-0000-0D6B
MSR 0000010B: < FAILED >
MSR 0000011E: < FAILED >
MSR 00000194: 0000-0000-0011-0A00
MSR 00000198: 0000-1606-0000-0800
MSR 00000199: 0000-0000-0000-0A00
MSR 0000019A: 0000-0000-0000-0000
MSR 0000019B: 0000-0000-0000-0010
MSR 0000019C: 0000-0000-8839-2800
MSR 0000019D: 0000-0000-0000-0000
MSR 000001A0: 0000-0000-0085-0089
MSR 000001A2: 0000-0000-8064-0000
MSR 000001A4: 0000-0000-0000-0000
MSR 000001AA: 0000-0000-0000-30C2
MSR 000001AC: < FAILED >
MSR 000001AD: 2626-2626-2626-262C
MSR 000001AE: 0807-0605-0403-0201
MSR 000001AF: < FAILED >
MSR 000001B0: 0000-0000-0000-0006
MSR 000001B1: 0000-0000-8837-0800
MSR 000001B2: 0000-0000-0200-0000
MSR 000001FC: 0000-0000-00EC-0059
MSR 00000300: < FAILED >
MSR 0000030A: 0000-0000-0000-0000
MSR 0000030B: 0000-0000-0000-0000
MSR 00000480: 03DA-0500-0000-0013
MSR 00000481: 0000-00FF-0000-0016
MSR 00000482: FFFB-FFFE-0401-E172
MSR 00000483: F77F-FFFF-0003-6DFF
MSR 00000484: 0076-FFFF-0000-11FF
MSR 00000485: 0000-0000-7004-C1E7
MSR 00000486: 0000-0000-8000-0021
MSR 00000487: 0000-0000-FFFF-FFFF
MSR 00000488: 0000-0000-0000-2000
MSR 00000489: 0000-0000-01F7-2FFF
MSR 0000048A: 0000-0000-0000-002E
MSR 0000048B: 075D-7FFF-0000-0000
MSR 0000048C: 0000-0F01-06F3-4141
MSR 0000048D: 0000-00FF-0000-0016
MSR 0000048E: FFFB-FFFE-0400-6172
MSR 0000048F: F77F-FFFF-0003-6DFB
MSR 00000490: 0076-FFFF-0000-11FB
MSR 00000601: 0000-0000-0000-0280
MSR 00000602: < FAILED >
MSR 00000603: 0036-0000-0036-3636
MSR 00000604: < FAILED >
MSR 00000606: 0000-0000-000A-0E03
MSR 0000060A: 0000-0000-0000-0000
MSR 0000060B: 0000-0000-0000-0000
MSR 0000060C: 0000-0000-0000-0000
MSR 0000060D: 0000-00C4-EA48-180E
MSR 00000610: 0042-8138-00DD-80A0
MSR 00000611: 0000-0000-11CC-DA6B
MSR 00000613: 0000-0000-0000-0000
MSR 00000614: 0000-0000-0000-00E0
MSR 00000618: 0000-0000-0000-0000
MSR 00000619: 0000-0000-0000-0000
MSR 0000061B: 0000-0000-0000-0000
MSR 0000061C: < FAILED >
MSR 0000061E: < FAILED >
MSR 00000620: 0000-0000-0000-0426
MSR 00000621: 0000-0000-0000-0004
MSR 00000638: 0000-0000-0000-0000
MSR 00000639: 0000-0000-0708-BB77
MSR 0000063A: 0000-0000-0000-0010
MSR 0000063B: < FAILED >
MSR 00000640: 0000-0000-0000-0000
MSR 00000641: 0000-0000-0000-0019
MSR 00000642: 0000-0000-0000-0010
MSR 00000648: 0000-0000-0000-000A
MSR 00000649: 0000-0000-000A-00A0
MSR 0000064A: 0000-0000-000A-0118
MSR 0000064B: 0000-0000-0000-0000
MSR 0000064C: 0000-0000-0000-0009
MSR 00000660: 0000-000B-06C9-F21A
MSR 00000661: < FAILED >
MSR 00000662: < FAILED >
MSR 00000663: < FAILED >
MSR 00000664: 0000-0106-3A79-CC9C
MSR 00000665: < FAILED >
MSR 00000666: < FAILED >
MSR 00000667: < FAILED >
MSR 00000668: < FAILED >
MSR 00000669: < FAILED >
MSR 0000066A: < FAILED >
MSR 0000066B: < FAILED >
MSR 0000066C: < FAILED >
MSR 0000066D: < FAILED >
MSR 0000066E: < FAILED >
MSR 0000066F: < FAILED >
MSR 00000670: < FAILED >
MSR 00000671: < FAILED >
MSR 00000672: < FAILED >
MSR 00000673: < FAILED >
MSR 00000674: < FAILED >
MSR 00000675: < FAILED >
MSR 00000676: < FAILED >
MSR 00000677: < FAILED >
MSR 00000690: < FAILED >
MSR 000006B0: 0000-0000-0000-0000
MSR 000006B1: 0000-0000-0500-0000
MSR 00000770: 0000-0000-0000-0001
MSR 00000771: 0000-0000-0108-0721
MSR 00000772: 0000-0000-8000-FF01
MSR 00000773: 0000-0000-0000-0005
MSR 00000774: 0000-019E-5400-2107
MSR 00000777: 0000-0000-0000-0004
MSR 00000832: 0000-0000-0003-00D1
MSR 00000838: 0000-0000-0000-0000
MSR 00000839: 0000-0000-0000-0000
MSR 0000083E: 0000-0000-0000-000A

------[ MSR Registers / Logical CPU #6 ]------

MSR 00000017: 001C-0000-0000-0000 [PlatID = 7]
MSR 0000001B: 0000-0000-FEE0-0C00
MSR 0000002A: 0000-0000-0000-0000
MSR 00000035: 0000-0000-000A-000C
MSR 00000048: 0000-0000-0000-0001
MSR 00000049: < FAILED >
MSR 0000008B: 0000-0413-0000-0000
MSR 000000CD: < FAILED >
MSR 000000CE: 0004-043D-F981-0A00 [eD = 0]
MSR 000000E7: 0000-00AB-8C7C-A348
MSR 000000E8: 0000-00BF-54E8-E26D
MSR 000000EE: < FAILED >
MSR 0000010A: 0000-0000-0000-0D6B
MSR 0000010B: < FAILED >
MSR 0000011E: < FAILED >
MSR 00000194: 0000-0000-0011-0A00
MSR 00000198: 0000-15FF-0000-0800
MSR 00000199: 0000-0000-0000-0A00
MSR 0000019A: 0000-0000-0000-0000
MSR 0000019B: 0000-0000-0000-0010
MSR 0000019C: 0000-0000-8839-2800
MSR 0000019D: 0000-0000-0000-0000
MSR 000001A0: 0000-0000-0085-0089
MSR 000001A2: 0000-0000-8064-0000
MSR 000001A4: 0000-0000-0000-0000
MSR 000001AA: 0000-0000-0000-30C2
MSR 000001AC: < FAILED >
MSR 000001AD: 2626-2626-2626-262C
MSR 000001AE: 0807-0605-0403-0201
MSR 000001AF: < FAILED >
MSR 000001B0: 0000-0000-0000-0006
MSR 000001B1: 0000-0000-8837-0800
MSR 000001B2: 0000-0000-0200-0000
MSR 000001FC: 0000-0000-00EC-0059
MSR 00000300: < FAILED >
MSR 0000030A: 0000-0000-0000-0000
MSR 0000030B: 0000-0000-0000-0000
MSR 00000480: 03DA-0500-0000-0013
MSR 00000481: 0000-00FF-0000-0016
MSR 00000482: FFFB-FFFE-0401-E172
MSR 00000483: F77F-FFFF-0003-6DFF
MSR 00000484: 0076-FFFF-0000-11FF
MSR 00000485: 0000-0000-7004-C1E7
MSR 00000486: 0000-0000-8000-0021
MSR 00000487: 0000-0000-FFFF-FFFF
MSR 00000488: 0000-0000-0000-2000
MSR 00000489: 0000-0000-01F7-2FFF
MSR 0000048A: 0000-0000-0000-002E
MSR 0000048B: 075D-7FFF-0000-0000
MSR 0000048C: 0000-0F01-06F3-4141
MSR 0000048D: 0000-00FF-0000-0016
MSR 0000048E: FFFB-FFFE-0400-6172
MSR 0000048F: F77F-FFFF-0003-6DFB
MSR 00000490: 0076-FFFF-0000-11FB
MSR 00000601: 0000-0000-0000-0280
MSR 00000602: < FAILED >
MSR 00000603: 0036-0000-0036-3636
MSR 00000604: < FAILED >
MSR 00000606: 0000-0000-000A-0E03
MSR 0000060A: 0000-0000-0000-0000
MSR 0000060B: 0000-0000-0000-0000
MSR 0000060C: 0000-0000-0000-0000
MSR 0000060D: 0000-00C4-EA48-180E
MSR 00000610: 0042-8138-00DD-80A0
MSR 00000611: 0000-0000-11CC-DBDD
MSR 00000613: 0000-0000-0000-0000
MSR 00000614: 0000-0000-0000-00E0
MSR 00000618: 0000-0000-0000-0000
MSR 00000619: 0000-0000-0000-0000
MSR 0000061B: 0000-0000-0000-0000
MSR 0000061C: < FAILED >
MSR 0000061E: < FAILED >
MSR 00000620: 0000-0000-0000-0426
MSR 00000621: 0000-0000-0000-0004
MSR 00000638: 0000-0000-0000-0000
MSR 00000639: 0000-0000-0708-BB9D
MSR 0000063A: 0000-0000-0000-0010
MSR 0000063B: < FAILED >
MSR 00000640: 0000-0000-0000-0000
MSR 00000641: 0000-0000-0000-0019
MSR 00000642: 0000-0000-0000-0010
MSR 00000648: 0000-0000-0000-000A
MSR 00000649: 0000-0000-000A-00A0
MSR 0000064A: 0000-0000-000A-0118
MSR 0000064B: 0000-0000-0000-0000
MSR 0000064C: 0000-0000-0000-0009
MSR 00000660: 0000-000A-CC4E-9238
MSR 00000661: < FAILED >
MSR 00000662: < FAILED >
MSR 00000663: < FAILED >
MSR 00000664: 0000-0106-3A79-CC9C
MSR 00000665: < FAILED >
MSR 00000666: < FAILED >
MSR 00000667: < FAILED >
MSR 00000668: < FAILED >
MSR 00000669: < FAILED >
MSR 0000066A: < FAILED >
MSR 0000066B: < FAILED >
MSR 0000066C: < FAILED >
MSR 0000066D: < FAILED >
MSR 0000066E: < FAILED >
MSR 0000066F: < FAILED >
MSR 00000670: < FAILED >
MSR 00000671: < FAILED >
MSR 00000672: < FAILED >
MSR 00000673: < FAILED >
MSR 00000674: < FAILED >
MSR 00000675: < FAILED >
MSR 00000676: < FAILED >
MSR 00000677: < FAILED >
MSR 00000690: < FAILED >
MSR 000006B0: 0000-0000-0000-0000
MSR 000006B1: 0000-0000-0500-0000
MSR 00000770: 0000-0000-0000-0001
MSR 00000771: 0000-0000-0108-0721
MSR 00000772: 0000-0000-8000-FF01
MSR 00000773: 0000-0000-0000-0005
MSR 00000774: 0000-019E-5400-2107
MSR 00000777: 0000-0000-0000-0004
MSR 00000832: 0000-0000-0003-00D1
MSR 00000838: 0000-0000-0000-0000
MSR 00000839: 0000-0000-0000-0000
MSR 0000083E: 0000-0000-0000-000A

------[ MSR Registers / Logical CPU #7 ]------

MSR 00000017: 001C-0000-0000-0000 [PlatID = 7]
MSR 0000001B: 0000-0000-FEE0-0C00
MSR 0000002A: 0000-0000-0000-0000
MSR 00000035: 0000-0000-000A-000C
MSR 00000048: 0000-0000-0000-0001
MSR 00000049: < FAILED >
MSR 0000008B: 0000-0413-0000-0000
MSR 000000CD: < FAILED >
MSR 000000CE: 0004-043D-F981-0A00 [eD = 0]
MSR 000000E7: 0000-00BA-65AC-C1D0
MSR 000000E8: 0000-00CC-7659-82D4
MSR 000000EE: < FAILED >
MSR 0000010A: 0000-0000-0000-0D6B
MSR 0000010B: < FAILED >
MSR 0000011E: < FAILED >
MSR 00000194: 0000-0000-0011-0A00
MSR 00000198: 0000-15FC-0000-0800
MSR 00000199: 0000-0000-0000-0A00
MSR 0000019A: 0000-0000-0000-0000
MSR 0000019B: 0000-0000-0000-0010
MSR 0000019C: 0000-0000-8839-2800
MSR 0000019D: 0000-0000-0000-0000
MSR 000001A0: 0000-0000-0085-0089
MSR 000001A2: 0000-0000-8064-0000
MSR 000001A4: 0000-0000-0000-0000
MSR 000001AA: 0000-0000-0000-30C2
MSR 000001AC: < FAILED >
MSR 000001AD: 2626-2626-2626-262C
MSR 000001AE: 0807-0605-0403-0201
MSR 000001AF: < FAILED >
MSR 000001B0: 0000-0000-0000-0006
MSR 000001B1: 0000-0000-8836-0800
MSR 000001B2: 0000-0000-0200-0000
MSR 000001FC: 0000-0000-00EC-0059
MSR 00000300: < FAILED >
MSR 0000030A: 0000-0000-0000-0000
MSR 0000030B: 0000-0000-0000-0000
MSR 00000480: 03DA-0500-0000-0013
MSR 00000481: 0000-00FF-0000-0016
MSR 00000482: FFFB-FFFE-0401-E172
MSR 00000483: F77F-FFFF-0003-6DFF
MSR 00000484: 0076-FFFF-0000-11FF
MSR 00000485: 0000-0000-7004-C1E7
MSR 00000486: 0000-0000-8000-0021
MSR 00000487: 0000-0000-FFFF-FFFF
MSR 00000488: 0000-0000-0000-2000
MSR 00000489: 0000-0000-01F7-2FFF
MSR 0000048A: 0000-0000-0000-002E
MSR 0000048B: 075D-7FFF-0000-0000
MSR 0000048C: 0000-0F01-06F3-4141
MSR 0000048D: 0000-00FF-0000-0016
MSR 0000048E: FFFB-FFFE-0400-6172
MSR 0000048F: F77F-FFFF-0003-6DFB
MSR 00000490: 0076-FFFF-0000-11FB
MSR 00000601: 0000-0000-0000-0280
MSR 00000602: < FAILED >
MSR 00000603: 0036-0000-0036-3636
MSR 00000604: < FAILED >
MSR 00000606: 0000-0000-000A-0E03
MSR 0000060A: 0000-0000-0000-0000
MSR 0000060B: 0000-0000-0000-0000
MSR 0000060C: 0000-0000-0000-0000
MSR 0000060D: 0000-00C4-EA48-180E
MSR 00000610: 0042-8138-00DD-80A0
MSR 00000611: 0000-0000-11CC-DCEE
MSR 00000613: 0000-0000-0000-0000
MSR 00000614: 0000-0000-0000-00E0
MSR 00000618: 0000-0000-0000-0000
MSR 00000619: 0000-0000-0000-0000
MSR 0000061B: 0000-0000-0000-0000
MSR 0000061C: < FAILED >
MSR 0000061E: < FAILED >
MSR 00000620: 0000-0000-0000-0426
MSR 00000621: 0000-0000-0000-0004
MSR 00000638: 0000-0000-0000-0000
MSR 00000639: 0000-0000-0708-BBC5
MSR 0000063A: 0000-0000-0000-0010
MSR 0000063B: < FAILED >
MSR 00000640: 0000-0000-0000-0000
MSR 00000641: 0000-0000-0000-0019
MSR 00000642: 0000-0000-0000-0010
MSR 00000648: 0000-0000-0000-000A
MSR 00000649: 0000-0000-000A-00A0
MSR 0000064A: 0000-0000-000A-0118
MSR 0000064B: 0000-0000-0000-0000
MSR 0000064C: 0000-0000-0000-0009
MSR 00000660: 0000-0009-E306-8566
MSR 00000661: < FAILED >
MSR 00000662: < FAILED >
MSR 00000663: < FAILED >
MSR 00000664: 0000-0106-3A79-CC9C
MSR 00000665: < FAILED >
MSR 00000666: < FAILED >
MSR 00000667: < FAILED >
MSR 00000668: < FAILED >
MSR 00000669: < FAILED >
MSR 0000066A: < FAILED >
MSR 0000066B: < FAILED >
MSR 0000066C: < FAILED >
MSR 0000066D: < FAILED >
MSR 0000066E: < FAILED >
MSR 0000066F: < FAILED >
MSR 00000670: < FAILED >
MSR 00000671: < FAILED >
MSR 00000672: < FAILED >
MSR 00000673: < FAILED >
MSR 00000674: < FAILED >
MSR 00000675: < FAILED >
MSR 00000676: < FAILED >
MSR 00000677: < FAILED >
MSR 00000690: < FAILED >
MSR 000006B0: 0000-0000-0000-0000
MSR 000006B1: 0000-0000-0500-0000
MSR 00000770: 0000-0000-0000-0001
MSR 00000771: 0000-0000-0108-0721
MSR 00000772: 0000-0000-8000-FF01
MSR 00000773: 0000-0000-0000-0005
MSR 00000774: 0000-019E-5400-2107
MSR 00000777: 0000-0000-0000-0004
MSR 00000832: 0000-0000-0003-00D1
MSR 00000838: 0000-0000-0000-0000
MSR 00000839: 0000-0000-0000-0000
MSR 0000083E: 0000-0000-0000-000A

------[ MSR Registers / Logical CPU #8 ]------

MSR 00000017: 001C-0000-0000-0000 [PlatID = 7]
MSR 0000001B: 0000-0000-FEE0-0C00
MSR 0000002A: 0000-0000-0000-0000
MSR 00000035: 0000-0000-000A-000C
MSR 00000048: 0000-0000-0000-0001
MSR 00000049: < FAILED >
MSR 0000008B: 0000-0413-0000-0000
MSR 000000CD: < FAILED >
MSR 000000CE: 0004-043D-F981-0A00 [eD = 0]
MSR 000000E7: 0000-0075-5CBB-F2C0
MSR 000000E8: 0000-0091-A1BE-AE69
MSR 000000EE: < FAILED >
MSR 0000010A: 0000-0000-0000-0D6B
MSR 0000010B: < FAILED >
MSR 0000011E: < FAILED >
MSR 00000194: 0000-0000-0011-0A00
MSR 00000198: 0000-15F8-0000-0800
MSR 00000199: 0000-0000-0000-0A00
MSR 0000019A: 0000-0000-0000-0000
MSR 0000019B: 0000-0000-0000-0010
MSR 0000019C: 0000-0000-8838-2800
MSR 0000019D: 0000-0000-0000-0000
MSR 000001A0: 0000-0000-0085-0089
MSR 000001A2: 0000-0000-8064-0000
MSR 000001A4: 0000-0000-0000-0000
MSR 000001AA: 0000-0000-0000-30C2
MSR 000001AC: < FAILED >
MSR 000001AD: 2626-2626-2626-262C
MSR 000001AE: 0807-0605-0403-0201
MSR 000001AF: < FAILED >
MSR 000001B0: 0000-0000-0000-0006
MSR 000001B1: 0000-0000-8836-0800
MSR 000001B2: 0000-0000-0200-0000
MSR 000001FC: 0000-0000-00EC-0059
MSR 00000300: < FAILED >
MSR 0000030A: 0000-0000-0000-0000
MSR 0000030B: 0000-0000-0000-0000
MSR 00000480: 03DA-0500-0000-0013
MSR 00000481: 0000-00FF-0000-0016
MSR 00000482: FFFB-FFFE-0401-E172
MSR 00000483: F77F-FFFF-0003-6DFF
MSR 00000484: 0076-FFFF-0000-11FF
MSR 00000485: 0000-0000-7004-C1E7
MSR 00000486: 0000-0000-8000-0021
MSR 00000487: 0000-0000-FFFF-FFFF
MSR 00000488: 0000-0000-0000-2000
MSR 00000489: 0000-0000-01F7-2FFF
MSR 0000048A: 0000-0000-0000-002E
MSR 0000048B: 075D-7FFF-0000-0000
MSR 0000048C: 0000-0F01-06F3-4141
MSR 0000048D: 0000-00FF-0000-0016
MSR 0000048E: FFFB-FFFE-0400-6172
MSR 0000048F: F77F-FFFF-0003-6DFB
MSR 00000490: 0076-FFFF-0000-11FB
MSR 00000601: 0000-0000-0000-0280
MSR 00000602: < FAILED >
MSR 00000603: 0036-0000-0036-3636
MSR 00000604: < FAILED >
MSR 00000606: 0000-0000-000A-0E03
MSR 0000060A: 0000-0000-0000-0000
MSR 0000060B: 0000-0000-0000-0000
MSR 0000060C: 0000-0000-0000-0000
MSR 0000060D: 0000-00C4-EA48-180E
MSR 00000610: 0042-8138-00DD-80A0
MSR 00000611: 0000-0000-11CC-DE3F
MSR 00000613: 0000-0000-0000-0000
MSR 00000614: 0000-0000-0000-00E0
MSR 00000618: 0000-0000-0000-0000
MSR 00000619: 0000-0000-0000-0000
MSR 0000061B: 0000-0000-0000-0000
MSR 0000061C: < FAILED >
MSR 0000061E: < FAILED >
MSR 00000620: 0000-0000-0000-0426
MSR 00000621: 0000-0000-0000-0004
MSR 00000638: 0000-0000-0000-0000
MSR 00000639: 0000-0000-0708-BBE5
MSR 0000063A: 0000-0000-0000-0010
MSR 0000063B: < FAILED >
MSR 00000640: 0000-0000-0000-0000
MSR 00000641: 0000-0000-0000-0019
MSR 00000642: 0000-0000-0000-0010
MSR 00000648: 0000-0000-0000-000A
MSR 00000649: 0000-0000-000A-00A0
MSR 0000064A: 0000-0000-000A-0118
MSR 0000064B: 0000-0000-0000-0000
MSR 0000064C: 0000-0000-0000-0009
MSR 00000660: 0000-000B-9FFE-0062
MSR 00000661: < FAILED >
MSR 00000662: < FAILED >
MSR 00000663: < FAILED >
MSR 00000664: 0000-00F6-38FE-7DC6
MSR 00000665: < FAILED >
MSR 00000666: < FAILED >
MSR 00000667: < FAILED >
MSR 00000668: < FAILED >
MSR 00000669: < FAILED >
MSR 0000066A: < FAILED >
MSR 0000066B: < FAILED >
MSR 0000066C: < FAILED >
MSR 0000066D: < FAILED >
MSR 0000066E: < FAILED >
MSR 0000066F: < FAILED >
MSR 00000670: < FAILED >
MSR 00000671: < FAILED >
MSR 00000672: < FAILED >
MSR 00000673: < FAILED >
MSR 00000674: < FAILED >
MSR 00000675: < FAILED >
MSR 00000676: < FAILED >
MSR 00000677: < FAILED >
MSR 00000690: < FAILED >
MSR 000006B0: 0000-0000-0000-0000
MSR 000006B1: 0000-0000-0500-0000
MSR 00000770: 0000-0000-0000-0001
MSR 00000771: 0000-0000-0108-0721
MSR 00000772: 0000-0000-8000-FF01
MSR 00000773: 0000-0000-0000-0005
MSR 00000774: 0000-019E-5400-2107
MSR 00000777: 0000-0000-0000-0004
MSR 00000832: 0000-0000-0003-00D1
MSR 00000838: 0000-0000-0000-0000
MSR 00000839: 0000-0000-0000-0000
MSR 0000083E: 0000-0000-0000-000A

------[ MSR Registers / Logical CPU #9 ]------

MSR 00000017: 001C-0000-0000-0000 [PlatID = 7]
MSR 0000001B: 0000-0000-FEE0-0C00
MSR 0000002A: 0000-0000-0000-0000
MSR 00000035: 0000-0000-000A-000C
MSR 00000048: 0000-0000-0000-0001
MSR 00000049: < FAILED >
MSR 0000008B: 0000-0413-0000-0000
MSR 000000CD: < FAILED >
MSR 000000CE: 0004-043D-F981-0A00 [eD = 0]
MSR 000000E7: 0000-0097-1964-EE38
MSR 000000E8: 0000-00AE-CF72-1FAE
MSR 000000EE: < FAILED >
MSR 0000010A: 0000-0000-0000-0D6B
MSR 0000010B: < FAILED >
MSR 0000011E: < FAILED >
MSR 00000194: 0000-0000-0011-0A00
MSR 00000198: 0000-15FF-0000-0800
MSR 00000199: 0000-0000-0000-0A00
MSR 0000019A: 0000-0000-0000-0000
MSR 0000019B: 0000-0000-0000-0010
MSR 0000019C: 0000-0000-8837-2800
MSR 0000019D: 0000-0000-0000-0000
MSR 000001A0: 0000-0000-0085-0089
MSR 000001A2: 0000-0000-8064-0000
MSR 000001A4: 0000-0000-0000-0000
MSR 000001AA: 0000-0000-0000-30C2
MSR 000001AC: < FAILED >
MSR 000001AD: 2626-2626-2626-262C
MSR 000001AE: 0807-0605-0403-0201
MSR 000001AF: < FAILED >
MSR 000001B0: 0000-0000-0000-0006
MSR 000001B1: 0000-0000-8837-0800
MSR 000001B2: 0000-0000-0200-0000
MSR 000001FC: 0000-0000-00EC-0059
MSR 00000300: < FAILED >
MSR 0000030A: 0000-0000-0000-0000
MSR 0000030B: 0000-0000-0000-0000
MSR 00000480: 03DA-0500-0000-0013
MSR 00000481: 0000-00FF-0000-0016
MSR 00000482: FFFB-FFFE-0401-E172
MSR 00000483: F77F-FFFF-0003-6DFF
MSR 00000484: 0076-FFFF-0000-11FF
MSR 00000485: 0000-0000-7004-C1E7
MSR 00000486: 0000-0000-8000-0021
MSR 00000487: 0000-0000-FFFF-FFFF
MSR 00000488: 0000-0000-0000-2000
MSR 00000489: 0000-0000-01F7-2FFF
MSR 0000048A: 0000-0000-0000-002E
MSR 0000048B: 075D-7FFF-0000-0000
MSR 0000048C: 0000-0F01-06F3-4141
MSR 0000048D: 0000-00FF-0000-0016
MSR 0000048E: FFFB-FFFE-0400-6172
MSR 0000048F: F77F-FFFF-0003-6DFB
MSR 00000490: 0076-FFFF-0000-11FB
MSR 00000601: 0000-0000-0000-0280
MSR 00000602: < FAILED >
MSR 00000603: 0036-0000-0036-3636
MSR 00000604: < FAILED >
MSR 00000606: 0000-0000-000A-0E03
MSR 0000060A: 0000-0000-0000-0000
MSR 0000060B: 0000-0000-0000-0000
MSR 0000060C: 0000-0000-0000-0000
MSR 0000060D: 0000-00C4-EA48-180E
MSR 00000610: 0042-8138-00DD-80A0
MSR 00000611: 0000-0000-11CC-DFC4
MSR 00000613: 0000-0000-0000-0000
MSR 00000614: 0000-0000-0000-00E0
MSR 00000618: 0000-0000-0000-0000
MSR 00000619: 0000-0000-0000-0000
MSR 0000061B: 0000-0000-0000-0000
MSR 0000061C: < FAILED >
MSR 0000061E: < FAILED >
MSR 00000620: 0000-0000-0000-0426
MSR 00000621: 0000-0000-0000-0004
MSR 00000638: 0000-0000-0000-0000
MSR 00000639: 0000-0000-0708-BC16
MSR 0000063A: 0000-0000-0000-0010
MSR 0000063B: < FAILED >
MSR 00000640: 0000-0000-0000-0000
MSR 00000641: 0000-0000-0000-0019
MSR 00000642: 0000-0000-0000-0010
MSR 00000648: 0000-0000-0000-000A
MSR 00000649: 0000-0000-000A-00A0
MSR 0000064A: 0000-0000-000A-0118
MSR 0000064B: 0000-0000-0000-0000
MSR 0000064C: 0000-0000-0000-0009
MSR 00000660: 0000-000A-8291-A5C8
MSR 00000661: < FAILED >
MSR 00000662: < FAILED >
MSR 00000663: < FAILED >
MSR 00000664: 0000-00F6-38FE-7DC6
MSR 00000665: < FAILED >
MSR 00000666: < FAILED >
MSR 00000667: < FAILED >
MSR 00000668: < FAILED >
MSR 00000669: < FAILED >
MSR 0000066A: < FAILED >
MSR 0000066B: < FAILED >
MSR 0000066C: < FAILED >
MSR 0000066D: < FAILED >
MSR 0000066E: < FAILED >
MSR 0000066F: < FAILED >
MSR 00000670: < FAILED >
MSR 00000671: < FAILED >
MSR 00000672: < FAILED >
MSR 00000673: < FAILED >
MSR 00000674: < FAILED >
MSR 00000675: < FAILED >
MSR 00000676: < FAILED >
MSR 00000677: < FAILED >
MSR 00000690: < FAILED >
MSR 000006B0: 0000-0000-0000-0000
MSR 000006B1: 0000-0000-0500-0000
MSR 00000770: 0000-0000-0000-0001
MSR 00000771: 0000-0000-0108-0721
MSR 00000772: 0000-0000-8000-FF01
MSR 00000773: 0000-0000-0000-0005
MSR 00000774: 0000-019E-5400-2107
MSR 00000777: 0000-0000-0000-0004
MSR 00000832: 0000-0000-0003-00D1
MSR 00000838: 0000-0000-0000-0000
MSR 00000839: 0000-0000-0000-0000
MSR 0000083E: 0000-0000-0000-000A

------[ MSR Registers / Logical CPU #10 ]------

MSR 00000017: 001C-0000-0000-0000 [PlatID = 7]
MSR 0000001B: 0000-0000-FEE0-0C00
MSR 0000002A: 0000-0000-0000-0000
MSR 00000035: 0000-0000-000A-000C
MSR 00000048: 0000-0000-0000-0001
MSR 00000049: < FAILED >
MSR 0000008B: 0000-0413-0000-0000
MSR 000000CD: < FAILED >
MSR 000000CE: 0004-043D-F981-0A00 [eD = 0]
MSR 000000E7: 0000-00AB-91B5-E400
MSR 000000E8: 0000-00BF-3289-2B67
MSR 000000EE: < FAILED >
MSR 0000010A: 0000-0000-0000-0D6B
MSR 0000010B: < FAILED >
MSR 0000011E: < FAILED >
MSR 00000194: 0000-0000-0011-0A00
MSR 00000198: 0000-1601-0000-0800
MSR 00000199: 0000-0000-0000-0A00
MSR 0000019A: 0000-0000-0000-0000
MSR 0000019B: 0000-0000-0000-0010
MSR 0000019C: 0000-0000-8837-2800
MSR 0000019D: 0000-0000-0000-0000
MSR 000001A0: 0000-0000-0085-0089
MSR 000001A2: 0000-0000-8064-0000
MSR 000001A4: 0000-0000-0000-0000
MSR 000001AA: 0000-0000-0000-30C2
MSR 000001AC: < FAILED >
MSR 000001AD: 2626-2626-2626-262C
MSR 000001AE: 0807-0605-0403-0201
MSR 000001AF: < FAILED >
MSR 000001B0: 0000-0000-0000-0006
MSR 000001B1: 0000-0000-8837-0800
MSR 000001B2: 0000-0000-0200-0000
MSR 000001FC: 0000-0000-00EC-0059
MSR 00000300: < FAILED >
MSR 0000030A: 0000-0000-0000-0000
MSR 0000030B: 0000-0000-0000-0000
MSR 00000480: 03DA-0500-0000-0013
MSR 00000481: 0000-00FF-0000-0016
MSR 00000482: FFFB-FFFE-0401-E172
MSR 00000483: F77F-FFFF-0003-6DFF
MSR 00000484: 0076-FFFF-0000-11FF
MSR 00000485: 0000-0000-7004-C1E7
MSR 00000486: 0000-0000-8000-0021
MSR 00000487: 0000-0000-FFFF-FFFF
MSR 00000488: 0000-0000-0000-2000
MSR 00000489: 0000-0000-01F7-2FFF
MSR 0000048A: 0000-0000-0000-002E
MSR 0000048B: 075D-7FFF-0000-0000
MSR 0000048C: 0000-0F01-06F3-4141
MSR 0000048D: 0000-00FF-0000-0016
MSR 0000048E: FFFB-FFFE-0400-6172
MSR 0000048F: F77F-FFFF-0003-6DFB
MSR 00000490: 0076-FFFF-0000-11FB
MSR 00000601: 0000-0000-0000-0280
MSR 00000602: < FAILED >
MSR 00000603: 0036-0000-0036-3636
MSR 00000604: < FAILED >
MSR 00000606: 0000-0000-000A-0E03
MSR 0000060A: 0000-0000-0000-0000
MSR 0000060B: 0000-0000-0000-0000
MSR 0000060C: 0000-0000-0000-0000
MSR 0000060D: 0000-00C4-EA48-180E
MSR 00000610: 0042-8138-00DD-80A0
MSR 00000611: 0000-0000-11CC-E125
MSR 00000613: 0000-0000-0000-0000
MSR 00000614: 0000-0000-0000-00E0
MSR 00000618: 0000-0000-0000-0000
MSR 00000619: 0000-0000-0000-0000
MSR 0000061B: 0000-0000-0000-0000
MSR 0000061C: < FAILED >
MSR 0000061E: < FAILED >
MSR 00000620: 0000-0000-0000-0426
MSR 00000621: 0000-0000-0000-0004
MSR 00000638: 0000-0000-0000-0000
MSR 00000639: 0000-0000-0708-BC50
MSR 0000063A: 0000-0000-0000-0010
MSR 0000063B: < FAILED >
MSR 00000640: 0000-0000-0000-0000
MSR 00000641: 0000-0000-0000-0019
MSR 00000642: 0000-0000-0000-0010
MSR 00000648: 0000-0000-0000-000A
MSR 00000649: 0000-0000-000A-00A0
MSR 0000064A: 0000-0000-000A-0118
MSR 0000064B: 0000-0000-0000-0000
MSR 0000064C: 0000-0000-0000-0009
MSR 00000660: 0000-0009-DA2D-10E4
MSR 00000661: < FAILED >
MSR 00000662: < FAILED >
MSR 00000663: < FAILED >
MSR 00000664: 0000-00F6-3909-301A
MSR 00000665: < FAILED >
MSR 00000666: < FAILED >
MSR 00000667: < FAILED >
MSR 00000668: < FAILED >
MSR 00000669: < FAILED >
MSR 0000066A: < FAILED >
MSR 0000066B: < FAILED >
MSR 0000066C: < FAILED >
MSR 0000066D: < FAILED >
MSR 0000066E: < FAILED >
MSR 0000066F: < FAILED >
MSR 00000670: < FAILED >
MSR 00000671: < FAILED >
MSR 00000672: < FAILED >
MSR 00000673: < FAILED >
MSR 00000674: < FAILED >
MSR 00000675: < FAILED >
MSR 00000676: < FAILED >
MSR 00000677: < FAILED >
MSR 00000690: < FAILED >
MSR 000006B0: 0000-0000-0000-0000
MSR 000006B1: 0000-0000-0500-0000
MSR 00000770: 0000-0000-0000-0001
MSR 00000771: 0000-0000-0108-0721
MSR 00000772: 0000-0000-8000-FF01
MSR 00000773: 0000-0000-0000-0005
MSR 00000774: 0000-019E-5400-2107
MSR 00000777: 0000-0000-0000-0004
MSR 00000832: 0000-0000-0003-00D1
MSR 00000838: 0000-0000-0000-0000
MSR 00000839: 0000-0000-0000-0000
MSR 0000083E: 0000-0000-0000-000A

------[ MSR Registers / Logical CPU #11 ]------

MSR 00000017: 001C-0000-0000-0000 [PlatID = 7]
MSR 0000001B: 0000-0000-FEE0-0C00
MSR 0000002A: 0000-0000-0000-0000
MSR 00000035: 0000-0000-000A-000C
MSR 00000048: 0000-0000-0000-0001
MSR 00000049: < FAILED >
MSR 0000008B: 0000-0413-0000-0000
MSR 000000CD: < FAILED >
MSR 000000CE: 0004-043D-F981-0A00 [eD = 0]
MSR 000000E7: 0000-00BE-9E90-E9F0
MSR 000000E8: 0000-00BE-8F04-A290
MSR 000000EE: < FAILED >
MSR 0000010A: 0000-0000-0000-0D6B
MSR 0000010B: < FAILED >
MSR 0000011E: < FAILED >
MSR 00000194: 0000-0000-0011-0A00
MSR 00000198: 0000-15FF-0000-0800
MSR 00000199: 0000-0000-0000-0A00
MSR 0000019A: 0000-0000-0000-0000
MSR 0000019B: 0000-0000-0000-0010
MSR 0000019C: 0000-0000-8838-2800
MSR 0000019D: 0000-0000-0000-0000
MSR 000001A0: 0000-0000-0085-0089
MSR 000001A2: 0000-0000-8064-0000
MSR 000001A4: 0000-0000-0000-0000
MSR 000001AA: 0000-0000-0000-30C2
MSR 000001AC: < FAILED >
MSR 000001AD: 2626-2626-2626-262C
MSR 000001AE: 0807-0605-0403-0201
MSR 000001AF: < FAILED >
MSR 000001B0: 0000-0000-0000-0006
MSR 000001B1: 0000-0000-8837-0800
MSR 000001B2: 0000-0000-0200-0000
MSR 000001FC: 0000-0000-00EC-0059
MSR 00000300: < FAILED >
MSR 0000030A: 0000-0000-00A0-C5AD
MSR 0000030B: 0000-0000-00E5-D598
MSR 00000480: 03DA-0500-0000-0013
MSR 00000481: 0000-00FF-0000-0016
MSR 00000482: FFFB-FFFE-0401-E172
MSR 00000483: F77F-FFFF-0003-6DFF
MSR 00000484: 0076-FFFF-0000-11FF
MSR 00000485: 0000-0000-7004-C1E7
MSR 00000486: 0000-0000-8000-0021
MSR 00000487: 0000-0000-FFFF-FFFF
MSR 00000488: 0000-0000-0000-2000
MSR 00000489: 0000-0000-01F7-2FFF
MSR 0000048A: 0000-0000-0000-002E
MSR 0000048B: 075D-7FFF-0000-0000
MSR 0000048C: 0000-0F01-06F3-4141
MSR 0000048D: 0000-00FF-0000-0016
MSR 0000048E: FFFB-FFFE-0400-6172
MSR 0000048F: F77F-FFFF-0003-6DFB
MSR 00000490: 0076-FFFF-0000-11FB
MSR 00000601: 0000-0000-0000-0280
MSR 00000602: < FAILED >
MSR 00000603: 0036-0000-0036-3636
MSR 00000604: < FAILED >
MSR 00000606: 0000-0000-000A-0E03
MSR 0000060A: 0000-0000-0000-0000
MSR 0000060B: 0000-0000-0000-0000
MSR 0000060C: 0000-0000-0000-0000
MSR 0000060D: 0000-00C4-EA48-180E
MSR 00000610: 0042-8138-00DD-80A0
MSR 00000611: 0000-0000-11CC-E2A3
MSR 00000613: 0000-0000-0000-0000
MSR 00000614: 0000-0000-0000-00E0
MSR 00000618: 0000-0000-0000-0000
MSR 00000619: 0000-0000-0000-0000
MSR 0000061B: 0000-0000-0000-0000
MSR 0000061C: < FAILED >
MSR 0000061E: < FAILED >
MSR 00000620: 0000-0000-0000-0426
MSR 00000621: 0000-0000-0000-0004
MSR 00000638: 0000-0000-0000-0000
MSR 00000639: 0000-0000-0708-BC6F
MSR 0000063A: 0000-0000-0000-0010
MSR 0000063B: < FAILED >
MSR 00000640: 0000-0000-0000-0000
MSR 00000641: 0000-0000-0000-0019
MSR 00000642: 0000-0000-0000-0010
MSR 00000648: 0000-0000-0000-000A
MSR 00000649: 0000-0000-000A-00A0
MSR 0000064A: 0000-0000-000A-0118
MSR 0000064B: 0000-0000-0000-0000
MSR 0000064C: 0000-0000-0000-0009
MSR 00000660: 0000-000A-9249-2CCA
MSR 00000661: < FAILED >
MSR 00000662: < FAILED >
MSR 00000663: < FAILED >
MSR 00000664: 0000-00F6-3909-301A
MSR 00000665: < FAILED >
MSR 00000666: < FAILED >
MSR 00000667: < FAILED >
MSR 00000668: < FAILED >
MSR 00000669: < FAILED >
MSR 0000066A: < FAILED >
MSR 0000066B: < FAILED >
MSR 0000066C: < FAILED >
MSR 0000066D: < FAILED >
MSR 0000066E: < FAILED >
MSR 0000066F: < FAILED >
MSR 00000670: < FAILED >
MSR 00000671: < FAILED >
MSR 00000672: < FAILED >
MSR 00000673: < FAILED >
MSR 00000674: < FAILED >
MSR 00000675: < FAILED >
MSR 00000676: < FAILED >
MSR 00000677: < FAILED >
MSR 00000690: < FAILED >
MSR 000006B0: 0000-0000-0000-0000
MSR 000006B1: 0000-0000-0500-0000
MSR 00000770: 0000-0000-0000-0001
MSR 00000771: 0000-0000-0109-0721
MSR 00000772: 0000-0000-8000-FF01
MSR 00000773: 0000-0000-0000-0005
MSR 00000774: 0000-019E-5400-2107
MSR 00000777: 0000-0000-0000-0004
MSR 00000832: 0000-0000-0003-00D1
MSR 00000838: 0000-0000-0000-0000
MSR 00000839: 0000-0000-0000-0000
MSR 0000083E: 0000-0000-0000-000A

PerformanceFrequency = 10000000

CPU Clock M.Method = 9  (APIC SKL)
PM Timer Address   = 6152  (1808h)

APIC Clock =  99.76 MHz  (AT = 0 / TT = 0 / try = 0 / SKL = 0.00 MHz)
APIC Clock =  99.76 MHz  (AT = 0 / TT = 0 / try = 0 / SKL = 0.00 MHz)
APIC Clock =  99.76 MHz  (AT = 0 / TT = 0 / try = 0 / SKL = 0.00 MHz)
APIC Clock =  99.76 MHz  (AT = 0 / TT = 0 / try = 0 / SKL = 0.00 MHz)
APIC Clock =  99.76 MHz  (AT = 0 / TT = 0 / try = 0 / SKL = 0.00 MHz)

CPU Clock =  798.05 MHz / TSC Clock =  997.56 MHz / CPU Mul =  8.00x
CPU Clock =  798.05 MHz / TSC Clock =  997.56 MHz / CPU Mul =  8.00x
CPU Clock =  698.29 MHz / TSC Clock =  997.56 MHz / CPU Mul =  7.00x
CPU Clock =  598.54 MHz / TSC Clock =  997.56 MHz / CPU Mul =  6.00x
CPU Clock =  598.54 MHz / TSC Clock =  997.56 MHz / CPU Mul =  6.00x

CPU Clock Max = 2194.63 MHz / TSC Clock =  997.56 MHz / CPU Mul = 22.00x
CPU Clock Max = 1197.07 MHz / TSC Clock =  997.56 MHz / CPU Mul = 12.00x
CPU Clock Max =  698.46 MHz / TSC Clock =  997.80 MHz / CPU Mul =  7.00x
CPU Clock Max = 4389.26 MHz / TSC Clock =  997.56 MHz / CPU Mul = 44.00x
CPU Clock Max = 3790.73 MHz / TSC Clock =  997.56 MHz / CPU Mul = 38.00x

INTPERFCTR2 = 4375.72 MHz / INTPERFCTR1 (TSC) =  998.40 MHz
INTPERFCTR2 = 4360.28 MHz / INTPERFCTR1 (TSC) =  998.41 MHz
INTPERFCTR2 = 3083.30 MHz / INTPERFCTR1 (TSC) =  998.39 MHz
INTPERFCTR2 = 3101.01 MHz / INTPERFCTR1 (TSC) =  998.37 MHz
INTPERFCTR2 = 3029.45 MHz / INTPERFCTR1 (TSC) =  998.38 MHz

------[ OC MailBox ]------

C 01 / P1 00 / P2 00: 0000062C
C 01 / P1 01 / P2 00: 00000616
C 01 / P1 02 / P2 00: 00000626
C 01 / P1 03 / P2 00: 00000616
C 01 / P1 04 / P2 00: 00000600
C 02 / P1 00 / P2 00: 2626262C
C 02 / P1 00 / P2 01: 21212121
C 02 / P1 00 / P2 02: 00000000
C 02 / P1 00 / P2 03: 00000000
C 02 / P1 01 / P2 00: 26262626
C 02 / P1 01 / P2 01: 21212121
C 02 / P1 01 / P2 02: 00000000
C 02 / P1 01 / P2 03: 00000000
C 02 / P1 02 / P2 00: 00000000
C 02 / P1 02 / P2 01: 00000000
C 02 / P1 02 / P2 02: 00000000
C 02 / P1 02 / P2 03: 00000000
C 02 / P1 03 / P2 00: 00000000
C 02 / P1 03 / P2 01: 00000000
C 02 / P1 03 / P2 02: 00000000
C 02 / P1 03 / P2 03: 00000000
C 02 / P1 04 / P2 00: 00000000
C 02 / P1 04 / P2 01: 00000000
C 02 / P1 04 / P2 02: 00000000
C 02 / P1 04 / P2 03: 00000000
C 02 / P1 05 / P2 00: 00000000
C 02 / P1 05 / P2 01: 00000000
C 02 / P1 05 / P2 02: 00000000
C 02 / P1 05 / P2 03: 00000000
C 02 / P1 06 / P2 00: 00000000
C 02 / P1 06 / P2 01: 00000000
C 02 / P1 06 / P2 02: 00000000
C 02 / P1 06 / P2 03: 00000000
C 02 / P1 07 / P2 00: 00000000
C 02 / P1 07 / P2 01: 00000000
C 02 / P1 07 / P2 02: 00000000
C 02 / P1 07 / P2 03: 00000000
C 03 / P1 00 / P2 00: 0001080C
C 04 / P1 00 / P2 00: 3C042008
C 05 / P1 00 / P2 00: 00000000
C 10 / P1 00 / P2 00: 00000000
C 10 / P1 01 / P2 00: 00000000
C 10 / P1 02 / P2 00: 00000000
C 10 / P1 03 / P2 00: 00000000
C 10 / P1 04 / P2 00: 00000000
C 12 / P1 00 / P2 00: 00000000
C 12 / P1 01 / P2 00: 00000000
C 12 / P1 02 / P2 00: 00000000
C 14 / P1 00 / P2 00: 00000000
C 16 / P1 00 / P2 00: 00000140
C 18 / P1 00 / P2 00: 00000004
C 1A / P1 00 / P2 00: 00000000
C 1C / P1 00 / P2 00: 00002C2C  [CPU0]
C 1C / P1 00 / P2 00: 00002C2C  [CPU1]
C 1C / P1 00 / P2 00: 00002C2C  [CPU2]
C 1C / P1 00 / P2 00: 00002C2C  [CPU3]
C 1C / P1 00 / P2 00: 00002121  [CPU4]
C 1C / P1 00 / P2 00: 00002121  [CPU5]
C 1C / P1 00 / P2 00: 00002121  [CPU6]
C 1C / P1 00 / P2 00: 00002121  [CPU7]
C 1C / P1 00 / P2 00: 00002121  [CPU8]
C 1C / P1 00 / P2 00: 00002121  [CPU9]
C 1C / P1 00 / P2 00: 00002121  [CPU10]
C 1C / P1 00 / P2 00: 00002121  [CPU11]

------[ APIC Base at 00000000-FEE00000 ]------

  0000  FF FF FF FF FF FF FF FF FF FF FF FF FF FF FF FF 
  0010  FF FF FF FF FF FF FF FF FF FF FF FF FF FF FF FF 
  0020  FF FF FF FF FF FF FF FF FF FF FF FF FF FF FF FF 
  0030  FF FF FF FF FF FF FF FF FF FF FF FF FF FF FF FF 
  0040  FF FF FF FF FF FF FF FF FF FF FF FF FF FF FF FF 
  0050  FF FF FF FF FF FF FF FF FF FF FF FF FF FF FF FF 
  0060  FF FF FF FF FF FF FF FF FF FF FF FF FF FF FF FF 
  0070  FF FF FF FF FF FF FF FF FF FF FF FF FF FF FF FF 
  0080  FF FF FF FF FF FF FF FF FF FF FF FF FF FF FF FF 
  0090  FF FF FF FF FF FF FF FF FF FF FF FF FF FF FF FF 
  00A0  FF FF FF FF FF FF FF FF FF FF FF FF FF FF FF FF 
  00B0  FF FF FF FF FF FF FF FF FF FF FF FF FF FF FF FF 
  00C0  FF FF FF FF FF FF FF FF FF FF FF FF FF FF FF FF 
  00D0  FF FF FF FF FF FF FF FF FF FF FF FF FF FF FF FF 
  00E0  FF FF FF FF FF FF FF FF FF FF FF FF FF FF FF FF 
  00F0  FF FF FF FF FF FF FF FF FF FF FF FF FF FF FF FF 
  0100  FF FF FF FF FF FF FF FF FF FF FF FF FF FF FF FF 
  0110  FF FF FF FF FF FF FF FF FF FF FF FF FF FF FF FF 
  0120  FF FF FF FF FF FF FF FF FF FF FF FF FF FF FF FF 
  0130  FF FF FF FF FF FF FF FF FF FF FF FF FF FF FF FF 
  0140  FF FF FF FF FF FF FF FF FF FF FF FF FF FF FF FF 
  0150  FF FF FF FF FF FF FF FF FF FF FF FF FF FF FF FF 
  0160  FF FF FF FF FF FF FF FF FF FF FF FF FF FF FF FF 
  0170  FF FF FF FF FF FF FF FF FF FF FF FF FF FF FF FF 
  0180  FF FF FF FF FF FF FF FF FF FF FF FF FF FF FF FF 
  0190  FF FF FF FF FF FF FF FF FF FF FF FF FF FF FF FF 
  01A0  FF FF FF FF FF FF FF FF FF FF FF FF FF FF FF FF 
  01B0  FF FF FF FF FF FF FF FF FF FF FF FF FF FF FF FF 
  01C0  FF FF FF FF FF FF FF FF FF FF FF FF FF FF FF FF 
  01D0  FF FF FF FF FF FF FF FF FF FF FF FF FF FF FF FF 
  01E0  FF FF FF FF FF FF FF FF FF FF FF FF FF FF FF FF 
  01F0  FF FF FF FF FF FF FF FF FF FF FF FF FF FF FF FF 
  0200  FF FF FF FF FF FF FF FF FF FF FF FF FF FF FF FF 
  0210  FF FF FF FF FF FF FF FF FF FF FF FF FF FF FF FF 
  0220  FF FF FF FF FF FF FF FF FF FF FF FF FF FF FF FF 
  0230  FF FF FF FF FF FF FF FF FF FF FF FF FF FF FF FF 
  0240  FF FF FF FF FF FF FF FF FF FF FF FF FF FF FF FF 
  0250  FF FF FF FF FF FF FF FF FF FF FF FF FF FF FF FF 
  0260  FF FF FF FF FF FF FF FF FF FF FF FF FF FF FF FF 
  0270  FF FF FF FF FF FF FF FF FF FF FF FF FF FF FF FF 
  0280  FF FF FF FF FF FF FF FF FF FF FF FF FF FF FF FF 
  0290  FF FF FF FF FF FF FF FF FF FF FF FF FF FF FF FF 
  02A0  FF FF FF FF FF FF FF FF FF FF FF FF FF FF FF FF 
  02B0  FF FF FF FF FF FF FF FF FF FF FF FF FF FF FF FF 
  02C0  FF FF FF FF FF FF FF FF FF FF FF FF FF FF FF FF 
  02D0  FF FF FF FF FF FF FF FF FF FF FF FF FF FF FF FF 
  02E0  FF FF FF FF FF FF FF FF FF FF FF FF FF FF FF FF 
  02F0  FF FF FF FF FF FF FF FF FF FF FF FF FF FF FF FF 
  0300  FF FF FF FF FF FF FF FF FF FF FF FF FF FF FF FF 
  0310  FF FF FF FF FF FF FF FF FF FF FF FF FF FF FF FF 
  0320  FF FF FF FF FF FF FF FF FF FF FF FF FF FF FF FF 
  0330  FF FF FF FF FF FF FF FF FF FF FF FF FF FF FF FF 
  0340  FF FF FF FF FF FF FF FF FF FF FF FF FF FF FF FF 
  0350  FF FF FF FF FF FF FF FF FF FF FF FF FF FF FF FF 
  0360  FF FF FF FF FF FF FF FF FF FF FF FF FF FF FF FF 
  0370  FF FF FF FF FF FF FF FF FF FF FF FF FF FF FF FF 
  0380  FF FF FF FF FF FF FF FF FF FF FF FF FF FF FF FF 
  0390  FF FF FF FF FF FF FF FF FF FF FF FF FF FF FF FF 
  03A0  FF FF FF FF FF FF FF FF FF FF FF FF FF FF FF FF 
  03B0  FF FF FF FF FF FF FF FF FF FF FF FF FF FF FF FF 
  03C0  FF FF FF FF FF FF FF FF FF FF FF FF FF FF FF FF 
  03D0  FF FF FF FF FF FF FF FF FF FF FF FF FF FF FF FF 
  03E0  FF FF FF FF FF FF FF FF FF FF FF FF FF FF FF FF 
  03F0  FF FF FF FF FF FF FF FF FF FF FF FF FF FF FF FF 
