------[ CPUID Registers / Logical CPU #0 ]------

allcpu: Package 0 / Core 0 / Thread 0: Valid

CPUID 00000000: 00000015-756E6547-6C65746E-49656E69 [GenuineIntel]
CPUID 00000001: 000506CA-00200800-4FF8EBB7-BFEBFBFF
CPUID 00000002: 6164A001-0000FFC4-00000000-00000000
CPUID 00000003: 00000000-00000000-00000000-00000000
CPUID 00000004: 3C000121-0140003F-0000003F-00000001 [SL 00] [L1D: 24 KB]
CPUID 00000004: 3C000122-01C0003F-0000003F-00000001 [SL 01] [L1I: 32 KB]
CPUID 00000004: 3C00C143-03C0003F-000003FF-00000001 [SL 02] [L2U: 1 MB]
CPUID 00000005: 00000000-00000000-00000000-11242020
CPUID 00000006: 00000057-00000002-00000001-00000000
CPUID 00000007: 00000000-2294E283-00000000-AC000400 [SL 00]
CPUID 00000008: 00000000-00000000-00000000-00000000
CPUID 00000009: 00000000-00000000-00000000-00000000
CPUID 0000000A: 07300404-00000000-00000000-00000603
CPUID 0000000B: 00000001-00000001-00000100-00000000 [SL 00]
CPUID 0000000B: 00000005-00000002-00000201-00000000 [SL 01]
CPUID 0000000C: 00000000-00000000-00000000-00000000
CPUID 0000000D: 0000001B-00000440-00000440-00000000 [SL 00] [x87]
CPUID 0000000D: 0000000F-00000340-00000100-00000000 [SL 01] [SSE]
CPUID 0000000D: 00000040-000003C0-00000000-00000000 [SL 03] [MPX BNDREGS]
CPUID 0000000D: 00000040-00000400-00000000-00000000 [SL 04] [MPX BNDCSR]
CPUID 0000000D: 00000080-00000000-00000001-00000000 [SL 08] [PT]
CPUID 0000000E: 00000000-00000000-00000000-00000000
CPUID 0000000F: 00000000-00000000-00000000-00000000 [SL 00]
CPUID 0000000F: 00000000-00000000-00000000-00000000 [SL 01]
CPUID 00000010: 00000000-00000004-00000000-00000000 [SL 00]
CPUID 00000010: 00000000-00000000-00000000-00000000 [SL 01]
CPUID 00000011: 00000000-00000000-00000000-00000000
CPUID 00000012: 00000000-00000000-00000000-00000000 [SL 00]
CPUID 00000012: 00000000-00000000-00000000-00000000 [SL 01]
CPUID 00000013: 00000000-00000000-00000000-00000000
CPUID 00000014: 00000001-0000000F-80000007-00000000 [SL 00]
CPUID 00000014: 02490002-003FFFFF-00000000-00000000 [SL 01]
CPUID 00000015: 00000003-000000C9-0124F800-00000000 [67.00x / 19200000 / 1286.40]
CPUID 80000000: 80000008-00000000-00000000-00000000
CPUID 80000001: 00000000-00000000-00000101-2C100000
CPUID 80000002: 65746E49-2952286C-6F744120-4D54286D [Intel(R) Atom(TM]
CPUID 80000003: 72502029-7365636F-20726F73-33393345 [) Processor E393]
CPUID 80000004: 20402030-30332E31-007A4847-00000000 [0 @ 1.30GHz]
CPUID 80000005: 00000000-00000000-00000000-00000000 [L1D: 0 KB / L1I: 0 KB]
CPUID 80000006: 00000000-00000000-04008040-00000000 [L2: 1024 KB] / L3: 0 KB]
CPUID 80000007: 00000000-00000000-00000000-00000100
CPUID 80000008: 00003027-00000000-00000000-00000000

L1    Data Cache:    24 KB,  6-way Associative, 64-byte Line
L1  Instr. Cache:    32 KB,  8-way Associative, 64-byte Line
L2 Unified Cache:     1 MB, 16-way Associative, 64-byte Line

------[ CPUID Registers / Logical CPU #1 ]------

allcpu: Package 0 / Core 1 / Thread 0: Valid

CPUID 00000000: 00000015-756E6547-6C65746E-49656E69 [GenuineIntel]
CPUID 00000001: 000506CA-04200800-4FF8EBB7-BFEBFBFF
CPUID 00000002: 6164A001-0000FFC4-00000000-00000000
CPUID 00000003: 00000000-00000000-00000000-00000000
CPUID 00000004: 3C000121-0140003F-0000003F-00000001 [SL 00] [L1D: 24 KB]
CPUID 00000004: 3C000122-01C0003F-0000003F-00000001 [SL 01] [L1I: 32 KB]
CPUID 00000004: 3C00C143-03C0003F-000003FF-00000001 [SL 02] [L2U: 1 MB]
CPUID 00000005: 00000000-00000000-00000000-11242020
CPUID 00000006: 00000057-00000002-00000001-00000000
CPUID 00000007: 00000000-2294E283-00000000-AC000400 [SL 00]
CPUID 00000008: 00000000-00000000-00000000-00000000
CPUID 00000009: 00000000-00000000-00000000-00000000
CPUID 0000000A: 07300404-00000000-00000000-00000603
CPUID 0000000B: 00000001-00000001-00000100-00000004 [SL 00]
CPUID 0000000B: 00000005-00000002-00000201-00000004 [SL 01]
CPUID 0000000C: 00000000-00000000-00000000-00000000
CPUID 0000000D: 0000001B-00000440-00000440-00000000 [SL 00] [x87]
CPUID 0000000D: 0000000F-00000340-00000100-00000000 [SL 01] [SSE]
CPUID 0000000D: 00000040-000003C0-00000000-00000000 [SL 03] [MPX BNDREGS]
CPUID 0000000D: 00000040-00000400-00000000-00000000 [SL 04] [MPX BNDCSR]
CPUID 0000000D: 00000080-00000000-00000001-00000000 [SL 08] [PT]
CPUID 0000000E: 00000000-00000000-00000000-00000000
CPUID 0000000F: 00000000-00000000-00000000-00000000 [SL 00]
CPUID 0000000F: 00000000-00000000-00000000-00000000 [SL 01]
CPUID 00000010: 00000000-00000004-00000000-00000000 [SL 00]
CPUID 00000010: 00000000-00000000-00000000-00000000 [SL 01]
CPUID 00000011: 00000000-00000000-00000000-00000000
CPUID 00000012: 00000000-00000000-00000000-00000000 [SL 00]
CPUID 00000012: 00000000-00000000-00000000-00000000 [SL 01]
CPUID 00000013: 00000000-00000000-00000000-00000000
CPUID 00000014: 00000001-0000000F-80000007-00000000 [SL 00]
CPUID 00000014: 02490002-003FFFFF-00000000-00000000 [SL 01]
CPUID 00000015: 00000003-000000C9-0124F800-00000000 [67.00x / 19200000 / 1286.40]
CPUID 80000000: 80000008-00000000-00000000-00000000
CPUID 80000001: 00000000-00000000-00000101-2C100000
CPUID 80000002: 65746E49-2952286C-6F744120-4D54286D [Intel(R) Atom(TM]
CPUID 80000003: 72502029-7365636F-20726F73-33393345 [) Processor E393]
CPUID 80000004: 20402030-30332E31-007A4847-00000000 [0 @ 1.30GHz]
CPUID 80000005: 00000000-00000000-00000000-00000000 [L1D: 0 KB / L1I: 0 KB]
CPUID 80000006: 00000000-00000000-04008040-00000000 [L2: 1024 KB] / L3: 0 KB]
CPUID 80000007: 00000000-00000000-00000000-00000100
CPUID 80000008: 00003027-00000000-00000000-00000000

L1    Data Cache:    24 KB,  6-way Associative, 64-byte Line
L1  Instr. Cache:    32 KB,  8-way Associative, 64-byte Line
L2 Unified Cache:     1 MB, 16-way Associative, 64-byte Line

------[ All CPUs ]------

CPU   0: APICID    0 / Package 0 / Core   0 / Thread 0: Valid
CPU   1: APICID    4 / Package 0 / Core   1 / Thread 0: Valid

------[ MSR Registers / Logical CPU #0 ]------

MSR 00000017: 0004-0000-0000-0000 [PlatID = 1]
MSR 0000001B: 0000-0000-FEE0-0900
MSR 0000002A: 0000-0000-0000-0000
MSR 00000035: 0000-0000-0002-0002
MSR 00000048: 0000-0000-0000-0000
MSR 00000049: < FAILED >
MSR 0000008B: 0000-001A-0000-0000
MSR 000000CD: < FAILED >
MSR 000000CE: 0004-0821-F001-0D00 [eD = 0]
MSR 000000E7: 0000-00D9-A324-DB2B [S200]
MSR 000000E7: 0000-00D9-A499-4834 [S200]
MSR 000000E7: 0000-00D9-A510-587B
MSR 000000E8: 0000-0111-8ED4-7E5C [S200]
MSR 000000E8: 0000-0111-8EF8-DC5C [S200]
MSR 000000E8: 0000-0111-8FCF-E568
MSR 000000EE: < FAILED >
MSR 0000010A: 0000-0000-0000-0069
MSR 0000011E: < FAILED >
MSR 00000194: < FAILED >
MSR 00000198: 0000-2051-0000-0800 [S200]
MSR 00000198: 0000-2051-0000-0800 [S200]
MSR 00000198: 0000-2051-0000-0800
MSR 00000199: 0000-0000-0000-0800
MSR 0000019A: 0000-0000-0000-0000
MSR 0000019B: 0000-0000-0000-0010
MSR 0000019C: 0000-0000-8843-0800 [S200]
MSR 0000019C: 0000-0000-8843-0800 [S200]
MSR 0000019C: 0000-0000-8844-0800
MSR 0000019D: 0000-0000-0000-0000
MSR 000001A0: 0000-0000-0081-0089
MSR 000001A2: 0000-0000-006E-0000
MSR 000001A4: 0000-0000-0000-0000
MSR 000001AA: 0000-0000-0040-0000
MSR 000001AC: < FAILED >
MSR 000001AD: 0000-0000-0000-1212
MSR 000001B0: < FAILED >
MSR 000001B1: 0000-0000-8840-0800
MSR 000001B2: 0000-0000-0000-0000
MSR 000001FC: 0000-0000-0020-005F
MSR 00000300: < FAILED >
MSR 0000030A: 0000-0000-0000-0000 [S200]
MSR 0000030A: 0000-0000-0000-0000 [S200]
MSR 0000030A: 0000-0000-0000-0000
MSR 0000030B: 0000-0000-0000-0000 [S200]
MSR 0000030B: 0000-0000-0000-0000 [S200]
MSR 0000030B: 0000-0000-0000-0000
MSR 00000480: 00DA-0400-0000-0011
MSR 00000481: 0000-00FF-0000-0016
MSR 00000482: FFF9-FFFE-0401-E172
MSR 00000483: 01FF-FFFF-0003-6DFF
MSR 00000484: 0003-FFFF-0000-11FF
MSR 00000485: 0000-0000-6004-C1E7
MSR 00000486: 0000-0000-8000-0021
MSR 00000487: 0000-0000-FFFF-FFFF
MSR 00000488: 0000-0000-0000-2000
MSR 00000489: 0000-0000-0035-27FF
MSR 0000048A: 0000-0000-0000-002E
MSR 0000048B: 001D-6FFF-0000-0000
MSR 0000048C: 0000-0F01-0633-4141
MSR 0000048D: 0000-00FF-0000-0016
MSR 0000048E: FFF9-FFFE-0400-6172
MSR 0000048F: 01FF-FFFF-0003-6DFB
MSR 00000490: 0003-FFFF-0000-11FB
MSR 00000601: 0000-0000-0000-00A8
MSR 00000602: < FAILED >
MSR 00000603: 0000-0000-0008-FF0B
MSR 00000604: < FAILED >
MSR 00000606: 0000-0000-330A-0E08
MSR 0000060A: 0000-0000-0000-0000
MSR 0000060B: 0000-0000-0000-8893
MSR 0000060C: 0000-0000-0000-8893
MSR 0000060D: 0000-0002-3D06-E27C
MSR 00000610: 0000-8F00-00DD-8680
MSR 00000611: 0000-0000-066A-2912 [S200]
MSR 00000611: 0000-0000-066A-3F88 [S200]
MSR 00000611: 0000-0000-066A-5690
MSR 00000613: 0000-0000-0000-0000
MSR 00000614: 0000-0000-0000-0680
MSR 00000618: 0000-0000-0000-0000
MSR 00000619: 0000-0000-004B-0943 [S200]
MSR 00000619: 0000-0000-004B-09CB [S200]
MSR 00000619: 0000-0000-004B-0A6B
MSR 0000061B: 0000-0000-0000-58F0
MSR 0000061C: < FAILED >
MSR 00000638: < FAILED >
MSR 00000639: 0000-0000-0150-0A15 [S200]
MSR 00000639: 0000-0000-0150-0A42 [S200]
MSR 00000639: 0000-0000-0150-0A5A
MSR 0000063A: < FAILED >
MSR 0000063B: < FAILED >
MSR 00000640: < FAILED >
MSR 00000641: 0000-0000-004E-E855 [S200]
MSR 00000641: 0000-0000-004E-E855 [S200]
MSR 00000641: 0000-0000-004E-E855
MSR 00000642: < FAILED >
MSR 00000660: 0000-0018-C215-7DC2
MSR 00000661: < FAILED >
MSR 00000662: < FAILED >
MSR 00000663: < FAILED >
MSR 00000664: < FAILED >
MSR 00000665: < FAILED >
MSR 00000666: < FAILED >
MSR 00000667: < FAILED >
MSR 00000668: < FAILED >
MSR 00000669: < FAILED >
MSR 0000066A: < FAILED >
MSR 0000066B: < FAILED >
MSR 0000066C: < FAILED >
MSR 0000066D: < FAILED >
MSR 0000066E: < FAILED >
MSR 0000066F: < FAILED >
MSR 00000670: < FAILED >
MSR 00000671: < FAILED >
MSR 00000672: < FAILED >
MSR 00000673: < FAILED >
MSR 00000674: < FAILED >
MSR 00000675: < FAILED >
MSR 00000676: < FAILED >
MSR 00000677: < FAILED >

------[ MSR Registers / Logical CPU #1 ]------

MSR 00000017: 0004-0000-0000-0000 [PlatID = 1]
MSR 0000001B: 0000-0000-FEE0-0800
MSR 0000002A: 0000-0000-0000-0000
MSR 00000035: 0000-0000-0002-0002
MSR 00000048: 0000-0000-0000-0000
MSR 00000049: < FAILED >
MSR 0000008B: 0000-001A-0000-0000
MSR 000000CD: < FAILED >
MSR 000000CE: 0004-0821-F001-0D00 [eD = 0]
MSR 000000E7: 0000-00C7-4E01-5DCB
MSR 000000E8: 0000-0102-9D69-9CF9
MSR 000000EE: < FAILED >
MSR 0000010A: 0000-0000-0000-0069
MSR 0000011E: < FAILED >
MSR 00000194: < FAILED >
MSR 00000198: 0000-235C-0000-1200
MSR 00000199: 0000-0000-0000-1200
MSR 0000019A: 0000-0000-0000-0000
MSR 0000019B: 0000-0000-0000-0010
MSR 0000019C: 0000-0000-8844-0800
MSR 0000019D: 0000-0000-0000-0000
MSR 000001A0: 0000-0000-0081-0089
MSR 000001A2: 0000-0000-006E-0000
MSR 000001A4: 0000-0000-0000-0000
MSR 000001AA: 0000-0000-0040-0000
MSR 000001AC: < FAILED >
MSR 000001AD: 0000-0000-0000-1212
MSR 000001B0: < FAILED >
MSR 000001B1: 0000-0000-8841-0800
MSR 000001B2: 0000-0000-0000-0000
MSR 000001FC: 0000-0000-0020-005F
MSR 00000300: < FAILED >
MSR 0000030A: 0000-0000-0000-0000
MSR 0000030B: 0000-0000-0000-0000
MSR 00000480: 00DA-0400-0000-0011
MSR 00000481: 0000-00FF-0000-0016
MSR 00000482: FFF9-FFFE-0401-E172
MSR 00000483: 01FF-FFFF-0003-6DFF
MSR 00000484: 0003-FFFF-0000-11FF
MSR 00000485: 0000-0000-6004-C1E7
MSR 00000486: 0000-0000-8000-0021
MSR 00000487: 0000-0000-FFFF-FFFF
MSR 00000488: 0000-0000-0000-2000
MSR 00000489: 0000-0000-0035-27FF
MSR 0000048A: 0000-0000-0000-002E
MSR 0000048B: 001D-6FFF-0000-0000
MSR 0000048C: 0000-0F01-0633-4141
MSR 0000048D: 0000-00FF-0000-0016
MSR 0000048E: FFF9-FFFE-0400-6172
MSR 0000048F: 01FF-FFFF-0003-6DFB
MSR 00000490: 0003-FFFF-0000-11FB
MSR 00000601: 0000-0000-0000-00A8
MSR 00000602: < FAILED >
MSR 00000603: 0000-0000-0008-FF0B
MSR 00000604: < FAILED >
MSR 00000606: 0000-0000-330A-0E08
MSR 0000060A: 0000-0000-0000-0000
MSR 0000060B: 0000-0000-0000-8893
MSR 0000060C: 0000-0000-0000-8893
MSR 0000060D: 0000-0002-3D06-E27C
MSR 00000610: 0000-8F00-00DD-8680
MSR 00000611: 0000-0000-066A-EB64
MSR 00000613: 0000-0000-0000-0000
MSR 00000614: 0000-0000-0000-0680
MSR 00000618: 0000-0000-0000-0000
MSR 00000619: 0000-0000-004B-0CB9
MSR 0000061B: 0000-0000-0000-58F0
MSR 0000061C: < FAILED >
MSR 00000638: < FAILED >
MSR 00000639: 0000-0000-0150-0CF7
MSR 0000063A: < FAILED >
MSR 0000063B: < FAILED >
MSR 00000640: < FAILED >
MSR 00000641: 0000-0000-004E-E87B
MSR 00000642: < FAILED >
MSR 00000660: 0000-001C-96DF-066F
MSR 00000661: < FAILED >
MSR 00000662: < FAILED >
MSR 00000663: < FAILED >
MSR 00000664: < FAILED >
MSR 00000665: < FAILED >
MSR 00000666: < FAILED >
MSR 00000667: < FAILED >
MSR 00000668: < FAILED >
MSR 00000669: < FAILED >
MSR 0000066A: < FAILED >
MSR 0000066B: < FAILED >
MSR 0000066C: < FAILED >
MSR 0000066D: < FAILED >
MSR 0000066E: < FAILED >
MSR 0000066F: < FAILED >
MSR 00000670: < FAILED >
MSR 00000671: < FAILED >
MSR 00000672: < FAILED >
MSR 00000673: < FAILED >
MSR 00000674: < FAILED >
MSR 00000675: < FAILED >
MSR 00000676: < FAILED >
MSR 00000677: < FAILED >
