------[ Versions ]------

Program Version : AIDA64 v2.60.2162 Beta
BenchDLL Version: 3.0.478-x64

------[ CPU Info ]------

CPU Type           : QuadCore Intel Core i7-3770K, 3700 MHz (37 x 100)
CPU Alias          : Ivy Bridge-DT
CPU Platform       : LGA1155
CPU Stepping       : E1/L1/N0/P0
Instruction Set    : x86, x86-64, MMX, SSE, SSE2, SSE3, SSSE3, SSE4.1, SSE4.2, AES, AVX
CPUID Manufacturer : GenuineIntel
CPUID CPU Name     : Intel(R) Core(TM) i7-3770K CPU @ 3.50GHz
CPUID Revision     : 000306A9h
IA Brand ID        : 00h  (Unknown)
Platform ID        : 31h  (LGA1155)
HTT / CMP Units    : 2 / 4
Tjmax Temperature  : 105 Celsius

------[ Logical CPU #0 ]------

allcpu: Package 0 / Core 0 / Thread 0: Valid

CPUID 00000000: 0000000D-756E6547-6C65746E-49656E69 [GenuineIntel]
CPUID 00000001: 000306A9-00100800-7F9AE3BF-BFEBFBFF
CPUID 00000002: 76035A01-00F0B2FF-00000000-00CA0000
CPUID 00000003: 00000000-00000000-00000000-00000000
CPUID 00000004: 1C004121-01C0003F-0000003F-00000000
CPUID 00000004: 1C004122-01C0003F-0000003F-00000000
CPUID 00000004: 1C004143-01C0003F-000001FF-00000000
CPUID 00000004: 1C03C163-03C0003F-00001FFF-00000006
CPUID 00000005: 00000040-00000040-00000003-00001120
CPUID 00000006: 00000077-00000002-00000009-00000000
CPUID 00000007: 00000000-00000281-00000000-00000000
CPUID 00000008: 00000000-00000000-00000000-00000000
CPUID 00000009: 00000000-00000000-00000000-00000000
CPUID 0000000A: 07300403-00000000-00000000-00000603
CPUID 0000000B: 00000001-00000002-00000100-00000000
CPUID 0000000B: 00000004-00000008-00000201-00000000
CPUID 0000000C: 00000000-00000000-00000000-00000000
CPUID 0000000D: 00000007-00000340-00000340-00000000
CPUID 0000000D: 00000100-00000240-00000000-00000000
CPUID 80000000: 80000008-00000000-00000000-00000000
CPUID 80000001: 00000000-00000000-00000001-28100000
CPUID 80000002: 20202020-49202020-6C65746E-20295228 [       Intel(R) ]
CPUID 80000003: 65726F43-294D5428-2D376920-30373733 [Core(TM) i7-3770]
CPUID 80000004: 5043204B-20402055-30352E33-007A4847 [K CPU @ 3.50GHz]
CPUID 80000005: 00000000-00000000-00000000-00000000
CPUID 80000006: 00000000-00000000-01006040-00000000
CPUID 80000007: 00000000-00000000-00000000-00000100
CPUID 80000008: 00003024-00000000-00000000-00000000

L1    Data Cache:     32 KB,  8-way Associative, 64-byte Line
L1  Instr. Cache:     32 KB,  8-way Associative, 64-byte Line
L2 Unified Cache:    256 KB,  8-way Associative, 64-byte Line
L3 Unified Cache:   8192 KB, 16-way Associative, 64-byte Line

------[ Logical CPU #1 ]------

allcpu: Package 0 / Core 0 / Thread 1: Valid, Virtual

CPUID 00000000: 0000000D-756E6547-6C65746E-49656E69 [GenuineIntel]
CPUID 00000001: 000306A9-01100800-7F9AE3BF-BFEBFBFF
CPUID 00000002: 76035A01-00F0B2FF-00000000-00CA0000
CPUID 00000003: 00000000-00000000-00000000-00000000
CPUID 00000004: 1C004121-01C0003F-0000003F-00000000
CPUID 00000004: 1C004122-01C0003F-0000003F-00000000
CPUID 00000004: 1C004143-01C0003F-000001FF-00000000
CPUID 00000004: 1C03C163-03C0003F-00001FFF-00000006
CPUID 00000005: 00000040-00000040-00000003-00001120
CPUID 00000006: 00000077-00000002-00000009-00000000
CPUID 00000007: 00000000-00000281-00000000-00000000
CPUID 00000008: 00000000-00000000-00000000-00000000
CPUID 00000009: 00000000-00000000-00000000-00000000
CPUID 0000000A: 07300403-00000000-00000000-00000603
CPUID 0000000B: 00000001-00000002-00000100-00000001
CPUID 0000000B: 00000004-00000008-00000201-00000001
CPUID 0000000C: 00000000-00000000-00000000-00000000
CPUID 0000000D: 00000007-00000340-00000340-00000000
CPUID 0000000D: 00000100-00000240-00000000-00000000
CPUID 80000000: 80000008-00000000-00000000-00000000
CPUID 80000001: 00000000-00000000-00000001-28100000
CPUID 80000002: 20202020-49202020-6C65746E-20295228 [       Intel(R) ]
CPUID 80000003: 65726F43-294D5428-2D376920-30373733 [Core(TM) i7-3770]
CPUID 80000004: 5043204B-20402055-30352E33-007A4847 [K CPU @ 3.50GHz]
CPUID 80000005: 00000000-00000000-00000000-00000000
CPUID 80000006: 00000000-00000000-01006040-00000000
CPUID 80000007: 00000000-00000000-00000000-00000100
CPUID 80000008: 00003024-00000000-00000000-00000000

L1    Data Cache:     32 KB,  8-way Associative, 64-byte Line
L1  Instr. Cache:     32 KB,  8-way Associative, 64-byte Line
L2 Unified Cache:    256 KB,  8-way Associative, 64-byte Line
L3 Unified Cache:   8192 KB, 16-way Associative, 64-byte Line

------[ Logical CPU #2 ]------

allcpu: Package 0 / Core 1 / Thread 0: Valid

CPUID 00000000: 0000000D-756E6547-6C65746E-49656E69 [GenuineIntel]
CPUID 00000001: 000306A9-02100800-7F9AE3BF-BFEBFBFF
CPUID 00000002: 76035A01-00F0B2FF-00000000-00CA0000
CPUID 00000003: 00000000-00000000-00000000-00000000
CPUID 00000004: 1C004121-01C0003F-0000003F-00000000
CPUID 00000004: 1C004122-01C0003F-0000003F-00000000
CPUID 00000004: 1C004143-01C0003F-000001FF-00000000
CPUID 00000004: 1C03C163-03C0003F-00001FFF-00000006
CPUID 00000005: 00000040-00000040-00000003-00001120
CPUID 00000006: 00000077-00000002-00000009-00000000
CPUID 00000007: 00000000-00000281-00000000-00000000
CPUID 00000008: 00000000-00000000-00000000-00000000
CPUID 00000009: 00000000-00000000-00000000-00000000
CPUID 0000000A: 07300403-00000000-00000000-00000603
CPUID 0000000B: 00000001-00000002-00000100-00000002
CPUID 0000000B: 00000004-00000008-00000201-00000002
CPUID 0000000C: 00000000-00000000-00000000-00000000
CPUID 0000000D: 00000007-00000340-00000340-00000000
CPUID 0000000D: 00000100-00000240-00000000-00000000
CPUID 80000000: 80000008-00000000-00000000-00000000
CPUID 80000001: 00000000-00000000-00000001-28100000
CPUID 80000002: 20202020-49202020-6C65746E-20295228 [       Intel(R) ]
CPUID 80000003: 65726F43-294D5428-2D376920-30373733 [Core(TM) i7-3770]
CPUID 80000004: 5043204B-20402055-30352E33-007A4847 [K CPU @ 3.50GHz]
CPUID 80000005: 00000000-00000000-00000000-00000000
CPUID 80000006: 00000000-00000000-01006040-00000000
CPUID 80000007: 00000000-00000000-00000000-00000100
CPUID 80000008: 00003024-00000000-00000000-00000000

L1    Data Cache:     32 KB,  8-way Associative, 64-byte Line
L1  Instr. Cache:     32 KB,  8-way Associative, 64-byte Line
L2 Unified Cache:    256 KB,  8-way Associative, 64-byte Line
L3 Unified Cache:   8192 KB, 16-way Associative, 64-byte Line

------[ Logical CPU #3 ]------

allcpu: Package 0 / Core 1 / Thread 1: Valid, Virtual

CPUID 00000000: 0000000D-756E6547-6C65746E-49656E69 [GenuineIntel]
CPUID 00000001: 000306A9-03100800-7F9AE3BF-BFEBFBFF
CPUID 00000002: 76035A01-00F0B2FF-00000000-00CA0000
CPUID 00000003: 00000000-00000000-00000000-00000000
CPUID 00000004: 1C004121-01C0003F-0000003F-00000000
CPUID 00000004: 1C004122-01C0003F-0000003F-00000000
CPUID 00000004: 1C004143-01C0003F-000001FF-00000000
CPUID 00000004: 1C03C163-03C0003F-00001FFF-00000006
CPUID 00000005: 00000040-00000040-00000003-00001120
CPUID 00000006: 00000077-00000002-00000009-00000000
CPUID 00000007: 00000000-00000281-00000000-00000000
CPUID 00000008: 00000000-00000000-00000000-00000000
CPUID 00000009: 00000000-00000000-00000000-00000000
CPUID 0000000A: 07300403-00000000-00000000-00000603
CPUID 0000000B: 00000001-00000002-00000100-00000003
CPUID 0000000B: 00000004-00000008-00000201-00000003
CPUID 0000000C: 00000000-00000000-00000000-00000000
CPUID 0000000D: 00000007-00000340-00000340-00000000
CPUID 0000000D: 00000100-00000240-00000000-00000000
CPUID 80000000: 80000008-00000000-00000000-00000000
CPUID 80000001: 00000000-00000000-00000001-28100000
CPUID 80000002: 20202020-49202020-6C65746E-20295228 [       Intel(R) ]
CPUID 80000003: 65726F43-294D5428-2D376920-30373733 [Core(TM) i7-3770]
CPUID 80000004: 5043204B-20402055-30352E33-007A4847 [K CPU @ 3.50GHz]
CPUID 80000005: 00000000-00000000-00000000-00000000
CPUID 80000006: 00000000-00000000-01006040-00000000
CPUID 80000007: 00000000-00000000-00000000-00000100
CPUID 80000008: 00003024-00000000-00000000-00000000

L1    Data Cache:     32 KB,  8-way Associative, 64-byte Line
L1  Instr. Cache:     32 KB,  8-way Associative, 64-byte Line
L2 Unified Cache:    256 KB,  8-way Associative, 64-byte Line
L3 Unified Cache:   8192 KB, 16-way Associative, 64-byte Line

------[ Logical CPU #4 ]------

allcpu: Package 0 / Core 2 / Thread 0: Valid

CPUID 00000000: 0000000D-756E6547-6C65746E-49656E69 [GenuineIntel]
CPUID 00000001: 000306A9-04100800-7F9AE3BF-BFEBFBFF
CPUID 00000002: 76035A01-00F0B2FF-00000000-00CA0000
CPUID 00000003: 00000000-00000000-00000000-00000000
CPUID 00000004: 1C004121-01C0003F-0000003F-00000000
CPUID 00000004: 1C004122-01C0003F-0000003F-00000000
CPUID 00000004: 1C004143-01C0003F-000001FF-00000000
CPUID 00000004: 1C03C163-03C0003F-00001FFF-00000006
CPUID 00000005: 00000040-00000040-00000003-00001120
CPUID 00000006: 00000077-00000002-00000009-00000000
CPUID 00000007: 00000000-00000281-00000000-00000000
CPUID 00000008: 00000000-00000000-00000000-00000000
CPUID 00000009: 00000000-00000000-00000000-00000000
CPUID 0000000A: 07300403-00000000-00000000-00000603
CPUID 0000000B: 00000001-00000002-00000100-00000004
CPUID 0000000B: 00000004-00000008-00000201-00000004
CPUID 0000000C: 00000000-00000000-00000000-00000000
CPUID 0000000D: 00000007-00000340-00000340-00000000
CPUID 0000000D: 00000100-00000240-00000000-00000000
CPUID 80000000: 80000008-00000000-00000000-00000000
CPUID 80000001: 00000000-00000000-00000001-28100000
CPUID 80000002: 20202020-49202020-6C65746E-20295228 [       Intel(R) ]
CPUID 80000003: 65726F43-294D5428-2D376920-30373733 [Core(TM) i7-3770]
CPUID 80000004: 5043204B-20402055-30352E33-007A4847 [K CPU @ 3.50GHz]
CPUID 80000005: 00000000-00000000-00000000-00000000
CPUID 80000006: 00000000-00000000-01006040-00000000
CPUID 80000007: 00000000-00000000-00000000-00000100
CPUID 80000008: 00003024-00000000-00000000-00000000

L1    Data Cache:     32 KB,  8-way Associative, 64-byte Line
L1  Instr. Cache:     32 KB,  8-way Associative, 64-byte Line
L2 Unified Cache:    256 KB,  8-way Associative, 64-byte Line
L3 Unified Cache:   8192 KB, 16-way Associative, 64-byte Line

------[ Logical CPU #5 ]------

allcpu: Package 0 / Core 2 / Thread 1: Valid, Virtual

CPUID 00000000: 0000000D-756E6547-6C65746E-49656E69 [GenuineIntel]
CPUID 00000001: 000306A9-05100800-7F9AE3BF-BFEBFBFF
CPUID 00000002: 76035A01-00F0B2FF-00000000-00CA0000
CPUID 00000003: 00000000-00000000-00000000-00000000
CPUID 00000004: 1C004121-01C0003F-0000003F-00000000
CPUID 00000004: 1C004122-01C0003F-0000003F-00000000
CPUID 00000004: 1C004143-01C0003F-000001FF-00000000
CPUID 00000004: 1C03C163-03C0003F-00001FFF-00000006
CPUID 00000005: 00000040-00000040-00000003-00001120
CPUID 00000006: 00000077-00000002-00000009-00000000
CPUID 00000007: 00000000-00000281-00000000-00000000
CPUID 00000008: 00000000-00000000-00000000-00000000
CPUID 00000009: 00000000-00000000-00000000-00000000
CPUID 0000000A: 07300403-00000000-00000000-00000603
CPUID 0000000B: 00000001-00000002-00000100-00000005
CPUID 0000000B: 00000004-00000008-00000201-00000005
CPUID 0000000C: 00000000-00000000-00000000-00000000
CPUID 0000000D: 00000007-00000340-00000340-00000000
CPUID 0000000D: 00000100-00000240-00000000-00000000
CPUID 80000000: 80000008-00000000-00000000-00000000
CPUID 80000001: 00000000-00000000-00000001-28100000
CPUID 80000002: 20202020-49202020-6C65746E-20295228 [       Intel(R) ]
CPUID 80000003: 65726F43-294D5428-2D376920-30373733 [Core(TM) i7-3770]
CPUID 80000004: 5043204B-20402055-30352E33-007A4847 [K CPU @ 3.50GHz]
CPUID 80000005: 00000000-00000000-00000000-00000000
CPUID 80000006: 00000000-00000000-01006040-00000000
CPUID 80000007: 00000000-00000000-00000000-00000100
CPUID 80000008: 00003024-00000000-00000000-00000000

L1    Data Cache:     32 KB,  8-way Associative, 64-byte Line
L1  Instr. Cache:     32 KB,  8-way Associative, 64-byte Line
L2 Unified Cache:    256 KB,  8-way Associative, 64-byte Line
L3 Unified Cache:   8192 KB, 16-way Associative, 64-byte Line

------[ Logical CPU #6 ]------

allcpu: Package 0 / Core 3 / Thread 0: Valid

CPUID 00000000: 0000000D-756E6547-6C65746E-49656E69 [GenuineIntel]
CPUID 00000001: 000306A9-06100800-7F9AE3BF-BFEBFBFF
CPUID 00000002: 76035A01-00F0B2FF-00000000-00CA0000
CPUID 00000003: 00000000-00000000-00000000-00000000
CPUID 00000004: 1C004121-01C0003F-0000003F-00000000
CPUID 00000004: 1C004122-01C0003F-0000003F-00000000
CPUID 00000004: 1C004143-01C0003F-000001FF-00000000
CPUID 00000004: 1C03C163-03C0003F-00001FFF-00000006
CPUID 00000005: 00000040-00000040-00000003-00001120
CPUID 00000006: 00000077-00000002-00000009-00000000
CPUID 00000007: 00000000-00000281-00000000-00000000
CPUID 00000008: 00000000-00000000-00000000-00000000
CPUID 00000009: 00000000-00000000-00000000-00000000
CPUID 0000000A: 07300403-00000000-00000000-00000603
CPUID 0000000B: 00000001-00000002-00000100-00000006
CPUID 0000000B: 00000004-00000008-00000201-00000006
CPUID 0000000C: 00000000-00000000-00000000-00000000
CPUID 0000000D: 00000007-00000340-00000340-00000000
CPUID 0000000D: 00000100-00000240-00000000-00000000
CPUID 80000000: 80000008-00000000-00000000-00000000
CPUID 80000001: 00000000-00000000-00000001-28100000
CPUID 80000002: 20202020-49202020-6C65746E-20295228 [       Intel(R) ]
CPUID 80000003: 65726F43-294D5428-2D376920-30373733 [Core(TM) i7-3770]
CPUID 80000004: 5043204B-20402055-30352E33-007A4847 [K CPU @ 3.50GHz]
CPUID 80000005: 00000000-00000000-00000000-00000000
CPUID 80000006: 00000000-00000000-01006040-00000000
CPUID 80000007: 00000000-00000000-00000000-00000100
CPUID 80000008: 00003024-00000000-00000000-00000000

L1    Data Cache:     32 KB,  8-way Associative, 64-byte Line
L1  Instr. Cache:     32 KB,  8-way Associative, 64-byte Line
L2 Unified Cache:    256 KB,  8-way Associative, 64-byte Line
L3 Unified Cache:   8192 KB, 16-way Associative, 64-byte Line

------[ Logical CPU #7 ]------

allcpu: Package 0 / Core 3 / Thread 1: Valid, Virtual

CPUID 00000000: 0000000D-756E6547-6C65746E-49656E69 [GenuineIntel]
CPUID 00000001: 000306A9-07100800-7F9AE3BF-BFEBFBFF
CPUID 00000002: 76035A01-00F0B2FF-00000000-00CA0000
CPUID 00000003: 00000000-00000000-00000000-00000000
CPUID 00000004: 1C004121-01C0003F-0000003F-00000000
CPUID 00000004: 1C004122-01C0003F-0000003F-00000000
CPUID 00000004: 1C004143-01C0003F-000001FF-00000000
CPUID 00000004: 1C03C163-03C0003F-00001FFF-00000006
CPUID 00000005: 00000040-00000040-00000003-00001120
CPUID 00000006: 00000077-00000002-00000009-00000000
CPUID 00000007: 00000000-00000281-00000000-00000000
CPUID 00000008: 00000000-00000000-00000000-00000000
CPUID 00000009: 00000000-00000000-00000000-00000000
CPUID 0000000A: 07300403-00000000-00000000-00000603
CPUID 0000000B: 00000001-00000002-00000100-00000007
CPUID 0000000B: 00000004-00000008-00000201-00000007
CPUID 0000000C: 00000000-00000000-00000000-00000000
CPUID 0000000D: 00000007-00000340-00000340-00000000
CPUID 0000000D: 00000100-00000240-00000000-00000000
CPUID 80000000: 80000008-00000000-00000000-00000000
CPUID 80000001: 00000000-00000000-00000001-28100000
CPUID 80000002: 20202020-49202020-6C65746E-20295228 [       Intel(R) ]
CPUID 80000003: 65726F43-294D5428-2D376920-30373733 [Core(TM) i7-3770]
CPUID 80000004: 5043204B-20402055-30352E33-007A4847 [K CPU @ 3.50GHz]
CPUID 80000005: 00000000-00000000-00000000-00000000
CPUID 80000006: 00000000-00000000-01006040-00000000
CPUID 80000007: 00000000-00000000-00000000-00000100
CPUID 80000008: 00003024-00000000-00000000-00000000

L1    Data Cache:     32 KB,  8-way Associative, 64-byte Line
L1  Instr. Cache:     32 KB,  8-way Associative, 64-byte Line
L2 Unified Cache:    256 KB,  8-way Associative, 64-byte Line
L3 Unified Cache:   8192 KB, 16-way Associative, 64-byte Line

------[ All CPUs ]------

CPU   0: APICID   0 / Package 0 / Core  0 / Thread 0: Valid
CPU   1: APICID   1 / Package 0 / Core  0 / Thread 1: Valid, Virtual
CPU   2: APICID   2 / Package 0 / Core  1 / Thread 0: Valid
CPU   3: APICID   3 / Package 0 / Core  1 / Thread 1: Valid, Virtual
CPU   4: APICID   4 / Package 0 / Core  2 / Thread 0: Valid
CPU   5: APICID   5 / Package 0 / Core  2 / Thread 1: Valid, Virtual
CPU   6: APICID   6 / Package 0 / Core  3 / Thread 0: Valid
CPU   7: APICID   7 / Package 0 / Core  3 / Thread 1: Valid, Virtual

------[ MSR Registers ]------

MSR 00000017: 0004-0000-0000-0000 [PlatID = 1]
MSR 0000001B: 0000-0000-FEE0-0900
MSR 00000035: 0000-0000-0004-0008
MSR 0000008B: 0000-0012-0000-0000
MSR 000000CE: 0008-1010-F001-2300
MSR 000000E7: 0000-0000-0005-43CE
MSR 000000E8: 0000-0000-0005-A6CB
MSR 00000194: 0000-0000-000F-0000
MSR 00000198: 0000-24D4-0000-2500
MSR 00000199: 0000-0000-0000-FF00
MSR 0000019A: 0000-0000-0000-0000
MSR 0000019B: 0000-0000-0000-0010
MSR 0000019C: 0000-0000-8838-0000
MSR 0000019D: 0000-0000-0000-0000
MSR 000001A0: 0000-0000-0085-0089
MSR 000001A2: 0000-0000-0069-1400
MSR 000001A4: 0000-0000-0000-0000
MSR 000001AA: 0000-0000-0040-0000
MSR 000001AD: 0000-0000-2526-2727
MSR 000001B0: 0000-0000-0000-0005
MSR 000001B1: 0000-0000-8838-0000
MSR 000001B2: 0000-0000-0000-0000
MSR 000001FC: 0000-0000-0014-005F
MSR 00000480: 00DA-0400-0000-0010
MSR 00000481: 0000-007F-0000-0016
MSR 00000482: FFF9-FFFE-0401-E172
MSR 00000483: 007F-FFFF-0003-6DFF
MSR 00000484: 0000-FFFF-0000-11FF
MSR 00000485: 0000-0000-1004-01E5
MSR 00000486: 0000-0000-8000-0021
MSR 00000487: 0000-0000-FFFF-FFFF
MSR 00000488: 0000-0000-0000-2000
MSR 00000489: 0000-0000-0017-27FF
MSR 0000048A: 0000-0000-0000-002A
MSR 0000048B: 0000-08FF-0000-0000
MSR 0000048C: 0000-0F01-0611-4141
MSR 0000048D: 0000-007F-0000-0016
MSR 0000048E: FFF9-FFFE-0400-6172
MSR 0000048F: 007F-FFFF-0003-6DFB
MSR 00000490: 0000-FFFF-0000-11FB
MSR 00000606: 0000-0000-000A-1003
MSR 0000060A: 0000-0000-0000-883B
MSR 0000060B: 0000-0000-0000-8850
MSR 0000060C: 0000-0000-0000-8857
MSR 0000060D: 0000-0000-0000-0000
MSR 00000610: 8000-87F8-0014-87F8
MSR 00000611: 0000-0000-219B-0CAE
MSR 00000614: 0000-0000-01E0-0268
MSR 00000638: 0000-0000-0000-0000
MSR 00000639: 0000-0000-1219-B8ED
MSR 0000063A: 0000-0000-0000-0000
MSR 00000640: 0000-0000-0000-0000
MSR 00000641: 0000-0000-0002-BBA4
MSR 00000642: 0000-0000-0000-0008

PerformanceFrequency = 3418066

CPU Clock M.Method = 8  (APIC SNB)
PM Timer Address   = 1032  (0408h)

APIC Clock = 100.00 MHz
APIC Clock = 100.00 MHz
APIC Clock = 100.00 MHz
APIC Clock = 100.00 MHz
APIC Clock = 100.00 MHz
