------[ CPUID Registers / Logical CPU #0 ]------

allcpu: Package 0 / Core 0 / Thread 0: Valid

CPUID 00000000: 00000002-756E6547-6C65746E-49656E69 [GenuineIntel]
CPUID 00000001: 00010650-00000800-00000000-AFE9FBFF
CPUID 00000002: 02B3B001-000000F0-00000000-2C04303F
CPUID 80000000: 80000008-00000000-00000000-00000000
CPUID 80000001: 00000000-00000000-00000000-00000000
CPUID 80000002: 756E6547-20656E69-65746E49-2952286C [Genuine Intel(R)]
CPUID 80000003: 6F727020-73736563-2020726F-20202020 [ processor      ]
CPUID 80000004: 20202020-20202020-30322E31-007A4847 [        1.20GHz]
CPUID 80000005: 00000000-00000000-00000000-00000000 [L1D: 0 KB / L1I: 0 KB]
CPUID 80000006: 00000000-00000000-01002040-00000000 [L2: 256 KB] / L3: 0 KB]
CPUID 80000007: 00000000-00000000-00000000-00000000
CPUID 80000008: 00002020-00000000-00000000-00000000

------[ All CPUs ]------

CPU   0: APICID    0 / Package 0 / Core   0 / Thread 0: Valid

------[ MSR Registers / Logical CPU #0 ]------

MSR 00000017: 0010-0000-C107-0480 [PlatID = 4]
MSR 0000001B: 0000-0000-FEE0-0900
MSR 0000002A: 0000-0000-4248-0081
MSR 0000008B: 0000-0002-0000-0000
MSR 000000CD: 0000-0000-0000-0201
MSR 000000CE: 0000-0900-0000-0201
MSR 000000E7: < FAILED >
MSR 000000E8: < FAILED >
MSR 000000EE: < FAILED >
MSR 0000011E: 0000-0000-0034-232B
MSR 00000198: 0900-0900-0800-0900 [S200]
MSR 00000198: 0900-0900-0800-0900 [S200]
MSR 00000198: 0900-0900-0800-0900
MSR 00000199: 0000-0000-0000-0900
MSR 0000019A: 0000-0000-0000-0002
MSR 0000019B: 0000-0000-0000-0000
MSR 0000019C: 0000-0000-0000-0000 [S200]
MSR 0000019C: 0000-0000-0000-0000 [S200]
MSR 0000019C: 0000-0000-0000-0000
MSR 000001A0: 0000-0004-0020-1488
