------[ CPUID Registers / Logical CPU #0 ]------

allcpu: Package 0 / Core 0 / Thread 0: Valid

CPUID 00000000: 00000020-756E6547-6C65746E-49656E69 [GenuineIntel]
CPUID 00000001: 000906A4-00400800-7FFAFBBF-BFEBFBFF
CPUID 00000002: 00FEFF01-000000F0-00000000-00000000
CPUID 00000003: 00000000-00000000-00000000-00000000
CPUID 00000004: 7C004121-02C0003F-0000003F-00000000 [SL 00] [L1D: 48 KB]
CPUID 00000004: 7C004122-01C0003F-0000003F-00000000 [SL 01] [L1I: 32 KB]
CPUID 00000004: 7C01C143-0240003F-000007FF-00000000 [SL 02] [L2U: 1280 KB]
CPUID 00000004: 7C0FC163-01C0003F-00003FFF-00000004 [SL 03] [L3U: 8 MB]
CPUID 00000005: 00000040-00000040-00000003-10102020
CPUID 00000006: 00DF8FF7-00000002-00000409-00000003
CPUID 00000007: 00000002-239C27EB-984007AC-FC18C410 [SL 00]
CPUID 00000007: 00400810-00000000-00000000-00000000 [SL 01]
CPUID 00000007: 00000000-00000000-00000000-00000017 [SL 02]
CPUID 00000008: 00000000-00000000-00000000-00000000
CPUID 00000009: 00000000-00000000-00000000-00000000
CPUID 0000000A: 07300605-00000000-00000007-00008603
CPUID 0000000B: 00000001-00000002-00000100-00000000 [SL 00]
CPUID 0000000B: 00000006-00000006-00000201-00000000 [SL 01]
CPUID 0000000C: 00000000-00000000-00000000-00000000
CPUID 0000000D: 00000207-00000340-00000A88-00000000 [SL 00] [x87]
CPUID 0000000D: 0000000F-000003D0-00019900-00000000 [SL 01] [SSE]
CPUID 0000000D: 00000100-00000240-00000000-00000000 [SL 02] [AVX]
CPUID 0000000D: 00000080-00000000-00000001-00000000 [SL 08] [PT]
CPUID 0000000D: 00000008-00000A80-00000000-00000000 [SL 09] [PKRU]
CPUID 0000000D: 00000010-00000000-00000001-00000000 [SL 0B]
CPUID 0000000D: 00000018-00000000-00000001-00000000 [SL 0C]
CPUID 0000000D: 00000328-00000000-00000001-00000000 [SL 0F]
CPUID 0000000D: 00000008-00000000-00000001-00000000 [SL 10]
CPUID 0000000E: 00000000-00000000-00000000-00000000
CPUID 0000000F: 00000000-00000000-00000000-00000000 [SL 00]
CPUID 0000000F: 00000000-00000000-00000000-00000000 [SL 01]
CPUID 00000010: 00000000-00000000-00000000-00000000 [SL 00]
CPUID 00000010: 00000000-00000000-00000000-00000000 [SL 01]
CPUID 00000011: 00000000-00000000-00000000-00000000
CPUID 00000012: 00000000-00000000-00000000-00000000 [SL 00]
CPUID 00000012: 00000000-00000000-00000000-00000000 [SL 01]
CPUID 00000013: 00000000-00000000-00000000-00000000
CPUID 00000014: 00000001-0000005F-00000007-00000000 [SL 00]
CPUID 00000014: 02490002-003F003F-00000000-00000000 [SL 01]
CPUID 00000015: 00000002-00000082-0249F000-00000000 [65.00x / 38400000]
CPUID 00000016: 000009C4-00001130-00000064-00000000 [2500 / 4400 / 100]
CPUID 00000017: 00000000-00000000-00000000-00000000 [SL 00]
CPUID 00000018: 00000008-00000000-00000000-00000000 [SL 00]
CPUID 00000018: 00000000-00080001-00000020-00004022 [SL 01]
CPUID 00000018: 00000000-00080006-00000004-00004022 [SL 02]
CPUID 00000018: 00000000-0010000F-00000001-00004125 [SL 03]
CPUID 00000018: 00000000-00040001-00000010-00004024 [SL 04]
CPUID 00000018: 00000000-00040006-00000008-00004024 [SL 05]
CPUID 00000018: 00000000-00080008-00000001-00004124 [SL 06]
CPUID 00000018: 00000000-00080007-00000080-00004043 [SL 07]
CPUID 00000018: 00000000-00080009-00000080-00004043 [SL 08]
CPUID 00000019: 00000000-00000000-00000000-00000000
CPUID 0000001A: 40000001-00000000-00000000-00000000 [Core]
CPUID 0000001B: 00000000-00000000-00000000-00000000
CPUID 0000001C: 4000000B-00000007-00000007-00000000
CPUID 0000001D: 00000000-00000000-00000000-00000000 [SL 00]
CPUID 0000001E: 00000000-00000000-00000000-00000000 [SL 00]
CPUID 0000001F: 00000001-00000002-00000100-00000000 [SL 00]
CPUID 0000001F: 00000006-00000006-00000201-00000000 [SL 01]
CPUID 00000020: 00000000-00000001-00000000-00000000 [SL 00]
CPUID 80000000: 80000008-00000000-00000000-00000000
CPUID 80000001: 00000000-00000000-00000121-2C100000
CPUID 80000002: 65746E49-2952286C-6E655020-6D756974 [Intel(R) Pentium]
CPUID 80000003: 20295228-646C6F47-30353820-00000035 [(R) Gold 8505]
CPUID 80000004: 00000000-00000000-00000000-00000000 []
CPUID 80000005: 00000000-00000000-00000000-00000000 [L1D: 0 KB / L1I: 0 KB]
CPUID 80000006: 00000000-00000000-05007040-00000000 [L2: 1280 KB] / L3: 0 KB]
CPUID 80000007: 00000000-00000000-00000000-00000100
CPUID 80000008: 00003027-00000000-00000000-00000000

L1    Data Cache:    48 KB, 12-way Associative, 64-byte Line
L1  Instr. Cache:    32 KB,  8-way Associative, 64-byte Line
L2 Unified Cache:  1280 KB, 10-way Associative, 64-byte Line
L3 Unified Cache:     8 MB,  8-way Associative, 64-byte Line

------[ CPUID Registers / Logical CPU #1 ]------

allcpu: Package 0 / Core 0 / Thread 1: Valid, Virtual

CPUID 00000000: 00000020-756E6547-6C65746E-49656E69 [GenuineIntel]
CPUID 00000001: 000906A4-01400800-7FFAFBBF-BFEBFBFF
CPUID 00000002: 00FEFF01-000000F0-00000000-00000000
CPUID 00000003: 00000000-00000000-00000000-00000000
CPUID 00000004: 7C004121-02C0003F-0000003F-00000000 [SL 00] [L1D: 48 KB]
CPUID 00000004: 7C004122-01C0003F-0000003F-00000000 [SL 01] [L1I: 32 KB]
CPUID 00000004: 7C01C143-0240003F-000007FF-00000000 [SL 02] [L2U: 1280 KB]
CPUID 00000004: 7C0FC163-01C0003F-00003FFF-00000004 [SL 03] [L3U: 8 MB]
CPUID 00000005: 00000040-00000040-00000003-10102020
CPUID 00000006: 00DF8FF7-00000002-00000409-00000003
CPUID 00000007: 00000002-239C27EB-984007AC-FC18C410 [SL 00]
CPUID 00000007: 00400810-00000000-00000000-00000000 [SL 01]
CPUID 00000007: 00000000-00000000-00000000-00000017 [SL 02]
CPUID 00000008: 00000000-00000000-00000000-00000000
CPUID 00000009: 00000000-00000000-00000000-00000000
CPUID 0000000A: 07300605-00000000-00000007-00008603
CPUID 0000000B: 00000001-00000002-00000100-00000001 [SL 00]
CPUID 0000000B: 00000006-00000006-00000201-00000001 [SL 01]
CPUID 0000000C: 00000000-00000000-00000000-00000000
CPUID 0000000D: 00000207-00000340-00000A88-00000000 [SL 00] [x87]
CPUID 0000000D: 0000000F-000003D0-00019900-00000000 [SL 01] [SSE]
CPUID 0000000D: 00000100-00000240-00000000-00000000 [SL 02] [AVX]
CPUID 0000000D: 00000080-00000000-00000001-00000000 [SL 08] [PT]
CPUID 0000000D: 00000008-00000A80-00000000-00000000 [SL 09] [PKRU]
CPUID 0000000D: 00000010-00000000-00000001-00000000 [SL 0B]
CPUID 0000000D: 00000018-00000000-00000001-00000000 [SL 0C]
CPUID 0000000D: 00000328-00000000-00000001-00000000 [SL 0F]
CPUID 0000000D: 00000008-00000000-00000001-00000000 [SL 10]
CPUID 0000000E: 00000000-00000000-00000000-00000000
CPUID 0000000F: 00000000-00000000-00000000-00000000 [SL 00]
CPUID 0000000F: 00000000-00000000-00000000-00000000 [SL 01]
CPUID 00000010: 00000000-00000000-00000000-00000000 [SL 00]
CPUID 00000010: 00000000-00000000-00000000-00000000 [SL 01]
CPUID 00000011: 00000000-00000000-00000000-00000000
CPUID 00000012: 00000000-00000000-00000000-00000000 [SL 00]
CPUID 00000012: 00000000-00000000-00000000-00000000 [SL 01]
CPUID 00000013: 00000000-00000000-00000000-00000000
CPUID 00000014: 00000001-0000005F-00000007-00000000 [SL 00]
CPUID 00000014: 02490002-003F003F-00000000-00000000 [SL 01]
CPUID 00000015: 00000002-00000082-0249F000-00000000 [65.00x / 38400000]
CPUID 00000016: 000009C4-00001130-00000064-00000000 [2500 / 4400 / 100]
CPUID 00000017: 00000000-00000000-00000000-00000000 [SL 00]
CPUID 00000018: 00000008-00000000-00000000-00000000 [SL 00]
CPUID 00000018: 00000000-00080001-00000020-00004022 [SL 01]
CPUID 00000018: 00000000-00080006-00000004-00004022 [SL 02]
CPUID 00000018: 00000000-0010000F-00000001-00004125 [SL 03]
CPUID 00000018: 00000000-00040001-00000010-00004024 [SL 04]
CPUID 00000018: 00000000-00040006-00000008-00004024 [SL 05]
CPUID 00000018: 00000000-00080008-00000001-00004124 [SL 06]
CPUID 00000018: 00000000-00080007-00000080-00004043 [SL 07]
CPUID 00000018: 00000000-00080009-00000080-00004043 [SL 08]
CPUID 00000019: 00000000-00000000-00000000-00000000
CPUID 0000001A: 40000001-00000000-00000000-00000000 [Core]
CPUID 0000001B: 00000000-00000000-00000000-00000000
CPUID 0000001C: 4000000B-00000007-00000007-00000000
CPUID 0000001D: 00000000-00000000-00000000-00000000 [SL 00]
CPUID 0000001E: 00000000-00000000-00000000-00000000 [SL 00]
CPUID 0000001F: 00000001-00000002-00000100-00000001 [SL 00]
CPUID 0000001F: 00000006-00000006-00000201-00000001 [SL 01]
CPUID 00000020: 00000000-00000001-00000000-00000000 [SL 00]
CPUID 80000000: 80000008-00000000-00000000-00000000
CPUID 80000001: 00000000-00000000-00000121-2C100000
CPUID 80000002: 65746E49-2952286C-6E655020-6D756974 [Intel(R) Pentium]
CPUID 80000003: 20295228-646C6F47-30353820-00000035 [(R) Gold 8505]
CPUID 80000004: 00000000-00000000-00000000-00000000 []
CPUID 80000005: 00000000-00000000-00000000-00000000 [L1D: 0 KB / L1I: 0 KB]
CPUID 80000006: 00000000-00000000-05007040-00000000 [L2: 1280 KB] / L3: 0 KB]
CPUID 80000007: 00000000-00000000-00000000-00000100
CPUID 80000008: 00003027-00000000-00000000-00000000

L1    Data Cache:    48 KB, 12-way Associative, 64-byte Line
L1  Instr. Cache:    32 KB,  8-way Associative, 64-byte Line
L2 Unified Cache:  1280 KB, 10-way Associative, 64-byte Line
L3 Unified Cache:     8 MB,  8-way Associative, 64-byte Line

------[ CPUID Registers / Logical CPU #2 ]------

allcpu: Package 0 / Core 1 / Thread 0: Valid

CPUID 00000000: 00000020-756E6547-6C65746E-49656E69 [GenuineIntel]
CPUID 00000001: 000906A4-10400800-7FFAFBBF-BFEBFBFF
CPUID 00000002: 00FEFF01-00000000-00000000-00000000
CPUID 00000003: 00000000-00000000-00000000-00000000
CPUID 00000004: 7C004121-01C0003F-0000003F-00000000 [SL 00] [L1D: 32 KB]
CPUID 00000004: 7C004122-01C0003F-0000007F-00000000 [SL 01] [L1I: 64 KB]
CPUID 00000004: 7C01C143-03C0003F-000007FF-00000000 [SL 02] [L2U: 2 MB]
CPUID 00000004: 7C0FC163-01C0003F-00003FFF-00000004 [SL 03] [L3U: 8 MB]
CPUID 00000005: 00000040-00000040-00000003-10102020
CPUID 00000006: 00DF8FF7-00000002-00000409-00020003
CPUID 00000007: 00000002-239C27EB-984007AC-FC18C410 [SL 00]
CPUID 00000007: 00400810-00000000-00000000-00000000 [SL 01]
CPUID 00000007: 00000000-00000000-00000000-00000017 [SL 02]
CPUID 00000008: 00000000-00000000-00000000-00000000
CPUID 00000009: 00000000-00000000-00000000-00000000
CPUID 0000000A: 07300605-00000000-00000007-00008603
CPUID 0000000B: 00000001-00000001-00000100-00000010 [SL 00]
CPUID 0000000B: 00000006-00000006-00000201-00000010 [SL 01]
CPUID 0000000C: 00000000-00000000-00000000-00000000
CPUID 0000000D: 00000207-00000340-00000A88-00000000 [SL 00] [x87]
CPUID 0000000D: 0000000F-000003D0-00019900-00000000 [SL 01] [SSE]
CPUID 0000000D: 00000100-00000240-00000000-00000000 [SL 02] [AVX]
CPUID 0000000D: 00000080-00000000-00000001-00000000 [SL 08] [PT]
CPUID 0000000D: 00000008-00000A80-00000000-00000000 [SL 09] [PKRU]
CPUID 0000000D: 00000010-00000000-00000001-00000000 [SL 0B]
CPUID 0000000D: 00000018-00000000-00000001-00000000 [SL 0C]
CPUID 0000000D: 00000328-00000000-00000001-00000000 [SL 0F]
CPUID 0000000D: 00000008-00000000-00000001-00000000 [SL 10]
CPUID 0000000E: 00000000-00000000-00000000-00000000
CPUID 0000000F: 00000000-00000000-00000000-00000000 [SL 00]
CPUID 0000000F: 00000000-00000000-00000000-00000000 [SL 01]
CPUID 00000010: 00000000-00000000-00000000-00000000 [SL 00]
CPUID 00000010: 00000000-00000000-00000000-00000000 [SL 01]
CPUID 00000011: 00000000-00000000-00000000-00000000
CPUID 00000012: 00000000-00000000-00000000-00000000 [SL 00]
CPUID 00000012: 00000000-00000000-00000000-00000000 [SL 01]
CPUID 00000013: 00000000-00000000-00000000-00000000
CPUID 00000014: 00000001-0000005F-80000007-00000000 [SL 00]
CPUID 00000014: 02490002-003F003F-00000000-00000000 [SL 01]
CPUID 00000015: 00000002-00000082-0249F000-00000000 [65.00x / 38400000]
CPUID 00000016: 000009C4-00000CE4-00000064-00000000 [2500 / 3300 / 100]
CPUID 00000017: 00000000-00000000-00000000-00000000 [SL 00]
CPUID 00000018: 00000004-00000000-00000000-00000000 [SL 00]
CPUID 00000018: 00000000-00300001-00000001-00000121 [SL 01]
CPUID 00000018: 00000000-00040003-00000200-00000043 [SL 02]
CPUID 00000018: 00000000-00400001-00000001-00000122 [SL 03]
CPUID 00000018: 00000000-00080008-00000001-00000143 [SL 04]
CPUID 00000019: 00000000-00000000-00000000-00000000
CPUID 0000001A: 20000001-00000000-00000000-00000000 [Atom]
CPUID 0000001B: 00000000-00000000-00000000-00000000
CPUID 0000001C: C000000B-00000007-00000007-00000000
CPUID 0000001D: 00000000-00000000-00000000-00000000 [SL 00]
CPUID 0000001E: 00000000-00000000-00000000-00000000 [SL 00]
CPUID 0000001F: 00000001-00000001-00000100-00000010 [SL 00]
CPUID 0000001F: 00000006-00000006-00000201-00000010 [SL 01]
CPUID 00000020: 00000000-00000001-00000000-00000000 [SL 00]
CPUID 80000000: 80000008-00000000-00000000-00000000
CPUID 80000001: 00000000-00000000-00000121-2C100000
CPUID 80000002: 65746E49-2952286C-6E655020-6D756974 [Intel(R) Pentium]
CPUID 80000003: 20295228-646C6F47-30353820-00000035 [(R) Gold 8505]
CPUID 80000004: 00000000-00000000-00000000-00000000 []
CPUID 80000005: 00000000-00000000-00000000-00000000 [L1D: 0 KB / L1I: 0 KB]
CPUID 80000006: 00000000-00000000-08008040-00000000 [L2: 2048 KB] / L3: 0 KB]
CPUID 80000007: 00000000-00000000-00000000-00000100
CPUID 80000008: 00003027-00000000-00000000-00000000

L1    Data Cache:    32 KB,  8-way Associative, 64-byte Line
L1  Instr. Cache:    64 KB,  8-way Associative, 64-byte Line
L2 Unified Cache:     2 MB, 16-way Associative, 64-byte Line
L3 Unified Cache:     8 MB,  8-way Associative, 64-byte Line

------[ CPUID Registers / Logical CPU #3 ]------

allcpu: Package 0 / Core 2 / Thread 0: Valid

CPUID 00000000: 00000020-756E6547-6C65746E-49656E69 [GenuineIntel]
CPUID 00000001: 000906A4-12400800-7FFAFBBF-BFEBFBFF
CPUID 00000002: 00FEFF01-00000000-00000000-00000000
CPUID 00000003: 00000000-00000000-00000000-00000000
CPUID 00000004: 7C004121-01C0003F-0000003F-00000000 [SL 00] [L1D: 32 KB]
CPUID 00000004: 7C004122-01C0003F-0000007F-00000000 [SL 01] [L1I: 64 KB]
CPUID 00000004: 7C01C143-03C0003F-000007FF-00000000 [SL 02] [L2U: 2 MB]
CPUID 00000004: 7C0FC163-01C0003F-00003FFF-00000004 [SL 03] [L3U: 8 MB]
CPUID 00000005: 00000040-00000040-00000003-10102020
CPUID 00000006: 00DF8FF7-00000002-00000409-00020003
CPUID 00000007: 00000002-239C27EB-984007AC-FC18C410 [SL 00]
CPUID 00000007: 00400810-00000000-00000000-00000000 [SL 01]
CPUID 00000007: 00000000-00000000-00000000-00000017 [SL 02]
CPUID 00000008: 00000000-00000000-00000000-00000000
CPUID 00000009: 00000000-00000000-00000000-00000000
CPUID 0000000A: 07300605-00000000-00000007-00008603
CPUID 0000000B: 00000001-00000001-00000100-00000012 [SL 00]
CPUID 0000000B: 00000006-00000006-00000201-00000012 [SL 01]
CPUID 0000000C: 00000000-00000000-00000000-00000000
CPUID 0000000D: 00000207-00000340-00000A88-00000000 [SL 00] [x87]
CPUID 0000000D: 0000000F-000003D0-00019900-00000000 [SL 01] [SSE]
CPUID 0000000D: 00000100-00000240-00000000-00000000 [SL 02] [AVX]
CPUID 0000000D: 00000080-00000000-00000001-00000000 [SL 08] [PT]
CPUID 0000000D: 00000008-00000A80-00000000-00000000 [SL 09] [PKRU]
CPUID 0000000D: 00000010-00000000-00000001-00000000 [SL 0B]
CPUID 0000000D: 00000018-00000000-00000001-00000000 [SL 0C]
CPUID 0000000D: 00000328-00000000-00000001-00000000 [SL 0F]
CPUID 0000000D: 00000008-00000000-00000001-00000000 [SL 10]
CPUID 0000000E: 00000000-00000000-00000000-00000000
CPUID 0000000F: 00000000-00000000-00000000-00000000 [SL 00]
CPUID 0000000F: 00000000-00000000-00000000-00000000 [SL 01]
CPUID 00000010: 00000000-00000000-00000000-00000000 [SL 00]
CPUID 00000010: 00000000-00000000-00000000-00000000 [SL 01]
CPUID 00000011: 00000000-00000000-00000000-00000000
CPUID 00000012: 00000000-00000000-00000000-00000000 [SL 00]
CPUID 00000012: 00000000-00000000-00000000-00000000 [SL 01]
CPUID 00000013: 00000000-00000000-00000000-00000000
CPUID 00000014: 00000001-0000005F-80000007-00000000 [SL 00]
CPUID 00000014: 02490002-003F003F-00000000-00000000 [SL 01]
CPUID 00000015: 00000002-00000082-0249F000-00000000 [65.00x / 38400000]
CPUID 00000016: 000009C4-00000CE4-00000064-00000000 [2500 / 3300 / 100]
CPUID 00000017: 00000000-00000000-00000000-00000000 [SL 00]
CPUID 00000018: 00000004-00000000-00000000-00000000 [SL 00]
CPUID 00000018: 00000000-00300001-00000001-00000121 [SL 01]
CPUID 00000018: 00000000-00040003-00000200-00000043 [SL 02]
CPUID 00000018: 00000000-00400001-00000001-00000122 [SL 03]
CPUID 00000018: 00000000-00080008-00000001-00000143 [SL 04]
CPUID 00000019: 00000000-00000000-00000000-00000000
CPUID 0000001A: 20000001-00000000-00000000-00000000 [Atom]
CPUID 0000001B: 00000000-00000000-00000000-00000000
CPUID 0000001C: C000000B-00000007-00000007-00000000
CPUID 0000001D: 00000000-00000000-00000000-00000000 [SL 00]
CPUID 0000001E: 00000000-00000000-00000000-00000000 [SL 00]
CPUID 0000001F: 00000001-00000001-00000100-00000012 [SL 00]
CPUID 0000001F: 00000006-00000006-00000201-00000012 [SL 01]
CPUID 00000020: 00000000-00000001-00000000-00000000 [SL 00]
CPUID 80000000: 80000008-00000000-00000000-00000000
CPUID 80000001: 00000000-00000000-00000121-2C100000
CPUID 80000002: 65746E49-2952286C-6E655020-6D756974 [Intel(R) Pentium]
CPUID 80000003: 20295228-646C6F47-30353820-00000035 [(R) Gold 8505]
CPUID 80000004: 00000000-00000000-00000000-00000000 []
CPUID 80000005: 00000000-00000000-00000000-00000000 [L1D: 0 KB / L1I: 0 KB]
CPUID 80000006: 00000000-00000000-08008040-00000000 [L2: 2048 KB] / L3: 0 KB]
CPUID 80000007: 00000000-00000000-00000000-00000100
CPUID 80000008: 00003027-00000000-00000000-00000000

L1    Data Cache:    32 KB,  8-way Associative, 64-byte Line
L1  Instr. Cache:    64 KB,  8-way Associative, 64-byte Line
L2 Unified Cache:     2 MB, 16-way Associative, 64-byte Line
L3 Unified Cache:     8 MB,  8-way Associative, 64-byte Line

------[ CPUID Registers / Logical CPU #4 ]------

allcpu: Package 0 / Core 3 / Thread 0: Valid

CPUID 00000000: 00000020-756E6547-6C65746E-49656E69 [GenuineIntel]
CPUID 00000001: 000906A4-14400800-7FFAFBBF-BFEBFBFF
CPUID 00000002: 00FEFF01-00000000-00000000-00000000
CPUID 00000003: 00000000-00000000-00000000-00000000
CPUID 00000004: 7C004121-01C0003F-0000003F-00000000 [SL 00] [L1D: 32 KB]
CPUID 00000004: 7C004122-01C0003F-0000007F-00000000 [SL 01] [L1I: 64 KB]
CPUID 00000004: 7C01C143-03C0003F-000007FF-00000000 [SL 02] [L2U: 2 MB]
CPUID 00000004: 7C0FC163-01C0003F-00003FFF-00000004 [SL 03] [L3U: 8 MB]
CPUID 00000005: 00000040-00000040-00000003-10102020
CPUID 00000006: 00DF8FF7-00000002-00000409-00020003
CPUID 00000007: 00000002-239C27EB-984007AC-FC18C410 [SL 00]
CPUID 00000007: 00400810-00000000-00000000-00000000 [SL 01]
CPUID 00000007: 00000000-00000000-00000000-00000017 [SL 02]
CPUID 00000008: 00000000-00000000-00000000-00000000
CPUID 00000009: 00000000-00000000-00000000-00000000
CPUID 0000000A: 07300605-00000000-00000007-00008603
CPUID 0000000B: 00000001-00000001-00000100-00000014 [SL 00]
CPUID 0000000B: 00000006-00000006-00000201-00000014 [SL 01]
CPUID 0000000C: 00000000-00000000-00000000-00000000
CPUID 0000000D: 00000207-00000340-00000A88-00000000 [SL 00] [x87]
CPUID 0000000D: 0000000F-000003D0-00019900-00000000 [SL 01] [SSE]
CPUID 0000000D: 00000100-00000240-00000000-00000000 [SL 02] [AVX]
CPUID 0000000D: 00000080-00000000-00000001-00000000 [SL 08] [PT]
CPUID 0000000D: 00000008-00000A80-00000000-00000000 [SL 09] [PKRU]
CPUID 0000000D: 00000010-00000000-00000001-00000000 [SL 0B]
CPUID 0000000D: 00000018-00000000-00000001-00000000 [SL 0C]
CPUID 0000000D: 00000328-00000000-00000001-00000000 [SL 0F]
CPUID 0000000D: 00000008-00000000-00000001-00000000 [SL 10]
CPUID 0000000E: 00000000-00000000-00000000-00000000
CPUID 0000000F: 00000000-00000000-00000000-00000000 [SL 00]
CPUID 0000000F: 00000000-00000000-00000000-00000000 [SL 01]
CPUID 00000010: 00000000-00000000-00000000-00000000 [SL 00]
CPUID 00000010: 00000000-00000000-00000000-00000000 [SL 01]
CPUID 00000011: 00000000-00000000-00000000-00000000
CPUID 00000012: 00000000-00000000-00000000-00000000 [SL 00]
CPUID 00000012: 00000000-00000000-00000000-00000000 [SL 01]
CPUID 00000013: 00000000-00000000-00000000-00000000
CPUID 00000014: 00000001-0000005F-80000007-00000000 [SL 00]
CPUID 00000014: 02490002-003F003F-00000000-00000000 [SL 01]
CPUID 00000015: 00000002-00000082-0249F000-00000000 [65.00x / 38400000]
CPUID 00000016: 000009C4-00000CE4-00000064-00000000 [2500 / 3300 / 100]
CPUID 00000017: 00000000-00000000-00000000-00000000 [SL 00]
CPUID 00000018: 00000004-00000000-00000000-00000000 [SL 00]
CPUID 00000018: 00000000-00300001-00000001-00000121 [SL 01]
CPUID 00000018: 00000000-00040003-00000200-00000043 [SL 02]
CPUID 00000018: 00000000-00400001-00000001-00000122 [SL 03]
CPUID 00000018: 00000000-00080008-00000001-00000143 [SL 04]
CPUID 00000019: 00000000-00000000-00000000-00000000
CPUID 0000001A: 20000001-00000000-00000000-00000000 [Atom]
CPUID 0000001B: 00000000-00000000-00000000-00000000
CPUID 0000001C: C000000B-00000007-00000007-00000000
CPUID 0000001D: 00000000-00000000-00000000-00000000 [SL 00]
CPUID 0000001E: 00000000-00000000-00000000-00000000 [SL 00]
CPUID 0000001F: 00000001-00000001-00000100-00000014 [SL 00]
CPUID 0000001F: 00000006-00000006-00000201-00000014 [SL 01]
CPUID 00000020: 00000000-00000001-00000000-00000000 [SL 00]
CPUID 80000000: 80000008-00000000-00000000-00000000
CPUID 80000001: 00000000-00000000-00000121-2C100000
CPUID 80000002: 65746E49-2952286C-6E655020-6D756974 [Intel(R) Pentium]
CPUID 80000003: 20295228-646C6F47-30353820-00000035 [(R) Gold 8505]
CPUID 80000004: 00000000-00000000-00000000-00000000 []
CPUID 80000005: 00000000-00000000-00000000-00000000 [L1D: 0 KB / L1I: 0 KB]
CPUID 80000006: 00000000-00000000-08008040-00000000 [L2: 2048 KB] / L3: 0 KB]
CPUID 80000007: 00000000-00000000-00000000-00000100
CPUID 80000008: 00003027-00000000-00000000-00000000

L1    Data Cache:    32 KB,  8-way Associative, 64-byte Line
L1  Instr. Cache:    64 KB,  8-way Associative, 64-byte Line
L2 Unified Cache:     2 MB, 16-way Associative, 64-byte Line
L3 Unified Cache:     8 MB,  8-way Associative, 64-byte Line

------[ CPUID Registers / Logical CPU #5 ]------

allcpu: Package 0 / Core 4 / Thread 0: Valid

CPUID 00000000: 00000020-756E6547-6C65746E-49656E69 [GenuineIntel]
CPUID 00000001: 000906A4-16400800-7FFAFBBF-BFEBFBFF
CPUID 00000002: 00FEFF01-00000000-00000000-00000000
CPUID 00000003: 00000000-00000000-00000000-00000000
CPUID 00000004: 7C004121-01C0003F-0000003F-00000000 [SL 00] [L1D: 32 KB]
CPUID 00000004: 7C004122-01C0003F-0000007F-00000000 [SL 01] [L1I: 64 KB]
CPUID 00000004: 7C01C143-03C0003F-000007FF-00000000 [SL 02] [L2U: 2 MB]
CPUID 00000004: 7C0FC163-01C0003F-00003FFF-00000004 [SL 03] [L3U: 8 MB]
CPUID 00000005: 00000040-00000040-00000003-10102020
CPUID 00000006: 00DF8FF7-00000002-00000409-00020003
CPUID 00000007: 00000002-239C27EB-984007AC-FC18C410 [SL 00]
CPUID 00000007: 00400810-00000000-00000000-00000000 [SL 01]
CPUID 00000007: 00000000-00000000-00000000-00000017 [SL 02]
CPUID 00000008: 00000000-00000000-00000000-00000000
CPUID 00000009: 00000000-00000000-00000000-00000000
CPUID 0000000A: 07300605-00000000-00000007-00008603
CPUID 0000000B: 00000001-00000001-00000100-00000016 [SL 00]
CPUID 0000000B: 00000006-00000006-00000201-00000016 [SL 01]
CPUID 0000000C: 00000000-00000000-00000000-00000000
CPUID 0000000D: 00000207-00000340-00000A88-00000000 [SL 00] [x87]
CPUID 0000000D: 0000000F-000003D0-00019900-00000000 [SL 01] [SSE]
CPUID 0000000D: 00000100-00000240-00000000-00000000 [SL 02] [AVX]
CPUID 0000000D: 00000080-00000000-00000001-00000000 [SL 08] [PT]
CPUID 0000000D: 00000008-00000A80-00000000-00000000 [SL 09] [PKRU]
CPUID 0000000D: 00000010-00000000-00000001-00000000 [SL 0B]
CPUID 0000000D: 00000018-00000000-00000001-00000000 [SL 0C]
CPUID 0000000D: 00000328-00000000-00000001-00000000 [SL 0F]
CPUID 0000000D: 00000008-00000000-00000001-00000000 [SL 10]
CPUID 0000000E: 00000000-00000000-00000000-00000000
CPUID 0000000F: 00000000-00000000-00000000-00000000 [SL 00]
CPUID 0000000F: 00000000-00000000-00000000-00000000 [SL 01]
CPUID 00000010: 00000000-00000000-00000000-00000000 [SL 00]
CPUID 00000010: 00000000-00000000-00000000-00000000 [SL 01]
CPUID 00000011: 00000000-00000000-00000000-00000000
CPUID 00000012: 00000000-00000000-00000000-00000000 [SL 00]
CPUID 00000012: 00000000-00000000-00000000-00000000 [SL 01]
CPUID 00000013: 00000000-00000000-00000000-00000000
CPUID 00000014: 00000001-0000005F-80000007-00000000 [SL 00]
CPUID 00000014: 02490002-003F003F-00000000-00000000 [SL 01]
CPUID 00000015: 00000002-00000082-0249F000-00000000 [65.00x / 38400000]
CPUID 00000016: 000009C4-00000CE4-00000064-00000000 [2500 / 3300 / 100]
CPUID 00000017: 00000000-00000000-00000000-00000000 [SL 00]
CPUID 00000018: 00000004-00000000-00000000-00000000 [SL 00]
CPUID 00000018: 00000000-00300001-00000001-00000121 [SL 01]
CPUID 00000018: 00000000-00040003-00000200-00000043 [SL 02]
CPUID 00000018: 00000000-00400001-00000001-00000122 [SL 03]
CPUID 00000018: 00000000-00080008-00000001-00000143 [SL 04]
CPUID 00000019: 00000000-00000000-00000000-00000000
CPUID 0000001A: 20000001-00000000-00000000-00000000 [Atom]
CPUID 0000001B: 00000000-00000000-00000000-00000000
CPUID 0000001C: C000000B-00000007-00000007-00000000
CPUID 0000001D: 00000000-00000000-00000000-00000000 [SL 00]
CPUID 0000001E: 00000000-00000000-00000000-00000000 [SL 00]
CPUID 0000001F: 00000001-00000001-00000100-00000016 [SL 00]
CPUID 0000001F: 00000006-00000006-00000201-00000016 [SL 01]
CPUID 00000020: 00000000-00000001-00000000-00000000 [SL 00]
CPUID 80000000: 80000008-00000000-00000000-00000000
CPUID 80000001: 00000000-00000000-00000121-2C100000
CPUID 80000002: 65746E49-2952286C-6E655020-6D756974 [Intel(R) Pentium]
CPUID 80000003: 20295228-646C6F47-30353820-00000035 [(R) Gold 8505]
CPUID 80000004: 00000000-00000000-00000000-00000000 []
CPUID 80000005: 00000000-00000000-00000000-00000000 [L1D: 0 KB / L1I: 0 KB]
CPUID 80000006: 00000000-00000000-08008040-00000000 [L2: 2048 KB] / L3: 0 KB]
CPUID 80000007: 00000000-00000000-00000000-00000100
CPUID 80000008: 00003027-00000000-00000000-00000000

L1    Data Cache:    32 KB,  8-way Associative, 64-byte Line
L1  Instr. Cache:    64 KB,  8-way Associative, 64-byte Line
L2 Unified Cache:     2 MB, 16-way Associative, 64-byte Line
L3 Unified Cache:     8 MB,  8-way Associative, 64-byte Line

------[ All CPUs ]------

CPU   0: APICID    0 / Package 0 / Core   0 / Thread 0: Valid
CPU   1: APICID    1 / Package 0 / Core   0 / Thread 1: Valid, Virtual
CPU   2: APICID   16 / Package 0 / Core   1 / Thread 0: Valid
CPU   3: APICID   18 / Package 0 / Core   2 / Thread 0: Valid
CPU   4: APICID   20 / Package 0 / Core   3 / Thread 0: Valid
CPU   5: APICID   22 / Package 0 / Core   4 / Thread 0: Valid

------[ MSR Registers / Logical CPU #0 ]------

MSR 00000017: 001C-0000-0000-0000 [PlatID = 7]
MSR 0000001B: 0000-0000-FEE0-0D00
MSR 00000035: 0000-0000-0005-0006
MSR 00000048: 0000-0000-0000-0001
MSR 00000049: < FAILED >
MSR 0000008B: 0000-0426-0000-0000
MSR 000000CE: 0004-043D-F081-1900 [eD = 0]
MSR 000000E7: 0000-01ED-1854-8286 [S200]
MSR 000000E7: 0000-01ED-1862-5163 [S200]
MSR 000000E7: 0000-01ED-189B-A2EC
MSR 000000E8: 0000-02BF-6678-3F4D [S200]
MSR 000000E8: 0000-02BF-6690-BABA [S200]
MSR 000000E8: 0000-02BF-6693-4254
MSR 0000010A: 0000-0000-0088-FD6B
MSR 0000010B: < FAILED >
MSR 00000194: 0000-0000-0011-0000
MSR 00000198: 0000-1599-0000-0600 [S200]
MSR 00000198: 0000-1800-0000-1300 [S200]
MSR 00000198: 0000-15EB-0000-0700
MSR 00000199: 0000-0000-0000-0C00
MSR 0000019A: 0000-0000-0000-0000
MSR 0000019B: 0000-0000-0000-0010
MSR 0000019C: 0000-0000-883F-0282 [S200]
MSR 0000019C: 0000-0000-8833-0282 [S200]
MSR 0000019C: 0000-0000-883F-0282
MSR 0000019D: 0000-0000-0000-0000
MSR 000001A0: 0000-0000-0085-0089
MSR 000001A2: 0000-0000-8064-0000
MSR 000001A4: 0000-0000-0000-0000
MSR 000001AA: 0000-0000-0000-30C2
MSR 000001AC: < FAILED >
MSR 000001AD: 2C2C-2C2C-2C2C-2C2C
MSR 000001AE: 0807-0605-0403-0201
MSR 000001AF: < FAILED >
MSR 000001B0: 0000-0000-0000-0006
MSR 000001B1: 0000-0000-883F-0282
MSR 000001B2: 0000-0000-0200-0000
MSR 000001FC: 0000-0000-00EC-005B
MSR 00000300: < FAILED >
MSR 0000030A: 0000-0000-0013-0CA0 [S200]
MSR 0000030A: 0000-0000-0013-0CA0 [S200]
MSR 0000030A: 0000-0000-0013-0CA0
MSR 0000030B: 0000-0000-000A-D467 [S200]
MSR 0000030B: 0000-0000-000A-D467 [S200]
MSR 0000030B: 0000-0000-000A-D467
MSR 00000480: 03DA-0500-0000-0013
MSR 00000481: 0000-00FF-0000-0016
MSR 00000482: FFFB-FFFE-0401-E172
MSR 00000483: F77F-FFFF-0003-6DFF
MSR 00000484: 0076-FFFF-0000-11FF
MSR 00000485: 0000-0000-7004-C1E7
MSR 00000486: 0000-0000-8000-0021
MSR 00000487: 0000-0000-FFFF-FFFF
MSR 00000488: 0000-0000-0000-2000
MSR 00000489: 0000-0000-01F7-2FFF
MSR 0000048A: 0000-0000-0000-002E
MSR 0000048B: 075D-7FFF-0000-0000
MSR 0000048C: 0000-0F01-06F3-4141
MSR 0000048D: 0000-00FF-0000-0016
MSR 0000048E: FFFB-FFFE-0400-6172
MSR 0000048F: F77F-FFFF-0003-6DFB
MSR 00000490: 0076-FFFF-0000-11FB
MSR 00000601: 0000-0000-0000-03D8
MSR 00000602: < FAILED >
MSR 00000603: 0036-0000-0036-3636
MSR 00000604: < FAILED >
MSR 00000606: 0000-0000-000A-0E03
MSR 0000060A: 0000-0000-0000-0000
MSR 0000060B: 0000-0000-0000-0000
MSR 0000060C: 0000-0000-0000-0000
MSR 0000060D: 0000-0443-B208-68F9
MSR 00000610: 0042-81B8-00DD-8190
MSR 00000611: 0000-0000-1B62-DEDD [S200]
MSR 00000611: 0000-0000-1B63-229B [S200]
MSR 00000611: 0000-0000-1B63-6564
MSR 00000613: 0000-0000-0000-0000
MSR 00000614: 0000-0000-0000-0078
MSR 00000618: 0000-0000-0000-0000
MSR 00000619: 0000-0000-0000-0000 [S200]
MSR 00000619: 0000-0000-0000-0000 [S200]
MSR 00000619: 0000-0000-0000-0000
MSR 0000061B: 0000-0000-0000-0000
MSR 0000061C: < FAILED >
MSR 0000061E: < FAILED >
MSR 00000620: 0000-0000-0000-0426
MSR 00000621: 0000-0000-0000-0004
MSR 00000638: 0000-0000-0000-0000
MSR 00000639: 0000-0000-063B-0B46 [S200]
MSR 00000639: 0000-0000-063B-1047 [S200]
MSR 00000639: 0000-0000-063B-1048
MSR 0000063A: 0000-0000-0000-0009
MSR 0000063B: < FAILED >
MSR 00000640: 0000-0000-0000-0000
MSR 00000641: 0000-0000-0014-E999 [S200]
MSR 00000641: 0000-0000-0014-E999 [S200]
MSR 00000641: 0000-0000-0014-E999
MSR 00000642: 0000-0000-0000-000D
MSR 00000648: 0000-0000-0000-000C
MSR 00000649: 0000-0000-0009-0060
MSR 0000064A: 0000-0000-0019-00E0
MSR 0000064B: 0000-0000-0000-0000
MSR 0000064C: 0000-0000-0000-000B
MSR 00000650: 2121-2121-2121-2121
MSR 00000651: 0807-0605-0403-0201
MSR 00000690: < FAILED >
MSR 000006B0: 0000-0000-0000-0000
MSR 000006B1: 0000-0000-0102-0000
MSR 00000770: 0000-0000-0000-0001
MSR 00000771: 0000-0000-0108-1038
MSR 00000772: 0000-0000-8000-FF01
MSR 00000773: 0000-0000-0000-0005
MSR 00000774: 0000-019E-5400-3801
MSR 00000777: 0000-0000-0000-0004
MSR 00000832: 0000-0000-0003-00D1
MSR 00000838: 0000-0000-0000-0000
MSR 00000839: 0000-0000-0000-0000
MSR 0000083E: 0000-0000-0000-000A

------[ MSR Registers / Logical CPU #1 ]------

MSR 00000017: 001C-0000-0000-0000 [PlatID = 7]
MSR 0000001B: 0000-0000-FEE0-0C00
MSR 00000035: 0000-0000-0005-0006
MSR 00000048: 0000-0000-0000-0001
MSR 00000049: < FAILED >
MSR 0000008B: 0000-0426-0000-0000
MSR 000000CE: 0004-043D-F081-1900 [eD = 0]
MSR 000000E7: 0000-0143-5C66-063E
MSR 000000E8: 0000-01D9-F72A-7779
MSR 0000010A: 0000-0000-0088-FD6B
MSR 0000010B: < FAILED >
MSR 00000194: 0000-0000-0011-0000
MSR 00000198: 0000-23D9-0000-2C00
MSR 00000199: 0000-0000-0000-0C00
MSR 0000019A: 0000-0000-0000-0000
MSR 0000019B: 0000-0000-0000-0010
MSR 0000019C: 0000-0000-883F-0282
MSR 0000019D: 0000-0000-0000-0000
MSR 000001A0: 0000-0000-0085-0089
MSR 000001A2: 0000-0000-8064-0000
MSR 000001A4: 0000-0000-0000-0000
MSR 000001AA: 0000-0000-0000-30C2
MSR 000001AC: < FAILED >
MSR 000001AD: 2C2C-2C2C-2C2C-2C2C
MSR 000001AE: 0807-0605-0403-0201
MSR 000001AF: < FAILED >
MSR 000001B0: 0000-0000-0000-0006
MSR 000001B1: 0000-0000-883F-0282
MSR 000001B2: 0000-0000-0200-0000
MSR 000001FC: 0000-0000-00EC-005B
MSR 00000300: < FAILED >
MSR 0000030A: 0000-0000-0012-9607
MSR 0000030B: 0000-0000-000A-D62E
MSR 00000480: 03DA-0500-0000-0013
MSR 00000481: 0000-00FF-0000-0016
MSR 00000482: FFFB-FFFE-0401-E172
MSR 00000483: F77F-FFFF-0003-6DFF
MSR 00000484: 0076-FFFF-0000-11FF
MSR 00000485: 0000-0000-7004-C1E7
MSR 00000486: 0000-0000-8000-0021
MSR 00000487: 0000-0000-FFFF-FFFF
MSR 00000488: 0000-0000-0000-2000
MSR 00000489: 0000-0000-01F7-2FFF
MSR 0000048A: 0000-0000-0000-002E
MSR 0000048B: 075D-7FFF-0000-0000
MSR 0000048C: 0000-0F01-06F3-4141
MSR 0000048D: 0000-00FF-0000-0016
MSR 0000048E: FFFB-FFFE-0400-6172
MSR 0000048F: F77F-FFFF-0003-6DFB
MSR 00000490: 0076-FFFF-0000-11FB
MSR 00000601: 0000-0000-0000-03D8
MSR 00000602: < FAILED >
MSR 00000603: 0036-0000-0036-3636
MSR 00000604: < FAILED >
MSR 00000606: 0000-0000-000A-0E03
MSR 0000060A: 0000-0000-0000-0000
MSR 0000060B: 0000-0000-0000-0000
MSR 0000060C: 0000-0000-0000-0000
MSR 0000060D: 0000-0444-5ECE-7CAE
MSR 00000610: 0042-81B8-00DD-8190
MSR 00000611: 0000-0000-1B65-0CAF
MSR 00000613: 0000-0000-0000-0000
MSR 00000614: 0000-0000-0000-0078
MSR 00000618: 0000-0000-0000-0000
MSR 00000619: 0000-0000-0000-0000
MSR 0000061B: 0000-0000-0000-0000
MSR 0000061C: < FAILED >
MSR 0000061E: < FAILED >
MSR 00000620: 0000-0000-0000-0426
MSR 00000621: 0000-0000-0000-0026
MSR 00000638: 0000-0000-0000-0000
MSR 00000639: 0000-0000-063B-11B6
MSR 0000063A: 0000-0000-0000-0009
MSR 0000063B: < FAILED >
MSR 00000640: 0000-0000-0000-0000
MSR 00000641: 0000-0000-0014-E999
MSR 00000642: 0000-0000-0000-000D
MSR 00000648: 0000-0000-0000-000C
MSR 00000649: 0000-0000-0009-0060
MSR 0000064A: 0000-0000-0019-00E0
MSR 0000064B: 0000-0000-0000-0000
MSR 0000064C: 0000-0000-0000-000B
MSR 00000650: 2121-2121-2121-2121
MSR 00000651: 0807-0605-0403-0201
MSR 00000690: < FAILED >
MSR 000006B0: 0000-0000-0000-0000
MSR 000006B1: 0000-0000-0102-0000
MSR 00000770: 0000-0000-0000-0001
MSR 00000771: 0000-0000-0115-1038
MSR 00000772: 0000-0000-8000-FF01
MSR 00000773: 0000-0000-0000-0005
MSR 00000774: 0000-019E-5400-3801
MSR 00000777: 0000-0000-0000-0004
MSR 00000832: 0000-0000-0003-00D1
MSR 00000838: 0000-0000-0000-0000
MSR 00000839: 0000-0000-0000-0000
MSR 0000083E: 0000-0000-0000-000A

------[ MSR Registers / Logical CPU #2 ]------

MSR 00000017: 001C-0000-0000-0000 [PlatID = 7]
MSR 0000001B: 0000-0000-FEE0-0C00
MSR 0000002A: 0000-0000-0000-0000
MSR 00000035: 0000-0000-0005-0006
MSR 00000048: 0000-0000-0000-0001
MSR 00000049: < FAILED >
MSR 0000008B: 0000-0426-0000-0000
MSR 000000CD: < FAILED >
MSR 000000CE: 0004-043D-F081-1900 [eD = 0]
MSR 000000E7: 0000-01CD-A20B-0164
MSR 000000E8: 0000-01A7-6113-B8F9
MSR 000000EE: < FAILED >
MSR 0000010A: 0000-0000-0088-FD6B
MSR 0000010B: < FAILED >
MSR 0000011E: < FAILED >
MSR 00000194: 0000-0000-0011-0000
MSR 00000198: 0000-226E-0000-2100
MSR 00000199: 0000-0000-0000-0C00
MSR 0000019A: 0000-0000-0000-0000
MSR 0000019B: 0000-0000-0000-0010
MSR 0000019C: 0000-0000-8840-0282
MSR 0000019D: 0000-0000-0000-0000
MSR 000001A0: 0000-0000-0085-0089
MSR 000001A2: 0000-0000-8064-0000
MSR 000001A4: 0000-0000-0000-0000
MSR 000001AA: 0000-0000-0000-30C2
MSR 000001AC: < FAILED >
MSR 000001AD: 2C2C-2C2C-2C2C-2C2C
MSR 000001AE: 0807-0605-0403-0201
MSR 000001AF: < FAILED >
MSR 000001B0: 0000-0000-0000-0006
MSR 000001B1: 0000-0000-8838-0282
MSR 000001B2: 0000-0000-0200-0000
MSR 000001FC: 0000-0000-00EC-005B
MSR 00000300: < FAILED >
MSR 0000030A: 0000-0000-000E-4371
MSR 0000030B: 0000-0000-000A-D057
MSR 00000480: 03DA-0500-0000-0013
MSR 00000481: 0000-00FF-0000-0016
MSR 00000482: FFFB-FFFE-0401-E172
MSR 00000483: F77F-FFFF-0003-6DFF
MSR 00000484: 0076-FFFF-0000-11FF
MSR 00000485: 0000-0000-7004-C1E7
MSR 00000486: 0000-0000-8000-0021
MSR 00000487: 0000-0000-FFFF-FFFF
MSR 00000488: 0000-0000-0000-2000
MSR 00000489: 0000-0000-01F7-2FFF
MSR 0000048A: 0000-0000-0000-002E
MSR 0000048B: 075D-7FFF-0000-0000
MSR 0000048C: 0000-0F01-06F3-4141
MSR 0000048D: 0000-00FF-0000-0016
MSR 0000048E: FFFB-FFFE-0400-6172
MSR 0000048F: F77F-FFFF-0003-6DFB
MSR 00000490: 0076-FFFF-0000-11FB
MSR 00000601: 0000-0000-0000-03D8
MSR 00000602: < FAILED >
MSR 00000603: 0036-0000-0036-3636
MSR 00000604: < FAILED >
MSR 00000606: 0000-0000-000A-0E03
MSR 0000060A: 0000-0000-0000-0000
MSR 0000060B: 0000-0000-0000-0000
MSR 0000060C: 0000-0000-0000-0000
MSR 0000060D: 0000-0444-5ECE-7CAE
MSR 00000610: 0042-81B8-00DD-8190
MSR 00000611: 0000-0000-1B65-0CAF
MSR 00000613: 0000-0000-0000-0000
MSR 00000614: 0000-0000-0000-0078
MSR 00000618: 0000-0000-0000-0000
MSR 00000619: 0000-0000-0000-0000
MSR 0000061B: 0000-0000-0000-0000
MSR 0000061C: < FAILED >
MSR 0000061E: < FAILED >
MSR 00000620: 0000-0000-0000-0426
MSR 00000621: 0000-0000-0000-001B
MSR 00000638: 0000-0000-0000-0000
MSR 00000639: 0000-0000-063B-11B6
MSR 0000063A: 0000-0000-0000-0009
MSR 0000063B: < FAILED >
MSR 00000640: 0000-0000-0000-0000
MSR 00000641: 0000-0000-0014-E999
MSR 00000642: 0000-0000-0000-000D
MSR 00000648: 0000-0000-0000-000C
MSR 00000649: 0000-0000-0009-0060
MSR 0000064A: 0000-0000-0019-00E0
MSR 0000064B: 0000-0000-0000-0000
MSR 0000064C: 0000-0000-0000-000B
MSR 00000650: 2121-2121-2121-2121
MSR 00000651: 0807-0605-0403-0201
MSR 00000660: 0000-0104-AC8D-D5F4
MSR 00000661: < FAILED >
MSR 00000662: < FAILED >
MSR 00000663: < FAILED >
MSR 00000664: 0000-04C5-8FCB-D64A
MSR 00000665: < FAILED >
MSR 00000666: < FAILED >
MSR 00000667: < FAILED >
MSR 00000668: < FAILED >
MSR 00000669: < FAILED >
MSR 0000066A: < FAILED >
MSR 0000066B: < FAILED >
MSR 0000066C: < FAILED >
MSR 0000066D: < FAILED >
MSR 0000066E: < FAILED >
MSR 0000066F: < FAILED >
MSR 00000670: < FAILED >
MSR 00000671: < FAILED >
MSR 00000672: < FAILED >
MSR 00000673: < FAILED >
MSR 00000674: < FAILED >
MSR 00000675: < FAILED >
MSR 00000676: < FAILED >
MSR 00000677: < FAILED >
MSR 00000690: < FAILED >
MSR 000006B0: 0000-0000-0000-0000
MSR 000006B1: 0000-0000-0102-0000
MSR 00000770: 0000-0000-0000-0001
MSR 00000771: 0000-0000-010F-0921
MSR 00000772: 0000-0000-8000-FF01
MSR 00000773: 0000-0000-0000-0005
MSR 00000774: 0000-019E-5400-2101
MSR 00000777: 0000-0000-0000-0004
MSR 00000832: 0000-0000-0002-00D1
MSR 00000838: 0000-0000-0000-124F
MSR 00000839: 0000-0000-0000-09DA
MSR 0000083E: 0000-0000-0000-000A

------[ MSR Registers / Logical CPU #3 ]------

MSR 00000017: 001C-0000-0000-0000 [PlatID = 7]
MSR 0000001B: 0000-0000-FEE0-0C00
MSR 0000002A: 0000-0000-0000-0000
MSR 00000035: 0000-0000-0005-0006
MSR 00000048: 0000-0000-0000-0001
MSR 00000049: < FAILED >
MSR 0000008B: 0000-0426-0000-0000
MSR 000000CD: < FAILED >
MSR 000000CE: 0004-043D-F081-1900 [eD = 0]
MSR 000000E7: 0000-0186-1757-E588
MSR 000000E8: 0000-017C-A853-B331
MSR 000000EE: < FAILED >
MSR 0000010A: 0000-0000-0088-FD6B
MSR 0000010B: < FAILED >
MSR 0000011E: < FAILED >
MSR 00000194: 0000-0000-0011-0000
MSR 00000198: 0000-22B8-0000-2100
MSR 00000199: 0000-0000-0000-0C00
MSR 0000019A: 0000-0000-0000-0000
MSR 0000019B: 0000-0000-0000-0010
MSR 0000019C: 0000-0000-883F-0282
MSR 0000019D: 0000-0000-0000-0000
MSR 000001A0: 0000-0000-0085-0089
MSR 000001A2: 0000-0000-8064-0000
MSR 000001A4: 0000-0000-0000-0000
MSR 000001AA: 0000-0000-0000-30C2
MSR 000001AC: < FAILED >
MSR 000001AD: 2C2C-2C2C-2C2C-2C2C
MSR 000001AE: 0807-0605-0403-0201
MSR 000001AF: < FAILED >
MSR 000001B0: 0000-0000-0000-0006
MSR 000001B1: 0000-0000-8839-0282
MSR 000001B2: 0000-0000-0200-0000
MSR 000001FC: 0000-0000-00EC-005B
MSR 00000300: < FAILED >
MSR 0000030A: 0000-0000-000E-48C8
MSR 0000030B: 0000-0000-000A-D426
MSR 00000480: 03DA-0500-0000-0013
MSR 00000481: 0000-00FF-0000-0016
MSR 00000482: FFFB-FFFE-0401-E172
MSR 00000483: F77F-FFFF-0003-6DFF
MSR 00000484: 0076-FFFF-0000-11FF
MSR 00000485: 0000-0000-7004-C1E7
MSR 00000486: 0000-0000-8000-0021
MSR 00000487: 0000-0000-FFFF-FFFF
MSR 00000488: 0000-0000-0000-2000
MSR 00000489: 0000-0000-01F7-2FFF
MSR 0000048A: 0000-0000-0000-002E
MSR 0000048B: 075D-7FFF-0000-0000
MSR 0000048C: 0000-0F01-06F3-4141
MSR 0000048D: 0000-00FF-0000-0016
MSR 0000048E: FFFB-FFFE-0400-6172
MSR 0000048F: F77F-FFFF-0003-6DFB
MSR 00000490: 0076-FFFF-0000-11FB
MSR 00000601: 0000-0000-0000-03D8
MSR 00000602: < FAILED >
MSR 00000603: 0036-0000-0036-3636
MSR 00000604: < FAILED >
MSR 00000606: 0000-0000-000A-0E03
MSR 0000060A: 0000-0000-0000-0000
MSR 0000060B: 0000-0000-0000-0000
MSR 0000060C: 0000-0000-0000-0000
MSR 0000060D: 0000-0444-5ECE-7CAE
MSR 00000610: 0042-81B8-00DD-8190
MSR 00000611: 0000-0000-1B65-0D20
MSR 00000613: 0000-0000-0000-0000
MSR 00000614: 0000-0000-0000-0078
MSR 00000618: 0000-0000-0000-0000
MSR 00000619: 0000-0000-0000-0000
MSR 0000061B: 0000-0000-0000-0000
MSR 0000061C: < FAILED >
MSR 0000061E: < FAILED >
MSR 00000620: 0000-0000-0000-0426
MSR 00000621: 0000-0000-0000-001B
MSR 00000638: 0000-0000-0000-0000
MSR 00000639: 0000-0000-063B-11D7
MSR 0000063A: 0000-0000-0000-0009
MSR 0000063B: < FAILED >
MSR 00000640: 0000-0000-0000-0000
MSR 00000641: 0000-0000-0014-E999
MSR 00000642: 0000-0000-0000-000D
MSR 00000648: 0000-0000-0000-000C
MSR 00000649: 0000-0000-0009-0060
MSR 0000064A: 0000-0000-0019-00E0
MSR 0000064B: 0000-0000-0000-0000
MSR 0000064C: 0000-0000-0000-000B
MSR 00000650: 2121-2121-2121-2121
MSR 00000651: 0807-0605-0403-0201
MSR 00000660: 0000-00D9-35F3-8680
MSR 00000661: < FAILED >
MSR 00000662: < FAILED >
MSR 00000663: < FAILED >
MSR 00000664: 0000-04C5-8FCB-D64A
MSR 00000665: < FAILED >
MSR 00000666: < FAILED >
MSR 00000667: < FAILED >
MSR 00000668: < FAILED >
MSR 00000669: < FAILED >
MSR 0000066A: < FAILED >
MSR 0000066B: < FAILED >
MSR 0000066C: < FAILED >
MSR 0000066D: < FAILED >
MSR 0000066E: < FAILED >
MSR 0000066F: < FAILED >
MSR 00000670: < FAILED >
MSR 00000671: < FAILED >
MSR 00000672: < FAILED >
MSR 00000673: < FAILED >
MSR 00000674: < FAILED >
MSR 00000675: < FAILED >
MSR 00000676: < FAILED >
MSR 00000677: < FAILED >
MSR 00000690: < FAILED >
MSR 000006B0: 0000-0000-0000-0000
MSR 000006B1: 0000-0000-0102-0000
MSR 00000770: 0000-0000-0000-0001
MSR 00000771: 0000-0000-010F-0921
MSR 00000772: 0000-0000-8000-FF01
MSR 00000773: 0000-0000-0000-0005
MSR 00000774: 0000-019E-5400-2101
MSR 00000777: 0000-0000-0000-0004
MSR 00000832: 0000-0000-0003-00D1
MSR 00000838: 0000-0000-0000-0000
MSR 00000839: 0000-0000-0000-0000
MSR 0000083E: 0000-0000-0000-000A

------[ MSR Registers / Logical CPU #4 ]------

MSR 00000017: 001C-0000-0000-0000 [PlatID = 7]
MSR 0000001B: 0000-0000-FEE0-0C00
MSR 0000002A: 0000-0000-0000-0000
MSR 00000035: 0000-0000-0005-0006
MSR 00000048: 0000-0000-0000-0001
MSR 00000049: < FAILED >
MSR 0000008B: 0000-0426-0000-0000
MSR 000000CD: < FAILED >
MSR 000000CE: 0004-043D-F081-1900 [eD = 0]
MSR 000000E7: 0000-017F-2809-0620
MSR 000000E8: 0000-0174-09E2-0C58
MSR 000000EE: < FAILED >
MSR 0000010A: 0000-0000-0088-FD6B
MSR 0000010B: < FAILED >
MSR 0000011E: < FAILED >
MSR 00000194: 0000-0000-0011-0000
MSR 00000198: 0000-22B8-0000-2100
MSR 00000199: 0000-0000-0000-0C00
MSR 0000019A: 0000-0000-0000-0000
MSR 0000019B: 0000-0000-0000-0010
MSR 0000019C: 0000-0000-883F-0282
MSR 0000019D: 0000-0000-0000-0000
MSR 000001A0: 0000-0000-0085-0089
MSR 000001A2: 0000-0000-8064-0000
MSR 000001A4: 0000-0000-0000-0000
MSR 000001AA: 0000-0000-0000-30C2
MSR 000001AC: < FAILED >
MSR 000001AD: 2C2C-2C2C-2C2C-2C2C
MSR 000001AE: 0807-0605-0403-0201
MSR 000001AF: < FAILED >
MSR 000001B0: 0000-0000-0000-0006
MSR 000001B1: 0000-0000-883C-0282
MSR 000001B2: 0000-0000-0200-0000
MSR 000001FC: 0000-0000-00EC-005B
MSR 00000300: < FAILED >
MSR 0000030A: 0000-0000-000E-4392
MSR 0000030B: 0000-0000-000A-D057
MSR 00000480: 03DA-0500-0000-0013
MSR 00000481: 0000-00FF-0000-0016
MSR 00000482: FFFB-FFFE-0401-E172
MSR 00000483: F77F-FFFF-0003-6DFF
MSR 00000484: 0076-FFFF-0000-11FF
MSR 00000485: 0000-0000-7004-C1E7
MSR 00000486: 0000-0000-8000-0021
MSR 00000487: 0000-0000-FFFF-FFFF
MSR 00000488: 0000-0000-0000-2000
MSR 00000489: 0000-0000-01F7-2FFF
MSR 0000048A: 0000-0000-0000-002E
MSR 0000048B: 075D-7FFF-0000-0000
MSR 0000048C: 0000-0F01-06F3-4141
MSR 0000048D: 0000-00FF-0000-0016
MSR 0000048E: FFFB-FFFE-0400-6172
MSR 0000048F: F77F-FFFF-0003-6DFB
MSR 00000490: 0076-FFFF-0000-11FB
MSR 00000601: 0000-0000-0000-03D8
MSR 00000602: < FAILED >
MSR 00000603: 0036-0000-0036-3636
MSR 00000604: < FAILED >
MSR 00000606: 0000-0000-000A-0E03
MSR 0000060A: 0000-0000-0000-0000
MSR 0000060B: 0000-0000-0000-0000
MSR 0000060C: 0000-0000-0000-0000
MSR 0000060D: 0000-0444-5ECE-7CAE
MSR 00000610: 0042-81B8-00DD-8190
MSR 00000611: 0000-0000-1B65-0D64
MSR 00000613: 0000-0000-0000-0000
MSR 00000614: 0000-0000-0000-0078
MSR 00000618: 0000-0000-0000-0000
MSR 00000619: 0000-0000-0000-0000
MSR 0000061B: 0000-0000-0000-0000
MSR 0000061C: < FAILED >
MSR 0000061E: < FAILED >
MSR 00000620: 0000-0000-0000-0426
MSR 00000621: 0000-0000-0000-001B
MSR 00000638: 0000-0000-0000-0000
MSR 00000639: 0000-0000-063B-11D7
MSR 0000063A: 0000-0000-0000-0009
MSR 0000063B: < FAILED >
MSR 00000640: 0000-0000-0000-0000
MSR 00000641: 0000-0000-0014-E999
MSR 00000642: 0000-0000-0000-000D
MSR 00000648: 0000-0000-0000-000C
MSR 00000649: 0000-0000-0009-0060
MSR 0000064A: 0000-0000-0019-00E0
MSR 0000064B: 0000-0000-0000-0000
MSR 0000064C: 0000-0000-0000-000B
MSR 00000650: 2121-2121-2121-2121
MSR 00000651: 0807-0605-0403-0201
MSR 00000660: 0000-00B1-77A3-F43E
MSR 00000661: < FAILED >
MSR 00000662: < FAILED >
MSR 00000663: < FAILED >
MSR 00000664: 0000-04C5-8FCB-D64A
MSR 00000665: < FAILED >
MSR 00000666: < FAILED >
MSR 00000667: < FAILED >
MSR 00000668: < FAILED >
MSR 00000669: < FAILED >
MSR 0000066A: < FAILED >
MSR 0000066B: < FAILED >
MSR 0000066C: < FAILED >
MSR 0000066D: < FAILED >
MSR 0000066E: < FAILED >
MSR 0000066F: < FAILED >
MSR 00000670: < FAILED >
MSR 00000671: < FAILED >
MSR 00000672: < FAILED >
MSR 00000673: < FAILED >
MSR 00000674: < FAILED >
MSR 00000675: < FAILED >
MSR 00000676: < FAILED >
MSR 00000677: < FAILED >
MSR 00000690: < FAILED >
MSR 000006B0: 0000-0000-0000-0000
MSR 000006B1: 0000-0000-0102-0000
MSR 00000770: 0000-0000-0000-0001
MSR 00000771: 0000-0000-0110-0921
MSR 00000772: 0000-0000-8000-FF01
MSR 00000773: 0000-0000-0000-0005
MSR 00000774: 0000-019E-5400-2101
MSR 00000777: 0000-0000-0000-0004
MSR 00000832: 0000-0000-0003-00D1
MSR 00000838: 0000-0000-0000-0000
MSR 00000839: 0000-0000-0000-0000
MSR 0000083E: 0000-0000-0000-000A

------[ MSR Registers / Logical CPU #5 ]------

MSR 00000017: 001C-0000-0000-0000 [PlatID = 7]
MSR 0000001B: 0000-0000-FEE0-0C00
MSR 0000002A: 0000-0000-0000-0000
MSR 00000035: 0000-0000-0005-0006
MSR 00000048: 0000-0000-0000-0001
MSR 00000049: < FAILED >
MSR 0000008B: 0000-0426-0000-0000
MSR 000000CD: < FAILED >
MSR 000000CE: 0004-043D-F081-1900 [eD = 0]
MSR 000000E7: 0000-0183-5E67-F18C
MSR 000000E8: 0000-017B-0150-AEDD
MSR 000000EE: < FAILED >
MSR 0000010A: 0000-0000-0088-FD6B
MSR 0000010B: < FAILED >
MSR 0000011E: < FAILED >
MSR 00000194: 0000-0000-0011-0000
MSR 00000198: 0000-22B8-0000-2100
MSR 00000199: 0000-0000-0000-0C00
MSR 0000019A: 0000-0000-0000-0000
MSR 0000019B: 0000-0000-0000-0010
MSR 0000019C: 0000-0000-883F-0282
MSR 0000019D: 0000-0000-0000-0000
MSR 000001A0: 0000-0000-0085-0089
MSR 000001A2: 0000-0000-8064-0000
MSR 000001A4: 0000-0000-0000-0000
MSR 000001AA: 0000-0000-0000-30C2
MSR 000001AC: < FAILED >
MSR 000001AD: 2C2C-2C2C-2C2C-2C2C
MSR 000001AE: 0807-0605-0403-0201
MSR 000001AF: < FAILED >
MSR 000001B0: 0000-0000-0000-0006
MSR 000001B1: 0000-0000-883C-0282
MSR 000001B2: 0000-0000-0200-0000
MSR 000001FC: 0000-0000-00EC-005B
MSR 00000300: < FAILED >
MSR 0000030A: 0000-0000-000E-4C60
MSR 0000030B: 0000-0000-000A-D6F1
MSR 00000480: 03DA-0500-0000-0013
MSR 00000481: 0000-00FF-0000-0016
MSR 00000482: FFFB-FFFE-0401-E172
MSR 00000483: F77F-FFFF-0003-6DFF
MSR 00000484: 0076-FFFF-0000-11FF
MSR 00000485: 0000-0000-7004-C1E7
MSR 00000486: 0000-0000-8000-0021
MSR 00000487: 0000-0000-FFFF-FFFF
MSR 00000488: 0000-0000-0000-2000
MSR 00000489: 0000-0000-01F7-2FFF
MSR 0000048A: 0000-0000-0000-002E
MSR 0000048B: 075D-7FFF-0000-0000
MSR 0000048C: 0000-0F01-06F3-4141
MSR 0000048D: 0000-00FF-0000-0016
MSR 0000048E: FFFB-FFFE-0400-6172
MSR 0000048F: F77F-FFFF-0003-6DFB
MSR 00000490: 0076-FFFF-0000-11FB
MSR 00000601: 0000-0000-0000-03D8
MSR 00000602: < FAILED >
MSR 00000603: 0036-0000-0036-3636
MSR 00000604: < FAILED >
MSR 00000606: 0000-0000-000A-0E03
MSR 0000060A: 0000-0000-0000-0000
MSR 0000060B: 0000-0000-0000-0000
MSR 0000060C: 0000-0000-0000-0000
MSR 0000060D: 0000-0444-5ECE-7CAE
MSR 00000610: 0042-81B8-00DD-8190
MSR 00000611: 0000-0000-1B65-0DBB
MSR 00000613: 0000-0000-0000-0000
MSR 00000614: 0000-0000-0000-0078
MSR 00000618: 0000-0000-0000-0000
MSR 00000619: 0000-0000-0000-0000
MSR 0000061B: 0000-0000-0000-0000
MSR 0000061C: < FAILED >
MSR 0000061E: < FAILED >
MSR 00000620: 0000-0000-0000-0426
MSR 00000621: 0000-0000-0000-001B
MSR 00000638: 0000-0000-0000-0000
MSR 00000639: 0000-0000-063B-11D7
MSR 0000063A: 0000-0000-0000-0009
MSR 0000063B: < FAILED >
MSR 00000640: 0000-0000-0000-0000
MSR 00000641: 0000-0000-0014-E999
MSR 00000642: 0000-0000-0000-000D
MSR 00000648: 0000-0000-0000-000C
MSR 00000649: 0000-0000-0009-0060
MSR 0000064A: 0000-0000-0019-00E0
MSR 0000064B: 0000-0000-0000-0000
MSR 0000064C: 0000-0000-0000-000B
MSR 00000650: 2121-2121-2121-2121
MSR 00000651: 0807-0605-0403-0201
MSR 00000660: 0000-00AE-EFB0-4336
MSR 00000661: < FAILED >
MSR 00000662: < FAILED >
MSR 00000663: < FAILED >
MSR 00000664: 0000-04C5-8FCB-D64A
MSR 00000665: < FAILED >
MSR 00000666: < FAILED >
MSR 00000667: < FAILED >
MSR 00000668: < FAILED >
MSR 00000669: < FAILED >
MSR 0000066A: < FAILED >
MSR 0000066B: < FAILED >
MSR 0000066C: < FAILED >
MSR 0000066D: < FAILED >
MSR 0000066E: < FAILED >
MSR 0000066F: < FAILED >
MSR 00000670: < FAILED >
MSR 00000671: < FAILED >
MSR 00000672: < FAILED >
MSR 00000673: < FAILED >
MSR 00000674: < FAILED >
MSR 00000675: < FAILED >
MSR 00000676: < FAILED >
MSR 00000677: < FAILED >
MSR 00000690: < FAILED >
MSR 000006B0: 0000-0000-0000-0000
MSR 000006B1: 0000-0000-0102-0000
MSR 00000770: 0000-0000-0000-0001
MSR 00000771: 0000-0000-0110-0921
MSR 00000772: 0000-0000-8000-FF01
MSR 00000773: 0000-0000-0000-0005
MSR 00000774: 0000-019E-5400-2101
MSR 00000777: 0000-0000-0000-0004
MSR 00000832: 0000-0000-0003-00D1
MSR 00000838: 0000-0000-0000-0000
MSR 00000839: 0000-0000-0000-0000
MSR 0000083E: 0000-0000-0000-000A
