------[ CPUID Registers / Logical CPU #0 ]------

allcpu: Package 0 / Core 0 / Thread 0: Valid, Intel Core

CPUID 00000000: 00000028-756E6547-6C65746E-49656E69 [GenuineIntel]
CPUID 00000001: 000C06C3-00800800-7FFAFBFF-BFEBFBFF
CPUID 00000002: 00FEFF01-000000F0-00000000-00000000
CPUID 00000003: 00000000-00000000-00000000-00000000
CPUID 00000004: FC004121-02C0003F-0000003F-00000000 [SL 00] [L1D: 48 KB]
CPUID 00000004: FC004122-03C0003F-0000003F-00000000 [SL 01] [L1I: 64 KB]
CPUID 00000004: FC01C143-02C0003F-00000FFF-00000000 [SL 02] [L2U: 3 MB]
CPUID 00000004: FC0FC163-02C0003F-00003FFF-00000004 [SL 03] [L3U: 12 MB]
CPUID 00000005: 00000040-00000040-00000003-10002020
CPUID 00000006: 00DFCFF7-00000002-00000409-00000003
CPUID 00000007: 00000002-239CA7EB-994007BC-FC18C430 [SL 00]
CPUID 00000007: 4CCE09D7-00000001-00000002-00040430 [SL 01]
CPUID 00000007: 00000000-00000000-00000000-000000BF [SL 02]
CPUID 00000008: 00000000-00000000-00000000-00000000
CPUID 00000009: 00000000-00000000-00000000-00000000
CPUID 0000000A: 0D300806-00000280-00000007-00008603
CPUID 0000000B: 00000001-00000001-00000100-00000000 [SL 00]
CPUID 0000000B: 00000007-00000008-00000201-00000000 [SL 01]
CPUID 0000000C: 00000000-00000000-00000000-00000000
CPUID 0000000D: 00000207-00000A88-00000A88-00000000 [SL 00] [x87]
CPUID 0000000D: 0000000F-00000698-0001D900-00000000 [SL 01] [SSE]
CPUID 0000000D: 00000100-00000240-00000000-00000000 [SL 02] [AVX]
CPUID 0000000D: 00000080-00000000-00000001-00000000 [SL 08] [PT]
CPUID 0000000D: 00000008-00000A80-00000000-00000000 [SL 09] [PKRU]
CPUID 0000000D: 00000010-00000000-00000001-00000000 [SL 0B] [CET_U]
CPUID 0000000D: 00000018-00000000-00000001-00000000 [SL 0C] [CET_S]
CPUID 0000000D: 00000030-00000000-00000001-00000000 [SL 0E] [UINTR]
CPUID 0000000D: 00000328-00000000-00000001-00000000 [SL 0F] [LBR]
CPUID 0000000D: 00000008-00000000-00000001-00000000 [SL 10] [HWP]
CPUID 0000000E: 00000000-00000000-00000000-00000000
CPUID 0000000F: 00000000-00000000-00000000-00000000 [SL 00]
CPUID 0000000F: 00000000-00000000-00000000-00000000 [SL 01]
CPUID 00000010: 00000000-00000040-00000000-00000000 [SL 00]
CPUID 00000010: 00000003-00000000-00000000-00000000 [SL 06]
CPUID 00000011: 00000000-00000000-00000000-00000000
CPUID 00000012: 00000000-00000000-00000000-00000000 [SL 00]
CPUID 00000012: 00000000-00000000-00000000-00000000 [SL 01]
CPUID 00000013: 00000000-00000000-00000000-00000000
CPUID 00000014: 00000001-0000015F-00000007-00000000 [SL 00]
CPUID 00000014: 02490002-003F003F-00000000-00000000 [SL 01]
CPUID 00000015: 00000002-000000AC-0249F000-00000000 [86.00x / 38400000 / 3302.40]
CPUID 00000016: 00000CE4-0000125C-00000064-00000000 [3300 / 4700 / 100]
CPUID 00000017: 00000000-00000000-00000000-00000000 [SL 00]
CPUID 00000018: 00000008-00000000-00000000-00000000 [SL 00]
CPUID 00000018: 00000000-00080001-00000020-00004022 [SL 01]
CPUID 00000018: 00000000-00080006-00000004-00004022 [SL 02]
CPUID 00000018: 00000000-0010000F-00000001-00004125 [SL 03]
CPUID 00000018: 00000000-00080001-00000010-00004024 [SL 04]
CPUID 00000018: 00000000-00040006-00000008-00004024 [SL 05]
CPUID 00000018: 00000000-00080008-00000001-00004124 [SL 06]
CPUID 00000018: 00000000-00080007-00000100-00004043 [SL 07]
CPUID 00000018: 00000000-00040009-00000100-00004043 [SL 08]
CPUID 00000019: 00000000-00000000-00000000-00000000
CPUID 0000001A: 40000004-00000000-00000000-00000000 [Core: Cougar Cove]
CPUID 0000001B: 00000000-00000000-00000000-00000000 [SL 00]
CPUID 0000001C: 4000000B-00000007-000F0007-00000000
CPUID 0000001D: 00000000-00000000-00000000-00000000 [SL 00]
CPUID 0000001E: 00000000-00000000-00000000-00000000 [SL 00]
CPUID 0000001F: 00000001-00000001-00000100-00000000 [SL 00]
CPUID 0000001F: 00000003-00000001-00000201-00000000 [SL 01]
CPUID 0000001F: 00000007-00000008-00000302-00000000 [SL 02]
CPUID 00000020: 00000000-00000001-00000000-00000000 [SL 00]
CPUID 00000021: 00000000-00000000-00000000-00000000
CPUID 00000022: 00000000-00000000-00000000-00000000
CPUID 00000023: 0000003B-00000003-00000000-00000000 [SL 00]
CPUID 00000023: 000003FF-0000000F-00000000-00000000 [SL 01]
CPUID 00000023: 00000000-00000000-00000000-00000000 [SL 02]
CPUID 00000023: 00001DFF-00000000-00000000-00000000 [SL 03]
CPUID 00000023: 00000000-60060378-00000000-00000000 [SL 04]
CPUID 00000023: 000003FF-00000003-0000000F-00000001 [SL 05]
CPUID 00000023: 00000000-00000000-00000000-00000000 [SL 06]
CPUID 00000023: 00000000-00000000-00000000-00000000 [SL 07]
CPUID 00000023: 00000000-00000000-00000000-00000000 [SL 08]
CPUID 00000023: 00000000-00000000-00000000-00000000 [SL 09]
CPUID 00000023: 00000000-00000000-00000000-00000000 [SL 0A]
CPUID 00000023: 00000000-00000000-00000000-00000000 [SL 0B]
CPUID 00000023: 00000000-00000000-00000000-00000000 [SL 0C]
CPUID 00000023: 00000000-00000000-00000000-00000000 [SL 0D]
CPUID 00000023: 00000000-00000000-00000000-00000000 [SL 0E]
CPUID 00000023: 00000000-00000000-00000000-00000000 [SL 0F]
CPUID 00000024: 00000000-00000000-00000000-00000000 [SL 00]
CPUID 00000025: 00000000-00000000-00000000-00000000
CPUID 00000026: 00000000-00000000-00000000-00000000
CPUID 00000027: 00000000-00000000-00000000-00000000 [SL 00]
CPUID 00000028: 00000000-00000040-00000000-00000000 [SL 00]
CPUID 00000028: 00000003-00000000-00000000-00000000 [SL 06]
CPUID 80000000: 80000008-00000000-00000000-00000000
CPUID 80000001: 00000000-00000000-00000121-2C100800
CPUID 80000002: 65746E49-2952286C-726F4320-4D542865 [Intel(R) Core(TM]
CPUID 80000003: 6C552029-20617274-35332037-00000035 [) Ultra 7 355]
CPUID 80000004: 00000000-00000000-00000000-00000000 []
CPUID 80000005: 00000000-00000000-00000000-00000000 [L1D: 0 KB / L1I: 0 KB]
CPUID 80000006: 00000000-00000000-0C007040-00000000 [L2: 3072 KB / L3: 0 KB]
CPUID 80000007: 00000000-00000000-00000000-00000100
CPUID 80000008: 0000302E-00000200-00000000-00000000

L1    Data Cache:    48 KB, 12-way Associative, 64-byte Line
L1  Instr. Cache:    64 KB, 16-way Associative, 64-byte Line
L2 Unified Cache:     3 MB, 12-way Associative, 64-byte Line
L3 Unified Cache:    12 MB, 12-way Associative, 64-byte Line

------[ CPUID Registers / Logical CPU #1 ]------

allcpu: Package 0 / Core 4 / Thread 0: Valid, Intel Core

CPUID 00000000: 00000028-756E6547-6C65746E-49656E69 [GenuineIntel]
CPUID 00000001: 000C06C3-08800800-7FFAFBFF-BFEBFBFF
CPUID 00000002: 00FEFF01-000000F0-00000000-00000000
CPUID 00000003: 00000000-00000000-00000000-00000000
CPUID 00000004: FC004121-02C0003F-0000003F-00000000 [SL 00] [L1D: 48 KB]
CPUID 00000004: FC004122-03C0003F-0000003F-00000000 [SL 01] [L1I: 64 KB]
CPUID 00000004: FC01C143-02C0003F-00000FFF-00000000 [SL 02] [L2U: 3 MB]
CPUID 00000004: FC0FC163-02C0003F-00003FFF-00000004 [SL 03] [L3U: 12 MB]
CPUID 00000005: 00000040-00000040-00000003-10002020
CPUID 00000006: 00DFCFF7-00000002-00000409-00010003
CPUID 00000007: 00000002-239CA7EB-994007BC-FC18C430 [SL 00]
CPUID 00000007: 4CCE09D7-00000001-00000002-00040430 [SL 01]
CPUID 00000007: 00000000-00000000-00000000-000000BF [SL 02]
CPUID 00000008: 00000000-00000000-00000000-00000000
CPUID 00000009: 00000000-00000000-00000000-00000000
CPUID 0000000A: 0D300806-00000280-00000007-00008603
CPUID 0000000B: 00000001-00000001-00000100-00000008 [SL 00]
CPUID 0000000B: 00000007-00000008-00000201-00000008 [SL 01]
CPUID 0000000C: 00000000-00000000-00000000-00000000
CPUID 0000000D: 00000207-00000A88-00000A88-00000000 [SL 00] [x87]
CPUID 0000000D: 0000000F-00000698-0001D900-00000000 [SL 01] [SSE]
CPUID 0000000D: 00000100-00000240-00000000-00000000 [SL 02] [AVX]
CPUID 0000000D: 00000080-00000000-00000001-00000000 [SL 08] [PT]
CPUID 0000000D: 00000008-00000A80-00000000-00000000 [SL 09] [PKRU]
CPUID 0000000D: 00000010-00000000-00000001-00000000 [SL 0B] [CET_U]
CPUID 0000000D: 00000018-00000000-00000001-00000000 [SL 0C] [CET_S]
CPUID 0000000D: 00000030-00000000-00000001-00000000 [SL 0E] [UINTR]
CPUID 0000000D: 00000328-00000000-00000001-00000000 [SL 0F] [LBR]
CPUID 0000000D: 00000008-00000000-00000001-00000000 [SL 10] [HWP]
CPUID 0000000E: 00000000-00000000-00000000-00000000
CPUID 0000000F: 00000000-00000000-00000000-00000000 [SL 00]
CPUID 0000000F: 00000000-00000000-00000000-00000000 [SL 01]
CPUID 00000010: 00000000-00000040-00000000-00000000 [SL 00]
CPUID 00000010: 00000003-00000000-00000000-00000000 [SL 06]
CPUID 00000011: 00000000-00000000-00000000-00000000
CPUID 00000012: 00000000-00000000-00000000-00000000 [SL 00]
CPUID 00000012: 00000000-00000000-00000000-00000000 [SL 01]
CPUID 00000013: 00000000-00000000-00000000-00000000
CPUID 00000014: 00000001-0000015F-00000007-00000000 [SL 00]
CPUID 00000014: 02490002-003F003F-00000000-00000000 [SL 01]
CPUID 00000015: 00000002-000000AC-0249F000-00000000 [86.00x / 38400000 / 3302.40]
CPUID 00000016: 00000CE4-0000125C-00000064-00000000 [3300 / 4700 / 100]
CPUID 00000017: 00000000-00000000-00000000-00000000 [SL 00]
CPUID 00000018: 00000008-00000000-00000000-00000000 [SL 00]
CPUID 00000018: 00000000-00080001-00000020-00004022 [SL 01]
CPUID 00000018: 00000000-00080006-00000004-00004022 [SL 02]
CPUID 00000018: 00000000-0010000F-00000001-00004125 [SL 03]
CPUID 00000018: 00000000-00080001-00000010-00004024 [SL 04]
CPUID 00000018: 00000000-00040006-00000008-00004024 [SL 05]
CPUID 00000018: 00000000-00080008-00000001-00004124 [SL 06]
CPUID 00000018: 00000000-00080007-00000100-00004043 [SL 07]
CPUID 00000018: 00000000-00040009-00000100-00004043 [SL 08]
CPUID 00000019: 00000000-00000000-00000000-00000000
CPUID 0000001A: 40000004-00000000-00000000-00000000 [Core: Cougar Cove]
CPUID 0000001B: 00000000-00000000-00000000-00000000 [SL 00]
CPUID 0000001C: 4000000B-00000007-000F0007-00000000
CPUID 0000001D: 00000000-00000000-00000000-00000000 [SL 00]
CPUID 0000001E: 00000000-00000000-00000000-00000000 [SL 00]
CPUID 0000001F: 00000001-00000001-00000100-00000008 [SL 00]
CPUID 0000001F: 00000003-00000001-00000201-00000008 [SL 01]
CPUID 0000001F: 00000007-00000008-00000302-00000008 [SL 02]
CPUID 00000020: 00000000-00000001-00000000-00000000 [SL 00]
CPUID 00000021: 00000000-00000000-00000000-00000000
CPUID 00000022: 00000000-00000000-00000000-00000000
CPUID 00000023: 0000003B-00000003-00000000-00000000 [SL 00]
CPUID 00000023: 000003FF-0000000F-00000000-00000000 [SL 01]
CPUID 00000023: 00000000-00000000-00000000-00000000 [SL 02]
CPUID 00000023: 00001DFF-00000000-00000000-00000000 [SL 03]
CPUID 00000023: 00000000-60060378-00000000-00000000 [SL 04]
CPUID 00000023: 000003FF-00000003-0000000F-00000001 [SL 05]
CPUID 00000023: 00000000-00000000-00000000-00000000 [SL 06]
CPUID 00000023: 00000000-00000000-00000000-00000000 [SL 07]
CPUID 00000023: 00000000-00000000-00000000-00000000 [SL 08]
CPUID 00000023: 00000000-00000000-00000000-00000000 [SL 09]
CPUID 00000023: 00000000-00000000-00000000-00000000 [SL 0A]
CPUID 00000023: 00000000-00000000-00000000-00000000 [SL 0B]
CPUID 00000023: 00000000-00000000-00000000-00000000 [SL 0C]
CPUID 00000023: 00000000-00000000-00000000-00000000 [SL 0D]
CPUID 00000023: 00000000-00000000-00000000-00000000 [SL 0E]
CPUID 00000023: 00000000-00000000-00000000-00000000 [SL 0F]
CPUID 00000024: 00000000-00000000-00000000-00000000 [SL 00]
CPUID 00000025: 00000000-00000000-00000000-00000000
CPUID 00000026: 00000000-00000000-00000000-00000000
CPUID 00000027: 00000000-00000000-00000000-00000000 [SL 00]
CPUID 00000028: 00000000-00000040-00000000-00000000 [SL 00]
CPUID 00000028: 00000003-00000000-00000000-00000000 [SL 06]
CPUID 80000000: 80000008-00000000-00000000-00000000
CPUID 80000001: 00000000-00000000-00000121-2C100800
CPUID 80000002: 65746E49-2952286C-726F4320-4D542865 [Intel(R) Core(TM]
CPUID 80000003: 6C552029-20617274-35332037-00000035 [) Ultra 7 355]
CPUID 80000004: 00000000-00000000-00000000-00000000 []
CPUID 80000005: 00000000-00000000-00000000-00000000 [L1D: 0 KB / L1I: 0 KB]
CPUID 80000006: 00000000-00000000-0C007040-00000000 [L2: 3072 KB / L3: 0 KB]
CPUID 80000007: 00000000-00000000-00000000-00000100
CPUID 80000008: 0000302E-00000200-00000000-00000000

L1    Data Cache:    48 KB, 12-way Associative, 64-byte Line
L1  Instr. Cache:    64 KB, 16-way Associative, 64-byte Line
L2 Unified Cache:     3 MB, 12-way Associative, 64-byte Line
L3 Unified Cache:    12 MB, 12-way Associative, 64-byte Line

------[ CPUID Registers / Logical CPU #2 ]------

allcpu: Package 0 / Core 8 / Thread 0: Valid, Intel Core

CPUID 00000000: 00000028-756E6547-6C65746E-49656E69 [GenuineIntel]
CPUID 00000001: 000C06C3-10800800-7FFAFBFF-BFEBFBFF
CPUID 00000002: 00FEFF01-000000F0-00000000-00000000
CPUID 00000003: 00000000-00000000-00000000-00000000
CPUID 00000004: FC004121-02C0003F-0000003F-00000000 [SL 00] [L1D: 48 KB]
CPUID 00000004: FC004122-03C0003F-0000003F-00000000 [SL 01] [L1I: 64 KB]
CPUID 00000004: FC01C143-02C0003F-00000FFF-00000000 [SL 02] [L2U: 3 MB]
CPUID 00000004: FC0FC163-02C0003F-00003FFF-00000004 [SL 03] [L3U: 12 MB]
CPUID 00000005: 00000040-00000040-00000003-10002020
CPUID 00000006: 00DFCFF7-00000002-00000409-00020003
CPUID 00000007: 00000002-239CA7EB-994007BC-FC18C430 [SL 00]
CPUID 00000007: 4CCE09D7-00000001-00000002-00040430 [SL 01]
CPUID 00000007: 00000000-00000000-00000000-000000BF [SL 02]
CPUID 00000008: 00000000-00000000-00000000-00000000
CPUID 00000009: 00000000-00000000-00000000-00000000
CPUID 0000000A: 0D300806-00000280-00000007-00008603
CPUID 0000000B: 00000001-00000001-00000100-00000010 [SL 00]
CPUID 0000000B: 00000007-00000008-00000201-00000010 [SL 01]
CPUID 0000000C: 00000000-00000000-00000000-00000000
CPUID 0000000D: 00000207-00000A88-00000A88-00000000 [SL 00] [x87]
CPUID 0000000D: 0000000F-00000698-0001D900-00000000 [SL 01] [SSE]
CPUID 0000000D: 00000100-00000240-00000000-00000000 [SL 02] [AVX]
CPUID 0000000D: 00000080-00000000-00000001-00000000 [SL 08] [PT]
CPUID 0000000D: 00000008-00000A80-00000000-00000000 [SL 09] [PKRU]
CPUID 0000000D: 00000010-00000000-00000001-00000000 [SL 0B] [CET_U]
CPUID 0000000D: 00000018-00000000-00000001-00000000 [SL 0C] [CET_S]
CPUID 0000000D: 00000030-00000000-00000001-00000000 [SL 0E] [UINTR]
CPUID 0000000D: 00000328-00000000-00000001-00000000 [SL 0F] [LBR]
CPUID 0000000D: 00000008-00000000-00000001-00000000 [SL 10] [HWP]
CPUID 0000000E: 00000000-00000000-00000000-00000000
CPUID 0000000F: 00000000-00000000-00000000-00000000 [SL 00]
CPUID 0000000F: 00000000-00000000-00000000-00000000 [SL 01]
CPUID 00000010: 00000000-00000040-00000000-00000000 [SL 00]
CPUID 00000010: 00000003-00000000-00000000-00000000 [SL 06]
CPUID 00000011: 00000000-00000000-00000000-00000000
CPUID 00000012: 00000000-00000000-00000000-00000000 [SL 00]
CPUID 00000012: 00000000-00000000-00000000-00000000 [SL 01]
CPUID 00000013: 00000000-00000000-00000000-00000000
CPUID 00000014: 00000001-0000015F-00000007-00000000 [SL 00]
CPUID 00000014: 02490002-003F003F-00000000-00000000 [SL 01]
CPUID 00000015: 00000002-000000AC-0249F000-00000000 [86.00x / 38400000 / 3302.40]
CPUID 00000016: 00000CE4-0000125C-00000064-00000000 [3300 / 4700 / 100]
CPUID 00000017: 00000000-00000000-00000000-00000000 [SL 00]
CPUID 00000018: 00000008-00000000-00000000-00000000 [SL 00]
CPUID 00000018: 00000000-00080001-00000020-00004022 [SL 01]
CPUID 00000018: 00000000-00080006-00000004-00004022 [SL 02]
CPUID 00000018: 00000000-0010000F-00000001-00004125 [SL 03]
CPUID 00000018: 00000000-00080001-00000010-00004024 [SL 04]
CPUID 00000018: 00000000-00040006-00000008-00004024 [SL 05]
CPUID 00000018: 00000000-00080008-00000001-00004124 [SL 06]
CPUID 00000018: 00000000-00080007-00000100-00004043 [SL 07]
CPUID 00000018: 00000000-00040009-00000100-00004043 [SL 08]
CPUID 00000019: 00000000-00000000-00000000-00000000
CPUID 0000001A: 40000004-00000000-00000000-00000000 [Core: Cougar Cove]
CPUID 0000001B: 00000000-00000000-00000000-00000000 [SL 00]
CPUID 0000001C: 4000000B-00000007-000F0007-00000000
CPUID 0000001D: 00000000-00000000-00000000-00000000 [SL 00]
CPUID 0000001E: 00000000-00000000-00000000-00000000 [SL 00]
CPUID 0000001F: 00000001-00000001-00000100-00000010 [SL 00]
CPUID 0000001F: 00000003-00000001-00000201-00000010 [SL 01]
CPUID 0000001F: 00000007-00000008-00000302-00000010 [SL 02]
CPUID 00000020: 00000000-00000001-00000000-00000000 [SL 00]
CPUID 00000021: 00000000-00000000-00000000-00000000
CPUID 00000022: 00000000-00000000-00000000-00000000
CPUID 00000023: 0000003B-00000003-00000000-00000000 [SL 00]
CPUID 00000023: 000003FF-0000000F-00000000-00000000 [SL 01]
CPUID 00000023: 00000000-00000000-00000000-00000000 [SL 02]
CPUID 00000023: 00001DFF-00000000-00000000-00000000 [SL 03]
CPUID 00000023: 00000000-60060378-00000000-00000000 [SL 04]
CPUID 00000023: 000003FF-00000003-0000000F-00000001 [SL 05]
CPUID 00000023: 00000000-00000000-00000000-00000000 [SL 06]
CPUID 00000023: 00000000-00000000-00000000-00000000 [SL 07]
CPUID 00000023: 00000000-00000000-00000000-00000000 [SL 08]
CPUID 00000023: 00000000-00000000-00000000-00000000 [SL 09]
CPUID 00000023: 00000000-00000000-00000000-00000000 [SL 0A]
CPUID 00000023: 00000000-00000000-00000000-00000000 [SL 0B]
CPUID 00000023: 00000000-00000000-00000000-00000000 [SL 0C]
CPUID 00000023: 00000000-00000000-00000000-00000000 [SL 0D]
CPUID 00000023: 00000000-00000000-00000000-00000000 [SL 0E]
CPUID 00000023: 00000000-00000000-00000000-00000000 [SL 0F]
CPUID 00000024: 00000000-00000000-00000000-00000000 [SL 00]
CPUID 00000025: 00000000-00000000-00000000-00000000
CPUID 00000026: 00000000-00000000-00000000-00000000
CPUID 00000027: 00000000-00000000-00000000-00000000 [SL 00]
CPUID 00000028: 00000000-00000040-00000000-00000000 [SL 00]
CPUID 00000028: 00000003-00000000-00000000-00000000 [SL 06]
CPUID 80000000: 80000008-00000000-00000000-00000000
CPUID 80000001: 00000000-00000000-00000121-2C100800
CPUID 80000002: 65746E49-2952286C-726F4320-4D542865 [Intel(R) Core(TM]
CPUID 80000003: 6C552029-20617274-35332037-00000035 [) Ultra 7 355]
CPUID 80000004: 00000000-00000000-00000000-00000000 []
CPUID 80000005: 00000000-00000000-00000000-00000000 [L1D: 0 KB / L1I: 0 KB]
CPUID 80000006: 00000000-00000000-0C007040-00000000 [L2: 3072 KB / L3: 0 KB]
CPUID 80000007: 00000000-00000000-00000000-00000100
CPUID 80000008: 0000302E-00000200-00000000-00000000

L1    Data Cache:    48 KB, 12-way Associative, 64-byte Line
L1  Instr. Cache:    64 KB, 16-way Associative, 64-byte Line
L2 Unified Cache:     3 MB, 12-way Associative, 64-byte Line
L3 Unified Cache:    12 MB, 12-way Associative, 64-byte Line

------[ CPUID Registers / Logical CPU #3 ]------

allcpu: Package 0 / Core 12 / Thread 0: Valid, Intel Core

CPUID 00000000: 00000028-756E6547-6C65746E-49656E69 [GenuineIntel]
CPUID 00000001: 000C06C3-18800800-7FFAFBFF-BFEBFBFF
CPUID 00000002: 00FEFF01-000000F0-00000000-00000000
CPUID 00000003: 00000000-00000000-00000000-00000000
CPUID 00000004: FC004121-02C0003F-0000003F-00000000 [SL 00] [L1D: 48 KB]
CPUID 00000004: FC004122-03C0003F-0000003F-00000000 [SL 01] [L1I: 64 KB]
CPUID 00000004: FC01C143-02C0003F-00000FFF-00000000 [SL 02] [L2U: 3 MB]
CPUID 00000004: FC0FC163-02C0003F-00003FFF-00000004 [SL 03] [L3U: 12 MB]
CPUID 00000005: 00000040-00000040-00000003-10002020
CPUID 00000006: 00DFCFF7-00000002-00000409-00030003
CPUID 00000007: 00000002-239CA7EB-994007BC-FC18C430 [SL 00]
CPUID 00000007: 4CCE09D7-00000001-00000002-00040430 [SL 01]
CPUID 00000007: 00000000-00000000-00000000-000000BF [SL 02]
CPUID 00000008: 00000000-00000000-00000000-00000000
CPUID 00000009: 00000000-00000000-00000000-00000000
CPUID 0000000A: 0D300806-00000280-00000007-00008603
CPUID 0000000B: 00000001-00000001-00000100-00000018 [SL 00]
CPUID 0000000B: 00000007-00000008-00000201-00000018 [SL 01]
CPUID 0000000C: 00000000-00000000-00000000-00000000
CPUID 0000000D: 00000207-00000A88-00000A88-00000000 [SL 00] [x87]
CPUID 0000000D: 0000000F-00000698-0001D900-00000000 [SL 01] [SSE]
CPUID 0000000D: 00000100-00000240-00000000-00000000 [SL 02] [AVX]
CPUID 0000000D: 00000080-00000000-00000001-00000000 [SL 08] [PT]
CPUID 0000000D: 00000008-00000A80-00000000-00000000 [SL 09] [PKRU]
CPUID 0000000D: 00000010-00000000-00000001-00000000 [SL 0B] [CET_U]
CPUID 0000000D: 00000018-00000000-00000001-00000000 [SL 0C] [CET_S]
CPUID 0000000D: 00000030-00000000-00000001-00000000 [SL 0E] [UINTR]
CPUID 0000000D: 00000328-00000000-00000001-00000000 [SL 0F] [LBR]
CPUID 0000000D: 00000008-00000000-00000001-00000000 [SL 10] [HWP]
CPUID 0000000E: 00000000-00000000-00000000-00000000
CPUID 0000000F: 00000000-00000000-00000000-00000000 [SL 00]
CPUID 0000000F: 00000000-00000000-00000000-00000000 [SL 01]
CPUID 00000010: 00000000-00000040-00000000-00000000 [SL 00]
CPUID 00000010: 00000003-00000000-00000000-00000000 [SL 06]
CPUID 00000011: 00000000-00000000-00000000-00000000
CPUID 00000012: 00000000-00000000-00000000-00000000 [SL 00]
CPUID 00000012: 00000000-00000000-00000000-00000000 [SL 01]
CPUID 00000013: 00000000-00000000-00000000-00000000
CPUID 00000014: 00000001-0000015F-00000007-00000000 [SL 00]
CPUID 00000014: 02490002-003F003F-00000000-00000000 [SL 01]
CPUID 00000015: 00000002-000000AC-0249F000-00000000 [86.00x / 38400000 / 3302.40]
CPUID 00000016: 00000CE4-0000125C-00000064-00000000 [3300 / 4700 / 100]
CPUID 00000017: 00000000-00000000-00000000-00000000 [SL 00]
CPUID 00000018: 00000008-00000000-00000000-00000000 [SL 00]
CPUID 00000018: 00000000-00080001-00000020-00004022 [SL 01]
CPUID 00000018: 00000000-00080006-00000004-00004022 [SL 02]
CPUID 00000018: 00000000-0010000F-00000001-00004125 [SL 03]
CPUID 00000018: 00000000-00080001-00000010-00004024 [SL 04]
CPUID 00000018: 00000000-00040006-00000008-00004024 [SL 05]
CPUID 00000018: 00000000-00080008-00000001-00004124 [SL 06]
CPUID 00000018: 00000000-00080007-00000100-00004043 [SL 07]
CPUID 00000018: 00000000-00040009-00000100-00004043 [SL 08]
CPUID 00000019: 00000000-00000000-00000000-00000000
CPUID 0000001A: 40000004-00000000-00000000-00000000 [Core: Cougar Cove]
CPUID 0000001B: 00000000-00000000-00000000-00000000 [SL 00]
CPUID 0000001C: 4000000B-00000007-000F0007-00000000
CPUID 0000001D: 00000000-00000000-00000000-00000000 [SL 00]
CPUID 0000001E: 00000000-00000000-00000000-00000000 [SL 00]
CPUID 0000001F: 00000001-00000001-00000100-00000018 [SL 00]
CPUID 0000001F: 00000003-00000001-00000201-00000018 [SL 01]
CPUID 0000001F: 00000007-00000008-00000302-00000018 [SL 02]
CPUID 00000020: 00000000-00000001-00000000-00000000 [SL 00]
CPUID 00000021: 00000000-00000000-00000000-00000000
CPUID 00000022: 00000000-00000000-00000000-00000000
CPUID 00000023: 0000003B-00000003-00000000-00000000 [SL 00]
CPUID 00000023: 000003FF-0000000F-00000000-00000000 [SL 01]
CPUID 00000023: 00000000-00000000-00000000-00000000 [SL 02]
CPUID 00000023: 00001DFF-00000000-00000000-00000000 [SL 03]
CPUID 00000023: 00000000-60060378-00000000-00000000 [SL 04]
CPUID 00000023: 000003FF-00000003-0000000F-00000001 [SL 05]
CPUID 00000023: 00000000-00000000-00000000-00000000 [SL 06]
CPUID 00000023: 00000000-00000000-00000000-00000000 [SL 07]
CPUID 00000023: 00000000-00000000-00000000-00000000 [SL 08]
CPUID 00000023: 00000000-00000000-00000000-00000000 [SL 09]
CPUID 00000023: 00000000-00000000-00000000-00000000 [SL 0A]
CPUID 00000023: 00000000-00000000-00000000-00000000 [SL 0B]
CPUID 00000023: 00000000-00000000-00000000-00000000 [SL 0C]
CPUID 00000023: 00000000-00000000-00000000-00000000 [SL 0D]
CPUID 00000023: 00000000-00000000-00000000-00000000 [SL 0E]
CPUID 00000023: 00000000-00000000-00000000-00000000 [SL 0F]
CPUID 00000024: 00000000-00000000-00000000-00000000 [SL 00]
CPUID 00000025: 00000000-00000000-00000000-00000000
CPUID 00000026: 00000000-00000000-00000000-00000000
CPUID 00000027: 00000000-00000000-00000000-00000000 [SL 00]
CPUID 00000028: 00000000-00000040-00000000-00000000 [SL 00]
CPUID 00000028: 00000003-00000000-00000000-00000000 [SL 06]
CPUID 80000000: 80000008-00000000-00000000-00000000
CPUID 80000001: 00000000-00000000-00000121-2C100800
CPUID 80000002: 65746E49-2952286C-726F4320-4D542865 [Intel(R) Core(TM]
CPUID 80000003: 6C552029-20617274-35332037-00000035 [) Ultra 7 355]
CPUID 80000004: 00000000-00000000-00000000-00000000 []
CPUID 80000005: 00000000-00000000-00000000-00000000 [L1D: 0 KB / L1I: 0 KB]
CPUID 80000006: 00000000-00000000-0C007040-00000000 [L2: 3072 KB / L3: 0 KB]
CPUID 80000007: 00000000-00000000-00000000-00000100
CPUID 80000008: 0000302E-00000200-00000000-00000000

L1    Data Cache:    48 KB, 12-way Associative, 64-byte Line
L1  Instr. Cache:    64 KB, 16-way Associative, 64-byte Line
L2 Unified Cache:     3 MB, 12-way Associative, 64-byte Line
L3 Unified Cache:    12 MB, 12-way Associative, 64-byte Line

------[ CPUID Registers / Logical CPU #4 ]------

allcpu: Package 0 / Core 32 / Thread 0: Valid, Intel Atom

CPUID 00000000: 00000028-756E6547-6C65746E-49656E69 [GenuineIntel]
CPUID 00000001: 000C06C3-40800800-7FFAFBFF-BFEBFBFF
CPUID 00000002: 00FEFF01-000000F0-00000000-00000000
CPUID 00000003: 00000000-00000000-00000000-00000000
CPUID 00000004: FC000121-01C0003F-0000003F-00000001 [SL 00] [L1D: 32 KB]
CPUID 00000004: FC000122-01C0003F-0000007F-00000001 [SL 01] [L1I: 64 KB]
CPUID 00000004: FC01C143-03C0003F-00000FFF-00000001 [SL 02] [L2U: 4 MB]
CPUID 00000005: 00000040-00000040-00000003-10002020
CPUID 00000006: 00DFCFF7-00000002-00000409-00040003
CPUID 00000007: 00000002-239CA7EB-994007BC-FC18C430 [SL 00]
CPUID 00000007: 4CCE09D7-00000001-00000002-00040430 [SL 01]
CPUID 00000007: 00000000-00000000-00000000-000000BF [SL 02]
CPUID 00000008: 00000000-00000000-00000000-00000000
CPUID 00000009: 00000000-00000000-00000000-00000000
CPUID 0000000A: 0D300806-00000280-00000007-00008603
CPUID 0000000B: 00000001-00000001-00000100-00000040 [SL 00]
CPUID 0000000B: 00000007-00000008-00000201-00000040 [SL 01]
CPUID 0000000C: 00000000-00000000-00000000-00000000
CPUID 0000000D: 00000207-00000A88-00000A88-00000000 [SL 00] [x87]
CPUID 0000000D: 0000000F-00000698-0001D900-00000000 [SL 01] [SSE]
CPUID 0000000D: 00000100-00000240-00000000-00000000 [SL 02] [AVX]
CPUID 0000000D: 00000080-00000000-00000001-00000000 [SL 08] [PT]
CPUID 0000000D: 00000008-00000A80-00000000-00000000 [SL 09] [PKRU]
CPUID 0000000D: 00000010-00000000-00000001-00000000 [SL 0B] [CET_U]
CPUID 0000000D: 00000018-00000000-00000001-00000000 [SL 0C] [CET_S]
CPUID 0000000D: 00000030-00000000-00000001-00000000 [SL 0E] [UINTR]
CPUID 0000000D: 00000328-00000000-00000001-00000000 [SL 0F] [LBR]
CPUID 0000000D: 00000008-00000000-00000001-00000000 [SL 10] [HWP]
CPUID 0000000E: 00000000-00000000-00000000-00000000
CPUID 0000000F: 00000000-00000000-00000000-00000000 [SL 00]
CPUID 0000000F: 00000000-00000000-00000000-00000000 [SL 01]
CPUID 00000010: 00000000-00000040-00000000-00000000 [SL 00]
CPUID 00000010: 00000003-00000000-00000000-00000000 [SL 06]
CPUID 00000011: 00000000-00000000-00000000-00000000
CPUID 00000012: 00000000-00000000-00000000-00000000 [SL 00]
CPUID 00000012: 00000000-00000000-00000000-00000000 [SL 01]
CPUID 00000013: 00000000-00000000-00000000-00000000
CPUID 00000014: 00000001-0000015F-80000007-00000000 [SL 00]
CPUID 00000014: 02490002-003F003F-00000000-00000000 [SL 01]
CPUID 00000015: 00000002-000000AC-0249F000-00000000 [86.00x / 38400000 / 3302.40]
CPUID 00000016: 00000CE4-00000DAC-00000064-00000000 [3300 / 3500 / 100]
CPUID 00000017: 00000000-00000000-00000000-00000000 [SL 00]
CPUID 00000018: 00000004-00000000-00000000-00000000 [SL 00]
CPUID 00000018: 00000000-00300003-00000001-00000121 [SL 01]
CPUID 00000018: 00000000-00040003-00000400-00000043 [SL 02]
CPUID 00000018: 00000000-00800001-00000001-00000122 [SL 03]
CPUID 00000018: 00000000-00080008-00000001-00000143 [SL 04]
CPUID 00000019: 00000000-00000000-00000000-00000000
CPUID 0000001A: 20000004-00000000-00000000-00000000 [Atom: Darkmont]
CPUID 0000001B: 00000000-00000000-00000000-00000000 [SL 00]
CPUID 0000001C: C000000B-00000007-000F0007-00000000
CPUID 0000001D: 00000000-00000000-00000000-00000000 [SL 00]
CPUID 0000001E: 00000000-00000000-00000000-00000000 [SL 00]
CPUID 0000001F: 00000001-00000001-00000100-00000040 [SL 00]
CPUID 0000001F: 00000003-00000004-00000201-00000040 [SL 01]
CPUID 0000001F: 00000007-00000008-00000302-00000040 [SL 02]
CPUID 00000020: 00000000-00000001-00000000-00000000 [SL 00]
CPUID 00000021: 00000000-00000000-00000000-00000000
CPUID 00000022: 00000000-00000000-00000000-00000000
CPUID 00000023: 0000003F-00000003-00000008-00000000 [SL 00]
CPUID 00000023: 000000FF-00000077-00000000-00000000 [SL 01]
CPUID 00000023: 000000FC-00000003-000000FC-00000003 [SL 02]
CPUID 00000023: 00001F7F-00000000-00000000-00000000 [SL 03]
CPUID 00000023: 00000000-60060338-00000000-00000000 [SL 04]
CPUID 00000023: 000000FF-00000003-00000077-00000001 [SL 05]
CPUID 00000023: 00000000-00000000-00000000-00000000 [SL 06]
CPUID 00000023: 00000000-00000000-00000000-00000000 [SL 07]
CPUID 00000023: 00000000-00000000-00000000-00000000 [SL 08]
CPUID 00000023: 00000000-00000000-00000000-00000000 [SL 09]
CPUID 00000023: 00000000-00000000-00000000-00000000 [SL 0A]
CPUID 00000023: 00000000-00000000-00000000-00000000 [SL 0B]
CPUID 00000023: 00000000-00000000-00000000-00000000 [SL 0C]
CPUID 00000023: 00000000-00000000-00000000-00000000 [SL 0D]
CPUID 00000023: 00000000-00000000-00000000-00000000 [SL 0E]
CPUID 00000023: 00000000-00000000-00000000-00000000 [SL 0F]
CPUID 00000024: 00000000-00000000-00000000-00000000 [SL 00]
CPUID 00000025: 00000000-00000000-00000000-00000000
CPUID 00000026: 00000000-00000000-00000000-00000000
CPUID 00000027: 00000000-00000000-00000000-00000000 [SL 00]
CPUID 00000028: 00000000-00000040-00000000-00000000 [SL 00]
CPUID 00000028: 00000003-00000000-00000000-00000000 [SL 06]
CPUID 80000000: 80000008-00000000-00000000-00000000
CPUID 80000001: 00000000-00000000-00000121-2C100800
CPUID 80000002: 65746E49-2952286C-726F4320-4D542865 [Intel(R) Core(TM]
CPUID 80000003: 6C552029-20617274-35332037-00000035 [) Ultra 7 355]
CPUID 80000004: 00000000-00000000-00000000-00000000 []
CPUID 80000005: 00000000-00000000-00000000-00000000 [L1D: 0 KB / L1I: 0 KB]
CPUID 80000006: 00000000-00000000-10008040-00000000 [L2: 4096 KB / L3: 0 KB]
CPUID 80000007: 00000000-00000000-00000000-00000100
CPUID 80000008: 0000302E-00000200-00000000-00000000

L1    Data Cache:    32 KB,  8-way Associative, 64-byte Line
L1  Instr. Cache:    64 KB,  8-way Associative, 64-byte Line
L2 Unified Cache:     4 MB, 16-way Associative, 64-byte Line

------[ CPUID Registers / Logical CPU #5 ]------

allcpu: Package 0 / Core 33 / Thread 0: Valid, Intel Atom

CPUID 00000000: 00000028-756E6547-6C65746E-49656E69 [GenuineIntel]
CPUID 00000001: 000C06C3-42800800-7FFAFBFF-BFEBFBFF
CPUID 00000002: 00FEFF01-000000F0-00000000-00000000
CPUID 00000003: 00000000-00000000-00000000-00000000
CPUID 00000004: FC000121-01C0003F-0000003F-00000001 [SL 00] [L1D: 32 KB]
CPUID 00000004: FC000122-01C0003F-0000007F-00000001 [SL 01] [L1I: 64 KB]
CPUID 00000004: FC01C143-03C0003F-00000FFF-00000001 [SL 02] [L2U: 4 MB]
CPUID 00000005: 00000040-00000040-00000003-10002020
CPUID 00000006: 00DFCFF7-00000002-00000409-00050003
CPUID 00000007: 00000002-239CA7EB-994007BC-FC18C430 [SL 00]
CPUID 00000007: 4CCE09D7-00000001-00000002-00040430 [SL 01]
CPUID 00000007: 00000000-00000000-00000000-000000BF [SL 02]
CPUID 00000008: 00000000-00000000-00000000-00000000
CPUID 00000009: 00000000-00000000-00000000-00000000
CPUID 0000000A: 0D300806-00000280-00000007-00008603
CPUID 0000000B: 00000001-00000001-00000100-00000042 [SL 00]
CPUID 0000000B: 00000007-00000008-00000201-00000042 [SL 01]
CPUID 0000000C: 00000000-00000000-00000000-00000000
CPUID 0000000D: 00000207-00000A88-00000A88-00000000 [SL 00] [x87]
CPUID 0000000D: 0000000F-00000698-0001D900-00000000 [SL 01] [SSE]
CPUID 0000000D: 00000100-00000240-00000000-00000000 [SL 02] [AVX]
CPUID 0000000D: 00000080-00000000-00000001-00000000 [SL 08] [PT]
CPUID 0000000D: 00000008-00000A80-00000000-00000000 [SL 09] [PKRU]
CPUID 0000000D: 00000010-00000000-00000001-00000000 [SL 0B] [CET_U]
CPUID 0000000D: 00000018-00000000-00000001-00000000 [SL 0C] [CET_S]
CPUID 0000000D: 00000030-00000000-00000001-00000000 [SL 0E] [UINTR]
CPUID 0000000D: 00000328-00000000-00000001-00000000 [SL 0F] [LBR]
CPUID 0000000D: 00000008-00000000-00000001-00000000 [SL 10] [HWP]
CPUID 0000000E: 00000000-00000000-00000000-00000000
CPUID 0000000F: 00000000-00000000-00000000-00000000 [SL 00]
CPUID 0000000F: 00000000-00000000-00000000-00000000 [SL 01]
CPUID 00000010: 00000000-00000040-00000000-00000000 [SL 00]
CPUID 00000010: 00000003-00000000-00000000-00000000 [SL 06]
CPUID 00000011: 00000000-00000000-00000000-00000000
CPUID 00000012: 00000000-00000000-00000000-00000000 [SL 00]
CPUID 00000012: 00000000-00000000-00000000-00000000 [SL 01]
CPUID 00000013: 00000000-00000000-00000000-00000000
CPUID 00000014: 00000001-0000015F-80000007-00000000 [SL 00]
CPUID 00000014: 02490002-003F003F-00000000-00000000 [SL 01]
CPUID 00000015: 00000002-000000AC-0249F000-00000000 [86.00x / 38400000 / 3302.40]
CPUID 00000016: 00000CE4-00000DAC-00000064-00000000 [3300 / 3500 / 100]
CPUID 00000017: 00000000-00000000-00000000-00000000 [SL 00]
CPUID 00000018: 00000004-00000000-00000000-00000000 [SL 00]
CPUID 00000018: 00000000-00300003-00000001-00000121 [SL 01]
CPUID 00000018: 00000000-00040003-00000400-00000043 [SL 02]
CPUID 00000018: 00000000-00800001-00000001-00000122 [SL 03]
CPUID 00000018: 00000000-00080008-00000001-00000143 [SL 04]
CPUID 00000019: 00000000-00000000-00000000-00000000
CPUID 0000001A: 20000004-00000000-00000000-00000000 [Atom: Darkmont]
CPUID 0000001B: 00000000-00000000-00000000-00000000 [SL 00]
CPUID 0000001C: C000000B-00000007-000F0007-00000000
CPUID 0000001D: 00000000-00000000-00000000-00000000 [SL 00]
CPUID 0000001E: 00000000-00000000-00000000-00000000 [SL 00]
CPUID 0000001F: 00000001-00000001-00000100-00000042 [SL 00]
CPUID 0000001F: 00000003-00000004-00000201-00000042 [SL 01]
CPUID 0000001F: 00000007-00000008-00000302-00000042 [SL 02]
CPUID 00000020: 00000000-00000001-00000000-00000000 [SL 00]
CPUID 00000021: 00000000-00000000-00000000-00000000
CPUID 00000022: 00000000-00000000-00000000-00000000
CPUID 00000023: 0000003F-00000003-00000008-00000000 [SL 00]
CPUID 00000023: 000000FF-00000077-00000000-00000000 [SL 01]
CPUID 00000023: 000000FC-00000003-000000FC-00000003 [SL 02]
CPUID 00000023: 00001F7F-00000000-00000000-00000000 [SL 03]
CPUID 00000023: 00000000-60060338-00000000-00000000 [SL 04]
CPUID 00000023: 000000FF-00000003-00000077-00000001 [SL 05]
CPUID 00000023: 00000000-00000000-00000000-00000000 [SL 06]
CPUID 00000023: 00000000-00000000-00000000-00000000 [SL 07]
CPUID 00000023: 00000000-00000000-00000000-00000000 [SL 08]
CPUID 00000023: 00000000-00000000-00000000-00000000 [SL 09]
CPUID 00000023: 00000000-00000000-00000000-00000000 [SL 0A]
CPUID 00000023: 00000000-00000000-00000000-00000000 [SL 0B]
CPUID 00000023: 00000000-00000000-00000000-00000000 [SL 0C]
CPUID 00000023: 00000000-00000000-00000000-00000000 [SL 0D]
CPUID 00000023: 00000000-00000000-00000000-00000000 [SL 0E]
CPUID 00000023: 00000000-00000000-00000000-00000000 [SL 0F]
CPUID 00000024: 00000000-00000000-00000000-00000000 [SL 00]
CPUID 00000025: 00000000-00000000-00000000-00000000
CPUID 00000026: 00000000-00000000-00000000-00000000
CPUID 00000027: 00000000-00000000-00000000-00000000 [SL 00]
CPUID 00000028: 00000000-00000040-00000000-00000000 [SL 00]
CPUID 00000028: 00000003-00000000-00000000-00000000 [SL 06]
CPUID 80000000: 80000008-00000000-00000000-00000000
CPUID 80000001: 00000000-00000000-00000121-2C100800
CPUID 80000002: 65746E49-2952286C-726F4320-4D542865 [Intel(R) Core(TM]
CPUID 80000003: 6C552029-20617274-35332037-00000035 [) Ultra 7 355]
CPUID 80000004: 00000000-00000000-00000000-00000000 []
CPUID 80000005: 00000000-00000000-00000000-00000000 [L1D: 0 KB / L1I: 0 KB]
CPUID 80000006: 00000000-00000000-10008040-00000000 [L2: 4096 KB / L3: 0 KB]
CPUID 80000007: 00000000-00000000-00000000-00000100
CPUID 80000008: 0000302E-00000200-00000000-00000000

L1    Data Cache:    32 KB,  8-way Associative, 64-byte Line
L1  Instr. Cache:    64 KB,  8-way Associative, 64-byte Line
L2 Unified Cache:     4 MB, 16-way Associative, 64-byte Line

------[ CPUID Registers / Logical CPU #6 ]------

allcpu: Package 0 / Core 34 / Thread 0: Valid, Intel Atom

CPUID 00000000: 00000028-756E6547-6C65746E-49656E69 [GenuineIntel]
CPUID 00000001: 000C06C3-44800800-7FFAFBFF-BFEBFBFF
CPUID 00000002: 00FEFF01-000000F0-00000000-00000000
CPUID 00000003: 00000000-00000000-00000000-00000000
CPUID 00000004: FC000121-01C0003F-0000003F-00000001 [SL 00] [L1D: 32 KB]
CPUID 00000004: FC000122-01C0003F-0000007F-00000001 [SL 01] [L1I: 64 KB]
CPUID 00000004: FC01C143-03C0003F-00000FFF-00000001 [SL 02] [L2U: 4 MB]
CPUID 00000005: 00000040-00000040-00000003-10002020
CPUID 00000006: 00DFCFF7-00000002-00000409-00060003
CPUID 00000007: 00000002-239CA7EB-994007BC-FC18C430 [SL 00]
CPUID 00000007: 4CCE09D7-00000001-00000002-00040430 [SL 01]
CPUID 00000007: 00000000-00000000-00000000-000000BF [SL 02]
CPUID 00000008: 00000000-00000000-00000000-00000000
CPUID 00000009: 00000000-00000000-00000000-00000000
CPUID 0000000A: 0D300806-00000280-00000007-00008603
CPUID 0000000B: 00000001-00000001-00000100-00000044 [SL 00]
CPUID 0000000B: 00000007-00000008-00000201-00000044 [SL 01]
CPUID 0000000C: 00000000-00000000-00000000-00000000
CPUID 0000000D: 00000207-00000A88-00000A88-00000000 [SL 00] [x87]
CPUID 0000000D: 0000000F-00000698-0001D900-00000000 [SL 01] [SSE]
CPUID 0000000D: 00000100-00000240-00000000-00000000 [SL 02] [AVX]
CPUID 0000000D: 00000080-00000000-00000001-00000000 [SL 08] [PT]
CPUID 0000000D: 00000008-00000A80-00000000-00000000 [SL 09] [PKRU]
CPUID 0000000D: 00000010-00000000-00000001-00000000 [SL 0B] [CET_U]
CPUID 0000000D: 00000018-00000000-00000001-00000000 [SL 0C] [CET_S]
CPUID 0000000D: 00000030-00000000-00000001-00000000 [SL 0E] [UINTR]
CPUID 0000000D: 00000328-00000000-00000001-00000000 [SL 0F] [LBR]
CPUID 0000000D: 00000008-00000000-00000001-00000000 [SL 10] [HWP]
CPUID 0000000E: 00000000-00000000-00000000-00000000
CPUID 0000000F: 00000000-00000000-00000000-00000000 [SL 00]
CPUID 0000000F: 00000000-00000000-00000000-00000000 [SL 01]
CPUID 00000010: 00000000-00000040-00000000-00000000 [SL 00]
CPUID 00000010: 00000003-00000000-00000000-00000000 [SL 06]
CPUID 00000011: 00000000-00000000-00000000-00000000
CPUID 00000012: 00000000-00000000-00000000-00000000 [SL 00]
CPUID 00000012: 00000000-00000000-00000000-00000000 [SL 01]
CPUID 00000013: 00000000-00000000-00000000-00000000
CPUID 00000014: 00000001-0000015F-80000007-00000000 [SL 00]
CPUID 00000014: 02490002-003F003F-00000000-00000000 [SL 01]
CPUID 00000015: 00000002-000000AC-0249F000-00000000 [86.00x / 38400000 / 3302.40]
CPUID 00000016: 00000CE4-00000DAC-00000064-00000000 [3300 / 3500 / 100]
CPUID 00000017: 00000000-00000000-00000000-00000000 [SL 00]
CPUID 00000018: 00000004-00000000-00000000-00000000 [SL 00]
CPUID 00000018: 00000000-00300003-00000001-00000121 [SL 01]
CPUID 00000018: 00000000-00040003-00000400-00000043 [SL 02]
CPUID 00000018: 00000000-00800001-00000001-00000122 [SL 03]
CPUID 00000018: 00000000-00080008-00000001-00000143 [SL 04]
CPUID 00000019: 00000000-00000000-00000000-00000000
CPUID 0000001A: 20000004-00000000-00000000-00000000 [Atom: Darkmont]
CPUID 0000001B: 00000000-00000000-00000000-00000000 [SL 00]
CPUID 0000001C: C000000B-00000007-000F0007-00000000
CPUID 0000001D: 00000000-00000000-00000000-00000000 [SL 00]
CPUID 0000001E: 00000000-00000000-00000000-00000000 [SL 00]
CPUID 0000001F: 00000001-00000001-00000100-00000044 [SL 00]
CPUID 0000001F: 00000003-00000004-00000201-00000044 [SL 01]
CPUID 0000001F: 00000007-00000008-00000302-00000044 [SL 02]
CPUID 00000020: 00000000-00000001-00000000-00000000 [SL 00]
CPUID 00000021: 00000000-00000000-00000000-00000000
CPUID 00000022: 00000000-00000000-00000000-00000000
CPUID 00000023: 0000003F-00000003-00000008-00000000 [SL 00]
CPUID 00000023: 000000FF-00000077-00000000-00000000 [SL 01]
CPUID 00000023: 000000FC-00000003-000000FC-00000003 [SL 02]
CPUID 00000023: 00001F7F-00000000-00000000-00000000 [SL 03]
CPUID 00000023: 00000000-60060338-00000000-00000000 [SL 04]
CPUID 00000023: 000000FF-00000003-00000077-00000001 [SL 05]
CPUID 00000023: 00000000-00000000-00000000-00000000 [SL 06]
CPUID 00000023: 00000000-00000000-00000000-00000000 [SL 07]
CPUID 00000023: 00000000-00000000-00000000-00000000 [SL 08]
CPUID 00000023: 00000000-00000000-00000000-00000000 [SL 09]
CPUID 00000023: 00000000-00000000-00000000-00000000 [SL 0A]
CPUID 00000023: 00000000-00000000-00000000-00000000 [SL 0B]
CPUID 00000023: 00000000-00000000-00000000-00000000 [SL 0C]
CPUID 00000023: 00000000-00000000-00000000-00000000 [SL 0D]
CPUID 00000023: 00000000-00000000-00000000-00000000 [SL 0E]
CPUID 00000023: 00000000-00000000-00000000-00000000 [SL 0F]
CPUID 00000024: 00000000-00000000-00000000-00000000 [SL 00]
CPUID 00000025: 00000000-00000000-00000000-00000000
CPUID 00000026: 00000000-00000000-00000000-00000000
CPUID 00000027: 00000000-00000000-00000000-00000000 [SL 00]
CPUID 00000028: 00000000-00000040-00000000-00000000 [SL 00]
CPUID 00000028: 00000003-00000000-00000000-00000000 [SL 06]
CPUID 80000000: 80000008-00000000-00000000-00000000
CPUID 80000001: 00000000-00000000-00000121-2C100800
CPUID 80000002: 65746E49-2952286C-726F4320-4D542865 [Intel(R) Core(TM]
CPUID 80000003: 6C552029-20617274-35332037-00000035 [) Ultra 7 355]
CPUID 80000004: 00000000-00000000-00000000-00000000 []
CPUID 80000005: 00000000-00000000-00000000-00000000 [L1D: 0 KB / L1I: 0 KB]
CPUID 80000006: 00000000-00000000-10008040-00000000 [L2: 4096 KB / L3: 0 KB]
CPUID 80000007: 00000000-00000000-00000000-00000100
CPUID 80000008: 0000302E-00000200-00000000-00000000

L1    Data Cache:    32 KB,  8-way Associative, 64-byte Line
L1  Instr. Cache:    64 KB,  8-way Associative, 64-byte Line
L2 Unified Cache:     4 MB, 16-way Associative, 64-byte Line

------[ CPUID Registers / Logical CPU #7 ]------

allcpu: Package 0 / Core 35 / Thread 0: Valid, Intel Atom

CPUID 00000000: 00000028-756E6547-6C65746E-49656E69 [GenuineIntel]
CPUID 00000001: 000C06C3-46800800-7FFAFBFF-BFEBFBFF
CPUID 00000002: 00FEFF01-000000F0-00000000-00000000
CPUID 00000003: 00000000-00000000-00000000-00000000
CPUID 00000004: FC000121-01C0003F-0000003F-00000001 [SL 00] [L1D: 32 KB]
CPUID 00000004: FC000122-01C0003F-0000007F-00000001 [SL 01] [L1I: 64 KB]
CPUID 00000004: FC01C143-03C0003F-00000FFF-00000001 [SL 02] [L2U: 4 MB]
CPUID 00000005: 00000040-00000040-00000003-10002020
CPUID 00000006: 00DFCFF7-00000002-00000409-00070003
CPUID 00000007: 00000002-239CA7EB-994007BC-FC18C430 [SL 00]
CPUID 00000007: 4CCE09D7-00000001-00000002-00040430 [SL 01]
CPUID 00000007: 00000000-00000000-00000000-000000BF [SL 02]
CPUID 00000008: 00000000-00000000-00000000-00000000
CPUID 00000009: 00000000-00000000-00000000-00000000
CPUID 0000000A: 0D300806-00000280-00000007-00008603
CPUID 0000000B: 00000001-00000001-00000100-00000046 [SL 00]
CPUID 0000000B: 00000007-00000008-00000201-00000046 [SL 01]
CPUID 0000000C: 00000000-00000000-00000000-00000000
CPUID 0000000D: 00000207-00000A88-00000A88-00000000 [SL 00] [x87]
CPUID 0000000D: 0000000F-00000698-0001D900-00000000 [SL 01] [SSE]
CPUID 0000000D: 00000100-00000240-00000000-00000000 [SL 02] [AVX]
CPUID 0000000D: 00000080-00000000-00000001-00000000 [SL 08] [PT]
CPUID 0000000D: 00000008-00000A80-00000000-00000000 [SL 09] [PKRU]
CPUID 0000000D: 00000010-00000000-00000001-00000000 [SL 0B] [CET_U]
CPUID 0000000D: 00000018-00000000-00000001-00000000 [SL 0C] [CET_S]
CPUID 0000000D: 00000030-00000000-00000001-00000000 [SL 0E] [UINTR]
CPUID 0000000D: 00000328-00000000-00000001-00000000 [SL 0F] [LBR]
CPUID 0000000D: 00000008-00000000-00000001-00000000 [SL 10] [HWP]
CPUID 0000000E: 00000000-00000000-00000000-00000000
CPUID 0000000F: 00000000-00000000-00000000-00000000 [SL 00]
CPUID 0000000F: 00000000-00000000-00000000-00000000 [SL 01]
CPUID 00000010: 00000000-00000040-00000000-00000000 [SL 00]
CPUID 00000010: 00000003-00000000-00000000-00000000 [SL 06]
CPUID 00000011: 00000000-00000000-00000000-00000000
CPUID 00000012: 00000000-00000000-00000000-00000000 [SL 00]
CPUID 00000012: 00000000-00000000-00000000-00000000 [SL 01]
CPUID 00000013: 00000000-00000000-00000000-00000000
CPUID 00000014: 00000001-0000015F-80000007-00000000 [SL 00]
CPUID 00000014: 02490002-003F003F-00000000-00000000 [SL 01]
CPUID 00000015: 00000002-000000AC-0249F000-00000000 [86.00x / 38400000 / 3302.40]
CPUID 00000016: 00000CE4-00000DAC-00000064-00000000 [3300 / 3500 / 100]
CPUID 00000017: 00000000-00000000-00000000-00000000 [SL 00]
CPUID 00000018: 00000004-00000000-00000000-00000000 [SL 00]
CPUID 00000018: 00000000-00300003-00000001-00000121 [SL 01]
CPUID 00000018: 00000000-00040003-00000400-00000043 [SL 02]
CPUID 00000018: 00000000-00800001-00000001-00000122 [SL 03]
CPUID 00000018: 00000000-00080008-00000001-00000143 [SL 04]
CPUID 00000019: 00000000-00000000-00000000-00000000
CPUID 0000001A: 20000004-00000000-00000000-00000000 [Atom: Darkmont]
CPUID 0000001B: 00000000-00000000-00000000-00000000 [SL 00]
CPUID 0000001C: C000000B-00000007-000F0007-00000000
CPUID 0000001D: 00000000-00000000-00000000-00000000 [SL 00]
CPUID 0000001E: 00000000-00000000-00000000-00000000 [SL 00]
CPUID 0000001F: 00000001-00000001-00000100-00000046 [SL 00]
CPUID 0000001F: 00000003-00000004-00000201-00000046 [SL 01]
CPUID 0000001F: 00000007-00000008-00000302-00000046 [SL 02]
CPUID 00000020: 00000000-00000001-00000000-00000000 [SL 00]
CPUID 00000021: 00000000-00000000-00000000-00000000
CPUID 00000022: 00000000-00000000-00000000-00000000
CPUID 00000023: 0000003F-00000003-00000008-00000000 [SL 00]
CPUID 00000023: 000000FF-00000077-00000000-00000000 [SL 01]
CPUID 00000023: 000000FC-00000003-000000FC-00000003 [SL 02]
CPUID 00000023: 00001F7F-00000000-00000000-00000000 [SL 03]
CPUID 00000023: 00000000-60060338-00000000-00000000 [SL 04]
CPUID 00000023: 000000FF-00000003-00000077-00000001 [SL 05]
CPUID 00000023: 00000000-00000000-00000000-00000000 [SL 06]
CPUID 00000023: 00000000-00000000-00000000-00000000 [SL 07]
CPUID 00000023: 00000000-00000000-00000000-00000000 [SL 08]
CPUID 00000023: 00000000-00000000-00000000-00000000 [SL 09]
CPUID 00000023: 00000000-00000000-00000000-00000000 [SL 0A]
CPUID 00000023: 00000000-00000000-00000000-00000000 [SL 0B]
CPUID 00000023: 00000000-00000000-00000000-00000000 [SL 0C]
CPUID 00000023: 00000000-00000000-00000000-00000000 [SL 0D]
CPUID 00000023: 00000000-00000000-00000000-00000000 [SL 0E]
CPUID 00000023: 00000000-00000000-00000000-00000000 [SL 0F]
CPUID 00000024: 00000000-00000000-00000000-00000000 [SL 00]
CPUID 00000025: 00000000-00000000-00000000-00000000
CPUID 00000026: 00000000-00000000-00000000-00000000
CPUID 00000027: 00000000-00000000-00000000-00000000 [SL 00]
CPUID 00000028: 00000000-00000040-00000000-00000000 [SL 00]
CPUID 00000028: 00000003-00000000-00000000-00000000 [SL 06]
CPUID 80000000: 80000008-00000000-00000000-00000000
CPUID 80000001: 00000000-00000000-00000121-2C100800
CPUID 80000002: 65746E49-2952286C-726F4320-4D542865 [Intel(R) Core(TM]
CPUID 80000003: 6C552029-20617274-35332037-00000035 [) Ultra 7 355]
CPUID 80000004: 00000000-00000000-00000000-00000000 []
CPUID 80000005: 00000000-00000000-00000000-00000000 [L1D: 0 KB / L1I: 0 KB]
CPUID 80000006: 00000000-00000000-10008040-00000000 [L2: 4096 KB / L3: 0 KB]
CPUID 80000007: 00000000-00000000-00000000-00000100
CPUID 80000008: 0000302E-00000200-00000000-00000000

L1    Data Cache:    32 KB,  8-way Associative, 64-byte Line
L1  Instr. Cache:    64 KB,  8-way Associative, 64-byte Line
L2 Unified Cache:     4 MB, 16-way Associative, 64-byte Line

