------[ CPUID Registers / Logical CPU #0 ]------

allcpu: Package 0 / Core 0 / Thread 0: Valid

CPUID 00000000: 00000020-756E6547-6C65746E-49656E69 [GenuineIntel]
CPUID 00000001: 000B0671-00200800-7FFAFBFF-BFEBFBFF
CPUID 00000002: 00FEFF01-000000F0-00000000-00000000
CPUID 00000003: 00000000-00000000-00000000-00000000
CPUID 00000004: 3C004121-02C0003F-0000003F-00000000 [SL 00] [L1D: 48 KB]
CPUID 00000004: 3C004122-01C0003F-0000003F-00000000 [SL 01] [L1I: 32 KB]
CPUID 00000004: 3C004143-03C0003F-000007FF-00000000 [SL 02] [L2U: 2 MB]
CPUID 00000004: 3C07C163-0140003F-00007FFF-00000004 [SL 03] [L3U: 12 MB]
CPUID 00000005: 00000040-00000040-00000003-10101020
CPUID 00000006: 00DF8EF7-00000002-00000409-00000003
CPUID 00000007: 00000002-239C27EB-98C027AC-FC1C4410 [SL 00]
CPUID 00000007: 00401C10-00000000-00000000-00040000 [SL 01]
CPUID 00000007: 00000000-00000000-00000000-0000009F [SL 02]
CPUID 00000008: 00000000-00000000-00000000-00000000
CPUID 00000009: 00000000-00000000-00000000-00000000
CPUID 0000000A: 08300805-00000000-0000000F-00008604
CPUID 0000000B: 00000001-00000001-00000100-00000000 [SL 00]
CPUID 0000000B: 00000005-00000004-00000201-00000000 [SL 01]
CPUID 0000000C: 00000000-00000000-00000000-00000000
CPUID 0000000D: 00000207-00000340-00000A88-00000000 [SL 00] [x87]
CPUID 0000000D: 0000000F-000003D0-00019900-00000000 [SL 01] [SSE]
CPUID 0000000D: 00000100-00000240-00000000-00000000 [SL 02] [AVX]
CPUID 0000000D: 00000080-00000000-00000001-00000000 [SL 08] [PT]
CPUID 0000000D: 00000008-00000A80-00000000-00000000 [SL 09] [PKRU]
CPUID 0000000D: 00000010-00000000-00000001-00000000 [SL 0B] [CET_U]
CPUID 0000000D: 00000018-00000000-00000001-00000000 [SL 0C] [CET_S]
CPUID 0000000D: 00000328-00000000-00000001-00000000 [SL 0F] [LBR]
CPUID 0000000D: 00000008-00000000-00000001-00000000 [SL 10] [HWP]
CPUID 0000000E: 00000000-00000000-00000000-00000000
CPUID 0000000F: 00000000-00000000-00000000-00000000 [SL 00]
CPUID 0000000F: 00000000-00000000-00000000-00000000 [SL 01]
CPUID 00000010: 00000000-00000000-00000000-00000000 [SL 00]
CPUID 00000010: 00000000-00000000-00000000-00000000 [SL 01]
CPUID 00000011: 00000000-00000000-00000000-00000000
CPUID 00000012: 00000000-00000000-00000000-00000000 [SL 00]
CPUID 00000012: 00000000-00000000-00000000-00000000 [SL 01]
CPUID 00000013: 00000000-00000000-00000000-00000000
CPUID 00000014: 00000001-0000005F-00000007-00000000 [SL 00]
CPUID 00000014: 02490002-003F003F-00000000-00000000 [SL 01]
CPUID 00000015: 00000002-00000092-0249F000-00000000 [73.00x / 38400000 / 2803.20]
CPUID 00000016: 00000AF0-0000125C-00000064-00000000 [2800 / 4700 / 100]
CPUID 00000017: 00000000-00000000-00000000-00000000 [SL 00]
CPUID 00000018: 00000008-00000000-00000000-00000000 [SL 00]
CPUID 00000018: 00000000-00080001-00000020-00004022 [SL 01]
CPUID 00000018: 00000000-00080006-00000004-00004022 [SL 02]
CPUID 00000018: 00000000-0010000F-00000001-00004125 [SL 03]
CPUID 00000018: 00000000-00040001-00000010-00004024 [SL 04]
CPUID 00000018: 00000000-00040006-00000008-00004024 [SL 05]
CPUID 00000018: 00000000-00080008-00000001-00004124 [SL 06]
CPUID 00000018: 00000000-00080007-00000080-00004043 [SL 07]
CPUID 00000018: 00000000-00080009-00000080-00004043 [SL 08]
CPUID 00000019: 00000007-00000014-00000003-00000000
CPUID 0000001A: 00000000-00000000-00000000-00000000 [Unknown]
CPUID 0000001B: 00000001-00000001-00000000-00000000 [SL 00]
CPUID 0000001C: 4000000B-00000007-00000007-00000000
CPUID 0000001D: 00000000-00000000-00000000-00000000 [SL 00]
CPUID 0000001E: 00000000-00000000-00000000-00000000 [SL 00]
CPUID 0000001F: 00000001-00000001-00000100-00000000 [SL 00]
CPUID 0000001F: 00000005-00000004-00000201-00000000 [SL 01]
CPUID 00000020: 00000000-00000001-00000000-00000000 [SL 00]
CPUID 80000000: 80000008-00000000-00000000-00000000
CPUID 80000001: 00000000-00000000-00000121-2C100000
CPUID 80000002: 65746E49-2952286C-6F655820-2952286E [Intel(R) Xeon(R)]
CPUID 80000003: 31333620-00005035-00000000-00000000 [ 6315P]
CPUID 80000004: 00000000-00000000-00000000-00000000 []
CPUID 80000005: 00000000-00000000-00000000-00000000 [L1D: 0 KB / L1I: 0 KB]
CPUID 80000006: 00000000-00000000-08007040-00000000 [L2: 2048 KB / L3: 0 KB]
CPUID 80000007: 00000000-00000000-00000000-00000100
CPUID 80000008: 0000302E-00000000-00000000-00000000

L1    Data Cache:    48 KB, 12-way Associative, 64-byte Line
L1  Instr. Cache:    32 KB,  8-way Associative, 64-byte Line
L2 Unified Cache:     2 MB, 16-way Associative, 64-byte Line
L3 Unified Cache:    12 MB,  6-way Associative, 64-byte Line

------[ CPUID Registers / Logical CPU #1 ]------

allcpu: Package 0 / Core 1 / Thread 0: Valid

CPUID 00000000: 00000020-756E6547-6C65746E-49656E69 [GenuineIntel]
CPUID 00000001: 000B0671-02200800-7FFAFBFF-BFEBFBFF
CPUID 00000002: 00FEFF01-000000F0-00000000-00000000
CPUID 00000003: 00000000-00000000-00000000-00000000
CPUID 00000004: 3C004121-02C0003F-0000003F-00000000 [SL 00] [L1D: 48 KB]
CPUID 00000004: 3C004122-01C0003F-0000003F-00000000 [SL 01] [L1I: 32 KB]
CPUID 00000004: 3C004143-03C0003F-000007FF-00000000 [SL 02] [L2U: 2 MB]
CPUID 00000004: 3C07C163-0140003F-00007FFF-00000004 [SL 03] [L3U: 12 MB]
CPUID 00000005: 00000040-00000040-00000003-10101020
CPUID 00000006: 00DF8EF7-00000002-00000409-00010003
CPUID 00000007: 00000002-239C27EB-98C027AC-FC1C4410 [SL 00]
CPUID 00000007: 00401C10-00000000-00000000-00040000 [SL 01]
CPUID 00000007: 00000000-00000000-00000000-0000009F [SL 02]
CPUID 00000008: 00000000-00000000-00000000-00000000
CPUID 00000009: 00000000-00000000-00000000-00000000
CPUID 0000000A: 08300805-00000000-0000000F-00008604
CPUID 0000000B: 00000001-00000001-00000100-00000002 [SL 00]
CPUID 0000000B: 00000005-00000004-00000201-00000002 [SL 01]
CPUID 0000000C: 00000000-00000000-00000000-00000000
CPUID 0000000D: 00000207-00000340-00000A88-00000000 [SL 00] [x87]
CPUID 0000000D: 0000000F-000003D0-00019900-00000000 [SL 01] [SSE]
CPUID 0000000D: 00000100-00000240-00000000-00000000 [SL 02] [AVX]
CPUID 0000000D: 00000080-00000000-00000001-00000000 [SL 08] [PT]
CPUID 0000000D: 00000008-00000A80-00000000-00000000 [SL 09] [PKRU]
CPUID 0000000D: 00000010-00000000-00000001-00000000 [SL 0B] [CET_U]
CPUID 0000000D: 00000018-00000000-00000001-00000000 [SL 0C] [CET_S]
CPUID 0000000D: 00000328-00000000-00000001-00000000 [SL 0F] [LBR]
CPUID 0000000D: 00000008-00000000-00000001-00000000 [SL 10] [HWP]
CPUID 0000000E: 00000000-00000000-00000000-00000000
CPUID 0000000F: 00000000-00000000-00000000-00000000 [SL 00]
CPUID 0000000F: 00000000-00000000-00000000-00000000 [SL 01]
CPUID 00000010: 00000000-00000000-00000000-00000000 [SL 00]
CPUID 00000010: 00000000-00000000-00000000-00000000 [SL 01]
CPUID 00000011: 00000000-00000000-00000000-00000000
CPUID 00000012: 00000000-00000000-00000000-00000000 [SL 00]
CPUID 00000012: 00000000-00000000-00000000-00000000 [SL 01]
CPUID 00000013: 00000000-00000000-00000000-00000000
CPUID 00000014: 00000001-0000005F-00000007-00000000 [SL 00]
CPUID 00000014: 02490002-003F003F-00000000-00000000 [SL 01]
CPUID 00000015: 00000002-00000092-0249F000-00000000 [73.00x / 38400000 / 2803.20]
CPUID 00000016: 00000AF0-0000125C-00000064-00000000 [2800 / 4700 / 100]
CPUID 00000017: 00000000-00000000-00000000-00000000 [SL 00]
CPUID 00000018: 00000008-00000000-00000000-00000000 [SL 00]
CPUID 00000018: 00000000-00080001-00000020-00004022 [SL 01]
CPUID 00000018: 00000000-00080006-00000004-00004022 [SL 02]
CPUID 00000018: 00000000-0010000F-00000001-00004125 [SL 03]
CPUID 00000018: 00000000-00040001-00000010-00004024 [SL 04]
CPUID 00000018: 00000000-00040006-00000008-00004024 [SL 05]
CPUID 00000018: 00000000-00080008-00000001-00004124 [SL 06]
CPUID 00000018: 00000000-00080007-00000080-00004043 [SL 07]
CPUID 00000018: 00000000-00080009-00000080-00004043 [SL 08]
CPUID 00000019: 00000007-00000014-00000003-00000000
CPUID 0000001A: 00000000-00000000-00000000-00000000 [Unknown]
CPUID 0000001B: 00000001-00000001-00000000-00000000 [SL 00]
CPUID 0000001C: 4000000B-00000007-00000007-00000000
CPUID 0000001D: 00000000-00000000-00000000-00000000 [SL 00]
CPUID 0000001E: 00000000-00000000-00000000-00000000 [SL 00]
CPUID 0000001F: 00000001-00000001-00000100-00000002 [SL 00]
CPUID 0000001F: 00000005-00000004-00000201-00000002 [SL 01]
CPUID 00000020: 00000000-00000001-00000000-00000000 [SL 00]
CPUID 80000000: 80000008-00000000-00000000-00000000
CPUID 80000001: 00000000-00000000-00000121-2C100000
CPUID 80000002: 65746E49-2952286C-6F655820-2952286E [Intel(R) Xeon(R)]
CPUID 80000003: 31333620-00005035-00000000-00000000 [ 6315P]
CPUID 80000004: 00000000-00000000-00000000-00000000 []
CPUID 80000005: 00000000-00000000-00000000-00000000 [L1D: 0 KB / L1I: 0 KB]
CPUID 80000006: 00000000-00000000-08007040-00000000 [L2: 2048 KB / L3: 0 KB]
CPUID 80000007: 00000000-00000000-00000000-00000100
CPUID 80000008: 0000302E-00000000-00000000-00000000

L1    Data Cache:    48 KB, 12-way Associative, 64-byte Line
L1  Instr. Cache:    32 KB,  8-way Associative, 64-byte Line
L2 Unified Cache:     2 MB, 16-way Associative, 64-byte Line
L3 Unified Cache:    12 MB,  6-way Associative, 64-byte Line

------[ CPUID Registers / Logical CPU #2 ]------

allcpu: Package 0 / Core 2 / Thread 0: Valid

CPUID 00000000: 00000020-756E6547-6C65746E-49656E69 [GenuineIntel]
CPUID 00000001: 000B0671-04200800-7FFAFBFF-BFEBFBFF
CPUID 00000002: 00FEFF01-000000F0-00000000-00000000
CPUID 00000003: 00000000-00000000-00000000-00000000
CPUID 00000004: 3C004121-02C0003F-0000003F-00000000 [SL 00] [L1D: 48 KB]
CPUID 00000004: 3C004122-01C0003F-0000003F-00000000 [SL 01] [L1I: 32 KB]
CPUID 00000004: 3C004143-03C0003F-000007FF-00000000 [SL 02] [L2U: 2 MB]
CPUID 00000004: 3C07C163-0140003F-00007FFF-00000004 [SL 03] [L3U: 12 MB]
CPUID 00000005: 00000040-00000040-00000003-10101020
CPUID 00000006: 00DF8EF7-00000002-00000409-00020003
CPUID 00000007: 00000002-239C27EB-98C027AC-FC1C4410 [SL 00]
CPUID 00000007: 00401C10-00000000-00000000-00040000 [SL 01]
CPUID 00000007: 00000000-00000000-00000000-0000009F [SL 02]
CPUID 00000008: 00000000-00000000-00000000-00000000
CPUID 00000009: 00000000-00000000-00000000-00000000
CPUID 0000000A: 08300805-00000000-0000000F-00008604
CPUID 0000000B: 00000001-00000001-00000100-00000004 [SL 00]
CPUID 0000000B: 00000005-00000004-00000201-00000004 [SL 01]
CPUID 0000000C: 00000000-00000000-00000000-00000000
CPUID 0000000D: 00000207-00000340-00000A88-00000000 [SL 00] [x87]
CPUID 0000000D: 0000000F-000003D0-00019900-00000000 [SL 01] [SSE]
CPUID 0000000D: 00000100-00000240-00000000-00000000 [SL 02] [AVX]
CPUID 0000000D: 00000080-00000000-00000001-00000000 [SL 08] [PT]
CPUID 0000000D: 00000008-00000A80-00000000-00000000 [SL 09] [PKRU]
CPUID 0000000D: 00000010-00000000-00000001-00000000 [SL 0B] [CET_U]
CPUID 0000000D: 00000018-00000000-00000001-00000000 [SL 0C] [CET_S]
CPUID 0000000D: 00000328-00000000-00000001-00000000 [SL 0F] [LBR]
CPUID 0000000D: 00000008-00000000-00000001-00000000 [SL 10] [HWP]
CPUID 0000000E: 00000000-00000000-00000000-00000000
CPUID 0000000F: 00000000-00000000-00000000-00000000 [SL 00]
CPUID 0000000F: 00000000-00000000-00000000-00000000 [SL 01]
CPUID 00000010: 00000000-00000000-00000000-00000000 [SL 00]
CPUID 00000010: 00000000-00000000-00000000-00000000 [SL 01]
CPUID 00000011: 00000000-00000000-00000000-00000000
CPUID 00000012: 00000000-00000000-00000000-00000000 [SL 00]
CPUID 00000012: 00000000-00000000-00000000-00000000 [SL 01]
CPUID 00000013: 00000000-00000000-00000000-00000000
CPUID 00000014: 00000001-0000005F-00000007-00000000 [SL 00]
CPUID 00000014: 02490002-003F003F-00000000-00000000 [SL 01]
CPUID 00000015: 00000002-00000092-0249F000-00000000 [73.00x / 38400000 / 2803.20]
CPUID 00000016: 00000AF0-0000125C-00000064-00000000 [2800 / 4700 / 100]
CPUID 00000017: 00000000-00000000-00000000-00000000 [SL 00]
CPUID 00000018: 00000008-00000000-00000000-00000000 [SL 00]
CPUID 00000018: 00000000-00080001-00000020-00004022 [SL 01]
CPUID 00000018: 00000000-00080006-00000004-00004022 [SL 02]
CPUID 00000018: 00000000-0010000F-00000001-00004125 [SL 03]
CPUID 00000018: 00000000-00040001-00000010-00004024 [SL 04]
CPUID 00000018: 00000000-00040006-00000008-00004024 [SL 05]
CPUID 00000018: 00000000-00080008-00000001-00004124 [SL 06]
CPUID 00000018: 00000000-00080007-00000080-00004043 [SL 07]
CPUID 00000018: 00000000-00080009-00000080-00004043 [SL 08]
CPUID 00000019: 00000007-00000014-00000003-00000000
CPUID 0000001A: 00000000-00000000-00000000-00000000 [Unknown]
CPUID 0000001B: 00000001-00000001-00000000-00000000 [SL 00]
CPUID 0000001C: 4000000B-00000007-00000007-00000000
CPUID 0000001D: 00000000-00000000-00000000-00000000 [SL 00]
CPUID 0000001E: 00000000-00000000-00000000-00000000 [SL 00]
CPUID 0000001F: 00000001-00000001-00000100-00000004 [SL 00]
CPUID 0000001F: 00000005-00000004-00000201-00000004 [SL 01]
CPUID 00000020: 00000000-00000001-00000000-00000000 [SL 00]
CPUID 80000000: 80000008-00000000-00000000-00000000
CPUID 80000001: 00000000-00000000-00000121-2C100000
CPUID 80000002: 65746E49-2952286C-6F655820-2952286E [Intel(R) Xeon(R)]
CPUID 80000003: 31333620-00005035-00000000-00000000 [ 6315P]
CPUID 80000004: 00000000-00000000-00000000-00000000 []
CPUID 80000005: 00000000-00000000-00000000-00000000 [L1D: 0 KB / L1I: 0 KB]
CPUID 80000006: 00000000-00000000-08007040-00000000 [L2: 2048 KB / L3: 0 KB]
CPUID 80000007: 00000000-00000000-00000000-00000100
CPUID 80000008: 0000302E-00000000-00000000-00000000

L1    Data Cache:    48 KB, 12-way Associative, 64-byte Line
L1  Instr. Cache:    32 KB,  8-way Associative, 64-byte Line
L2 Unified Cache:     2 MB, 16-way Associative, 64-byte Line
L3 Unified Cache:    12 MB,  6-way Associative, 64-byte Line

------[ CPUID Registers / Logical CPU #3 ]------

allcpu: Package 0 / Core 3 / Thread 0: Valid

CPUID 00000000: 00000020-756E6547-6C65746E-49656E69 [GenuineIntel]
CPUID 00000001: 000B0671-06200800-7FFAFBFF-BFEBFBFF
CPUID 00000002: 00FEFF01-000000F0-00000000-00000000
CPUID 00000003: 00000000-00000000-00000000-00000000
CPUID 00000004: 3C004121-02C0003F-0000003F-00000000 [SL 00] [L1D: 48 KB]
CPUID 00000004: 3C004122-01C0003F-0000003F-00000000 [SL 01] [L1I: 32 KB]
CPUID 00000004: 3C004143-03C0003F-000007FF-00000000 [SL 02] [L2U: 2 MB]
CPUID 00000004: 3C07C163-0140003F-00007FFF-00000004 [SL 03] [L3U: 12 MB]
CPUID 00000005: 00000040-00000040-00000003-10101020
CPUID 00000006: 00DF8EF7-00000002-00000409-00030003
CPUID 00000007: 00000002-239C27EB-98C027AC-FC1C4410 [SL 00]
CPUID 00000007: 00401C10-00000000-00000000-00040000 [SL 01]
CPUID 00000007: 00000000-00000000-00000000-0000009F [SL 02]
CPUID 00000008: 00000000-00000000-00000000-00000000
CPUID 00000009: 00000000-00000000-00000000-00000000
CPUID 0000000A: 08300805-00000000-0000000F-00008604
CPUID 0000000B: 00000001-00000001-00000100-00000006 [SL 00]
CPUID 0000000B: 00000005-00000004-00000201-00000006 [SL 01]
CPUID 0000000C: 00000000-00000000-00000000-00000000
CPUID 0000000D: 00000207-00000340-00000A88-00000000 [SL 00] [x87]
CPUID 0000000D: 0000000F-000003D0-00019900-00000000 [SL 01] [SSE]
CPUID 0000000D: 00000100-00000240-00000000-00000000 [SL 02] [AVX]
CPUID 0000000D: 00000080-00000000-00000001-00000000 [SL 08] [PT]
CPUID 0000000D: 00000008-00000A80-00000000-00000000 [SL 09] [PKRU]
CPUID 0000000D: 00000010-00000000-00000001-00000000 [SL 0B] [CET_U]
CPUID 0000000D: 00000018-00000000-00000001-00000000 [SL 0C] [CET_S]
CPUID 0000000D: 00000328-00000000-00000001-00000000 [SL 0F] [LBR]
CPUID 0000000D: 00000008-00000000-00000001-00000000 [SL 10] [HWP]
CPUID 0000000E: 00000000-00000000-00000000-00000000
CPUID 0000000F: 00000000-00000000-00000000-00000000 [SL 00]
CPUID 0000000F: 00000000-00000000-00000000-00000000 [SL 01]
CPUID 00000010: 00000000-00000000-00000000-00000000 [SL 00]
CPUID 00000010: 00000000-00000000-00000000-00000000 [SL 01]
CPUID 00000011: 00000000-00000000-00000000-00000000
CPUID 00000012: 00000000-00000000-00000000-00000000 [SL 00]
CPUID 00000012: 00000000-00000000-00000000-00000000 [SL 01]
CPUID 00000013: 00000000-00000000-00000000-00000000
CPUID 00000014: 00000001-0000005F-00000007-00000000 [SL 00]
CPUID 00000014: 02490002-003F003F-00000000-00000000 [SL 01]
CPUID 00000015: 00000002-00000092-0249F000-00000000 [73.00x / 38400000 / 2803.20]
CPUID 00000016: 00000AF0-0000125C-00000064-00000000 [2800 / 4700 / 100]
CPUID 00000017: 00000000-00000000-00000000-00000000 [SL 00]
CPUID 00000018: 00000008-00000000-00000000-00000000 [SL 00]
CPUID 00000018: 00000000-00080001-00000020-00004022 [SL 01]
CPUID 00000018: 00000000-00080006-00000004-00004022 [SL 02]
CPUID 00000018: 00000000-0010000F-00000001-00004125 [SL 03]
CPUID 00000018: 00000000-00040001-00000010-00004024 [SL 04]
CPUID 00000018: 00000000-00040006-00000008-00004024 [SL 05]
CPUID 00000018: 00000000-00080008-00000001-00004124 [SL 06]
CPUID 00000018: 00000000-00080007-00000080-00004043 [SL 07]
CPUID 00000018: 00000000-00080009-00000080-00004043 [SL 08]
CPUID 00000019: 00000007-00000014-00000003-00000000
CPUID 0000001A: 00000000-00000000-00000000-00000000 [Unknown]
CPUID 0000001B: 00000001-00000001-00000000-00000000 [SL 00]
CPUID 0000001C: 4000000B-00000007-00000007-00000000
CPUID 0000001D: 00000000-00000000-00000000-00000000 [SL 00]
CPUID 0000001E: 00000000-00000000-00000000-00000000 [SL 00]
CPUID 0000001F: 00000001-00000001-00000100-00000006 [SL 00]
CPUID 0000001F: 00000005-00000004-00000201-00000006 [SL 01]
CPUID 00000020: 00000000-00000001-00000000-00000000 [SL 00]
CPUID 80000000: 80000008-00000000-00000000-00000000
CPUID 80000001: 00000000-00000000-00000121-2C100000
CPUID 80000002: 65746E49-2952286C-6F655820-2952286E [Intel(R) Xeon(R)]
CPUID 80000003: 31333620-00005035-00000000-00000000 [ 6315P]
CPUID 80000004: 00000000-00000000-00000000-00000000 []
CPUID 80000005: 00000000-00000000-00000000-00000000 [L1D: 0 KB / L1I: 0 KB]
CPUID 80000006: 00000000-00000000-08007040-00000000 [L2: 2048 KB / L3: 0 KB]
CPUID 80000007: 00000000-00000000-00000000-00000100
CPUID 80000008: 0000302E-00000000-00000000-00000000

L1    Data Cache:    48 KB, 12-way Associative, 64-byte Line
L1  Instr. Cache:    32 KB,  8-way Associative, 64-byte Line
L2 Unified Cache:     2 MB, 16-way Associative, 64-byte Line
L3 Unified Cache:    12 MB,  6-way Associative, 64-byte Line

------[ All CPUs ]------

CPU   0: APICID    0 / Package 0 / Core   0 / Thread 0: Valid
CPU   1: APICID    2 / Package 0 / Core   1 / Thread 0: Valid
CPU   2: APICID    4 / Package 0 / Core   2 / Thread 0: Valid
CPU   3: APICID    6 / Package 0 / Core   3 / Thread 0: Valid

------[ MSR Registers / Logical CPU #0 ]------

MSR 00000017: 0010-0000-0000-0000 [PlatID = 4]
MSR 0000001B: 0000-0000-FEE0-0D00
MSR 00000035: 0000-0000-0004-0004
MSR 00000048: 0000-0000-0000-0001
MSR 00000049: < FAILED >
MSR 0000008B: 0000-012F-0000-0000
MSR 000000CE: 0808-0838-F081-1C00 [eD = 0]
MSR 000000E7: 0000-0177-AC6E-DCA8 [S200]
MSR 000000E7: 0000-0177-B8B8-6B28 [S200]
MSR 000000E7: 0000-0177-C7D1-1C90
MSR 000000E8: 0000-0256-9FA0-CA05 [S200]
MSR 000000E8: 0000-0256-B62B-F3EE [S200]
MSR 000000E8: 0000-0256-D7D6-68F8
MSR 0000010A: 0000-0000-0CC8-FD6B
MSR 0000010B: < FAILED >
MSR 00000194: 0000-0000-0011-0000
MSR 00000198: 0000-245F-0000-2D00 [S200]
MSR 00000198: 0000-23A6-0000-2D00 [S200]
MSR 00000198: 0000-24D2-0000-2F00
MSR 00000199: 0000-0000-0000-2F00
MSR 0000019A: 0000-0000-0000-0000
MSR 0000019B: 0000-0000-0000-0010
MSR 0000019C: 0000-0000-8839-0000 [S200]
MSR 0000019C: 0000-0000-883F-0000 [S200]
MSR 0000019C: 0000-0000-8838-0000
MSR 0000019D: 0000-0000-0000-0000
MSR 000001A0: 0000-0000-0085-0089
MSR 000001A2: 0000-0000-8064-1400
MSR 000001A4: 0000-0000-0000-0000
MSR 000001AA: 0000-0000-0000-3042
MSR 000001AC: < FAILED >
MSR 000001AD: 2D2D-2D2D-2D2D-2F2F
MSR 000001AE: 0807-0605-0403-0201
MSR 000001AF: < FAILED >
MSR 000001B0: 0000-0000-0000-0000
MSR 000001B1: 0000-0000-8834-0000
MSR 000001B2: 0000-0000-0000-0000
MSR 000001FC: 0000-0000-00EC-005F
MSR 00000300: < FAILED >
MSR 0000030A: 0000-0000-0000-0000 [S200]
MSR 0000030A: 0000-0000-0000-0000 [S200]
MSR 0000030A: 0000-0000-0000-0000
MSR 0000030B: 0000-0000-0000-0000 [S200]
MSR 0000030B: 0000-0000-0000-0000 [S200]
MSR 0000030B: 0000-0000-0000-0000
MSR 00000480: 03DA-0500-0000-0013
MSR 00000481: 0000-00FF-0000-0016
MSR 00000482: FFFB-FFFE-0401-E172
MSR 00000483: F77F-FFFF-0003-6DFF
MSR 00000484: 0076-FFFF-0000-11FF
MSR 00000485: 0000-0000-7004-C1E7
MSR 00000486: 0000-0000-8000-0021
MSR 00000487: 0000-0000-FFFF-FFFF
MSR 00000488: 0000-0000-0000-2000
MSR 00000489: 0000-0000-01FF-6FFF
MSR 0000048A: 0000-0000-0000-002E
MSR 0000048B: 0F5F-7FFF-0000-0000
MSR 0000048C: 0001-0F01-06F3-4141
MSR 0000048D: 0000-00FF-0000-0016
MSR 0000048E: FFFB-FFFE-0400-6172
MSR 0000048F: F77F-FFFF-0003-6DFB
MSR 00000490: 0076-FFFF-0000-11FB
MSR 00000601: 0000-0000-0000-05C0
MSR 00000602: < FAILED >
MSR 00000603: 0036-0000-0036-3636
MSR 00000604: < FAILED >
MSR 00000606: 0000-0000-000A-0E03
MSR 0000060A: 0000-0000-0000-0000
MSR 0000060B: 0000-0000-0000-0000
MSR 0000060C: 0000-0000-0000-0000
MSR 0000060D: 0000-0031-E6EA-96BA
MSR 00000610: 0042-8210-0015-81B8
MSR 00000611: 0000-0000-2165-ADFA [S200]
MSR 00000611: 0000-0000-2165-F709 [S200]
MSR 00000611: 0000-0000-2166-4034
MSR 00000613: 0000-0000-0000-0000
MSR 00000614: 0000-0000-0000-01B8
MSR 00000618: 0000-0000-0000-0000
MSR 00000619: 0000-0000-0000-0000 [S200]
MSR 00000619: 0000-0000-0000-0000 [S200]
MSR 00000619: 0000-0000-0000-0000
MSR 0000061B: 0000-0000-0000-0000
MSR 0000061C: < FAILED >
MSR 0000061E: < FAILED >
MSR 00000620: 0000-0000-0000-0829
MSR 00000621: 0000-0000-2313-0029
MSR 00000638: 0000-0000-0000-0000
MSR 00000639: 0000-0000-184F-934B [S200]
MSR 00000639: 0000-0000-184F-C4B7 [S200]
MSR 00000639: 0000-0000-1850-516D
MSR 0000063A: 0000-0000-0000-0010
MSR 0000063B: < FAILED >
MSR 00000640: 0000-0000-0000-0000
MSR 00000641: 0000-0000-0000-0000 [S200]
MSR 00000641: 0000-0000-0000-0000 [S200]
MSR 00000641: 0000-0000-0000-0000
MSR 00000642: 0000-0000-0000-0010
MSR 00000648: 0000-0000-0000-001C
MSR 00000649: 0000-0000-0000-0000
MSR 0000064A: 0000-0000-0000-0000
MSR 0000064B: 0000-0000-8000-0000
MSR 0000064C: 0000-0000-0000-0000
MSR 00000690: < FAILED >
MSR 000006B0: 0000-0000-0000-0000
MSR 000006B1: 0000-0000-0100-0000
MSR 00000770: 0000-0000-0000-0001
MSR 00000771: 0000-0000-011F-243C
MSR 00000772: 0000-019E-0C00-3C23
MSR 00000773: < FAILED >
MSR 00000774: 0000-059E-0C00-3C23
MSR 00000777: 0000-0000-0000-0000
MSR 00000832: 0000-0000-0000-00D1
MSR 00000838: 0000-0000-0000-0258
MSR 00000839: 0000-0000-0000-0205
MSR 0000083E: 0000-0000-0000-000A

------[ MSR Registers / Logical CPU #1 ]------

MSR 00000017: 0010-0000-0000-0000 [PlatID = 4]
MSR 0000001B: 0000-0000-FEE0-0C00
MSR 00000035: 0000-0000-0004-0004
MSR 00000048: 0000-0000-0000-0001
MSR 00000049: < FAILED >
MSR 0000008B: 0000-012F-0000-0000
MSR 000000CE: 0808-0838-F081-1C00 [eD = 0]
MSR 000000E7: 0000-0147-1A0D-5B7C
MSR 000000E8: 0000-020C-7B3A-1EC5
MSR 0000010A: 0000-0000-0CC8-FD6B
MSR 0000010B: < FAILED >
MSR 00000194: 0000-0000-0011-0000
MSR 00000198: 0000-2443-0000-2F00
MSR 00000199: 0000-0000-0000-2F00
MSR 0000019A: 0000-0000-0000-0000
MSR 0000019B: 0000-0000-0000-0010
MSR 0000019C: 0000-0000-8841-0000
MSR 0000019D: 0000-0000-0000-0000
MSR 000001A0: 0000-0000-0085-0089
MSR 000001A2: 0000-0000-8064-1400
MSR 000001A4: 0000-0000-0000-0000
MSR 000001AA: 0000-0000-0000-3042
MSR 000001AC: < FAILED >
MSR 000001AD: 2D2D-2D2D-2D2D-2F2F
MSR 000001AE: 0807-0605-0403-0201
MSR 000001AF: < FAILED >
MSR 000001B0: 0000-0000-0000-0000
MSR 000001B1: 0000-0000-8839-0000
MSR 000001B2: 0000-0000-0000-0000
MSR 000001FC: 0000-0000-00EC-005F
MSR 00000300: < FAILED >
MSR 0000030A: 0000-0000-0000-0000
MSR 0000030B: 0000-0000-0000-0000
MSR 00000480: 03DA-0500-0000-0013
MSR 00000481: 0000-00FF-0000-0016
MSR 00000482: FFFB-FFFE-0401-E172
MSR 00000483: F77F-FFFF-0003-6DFF
MSR 00000484: 0076-FFFF-0000-11FF
MSR 00000485: 0000-0000-7004-C1E7
MSR 00000486: 0000-0000-8000-0021
MSR 00000487: 0000-0000-FFFF-FFFF
MSR 00000488: 0000-0000-0000-2000
MSR 00000489: 0000-0000-01FF-6FFF
MSR 0000048A: 0000-0000-0000-002E
MSR 0000048B: 0F5F-7FFF-0000-0000
MSR 0000048C: 0001-0F01-06F3-4141
MSR 0000048D: 0000-00FF-0000-0016
MSR 0000048E: FFFB-FFFE-0400-6172
MSR 0000048F: F77F-FFFF-0003-6DFB
MSR 00000490: 0076-FFFF-0000-11FB
MSR 00000601: 0000-0000-0000-05C0
MSR 00000602: < FAILED >
MSR 00000603: 0036-0000-0036-3636
MSR 00000604: < FAILED >
MSR 00000606: 0000-0000-000A-0E03
MSR 0000060A: 0000-0000-0000-0000
MSR 0000060B: 0000-0000-0000-0000
MSR 0000060C: 0000-0000-0000-0000
MSR 0000060D: 0000-0031-F831-23FB
MSR 00000610: 0042-8210-0015-81B8
MSR 00000611: 0000-0000-216A-3FC6
MSR 00000613: 0000-0000-0000-0000
MSR 00000614: 0000-0000-0000-01B8
MSR 00000618: 0000-0000-0000-0000
MSR 00000619: 0000-0000-0000-0000
MSR 0000061B: 0000-0000-0000-0000
MSR 0000061C: < FAILED >
MSR 0000061E: < FAILED >
MSR 00000620: 0000-0000-0000-0829
MSR 00000621: 0000-0000-2313-0029
MSR 00000638: 0000-0000-0000-0000
MSR 00000639: 0000-0000-1851-A744
MSR 0000063A: 0000-0000-0000-0010
MSR 0000063B: < FAILED >
MSR 00000640: 0000-0000-0000-0000
MSR 00000641: 0000-0000-0000-0000
MSR 00000642: 0000-0000-0000-0010
MSR 00000648: 0000-0000-0000-001C
MSR 00000649: 0000-0000-0000-0000
MSR 0000064A: 0000-0000-0000-0000
MSR 0000064B: 0000-0000-8000-0000
MSR 0000064C: 0000-0000-0000-0000
MSR 00000690: < FAILED >
MSR 000006B0: 0000-0000-0000-0000
MSR 000006B1: 0000-0000-0100-0000
MSR 00000770: 0000-0000-0000-0001
MSR 00000771: 0000-0000-011F-243C
MSR 00000772: 0000-019E-0C00-3C23
MSR 00000773: < FAILED >
MSR 00000774: 0000-0400-003C-3C23
MSR 00000777: 0000-0000-0000-0000
MSR 00000832: 0000-0000-0002-00D1
MSR 00000838: 0000-0000-0000-0209
MSR 00000839: 0000-0000-0000-0184
MSR 0000083E: 0000-0000-0000-000A

------[ MSR Registers / Logical CPU #2 ]------

MSR 00000017: 0010-0000-0000-0000 [PlatID = 4]
MSR 0000001B: 0000-0000-FEE0-0C00
MSR 00000035: 0000-0000-0004-0004
MSR 00000048: 0000-0000-0000-0001
MSR 00000049: < FAILED >
MSR 0000008B: 0000-012F-0000-0000
MSR 000000CE: 0808-0838-F081-1C00 [eD = 0]
MSR 000000E7: 0000-011A-6D71-72D8
MSR 000000E8: 0000-01C3-099F-6E65
MSR 0000010A: 0000-0000-0CC8-FD6B
MSR 0000010B: < FAILED >
MSR 00000194: 0000-0000-0011-0000
MSR 00000198: 0000-2455-0000-2F00
MSR 00000199: 0000-0000-0000-2F00
MSR 0000019A: 0000-0000-0000-0000
MSR 0000019B: 0000-0000-0000-0010
MSR 0000019C: 0000-0000-8841-0000
MSR 0000019D: 0000-0000-0000-0000
MSR 000001A0: 0000-0000-0085-0089
MSR 000001A2: 0000-0000-8064-1400
MSR 000001A4: 0000-0000-0000-0000
MSR 000001AA: 0000-0000-0000-3042
MSR 000001AC: < FAILED >
MSR 000001AD: 2D2D-2D2D-2D2D-2F2F
MSR 000001AE: 0807-0605-0403-0201
MSR 000001AF: < FAILED >
MSR 000001B0: 0000-0000-0000-0000
MSR 000001B1: 0000-0000-883D-0000
MSR 000001B2: 0000-0000-0000-0000
MSR 000001FC: 0000-0000-00EC-005F
MSR 00000300: < FAILED >
MSR 0000030A: 0000-0000-0000-0000
MSR 0000030B: 0000-0000-0000-0000
MSR 00000480: 03DA-0500-0000-0013
MSR 00000481: 0000-00FF-0000-0016
MSR 00000482: FFFB-FFFE-0401-E172
MSR 00000483: F77F-FFFF-0003-6DFF
MSR 00000484: 0076-FFFF-0000-11FF
MSR 00000485: 0000-0000-7004-C1E7
MSR 00000486: 0000-0000-8000-0021
MSR 00000487: 0000-0000-FFFF-FFFF
MSR 00000488: 0000-0000-0000-2000
MSR 00000489: 0000-0000-01FF-6FFF
MSR 0000048A: 0000-0000-0000-002E
MSR 0000048B: 0F5F-7FFF-0000-0000
MSR 0000048C: 0001-0F01-06F3-4141
MSR 0000048D: 0000-00FF-0000-0016
MSR 0000048E: FFFB-FFFE-0400-6172
MSR 0000048F: F77F-FFFF-0003-6DFB
MSR 00000490: 0076-FFFF-0000-11FB
MSR 00000601: 0000-0000-0000-05C0
MSR 00000602: < FAILED >
MSR 00000603: 0036-0000-0036-3636
MSR 00000604: < FAILED >
MSR 00000606: 0000-0000-000A-0E03
MSR 0000060A: 0000-0000-0000-0000
MSR 0000060B: 0000-0000-0000-0000
MSR 0000060C: 0000-0000-0000-0000
MSR 0000060D: 0000-0031-F831-23FB
MSR 00000610: 0042-8210-0015-81B8
MSR 00000611: 0000-0000-216A-40D2
MSR 00000613: 0000-0000-0000-0000
MSR 00000614: 0000-0000-0000-01B8
MSR 00000618: 0000-0000-0000-0000
MSR 00000619: 0000-0000-0000-0000
MSR 0000061B: 0000-0000-0000-0000
MSR 0000061C: < FAILED >
MSR 0000061E: < FAILED >
MSR 00000620: 0000-0000-0000-0829
MSR 00000621: 0000-0000-2313-0029
MSR 00000638: 0000-0000-0000-0000
MSR 00000639: 0000-0000-1851-A7FA
MSR 0000063A: 0000-0000-0000-0010
MSR 0000063B: < FAILED >
MSR 00000640: 0000-0000-0000-0000
MSR 00000641: 0000-0000-0000-0000
MSR 00000642: 0000-0000-0000-0010
MSR 00000648: 0000-0000-0000-001C
MSR 00000649: 0000-0000-0000-0000
MSR 0000064A: 0000-0000-0000-0000
MSR 0000064B: 0000-0000-8000-0000
MSR 0000064C: 0000-0000-0000-0000
MSR 00000690: < FAILED >
MSR 000006B0: 0000-0000-0000-0000
MSR 000006B1: 0000-0000-0100-0000
MSR 00000770: 0000-0000-0000-0001
MSR 00000771: 0000-0000-011F-243C
MSR 00000772: 0000-019E-0C00-3C23
MSR 00000773: < FAILED >
MSR 00000774: 0000-0400-003C-3C23
MSR 00000777: 0000-0000-0000-0000
MSR 00000832: 0000-0000-0002-00D1
MSR 00000838: 0000-0000-0000-0209
MSR 00000839: 0000-0000-0000-0180
MSR 0000083E: 0000-0000-0000-000A

------[ MSR Registers / Logical CPU #3 ]------

MSR 00000017: 0010-0000-0000-0000 [PlatID = 4]
MSR 0000001B: 0000-0000-FEE0-0C00
MSR 00000035: 0000-0000-0004-0004
MSR 00000048: 0000-0000-0000-0001
MSR 00000049: < FAILED >
MSR 0000008B: 0000-012F-0000-0000
MSR 000000CE: 0808-0838-F081-1C00 [eD = 0]
MSR 000000E7: 0000-00F1-E35C-3660
MSR 000000E8: 0000-0183-5C9D-93EC
MSR 0000010A: 0000-0000-0CC8-FD6B
MSR 0000010B: < FAILED >
MSR 00000194: 0000-0000-0011-0000
MSR 00000198: 0000-2453-0000-2F00
MSR 00000199: 0000-0000-0000-2F00
MSR 0000019A: 0000-0000-0000-0000
MSR 0000019B: 0000-0000-0000-0010
MSR 0000019C: 0000-0000-883F-0000
MSR 0000019D: 0000-0000-0000-0000
MSR 000001A0: 0000-0000-0085-0089
MSR 000001A2: 0000-0000-8064-1400
MSR 000001A4: 0000-0000-0000-0000
MSR 000001AA: 0000-0000-0000-3042
MSR 000001AC: < FAILED >
MSR 000001AD: 2D2D-2D2D-2D2D-2F2F
MSR 000001AE: 0807-0605-0403-0201
MSR 000001AF: < FAILED >
MSR 000001B0: 0000-0000-0000-0000
MSR 000001B1: 0000-0000-883E-0000
MSR 000001B2: 0000-0000-0000-0000
MSR 000001FC: 0000-0000-00EC-005F
MSR 00000300: < FAILED >
MSR 0000030A: 0000-0000-0000-0000
MSR 0000030B: 0000-0000-0000-0000
MSR 00000480: 03DA-0500-0000-0013
MSR 00000481: 0000-00FF-0000-0016
MSR 00000482: FFFB-FFFE-0401-E172
MSR 00000483: F77F-FFFF-0003-6DFF
MSR 00000484: 0076-FFFF-0000-11FF
MSR 00000485: 0000-0000-7004-C1E7
MSR 00000486: 0000-0000-8000-0021
MSR 00000487: 0000-0000-FFFF-FFFF
MSR 00000488: 0000-0000-0000-2000
MSR 00000489: 0000-0000-01FF-6FFF
MSR 0000048A: 0000-0000-0000-002E
MSR 0000048B: 0F5F-7FFF-0000-0000
MSR 0000048C: 0001-0F01-06F3-4141
MSR 0000048D: 0000-00FF-0000-0016
MSR 0000048E: FFFB-FFFE-0400-6172
MSR 0000048F: F77F-FFFF-0003-6DFB
MSR 00000490: 0076-FFFF-0000-11FB
MSR 00000601: 0000-0000-0000-05C0
MSR 00000602: < FAILED >
MSR 00000603: 0036-0000-0036-3636
MSR 00000604: < FAILED >
MSR 00000606: 0000-0000-000A-0E03
MSR 0000060A: 0000-0000-0000-0000
MSR 0000060B: 0000-0000-0000-0000
MSR 0000060C: 0000-0000-0000-0000
MSR 0000060D: 0000-0031-F831-23FB
MSR 00000610: 0042-8210-0015-81B8
MSR 00000611: 0000-0000-216A-40D2
MSR 00000613: 0000-0000-0000-0000
MSR 00000614: 0000-0000-0000-01B8
MSR 00000618: 0000-0000-0000-0000
MSR 00000619: 0000-0000-0000-0000
MSR 0000061B: 0000-0000-0000-0000
MSR 0000061C: < FAILED >
MSR 0000061E: < FAILED >
MSR 00000620: 0000-0000-0000-0829
MSR 00000621: 0000-0000-2327-0029
MSR 00000638: 0000-0000-0000-0000
MSR 00000639: 0000-0000-1851-A7FA
MSR 0000063A: 0000-0000-0000-0010
MSR 0000063B: < FAILED >
MSR 00000640: 0000-0000-0000-0000
MSR 00000641: 0000-0000-0000-0000
MSR 00000642: 0000-0000-0000-0010
MSR 00000648: 0000-0000-0000-001C
MSR 00000649: 0000-0000-0000-0000
MSR 0000064A: 0000-0000-0000-0000
MSR 0000064B: 0000-0000-8000-0000
MSR 0000064C: 0000-0000-0000-0000
MSR 00000690: < FAILED >
MSR 000006B0: 0000-0000-0000-0000
MSR 000006B1: 0000-0000-0100-0000
MSR 00000770: 0000-0000-0000-0001
MSR 00000771: 0000-0000-011F-243C
MSR 00000772: 0000-019E-0C00-3C23
MSR 00000773: < FAILED >
MSR 00000774: 0000-0400-003C-3C23
MSR 00000777: 0000-0000-0000-0000
MSR 00000832: 0000-0000-0002-00D1
MSR 00000838: 0000-0000-0000-0209
MSR 00000839: 0000-0000-0000-0180
MSR 0000083E: 0000-0000-0000-000A
