------[ Versions ]------

Program Version : AIDA64 Engineer v6.60.5923 Beta
BenchDLL Version: 4.5.867.8-x64
Windows Version : Microsoft Windows 10 Enterprise 10.0.19044.1566 (64-bit)
GetProductInfo  : 0x00000004

------[ CPU Info ]------

CPU Type          : HexaCore Intel Core i7-3930K, 3200 MHz (32 x 100)
CPU Alias         : Sandy Bridge-E
CPU Platform      : LGA2011
CPU Stepping      : C2
Instruction Set   : x86, x86-64, MMX, SSE, SSE2, SSE3, SSSE3, SSE4.1, SSE4.2, AVX, AES
CPUID Manufacturer: GenuineIntel
CPUID CPU Name    : Intel(R) Core(TM) i7-3930K CPU @ 3.20GHz
CPUID Revision    : 000206D7h
IA Brand ID       : 00h  (Unknown)
Platform ID       : 58h  (LGA2011)
HTT / CMP Units   : 2 / 6
Max. NUMA Node    : 0

Tjmax Temperature          : 91 Celsius
HTC Temperature Limit      : 0 Celsius
CPU TDP                    : 130 W
DRAM TDP                   : 35 W
CPU TDC                    : 135 A
CPU Max Power Limit        : Unlimited Power / Unlimited Time
CPU Power Limit 1 (Long)   : 130 W / 10.00 sec  (Unlocked)
CPU Power Limit 2 (Short)  : 0 W / 7.81 ms  (Unlocked)
Max Turbo Boost Multipliers: 1C: 38x, 2C: 38x, 3C: 37x, 4C: 36x, 5C: 35x, 6C: 35x

------[ Motherboard Info ]------

Motherboard ID      : 63-0100-000001-00101111-122211-Chipset$1APEQ016_BIOS DATE: 05/08/15 17:37:14 VER: 17.04
Motherboard Model   : Asus P9X79-E WS
Motherboard Chipset : Intel Patsburg X79, Intel Sandy Bridge-E

DMI MB Manufacturer : ASUSTeK COMPUTER INC.
DMI MB Product      : P9X79-E WS
DMI MB Version      : Rev 1.xx
DMI MB Serial       : 130814410200006
DMI SYS Manufacturer: System manufacturer
DMI SYS Product     : System Product Name
DMI SYS Version     : System Version
DMI SYS Serial      : System Serial Number
DMI BIOS Version    : 1704


------[ CPUID Registers / Logical CPU #0 ]------

allcpu: Package 0 / Core 0 / Thread 0: Valid

CPUID 00000000: 0000000D-756E6547-6C65746E-49656E69 [GenuineIntel]
CPUID 00000001: 000206D7-00200800-1FBEE3BF-BFEBFBFF
CPUID 00000002: 76035A01-00F0B2FF-00000000-00CA0000
CPUID 00000003: 00000000-00000000-00000000-00000000
CPUID 00000004: 3C004121-01C0003F-0000003F-00000000 [SL 00] [L1D: 32 KB]
CPUID 00000004: 3C004122-01C0003F-0000003F-00000000 [SL 01] [L1I: 32 KB]
CPUID 00000004: 3C004143-01C0003F-000001FF-00000000 [SL 02] [L2U: 256 KB]
CPUID 00000004: 3C07C163-03C0003F-00002FFF-00000006 [SL 03] [L3U: 12 MB]
CPUID 00000005: 00000040-00000040-00000003-00021120
CPUID 00000006: 00000075-00000002-00000009-00000000
CPUID 00000007: 00000000-00000000-00000000-9C000400 [SL 00]
CPUID 00000008: 00000000-00000000-00000000-00000000
CPUID 00000009: 00000001-00000000-00000000-00000000
CPUID 0000000A: 07300403-00000000-00000000-00000603
CPUID 0000000B: 00000001-00000002-00000100-00000000 [SL 00]
CPUID 0000000B: 00000005-0000000C-00000201-00000000 [SL 01]
CPUID 0000000C: 00000000-00000000-00000000-00000000
CPUID 0000000D: 00000007-00000340-00000340-00000000 [SL 00] [x87]
CPUID 0000000D: 00000001-00000000-00000000-00000000 [SL 01] [SSE]
CPUID 0000000D: 00000100-00000240-00000000-00000000 [SL 02] [AVX]
CPUID 80000000: 80000008-00000000-00000000-00000000
CPUID 80000001: 00000000-00000000-00000001-2C100000
CPUID 80000002: 20202020-49202020-6C65746E-20295228 [       Intel(R) ]
CPUID 80000003: 65726F43-294D5428-2D376920-30333933 [Core(TM) i7-3930]
CPUID 80000004: 5043204B-20402055-30322E33-007A4847 [K CPU @ 3.20GHz]
CPUID 80000005: 00000000-00000000-00000000-00000000 [L1D: 0 KB / L1I: 0 KB]
CPUID 80000006: 00000000-00000000-01006040-00000000 [L2: 256 KB] / L3: 0 KB]
CPUID 80000007: 00000000-00000000-00000000-00000100
CPUID 80000008: 0000302E-00000000-00000000-00000000

L1    Data Cache:    32 KB,  8-way Associative, 64-byte Line
L1  Instr. Cache:    32 KB,  8-way Associative, 64-byte Line
L2 Unified Cache:   256 KB,  8-way Associative, 64-byte Line
L3 Unified Cache:    12 MB, 16-way Associative, 64-byte Line

------[ CPUID Registers / Logical CPU #1 ]------

allcpu: Package 0 / Core 0 / Thread 1: Valid, Virtual

CPUID 00000000: 0000000D-756E6547-6C65746E-49656E69 [GenuineIntel]
CPUID 00000001: 000206D7-01200800-1FBEE3BF-BFEBFBFF
CPUID 00000002: 76035A01-00F0B2FF-00000000-00CA0000
CPUID 00000003: 00000000-00000000-00000000-00000000
CPUID 00000004: 3C004121-01C0003F-0000003F-00000000 [SL 00] [L1D: 32 KB]
CPUID 00000004: 3C004122-01C0003F-0000003F-00000000 [SL 01] [L1I: 32 KB]
CPUID 00000004: 3C004143-01C0003F-000001FF-00000000 [SL 02] [L2U: 256 KB]
CPUID 00000004: 3C07C163-03C0003F-00002FFF-00000006 [SL 03] [L3U: 12 MB]
CPUID 00000005: 00000040-00000040-00000003-00021120
CPUID 00000006: 00000075-00000002-00000009-00000000
CPUID 00000007: 00000000-00000000-00000000-9C000400 [SL 00]
CPUID 00000008: 00000000-00000000-00000000-00000000
CPUID 00000009: 00000001-00000000-00000000-00000000
CPUID 0000000A: 07300403-00000000-00000000-00000603
CPUID 0000000B: 00000001-00000002-00000100-00000001 [SL 00]
CPUID 0000000B: 00000005-0000000C-00000201-00000001 [SL 01]
CPUID 0000000C: 00000000-00000000-00000000-00000000
CPUID 0000000D: 00000007-00000340-00000340-00000000 [SL 00] [x87]
CPUID 0000000D: 00000001-00000000-00000000-00000000 [SL 01] [SSE]
CPUID 0000000D: 00000100-00000240-00000000-00000000 [SL 02] [AVX]
CPUID 80000000: 80000008-00000000-00000000-00000000
CPUID 80000001: 00000000-00000000-00000001-2C100000
CPUID 80000002: 20202020-49202020-6C65746E-20295228 [       Intel(R) ]
CPUID 80000003: 65726F43-294D5428-2D376920-30333933 [Core(TM) i7-3930]
CPUID 80000004: 5043204B-20402055-30322E33-007A4847 [K CPU @ 3.20GHz]
CPUID 80000005: 00000000-00000000-00000000-00000000 [L1D: 0 KB / L1I: 0 KB]
CPUID 80000006: 00000000-00000000-01006040-00000000 [L2: 256 KB] / L3: 0 KB]
CPUID 80000007: 00000000-00000000-00000000-00000100
CPUID 80000008: 0000302E-00000000-00000000-00000000

L1    Data Cache:    32 KB,  8-way Associative, 64-byte Line
L1  Instr. Cache:    32 KB,  8-way Associative, 64-byte Line
L2 Unified Cache:   256 KB,  8-way Associative, 64-byte Line
L3 Unified Cache:    12 MB, 16-way Associative, 64-byte Line

------[ CPUID Registers / Logical CPU #2 ]------

allcpu: Package 0 / Core 1 / Thread 0: Valid

CPUID 00000000: 0000000D-756E6547-6C65746E-49656E69 [GenuineIntel]
CPUID 00000001: 000206D7-02200800-1FBEE3BF-BFEBFBFF
CPUID 00000002: 76035A01-00F0B2FF-00000000-00CA0000
CPUID 00000003: 00000000-00000000-00000000-00000000
CPUID 00000004: 3C004121-01C0003F-0000003F-00000000 [SL 00] [L1D: 32 KB]
CPUID 00000004: 3C004122-01C0003F-0000003F-00000000 [SL 01] [L1I: 32 KB]
CPUID 00000004: 3C004143-01C0003F-000001FF-00000000 [SL 02] [L2U: 256 KB]
CPUID 00000004: 3C07C163-03C0003F-00002FFF-00000006 [SL 03] [L3U: 12 MB]
CPUID 00000005: 00000040-00000040-00000003-00021120
CPUID 00000006: 00000075-00000002-00000009-00000000
CPUID 00000007: 00000000-00000000-00000000-9C000400 [SL 00]
CPUID 00000008: 00000000-00000000-00000000-00000000
CPUID 00000009: 00000001-00000000-00000000-00000000
CPUID 0000000A: 07300403-00000000-00000000-00000603
CPUID 0000000B: 00000001-00000002-00000100-00000002 [SL 00]
CPUID 0000000B: 00000005-0000000C-00000201-00000002 [SL 01]
CPUID 0000000C: 00000000-00000000-00000000-00000000
CPUID 0000000D: 00000007-00000340-00000340-00000000 [SL 00] [x87]
CPUID 0000000D: 00000001-00000000-00000000-00000000 [SL 01] [SSE]
CPUID 0000000D: 00000100-00000240-00000000-00000000 [SL 02] [AVX]
CPUID 80000000: 80000008-00000000-00000000-00000000
CPUID 80000001: 00000000-00000000-00000001-2C100000
CPUID 80000002: 20202020-49202020-6C65746E-20295228 [       Intel(R) ]
CPUID 80000003: 65726F43-294D5428-2D376920-30333933 [Core(TM) i7-3930]
CPUID 80000004: 5043204B-20402055-30322E33-007A4847 [K CPU @ 3.20GHz]
CPUID 80000005: 00000000-00000000-00000000-00000000 [L1D: 0 KB / L1I: 0 KB]
CPUID 80000006: 00000000-00000000-01006040-00000000 [L2: 256 KB] / L3: 0 KB]
CPUID 80000007: 00000000-00000000-00000000-00000100
CPUID 80000008: 0000302E-00000000-00000000-00000000

L1    Data Cache:    32 KB,  8-way Associative, 64-byte Line
L1  Instr. Cache:    32 KB,  8-way Associative, 64-byte Line
L2 Unified Cache:   256 KB,  8-way Associative, 64-byte Line
L3 Unified Cache:    12 MB, 16-way Associative, 64-byte Line

------[ CPUID Registers / Logical CPU #3 ]------

allcpu: Package 0 / Core 1 / Thread 1: Valid, Virtual

CPUID 00000000: 0000000D-756E6547-6C65746E-49656E69 [GenuineIntel]
CPUID 00000001: 000206D7-03200800-1FBEE3BF-BFEBFBFF
CPUID 00000002: 76035A01-00F0B2FF-00000000-00CA0000
CPUID 00000003: 00000000-00000000-00000000-00000000
CPUID 00000004: 3C004121-01C0003F-0000003F-00000000 [SL 00] [L1D: 32 KB]
CPUID 00000004: 3C004122-01C0003F-0000003F-00000000 [SL 01] [L1I: 32 KB]
CPUID 00000004: 3C004143-01C0003F-000001FF-00000000 [SL 02] [L2U: 256 KB]
CPUID 00000004: 3C07C163-03C0003F-00002FFF-00000006 [SL 03] [L3U: 12 MB]
CPUID 00000005: 00000040-00000040-00000003-00021120
CPUID 00000006: 00000075-00000002-00000009-00000000
CPUID 00000007: 00000000-00000000-00000000-9C000400 [SL 00]
CPUID 00000008: 00000000-00000000-00000000-00000000
CPUID 00000009: 00000001-00000000-00000000-00000000
CPUID 0000000A: 07300403-00000000-00000000-00000603
CPUID 0000000B: 00000001-00000002-00000100-00000003 [SL 00]
CPUID 0000000B: 00000005-0000000C-00000201-00000003 [SL 01]
CPUID 0000000C: 00000000-00000000-00000000-00000000
CPUID 0000000D: 00000007-00000340-00000340-00000000 [SL 00] [x87]
CPUID 0000000D: 00000001-00000000-00000000-00000000 [SL 01] [SSE]
CPUID 0000000D: 00000100-00000240-00000000-00000000 [SL 02] [AVX]
CPUID 80000000: 80000008-00000000-00000000-00000000
CPUID 80000001: 00000000-00000000-00000001-2C100000
CPUID 80000002: 20202020-49202020-6C65746E-20295228 [       Intel(R) ]
CPUID 80000003: 65726F43-294D5428-2D376920-30333933 [Core(TM) i7-3930]
CPUID 80000004: 5043204B-20402055-30322E33-007A4847 [K CPU @ 3.20GHz]
CPUID 80000005: 00000000-00000000-00000000-00000000 [L1D: 0 KB / L1I: 0 KB]
CPUID 80000006: 00000000-00000000-01006040-00000000 [L2: 256 KB] / L3: 0 KB]
CPUID 80000007: 00000000-00000000-00000000-00000100
CPUID 80000008: 0000302E-00000000-00000000-00000000

L1    Data Cache:    32 KB,  8-way Associative, 64-byte Line
L1  Instr. Cache:    32 KB,  8-way Associative, 64-byte Line
L2 Unified Cache:   256 KB,  8-way Associative, 64-byte Line
L3 Unified Cache:    12 MB, 16-way Associative, 64-byte Line

------[ CPUID Registers / Logical CPU #4 ]------

allcpu: Package 0 / Core 2 / Thread 0: Valid

CPUID 00000000: 0000000D-756E6547-6C65746E-49656E69 [GenuineIntel]
CPUID 00000001: 000206D7-04200800-1FBEE3BF-BFEBFBFF
CPUID 00000002: 76035A01-00F0B2FF-00000000-00CA0000
CPUID 00000003: 00000000-00000000-00000000-00000000
CPUID 00000004: 3C004121-01C0003F-0000003F-00000000 [SL 00] [L1D: 32 KB]
CPUID 00000004: 3C004122-01C0003F-0000003F-00000000 [SL 01] [L1I: 32 KB]
CPUID 00000004: 3C004143-01C0003F-000001FF-00000000 [SL 02] [L2U: 256 KB]
CPUID 00000004: 3C07C163-03C0003F-00002FFF-00000006 [SL 03] [L3U: 12 MB]
CPUID 00000005: 00000040-00000040-00000003-00021120
CPUID 00000006: 00000075-00000002-00000009-00000000
CPUID 00000007: 00000000-00000000-00000000-9C000400 [SL 00]
CPUID 00000008: 00000000-00000000-00000000-00000000
CPUID 00000009: 00000001-00000000-00000000-00000000
CPUID 0000000A: 07300403-00000000-00000000-00000603
CPUID 0000000B: 00000001-00000002-00000100-00000004 [SL 00]
CPUID 0000000B: 00000005-0000000C-00000201-00000004 [SL 01]
CPUID 0000000C: 00000000-00000000-00000000-00000000
CPUID 0000000D: 00000007-00000340-00000340-00000000 [SL 00] [x87]
CPUID 0000000D: 00000001-00000000-00000000-00000000 [SL 01] [SSE]
CPUID 0000000D: 00000100-00000240-00000000-00000000 [SL 02] [AVX]
CPUID 80000000: 80000008-00000000-00000000-00000000
CPUID 80000001: 00000000-00000000-00000001-2C100000
CPUID 80000002: 20202020-49202020-6C65746E-20295228 [       Intel(R) ]
CPUID 80000003: 65726F43-294D5428-2D376920-30333933 [Core(TM) i7-3930]
CPUID 80000004: 5043204B-20402055-30322E33-007A4847 [K CPU @ 3.20GHz]
CPUID 80000005: 00000000-00000000-00000000-00000000 [L1D: 0 KB / L1I: 0 KB]
CPUID 80000006: 00000000-00000000-01006040-00000000 [L2: 256 KB] / L3: 0 KB]
CPUID 80000007: 00000000-00000000-00000000-00000100
CPUID 80000008: 0000302E-00000000-00000000-00000000

L1    Data Cache:    32 KB,  8-way Associative, 64-byte Line
L1  Instr. Cache:    32 KB,  8-way Associative, 64-byte Line
L2 Unified Cache:   256 KB,  8-way Associative, 64-byte Line
L3 Unified Cache:    12 MB, 16-way Associative, 64-byte Line

------[ CPUID Registers / Logical CPU #5 ]------

allcpu: Package 0 / Core 2 / Thread 1: Valid, Virtual

CPUID 00000000: 0000000D-756E6547-6C65746E-49656E69 [GenuineIntel]
CPUID 00000001: 000206D7-05200800-1FBEE3BF-BFEBFBFF
CPUID 00000002: 76035A01-00F0B2FF-00000000-00CA0000
CPUID 00000003: 00000000-00000000-00000000-00000000
CPUID 00000004: 3C004121-01C0003F-0000003F-00000000 [SL 00] [L1D: 32 KB]
CPUID 00000004: 3C004122-01C0003F-0000003F-00000000 [SL 01] [L1I: 32 KB]
CPUID 00000004: 3C004143-01C0003F-000001FF-00000000 [SL 02] [L2U: 256 KB]
CPUID 00000004: 3C07C163-03C0003F-00002FFF-00000006 [SL 03] [L3U: 12 MB]
CPUID 00000005: 00000040-00000040-00000003-00021120
CPUID 00000006: 00000075-00000002-00000009-00000000
CPUID 00000007: 00000000-00000000-00000000-9C000400 [SL 00]
CPUID 00000008: 00000000-00000000-00000000-00000000
CPUID 00000009: 00000001-00000000-00000000-00000000
CPUID 0000000A: 07300403-00000000-00000000-00000603
CPUID 0000000B: 00000001-00000002-00000100-00000005 [SL 00]
CPUID 0000000B: 00000005-0000000C-00000201-00000005 [SL 01]
CPUID 0000000C: 00000000-00000000-00000000-00000000
CPUID 0000000D: 00000007-00000340-00000340-00000000 [SL 00] [x87]
CPUID 0000000D: 00000001-00000000-00000000-00000000 [SL 01] [SSE]
CPUID 0000000D: 00000100-00000240-00000000-00000000 [SL 02] [AVX]
CPUID 80000000: 80000008-00000000-00000000-00000000
CPUID 80000001: 00000000-00000000-00000001-2C100000
CPUID 80000002: 20202020-49202020-6C65746E-20295228 [       Intel(R) ]
CPUID 80000003: 65726F43-294D5428-2D376920-30333933 [Core(TM) i7-3930]
CPUID 80000004: 5043204B-20402055-30322E33-007A4847 [K CPU @ 3.20GHz]
CPUID 80000005: 00000000-00000000-00000000-00000000 [L1D: 0 KB / L1I: 0 KB]
CPUID 80000006: 00000000-00000000-01006040-00000000 [L2: 256 KB] / L3: 0 KB]
CPUID 80000007: 00000000-00000000-00000000-00000100
CPUID 80000008: 0000302E-00000000-00000000-00000000

L1    Data Cache:    32 KB,  8-way Associative, 64-byte Line
L1  Instr. Cache:    32 KB,  8-way Associative, 64-byte Line
L2 Unified Cache:   256 KB,  8-way Associative, 64-byte Line
L3 Unified Cache:    12 MB, 16-way Associative, 64-byte Line

------[ CPUID Registers / Logical CPU #6 ]------

allcpu: Package 0 / Core 3 / Thread 0: Valid

CPUID 00000000: 0000000D-756E6547-6C65746E-49656E69 [GenuineIntel]
CPUID 00000001: 000206D7-06200800-1FBEE3BF-BFEBFBFF
CPUID 00000002: 76035A01-00F0B2FF-00000000-00CA0000
CPUID 00000003: 00000000-00000000-00000000-00000000
CPUID 00000004: 3C004121-01C0003F-0000003F-00000000 [SL 00] [L1D: 32 KB]
CPUID 00000004: 3C004122-01C0003F-0000003F-00000000 [SL 01] [L1I: 32 KB]
CPUID 00000004: 3C004143-01C0003F-000001FF-00000000 [SL 02] [L2U: 256 KB]
CPUID 00000004: 3C07C163-03C0003F-00002FFF-00000006 [SL 03] [L3U: 12 MB]
CPUID 00000005: 00000040-00000040-00000003-00021120
CPUID 00000006: 00000075-00000002-00000009-00000000
CPUID 00000007: 00000000-00000000-00000000-9C000400 [SL 00]
CPUID 00000008: 00000000-00000000-00000000-00000000
CPUID 00000009: 00000001-00000000-00000000-00000000
CPUID 0000000A: 07300403-00000000-00000000-00000603
CPUID 0000000B: 00000001-00000002-00000100-00000006 [SL 00]
CPUID 0000000B: 00000005-0000000C-00000201-00000006 [SL 01]
CPUID 0000000C: 00000000-00000000-00000000-00000000
CPUID 0000000D: 00000007-00000340-00000340-00000000 [SL 00] [x87]
CPUID 0000000D: 00000001-00000000-00000000-00000000 [SL 01] [SSE]
CPUID 0000000D: 00000100-00000240-00000000-00000000 [SL 02] [AVX]
CPUID 80000000: 80000008-00000000-00000000-00000000
CPUID 80000001: 00000000-00000000-00000001-2C100000
CPUID 80000002: 20202020-49202020-6C65746E-20295228 [       Intel(R) ]
CPUID 80000003: 65726F43-294D5428-2D376920-30333933 [Core(TM) i7-3930]
CPUID 80000004: 5043204B-20402055-30322E33-007A4847 [K CPU @ 3.20GHz]
CPUID 80000005: 00000000-00000000-00000000-00000000 [L1D: 0 KB / L1I: 0 KB]
CPUID 80000006: 00000000-00000000-01006040-00000000 [L2: 256 KB] / L3: 0 KB]
CPUID 80000007: 00000000-00000000-00000000-00000100
CPUID 80000008: 0000302E-00000000-00000000-00000000

L1    Data Cache:    32 KB,  8-way Associative, 64-byte Line
L1  Instr. Cache:    32 KB,  8-way Associative, 64-byte Line
L2 Unified Cache:   256 KB,  8-way Associative, 64-byte Line
L3 Unified Cache:    12 MB, 16-way Associative, 64-byte Line

------[ CPUID Registers / Logical CPU #7 ]------

allcpu: Package 0 / Core 3 / Thread 1: Valid, Virtual

CPUID 00000000: 0000000D-756E6547-6C65746E-49656E69 [GenuineIntel]
CPUID 00000001: 000206D7-07200800-1FBEE3BF-BFEBFBFF
CPUID 00000002: 76035A01-00F0B2FF-00000000-00CA0000
CPUID 00000003: 00000000-00000000-00000000-00000000
CPUID 00000004: 3C004121-01C0003F-0000003F-00000000 [SL 00] [L1D: 32 KB]
CPUID 00000004: 3C004122-01C0003F-0000003F-00000000 [SL 01] [L1I: 32 KB]
CPUID 00000004: 3C004143-01C0003F-000001FF-00000000 [SL 02] [L2U: 256 KB]
CPUID 00000004: 3C07C163-03C0003F-00002FFF-00000006 [SL 03] [L3U: 12 MB]
CPUID 00000005: 00000040-00000040-00000003-00021120
CPUID 00000006: 00000075-00000002-00000009-00000000
CPUID 00000007: 00000000-00000000-00000000-9C000400 [SL 00]
CPUID 00000008: 00000000-00000000-00000000-00000000
CPUID 00000009: 00000001-00000000-00000000-00000000
CPUID 0000000A: 07300403-00000000-00000000-00000603
CPUID 0000000B: 00000001-00000002-00000100-00000007 [SL 00]
CPUID 0000000B: 00000005-0000000C-00000201-00000007 [SL 01]
CPUID 0000000C: 00000000-00000000-00000000-00000000
CPUID 0000000D: 00000007-00000340-00000340-00000000 [SL 00] [x87]
CPUID 0000000D: 00000001-00000000-00000000-00000000 [SL 01] [SSE]
CPUID 0000000D: 00000100-00000240-00000000-00000000 [SL 02] [AVX]
CPUID 80000000: 80000008-00000000-00000000-00000000
CPUID 80000001: 00000000-00000000-00000001-2C100000
CPUID 80000002: 20202020-49202020-6C65746E-20295228 [       Intel(R) ]
CPUID 80000003: 65726F43-294D5428-2D376920-30333933 [Core(TM) i7-3930]
CPUID 80000004: 5043204B-20402055-30322E33-007A4847 [K CPU @ 3.20GHz]
CPUID 80000005: 00000000-00000000-00000000-00000000 [L1D: 0 KB / L1I: 0 KB]
CPUID 80000006: 00000000-00000000-01006040-00000000 [L2: 256 KB] / L3: 0 KB]
CPUID 80000007: 00000000-00000000-00000000-00000100
CPUID 80000008: 0000302E-00000000-00000000-00000000

L1    Data Cache:    32 KB,  8-way Associative, 64-byte Line
L1  Instr. Cache:    32 KB,  8-way Associative, 64-byte Line
L2 Unified Cache:   256 KB,  8-way Associative, 64-byte Line
L3 Unified Cache:    12 MB, 16-way Associative, 64-byte Line

------[ CPUID Registers / Logical CPU #8 ]------

allcpu: Package 0 / Core 4 / Thread 0: Valid

CPUID 00000000: 0000000D-756E6547-6C65746E-49656E69 [GenuineIntel]
CPUID 00000001: 000206D7-08200800-1FBEE3BF-BFEBFBFF
CPUID 00000002: 76035A01-00F0B2FF-00000000-00CA0000
CPUID 00000003: 00000000-00000000-00000000-00000000
CPUID 00000004: 3C004121-01C0003F-0000003F-00000000 [SL 00] [L1D: 32 KB]
CPUID 00000004: 3C004122-01C0003F-0000003F-00000000 [SL 01] [L1I: 32 KB]
CPUID 00000004: 3C004143-01C0003F-000001FF-00000000 [SL 02] [L2U: 256 KB]
CPUID 00000004: 3C07C163-03C0003F-00002FFF-00000006 [SL 03] [L3U: 12 MB]
CPUID 00000005: 00000040-00000040-00000003-00021120
CPUID 00000006: 00000075-00000002-00000009-00000000
CPUID 00000007: 00000000-00000000-00000000-9C000400 [SL 00]
CPUID 00000008: 00000000-00000000-00000000-00000000
CPUID 00000009: 00000001-00000000-00000000-00000000
CPUID 0000000A: 07300403-00000000-00000000-00000603
CPUID 0000000B: 00000001-00000002-00000100-00000008 [SL 00]
CPUID 0000000B: 00000005-0000000C-00000201-00000008 [SL 01]
CPUID 0000000C: 00000000-00000000-00000000-00000000
CPUID 0000000D: 00000007-00000340-00000340-00000000 [SL 00] [x87]
CPUID 0000000D: 00000001-00000000-00000000-00000000 [SL 01] [SSE]
CPUID 0000000D: 00000100-00000240-00000000-00000000 [SL 02] [AVX]
CPUID 80000000: 80000008-00000000-00000000-00000000
CPUID 80000001: 00000000-00000000-00000001-2C100000
CPUID 80000002: 20202020-49202020-6C65746E-20295228 [       Intel(R) ]
CPUID 80000003: 65726F43-294D5428-2D376920-30333933 [Core(TM) i7-3930]
CPUID 80000004: 5043204B-20402055-30322E33-007A4847 [K CPU @ 3.20GHz]
CPUID 80000005: 00000000-00000000-00000000-00000000 [L1D: 0 KB / L1I: 0 KB]
CPUID 80000006: 00000000-00000000-01006040-00000000 [L2: 256 KB] / L3: 0 KB]
CPUID 80000007: 00000000-00000000-00000000-00000100
CPUID 80000008: 0000302E-00000000-00000000-00000000

L1    Data Cache:    32 KB,  8-way Associative, 64-byte Line
L1  Instr. Cache:    32 KB,  8-way Associative, 64-byte Line
L2 Unified Cache:   256 KB,  8-way Associative, 64-byte Line
L3 Unified Cache:    12 MB, 16-way Associative, 64-byte Line

------[ CPUID Registers / Logical CPU #9 ]------

allcpu: Package 0 / Core 4 / Thread 1: Valid, Virtual

CPUID 00000000: 0000000D-756E6547-6C65746E-49656E69 [GenuineIntel]
CPUID 00000001: 000206D7-09200800-1FBEE3BF-BFEBFBFF
CPUID 00000002: 76035A01-00F0B2FF-00000000-00CA0000
CPUID 00000003: 00000000-00000000-00000000-00000000
CPUID 00000004: 3C004121-01C0003F-0000003F-00000000 [SL 00] [L1D: 32 KB]
CPUID 00000004: 3C004122-01C0003F-0000003F-00000000 [SL 01] [L1I: 32 KB]
CPUID 00000004: 3C004143-01C0003F-000001FF-00000000 [SL 02] [L2U: 256 KB]
CPUID 00000004: 3C07C163-03C0003F-00002FFF-00000006 [SL 03] [L3U: 12 MB]
CPUID 00000005: 00000040-00000040-00000003-00021120
CPUID 00000006: 00000075-00000002-00000009-00000000
CPUID 00000007: 00000000-00000000-00000000-9C000400 [SL 00]
CPUID 00000008: 00000000-00000000-00000000-00000000
CPUID 00000009: 00000001-00000000-00000000-00000000
CPUID 0000000A: 07300403-00000000-00000000-00000603
CPUID 0000000B: 00000001-00000002-00000100-00000009 [SL 00]
CPUID 0000000B: 00000005-0000000C-00000201-00000009 [SL 01]
CPUID 0000000C: 00000000-00000000-00000000-00000000
CPUID 0000000D: 00000007-00000340-00000340-00000000 [SL 00] [x87]
CPUID 0000000D: 00000001-00000000-00000000-00000000 [SL 01] [SSE]
CPUID 0000000D: 00000100-00000240-00000000-00000000 [SL 02] [AVX]
CPUID 80000000: 80000008-00000000-00000000-00000000
CPUID 80000001: 00000000-00000000-00000001-2C100000
CPUID 80000002: 20202020-49202020-6C65746E-20295228 [       Intel(R) ]
CPUID 80000003: 65726F43-294D5428-2D376920-30333933 [Core(TM) i7-3930]
CPUID 80000004: 5043204B-20402055-30322E33-007A4847 [K CPU @ 3.20GHz]
CPUID 80000005: 00000000-00000000-00000000-00000000 [L1D: 0 KB / L1I: 0 KB]
CPUID 80000006: 00000000-00000000-01006040-00000000 [L2: 256 KB] / L3: 0 KB]
CPUID 80000007: 00000000-00000000-00000000-00000100
CPUID 80000008: 0000302E-00000000-00000000-00000000

L1    Data Cache:    32 KB,  8-way Associative, 64-byte Line
L1  Instr. Cache:    32 KB,  8-way Associative, 64-byte Line
L2 Unified Cache:   256 KB,  8-way Associative, 64-byte Line
L3 Unified Cache:    12 MB, 16-way Associative, 64-byte Line

------[ CPUID Registers / Logical CPU #10 ]------

allcpu: Package 0 / Core 5 / Thread 0: Valid

CPUID 00000000: 0000000D-756E6547-6C65746E-49656E69 [GenuineIntel]
CPUID 00000001: 000206D7-0A200800-1FBEE3BF-BFEBFBFF
CPUID 00000002: 76035A01-00F0B2FF-00000000-00CA0000
CPUID 00000003: 00000000-00000000-00000000-00000000
CPUID 00000004: 3C004121-01C0003F-0000003F-00000000 [SL 00] [L1D: 32 KB]
CPUID 00000004: 3C004122-01C0003F-0000003F-00000000 [SL 01] [L1I: 32 KB]
CPUID 00000004: 3C004143-01C0003F-000001FF-00000000 [SL 02] [L2U: 256 KB]
CPUID 00000004: 3C07C163-03C0003F-00002FFF-00000006 [SL 03] [L3U: 12 MB]
CPUID 00000005: 00000040-00000040-00000003-00021120
CPUID 00000006: 00000075-00000002-00000009-00000000
CPUID 00000007: 00000000-00000000-00000000-9C000400 [SL 00]
CPUID 00000008: 00000000-00000000-00000000-00000000
CPUID 00000009: 00000001-00000000-00000000-00000000
CPUID 0000000A: 07300403-00000000-00000000-00000603
CPUID 0000000B: 00000001-00000002-00000100-0000000A [SL 00]
CPUID 0000000B: 00000005-0000000C-00000201-0000000A [SL 01]
CPUID 0000000C: 00000000-00000000-00000000-00000000
CPUID 0000000D: 00000007-00000340-00000340-00000000 [SL 00] [x87]
CPUID 0000000D: 00000001-00000000-00000000-00000000 [SL 01] [SSE]
CPUID 0000000D: 00000100-00000240-00000000-00000000 [SL 02] [AVX]
CPUID 80000000: 80000008-00000000-00000000-00000000
CPUID 80000001: 00000000-00000000-00000001-2C100000
CPUID 80000002: 20202020-49202020-6C65746E-20295228 [       Intel(R) ]
CPUID 80000003: 65726F43-294D5428-2D376920-30333933 [Core(TM) i7-3930]
CPUID 80000004: 5043204B-20402055-30322E33-007A4847 [K CPU @ 3.20GHz]
CPUID 80000005: 00000000-00000000-00000000-00000000 [L1D: 0 KB / L1I: 0 KB]
CPUID 80000006: 00000000-00000000-01006040-00000000 [L2: 256 KB] / L3: 0 KB]
CPUID 80000007: 00000000-00000000-00000000-00000100
CPUID 80000008: 0000302E-00000000-00000000-00000000

L1    Data Cache:    32 KB,  8-way Associative, 64-byte Line
L1  Instr. Cache:    32 KB,  8-way Associative, 64-byte Line
L2 Unified Cache:   256 KB,  8-way Associative, 64-byte Line
L3 Unified Cache:    12 MB, 16-way Associative, 64-byte Line

------[ CPUID Registers / Logical CPU #11 ]------

allcpu: Package 0 / Core 5 / Thread 1: Valid, Virtual

CPUID 00000000: 0000000D-756E6547-6C65746E-49656E69 [GenuineIntel]
CPUID 00000001: 000206D7-0B200800-1FBEE3BF-BFEBFBFF
CPUID 00000002: 76035A01-00F0B2FF-00000000-00CA0000
CPUID 00000003: 00000000-00000000-00000000-00000000
CPUID 00000004: 3C004121-01C0003F-0000003F-00000000 [SL 00] [L1D: 32 KB]
CPUID 00000004: 3C004122-01C0003F-0000003F-00000000 [SL 01] [L1I: 32 KB]
CPUID 00000004: 3C004143-01C0003F-000001FF-00000000 [SL 02] [L2U: 256 KB]
CPUID 00000004: 3C07C163-03C0003F-00002FFF-00000006 [SL 03] [L3U: 12 MB]
CPUID 00000005: 00000040-00000040-00000003-00021120
CPUID 00000006: 00000075-00000002-00000009-00000000
CPUID 00000007: 00000000-00000000-00000000-9C000400 [SL 00]
CPUID 00000008: 00000000-00000000-00000000-00000000
CPUID 00000009: 00000001-00000000-00000000-00000000
CPUID 0000000A: 07300403-00000000-00000000-00000603
CPUID 0000000B: 00000001-00000002-00000100-0000000B [SL 00]
CPUID 0000000B: 00000005-0000000C-00000201-0000000B [SL 01]
CPUID 0000000C: 00000000-00000000-00000000-00000000
CPUID 0000000D: 00000007-00000340-00000340-00000000 [SL 00] [x87]
CPUID 0000000D: 00000001-00000000-00000000-00000000 [SL 01] [SSE]
CPUID 0000000D: 00000100-00000240-00000000-00000000 [SL 02] [AVX]
CPUID 80000000: 80000008-00000000-00000000-00000000
CPUID 80000001: 00000000-00000000-00000001-2C100000
CPUID 80000002: 20202020-49202020-6C65746E-20295228 [       Intel(R) ]
CPUID 80000003: 65726F43-294D5428-2D376920-30333933 [Core(TM) i7-3930]
CPUID 80000004: 5043204B-20402055-30322E33-007A4847 [K CPU @ 3.20GHz]
CPUID 80000005: 00000000-00000000-00000000-00000000 [L1D: 0 KB / L1I: 0 KB]
CPUID 80000006: 00000000-00000000-01006040-00000000 [L2: 256 KB] / L3: 0 KB]
CPUID 80000007: 00000000-00000000-00000000-00000100
CPUID 80000008: 0000302E-00000000-00000000-00000000

L1    Data Cache:    32 KB,  8-way Associative, 64-byte Line
L1  Instr. Cache:    32 KB,  8-way Associative, 64-byte Line
L2 Unified Cache:   256 KB,  8-way Associative, 64-byte Line
L3 Unified Cache:    12 MB, 16-way Associative, 64-byte Line

------[ All CPUs ]------

CPU   0: APICID    0 / Package 0 / Core   0 / Thread 0: Valid
CPU   1: APICID    1 / Package 0 / Core   0 / Thread 1: Valid, Virtual
CPU   2: APICID    2 / Package 0 / Core   1 / Thread 0: Valid
CPU   3: APICID    3 / Package 0 / Core   1 / Thread 1: Valid, Virtual
CPU   4: APICID    4 / Package 0 / Core   2 / Thread 0: Valid
CPU   5: APICID    5 / Package 0 / Core   2 / Thread 1: Valid, Virtual
CPU   6: APICID    6 / Package 0 / Core   3 / Thread 0: Valid
CPU   7: APICID    7 / Package 0 / Core   3 / Thread 1: Valid, Virtual
CPU   8: APICID    8 / Package 0 / Core   4 / Thread 0: Valid
CPU   9: APICID    9 / Package 0 / Core   4 / Thread 1: Valid, Virtual
CPU  10: APICID   10 / Package 0 / Core   5 / Thread 0: Valid
CPU  11: APICID   11 / Package 0 / Core   5 / Thread 1: Valid, Virtual

------[ MSR Registers / Logical CPU #0 ]------

MSR 00000017: 0008-0000-0000-0000 [PlatID = 2]
MSR 0000001B: 0000-0000-FEE0-0900
MSR 00000035: 0000-0000-0006-000C
MSR 00000048: 0000-0000-0000-0000
MSR 00000049: < FAILED >
MSR 0000008B: 0000-071A-0000-0000
MSR 000000CE: 0000-0C00-7001-2000 [eD = 0]
MSR 000000E7: 0000-008C-71D4-9036 [S200]
MSR 000000E7: 0000-008C-732F-0DE2 [S200]
MSR 000000E7: 0000-008C-736B-532A
MSR 000000E8: 0000-008B-44F8-1D6B [S200]
MSR 000000E8: 0000-008B-4536-D67E [S200]
MSR 000000E8: 0000-008B-45DD-3ADE
MSR 0000010B: < FAILED >
MSR 00000194: 0000-0000-000E-0000
MSR 00000198: 0000-24D4-0000-2000 [S200]
MSR 00000198: 0000-25A1-0000-2000 [S200]
MSR 00000198: 0000-25F3-0000-2000
MSR 00000199: 0000-0000-0000-2600
MSR 0000019A: 0000-0000-0000-0000
MSR 0000019B: 0000-0000-0000-0000
MSR 0000019C: 0000-0000-8840-0000 [S200]
MSR 0000019C: 0000-0000-8840-0000 [S200]
MSR 0000019C: 0000-0000-8840-0000
MSR 0000019D: 0000-0000-0000-0000
MSR 000001A0: 0000-0040-0085-0089
MSR 000001A2: 0000-0000-005B-0A00
MSR 000001A4: 0000-0000-0000-0000
MSR 000001AA: 0000-0000-0040-0000
MSR 000001AC: < FAILED >
MSR 000001AD: 2323-2323-2425-2626
MSR 000001B0: 0000-0000-0000-0000
MSR 000001B1: 0000-0000-8836-0000
MSR 000001B2: 0000-0000-0000-0000
MSR 000001FC: 0000-0000-2504-0059
MSR 00000300: 0000-0000-8000-FF00
MSR 0000030A: 0000-0000-02E0-B34C [S200]
MSR 0000030A: 0000-0000-02E0-B34C [S200]
MSR 0000030A: 0000-0000-02E0-B34C
MSR 0000030B: 0000-0000-02E1-D780 [S200]
MSR 0000030B: 0000-0000-02E1-D780 [S200]
MSR 0000030B: 0000-0000-02E1-D780
MSR 00000480: 00DA-0400-0000-0010
MSR 00000481: 0000-007F-0000-0016
MSR 00000482: FFF9-FFFE-0401-E172
MSR 00000483: 007F-FFFF-0003-6DFF
MSR 00000484: 0000-FFFF-0000-11FF
MSR 00000485: 0000-0000-1004-01E5
MSR 00000486: 0000-0000-8000-0021
MSR 00000487: 0000-0000-FFFF-FFFF
MSR 00000488: 0000-0000-0000-2000
MSR 00000489: 0000-0000-0006-27FF
MSR 0000048A: 0000-0000-0000-002A
MSR 0000048B: 0000-04FF-0000-0000
MSR 0000048C: 0000-0F01-0613-4141
MSR 0000048D: 0000-007F-0000-0016
MSR 0000048E: FFF9-FFFE-0400-6172
MSR 0000048F: 007F-FFFF-0003-6DFB
MSR 00000490: 0000-FFFF-0000-11FB
MSR 00000601: 0014-1494-8000-0438
MSR 00000602: < FAILED >
MSR 00000603: 0000-0000-8015-1515
MSR 00000604: < FAILED >
MSR 00000606: 0000-0000-000A-1003
MSR 0000060A: 0000-0000-0000-0000
MSR 0000060B: 0000-0000-0000-0000
MSR 0000060C: 0000-0000-0000-0000
MSR 0000060D: 0000-0000-0000-0000
MSR 00000610: 0006-8000-005A-8410
MSR 00000611: 0000-0000-9666-6A6F [S200]
MSR 00000611: 0000-0000-966B-AD76 [S200]
MSR 00000611: 0000-0000-9671-9ED3
MSR 00000613: 0000-0000-0000-0000
MSR 00000614: 0000-0000-01A8-0410
MSR 00000618: 0000-0000-0000-0000
MSR 00000619: 0000-0000-0000-0000 [S200]
MSR 00000619: 0000-0000-0000-0000 [S200]
MSR 00000619: 0000-0000-0000-0000
MSR 0000061B: 0000-0000-0000-0000
MSR 0000061C: 0028-0258-0078-0118
MSR 00000638: 0000-0000-0000-0000
MSR 00000639: 0000-0000-5C7E-400A [S200]
MSR 00000639: 0000-0000-5C80-0A71 [S200]
MSR 00000639: 0000-0000-5C82-46E5
MSR 0000063A: 0000-0000-0000-0000
MSR 0000063B: 0000-0000-0000-0000
MSR 00000640: < FAILED >
MSR 00000641: < FAILED >
MSR 00000642: < FAILED >

------[ MSR Registers / Logical CPU #1 ]------

MSR 00000017: 0008-0000-0000-0000 [PlatID = 2]
MSR 0000001B: 0000-0000-FEE0-0800
MSR 00000035: 0000-0000-0006-000C
MSR 00000048: 0000-0000-0000-0000
MSR 00000049: < FAILED >
MSR 0000008B: 0000-071A-0000-0000
MSR 000000CE: 0000-0C00-7001-2000 [eD = 0]
MSR 000000E7: 0000-0020-5ED4-1354
MSR 000000E8: 0000-001F-B873-8BE7
MSR 0000010B: < FAILED >
MSR 00000194: 0000-0000-000E-0000
MSR 00000198: 0000-24D4-0000-2000
MSR 00000199: 0000-0000-0000-2600
MSR 0000019A: 0000-0000-0000-0000
MSR 0000019B: 0000-0000-0000-0000
MSR 0000019C: 0000-0000-883D-0000
MSR 0000019D: 0000-0000-0000-0000
MSR 000001A0: 0000-0040-0085-0089
MSR 000001A2: 0000-0000-005B-0A00
MSR 000001A4: 0000-0000-0000-0000
MSR 000001AA: 0000-0000-0040-0000
MSR 000001AC: < FAILED >
MSR 000001AD: 2323-2323-2425-2626
MSR 000001B0: 0000-0000-0000-0000
MSR 000001B1: 0000-0000-8835-0000
MSR 000001B2: 0000-0000-0000-0000
MSR 000001FC: 0000-0000-2504-0059
MSR 00000300: 0000-0000-8000-FF00
MSR 0000030A: 0000-0000-0000-0000
MSR 0000030B: 0000-0000-0000-0000
MSR 00000480: 00DA-0400-0000-0010
MSR 00000481: 0000-007F-0000-0016
MSR 00000482: FFF9-FFFE-0401-E172
MSR 00000483: 007F-FFFF-0003-6DFF
MSR 00000484: 0000-FFFF-0000-11FF
MSR 00000485: 0000-0000-1004-01E5
MSR 00000486: 0000-0000-8000-0021
MSR 00000487: 0000-0000-FFFF-FFFF
MSR 00000488: 0000-0000-0000-2000
MSR 00000489: 0000-0000-0006-27FF
MSR 0000048A: 0000-0000-0000-002A
MSR 0000048B: 0000-04FF-0000-0000
MSR 0000048C: 0000-0F01-0613-4141
MSR 0000048D: 0000-007F-0000-0016
MSR 0000048E: FFF9-FFFE-0400-6172
MSR 0000048F: 007F-FFFF-0003-6DFB
MSR 00000490: 0000-FFFF-0000-11FB
MSR 00000601: 0014-1494-8000-0438
MSR 00000602: < FAILED >
MSR 00000603: 0000-0000-8015-1515
MSR 00000604: < FAILED >
MSR 00000606: 0000-0000-000A-1003
MSR 0000060A: 0000-0000-0000-0000
MSR 0000060B: 0000-0000-0000-0000
MSR 0000060C: 0000-0000-0000-0000
MSR 0000060D: 0000-0000-0000-0000
MSR 00000610: 0006-8000-005A-8410
MSR 00000611: 0000-0000-9687-30E2
MSR 00000613: 0000-0000-0000-0000
MSR 00000614: 0000-0000-01A8-0410
MSR 00000618: 0000-0000-0000-0000
MSR 00000619: 0000-0000-0000-0000
MSR 0000061B: 0000-0000-0000-0000
MSR 0000061C: 0028-0258-0078-0118
MSR 00000638: 0000-0000-0000-0000
MSR 00000639: 0000-0000-5C82-9D08
MSR 0000063A: 0000-0000-0000-0000
MSR 0000063B: 0000-0000-0000-0000
MSR 00000640: < FAILED >
MSR 00000641: < FAILED >
MSR 00000642: < FAILED >

------[ MSR Registers / Logical CPU #2 ]------

MSR 00000017: 0008-0000-0000-0000 [PlatID = 2]
MSR 0000001B: 0000-0000-FEE0-0800
MSR 00000035: 0000-0000-0006-000C
MSR 00000048: 0000-0000-0000-0000
MSR 00000049: < FAILED >
MSR 0000008B: 0000-071A-0000-0000
MSR 000000CE: 0000-0C00-7001-2000 [eD = 0]
MSR 000000E7: 0000-0088-59B9-DBB6
MSR 000000E8: 0000-0086-C5F0-5052
MSR 0000010B: < FAILED >
MSR 00000194: 0000-0000-000E-0000
MSR 00000198: 0000-2482-0000-2000
MSR 00000199: 0000-0000-0000-2600
MSR 0000019A: 0000-0000-0000-0000
MSR 0000019B: 0000-0000-0000-0000
MSR 0000019C: 0000-0000-8835-0000
MSR 0000019D: 0000-0000-0000-0000
MSR 000001A0: 0000-0040-0085-0089
MSR 000001A2: 0000-0000-005B-0A00
MSR 000001A4: 0000-0000-0000-0000
MSR 000001AA: 0000-0000-0040-0000
MSR 000001AC: < FAILED >
MSR 000001AD: 2323-2323-2425-2626
MSR 000001B0: 0000-0000-0000-0000
MSR 000001B1: 0000-0000-8835-0000
MSR 000001B2: 0000-0000-0000-0000
MSR 000001FC: 0000-0000-2504-0059
MSR 00000300: 0000-0000-8000-FF00
MSR 0000030A: 0000-0000-0000-0000
MSR 0000030B: 0000-0000-0000-0000
MSR 00000480: 00DA-0400-0000-0010
MSR 00000481: 0000-007F-0000-0016
MSR 00000482: FFF9-FFFE-0401-E172
MSR 00000483: 007F-FFFF-0003-6DFF
MSR 00000484: 0000-FFFF-0000-11FF
MSR 00000485: 0000-0000-1004-01E5
MSR 00000486: 0000-0000-8000-0021
MSR 00000487: 0000-0000-FFFF-FFFF
MSR 00000488: 0000-0000-0000-2000
MSR 00000489: 0000-0000-0006-27FF
MSR 0000048A: 0000-0000-0000-002A
MSR 0000048B: 0000-04FF-0000-0000
MSR 0000048C: 0000-0F01-0613-4141
MSR 0000048D: 0000-007F-0000-0016
MSR 0000048E: FFF9-FFFE-0400-6172
MSR 0000048F: 007F-FFFF-0003-6DFB
MSR 00000490: 0000-FFFF-0000-11FB
MSR 00000601: 0014-1494-8000-0438
MSR 00000602: < FAILED >
MSR 00000603: 0000-0000-8015-1515
MSR 00000604: < FAILED >
MSR 00000606: 0000-0000-000A-1003
MSR 0000060A: 0000-0000-0000-0000
MSR 0000060B: 0000-0000-0000-0000
MSR 0000060C: 0000-0000-0000-0000
MSR 0000060D: 0000-0000-0000-0000
MSR 00000610: 0006-8000-005A-8410
MSR 00000611: 0000-0000-9687-4B2E
MSR 00000613: 0000-0000-0000-0000
MSR 00000614: 0000-0000-01A8-0410
MSR 00000618: 0000-0000-0000-0000
MSR 00000619: 0000-0000-0000-0000
MSR 0000061B: 0000-0000-0000-0000
MSR 0000061C: 0028-0258-0078-0118
MSR 00000638: 0000-0000-0000-0000
MSR 00000639: 0000-0000-5C82-AECE
MSR 0000063A: 0000-0000-0000-0000
MSR 0000063B: 0000-0000-0000-0000
MSR 00000640: < FAILED >
MSR 00000641: < FAILED >
MSR 00000642: < FAILED >

------[ MSR Registers / Logical CPU #3 ]------

MSR 00000017: 0008-0000-0000-0000 [PlatID = 2]
MSR 0000001B: 0000-0000-FEE0-0800
MSR 00000035: 0000-0000-0006-000C
MSR 00000048: 0000-0000-0000-0000
MSR 00000049: < FAILED >
MSR 0000008B: 0000-071A-0000-0000
MSR 000000CE: 0000-0C00-7001-2000 [eD = 0]
MSR 000000E7: 0000-0021-7A56-CFFA
MSR 000000E8: 0000-0020-D260-165C
MSR 0000010B: < FAILED >
MSR 00000194: 0000-0000-000E-0000
MSR 00000198: 0000-2482-0000-2000
MSR 00000199: 0000-0000-0000-2600
MSR 0000019A: 0000-0000-0000-0000
MSR 0000019B: 0000-0000-0000-0000
MSR 0000019C: 0000-0000-8835-0000
MSR 0000019D: 0000-0000-0000-0000
MSR 000001A0: 0000-0040-0085-0089
MSR 000001A2: 0000-0000-005B-0A00
MSR 000001A4: 0000-0000-0000-0000
MSR 000001AA: 0000-0000-0040-0000
MSR 000001AC: < FAILED >
MSR 000001AD: 2323-2323-2425-2626
MSR 000001B0: 0000-0000-0000-0000
MSR 000001B1: 0000-0000-8835-0000
MSR 000001B2: 0000-0000-0000-0000
MSR 000001FC: 0000-0000-2504-0059
MSR 00000300: 0000-0000-8000-FF00
MSR 0000030A: 0000-0000-0000-0000
MSR 0000030B: 0000-0000-0000-0000
MSR 00000480: 00DA-0400-0000-0010
MSR 00000481: 0000-007F-0000-0016
MSR 00000482: FFF9-FFFE-0401-E172
MSR 00000483: 007F-FFFF-0003-6DFF
MSR 00000484: 0000-FFFF-0000-11FF
MSR 00000485: 0000-0000-1004-01E5
MSR 00000486: 0000-0000-8000-0021
MSR 00000487: 0000-0000-FFFF-FFFF
MSR 00000488: 0000-0000-0000-2000
MSR 00000489: 0000-0000-0006-27FF
MSR 0000048A: 0000-0000-0000-002A
MSR 0000048B: 0000-04FF-0000-0000
MSR 0000048C: 0000-0F01-0613-4141
MSR 0000048D: 0000-007F-0000-0016
MSR 0000048E: FFF9-FFFE-0400-6172
MSR 0000048F: 007F-FFFF-0003-6DFB
MSR 00000490: 0000-FFFF-0000-11FB
MSR 00000601: 0014-1494-8000-0438
MSR 00000602: < FAILED >
MSR 00000603: 0000-0000-8015-1515
MSR 00000604: < FAILED >
MSR 00000606: 0000-0000-000A-1003
MSR 0000060A: 0000-0000-0000-0000
MSR 0000060B: 0000-0000-0000-0000
MSR 0000060C: 0000-0000-0000-0000
MSR 0000060D: 0000-0000-0000-0000
MSR 00000610: 0006-8000-005A-8410
MSR 00000611: 0000-0000-9687-572C
MSR 00000613: 0000-0000-0000-0000
MSR 00000614: 0000-0000-01A8-0410
MSR 00000618: 0000-0000-0000-0000
MSR 00000619: 0000-0000-0000-0000
MSR 0000061B: 0000-0000-0000-0000
MSR 0000061C: 0028-0258-0078-0118
MSR 00000638: 0000-0000-0000-0000
MSR 00000639: 0000-0000-5C82-B68F
MSR 0000063A: 0000-0000-0000-0000
MSR 0000063B: 0000-0000-0000-0000
MSR 00000640: < FAILED >
MSR 00000641: < FAILED >
MSR 00000642: < FAILED >

------[ MSR Registers / Logical CPU #4 ]------

MSR 00000017: 0008-0000-0000-0000 [PlatID = 2]
MSR 0000001B: 0000-0000-FEE0-0800
MSR 00000035: 0000-0000-0006-000C
MSR 00000048: 0000-0000-0000-0000
MSR 00000049: < FAILED >
MSR 0000008B: 0000-071A-0000-0000
MSR 000000CE: 0000-0C00-7001-2000 [eD = 0]
MSR 000000E7: 0000-0049-69E3-85E8
MSR 000000E8: 0000-0047-E79C-9662
MSR 0000010B: < FAILED >
MSR 00000194: 0000-0000-000E-0000
MSR 00000198: 0000-2482-0000-2000
MSR 00000199: 0000-0000-0000-2600
MSR 0000019A: 0000-0000-0000-0000
MSR 0000019B: 0000-0000-0000-0000
MSR 0000019C: 0000-0000-8837-0000
MSR 0000019D: 0000-0000-0000-0000
MSR 000001A0: 0000-0040-0085-0089
MSR 000001A2: 0000-0000-005B-0A00
MSR 000001A4: 0000-0000-0000-0000
MSR 000001AA: 0000-0000-0040-0000
MSR 000001AC: < FAILED >
MSR 000001AD: 2323-2323-2425-2626
MSR 000001B0: 0000-0000-0000-0000
MSR 000001B1: 0000-0000-8834-0000
MSR 000001B2: 0000-0000-0000-0000
MSR 000001FC: 0000-0000-2504-0059
MSR 00000300: 0000-0000-8000-FF00
MSR 0000030A: 0000-0000-0000-0000
MSR 0000030B: 0000-0000-0000-0000
MSR 00000480: 00DA-0400-0000-0010
MSR 00000481: 0000-007F-0000-0016
MSR 00000482: FFF9-FFFE-0401-E172
MSR 00000483: 007F-FFFF-0003-6DFF
MSR 00000484: 0000-FFFF-0000-11FF
MSR 00000485: 0000-0000-1004-01E5
MSR 00000486: 0000-0000-8000-0021
MSR 00000487: 0000-0000-FFFF-FFFF
MSR 00000488: 0000-0000-0000-2000
MSR 00000489: 0000-0000-0006-27FF
MSR 0000048A: 0000-0000-0000-002A
MSR 0000048B: 0000-04FF-0000-0000
MSR 0000048C: 0000-0F01-0613-4141
MSR 0000048D: 0000-007F-0000-0016
MSR 0000048E: FFF9-FFFE-0400-6172
MSR 0000048F: 007F-FFFF-0003-6DFB
MSR 00000490: 0000-FFFF-0000-11FB
MSR 00000601: 0014-1494-8000-0438
MSR 00000602: < FAILED >
MSR 00000603: 0000-0000-8015-1515
MSR 00000604: < FAILED >
MSR 00000606: 0000-0000-000A-1003
MSR 0000060A: 0000-0000-0000-0000
MSR 0000060B: 0000-0000-0000-0000
MSR 0000060C: 0000-0000-0000-0000
MSR 0000060D: 0000-0000-0000-0000
MSR 00000610: 0006-8000-005A-8410
MSR 00000611: 0000-0000-9687-572C
MSR 00000613: 0000-0000-0000-0000
MSR 00000614: 0000-0000-01A8-0410
MSR 00000618: 0000-0000-0000-0000
MSR 00000619: 0000-0000-0000-0000
MSR 0000061B: 0000-0000-0000-0000
MSR 0000061C: 0028-0258-0078-0118
MSR 00000638: 0000-0000-0000-0000
MSR 00000639: 0000-0000-5C82-B68F
MSR 0000063A: 0000-0000-0000-0000
MSR 0000063B: 0000-0000-0000-0000
MSR 00000640: < FAILED >
MSR 00000641: < FAILED >
MSR 00000642: < FAILED >

------[ MSR Registers / Logical CPU #5 ]------

MSR 00000017: 0008-0000-0000-0000 [PlatID = 2]
MSR 0000001B: 0000-0000-FEE0-0800
MSR 00000035: 0000-0000-0006-000C
MSR 00000048: 0000-0000-0000-0000
MSR 00000049: < FAILED >
MSR 0000008B: 0000-071A-0000-0000
MSR 000000CE: 0000-0C00-7001-2000 [eD = 0]
MSR 000000E7: 0000-001E-0593-54B6
MSR 000000E8: 0000-001D-63D5-1C24
MSR 0000010B: < FAILED >
MSR 00000194: 0000-0000-000E-0000
MSR 00000198: 0000-2482-0000-2000
MSR 00000199: 0000-0000-0000-2600
MSR 0000019A: 0000-0000-0000-0000
MSR 0000019B: 0000-0000-0000-0000
MSR 0000019C: 0000-0000-8837-0000
MSR 0000019D: 0000-0000-0000-0000
MSR 000001A0: 0000-0040-0085-0089
MSR 000001A2: 0000-0000-005B-0A00
MSR 000001A4: 0000-0000-0000-0000
MSR 000001AA: 0000-0000-0040-0000
MSR 000001AC: < FAILED >
MSR 000001AD: 2323-2323-2425-2626
MSR 000001B0: 0000-0000-0000-0000
MSR 000001B1: 0000-0000-8834-0000
MSR 000001B2: 0000-0000-0000-0000
MSR 000001FC: 0000-0000-2504-0059
MSR 00000300: 0000-0000-8000-FF00
MSR 0000030A: 0000-0000-0000-0000
MSR 0000030B: 0000-0000-0000-0000
MSR 00000480: 00DA-0400-0000-0010
MSR 00000481: 0000-007F-0000-0016
MSR 00000482: FFF9-FFFE-0401-E172
MSR 00000483: 007F-FFFF-0003-6DFF
MSR 00000484: 0000-FFFF-0000-11FF
MSR 00000485: 0000-0000-1004-01E5
MSR 00000486: 0000-0000-8000-0021
MSR 00000487: 0000-0000-FFFF-FFFF
MSR 00000488: 0000-0000-0000-2000
MSR 00000489: 0000-0000-0006-27FF
MSR 0000048A: 0000-0000-0000-002A
MSR 0000048B: 0000-04FF-0000-0000
MSR 0000048C: 0000-0F01-0613-4141
MSR 0000048D: 0000-007F-0000-0016
MSR 0000048E: FFF9-FFFE-0400-6172
MSR 0000048F: 007F-FFFF-0003-6DFB
MSR 00000490: 0000-FFFF-0000-11FB
MSR 00000601: 0014-1494-8000-0438
MSR 00000602: < FAILED >
MSR 00000603: 0000-0000-8015-1515
MSR 00000604: < FAILED >
MSR 00000606: 0000-0000-000A-1003
MSR 0000060A: 0000-0000-0000-0000
MSR 0000060B: 0000-0000-0000-0000
MSR 0000060C: 0000-0000-0000-0000
MSR 0000060D: 0000-0000-0000-0000
MSR 00000610: 0006-8000-005A-8410
MSR 00000611: 0000-0000-9687-6205
MSR 00000613: 0000-0000-0000-0000
MSR 00000614: 0000-0000-01A8-0410
MSR 00000618: 0000-0000-0000-0000
MSR 00000619: 0000-0000-0000-0000
MSR 0000061B: 0000-0000-0000-0000
MSR 0000061C: 0028-0258-0078-0118
MSR 00000638: 0000-0000-0000-0000
MSR 00000639: 0000-0000-5C82-BD42
MSR 0000063A: 0000-0000-0000-0000
MSR 0000063B: 0000-0000-0000-0000
MSR 00000640: < FAILED >
MSR 00000641: < FAILED >
MSR 00000642: < FAILED >

------[ MSR Registers / Logical CPU #6 ]------

MSR 00000017: 0008-0000-0000-0000 [PlatID = 2]
MSR 0000001B: 0000-0000-FEE0-0800
MSR 00000035: 0000-0000-0006-000C
MSR 00000048: 0000-0000-0000-0000
MSR 00000049: < FAILED >
MSR 0000008B: 0000-071A-0000-0000
MSR 000000CE: 0000-0C00-7001-2000 [eD = 0]
MSR 000000E7: 0000-002F-2D5D-1B62
MSR 000000E8: 0000-002D-BE69-3B44
MSR 0000010B: < FAILED >
MSR 00000194: 0000-0000-000E-0000
MSR 00000198: 0000-24D4-0000-2000
MSR 00000199: 0000-0000-0000-2600
MSR 0000019A: 0000-0000-0000-0000
MSR 0000019B: 0000-0000-0000-0000
MSR 0000019C: 0000-0000-883B-0000
MSR 0000019D: 0000-0000-0000-0000
MSR 000001A0: 0000-0040-0085-0089
MSR 000001A2: 0000-0000-005B-0A00
MSR 000001A4: 0000-0000-0000-0000
MSR 000001AA: 0000-0000-0040-0000
MSR 000001AC: < FAILED >
MSR 000001AD: 2323-2323-2425-2626
MSR 000001B0: 0000-0000-0000-0000
MSR 000001B1: 0000-0000-8833-0000
MSR 000001B2: 0000-0000-0000-0000
MSR 000001FC: 0000-0000-2504-0059
MSR 00000300: 0000-0000-8000-FF00
MSR 0000030A: 0000-0000-0000-0000
MSR 0000030B: 0000-0000-0000-0000
MSR 00000480: 00DA-0400-0000-0010
MSR 00000481: 0000-007F-0000-0016
MSR 00000482: FFF9-FFFE-0401-E172
MSR 00000483: 007F-FFFF-0003-6DFF
MSR 00000484: 0000-FFFF-0000-11FF
MSR 00000485: 0000-0000-1004-01E5
MSR 00000486: 0000-0000-8000-0021
MSR 00000487: 0000-0000-FFFF-FFFF
MSR 00000488: 0000-0000-0000-2000
MSR 00000489: 0000-0000-0006-27FF
MSR 0000048A: 0000-0000-0000-002A
MSR 0000048B: 0000-04FF-0000-0000
MSR 0000048C: 0000-0F01-0613-4141
MSR 0000048D: 0000-007F-0000-0016
MSR 0000048E: FFF9-FFFE-0400-6172
MSR 0000048F: 007F-FFFF-0003-6DFB
MSR 00000490: 0000-FFFF-0000-11FB
MSR 00000601: 0014-1494-8000-0438
MSR 00000602: < FAILED >
MSR 00000603: 0000-0000-8015-1515
MSR 00000604: < FAILED >
MSR 00000606: 0000-0000-000A-1003
MSR 0000060A: 0000-0000-0000-0000
MSR 0000060B: 0000-0000-0000-0000
MSR 0000060C: 0000-0000-0000-0000
MSR 0000060D: 0000-0000-0000-0000
MSR 00000610: 0006-8000-005A-8410
MSR 00000611: 0000-0000-9687-6D5E
MSR 00000613: 0000-0000-0000-0000
MSR 00000614: 0000-0000-01A8-0410
MSR 00000618: 0000-0000-0000-0000
MSR 00000619: 0000-0000-0000-0000
MSR 0000061B: 0000-0000-0000-0000
MSR 0000061C: 0028-0258-0078-0118
MSR 00000638: 0000-0000-0000-0000
MSR 00000639: 0000-0000-5C82-C45F
MSR 0000063A: 0000-0000-0000-0000
MSR 0000063B: 0000-0000-0000-0000
MSR 00000640: < FAILED >
MSR 00000641: < FAILED >
MSR 00000642: < FAILED >

------[ MSR Registers / Logical CPU #7 ]------

MSR 00000017: 0008-0000-0000-0000 [PlatID = 2]
MSR 0000001B: 0000-0000-FEE0-0800
MSR 00000035: 0000-0000-0006-000C
MSR 00000048: 0000-0000-0000-0000
MSR 00000049: < FAILED >
MSR 0000008B: 0000-071A-0000-0000
MSR 000000CE: 0000-0C00-7001-2000 [eD = 0]
MSR 000000E7: 0000-0065-945E-7FAE
MSR 000000E8: 0000-0064-C677-AF08
MSR 0000010B: < FAILED >
MSR 00000194: 0000-0000-000E-0000
MSR 00000198: 0000-25A1-0000-2000
MSR 00000199: 0000-0000-0000-2600
MSR 0000019A: 0000-0000-0000-0000
MSR 0000019B: 0000-0000-0000-0000
MSR 0000019C: 0000-0000-883B-0000
MSR 0000019D: 0000-0000-0000-0000
MSR 000001A0: 0000-0040-0085-0089
MSR 000001A2: 0000-0000-005B-0A00
MSR 000001A4: 0000-0000-0000-0000
MSR 000001AA: 0000-0000-0040-0000
MSR 000001AC: < FAILED >
MSR 000001AD: 2323-2323-2425-2626
MSR 000001B0: 0000-0000-0000-0000
MSR 000001B1: 0000-0000-8833-0000
MSR 000001B2: 0000-0000-0000-0000
MSR 000001FC: 0000-0000-2504-0059
MSR 00000300: 0000-0000-8000-FF00
MSR 0000030A: 0000-0000-0000-0000
MSR 0000030B: 0000-0000-0000-0000
MSR 00000480: 00DA-0400-0000-0010
MSR 00000481: 0000-007F-0000-0016
MSR 00000482: FFF9-FFFE-0401-E172
MSR 00000483: 007F-FFFF-0003-6DFF
MSR 00000484: 0000-FFFF-0000-11FF
MSR 00000485: 0000-0000-1004-01E5
MSR 00000486: 0000-0000-8000-0021
MSR 00000487: 0000-0000-FFFF-FFFF
MSR 00000488: 0000-0000-0000-2000
MSR 00000489: 0000-0000-0006-27FF
MSR 0000048A: 0000-0000-0000-002A
MSR 0000048B: 0000-04FF-0000-0000
MSR 0000048C: 0000-0F01-0613-4141
MSR 0000048D: 0000-007F-0000-0016
MSR 0000048E: FFF9-FFFE-0400-6172
MSR 0000048F: 007F-FFFF-0003-6DFB
MSR 00000490: 0000-FFFF-0000-11FB
MSR 00000601: 0014-1494-8000-0438
MSR 00000602: < FAILED >
MSR 00000603: 0000-0000-8015-1515
MSR 00000604: < FAILED >
MSR 00000606: 0000-0000-000A-1003
MSR 0000060A: 0000-0000-0000-0000
MSR 0000060B: 0000-0000-0000-0000
MSR 0000060C: 0000-0000-0000-0000
MSR 0000060D: 0000-0000-0000-0000
MSR 00000610: 0006-8000-005A-8410
MSR 00000611: 0000-0000-9687-7886
MSR 00000613: 0000-0000-0000-0000
MSR 00000614: 0000-0000-01A8-0410
MSR 00000618: 0000-0000-0000-0000
MSR 00000619: 0000-0000-0000-0000
MSR 0000061B: 0000-0000-0000-0000
MSR 0000061C: 0028-0258-0078-0118
MSR 00000638: 0000-0000-0000-0000
MSR 00000639: 0000-0000-5C82-CB5C
MSR 0000063A: 0000-0000-0000-0000
MSR 0000063B: 0000-0000-0000-0000
MSR 00000640: < FAILED >
MSR 00000641: < FAILED >
MSR 00000642: < FAILED >

------[ MSR Registers / Logical CPU #8 ]------

MSR 00000017: 0008-0000-0000-0000 [PlatID = 2]
MSR 0000001B: 0000-0000-FEE0-0800
MSR 00000035: 0000-0000-0006-000C
MSR 00000048: 0000-0000-0000-0000
MSR 00000049: < FAILED >
MSR 0000008B: 0000-071A-0000-0000
MSR 000000CE: 0000-0C00-7001-2000 [eD = 0]
MSR 000000E7: 0000-004A-B782-329C
MSR 000000E8: 0000-0048-ED48-44EA
MSR 0000010B: < FAILED >
MSR 00000194: 0000-0000-000E-0000
MSR 00000198: 0000-24D4-0000-2000
MSR 00000199: 0000-0000-0000-2600
MSR 0000019A: 0000-0000-0000-0000
MSR 0000019B: 0000-0000-0000-0000
MSR 0000019C: 0000-0000-883A-0000
MSR 0000019D: 0000-0000-0000-0000
MSR 000001A0: 0000-0040-0085-0089
MSR 000001A2: 0000-0000-005B-0A00
MSR 000001A4: 0000-0000-0000-0000
MSR 000001AA: 0000-0000-0040-0000
MSR 000001AC: < FAILED >
MSR 000001AD: 2323-2323-2425-2626
MSR 000001B0: 0000-0000-0000-0000
MSR 000001B1: 0000-0000-8834-0000
MSR 000001B2: 0000-0000-0000-0000
MSR 000001FC: 0000-0000-2504-0059
MSR 00000300: 0000-0000-8000-FF00
MSR 0000030A: 0000-0000-0000-0000
MSR 0000030B: 0000-0000-0000-0000
MSR 00000480: 00DA-0400-0000-0010
MSR 00000481: 0000-007F-0000-0016
MSR 00000482: FFF9-FFFE-0401-E172
MSR 00000483: 007F-FFFF-0003-6DFF
MSR 00000484: 0000-FFFF-0000-11FF
MSR 00000485: 0000-0000-1004-01E5
MSR 00000486: 0000-0000-8000-0021
MSR 00000487: 0000-0000-FFFF-FFFF
MSR 00000488: 0000-0000-0000-2000
MSR 00000489: 0000-0000-0006-27FF
MSR 0000048A: 0000-0000-0000-002A
MSR 0000048B: 0000-04FF-0000-0000
MSR 0000048C: 0000-0F01-0613-4141
MSR 0000048D: 0000-007F-0000-0016
MSR 0000048E: FFF9-FFFE-0400-6172
MSR 0000048F: 007F-FFFF-0003-6DFB
MSR 00000490: 0000-FFFF-0000-11FB
MSR 00000601: 0014-1494-8000-0438
MSR 00000602: < FAILED >
MSR 00000603: 0000-0000-8015-1515
MSR 00000604: < FAILED >
MSR 00000606: 0000-0000-000A-1003
MSR 0000060A: 0000-0000-0000-0000
MSR 0000060B: 0000-0000-0000-0000
MSR 0000060C: 0000-0000-0000-0000
MSR 0000060D: 0000-0000-0000-0000
MSR 00000610: 0006-8000-005A-8410
MSR 00000611: 0000-0000-9687-84A3
MSR 00000613: 0000-0000-0000-0000
MSR 00000614: 0000-0000-01A8-0410
MSR 00000618: 0000-0000-0000-0000
MSR 00000619: 0000-0000-0000-0000
MSR 0000061B: 0000-0000-0000-0000
MSR 0000061C: 0028-0258-0078-0118
MSR 00000638: 0000-0000-0000-0000
MSR 00000639: 0000-0000-5C82-D344
MSR 0000063A: 0000-0000-0000-0000
MSR 0000063B: 0000-0000-0000-0000
MSR 00000640: < FAILED >
MSR 00000641: < FAILED >
MSR 00000642: < FAILED >

------[ MSR Registers / Logical CPU #9 ]------

MSR 00000017: 0008-0000-0000-0000 [PlatID = 2]
MSR 0000001B: 0000-0000-FEE0-0800
MSR 00000035: 0000-0000-0006-000C
MSR 00000048: 0000-0000-0000-0000
MSR 00000049: < FAILED >
MSR 0000008B: 0000-071A-0000-0000
MSR 000000CE: 0000-0C00-7001-2000 [eD = 0]
MSR 000000E7: 0000-0021-6D70-A40E
MSR 000000E8: 0000-0020-C8DE-7F2B
MSR 0000010B: < FAILED >
MSR 00000194: 0000-0000-000E-0000
MSR 00000198: 0000-24D4-0000-2000
MSR 00000199: 0000-0000-0000-2600
MSR 0000019A: 0000-0000-0000-0000
MSR 0000019B: 0000-0000-0000-0000
MSR 0000019C: 0000-0000-883A-0000
MSR 0000019D: 0000-0000-0000-0000
MSR 000001A0: 0000-0040-0085-0089
MSR 000001A2: 0000-0000-005B-0A00
MSR 000001A4: 0000-0000-0000-0000
MSR 000001AA: 0000-0000-0040-0000
MSR 000001AC: < FAILED >
MSR 000001AD: 2323-2323-2425-2626
MSR 000001B0: 0000-0000-0000-0000
MSR 000001B1: 0000-0000-8834-0000
MSR 000001B2: 0000-0000-0000-0000
MSR 000001FC: 0000-0000-2504-0059
MSR 00000300: 0000-0000-8000-FF00
MSR 0000030A: 0000-0000-0000-0000
MSR 0000030B: 0000-0000-0000-0000
MSR 00000480: 00DA-0400-0000-0010
MSR 00000481: 0000-007F-0000-0016
MSR 00000482: FFF9-FFFE-0401-E172
MSR 00000483: 007F-FFFF-0003-6DFF
MSR 00000484: 0000-FFFF-0000-11FF
MSR 00000485: 0000-0000-1004-01E5
MSR 00000486: 0000-0000-8000-0021
MSR 00000487: 0000-0000-FFFF-FFFF
MSR 00000488: 0000-0000-0000-2000
MSR 00000489: 0000-0000-0006-27FF
MSR 0000048A: 0000-0000-0000-002A
MSR 0000048B: 0000-04FF-0000-0000
MSR 0000048C: 0000-0F01-0613-4141
MSR 0000048D: 0000-007F-0000-0016
MSR 0000048E: FFF9-FFFE-0400-6172
MSR 0000048F: 007F-FFFF-0003-6DFB
MSR 00000490: 0000-FFFF-0000-11FB
MSR 00000601: 0014-1494-8000-0438
MSR 00000602: < FAILED >
MSR 00000603: 0000-0000-8015-1515
MSR 00000604: < FAILED >
MSR 00000606: 0000-0000-000A-1003
MSR 0000060A: 0000-0000-0000-0000
MSR 0000060B: 0000-0000-0000-0000
MSR 0000060C: 0000-0000-0000-0000
MSR 0000060D: 0000-0000-0000-0000
MSR 00000610: 0006-8000-005A-8410
MSR 00000611: 0000-0000-9687-8FE7
MSR 00000613: 0000-0000-0000-0000
MSR 00000614: 0000-0000-01A8-0410
MSR 00000618: 0000-0000-0000-0000
MSR 00000619: 0000-0000-0000-0000
MSR 0000061B: 0000-0000-0000-0000
MSR 0000061C: 0028-0258-0078-0118
MSR 00000638: 0000-0000-0000-0000
MSR 00000639: 0000-0000-5C82-DA67
MSR 0000063A: 0000-0000-0000-0000
MSR 0000063B: 0000-0000-0000-0000
MSR 00000640: < FAILED >
MSR 00000641: < FAILED >
MSR 00000642: < FAILED >

------[ MSR Registers / Logical CPU #10 ]------

MSR 00000017: 0008-0000-0000-0000 [PlatID = 2]
MSR 0000001B: 0000-0000-FEE0-0800
MSR 00000035: 0000-0000-0006-000C
MSR 00000048: 0000-0000-0000-0000
MSR 00000049: < FAILED >
MSR 0000008B: 0000-071A-0000-0000
MSR 000000CE: 0000-0C00-7001-2000 [eD = 0]
MSR 000000E7: 0000-005D-CBB2-ACBE
MSR 000000E8: 0000-005B-8A24-03CC
MSR 0000010B: < FAILED >
MSR 00000194: 0000-0000-000E-0000
MSR 00000198: 0000-24D4-0000-2000
MSR 00000199: 0000-0000-0000-2600
MSR 0000019A: 0000-0000-0000-0000
MSR 0000019B: 0000-0000-0000-0000
MSR 0000019C: 0000-0000-883C-0000
MSR 0000019D: 0000-0000-0000-0000
MSR 000001A0: 0000-0040-0085-0089
MSR 000001A2: 0000-0000-005B-0A00
MSR 000001A4: 0000-0000-0000-0000
MSR 000001AA: 0000-0000-0040-0000
MSR 000001AC: < FAILED >
MSR 000001AD: 2323-2323-2425-2626
MSR 000001B0: 0000-0000-0000-0000
MSR 000001B1: 0000-0000-8834-0000
MSR 000001B2: 0000-0000-0000-0000
MSR 000001FC: 0000-0000-2504-0059
MSR 00000300: 0000-0000-8000-FF00
MSR 0000030A: 0000-0000-0000-0000
MSR 0000030B: 0000-0000-0000-0000
MSR 00000480: 00DA-0400-0000-0010
MSR 00000481: 0000-007F-0000-0016
MSR 00000482: FFF9-FFFE-0401-E172
MSR 00000483: 007F-FFFF-0003-6DFF
MSR 00000484: 0000-FFFF-0000-11FF
MSR 00000485: 0000-0000-1004-01E5
MSR 00000486: 0000-0000-8000-0021
MSR 00000487: 0000-0000-FFFF-FFFF
MSR 00000488: 0000-0000-0000-2000
MSR 00000489: 0000-0000-0006-27FF
MSR 0000048A: 0000-0000-0000-002A
MSR 0000048B: 0000-04FF-0000-0000
MSR 0000048C: 0000-0F01-0613-4141
MSR 0000048D: 0000-007F-0000-0016
MSR 0000048E: FFF9-FFFE-0400-6172
MSR 0000048F: 007F-FFFF-0003-6DFB
MSR 00000490: 0000-FFFF-0000-11FB
MSR 00000601: 0014-1494-8000-0438
MSR 00000602: < FAILED >
MSR 00000603: 0000-0000-8015-1515
MSR 00000604: < FAILED >
MSR 00000606: 0000-0000-000A-1003
MSR 0000060A: 0000-0000-0000-0000
MSR 0000060B: 0000-0000-0000-0000
MSR 0000060C: 0000-0000-0000-0000
MSR 0000060D: 0000-0000-0000-0000
MSR 00000610: 0006-8000-005A-8410
MSR 00000611: 0000-0000-9687-9AF9
MSR 00000613: 0000-0000-0000-0000
MSR 00000614: 0000-0000-01A8-0410
MSR 00000618: 0000-0000-0000-0000
MSR 00000619: 0000-0000-0000-0000
MSR 0000061B: 0000-0000-0000-0000
MSR 0000061C: 0028-0258-0078-0118
MSR 00000638: 0000-0000-0000-0000
MSR 00000639: 0000-0000-5C82-E14E
MSR 0000063A: 0000-0000-0000-0000
MSR 0000063B: 0000-0000-0000-0000
MSR 00000640: < FAILED >
MSR 00000641: < FAILED >
MSR 00000642: < FAILED >

------[ MSR Registers / Logical CPU #11 ]------

MSR 00000017: 0008-0000-0000-0000 [PlatID = 2]
MSR 0000001B: 0000-0000-FEE0-0800
MSR 00000035: 0000-0000-0006-000C
MSR 00000048: 0000-0000-0000-0000
MSR 00000049: < FAILED >
MSR 0000008B: 0000-071A-0000-0000
MSR 000000CE: 0000-0C00-7001-2000 [eD = 0]
MSR 000000E7: 0000-004D-35A3-FB4A
MSR 000000E8: 0000-004C-8AC4-6EB0
MSR 0000010B: < FAILED >
MSR 00000194: 0000-0000-000E-0000
MSR 00000198: 0000-24D4-0000-2000
MSR 00000199: 0000-0000-0000-2600
MSR 0000019A: 0000-0000-0000-0000
MSR 0000019B: 0000-0000-0000-0000
MSR 0000019C: 0000-0000-883B-0000
MSR 0000019D: 0000-0000-0000-0000
MSR 000001A0: 0000-0040-0085-0089
MSR 000001A2: 0000-0000-005B-0A00
MSR 000001A4: 0000-0000-0000-0000
MSR 000001AA: 0000-0000-0040-0000
MSR 000001AC: < FAILED >
MSR 000001AD: 2323-2323-2425-2626
MSR 000001B0: 0000-0000-0000-0000
MSR 000001B1: 0000-0000-8834-0000
MSR 000001B2: 0000-0000-0000-0000
MSR 000001FC: 0000-0000-2504-0059
MSR 00000300: 0000-0000-8000-FF00
MSR 0000030A: 0000-0000-0000-0000
MSR 0000030B: 0000-0000-0000-0000
MSR 00000480: 00DA-0400-0000-0010
MSR 00000481: 0000-007F-0000-0016
MSR 00000482: FFF9-FFFE-0401-E172
MSR 00000483: 007F-FFFF-0003-6DFF
MSR 00000484: 0000-FFFF-0000-11FF
MSR 00000485: 0000-0000-1004-01E5
MSR 00000486: 0000-0000-8000-0021
MSR 00000487: 0000-0000-FFFF-FFFF
MSR 00000488: 0000-0000-0000-2000
MSR 00000489: 0000-0000-0006-27FF
MSR 0000048A: 0000-0000-0000-002A
MSR 0000048B: 0000-04FF-0000-0000
MSR 0000048C: 0000-0F01-0613-4141
MSR 0000048D: 0000-007F-0000-0016
MSR 0000048E: FFF9-FFFE-0400-6172
MSR 0000048F: 007F-FFFF-0003-6DFB
MSR 00000490: 0000-FFFF-0000-11FB
MSR 00000601: 0014-1494-8000-0438
MSR 00000602: < FAILED >
MSR 00000603: 0000-0000-8015-1515
MSR 00000604: < FAILED >
MSR 00000606: 0000-0000-000A-1003
MSR 0000060A: 0000-0000-0000-0000
MSR 0000060B: 0000-0000-0000-0000
MSR 0000060C: 0000-0000-0000-0000
MSR 0000060D: 0000-0000-0000-0000
MSR 00000610: 0006-8000-005A-8410
MSR 00000611: 0000-0000-9687-A6C9
MSR 00000613: 0000-0000-0000-0000
MSR 00000614: 0000-0000-01A8-0410
MSR 00000618: 0000-0000-0000-0000
MSR 00000619: 0000-0000-0000-0000
MSR 0000061B: 0000-0000-0000-0000
MSR 0000061C: 0028-0258-0078-0118
MSR 00000638: 0000-0000-0000-0000
MSR 00000639: 0000-0000-5C82-E8E7
MSR 0000063A: 0000-0000-0000-0000
MSR 0000063B: 0000-0000-0000-0000
MSR 00000640: < FAILED >
MSR 00000641: < FAILED >
MSR 00000642: < FAILED >

PerformanceFrequency = 10000000

CPU Clock M.Method = 8  (APIC SNB)
PM Timer Address   = 1032  (0408h)

APIC Clock = 100.30 MHz  (AT = 52547 / TT = 15003 / try = 1 / SKL = 0.00 MHz)
APIC Clock = 100.30 MHz  (AT = 52547 / TT = 15003 / try = 1 / SKL = 0.00 MHz)
APIC Clock = 100.30 MHz  (AT = 52547 / TT = 15003 / try = 1 / SKL = 0.00 MHz)
APIC Clock = 100.30 MHz  (AT = 52547 / TT = 15003 / try = 1 / SKL = 0.00 MHz)
APIC Clock = 100.30 MHz  (AT = 52547 / TT = 15003 / try = 1 / SKL = 0.00 MHz)

CPU Clock = 1203.56 MHz / TSC Clock = 3209.50 MHz / CPU Mul = 12.00x
CPU Clock = 1203.56 MHz / TSC Clock = 3209.50 MHz / CPU Mul = 12.00x
CPU Clock = 1203.56 MHz / TSC Clock = 3209.50 MHz / CPU Mul = 12.00x
CPU Clock = 1203.56 MHz / TSC Clock = 3209.50 MHz / CPU Mul = 12.00x
CPU Clock = 3209.50 MHz / TSC Clock = 3209.50 MHz / CPU Mul = 32.00x

CPU Clock Max = 3209.50 MHz / TSC Clock = 3209.50 MHz / CPU Mul = 32.00x
CPU Clock Max = 3209.50 MHz / TSC Clock = 3209.50 MHz / CPU Mul = 32.00x
CPU Clock Max = 3209.50 MHz / TSC Clock = 3209.50 MHz / CPU Mul = 32.00x
CPU Clock Max = 3209.50 MHz / TSC Clock = 3209.50 MHz / CPU Mul = 32.00x
CPU Clock Max = 3209.50 MHz / TSC Clock = 3209.50 MHz / CPU Mul = 32.00x

INTPERFCTR2 = 3209.53 MHz / INTPERFCTR1 (TSC) = 3209.53 MHz
INTPERFCTR2 = 3206.97 MHz / INTPERFCTR1 (TSC) = 3206.97 MHz
INTPERFCTR2 = 3205.09 MHz / INTPERFCTR1 (TSC) = 3206.78 MHz
INTPERFCTR2 = 3209.53 MHz / INTPERFCTR1 (TSC) = 3209.53 MHz
INTPERFCTR2 = 3209.51 MHz / INTPERFCTR1 (TSC) = 3209.51 MHz
