------[ Versions ]------

Program Version : AIDA64 v5.80.4102 Beta
BenchDLL Version: 4.3.718-x64

------[ CPU Info ]------

CPU Type          : Mobile DualCore Intel Core i5-5250U, 1600 MHz (16 x 100)
CPU Alias         : Broadwell-U
CPU Platform      : BGA1168
CPU Stepping      : E0/F0
Instruction Set   : x86, x86-64, MMX, SSE, SSE2, SSE3, SSSE3, SSE4.1, SSE4.2, AVX, AVX2, FMA, AES
CPUID Manufacturer: GenuineIntel
CPUID CPU Name    : Intel(R) Core(TM) i5-5250U CPU @ 1.60GHz
CPUID Revision    : 000306D4h
IA Brand ID       : 00h  (Unknown)
Platform ID       : 2Bh  (BGA1168)
HTT / CMP Units   : 2 / 2
Max. NUMA Node    : 0

Tjmax Temperature          : 105 Celsius
HTC Temperature Limit      : 0 Celsius
CPU TDP                    : 15 W
CPU TDC                    : 32 A
CPU Max Power Limit        : Unlimited Power / Unlimited Time
CPU Power Limit 1 (Long)   : 20 W / 28.00 sec  (Unlocked)
CPU Power Limit 2 (Short)  : 25 W / 2.44 ms  (Unlocked)
Max Turbo Boost Multipliers: 1C: 27x, 2C: 25x

------[ Logical CPU #0 ]------

allcpu: Package 0 / Core 0 / Thread 0: Valid

CPUID 00000000: 00000014-756E6547-6C65746E-49656E69 [GenuineIntel]
CPUID 00000001: 000306D4-00100800-7FFAFBBF-BFEBFBFF
CPUID 00000002: 76036301-00F0B5FF-00000000-00C30000
CPUID 00000003: 00000000-00000000-00000000-00000000
CPUID 00000004: 1C004121-01C0003F-0000003F-00000000 [SL 00]
CPUID 00000004: 1C004122-01C0003F-0000003F-00000000 [SL 01]
CPUID 00000004: 1C004143-01C0003F-000001FF-00000000 [SL 02]
CPUID 00000004: 1C03C163-02C0003F-00000FFF-00000006 [SL 03]
CPUID 00000005: 00000040-00000040-00000003-11142120
CPUID 00000006: 00000077-00000002-00000009-00000000
CPUID 00000007: 00000000-021C27AB-00000000-00000000
CPUID 00000008: 00000000-00000000-00000000-00000000
CPUID 00000009: 00000000-00000000-00000000-00000000
CPUID 0000000A: 07300403-00000000-00000000-00000603
CPUID 0000000B: 00000001-00000002-00000100-00000000 [SL 00]
CPUID 0000000B: 00000004-00000004-00000201-00000000 [SL 01]
CPUID 0000000C: 00000000-00000001-00000001-00000000
CPUID 0000000D: 00000007-00000340-00000340-00000000 [SL 00]
CPUID 0000000D: 00000001-00000000-00000000-00000000 [SL 01]
CPUID 0000000D: 00000100-00000240-00000000-00000000 [SL 02]
CPUID 0000000E: 00000000-00000000-00000000-00000000
CPUID 0000000F: 00000000-00000000-00000000-00000000 [SL 00]
CPUID 0000000F: 00000000-00000000-00000000-00000000 [SL 01]
CPUID 00000010: 00000000-00000000-00000000-00000000 [SL 00]
CPUID 00000010: 00000000-00000000-00000000-00000000 [SL 01]
CPUID 00000011: 00000000-00000000-00000000-00000000
CPUID 00000012: 00000000-00000000-00000000-00000000 [SL 00]
CPUID 00000012: 00000000-00000000-00000000-00000000 [SL 01]
CPUID 00000013: 00000000-00000000-00000000-00000000
CPUID 00000014: 00000000-00000001-00000001-00000000 [SL 00]
CPUID 80000000: 80000008-00000000-00000000-00000000
CPUID 80000001: 00000000-00000000-00000121-2C100000
CPUID 80000002: 65746E49-2952286C-726F4320-4D542865 [Intel(R) Core(TM]
CPUID 80000003: 35692029-3532352D-43205530-40205550 [) i5-5250U CPU @]
CPUID 80000004: 362E3120-7A484730-00000000-00000000 [ 1.60GHz]
CPUID 80000005: 00000000-00000000-00000000-00000000
CPUID 80000006: 00000000-00000000-01006040-00000000
CPUID 80000007: 00000000-00000000-00000000-00000100
CPUID 80000008: 00003027-00000000-00000000-00000000

L1    Data Cache:    32 KB,  8-way Associative, 64-byte Line
L1  Instr. Cache:    32 KB,  8-way Associative, 64-byte Line
L2 Unified Cache:   256 KB,  8-way Associative, 64-byte Line
L3 Unified Cache:     3 MB, 12-way Associative, 64-byte Line

------[ Logical CPU #1 ]------

allcpu: Package 0 / Core 0 / Thread 1: Valid, Virtual

CPUID 00000000: 00000014-756E6547-6C65746E-49656E69 [GenuineIntel]
CPUID 00000001: 000306D4-01100800-7FFAFBBF-BFEBFBFF
CPUID 00000002: 76036301-00F0B5FF-00000000-00C30000
CPUID 00000003: 00000000-00000000-00000000-00000000
CPUID 00000004: 1C004121-01C0003F-0000003F-00000000 [SL 00]
CPUID 00000004: 1C004122-01C0003F-0000003F-00000000 [SL 01]
CPUID 00000004: 1C004143-01C0003F-000001FF-00000000 [SL 02]
CPUID 00000004: 1C03C163-02C0003F-00000FFF-00000006 [SL 03]
CPUID 00000005: 00000040-00000040-00000003-11142120
CPUID 00000006: 00000077-00000002-00000009-00000000
CPUID 00000007: 00000000-021C27AB-00000000-00000000
CPUID 00000008: 00000000-00000000-00000000-00000000
CPUID 00000009: 00000000-00000000-00000000-00000000
CPUID 0000000A: 07300403-00000000-00000000-00000603
CPUID 0000000B: 00000001-00000002-00000100-00000001 [SL 00]
CPUID 0000000B: 00000004-00000004-00000201-00000001 [SL 01]
CPUID 0000000C: 00000000-00000001-00000001-00000000
CPUID 0000000D: 00000007-00000340-00000340-00000000 [SL 00]
CPUID 0000000D: 00000001-00000000-00000000-00000000 [SL 01]
CPUID 0000000D: 00000100-00000240-00000000-00000000 [SL 02]
CPUID 0000000E: 00000000-00000000-00000000-00000000
CPUID 0000000F: 00000000-00000000-00000000-00000000 [SL 00]
CPUID 0000000F: 00000000-00000000-00000000-00000000 [SL 01]
CPUID 00000010: 00000000-00000000-00000000-00000000 [SL 00]
CPUID 00000010: 00000000-00000000-00000000-00000000 [SL 01]
CPUID 00000011: 00000000-00000000-00000000-00000000
CPUID 00000012: 00000000-00000000-00000000-00000000 [SL 00]
CPUID 00000012: 00000000-00000000-00000000-00000000 [SL 01]
CPUID 00000013: 00000000-00000000-00000000-00000000
CPUID 00000014: 00000000-00000001-00000001-00000000 [SL 00]
CPUID 80000000: 80000008-00000000-00000000-00000000
CPUID 80000001: 00000000-00000000-00000121-2C100000
CPUID 80000002: 65746E49-2952286C-726F4320-4D542865 [Intel(R) Core(TM]
CPUID 80000003: 35692029-3532352D-43205530-40205550 [) i5-5250U CPU @]
CPUID 80000004: 362E3120-7A484730-00000000-00000000 [ 1.60GHz]
CPUID 80000005: 00000000-00000000-00000000-00000000
CPUID 80000006: 00000000-00000000-01006040-00000000
CPUID 80000007: 00000000-00000000-00000000-00000100
CPUID 80000008: 00003027-00000000-00000000-00000000

L1    Data Cache:    32 KB,  8-way Associative, 64-byte Line
L1  Instr. Cache:    32 KB,  8-way Associative, 64-byte Line
L2 Unified Cache:   256 KB,  8-way Associative, 64-byte Line
L3 Unified Cache:     3 MB, 12-way Associative, 64-byte Line

------[ Logical CPU #2 ]------

allcpu: Package 0 / Core 1 / Thread 0: Valid

CPUID 00000000: 00000014-756E6547-6C65746E-49656E69 [GenuineIntel]
CPUID 00000001: 000306D4-02100800-7FFAFBBF-BFEBFBFF
CPUID 00000002: 76036301-00F0B5FF-00000000-00C30000
CPUID 00000003: 00000000-00000000-00000000-00000000
CPUID 00000004: 1C004121-01C0003F-0000003F-00000000 [SL 00]
CPUID 00000004: 1C004122-01C0003F-0000003F-00000000 [SL 01]
CPUID 00000004: 1C004143-01C0003F-000001FF-00000000 [SL 02]
CPUID 00000004: 1C03C163-02C0003F-00000FFF-00000006 [SL 03]
CPUID 00000005: 00000040-00000040-00000003-11142120
CPUID 00000006: 00000077-00000002-00000009-00000000
CPUID 00000007: 00000000-021C27AB-00000000-00000000
CPUID 00000008: 00000000-00000000-00000000-00000000
CPUID 00000009: 00000000-00000000-00000000-00000000
CPUID 0000000A: 07300403-00000000-00000000-00000603
CPUID 0000000B: 00000001-00000002-00000100-00000002 [SL 00]
CPUID 0000000B: 00000004-00000004-00000201-00000002 [SL 01]
CPUID 0000000C: 00000000-00000001-00000001-00000000
CPUID 0000000D: 00000007-00000340-00000340-00000000 [SL 00]
CPUID 0000000D: 00000001-00000000-00000000-00000000 [SL 01]
CPUID 0000000D: 00000100-00000240-00000000-00000000 [SL 02]
CPUID 0000000E: 00000000-00000000-00000000-00000000
CPUID 0000000F: 00000000-00000000-00000000-00000000 [SL 00]
CPUID 0000000F: 00000000-00000000-00000000-00000000 [SL 01]
CPUID 00000010: 00000000-00000000-00000000-00000000 [SL 00]
CPUID 00000010: 00000000-00000000-00000000-00000000 [SL 01]
CPUID 00000011: 00000000-00000000-00000000-00000000
CPUID 00000012: 00000000-00000000-00000000-00000000 [SL 00]
CPUID 00000012: 00000000-00000000-00000000-00000000 [SL 01]
CPUID 00000013: 00000000-00000000-00000000-00000000
CPUID 00000014: 00000000-00000001-00000001-00000000 [SL 00]
CPUID 80000000: 80000008-00000000-00000000-00000000
CPUID 80000001: 00000000-00000000-00000121-2C100000
CPUID 80000002: 65746E49-2952286C-726F4320-4D542865 [Intel(R) Core(TM]
CPUID 80000003: 35692029-3532352D-43205530-40205550 [) i5-5250U CPU @]
CPUID 80000004: 362E3120-7A484730-00000000-00000000 [ 1.60GHz]
CPUID 80000005: 00000000-00000000-00000000-00000000
CPUID 80000006: 00000000-00000000-01006040-00000000
CPUID 80000007: 00000000-00000000-00000000-00000100
CPUID 80000008: 00003027-00000000-00000000-00000000

L1    Data Cache:    32 KB,  8-way Associative, 64-byte Line
L1  Instr. Cache:    32 KB,  8-way Associative, 64-byte Line
L2 Unified Cache:   256 KB,  8-way Associative, 64-byte Line
L3 Unified Cache:     3 MB, 12-way Associative, 64-byte Line

------[ Logical CPU #3 ]------

allcpu: Package 0 / Core 1 / Thread 1: Valid, Virtual

CPUID 00000000: 00000014-756E6547-6C65746E-49656E69 [GenuineIntel]
CPUID 00000001: 000306D4-03100800-7FFAFBBF-BFEBFBFF
CPUID 00000002: 76036301-00F0B5FF-00000000-00C30000
CPUID 00000003: 00000000-00000000-00000000-00000000
CPUID 00000004: 1C004121-01C0003F-0000003F-00000000 [SL 00]
CPUID 00000004: 1C004122-01C0003F-0000003F-00000000 [SL 01]
CPUID 00000004: 1C004143-01C0003F-000001FF-00000000 [SL 02]
CPUID 00000004: 1C03C163-02C0003F-00000FFF-00000006 [SL 03]
CPUID 00000005: 00000040-00000040-00000003-11142120
CPUID 00000006: 00000077-00000002-00000009-00000000
CPUID 00000007: 00000000-021C27AB-00000000-00000000
CPUID 00000008: 00000000-00000000-00000000-00000000
CPUID 00000009: 00000000-00000000-00000000-00000000
CPUID 0000000A: 07300403-00000000-00000000-00000603
CPUID 0000000B: 00000001-00000002-00000100-00000003 [SL 00]
CPUID 0000000B: 00000004-00000004-00000201-00000003 [SL 01]
CPUID 0000000C: 00000000-00000001-00000001-00000000
CPUID 0000000D: 00000007-00000340-00000340-00000000 [SL 00]
CPUID 0000000D: 00000001-00000000-00000000-00000000 [SL 01]
CPUID 0000000D: 00000100-00000240-00000000-00000000 [SL 02]
CPUID 0000000E: 00000000-00000000-00000000-00000000
CPUID 0000000F: 00000000-00000000-00000000-00000000 [SL 00]
CPUID 0000000F: 00000000-00000000-00000000-00000000 [SL 01]
CPUID 00000010: 00000000-00000000-00000000-00000000 [SL 00]
CPUID 00000010: 00000000-00000000-00000000-00000000 [SL 01]
CPUID 00000011: 00000000-00000000-00000000-00000000
CPUID 00000012: 00000000-00000000-00000000-00000000 [SL 00]
CPUID 00000012: 00000000-00000000-00000000-00000000 [SL 01]
CPUID 00000013: 00000000-00000000-00000000-00000000
CPUID 00000014: 00000000-00000001-00000001-00000000 [SL 00]
CPUID 80000000: 80000008-00000000-00000000-00000000
CPUID 80000001: 00000000-00000000-00000121-2C100000
CPUID 80000002: 65746E49-2952286C-726F4320-4D542865 [Intel(R) Core(TM]
CPUID 80000003: 35692029-3532352D-43205530-40205550 [) i5-5250U CPU @]
CPUID 80000004: 362E3120-7A484730-00000000-00000000 [ 1.60GHz]
CPUID 80000005: 00000000-00000000-00000000-00000000
CPUID 80000006: 00000000-00000000-01006040-00000000
CPUID 80000007: 00000000-00000000-00000000-00000100
CPUID 80000008: 00003027-00000000-00000000-00000000

L1    Data Cache:    32 KB,  8-way Associative, 64-byte Line
L1  Instr. Cache:    32 KB,  8-way Associative, 64-byte Line
L2 Unified Cache:   256 KB,  8-way Associative, 64-byte Line
L3 Unified Cache:     3 MB, 12-way Associative, 64-byte Line

------[ All CPUs ]------

CPU   0: APICID   0 / Package 0 / Core  0 / Thread 0: Valid
CPU   1: APICID   1 / Package 0 / Core  0 / Thread 1: Valid, Virtual
CPU   2: APICID   2 / Package 0 / Core  1 / Thread 0: Valid
CPU   3: APICID   3 / Package 0 / Core  1 / Thread 1: Valid, Virtual

------[ MSR Registers ]------

MSR 00000017: 0018-0000-0000-0000 [PlatID = 6]
MSR 0000001B: 0000-0000-FEE0-0900
MSR 00000035: 0000-0000-0002-0004
MSR 0000008B: 0000-0021-0000-0000
MSR 000000CE: 0005-053B-FB01-1000 [eD = 0]
MSR 000000E7: 0000-020E-2B22-59A0 [S200]
MSR 000000E7: 0000-020E-2B83-1E08 [S200]
MSR 000000E7: 0000-020E-2B97-72A0
MSR 000000E8: 0000-0324-3625-5EEB [S200]
MSR 000000E8: 0000-0324-363A-F24A [S200]
MSR 000000E8: 0000-0324-3650-5507
MSR 00000194: 0000-0000-0001-0000
MSR 00000198: 0000-194B-0000-1000 [S200]
MSR 00000198: 0000-194B-0000-1000 [S200]
MSR 00000198: 0000-194B-0000-1000
MSR 00000199: 0000-0000-0000-1000
MSR 0000019A: 0000-0000-0000-0000
MSR 0000019B: 0000-0000-0000-0000
MSR 0000019C: 0000-0000-8828-0800 [S200]
MSR 0000019C: 0000-0000-8828-0800 [S200]
MSR 0000019C: 0000-0000-8828-0800
MSR 0000019D: 0000-0000-0000-0000
MSR 000001A0: 0000-0000-0085-0089
MSR 000001A2: 0000-0000-0069-0000
MSR 000001A4: 0000-0000-0000-0000
MSR 000001AA: 0000-0000-0040-0000
MSR 000001AC: < FAILED >
MSR 000001AD: 0000-1919-1919-191B
MSR 000001B0: 0000-0000-0000-0006
MSR 000001B1: 0000-0000-8828-0800
MSR 000001B2: 0000-0000-0000-0000
MSR 000001FC: 0000-0000-0004-005F
MSR 00000300: < FAILED >
MSR 0000030A: 0000-0000-0000-0000 [S200]
MSR 0000030A: 0000-0000-0000-0000 [S200]
MSR 0000030A: 0000-0000-0000-0000
MSR 0000030B: 0000-0000-0000-0000 [S200]
MSR 0000030B: 0000-0000-0000-0000 [S200]
MSR 0000030B: 0000-0000-0000-0000
MSR 00000480: 00DA-0400-0000-0012
MSR 00000481: 0000-007F-0000-0016
MSR 00000482: FFF9-FFFE-0401-E172
MSR 00000483: 007F-FFFF-0003-6DFF
MSR 00000484: 0000-FFFF-0000-11FF
MSR 00000485: 0000-0000-3004-81E5
MSR 00000486: 0000-0000-8000-0021
MSR 00000487: 0000-0000-FFFF-FFFF
MSR 00000488: 0000-0000-0000-2000
MSR 00000489: 0000-0000-0037-27FF
MSR 0000048A: 0000-0000-0000-002A
MSR 0000048B: 0005-3CFF-0000-0000
MSR 0000048C: 0000-0F01-0633-4141
MSR 0000048D: 0000-007F-0000-0016
MSR 0000048E: FFF9-FFFE-0400-6172
MSR 0000048F: 007F-FFFF-0003-6DFB
MSR 00000490: 0000-FFFF-0000-11FB
MSR 00000601: 4010-1414-0000-0100
MSR 00000602: < FAILED >
MSR 00000603: 0036-0000-0033-3333
MSR 00000604: < FAILED >
MSR 00000606: 0000-0000-000A-0E03
MSR 0000060A: 0000-0000-0000-8842
MSR 0000060B: 0000-0000-0000-8873
MSR 0000060C: 0000-0000-0000-88E1
MSR 0000060D: 0000-0000-0000-0000
MSR 00000610: 0042-80C8-00DD-80A0
MSR 00000611: 0000-0000-2BC4-7D7A [S200]
MSR 00000611: 0000-0000-2BC4-A0DB [S200]
MSR 00000611: 0000-0000-2BC4-C00C
MSR 00000613: 0000-0000-0000-0018
MSR 00000614: 0000-0000-0000-0078
MSR 00000618: 0000-0000-0000-0000
MSR 00000619: 0000-0000-0F47-B0E9 [S200]
MSR 00000619: 0000-0000-0F47-C2A8 [S200]
MSR 00000619: 0000-0000-0F47-D466
MSR 0000061B: 0000-0000-0000-0000
MSR 0000061C: < FAILED >
MSR 0000061E: < FAILED >
MSR 00000620: 0000-0000-0000-0718
MSR 00000621: 0000-0000-0000-0010
MSR 00000638: 0000-0000-0000-0000
MSR 00000639: 0000-0000-14CF-6821 [S200]
MSR 00000639: 0000-0000-14CF-68D9 [S200]
MSR 00000639: 0000-0000-14CF-69A5
MSR 0000063A: 0000-0000-0000-0009
MSR 0000063B: < FAILED >
MSR 00000640: 0000-0000-0000-0000
MSR 00000641: 0000-0000-0078-D086 [S200]
MSR 00000641: 0000-0000-0078-D086 [S200]
MSR 00000641: 0000-0000-0078-D086
MSR 00000642: 0000-0000-0000-000D
MSR 00000648: 0000-0000-0000-0010
MSR 00000649: 0000-0000-0006-004C
MSR 0000064A: 0000-0000-0000-0000
MSR 0000064B: 0000-0000-0000-0000
MSR 0000064C: 0000-0000-0000-000F
MSR 00000690: 0000-0000-3D20-0020
MSR 000006B0: 0000-0000-1D00-0000
MSR 000006B1: 0000-0000-0900-0000

PerformanceFrequency = 1558889

CPU Clock M.Method = 8  (APIC SNB)
PM Timer Address   = 6152  (1808h)

APIC Clock = 99.77 MHz  (AT = 52267 / TT = 15002 / try = 1 / SKL = 0.00 MHz)
APIC Clock = 99.76 MHz  (AT = 52268 / TT = 15003 / try = 1 / SKL = 0.00 MHz)
APIC Clock = 99.77 MHz  (AT = 52273 / TT = 15003 / try = 1 / SKL = 0.00 MHz)
APIC Clock = 99.77 MHz  (AT = 52266 / TT = 15002 / try = 1 / SKL = 0.00 MHz)
APIC Clock = 99.77 MHz  (AT = 52271 / TT = 15003 / try = 1 / SKL = 0.00 MHz)

CPU Clock = 1596.35 MHz / TSC Clock = 1596.35 MHz / CPU Mul = 16.00x
CPU Clock = 1596.37 MHz / TSC Clock = 1596.37 MHz / CPU Mul = 16.00x
CPU Clock = 1596.29 MHz / TSC Clock = 1596.29 MHz / CPU Mul = 16.00x
CPU Clock = 1596.22 MHz / TSC Clock = 1596.22 MHz / CPU Mul = 16.00x
CPU Clock = 1596.31 MHz / TSC Clock = 1596.31 MHz / CPU Mul = 16.00x

CPU Clock Max = 2693.64 MHz / TSC Clock = 1596.23 MHz / CPU Mul = 27.00x
CPU Clock Max = 2693.66 MHz / TSC Clock = 1596.25 MHz / CPU Mul = 27.00x
CPU Clock Max = 2693.69 MHz / TSC Clock = 1596.26 MHz / CPU Mul = 27.00x
CPU Clock Max = 2693.67 MHz / TSC Clock = 1596.25 MHz / CPU Mul = 27.00x
CPU Clock Max = 2693.66 MHz / TSC Clock = 1596.25 MHz / CPU Mul = 27.00x

INTPERFCTR2 = 2092.44 MHz / INTPERFCTR1 (TSC) = 1582.82 MHz
INTPERFCTR2 = 1933.66 MHz / INTPERFCTR1 (TSC) = 1589.15 MHz
INTPERFCTR2 = 1882.37 MHz / INTPERFCTR1 (TSC) = 1594.53 MHz
INTPERFCTR2 = 1905.22 MHz / INTPERFCTR1 (TSC) = 1593.00 MHz
INTPERFCTR2 = 1890.75 MHz / INTPERFCTR1 (TSC) = 1592.74 MHz

------[ OC MailBox ]------

C 01 / P1 00 / P2 00: 0000061B
C 01 / P1 01 / P2 00: 00000739
C 01 / P1 02 / P2 00: 00000618
C 01 / P1 03 / P2 00: 00000400
C 02 / P1 00 / P2 00: 1919191B
C 02 / P1 00 / P2 01: < FAILED >
C 10 / P1 00 / P2 00: 00000000
C 10 / P1 01 / P2 00: 00000013
C 10 / P1 02 / P2 00: 00000000
C 10 / P1 03 / P2 00: 00000000
C 12 / P1 00 / P2 00: 00000000
C 14 / P1 00 / P2 00: 00000000
