------[ Versions ]------

Program Version : EVEREST v4.60.1628 Beta
BenchDLL Version: 2.4.257.0

------[ CPU Info ]------

CPU Type           : Intel Celeron D 326, 2533 MHz (19 x 133)
CPU Alias          : Prescott-256
CPU Platform       : LGA775
CPU Stepping       : E0
Instruction Set    : x86, x86-64, MMX, SSE, SSE2, SSE3
CPUID Manufacturer : GenuineIntel
CPUID CPU Name     : Intel(R) Celeron(R) CPU 2.53GHz
CPUID Revision     : 00000F41h
IA Brand ID        : 00h  (Unknown)
Platform ID        : 2Ah  (LGA775)

------[ Logical CPU #0 ]------

allcpu: Valid

CPUID 00000000: 00000005-756E6547-6C65746E-49656E69
CPUID 00000001: 00000F41-00010800-0000651D-BFEBFBFF
CPUID 00000002: 605B5101-00000000-00000000-003C7040
CPUID 00000003: 00000000-00000000-00000000-00000000
CPUID 00000004: 00000121-01C0003F-0000001F-00000000
CPUID 00000004: 00000143-00C0103F-000001FF-00000000
CPUID 00000005: 00000040-00000040-00000000-00000000
CPUID 80000000: 80000008-00000000-00000000-00000000
CPUID 80000001: 00000000-00000000-00000000-20100000
CPUID 80000002: 20202020-20202020-20202020-20202020
CPUID 80000003: 65746E49-2952286C-6C654320-6E6F7265
CPUID 80000004: 20295228-20555043-33352E32-007A4847
CPUID 80000005: 00000000-00000000-00000000-00000000
CPUID 80000006: 00000000-00000000-01004040-00000000
CPUID 80000007: 00000000-00000000-00000000-00000000
CPUID 80000008: 00003024-00000000-00000000-00000000

L1    Data Cache:     16 KB,  8-way Associative, 64-byte Line
L2 Unified Cache:    256 KB,  4-way Associative, 64-byte Line

------[ MSR Registers ]------

MSR 00000017: 0012-0000-0000-0000 [PlatID = 4]
MSR 0000001B: 0000-0000-FEE0-0900
MSR 0000002A: 0000-0000-0000-0000
MSR 0000002C: 0000-0000-1311-0513
MSR 0000008B: 0000-0017-0000-0000
MSR 0000019A: 0000-0000-0000-0000
MSR 0000019B: 0000-0000-0000-0000
MSR 0000019C: 0000-0000-0000-0000
MSR 0000019D: 0000-0000-0000-0E1E
MSR 000001A0: 0000-0000-2084-2081
MSR 000001A1: 0000-0000-0000-0000

PerformanceFrequency = 3579545

Tjmax Temperature = 0 Celsius
