------[ Versions ]------

Program Version : EVEREST v5.00.1650
BenchDLL Version: 2.4.257.0

------[ CPU Info ]------

CPU Type           : QuadCore Intel Xeon X5550, 2666 MHz (20 x 133)
CPU Alias          : Nehalem-EP
CPU Platform       : LGA1366 DP
CPU Stepping       : B0
Instruction Set    : x86, x86-64, MMX, SSE, SSE2, SSE3, SSSE3, SSE4.1, SSE4.2
CPUID Manufacturer : GenuineIntel
CPUID CPU Name     : Genuine Intel(R) CPU @ 0000 @ 2.67GHz
CPUID Revision     : 000106A2h
IA Brand ID        : 00h  (Unknown)
Platform ID        : 2Ch  (LGA1366 DP)

------[ Logical CPU #0 ]------

allcpu: Valid

CPUID 00000000: 0000000B-756E6547-6C65746E-49656E69
CPUID 00000001: 000106A2-00100800-00BCE3BD-BFEBFBFF
CPUID 00000002: 55035A01-00F0B2E4-00000000-09CA212C
CPUID 00000003: 00000000-00000000-00000000-00000000
CPUID 00000004: 1C004121-01C0003F-0000003F-00000000
CPUID 00000004: 1C004122-00C0003F-0000007F-00000000
CPUID 00000004: 1C004143-01C0003F-000001FF-00000000
CPUID 00000004: 1C03C163-03C0003F-00001FFF-00000002
CPUID 00000005: 00000040-00000040-00000003-00021120
CPUID 00000006: 00000003-00000002-00000001-00000000
CPUID 00000007: 00000000-00000000-00000000-00000000
CPUID 00000008: 00000000-00000000-00000000-00000000
CPUID 00000009: 00000000-00000000-00000000-00000000
CPUID 0000000A: 07300403-00000000-00000000-00000603
CPUID 0000000B: 00000001-00000002-00000100-00000000
CPUID 0000000B: 00000004-00000008-00000201-00000000
CPUID 80000000: 80000008-00000000-00000000-00000000
CPUID 80000001: 00000000-00000000-00000001-28100000
CPUID 80000002: 756E6547-20656E69-65746E49-2952286C
CPUID 80000003: 55504320-20202020-20202020-40202020
CPUID 80000004: 30303020-20402030-37362E32-007A4847
CPUID 80000005: 00000000-00000000-00000000-00000000
CPUID 80000006: 00000000-00000000-01006040-00000000
CPUID 80000007: 00000000-00000000-00000000-00000100
CPUID 80000008: 00003028-00000000-00000000-00000000

L1    Data Cache:     32 KB,  8-way Associative, 64-byte Line
L1  Instr. Cache:     32 KB,  4-way Associative, 64-byte Line
L2 Unified Cache:    256 KB,  8-way Associative, 64-byte Line
L3 Unified Cache:   8192 KB, 16-way Associative, 64-byte Line

------[ Logical CPU #1 ]------

allcpu: Valid

CPUID 00000000: 0000000B-756E6547-6C65746E-49656E69
CPUID 00000001: 000106A2-02100800-00BCE3BD-BFEBFBFF
CPUID 00000002: 55035A01-00F0B2E4-00000000-09CA212C
CPUID 00000003: 00000000-00000000-00000000-00000000
CPUID 00000004: 1C004121-01C0003F-0000003F-00000000
CPUID 00000004: 1C004122-00C0003F-0000007F-00000000
CPUID 00000004: 1C004143-01C0003F-000001FF-00000000
CPUID 00000004: 1C03C163-03C0003F-00001FFF-00000002
CPUID 00000005: 00000040-00000040-00000003-00021120
CPUID 00000006: 00000003-00000002-00000001-00000000
CPUID 00000007: 00000000-00000000-00000000-00000000
CPUID 00000008: 00000000-00000000-00000000-00000000
CPUID 00000009: 00000000-00000000-00000000-00000000
CPUID 0000000A: 07300403-00000000-00000000-00000603
CPUID 0000000B: 00000001-00000002-00000100-00000002
CPUID 0000000B: 00000004-00000008-00000201-00000002
CPUID 80000000: 80000008-00000000-00000000-00000000
CPUID 80000001: 00000000-00000000-00000001-28100000
CPUID 80000002: 756E6547-20656E69-65746E49-2952286C
CPUID 80000003: 55504320-20202020-20202020-40202020
CPUID 80000004: 30303020-20402030-37362E32-007A4847
CPUID 80000005: 00000000-00000000-00000000-00000000
CPUID 80000006: 00000000-00000000-01006040-00000000
CPUID 80000007: 00000000-00000000-00000000-00000100
CPUID 80000008: 00003028-00000000-00000000-00000000

L1    Data Cache:     32 KB,  8-way Associative, 64-byte Line
L1  Instr. Cache:     32 KB,  4-way Associative, 64-byte Line
L2 Unified Cache:    256 KB,  8-way Associative, 64-byte Line
L3 Unified Cache:   8192 KB, 16-way Associative, 64-byte Line

------[ Logical CPU #2 ]------

allcpu: Valid

CPUID 00000000: 0000000B-756E6547-6C65746E-49656E69
CPUID 00000001: 000106A2-04100800-00BCE3BD-BFEBFBFF
CPUID 00000002: 55035A01-00F0B2E4-00000000-09CA212C
CPUID 00000003: 00000000-00000000-00000000-00000000
CPUID 00000004: 1C004121-01C0003F-0000003F-00000000
CPUID 00000004: 1C004122-00C0003F-0000007F-00000000
CPUID 00000004: 1C004143-01C0003F-000001FF-00000000
CPUID 00000004: 1C03C163-03C0003F-00001FFF-00000002
CPUID 00000005: 00000040-00000040-00000003-00021120
CPUID 00000006: 00000003-00000002-00000001-00000000
CPUID 00000007: 00000000-00000000-00000000-00000000
CPUID 00000008: 00000000-00000000-00000000-00000000
CPUID 00000009: 00000000-00000000-00000000-00000000
CPUID 0000000A: 07300403-00000000-00000000-00000603
CPUID 0000000B: 00000001-00000002-00000100-00000004
CPUID 0000000B: 00000004-00000008-00000201-00000004
CPUID 80000000: 80000008-00000000-00000000-00000000
CPUID 80000001: 00000000-00000000-00000001-28100000
CPUID 80000002: 756E6547-20656E69-65746E49-2952286C
CPUID 80000003: 55504320-20202020-20202020-40202020
CPUID 80000004: 30303020-20402030-37362E32-007A4847
CPUID 80000005: 00000000-00000000-00000000-00000000
CPUID 80000006: 00000000-00000000-01006040-00000000
CPUID 80000007: 00000000-00000000-00000000-00000100
CPUID 80000008: 00003028-00000000-00000000-00000000

L1    Data Cache:     32 KB,  8-way Associative, 64-byte Line
L1  Instr. Cache:     32 KB,  4-way Associative, 64-byte Line
L2 Unified Cache:    256 KB,  8-way Associative, 64-byte Line
L3 Unified Cache:   8192 KB, 16-way Associative, 64-byte Line

------[ Logical CPU #3 ]------

allcpu: Valid

CPUID 00000000: 0000000B-756E6547-6C65746E-49656E69
CPUID 00000001: 000106A2-06100800-00BCE3BD-BFEBFBFF
CPUID 00000002: 55035A01-00F0B2E4-00000000-09CA212C
CPUID 00000003: 00000000-00000000-00000000-00000000
CPUID 00000004: 1C004121-01C0003F-0000003F-00000000
CPUID 00000004: 1C004122-00C0003F-0000007F-00000000
CPUID 00000004: 1C004143-01C0003F-000001FF-00000000
CPUID 00000004: 1C03C163-03C0003F-00001FFF-00000002
CPUID 00000005: 00000040-00000040-00000003-00021120
CPUID 00000006: 00000003-00000002-00000001-00000000
CPUID 00000007: 00000000-00000000-00000000-00000000
CPUID 00000008: 00000000-00000000-00000000-00000000
CPUID 00000009: 00000000-00000000-00000000-00000000
CPUID 0000000A: 07300403-00000000-00000000-00000603
CPUID 0000000B: 00000001-00000002-00000100-00000006
CPUID 0000000B: 00000004-00000008-00000201-00000006
CPUID 80000000: 80000008-00000000-00000000-00000000
CPUID 80000001: 00000000-00000000-00000001-28100000
CPUID 80000002: 756E6547-20656E69-65746E49-2952286C
CPUID 80000003: 55504320-20202020-20202020-40202020
CPUID 80000004: 30303020-20402030-37362E32-007A4847
CPUID 80000005: 00000000-00000000-00000000-00000000
CPUID 80000006: 00000000-00000000-01006040-00000000
CPUID 80000007: 00000000-00000000-00000000-00000100
CPUID 80000008: 00003028-00000000-00000000-00000000

L1    Data Cache:     32 KB,  8-way Associative, 64-byte Line
L1  Instr. Cache:     32 KB,  4-way Associative, 64-byte Line
L2 Unified Cache:    256 KB,  8-way Associative, 64-byte Line
L3 Unified Cache:   8192 KB, 16-way Associative, 64-byte Line

------[ Logical CPU #4 ]------

allcpu: Valid, Virtual

CPUID 00000000: 0000000B-756E6547-6C65746E-49656E69
CPUID 00000001: 000106A2-01100800-00BCE3BD-BFEBFBFF
CPUID 00000002: 55035A01-00F0B2E4-00000000-09CA212C
CPUID 00000003: 00000000-00000000-00000000-00000000
CPUID 00000004: 1C004121-01C0003F-0000003F-00000000
CPUID 00000004: 1C004122-00C0003F-0000007F-00000000
CPUID 00000004: 1C004143-01C0003F-000001FF-00000000
CPUID 00000004: 1C03C163-03C0003F-00001FFF-00000002
CPUID 00000005: 00000040-00000040-00000003-00021120
CPUID 00000006: 00000003-00000002-00000001-00000000
CPUID 00000007: 00000000-00000000-00000000-00000000
CPUID 00000008: 00000000-00000000-00000000-00000000
CPUID 00000009: 00000000-00000000-00000000-00000000
CPUID 0000000A: 07300403-00000000-00000000-00000603
CPUID 0000000B: 00000001-00000002-00000100-00000001
CPUID 0000000B: 00000004-00000008-00000201-00000001
CPUID 80000000: 80000008-00000000-00000000-00000000
CPUID 80000001: 00000000-00000000-00000001-28100000
CPUID 80000002: 756E6547-20656E69-65746E49-2952286C
CPUID 80000003: 55504320-20202020-20202020-40202020
CPUID 80000004: 30303020-20402030-37362E32-007A4847
CPUID 80000005: 00000000-00000000-00000000-00000000
CPUID 80000006: 00000000-00000000-01006040-00000000
CPUID 80000007: 00000000-00000000-00000000-00000100
CPUID 80000008: 00003028-00000000-00000000-00000000

L1    Data Cache:     32 KB,  8-way Associative, 64-byte Line
L1  Instr. Cache:     32 KB,  4-way Associative, 64-byte Line
L2 Unified Cache:    256 KB,  8-way Associative, 64-byte Line
L3 Unified Cache:   8192 KB, 16-way Associative, 64-byte Line

------[ Logical CPU #5 ]------

allcpu: Valid, Virtual

CPUID 00000000: 0000000B-756E6547-6C65746E-49656E69
CPUID 00000001: 000106A2-03100800-00BCE3BD-BFEBFBFF
CPUID 00000002: 55035A01-00F0B2E4-00000000-09CA212C
CPUID 00000003: 00000000-00000000-00000000-00000000
CPUID 00000004: 1C004121-01C0003F-0000003F-00000000
CPUID 00000004: 1C004122-00C0003F-0000007F-00000000
CPUID 00000004: 1C004143-01C0003F-000001FF-00000000
CPUID 00000004: 1C03C163-03C0003F-00001FFF-00000002
CPUID 00000005: 00000040-00000040-00000003-00021120
CPUID 00000006: 00000003-00000002-00000001-00000000
CPUID 00000007: 00000000-00000000-00000000-00000000
CPUID 00000008: 00000000-00000000-00000000-00000000
CPUID 00000009: 00000000-00000000-00000000-00000000
CPUID 0000000A: 07300403-00000000-00000000-00000603
CPUID 0000000B: 00000001-00000002-00000100-00000003
CPUID 0000000B: 00000004-00000008-00000201-00000003
CPUID 80000000: 80000008-00000000-00000000-00000000
CPUID 80000001: 00000000-00000000-00000001-28100000
CPUID 80000002: 756E6547-20656E69-65746E49-2952286C
CPUID 80000003: 55504320-20202020-20202020-40202020
CPUID 80000004: 30303020-20402030-37362E32-007A4847
CPUID 80000005: 00000000-00000000-00000000-00000000
CPUID 80000006: 00000000-00000000-01006040-00000000
CPUID 80000007: 00000000-00000000-00000000-00000100
CPUID 80000008: 00003028-00000000-00000000-00000000

L1    Data Cache:     32 KB,  8-way Associative, 64-byte Line
L1  Instr. Cache:     32 KB,  4-way Associative, 64-byte Line
L2 Unified Cache:    256 KB,  8-way Associative, 64-byte Line
L3 Unified Cache:   8192 KB, 16-way Associative, 64-byte Line

------[ Logical CPU #6 ]------

allcpu: Valid, Virtual

CPUID 00000000: 0000000B-756E6547-6C65746E-49656E69
CPUID 00000001: 000106A2-05100800-00BCE3BD-BFEBFBFF
CPUID 00000002: 55035A01-00F0B2E4-00000000-09CA212C
CPUID 00000003: 00000000-00000000-00000000-00000000
CPUID 00000004: 1C004121-01C0003F-0000003F-00000000
CPUID 00000004: 1C004122-00C0003F-0000007F-00000000
CPUID 00000004: 1C004143-01C0003F-000001FF-00000000
CPUID 00000004: 1C03C163-03C0003F-00001FFF-00000002
CPUID 00000005: 00000040-00000040-00000003-00021120
CPUID 00000006: 00000003-00000002-00000001-00000000
CPUID 00000007: 00000000-00000000-00000000-00000000
CPUID 00000008: 00000000-00000000-00000000-00000000
CPUID 00000009: 00000000-00000000-00000000-00000000
CPUID 0000000A: 07300403-00000000-00000000-00000603
CPUID 0000000B: 00000001-00000002-00000100-00000005
CPUID 0000000B: 00000004-00000008-00000201-00000005
CPUID 80000000: 80000008-00000000-00000000-00000000
CPUID 80000001: 00000000-00000000-00000001-28100000
CPUID 80000002: 756E6547-20656E69-65746E49-2952286C
CPUID 80000003: 55504320-20202020-20202020-40202020
CPUID 80000004: 30303020-20402030-37362E32-007A4847
CPUID 80000005: 00000000-00000000-00000000-00000000
CPUID 80000006: 00000000-00000000-01006040-00000000
CPUID 80000007: 00000000-00000000-00000000-00000100
CPUID 80000008: 00003028-00000000-00000000-00000000

L1    Data Cache:     32 KB,  8-way Associative, 64-byte Line
L1  Instr. Cache:     32 KB,  4-way Associative, 64-byte Line
L2 Unified Cache:    256 KB,  8-way Associative, 64-byte Line
L3 Unified Cache:   8192 KB, 16-way Associative, 64-byte Line

------[ Logical CPU #7 ]------

allcpu: Valid, Virtual

CPUID 00000000: 0000000B-756E6547-6C65746E-49656E69
CPUID 00000001: 000106A2-07100800-00BCE3BD-BFEBFBFF
CPUID 00000002: 55035A01-00F0B2E4-00000000-09CA212C
CPUID 00000003: 00000000-00000000-00000000-00000000
CPUID 00000004: 1C004121-01C0003F-0000003F-00000000
CPUID 00000004: 1C004122-00C0003F-0000007F-00000000
CPUID 00000004: 1C004143-01C0003F-000001FF-00000000
CPUID 00000004: 1C03C163-03C0003F-00001FFF-00000002
CPUID 00000005: 00000040-00000040-00000003-00021120
CPUID 00000006: 00000003-00000002-00000001-00000000
CPUID 00000007: 00000000-00000000-00000000-00000000
CPUID 00000008: 00000000-00000000-00000000-00000000
CPUID 00000009: 00000000-00000000-00000000-00000000
CPUID 0000000A: 07300403-00000000-00000000-00000603
CPUID 0000000B: 00000001-00000002-00000100-00000007
CPUID 0000000B: 00000004-00000008-00000201-00000007
CPUID 80000000: 80000008-00000000-00000000-00000000
CPUID 80000001: 00000000-00000000-00000001-28100000
CPUID 80000002: 756E6547-20656E69-65746E49-2952286C
CPUID 80000003: 55504320-20202020-20202020-40202020
CPUID 80000004: 30303020-20402030-37362E32-007A4847
CPUID 80000005: 00000000-00000000-00000000-00000000
CPUID 80000006: 00000000-00000000-01006040-00000000
CPUID 80000007: 00000000-00000000-00000000-00000100
CPUID 80000008: 00003028-00000000-00000000-00000000

L1    Data Cache:     32 KB,  8-way Associative, 64-byte Line
L1  Instr. Cache:     32 KB,  4-way Associative, 64-byte Line
L2 Unified Cache:    256 KB,  8-way Associative, 64-byte Line
L3 Unified Cache:   8192 KB, 16-way Associative, 64-byte Line

------[ MSR Registers ]------

MSR 00000017: 0000-0000-0000-0000 [PlatID = 0]
MSR 0000001B: 0000-0000-FEE0-0900
MSR 00000035: 0000-0000-0004-0008
MSR 0000008B: FFFF-0019-0000-0000
MSR 000000CE: 0000-0C00-0C00-1400
MSR 000000E7: 0000-0000-12B4-A9C8
MSR 000000E8: 0000-0000-12B4-C5B5
MSR 00000194: 0000-0000-0000-0000
MSR 00000198: 0000-0000-0000-0014
MSR 00000199: 0000-0000-0000-0015
MSR 0000019A: 0000-0000-0000-0000
MSR 0000019B: 0000-0000-0000-0000
MSR 0000019C: 0000-0000-882E-0000
MSR 0000019D: 0000-0000-0000-0000
MSR 000001A0: 0000-0000-0085-0089
MSR 000001A2: 0000-0000-0061-1C00
MSR 000001A4: 0000-0000-0000-07C0
MSR 000001AA: 0000-0000-0040-0000
MSR 000001AC: 0000-0000-02A8-02F8
MSR 000001FC: 0000-0000-0000-0001
MSR 00000300: 0000-0000-E000-0001

PerformanceFrequency = 2672790000

Tjmax Temperature = 97 Celsius
