------[ Versions ]------

Program Version : EVEREST v4.60.1628 Beta
BenchDLL Version: 2.4.257.0

------[ CPU Info ]------

CPU Type           : Mobile DualCore Intel Core 2 Duo T5600, 1833 MHz (11 x 167)
CPU Alias          : Merom-2M
CPU Platform       : Socket 479
CPU Stepping       : B2
Instruction Set    : x86, x86-64, MMX, SSE, SSE2, SSE3, SSSE3
CPUID Manufacturer : GenuineIntel
CPUID CPU Name     : Intel(R) Core(TM)2 CPU T5600 @ 1.83GHz
CPUID Revision     : 000006F6h
IA Brand ID        : 00h  (Unknown)
Platform ID        : 20h  (Socket 479)

------[ Logical CPU #0 ]------

allcpu: Valid

CPUID 00000000: 0000000A-756E6547-6C65746E-49656E69
CPUID 00000001: 000006F6-00020800-0000E3BD-BFEBFBFF
CPUID 00000002: 05B0B101-005657F0-00000000-2CB4307D
CPUID 00000003: 00000000-00000000-00000000-00000000
CPUID 00000004: 04000121-01C0003F-0000003F-00000001
CPUID 00000004: 04000122-01C0003F-0000003F-00000001
CPUID 00000004: 04004143-01C0003F-00000FFF-00000001
CPUID 00000005: 00000040-00000040-00000003-00022220
CPUID 00000006: 00000001-00000002-00000001-00000000
CPUID 00000007: 00000000-00000000-00000000-00000000
CPUID 00000008: 00000400-00000000-00000000-00000000
CPUID 00000009: 00000000-00000000-00000000-00000000
CPUID 0000000A: 07280202-00000000-00000000-00000000
CPUID 80000000: 80000008-00000000-00000000-00000000
CPUID 80000001: 00000000-00000000-00000001-20100000
CPUID 80000002: 65746E49-2952286C-726F4320-4D542865
CPUID 80000003: 43203229-20205550-20202020-54202020
CPUID 80000004: 30303635-20402020-33382E31-007A4847
CPUID 80000005: 00000000-00000000-00000000-00000000
CPUID 80000006: 00000000-00000000-08006040-00000000
CPUID 80000007: 00000000-00000000-00000000-00000000
CPUID 80000008: 00003024-00000000-00000000-00000000

L1    Data Cache:     32 KB,  8-way Associative, 64-byte Line
L1  Instr. Cache:     32 KB,  8-way Associative, 64-byte Line
L2 Unified Cache:   2048 KB,  8-way Associative, 64-byte Line

------[ Logical CPU #1 ]------

allcpu: Valid

CPUID 00000000: 0000000A-756E6547-6C65746E-49656E69
CPUID 00000001: 000006F6-01020800-0000E3BD-BFEBFBFF
CPUID 00000002: 05B0B101-005657F0-00000000-2CB4307D
CPUID 00000003: 00000000-00000000-00000000-00000000
CPUID 00000004: 04000121-01C0003F-0000003F-00000001
CPUID 00000004: 04000122-01C0003F-0000003F-00000001
CPUID 00000004: 04004143-01C0003F-00000FFF-00000001
CPUID 00000005: 00000040-00000040-00000003-00022220
CPUID 00000006: 00000001-00000002-00000001-00000000
CPUID 00000007: 00000000-00000000-00000000-00000000
CPUID 00000008: 00000400-00000000-00000000-00000000
CPUID 00000009: 00000000-00000000-00000000-00000000
CPUID 0000000A: 07280202-00000000-00000000-00000000
CPUID 80000000: 80000008-00000000-00000000-00000000
CPUID 80000001: 00000000-00000000-00000001-20100000
CPUID 80000002: 65746E49-2952286C-726F4320-4D542865
CPUID 80000003: 43203229-20205550-20202020-54202020
CPUID 80000004: 30303635-20402020-33382E31-007A4847
CPUID 80000005: 00000000-00000000-00000000-00000000
CPUID 80000006: 00000000-00000000-08006040-00000000
CPUID 80000007: 00000000-00000000-00000000-00000000
CPUID 80000008: 00003024-00000000-00000000-00000000

L1    Data Cache:     32 KB,  8-way Associative, 64-byte Line
L1  Instr. Cache:     32 KB,  8-way Associative, 64-byte Line
L2 Unified Cache:   2048 KB,  8-way Associative, 64-byte Line

------[ MSR Registers ]------

MSR 00000017: 0014-0000-9A54-8B28 [PlatID = 5]
MSR 0000001B: 0000-0000-FEE0-0900
MSR 0000002A: 0000-0000-4188-0000
MSR 0000008B: 0000-00C7-0000-0000
MSR 000000CD: 0000-0000-0000-0933
MSR 000000CE: 0013-0B28-3B53-0613
MSR 000000E7: 0000-0074-5E74-792E
MSR 000000E8: 0000-006D-E57E-7D78
MSR 000000EE: 0000-0000-80B9-0400
MSR 0000011E: 0000-0000-7470-2107
MSR 00000198: 0613-0B28-0600-0613
MSR 00000199: 0000-0000-0000-0613
MSR 0000019A: 0000-0000-0000-0002
MSR 0000019B: 0000-0000-00D0-8A00
MSR 0000019C: 0000-0000-8836-0100
MSR 0000019D: 0000-0000-0000-0613
MSR 000001A0: 0000-0043-6497-2489

PerformanceFrequency = 3579545

Tjmax Temperature = 100 Celsius
