------[ Versions ]------

Program Version : AIDA64 Engineer v7.50.7210 Beta
LLKD Version    : 2
BenchDLL Version: 4.7.912.8-x64
Windows Version : Microsoft Windows 11 Pro 10.0.26100.2605 (64-bit)
GetProductInfo  : 0x00000030

------[ CPU Info ]------

CPU Type          : 2C+8c Intel Core i3-1220P, 3800 MHz (38 x 100)
CPU Alias         : Alder Lake-P
CPU Platform      : BGA1744
CPU Stepping      : R0
Instruction Set   : x86, x86-64, MMX, SSE, SSE2, SSE3, SSSE3, SSE4.1, SSE4.2, AVX, AVX2, FMA, AES, SHA
CPUID Manufacturer: GenuineIntel
CPUID CPU Name    : 12th Gen Intel(R) Core(TM) i3-1220P
CPUID Revision    : 000906A4h
IA Brand ID       : 00h  (Unknown)
Platform ID       : 39h  (BGA1744)
HTT / CMP Units   : 2 / 10
Max. NUMA Node    : 0

Tjmax Temperature          : 100 Celsius
HTC Temperature Limit      : 0 Celsius
CPU TDP                    : 28 W
CPU TDC                    : 80 A
CPU Max Power Limit        : Unlimited Power / Unlimited Time
CPU Power Limit 1 (Long)   : 20 W / 28.00 sec  (Unlocked)
CPU Power Limit 2 (Short)  : 39 W / 2.44 ms  (Unlocked)
Max Turbo Boost Multipliers: 1C: 44x, 2C: 38x, 3C: 38x, 4C: 38x, 5C: 38x, 6C: 38x, 7C: 38x, 8C: 38x

------[ Motherboard Info ]------

Motherboard ID      : <DMI>
Motherboard Model   : Intel Wallstreet Canyon NUC12WSBi3
Motherboard Chipset : Intel Alder Point-P, Intel Alder Lake-P

DMI MB Manufacturer : Intel Corporation
DMI MB Product      : NUC12WSBi3
DMI MB Version      : M36953-300
DMI MB Serial       : BTWS203002J5
DMI SYS Manufacturer: Intel(R) Client Systems
DMI SYS Product     : NUC12WSHi3
DMI SYS Version     : M46710-300
DMI SYS Serial      : BTWS203002J5
DMI BIOS Version    : WSADL357.0088.2023.0505.1623


------[ CPUID Registers / Logical CPU #0 ]------

allcpu: Package 0 / Core 0 / Thread 0: Valid, Intel Core

CPUID 00000000: 00000020-756E6547-6C65746E-49656E69 [GenuineIntel]
CPUID 00000001: 000906A4-00400800-7FFAFBBF-BFEBFBFF
CPUID 00000002: 00FEFF01-000000F0-00000000-00000000
CPUID 00000003: 00000000-00000000-00000000-00000000
CPUID 00000004: 7C004121-02C0003F-0000003F-00000000 [SL 00] [L1D: 48 KB]
CPUID 00000004: 7C004122-01C0003F-0000003F-00000000 [SL 01] [L1I: 32 KB]
CPUID 00000004: 7C01C143-0240003F-000007FF-00000000 [SL 02] [L2U: 1280 KB]
CPUID 00000004: 7C0FC163-02C0003F-00003FFF-00000004 [SL 03] [L3U: 12 MB]
CPUID 00000005: 00000040-00000040-00000003-10102020
CPUID 00000006: 00DF8FF7-00000002-00000409-00000003
CPUID 00000007: 00000002-239C27EB-984007AC-FC18C410 [SL 00]
CPUID 00000007: 00400810-00000000-00000000-00000000 [SL 01]
CPUID 00000007: 00000000-00000000-00000000-00000017 [SL 02]
CPUID 00000008: 00000000-00000000-00000000-00000000
CPUID 00000009: 00000000-00000000-00000000-00000000
CPUID 0000000A: 07300605-00000000-00000007-00008603
CPUID 0000000B: 00000001-00000002-00000100-00000000 [SL 00]
CPUID 0000000B: 00000006-0000000C-00000201-00000000 [SL 01]
CPUID 0000000C: 00000000-00000000-00000000-00000000
CPUID 0000000D: 00000207-00000340-00000A88-00000000 [SL 00] [x87]
CPUID 0000000D: 0000000F-000003D0-00019900-00000000 [SL 01] [SSE]
CPUID 0000000D: 00000100-00000240-00000000-00000000 [SL 02] [AVX]
CPUID 0000000D: 00000080-00000000-00000001-00000000 [SL 08] [PT]
CPUID 0000000D: 00000008-00000A80-00000000-00000000 [SL 09] [PKRU]
CPUID 0000000D: 00000010-00000000-00000001-00000000 [SL 0B] [CET_U]
CPUID 0000000D: 00000018-00000000-00000001-00000000 [SL 0C] [CET_S]
CPUID 0000000D: 00000328-00000000-00000001-00000000 [SL 0F] [LBR]
CPUID 0000000D: 00000008-00000000-00000001-00000000 [SL 10] [HWP]
CPUID 0000000E: 00000000-00000000-00000000-00000000
CPUID 0000000F: 00000000-00000000-00000000-00000000 [SL 00]
CPUID 0000000F: 00000000-00000000-00000000-00000000 [SL 01]
CPUID 00000010: 00000000-00000000-00000000-00000000 [SL 00]
CPUID 00000010: 00000000-00000000-00000000-00000000 [SL 01]
CPUID 00000011: 00000000-00000000-00000000-00000000
CPUID 00000012: 00000000-00000000-00000000-00000000 [SL 00]
CPUID 00000012: 00000000-00000000-00000000-00000000 [SL 01]
CPUID 00000013: 00000000-00000000-00000000-00000000
CPUID 00000014: 00000001-0000005F-00000007-00000000 [SL 00]
CPUID 00000014: 02490002-003F003F-00000000-00000000 [SL 01]
CPUID 00000015: 00000002-00000034-0249F000-00000000 [26.00x / 38400000 / 998.40]
CPUID 00000016: 000003E8-00001130-00000064-00000000 [1000 / 4400 / 100]
CPUID 00000017: 00000000-00000000-00000000-00000000 [SL 00]
CPUID 00000018: 00000008-00000000-00000000-00000000 [SL 00]
CPUID 00000018: 00000000-00080001-00000020-00004022 [SL 01]
CPUID 00000018: 00000000-00080006-00000004-00004022 [SL 02]
CPUID 00000018: 00000000-0010000F-00000001-00004125 [SL 03]
CPUID 00000018: 00000000-00040001-00000010-00004024 [SL 04]
CPUID 00000018: 00000000-00040006-00000008-00004024 [SL 05]
CPUID 00000018: 00000000-00080008-00000001-00004124 [SL 06]
CPUID 00000018: 00000000-00080007-00000080-00004043 [SL 07]
CPUID 00000018: 00000000-00080009-00000080-00004043 [SL 08]
CPUID 00000019: 00000000-00000000-00000000-00000000
CPUID 0000001A: 40000001-00000000-00000000-00000000 [Core: Golden Cove]
CPUID 0000001C: 4000000B-00000007-00000007-00000000
CPUID 0000001D: 00000000-00000000-00000000-00000000 [SL 00]
CPUID 0000001E: 00000000-00000000-00000000-00000000 [SL 00]
CPUID 0000001F: 00000001-00000002-00000100-00000000 [SL 00]
CPUID 0000001F: 00000006-0000000C-00000201-00000000 [SL 01]
CPUID 00000020: 00000000-00000001-00000000-00000000 [SL 00]
CPUID 80000000: 80000008-00000000-00000000-00000000
CPUID 80000001: 00000000-00000000-00000121-2C100000
CPUID 80000002: 68743231-6E654720-746E4920-52286C65 [12th Gen Intel(R]
CPUID 80000003: 6F432029-54286572-6920294D-32312D33 [) Core(TM) i3-12]
CPUID 80000004: 00503032-00000000-00000000-00000000 [20P]
CPUID 80000005: 00000000-00000000-00000000-00000000 [L1D: 0 KB / L1I: 0 KB]
CPUID 80000006: 00000000-00000000-05007040-00000000 [L2: 1280 KB / L3: 0 KB]
CPUID 80000007: 00000000-00000000-00000000-00000100
CPUID 80000008: 00003027-00000000-00000000-00000000

L1    Data Cache:    48 KB, 12-way Associative, 64-byte Line
L1  Instr. Cache:    32 KB,  8-way Associative, 64-byte Line
L2 Unified Cache:  1280 KB, 10-way Associative, 64-byte Line
L3 Unified Cache:    12 MB, 12-way Associative, 64-byte Line

------[ CPUID Registers / Logical CPU #1 ]------

allcpu: Package 0 / Core 0 / Thread 1: Valid, Virtual, Intel Core

CPUID 00000000: 00000020-756E6547-6C65746E-49656E69 [GenuineIntel]
CPUID 00000001: 000906A4-01400800-7FFAFBBF-BFEBFBFF
CPUID 00000002: 00FEFF01-000000F0-00000000-00000000
CPUID 00000003: 00000000-00000000-00000000-00000000
CPUID 00000004: 7C004121-02C0003F-0000003F-00000000 [SL 00] [L1D: 48 KB]
CPUID 00000004: 7C004122-01C0003F-0000003F-00000000 [SL 01] [L1I: 32 KB]
CPUID 00000004: 7C01C143-0240003F-000007FF-00000000 [SL 02] [L2U: 1280 KB]
CPUID 00000004: 7C0FC163-02C0003F-00003FFF-00000004 [SL 03] [L3U: 12 MB]
CPUID 00000005: 00000040-00000040-00000003-10102020
CPUID 00000006: 00DF8FF7-00000002-00000409-00000003
CPUID 00000007: 00000002-239C27EB-984007AC-FC18C410 [SL 00]
CPUID 00000007: 00400810-00000000-00000000-00000000 [SL 01]
CPUID 00000007: 00000000-00000000-00000000-00000017 [SL 02]
CPUID 00000008: 00000000-00000000-00000000-00000000
CPUID 00000009: 00000000-00000000-00000000-00000000
CPUID 0000000A: 07300605-00000000-00000007-00008603
CPUID 0000000B: 00000001-00000002-00000100-00000001 [SL 00]
CPUID 0000000B: 00000006-0000000C-00000201-00000001 [SL 01]
CPUID 0000000C: 00000000-00000000-00000000-00000000
CPUID 0000000D: 00000207-00000340-00000A88-00000000 [SL 00] [x87]
CPUID 0000000D: 0000000F-000003D0-00019900-00000000 [SL 01] [SSE]
CPUID 0000000D: 00000100-00000240-00000000-00000000 [SL 02] [AVX]
CPUID 0000000D: 00000080-00000000-00000001-00000000 [SL 08] [PT]
CPUID 0000000D: 00000008-00000A80-00000000-00000000 [SL 09] [PKRU]
CPUID 0000000D: 00000010-00000000-00000001-00000000 [SL 0B] [CET_U]
CPUID 0000000D: 00000018-00000000-00000001-00000000 [SL 0C] [CET_S]
CPUID 0000000D: 00000328-00000000-00000001-00000000 [SL 0F] [LBR]
CPUID 0000000D: 00000008-00000000-00000001-00000000 [SL 10] [HWP]
CPUID 0000000E: 00000000-00000000-00000000-00000000
CPUID 0000000F: 00000000-00000000-00000000-00000000 [SL 00]
CPUID 0000000F: 00000000-00000000-00000000-00000000 [SL 01]
CPUID 00000010: 00000000-00000000-00000000-00000000 [SL 00]
CPUID 00000010: 00000000-00000000-00000000-00000000 [SL 01]
CPUID 00000011: 00000000-00000000-00000000-00000000
CPUID 00000012: 00000000-00000000-00000000-00000000 [SL 00]
CPUID 00000012: 00000000-00000000-00000000-00000000 [SL 01]
CPUID 00000013: 00000000-00000000-00000000-00000000
CPUID 00000014: 00000001-0000005F-00000007-00000000 [SL 00]
CPUID 00000014: 02490002-003F003F-00000000-00000000 [SL 01]
CPUID 00000015: 00000002-00000034-0249F000-00000000 [26.00x / 38400000 / 998.40]
CPUID 00000016: 000003E8-00001130-00000064-00000000 [1000 / 4400 / 100]
CPUID 00000017: 00000000-00000000-00000000-00000000 [SL 00]
CPUID 00000018: 00000008-00000000-00000000-00000000 [SL 00]
CPUID 00000018: 00000000-00080001-00000020-00004022 [SL 01]
CPUID 00000018: 00000000-00080006-00000004-00004022 [SL 02]
CPUID 00000018: 00000000-0010000F-00000001-00004125 [SL 03]
CPUID 00000018: 00000000-00040001-00000010-00004024 [SL 04]
CPUID 00000018: 00000000-00040006-00000008-00004024 [SL 05]
CPUID 00000018: 00000000-00080008-00000001-00004124 [SL 06]
CPUID 00000018: 00000000-00080007-00000080-00004043 [SL 07]
CPUID 00000018: 00000000-00080009-00000080-00004043 [SL 08]
CPUID 00000019: 00000000-00000000-00000000-00000000
CPUID 0000001A: 40000001-00000000-00000000-00000000 [Core: Golden Cove]
CPUID 0000001C: 4000000B-00000007-00000007-00000000
CPUID 0000001D: 00000000-00000000-00000000-00000000 [SL 00]
CPUID 0000001E: 00000000-00000000-00000000-00000000 [SL 00]
CPUID 0000001F: 00000001-00000002-00000100-00000001 [SL 00]
CPUID 0000001F: 00000006-0000000C-00000201-00000001 [SL 01]
CPUID 00000020: 00000000-00000001-00000000-00000000 [SL 00]
CPUID 80000000: 80000008-00000000-00000000-00000000
CPUID 80000001: 00000000-00000000-00000121-2C100000
CPUID 80000002: 68743231-6E654720-746E4920-52286C65 [12th Gen Intel(R]
CPUID 80000003: 6F432029-54286572-6920294D-32312D33 [) Core(TM) i3-12]
CPUID 80000004: 00503032-00000000-00000000-00000000 [20P]
CPUID 80000005: 00000000-00000000-00000000-00000000 [L1D: 0 KB / L1I: 0 KB]
CPUID 80000006: 00000000-00000000-05007040-00000000 [L2: 1280 KB / L3: 0 KB]
CPUID 80000007: 00000000-00000000-00000000-00000100
CPUID 80000008: 00003027-00000000-00000000-00000000

L1    Data Cache:    48 KB, 12-way Associative, 64-byte Line
L1  Instr. Cache:    32 KB,  8-way Associative, 64-byte Line
L2 Unified Cache:  1280 KB, 10-way Associative, 64-byte Line
L3 Unified Cache:    12 MB, 12-way Associative, 64-byte Line

------[ CPUID Registers / Logical CPU #2 ]------

allcpu: Package 0 / Core 1 / Thread 0: Valid, Intel Core

CPUID 00000000: 00000020-756E6547-6C65746E-49656E69 [GenuineIntel]
CPUID 00000001: 000906A4-08400800-7FFAFBBF-BFEBFBFF
CPUID 00000002: 00FEFF01-000000F0-00000000-00000000
CPUID 00000003: 00000000-00000000-00000000-00000000
CPUID 00000004: 7C004121-02C0003F-0000003F-00000000 [SL 00] [L1D: 48 KB]
CPUID 00000004: 7C004122-01C0003F-0000003F-00000000 [SL 01] [L1I: 32 KB]
CPUID 00000004: 7C01C143-0240003F-000007FF-00000000 [SL 02] [L2U: 1280 KB]
CPUID 00000004: 7C0FC163-02C0003F-00003FFF-00000004 [SL 03] [L3U: 12 MB]
CPUID 00000005: 00000040-00000040-00000003-10102020
CPUID 00000006: 00DF8FF7-00000002-00000409-00010003
CPUID 00000007: 00000002-239C27EB-984007AC-FC18C410 [SL 00]
CPUID 00000007: 00400810-00000000-00000000-00000000 [SL 01]
CPUID 00000007: 00000000-00000000-00000000-00000017 [SL 02]
CPUID 00000008: 00000000-00000000-00000000-00000000
CPUID 00000009: 00000000-00000000-00000000-00000000
CPUID 0000000A: 07300605-00000000-00000007-00008603
CPUID 0000000B: 00000001-00000002-00000100-00000008 [SL 00]
CPUID 0000000B: 00000006-0000000C-00000201-00000008 [SL 01]
CPUID 0000000C: 00000000-00000000-00000000-00000000
CPUID 0000000D: 00000207-00000340-00000A88-00000000 [SL 00] [x87]
CPUID 0000000D: 0000000F-000003D0-00019900-00000000 [SL 01] [SSE]
CPUID 0000000D: 00000100-00000240-00000000-00000000 [SL 02] [AVX]
CPUID 0000000D: 00000080-00000000-00000001-00000000 [SL 08] [PT]
CPUID 0000000D: 00000008-00000A80-00000000-00000000 [SL 09] [PKRU]
CPUID 0000000D: 00000010-00000000-00000001-00000000 [SL 0B] [CET_U]
CPUID 0000000D: 00000018-00000000-00000001-00000000 [SL 0C] [CET_S]
CPUID 0000000D: 00000328-00000000-00000001-00000000 [SL 0F] [LBR]
CPUID 0000000D: 00000008-00000000-00000001-00000000 [SL 10] [HWP]
CPUID 0000000E: 00000000-00000000-00000000-00000000
CPUID 0000000F: 00000000-00000000-00000000-00000000 [SL 00]
CPUID 0000000F: 00000000-00000000-00000000-00000000 [SL 01]
CPUID 00000010: 00000000-00000000-00000000-00000000 [SL 00]
CPUID 00000010: 00000000-00000000-00000000-00000000 [SL 01]
CPUID 00000011: 00000000-00000000-00000000-00000000
CPUID 00000012: 00000000-00000000-00000000-00000000 [SL 00]
CPUID 00000012: 00000000-00000000-00000000-00000000 [SL 01]
CPUID 00000013: 00000000-00000000-00000000-00000000
CPUID 00000014: 00000001-0000005F-00000007-00000000 [SL 00]
CPUID 00000014: 02490002-003F003F-00000000-00000000 [SL 01]
CPUID 00000015: 00000002-00000034-0249F000-00000000 [26.00x / 38400000 / 998.40]
CPUID 00000016: 000003E8-00001130-00000064-00000000 [1000 / 4400 / 100]
CPUID 00000017: 00000000-00000000-00000000-00000000 [SL 00]
CPUID 00000018: 00000008-00000000-00000000-00000000 [SL 00]
CPUID 00000018: 00000000-00080001-00000020-00004022 [SL 01]
CPUID 00000018: 00000000-00080006-00000004-00004022 [SL 02]
CPUID 00000018: 00000000-0010000F-00000001-00004125 [SL 03]
CPUID 00000018: 00000000-00040001-00000010-00004024 [SL 04]
CPUID 00000018: 00000000-00040006-00000008-00004024 [SL 05]
CPUID 00000018: 00000000-00080008-00000001-00004124 [SL 06]
CPUID 00000018: 00000000-00080007-00000080-00004043 [SL 07]
CPUID 00000018: 00000000-00080009-00000080-00004043 [SL 08]
CPUID 00000019: 00000000-00000000-00000000-00000000
CPUID 0000001A: 40000001-00000000-00000000-00000000 [Core: Golden Cove]
CPUID 0000001C: 4000000B-00000007-00000007-00000000
CPUID 0000001D: 00000000-00000000-00000000-00000000 [SL 00]
CPUID 0000001E: 00000000-00000000-00000000-00000000 [SL 00]
CPUID 0000001F: 00000001-00000002-00000100-00000008 [SL 00]
CPUID 0000001F: 00000006-0000000C-00000201-00000008 [SL 01]
CPUID 00000020: 00000000-00000001-00000000-00000000 [SL 00]
CPUID 80000000: 80000008-00000000-00000000-00000000
CPUID 80000001: 00000000-00000000-00000121-2C100000
CPUID 80000002: 68743231-6E654720-746E4920-52286C65 [12th Gen Intel(R]
CPUID 80000003: 6F432029-54286572-6920294D-32312D33 [) Core(TM) i3-12]
CPUID 80000004: 00503032-00000000-00000000-00000000 [20P]
CPUID 80000005: 00000000-00000000-00000000-00000000 [L1D: 0 KB / L1I: 0 KB]
CPUID 80000006: 00000000-00000000-05007040-00000000 [L2: 1280 KB / L3: 0 KB]
CPUID 80000007: 00000000-00000000-00000000-00000100
CPUID 80000008: 00003027-00000000-00000000-00000000

L1    Data Cache:    48 KB, 12-way Associative, 64-byte Line
L1  Instr. Cache:    32 KB,  8-way Associative, 64-byte Line
L2 Unified Cache:  1280 KB, 10-way Associative, 64-byte Line
L3 Unified Cache:    12 MB, 12-way Associative, 64-byte Line

------[ CPUID Registers / Logical CPU #3 ]------

allcpu: Package 0 / Core 1 / Thread 1: Valid, Virtual, Intel Core

CPUID 00000000: 00000020-756E6547-6C65746E-49656E69 [GenuineIntel]
CPUID 00000001: 000906A4-09400800-7FFAFBBF-BFEBFBFF
CPUID 00000002: 00FEFF01-000000F0-00000000-00000000
CPUID 00000003: 00000000-00000000-00000000-00000000
CPUID 00000004: 7C004121-02C0003F-0000003F-00000000 [SL 00] [L1D: 48 KB]
CPUID 00000004: 7C004122-01C0003F-0000003F-00000000 [SL 01] [L1I: 32 KB]
CPUID 00000004: 7C01C143-0240003F-000007FF-00000000 [SL 02] [L2U: 1280 KB]
CPUID 00000004: 7C0FC163-02C0003F-00003FFF-00000004 [SL 03] [L3U: 12 MB]
CPUID 00000005: 00000040-00000040-00000003-10102020
CPUID 00000006: 00DF8FF7-00000002-00000409-00010003
CPUID 00000007: 00000002-239C27EB-984007AC-FC18C410 [SL 00]
CPUID 00000007: 00400810-00000000-00000000-00000000 [SL 01]
CPUID 00000007: 00000000-00000000-00000000-00000017 [SL 02]
CPUID 00000008: 00000000-00000000-00000000-00000000
CPUID 00000009: 00000000-00000000-00000000-00000000
CPUID 0000000A: 07300605-00000000-00000007-00008603
CPUID 0000000B: 00000001-00000002-00000100-00000009 [SL 00]
CPUID 0000000B: 00000006-0000000C-00000201-00000009 [SL 01]
CPUID 0000000C: 00000000-00000000-00000000-00000000
CPUID 0000000D: 00000207-00000340-00000A88-00000000 [SL 00] [x87]
CPUID 0000000D: 0000000F-000003D0-00019900-00000000 [SL 01] [SSE]
CPUID 0000000D: 00000100-00000240-00000000-00000000 [SL 02] [AVX]
CPUID 0000000D: 00000080-00000000-00000001-00000000 [SL 08] [PT]
CPUID 0000000D: 00000008-00000A80-00000000-00000000 [SL 09] [PKRU]
CPUID 0000000D: 00000010-00000000-00000001-00000000 [SL 0B] [CET_U]
CPUID 0000000D: 00000018-00000000-00000001-00000000 [SL 0C] [CET_S]
CPUID 0000000D: 00000328-00000000-00000001-00000000 [SL 0F] [LBR]
CPUID 0000000D: 00000008-00000000-00000001-00000000 [SL 10] [HWP]
CPUID 0000000E: 00000000-00000000-00000000-00000000
CPUID 0000000F: 00000000-00000000-00000000-00000000 [SL 00]
CPUID 0000000F: 00000000-00000000-00000000-00000000 [SL 01]
CPUID 00000010: 00000000-00000000-00000000-00000000 [SL 00]
CPUID 00000010: 00000000-00000000-00000000-00000000 [SL 01]
CPUID 00000011: 00000000-00000000-00000000-00000000
CPUID 00000012: 00000000-00000000-00000000-00000000 [SL 00]
CPUID 00000012: 00000000-00000000-00000000-00000000 [SL 01]
CPUID 00000013: 00000000-00000000-00000000-00000000
CPUID 00000014: 00000001-0000005F-00000007-00000000 [SL 00]
CPUID 00000014: 02490002-003F003F-00000000-00000000 [SL 01]
CPUID 00000015: 00000002-00000034-0249F000-00000000 [26.00x / 38400000 / 998.40]
CPUID 00000016: 000003E8-00001130-00000064-00000000 [1000 / 4400 / 100]
CPUID 00000017: 00000000-00000000-00000000-00000000 [SL 00]
CPUID 00000018: 00000008-00000000-00000000-00000000 [SL 00]
CPUID 00000018: 00000000-00080001-00000020-00004022 [SL 01]
CPUID 00000018: 00000000-00080006-00000004-00004022 [SL 02]
CPUID 00000018: 00000000-0010000F-00000001-00004125 [SL 03]
CPUID 00000018: 00000000-00040001-00000010-00004024 [SL 04]
CPUID 00000018: 00000000-00040006-00000008-00004024 [SL 05]
CPUID 00000018: 00000000-00080008-00000001-00004124 [SL 06]
CPUID 00000018: 00000000-00080007-00000080-00004043 [SL 07]
CPUID 00000018: 00000000-00080009-00000080-00004043 [SL 08]
CPUID 00000019: 00000000-00000000-00000000-00000000
CPUID 0000001A: 40000001-00000000-00000000-00000000 [Core: Golden Cove]
CPUID 0000001C: 4000000B-00000007-00000007-00000000
CPUID 0000001D: 00000000-00000000-00000000-00000000 [SL 00]
CPUID 0000001E: 00000000-00000000-00000000-00000000 [SL 00]
CPUID 0000001F: 00000001-00000002-00000100-00000009 [SL 00]
CPUID 0000001F: 00000006-0000000C-00000201-00000009 [SL 01]
CPUID 00000020: 00000000-00000001-00000000-00000000 [SL 00]
CPUID 80000000: 80000008-00000000-00000000-00000000
CPUID 80000001: 00000000-00000000-00000121-2C100000
CPUID 80000002: 68743231-6E654720-746E4920-52286C65 [12th Gen Intel(R]
CPUID 80000003: 6F432029-54286572-6920294D-32312D33 [) Core(TM) i3-12]
CPUID 80000004: 00503032-00000000-00000000-00000000 [20P]
CPUID 80000005: 00000000-00000000-00000000-00000000 [L1D: 0 KB / L1I: 0 KB]
CPUID 80000006: 00000000-00000000-05007040-00000000 [L2: 1280 KB / L3: 0 KB]
CPUID 80000007: 00000000-00000000-00000000-00000100
CPUID 80000008: 00003027-00000000-00000000-00000000

L1    Data Cache:    48 KB, 12-way Associative, 64-byte Line
L1  Instr. Cache:    32 KB,  8-way Associative, 64-byte Line
L2 Unified Cache:  1280 KB, 10-way Associative, 64-byte Line
L3 Unified Cache:    12 MB, 12-way Associative, 64-byte Line

------[ CPUID Registers / Logical CPU #4 ]------

allcpu: Package 0 / Core 2 / Thread 0: Valid, Intel Atom

CPUID 00000000: 00000020-756E6547-6C65746E-49656E69 [GenuineIntel]
CPUID 00000001: 000906A4-10400800-7FFAFBBF-BFEBFBFF
CPUID 00000002: 00FEFF01-00000000-00000000-00000000
CPUID 00000003: 00000000-00000000-00000000-00000000
CPUID 00000004: 7C004121-01C0003F-0000003F-00000000 [SL 00] [L1D: 32 KB]
CPUID 00000004: 7C004122-01C0003F-0000007F-00000000 [SL 01] [L1I: 64 KB]
CPUID 00000004: 7C01C143-03C0003F-000007FF-00000000 [SL 02] [L2U: 2 MB]
CPUID 00000004: 7C0FC163-02C0003F-00003FFF-00000004 [SL 03] [L3U: 12 MB]
CPUID 00000005: 00000040-00000040-00000003-10102020
CPUID 00000006: 00DF8FF7-00000002-00000409-00020003
CPUID 00000007: 00000002-239C27EB-984007AC-FC18C410 [SL 00]
CPUID 00000007: 00400810-00000000-00000000-00000000 [SL 01]
CPUID 00000007: 00000000-00000000-00000000-00000017 [SL 02]
CPUID 00000008: 00000000-00000000-00000000-00000000
CPUID 00000009: 00000000-00000000-00000000-00000000
CPUID 0000000A: 07300605-00000000-00000007-00008603
CPUID 0000000B: 00000001-00000001-00000100-00000010 [SL 00]
CPUID 0000000B: 00000006-0000000C-00000201-00000010 [SL 01]
CPUID 0000000C: 00000000-00000000-00000000-00000000
CPUID 0000000D: 00000207-00000340-00000A88-00000000 [SL 00] [x87]
CPUID 0000000D: 0000000F-000003D0-00019900-00000000 [SL 01] [SSE]
CPUID 0000000D: 00000100-00000240-00000000-00000000 [SL 02] [AVX]
CPUID 0000000D: 00000080-00000000-00000001-00000000 [SL 08] [PT]
CPUID 0000000D: 00000008-00000A80-00000000-00000000 [SL 09] [PKRU]
CPUID 0000000D: 00000010-00000000-00000001-00000000 [SL 0B] [CET_U]
CPUID 0000000D: 00000018-00000000-00000001-00000000 [SL 0C] [CET_S]
CPUID 0000000D: 00000328-00000000-00000001-00000000 [SL 0F] [LBR]
CPUID 0000000D: 00000008-00000000-00000001-00000000 [SL 10] [HWP]
CPUID 0000000E: 00000000-00000000-00000000-00000000
CPUID 0000000F: 00000000-00000000-00000000-00000000 [SL 00]
CPUID 0000000F: 00000000-00000000-00000000-00000000 [SL 01]
CPUID 00000010: 00000000-00000000-00000000-00000000 [SL 00]
CPUID 00000010: 00000000-00000000-00000000-00000000 [SL 01]
CPUID 00000011: 00000000-00000000-00000000-00000000
CPUID 00000012: 00000000-00000000-00000000-00000000 [SL 00]
CPUID 00000012: 00000000-00000000-00000000-00000000 [SL 01]
CPUID 00000013: 00000000-00000000-00000000-00000000
CPUID 00000014: 00000001-0000005F-80000007-00000000 [SL 00]
CPUID 00000014: 02490002-003F003F-00000000-00000000 [SL 01]
CPUID 00000015: 00000002-00000034-0249F000-00000000 [26.00x / 38400000 / 998.40]
CPUID 00000016: 000003E8-00000CE4-00000064-00000000 [1000 / 3300 / 100]
CPUID 00000017: 00000000-00000000-00000000-00000000 [SL 00]
CPUID 00000018: 00000004-00000000-00000000-00000000 [SL 00]
CPUID 00000018: 00000000-00300001-00000001-00000121 [SL 01]
CPUID 00000018: 00000000-00040003-00000200-00000043 [SL 02]
CPUID 00000018: 00000000-00400001-00000001-00000122 [SL 03]
CPUID 00000018: 00000000-00080008-00000001-00000143 [SL 04]
CPUID 00000019: 00000000-00000000-00000000-00000000
CPUID 0000001A: 20000001-00000000-00000000-00000000 [Atom: Gracemont]
CPUID 0000001C: C000000B-00000007-00000007-00000000
CPUID 0000001D: 00000000-00000000-00000000-00000000 [SL 00]
CPUID 0000001E: 00000000-00000000-00000000-00000000 [SL 00]
CPUID 0000001F: 00000001-00000001-00000100-00000010 [SL 00]
CPUID 0000001F: 00000006-0000000C-00000201-00000010 [SL 01]
CPUID 00000020: 00000000-00000001-00000000-00000000 [SL 00]
CPUID 80000000: 80000008-00000000-00000000-00000000
CPUID 80000001: 00000000-00000000-00000121-2C100000
CPUID 80000002: 68743231-6E654720-746E4920-52286C65 [12th Gen Intel(R]
CPUID 80000003: 6F432029-54286572-6920294D-32312D33 [) Core(TM) i3-12]
CPUID 80000004: 00503032-00000000-00000000-00000000 [20P]
CPUID 80000005: 00000000-00000000-00000000-00000000 [L1D: 0 KB / L1I: 0 KB]
CPUID 80000006: 00000000-00000000-08008040-00000000 [L2: 2048 KB / L3: 0 KB]
CPUID 80000007: 00000000-00000000-00000000-00000100
CPUID 80000008: 00003027-00000000-00000000-00000000

L1    Data Cache:    32 KB,  8-way Associative, 64-byte Line
L1  Instr. Cache:    64 KB,  8-way Associative, 64-byte Line
L2 Unified Cache:     2 MB, 16-way Associative, 64-byte Line
L3 Unified Cache:    12 MB, 12-way Associative, 64-byte Line

------[ CPUID Registers / Logical CPU #5 ]------

allcpu: Package 0 / Core 3 / Thread 0: Valid, Intel Atom

CPUID 00000000: 00000020-756E6547-6C65746E-49656E69 [GenuineIntel]
CPUID 00000001: 000906A4-12400800-7FFAFBBF-BFEBFBFF
CPUID 00000002: 00FEFF01-00000000-00000000-00000000
CPUID 00000003: 00000000-00000000-00000000-00000000
CPUID 00000004: 7C004121-01C0003F-0000003F-00000000 [SL 00] [L1D: 32 KB]
CPUID 00000004: 7C004122-01C0003F-0000007F-00000000 [SL 01] [L1I: 64 KB]
CPUID 00000004: 7C01C143-03C0003F-000007FF-00000000 [SL 02] [L2U: 2 MB]
CPUID 00000004: 7C0FC163-02C0003F-00003FFF-00000004 [SL 03] [L3U: 12 MB]
CPUID 00000005: 00000040-00000040-00000003-10102020
CPUID 00000006: 00DF8FF7-00000002-00000409-00020003
CPUID 00000007: 00000002-239C27EB-984007AC-FC18C410 [SL 00]
CPUID 00000007: 00400810-00000000-00000000-00000000 [SL 01]
CPUID 00000007: 00000000-00000000-00000000-00000017 [SL 02]
CPUID 00000008: 00000000-00000000-00000000-00000000
CPUID 00000009: 00000000-00000000-00000000-00000000
CPUID 0000000A: 07300605-00000000-00000007-00008603
CPUID 0000000B: 00000001-00000001-00000100-00000012 [SL 00]
CPUID 0000000B: 00000006-0000000C-00000201-00000012 [SL 01]
CPUID 0000000C: 00000000-00000000-00000000-00000000
CPUID 0000000D: 00000207-00000340-00000A88-00000000 [SL 00] [x87]
CPUID 0000000D: 0000000F-000003D0-00019900-00000000 [SL 01] [SSE]
CPUID 0000000D: 00000100-00000240-00000000-00000000 [SL 02] [AVX]
CPUID 0000000D: 00000080-00000000-00000001-00000000 [SL 08] [PT]
CPUID 0000000D: 00000008-00000A80-00000000-00000000 [SL 09] [PKRU]
CPUID 0000000D: 00000010-00000000-00000001-00000000 [SL 0B] [CET_U]
CPUID 0000000D: 00000018-00000000-00000001-00000000 [SL 0C] [CET_S]
CPUID 0000000D: 00000328-00000000-00000001-00000000 [SL 0F] [LBR]
CPUID 0000000D: 00000008-00000000-00000001-00000000 [SL 10] [HWP]
CPUID 0000000E: 00000000-00000000-00000000-00000000
CPUID 0000000F: 00000000-00000000-00000000-00000000 [SL 00]
CPUID 0000000F: 00000000-00000000-00000000-00000000 [SL 01]
CPUID 00000010: 00000000-00000000-00000000-00000000 [SL 00]
CPUID 00000010: 00000000-00000000-00000000-00000000 [SL 01]
CPUID 00000011: 00000000-00000000-00000000-00000000
CPUID 00000012: 00000000-00000000-00000000-00000000 [SL 00]
CPUID 00000012: 00000000-00000000-00000000-00000000 [SL 01]
CPUID 00000013: 00000000-00000000-00000000-00000000
CPUID 00000014: 00000001-0000005F-80000007-00000000 [SL 00]
CPUID 00000014: 02490002-003F003F-00000000-00000000 [SL 01]
CPUID 00000015: 00000002-00000034-0249F000-00000000 [26.00x / 38400000 / 998.40]
CPUID 00000016: 000003E8-00000CE4-00000064-00000000 [1000 / 3300 / 100]
CPUID 00000017: 00000000-00000000-00000000-00000000 [SL 00]
CPUID 00000018: 00000004-00000000-00000000-00000000 [SL 00]
CPUID 00000018: 00000000-00300001-00000001-00000121 [SL 01]
CPUID 00000018: 00000000-00040003-00000200-00000043 [SL 02]
CPUID 00000018: 00000000-00400001-00000001-00000122 [SL 03]
CPUID 00000018: 00000000-00080008-00000001-00000143 [SL 04]
CPUID 00000019: 00000000-00000000-00000000-00000000
CPUID 0000001A: 20000001-00000000-00000000-00000000 [Atom: Gracemont]
CPUID 0000001C: C000000B-00000007-00000007-00000000
CPUID 0000001D: 00000000-00000000-00000000-00000000 [SL 00]
CPUID 0000001E: 00000000-00000000-00000000-00000000 [SL 00]
CPUID 0000001F: 00000001-00000001-00000100-00000012 [SL 00]
CPUID 0000001F: 00000006-0000000C-00000201-00000012 [SL 01]
CPUID 00000020: 00000000-00000001-00000000-00000000 [SL 00]
CPUID 80000000: 80000008-00000000-00000000-00000000
CPUID 80000001: 00000000-00000000-00000121-2C100000
CPUID 80000002: 68743231-6E654720-746E4920-52286C65 [12th Gen Intel(R]
CPUID 80000003: 6F432029-54286572-6920294D-32312D33 [) Core(TM) i3-12]
CPUID 80000004: 00503032-00000000-00000000-00000000 [20P]
CPUID 80000005: 00000000-00000000-00000000-00000000 [L1D: 0 KB / L1I: 0 KB]
CPUID 80000006: 00000000-00000000-08008040-00000000 [L2: 2048 KB / L3: 0 KB]
CPUID 80000007: 00000000-00000000-00000000-00000100
CPUID 80000008: 00003027-00000000-00000000-00000000

L1    Data Cache:    32 KB,  8-way Associative, 64-byte Line
L1  Instr. Cache:    64 KB,  8-way Associative, 64-byte Line
L2 Unified Cache:     2 MB, 16-way Associative, 64-byte Line
L3 Unified Cache:    12 MB, 12-way Associative, 64-byte Line

------[ CPUID Registers / Logical CPU #6 ]------

allcpu: Package 0 / Core 4 / Thread 0: Valid, Intel Atom

CPUID 00000000: 00000020-756E6547-6C65746E-49656E69 [GenuineIntel]
CPUID 00000001: 000906A4-14400800-7FFAFBBF-BFEBFBFF
CPUID 00000002: 00FEFF01-00000000-00000000-00000000
CPUID 00000003: 00000000-00000000-00000000-00000000
CPUID 00000004: 7C004121-01C0003F-0000003F-00000000 [SL 00] [L1D: 32 KB]
CPUID 00000004: 7C004122-01C0003F-0000007F-00000000 [SL 01] [L1I: 64 KB]
CPUID 00000004: 7C01C143-03C0003F-000007FF-00000000 [SL 02] [L2U: 2 MB]
CPUID 00000004: 7C0FC163-02C0003F-00003FFF-00000004 [SL 03] [L3U: 12 MB]
CPUID 00000005: 00000040-00000040-00000003-10102020
CPUID 00000006: 00DF8FF7-00000002-00000409-00020003
CPUID 00000007: 00000002-239C27EB-984007AC-FC18C410 [SL 00]
CPUID 00000007: 00400810-00000000-00000000-00000000 [SL 01]
CPUID 00000007: 00000000-00000000-00000000-00000017 [SL 02]
CPUID 00000008: 00000000-00000000-00000000-00000000
CPUID 00000009: 00000000-00000000-00000000-00000000
CPUID 0000000A: 07300605-00000000-00000007-00008603
CPUID 0000000B: 00000001-00000001-00000100-00000014 [SL 00]
CPUID 0000000B: 00000006-0000000C-00000201-00000014 [SL 01]
CPUID 0000000C: 00000000-00000000-00000000-00000000
CPUID 0000000D: 00000207-00000340-00000A88-00000000 [SL 00] [x87]
CPUID 0000000D: 0000000F-000003D0-00019900-00000000 [SL 01] [SSE]
CPUID 0000000D: 00000100-00000240-00000000-00000000 [SL 02] [AVX]
CPUID 0000000D: 00000080-00000000-00000001-00000000 [SL 08] [PT]
CPUID 0000000D: 00000008-00000A80-00000000-00000000 [SL 09] [PKRU]
CPUID 0000000D: 00000010-00000000-00000001-00000000 [SL 0B] [CET_U]
CPUID 0000000D: 00000018-00000000-00000001-00000000 [SL 0C] [CET_S]
CPUID 0000000D: 00000328-00000000-00000001-00000000 [SL 0F] [LBR]
CPUID 0000000D: 00000008-00000000-00000001-00000000 [SL 10] [HWP]
CPUID 0000000E: 00000000-00000000-00000000-00000000
CPUID 0000000F: 00000000-00000000-00000000-00000000 [SL 00]
CPUID 0000000F: 00000000-00000000-00000000-00000000 [SL 01]
CPUID 00000010: 00000000-00000000-00000000-00000000 [SL 00]
CPUID 00000010: 00000000-00000000-00000000-00000000 [SL 01]
CPUID 00000011: 00000000-00000000-00000000-00000000
CPUID 00000012: 00000000-00000000-00000000-00000000 [SL 00]
CPUID 00000012: 00000000-00000000-00000000-00000000 [SL 01]
CPUID 00000013: 00000000-00000000-00000000-00000000
CPUID 00000014: 00000001-0000005F-80000007-00000000 [SL 00]
CPUID 00000014: 02490002-003F003F-00000000-00000000 [SL 01]
CPUID 00000015: 00000002-00000034-0249F000-00000000 [26.00x / 38400000 / 998.40]
CPUID 00000016: 000003E8-00000CE4-00000064-00000000 [1000 / 3300 / 100]
CPUID 00000017: 00000000-00000000-00000000-00000000 [SL 00]
CPUID 00000018: 00000004-00000000-00000000-00000000 [SL 00]
CPUID 00000018: 00000000-00300001-00000001-00000121 [SL 01]
CPUID 00000018: 00000000-00040003-00000200-00000043 [SL 02]
CPUID 00000018: 00000000-00400001-00000001-00000122 [SL 03]
CPUID 00000018: 00000000-00080008-00000001-00000143 [SL 04]
CPUID 00000019: 00000000-00000000-00000000-00000000
CPUID 0000001A: 20000001-00000000-00000000-00000000 [Atom: Gracemont]
CPUID 0000001C: C000000B-00000007-00000007-00000000
CPUID 0000001D: 00000000-00000000-00000000-00000000 [SL 00]
CPUID 0000001E: 00000000-00000000-00000000-00000000 [SL 00]
CPUID 0000001F: 00000001-00000001-00000100-00000014 [SL 00]
CPUID 0000001F: 00000006-0000000C-00000201-00000014 [SL 01]
CPUID 00000020: 00000000-00000001-00000000-00000000 [SL 00]
CPUID 80000000: 80000008-00000000-00000000-00000000
CPUID 80000001: 00000000-00000000-00000121-2C100000
CPUID 80000002: 68743231-6E654720-746E4920-52286C65 [12th Gen Intel(R]
CPUID 80000003: 6F432029-54286572-6920294D-32312D33 [) Core(TM) i3-12]
CPUID 80000004: 00503032-00000000-00000000-00000000 [20P]
CPUID 80000005: 00000000-00000000-00000000-00000000 [L1D: 0 KB / L1I: 0 KB]
CPUID 80000006: 00000000-00000000-08008040-00000000 [L2: 2048 KB / L3: 0 KB]
CPUID 80000007: 00000000-00000000-00000000-00000100
CPUID 80000008: 00003027-00000000-00000000-00000000

L1    Data Cache:    32 KB,  8-way Associative, 64-byte Line
L1  Instr. Cache:    64 KB,  8-way Associative, 64-byte Line
L2 Unified Cache:     2 MB, 16-way Associative, 64-byte Line
L3 Unified Cache:    12 MB, 12-way Associative, 64-byte Line

------[ CPUID Registers / Logical CPU #7 ]------

allcpu: Package 0 / Core 5 / Thread 0: Valid, Intel Atom

CPUID 00000000: 00000020-756E6547-6C65746E-49656E69 [GenuineIntel]
CPUID 00000001: 000906A4-16400800-7FFAFBBF-BFEBFBFF
CPUID 00000002: 00FEFF01-00000000-00000000-00000000
CPUID 00000003: 00000000-00000000-00000000-00000000
CPUID 00000004: 7C004121-01C0003F-0000003F-00000000 [SL 00] [L1D: 32 KB]
CPUID 00000004: 7C004122-01C0003F-0000007F-00000000 [SL 01] [L1I: 64 KB]
CPUID 00000004: 7C01C143-03C0003F-000007FF-00000000 [SL 02] [L2U: 2 MB]
CPUID 00000004: 7C0FC163-02C0003F-00003FFF-00000004 [SL 03] [L3U: 12 MB]
CPUID 00000005: 00000040-00000040-00000003-10102020
CPUID 00000006: 00DF8FF7-00000002-00000409-00020003
CPUID 00000007: 00000002-239C27EB-984007AC-FC18C410 [SL 00]
CPUID 00000007: 00400810-00000000-00000000-00000000 [SL 01]
CPUID 00000007: 00000000-00000000-00000000-00000017 [SL 02]
CPUID 00000008: 00000000-00000000-00000000-00000000
CPUID 00000009: 00000000-00000000-00000000-00000000
CPUID 0000000A: 07300605-00000000-00000007-00008603
CPUID 0000000B: 00000001-00000001-00000100-00000016 [SL 00]
CPUID 0000000B: 00000006-0000000C-00000201-00000016 [SL 01]
CPUID 0000000C: 00000000-00000000-00000000-00000000
CPUID 0000000D: 00000207-00000340-00000A88-00000000 [SL 00] [x87]
CPUID 0000000D: 0000000F-000003D0-00019900-00000000 [SL 01] [SSE]
CPUID 0000000D: 00000100-00000240-00000000-00000000 [SL 02] [AVX]
CPUID 0000000D: 00000080-00000000-00000001-00000000 [SL 08] [PT]
CPUID 0000000D: 00000008-00000A80-00000000-00000000 [SL 09] [PKRU]
CPUID 0000000D: 00000010-00000000-00000001-00000000 [SL 0B] [CET_U]
CPUID 0000000D: 00000018-00000000-00000001-00000000 [SL 0C] [CET_S]
CPUID 0000000D: 00000328-00000000-00000001-00000000 [SL 0F] [LBR]
CPUID 0000000D: 00000008-00000000-00000001-00000000 [SL 10] [HWP]
CPUID 0000000E: 00000000-00000000-00000000-00000000
CPUID 0000000F: 00000000-00000000-00000000-00000000 [SL 00]
CPUID 0000000F: 00000000-00000000-00000000-00000000 [SL 01]
CPUID 00000010: 00000000-00000000-00000000-00000000 [SL 00]
CPUID 00000010: 00000000-00000000-00000000-00000000 [SL 01]
CPUID 00000011: 00000000-00000000-00000000-00000000
CPUID 00000012: 00000000-00000000-00000000-00000000 [SL 00]
CPUID 00000012: 00000000-00000000-00000000-00000000 [SL 01]
CPUID 00000013: 00000000-00000000-00000000-00000000
CPUID 00000014: 00000001-0000005F-80000007-00000000 [SL 00]
CPUID 00000014: 02490002-003F003F-00000000-00000000 [SL 01]
CPUID 00000015: 00000002-00000034-0249F000-00000000 [26.00x / 38400000 / 998.40]
CPUID 00000016: 000003E8-00000CE4-00000064-00000000 [1000 / 3300 / 100]
CPUID 00000017: 00000000-00000000-00000000-00000000 [SL 00]
CPUID 00000018: 00000004-00000000-00000000-00000000 [SL 00]
CPUID 00000018: 00000000-00300001-00000001-00000121 [SL 01]
CPUID 00000018: 00000000-00040003-00000200-00000043 [SL 02]
CPUID 00000018: 00000000-00400001-00000001-00000122 [SL 03]
CPUID 00000018: 00000000-00080008-00000001-00000143 [SL 04]
CPUID 00000019: 00000000-00000000-00000000-00000000
CPUID 0000001A: 20000001-00000000-00000000-00000000 [Atom: Gracemont]
CPUID 0000001C: C000000B-00000007-00000007-00000000
CPUID 0000001D: 00000000-00000000-00000000-00000000 [SL 00]
CPUID 0000001E: 00000000-00000000-00000000-00000000 [SL 00]
CPUID 0000001F: 00000001-00000001-00000100-00000016 [SL 00]
CPUID 0000001F: 00000006-0000000C-00000201-00000016 [SL 01]
CPUID 00000020: 00000000-00000001-00000000-00000000 [SL 00]
CPUID 80000000: 80000008-00000000-00000000-00000000
CPUID 80000001: 00000000-00000000-00000121-2C100000
CPUID 80000002: 68743231-6E654720-746E4920-52286C65 [12th Gen Intel(R]
CPUID 80000003: 6F432029-54286572-6920294D-32312D33 [) Core(TM) i3-12]
CPUID 80000004: 00503032-00000000-00000000-00000000 [20P]
CPUID 80000005: 00000000-00000000-00000000-00000000 [L1D: 0 KB / L1I: 0 KB]
CPUID 80000006: 00000000-00000000-08008040-00000000 [L2: 2048 KB / L3: 0 KB]
CPUID 80000007: 00000000-00000000-00000000-00000100
CPUID 80000008: 00003027-00000000-00000000-00000000

L1    Data Cache:    32 KB,  8-way Associative, 64-byte Line
L1  Instr. Cache:    64 KB,  8-way Associative, 64-byte Line
L2 Unified Cache:     2 MB, 16-way Associative, 64-byte Line
L3 Unified Cache:    12 MB, 12-way Associative, 64-byte Line

------[ CPUID Registers / Logical CPU #8 ]------

allcpu: Package 0 / Core 6 / Thread 0: Valid, Intel Atom

CPUID 00000000: 00000020-756E6547-6C65746E-49656E69 [GenuineIntel]
CPUID 00000001: 000906A4-18400800-7FFAFBBF-BFEBFBFF
CPUID 00000002: 00FEFF01-00000000-00000000-00000000
CPUID 00000003: 00000000-00000000-00000000-00000000
CPUID 00000004: 7C004121-01C0003F-0000003F-00000000 [SL 00] [L1D: 32 KB]
CPUID 00000004: 7C004122-01C0003F-0000007F-00000000 [SL 01] [L1I: 64 KB]
CPUID 00000004: 7C01C143-03C0003F-000007FF-00000000 [SL 02] [L2U: 2 MB]
CPUID 00000004: 7C0FC163-02C0003F-00003FFF-00000004 [SL 03] [L3U: 12 MB]
CPUID 00000005: 00000040-00000040-00000003-10102020
CPUID 00000006: 00DF8FF7-00000002-00000409-00030003
CPUID 00000007: 00000002-239C27EB-984007AC-FC18C410 [SL 00]
CPUID 00000007: 00400810-00000000-00000000-00000000 [SL 01]
CPUID 00000007: 00000000-00000000-00000000-00000017 [SL 02]
CPUID 00000008: 00000000-00000000-00000000-00000000
CPUID 00000009: 00000000-00000000-00000000-00000000
CPUID 0000000A: 07300605-00000000-00000007-00008603
CPUID 0000000B: 00000001-00000001-00000100-00000018 [SL 00]
CPUID 0000000B: 00000006-0000000C-00000201-00000018 [SL 01]
CPUID 0000000C: 00000000-00000000-00000000-00000000
CPUID 0000000D: 00000207-00000340-00000A88-00000000 [SL 00] [x87]
CPUID 0000000D: 0000000F-000003D0-00019900-00000000 [SL 01] [SSE]
CPUID 0000000D: 00000100-00000240-00000000-00000000 [SL 02] [AVX]
CPUID 0000000D: 00000080-00000000-00000001-00000000 [SL 08] [PT]
CPUID 0000000D: 00000008-00000A80-00000000-00000000 [SL 09] [PKRU]
CPUID 0000000D: 00000010-00000000-00000001-00000000 [SL 0B] [CET_U]
CPUID 0000000D: 00000018-00000000-00000001-00000000 [SL 0C] [CET_S]
CPUID 0000000D: 00000328-00000000-00000001-00000000 [SL 0F] [LBR]
CPUID 0000000D: 00000008-00000000-00000001-00000000 [SL 10] [HWP]
CPUID 0000000E: 00000000-00000000-00000000-00000000
CPUID 0000000F: 00000000-00000000-00000000-00000000 [SL 00]
CPUID 0000000F: 00000000-00000000-00000000-00000000 [SL 01]
CPUID 00000010: 00000000-00000000-00000000-00000000 [SL 00]
CPUID 00000010: 00000000-00000000-00000000-00000000 [SL 01]
CPUID 00000011: 00000000-00000000-00000000-00000000
CPUID 00000012: 00000000-00000000-00000000-00000000 [SL 00]
CPUID 00000012: 00000000-00000000-00000000-00000000 [SL 01]
CPUID 00000013: 00000000-00000000-00000000-00000000
CPUID 00000014: 00000001-0000005F-80000007-00000000 [SL 00]
CPUID 00000014: 02490002-003F003F-00000000-00000000 [SL 01]
CPUID 00000015: 00000002-00000034-0249F000-00000000 [26.00x / 38400000 / 998.40]
CPUID 00000016: 000003E8-00000CE4-00000064-00000000 [1000 / 3300 / 100]
CPUID 00000017: 00000000-00000000-00000000-00000000 [SL 00]
CPUID 00000018: 00000004-00000000-00000000-00000000 [SL 00]
CPUID 00000018: 00000000-00300001-00000001-00000121 [SL 01]
CPUID 00000018: 00000000-00040003-00000200-00000043 [SL 02]
CPUID 00000018: 00000000-00400001-00000001-00000122 [SL 03]
CPUID 00000018: 00000000-00080008-00000001-00000143 [SL 04]
CPUID 00000019: 00000000-00000000-00000000-00000000
CPUID 0000001A: 20000001-00000000-00000000-00000000 [Atom: Gracemont]
CPUID 0000001C: C000000B-00000007-00000007-00000000
CPUID 0000001D: 00000000-00000000-00000000-00000000 [SL 00]
CPUID 0000001E: 00000000-00000000-00000000-00000000 [SL 00]
CPUID 0000001F: 00000001-00000001-00000100-00000018 [SL 00]
CPUID 0000001F: 00000006-0000000C-00000201-00000018 [SL 01]
CPUID 00000020: 00000000-00000001-00000000-00000000 [SL 00]
CPUID 80000000: 80000008-00000000-00000000-00000000
CPUID 80000001: 00000000-00000000-00000121-2C100000
CPUID 80000002: 68743231-6E654720-746E4920-52286C65 [12th Gen Intel(R]
CPUID 80000003: 6F432029-54286572-6920294D-32312D33 [) Core(TM) i3-12]
CPUID 80000004: 00503032-00000000-00000000-00000000 [20P]
CPUID 80000005: 00000000-00000000-00000000-00000000 [L1D: 0 KB / L1I: 0 KB]
CPUID 80000006: 00000000-00000000-08008040-00000000 [L2: 2048 KB / L3: 0 KB]
CPUID 80000007: 00000000-00000000-00000000-00000100
CPUID 80000008: 00003027-00000000-00000000-00000000

L1    Data Cache:    32 KB,  8-way Associative, 64-byte Line
L1  Instr. Cache:    64 KB,  8-way Associative, 64-byte Line
L2 Unified Cache:     2 MB, 16-way Associative, 64-byte Line
L3 Unified Cache:    12 MB, 12-way Associative, 64-byte Line

------[ CPUID Registers / Logical CPU #9 ]------

allcpu: Package 0 / Core 7 / Thread 0: Valid, Intel Atom

CPUID 00000000: 00000020-756E6547-6C65746E-49656E69 [GenuineIntel]
CPUID 00000001: 000906A4-1A400800-7FFAFBBF-BFEBFBFF
CPUID 00000002: 00FEFF01-00000000-00000000-00000000
CPUID 00000003: 00000000-00000000-00000000-00000000
CPUID 00000004: 7C004121-01C0003F-0000003F-00000000 [SL 00] [L1D: 32 KB]
CPUID 00000004: 7C004122-01C0003F-0000007F-00000000 [SL 01] [L1I: 64 KB]
CPUID 00000004: 7C01C143-03C0003F-000007FF-00000000 [SL 02] [L2U: 2 MB]
CPUID 00000004: 7C0FC163-02C0003F-00003FFF-00000004 [SL 03] [L3U: 12 MB]
CPUID 00000005: 00000040-00000040-00000003-10102020
CPUID 00000006: 00DF8FF7-00000002-00000409-00030003
CPUID 00000007: 00000002-239C27EB-984007AC-FC18C410 [SL 00]
CPUID 00000007: 00400810-00000000-00000000-00000000 [SL 01]
CPUID 00000007: 00000000-00000000-00000000-00000017 [SL 02]
CPUID 00000008: 00000000-00000000-00000000-00000000
CPUID 00000009: 00000000-00000000-00000000-00000000
CPUID 0000000A: 07300605-00000000-00000007-00008603
CPUID 0000000B: 00000001-00000001-00000100-0000001A [SL 00]
CPUID 0000000B: 00000006-0000000C-00000201-0000001A [SL 01]
CPUID 0000000C: 00000000-00000000-00000000-00000000
CPUID 0000000D: 00000207-00000340-00000A88-00000000 [SL 00] [x87]
CPUID 0000000D: 0000000F-000003D0-00019900-00000000 [SL 01] [SSE]
CPUID 0000000D: 00000100-00000240-00000000-00000000 [SL 02] [AVX]
CPUID 0000000D: 00000080-00000000-00000001-00000000 [SL 08] [PT]
CPUID 0000000D: 00000008-00000A80-00000000-00000000 [SL 09] [PKRU]
CPUID 0000000D: 00000010-00000000-00000001-00000000 [SL 0B] [CET_U]
CPUID 0000000D: 00000018-00000000-00000001-00000000 [SL 0C] [CET_S]
CPUID 0000000D: 00000328-00000000-00000001-00000000 [SL 0F] [LBR]
CPUID 0000000D: 00000008-00000000-00000001-00000000 [SL 10] [HWP]
CPUID 0000000E: 00000000-00000000-00000000-00000000
CPUID 0000000F: 00000000-00000000-00000000-00000000 [SL 00]
CPUID 0000000F: 00000000-00000000-00000000-00000000 [SL 01]
CPUID 00000010: 00000000-00000000-00000000-00000000 [SL 00]
CPUID 00000010: 00000000-00000000-00000000-00000000 [SL 01]
CPUID 00000011: 00000000-00000000-00000000-00000000
CPUID 00000012: 00000000-00000000-00000000-00000000 [SL 00]
CPUID 00000012: 00000000-00000000-00000000-00000000 [SL 01]
CPUID 00000013: 00000000-00000000-00000000-00000000
CPUID 00000014: 00000001-0000005F-80000007-00000000 [SL 00]
CPUID 00000014: 02490002-003F003F-00000000-00000000 [SL 01]
CPUID 00000015: 00000002-00000034-0249F000-00000000 [26.00x / 38400000 / 998.40]
CPUID 00000016: 000003E8-00000CE4-00000064-00000000 [1000 / 3300 / 100]
CPUID 00000017: 00000000-00000000-00000000-00000000 [SL 00]
CPUID 00000018: 00000004-00000000-00000000-00000000 [SL 00]
CPUID 00000018: 00000000-00300001-00000001-00000121 [SL 01]
CPUID 00000018: 00000000-00040003-00000200-00000043 [SL 02]
CPUID 00000018: 00000000-00400001-00000001-00000122 [SL 03]
CPUID 00000018: 00000000-00080008-00000001-00000143 [SL 04]
CPUID 00000019: 00000000-00000000-00000000-00000000
CPUID 0000001A: 20000001-00000000-00000000-00000000 [Atom: Gracemont]
CPUID 0000001C: C000000B-00000007-00000007-00000000
CPUID 0000001D: 00000000-00000000-00000000-00000000 [SL 00]
CPUID 0000001E: 00000000-00000000-00000000-00000000 [SL 00]
CPUID 0000001F: 00000001-00000001-00000100-0000001A [SL 00]
CPUID 0000001F: 00000006-0000000C-00000201-0000001A [SL 01]
CPUID 00000020: 00000000-00000001-00000000-00000000 [SL 00]
CPUID 80000000: 80000008-00000000-00000000-00000000
CPUID 80000001: 00000000-00000000-00000121-2C100000
CPUID 80000002: 68743231-6E654720-746E4920-52286C65 [12th Gen Intel(R]
CPUID 80000003: 6F432029-54286572-6920294D-32312D33 [) Core(TM) i3-12]
CPUID 80000004: 00503032-00000000-00000000-00000000 [20P]
CPUID 80000005: 00000000-00000000-00000000-00000000 [L1D: 0 KB / L1I: 0 KB]
CPUID 80000006: 00000000-00000000-08008040-00000000 [L2: 2048 KB / L3: 0 KB]
CPUID 80000007: 00000000-00000000-00000000-00000100
CPUID 80000008: 00003027-00000000-00000000-00000000

L1    Data Cache:    32 KB,  8-way Associative, 64-byte Line
L1  Instr. Cache:    64 KB,  8-way Associative, 64-byte Line
L2 Unified Cache:     2 MB, 16-way Associative, 64-byte Line
L3 Unified Cache:    12 MB, 12-way Associative, 64-byte Line

------[ CPUID Registers / Logical CPU #10 ]------

allcpu: Package 0 / Core 8 / Thread 0: Valid, Intel Atom

CPUID 00000000: 00000020-756E6547-6C65746E-49656E69 [GenuineIntel]
CPUID 00000001: 000906A4-1C400800-7FFAFBBF-BFEBFBFF
CPUID 00000002: 00FEFF01-00000000-00000000-00000000
CPUID 00000003: 00000000-00000000-00000000-00000000
CPUID 00000004: 7C004121-01C0003F-0000003F-00000000 [SL 00] [L1D: 32 KB]
CPUID 00000004: 7C004122-01C0003F-0000007F-00000000 [SL 01] [L1I: 64 KB]
CPUID 00000004: 7C01C143-03C0003F-000007FF-00000000 [SL 02] [L2U: 2 MB]
CPUID 00000004: 7C0FC163-02C0003F-00003FFF-00000004 [SL 03] [L3U: 12 MB]
CPUID 00000005: 00000040-00000040-00000003-10102020
CPUID 00000006: 00DF8FF7-00000002-00000409-00030003
CPUID 00000007: 00000002-239C27EB-984007AC-FC18C410 [SL 00]
CPUID 00000007: 00400810-00000000-00000000-00000000 [SL 01]
CPUID 00000007: 00000000-00000000-00000000-00000017 [SL 02]
CPUID 00000008: 00000000-00000000-00000000-00000000
CPUID 00000009: 00000000-00000000-00000000-00000000
CPUID 0000000A: 07300605-00000000-00000007-00008603
CPUID 0000000B: 00000001-00000001-00000100-0000001C [SL 00]
CPUID 0000000B: 00000006-0000000C-00000201-0000001C [SL 01]
CPUID 0000000C: 00000000-00000000-00000000-00000000
CPUID 0000000D: 00000207-00000340-00000A88-00000000 [SL 00] [x87]
CPUID 0000000D: 0000000F-000003D0-00019900-00000000 [SL 01] [SSE]
CPUID 0000000D: 00000100-00000240-00000000-00000000 [SL 02] [AVX]
CPUID 0000000D: 00000080-00000000-00000001-00000000 [SL 08] [PT]
CPUID 0000000D: 00000008-00000A80-00000000-00000000 [SL 09] [PKRU]
CPUID 0000000D: 00000010-00000000-00000001-00000000 [SL 0B] [CET_U]
CPUID 0000000D: 00000018-00000000-00000001-00000000 [SL 0C] [CET_S]
CPUID 0000000D: 00000328-00000000-00000001-00000000 [SL 0F] [LBR]
CPUID 0000000D: 00000008-00000000-00000001-00000000 [SL 10] [HWP]
CPUID 0000000E: 00000000-00000000-00000000-00000000
CPUID 0000000F: 00000000-00000000-00000000-00000000 [SL 00]
CPUID 0000000F: 00000000-00000000-00000000-00000000 [SL 01]
CPUID 00000010: 00000000-00000000-00000000-00000000 [SL 00]
CPUID 00000010: 00000000-00000000-00000000-00000000 [SL 01]
CPUID 00000011: 00000000-00000000-00000000-00000000
CPUID 00000012: 00000000-00000000-00000000-00000000 [SL 00]
CPUID 00000012: 00000000-00000000-00000000-00000000 [SL 01]
CPUID 00000013: 00000000-00000000-00000000-00000000
CPUID 00000014: 00000001-0000005F-80000007-00000000 [SL 00]
CPUID 00000014: 02490002-003F003F-00000000-00000000 [SL 01]
CPUID 00000015: 00000002-00000034-0249F000-00000000 [26.00x / 38400000 / 998.40]
CPUID 00000016: 000003E8-00000CE4-00000064-00000000 [1000 / 3300 / 100]
CPUID 00000017: 00000000-00000000-00000000-00000000 [SL 00]
CPUID 00000018: 00000004-00000000-00000000-00000000 [SL 00]
CPUID 00000018: 00000000-00300001-00000001-00000121 [SL 01]
CPUID 00000018: 00000000-00040003-00000200-00000043 [SL 02]
CPUID 00000018: 00000000-00400001-00000001-00000122 [SL 03]
CPUID 00000018: 00000000-00080008-00000001-00000143 [SL 04]
CPUID 00000019: 00000000-00000000-00000000-00000000
CPUID 0000001A: 20000001-00000000-00000000-00000000 [Atom: Gracemont]
CPUID 0000001C: C000000B-00000007-00000007-00000000
CPUID 0000001D: 00000000-00000000-00000000-00000000 [SL 00]
CPUID 0000001E: 00000000-00000000-00000000-00000000 [SL 00]
CPUID 0000001F: 00000001-00000001-00000100-0000001C [SL 00]
CPUID 0000001F: 00000006-0000000C-00000201-0000001C [SL 01]
CPUID 00000020: 00000000-00000001-00000000-00000000 [SL 00]
CPUID 80000000: 80000008-00000000-00000000-00000000
CPUID 80000001: 00000000-00000000-00000121-2C100000
CPUID 80000002: 68743231-6E654720-746E4920-52286C65 [12th Gen Intel(R]
CPUID 80000003: 6F432029-54286572-6920294D-32312D33 [) Core(TM) i3-12]
CPUID 80000004: 00503032-00000000-00000000-00000000 [20P]
CPUID 80000005: 00000000-00000000-00000000-00000000 [L1D: 0 KB / L1I: 0 KB]
CPUID 80000006: 00000000-00000000-08008040-00000000 [L2: 2048 KB / L3: 0 KB]
CPUID 80000007: 00000000-00000000-00000000-00000100
CPUID 80000008: 00003027-00000000-00000000-00000000

L1    Data Cache:    32 KB,  8-way Associative, 64-byte Line
L1  Instr. Cache:    64 KB,  8-way Associative, 64-byte Line
L2 Unified Cache:     2 MB, 16-way Associative, 64-byte Line
L3 Unified Cache:    12 MB, 12-way Associative, 64-byte Line

------[ CPUID Registers / Logical CPU #11 ]------

allcpu: Package 0 / Core 9 / Thread 0: Valid, Intel Atom

CPUID 00000000: 00000020-756E6547-6C65746E-49656E69 [GenuineIntel]
CPUID 00000001: 000906A4-1E400800-7FFAFBBF-BFEBFBFF
CPUID 00000002: 00FEFF01-00000000-00000000-00000000
CPUID 00000003: 00000000-00000000-00000000-00000000
CPUID 00000004: 7C004121-01C0003F-0000003F-00000000 [SL 00] [L1D: 32 KB]
CPUID 00000004: 7C004122-01C0003F-0000007F-00000000 [SL 01] [L1I: 64 KB]
CPUID 00000004: 7C01C143-03C0003F-000007FF-00000000 [SL 02] [L2U: 2 MB]
CPUID 00000004: 7C0FC163-02C0003F-00003FFF-00000004 [SL 03] [L3U: 12 MB]
CPUID 00000005: 00000040-00000040-00000003-10102020
CPUID 00000006: 00DF8FF7-00000002-00000409-00030003
CPUID 00000007: 00000002-239C27EB-984007AC-FC18C410 [SL 00]
CPUID 00000007: 00400810-00000000-00000000-00000000 [SL 01]
CPUID 00000007: 00000000-00000000-00000000-00000017 [SL 02]
CPUID 00000008: 00000000-00000000-00000000-00000000
CPUID 00000009: 00000000-00000000-00000000-00000000
CPUID 0000000A: 07300605-00000000-00000007-00008603
CPUID 0000000B: 00000001-00000001-00000100-0000001E [SL 00]
CPUID 0000000B: 00000006-0000000C-00000201-0000001E [SL 01]
CPUID 0000000C: 00000000-00000000-00000000-00000000
CPUID 0000000D: 00000207-00000340-00000A88-00000000 [SL 00] [x87]
CPUID 0000000D: 0000000F-000003D0-00019900-00000000 [SL 01] [SSE]
CPUID 0000000D: 00000100-00000240-00000000-00000000 [SL 02] [AVX]
CPUID 0000000D: 00000080-00000000-00000001-00000000 [SL 08] [PT]
CPUID 0000000D: 00000008-00000A80-00000000-00000000 [SL 09] [PKRU]
CPUID 0000000D: 00000010-00000000-00000001-00000000 [SL 0B] [CET_U]
CPUID 0000000D: 00000018-00000000-00000001-00000000 [SL 0C] [CET_S]
CPUID 0000000D: 00000328-00000000-00000001-00000000 [SL 0F] [LBR]
CPUID 0000000D: 00000008-00000000-00000001-00000000 [SL 10] [HWP]
CPUID 0000000E: 00000000-00000000-00000000-00000000
CPUID 0000000F: 00000000-00000000-00000000-00000000 [SL 00]
CPUID 0000000F: 00000000-00000000-00000000-00000000 [SL 01]
CPUID 00000010: 00000000-00000000-00000000-00000000 [SL 00]
CPUID 00000010: 00000000-00000000-00000000-00000000 [SL 01]
CPUID 00000011: 00000000-00000000-00000000-00000000
CPUID 00000012: 00000000-00000000-00000000-00000000 [SL 00]
CPUID 00000012: 00000000-00000000-00000000-00000000 [SL 01]
CPUID 00000013: 00000000-00000000-00000000-00000000
CPUID 00000014: 00000001-0000005F-80000007-00000000 [SL 00]
CPUID 00000014: 02490002-003F003F-00000000-00000000 [SL 01]
CPUID 00000015: 00000002-00000034-0249F000-00000000 [26.00x / 38400000 / 998.40]
CPUID 00000016: 000003E8-00000CE4-00000064-00000000 [1000 / 3300 / 100]
CPUID 00000017: 00000000-00000000-00000000-00000000 [SL 00]
CPUID 00000018: 00000004-00000000-00000000-00000000 [SL 00]
CPUID 00000018: 00000000-00300001-00000001-00000121 [SL 01]
CPUID 00000018: 00000000-00040003-00000200-00000043 [SL 02]
CPUID 00000018: 00000000-00400001-00000001-00000122 [SL 03]
CPUID 00000018: 00000000-00080008-00000001-00000143 [SL 04]
CPUID 00000019: 00000000-00000000-00000000-00000000
CPUID 0000001A: 20000001-00000000-00000000-00000000 [Atom: Gracemont]
CPUID 0000001C: C000000B-00000007-00000007-00000000
CPUID 0000001D: 00000000-00000000-00000000-00000000 [SL 00]
CPUID 0000001E: 00000000-00000000-00000000-00000000 [SL 00]
CPUID 0000001F: 00000001-00000001-00000100-0000001E [SL 00]
CPUID 0000001F: 00000006-0000000C-00000201-0000001E [SL 01]
CPUID 00000020: 00000000-00000001-00000000-00000000 [SL 00]
CPUID 80000000: 80000008-00000000-00000000-00000000
CPUID 80000001: 00000000-00000000-00000121-2C100000
CPUID 80000002: 68743231-6E654720-746E4920-52286C65 [12th Gen Intel(R]
CPUID 80000003: 6F432029-54286572-6920294D-32312D33 [) Core(TM) i3-12]
CPUID 80000004: 00503032-00000000-00000000-00000000 [20P]
CPUID 80000005: 00000000-00000000-00000000-00000000 [L1D: 0 KB / L1I: 0 KB]
CPUID 80000006: 00000000-00000000-08008040-00000000 [L2: 2048 KB / L3: 0 KB]
CPUID 80000007: 00000000-00000000-00000000-00000100
CPUID 80000008: 00003027-00000000-00000000-00000000

L1    Data Cache:    32 KB,  8-way Associative, 64-byte Line
L1  Instr. Cache:    64 KB,  8-way Associative, 64-byte Line
L2 Unified Cache:     2 MB, 16-way Associative, 64-byte Line
L3 Unified Cache:    12 MB, 12-way Associative, 64-byte Line

------[ All CPUs ]------

CPU   0: APICID    0 / Package 0 / Core   0 / Thread 0: Valid
CPU   1: APICID    1 / Package 0 / Core   0 / Thread 1: Valid, Virtual
CPU   2: APICID    8 / Package 0 / Core   1 / Thread 0: Valid
CPU   3: APICID    9 / Package 0 / Core   1 / Thread 1: Valid, Virtual
CPU   4: APICID   16 / Package 0 / Core   2 / Thread 0: Valid
CPU   5: APICID   18 / Package 0 / Core   3 / Thread 0: Valid
CPU   6: APICID   20 / Package 0 / Core   4 / Thread 0: Valid
CPU   7: APICID   22 / Package 0 / Core   5 / Thread 0: Valid
CPU   8: APICID   24 / Package 0 / Core   6 / Thread 0: Valid
CPU   9: APICID   26 / Package 0 / Core   7 / Thread 0: Valid
CPU  10: APICID   28 / Package 0 / Core   8 / Thread 0: Valid
CPU  11: APICID   30 / Package 0 / Core   9 / Thread 0: Valid

------[ MSR Registers / Logical CPU #0 ]------

MSR 00000017: 001C-0000-0000-0000 [PlatID = 7]
MSR 0000001B: 0000-0000-FEE0-0D00
MSR 00000035: 0000-0000-000A-000C
MSR 00000048: 0000-0000-0000-0001
MSR 00000049: < FAILED >
MSR 0000008B: 0000-042A-0000-0000
MSR 000000CE: 0004-043D-F981-0A00 [eD = 0]
MSR 000000E7: 0000-0004-0717-7C3E [S200]
MSR 000000E7: 0000-0004-0730-EFE8 [S200]
MSR 000000E7: 0000-0004-0780-2FA4
MSR 000000E8: 0000-0005-0A5F-E733 [S200]
MSR 000000E8: 0000-0005-0AAB-5746 [S200]
MSR 000000E8: 0000-0005-0AAE-8FAF
MSR 0000010A: 0000-0000-0088-FD6B
MSR 0000010B: < FAILED >
MSR 00000194: 0000-0000-0011-0A00
MSR 00000198: 0000-1686-0000-0B00 [S200]
MSR 00000198: 0000-168B-0000-0A00 [S200]
MSR 00000198: 0000-165A-0000-0900
MSR 00000199: 0000-0000-0000-0A00
MSR 0000019A: 0000-0000-0000-0000
MSR 0000019B: 0000-0000-0000-0010
MSR 0000019C: 0000-0000-883A-2A82 [S200]
MSR 0000019C: 0000-0000-883A-2A82 [S200]
MSR 0000019C: 0000-0000-883A-2A82
MSR 0000019D: 0000-0000-0000-0000
MSR 000001A0: 0000-0000-0085-0089
MSR 000001A2: 0000-0000-8064-0000
MSR 000001A4: 0000-0000-0000-0000
MSR 000001AA: 0000-0000-0000-30C2
MSR 000001AC: < FAILED >
MSR 000001AD: 2626-2626-2626-262C
MSR 000001AE: 0807-0605-0403-0201
MSR 000001AF: < FAILED >
MSR 000001B0: 0000-0000-0000-0006
MSR 000001B1: 0000-0000-8839-0A82
MSR 000001B2: 0000-0000-0200-0000
MSR 000001FC: 0000-0000-00EC-0059
MSR 00000300: < FAILED >
MSR 0000030A: 0000-0002-D37B-863C [S200]
MSR 0000030A: 0000-0002-D4D8-D104 [S200]
MSR 0000030A: 0000-0002-D4F2-9AE8
MSR 0000030B: 0000-0002-3B97-3152 [S200]
MSR 0000030B: 0000-0002-3B97-C28E [S200]
MSR 0000030B: 0000-0002-3B98-C2B2
MSR 00000480: 03DA-0500-0000-0013
MSR 00000481: 0000-00FF-0000-0016
MSR 00000482: FFFB-FFFE-0401-E172
MSR 00000483: F77F-FFFF-0003-6DFF
MSR 00000484: 0076-FFFF-0000-11FF
MSR 00000485: 0000-0000-7004-C1E7
MSR 00000486: 0000-0000-8000-0021
MSR 00000487: 0000-0000-FFFF-FFFF
MSR 00000488: 0000-0000-0000-2000
MSR 00000489: 0000-0000-01F7-2FFF
MSR 0000048A: 0000-0000-0000-002E
MSR 0000048B: 075D-7FFF-0000-0000
MSR 0000048C: 0000-0F01-06F3-4141
MSR 0000048D: 0000-00FF-0000-0016
MSR 0000048E: FFFB-FFFE-0400-6172
MSR 0000048F: F77F-FFFF-0003-6DFB
MSR 00000490: 0076-FFFF-0000-11FB
MSR 00000601: 0000-0000-0000-0280
MSR 00000602: < FAILED >
MSR 00000603: 0036-0000-0036-3636
MSR 00000604: < FAILED >
MSR 00000606: 0000-0000-000A-0E03
MSR 0000060A: 0000-0000-0000-0000
MSR 0000060B: 0000-0000-0000-0000
MSR 0000060C: 0000-0000-0000-0000
MSR 0000060D: 0000-0014-6372-9694
MSR 00000610: 0042-8138-00DD-80A0
MSR 00000611: 0000-0000-07D5-E4C1 [S200]
MSR 00000611: 0000-0000-07D5-EBDB [S200]
MSR 00000611: 0000-0000-07D5-F87F
MSR 00000613: 0000-0000-0000-0000
MSR 00000614: 0000-0000-0000-00E0
MSR 00000618: 0000-0000-0000-0000
MSR 00000619: 0000-0000-0000-0000 [S200]
MSR 00000619: 0000-0000-0000-0000 [S200]
MSR 00000619: 0000-0000-0000-0000
MSR 0000061B: 0000-0000-0000-0000
MSR 0000061C: < FAILED >
MSR 0000061E: < FAILED >
MSR 00000620: 0000-0000-0000-0426
MSR 00000621: 0000-0000-0000-0004
MSR 00000638: 0000-0000-0000-0000
MSR 00000639: 0000-0000-045F-0481 [S200]
MSR 00000639: 0000-0000-045F-0964 [S200]
MSR 00000639: 0000-0000-045F-0CC5
MSR 0000063A: 0000-0000-0000-0009
MSR 0000063B: < FAILED >
MSR 00000640: 0000-0000-0000-0000
MSR 00000641: 0000-0000-0006-715E [S200]
MSR 00000641: 0000-0000-0006-715E [S200]
MSR 00000641: 0000-0000-0006-7285
MSR 00000642: 0000-0000-0000-000D
MSR 00000648: 0000-0000-0000-000A
MSR 00000649: 0000-0000-000A-00A0
MSR 0000064A: 0000-0000-000A-0118
MSR 0000064B: 0000-0000-0000-0000
MSR 0000064C: 0000-0000-0000-0009
MSR 00000650: 2121-2121-2121-2121
MSR 00000651: 0807-0605-0403-0201
MSR 00000690: < FAILED >
MSR 000006B0: 0000-0000-0100-0000
MSR 000006B1: 0000-0000-0100-0000
MSR 00000770: 0000-0000-0000-0001
MSR 00000771: 0000-0000-010C-0D38
MSR 00000772: 0000-0000-8000-FF01
MSR 00000773: 0000-0000-0000-0005
MSR 00000774: 0000-019E-5400-3801
MSR 00000777: 0000-0000-0000-0004
MSR 00000832: 0000-0000-0002-00D1
MSR 00000838: 0000-0000-0000-0209
MSR 00000839: 0000-0000-0000-0162
MSR 0000083E: 0000-0000-0000-000A

------[ MSR Registers / Logical CPU #1 ]------

MSR 00000017: 001C-0000-0000-0000 [PlatID = 7]
MSR 0000001B: 0000-0000-FEE0-0C00
MSR 00000035: 0000-0000-000A-000C
MSR 00000048: 0000-0000-0000-0001
MSR 00000049: < FAILED >
MSR 0000008B: 0000-042A-0000-0000
MSR 000000CE: 0004-043D-F981-0A00 [eD = 0]
MSR 000000E7: 0000-000A-8D24-5B0C
MSR 000000E8: 0000-001B-AD34-DD2D
MSR 0000010A: 0000-0000-0088-FD6B
MSR 0000010B: < FAILED >
MSR 00000194: 0000-0000-0011-0A00
MSR 00000198: 0000-251F-0000-2C00
MSR 00000199: 0000-0000-0000-0A00
MSR 0000019A: 0000-0000-0000-0000
MSR 0000019B: 0000-0000-0000-0010
MSR 0000019C: 0000-0000-8821-2A82
MSR 0000019D: 0000-0000-0000-0000
MSR 000001A0: 0000-0000-0085-0089
MSR 000001A2: 0000-0000-8064-0000
MSR 000001A4: 0000-0000-0000-0000
MSR 000001AA: 0000-0000-0000-30C2
MSR 000001AC: < FAILED >
MSR 000001AD: 2626-2626-2626-262C
MSR 000001AE: 0807-0605-0403-0201
MSR 000001AF: < FAILED >
MSR 000001B0: 0000-0000-0000-0006
MSR 000001B1: 0000-0000-8822-0A82
MSR 000001B2: 0000-0000-0200-0000
MSR 000001FC: 0000-0000-00EC-0059
MSR 00000300: < FAILED >
MSR 0000030A: 0000-0007-9328-327D
MSR 0000030B: 0000-0002-7AE0-21E6
MSR 00000480: 03DA-0500-0000-0013
MSR 00000481: 0000-00FF-0000-0016
MSR 00000482: FFFB-FFFE-0401-E172
MSR 00000483: F77F-FFFF-0003-6DFF
MSR 00000484: 0076-FFFF-0000-11FF
MSR 00000485: 0000-0000-7004-C1E7
MSR 00000486: 0000-0000-8000-0021
MSR 00000487: 0000-0000-FFFF-FFFF
MSR 00000488: 0000-0000-0000-2000
MSR 00000489: 0000-0000-01F7-2FFF
MSR 0000048A: 0000-0000-0000-002E
MSR 0000048B: 075D-7FFF-0000-0000
MSR 0000048C: 0000-0F01-06F3-4141
MSR 0000048D: 0000-00FF-0000-0016
MSR 0000048E: FFFB-FFFE-0400-6172
MSR 0000048F: F77F-FFFF-0003-6DFB
MSR 00000490: 0076-FFFF-0000-11FB
MSR 00000601: 0000-0000-0000-0280
MSR 00000602: < FAILED >
MSR 00000603: 0036-0000-0036-3636
MSR 00000604: < FAILED >
MSR 00000606: 0000-0000-000A-0E03
MSR 0000060A: 0000-0000-0000-0000
MSR 0000060B: 0000-0000-0000-0000
MSR 0000060C: 0000-0000-0000-0000
MSR 0000060D: 0000-0014-6CA1-BA8E
MSR 00000610: 0042-8138-00DD-80A0
MSR 00000611: 0000-0000-07D6-7B75
MSR 00000613: 0000-0000-0000-0000
MSR 00000614: 0000-0000-0000-00E0
MSR 00000618: 0000-0000-0000-0000
MSR 00000619: 0000-0000-0000-0000
MSR 0000061B: 0000-0000-0000-0000
MSR 0000061C: < FAILED >
MSR 0000061E: < FAILED >
MSR 00000620: 0000-0000-0000-0426
MSR 00000621: 0000-0000-0000-0026
MSR 00000638: 0000-0000-0000-0000
MSR 00000639: 0000-0000-045F-2419
MSR 0000063A: 0000-0000-0000-0009
MSR 0000063B: < FAILED >
MSR 00000640: 0000-0000-0000-0000
MSR 00000641: 0000-0000-0006-7293
MSR 00000642: 0000-0000-0000-000D
MSR 00000648: 0000-0000-0000-000A
MSR 00000649: 0000-0000-000A-00A0
MSR 0000064A: 0000-0000-000A-0118
MSR 0000064B: 0000-0000-0000-0000
MSR 0000064C: 0000-0000-0000-0009
MSR 00000650: 2121-2121-2121-2121
MSR 00000651: 0807-0605-0403-0201
MSR 00000690: < FAILED >
MSR 000006B0: 0000-0000-0100-0000
MSR 000006B1: 0000-0000-0100-0000
MSR 00000770: 0000-0000-0000-0001
MSR 00000771: 0000-0000-010E-0D38
MSR 00000772: 0000-0000-8000-FF01
MSR 00000773: 0000-0000-0000-0005
MSR 00000774: 0000-019E-5400-3801
MSR 00000777: 0000-0000-0000-0004
MSR 00000832: 0000-0000-0000-00D1
MSR 00000838: 0000-0000-0000-0096
MSR 00000839: 0000-0000-0000-000D
MSR 0000083E: 0000-0000-0000-000A

------[ MSR Registers / Logical CPU #2 ]------

MSR 00000017: 001C-0000-0000-0000 [PlatID = 7]
MSR 0000001B: 0000-0000-FEE0-0C00
MSR 00000035: 0000-0000-000A-000C
MSR 00000048: 0000-0000-0000-0001
MSR 00000049: < FAILED >
MSR 0000008B: 0000-042A-0000-0000
MSR 000000CE: 0004-043D-F981-0A00 [eD = 0]
MSR 000000E7: 0000-001A-0DDF-1D4A
MSR 000000E8: 0000-0040-9C8F-AF04
MSR 0000010A: 0000-0000-0088-FD6B
MSR 0000010B: < FAILED >
MSR 00000194: 0000-0000-0011-0A00
MSR 00000198: 0000-2526-0000-2C00
MSR 00000199: 0000-0000-0000-0A00
MSR 0000019A: 0000-0000-0000-0000
MSR 0000019B: 0000-0000-0000-0010
MSR 0000019C: 0000-0000-883C-2800
MSR 0000019D: 0000-0000-0000-0000
MSR 000001A0: 0000-0000-0085-0089
MSR 000001A2: 0000-0000-8064-0000
MSR 000001A4: 0000-0000-0000-0000
MSR 000001AA: 0000-0000-0000-30C2
MSR 000001AC: < FAILED >
MSR 000001AD: 2626-2626-2626-262C
MSR 000001AE: 0807-0605-0403-0201
MSR 000001AF: < FAILED >
MSR 000001B0: 0000-0000-0000-0006
MSR 000001B1: 0000-0000-8822-0A82
MSR 000001B2: 0000-0000-0200-0000
MSR 000001FC: 0000-0000-00EC-0059
MSR 00000300: < FAILED >
MSR 0000030A: 0000-0013-AFE3-F50C
MSR 0000030B: 0000-0007-80D0-DD86
MSR 00000480: 03DA-0500-0000-0013
MSR 00000481: 0000-00FF-0000-0016
MSR 00000482: FFFB-FFFE-0401-E172
MSR 00000483: F77F-FFFF-0003-6DFF
MSR 00000484: 0076-FFFF-0000-11FF
MSR 00000485: 0000-0000-7004-C1E7
MSR 00000486: 0000-0000-8000-0021
MSR 00000487: 0000-0000-FFFF-FFFF
MSR 00000488: 0000-0000-0000-2000
MSR 00000489: 0000-0000-01F7-2FFF
MSR 0000048A: 0000-0000-0000-002E
MSR 0000048B: 075D-7FFF-0000-0000
MSR 0000048C: 0000-0F01-06F3-4141
MSR 0000048D: 0000-00FF-0000-0016
MSR 0000048E: FFFB-FFFE-0400-6172
MSR 0000048F: F77F-FFFF-0003-6DFB
MSR 00000490: 0076-FFFF-0000-11FB
MSR 00000601: 0000-0000-0000-0280
MSR 00000602: < FAILED >
MSR 00000603: 0036-0000-0036-3636
MSR 00000604: < FAILED >
MSR 00000606: 0000-0000-000A-0E03
MSR 0000060A: 0000-0000-0000-0000
MSR 0000060B: 0000-0000-0000-0000
MSR 0000060C: 0000-0000-0000-0000
MSR 0000060D: 0000-0014-6CA1-BA8E
MSR 00000610: 0042-8138-00DD-80A0
MSR 00000611: 0000-0000-07D6-7CB1
MSR 00000613: 0000-0000-0000-0000
MSR 00000614: 0000-0000-0000-00E0
MSR 00000618: 0000-0000-0000-0000
MSR 00000619: 0000-0000-0000-0000
MSR 0000061B: 0000-0000-0000-0000
MSR 0000061C: < FAILED >
MSR 0000061E: < FAILED >
MSR 00000620: 0000-0000-0000-0426
MSR 00000621: 0000-0000-0000-0026
MSR 00000638: 0000-0000-0000-0000
MSR 00000639: 0000-0000-045F-2502
MSR 0000063A: 0000-0000-0000-0009
MSR 0000063B: < FAILED >
MSR 00000640: 0000-0000-0000-0000
MSR 00000641: 0000-0000-0006-7293
MSR 00000642: 0000-0000-0000-000D
MSR 00000648: 0000-0000-0000-000A
MSR 00000649: 0000-0000-000A-00A0
MSR 0000064A: 0000-0000-000A-0118
MSR 0000064B: 0000-0000-0000-0000
MSR 0000064C: 0000-0000-0000-0009
MSR 00000650: 2121-2121-2121-2121
MSR 00000651: 0807-0605-0403-0201
MSR 00000690: < FAILED >
MSR 000006B0: 0000-0000-0100-0000
MSR 000006B1: 0000-0000-0100-0000
MSR 00000770: 0000-0000-0000-0001
MSR 00000771: 0000-0000-010E-0D38
MSR 00000772: 0000-0000-8000-FF01
MSR 00000773: 0000-0000-0000-0005
MSR 00000774: 0000-019E-5400-3801
MSR 00000777: 0000-0000-0000-0004
MSR 00000832: 0000-0000-0002-00D1
MSR 00000838: 0000-0000-0000-0209
MSR 00000839: 0000-0000-0000-017E
MSR 0000083E: 0000-0000-0000-000A

------[ MSR Registers / Logical CPU #3 ]------

MSR 00000017: 001C-0000-0000-0000 [PlatID = 7]
MSR 0000001B: 0000-0000-FEE0-0C00
MSR 00000035: 0000-0000-000A-000C
MSR 00000048: 0000-0000-0000-0001
MSR 00000049: < FAILED >
MSR 0000008B: 0000-042A-0000-0000
MSR 000000CE: 0004-043D-F981-0A00 [eD = 0]
MSR 000000E7: 0000-000D-3001-D988
MSR 000000E8: 0000-0022-D4E0-A143
MSR 0000010A: 0000-0000-0088-FD6B
MSR 0000010B: < FAILED >
MSR 00000194: 0000-0000-0011-0A00
MSR 00000198: 0000-2539-0000-2C00
MSR 00000199: 0000-0000-0000-0A00
MSR 0000019A: 0000-0000-0000-0000
MSR 0000019B: 0000-0000-0000-0010
MSR 0000019C: 0000-0000-883C-2800
MSR 0000019D: 0000-0000-0000-0000
MSR 000001A0: 0000-0000-0085-0089
MSR 000001A2: 0000-0000-8064-0000
MSR 000001A4: 0000-0000-0000-0000
MSR 000001AA: 0000-0000-0000-30C2
MSR 000001AC: < FAILED >
MSR 000001AD: 2626-2626-2626-262C
MSR 000001AE: 0807-0605-0403-0201
MSR 000001AF: < FAILED >
MSR 000001B0: 0000-0000-0000-0006
MSR 000001B1: 0000-0000-8822-0A82
MSR 000001B2: 0000-0000-0200-0000
MSR 000001FC: 0000-0000-00EC-0059
MSR 00000300: < FAILED >
MSR 0000030A: 0000-0004-DCE4-5E69
MSR 0000030B: 0000-0002-0A01-8BE2
MSR 00000480: 03DA-0500-0000-0013
MSR 00000481: 0000-00FF-0000-0016
MSR 00000482: FFFB-FFFE-0401-E172
MSR 00000483: F77F-FFFF-0003-6DFF
MSR 00000484: 0076-FFFF-0000-11FF
MSR 00000485: 0000-0000-7004-C1E7
MSR 00000486: 0000-0000-8000-0021
MSR 00000487: 0000-0000-FFFF-FFFF
MSR 00000488: 0000-0000-0000-2000
MSR 00000489: 0000-0000-01F7-2FFF
MSR 0000048A: 0000-0000-0000-002E
MSR 0000048B: 075D-7FFF-0000-0000
MSR 0000048C: 0000-0F01-06F3-4141
MSR 0000048D: 0000-00FF-0000-0016
MSR 0000048E: FFFB-FFFE-0400-6172
MSR 0000048F: F77F-FFFF-0003-6DFB
MSR 00000490: 0076-FFFF-0000-11FB
MSR 00000601: 0000-0000-0000-0280
MSR 00000602: < FAILED >
MSR 00000603: 0036-0000-0036-3636
MSR 00000604: < FAILED >
MSR 00000606: 0000-0000-000A-0E03
MSR 0000060A: 0000-0000-0000-0000
MSR 0000060B: 0000-0000-0000-0000
MSR 0000060C: 0000-0000-0000-0000
MSR 0000060D: 0000-0014-6CA1-BA8E
MSR 00000610: 0042-8138-00DD-80A0
MSR 00000611: 0000-0000-07D6-7D82
MSR 00000613: 0000-0000-0000-0000
MSR 00000614: 0000-0000-0000-00E0
MSR 00000618: 0000-0000-0000-0000
MSR 00000619: 0000-0000-0000-0000
MSR 0000061B: 0000-0000-0000-0000
MSR 0000061C: < FAILED >
MSR 0000061E: < FAILED >
MSR 00000620: 0000-0000-0000-0426
MSR 00000621: 0000-0000-0000-0026
MSR 00000638: 0000-0000-0000-0000
MSR 00000639: 0000-0000-045F-25A4
MSR 0000063A: 0000-0000-0000-0009
MSR 0000063B: < FAILED >
MSR 00000640: 0000-0000-0000-0000
MSR 00000641: 0000-0000-0006-7293
MSR 00000642: 0000-0000-0000-000D
MSR 00000648: 0000-0000-0000-000A
MSR 00000649: 0000-0000-000A-00A0
MSR 0000064A: 0000-0000-000A-0118
MSR 0000064B: 0000-0000-0000-0000
MSR 0000064C: 0000-0000-0000-0009
MSR 00000650: 2121-2121-2121-2121
MSR 00000651: 0807-0605-0403-0201
MSR 00000690: < FAILED >
MSR 000006B0: 0000-0000-0100-0000
MSR 000006B1: 0000-0000-0100-0000
MSR 00000770: 0000-0000-0000-0001
MSR 00000771: 0000-0000-010E-0D38
MSR 00000772: 0000-0000-8000-FF01
MSR 00000773: 0000-0000-0000-0005
MSR 00000774: 0000-019E-5400-3801
MSR 00000777: 0000-0000-0000-0004
MSR 00000832: 0000-0000-0000-00D1
MSR 00000838: 0000-0000-0000-0096
MSR 00000839: 0000-0000-0000-000E
MSR 0000083E: 0000-0000-0000-000A

------[ MSR Registers / Logical CPU #4 ]------

MSR 00000017: 001C-0000-0000-0000 [PlatID = 7]
MSR 0000001B: 0000-0000-FEE0-0C00
MSR 0000002A: 0000-0000-0000-0000
MSR 00000035: 0000-0000-000A-000C
MSR 00000048: 0000-0000-0000-0001
MSR 00000049: < FAILED >
MSR 0000008B: 0000-042A-0000-0000
MSR 000000CD: < FAILED >
MSR 000000CE: 0004-043D-F981-0A00 [eD = 0]
MSR 000000E7: 0000-001C-A849-D1E8
MSR 000000E8: 0000-004D-2ADE-6176
MSR 000000EE: < FAILED >
MSR 0000010A: 0000-0000-0088-FD6B
MSR 0000010B: < FAILED >
MSR 0000011E: < FAILED >
MSR 00000194: 0000-0000-0011-0A00
MSR 00000198: 0000-24E4-0000-2000
MSR 00000199: 0000-0000-0000-0A00
MSR 0000019A: 0000-0000-0000-0000
MSR 0000019B: 0000-0000-0000-0010
MSR 0000019C: 0000-0000-8832-2800
MSR 0000019D: 0000-0000-0000-0000
MSR 000001A0: 0000-0000-0085-0089
MSR 000001A2: 0000-0000-8064-0000
MSR 000001A4: 0000-0000-0000-0000
MSR 000001AA: 0000-0000-0000-30C2
MSR 000001AC: < FAILED >
MSR 000001AD: 2626-2626-2626-262C
MSR 000001AE: 0807-0605-0403-0201
MSR 000001AF: < FAILED >
MSR 000001B0: 0000-0000-0000-0006
MSR 000001B1: 0000-0000-882A-0A82
MSR 000001B2: 0000-0000-0200-0000
MSR 000001FC: 0000-0000-00EC-0059
MSR 00000300: < FAILED >
MSR 0000030A: 0000-0017-1E55-A21B
MSR 0000030B: 0000-0008-8B3C-55C4
MSR 00000480: 03DA-0500-0000-0013
MSR 00000481: 0000-00FF-0000-0016
MSR 00000482: FFFB-FFFE-0401-E172
MSR 00000483: F77F-FFFF-0003-6DFF
MSR 00000484: 0076-FFFF-0000-11FF
MSR 00000485: 0000-0000-7004-C1E7
MSR 00000486: 0000-0000-8000-0021
MSR 00000487: 0000-0000-FFFF-FFFF
MSR 00000488: 0000-0000-0000-2000
MSR 00000489: 0000-0000-01F7-2FFF
MSR 0000048A: 0000-0000-0000-002E
MSR 0000048B: 075D-7FFF-0000-0000
MSR 0000048C: 0000-0F01-06F3-4141
MSR 0000048D: 0000-00FF-0000-0016
MSR 0000048E: FFFB-FFFE-0400-6172
MSR 0000048F: F77F-FFFF-0003-6DFB
MSR 00000490: 0076-FFFF-0000-11FB
MSR 00000601: 0000-0000-0000-0280
MSR 00000602: < FAILED >
MSR 00000603: 0036-0000-0036-3636
MSR 00000604: < FAILED >
MSR 00000606: 0000-0000-000A-0E03
MSR 0000060A: 0000-0000-0000-0000
MSR 0000060B: 0000-0000-0000-0000
MSR 0000060C: 0000-0000-0000-0000
MSR 0000060D: 0000-0014-6CA1-BA8E
MSR 00000610: 0042-8138-00DD-80A0
MSR 00000611: 0000-0000-07D6-7E7B
MSR 00000613: 0000-0000-0000-0000
MSR 00000614: 0000-0000-0000-00E0
MSR 00000618: 0000-0000-0000-0000
MSR 00000619: 0000-0000-0000-0000
MSR 0000061B: 0000-0000-0000-0000
MSR 0000061C: < FAILED >
MSR 0000061E: < FAILED >
MSR 00000620: 0000-0000-0000-0426
MSR 00000621: 0000-0000-0000-001A
MSR 00000638: 0000-0000-0000-0000
MSR 00000639: 0000-0000-045F-2659
MSR 0000063A: 0000-0000-0000-0009
MSR 0000063B: < FAILED >
MSR 00000640: 0000-0000-0000-0000
MSR 00000641: 0000-0000-0006-7293
MSR 00000642: 0000-0000-0000-000D
MSR 00000648: 0000-0000-0000-000A
MSR 00000649: 0000-0000-000A-00A0
MSR 0000064A: 0000-0000-000A-0118
MSR 0000064B: 0000-0000-0000-0000
MSR 0000064C: 0000-0000-0000-0009
MSR 00000650: 2121-2121-2121-2121
MSR 00000651: 0807-0605-0403-0201
MSR 00000660: 0000-0011-FE99-18DA
MSR 00000661: < FAILED >
MSR 00000662: < FAILED >
MSR 00000663: < FAILED >
MSR 00000664: 0000-0152-782A-1D00
MSR 00000665: < FAILED >
MSR 00000666: < FAILED >
MSR 00000667: < FAILED >
MSR 00000668: < FAILED >
MSR 00000669: < FAILED >
MSR 0000066A: < FAILED >
MSR 0000066B: < FAILED >
MSR 0000066C: < FAILED >
MSR 0000066D: < FAILED >
MSR 0000066E: < FAILED >
MSR 0000066F: < FAILED >
MSR 00000670: < FAILED >
MSR 00000671: < FAILED >
MSR 00000672: < FAILED >
MSR 00000673: < FAILED >
MSR 00000674: < FAILED >
MSR 00000675: < FAILED >
MSR 00000676: < FAILED >
MSR 00000677: < FAILED >
MSR 00000690: < FAILED >
MSR 000006B0: 0000-0000-0100-0000
MSR 000006B1: 0000-0000-0100-0100
MSR 00000770: 0000-0000-0000-0001
MSR 00000771: 0000-0000-010B-0721
MSR 00000772: 0000-0000-8000-FF01
MSR 00000773: 0000-0000-0000-0005
MSR 00000774: 0000-019E-5400-2101
MSR 00000777: 0000-0000-0000-0004
MSR 00000832: 0000-0000-0000-00D1
MSR 00000838: 0000-0000-0000-0258
MSR 00000839: 0000-0000-0000-019B
MSR 0000083E: 0000-0000-0000-000A

------[ MSR Registers / Logical CPU #5 ]------

MSR 00000017: 001C-0000-0000-0000 [PlatID = 7]
MSR 0000001B: 0000-0000-FEE0-0C00
MSR 0000002A: 0000-0000-0000-0000
MSR 00000035: 0000-0000-000A-000C
MSR 00000048: 0000-0000-0000-0001
MSR 00000049: < FAILED >
MSR 0000008B: 0000-042A-0000-0000
MSR 000000CD: < FAILED >
MSR 000000CE: 0004-043D-F981-0A00 [eD = 0]
MSR 000000E7: 0000-0011-BE45-D0D8
MSR 000000E8: 0000-0030-E5F0-9EDC
MSR 000000EE: < FAILED >
MSR 0000010A: 0000-0000-0088-FD6B
MSR 0000010B: < FAILED >
MSR 0000011E: < FAILED >
MSR 00000194: 0000-0000-0011-0A00
MSR 00000198: 0000-22B2-0000-2000
MSR 00000199: 0000-0000-0000-0A00
MSR 0000019A: 0000-0000-0000-0000
MSR 0000019B: 0000-0000-0000-0010
MSR 0000019C: 0000-0000-8834-2800
MSR 0000019D: 0000-0000-0000-0000
MSR 000001A0: 0000-0000-0085-0089
MSR 000001A2: 0000-0000-8064-0000
MSR 000001A4: 0000-0000-0000-0000
MSR 000001AA: 0000-0000-0000-30C2
MSR 000001AC: < FAILED >
MSR 000001AD: 2626-2626-2626-262C
MSR 000001AE: 0807-0605-0403-0201
MSR 000001AF: < FAILED >
MSR 000001B0: 0000-0000-0000-0006
MSR 000001B1: 0000-0000-882D-0A82
MSR 000001B2: 0000-0000-0200-0000
MSR 000001FC: 0000-0000-00EC-0059
MSR 00000300: < FAILED >
MSR 0000030A: 0000-0011-528C-761A
MSR 0000030B: 0000-0006-2856-1A5A
MSR 00000480: 03DA-0500-0000-0013
MSR 00000481: 0000-00FF-0000-0016
MSR 00000482: FFFB-FFFE-0401-E172
MSR 00000483: F77F-FFFF-0003-6DFF
MSR 00000484: 0076-FFFF-0000-11FF
MSR 00000485: 0000-0000-7004-C1E7
MSR 00000486: 0000-0000-8000-0021
MSR 00000487: 0000-0000-FFFF-FFFF
MSR 00000488: 0000-0000-0000-2000
MSR 00000489: 0000-0000-01F7-2FFF
MSR 0000048A: 0000-0000-0000-002E
MSR 0000048B: 075D-7FFF-0000-0000
MSR 0000048C: 0000-0F01-06F3-4141
MSR 0000048D: 0000-00FF-0000-0016
MSR 0000048E: FFFB-FFFE-0400-6172
MSR 0000048F: F77F-FFFF-0003-6DFB
MSR 00000490: 0076-FFFF-0000-11FB
MSR 00000601: 0000-0000-0000-0280
MSR 00000602: < FAILED >
MSR 00000603: 0036-0000-0036-3636
MSR 00000604: < FAILED >
MSR 00000606: 0000-0000-000A-0E03
MSR 0000060A: 0000-0000-0000-0000
MSR 0000060B: 0000-0000-0000-0000
MSR 0000060C: 0000-0000-0000-0000
MSR 0000060D: 0000-0014-6CA1-BA8E
MSR 00000610: 0042-8138-00DD-80A0
MSR 00000611: 0000-0000-07D6-800B
MSR 00000613: 0000-0000-0000-0000
MSR 00000614: 0000-0000-0000-00E0
MSR 00000618: 0000-0000-0000-0000
MSR 00000619: 0000-0000-0000-0000
MSR 0000061B: 0000-0000-0000-0000
MSR 0000061C: < FAILED >
MSR 0000061E: < FAILED >
MSR 00000620: 0000-0000-0000-0426
MSR 00000621: 0000-0000-0000-001A
MSR 00000638: 0000-0000-0000-0000
MSR 00000639: 0000-0000-045F-273B
MSR 0000063A: 0000-0000-0000-0009
MSR 0000063B: < FAILED >
MSR 00000640: 0000-0000-0000-0000
MSR 00000641: 0000-0000-0006-72B3
MSR 00000642: 0000-0000-0000-000D
MSR 00000648: 0000-0000-0000-000A
MSR 00000649: 0000-0000-000A-00A0
MSR 0000064A: 0000-0000-000A-0118
MSR 0000064B: 0000-0000-0000-0000
MSR 0000064C: 0000-0000-0000-0009
MSR 00000650: 2121-2121-2121-2121
MSR 00000651: 0807-0605-0403-0201
MSR 00000660: 0000-000B-2B58-FDF2
MSR 00000661: < FAILED >
MSR 00000662: < FAILED >
MSR 00000663: < FAILED >
MSR 00000664: 0000-0152-782A-1D00
MSR 00000665: < FAILED >
MSR 00000666: < FAILED >
MSR 00000667: < FAILED >
MSR 00000668: < FAILED >
MSR 00000669: < FAILED >
MSR 0000066A: < FAILED >
MSR 0000066B: < FAILED >
MSR 0000066C: < FAILED >
MSR 0000066D: < FAILED >
MSR 0000066E: < FAILED >
MSR 0000066F: < FAILED >
MSR 00000670: < FAILED >
MSR 00000671: < FAILED >
MSR 00000672: < FAILED >
MSR 00000673: < FAILED >
MSR 00000674: < FAILED >
MSR 00000675: < FAILED >
MSR 00000676: < FAILED >
MSR 00000677: < FAILED >
MSR 00000690: < FAILED >
MSR 000006B0: 0000-0000-0100-0000
MSR 000006B1: 0000-0000-0100-0000
MSR 00000770: 0000-0000-0000-0001
MSR 00000771: 0000-0000-010B-0721
MSR 00000772: 0000-0000-8000-FF01
MSR 00000773: 0000-0000-0000-0005
MSR 00000774: 0000-019E-5400-2101
MSR 00000777: 0000-0000-0000-0004
MSR 00000832: 0000-0000-0000-00D1
MSR 00000838: 0000-0000-0000-0258
MSR 00000839: 0000-0000-0000-01C0
MSR 0000083E: 0000-0000-0000-000A

------[ MSR Registers / Logical CPU #6 ]------

MSR 00000017: 001C-0000-0000-0000 [PlatID = 7]
MSR 0000001B: 0000-0000-FEE0-0C00
MSR 0000002A: 0000-0000-0000-0000
MSR 00000035: 0000-0000-000A-000C
MSR 00000048: 0000-0000-0000-0001
MSR 00000049: < FAILED >
MSR 0000008B: 0000-042A-0000-0000
MSR 000000CD: < FAILED >
MSR 000000CE: 0004-043D-F981-0A00 [eD = 0]
MSR 000000E7: 0000-0010-E006-1030
MSR 000000E8: 0000-002C-BB21-66AF
MSR 000000EE: < FAILED >
MSR 0000010A: 0000-0000-0088-FD6B
MSR 0000010B: < FAILED >
MSR 0000011E: < FAILED >
MSR 00000194: 0000-0000-0011-0A00
MSR 00000198: 0000-224A-0000-2000
MSR 00000199: 0000-0000-0000-0A00
MSR 0000019A: 0000-0000-0000-0000
MSR 0000019B: 0000-0000-0000-0010
MSR 0000019C: 0000-0000-8832-2800
MSR 0000019D: 0000-0000-0000-0000
MSR 000001A0: 0000-0000-0085-0089
MSR 000001A2: 0000-0000-8064-0000
MSR 000001A4: 0000-0000-0000-0000
MSR 000001AA: 0000-0000-0000-30C2
MSR 000001AC: < FAILED >
MSR 000001AD: 2626-2626-2626-262C
MSR 000001AE: 0807-0605-0403-0201
MSR 000001AF: < FAILED >
MSR 000001B0: 0000-0000-0000-0006
MSR 000001B1: 0000-0000-8830-0A82
MSR 000001B2: 0000-0000-0200-0000
MSR 000001FC: 0000-0000-00EC-0059
MSR 00000300: < FAILED >
MSR 0000030A: 0000-0010-02C9-4AB1
MSR 0000030B: 0000-0006-0E08-9078
MSR 00000480: 03DA-0500-0000-0013
MSR 00000481: 0000-00FF-0000-0016
MSR 00000482: FFFB-FFFE-0401-E172
MSR 00000483: F77F-FFFF-0003-6DFF
MSR 00000484: 0076-FFFF-0000-11FF
MSR 00000485: 0000-0000-7004-C1E7
MSR 00000486: 0000-0000-8000-0021
MSR 00000487: 0000-0000-FFFF-FFFF
MSR 00000488: 0000-0000-0000-2000
MSR 00000489: 0000-0000-01F7-2FFF
MSR 0000048A: 0000-0000-0000-002E
MSR 0000048B: 075D-7FFF-0000-0000
MSR 0000048C: 0000-0F01-06F3-4141
MSR 0000048D: 0000-00FF-0000-0016
MSR 0000048E: FFFB-FFFE-0400-6172
MSR 0000048F: F77F-FFFF-0003-6DFB
MSR 00000490: 0076-FFFF-0000-11FB
MSR 00000601: 0000-0000-0000-0280
MSR 00000602: < FAILED >
MSR 00000603: 0036-0000-0036-3636
MSR 00000604: < FAILED >
MSR 00000606: 0000-0000-000A-0E03
MSR 0000060A: 0000-0000-0000-0000
MSR 0000060B: 0000-0000-0000-0000
MSR 0000060C: 0000-0000-0000-0000
MSR 0000060D: 0000-0014-6CA1-BA8E
MSR 00000610: 0042-8138-00DD-80A0
MSR 00000611: 0000-0000-07D6-80E8
MSR 00000613: 0000-0000-0000-0000
MSR 00000614: 0000-0000-0000-00E0
MSR 00000618: 0000-0000-0000-0000
MSR 00000619: 0000-0000-0000-0000
MSR 0000061B: 0000-0000-0000-0000
MSR 0000061C: < FAILED >
MSR 0000061E: < FAILED >
MSR 00000620: 0000-0000-0000-0426
MSR 00000621: 0000-0000-0000-001A
MSR 00000638: 0000-0000-0000-0000
MSR 00000639: 0000-0000-045F-27BB
MSR 0000063A: 0000-0000-0000-0009
MSR 0000063B: < FAILED >
MSR 00000640: 0000-0000-0000-0000
MSR 00000641: 0000-0000-0006-72B3
MSR 00000642: 0000-0000-0000-000D
MSR 00000648: 0000-0000-0000-000A
MSR 00000649: 0000-0000-000A-00A0
MSR 0000064A: 0000-0000-000A-0118
MSR 0000064B: 0000-0000-0000-0000
MSR 0000064C: 0000-0000-0000-0009
MSR 00000650: 2121-2121-2121-2121
MSR 00000651: 0807-0605-0403-0201
MSR 00000660: 0000-000A-1848-8820
MSR 00000661: < FAILED >
MSR 00000662: < FAILED >
MSR 00000663: < FAILED >
MSR 00000664: 0000-0152-782A-1D00
MSR 00000665: < FAILED >
MSR 00000666: < FAILED >
MSR 00000667: < FAILED >
MSR 00000668: < FAILED >
MSR 00000669: < FAILED >
MSR 0000066A: < FAILED >
MSR 0000066B: < FAILED >
MSR 0000066C: < FAILED >
MSR 0000066D: < FAILED >
MSR 0000066E: < FAILED >
MSR 0000066F: < FAILED >
MSR 00000670: < FAILED >
MSR 00000671: < FAILED >
MSR 00000672: < FAILED >
MSR 00000673: < FAILED >
MSR 00000674: < FAILED >
MSR 00000675: < FAILED >
MSR 00000676: < FAILED >
MSR 00000677: < FAILED >
MSR 00000690: < FAILED >
MSR 000006B0: 0000-0000-0100-0000
MSR 000006B1: 0000-0000-0100-0000
MSR 00000770: 0000-0000-0000-0001
MSR 00000771: 0000-0000-010A-0721
MSR 00000772: 0000-0000-8000-FF01
MSR 00000773: 0000-0000-0000-0005
MSR 00000774: 0000-019E-5400-2101
MSR 00000777: 0000-0000-0000-0004
MSR 00000832: 0000-0000-0002-00D1
MSR 00000838: 0000-0000-0000-0209
MSR 00000839: 0000-0000-0000-00FF
MSR 0000083E: 0000-0000-0000-000A

------[ MSR Registers / Logical CPU #7 ]------

MSR 00000017: 001C-0000-0000-0000 [PlatID = 7]
MSR 0000001B: 0000-0000-FEE0-0C00
MSR 0000002A: 0000-0000-0000-0000
MSR 00000035: 0000-0000-000A-000C
MSR 00000048: 0000-0000-0000-0001
MSR 00000049: < FAILED >
MSR 0000008B: 0000-042A-0000-0000
MSR 000000CD: < FAILED >
MSR 000000CE: 0004-043D-F981-0A00 [eD = 0]
MSR 000000E7: 0000-0010-A1C2-4D98
MSR 000000E8: 0000-002D-1325-BAAA
MSR 000000EE: < FAILED >
MSR 0000010A: 0000-0000-0088-FD6B
MSR 0000010B: < FAILED >
MSR 0000011E: < FAILED >
MSR 00000194: 0000-0000-0011-0A00
MSR 00000198: 0000-2271-0000-2000
MSR 00000199: 0000-0000-0000-0A00
MSR 0000019A: 0000-0000-0000-0000
MSR 0000019B: 0000-0000-0000-0010
MSR 0000019C: 0000-0000-8832-2800
MSR 0000019D: 0000-0000-0000-0000
MSR 000001A0: 0000-0000-0085-0089
MSR 000001A2: 0000-0000-8064-0000
MSR 000001A4: 0000-0000-0000-0000
MSR 000001AA: 0000-0000-0000-30C2
MSR 000001AC: < FAILED >
MSR 000001AD: 2626-2626-2626-262C
MSR 000001AE: 0807-0605-0403-0201
MSR 000001AF: < FAILED >
MSR 000001B0: 0000-0000-0000-0006
MSR 000001B1: 0000-0000-8830-0A82
MSR 000001B2: 0000-0000-0200-0000
MSR 000001FC: 0000-0000-00EC-0059
MSR 00000300: < FAILED >
MSR 0000030A: 0000-0011-A4D8-9ABA
MSR 0000030B: 0000-0006-53A2-9818
MSR 00000480: 03DA-0500-0000-0013
MSR 00000481: 0000-00FF-0000-0016
MSR 00000482: FFFB-FFFE-0401-E172
MSR 00000483: F77F-FFFF-0003-6DFF
MSR 00000484: 0076-FFFF-0000-11FF
MSR 00000485: 0000-0000-7004-C1E7
MSR 00000486: 0000-0000-8000-0021
MSR 00000487: 0000-0000-FFFF-FFFF
MSR 00000488: 0000-0000-0000-2000
MSR 00000489: 0000-0000-01F7-2FFF
MSR 0000048A: 0000-0000-0000-002E
MSR 0000048B: 075D-7FFF-0000-0000
MSR 0000048C: 0000-0F01-06F3-4141
MSR 0000048D: 0000-00FF-0000-0016
MSR 0000048E: FFFB-FFFE-0400-6172
MSR 0000048F: F77F-FFFF-0003-6DFB
MSR 00000490: 0076-FFFF-0000-11FB
MSR 00000601: 0000-0000-0000-0280
MSR 00000602: < FAILED >
MSR 00000603: 0036-0000-0036-3636
MSR 00000604: < FAILED >
MSR 00000606: 0000-0000-000A-0E03
MSR 0000060A: 0000-0000-0000-0000
MSR 0000060B: 0000-0000-0000-0000
MSR 0000060C: 0000-0000-0000-0000
MSR 0000060D: 0000-0014-6CA1-BA8E
MSR 00000610: 0042-8138-00DD-80A0
MSR 00000611: 0000-0000-07D6-81E5
MSR 00000613: 0000-0000-0000-0000
MSR 00000614: 0000-0000-0000-00E0
MSR 00000618: 0000-0000-0000-0000
MSR 00000619: 0000-0000-0000-0000
MSR 0000061B: 0000-0000-0000-0000
MSR 0000061C: < FAILED >
MSR 0000061E: < FAILED >
MSR 00000620: 0000-0000-0000-0426
MSR 00000621: 0000-0000-0000-001A
MSR 00000638: 0000-0000-0000-0000
MSR 00000639: 0000-0000-045F-2835
MSR 0000063A: 0000-0000-0000-0009
MSR 0000063B: < FAILED >
MSR 00000640: 0000-0000-0000-0000
MSR 00000641: 0000-0000-0006-72B3
MSR 00000642: 0000-0000-0000-000D
MSR 00000648: 0000-0000-0000-000A
MSR 00000649: 0000-0000-000A-00A0
MSR 0000064A: 0000-0000-000A-0118
MSR 0000064B: 0000-0000-0000-0000
MSR 0000064C: 0000-0000-0000-0009
MSR 00000650: 2121-2121-2121-2121
MSR 00000651: 0807-0605-0403-0201
MSR 00000660: 0000-0009-45FD-30CE
MSR 00000661: < FAILED >
MSR 00000662: < FAILED >
MSR 00000663: < FAILED >
MSR 00000664: 0000-0152-782A-1D00
MSR 00000665: < FAILED >
MSR 00000666: < FAILED >
MSR 00000667: < FAILED >
MSR 00000668: < FAILED >
MSR 00000669: < FAILED >
MSR 0000066A: < FAILED >
MSR 0000066B: < FAILED >
MSR 0000066C: < FAILED >
MSR 0000066D: < FAILED >
MSR 0000066E: < FAILED >
MSR 0000066F: < FAILED >
MSR 00000670: < FAILED >
MSR 00000671: < FAILED >
MSR 00000672: < FAILED >
MSR 00000673: < FAILED >
MSR 00000674: < FAILED >
MSR 00000675: < FAILED >
MSR 00000676: < FAILED >
MSR 00000677: < FAILED >
MSR 00000690: < FAILED >
MSR 000006B0: 0000-0000-0100-0000
MSR 000006B1: 0000-0000-0100-0000
MSR 00000770: 0000-0000-0000-0001
MSR 00000771: 0000-0000-010A-0721
MSR 00000772: 0000-0000-8000-FF01
MSR 00000773: 0000-0000-0000-0005
MSR 00000774: 0000-019E-5400-2101
MSR 00000777: 0000-0000-0000-0004
MSR 00000832: 0000-0000-0000-00D1
MSR 00000838: 0000-0000-0000-0258
MSR 00000839: 0000-0000-0000-01AA
MSR 0000083E: 0000-0000-0000-000A

------[ MSR Registers / Logical CPU #8 ]------

MSR 00000017: 001C-0000-0000-0000 [PlatID = 7]
MSR 0000001B: 0000-0000-FEE0-0C00
MSR 0000002A: 0000-0000-0000-0000
MSR 00000035: 0000-0000-000A-000C
MSR 00000048: 0000-0000-0000-0001
MSR 00000049: < FAILED >
MSR 0000008B: 0000-042A-0000-0000
MSR 000000CD: < FAILED >
MSR 000000CE: 0004-043D-F981-0A00 [eD = 0]
MSR 000000E7: 0000-0019-678F-8B50
MSR 000000E8: 0000-0042-AEAF-1174
MSR 000000EE: < FAILED >
MSR 0000010A: 0000-0000-0088-FD6B
MSR 0000010B: < FAILED >
MSR 0000011E: < FAILED >
MSR 00000194: 0000-0000-0011-0A00
MSR 00000198: 0000-224F-0000-2000
MSR 00000199: 0000-0000-0000-0A00
MSR 0000019A: 0000-0000-0000-0000
MSR 0000019B: 0000-0000-0000-0010
MSR 0000019C: 0000-0000-883A-2800
MSR 0000019D: 0000-0000-0000-0000
MSR 000001A0: 0000-0000-0085-0089
MSR 000001A2: 0000-0000-8064-0000
MSR 000001A4: 0000-0000-0000-0000
MSR 000001AA: 0000-0000-0000-30C2
MSR 000001AC: < FAILED >
MSR 000001AD: 2626-2626-2626-262C
MSR 000001AE: 0807-0605-0403-0201
MSR 000001AF: < FAILED >
MSR 000001B0: 0000-0000-0000-0006
MSR 000001B1: 0000-0000-8831-0A82
MSR 000001B2: 0000-0000-0200-0000
MSR 000001FC: 0000-0000-00EC-0059
MSR 00000300: < FAILED >
MSR 0000030A: 0000-0019-9652-D18A
MSR 0000030B: 0000-0009-A0B4-0F96
MSR 00000480: 03DA-0500-0000-0013
MSR 00000481: 0000-00FF-0000-0016
MSR 00000482: FFFB-FFFE-0401-E172
MSR 00000483: F77F-FFFF-0003-6DFF
MSR 00000484: 0076-FFFF-0000-11FF
MSR 00000485: 0000-0000-7004-C1E7
MSR 00000486: 0000-0000-8000-0021
MSR 00000487: 0000-0000-FFFF-FFFF
MSR 00000488: 0000-0000-0000-2000
MSR 00000489: 0000-0000-01F7-2FFF
MSR 0000048A: 0000-0000-0000-002E
MSR 0000048B: 075D-7FFF-0000-0000
MSR 0000048C: 0000-0F01-06F3-4141
MSR 0000048D: 0000-00FF-0000-0016
MSR 0000048E: FFFB-FFFE-0400-6172
MSR 0000048F: F77F-FFFF-0003-6DFB
MSR 00000490: 0076-FFFF-0000-11FB
MSR 00000601: 0000-0000-0000-0280
MSR 00000602: < FAILED >
MSR 00000603: 0036-0000-0036-3636
MSR 00000604: < FAILED >
MSR 00000606: 0000-0000-000A-0E03
MSR 0000060A: 0000-0000-0000-0000
MSR 0000060B: 0000-0000-0000-0000
MSR 0000060C: 0000-0000-0000-0000
MSR 0000060D: 0000-0014-6CA1-BA8E
MSR 00000610: 0042-8138-00DD-80A0
MSR 00000611: 0000-0000-07D6-827F
MSR 00000613: 0000-0000-0000-0000
MSR 00000614: 0000-0000-0000-00E0
MSR 00000618: 0000-0000-0000-0000
MSR 00000619: 0000-0000-0000-0000
MSR 0000061B: 0000-0000-0000-0000
MSR 0000061C: < FAILED >
MSR 0000061E: < FAILED >
MSR 00000620: 0000-0000-0000-0426
MSR 00000621: 0000-0000-0000-001A
MSR 00000638: 0000-0000-0000-0000
MSR 00000639: 0000-0000-045F-2885
MSR 0000063A: 0000-0000-0000-0009
MSR 0000063B: < FAILED >
MSR 00000640: 0000-0000-0000-0000
MSR 00000641: 0000-0000-0006-72B3
MSR 00000642: 0000-0000-0000-000D
MSR 00000648: 0000-0000-0000-000A
MSR 00000649: 0000-0000-000A-00A0
MSR 0000064A: 0000-0000-000A-0118
MSR 0000064B: 0000-0000-0000-0000
MSR 0000064C: 0000-0000-0000-0009
MSR 00000650: 2121-2121-2121-2121
MSR 00000651: 0807-0605-0403-0201
MSR 00000660: 0000-000D-3A93-365E
MSR 00000661: < FAILED >
MSR 00000662: < FAILED >
MSR 00000663: < FAILED >
MSR 00000664: 0000-014A-430D-68E2
MSR 00000665: < FAILED >
MSR 00000666: < FAILED >
MSR 00000667: < FAILED >
MSR 00000668: < FAILED >
MSR 00000669: < FAILED >
MSR 0000066A: < FAILED >
MSR 0000066B: < FAILED >
MSR 0000066C: < FAILED >
MSR 0000066D: < FAILED >
MSR 0000066E: < FAILED >
MSR 0000066F: < FAILED >
MSR 00000670: < FAILED >
MSR 00000671: < FAILED >
MSR 00000672: < FAILED >
MSR 00000673: < FAILED >
MSR 00000674: < FAILED >
MSR 00000675: < FAILED >
MSR 00000676: < FAILED >
MSR 00000677: < FAILED >
MSR 00000690: < FAILED >
MSR 000006B0: 0000-0000-0100-0000
MSR 000006B1: 0000-0000-0100-0000
MSR 00000770: 0000-0000-0000-0001
MSR 00000771: 0000-0000-010A-0721
MSR 00000772: 0000-0000-8000-FF01
MSR 00000773: 0000-0000-0000-0005
MSR 00000774: 0000-019E-5400-2101
MSR 00000777: 0000-0000-0000-0004
MSR 00000832: 0000-0000-0002-00D1
MSR 00000838: 0000-0000-0000-0209
MSR 00000839: 0000-0000-0000-00FD
MSR 0000083E: 0000-0000-0000-000A

------[ MSR Registers / Logical CPU #9 ]------

MSR 00000017: 001C-0000-0000-0000 [PlatID = 7]
MSR 0000001B: 0000-0000-FEE0-0C00
MSR 0000002A: 0000-0000-0000-0000
MSR 00000035: 0000-0000-000A-000C
MSR 00000048: 0000-0000-0000-0001
MSR 00000049: < FAILED >
MSR 0000008B: 0000-042A-0000-0000
MSR 000000CD: < FAILED >
MSR 000000CE: 0004-043D-F981-0A00 [eD = 0]
MSR 000000E7: 0000-000E-9216-DC08
MSR 000000E8: 0000-0026-D897-1E8A
MSR 000000EE: < FAILED >
MSR 0000010A: 0000-0000-0088-FD6B
MSR 0000010B: < FAILED >
MSR 0000011E: < FAILED >
MSR 00000194: 0000-0000-0011-0A00
MSR 00000198: 0000-2286-0000-2000
MSR 00000199: 0000-0000-0000-0A00
MSR 0000019A: 0000-0000-0000-0000
MSR 0000019B: 0000-0000-0000-0010
MSR 0000019C: 0000-0000-883A-2800
MSR 0000019D: 0000-0000-0000-0000
MSR 000001A0: 0000-0000-0085-0089
MSR 000001A2: 0000-0000-8064-0000
MSR 000001A4: 0000-0000-0000-0000
MSR 000001AA: 0000-0000-0000-30C2
MSR 000001AC: < FAILED >
MSR 000001AD: 2626-2626-2626-262C
MSR 000001AE: 0807-0605-0403-0201
MSR 000001AF: < FAILED >
MSR 000001B0: 0000-0000-0000-0006
MSR 000001B1: 0000-0000-8834-0A82
MSR 000001B2: 0000-0000-0200-0000
MSR 000001FC: 0000-0000-00EC-0059
MSR 00000300: < FAILED >
MSR 0000030A: 0000-000E-6070-5E3F
MSR 0000030B: 0000-0005-3437-8CC2
MSR 00000480: 03DA-0500-0000-0013
MSR 00000481: 0000-00FF-0000-0016
MSR 00000482: FFFB-FFFE-0401-E172
MSR 00000483: F77F-FFFF-0003-6DFF
MSR 00000484: 0076-FFFF-0000-11FF
MSR 00000485: 0000-0000-7004-C1E7
MSR 00000486: 0000-0000-8000-0021
MSR 00000487: 0000-0000-FFFF-FFFF
MSR 00000488: 0000-0000-0000-2000
MSR 00000489: 0000-0000-01F7-2FFF
MSR 0000048A: 0000-0000-0000-002E
MSR 0000048B: 075D-7FFF-0000-0000
MSR 0000048C: 0000-0F01-06F3-4141
MSR 0000048D: 0000-00FF-0000-0016
MSR 0000048E: FFFB-FFFE-0400-6172
MSR 0000048F: F77F-FFFF-0003-6DFB
MSR 00000490: 0076-FFFF-0000-11FB
MSR 00000601: 0000-0000-0000-0280
MSR 00000602: < FAILED >
MSR 00000603: 0036-0000-0036-3636
MSR 00000604: < FAILED >
MSR 00000606: 0000-0000-000A-0E03
MSR 0000060A: 0000-0000-0000-0000
MSR 0000060B: 0000-0000-0000-0000
MSR 0000060C: 0000-0000-0000-0000
MSR 0000060D: 0000-0014-6CA1-BA8E
MSR 00000610: 0042-8138-00DD-80A0
MSR 00000611: 0000-0000-07D6-8393
MSR 00000613: 0000-0000-0000-0000
MSR 00000614: 0000-0000-0000-00E0
MSR 00000618: 0000-0000-0000-0000
MSR 00000619: 0000-0000-0000-0000
MSR 0000061B: 0000-0000-0000-0000
MSR 0000061C: < FAILED >
MSR 0000061E: < FAILED >
MSR 00000620: 0000-0000-0000-0426
MSR 00000621: 0000-0000-0000-001A
MSR 00000638: 0000-0000-0000-0000
MSR 00000639: 0000-0000-045F-2903
MSR 0000063A: 0000-0000-0000-0009
MSR 0000063B: < FAILED >
MSR 00000640: 0000-0000-0000-0000
MSR 00000641: 0000-0000-0006-72B3
MSR 00000642: 0000-0000-0000-000D
MSR 00000648: 0000-0000-0000-000A
MSR 00000649: 0000-0000-000A-00A0
MSR 0000064A: 0000-0000-000A-0118
MSR 0000064B: 0000-0000-0000-0000
MSR 0000064C: 0000-0000-0000-0009
MSR 00000650: 2121-2121-2121-2121
MSR 00000651: 0807-0605-0403-0201
MSR 00000660: 0000-0009-180F-8838
MSR 00000661: < FAILED >
MSR 00000662: < FAILED >
MSR 00000663: < FAILED >
MSR 00000664: 0000-014A-430D-68E2
MSR 00000665: < FAILED >
MSR 00000666: < FAILED >
MSR 00000667: < FAILED >
MSR 00000668: < FAILED >
MSR 00000669: < FAILED >
MSR 0000066A: < FAILED >
MSR 0000066B: < FAILED >
MSR 0000066C: < FAILED >
MSR 0000066D: < FAILED >
MSR 0000066E: < FAILED >
MSR 0000066F: < FAILED >
MSR 00000670: < FAILED >
MSR 00000671: < FAILED >
MSR 00000672: < FAILED >
MSR 00000673: < FAILED >
MSR 00000674: < FAILED >
MSR 00000675: < FAILED >
MSR 00000676: < FAILED >
MSR 00000677: < FAILED >
MSR 00000690: < FAILED >
MSR 000006B0: 0000-0000-0100-0000
MSR 000006B1: 0000-0000-0100-0000
MSR 00000770: 0000-0000-0000-0001
MSR 00000771: 0000-0000-010A-0721
MSR 00000772: 0000-0000-8000-FF01
MSR 00000773: 0000-0000-0000-0005
MSR 00000774: 0000-019E-5400-2101
MSR 00000777: 0000-0000-0000-0004
MSR 00000832: 0000-0000-0000-00D1
MSR 00000838: 0000-0000-0000-0258
MSR 00000839: 0000-0000-0000-0182
MSR 0000083E: 0000-0000-0000-000A

------[ MSR Registers / Logical CPU #10 ]------

MSR 00000017: 001C-0000-0000-0000 [PlatID = 7]
MSR 0000001B: 0000-0000-FEE0-0C00
MSR 0000002A: 0000-0000-0000-0000
MSR 00000035: 0000-0000-000A-000C
MSR 00000048: 0000-0000-0000-0001
MSR 00000049: < FAILED >
MSR 0000008B: 0000-042A-0000-0000
MSR 000000CD: < FAILED >
MSR 000000CE: 0004-043D-F981-0A00 [eD = 0]
MSR 000000E7: 0000-0012-283E-5B68
MSR 000000E8: 0000-0033-05B6-C435
MSR 000000EE: < FAILED >
MSR 0000010A: 0000-0000-0088-FD6B
MSR 0000010B: < FAILED >
MSR 0000011E: < FAILED >
MSR 00000194: 0000-0000-0011-0A00
MSR 00000198: 0000-1ECD-0000-1C00
MSR 00000199: 0000-0000-0000-0A00
MSR 0000019A: 0000-0000-0000-0000
MSR 0000019B: 0000-0000-0000-0010
MSR 0000019C: 0000-0000-8839-2800
MSR 0000019D: 0000-0000-0000-0000
MSR 000001A0: 0000-0000-0085-0089
MSR 000001A2: 0000-0000-8064-0000
MSR 000001A4: 0000-0000-0000-0000
MSR 000001AA: 0000-0000-0000-30C2
MSR 000001AC: < FAILED >
MSR 000001AD: 2626-2626-2626-262C
MSR 000001AE: 0807-0605-0403-0201
MSR 000001AF: < FAILED >
MSR 000001B0: 0000-0000-0000-0006
MSR 000001B1: 0000-0000-8831-0A82
MSR 000001B2: 0000-0000-0200-0000
MSR 000001FC: 0000-0000-00EC-0059
MSR 00000300: < FAILED >
MSR 0000030A: 0000-0011-5DDC-3A9C
MSR 0000030B: 0000-0006-155F-E65C
MSR 00000480: 03DA-0500-0000-0013
MSR 00000481: 0000-00FF-0000-0016
MSR 00000482: FFFB-FFFE-0401-E172
MSR 00000483: F77F-FFFF-0003-6DFF
MSR 00000484: 0076-FFFF-0000-11FF
MSR 00000485: 0000-0000-7004-C1E7
MSR 00000486: 0000-0000-8000-0021
MSR 00000487: 0000-0000-FFFF-FFFF
MSR 00000488: 0000-0000-0000-2000
MSR 00000489: 0000-0000-01F7-2FFF
MSR 0000048A: 0000-0000-0000-002E
MSR 0000048B: 075D-7FFF-0000-0000
MSR 0000048C: 0000-0F01-06F3-4141
MSR 0000048D: 0000-00FF-0000-0016
MSR 0000048E: FFFB-FFFE-0400-6172
MSR 0000048F: F77F-FFFF-0003-6DFB
MSR 00000490: 0076-FFFF-0000-11FB
MSR 00000601: 0000-0000-0000-0280
MSR 00000602: < FAILED >
MSR 00000603: 0036-0000-0036-3636
MSR 00000604: < FAILED >
MSR 00000606: 0000-0000-000A-0E03
MSR 0000060A: 0000-0000-0000-0000
MSR 0000060B: 0000-0000-0000-0000
MSR 0000060C: 0000-0000-0000-0000
MSR 0000060D: 0000-0014-6CA1-BA8E
MSR 00000610: 0042-8138-00DD-80A0
MSR 00000611: 0000-0000-07D6-8438
MSR 00000613: 0000-0000-0000-0000
MSR 00000614: 0000-0000-0000-00E0
MSR 00000618: 0000-0000-0000-0000
MSR 00000619: 0000-0000-0000-0000
MSR 0000061B: 0000-0000-0000-0000
MSR 0000061C: < FAILED >
MSR 0000061E: < FAILED >
MSR 00000620: 0000-0000-0000-0426
MSR 00000621: 0000-0000-0000-001A
MSR 00000638: 0000-0000-0000-0000
MSR 00000639: 0000-0000-045F-2967
MSR 0000063A: 0000-0000-0000-0009
MSR 0000063B: < FAILED >
MSR 00000640: 0000-0000-0000-0000
MSR 00000641: 0000-0000-0006-72B3
MSR 00000642: 0000-0000-0000-000D
MSR 00000648: 0000-0000-0000-000A
MSR 00000649: 0000-0000-000A-00A0
MSR 0000064A: 0000-0000-000A-0118
MSR 0000064B: 0000-0000-0000-0000
MSR 0000064C: 0000-0000-0000-0009
MSR 00000650: 2121-2121-2121-2121
MSR 00000651: 0807-0605-0403-0201
MSR 00000660: 0000-000A-A7FB-FBCA
MSR 00000661: < FAILED >
MSR 00000662: < FAILED >
MSR 00000663: < FAILED >
MSR 00000664: 0000-014A-430D-68E2
MSR 00000665: < FAILED >
MSR 00000666: < FAILED >
MSR 00000667: < FAILED >
MSR 00000668: < FAILED >
MSR 00000669: < FAILED >
MSR 0000066A: < FAILED >
MSR 0000066B: < FAILED >
MSR 0000066C: < FAILED >
MSR 0000066D: < FAILED >
MSR 0000066E: < FAILED >
MSR 0000066F: < FAILED >
MSR 00000670: < FAILED >
MSR 00000671: < FAILED >
MSR 00000672: < FAILED >
MSR 00000673: < FAILED >
MSR 00000674: < FAILED >
MSR 00000675: < FAILED >
MSR 00000676: < FAILED >
MSR 00000677: < FAILED >
MSR 00000690: < FAILED >
MSR 000006B0: 0000-0000-0100-0000
MSR 000006B1: 0000-0000-0100-0000
MSR 00000770: 0000-0000-0000-0001
MSR 00000771: 0000-0000-010A-0721
MSR 00000772: 0000-0000-8000-FF01
MSR 00000773: 0000-0000-0000-0005
MSR 00000774: 0000-019E-5400-2101
MSR 00000777: 0000-0000-0000-0004
MSR 00000832: 0000-0000-0000-00D1
MSR 00000838: 0000-0000-0000-0258
MSR 00000839: 0000-0000-0000-01A0
MSR 0000083E: 0000-0000-0000-000A

------[ MSR Registers / Logical CPU #11 ]------

MSR 00000017: 001C-0000-0000-0000 [PlatID = 7]
MSR 0000001B: 0000-0000-FEE0-0C00
MSR 0000002A: 0000-0000-0000-0000
MSR 00000035: 0000-0000-000A-000C
MSR 00000048: 0000-0000-0000-0001
MSR 00000049: < FAILED >
MSR 0000008B: 0000-042A-0000-0000
MSR 000000CD: < FAILED >
MSR 000000CE: 0004-043D-F981-0A00 [eD = 0]
MSR 000000E7: 0000-001F-48E2-8378
MSR 000000E8: 0000-004B-AD75-0EB7
MSR 000000EE: < FAILED >
MSR 0000010A: 0000-0000-0088-FD6B
MSR 0000010B: < FAILED >
MSR 0000011E: < FAILED >
MSR 00000194: 0000-0000-0011-0A00
MSR 00000198: 0000-22AD-0000-2000
MSR 00000199: 0000-0000-0000-0A00
MSR 0000019A: 0000-0000-0000-0000
MSR 0000019B: 0000-0000-0000-0010
MSR 0000019C: 0000-0000-8839-2800
MSR 0000019D: 0000-0000-0000-0000
MSR 000001A0: 0000-0000-0085-0089
MSR 000001A2: 0000-0000-8064-0000
MSR 000001A4: 0000-0000-0000-0000
MSR 000001AA: 0000-0000-0000-30C2
MSR 000001AC: < FAILED >
MSR 000001AD: 2626-2626-2626-262C
MSR 000001AE: 0807-0605-0403-0201
MSR 000001AF: < FAILED >
MSR 000001B0: 0000-0000-0000-0006
MSR 000001B1: 0000-0000-8834-0A82
MSR 000001B2: 0000-0000-0200-0000
MSR 000001FC: 0000-0000-00EC-0059
MSR 00000300: < FAILED >
MSR 0000030A: 0000-0019-EF70-97FD
MSR 0000030B: 0000-000C-2B7F-6210
MSR 00000480: 03DA-0500-0000-0013
MSR 00000481: 0000-00FF-0000-0016
MSR 00000482: FFFB-FFFE-0401-E172
MSR 00000483: F77F-FFFF-0003-6DFF
MSR 00000484: 0076-FFFF-0000-11FF
MSR 00000485: 0000-0000-7004-C1E7
MSR 00000486: 0000-0000-8000-0021
MSR 00000487: 0000-0000-FFFF-FFFF
MSR 00000488: 0000-0000-0000-2000
MSR 00000489: 0000-0000-01F7-2FFF
MSR 0000048A: 0000-0000-0000-002E
MSR 0000048B: 075D-7FFF-0000-0000
MSR 0000048C: 0000-0F01-06F3-4141
MSR 0000048D: 0000-00FF-0000-0016
MSR 0000048E: FFFB-FFFE-0400-6172
MSR 0000048F: F77F-FFFF-0003-6DFB
MSR 00000490: 0076-FFFF-0000-11FB
MSR 00000601: 0000-0000-0000-0280
MSR 00000602: < FAILED >
MSR 00000603: 0036-0000-0036-3636
MSR 00000604: < FAILED >
MSR 00000606: 0000-0000-000A-0E03
MSR 0000060A: 0000-0000-0000-0000
MSR 0000060B: 0000-0000-0000-0000
MSR 0000060C: 0000-0000-0000-0000
MSR 0000060D: 0000-0014-6CA1-BA8E
MSR 00000610: 0042-8138-00DD-80A0
MSR 00000611: 0000-0000-07D6-8553
MSR 00000613: 0000-0000-0000-0000
MSR 00000614: 0000-0000-0000-00E0
MSR 00000618: 0000-0000-0000-0000
MSR 00000619: 0000-0000-0000-0000
MSR 0000061B: 0000-0000-0000-0000
MSR 0000061C: < FAILED >
MSR 0000061E: < FAILED >
MSR 00000620: 0000-0000-0000-0426
MSR 00000621: 0000-0000-0000-001A
MSR 00000638: 0000-0000-0000-0000
MSR 00000639: 0000-0000-045F-29E3
MSR 0000063A: 0000-0000-0000-0009
MSR 0000063B: < FAILED >
MSR 00000640: 0000-0000-0000-0000
MSR 00000641: 0000-0000-0006-72B3
MSR 00000642: 0000-0000-0000-000D
MSR 00000648: 0000-0000-0000-000A
MSR 00000649: 0000-0000-000A-00A0
MSR 0000064A: 0000-0000-000A-0118
MSR 0000064B: 0000-0000-0000-0000
MSR 0000064C: 0000-0000-0000-0009
MSR 00000650: 2121-2121-2121-2121
MSR 00000651: 0807-0605-0403-0201
MSR 00000660: 0000-000E-0FF4-23F2
MSR 00000661: < FAILED >
MSR 00000662: < FAILED >
MSR 00000663: < FAILED >
MSR 00000664: 0000-014A-430D-68E2
MSR 00000665: < FAILED >
MSR 00000666: < FAILED >
MSR 00000667: < FAILED >
MSR 00000668: < FAILED >
MSR 00000669: < FAILED >
MSR 0000066A: < FAILED >
MSR 0000066B: < FAILED >
MSR 0000066C: < FAILED >
MSR 0000066D: < FAILED >
MSR 0000066E: < FAILED >
MSR 0000066F: < FAILED >
MSR 00000670: < FAILED >
MSR 00000671: < FAILED >
MSR 00000672: < FAILED >
MSR 00000673: < FAILED >
MSR 00000674: < FAILED >
MSR 00000675: < FAILED >
MSR 00000676: < FAILED >
MSR 00000677: < FAILED >
MSR 00000690: < FAILED >
MSR 000006B0: 0000-0000-0100-0000
MSR 000006B1: 0000-0000-0100-0000
MSR 00000770: 0000-0000-0000-0001
MSR 00000771: 0000-0000-010A-0721
MSR 00000772: 0000-0000-8000-FF01
MSR 00000773: 0000-0000-0000-0005
MSR 00000774: 0000-019E-5400-2101
MSR 00000777: 0000-0000-0000-0004
MSR 00000832: 0000-0000-0000-00D1
MSR 00000838: 0000-0000-0000-0258
MSR 00000839: 0000-0000-0000-01AA
MSR 0000083E: 0000-0000-0000-000A

PerformanceFrequency = 10000000

CPU Clock M.Method = 9  (APIC SKL)
PM Timer Address   = 6152  (1808h)

APIC Clock =  99.76 MHz  (AT = 0 / TT = 0 / try = 0 / SKL = 0.00 MHz)
APIC Clock =  99.76 MHz  (AT = 0 / TT = 0 / try = 0 / SKL = 0.00 MHz)
APIC Clock =  99.76 MHz  (AT = 0 / TT = 0 / try = 0 / SKL = 0.00 MHz)
APIC Clock =  99.76 MHz  (AT = 0 / TT = 0 / try = 0 / SKL = 0.00 MHz)
APIC Clock =  99.78 MHz  (AT = 0 / TT = 0 / try = 0 / SKL = 0.00 MHz)

CPU Clock = 2992.68 MHz / TSC Clock =  998.40 MHz / CPU Mul = 30.00x
CPU Clock =  897.80 MHz / TSC Clock =  998.40 MHz / CPU Mul =  9.00x
CPU Clock =  897.80 MHz / TSC Clock =  998.40 MHz / CPU Mul =  9.00x
CPU Clock =  798.05 MHz / TSC Clock =  998.40 MHz / CPU Mul =  8.00x
CPU Clock =  798.05 MHz / TSC Clock =  998.40 MHz / CPU Mul =  8.00x

CPU Clock Max = 4389.26 MHz / TSC Clock =  998.40 MHz / CPU Mul = 44.00x
CPU Clock Max = 4389.26 MHz / TSC Clock =  998.40 MHz / CPU Mul = 44.00x
CPU Clock Max = 3790.73 MHz / TSC Clock =  998.40 MHz / CPU Mul = 38.00x
CPU Clock Max = 4389.26 MHz / TSC Clock =  998.40 MHz / CPU Mul = 44.00x
CPU Clock Max = 3790.73 MHz / TSC Clock =  998.40 MHz / CPU Mul = 38.00x

INTPERFCTR2 = 4351.33 MHz / INTPERFCTR1 (TSC) =  998.41 MHz
INTPERFCTR2 = 4362.79 MHz / INTPERFCTR1 (TSC) =  997.90 MHz
INTPERFCTR2 = 3129.18 MHz / INTPERFCTR1 (TSC) =  998.40 MHz
INTPERFCTR2 = 3133.60 MHz / INTPERFCTR1 (TSC) =  998.49 MHz
INTPERFCTR2 = 3052.65 MHz / INTPERFCTR1 (TSC) =  998.23 MHz

------[ OC MailBox ]------

C 01 / P1 00 / P2 00: 0000062C
C 01 / P1 01 / P2 00: 00000616
C 01 / P1 02 / P2 00: 00000626
C 01 / P1 03 / P2 00: 00000616
C 01 / P1 04 / P2 00: 00000600
C 02 / P1 00 / P2 00: 2626262C
C 02 / P1 00 / P2 01: 21212121
C 02 / P1 00 / P2 02: 00000000
C 02 / P1 00 / P2 03: 00000000
C 02 / P1 01 / P2 00: 26262626
C 02 / P1 01 / P2 01: 21212121
C 02 / P1 01 / P2 02: 00000000
C 02 / P1 01 / P2 03: 00000000
C 02 / P1 02 / P2 00: 00000000
C 02 / P1 02 / P2 01: 00000000
C 02 / P1 02 / P2 02: 00000000
C 02 / P1 02 / P2 03: 00000000
C 02 / P1 03 / P2 00: 00000000
C 02 / P1 03 / P2 01: 00000000
C 02 / P1 03 / P2 02: 00000000
C 02 / P1 03 / P2 03: 00000000
C 02 / P1 04 / P2 00: 00000000
C 02 / P1 04 / P2 01: 00000000
C 02 / P1 04 / P2 02: 00000000
C 02 / P1 04 / P2 03: 00000000
C 02 / P1 05 / P2 00: 00000000
C 02 / P1 05 / P2 01: 00000000
C 02 / P1 05 / P2 02: 00000000
C 02 / P1 05 / P2 03: 00000000
C 02 / P1 06 / P2 00: 00000000
C 02 / P1 06 / P2 01: 00000000
C 02 / P1 06 / P2 02: 00000000
C 02 / P1 06 / P2 03: 00000000
C 02 / P1 07 / P2 00: 00000000
C 02 / P1 07 / P2 01: 00000000
C 02 / P1 07 / P2 02: 00000000
C 02 / P1 07 / P2 03: 00000000
C 03 / P1 00 / P2 00: 0001080C
C 03 / P1 01 / P2 00: 0001080C
C 03 / P1 02 / P2 00: 0001080C
C 03 / P1 03 / P2 00: 0001080C
C 04 / P1 00 / P2 00: 3C042008
C 05 / P1 00 / P2 00: 00000000
C 10 / P1 00 / P2 00: 00000000
C 10 / P1 01 / P2 00: 00000000
C 10 / P1 02 / P2 00: 00000000
C 10 / P1 03 / P2 00: 00000000
C 10 / P1 04 / P2 00: 00000000
C 12 / P1 00 / P2 00: 00000000
C 12 / P1 01 / P2 00: 00000000
C 12 / P1 02 / P2 00: 00000000
C 14 / P1 00 / P2 00: 00000000
C 16 / P1 00 / P2 00: 00000140
C 18 / P1 00 / P2 00: 00000004
C 1A / P1 00 / P2 00: 00000000
C 1C / P1 00 / P2 00: 00002C2C  [CPU0]
C 1C / P1 00 / P2 00: 00002C2C  [CPU1]
C 1C / P1 00 / P2 00: 00002C2C  [CPU2]
C 1C / P1 00 / P2 00: 00002C2C  [CPU3]
C 1C / P1 00 / P2 00: 00002121  [CPU4]
C 1C / P1 00 / P2 00: 00002121  [CPU5]
C 1C / P1 00 / P2 00: 00002121  [CPU6]
C 1C / P1 00 / P2 00: 00002121  [CPU7]
C 1C / P1 00 / P2 00: 00002121  [CPU8]
C 1C / P1 00 / P2 00: 00002121  [CPU9]
C 1C / P1 00 / P2 00: 00002121  [CPU10]
C 1C / P1 00 / P2 00: 00002121  [CPU11]
