------[ Versions ]------

Program Version : EVEREST v5.00.1650
BenchDLL Version: 2.4.257.0

------[ CPU Info ]------

CPU Type           : Intel Pentium 4, 2800 MHz (14 x 200)
CPU Alias          : Northwood HyperThreading
CPU Platform       : Socket 478
CPU Stepping       : D1
Instruction Set    : x86, MMX, SSE, SSE2
CPUID Manufacturer : GenuineIntel
CPUID CPU Name     : Intel(R) Pentium(R) 4 CPU 2.80GHz
CPUID Revision     : 00000F29h
IA Brand ID        : 09h  (Intel Pentium 4)
Platform ID        : 1Fh  (Socket 478)

------[ Logical CPU #0 ]------

allcpu: Valid

CPUID 00000000: 00000002-756E6547-6C65746E-49656E69
CPUID 00000001: 00000F29-00020809-00004400-BFEBFBFF
CPUID 00000002: 665B5001-00000000-00000000-007B7040
CPUID 80000000: 80000004-00000000-00000000-00000000
CPUID 80000001: 00000000-00000000-00000000-00000000
CPUID 80000002: 20202020-20202020-20202020-6E492020
CPUID 80000003: 286C6574-50202952-69746E65-52286D75
CPUID 80000004: 20342029-20555043-30382E32-007A4847

------[ Logical CPU #1 ]------

allcpu: Valid, Virtual

CPUID 00000000: 00000002-756E6547-6C65746E-49656E69
CPUID 00000001: 00000F29-01020809-00004400-BFEBFBFF
CPUID 00000002: 665B5001-00000000-00000000-007B7040
CPUID 80000000: 80000004-00000000-00000000-00000000
CPUID 80000001: 00000000-00000000-00000000-00000000
CPUID 80000002: 20202020-20202020-20202020-6E492020
CPUID 80000003: 286C6574-50202952-69746E65-52286D75
CPUID 80000004: 20342029-20555043-30382E32-007A4847

------[ MSR Registers ]------

MSR 00000017: 000A-0000-0000-0000 [PlatID = 2]
MSR 0000001B: 0000-0000-FEE0-0900
MSR 0000002A: 0000-0000-0000-0080
MSR 0000002C: 0000-0000-0E12-000E
MSR 0000008B: 0000-002E-0000-0000
MSR 0000019A: 0000-0000-0000-0002
MSR 0000019B: 0000-0000-0000-0000
MSR 0000019C: 0000-0000-0000-0000
MSR 000001A0: 0000-0000-0000-00C9

PerformanceFrequency = 2839800000

Tjmax Temperature = 0 Celsius
