------[ CPUID Registers / Logical CPU #0 ]------

allcpu: Package 0 / Core 0 / Thread 0: Valid

CPUID 00000000: 0000001B-756E6547-6C65746E-49656E69 [GenuineIntel]
CPUID 00000001: 00090661-00800800-4FF8EBBF-BFEBFBFF
CPUID 00000002: 00FEFF01-00000000-00000000-00000000
CPUID 00000003: 00000000-00000000-00000000-00000000
CPUID 00000004: FC000121-01C0003F-0000003F-00000000 [SL 00] [L1D: 32 KB]
CPUID 00000004: FC000122-01C0003F-0000003F-00000000 [SL 01] [L1I: 32 KB]
CPUID 00000004: FC01C143-02C0003F-000007FF-00000000 [SL 02] [L2U: 1536 KB]
CPUID 00000004: FC1FC163-03C0003F-00000FFF-00000006 [SL 03] [L3U: 4 MB]
CPUID 00000005: 00000040-00000040-00000003-11122020
CPUID 00000006: 00178FF7-00000002-00000009-00000000
CPUID 00000007: 00000000-2394A2C3-18400124-FC000400
CPUID 00000008: 00000000-00000000-00000000-00000000
CPUID 00000009: 00000000-00000000-00000000-00000000
CPUID 0000000A: 07300405-00000000-00000007-00008603
CPUID 0000000B: 00000001-00000001-00000100-00000000 [SL 00]
CPUID 0000000B: 00000007-00000004-00000201-00000000 [SL 01]
CPUID 0000000C: 00000000-00000000-00000000-00000000
CPUID 0000000D: 00000003-00000240-00000240-00000000 [SL 00] [x87]
CPUID 0000000D: 0000000F-000002C0-00000100-00000000 [SL 01] [SSE]
CPUID 0000000D: 00000080-00000000-00000001-00000000 [SL 08] [PT]
CPUID 0000000E: 00000000-00000000-00000000-00000000
CPUID 0000000F: 00000000-00000000-00000000-00000000 [SL 00]
CPUID 0000000F: 00000000-00000000-00000000-00000000 [SL 01]
CPUID 00000010: 00000000-00000004-00000000-00000000 [SL 00]
CPUID 00000010: 00000000-00000000-00000000-00000000 [SL 01]
CPUID 00000011: 00000000-00000000-00000000-00000000
CPUID 00000012: 00000000-00000000-00000000-00000000 [SL 00]
CPUID 00000012: 00000000-00000000-00000000-00000000 [SL 01]
CPUID 00000013: 00000000-00000000-00000000-00000000
CPUID 00000014: 00000001-0000007F-80000007-00000000 [SL 00]
CPUID 00000014: 02490002-003FFFFF-00000000-00000000 [SL 01]
CPUID 00000015: 00000002-00000068-0249F000-00000000 [52.00x / 38400000]
CPUID 00000016: 000007D0-00000A28-00000064-00000000 [2000 / 2600 / 100]
CPUID 00000017: 00000000-00000000-00000000-00000000 [SL 00]
CPUID 00000018: 00000005-00000000-00000000-00000000 [SL 00]
CPUID 00000018: 00000000-00300001-00000001-00000121 [SL 01]
CPUID 00000018: 00000000-00040001-00000100-00000043 [SL 02]
CPUID 00000018: 00000000-00040006-00000010-00000043 [SL 03]
CPUID 00000018: 00000000-00300001-00000001-00000122 [SL 04]
CPUID 00000018: 00000000-00000000-00000000-00000000 [SL 05]
CPUID 00000019: 00000000-00000000-00000000-00000000
CPUID 0000001A: 20000000-00000000-00000000-00000000
CPUID 0000001B: 00000000-00000000-00000000-00000000
CPUID 80000000: 80000008-00000000-00000000-00000000
CPUID 80000001: 00000000-00000000-00000101-28100000
CPUID 80000002: 65746E49-2952286C-6C654320-6E6F7265 [Intel(R) Celeron]
CPUID 80000003: 20295228-3134364A-20402032-30302E32 [(R) J6412 @ 2.00]
CPUID 80000004: 007A4847-00000000-00000000-00000000 [GHz]
CPUID 80000005: 00000000-00000000-00000000-00000000 [L1D: 0 KB / L1I: 0 KB]
CPUID 80000006: 00000000-00000000-06006040-00000000 [L2: 1536 KB] / L3: 0 KB]
CPUID 80000007: 00000000-00000000-00000000-00000100
CPUID 80000008: 00003027-00000000-00000000-00000000

L1    Data Cache:    32 KB,  8-way Associative, 64-byte Line
L1  Instr. Cache:    32 KB,  8-way Associative, 64-byte Line
L2 Unified Cache:  1536 KB, 12-way Associative, 64-byte Line
L3 Unified Cache:     4 MB, 16-way Associative, 64-byte Line

------[ CPUID Registers / Logical CPU #1 ]------

allcpu: Package 0 / Core 1 / Thread 0: Valid

CPUID 00000000: 0000001B-756E6547-6C65746E-49656E69 [GenuineIntel]
CPUID 00000001: 00090661-02800800-4FF8EBBF-BFEBFBFF
CPUID 00000002: 00FEFF01-00000000-00000000-00000000
CPUID 00000003: 00000000-00000000-00000000-00000000
CPUID 00000004: FC000121-01C0003F-0000003F-00000000 [SL 00] [L1D: 32 KB]
CPUID 00000004: FC000122-01C0003F-0000003F-00000000 [SL 01] [L1I: 32 KB]
CPUID 00000004: FC01C143-02C0003F-000007FF-00000000 [SL 02] [L2U: 1536 KB]
CPUID 00000004: FC1FC163-03C0003F-00000FFF-00000006 [SL 03] [L3U: 4 MB]
CPUID 00000005: 00000040-00000040-00000003-11122020
CPUID 00000006: 00178FF7-00000002-00000009-00000000
CPUID 00000007: 00000000-2394A2C3-18400124-FC000400
CPUID 00000008: 00000000-00000000-00000000-00000000
CPUID 00000009: 00000000-00000000-00000000-00000000
CPUID 0000000A: 07300405-00000000-00000007-00008603
CPUID 0000000B: 00000001-00000001-00000100-00000002 [SL 00]
CPUID 0000000B: 00000007-00000004-00000201-00000002 [SL 01]
CPUID 0000000C: 00000000-00000000-00000000-00000000
CPUID 0000000D: 00000003-00000240-00000240-00000000 [SL 00] [x87]
CPUID 0000000D: 0000000F-000002C0-00000100-00000000 [SL 01] [SSE]
CPUID 0000000D: 00000080-00000000-00000001-00000000 [SL 08] [PT]
CPUID 0000000E: 00000000-00000000-00000000-00000000
CPUID 0000000F: 00000000-00000000-00000000-00000000 [SL 00]
CPUID 0000000F: 00000000-00000000-00000000-00000000 [SL 01]
CPUID 00000010: 00000000-00000004-00000000-00000000 [SL 00]
CPUID 00000010: 00000000-00000000-00000000-00000000 [SL 01]
CPUID 00000011: 00000000-00000000-00000000-00000000
CPUID 00000012: 00000000-00000000-00000000-00000000 [SL 00]
CPUID 00000012: 00000000-00000000-00000000-00000000 [SL 01]
CPUID 00000013: 00000000-00000000-00000000-00000000
CPUID 00000014: 00000001-0000007F-80000007-00000000 [SL 00]
CPUID 00000014: 02490002-003FFFFF-00000000-00000000 [SL 01]
CPUID 00000015: 00000002-00000068-0249F000-00000000 [52.00x / 38400000]
CPUID 00000016: 000007D0-00000A28-00000064-00000000 [2000 / 2600 / 100]
CPUID 00000017: 00000000-00000000-00000000-00000000 [SL 00]
CPUID 00000018: 00000005-00000000-00000000-00000000 [SL 00]
CPUID 00000018: 00000000-00300001-00000001-00000121 [SL 01]
CPUID 00000018: 00000000-00040001-00000100-00000043 [SL 02]
CPUID 00000018: 00000000-00040006-00000010-00000043 [SL 03]
CPUID 00000018: 00000000-00300001-00000001-00000122 [SL 04]
CPUID 00000018: 00000000-00000000-00000000-00000000 [SL 05]
CPUID 00000019: 00000000-00000000-00000000-00000000
CPUID 0000001A: 20000000-00000000-00000000-00000000
CPUID 0000001B: 00000000-00000000-00000000-00000000
CPUID 80000000: 80000008-00000000-00000000-00000000
CPUID 80000001: 00000000-00000000-00000101-28100000
CPUID 80000002: 65746E49-2952286C-6C654320-6E6F7265 [Intel(R) Celeron]
CPUID 80000003: 20295228-3134364A-20402032-30302E32 [(R) J6412 @ 2.00]
CPUID 80000004: 007A4847-00000000-00000000-00000000 [GHz]
CPUID 80000005: 00000000-00000000-00000000-00000000 [L1D: 0 KB / L1I: 0 KB]
CPUID 80000006: 00000000-00000000-06006040-00000000 [L2: 1536 KB] / L3: 0 KB]
CPUID 80000007: 00000000-00000000-00000000-00000100
CPUID 80000008: 00003027-00000000-00000000-00000000

L1    Data Cache:    32 KB,  8-way Associative, 64-byte Line
L1  Instr. Cache:    32 KB,  8-way Associative, 64-byte Line
L2 Unified Cache:  1536 KB, 12-way Associative, 64-byte Line
L3 Unified Cache:     4 MB, 16-way Associative, 64-byte Line

------[ CPUID Registers / Logical CPU #2 ]------

allcpu: Package 0 / Core 2 / Thread 0: Valid

CPUID 00000000: 0000001B-756E6547-6C65746E-49656E69 [GenuineIntel]
CPUID 00000001: 00090661-04800800-4FF8EBBF-BFEBFBFF
CPUID 00000002: 00FEFF01-00000000-00000000-00000000
CPUID 00000003: 00000000-00000000-00000000-00000000
CPUID 00000004: FC000121-01C0003F-0000003F-00000000 [SL 00] [L1D: 32 KB]
CPUID 00000004: FC000122-01C0003F-0000003F-00000000 [SL 01] [L1I: 32 KB]
CPUID 00000004: FC01C143-02C0003F-000007FF-00000000 [SL 02] [L2U: 1536 KB]
CPUID 00000004: FC1FC163-03C0003F-00000FFF-00000006 [SL 03] [L3U: 4 MB]
CPUID 00000005: 00000040-00000040-00000003-11122020
CPUID 00000006: 00178FF7-00000002-00000009-00000000
CPUID 00000007: 00000000-2394A2C3-18400124-FC000400
CPUID 00000008: 00000000-00000000-00000000-00000000
CPUID 00000009: 00000000-00000000-00000000-00000000
CPUID 0000000A: 07300405-00000000-00000007-00008603
CPUID 0000000B: 00000001-00000001-00000100-00000004 [SL 00]
CPUID 0000000B: 00000007-00000004-00000201-00000004 [SL 01]
CPUID 0000000C: 00000000-00000000-00000000-00000000
CPUID 0000000D: 00000003-00000240-00000240-00000000 [SL 00] [x87]
CPUID 0000000D: 0000000F-000002C0-00000100-00000000 [SL 01] [SSE]
CPUID 0000000D: 00000080-00000000-00000001-00000000 [SL 08] [PT]
CPUID 0000000E: 00000000-00000000-00000000-00000000
CPUID 0000000F: 00000000-00000000-00000000-00000000 [SL 00]
CPUID 0000000F: 00000000-00000000-00000000-00000000 [SL 01]
CPUID 00000010: 00000000-00000004-00000000-00000000 [SL 00]
CPUID 00000010: 00000000-00000000-00000000-00000000 [SL 01]
CPUID 00000011: 00000000-00000000-00000000-00000000
CPUID 00000012: 00000000-00000000-00000000-00000000 [SL 00]
CPUID 00000012: 00000000-00000000-00000000-00000000 [SL 01]
CPUID 00000013: 00000000-00000000-00000000-00000000
CPUID 00000014: 00000001-0000007F-80000007-00000000 [SL 00]
CPUID 00000014: 02490002-003FFFFF-00000000-00000000 [SL 01]
CPUID 00000015: 00000002-00000068-0249F000-00000000 [52.00x / 38400000]
CPUID 00000016: 000007D0-00000A28-00000064-00000000 [2000 / 2600 / 100]
CPUID 00000017: 00000000-00000000-00000000-00000000 [SL 00]
CPUID 00000018: 00000005-00000000-00000000-00000000 [SL 00]
CPUID 00000018: 00000000-00300001-00000001-00000121 [SL 01]
CPUID 00000018: 00000000-00040001-00000100-00000043 [SL 02]
CPUID 00000018: 00000000-00040006-00000010-00000043 [SL 03]
CPUID 00000018: 00000000-00300001-00000001-00000122 [SL 04]
CPUID 00000018: 00000000-00000000-00000000-00000000 [SL 05]
CPUID 00000019: 00000000-00000000-00000000-00000000
CPUID 0000001A: 20000000-00000000-00000000-00000000
CPUID 0000001B: 00000000-00000000-00000000-00000000
CPUID 80000000: 80000008-00000000-00000000-00000000
CPUID 80000001: 00000000-00000000-00000101-28100000
CPUID 80000002: 65746E49-2952286C-6C654320-6E6F7265 [Intel(R) Celeron]
CPUID 80000003: 20295228-3134364A-20402032-30302E32 [(R) J6412 @ 2.00]
CPUID 80000004: 007A4847-00000000-00000000-00000000 [GHz]
CPUID 80000005: 00000000-00000000-00000000-00000000 [L1D: 0 KB / L1I: 0 KB]
CPUID 80000006: 00000000-00000000-06006040-00000000 [L2: 1536 KB] / L3: 0 KB]
CPUID 80000007: 00000000-00000000-00000000-00000100
CPUID 80000008: 00003027-00000000-00000000-00000000

L1    Data Cache:    32 KB,  8-way Associative, 64-byte Line
L1  Instr. Cache:    32 KB,  8-way Associative, 64-byte Line
L2 Unified Cache:  1536 KB, 12-way Associative, 64-byte Line
L3 Unified Cache:     4 MB, 16-way Associative, 64-byte Line

------[ CPUID Registers / Logical CPU #3 ]------

allcpu: Package 0 / Core 3 / Thread 0: Valid

CPUID 00000000: 0000001B-756E6547-6C65746E-49656E69 [GenuineIntel]
CPUID 00000001: 00090661-06800800-4FF8EBBF-BFEBFBFF
CPUID 00000002: 00FEFF01-00000000-00000000-00000000
CPUID 00000003: 00000000-00000000-00000000-00000000
CPUID 00000004: FC000121-01C0003F-0000003F-00000000 [SL 00] [L1D: 32 KB]
CPUID 00000004: FC000122-01C0003F-0000003F-00000000 [SL 01] [L1I: 32 KB]
CPUID 00000004: FC01C143-02C0003F-000007FF-00000000 [SL 02] [L2U: 1536 KB]
CPUID 00000004: FC1FC163-03C0003F-00000FFF-00000006 [SL 03] [L3U: 4 MB]
CPUID 00000005: 00000040-00000040-00000003-11122020
CPUID 00000006: 00178FF7-00000002-00000009-00000000
CPUID 00000007: 00000000-2394A2C3-18400124-FC000400
CPUID 00000008: 00000000-00000000-00000000-00000000
CPUID 00000009: 00000000-00000000-00000000-00000000
CPUID 0000000A: 07300405-00000000-00000007-00008603
CPUID 0000000B: 00000001-00000001-00000100-00000006 [SL 00]
CPUID 0000000B: 00000007-00000004-00000201-00000006 [SL 01]
CPUID 0000000C: 00000000-00000000-00000000-00000000
CPUID 0000000D: 00000003-00000240-00000240-00000000 [SL 00] [x87]
CPUID 0000000D: 0000000F-000002C0-00000100-00000000 [SL 01] [SSE]
CPUID 0000000D: 00000080-00000000-00000001-00000000 [SL 08] [PT]
CPUID 0000000E: 00000000-00000000-00000000-00000000
CPUID 0000000F: 00000000-00000000-00000000-00000000 [SL 00]
CPUID 0000000F: 00000000-00000000-00000000-00000000 [SL 01]
CPUID 00000010: 00000000-00000004-00000000-00000000 [SL 00]
CPUID 00000010: 00000000-00000000-00000000-00000000 [SL 01]
CPUID 00000011: 00000000-00000000-00000000-00000000
CPUID 00000012: 00000000-00000000-00000000-00000000 [SL 00]
CPUID 00000012: 00000000-00000000-00000000-00000000 [SL 01]
CPUID 00000013: 00000000-00000000-00000000-00000000
CPUID 00000014: 00000001-0000007F-80000007-00000000 [SL 00]
CPUID 00000014: 02490002-003FFFFF-00000000-00000000 [SL 01]
CPUID 00000015: 00000002-00000068-0249F000-00000000 [52.00x / 38400000]
CPUID 00000016: 000007D0-00000A28-00000064-00000000 [2000 / 2600 / 100]
CPUID 00000017: 00000000-00000000-00000000-00000000 [SL 00]
CPUID 00000018: 00000005-00000000-00000000-00000000 [SL 00]
CPUID 00000018: 00000000-00300001-00000001-00000121 [SL 01]
CPUID 00000018: 00000000-00040001-00000100-00000043 [SL 02]
CPUID 00000018: 00000000-00040006-00000010-00000043 [SL 03]
CPUID 00000018: 00000000-00300001-00000001-00000122 [SL 04]
CPUID 00000018: 00000000-00000000-00000000-00000000 [SL 05]
CPUID 00000019: 00000000-00000000-00000000-00000000
CPUID 0000001A: 20000000-00000000-00000000-00000000
CPUID 0000001B: 00000000-00000000-00000000-00000000
CPUID 80000000: 80000008-00000000-00000000-00000000
CPUID 80000001: 00000000-00000000-00000101-28100000
CPUID 80000002: 65746E49-2952286C-6C654320-6E6F7265 [Intel(R) Celeron]
CPUID 80000003: 20295228-3134364A-20402032-30302E32 [(R) J6412 @ 2.00]
CPUID 80000004: 007A4847-00000000-00000000-00000000 [GHz]
CPUID 80000005: 00000000-00000000-00000000-00000000 [L1D: 0 KB / L1I: 0 KB]
CPUID 80000006: 00000000-00000000-06006040-00000000 [L2: 1536 KB] / L3: 0 KB]
CPUID 80000007: 00000000-00000000-00000000-00000100
CPUID 80000008: 00003027-00000000-00000000-00000000

L1    Data Cache:    32 KB,  8-way Associative, 64-byte Line
L1  Instr. Cache:    32 KB,  8-way Associative, 64-byte Line
L2 Unified Cache:  1536 KB, 12-way Associative, 64-byte Line
L3 Unified Cache:     4 MB, 16-way Associative, 64-byte Line

------[ All CPUs ]------

CPU   0: APICID    0 / Package 0 / Core   0 / Thread 0: Valid
CPU   1: APICID    2 / Package 0 / Core   1 / Thread 0: Valid
CPU   2: APICID    4 / Package 0 / Core   2 / Thread 0: Valid
CPU   3: APICID    6 / Package 0 / Core   3 / Thread 0: Valid

------[ MSR Registers / Logical CPU #0 ]------

MSR 00000017: 0000-0000-0000-0000 [PlatID = 0]
MSR 0000001B: 0000-0000-FEE0-0900
MSR 0000002A: 0000-0000-0000-0000
MSR 00000035: 0000-0000-0004-0004
MSR 00000048: 0000-0000-0000-0000
MSR 00000049: < FAILED >
MSR 0000008B: 0000-0011-0000-0000
MSR 000000CD: < FAILED >
MSR 000000CE: 0004-0830-F001-1400 [eD = 0]
MSR 000000E7: 0000-001B-0CC2-C76C [S200]
MSR 000000E7: 0000-001B-0CDC-1AC8 [S200]
MSR 000000E7: 0000-001B-0D09-B348
MSR 000000E8: 0000-0021-75A2-752B [S200]
MSR 000000E8: 0000-0021-75A9-0A65 [S200]
MSR 000000E8: 0000-0021-75BB-04CD
MSR 000000EE: < FAILED >
MSR 0000010A: 0000-0000-0000-006B
MSR 0000010B: < FAILED >
MSR 0000011E: < FAILED >
MSR 00000194: 0000-0000-0001-0000
MSR 00000198: 0000-1FD7-0000-1A00 [S200]
MSR 00000198: 0000-1FD7-0000-1A00 [S200]
MSR 00000198: 0000-1FD7-0000-1A00
MSR 00000199: 0000-0000-0000-1400
MSR 0000019A: 0000-0000-0000-0000
MSR 0000019B: 0000-0000-0000-0010
MSR 0000019C: 0000-0000-8845-0000 [S200]
MSR 0000019C: 0000-0000-8845-0000 [S200]
MSR 0000019C: 0000-0000-8845-0000
MSR 0000019D: 0000-0000-0000-0000
MSR 000001A0: 0000-0000-0085-0089
MSR 000001A2: 0000-0000-8069-0000
MSR 000001A4: 0000-0000-0000-0000
MSR 000001AA: 0000-0000-0040-10C0
MSR 000001AC: < FAILED >
MSR 000001AD: 1A1A-1A1A-1A1A-1A1A
MSR 000001B0: 0000-0000-0000-0006
MSR 000001B1: 0000-0000-883E-0000
MSR 000001B2: 0000-0000-0000-0000
MSR 000001FC: 0000-0000-0864-005D
MSR 00000300: < FAILED >
MSR 0000030A: 0000-0000-0000-0000 [S200]
MSR 0000030A: 0000-0000-0000-0000 [S200]
MSR 0000030A: 0000-0000-0000-0000
MSR 0000030B: 0000-0000-0000-0000 [S200]
MSR 0000030B: 0000-0000-0000-0000 [S200]
MSR 0000030B: 0000-0000-0000-0000
MSR 00000480: 00DA-0500-0000-0013
MSR 00000481: 0000-00FF-0000-0016
MSR 00000482: FFF9-FFFE-0401-E172
MSR 00000483: 037F-FFFF-0003-6DFF
MSR 00000484: 0006-FFFF-0000-11FF
MSR 00000485: 0000-0000-7004-C1E7
MSR 00000486: 0000-0000-8000-0021
MSR 00000487: 0000-0000-FFFF-FFFF
MSR 00000488: 0000-0000-0000-2000
MSR 00000489: 0000-0000-0035-2FFF
MSR 0000048A: 0000-0000-0000-002E
MSR 0000048B: 07DD-6FFF-0000-0000
MSR 0000048C: 0000-0F01-0671-4141
MSR 0000048D: 0000-00FF-0000-0016
MSR 0000048E: FFF9-FFFE-0400-6172
MSR 0000048F: 037F-FFFF-0003-6DFB
MSR 00000490: 0006-FFFF-0000-11FB
MSR 00000601: 0000-0000-0000-0000
MSR 00000602: < FAILED >
MSR 00000603: 0036-0000-0036-3636
MSR 00000604: < FAILED >
MSR 00000606: 0000-0000-000A-0E03
MSR 0000060A: 0000-0000-0000-0000
MSR 0000060B: 0000-0000-0000-0000
MSR 0000060C: 0000-0000-0000-0000
MSR 0000060D: 0000-0000-0000-0000
MSR 00000610: 0042-8064-00DD-8050
MSR 00000611: 0000-0000-0111-04E5 [S200]
MSR 00000611: 0000-0000-0111-3944 [S200]
MSR 00000611: 0000-0000-0111-6E44
MSR 00000613: 0000-0000-0000-0000
MSR 00000614: 0000-0000-0000-0050
MSR 00000618: 0054-00DE-0000-0000
MSR 00000619: 0000-0000-0000-0000 [S200]
MSR 00000619: 0000-0000-0000-0000 [S200]
MSR 00000619: 0000-0000-0000-0000
MSR 0000061B: 0000-0000-0000-0000
MSR 0000061C: < FAILED >
MSR 00000638: 0000-0000-0000-0000
MSR 00000639: 0000-0000-007A-5BB0 [S200]
MSR 00000639: 0000-0000-007A-7169 [S200]
MSR 00000639: 0000-0000-007A-86EB
MSR 0000063A: 0000-0000-0000-0009
MSR 0000063B: < FAILED >
MSR 00000640: 0000-0000-0000-0000
MSR 00000641: 0000-0000-0000-3271 [S200]
MSR 00000641: 0000-0000-0000-3271 [S200]
MSR 00000641: 0000-0000-0000-3271
MSR 00000642: 0000-0000-0000-000D
MSR 00000660: 0000-0053-FA56-DA7C
MSR 00000661: < FAILED >
MSR 00000662: < FAILED >
MSR 00000663: < FAILED >
MSR 00000664: 0000-0000-0000-0000
MSR 00000665: < FAILED >
MSR 00000666: < FAILED >
MSR 00000667: < FAILED >
MSR 00000668: < FAILED >
MSR 00000669: < FAILED >
MSR 0000066A: < FAILED >
MSR 0000066B: < FAILED >
MSR 0000066C: < FAILED >
MSR 0000066D: < FAILED >
MSR 0000066E: < FAILED >
MSR 0000066F: < FAILED >
MSR 00000670: < FAILED >
MSR 00000671: < FAILED >
MSR 00000672: < FAILED >
MSR 00000673: < FAILED >
MSR 00000674: < FAILED >
MSR 00000675: < FAILED >
MSR 00000676: < FAILED >
MSR 00000677: < FAILED >
MSR 00000770: 0000-0000-0000-0001
MSR 00000771: 0000-0000-0108-141A
MSR 00000772: 0000-019E-5400-1A01
MSR 00000773: 0000-0000-0000-0005
MSR 00000774: 0000-059E-5400-1A01
MSR 00000777: 0000-0000-0000-0000

------[ MSR Registers / Logical CPU #1 ]------

MSR 00000017: 0000-0000-0000-0000 [PlatID = 0]
MSR 0000001B: 0000-0000-FEE0-0800
MSR 0000002A: 0000-0000-0000-0000
MSR 00000035: 0000-0000-0004-0004
MSR 00000048: 0000-0000-0000-0000
MSR 00000049: < FAILED >
MSR 0000008B: 0000-0011-0000-0000
MSR 000000CD: < FAILED >
MSR 000000CE: 0004-0830-F001-1400 [eD = 0]
MSR 000000E7: 0000-0015-5498-D064
MSR 000000E8: 0000-001B-7D90-6E44
MSR 000000EE: < FAILED >
MSR 0000010A: 0000-0000-0000-006B
MSR 0000010B: < FAILED >
MSR 0000011E: < FAILED >
MSR 00000194: 0000-0000-0001-0000
MSR 00000198: 0000-1FD7-0000-1A00
MSR 00000199: 0000-0000-0000-1400
MSR 0000019A: 0000-0000-0000-0000
MSR 0000019B: 0000-0000-0000-0010
MSR 0000019C: 0000-0000-8845-0000
MSR 0000019D: 0000-0000-0000-0000
MSR 000001A0: 0000-0000-0085-0089
MSR 000001A2: 0000-0000-8069-0000
MSR 000001A4: 0000-0000-0000-0000
MSR 000001AA: 0000-0000-0040-10C0
MSR 000001AC: < FAILED >
MSR 000001AD: 1A1A-1A1A-1A1A-1A1A
MSR 000001B0: 0000-0000-0000-0006
MSR 000001B1: 0000-0000-883D-0000
MSR 000001B2: 0000-0000-0000-0000
MSR 000001FC: 0000-0000-0864-005D
MSR 00000300: < FAILED >
MSR 0000030A: 0000-0000-0000-0000
MSR 0000030B: 0000-0000-0000-0000
MSR 00000480: 00DA-0500-0000-0013
MSR 00000481: 0000-00FF-0000-0016
MSR 00000482: FFF9-FFFE-0401-E172
MSR 00000483: 037F-FFFF-0003-6DFF
MSR 00000484: 0006-FFFF-0000-11FF
MSR 00000485: 0000-0000-7004-C1E7
MSR 00000486: 0000-0000-8000-0021
MSR 00000487: 0000-0000-FFFF-FFFF
MSR 00000488: 0000-0000-0000-2000
MSR 00000489: 0000-0000-0035-2FFF
MSR 0000048A: 0000-0000-0000-002E
MSR 0000048B: 07DD-6FFF-0000-0000
MSR 0000048C: 0000-0F01-0671-4141
MSR 0000048D: 0000-00FF-0000-0016
MSR 0000048E: FFF9-FFFE-0400-6172
MSR 0000048F: 037F-FFFF-0003-6DFB
MSR 00000490: 0006-FFFF-0000-11FB
MSR 00000601: 0000-0000-0000-0000
MSR 00000602: < FAILED >
MSR 00000603: 0036-0000-0036-3636
MSR 00000604: < FAILED >
MSR 00000606: 0000-0000-000A-0E03
MSR 0000060A: 0000-0000-0000-0000
MSR 0000060B: 0000-0000-0000-0000
MSR 0000060C: 0000-0000-0000-0000
MSR 0000060D: 0000-0000-0000-0000
MSR 00000610: 0042-8064-00DD-8050
MSR 00000611: 0000-0000-0112-A957
MSR 00000613: 0000-0000-0000-0000
MSR 00000614: 0000-0000-0000-0050
MSR 00000618: 0054-00DE-0000-0000
MSR 00000619: 0000-0000-0000-0000
MSR 0000061B: 0000-0000-0000-0000
MSR 0000061C: < FAILED >
MSR 00000638: 0000-0000-0000-0000
MSR 00000639: 0000-0000-007A-B3CA
MSR 0000063A: 0000-0000-0000-0009
MSR 0000063B: < FAILED >
MSR 00000640: 0000-0000-0000-0000
MSR 00000641: 0000-0000-0000-3271
MSR 00000642: 0000-0000-0000-000D
MSR 00000660: 0000-0059-B613-DED4
MSR 00000661: < FAILED >
MSR 00000662: < FAILED >
MSR 00000663: < FAILED >
MSR 00000664: 0000-0000-0000-0000
MSR 00000665: < FAILED >
MSR 00000666: < FAILED >
MSR 00000667: < FAILED >
MSR 00000668: < FAILED >
MSR 00000669: < FAILED >
MSR 0000066A: < FAILED >
MSR 0000066B: < FAILED >
MSR 0000066C: < FAILED >
MSR 0000066D: < FAILED >
MSR 0000066E: < FAILED >
MSR 0000066F: < FAILED >
MSR 00000670: < FAILED >
MSR 00000671: < FAILED >
MSR 00000672: < FAILED >
MSR 00000673: < FAILED >
MSR 00000674: < FAILED >
MSR 00000675: < FAILED >
MSR 00000676: < FAILED >
MSR 00000677: < FAILED >
MSR 00000770: 0000-0000-0000-0001
MSR 00000771: 0000-0000-0108-141A
MSR 00000772: 0000-019E-5400-1A01
MSR 00000773: 0000-0000-0000-0005
MSR 00000774: 0000-059E-0000-1A14
MSR 00000777: 0000-0000-0000-0000

------[ MSR Registers / Logical CPU #2 ]------

MSR 00000017: 0000-0000-0000-0000 [PlatID = 0]
MSR 0000001B: 0000-0000-FEE0-0800
MSR 0000002A: 0000-0000-0000-0000
MSR 00000035: 0000-0000-0004-0004
MSR 00000048: 0000-0000-0000-0000
MSR 00000049: < FAILED >
MSR 0000008B: 0000-0011-0000-0000
MSR 000000CD: < FAILED >
MSR 000000CE: 0004-0830-F001-1400 [eD = 0]
MSR 000000E7: 0000-0012-8312-54CC
MSR 000000E8: 0000-0017-D3A8-913B
MSR 000000EE: < FAILED >
MSR 0000010A: 0000-0000-0000-006B
MSR 0000010B: < FAILED >
MSR 0000011E: < FAILED >
MSR 00000194: 0000-0000-0001-0000
MSR 00000198: 0000-1FD7-0000-1A00
MSR 00000199: 0000-0000-0000-1400
MSR 0000019A: 0000-0000-0000-0000
MSR 0000019B: 0000-0000-0000-0010
MSR 0000019C: 0000-0000-8844-0000
MSR 0000019D: 0000-0000-0000-0000
MSR 000001A0: 0000-0000-0085-0089
MSR 000001A2: 0000-0000-8069-0000
MSR 000001A4: 0000-0000-0000-0000
MSR 000001AA: 0000-0000-0040-10C0
MSR 000001AC: < FAILED >
MSR 000001AD: 1A1A-1A1A-1A1A-1A1A
MSR 000001B0: 0000-0000-0000-0006
MSR 000001B1: 0000-0000-883E-0000
MSR 000001B2: 0000-0000-0000-0000
MSR 000001FC: 0000-0000-0864-005D
MSR 00000300: < FAILED >
MSR 0000030A: 0000-0000-0000-0000
MSR 0000030B: 0000-0000-0000-0000
MSR 00000480: 00DA-0500-0000-0013
MSR 00000481: 0000-00FF-0000-0016
MSR 00000482: FFF9-FFFE-0401-E172
MSR 00000483: 037F-FFFF-0003-6DFF
MSR 00000484: 0006-FFFF-0000-11FF
MSR 00000485: 0000-0000-7004-C1E7
MSR 00000486: 0000-0000-8000-0021
MSR 00000487: 0000-0000-FFFF-FFFF
MSR 00000488: 0000-0000-0000-2000
MSR 00000489: 0000-0000-0035-2FFF
MSR 0000048A: 0000-0000-0000-002E
MSR 0000048B: 07DD-6FFF-0000-0000
MSR 0000048C: 0000-0F01-0671-4141
MSR 0000048D: 0000-00FF-0000-0016
MSR 0000048E: FFF9-FFFE-0400-6172
MSR 0000048F: 037F-FFFF-0003-6DFB
MSR 00000490: 0006-FFFF-0000-11FB
MSR 00000601: 0000-0000-0000-0000
MSR 00000602: < FAILED >
MSR 00000603: 0036-0000-0036-3636
MSR 00000604: < FAILED >
MSR 00000606: 0000-0000-000A-0E03
MSR 0000060A: 0000-0000-0000-0000
MSR 0000060B: 0000-0000-0000-0000
MSR 0000060C: 0000-0000-0000-0000
MSR 0000060D: 0000-0000-0000-0000
MSR 00000610: 0042-8064-00DD-8050
MSR 00000611: 0000-0000-0112-A9B0
MSR 00000613: 0000-0000-0000-0000
MSR 00000614: 0000-0000-0000-0050
MSR 00000618: 0054-00DE-0000-0000
MSR 00000619: 0000-0000-0000-0000
MSR 0000061B: 0000-0000-0000-0000
MSR 0000061C: < FAILED >
MSR 00000638: 0000-0000-0000-0000
MSR 00000639: 0000-0000-007A-B3F1
MSR 0000063A: 0000-0000-0000-0009
MSR 0000063B: < FAILED >
MSR 00000640: 0000-0000-0000-0000
MSR 00000641: 0000-0000-0000-3271
MSR 00000642: 0000-0000-0000-000D
MSR 00000660: 0000-005C-881F-C5A0
MSR 00000661: < FAILED >
MSR 00000662: < FAILED >
MSR 00000663: < FAILED >
MSR 00000664: 0000-0000-0000-0000
MSR 00000665: < FAILED >
MSR 00000666: < FAILED >
MSR 00000667: < FAILED >
MSR 00000668: < FAILED >
MSR 00000669: < FAILED >
MSR 0000066A: < FAILED >
MSR 0000066B: < FAILED >
MSR 0000066C: < FAILED >
MSR 0000066D: < FAILED >
MSR 0000066E: < FAILED >
MSR 0000066F: < FAILED >
MSR 00000670: < FAILED >
MSR 00000671: < FAILED >
MSR 00000672: < FAILED >
MSR 00000673: < FAILED >
MSR 00000674: < FAILED >
MSR 00000675: < FAILED >
MSR 00000676: < FAILED >
MSR 00000677: < FAILED >
MSR 00000770: 0000-0000-0000-0001
MSR 00000771: 0000-0000-0108-141A
MSR 00000772: 0000-019E-5400-1A01
MSR 00000773: 0000-0000-0000-0005
MSR 00000774: 0000-059E-0000-1A14
MSR 00000777: 0000-0000-0000-0000

------[ MSR Registers / Logical CPU #3 ]------

MSR 00000017: 0000-0000-0000-0000 [PlatID = 0]
MSR 0000001B: 0000-0000-FEE0-0800
MSR 0000002A: 0000-0000-0000-0000
MSR 00000035: 0000-0000-0004-0004
MSR 00000048: 0000-0000-0000-0000
MSR 00000049: < FAILED >
MSR 0000008B: 0000-0011-0000-0000
MSR 000000CD: < FAILED >
MSR 000000CE: 0004-0830-F001-1400 [eD = 0]
MSR 000000E7: 0000-0010-49F3-A0F8
MSR 000000E8: 0000-0014-EFDE-D581
MSR 000000EE: < FAILED >
MSR 0000010A: 0000-0000-0000-006B
MSR 0000010B: < FAILED >
MSR 0000011E: < FAILED >
MSR 00000194: 0000-0000-0001-0000
MSR 00000198: 0000-1FD7-0000-1A00
MSR 00000199: 0000-0000-0000-1400
MSR 0000019A: 0000-0000-0000-0000
MSR 0000019B: 0000-0000-0000-0010
MSR 0000019C: 0000-0000-8844-0000
MSR 0000019D: 0000-0000-0000-0000
MSR 000001A0: 0000-0000-0085-0089
MSR 000001A2: 0000-0000-8069-0000
MSR 000001A4: 0000-0000-0000-0000
MSR 000001AA: 0000-0000-0040-10C0
MSR 000001AC: < FAILED >
MSR 000001AD: 1A1A-1A1A-1A1A-1A1A
MSR 000001B0: 0000-0000-0000-0006
MSR 000001B1: 0000-0000-883E-0000
MSR 000001B2: 0000-0000-0000-0000
MSR 000001FC: 0000-0000-0864-005D
MSR 00000300: < FAILED >
MSR 0000030A: 0000-0000-0000-0000
MSR 0000030B: 0000-0000-0000-0000
MSR 00000480: 00DA-0500-0000-0013
MSR 00000481: 0000-00FF-0000-0016
MSR 00000482: FFF9-FFFE-0401-E172
MSR 00000483: 037F-FFFF-0003-6DFF
MSR 00000484: 0006-FFFF-0000-11FF
MSR 00000485: 0000-0000-7004-C1E7
MSR 00000486: 0000-0000-8000-0021
MSR 00000487: 0000-0000-FFFF-FFFF
MSR 00000488: 0000-0000-0000-2000
MSR 00000489: 0000-0000-0035-2FFF
MSR 0000048A: 0000-0000-0000-002E
MSR 0000048B: 07DD-6FFF-0000-0000
MSR 0000048C: 0000-0F01-0671-4141
MSR 0000048D: 0000-00FF-0000-0016
MSR 0000048E: FFF9-FFFE-0400-6172
MSR 0000048F: 037F-FFFF-0003-6DFB
MSR 00000490: 0006-FFFF-0000-11FB
MSR 00000601: 0000-0000-0000-0000
MSR 00000602: < FAILED >
MSR 00000603: 0036-0000-0036-3636
MSR 00000604: < FAILED >
MSR 00000606: 0000-0000-000A-0E03
MSR 0000060A: 0000-0000-0000-0000
MSR 0000060B: 0000-0000-0000-0000
MSR 0000060C: 0000-0000-0000-0000
MSR 0000060D: 0000-0000-0000-0000
MSR 00000610: 0042-8064-00DD-8050
MSR 00000611: 0000-0000-0112-AA01
MSR 00000613: 0000-0000-0000-0000
MSR 00000614: 0000-0000-0000-0050
MSR 00000618: 0054-00DE-0000-0000
MSR 00000619: 0000-0000-0000-0000
MSR 0000061B: 0000-0000-0000-0000
MSR 0000061C: < FAILED >
MSR 00000638: 0000-0000-0000-0000
MSR 00000639: 0000-0000-007A-B416
MSR 0000063A: 0000-0000-0000-0009
MSR 0000063B: < FAILED >
MSR 00000640: 0000-0000-0000-0000
MSR 00000641: 0000-0000-0000-3271
MSR 00000642: 0000-0000-0000-000D
MSR 00000660: 0000-005E-C1A9-08E4
MSR 00000661: < FAILED >
MSR 00000662: < FAILED >
MSR 00000663: < FAILED >
MSR 00000664: 0000-0000-0000-0000
MSR 00000665: < FAILED >
MSR 00000666: < FAILED >
MSR 00000667: < FAILED >
MSR 00000668: < FAILED >
MSR 00000669: < FAILED >
MSR 0000066A: < FAILED >
MSR 0000066B: < FAILED >
MSR 0000066C: < FAILED >
MSR 0000066D: < FAILED >
MSR 0000066E: < FAILED >
MSR 0000066F: < FAILED >
MSR 00000670: < FAILED >
MSR 00000671: < FAILED >
MSR 00000672: < FAILED >
MSR 00000673: < FAILED >
MSR 00000674: < FAILED >
MSR 00000675: < FAILED >
MSR 00000676: < FAILED >
MSR 00000677: < FAILED >
MSR 00000770: 0000-0000-0000-0001
MSR 00000771: 0000-0000-0108-141A
MSR 00000772: 0000-019E-5400-1A01
MSR 00000773: 0000-0000-0000-0005
MSR 00000774: 0000-059E-0000-1A14
MSR 00000777: 0000-0000-0000-0000
