------[ Versions ]------

Program Version : AIDA64 v5.80.4010 Beta
BenchDLL Version: 4.3.714-x64

------[ CPU Info ]------

CPU Type          : QuadCore Intel Celeron J3455, 2200 MHz (22 x 100)
CPU Alias         : Apollo Lake-D
CPU Platform      : FCBGA1296
CPU Stepping      : B0/B1
Instruction Set   : x86, x86-64, MMX, SSE, SSE2, SSE3, SSSE3, SSE4.1, SSE4.2, AES, SHA
CPUID Manufacturer: GenuineIntel
CPUID CPU Name    : Intel(R) Celeron(R) CPU J3455 @ 1.50GHz
CPUID Revision    : 000506C9h
IA Brand ID       : 00h  (Unknown)
Platform ID       : 39h  (FCBGA1296)
HTT / CMP Units   : 0 / 4
Max. NUMA Node    : 0

Tjmax Temperature          : 105 Celsius
HTC Temperature Limit      : 0 Celsius
CPU TDP                    : 10 W
CPU TDC                    : 21 A
CPU Max Power Limit        : Unlimited Power / Unlimited Time
CPU Power Limit 1 (Long)   : 10 W / 8.00 sec  (Unlocked)
CPU Power Limit 2 (Short)  : 25 W / Unlimited Time  (Unlocked)
Max Turbo Boost Multipliers: 1C: 23x, 2C: 22x, 3C: 22x, 4C: 22x

------[ Logical CPU #0 ]------

allcpu: Package 0 / Core 0 / Thread 0: Valid

CPUID 00000000: 00000015-756E6547-6C65746E-49656E69 [GenuineIntel]
CPUID 00000001: 000506C9-00200800-4FF8EBBF-BFEBFBFF
CPUID 00000002: 6164A001-0000FFC4-00000000-00000000
CPUID 00000003: 00000000-00000000-00000000-00000000
CPUID 00000004: 3C000121-0140003F-0000003F-00000001 [SL 00]
CPUID 00000004: 3C000122-01C0003F-0000003F-00000001 [SL 01]
CPUID 00000004: 3C00C143-03C0003F-000003FF-00000001 [SL 02]
CPUID 00000005: 00000040-00000040-00000003-11242020
CPUID 00000006: 00000057-00000002-00000001-00000000
CPUID 00000007: 00000000-2294E283-00000000-00000000
CPUID 00000008: 00000000-00000000-00000000-00000000
CPUID 00000009: 00000000-00000000-00000000-00000000
CPUID 0000000A: 07300404-00000000-00000000-00000603
CPUID 0000000B: 00000001-00000001-00000100-00000000 [SL 00]
CPUID 0000000B: 00000005-00000004-00000201-00000000 [SL 01]
CPUID 0000000C: 00000000-00000000-00000000-00000000
CPUID 0000000D: 0000001B-00000440-00000440-00000000 [SL 00]
CPUID 0000000D: 0000000F-000002C0-00000100-00000000 [SL 01]
CPUID 0000000E: 00000000-00000000-00000000-00000000
CPUID 0000000F: 00000000-00000000-00000000-00000000 [SL 00]
CPUID 0000000F: 00000000-00000000-00000000-00000000 [SL 01]
CPUID 00000010: 00000000-00000004-00000000-00000000 [SL 00]
CPUID 00000010: 00000000-00000000-00000000-00000000 [SL 01]
CPUID 00000011: 00000000-00000000-00000000-00000000
CPUID 00000012: 00000000-00000000-00000000-00000000 [SL 00]
CPUID 00000012: 00000000-00000000-00000000-00000000 [SL 01]
CPUID 00000013: 00000000-00000000-00000000-00000000
CPUID 00000014: 00000001-0000000F-80000007-00000000 [SL 00]
CPUID 00000014: 02490002-003FFFFF-00000000-00000000 [SL 01]
CPUID 00000015: 00000003-000000EA-0124F800-00000000 [78.00x / 19200000]
CPUID 80000000: 80000008-00000000-00000000-00000000
CPUID 80000001: 00000000-00000000-00000101-2C100000
CPUID 80000002: 65746E49-2952286C-6C654320-6E6F7265 [Intel(R) Celeron]
CPUID 80000003: 20295228-20555043-3534334A-20402035 [(R) CPU J3455 @ ]
CPUID 80000004: 30352E31-007A4847-00000000-00000000 [1.50GHz]
CPUID 80000005: 00000000-00000000-00000000-00000000
CPUID 80000006: 00000000-00000000-04008040-00000000
CPUID 80000007: 00000000-00000000-00000000-00000100
CPUID 80000008: 00003027-00000000-00000000-00000000

L1    Data Cache:    24 KB,  6-way Associative, 64-byte Line
L1  Instr. Cache:    32 KB,  8-way Associative, 64-byte Line
L2 Unified Cache:     1 MB, 16-way Associative, 64-byte Line

------[ Logical CPU #1 ]------

allcpu: Package 0 / Core 1 / Thread 0: Valid

CPUID 00000000: 00000015-756E6547-6C65746E-49656E69 [GenuineIntel]
CPUID 00000001: 000506C9-02200800-4FF8EBBF-BFEBFBFF
CPUID 00000002: 6164A001-0000FFC4-00000000-00000000
CPUID 00000003: 00000000-00000000-00000000-00000000
CPUID 00000004: 3C000121-0140003F-0000003F-00000001 [SL 00]
CPUID 00000004: 3C000122-01C0003F-0000003F-00000001 [SL 01]
CPUID 00000004: 3C00C143-03C0003F-000003FF-00000001 [SL 02]
CPUID 00000005: 00000040-00000040-00000003-11242020
CPUID 00000006: 00000057-00000002-00000001-00000000
CPUID 00000007: 00000000-2294E283-00000000-00000000
CPUID 00000008: 00000000-00000000-00000000-00000000
CPUID 00000009: 00000000-00000000-00000000-00000000
CPUID 0000000A: 07300404-00000000-00000000-00000603
CPUID 0000000B: 00000001-00000001-00000100-00000002 [SL 00]
CPUID 0000000B: 00000005-00000004-00000201-00000002 [SL 01]
CPUID 0000000C: 00000000-00000000-00000000-00000000
CPUID 0000000D: 0000001B-00000440-00000440-00000000 [SL 00]
CPUID 0000000D: 0000000F-000002C0-00000100-00000000 [SL 01]
CPUID 0000000E: 00000000-00000000-00000000-00000000
CPUID 0000000F: 00000000-00000000-00000000-00000000 [SL 00]
CPUID 0000000F: 00000000-00000000-00000000-00000000 [SL 01]
CPUID 00000010: 00000000-00000004-00000000-00000000 [SL 00]
CPUID 00000010: 00000000-00000000-00000000-00000000 [SL 01]
CPUID 00000011: 00000000-00000000-00000000-00000000
CPUID 00000012: 00000000-00000000-00000000-00000000 [SL 00]
CPUID 00000012: 00000000-00000000-00000000-00000000 [SL 01]
CPUID 00000013: 00000000-00000000-00000000-00000000
CPUID 00000014: 00000001-0000000F-80000007-00000000 [SL 00]
CPUID 00000014: 02490002-003FFFFF-00000000-00000000 [SL 01]
CPUID 00000015: 00000003-000000EA-0124F800-00000000 [78.00x / 19200000]
CPUID 80000000: 80000008-00000000-00000000-00000000
CPUID 80000001: 00000000-00000000-00000101-2C100000
CPUID 80000002: 65746E49-2952286C-6C654320-6E6F7265 [Intel(R) Celeron]
CPUID 80000003: 20295228-20555043-3534334A-20402035 [(R) CPU J3455 @ ]
CPUID 80000004: 30352E31-007A4847-00000000-00000000 [1.50GHz]
CPUID 80000005: 00000000-00000000-00000000-00000000
CPUID 80000006: 00000000-00000000-04008040-00000000
CPUID 80000007: 00000000-00000000-00000000-00000100
CPUID 80000008: 00003027-00000000-00000000-00000000

L1    Data Cache:    24 KB,  6-way Associative, 64-byte Line
L1  Instr. Cache:    32 KB,  8-way Associative, 64-byte Line
L2 Unified Cache:     1 MB, 16-way Associative, 64-byte Line

------[ Logical CPU #2 ]------

allcpu: Package 0 / Core 2 / Thread 0: Valid

CPUID 00000000: 00000015-756E6547-6C65746E-49656E69 [GenuineIntel]
CPUID 00000001: 000506C9-04200800-4FF8EBBF-BFEBFBFF
CPUID 00000002: 6164A001-0000FFC4-00000000-00000000
CPUID 00000003: 00000000-00000000-00000000-00000000
CPUID 00000004: 3C000121-0140003F-0000003F-00000001 [SL 00]
CPUID 00000004: 3C000122-01C0003F-0000003F-00000001 [SL 01]
CPUID 00000004: 3C00C143-03C0003F-000003FF-00000001 [SL 02]
CPUID 00000005: 00000040-00000040-00000003-11242020
CPUID 00000006: 00000057-00000002-00000001-00000000
CPUID 00000007: 00000000-2294E283-00000000-00000000
CPUID 00000008: 00000000-00000000-00000000-00000000
CPUID 00000009: 00000000-00000000-00000000-00000000
CPUID 0000000A: 07300404-00000000-00000000-00000603
CPUID 0000000B: 00000001-00000001-00000100-00000004 [SL 00]
CPUID 0000000B: 00000005-00000004-00000201-00000004 [SL 01]
CPUID 0000000C: 00000000-00000000-00000000-00000000
CPUID 0000000D: 0000001B-00000440-00000440-00000000 [SL 00]
CPUID 0000000D: 0000000F-000002C0-00000100-00000000 [SL 01]
CPUID 0000000E: 00000000-00000000-00000000-00000000
CPUID 0000000F: 00000000-00000000-00000000-00000000 [SL 00]
CPUID 0000000F: 00000000-00000000-00000000-00000000 [SL 01]
CPUID 00000010: 00000000-00000004-00000000-00000000 [SL 00]
CPUID 00000010: 00000000-00000000-00000000-00000000 [SL 01]
CPUID 00000011: 00000000-00000000-00000000-00000000
CPUID 00000012: 00000000-00000000-00000000-00000000 [SL 00]
CPUID 00000012: 00000000-00000000-00000000-00000000 [SL 01]
CPUID 00000013: 00000000-00000000-00000000-00000000
CPUID 00000014: 00000001-0000000F-80000007-00000000 [SL 00]
CPUID 00000014: 02490002-003FFFFF-00000000-00000000 [SL 01]
CPUID 00000015: 00000003-000000EA-0124F800-00000000 [78.00x / 19200000]
CPUID 80000000: 80000008-00000000-00000000-00000000
CPUID 80000001: 00000000-00000000-00000101-2C100000
CPUID 80000002: 65746E49-2952286C-6C654320-6E6F7265 [Intel(R) Celeron]
CPUID 80000003: 20295228-20555043-3534334A-20402035 [(R) CPU J3455 @ ]
CPUID 80000004: 30352E31-007A4847-00000000-00000000 [1.50GHz]
CPUID 80000005: 00000000-00000000-00000000-00000000
CPUID 80000006: 00000000-00000000-04008040-00000000
CPUID 80000007: 00000000-00000000-00000000-00000100
CPUID 80000008: 00003027-00000000-00000000-00000000

L1    Data Cache:    24 KB,  6-way Associative, 64-byte Line
L1  Instr. Cache:    32 KB,  8-way Associative, 64-byte Line
L2 Unified Cache:     1 MB, 16-way Associative, 64-byte Line

------[ Logical CPU #3 ]------

allcpu: Package 0 / Core 3 / Thread 0: Valid

CPUID 00000000: 00000015-756E6547-6C65746E-49656E69 [GenuineIntel]
CPUID 00000001: 000506C9-06200800-4FF8EBBF-BFEBFBFF
CPUID 00000002: 6164A001-0000FFC4-00000000-00000000
CPUID 00000003: 00000000-00000000-00000000-00000000
CPUID 00000004: 3C000121-0140003F-0000003F-00000001 [SL 00]
CPUID 00000004: 3C000122-01C0003F-0000003F-00000001 [SL 01]
CPUID 00000004: 3C00C143-03C0003F-000003FF-00000001 [SL 02]
CPUID 00000005: 00000040-00000040-00000003-11242020
CPUID 00000006: 00000057-00000002-00000001-00000000
CPUID 00000007: 00000000-2294E283-00000000-00000000
CPUID 00000008: 00000000-00000000-00000000-00000000
CPUID 00000009: 00000000-00000000-00000000-00000000
CPUID 0000000A: 07300404-00000000-00000000-00000603
CPUID 0000000B: 00000001-00000001-00000100-00000006 [SL 00]
CPUID 0000000B: 00000005-00000004-00000201-00000006 [SL 01]
CPUID 0000000C: 00000000-00000000-00000000-00000000
CPUID 0000000D: 0000001B-00000440-00000440-00000000 [SL 00]
CPUID 0000000D: 0000000F-000002C0-00000100-00000000 [SL 01]
CPUID 0000000E: 00000000-00000000-00000000-00000000
CPUID 0000000F: 00000000-00000000-00000000-00000000 [SL 00]
CPUID 0000000F: 00000000-00000000-00000000-00000000 [SL 01]
CPUID 00000010: 00000000-00000004-00000000-00000000 [SL 00]
CPUID 00000010: 00000000-00000000-00000000-00000000 [SL 01]
CPUID 00000011: 00000000-00000000-00000000-00000000
CPUID 00000012: 00000000-00000000-00000000-00000000 [SL 00]
CPUID 00000012: 00000000-00000000-00000000-00000000 [SL 01]
CPUID 00000013: 00000000-00000000-00000000-00000000
CPUID 00000014: 00000001-0000000F-80000007-00000000 [SL 00]
CPUID 00000014: 02490002-003FFFFF-00000000-00000000 [SL 01]
CPUID 00000015: 00000003-000000EA-0124F800-00000000 [78.00x / 19200000]
CPUID 80000000: 80000008-00000000-00000000-00000000
CPUID 80000001: 00000000-00000000-00000101-2C100000
CPUID 80000002: 65746E49-2952286C-6C654320-6E6F7265 [Intel(R) Celeron]
CPUID 80000003: 20295228-20555043-3534334A-20402035 [(R) CPU J3455 @ ]
CPUID 80000004: 30352E31-007A4847-00000000-00000000 [1.50GHz]
CPUID 80000005: 00000000-00000000-00000000-00000000
CPUID 80000006: 00000000-00000000-04008040-00000000
CPUID 80000007: 00000000-00000000-00000000-00000100
CPUID 80000008: 00003027-00000000-00000000-00000000

L1    Data Cache:    24 KB,  6-way Associative, 64-byte Line
L1  Instr. Cache:    32 KB,  8-way Associative, 64-byte Line
L2 Unified Cache:     1 MB, 16-way Associative, 64-byte Line

------[ All CPUs ]------

CPU   0: APICID   0 / Package 0 / Core  0 / Thread 0: Valid
CPU   1: APICID   2 / Package 0 / Core  1 / Thread 0: Valid
CPU   2: APICID   4 / Package 0 / Core  2 / Thread 0: Valid
CPU   3: APICID   6 / Package 0 / Core  3 / Thread 0: Valid

------[ MSR Registers ]------

MSR 00000017: 0000-0000-0000-0000 [PlatID = 0]
MSR 0000001B: 0000-0000-FEE0-0900
MSR 0000002A: 0000-0000-0000-0000
MSR 00000035: 0000-0000-0004-0004
MSR 0000008B: 0000-001C-0000-0000
MSR 000000CD: < FAILED >
MSR 000000CE: 0004-0821-F001-0F00 [eD = 0]
MSR 000000E7: 0000-0013-B9C9-F3FC [S200]
MSR 000000E7: 0000-0013-BA79-6652 [S200]
MSR 000000E7: 0000-0013-BD84-DCAF
MSR 000000E8: 0000-001A-E23C-D2DA [S200]
MSR 000000E8: 0000-001A-E469-3C16 [S200]
MSR 000000E8: 0000-001A-E70D-A5D4
MSR 000000EE: < FAILED >
MSR 0000011E: < FAILED >
MSR 00000194: < FAILED >
MSR 00000198: 0000-268F-0000-1600 [S200]
MSR 00000198: 0000-268F-0000-1600 [S200]
MSR 00000198: 0000-268F-0000-1600
MSR 00000199: 0000-0000-0000-1700
MSR 0000019A: 0000-0000-0000-0000
MSR 0000019B: 0000-0000-0000-0010
MSR 0000019C: 0000-0000-8844-0800 [S200]
MSR 0000019C: 0000-0000-8844-0800 [S200]
MSR 0000019C: 0000-0000-8845-0800
MSR 0000019D: 0000-0000-0000-0000
MSR 000001A0: 0000-0000-0085-0089
MSR 000001A2: 0000-0000-0069-0000
MSR 000001A4: 0000-0000-0000-0000
MSR 000001AA: 0000-0000-0040-0000
MSR 000001AC: < FAILED >
MSR 000001AD: 0000-0000-1616-1617
MSR 000001B0: < FAILED >
MSR 000001B1: 0000-0000-8845-0800
MSR 000001B2: 0000-0000-0000-0000
MSR 000001FC: 0000-0000-0020-005D
MSR 00000300: < FAILED >
MSR 0000030A: 0000-0000-0000-0000 [S200]
MSR 0000030A: 0000-0000-0000-0000 [S200]
MSR 0000030A: 0000-0000-0000-0000
MSR 0000030B: 0000-0000-0000-0000 [S200]
MSR 0000030B: 0000-0000-0000-0000 [S200]
MSR 0000030B: 0000-0000-0000-0000
MSR 00000480: 00DA-0400-0000-0011
MSR 00000481: 0000-00FF-0000-0016
MSR 00000482: FFF9-FFFE-0401-E172
MSR 00000483: 01FF-FFFF-0003-6DFF
MSR 00000484: 0003-FFFF-0000-11FF
MSR 00000485: 0000-0000-6004-C1E7
MSR 00000486: 0000-0000-8000-0021
MSR 00000487: 0000-0000-FFFF-FFFF
MSR 00000488: 0000-0000-0000-2000
MSR 00000489: 0000-0000-0035-27FF
MSR 0000048A: 0000-0000-0000-002E
MSR 0000048B: 001D-6FFF-0000-0000
MSR 0000048C: 0000-0F01-0633-4141
MSR 0000048D: 0000-00FF-0000-0016
MSR 0000048E: FFF9-FFFE-0400-6172
MSR 0000048F: 01FF-FFFF-0003-6DFB
MSR 00000490: 0003-FFFF-0000-11FB
MSR 00000601: 4080-4000-0000-00A8
MSR 00000602: < FAILED >
MSR 00000603: 0000-0000-0008-FF0B
MSR 00000604: < FAILED >
MSR 00000606: 0000-0000-330A-0E08
MSR 0000060A: 0000-0000-0000-0000
MSR 0000060B: 0000-0000-0000-8893
MSR 0000060C: 0000-0000-0000-8893
MSR 0000060D: 0000-0000-0000-0000
MSR 00000610: 0000-9900-001B-8A00
MSR 00000611: 0000-0000-012E-BF37 [S200]
MSR 00000611: 0000-0000-012E-DED3 [S200]
MSR 00000611: 0000-0000-012E-FECF
MSR 00000613: 0000-0000-0000-0000
MSR 00000614: 0000-0000-0000-0A00
MSR 00000618: 0000-0000-0000-0000
MSR 00000619: 0000-0000-004B-04D4 [S200]
MSR 00000619: 0000-0000-004B-08BF [S200]
MSR 00000619: 0000-0000-004B-0BC9
MSR 0000061B: 0000-0000-0000-58F0
MSR 0000061C: < FAILED >
MSR 00000638: < FAILED >
MSR 00000639: 0000-0000-0073-4148 [S200]
MSR 00000639: 0000-0000-0073-4696 [S200]
MSR 00000639: 0000-0000-0073-4C1D
MSR 0000063A: < FAILED >
MSR 0000063B: < FAILED >
MSR 00000640: < FAILED >
MSR 00000641: 0000-0000-0006-3CB9 [S200]
MSR 00000641: 0000-0000-0006-3CEC [S200]
MSR 00000641: 0000-0000-0006-4050
MSR 00000642: < FAILED >
MSR 00000660: 0000-0088-0538-BC7A
MSR 00000661: < FAILED >
MSR 00000662: < FAILED >
MSR 00000663: < FAILED >
MSR 00000664: < FAILED >
MSR 00000665: < FAILED >
MSR 00000666: < FAILED >
MSR 00000667: < FAILED >
MSR 00000668: < FAILED >
MSR 00000669: < FAILED >
MSR 0000066A: < FAILED >
MSR 0000066B: < FAILED >
MSR 0000066C: < FAILED >
MSR 0000066D: < FAILED >
MSR 0000066E: < FAILED >
MSR 0000066F: < FAILED >
MSR 00000670: < FAILED >
MSR 00000671: < FAILED >
MSR 00000672: < FAILED >
MSR 00000673: < FAILED >
MSR 00000674: < FAILED >
MSR 00000675: < FAILED >
MSR 00000676: < FAILED >
MSR 00000677: < FAILED >

PerformanceFrequency = 1462502

CPU Clock M.Method = 8  (APIC SNB)
PM Timer Address   = 1032  (0408h)

APIC Clock = 100.01 MHz  (AT = 10058 / TT = 15000 / try = 1 / SKL = 0.00 MHz)
APIC Clock = 100.01 MHz  (AT = 10058 / TT = 15000 / try = 1 / SKL = 0.00 MHz)
APIC Clock = 100.00 MHz  (AT = 10057 / TT = 15000 / try = 1 / SKL = 0.00 MHz)
APIC Clock = 100.00 MHz  (AT = 10057 / TT = 15000 / try = 1 / SKL = 0.00 MHz)
APIC Clock = 100.01 MHz  (AT = 10058 / TT = 15000 / try = 1 / SKL = 0.00 MHz)

CPU Clock = 2199.97 MHz / TSC Clock = 1499.98 MHz / CPU Mul = 22.00x
CPU Clock = 2199.97 MHz / TSC Clock = 1499.98 MHz / CPU Mul = 22.00x
CPU Clock = 2199.97 MHz / TSC Clock = 1499.98 MHz / CPU Mul = 22.00x
CPU Clock = 2200.19 MHz / TSC Clock = 1500.13 MHz / CPU Mul = 22.00x
CPU Clock = 2200.19 MHz / TSC Clock = 1500.13 MHz / CPU Mul = 22.00x

CPU Clock Max = 2199.97 MHz / TSC Clock = 1499.98 MHz / CPU Mul = 22.00x
CPU Clock Max = 2199.97 MHz / TSC Clock = 1499.98 MHz / CPU Mul = 22.00x
CPU Clock Max = 2200.19 MHz / TSC Clock = 1500.13 MHz / CPU Mul = 22.00x
CPU Clock Max = 2199.97 MHz / TSC Clock = 1499.98 MHz / CPU Mul = 22.00x
CPU Clock Max = 2199.97 MHz / TSC Clock = 1499.98 MHz / CPU Mul = 22.00x

INTPERFCTR2 = 2194.93 MHz / INTPERFCTR1 (TSC) = 1497.59 MHz
INTPERFCTR2 = 2194.95 MHz / INTPERFCTR1 (TSC) = 1497.61 MHz
INTPERFCTR2 = 2194.93 MHz / INTPERFCTR1 (TSC) = 1497.59 MHz
INTPERFCTR2 = 2194.94 MHz / INTPERFCTR1 (TSC) = 1497.60 MHz
INTPERFCTR2 = 2194.93 MHz / INTPERFCTR1 (TSC) = 1497.60 MHz
