------[ Versions ]------

Program Version : AIDA64 v4.20.2827 Beta
BenchDLL Version: 4.1.611-x64

------[ CPU Info ]------

CPU Type          : QuadCore Intel Celeron J1900, 2000 MHz (24 x 83)
CPU Alias         : Bay Trail-D
CPU Platform      : FCBGA1170-D
CPU Stepping      : B3
Instruction Set   : x86, x86-64, MMX, SSE, SSE2, SSE3, SSSE3, SSE4.1, SSE4.2
CPUID Manufacturer: GenuineIntel
CPUID CPU Name    : Intel(R) Celeron(R) CPU J1900 @ 1.99GHz
CPUID Revision    : 00030673h
IA Brand ID       : 00h  (Unknown)
Platform ID       : 30h  (FCBGA1170-D)
HTT / CMP Units   : 0 / 4
Max. NUMA Node    : 0

Tjmax Temperature          : 105 Celsius
HTC Temperature Limit      : 0 Celsius
CPU TDP                    : 10 W
CPU Max Power Limit        : -1 W / -1000000.00 us
CPU Power Limit 1 (Long)   : 0 W / 28.00 sec  (Unlocked)
Max Turbo Boost Multipliers: 1C: 29x, 2C: 29x, 3C: 29x, 4C: 29x

------[ Logical CPU #0 ]------

allcpu: Package 0 / Core 0 / Thread 0: Valid

CPUID 00000000: 0000000B-756E6547-6C65746E-49656E69 [GenuineIntel]
CPUID 00000001: 00030673-00100800-41D8E3BF-BFEBFBFF
CPUID 00000002: 61B3A001-0000FFC2-00000000-00000000
CPUID 00000003: 00000000-00000000-00000000-00000000
CPUID 00000004: 1C000121-0140003F-0000003F-00000001
CPUID 00000004: 1C000122-01C0003F-0000003F-00000001
CPUID 00000004: 1C00C143-03C0003F-000003FF-00000001
CPUID 00000005: 00000040-00000040-00000003-33000020
CPUID 00000006: 00000005-00000002-00000009-00000000
CPUID 00000007: 00000000-00002282-00000000-00000000
CPUID 00000008: 00000000-00000000-00000000-00000000
CPUID 00000009: 00000000-00000000-00000000-00000000
CPUID 0000000A: 07280203-00000000-00000000-00004503
CPUID 0000000B: 00000001-00000001-00000100-00000000
CPUID 0000000B: 00000004-00000004-00000201-00000000
CPUID 80000000: 80000008-00000000-00000000-00000000
CPUID 80000001: 00000000-00000000-00000101-28100000
CPUID 80000002: 20202020-6E492020-286C6574-43202952 [      Intel(R) C]
CPUID 80000003: 72656C65-52286E6F-50432029-4A202055 [eleron(R) CPU  J]
CPUID 80000004: 30303931-20402020-39392E31-007A4847 [1900  @ 1.99GHz]
CPUID 80000005: 00000000-00000000-00000000-00000000
CPUID 80000006: 00000000-00000000-04008040-00000000
CPUID 80000007: 00000000-00000000-00000000-00000100
CPUID 80000008: 00003024-00000000-00000000-00000000

L1    Data Cache:     24 KB,  6-way Associative, 64-byte Line
L1  Instr. Cache:     32 KB,  8-way Associative, 64-byte Line
L2 Unified Cache:   1024 KB, 16-way Associative, 64-byte Line

------[ Logical CPU #1 ]------

allcpu: Package 0 / Core 1 / Thread 0: Valid

CPUID 00000000: 0000000B-756E6547-6C65746E-49656E69 [GenuineIntel]
CPUID 00000001: 00030673-02100800-41D8E3BF-BFEBFBFF
CPUID 00000002: 61B3A001-0000FFC2-00000000-00000000
CPUID 00000003: 00000000-00000000-00000000-00000000
CPUID 00000004: 1C000121-0140003F-0000003F-00000001
CPUID 00000004: 1C000122-01C0003F-0000003F-00000001
CPUID 00000004: 1C00C143-03C0003F-000003FF-00000001
CPUID 00000005: 00000040-00000040-00000003-33000020
CPUID 00000006: 00000005-00000002-00000009-00000000
CPUID 00000007: 00000000-00002282-00000000-00000000
CPUID 00000008: 00000000-00000000-00000000-00000000
CPUID 00000009: 00000000-00000000-00000000-00000000
CPUID 0000000A: 07280203-00000000-00000000-00004503
CPUID 0000000B: 00000001-00000001-00000100-00000002
CPUID 0000000B: 00000004-00000004-00000201-00000002
CPUID 80000000: 80000008-00000000-00000000-00000000
CPUID 80000001: 00000000-00000000-00000101-28100000
CPUID 80000002: 20202020-6E492020-286C6574-43202952 [      Intel(R) C]
CPUID 80000003: 72656C65-52286E6F-50432029-4A202055 [eleron(R) CPU  J]
CPUID 80000004: 30303931-20402020-39392E31-007A4847 [1900  @ 1.99GHz]
CPUID 80000005: 00000000-00000000-00000000-00000000
CPUID 80000006: 00000000-00000000-04008040-00000000
CPUID 80000007: 00000000-00000000-00000000-00000100
CPUID 80000008: 00003024-00000000-00000000-00000000

L1    Data Cache:     24 KB,  6-way Associative, 64-byte Line
L1  Instr. Cache:     32 KB,  8-way Associative, 64-byte Line
L2 Unified Cache:   1024 KB, 16-way Associative, 64-byte Line

------[ Logical CPU #2 ]------

allcpu: Package 0 / Core 2 / Thread 0: Valid

CPUID 00000000: 0000000B-756E6547-6C65746E-49656E69 [GenuineIntel]
CPUID 00000001: 00030673-04100800-41D8E3BF-BFEBFBFF
CPUID 00000002: 61B3A001-0000FFC2-00000000-00000000
CPUID 00000003: 00000000-00000000-00000000-00000000
CPUID 00000004: 1C000121-0140003F-0000003F-00000001
CPUID 00000004: 1C000122-01C0003F-0000003F-00000001
CPUID 00000004: 1C00C143-03C0003F-000003FF-00000001
CPUID 00000005: 00000040-00000040-00000003-33000020
CPUID 00000006: 00000005-00000002-00000009-00000000
CPUID 00000007: 00000000-00002282-00000000-00000000
CPUID 00000008: 00000000-00000000-00000000-00000000
CPUID 00000009: 00000000-00000000-00000000-00000000
CPUID 0000000A: 07280203-00000000-00000000-00004503
CPUID 0000000B: 00000001-00000001-00000100-00000004
CPUID 0000000B: 00000004-00000004-00000201-00000004
CPUID 80000000: 80000008-00000000-00000000-00000000
CPUID 80000001: 00000000-00000000-00000101-28100000
CPUID 80000002: 20202020-6E492020-286C6574-43202952 [      Intel(R) C]
CPUID 80000003: 72656C65-52286E6F-50432029-4A202055 [eleron(R) CPU  J]
CPUID 80000004: 30303931-20402020-39392E31-007A4847 [1900  @ 1.99GHz]
CPUID 80000005: 00000000-00000000-00000000-00000000
CPUID 80000006: 00000000-00000000-04008040-00000000
CPUID 80000007: 00000000-00000000-00000000-00000100
CPUID 80000008: 00003024-00000000-00000000-00000000

L1    Data Cache:     24 KB,  6-way Associative, 64-byte Line
L1  Instr. Cache:     32 KB,  8-way Associative, 64-byte Line
L2 Unified Cache:   1024 KB, 16-way Associative, 64-byte Line

------[ Logical CPU #3 ]------

allcpu: Package 0 / Core 3 / Thread 0: Valid

CPUID 00000000: 0000000B-756E6547-6C65746E-49656E69 [GenuineIntel]
CPUID 00000001: 00030673-06100800-41D8E3BF-BFEBFBFF
CPUID 00000002: 61B3A001-0000FFC2-00000000-00000000
CPUID 00000003: 00000000-00000000-00000000-00000000
CPUID 00000004: 1C000121-0140003F-0000003F-00000001
CPUID 00000004: 1C000122-01C0003F-0000003F-00000001
CPUID 00000004: 1C00C143-03C0003F-000003FF-00000001
CPUID 00000005: 00000040-00000040-00000003-33000020
CPUID 00000006: 00000005-00000002-00000009-00000000
CPUID 00000007: 00000000-00002282-00000000-00000000
CPUID 00000008: 00000000-00000000-00000000-00000000
CPUID 00000009: 00000000-00000000-00000000-00000000
CPUID 0000000A: 07280203-00000000-00000000-00004503
CPUID 0000000B: 00000001-00000001-00000100-00000006
CPUID 0000000B: 00000004-00000004-00000201-00000006
CPUID 80000000: 80000008-00000000-00000000-00000000
CPUID 80000001: 00000000-00000000-00000101-28100000
CPUID 80000002: 20202020-6E492020-286C6574-43202952 [      Intel(R) C]
CPUID 80000003: 72656C65-52286E6F-50432029-4A202055 [eleron(R) CPU  J]
CPUID 80000004: 30303931-20402020-39392E31-007A4847 [1900  @ 1.99GHz]
CPUID 80000005: 00000000-00000000-00000000-00000000
CPUID 80000006: 00000000-00000000-04008040-00000000
CPUID 80000007: 00000000-00000000-00000000-00000100
CPUID 80000008: 00003024-00000000-00000000-00000000

L1    Data Cache:     24 KB,  6-way Associative, 64-byte Line
L1  Instr. Cache:     32 KB,  8-way Associative, 64-byte Line
L2 Unified Cache:   1024 KB, 16-way Associative, 64-byte Line

------[ All CPUs ]------

CPU   0: APICID   0 / Package 0 / Core  0 / Thread 0: Valid
CPU   1: APICID   2 / Package 0 / Core  1 / Thread 0: Valid
CPU   2: APICID   4 / Package 0 / Core  2 / Thread 0: Valid
CPU   3: APICID   6 / Package 0 / Core  3 / Thread 0: Valid

------[ MSR Registers ]------

MSR 00000017: 0008-0000-9024-1D46 [PlatID = 2]
MSR 0000001B: 0000-0000-FEE0-0900
MSR 0000002A: 0000-0000-4008-0000
MSR 00000035: < FAILED >
MSR 0000008B: 0000-0312-0000-0000
MSR 000000CD: 0000-0000-0000-0000
MSR 000000CE: 0000-1000-0000-1800
MSR 000000E7: 0000-0000-000E-5D10
MSR 000000E8: 0000-0000-000E-8518
MSR 000000EE: 0000-0000-0238-0002
MSR 0000011E: 0000-0000-7E28-01FF
MSR 00000194: 0000-0000-0000-0000
MSR 00000198: 0000-7600-0000-183B
MSR 00000199: 0000-0000-0000-183B
MSR 0000019A: 0000-0000-0000-0000
MSR 0000019B: 0000-0000-0000-0000
MSR 0000019C: 0000-0000-8839-0000
MSR 0000019D: 0000-0000-0000-102E
MSR 000001A0: 0000-0040-0085-0089
MSR 000001A2: 0000-0000-0069-0000
MSR 000001A4: < FAILED >
MSR 000001AA: < FAILED >
MSR 000001AC: < FAILED >
MSR 000001AD: 0000-0000-0000-0000
MSR 000001B0: 0000-0000-0000-0006
MSR 000001B1: < FAILED >
MSR 000001B2: < FAILED >
MSR 000001FC: 0000-0000-0000-0000
MSR 00000300: < FAILED >
MSR 00000480: 00DA-0400-0000-0002
MSR 00000481: 0000-007F-0000-0016
MSR 00000482: FFF9-FFFE-0401-E172
MSR 00000483: 007F-FFFF-0003-6DFF
MSR 00000484: 0000-FFFF-0000-11FF
MSR 00000485: 0000-0000-0004-81E6
MSR 00000486: 0000-0000-8000-0021
MSR 00000487: 0000-0000-FFFF-FFFF
MSR 00000488: 0000-0000-0000-2000
MSR 00000489: 0000-0000-0010-27FF
MSR 0000048A: 0000-0000-0000-002E
MSR 0000048B: 0000-28EF-0000-0000
MSR 0000048C: 0000-0F01-0611-4141
MSR 0000048D: 0000-007F-0000-0016
MSR 0000048E: FFF9-FFFE-0400-6172
MSR 0000048F: 007F-FFFF-0003-6DFB
MSR 00000490: 0000-FFFF-0000-11FB
MSR 00000601: 0000-0000-0000-0000
MSR 00000602: < FAILED >
MSR 00000603: < FAILED >
MSR 00000604: < FAILED >
MSR 00000606: 0000-0000-0000-0505
MSR 0000060A: < FAILED >
MSR 0000060B: < FAILED >
MSR 0000060C: < FAILED >
MSR 0000060D: 0000-0000-0000-0000
MSR 00000610: 0000-00FA-0038-8000
MSR 00000611: 0000-0000-21B8-9F97
MSR 00000613: < FAILED >
MSR 00000614: < FAILED >
MSR 00000618: < FAILED >
MSR 00000619: < FAILED >
MSR 0000061B: < FAILED >
MSR 0000061C: < FAILED >
MSR 00000638: 0000-0000-0000-0000
MSR 00000639: 0000-0000-1A60-C7B0
MSR 0000063A: < FAILED >
MSR 0000063B: < FAILED >
MSR 00000640: < FAILED >
MSR 00000641: < FAILED >
MSR 00000642: < FAILED >
MSR 0000066A: 0000-0000-0018-1002
MSR 0000066B: 0000-0000-003B-2E2E
MSR 0000066C: 0000-0000-1D1D-1D1D
MSR 0000066D: 0000-0000-4646-4646
MSR 00000670: 0000-0000-0000-0702
MSR 00000671: 0000-0000-0000-200B
MSR 00000673: 0000-0000-0000-0305
MSR 00000674: 0000-0000-0405-500D
MSR 00000675: 0000-0000-0000-0027
MSR 00000676: 0000-0000-0000-0000

PerformanceFrequency = 1953126

CPU Clock M.Method = 8  (APIC SNB)
PM Timer Address   = 1032  (0408h)

APIC Clock = 83.33 MHz
APIC Clock = 83.33 MHz
APIC Clock = 83.33 MHz
APIC Clock = 83.33 MHz
APIC Clock = 83.33 MHz
