------[ Versions ]------

Program Version : AIDA64 v1.20.1183 Beta
BenchDLL Version: 2.7.333-x32

------[ CPU Info ]------

CPU Type           : DualCore Intel Atom D525, 1800 MHz (9 x 200)
CPU Alias          : Pineview-D
CPU Platform       : FCBGA8
CPU Stepping       : B0
Instruction Set    : x86, x86-64, MMX, SSE, SSE2, SSE3, SSSE3
CPUID Manufacturer : GenuineIntel
CPUID CPU Name     : Intel(R) Atom(TM) CPU D525 @ 1.80GHz
CPUID Revision     : 000106CAh
IA Brand ID        : 00h  (Unknown)
Platform ID        : E3h  (FCBGA8)

------[ Logical CPU #0 ]------

allcpu: Package 0 / Core 0 / Thread 0: Valid

CPUID 00000000: 0000000A-756E6547-6C65746E-49656E69
CPUID 00000001: 000106CA-00040800-0040E31D-BFEBFBFF
CPUID 00000002: 4FBA5901-0E3080C0-00000000-00000000
CPUID 00000003: 00000000-00000000-00000000-00000000
CPUID 00000004: 04004121-0140003F-0000003F-00000001
CPUID 00000004: 04004122-01C0003F-0000003F-00000001
CPUID 00000004: 04004143-01C0003F-000003FF-00000001
CPUID 00000005: 00000040-00000040-00000003-00000010
CPUID 00000006: 00000001-00000002-00000001-00000000
CPUID 00000007: 00000000-00000000-00000000-00000000
CPUID 00000008: 00000000-00000000-00000000-00000000
CPUID 00000009: 00000000-00000000-00000000-00000000
CPUID 0000000A: 07280203-00000000-00000000-00000503
CPUID 80000000: 80000008-00000000-00000000-00000000
CPUID 80000001: 00000000-00000000-00000001-20100000
CPUID 80000002: 20202020-20202020-746E4920-52286C65
CPUID 80000003: 74412029-54286D6F-4320294D-44205550
CPUID 80000004: 20353235-20402020-30382E31-007A4847
CPUID 80000005: 00000000-00000000-00000000-00000000
CPUID 80000006: 00000000-00000000-02006040-00000000
CPUID 80000007: 00000000-00000000-00000000-00000000
CPUID 80000008: 00003024-00000000-00000000-00000000

L1    Data Cache:     24 KB,  6-way Associative, 64-byte Line
L1  Instr. Cache:     32 KB,  8-way Associative, 64-byte Line
L2 Unified Cache:    512 KB,  8-way Associative, 64-byte Line

------[ Logical CPU #1 ]------

allcpu: Package 0 / Core 1 / Thread 0: Valid

CPUID 00000000: 0000000A-756E6547-6C65746E-49656E69
CPUID 00000001: 000106CA-02040800-0040E31D-BFEBFBFF
CPUID 00000002: 4FBA5901-0E3080C0-00000000-00000000
CPUID 00000003: 00000000-00000000-00000000-00000000
CPUID 00000004: 04004121-0140003F-0000003F-00000001
CPUID 00000004: 04004122-01C0003F-0000003F-00000001
CPUID 00000004: 04004143-01C0003F-000003FF-00000001
CPUID 00000005: 00000040-00000040-00000003-00000010
CPUID 00000006: 00000001-00000002-00000001-00000000
CPUID 00000007: 00000000-00000000-00000000-00000000
CPUID 00000008: 00000000-00000000-00000000-00000000
CPUID 00000009: 00000000-00000000-00000000-00000000
CPUID 0000000A: 07280203-00000000-00000000-00000503
CPUID 80000000: 80000008-00000000-00000000-00000000
CPUID 80000001: 00000000-00000000-00000001-20100000
CPUID 80000002: 20202020-20202020-746E4920-52286C65
CPUID 80000003: 74412029-54286D6F-4320294D-44205550
CPUID 80000004: 20353235-20402020-30382E31-007A4847
CPUID 80000005: 00000000-00000000-00000000-00000000
CPUID 80000006: 00000000-00000000-02006040-00000000
CPUID 80000007: 00000000-00000000-00000000-00000000
CPUID 80000008: 00003024-00000000-00000000-00000000

L1    Data Cache:     24 KB,  6-way Associative, 64-byte Line
L1  Instr. Cache:     32 KB,  8-way Associative, 64-byte Line
L2 Unified Cache:    512 KB,  8-way Associative, 64-byte Line

------[ Logical CPU #2 ]------

allcpu: Package 0 / Core 0 / Thread 1: Valid, Virtual

CPUID 00000000: 0000000A-756E6547-6C65746E-49656E69
CPUID 00000001: 000106CA-01040800-0040E31D-BFEBFBFF
CPUID 00000002: 4FBA5901-0E3080C0-00000000-00000000
CPUID 00000003: 00000000-00000000-00000000-00000000
CPUID 00000004: 04004121-0140003F-0000003F-00000001
CPUID 00000004: 04004122-01C0003F-0000003F-00000001
CPUID 00000004: 04004143-01C0003F-000003FF-00000001
CPUID 00000005: 00000040-00000040-00000003-00000010
CPUID 00000006: 00000001-00000002-00000001-00000000
CPUID 00000007: 00000000-00000000-00000000-00000000
CPUID 00000008: 00000000-00000000-00000000-00000000
CPUID 00000009: 00000000-00000000-00000000-00000000
CPUID 0000000A: 07280203-00000000-00000000-00000503
CPUID 80000000: 80000008-00000000-00000000-00000000
CPUID 80000001: 00000000-00000000-00000001-20100000
CPUID 80000002: 20202020-20202020-746E4920-52286C65
CPUID 80000003: 74412029-54286D6F-4320294D-44205550
CPUID 80000004: 20353235-20402020-30382E31-007A4847
CPUID 80000005: 00000000-00000000-00000000-00000000
CPUID 80000006: 00000000-00000000-02006040-00000000
CPUID 80000007: 00000000-00000000-00000000-00000000
CPUID 80000008: 00003024-00000000-00000000-00000000

L1    Data Cache:     24 KB,  6-way Associative, 64-byte Line
L1  Instr. Cache:     32 KB,  8-way Associative, 64-byte Line
L2 Unified Cache:    512 KB,  8-way Associative, 64-byte Line

------[ Logical CPU #3 ]------

allcpu: Package 0 / Core 1 / Thread 1: Valid, Virtual

CPUID 00000000: 0000000A-756E6547-6C65746E-49656E69
CPUID 00000001: 000106CA-03040800-0040E31D-BFEBFBFF
CPUID 00000002: 4FBA5901-0E3080C0-00000000-00000000
CPUID 00000003: 00000000-00000000-00000000-00000000
CPUID 00000004: 04004121-0140003F-0000003F-00000001
CPUID 00000004: 04004122-01C0003F-0000003F-00000001
CPUID 00000004: 04004143-01C0003F-000003FF-00000001
CPUID 00000005: 00000040-00000040-00000003-00000010
CPUID 00000006: 00000001-00000002-00000001-00000000
CPUID 00000007: 00000000-00000000-00000000-00000000
CPUID 00000008: 00000000-00000000-00000000-00000000
CPUID 00000009: 00000000-00000000-00000000-00000000
CPUID 0000000A: 07280203-00000000-00000000-00000503
CPUID 80000000: 80000008-00000000-00000000-00000000
CPUID 80000001: 00000000-00000000-00000001-20100000
CPUID 80000002: 20202020-20202020-746E4920-52286C65
CPUID 80000003: 74412029-54286D6F-4320294D-44205550
CPUID 80000004: 20353235-20402020-30382E31-007A4847
CPUID 80000005: 00000000-00000000-00000000-00000000
CPUID 80000006: 00000000-00000000-02006040-00000000
CPUID 80000007: 00000000-00000000-00000000-00000000
CPUID 80000008: 00003024-00000000-00000000-00000000

L1    Data Cache:     24 KB,  6-way Associative, 64-byte Line
L1  Instr. Cache:     32 KB,  8-way Associative, 64-byte Line
L2 Unified Cache:    512 KB,  8-way Associative, 64-byte Line

------[ All CPUs ]------

CPU   0: APICID   0 / Package 0 / Core  0 / Thread 0: Valid
CPU   1: APICID   2 / Package 0 / Core  1 / Thread 0: Valid
CPU   2: APICID   1 / Package 0 / Core  0 / Thread 1: Valid, Virtual
CPU   3: APICID   3 / Package 0 / Core  1 / Thread 1: Valid, Virtual

------[ MSR Registers ]------

MSR 00000017: 000C-0000-8036-A911 [PlatID = 3]
MSR 0000001B: 0000-0000-FEE0-0900
MSR 0000002A: 0000-0000-C248-1400
MSR 0000008B: 0000-0107-0000-0000
MSR 000000CD: 0000-0000-0000-0002
MSR 000000CE: 1111-0900-5151-0000
MSR 000000E7: 0000-03B8-F705-6452
MSR 000000E8: 0000-03B8-F705-A028
MSR 000000EE: 0000-0001-0239-0001
MSR 0000011E: 0000-0000-7E00-011F
MSR 00000198: 0911-0911-0800-0911
MSR 00000199: 0000-0000-0000-0911
MSR 0000019A: 0000-0000-0000-0002
MSR 0000019B: 0000-0000-0000-0000
MSR 0000019C: 0000-0000-883D-0000
MSR 0000019D: 0000-0000-0000-0811
MSR 000001A0: 0000-0000-6094-0489

PerformanceFrequency = 1757851

Tjmax Temperature = 125 Celsius
