------[ Versions ]------

Program Version : AIDA64 Engineer v6.33.5721 Beta
BenchDLL Version: 4.5.850.8-x64
Windows Version : Microsoft Windows 10 Pro 10.0.19042.985 (64-bit)
GetProductInfo  : 0x00000030

------[ CPU Info ]------

CPU Type          : OctalCore Intel Core i9-11900K, 3500 MHz (35 x 100)
CPU Alias         : Rocket Lake-S
CPU Platform      : LGA1200
CPU Stepping      : B0
Instruction Set   : x86, x86-64, MMX, SSE, SSE2, SSE3, SSSE3, SSE4.1, SSE4.2, AVX, AVX2, AVX-512, FMA, AES, SHA
CPUID Manufacturer: GenuineIntel
CPUID CPU Name    : 11th Gen Intel(R) Core(TM) i9-11900K @ 3.50GHz
CPUID Revision    : 000A0671h
IA Brand ID       : 00h  (Unknown)
Platform ID       : 4Dh  (LGA1200)
HTT / CMP Units   : 2 / 8
Max. NUMA Node    : 0

Tjmax Temperature          : 100 Celsius
HTC Temperature Limit      : 0 Celsius
CPU TDP                    : 125 W
CPU Max Power Limit        : Unlimited Power / Unlimited Time
CPU Power Limit 1 (Long)   : 4095 W / 8.00 sec  (Unlocked)
CPU Power Limit 2 (Short)  : 4095 W / 2.44 ms  (Unlocked)
Max Turbo Boost Multipliers: 1C: 53x, 2C: 53x, 3C: 51x, 4C: 51x, 5C: 49x, 6C: 49x, 7C: 48x, 8C: 48x

------[ Motherboard Info ]------

Motherboard ID      : <DMI>
Motherboard Model   : Gigabyte Z590 Aorus Master
Motherboard Chipset : Intel Tiger Point Z590, Intel Rocket Lake-S

DMI MB Manufacturer : Gigabyte Technology Co., Ltd.
DMI MB Product      : Z590 AORUS MASTER
DMI MB Version      : Default string
DMI MB Serial       : Default string
DMI SYS Manufacturer: Gigabyte Technology Co., Ltd.
DMI SYS Product     : Z590 AORUS MASTER
DMI SYS Version     : -CF
DMI SYS Serial      : Default string
DMI BIOS Version    : F3


------[ CPUID Registers / Logical CPU #0 ]------

allcpu: Package 0 / Core 0 / Thread 0: Valid

CPUID 00000000: 0000001B-756E6547-6C65746E-49656E69 [GenuineIntel]
CPUID 00000001: 000A0671-00100800-7FFAFBFF-BFEBFBFF
CPUID 00000002: 00FEFF01-000000F0-00000000-00000000
CPUID 00000003: 00000000-00000000-00000000-00000000
CPUID 00000004: 1C004121-02C0003F-0000003F-00000000 [SL 00] [L1D: 48 KB]
CPUID 00000004: 1C004122-01C0003F-0000003F-00000000 [SL 01] [L1I: 32 KB]
CPUID 00000004: 1C004143-01C0003F-000003FF-00000000 [SL 02] [L2U: 512 KB]
CPUID 00000004: 1C03C163-03C0003F-00003FFF-00000006 [SL 03] [L3U: 16 MB]
CPUID 00000005: 00000040-00000040-00000003-11121020
CPUID 00000006: 0003EFF5-00000002-00000001-00000000
CPUID 00000007: 00000000-F2BF67EB-00405F4E-BC000410 [SL 00]
CPUID 00000008: 00000000-00000000-00000000-00000000
CPUID 00000009: 00000000-00000000-00000000-00000000
CPUID 0000000A: 08300805-00000000-0000000F-00008604
CPUID 0000000B: 00000001-00000002-00000100-00000000 [SL 00]
CPUID 0000000B: 00000004-00000010-00000201-00000000 [SL 01]
CPUID 0000000C: 00000000-00000000-00000000-00000000
CPUID 0000000D: 000002FF-00000A80-00000A88-00000000 [SL 00] [x87]
CPUID 0000000D: 0000000F-00000A80-00002100-00000000 [SL 01] [SSE]
CPUID 0000000D: 00000100-00000240-00000000-00000000 [SL 02] [AVX]
CPUID 0000000D: 00000040-000003C0-00000000-00000000 [SL 03] [MPX BNDREGS]
CPUID 0000000D: 00000040-00000400-00000000-00000000 [SL 04] [MPX BNDCSR]
CPUID 0000000D: 00000040-00000440-00000000-00000000 [SL 05] [AVX-512 Opmask]
CPUID 0000000D: 00000200-00000480-00000000-00000000 [SL 06] [AVX-512 Hi256]
CPUID 0000000D: 00000400-00000680-00000000-00000000 [SL 07] [AVX-512 Hi16]
CPUID 0000000D: 00000080-00000000-00000001-00000000 [SL 08] [PT]
CPUID 0000000D: 00000008-00000A80-00000000-00000000 [SL 09] [PKRU]
CPUID 0000000D: 00000008-00000000-00000001-00000000 [SL 0D]
CPUID 0000000E: 00000000-00000000-00000000-00000000
CPUID 0000000F: 00000000-00000000-00000000-00000000 [SL 00]
CPUID 0000000F: 00000000-00000000-00000000-00000000 [SL 01]
CPUID 00000010: 00000000-00000000-00000000-00000000 [SL 00]
CPUID 00000010: 00000000-00000000-00000000-00000000 [SL 01]
CPUID 00000011: 00000000-00000000-00000000-00000000
CPUID 00000012: 00000000-00000000-00000000-00000000 [SL 00]
CPUID 00000012: 00000000-00000000-00000000-00000000 [SL 01]
CPUID 00000013: 00000000-00000000-00000000-00000000
CPUID 00000014: 00000001-0000000F-00000007-00000000 [SL 00]
CPUID 00000014: 02490002-003F1FFF-00000000-00000000 [SL 01]
CPUID 00000015: 00000002-00000124-016E3600-00000000 [146.00x / 24000000]
CPUID 00000016: 00000DAC-000014B4-00000064-00000000 [3500 / 5300 / 100]
CPUID 00000017: 00000000-00000000-00000000-00000000 [SL 00]
CPUID 00000018: 00000007-00000000-00000000-00000000 [SL 00]
CPUID 00000018: 00000000-00080007-00000001-00004122 [SL 01]
CPUID 00000018: 00000000-0010000F-00000001-00004125 [SL 02]
CPUID 00000018: 00000000-00040001-00000010-00004024 [SL 03]
CPUID 00000018: 00000000-00040006-00000008-00004024 [SL 04]
CPUID 00000018: 00000000-00080008-00000001-00004124 [SL 05]
CPUID 00000018: 00000000-00080007-00000080-00004043 [SL 06]
CPUID 00000018: 00000000-00080009-00000080-00004043 [SL 07]
CPUID 00000019: 00000000-00000000-00000000-00000000
CPUID 0000001A: 00000000-00000000-00000000-00000000
CPUID 0000001B: 00000000-00000000-00000000-00000000
CPUID 80000000: 80000008-00000000-00000000-00000000
CPUID 80000001: 00000000-00000000-00000121-2C100000
CPUID 80000002: 68743131-6E654720-746E4920-52286C65 [11th Gen Intel(R]
CPUID 80000003: 6F432029-54286572-6920294D-31312D39 [) Core(TM) i9-11]
CPUID 80000004: 4B303039-33204020-4730352E-00007A48 [900K @ 3.50GHz]
CPUID 80000005: 00000000-00000000-00000000-00000000 [L1D: 0 KB / L1I: 0 KB]
CPUID 80000006: 00000000-00000000-01006040-00000000 [L2: 256 KB] / L3: 0 KB]
CPUID 80000007: 00000000-00000000-00000000-00000100
CPUID 80000008: 00003027-00000000-00000000-00000000

L1    Data Cache:    48 KB, 12-way Associative, 64-byte Line
L1  Instr. Cache:    32 KB,  8-way Associative, 64-byte Line
L2 Unified Cache:   512 KB,  8-way Associative, 64-byte Line
L3 Unified Cache:    16 MB, 16-way Associative, 64-byte Line

------[ CPUID Registers / Logical CPU #1 ]------

allcpu: Package 0 / Core 0 / Thread 1: Valid, Virtual

CPUID 00000000: 0000001B-756E6547-6C65746E-49656E69 [GenuineIntel]
CPUID 00000001: 000A0671-01100800-7FFAFBFF-BFEBFBFF
CPUID 00000002: 00FEFF01-000000F0-00000000-00000000
CPUID 00000003: 00000000-00000000-00000000-00000000
CPUID 00000004: 1C004121-02C0003F-0000003F-00000000 [SL 00] [L1D: 48 KB]
CPUID 00000004: 1C004122-01C0003F-0000003F-00000000 [SL 01] [L1I: 32 KB]
CPUID 00000004: 1C004143-01C0003F-000003FF-00000000 [SL 02] [L2U: 512 KB]
CPUID 00000004: 1C03C163-03C0003F-00003FFF-00000006 [SL 03] [L3U: 16 MB]
CPUID 00000005: 00000040-00000040-00000003-11121020
CPUID 00000006: 0003EFF5-00000002-00000001-00000000
CPUID 00000007: 00000000-F2BF67EB-00405F4E-BC000410 [SL 00]
CPUID 00000008: 00000000-00000000-00000000-00000000
CPUID 00000009: 00000000-00000000-00000000-00000000
CPUID 0000000A: 08300805-00000000-0000000F-00008604
CPUID 0000000B: 00000001-00000002-00000100-00000001 [SL 00]
CPUID 0000000B: 00000004-00000010-00000201-00000001 [SL 01]
CPUID 0000000C: 00000000-00000000-00000000-00000000
CPUID 0000000D: 000002FF-00000A80-00000A88-00000000 [SL 00] [x87]
CPUID 0000000D: 0000000F-00000A80-00002100-00000000 [SL 01] [SSE]
CPUID 0000000D: 00000100-00000240-00000000-00000000 [SL 02] [AVX]
CPUID 0000000D: 00000040-000003C0-00000000-00000000 [SL 03] [MPX BNDREGS]
CPUID 0000000D: 00000040-00000400-00000000-00000000 [SL 04] [MPX BNDCSR]
CPUID 0000000D: 00000040-00000440-00000000-00000000 [SL 05] [AVX-512 Opmask]
CPUID 0000000D: 00000200-00000480-00000000-00000000 [SL 06] [AVX-512 Hi256]
CPUID 0000000D: 00000400-00000680-00000000-00000000 [SL 07] [AVX-512 Hi16]
CPUID 0000000D: 00000080-00000000-00000001-00000000 [SL 08] [PT]
CPUID 0000000D: 00000008-00000A80-00000000-00000000 [SL 09] [PKRU]
CPUID 0000000D: 00000008-00000000-00000001-00000000 [SL 0D]
CPUID 0000000E: 00000000-00000000-00000000-00000000
CPUID 0000000F: 00000000-00000000-00000000-00000000 [SL 00]
CPUID 0000000F: 00000000-00000000-00000000-00000000 [SL 01]
CPUID 00000010: 00000000-00000000-00000000-00000000 [SL 00]
CPUID 00000010: 00000000-00000000-00000000-00000000 [SL 01]
CPUID 00000011: 00000000-00000000-00000000-00000000
CPUID 00000012: 00000000-00000000-00000000-00000000 [SL 00]
CPUID 00000012: 00000000-00000000-00000000-00000000 [SL 01]
CPUID 00000013: 00000000-00000000-00000000-00000000
CPUID 00000014: 00000001-0000000F-00000007-00000000 [SL 00]
CPUID 00000014: 02490002-003F1FFF-00000000-00000000 [SL 01]
CPUID 00000015: 00000002-00000124-016E3600-00000000 [146.00x / 24000000]
CPUID 00000016: 00000DAC-000014B4-00000064-00000000 [3500 / 5300 / 100]
CPUID 00000017: 00000000-00000000-00000000-00000000 [SL 00]
CPUID 00000018: 00000007-00000000-00000000-00000000 [SL 00]
CPUID 00000018: 00000000-00080007-00000001-00004122 [SL 01]
CPUID 00000018: 00000000-0010000F-00000001-00004125 [SL 02]
CPUID 00000018: 00000000-00040001-00000010-00004024 [SL 03]
CPUID 00000018: 00000000-00040006-00000008-00004024 [SL 04]
CPUID 00000018: 00000000-00080008-00000001-00004124 [SL 05]
CPUID 00000018: 00000000-00080007-00000080-00004043 [SL 06]
CPUID 00000018: 00000000-00080009-00000080-00004043 [SL 07]
CPUID 00000019: 00000000-00000000-00000000-00000000
CPUID 0000001A: 00000000-00000000-00000000-00000000
CPUID 0000001B: 00000000-00000000-00000000-00000000
CPUID 80000000: 80000008-00000000-00000000-00000000
CPUID 80000001: 00000000-00000000-00000121-2C100000
CPUID 80000002: 68743131-6E654720-746E4920-52286C65 [11th Gen Intel(R]
CPUID 80000003: 6F432029-54286572-6920294D-31312D39 [) Core(TM) i9-11]
CPUID 80000004: 4B303039-33204020-4730352E-00007A48 [900K @ 3.50GHz]
CPUID 80000005: 00000000-00000000-00000000-00000000 [L1D: 0 KB / L1I: 0 KB]
CPUID 80000006: 00000000-00000000-01006040-00000000 [L2: 256 KB] / L3: 0 KB]
CPUID 80000007: 00000000-00000000-00000000-00000100
CPUID 80000008: 00003027-00000000-00000000-00000000

L1    Data Cache:    48 KB, 12-way Associative, 64-byte Line
L1  Instr. Cache:    32 KB,  8-way Associative, 64-byte Line
L2 Unified Cache:   512 KB,  8-way Associative, 64-byte Line
L3 Unified Cache:    16 MB, 16-way Associative, 64-byte Line

------[ CPUID Registers / Logical CPU #2 ]------

allcpu: Package 0 / Core 1 / Thread 0: Valid

CPUID 00000000: 0000001B-756E6547-6C65746E-49656E69 [GenuineIntel]
CPUID 00000001: 000A0671-02100800-7FFAFBFF-BFEBFBFF
CPUID 00000002: 00FEFF01-000000F0-00000000-00000000
CPUID 00000003: 00000000-00000000-00000000-00000000
CPUID 00000004: 1C004121-02C0003F-0000003F-00000000 [SL 00] [L1D: 48 KB]
CPUID 00000004: 1C004122-01C0003F-0000003F-00000000 [SL 01] [L1I: 32 KB]
CPUID 00000004: 1C004143-01C0003F-000003FF-00000000 [SL 02] [L2U: 512 KB]
CPUID 00000004: 1C03C163-03C0003F-00003FFF-00000006 [SL 03] [L3U: 16 MB]
CPUID 00000005: 00000040-00000040-00000003-11121020
CPUID 00000006: 0003EFF5-00000002-00000001-00000000
CPUID 00000007: 00000000-F2BF67EB-00405F4E-BC000410 [SL 00]
CPUID 00000008: 00000000-00000000-00000000-00000000
CPUID 00000009: 00000000-00000000-00000000-00000000
CPUID 0000000A: 08300805-00000000-0000000F-00008604
CPUID 0000000B: 00000001-00000002-00000100-00000002 [SL 00]
CPUID 0000000B: 00000004-00000010-00000201-00000002 [SL 01]
CPUID 0000000C: 00000000-00000000-00000000-00000000
CPUID 0000000D: 000002FF-00000A80-00000A88-00000000 [SL 00] [x87]
CPUID 0000000D: 0000000F-00000A80-00002100-00000000 [SL 01] [SSE]
CPUID 0000000D: 00000100-00000240-00000000-00000000 [SL 02] [AVX]
CPUID 0000000D: 00000040-000003C0-00000000-00000000 [SL 03] [MPX BNDREGS]
CPUID 0000000D: 00000040-00000400-00000000-00000000 [SL 04] [MPX BNDCSR]
CPUID 0000000D: 00000040-00000440-00000000-00000000 [SL 05] [AVX-512 Opmask]
CPUID 0000000D: 00000200-00000480-00000000-00000000 [SL 06] [AVX-512 Hi256]
CPUID 0000000D: 00000400-00000680-00000000-00000000 [SL 07] [AVX-512 Hi16]
CPUID 0000000D: 00000080-00000000-00000001-00000000 [SL 08] [PT]
CPUID 0000000D: 00000008-00000A80-00000000-00000000 [SL 09] [PKRU]
CPUID 0000000D: 00000008-00000000-00000001-00000000 [SL 0D]
CPUID 0000000E: 00000000-00000000-00000000-00000000
CPUID 0000000F: 00000000-00000000-00000000-00000000 [SL 00]
CPUID 0000000F: 00000000-00000000-00000000-00000000 [SL 01]
CPUID 00000010: 00000000-00000000-00000000-00000000 [SL 00]
CPUID 00000010: 00000000-00000000-00000000-00000000 [SL 01]
CPUID 00000011: 00000000-00000000-00000000-00000000
CPUID 00000012: 00000000-00000000-00000000-00000000 [SL 00]
CPUID 00000012: 00000000-00000000-00000000-00000000 [SL 01]
CPUID 00000013: 00000000-00000000-00000000-00000000
CPUID 00000014: 00000001-0000000F-00000007-00000000 [SL 00]
CPUID 00000014: 02490002-003F1FFF-00000000-00000000 [SL 01]
CPUID 00000015: 00000002-00000124-016E3600-00000000 [146.00x / 24000000]
CPUID 00000016: 00000DAC-000014B4-00000064-00000000 [3500 / 5300 / 100]
CPUID 00000017: 00000000-00000000-00000000-00000000 [SL 00]
CPUID 00000018: 00000007-00000000-00000000-00000000 [SL 00]
CPUID 00000018: 00000000-00080007-00000001-00004122 [SL 01]
CPUID 00000018: 00000000-0010000F-00000001-00004125 [SL 02]
CPUID 00000018: 00000000-00040001-00000010-00004024 [SL 03]
CPUID 00000018: 00000000-00040006-00000008-00004024 [SL 04]
CPUID 00000018: 00000000-00080008-00000001-00004124 [SL 05]
CPUID 00000018: 00000000-00080007-00000080-00004043 [SL 06]
CPUID 00000018: 00000000-00080009-00000080-00004043 [SL 07]
CPUID 00000019: 00000000-00000000-00000000-00000000
CPUID 0000001A: 00000000-00000000-00000000-00000000
CPUID 0000001B: 00000000-00000000-00000000-00000000
CPUID 80000000: 80000008-00000000-00000000-00000000
CPUID 80000001: 00000000-00000000-00000121-2C100000
CPUID 80000002: 68743131-6E654720-746E4920-52286C65 [11th Gen Intel(R]
CPUID 80000003: 6F432029-54286572-6920294D-31312D39 [) Core(TM) i9-11]
CPUID 80000004: 4B303039-33204020-4730352E-00007A48 [900K @ 3.50GHz]
CPUID 80000005: 00000000-00000000-00000000-00000000 [L1D: 0 KB / L1I: 0 KB]
CPUID 80000006: 00000000-00000000-01006040-00000000 [L2: 256 KB] / L3: 0 KB]
CPUID 80000007: 00000000-00000000-00000000-00000100
CPUID 80000008: 00003027-00000000-00000000-00000000

L1    Data Cache:    48 KB, 12-way Associative, 64-byte Line
L1  Instr. Cache:    32 KB,  8-way Associative, 64-byte Line
L2 Unified Cache:   512 KB,  8-way Associative, 64-byte Line
L3 Unified Cache:    16 MB, 16-way Associative, 64-byte Line

------[ CPUID Registers / Logical CPU #3 ]------

allcpu: Package 0 / Core 1 / Thread 1: Valid, Virtual

CPUID 00000000: 0000001B-756E6547-6C65746E-49656E69 [GenuineIntel]
CPUID 00000001: 000A0671-03100800-7FFAFBFF-BFEBFBFF
CPUID 00000002: 00FEFF01-000000F0-00000000-00000000
CPUID 00000003: 00000000-00000000-00000000-00000000
CPUID 00000004: 1C004121-02C0003F-0000003F-00000000 [SL 00] [L1D: 48 KB]
CPUID 00000004: 1C004122-01C0003F-0000003F-00000000 [SL 01] [L1I: 32 KB]
CPUID 00000004: 1C004143-01C0003F-000003FF-00000000 [SL 02] [L2U: 512 KB]
CPUID 00000004: 1C03C163-03C0003F-00003FFF-00000006 [SL 03] [L3U: 16 MB]
CPUID 00000005: 00000040-00000040-00000003-11121020
CPUID 00000006: 0003EFF5-00000002-00000001-00000000
CPUID 00000007: 00000000-F2BF67EB-00405F4E-BC000410 [SL 00]
CPUID 00000008: 00000000-00000000-00000000-00000000
CPUID 00000009: 00000000-00000000-00000000-00000000
CPUID 0000000A: 08300805-00000000-0000000F-00008604
CPUID 0000000B: 00000001-00000002-00000100-00000003 [SL 00]
CPUID 0000000B: 00000004-00000010-00000201-00000003 [SL 01]
CPUID 0000000C: 00000000-00000000-00000000-00000000
CPUID 0000000D: 000002FF-00000A80-00000A88-00000000 [SL 00] [x87]
CPUID 0000000D: 0000000F-00000A80-00002100-00000000 [SL 01] [SSE]
CPUID 0000000D: 00000100-00000240-00000000-00000000 [SL 02] [AVX]
CPUID 0000000D: 00000040-000003C0-00000000-00000000 [SL 03] [MPX BNDREGS]
CPUID 0000000D: 00000040-00000400-00000000-00000000 [SL 04] [MPX BNDCSR]
CPUID 0000000D: 00000040-00000440-00000000-00000000 [SL 05] [AVX-512 Opmask]
CPUID 0000000D: 00000200-00000480-00000000-00000000 [SL 06] [AVX-512 Hi256]
CPUID 0000000D: 00000400-00000680-00000000-00000000 [SL 07] [AVX-512 Hi16]
CPUID 0000000D: 00000080-00000000-00000001-00000000 [SL 08] [PT]
CPUID 0000000D: 00000008-00000A80-00000000-00000000 [SL 09] [PKRU]
CPUID 0000000D: 00000008-00000000-00000001-00000000 [SL 0D]
CPUID 0000000E: 00000000-00000000-00000000-00000000
CPUID 0000000F: 00000000-00000000-00000000-00000000 [SL 00]
CPUID 0000000F: 00000000-00000000-00000000-00000000 [SL 01]
CPUID 00000010: 00000000-00000000-00000000-00000000 [SL 00]
CPUID 00000010: 00000000-00000000-00000000-00000000 [SL 01]
CPUID 00000011: 00000000-00000000-00000000-00000000
CPUID 00000012: 00000000-00000000-00000000-00000000 [SL 00]
CPUID 00000012: 00000000-00000000-00000000-00000000 [SL 01]
CPUID 00000013: 00000000-00000000-00000000-00000000
CPUID 00000014: 00000001-0000000F-00000007-00000000 [SL 00]
CPUID 00000014: 02490002-003F1FFF-00000000-00000000 [SL 01]
CPUID 00000015: 00000002-00000124-016E3600-00000000 [146.00x / 24000000]
CPUID 00000016: 00000DAC-000014B4-00000064-00000000 [3500 / 5300 / 100]
CPUID 00000017: 00000000-00000000-00000000-00000000 [SL 00]
CPUID 00000018: 00000007-00000000-00000000-00000000 [SL 00]
CPUID 00000018: 00000000-00080007-00000001-00004122 [SL 01]
CPUID 00000018: 00000000-0010000F-00000001-00004125 [SL 02]
CPUID 00000018: 00000000-00040001-00000010-00004024 [SL 03]
CPUID 00000018: 00000000-00040006-00000008-00004024 [SL 04]
CPUID 00000018: 00000000-00080008-00000001-00004124 [SL 05]
CPUID 00000018: 00000000-00080007-00000080-00004043 [SL 06]
CPUID 00000018: 00000000-00080009-00000080-00004043 [SL 07]
CPUID 00000019: 00000000-00000000-00000000-00000000
CPUID 0000001A: 00000000-00000000-00000000-00000000
CPUID 0000001B: 00000000-00000000-00000000-00000000
CPUID 80000000: 80000008-00000000-00000000-00000000
CPUID 80000001: 00000000-00000000-00000121-2C100000
CPUID 80000002: 68743131-6E654720-746E4920-52286C65 [11th Gen Intel(R]
CPUID 80000003: 6F432029-54286572-6920294D-31312D39 [) Core(TM) i9-11]
CPUID 80000004: 4B303039-33204020-4730352E-00007A48 [900K @ 3.50GHz]
CPUID 80000005: 00000000-00000000-00000000-00000000 [L1D: 0 KB / L1I: 0 KB]
CPUID 80000006: 00000000-00000000-01006040-00000000 [L2: 256 KB] / L3: 0 KB]
CPUID 80000007: 00000000-00000000-00000000-00000100
CPUID 80000008: 00003027-00000000-00000000-00000000

L1    Data Cache:    48 KB, 12-way Associative, 64-byte Line
L1  Instr. Cache:    32 KB,  8-way Associative, 64-byte Line
L2 Unified Cache:   512 KB,  8-way Associative, 64-byte Line
L3 Unified Cache:    16 MB, 16-way Associative, 64-byte Line

------[ CPUID Registers / Logical CPU #4 ]------

allcpu: Package 0 / Core 2 / Thread 0: Valid

CPUID 00000000: 0000001B-756E6547-6C65746E-49656E69 [GenuineIntel]
CPUID 00000001: 000A0671-04100800-7FFAFBFF-BFEBFBFF
CPUID 00000002: 00FEFF01-000000F0-00000000-00000000
CPUID 00000003: 00000000-00000000-00000000-00000000
CPUID 00000004: 1C004121-02C0003F-0000003F-00000000 [SL 00] [L1D: 48 KB]
CPUID 00000004: 1C004122-01C0003F-0000003F-00000000 [SL 01] [L1I: 32 KB]
CPUID 00000004: 1C004143-01C0003F-000003FF-00000000 [SL 02] [L2U: 512 KB]
CPUID 00000004: 1C03C163-03C0003F-00003FFF-00000006 [SL 03] [L3U: 16 MB]
CPUID 00000005: 00000040-00000040-00000003-11121020
CPUID 00000006: 0003EFF5-00000002-00000001-00000000
CPUID 00000007: 00000000-F2BF67EB-00405F4E-BC000410 [SL 00]
CPUID 00000008: 00000000-00000000-00000000-00000000
CPUID 00000009: 00000000-00000000-00000000-00000000
CPUID 0000000A: 08300805-00000000-0000000F-00008604
CPUID 0000000B: 00000001-00000002-00000100-00000004 [SL 00]
CPUID 0000000B: 00000004-00000010-00000201-00000004 [SL 01]
CPUID 0000000C: 00000000-00000000-00000000-00000000
CPUID 0000000D: 000002FF-00000A80-00000A88-00000000 [SL 00] [x87]
CPUID 0000000D: 0000000F-00000A80-00002100-00000000 [SL 01] [SSE]
CPUID 0000000D: 00000100-00000240-00000000-00000000 [SL 02] [AVX]
CPUID 0000000D: 00000040-000003C0-00000000-00000000 [SL 03] [MPX BNDREGS]
CPUID 0000000D: 00000040-00000400-00000000-00000000 [SL 04] [MPX BNDCSR]
CPUID 0000000D: 00000040-00000440-00000000-00000000 [SL 05] [AVX-512 Opmask]
CPUID 0000000D: 00000200-00000480-00000000-00000000 [SL 06] [AVX-512 Hi256]
CPUID 0000000D: 00000400-00000680-00000000-00000000 [SL 07] [AVX-512 Hi16]
CPUID 0000000D: 00000080-00000000-00000001-00000000 [SL 08] [PT]
CPUID 0000000D: 00000008-00000A80-00000000-00000000 [SL 09] [PKRU]
CPUID 0000000D: 00000008-00000000-00000001-00000000 [SL 0D]
CPUID 0000000E: 00000000-00000000-00000000-00000000
CPUID 0000000F: 00000000-00000000-00000000-00000000 [SL 00]
CPUID 0000000F: 00000000-00000000-00000000-00000000 [SL 01]
CPUID 00000010: 00000000-00000000-00000000-00000000 [SL 00]
CPUID 00000010: 00000000-00000000-00000000-00000000 [SL 01]
CPUID 00000011: 00000000-00000000-00000000-00000000
CPUID 00000012: 00000000-00000000-00000000-00000000 [SL 00]
CPUID 00000012: 00000000-00000000-00000000-00000000 [SL 01]
CPUID 00000013: 00000000-00000000-00000000-00000000
CPUID 00000014: 00000001-0000000F-00000007-00000000 [SL 00]
CPUID 00000014: 02490002-003F1FFF-00000000-00000000 [SL 01]
CPUID 00000015: 00000002-00000124-016E3600-00000000 [146.00x / 24000000]
CPUID 00000016: 00000DAC-000014B4-00000064-00000000 [3500 / 5300 / 100]
CPUID 00000017: 00000000-00000000-00000000-00000000 [SL 00]
CPUID 00000018: 00000007-00000000-00000000-00000000 [SL 00]
CPUID 00000018: 00000000-00080007-00000001-00004122 [SL 01]
CPUID 00000018: 00000000-0010000F-00000001-00004125 [SL 02]
CPUID 00000018: 00000000-00040001-00000010-00004024 [SL 03]
CPUID 00000018: 00000000-00040006-00000008-00004024 [SL 04]
CPUID 00000018: 00000000-00080008-00000001-00004124 [SL 05]
CPUID 00000018: 00000000-00080007-00000080-00004043 [SL 06]
CPUID 00000018: 00000000-00080009-00000080-00004043 [SL 07]
CPUID 00000019: 00000000-00000000-00000000-00000000
CPUID 0000001A: 00000000-00000000-00000000-00000000
CPUID 0000001B: 00000000-00000000-00000000-00000000
CPUID 80000000: 80000008-00000000-00000000-00000000
CPUID 80000001: 00000000-00000000-00000121-2C100000
CPUID 80000002: 68743131-6E654720-746E4920-52286C65 [11th Gen Intel(R]
CPUID 80000003: 6F432029-54286572-6920294D-31312D39 [) Core(TM) i9-11]
CPUID 80000004: 4B303039-33204020-4730352E-00007A48 [900K @ 3.50GHz]
CPUID 80000005: 00000000-00000000-00000000-00000000 [L1D: 0 KB / L1I: 0 KB]
CPUID 80000006: 00000000-00000000-01006040-00000000 [L2: 256 KB] / L3: 0 KB]
CPUID 80000007: 00000000-00000000-00000000-00000100
CPUID 80000008: 00003027-00000000-00000000-00000000

L1    Data Cache:    48 KB, 12-way Associative, 64-byte Line
L1  Instr. Cache:    32 KB,  8-way Associative, 64-byte Line
L2 Unified Cache:   512 KB,  8-way Associative, 64-byte Line
L3 Unified Cache:    16 MB, 16-way Associative, 64-byte Line

------[ CPUID Registers / Logical CPU #5 ]------

allcpu: Package 0 / Core 2 / Thread 1: Valid, Virtual

CPUID 00000000: 0000001B-756E6547-6C65746E-49656E69 [GenuineIntel]
CPUID 00000001: 000A0671-05100800-7FFAFBFF-BFEBFBFF
CPUID 00000002: 00FEFF01-000000F0-00000000-00000000
CPUID 00000003: 00000000-00000000-00000000-00000000
CPUID 00000004: 1C004121-02C0003F-0000003F-00000000 [SL 00] [L1D: 48 KB]
CPUID 00000004: 1C004122-01C0003F-0000003F-00000000 [SL 01] [L1I: 32 KB]
CPUID 00000004: 1C004143-01C0003F-000003FF-00000000 [SL 02] [L2U: 512 KB]
CPUID 00000004: 1C03C163-03C0003F-00003FFF-00000006 [SL 03] [L3U: 16 MB]
CPUID 00000005: 00000040-00000040-00000003-11121020
CPUID 00000006: 0003EFF5-00000002-00000001-00000000
CPUID 00000007: 00000000-F2BF67EB-00405F4E-BC000410 [SL 00]
CPUID 00000008: 00000000-00000000-00000000-00000000
CPUID 00000009: 00000000-00000000-00000000-00000000
CPUID 0000000A: 08300805-00000000-0000000F-00008604
CPUID 0000000B: 00000001-00000002-00000100-00000005 [SL 00]
CPUID 0000000B: 00000004-00000010-00000201-00000005 [SL 01]
CPUID 0000000C: 00000000-00000000-00000000-00000000
CPUID 0000000D: 000002FF-00000A80-00000A88-00000000 [SL 00] [x87]
CPUID 0000000D: 0000000F-00000A80-00002100-00000000 [SL 01] [SSE]
CPUID 0000000D: 00000100-00000240-00000000-00000000 [SL 02] [AVX]
CPUID 0000000D: 00000040-000003C0-00000000-00000000 [SL 03] [MPX BNDREGS]
CPUID 0000000D: 00000040-00000400-00000000-00000000 [SL 04] [MPX BNDCSR]
CPUID 0000000D: 00000040-00000440-00000000-00000000 [SL 05] [AVX-512 Opmask]
CPUID 0000000D: 00000200-00000480-00000000-00000000 [SL 06] [AVX-512 Hi256]
CPUID 0000000D: 00000400-00000680-00000000-00000000 [SL 07] [AVX-512 Hi16]
CPUID 0000000D: 00000080-00000000-00000001-00000000 [SL 08] [PT]
CPUID 0000000D: 00000008-00000A80-00000000-00000000 [SL 09] [PKRU]
CPUID 0000000D: 00000008-00000000-00000001-00000000 [SL 0D]
CPUID 0000000E: 00000000-00000000-00000000-00000000
CPUID 0000000F: 00000000-00000000-00000000-00000000 [SL 00]
CPUID 0000000F: 00000000-00000000-00000000-00000000 [SL 01]
CPUID 00000010: 00000000-00000000-00000000-00000000 [SL 00]
CPUID 00000010: 00000000-00000000-00000000-00000000 [SL 01]
CPUID 00000011: 00000000-00000000-00000000-00000000
CPUID 00000012: 00000000-00000000-00000000-00000000 [SL 00]
CPUID 00000012: 00000000-00000000-00000000-00000000 [SL 01]
CPUID 00000013: 00000000-00000000-00000000-00000000
CPUID 00000014: 00000001-0000000F-00000007-00000000 [SL 00]
CPUID 00000014: 02490002-003F1FFF-00000000-00000000 [SL 01]
CPUID 00000015: 00000002-00000124-016E3600-00000000 [146.00x / 24000000]
CPUID 00000016: 00000DAC-000014B4-00000064-00000000 [3500 / 5300 / 100]
CPUID 00000017: 00000000-00000000-00000000-00000000 [SL 00]
CPUID 00000018: 00000007-00000000-00000000-00000000 [SL 00]
CPUID 00000018: 00000000-00080007-00000001-00004122 [SL 01]
CPUID 00000018: 00000000-0010000F-00000001-00004125 [SL 02]
CPUID 00000018: 00000000-00040001-00000010-00004024 [SL 03]
CPUID 00000018: 00000000-00040006-00000008-00004024 [SL 04]
CPUID 00000018: 00000000-00080008-00000001-00004124 [SL 05]
CPUID 00000018: 00000000-00080007-00000080-00004043 [SL 06]
CPUID 00000018: 00000000-00080009-00000080-00004043 [SL 07]
CPUID 00000019: 00000000-00000000-00000000-00000000
CPUID 0000001A: 00000000-00000000-00000000-00000000
CPUID 0000001B: 00000000-00000000-00000000-00000000
CPUID 80000000: 80000008-00000000-00000000-00000000
CPUID 80000001: 00000000-00000000-00000121-2C100000
CPUID 80000002: 68743131-6E654720-746E4920-52286C65 [11th Gen Intel(R]
CPUID 80000003: 6F432029-54286572-6920294D-31312D39 [) Core(TM) i9-11]
CPUID 80000004: 4B303039-33204020-4730352E-00007A48 [900K @ 3.50GHz]
CPUID 80000005: 00000000-00000000-00000000-00000000 [L1D: 0 KB / L1I: 0 KB]
CPUID 80000006: 00000000-00000000-01006040-00000000 [L2: 256 KB] / L3: 0 KB]
CPUID 80000007: 00000000-00000000-00000000-00000100
CPUID 80000008: 00003027-00000000-00000000-00000000

L1    Data Cache:    48 KB, 12-way Associative, 64-byte Line
L1  Instr. Cache:    32 KB,  8-way Associative, 64-byte Line
L2 Unified Cache:   512 KB,  8-way Associative, 64-byte Line
L3 Unified Cache:    16 MB, 16-way Associative, 64-byte Line

------[ CPUID Registers / Logical CPU #6 ]------

allcpu: Package 0 / Core 3 / Thread 0: Valid

CPUID 00000000: 0000001B-756E6547-6C65746E-49656E69 [GenuineIntel]
CPUID 00000001: 000A0671-06100800-7FFAFBFF-BFEBFBFF
CPUID 00000002: 00FEFF01-000000F0-00000000-00000000
CPUID 00000003: 00000000-00000000-00000000-00000000
CPUID 00000004: 1C004121-02C0003F-0000003F-00000000 [SL 00] [L1D: 48 KB]
CPUID 00000004: 1C004122-01C0003F-0000003F-00000000 [SL 01] [L1I: 32 KB]
CPUID 00000004: 1C004143-01C0003F-000003FF-00000000 [SL 02] [L2U: 512 KB]
CPUID 00000004: 1C03C163-03C0003F-00003FFF-00000006 [SL 03] [L3U: 16 MB]
CPUID 00000005: 00000040-00000040-00000003-11121020
CPUID 00000006: 0003EFF5-00000002-00000001-00000000
CPUID 00000007: 00000000-F2BF67EB-00405F4E-BC000410 [SL 00]
CPUID 00000008: 00000000-00000000-00000000-00000000
CPUID 00000009: 00000000-00000000-00000000-00000000
CPUID 0000000A: 08300805-00000000-0000000F-00008604
CPUID 0000000B: 00000001-00000002-00000100-00000006 [SL 00]
CPUID 0000000B: 00000004-00000010-00000201-00000006 [SL 01]
CPUID 0000000C: 00000000-00000000-00000000-00000000
CPUID 0000000D: 000002FF-00000A80-00000A88-00000000 [SL 00] [x87]
CPUID 0000000D: 0000000F-00000A80-00002100-00000000 [SL 01] [SSE]
CPUID 0000000D: 00000100-00000240-00000000-00000000 [SL 02] [AVX]
CPUID 0000000D: 00000040-000003C0-00000000-00000000 [SL 03] [MPX BNDREGS]
CPUID 0000000D: 00000040-00000400-00000000-00000000 [SL 04] [MPX BNDCSR]
CPUID 0000000D: 00000040-00000440-00000000-00000000 [SL 05] [AVX-512 Opmask]
CPUID 0000000D: 00000200-00000480-00000000-00000000 [SL 06] [AVX-512 Hi256]
CPUID 0000000D: 00000400-00000680-00000000-00000000 [SL 07] [AVX-512 Hi16]
CPUID 0000000D: 00000080-00000000-00000001-00000000 [SL 08] [PT]
CPUID 0000000D: 00000008-00000A80-00000000-00000000 [SL 09] [PKRU]
CPUID 0000000D: 00000008-00000000-00000001-00000000 [SL 0D]
CPUID 0000000E: 00000000-00000000-00000000-00000000
CPUID 0000000F: 00000000-00000000-00000000-00000000 [SL 00]
CPUID 0000000F: 00000000-00000000-00000000-00000000 [SL 01]
CPUID 00000010: 00000000-00000000-00000000-00000000 [SL 00]
CPUID 00000010: 00000000-00000000-00000000-00000000 [SL 01]
CPUID 00000011: 00000000-00000000-00000000-00000000
CPUID 00000012: 00000000-00000000-00000000-00000000 [SL 00]
CPUID 00000012: 00000000-00000000-00000000-00000000 [SL 01]
CPUID 00000013: 00000000-00000000-00000000-00000000
CPUID 00000014: 00000001-0000000F-00000007-00000000 [SL 00]
CPUID 00000014: 02490002-003F1FFF-00000000-00000000 [SL 01]
CPUID 00000015: 00000002-00000124-016E3600-00000000 [146.00x / 24000000]
CPUID 00000016: 00000DAC-000014B4-00000064-00000000 [3500 / 5300 / 100]
CPUID 00000017: 00000000-00000000-00000000-00000000 [SL 00]
CPUID 00000018: 00000007-00000000-00000000-00000000 [SL 00]
CPUID 00000018: 00000000-00080007-00000001-00004122 [SL 01]
CPUID 00000018: 00000000-0010000F-00000001-00004125 [SL 02]
CPUID 00000018: 00000000-00040001-00000010-00004024 [SL 03]
CPUID 00000018: 00000000-00040006-00000008-00004024 [SL 04]
CPUID 00000018: 00000000-00080008-00000001-00004124 [SL 05]
CPUID 00000018: 00000000-00080007-00000080-00004043 [SL 06]
CPUID 00000018: 00000000-00080009-00000080-00004043 [SL 07]
CPUID 00000019: 00000000-00000000-00000000-00000000
CPUID 0000001A: 00000000-00000000-00000000-00000000
CPUID 0000001B: 00000000-00000000-00000000-00000000
CPUID 80000000: 80000008-00000000-00000000-00000000
CPUID 80000001: 00000000-00000000-00000121-2C100000
CPUID 80000002: 68743131-6E654720-746E4920-52286C65 [11th Gen Intel(R]
CPUID 80000003: 6F432029-54286572-6920294D-31312D39 [) Core(TM) i9-11]
CPUID 80000004: 4B303039-33204020-4730352E-00007A48 [900K @ 3.50GHz]
CPUID 80000005: 00000000-00000000-00000000-00000000 [L1D: 0 KB / L1I: 0 KB]
CPUID 80000006: 00000000-00000000-01006040-00000000 [L2: 256 KB] / L3: 0 KB]
CPUID 80000007: 00000000-00000000-00000000-00000100
CPUID 80000008: 00003027-00000000-00000000-00000000

L1    Data Cache:    48 KB, 12-way Associative, 64-byte Line
L1  Instr. Cache:    32 KB,  8-way Associative, 64-byte Line
L2 Unified Cache:   512 KB,  8-way Associative, 64-byte Line
L3 Unified Cache:    16 MB, 16-way Associative, 64-byte Line

------[ CPUID Registers / Logical CPU #7 ]------

allcpu: Package 0 / Core 4 / Thread 0: Valid

CPUID 00000000: 0000001B-756E6547-6C65746E-49656E69 [GenuineIntel]
CPUID 00000001: 000A0671-08100800-7FFAFBFF-BFEBFBFF
CPUID 00000002: 00FEFF01-000000F0-00000000-00000000
CPUID 00000003: 00000000-00000000-00000000-00000000
CPUID 00000004: 1C004121-02C0003F-0000003F-00000000 [SL 00] [L1D: 48 KB]
CPUID 00000004: 1C004122-01C0003F-0000003F-00000000 [SL 01] [L1I: 32 KB]
CPUID 00000004: 1C004143-01C0003F-000003FF-00000000 [SL 02] [L2U: 512 KB]
CPUID 00000004: 1C03C163-03C0003F-00003FFF-00000006 [SL 03] [L3U: 16 MB]
CPUID 00000005: 00000040-00000040-00000003-11121020
CPUID 00000006: 0003EFF5-00000002-00000001-00000000
CPUID 00000007: 00000000-F2BF67EB-00405F4E-BC000410 [SL 00]
CPUID 00000008: 00000000-00000000-00000000-00000000
CPUID 00000009: 00000000-00000000-00000000-00000000
CPUID 0000000A: 08300805-00000000-0000000F-00008604
CPUID 0000000B: 00000001-00000002-00000100-00000008 [SL 00]
CPUID 0000000B: 00000004-00000010-00000201-00000008 [SL 01]
CPUID 0000000C: 00000000-00000000-00000000-00000000
CPUID 0000000D: 000002FF-00000A80-00000A88-00000000 [SL 00] [x87]
CPUID 0000000D: 0000000F-00000A80-00002100-00000000 [SL 01] [SSE]
CPUID 0000000D: 00000100-00000240-00000000-00000000 [SL 02] [AVX]
CPUID 0000000D: 00000040-000003C0-00000000-00000000 [SL 03] [MPX BNDREGS]
CPUID 0000000D: 00000040-00000400-00000000-00000000 [SL 04] [MPX BNDCSR]
CPUID 0000000D: 00000040-00000440-00000000-00000000 [SL 05] [AVX-512 Opmask]
CPUID 0000000D: 00000200-00000480-00000000-00000000 [SL 06] [AVX-512 Hi256]
CPUID 0000000D: 00000400-00000680-00000000-00000000 [SL 07] [AVX-512 Hi16]
CPUID 0000000D: 00000080-00000000-00000001-00000000 [SL 08] [PT]
CPUID 0000000D: 00000008-00000A80-00000000-00000000 [SL 09] [PKRU]
CPUID 0000000D: 00000008-00000000-00000001-00000000 [SL 0D]
CPUID 0000000E: 00000000-00000000-00000000-00000000
CPUID 0000000F: 00000000-00000000-00000000-00000000 [SL 00]
CPUID 0000000F: 00000000-00000000-00000000-00000000 [SL 01]
CPUID 00000010: 00000000-00000000-00000000-00000000 [SL 00]
CPUID 00000010: 00000000-00000000-00000000-00000000 [SL 01]
CPUID 00000011: 00000000-00000000-00000000-00000000
CPUID 00000012: 00000000-00000000-00000000-00000000 [SL 00]
CPUID 00000012: 00000000-00000000-00000000-00000000 [SL 01]
CPUID 00000013: 00000000-00000000-00000000-00000000
CPUID 00000014: 00000001-0000000F-00000007-00000000 [SL 00]
CPUID 00000014: 02490002-003F1FFF-00000000-00000000 [SL 01]
CPUID 00000015: 00000002-00000124-016E3600-00000000 [146.00x / 24000000]
CPUID 00000016: 00000DAC-000014B4-00000064-00000000 [3500 / 5300 / 100]
CPUID 00000017: 00000000-00000000-00000000-00000000 [SL 00]
CPUID 00000018: 00000007-00000000-00000000-00000000 [SL 00]
CPUID 00000018: 00000000-00080007-00000001-00004122 [SL 01]
CPUID 00000018: 00000000-0010000F-00000001-00004125 [SL 02]
CPUID 00000018: 00000000-00040001-00000010-00004024 [SL 03]
CPUID 00000018: 00000000-00040006-00000008-00004024 [SL 04]
CPUID 00000018: 00000000-00080008-00000001-00004124 [SL 05]
CPUID 00000018: 00000000-00080007-00000080-00004043 [SL 06]
CPUID 00000018: 00000000-00080009-00000080-00004043 [SL 07]
CPUID 00000019: 00000000-00000000-00000000-00000000
CPUID 0000001A: 00000000-00000000-00000000-00000000
CPUID 0000001B: 00000000-00000000-00000000-00000000
CPUID 80000000: 80000008-00000000-00000000-00000000
CPUID 80000001: 00000000-00000000-00000121-2C100000
CPUID 80000002: 68743131-6E654720-746E4920-52286C65 [11th Gen Intel(R]
CPUID 80000003: 6F432029-54286572-6920294D-31312D39 [) Core(TM) i9-11]
CPUID 80000004: 4B303039-33204020-4730352E-00007A48 [900K @ 3.50GHz]
CPUID 80000005: 00000000-00000000-00000000-00000000 [L1D: 0 KB / L1I: 0 KB]
CPUID 80000006: 00000000-00000000-01006040-00000000 [L2: 256 KB] / L3: 0 KB]
CPUID 80000007: 00000000-00000000-00000000-00000100
CPUID 80000008: 00003027-00000000-00000000-00000000

L1    Data Cache:    48 KB, 12-way Associative, 64-byte Line
L1  Instr. Cache:    32 KB,  8-way Associative, 64-byte Line
L2 Unified Cache:   512 KB,  8-way Associative, 64-byte Line
L3 Unified Cache:    16 MB, 16-way Associative, 64-byte Line

------[ CPUID Registers / Logical CPU #8 ]------

allcpu: Package 0 / Core 5 / Thread 0: Valid

CPUID 00000000: 0000001B-756E6547-6C65746E-49656E69 [GenuineIntel]
CPUID 00000001: 000A0671-0A100800-7FFAFBFF-BFEBFBFF
CPUID 00000002: 00FEFF01-000000F0-00000000-00000000
CPUID 00000003: 00000000-00000000-00000000-00000000
CPUID 00000004: 1C004121-02C0003F-0000003F-00000000 [SL 00] [L1D: 48 KB]
CPUID 00000004: 1C004122-01C0003F-0000003F-00000000 [SL 01] [L1I: 32 KB]
CPUID 00000004: 1C004143-01C0003F-000003FF-00000000 [SL 02] [L2U: 512 KB]
CPUID 00000004: 1C03C163-03C0003F-00003FFF-00000006 [SL 03] [L3U: 16 MB]
CPUID 00000005: 00000040-00000040-00000003-11121020
CPUID 00000006: 0003EFF5-00000002-00000001-00000000
CPUID 00000007: 00000000-F2BF67EB-00405F4E-BC000410 [SL 00]
CPUID 00000008: 00000000-00000000-00000000-00000000
CPUID 00000009: 00000000-00000000-00000000-00000000
CPUID 0000000A: 08300805-00000000-0000000F-00008604
CPUID 0000000B: 00000001-00000002-00000100-0000000A [SL 00]
CPUID 0000000B: 00000004-00000010-00000201-0000000A [SL 01]
CPUID 0000000C: 00000000-00000000-00000000-00000000
CPUID 0000000D: 000002FF-00000A80-00000A88-00000000 [SL 00] [x87]
CPUID 0000000D: 0000000F-00000A80-00002100-00000000 [SL 01] [SSE]
CPUID 0000000D: 00000100-00000240-00000000-00000000 [SL 02] [AVX]
CPUID 0000000D: 00000040-000003C0-00000000-00000000 [SL 03] [MPX BNDREGS]
CPUID 0000000D: 00000040-00000400-00000000-00000000 [SL 04] [MPX BNDCSR]
CPUID 0000000D: 00000040-00000440-00000000-00000000 [SL 05] [AVX-512 Opmask]
CPUID 0000000D: 00000200-00000480-00000000-00000000 [SL 06] [AVX-512 Hi256]
CPUID 0000000D: 00000400-00000680-00000000-00000000 [SL 07] [AVX-512 Hi16]
CPUID 0000000D: 00000080-00000000-00000001-00000000 [SL 08] [PT]
CPUID 0000000D: 00000008-00000A80-00000000-00000000 [SL 09] [PKRU]
CPUID 0000000D: 00000008-00000000-00000001-00000000 [SL 0D]
CPUID 0000000E: 00000000-00000000-00000000-00000000
CPUID 0000000F: 00000000-00000000-00000000-00000000 [SL 00]
CPUID 0000000F: 00000000-00000000-00000000-00000000 [SL 01]
CPUID 00000010: 00000000-00000000-00000000-00000000 [SL 00]
CPUID 00000010: 00000000-00000000-00000000-00000000 [SL 01]
CPUID 00000011: 00000000-00000000-00000000-00000000
CPUID 00000012: 00000000-00000000-00000000-00000000 [SL 00]
CPUID 00000012: 00000000-00000000-00000000-00000000 [SL 01]
CPUID 00000013: 00000000-00000000-00000000-00000000
CPUID 00000014: 00000001-0000000F-00000007-00000000 [SL 00]
CPUID 00000014: 02490002-003F1FFF-00000000-00000000 [SL 01]
CPUID 00000015: 00000002-00000124-016E3600-00000000 [146.00x / 24000000]
CPUID 00000016: 00000DAC-000014B4-00000064-00000000 [3500 / 5300 / 100]
CPUID 00000017: 00000000-00000000-00000000-00000000 [SL 00]
CPUID 00000018: 00000007-00000000-00000000-00000000 [SL 00]
CPUID 00000018: 00000000-00080007-00000001-00004122 [SL 01]
CPUID 00000018: 00000000-0010000F-00000001-00004125 [SL 02]
CPUID 00000018: 00000000-00040001-00000010-00004024 [SL 03]
CPUID 00000018: 00000000-00040006-00000008-00004024 [SL 04]
CPUID 00000018: 00000000-00080008-00000001-00004124 [SL 05]
CPUID 00000018: 00000000-00080007-00000080-00004043 [SL 06]
CPUID 00000018: 00000000-00080009-00000080-00004043 [SL 07]
CPUID 00000019: 00000000-00000000-00000000-00000000
CPUID 0000001A: 00000000-00000000-00000000-00000000
CPUID 0000001B: 00000000-00000000-00000000-00000000
CPUID 80000000: 80000008-00000000-00000000-00000000
CPUID 80000001: 00000000-00000000-00000121-2C100000
CPUID 80000002: 68743131-6E654720-746E4920-52286C65 [11th Gen Intel(R]
CPUID 80000003: 6F432029-54286572-6920294D-31312D39 [) Core(TM) i9-11]
CPUID 80000004: 4B303039-33204020-4730352E-00007A48 [900K @ 3.50GHz]
CPUID 80000005: 00000000-00000000-00000000-00000000 [L1D: 0 KB / L1I: 0 KB]
CPUID 80000006: 00000000-00000000-01006040-00000000 [L2: 256 KB] / L3: 0 KB]
CPUID 80000007: 00000000-00000000-00000000-00000100
CPUID 80000008: 00003027-00000000-00000000-00000000

L1    Data Cache:    48 KB, 12-way Associative, 64-byte Line
L1  Instr. Cache:    32 KB,  8-way Associative, 64-byte Line
L2 Unified Cache:   512 KB,  8-way Associative, 64-byte Line
L3 Unified Cache:    16 MB, 16-way Associative, 64-byte Line

------[ CPUID Registers / Logical CPU #9 ]------

allcpu: Package 0 / Core 6 / Thread 0: Valid

CPUID 00000000: 0000001B-756E6547-6C65746E-49656E69 [GenuineIntel]
CPUID 00000001: 000A0671-0C100800-7FFAFBFF-BFEBFBFF
CPUID 00000002: 00FEFF01-000000F0-00000000-00000000
CPUID 00000003: 00000000-00000000-00000000-00000000
CPUID 00000004: 1C004121-02C0003F-0000003F-00000000 [SL 00] [L1D: 48 KB]
CPUID 00000004: 1C004122-01C0003F-0000003F-00000000 [SL 01] [L1I: 32 KB]
CPUID 00000004: 1C004143-01C0003F-000003FF-00000000 [SL 02] [L2U: 512 KB]
CPUID 00000004: 1C03C163-03C0003F-00003FFF-00000006 [SL 03] [L3U: 16 MB]
CPUID 00000005: 00000040-00000040-00000003-11121020
CPUID 00000006: 0003EFF5-00000002-00000001-00000000
CPUID 00000007: 00000000-F2BF67EB-00405F4E-BC000410 [SL 00]
CPUID 00000008: 00000000-00000000-00000000-00000000
CPUID 00000009: 00000000-00000000-00000000-00000000
CPUID 0000000A: 08300805-00000000-0000000F-00008604
CPUID 0000000B: 00000001-00000002-00000100-0000000C [SL 00]
CPUID 0000000B: 00000004-00000010-00000201-0000000C [SL 01]
CPUID 0000000C: 00000000-00000000-00000000-00000000
CPUID 0000000D: 000002FF-00000A80-00000A88-00000000 [SL 00] [x87]
CPUID 0000000D: 0000000F-00000A80-00002100-00000000 [SL 01] [SSE]
CPUID 0000000D: 00000100-00000240-00000000-00000000 [SL 02] [AVX]
CPUID 0000000D: 00000040-000003C0-00000000-00000000 [SL 03] [MPX BNDREGS]
CPUID 0000000D: 00000040-00000400-00000000-00000000 [SL 04] [MPX BNDCSR]
CPUID 0000000D: 00000040-00000440-00000000-00000000 [SL 05] [AVX-512 Opmask]
CPUID 0000000D: 00000200-00000480-00000000-00000000 [SL 06] [AVX-512 Hi256]
CPUID 0000000D: 00000400-00000680-00000000-00000000 [SL 07] [AVX-512 Hi16]
CPUID 0000000D: 00000080-00000000-00000001-00000000 [SL 08] [PT]
CPUID 0000000D: 00000008-00000A80-00000000-00000000 [SL 09] [PKRU]
CPUID 0000000D: 00000008-00000000-00000001-00000000 [SL 0D]
CPUID 0000000E: 00000000-00000000-00000000-00000000
CPUID 0000000F: 00000000-00000000-00000000-00000000 [SL 00]
CPUID 0000000F: 00000000-00000000-00000000-00000000 [SL 01]
CPUID 00000010: 00000000-00000000-00000000-00000000 [SL 00]
CPUID 00000010: 00000000-00000000-00000000-00000000 [SL 01]
CPUID 00000011: 00000000-00000000-00000000-00000000
CPUID 00000012: 00000000-00000000-00000000-00000000 [SL 00]
CPUID 00000012: 00000000-00000000-00000000-00000000 [SL 01]
CPUID 00000013: 00000000-00000000-00000000-00000000
CPUID 00000014: 00000001-0000000F-00000007-00000000 [SL 00]
CPUID 00000014: 02490002-003F1FFF-00000000-00000000 [SL 01]
CPUID 00000015: 00000002-00000124-016E3600-00000000 [146.00x / 24000000]
CPUID 00000016: 00000DAC-000014B4-00000064-00000000 [3500 / 5300 / 100]
CPUID 00000017: 00000000-00000000-00000000-00000000 [SL 00]
CPUID 00000018: 00000007-00000000-00000000-00000000 [SL 00]
CPUID 00000018: 00000000-00080007-00000001-00004122 [SL 01]
CPUID 00000018: 00000000-0010000F-00000001-00004125 [SL 02]
CPUID 00000018: 00000000-00040001-00000010-00004024 [SL 03]
CPUID 00000018: 00000000-00040006-00000008-00004024 [SL 04]
CPUID 00000018: 00000000-00080008-00000001-00004124 [SL 05]
CPUID 00000018: 00000000-00080007-00000080-00004043 [SL 06]
CPUID 00000018: 00000000-00080009-00000080-00004043 [SL 07]
CPUID 00000019: 00000000-00000000-00000000-00000000
CPUID 0000001A: 00000000-00000000-00000000-00000000
CPUID 0000001B: 00000000-00000000-00000000-00000000
CPUID 80000000: 80000008-00000000-00000000-00000000
CPUID 80000001: 00000000-00000000-00000121-2C100000
CPUID 80000002: 68743131-6E654720-746E4920-52286C65 [11th Gen Intel(R]
CPUID 80000003: 6F432029-54286572-6920294D-31312D39 [) Core(TM) i9-11]
CPUID 80000004: 4B303039-33204020-4730352E-00007A48 [900K @ 3.50GHz]
CPUID 80000005: 00000000-00000000-00000000-00000000 [L1D: 0 KB / L1I: 0 KB]
CPUID 80000006: 00000000-00000000-01006040-00000000 [L2: 256 KB] / L3: 0 KB]
CPUID 80000007: 00000000-00000000-00000000-00000100
CPUID 80000008: 00003027-00000000-00000000-00000000

L1    Data Cache:    48 KB, 12-way Associative, 64-byte Line
L1  Instr. Cache:    32 KB,  8-way Associative, 64-byte Line
L2 Unified Cache:   512 KB,  8-way Associative, 64-byte Line
L3 Unified Cache:    16 MB, 16-way Associative, 64-byte Line

------[ CPUID Registers / Logical CPU #10 ]------

allcpu: Package 0 / Core 7 / Thread 0: Valid

CPUID 00000000: 0000001B-756E6547-6C65746E-49656E69 [GenuineIntel]
CPUID 00000001: 000A0671-0E100800-7FFAFBFF-BFEBFBFF
CPUID 00000002: 00FEFF01-000000F0-00000000-00000000
CPUID 00000003: 00000000-00000000-00000000-00000000
CPUID 00000004: 1C004121-02C0003F-0000003F-00000000 [SL 00] [L1D: 48 KB]
CPUID 00000004: 1C004122-01C0003F-0000003F-00000000 [SL 01] [L1I: 32 KB]
CPUID 00000004: 1C004143-01C0003F-000003FF-00000000 [SL 02] [L2U: 512 KB]
CPUID 00000004: 1C03C163-03C0003F-00003FFF-00000006 [SL 03] [L3U: 16 MB]
CPUID 00000005: 00000040-00000040-00000003-11121020
CPUID 00000006: 0003EFF5-00000002-00000001-00000000
CPUID 00000007: 00000000-F2BF67EB-00405F4E-BC000410 [SL 00]
CPUID 00000008: 00000000-00000000-00000000-00000000
CPUID 00000009: 00000000-00000000-00000000-00000000
CPUID 0000000A: 08300805-00000000-0000000F-00008604
CPUID 0000000B: 00000001-00000002-00000100-0000000E [SL 00]
CPUID 0000000B: 00000004-00000010-00000201-0000000E [SL 01]
CPUID 0000000C: 00000000-00000000-00000000-00000000
CPUID 0000000D: 000002FF-00000A80-00000A88-00000000 [SL 00] [x87]
CPUID 0000000D: 0000000F-00000A80-00002100-00000000 [SL 01] [SSE]
CPUID 0000000D: 00000100-00000240-00000000-00000000 [SL 02] [AVX]
CPUID 0000000D: 00000040-000003C0-00000000-00000000 [SL 03] [MPX BNDREGS]
CPUID 0000000D: 00000040-00000400-00000000-00000000 [SL 04] [MPX BNDCSR]
CPUID 0000000D: 00000040-00000440-00000000-00000000 [SL 05] [AVX-512 Opmask]
CPUID 0000000D: 00000200-00000480-00000000-00000000 [SL 06] [AVX-512 Hi256]
CPUID 0000000D: 00000400-00000680-00000000-00000000 [SL 07] [AVX-512 Hi16]
CPUID 0000000D: 00000080-00000000-00000001-00000000 [SL 08] [PT]
CPUID 0000000D: 00000008-00000A80-00000000-00000000 [SL 09] [PKRU]
CPUID 0000000D: 00000008-00000000-00000001-00000000 [SL 0D]
CPUID 0000000E: 00000000-00000000-00000000-00000000
CPUID 0000000F: 00000000-00000000-00000000-00000000 [SL 00]
CPUID 0000000F: 00000000-00000000-00000000-00000000 [SL 01]
CPUID 00000010: 00000000-00000000-00000000-00000000 [SL 00]
CPUID 00000010: 00000000-00000000-00000000-00000000 [SL 01]
CPUID 00000011: 00000000-00000000-00000000-00000000
CPUID 00000012: 00000000-00000000-00000000-00000000 [SL 00]
CPUID 00000012: 00000000-00000000-00000000-00000000 [SL 01]
CPUID 00000013: 00000000-00000000-00000000-00000000
CPUID 00000014: 00000001-0000000F-00000007-00000000 [SL 00]
CPUID 00000014: 02490002-003F1FFF-00000000-00000000 [SL 01]
CPUID 00000015: 00000002-00000124-016E3600-00000000 [146.00x / 24000000]
CPUID 00000016: 00000DAC-000014B4-00000064-00000000 [3500 / 5300 / 100]
CPUID 00000017: 00000000-00000000-00000000-00000000 [SL 00]
CPUID 00000018: 00000007-00000000-00000000-00000000 [SL 00]
CPUID 00000018: 00000000-00080007-00000001-00004122 [SL 01]
CPUID 00000018: 00000000-0010000F-00000001-00004125 [SL 02]
CPUID 00000018: 00000000-00040001-00000010-00004024 [SL 03]
CPUID 00000018: 00000000-00040006-00000008-00004024 [SL 04]
CPUID 00000018: 00000000-00080008-00000001-00004124 [SL 05]
CPUID 00000018: 00000000-00080007-00000080-00004043 [SL 06]
CPUID 00000018: 00000000-00080009-00000080-00004043 [SL 07]
CPUID 00000019: 00000000-00000000-00000000-00000000
CPUID 0000001A: 00000000-00000000-00000000-00000000
CPUID 0000001B: 00000000-00000000-00000000-00000000
CPUID 80000000: 80000008-00000000-00000000-00000000
CPUID 80000001: 00000000-00000000-00000121-2C100000
CPUID 80000002: 68743131-6E654720-746E4920-52286C65 [11th Gen Intel(R]
CPUID 80000003: 6F432029-54286572-6920294D-31312D39 [) Core(TM) i9-11]
CPUID 80000004: 4B303039-33204020-4730352E-00007A48 [900K @ 3.50GHz]
CPUID 80000005: 00000000-00000000-00000000-00000000 [L1D: 0 KB / L1I: 0 KB]
CPUID 80000006: 00000000-00000000-01006040-00000000 [L2: 256 KB] / L3: 0 KB]
CPUID 80000007: 00000000-00000000-00000000-00000100
CPUID 80000008: 00003027-00000000-00000000-00000000

L1    Data Cache:    48 KB, 12-way Associative, 64-byte Line
L1  Instr. Cache:    32 KB,  8-way Associative, 64-byte Line
L2 Unified Cache:   512 KB,  8-way Associative, 64-byte Line
L3 Unified Cache:    16 MB, 16-way Associative, 64-byte Line

------[ CPUID Registers / Logical CPU #11 ]------

allcpu: Package 0 / Core 7 / Thread 1: Valid, Virtual

CPUID 00000000: 0000001B-756E6547-6C65746E-49656E69 [GenuineIntel]
CPUID 00000001: 000A0671-0F100800-7FFAFBFF-BFEBFBFF
CPUID 00000002: 00FEFF01-000000F0-00000000-00000000
CPUID 00000003: 00000000-00000000-00000000-00000000
CPUID 00000004: 1C004121-02C0003F-0000003F-00000000 [SL 00] [L1D: 48 KB]
CPUID 00000004: 1C004122-01C0003F-0000003F-00000000 [SL 01] [L1I: 32 KB]
CPUID 00000004: 1C004143-01C0003F-000003FF-00000000 [SL 02] [L2U: 512 KB]
CPUID 00000004: 1C03C163-03C0003F-00003FFF-00000006 [SL 03] [L3U: 16 MB]
CPUID 00000005: 00000040-00000040-00000003-11121020
CPUID 00000006: 0003EFF5-00000002-00000001-00000000
CPUID 00000007: 00000000-F2BF67EB-00405F4E-BC000410 [SL 00]
CPUID 00000008: 00000000-00000000-00000000-00000000
CPUID 00000009: 00000000-00000000-00000000-00000000
CPUID 0000000A: 08300805-00000000-0000000F-00008604
CPUID 0000000B: 00000001-00000002-00000100-0000000F [SL 00]
CPUID 0000000B: 00000004-00000010-00000201-0000000F [SL 01]
CPUID 0000000C: 00000000-00000000-00000000-00000000
CPUID 0000000D: 000002FF-00000A80-00000A88-00000000 [SL 00] [x87]
CPUID 0000000D: 0000000F-00000A80-00002100-00000000 [SL 01] [SSE]
CPUID 0000000D: 00000100-00000240-00000000-00000000 [SL 02] [AVX]
CPUID 0000000D: 00000040-000003C0-00000000-00000000 [SL 03] [MPX BNDREGS]
CPUID 0000000D: 00000040-00000400-00000000-00000000 [SL 04] [MPX BNDCSR]
CPUID 0000000D: 00000040-00000440-00000000-00000000 [SL 05] [AVX-512 Opmask]
CPUID 0000000D: 00000200-00000480-00000000-00000000 [SL 06] [AVX-512 Hi256]
CPUID 0000000D: 00000400-00000680-00000000-00000000 [SL 07] [AVX-512 Hi16]
CPUID 0000000D: 00000080-00000000-00000001-00000000 [SL 08] [PT]
CPUID 0000000D: 00000008-00000A80-00000000-00000000 [SL 09] [PKRU]
CPUID 0000000D: 00000008-00000000-00000001-00000000 [SL 0D]
CPUID 0000000E: 00000000-00000000-00000000-00000000
CPUID 0000000F: 00000000-00000000-00000000-00000000 [SL 00]
CPUID 0000000F: 00000000-00000000-00000000-00000000 [SL 01]
CPUID 00000010: 00000000-00000000-00000000-00000000 [SL 00]
CPUID 00000010: 00000000-00000000-00000000-00000000 [SL 01]
CPUID 00000011: 00000000-00000000-00000000-00000000
CPUID 00000012: 00000000-00000000-00000000-00000000 [SL 00]
CPUID 00000012: 00000000-00000000-00000000-00000000 [SL 01]
CPUID 00000013: 00000000-00000000-00000000-00000000
CPUID 00000014: 00000001-0000000F-00000007-00000000 [SL 00]
CPUID 00000014: 02490002-003F1FFF-00000000-00000000 [SL 01]
CPUID 00000015: 00000002-00000124-016E3600-00000000 [146.00x / 24000000]
CPUID 00000016: 00000DAC-000014B4-00000064-00000000 [3500 / 5300 / 100]
CPUID 00000017: 00000000-00000000-00000000-00000000 [SL 00]
CPUID 00000018: 00000007-00000000-00000000-00000000 [SL 00]
CPUID 00000018: 00000000-00080007-00000001-00004122 [SL 01]
CPUID 00000018: 00000000-0010000F-00000001-00004125 [SL 02]
CPUID 00000018: 00000000-00040001-00000010-00004024 [SL 03]
CPUID 00000018: 00000000-00040006-00000008-00004024 [SL 04]
CPUID 00000018: 00000000-00080008-00000001-00004124 [SL 05]
CPUID 00000018: 00000000-00080007-00000080-00004043 [SL 06]
CPUID 00000018: 00000000-00080009-00000080-00004043 [SL 07]
CPUID 00000019: 00000000-00000000-00000000-00000000
CPUID 0000001A: 00000000-00000000-00000000-00000000
CPUID 0000001B: 00000000-00000000-00000000-00000000
CPUID 80000000: 80000008-00000000-00000000-00000000
CPUID 80000001: 00000000-00000000-00000121-2C100000
CPUID 80000002: 68743131-6E654720-746E4920-52286C65 [11th Gen Intel(R]
CPUID 80000003: 6F432029-54286572-6920294D-31312D39 [) Core(TM) i9-11]
CPUID 80000004: 4B303039-33204020-4730352E-00007A48 [900K @ 3.50GHz]
CPUID 80000005: 00000000-00000000-00000000-00000000 [L1D: 0 KB / L1I: 0 KB]
CPUID 80000006: 00000000-00000000-01006040-00000000 [L2: 256 KB] / L3: 0 KB]
CPUID 80000007: 00000000-00000000-00000000-00000100
CPUID 80000008: 00003027-00000000-00000000-00000000

L1    Data Cache:    48 KB, 12-way Associative, 64-byte Line
L1  Instr. Cache:    32 KB,  8-way Associative, 64-byte Line
L2 Unified Cache:   512 KB,  8-way Associative, 64-byte Line
L3 Unified Cache:    16 MB, 16-way Associative, 64-byte Line

------[ All CPUs ]------

CPU   0: APICID    0 / Package 0 / Core   0 / Thread 0: Valid
CPU   1: APICID    1 / Package 0 / Core   0 / Thread 1: Valid, Virtual
CPU   2: APICID    2 / Package 0 / Core   1 / Thread 0: Valid
CPU   3: APICID    3 / Package 0 / Core   1 / Thread 1: Valid, Virtual
CPU   4: APICID    4 / Package 0 / Core   2 / Thread 0: Valid
CPU   5: APICID    5 / Package 0 / Core   2 / Thread 1: Valid, Virtual
CPU   6: APICID    6 / Package 0 / Core   3 / Thread 0: Valid
CPU   7: APICID    8 / Package 0 / Core   4 / Thread 0: Valid
CPU   8: APICID   10 / Package 0 / Core   5 / Thread 0: Valid
CPU   9: APICID   12 / Package 0 / Core   6 / Thread 0: Valid
CPU  10: APICID   14 / Package 0 / Core   7 / Thread 0: Valid
CPU  11: APICID   15 / Package 0 / Core   7 / Thread 1: Valid, Virtual

------[ MSR Registers / Logical CPU #0 ]------

MSR 00000017: 0004-0000-0000-0000 [PlatID = 1]
MSR 0000001B: 0000-0000-FEE0-0D00
MSR 00000035: 0000-0000-0008-000C
MSR 00000048: 0000-0000-0000-0001
MSR 00000049: < FAILED >
MSR 0000008B: 0000-001C-0000-0000
MSR 000000CE: 0808-0838-F181-2300 [eD = 0]
MSR 000000E7: 0000-000D-9B65-6F32 [S200]
MSR 000000E7: 0000-000D-9C76-EE3C [S200]
MSR 000000E7: 0000-000D-9D73-0668
MSR 000000E8: 0000-000D-8608-FCBF [S200]
MSR 000000E8: 0000-000D-869A-F14B [S200]
MSR 000000E8: 0000-000D-888C-EF5F
MSR 0000010A: 0000-0000-0000-006B
MSR 0000010B: < FAILED >
MSR 00000194: 0000-0000-000F-0000
MSR 00000198: 0000-20FB-0000-2300 [S200]
MSR 00000198: 0000-19C2-0000-0A00 [S200]
MSR 00000198: 0000-2146-0000-2300
MSR 00000199: 0000-0000-0000-2300
MSR 0000019A: 0000-0000-0000-0000
MSR 0000019B: 0000-0000-0000-0010
MSR 0000019C: 0000-0000-884B-8000 [S200]
MSR 0000019C: 0000-0000-884B-8000 [S200]
MSR 0000019C: 0000-0000-884B-8000
MSR 0000019D: 0000-0000-0000-0000
MSR 000001A0: 0000-0040-0085-0089
MSR 000001A2: 0000-0000-8064-0000
MSR 000001A4: 0000-0000-0000-0000
MSR 000001AA: 0000-0000-0040-1CC0
MSR 000001AC: < FAILED >
MSR 000001AD: 3030-3131-3333-3535
MSR 000001AE: < FAILED >
MSR 000001AF: < FAILED >
MSR 000001B0: < FAILED >
MSR 000001B1: 0000-0000-8849-0000
MSR 000001B2: 0000-0000-0000-0000
MSR 000001FC: 0000-0000-0038-005F
MSR 00000300: < FAILED >
MSR 0000030A: 0000-0000-1CAB-B5A3 [S200]
MSR 0000030A: 0000-0000-1CD4-6324 [S200]
MSR 0000030A: 0000-0000-1CE4-CD43
MSR 0000030B: 0000-0000-2492-BBC2 [S200]
MSR 0000030B: 0000-0000-2BAE-9DC0 [S200]
MSR 0000030B: 0000-0000-2BBC-5ADE
MSR 00000480: 00DA-0500-0000-0013
MSR 00000481: 0000-00FF-0000-0016
MSR 00000482: FFF9-FFFE-0401-E172
MSR 00000483: 03FF-FFFF-0003-6DFF
MSR 00000484: 0007-FFFF-0000-11FF
MSR 00000485: 0000-0000-7004-C1E7
MSR 00000486: 0000-0000-8000-0021
MSR 00000487: 0000-0000-FFFF-FFFF
MSR 00000488: 0000-0000-0000-2000
MSR 00000489: 0000-0000-0077-6FFF
MSR 0000048A: 0000-0000-0000-002E
MSR 0000048B: 031F-7FFF-0000-0000
MSR 0000048C: 0000-0F01-0633-4141
MSR 0000048D: 0000-00FF-0000-0016
MSR 0000048E: FFF9-FFFE-0400-6172
MSR 0000048F: 03FF-FFFF-0003-6DFB
MSR 00000490: 0007-FFFF-0000-11FB
MSR 00000601: 0000-0000-0000-0000
MSR 00000602: < FAILED >
MSR 00000603: 0036-0000-0036-3636
MSR 00000604: < FAILED >
MSR 00000606: 0000-0000-000A-0E03
MSR 0000060A: 0000-0000-0000-0000
MSR 0000060B: 0000-0000-0000-0000
MSR 0000060C: 0000-0000-0000-0000
MSR 0000060D: 0000-0000-0000-0000
MSR 00000610: 0042-FFF8-001B-FFF8
MSR 00000611: 0000-0000-0281-227C [S200]
MSR 00000611: 0000-0000-0281-DF92 [S200]
MSR 00000611: 0000-0000-0282-9C65
MSR 00000613: 0000-0000-0000-0000
MSR 00000614: 0000-0000-0000-03E8
MSR 00000618: 0014-8FFF-0014-8FFF
MSR 00000619: 0000-0000-0000-0000 [S200]
MSR 00000619: 0000-0000-0000-0000 [S200]
MSR 00000619: 0000-0000-0000-0000
MSR 0000061B: 0000-0000-0000-0000
MSR 0000061C: < FAILED >
MSR 0000061E: < FAILED >
MSR 00000620: 0000-0000-0000-082B
MSR 00000621: 0000-0000-0000-0008
MSR 00000638: 0000-0000-0000-0000
MSR 00000639: 0000-0000-00DD-28F2 [S200]
MSR 00000639: 0000-0000-00DD-2D8C [S200]
MSR 00000639: 0000-0000-00DD-33D7
MSR 0000063A: 0000-0000-0000-0009
MSR 0000063B: < FAILED >
MSR 00000640: 0000-0000-0000-0000
MSR 00000641: 0000-0000-0000-A92A [S200]
MSR 00000641: 0000-0000-0000-AA1B [S200]
MSR 00000641: 0000-0000-0000-AAA4
MSR 00000642: 0000-0000-0000-000D
MSR 00000648: 0000-0000-0000-0023
MSR 00000649: 0000-0000-0000-02F8
MSR 0000064A: 0000-0000-001E-0000
MSR 0000064B: 0000-0000-8000-0000
MSR 0000064C: 0000-0000-0000-0000
MSR 00000690: 0000-0000-0000-0000
MSR 000006B0: 0000-0000-0000-0000
MSR 000006B1: 0000-0000-0000-0000
MSR 00000770: 0000-0000-0000-0001
MSR 00000771: 0000-0000-0108-2333
MSR 00000772: 0000-0000-8000-FF01
MSR 00000773: 0000-0000-0000-0005
MSR 00000774: 0000-019E-5400-FF01
MSR 00000777: 0000-0000-0000-0004
MSR 00000832: 0000-0000-0003-00D1
MSR 00000838: 0000-0000-0000-0000
MSR 00000839: 0000-0000-0000-0000
MSR 0000083E: 0000-0000-0000-000A

------[ MSR Registers / Logical CPU #1 ]------

MSR 00000017: 0004-0000-0000-0000 [PlatID = 1]
MSR 0000001B: 0000-0000-FEE0-0C00
MSR 00000035: 0000-0000-0008-000C
MSR 00000048: 0000-0000-0000-0001
MSR 00000049: < FAILED >
MSR 0000008B: 0000-001C-0000-0000
MSR 000000CE: 0808-0838-F181-2300 [eD = 0]
MSR 000000E7: 0000-0003-E683-0015
MSR 000000E8: 0000-0003-DE6A-2D2F
MSR 0000010A: 0000-0000-0000-006B
MSR 0000010B: < FAILED >
MSR 00000194: 0000-0000-000F-0000
MSR 00000198: 0000-2123-0000-2300
MSR 00000199: 0000-0000-0000-2300
MSR 0000019A: 0000-0000-0000-0000
MSR 0000019B: 0000-0000-0000-0010
MSR 0000019C: 0000-0000-8846-8000
MSR 0000019D: 0000-0000-0000-0000
MSR 000001A0: 0000-0040-0085-0089
MSR 000001A2: 0000-0000-8064-0000
MSR 000001A4: 0000-0000-0000-0000
MSR 000001AA: 0000-0000-0040-1CC0
MSR 000001AC: < FAILED >
MSR 000001AD: 3030-3131-3333-3535
MSR 000001AE: < FAILED >
MSR 000001AF: < FAILED >
MSR 000001B0: < FAILED >
MSR 000001B1: 0000-0000-8846-0000
MSR 000001B2: 0000-0000-0000-0000
MSR 000001FC: 0000-0000-0038-005F
MSR 00000300: < FAILED >
MSR 0000030A: 0000-0000-0249-74E3
MSR 0000030B: 0000-0000-03E6-AA8C
MSR 00000480: 00DA-0500-0000-0013
MSR 00000481: 0000-00FF-0000-0016
MSR 00000482: FFF9-FFFE-0401-E172
MSR 00000483: 03FF-FFFF-0003-6DFF
MSR 00000484: 0007-FFFF-0000-11FF
MSR 00000485: 0000-0000-7004-C1E7
MSR 00000486: 0000-0000-8000-0021
MSR 00000487: 0000-0000-FFFF-FFFF
MSR 00000488: 0000-0000-0000-2000
MSR 00000489: 0000-0000-0077-6FFF
MSR 0000048A: 0000-0000-0000-002E
MSR 0000048B: 031F-7FFF-0000-0000
MSR 0000048C: 0000-0F01-0633-4141
MSR 0000048D: 0000-00FF-0000-0016
MSR 0000048E: FFF9-FFFE-0400-6172
MSR 0000048F: 03FF-FFFF-0003-6DFB
MSR 00000490: 0007-FFFF-0000-11FB
MSR 00000601: 0000-0000-0000-0000
MSR 00000602: < FAILED >
MSR 00000603: 0036-0000-0036-3636
MSR 00000604: < FAILED >
MSR 00000606: 0000-0000-000A-0E03
MSR 0000060A: 0000-0000-0000-0000
MSR 0000060B: 0000-0000-0000-0000
MSR 0000060C: 0000-0000-0000-0000
MSR 0000060D: 0000-0000-0000-0000
MSR 00000610: 0042-FFF8-001B-FFF8
MSR 00000611: 0000-0000-028D-704A
MSR 00000613: 0000-0000-0000-0000
MSR 00000614: 0000-0000-0000-03E8
MSR 00000618: 0014-8FFF-0014-8FFF
MSR 00000619: 0000-0000-0000-0000
MSR 0000061B: 0000-0000-0000-0000
MSR 0000061C: < FAILED >
MSR 0000061E: < FAILED >
MSR 00000620: 0000-0000-0000-082B
MSR 00000621: 0000-0000-0000-001D
MSR 00000638: 0000-0000-0000-0000
MSR 00000639: 0000-0000-00DF-D4EA
MSR 0000063A: 0000-0000-0000-0009
MSR 0000063B: < FAILED >
MSR 00000640: 0000-0000-0000-0000
MSR 00000641: 0000-0000-0000-AF4E
MSR 00000642: 0000-0000-0000-000D
MSR 00000648: 0000-0000-0000-0023
MSR 00000649: 0000-0000-0000-02F8
MSR 0000064A: 0000-0000-001E-0000
MSR 0000064B: 0000-0000-8000-0000
MSR 0000064C: 0000-0000-0000-0000
MSR 00000690: 0000-0000-0000-0000
MSR 000006B0: 0000-0000-0000-0000
MSR 000006B1: 0000-0000-0000-0000
MSR 00000770: 0000-0000-0000-0001
MSR 00000771: 0000-0000-0108-2333
MSR 00000772: 0000-0000-8000-FF01
MSR 00000773: 0000-0000-0000-0005
MSR 00000774: 0000-019E-5400-FF01
MSR 00000777: 0000-0000-0000-0004
MSR 00000832: 0000-0000-0003-00D1
MSR 00000838: 0000-0000-0000-0000
MSR 00000839: 0000-0000-0000-0000
MSR 0000083E: 0000-0000-0000-000A

------[ MSR Registers / Logical CPU #2 ]------

MSR 00000017: 0004-0000-0000-0000 [PlatID = 1]
MSR 0000001B: 0000-0000-FEE0-0C00
MSR 00000035: 0000-0000-0008-000C
MSR 00000048: 0000-0000-0000-0001
MSR 00000049: < FAILED >
MSR 0000008B: 0000-001C-0000-0000
MSR 000000CE: 0808-0838-F181-2300 [eD = 0]
MSR 000000E7: 0000-0008-4BFB-E48A
MSR 000000E8: 0000-0008-0CFC-2D91
MSR 0000010A: 0000-0000-0000-006B
MSR 0000010B: < FAILED >
MSR 00000194: 0000-0000-000F-0000
MSR 00000198: 0000-20ED-0000-2300
MSR 00000199: 0000-0000-0000-2300
MSR 0000019A: 0000-0000-0000-0000
MSR 0000019B: 0000-0000-0000-0010
MSR 0000019C: 0000-0000-8848-8000
MSR 0000019D: 0000-0000-0000-0000
MSR 000001A0: 0000-0040-0085-0089
MSR 000001A2: 0000-0000-8064-0000
MSR 000001A4: 0000-0000-0000-0000
MSR 000001AA: 0000-0000-0040-1CC0
MSR 000001AC: < FAILED >
MSR 000001AD: 3030-3131-3333-3535
MSR 000001AE: < FAILED >
MSR 000001AF: < FAILED >
MSR 000001B0: < FAILED >
MSR 000001B1: 0000-0000-8847-0000
MSR 000001B2: 0000-0000-0000-0000
MSR 000001FC: 0000-0000-0038-005F
MSR 00000300: < FAILED >
MSR 0000030A: 0000-0000-389A-1F58
MSR 0000030B: 0000-0000-3C20-85D2
MSR 00000480: 00DA-0500-0000-0013
MSR 00000481: 0000-00FF-0000-0016
MSR 00000482: FFF9-FFFE-0401-E172
MSR 00000483: 03FF-FFFF-0003-6DFF
MSR 00000484: 0007-FFFF-0000-11FF
MSR 00000485: 0000-0000-7004-C1E7
MSR 00000486: 0000-0000-8000-0021
MSR 00000487: 0000-0000-FFFF-FFFF
MSR 00000488: 0000-0000-0000-2000
MSR 00000489: 0000-0000-0077-6FFF
MSR 0000048A: 0000-0000-0000-002E
MSR 0000048B: 031F-7FFF-0000-0000
MSR 0000048C: 0000-0F01-0633-4141
MSR 0000048D: 0000-00FF-0000-0016
MSR 0000048E: FFF9-FFFE-0400-6172
MSR 0000048F: 03FF-FFFF-0003-6DFB
MSR 00000490: 0007-FFFF-0000-11FB
MSR 00000601: 0000-0000-0000-0000
MSR 00000602: < FAILED >
MSR 00000603: 0036-0000-0036-3636
MSR 00000604: < FAILED >
MSR 00000606: 0000-0000-000A-0E03
MSR 0000060A: 0000-0000-0000-0000
MSR 0000060B: 0000-0000-0000-0000
MSR 0000060C: 0000-0000-0000-0000
MSR 0000060D: 0000-0000-0000-0000
MSR 00000610: 0042-FFF8-001B-FFF8
MSR 00000611: 0000-0000-028D-7241
MSR 00000613: 0000-0000-0000-0000
MSR 00000614: 0000-0000-0000-03E8
MSR 00000618: 0014-8FFF-0014-8FFF
MSR 00000619: 0000-0000-0000-0000
MSR 0000061B: 0000-0000-0000-0000
MSR 0000061C: < FAILED >
MSR 0000061E: < FAILED >
MSR 00000620: 0000-0000-0000-082B
MSR 00000621: 0000-0000-0000-001D
MSR 00000638: 0000-0000-0000-0000
MSR 00000639: 0000-0000-00DF-D5FB
MSR 0000063A: 0000-0000-0000-0009
MSR 0000063B: < FAILED >
MSR 00000640: 0000-0000-0000-0000
MSR 00000641: 0000-0000-0000-AF4E
MSR 00000642: 0000-0000-0000-000D
MSR 00000648: 0000-0000-0000-0023
MSR 00000649: 0000-0000-0000-02F8
MSR 0000064A: 0000-0000-001E-0000
MSR 0000064B: 0000-0000-8000-0000
MSR 0000064C: 0000-0000-0000-0000
MSR 00000690: 0000-0000-0000-0000
MSR 000006B0: 0000-0000-0000-0000
MSR 000006B1: 0000-0000-0000-0000
MSR 00000770: 0000-0000-0000-0001
MSR 00000771: 0000-0000-0108-2333
MSR 00000772: 0000-0000-8000-FF01
MSR 00000773: 0000-0000-0000-0005
MSR 00000774: 0000-019E-5400-FF01
MSR 00000777: 0000-0000-0000-0004
MSR 00000832: 0000-0000-0002-00D1
MSR 00000838: 0000-0000-0000-0B71
MSR 00000839: 0000-0000-0000-05E8
MSR 0000083E: 0000-0000-0000-000A

------[ MSR Registers / Logical CPU #3 ]------

MSR 00000017: 0004-0000-0000-0000 [PlatID = 1]
MSR 0000001B: 0000-0000-FEE0-0C00
MSR 00000035: 0000-0000-0008-000C
MSR 00000048: 0000-0000-0000-0001
MSR 00000049: < FAILED >
MSR 0000008B: 0000-001C-0000-0000
MSR 000000CE: 0808-0838-F181-2300 [eD = 0]
MSR 000000E7: 0000-0003-9FD0-4ECF
MSR 000000E8: 0000-0003-9AB4-074E
MSR 0000010A: 0000-0000-0000-006B
MSR 0000010B: < FAILED >
MSR 00000194: 0000-0000-000F-0000
MSR 00000198: 0000-2108-0000-2300
MSR 00000199: 0000-0000-0000-2300
MSR 0000019A: 0000-0000-0000-0000
MSR 0000019B: 0000-0000-0000-0010
MSR 0000019C: 0000-0000-8848-8000
MSR 0000019D: 0000-0000-0000-0000
MSR 000001A0: 0000-0040-0085-0089
MSR 000001A2: 0000-0000-8064-0000
MSR 000001A4: 0000-0000-0000-0000
MSR 000001AA: 0000-0000-0040-1CC0
MSR 000001AC: < FAILED >
MSR 000001AD: 3030-3131-3333-3535
MSR 000001AE: < FAILED >
MSR 000001AF: < FAILED >
MSR 000001B0: < FAILED >
MSR 000001B1: 0000-0000-8847-0000
MSR 000001B2: 0000-0000-0000-0000
MSR 000001FC: 0000-0000-0038-005F
MSR 00000300: < FAILED >
MSR 0000030A: 0000-0000-0AE2-5693
MSR 0000030B: 0000-0000-0C1B-AF20
MSR 00000480: 00DA-0500-0000-0013
MSR 00000481: 0000-00FF-0000-0016
MSR 00000482: FFF9-FFFE-0401-E172
MSR 00000483: 03FF-FFFF-0003-6DFF
MSR 00000484: 0007-FFFF-0000-11FF
MSR 00000485: 0000-0000-7004-C1E7
MSR 00000486: 0000-0000-8000-0021
MSR 00000487: 0000-0000-FFFF-FFFF
MSR 00000488: 0000-0000-0000-2000
MSR 00000489: 0000-0000-0077-6FFF
MSR 0000048A: 0000-0000-0000-002E
MSR 0000048B: 031F-7FFF-0000-0000
MSR 0000048C: 0000-0F01-0633-4141
MSR 0000048D: 0000-00FF-0000-0016
MSR 0000048E: FFF9-FFFE-0400-6172
MSR 0000048F: 03FF-FFFF-0003-6DFB
MSR 00000490: 0007-FFFF-0000-11FB
MSR 00000601: 0000-0000-0000-0000
MSR 00000602: < FAILED >
MSR 00000603: 0036-0000-0036-3636
MSR 00000604: < FAILED >
MSR 00000606: 0000-0000-000A-0E03
MSR 0000060A: 0000-0000-0000-0000
MSR 0000060B: 0000-0000-0000-0000
MSR 0000060C: 0000-0000-0000-0000
MSR 0000060D: 0000-0000-0000-0000
MSR 00000610: 0042-FFF8-001B-FFF8
MSR 00000611: 0000-0000-028D-741C
MSR 00000613: 0000-0000-0000-0000
MSR 00000614: 0000-0000-0000-03E8
MSR 00000618: 0014-8FFF-0014-8FFF
MSR 00000619: 0000-0000-0000-0000
MSR 0000061B: 0000-0000-0000-0000
MSR 0000061C: < FAILED >
MSR 0000061E: < FAILED >
MSR 00000620: 0000-0000-0000-082B
MSR 00000621: 0000-0000-0000-001D
MSR 00000638: 0000-0000-0000-0000
MSR 00000639: 0000-0000-00DF-D6FA
MSR 0000063A: 0000-0000-0000-0009
MSR 0000063B: < FAILED >
MSR 00000640: 0000-0000-0000-0000
MSR 00000641: 0000-0000-0000-AF4E
MSR 00000642: 0000-0000-0000-000D
MSR 00000648: 0000-0000-0000-0023
MSR 00000649: 0000-0000-0000-02F8
MSR 0000064A: 0000-0000-001E-0000
MSR 0000064B: 0000-0000-8000-0000
MSR 0000064C: 0000-0000-0000-0000
MSR 00000690: 0000-0000-0000-0000
MSR 000006B0: 0000-0000-0000-0000
MSR 000006B1: 0000-0000-0000-0000
MSR 00000770: 0000-0000-0000-0001
MSR 00000771: 0000-0000-0108-2333
MSR 00000772: 0000-0000-8000-FF01
MSR 00000773: 0000-0000-0000-0005
MSR 00000774: 0000-019E-5400-FF01
MSR 00000777: 0000-0000-0000-0004
MSR 00000832: 0000-0000-0003-00D1
MSR 00000838: 0000-0000-0000-0000
MSR 00000839: 0000-0000-0000-0000
MSR 0000083E: 0000-0000-0000-000A

------[ MSR Registers / Logical CPU #4 ]------

MSR 00000017: 0004-0000-0000-0000 [PlatID = 1]
MSR 0000001B: 0000-0000-FEE0-0C00
MSR 00000035: 0000-0000-0008-000C
MSR 00000048: 0000-0000-0000-0001
MSR 00000049: < FAILED >
MSR 0000008B: 0000-001C-0000-0000
MSR 000000CE: 0808-0838-F181-2300 [eD = 0]
MSR 000000E7: 0000-0006-1C5D-FD0A
MSR 000000E8: 0000-0006-0120-F98B
MSR 0000010A: 0000-0000-0000-006B
MSR 0000010B: < FAILED >
MSR 00000194: 0000-0000-000F-0000
MSR 00000198: 0000-2104-0000-2300
MSR 00000199: 0000-0000-0000-2300
MSR 0000019A: 0000-0000-0000-0000
MSR 0000019B: 0000-0000-0000-0010
MSR 0000019C: 0000-0000-8849-8000
MSR 0000019D: 0000-0000-0000-0000
MSR 000001A0: 0000-0040-0085-0089
MSR 000001A2: 0000-0000-8064-0000
MSR 000001A4: 0000-0000-0000-0000
MSR 000001AA: 0000-0000-0040-1CC0
MSR 000001AC: < FAILED >
MSR 000001AD: 3030-3131-3333-3535
MSR 000001AE: < FAILED >
MSR 000001AF: < FAILED >
MSR 000001B0: < FAILED >
MSR 000001B1: 0000-0000-8846-0000
MSR 000001B2: 0000-0000-0000-0000
MSR 000001FC: 0000-0000-0038-005F
MSR 00000300: < FAILED >
MSR 0000030A: 0000-0000-4D91-D35F
MSR 0000030B: 0000-0000-539B-EF60
MSR 00000480: 00DA-0500-0000-0013
MSR 00000481: 0000-00FF-0000-0016
MSR 00000482: FFF9-FFFE-0401-E172
MSR 00000483: 03FF-FFFF-0003-6DFF
MSR 00000484: 0007-FFFF-0000-11FF
MSR 00000485: 0000-0000-7004-C1E7
MSR 00000486: 0000-0000-8000-0021
MSR 00000487: 0000-0000-FFFF-FFFF
MSR 00000488: 0000-0000-0000-2000
MSR 00000489: 0000-0000-0077-6FFF
MSR 0000048A: 0000-0000-0000-002E
MSR 0000048B: 031F-7FFF-0000-0000
MSR 0000048C: 0000-0F01-0633-4141
MSR 0000048D: 0000-00FF-0000-0016
MSR 0000048E: FFF9-FFFE-0400-6172
MSR 0000048F: 03FF-FFFF-0003-6DFB
MSR 00000490: 0007-FFFF-0000-11FB
MSR 00000601: 0000-0000-0000-0000
MSR 00000602: < FAILED >
MSR 00000603: 0036-0000-0036-3636
MSR 00000604: < FAILED >
MSR 00000606: 0000-0000-000A-0E03
MSR 0000060A: 0000-0000-0000-0000
MSR 0000060B: 0000-0000-0000-0000
MSR 0000060C: 0000-0000-0000-0000
MSR 0000060D: 0000-0000-0000-0000
MSR 00000610: 0042-FFF8-001B-FFF8
MSR 00000611: 0000-0000-028D-741C
MSR 00000613: 0000-0000-0000-0000
MSR 00000614: 0000-0000-0000-03E8
MSR 00000618: 0014-8FFF-0014-8FFF
MSR 00000619: 0000-0000-0000-0000
MSR 0000061B: 0000-0000-0000-0000
MSR 0000061C: < FAILED >
MSR 0000061E: < FAILED >
MSR 00000620: 0000-0000-0000-082B
MSR 00000621: 0000-0000-0000-001D
MSR 00000638: 0000-0000-0000-0000
MSR 00000639: 0000-0000-00DF-D6FA
MSR 0000063A: 0000-0000-0000-0009
MSR 0000063B: < FAILED >
MSR 00000640: 0000-0000-0000-0000
MSR 00000641: 0000-0000-0000-AF4E
MSR 00000642: 0000-0000-0000-000D
MSR 00000648: 0000-0000-0000-0023
MSR 00000649: 0000-0000-0000-02F8
MSR 0000064A: 0000-0000-001E-0000
MSR 0000064B: 0000-0000-8000-0000
MSR 0000064C: 0000-0000-0000-0000
MSR 00000690: 0000-0000-0000-0000
MSR 000006B0: 0000-0000-0000-0000
MSR 000006B1: 0000-0000-0000-0000
MSR 00000770: 0000-0000-0000-0001
MSR 00000771: 0000-0000-0108-2333
MSR 00000772: 0000-0000-8000-FF01
MSR 00000773: 0000-0000-0000-0005
MSR 00000774: 0000-019E-5400-FF01
MSR 00000777: 0000-0000-0000-0004
MSR 00000832: 0000-0000-0003-00D1
MSR 00000838: 0000-0000-0000-0000
MSR 00000839: 0000-0000-0000-0000
MSR 0000083E: 0000-0000-0000-000A

------[ MSR Registers / Logical CPU #5 ]------

MSR 00000017: 0004-0000-0000-0000 [PlatID = 1]
MSR 0000001B: 0000-0000-FEE0-0C00
MSR 00000035: 0000-0000-0008-000C
MSR 00000048: 0000-0000-0000-0001
MSR 00000049: < FAILED >
MSR 0000008B: 0000-001C-0000-0000
MSR 000000CE: 0808-0838-F181-2300 [eD = 0]
MSR 000000E7: 0000-0003-8E2A-219B
MSR 000000E8: 0000-0003-8186-B8B5
MSR 0000010A: 0000-0000-0000-006B
MSR 0000010B: < FAILED >
MSR 00000194: 0000-0000-000F-0000
MSR 00000198: 0000-2103-0000-2300
MSR 00000199: 0000-0000-0000-2300
MSR 0000019A: 0000-0000-0000-0000
MSR 0000019B: 0000-0000-0000-0010
MSR 0000019C: 0000-0000-8849-8000
MSR 0000019D: 0000-0000-0000-0000
MSR 000001A0: 0000-0040-0085-0089
MSR 000001A2: 0000-0000-8064-0000
MSR 000001A4: 0000-0000-0000-0000
MSR 000001AA: 0000-0000-0040-1CC0
MSR 000001AC: < FAILED >
MSR 000001AD: 3030-3131-3333-3535
MSR 000001AE: < FAILED >
MSR 000001AF: < FAILED >
MSR 000001B0: < FAILED >
MSR 000001B1: 0000-0000-8846-0000
MSR 000001B2: 0000-0000-0000-0000
MSR 000001FC: 0000-0000-0038-005F
MSR 00000300: < FAILED >
MSR 0000030A: 0000-0000-0625-E5D9
MSR 0000030B: 0000-0000-07E8-889C
MSR 00000480: 00DA-0500-0000-0013
MSR 00000481: 0000-00FF-0000-0016
MSR 00000482: FFF9-FFFE-0401-E172
MSR 00000483: 03FF-FFFF-0003-6DFF
MSR 00000484: 0007-FFFF-0000-11FF
MSR 00000485: 0000-0000-7004-C1E7
MSR 00000486: 0000-0000-8000-0021
MSR 00000487: 0000-0000-FFFF-FFFF
MSR 00000488: 0000-0000-0000-2000
MSR 00000489: 0000-0000-0077-6FFF
MSR 0000048A: 0000-0000-0000-002E
MSR 0000048B: 031F-7FFF-0000-0000
MSR 0000048C: 0000-0F01-0633-4141
MSR 0000048D: 0000-00FF-0000-0016
MSR 0000048E: FFF9-FFFE-0400-6172
MSR 0000048F: 03FF-FFFF-0003-6DFB
MSR 00000490: 0007-FFFF-0000-11FB
MSR 00000601: 0000-0000-0000-0000
MSR 00000602: < FAILED >
MSR 00000603: 0036-0000-0036-3636
MSR 00000604: < FAILED >
MSR 00000606: 0000-0000-000A-0E03
MSR 0000060A: 0000-0000-0000-0000
MSR 0000060B: 0000-0000-0000-0000
MSR 0000060C: 0000-0000-0000-0000
MSR 0000060D: 0000-0000-0000-0000
MSR 00000610: 0042-FFF8-001B-FFF8
MSR 00000611: 0000-0000-028D-7646
MSR 00000613: 0000-0000-0000-0000
MSR 00000614: 0000-0000-0000-03E8
MSR 00000618: 0014-8FFF-0014-8FFF
MSR 00000619: 0000-0000-0000-0000
MSR 0000061B: 0000-0000-0000-0000
MSR 0000061C: < FAILED >
MSR 0000061E: < FAILED >
MSR 00000620: 0000-0000-0000-082B
MSR 00000621: 0000-0000-0000-001D
MSR 00000638: 0000-0000-0000-0000
MSR 00000639: 0000-0000-00DF-D81C
MSR 0000063A: 0000-0000-0000-0009
MSR 0000063B: < FAILED >
MSR 00000640: 0000-0000-0000-0000
MSR 00000641: 0000-0000-0000-AF4E
MSR 00000642: 0000-0000-0000-000D
MSR 00000648: 0000-0000-0000-0023
MSR 00000649: 0000-0000-0000-02F8
MSR 0000064A: 0000-0000-001E-0000
MSR 0000064B: 0000-0000-8000-0000
MSR 0000064C: 0000-0000-0000-0000
MSR 00000690: 0000-0000-0000-0000
MSR 000006B0: 0000-0000-0000-0000
MSR 000006B1: 0000-0000-0000-0000
MSR 00000770: 0000-0000-0000-0001
MSR 00000771: 0000-0000-0108-2333
MSR 00000772: 0000-0000-8000-FF01
MSR 00000773: 0000-0000-0000-0005
MSR 00000774: 0000-019E-5400-FF01
MSR 00000777: 0000-0000-0000-0004
MSR 00000832: 0000-0000-0003-00D1
MSR 00000838: 0000-0000-0000-0000
MSR 00000839: 0000-0000-0000-0000
MSR 0000083E: 0000-0000-0000-000A

------[ MSR Registers / Logical CPU #6 ]------

MSR 00000017: 0004-0000-0000-0000 [PlatID = 1]
MSR 0000001B: 0000-0000-FEE0-0C00
MSR 00000035: 0000-0000-0008-000C
MSR 00000048: 0000-0000-0000-0001
MSR 00000049: < FAILED >
MSR 0000008B: 0000-001C-0000-0000
MSR 000000CE: 0808-0838-F181-2300 [eD = 0]
MSR 000000E7: 0000-0006-89CD-D06D
MSR 000000E8: 0000-0006-5E25-1FEF
MSR 0000010A: 0000-0000-0000-006B
MSR 0000010B: < FAILED >
MSR 00000194: 0000-0000-000F-0000
MSR 00000198: 0000-20E0-0000-2300
MSR 00000199: 0000-0000-0000-2300
MSR 0000019A: 0000-0000-0000-0000
MSR 0000019B: 0000-0000-0000-0010
MSR 0000019C: 0000-0000-8849-8000
MSR 0000019D: 0000-0000-0000-0000
MSR 000001A0: 0000-0040-0085-0089
MSR 000001A2: 0000-0000-8064-0000
MSR 000001A4: 0000-0000-0000-0000
MSR 000001AA: 0000-0000-0040-1CC0
MSR 000001AC: < FAILED >
MSR 000001AD: 3030-3131-3333-3535
MSR 000001AE: < FAILED >
MSR 000001AF: < FAILED >
MSR 000001B0: < FAILED >
MSR 000001B1: 0000-0000-8847-0000
MSR 000001B2: 0000-0000-0000-0000
MSR 000001FC: 0000-0000-0038-005F
MSR 00000300: < FAILED >
MSR 0000030A: 0000-0000-08BA-7EF3
MSR 0000030B: 0000-0000-0CA5-B7B0
MSR 00000480: 00DA-0500-0000-0013
MSR 00000481: 0000-00FF-0000-0016
MSR 00000482: FFF9-FFFE-0401-E172
MSR 00000483: 03FF-FFFF-0003-6DFF
MSR 00000484: 0007-FFFF-0000-11FF
MSR 00000485: 0000-0000-7004-C1E7
MSR 00000486: 0000-0000-8000-0021
MSR 00000487: 0000-0000-FFFF-FFFF
MSR 00000488: 0000-0000-0000-2000
MSR 00000489: 0000-0000-0077-6FFF
MSR 0000048A: 0000-0000-0000-002E
MSR 0000048B: 031F-7FFF-0000-0000
MSR 0000048C: 0000-0F01-0633-4141
MSR 0000048D: 0000-00FF-0000-0016
MSR 0000048E: FFF9-FFFE-0400-6172
MSR 0000048F: 03FF-FFFF-0003-6DFB
MSR 00000490: 0007-FFFF-0000-11FB
MSR 00000601: 0000-0000-0000-0000
MSR 00000602: < FAILED >
MSR 00000603: 0036-0000-0036-3636
MSR 00000604: < FAILED >
MSR 00000606: 0000-0000-000A-0E03
MSR 0000060A: 0000-0000-0000-0000
MSR 0000060B: 0000-0000-0000-0000
MSR 0000060C: 0000-0000-0000-0000
MSR 0000060D: 0000-0000-0000-0000
MSR 00000610: 0042-FFF8-001B-FFF8
MSR 00000611: 0000-0000-028D-7836
MSR 00000613: 0000-0000-0000-0000
MSR 00000614: 0000-0000-0000-03E8
MSR 00000618: 0014-8FFF-0014-8FFF
MSR 00000619: 0000-0000-0000-0000
MSR 0000061B: 0000-0000-0000-0000
MSR 0000061C: < FAILED >
MSR 0000061E: < FAILED >
MSR 00000620: 0000-0000-0000-082B
MSR 00000621: 0000-0000-0000-001D
MSR 00000638: 0000-0000-0000-0000
MSR 00000639: 0000-0000-00DF-D923
MSR 0000063A: 0000-0000-0000-0009
MSR 0000063B: < FAILED >
MSR 00000640: 0000-0000-0000-0000
MSR 00000641: 0000-0000-0000-AF4E
MSR 00000642: 0000-0000-0000-000D
MSR 00000648: 0000-0000-0000-0023
MSR 00000649: 0000-0000-0000-02F8
MSR 0000064A: 0000-0000-001E-0000
MSR 0000064B: 0000-0000-8000-0000
MSR 0000064C: 0000-0000-0000-0000
MSR 00000690: 0000-0000-0000-0000
MSR 000006B0: 0000-0000-0000-0000
MSR 000006B1: 0000-0000-0000-0000
MSR 00000770: 0000-0000-0000-0001
MSR 00000771: 0000-0000-0108-2333
MSR 00000772: 0000-0000-8000-FF01
MSR 00000773: 0000-0000-0000-0005
MSR 00000774: 0000-019E-5400-FF01
MSR 00000777: 0000-0000-0000-0004
MSR 00000832: 0000-0000-0003-00D1
MSR 00000838: 0000-0000-0000-0000
MSR 00000839: 0000-0000-0000-0000
MSR 0000083E: 0000-0000-0000-000A

------[ MSR Registers / Logical CPU #7 ]------

MSR 00000017: 0004-0000-0000-0000 [PlatID = 1]
MSR 0000001B: 0000-0000-FEE0-0C00
MSR 00000035: 0000-0000-0008-000C
MSR 00000048: 0000-0000-0000-0001
MSR 00000049: < FAILED >
MSR 0000008B: 0000-001C-0000-0000
MSR 000000CE: 0808-0838-F181-2300 [eD = 0]
MSR 000000E7: 0000-0006-8DE0-A46E
MSR 000000E8: 0000-0006-823A-FC38
MSR 0000010A: 0000-0000-0000-006B
MSR 0000010B: < FAILED >
MSR 00000194: 0000-0000-000F-0000
MSR 00000198: 0000-20E3-0000-2300
MSR 00000199: 0000-0000-0000-2300
MSR 0000019A: 0000-0000-0000-0000
MSR 0000019B: 0000-0000-0000-0010
MSR 0000019C: 0000-0000-8849-8000
MSR 0000019D: 0000-0000-0000-0000
MSR 000001A0: 0000-0040-0085-0089
MSR 000001A2: 0000-0000-8064-0000
MSR 000001A4: 0000-0000-0000-0000
MSR 000001AA: 0000-0000-0040-1CC0
MSR 000001AC: < FAILED >
MSR 000001AD: 3030-3131-3333-3535
MSR 000001AE: < FAILED >
MSR 000001AF: < FAILED >
MSR 000001B0: < FAILED >
MSR 000001B1: 0000-0000-8847-0000
MSR 000001B2: 0000-0000-0000-0000
MSR 000001FC: 0000-0000-0038-005F
MSR 00000300: < FAILED >
MSR 0000030A: 0000-0000-14AD-B3B5
MSR 0000030B: 0000-0000-165B-E904
MSR 00000480: 00DA-0500-0000-0013
MSR 00000481: 0000-00FF-0000-0016
MSR 00000482: FFF9-FFFE-0401-E172
MSR 00000483: 03FF-FFFF-0003-6DFF
MSR 00000484: 0007-FFFF-0000-11FF
MSR 00000485: 0000-0000-7004-C1E7
MSR 00000486: 0000-0000-8000-0021
MSR 00000487: 0000-0000-FFFF-FFFF
MSR 00000488: 0000-0000-0000-2000
MSR 00000489: 0000-0000-0077-6FFF
MSR 0000048A: 0000-0000-0000-002E
MSR 0000048B: 031F-7FFF-0000-0000
MSR 0000048C: 0000-0F01-0633-4141
MSR 0000048D: 0000-00FF-0000-0016
MSR 0000048E: FFF9-FFFE-0400-6172
MSR 0000048F: 03FF-FFFF-0003-6DFB
MSR 00000490: 0007-FFFF-0000-11FB
MSR 00000601: 0000-0000-0000-0000
MSR 00000602: < FAILED >
MSR 00000603: 0036-0000-0036-3636
MSR 00000604: < FAILED >
MSR 00000606: 0000-0000-000A-0E03
MSR 0000060A: 0000-0000-0000-0000
MSR 0000060B: 0000-0000-0000-0000
MSR 0000060C: 0000-0000-0000-0000
MSR 0000060D: 0000-0000-0000-0000
MSR 00000610: 0042-FFF8-001B-FFF8
MSR 00000611: 0000-0000-028D-7836
MSR 00000613: 0000-0000-0000-0000
MSR 00000614: 0000-0000-0000-03E8
MSR 00000618: 0014-8FFF-0014-8FFF
MSR 00000619: 0000-0000-0000-0000
MSR 0000061B: 0000-0000-0000-0000
MSR 0000061C: < FAILED >
MSR 0000061E: < FAILED >
MSR 00000620: 0000-0000-0000-082B
MSR 00000621: 0000-0000-0000-001D
MSR 00000638: 0000-0000-0000-0000
MSR 00000639: 0000-0000-00DF-D923
MSR 0000063A: 0000-0000-0000-0009
MSR 0000063B: < FAILED >
MSR 00000640: 0000-0000-0000-0000
MSR 00000641: 0000-0000-0000-AF4E
MSR 00000642: 0000-0000-0000-000D
MSR 00000648: 0000-0000-0000-0023
MSR 00000649: 0000-0000-0000-02F8
MSR 0000064A: 0000-0000-001E-0000
MSR 0000064B: 0000-0000-8000-0000
MSR 0000064C: 0000-0000-0000-0000
MSR 00000690: 0000-0000-0000-0000
MSR 000006B0: 0000-0000-0000-0000
MSR 000006B1: 0000-0000-0000-0000
MSR 00000770: 0000-0000-0000-0001
MSR 00000771: 0000-0000-0108-2335
MSR 00000772: 0000-0000-8000-FF01
MSR 00000773: 0000-0000-0000-0005
MSR 00000774: 0000-019E-5400-FF01
MSR 00000777: 0000-0000-0000-0004
MSR 00000832: 0000-0000-0003-00D1
MSR 00000838: 0000-0000-0000-0000
MSR 00000839: 0000-0000-0000-0000
MSR 0000083E: 0000-0000-0000-000A

------[ MSR Registers / Logical CPU #8 ]------

MSR 00000017: 0004-0000-0000-0000 [PlatID = 1]
MSR 0000001B: 0000-0000-FEE0-0C00
MSR 00000035: 0000-0000-0008-000C
MSR 00000048: 0000-0000-0000-0001
MSR 00000049: < FAILED >
MSR 0000008B: 0000-001C-0000-0000
MSR 000000CE: 0808-0838-F181-2300 [eD = 0]
MSR 000000E7: 0000-0006-952A-A936
MSR 000000E8: 0000-0006-7FEB-A899
MSR 0000010A: 0000-0000-0000-006B
MSR 0000010B: < FAILED >
MSR 00000194: 0000-0000-000F-0000
MSR 00000198: 0000-20E8-0000-2300
MSR 00000199: 0000-0000-0000-2300
MSR 0000019A: 0000-0000-0000-0000
MSR 0000019B: 0000-0000-0000-0010
MSR 0000019C: 0000-0000-8847-8000
MSR 0000019D: 0000-0000-0000-0000
MSR 000001A0: 0000-0040-0085-0089
MSR 000001A2: 0000-0000-8064-0000
MSR 000001A4: 0000-0000-0000-0000
MSR 000001AA: 0000-0000-0040-1CC0
MSR 000001AC: < FAILED >
MSR 000001AD: 3030-3131-3333-3535
MSR 000001AE: < FAILED >
MSR 000001AF: < FAILED >
MSR 000001B0: < FAILED >
MSR 000001B1: 0000-0000-8847-0000
MSR 000001B2: 0000-0000-0000-0000
MSR 000001FC: 0000-0000-0038-005F
MSR 00000300: < FAILED >
MSR 0000030A: 0000-0000-07AC-EF74
MSR 0000030B: 0000-0000-0C05-8DA4
MSR 00000480: 00DA-0500-0000-0013
MSR 00000481: 0000-00FF-0000-0016
MSR 00000482: FFF9-FFFE-0401-E172
MSR 00000483: 03FF-FFFF-0003-6DFF
MSR 00000484: 0007-FFFF-0000-11FF
MSR 00000485: 0000-0000-7004-C1E7
MSR 00000486: 0000-0000-8000-0021
MSR 00000487: 0000-0000-FFFF-FFFF
MSR 00000488: 0000-0000-0000-2000
MSR 00000489: 0000-0000-0077-6FFF
MSR 0000048A: 0000-0000-0000-002E
MSR 0000048B: 031F-7FFF-0000-0000
MSR 0000048C: 0000-0F01-0633-4141
MSR 0000048D: 0000-00FF-0000-0016
MSR 0000048E: FFF9-FFFE-0400-6172
MSR 0000048F: 03FF-FFFF-0003-6DFB
MSR 00000490: 0007-FFFF-0000-11FB
MSR 00000601: 0000-0000-0000-0000
MSR 00000602: < FAILED >
MSR 00000603: 0036-0000-0036-3636
MSR 00000604: < FAILED >
MSR 00000606: 0000-0000-000A-0E03
MSR 0000060A: 0000-0000-0000-0000
MSR 0000060B: 0000-0000-0000-0000
MSR 0000060C: 0000-0000-0000-0000
MSR 0000060D: 0000-0000-0000-0000
MSR 00000610: 0042-FFF8-001B-FFF8
MSR 00000611: 0000-0000-028D-79BD
MSR 00000613: 0000-0000-0000-0000
MSR 00000614: 0000-0000-0000-03E8
MSR 00000618: 0014-8FFF-0014-8FFF
MSR 00000619: 0000-0000-0000-0000
MSR 0000061B: 0000-0000-0000-0000
MSR 0000061C: < FAILED >
MSR 0000061E: < FAILED >
MSR 00000620: 0000-0000-0000-082B
MSR 00000621: 0000-0000-0000-001D
MSR 00000638: 0000-0000-0000-0000
MSR 00000639: 0000-0000-00DF-D9E6
MSR 0000063A: 0000-0000-0000-0009
MSR 0000063B: < FAILED >
MSR 00000640: 0000-0000-0000-0000
MSR 00000641: 0000-0000-0000-AF4E
MSR 00000642: 0000-0000-0000-000D
MSR 00000648: 0000-0000-0000-0023
MSR 00000649: 0000-0000-0000-02F8
MSR 0000064A: 0000-0000-001E-0000
MSR 0000064B: 0000-0000-8000-0000
MSR 0000064C: 0000-0000-0000-0000
MSR 00000690: 0000-0000-0000-0000
MSR 000006B0: 0000-0000-0000-0000
MSR 000006B1: 0000-0000-0000-0000
MSR 00000770: 0000-0000-0000-0001
MSR 00000771: 0000-0000-0108-2335
MSR 00000772: 0000-0000-8000-FF01
MSR 00000773: 0000-0000-0000-0005
MSR 00000774: 0000-019E-5400-FF01
MSR 00000777: 0000-0000-0000-0004
MSR 00000832: 0000-0000-0003-00D1
MSR 00000838: 0000-0000-0000-0000
MSR 00000839: 0000-0000-0000-0000
MSR 0000083E: 0000-0000-0000-000A

------[ MSR Registers / Logical CPU #9 ]------

MSR 00000017: 0004-0000-0000-0000 [PlatID = 1]
MSR 0000001B: 0000-0000-FEE0-0C00
MSR 00000035: 0000-0000-0008-000C
MSR 00000048: 0000-0000-0000-0001
MSR 00000049: < FAILED >
MSR 0000008B: 0000-001C-0000-0000
MSR 000000CE: 0808-0838-F181-2300 [eD = 0]
MSR 000000E7: 0000-0008-2F8E-6C50
MSR 000000E8: 0000-0008-2602-15C2
MSR 0000010A: 0000-0000-0000-006B
MSR 0000010B: < FAILED >
MSR 00000194: 0000-0000-000F-0000
MSR 00000198: 0000-20E0-0000-2300
MSR 00000199: 0000-0000-0000-2300
MSR 0000019A: 0000-0000-0000-0000
MSR 0000019B: 0000-0000-0000-0010
MSR 0000019C: 0000-0000-884B-8000
MSR 0000019D: 0000-0000-0000-0000
MSR 000001A0: 0000-0040-0085-0089
MSR 000001A2: 0000-0000-8064-0000
MSR 000001A4: 0000-0000-0000-0000
MSR 000001AA: 0000-0000-0040-1CC0
MSR 000001AC: < FAILED >
MSR 000001AD: 3030-3131-3333-3535
MSR 000001AE: < FAILED >
MSR 000001AF: < FAILED >
MSR 000001B0: < FAILED >
MSR 000001B1: 0000-0000-8848-0000
MSR 000001B2: 0000-0000-0000-0000
MSR 000001FC: 0000-0000-0038-005F
MSR 00000300: < FAILED >
MSR 0000030A: 0000-0000-0311-E2AD
MSR 0000030B: 0000-0000-0478-5624
MSR 00000480: 00DA-0500-0000-0013
MSR 00000481: 0000-00FF-0000-0016
MSR 00000482: FFF9-FFFE-0401-E172
MSR 00000483: 03FF-FFFF-0003-6DFF
MSR 00000484: 0007-FFFF-0000-11FF
MSR 00000485: 0000-0000-7004-C1E7
MSR 00000486: 0000-0000-8000-0021
MSR 00000487: 0000-0000-FFFF-FFFF
MSR 00000488: 0000-0000-0000-2000
MSR 00000489: 0000-0000-0077-6FFF
MSR 0000048A: 0000-0000-0000-002E
MSR 0000048B: 031F-7FFF-0000-0000
MSR 0000048C: 0000-0F01-0633-4141
MSR 0000048D: 0000-00FF-0000-0016
MSR 0000048E: FFF9-FFFE-0400-6172
MSR 0000048F: 03FF-FFFF-0003-6DFB
MSR 00000490: 0007-FFFF-0000-11FB
MSR 00000601: 0000-0000-0000-0000
MSR 00000602: < FAILED >
MSR 00000603: 0036-0000-0036-3636
MSR 00000604: < FAILED >
MSR 00000606: 0000-0000-000A-0E03
MSR 0000060A: 0000-0000-0000-0000
MSR 0000060B: 0000-0000-0000-0000
MSR 0000060C: 0000-0000-0000-0000
MSR 0000060D: 0000-0000-0000-0000
MSR 00000610: 0042-FFF8-001B-FFF8
MSR 00000611: 0000-0000-028D-7B94
MSR 00000613: 0000-0000-0000-0000
MSR 00000614: 0000-0000-0000-03E8
MSR 00000618: 0014-8FFF-0014-8FFF
MSR 00000619: 0000-0000-0000-0000
MSR 0000061B: 0000-0000-0000-0000
MSR 0000061C: < FAILED >
MSR 0000061E: < FAILED >
MSR 00000620: 0000-0000-0000-082B
MSR 00000621: 0000-0000-0000-001D
MSR 00000638: 0000-0000-0000-0000
MSR 00000639: 0000-0000-00DF-DAD2
MSR 0000063A: 0000-0000-0000-0009
MSR 0000063B: < FAILED >
MSR 00000640: 0000-0000-0000-0000
MSR 00000641: 0000-0000-0000-AF4E
MSR 00000642: 0000-0000-0000-000D
MSR 00000648: 0000-0000-0000-0023
MSR 00000649: 0000-0000-0000-02F8
MSR 0000064A: 0000-0000-001E-0000
MSR 0000064B: 0000-0000-8000-0000
MSR 0000064C: 0000-0000-0000-0000
MSR 00000690: 0000-0000-0000-0000
MSR 000006B0: 0000-0000-0000-0000
MSR 000006B1: 0000-0000-0000-0000
MSR 00000770: 0000-0000-0000-0001
MSR 00000771: 0000-0000-0108-2333
MSR 00000772: 0000-0000-8000-FF01
MSR 00000773: 0000-0000-0000-0005
MSR 00000774: 0000-019E-5400-FF01
MSR 00000777: 0000-0000-0000-0004
MSR 00000832: 0000-0000-0003-00D1
MSR 00000838: 0000-0000-0000-0000
MSR 00000839: 0000-0000-0000-0000
MSR 0000083E: 0000-0000-0000-000A

------[ MSR Registers / Logical CPU #10 ]------

MSR 00000017: 0004-0000-0000-0000 [PlatID = 1]
MSR 0000001B: 0000-0000-FEE0-0C00
MSR 00000035: 0000-0000-0008-000C
MSR 00000048: 0000-0000-0000-0001
MSR 00000049: < FAILED >
MSR 0000008B: 0000-001C-0000-0000
MSR 000000CE: 0808-0838-F181-2300 [eD = 0]
MSR 000000E7: 0000-0006-BF3A-EAC4
MSR 000000E8: 0000-0006-753A-86E8
MSR 0000010A: 0000-0000-0000-006B
MSR 0000010B: < FAILED >
MSR 00000194: 0000-0000-000F-0000
MSR 00000198: 0000-20E5-0000-2300
MSR 00000199: 0000-0000-0000-2300
MSR 0000019A: 0000-0000-0000-0000
MSR 0000019B: 0000-0000-0000-0010
MSR 0000019C: 0000-0000-884B-8000
MSR 0000019D: 0000-0000-0000-0000
MSR 000001A0: 0000-0040-0085-0089
MSR 000001A2: 0000-0000-8064-0000
MSR 000001A4: 0000-0000-0000-0000
MSR 000001AA: 0000-0000-0040-1CC0
MSR 000001AC: < FAILED >
MSR 000001AD: 3030-3131-3333-3535
MSR 000001AE: < FAILED >
MSR 000001AF: < FAILED >
MSR 000001B0: < FAILED >
MSR 000001B1: 0000-0000-8847-0000
MSR 000001B2: 0000-0000-0000-0000
MSR 000001FC: 0000-0000-0038-005F
MSR 00000300: < FAILED >
MSR 0000030A: 0000-0000-2228-1D3A
MSR 0000030B: 0000-0000-4717-7030
MSR 00000480: 00DA-0500-0000-0013
MSR 00000481: 0000-00FF-0000-0016
MSR 00000482: FFF9-FFFE-0401-E172
MSR 00000483: 03FF-FFFF-0003-6DFF
MSR 00000484: 0007-FFFF-0000-11FF
MSR 00000485: 0000-0000-7004-C1E7
MSR 00000486: 0000-0000-8000-0021
MSR 00000487: 0000-0000-FFFF-FFFF
MSR 00000488: 0000-0000-0000-2000
MSR 00000489: 0000-0000-0077-6FFF
MSR 0000048A: 0000-0000-0000-002E
MSR 0000048B: 031F-7FFF-0000-0000
MSR 0000048C: 0000-0F01-0633-4141
MSR 0000048D: 0000-00FF-0000-0016
MSR 0000048E: FFF9-FFFE-0400-6172
MSR 0000048F: 03FF-FFFF-0003-6DFB
MSR 00000490: 0007-FFFF-0000-11FB
MSR 00000601: 0000-0000-0000-0000
MSR 00000602: < FAILED >
MSR 00000603: 0036-0000-0036-3636
MSR 00000604: < FAILED >
MSR 00000606: 0000-0000-000A-0E03
MSR 0000060A: 0000-0000-0000-0000
MSR 0000060B: 0000-0000-0000-0000
MSR 0000060C: 0000-0000-0000-0000
MSR 0000060D: 0000-0000-0000-0000
MSR 00000610: 0042-FFF8-001B-FFF8
MSR 00000611: 0000-0000-028D-7B94
MSR 00000613: 0000-0000-0000-0000
MSR 00000614: 0000-0000-0000-03E8
MSR 00000618: 0014-8FFF-0014-8FFF
MSR 00000619: 0000-0000-0000-0000
MSR 0000061B: 0000-0000-0000-0000
MSR 0000061C: < FAILED >
MSR 0000061E: < FAILED >
MSR 00000620: 0000-0000-0000-082B
MSR 00000621: 0000-0000-0000-001D
MSR 00000638: 0000-0000-0000-0000
MSR 00000639: 0000-0000-00DF-DAD2
MSR 0000063A: 0000-0000-0000-0009
MSR 0000063B: < FAILED >
MSR 00000640: 0000-0000-0000-0000
MSR 00000641: 0000-0000-0000-AF4E
MSR 00000642: 0000-0000-0000-000D
MSR 00000648: 0000-0000-0000-0023
MSR 00000649: 0000-0000-0000-02F8
MSR 0000064A: 0000-0000-001E-0000
MSR 0000064B: 0000-0000-8000-0000
MSR 0000064C: 0000-0000-0000-0000
MSR 00000690: 0000-0000-0000-0000
MSR 000006B0: 0000-0000-0000-0000
MSR 000006B1: 0000-0000-0000-0000
MSR 00000770: 0000-0000-0000-0001
MSR 00000771: 0000-0000-0108-2333
MSR 00000772: 0000-0000-8000-FF01
MSR 00000773: 0000-0000-0000-0005
MSR 00000774: 0000-019E-5400-FF01
MSR 00000777: 0000-0000-0000-0004
MSR 00000832: 0000-0000-0003-00D1
MSR 00000838: 0000-0000-0000-0000
MSR 00000839: 0000-0000-0000-0000
MSR 0000083E: 0000-0000-0000-000A

------[ MSR Registers / Logical CPU #11 ]------

MSR 00000017: 0004-0000-0000-0000 [PlatID = 1]
MSR 0000001B: 0000-0000-FEE0-0C00
MSR 00000035: 0000-0000-0008-000C
MSR 00000048: 0000-0000-0000-0001
MSR 00000049: < FAILED >
MSR 0000008B: 0000-001C-0000-0000
MSR 000000CE: 0808-0838-F181-2300 [eD = 0]
MSR 000000E7: 0000-0004-AF83-B496
MSR 000000E8: 0000-0004-AA80-3833
MSR 0000010A: 0000-0000-0000-006B
MSR 0000010B: < FAILED >
MSR 00000194: 0000-0000-000F-0000
MSR 00000198: 0000-20BD-0000-2300
MSR 00000199: 0000-0000-0000-2300
MSR 0000019A: 0000-0000-0000-0000
MSR 0000019B: 0000-0000-0000-0010
MSR 0000019C: 0000-0000-884B-8000
MSR 0000019D: 0000-0000-0000-0000
MSR 000001A0: 0000-0040-0085-0089
MSR 000001A2: 0000-0000-8064-0000
MSR 000001A4: 0000-0000-0000-0000
MSR 000001AA: 0000-0000-0040-1CC0
MSR 000001AC: < FAILED >
MSR 000001AD: 3030-3131-3333-3535
MSR 000001AE: < FAILED >
MSR 000001AF: < FAILED >
MSR 000001B0: < FAILED >
MSR 000001B1: 0000-0000-8847-0000
MSR 000001B2: 0000-0000-0000-0000
MSR 000001FC: 0000-0000-0038-005F
MSR 00000300: < FAILED >
MSR 0000030A: 0000-0000-06A2-3AB6
MSR 0000030B: 0000-0000-0733-B210
MSR 00000480: 00DA-0500-0000-0013
MSR 00000481: 0000-00FF-0000-0016
MSR 00000482: FFF9-FFFE-0401-E172
MSR 00000483: 03FF-FFFF-0003-6DFF
MSR 00000484: 0007-FFFF-0000-11FF
MSR 00000485: 0000-0000-7004-C1E7
MSR 00000486: 0000-0000-8000-0021
MSR 00000487: 0000-0000-FFFF-FFFF
MSR 00000488: 0000-0000-0000-2000
MSR 00000489: 0000-0000-0077-6FFF
MSR 0000048A: 0000-0000-0000-002E
MSR 0000048B: 031F-7FFF-0000-0000
MSR 0000048C: 0000-0F01-0633-4141
MSR 0000048D: 0000-00FF-0000-0016
MSR 0000048E: FFF9-FFFE-0400-6172
MSR 0000048F: 03FF-FFFF-0003-6DFB
MSR 00000490: 0007-FFFF-0000-11FB
MSR 00000601: 0000-0000-0000-0000
MSR 00000602: < FAILED >
MSR 00000603: 0036-0000-0036-3636
MSR 00000604: < FAILED >
MSR 00000606: 0000-0000-000A-0E03
MSR 0000060A: 0000-0000-0000-0000
MSR 0000060B: 0000-0000-0000-0000
MSR 0000060C: 0000-0000-0000-0000
MSR 0000060D: 0000-0000-0000-0000
MSR 00000610: 0042-FFF8-001B-FFF8
MSR 00000611: 0000-0000-028D-7D96
MSR 00000613: 0000-0000-0000-0000
MSR 00000614: 0000-0000-0000-03E8
MSR 00000618: 0014-8FFF-0014-8FFF
MSR 00000619: 0000-0000-0000-0000
MSR 0000061B: 0000-0000-0000-0000
MSR 0000061C: < FAILED >
MSR 0000061E: < FAILED >
MSR 00000620: 0000-0000-0000-082B
MSR 00000621: 0000-0000-0000-001D
MSR 00000638: 0000-0000-0000-0000
MSR 00000639: 0000-0000-00DF-DBBC
MSR 0000063A: 0000-0000-0000-0009
MSR 0000063B: < FAILED >
MSR 00000640: 0000-0000-0000-0000
MSR 00000641: 0000-0000-0000-AF66
MSR 00000642: 0000-0000-0000-000D
MSR 00000648: 0000-0000-0000-0023
MSR 00000649: 0000-0000-0000-02F8
MSR 0000064A: 0000-0000-001E-0000
MSR 0000064B: 0000-0000-8000-0000
MSR 0000064C: 0000-0000-0000-0000
MSR 00000690: 0000-0000-0000-0000
MSR 000006B0: 0000-0000-0000-0000
MSR 000006B1: 0000-0000-0000-0000
MSR 00000770: 0000-0000-0000-0001
MSR 00000771: 0000-0000-0108-2333
MSR 00000772: 0000-0000-8000-FF01
MSR 00000773: 0000-0000-0000-0005
MSR 00000774: 0000-019E-5400-FF01
MSR 00000777: 0000-0000-0000-0004
MSR 00000832: 0000-0000-0003-00D1
MSR 00000838: 0000-0000-0000-0000
MSR 00000839: 0000-0000-0000-0000
MSR 0000083E: 0000-0000-0000-000A

PerformanceFrequency = 10000000

CPU Clock M.Method = 9  (APIC SKL)
PM Timer Address   = 6152  (1808h)

APIC Clock = 100.00 MHz  (AT = 12574 / TT = 15004 / try = 1 / SKL = 24.00 MHz)
APIC Clock = 100.00 MHz  (AT = 12574 / TT = 15004 / try = 1 / SKL = 24.00 MHz)
APIC Clock = 100.00 MHz  (AT = 12574 / TT = 15004 / try = 1 / SKL = 24.00 MHz)
APIC Clock = 100.00 MHz  (AT = 12574 / TT = 15004 / try = 1 / SKL = 24.00 MHz)
APIC Clock = 100.00 MHz  (AT = 12574 / TT = 15004 / try = 1 / SKL = 24.00 MHz)

CPU Clock =  800.00 MHz / TSC Clock = 3503.78 MHz / CPU Mul =  8.00x
CPU Clock =  800.00 MHz / TSC Clock = 3503.78 MHz / CPU Mul =  8.00x
CPU Clock = 1100.00 MHz / TSC Clock = 3503.78 MHz / CPU Mul = 11.00x
CPU Clock = 1000.00 MHz / TSC Clock = 3503.78 MHz / CPU Mul = 10.00x
CPU Clock = 1100.00 MHz / TSC Clock = 3503.78 MHz / CPU Mul = 11.00x

CPU Clock Max = 3500.00 MHz / TSC Clock = 3503.78 MHz / CPU Mul = 35.00x
CPU Clock Max = 3500.00 MHz / TSC Clock = 3503.78 MHz / CPU Mul = 35.00x
CPU Clock Max = 3500.00 MHz / TSC Clock = 3503.78 MHz / CPU Mul = 35.00x
CPU Clock Max = 3500.00 MHz / TSC Clock = 3503.78 MHz / CPU Mul = 35.00x
CPU Clock Max = 3500.00 MHz / TSC Clock = 3503.78 MHz / CPU Mul = 35.00x

INTPERFCTR2 = 3500.17 MHz / INTPERFCTR1 (TSC) = 3504.01 MHz
INTPERFCTR2 = 3500.15 MHz / INTPERFCTR1 (TSC) = 3504.00 MHz
INTPERFCTR2 = 2808.79 MHz / INTPERFCTR1 (TSC) = 3504.02 MHz
INTPERFCTR2 = 3500.17 MHz / INTPERFCTR1 (TSC) = 3504.02 MHz
INTPERFCTR2 = 3500.14 MHz / INTPERFCTR1 (TSC) = 3503.98 MHz

------[ OC MailBox ]------

C 01 / P1 00 / P2 00: 00000755
C 01 / P1 01 / P2 00: 0000072A
C 01 / P1 02 / P2 00: 00000755
C 01 / P1 03 / P2 00: 00000000
C 01 / P1 04 / P2 00: 00000600
C 02 / P1 00 / P2 00: 33333535
C 02 / P1 00 / P2 01: 00000000
C 02 / P1 00 / P2 02: 00000000
C 02 / P1 00 / P2 03: 00000000
C 02 / P1 01 / P2 00: 30303131
C 02 / P1 01 / P2 01: 00000000
C 02 / P1 01 / P2 02: 00000000
C 02 / P1 01 / P2 03: 00000000
C 02 / P1 02 / P2 00: 00000000
C 02 / P1 02 / P2 01: 00000000
C 02 / P1 02 / P2 02: 00000000
C 02 / P1 02 / P2 03: 00000000
C 02 / P1 03 / P2 00: 00000000
C 02 / P1 03 / P2 01: 00000000
C 02 / P1 03 / P2 02: 00000000
C 02 / P1 03 / P2 03: 00000000
C 02 / P1 04 / P2 00: 00000000
C 02 / P1 04 / P2 01: 00000000
C 02 / P1 04 / P2 02: 00000000
C 02 / P1 04 / P2 03: 00000000
C 02 / P1 05 / P2 00: 00000000
C 02 / P1 05 / P2 01: 00000000
C 02 / P1 05 / P2 02: 00000000
C 02 / P1 05 / P2 03: 00000000
C 02 / P1 06 / P2 00: 00000000
C 02 / P1 06 / P2 01: 00000000
C 02 / P1 06 / P2 02: 00000000
C 02 / P1 06 / P2 03: 00000000
C 02 / P1 07 / P2 00: 00000000
C 02 / P1 07 / P2 01: 00000000
C 02 / P1 07 / P2 02: 00000000
C 02 / P1 07 / P2 03: 00000000
C 03 / P1 00 / P2 00: 00000818
C 04 / P1 00 / P2 00: B0108002
C 05 / P1 00 / P2 00: 00018688
C 10 / P1 00 / P2 00: 00000035
C 10 / P1 01 / P2 00: 00000000
C 10 / P1 02 / P2 00: 0000002B
C 10 / P1 03 / P2 00: 00000000
C 10 / P1 04 / P2 00: 00000000
C 12 / P1 00 / P2 00: 00000000
C 12 / P1 01 / P2 00: 00000000
C 12 / P1 02 / P2 00: 00000000
C 14 / P1 00 / P2 00: 00000004
C 16 / P1 00 / P2 00: 800003FF
C 18 / P1 00 / P2 00: 00000010
C 1A / P1 00 / P2 00: 00000000
C 1C / P1 00 / P2 00: 00003333  [CPU0]
C 1C / P1 00 / P2 00: 00003333  [CPU1]
C 1C / P1 00 / P2 00: 00003333  [CPU2]
C 1C / P1 00 / P2 00: 00003333  [CPU3]
C 1C / P1 00 / P2 00: 00003333  [CPU4]
C 1C / P1 00 / P2 00: 00003333  [CPU5]
C 1C / P1 00 / P2 00: 00003333  [CPU6]
C 1C / P1 00 / P2 00: 00003535  [CPU7]
C 1C / P1 00 / P2 00: 00003535  [CPU8]
C 1C / P1 00 / P2 00: 00003333  [CPU9]
C 1C / P1 00 / P2 00: 00003333  [CPU10]
C 1C / P1 00 / P2 00: 00003333  [CPU11]

------[ APIC Base at 00000000-FEE00000 ]------

  0000  FF FF FF FF FF FF FF FF FF FF FF FF FF FF FF FF 
  0010  FF FF FF FF FF FF FF FF FF FF FF FF FF FF FF FF 
  0020  FF FF FF FF FF FF FF FF FF FF FF FF FF FF FF FF 
  0030  FF FF FF FF FF FF FF FF FF FF FF FF FF FF FF FF 
  0040  FF FF FF FF FF FF FF FF FF FF FF FF FF FF FF FF 
  0050  FF FF FF FF FF FF FF FF FF FF FF FF FF FF FF FF 
  0060  FF FF FF FF FF FF FF FF FF FF FF FF FF FF FF FF 
  0070  FF FF FF FF FF FF FF FF FF FF FF FF FF FF FF FF 
  0080  FF FF FF FF FF FF FF FF FF FF FF FF FF FF FF FF 
  0090  FF FF FF FF FF FF FF FF FF FF FF FF FF FF FF FF 
  00A0  FF FF FF FF FF FF FF FF FF FF FF FF FF FF FF FF 
  00B0  FF FF FF FF FF FF FF FF FF FF FF FF FF FF FF FF 
  00C0  FF FF FF FF FF FF FF FF FF FF FF FF FF FF FF FF 
  00D0  FF FF FF FF FF FF FF FF FF FF FF FF FF FF FF FF 
  00E0  FF FF FF FF FF FF FF FF FF FF FF FF FF FF FF FF 
  00F0  FF FF FF FF FF FF FF FF FF FF FF FF FF FF FF FF 
  0100  FF FF FF FF FF FF FF FF FF FF FF FF FF FF FF FF 
  0110  FF FF FF FF FF FF FF FF FF FF FF FF FF FF FF FF 
  0120  FF FF FF FF FF FF FF FF FF FF FF FF FF FF FF FF 
  0130  FF FF FF FF FF FF FF FF FF FF FF FF FF FF FF FF 
  0140  FF FF FF FF FF FF FF FF FF FF FF FF FF FF FF FF 
  0150  FF FF FF FF FF FF FF FF FF FF FF FF FF FF FF FF 
  0160  FF FF FF FF FF FF FF FF FF FF FF FF FF FF FF FF 
  0170  FF FF FF FF FF FF FF FF FF FF FF FF FF FF FF FF 
  0180  FF FF FF FF FF FF FF FF FF FF FF FF FF FF FF FF 
  0190  FF FF FF FF FF FF FF FF FF FF FF FF FF FF FF FF 
  01A0  FF FF FF FF FF FF FF FF FF FF FF FF FF FF FF FF 
  01B0  FF FF FF FF FF FF FF FF FF FF FF FF FF FF FF FF 
  01C0  FF FF FF FF FF FF FF FF FF FF FF FF FF FF FF FF 
  01D0  FF FF FF FF FF FF FF FF FF FF FF FF FF FF FF FF 
  01E0  FF FF FF FF FF FF FF FF FF FF FF FF FF FF FF FF 
  01F0  FF FF FF FF FF FF FF FF FF FF FF FF FF FF FF FF 
  0200  FF FF FF FF FF FF FF FF FF FF FF FF FF FF FF FF 
  0210  FF FF FF FF FF FF FF FF FF FF FF FF FF FF FF FF 
  0220  FF FF FF FF FF FF FF FF FF FF FF FF FF FF FF FF 
  0230  FF FF FF FF FF FF FF FF FF FF FF FF FF FF FF FF 
  0240  FF FF FF FF FF FF FF FF FF FF FF FF FF FF FF FF 
  0250  FF FF FF FF FF FF FF FF FF FF FF FF FF FF FF FF 
  0260  FF FF FF FF FF FF FF FF FF FF FF FF FF FF FF FF 
  0270  FF FF FF FF FF FF FF FF FF FF FF FF FF FF FF FF 
  0280  FF FF FF FF FF FF FF FF FF FF FF FF FF FF FF FF 
  0290  FF FF FF FF FF FF FF FF FF FF FF FF FF FF FF FF 
  02A0  FF FF FF FF FF FF FF FF FF FF FF FF FF FF FF FF 
  02B0  FF FF FF FF FF FF FF FF FF FF FF FF FF FF FF FF 
  02C0  FF FF FF FF FF FF FF FF FF FF FF FF FF FF FF FF 
  02D0  FF FF FF FF FF FF FF FF FF FF FF FF FF FF FF FF 
  02E0  FF FF FF FF FF FF FF FF FF FF FF FF FF FF FF FF 
  02F0  FF FF FF FF FF FF FF FF FF FF FF FF FF FF FF FF 
  0300  FF FF FF FF FF FF FF FF FF FF FF FF FF FF FF FF 
  0310  FF FF FF FF FF FF FF FF FF FF FF FF FF FF FF FF 
  0320  FF FF FF FF FF FF FF FF FF FF FF FF FF FF FF FF 
  0330  FF FF FF FF FF FF FF FF FF FF FF FF FF FF FF FF 
  0340  FF FF FF FF FF FF FF FF FF FF FF FF FF FF FF FF 
  0350  FF FF FF FF FF FF FF FF FF FF FF FF FF FF FF FF 
  0360  FF FF FF FF FF FF FF FF FF FF FF FF FF FF FF FF 
  0370  FF FF FF FF FF FF FF FF FF FF FF FF FF FF FF FF 
  0380  FF FF FF FF FF FF FF FF FF FF FF FF FF FF FF FF 
  0390  FF FF FF FF FF FF FF FF FF FF FF FF FF FF FF FF 
  03A0  FF FF FF FF FF FF FF FF FF FF FF FF FF FF FF FF 
  03B0  FF FF FF FF FF FF FF FF FF FF FF FF FF FF FF FF 
  03C0  FF FF FF FF FF FF FF FF FF FF FF FF FF FF FF FF 
  03D0  FF FF FF FF FF FF FF FF FF FF FF FF FF FF FF FF 
  03E0  FF FF FF FF FF FF FF FF FF FF FF FF FF FF FF FF 
  03F0  FF FF FF FF FF FF FF FF FF FF FF FF FF FF FF FF 
