------[ Logical CPU #0 ]------

allcpu: Package 0 / Core 0 / Thread 0: Valid

CPUID 00000000: 00000016-756E6547-6C65746E-49656E69 [GenuineIntel]
CPUID 00000001: 000806E9-00100800-7FFAFBBF-BFEBFBFF
CPUID 00000002: 76036301-00F0B5FF-00000000-00C30000
CPUID 00000003: 00000000-00000000-00000000-00000000
CPUID 00000004: 1C004121-01C0003F-0000003F-00000000 [SL 00] [L1D: 32 KB]
CPUID 00000004: 1C004122-01C0003F-0000003F-00000000 [SL 01] [L1I: 32 KB]
CPUID 00000004: 1C004143-00C0003F-000003FF-00000000 [SL 02] [L2U: 256 KB]
CPUID 00000004: 1C03C163-03C0003F-00000FFF-00000006 [SL 03] [L3U: 4 MB]
CPUID 00000005: 00000040-00000040-00000003-11142120
CPUID 00000006: 000027F7-00000002-00000009-00000000
CPUID 00000007: 00000000-029C67AF-00000000-9C002400
CPUID 00000008: 00000000-00000000-00000000-00000000
CPUID 00000009: 00000000-00000000-00000000-00000000
CPUID 0000000A: 07300404-00000000-00000000-00000603
CPUID 0000000B: 00000001-00000002-00000100-00000000 [SL 00]
CPUID 0000000B: 00000004-00000004-00000201-00000000 [SL 01]
CPUID 0000000C: 00000000-00000000-00000000-00000000
CPUID 0000000D: 0000001F-00000440-00000440-00000000 [SL 00] [x87]
CPUID 0000000D: 0000000F-00000440-00000100-00000000 [SL 01] [SSE]
CPUID 0000000D: 00000100-00000240-00000000-00000000 [SL 02] [AVX]
CPUID 0000000D: 00000040-000003C0-00000000-00000000 [SL 03] [MPX BNDREGS]
CPUID 0000000D: 00000040-00000400-00000000-00000000 [SL 04] [MPX BNDCSR]
CPUID 0000000D: 00000080-00000000-00000001-00000000 [SL 08] [PT]
CPUID 0000000E: 00000000-00000000-00000000-00000000
CPUID 0000000F: 00000000-00000000-00000000-00000000 [SL 00]
CPUID 0000000F: 00000000-00000000-00000000-00000000 [SL 01]
CPUID 00000010: 00000000-00000000-00000000-00000000 [SL 00]
CPUID 00000010: 00000000-00000000-00000000-00000000 [SL 01]
CPUID 00000011: 00000000-00000000-00000000-00000000
CPUID 00000012: 00000000-00000000-00000000-00000000 [SL 00]
CPUID 00000012: 00000000-00000000-00000000-00000000 [SL 01]
CPUID 00000013: 00000000-00000000-00000000-00000000
CPUID 00000014: 00000001-0000000F-00000007-00000000 [SL 00]
CPUID 00000014: 02490002-003F3FFF-00000000-00000000 [SL 01]
CPUID 00000015: 00000002-00000086-00000000-00000000 [67.00x / 0]
CPUID 00000016: 00000640-00000D48-00000064-00000000 [1600 / 3400 / 100]
CPUID 80000000: 80000008-00000000-00000000-00000000
CPUID 80000001: 00000000-00000000-00000121-2C100000
CPUID 80000002: 65746E49-2952286C-726F4320-4D542865 [Intel(R) Core(TM]
CPUID 80000003: 336D2029-3031382D-43205930-40205550 [) m3-8100Y CPU @]
CPUID 80000004: 312E3120-7A484730-00000000-00000000 [ 1.10GHz]
CPUID 80000005: 00000000-00000000-00000000-00000000 [L1D: 0 KB / L1I: 0 KB]
CPUID 80000006: 00000000-00000000-01006040-00000000 [L2: 256 KB] / L3: 0 KB]
CPUID 80000007: 00000000-00000000-00000000-00000100
CPUID 80000008: 00003027-00000000-00000000-00000000

L1    Data Cache:    32 KB,  8-way Associative, 64-byte Line
L1  Instr. Cache:    32 KB,  8-way Associative, 64-byte Line
L2 Unified Cache:   256 KB,  4-way Associative, 64-byte Line
L3 Unified Cache:     4 MB, 16-way Associative, 64-byte Line

------[ Logical CPU #1 ]------

allcpu: Package 0 / Core 0 / Thread 1: Valid, Virtual

CPUID 00000000: 00000016-756E6547-6C65746E-49656E69 [GenuineIntel]
CPUID 00000001: 000806E9-01100800-7FFAFBBF-BFEBFBFF
CPUID 00000002: 76036301-00F0B5FF-00000000-00C30000
CPUID 00000003: 00000000-00000000-00000000-00000000
CPUID 00000004: 1C004121-01C0003F-0000003F-00000000 [SL 00] [L1D: 32 KB]
CPUID 00000004: 1C004122-01C0003F-0000003F-00000000 [SL 01] [L1I: 32 KB]
CPUID 00000004: 1C004143-00C0003F-000003FF-00000000 [SL 02] [L2U: 256 KB]
CPUID 00000004: 1C03C163-03C0003F-00000FFF-00000006 [SL 03] [L3U: 4 MB]
CPUID 00000005: 00000040-00000040-00000003-11142120
CPUID 00000006: 000027F7-00000002-00000009-00000000
CPUID 00000007: 00000000-029C67AF-00000000-9C002400
CPUID 00000008: 00000000-00000000-00000000-00000000
CPUID 00000009: 00000000-00000000-00000000-00000000
CPUID 0000000A: 07300404-00000000-00000000-00000603
CPUID 0000000B: 00000001-00000002-00000100-00000001 [SL 00]
CPUID 0000000B: 00000004-00000004-00000201-00000001 [SL 01]
CPUID 0000000C: 00000000-00000000-00000000-00000000
CPUID 0000000D: 0000001F-00000440-00000440-00000000 [SL 00] [x87]
CPUID 0000000D: 0000000F-00000440-00000100-00000000 [SL 01] [SSE]
CPUID 0000000D: 00000100-00000240-00000000-00000000 [SL 02] [AVX]
CPUID 0000000D: 00000040-000003C0-00000000-00000000 [SL 03] [MPX BNDREGS]
CPUID 0000000D: 00000040-00000400-00000000-00000000 [SL 04] [MPX BNDCSR]
CPUID 0000000D: 00000080-00000000-00000001-00000000 [SL 08] [PT]
CPUID 0000000E: 00000000-00000000-00000000-00000000
CPUID 0000000F: 00000000-00000000-00000000-00000000 [SL 00]
CPUID 0000000F: 00000000-00000000-00000000-00000000 [SL 01]
CPUID 00000010: 00000000-00000000-00000000-00000000 [SL 00]
CPUID 00000010: 00000000-00000000-00000000-00000000 [SL 01]
CPUID 00000011: 00000000-00000000-00000000-00000000
CPUID 00000012: 00000000-00000000-00000000-00000000 [SL 00]
CPUID 00000012: 00000000-00000000-00000000-00000000 [SL 01]
CPUID 00000013: 00000000-00000000-00000000-00000000
CPUID 00000014: 00000001-0000000F-00000007-00000000 [SL 00]
CPUID 00000014: 02490002-003F3FFF-00000000-00000000 [SL 01]
CPUID 00000015: 00000002-00000086-00000000-00000000 [67.00x / 0]
CPUID 00000016: 00000640-00000D48-00000064-00000000 [1600 / 3400 / 100]
CPUID 80000000: 80000008-00000000-00000000-00000000
CPUID 80000001: 00000000-00000000-00000121-2C100000
CPUID 80000002: 65746E49-2952286C-726F4320-4D542865 [Intel(R) Core(TM]
CPUID 80000003: 336D2029-3031382D-43205930-40205550 [) m3-8100Y CPU @]
CPUID 80000004: 312E3120-7A484730-00000000-00000000 [ 1.10GHz]
CPUID 80000005: 00000000-00000000-00000000-00000000 [L1D: 0 KB / L1I: 0 KB]
CPUID 80000006: 00000000-00000000-01006040-00000000 [L2: 256 KB] / L3: 0 KB]
CPUID 80000007: 00000000-00000000-00000000-00000100
CPUID 80000008: 00003027-00000000-00000000-00000000

L1    Data Cache:    32 KB,  8-way Associative, 64-byte Line
L1  Instr. Cache:    32 KB,  8-way Associative, 64-byte Line
L2 Unified Cache:   256 KB,  4-way Associative, 64-byte Line
L3 Unified Cache:     4 MB, 16-way Associative, 64-byte Line

------[ Logical CPU #2 ]------

allcpu: Package 0 / Core 1 / Thread 0: Valid

CPUID 00000000: 00000016-756E6547-6C65746E-49656E69 [GenuineIntel]
CPUID 00000001: 000806E9-02100800-7FFAFBBF-BFEBFBFF
CPUID 00000002: 76036301-00F0B5FF-00000000-00C30000
CPUID 00000003: 00000000-00000000-00000000-00000000
CPUID 00000004: 1C004121-01C0003F-0000003F-00000000 [SL 00] [L1D: 32 KB]
CPUID 00000004: 1C004122-01C0003F-0000003F-00000000 [SL 01] [L1I: 32 KB]
CPUID 00000004: 1C004143-00C0003F-000003FF-00000000 [SL 02] [L2U: 256 KB]
CPUID 00000004: 1C03C163-03C0003F-00000FFF-00000006 [SL 03] [L3U: 4 MB]
CPUID 00000005: 00000040-00000040-00000003-11142120
CPUID 00000006: 000027F7-00000002-00000009-00000000
CPUID 00000007: 00000000-029C67AF-00000000-9C002400
CPUID 00000008: 00000000-00000000-00000000-00000000
CPUID 00000009: 00000000-00000000-00000000-00000000
CPUID 0000000A: 07300404-00000000-00000000-00000603
CPUID 0000000B: 00000001-00000002-00000100-00000002 [SL 00]
CPUID 0000000B: 00000004-00000004-00000201-00000002 [SL 01]
CPUID 0000000C: 00000000-00000000-00000000-00000000
CPUID 0000000D: 0000001F-00000440-00000440-00000000 [SL 00] [x87]
CPUID 0000000D: 0000000F-00000440-00000100-00000000 [SL 01] [SSE]
CPUID 0000000D: 00000100-00000240-00000000-00000000 [SL 02] [AVX]
CPUID 0000000D: 00000040-000003C0-00000000-00000000 [SL 03] [MPX BNDREGS]
CPUID 0000000D: 00000040-00000400-00000000-00000000 [SL 04] [MPX BNDCSR]
CPUID 0000000D: 00000080-00000000-00000001-00000000 [SL 08] [PT]
CPUID 0000000E: 00000000-00000000-00000000-00000000
CPUID 0000000F: 00000000-00000000-00000000-00000000 [SL 00]
CPUID 0000000F: 00000000-00000000-00000000-00000000 [SL 01]
CPUID 00000010: 00000000-00000000-00000000-00000000 [SL 00]
CPUID 00000010: 00000000-00000000-00000000-00000000 [SL 01]
CPUID 00000011: 00000000-00000000-00000000-00000000
CPUID 00000012: 00000000-00000000-00000000-00000000 [SL 00]
CPUID 00000012: 00000000-00000000-00000000-00000000 [SL 01]
CPUID 00000013: 00000000-00000000-00000000-00000000
CPUID 00000014: 00000001-0000000F-00000007-00000000 [SL 00]
CPUID 00000014: 02490002-003F3FFF-00000000-00000000 [SL 01]
CPUID 00000015: 00000002-00000086-00000000-00000000 [67.00x / 0]
CPUID 00000016: 00000640-00000D48-00000064-00000000 [1600 / 3400 / 100]
CPUID 80000000: 80000008-00000000-00000000-00000000
CPUID 80000001: 00000000-00000000-00000121-2C100000
CPUID 80000002: 65746E49-2952286C-726F4320-4D542865 [Intel(R) Core(TM]
CPUID 80000003: 336D2029-3031382D-43205930-40205550 [) m3-8100Y CPU @]
CPUID 80000004: 312E3120-7A484730-00000000-00000000 [ 1.10GHz]
CPUID 80000005: 00000000-00000000-00000000-00000000 [L1D: 0 KB / L1I: 0 KB]
CPUID 80000006: 00000000-00000000-01006040-00000000 [L2: 256 KB] / L3: 0 KB]
CPUID 80000007: 00000000-00000000-00000000-00000100
CPUID 80000008: 00003027-00000000-00000000-00000000

L1    Data Cache:    32 KB,  8-way Associative, 64-byte Line
L1  Instr. Cache:    32 KB,  8-way Associative, 64-byte Line
L2 Unified Cache:   256 KB,  4-way Associative, 64-byte Line
L3 Unified Cache:     4 MB, 16-way Associative, 64-byte Line

------[ Logical CPU #3 ]------

allcpu: Package 0 / Core 1 / Thread 1: Valid, Virtual

CPUID 00000000: 00000016-756E6547-6C65746E-49656E69 [GenuineIntel]
CPUID 00000001: 000806E9-03100800-7FFAFBBF-BFEBFBFF
CPUID 00000002: 76036301-00F0B5FF-00000000-00C30000
CPUID 00000003: 00000000-00000000-00000000-00000000
CPUID 00000004: 1C004121-01C0003F-0000003F-00000000 [SL 00] [L1D: 32 KB]
CPUID 00000004: 1C004122-01C0003F-0000003F-00000000 [SL 01] [L1I: 32 KB]
CPUID 00000004: 1C004143-00C0003F-000003FF-00000000 [SL 02] [L2U: 256 KB]
CPUID 00000004: 1C03C163-03C0003F-00000FFF-00000006 [SL 03] [L3U: 4 MB]
CPUID 00000005: 00000040-00000040-00000003-11142120
CPUID 00000006: 000027F7-00000002-00000009-00000000
CPUID 00000007: 00000000-029C67AF-00000000-9C002400
CPUID 00000008: 00000000-00000000-00000000-00000000
CPUID 00000009: 00000000-00000000-00000000-00000000
CPUID 0000000A: 07300404-00000000-00000000-00000603
CPUID 0000000B: 00000001-00000002-00000100-00000003 [SL 00]
CPUID 0000000B: 00000004-00000004-00000201-00000003 [SL 01]
CPUID 0000000C: 00000000-00000000-00000000-00000000
CPUID 0000000D: 0000001F-00000440-00000440-00000000 [SL 00] [x87]
CPUID 0000000D: 0000000F-00000440-00000100-00000000 [SL 01] [SSE]
CPUID 0000000D: 00000100-00000240-00000000-00000000 [SL 02] [AVX]
CPUID 0000000D: 00000040-000003C0-00000000-00000000 [SL 03] [MPX BNDREGS]
CPUID 0000000D: 00000040-00000400-00000000-00000000 [SL 04] [MPX BNDCSR]
CPUID 0000000D: 00000080-00000000-00000001-00000000 [SL 08] [PT]
CPUID 0000000E: 00000000-00000000-00000000-00000000
CPUID 0000000F: 00000000-00000000-00000000-00000000 [SL 00]
CPUID 0000000F: 00000000-00000000-00000000-00000000 [SL 01]
CPUID 00000010: 00000000-00000000-00000000-00000000 [SL 00]
CPUID 00000010: 00000000-00000000-00000000-00000000 [SL 01]
CPUID 00000011: 00000000-00000000-00000000-00000000
CPUID 00000012: 00000000-00000000-00000000-00000000 [SL 00]
CPUID 00000012: 00000000-00000000-00000000-00000000 [SL 01]
CPUID 00000013: 00000000-00000000-00000000-00000000
CPUID 00000014: 00000001-0000000F-00000007-00000000 [SL 00]
CPUID 00000014: 02490002-003F3FFF-00000000-00000000 [SL 01]
CPUID 00000015: 00000002-00000086-00000000-00000000 [67.00x / 0]
CPUID 00000016: 00000640-00000D48-00000064-00000000 [1600 / 3400 / 100]
CPUID 80000000: 80000008-00000000-00000000-00000000
CPUID 80000001: 00000000-00000000-00000121-2C100000
CPUID 80000002: 65746E49-2952286C-726F4320-4D542865 [Intel(R) Core(TM]
CPUID 80000003: 336D2029-3031382D-43205930-40205550 [) m3-8100Y CPU @]
CPUID 80000004: 312E3120-7A484730-00000000-00000000 [ 1.10GHz]
CPUID 80000005: 00000000-00000000-00000000-00000000 [L1D: 0 KB / L1I: 0 KB]
CPUID 80000006: 00000000-00000000-01006040-00000000 [L2: 256 KB] / L3: 0 KB]
CPUID 80000007: 00000000-00000000-00000000-00000100
CPUID 80000008: 00003027-00000000-00000000-00000000

L1    Data Cache:    32 KB,  8-way Associative, 64-byte Line
L1  Instr. Cache:    32 KB,  8-way Associative, 64-byte Line
L2 Unified Cache:   256 KB,  4-way Associative, 64-byte Line
L3 Unified Cache:     4 MB, 16-way Associative, 64-byte Line

------[ All CPUs ]------

CPU   0: APICID    0 / Package 0 / Core   0 / Thread 0: Valid
CPU   1: APICID    1 / Package 0 / Core   0 / Thread 1: Valid, Virtual
CPU   2: APICID    2 / Package 0 / Core   1 / Thread 0: Valid
CPU   3: APICID    3 / Package 0 / Core   1 / Thread 1: Valid, Virtual

------[ MSR Registers ]------

MSR 00000017: 0010-0000-0000-0000 [PlatID = 4]
MSR 0000001B: 0000-0000-FEE0-0D00
MSR 00000035: 0000-0000-0002-0004
MSR 00000048: 0000-0000-0000-0000
MSR 00000049: < FAILED >
MSR 0000008B: 0000-00B4-0000-0000
MSR 000000CE: 0004-043D-F101-1000 [eD = 0]
MSR 000000E7: 0000-0096-6028-D848 [S200]
MSR 000000E7: 0000-0096-6144-7EA7 [S200]
MSR 000000E7: 0000-0096-62F4-9DC6
MSR 000000E8: 0000-0096-C11E-F5AA [S200]
MSR 000000E8: 0000-0096-C1B3-C8E5 [S200]
MSR 000000E8: 0000-0096-C233-1D96
MSR 0000010B: < FAILED >
MSR 00000194: 0000-0000-0001-0000
MSR 00000198: 0000-164F-0000-0600 [S200]
MSR 00000198: 0000-168B-0000-0600 [S200]
MSR 00000198: 0000-1687-0000-0500
MSR 00000199: 0000-0000-0000-0B00
MSR 0000019A: 0000-0000-0000-0000
MSR 0000019B: 0000-0000-0000-0010
MSR 0000019C: 0000-0000-8833-0800 [S200]
MSR 0000019C: 0000-0000-8833-0800 [S200]
MSR 0000019C: 0000-0000-8833-0800
MSR 0000019D: 0000-0000-0000-0000
MSR 000001A0: 0000-0000-0085-0089
MSR 000001A2: 0000-0000-0064-0000
MSR 000001A4: 0000-0000-0000-0000
MSR 000001AA: 0000-0000-0040-1CC0
MSR 000001AC: < FAILED >
MSR 000001AD: 0000-0000-1B1B-1B22
MSR 000001B0: 0000-0000-0000-0009
MSR 000001B1: 0000-0000-8832-0800
MSR 000001B2: 0000-0000-0000-0000
MSR 000001FC: 0000-0000-002C-005F
MSR 00000300: < FAILED >
MSR 0000030A: 0000-0000-0000-0000 [S200]
MSR 0000030A: 0000-0000-0000-0000 [S200]
MSR 0000030A: 0000-0000-0000-0000
MSR 0000030B: 0000-0000-0000-0000 [S200]
MSR 0000030B: 0000-0000-0000-0000 [S200]
MSR 0000030B: 0000-0000-0000-0000
MSR 00000480: 00DA-0400-0000-0004
MSR 00000481: 0000-007F-0000-0016
MSR 00000482: FFF9-FFFE-0401-E172
MSR 00000483: 01FF-FFFF-0003-6DFF
MSR 00000484: 0003-FFFF-0000-11FF
MSR 00000485: 0000-0000-7004-C1E7
MSR 00000486: 0000-0000-8000-0021
MSR 00000487: 0000-0000-FFFF-FFFF
MSR 00000488: 0000-0000-0000-2000
MSR 00000489: 0000-0000-0037-27FF
MSR 0000048A: 0000-0000-0000-002E
MSR 0000048B: 005F-BCFF-0000-0000
MSR 0000048C: 0000-0F01-0673-4141
MSR 0000048D: 0000-007F-0000-0016
MSR 0000048E: FFF9-FFFE-0400-6172
MSR 0000048F: 01FF-FFFF-0003-6DFB
MSR 00000490: 0003-FFFF-0000-11FB
MSR 00000601: 0000-0000-0000-0000
MSR 00000602: < FAILED >
MSR 00000603: 0036-0000-0036-3636
MSR 00000604: < FAILED >
MSR 00000606: 0000-0000-000A-0E03
MSR 0000060A: 0000-0000-0000-884E
MSR 0000060B: 0000-0000-0000-8876
MSR 0000060C: 0000-0000-0000-8894
MSR 0000060D: 0000-00AC-20FA-1150
MSR 00000610: 0042-8078-00DD-8040
MSR 00000611: 0000-0000-02FC-D397 [S200]
MSR 00000611: 0000-0000-02FC-DF59 [S200]
MSR 00000611: 0000-0000-02FC-EB60
MSR 00000613: 0000-0000-0000-0000
MSR 00000614: 0000-0000-0000-0028
MSR 00000618: 0054-00DE-0000-0000
MSR 00000619: 0000-0000-0087-3E0D [S200]
MSR 00000619: 0000-0000-0087-41DC [S200]
MSR 00000619: 0000-0000-0087-45D4
MSR 0000061B: 0000-0000-0000-0000
MSR 0000061C: < FAILED >
MSR 0000061E: < FAILED >
MSR 00000620: 0000-0000-0000-0420
MSR 00000621: 0000-0000-0000-0005
MSR 00000638: 0000-0000-0000-0000
MSR 00000639: 0000-0000-01F0-6179 [S200]
MSR 00000639: 0000-0000-01F0-62E7 [S200]
MSR 00000639: 0000-0000-01F0-648E
MSR 0000063A: 0000-0000-0000-0009
MSR 0000063B: < FAILED >
MSR 00000640: 0000-0000-0000-0000
MSR 00000641: 0000-0000-000A-821D [S200]
MSR 00000641: 0000-0000-000A-821D [S200]
MSR 00000641: 0000-0000-000A-821D
MSR 00000642: 0000-0000-0000-000D
MSR 00000648: 0000-0000-0000-000B
MSR 00000649: 0000-0000-0006-001C
MSR 0000064A: 0000-0000-0010-0038
MSR 0000064B: 0000-0000-0000-0000
MSR 0000064C: 0000-0000-0000-000A
MSR 00000690: 0000-0000-0000-0000
MSR 000006B0: 0000-0000-0000-0000
MSR 000006B1: 0000-0000-0100-0000
MSR 00000770: 0000-0000-0000-0001
MSR 00000771: 0000-0000-0107-0B22
MSR 00000772: < FAILED >
MSR 00000773: 0000-0000-0000-0001
MSR 00000774: 0000-019E-7F00-2201
MSR 00000777: 0000-0000-0000-0000
MSR 00000832: 0000-0000-0003-00D1
MSR 00000838: 0000-0000-0000-0000
MSR 00000839: 0000-0000-0000-0000
MSR 0000083E: 0000-0000-0000-000A
