------[ Versions ]------

Program Version : EVEREST v5.30.2024 Beta
BenchDLL Version: 2.4.273.0

------[ CPU Info ]------

CPU Type           : 2x QuadCore Intel Xeon X5667, 3066 MHz (23 x 133)
CPU Alias          : Westmere-EP
CPU Stepping       : B0
Instruction Set    : x86, x86-64, MMX, SSE, SSE2, SSE3, SSSE3, SSE4.1, SSE4.2, AES
CPUID Manufacturer : GenuineIntel
CPUID CPU Name     : Intel(R) Xeon(R) CPU X5667 @ 3.07GHz
CPUID Revision     : 000206C1h
IA Brand ID        : 00h  (Unknown)
Platform ID        : FFh  (Unknown)

------[ Logical CPU #0 ]------

allcpu: Package 0 / Core 0 / Thread 0: Valid

CPUID 00000000: 0000000B-756E6547-6C65746E-49656E69
CPUID 00000001: 000206C1-20200800-029EE3FF-BFEBFBFF
CPUID 00000002: 55035A01-00F0B2FF-00000000-00CA0000
CPUID 00000003: 00000000-00000000-00000000-00000000
CPUID 00000004: 3C004121-01C0003F-0000003F-00000000
CPUID 00000004: 3C004122-00C0003F-0000007F-00000000
CPUID 00000004: 3C004143-01C0003F-000001FF-00000000
CPUID 00000004: 3C07C163-03C0003F-00002FFF-00000002
CPUID 00000005: 00000040-00000040-00000003-00001120
CPUID 00000006: 00000007-00000002-00000001-00000000
CPUID 00000007: 00000000-00000000-00000000-00000000
CPUID 00000008: 00000000-00000000-00000000-00000000
CPUID 00000009: 00000000-00000000-00000000-00000000
CPUID 0000000A: 07300403-00000004-00000000-00000603
CPUID 0000000B: 00000001-00000002-00000100-00000020
CPUID 0000000B: 00000005-00000008-00000201-00000020
CPUID 80000000: 80000008-00000000-00000000-00000000
CPUID 80000001: 00000000-00000000-00000001-2C100000
CPUID 80000002: 65746E49-2952286C-6F655820-2952286E
CPUID 80000003: 55504320-20202020-20202020-58202020
CPUID 80000004: 37363635-20402020-37302E33-007A4847
CPUID 80000005: 00000000-00000000-00000000-00000000
CPUID 80000006: 00000000-00000000-01006040-00000000
CPUID 80000007: 00000000-00000000-00000000-00000100
CPUID 80000008: 00003028-00000000-00000000-00000000

L1    Data Cache:     32 KB,  8-way Associative, 64-byte Line
L1  Instr. Cache:     32 KB,  4-way Associative, 64-byte Line
L2 Unified Cache:    256 KB,  8-way Associative, 64-byte Line
L3 Unified Cache:  12288 KB, 16-way Associative, 64-byte Line

------[ Logical CPU #1 ]------

allcpu: Package 0 / Core 0 / Thread 1: Valid, Virtual

CPUID 00000000: 0000000B-756E6547-6C65746E-49656E69
CPUID 00000001: 000206C1-21200800-029EE3FF-BFEBFBFF
CPUID 00000002: 55035A01-00F0B2FF-00000000-00CA0000
CPUID 00000003: 00000000-00000000-00000000-00000000
CPUID 00000004: 3C004121-01C0003F-0000003F-00000000
CPUID 00000004: 3C004122-00C0003F-0000007F-00000000
CPUID 00000004: 3C004143-01C0003F-000001FF-00000000
CPUID 00000004: 3C07C163-03C0003F-00002FFF-00000002
CPUID 00000005: 00000040-00000040-00000003-00001120
CPUID 00000006: 00000007-00000002-00000001-00000000
CPUID 00000007: 00000000-00000000-00000000-00000000
CPUID 00000008: 00000000-00000000-00000000-00000000
CPUID 00000009: 00000000-00000000-00000000-00000000
CPUID 0000000A: 07300403-00000004-00000000-00000603
CPUID 0000000B: 00000001-00000002-00000100-00000021
CPUID 0000000B: 00000005-00000008-00000201-00000021
CPUID 80000000: 80000008-00000000-00000000-00000000
CPUID 80000001: 00000000-00000000-00000001-2C100000
CPUID 80000002: 65746E49-2952286C-6F655820-2952286E
CPUID 80000003: 55504320-20202020-20202020-58202020
CPUID 80000004: 37363635-20402020-37302E33-007A4847
CPUID 80000005: 00000000-00000000-00000000-00000000
CPUID 80000006: 00000000-00000000-01006040-00000000
CPUID 80000007: 00000000-00000000-00000000-00000100
CPUID 80000008: 00003028-00000000-00000000-00000000

L1    Data Cache:     32 KB,  8-way Associative, 64-byte Line
L1  Instr. Cache:     32 KB,  4-way Associative, 64-byte Line
L2 Unified Cache:    256 KB,  8-way Associative, 64-byte Line
L3 Unified Cache:  12288 KB, 16-way Associative, 64-byte Line

------[ Logical CPU #2 ]------

allcpu: Package 0 / Core 1 / Thread 0: Valid

CPUID 00000000: 0000000B-756E6547-6C65746E-49656E69
CPUID 00000001: 000206C1-22200800-029EE3FF-BFEBFBFF
CPUID 00000002: 55035A01-00F0B2FF-00000000-00CA0000
CPUID 00000003: 00000000-00000000-00000000-00000000
CPUID 00000004: 3C004121-01C0003F-0000003F-00000000
CPUID 00000004: 3C004122-00C0003F-0000007F-00000000
CPUID 00000004: 3C004143-01C0003F-000001FF-00000000
CPUID 00000004: 3C07C163-03C0003F-00002FFF-00000002
CPUID 00000005: 00000040-00000040-00000003-00001120
CPUID 00000006: 00000007-00000002-00000001-00000000
CPUID 00000007: 00000000-00000000-00000000-00000000
CPUID 00000008: 00000000-00000000-00000000-00000000
CPUID 00000009: 00000000-00000000-00000000-00000000
CPUID 0000000A: 07300403-00000004-00000000-00000603
CPUID 0000000B: 00000001-00000002-00000100-00000022
CPUID 0000000B: 00000005-00000008-00000201-00000022
CPUID 80000000: 80000008-00000000-00000000-00000000
CPUID 80000001: 00000000-00000000-00000001-2C100000
CPUID 80000002: 65746E49-2952286C-6F655820-2952286E
CPUID 80000003: 55504320-20202020-20202020-58202020
CPUID 80000004: 37363635-20402020-37302E33-007A4847
CPUID 80000005: 00000000-00000000-00000000-00000000
CPUID 80000006: 00000000-00000000-01006040-00000000
CPUID 80000007: 00000000-00000000-00000000-00000100
CPUID 80000008: 00003028-00000000-00000000-00000000

L1    Data Cache:     32 KB,  8-way Associative, 64-byte Line
L1  Instr. Cache:     32 KB,  4-way Associative, 64-byte Line
L2 Unified Cache:    256 KB,  8-way Associative, 64-byte Line
L3 Unified Cache:  12288 KB, 16-way Associative, 64-byte Line

------[ Logical CPU #3 ]------

allcpu: Package 0 / Core 1 / Thread 1: Valid, Virtual

CPUID 00000000: 0000000B-756E6547-6C65746E-49656E69
CPUID 00000001: 000206C1-23200800-029EE3FF-BFEBFBFF
CPUID 00000002: 55035A01-00F0B2FF-00000000-00CA0000
CPUID 00000003: 00000000-00000000-00000000-00000000
CPUID 00000004: 3C004121-01C0003F-0000003F-00000000
CPUID 00000004: 3C004122-00C0003F-0000007F-00000000
CPUID 00000004: 3C004143-01C0003F-000001FF-00000000
CPUID 00000004: 3C07C163-03C0003F-00002FFF-00000002
CPUID 00000005: 00000040-00000040-00000003-00001120
CPUID 00000006: 00000007-00000002-00000001-00000000
CPUID 00000007: 00000000-00000000-00000000-00000000
CPUID 00000008: 00000000-00000000-00000000-00000000
CPUID 00000009: 00000000-00000000-00000000-00000000
CPUID 0000000A: 07300403-00000004-00000000-00000603
CPUID 0000000B: 00000001-00000002-00000100-00000023
CPUID 0000000B: 00000005-00000008-00000201-00000023
CPUID 80000000: 80000008-00000000-00000000-00000000
CPUID 80000001: 00000000-00000000-00000001-2C100000
CPUID 80000002: 65746E49-2952286C-6F655820-2952286E
CPUID 80000003: 55504320-20202020-20202020-58202020
CPUID 80000004: 37363635-20402020-37302E33-007A4847
CPUID 80000005: 00000000-00000000-00000000-00000000
CPUID 80000006: 00000000-00000000-01006040-00000000
CPUID 80000007: 00000000-00000000-00000000-00000100
CPUID 80000008: 00003028-00000000-00000000-00000000

L1    Data Cache:     32 KB,  8-way Associative, 64-byte Line
L1  Instr. Cache:     32 KB,  4-way Associative, 64-byte Line
L2 Unified Cache:    256 KB,  8-way Associative, 64-byte Line
L3 Unified Cache:  12288 KB, 16-way Associative, 64-byte Line

------[ Logical CPU #4 ]------

allcpu: Package 0 / Core 2 / Thread 0: Valid

CPUID 00000000: 0000000B-756E6547-6C65746E-49656E69
CPUID 00000001: 000206C1-32200800-029EE3FF-BFEBFBFF
CPUID 00000002: 55035A01-00F0B2FF-00000000-00CA0000
CPUID 00000003: 00000000-00000000-00000000-00000000
CPUID 00000004: 3C004121-01C0003F-0000003F-00000000
CPUID 00000004: 3C004122-00C0003F-0000007F-00000000
CPUID 00000004: 3C004143-01C0003F-000001FF-00000000
CPUID 00000004: 3C07C163-03C0003F-00002FFF-00000002
CPUID 00000005: 00000040-00000040-00000003-00001120
CPUID 00000006: 00000007-00000002-00000001-00000000
CPUID 00000007: 00000000-00000000-00000000-00000000
CPUID 00000008: 00000000-00000000-00000000-00000000
CPUID 00000009: 00000000-00000000-00000000-00000000
CPUID 0000000A: 07300403-00000004-00000000-00000603
CPUID 0000000B: 00000001-00000002-00000100-00000032
CPUID 0000000B: 00000005-00000008-00000201-00000032
CPUID 80000000: 80000008-00000000-00000000-00000000
CPUID 80000001: 00000000-00000000-00000001-2C100000
CPUID 80000002: 65746E49-2952286C-6F655820-2952286E
CPUID 80000003: 55504320-20202020-20202020-58202020
CPUID 80000004: 37363635-20402020-37302E33-007A4847
CPUID 80000005: 00000000-00000000-00000000-00000000
CPUID 80000006: 00000000-00000000-01006040-00000000
CPUID 80000007: 00000000-00000000-00000000-00000100
CPUID 80000008: 00003028-00000000-00000000-00000000

L1    Data Cache:     32 KB,  8-way Associative, 64-byte Line
L1  Instr. Cache:     32 KB,  4-way Associative, 64-byte Line
L2 Unified Cache:    256 KB,  8-way Associative, 64-byte Line
L3 Unified Cache:  12288 KB, 16-way Associative, 64-byte Line

------[ Logical CPU #5 ]------

allcpu: Package 0 / Core 2 / Thread 1: Valid, Virtual

CPUID 00000000: 0000000B-756E6547-6C65746E-49656E69
CPUID 00000001: 000206C1-33200800-029EE3FF-BFEBFBFF
CPUID 00000002: 55035A01-00F0B2FF-00000000-00CA0000
CPUID 00000003: 00000000-00000000-00000000-00000000
CPUID 00000004: 3C004121-01C0003F-0000003F-00000000
CPUID 00000004: 3C004122-00C0003F-0000007F-00000000
CPUID 00000004: 3C004143-01C0003F-000001FF-00000000
CPUID 00000004: 3C07C163-03C0003F-00002FFF-00000002
CPUID 00000005: 00000040-00000040-00000003-00001120
CPUID 00000006: 00000007-00000002-00000001-00000000
CPUID 00000007: 00000000-00000000-00000000-00000000
CPUID 00000008: 00000000-00000000-00000000-00000000
CPUID 00000009: 00000000-00000000-00000000-00000000
CPUID 0000000A: 07300403-00000004-00000000-00000603
CPUID 0000000B: 00000001-00000002-00000100-00000033
CPUID 0000000B: 00000005-00000008-00000201-00000033
CPUID 80000000: 80000008-00000000-00000000-00000000
CPUID 80000001: 00000000-00000000-00000001-2C100000
CPUID 80000002: 65746E49-2952286C-6F655820-2952286E
CPUID 80000003: 55504320-20202020-20202020-58202020
CPUID 80000004: 37363635-20402020-37302E33-007A4847
CPUID 80000005: 00000000-00000000-00000000-00000000
CPUID 80000006: 00000000-00000000-01006040-00000000
CPUID 80000007: 00000000-00000000-00000000-00000100
CPUID 80000008: 00003028-00000000-00000000-00000000

L1    Data Cache:     32 KB,  8-way Associative, 64-byte Line
L1  Instr. Cache:     32 KB,  4-way Associative, 64-byte Line
L2 Unified Cache:    256 KB,  8-way Associative, 64-byte Line
L3 Unified Cache:  12288 KB, 16-way Associative, 64-byte Line

------[ Logical CPU #6 ]------

allcpu: Package 0 / Core 3 / Thread 0: Valid

CPUID 00000000: 0000000B-756E6547-6C65746E-49656E69
CPUID 00000001: 000206C1-34200800-029EE3FF-BFEBFBFF
CPUID 00000002: 55035A01-00F0B2FF-00000000-00CA0000
CPUID 00000003: 00000000-00000000-00000000-00000000
CPUID 00000004: 3C004121-01C0003F-0000003F-00000000
CPUID 00000004: 3C004122-00C0003F-0000007F-00000000
CPUID 00000004: 3C004143-01C0003F-000001FF-00000000
CPUID 00000004: 3C07C163-03C0003F-00002FFF-00000002
CPUID 00000005: 00000040-00000040-00000003-00001120
CPUID 00000006: 00000007-00000002-00000001-00000000
CPUID 00000007: 00000000-00000000-00000000-00000000
CPUID 00000008: 00000000-00000000-00000000-00000000
CPUID 00000009: 00000000-00000000-00000000-00000000
CPUID 0000000A: 07300403-00000004-00000000-00000603
CPUID 0000000B: 00000001-00000002-00000100-00000034
CPUID 0000000B: 00000005-00000008-00000201-00000034
CPUID 80000000: 80000008-00000000-00000000-00000000
CPUID 80000001: 00000000-00000000-00000001-2C100000
CPUID 80000002: 65746E49-2952286C-6F655820-2952286E
CPUID 80000003: 55504320-20202020-20202020-58202020
CPUID 80000004: 37363635-20402020-37302E33-007A4847
CPUID 80000005: 00000000-00000000-00000000-00000000
CPUID 80000006: 00000000-00000000-01006040-00000000
CPUID 80000007: 00000000-00000000-00000000-00000100
CPUID 80000008: 00003028-00000000-00000000-00000000

L1    Data Cache:     32 KB,  8-way Associative, 64-byte Line
L1  Instr. Cache:     32 KB,  4-way Associative, 64-byte Line
L2 Unified Cache:    256 KB,  8-way Associative, 64-byte Line
L3 Unified Cache:  12288 KB, 16-way Associative, 64-byte Line

------[ Logical CPU #7 ]------

allcpu: Package 0 / Core 3 / Thread 1: Valid, Virtual

CPUID 00000000: 0000000B-756E6547-6C65746E-49656E69
CPUID 00000001: 000206C1-35200800-029EE3FF-BFEBFBFF
CPUID 00000002: 55035A01-00F0B2FF-00000000-00CA0000
CPUID 00000003: 00000000-00000000-00000000-00000000
CPUID 00000004: 3C004121-01C0003F-0000003F-00000000
CPUID 00000004: 3C004122-00C0003F-0000007F-00000000
CPUID 00000004: 3C004143-01C0003F-000001FF-00000000
CPUID 00000004: 3C07C163-03C0003F-00002FFF-00000002
CPUID 00000005: 00000040-00000040-00000003-00001120
CPUID 00000006: 00000007-00000002-00000001-00000000
CPUID 00000007: 00000000-00000000-00000000-00000000
CPUID 00000008: 00000000-00000000-00000000-00000000
CPUID 00000009: 00000000-00000000-00000000-00000000
CPUID 0000000A: 07300403-00000004-00000000-00000603
CPUID 0000000B: 00000001-00000002-00000100-00000035
CPUID 0000000B: 00000005-00000008-00000201-00000035
CPUID 80000000: 80000008-00000000-00000000-00000000
CPUID 80000001: 00000000-00000000-00000001-2C100000
CPUID 80000002: 65746E49-2952286C-6F655820-2952286E
CPUID 80000003: 55504320-20202020-20202020-58202020
CPUID 80000004: 37363635-20402020-37302E33-007A4847
CPUID 80000005: 00000000-00000000-00000000-00000000
CPUID 80000006: 00000000-00000000-01006040-00000000
CPUID 80000007: 00000000-00000000-00000000-00000100
CPUID 80000008: 00003028-00000000-00000000-00000000

L1    Data Cache:     32 KB,  8-way Associative, 64-byte Line
L1  Instr. Cache:     32 KB,  4-way Associative, 64-byte Line
L2 Unified Cache:    256 KB,  8-way Associative, 64-byte Line
L3 Unified Cache:  12288 KB, 16-way Associative, 64-byte Line

------[ Logical CPU #8 ]------

allcpu: Package 1 / Core 0 / Thread 0: Valid

CPUID 00000000: 0000000B-756E6547-6C65746E-49656E69
CPUID 00000001: 000206C1-00200800-029EE3FF-BFEBFBFF
CPUID 00000002: 55035A01-00F0B2FF-00000000-00CA0000
CPUID 00000003: 00000000-00000000-00000000-00000000
CPUID 00000004: 3C004121-01C0003F-0000003F-00000000
CPUID 00000004: 3C004122-00C0003F-0000007F-00000000
CPUID 00000004: 3C004143-01C0003F-000001FF-00000000
CPUID 00000004: 3C07C163-03C0003F-00002FFF-00000002
CPUID 00000005: 00000040-00000040-00000003-00001120
CPUID 00000006: 00000007-00000002-00000001-00000000
CPUID 00000007: 00000000-00000000-00000000-00000000
CPUID 00000008: 00000000-00000000-00000000-00000000
CPUID 00000009: 00000000-00000000-00000000-00000000
CPUID 0000000A: 07300403-00000004-00000000-00000603
CPUID 0000000B: 00000001-00000002-00000100-00000000
CPUID 0000000B: 00000005-00000008-00000201-00000000
CPUID 80000000: 80000008-00000000-00000000-00000000
CPUID 80000001: 00000000-00000000-00000001-2C100000
CPUID 80000002: 65746E49-2952286C-6F655820-2952286E
CPUID 80000003: 55504320-20202020-20202020-58202020
CPUID 80000004: 37363635-20402020-37302E33-007A4847
CPUID 80000005: 00000000-00000000-00000000-00000000
CPUID 80000006: 00000000-00000000-01006040-00000000
CPUID 80000007: 00000000-00000000-00000000-00000100
CPUID 80000008: 00003028-00000000-00000000-00000000

L1    Data Cache:     32 KB,  8-way Associative, 64-byte Line
L1  Instr. Cache:     32 KB,  4-way Associative, 64-byte Line
L2 Unified Cache:    256 KB,  8-way Associative, 64-byte Line
L3 Unified Cache:  12288 KB, 16-way Associative, 64-byte Line

------[ Logical CPU #9 ]------

allcpu: Package 1 / Core 0 / Thread 1: Valid, Virtual

CPUID 00000000: 0000000B-756E6547-6C65746E-49656E69
CPUID 00000001: 000206C1-01200800-029EE3FF-BFEBFBFF
CPUID 00000002: 55035A01-00F0B2FF-00000000-00CA0000
CPUID 00000003: 00000000-00000000-00000000-00000000
CPUID 00000004: 3C004121-01C0003F-0000003F-00000000
CPUID 00000004: 3C004122-00C0003F-0000007F-00000000
CPUID 00000004: 3C004143-01C0003F-000001FF-00000000
CPUID 00000004: 3C07C163-03C0003F-00002FFF-00000002
CPUID 00000005: 00000040-00000040-00000003-00001120
CPUID 00000006: 00000007-00000002-00000001-00000000
CPUID 00000007: 00000000-00000000-00000000-00000000
CPUID 00000008: 00000000-00000000-00000000-00000000
CPUID 00000009: 00000000-00000000-00000000-00000000
CPUID 0000000A: 07300403-00000004-00000000-00000603
CPUID 0000000B: 00000001-00000002-00000100-00000001
CPUID 0000000B: 00000005-00000008-00000201-00000001
CPUID 80000000: 80000008-00000000-00000000-00000000
CPUID 80000001: 00000000-00000000-00000001-2C100000
CPUID 80000002: 65746E49-2952286C-6F655820-2952286E
CPUID 80000003: 55504320-20202020-20202020-58202020
CPUID 80000004: 37363635-20402020-37302E33-007A4847
CPUID 80000005: 00000000-00000000-00000000-00000000
CPUID 80000006: 00000000-00000000-01006040-00000000
CPUID 80000007: 00000000-00000000-00000000-00000100
CPUID 80000008: 00003028-00000000-00000000-00000000

L1    Data Cache:     32 KB,  8-way Associative, 64-byte Line
L1  Instr. Cache:     32 KB,  4-way Associative, 64-byte Line
L2 Unified Cache:    256 KB,  8-way Associative, 64-byte Line
L3 Unified Cache:  12288 KB, 16-way Associative, 64-byte Line

------[ Logical CPU #10 ]------

allcpu: Package 1 / Core 1 / Thread 0: Valid

CPUID 00000000: 0000000B-756E6547-6C65746E-49656E69
CPUID 00000001: 000206C1-02200800-029EE3FF-BFEBFBFF
CPUID 00000002: 55035A01-00F0B2FF-00000000-00CA0000
CPUID 00000003: 00000000-00000000-00000000-00000000
CPUID 00000004: 3C004121-01C0003F-0000003F-00000000
CPUID 00000004: 3C004122-00C0003F-0000007F-00000000
CPUID 00000004: 3C004143-01C0003F-000001FF-00000000
CPUID 00000004: 3C07C163-03C0003F-00002FFF-00000002
CPUID 00000005: 00000040-00000040-00000003-00001120
CPUID 00000006: 00000007-00000002-00000001-00000000
CPUID 00000007: 00000000-00000000-00000000-00000000
CPUID 00000008: 00000000-00000000-00000000-00000000
CPUID 00000009: 00000000-00000000-00000000-00000000
CPUID 0000000A: 07300403-00000004-00000000-00000603
CPUID 0000000B: 00000001-00000002-00000100-00000002
CPUID 0000000B: 00000005-00000008-00000201-00000002
CPUID 80000000: 80000008-00000000-00000000-00000000
CPUID 80000001: 00000000-00000000-00000001-2C100000
CPUID 80000002: 65746E49-2952286C-6F655820-2952286E
CPUID 80000003: 55504320-20202020-20202020-58202020
CPUID 80000004: 37363635-20402020-37302E33-007A4847
CPUID 80000005: 00000000-00000000-00000000-00000000
CPUID 80000006: 00000000-00000000-01006040-00000000
CPUID 80000007: 00000000-00000000-00000000-00000100
CPUID 80000008: 00003028-00000000-00000000-00000000

L1    Data Cache:     32 KB,  8-way Associative, 64-byte Line
L1  Instr. Cache:     32 KB,  4-way Associative, 64-byte Line
L2 Unified Cache:    256 KB,  8-way Associative, 64-byte Line
L3 Unified Cache:  12288 KB, 16-way Associative, 64-byte Line

------[ Logical CPU #11 ]------

allcpu: Package 1 / Core 1 / Thread 1: Valid, Virtual

CPUID 00000000: 0000000B-756E6547-6C65746E-49656E69
CPUID 00000001: 000206C1-03200800-029EE3FF-BFEBFBFF
CPUID 00000002: 55035A01-00F0B2FF-00000000-00CA0000
CPUID 00000003: 00000000-00000000-00000000-00000000
CPUID 00000004: 3C004121-01C0003F-0000003F-00000000
CPUID 00000004: 3C004122-00C0003F-0000007F-00000000
CPUID 00000004: 3C004143-01C0003F-000001FF-00000000
CPUID 00000004: 3C07C163-03C0003F-00002FFF-00000002
CPUID 00000005: 00000040-00000040-00000003-00001120
CPUID 00000006: 00000007-00000002-00000001-00000000
CPUID 00000007: 00000000-00000000-00000000-00000000
CPUID 00000008: 00000000-00000000-00000000-00000000
CPUID 00000009: 00000000-00000000-00000000-00000000
CPUID 0000000A: 07300403-00000004-00000000-00000603
CPUID 0000000B: 00000001-00000002-00000100-00000003
CPUID 0000000B: 00000005-00000008-00000201-00000003
CPUID 80000000: 80000008-00000000-00000000-00000000
CPUID 80000001: 00000000-00000000-00000001-2C100000
CPUID 80000002: 65746E49-2952286C-6F655820-2952286E
CPUID 80000003: 55504320-20202020-20202020-58202020
CPUID 80000004: 37363635-20402020-37302E33-007A4847
CPUID 80000005: 00000000-00000000-00000000-00000000
CPUID 80000006: 00000000-00000000-01006040-00000000
CPUID 80000007: 00000000-00000000-00000000-00000100
CPUID 80000008: 00003028-00000000-00000000-00000000

L1    Data Cache:     32 KB,  8-way Associative, 64-byte Line
L1  Instr. Cache:     32 KB,  4-way Associative, 64-byte Line
L2 Unified Cache:    256 KB,  8-way Associative, 64-byte Line
L3 Unified Cache:  12288 KB, 16-way Associative, 64-byte Line

------[ Logical CPU #12 ]------

allcpu: Package 1 / Core 2 / Thread 0: Valid

CPUID 00000000: 0000000B-756E6547-6C65746E-49656E69
CPUID 00000001: 000206C1-12200800-029EE3FF-BFEBFBFF
CPUID 00000002: 55035A01-00F0B2FF-00000000-00CA0000
CPUID 00000003: 00000000-00000000-00000000-00000000
CPUID 00000004: 3C004121-01C0003F-0000003F-00000000
CPUID 00000004: 3C004122-00C0003F-0000007F-00000000
CPUID 00000004: 3C004143-01C0003F-000001FF-00000000
CPUID 00000004: 3C07C163-03C0003F-00002FFF-00000002
CPUID 00000005: 00000040-00000040-00000003-00001120
CPUID 00000006: 00000007-00000002-00000001-00000000
CPUID 00000007: 00000000-00000000-00000000-00000000
CPUID 00000008: 00000000-00000000-00000000-00000000
CPUID 00000009: 00000000-00000000-00000000-00000000
CPUID 0000000A: 07300403-00000004-00000000-00000603
CPUID 0000000B: 00000001-00000002-00000100-00000012
CPUID 0000000B: 00000005-00000008-00000201-00000012
CPUID 80000000: 80000008-00000000-00000000-00000000
CPUID 80000001: 00000000-00000000-00000001-2C100000
CPUID 80000002: 65746E49-2952286C-6F655820-2952286E
CPUID 80000003: 55504320-20202020-20202020-58202020
CPUID 80000004: 37363635-20402020-37302E33-007A4847
CPUID 80000005: 00000000-00000000-00000000-00000000
CPUID 80000006: 00000000-00000000-01006040-00000000
CPUID 80000007: 00000000-00000000-00000000-00000100
CPUID 80000008: 00003028-00000000-00000000-00000000

L1    Data Cache:     32 KB,  8-way Associative, 64-byte Line
L1  Instr. Cache:     32 KB,  4-way Associative, 64-byte Line
L2 Unified Cache:    256 KB,  8-way Associative, 64-byte Line
L3 Unified Cache:  12288 KB, 16-way Associative, 64-byte Line

------[ Logical CPU #13 ]------

allcpu: Package 1 / Core 2 / Thread 1: Valid, Virtual

CPUID 00000000: 0000000B-756E6547-6C65746E-49656E69
CPUID 00000001: 000206C1-13200800-029EE3FF-BFEBFBFF
CPUID 00000002: 55035A01-00F0B2FF-00000000-00CA0000
CPUID 00000003: 00000000-00000000-00000000-00000000
CPUID 00000004: 3C004121-01C0003F-0000003F-00000000
CPUID 00000004: 3C004122-00C0003F-0000007F-00000000
CPUID 00000004: 3C004143-01C0003F-000001FF-00000000
CPUID 00000004: 3C07C163-03C0003F-00002FFF-00000002
CPUID 00000005: 00000040-00000040-00000003-00001120
CPUID 00000006: 00000007-00000002-00000001-00000000
CPUID 00000007: 00000000-00000000-00000000-00000000
CPUID 00000008: 00000000-00000000-00000000-00000000
CPUID 00000009: 00000000-00000000-00000000-00000000
CPUID 0000000A: 07300403-00000004-00000000-00000603
CPUID 0000000B: 00000001-00000002-00000100-00000013
CPUID 0000000B: 00000005-00000008-00000201-00000013
CPUID 80000000: 80000008-00000000-00000000-00000000
CPUID 80000001: 00000000-00000000-00000001-2C100000
CPUID 80000002: 65746E49-2952286C-6F655820-2952286E
CPUID 80000003: 55504320-20202020-20202020-58202020
CPUID 80000004: 37363635-20402020-37302E33-007A4847
CPUID 80000005: 00000000-00000000-00000000-00000000
CPUID 80000006: 00000000-00000000-01006040-00000000
CPUID 80000007: 00000000-00000000-00000000-00000100
CPUID 80000008: 00003028-00000000-00000000-00000000

L1    Data Cache:     32 KB,  8-way Associative, 64-byte Line
L1  Instr. Cache:     32 KB,  4-way Associative, 64-byte Line
L2 Unified Cache:    256 KB,  8-way Associative, 64-byte Line
L3 Unified Cache:  12288 KB, 16-way Associative, 64-byte Line

------[ Logical CPU #14 ]------

allcpu: Package 1 / Core 3 / Thread 0: Valid

CPUID 00000000: 0000000B-756E6547-6C65746E-49656E69
CPUID 00000001: 000206C1-14200800-029EE3FF-BFEBFBFF
CPUID 00000002: 55035A01-00F0B2FF-00000000-00CA0000
CPUID 00000003: 00000000-00000000-00000000-00000000
CPUID 00000004: 3C004121-01C0003F-0000003F-00000000
CPUID 00000004: 3C004122-00C0003F-0000007F-00000000
CPUID 00000004: 3C004143-01C0003F-000001FF-00000000
CPUID 00000004: 3C07C163-03C0003F-00002FFF-00000002
CPUID 00000005: 00000040-00000040-00000003-00001120
CPUID 00000006: 00000007-00000002-00000001-00000000
CPUID 00000007: 00000000-00000000-00000000-00000000
CPUID 00000008: 00000000-00000000-00000000-00000000
CPUID 00000009: 00000000-00000000-00000000-00000000
CPUID 0000000A: 07300403-00000004-00000000-00000603
CPUID 0000000B: 00000001-00000002-00000100-00000014
CPUID 0000000B: 00000005-00000008-00000201-00000014
CPUID 80000000: 80000008-00000000-00000000-00000000
CPUID 80000001: 00000000-00000000-00000001-2C100000
CPUID 80000002: 65746E49-2952286C-6F655820-2952286E
CPUID 80000003: 55504320-20202020-20202020-58202020
CPUID 80000004: 37363635-20402020-37302E33-007A4847
CPUID 80000005: 00000000-00000000-00000000-00000000
CPUID 80000006: 00000000-00000000-01006040-00000000
CPUID 80000007: 00000000-00000000-00000000-00000100
CPUID 80000008: 00003028-00000000-00000000-00000000

L1    Data Cache:     32 KB,  8-way Associative, 64-byte Line
L1  Instr. Cache:     32 KB,  4-way Associative, 64-byte Line
L2 Unified Cache:    256 KB,  8-way Associative, 64-byte Line
L3 Unified Cache:  12288 KB, 16-way Associative, 64-byte Line

------[ Logical CPU #15 ]------

allcpu: Package 1 / Core 3 / Thread 1: Valid, Virtual

CPUID 00000000: 0000000B-756E6547-6C65746E-49656E69
CPUID 00000001: 000206C1-15200800-029EE3FF-BFEBFBFF
CPUID 00000002: 55035A01-00F0B2FF-00000000-00CA0000
CPUID 00000003: 00000000-00000000-00000000-00000000
CPUID 00000004: 3C004121-01C0003F-0000003F-00000000
CPUID 00000004: 3C004122-00C0003F-0000007F-00000000
CPUID 00000004: 3C004143-01C0003F-000001FF-00000000
CPUID 00000004: 3C07C163-03C0003F-00002FFF-00000002
CPUID 00000005: 00000040-00000040-00000003-00001120
CPUID 00000006: 00000007-00000002-00000001-00000000
CPUID 00000007: 00000000-00000000-00000000-00000000
CPUID 00000008: 00000000-00000000-00000000-00000000
CPUID 00000009: 00000000-00000000-00000000-00000000
CPUID 0000000A: 07300403-00000004-00000000-00000603
CPUID 0000000B: 00000001-00000002-00000100-00000015
CPUID 0000000B: 00000005-00000008-00000201-00000015
CPUID 80000000: 80000008-00000000-00000000-00000000
CPUID 80000001: 00000000-00000000-00000001-2C100000
CPUID 80000002: 65746E49-2952286C-6F655820-2952286E
CPUID 80000003: 55504320-20202020-20202020-58202020
CPUID 80000004: 37363635-20402020-37302E33-007A4847
CPUID 80000005: 00000000-00000000-00000000-00000000
CPUID 80000006: 00000000-00000000-01006040-00000000
CPUID 80000007: 00000000-00000000-00000000-00000100
CPUID 80000008: 00003028-00000000-00000000-00000000

L1    Data Cache:     32 KB,  8-way Associative, 64-byte Line
L1  Instr. Cache:     32 KB,  4-way Associative, 64-byte Line
L2 Unified Cache:    256 KB,  8-way Associative, 64-byte Line
L3 Unified Cache:  12288 KB, 16-way Associative, 64-byte Line

------[ All CPUs ]------

CPU   0: APICID  32 / Package 0 / Core  0 / Thread 0: Valid
CPU   1: APICID  33 / Package 0 / Core  0 / Thread 1: Valid, Virtual
CPU   2: APICID  34 / Package 0 / Core  1 / Thread 0: Valid
CPU   3: APICID  35 / Package 0 / Core  1 / Thread 1: Valid, Virtual
CPU   4: APICID  50 / Package 0 / Core  2 / Thread 0: Valid
CPU   5: APICID  51 / Package 0 / Core  2 / Thread 1: Valid, Virtual
CPU   6: APICID  52 / Package 0 / Core  3 / Thread 0: Valid
CPU   7: APICID  53 / Package 0 / Core  3 / Thread 1: Valid, Virtual
CPU   8: APICID   0 / Package 1 / Core  0 / Thread 0: Valid
CPU   9: APICID   1 / Package 1 / Core  0 / Thread 1: Valid, Virtual
CPU  10: APICID   2 / Package 1 / Core  1 / Thread 0: Valid
CPU  11: APICID   3 / Package 1 / Core  1 / Thread 1: Valid, Virtual
CPU  12: APICID  18 / Package 1 / Core  2 / Thread 0: Valid
CPU  13: APICID  19 / Package 1 / Core  2 / Thread 1: Valid, Virtual
CPU  14: APICID  20 / Package 1 / Core  3 / Thread 0: Valid
CPU  15: APICID  21 / Package 1 / Core  3 / Thread 1: Valid, Virtual

------[ MSR Registers ]------

MSR 00000017: 0000-0000-0000-0000 [PlatID = 0]
MSR 0000001B: 0000-0000-FEE0-0900
MSR 00000035: 0000-0000-0004-0008
MSR 0000008B: 0000-0000-0000-0000
MSR 000000CE: 0000-0C00-0C01-1700
MSR 000000E7: 0000-0000-007F-ED33
MSR 000000E8: 0000-0000-0042-D814
MSR 00000194: 0000-0000-0000-0000
MSR 00000198: 0000-0000-0000-000C
MSR 00000199: 0000-0000-0000-000C
MSR 0000019A: 0000-0000-0000-0000
MSR 0000019B: 0000-0000-0000-0000
MSR 0000019C: 0000-0000-8856-0000
MSR 0000019D: 0000-0000-0000-0000
MSR 000001A0: 0000-0000-0085-0089
MSR 000001A2: 0000-0000-0066-1000
MSR 000001A4: 0000-0000-0000-0000
MSR 000001AA: 0000-0000-0040-0000
MSR 000001AC: 0000-0000-02F8-02F8
MSR 000001AD: 0000-1717-1919-1A1A
MSR 000001FC: 0000-0000-0000-0002
MSR 00000300: 0000-0000-E000-0001

PerformanceFrequency = 2991093

Tjmax Temperature = 102 Celsius
