CPUID 00000000: 0000000D-756E6547-6C65746E-49656E69 
CPUID 00000001: 00050670-02FF0800-7FF8F3BF-BFEBFBFF 
CPUID 00000002: 616B6A01-0000FF6D-00000000-00000000 
CPUID 00000003: 00000000-00000000-00000000-00000000 
CPUID 00000004: FC00C121-01C0003F-0000003F-00000000 [SL 00]
CPUID 00000004: FC00C122-01C0003F-0000003F-00000000 [SL 01]
CPUID 00000004: FC01C143-03C0003F-000003FF-00000013 [SL 02]
CPUID 00000005: 00000040-00000040-00000003-00000110 
CPUID 00000006: 00000075-00000002-00000009-00000000 
CPUID 00000007: 00000000-1C0D23AB-00000001-00000000 [SL 00]
CPUID 00000008: 00000000-00000000-00000000-00000000 
CPUID 00000009: 00000000-00000000-00000000-00000000 
CPUID 0000000A: 07280203-00000000-00000000-00000503 
CPUID 0000000B: 00000002-00000004-00000100-00000002 [SL 00]
CPUID 0000000B: 00000009-00000120-00000201-00000002 [SL 01]
CPUID 0000000C: 00000000-00000000-00000000-00000000 
CPUID 0000000D: 000000E7-00000A80-00000A80-00000000 [SL 00]
CPUID 0000000D: 00000001-00000000-00000000-00000000 [SL 01]
CPUID 0000000D: 00000100-00000240-00000000-00000000 [SL 02]
CPUID 0000000D: 00000040-00000440-00000000-00000000 [SL 05]
CPUID 0000000D: 00000200-00000480-00000000-00000000 [SL 06]
CPUID 0000000D: 00000400-00000680-00000000-00000000 [SL 07]
CPUID 80000000: 80000008-00000000-00000000-00000000 
CPUID 80000001: 00000000-00000000-00000121-2C100000 
CPUID 80000002: 00000000-00000000-00000000-00000000 
CPUID 80000003: 00000000-00000000-00000000-00000000 
CPUID 80000004: 00000000-00000000-00000000-00000000 
CPUID 80000005: 00000000-00000000-00000000-00000000 
CPUID 80000006: 00000000-00000000-04008040-00000000 
CPUID 80000007: 00000000-00000000-00000000-00000100 
CPUID 80000008: 0000302E-00000000-00000000-00000000 
