CPU#000 AffMask: 0x0000000000000001 
CPUID 00000000: 0000000D-756E6547-6C65746E-49656E69 [GenuineIntel]
CPUID 00000001: 000306C3-00100800-7FFAFBFF-BFEBFBFF 
CPUID 00000002: 76036301-00F0B5FF-00000000-00C10000 
CPUID 00000003: 00000000-00000000-00000000-00000000 
CPUID 00000004: 1C004121-01C0003F-0000003F-00000000 [SL 00]
CPUID 00000004: 1C004122-01C0003F-0000003F-00000000 [SL 01]
CPUID 00000004: 1C004143-01C0003F-000001FF-00000000 [SL 02]
CPUID 00000004: 1C03C163-03C0003F-00001FFF-00000006 [SL 03]
CPUID 00000005: 00000040-00000040-00000003-00042120 
CPUID 00000006: 00000075-00000002-00000001-00000000 
CPUID 00000007: 00000000-000027AB-00000000-9C000000 [SL 00]
CPUID 00000008: 00000000-00000000-00000000-00000000 
CPUID 00000009: 00000000-00000000-00000000-00000000 
CPUID 0000000A: 07300403-00000000-00000000-00000603 
CPUID 0000000B: 00000001-00000002-00000100-00000000 [SL 00]
CPUID 0000000B: 00000004-00000008-00000201-00000000 [SL 01]
CPUID 0000000C: 00000000-00000000-00000000-00000000 
CPUID 0000000D: 00000007-00000340-00000340-00000000 [SL 00]
CPUID 0000000D: 00000001-00000000-00000000-00000000 [SL 01]
CPUID 0000000D: 00000000-00000000-00000000-00000000 [SL 02]
CPUID 80000000: 80000008-00000000-00000000-00000000 
CPUID 80000001: 00000000-00000000-00000021-2C100800 
CPUID 80000002: 65746E49-2952286C-6F655820-2952286E [Intel(R) Xeon(R)]
CPUID 80000003: 55504320-2D334520-35363231-3376204C [ CPU E3-1265L v3]
CPUID 80000004: 32204020-4730352E-00007A48-00000000 [ @ 2.50GHz]
CPUID 80000005: 00000000-00000000-00000000-00000000 
CPUID 80000006: 00000000-00000000-01006040-00000000 
CPUID 80000007: 00000000-00000000-00000000-00000100 
CPUID 80000008: 00003027-00000000-00000000-00000000 

CPU#001 AffMask: 0x0000000000000002 
CPUID 00000000: 0000000D-756E6547-6C65746E-49656E69 [GenuineIntel]
CPUID 00000001: 000306C3-01100800-7FFAFBFF-BFEBFBFF 
CPUID 00000002: 76036301-00F0B5FF-00000000-00C10000 
CPUID 00000003: 00000000-00000000-00000000-00000000 
CPUID 00000004: 1C004121-01C0003F-0000003F-00000000 [SL 00]
CPUID 00000004: 1C004122-01C0003F-0000003F-00000000 [SL 01]
CPUID 00000004: 1C004143-01C0003F-000001FF-00000000 [SL 02]
CPUID 00000004: 1C03C163-03C0003F-00001FFF-00000006 [SL 03]
CPUID 00000005: 00000040-00000040-00000003-00042120 
CPUID 00000006: 00000075-00000002-00000001-00000000 
CPUID 00000007: 00000000-000027AB-00000000-9C000000 [SL 00]
CPUID 00000008: 00000000-00000000-00000000-00000000 
CPUID 00000009: 00000000-00000000-00000000-00000000 
CPUID 0000000A: 07300403-00000000-00000000-00000603 
CPUID 0000000B: 00000001-00000002-00000100-00000001 [SL 00]
CPUID 0000000B: 00000004-00000008-00000201-00000001 [SL 01]
CPUID 0000000C: 00000000-00000000-00000000-00000000 
CPUID 0000000D: 00000007-00000340-00000340-00000000 [SL 00]
CPUID 0000000D: 00000001-00000000-00000000-00000000 [SL 01]
CPUID 0000000D: 00000000-00000000-00000000-00000000 [SL 02]
CPUID 80000000: 80000008-00000000-00000000-00000000 
CPUID 80000001: 00000000-00000000-00000021-2C100800 
CPUID 80000002: 65746E49-2952286C-6F655820-2952286E [Intel(R) Xeon(R)]
CPUID 80000003: 55504320-2D334520-35363231-3376204C [ CPU E3-1265L v3]
CPUID 80000004: 32204020-4730352E-00007A48-00000000 [ @ 2.50GHz]
CPUID 80000005: 00000000-00000000-00000000-00000000 
CPUID 80000006: 00000000-00000000-01006040-00000000 
CPUID 80000007: 00000000-00000000-00000000-00000100 
CPUID 80000008: 00003027-00000000-00000000-00000000 

CPU#002 AffMask: 0x0000000000000004 
CPUID 00000000: 0000000D-756E6547-6C65746E-49656E69 [GenuineIntel]
CPUID 00000001: 000306C3-02100800-7FFAFBFF-BFEBFBFF 
CPUID 00000002: 76036301-00F0B5FF-00000000-00C10000 
CPUID 00000003: 00000000-00000000-00000000-00000000 
CPUID 00000004: 1C004121-01C0003F-0000003F-00000000 [SL 00]
CPUID 00000004: 1C004122-01C0003F-0000003F-00000000 [SL 01]
CPUID 00000004: 1C004143-01C0003F-000001FF-00000000 [SL 02]
CPUID 00000004: 1C03C163-03C0003F-00001FFF-00000006 [SL 03]
CPUID 00000005: 00000040-00000040-00000003-00042120 
CPUID 00000006: 00000075-00000002-00000001-00000000 
CPUID 00000007: 00000000-000027AB-00000000-9C000000 [SL 00]
CPUID 00000008: 00000000-00000000-00000000-00000000 
CPUID 00000009: 00000000-00000000-00000000-00000000 
CPUID 0000000A: 07300403-00000000-00000000-00000603 
CPUID 0000000B: 00000001-00000002-00000100-00000002 [SL 00]
CPUID 0000000B: 00000004-00000008-00000201-00000002 [SL 01]
CPUID 0000000C: 00000000-00000000-00000000-00000000 
CPUID 0000000D: 00000007-00000340-00000340-00000000 [SL 00]
CPUID 0000000D: 00000001-00000000-00000000-00000000 [SL 01]
CPUID 0000000D: 00000000-00000000-00000000-00000000 [SL 02]
CPUID 80000000: 80000008-00000000-00000000-00000000 
CPUID 80000001: 00000000-00000000-00000021-2C100800 
CPUID 80000002: 65746E49-2952286C-6F655820-2952286E [Intel(R) Xeon(R)]
CPUID 80000003: 55504320-2D334520-35363231-3376204C [ CPU E3-1265L v3]
CPUID 80000004: 32204020-4730352E-00007A48-00000000 [ @ 2.50GHz]
CPUID 80000005: 00000000-00000000-00000000-00000000 
CPUID 80000006: 00000000-00000000-01006040-00000000 
CPUID 80000007: 00000000-00000000-00000000-00000100 
CPUID 80000008: 00003027-00000000-00000000-00000000 

CPU#003 AffMask: 0x0000000000000008 
CPUID 00000000: 0000000D-756E6547-6C65746E-49656E69 [GenuineIntel]
CPUID 00000001: 000306C3-03100800-7FFAFBFF-BFEBFBFF 
CPUID 00000002: 76036301-00F0B5FF-00000000-00C10000 
CPUID 00000003: 00000000-00000000-00000000-00000000 
CPUID 00000004: 1C004121-01C0003F-0000003F-00000000 [SL 00]
CPUID 00000004: 1C004122-01C0003F-0000003F-00000000 [SL 01]
CPUID 00000004: 1C004143-01C0003F-000001FF-00000000 [SL 02]
CPUID 00000004: 1C03C163-03C0003F-00001FFF-00000006 [SL 03]
CPUID 00000005: 00000040-00000040-00000003-00042120 
CPUID 00000006: 00000075-00000002-00000001-00000000 
CPUID 00000007: 00000000-000027AB-00000000-9C000000 [SL 00]
CPUID 00000008: 00000000-00000000-00000000-00000000 
CPUID 00000009: 00000000-00000000-00000000-00000000 
CPUID 0000000A: 07300403-00000000-00000000-00000603 
CPUID 0000000B: 00000001-00000002-00000100-00000003 [SL 00]
CPUID 0000000B: 00000004-00000008-00000201-00000003 [SL 01]
CPUID 0000000C: 00000000-00000000-00000000-00000000 
CPUID 0000000D: 00000007-00000340-00000340-00000000 [SL 00]
CPUID 0000000D: 00000001-00000000-00000000-00000000 [SL 01]
CPUID 0000000D: 00000000-00000000-00000000-00000000 [SL 02]
CPUID 80000000: 80000008-00000000-00000000-00000000 
CPUID 80000001: 00000000-00000000-00000021-2C100800 
CPUID 80000002: 65746E49-2952286C-6F655820-2952286E [Intel(R) Xeon(R)]
CPUID 80000003: 55504320-2D334520-35363231-3376204C [ CPU E3-1265L v3]
CPUID 80000004: 32204020-4730352E-00007A48-00000000 [ @ 2.50GHz]
CPUID 80000005: 00000000-00000000-00000000-00000000 
CPUID 80000006: 00000000-00000000-01006040-00000000 
CPUID 80000007: 00000000-00000000-00000000-00000100 
CPUID 80000008: 00003027-00000000-00000000-00000000 

CPU#004 AffMask: 0x0000000000000010 
CPUID 00000000: 0000000D-756E6547-6C65746E-49656E69 [GenuineIntel]
CPUID 00000001: 000306C3-04100800-7FFAFBFF-BFEBFBFF 
CPUID 00000002: 76036301-00F0B5FF-00000000-00C10000 
CPUID 00000003: 00000000-00000000-00000000-00000000 
CPUID 00000004: 1C004121-01C0003F-0000003F-00000000 [SL 00]
CPUID 00000004: 1C004122-01C0003F-0000003F-00000000 [SL 01]
CPUID 00000004: 1C004143-01C0003F-000001FF-00000000 [SL 02]
CPUID 00000004: 1C03C163-03C0003F-00001FFF-00000006 [SL 03]
CPUID 00000005: 00000040-00000040-00000003-00042120 
CPUID 00000006: 00000075-00000002-00000001-00000000 
CPUID 00000007: 00000000-000027AB-00000000-9C000000 [SL 00]
CPUID 00000008: 00000000-00000000-00000000-00000000 
CPUID 00000009: 00000000-00000000-00000000-00000000 
CPUID 0000000A: 07300403-00000000-00000000-00000603 
CPUID 0000000B: 00000001-00000002-00000100-00000004 [SL 00]
CPUID 0000000B: 00000004-00000008-00000201-00000004 [SL 01]
CPUID 0000000C: 00000000-00000000-00000000-00000000 
CPUID 0000000D: 00000007-00000340-00000340-00000000 [SL 00]
CPUID 0000000D: 00000001-00000000-00000000-00000000 [SL 01]
CPUID 0000000D: 00000000-00000000-00000000-00000000 [SL 02]
CPUID 80000000: 80000008-00000000-00000000-00000000 
CPUID 80000001: 00000000-00000000-00000021-2C100800 
CPUID 80000002: 65746E49-2952286C-6F655820-2952286E [Intel(R) Xeon(R)]
CPUID 80000003: 55504320-2D334520-35363231-3376204C [ CPU E3-1265L v3]
CPUID 80000004: 32204020-4730352E-00007A48-00000000 [ @ 2.50GHz]
CPUID 80000005: 00000000-00000000-00000000-00000000 
CPUID 80000006: 00000000-00000000-01006040-00000000 
CPUID 80000007: 00000000-00000000-00000000-00000100 
CPUID 80000008: 00003027-00000000-00000000-00000000 

CPU#005 AffMask: 0x0000000000000020 
CPUID 00000000: 0000000D-756E6547-6C65746E-49656E69 [GenuineIntel]
CPUID 00000001: 000306C3-05100800-7FFAFBFF-BFEBFBFF 
CPUID 00000002: 76036301-00F0B5FF-00000000-00C10000 
CPUID 00000003: 00000000-00000000-00000000-00000000 
CPUID 00000004: 1C004121-01C0003F-0000003F-00000000 [SL 00]
CPUID 00000004: 1C004122-01C0003F-0000003F-00000000 [SL 01]
CPUID 00000004: 1C004143-01C0003F-000001FF-00000000 [SL 02]
CPUID 00000004: 1C03C163-03C0003F-00001FFF-00000006 [SL 03]
CPUID 00000005: 00000040-00000040-00000003-00042120 
CPUID 00000006: 00000075-00000002-00000001-00000000 
CPUID 00000007: 00000000-000027AB-00000000-9C000000 [SL 00]
CPUID 00000008: 00000000-00000000-00000000-00000000 
CPUID 00000009: 00000000-00000000-00000000-00000000 
CPUID 0000000A: 07300403-00000000-00000000-00000603 
CPUID 0000000B: 00000001-00000002-00000100-00000005 [SL 00]
CPUID 0000000B: 00000004-00000008-00000201-00000005 [SL 01]
CPUID 0000000C: 00000000-00000000-00000000-00000000 
CPUID 0000000D: 00000007-00000340-00000340-00000000 [SL 00]
CPUID 0000000D: 00000001-00000000-00000000-00000000 [SL 01]
CPUID 0000000D: 00000000-00000000-00000000-00000000 [SL 02]
CPUID 80000000: 80000008-00000000-00000000-00000000 
CPUID 80000001: 00000000-00000000-00000021-2C100800 
CPUID 80000002: 65746E49-2952286C-6F655820-2952286E [Intel(R) Xeon(R)]
CPUID 80000003: 55504320-2D334520-35363231-3376204C [ CPU E3-1265L v3]
CPUID 80000004: 32204020-4730352E-00007A48-00000000 [ @ 2.50GHz]
CPUID 80000005: 00000000-00000000-00000000-00000000 
CPUID 80000006: 00000000-00000000-01006040-00000000 
CPUID 80000007: 00000000-00000000-00000000-00000100 
CPUID 80000008: 00003027-00000000-00000000-00000000 

CPU#006 AffMask: 0x0000000000000040 
CPUID 00000000: 0000000D-756E6547-6C65746E-49656E69 [GenuineIntel]
CPUID 00000001: 000306C3-06100800-7FFAFBFF-BFEBFBFF 
CPUID 00000002: 76036301-00F0B5FF-00000000-00C10000 
CPUID 00000003: 00000000-00000000-00000000-00000000 
CPUID 00000004: 1C004121-01C0003F-0000003F-00000000 [SL 00]
CPUID 00000004: 1C004122-01C0003F-0000003F-00000000 [SL 01]
CPUID 00000004: 1C004143-01C0003F-000001FF-00000000 [SL 02]
CPUID 00000004: 1C03C163-03C0003F-00001FFF-00000006 [SL 03]
CPUID 00000005: 00000040-00000040-00000003-00042120 
CPUID 00000006: 00000075-00000002-00000001-00000000 
CPUID 00000007: 00000000-000027AB-00000000-9C000000 [SL 00]
CPUID 00000008: 00000000-00000000-00000000-00000000 
CPUID 00000009: 00000000-00000000-00000000-00000000 
CPUID 0000000A: 07300403-00000000-00000000-00000603 
CPUID 0000000B: 00000001-00000002-00000100-00000006 [SL 00]
CPUID 0000000B: 00000004-00000008-00000201-00000006 [SL 01]
CPUID 0000000C: 00000000-00000000-00000000-00000000 
CPUID 0000000D: 00000007-00000340-00000340-00000000 [SL 00]
CPUID 0000000D: 00000001-00000000-00000000-00000000 [SL 01]
CPUID 0000000D: 00000000-00000000-00000000-00000000 [SL 02]
CPUID 80000000: 80000008-00000000-00000000-00000000 
CPUID 80000001: 00000000-00000000-00000021-2C100800 
CPUID 80000002: 65746E49-2952286C-6F655820-2952286E [Intel(R) Xeon(R)]
CPUID 80000003: 55504320-2D334520-35363231-3376204C [ CPU E3-1265L v3]
CPUID 80000004: 32204020-4730352E-00007A48-00000000 [ @ 2.50GHz]
CPUID 80000005: 00000000-00000000-00000000-00000000 
CPUID 80000006: 00000000-00000000-01006040-00000000 
CPUID 80000007: 00000000-00000000-00000000-00000100 
CPUID 80000008: 00003027-00000000-00000000-00000000 

CPU#007 AffMask: 0x0000000000000080 
CPUID 00000000: 0000000D-756E6547-6C65746E-49656E69 [GenuineIntel]
CPUID 00000001: 000306C3-07100800-7FFAFBFF-BFEBFBFF 
CPUID 00000002: 76036301-00F0B5FF-00000000-00C10000 
CPUID 00000003: 00000000-00000000-00000000-00000000 
CPUID 00000004: 1C004121-01C0003F-0000003F-00000000 [SL 00]
CPUID 00000004: 1C004122-01C0003F-0000003F-00000000 [SL 01]
CPUID 00000004: 1C004143-01C0003F-000001FF-00000000 [SL 02]
CPUID 00000004: 1C03C163-03C0003F-00001FFF-00000006 [SL 03]
CPUID 00000005: 00000040-00000040-00000003-00042120 
CPUID 00000006: 00000075-00000002-00000001-00000000 
CPUID 00000007: 00000000-000027AB-00000000-9C000000 [SL 00]
CPUID 00000008: 00000000-00000000-00000000-00000000 
CPUID 00000009: 00000000-00000000-00000000-00000000 
CPUID 0000000A: 07300403-00000000-00000000-00000603 
CPUID 0000000B: 00000001-00000002-00000100-00000007 [SL 00]
CPUID 0000000B: 00000004-00000008-00000201-00000007 [SL 01]
CPUID 0000000C: 00000000-00000000-00000000-00000000 
CPUID 0000000D: 00000007-00000340-00000340-00000000 [SL 00]
CPUID 0000000D: 00000001-00000000-00000000-00000000 [SL 01]
CPUID 0000000D: 00000000-00000000-00000000-00000000 [SL 02]
CPUID 80000000: 80000008-00000000-00000000-00000000 
CPUID 80000001: 00000000-00000000-00000021-2C100800 
CPUID 80000002: 65746E49-2952286C-6F655820-2952286E [Intel(R) Xeon(R)]
CPUID 80000003: 55504320-2D334520-35363231-3376204C [ CPU E3-1265L v3]
CPUID 80000004: 32204020-4730352E-00007A48-00000000 [ @ 2.50GHz]
CPUID 80000005: 00000000-00000000-00000000-00000000 
CPUID 80000006: 00000000-00000000-01006040-00000000 
CPUID 80000007: 00000000-00000000-00000000-00000100 
CPUID 80000008: 00003027-00000000-00000000-00000000 