------[ CPUID Registers / Logical CPU #0 ]------

allcpu: Package 0 / Core 0 / Thread 0: Valid

CPUID 00000000: 0000001B-756E6547-6C65746E-49656E69 [GenuineIntel]
CPUID 00000001: 000806C1-00100800-7FFAFBBF-BFEBFBFF
CPUID 00000002: 00FEFF01-000000F0-00000000-00000000
CPUID 00000003: 00000000-00000000-00000000-00000000
CPUID 00000004: 1C004121-02C0003F-0000003F-00000000 [SL 00] [L1D: 48 KB]
CPUID 00000004: 1C004122-01C0003F-0000003F-00000000 [SL 01] [L1I: 32 KB]
CPUID 00000004: 1C004143-04C0003F-000003FF-00000000 [SL 02] [L2U: 1280 KB]
CPUID 00000004: 1C03C163-01C0003F-00001FFF-00000004 [SL 03] [L3U: 4 MB]
CPUID 00000005: 00000040-00000040-00000003-11121020
CPUID 00000006: 0017EFF7-00000002-00000009-00000000
CPUID 00000007: 00000000-F3BFA7EB-18C05FCE-FC100510 [SL 00]
CPUID 00000008: 00000000-00000000-00000000-00000000
CPUID 00000009: 00000000-00000000-00000000-00000000
CPUID 0000000A: 08300805-00000000-0000000F-00008604
CPUID 0000000B: 00000001-00000002-00000100-00000000 [SL 00]
CPUID 0000000B: 00000004-00000004-00000201-00000000 [SL 01]
CPUID 0000000C: 00000000-00000000-00000000-00000000
CPUID 0000000D: 000002E7-00000A80-00000A88-00000000 [SL 00] [x87]
CPUID 0000000D: 0000000F-00000A10-00003900-00000000 [SL 01] [SSE]
CPUID 0000000D: 00000100-00000240-00000000-00000000 [SL 02] [AVX]
CPUID 0000000D: 00000040-00000440-00000000-00000000 [SL 05] [AVX-512 Opmask]
CPUID 0000000D: 00000200-00000480-00000000-00000000 [SL 06] [AVX-512 Hi256]
CPUID 0000000D: 00000400-00000680-00000000-00000000 [SL 07] [AVX-512 Hi16]
CPUID 0000000D: 00000080-00000000-00000001-00000000 [SL 08] [PT]
CPUID 0000000D: 00000008-00000A80-00000000-00000000 [SL 09] [PKRU]
CPUID 0000000D: 00000010-00000000-00000001-00000000 [SL 0B]
CPUID 0000000D: 00000018-00000000-00000001-00000000 [SL 0C]
CPUID 0000000D: 00000008-00000000-00000001-00000000 [SL 0D]
CPUID 0000000E: 00000000-00000000-00000000-00000000
CPUID 0000000F: 00000000-00000000-00000000-00000000 [SL 00]
CPUID 0000000F: 00000000-00000000-00000000-00000000 [SL 01]
CPUID 00000010: 00000000-00000004-00000000-00000000 [SL 00]
CPUID 00000010: 00000000-00000000-00000000-00000000 [SL 01]
CPUID 00000011: 00000000-00000000-00000000-00000000
CPUID 00000012: 00000000-00000000-00000000-00000000 [SL 00]
CPUID 00000012: 00000000-00000000-00000000-00000000 [SL 01]
CPUID 00000013: 00000000-00000000-00000000-00000000
CPUID 00000014: 00000001-0000004F-00000007-00000000 [SL 00]
CPUID 00000014: 02490002-003F1FFF-00000000-00000000 [SL 01]
CPUID 00000015: 00000002-00000068-0249F000-00000000 [52.00x / 38400000]
CPUID 00000016: 000007D0-00000DAC-00000064-00000000 [2000 / 3500 / 100]
CPUID 00000017: 00000000-00000000-00000000-00000000 [SL 00]
CPUID 00000018: 00000008-00000000-00000000-00000000 [SL 00]
CPUID 00000018: 00000000-00080001-00000010-00004022 [SL 01]
CPUID 00000018: 00000000-00080006-00000002-00004022 [SL 02]
CPUID 00000018: 00000000-0010000F-00000001-00004125 [SL 03]
CPUID 00000018: 00000000-00040001-00000010-00004024 [SL 04]
CPUID 00000018: 00000000-00040006-00000008-00004024 [SL 05]
CPUID 00000018: 00000000-00080008-00000001-00004124 [SL 06]
CPUID 00000018: 00000000-00080007-00000080-00004043 [SL 07]
CPUID 00000018: 00000000-00080009-00000080-00004043 [SL 08]
CPUID 00000019: 00000007-00000014-00000003-00000000
CPUID 0000001A: 00000000-00000000-00000000-00000000
CPUID 0000001B: 00000000-00000000-00000000-00000000
CPUID 80000000: 80000008-00000000-00000000-00000000
CPUID 80000001: 00000000-00000000-00000121-2C100000
CPUID 80000002: 65746E49-2952286C-6E655020-6D756974 [Intel(R) Pentium]
CPUID 80000003: 20295228-646C6F47-30353720-20402035 [(R) Gold 7505 @ ]
CPUID 80000004: 30302E32-007A4847-00000000-00000000 [2.00GHz]
CPUID 80000005: 00000000-00000000-00000000-00000000 [L1D: 0 KB / L1I: 0 KB]
CPUID 80000006: 00000000-00000000-01007040-00000000 [L2: 256 KB] / L3: 0 KB]
CPUID 80000007: 00000000-00000000-00000000-00000100
CPUID 80000008: 00003027-00000000-00000000-00000000

L1    Data Cache:    48 KB, 12-way Associative, 64-byte Line
L1  Instr. Cache:    32 KB,  8-way Associative, 64-byte Line
L2 Unified Cache:  1280 KB, 20-way Associative, 64-byte Line
L3 Unified Cache:     4 MB,  8-way Associative, 64-byte Line

------[ CPUID Registers / Logical CPU #1 ]------

allcpu: Package 0 / Core 0 / Thread 1: Valid, Virtual

CPUID 00000000: 0000001B-756E6547-6C65746E-49656E69 [GenuineIntel]
CPUID 00000001: 000806C1-01100800-7FFAFBBF-BFEBFBFF
CPUID 00000002: 00FEFF01-000000F0-00000000-00000000
CPUID 00000003: 00000000-00000000-00000000-00000000
CPUID 00000004: 1C004121-02C0003F-0000003F-00000000 [SL 00] [L1D: 48 KB]
CPUID 00000004: 1C004122-01C0003F-0000003F-00000000 [SL 01] [L1I: 32 KB]
CPUID 00000004: 1C004143-04C0003F-000003FF-00000000 [SL 02] [L2U: 1280 KB]
CPUID 00000004: 1C03C163-01C0003F-00001FFF-00000004 [SL 03] [L3U: 4 MB]
CPUID 00000005: 00000040-00000040-00000003-11121020
CPUID 00000006: 0017EFF7-00000002-00000009-00000000
CPUID 00000007: 00000000-F3BFA7EB-18C05FCE-FC100510 [SL 00]
CPUID 00000008: 00000000-00000000-00000000-00000000
CPUID 00000009: 00000000-00000000-00000000-00000000
CPUID 0000000A: 08300805-00000000-0000000F-00008604
CPUID 0000000B: 00000001-00000002-00000100-00000001 [SL 00]
CPUID 0000000B: 00000004-00000004-00000201-00000001 [SL 01]
CPUID 0000000C: 00000000-00000000-00000000-00000000
CPUID 0000000D: 000002E7-00000A80-00000A88-00000000 [SL 00] [x87]
CPUID 0000000D: 0000000F-00000A10-00003900-00000000 [SL 01] [SSE]
CPUID 0000000D: 00000100-00000240-00000000-00000000 [SL 02] [AVX]
CPUID 0000000D: 00000040-00000440-00000000-00000000 [SL 05] [AVX-512 Opmask]
CPUID 0000000D: 00000200-00000480-00000000-00000000 [SL 06] [AVX-512 Hi256]
CPUID 0000000D: 00000400-00000680-00000000-00000000 [SL 07] [AVX-512 Hi16]
CPUID 0000000D: 00000080-00000000-00000001-00000000 [SL 08] [PT]
CPUID 0000000D: 00000008-00000A80-00000000-00000000 [SL 09] [PKRU]
CPUID 0000000D: 00000010-00000000-00000001-00000000 [SL 0B]
CPUID 0000000D: 00000018-00000000-00000001-00000000 [SL 0C]
CPUID 0000000D: 00000008-00000000-00000001-00000000 [SL 0D]
CPUID 0000000E: 00000000-00000000-00000000-00000000
CPUID 0000000F: 00000000-00000000-00000000-00000000 [SL 00]
CPUID 0000000F: 00000000-00000000-00000000-00000000 [SL 01]
CPUID 00000010: 00000000-00000004-00000000-00000000 [SL 00]
CPUID 00000010: 00000000-00000000-00000000-00000000 [SL 01]
CPUID 00000011: 00000000-00000000-00000000-00000000
CPUID 00000012: 00000000-00000000-00000000-00000000 [SL 00]
CPUID 00000012: 00000000-00000000-00000000-00000000 [SL 01]
CPUID 00000013: 00000000-00000000-00000000-00000000
CPUID 00000014: 00000001-0000004F-00000007-00000000 [SL 00]
CPUID 00000014: 02490002-003F1FFF-00000000-00000000 [SL 01]
CPUID 00000015: 00000002-00000068-0249F000-00000000 [52.00x / 38400000]
CPUID 00000016: 000007D0-00000DAC-00000064-00000000 [2000 / 3500 / 100]
CPUID 00000017: 00000000-00000000-00000000-00000000 [SL 00]
CPUID 00000018: 00000008-00000000-00000000-00000000 [SL 00]
CPUID 00000018: 00000000-00080001-00000010-00004022 [SL 01]
CPUID 00000018: 00000000-00080006-00000002-00004022 [SL 02]
CPUID 00000018: 00000000-0010000F-00000001-00004125 [SL 03]
CPUID 00000018: 00000000-00040001-00000010-00004024 [SL 04]
CPUID 00000018: 00000000-00040006-00000008-00004024 [SL 05]
CPUID 00000018: 00000000-00080008-00000001-00004124 [SL 06]
CPUID 00000018: 00000000-00080007-00000080-00004043 [SL 07]
CPUID 00000018: 00000000-00080009-00000080-00004043 [SL 08]
CPUID 00000019: 00000007-00000014-00000003-00000000
CPUID 0000001A: 00000000-00000000-00000000-00000000
CPUID 0000001B: 00000000-00000000-00000000-00000000
CPUID 80000000: 80000008-00000000-00000000-00000000
CPUID 80000001: 00000000-00000000-00000121-2C100000
CPUID 80000002: 65746E49-2952286C-6E655020-6D756974 [Intel(R) Pentium]
CPUID 80000003: 20295228-646C6F47-30353720-20402035 [(R) Gold 7505 @ ]
CPUID 80000004: 30302E32-007A4847-00000000-00000000 [2.00GHz]
CPUID 80000005: 00000000-00000000-00000000-00000000 [L1D: 0 KB / L1I: 0 KB]
CPUID 80000006: 00000000-00000000-01007040-00000000 [L2: 256 KB] / L3: 0 KB]
CPUID 80000007: 00000000-00000000-00000000-00000100
CPUID 80000008: 00003027-00000000-00000000-00000000

L1    Data Cache:    48 KB, 12-way Associative, 64-byte Line
L1  Instr. Cache:    32 KB,  8-way Associative, 64-byte Line
L2 Unified Cache:  1280 KB, 20-way Associative, 64-byte Line
L3 Unified Cache:     4 MB,  8-way Associative, 64-byte Line

------[ CPUID Registers / Logical CPU #2 ]------

allcpu: Package 0 / Core 1 / Thread 0: Valid

CPUID 00000000: 0000001B-756E6547-6C65746E-49656E69 [GenuineIntel]
CPUID 00000001: 000806C1-02100800-7FFAFBBF-BFEBFBFF
CPUID 00000002: 00FEFF01-000000F0-00000000-00000000
CPUID 00000003: 00000000-00000000-00000000-00000000
CPUID 00000004: 1C004121-02C0003F-0000003F-00000000 [SL 00] [L1D: 48 KB]
CPUID 00000004: 1C004122-01C0003F-0000003F-00000000 [SL 01] [L1I: 32 KB]
CPUID 00000004: 1C004143-04C0003F-000003FF-00000000 [SL 02] [L2U: 1280 KB]
CPUID 00000004: 1C03C163-01C0003F-00001FFF-00000004 [SL 03] [L3U: 4 MB]
CPUID 00000005: 00000040-00000040-00000003-11121020
CPUID 00000006: 0017EFF7-00000002-00000009-00000000
CPUID 00000007: 00000000-F3BFA7EB-18C05FCE-FC100510 [SL 00]
CPUID 00000008: 00000000-00000000-00000000-00000000
CPUID 00000009: 00000000-00000000-00000000-00000000
CPUID 0000000A: 08300805-00000000-0000000F-00008604
CPUID 0000000B: 00000001-00000002-00000100-00000002 [SL 00]
CPUID 0000000B: 00000004-00000004-00000201-00000002 [SL 01]
CPUID 0000000C: 00000000-00000000-00000000-00000000
CPUID 0000000D: 000002E7-00000A80-00000A88-00000000 [SL 00] [x87]
CPUID 0000000D: 0000000F-00000A10-00003900-00000000 [SL 01] [SSE]
CPUID 0000000D: 00000100-00000240-00000000-00000000 [SL 02] [AVX]
CPUID 0000000D: 00000040-00000440-00000000-00000000 [SL 05] [AVX-512 Opmask]
CPUID 0000000D: 00000200-00000480-00000000-00000000 [SL 06] [AVX-512 Hi256]
CPUID 0000000D: 00000400-00000680-00000000-00000000 [SL 07] [AVX-512 Hi16]
CPUID 0000000D: 00000080-00000000-00000001-00000000 [SL 08] [PT]
CPUID 0000000D: 00000008-00000A80-00000000-00000000 [SL 09] [PKRU]
CPUID 0000000D: 00000010-00000000-00000001-00000000 [SL 0B]
CPUID 0000000D: 00000018-00000000-00000001-00000000 [SL 0C]
CPUID 0000000D: 00000008-00000000-00000001-00000000 [SL 0D]
CPUID 0000000E: 00000000-00000000-00000000-00000000
CPUID 0000000F: 00000000-00000000-00000000-00000000 [SL 00]
CPUID 0000000F: 00000000-00000000-00000000-00000000 [SL 01]
CPUID 00000010: 00000000-00000004-00000000-00000000 [SL 00]
CPUID 00000010: 00000000-00000000-00000000-00000000 [SL 01]
CPUID 00000011: 00000000-00000000-00000000-00000000
CPUID 00000012: 00000000-00000000-00000000-00000000 [SL 00]
CPUID 00000012: 00000000-00000000-00000000-00000000 [SL 01]
CPUID 00000013: 00000000-00000000-00000000-00000000
CPUID 00000014: 00000001-0000004F-00000007-00000000 [SL 00]
CPUID 00000014: 02490002-003F1FFF-00000000-00000000 [SL 01]
CPUID 00000015: 00000002-00000068-0249F000-00000000 [52.00x / 38400000]
CPUID 00000016: 000007D0-00000DAC-00000064-00000000 [2000 / 3500 / 100]
CPUID 00000017: 00000000-00000000-00000000-00000000 [SL 00]
CPUID 00000018: 00000008-00000000-00000000-00000000 [SL 00]
CPUID 00000018: 00000000-00080001-00000010-00004022 [SL 01]
CPUID 00000018: 00000000-00080006-00000002-00004022 [SL 02]
CPUID 00000018: 00000000-0010000F-00000001-00004125 [SL 03]
CPUID 00000018: 00000000-00040001-00000010-00004024 [SL 04]
CPUID 00000018: 00000000-00040006-00000008-00004024 [SL 05]
CPUID 00000018: 00000000-00080008-00000001-00004124 [SL 06]
CPUID 00000018: 00000000-00080007-00000080-00004043 [SL 07]
CPUID 00000018: 00000000-00080009-00000080-00004043 [SL 08]
CPUID 00000019: 00000007-00000014-00000003-00000000
CPUID 0000001A: 00000000-00000000-00000000-00000000
CPUID 0000001B: 00000000-00000000-00000000-00000000
CPUID 80000000: 80000008-00000000-00000000-00000000
CPUID 80000001: 00000000-00000000-00000121-2C100000
CPUID 80000002: 65746E49-2952286C-6E655020-6D756974 [Intel(R) Pentium]
CPUID 80000003: 20295228-646C6F47-30353720-20402035 [(R) Gold 7505 @ ]
CPUID 80000004: 30302E32-007A4847-00000000-00000000 [2.00GHz]
CPUID 80000005: 00000000-00000000-00000000-00000000 [L1D: 0 KB / L1I: 0 KB]
CPUID 80000006: 00000000-00000000-01007040-00000000 [L2: 256 KB] / L3: 0 KB]
CPUID 80000007: 00000000-00000000-00000000-00000100
CPUID 80000008: 00003027-00000000-00000000-00000000

L1    Data Cache:    48 KB, 12-way Associative, 64-byte Line
L1  Instr. Cache:    32 KB,  8-way Associative, 64-byte Line
L2 Unified Cache:  1280 KB, 20-way Associative, 64-byte Line
L3 Unified Cache:     4 MB,  8-way Associative, 64-byte Line

------[ CPUID Registers / Logical CPU #3 ]------

allcpu: Package 0 / Core 1 / Thread 1: Valid, Virtual

CPUID 00000000: 0000001B-756E6547-6C65746E-49656E69 [GenuineIntel]
CPUID 00000001: 000806C1-03100800-7FFAFBBF-BFEBFBFF
CPUID 00000002: 00FEFF01-000000F0-00000000-00000000
CPUID 00000003: 00000000-00000000-00000000-00000000
CPUID 00000004: 1C004121-02C0003F-0000003F-00000000 [SL 00] [L1D: 48 KB]
CPUID 00000004: 1C004122-01C0003F-0000003F-00000000 [SL 01] [L1I: 32 KB]
CPUID 00000004: 1C004143-04C0003F-000003FF-00000000 [SL 02] [L2U: 1280 KB]
CPUID 00000004: 1C03C163-01C0003F-00001FFF-00000004 [SL 03] [L3U: 4 MB]
CPUID 00000005: 00000040-00000040-00000003-11121020
CPUID 00000006: 0017EFF7-00000002-00000009-00000000
CPUID 00000007: 00000000-F3BFA7EB-18C05FCE-FC100510 [SL 00]
CPUID 00000008: 00000000-00000000-00000000-00000000
CPUID 00000009: 00000000-00000000-00000000-00000000
CPUID 0000000A: 08300805-00000000-0000000F-00008604
CPUID 0000000B: 00000001-00000002-00000100-00000003 [SL 00]
CPUID 0000000B: 00000004-00000004-00000201-00000003 [SL 01]
CPUID 0000000C: 00000000-00000000-00000000-00000000
CPUID 0000000D: 000002E7-00000A80-00000A88-00000000 [SL 00] [x87]
CPUID 0000000D: 0000000F-00000A10-00003900-00000000 [SL 01] [SSE]
CPUID 0000000D: 00000100-00000240-00000000-00000000 [SL 02] [AVX]
CPUID 0000000D: 00000040-00000440-00000000-00000000 [SL 05] [AVX-512 Opmask]
CPUID 0000000D: 00000200-00000480-00000000-00000000 [SL 06] [AVX-512 Hi256]
CPUID 0000000D: 00000400-00000680-00000000-00000000 [SL 07] [AVX-512 Hi16]
CPUID 0000000D: 00000080-00000000-00000001-00000000 [SL 08] [PT]
CPUID 0000000D: 00000008-00000A80-00000000-00000000 [SL 09] [PKRU]
CPUID 0000000D: 00000010-00000000-00000001-00000000 [SL 0B]
CPUID 0000000D: 00000018-00000000-00000001-00000000 [SL 0C]
CPUID 0000000D: 00000008-00000000-00000001-00000000 [SL 0D]
CPUID 0000000E: 00000000-00000000-00000000-00000000
CPUID 0000000F: 00000000-00000000-00000000-00000000 [SL 00]
CPUID 0000000F: 00000000-00000000-00000000-00000000 [SL 01]
CPUID 00000010: 00000000-00000004-00000000-00000000 [SL 00]
CPUID 00000010: 00000000-00000000-00000000-00000000 [SL 01]
CPUID 00000011: 00000000-00000000-00000000-00000000
CPUID 00000012: 00000000-00000000-00000000-00000000 [SL 00]
CPUID 00000012: 00000000-00000000-00000000-00000000 [SL 01]
CPUID 00000013: 00000000-00000000-00000000-00000000
CPUID 00000014: 00000001-0000004F-00000007-00000000 [SL 00]
CPUID 00000014: 02490002-003F1FFF-00000000-00000000 [SL 01]
CPUID 00000015: 00000002-00000068-0249F000-00000000 [52.00x / 38400000]
CPUID 00000016: 000007D0-00000DAC-00000064-00000000 [2000 / 3500 / 100]
CPUID 00000017: 00000000-00000000-00000000-00000000 [SL 00]
CPUID 00000018: 00000008-00000000-00000000-00000000 [SL 00]
CPUID 00000018: 00000000-00080001-00000010-00004022 [SL 01]
CPUID 00000018: 00000000-00080006-00000002-00004022 [SL 02]
CPUID 00000018: 00000000-0010000F-00000001-00004125 [SL 03]
CPUID 00000018: 00000000-00040001-00000010-00004024 [SL 04]
CPUID 00000018: 00000000-00040006-00000008-00004024 [SL 05]
CPUID 00000018: 00000000-00080008-00000001-00004124 [SL 06]
CPUID 00000018: 00000000-00080007-00000080-00004043 [SL 07]
CPUID 00000018: 00000000-00080009-00000080-00004043 [SL 08]
CPUID 00000019: 00000007-00000014-00000003-00000000
CPUID 0000001A: 00000000-00000000-00000000-00000000
CPUID 0000001B: 00000000-00000000-00000000-00000000
CPUID 80000000: 80000008-00000000-00000000-00000000
CPUID 80000001: 00000000-00000000-00000121-2C100000
CPUID 80000002: 65746E49-2952286C-6E655020-6D756974 [Intel(R) Pentium]
CPUID 80000003: 20295228-646C6F47-30353720-20402035 [(R) Gold 7505 @ ]
CPUID 80000004: 30302E32-007A4847-00000000-00000000 [2.00GHz]
CPUID 80000005: 00000000-00000000-00000000-00000000 [L1D: 0 KB / L1I: 0 KB]
CPUID 80000006: 00000000-00000000-01007040-00000000 [L2: 256 KB] / L3: 0 KB]
CPUID 80000007: 00000000-00000000-00000000-00000100
CPUID 80000008: 00003027-00000000-00000000-00000000

L1    Data Cache:    48 KB, 12-way Associative, 64-byte Line
L1  Instr. Cache:    32 KB,  8-way Associative, 64-byte Line
L2 Unified Cache:  1280 KB, 20-way Associative, 64-byte Line
L3 Unified Cache:     4 MB,  8-way Associative, 64-byte Line

------[ All CPUs ]------

CPU   0: APICID    0 / Package 0 / Core   0 / Thread 0: Valid
CPU   1: APICID    1 / Package 0 / Core   0 / Thread 1: Valid, Virtual
CPU   2: APICID    2 / Package 0 / Core   1 / Thread 0: Valid
CPU   3: APICID    3 / Package 0 / Core   1 / Thread 1: Valid, Virtual

------[ MSR Registers / Logical CPU #0 ]------

MSR 00000017: 001C-0000-0000-0000 [PlatID = 7]
MSR 0000001B: 0000-0000-FEE0-0D00
MSR 00000035: 0000-0000-0002-0004
MSR 00000048: 0000-0000-0000-0001
MSR 00000049: < FAILED >
MSR 0000008B: 0000-0066-0000-0000
MSR 000000CE: 0004-0439-F081-1400 [eD = 0]
MSR 000000E7: 0000-0012-497F-84DC [S200]
MSR 000000E7: 0000-0012-49CC-945C [S200]
MSR 000000E7: 0000-0012-4FBF-9530
MSR 000000E8: 0000-001B-5038-C0DB [S200]
MSR 000000E8: 0000-001B-5062-A488 [S200]
MSR 000000E8: 0000-001B-5143-FA30
MSR 0000010A: 0000-0000-0000-006B
MSR 0000010B: < FAILED >
MSR 00000194: 0000-0000-0011-0000
MSR 00000198: 0000-1600-0000-0F00 [S200]
MSR 00000198: 0000-1599-0000-0F00 [S200]
MSR 00000198: 0000-1599-0000-0E00
MSR 00000199: 0000-0000-0000-2300
MSR 0000019A: 0000-0000-0000-0000
MSR 0000019B: 0000-0000-0000-0010
MSR 0000019C: 0000-0000-8831-8000 [S200]
MSR 0000019C: 0000-0000-8831-8000 [S200]
MSR 0000019C: 0000-0000-8831-8000
MSR 0000019D: 0000-0000-0000-0000
MSR 000001A0: 0000-0000-0085-0089
MSR 000001A2: 0000-0000-8564-0000
MSR 000001A4: 0000-0000-0000-0000
MSR 000001AA: 0000-0000-0040-1CC0
MSR 000001AC: < FAILED >
MSR 000001AD: 2222-2222-2222-2223
MSR 000001B0: 0000-0000-0000-0006
MSR 000001B1: 0000-0000-882E-0000
MSR 000001B2: 0000-0000-0000-0000
MSR 000001FC: 0000-0000-0024-005B
MSR 00000300: < FAILED >
MSR 0000030A: 0000-0000-0000-0000 [S200]
MSR 0000030A: 0000-0000-0000-0000 [S200]
MSR 0000030A: 0000-0000-0000-0000
MSR 0000030B: 0000-0000-0000-0000 [S200]
MSR 0000030B: 0000-0000-0000-0000 [S200]
MSR 0000030B: 0000-0000-0000-0000
MSR 00000480: 01DA-0500-0000-0013
MSR 00000481: 0000-00FF-0000-0016
MSR 00000482: FFFB-FFFE-0401-E172
MSR 00000483: 137F-FFFF-0003-6DFF
MSR 00000484: 0016-FFFF-0000-11FF
MSR 00000485: 0000-0000-7004-C1E7
MSR 00000486: 0000-0000-8000-0021
MSR 00000487: 0000-0000-FFFF-FFFF
MSR 00000488: 0000-0000-0000-2000
MSR 00000489: 0000-0000-00FF-2FFF
MSR 0000048A: 0000-0000-0000-002E
MSR 0000048B: 035F-3FFF-0000-0000
MSR 0000048C: 0000-0F01-06F3-4141
MSR 0000048D: 0000-00FF-0000-0016
MSR 0000048E: FFFB-FFFE-0400-6172
MSR 0000048F: 137F-FFFF-0003-6DFB
MSR 00000490: 0016-FFFF-0000-11FB
MSR 00000601: 0000-0000-0000-0238
MSR 00000602: < FAILED >
MSR 00000603: 0036-0000-0036-3636
MSR 00000604: < FAILED >
MSR 00000606: 0000-0000-000A-0E03
MSR 0000060A: 0000-0000-0000-0000
MSR 0000060B: 0000-0000-0000-0000
MSR 0000060C: 0000-0000-0000-0000
MSR 0000060D: 0000-0017-134B-E934
MSR 00000610: 0042-8130-00DD-8078
MSR 00000611: 0000-0000-00CC-759A [S200]
MSR 00000611: 0000-0000-00CC-7E4E [S200]
MSR 00000611: 0000-0000-00CC-91AE
MSR 00000613: 0000-0000-0000-0000
MSR 00000614: 0000-0000-0000-0078
MSR 00000618: 0000-0000-0000-0000
MSR 00000619: 0000-0000-0000-0000 [S200]
MSR 00000619: 0000-0000-0000-0000 [S200]
MSR 00000619: 0000-0000-0000-0000
MSR 0000061B: 0000-0000-0000-0000
MSR 0000061C: < FAILED >
MSR 0000061E: < FAILED >
MSR 00000620: 0000-0000-0000-0421
MSR 00000621: 0000-0000-1561-000D
MSR 00000638: 0000-0000-0000-0000
MSR 00000639: 0000-0000-004D-D697 [S200]
MSR 00000639: 0000-0000-004D-D6FF [S200]
MSR 00000639: 0000-0000-004D-D75E
MSR 0000063A: 0000-0000-0000-0009
MSR 0000063B: < FAILED >
MSR 00000640: 0000-0000-0000-0000
MSR 00000641: 0000-0000-0002-AB0F [S200]
MSR 00000641: 0000-0000-0002-AB25 [S200]
MSR 00000641: 0000-0000-0002-AB3D
MSR 00000642: 0000-0000-0000-000D
MSR 00000648: 0000-0000-0000-0014
MSR 00000649: 0000-0000-0000-0000
MSR 0000064A: 0000-0000-0000-0000
MSR 0000064B: 0000-0000-8000-0000
MSR 0000064C: 0000-0000-0000-0000
MSR 00000690: 0000-0000-0000-0000
MSR 000006B0: 0000-0000-0000-0000
MSR 000006B1: 0000-0000-0000-0000
MSR 00000770: 0000-0000-0000-0001
MSR 00000771: 0000-0000-010F-1423
MSR 00000772: 0000-0000-8000-FF01
MSR 00000773: 0000-0000-0000-0005
MSR 00000774: 0000-019E-5400-2301
MSR 00000777: 0000-0000-0000-0004
MSR 00000832: 0000-0000-0003-00D1
MSR 00000838: 0000-0000-0000-0000
MSR 00000839: 0000-0000-0000-0000
MSR 0000083E: 0000-0000-0000-000A

------[ MSR Registers / Logical CPU #1 ]------

MSR 00000017: 001C-0000-0000-0000 [PlatID = 7]
MSR 0000001B: 0000-0000-FEE0-0C00
MSR 00000035: 0000-0000-0002-0004
MSR 00000048: 0000-0000-0000-0001
MSR 00000049: < FAILED >
MSR 0000008B: 0000-0066-0000-0000
MSR 000000CE: 0004-0439-F081-1400 [eD = 0]
MSR 000000E7: 0000-000B-C5F0-4300
MSR 000000E8: 0000-0012-1339-9E81
MSR 0000010A: 0000-0000-0000-006B
MSR 0000010B: < FAILED >
MSR 00000194: 0000-0000-0011-0000
MSR 00000198: 0000-1D33-0000-2300
MSR 00000199: 0000-0000-0000-2300
MSR 0000019A: 0000-0000-0000-0000
MSR 0000019B: 0000-0000-0000-0010
MSR 0000019C: 0000-0000-882D-8000
MSR 0000019D: 0000-0000-0000-0000
MSR 000001A0: 0000-0000-0085-0089
MSR 000001A2: 0000-0000-8564-0000
MSR 000001A4: 0000-0000-0000-0000
MSR 000001AA: 0000-0000-0040-1CC0
MSR 000001AC: < FAILED >
MSR 000001AD: 2222-2222-2222-2223
MSR 000001B0: 0000-0000-0000-0006
MSR 000001B1: 0000-0000-882D-0000
MSR 000001B2: 0000-0000-0000-0000
MSR 000001FC: 0000-0000-0024-005B
MSR 00000300: < FAILED >
MSR 0000030A: 0000-0000-0000-0000
MSR 0000030B: 0000-0000-0000-0000
MSR 00000480: 01DA-0500-0000-0013
MSR 00000481: 0000-00FF-0000-0016
MSR 00000482: FFFB-FFFE-0401-E172
MSR 00000483: 137F-FFFF-0003-6DFF
MSR 00000484: 0016-FFFF-0000-11FF
MSR 00000485: 0000-0000-7004-C1E7
MSR 00000486: 0000-0000-8000-0021
MSR 00000487: 0000-0000-FFFF-FFFF
MSR 00000488: 0000-0000-0000-2000
MSR 00000489: 0000-0000-00FF-2FFF
MSR 0000048A: 0000-0000-0000-002E
MSR 0000048B: 035F-3FFF-0000-0000
MSR 0000048C: 0000-0F01-06F3-4141
MSR 0000048D: 0000-00FF-0000-0016
MSR 0000048E: FFFB-FFFE-0400-6172
MSR 0000048F: 137F-FFFF-0003-6DFB
MSR 00000490: 0016-FFFF-0000-11FB
MSR 00000601: 0000-0000-0000-0238
MSR 00000602: < FAILED >
MSR 00000603: 0036-0000-0036-3636
MSR 00000604: < FAILED >
MSR 00000606: 0000-0000-000A-0E03
MSR 0000060A: 0000-0000-0000-0000
MSR 0000060B: 0000-0000-0000-0000
MSR 0000060C: 0000-0000-0000-0000
MSR 0000060D: 0000-0017-1DA9-D04C
MSR 00000610: 0042-8130-00DD-8078
MSR 00000611: 0000-0000-00CC-CA59
MSR 00000613: 0000-0000-0000-0000
MSR 00000614: 0000-0000-0000-0078
MSR 00000618: 0000-0000-0000-0000
MSR 00000619: 0000-0000-0000-0000
MSR 0000061B: 0000-0000-0000-0000
MSR 0000061C: < FAILED >
MSR 0000061E: < FAILED >
MSR 00000620: 0000-0000-0000-0421
MSR 00000621: 0000-0000-1BB5-0021
MSR 00000638: 0000-0000-0000-0000
MSR 00000639: 0000-0000-004D-D876
MSR 0000063A: 0000-0000-0000-0009
MSR 0000063B: < FAILED >
MSR 00000640: 0000-0000-0000-0000
MSR 00000641: 0000-0000-0002-AB4A
MSR 00000642: 0000-0000-0000-000D
MSR 00000648: 0000-0000-0000-0014
MSR 00000649: 0000-0000-0000-0000
MSR 0000064A: 0000-0000-0000-0000
MSR 0000064B: 0000-0000-8000-0000
MSR 0000064C: 0000-0000-0000-0000
MSR 00000690: 0000-0000-0000-0000
MSR 000006B0: 0000-0000-0000-0000
MSR 000006B1: 0000-0000-0000-0000
MSR 00000770: 0000-0000-0000-0001
MSR 00000771: 0000-0000-0110-1423
MSR 00000772: 0000-0000-8000-FF01
MSR 00000773: 0000-0000-0000-0005
MSR 00000774: 0000-019E-5400-2301
MSR 00000777: 0000-0000-0000-0004
MSR 00000832: 0000-0000-0002-00D1
MSR 00000838: 0000-0000-0000-124F
MSR 00000839: 0000-0000-0000-02E3
MSR 0000083E: 0000-0000-0000-000A

------[ MSR Registers / Logical CPU #2 ]------

MSR 00000017: 001C-0000-0000-0000 [PlatID = 7]
MSR 0000001B: 0000-0000-FEE0-0C00
MSR 00000035: 0000-0000-0002-0004
MSR 00000048: 0000-0000-0000-0001
MSR 00000049: < FAILED >
MSR 0000008B: 0000-0066-0000-0000
MSR 000000CE: 0004-0439-F081-1400 [eD = 0]
MSR 000000E7: 0000-000D-EDC1-A840
MSR 000000E8: 0000-0015-0589-0684
MSR 0000010A: 0000-0000-0000-006B
MSR 0000010B: < FAILED >
MSR 00000194: 0000-0000-0011-0000
MSR 00000198: 0000-1D1E-0000-2300
MSR 00000199: 0000-0000-0000-2300
MSR 0000019A: 0000-0000-0000-0000
MSR 0000019B: 0000-0000-0000-0010
MSR 0000019C: 0000-0000-8833-8000
MSR 0000019D: 0000-0000-0000-0000
MSR 000001A0: 0000-0000-0085-0089
MSR 000001A2: 0000-0000-8564-0000
MSR 000001A4: 0000-0000-0000-0000
MSR 000001AA: 0000-0000-0040-1CC0
MSR 000001AC: < FAILED >
MSR 000001AD: 2222-2222-2222-2223
MSR 000001B0: 0000-0000-0000-0006
MSR 000001B1: 0000-0000-882D-0000
MSR 000001B2: 0000-0000-0000-0000
MSR 000001FC: 0000-0000-0024-005B
MSR 00000300: < FAILED >
MSR 0000030A: 0000-0000-0000-0000
MSR 0000030B: 0000-0000-0000-0000
MSR 00000480: 01DA-0500-0000-0013
MSR 00000481: 0000-00FF-0000-0016
MSR 00000482: FFFB-FFFE-0401-E172
MSR 00000483: 137F-FFFF-0003-6DFF
MSR 00000484: 0016-FFFF-0000-11FF
MSR 00000485: 0000-0000-7004-C1E7
MSR 00000486: 0000-0000-8000-0021
MSR 00000487: 0000-0000-FFFF-FFFF
MSR 00000488: 0000-0000-0000-2000
MSR 00000489: 0000-0000-00FF-2FFF
MSR 0000048A: 0000-0000-0000-002E
MSR 0000048B: 035F-3FFF-0000-0000
MSR 0000048C: 0000-0F01-06F3-4141
MSR 0000048D: 0000-00FF-0000-0016
MSR 0000048E: FFFB-FFFE-0400-6172
MSR 0000048F: 137F-FFFF-0003-6DFB
MSR 00000490: 0016-FFFF-0000-11FB
MSR 00000601: 0000-0000-0000-0238
MSR 00000602: < FAILED >
MSR 00000603: 0036-0000-0036-3636
MSR 00000604: < FAILED >
MSR 00000606: 0000-0000-000A-0E03
MSR 0000060A: 0000-0000-0000-0000
MSR 0000060B: 0000-0000-0000-0000
MSR 0000060C: 0000-0000-0000-0000
MSR 0000060D: 0000-0017-1DA9-D04C
MSR 00000610: 0042-8130-00DD-8078
MSR 00000611: 0000-0000-00CC-CA9D
MSR 00000613: 0000-0000-0000-0000
MSR 00000614: 0000-0000-0000-0078
MSR 00000618: 0000-0000-0000-0000
MSR 00000619: 0000-0000-0000-0000
MSR 0000061B: 0000-0000-0000-0000
MSR 0000061C: < FAILED >
MSR 0000061E: < FAILED >
MSR 00000620: 0000-0000-0000-0421
MSR 00000621: 0000-0000-1BB5-0021
MSR 00000638: 0000-0000-0000-0000
MSR 00000639: 0000-0000-004D-D897
MSR 0000063A: 0000-0000-0000-0009
MSR 0000063B: < FAILED >
MSR 00000640: 0000-0000-0000-0000
MSR 00000641: 0000-0000-0002-AB4A
MSR 00000642: 0000-0000-0000-000D
MSR 00000648: 0000-0000-0000-0014
MSR 00000649: 0000-0000-0000-0000
MSR 0000064A: 0000-0000-0000-0000
MSR 0000064B: 0000-0000-8000-0000
MSR 0000064C: 0000-0000-0000-0000
MSR 00000690: 0000-0000-0000-0000
MSR 000006B0: 0000-0000-0000-0000
MSR 000006B1: 0000-0000-0000-0000
MSR 00000770: 0000-0000-0000-0001
MSR 00000771: 0000-0000-0110-1423
MSR 00000772: 0000-0000-8000-FF01
MSR 00000773: 0000-0000-0000-0005
MSR 00000774: 0000-019E-5400-2301
MSR 00000777: 0000-0000-0000-0004
MSR 00000832: 0000-0000-0003-00D1
MSR 00000838: 0000-0000-0000-0000
MSR 00000839: 0000-0000-0000-0000
MSR 0000083E: 0000-0000-0000-000A

------[ MSR Registers / Logical CPU #3 ]------

MSR 00000017: 001C-0000-0000-0000 [PlatID = 7]
MSR 0000001B: 0000-0000-FEE0-0C00
MSR 00000035: 0000-0000-0002-0004
MSR 00000048: 0000-0000-0000-0001
MSR 00000049: < FAILED >
MSR 0000008B: 0000-0066-0000-0000
MSR 000000CE: 0004-0439-F081-1400 [eD = 0]
MSR 000000E7: 0000-000B-5914-31B0
MSR 000000E8: 0000-0011-4BFE-CC17
MSR 0000010A: 0000-0000-0000-006B
MSR 0000010B: < FAILED >
MSR 00000194: 0000-0000-0011-0000
MSR 00000198: 0000-1D1E-0000-2300
MSR 00000199: 0000-0000-0000-2300
MSR 0000019A: 0000-0000-0000-0000
MSR 0000019B: 0000-0000-0000-0010
MSR 0000019C: 0000-0000-8831-8000
MSR 0000019D: 0000-0000-0000-0000
MSR 000001A0: 0000-0000-0085-0089
MSR 000001A2: 0000-0000-8564-0000
MSR 000001A4: 0000-0000-0000-0000
MSR 000001AA: 0000-0000-0040-1CC0
MSR 000001AC: < FAILED >
MSR 000001AD: 2222-2222-2222-2223
MSR 000001B0: 0000-0000-0000-0006
MSR 000001B1: 0000-0000-882D-0000
MSR 000001B2: 0000-0000-0000-0000
MSR 000001FC: 0000-0000-0024-005B
MSR 00000300: < FAILED >
MSR 0000030A: 0000-0000-0000-0000
MSR 0000030B: 0000-0000-0000-0000
MSR 00000480: 01DA-0500-0000-0013
MSR 00000481: 0000-00FF-0000-0016
MSR 00000482: FFFB-FFFE-0401-E172
MSR 00000483: 137F-FFFF-0003-6DFF
MSR 00000484: 0016-FFFF-0000-11FF
MSR 00000485: 0000-0000-7004-C1E7
MSR 00000486: 0000-0000-8000-0021
MSR 00000487: 0000-0000-FFFF-FFFF
MSR 00000488: 0000-0000-0000-2000
MSR 00000489: 0000-0000-00FF-2FFF
MSR 0000048A: 0000-0000-0000-002E
MSR 0000048B: 035F-3FFF-0000-0000
MSR 0000048C: 0000-0F01-06F3-4141
MSR 0000048D: 0000-00FF-0000-0016
MSR 0000048E: FFFB-FFFE-0400-6172
MSR 0000048F: 137F-FFFF-0003-6DFB
MSR 00000490: 0016-FFFF-0000-11FB
MSR 00000601: 0000-0000-0000-0238
MSR 00000602: < FAILED >
MSR 00000603: 0036-0000-0036-3636
MSR 00000604: < FAILED >
MSR 00000606: 0000-0000-000A-0E03
MSR 0000060A: 0000-0000-0000-0000
MSR 0000060B: 0000-0000-0000-0000
MSR 0000060C: 0000-0000-0000-0000
MSR 0000060D: 0000-0017-1DA9-D04C
MSR 00000610: 0042-8130-00DD-8078
MSR 00000611: 0000-0000-00CC-CA9D
MSR 00000613: 0000-0000-0000-0000
MSR 00000614: 0000-0000-0000-0078
MSR 00000618: 0000-0000-0000-0000
MSR 00000619: 0000-0000-0000-0000
MSR 0000061B: 0000-0000-0000-0000
MSR 0000061C: < FAILED >
MSR 0000061E: < FAILED >
MSR 00000620: 0000-0000-0000-0421
MSR 00000621: 0000-0000-1BB5-0021
MSR 00000638: 0000-0000-0000-0000
MSR 00000639: 0000-0000-004D-D89D
MSR 0000063A: 0000-0000-0000-0009
MSR 0000063B: < FAILED >
MSR 00000640: 0000-0000-0000-0000
MSR 00000641: 0000-0000-0002-AB4A
MSR 00000642: 0000-0000-0000-000D
MSR 00000648: 0000-0000-0000-0014
MSR 00000649: 0000-0000-0000-0000
MSR 0000064A: 0000-0000-0000-0000
MSR 0000064B: 0000-0000-8000-0000
MSR 0000064C: 0000-0000-0000-0000
MSR 00000690: 0000-0000-0000-0000
MSR 000006B0: 0000-0000-0000-0000
MSR 000006B1: 0000-0000-0000-0000
MSR 00000770: 0000-0000-0000-0001
MSR 00000771: 0000-0000-0110-1423
MSR 00000772: 0000-0000-8000-FF01
MSR 00000773: 0000-0000-0000-0005
MSR 00000774: 0000-019E-5400-2301
MSR 00000777: 0000-0000-0000-0004
MSR 00000832: 0000-0000-0003-00D1
MSR 00000838: 0000-0000-0000-0000
MSR 00000839: 0000-0000-0000-0000
MSR 0000083E: 0000-0000-0000-000A
