------[ Versions ]------

Program Version : EVEREST v4.60.1629 Beta
BenchDLL Version: 2.4.257.0

------[ CPU Info ]------

CPU Type           : QuadCore Intel Xeon X3210, 2133 MHz (8 x 267)
CPU Alias          : Kentsfield
CPU Platform       : LGA775
CPU Stepping       : B3
Instruction Set    : x86, x86-64, MMX, SSE, SSE2, SSE3, SSSE3
CPUID Manufacturer : GenuineIntel
CPUID CPU Name     : Intel(R) Xeon(R) CPU X3210 @ 2.13GHz
CPUID Revision     : 000006F7h
IA Brand ID        : 00h  (Unknown)
Platform ID        : 2Ah  (LGA775)

------[ Logical CPU #0 ]------

allcpu: Valid

CPUID 00000000: 0000000A-756E6547-6C65746E-49656E69
CPUID 00000001: 000006F7-00040800-0000E3BD-BFEBFBFF
CPUID 00000002: 05B0B101-005657F0-00000000-2CB43049
CPUID 00000003: 00000000-00000000-00000000-00000000
CPUID 00000004: 0C000121-01C0003F-0000003F-00000001
CPUID 00000004: 0C000122-01C0003F-0000003F-00000001
CPUID 00000004: 0C004143-03C0003F-00000FFF-00000001
CPUID 00000005: 00000040-00000040-00000003-00000020
CPUID 00000006: 00000001-00000002-00000001-00000000
CPUID 00000007: 00000000-00000000-00000000-00000000
CPUID 00000008: 00000400-00000000-00000000-00000000
CPUID 00000009: 00000000-00000000-00000000-00000000
CPUID 0000000A: 07280202-00000000-00000000-00000000
CPUID 80000000: 80000008-00000000-00000000-00000000
CPUID 80000001: 00000000-00000000-00000001-20100000
CPUID 80000002: 65746E49-2952286C-6F655820-2952286E
CPUID 80000003: 55504320-20202020-20202020-58202020
CPUID 80000004: 30313233-20402020-33312E32-007A4847
CPUID 80000005: 00000000-00000000-00000000-00000000
CPUID 80000006: 00000000-00000000-10008040-00000000
CPUID 80000007: 00000000-00000000-00000000-00000000
CPUID 80000008: 00003024-00000000-00000000-00000000

L1    Data Cache:     32 KB,  8-way Associative, 64-byte Line
L1  Instr. Cache:     32 KB,  8-way Associative, 64-byte Line
L2 Unified Cache:   4096 KB, 16-way Associative, 64-byte Line

------[ Logical CPU #1 ]------

allcpu: Valid

CPUID 00000000: 0000000A-756E6547-6C65746E-49656E69
CPUID 00000001: 000006F7-02040800-0000E3BD-BFEBFBFF
CPUID 00000002: 05B0B101-005657F0-00000000-2CB43049
CPUID 00000003: 00000000-00000000-00000000-00000000
CPUID 00000004: 0C000121-01C0003F-0000003F-00000001
CPUID 00000004: 0C000122-01C0003F-0000003F-00000001
CPUID 00000004: 0C004143-03C0003F-00000FFF-00000001
CPUID 00000005: 00000040-00000040-00000003-00000020
CPUID 00000006: 00000001-00000002-00000001-00000000
CPUID 00000007: 00000000-00000000-00000000-00000000
CPUID 00000008: 00000400-00000000-00000000-00000000
CPUID 00000009: 00000000-00000000-00000000-00000000
CPUID 0000000A: 07280202-00000000-00000000-00000000
CPUID 80000000: 80000008-00000000-00000000-00000000
CPUID 80000001: 00000000-00000000-00000001-20100000
CPUID 80000002: 65746E49-2952286C-6F655820-2952286E
CPUID 80000003: 55504320-20202020-20202020-58202020
CPUID 80000004: 30313233-20402020-33312E32-007A4847
CPUID 80000005: 00000000-00000000-00000000-00000000
CPUID 80000006: 00000000-00000000-10008040-00000000
CPUID 80000007: 00000000-00000000-00000000-00000000
CPUID 80000008: 00003024-00000000-00000000-00000000

L1    Data Cache:     32 KB,  8-way Associative, 64-byte Line
L1  Instr. Cache:     32 KB,  8-way Associative, 64-byte Line
L2 Unified Cache:   4096 KB, 16-way Associative, 64-byte Line

------[ Logical CPU #2 ]------

allcpu: Valid

CPUID 00000000: 0000000A-756E6547-6C65746E-49656E69
CPUID 00000001: 000006F7-01040800-0000E3BD-BFEBFBFF
CPUID 00000002: 05B0B101-005657F0-00000000-2CB43049
CPUID 00000003: 00000000-00000000-00000000-00000000
CPUID 00000004: 0C000121-01C0003F-0000003F-00000001
CPUID 00000004: 0C000122-01C0003F-0000003F-00000001
CPUID 00000004: 0C004143-03C0003F-00000FFF-00000001
CPUID 00000005: 00000040-00000040-00000003-00000020
CPUID 00000006: 00000001-00000002-00000001-00000000
CPUID 00000007: 00000000-00000000-00000000-00000000
CPUID 00000008: 00000400-00000000-00000000-00000000
CPUID 00000009: 00000000-00000000-00000000-00000000
CPUID 0000000A: 07280202-00000000-00000000-00000000
CPUID 80000000: 80000008-00000000-00000000-00000000
CPUID 80000001: 00000000-00000000-00000001-20100000
CPUID 80000002: 65746E49-2952286C-6F655820-2952286E
CPUID 80000003: 55504320-20202020-20202020-58202020
CPUID 80000004: 30313233-20402020-33312E32-007A4847
CPUID 80000005: 00000000-00000000-00000000-00000000
CPUID 80000006: 00000000-00000000-10008040-00000000
CPUID 80000007: 00000000-00000000-00000000-00000000
CPUID 80000008: 00003024-00000000-00000000-00000000

L1    Data Cache:     32 KB,  8-way Associative, 64-byte Line
L1  Instr. Cache:     32 KB,  8-way Associative, 64-byte Line
L2 Unified Cache:   4096 KB, 16-way Associative, 64-byte Line

------[ Logical CPU #3 ]------

allcpu: Valid

CPUID 00000000: 0000000A-756E6547-6C65746E-49656E69
CPUID 00000001: 000006F7-03040800-0000E3BD-BFEBFBFF
CPUID 00000002: 05B0B101-005657F0-00000000-2CB43049
CPUID 00000003: 00000000-00000000-00000000-00000000
CPUID 00000004: 0C000121-01C0003F-0000003F-00000001
CPUID 00000004: 0C000122-01C0003F-0000003F-00000001
CPUID 00000004: 0C004143-03C0003F-00000FFF-00000001
CPUID 00000005: 00000040-00000040-00000003-00000020
CPUID 00000006: 00000001-00000002-00000001-00000000
CPUID 00000007: 00000000-00000000-00000000-00000000
CPUID 00000008: 00000400-00000000-00000000-00000000
CPUID 00000009: 00000000-00000000-00000000-00000000
CPUID 0000000A: 07280202-00000000-00000000-00000000
CPUID 80000000: 80000008-00000000-00000000-00000000
CPUID 80000001: 00000000-00000000-00000001-20100000
CPUID 80000002: 65746E49-2952286C-6F655820-2952286E
CPUID 80000003: 55504320-20202020-20202020-58202020
CPUID 80000004: 30313233-20402020-33312E32-007A4847
CPUID 80000005: 00000000-00000000-00000000-00000000
CPUID 80000006: 00000000-00000000-10008040-00000000
CPUID 80000007: 00000000-00000000-00000000-00000000
CPUID 80000008: 00003024-00000000-00000000-00000000

L1    Data Cache:     32 KB,  8-way Associative, 64-byte Line
L1  Instr. Cache:     32 KB,  8-way Associative, 64-byte Line
L2 Unified Cache:   4096 KB, 16-way Associative, 64-byte Line

------[ MSR Registers ]------

MSR 00000017: 0010-0000-8044-0822 [PlatID = 4]
MSR 0000001B: 0000-0000-FEE0-0900
MSR 0000002A: 0000-0000-4208-0000
MSR 0000008B: 0000-0066-0000-0000
MSR 000000CD: 0000-0000-0000-0800
MSR 000000CE: 001B-0822-7F7F-071B
MSR 000000E7: 0000-0000-87C1-BC18
MSR 000000E8: 0000-0000-87C1-E1A0
MSR 000000EE: 0000-0000-817D-4B00
MSR 0000011E: 0000-0000-BE70-2109
MSR 00000198: 0822-0822-0600-0822
MSR 00000199: 0000-0000-0000-0822
MSR 0000019A: 0000-0000-0000-0002
MSR 0000019B: 0000-0000-0000-0000
MSR 0000019C: 0000-0000-8835-0000
MSR 0000019D: 0000-0000-0000-061B
MSR 000001A0: 0000-0040-6097-2489

PerformanceFrequency = 2133460000

Tjmax Temperature = 90 Celsius
