------[ CPUID Registers / Logical CPU #0 ]------

allcpu: Package 0 / Core 0 / Thread 0: Valid

CPUID 00000000: 00000018-756E6547-6C65746E-49656E69 [GenuineIntel]
CPUID 00000001: 000706A8-00400800-4FF8EBBF-BFEBFBFF
CPUID 00000002: 00FEFF01-00000000-00000000-00000000
CPUID 00000003: 00000000-00000000-00000000-00000000
CPUID 00000004: 7C000121-0140003F-0000003F-00000001 [SL 00] [L1D: 24 KB]
CPUID 00000004: 7C000122-01C0003F-0000003F-00000001 [SL 01] [L1I: 32 KB]
CPUID 00000004: 7C01C143-03C0003F-00000FFF-00000001 [SL 02] [L2U: 4 MB]
CPUID 00000005: 00000040-00000040-00000003-11242020
CPUID 00000006: 00000057-00000002-00000001-00000000
CPUID 00000007: 00000000-2294E287-40400004-AC000400
CPUID 00000008: 00000000-00000000-00000000-00000000
CPUID 00000009: 00000000-00000000-00000000-00000000
CPUID 0000000A: 07300404-00000000-00000000-00008603
CPUID 0000000B: 00000001-00000001-00000100-00000000 [SL 00]
CPUID 0000000B: 00000006-00000004-00000201-00000000 [SL 01]
CPUID 0000000C: 00000000-00000000-00000000-00000000
CPUID 0000000D: 0000001B-00000440-00000440-00000000 [SL 00] [x87]
CPUID 0000000D: 0000000F-00000340-00000100-00000000 [SL 01] [SSE]
CPUID 0000000D: 00000040-000003C0-00000000-00000000 [SL 03] [MPX BNDREGS]
CPUID 0000000D: 00000040-00000400-00000000-00000000 [SL 04] [MPX BNDCSR]
CPUID 0000000D: 00000080-00000000-00000001-00000000 [SL 08] [PT]
CPUID 0000000E: 00000000-00000000-00000000-00000000
CPUID 0000000F: 00000000-00000000-00000000-00000000 [SL 00]
CPUID 0000000F: 00000000-00000000-00000000-00000000 [SL 01]
CPUID 00000010: 00000000-00000004-00000000-00000000 [SL 00]
CPUID 00000010: 00000000-00000000-00000000-00000000 [SL 01]
CPUID 00000011: 00000000-00000000-00000000-00000000
CPUID 00000012: 00000000-00000000-00000000-00000000 [SL 00]
CPUID 00000012: 00000000-00000000-00000000-00000000 [SL 01]
CPUID 00000013: 00000000-00000000-00000000-00000000
CPUID 00000014: 00000001-0000003F-80000007-00000000 [SL 00]
CPUID 00000014: 02490002-003FFFFF-00000000-00000000 [SL 01]
CPUID 00000015: 00000003-000000AB-0124F800-00000000 [57.00x / 19200000]
CPUID 00000016: 00000000-00000000-00000000-00000000 [0 / 0 / 0]
CPUID 00000017: 00000000-00000000-00000000-00000000 [SL 00]
CPUID 00000018: 00000004-00000000-00000000-00000000 [SL 00]
CPUID 00000018: 00000000-00200001-00000001-00000121 [SL 01]
CPUID 00000018: 00000000-00040001-00000080-00000043 [SL 02]
CPUID 00000018: 00000000-00040006-00000008-00000043 [SL 03]
CPUID 00000018: 00000000-00300001-00000001-00000122 [SL 04]
CPUID 80000000: 80000008-00000000-00000000-00000000
CPUID 80000001: 00000000-00000000-00000101-2C100000
CPUID 80000002: 65746E49-2952286C-6E655020-6D756974 [Intel(R) Pentium]
CPUID 80000003: 20295228-766C6953-4E207265-30333035 [(R) Silver N5030]
CPUID 80000004: 55504320-31204020-4730312E-00007A48 [ CPU @ 1.10GHz]
CPUID 80000005: 00000000-00000000-00000000-00000000 [L1D: 0 KB / L1I: 0 KB]
CPUID 80000006: 00000000-00000000-10008040-00000000 [L2: 4096 KB] / L3: 0 KB]
CPUID 80000007: 00000000-00000000-00000000-00000100
CPUID 80000008: 00003027-00000000-00000000-00000000

L1    Data Cache:    24 KB,  6-way Associative, 64-byte Line
L1  Instr. Cache:    32 KB,  8-way Associative, 64-byte Line
L2 Unified Cache:     4 MB, 16-way Associative, 64-byte Line

------[ CPUID Registers / Logical CPU #1 ]------

allcpu: Package 0 / Core 1 / Thread 0: Valid

CPUID 00000000: 00000018-756E6547-6C65746E-49656E69 [GenuineIntel]
CPUID 00000001: 000706A8-02400800-4FF8EBBF-BFEBFBFF
CPUID 00000002: 00FEFF01-00000000-00000000-00000000
CPUID 00000003: 00000000-00000000-00000000-00000000
CPUID 00000004: 7C000121-0140003F-0000003F-00000001 [SL 00] [L1D: 24 KB]
CPUID 00000004: 7C000122-01C0003F-0000003F-00000001 [SL 01] [L1I: 32 KB]
CPUID 00000004: 7C01C143-03C0003F-00000FFF-00000001 [SL 02] [L2U: 4 MB]
CPUID 00000005: 00000040-00000040-00000003-11242020
CPUID 00000006: 00000057-00000002-00000001-00000000
CPUID 00000007: 00000000-2294E287-40400004-AC000400
CPUID 00000008: 00000000-00000000-00000000-00000000
CPUID 00000009: 00000000-00000000-00000000-00000000
CPUID 0000000A: 07300404-00000000-00000000-00008603
CPUID 0000000B: 00000001-00000001-00000100-00000002 [SL 00]
CPUID 0000000B: 00000006-00000004-00000201-00000002 [SL 01]
CPUID 0000000C: 00000000-00000000-00000000-00000000
CPUID 0000000D: 0000001B-00000440-00000440-00000000 [SL 00] [x87]
CPUID 0000000D: 0000000F-00000340-00000100-00000000 [SL 01] [SSE]
CPUID 0000000D: 00000040-000003C0-00000000-00000000 [SL 03] [MPX BNDREGS]
CPUID 0000000D: 00000040-00000400-00000000-00000000 [SL 04] [MPX BNDCSR]
CPUID 0000000D: 00000080-00000000-00000001-00000000 [SL 08] [PT]
CPUID 0000000E: 00000000-00000000-00000000-00000000
CPUID 0000000F: 00000000-00000000-00000000-00000000 [SL 00]
CPUID 0000000F: 00000000-00000000-00000000-00000000 [SL 01]
CPUID 00000010: 00000000-00000004-00000000-00000000 [SL 00]
CPUID 00000010: 00000000-00000000-00000000-00000000 [SL 01]
CPUID 00000011: 00000000-00000000-00000000-00000000
CPUID 00000012: 00000000-00000000-00000000-00000000 [SL 00]
CPUID 00000012: 00000000-00000000-00000000-00000000 [SL 01]
CPUID 00000013: 00000000-00000000-00000000-00000000
CPUID 00000014: 00000001-0000003F-80000007-00000000 [SL 00]
CPUID 00000014: 02490002-003FFFFF-00000000-00000000 [SL 01]
CPUID 00000015: 00000003-000000AB-0124F800-00000000 [57.00x / 19200000]
CPUID 00000016: 00000000-00000000-00000000-00000000 [0 / 0 / 0]
CPUID 00000017: 00000000-00000000-00000000-00000000 [SL 00]
CPUID 00000018: 00000004-00000000-00000000-00000000 [SL 00]
CPUID 00000018: 00000000-00200001-00000001-00000121 [SL 01]
CPUID 00000018: 00000000-00040001-00000080-00000043 [SL 02]
CPUID 00000018: 00000000-00040006-00000008-00000043 [SL 03]
CPUID 00000018: 00000000-00300001-00000001-00000122 [SL 04]
CPUID 80000000: 80000008-00000000-00000000-00000000
CPUID 80000001: 00000000-00000000-00000101-2C100000
CPUID 80000002: 65746E49-2952286C-6E655020-6D756974 [Intel(R) Pentium]
CPUID 80000003: 20295228-766C6953-4E207265-30333035 [(R) Silver N5030]
CPUID 80000004: 55504320-31204020-4730312E-00007A48 [ CPU @ 1.10GHz]
CPUID 80000005: 00000000-00000000-00000000-00000000 [L1D: 0 KB / L1I: 0 KB]
CPUID 80000006: 00000000-00000000-10008040-00000000 [L2: 4096 KB] / L3: 0 KB]
CPUID 80000007: 00000000-00000000-00000000-00000100
CPUID 80000008: 00003027-00000000-00000000-00000000

L1    Data Cache:    24 KB,  6-way Associative, 64-byte Line
L1  Instr. Cache:    32 KB,  8-way Associative, 64-byte Line
L2 Unified Cache:     4 MB, 16-way Associative, 64-byte Line

------[ CPUID Registers / Logical CPU #2 ]------

allcpu: Package 0 / Core 2 / Thread 0: Valid

CPUID 00000000: 00000018-756E6547-6C65746E-49656E69 [GenuineIntel]
CPUID 00000001: 000706A8-04400800-4FF8EBBF-BFEBFBFF
CPUID 00000002: 00FEFF01-00000000-00000000-00000000
CPUID 00000003: 00000000-00000000-00000000-00000000
CPUID 00000004: 7C000121-0140003F-0000003F-00000001 [SL 00] [L1D: 24 KB]
CPUID 00000004: 7C000122-01C0003F-0000003F-00000001 [SL 01] [L1I: 32 KB]
CPUID 00000004: 7C01C143-03C0003F-00000FFF-00000001 [SL 02] [L2U: 4 MB]
CPUID 00000005: 00000040-00000040-00000003-11242020
CPUID 00000006: 00000057-00000002-00000001-00000000
CPUID 00000007: 00000000-2294E287-40400004-AC000400
CPUID 00000008: 00000000-00000000-00000000-00000000
CPUID 00000009: 00000000-00000000-00000000-00000000
CPUID 0000000A: 07300404-00000000-00000000-00008603
CPUID 0000000B: 00000001-00000001-00000100-00000004 [SL 00]
CPUID 0000000B: 00000006-00000004-00000201-00000004 [SL 01]
CPUID 0000000C: 00000000-00000000-00000000-00000000
CPUID 0000000D: 0000001B-00000440-00000440-00000000 [SL 00] [x87]
CPUID 0000000D: 0000000F-00000340-00000100-00000000 [SL 01] [SSE]
CPUID 0000000D: 00000040-000003C0-00000000-00000000 [SL 03] [MPX BNDREGS]
CPUID 0000000D: 00000040-00000400-00000000-00000000 [SL 04] [MPX BNDCSR]
CPUID 0000000D: 00000080-00000000-00000001-00000000 [SL 08] [PT]
CPUID 0000000E: 00000000-00000000-00000000-00000000
CPUID 0000000F: 00000000-00000000-00000000-00000000 [SL 00]
CPUID 0000000F: 00000000-00000000-00000000-00000000 [SL 01]
CPUID 00000010: 00000000-00000004-00000000-00000000 [SL 00]
CPUID 00000010: 00000000-00000000-00000000-00000000 [SL 01]
CPUID 00000011: 00000000-00000000-00000000-00000000
CPUID 00000012: 00000000-00000000-00000000-00000000 [SL 00]
CPUID 00000012: 00000000-00000000-00000000-00000000 [SL 01]
CPUID 00000013: 00000000-00000000-00000000-00000000
CPUID 00000014: 00000001-0000003F-80000007-00000000 [SL 00]
CPUID 00000014: 02490002-003FFFFF-00000000-00000000 [SL 01]
CPUID 00000015: 00000003-000000AB-0124F800-00000000 [57.00x / 19200000]
CPUID 00000016: 00000000-00000000-00000000-00000000 [0 / 0 / 0]
CPUID 00000017: 00000000-00000000-00000000-00000000 [SL 00]
CPUID 00000018: 00000004-00000000-00000000-00000000 [SL 00]
CPUID 00000018: 00000000-00200001-00000001-00000121 [SL 01]
CPUID 00000018: 00000000-00040001-00000080-00000043 [SL 02]
CPUID 00000018: 00000000-00040006-00000008-00000043 [SL 03]
CPUID 00000018: 00000000-00300001-00000001-00000122 [SL 04]
CPUID 80000000: 80000008-00000000-00000000-00000000
CPUID 80000001: 00000000-00000000-00000101-2C100000
CPUID 80000002: 65746E49-2952286C-6E655020-6D756974 [Intel(R) Pentium]
CPUID 80000003: 20295228-766C6953-4E207265-30333035 [(R) Silver N5030]
CPUID 80000004: 55504320-31204020-4730312E-00007A48 [ CPU @ 1.10GHz]
CPUID 80000005: 00000000-00000000-00000000-00000000 [L1D: 0 KB / L1I: 0 KB]
CPUID 80000006: 00000000-00000000-10008040-00000000 [L2: 4096 KB] / L3: 0 KB]
CPUID 80000007: 00000000-00000000-00000000-00000100
CPUID 80000008: 00003027-00000000-00000000-00000000

L1    Data Cache:    24 KB,  6-way Associative, 64-byte Line
L1  Instr. Cache:    32 KB,  8-way Associative, 64-byte Line
L2 Unified Cache:     4 MB, 16-way Associative, 64-byte Line

------[ CPUID Registers / Logical CPU #3 ]------

allcpu: Package 0 / Core 3 / Thread 0: Valid

CPUID 00000000: 00000018-756E6547-6C65746E-49656E69 [GenuineIntel]
CPUID 00000001: 000706A8-06400800-4FF8EBBF-BFEBFBFF
CPUID 00000002: 00FEFF01-00000000-00000000-00000000
CPUID 00000003: 00000000-00000000-00000000-00000000
CPUID 00000004: 7C000121-0140003F-0000003F-00000001 [SL 00] [L1D: 24 KB]
CPUID 00000004: 7C000122-01C0003F-0000003F-00000001 [SL 01] [L1I: 32 KB]
CPUID 00000004: 7C01C143-03C0003F-00000FFF-00000001 [SL 02] [L2U: 4 MB]
CPUID 00000005: 00000040-00000040-00000003-11242020
CPUID 00000006: 00000057-00000002-00000001-00000000
CPUID 00000007: 00000000-2294E287-40400004-AC000400
CPUID 00000008: 00000000-00000000-00000000-00000000
CPUID 00000009: 00000000-00000000-00000000-00000000
CPUID 0000000A: 07300404-00000000-00000000-00008603
CPUID 0000000B: 00000001-00000001-00000100-00000006 [SL 00]
CPUID 0000000B: 00000006-00000004-00000201-00000006 [SL 01]
CPUID 0000000C: 00000000-00000000-00000000-00000000
CPUID 0000000D: 0000001B-00000440-00000440-00000000 [SL 00] [x87]
CPUID 0000000D: 0000000F-00000340-00000100-00000000 [SL 01] [SSE]
CPUID 0000000D: 00000040-000003C0-00000000-00000000 [SL 03] [MPX BNDREGS]
CPUID 0000000D: 00000040-00000400-00000000-00000000 [SL 04] [MPX BNDCSR]
CPUID 0000000D: 00000080-00000000-00000001-00000000 [SL 08] [PT]
CPUID 0000000E: 00000000-00000000-00000000-00000000
CPUID 0000000F: 00000000-00000000-00000000-00000000 [SL 00]
CPUID 0000000F: 00000000-00000000-00000000-00000000 [SL 01]
CPUID 00000010: 00000000-00000004-00000000-00000000 [SL 00]
CPUID 00000010: 00000000-00000000-00000000-00000000 [SL 01]
CPUID 00000011: 00000000-00000000-00000000-00000000
CPUID 00000012: 00000000-00000000-00000000-00000000 [SL 00]
CPUID 00000012: 00000000-00000000-00000000-00000000 [SL 01]
CPUID 00000013: 00000000-00000000-00000000-00000000
CPUID 00000014: 00000001-0000003F-80000007-00000000 [SL 00]
CPUID 00000014: 02490002-003FFFFF-00000000-00000000 [SL 01]
CPUID 00000015: 00000003-000000AB-0124F800-00000000 [57.00x / 19200000]
CPUID 00000016: 00000000-00000000-00000000-00000000 [0 / 0 / 0]
CPUID 00000017: 00000000-00000000-00000000-00000000 [SL 00]
CPUID 00000018: 00000004-00000000-00000000-00000000 [SL 00]
CPUID 00000018: 00000000-00200001-00000001-00000121 [SL 01]
CPUID 00000018: 00000000-00040001-00000080-00000043 [SL 02]
CPUID 00000018: 00000000-00040006-00000008-00000043 [SL 03]
CPUID 00000018: 00000000-00300001-00000001-00000122 [SL 04]
CPUID 80000000: 80000008-00000000-00000000-00000000
CPUID 80000001: 00000000-00000000-00000101-2C100000
CPUID 80000002: 65746E49-2952286C-6E655020-6D756974 [Intel(R) Pentium]
CPUID 80000003: 20295228-766C6953-4E207265-30333035 [(R) Silver N5030]
CPUID 80000004: 55504320-31204020-4730312E-00007A48 [ CPU @ 1.10GHz]
CPUID 80000005: 00000000-00000000-00000000-00000000 [L1D: 0 KB / L1I: 0 KB]
CPUID 80000006: 00000000-00000000-10008040-00000000 [L2: 4096 KB] / L3: 0 KB]
CPUID 80000007: 00000000-00000000-00000000-00000100
CPUID 80000008: 00003027-00000000-00000000-00000000

L1    Data Cache:    24 KB,  6-way Associative, 64-byte Line
L1  Instr. Cache:    32 KB,  8-way Associative, 64-byte Line
L2 Unified Cache:     4 MB, 16-way Associative, 64-byte Line

------[ All CPUs ]------

CPU   0: APICID    0 / Package 0 / Core   0 / Thread 0: Valid
CPU   1: APICID    2 / Package 0 / Core   1 / Thread 0: Valid
CPU   2: APICID    4 / Package 0 / Core   2 / Thread 0: Valid
CPU   3: APICID    6 / Package 0 / Core   3 / Thread 0: Valid

------[ MSR Registers / Logical CPU #0 ]------

MSR 00000017: 0000-0000-0000-0000 [PlatID = 0]
MSR 0000001B: 0000-0000-FEE0-0D00
MSR 0000002A: 0000-0000-0000-0000
MSR 00000035: 0000-0000-0004-0004
MSR 00000048: 0000-0000-0000-0001
MSR 00000049: < FAILED >
MSR 0000008B: 0000-0016-0000-0000
MSR 000000CD: < FAILED >
MSR 000000CE: 0004-0821-F801-0B00 [eD = 0]
MSR 000000E7: 0000-000B-F051-CEF7 [S200]
MSR 000000E7: 0000-000B-F115-E0D3 [S200]
MSR 000000E7: 0000-000B-F182-E4C5
MSR 000000E8: 0000-0014-5A34-0CB0 [S200]
MSR 000000E8: 0000-0014-5BEA-12EC [S200]
MSR 000000E8: 0000-0014-5C17-8856
MSR 000000EE: < FAILED >
MSR 0000010A: 0000-0000-0000-006B
MSR 0000011E: < FAILED >
MSR 00000194: < FAILED >
MSR 00000198: 0000-18CC-0000-0800 [S200]
MSR 00000198: 0000-18CC-0000-0500 [S200]
MSR 00000198: 0000-18CC-0000-0500
MSR 00000199: 0000-0000-0000-0800
MSR 0000019A: 0000-0000-0000-0000
MSR 0000019B: 0000-0000-0000-0010
MSR 0000019C: 0000-0000-8843-0800 [S200]
MSR 0000019C: 0000-0000-8845-0800 [S200]
MSR 0000019C: 0000-0000-8843-0800
MSR 0000019D: 0000-0000-0000-0000
MSR 000001A0: 0000-0000-0085-0089
MSR 000001A2: 0000-0000-0369-0000
MSR 000001A4: 0000-0000-0000-0000
MSR 000001AA: 0000-0000-0040-0000
MSR 000001AC: < FAILED >
MSR 000001AD: 0000-0000-1C1C-1C1F
MSR 000001B0: < FAILED >
MSR 000001B1: 0000-0000-8843-0800
MSR 000001B2: 0000-0000-0000-0000
MSR 000001FC: 0000-0000-0020-005F
MSR 00000300: < FAILED >
MSR 0000030A: 0000-0000-0000-0000 [S200]
MSR 0000030A: 0000-0000-0000-0000 [S200]
MSR 0000030A: 0000-0000-0000-0000
MSR 0000030B: 0000-0000-0000-0000 [S200]
MSR 0000030B: 0000-0000-0000-0000 [S200]
MSR 0000030B: 0000-0000-0000-0000
MSR 00000480: 00DA-0400-0000-0011
MSR 00000481: 0000-00FF-0000-0016
MSR 00000482: FFF9-FFFE-0401-E172
MSR 00000483: 01FF-FFFF-0003-6DFF
MSR 00000484: 0003-FFFF-0000-11FF
MSR 00000485: 0000-0000-6004-C1E7
MSR 00000486: 0000-0000-8000-0021
MSR 00000487: 0000-0000-FFFF-FFFF
MSR 00000488: 0000-0000-0000-2000
MSR 00000489: 0000-0000-0035-2FFF
MSR 0000048A: 0000-0000-0000-002E
MSR 0000048B: 025D-EFFF-0000-0000
MSR 0000048C: 0000-0F01-0673-4141
MSR 0000048D: 0000-00FF-0000-0016
MSR 0000048E: FFF9-FFFE-0400-6172
MSR 0000048F: 01FF-FFFF-0003-6DFB
MSR 00000490: 0003-FFFF-0000-11FB
MSR 00000601: 0000-0000-0000-00C8
MSR 00000602: < FAILED >
MSR 00000603: 0000-0000-0008-FF0B
MSR 00000604: < FAILED >
MSR 00000606: 0000-0000-330A-0E08
MSR 0000060A: 0000-0000-0000-0000
MSR 0000060B: 0000-0000-0000-8893
MSR 0000060C: 0000-0000-0000-8893
MSR 0000060D: 0000-0000-45D0-025D
MSR 00000610: 0000-8F00-00DD-8700
MSR 00000611: 0000-0000-0149-EFB2 [S200]
MSR 00000611: 0000-0000-014A-0AD3 [S200]
MSR 00000611: 0000-0000-014A-24A7
MSR 00000613: 0000-0000-0000-0000
MSR 00000614: 0000-0000-0000-0600
MSR 00000618: 0000-0000-0000-0000
MSR 00000619: 0000-0000-000E-8196 [S200]
MSR 00000619: 0000-0000-000E-82CE [S200]
MSR 00000619: 0000-0000-000E-83ED
MSR 0000061B: 0000-0000-0000-58F0
MSR 0000061C: < FAILED >
MSR 00000638: < FAILED >
MSR 00000639: 0000-0000-0051-A2B1 [S200]
MSR 00000639: 0000-0000-0051-A34F [S200]
MSR 00000639: 0000-0000-0051-A3CA
MSR 0000063A: < FAILED >
MSR 0000063B: < FAILED >
MSR 00000640: < FAILED >
MSR 00000641: 0000-0000-000B-C4BA [S200]
MSR 00000641: 0000-0000-000B-C4BA [S200]
MSR 00000641: 0000-0000-000B-C4BA
MSR 00000642: < FAILED >
MSR 00000660: 0000-0001-5515-128B
MSR 00000661: < FAILED >
MSR 00000662: < FAILED >
MSR 00000663: < FAILED >
MSR 00000664: < FAILED >
MSR 00000665: < FAILED >
MSR 00000666: < FAILED >
MSR 00000667: < FAILED >
MSR 00000668: < FAILED >
MSR 00000669: < FAILED >
MSR 0000066A: < FAILED >
MSR 0000066B: < FAILED >
MSR 0000066C: < FAILED >
MSR 0000066D: < FAILED >
MSR 0000066E: < FAILED >
MSR 0000066F: < FAILED >
MSR 00000670: < FAILED >
MSR 00000671: < FAILED >
MSR 00000672: < FAILED >
MSR 00000673: < FAILED >
MSR 00000674: < FAILED >
MSR 00000675: < FAILED >
MSR 00000676: < FAILED >
MSR 00000677: < FAILED >
MSR 00000832: 0000-0000-0003-00D1
MSR 00000838: 0000-0000-0000-0000
MSR 00000839: 0000-0000-0000-0000
MSR 0000083E: 0000-0000-0000-000A

------[ MSR Registers / Logical CPU #1 ]------

MSR 00000017: 0000-0000-0000-0000 [PlatID = 0]
MSR 0000001B: 0000-0000-FEE0-0C00
MSR 0000002A: 0000-0000-0000-0000
MSR 00000035: 0000-0000-0004-0004
MSR 00000048: 0000-0000-0000-0001
MSR 00000049: < FAILED >
MSR 0000008B: 0000-0016-0000-0000
MSR 000000CD: < FAILED >
MSR 000000CE: 0004-0821-F801-0B00 [eD = 0]
MSR 000000E7: 0000-000C-7D70-C741
MSR 000000E8: 0000-0015-9C79-C0AF
MSR 000000EE: < FAILED >
MSR 0000010A: 0000-0000-0000-006B
MSR 0000011E: < FAILED >
MSR 00000194: < FAILED >
MSR 00000198: 0000-18CC-0000-0C00
MSR 00000199: 0000-0000-0000-1F00
MSR 0000019A: 0000-0000-0000-0000
MSR 0000019B: 0000-0000-0000-0010
MSR 0000019C: 0000-0000-8843-0800
MSR 0000019D: 0000-0000-0000-0000
MSR 000001A0: 0000-0000-0085-0089
MSR 000001A2: 0000-0000-0369-0000
MSR 000001A4: 0000-0000-0000-0000
MSR 000001AA: 0000-0000-0040-0000
MSR 000001AC: < FAILED >
MSR 000001AD: 0000-0000-1C1C-1C1F
MSR 000001B0: < FAILED >
MSR 000001B1: 0000-0000-8843-0800
MSR 000001B2: 0000-0000-0000-0000
MSR 000001FC: 0000-0000-0020-005F
MSR 00000300: < FAILED >
MSR 0000030A: 0000-0000-0000-0000
MSR 0000030B: 0000-0000-0000-0000
MSR 00000480: 00DA-0400-0000-0011
MSR 00000481: 0000-00FF-0000-0016
MSR 00000482: FFF9-FFFE-0401-E172
MSR 00000483: 01FF-FFFF-0003-6DFF
MSR 00000484: 0003-FFFF-0000-11FF
MSR 00000485: 0000-0000-6004-C1E7
MSR 00000486: 0000-0000-8000-0021
MSR 00000487: 0000-0000-FFFF-FFFF
MSR 00000488: 0000-0000-0000-2000
MSR 00000489: 0000-0000-0035-2FFF
MSR 0000048A: 0000-0000-0000-002E
MSR 0000048B: 025D-EFFF-0000-0000
MSR 0000048C: 0000-0F01-0673-4141
MSR 0000048D: 0000-00FF-0000-0016
MSR 0000048E: FFF9-FFFE-0400-6172
MSR 0000048F: 01FF-FFFF-0003-6DFB
MSR 00000490: 0003-FFFF-0000-11FB
MSR 00000601: 0000-0000-0000-00C8
MSR 00000602: < FAILED >
MSR 00000603: 0000-0000-0008-FF0B
MSR 00000604: < FAILED >
MSR 00000606: 0000-0000-330A-0E08
MSR 0000060A: 0000-0000-0000-0000
MSR 0000060B: 0000-0000-0000-8893
MSR 0000060C: 0000-0000-0000-8893
MSR 0000060D: 0000-0000-45D0-025D
MSR 00000610: 0000-8F00-00DD-8700
MSR 00000611: 0000-0000-014A-C93C
MSR 00000613: 0000-0000-0000-0000
MSR 00000614: 0000-0000-0000-0600
MSR 00000618: 0000-0000-0000-0000
MSR 00000619: 0000-0000-000E-8919
MSR 0000061B: 0000-0000-0000-58F0
MSR 0000061C: < FAILED >
MSR 00000638: < FAILED >
MSR 00000639: 0000-0000-0051-A5CB
MSR 0000063A: < FAILED >
MSR 0000063B: < FAILED >
MSR 00000640: < FAILED >
MSR 00000641: 0000-0000-000B-C4C0
MSR 00000642: < FAILED >
MSR 00000660: 0000-0001-EDCC-A18D
MSR 00000661: < FAILED >
MSR 00000662: < FAILED >
MSR 00000663: < FAILED >
MSR 00000664: < FAILED >
MSR 00000665: < FAILED >
MSR 00000666: < FAILED >
MSR 00000667: < FAILED >
MSR 00000668: < FAILED >
MSR 00000669: < FAILED >
MSR 0000066A: < FAILED >
MSR 0000066B: < FAILED >
MSR 0000066C: < FAILED >
MSR 0000066D: < FAILED >
MSR 0000066E: < FAILED >
MSR 0000066F: < FAILED >
MSR 00000670: < FAILED >
MSR 00000671: < FAILED >
MSR 00000672: < FAILED >
MSR 00000673: < FAILED >
MSR 00000674: < FAILED >
MSR 00000675: < FAILED >
MSR 00000676: < FAILED >
MSR 00000677: < FAILED >
MSR 00000832: 0000-0000-0002-00D1
MSR 00000838: 0000-0000-0000-0927
MSR 00000839: 0000-0000-0000-0879
MSR 0000083E: 0000-0000-0000-000A

------[ MSR Registers / Logical CPU #2 ]------

MSR 00000017: 0000-0000-0000-0000 [PlatID = 0]
MSR 0000001B: 0000-0000-FEE0-0C00
MSR 0000002A: 0000-0000-0000-0000
MSR 00000035: 0000-0000-0004-0004
MSR 00000048: 0000-0000-0000-0001
MSR 00000049: < FAILED >
MSR 0000008B: 0000-0016-0000-0000
MSR 000000CD: < FAILED >
MSR 000000CE: 0004-0821-F801-0B00 [eD = 0]
MSR 000000E7: 0000-000B-4C82-4EE5
MSR 000000E8: 0000-0013-98B4-3DCC
MSR 000000EE: < FAILED >
MSR 0000010A: 0000-0000-0000-006B
MSR 0000011E: < FAILED >
MSR 00000194: < FAILED >
MSR 00000198: 0000-268F-0000-1F00
MSR 00000199: 0000-0000-0000-1F00
MSR 0000019A: 0000-0000-0000-0000
MSR 0000019B: 0000-0000-0000-0010
MSR 0000019C: 0000-0000-8843-0800
MSR 0000019D: 0000-0000-0000-0000
MSR 000001A0: 0000-0000-0085-0089
MSR 000001A2: 0000-0000-0369-0000
MSR 000001A4: 0000-0000-0000-0000
MSR 000001AA: 0000-0000-0040-0000
MSR 000001AC: < FAILED >
MSR 000001AD: 0000-0000-1C1C-1C1F
MSR 000001B0: < FAILED >
MSR 000001B1: 0000-0000-8843-0800
MSR 000001B2: 0000-0000-0000-0000
MSR 000001FC: 0000-0000-0020-005F
MSR 00000300: < FAILED >
MSR 0000030A: 0000-0000-0000-0000
MSR 0000030B: 0000-0000-0000-0000
MSR 00000480: 00DA-0400-0000-0011
MSR 00000481: 0000-00FF-0000-0016
MSR 00000482: FFF9-FFFE-0401-E172
MSR 00000483: 01FF-FFFF-0003-6DFF
MSR 00000484: 0003-FFFF-0000-11FF
MSR 00000485: 0000-0000-6004-C1E7
MSR 00000486: 0000-0000-8000-0021
MSR 00000487: 0000-0000-FFFF-FFFF
MSR 00000488: 0000-0000-0000-2000
MSR 00000489: 0000-0000-0035-2FFF
MSR 0000048A: 0000-0000-0000-002E
MSR 0000048B: 025D-EFFF-0000-0000
MSR 0000048C: 0000-0F01-0673-4141
MSR 0000048D: 0000-00FF-0000-0016
MSR 0000048E: FFF9-FFFE-0400-6172
MSR 0000048F: 01FF-FFFF-0003-6DFB
MSR 00000490: 0003-FFFF-0000-11FB
MSR 00000601: 0000-0000-0000-00C8
MSR 00000602: < FAILED >
MSR 00000603: 0000-0000-0008-FF0B
MSR 00000604: < FAILED >
MSR 00000606: 0000-0000-330A-0E08
MSR 0000060A: 0000-0000-0000-0000
MSR 0000060B: 0000-0000-0000-8893
MSR 0000060C: 0000-0000-0000-8893
MSR 0000060D: 0000-0000-45D0-025D
MSR 00000610: 0000-8F00-00DD-8700
MSR 00000611: 0000-0000-014A-C9F9
MSR 00000613: 0000-0000-0000-0000
MSR 00000614: 0000-0000-0000-0600
MSR 00000618: 0000-0000-0000-0000
MSR 00000619: 0000-0000-000E-8921
MSR 0000061B: 0000-0000-0000-58F0
MSR 0000061C: < FAILED >
MSR 00000638: < FAILED >
MSR 00000639: 0000-0000-0051-A62C
MSR 0000063A: < FAILED >
MSR 0000063B: < FAILED >
MSR 00000640: < FAILED >
MSR 00000641: 0000-0000-000B-C4C0
MSR 00000642: < FAILED >
MSR 00000660: 0000-0001-8352-A43C
MSR 00000661: < FAILED >
MSR 00000662: < FAILED >
MSR 00000663: < FAILED >
MSR 00000664: < FAILED >
MSR 00000665: < FAILED >
MSR 00000666: < FAILED >
MSR 00000667: < FAILED >
MSR 00000668: < FAILED >
MSR 00000669: < FAILED >
MSR 0000066A: < FAILED >
MSR 0000066B: < FAILED >
MSR 0000066C: < FAILED >
MSR 0000066D: < FAILED >
MSR 0000066E: < FAILED >
MSR 0000066F: < FAILED >
MSR 00000670: < FAILED >
MSR 00000671: < FAILED >
MSR 00000672: < FAILED >
MSR 00000673: < FAILED >
MSR 00000674: < FAILED >
MSR 00000675: < FAILED >
MSR 00000676: < FAILED >
MSR 00000677: < FAILED >
MSR 00000832: 0000-0000-0003-00D1
MSR 00000838: 0000-0000-0000-0000
MSR 00000839: 0000-0000-0000-0000
MSR 0000083E: 0000-0000-0000-000A

------[ MSR Registers / Logical CPU #3 ]------

MSR 00000017: 0000-0000-0000-0000 [PlatID = 0]
MSR 0000001B: 0000-0000-FEE0-0C00
MSR 0000002A: 0000-0000-0000-0000
MSR 00000035: 0000-0000-0004-0004
MSR 00000048: 0000-0000-0000-0001
MSR 00000049: < FAILED >
MSR 0000008B: 0000-0016-0000-0000
MSR 000000CD: < FAILED >
MSR 000000CE: 0004-0821-F801-0B00 [eD = 0]
MSR 000000E7: 0000-000C-28EA-CE14
MSR 000000E8: 0000-0015-1EAC-596E
MSR 000000EE: < FAILED >
MSR 0000010A: 0000-0000-0000-006B
MSR 0000011E: < FAILED >
MSR 00000194: < FAILED >
MSR 00000198: 0000-268F-0000-1F00
MSR 00000199: 0000-0000-0000-1F00
MSR 0000019A: 0000-0000-0000-0000
MSR 0000019B: 0000-0000-0000-0010
MSR 0000019C: 0000-0000-8842-0800
MSR 0000019D: 0000-0000-0000-0000
MSR 000001A0: 0000-0000-0085-0089
MSR 000001A2: 0000-0000-0369-0000
MSR 000001A4: 0000-0000-0000-0000
MSR 000001AA: 0000-0000-0040-0000
MSR 000001AC: < FAILED >
MSR 000001AD: 0000-0000-1C1C-1C1F
MSR 000001B0: < FAILED >
MSR 000001B1: 0000-0000-8842-0800
MSR 000001B2: 0000-0000-0000-0000
MSR 000001FC: 0000-0000-0020-005F
MSR 00000300: < FAILED >
MSR 0000030A: 0000-0000-0000-0000
MSR 0000030B: 0000-0000-0000-0000
MSR 00000480: 00DA-0400-0000-0011
MSR 00000481: 0000-00FF-0000-0016
MSR 00000482: FFF9-FFFE-0401-E172
MSR 00000483: 01FF-FFFF-0003-6DFF
MSR 00000484: 0003-FFFF-0000-11FF
MSR 00000485: 0000-0000-6004-C1E7
MSR 00000486: 0000-0000-8000-0021
MSR 00000487: 0000-0000-FFFF-FFFF
MSR 00000488: 0000-0000-0000-2000
MSR 00000489: 0000-0000-0035-2FFF
MSR 0000048A: 0000-0000-0000-002E
MSR 0000048B: 025D-EFFF-0000-0000
MSR 0000048C: 0000-0F01-0673-4141
MSR 0000048D: 0000-00FF-0000-0016
MSR 0000048E: FFF9-FFFE-0400-6172
MSR 0000048F: 01FF-FFFF-0003-6DFB
MSR 00000490: 0003-FFFF-0000-11FB
MSR 00000601: 0000-0000-0000-00C8
MSR 00000602: < FAILED >
MSR 00000603: 0000-0000-0008-FF0B
MSR 00000604: < FAILED >
MSR 00000606: 0000-0000-330A-0E08
MSR 0000060A: 0000-0000-0000-0000
MSR 0000060B: 0000-0000-0000-8893
MSR 0000060C: 0000-0000-0000-8893
MSR 0000060D: 0000-0000-45D0-025D
MSR 00000610: 0000-8F00-00DD-8700
MSR 00000611: 0000-0000-014A-CA61
MSR 00000613: 0000-0000-0000-0000
MSR 00000614: 0000-0000-0000-0600
MSR 00000618: 0000-0000-0000-0000
MSR 00000619: 0000-0000-000E-8925
MSR 0000061B: 0000-0000-0000-58F0
MSR 0000061C: < FAILED >
MSR 00000638: < FAILED >
MSR 00000639: 0000-0000-0051-A665
MSR 0000063A: < FAILED >
MSR 0000063B: < FAILED >
MSR 00000640: < FAILED >
MSR 00000641: 0000-0000-000B-C4C0
MSR 00000642: < FAILED >
MSR 00000660: 0000-0001-933C-369B
MSR 00000661: < FAILED >
MSR 00000662: < FAILED >
MSR 00000663: < FAILED >
MSR 00000664: < FAILED >
MSR 00000665: < FAILED >
MSR 00000666: < FAILED >
MSR 00000667: < FAILED >
MSR 00000668: < FAILED >
MSR 00000669: < FAILED >
MSR 0000066A: < FAILED >
MSR 0000066B: < FAILED >
MSR 0000066C: < FAILED >
MSR 0000066D: < FAILED >
MSR 0000066E: < FAILED >
MSR 0000066F: < FAILED >
MSR 00000670: < FAILED >
MSR 00000671: < FAILED >
MSR 00000672: < FAILED >
MSR 00000673: < FAILED >
MSR 00000674: < FAILED >
MSR 00000675: < FAILED >
MSR 00000676: < FAILED >
MSR 00000677: < FAILED >
MSR 00000832: 0000-0000-0003-00D1
MSR 00000838: 0000-0000-0000-0000
MSR 00000839: 0000-0000-0000-0000
MSR 0000083E: 0000-0000-0000-000A
