
CPUID 00000000: 0000001B-756E6547-6C65746E-49656E69
CPUID 00000001: 00090661-00800800-4FF8EBBF-BFEBFBFF
CPUID 00000002: 00FEFF01-00000000-00000000-00000000
CPUID 00000003: 00000000-00000000-00000000-00000000
CPUID 00000004: FC000121-01C0003F-0000003F-00000000
CPUID 00000004: FC000122-01C0003F-0000003F-00000000
CPUID 00000004: FC01C143-02C0003F-000007FF-00000000
CPUID 00000004: FC1FC163-03C0003F-00000FFF-00000006
CPUID 00000005: 00000040-00000040-00000003-11122020
CPUID 00000006: 00178FF7-00000002-00000009-00000000
CPUID 00000007: 00000000-2394A2C3-18400124-FC000400
CPUID 00000008: 00000000-00000000-00000000-00000000
CPUID 00000009: 00000000-00000000-00000000-00000000
CPUID 0000000A: 07300405-00000000-00000007-00008603
CPUID 0000000B: 00000001-00000001-00000100-00000000
CPUID 0000000B: 00000007-00000004-00000201-00000000
CPUID 0000000C: 00000000-00000000-00000000-00000000
CPUID 0000000D: 00000003-00000240-00000240-00000000
CPUID 0000000D: 0000000F-000002C0-00000100-00000000
CPUID 0000000E: 00000000-00000000-00000000-00000000
CPUID 0000000F: 00000000-00000000-00000000-00000000
CPUID 00000010: 00000000-00000004-00000000-00000000
CPUID 00000011: 00000000-00000000-00000000-00000000
CPUID 00000012: 00000000-00000000-00000000-00000000
CPUID 00000013: 00000000-00000000-00000000-00000000
CPUID 00000014: 00000001-0000007F-80000007-00000000
CPUID 00000015: 00000002-00000062-0249F000-00000000
CPUID 00000016: 0000076C-0000076C-00000064-00000000
CPUID 00000017: 00000000-00000000-00000000-00000000
CPUID 00000018: 00000005-00000000-00000000-00000000
CPUID 00000018: 00000000-00300001-00000001-00000121
CPUID 00000018: 00000000-00040001-00000100-00000043
CPUID 00000018: 00000000-00040006-00000010-00000043
CPUID 00000018: 00000000-00300001-00000001-00000122
CPUID 00000018: 00000000-00000000-00000000-00000000
CPUID 00000019: 00000000-00000000-00000000-00000000
CPUID 0000001A: 20000000-00000000-00000000-00000000
CPUID 0000001B: 00000000-00000000-00000000-00000000
CPUID 80000000: 80000008-00000000-00000000-00000000
CPUID 80000001: 00000000-00000000-00000101-28100800
CPUID 80000002: 49202020-6C65746E-6F744120-2952286D
CPUID 80000003: 34367820-45523532-6F725020-73736563
CPUID 80000004: 4020726F-392E3120-7A484730-00000000
CPUID 80000005: 00000000-00000000-00000000-00000000
CPUID 80000006: 00000000-00000000-06006040-00000000
CPUID 80000007: 00000000-00000000-00000000-00000100
CPUID 80000008: 00003027-00000000-00000000-00000000



CPUID 00000000: 0000001B-756E6547-6C65746E-49656E69
CPUID 00000001: 00090661-02800800-4FF8EBBF-BFEBFBFF
CPUID 00000002: 00FEFF01-00000000-00000000-00000000
CPUID 00000003: 00000000-00000000-00000000-00000000
CPUID 00000004: FC000121-01C0003F-0000003F-00000000
CPUID 00000004: FC000122-01C0003F-0000003F-00000000
CPUID 00000004: FC01C143-02C0003F-000007FF-00000000
CPUID 00000004: FC1FC163-03C0003F-00000FFF-00000006
CPUID 00000005: 00000040-00000040-00000003-11122020
CPUID 00000006: 00178FF7-00000002-00000009-00000000
CPUID 00000007: 00000000-2394A2C3-18400124-FC000400
CPUID 00000008: 00000000-00000000-00000000-00000000
CPUID 00000009: 00000000-00000000-00000000-00000000
CPUID 0000000A: 07300405-00000000-00000007-00008603
CPUID 0000000B: 00000001-00000001-00000100-00000002
CPUID 0000000B: 00000007-00000004-00000201-00000002
CPUID 0000000C: 00000000-00000000-00000000-00000000
CPUID 0000000D: 00000003-00000240-00000240-00000000
CPUID 0000000D: 0000000F-000002C0-00000100-00000000
CPUID 0000000E: 00000000-00000000-00000000-00000000
CPUID 0000000F: 00000000-00000000-00000000-00000000
CPUID 00000010: 00000000-00000004-00000000-00000000
CPUID 00000011: 00000000-00000000-00000000-00000000
CPUID 00000012: 00000000-00000000-00000000-00000000
CPUID 00000013: 00000000-00000000-00000000-00000000
CPUID 00000014: 00000001-0000007F-80000007-00000000
CPUID 00000015: 00000002-00000062-0249F000-00000000
CPUID 00000016: 0000076C-0000076C-00000064-00000000
CPUID 00000017: 00000000-00000000-00000000-00000000
CPUID 00000018: 00000005-00000000-00000000-00000000
CPUID 00000018: 00000000-00300001-00000001-00000121
CPUID 00000018: 00000000-00040001-00000100-00000043
CPUID 00000018: 00000000-00040006-00000010-00000043
CPUID 00000018: 00000000-00300001-00000001-00000122
CPUID 00000018: 00000000-00000000-00000000-00000000
CPUID 00000019: 00000000-00000000-00000000-00000000
CPUID 0000001A: 20000000-00000000-00000000-00000000
CPUID 0000001B: 00000000-00000000-00000000-00000000
CPUID 80000000: 80000008-00000000-00000000-00000000
CPUID 80000001: 00000000-00000000-00000101-28100800
CPUID 80000002: 49202020-6C65746E-6F744120-2952286D
CPUID 80000003: 34367820-45523532-6F725020-73736563
CPUID 80000004: 4020726F-392E3120-7A484730-00000000
CPUID 80000005: 00000000-00000000-00000000-00000000
CPUID 80000006: 00000000-00000000-06006040-00000000
CPUID 80000007: 00000000-00000000-00000000-00000100
CPUID 80000008: 00003027-00000000-00000000-00000000



CPUID 00000000: 0000001B-756E6547-6C65746E-49656E69
CPUID 00000001: 00090661-04800800-4FF8EBBF-BFEBFBFF
CPUID 00000002: 00FEFF01-00000000-00000000-00000000
CPUID 00000003: 00000000-00000000-00000000-00000000
CPUID 00000004: FC000121-01C0003F-0000003F-00000000
CPUID 00000004: FC000122-01C0003F-0000003F-00000000
CPUID 00000004: FC01C143-02C0003F-000007FF-00000000
CPUID 00000004: FC1FC163-03C0003F-00000FFF-00000006
CPUID 00000005: 00000040-00000040-00000003-11122020
CPUID 00000006: 00178FF7-00000002-00000009-00000000
CPUID 00000007: 00000000-2394A2C3-18400124-FC000400
CPUID 00000008: 00000000-00000000-00000000-00000000
CPUID 00000009: 00000000-00000000-00000000-00000000
CPUID 0000000A: 07300405-00000000-00000007-00008603
CPUID 0000000B: 00000001-00000001-00000100-00000004
CPUID 0000000B: 00000007-00000004-00000201-00000004
CPUID 0000000C: 00000000-00000000-00000000-00000000
CPUID 0000000D: 00000003-00000240-00000240-00000000
CPUID 0000000D: 0000000F-000002C0-00000100-00000000
CPUID 0000000E: 00000000-00000000-00000000-00000000
CPUID 0000000F: 00000000-00000000-00000000-00000000
CPUID 00000010: 00000000-00000004-00000000-00000000
CPUID 00000011: 00000000-00000000-00000000-00000000
CPUID 00000012: 00000000-00000000-00000000-00000000
CPUID 00000013: 00000000-00000000-00000000-00000000
CPUID 00000014: 00000001-0000007F-80000007-00000000
CPUID 00000015: 00000002-00000062-0249F000-00000000
CPUID 00000016: 0000076C-0000076C-00000064-00000000
CPUID 00000017: 00000000-00000000-00000000-00000000
CPUID 00000018: 00000005-00000000-00000000-00000000
CPUID 00000018: 00000000-00300001-00000001-00000121
CPUID 00000018: 00000000-00040001-00000100-00000043
CPUID 00000018: 00000000-00040006-00000010-00000043
CPUID 00000018: 00000000-00300001-00000001-00000122
CPUID 00000018: 00000000-00000000-00000000-00000000
CPUID 00000019: 00000000-00000000-00000000-00000000
CPUID 0000001A: 20000000-00000000-00000000-00000000
CPUID 0000001B: 00000000-00000000-00000000-00000000
CPUID 80000000: 80000008-00000000-00000000-00000000
CPUID 80000001: 00000000-00000000-00000101-28100800
CPUID 80000002: 49202020-6C65746E-6F744120-2952286D
CPUID 80000003: 34367820-45523532-6F725020-73736563
CPUID 80000004: 4020726F-392E3120-7A484730-00000000
CPUID 80000005: 00000000-00000000-00000000-00000000
CPUID 80000006: 00000000-00000000-06006040-00000000
CPUID 80000007: 00000000-00000000-00000000-00000100
CPUID 80000008: 00003027-00000000-00000000-00000000



CPUID 00000000: 0000001B-756E6547-6C65746E-49656E69
CPUID 00000001: 00090661-06800800-4FF8EBBF-BFEBFBFF
CPUID 00000002: 00FEFF01-00000000-00000000-00000000
CPUID 00000003: 00000000-00000000-00000000-00000000
CPUID 00000004: FC000121-01C0003F-0000003F-00000000
CPUID 00000004: FC000122-01C0003F-0000003F-00000000
CPUID 00000004: FC01C143-02C0003F-000007FF-00000000
CPUID 00000004: FC1FC163-03C0003F-00000FFF-00000006
CPUID 00000005: 00000040-00000040-00000003-11122020
CPUID 00000006: 00178FF7-00000002-00000009-00000000
CPUID 00000007: 00000000-2394A2C3-18400124-FC000400
CPUID 00000008: 00000000-00000000-00000000-00000000
CPUID 00000009: 00000000-00000000-00000000-00000000
CPUID 0000000A: 07300405-00000000-00000007-00008603
CPUID 0000000B: 00000001-00000001-00000100-00000006
CPUID 0000000B: 00000007-00000004-00000201-00000006
CPUID 0000000C: 00000000-00000000-00000000-00000000
CPUID 0000000D: 00000003-00000240-00000240-00000000
CPUID 0000000D: 0000000F-000002C0-00000100-00000000
CPUID 0000000E: 00000000-00000000-00000000-00000000
CPUID 0000000F: 00000000-00000000-00000000-00000000
CPUID 00000010: 00000000-00000004-00000000-00000000
CPUID 00000011: 00000000-00000000-00000000-00000000
CPUID 00000012: 00000000-00000000-00000000-00000000
CPUID 00000013: 00000000-00000000-00000000-00000000
CPUID 00000014: 00000001-0000007F-80000007-00000000
CPUID 00000015: 00000002-00000062-0249F000-00000000
CPUID 00000016: 0000076C-0000076C-00000064-00000000
CPUID 00000017: 00000000-00000000-00000000-00000000
CPUID 00000018: 00000005-00000000-00000000-00000000
CPUID 00000018: 00000000-00300001-00000001-00000121
CPUID 00000018: 00000000-00040001-00000100-00000043
CPUID 00000018: 00000000-00040006-00000010-00000043
CPUID 00000018: 00000000-00300001-00000001-00000122
CPUID 00000018: 00000000-00000000-00000000-00000000
CPUID 00000019: 00000000-00000000-00000000-00000000
CPUID 0000001A: 20000000-00000000-00000000-00000000
CPUID 0000001B: 00000000-00000000-00000000-00000000
CPUID 80000000: 80000008-00000000-00000000-00000000
CPUID 80000001: 00000000-00000000-00000101-28100800
CPUID 80000002: 49202020-6C65746E-6F744120-2952286D
CPUID 80000003: 34367820-45523532-6F725020-73736563
CPUID 80000004: 4020726F-392E3120-7A484730-00000000
CPUID 80000005: 00000000-00000000-00000000-00000000
CPUID 80000006: 00000000-00000000-06006040-00000000
CPUID 80000007: 00000000-00000000-00000000-00000100
CPUID 80000008: 00003027-00000000-00000000-00000000
