------[ CPUID Registers / Logical CPU #0 ]------

allcpu: Package 0 / Core 0 / Thread 0: Valid, Intel Core

CPUID 00000000: 00000028-756E6547-6C65746E-49656E69 [GenuineIntel]
CPUID 00000001: 000D0651-00800800-7FFAFBFF-BFEBFBFF
CPUID 00000002: 00FEFF01-000000F0-00000000-00000000
CPUID 00000003: 00000000-00000000-00000000-00000000
CPUID 00000004: FC004121-02C0003F-0000003F-00000000 [SL 00] [L1D: 48 KB]
CPUID 00000004: FC004122-03C0003F-0000003F-00000000 [SL 01] [L1I: 64 KB]
CPUID 00000004: FC01C143-02C0003F-00000FFF-00000000 [SL 02] [L2U: 3 MB]
CPUID 00000004: FC0FC163-02C0003F-00001FFF-00000004 [SL 03] [L3U: 6 MB]
CPUID 00000005: 00000040-00000040-00000003-10002020
CPUID 00000006: 00DFCFF7-00000002-00000409-00000003
CPUID 00000007: 00000002-239CA7EB-994007AC-FC18C430 [SL 00]
CPUID 00000007: 4CCE09D7-00000001-00000002-00040430 [SL 01]
CPUID 00000007: 00000000-00000000-00000000-000000BF [SL 02]
CPUID 00000008: 00000000-00000000-00000000-00000000
CPUID 00000009: 00000000-00000000-00000000-00000000
CPUID 0000000A: 0D300806-00000280-00000007-00008603
CPUID 0000000B: 00000001-00000001-00000100-00000000 [SL 00]
CPUID 0000000B: 00000007-00000006-00000201-00000000 [SL 01]
CPUID 0000000C: 00000000-00000000-00000000-00000000
CPUID 0000000D: 00000207-00000340-00000A88-00000000 [SL 00] [x87]
CPUID 0000000D: 0000000F-000003D0-0001D900-00000000 [SL 01] [SSE]
CPUID 0000000D: 00000100-00000240-00000000-00000000 [SL 02] [AVX]
CPUID 0000000D: 00000080-00000000-00000001-00000000 [SL 08] [PT]
CPUID 0000000D: 00000008-00000A80-00000000-00000000 [SL 09] [PKRU]
CPUID 0000000D: 00000010-00000000-00000001-00000000 [SL 0B] [CET_U]
CPUID 0000000D: 00000018-00000000-00000001-00000000 [SL 0C] [CET_S]
CPUID 0000000D: 00000030-00000000-00000001-00000000 [SL 0E] [UINTR]
CPUID 0000000D: 00000328-00000000-00000001-00000000 [SL 0F] [LBR]
CPUID 0000000D: 00000008-00000000-00000001-00000000 [SL 10] [HWP]
CPUID 0000000E: 00000000-00000000-00000000-00000000
CPUID 0000000F: 00000000-00000000-00000000-00000000 [SL 00]
CPUID 0000000F: 00000000-00000000-00000000-00000000 [SL 01]
CPUID 00000010: 00000000-00000040-00000000-00000000 [SL 00]
CPUID 00000010: 00000000-00000000-00000000-00000000 [SL 01]
CPUID 00000011: 00000000-00000000-00000000-00000000
CPUID 00000012: 00000000-00000000-00000000-00000000 [SL 00]
CPUID 00000012: 00000000-00000000-00000000-00000000 [SL 01]
CPUID 00000013: 00000000-00000000-00000000-00000000
CPUID 00000014: 00000001-0000015F-00000007-00000000 [SL 00]
CPUID 00000014: 02490002-003F003F-00000000-00000000 [SL 01]
CPUID 00000015: 00000002-00000082-0249F000-00000000 [65.00x / 38400000 / 2496.00]
CPUID 00000016: 000009C4-000012C0-00000064-00000000 [2500 / 4800 / 100]
CPUID 00000017: 00000000-00000000-00000000-00000000 [SL 00]
CPUID 00000018: 00000008-00000000-00000000-00000000 [SL 00]
CPUID 00000018: 00000000-00080001-00000020-00004022 [SL 01]
CPUID 00000018: 00000000-00080006-00000004-00004022 [SL 02]
CPUID 00000018: 00000000-0010000F-00000001-00004125 [SL 03]
CPUID 00000018: 00000000-00080001-00000010-00004024 [SL 04]
CPUID 00000018: 00000000-00040006-00000008-00004024 [SL 05]
CPUID 00000018: 00000000-00080008-00000001-00004124 [SL 06]
CPUID 00000018: 00000000-00080007-00000100-00004043 [SL 07]
CPUID 00000018: 00000000-00040009-00000100-00004043 [SL 08]
CPUID 00000019: 00000000-00000000-00000000-00000000
CPUID 0000001A: 40000004-00000000-00000000-00000000 [Core: Cougar Cove]
CPUID 0000001C: 4000000B-00000007-000F0007-00000000
CPUID 0000001D: 00000000-00000000-00000000-00000000 [SL 00]
CPUID 0000001E: 00000000-00000000-00000000-00000000 [SL 00]
CPUID 0000001F: 00000001-00000001-00000100-00000000 [SL 00]
CPUID 0000001F: 00000003-00000001-00000201-00000000 [SL 01]
CPUID 0000001F: 00000007-00000006-00000302-00000000 [SL 02]
CPUID 00000020: 00000000-00000001-00000000-00000000 [SL 00]
CPUID 00000021: 00000000-00000000-00000000-00000000
CPUID 00000022: 00000000-00000000-00000000-00000000
CPUID 00000023: 0000003B-00000003-00000000-00000000 [SL 00]
CPUID 00000023: 000003FF-0000000F-00000000-00000000 [SL 01]
CPUID 00000023: 00001DFF-00000000-00000000-00000000 [SL 03]
CPUID 00000023: 00000000-60060378-00000000-00000000 [SL 04]
CPUID 00000023: 000003FF-00000003-0000000F-00000001 [SL 05]
CPUID 00000024: 00000000-00000000-00000000-00000000 [SL 00]
CPUID 00000025: 00000000-00000000-00000000-00000000
CPUID 00000026: 00000000-00000000-00000000-00000000
CPUID 00000027: 00000000-00000000-00000000-00000000 [SL 00]
CPUID 00000028: 00000000-00000040-00000000-00000000 [SL 00]
CPUID 80000000: 80000008-00000000-00000000-00000000
CPUID 80000001: 00000000-00000000-00000121-2C100800
CPUID 80000002: 65746E49-2952286C-726F4320-4D542865 [Intel(R) Core(TM]
CPUID 80000003: 20372029-00303533-00000000-00000000 [) 7 350]
CPUID 80000004: 00000000-00000000-00000000-00000000 []
CPUID 80000005: 00000000-00000000-00000000-00000000 [L1D: 0 KB / L1I: 0 KB]
CPUID 80000006: 00000000-00000000-0C007040-00000000 [L2: 3072 KB / L3: 0 KB]
CPUID 80000007: 00000000-00000000-00000000-00000100
CPUID 80000008: 0000302E-00000200-00000000-00000000

L1    Data Cache:    48 KB, 12-way Associative, 64-byte Line
L1  Instr. Cache:    64 KB, 16-way Associative, 64-byte Line
L2 Unified Cache:     3 MB, 12-way Associative, 64-byte Line
L3 Unified Cache:     6 MB, 12-way Associative, 64-byte Line

------[ CPUID Registers / Logical CPU #1 ]------

allcpu: Package 0 / Core 1 / Thread 0: Valid, Intel Core

CPUID 00000000: 00000028-756E6547-6C65746E-49656E69 [GenuineIntel]
CPUID 00000001: 000D0651-08800800-7FFAFBFF-BFEBFBFF
CPUID 00000002: 00FEFF01-000000F0-00000000-00000000
CPUID 00000003: 00000000-00000000-00000000-00000000
CPUID 00000004: FC004121-02C0003F-0000003F-00000000 [SL 00] [L1D: 48 KB]
CPUID 00000004: FC004122-03C0003F-0000003F-00000000 [SL 01] [L1I: 64 KB]
CPUID 00000004: FC01C143-02C0003F-00000FFF-00000000 [SL 02] [L2U: 3 MB]
CPUID 00000004: FC0FC163-02C0003F-00001FFF-00000004 [SL 03] [L3U: 6 MB]
CPUID 00000005: 00000040-00000040-00000003-10002020
CPUID 00000006: 00DFCFF7-00000002-00000409-00010003
CPUID 00000007: 00000002-239CA7EB-994007AC-FC18C430 [SL 00]
CPUID 00000007: 4CCE09D7-00000001-00000002-00040430 [SL 01]
CPUID 00000007: 00000000-00000000-00000000-000000BF [SL 02]
CPUID 00000008: 00000000-00000000-00000000-00000000
CPUID 00000009: 00000000-00000000-00000000-00000000
CPUID 0000000A: 0D300806-00000280-00000007-00008603
CPUID 0000000B: 00000001-00000001-00000100-00000008 [SL 00]
CPUID 0000000B: 00000007-00000006-00000201-00000008 [SL 01]
CPUID 0000000C: 00000000-00000000-00000000-00000000
CPUID 0000000D: 00000207-00000340-00000A88-00000000 [SL 00] [x87]
CPUID 0000000D: 0000000F-000003D0-0001D900-00000000 [SL 01] [SSE]
CPUID 0000000D: 00000100-00000240-00000000-00000000 [SL 02] [AVX]
CPUID 0000000D: 00000080-00000000-00000001-00000000 [SL 08] [PT]
CPUID 0000000D: 00000008-00000A80-00000000-00000000 [SL 09] [PKRU]
CPUID 0000000D: 00000010-00000000-00000001-00000000 [SL 0B] [CET_U]
CPUID 0000000D: 00000018-00000000-00000001-00000000 [SL 0C] [CET_S]
CPUID 0000000D: 00000030-00000000-00000001-00000000 [SL 0E] [UINTR]
CPUID 0000000D: 00000328-00000000-00000001-00000000 [SL 0F] [LBR]
CPUID 0000000D: 00000008-00000000-00000001-00000000 [SL 10] [HWP]
CPUID 0000000E: 00000000-00000000-00000000-00000000
CPUID 0000000F: 00000000-00000000-00000000-00000000 [SL 00]
CPUID 0000000F: 00000000-00000000-00000000-00000000 [SL 01]
CPUID 00000010: 00000000-00000040-00000000-00000000 [SL 00]
CPUID 00000010: 00000000-00000000-00000000-00000000 [SL 01]
CPUID 00000011: 00000000-00000000-00000000-00000000
CPUID 00000012: 00000000-00000000-00000000-00000000 [SL 00]
CPUID 00000012: 00000000-00000000-00000000-00000000 [SL 01]
CPUID 00000013: 00000000-00000000-00000000-00000000
CPUID 00000014: 00000001-0000015F-00000007-00000000 [SL 00]
CPUID 00000014: 02490002-003F003F-00000000-00000000 [SL 01]
CPUID 00000015: 00000002-00000082-0249F000-00000000 [65.00x / 38400000 / 2496.00]
CPUID 00000016: 000009C4-000012C0-00000064-00000000 [2500 / 4800 / 100]
CPUID 00000017: 00000000-00000000-00000000-00000000 [SL 00]
CPUID 00000018: 00000008-00000000-00000000-00000000 [SL 00]
CPUID 00000018: 00000000-00080001-00000020-00004022 [SL 01]
CPUID 00000018: 00000000-00080006-00000004-00004022 [SL 02]
CPUID 00000018: 00000000-0010000F-00000001-00004125 [SL 03]
CPUID 00000018: 00000000-00080001-00000010-00004024 [SL 04]
CPUID 00000018: 00000000-00040006-00000008-00004024 [SL 05]
CPUID 00000018: 00000000-00080008-00000001-00004124 [SL 06]
CPUID 00000018: 00000000-00080007-00000100-00004043 [SL 07]
CPUID 00000018: 00000000-00040009-00000100-00004043 [SL 08]
CPUID 00000019: 00000000-00000000-00000000-00000000
CPUID 0000001A: 40000004-00000000-00000000-00000000 [Core: Cougar Cove]
CPUID 0000001C: 4000000B-00000007-000F0007-00000000
CPUID 0000001D: 00000000-00000000-00000000-00000000 [SL 00]
CPUID 0000001E: 00000000-00000000-00000000-00000000 [SL 00]
CPUID 0000001F: 00000001-00000001-00000100-00000008 [SL 00]
CPUID 0000001F: 00000003-00000001-00000201-00000008 [SL 01]
CPUID 0000001F: 00000007-00000006-00000302-00000008 [SL 02]
CPUID 00000020: 00000000-00000001-00000000-00000000 [SL 00]
CPUID 00000021: 00000000-00000000-00000000-00000000
CPUID 00000022: 00000000-00000000-00000000-00000000
CPUID 00000023: 0000003B-00000003-00000000-00000000 [SL 00]
CPUID 00000023: 000003FF-0000000F-00000000-00000000 [SL 01]
CPUID 00000023: 00001DFF-00000000-00000000-00000000 [SL 03]
CPUID 00000023: 00000000-60060378-00000000-00000000 [SL 04]
CPUID 00000023: 000003FF-00000003-0000000F-00000001 [SL 05]
CPUID 00000024: 00000000-00000000-00000000-00000000 [SL 00]
CPUID 00000025: 00000000-00000000-00000000-00000000
CPUID 00000026: 00000000-00000000-00000000-00000000
CPUID 00000027: 00000000-00000000-00000000-00000000 [SL 00]
CPUID 00000028: 00000000-00000040-00000000-00000000 [SL 00]
CPUID 80000000: 80000008-00000000-00000000-00000000
CPUID 80000001: 00000000-00000000-00000121-2C100800
CPUID 80000002: 65746E49-2952286C-726F4320-4D542865 [Intel(R) Core(TM]
CPUID 80000003: 20372029-00303533-00000000-00000000 [) 7 350]
CPUID 80000004: 00000000-00000000-00000000-00000000 []
CPUID 80000005: 00000000-00000000-00000000-00000000 [L1D: 0 KB / L1I: 0 KB]
CPUID 80000006: 00000000-00000000-0C007040-00000000 [L2: 3072 KB / L3: 0 KB]
CPUID 80000007: 00000000-00000000-00000000-00000100
CPUID 80000008: 0000302E-00000200-00000000-00000000

L1    Data Cache:    48 KB, 12-way Associative, 64-byte Line
L1  Instr. Cache:    64 KB, 16-way Associative, 64-byte Line
L2 Unified Cache:     3 MB, 12-way Associative, 64-byte Line
L3 Unified Cache:     6 MB, 12-way Associative, 64-byte Line

------[ CPUID Registers / Logical CPU #2 ]------

allcpu: Package 0 / Core 2 / Thread 0: Valid, Intel Atom LP

CPUID 00000000: 00000028-756E6547-6C65746E-49656E69 [GenuineIntel]
CPUID 00000001: 000D0651-40800800-7FFAFBFF-BFEBFBFF
CPUID 00000002: 00FEFF01-000000F0-00000000-00000000
CPUID 00000003: 00000000-00000000-00000000-00000000
CPUID 00000004: FC000121-01C0003F-0000003F-00000001 [SL 00] [L1D: 32 KB]
CPUID 00000004: FC000122-01C0003F-0000007F-00000001 [SL 01] [L1I: 64 KB]
CPUID 00000004: FC01C143-03C0003F-00000FFF-00000001 [SL 02] [L2U: 4 MB]
CPUID 00000005: 00000040-00000040-00000003-10002020
CPUID 00000006: 00DFCFF7-00000002-00000409-00020003
CPUID 00000007: 00000002-239CA7EB-994007AC-FC18C430 [SL 00]
CPUID 00000007: 4CCE09D7-00000001-00000002-00040430 [SL 01]
CPUID 00000007: 00000000-00000000-00000000-000000BF [SL 02]
CPUID 00000008: 00000000-00000000-00000000-00000000
CPUID 00000009: 00000000-00000000-00000000-00000000
CPUID 0000000A: 0D300806-00000280-00000007-00008603
CPUID 0000000B: 00000001-00000001-00000100-00000040 [SL 00]
CPUID 0000000B: 00000007-00000006-00000201-00000040 [SL 01]
CPUID 0000000C: 00000000-00000000-00000000-00000000
CPUID 0000000D: 00000207-00000340-00000A88-00000000 [SL 00] [x87]
CPUID 0000000D: 0000000F-000003D0-0001D900-00000000 [SL 01] [SSE]
CPUID 0000000D: 00000100-00000240-00000000-00000000 [SL 02] [AVX]
CPUID 0000000D: 00000080-00000000-00000001-00000000 [SL 08] [PT]
CPUID 0000000D: 00000008-00000A80-00000000-00000000 [SL 09] [PKRU]
CPUID 0000000D: 00000010-00000000-00000001-00000000 [SL 0B] [CET_U]
CPUID 0000000D: 00000018-00000000-00000001-00000000 [SL 0C] [CET_S]
CPUID 0000000D: 00000030-00000000-00000001-00000000 [SL 0E] [UINTR]
CPUID 0000000D: 00000328-00000000-00000001-00000000 [SL 0F] [LBR]
CPUID 0000000D: 00000008-00000000-00000001-00000000 [SL 10] [HWP]
CPUID 0000000E: 00000000-00000000-00000000-00000000
CPUID 0000000F: 00000000-00000000-00000000-00000000 [SL 00]
CPUID 0000000F: 00000000-00000000-00000000-00000000 [SL 01]
CPUID 00000010: 00000000-00000040-00000000-00000000 [SL 00]
CPUID 00000010: 00000000-00000000-00000000-00000000 [SL 01]
CPUID 00000011: 00000000-00000000-00000000-00000000
CPUID 00000012: 00000000-00000000-00000000-00000000 [SL 00]
CPUID 00000012: 00000000-00000000-00000000-00000000 [SL 01]
CPUID 00000013: 00000000-00000000-00000000-00000000
CPUID 00000014: 00000001-0000015F-80000007-00000000 [SL 00]
CPUID 00000014: 02490002-003F003F-00000000-00000000 [SL 01]
CPUID 00000015: 00000002-00000082-0249F000-00000000 [65.00x / 38400000 / 2496.00]
CPUID 00000016: 000009C4-00000E10-00000064-00000000 [2500 / 3600 / 100]
CPUID 00000017: 00000000-00000000-00000000-00000000 [SL 00]
CPUID 00000018: 00000004-00000000-00000000-00000000 [SL 00]
CPUID 00000018: 00000000-00300003-00000001-00000121 [SL 01]
CPUID 00000018: 00000000-00040003-00000400-00000043 [SL 02]
CPUID 00000018: 00000000-00800001-00000001-00000122 [SL 03]
CPUID 00000018: 00000000-00080008-00000001-00000143 [SL 04]
CPUID 00000019: 00000000-00000000-00000000-00000000
CPUID 0000001A: 20000004-00000000-00000000-00000000 [Atom: Darkmont]
CPUID 0000001C: C000000B-00000007-000F0007-00000000
CPUID 0000001D: 00000000-00000000-00000000-00000000 [SL 00]
CPUID 0000001E: 00000000-00000000-00000000-00000000 [SL 00]
CPUID 0000001F: 00000001-00000001-00000100-00000040 [SL 00]
CPUID 0000001F: 00000003-00000004-00000201-00000040 [SL 01]
CPUID 0000001F: 00000007-00000006-00000302-00000040 [SL 02]
CPUID 00000020: 00000000-00000001-00000000-00000000 [SL 00]
CPUID 00000021: 00000000-00000000-00000000-00000000
CPUID 00000022: 00000000-00000000-00000000-00000000
CPUID 00000023: 0000003F-00000003-00000008-00000000 [SL 00]
CPUID 00000023: 000000FF-00000077-00000000-00000000 [SL 01]
CPUID 00000023: 000000FC-00000003-000000FC-00000003 [SL 02]
CPUID 00000023: 00001F7F-00000000-00000000-00000000 [SL 03]
CPUID 00000023: 00000000-60060338-00000000-00000000 [SL 04]
CPUID 00000023: 000000FF-00000003-00000077-00000001 [SL 05]
CPUID 00000024: 00000000-00000000-00000000-00000000 [SL 00]
CPUID 00000025: 00000000-00000000-00000000-00000000
CPUID 00000026: 00000000-00000000-00000000-00000000
CPUID 00000027: 00000000-00000000-00000000-00000000 [SL 00]
CPUID 00000028: 00000000-00000040-00000000-00000000 [SL 00]
CPUID 80000000: 80000008-00000000-00000000-00000000
CPUID 80000001: 00000000-00000000-00000121-2C100800
CPUID 80000002: 65746E49-2952286C-726F4320-4D542865 [Intel(R) Core(TM]
CPUID 80000003: 20372029-00303533-00000000-00000000 [) 7 350]
CPUID 80000004: 00000000-00000000-00000000-00000000 []
CPUID 80000005: 00000000-00000000-00000000-00000000 [L1D: 0 KB / L1I: 0 KB]
CPUID 80000006: 00000000-00000000-10008040-00000000 [L2: 4096 KB / L3: 0 KB]
CPUID 80000007: 00000000-00000000-00000000-00000100
CPUID 80000008: 0000302E-00000200-00000000-00000000

L1    Data Cache:    32 KB,  8-way Associative, 64-byte Line
L1  Instr. Cache:    64 KB,  8-way Associative, 64-byte Line
L2 Unified Cache:     4 MB, 16-way Associative, 64-byte Line

------[ CPUID Registers / Logical CPU #3 ]------

allcpu: Package 0 / Core 3 / Thread 0: Valid, Intel Atom LP

CPUID 00000000: 00000028-756E6547-6C65746E-49656E69 [GenuineIntel]
CPUID 00000001: 000D0651-42800800-7FFAFBFF-BFEBFBFF
CPUID 00000002: 00FEFF01-000000F0-00000000-00000000
CPUID 00000003: 00000000-00000000-00000000-00000000
CPUID 00000004: FC000121-01C0003F-0000003F-00000001 [SL 00] [L1D: 32 KB]
CPUID 00000004: FC000122-01C0003F-0000007F-00000001 [SL 01] [L1I: 64 KB]
CPUID 00000004: FC01C143-03C0003F-00000FFF-00000001 [SL 02] [L2U: 4 MB]
CPUID 00000005: 00000040-00000040-00000003-10002020
CPUID 00000006: 00DFCFF7-00000002-00000409-00030003
CPUID 00000007: 00000002-239CA7EB-994007AC-FC18C430 [SL 00]
CPUID 00000007: 4CCE09D7-00000001-00000002-00040430 [SL 01]
CPUID 00000007: 00000000-00000000-00000000-000000BF [SL 02]
CPUID 00000008: 00000000-00000000-00000000-00000000
CPUID 00000009: 00000000-00000000-00000000-00000000
CPUID 0000000A: 0D300806-00000280-00000007-00008603
CPUID 0000000B: 00000001-00000001-00000100-00000042 [SL 00]
CPUID 0000000B: 00000007-00000006-00000201-00000042 [SL 01]
CPUID 0000000C: 00000000-00000000-00000000-00000000
CPUID 0000000D: 00000207-00000340-00000A88-00000000 [SL 00] [x87]
CPUID 0000000D: 0000000F-000003D0-0001D900-00000000 [SL 01] [SSE]
CPUID 0000000D: 00000100-00000240-00000000-00000000 [SL 02] [AVX]
CPUID 0000000D: 00000080-00000000-00000001-00000000 [SL 08] [PT]
CPUID 0000000D: 00000008-00000A80-00000000-00000000 [SL 09] [PKRU]
CPUID 0000000D: 00000010-00000000-00000001-00000000 [SL 0B] [CET_U]
CPUID 0000000D: 00000018-00000000-00000001-00000000 [SL 0C] [CET_S]
CPUID 0000000D: 00000030-00000000-00000001-00000000 [SL 0E] [UINTR]
CPUID 0000000D: 00000328-00000000-00000001-00000000 [SL 0F] [LBR]
CPUID 0000000D: 00000008-00000000-00000001-00000000 [SL 10] [HWP]
CPUID 0000000E: 00000000-00000000-00000000-00000000
CPUID 0000000F: 00000000-00000000-00000000-00000000 [SL 00]
CPUID 0000000F: 00000000-00000000-00000000-00000000 [SL 01]
CPUID 00000010: 00000000-00000040-00000000-00000000 [SL 00]
CPUID 00000010: 00000000-00000000-00000000-00000000 [SL 01]
CPUID 00000011: 00000000-00000000-00000000-00000000
CPUID 00000012: 00000000-00000000-00000000-00000000 [SL 00]
CPUID 00000012: 00000000-00000000-00000000-00000000 [SL 01]
CPUID 00000013: 00000000-00000000-00000000-00000000
CPUID 00000014: 00000001-0000015F-80000007-00000000 [SL 00]
CPUID 00000014: 02490002-003F003F-00000000-00000000 [SL 01]
CPUID 00000015: 00000002-00000082-0249F000-00000000 [65.00x / 38400000 / 2496.00]
CPUID 00000016: 000009C4-00000E10-00000064-00000000 [2500 / 3600 / 100]
CPUID 00000017: 00000000-00000000-00000000-00000000 [SL 00]
CPUID 00000018: 00000004-00000000-00000000-00000000 [SL 00]
CPUID 00000018: 00000000-00300003-00000001-00000121 [SL 01]
CPUID 00000018: 00000000-00040003-00000400-00000043 [SL 02]
CPUID 00000018: 00000000-00800001-00000001-00000122 [SL 03]
CPUID 00000018: 00000000-00080008-00000001-00000143 [SL 04]
CPUID 00000019: 00000000-00000000-00000000-00000000
CPUID 0000001A: 20000004-00000000-00000000-00000000 [Atom: Darkmont]
CPUID 0000001C: C000000B-00000007-000F0007-00000000
CPUID 0000001D: 00000000-00000000-00000000-00000000 [SL 00]
CPUID 0000001E: 00000000-00000000-00000000-00000000 [SL 00]
CPUID 0000001F: 00000001-00000001-00000100-00000042 [SL 00]
CPUID 0000001F: 00000003-00000004-00000201-00000042 [SL 01]
CPUID 0000001F: 00000007-00000006-00000302-00000042 [SL 02]
CPUID 00000020: 00000000-00000001-00000000-00000000 [SL 00]
CPUID 00000021: 00000000-00000000-00000000-00000000
CPUID 00000022: 00000000-00000000-00000000-00000000
CPUID 00000023: 0000003F-00000003-00000008-00000000 [SL 00]
CPUID 00000023: 000000FF-00000077-00000000-00000000 [SL 01]
CPUID 00000023: 000000FC-00000003-000000FC-00000003 [SL 02]
CPUID 00000023: 00001F7F-00000000-00000000-00000000 [SL 03]
CPUID 00000023: 00000000-60060338-00000000-00000000 [SL 04]
CPUID 00000023: 000000FF-00000003-00000077-00000001 [SL 05]
CPUID 00000024: 00000000-00000000-00000000-00000000 [SL 00]
CPUID 00000025: 00000000-00000000-00000000-00000000
CPUID 00000026: 00000000-00000000-00000000-00000000
CPUID 00000027: 00000000-00000000-00000000-00000000 [SL 00]
CPUID 00000028: 00000000-00000040-00000000-00000000 [SL 00]
CPUID 80000000: 80000008-00000000-00000000-00000000
CPUID 80000001: 00000000-00000000-00000121-2C100800
CPUID 80000002: 65746E49-2952286C-726F4320-4D542865 [Intel(R) Core(TM]
CPUID 80000003: 20372029-00303533-00000000-00000000 [) 7 350]
CPUID 80000004: 00000000-00000000-00000000-00000000 []
CPUID 80000005: 00000000-00000000-00000000-00000000 [L1D: 0 KB / L1I: 0 KB]
CPUID 80000006: 00000000-00000000-10008040-00000000 [L2: 4096 KB / L3: 0 KB]
CPUID 80000007: 00000000-00000000-00000000-00000100
CPUID 80000008: 0000302E-00000200-00000000-00000000

L1    Data Cache:    32 KB,  8-way Associative, 64-byte Line
L1  Instr. Cache:    64 KB,  8-way Associative, 64-byte Line
L2 Unified Cache:     4 MB, 16-way Associative, 64-byte Line

------[ CPUID Registers / Logical CPU #4 ]------

allcpu: Package 0 / Core 4 / Thread 0: Valid, Intel Atom LP

CPUID 00000000: 00000028-756E6547-6C65746E-49656E69 [GenuineIntel]
CPUID 00000001: 000D0651-44800800-7FFAFBFF-BFEBFBFF
CPUID 00000002: 00FEFF01-000000F0-00000000-00000000
CPUID 00000003: 00000000-00000000-00000000-00000000
CPUID 00000004: FC000121-01C0003F-0000003F-00000001 [SL 00] [L1D: 32 KB]
CPUID 00000004: FC000122-01C0003F-0000007F-00000001 [SL 01] [L1I: 64 KB]
CPUID 00000004: FC01C143-03C0003F-00000FFF-00000001 [SL 02] [L2U: 4 MB]
CPUID 00000005: 00000040-00000040-00000003-10002020
CPUID 00000006: 00DFCFF7-00000002-00000409-00040003
CPUID 00000007: 00000002-239CA7EB-994007AC-FC18C430 [SL 00]
CPUID 00000007: 4CCE09D7-00000001-00000002-00040430 [SL 01]
CPUID 00000007: 00000000-00000000-00000000-000000BF [SL 02]
CPUID 00000008: 00000000-00000000-00000000-00000000
CPUID 00000009: 00000000-00000000-00000000-00000000
CPUID 0000000A: 0D300806-00000280-00000007-00008603
CPUID 0000000B: 00000001-00000001-00000100-00000044 [SL 00]
CPUID 0000000B: 00000007-00000006-00000201-00000044 [SL 01]
CPUID 0000000C: 00000000-00000000-00000000-00000000
CPUID 0000000D: 00000207-00000340-00000A88-00000000 [SL 00] [x87]
CPUID 0000000D: 0000000F-000003D0-0001D900-00000000 [SL 01] [SSE]
CPUID 0000000D: 00000100-00000240-00000000-00000000 [SL 02] [AVX]
CPUID 0000000D: 00000080-00000000-00000001-00000000 [SL 08] [PT]
CPUID 0000000D: 00000008-00000A80-00000000-00000000 [SL 09] [PKRU]
CPUID 0000000D: 00000010-00000000-00000001-00000000 [SL 0B] [CET_U]
CPUID 0000000D: 00000018-00000000-00000001-00000000 [SL 0C] [CET_S]
CPUID 0000000D: 00000030-00000000-00000001-00000000 [SL 0E] [UINTR]
CPUID 0000000D: 00000328-00000000-00000001-00000000 [SL 0F] [LBR]
CPUID 0000000D: 00000008-00000000-00000001-00000000 [SL 10] [HWP]
CPUID 0000000E: 00000000-00000000-00000000-00000000
CPUID 0000000F: 00000000-00000000-00000000-00000000 [SL 00]
CPUID 0000000F: 00000000-00000000-00000000-00000000 [SL 01]
CPUID 00000010: 00000000-00000040-00000000-00000000 [SL 00]
CPUID 00000010: 00000000-00000000-00000000-00000000 [SL 01]
CPUID 00000011: 00000000-00000000-00000000-00000000
CPUID 00000012: 00000000-00000000-00000000-00000000 [SL 00]
CPUID 00000012: 00000000-00000000-00000000-00000000 [SL 01]
CPUID 00000013: 00000000-00000000-00000000-00000000
CPUID 00000014: 00000001-0000015F-80000007-00000000 [SL 00]
CPUID 00000014: 02490002-003F003F-00000000-00000000 [SL 01]
CPUID 00000015: 00000002-00000082-0249F000-00000000 [65.00x / 38400000 / 2496.00]
CPUID 00000016: 000009C4-00000E10-00000064-00000000 [2500 / 3600 / 100]
CPUID 00000017: 00000000-00000000-00000000-00000000 [SL 00]
CPUID 00000018: 00000004-00000000-00000000-00000000 [SL 00]
CPUID 00000018: 00000000-00300003-00000001-00000121 [SL 01]
CPUID 00000018: 00000000-00040003-00000400-00000043 [SL 02]
CPUID 00000018: 00000000-00800001-00000001-00000122 [SL 03]
CPUID 00000018: 00000000-00080008-00000001-00000143 [SL 04]
CPUID 00000019: 00000000-00000000-00000000-00000000
CPUID 0000001A: 20000004-00000000-00000000-00000000 [Atom: Darkmont]
CPUID 0000001C: C000000B-00000007-000F0007-00000000
CPUID 0000001D: 00000000-00000000-00000000-00000000 [SL 00]
CPUID 0000001E: 00000000-00000000-00000000-00000000 [SL 00]
CPUID 0000001F: 00000001-00000001-00000100-00000044 [SL 00]
CPUID 0000001F: 00000003-00000004-00000201-00000044 [SL 01]
CPUID 0000001F: 00000007-00000006-00000302-00000044 [SL 02]
CPUID 00000020: 00000000-00000001-00000000-00000000 [SL 00]
CPUID 00000021: 00000000-00000000-00000000-00000000
CPUID 00000022: 00000000-00000000-00000000-00000000
CPUID 00000023: 0000003F-00000003-00000008-00000000 [SL 00]
CPUID 00000023: 000000FF-00000077-00000000-00000000 [SL 01]
CPUID 00000023: 000000FC-00000003-000000FC-00000003 [SL 02]
CPUID 00000023: 00001F7F-00000000-00000000-00000000 [SL 03]
CPUID 00000023: 00000000-60060338-00000000-00000000 [SL 04]
CPUID 00000023: 000000FF-00000003-00000077-00000001 [SL 05]
CPUID 00000024: 00000000-00000000-00000000-00000000 [SL 00]
CPUID 00000025: 00000000-00000000-00000000-00000000
CPUID 00000026: 00000000-00000000-00000000-00000000
CPUID 00000027: 00000000-00000000-00000000-00000000 [SL 00]
CPUID 00000028: 00000000-00000040-00000000-00000000 [SL 00]
CPUID 80000000: 80000008-00000000-00000000-00000000
CPUID 80000001: 00000000-00000000-00000121-2C100800
CPUID 80000002: 65746E49-2952286C-726F4320-4D542865 [Intel(R) Core(TM]
CPUID 80000003: 20372029-00303533-00000000-00000000 [) 7 350]
CPUID 80000004: 00000000-00000000-00000000-00000000 []
CPUID 80000005: 00000000-00000000-00000000-00000000 [L1D: 0 KB / L1I: 0 KB]
CPUID 80000006: 00000000-00000000-10008040-00000000 [L2: 4096 KB / L3: 0 KB]
CPUID 80000007: 00000000-00000000-00000000-00000100
CPUID 80000008: 0000302E-00000200-00000000-00000000

L1    Data Cache:    32 KB,  8-way Associative, 64-byte Line
L1  Instr. Cache:    64 KB,  8-way Associative, 64-byte Line
L2 Unified Cache:     4 MB, 16-way Associative, 64-byte Line

------[ CPUID Registers / Logical CPU #5 ]------

allcpu: Package 0 / Core 5 / Thread 0: Valid, Intel Atom LP

CPUID 00000000: 00000028-756E6547-6C65746E-49656E69 [GenuineIntel]
CPUID 00000001: 000D0651-46800800-7FFAFBFF-BFEBFBFF
CPUID 00000002: 00FEFF01-000000F0-00000000-00000000
CPUID 00000003: 00000000-00000000-00000000-00000000
CPUID 00000004: FC000121-01C0003F-0000003F-00000001 [SL 00] [L1D: 32 KB]
CPUID 00000004: FC000122-01C0003F-0000007F-00000001 [SL 01] [L1I: 64 KB]
CPUID 00000004: FC01C143-03C0003F-00000FFF-00000001 [SL 02] [L2U: 4 MB]
CPUID 00000005: 00000040-00000040-00000003-10002020
CPUID 00000006: 00DFCFF7-00000002-00000409-00050003
CPUID 00000007: 00000002-239CA7EB-994007AC-FC18C430 [SL 00]
CPUID 00000007: 4CCE09D7-00000001-00000002-00040430 [SL 01]
CPUID 00000007: 00000000-00000000-00000000-000000BF [SL 02]
CPUID 00000008: 00000000-00000000-00000000-00000000
CPUID 00000009: 00000000-00000000-00000000-00000000
CPUID 0000000A: 0D300806-00000280-00000007-00008603
CPUID 0000000B: 00000001-00000001-00000100-00000046 [SL 00]
CPUID 0000000B: 00000007-00000006-00000201-00000046 [SL 01]
CPUID 0000000C: 00000000-00000000-00000000-00000000
CPUID 0000000D: 00000207-00000340-00000A88-00000000 [SL 00] [x87]
CPUID 0000000D: 0000000F-000003D0-0001D900-00000000 [SL 01] [SSE]
CPUID 0000000D: 00000100-00000240-00000000-00000000 [SL 02] [AVX]
CPUID 0000000D: 00000080-00000000-00000001-00000000 [SL 08] [PT]
CPUID 0000000D: 00000008-00000A80-00000000-00000000 [SL 09] [PKRU]
CPUID 0000000D: 00000010-00000000-00000001-00000000 [SL 0B] [CET_U]
CPUID 0000000D: 00000018-00000000-00000001-00000000 [SL 0C] [CET_S]
CPUID 0000000D: 00000030-00000000-00000001-00000000 [SL 0E] [UINTR]
CPUID 0000000D: 00000328-00000000-00000001-00000000 [SL 0F] [LBR]
CPUID 0000000D: 00000008-00000000-00000001-00000000 [SL 10] [HWP]
CPUID 0000000E: 00000000-00000000-00000000-00000000
CPUID 0000000F: 00000000-00000000-00000000-00000000 [SL 00]
CPUID 0000000F: 00000000-00000000-00000000-00000000 [SL 01]
CPUID 00000010: 00000000-00000040-00000000-00000000 [SL 00]
CPUID 00000010: 00000000-00000000-00000000-00000000 [SL 01]
CPUID 00000011: 00000000-00000000-00000000-00000000
CPUID 00000012: 00000000-00000000-00000000-00000000 [SL 00]
CPUID 00000012: 00000000-00000000-00000000-00000000 [SL 01]
CPUID 00000013: 00000000-00000000-00000000-00000000
CPUID 00000014: 00000001-0000015F-80000007-00000000 [SL 00]
CPUID 00000014: 02490002-003F003F-00000000-00000000 [SL 01]
CPUID 00000015: 00000002-00000082-0249F000-00000000 [65.00x / 38400000 / 2496.00]
CPUID 00000016: 000009C4-00000E10-00000064-00000000 [2500 / 3600 / 100]
CPUID 00000017: 00000000-00000000-00000000-00000000 [SL 00]
CPUID 00000018: 00000004-00000000-00000000-00000000 [SL 00]
CPUID 00000018: 00000000-00300003-00000001-00000121 [SL 01]
CPUID 00000018: 00000000-00040003-00000400-00000043 [SL 02]
CPUID 00000018: 00000000-00800001-00000001-00000122 [SL 03]
CPUID 00000018: 00000000-00080008-00000001-00000143 [SL 04]
CPUID 00000019: 00000000-00000000-00000000-00000000
CPUID 0000001A: 20000004-00000000-00000000-00000000 [Atom: Darkmont]
CPUID 0000001C: C000000B-00000007-000F0007-00000000
CPUID 0000001D: 00000000-00000000-00000000-00000000 [SL 00]
CPUID 0000001E: 00000000-00000000-00000000-00000000 [SL 00]
CPUID 0000001F: 00000001-00000001-00000100-00000046 [SL 00]
CPUID 0000001F: 00000003-00000004-00000201-00000046 [SL 01]
CPUID 0000001F: 00000007-00000006-00000302-00000046 [SL 02]
CPUID 00000020: 00000000-00000001-00000000-00000000 [SL 00]
CPUID 00000021: 00000000-00000000-00000000-00000000
CPUID 00000022: 00000000-00000000-00000000-00000000
CPUID 00000023: 0000003F-00000003-00000008-00000000 [SL 00]
CPUID 00000023: 000000FF-00000077-00000000-00000000 [SL 01]
CPUID 00000023: 000000FC-00000003-000000FC-00000003 [SL 02]
CPUID 00000023: 00001F7F-00000000-00000000-00000000 [SL 03]
CPUID 00000023: 00000000-60060338-00000000-00000000 [SL 04]
CPUID 00000023: 000000FF-00000003-00000077-00000001 [SL 05]
CPUID 00000024: 00000000-00000000-00000000-00000000 [SL 00]
CPUID 00000025: 00000000-00000000-00000000-00000000
CPUID 00000026: 00000000-00000000-00000000-00000000
CPUID 00000027: 00000000-00000000-00000000-00000000 [SL 00]
CPUID 00000028: 00000000-00000040-00000000-00000000 [SL 00]
CPUID 80000000: 80000008-00000000-00000000-00000000
CPUID 80000001: 00000000-00000000-00000121-2C100800
CPUID 80000002: 65746E49-2952286C-726F4320-4D542865 [Intel(R) Core(TM]
CPUID 80000003: 20372029-00303533-00000000-00000000 [) 7 350]
CPUID 80000004: 00000000-00000000-00000000-00000000 []
CPUID 80000005: 00000000-00000000-00000000-00000000 [L1D: 0 KB / L1I: 0 KB]
CPUID 80000006: 00000000-00000000-10008040-00000000 [L2: 4096 KB / L3: 0 KB]
CPUID 80000007: 00000000-00000000-00000000-00000100
CPUID 80000008: 0000302E-00000200-00000000-00000000

L1    Data Cache:    32 KB,  8-way Associative, 64-byte Line
L1  Instr. Cache:    64 KB,  8-way Associative, 64-byte Line
L2 Unified Cache:     4 MB, 16-way Associative, 64-byte Line

------[ All CPUs ]------

CPU   0: APICID    0 / Package 0 / Core   0 / Thread 0: Valid
CPU   1: APICID    8 / Package 0 / Core   1 / Thread 0: Valid
CPU   2: APICID   64 / Package 0 / Core   2 / Thread 0: Valid
CPU   3: APICID   66 / Package 0 / Core   3 / Thread 0: Valid
CPU   4: APICID   68 / Package 0 / Core   4 / Thread 0: Valid
CPU   5: APICID   70 / Package 0 / Core   5 / Thread 0: Valid

------[ MSR Registers / Logical CPU #0 ]------

MSR 00000017: 001C-0000-0000-0000 [PlatID = 7]
MSR 0000001B: 0000-0000-FEE0-0D00
MSR 0000002A: 0000-0000-0000-0000
MSR 00000035: 0000-0000-0006-0006
MSR 00000048: 0000-0000-0000-0001
MSR 00000049: < FAILED >
MSR 0000008B: 0000-0008-0000-0000
MSR 000000CD: 0000-0000-0000-0000
MSR 000000CE: 0804-043D-F080-1900 [eD = 0]
MSR 000000E7: 0000-0020-54F5-8C18 [S200]
MSR 000000E7: 0000-0020-5704-0D0E [S200]
MSR 000000E7: 0000-0020-58A4-B1CC
MSR 000000E8: 0000-0034-8552-F089 [S200]
MSR 000000E8: 0000-0034-8628-B509 [S200]
MSR 000000E8: 0000-0034-86D7-8B48
MSR 000000EE: < FAILED >
MSR 0000010A: 0000-0000-0DB9-FD6B
MSR 0000010B: < FAILED >
MSR 0000011E: < FAILED >
MSR 00000194: 0000-0000-0011-0000
MSR 00000198: 0000-0000-0000-2100 [S200]
MSR 00000198: 0000-0000-0000-2F00 [S200]
MSR 00000198: 0000-0000-0000-0D00
MSR 00000199: 0000-0000-0000-0F00
MSR 0000019A: 0000-0000-0000-0000
MSR 0000019B: 0000-0000-0000-0010
MSR 0000019C: 0000-0000-8835-2800 [S200]
MSR 0000019C: 0000-0000-882D-2800 [S200]
MSR 0000019C: 0000-0000-8828-2800
MSR 0000019D: 0000-0000-0000-0000
MSR 000001A0: 0000-0000-0085-1089
MSR 000001A2: 0000-0000-0664-0000
MSR 000001A4: 0000-0000-0000-0000
MSR 000001AA: 0000-0000-0000-30C2
MSR 000001AC: < FAILED >
MSR 000001AD: 2D2D-2D2D-2D2E-2F30
MSR 000001AE: 0807-0605-0403-0201
MSR 000001AF: < FAILED >
MSR 000001B0: 0000-0000-0000-0002
MSR 000001B1: 0000-0000-8820-0802
MSR 000001B2: 0000-0000-0200-0000
MSR 000001FC: 0000-0000-08E4-005F
MSR 00000300: < FAILED >
MSR 0000030A: 0000-0000-0000-0000 [S200]
MSR 0000030A: 0000-0000-0000-0000 [S200]
MSR 0000030A: 0000-0000-0000-0000
MSR 0000030B: 0000-0000-0000-0000 [S200]
MSR 0000030B: 0000-0000-0000-0000 [S200]
MSR 0000030B: 0000-0000-0000-0000
MSR 00000480: 07DA-0600-0000-0015
MSR 00000481: 0000-00FF-0000-0016
MSR 00000482: FFFB-FFFE-0401-E172
MSR 00000483: FF7F-FFFF-0003-6DFF
MSR 00000484: 01FE-FFFF-0000-11FF
MSR 00000485: 0000-0000-7004-C1E7
MSR 00000486: 0000-0000-8000-0021
MSR 00000487: 0000-0000-FFFF-FFFF
MSR 00000488: 0000-0000-0000-2000
MSR 00000489: 0000-0001-1BF7-6FFF
MSR 0000048A: 0000-0000-0000-002E
MSR 0000048B: C75F-7FFF-0000-0000
MSR 0000048C: 0001-0F01-06F3-4141
MSR 0000048D: 0000-00FF-0000-0016
MSR 0000048E: FFFB-FFFE-0400-6172
MSR 0000048F: FF7F-FFFF-0003-6DFB
MSR 00000490: 01FE-FFFF-0000-11FB
MSR 00000601: 0000-0000-0000-02E8
MSR 00000602: < FAILED >
MSR 00000603: 0036-0000-0036-3636
MSR 00000604: < FAILED >
MSR 00000606: 0000-0000-000A-0E03
MSR 0000060A: 0000-0000-0000-0000
MSR 0000060B: 0000-0000-0000-0000
MSR 0000060C: 0000-0000-0000-0000
MSR 0000060D: 0000-0000-279C-92C2
MSR 00000610: 0000-8118-00DD-80F0
MSR 00000611: 0000-0000-01B8-9ADA [S200]
MSR 00000611: 0000-0000-01B8-C91E [S200]
MSR 00000611: 0000-0000-01B9-A387
MSR 00000613: 0000-0000-0000-0000
MSR 00000614: 0000-0000-0000-0078
MSR 00000618: 0000-0000-0000-0000
MSR 00000619: 0000-0000-0013-9516 [S200]
MSR 00000619: 0000-0000-0013-9B1C [S200]
MSR 00000619: 0000-0000-0013-9F9F
MSR 0000061B: 0000-0000-0000-0000
MSR 0000061C: < FAILED >
MSR 0000061E: < FAILED >
MSR 00000620: 0000-0000-0000-042B
MSR 00000621: 0000-0000-13DC-000F
MSR 00000638: 0000-0000-0000-0000
MSR 00000639: 0000-0000-0160-032A [S200]
MSR 00000639: 0000-0000-0160-121F [S200]
MSR 00000639: 0000-0000-0160-14D6
MSR 0000063A: 0000-0000-0000-0000
MSR 0000063B: < FAILED >
MSR 00000640: 0000-0000-0000-0000
MSR 00000641: 0000-0000-0001-5176 [S200]
MSR 00000641: 0000-0000-0001-5176 [S200]
MSR 00000641: 0000-0000-0001-5176
MSR 00000642: 0000-0000-0000-0010
MSR 00000648: 0000-0000-0000-000F
MSR 00000649: 0000-0000-000A-0050
MSR 0000064A: 0000-0000-0019-00E0
MSR 0000064B: 0000-0000-0000-0000
MSR 0000064C: 0000-0000-0000-000E
MSR 00000650: 2424-2424-2424-2424
MSR 00000651: 0404-0404-0404-0404
MSR 00000660: 0000-002A-389F-DE51
MSR 00000661: < FAILED >
MSR 00000662: < FAILED >
MSR 00000663: < FAILED >
MSR 00000664: 0000-0000-0000-0000
MSR 00000665: < FAILED >
MSR 00000666: < FAILED >
MSR 00000667: < FAILED >
MSR 00000668: < FAILED >
MSR 00000669: < FAILED >
MSR 0000066A: < FAILED >
MSR 0000066B: < FAILED >
MSR 0000066C: < FAILED >
MSR 0000066D: < FAILED >
MSR 0000066E: < FAILED >
MSR 0000066F: < FAILED >
MSR 00000670: < FAILED >
MSR 00000671: < FAILED >
MSR 00000672: < FAILED >
MSR 00000673: < FAILED >
MSR 00000674: < FAILED >
MSR 00000675: < FAILED >
MSR 00000676: < FAILED >
MSR 00000677: < FAILED >
MSR 00000690: < FAILED >
MSR 000006B0: 0000-0000-1800-0000
MSR 000006B1: 0000-0000-0000-0000
MSR 00000770: 0000-0000-0000-0001
MSR 00000771: 0000-0000-0110-1135
MSR 00000772: 0000-0000-8000-FF01
MSR 00000773: 0000-0000-0000-0005
MSR 00000774: 0000-019E-7F00-3501
MSR 00000777: 0000-0000-0000-0000
MSR 00000832: 0000-0000-0000-00D1
MSR 00000838: 0000-0000-0000-0258
MSR 00000839: 0000-0000-0000-01F7
MSR 0000083E: 0000-0000-0000-000A

------[ MSR Registers / Logical CPU #1 ]------

MSR 00000017: 001C-0000-0000-0000 [PlatID = 7]
MSR 0000001B: 0000-0000-FEE0-0C00
MSR 0000002A: 0000-0000-0000-0000
MSR 00000035: 0000-0000-0006-0006
MSR 00000048: 0000-0000-0000-0001
MSR 00000049: < FAILED >
MSR 0000008B: 0000-0008-0000-0000
MSR 000000CD: 0000-0000-0000-0000
MSR 000000CE: 0804-043D-F080-1900 [eD = 0]
MSR 000000E7: 0000-0026-4976-8927
MSR 000000E8: 0000-0041-5D44-2504
MSR 000000EE: < FAILED >
MSR 0000010A: 0000-0000-0DB9-FD6B
MSR 0000010B: < FAILED >
MSR 0000011E: < FAILED >
MSR 00000194: 0000-0000-0011-0000
MSR 00000198: 0000-0000-0000-1800
MSR 00000199: 0000-0000-0000-0F00
MSR 0000019A: 0000-0000-0000-0000
MSR 0000019B: 0000-0000-0000-0010
MSR 0000019C: 0000-0000-8834-2800
MSR 0000019D: 0000-0000-0000-0000
MSR 000001A0: 0000-0000-0085-1089
MSR 000001A2: 0000-0000-0664-0000
MSR 000001A4: 0000-0000-0000-0000
MSR 000001AA: 0000-0000-0000-30C2
MSR 000001AC: < FAILED >
MSR 000001AD: 2D2D-2D2D-2D2E-2F30
MSR 000001AE: 0807-0605-0403-0201
MSR 000001AF: < FAILED >
MSR 000001B0: 0000-0000-0000-0002
MSR 000001B1: 0000-0000-8831-0802
MSR 000001B2: 0000-0000-0200-0000
MSR 000001FC: 0000-0000-08E4-005F
MSR 00000300: < FAILED >
MSR 0000030A: 0000-0000-0000-0000
MSR 0000030B: 0000-0000-0000-0000
MSR 00000480: 07DA-0600-0000-0015
MSR 00000481: 0000-00FF-0000-0016
MSR 00000482: FFFB-FFFE-0401-E172
MSR 00000483: FF7F-FFFF-0003-6DFF
MSR 00000484: 01FE-FFFF-0000-11FF
MSR 00000485: 0000-0000-7004-C1E7
MSR 00000486: 0000-0000-8000-0021
MSR 00000487: 0000-0000-FFFF-FFFF
MSR 00000488: 0000-0000-0000-2000
MSR 00000489: 0000-0001-1BF7-6FFF
MSR 0000048A: 0000-0000-0000-002E
MSR 0000048B: C75F-7FFF-0000-0000
MSR 0000048C: 0001-0F01-06F3-4141
MSR 0000048D: 0000-00FF-0000-0016
MSR 0000048E: FFFB-FFFE-0400-6172
MSR 0000048F: FF7F-FFFF-0003-6DFB
MSR 00000490: 01FE-FFFF-0000-11FB
MSR 00000601: 0000-0000-0000-02E8
MSR 00000602: < FAILED >
MSR 00000603: 0036-0000-0036-3636
MSR 00000604: < FAILED >
MSR 00000606: 0000-0000-000A-0E03
MSR 0000060A: 0000-0000-0000-0000
MSR 0000060B: 0000-0000-0000-0000
MSR 0000060C: 0000-0000-0000-0000
MSR 0000060D: 0000-0000-27D7-4AC5
MSR 00000610: 0000-8118-00DD-80F0
MSR 00000611: 0000-0000-01BA-CE8C
MSR 00000613: 0000-0000-0000-0000
MSR 00000614: 0000-0000-0000-0078
MSR 00000618: 0000-0000-0000-0000
MSR 00000619: 0000-0000-0013-AA34
MSR 0000061B: 0000-0000-0000-0000
MSR 0000061C: < FAILED >
MSR 0000061E: < FAILED >
MSR 00000620: 0000-0000-0000-042B
MSR 00000621: 0000-0000-174D-001C
MSR 00000638: 0000-0000-0000-0000
MSR 00000639: 0000-0000-0160-1AAC
MSR 0000063A: 0000-0000-0000-0000
MSR 0000063B: < FAILED >
MSR 00000640: 0000-0000-0000-0000
MSR 00000641: 0000-0000-0001-5176
MSR 00000642: 0000-0000-0000-0010
MSR 00000648: 0000-0000-0000-000F
MSR 00000649: 0000-0000-000A-0050
MSR 0000064A: 0000-0000-0019-00E0
MSR 0000064B: 0000-0000-0000-0000
MSR 0000064C: 0000-0000-0000-000E
MSR 00000650: 2424-2424-2424-2424
MSR 00000651: 0404-0404-0404-0404
MSR 00000660: 0000-0027-35E3-5A92
MSR 00000661: < FAILED >
MSR 00000662: < FAILED >
MSR 00000663: < FAILED >
MSR 00000664: 0000-0000-0000-0000
MSR 00000665: < FAILED >
MSR 00000666: < FAILED >
MSR 00000667: < FAILED >
MSR 00000668: < FAILED >
MSR 00000669: < FAILED >
MSR 0000066A: < FAILED >
MSR 0000066B: < FAILED >
MSR 0000066C: < FAILED >
MSR 0000066D: < FAILED >
MSR 0000066E: < FAILED >
MSR 0000066F: < FAILED >
MSR 00000670: < FAILED >
MSR 00000671: < FAILED >
MSR 00000672: < FAILED >
MSR 00000673: < FAILED >
MSR 00000674: < FAILED >
MSR 00000675: < FAILED >
MSR 00000676: < FAILED >
MSR 00000677: < FAILED >
MSR 00000690: < FAILED >
MSR 000006B0: 0000-0000-1800-0000
MSR 000006B1: 0000-0000-0000-0000
MSR 00000770: 0000-0000-0000-0001
MSR 00000771: 0000-0000-010E-1136
MSR 00000772: 0000-0000-8000-FF01
MSR 00000773: 0000-0000-0000-0005
MSR 00000774: 0000-019E-7F00-3601
MSR 00000777: 0000-0000-0000-0000
MSR 00000832: 0000-0000-0002-00D1
MSR 00000838: 0000-0000-0000-020A
MSR 00000839: 0000-0000-0000-0020
MSR 0000083E: 0000-0000-0000-000A

------[ MSR Registers / Logical CPU #2 ]------

MSR 00000017: 001C-0000-0000-0000 [PlatID = 7]
MSR 0000001B: 0000-0000-FEE0-0C00
MSR 0000002A: 0000-0000-0000-0000
MSR 00000035: 0000-0000-0006-0006
MSR 00000048: 0000-0000-0000-0001
MSR 00000049: < FAILED >
MSR 0000008B: 0000-0008-0000-0000
MSR 000000CD: < FAILED >
MSR 000000CE: 0804-043D-F080-1900 [eD = 0]
MSR 000000E7: 0000-0025-5B83-9D54
MSR 000000E8: 0000-002C-DD83-6D55
MSR 000000EE: < FAILED >
MSR 0000010A: 0000-0000-0DB9-FD6B
MSR 0000010B: < FAILED >
MSR 0000011E: < FAILED >
MSR 00000194: 0000-0000-0011-0000
MSR 00000198: 0000-0000-0000-1A00
MSR 00000199: 0000-0000-0000-0F00
MSR 0000019A: 0000-0000-0000-0000
MSR 0000019B: 0000-0000-0000-0010
MSR 0000019C: 0000-0000-8836-0000
MSR 0000019D: 0000-0000-0000-0000
MSR 000001A0: 0000-0000-0085-1089
MSR 000001A2: 0000-0000-0664-0000
MSR 000001A4: 0000-0000-0000-0004
MSR 000001AA: 0000-0000-0000-30C2
MSR 000001AC: < FAILED >
MSR 000001AD: 2D2D-2D2D-2D2E-2F30
MSR 000001AE: 0807-0605-0403-0201
MSR 000001AF: < FAILED >
MSR 000001B0: 0000-0000-0000-0002
MSR 000001B1: 0000-0000-8831-0802
MSR 000001B2: 0000-0000-0200-0000
MSR 000001FC: 0000-0000-08E4-005F
MSR 00000300: < FAILED >
MSR 0000030A: 0000-0000-0000-0000
MSR 0000030B: 0000-0000-0000-0000
MSR 00000480: 07DA-0600-0000-0015
MSR 00000481: 0000-00FF-0000-0016
MSR 00000482: FFFB-FFFE-0401-E172
MSR 00000483: FF7F-FFFF-0003-6DFF
MSR 00000484: 01FE-FFFF-0000-11FF
MSR 00000485: 0000-0000-7004-C1E7
MSR 00000486: 0000-0000-8000-0021
MSR 00000487: 0000-0000-FFFF-FFFF
MSR 00000488: 0000-0000-0000-2000
MSR 00000489: 0000-0001-1BF7-6FFF
MSR 0000048A: 0000-0000-0000-002E
MSR 0000048B: C75F-7FFF-0000-0000
MSR 0000048C: 0001-0F01-06F3-4141
MSR 0000048D: 0000-00FF-0000-0016
MSR 0000048E: FFFB-FFFE-0400-6172
MSR 0000048F: FF7F-FFFF-0003-6DFB
MSR 00000490: 01FE-FFFF-0000-11FB
MSR 00000601: 0000-0000-0000-02E8
MSR 00000602: < FAILED >
MSR 00000603: 0036-0000-0036-3636
MSR 00000604: < FAILED >
MSR 00000606: 0000-0000-000A-0E03
MSR 0000060A: 0000-0000-0000-0000
MSR 0000060B: 0000-0000-0000-0000
MSR 0000060C: 0000-0000-0000-0000
MSR 0000060D: 0000-0000-27D7-4AC5
MSR 00000610: 0000-8118-00DD-80F0
MSR 00000611: 0000-0000-01BA-CEE1
MSR 00000613: 0000-0000-0000-0000
MSR 00000614: 0000-0000-0000-0078
MSR 00000618: 0000-0000-0000-0000
MSR 00000619: 0000-0000-0013-AA3F
MSR 0000061B: 0000-0000-0000-0000
MSR 0000061C: < FAILED >
MSR 0000061E: < FAILED >
MSR 00000620: 0000-0000-0000-042B
MSR 00000621: 0000-0000-174D-001C
MSR 00000638: 0000-0000-0000-0000
MSR 00000639: 0000-0000-0160-1AED
MSR 0000063A: 0000-0000-0000-0000
MSR 0000063B: < FAILED >
MSR 00000640: 0000-0000-0000-0000
MSR 00000641: 0000-0000-0001-5176
MSR 00000642: 0000-0000-0000-0010
MSR 00000648: 0000-0000-0000-000F
MSR 00000649: 0000-0000-000A-0050
MSR 0000064A: 0000-0000-0019-00E0
MSR 0000064B: 0000-0000-0000-0000
MSR 0000064C: 0000-0000-0000-000E
MSR 00000650: 2424-2424-2424-2424
MSR 00000651: 0404-0404-0404-0404
MSR 00000660: 0000-001B-FA27-42D5
MSR 00000661: < FAILED >
MSR 00000662: < FAILED >
MSR 00000663: < FAILED >
MSR 00000664: 0000-0003-D7CF-2B66
MSR 00000665: < FAILED >
MSR 00000666: < FAILED >
MSR 00000667: < FAILED >
MSR 00000668: < FAILED >
MSR 00000669: < FAILED >
MSR 0000066A: < FAILED >
MSR 0000066B: < FAILED >
MSR 0000066C: < FAILED >
MSR 0000066D: < FAILED >
MSR 0000066E: < FAILED >
MSR 0000066F: < FAILED >
MSR 00000670: < FAILED >
MSR 00000671: < FAILED >
MSR 00000672: < FAILED >
MSR 00000673: < FAILED >
MSR 00000674: < FAILED >
MSR 00000675: < FAILED >
MSR 00000676: < FAILED >
MSR 00000677: < FAILED >
MSR 00000690: < FAILED >
MSR 000006B0: 0000-0000-1800-0000
MSR 000006B1: 0000-0000-0000-0000
MSR 00000770: 0000-0000-0000-0001
MSR 00000771: 0000-0000-010F-0E24
MSR 00000772: 0000-0000-8000-FF01
MSR 00000773: 0000-0000-0000-0005
MSR 00000774: 0000-019E-7F00-2401
MSR 00000777: 0000-0000-0000-0000
MSR 00000832: 0000-0000-0002-00D1
MSR 00000838: 0000-0000-0000-020A
MSR 00000839: 0000-0000-0000-012F
MSR 0000083E: 0000-0000-0000-000A

------[ MSR Registers / Logical CPU #3 ]------

MSR 00000017: 001C-0000-0000-0000 [PlatID = 7]
MSR 0000001B: 0000-0000-FEE0-0C00
MSR 0000002A: 0000-0000-0000-0000
MSR 00000035: 0000-0000-0006-0006
MSR 00000048: 0000-0000-0000-0001
MSR 00000049: < FAILED >
MSR 0000008B: 0000-0008-0000-0000
MSR 000000CD: < FAILED >
MSR 000000CE: 0804-043D-F080-1900 [eD = 0]
MSR 000000E7: 0000-0026-55CF-1220
MSR 000000E8: 0000-002E-ADCE-8CF0
MSR 000000EE: < FAILED >
MSR 0000010A: 0000-0000-0DB9-FD6B
MSR 0000010B: < FAILED >
MSR 0000011E: < FAILED >
MSR 00000194: 0000-0000-0011-0000
MSR 00000198: 0000-0000-0000-2400
MSR 00000199: 0000-0000-0000-0F00
MSR 0000019A: 0000-0000-0000-0000
MSR 0000019B: 0000-0000-0000-0010
MSR 0000019C: 0000-0000-8836-0000
MSR 0000019D: 0000-0000-0000-0000
MSR 000001A0: 0000-0000-0085-1089
MSR 000001A2: 0000-0000-0664-0000
MSR 000001A4: 0000-0000-0000-0004
MSR 000001AA: 0000-0000-0000-30C2
MSR 000001AC: < FAILED >
MSR 000001AD: 2D2D-2D2D-2D2E-2F30
MSR 000001AE: 0807-0605-0403-0201
MSR 000001AF: < FAILED >
MSR 000001B0: 0000-0000-0000-0002
MSR 000001B1: 0000-0000-8832-0802
MSR 000001B2: 0000-0000-0200-0000
MSR 000001FC: 0000-0000-08E4-005F
MSR 00000300: < FAILED >
MSR 0000030A: 0000-0000-0000-0000
MSR 0000030B: 0000-0000-0000-0000
MSR 00000480: 07DA-0600-0000-0015
MSR 00000481: 0000-00FF-0000-0016
MSR 00000482: FFFB-FFFE-0401-E172
MSR 00000483: FF7F-FFFF-0003-6DFF
MSR 00000484: 01FE-FFFF-0000-11FF
MSR 00000485: 0000-0000-7004-C1E7
MSR 00000486: 0000-0000-8000-0021
MSR 00000487: 0000-0000-FFFF-FFFF
MSR 00000488: 0000-0000-0000-2000
MSR 00000489: 0000-0001-1BF7-6FFF
MSR 0000048A: 0000-0000-0000-002E
MSR 0000048B: C75F-7FFF-0000-0000
MSR 0000048C: 0001-0F01-06F3-4141
MSR 0000048D: 0000-00FF-0000-0016
MSR 0000048E: FFFB-FFFE-0400-6172
MSR 0000048F: FF7F-FFFF-0003-6DFB
MSR 00000490: 01FE-FFFF-0000-11FB
MSR 00000601: 0000-0000-0000-02E8
MSR 00000602: < FAILED >
MSR 00000603: 0036-0000-0036-3636
MSR 00000604: < FAILED >
MSR 00000606: 0000-0000-000A-0E03
MSR 0000060A: 0000-0000-0000-0000
MSR 0000060B: 0000-0000-0000-0000
MSR 0000060C: 0000-0000-0000-0000
MSR 0000060D: 0000-0000-27D7-4AC5
MSR 00000610: 0000-8118-00DD-80F0
MSR 00000611: 0000-0000-01BA-CF38
MSR 00000613: 0000-0000-0000-0000
MSR 00000614: 0000-0000-0000-0078
MSR 00000618: 0000-0000-0000-0000
MSR 00000619: 0000-0000-0013-AA4A
MSR 0000061B: 0000-0000-0000-0000
MSR 0000061C: < FAILED >
MSR 0000061E: < FAILED >
MSR 00000620: 0000-0000-0000-042B
MSR 00000621: 0000-0000-1E6E-002A
MSR 00000638: 0000-0000-0000-0000
MSR 00000639: 0000-0000-0160-1B2E
MSR 0000063A: 0000-0000-0000-0000
MSR 0000063B: < FAILED >
MSR 00000640: 0000-0000-0000-0000
MSR 00000641: 0000-0000-0001-5176
MSR 00000642: 0000-0000-0000-0010
MSR 00000648: 0000-0000-0000-000F
MSR 00000649: 0000-0000-000A-0050
MSR 0000064A: 0000-0000-0019-00E0
MSR 0000064B: 0000-0000-0000-0000
MSR 0000064C: 0000-0000-0000-000E
MSR 00000650: 2424-2424-2424-2424
MSR 00000651: 0404-0404-0404-0404
MSR 00000660: 0000-0019-540C-D498
MSR 00000661: < FAILED >
MSR 00000662: < FAILED >
MSR 00000663: < FAILED >
MSR 00000664: 0000-0003-D7CF-2B66
MSR 00000665: < FAILED >
MSR 00000666: < FAILED >
MSR 00000667: < FAILED >
MSR 00000668: < FAILED >
MSR 00000669: < FAILED >
MSR 0000066A: < FAILED >
MSR 0000066B: < FAILED >
MSR 0000066C: < FAILED >
MSR 0000066D: < FAILED >
MSR 0000066E: < FAILED >
MSR 0000066F: < FAILED >
MSR 00000670: < FAILED >
MSR 00000671: < FAILED >
MSR 00000672: < FAILED >
MSR 00000673: < FAILED >
MSR 00000674: < FAILED >
MSR 00000675: < FAILED >
MSR 00000676: < FAILED >
MSR 00000677: < FAILED >
MSR 00000690: < FAILED >
MSR 000006B0: 0000-0000-1800-0000
MSR 000006B1: 0000-0000-0000-0000
MSR 00000770: 0000-0000-0000-0001
MSR 00000771: 0000-0000-0110-0E24
MSR 00000772: 0000-0000-8000-FF01
MSR 00000773: 0000-0000-0000-0005
MSR 00000774: 0000-019E-7F00-2401
MSR 00000777: 0000-0000-0000-0000
MSR 00000832: 0000-0000-0000-00D1
MSR 00000838: 0000-0000-0000-0258
MSR 00000839: 0000-0000-0000-0256
MSR 0000083E: 0000-0000-0000-000A

------[ MSR Registers / Logical CPU #4 ]------

MSR 00000017: 001C-0000-0000-0000 [PlatID = 7]
MSR 0000001B: 0000-0000-FEE0-0C00
MSR 0000002A: 0000-0000-0000-0000
MSR 00000035: 0000-0000-0006-0006
MSR 00000048: 0000-0000-0000-0001
MSR 00000049: < FAILED >
MSR 0000008B: 0000-0008-0000-0000
MSR 000000CD: < FAILED >
MSR 000000CE: 0804-043D-F080-1900 [eD = 0]
MSR 000000E7: 0000-0025-C260-984C
MSR 000000E8: 0000-002E-403E-1A3C
MSR 000000EE: < FAILED >
MSR 0000010A: 0000-0000-0DB9-FD6B
MSR 0000010B: < FAILED >
MSR 0000011E: < FAILED >
MSR 00000194: 0000-0000-0011-0000
MSR 00000198: 0000-0000-0000-2400
MSR 00000199: 0000-0000-0000-0F00
MSR 0000019A: 0000-0000-0000-0000
MSR 0000019B: 0000-0000-0000-0010
MSR 0000019C: 0000-0000-8835-0000
MSR 0000019D: 0000-0000-0000-0000
MSR 000001A0: 0000-0000-0085-1089
MSR 000001A2: 0000-0000-0664-0000
MSR 000001A4: 0000-0000-0000-0004
MSR 000001AA: 0000-0000-0000-30C2
MSR 000001AC: < FAILED >
MSR 000001AD: 2D2D-2D2D-2D2E-2F30
MSR 000001AE: 0807-0605-0403-0201
MSR 000001AF: < FAILED >
MSR 000001B0: 0000-0000-0000-0002
MSR 000001B1: 0000-0000-8832-0802
MSR 000001B2: 0000-0000-0200-0000
MSR 000001FC: 0000-0000-08E4-005F
MSR 00000300: < FAILED >
MSR 0000030A: 0000-0000-0000-0000
MSR 0000030B: 0000-0000-0000-0000
MSR 00000480: 07DA-0600-0000-0015
MSR 00000481: 0000-00FF-0000-0016
MSR 00000482: FFFB-FFFE-0401-E172
MSR 00000483: FF7F-FFFF-0003-6DFF
MSR 00000484: 01FE-FFFF-0000-11FF
MSR 00000485: 0000-0000-7004-C1E7
MSR 00000486: 0000-0000-8000-0021
MSR 00000487: 0000-0000-FFFF-FFFF
MSR 00000488: 0000-0000-0000-2000
MSR 00000489: 0000-0001-1BF7-6FFF
MSR 0000048A: 0000-0000-0000-002E
MSR 0000048B: C75F-7FFF-0000-0000
MSR 0000048C: 0001-0F01-06F3-4141
MSR 0000048D: 0000-00FF-0000-0016
MSR 0000048E: FFFB-FFFE-0400-6172
MSR 0000048F: FF7F-FFFF-0003-6DFB
MSR 00000490: 01FE-FFFF-0000-11FB
MSR 00000601: 0000-0000-0000-02E8
MSR 00000602: < FAILED >
MSR 00000603: 0036-0000-0036-3636
MSR 00000604: < FAILED >
MSR 00000606: 0000-0000-000A-0E03
MSR 0000060A: 0000-0000-0000-0000
MSR 0000060B: 0000-0000-0000-0000
MSR 0000060C: 0000-0000-0000-0000
MSR 0000060D: 0000-0000-27D7-4AC5
MSR 00000610: 0000-8118-00DD-80F0
MSR 00000611: 0000-0000-01BA-CF9D
MSR 00000613: 0000-0000-0000-0000
MSR 00000614: 0000-0000-0000-0078
MSR 00000618: 0000-0000-0000-0000
MSR 00000619: 0000-0000-0013-AA59
MSR 0000061B: 0000-0000-0000-0000
MSR 0000061C: < FAILED >
MSR 0000061E: < FAILED >
MSR 00000620: 0000-0000-0000-042B
MSR 00000621: 0000-0000-1F64-002B
MSR 00000638: 0000-0000-0000-0000
MSR 00000639: 0000-0000-0160-1B7A
MSR 0000063A: 0000-0000-0000-0000
MSR 0000063B: < FAILED >
MSR 00000640: 0000-0000-0000-0000
MSR 00000641: 0000-0000-0001-5176
MSR 00000642: 0000-0000-0000-0010
MSR 00000648: 0000-0000-0000-000F
MSR 00000649: 0000-0000-000A-0050
MSR 0000064A: 0000-0000-0019-00E0
MSR 0000064B: 0000-0000-0000-0000
MSR 0000064C: 0000-0000-0000-000E
MSR 00000650: 2424-2424-2424-2424
MSR 00000651: 0404-0404-0404-0404
MSR 00000660: 0000-0018-CA2D-4D84
MSR 00000661: < FAILED >
MSR 00000662: < FAILED >
MSR 00000663: < FAILED >
MSR 00000664: 0000-0003-D7CF-2B66
MSR 00000665: < FAILED >
MSR 00000666: < FAILED >
MSR 00000667: < FAILED >
MSR 00000668: < FAILED >
MSR 00000669: < FAILED >
MSR 0000066A: < FAILED >
MSR 0000066B: < FAILED >
MSR 0000066C: < FAILED >
MSR 0000066D: < FAILED >
MSR 0000066E: < FAILED >
MSR 0000066F: < FAILED >
MSR 00000670: < FAILED >
MSR 00000671: < FAILED >
MSR 00000672: < FAILED >
MSR 00000673: < FAILED >
MSR 00000674: < FAILED >
MSR 00000675: < FAILED >
MSR 00000676: < FAILED >
MSR 00000677: < FAILED >
MSR 00000690: < FAILED >
MSR 000006B0: 0000-0000-1800-0000
MSR 000006B1: 0000-0000-0000-0000
MSR 00000770: 0000-0000-0000-0001
MSR 00000771: 0000-0000-0110-0E24
MSR 00000772: 0000-0000-8000-FF01
MSR 00000773: 0000-0000-0000-0005
MSR 00000774: 0000-019E-7F00-2401
MSR 00000777: 0000-0000-0000-0000
MSR 00000832: 0000-0000-0002-00D1
MSR 00000838: 0000-0000-0000-020A
MSR 00000839: 0000-0000-0000-0173
MSR 0000083E: 0000-0000-0000-000A

------[ MSR Registers / Logical CPU #5 ]------

MSR 00000017: 001C-0000-0000-0000 [PlatID = 7]
MSR 0000001B: 0000-0000-FEE0-0C00
MSR 0000002A: 0000-0000-0000-0000
MSR 00000035: 0000-0000-0006-0006
MSR 00000048: 0000-0000-0000-0001
MSR 00000049: < FAILED >
MSR 0000008B: 0000-0008-0000-0000
MSR 000000CD: < FAILED >
MSR 000000CE: 0804-043D-F080-1900 [eD = 0]
MSR 000000E7: 0000-0029-B279-0618
MSR 000000E8: 0000-0032-3B85-C05A
MSR 000000EE: < FAILED >
MSR 0000010A: 0000-0000-0DB9-FD6B
MSR 0000010B: < FAILED >
MSR 0000011E: < FAILED >
MSR 00000194: 0000-0000-0011-0000
MSR 00000198: 0000-0000-0000-2400
MSR 00000199: 0000-0000-0000-0F00
MSR 0000019A: 0000-0000-0000-0000
MSR 0000019B: 0000-0000-0000-0010
MSR 0000019C: 0000-0000-8835-0000
MSR 0000019D: 0000-0000-0000-0000
MSR 000001A0: 0000-0000-0085-1089
MSR 000001A2: 0000-0000-0664-0000
MSR 000001A4: 0000-0000-0000-0004
MSR 000001AA: 0000-0000-0000-30C2
MSR 000001AC: < FAILED >
MSR 000001AD: 2D2D-2D2D-2D2E-2F30
MSR 000001AE: 0807-0605-0403-0201
MSR 000001AF: < FAILED >
MSR 000001B0: 0000-0000-0000-0002
MSR 000001B1: 0000-0000-8831-0802
MSR 000001B2: 0000-0000-0200-0000
MSR 000001FC: 0000-0000-08E4-005F
MSR 00000300: < FAILED >
MSR 0000030A: 0000-0000-0000-0000
MSR 0000030B: 0000-0000-0000-0000
MSR 00000480: 07DA-0600-0000-0015
MSR 00000481: 0000-00FF-0000-0016
MSR 00000482: FFFB-FFFE-0401-E172
MSR 00000483: FF7F-FFFF-0003-6DFF
MSR 00000484: 01FE-FFFF-0000-11FF
MSR 00000485: 0000-0000-7004-C1E7
MSR 00000486: 0000-0000-8000-0021
MSR 00000487: 0000-0000-FFFF-FFFF
MSR 00000488: 0000-0000-0000-2000
MSR 00000489: 0000-0001-1BF7-6FFF
MSR 0000048A: 0000-0000-0000-002E
MSR 0000048B: C75F-7FFF-0000-0000
MSR 0000048C: 0001-0F01-06F3-4141
MSR 0000048D: 0000-00FF-0000-0016
MSR 0000048E: FFFB-FFFE-0400-6172
MSR 0000048F: FF7F-FFFF-0003-6DFB
MSR 00000490: 01FE-FFFF-0000-11FB
MSR 00000601: 0000-0000-0000-02E8
MSR 00000602: < FAILED >
MSR 00000603: 0036-0000-0036-3636
MSR 00000604: < FAILED >
MSR 00000606: 0000-0000-000A-0E03
MSR 0000060A: 0000-0000-0000-0000
MSR 0000060B: 0000-0000-0000-0000
MSR 0000060C: 0000-0000-0000-0000
MSR 0000060D: 0000-0000-27D7-4AC5
MSR 00000610: 0000-8118-00DD-80F0
MSR 00000611: 0000-0000-01BA-D00B
MSR 00000613: 0000-0000-0000-0000
MSR 00000614: 0000-0000-0000-0078
MSR 00000618: 0000-0000-0000-0000
MSR 00000619: 0000-0000-0013-AA60
MSR 0000061B: 0000-0000-0000-0000
MSR 0000061C: < FAILED >
MSR 0000061E: < FAILED >
MSR 00000620: 0000-0000-0000-042B
MSR 00000621: 0000-0000-13C7-0008
MSR 00000638: 0000-0000-0000-0000
MSR 00000639: 0000-0000-0160-1BD5
MSR 0000063A: 0000-0000-0000-0000
MSR 0000063B: < FAILED >
MSR 00000640: 0000-0000-0000-0000
MSR 00000641: 0000-0000-0001-5176
MSR 00000642: 0000-0000-0000-0010
MSR 00000648: 0000-0000-0000-000F
MSR 00000649: 0000-0000-000A-0050
MSR 0000064A: 0000-0000-0019-00E0
MSR 0000064B: 0000-0000-0000-0000
MSR 0000064C: 0000-0000-0000-000E
MSR 00000650: 2424-2424-2424-2424
MSR 00000651: 0404-0404-0404-0404
MSR 00000660: 0000-001B-3BA5-FE32
MSR 00000661: < FAILED >
MSR 00000662: < FAILED >
MSR 00000663: < FAILED >
MSR 00000664: 0000-0003-D7CF-2B66
MSR 00000665: < FAILED >
MSR 00000666: < FAILED >
MSR 00000667: < FAILED >
MSR 00000668: < FAILED >
MSR 00000669: < FAILED >
MSR 0000066A: < FAILED >
MSR 0000066B: < FAILED >
MSR 0000066C: < FAILED >
MSR 0000066D: < FAILED >
MSR 0000066E: < FAILED >
MSR 0000066F: < FAILED >
MSR 00000670: < FAILED >
MSR 00000671: < FAILED >
MSR 00000672: < FAILED >
MSR 00000673: < FAILED >
MSR 00000674: < FAILED >
MSR 00000675: < FAILED >
MSR 00000676: < FAILED >
MSR 00000677: < FAILED >
MSR 00000690: < FAILED >
MSR 000006B0: 0000-0000-1800-0000
MSR 000006B1: 0000-0000-0000-0000
MSR 00000770: 0000-0000-0000-0001
MSR 00000771: 0000-0000-0110-0E24
MSR 00000772: 0000-0000-8000-FF01
MSR 00000773: 0000-0000-0000-0005
MSR 00000774: 0000-019E-7F00-2401
MSR 00000777: 0000-0000-0000-0000
MSR 00000832: 0000-0000-0002-00D1
MSR 00000838: 0000-0000-0000-020A
MSR 00000839: 0000-0000-0000-0173
MSR 0000083E: 0000-0000-0000-000A
