------[ CPUID Registers / Logical CPU #0 ]------

allcpu: Package 0 / Core 0 / Thread 0: Valid

CPUID 00000000: 0000001B-756E6547-6C65746E-49656E69 [GenuineIntel]
CPUID 00000001: 000806A1-00100800-4FD8EBBF-BFEBFBFF
CPUID 00000002: 00FEFF01-00000000-00000000-00000000
CPUID 00000003: 00000000-00000000-00000000-00000000
CPUID 00000004: 1C000121-01C0003F-0000003F-00000000 [SL 00] [L1D: 32 KB]
CPUID 00000004: 1C000122-01C0003F-0000003F-00000000 [SL 01] [L1I: 32 KB]
CPUID 00000004: 1C01C143-02C0003F-000007FF-00000000 [SL 02] [L2U: 1536 KB]
CPUID 00000004: 1C03C163-03C0003F-00000FFF-00000006 [SL 03] [L3U: 4 MB]
CPUID 00000005: 00000040-00000040-00000003-11122020
CPUID 00000006: 001F8FF7-00000002-00000009-00000003
CPUID 00000007: 00000000-239422C3-00400104-BC008400 [SL 00]
CPUID 00000008: 00000000-00000000-00000000-00000000
CPUID 00000009: 00000000-00000000-00000000-00000000
CPUID 0000000A: 07300405-00000004-00000007-00008603
CPUID 0000000B: 00000001-00000001-00000100-00000000 [SL 00]
CPUID 0000000B: 00000004-00000005-00000201-00000000 [SL 01]
CPUID 0000000C: 00000000-00000000-00000000-00000000
CPUID 0000000D: 00000003-00000240-00000240-00000000 [SL 00] [x87]
CPUID 0000000D: 0000000F-000002C0-00000100-00000000 [SL 01] [SSE]
CPUID 0000000D: 00000080-00000000-00000001-00000000 [SL 08] [PT]
CPUID 0000000E: 00000000-00000000-00000000-00000000
CPUID 0000000F: 00000000-00000000-00000000-00000000 [SL 00]
CPUID 0000000F: 00000000-00000000-00000000-00000000 [SL 01]
CPUID 00000010: 00000000-00000000-00000000-00000000 [SL 00]
CPUID 00000010: 00000000-00000000-00000000-00000000 [SL 01]
CPUID 00000011: 00000000-00000000-00000000-00000000
CPUID 00000012: 00000000-00000000-00000000-00000000 [SL 00]
CPUID 00000012: 00000000-00000000-00000000-00000000 [SL 01]
CPUID 00000013: 00000000-00000000-00000000-00000000
CPUID 00000014: 00000001-0000000F-80000007-00000000 [SL 00]
CPUID 00000014: 02490002-003F1FFF-00000000-00000000 [SL 01]
CPUID 00000015: 00000002-00000048-0249F000-00000000 [36.00x / 38400000]
CPUID 00000016: 00000578-00000BB8-00000064-00000000 [1400 / 3000 / 100]
CPUID 00000017: 00000000-00000000-00000000-00000000 [SL 00]
CPUID 00000018: 00000005-00000000-00000000-00000000 [SL 00]
CPUID 00000018: 00000000-00300001-00000001-00000121 [SL 01]
CPUID 00000018: 00000000-00040001-00000100-00000043 [SL 02]
CPUID 00000018: 00000000-00040006-00000010-00000043 [SL 03]
CPUID 00000018: 00000000-00300001-00000001-00000122 [SL 04]
CPUID 00000018: 00000000-00000000-00000000-00000000 [SL 05]
CPUID 00000019: 00000000-00000000-00000000-00000000
CPUID 0000001A: 20000000-00000000-00000000-00000000
CPUID 0000001B: 00000000-00000000-00000000-00000000
CPUID 80000000: 80000008-00000000-00000000-00000000
CPUID 80000001: 00000000-00000000-00000101-28100000
CPUID 80000002: 65746E49-2952286C-726F4320-4D542865 [Intel(R) Core(TM]
CPUID 80000003: 35692029-36314C2D-43203747-40205550 [) i5-L16G7 CPU @]
CPUID 80000004: 342E3120-7A484730-00000000-00000000 [ 1.40GHz]
CPUID 80000005: 00000000-00000000-00000000-00000000 [L1D: 0 KB / L1I: 0 KB]
CPUID 80000006: 00000000-00000000-06006040-00000000 [L2: 1536 KB] / L3: 0 KB]
CPUID 80000007: 00000000-00000000-00000000-00000100
CPUID 80000008: 00003027-00000000-00000000-00000000

L1    Data Cache:    32 KB,  8-way Associative, 64-byte Line
L1  Instr. Cache:    32 KB,  8-way Associative, 64-byte Line
L2 Unified Cache:  1536 KB, 12-way Associative, 64-byte Line
L3 Unified Cache:     4 MB, 16-way Associative, 64-byte Line

------[ CPUID Registers / Logical CPU #1 ]------

allcpu: Package 0 / Core 1 / Thread 0: Valid

CPUID 00000000: 0000001B-756E6547-6C65746E-49656E69 [GenuineIntel]
CPUID 00000001: 000806A1-02100800-4FD8EBBF-BFEBFBFF
CPUID 00000002: 00FEFF01-00000000-00000000-00000000
CPUID 00000003: 00000000-00000000-00000000-00000000
CPUID 00000004: 1C000121-01C0003F-0000003F-00000000 [SL 00] [L1D: 32 KB]
CPUID 00000004: 1C000122-01C0003F-0000003F-00000000 [SL 01] [L1I: 32 KB]
CPUID 00000004: 1C01C143-02C0003F-000007FF-00000000 [SL 02] [L2U: 1536 KB]
CPUID 00000004: 1C03C163-03C0003F-00000FFF-00000006 [SL 03] [L3U: 4 MB]
CPUID 00000005: 00000040-00000040-00000003-11122020
CPUID 00000006: 001F8FF7-00000002-00000009-00010003
CPUID 00000007: 00000000-239422C3-00400104-BC008400 [SL 00]
CPUID 00000008: 00000000-00000000-00000000-00000000
CPUID 00000009: 00000000-00000000-00000000-00000000
CPUID 0000000A: 07300405-00000004-00000007-00008603
CPUID 0000000B: 00000001-00000001-00000100-00000002 [SL 00]
CPUID 0000000B: 00000004-00000005-00000201-00000002 [SL 01]
CPUID 0000000C: 00000000-00000000-00000000-00000000
CPUID 0000000D: 00000003-00000240-00000240-00000000 [SL 00] [x87]
CPUID 0000000D: 0000000F-000002C0-00000100-00000000 [SL 01] [SSE]
CPUID 0000000D: 00000080-00000000-00000001-00000000 [SL 08] [PT]
CPUID 0000000E: 00000000-00000000-00000000-00000000
CPUID 0000000F: 00000000-00000000-00000000-00000000 [SL 00]
CPUID 0000000F: 00000000-00000000-00000000-00000000 [SL 01]
CPUID 00000010: 00000000-00000000-00000000-00000000 [SL 00]
CPUID 00000010: 00000000-00000000-00000000-00000000 [SL 01]
CPUID 00000011: 00000000-00000000-00000000-00000000
CPUID 00000012: 00000000-00000000-00000000-00000000 [SL 00]
CPUID 00000012: 00000000-00000000-00000000-00000000 [SL 01]
CPUID 00000013: 00000000-00000000-00000000-00000000
CPUID 00000014: 00000001-0000000F-80000007-00000000 [SL 00]
CPUID 00000014: 02490002-003F1FFF-00000000-00000000 [SL 01]
CPUID 00000015: 00000002-00000048-0249F000-00000000 [36.00x / 38400000]
CPUID 00000016: 00000578-00000BB8-00000064-00000000 [1400 / 3000 / 100]
CPUID 00000017: 00000000-00000000-00000000-00000000 [SL 00]
CPUID 00000018: 00000005-00000000-00000000-00000000 [SL 00]
CPUID 00000018: 00000000-00300001-00000001-00000121 [SL 01]
CPUID 00000018: 00000000-00040001-00000100-00000043 [SL 02]
CPUID 00000018: 00000000-00040006-00000010-00000043 [SL 03]
CPUID 00000018: 00000000-00300001-00000001-00000122 [SL 04]
CPUID 00000018: 00000000-00000000-00000000-00000000 [SL 05]
CPUID 00000019: 00000000-00000000-00000000-00000000
CPUID 0000001A: 20000000-00000000-00000000-00000000
CPUID 0000001B: 00000000-00000000-00000000-00000000
CPUID 80000000: 80000008-00000000-00000000-00000000
CPUID 80000001: 00000000-00000000-00000101-28100000
CPUID 80000002: 65746E49-2952286C-726F4320-4D542865 [Intel(R) Core(TM]
CPUID 80000003: 35692029-36314C2D-43203747-40205550 [) i5-L16G7 CPU @]
CPUID 80000004: 342E3120-7A484730-00000000-00000000 [ 1.40GHz]
CPUID 80000005: 00000000-00000000-00000000-00000000 [L1D: 0 KB / L1I: 0 KB]
CPUID 80000006: 00000000-00000000-06006040-00000000 [L2: 1536 KB] / L3: 0 KB]
CPUID 80000007: 00000000-00000000-00000000-00000100
CPUID 80000008: 00003027-00000000-00000000-00000000

L1    Data Cache:    32 KB,  8-way Associative, 64-byte Line
L1  Instr. Cache:    32 KB,  8-way Associative, 64-byte Line
L2 Unified Cache:  1536 KB, 12-way Associative, 64-byte Line
L3 Unified Cache:     4 MB, 16-way Associative, 64-byte Line

------[ CPUID Registers / Logical CPU #2 ]------

allcpu: Package 0 / Core 2 / Thread 0: Valid

CPUID 00000000: 0000001B-756E6547-6C65746E-49656E69 [GenuineIntel]
CPUID 00000001: 000806A1-04100800-4FD8EBBF-BFEBFBFF
CPUID 00000002: 00FEFF01-00000000-00000000-00000000
CPUID 00000003: 00000000-00000000-00000000-00000000
CPUID 00000004: 1C000121-01C0003F-0000003F-00000000 [SL 00] [L1D: 32 KB]
CPUID 00000004: 1C000122-01C0003F-0000003F-00000000 [SL 01] [L1I: 32 KB]
CPUID 00000004: 1C01C143-02C0003F-000007FF-00000000 [SL 02] [L2U: 1536 KB]
CPUID 00000004: 1C03C163-03C0003F-00000FFF-00000006 [SL 03] [L3U: 4 MB]
CPUID 00000005: 00000040-00000040-00000003-11122020
CPUID 00000006: 001F8FF7-00000002-00000009-00020003
CPUID 00000007: 00000000-239422C3-00400104-BC008400 [SL 00]
CPUID 00000008: 00000000-00000000-00000000-00000000
CPUID 00000009: 00000000-00000000-00000000-00000000
CPUID 0000000A: 07300405-00000004-00000007-00008603
CPUID 0000000B: 00000001-00000001-00000100-00000004 [SL 00]
CPUID 0000000B: 00000004-00000005-00000201-00000004 [SL 01]
CPUID 0000000C: 00000000-00000000-00000000-00000000
CPUID 0000000D: 00000003-00000240-00000240-00000000 [SL 00] [x87]
CPUID 0000000D: 0000000F-000002C0-00000100-00000000 [SL 01] [SSE]
CPUID 0000000D: 00000080-00000000-00000001-00000000 [SL 08] [PT]
CPUID 0000000E: 00000000-00000000-00000000-00000000
CPUID 0000000F: 00000000-00000000-00000000-00000000 [SL 00]
CPUID 0000000F: 00000000-00000000-00000000-00000000 [SL 01]
CPUID 00000010: 00000000-00000000-00000000-00000000 [SL 00]
CPUID 00000010: 00000000-00000000-00000000-00000000 [SL 01]
CPUID 00000011: 00000000-00000000-00000000-00000000
CPUID 00000012: 00000000-00000000-00000000-00000000 [SL 00]
CPUID 00000012: 00000000-00000000-00000000-00000000 [SL 01]
CPUID 00000013: 00000000-00000000-00000000-00000000
CPUID 00000014: 00000001-0000000F-80000007-00000000 [SL 00]
CPUID 00000014: 02490002-003F1FFF-00000000-00000000 [SL 01]
CPUID 00000015: 00000002-00000048-0249F000-00000000 [36.00x / 38400000]
CPUID 00000016: 00000578-00000BB8-00000064-00000000 [1400 / 3000 / 100]
CPUID 00000017: 00000000-00000000-00000000-00000000 [SL 00]
CPUID 00000018: 00000005-00000000-00000000-00000000 [SL 00]
CPUID 00000018: 00000000-00300001-00000001-00000121 [SL 01]
CPUID 00000018: 00000000-00040001-00000100-00000043 [SL 02]
CPUID 00000018: 00000000-00040006-00000010-00000043 [SL 03]
CPUID 00000018: 00000000-00300001-00000001-00000122 [SL 04]
CPUID 00000018: 00000000-00000000-00000000-00000000 [SL 05]
CPUID 00000019: 00000000-00000000-00000000-00000000
CPUID 0000001A: 20000000-00000000-00000000-00000000
CPUID 0000001B: 00000000-00000000-00000000-00000000
CPUID 80000000: 80000008-00000000-00000000-00000000
CPUID 80000001: 00000000-00000000-00000101-28100000
CPUID 80000002: 65746E49-2952286C-726F4320-4D542865 [Intel(R) Core(TM]
CPUID 80000003: 35692029-36314C2D-43203747-40205550 [) i5-L16G7 CPU @]
CPUID 80000004: 342E3120-7A484730-00000000-00000000 [ 1.40GHz]
CPUID 80000005: 00000000-00000000-00000000-00000000 [L1D: 0 KB / L1I: 0 KB]
CPUID 80000006: 00000000-00000000-06006040-00000000 [L2: 1536 KB] / L3: 0 KB]
CPUID 80000007: 00000000-00000000-00000000-00000100
CPUID 80000008: 00003027-00000000-00000000-00000000

L1    Data Cache:    32 KB,  8-way Associative, 64-byte Line
L1  Instr. Cache:    32 KB,  8-way Associative, 64-byte Line
L2 Unified Cache:  1536 KB, 12-way Associative, 64-byte Line
L3 Unified Cache:     4 MB, 16-way Associative, 64-byte Line

------[ CPUID Registers / Logical CPU #3 ]------

allcpu: Package 0 / Core 3 / Thread 0: Valid

CPUID 00000000: 0000001B-756E6547-6C65746E-49656E69 [GenuineIntel]
CPUID 00000001: 000806A1-06100800-4FD8EBBF-BFEBFBFF
CPUID 00000002: 00FEFF01-00000000-00000000-00000000
CPUID 00000003: 00000000-00000000-00000000-00000000
CPUID 00000004: 1C000121-01C0003F-0000003F-00000000 [SL 00] [L1D: 32 KB]
CPUID 00000004: 1C000122-01C0003F-0000003F-00000000 [SL 01] [L1I: 32 KB]
CPUID 00000004: 1C01C143-02C0003F-000007FF-00000000 [SL 02] [L2U: 1536 KB]
CPUID 00000004: 1C03C163-03C0003F-00000FFF-00000006 [SL 03] [L3U: 4 MB]
CPUID 00000005: 00000040-00000040-00000003-11122020
CPUID 00000006: 001F8FF7-00000002-00000009-00030003
CPUID 00000007: 00000000-239422C3-00400104-BC008400 [SL 00]
CPUID 00000008: 00000000-00000000-00000000-00000000
CPUID 00000009: 00000000-00000000-00000000-00000000
CPUID 0000000A: 07300405-00000004-00000007-00008603
CPUID 0000000B: 00000001-00000001-00000100-00000006 [SL 00]
CPUID 0000000B: 00000004-00000005-00000201-00000006 [SL 01]
CPUID 0000000C: 00000000-00000000-00000000-00000000
CPUID 0000000D: 00000003-00000240-00000240-00000000 [SL 00] [x87]
CPUID 0000000D: 0000000F-000002C0-00000100-00000000 [SL 01] [SSE]
CPUID 0000000D: 00000080-00000000-00000001-00000000 [SL 08] [PT]
CPUID 0000000E: 00000000-00000000-00000000-00000000
CPUID 0000000F: 00000000-00000000-00000000-00000000 [SL 00]
CPUID 0000000F: 00000000-00000000-00000000-00000000 [SL 01]
CPUID 00000010: 00000000-00000000-00000000-00000000 [SL 00]
CPUID 00000010: 00000000-00000000-00000000-00000000 [SL 01]
CPUID 00000011: 00000000-00000000-00000000-00000000
CPUID 00000012: 00000000-00000000-00000000-00000000 [SL 00]
CPUID 00000012: 00000000-00000000-00000000-00000000 [SL 01]
CPUID 00000013: 00000000-00000000-00000000-00000000
CPUID 00000014: 00000001-0000000F-80000007-00000000 [SL 00]
CPUID 00000014: 02490002-003F1FFF-00000000-00000000 [SL 01]
CPUID 00000015: 00000002-00000048-0249F000-00000000 [36.00x / 38400000]
CPUID 00000016: 00000578-00000BB8-00000064-00000000 [1400 / 3000 / 100]
CPUID 00000017: 00000000-00000000-00000000-00000000 [SL 00]
CPUID 00000018: 00000005-00000000-00000000-00000000 [SL 00]
CPUID 00000018: 00000000-00300001-00000001-00000121 [SL 01]
CPUID 00000018: 00000000-00040001-00000100-00000043 [SL 02]
CPUID 00000018: 00000000-00040006-00000010-00000043 [SL 03]
CPUID 00000018: 00000000-00300001-00000001-00000122 [SL 04]
CPUID 00000018: 00000000-00000000-00000000-00000000 [SL 05]
CPUID 00000019: 00000000-00000000-00000000-00000000
CPUID 0000001A: 20000000-00000000-00000000-00000000
CPUID 0000001B: 00000000-00000000-00000000-00000000
CPUID 80000000: 80000008-00000000-00000000-00000000
CPUID 80000001: 00000000-00000000-00000101-28100000
CPUID 80000002: 65746E49-2952286C-726F4320-4D542865 [Intel(R) Core(TM]
CPUID 80000003: 35692029-36314C2D-43203747-40205550 [) i5-L16G7 CPU @]
CPUID 80000004: 342E3120-7A484730-00000000-00000000 [ 1.40GHz]
CPUID 80000005: 00000000-00000000-00000000-00000000 [L1D: 0 KB / L1I: 0 KB]
CPUID 80000006: 00000000-00000000-06006040-00000000 [L2: 1536 KB] / L3: 0 KB]
CPUID 80000007: 00000000-00000000-00000000-00000100
CPUID 80000008: 00003027-00000000-00000000-00000000

L1    Data Cache:    32 KB,  8-way Associative, 64-byte Line
L1  Instr. Cache:    32 KB,  8-way Associative, 64-byte Line
L2 Unified Cache:  1536 KB, 12-way Associative, 64-byte Line
L3 Unified Cache:     4 MB, 16-way Associative, 64-byte Line

------[ CPUID Registers / Logical CPU #4 ]------

allcpu: Package 0 / Core 4 / Thread 0: Valid

CPUID 00000000: 0000001B-756E6547-6C65746E-49656E69 [GenuineIntel]
CPUID 00000001: 000806A1-08100800-4FD8EBBF-BFEBFBFF
CPUID 00000002: 00FEFF01-000000F0-00000000-00000000
CPUID 00000003: 00000000-00000000-00000000-00000000
CPUID 00000004: 1C004121-02C0003F-0000003F-00000000 [SL 00] [L1D: 48 KB]
CPUID 00000004: 1C004122-01C0003F-0000003F-00000000 [SL 01] [L1I: 32 KB]
CPUID 00000004: 1C004143-01C0003F-000003FF-00000000 [SL 02] [L2U: 512 KB]
CPUID 00000004: 1C03C163-03C0003F-00000FFF-00000006 [SL 03] [L3U: 4 MB]
CPUID 00000005: 00000040-00000040-00000003-11122020
CPUID 00000006: 001F8FF7-00000002-00000001-00040003
CPUID 00000007: 00000000-239422C3-00400104-BC008400 [SL 00]
CPUID 00000008: 00000000-00000000-00000000-00000000
CPUID 00000009: 00000000-00000000-00000000-00000000
CPUID 0000000A: 07300405-00000004-00000007-00008603
CPUID 0000000B: 00000001-00000001-00000100-00000008 [SL 00]
CPUID 0000000B: 00000004-00000005-00000201-00000008 [SL 01]
CPUID 0000000C: 00000000-00000000-00000000-00000000
CPUID 0000000D: 00000003-00000240-00000240-00000000 [SL 00] [x87]
CPUID 0000000D: 0000000F-000002C0-00000100-00000000 [SL 01] [SSE]
CPUID 0000000D: 00000080-00000000-00000001-00000000 [SL 08] [PT]
CPUID 0000000E: 00000000-00000000-00000000-00000000
CPUID 0000000F: 00000000-00000000-00000000-00000000 [SL 00]
CPUID 0000000F: 00000000-00000000-00000000-00000000 [SL 01]
CPUID 00000010: 00000000-00000000-00000000-00000000 [SL 00]
CPUID 00000010: 00000000-00000000-00000000-00000000 [SL 01]
CPUID 00000011: 00000000-00000000-00000000-00000000
CPUID 00000012: 00000000-00000000-00000000-00000000 [SL 00]
CPUID 00000012: 00000000-00000000-00000000-00000000 [SL 01]
CPUID 00000013: 00000000-00000000-00000000-00000000
CPUID 00000014: 00000001-0000000F-00000007-00000000 [SL 00]
CPUID 00000014: 02490002-003F1FFF-00000000-00000000 [SL 01]
CPUID 00000015: 00000002-00000048-0249F000-00000000 [36.00x / 38400000]
CPUID 00000016: 00000578-00000BB8-00000064-00000000 [1400 / 3000 / 100]
CPUID 00000017: 00000000-00000000-00000000-00000000 [SL 00]
CPUID 00000018: 00000007-00000000-00000000-00000000 [SL 00]
CPUID 00000018: 00000000-00080007-00000001-00004122 [SL 01]
CPUID 00000018: 00000000-00100007-00000001-00004125 [SL 02]
CPUID 00000018: 00000000-00040001-00000010-00004024 [SL 03]
CPUID 00000018: 00000000-00040006-00000008-00004024 [SL 04]
CPUID 00000018: 00000000-00000000-00000000-00000000 [SL 05]
CPUID 00000018: 00000000-00080007-00000080-00004043 [SL 06]
CPUID 00000018: 00000000-00080001-00000080-00004043 [SL 07]
CPUID 00000019: 00000000-00000000-00000000-00000000
CPUID 0000001A: 40000000-00000000-00000000-00000000
CPUID 0000001B: 00000000-00000000-00000000-00000000
CPUID 80000000: 80000008-00000000-00000000-00000000
CPUID 80000001: 00000000-00000000-00000101-28100000
CPUID 80000002: 65746E49-2952286C-726F4320-4D542865 [Intel(R) Core(TM]
CPUID 80000003: 35692029-36314C2D-43203747-40205550 [) i5-L16G7 CPU @]
CPUID 80000004: 342E3120-7A484730-00000000-00000000 [ 1.40GHz]
CPUID 80000005: 00000000-00000000-00000000-00000000 [L1D: 0 KB / L1I: 0 KB]
CPUID 80000006: 00000000-00000000-01006040-00000000 [L2: 256 KB] / L3: 0 KB]
CPUID 80000007: 00000000-00000000-00000000-00000100
CPUID 80000008: 00003027-00000000-00000000-00000000

L1    Data Cache:    48 KB, 12-way Associative, 64-byte Line
L1  Instr. Cache:    32 KB,  8-way Associative, 64-byte Line
L2 Unified Cache:   512 KB,  8-way Associative, 64-byte Line
L3 Unified Cache:     4 MB, 16-way Associative, 64-byte Line

------[ All CPUs ]------

CPU   0: APICID    0 / Package 0 / Core   0 / Thread 0: Valid
CPU   1: APICID    2 / Package 0 / Core   1 / Thread 0: Valid
CPU   2: APICID    4 / Package 0 / Core   2 / Thread 0: Valid
CPU   3: APICID    6 / Package 0 / Core   3 / Thread 0: Valid
CPU   4: APICID    8 / Package 0 / Core   4 / Thread 0: Valid

------[ MSR Registers / Logical CPU #0 ]------

MSR 00000017: 0010-0000-0000-0000 [PlatID = 4]
MSR 0000001B: 0000-0000-FEE0-0900
MSR 0000002A: 0000-0000-0000-0000
MSR 00000048: 0000-0000-0000-0001
MSR 00000049: < FAILED >
MSR 0000008B: 2400-0022-0000-0000
MSR 000000CE: 0005-0830-F081-0E00
MSR 000000E7: 0000-009B-6544-B310 [S200]
MSR 000000E7: 0000-009B-65F4-B798 [S200]
MSR 000000E7: 0000-009B-6646-9D94
MSR 000000E8: 0000-00AE-1191-AE5C [S200]
MSR 000000E8: 0000-00AE-12B9-3DA4 [S200]
MSR 000000E8: 0000-00AE-12E7-F1C4
MSR 0000010A: 0000-0000-8000-002B
MSR 0000010B: < FAILED >
MSR 00000198: 0000-0000-0000-0800 [S200]
MSR 00000198: 0000-0000-0000-0800 [S200]
MSR 00000198: 0000-0000-0000-0800
MSR 00000199: 0000-0000-0000-0800
MSR 0000019A: 0000-0000-0000-0000
MSR 0000019B: 0000-0000-0000-0010
MSR 0000019C: 0000-0000-883A-0800 [S200]
MSR 0000019C: 0000-0000-883A-0800 [S200]
MSR 0000019C: 0000-0000-8839-0800
MSR 0000019D: 0000-0000-0000-0000
MSR 00000480: 00DA-0500-0000-0013
MSR 00000481: 0000-00FF-0000-0016
MSR 00000482: FFF9-FFFE-0401-E172
MSR 00000483: 037F-FFFF-0003-6DFF
MSR 00000484: 0006-FFFF-0000-11FF
MSR 00000485: 0000-0000-7004-C1E7
MSR 00000486: 0000-0000-8000-0021
MSR 00000487: 0000-0000-FFFF-FFFF
MSR 00000488: 0000-0000-0000-2000
MSR 00000489: 0000-0000-0035-2FFF
MSR 0000048A: 0000-0000-0000-002E
MSR 0000048B: 035D-6FFF-0000-0000
MSR 0000048C: 0000-0F01-0671-4141
MSR 0000048D: 0000-00FF-0000-0016
MSR 0000048E: FFF9-FFFE-0400-6172
MSR 0000048F: 037F-FFFF-0003-6DFB
MSR 00000490: 0006-FFFF-0000-11FB
MSR 00000770: 0000-0000-0000-0001
MSR 00000771: 0000-0000-0108-0E1C
MSR 00000772: 0000-0000-8000-FF01
MSR 00000773: 0000-0000-0000-0005
MSR 00000774: 0000-019E-5400-1C01
MSR 00000777: 0000-0000-0000-0000

------[ MSR Registers / Logical CPU #1 ]------

MSR 00000017: 0010-0000-0000-0000 [PlatID = 4]
MSR 0000001B: 0000-0000-FEE0-0800
MSR 0000002A: 0000-0000-0000-0000
MSR 00000048: 0000-0000-0000-0001
MSR 00000049: < FAILED >
MSR 0000008B: 2400-0022-0000-0000
MSR 000000CE: 0005-0830-F081-0E00
MSR 000000E7: 0000-0087-CF25-1544
MSR 000000E8: 0000-009A-C259-6B74
MSR 0000010A: 0000-0000-8000-002B
MSR 0000010B: < FAILED >
MSR 00000198: 0000-0000-0000-1600
MSR 00000199: 0000-0000-0000-0800
MSR 0000019A: 0000-0000-0000-0000
MSR 0000019B: 0000-0000-0000-0010
MSR 0000019C: 0000-0000-8837-0800
MSR 0000019D: 0000-0000-0000-0000
MSR 00000480: 00DA-0500-0000-0013
MSR 00000481: 0000-00FF-0000-0016
MSR 00000482: FFF9-FFFE-0401-E172
MSR 00000483: 037F-FFFF-0003-6DFF
MSR 00000484: 0006-FFFF-0000-11FF
MSR 00000485: 0000-0000-7004-C1E7
MSR 00000486: 0000-0000-8000-0021
MSR 00000487: 0000-0000-FFFF-FFFF
MSR 00000488: 0000-0000-0000-2000
MSR 00000489: 0000-0000-0035-2FFF
MSR 0000048A: 0000-0000-0000-002E
MSR 0000048B: 035D-6FFF-0000-0000
MSR 0000048C: 0000-0F01-0671-4141
MSR 0000048D: 0000-00FF-0000-0016
MSR 0000048E: FFF9-FFFE-0400-6172
MSR 0000048F: 037F-FFFF-0003-6DFB
MSR 00000490: 0006-FFFF-0000-11FB
MSR 00000770: 0000-0000-0000-0001
MSR 00000771: 0000-0000-0108-0E1C
MSR 00000772: 0000-0000-8000-FF01
MSR 00000773: 0000-0000-0000-0005
MSR 00000774: 0000-019E-5400-1C01
MSR 00000777: 0000-0000-0000-0000

------[ MSR Registers / Logical CPU #2 ]------

MSR 00000017: 0010-0000-0000-0000 [PlatID = 4]
MSR 0000001B: 0000-0000-FEE0-0800
MSR 0000002A: 0000-0000-0000-0000
MSR 00000048: 0000-0000-0000-0001
MSR 00000049: < FAILED >
MSR 0000008B: 2400-0022-0000-0000
MSR 000000CE: 0005-0830-F081-0E00
MSR 000000E7: 0000-0084-A7BF-8E7E
MSR 000000E8: 0000-0094-D563-00B2
MSR 0000010A: 0000-0000-8000-002B
MSR 0000010B: < FAILED >
MSR 00000198: 0000-0000-0000-1C00
MSR 00000199: 0000-0000-0000-0800
MSR 0000019A: 0000-0000-0000-0000
MSR 0000019B: 0000-0000-0000-0010
MSR 0000019C: 0000-0000-8836-0800
MSR 0000019D: 0000-0000-0000-0000
MSR 00000480: 00DA-0500-0000-0013
MSR 00000481: 0000-00FF-0000-0016
MSR 00000482: FFF9-FFFE-0401-E172
MSR 00000483: 037F-FFFF-0003-6DFF
MSR 00000484: 0006-FFFF-0000-11FF
MSR 00000485: 0000-0000-7004-C1E7
MSR 00000486: 0000-0000-8000-0021
MSR 00000487: 0000-0000-FFFF-FFFF
MSR 00000488: 0000-0000-0000-2000
MSR 00000489: 0000-0000-0035-2FFF
MSR 0000048A: 0000-0000-0000-002E
MSR 0000048B: 035D-6FFF-0000-0000
MSR 0000048C: 0000-0F01-0671-4141
MSR 0000048D: 0000-00FF-0000-0016
MSR 0000048E: FFF9-FFFE-0400-6172
MSR 0000048F: 037F-FFFF-0003-6DFB
MSR 00000490: 0006-FFFF-0000-11FB
MSR 00000770: 0000-0000-0000-0001
MSR 00000771: 0000-0000-0108-0E1C
MSR 00000772: 0000-0000-8000-FF01
MSR 00000773: 0000-0000-0000-0005
MSR 00000774: 0000-019E-5400-1C01
MSR 00000777: 0000-0000-0000-0000

------[ MSR Registers / Logical CPU #3 ]------

MSR 00000017: 0010-0000-0000-0000 [PlatID = 4]
MSR 0000001B: 0000-0000-FEE0-0800
MSR 0000002A: 0000-0000-0000-0000
MSR 00000048: 0000-0000-0000-0001
MSR 00000049: < FAILED >
MSR 0000008B: 2400-0022-0000-0000
MSR 000000CE: 0005-0830-F081-0E00
MSR 000000E7: 0000-008A-9F8A-ABAA
MSR 000000E8: 0000-009F-58E5-820F
MSR 0000010A: 0000-0000-8000-002B
MSR 0000010B: < FAILED >
MSR 00000198: 0000-0000-0000-1800
MSR 00000199: 0000-0000-0000-0800
MSR 0000019A: 0000-0000-0000-0000
MSR 0000019B: 0000-0000-0000-0010
MSR 0000019C: 0000-0000-8836-0800
MSR 0000019D: 0000-0000-0000-0000
MSR 00000480: 00DA-0500-0000-0013
MSR 00000481: 0000-00FF-0000-0016
MSR 00000482: FFF9-FFFE-0401-E172
MSR 00000483: 037F-FFFF-0003-6DFF
MSR 00000484: 0006-FFFF-0000-11FF
MSR 00000485: 0000-0000-7004-C1E7
MSR 00000486: 0000-0000-8000-0021
MSR 00000487: 0000-0000-FFFF-FFFF
MSR 00000488: 0000-0000-0000-2000
MSR 00000489: 0000-0000-0035-2FFF
MSR 0000048A: 0000-0000-0000-002E
MSR 0000048B: 035D-6FFF-0000-0000
MSR 0000048C: 0000-0F01-0671-4141
MSR 0000048D: 0000-00FF-0000-0016
MSR 0000048E: FFF9-FFFE-0400-6172
MSR 0000048F: 037F-FFFF-0003-6DFB
MSR 00000490: 0006-FFFF-0000-11FB
MSR 00000770: 0000-0000-0000-0001
MSR 00000771: 0000-0000-0108-0E1C
MSR 00000772: 0000-0000-8000-FF01
MSR 00000773: 0000-0000-0000-0005
MSR 00000774: 0000-019E-5400-1C01
MSR 00000777: 0000-0000-0000-0000

------[ MSR Registers / Logical CPU #4 ]------

MSR 00000017: 0010-0000-0000-0000 [PlatID = 4]
MSR 0000001B: 0000-0000-FEE0-0800
MSR 0000002A: 0000-0000-0000-0000
MSR 00000048: 0000-0000-0000-0001
MSR 00000049: < FAILED >
MSR 0000008B: 2400-0022-0000-0000
MSR 000000CE: 0005-0830-F081-0E00
MSR 000000E7: 0000-00D3-F73A-30E8
MSR 000000E8: 0000-013C-DA0A-F7DE
MSR 0000010A: 0000-0000-0000-002B
MSR 0000010B: < FAILED >
MSR 00000198: 0000-0000-0000-0800
MSR 00000199: 0000-0000-0000-0800
MSR 0000019A: 0000-0000-0000-0000
MSR 0000019B: 0000-0000-0000-0010
MSR 0000019C: 0000-0000-8835-0800
MSR 0000019D: 0000-0000-0000-0000
MSR 00000480: 00DA-0500-0000-0013
MSR 00000481: 0000-00FF-0000-0016
MSR 00000482: FFF9-FFFE-0401-E172
MSR 00000483: 037F-FFFF-0003-6DFF
MSR 00000484: 0006-FFFF-0000-11FF
MSR 00000485: 0000-0000-7004-C1E7
MSR 00000486: 0000-0000-8000-0021
MSR 00000487: 0000-0000-FFFF-FFFF
MSR 00000488: 0000-0000-0000-2000
MSR 00000489: 0000-0000-0035-2FFF
MSR 0000048A: 0000-0000-0000-002E
MSR 0000048B: 435D-6FFF-0000-0000
MSR 0000048C: 0000-0F01-0671-4141
MSR 0000048D: 0000-00FF-0000-0016
MSR 0000048E: FFF9-FFFE-0400-6172
MSR 0000048F: 037F-FFFF-0003-6DFB
MSR 00000490: 0006-FFFF-0000-11FB
MSR 00000770: 0000-0000-0000-0001
MSR 00000771: 0000-0000-010C-142B
MSR 00000772: 0000-0000-8000-FF01
MSR 00000773: 0000-0000-0000-0005
MSR 00000774: 0000-019E-3F00-2B01
MSR 00000777: 0000-0000-0000-0004
