------[ CPUID Registers / Logical CPU #0 ]------

allcpu: Package 0 / Core 0 / Thread 0: Valid

CPUID 00000000: 00000020-756E6547-6C65746E-49656E69 [GenuineIntel]
CPUID 00000001: 000B06A3-00400800-7FFAFBFF-BFEBFBFF
CPUID 00000002: 00FEFF01-000000F0-00000000-00000000
CPUID 00000003: 00000000-00000000-00000000-00000000
CPUID 00000004: 7C004121-02C0003F-0000003F-00000000 [SL 00] [L1D: 48 KB]
CPUID 00000004: 7C004122-01C0003F-0000003F-00000000 [SL 01] [L1I: 32 KB]
CPUID 00000004: 7C01C143-0240003F-000007FF-00000000 [SL 02] [L2U: 1280 KB]
CPUID 00000004: 7C0FC163-02C0003F-00003FFF-00000004 [SL 03] [L3U: 12 MB]
CPUID 00000005: 00000040-00000040-00000003-10101020
CPUID 00000006: 00DF8FF7-00000002-00000409-00000003
CPUID 00000007: 00000002-239C27EB-98C027AC-FC1CC410 [SL 00]
CPUID 00000007: 00401C10-00000000-00000000-00000000 [SL 01]
CPUID 00000007: 00000000-00000000-00000000-0000001F [SL 02]
CPUID 00000008: 00000000-00000000-00000000-00000000
CPUID 00000009: 00000000-00000000-00000000-00000000
CPUID 0000000A: 08300805-00000000-0000000F-00008604
CPUID 0000000B: 00000001-00000002-00000100-00000000 [SL 00]
CPUID 0000000B: 00000006-0000000C-00000201-00000000 [SL 01]
CPUID 0000000C: 00000000-00000000-00000000-00000000
CPUID 0000000D: 00000207-00000340-00000A88-00000000 [SL 00] [x87]
CPUID 0000000D: 0000000F-000003D0-00019900-00000000 [SL 01] [SSE]
CPUID 0000000D: 00000100-00000240-00000000-00000000 [SL 02] [AVX]
CPUID 0000000D: 00000080-00000000-00000001-00000000 [SL 08] [PT]
CPUID 0000000D: 00000008-00000A80-00000000-00000000 [SL 09] [PKRU]
CPUID 0000000D: 00000010-00000000-00000001-00000000 [SL 0B]
CPUID 0000000D: 00000018-00000000-00000001-00000000 [SL 0C]
CPUID 0000000D: 00000328-00000000-00000001-00000000 [SL 0F]
CPUID 0000000D: 00000008-00000000-00000001-00000000 [SL 10]
CPUID 0000000E: 00000000-00000000-00000000-00000000
CPUID 0000000F: 00000000-00000000-00000000-00000000 [SL 00]
CPUID 0000000F: 00000000-00000000-00000000-00000000 [SL 01]
CPUID 00000010: 00000000-00000000-00000000-00000000 [SL 00]
CPUID 00000010: 00000000-00000000-00000000-00000000 [SL 01]
CPUID 00000011: 00000000-00000000-00000000-00000000
CPUID 00000012: 00000000-00000000-00000000-00000000 [SL 00]
CPUID 00000012: 00000000-00000000-00000000-00000000 [SL 01]
CPUID 00000013: 00000000-00000000-00000000-00000000
CPUID 00000014: 00000001-0000005F-00000007-00000000 [SL 00]
CPUID 00000014: 02490002-003F003F-00000000-00000000 [SL 01]
CPUID 00000015: 00000002-0000008C-0249F000-00000000 [70.00x / 38400000]
CPUID 00000016: 00000A8C-00001450-00000064-00000000 [2700 / 5200 / 100]
CPUID 00000017: 00000000-00000000-00000000-00000000 [SL 00]
CPUID 00000018: 00000008-00000000-00000000-00000000 [SL 00]
CPUID 00000018: 00000000-00080001-00000020-00004022 [SL 01]
CPUID 00000018: 00000000-00080006-00000004-00004022 [SL 02]
CPUID 00000018: 00000000-0010000F-00000001-00004125 [SL 03]
CPUID 00000018: 00000000-00040001-00000010-00004024 [SL 04]
CPUID 00000018: 00000000-00040006-00000008-00004024 [SL 05]
CPUID 00000018: 00000000-00080008-00000001-00004124 [SL 06]
CPUID 00000018: 00000000-00080007-00000080-00004043 [SL 07]
CPUID 00000018: 00000000-00080009-00000080-00004043 [SL 08]
CPUID 00000019: 00000007-00000014-00000003-00000000
CPUID 0000001A: 40000001-00000000-00000000-00000000 [Core]
CPUID 0000001B: 00000001-00000001-00000000-00000000
CPUID 0000001C: 4000000B-00000007-00000007-00000000
CPUID 0000001D: 00000000-00000000-00000000-00000000
CPUID 0000001E: 00000000-00000000-00000000-00000000
CPUID 0000001F: 00000001-00000002-00000100-00000000 [SL 00]
CPUID 0000001F: 00000006-0000000C-00000201-00000000 [SL 01]
CPUID 00000020: 00000000-00000001-00000000-00000000
CPUID 80000000: 80000008-00000000-00000000-00000000
CPUID 80000001: 00000000-00000000-00000121-2C100000
CPUID 80000002: 68743331-6E654720-746E4920-52286C65 [13th Gen Intel(R]
CPUID 80000003: 6F432029-54286572-6920294D-33312D37 [) Core(TM) i7-13]
CPUID 80000004: 00553536-00000000-00000000-00000000 [65U]
CPUID 80000005: 00000000-00000000-00000000-00000000 [L1D: 0 KB / L1I: 0 KB]
CPUID 80000006: 00000000-00000000-05007040-00000000 [L2: 1280 KB] / L3: 0 KB]
CPUID 80000007: 00000000-00000000-00000000-00000100
CPUID 80000008: 0000302E-00000000-00000000-00000000

L1    Data Cache:    48 KB, 12-way Associative, 64-byte Line
L1  Instr. Cache:    32 KB,  8-way Associative, 64-byte Line
L2 Unified Cache:  1280 KB, 10-way Associative, 64-byte Line
L3 Unified Cache:    12 MB, 12-way Associative, 64-byte Line

------[ CPUID Registers / Logical CPU #1 ]------

allcpu: Package 0 / Core 0 / Thread 1: Valid, Virtual

CPUID 00000000: 00000020-756E6547-6C65746E-49656E69 [GenuineIntel]
CPUID 00000001: 000B06A3-01400800-7FFAFBFF-BFEBFBFF
CPUID 00000002: 00FEFF01-000000F0-00000000-00000000
CPUID 00000003: 00000000-00000000-00000000-00000000
CPUID 00000004: 7C004121-02C0003F-0000003F-00000000 [SL 00] [L1D: 48 KB]
CPUID 00000004: 7C004122-01C0003F-0000003F-00000000 [SL 01] [L1I: 32 KB]
CPUID 00000004: 7C01C143-0240003F-000007FF-00000000 [SL 02] [L2U: 1280 KB]
CPUID 00000004: 7C0FC163-02C0003F-00003FFF-00000004 [SL 03] [L3U: 12 MB]
CPUID 00000005: 00000040-00000040-00000003-10101020
CPUID 00000006: 00DF8FF7-00000002-00000409-00000003
CPUID 00000007: 00000002-239C27EB-98C027AC-FC1CC410 [SL 00]
CPUID 00000007: 00401C10-00000000-00000000-00000000 [SL 01]
CPUID 00000007: 00000000-00000000-00000000-0000001F [SL 02]
CPUID 00000008: 00000000-00000000-00000000-00000000
CPUID 00000009: 00000000-00000000-00000000-00000000
CPUID 0000000A: 08300805-00000000-0000000F-00008604
CPUID 0000000B: 00000001-00000002-00000100-00000001 [SL 00]
CPUID 0000000B: 00000006-0000000C-00000201-00000001 [SL 01]
CPUID 0000000C: 00000000-00000000-00000000-00000000
CPUID 0000000D: 00000207-00000340-00000A88-00000000 [SL 00] [x87]
CPUID 0000000D: 0000000F-000003D0-00019900-00000000 [SL 01] [SSE]
CPUID 0000000D: 00000100-00000240-00000000-00000000 [SL 02] [AVX]
CPUID 0000000D: 00000080-00000000-00000001-00000000 [SL 08] [PT]
CPUID 0000000D: 00000008-00000A80-00000000-00000000 [SL 09] [PKRU]
CPUID 0000000D: 00000010-00000000-00000001-00000000 [SL 0B]
CPUID 0000000D: 00000018-00000000-00000001-00000000 [SL 0C]
CPUID 0000000D: 00000328-00000000-00000001-00000000 [SL 0F]
CPUID 0000000D: 00000008-00000000-00000001-00000000 [SL 10]
CPUID 0000000E: 00000000-00000000-00000000-00000000
CPUID 0000000F: 00000000-00000000-00000000-00000000 [SL 00]
CPUID 0000000F: 00000000-00000000-00000000-00000000 [SL 01]
CPUID 00000010: 00000000-00000000-00000000-00000000 [SL 00]
CPUID 00000010: 00000000-00000000-00000000-00000000 [SL 01]
CPUID 00000011: 00000000-00000000-00000000-00000000
CPUID 00000012: 00000000-00000000-00000000-00000000 [SL 00]
CPUID 00000012: 00000000-00000000-00000000-00000000 [SL 01]
CPUID 00000013: 00000000-00000000-00000000-00000000
CPUID 00000014: 00000001-0000005F-00000007-00000000 [SL 00]
CPUID 00000014: 02490002-003F003F-00000000-00000000 [SL 01]
CPUID 00000015: 00000002-0000008C-0249F000-00000000 [70.00x / 38400000]
CPUID 00000016: 00000A8C-00001450-00000064-00000000 [2700 / 5200 / 100]
CPUID 00000017: 00000000-00000000-00000000-00000000 [SL 00]
CPUID 00000018: 00000008-00000000-00000000-00000000 [SL 00]
CPUID 00000018: 00000000-00080001-00000020-00004022 [SL 01]
CPUID 00000018: 00000000-00080006-00000004-00004022 [SL 02]
CPUID 00000018: 00000000-0010000F-00000001-00004125 [SL 03]
CPUID 00000018: 00000000-00040001-00000010-00004024 [SL 04]
CPUID 00000018: 00000000-00040006-00000008-00004024 [SL 05]
CPUID 00000018: 00000000-00080008-00000001-00004124 [SL 06]
CPUID 00000018: 00000000-00080007-00000080-00004043 [SL 07]
CPUID 00000018: 00000000-00080009-00000080-00004043 [SL 08]
CPUID 00000019: 00000007-00000014-00000003-00000000
CPUID 0000001A: 40000001-00000000-00000000-00000000 [Core]
CPUID 0000001B: 00000001-00000001-00000000-00000000
CPUID 0000001C: 4000000B-00000007-00000007-00000000
CPUID 0000001D: 00000000-00000000-00000000-00000000
CPUID 0000001E: 00000000-00000000-00000000-00000000
CPUID 0000001F: 00000001-00000002-00000100-00000001 [SL 00]
CPUID 0000001F: 00000006-0000000C-00000201-00000001 [SL 01]
CPUID 00000020: 00000000-00000001-00000000-00000000
CPUID 80000000: 80000008-00000000-00000000-00000000
CPUID 80000001: 00000000-00000000-00000121-2C100000
CPUID 80000002: 68743331-6E654720-746E4920-52286C65 [13th Gen Intel(R]
CPUID 80000003: 6F432029-54286572-6920294D-33312D37 [) Core(TM) i7-13]
CPUID 80000004: 00553536-00000000-00000000-00000000 [65U]
CPUID 80000005: 00000000-00000000-00000000-00000000 [L1D: 0 KB / L1I: 0 KB]
CPUID 80000006: 00000000-00000000-05007040-00000000 [L2: 1280 KB] / L3: 0 KB]
CPUID 80000007: 00000000-00000000-00000000-00000100
CPUID 80000008: 0000302E-00000000-00000000-00000000

L1    Data Cache:    48 KB, 12-way Associative, 64-byte Line
L1  Instr. Cache:    32 KB,  8-way Associative, 64-byte Line
L2 Unified Cache:  1280 KB, 10-way Associative, 64-byte Line
L3 Unified Cache:    12 MB, 12-way Associative, 64-byte Line

------[ CPUID Registers / Logical CPU #2 ]------

allcpu: Package 0 / Core 1 / Thread 0: Valid

CPUID 00000000: 00000020-756E6547-6C65746E-49656E69 [GenuineIntel]
CPUID 00000001: 000B06A3-08400800-7FFAFBFF-BFEBFBFF
CPUID 00000002: 00FEFF01-000000F0-00000000-00000000
CPUID 00000003: 00000000-00000000-00000000-00000000
CPUID 00000004: 7C004121-02C0003F-0000003F-00000000 [SL 00] [L1D: 48 KB]
CPUID 00000004: 7C004122-01C0003F-0000003F-00000000 [SL 01] [L1I: 32 KB]
CPUID 00000004: 7C01C143-0240003F-000007FF-00000000 [SL 02] [L2U: 1280 KB]
CPUID 00000004: 7C0FC163-02C0003F-00003FFF-00000004 [SL 03] [L3U: 12 MB]
CPUID 00000005: 00000040-00000040-00000003-10101020
CPUID 00000006: 00DF8FF7-00000002-00000409-00010003
CPUID 00000007: 00000002-239C27EB-98C027AC-FC1CC410 [SL 00]
CPUID 00000007: 00401C10-00000000-00000000-00000000 [SL 01]
CPUID 00000007: 00000000-00000000-00000000-0000001F [SL 02]
CPUID 00000008: 00000000-00000000-00000000-00000000
CPUID 00000009: 00000000-00000000-00000000-00000000
CPUID 0000000A: 08300805-00000000-0000000F-00008604
CPUID 0000000B: 00000001-00000002-00000100-00000008 [SL 00]
CPUID 0000000B: 00000006-0000000C-00000201-00000008 [SL 01]
CPUID 0000000C: 00000000-00000000-00000000-00000000
CPUID 0000000D: 00000207-00000340-00000A88-00000000 [SL 00] [x87]
CPUID 0000000D: 0000000F-000003D0-00019900-00000000 [SL 01] [SSE]
CPUID 0000000D: 00000100-00000240-00000000-00000000 [SL 02] [AVX]
CPUID 0000000D: 00000080-00000000-00000001-00000000 [SL 08] [PT]
CPUID 0000000D: 00000008-00000A80-00000000-00000000 [SL 09] [PKRU]
CPUID 0000000D: 00000010-00000000-00000001-00000000 [SL 0B]
CPUID 0000000D: 00000018-00000000-00000001-00000000 [SL 0C]
CPUID 0000000D: 00000328-00000000-00000001-00000000 [SL 0F]
CPUID 0000000D: 00000008-00000000-00000001-00000000 [SL 10]
CPUID 0000000E: 00000000-00000000-00000000-00000000
CPUID 0000000F: 00000000-00000000-00000000-00000000 [SL 00]
CPUID 0000000F: 00000000-00000000-00000000-00000000 [SL 01]
CPUID 00000010: 00000000-00000000-00000000-00000000 [SL 00]
CPUID 00000010: 00000000-00000000-00000000-00000000 [SL 01]
CPUID 00000011: 00000000-00000000-00000000-00000000
CPUID 00000012: 00000000-00000000-00000000-00000000 [SL 00]
CPUID 00000012: 00000000-00000000-00000000-00000000 [SL 01]
CPUID 00000013: 00000000-00000000-00000000-00000000
CPUID 00000014: 00000001-0000005F-00000007-00000000 [SL 00]
CPUID 00000014: 02490002-003F003F-00000000-00000000 [SL 01]
CPUID 00000015: 00000002-0000008C-0249F000-00000000 [70.00x / 38400000]
CPUID 00000016: 00000A8C-00001450-00000064-00000000 [2700 / 5200 / 100]
CPUID 00000017: 00000000-00000000-00000000-00000000 [SL 00]
CPUID 00000018: 00000008-00000000-00000000-00000000 [SL 00]
CPUID 00000018: 00000000-00080001-00000020-00004022 [SL 01]
CPUID 00000018: 00000000-00080006-00000004-00004022 [SL 02]
CPUID 00000018: 00000000-0010000F-00000001-00004125 [SL 03]
CPUID 00000018: 00000000-00040001-00000010-00004024 [SL 04]
CPUID 00000018: 00000000-00040006-00000008-00004024 [SL 05]
CPUID 00000018: 00000000-00080008-00000001-00004124 [SL 06]
CPUID 00000018: 00000000-00080007-00000080-00004043 [SL 07]
CPUID 00000018: 00000000-00080009-00000080-00004043 [SL 08]
CPUID 00000019: 00000007-00000014-00000003-00000000
CPUID 0000001A: 40000001-00000000-00000000-00000000 [Core]
CPUID 0000001B: 00000001-00000001-00000000-00000000
CPUID 0000001C: 4000000B-00000007-00000007-00000000
CPUID 0000001D: 00000000-00000000-00000000-00000000
CPUID 0000001E: 00000000-00000000-00000000-00000000
CPUID 0000001F: 00000001-00000002-00000100-00000008 [SL 00]
CPUID 0000001F: 00000006-0000000C-00000201-00000008 [SL 01]
CPUID 00000020: 00000000-00000001-00000000-00000000
CPUID 80000000: 80000008-00000000-00000000-00000000
CPUID 80000001: 00000000-00000000-00000121-2C100000
CPUID 80000002: 68743331-6E654720-746E4920-52286C65 [13th Gen Intel(R]
CPUID 80000003: 6F432029-54286572-6920294D-33312D37 [) Core(TM) i7-13]
CPUID 80000004: 00553536-00000000-00000000-00000000 [65U]
CPUID 80000005: 00000000-00000000-00000000-00000000 [L1D: 0 KB / L1I: 0 KB]
CPUID 80000006: 00000000-00000000-05007040-00000000 [L2: 1280 KB] / L3: 0 KB]
CPUID 80000007: 00000000-00000000-00000000-00000100
CPUID 80000008: 0000302E-00000000-00000000-00000000

L1    Data Cache:    48 KB, 12-way Associative, 64-byte Line
L1  Instr. Cache:    32 KB,  8-way Associative, 64-byte Line
L2 Unified Cache:  1280 KB, 10-way Associative, 64-byte Line
L3 Unified Cache:    12 MB, 12-way Associative, 64-byte Line

------[ CPUID Registers / Logical CPU #3 ]------

allcpu: Package 0 / Core 1 / Thread 1: Valid, Virtual

CPUID 00000000: 00000020-756E6547-6C65746E-49656E69 [GenuineIntel]
CPUID 00000001: 000B06A3-09400800-7FFAFBFF-BFEBFBFF
CPUID 00000002: 00FEFF01-000000F0-00000000-00000000
CPUID 00000003: 00000000-00000000-00000000-00000000
CPUID 00000004: 7C004121-02C0003F-0000003F-00000000 [SL 00] [L1D: 48 KB]
CPUID 00000004: 7C004122-01C0003F-0000003F-00000000 [SL 01] [L1I: 32 KB]
CPUID 00000004: 7C01C143-0240003F-000007FF-00000000 [SL 02] [L2U: 1280 KB]
CPUID 00000004: 7C0FC163-02C0003F-00003FFF-00000004 [SL 03] [L3U: 12 MB]
CPUID 00000005: 00000040-00000040-00000003-10101020
CPUID 00000006: 00DF8FF7-00000002-00000409-00010003
CPUID 00000007: 00000002-239C27EB-98C027AC-FC1CC410 [SL 00]
CPUID 00000007: 00401C10-00000000-00000000-00000000 [SL 01]
CPUID 00000007: 00000000-00000000-00000000-0000001F [SL 02]
CPUID 00000008: 00000000-00000000-00000000-00000000
CPUID 00000009: 00000000-00000000-00000000-00000000
CPUID 0000000A: 08300805-00000000-0000000F-00008604
CPUID 0000000B: 00000001-00000002-00000100-00000009 [SL 00]
CPUID 0000000B: 00000006-0000000C-00000201-00000009 [SL 01]
CPUID 0000000C: 00000000-00000000-00000000-00000000
CPUID 0000000D: 00000207-00000340-00000A88-00000000 [SL 00] [x87]
CPUID 0000000D: 0000000F-000003D0-00019900-00000000 [SL 01] [SSE]
CPUID 0000000D: 00000100-00000240-00000000-00000000 [SL 02] [AVX]
CPUID 0000000D: 00000080-00000000-00000001-00000000 [SL 08] [PT]
CPUID 0000000D: 00000008-00000A80-00000000-00000000 [SL 09] [PKRU]
CPUID 0000000D: 00000010-00000000-00000001-00000000 [SL 0B]
CPUID 0000000D: 00000018-00000000-00000001-00000000 [SL 0C]
CPUID 0000000D: 00000328-00000000-00000001-00000000 [SL 0F]
CPUID 0000000D: 00000008-00000000-00000001-00000000 [SL 10]
CPUID 0000000E: 00000000-00000000-00000000-00000000
CPUID 0000000F: 00000000-00000000-00000000-00000000 [SL 00]
CPUID 0000000F: 00000000-00000000-00000000-00000000 [SL 01]
CPUID 00000010: 00000000-00000000-00000000-00000000 [SL 00]
CPUID 00000010: 00000000-00000000-00000000-00000000 [SL 01]
CPUID 00000011: 00000000-00000000-00000000-00000000
CPUID 00000012: 00000000-00000000-00000000-00000000 [SL 00]
CPUID 00000012: 00000000-00000000-00000000-00000000 [SL 01]
CPUID 00000013: 00000000-00000000-00000000-00000000
CPUID 00000014: 00000001-0000005F-00000007-00000000 [SL 00]
CPUID 00000014: 02490002-003F003F-00000000-00000000 [SL 01]
CPUID 00000015: 00000002-0000008C-0249F000-00000000 [70.00x / 38400000]
CPUID 00000016: 00000A8C-00001450-00000064-00000000 [2700 / 5200 / 100]
CPUID 00000017: 00000000-00000000-00000000-00000000 [SL 00]
CPUID 00000018: 00000008-00000000-00000000-00000000 [SL 00]
CPUID 00000018: 00000000-00080001-00000020-00004022 [SL 01]
CPUID 00000018: 00000000-00080006-00000004-00004022 [SL 02]
CPUID 00000018: 00000000-0010000F-00000001-00004125 [SL 03]
CPUID 00000018: 00000000-00040001-00000010-00004024 [SL 04]
CPUID 00000018: 00000000-00040006-00000008-00004024 [SL 05]
CPUID 00000018: 00000000-00080008-00000001-00004124 [SL 06]
CPUID 00000018: 00000000-00080007-00000080-00004043 [SL 07]
CPUID 00000018: 00000000-00080009-00000080-00004043 [SL 08]
CPUID 00000019: 00000007-00000014-00000003-00000000
CPUID 0000001A: 40000001-00000000-00000000-00000000 [Core]
CPUID 0000001B: 00000001-00000001-00000000-00000000
CPUID 0000001C: 4000000B-00000007-00000007-00000000
CPUID 0000001D: 00000000-00000000-00000000-00000000
CPUID 0000001E: 00000000-00000000-00000000-00000000
CPUID 0000001F: 00000001-00000002-00000100-00000009 [SL 00]
CPUID 0000001F: 00000006-0000000C-00000201-00000009 [SL 01]
CPUID 00000020: 00000000-00000001-00000000-00000000
CPUID 80000000: 80000008-00000000-00000000-00000000
CPUID 80000001: 00000000-00000000-00000121-2C100000
CPUID 80000002: 68743331-6E654720-746E4920-52286C65 [13th Gen Intel(R]
CPUID 80000003: 6F432029-54286572-6920294D-33312D37 [) Core(TM) i7-13]
CPUID 80000004: 00553536-00000000-00000000-00000000 [65U]
CPUID 80000005: 00000000-00000000-00000000-00000000 [L1D: 0 KB / L1I: 0 KB]
CPUID 80000006: 00000000-00000000-05007040-00000000 [L2: 1280 KB] / L3: 0 KB]
CPUID 80000007: 00000000-00000000-00000000-00000100
CPUID 80000008: 0000302E-00000000-00000000-00000000

L1    Data Cache:    48 KB, 12-way Associative, 64-byte Line
L1  Instr. Cache:    32 KB,  8-way Associative, 64-byte Line
L2 Unified Cache:  1280 KB, 10-way Associative, 64-byte Line
L3 Unified Cache:    12 MB, 12-way Associative, 64-byte Line

------[ All CPUs ]------

CPU   0: APICID    0 / Package 0 / Core   0 / Thread 0: Valid
CPU   1: APICID    1 / Package 0 / Core   0 / Thread 1: Valid, Virtual
CPU   2: APICID    8 / Package 0 / Core   1 / Thread 0: Valid
CPU   3: APICID    9 / Package 0 / Core   1 / Thread 1: Valid, Virtual

------[ MSR Registers / Logical CPU #0 ]------

MSR 00000017: 001C-0000-0000-0000 [PlatID = 7]
MSR 0000001B: 0000-0000-FEE0-0900
MSR 00000035: 0000-0000-0002-0004
MSR 00000048: 0000-0000-0000-0001
MSR 00000049: < FAILED >
MSR 0000008B: 0000-410C-0000-0000
MSR 000000CE: 0804-043D-F881-1B00 [eD = 0]
MSR 000000E7: 0000-03D8-97E4-7E7A [S200]
MSR 000000E7: 0000-03D8-99BA-0C96 [S200]
MSR 000000E7: 0000-03D8-9A3A-6601
MSR 000000E8: 0000-067E-2C7B-E4EB [S200]
MSR 000000E8: 0000-067E-2CB4-CBEF [S200]
MSR 000000E8: 0000-067E-2CFA-CC17
MSR 0000010A: 0000-0000-0088-FD6B
MSR 0000010B: < FAILED >
MSR 00000194: 0000-0000-0011-0000
MSR 00000198: 0000-153F-0000-0F00 [S200]
MSR 00000198: 0000-154C-0000-0F00 [S200]
MSR 00000198: 0000-14F2-0000-0D00
MSR 00000199: 0000-0000-0000-1100
MSR 0000019A: 0000-0000-0000-0000
MSR 0000019B: 0000-0000-0000-0010
MSR 0000019C: 0000-0000-8818-0A82 [S200]
MSR 0000019C: 0000-0000-8818-0A82 [S200]
MSR 0000019C: 0000-0000-8818-0A82
MSR 0000019D: 0000-0000-0000-0000
MSR 000001A0: 0000-0000-0085-0089
MSR 000001A2: 0000-0000-0364-0000
MSR 000001A4: 0000-0000-0000-0000
MSR 000001AA: 0000-0000-0000-30C2
MSR 000001AC: < FAILED >
MSR 000001AD: 3131-3131-3131-3134
MSR 000001AE: 0807-0605-0403-0201
MSR 000001AF: < FAILED >
MSR 000001B0: 0000-0000-0000-0006
MSR 000001B1: 0000-0000-8814-0A82
MSR 000001B2: 0000-0000-0200-0000
MSR 000001FC: 0000-0000-00EC-005B
MSR 00000300: < FAILED >
MSR 0000030A: 0000-0000-0000-0000 [S200]
MSR 0000030A: 0000-0000-0000-0000 [S200]
MSR 0000030A: 0000-0000-0000-0000
MSR 0000030B: 0000-0000-0000-0000 [S200]
MSR 0000030B: 0000-0000-0000-0000 [S200]
MSR 0000030B: 0000-0000-0000-0000
MSR 00000480: 03DA-0500-0000-0013
MSR 00000481: 0000-00FF-0000-0016
MSR 00000482: FFFB-FFFE-0401-E172
MSR 00000483: F77F-FFFF-0003-6DFF
MSR 00000484: 0076-FFFF-0000-11FF
MSR 00000485: 0000-0000-7004-C1E7
MSR 00000486: 0000-0000-8000-0021
MSR 00000487: 0000-0000-FFFF-FFFF
MSR 00000488: 0000-0000-0000-2000
MSR 00000489: 0000-0000-01FF-6FFF
MSR 0000048A: 0000-0000-0000-002E
MSR 0000048B: 0F5F-7FFF-0000-0000
MSR 0000048C: 0001-0F01-06F3-4141
MSR 0000048D: 0000-00FF-0000-0016
MSR 0000048E: FFFB-FFFE-0400-6172
MSR 0000048F: F77F-FFFF-0003-6DFB
MSR 00000490: 0076-FFFF-0000-11FB
MSR 00000601: 0000-0000-0000-0390
MSR 00000602: < FAILED >
MSR 00000603: 0036-0000-0036-3636
MSR 00000604: < FAILED >
MSR 00000606: 0000-0000-000A-0E03
MSR 0000060A: 0000-0000-0000-0000
MSR 0000060B: 0000-0000-0000-0000
MSR 0000060C: 0000-0000-0000-0000
MSR 0000060D: 0000-0010-4390-BF70
MSR 00000610: 0042-81B8-00DD-81B8
MSR 00000611: 0000-0000-1827-4628 [S200]
MSR 00000611: 0000-0000-1827-4DA1 [S200]
MSR 00000611: 0000-0000-1827-53CF
MSR 00000613: 0000-0000-0000-0000
MSR 00000614: 0000-0000-0000-0078
MSR 00000618: 0000-0000-0000-0000
MSR 00000619: 0000-0000-0000-0000 [S200]
MSR 00000619: 0000-0000-0000-0000 [S200]
MSR 00000619: 0000-0000-0000-0000
MSR 0000061B: 0000-0000-0000-0000
MSR 0000061C: < FAILED >
MSR 0000061E: < FAILED >
MSR 00000620: 0000-0000-0000-042D
MSR 00000621: 0000-0000-13DC-0008
MSR 00000638: 0000-0000-0000-0000
MSR 00000639: 0000-0000-10FA-1B07 [S200]
MSR 00000639: 0000-0000-10FA-1C0C [S200]
MSR 00000639: 0000-0000-10FA-1D19
MSR 0000063A: 0000-0000-0000-000F
MSR 0000063B: < FAILED >
MSR 00000640: 0000-0000-0000-0000
MSR 00000641: 0000-0000-0001-1885 [S200]
MSR 00000641: 0000-0000-0001-1885 [S200]
MSR 00000641: 0000-0000-0001-1885
MSR 00000642: 0000-0000-0000-0008
MSR 00000648: 0000-0000-0000-0012
MSR 00000649: 0000-0000-000D-0060
MSR 0000064A: 0000-0000-001B-00E0
MSR 0000064B: 0000-0000-0000-0001
MSR 0000064C: 0000-0000-0000-000C
MSR 00000650: 0000-0000-0000-0027
MSR 00000651: 0000-0000-0000-0001
MSR 00000690: < FAILED >
MSR 000006B0: 0000-0000-1500-0000
MSR 000006B1: 0000-0000-0502-0000
MSR 00000770: 0000-0000-0000-0001
MSR 00000771: 0000-0000-0111-1143
MSR 00000772: 0000-0000-8000-FF01
MSR 00000773: 0000-0000-0000-0005
MSR 00000774: 0000-019E-5400-4301
MSR 00000777: 0000-0000-0000-0004

------[ MSR Registers / Logical CPU #1 ]------

MSR 00000017: 001C-0000-0000-0000 [PlatID = 7]
MSR 0000001B: 0000-0000-FEE0-0800
MSR 00000035: 0000-0000-0002-0004
MSR 00000048: 0000-0000-0000-0001
MSR 00000049: < FAILED >
MSR 0000008B: 0000-410C-0000-0000
MSR 000000CE: 0804-043D-F881-1B00 [eD = 0]
MSR 000000E7: 0000-0102-411A-C4E8
MSR 000000E8: 0000-0189-7FE5-90F1
MSR 0000010A: 0000-0000-0088-FD6B
MSR 0000010B: < FAILED >
MSR 00000194: 0000-0000-0011-0000
MSR 00000198: 0000-287E-0000-3400
MSR 00000199: 0000-0000-0000-1100
MSR 0000019A: 0000-0000-0000-0000
MSR 0000019B: 0000-0000-0000-0010
MSR 0000019C: 0000-0000-880A-0A82
MSR 0000019D: 0000-0000-0000-0000
MSR 000001A0: 0000-0000-0085-0089
MSR 000001A2: 0000-0000-0364-0000
MSR 000001A4: 0000-0000-0000-0000
MSR 000001AA: 0000-0000-0000-30C2
MSR 000001AC: < FAILED >
MSR 000001AD: 3131-3131-3131-3134
MSR 000001AE: 0807-0605-0403-0201
MSR 000001AF: < FAILED >
MSR 000001B0: 0000-0000-0000-0006
MSR 000001B1: 0000-0000-880A-0A82
MSR 000001B2: 0000-0000-0200-0000
MSR 000001FC: 0000-0000-00EC-005B
MSR 00000300: < FAILED >
MSR 0000030A: 0000-0000-0000-0000
MSR 0000030B: 0000-0000-0000-0000
MSR 00000480: 03DA-0500-0000-0013
MSR 00000481: 0000-00FF-0000-0016
MSR 00000482: FFFB-FFFE-0401-E172
MSR 00000483: F77F-FFFF-0003-6DFF
MSR 00000484: 0076-FFFF-0000-11FF
MSR 00000485: 0000-0000-7004-C1E7
MSR 00000486: 0000-0000-8000-0021
MSR 00000487: 0000-0000-FFFF-FFFF
MSR 00000488: 0000-0000-0000-2000
MSR 00000489: 0000-0000-01FF-6FFF
MSR 0000048A: 0000-0000-0000-002E
MSR 0000048B: 0F5F-7FFF-0000-0000
MSR 0000048C: 0001-0F01-06F3-4141
MSR 0000048D: 0000-00FF-0000-0016
MSR 0000048E: FFFB-FFFE-0400-6172
MSR 0000048F: F77F-FFFF-0003-6DFB
MSR 00000490: 0076-FFFF-0000-11FB
MSR 00000601: 0000-0000-0000-0390
MSR 00000602: < FAILED >
MSR 00000603: 0036-0000-0036-3636
MSR 00000604: < FAILED >
MSR 00000606: 0000-0000-000A-0E03
MSR 0000060A: 0000-0000-0000-0000
MSR 0000060B: 0000-0000-0000-0000
MSR 0000060C: 0000-0000-0000-0000
MSR 0000060D: 0000-0010-5848-58CE
MSR 00000610: 0042-81B8-00DD-81B8
MSR 00000611: 0000-0000-1827-93EE
MSR 00000613: 0000-0000-0000-0000
MSR 00000614: 0000-0000-0000-0078
MSR 00000618: 0000-0000-0000-0000
MSR 00000619: 0000-0000-0000-0000
MSR 0000061B: 0000-0000-0000-0000
MSR 0000061C: < FAILED >
MSR 0000061E: < FAILED >
MSR 00000620: 0000-0000-0000-042D
MSR 00000621: 0000-0000-26C2-002D
MSR 00000638: 0000-0000-0000-0000
MSR 00000639: 0000-0000-10FA-264D
MSR 0000063A: 0000-0000-0000-000F
MSR 0000063B: < FAILED >
MSR 00000640: 0000-0000-0000-0000
MSR 00000641: 0000-0000-0001-1885
MSR 00000642: 0000-0000-0000-0008
MSR 00000648: 0000-0000-0000-0012
MSR 00000649: 0000-0000-000D-0060
MSR 0000064A: 0000-0000-001B-00E0
MSR 0000064B: 0000-0000-0000-0001
MSR 0000064C: 0000-0000-0000-000C
MSR 00000650: 0000-0000-0000-0027
MSR 00000651: 0000-0000-0000-0001
MSR 00000690: < FAILED >
MSR 000006B0: 0000-0000-1500-0000
MSR 000006B1: 0000-0000-0502-0000
MSR 00000770: 0000-0000-0000-0001
MSR 00000771: 0000-0000-011B-1143
MSR 00000772: 0000-0000-8000-FF01
MSR 00000773: 0000-0000-0000-0005
MSR 00000774: 0000-019E-5400-4301
MSR 00000777: 0000-0000-0000-0004

------[ MSR Registers / Logical CPU #2 ]------

MSR 00000017: 001C-0000-0000-0000 [PlatID = 7]
MSR 0000001B: 0000-0000-FEE0-0800
MSR 00000035: 0000-0000-0002-0004
MSR 00000048: 0000-0000-0000-0001
MSR 00000049: < FAILED >
MSR 0000008B: 0000-410C-0000-0000
MSR 000000CE: 0804-043D-F881-1B00 [eD = 0]
MSR 000000E7: 0000-00F4-1797-6383
MSR 000000E8: 0000-0143-18C6-091C
MSR 0000010A: 0000-0000-0088-FD6B
MSR 0000010B: < FAILED >
MSR 00000194: 0000-0000-0011-0000
MSR 00000198: 0000-27CC-0000-3400
MSR 00000199: 0000-0000-0000-1100
MSR 0000019A: 0000-0000-0000-0000
MSR 0000019B: 0000-0000-0000-0010
MSR 0000019C: 0000-0000-881B-0A82
MSR 0000019D: 0000-0000-0000-0000
MSR 000001A0: 0000-0000-0085-0089
MSR 000001A2: 0000-0000-0364-0000
MSR 000001A4: 0000-0000-0000-0000
MSR 000001AA: 0000-0000-0000-30C2
MSR 000001AC: < FAILED >
MSR 000001AD: 3131-3131-3131-3134
MSR 000001AE: 0807-0605-0403-0201
MSR 000001AF: < FAILED >
MSR 000001B0: 0000-0000-0000-0006
MSR 000001B1: 0000-0000-880A-0A82
MSR 000001B2: 0000-0000-0200-0000
MSR 000001FC: 0000-0000-00EC-005B
MSR 00000300: < FAILED >
MSR 0000030A: 0000-0000-0000-0000
MSR 0000030B: 0000-0000-0000-0000
MSR 00000480: 03DA-0500-0000-0013
MSR 00000481: 0000-00FF-0000-0016
MSR 00000482: FFFB-FFFE-0401-E172
MSR 00000483: F77F-FFFF-0003-6DFF
MSR 00000484: 0076-FFFF-0000-11FF
MSR 00000485: 0000-0000-7004-C1E7
MSR 00000486: 0000-0000-8000-0021
MSR 00000487: 0000-0000-FFFF-FFFF
MSR 00000488: 0000-0000-0000-2000
MSR 00000489: 0000-0000-01FF-6FFF
MSR 0000048A: 0000-0000-0000-002E
MSR 0000048B: 0F5F-7FFF-0000-0000
MSR 0000048C: 0001-0F01-06F3-4141
MSR 0000048D: 0000-00FF-0000-0016
MSR 0000048E: FFFB-FFFE-0400-6172
MSR 0000048F: F77F-FFFF-0003-6DFB
MSR 00000490: 0076-FFFF-0000-11FB
MSR 00000601: 0000-0000-0000-0390
MSR 00000602: < FAILED >
MSR 00000603: 0036-0000-0036-3636
MSR 00000604: < FAILED >
MSR 00000606: 0000-0000-000A-0E03
MSR 0000060A: 0000-0000-0000-0000
MSR 0000060B: 0000-0000-0000-0000
MSR 0000060C: 0000-0000-0000-0000
MSR 0000060D: 0000-0010-5848-58CE
MSR 00000610: 0042-81B8-00DD-81B8
MSR 00000611: 0000-0000-1827-9509
MSR 00000613: 0000-0000-0000-0000
MSR 00000614: 0000-0000-0000-0078
MSR 00000618: 0000-0000-0000-0000
MSR 00000619: 0000-0000-0000-0000
MSR 0000061B: 0000-0000-0000-0000
MSR 0000061C: < FAILED >
MSR 0000061E: < FAILED >
MSR 00000620: 0000-0000-0000-042D
MSR 00000621: 0000-0000-26C2-002D
MSR 00000638: 0000-0000-0000-0000
MSR 00000639: 0000-0000-10FA-264D
MSR 0000063A: 0000-0000-0000-000F
MSR 0000063B: < FAILED >
MSR 00000640: 0000-0000-0000-0000
MSR 00000641: 0000-0000-0001-1885
MSR 00000642: 0000-0000-0000-0008
MSR 00000648: 0000-0000-0000-0012
MSR 00000649: 0000-0000-000D-0060
MSR 0000064A: 0000-0000-001B-00E0
MSR 0000064B: 0000-0000-0000-0001
MSR 0000064C: 0000-0000-0000-000C
MSR 00000650: 0000-0000-0000-0027
MSR 00000651: 0000-0000-0000-0001
MSR 00000690: < FAILED >
MSR 000006B0: 0000-0000-1500-0000
MSR 000006B1: 0000-0000-0502-0000
MSR 00000770: 0000-0000-0000-0001
MSR 00000771: 0000-0000-011B-1143
MSR 00000772: 0000-0000-8000-FF01
MSR 00000773: 0000-0000-0000-0005
MSR 00000774: 0000-019E-5400-4301
MSR 00000777: 0000-0000-0000-0004

------[ MSR Registers / Logical CPU #3 ]------

MSR 00000017: 001C-0000-0000-0000 [PlatID = 7]
MSR 0000001B: 0000-0000-FEE0-0800
MSR 00000035: 0000-0000-0002-0004
MSR 00000048: 0000-0000-0000-0001
MSR 00000049: < FAILED >
MSR 0000008B: 0000-410C-0000-0000
MSR 000000CE: 0804-043D-F881-1B00 [eD = 0]
MSR 000000E7: 0000-00D3-B59D-0ACB
MSR 000000E8: 0000-0111-FCE1-B43C
MSR 0000010A: 0000-0000-0088-FD6B
MSR 0000010B: < FAILED >
MSR 00000194: 0000-0000-0011-0000
MSR 00000198: 0000-284D-0000-3400
MSR 00000199: 0000-0000-0000-1100
MSR 0000019A: 0000-0000-0000-0000
MSR 0000019B: 0000-0000-0000-0010
MSR 0000019C: 0000-0000-881A-0A82
MSR 0000019D: 0000-0000-0000-0000
MSR 000001A0: 0000-0000-0085-0089
MSR 000001A2: 0000-0000-0364-0000
MSR 000001A4: 0000-0000-0000-0000
MSR 000001AA: 0000-0000-0000-30C2
MSR 000001AC: < FAILED >
MSR 000001AD: 3131-3131-3131-3134
MSR 000001AE: 0807-0605-0403-0201
MSR 000001AF: < FAILED >
MSR 000001B0: 0000-0000-0000-0006
MSR 000001B1: 0000-0000-880A-0A82
MSR 000001B2: 0000-0000-0200-0000
MSR 000001FC: 0000-0000-00EC-005B
MSR 00000300: < FAILED >
MSR 0000030A: 0000-0000-0000-0000
MSR 0000030B: 0000-0000-0000-0000
MSR 00000480: 03DA-0500-0000-0013
MSR 00000481: 0000-00FF-0000-0016
MSR 00000482: FFFB-FFFE-0401-E172
MSR 00000483: F77F-FFFF-0003-6DFF
MSR 00000484: 0076-FFFF-0000-11FF
MSR 00000485: 0000-0000-7004-C1E7
MSR 00000486: 0000-0000-8000-0021
MSR 00000487: 0000-0000-FFFF-FFFF
MSR 00000488: 0000-0000-0000-2000
MSR 00000489: 0000-0000-01FF-6FFF
MSR 0000048A: 0000-0000-0000-002E
MSR 0000048B: 0F5F-7FFF-0000-0000
MSR 0000048C: 0001-0F01-06F3-4141
MSR 0000048D: 0000-00FF-0000-0016
MSR 0000048E: FFFB-FFFE-0400-6172
MSR 0000048F: F77F-FFFF-0003-6DFB
MSR 00000490: 0076-FFFF-0000-11FB
MSR 00000601: 0000-0000-0000-0390
MSR 00000602: < FAILED >
MSR 00000603: 0036-0000-0036-3636
MSR 00000604: < FAILED >
MSR 00000606: 0000-0000-000A-0E03
MSR 0000060A: 0000-0000-0000-0000
MSR 0000060B: 0000-0000-0000-0000
MSR 0000060C: 0000-0000-0000-0000
MSR 0000060D: 0000-0010-5848-58CE
MSR 00000610: 0042-81B8-00DD-81B8
MSR 00000611: 0000-0000-1827-963B
MSR 00000613: 0000-0000-0000-0000
MSR 00000614: 0000-0000-0000-0078
MSR 00000618: 0000-0000-0000-0000
MSR 00000619: 0000-0000-0000-0000
MSR 0000061B: 0000-0000-0000-0000
MSR 0000061C: < FAILED >
MSR 0000061E: < FAILED >
MSR 00000620: 0000-0000-0000-042D
MSR 00000621: 0000-0000-26C2-002D
MSR 00000638: 0000-0000-0000-0000
MSR 00000639: 0000-0000-10FA-2731
MSR 0000063A: 0000-0000-0000-000F
MSR 0000063B: < FAILED >
MSR 00000640: 0000-0000-0000-0000
MSR 00000641: 0000-0000-0001-1885
MSR 00000642: 0000-0000-0000-0008
MSR 00000648: 0000-0000-0000-0012
MSR 00000649: 0000-0000-000D-0060
MSR 0000064A: 0000-0000-001B-00E0
MSR 0000064B: 0000-0000-0000-0001
MSR 0000064C: 0000-0000-0000-000C
MSR 00000650: 0000-0000-0000-0027
MSR 00000651: 0000-0000-0000-0001
MSR 00000690: < FAILED >
MSR 000006B0: 0000-0000-1500-0000
MSR 000006B1: 0000-0000-0502-0000
MSR 00000770: 0000-0000-0000-0001
MSR 00000771: 0000-0000-011B-1143
MSR 00000772: 0000-0000-8000-FF01
MSR 00000773: 0000-0000-0000-0005
MSR 00000774: 0000-019E-5400-4301
MSR 00000777: 0000-0000-0000-0004
