------[ Versions ]------

Program Version : AIDA64 Engineer v7.50.7210 Beta
LLKD Version    : 2
BenchDLL Version: 4.7.912.8-x64
Windows Version : Microsoft Windows 11 Pro 10.0.22631.4602 (64-bit)
GetProductInfo  : 0x00000030

------[ CPU Info ]------

CPU Type          : QuadCore Intel Core i5-1135G7, 3500 MHz (35 x 100)
CPU Alias         : Tiger Lake-UP3
CPU Platform      : BGA1449
CPU Stepping      : B0/B1
Instruction Set   : x86, x86-64, MMX, SSE, SSE2, SSE3, SSSE3, SSE4.1, SSE4.2, AVX, AVX2, AVX-512, FMA, AES, SHA
CPUID Manufacturer: GenuineIntel
CPUID CPU Name    : 11th Gen Intel(R) Core(TM) i5-1135G7 @ 2.40GHz
CPUID Revision    : 000806C1h
IA Brand ID       : 00h  (Unknown)
Platform ID       : 33h  (BGA1449)
HTT / CMP Units   : 2 / 4
Max. NUMA Node    : 0

Tjmax Temperature          : 100 Celsius
HTC Temperature Limit      : 0 Celsius
CPU TDP                    : 28 W
CPU TDC                    : 81 A
CPU Max Power Limit        : Unlimited Power / Unlimited Time
CPU Power Limit 1 (Long)   : 28 W / 28.00 sec  (Unlocked)
CPU Power Limit 2 (Short)  : 64 W / 2.44 ms  (Unlocked)
Max Turbo Boost Multipliers: 1C: 42x, 2C: 42x, 3C: 38x, 4C: 38x

------[ Motherboard Info ]------

Motherboard ID      : <DMI>
Motherboard Model   : Intel Tiger Canyon NUC11TN
Motherboard Chipset : Intel Tiger Point-LP, Intel Tiger Lake-UP3

DMI MB Manufacturer : Intel Corporation
DMI MB Product      : NUC11TN
DMI MB Version      : 
DMI MB Serial       : 
DMI SYS Manufacturer: Intel(R) Client Systems
DMI SYS Product     : 
DMI SYS Version     : 
DMI SYS Serial      : 
DMI BIOS Version    : TNTGL357.0023.2020.0825.1713


------[ CPUID Registers / Logical CPU #0 ]------

allcpu: Package 0 / Core 0 / Thread 0: Valid

CPUID 00000000: 0000001B-756E6547-6C65746E-49656E69 [GenuineIntel]
CPUID 00000001: 000806C1-00100800-7FFAFBBF-BFEBFBFF
CPUID 00000002: 00FEFF01-000000F0-00000000-00000000
CPUID 00000003: 00000000-00000000-00000000-00000000
CPUID 00000004: 1C004121-02C0003F-0000003F-00000000 [SL 00] [L1D: 48 KB]
CPUID 00000004: 1C004122-01C0003F-0000003F-00000000 [SL 01] [L1I: 32 KB]
CPUID 00000004: 1C004143-04C0003F-000003FF-00000000 [SL 02] [L2U: 1280 KB]
CPUID 00000004: 1C03C163-01C0003F-00003FFF-00000004 [SL 03] [L3U: 8 MB]
CPUID 00000005: 00000040-00000040-00000003-11121020
CPUID 00000006: 0017EFF7-00000002-00000009-00000000
CPUID 00000007: 00000000-F3BFA7EB-18C05FCE-FC100510 [SL 00]
CPUID 00000008: 00000000-00000000-00000000-00000000
CPUID 00000009: 00000000-00000000-00000000-00000000
CPUID 0000000A: 08300805-00000000-0000000F-00008604
CPUID 0000000B: 00000001-00000002-00000100-00000000 [SL 00]
CPUID 0000000B: 00000004-00000008-00000201-00000000 [SL 01]
CPUID 0000000C: 00000000-00000000-00000000-00000000
CPUID 0000000D: 000002E7-00000A80-00000A88-00000000 [SL 00] [x87]
CPUID 0000000D: 0000000F-00000A10-00003900-00000000 [SL 01] [SSE]
CPUID 0000000D: 00000100-00000240-00000000-00000000 [SL 02] [AVX]
CPUID 0000000D: 00000040-00000440-00000000-00000000 [SL 05] [AVX-512 Opmask]
CPUID 0000000D: 00000200-00000480-00000000-00000000 [SL 06] [AVX-512 Hi256]
CPUID 0000000D: 00000400-00000680-00000000-00000000 [SL 07] [AVX-512 Hi16]
CPUID 0000000D: 00000080-00000000-00000001-00000000 [SL 08] [PT]
CPUID 0000000D: 00000008-00000A80-00000000-00000000 [SL 09] [PKRU]
CPUID 0000000D: 00000010-00000000-00000001-00000000 [SL 0B] [CET_U]
CPUID 0000000D: 00000018-00000000-00000001-00000000 [SL 0C] [CET_S]
CPUID 0000000D: 00000008-00000000-00000001-00000000 [SL 0D] [HDC]
CPUID 0000000E: 00000000-00000000-00000000-00000000
CPUID 0000000F: 00000000-00000000-00000000-00000000 [SL 00]
CPUID 0000000F: 00000000-00000000-00000000-00000000 [SL 01]
CPUID 00000010: 00000000-00000004-00000000-00000000 [SL 00]
CPUID 00000010: 00000000-00000000-00000000-00000000 [SL 01]
CPUID 00000011: 00000000-00000000-00000000-00000000
CPUID 00000012: 00000000-00000000-00000000-00000000 [SL 00]
CPUID 00000012: 00000000-00000000-00000000-00000000 [SL 01]
CPUID 00000013: 00000000-00000000-00000000-00000000
CPUID 00000014: 00000001-0000004F-00000007-00000000 [SL 00]
CPUID 00000014: 02490002-003F1FFF-00000000-00000000 [SL 01]
CPUID 00000015: 00000002-0000007E-0249F000-00000000 [63.00x / 38400000 / 2419.20]
CPUID 00000016: 00000960-00001068-00000064-00000000 [2400 / 4200 / 100]
CPUID 00000017: 00000000-00000000-00000000-00000000 [SL 00]
CPUID 00000018: 00000008-00000000-00000000-00000000 [SL 00]
CPUID 00000018: 00000000-00080001-00000010-00004022 [SL 01]
CPUID 00000018: 00000000-00080006-00000002-00004022 [SL 02]
CPUID 00000018: 00000000-0010000F-00000001-00004125 [SL 03]
CPUID 00000018: 00000000-00040001-00000010-00004024 [SL 04]
CPUID 00000018: 00000000-00040006-00000008-00004024 [SL 05]
CPUID 00000018: 00000000-00080008-00000001-00004124 [SL 06]
CPUID 00000018: 00000000-00080007-00000080-00004043 [SL 07]
CPUID 00000018: 00000000-00080009-00000080-00004043 [SL 08]
CPUID 00000019: 00000007-00000014-00000003-00000000
CPUID 0000001A: 00000000-00000000-00000000-00000000 [Unknown]
CPUID 80000000: 80000008-00000000-00000000-00000000
CPUID 80000001: 00000000-00000000-00000121-2C100000
CPUID 80000002: 68743131-6E654720-746E4920-52286C65 [11th Gen Intel(R]
CPUID 80000003: 6F432029-54286572-6920294D-31312D35 [) Core(TM) i5-11]
CPUID 80000004: 37473533-32204020-4730342E-00007A48 [35G7 @ 2.40GHz]
CPUID 80000005: 00000000-00000000-00000000-00000000 [L1D: 0 KB / L1I: 0 KB]
CPUID 80000006: 00000000-00000000-01007040-00000000 [L2: 256 KB / L3: 0 KB]
CPUID 80000007: 00000000-00000000-00000000-00000100
CPUID 80000008: 00003027-00000000-00000000-00000000

L1    Data Cache:    48 KB, 12-way Associative, 64-byte Line
L1  Instr. Cache:    32 KB,  8-way Associative, 64-byte Line
L2 Unified Cache:  1280 KB, 20-way Associative, 64-byte Line
L3 Unified Cache:     8 MB,  8-way Associative, 64-byte Line

------[ CPUID Registers / Logical CPU #1 ]------

allcpu: Package 0 / Core 0 / Thread 1: Valid, Virtual

CPUID 00000000: 0000001B-756E6547-6C65746E-49656E69 [GenuineIntel]
CPUID 00000001: 000806C1-01100800-7FFAFBBF-BFEBFBFF
CPUID 00000002: 00FEFF01-000000F0-00000000-00000000
CPUID 00000003: 00000000-00000000-00000000-00000000
CPUID 00000004: 1C004121-02C0003F-0000003F-00000000 [SL 00] [L1D: 48 KB]
CPUID 00000004: 1C004122-01C0003F-0000003F-00000000 [SL 01] [L1I: 32 KB]
CPUID 00000004: 1C004143-04C0003F-000003FF-00000000 [SL 02] [L2U: 1280 KB]
CPUID 00000004: 1C03C163-01C0003F-00003FFF-00000004 [SL 03] [L3U: 8 MB]
CPUID 00000005: 00000040-00000040-00000003-11121020
CPUID 00000006: 0017EFF7-00000002-00000009-00000000
CPUID 00000007: 00000000-F3BFA7EB-18C05FCE-FC100510 [SL 00]
CPUID 00000008: 00000000-00000000-00000000-00000000
CPUID 00000009: 00000000-00000000-00000000-00000000
CPUID 0000000A: 08300805-00000000-0000000F-00008604
CPUID 0000000B: 00000001-00000002-00000100-00000001 [SL 00]
CPUID 0000000B: 00000004-00000008-00000201-00000001 [SL 01]
CPUID 0000000C: 00000000-00000000-00000000-00000000
CPUID 0000000D: 000002E7-00000A80-00000A88-00000000 [SL 00] [x87]
CPUID 0000000D: 0000000F-00000A10-00003900-00000000 [SL 01] [SSE]
CPUID 0000000D: 00000100-00000240-00000000-00000000 [SL 02] [AVX]
CPUID 0000000D: 00000040-00000440-00000000-00000000 [SL 05] [AVX-512 Opmask]
CPUID 0000000D: 00000200-00000480-00000000-00000000 [SL 06] [AVX-512 Hi256]
CPUID 0000000D: 00000400-00000680-00000000-00000000 [SL 07] [AVX-512 Hi16]
CPUID 0000000D: 00000080-00000000-00000001-00000000 [SL 08] [PT]
CPUID 0000000D: 00000008-00000A80-00000000-00000000 [SL 09] [PKRU]
CPUID 0000000D: 00000010-00000000-00000001-00000000 [SL 0B] [CET_U]
CPUID 0000000D: 00000018-00000000-00000001-00000000 [SL 0C] [CET_S]
CPUID 0000000D: 00000008-00000000-00000001-00000000 [SL 0D] [HDC]
CPUID 0000000E: 00000000-00000000-00000000-00000000
CPUID 0000000F: 00000000-00000000-00000000-00000000 [SL 00]
CPUID 0000000F: 00000000-00000000-00000000-00000000 [SL 01]
CPUID 00000010: 00000000-00000004-00000000-00000000 [SL 00]
CPUID 00000010: 00000000-00000000-00000000-00000000 [SL 01]
CPUID 00000011: 00000000-00000000-00000000-00000000
CPUID 00000012: 00000000-00000000-00000000-00000000 [SL 00]
CPUID 00000012: 00000000-00000000-00000000-00000000 [SL 01]
CPUID 00000013: 00000000-00000000-00000000-00000000
CPUID 00000014: 00000001-0000004F-00000007-00000000 [SL 00]
CPUID 00000014: 02490002-003F1FFF-00000000-00000000 [SL 01]
CPUID 00000015: 00000002-0000007E-0249F000-00000000 [63.00x / 38400000 / 2419.20]
CPUID 00000016: 00000960-00001068-00000064-00000000 [2400 / 4200 / 100]
CPUID 00000017: 00000000-00000000-00000000-00000000 [SL 00]
CPUID 00000018: 00000008-00000000-00000000-00000000 [SL 00]
CPUID 00000018: 00000000-00080001-00000010-00004022 [SL 01]
CPUID 00000018: 00000000-00080006-00000002-00004022 [SL 02]
CPUID 00000018: 00000000-0010000F-00000001-00004125 [SL 03]
CPUID 00000018: 00000000-00040001-00000010-00004024 [SL 04]
CPUID 00000018: 00000000-00040006-00000008-00004024 [SL 05]
CPUID 00000018: 00000000-00080008-00000001-00004124 [SL 06]
CPUID 00000018: 00000000-00080007-00000080-00004043 [SL 07]
CPUID 00000018: 00000000-00080009-00000080-00004043 [SL 08]
CPUID 00000019: 00000007-00000014-00000003-00000000
CPUID 0000001A: 00000000-00000000-00000000-00000000 [Unknown]
CPUID 80000000: 80000008-00000000-00000000-00000000
CPUID 80000001: 00000000-00000000-00000121-2C100000
CPUID 80000002: 68743131-6E654720-746E4920-52286C65 [11th Gen Intel(R]
CPUID 80000003: 6F432029-54286572-6920294D-31312D35 [) Core(TM) i5-11]
CPUID 80000004: 37473533-32204020-4730342E-00007A48 [35G7 @ 2.40GHz]
CPUID 80000005: 00000000-00000000-00000000-00000000 [L1D: 0 KB / L1I: 0 KB]
CPUID 80000006: 00000000-00000000-01007040-00000000 [L2: 256 KB / L3: 0 KB]
CPUID 80000007: 00000000-00000000-00000000-00000100
CPUID 80000008: 00003027-00000000-00000000-00000000

L1    Data Cache:    48 KB, 12-way Associative, 64-byte Line
L1  Instr. Cache:    32 KB,  8-way Associative, 64-byte Line
L2 Unified Cache:  1280 KB, 20-way Associative, 64-byte Line
L3 Unified Cache:     8 MB,  8-way Associative, 64-byte Line

------[ CPUID Registers / Logical CPU #2 ]------

allcpu: Package 0 / Core 1 / Thread 0: Valid

CPUID 00000000: 0000001B-756E6547-6C65746E-49656E69 [GenuineIntel]
CPUID 00000001: 000806C1-02100800-7FFAFBBF-BFEBFBFF
CPUID 00000002: 00FEFF01-000000F0-00000000-00000000
CPUID 00000003: 00000000-00000000-00000000-00000000
CPUID 00000004: 1C004121-02C0003F-0000003F-00000000 [SL 00] [L1D: 48 KB]
CPUID 00000004: 1C004122-01C0003F-0000003F-00000000 [SL 01] [L1I: 32 KB]
CPUID 00000004: 1C004143-04C0003F-000003FF-00000000 [SL 02] [L2U: 1280 KB]
CPUID 00000004: 1C03C163-01C0003F-00003FFF-00000004 [SL 03] [L3U: 8 MB]
CPUID 00000005: 00000040-00000040-00000003-11121020
CPUID 00000006: 0017EFF7-00000002-00000009-00000000
CPUID 00000007: 00000000-F3BFA7EB-18C05FCE-FC100510 [SL 00]
CPUID 00000008: 00000000-00000000-00000000-00000000
CPUID 00000009: 00000000-00000000-00000000-00000000
CPUID 0000000A: 08300805-00000000-0000000F-00008604
CPUID 0000000B: 00000001-00000002-00000100-00000002 [SL 00]
CPUID 0000000B: 00000004-00000008-00000201-00000002 [SL 01]
CPUID 0000000C: 00000000-00000000-00000000-00000000
CPUID 0000000D: 000002E7-00000A80-00000A88-00000000 [SL 00] [x87]
CPUID 0000000D: 0000000F-00000A10-00003900-00000000 [SL 01] [SSE]
CPUID 0000000D: 00000100-00000240-00000000-00000000 [SL 02] [AVX]
CPUID 0000000D: 00000040-00000440-00000000-00000000 [SL 05] [AVX-512 Opmask]
CPUID 0000000D: 00000200-00000480-00000000-00000000 [SL 06] [AVX-512 Hi256]
CPUID 0000000D: 00000400-00000680-00000000-00000000 [SL 07] [AVX-512 Hi16]
CPUID 0000000D: 00000080-00000000-00000001-00000000 [SL 08] [PT]
CPUID 0000000D: 00000008-00000A80-00000000-00000000 [SL 09] [PKRU]
CPUID 0000000D: 00000010-00000000-00000001-00000000 [SL 0B] [CET_U]
CPUID 0000000D: 00000018-00000000-00000001-00000000 [SL 0C] [CET_S]
CPUID 0000000D: 00000008-00000000-00000001-00000000 [SL 0D] [HDC]
CPUID 0000000E: 00000000-00000000-00000000-00000000
CPUID 0000000F: 00000000-00000000-00000000-00000000 [SL 00]
CPUID 0000000F: 00000000-00000000-00000000-00000000 [SL 01]
CPUID 00000010: 00000000-00000004-00000000-00000000 [SL 00]
CPUID 00000010: 00000000-00000000-00000000-00000000 [SL 01]
CPUID 00000011: 00000000-00000000-00000000-00000000
CPUID 00000012: 00000000-00000000-00000000-00000000 [SL 00]
CPUID 00000012: 00000000-00000000-00000000-00000000 [SL 01]
CPUID 00000013: 00000000-00000000-00000000-00000000
CPUID 00000014: 00000001-0000004F-00000007-00000000 [SL 00]
CPUID 00000014: 02490002-003F1FFF-00000000-00000000 [SL 01]
CPUID 00000015: 00000002-0000007E-0249F000-00000000 [63.00x / 38400000 / 2419.20]
CPUID 00000016: 00000960-00001068-00000064-00000000 [2400 / 4200 / 100]
CPUID 00000017: 00000000-00000000-00000000-00000000 [SL 00]
CPUID 00000018: 00000008-00000000-00000000-00000000 [SL 00]
CPUID 00000018: 00000000-00080001-00000010-00004022 [SL 01]
CPUID 00000018: 00000000-00080006-00000002-00004022 [SL 02]
CPUID 00000018: 00000000-0010000F-00000001-00004125 [SL 03]
CPUID 00000018: 00000000-00040001-00000010-00004024 [SL 04]
CPUID 00000018: 00000000-00040006-00000008-00004024 [SL 05]
CPUID 00000018: 00000000-00080008-00000001-00004124 [SL 06]
CPUID 00000018: 00000000-00080007-00000080-00004043 [SL 07]
CPUID 00000018: 00000000-00080009-00000080-00004043 [SL 08]
CPUID 00000019: 00000007-00000014-00000003-00000000
CPUID 0000001A: 00000000-00000000-00000000-00000000 [Unknown]
CPUID 80000000: 80000008-00000000-00000000-00000000
CPUID 80000001: 00000000-00000000-00000121-2C100000
CPUID 80000002: 68743131-6E654720-746E4920-52286C65 [11th Gen Intel(R]
CPUID 80000003: 6F432029-54286572-6920294D-31312D35 [) Core(TM) i5-11]
CPUID 80000004: 37473533-32204020-4730342E-00007A48 [35G7 @ 2.40GHz]
CPUID 80000005: 00000000-00000000-00000000-00000000 [L1D: 0 KB / L1I: 0 KB]
CPUID 80000006: 00000000-00000000-01007040-00000000 [L2: 256 KB / L3: 0 KB]
CPUID 80000007: 00000000-00000000-00000000-00000100
CPUID 80000008: 00003027-00000000-00000000-00000000

L1    Data Cache:    48 KB, 12-way Associative, 64-byte Line
L1  Instr. Cache:    32 KB,  8-way Associative, 64-byte Line
L2 Unified Cache:  1280 KB, 20-way Associative, 64-byte Line
L3 Unified Cache:     8 MB,  8-way Associative, 64-byte Line

------[ CPUID Registers / Logical CPU #3 ]------

allcpu: Package 0 / Core 1 / Thread 1: Valid, Virtual

CPUID 00000000: 0000001B-756E6547-6C65746E-49656E69 [GenuineIntel]
CPUID 00000001: 000806C1-03100800-7FFAFBBF-BFEBFBFF
CPUID 00000002: 00FEFF01-000000F0-00000000-00000000
CPUID 00000003: 00000000-00000000-00000000-00000000
CPUID 00000004: 1C004121-02C0003F-0000003F-00000000 [SL 00] [L1D: 48 KB]
CPUID 00000004: 1C004122-01C0003F-0000003F-00000000 [SL 01] [L1I: 32 KB]
CPUID 00000004: 1C004143-04C0003F-000003FF-00000000 [SL 02] [L2U: 1280 KB]
CPUID 00000004: 1C03C163-01C0003F-00003FFF-00000004 [SL 03] [L3U: 8 MB]
CPUID 00000005: 00000040-00000040-00000003-11121020
CPUID 00000006: 0017EFF7-00000002-00000009-00000000
CPUID 00000007: 00000000-F3BFA7EB-18C05FCE-FC100510 [SL 00]
CPUID 00000008: 00000000-00000000-00000000-00000000
CPUID 00000009: 00000000-00000000-00000000-00000000
CPUID 0000000A: 08300805-00000000-0000000F-00008604
CPUID 0000000B: 00000001-00000002-00000100-00000003 [SL 00]
CPUID 0000000B: 00000004-00000008-00000201-00000003 [SL 01]
CPUID 0000000C: 00000000-00000000-00000000-00000000
CPUID 0000000D: 000002E7-00000A80-00000A88-00000000 [SL 00] [x87]
CPUID 0000000D: 0000000F-00000A10-00003900-00000000 [SL 01] [SSE]
CPUID 0000000D: 00000100-00000240-00000000-00000000 [SL 02] [AVX]
CPUID 0000000D: 00000040-00000440-00000000-00000000 [SL 05] [AVX-512 Opmask]
CPUID 0000000D: 00000200-00000480-00000000-00000000 [SL 06] [AVX-512 Hi256]
CPUID 0000000D: 00000400-00000680-00000000-00000000 [SL 07] [AVX-512 Hi16]
CPUID 0000000D: 00000080-00000000-00000001-00000000 [SL 08] [PT]
CPUID 0000000D: 00000008-00000A80-00000000-00000000 [SL 09] [PKRU]
CPUID 0000000D: 00000010-00000000-00000001-00000000 [SL 0B] [CET_U]
CPUID 0000000D: 00000018-00000000-00000001-00000000 [SL 0C] [CET_S]
CPUID 0000000D: 00000008-00000000-00000001-00000000 [SL 0D] [HDC]
CPUID 0000000E: 00000000-00000000-00000000-00000000
CPUID 0000000F: 00000000-00000000-00000000-00000000 [SL 00]
CPUID 0000000F: 00000000-00000000-00000000-00000000 [SL 01]
CPUID 00000010: 00000000-00000004-00000000-00000000 [SL 00]
CPUID 00000010: 00000000-00000000-00000000-00000000 [SL 01]
CPUID 00000011: 00000000-00000000-00000000-00000000
CPUID 00000012: 00000000-00000000-00000000-00000000 [SL 00]
CPUID 00000012: 00000000-00000000-00000000-00000000 [SL 01]
CPUID 00000013: 00000000-00000000-00000000-00000000
CPUID 00000014: 00000001-0000004F-00000007-00000000 [SL 00]
CPUID 00000014: 02490002-003F1FFF-00000000-00000000 [SL 01]
CPUID 00000015: 00000002-0000007E-0249F000-00000000 [63.00x / 38400000 / 2419.20]
CPUID 00000016: 00000960-00001068-00000064-00000000 [2400 / 4200 / 100]
CPUID 00000017: 00000000-00000000-00000000-00000000 [SL 00]
CPUID 00000018: 00000008-00000000-00000000-00000000 [SL 00]
CPUID 00000018: 00000000-00080001-00000010-00004022 [SL 01]
CPUID 00000018: 00000000-00080006-00000002-00004022 [SL 02]
CPUID 00000018: 00000000-0010000F-00000001-00004125 [SL 03]
CPUID 00000018: 00000000-00040001-00000010-00004024 [SL 04]
CPUID 00000018: 00000000-00040006-00000008-00004024 [SL 05]
CPUID 00000018: 00000000-00080008-00000001-00004124 [SL 06]
CPUID 00000018: 00000000-00080007-00000080-00004043 [SL 07]
CPUID 00000018: 00000000-00080009-00000080-00004043 [SL 08]
CPUID 00000019: 00000007-00000014-00000003-00000000
CPUID 0000001A: 00000000-00000000-00000000-00000000 [Unknown]
CPUID 80000000: 80000008-00000000-00000000-00000000
CPUID 80000001: 00000000-00000000-00000121-2C100000
CPUID 80000002: 68743131-6E654720-746E4920-52286C65 [11th Gen Intel(R]
CPUID 80000003: 6F432029-54286572-6920294D-31312D35 [) Core(TM) i5-11]
CPUID 80000004: 37473533-32204020-4730342E-00007A48 [35G7 @ 2.40GHz]
CPUID 80000005: 00000000-00000000-00000000-00000000 [L1D: 0 KB / L1I: 0 KB]
CPUID 80000006: 00000000-00000000-01007040-00000000 [L2: 256 KB / L3: 0 KB]
CPUID 80000007: 00000000-00000000-00000000-00000100
CPUID 80000008: 00003027-00000000-00000000-00000000

L1    Data Cache:    48 KB, 12-way Associative, 64-byte Line
L1  Instr. Cache:    32 KB,  8-way Associative, 64-byte Line
L2 Unified Cache:  1280 KB, 20-way Associative, 64-byte Line
L3 Unified Cache:     8 MB,  8-way Associative, 64-byte Line

------[ CPUID Registers / Logical CPU #4 ]------

allcpu: Package 0 / Core 2 / Thread 0: Valid

CPUID 00000000: 0000001B-756E6547-6C65746E-49656E69 [GenuineIntel]
CPUID 00000001: 000806C1-04100800-7FFAFBBF-BFEBFBFF
CPUID 00000002: 00FEFF01-000000F0-00000000-00000000
CPUID 00000003: 00000000-00000000-00000000-00000000
CPUID 00000004: 1C004121-02C0003F-0000003F-00000000 [SL 00] [L1D: 48 KB]
CPUID 00000004: 1C004122-01C0003F-0000003F-00000000 [SL 01] [L1I: 32 KB]
CPUID 00000004: 1C004143-04C0003F-000003FF-00000000 [SL 02] [L2U: 1280 KB]
CPUID 00000004: 1C03C163-01C0003F-00003FFF-00000004 [SL 03] [L3U: 8 MB]
CPUID 00000005: 00000040-00000040-00000003-11121020
CPUID 00000006: 0017EFF7-00000002-00000009-00000000
CPUID 00000007: 00000000-F3BFA7EB-18C05FCE-FC100510 [SL 00]
CPUID 00000008: 00000000-00000000-00000000-00000000
CPUID 00000009: 00000000-00000000-00000000-00000000
CPUID 0000000A: 08300805-00000000-0000000F-00008604
CPUID 0000000B: 00000001-00000002-00000100-00000004 [SL 00]
CPUID 0000000B: 00000004-00000008-00000201-00000004 [SL 01]
CPUID 0000000C: 00000000-00000000-00000000-00000000
CPUID 0000000D: 000002E7-00000A80-00000A88-00000000 [SL 00] [x87]
CPUID 0000000D: 0000000F-00000A10-00003900-00000000 [SL 01] [SSE]
CPUID 0000000D: 00000100-00000240-00000000-00000000 [SL 02] [AVX]
CPUID 0000000D: 00000040-00000440-00000000-00000000 [SL 05] [AVX-512 Opmask]
CPUID 0000000D: 00000200-00000480-00000000-00000000 [SL 06] [AVX-512 Hi256]
CPUID 0000000D: 00000400-00000680-00000000-00000000 [SL 07] [AVX-512 Hi16]
CPUID 0000000D: 00000080-00000000-00000001-00000000 [SL 08] [PT]
CPUID 0000000D: 00000008-00000A80-00000000-00000000 [SL 09] [PKRU]
CPUID 0000000D: 00000010-00000000-00000001-00000000 [SL 0B] [CET_U]
CPUID 0000000D: 00000018-00000000-00000001-00000000 [SL 0C] [CET_S]
CPUID 0000000D: 00000008-00000000-00000001-00000000 [SL 0D] [HDC]
CPUID 0000000E: 00000000-00000000-00000000-00000000
CPUID 0000000F: 00000000-00000000-00000000-00000000 [SL 00]
CPUID 0000000F: 00000000-00000000-00000000-00000000 [SL 01]
CPUID 00000010: 00000000-00000004-00000000-00000000 [SL 00]
CPUID 00000010: 00000000-00000000-00000000-00000000 [SL 01]
CPUID 00000011: 00000000-00000000-00000000-00000000
CPUID 00000012: 00000000-00000000-00000000-00000000 [SL 00]
CPUID 00000012: 00000000-00000000-00000000-00000000 [SL 01]
CPUID 00000013: 00000000-00000000-00000000-00000000
CPUID 00000014: 00000001-0000004F-00000007-00000000 [SL 00]
CPUID 00000014: 02490002-003F1FFF-00000000-00000000 [SL 01]
CPUID 00000015: 00000002-0000007E-0249F000-00000000 [63.00x / 38400000 / 2419.20]
CPUID 00000016: 00000960-00001068-00000064-00000000 [2400 / 4200 / 100]
CPUID 00000017: 00000000-00000000-00000000-00000000 [SL 00]
CPUID 00000018: 00000008-00000000-00000000-00000000 [SL 00]
CPUID 00000018: 00000000-00080001-00000010-00004022 [SL 01]
CPUID 00000018: 00000000-00080006-00000002-00004022 [SL 02]
CPUID 00000018: 00000000-0010000F-00000001-00004125 [SL 03]
CPUID 00000018: 00000000-00040001-00000010-00004024 [SL 04]
CPUID 00000018: 00000000-00040006-00000008-00004024 [SL 05]
CPUID 00000018: 00000000-00080008-00000001-00004124 [SL 06]
CPUID 00000018: 00000000-00080007-00000080-00004043 [SL 07]
CPUID 00000018: 00000000-00080009-00000080-00004043 [SL 08]
CPUID 00000019: 00000007-00000014-00000003-00000000
CPUID 0000001A: 00000000-00000000-00000000-00000000 [Unknown]
CPUID 80000000: 80000008-00000000-00000000-00000000
CPUID 80000001: 00000000-00000000-00000121-2C100000
CPUID 80000002: 68743131-6E654720-746E4920-52286C65 [11th Gen Intel(R]
CPUID 80000003: 6F432029-54286572-6920294D-31312D35 [) Core(TM) i5-11]
CPUID 80000004: 37473533-32204020-4730342E-00007A48 [35G7 @ 2.40GHz]
CPUID 80000005: 00000000-00000000-00000000-00000000 [L1D: 0 KB / L1I: 0 KB]
CPUID 80000006: 00000000-00000000-01007040-00000000 [L2: 256 KB / L3: 0 KB]
CPUID 80000007: 00000000-00000000-00000000-00000100
CPUID 80000008: 00003027-00000000-00000000-00000000

L1    Data Cache:    48 KB, 12-way Associative, 64-byte Line
L1  Instr. Cache:    32 KB,  8-way Associative, 64-byte Line
L2 Unified Cache:  1280 KB, 20-way Associative, 64-byte Line
L3 Unified Cache:     8 MB,  8-way Associative, 64-byte Line

------[ CPUID Registers / Logical CPU #5 ]------

allcpu: Package 0 / Core 2 / Thread 1: Valid, Virtual

CPUID 00000000: 0000001B-756E6547-6C65746E-49656E69 [GenuineIntel]
CPUID 00000001: 000806C1-05100800-7FFAFBBF-BFEBFBFF
CPUID 00000002: 00FEFF01-000000F0-00000000-00000000
CPUID 00000003: 00000000-00000000-00000000-00000000
CPUID 00000004: 1C004121-02C0003F-0000003F-00000000 [SL 00] [L1D: 48 KB]
CPUID 00000004: 1C004122-01C0003F-0000003F-00000000 [SL 01] [L1I: 32 KB]
CPUID 00000004: 1C004143-04C0003F-000003FF-00000000 [SL 02] [L2U: 1280 KB]
CPUID 00000004: 1C03C163-01C0003F-00003FFF-00000004 [SL 03] [L3U: 8 MB]
CPUID 00000005: 00000040-00000040-00000003-11121020
CPUID 00000006: 0017EFF7-00000002-00000009-00000000
CPUID 00000007: 00000000-F3BFA7EB-18C05FCE-FC100510 [SL 00]
CPUID 00000008: 00000000-00000000-00000000-00000000
CPUID 00000009: 00000000-00000000-00000000-00000000
CPUID 0000000A: 08300805-00000000-0000000F-00008604
CPUID 0000000B: 00000001-00000002-00000100-00000005 [SL 00]
CPUID 0000000B: 00000004-00000008-00000201-00000005 [SL 01]
CPUID 0000000C: 00000000-00000000-00000000-00000000
CPUID 0000000D: 000002E7-00000A80-00000A88-00000000 [SL 00] [x87]
CPUID 0000000D: 0000000F-00000A10-00003900-00000000 [SL 01] [SSE]
CPUID 0000000D: 00000100-00000240-00000000-00000000 [SL 02] [AVX]
CPUID 0000000D: 00000040-00000440-00000000-00000000 [SL 05] [AVX-512 Opmask]
CPUID 0000000D: 00000200-00000480-00000000-00000000 [SL 06] [AVX-512 Hi256]
CPUID 0000000D: 00000400-00000680-00000000-00000000 [SL 07] [AVX-512 Hi16]
CPUID 0000000D: 00000080-00000000-00000001-00000000 [SL 08] [PT]
CPUID 0000000D: 00000008-00000A80-00000000-00000000 [SL 09] [PKRU]
CPUID 0000000D: 00000010-00000000-00000001-00000000 [SL 0B] [CET_U]
CPUID 0000000D: 00000018-00000000-00000001-00000000 [SL 0C] [CET_S]
CPUID 0000000D: 00000008-00000000-00000001-00000000 [SL 0D] [HDC]
CPUID 0000000E: 00000000-00000000-00000000-00000000
CPUID 0000000F: 00000000-00000000-00000000-00000000 [SL 00]
CPUID 0000000F: 00000000-00000000-00000000-00000000 [SL 01]
CPUID 00000010: 00000000-00000004-00000000-00000000 [SL 00]
CPUID 00000010: 00000000-00000000-00000000-00000000 [SL 01]
CPUID 00000011: 00000000-00000000-00000000-00000000
CPUID 00000012: 00000000-00000000-00000000-00000000 [SL 00]
CPUID 00000012: 00000000-00000000-00000000-00000000 [SL 01]
CPUID 00000013: 00000000-00000000-00000000-00000000
CPUID 00000014: 00000001-0000004F-00000007-00000000 [SL 00]
CPUID 00000014: 02490002-003F1FFF-00000000-00000000 [SL 01]
CPUID 00000015: 00000002-0000007E-0249F000-00000000 [63.00x / 38400000 / 2419.20]
CPUID 00000016: 00000960-00001068-00000064-00000000 [2400 / 4200 / 100]
CPUID 00000017: 00000000-00000000-00000000-00000000 [SL 00]
CPUID 00000018: 00000008-00000000-00000000-00000000 [SL 00]
CPUID 00000018: 00000000-00080001-00000010-00004022 [SL 01]
CPUID 00000018: 00000000-00080006-00000002-00004022 [SL 02]
CPUID 00000018: 00000000-0010000F-00000001-00004125 [SL 03]
CPUID 00000018: 00000000-00040001-00000010-00004024 [SL 04]
CPUID 00000018: 00000000-00040006-00000008-00004024 [SL 05]
CPUID 00000018: 00000000-00080008-00000001-00004124 [SL 06]
CPUID 00000018: 00000000-00080007-00000080-00004043 [SL 07]
CPUID 00000018: 00000000-00080009-00000080-00004043 [SL 08]
CPUID 00000019: 00000007-00000014-00000003-00000000
CPUID 0000001A: 00000000-00000000-00000000-00000000 [Unknown]
CPUID 80000000: 80000008-00000000-00000000-00000000
CPUID 80000001: 00000000-00000000-00000121-2C100000
CPUID 80000002: 68743131-6E654720-746E4920-52286C65 [11th Gen Intel(R]
CPUID 80000003: 6F432029-54286572-6920294D-31312D35 [) Core(TM) i5-11]
CPUID 80000004: 37473533-32204020-4730342E-00007A48 [35G7 @ 2.40GHz]
CPUID 80000005: 00000000-00000000-00000000-00000000 [L1D: 0 KB / L1I: 0 KB]
CPUID 80000006: 00000000-00000000-01007040-00000000 [L2: 256 KB / L3: 0 KB]
CPUID 80000007: 00000000-00000000-00000000-00000100
CPUID 80000008: 00003027-00000000-00000000-00000000

L1    Data Cache:    48 KB, 12-way Associative, 64-byte Line
L1  Instr. Cache:    32 KB,  8-way Associative, 64-byte Line
L2 Unified Cache:  1280 KB, 20-way Associative, 64-byte Line
L3 Unified Cache:     8 MB,  8-way Associative, 64-byte Line

------[ CPUID Registers / Logical CPU #6 ]------

allcpu: Package 0 / Core 3 / Thread 0: Valid

CPUID 00000000: 0000001B-756E6547-6C65746E-49656E69 [GenuineIntel]
CPUID 00000001: 000806C1-06100800-7FFAFBBF-BFEBFBFF
CPUID 00000002: 00FEFF01-000000F0-00000000-00000000
CPUID 00000003: 00000000-00000000-00000000-00000000
CPUID 00000004: 1C004121-02C0003F-0000003F-00000000 [SL 00] [L1D: 48 KB]
CPUID 00000004: 1C004122-01C0003F-0000003F-00000000 [SL 01] [L1I: 32 KB]
CPUID 00000004: 1C004143-04C0003F-000003FF-00000000 [SL 02] [L2U: 1280 KB]
CPUID 00000004: 1C03C163-01C0003F-00003FFF-00000004 [SL 03] [L3U: 8 MB]
CPUID 00000005: 00000040-00000040-00000003-11121020
CPUID 00000006: 0017EFF7-00000002-00000009-00000000
CPUID 00000007: 00000000-F3BFA7EB-18C05FCE-FC100510 [SL 00]
CPUID 00000008: 00000000-00000000-00000000-00000000
CPUID 00000009: 00000000-00000000-00000000-00000000
CPUID 0000000A: 08300805-00000000-0000000F-00008604
CPUID 0000000B: 00000001-00000002-00000100-00000006 [SL 00]
CPUID 0000000B: 00000004-00000008-00000201-00000006 [SL 01]
CPUID 0000000C: 00000000-00000000-00000000-00000000
CPUID 0000000D: 000002E7-00000A80-00000A88-00000000 [SL 00] [x87]
CPUID 0000000D: 0000000F-00000A10-00003900-00000000 [SL 01] [SSE]
CPUID 0000000D: 00000100-00000240-00000000-00000000 [SL 02] [AVX]
CPUID 0000000D: 00000040-00000440-00000000-00000000 [SL 05] [AVX-512 Opmask]
CPUID 0000000D: 00000200-00000480-00000000-00000000 [SL 06] [AVX-512 Hi256]
CPUID 0000000D: 00000400-00000680-00000000-00000000 [SL 07] [AVX-512 Hi16]
CPUID 0000000D: 00000080-00000000-00000001-00000000 [SL 08] [PT]
CPUID 0000000D: 00000008-00000A80-00000000-00000000 [SL 09] [PKRU]
CPUID 0000000D: 00000010-00000000-00000001-00000000 [SL 0B] [CET_U]
CPUID 0000000D: 00000018-00000000-00000001-00000000 [SL 0C] [CET_S]
CPUID 0000000D: 00000008-00000000-00000001-00000000 [SL 0D] [HDC]
CPUID 0000000E: 00000000-00000000-00000000-00000000
CPUID 0000000F: 00000000-00000000-00000000-00000000 [SL 00]
CPUID 0000000F: 00000000-00000000-00000000-00000000 [SL 01]
CPUID 00000010: 00000000-00000004-00000000-00000000 [SL 00]
CPUID 00000010: 00000000-00000000-00000000-00000000 [SL 01]
CPUID 00000011: 00000000-00000000-00000000-00000000
CPUID 00000012: 00000000-00000000-00000000-00000000 [SL 00]
CPUID 00000012: 00000000-00000000-00000000-00000000 [SL 01]
CPUID 00000013: 00000000-00000000-00000000-00000000
CPUID 00000014: 00000001-0000004F-00000007-00000000 [SL 00]
CPUID 00000014: 02490002-003F1FFF-00000000-00000000 [SL 01]
CPUID 00000015: 00000002-0000007E-0249F000-00000000 [63.00x / 38400000 / 2419.20]
CPUID 00000016: 00000960-00001068-00000064-00000000 [2400 / 4200 / 100]
CPUID 00000017: 00000000-00000000-00000000-00000000 [SL 00]
CPUID 00000018: 00000008-00000000-00000000-00000000 [SL 00]
CPUID 00000018: 00000000-00080001-00000010-00004022 [SL 01]
CPUID 00000018: 00000000-00080006-00000002-00004022 [SL 02]
CPUID 00000018: 00000000-0010000F-00000001-00004125 [SL 03]
CPUID 00000018: 00000000-00040001-00000010-00004024 [SL 04]
CPUID 00000018: 00000000-00040006-00000008-00004024 [SL 05]
CPUID 00000018: 00000000-00080008-00000001-00004124 [SL 06]
CPUID 00000018: 00000000-00080007-00000080-00004043 [SL 07]
CPUID 00000018: 00000000-00080009-00000080-00004043 [SL 08]
CPUID 00000019: 00000007-00000014-00000003-00000000
CPUID 0000001A: 00000000-00000000-00000000-00000000 [Unknown]
CPUID 80000000: 80000008-00000000-00000000-00000000
CPUID 80000001: 00000000-00000000-00000121-2C100000
CPUID 80000002: 68743131-6E654720-746E4920-52286C65 [11th Gen Intel(R]
CPUID 80000003: 6F432029-54286572-6920294D-31312D35 [) Core(TM) i5-11]
CPUID 80000004: 37473533-32204020-4730342E-00007A48 [35G7 @ 2.40GHz]
CPUID 80000005: 00000000-00000000-00000000-00000000 [L1D: 0 KB / L1I: 0 KB]
CPUID 80000006: 00000000-00000000-01007040-00000000 [L2: 256 KB / L3: 0 KB]
CPUID 80000007: 00000000-00000000-00000000-00000100
CPUID 80000008: 00003027-00000000-00000000-00000000

L1    Data Cache:    48 KB, 12-way Associative, 64-byte Line
L1  Instr. Cache:    32 KB,  8-way Associative, 64-byte Line
L2 Unified Cache:  1280 KB, 20-way Associative, 64-byte Line
L3 Unified Cache:     8 MB,  8-way Associative, 64-byte Line

------[ CPUID Registers / Logical CPU #7 ]------

allcpu: Package 0 / Core 3 / Thread 1: Valid, Virtual

CPUID 00000000: 0000001B-756E6547-6C65746E-49656E69 [GenuineIntel]
CPUID 00000001: 000806C1-07100800-7FFAFBBF-BFEBFBFF
CPUID 00000002: 00FEFF01-000000F0-00000000-00000000
CPUID 00000003: 00000000-00000000-00000000-00000000
CPUID 00000004: 1C004121-02C0003F-0000003F-00000000 [SL 00] [L1D: 48 KB]
CPUID 00000004: 1C004122-01C0003F-0000003F-00000000 [SL 01] [L1I: 32 KB]
CPUID 00000004: 1C004143-04C0003F-000003FF-00000000 [SL 02] [L2U: 1280 KB]
CPUID 00000004: 1C03C163-01C0003F-00003FFF-00000004 [SL 03] [L3U: 8 MB]
CPUID 00000005: 00000040-00000040-00000003-11121020
CPUID 00000006: 0017EFF7-00000002-00000009-00000000
CPUID 00000007: 00000000-F3BFA7EB-18C05FCE-FC100510 [SL 00]
CPUID 00000008: 00000000-00000000-00000000-00000000
CPUID 00000009: 00000000-00000000-00000000-00000000
CPUID 0000000A: 08300805-00000000-0000000F-00008604
CPUID 0000000B: 00000001-00000002-00000100-00000007 [SL 00]
CPUID 0000000B: 00000004-00000008-00000201-00000007 [SL 01]
CPUID 0000000C: 00000000-00000000-00000000-00000000
CPUID 0000000D: 000002E7-00000A80-00000A88-00000000 [SL 00] [x87]
CPUID 0000000D: 0000000F-00000A10-00003900-00000000 [SL 01] [SSE]
CPUID 0000000D: 00000100-00000240-00000000-00000000 [SL 02] [AVX]
CPUID 0000000D: 00000040-00000440-00000000-00000000 [SL 05] [AVX-512 Opmask]
CPUID 0000000D: 00000200-00000480-00000000-00000000 [SL 06] [AVX-512 Hi256]
CPUID 0000000D: 00000400-00000680-00000000-00000000 [SL 07] [AVX-512 Hi16]
CPUID 0000000D: 00000080-00000000-00000001-00000000 [SL 08] [PT]
CPUID 0000000D: 00000008-00000A80-00000000-00000000 [SL 09] [PKRU]
CPUID 0000000D: 00000010-00000000-00000001-00000000 [SL 0B] [CET_U]
CPUID 0000000D: 00000018-00000000-00000001-00000000 [SL 0C] [CET_S]
CPUID 0000000D: 00000008-00000000-00000001-00000000 [SL 0D] [HDC]
CPUID 0000000E: 00000000-00000000-00000000-00000000
CPUID 0000000F: 00000000-00000000-00000000-00000000 [SL 00]
CPUID 0000000F: 00000000-00000000-00000000-00000000 [SL 01]
CPUID 00000010: 00000000-00000004-00000000-00000000 [SL 00]
CPUID 00000010: 00000000-00000000-00000000-00000000 [SL 01]
CPUID 00000011: 00000000-00000000-00000000-00000000
CPUID 00000012: 00000000-00000000-00000000-00000000 [SL 00]
CPUID 00000012: 00000000-00000000-00000000-00000000 [SL 01]
CPUID 00000013: 00000000-00000000-00000000-00000000
CPUID 00000014: 00000001-0000004F-00000007-00000000 [SL 00]
CPUID 00000014: 02490002-003F1FFF-00000000-00000000 [SL 01]
CPUID 00000015: 00000002-0000007E-0249F000-00000000 [63.00x / 38400000 / 2419.20]
CPUID 00000016: 00000960-00001068-00000064-00000000 [2400 / 4200 / 100]
CPUID 00000017: 00000000-00000000-00000000-00000000 [SL 00]
CPUID 00000018: 00000008-00000000-00000000-00000000 [SL 00]
CPUID 00000018: 00000000-00080001-00000010-00004022 [SL 01]
CPUID 00000018: 00000000-00080006-00000002-00004022 [SL 02]
CPUID 00000018: 00000000-0010000F-00000001-00004125 [SL 03]
CPUID 00000018: 00000000-00040001-00000010-00004024 [SL 04]
CPUID 00000018: 00000000-00040006-00000008-00004024 [SL 05]
CPUID 00000018: 00000000-00080008-00000001-00004124 [SL 06]
CPUID 00000018: 00000000-00080007-00000080-00004043 [SL 07]
CPUID 00000018: 00000000-00080009-00000080-00004043 [SL 08]
CPUID 00000019: 00000007-00000014-00000003-00000000
CPUID 0000001A: 00000000-00000000-00000000-00000000 [Unknown]
CPUID 80000000: 80000008-00000000-00000000-00000000
CPUID 80000001: 00000000-00000000-00000121-2C100000
CPUID 80000002: 68743131-6E654720-746E4920-52286C65 [11th Gen Intel(R]
CPUID 80000003: 6F432029-54286572-6920294D-31312D35 [) Core(TM) i5-11]
CPUID 80000004: 37473533-32204020-4730342E-00007A48 [35G7 @ 2.40GHz]
CPUID 80000005: 00000000-00000000-00000000-00000000 [L1D: 0 KB / L1I: 0 KB]
CPUID 80000006: 00000000-00000000-01007040-00000000 [L2: 256 KB / L3: 0 KB]
CPUID 80000007: 00000000-00000000-00000000-00000100
CPUID 80000008: 00003027-00000000-00000000-00000000

L1    Data Cache:    48 KB, 12-way Associative, 64-byte Line
L1  Instr. Cache:    32 KB,  8-way Associative, 64-byte Line
L2 Unified Cache:  1280 KB, 20-way Associative, 64-byte Line
L3 Unified Cache:     8 MB,  8-way Associative, 64-byte Line

------[ All CPUs ]------

CPU   0: APICID    0 / Package 0 / Core   0 / Thread 0: Valid
CPU   1: APICID    1 / Package 0 / Core   0 / Thread 1: Valid, Virtual
CPU   2: APICID    2 / Package 0 / Core   1 / Thread 0: Valid
CPU   3: APICID    3 / Package 0 / Core   1 / Thread 1: Valid, Virtual
CPU   4: APICID    4 / Package 0 / Core   2 / Thread 0: Valid
CPU   5: APICID    5 / Package 0 / Core   2 / Thread 1: Valid, Virtual
CPU   6: APICID    6 / Package 0 / Core   3 / Thread 0: Valid
CPU   7: APICID    7 / Package 0 / Core   3 / Thread 1: Valid, Virtual

------[ MSR Registers / Logical CPU #0 ]------

MSR 00000017: 001C-0000-0000-0000 [PlatID = 7]
MSR 0000001B: 0000-0000-FEE0-0D00
MSR 00000035: 0000-0000-0004-0008
MSR 00000048: 0000-0000-0000-0001
MSR 00000049: < FAILED >
MSR 0000008B: 0000-0052-0000-0000
MSR 000000CE: 0004-043D-F881-1800 [eD = 0]
MSR 000000E7: 0000-01BA-4473-C818 [S200]
MSR 000000E7: 0000-01BA-45C6-F3F8 [S200]
MSR 000000E7: 0000-01BA-465E-EB80
MSR 000000E8: 0000-01A8-9899-2824 [S200]
MSR 000000E8: 0000-01A8-9901-ECF5 [S200]
MSR 000000E8: 0000-01A8-9938-D113
MSR 0000010A: 0000-0000-0000-006B
MSR 0000010B: < FAILED >
MSR 00000194: 0000-0000-0011-0000
MSR 00000198: 0000-14E1-0000-0C00 [S200]
MSR 00000198: 0000-151E-0000-0D00 [S200]
MSR 00000198: 0000-151E-0000-0D00
MSR 00000199: 0000-0000-0000-0400
MSR 0000019A: 0000-0000-0000-0000
MSR 0000019B: 0000-0000-0000-0010
MSR 0000019C: 0000-0000-8822-8282 [S200]
MSR 0000019C: 0000-0000-8822-8282 [S200]
MSR 0000019C: 0000-0000-8822-8282
MSR 0000019D: 0000-0000-0000-0000
MSR 000001A0: 0000-0000-0085-0089
MSR 000001A2: 0000-0000-8064-0000
MSR 000001A4: 0000-0000-0000-0000
MSR 000001AA: 0000-0000-0040-1CC0
MSR 000001AC: < FAILED >
MSR 000001AD: 2626-2626-2626-2A2A
MSR 000001AE: < FAILED >
MSR 000001AF: < FAILED >
MSR 000001B0: 0000-0000-0000-0006
MSR 000001B1: 0000-0000-881D-0282
MSR 000001B2: 0000-0000-0000-0000
MSR 000001FC: 0000-0000-0024-005B
MSR 00000300: < FAILED >
MSR 0000030A: 0000-004B-2EAC-6DF3 [S200]
MSR 0000030A: 0000-004B-2EAC-6DF3 [S200]
MSR 0000030A: 0000-004B-2EAC-6DF3
MSR 0000030B: 0000-003B-D5D1-249E [S200]
MSR 0000030B: 0000-003B-D5D1-249E [S200]
MSR 0000030B: 0000-003B-D5D1-249E
MSR 00000480: 01DA-0500-0000-0013
MSR 00000481: 0000-00FF-0000-0016
MSR 00000482: FFFB-FFFE-0401-E172
MSR 00000483: 137F-FFFF-0003-6DFF
MSR 00000484: 0016-FFFF-0000-11FF
MSR 00000485: 0000-0000-7004-C1E7
MSR 00000486: 0000-0000-8000-0021
MSR 00000487: 0000-0000-FFFF-FFFF
MSR 00000488: 0000-0000-0000-2000
MSR 00000489: 0000-0000-00FF-2FFF
MSR 0000048A: 0000-0000-0000-002E
MSR 0000048B: 035F-3FFF-0000-0000
MSR 0000048C: 0000-0F01-06F3-4141
MSR 0000048D: 0000-00FF-0000-0016
MSR 0000048E: FFFB-FFFE-0400-6172
MSR 0000048F: 137F-FFFF-0003-6DFB
MSR 00000490: 0016-FFFF-0000-11FB
MSR 00000601: 0000-0000-0000-0288
MSR 00000602: < FAILED >
MSR 00000603: 0036-0000-0036-3636
MSR 00000604: < FAILED >
MSR 00000606: 0000-0000-000A-0E03
MSR 0000060A: 0000-0000-0000-0000
MSR 0000060B: 0000-0000-0000-0000
MSR 0000060C: 0000-0000-0000-0000
MSR 0000060D: 0000-052C-179D-564E
MSR 00000610: 0042-8200-00DD-80E0
MSR 00000611: 0000-0000-312E-5C59 [S200]
MSR 00000611: 0000-0000-312E-7BE8 [S200]
MSR 00000611: 0000-0000-312E-A19B
MSR 00000613: 0000-0000-0000-0000
MSR 00000614: 0000-0000-0000-00E0
MSR 00000618: 0000-0000-0000-0000
MSR 00000619: 0000-0000-0000-0000 [S200]
MSR 00000619: 0000-0000-0000-0000 [S200]
MSR 00000619: 0000-0000-0000-0000
MSR 0000061B: 0000-0000-0000-0000
MSR 0000061C: < FAILED >
MSR 0000061E: < FAILED >
MSR 00000620: 0000-0000-0000-0424
MSR 00000621: 0000-0000-1457-000C
MSR 00000638: 0000-0000-0000-0000
MSR 00000639: 0000-0000-15E8-5E22 [S200]
MSR 00000639: 0000-0000-15E8-61C5 [S200]
MSR 00000639: 0000-0000-15E8-649B
MSR 0000063A: 0000-0000-0000-0009
MSR 0000063B: < FAILED >
MSR 00000640: 0000-0000-0000-0000
MSR 00000641: 0000-0000-0081-6AEF [S200]
MSR 00000641: 0000-0000-0081-6AEF [S200]
MSR 00000641: 0000-0000-0081-6AFA
MSR 00000642: 0000-0000-0000-000D
MSR 00000648: 0000-0000-0000-0018
MSR 00000649: 0000-0000-0009-0060
MSR 0000064A: 0000-0000-000E-0078
MSR 0000064B: 0000-0000-0000-0000
MSR 0000064C: 0000-0000-0000-0017
MSR 00000690: 0000-0000-0000-0000
MSR 000006B0: 0000-0000-0102-0000
MSR 000006B1: 0000-0000-1100-0000
MSR 00000770: 0000-0000-0000-0000
MSR 00000771: < FAILED >
MSR 00000772: < FAILED >
MSR 00000773: 0000-0000-0000-0001
MSR 00000774: < FAILED >
MSR 00000777: < FAILED >
MSR 00000832: 0000-0000-0000-00D1
MSR 00000838: 0000-0000-0000-0097
MSR 00000839: 0000-0000-0000-0046
MSR 0000083E: 0000-0000-0000-000A

------[ MSR Registers / Logical CPU #1 ]------

MSR 00000017: 001C-0000-0000-0000 [PlatID = 7]
MSR 0000001B: 0000-0000-FEE0-0C00
MSR 00000035: 0000-0000-0004-0008
MSR 00000048: 0000-0000-0000-0001
MSR 00000049: < FAILED >
MSR 0000008B: 0000-0052-0000-0000
MSR 000000CE: 0004-043D-F881-1800 [eD = 0]
MSR 000000E7: 0000-00FE-DB4D-FF98
MSR 000000E8: 0000-0116-5B46-FEC0
MSR 0000010A: 0000-0000-0000-006B
MSR 0000010B: < FAILED >
MSR 00000194: 0000-0000-0011-0000
MSR 00000198: 0000-155C-0000-0F00
MSR 00000199: 0000-0000-0000-0400
MSR 0000019A: 0000-0000-0000-0000
MSR 0000019B: 0000-0000-0000-0010
MSR 0000019C: 0000-0000-8820-8282
MSR 0000019D: 0000-0000-0000-0000
MSR 000001A0: 0000-0000-0085-0089
MSR 000001A2: 0000-0000-8064-0000
MSR 000001A4: 0000-0000-0000-0000
MSR 000001AA: 0000-0000-0040-1CC0
MSR 000001AC: < FAILED >
MSR 000001AD: 2626-2626-2626-2A2A
MSR 000001AE: < FAILED >
MSR 000001AF: < FAILED >
MSR 000001B0: 0000-0000-0000-0006
MSR 000001B1: 0000-0000-881E-0282
MSR 000001B2: 0000-0000-0000-0000
MSR 000001FC: 0000-0000-0024-005B
MSR 00000300: < FAILED >
MSR 0000030A: 0000-003E-5F27-5BC3
MSR 0000030B: 0000-0030-BBDA-17C7
MSR 00000480: 01DA-0500-0000-0013
MSR 00000481: 0000-00FF-0000-0016
MSR 00000482: FFFB-FFFE-0401-E172
MSR 00000483: 137F-FFFF-0003-6DFF
MSR 00000484: 0016-FFFF-0000-11FF
MSR 00000485: 0000-0000-7004-C1E7
MSR 00000486: 0000-0000-8000-0021
MSR 00000487: 0000-0000-FFFF-FFFF
MSR 00000488: 0000-0000-0000-2000
MSR 00000489: 0000-0000-00FF-2FFF
MSR 0000048A: 0000-0000-0000-002E
MSR 0000048B: 035F-3FFF-0000-0000
MSR 0000048C: 0000-0F01-06F3-4141
MSR 0000048D: 0000-00FF-0000-0016
MSR 0000048E: FFFB-FFFE-0400-6172
MSR 0000048F: 137F-FFFF-0003-6DFB
MSR 00000490: 0016-FFFF-0000-11FB
MSR 00000601: 0000-0000-0000-0288
MSR 00000602: < FAILED >
MSR 00000603: 0036-0000-0036-3636
MSR 00000604: < FAILED >
MSR 00000606: 0000-0000-000A-0E03
MSR 0000060A: 0000-0000-0000-0000
MSR 0000060B: 0000-0000-0000-0000
MSR 0000060C: 0000-0000-0000-0000
MSR 0000060D: 0000-052C-573D-0337
MSR 00000610: 0042-8200-00DD-80E0
MSR 00000611: 0000-0000-312F-6BC2
MSR 00000613: 0000-0000-0000-0000
MSR 00000614: 0000-0000-0000-00E0
MSR 00000618: 0000-0000-0000-0000
MSR 00000619: 0000-0000-0000-0000
MSR 0000061B: 0000-0000-0000-0000
MSR 0000061C: < FAILED >
MSR 0000061E: < FAILED >
MSR 00000620: 0000-0000-0000-0424
MSR 00000621: 0000-0000-146B-000D
MSR 00000638: 0000-0000-0000-0000
MSR 00000639: 0000-0000-15E8-6DEB
MSR 0000063A: 0000-0000-0000-0009
MSR 0000063B: < FAILED >
MSR 00000640: 0000-0000-0000-0000
MSR 00000641: 0000-0000-0081-6AFA
MSR 00000642: 0000-0000-0000-000D
MSR 00000648: 0000-0000-0000-0018
MSR 00000649: 0000-0000-0009-0060
MSR 0000064A: 0000-0000-000E-0078
MSR 0000064B: 0000-0000-0000-0000
MSR 0000064C: 0000-0000-0000-0017
MSR 00000690: 0000-0000-0000-0000
MSR 000006B0: 0000-0000-0102-0000
MSR 000006B1: 0000-0000-1100-0000
MSR 00000770: 0000-0000-0000-0000
MSR 00000771: < FAILED >
MSR 00000772: < FAILED >
MSR 00000773: 0000-0000-0000-0001
MSR 00000774: < FAILED >
MSR 00000777: < FAILED >
MSR 00000832: 0000-0000-0002-00D1
MSR 00000838: 0000-0000-0000-124F
MSR 00000839: 0000-0000-0000-115C
MSR 0000083E: 0000-0000-0000-000A

------[ MSR Registers / Logical CPU #2 ]------

MSR 00000017: 001C-0000-0000-0000 [PlatID = 7]
MSR 0000001B: 0000-0000-FEE0-0C00
MSR 00000035: 0000-0000-0004-0008
MSR 00000048: 0000-0000-0000-0001
MSR 00000049: < FAILED >
MSR 0000008B: 0000-0052-0000-0000
MSR 000000CE: 0004-043D-F881-1800 [eD = 0]
MSR 000000E7: 0000-0266-2620-8748
MSR 000000E8: 0000-0266-1BF2-1362
MSR 0000010A: 0000-0000-0000-006B
MSR 0000010B: < FAILED >
MSR 00000194: 0000-0000-0011-0000
MSR 00000198: 0000-14B8-0000-0F00
MSR 00000199: 0000-0000-0000-0400
MSR 0000019A: 0000-0000-0000-0000
MSR 0000019B: 0000-0000-0000-0010
MSR 0000019C: 0000-0000-881F-8282
MSR 0000019D: 0000-0000-0000-0000
MSR 000001A0: 0000-0000-0085-0089
MSR 000001A2: 0000-0000-8064-0000
MSR 000001A4: 0000-0000-0000-0000
MSR 000001AA: 0000-0000-0040-1CC0
MSR 000001AC: < FAILED >
MSR 000001AD: 2626-2626-2626-2A2A
MSR 000001AE: < FAILED >
MSR 000001AF: < FAILED >
MSR 000001B0: 0000-0000-0000-0006
MSR 000001B1: 0000-0000-881D-0282
MSR 000001B2: 0000-0000-0000-0000
MSR 000001FC: 0000-0000-0024-005B
MSR 00000300: < FAILED >
MSR 0000030A: 0000-0043-C79C-020B
MSR 0000030B: 0000-0038-CD4C-D7CC
MSR 00000480: 01DA-0500-0000-0013
MSR 00000481: 0000-00FF-0000-0016
MSR 00000482: FFFB-FFFE-0401-E172
MSR 00000483: 137F-FFFF-0003-6DFF
MSR 00000484: 0016-FFFF-0000-11FF
MSR 00000485: 0000-0000-7004-C1E7
MSR 00000486: 0000-0000-8000-0021
MSR 00000487: 0000-0000-FFFF-FFFF
MSR 00000488: 0000-0000-0000-2000
MSR 00000489: 0000-0000-00FF-2FFF
MSR 0000048A: 0000-0000-0000-002E
MSR 0000048B: 035F-3FFF-0000-0000
MSR 0000048C: 0000-0F01-06F3-4141
MSR 0000048D: 0000-00FF-0000-0016
MSR 0000048E: FFFB-FFFE-0400-6172
MSR 0000048F: 137F-FFFF-0003-6DFB
MSR 00000490: 0016-FFFF-0000-11FB
MSR 00000601: 0000-0000-0000-0288
MSR 00000602: < FAILED >
MSR 00000603: 0036-0000-0036-3636
MSR 00000604: < FAILED >
MSR 00000606: 0000-0000-000A-0E03
MSR 0000060A: 0000-0000-0000-0000
MSR 0000060B: 0000-0000-0000-0000
MSR 0000060C: 0000-0000-0000-0000
MSR 0000060D: 0000-052C-573D-0337
MSR 00000610: 0042-8200-00DD-80E0
MSR 00000611: 0000-0000-312F-6C17
MSR 00000613: 0000-0000-0000-0000
MSR 00000614: 0000-0000-0000-00E0
MSR 00000618: 0000-0000-0000-0000
MSR 00000619: 0000-0000-0000-0000
MSR 0000061B: 0000-0000-0000-0000
MSR 0000061C: < FAILED >
MSR 0000061E: < FAILED >
MSR 00000620: 0000-0000-0000-0424
MSR 00000621: 0000-0000-146B-000D
MSR 00000638: 0000-0000-0000-0000
MSR 00000639: 0000-0000-15E8-6E03
MSR 0000063A: 0000-0000-0000-0009
MSR 0000063B: < FAILED >
MSR 00000640: 0000-0000-0000-0000
MSR 00000641: 0000-0000-0081-6AFA
MSR 00000642: 0000-0000-0000-000D
MSR 00000648: 0000-0000-0000-0018
MSR 00000649: 0000-0000-0009-0060
MSR 0000064A: 0000-0000-000E-0078
MSR 0000064B: 0000-0000-0000-0000
MSR 0000064C: 0000-0000-0000-0017
MSR 00000690: 0000-0000-0000-0000
MSR 000006B0: 0000-0000-0102-0000
MSR 000006B1: 0000-0000-1100-0000
MSR 00000770: 0000-0000-0000-0000
MSR 00000771: < FAILED >
MSR 00000772: < FAILED >
MSR 00000773: 0000-0000-0000-0001
MSR 00000774: < FAILED >
MSR 00000777: < FAILED >
MSR 00000832: 0000-0000-0002-00D1
MSR 00000838: 0000-0000-0000-124F
MSR 00000839: 0000-0000-0000-1158
MSR 0000083E: 0000-0000-0000-000A

------[ MSR Registers / Logical CPU #3 ]------

MSR 00000017: 001C-0000-0000-0000 [PlatID = 7]
MSR 0000001B: 0000-0000-FEE0-0C00
MSR 00000035: 0000-0000-0004-0008
MSR 00000048: 0000-0000-0000-0001
MSR 00000049: < FAILED >
MSR 0000008B: 0000-0052-0000-0000
MSR 000000CE: 0004-043D-F881-1800 [eD = 0]
MSR 000000E7: 0000-00E3-A1A0-86F8
MSR 000000E8: 0000-0104-8DBC-9610
MSR 0000010A: 0000-0000-0000-006B
MSR 0000010B: < FAILED >
MSR 00000194: 0000-0000-0011-0000
MSR 00000198: 0000-14B8-0000-0F00
MSR 00000199: 0000-0000-0000-0400
MSR 0000019A: 0000-0000-0000-0000
MSR 0000019B: 0000-0000-0000-0010
MSR 0000019C: 0000-0000-881F-8282
MSR 0000019D: 0000-0000-0000-0000
MSR 000001A0: 0000-0000-0085-0089
MSR 000001A2: 0000-0000-8064-0000
MSR 000001A4: 0000-0000-0000-0000
MSR 000001AA: 0000-0000-0040-1CC0
MSR 000001AC: < FAILED >
MSR 000001AD: 2626-2626-2626-2A2A
MSR 000001AE: < FAILED >
MSR 000001AF: < FAILED >
MSR 000001B0: 0000-0000-0000-0006
MSR 000001B1: 0000-0000-881E-0282
MSR 000001B2: 0000-0000-0000-0000
MSR 000001FC: 0000-0000-0024-005B
MSR 00000300: < FAILED >
MSR 0000030A: 0000-0047-86E8-2D8E
MSR 0000030B: 0000-003B-4699-8E11
MSR 00000480: 01DA-0500-0000-0013
MSR 00000481: 0000-00FF-0000-0016
MSR 00000482: FFFB-FFFE-0401-E172
MSR 00000483: 137F-FFFF-0003-6DFF
MSR 00000484: 0016-FFFF-0000-11FF
MSR 00000485: 0000-0000-7004-C1E7
MSR 00000486: 0000-0000-8000-0021
MSR 00000487: 0000-0000-FFFF-FFFF
MSR 00000488: 0000-0000-0000-2000
MSR 00000489: 0000-0000-00FF-2FFF
MSR 0000048A: 0000-0000-0000-002E
MSR 0000048B: 035F-3FFF-0000-0000
MSR 0000048C: 0000-0F01-06F3-4141
MSR 0000048D: 0000-00FF-0000-0016
MSR 0000048E: FFFB-FFFE-0400-6172
MSR 0000048F: 137F-FFFF-0003-6DFB
MSR 00000490: 0016-FFFF-0000-11FB
MSR 00000601: 0000-0000-0000-0288
MSR 00000602: < FAILED >
MSR 00000603: 0036-0000-0036-3636
MSR 00000604: < FAILED >
MSR 00000606: 0000-0000-000A-0E03
MSR 0000060A: 0000-0000-0000-0000
MSR 0000060B: 0000-0000-0000-0000
MSR 0000060C: 0000-0000-0000-0000
MSR 0000060D: 0000-052C-573D-0337
MSR 00000610: 0042-8200-00DD-80E0
MSR 00000611: 0000-0000-312F-6CF9
MSR 00000613: 0000-0000-0000-0000
MSR 00000614: 0000-0000-0000-00E0
MSR 00000618: 0000-0000-0000-0000
MSR 00000619: 0000-0000-0000-0000
MSR 0000061B: 0000-0000-0000-0000
MSR 0000061C: < FAILED >
MSR 0000061E: < FAILED >
MSR 00000620: 0000-0000-0000-0424
MSR 00000621: 0000-0000-146B-000D
MSR 00000638: 0000-0000-0000-0000
MSR 00000639: 0000-0000-15E8-6E60
MSR 0000063A: 0000-0000-0000-0009
MSR 0000063B: < FAILED >
MSR 00000640: 0000-0000-0000-0000
MSR 00000641: 0000-0000-0081-6AFA
MSR 00000642: 0000-0000-0000-000D
MSR 00000648: 0000-0000-0000-0018
MSR 00000649: 0000-0000-0009-0060
MSR 0000064A: 0000-0000-000E-0078
MSR 0000064B: 0000-0000-0000-0000
MSR 0000064C: 0000-0000-0000-0017
MSR 00000690: 0000-0000-0000-0000
MSR 000006B0: 0000-0000-0102-0000
MSR 000006B1: 0000-0000-1100-0000
MSR 00000770: 0000-0000-0000-0000
MSR 00000771: < FAILED >
MSR 00000772: < FAILED >
MSR 00000773: 0000-0000-0000-0001
MSR 00000774: < FAILED >
MSR 00000777: < FAILED >
MSR 00000832: 0000-0000-0002-00D1
MSR 00000838: 0000-0000-0000-124F
MSR 00000839: 0000-0000-0000-11F4
MSR 0000083E: 0000-0000-0000-000A

------[ MSR Registers / Logical CPU #4 ]------

MSR 00000017: 001C-0000-0000-0000 [PlatID = 7]
MSR 0000001B: 0000-0000-FEE0-0C00
MSR 00000035: 0000-0000-0004-0008
MSR 00000048: 0000-0000-0000-0001
MSR 00000049: < FAILED >
MSR 0000008B: 0000-0052-0000-0000
MSR 000000CE: 0004-043D-F881-1800 [eD = 0]
MSR 000000E7: 0000-021E-2BF6-24F0
MSR 000000E8: 0000-0255-3BAF-4699
MSR 0000010A: 0000-0000-0000-006B
MSR 0000010B: < FAILED >
MSR 00000194: 0000-0000-0011-0000
MSR 00000198: 0000-15C2-0000-0F00
MSR 00000199: 0000-0000-0000-0400
MSR 0000019A: 0000-0000-0000-0000
MSR 0000019B: 0000-0000-0000-0010
MSR 0000019C: 0000-0000-8822-8282
MSR 0000019D: 0000-0000-0000-0000
MSR 000001A0: 0000-0000-0085-0089
MSR 000001A2: 0000-0000-8064-0000
MSR 000001A4: 0000-0000-0000-0000
MSR 000001AA: 0000-0000-0040-1CC0
MSR 000001AC: < FAILED >
MSR 000001AD: 2626-2626-2626-2A2A
MSR 000001AE: < FAILED >
MSR 000001AF: < FAILED >
MSR 000001B0: 0000-0000-0000-0006
MSR 000001B1: 0000-0000-881D-0282
MSR 000001B2: 0000-0000-0000-0000
MSR 000001FC: 0000-0000-0024-005B
MSR 00000300: < FAILED >
MSR 0000030A: 0000-0035-0F48-C217
MSR 0000030B: 0000-002B-A088-7377
MSR 00000480: 01DA-0500-0000-0013
MSR 00000481: 0000-00FF-0000-0016
MSR 00000482: FFFB-FFFE-0401-E172
MSR 00000483: 137F-FFFF-0003-6DFF
MSR 00000484: 0016-FFFF-0000-11FF
MSR 00000485: 0000-0000-7004-C1E7
MSR 00000486: 0000-0000-8000-0021
MSR 00000487: 0000-0000-FFFF-FFFF
MSR 00000488: 0000-0000-0000-2000
MSR 00000489: 0000-0000-00FF-2FFF
MSR 0000048A: 0000-0000-0000-002E
MSR 0000048B: 035F-3FFF-0000-0000
MSR 0000048C: 0000-0F01-06F3-4141
MSR 0000048D: 0000-00FF-0000-0016
MSR 0000048E: FFFB-FFFE-0400-6172
MSR 0000048F: 137F-FFFF-0003-6DFB
MSR 00000490: 0016-FFFF-0000-11FB
MSR 00000601: 0000-0000-0000-0288
MSR 00000602: < FAILED >
MSR 00000603: 0036-0000-0036-3636
MSR 00000604: < FAILED >
MSR 00000606: 0000-0000-000A-0E03
MSR 0000060A: 0000-0000-0000-0000
MSR 0000060B: 0000-0000-0000-0000
MSR 0000060C: 0000-0000-0000-0000
MSR 0000060D: 0000-052C-573D-0337
MSR 00000610: 0042-8200-00DD-80E0
MSR 00000611: 0000-0000-312F-6DB9
MSR 00000613: 0000-0000-0000-0000
MSR 00000614: 0000-0000-0000-00E0
MSR 00000618: 0000-0000-0000-0000
MSR 00000619: 0000-0000-0000-0000
MSR 0000061B: 0000-0000-0000-0000
MSR 0000061C: < FAILED >
MSR 0000061E: < FAILED >
MSR 00000620: 0000-0000-0000-0424
MSR 00000621: 0000-0000-146B-000D
MSR 00000638: 0000-0000-0000-0000
MSR 00000639: 0000-0000-15E8-6EAB
MSR 0000063A: 0000-0000-0000-0009
MSR 0000063B: < FAILED >
MSR 00000640: 0000-0000-0000-0000
MSR 00000641: 0000-0000-0081-6AFA
MSR 00000642: 0000-0000-0000-000D
MSR 00000648: 0000-0000-0000-0018
MSR 00000649: 0000-0000-0009-0060
MSR 0000064A: 0000-0000-000E-0078
MSR 0000064B: 0000-0000-0000-0000
MSR 0000064C: 0000-0000-0000-0017
MSR 00000690: 0000-0000-0000-0000
MSR 000006B0: 0000-0000-0102-0000
MSR 000006B1: 0000-0000-1100-0000
MSR 00000770: 0000-0000-0000-0000
MSR 00000771: < FAILED >
MSR 00000772: < FAILED >
MSR 00000773: 0000-0000-0000-0001
MSR 00000774: < FAILED >
MSR 00000777: < FAILED >
MSR 00000832: 0000-0000-0002-00D1
MSR 00000838: 0000-0000-0000-124F
MSR 00000839: 0000-0000-0000-115A
MSR 0000083E: 0000-0000-0000-000A

------[ MSR Registers / Logical CPU #5 ]------

MSR 00000017: 001C-0000-0000-0000 [PlatID = 7]
MSR 0000001B: 0000-0000-FEE0-0C00
MSR 00000035: 0000-0000-0004-0008
MSR 00000048: 0000-0000-0000-0001
MSR 00000049: < FAILED >
MSR 0000008B: 0000-0052-0000-0000
MSR 000000CE: 0004-043D-F881-1800 [eD = 0]
MSR 000000E7: 0000-00F3-A145-61F0
MSR 000000E8: 0000-00F6-561D-E5A4
MSR 0000010A: 0000-0000-0000-006B
MSR 0000010B: < FAILED >
MSR 00000194: 0000-0000-0011-0000
MSR 00000198: 0000-15C2-0000-0F00
MSR 00000199: 0000-0000-0000-0400
MSR 0000019A: 0000-0000-0000-0000
MSR 0000019B: 0000-0000-0000-0010
MSR 0000019C: 0000-0000-8821-8282
MSR 0000019D: 0000-0000-0000-0000
MSR 000001A0: 0000-0000-0085-0089
MSR 000001A2: 0000-0000-8064-0000
MSR 000001A4: 0000-0000-0000-0000
MSR 000001AA: 0000-0000-0040-1CC0
MSR 000001AC: < FAILED >
MSR 000001AD: 2626-2626-2626-2A2A
MSR 000001AE: < FAILED >
MSR 000001AF: < FAILED >
MSR 000001B0: 0000-0000-0000-0006
MSR 000001B1: 0000-0000-881D-0282
MSR 000001B2: 0000-0000-0000-0000
MSR 000001FC: 0000-0000-0024-005B
MSR 00000300: < FAILED >
MSR 0000030A: 0000-003C-FA23-A439
MSR 0000030B: 0000-0030-E150-1471
MSR 00000480: 01DA-0500-0000-0013
MSR 00000481: 0000-00FF-0000-0016
MSR 00000482: FFFB-FFFE-0401-E172
MSR 00000483: 137F-FFFF-0003-6DFF
MSR 00000484: 0016-FFFF-0000-11FF
MSR 00000485: 0000-0000-7004-C1E7
MSR 00000486: 0000-0000-8000-0021
MSR 00000487: 0000-0000-FFFF-FFFF
MSR 00000488: 0000-0000-0000-2000
MSR 00000489: 0000-0000-00FF-2FFF
MSR 0000048A: 0000-0000-0000-002E
MSR 0000048B: 035F-3FFF-0000-0000
MSR 0000048C: 0000-0F01-06F3-4141
MSR 0000048D: 0000-00FF-0000-0016
MSR 0000048E: FFFB-FFFE-0400-6172
MSR 0000048F: 137F-FFFF-0003-6DFB
MSR 00000490: 0016-FFFF-0000-11FB
MSR 00000601: 0000-0000-0000-0288
MSR 00000602: < FAILED >
MSR 00000603: 0036-0000-0036-3636
MSR 00000604: < FAILED >
MSR 00000606: 0000-0000-000A-0E03
MSR 0000060A: 0000-0000-0000-0000
MSR 0000060B: 0000-0000-0000-0000
MSR 0000060C: 0000-0000-0000-0000
MSR 0000060D: 0000-052C-573D-0337
MSR 00000610: 0042-8200-00DD-80E0
MSR 00000611: 0000-0000-312F-6E77
MSR 00000613: 0000-0000-0000-0000
MSR 00000614: 0000-0000-0000-00E0
MSR 00000618: 0000-0000-0000-0000
MSR 00000619: 0000-0000-0000-0000
MSR 0000061B: 0000-0000-0000-0000
MSR 0000061C: < FAILED >
MSR 0000061E: < FAILED >
MSR 00000620: 0000-0000-0000-0424
MSR 00000621: 0000-0000-146B-000D
MSR 00000638: 0000-0000-0000-0000
MSR 00000639: 0000-0000-15E8-6EF5
MSR 0000063A: 0000-0000-0000-0009
MSR 0000063B: < FAILED >
MSR 00000640: 0000-0000-0000-0000
MSR 00000641: 0000-0000-0081-6AFA
MSR 00000642: 0000-0000-0000-000D
MSR 00000648: 0000-0000-0000-0018
MSR 00000649: 0000-0000-0009-0060
MSR 0000064A: 0000-0000-000E-0078
MSR 0000064B: 0000-0000-0000-0000
MSR 0000064C: 0000-0000-0000-0017
MSR 00000690: 0000-0000-0000-0000
MSR 000006B0: 0000-0000-0102-0000
MSR 000006B1: 0000-0000-1100-0000
MSR 00000770: 0000-0000-0000-0000
MSR 00000771: < FAILED >
MSR 00000772: < FAILED >
MSR 00000773: 0000-0000-0000-0001
MSR 00000774: < FAILED >
MSR 00000777: < FAILED >
MSR 00000832: 0000-0000-0002-00D1
MSR 00000838: 0000-0000-0000-124F
MSR 00000839: 0000-0000-0000-1168
MSR 0000083E: 0000-0000-0000-000A

------[ MSR Registers / Logical CPU #6 ]------

MSR 00000017: 001C-0000-0000-0000 [PlatID = 7]
MSR 0000001B: 0000-0000-FEE0-0C00
MSR 00000035: 0000-0000-0004-0008
MSR 00000048: 0000-0000-0000-0001
MSR 00000049: < FAILED >
MSR 0000008B: 0000-0052-0000-0000
MSR 000000CE: 0004-043D-F881-1800 [eD = 0]
MSR 000000E7: 0000-0183-5D1C-8660
MSR 000000E8: 0000-0160-5EB2-E36E
MSR 0000010A: 0000-0000-0000-006B
MSR 0000010B: < FAILED >
MSR 00000194: 0000-0000-0011-0000
MSR 00000198: 0000-163D-0000-0F00
MSR 00000199: 0000-0000-0000-0400
MSR 0000019A: 0000-0000-0000-0000
MSR 0000019B: 0000-0000-0000-0010
MSR 0000019C: 0000-0000-8821-8282
MSR 0000019D: 0000-0000-0000-0000
MSR 000001A0: 0000-0000-0085-0089
MSR 000001A2: 0000-0000-8064-0000
MSR 000001A4: 0000-0000-0000-0000
MSR 000001AA: 0000-0000-0040-1CC0
MSR 000001AC: < FAILED >
MSR 000001AD: 2626-2626-2626-2A2A
MSR 000001AE: < FAILED >
MSR 000001AF: < FAILED >
MSR 000001B0: 0000-0000-0000-0006
MSR 000001B1: 0000-0000-881E-0282
MSR 000001B2: 0000-0000-0000-0000
MSR 000001FC: 0000-0000-0024-005B
MSR 00000300: < FAILED >
MSR 0000030A: 0000-002B-D87A-DB54
MSR 0000030B: 0000-0026-E4B9-8A4D
MSR 00000480: 01DA-0500-0000-0013
MSR 00000481: 0000-00FF-0000-0016
MSR 00000482: FFFB-FFFE-0401-E172
MSR 00000483: 137F-FFFF-0003-6DFF
MSR 00000484: 0016-FFFF-0000-11FF
MSR 00000485: 0000-0000-7004-C1E7
MSR 00000486: 0000-0000-8000-0021
MSR 00000487: 0000-0000-FFFF-FFFF
MSR 00000488: 0000-0000-0000-2000
MSR 00000489: 0000-0000-00FF-2FFF
MSR 0000048A: 0000-0000-0000-002E
MSR 0000048B: 035F-3FFF-0000-0000
MSR 0000048C: 0000-0F01-06F3-4141
MSR 0000048D: 0000-00FF-0000-0016
MSR 0000048E: FFFB-FFFE-0400-6172
MSR 0000048F: 137F-FFFF-0003-6DFB
MSR 00000490: 0016-FFFF-0000-11FB
MSR 00000601: 0000-0000-0000-0288
MSR 00000602: < FAILED >
MSR 00000603: 0036-0000-0036-3636
MSR 00000604: < FAILED >
MSR 00000606: 0000-0000-000A-0E03
MSR 0000060A: 0000-0000-0000-0000
MSR 0000060B: 0000-0000-0000-0000
MSR 0000060C: 0000-0000-0000-0000
MSR 0000060D: 0000-052C-573D-0337
MSR 00000610: 0042-8200-00DD-80E0
MSR 00000611: 0000-0000-312F-6EF0
MSR 00000613: 0000-0000-0000-0000
MSR 00000614: 0000-0000-0000-00E0
MSR 00000618: 0000-0000-0000-0000
MSR 00000619: 0000-0000-0000-0000
MSR 0000061B: 0000-0000-0000-0000
MSR 0000061C: < FAILED >
MSR 0000061E: < FAILED >
MSR 00000620: 0000-0000-0000-0424
MSR 00000621: 0000-0000-146B-000D
MSR 00000638: 0000-0000-0000-0000
MSR 00000639: 0000-0000-15E8-6F28
MSR 0000063A: 0000-0000-0000-0009
MSR 0000063B: < FAILED >
MSR 00000640: 0000-0000-0000-0000
MSR 00000641: 0000-0000-0081-6AFA
MSR 00000642: 0000-0000-0000-000D
MSR 00000648: 0000-0000-0000-0018
MSR 00000649: 0000-0000-0009-0060
MSR 0000064A: 0000-0000-000E-0078
MSR 0000064B: 0000-0000-0000-0000
MSR 0000064C: 0000-0000-0000-0017
MSR 00000690: 0000-0000-0000-0000
MSR 000006B0: 0000-0000-0102-0000
MSR 000006B1: 0000-0000-1100-0000
MSR 00000770: 0000-0000-0000-0000
MSR 00000771: < FAILED >
MSR 00000772: < FAILED >
MSR 00000773: 0000-0000-0000-0001
MSR 00000774: < FAILED >
MSR 00000777: < FAILED >
MSR 00000832: 0000-0000-0002-00D1
MSR 00000838: 0000-0000-0000-124F
MSR 00000839: 0000-0000-0000-0A0D
MSR 0000083E: 0000-0000-0000-000A

------[ MSR Registers / Logical CPU #7 ]------

MSR 00000017: 001C-0000-0000-0000 [PlatID = 7]
MSR 0000001B: 0000-0000-FEE0-0C00
MSR 00000035: 0000-0000-0004-0008
MSR 00000048: 0000-0000-0000-0001
MSR 00000049: < FAILED >
MSR 0000008B: 0000-0052-0000-0000
MSR 000000CE: 0004-043D-F881-1800 [eD = 0]
MSR 000000E7: 0000-0120-748A-1240
MSR 000000E8: 0000-0127-A98D-DA57
MSR 0000010A: 0000-0000-0000-006B
MSR 0000010B: < FAILED >
MSR 00000194: 0000-0000-0011-0000
MSR 00000198: 0000-1600-0000-1000
MSR 00000199: 0000-0000-0000-0400
MSR 0000019A: 0000-0000-0000-0000
MSR 0000019B: 0000-0000-0000-0010
MSR 0000019C: 0000-0000-8820-8282
MSR 0000019D: 0000-0000-0000-0000
MSR 000001A0: 0000-0000-0085-0089
MSR 000001A2: 0000-0000-8064-0000
MSR 000001A4: 0000-0000-0000-0000
MSR 000001AA: 0000-0000-0040-1CC0
MSR 000001AC: < FAILED >
MSR 000001AD: 2626-2626-2626-2A2A
MSR 000001AE: < FAILED >
MSR 000001AF: < FAILED >
MSR 000001B0: 0000-0000-0000-0006
MSR 000001B1: 0000-0000-881D-0282
MSR 000001B2: 0000-0000-0000-0000
MSR 000001FC: 0000-0000-0024-005B
MSR 00000300: < FAILED >
MSR 0000030A: 0000-0031-E9C3-E9F7
MSR 0000030B: 0000-002B-B853-28AC
MSR 00000480: 01DA-0500-0000-0013
MSR 00000481: 0000-00FF-0000-0016
MSR 00000482: FFFB-FFFE-0401-E172
MSR 00000483: 137F-FFFF-0003-6DFF
MSR 00000484: 0016-FFFF-0000-11FF
MSR 00000485: 0000-0000-7004-C1E7
MSR 00000486: 0000-0000-8000-0021
MSR 00000487: 0000-0000-FFFF-FFFF
MSR 00000488: 0000-0000-0000-2000
MSR 00000489: 0000-0000-00FF-2FFF
MSR 0000048A: 0000-0000-0000-002E
MSR 0000048B: 035F-3FFF-0000-0000
MSR 0000048C: 0000-0F01-06F3-4141
MSR 0000048D: 0000-00FF-0000-0016
MSR 0000048E: FFFB-FFFE-0400-6172
MSR 0000048F: 137F-FFFF-0003-6DFB
MSR 00000490: 0016-FFFF-0000-11FB
MSR 00000601: 0000-0000-0000-0288
MSR 00000602: < FAILED >
MSR 00000603: 0036-0000-0036-3636
MSR 00000604: < FAILED >
MSR 00000606: 0000-0000-000A-0E03
MSR 0000060A: 0000-0000-0000-0000
MSR 0000060B: 0000-0000-0000-0000
MSR 0000060C: 0000-0000-0000-0000
MSR 0000060D: 0000-052C-573D-0337
MSR 00000610: 0042-8200-00DD-80E0
MSR 00000611: 0000-0000-312F-6F4B
MSR 00000613: 0000-0000-0000-0000
MSR 00000614: 0000-0000-0000-00E0
MSR 00000618: 0000-0000-0000-0000
MSR 00000619: 0000-0000-0000-0000
MSR 0000061B: 0000-0000-0000-0000
MSR 0000061C: < FAILED >
MSR 0000061E: < FAILED >
MSR 00000620: 0000-0000-0000-0424
MSR 00000621: 0000-0000-1480-000E
MSR 00000638: 0000-0000-0000-0000
MSR 00000639: 0000-0000-15E8-6F5E
MSR 0000063A: 0000-0000-0000-0009
MSR 0000063B: < FAILED >
MSR 00000640: 0000-0000-0000-0000
MSR 00000641: 0000-0000-0081-6AFA
MSR 00000642: 0000-0000-0000-000D
MSR 00000648: 0000-0000-0000-0018
MSR 00000649: 0000-0000-0009-0060
MSR 0000064A: 0000-0000-000E-0078
MSR 0000064B: 0000-0000-0000-0000
MSR 0000064C: 0000-0000-0000-0017
MSR 00000690: 0000-0000-0000-0000
MSR 000006B0: 0000-0000-0102-0000
MSR 000006B1: 0000-0000-1100-0000
MSR 00000770: 0000-0000-0000-0000
MSR 00000771: < FAILED >
MSR 00000772: < FAILED >
MSR 00000773: 0000-0000-0000-0001
MSR 00000774: < FAILED >
MSR 00000777: < FAILED >
MSR 00000832: 0000-0000-0002-00D1
MSR 00000838: 0000-0000-0000-124F
MSR 00000839: 0000-0000-0000-1174
MSR 0000083E: 0000-0000-0000-000A

PerformanceFrequency = 10000000

CPU Clock M.Method = 9  (APIC SKL)
PM Timer Address   = 6152  (1808h)

APIC Clock = 100.00 MHz  (AT = 20119 / TT = 15004 / try = 1 / SKL = 38.40 MHz)
APIC Clock = 100.00 MHz  (AT = 20119 / TT = 15004 / try = 1 / SKL = 38.40 MHz)
APIC Clock = 100.00 MHz  (AT = 20119 / TT = 15004 / try = 1 / SKL = 38.40 MHz)
APIC Clock = 100.00 MHz  (AT = 20119 / TT = 15004 / try = 1 / SKL = 38.40 MHz)
APIC Clock = 100.00 MHz  (AT = 20119 / TT = 15004 / try = 1 / SKL = 38.40 MHz)

CPU Clock = 1599.95 MHz / TSC Clock = 2419.12 MHz / CPU Mul = 16.00x
CPU Clock = 1399.95 MHz / TSC Clock = 2419.12 MHz / CPU Mul = 14.00x
CPU Clock = 1299.96 MHz / TSC Clock = 2419.12 MHz / CPU Mul = 13.00x
CPU Clock = 1399.95 MHz / TSC Clock = 2419.12 MHz / CPU Mul = 14.00x
CPU Clock = 1299.96 MHz / TSC Clock = 2419.12 MHz / CPU Mul = 13.00x

CPU Clock Max = 4199.86 MHz / TSC Clock = 2419.12 MHz / CPU Mul = 42.00x
CPU Clock Max = 4199.86 MHz / TSC Clock = 2419.12 MHz / CPU Mul = 42.00x
CPU Clock Max = 4199.86 MHz / TSC Clock = 2419.12 MHz / CPU Mul = 42.00x
CPU Clock Max = 4199.86 MHz / TSC Clock = 2419.12 MHz / CPU Mul = 42.00x
CPU Clock Max = 4199.86 MHz / TSC Clock = 2419.12 MHz / CPU Mul = 42.00x

INTPERFCTR2 = 3544.52 MHz / INTPERFCTR1 (TSC) = 2419.22 MHz
INTPERFCTR2 = 3515.70 MHz / INTPERFCTR1 (TSC) = 2419.22 MHz
INTPERFCTR2 = 1073.08 MHz / INTPERFCTR1 (TSC) = 2419.20 MHz
INTPERFCTR2 = 1151.86 MHz / INTPERFCTR1 (TSC) = 2419.21 MHz
INTPERFCTR2 = 1237.94 MHz / INTPERFCTR1 (TSC) = 2419.23 MHz

------[ OC MailBox ]------

C 01 / P1 00 / P2 00: 00000000
C 01 / P1 01 / P2 00: 00000000
C 01 / P1 02 / P2 00: 00000000
C 01 / P1 03 / P2 00: 00000000
C 01 / P1 04 / P2 00: 00000000
C 02 / P1 00 / P2 00: 00000000
C 02 / P1 00 / P2 01: 00000000
C 02 / P1 00 / P2 02: 00000000
C 02 / P1 00 / P2 03: 00000000
C 02 / P1 01 / P2 00: 00000000
C 02 / P1 01 / P2 01: 00000000
C 02 / P1 01 / P2 02: 00000000
C 02 / P1 01 / P2 03: 00000000
C 02 / P1 02 / P2 00: 00000000
C 02 / P1 02 / P2 01: 00000000
C 02 / P1 02 / P2 02: 00000000
C 02 / P1 02 / P2 03: 00000000
C 02 / P1 03 / P2 00: 00000000
C 02 / P1 03 / P2 01: 00000000
C 02 / P1 03 / P2 02: 00000000
C 02 / P1 03 / P2 03: 00000000
C 02 / P1 04 / P2 00: 00000000
C 02 / P1 04 / P2 01: 00000000
C 02 / P1 04 / P2 02: 00000000
C 02 / P1 04 / P2 03: 00000000
C 02 / P1 05 / P2 00: 00000000
C 02 / P1 05 / P2 01: 00000000
C 02 / P1 05 / P2 02: 00000000
C 02 / P1 05 / P2 03: 00000000
C 02 / P1 06 / P2 00: 00000000
C 02 / P1 06 / P2 01: 00000000
C 02 / P1 06 / P2 02: 00000000
C 02 / P1 06 / P2 03: 00000000
C 02 / P1 07 / P2 00: 00000000
C 02 / P1 07 / P2 01: 00000000
C 02 / P1 07 / P2 02: 00000000
C 02 / P1 07 / P2 03: 00000000
C 03 / P1 00 / P2 00: 00000000
C 03 / P1 01 / P2 00: 00000000
C 03 / P1 02 / P2 00: 00000000
C 03 / P1 03 / P2 00: 00000000
C 04 / P1 00 / P2 00: 00000000
C 05 / P1 00 / P2 00: 00000000
C 10 / P1 00 / P2 00: 00000000
C 10 / P1 01 / P2 00: 00000000
C 10 / P1 02 / P2 00: 00000000
C 10 / P1 03 / P2 00: 00000000
C 10 / P1 04 / P2 00: 00000000
C 12 / P1 00 / P2 00: 00000000
C 12 / P1 01 / P2 00: 00000000
C 12 / P1 02 / P2 00: 00000000
C 14 / P1 00 / P2 00: 00000000
C 16 / P1 00 / P2 00: 00000000
C 18 / P1 00 / P2 00: 00000000
C 1A / P1 00 / P2 00: 00000000
C 1C / P1 00 / P2 00: 00000000  [CPU0]
C 1C / P1 00 / P2 00: 00000000  [CPU1]
C 1C / P1 00 / P2 00: 00000000  [CPU2]
C 1C / P1 00 / P2 00: 00000000  [CPU3]
C 1C / P1 00 / P2 00: 00000000  [CPU4]
C 1C / P1 00 / P2 00: 00000000  [CPU5]
C 1C / P1 00 / P2 00: 00000000  [CPU6]
C 1C / P1 00 / P2 00: 00000000  [CPU7]
