------[ Versions ]------

Program Version : EVEREST v5.00.1650
BenchDLL Version: 2.4.257.0

------[ CPU Info ]------

CPU Type           : 2x Intel Pentium IIIE, 733 MHz (5.5 x 133)
CPU Alias          : Coppermine
CPU Stepping       : cB0
Instruction Set    : x86, MMX, SSE
CPUID Manufacturer : GenuineIntel
CPUID Revision     : 00000683h
IA Brand ID        : 02h  (Intel Pentium III)
Platform ID        : 00h  (Unknown)

------[ Logical CPU #0 ]------

allcpu: Valid

CPUID 00000000: 00000003-756E6547-6C65746E-49656E69
CPUID 00000001: 00000683-00000002-00000000-0387FBFF
CPUID 00000002: 03020101-00000000-00000000-0C040882
CPUID 00000003: 00000000-00000000-6107FB5A-0000E4CA

------[ Logical CPU #1 ]------

allcpu: Valid

CPUID 00000000: 00000003-756E6547-6C65746E-49656E69
CPUID 00000001: 00000683-00000002-00000000-0387FBFF
CPUID 00000002: 03020101-00000000-00000000-0C040882
CPUID 00000003: 00000000-00000000-AAF054D8-0003E8AA

------[ MSR Registers ]------

MSR 00000017: 2140-0000-0000-0000 [PlatID = 0]
MSR 0000001B: 0000-0000-FEE0-0900
MSR 0000002A: 0000-0000-C514-0000
MSR 0000008B: 0000-0013-0000-0000
MSR 0000011E: 0000-0000-0074-27E1

PerformanceFrequency = 730800000

Tjmax Temperature = 0 Celsius
