------[ Versions ]------

Program Version : AIDA64 Extreme v6.60.5916 Beta
BenchDLL Version: 4.5.865.8-x64
Windows Version : Microsoft Windows 11 Pro 10.0.22000.376 (64-bit)
GetProductInfo  : 0x00000030

------[ CPU Info ]------

CPU Type          : QuadCore Intel Pentium Silver N6005, 3300 MHz (33 x 100)
CPU Alias         : Jasper Lake-D
CPU Platform      : FCBGA1338
CPU Stepping      : A0
Instruction Set   : x86, x86-64, MMX, SSE, SSE2, SSE3, SSSE3, SSE4.1, SSE4.2, AES, SHA
CPUID Manufacturer: GenuineIntel
CPUID CPU Name    : Intel(R) Pentium(R) Silver N6005 @ 2.00GHz
CPUID Revision    : 000906C0h
IA Brand ID       : 00h  (Unknown)
Platform ID       : 43h  (FCBGA1338)
HTT / CMP Units   : 0 / 4
Max. NUMA Node    : 0

Tjmax Temperature          : 105 Celsius
HTC Temperature Limit      : 0 Celsius
CPU TDP                    : 10 W
CPU TDC                    : 60 A
CPU Max Power Limit        : Unlimited Power / Unlimited Time
CPU Power Limit 1 (Long)   : 15 W / 48.00 sec  (Unlocked)
CPU Power Limit 2 (Short)  : 25 W / 2.44 ms  (Unlocked)
Max Turbo Boost Multipliers: 1C: 33x, 2C: 33x, 3C: 33x, 4C: 33x

------[ Motherboard Info ]------

Motherboard ID      : <DMI>
Motherboard Model   : Intel Atlas Canyon NUC11AT
Motherboard Chipset : Intel Jasper Point

DMI MB Manufacturer : Intel Corporation
DMI MB Product      : 
DMI MB Version      : 
DMI MB Serial       : 
DMI SYS Manufacturer: Intel(R) Client Systems
DMI SYS Product     : 
DMI SYS Version     : 
DMI SYS Serial      : 
DMI BIOS Version    : ATJSLCPX.0029.2021.1117.2104


------[ CPUID Registers / Logical CPU #0 ]------

allcpu: Package 0 / Core 0 / Thread 0: Valid

CPUID 00000000: 0000001B-756E6547-6C65746E-49656E69 [GenuineIntel]
CPUID 00000001: 000906C0-00800800-4FF8EBBF-BFEBFBFF
CPUID 00000002: 00FEFF01-00000000-00000000-00000000
CPUID 00000003: 00000000-00000000-00000000-00000000
CPUID 00000004: FC000121-01C0003F-0000003F-00000000 [SL 00] [L1D: 32 KB]
CPUID 00000004: FC000122-01C0003F-0000003F-00000000 [SL 01] [L1I: 32 KB]
CPUID 00000004: FC01C143-02C0003F-000007FF-00000000 [SL 02] [L2U: 1536 KB]
CPUID 00000004: FC1FC163-03C0003F-00000FFF-00000006 [SL 03] [L3U: 4 MB]
CPUID 00000005: 00000040-00000040-00000003-11122020
CPUID 00000006: 00178FF7-00000002-00000009-00000000
CPUID 00000007: 00000000-2394A2C3-18400124-FC000400 [SL 00]
CPUID 00000008: 00000000-00000000-00000000-00000000
CPUID 00000009: 00000000-00000000-00000000-00000000
CPUID 0000000A: 07300405-00000000-00000007-00008603
CPUID 0000000B: 00000001-00000001-00000100-00000000 [SL 00]
CPUID 0000000B: 00000007-00000004-00000201-00000000 [SL 01]
CPUID 0000000C: 00000000-00000000-00000000-00000000
CPUID 0000000D: 00000003-00000240-00000240-00000000 [SL 00] [x87]
CPUID 0000000D: 0000000F-000002C0-00000100-00000000 [SL 01] [SSE]
CPUID 0000000D: 00000080-00000000-00000001-00000000 [SL 08] [PT]
CPUID 0000000E: 00000000-00000000-00000000-00000000
CPUID 0000000F: 00000000-00000000-00000000-00000000 [SL 00]
CPUID 0000000F: 00000000-00000000-00000000-00000000 [SL 01]
CPUID 00000010: 00000000-00000004-00000000-00000000 [SL 00]
CPUID 00000010: 00000000-00000000-00000000-00000000 [SL 01]
CPUID 00000011: 00000000-00000000-00000000-00000000
CPUID 00000012: 00000000-00000000-00000000-00000000 [SL 00]
CPUID 00000012: 00000000-00000000-00000000-00000000 [SL 01]
CPUID 00000013: 00000000-00000000-00000000-00000000
CPUID 00000014: 00000001-0000007F-80000007-00000000 [SL 00]
CPUID 00000014: 02490002-003FFFFF-00000000-00000000 [SL 01]
CPUID 00000015: 00000002-00000068-0249F000-00000000 [52.00x / 38400000]
CPUID 00000016: 000007D0-00000CE4-00000064-00000000 [2000 / 3300 / 100]
CPUID 00000017: 00000000-00000000-00000000-00000000 [SL 00]
CPUID 00000018: 00000005-00000000-00000000-00000000 [SL 00]
CPUID 00000018: 00000000-00300001-00000001-00000121 [SL 01]
CPUID 00000018: 00000000-00040001-00000100-00000043 [SL 02]
CPUID 00000018: 00000000-00040006-00000010-00000043 [SL 03]
CPUID 00000018: 00000000-00300001-00000001-00000122 [SL 04]
CPUID 00000018: 00000000-00000000-00000000-00000000 [SL 05]
CPUID 00000019: 00000000-00000000-00000000-00000000
CPUID 0000001A: 20000000-00000000-00000000-00000000 [Atom]
CPUID 0000001B: 00000000-00000000-00000000-00000000
CPUID 80000000: 80000008-00000000-00000000-00000000
CPUID 80000001: 00000000-00000000-00000101-28100000
CPUID 80000002: 65746E49-2952286C-6E655020-6D756974 [Intel(R) Pentium]
CPUID 80000003: 20295228-766C6953-4E207265-35303036 [(R) Silver N6005]
CPUID 80000004: 32204020-4730302E-00007A48-00000000 [ @ 2.00GHz]
CPUID 80000005: 00000000-00000000-00000000-00000000 [L1D: 0 KB / L1I: 0 KB]
CPUID 80000006: 00000000-00000000-06006040-00000000 [L2: 1536 KB] / L3: 0 KB]
CPUID 80000007: 00000000-00000000-00000000-00000100
CPUID 80000008: 00003027-00000000-00000000-00000000

L1    Data Cache:    32 KB,  8-way Associative, 64-byte Line
L1  Instr. Cache:    32 KB,  8-way Associative, 64-byte Line
L2 Unified Cache:  1536 KB, 12-way Associative, 64-byte Line
L3 Unified Cache:     4 MB, 16-way Associative, 64-byte Line

------[ CPUID Registers / Logical CPU #1 ]------

allcpu: Package 0 / Core 1 / Thread 0: Valid

CPUID 00000000: 0000001B-756E6547-6C65746E-49656E69 [GenuineIntel]
CPUID 00000001: 000906C0-02800800-4FF8EBBF-BFEBFBFF
CPUID 00000002: 00FEFF01-00000000-00000000-00000000
CPUID 00000003: 00000000-00000000-00000000-00000000
CPUID 00000004: FC000121-01C0003F-0000003F-00000000 [SL 00] [L1D: 32 KB]
CPUID 00000004: FC000122-01C0003F-0000003F-00000000 [SL 01] [L1I: 32 KB]
CPUID 00000004: FC01C143-02C0003F-000007FF-00000000 [SL 02] [L2U: 1536 KB]
CPUID 00000004: FC1FC163-03C0003F-00000FFF-00000006 [SL 03] [L3U: 4 MB]
CPUID 00000005: 00000040-00000040-00000003-11122020
CPUID 00000006: 00178FF7-00000002-00000009-00000000
CPUID 00000007: 00000000-2394A2C3-18400124-FC000400 [SL 00]
CPUID 00000008: 00000000-00000000-00000000-00000000
CPUID 00000009: 00000000-00000000-00000000-00000000
CPUID 0000000A: 07300405-00000000-00000007-00008603
CPUID 0000000B: 00000001-00000001-00000100-00000002 [SL 00]
CPUID 0000000B: 00000007-00000004-00000201-00000002 [SL 01]
CPUID 0000000C: 00000000-00000000-00000000-00000000
CPUID 0000000D: 00000003-00000240-00000240-00000000 [SL 00] [x87]
CPUID 0000000D: 0000000F-000002C0-00000100-00000000 [SL 01] [SSE]
CPUID 0000000D: 00000080-00000000-00000001-00000000 [SL 08] [PT]
CPUID 0000000E: 00000000-00000000-00000000-00000000
CPUID 0000000F: 00000000-00000000-00000000-00000000 [SL 00]
CPUID 0000000F: 00000000-00000000-00000000-00000000 [SL 01]
CPUID 00000010: 00000000-00000004-00000000-00000000 [SL 00]
CPUID 00000010: 00000000-00000000-00000000-00000000 [SL 01]
CPUID 00000011: 00000000-00000000-00000000-00000000
CPUID 00000012: 00000000-00000000-00000000-00000000 [SL 00]
CPUID 00000012: 00000000-00000000-00000000-00000000 [SL 01]
CPUID 00000013: 00000000-00000000-00000000-00000000
CPUID 00000014: 00000001-0000007F-80000007-00000000 [SL 00]
CPUID 00000014: 02490002-003FFFFF-00000000-00000000 [SL 01]
CPUID 00000015: 00000002-00000068-0249F000-00000000 [52.00x / 38400000]
CPUID 00000016: 000007D0-00000CE4-00000064-00000000 [2000 / 3300 / 100]
CPUID 00000017: 00000000-00000000-00000000-00000000 [SL 00]
CPUID 00000018: 00000005-00000000-00000000-00000000 [SL 00]
CPUID 00000018: 00000000-00300001-00000001-00000121 [SL 01]
CPUID 00000018: 00000000-00040001-00000100-00000043 [SL 02]
CPUID 00000018: 00000000-00040006-00000010-00000043 [SL 03]
CPUID 00000018: 00000000-00300001-00000001-00000122 [SL 04]
CPUID 00000018: 00000000-00000000-00000000-00000000 [SL 05]
CPUID 00000019: 00000000-00000000-00000000-00000000
CPUID 0000001A: 20000000-00000000-00000000-00000000 [Atom]
CPUID 0000001B: 00000000-00000000-00000000-00000000
CPUID 80000000: 80000008-00000000-00000000-00000000
CPUID 80000001: 00000000-00000000-00000101-28100000
CPUID 80000002: 65746E49-2952286C-6E655020-6D756974 [Intel(R) Pentium]
CPUID 80000003: 20295228-766C6953-4E207265-35303036 [(R) Silver N6005]
CPUID 80000004: 32204020-4730302E-00007A48-00000000 [ @ 2.00GHz]
CPUID 80000005: 00000000-00000000-00000000-00000000 [L1D: 0 KB / L1I: 0 KB]
CPUID 80000006: 00000000-00000000-06006040-00000000 [L2: 1536 KB] / L3: 0 KB]
CPUID 80000007: 00000000-00000000-00000000-00000100
CPUID 80000008: 00003027-00000000-00000000-00000000

L1    Data Cache:    32 KB,  8-way Associative, 64-byte Line
L1  Instr. Cache:    32 KB,  8-way Associative, 64-byte Line
L2 Unified Cache:  1536 KB, 12-way Associative, 64-byte Line
L3 Unified Cache:     4 MB, 16-way Associative, 64-byte Line

------[ CPUID Registers / Logical CPU #2 ]------

allcpu: Package 0 / Core 2 / Thread 0: Valid

CPUID 00000000: 0000001B-756E6547-6C65746E-49656E69 [GenuineIntel]
CPUID 00000001: 000906C0-04800800-4FF8EBBF-BFEBFBFF
CPUID 00000002: 00FEFF01-00000000-00000000-00000000
CPUID 00000003: 00000000-00000000-00000000-00000000
CPUID 00000004: FC000121-01C0003F-0000003F-00000000 [SL 00] [L1D: 32 KB]
CPUID 00000004: FC000122-01C0003F-0000003F-00000000 [SL 01] [L1I: 32 KB]
CPUID 00000004: FC01C143-02C0003F-000007FF-00000000 [SL 02] [L2U: 1536 KB]
CPUID 00000004: FC1FC163-03C0003F-00000FFF-00000006 [SL 03] [L3U: 4 MB]
CPUID 00000005: 00000040-00000040-00000003-11122020
CPUID 00000006: 00178FF7-00000002-00000009-00000000
CPUID 00000007: 00000000-2394A2C3-18400124-FC000400 [SL 00]
CPUID 00000008: 00000000-00000000-00000000-00000000
CPUID 00000009: 00000000-00000000-00000000-00000000
CPUID 0000000A: 07300405-00000000-00000007-00008603
CPUID 0000000B: 00000001-00000001-00000100-00000004 [SL 00]
CPUID 0000000B: 00000007-00000004-00000201-00000004 [SL 01]
CPUID 0000000C: 00000000-00000000-00000000-00000000
CPUID 0000000D: 00000003-00000240-00000240-00000000 [SL 00] [x87]
CPUID 0000000D: 0000000F-000002C0-00000100-00000000 [SL 01] [SSE]
CPUID 0000000D: 00000080-00000000-00000001-00000000 [SL 08] [PT]
CPUID 0000000E: 00000000-00000000-00000000-00000000
CPUID 0000000F: 00000000-00000000-00000000-00000000 [SL 00]
CPUID 0000000F: 00000000-00000000-00000000-00000000 [SL 01]
CPUID 00000010: 00000000-00000004-00000000-00000000 [SL 00]
CPUID 00000010: 00000000-00000000-00000000-00000000 [SL 01]
CPUID 00000011: 00000000-00000000-00000000-00000000
CPUID 00000012: 00000000-00000000-00000000-00000000 [SL 00]
CPUID 00000012: 00000000-00000000-00000000-00000000 [SL 01]
CPUID 00000013: 00000000-00000000-00000000-00000000
CPUID 00000014: 00000001-0000007F-80000007-00000000 [SL 00]
CPUID 00000014: 02490002-003FFFFF-00000000-00000000 [SL 01]
CPUID 00000015: 00000002-00000068-0249F000-00000000 [52.00x / 38400000]
CPUID 00000016: 000007D0-00000CE4-00000064-00000000 [2000 / 3300 / 100]
CPUID 00000017: 00000000-00000000-00000000-00000000 [SL 00]
CPUID 00000018: 00000005-00000000-00000000-00000000 [SL 00]
CPUID 00000018: 00000000-00300001-00000001-00000121 [SL 01]
CPUID 00000018: 00000000-00040001-00000100-00000043 [SL 02]
CPUID 00000018: 00000000-00040006-00000010-00000043 [SL 03]
CPUID 00000018: 00000000-00300001-00000001-00000122 [SL 04]
CPUID 00000018: 00000000-00000000-00000000-00000000 [SL 05]
CPUID 00000019: 00000000-00000000-00000000-00000000
CPUID 0000001A: 20000000-00000000-00000000-00000000 [Atom]
CPUID 0000001B: 00000000-00000000-00000000-00000000
CPUID 80000000: 80000008-00000000-00000000-00000000
CPUID 80000001: 00000000-00000000-00000101-28100000
CPUID 80000002: 65746E49-2952286C-6E655020-6D756974 [Intel(R) Pentium]
CPUID 80000003: 20295228-766C6953-4E207265-35303036 [(R) Silver N6005]
CPUID 80000004: 32204020-4730302E-00007A48-00000000 [ @ 2.00GHz]
CPUID 80000005: 00000000-00000000-00000000-00000000 [L1D: 0 KB / L1I: 0 KB]
CPUID 80000006: 00000000-00000000-06006040-00000000 [L2: 1536 KB] / L3: 0 KB]
CPUID 80000007: 00000000-00000000-00000000-00000100
CPUID 80000008: 00003027-00000000-00000000-00000000

L1    Data Cache:    32 KB,  8-way Associative, 64-byte Line
L1  Instr. Cache:    32 KB,  8-way Associative, 64-byte Line
L2 Unified Cache:  1536 KB, 12-way Associative, 64-byte Line
L3 Unified Cache:     4 MB, 16-way Associative, 64-byte Line

------[ CPUID Registers / Logical CPU #3 ]------

allcpu: Package 0 / Core 3 / Thread 0: Valid

CPUID 00000000: 0000001B-756E6547-6C65746E-49656E69 [GenuineIntel]
CPUID 00000001: 000906C0-06800800-4FF8EBBF-BFEBFBFF
CPUID 00000002: 00FEFF01-00000000-00000000-00000000
CPUID 00000003: 00000000-00000000-00000000-00000000
CPUID 00000004: FC000121-01C0003F-0000003F-00000000 [SL 00] [L1D: 32 KB]
CPUID 00000004: FC000122-01C0003F-0000003F-00000000 [SL 01] [L1I: 32 KB]
CPUID 00000004: FC01C143-02C0003F-000007FF-00000000 [SL 02] [L2U: 1536 KB]
CPUID 00000004: FC1FC163-03C0003F-00000FFF-00000006 [SL 03] [L3U: 4 MB]
CPUID 00000005: 00000040-00000040-00000003-11122020
CPUID 00000006: 00178FF7-00000002-00000009-00000000
CPUID 00000007: 00000000-2394A2C3-18400124-FC000400 [SL 00]
CPUID 00000008: 00000000-00000000-00000000-00000000
CPUID 00000009: 00000000-00000000-00000000-00000000
CPUID 0000000A: 07300405-00000000-00000007-00008603
CPUID 0000000B: 00000001-00000001-00000100-00000006 [SL 00]
CPUID 0000000B: 00000007-00000004-00000201-00000006 [SL 01]
CPUID 0000000C: 00000000-00000000-00000000-00000000
CPUID 0000000D: 00000003-00000240-00000240-00000000 [SL 00] [x87]
CPUID 0000000D: 0000000F-000002C0-00000100-00000000 [SL 01] [SSE]
CPUID 0000000D: 00000080-00000000-00000001-00000000 [SL 08] [PT]
CPUID 0000000E: 00000000-00000000-00000000-00000000
CPUID 0000000F: 00000000-00000000-00000000-00000000 [SL 00]
CPUID 0000000F: 00000000-00000000-00000000-00000000 [SL 01]
CPUID 00000010: 00000000-00000004-00000000-00000000 [SL 00]
CPUID 00000010: 00000000-00000000-00000000-00000000 [SL 01]
CPUID 00000011: 00000000-00000000-00000000-00000000
CPUID 00000012: 00000000-00000000-00000000-00000000 [SL 00]
CPUID 00000012: 00000000-00000000-00000000-00000000 [SL 01]
CPUID 00000013: 00000000-00000000-00000000-00000000
CPUID 00000014: 00000001-0000007F-80000007-00000000 [SL 00]
CPUID 00000014: 02490002-003FFFFF-00000000-00000000 [SL 01]
CPUID 00000015: 00000002-00000068-0249F000-00000000 [52.00x / 38400000]
CPUID 00000016: 000007D0-00000CE4-00000064-00000000 [2000 / 3300 / 100]
CPUID 00000017: 00000000-00000000-00000000-00000000 [SL 00]
CPUID 00000018: 00000005-00000000-00000000-00000000 [SL 00]
CPUID 00000018: 00000000-00300001-00000001-00000121 [SL 01]
CPUID 00000018: 00000000-00040001-00000100-00000043 [SL 02]
CPUID 00000018: 00000000-00040006-00000010-00000043 [SL 03]
CPUID 00000018: 00000000-00300001-00000001-00000122 [SL 04]
CPUID 00000018: 00000000-00000000-00000000-00000000 [SL 05]
CPUID 00000019: 00000000-00000000-00000000-00000000
CPUID 0000001A: 20000000-00000000-00000000-00000000 [Atom]
CPUID 0000001B: 00000000-00000000-00000000-00000000
CPUID 80000000: 80000008-00000000-00000000-00000000
CPUID 80000001: 00000000-00000000-00000101-28100000
CPUID 80000002: 65746E49-2952286C-6E655020-6D756974 [Intel(R) Pentium]
CPUID 80000003: 20295228-766C6953-4E207265-35303036 [(R) Silver N6005]
CPUID 80000004: 32204020-4730302E-00007A48-00000000 [ @ 2.00GHz]
CPUID 80000005: 00000000-00000000-00000000-00000000 [L1D: 0 KB / L1I: 0 KB]
CPUID 80000006: 00000000-00000000-06006040-00000000 [L2: 1536 KB] / L3: 0 KB]
CPUID 80000007: 00000000-00000000-00000000-00000100
CPUID 80000008: 00003027-00000000-00000000-00000000

L1    Data Cache:    32 KB,  8-way Associative, 64-byte Line
L1  Instr. Cache:    32 KB,  8-way Associative, 64-byte Line
L2 Unified Cache:  1536 KB, 12-way Associative, 64-byte Line
L3 Unified Cache:     4 MB, 16-way Associative, 64-byte Line

------[ All CPUs ]------

CPU   0: APICID    0 / Package 0 / Core   0 / Thread 0: Valid
CPU   1: APICID    2 / Package 0 / Core   1 / Thread 0: Valid
CPU   2: APICID    4 / Package 0 / Core   2 / Thread 0: Valid
CPU   3: APICID    6 / Package 0 / Core   3 / Thread 0: Valid

------[ MSR Registers / Logical CPU #0 ]------

MSR 00000017: 0000-0000-0000-0000 [PlatID = 0]
MSR 0000001B: 0000-0000-FEE0-0D00
MSR 0000002A: 0000-0000-0000-0000
MSR 00000035: 0000-0000-0004-0004
MSR 00000048: 0000-0000-0000-0001
MSR 00000049: < FAILED >
MSR 0000008B: 2400-001F-0000-0000
MSR 000000CD: < FAILED >
MSR 000000CE: 0004-0830-F081-1400 [eD = 0]
MSR 000000E7: 0000-01C0-7274-84A0 [S200]
MSR 000000E7: 0000-01C0-728E-3954 [S200]
MSR 000000E7: 0000-01C0-72A2-CF7C
MSR 000000E8: 0000-02DC-8176-8A79 [S200]
MSR 000000E8: 0000-02DC-81D2-204D [S200]
MSR 000000E8: 0000-02DC-8215-D569
MSR 000000EE: < FAILED >
MSR 0000010A: 0000-0000-0000-0C6B
MSR 0000010B: < FAILED >
MSR 0000011E: < FAILED >
MSR 00000194: 0000-0000-0001-0000
MSR 00000198: 0000-1AE1-0000-1400 [S200]
MSR 00000198: 0000-1AE1-0000-1400 [S200]
MSR 00000198: 0000-1AE1-0000-1400
MSR 00000199: 0000-0000-0000-2100
MSR 0000019A: 0000-0000-0000-0000
MSR 0000019B: 0000-0000-0000-0010
MSR 0000019C: 0000-0000-8843-0800 [S200]
MSR 0000019C: 0000-0000-8843-0800 [S200]
MSR 0000019C: 0000-0000-8843-0800
MSR 0000019D: 0000-0000-0000-0000
MSR 000001A0: 0000-0000-0085-0089
MSR 000001A2: 0000-0000-8069-0000
MSR 000001A4: 0000-0000-0000-0000
MSR 000001AA: 0000-0000-0040-10C0
MSR 000001AC: < FAILED >
MSR 000001AD: 2121-2121-2121-2121
MSR 000001B0: 0000-0000-0000-0006
MSR 000001B1: 0000-0000-883A-0800
MSR 000001B2: 0000-0000-0000-0000
MSR 000001FC: 0000-0000-0824-005F
MSR 00000300: < FAILED >
MSR 0000030A: 0000-0000-02F5-FD7C [S200]
MSR 0000030A: 0000-0000-02F5-FD7C [S200]
MSR 0000030A: 0000-0000-02F5-FD7C
MSR 0000030B: 0000-0000-01CB-A4E4 [S200]
MSR 0000030B: 0000-0000-01CB-A4E4 [S200]
MSR 0000030B: 0000-0000-01CB-A4E4
MSR 00000480: 00DA-0500-0000-0013
MSR 00000481: 0000-00FF-0000-0016
MSR 00000482: FFF9-FFFE-0401-E172
MSR 00000483: 037F-FFFF-0003-6DFF
MSR 00000484: 0006-FFFF-0000-11FF
MSR 00000485: 0000-0000-7004-C1E7
MSR 00000486: 0000-0000-8000-0021
MSR 00000487: 0000-0000-FFFF-FFFF
MSR 00000488: 0000-0000-0000-2000
MSR 00000489: 0000-0000-0035-2FFF
MSR 0000048A: 0000-0000-0000-002E
MSR 0000048B: 07DD-6FFF-0000-0000
MSR 0000048C: 0000-0F01-0671-4141
MSR 0000048D: 0000-00FF-0000-0016
MSR 0000048E: FFF9-FFFE-0400-6172
MSR 0000048F: 037F-FFFF-0003-6DFB
MSR 00000490: 0006-FFFF-0000-11FB
MSR 00000601: 0000-0000-0000-01E0
MSR 00000602: < FAILED >
MSR 00000603: 0036-0000-0036-3636
MSR 00000604: < FAILED >
MSR 00000606: 0000-0000-000A-0E03
MSR 0000060A: 0000-0000-0000-0000
MSR 0000060B: 0000-0000-0000-0000
MSR 0000060C: 0000-0000-0000-0000
MSR 0000060D: 0000-0019-78A7-35DC
MSR 00000610: 0042-80C8-009F-8078
MSR 00000611: 0000-0000-1687-8A93 [S200]
MSR 00000611: 0000-0000-1687-B8E1 [S200]
MSR 00000611: 0000-0000-1687-E60B
MSR 00000613: 0000-0000-0000-0000
MSR 00000614: 0000-0000-0000-0050
MSR 00000618: 0054-00DE-0000-0000
MSR 00000619: 0000-0000-0000-0000 [S200]
MSR 00000619: 0000-0000-0000-0000 [S200]
MSR 00000619: 0000-0000-0000-0000
MSR 0000061B: 0000-0000-0000-0000
MSR 0000061C: < FAILED >
MSR 00000638: 0000-0000-0000-0000
MSR 00000639: 0000-0000-0AFF-3285 [S200]
MSR 00000639: 0000-0000-0AFF-3413 [S200]
MSR 00000639: 0000-0000-0AFF-378D
MSR 0000063A: 0000-0000-0000-0009
MSR 0000063B: < FAILED >
MSR 00000640: 0000-0000-0000-0000
MSR 00000641: 0000-0000-002A-2261 [S200]
MSR 00000641: 0000-0000-002A-2261 [S200]
MSR 00000641: 0000-0000-002A-2261
MSR 00000642: 0000-0000-0000-000D
MSR 00000660: 0000-0050-3FDD-174C
MSR 00000661: < FAILED >
MSR 00000662: < FAILED >
MSR 00000663: < FAILED >
MSR 00000664: 0000-0285-3CC4-E744
MSR 00000665: < FAILED >
MSR 00000666: < FAILED >
MSR 00000667: < FAILED >
MSR 00000668: < FAILED >
MSR 00000669: < FAILED >
MSR 0000066A: < FAILED >
MSR 0000066B: < FAILED >
MSR 0000066C: < FAILED >
MSR 0000066D: < FAILED >
MSR 0000066E: < FAILED >
MSR 0000066F: < FAILED >
MSR 00000670: < FAILED >
MSR 00000671: < FAILED >
MSR 00000672: < FAILED >
MSR 00000673: < FAILED >
MSR 00000674: < FAILED >
MSR 00000675: < FAILED >
MSR 00000676: < FAILED >
MSR 00000677: < FAILED >
MSR 00000770: 0000-0000-0000-0001
MSR 00000771: 0000-0000-0108-1421
MSR 00000772: 0000-019E-5400-2114
MSR 00000773: 0000-0000-0000-0005
MSR 00000774: 0000-059E-5400-2114
MSR 00000777: 0000-0000-0000-0004
MSR 00000832: 0000-0000-0003-00D1
MSR 00000838: 0000-0000-0000-0000
MSR 00000839: 0000-0000-0000-0000
MSR 0000083E: 0000-0000-0000-000A

------[ MSR Registers / Logical CPU #1 ]------

MSR 00000017: 0000-0000-0000-0000 [PlatID = 0]
MSR 0000001B: 0000-0000-FEE0-0C00
MSR 0000002A: 0000-0000-0000-0000
MSR 00000035: 0000-0000-0004-0004
MSR 00000048: 0000-0000-0000-0001
MSR 00000049: < FAILED >
MSR 0000008B: 2400-001F-0000-0000
MSR 000000CD: < FAILED >
MSR 000000CE: 0004-0830-F081-1400 [eD = 0]
MSR 000000E7: 0000-019C-E151-29C4
MSR 000000E8: 0000-02A4-CD2D-6258
MSR 000000EE: < FAILED >
MSR 0000010A: 0000-0000-0000-0C6B
MSR 0000010B: < FAILED >
MSR 0000011E: < FAILED >
MSR 00000194: 0000-0000-0001-0000
MSR 00000198: 0000-288F-0000-2100
MSR 00000199: 0000-0000-0000-2100
MSR 0000019A: 0000-0000-0000-0000
MSR 0000019B: 0000-0000-0000-0010
MSR 0000019C: 0000-0000-8842-0800
MSR 0000019D: 0000-0000-0000-0000
MSR 000001A0: 0000-0000-0085-0089
MSR 000001A2: 0000-0000-8069-0000
MSR 000001A4: 0000-0000-0000-0000
MSR 000001AA: 0000-0000-0040-10C0
MSR 000001AC: < FAILED >
MSR 000001AD: 2121-2121-2121-2121
MSR 000001B0: 0000-0000-0000-0006
MSR 000001B1: 0000-0000-883A-0800
MSR 000001B2: 0000-0000-0000-0000
MSR 000001FC: 0000-0000-0824-005F
MSR 00000300: < FAILED >
MSR 0000030A: 0000-0000-0000-0000
MSR 0000030B: 0000-0000-0000-0000
MSR 00000480: 00DA-0500-0000-0013
MSR 00000481: 0000-00FF-0000-0016
MSR 00000482: FFF9-FFFE-0401-E172
MSR 00000483: 037F-FFFF-0003-6DFF
MSR 00000484: 0006-FFFF-0000-11FF
MSR 00000485: 0000-0000-7004-C1E7
MSR 00000486: 0000-0000-8000-0021
MSR 00000487: 0000-0000-FFFF-FFFF
MSR 00000488: 0000-0000-0000-2000
MSR 00000489: 0000-0000-0035-2FFF
MSR 0000048A: 0000-0000-0000-002E
MSR 0000048B: 07DD-6FFF-0000-0000
MSR 0000048C: 0000-0F01-0671-4141
MSR 0000048D: 0000-00FF-0000-0016
MSR 0000048E: FFF9-FFFE-0400-6172
MSR 0000048F: 037F-FFFF-0003-6DFB
MSR 00000490: 0006-FFFF-0000-11FB
MSR 00000601: 0000-0000-0000-01E0
MSR 00000602: < FAILED >
MSR 00000603: 0036-0000-0036-3636
MSR 00000604: < FAILED >
MSR 00000606: 0000-0000-000A-0E03
MSR 0000060A: 0000-0000-0000-0000
MSR 0000060B: 0000-0000-0000-0000
MSR 0000060C: 0000-0000-0000-0000
MSR 0000060D: 0000-0019-80B1-21C0
MSR 00000610: 0042-80C8-009F-8078
MSR 00000611: 0000-0000-1688-FF5E
MSR 00000613: 0000-0000-0000-0000
MSR 00000614: 0000-0000-0000-0050
MSR 00000618: 0054-00DE-0000-0000
MSR 00000619: 0000-0000-0000-0000
MSR 0000061B: 0000-0000-0000-0000
MSR 0000061C: < FAILED >
MSR 00000638: 0000-0000-0000-0000
MSR 00000639: 0000-0000-0AFF-3CC3
MSR 0000063A: 0000-0000-0000-0009
MSR 0000063B: < FAILED >
MSR 00000640: 0000-0000-0000-0000
MSR 00000641: 0000-0000-002A-2261
MSR 00000642: 0000-0000-0000-000D
MSR 00000660: 0000-0055-1E0C-99EC
MSR 00000661: < FAILED >
MSR 00000662: < FAILED >
MSR 00000663: < FAILED >
MSR 00000664: 0000-0285-3CC4-E744
MSR 00000665: < FAILED >
MSR 00000666: < FAILED >
MSR 00000667: < FAILED >
MSR 00000668: < FAILED >
MSR 00000669: < FAILED >
MSR 0000066A: < FAILED >
MSR 0000066B: < FAILED >
MSR 0000066C: < FAILED >
MSR 0000066D: < FAILED >
MSR 0000066E: < FAILED >
MSR 0000066F: < FAILED >
MSR 00000670: < FAILED >
MSR 00000671: < FAILED >
MSR 00000672: < FAILED >
MSR 00000673: < FAILED >
MSR 00000674: < FAILED >
MSR 00000675: < FAILED >
MSR 00000676: < FAILED >
MSR 00000677: < FAILED >
MSR 00000770: 0000-0000-0000-0001
MSR 00000771: 0000-0000-0108-1421
MSR 00000772: 0000-019E-5400-2114
MSR 00000773: 0000-0000-0000-0005
MSR 00000774: 0000-0400-0021-2114
MSR 00000777: 0000-0000-0000-0004
MSR 00000832: 0000-0000-0002-00D1
MSR 00000838: 0000-0000-0000-124F
MSR 00000839: 0000-0000-0000-03B1
MSR 0000083E: 0000-0000-0000-000A

------[ MSR Registers / Logical CPU #2 ]------

MSR 00000017: 0000-0000-0000-0000 [PlatID = 0]
MSR 0000001B: 0000-0000-FEE0-0C00
MSR 0000002A: 0000-0000-0000-0000
MSR 00000035: 0000-0000-0004-0004
MSR 00000048: 0000-0000-0000-0001
MSR 00000049: < FAILED >
MSR 0000008B: 2400-001F-0000-0000
MSR 000000CD: < FAILED >
MSR 000000CE: 0004-0830-F081-1400 [eD = 0]
MSR 000000E7: 0000-01B1-81E4-BC34
MSR 000000E8: 0000-02C7-648B-47A0
MSR 000000EE: < FAILED >
MSR 0000010A: 0000-0000-0000-0C6B
MSR 0000010B: < FAILED >
MSR 0000011E: < FAILED >
MSR 00000194: 0000-0000-0001-0000
MSR 00000198: 0000-288F-0000-2100
MSR 00000199: 0000-0000-0000-2100
MSR 0000019A: 0000-0000-0000-0000
MSR 0000019B: 0000-0000-0000-0010
MSR 0000019C: 0000-0000-8842-0800
MSR 0000019D: 0000-0000-0000-0000
MSR 000001A0: 0000-0000-0085-0089
MSR 000001A2: 0000-0000-8069-0000
MSR 000001A4: 0000-0000-0000-0000
MSR 000001AA: 0000-0000-0040-10C0
MSR 000001AC: < FAILED >
MSR 000001AD: 2121-2121-2121-2121
MSR 000001B0: 0000-0000-0000-0006
MSR 000001B1: 0000-0000-883A-0800
MSR 000001B2: 0000-0000-0000-0000
MSR 000001FC: 0000-0000-0824-005F
MSR 00000300: < FAILED >
MSR 0000030A: 0000-0000-0000-0000
MSR 0000030B: 0000-0000-0000-0000
MSR 00000480: 00DA-0500-0000-0013
MSR 00000481: 0000-00FF-0000-0016
MSR 00000482: FFF9-FFFE-0401-E172
MSR 00000483: 037F-FFFF-0003-6DFF
MSR 00000484: 0006-FFFF-0000-11FF
MSR 00000485: 0000-0000-7004-C1E7
MSR 00000486: 0000-0000-8000-0021
MSR 00000487: 0000-0000-FFFF-FFFF
MSR 00000488: 0000-0000-0000-2000
MSR 00000489: 0000-0000-0035-2FFF
MSR 0000048A: 0000-0000-0000-002E
MSR 0000048B: 07DD-6FFF-0000-0000
MSR 0000048C: 0000-0F01-0671-4141
MSR 0000048D: 0000-00FF-0000-0016
MSR 0000048E: FFF9-FFFE-0400-6172
MSR 0000048F: 037F-FFFF-0003-6DFB
MSR 00000490: 0006-FFFF-0000-11FB
MSR 00000601: 0000-0000-0000-01E0
MSR 00000602: < FAILED >
MSR 00000603: 0036-0000-0036-3636
MSR 00000604: < FAILED >
MSR 00000606: 0000-0000-000A-0E03
MSR 0000060A: 0000-0000-0000-0000
MSR 0000060B: 0000-0000-0000-0000
MSR 0000060C: 0000-0000-0000-0000
MSR 0000060D: 0000-0019-80B1-21C0
MSR 00000610: 0042-80C8-009F-8078
MSR 00000611: 0000-0000-1688-FFCA
MSR 00000613: 0000-0000-0000-0000
MSR 00000614: 0000-0000-0000-0050
MSR 00000618: 0054-00DE-0000-0000
MSR 00000619: 0000-0000-0000-0000
MSR 0000061B: 0000-0000-0000-0000
MSR 0000061C: < FAILED >
MSR 00000638: 0000-0000-0000-0000
MSR 00000639: 0000-0000-0AFF-3CC3
MSR 0000063A: 0000-0000-0000-0009
MSR 0000063B: < FAILED >
MSR 00000640: 0000-0000-0000-0000
MSR 00000641: 0000-0000-002A-2261
MSR 00000642: 0000-0000-0000-000D
MSR 00000660: 0000-004C-DBD9-D394
MSR 00000661: < FAILED >
MSR 00000662: < FAILED >
MSR 00000663: < FAILED >
MSR 00000664: 0000-0285-3CC4-E744
MSR 00000665: < FAILED >
MSR 00000666: < FAILED >
MSR 00000667: < FAILED >
MSR 00000668: < FAILED >
MSR 00000669: < FAILED >
MSR 0000066A: < FAILED >
MSR 0000066B: < FAILED >
MSR 0000066C: < FAILED >
MSR 0000066D: < FAILED >
MSR 0000066E: < FAILED >
MSR 0000066F: < FAILED >
MSR 00000670: < FAILED >
MSR 00000671: < FAILED >
MSR 00000672: < FAILED >
MSR 00000673: < FAILED >
MSR 00000674: < FAILED >
MSR 00000675: < FAILED >
MSR 00000676: < FAILED >
MSR 00000677: < FAILED >
MSR 00000770: 0000-0000-0000-0001
MSR 00000771: 0000-0000-0108-1421
MSR 00000772: 0000-019E-5400-2114
MSR 00000773: 0000-0000-0000-0005
MSR 00000774: 0000-0400-0021-2114
MSR 00000777: 0000-0000-0000-0004
MSR 00000832: 0000-0000-0003-00D1
MSR 00000838: 0000-0000-0000-0000
MSR 00000839: 0000-0000-0000-0000
MSR 0000083E: 0000-0000-0000-000A

------[ MSR Registers / Logical CPU #3 ]------

MSR 00000017: 0000-0000-0000-0000 [PlatID = 0]
MSR 0000001B: 0000-0000-FEE0-0C00
MSR 0000002A: 0000-0000-0000-0000
MSR 00000035: 0000-0000-0004-0004
MSR 00000048: 0000-0000-0000-0001
MSR 00000049: < FAILED >
MSR 0000008B: 2400-001F-0000-0000
MSR 000000CD: < FAILED >
MSR 000000CE: 0004-0830-F081-1400 [eD = 0]
MSR 000000E7: 0000-016A-350C-62A0
MSR 000000E8: 0000-024C-C59F-83D4
MSR 000000EE: < FAILED >
MSR 0000010A: 0000-0000-0000-0C6B
MSR 0000010B: < FAILED >
MSR 0000011E: < FAILED >
MSR 00000194: 0000-0000-0001-0000
MSR 00000198: 0000-288F-0000-2100
MSR 00000199: 0000-0000-0000-2100
MSR 0000019A: 0000-0000-0000-0000
MSR 0000019B: 0000-0000-0000-0010
MSR 0000019C: 0000-0000-8841-0800
MSR 0000019D: 0000-0000-0000-0000
MSR 000001A0: 0000-0000-0085-0089
MSR 000001A2: 0000-0000-8069-0000
MSR 000001A4: 0000-0000-0000-0000
MSR 000001AA: 0000-0000-0040-10C0
MSR 000001AC: < FAILED >
MSR 000001AD: 2121-2121-2121-2121
MSR 000001B0: 0000-0000-0000-0006
MSR 000001B1: 0000-0000-883B-0800
MSR 000001B2: 0000-0000-0000-0000
MSR 000001FC: 0000-0000-0824-005F
MSR 00000300: < FAILED >
MSR 0000030A: 0000-0000-0000-0000
MSR 0000030B: 0000-0000-0000-0000
MSR 00000480: 00DA-0500-0000-0013
MSR 00000481: 0000-00FF-0000-0016
MSR 00000482: FFF9-FFFE-0401-E172
MSR 00000483: 037F-FFFF-0003-6DFF
MSR 00000484: 0006-FFFF-0000-11FF
MSR 00000485: 0000-0000-7004-C1E7
MSR 00000486: 0000-0000-8000-0021
MSR 00000487: 0000-0000-FFFF-FFFF
MSR 00000488: 0000-0000-0000-2000
MSR 00000489: 0000-0000-0035-2FFF
MSR 0000048A: 0000-0000-0000-002E
MSR 0000048B: 07DD-6FFF-0000-0000
MSR 0000048C: 0000-0F01-0671-4141
MSR 0000048D: 0000-00FF-0000-0016
MSR 0000048E: FFF9-FFFE-0400-6172
MSR 0000048F: 037F-FFFF-0003-6DFB
MSR 00000490: 0006-FFFF-0000-11FB
MSR 00000601: 0000-0000-0000-01E0
MSR 00000602: < FAILED >
MSR 00000603: 0036-0000-0036-3636
MSR 00000604: < FAILED >
MSR 00000606: 0000-0000-000A-0E03
MSR 0000060A: 0000-0000-0000-0000
MSR 0000060B: 0000-0000-0000-0000
MSR 0000060C: 0000-0000-0000-0000
MSR 0000060D: 0000-0019-80B1-21C0
MSR 00000610: 0042-80C8-009F-8078
MSR 00000611: 0000-0000-1689-003A
MSR 00000613: 0000-0000-0000-0000
MSR 00000614: 0000-0000-0000-0050
MSR 00000618: 0054-00DE-0000-0000
MSR 00000619: 0000-0000-0000-0000
MSR 0000061B: 0000-0000-0000-0000
MSR 0000061C: < FAILED >
MSR 00000638: 0000-0000-0000-0000
MSR 00000639: 0000-0000-0AFF-3CFF
MSR 0000063A: 0000-0000-0000-0009
MSR 0000063B: < FAILED >
MSR 00000640: 0000-0000-0000-0000
MSR 00000641: 0000-0000-002A-2261
MSR 00000642: 0000-0000-0000-000D
MSR 00000660: 0000-0053-2D8E-F9DC
MSR 00000661: < FAILED >
MSR 00000662: < FAILED >
MSR 00000663: < FAILED >
MSR 00000664: 0000-0285-3CC4-E744
MSR 00000665: < FAILED >
MSR 00000666: < FAILED >
MSR 00000667: < FAILED >
MSR 00000668: < FAILED >
MSR 00000669: < FAILED >
MSR 0000066A: < FAILED >
MSR 0000066B: < FAILED >
MSR 0000066C: < FAILED >
MSR 0000066D: < FAILED >
MSR 0000066E: < FAILED >
MSR 0000066F: < FAILED >
MSR 00000670: < FAILED >
MSR 00000671: < FAILED >
MSR 00000672: < FAILED >
MSR 00000673: < FAILED >
MSR 00000674: < FAILED >
MSR 00000675: < FAILED >
MSR 00000676: < FAILED >
MSR 00000677: < FAILED >
MSR 00000770: 0000-0000-0000-0001
MSR 00000771: 0000-0000-0108-1421
MSR 00000772: 0000-019E-5400-2114
MSR 00000773: 0000-0000-0000-0005
MSR 00000774: 0000-0400-0021-2114
MSR 00000777: 0000-0000-0000-0004
MSR 00000832: 0000-0000-0003-00D1
MSR 00000838: 0000-0000-0000-0000
MSR 00000839: 0000-0000-0000-0000
MSR 0000083E: 0000-0000-0000-000A

PerformanceFrequency = 10000000

CPU Clock M.Method = 8  (APIC SNB)
PM Timer Address   = 6152  (1808h)

APIC Clock = 100.00 MHz  (AT = 20114 / TT = 15000 / try = 1 / SKL = 38.40 MHz)
APIC Clock = 100.00 MHz  (AT = 20114 / TT = 15000 / try = 1 / SKL = 38.40 MHz)
APIC Clock = 100.00 MHz  (AT = 20114 / TT = 15000 / try = 1 / SKL = 38.40 MHz)
APIC Clock = 100.00 MHz  (AT = 20114 / TT = 15000 / try = 1 / SKL = 38.40 MHz)
APIC Clock = 100.00 MHz  (AT = 20114 / TT = 15000 / try = 1 / SKL = 38.40 MHz)

CPU Clock = 1999.97 MHz / TSC Clock = 1999.97 MHz / CPU Mul = 20.00x
CPU Clock = 1999.97 MHz / TSC Clock = 1999.97 MHz / CPU Mul = 20.00x
CPU Clock = 1999.97 MHz / TSC Clock = 1999.97 MHz / CPU Mul = 20.00x
CPU Clock = 1999.97 MHz / TSC Clock = 1999.97 MHz / CPU Mul = 20.00x
CPU Clock = 1999.97 MHz / TSC Clock = 1999.97 MHz / CPU Mul = 20.00x

CPU Clock Max = 3299.95 MHz / TSC Clock = 1999.97 MHz / CPU Mul = 33.00x
CPU Clock Max = 2399.97 MHz / TSC Clock = 1999.97 MHz / CPU Mul = 24.00x
CPU Clock Max = 1999.97 MHz / TSC Clock = 1999.97 MHz / CPU Mul = 20.00x
CPU Clock Max = 1999.97 MHz / TSC Clock = 1999.97 MHz / CPU Mul = 20.00x
CPU Clock Max = 1999.97 MHz / TSC Clock = 1999.97 MHz / CPU Mul = 20.00x

INTPERFCTR2 = 3292.84 MHz / INTPERFCTR1 (TSC) = 1996.78 MHz
INTPERFCTR2 = 3292.87 MHz / INTPERFCTR1 (TSC) = 1996.80 MHz
INTPERFCTR2 = 2581.98 MHz / INTPERFCTR1 (TSC) = 1989.30 MHz
INTPERFCTR2 = 2506.68 MHz / INTPERFCTR1 (TSC) = 1989.00 MHz
INTPERFCTR2 = 2844.71 MHz / INTPERFCTR1 (TSC) = 1992.86 MHz

------[ APIC Base at 00000000-FEE00000 ]------

  0000  FF FF FF FF FF FF FF FF FF FF FF FF FF FF FF FF 
  0010  FF FF FF FF FF FF FF FF FF FF FF FF FF FF FF FF 
  0020  FF FF FF FF FF FF FF FF FF FF FF FF FF FF FF FF 
  0030  FF FF FF FF FF FF FF FF FF FF FF FF FF FF FF FF 
  0040  FF FF FF FF FF FF FF FF FF FF FF FF FF FF FF FF 
  0050  FF FF FF FF FF FF FF FF FF FF FF FF FF FF FF FF 
  0060  FF FF FF FF FF FF FF FF FF FF FF FF FF FF FF FF 
  0070  FF FF FF FF FF FF FF FF FF FF FF FF FF FF FF FF 
  0080  FF FF FF FF FF FF FF FF FF FF FF FF FF FF FF FF 
  0090  FF FF FF FF FF FF FF FF FF FF FF FF FF FF FF FF 
  00A0  FF FF FF FF FF FF FF FF FF FF FF FF FF FF FF FF 
  00B0  FF FF FF FF FF FF FF FF FF FF FF FF FF FF FF FF 
  00C0  FF FF FF FF FF FF FF FF FF FF FF FF FF FF FF FF 
  00D0  FF FF FF FF FF FF FF FF FF FF FF FF FF FF FF FF 
  00E0  FF FF FF FF FF FF FF FF FF FF FF FF FF FF FF FF 
  00F0  FF FF FF FF FF FF FF FF FF FF FF FF FF FF FF FF 
  0100  FF FF FF FF FF FF FF FF FF FF FF FF FF FF FF FF 
  0110  FF FF FF FF FF FF FF FF FF FF FF FF FF FF FF FF 
  0120  FF FF FF FF FF FF FF FF FF FF FF FF FF FF FF FF 
  0130  FF FF FF FF FF FF FF FF FF FF FF FF FF FF FF FF 
  0140  FF FF FF FF FF FF FF FF FF FF FF FF FF FF FF FF 
  0150  FF FF FF FF FF FF FF FF FF FF FF FF FF FF FF FF 
  0160  FF FF FF FF FF FF FF FF FF FF FF FF FF FF FF FF 
  0170  FF FF FF FF FF FF FF FF FF FF FF FF FF FF FF FF 
  0180  FF FF FF FF FF FF FF FF FF FF FF FF FF FF FF FF 
  0190  FF FF FF FF FF FF FF FF FF FF FF FF FF FF FF FF 
  01A0  FF FF FF FF FF FF FF FF FF FF FF FF FF FF FF FF 
  01B0  FF FF FF FF FF FF FF FF FF FF FF FF FF FF FF FF 
  01C0  FF FF FF FF FF FF FF FF FF FF FF FF FF FF FF FF 
  01D0  FF FF FF FF FF FF FF FF FF FF FF FF FF FF FF FF 
  01E0  FF FF FF FF FF FF FF FF FF FF FF FF FF FF FF FF 
  01F0  FF FF FF FF FF FF FF FF FF FF FF FF FF FF FF FF 
  0200  FF FF FF FF FF FF FF FF FF FF FF FF FF FF FF FF 
  0210  FF FF FF FF FF FF FF FF FF FF FF FF FF FF FF FF 
  0220  FF FF FF FF FF FF FF FF FF FF FF FF FF FF FF FF 
  0230  FF FF FF FF FF FF FF FF FF FF FF FF FF FF FF FF 
  0240  FF FF FF FF FF FF FF FF FF FF FF FF FF FF FF FF 
  0250  FF FF FF FF FF FF FF FF FF FF FF FF FF FF FF FF 
  0260  FF FF FF FF FF FF FF FF FF FF FF FF FF FF FF FF 
  0270  FF FF FF FF FF FF FF FF FF FF FF FF FF FF FF FF 
  0280  FF FF FF FF FF FF FF FF FF FF FF FF FF FF FF FF 
  0290  FF FF FF FF FF FF FF FF FF FF FF FF FF FF FF FF 
  02A0  FF FF FF FF FF FF FF FF FF FF FF FF FF FF FF FF 
  02B0  FF FF FF FF FF FF FF FF FF FF FF FF FF FF FF FF 
  02C0  FF FF FF FF FF FF FF FF FF FF FF FF FF FF FF FF 
  02D0  FF FF FF FF FF FF FF FF FF FF FF FF FF FF FF FF 
  02E0  FF FF FF FF FF FF FF FF FF FF FF FF FF FF FF FF 
  02F0  FF FF FF FF FF FF FF FF FF FF FF FF FF FF FF FF 
  0300  FF FF FF FF FF FF FF FF FF FF FF FF FF FF FF FF 
  0310  FF FF FF FF FF FF FF FF FF FF FF FF FF FF FF FF 
  0320  FF FF FF FF FF FF FF FF FF FF FF FF FF FF FF FF 
  0330  FF FF FF FF FF FF FF FF FF FF FF FF FF FF FF FF 
  0340  FF FF FF FF FF FF FF FF FF FF FF FF FF FF FF FF 
  0350  FF FF FF FF FF FF FF FF FF FF FF FF FF FF FF FF 
  0360  FF FF FF FF FF FF FF FF FF FF FF FF FF FF FF FF 
  0370  FF FF FF FF FF FF FF FF FF FF FF FF FF FF FF FF 
  0380  FF FF FF FF FF FF FF FF FF FF FF FF FF FF FF FF 
  0390  FF FF FF FF FF FF FF FF FF FF FF FF FF FF FF FF 
  03A0  FF FF FF FF FF FF FF FF FF FF FF FF FF FF FF FF 
  03B0  FF FF FF FF FF FF FF FF FF FF FF FF FF FF FF FF 
  03C0  FF FF FF FF FF FF FF FF FF FF FF FF FF FF FF FF 
  03D0  FF FF FF FF FF FF FF FF FF FF FF FF FF FF FF FF 
  03E0  FF FF FF FF FF FF FF FF FF FF FF FF FF FF FF FF 
  03F0  FF FF FF FF FF FF FF FF FF FF FF FF FF FF FF FF 
