------[ Logical CPU #0 ]------

allcpu: Package 0 / Core 0 / Thread 0: Valid

CPUID 00000000: 0000000D-756E6547-6C65746F-49656E69 [GenuineIotel]
CPUID 00000001: 000306C3-00100800-7FFAFBFF-BFEBFBFF
CPUID 00000002: 76036301-00F0B5FF-00000000-00C10000
CPUID 00000003: 00000000-00000000-00000000-00000000
CPUID 00000005: 00000040-00000040-00000003-00042120
CPUID 00000006: 00000077-00000002-00000009-00000000
CPUID 00000007: 00000000-00000000-00000000-00000000
CPUID 00000008: 00000000-00000000-00000000-00000000
CPUID 00000009: 00000000-00000000-00000000-00000000
CPUID 0000000A: 07300403-00000000-00000000-00000603
CPUID 0000000C: 00000000-00000000-00000000-00000000
CPUID 0000000D: 00000000-00000000-00000000-00000000 [SL 00] [x87]
CPUID 0000000D: 00000000-00000000-00000000-00000000 [SL 01] [SSE]
CPUID 80000000: 80000008-00000000-00000000-00000000
CPUID 80000001: 00000000-00000000-00000021-2C100800
CPUID 80000002: 65746E49-2952286C-6F655820-2952286E [Intel(R) Xeon(R)]
CPUID 80000003: 55504320-2D334520-31333231-20337620 [ CPU E3-1231 v3 ]
CPUID 80000004: 2E332040-48473034-0000007A-00000000 [@ 3.40GHz]
CPUID 80000005: 00000000-00000000-00000000-00000000
CPUID 80000006: 00000000-00000000-01006040-00000000
CPUID 80000007: 00000000-00000000-00000000-00000100
CPUID 80000008: 00003027-00000000-00000000-00000000

------[ Logical CPU #1 ]------

allcpu: Package 0 / Core 0 / Thread 1: Valid, Virtual

CPUID 00000000: 0000000D-756E6547-6C65746F-49656E69 [GenuineIotel]
CPUID 00000001: 000306C3-01100800-7FFAFBFF-BFEBFBFF
CPUID 00000002: 76036301-00F0B5FF-00000000-00C10000
CPUID 00000003: 00000000-00000000-00000000-00000000
CPUID 00000005: 00000040-00000040-00000003-00042120
CPUID 00000006: 00000077-00000002-00000009-00000000
CPUID 00000007: 00000000-00000000-00000000-00000000
CPUID 00000008: 00000000-00000000-00000000-00000000
CPUID 00000009: 00000000-00000000-00000000-00000000
CPUID 0000000A: 07300403-00000000-00000000-00000603
CPUID 0000000C: 00000000-00000000-00000000-00000000
CPUID 0000000D: 00000000-00000000-00000000-00000000 [SL 00] [x87]
CPUID 0000000D: 00000000-00000000-00000000-00000000 [SL 01] [SSE]
CPUID 80000000: 80000008-00000000-00000000-00000000
CPUID 80000001: 00000000-00000000-00000021-2C100800
CPUID 80000002: 65746E49-2952286C-6F655820-2952286E [Intel(R) Xeon(R)]
CPUID 80000003: 55504320-2D334520-31333231-20337620 [ CPU E3-1231 v3 ]
CPUID 80000004: 2E332040-48473034-0000007A-00000000 [@ 3.40GHz]
CPUID 80000005: 00000000-00000000-00000000-00000000
CPUID 80000006: 00000000-00000000-01006040-00000000
CPUID 80000007: 00000000-00000000-00000000-00000100
CPUID 80000008: 00003027-00000000-00000000-00000000

------[ Logical CPU #2 ]------

allcpu: Package 1 / Core 0 / Thread 0: Valid

CPUID 00000000: 0000000D-756E6547-6C65746F-49656E69 [GenuineIotel]
CPUID 00000001: 000306C3-02100800-7FFAFBFF-BFEBFBFF
CPUID 00000002: 76036301-00F0B5FF-00000000-00C10000
CPUID 00000003: 00000000-00000000-00000000-00000000
CPUID 00000005: 00000040-00000040-00000003-00042120
CPUID 00000006: 00000077-00000002-00000009-00000000
CPUID 00000007: 00000000-00000000-00000000-00000000
CPUID 00000008: 00000000-00000000-00000000-00000000
CPUID 00000009: 00000000-00000000-00000000-00000000
CPUID 0000000A: 07300403-00000000-00000000-00000603
CPUID 0000000C: 00000000-00000000-00000000-00000000
CPUID 0000000D: 00000000-00000000-00000000-00000000 [SL 00] [x87]
CPUID 0000000D: 00000000-00000000-00000000-00000000 [SL 01] [SSE]
CPUID 80000000: 80000008-00000000-00000000-00000000
CPUID 80000001: 00000000-00000000-00000021-2C100800
CPUID 80000002: 65746E49-2952286C-6F655820-2952286E [Intel(R) Xeon(R)]
CPUID 80000003: 55504320-2D334520-31333231-20337620 [ CPU E3-1231 v3 ]
CPUID 80000004: 2E332040-48473034-0000007A-00000000 [@ 3.40GHz]
CPUID 80000005: 00000000-00000000-00000000-00000000
CPUID 80000006: 00000000-00000000-01006040-00000000
CPUID 80000007: 00000000-00000000-00000000-00000100
CPUID 80000008: 00003027-00000000-00000000-00000000

------[ Logical CPU #3 ]------

allcpu: Package 1 / Core 0 / Thread 1: Valid, Virtual

CPUID 00000000: 0000000D-756E6547-6C65746F-49656E69 [GenuineIotel]
CPUID 00000001: 000306C3-03100800-7FFAFBFF-BFEBFBFF
CPUID 00000002: 76036301-00F0B5FF-00000000-00C10000
CPUID 00000003: 00000000-00000000-00000000-00000000
CPUID 00000005: 00000040-00000040-00000003-00042120
CPUID 00000006: 00000077-00000002-00000009-00000000
CPUID 00000007: 00000000-00000000-00000000-00000000
CPUID 00000008: 00000000-00000000-00000000-00000000
CPUID 00000009: 00000000-00000000-00000000-00000000
CPUID 0000000A: 07300403-00000000-00000000-00000603
CPUID 0000000C: 00000000-00000000-00000000-00000000
CPUID 0000000D: 00000000-00000000-00000000-00000000 [SL 00] [x87]
CPUID 0000000D: 00000000-00000000-00000000-00000000 [SL 01] [SSE]
CPUID 80000000: 80000008-00000000-00000000-00000000
CPUID 80000001: 00000000-00000000-00000021-2C100800
CPUID 80000002: 65746E49-2952286C-6F655820-2952286E [Intel(R) Xeon(R)]
CPUID 80000003: 55504320-2D334520-31333231-20337620 [ CPU E3-1231 v3 ]
CPUID 80000004: 2E332040-48473034-0000007A-00000000 [@ 3.40GHz]
CPUID 80000005: 00000000-00000000-00000000-00000000
CPUID 80000006: 00000000-00000000-01006040-00000000
CPUID 80000007: 00000000-00000000-00000000-00000100
CPUID 80000008: 00003027-00000000-00000000-00000000

------[ Logical CPU #4 ]------

allcpu: Package 2 / Core 0 / Thread 0: Valid

CPUID 00000000: 0000000D-756E6547-6C65746F-49656E69 [GenuineIotel]
CPUID 00000001: 000306C3-04100800-7FFAFBFF-BFEBFBFF
CPUID 00000002: 76036301-00F0B5FF-00000000-00C10000
CPUID 00000003: 00000000-00000000-00000000-00000000
CPUID 00000005: 00000040-00000040-00000003-00042120
CPUID 00000006: 00000077-00000002-00000009-00000000
CPUID 00000007: 00000000-00000000-00000000-00000000
CPUID 00000008: 00000000-00000000-00000000-00000000
CPUID 00000009: 00000000-00000000-00000000-00000000
CPUID 0000000A: 07300403-00000000-00000000-00000603
CPUID 0000000C: 00000000-00000000-00000000-00000000
CPUID 0000000D: 00000000-00000000-00000000-00000000 [SL 00] [x87]
CPUID 0000000D: 00000000-00000000-00000000-00000000 [SL 01] [SSE]
CPUID 80000000: 80000008-00000000-00000000-00000000
CPUID 80000001: 00000000-00000000-00000021-2C100800
CPUID 80000002: 65746E49-2952286C-6F655820-2952286E [Intel(R) Xeon(R)]
CPUID 80000003: 55504320-2D334520-31333231-20337620 [ CPU E3-1231 v3 ]
CPUID 80000004: 2E332040-48473034-0000007A-00000000 [@ 3.40GHz]
CPUID 80000005: 00000000-00000000-00000000-00000000
CPUID 80000006: 00000000-00000000-01006040-00000000
CPUID 80000007: 00000000-00000000-00000000-00000100
CPUID 80000008: 00003027-00000000-00000000-00000000

------[ Logical CPU #5 ]------

allcpu: Package 2 / Core 0 / Thread 1: Valid, Virtual

CPUID 00000000: 0000000D-756E6547-6C65746F-49656E69 [GenuineIotel]
CPUID 00000001: 000306C3-05100800-7FFAFBFF-BFEBFBFF
CPUID 00000002: 76036301-00F0B5FF-00000000-00C10000
CPUID 00000003: 00000000-00000000-00000000-00000000
CPUID 00000005: 00000040-00000040-00000003-00042120
CPUID 00000006: 00000077-00000002-00000009-00000000
CPUID 00000007: 00000000-00000000-00000000-00000000
CPUID 00000008: 00000000-00000000-00000000-00000000
CPUID 00000009: 00000000-00000000-00000000-00000000
CPUID 0000000A: 07300403-00000000-00000000-00000603
CPUID 0000000C: 00000000-00000000-00000000-00000000
CPUID 0000000D: 00000000-00000000-00000000-00000000 [SL 00] [x87]
CPUID 0000000D: 00000000-00000000-00000000-00000000 [SL 01] [SSE]
CPUID 80000000: 80000008-00000000-00000000-00000000
CPUID 80000001: 00000000-00000000-00000021-2C100800
CPUID 80000002: 65746E49-2952286C-6F655820-2952286E [Intel(R) Xeon(R)]
CPUID 80000003: 55504320-2D334520-31333231-20337620 [ CPU E3-1231 v3 ]
CPUID 80000004: 2E332040-48473034-0000007A-00000000 [@ 3.40GHz]
CPUID 80000005: 00000000-00000000-00000000-00000000
CPUID 80000006: 00000000-00000000-01006040-00000000
CPUID 80000007: 00000000-00000000-00000000-00000100
CPUID 80000008: 00003027-00000000-00000000-00000000

------[ Logical CPU #6 ]------

allcpu: Package 3 / Core 0 / Thread 0: Valid

CPUID 00000000: 0000000D-756E6547-6C65746F-49656E69 [GenuineIotel]
CPUID 00000001: 000306C3-06100800-7FFAFBFF-BFEBFBFF
CPUID 00000002: 76036301-00F0B5FF-00000000-00C10000
CPUID 00000003: 00000000-00000000-00000000-00000000
CPUID 00000005: 00000040-00000040-00000003-00042120
CPUID 00000006: 00000077-00000002-00000009-00000000
CPUID 00000007: 00000000-00000000-00000000-00000000
CPUID 00000008: 00000000-00000000-00000000-00000000
CPUID 00000009: 00000000-00000000-00000000-00000000
CPUID 0000000A: 07300403-00000000-00000000-00000603
CPUID 0000000C: 00000000-00000000-00000000-00000000
CPUID 0000000D: 00000000-00000000-00000000-00000000 [SL 00] [x87]
CPUID 0000000D: 00000000-00000000-00000000-00000000 [SL 01] [SSE]
CPUID 80000000: 80000008-00000000-00000000-00000000
CPUID 80000001: 00000000-00000000-00000021-2C100800
CPUID 80000002: 65746E49-2952286C-6F655820-2952286E [Intel(R) Xeon(R)]
CPUID 80000003: 55504320-2D334520-31333231-20337620 [ CPU E3-1231 v3 ]
CPUID 80000004: 2E332040-48473034-0000007A-00000000 [@ 3.40GHz]
CPUID 80000005: 00000000-00000000-00000000-00000000
CPUID 80000006: 00000000-00000000-01006040-00000000
CPUID 80000007: 00000000-00000000-00000000-00000100
CPUID 80000008: 00003027-00000000-00000000-00000000

------[ Logical CPU #7 ]------

allcpu: Package 3 / Core 0 / Thread 1: Valid, Virtual

CPUID 00000000: 0000000D-756E6547-6C65746F-49656E69 [GenuineIotel]
CPUID 00000001: 000306C3-07100800-7FFAFBFF-BFEBFBFF
CPUID 00000002: 76036301-00F0B5FF-00000000-00C10000
CPUID 00000003: 00000000-00000000-00000000-00000000
CPUID 00000005: 00000040-00000040-00000003-00042120
CPUID 00000006: 00000077-00000002-00000009-00000000
CPUID 00000007: 00000000-00000000-00000000-00000000
CPUID 00000008: 00000000-00000000-00000000-00000000
CPUID 00000009: 00000000-00000000-00000000-00000000
CPUID 0000000A: 07300403-00000000-00000000-00000603
CPUID 0000000C: 00000000-00000000-00000000-00000000
CPUID 0000000D: 00000000-00000000-00000000-00000000 [SL 00] [x87]
CPUID 0000000D: 00000000-00000000-00000000-00000000 [SL 01] [SSE]
CPUID 80000000: 80000008-00000000-00000000-00000000
CPUID 80000001: 00000000-00000000-00000021-2C100800
CPUID 80000002: 65746E49-2952286C-6F655820-2952286E [Intel(R) Xeon(R)]
CPUID 80000003: 55504320-2D334520-31333231-20337620 [ CPU E3-1231 v3 ]
CPUID 80000004: 2E332040-48473034-0000007A-00000000 [@ 3.40GHz]
CPUID 80000005: 00000000-00000000-00000000-00000000
CPUID 80000006: 00000000-00000000-01006040-00000000
CPUID 80000007: 00000000-00000000-00000000-00000100
CPUID 80000008: 00003027-00000000-00000000-00000000

------[ All CPUs ]------

CPU   0: APICID    0 / Package 0 / Core   0 / Thread 0: Valid
CPU   1: APICID    1 / Package 0 / Core   0 / Thread 1: Valid, Virtual
CPU   2: APICID    2 / Package 1 / Core   0 / Thread 0: Valid
CPU   3: APICID    3 / Package 1 / Core   0 / Thread 1: Valid, Virtual
CPU   4: APICID    4 / Package 2 / Core   0 / Thread 0: Valid
CPU   5: APICID    5 / Package 2 / Core   0 / Thread 1: Valid, Virtual
CPU   6: APICID    6 / Package 3 / Core   0 / Thread 0: Valid
CPU   7: APICID    7 / Package 3 / Core   0 / Thread 1: Valid, Virtual

------[ MSR Registers ]------

MSR 00000198: 0000-2379-0000-2500 [S200]
MSR 00000198: 0000-19D6-0000-1100 [S200]
MSR 00000198: 0000-1B6A-0000-1500
MSR 00000199: 0000-0000-0000-1500
MSR 0000019A: 0000-0000-0000-0000
MSR 0000019B: 0000-0000-0000-0010
MSR 0000019C: 0000-0000-883C-0000 [S200]
MSR 0000019C: 0000-0000-883D-0000 [S200]
MSR 0000019C: 0000-0000-883D-0000
MSR 0000019D: 0000-0000-0000-0000
MSR 00000480: 00DA-0400-0000-0012
MSR 00000481: 0000-007F-0000-0016
MSR 00000482: FFF9-FFFE-0401-E172
MSR 00000483: 007F-FFFF-0003-6DFF
MSR 00000484: 0000-FFFF-0000-11FF
MSR 00000485: 0000-0000-3004-81E5
MSR 00000486: 0000-0000-8000-0021
MSR 00000487: 0000-0000-FFFF-FFFF
MSR 00000488: 0000-0000-0000-2000
MSR 00000489: 0000-0000-0017-67FF
MSR 0000048A: 0000-0000-0000-002A
MSR 0000048B: 0000-7CFF-0000-0000
MSR 0000048C: 0000-0F01-0633-4141
MSR 0000048D: 0000-007F-0000-0016
MSR 0000048E: FFF9-FFFE-0400-6172
MSR 0000048F: 007F-FFFF-0003-6DFB
MSR 00000490: 0000-FFFF-0000-11FB
