------[ Versions ]------

Program Version : EVEREST v5.30.1900
BenchDLL Version: 2.4.273.0

------[ CPU Info ]------

CPU Type           : IDT WinChip 2A, 225 MHz (4.5 x 50)
CPU Alias          : W2A
CPU Platform       : Socket 7
Instruction Set    : x86, MMX, 3DNow!
CPUID Manufacturer : CentaurHauls
CPUID CPU Name     : IDT WinChip 2-3D
CPUID Revision     : 00000587h
Platform ID        : CBh  (Socket 7)

------[ Logical CPU #0 ]------

allcpu: Valid

CPUID 00000000: 00000001-746E6543-736C7561-48727561
CPUID 00000001: 00000587-00000000-00000000-008001B5
CPUID 80000000: 80000005-00000000-00000000-00000000
CPUID 80000001: 00000587-00000000-00000000-808001B5
CPUID 80000002: 20544449-436E6957-20706968-44332D32
CPUID 80000003: 00000000-00000000-00000000-00000000
CPUID 80000004: 00000000-00000000-00000000-00000000
CPUID 80000005: 80000005-08800880-20040120-20020120
CPUID 80860000: 80860000-00000000-00000000-00000000
CPUID C0000000: C0000005-00000000-00000000-00000000
CPUID C0000001: 00000587-00000000-00000000-808001B5
CPUID C0000002: 20544449-436E6957-20706968-44332D32
CPUID C0000003: 00000000-00000000-00000000-00000000
CPUID C0000004: 00000000-00000000-00000000-00000000
CPUID C0000005: C0000005-08800880-20040120-20020120

------[ MSR Registers ]------

MSR 0000010A: 0000-0000-0000-0000

PerformanceFrequency = 1193182

Tjmax Temperature = 0 Celsius
