------[ Versions ]------

Program Version : EVEREST v4.60.1628 Beta
BenchDLL Version: 2.4.257.0

------[ CPU Info ]------

CPU Type           : VIA C3, 1333 MHz (10 x 133)
CPU Alias          : WinChip 5P, Nehemiah-P
Instruction Set    : x86, MMX, SSE
CPUID Manufacturer : CentaurHauls
CPUID CPU Name     : VIA Nehemiah
CPUID Revision     : 00000698h
Platform ID        : 00h  (Unknown)

------[ Logical CPU #0 ]------

allcpu: Valid

CPUID 00000000: 00000001-746E6543-736C7561-48727561
CPUID 00000001: 00000698-00000000-00000000-0381B93F
CPUID 80000000: 80000006-00000000-00000000-00000000
CPUID 80000001: 00000000-00000000-00000000-00000000
CPUID 80000002: 20414956-6568654E-6861696D-00000000
CPUID 80000003: 00000000-00000000-00000000-00000000
CPUID 80000004: 00000000-00000000-00000000-00000000
CPUID 80000005: 00000000-08800880-40040120-40040120
CPUID 80000006: 00000000-00000000-00408120-00000000
CPUID C0000000: C0000001-00000000-00000000-00000000
CPUID C0000001: 00000000-00000000-00000000-000000DD

------[ MSR Registers ]------

MSR 0000002A: 0000-0000-C0C4-0000

PerformanceFrequency = 3579545

Tjmax Temperature = 0 Celsius
