------[ CPUID Registers / Logical CPU #0 ]------

allcpu: Package 0 / Core 0 / Thread 0: Valid

CPUID 00000000: 0000000D-746E6543-736C7561-48727561 [CentaurHauls]
CPUID 00000001: 000307B2-00040800-7FDA63EB-BFCBFBFF
CPUID 00000002: 635AF001-00000000-00000000-000000FF
CPUID 00000003: 00000000-00000000-00000000-00000000
CPUID 00000004: 0C000121-01C0003F-0000003F-00000000 [SL 00] [L1D: 32 KB]
CPUID 00000004: 0C000122-01C0003F-0000003F-00000000 [SL 01] [L1I: 32 KB]
CPUID 00000004: 0C00C143-03C0003F-00000FFF-00000002 [SL 02] [L2U: 4 MB]
CPUID 00000005: 00000040-00000040-00000003-00022220
CPUID 00000006: 00000E81-00000000-00000001-00000000
CPUID 00000007: 00000000-201C258B-0040000C-24000000 [SL 00]
CPUID 00000008: 00000000-00000000-00000000-00000000
CPUID 00000009: 00000000-00000000-00000000-00000000
CPUID 0000000A: 07300402-00000000-00000000-00000603
CPUID 0000000B: 00000000-00000001-00000100-00000000 [SL 00]
CPUID 0000000B: 00000002-00000004-00000201-00000000 [SL 01]
CPUID 0000000C: 00000000-00000000-00000000-00000000
CPUID 0000000D: 00000207-00000340-00000A88-00000000 [SL 00] [x87]
CPUID 0000000D: 00000001-00000000-00000000-00000000 [SL 01] [SSE]
CPUID 0000000D: 00000100-00000240-00000000-00000000 [SL 02] [AVX]
CPUID 0000000D: 00000008-00000A80-00000000-00000000 [SL 09] [PKRU]
CPUID 80000000: 80000008-00000000-00000000-00000000
CPUID 80000001: 00000000-00000000-00000121-2C100800
CPUID 80000002: 20202020-20202020-20202020-485A2020 [              ZH]
CPUID 80000003: 49584F41-614B204E-61695869-584B206E [AOXIN KaiXian KX]
CPUID 80000004: 3030362D-342F4730-362E3240-007A4847 [-6000G/4@2.6GHz]
CPUID 80000005: 04200420-06600660-20080140-20080140 [L1D: 32 KB / L1I: 32 KB]
CPUID 80000006: 00000000-00000000-10008140-00000000 [L2: 4096 KB] / L3: 0 KB]
CPUID 80000007: 00000000-00000000-00000000-00000100
CPUID 80000008: 00003028-00000000-00000000-00000000
CPUID C0000000: C0000005-00000000-00000000-00000000
CPUID C0000001: 000307B2-00000000-00000000-1EC03DFF
CPUID C0000002: 00000000-00000000-00000000-00000000
CPUID C0000003: 00000000-00000000-00000000-00000000
CPUID C0000004: 0000002B-1000105B-105B42C7-00000000
CPUID C0000005: 00000082-00000000-00000000-00000000

L1    Data Cache:    32 KB,  8-way Associative, 64-byte Line
L1  Instr. Cache:    32 KB,  8-way Associative, 64-byte Line
L2 Unified Cache:     4 MB, 16-way Associative, 64-byte Line

------[ CPUID Registers / Logical CPU #1 ]------

allcpu: Package 0 / Core 1 / Thread 0: Valid

CPUID 00000000: 0000000D-746E6543-736C7561-48727561 [CentaurHauls]
CPUID 00000001: 000307B2-01040800-7FDA63EB-BFCBFBFF
CPUID 00000002: 635AF001-00000000-00000000-000000FF
CPUID 00000003: 00000000-00000000-00000000-00000000
CPUID 00000004: 0C000121-01C0003F-0000003F-00000000 [SL 00] [L1D: 32 KB]
CPUID 00000004: 0C000122-01C0003F-0000003F-00000000 [SL 01] [L1I: 32 KB]
CPUID 00000004: 0C00C143-03C0003F-00000FFF-00000002 [SL 02] [L2U: 4 MB]
CPUID 00000005: 00000040-00000040-00000003-00022220
CPUID 00000006: 00000E81-00000000-00000001-00000000
CPUID 00000007: 00000000-201C258B-0040000C-24000000 [SL 00]
CPUID 00000008: 00000000-00000000-00000000-00000000
CPUID 00000009: 00000000-00000000-00000000-00000000
CPUID 0000000A: 07300402-00000000-00000000-00000603
CPUID 0000000B: 00000000-00000001-00000100-00000001 [SL 00]
CPUID 0000000B: 00000002-00000004-00000201-00000001 [SL 01]
CPUID 0000000C: 00000000-00000000-00000000-00000000
CPUID 0000000D: 00000207-00000340-00000A88-00000000 [SL 00] [x87]
CPUID 0000000D: 00000001-00000000-00000000-00000000 [SL 01] [SSE]
CPUID 0000000D: 00000100-00000240-00000000-00000000 [SL 02] [AVX]
CPUID 0000000D: 00000008-00000A80-00000000-00000000 [SL 09] [PKRU]
CPUID 80000000: 80000008-00000000-00000000-00000000
CPUID 80000001: 00000000-00000000-00000121-2C100800
CPUID 80000002: 20202020-20202020-20202020-485A2020 [              ZH]
CPUID 80000003: 49584F41-614B204E-61695869-584B206E [AOXIN KaiXian KX]
CPUID 80000004: 3030362D-342F4730-362E3240-007A4847 [-6000G/4@2.6GHz]
CPUID 80000005: 04200420-06600660-20080140-20080140 [L1D: 32 KB / L1I: 32 KB]
CPUID 80000006: 00000000-00000000-10008140-00000000 [L2: 4096 KB] / L3: 0 KB]
CPUID 80000007: 00000000-00000000-00000000-00000100
CPUID 80000008: 00003028-00000000-00000000-00000000
CPUID C0000000: C0000005-00000000-00000000-00000000
CPUID C0000001: 000307B2-00000000-00000000-1EC03DFF
CPUID C0000002: 00000000-00000000-00000000-00000000
CPUID C0000003: 00000000-00000000-00000000-00000000
CPUID C0000004: 0000002B-1000105B-105B42C7-00000000
CPUID C0000005: 00000082-00000000-00000000-00000000

L1    Data Cache:    32 KB,  8-way Associative, 64-byte Line
L1  Instr. Cache:    32 KB,  8-way Associative, 64-byte Line
L2 Unified Cache:     4 MB, 16-way Associative, 64-byte Line

------[ CPUID Registers / Logical CPU #2 ]------

allcpu: Package 0 / Core 2 / Thread 0: Valid

CPUID 00000000: 0000000D-746E6543-736C7561-48727561 [CentaurHauls]
CPUID 00000001: 000307B2-02040800-7FDA63EB-BFCBFBFF
CPUID 00000002: 635AF001-00000000-00000000-000000FF
CPUID 00000003: 00000000-00000000-00000000-00000000
CPUID 00000004: 0C000121-01C0003F-0000003F-00000000 [SL 00] [L1D: 32 KB]
CPUID 00000004: 0C000122-01C0003F-0000003F-00000000 [SL 01] [L1I: 32 KB]
CPUID 00000004: 0C00C143-03C0003F-00000FFF-00000002 [SL 02] [L2U: 4 MB]
CPUID 00000005: 00000040-00000040-00000003-00022220
CPUID 00000006: 00000E81-00000000-00000001-00000000
CPUID 00000007: 00000000-201C258B-0040000C-24000000 [SL 00]
CPUID 00000008: 00000000-00000000-00000000-00000000
CPUID 00000009: 00000000-00000000-00000000-00000000
CPUID 0000000A: 07300402-00000000-00000000-00000603
CPUID 0000000B: 00000000-00000001-00000100-00000002 [SL 00]
CPUID 0000000B: 00000002-00000004-00000201-00000002 [SL 01]
CPUID 0000000C: 00000000-00000000-00000000-00000000
CPUID 0000000D: 00000207-00000340-00000A88-00000000 [SL 00] [x87]
CPUID 0000000D: 00000001-00000000-00000000-00000000 [SL 01] [SSE]
CPUID 0000000D: 00000100-00000240-00000000-00000000 [SL 02] [AVX]
CPUID 0000000D: 00000008-00000A80-00000000-00000000 [SL 09] [PKRU]
CPUID 80000000: 80000008-00000000-00000000-00000000
CPUID 80000001: 00000000-00000000-00000121-2C100800
CPUID 80000002: 20202020-20202020-20202020-485A2020 [              ZH]
CPUID 80000003: 49584F41-614B204E-61695869-584B206E [AOXIN KaiXian KX]
CPUID 80000004: 3030362D-342F4730-362E3240-007A4847 [-6000G/4@2.6GHz]
CPUID 80000005: 04200420-06600660-20080140-20080140 [L1D: 32 KB / L1I: 32 KB]
CPUID 80000006: 00000000-00000000-10008140-00000000 [L2: 4096 KB] / L3: 0 KB]
CPUID 80000007: 00000000-00000000-00000000-00000100
CPUID 80000008: 00003028-00000000-00000000-00000000
CPUID C0000000: C0000005-00000000-00000000-00000000
CPUID C0000001: 000307B2-00000000-00000000-1EC03DFF
CPUID C0000002: 00000000-00000000-00000000-00000000
CPUID C0000003: 00000000-00000000-00000000-00000000
CPUID C0000004: 0000002A-1000105B-105B42C7-00000000
CPUID C0000005: 00000082-00000000-00000000-00000000

L1    Data Cache:    32 KB,  8-way Associative, 64-byte Line
L1  Instr. Cache:    32 KB,  8-way Associative, 64-byte Line
L2 Unified Cache:     4 MB, 16-way Associative, 64-byte Line

------[ CPUID Registers / Logical CPU #3 ]------

allcpu: Package 0 / Core 3 / Thread 0: Valid

CPUID 00000000: 0000000D-746E6543-736C7561-48727561 [CentaurHauls]
CPUID 00000001: 000307B2-03040800-7FDA63EB-BFCBFBFF
CPUID 00000002: 635AF001-00000000-00000000-000000FF
CPUID 00000003: 00000000-00000000-00000000-00000000
CPUID 00000004: 0C000121-01C0003F-0000003F-00000000 [SL 00] [L1D: 32 KB]
CPUID 00000004: 0C000122-01C0003F-0000003F-00000000 [SL 01] [L1I: 32 KB]
CPUID 00000004: 0C00C143-03C0003F-00000FFF-00000002 [SL 02] [L2U: 4 MB]
CPUID 00000005: 00000040-00000040-00000003-00022220
CPUID 00000006: 00000E81-00000000-00000001-00000000
CPUID 00000007: 00000000-201C258B-0040000C-24000000 [SL 00]
CPUID 00000008: 00000000-00000000-00000000-00000000
CPUID 00000009: 00000000-00000000-00000000-00000000
CPUID 0000000A: 07300402-00000000-00000000-00000603
CPUID 0000000B: 00000000-00000001-00000100-00000003 [SL 00]
CPUID 0000000B: 00000002-00000004-00000201-00000003 [SL 01]
CPUID 0000000C: 00000000-00000000-00000000-00000000
CPUID 0000000D: 00000207-00000340-00000A88-00000000 [SL 00] [x87]
CPUID 0000000D: 00000001-00000000-00000000-00000000 [SL 01] [SSE]
CPUID 0000000D: 00000100-00000240-00000000-00000000 [SL 02] [AVX]
CPUID 0000000D: 00000008-00000A80-00000000-00000000 [SL 09] [PKRU]
CPUID 80000000: 80000008-00000000-00000000-00000000
CPUID 80000001: 00000000-00000000-00000121-2C100800
CPUID 80000002: 20202020-20202020-20202020-485A2020 [              ZH]
CPUID 80000003: 49584F41-614B204E-61695869-584B206E [AOXIN KaiXian KX]
CPUID 80000004: 3030362D-342F4730-362E3240-007A4847 [-6000G/4@2.6GHz]
CPUID 80000005: 04200420-06600660-20080140-20080140 [L1D: 32 KB / L1I: 32 KB]
CPUID 80000006: 00000000-00000000-10008140-00000000 [L2: 4096 KB] / L3: 0 KB]
CPUID 80000007: 00000000-00000000-00000000-00000100
CPUID 80000008: 00003028-00000000-00000000-00000000
CPUID C0000000: C0000005-00000000-00000000-00000000
CPUID C0000001: 000307B2-00000000-00000000-1EC03DFF
CPUID C0000002: 00000000-00000000-00000000-00000000
CPUID C0000003: 00000000-00000000-00000000-00000000
CPUID C0000004: 0000002A-1000105B-105B42C7-00000000
CPUID C0000005: 00000082-00000000-00000000-00000000

L1    Data Cache:    32 KB,  8-way Associative, 64-byte Line
L1  Instr. Cache:    32 KB,  8-way Associative, 64-byte Line
L2 Unified Cache:     4 MB, 16-way Associative, 64-byte Line

------[ All CPUs ]------

CPU   0: APICID    0 / Package 0 / Core   0 / Thread 0: Valid
CPU   1: APICID    1 / Package 0 / Core   1 / Thread 0: Valid
CPU   2: APICID    2 / Package 0 / Core   2 / Thread 0: Valid
CPU   3: APICID    3 / Package 0 / Core   3 / Thread 0: Valid

------[ MSR Registers / Logical CPU #0 ]------

MSR 0000001B: 0000-0000-FEE0-0900
MSR 0000002A: 0000-0000-0400-0000
MSR 0000003A: 0000-0000-0000-0005
MSR 00000048: 0000-0000-0000-0000
MSR 00000049: 0000-0000-0000-0001
MSR 0000008B: 0000-723D-0000-0000
MSR 000000CD: 0000-0000-0000-0005
MSR 00000198: 105B-42C7-1000-105B [S200]
MSR 00000198: 105B-42C7-1000-105B [S200]
MSR 00000198: 105B-42C7-1000-105B
MSR 00000199: 0000-0000-0000-105B
MSR 0000019A: 0000-0000-0000-0002
MSR 0000019B: 0000-0000-0000-0000
MSR 0000019C: 0000-0000-883F-0000 [S200]
MSR 0000019C: 0000-0000-883F-0000 [S200]
MSR 0000019C: 0000-0000-8840-0000
MSR 0000019D: 0000-0000-0000-7FFF
MSR 000001A0: 0000-0000-0097-3C89
MSR 00000480: 00D8-0400-0000-0007
MSR 00000481: 0000-003F-0000-0016
MSR 00000482: FFF9-FFFE-0401-E172
MSR 00000483: 003F-FFFF-0003-6DFF
MSR 00000484: 0000-FFFF-0000-11FF
MSR 00000485: 0000-0000-0004-01E0
MSR 00000486: 0000-0000-8000-0021
MSR 00000487: 0000-0000-FFFF-FFFF
MSR 00000488: 0000-0000-0000-2000
MSR 00000489: 0000-0000-0077-6FFF
MSR 0000048A: 0000-0000-0000-002A
MSR 0000048B: 0000-3CEE-0000-0000
MSR 0000048C: 0000-0F01-0613-4141
MSR 0000048D: 0000-003F-0000-0016
MSR 0000048E: FFF9-FFFE-0400-6172
MSR 0000048F: 003F-FFFF-0003-6DFB
MSR 00000490: 0000-FFFF-0000-11FB
MSR 00000770: 0000-0000-0000-0000
MSR 00000771: 0000-0000-0000-0000
MSR 00000772: 0000-0000-0000-0000
MSR 00000773: 0000-0000-0000-0000
MSR 00000774: 0000-0000-0000-0000
MSR 00000777: 0000-0000-0000-0000
MSR 00001107: 0FC6-037D-3C34-030E
MSR 00001140: 0000-0000-0000-0000
MSR 00001141: 0000-0000-0000-0000
MSR 00001142: 0000-0000-0000-0000
MSR 00001152: 0000-0000-0000-0000
MSR 00001153: 0000-0000-0000-0000
MSR 00001154: 0000-0000-0000-0000
MSR 00001160: 0000-0000-0000-0000
MSR 00001161: 0000-0000-0000-0000
MSR 00001164: 0000-0000-0000-0000
MSR 00001165: 0000-0000-0000-0000
MSR 00001166: 0000-0000-0000-0000
MSR 00001167: 0000-0000-0000-0000
MSR 00001168: 0000-0000-0000-0000
MSR 0000116A: 0000-0000-0000-0000
MSR 0000116B: 0000-0000-0000-0000
MSR 0000116C: 0000-0000-0000-0000
MSR 00001202: 0000-0000-0000-3DFF
MSR 00001203: 0000-0000-0000-0018
MSR 0000120E: 0180-0700-0000-2000
MSR 00001234: 0000-0000-0000-0000
MSR 00001246: 0000-0000-0000-0000
MSR 00001406: 0000-0000-0003-C800
MSR 00001407: 0000-0000-0845-0095
MSR 00001423: 0000-0000-0000-002A
MSR 00001424: 0070-F000-02AF-FF00
MSR 00001425: 0000-0000-0000-0000
MSR 00001435: 0000-0000-0800-105B
MSR 00001466: 0000-0010-0000-005B

------[ MSR Registers / Logical CPU #1 ]------

MSR 0000001B: 0000-0000-FEE0-0800
MSR 0000002A: 0000-0000-0700-0000
MSR 0000003A: 0000-0000-0000-0005
MSR 00000048: 0000-0000-0000-0000
MSR 00000049: 0000-0000-0000-0001
MSR 0000008B: 0000-723D-0000-0000
MSR 000000CD: 0000-0000-0000-0005
MSR 00000198: 105B-42C7-1000-1C6C
MSR 00000199: 0000-0000-0000-1C6C
MSR 0000019A: 0000-0000-0000-0002
MSR 0000019B: 0000-0000-0000-0000
MSR 0000019C: 0000-0000-883C-0000
MSR 0000019D: 0000-0000-0000-7FFF
MSR 000001A0: 0000-0000-0097-3C89
MSR 00000480: 00D8-0400-0000-0007
MSR 00000481: 0000-003F-0000-0016
MSR 00000482: FFF9-FFFE-0401-E172
MSR 00000483: 003F-FFFF-0003-6DFF
MSR 00000484: 0000-FFFF-0000-11FF
MSR 00000485: 0000-0000-0004-01E0
MSR 00000486: 0000-0000-8000-0021
MSR 00000487: 0000-0000-FFFF-FFFF
MSR 00000488: 0000-0000-0000-2000
MSR 00000489: 0000-0000-0077-6FFF
MSR 0000048A: 0000-0000-0000-002A
MSR 0000048B: 0000-3CEE-0000-0000
MSR 0000048C: 0000-0F01-0613-4141
MSR 0000048D: 0000-003F-0000-0016
MSR 0000048E: FFF9-FFFE-0400-6172
MSR 0000048F: 003F-FFFF-0003-6DFB
MSR 00000490: 0000-FFFF-0000-11FB
MSR 00000770: 0000-0000-0000-0000
MSR 00000771: 0000-0000-0000-0000
MSR 00000772: 0000-0000-0000-0000
MSR 00000773: 0000-0000-0000-0000
MSR 00000774: 0000-0000-0000-0000
MSR 00000777: 0000-0000-0000-0000
MSR 00001107: 0FC6-037D-3C34-030E
MSR 00001140: 0000-0000-0000-0000
MSR 00001141: 0000-0000-0000-0000
MSR 00001142: 0000-0000-0000-0000
MSR 00001152: 0000-0000-0000-0000
MSR 00001153: 0000-0000-0000-0000
MSR 00001154: 0000-0000-0000-0000
MSR 00001160: 0000-0000-0000-0000
MSR 00001161: 0000-0000-0000-0000
MSR 00001164: 0000-0000-0000-0000
MSR 00001165: 0000-0000-0000-0000
MSR 00001166: 0000-0000-0000-0000
MSR 00001167: 0000-0000-0000-0000
MSR 00001168: 0000-0000-0000-0000
MSR 0000116A: 0000-0000-0000-0000
MSR 0000116B: 0000-0000-0000-0000
MSR 0000116C: 0000-0000-0000-0000
MSR 00001202: 0000-0000-0000-3DFF
MSR 00001203: 0000-0000-0000-0018
MSR 0000120E: 0180-0700-0000-2000
MSR 00001234: 0000-0000-0000-0000
MSR 00001246: 0000-0000-0000-0000
MSR 00001406: 0000-0000-002C-C800
MSR 00001407: 0000-0000-0845-0095
MSR 00001423: 0000-0000-0000-002B
MSR 00001424: 0070-F000-02BF-FF00
MSR 00001425: 0000-0000-0000-0000
MSR 00001435: 0000-0000-0800-105B
MSR 00001466: 0000-0010-0000-005B

------[ MSR Registers / Logical CPU #2 ]------

MSR 0000001B: 0000-0000-FEE0-0800
MSR 0000002A: 0000-0000-0700-0000
MSR 0000003A: 0000-0000-0000-0005
MSR 00000048: 0000-0000-0000-0000
MSR 00000049: 0000-0000-0000-0001
MSR 0000008B: 0000-723D-0000-0000
MSR 000000CD: 0000-0000-0000-0005
MSR 00000198: 105B-42C7-1000-1C6C
MSR 00000199: 0000-0000-0000-1C6C
MSR 0000019A: 0000-0000-0000-0002
MSR 0000019B: 0000-0000-0000-0000
MSR 0000019C: 0000-0000-883F-0000
MSR 0000019D: 0000-0000-0000-7FFF
MSR 000001A0: 0000-0000-0097-3C89
MSR 00000480: 00D8-0400-0000-0007
MSR 00000481: 0000-003F-0000-0016
MSR 00000482: FFF9-FFFE-0401-E172
MSR 00000483: 003F-FFFF-0003-6DFF
MSR 00000484: 0000-FFFF-0000-11FF
MSR 00000485: 0000-0000-0004-01E0
MSR 00000486: 0000-0000-8000-0021
MSR 00000487: 0000-0000-FFFF-FFFF
MSR 00000488: 0000-0000-0000-2000
MSR 00000489: 0000-0000-0077-6FFF
MSR 0000048A: 0000-0000-0000-002A
MSR 0000048B: 0000-3CEE-0000-0000
MSR 0000048C: 0000-0F01-0613-4141
MSR 0000048D: 0000-003F-0000-0016
MSR 0000048E: FFF9-FFFE-0400-6172
MSR 0000048F: 003F-FFFF-0003-6DFB
MSR 00000490: 0000-FFFF-0000-11FB
MSR 00000770: 0000-0000-0000-0000
MSR 00000771: 0000-0000-0000-0000
MSR 00000772: 0000-0000-0000-0000
MSR 00000773: 0000-0000-0000-0000
MSR 00000774: 0000-0000-0000-0000
MSR 00000777: 0000-0000-0000-0000
MSR 00001107: 0FC6-037D-3C34-030E
MSR 00001140: 0000-0000-0000-0000
MSR 00001141: 0000-0000-0000-0000
MSR 00001142: 0000-0000-0000-0000
MSR 00001152: 0000-0000-0000-0000
MSR 00001153: 0000-0000-0000-0000
MSR 00001154: 0000-0000-0000-0000
MSR 00001160: 0000-0000-0000-0000
MSR 00001161: 0000-0000-0000-0000
MSR 00001164: 0000-0000-0000-0000
MSR 00001165: 0000-0000-0000-0000
MSR 00001166: 0000-0000-0000-0000
MSR 00001167: 0000-0000-0000-0000
MSR 00001168: 0000-0000-0000-0000
MSR 0000116A: 0000-0000-0000-0000
MSR 0000116B: 0000-0000-0000-0000
MSR 0000116C: 0000-0000-0000-0000
MSR 00001202: 0000-0000-0000-3DFF
MSR 00001203: 0000-0000-0000-0018
MSR 0000120E: 0180-0700-0000-2000
MSR 00001234: 0000-0000-0000-0000
MSR 00001246: 0000-0000-0000-0000
MSR 00001406: 0000-0000-000C-C800
MSR 00001407: 0000-0000-0845-0095
MSR 00001423: 0000-0000-0000-002A
MSR 00001424: 0070-F000-02AF-FF00
MSR 00001425: 0000-0000-0000-0000
MSR 00001435: 0000-0000-0800-105B
MSR 00001466: 0000-0010-0000-005B

------[ MSR Registers / Logical CPU #3 ]------

MSR 0000001B: 0000-0000-FEE0-0800
MSR 0000002A: 0000-0000-0700-0000
MSR 0000003A: 0000-0000-0000-0005
MSR 00000048: 0000-0000-0000-0000
MSR 00000049: 0000-0000-0000-0001
MSR 0000008B: 0000-723D-0000-0000
MSR 000000CD: 0000-0000-0000-0005
MSR 00000198: 105B-42C7-1000-1C6C
MSR 00000199: 0000-0000-0000-1C6C
MSR 0000019A: 0000-0000-0000-0002
MSR 0000019B: 0000-0000-0000-0000
MSR 0000019C: 0000-0000-883D-0000
MSR 0000019D: 0000-0000-0000-7FFF
MSR 000001A0: 0000-0000-0097-3C89
MSR 00000480: 00D8-0400-0000-0007
MSR 00000481: 0000-003F-0000-0016
MSR 00000482: FFF9-FFFE-0401-E172
MSR 00000483: 003F-FFFF-0003-6DFF
MSR 00000484: 0000-FFFF-0000-11FF
MSR 00000485: 0000-0000-0004-01E0
MSR 00000486: 0000-0000-8000-0021
MSR 00000487: 0000-0000-FFFF-FFFF
MSR 00000488: 0000-0000-0000-2000
MSR 00000489: 0000-0000-0077-6FFF
MSR 0000048A: 0000-0000-0000-002A
MSR 0000048B: 0000-3CEE-0000-0000
MSR 0000048C: 0000-0F01-0613-4141
MSR 0000048D: 0000-003F-0000-0016
MSR 0000048E: FFF9-FFFE-0400-6172
MSR 0000048F: 003F-FFFF-0003-6DFB
MSR 00000490: 0000-FFFF-0000-11FB
MSR 00000770: 0000-0000-0000-0000
MSR 00000771: 0000-0000-0000-0000
MSR 00000772: 0000-0000-0000-0000
MSR 00000773: 0000-0000-0000-0000
MSR 00000774: 0000-0000-0000-0000
MSR 00000777: 0000-0000-0000-0000
MSR 00001107: 0FC6-037D-3C34-030E
MSR 00001140: 0000-0000-0000-0000
MSR 00001141: 0000-0000-0000-0000
MSR 00001142: 0000-0000-0000-0000
MSR 00001152: 0000-0000-0000-0000
MSR 00001153: 0000-0000-0000-0000
MSR 00001154: 0000-0000-0000-0000
MSR 00001160: 0000-0000-0000-0000
MSR 00001161: 0000-0000-0000-0000
MSR 00001164: 0000-0000-0000-0000
MSR 00001165: 0000-0000-0000-0000
MSR 00001166: 0000-0000-0000-0000
MSR 00001167: 0000-0000-0000-0000
MSR 00001168: 0000-0000-0000-0000
MSR 0000116A: 0000-0000-0000-0000
MSR 0000116B: 0000-0000-0000-0000
MSR 0000116C: 0000-0000-0000-0000
MSR 00001202: 0000-0000-0000-3DFF
MSR 00001203: 0000-0000-0000-0018
MSR 0000120E: 0180-0700-0000-2000
MSR 00001234: 0000-0000-0000-0000
MSR 00001246: 0000-0000-0000-0000
MSR 00001406: 0000-0000-0001-C800
MSR 00001407: 0000-0000-0845-0095
MSR 00001423: 0000-0000-0000-002C
MSR 00001424: 0070-F000-02CF-FF00
MSR 00001425: 0000-0000-0000-0000
MSR 00001435: 0000-0000-0800-105B
MSR 00001466: 0000-0010-0000-005B
