------[ Versions ]------

Program Version : EVEREST v4.60.1629 Beta
BenchDLL Version: 2.4.257.0

------[ CPU Info ]------

CPU Type           : VIA C7, 1500 MHz (15 x 100)
CPU Alias          : WinChip 5J, Esther
Instruction Set    : x86, MMX, SSE, SSE2, SSE3
CPUID Manufacturer : CentaurHauls
CPUID CPU Name     : VIA Esther processor 1500MHz
CPUID Revision     : 000006A9h
Platform ID        : 00h  (Unknown)

------[ Logical CPU #0 ]------

allcpu: Valid

CPUID 00000000: 00000001-746E6543-736C7561-48727561
CPUID 00000001: 000006A9-00010800-00000181-A7C9BBFF
CPUID 80000000: 80000006-00000000-00000000-00000000
CPUID 80000001: 00000000-00000000-00000000-00100000
CPUID 80000002: 20202020-20202020-20202020-20202020
CPUID 80000003: 56202020-45204149-65687473-72702072
CPUID 80000004: 7365636F-20726F73-30303531-007A484D
CPUID 80000005: 00000000-08800880-40040140-40040140
CPUID 80000006: 00000000-00000000-0080A140-00000000
CPUID C0000000: C0000002-00000000-00000000-00000000
CPUID C0000001: 00000000-00000000-00000000-00003FCC
CPUID C0000002: 00002C00-08000F13-08100F13-43C00000

------[ MSR Registers ]------

MSR 0000002A: 0000-0000-43C0-0000
MSR 00000198: 0810-0F13-0800-0F13
MSR 00000199: 0000-0000-0000-0F13
MSR 0000019A: 0000-0000-0000-0008
MSR 0000019B: 0000-0000-0000-0000
MSR 0000019C: 0000-0000-0000-0000
MSR 0000019D: 0000-0000-0001-0810
MSR 00001153: FFFF-FFFF-FFF9-30BF

PerformanceFrequency = 3579545

Tjmax Temperature = 0 Celsius
