------[ CPUID Registers / Logical CPU #0 ]------

allcpu: Package 0 / Core 0 / Thread 0: Valid

CPUID 00000000: 0000000D-746E6543-736C7561-48727561 [CentaurHauls]
CPUID 00000001: 000307B0-00040800-7FDA63EB-BFCBFBFF
CPUID 00000002: 635AF001-00000000-00000000-000000FF
CPUID 00000003: 00000000-00000000-00000000-00000000
CPUID 00000004: 0C000121-01C0003F-0000003F-00000000 [SL 00] [L1D: 32 KB]
CPUID 00000004: 0C000122-01C0003F-0000003F-00000000 [SL 01] [L1I: 32 KB]
CPUID 00000004: 0C00C143-03C0003F-00000FFF-00000002 [SL 02] [L2U: 4 MB]
CPUID 00000005: 00000040-00000040-00000003-00022220
CPUID 00000006: 00000003-00000000-00000000-00000000
CPUID 00000007: 00000000-200C258B-00000004-24000000 [SL 00]
CPUID 00000008: 00000000-00000000-00000000-00000000
CPUID 00000009: 00000000-00000000-00000000-00000000
CPUID 0000000A: 07300402-00000000-00000000-00000603
CPUID 0000000B: 00000000-00000001-00000100-00000000 [SL 00]
CPUID 0000000B: 00000002-00000004-00000201-00000000 [SL 01]
CPUID 0000000C: 00000000-00000000-00000000-00000000
CPUID 0000000D: 00000007-00000340-00000340-00000000 [SL 00] [x87]
CPUID 0000000D: 00000001-00000000-00000000-00000000 [SL 01] [SSE]
CPUID 0000000D: 00000100-00000240-00000000-00000000 [SL 02] [AVX]
CPUID 80000000: 80000008-00000000-00000000-00000000
CPUID 80000001: 00000000-00000000-00000121-2C100800
CPUID 80000002: 20202020-20202020-20202020-485A2020 [              ZH]
CPUID 80000003: 49584F41-614B204E-61695869-584B206E [AOXIN KaiXian KX]
CPUID 80000004: 3436362D-40414D30-2B322E32-007A4847 [-6640MA@2.2+GHz]
CPUID 80000005: 04200420-06600660-20080140-20080140 [L1D: 32 KB / L1I: 32 KB]
CPUID 80000006: 00000000-00000000-10008140-00000000 [L2: 4096 KB] / L3: 0 KB]
CPUID 80000007: 00000000-00000000-00000000-00000100
CPUID 80000008: 00003028-00000000-00000000-00000000
CPUID C0000000: C0000004-00000000-00000000-00000000
CPUID C0000001: 000307B0-00000000-00000000-1EC13DFC
CPUID C0000002: 00000000-00000000-00000000-00000000
CPUID C0000003: 00000000-00000000-00000000-00000000
CPUID C0000004: 0000004D-18002C98-186F34AA-00000000

L1    Data Cache:    32 KB,  8-way Associative, 64-byte Line
L1  Instr. Cache:    32 KB,  8-way Associative, 64-byte Line
L2 Unified Cache:     4 MB, 16-way Associative, 64-byte Line

------[ CPUID Registers / Logical CPU #1 ]------

allcpu: Package 0 / Core 1 / Thread 0: Valid

CPUID 00000000: 0000000D-746E6543-736C7561-48727561 [CentaurHauls]
CPUID 00000001: 000307B0-01040800-7FDA63EB-BFCBFBFF
CPUID 00000002: 635AF001-00000000-00000000-000000FF
CPUID 00000003: 00000000-00000000-00000000-00000000
CPUID 00000004: 0C000121-01C0003F-0000003F-00000000 [SL 00] [L1D: 32 KB]
CPUID 00000004: 0C000122-01C0003F-0000003F-00000000 [SL 01] [L1I: 32 KB]
CPUID 00000004: 0C00C143-03C0003F-00000FFF-00000002 [SL 02] [L2U: 4 MB]
CPUID 00000005: 00000040-00000040-00000003-00022220
CPUID 00000006: 00000003-00000000-00000000-00000000
CPUID 00000007: 00000000-200C258B-00000004-24000000 [SL 00]
CPUID 00000008: 00000000-00000000-00000000-00000000
CPUID 00000009: 00000000-00000000-00000000-00000000
CPUID 0000000A: 07300402-00000000-00000000-00000603
CPUID 0000000B: 00000000-00000001-00000100-00000001 [SL 00]
CPUID 0000000B: 00000002-00000004-00000201-00000001 [SL 01]
CPUID 0000000C: 00000000-00000000-00000000-00000000
CPUID 0000000D: 00000007-00000340-00000340-00000000 [SL 00] [x87]
CPUID 0000000D: 00000001-00000000-00000000-00000000 [SL 01] [SSE]
CPUID 0000000D: 00000100-00000240-00000000-00000000 [SL 02] [AVX]
CPUID 80000000: 80000008-00000000-00000000-00000000
CPUID 80000001: 00000000-00000000-00000121-2C100800
CPUID 80000002: 20202020-20202020-20202020-485A2020 [              ZH]
CPUID 80000003: 49584F41-614B204E-61695869-584B206E [AOXIN KaiXian KX]
CPUID 80000004: 3436362D-40414D30-2B322E32-007A4847 [-6640MA@2.2+GHz]
CPUID 80000005: 04200420-06600660-20080140-20080140 [L1D: 32 KB / L1I: 32 KB]
CPUID 80000006: 00000000-00000000-10008140-00000000 [L2: 4096 KB] / L3: 0 KB]
CPUID 80000007: 00000000-00000000-00000000-00000100
CPUID 80000008: 00003028-00000000-00000000-00000000
CPUID C0000000: C0000004-00000000-00000000-00000000
CPUID C0000001: 000307B0-00000000-00000000-1EC13DFC
CPUID C0000002: 00000000-00000000-00000000-00000000
CPUID C0000003: 00000000-00000000-00000000-00000000
CPUID C0000004: 0000004D-18002C98-186F34AA-00000000

L1    Data Cache:    32 KB,  8-way Associative, 64-byte Line
L1  Instr. Cache:    32 KB,  8-way Associative, 64-byte Line
L2 Unified Cache:     4 MB, 16-way Associative, 64-byte Line

------[ CPUID Registers / Logical CPU #2 ]------

allcpu: Package 0 / Core 2 / Thread 0: Valid

CPUID 00000000: 0000000D-746E6543-736C7561-48727561 [CentaurHauls]
CPUID 00000001: 000307B0-02040800-7FDA63EB-BFCBFBFF
CPUID 00000002: 635AF001-00000000-00000000-000000FF
CPUID 00000003: 00000000-00000000-00000000-00000000
CPUID 00000004: 0C000121-01C0003F-0000003F-00000000 [SL 00] [L1D: 32 KB]
CPUID 00000004: 0C000122-01C0003F-0000003F-00000000 [SL 01] [L1I: 32 KB]
CPUID 00000004: 0C00C143-03C0003F-00000FFF-00000002 [SL 02] [L2U: 4 MB]
CPUID 00000005: 00000040-00000040-00000003-00022220
CPUID 00000006: 00000003-00000000-00000000-00000000
CPUID 00000007: 00000000-200C258B-00000004-24000000 [SL 00]
CPUID 00000008: 00000000-00000000-00000000-00000000
CPUID 00000009: 00000000-00000000-00000000-00000000
CPUID 0000000A: 07300402-00000000-00000000-00000603
CPUID 0000000B: 00000000-00000001-00000100-00000002 [SL 00]
CPUID 0000000B: 00000002-00000004-00000201-00000002 [SL 01]
CPUID 0000000C: 00000000-00000000-00000000-00000000
CPUID 0000000D: 00000007-00000340-00000340-00000000 [SL 00] [x87]
CPUID 0000000D: 00000001-00000000-00000000-00000000 [SL 01] [SSE]
CPUID 0000000D: 00000100-00000240-00000000-00000000 [SL 02] [AVX]
CPUID 80000000: 80000008-00000000-00000000-00000000
CPUID 80000001: 00000000-00000000-00000121-2C100800
CPUID 80000002: 20202020-20202020-20202020-485A2020 [              ZH]
CPUID 80000003: 49584F41-614B204E-61695869-584B206E [AOXIN KaiXian KX]
CPUID 80000004: 3436362D-40414D30-2B322E32-007A4847 [-6640MA@2.2+GHz]
CPUID 80000005: 04200420-06600660-20080140-20080140 [L1D: 32 KB / L1I: 32 KB]
CPUID 80000006: 00000000-00000000-10008140-00000000 [L2: 4096 KB] / L3: 0 KB]
CPUID 80000007: 00000000-00000000-00000000-00000100
CPUID 80000008: 00003028-00000000-00000000-00000000
CPUID C0000000: C0000004-00000000-00000000-00000000
CPUID C0000001: 000307B0-00000000-00000000-1EC13DFC
CPUID C0000002: 00000000-00000000-00000000-00000000
CPUID C0000003: 00000000-00000000-00000000-00000000
CPUID C0000004: 0000004D-183031A6-186F34AA-00000000

L1    Data Cache:    32 KB,  8-way Associative, 64-byte Line
L1  Instr. Cache:    32 KB,  8-way Associative, 64-byte Line
L2 Unified Cache:     4 MB, 16-way Associative, 64-byte Line

------[ CPUID Registers / Logical CPU #3 ]------

allcpu: Package 0 / Core 3 / Thread 0: Valid

CPUID 00000000: 0000000D-746E6543-736C7561-48727561 [CentaurHauls]
CPUID 00000001: 000307B0-03040800-7FDA63EB-BFCBFBFF
CPUID 00000002: 635AF001-00000000-00000000-000000FF
CPUID 00000003: 00000000-00000000-00000000-00000000
CPUID 00000004: 0C000121-01C0003F-0000003F-00000000 [SL 00] [L1D: 32 KB]
CPUID 00000004: 0C000122-01C0003F-0000003F-00000000 [SL 01] [L1I: 32 KB]
CPUID 00000004: 0C00C143-03C0003F-00000FFF-00000002 [SL 02] [L2U: 4 MB]
CPUID 00000005: 00000040-00000040-00000003-00022220
CPUID 00000006: 00000003-00000000-00000000-00000000
CPUID 00000007: 00000000-200C258B-00000004-24000000 [SL 00]
CPUID 00000008: 00000000-00000000-00000000-00000000
CPUID 00000009: 00000000-00000000-00000000-00000000
CPUID 0000000A: 07300402-00000000-00000000-00000603
CPUID 0000000B: 00000000-00000001-00000100-00000003 [SL 00]
CPUID 0000000B: 00000002-00000004-00000201-00000003 [SL 01]
CPUID 0000000C: 00000000-00000000-00000000-00000000
CPUID 0000000D: 00000007-00000340-00000340-00000000 [SL 00] [x87]
CPUID 0000000D: 00000001-00000000-00000000-00000000 [SL 01] [SSE]
CPUID 0000000D: 00000100-00000240-00000000-00000000 [SL 02] [AVX]
CPUID 80000000: 80000008-00000000-00000000-00000000
CPUID 80000001: 00000000-00000000-00000121-2C100800
CPUID 80000002: 20202020-20202020-20202020-485A2020 [              ZH]
CPUID 80000003: 49584F41-614B204E-61695869-584B206E [AOXIN KaiXian KX]
CPUID 80000004: 3436362D-40414D30-2B322E32-007A4847 [-6640MA@2.2+GHz]
CPUID 80000005: 04200420-06600660-20080140-20080140 [L1D: 32 KB / L1I: 32 KB]
CPUID 80000006: 00000000-00000000-10008140-00000000 [L2: 4096 KB] / L3: 0 KB]
CPUID 80000007: 00000000-00000000-00000000-00000100
CPUID 80000008: 00003028-00000000-00000000-00000000
CPUID C0000000: C0000004-00000000-00000000-00000000
CPUID C0000001: 000307B0-00000000-00000000-1EC13DFC
CPUID C0000002: 00000000-00000000-00000000-00000000
CPUID C0000003: 00000000-00000000-00000000-00000000
CPUID C0000004: 0000004D-180034AA-186F34AA-00000000

L1    Data Cache:    32 KB,  8-way Associative, 64-byte Line
L1  Instr. Cache:    32 KB,  8-way Associative, 64-byte Line
L2 Unified Cache:     4 MB, 16-way Associative, 64-byte Line

------[ All CPUs ]------

CPU   0: APICID    0 / Package 0 / Core   0 / Thread 0: Valid
CPU   1: APICID    1 / Package 0 / Core   1 / Thread 0: Valid
CPU   2: APICID    2 / Package 0 / Core   2 / Thread 0: Valid
CPU   3: APICID    3 / Package 0 / Core   3 / Thread 0: Valid

------[ MSR Registers / Logical CPU #0 ]------

MSR 0000001B: 0000-0000-FEE0-0900
MSR 0000002A: 0000-0000-0D00-0000
MSR 0000003A: 0000-0000-0000-0005
MSR 00000048: 0000-0000-0000-0000
MSR 00000049: 0000-0000-0000-0001
MSR 0000008B: 0000-720E-0000-0000
MSR 000000CD: 0000-0000-0000-0005
MSR 00000198: 186F-34AA-1800-34AA [S200]
MSR 00000198: 186F-34AA-1830-32A6 [S200]
MSR 00000198: 186F-34AA-1830-33AA
MSR 00000199: 0000-0000-0000-34AA
MSR 0000019A: 0000-0000-0000-0002
MSR 0000019B: 0000-0000-0000-0000
MSR 0000019C: 0000-0000-8818-0000 [S200]
MSR 0000019C: 0000-0000-8820-0000 [S200]
MSR 0000019C: 0000-0000-881E-0000
MSR 0000019D: 0000-0000-0000-0000
MSR 000001A0: 0000-0000-0095-3C89
MSR 00000480: 00D8-0400-0000-0007
MSR 00000481: 0000-003F-0000-0016
MSR 00000482: FFF9-FFFE-0401-E172
MSR 00000483: 003F-FFFF-0003-6DFF
MSR 00000484: 0000-FFFF-0000-11FF
MSR 00000485: 0000-0000-0004-01E0
MSR 00000486: 0000-0000-8000-0021
MSR 00000487: 0000-0000-FFFF-FFFF
MSR 00000488: 0000-0000-0000-2000
MSR 00000489: 0000-0000-0017-6FFF
MSR 0000048A: 0000-0000-0000-002A
MSR 0000048B: 0000-3CEE-0000-0000
MSR 0000048C: 0000-0F01-0613-4141
MSR 0000048D: 0000-003F-0000-0016
MSR 0000048E: FFF9-FFFE-0400-6172
MSR 0000048F: 003F-FFFF-0003-6DFB
MSR 00000490: 0000-FFFF-0000-11FB
MSR 00001107: 0FC6-037D-3C34-030E
MSR 00001140: 0000-0000-0000-0000
MSR 00001141: 0000-0000-0000-0000
MSR 00001142: 0000-0000-0000-0000
MSR 00001152: 0000-0000-0000-0000
MSR 00001153: 0000-0000-0000-0000
MSR 00001154: 0000-0000-0000-0000
MSR 00001160: 0000-0000-0000-0000
MSR 00001161: 0000-0000-0000-0000
MSR 00001164: 0000-0000-0000-0000
MSR 00001165: 0000-0000-0000-0000
MSR 00001166: 0000-0000-0000-0000
MSR 00001167: 0000-0000-0000-0000
MSR 00001168: 0000-0000-0000-0000
MSR 0000116A: 0000-0000-0000-0000
MSR 0000116B: 0000-0000-0000-0000
MSR 0000116C: 0000-0000-0000-0000
MSR 00001203: 0000-0000-0000-0018
MSR 0000120E: 0180-0700-0000-2000
MSR 00001234: 0000-0000-0000-0000
MSR 00001246: 0000-0000-0000-0000
MSR 00001406: 0000-0000-C840-C800
MSR 00001407: 0000-0000-2A75-8090
MSR 00001423: 0000-0000-0000-004B
MSR 00001424: 0038-F800-03F0-004B
MSR 00001425: 0000-0000-0000-0000
MSR 00001435: 0000-0000-0800-185B
MSR 00001466: 0000-0018-0000-006F

------[ MSR Registers / Logical CPU #1 ]------

MSR 0000001B: 0000-0000-FEE0-0800
MSR 0000002A: 0000-0000-0D00-0000
MSR 0000003A: 0000-0000-0000-0005
MSR 00000048: 0000-0000-0000-0000
MSR 00000049: 0000-0000-0000-0001
MSR 0000008B: 0000-720E-0000-0000
MSR 000000CD: 0000-0000-0000-0005
MSR 00000198: 186F-34AA-1800-34AA
MSR 00000199: 0000-0000-0000-34AA
MSR 0000019A: 0000-0000-0000-0002
MSR 0000019B: 0000-0000-0000-0000
MSR 0000019C: 0000-0000-881E-0000
MSR 0000019D: 0000-0000-0000-0000
MSR 000001A0: 0000-0000-0095-3C89
MSR 00000480: 00D8-0400-0000-0007
MSR 00000481: 0000-003F-0000-0016
MSR 00000482: FFF9-FFFE-0401-E172
MSR 00000483: 003F-FFFF-0003-6DFF
MSR 00000484: 0000-FFFF-0000-11FF
MSR 00000485: 0000-0000-0004-01E0
MSR 00000486: 0000-0000-8000-0021
MSR 00000487: 0000-0000-FFFF-FFFF
MSR 00000488: 0000-0000-0000-2000
MSR 00000489: 0000-0000-0017-6FFF
MSR 0000048A: 0000-0000-0000-002A
MSR 0000048B: 0000-3CEE-0000-0000
MSR 0000048C: 0000-0F01-0613-4141
MSR 0000048D: 0000-003F-0000-0016
MSR 0000048E: FFF9-FFFE-0400-6172
MSR 0000048F: 003F-FFFF-0003-6DFB
MSR 00000490: 0000-FFFF-0000-11FB
MSR 00001107: 0FC6-037D-3C34-030E
MSR 00001140: 0000-0000-0000-0000
MSR 00001141: 0000-0000-0000-0000
MSR 00001142: 0000-0000-0000-0000
MSR 00001152: 0000-0000-0000-0000
MSR 00001153: 0000-0000-0000-0000
MSR 00001154: 0000-0000-0000-0000
MSR 00001160: 0000-0000-0000-0000
MSR 00001161: 0000-0000-0000-0000
MSR 00001164: 0000-0000-0000-0000
MSR 00001165: 0000-0000-0000-0000
MSR 00001166: 0000-0000-0000-0000
MSR 00001167: 0000-0000-0000-0000
MSR 00001168: 0000-0000-0000-0000
MSR 0000116A: 0000-0000-0000-0000
MSR 0000116B: 0000-0000-0000-0000
MSR 0000116C: 0000-0000-0000-0000
MSR 00001203: 0000-0000-0000-0018
MSR 0000120E: 0180-0700-0000-2000
MSR 00001234: 0000-0000-0000-0000
MSR 00001246: 0000-0000-0000-0000
MSR 00001406: 0000-0000-C840-C800
MSR 00001407: 0000-0000-2A75-8090
MSR 00001423: 0000-0000-0000-004B
MSR 00001424: 0038-F800-03F0-004B
MSR 00001425: 0000-0000-0000-0000
MSR 00001435: 0000-0000-0800-185B
MSR 00001466: 0000-0018-0000-006F

------[ MSR Registers / Logical CPU #2 ]------

MSR 0000001B: 0000-0000-FEE0-0800
MSR 0000002A: 0000-0000-0D00-0000
MSR 0000003A: 0000-0000-0000-0005
MSR 00000048: 0000-0000-0000-0000
MSR 00000049: 0000-0000-0000-0001
MSR 0000008B: 0000-720E-0000-0000
MSR 000000CD: 0000-0000-0000-0005
MSR 00000198: 186F-34AA-1800-34AA
MSR 00000199: 0000-0000-0000-34AA
MSR 0000019A: 0000-0000-0000-0002
MSR 0000019B: 0000-0000-0000-0000
MSR 0000019C: 0000-0000-881E-0000
MSR 0000019D: 0000-0000-0000-0000
MSR 000001A0: 0000-0000-0095-3C89
MSR 00000480: 00D8-0400-0000-0007
MSR 00000481: 0000-003F-0000-0016
MSR 00000482: FFF9-FFFE-0401-E172
MSR 00000483: 003F-FFFF-0003-6DFF
MSR 00000484: 0000-FFFF-0000-11FF
MSR 00000485: 0000-0000-0004-01E0
MSR 00000486: 0000-0000-8000-0021
MSR 00000487: 0000-0000-FFFF-FFFF
MSR 00000488: 0000-0000-0000-2000
MSR 00000489: 0000-0000-0017-6FFF
MSR 0000048A: 0000-0000-0000-002A
MSR 0000048B: 0000-3CEE-0000-0000
MSR 0000048C: 0000-0F01-0613-4141
MSR 0000048D: 0000-003F-0000-0016
MSR 0000048E: FFF9-FFFE-0400-6172
MSR 0000048F: 003F-FFFF-0003-6DFB
MSR 00000490: 0000-FFFF-0000-11FB
MSR 00001107: 0FC6-037D-3C34-030E
MSR 00001140: 0000-0000-0000-0000
MSR 00001141: 0000-0000-0000-0000
MSR 00001142: 0000-0000-0000-0000
MSR 00001152: 0000-0000-0000-0000
MSR 00001153: 0000-0000-0000-0000
MSR 00001154: 0000-0000-0000-0000
MSR 00001160: 0000-0000-0000-0000
MSR 00001161: 0000-0000-0000-0000
MSR 00001164: 0000-0000-0000-0000
MSR 00001165: 0000-0000-0000-0000
MSR 00001166: 0000-0000-0000-0000
MSR 00001167: 0000-0000-0000-0000
MSR 00001168: 0000-0000-0000-0000
MSR 0000116A: 0000-0000-0000-0000
MSR 0000116B: 0000-0000-0000-0000
MSR 0000116C: 0000-0000-0000-0000
MSR 00001203: 0000-0000-0000-0018
MSR 0000120E: 0180-0700-0000-2000
MSR 00001234: 0000-0000-0000-0000
MSR 00001246: 0000-0000-0000-0000
MSR 00001406: 0000-0000-C840-C800
MSR 00001407: 0000-0000-2A75-8090
MSR 00001423: 0000-0000-0000-004B
MSR 00001424: 0038-F800-03F0-004B
MSR 00001425: 0000-0000-0000-0000
MSR 00001435: 0000-0000-0800-185B
MSR 00001466: 0000-0018-0000-006F

------[ MSR Registers / Logical CPU #3 ]------

MSR 0000001B: 0000-0000-FEE0-0800
MSR 0000002A: 0000-0000-0D00-0000
MSR 0000003A: 0000-0000-0000-0005
MSR 00000048: 0000-0000-0000-0000
MSR 00000049: 0000-0000-0000-0001
MSR 0000008B: 0000-720E-0000-0000
MSR 000000CD: 0000-0000-0000-0005
MSR 00000198: 186F-34AA-1800-34AA
MSR 00000199: 0000-0000-0000-34AA
MSR 0000019A: 0000-0000-0000-0002
MSR 0000019B: 0000-0000-0000-0000
MSR 0000019C: 0000-0000-881E-0000
MSR 0000019D: 0000-0000-0000-0000
MSR 000001A0: 0000-0000-0095-3C89
MSR 00000480: 00D8-0400-0000-0007
MSR 00000481: 0000-003F-0000-0016
MSR 00000482: FFF9-FFFE-0401-E172
MSR 00000483: 003F-FFFF-0003-6DFF
MSR 00000484: 0000-FFFF-0000-11FF
MSR 00000485: 0000-0000-0004-01E0
MSR 00000486: 0000-0000-8000-0021
MSR 00000487: 0000-0000-FFFF-FFFF
MSR 00000488: 0000-0000-0000-2000
MSR 00000489: 0000-0000-0017-6FFF
MSR 0000048A: 0000-0000-0000-002A
MSR 0000048B: 0000-3CEE-0000-0000
MSR 0000048C: 0000-0F01-0613-4141
MSR 0000048D: 0000-003F-0000-0016
MSR 0000048E: FFF9-FFFE-0400-6172
MSR 0000048F: 003F-FFFF-0003-6DFB
MSR 00000490: 0000-FFFF-0000-11FB
MSR 00001107: 0FC6-037D-3C34-030E
MSR 00001140: 0000-0000-0000-0000
MSR 00001141: 0000-0000-0000-0000
MSR 00001142: 0000-0000-0000-0000
MSR 00001152: 0000-0000-0000-0000
MSR 00001153: 0000-0000-0000-0000
MSR 00001154: 0000-0000-0000-0000
MSR 00001160: 0000-0000-0000-0000
MSR 00001161: 0000-0000-0000-0000
MSR 00001164: 0000-0000-0000-0000
MSR 00001165: 0000-0000-0000-0000
MSR 00001166: 0000-0000-0000-0000
MSR 00001167: 0000-0000-0000-0000
MSR 00001168: 0000-0000-0000-0000
MSR 0000116A: 0000-0000-0000-0000
MSR 0000116B: 0000-0000-0000-0000
MSR 0000116C: 0000-0000-0000-0000
MSR 00001203: 0000-0000-0000-0018
MSR 0000120E: 0180-0700-0000-2000
MSR 00001234: 0000-0000-0000-0000
MSR 00001246: 0000-0000-0000-0000
MSR 00001406: 0000-0000-C840-C800
MSR 00001407: 0000-0000-2A75-8090
MSR 00001423: 0000-0000-0000-004B
MSR 00001424: 0038-F800-03F0-004B
MSR 00001425: 0000-0000-0000-0000
MSR 00001435: 0000-0000-0800-185B
MSR 00001466: 0000-0018-0000-006F
