------[ Versions ]------

Program Version : AIDA64 v1.70.1424 Beta
BenchDLL Version: 2.7.371-x32

------[ CPU Info ]------

CPU Type           : QuadCore VIA QuadCore L4700, 1466 MHz (5.5 x 267)
CPU Alias          : Isaiah CNQ
CPU Platform       : NanoBGA2
CPU Stepping       : A1
Instruction Set    : x86, x86-64, MMX, SSE, SSE2, SSE3, SSSE3, SSE4.1
CPUID Manufacturer : CentaurHauls
CPUID CPU Name     : VIA QuadCore L4700 @ 1.2+ GHz
CPUID Revision     : 000006FCh
Platform ID        : EAh  (NanoBGA2)

------[ Logical CPU #0 ]------

allcpu: Package 0 / Core 0 / Thread 0: Valid

CPUID 00000000: 0000000A-746E6543-736C7561-48727561
CPUID 00000001: 000006FC-00080800-008863A9-BFC9FBFF
CPUID 00000002: 02B3B001-00000000-00000000-2C04307D
CPUID 00000003: 00000000-00000000-00000000-00000000
CPUID 00000004: 1C000021-03C0003F-0000003F-00000000
CPUID 00000004: 1C000022-03C0003F-0000003F-00000000
CPUID 00000004: 1C000043-07C0003F-000001FF-00000000
CPUID 00000005: 00000040-00000040-00000003-00022220
CPUID 00000006: 00000002-00000000-00000000-00000000
CPUID 00000007: 00000000-00000000-00000000-00000000
CPUID 00000008: 00000000-00000000-00000000-00000000
CPUID 00000009: 00000000-00000000-00000000-00000000
CPUID 0000000A: 06280202-00000000-00000000-00000503
CPUID 80000000: 80000008-00000000-00000000-00000000
CPUID 80000001: 00000000-00000000-00000001-20100800
CPUID 80000002: 20202020-20202020-20202020-20202020
CPUID 80000003: 49562020-75512041-6F436461-4C206572
CPUID 80000004: 30303734-31204020-202B322E-007A4847
CPUID 80000005: 00000000-08800880-40100140-40100140
CPUID 80000006: 00000000-00000000-04008140-00000000
CPUID 80000007: 00000000-00000000-00000000-00000000
CPUID 80000008: 00003024-00000000-00000000-00000000
CPUID C0000000: C0000004-00000000-00000000-00000000
CPUID C0000001: 000006FC-00000000-00000000-1EC33DCC
CPUID C0000002: 00000000-00000000-00000000-00000000
CPUID C0000003: 00000000-00000000-00000000-00000000
CPUID C0000004: 0000001F-08000B67-08540B66-00000000

L1    Data Cache:     64 KB, 16-way Associative, 64-byte Line
L1  Instr. Cache:     64 KB, 16-way Associative, 64-byte Line
L2 Unified Cache:   1024 KB, 32-way Associative, 64-byte Line

------[ Logical CPU #1 ]------

allcpu: Package 0 / Core 1 / Thread 0: Valid

CPUID 00000000: 0000000A-746E6543-736C7561-48727561
CPUID 00000001: 000006FC-02080800-008863A9-BFC9FBFF
CPUID 00000002: 02B3B001-00000000-00000000-2C04307D
CPUID 00000003: 00000000-00000000-00000000-00000000
CPUID 00000004: 1C000021-03C0003F-0000003F-00000000
CPUID 00000004: 1C000022-03C0003F-0000003F-00000000
CPUID 00000004: 1C000043-07C0003F-000001FF-00000000
CPUID 00000005: 00000040-00000040-00000003-00022220
CPUID 00000006: 00000002-00000000-00000000-00000000
CPUID 00000007: 00000000-00000000-00000000-00000000
CPUID 00000008: 00000000-00000000-00000000-00000000
CPUID 00000009: 00000000-00000000-00000000-00000000
CPUID 0000000A: 06280202-00000000-00000000-00000503
CPUID 80000000: 80000008-00000000-00000000-00000000
CPUID 80000001: 00000000-00000000-00000001-20100800
CPUID 80000002: 20202020-20202020-20202020-20202020
CPUID 80000003: 49562020-75512041-6F436461-4C206572
CPUID 80000004: 30303734-31204020-202B322E-007A4847
CPUID 80000005: 00000000-08800880-40100140-40100140
CPUID 80000006: 00000000-00000000-04008140-00000000
CPUID 80000007: 00000000-00000000-00000000-00000000
CPUID 80000008: 00003024-00000000-00000000-00000000
CPUID C0000000: C0000004-00000000-00000000-00000000
CPUID C0000001: 000006FC-00000000-00000000-1EC33DCC
CPUID C0000002: 00000000-00000000-00000000-00000000
CPUID C0000003: 00000000-00000000-00000000-00000000
CPUID C0000004: 0000001E-08000B67-08540B66-00000000

L1    Data Cache:     64 KB, 16-way Associative, 64-byte Line
L1  Instr. Cache:     64 KB, 16-way Associative, 64-byte Line
L2 Unified Cache:   1024 KB, 32-way Associative, 64-byte Line

------[ Logical CPU #2 ]------

allcpu: Package 0 / Core 2 / Thread 0: Valid

CPUID 00000000: 0000000A-746E6543-736C7561-48727561
CPUID 00000001: 000006FC-04080800-008863A9-BFC9FBFF
CPUID 00000002: 02B3B001-00000000-00000000-2C04307D
CPUID 00000003: 00000000-00000000-00000000-00000000
CPUID 00000004: 1C000021-03C0003F-0000003F-00000000
CPUID 00000004: 1C000022-03C0003F-0000003F-00000000
CPUID 00000004: 1C000043-07C0003F-000001FF-00000000
CPUID 00000005: 00000040-00000040-00000003-00022220
CPUID 00000006: 00000002-00000000-00000000-00000000
CPUID 00000007: 00000000-00000000-00000000-00000000
CPUID 00000008: 00000000-00000000-00000000-00000000
CPUID 00000009: 00000000-00000000-00000000-00000000
CPUID 0000000A: 06280202-00000000-00000000-00000503
CPUID 80000000: 80000008-00000000-00000000-00000000
CPUID 80000001: 00000000-00000000-00000001-20100800
CPUID 80000002: 20202020-20202020-20202020-20202020
CPUID 80000003: 49562020-75512041-6F436461-4C206572
CPUID 80000004: 30303734-31204020-202B322E-007A4847
CPUID 80000005: 00000000-08800880-40100140-40100140
CPUID 80000006: 00000000-00000000-04008140-00000000
CPUID 80000007: 00000000-00000000-00000000-00000000
CPUID 80000008: 00003024-00000000-00000000-00000000
CPUID C0000000: C0000004-00000000-00000000-00000000
CPUID C0000001: 000006FC-00000000-00000000-1EC33DCC
CPUID C0000002: 00000000-00000000-00000000-00000000
CPUID C0000003: 00000000-00000000-00000000-00000000
CPUID C0000004: 0000001E-08000B67-08540B66-00000000

L1    Data Cache:     64 KB, 16-way Associative, 64-byte Line
L1  Instr. Cache:     64 KB, 16-way Associative, 64-byte Line
L2 Unified Cache:   1024 KB, 32-way Associative, 64-byte Line

------[ Logical CPU #3 ]------

allcpu: Package 0 / Core 3 / Thread 0: Valid

CPUID 00000000: 0000000A-746E6543-736C7561-48727561
CPUID 00000001: 000006FC-06080800-008863A9-BFC9FBFF
CPUID 00000002: 02B3B001-00000000-00000000-2C04307D
CPUID 00000003: 00000000-00000000-00000000-00000000
CPUID 00000004: 1C000021-03C0003F-0000003F-00000000
CPUID 00000004: 1C000022-03C0003F-0000003F-00000000
CPUID 00000004: 1C000043-07C0003F-000001FF-00000000
CPUID 00000005: 00000040-00000040-00000003-00022220
CPUID 00000006: 00000002-00000000-00000000-00000000
CPUID 00000007: 00000000-00000000-00000000-00000000
CPUID 00000008: 00000000-00000000-00000000-00000000
CPUID 00000009: 00000000-00000000-00000000-00000000
CPUID 0000000A: 06280202-00000000-00000000-00000503
CPUID 80000000: 80000008-00000000-00000000-00000000
CPUID 80000001: 00000000-00000000-00000001-20100800
CPUID 80000002: 20202020-20202020-20202020-20202020
CPUID 80000003: 49562020-75512041-6F436461-4C206572
CPUID 80000004: 30303734-31204020-202B322E-007A4847
CPUID 80000005: 00000000-08800880-40100140-40100140
CPUID 80000006: 00000000-00000000-04008140-00000000
CPUID 80000007: 00000000-00000000-00000000-00000000
CPUID 80000008: 00003024-00000000-00000000-00000000
CPUID C0000000: C0000004-00000000-00000000-00000000
CPUID C0000001: 000006FC-00000000-00000000-1EC33DCC
CPUID C0000002: 00000000-00000000-00000000-00000000
CPUID C0000003: 00000000-00000000-00000000-00000000
CPUID C0000004: 0000001E-08000B67-08540B66-00000000

L1    Data Cache:     64 KB, 16-way Associative, 64-byte Line
L1  Instr. Cache:     64 KB, 16-way Associative, 64-byte Line
L2 Unified Cache:   1024 KB, 32-way Associative, 64-byte Line

------[ All CPUs ]------

CPU   0: APICID   0 / Package 0 / Core  0 / Thread 0: Valid
CPU   1: APICID   2 / Package 0 / Core  1 / Thread 0: Valid
CPU   2: APICID   4 / Package 0 / Core  2 / Thread 0: Valid
CPU   3: APICID   6 / Package 0 / Core  3 / Thread 0: Valid

------[ MSR Registers ]------

MSR 0000001B: 0000-0000-FEE0-0900
MSR 0000002A: 0000-0000-02C0-0000
MSR 000000CD: 0000-0000-0000-0000
MSR 00000198: 0854-0B66-0800-0B67
MSR 00000199: 0000-0000-0000-0B66
MSR 0000019A: 0000-0000-0000-0002
MSR 0000019B: 0000-0000-0000-0000
MSR 0000019C: 0000-0000-884C-0000
MSR 0000019D: 0000-0000-0000-0854
MSR 000001A0: 0000-0000-0017-3C89
MSR 00001153: 0000-0000-0000-0000
MSR 00001154: 0000-0000-0000-0000

PerformanceFrequency = 14318180

Tjmax Temperature = 0 Celsius

APIC Clock = 266.68 MHz
APIC Clock = 266.68 MHz
APIC Clock = 266.68 MHz
APIC Clock = 266.68 MHz
APIC Clock = 266.69 MHz
