------[ Versions ]------

Program Version : EVEREST v5.00.1677 Beta
BenchDLL Version: 2.4.258.0

------[ CPU Info ]------

CPU Type           : Mobile VIA Nano-M, 1616 MHz (8 x 202)
CPU Alias          : Isaiah
Instruction Set    : x86, x86-64, MMX, SSE, SSE2, SSE3, SSSE3
CPUID Manufacturer : CentaurHauls
CPUID CPU Name     : VIA Nano processor L2200@1600MHz
CPUID Revision     : 000006F2h
Platform ID        : 00h  (Unknown)

------[ Logical CPU #0 ]------

allcpu: Valid

CPUID 00000000: 0000000A-746E6543-736C7561-48727561
CPUID 00000001: 000006F2-00010800-000063A9-AFC9FBFF
CPUID 00000002: 02B3B001-00000000-00000000-2C04307D
CPUID 00000003: 00000000-00000000-00000000-00000000
CPUID 00000005: 00000040-00000040-00000003-00022220
CPUID 00000006: 00000000-00000000-00000000-00000000
CPUID 00000007: 00000000-00000000-00000000-00000000
CPUID 00000008: 00000000-00000000-00000000-00000000
CPUID 00000009: 00000000-00000000-00000000-00000000
CPUID 0000000A: 06280302-00000000-00000000-00000503
CPUID 80000000: 80000008-00000000-00000000-00000000
CPUID 80000001: 00000000-00000000-00000001-2A100800
CPUID 80000002: 20202020-20202020-20202020-56202020
CPUID 80000003: 4E204149-206F6E61-636F7270-6F737365
CPUID 80000004: 324C2072-40303032-30303631-007A484D
CPUID 80000005: 00000000-08800880-40100140-40100140
CPUID 80000006: 00000000-00000000-04008140-00000000
CPUID 80000007: 00000000-00000000-00000000-00000000
CPUID 80000008: 00003028-00000000-00000000-00000000
CPUID C0000000: C0000004-00000000-00000000-00000000
CPUID C0000001: 000006F2-00000000-00000000-00070DCC
CPUID C0000002: 00000000-00000000-00000000-00000000
CPUID C0000003: 00000000-00000000-00000000-00000000
CPUID C0000004: 0000002C-0800101A-080D101A-00000000

------[ MSR Registers ]------

MSR 0000002A: 0000-0000-0400-0000
MSR 000000CD: 0000-0000-0000-0002
MSR 00000198: 080D-101A-0800-101A
MSR 00000199: 0000-0000-0800-101A
MSR 0000019A: 0000-0000-0000-0002
MSR 0000019B: 0000-0000-0000-0000
MSR 0000019C: 0000-0000-883E-0000
MSR 0000019D: 0000-0000-0000-080D
MSR 00001153: 0000-0000-0000-0000
MSR 00001154: 0000-0000-0000-0000

PerformanceFrequency = 3579545

Tjmax Temperature = 0 Celsius
