------[ Versions ]------

Program Version : AIDA64 Engineer v6.00.5112 Beta
BenchDLL Version: 4.4.800-x64
Windows Version : Microsoft Windows 7 Ultimate 6.1.7601.24475 Service Pack 1 (64-bit)

------[ CPU Info ]------

CPU Type          : QuadCore Zhaoxin KaiXian ZX-C+ C4580, 1833 MHz (5.5 x 333)
CPU Alias         : Zhangjiang
CPU Platform      : NanoBGA2
Instruction Set   : x86, x86-64, MMX, SSE, SSE2, SSE3, SSSE3, SSE4.1, SSE4.2, AVX, AVX2, AES
CPUID Manufacturer: CentaurHauls
CPUID CPU Name    : ZHAOXIN KaiXian ZX-C+ C4580@1.83GHz
CPUID Revision    : 000006FEh
Platform ID       : F5h  (NanoBGA2)
HTT / CMP Units   : 0 / 4
Max. NUMA Node    : 0

Tjmax Temperature    : 0 Celsius
HTC Temperature Limit: 0 Celsius

------[ Motherboard Info ]------

Motherboard ID      : 63-0100-000001-00101111-041312-Chipset$09238002_BIOS DATE: 05/30/18 09:21:22 VER: 04.06.05
Motherboard Model   : Evoc EC9-1501-ZX
Motherboard Chipset : Zhaoxin ZX-100S

DMI MB Manufacturer : EVOC
DMI MB Product      : EC9-1501-ZX
DMI MB Version      : C01
DMI MB Serial       : To be filled by O.E.M.
DMI SYS Manufacturer: EVOC
DMI SYS Product     : EC9-1501-ZX
DMI SYS Version     : BIOS Name:09238006 BIOS Version:C01 Build Date:05/30/2018 09:21:
DMI SYS Serial      : To be filled by O.E.M.
DMI BIOS Version    : 4.6.5


------[ Logical CPU #0 ]------

allcpu: Package 0 / Core 0 / Thread 0: Valid

CPUID 00000000: 0000000D-746E6543-736C7561-48727561 [CentaurHauls]
CPUID 00000001: 000006FE-00040800-76DA63AB-BFCBFBFF
CPUID 00000002: 00000001-00000000-00000000-00000000
CPUID 00000003: 00000000-00000000-00000000-00000000
CPUID 00000004: 0C000121-01C0003F-0000003F-00000000 [SL 00] [L1D: 32 KB]
CPUID 00000004: 0C000122-01C0003F-0000003F-00000000 [SL 01] [L1I: 32 KB]
CPUID 00000004: 0C00C143-03C0003F-000007FF-00000000 [SL 02] [L2U: 2 MB]
CPUID 00000005: 00000040-00000040-00000003-00022220
CPUID 00000006: 00000003-00000000-00000000-00000000
CPUID 00000007: 00000000-000C25AB-00000000-00000000
CPUID 00000008: 00000000-00000000-00000000-00000000
CPUID 00000009: 00000000-00000000-00000000-00000000
CPUID 0000000A: 06280202-00000000-00000000-00000503
CPUID 0000000B: 00000000-00000001-00000100-00000000 [SL 00]
CPUID 0000000B: 00000002-00000004-00000201-00000000 [SL 01]
CPUID 0000000C: 00000000-00000000-00000000-00000000
CPUID 0000000D: 00000007-00000240-00000340-00000000 [SL 00] [x87]
CPUID 0000000D: 00000001-00000000-00000000-00000000 [SL 01] [SSE]
CPUID 0000000D: 00000100-00000240-00000000-00000000 [SL 02] [AVX]
CPUID 80000000: 80000008-00000000-00000000-00000000
CPUID 80000001: 00000000-00000000-00000121-2C100800
CPUID 80000002: 20202020-20202020-20202020-4F41485A [            ZHAO]
CPUID 80000003: 204E4958-5869614B-206E6169-432D585A [XIN KaiXian ZX-C]
CPUID 80000004: 3443202B-40303835-33382E31-007A4847 [+ C4580@1.83GHz]
CPUID 80000005: 04200420-06600660-20080140-20080140 [L1D: 32 KB / L1I: 32 KB]
CPUID 80000006: 00000000-00000000-08008140-00000000 [L2: 2048 KB] / L3: 0 KB]
CPUID 80000007: 00000000-00000000-00000000-00000000
CPUID 80000008: 00003024-00000000-00000000-00000000
CPUID C0000000: C0000004-00000000-00000000-00000000
CPUID C0000001: 000006FE-00000000-00000000-1EC33DFC
CPUID C0000002: 00000000-00000000-00000000-00000000
CPUID C0000003: 00000000-00000000-00000000-00000000
CPUID C0000004: 00000028-08000B5C-08510B5B-00000000

L1    Data Cache:    32 KB,  8-way Associative, 64-byte Line
L1  Instr. Cache:    32 KB,  8-way Associative, 64-byte Line
L2 Unified Cache:     2 MB, 16-way Associative, 64-byte Line

------[ Logical CPU #1 ]------

allcpu: Package 0 / Core 1 / Thread 0: Valid

CPUID 00000000: 0000000D-746E6543-736C7561-48727561 [CentaurHauls]
CPUID 00000001: 000006FE-01040800-76DA63AB-BFCBFBFF
CPUID 00000002: 00000001-00000000-00000000-00000000
CPUID 00000003: 00000000-00000000-00000000-00000000
CPUID 00000004: 0C000121-01C0003F-0000003F-00000000 [SL 00] [L1D: 32 KB]
CPUID 00000004: 0C000122-01C0003F-0000003F-00000000 [SL 01] [L1I: 32 KB]
CPUID 00000004: 0C00C143-03C0003F-000007FF-00000000 [SL 02] [L2U: 2 MB]
CPUID 00000005: 00000040-00000040-00000003-00022220
CPUID 00000006: 00000003-00000000-00000000-00000000
CPUID 00000007: 00000000-000C25AB-00000000-00000000
CPUID 00000008: 00000000-00000000-00000000-00000000
CPUID 00000009: 00000000-00000000-00000000-00000000
CPUID 0000000A: 06280202-00000000-00000000-00000503
CPUID 0000000B: 00000000-00000001-00000100-00000001 [SL 00]
CPUID 0000000B: 00000002-00000004-00000201-00000001 [SL 01]
CPUID 0000000C: 00000000-00000000-00000000-00000000
CPUID 0000000D: 00000007-00000240-00000340-00000000 [SL 00] [x87]
CPUID 0000000D: 00000001-00000000-00000000-00000000 [SL 01] [SSE]
CPUID 0000000D: 00000100-00000240-00000000-00000000 [SL 02] [AVX]
CPUID 80000000: 80000008-00000000-00000000-00000000
CPUID 80000001: 00000000-00000000-00000121-2C100800
CPUID 80000002: 20202020-20202020-20202020-4F41485A [            ZHAO]
CPUID 80000003: 204E4958-5869614B-206E6169-432D585A [XIN KaiXian ZX-C]
CPUID 80000004: 3443202B-40303835-33382E31-007A4847 [+ C4580@1.83GHz]
CPUID 80000005: 04200420-06600660-20080140-20080140 [L1D: 32 KB / L1I: 32 KB]
CPUID 80000006: 00000000-00000000-08008140-00000000 [L2: 2048 KB] / L3: 0 KB]
CPUID 80000007: 00000000-00000000-00000000-00000000
CPUID 80000008: 00003024-00000000-00000000-00000000
CPUID C0000000: C0000004-00000000-00000000-00000000
CPUID C0000001: 000006FE-00000000-00000000-1EC33DFC
CPUID C0000002: 00000000-00000000-00000000-00000000
CPUID C0000003: 00000000-00000000-00000000-00000000
CPUID C0000004: 00000028-08000B5C-08510B5B-00000000

L1    Data Cache:    32 KB,  8-way Associative, 64-byte Line
L1  Instr. Cache:    32 KB,  8-way Associative, 64-byte Line
L2 Unified Cache:     2 MB, 16-way Associative, 64-byte Line

------[ Logical CPU #2 ]------

allcpu: Package 0 / Core 2 / Thread 0: Valid

CPUID 00000000: 0000000D-746E6543-736C7561-48727561 [CentaurHauls]
CPUID 00000001: 000006FE-02040800-76DA63AB-BFCBFBFF
CPUID 00000002: 00000001-00000000-00000000-00000000
CPUID 00000003: 00000000-00000000-00000000-00000000
CPUID 00000004: 0C000121-01C0003F-0000003F-00000000 [SL 00] [L1D: 32 KB]
CPUID 00000004: 0C000122-01C0003F-0000003F-00000000 [SL 01] [L1I: 32 KB]
CPUID 00000004: 0C00C143-03C0003F-000007FF-00000000 [SL 02] [L2U: 2 MB]
CPUID 00000005: 00000040-00000040-00000003-00022220
CPUID 00000006: 00000003-00000000-00000000-00000000
CPUID 00000007: 00000000-000C25AB-00000000-00000000
CPUID 00000008: 00000000-00000000-00000000-00000000
CPUID 00000009: 00000000-00000000-00000000-00000000
CPUID 0000000A: 06280202-00000000-00000000-00000503
CPUID 0000000B: 00000000-00000001-00000100-00000002 [SL 00]
CPUID 0000000B: 00000002-00000004-00000201-00000002 [SL 01]
CPUID 0000000C: 00000000-00000000-00000000-00000000
CPUID 0000000D: 00000007-00000240-00000340-00000000 [SL 00] [x87]
CPUID 0000000D: 00000001-00000000-00000000-00000000 [SL 01] [SSE]
CPUID 0000000D: 00000100-00000240-00000000-00000000 [SL 02] [AVX]
CPUID 80000000: 80000008-00000000-00000000-00000000
CPUID 80000001: 00000000-00000000-00000121-2C100800
CPUID 80000002: 20202020-20202020-20202020-4F41485A [            ZHAO]
CPUID 80000003: 204E4958-5869614B-206E6169-432D585A [XIN KaiXian ZX-C]
CPUID 80000004: 3443202B-40303835-33382E31-007A4847 [+ C4580@1.83GHz]
CPUID 80000005: 04200420-06600660-20080140-20080140 [L1D: 32 KB / L1I: 32 KB]
CPUID 80000006: 00000000-00000000-08008140-00000000 [L2: 2048 KB] / L3: 0 KB]
CPUID 80000007: 00000000-00000000-00000000-00000000
CPUID 80000008: 00003024-00000000-00000000-00000000
CPUID C0000000: C0000004-00000000-00000000-00000000
CPUID C0000001: 000006FE-00000000-00000000-1EC33DFC
CPUID C0000002: 00000000-00000000-00000000-00000000
CPUID C0000003: 00000000-00000000-00000000-00000000
CPUID C0000004: 00000028-08000B5C-08510B5B-00000000

L1    Data Cache:    32 KB,  8-way Associative, 64-byte Line
L1  Instr. Cache:    32 KB,  8-way Associative, 64-byte Line
L2 Unified Cache:     2 MB, 16-way Associative, 64-byte Line

------[ Logical CPU #3 ]------

allcpu: Package 0 / Core 3 / Thread 0: Valid

CPUID 00000000: 0000000D-746E6543-736C7561-48727561 [CentaurHauls]
CPUID 00000001: 000006FE-03040800-76DA63AB-BFCBFBFF
CPUID 00000002: 00000001-00000000-00000000-00000000
CPUID 00000003: 00000000-00000000-00000000-00000000
CPUID 00000004: 0C000121-01C0003F-0000003F-00000000 [SL 00] [L1D: 32 KB]
CPUID 00000004: 0C000122-01C0003F-0000003F-00000000 [SL 01] [L1I: 32 KB]
CPUID 00000004: 0C00C143-03C0003F-000007FF-00000000 [SL 02] [L2U: 2 MB]
CPUID 00000005: 00000040-00000040-00000003-00022220
CPUID 00000006: 00000003-00000000-00000000-00000000
CPUID 00000007: 00000000-000C25AB-00000000-00000000
CPUID 00000008: 00000000-00000000-00000000-00000000
CPUID 00000009: 00000000-00000000-00000000-00000000
CPUID 0000000A: 06280202-00000000-00000000-00000503
CPUID 0000000B: 00000000-00000001-00000100-00000003 [SL 00]
CPUID 0000000B: 00000002-00000004-00000201-00000003 [SL 01]
CPUID 0000000C: 00000000-00000000-00000000-00000000
CPUID 0000000D: 00000007-00000240-00000340-00000000 [SL 00] [x87]
CPUID 0000000D: 00000001-00000000-00000000-00000000 [SL 01] [SSE]
CPUID 0000000D: 00000100-00000240-00000000-00000000 [SL 02] [AVX]
CPUID 80000000: 80000008-00000000-00000000-00000000
CPUID 80000001: 00000000-00000000-00000121-2C100800
CPUID 80000002: 20202020-20202020-20202020-4F41485A [            ZHAO]
CPUID 80000003: 204E4958-5869614B-206E6169-432D585A [XIN KaiXian ZX-C]
CPUID 80000004: 3443202B-40303835-33382E31-007A4847 [+ C4580@1.83GHz]
CPUID 80000005: 04200420-06600660-20080140-20080140 [L1D: 32 KB / L1I: 32 KB]
CPUID 80000006: 00000000-00000000-08008140-00000000 [L2: 2048 KB] / L3: 0 KB]
CPUID 80000007: 00000000-00000000-00000000-00000000
CPUID 80000008: 00003024-00000000-00000000-00000000
CPUID C0000000: C0000004-00000000-00000000-00000000
CPUID C0000001: 000006FE-00000000-00000000-1EC33DFC
CPUID C0000002: 00000000-00000000-00000000-00000000
CPUID C0000003: 00000000-00000000-00000000-00000000
CPUID C0000004: 00000028-08000B5C-08510B5B-00000000

L1    Data Cache:    32 KB,  8-way Associative, 64-byte Line
L1  Instr. Cache:    32 KB,  8-way Associative, 64-byte Line
L2 Unified Cache:     2 MB, 16-way Associative, 64-byte Line

------[ All CPUs ]------

CPU   0: APICID    0 / Package 0 / Core   0 / Thread 0: Valid
CPU   1: APICID    1 / Package 0 / Core   1 / Thread 0: Valid
CPU   2: APICID    2 / Package 0 / Core   2 / Thread 0: Valid
CPU   3: APICID    3 / Package 0 / Core   3 / Thread 0: Valid

------[ MSR Registers ]------

MSR 0000001B: 0000-0000-FEE0-0900
MSR 0000002A: 0000-0000-02C0-0000
MSR 0000003A: 0000-0000-0000-0005
MSR 0000008B: 0000-0205-0000-0000
MSR 000000CD: 0000-0000-0000-0004
MSR 00000198: 0851-0B5B-0800-0B5C [S200]
MSR 00000198: 0851-0B5B-0800-0B5C [S200]
MSR 00000198: 0851-0B5B-0800-0B5C
MSR 00000199: 0000-0000-0000-0B5B
MSR 0000019A: 0000-0000-0000-0002
MSR 0000019B: 0000-0000-0000-0000
MSR 0000019C: 0000-0000-8842-0000 [S200]
MSR 0000019C: 0000-0000-8842-0000 [S200]
MSR 0000019C: 0000-0000-8842-0000
MSR 0000019D: 0000-0000-0000-0851
MSR 000001A0: 0000-0000-0095-3C89
MSR 00000480: 00D8-0400-0000-0007
MSR 00000481: 0000-003F-0000-0016
MSR 00000482: FFF9-FFFE-0401-E172
MSR 00000483: 003F-FFFF-0003-6DFF
MSR 00000484: 0000-FFFF-0000-11FF
MSR 00000485: 0000-0000-0004-01E0
MSR 00000486: 0000-0000-8000-0021
MSR 00000487: 0000-0000-FFFF-FFFF
MSR 00000488: 0000-0000-0000-2000
MSR 00000489: 0000-0000-0037-27FF
MSR 0000048A: 0000-0000-0000-002A
MSR 0000048B: 0000-1CFE-0000-0000
MSR 0000048C: 0000-0F01-0613-4141
MSR 0000048D: 0000-003F-0000-0016
MSR 0000048E: FFF9-FFFE-0400-6172
MSR 0000048F: 003F-FFFF-0003-6DFB
MSR 00000490: 0000-FFFF-0000-11FB
MSR 00001107: 0FC6-037D-3C34-030E
MSR 00001140: 0000-0000-0000-0000
MSR 00001141: 0000-0000-0000-0000
MSR 00001142: 0000-0000-0000-0000
MSR 00001152: 0000-0000-0000-0000
MSR 00001153: 0000-0000-0000-0000
MSR 00001154: 0000-0000-0000-0000
MSR 00001160: 0000-0000-0000-0000
MSR 00001161: 0000-0000-0000-0000
MSR 00001164: 0000-0000-0000-0000
MSR 00001165: 0000-0000-0000-0000
MSR 00001166: 0000-0000-0000-0000
MSR 00001167: 0000-0000-0000-0000
MSR 00001168: 0000-0000-0000-0000
MSR 0000116A: 0000-0000-0000-0000
MSR 0000116B: 0000-0000-0000-0000
MSR 0000116C: 0000-0000-0000-0000
MSR 00001203: 0000-0040-0000-0018
MSR 0000120E: 0180-0700-0000-2100
MSR 00001234: 0000-0000-0000-0000
MSR 00001246: 0000-0000-0000-0000
MSR 00001406: 0000-0000-EA62-A800
MSR 00001407: 0000-0000-2A75-A090
MSR 00001423: 0000-0000-0000-0027
MSR 00001424: 0070-3000-0F30-0027
MSR 00001425: 0000-0000-0000-0000
MSR 00001435: 0000-0000-0800-0847
MSR 00001466: 0000-0008-0000-0051

PerformanceFrequency = 14318180

CPU Clock M.Method = 2  (TSC PMT)
PM Timer Address   = 2056  (0808h)

APIC Clock = 332.50 MHz  (AT = 174202 / TT = 15003 / try = 1 / SKL = 0.00 MHz)
APIC Clock = 332.51 MHz  (AT = 174193 / TT = 15002 / try = 1 / SKL = 0.00 MHz)
APIC Clock = 332.50 MHz  (AT = 174202 / TT = 15003 / try = 1 / SKL = 0.00 MHz)
APIC Clock = 332.51 MHz  (AT = 174195 / TT = 15002 / try = 1 / SKL = 0.00 MHz)
APIC Clock = 332.50 MHz  (AT = 174191 / TT = 15002 / try = 1 / SKL = 0.00 MHz)

CPU Clock = 1828.78 MHz / TSC Clock = 1828.78 MHz / CPU Mul =  5.50x
CPU Clock = 1828.77 MHz / TSC Clock = 1828.77 MHz / CPU Mul =  5.50x
CPU Clock = 1828.76 MHz / TSC Clock = 1828.76 MHz / CPU Mul =  5.50x
CPU Clock = 1828.76 MHz / TSC Clock = 1828.76 MHz / CPU Mul =  5.50x
CPU Clock = 1828.75 MHz / TSC Clock = 1828.75 MHz / CPU Mul =  5.50x

CPU Clock Max = 1828.74 MHz / TSC Clock = 1828.74 MHz / CPU Mul =  5.50x
CPU Clock Max = 1828.74 MHz / TSC Clock = 1828.74 MHz / CPU Mul =  5.50x
CPU Clock Max = 1828.73 MHz / TSC Clock = 1828.73 MHz / CPU Mul =  5.50x
CPU Clock Max = 1828.76 MHz / TSC Clock = 1828.76 MHz / CPU Mul =  5.50x
CPU Clock Max = 1828.75 MHz / TSC Clock = 1828.75 MHz / CPU Mul =  5.50x

------[ APIC Base at 00000000-FEE00000 ]------

  0000  D1 02 60 00 00 00 00 00 E3 02 60 00 00 00 00 00 
  0010  00 20 F0 02 00 00 00 00 00 20 F0 02 00 00 00 00 
  0020  00 00 00 00 00 00 00 00 00 00 00 00 00 00 00 00 
  0030  15 00 05 01 00 00 00 00 15 00 05 01 00 00 00 00 
  0040  00 00 00 00 00 00 00 00 00 00 00 00 00 00 00 00 
  0050  FF 00 02 30 00 00 00 00 FF 00 02 30 00 00 00 00 
  0060  33 00 31 00 00 00 00 00 33 00 31 00 00 00 00 00 
  0070  00 00 00 00 00 00 00 00 00 00 00 00 00 00 00 00 
  0080  00 00 00 00 00 00 00 00 00 00 00 00 00 00 00 00 
  0090  00 00 00 00 00 00 00 00 00 00 00 00 00 00 00 00 
  00A0  00 00 00 00 00 00 00 00 00 00 00 00 00 00 00 00 
  00B0  00 00 00 00 00 00 00 00 00 00 00 00 00 00 00 00 
  00C0  00 00 00 00 00 00 00 00 00 00 00 00 00 00 00 00 
  00D0  00 00 00 01 00 00 00 00 00 00 00 01 00 00 00 00 
  00E0  FF FF FF FF 00 00 00 00 FF FF FF FF 00 00 00 00 
  00F0  3F 01 00 00 00 00 00 00 3F 01 00 00 00 00 00 00 
  0100  00 00 00 00 00 00 00 00 00 00 00 00 00 00 00 00 
  0110  00 00 00 00 00 00 00 00 00 00 00 00 00 00 00 00 
  0120  00 00 00 00 00 00 00 00 00 00 00 00 00 00 00 00 
  0130  00 00 00 00 00 00 00 00 00 00 00 00 00 00 00 00 
  0140  00 00 00 00 00 00 00 00 00 00 00 00 00 00 00 00 
  0150  00 00 00 00 00 00 00 00 00 00 00 00 00 00 00 00 
  0160  00 00 00 00 00 00 00 00 00 00 00 00 00 00 00 00 
  0170  00 00 00 00 00 00 00 00 00 00 00 00 00 00 00 00 
  0180  00 00 00 00 00 00 00 00 00 00 00 00 00 00 00 00 
  0190  00 00 00 00 00 00 00 00 00 00 00 00 00 00 00 00 
  01A0  00 00 04 00 00 00 00 00 00 00 04 00 00 00 00 00 
  01B0  00 00 00 00 00 00 00 00 00 00 00 00 00 00 00 00 
  01C0  08 00 08 00 00 00 00 00 08 00 08 00 00 00 00 00 
  01D0  08 00 0A 00 00 00 00 00 08 00 0A 00 00 00 00 00 
  01E0  00 00 00 00 00 00 00 00 00 00 00 00 00 00 00 00 
  01F0  00 00 00 00 00 00 00 00 00 00 00 00 00 00 00 00 
  0200  00 00 00 00 00 00 00 00 00 00 00 00 00 00 00 00 
  0210  00 00 00 00 00 00 00 00 00 00 00 00 00 00 00 00 
  0220  00 00 00 00 00 00 00 00 00 00 00 00 00 00 00 00 
  0230  00 00 00 00 00 00 00 00 00 00 00 00 00 00 00 00 
  0240  00 00 00 00 00 00 00 00 00 00 00 00 00 00 00 00 
  0250  00 00 00 00 00 00 00 00 00 00 00 00 00 00 00 00 
  0260  00 00 00 00 00 00 00 00 00 00 00 00 00 00 00 00 
  0270  00 00 00 00 00 00 00 00 00 00 00 00 00 00 00 00 
  0280  80 00 00 00 00 00 00 00 80 00 00 00 00 00 00 00 
  0290  00 00 00 00 00 00 00 00 00 00 00 00 00 00 00 00 
  02A0  00 00 00 00 00 00 00 00 00 00 00 00 00 00 00 00 
  02B0  00 00 00 00 00 00 00 00 00 00 00 00 00 00 00 00 
  02C0  00 00 00 00 00 00 00 00 00 00 00 00 00 00 00 00 
  02D0  00 00 00 00 00 00 00 00 00 00 00 00 00 00 00 00 
  02E0  00 00 00 00 00 00 00 00 00 00 00 00 00 00 00 00 
  02F0  00 00 01 00 00 00 00 00 00 00 01 00 00 00 00 00 
  0300  2F 00 00 00 00 00 00 00 2F 00 00 00 00 00 00 00 
  0310  00 00 00 02 00 00 00 00 00 00 00 02 00 00 00 00 
  0320  FD 00 03 00 00 00 00 00 FD 00 03 00 00 00 00 00 
  0330  00 00 01 00 00 00 00 00 00 00 01 00 00 00 00 00 
  0340  FE 00 00 00 00 00 00 00 FE 00 00 00 00 00 00 00 
  0350  3F 00 01 00 00 00 00 00 3F 00 01 00 00 00 00 00 
  0360  FF 04 00 00 00 00 00 00 FF 04 00 00 00 00 00 00 
  0370  E3 00 00 00 00 00 00 00 E3 00 00 00 00 00 00 00 
  0380  00 00 00 00 00 00 00 00 00 00 00 00 00 00 00 00 
  0390  00 00 00 00 00 00 00 00 00 00 00 00 00 00 00 00 
  03A0  00 00 00 00 00 00 00 00 00 00 00 00 00 00 00 00 
  03B0  00 00 00 00 00 00 00 00 00 00 00 00 00 00 00 00 
  03C0  00 00 00 00 00 00 00 00 00 00 00 00 00 00 00 00 
  03D0  00 00 00 00 00 00 00 00 00 00 00 00 00 00 00 00 
  03E0  0B 00 00 00 00 00 00 00 0B 00 00 00 00 00 00 00 
  03F0  2F 00 00 00 00 00 00 00 2F 00 00 00 00 00 00 00 
