CPUID Registers (CPU #0):
CPUID 00000000  	00000010-68747541-444D4163-69746E65 [AuthenticAMD]
CPUID 00000001  	008A0F00-00080800-7EF8320B-178BFBFF
CPUID 00000002  	00000000-00000000-00000000-00000000
CPUID 00000003  	00000000-00000000-00000000-00000000
CPUID 00000005  	00000040-00000040-00000003-00000011
CPUID 00000006  	00000004-00000000-00000001-00000000
CPUID 00000007  	00000000-219C91A9-00400004-00000000 [SL 00]
CPUID 00000008  	00000000-00000000-00000000-00000000
CPUID 00000009  	00000000-00000000-00000000-00000000
CPUID 0000000A  	00000000-00000000-00000000-00000000
CPUID 0000000B  	00000001-00000002-00000100-00000000 [SL 00]
CPUID 0000000B  	00000007-00000008-00000201-00000000 [SL 01]
CPUID 0000000C  	00000000-00000000-00000000-00000000
CPUID 0000000D  	00000207-00000340-00000380-00000000 [SL 00]
CPUID 0000000D  	0000000F-00000340-00000000-00000000 [SL 01]
CPUID 0000000D  	00000100-00000240-00000000-00000000 [SL 02]
CPUID 0000000D  	00000040-00000340-00000000-00000000 [SL 09]
CPUID 0000000E  	00000000-00000000-00000000-00000000
CPUID 0000000F  	00000000-000000FF-00000000-00000002 [SL 00]
CPUID 0000000F  	00000000-00000040-000000FF-00000007 [SL 01]
CPUID 00000010  	00000000-00000002-00000000-00000000 [SL 00]
CPUID 00000010  	0000000F-00000000-00000004-0000000F [SL 01]
CPUID 80000000  	80000020-68747541-444D4163-69746E65 [AuthenticAMD]
CPUID 80000001  	008A0F00-10000000-75C237FF-2FD3FBFF
CPUID 80000002  	20444D41-657A7952-2033206E-30323337 [AMD Ryzen 3 7320]
CPUID 80000003  	69772055-52206874-6F656461-7247206E [U with Radeon Gr]
CPUID 80000004  	69687061-20207363-20202020-00202020 [aphics ]
CPUID 80000005  	FF40FF40-FF40FF40-20080140-20080140
CPUID 80000006  	48006400-68006400-02006140-00209140
CPUID 80000007  	00000000-0000001B-00000000-00006799
CPUID 80000008  	00003030-010CF657-00007007-00010000
CPUID 80000009  	00000000-00000000-00000000-00000000
CPUID 8000000A  	00000001-00008000-00000000-0013BCFF
CPUID 8000000B  	00000000-00000000-00000000-00000000
CPUID 8000000C  	00000000-00000000-00000000-00000000
CPUID 8000000D  	00000000-00000000-00000000-00000000
CPUID 8000000E  	00000000-00000000-00000000-00000000
CPUID 8000000F  	00000000-00000000-00000000-00000000
CPUID 80000010  	00000000-00000000-00000000-00000000
CPUID 80000011  	00000000-00000000-00000000-00000000
CPUID 80000012  	00000000-00000000-00000000-00000000
CPUID 80000013  	00000000-00000000-00000000-00000000
CPUID 80000014  	00000000-00000000-00000000-00000000
CPUID 80000015  	00000000-00000000-00000000-00000000
CPUID 80000016  	00000000-00000000-00000000-00000000
CPUID 80000017  	00000000-00000000-00000000-00000000
CPUID 80000018  	00000000-00000000-00000000-00000000
CPUID 80000019  	F040F040-00000000-00000000-00000000
CPUID 8000001A  	00000006-00000000-00000000-00000000
CPUID 8000001B  	000003FF-00000000-00000000-00000000
CPUID 8000001C  	00000000-00000000-00000000-00000000
CPUID 8000001D  	00004121-01C0003F-0000003F-00000000 [SL 00]
CPUID 8000001D  	00004122-01C0003F-0000003F-00000000 [SL 01]
CPUID 8000001D  	00004143-01C0003F-000003FF-00000002 [SL 02]
CPUID 8000001D  	0001C163-03C0003F-00000FFF-00000001 [SL 03]
CPUID 8000001E  	00000000-00000100-00000000-00000000
CPUID 8000001F  	0001000F-0000012F-0000000E-00000001
CPUID 80000020  	00000000-00000002-00000000-00000000
 
CPUID Registers (CPU #1 Virtual):
CPUID 00000000  	00000010-68747541-444D4163-69746E65 [AuthenticAMD]
CPUID 00000001  	008A0F00-01080800-7EF8320B-178BFBFF
CPUID 00000002  	00000000-00000000-00000000-00000000
CPUID 00000003  	00000000-00000000-00000000-00000000
CPUID 00000005  	00000040-00000040-00000003-00000011
CPUID 00000006  	00000004-00000000-00000001-00000000
CPUID 00000007  	00000000-219C91A9-00400004-00000000 [SL 00]
CPUID 00000008  	00000000-00000000-00000000-00000000
CPUID 00000009  	00000000-00000000-00000000-00000000
CPUID 0000000A  	00000000-00000000-00000000-00000000
CPUID 0000000B  	00000001-00000002-00000100-00000001 [SL 00]
CPUID 0000000B  	00000007-00000008-00000201-00000001 [SL 01]
CPUID 0000000C  	00000000-00000000-00000000-00000000
CPUID 0000000D  	00000207-00000340-00000380-00000000 [SL 00]
CPUID 0000000D  	0000000F-00000340-00000000-00000000 [SL 01]
CPUID 0000000D  	00000100-00000240-00000000-00000000 [SL 02]
CPUID 0000000D  	00000040-00000340-00000000-00000000 [SL 09]
CPUID 0000000E  	00000000-00000000-00000000-00000000
CPUID 0000000F  	00000000-000000FF-00000000-00000002 [SL 00]
CPUID 0000000F  	00000000-00000040-000000FF-00000007 [SL 01]
CPUID 00000010  	00000000-00000002-00000000-00000000 [SL 00]
CPUID 00000010  	0000000F-00000000-00000004-0000000F [SL 01]
CPUID 80000000  	80000020-68747541-444D4163-69746E65 [AuthenticAMD]
CPUID 80000001  	008A0F00-10000000-75C237FF-2FD3FBFF
CPUID 80000002  	20444D41-657A7952-2033206E-30323337 [AMD Ryzen 3 7320]
CPUID 80000003  	69772055-52206874-6F656461-7247206E [U with Radeon Gr]
CPUID 80000004  	69687061-20207363-20202020-00202020 [aphics ]
CPUID 80000005  	FF40FF40-FF40FF40-20080140-20080140
CPUID 80000006  	48006400-68006400-02006140-00209140
CPUID 80000007  	00000000-0000001B-00000000-00006799
CPUID 80000008  	00003030-010CF657-00007007-00010000
CPUID 80000009  	00000000-00000000-00000000-00000000
CPUID 8000000A  	00000001-00008000-00000000-0013BCFF
CPUID 8000000B  	00000000-00000000-00000000-00000000
CPUID 8000000C  	00000000-00000000-00000000-00000000
CPUID 8000000D  	00000000-00000000-00000000-00000000
CPUID 8000000E  	00000000-00000000-00000000-00000000
CPUID 8000000F  	00000000-00000000-00000000-00000000
CPUID 80000010  	00000000-00000000-00000000-00000000
CPUID 80000011  	00000000-00000000-00000000-00000000
CPUID 80000012  	00000000-00000000-00000000-00000000
CPUID 80000013  	00000000-00000000-00000000-00000000
CPUID 80000014  	00000000-00000000-00000000-00000000
CPUID 80000015  	00000000-00000000-00000000-00000000
CPUID 80000016  	00000000-00000000-00000000-00000000
CPUID 80000017  	00000000-00000000-00000000-00000000
CPUID 80000018  	00000000-00000000-00000000-00000000
CPUID 80000019  	F040F040-00000000-00000000-00000000
CPUID 8000001A  	00000006-00000000-00000000-00000000
CPUID 8000001B  	000003FF-00000000-00000000-00000000
CPUID 8000001C  	00000000-00000000-00000000-00000000
CPUID 8000001D  	00004121-01C0003F-0000003F-00000000 [SL 00]
CPUID 8000001D  	00004122-01C0003F-0000003F-00000000 [SL 01]
CPUID 8000001D  	00004143-01C0003F-000003FF-00000002 [SL 02]
CPUID 8000001D  	0001C163-03C0003F-00000FFF-00000001 [SL 03]
CPUID 8000001E  	00000001-00000100-00000000-00000000
CPUID 8000001F  	0001000F-0000012F-0000000E-00000001
CPUID 80000020  	00000000-00000002-00000000-00000000
 
CPUID Registers (CPU #2):
CPUID 00000000  	00000010-68747541-444D4163-69746E65 [AuthenticAMD]
CPUID 00000001  	008A0F00-02080800-7EF8320B-178BFBFF
CPUID 00000002  	00000000-00000000-00000000-00000000
CPUID 00000003  	00000000-00000000-00000000-00000000
CPUID 00000005  	00000040-00000040-00000003-00000011
CPUID 00000006  	00000004-00000000-00000001-00000000
CPUID 00000007  	00000000-219C91A9-00400004-00000000 [SL 00]
CPUID 00000008  	00000000-00000000-00000000-00000000
CPUID 00000009  	00000000-00000000-00000000-00000000
CPUID 0000000A  	00000000-00000000-00000000-00000000
CPUID 0000000B  	00000001-00000002-00000100-00000002 [SL 00]
CPUID 0000000B  	00000007-00000008-00000201-00000002 [SL 01]
CPUID 0000000C  	00000000-00000000-00000000-00000000
CPUID 0000000D  	00000207-00000340-00000380-00000000 [SL 00]
CPUID 0000000D  	0000000F-00000340-00000000-00000000 [SL 01]
CPUID 0000000D  	00000100-00000240-00000000-00000000 [SL 02]
CPUID 0000000D  	00000040-00000340-00000000-00000000 [SL 09]
CPUID 0000000E  	00000000-00000000-00000000-00000000
CPUID 0000000F  	00000000-000000FF-00000000-00000002 [SL 00]
CPUID 0000000F  	00000000-00000040-000000FF-00000007 [SL 01]
CPUID 00000010  	00000000-00000002-00000000-00000000 [SL 00]
CPUID 00000010  	0000000F-00000000-00000004-0000000F [SL 01]
CPUID 80000000  	80000020-68747541-444D4163-69746E65 [AuthenticAMD]
CPUID 80000001  	008A0F00-10000000-75C237FF-2FD3FBFF
CPUID 80000002  	20444D41-657A7952-2033206E-30323337 [AMD Ryzen 3 7320]
CPUID 80000003  	69772055-52206874-6F656461-7247206E [U with Radeon Gr]
CPUID 80000004  	69687061-20207363-20202020-00202020 [aphics ]
CPUID 80000005  	FF40FF40-FF40FF40-20080140-20080140
CPUID 80000006  	48006400-68006400-02006140-00209140
CPUID 80000007  	00000000-0000001B-00000000-00006799
CPUID 80000008  	00003030-010CF657-00007007-00010000
CPUID 80000009  	00000000-00000000-00000000-00000000
CPUID 8000000A  	00000001-00008000-00000000-0013BCFF
CPUID 8000000B  	00000000-00000000-00000000-00000000
CPUID 8000000C  	00000000-00000000-00000000-00000000
CPUID 8000000D  	00000000-00000000-00000000-00000000
CPUID 8000000E  	00000000-00000000-00000000-00000000
CPUID 8000000F  	00000000-00000000-00000000-00000000
CPUID 80000010  	00000000-00000000-00000000-00000000
CPUID 80000011  	00000000-00000000-00000000-00000000
CPUID 80000012  	00000000-00000000-00000000-00000000
CPUID 80000013  	00000000-00000000-00000000-00000000
CPUID 80000014  	00000000-00000000-00000000-00000000
CPUID 80000015  	00000000-00000000-00000000-00000000
CPUID 80000016  	00000000-00000000-00000000-00000000
CPUID 80000017  	00000000-00000000-00000000-00000000
CPUID 80000018  	00000000-00000000-00000000-00000000
CPUID 80000019  	F040F040-00000000-00000000-00000000
CPUID 8000001A  	00000006-00000000-00000000-00000000
CPUID 8000001B  	000003FF-00000000-00000000-00000000
CPUID 8000001C  	00000000-00000000-00000000-00000000
CPUID 8000001D  	00004121-01C0003F-0000003F-00000000 [SL 00]
CPUID 8000001D  	00004122-01C0003F-0000003F-00000000 [SL 01]
CPUID 8000001D  	00004143-01C0003F-000003FF-00000002 [SL 02]
CPUID 8000001D  	0001C163-03C0003F-00000FFF-00000001 [SL 03]
CPUID 8000001E  	00000002-00000101-00000000-00000000
CPUID 8000001F  	0001000F-0000012F-0000000E-00000001
CPUID 80000020  	00000000-00000002-00000000-00000000
 
CPUID Registers (CPU #3 Virtual):
CPUID 00000000  	00000010-68747541-444D4163-69746E65 [AuthenticAMD]
CPUID 00000001  	008A0F00-03080800-7EF8320B-178BFBFF
CPUID 00000002  	00000000-00000000-00000000-00000000
CPUID 00000003  	00000000-00000000-00000000-00000000
CPUID 00000005  	00000040-00000040-00000003-00000011
CPUID 00000006  	00000004-00000000-00000001-00000000
CPUID 00000007  	00000000-219C91A9-00400004-00000000 [SL 00]
CPUID 00000008  	00000000-00000000-00000000-00000000
CPUID 00000009  	00000000-00000000-00000000-00000000
CPUID 0000000A  	00000000-00000000-00000000-00000000
CPUID 0000000B  	00000001-00000002-00000100-00000003 [SL 00]
CPUID 0000000B  	00000007-00000008-00000201-00000003 [SL 01]
CPUID 0000000C  	00000000-00000000-00000000-00000000
CPUID 0000000D  	00000207-00000340-00000380-00000000 [SL 00]
CPUID 0000000D  	0000000F-00000340-00000000-00000000 [SL 01]
CPUID 0000000D  	00000100-00000240-00000000-00000000 [SL 02]
CPUID 0000000D  	00000040-00000340-00000000-00000000 [SL 09]
CPUID 0000000E  	00000000-00000000-00000000-00000000
CPUID 0000000F  	00000000-000000FF-00000000-00000002 [SL 00]
CPUID 0000000F  	00000000-00000040-000000FF-00000007 [SL 01]
CPUID 00000010  	00000000-00000002-00000000-00000000 [SL 00]
CPUID 00000010  	0000000F-00000000-00000004-0000000F [SL 01]
CPUID 80000000  	80000020-68747541-444D4163-69746E65 [AuthenticAMD]
CPUID 80000001  	008A0F00-10000000-75C237FF-2FD3FBFF
CPUID 80000002  	20444D41-657A7952-2033206E-30323337 [AMD Ryzen 3 7320]
CPUID 80000003  	69772055-52206874-6F656461-7247206E [U with Radeon Gr]
CPUID 80000004  	69687061-20207363-20202020-00202020 [aphics ]
CPUID 80000005  	FF40FF40-FF40FF40-20080140-20080140
CPUID 80000006  	48006400-68006400-02006140-00209140
CPUID 80000007  	00000000-0000001B-00000000-00006799
CPUID 80000008  	00003030-010CF657-00007007-00010000
CPUID 80000009  	00000000-00000000-00000000-00000000
CPUID 8000000A  	00000001-00008000-00000000-0013BCFF
CPUID 8000000B  	00000000-00000000-00000000-00000000
CPUID 8000000C  	00000000-00000000-00000000-00000000
CPUID 8000000D  	00000000-00000000-00000000-00000000
CPUID 8000000E  	00000000-00000000-00000000-00000000
CPUID 8000000F  	00000000-00000000-00000000-00000000
CPUID 80000010  	00000000-00000000-00000000-00000000
CPUID 80000011  	00000000-00000000-00000000-00000000
CPUID 80000012  	00000000-00000000-00000000-00000000
CPUID 80000013  	00000000-00000000-00000000-00000000
CPUID 80000014  	00000000-00000000-00000000-00000000
CPUID 80000015  	00000000-00000000-00000000-00000000
CPUID 80000016  	00000000-00000000-00000000-00000000
CPUID 80000017  	00000000-00000000-00000000-00000000
CPUID 80000018  	00000000-00000000-00000000-00000000
CPUID 80000019  	F040F040-00000000-00000000-00000000
CPUID 8000001A  	00000006-00000000-00000000-00000000
CPUID 8000001B  	000003FF-00000000-00000000-00000000
CPUID 8000001C  	00000000-00000000-00000000-00000000
CPUID 8000001D  	00004121-01C0003F-0000003F-00000000 [SL 00]
CPUID 8000001D  	00004122-01C0003F-0000003F-00000000 [SL 01]
CPUID 8000001D  	00004143-01C0003F-000003FF-00000002 [SL 02]
CPUID 8000001D  	0001C163-03C0003F-00000FFF-00000001 [SL 03]
CPUID 8000001E  	00000003-00000101-00000000-00000000
CPUID 8000001F  	0001000F-0000012F-0000000E-00000001
CPUID 80000020  	00000000-00000002-00000000-00000000
 
CPUID Registers (CPU #4):
CPUID 00000000  	00000010-68747541-444D4163-69746E65 [AuthenticAMD]
CPUID 00000001  	008A0F00-04080800-7EF8320B-178BFBFF
CPUID 00000002  	00000000-00000000-00000000-00000000
CPUID 00000003  	00000000-00000000-00000000-00000000
CPUID 00000005  	00000040-00000040-00000003-00000011
CPUID 00000006  	00000004-00000000-00000001-00000000
CPUID 00000007  	00000000-219C91A9-00400004-00000000 [SL 00]
CPUID 00000008  	00000000-00000000-00000000-00000000
CPUID 00000009  	00000000-00000000-00000000-00000000
CPUID 0000000A  	00000000-00000000-00000000-00000000
CPUID 0000000B  	00000001-00000002-00000100-00000004 [SL 00]
CPUID 0000000B  	00000007-00000008-00000201-00000004 [SL 01]
CPUID 0000000C  	00000000-00000000-00000000-00000000
CPUID 0000000D  	00000207-00000340-00000380-00000000 [SL 00]
CPUID 0000000D  	0000000F-00000340-00000000-00000000 [SL 01]
CPUID 0000000D  	00000100-00000240-00000000-00000000 [SL 02]
CPUID 0000000D  	00000040-00000340-00000000-00000000 [SL 09]
CPUID 0000000E  	00000000-00000000-00000000-00000000
CPUID 0000000F  	00000000-000000FF-00000000-00000002 [SL 00]
CPUID 0000000F  	00000000-00000040-000000FF-00000007 [SL 01]
CPUID 00000010  	00000000-00000002-00000000-00000000 [SL 00]
CPUID 00000010  	0000000F-00000000-00000004-0000000F [SL 01]
CPUID 80000000  	80000020-68747541-444D4163-69746E65 [AuthenticAMD]
CPUID 80000001  	008A0F00-10000000-75C237FF-2FD3FBFF
CPUID 80000002  	20444D41-657A7952-2033206E-30323337 [AMD Ryzen 3 7320]
CPUID 80000003  	69772055-52206874-6F656461-7247206E [U with Radeon Gr]
CPUID 80000004  	69687061-20207363-20202020-00202020 [aphics ]
CPUID 80000005  	FF40FF40-FF40FF40-20080140-20080140
CPUID 80000006  	48006400-68006400-02006140-00209140
CPUID 80000007  	00000000-0000001B-00000000-00006799
CPUID 80000008  	00003030-010CF657-00007007-00010000
CPUID 80000009  	00000000-00000000-00000000-00000000
CPUID 8000000A  	00000001-00008000-00000000-0013BCFF
CPUID 8000000B  	00000000-00000000-00000000-00000000
CPUID 8000000C  	00000000-00000000-00000000-00000000
CPUID 8000000D  	00000000-00000000-00000000-00000000
CPUID 8000000E  	00000000-00000000-00000000-00000000
CPUID 8000000F  	00000000-00000000-00000000-00000000
CPUID 80000010  	00000000-00000000-00000000-00000000
CPUID 80000011  	00000000-00000000-00000000-00000000
CPUID 80000012  	00000000-00000000-00000000-00000000
CPUID 80000013  	00000000-00000000-00000000-00000000
CPUID 80000014  	00000000-00000000-00000000-00000000
CPUID 80000015  	00000000-00000000-00000000-00000000
CPUID 80000016  	00000000-00000000-00000000-00000000
CPUID 80000017  	00000000-00000000-00000000-00000000
CPUID 80000018  	00000000-00000000-00000000-00000000
CPUID 80000019  	F040F040-00000000-00000000-00000000
CPUID 8000001A  	00000006-00000000-00000000-00000000
CPUID 8000001B  	000003FF-00000000-00000000-00000000
CPUID 8000001C  	00000000-00000000-00000000-00000000
CPUID 8000001D  	00004121-01C0003F-0000003F-00000000 [SL 00]
CPUID 8000001D  	00004122-01C0003F-0000003F-00000000 [SL 01]
CPUID 8000001D  	00004143-01C0003F-000003FF-00000002 [SL 02]
CPUID 8000001D  	0001C163-03C0003F-00000FFF-00000001 [SL 03]
CPUID 8000001E  	00000004-00000102-00000000-00000000
CPUID 8000001F  	0001000F-0000012F-0000000E-00000001
CPUID 80000020  	00000000-00000002-00000000-00000000
 
CPUID Registers (CPU #5 Virtual):
CPUID 00000000  	00000010-68747541-444D4163-69746E65 [AuthenticAMD]
CPUID 00000001  	008A0F00-05080800-7EF8320B-178BFBFF
CPUID 00000002  	00000000-00000000-00000000-00000000
CPUID 00000003  	00000000-00000000-00000000-00000000
CPUID 00000005  	00000040-00000040-00000003-00000011
CPUID 00000006  	00000004-00000000-00000001-00000000
CPUID 00000007  	00000000-219C91A9-00400004-00000000 [SL 00]
CPUID 00000008  	00000000-00000000-00000000-00000000
CPUID 00000009  	00000000-00000000-00000000-00000000
CPUID 0000000A  	00000000-00000000-00000000-00000000
CPUID 0000000B  	00000001-00000002-00000100-00000005 [SL 00]
CPUID 0000000B  	00000007-00000008-00000201-00000005 [SL 01]
CPUID 0000000C  	00000000-00000000-00000000-00000000
CPUID 0000000D  	00000207-00000340-00000380-00000000 [SL 00]
CPUID 0000000D  	0000000F-00000340-00000000-00000000 [SL 01]
CPUID 0000000D  	00000100-00000240-00000000-00000000 [SL 02]
CPUID 0000000D  	00000040-00000340-00000000-00000000 [SL 09]
CPUID 0000000E  	00000000-00000000-00000000-00000000
CPUID 0000000F  	00000000-000000FF-00000000-00000002 [SL 00]
CPUID 0000000F  	00000000-00000040-000000FF-00000007 [SL 01]
CPUID 00000010  	00000000-00000002-00000000-00000000 [SL 00]
CPUID 00000010  	0000000F-00000000-00000004-0000000F [SL 01]
CPUID 80000000  	80000020-68747541-444D4163-69746E65 [AuthenticAMD]
CPUID 80000001  	008A0F00-10000000-75C237FF-2FD3FBFF
CPUID 80000002  	20444D41-657A7952-2033206E-30323337 [AMD Ryzen 3 7320]
CPUID 80000003  	69772055-52206874-6F656461-7247206E [U with Radeon Gr]
CPUID 80000004  	69687061-20207363-20202020-00202020 [aphics ]
CPUID 80000005  	FF40FF40-FF40FF40-20080140-20080140
CPUID 80000006  	48006400-68006400-02006140-00209140
CPUID 80000007  	00000000-0000001B-00000000-00006799
CPUID 80000008  	00003030-010CF657-00007007-00010000
CPUID 80000009  	00000000-00000000-00000000-00000000
CPUID 8000000A  	00000001-00008000-00000000-0013BCFF
CPUID 8000000B  	00000000-00000000-00000000-00000000
CPUID 8000000C  	00000000-00000000-00000000-00000000
CPUID 8000000D  	00000000-00000000-00000000-00000000
CPUID 8000000E  	00000000-00000000-00000000-00000000
CPUID 8000000F  	00000000-00000000-00000000-00000000
CPUID 80000010  	00000000-00000000-00000000-00000000
CPUID 80000011  	00000000-00000000-00000000-00000000
CPUID 80000012  	00000000-00000000-00000000-00000000
CPUID 80000013  	00000000-00000000-00000000-00000000
CPUID 80000014  	00000000-00000000-00000000-00000000
CPUID 80000015  	00000000-00000000-00000000-00000000
CPUID 80000016  	00000000-00000000-00000000-00000000
CPUID 80000017  	00000000-00000000-00000000-00000000
CPUID 80000018  	00000000-00000000-00000000-00000000
CPUID 80000019  	F040F040-00000000-00000000-00000000
CPUID 8000001A  	00000006-00000000-00000000-00000000
CPUID 8000001B  	000003FF-00000000-00000000-00000000
CPUID 8000001C  	00000000-00000000-00000000-00000000
CPUID 8000001D  	00004121-01C0003F-0000003F-00000000 [SL 00]
CPUID 8000001D  	00004122-01C0003F-0000003F-00000000 [SL 01]
CPUID 8000001D  	00004143-01C0003F-000003FF-00000002 [SL 02]
CPUID 8000001D  	0001C163-03C0003F-00000FFF-00000001 [SL 03]
CPUID 8000001E  	00000005-00000102-00000000-00000000
CPUID 8000001F  	0001000F-0000012F-0000000E-00000001
CPUID 80000020  	00000000-00000002-00000000-00000000
 
CPUID Registers (CPU #6):
CPUID 00000000  	00000010-68747541-444D4163-69746E65 [AuthenticAMD]
CPUID 00000001  	008A0F00-06080800-7EF8320B-178BFBFF
CPUID 00000002  	00000000-00000000-00000000-00000000
CPUID 00000003  	00000000-00000000-00000000-00000000
CPUID 00000005  	00000040-00000040-00000003-00000011
CPUID 00000006  	00000004-00000000-00000001-00000000
CPUID 00000007  	00000000-219C91A9-00400004-00000000 [SL 00]
CPUID 00000008  	00000000-00000000-00000000-00000000
CPUID 00000009  	00000000-00000000-00000000-00000000
CPUID 0000000A  	00000000-00000000-00000000-00000000
CPUID 0000000B  	00000001-00000002-00000100-00000006 [SL 00]
CPUID 0000000B  	00000007-00000008-00000201-00000006 [SL 01]
CPUID 0000000C  	00000000-00000000-00000000-00000000
CPUID 0000000D  	00000207-00000340-00000380-00000000 [SL 00]
CPUID 0000000D  	0000000F-00000340-00000000-00000000 [SL 01]
CPUID 0000000D  	00000100-00000240-00000000-00000000 [SL 02]
CPUID 0000000D  	00000040-00000340-00000000-00000000 [SL 09]
CPUID 0000000E  	00000000-00000000-00000000-00000000
CPUID 0000000F  	00000000-000000FF-00000000-00000002 [SL 00]
CPUID 0000000F  	00000000-00000040-000000FF-00000007 [SL 01]
CPUID 00000010  	00000000-00000002-00000000-00000000 [SL 00]
CPUID 00000010  	0000000F-00000000-00000004-0000000F [SL 01]
CPUID 80000000  	80000020-68747541-444D4163-69746E65 [AuthenticAMD]
CPUID 80000001  	008A0F00-10000000-75C237FF-2FD3FBFF
CPUID 80000002  	20444D41-657A7952-2033206E-30323337 [AMD Ryzen 3 7320]
CPUID 80000003  	69772055-52206874-6F656461-7247206E [U with Radeon Gr]
CPUID 80000004  	69687061-20207363-20202020-00202020 [aphics ]
CPUID 80000005  	FF40FF40-FF40FF40-20080140-20080140
CPUID 80000006  	48006400-68006400-02006140-00209140
CPUID 80000007  	00000000-0000001B-00000000-00006799
CPUID 80000008  	00003030-010CF657-00007007-00010000
CPUID 80000009  	00000000-00000000-00000000-00000000
CPUID 8000000A  	00000001-00008000-00000000-0013BCFF
CPUID 8000000B  	00000000-00000000-00000000-00000000
CPUID 8000000C  	00000000-00000000-00000000-00000000
CPUID 8000000D  	00000000-00000000-00000000-00000000
CPUID 8000000E  	00000000-00000000-00000000-00000000
CPUID 8000000F  	00000000-00000000-00000000-00000000
CPUID 80000010  	00000000-00000000-00000000-00000000
CPUID 80000011  	00000000-00000000-00000000-00000000
CPUID 80000012  	00000000-00000000-00000000-00000000
CPUID 80000013  	00000000-00000000-00000000-00000000
CPUID 80000014  	00000000-00000000-00000000-00000000
CPUID 80000015  	00000000-00000000-00000000-00000000
CPUID 80000016  	00000000-00000000-00000000-00000000
CPUID 80000017  	00000000-00000000-00000000-00000000
CPUID 80000018  	00000000-00000000-00000000-00000000
CPUID 80000019  	F040F040-00000000-00000000-00000000
CPUID 8000001A  	00000006-00000000-00000000-00000000
CPUID 8000001B  	000003FF-00000000-00000000-00000000
CPUID 8000001C  	00000000-00000000-00000000-00000000
CPUID 8000001D  	00004121-01C0003F-0000003F-00000000 [SL 00]
CPUID 8000001D  	00004122-01C0003F-0000003F-00000000 [SL 01]
CPUID 8000001D  	00004143-01C0003F-000003FF-00000002 [SL 02]
CPUID 8000001D  	0001C163-03C0003F-00000FFF-00000001 [SL 03]
CPUID 8000001E  	00000006-00000103-00000000-00000000
CPUID 8000001F  	0001000F-0000012F-0000000E-00000001
CPUID 80000020  	00000000-00000002-00000000-00000000
 
CPUID Registers (CPU #7 Virtual):
CPUID 00000000  	00000010-68747541-444D4163-69746E65 [AuthenticAMD]
CPUID 00000001  	008A0F00-07080800-7EF8320B-178BFBFF
CPUID 00000002  	00000000-00000000-00000000-00000000
CPUID 00000003  	00000000-00000000-00000000-00000000
CPUID 00000005  	00000040-00000040-00000003-00000011
CPUID 00000006  	00000004-00000000-00000001-00000000
CPUID 00000007  	00000000-219C91A9-00400004-00000000 [SL 00]
CPUID 00000008  	00000000-00000000-00000000-00000000
CPUID 00000009  	00000000-00000000-00000000-00000000
CPUID 0000000A  	00000000-00000000-00000000-00000000
CPUID 0000000B  	00000001-00000002-00000100-00000007 [SL 00]
CPUID 0000000B  	00000007-00000008-00000201-00000007 [SL 01]
CPUID 0000000C  	00000000-00000000-00000000-00000000
CPUID 0000000D  	00000207-00000340-00000380-00000000 [SL 00]
CPUID 0000000D  	0000000F-00000340-00000000-00000000 [SL 01]
CPUID 0000000D  	00000100-00000240-00000000-00000000 [SL 02]
CPUID 0000000D  	00000040-00000340-00000000-00000000 [SL 09]
CPUID 0000000E  	00000000-00000000-00000000-00000000
CPUID 0000000F  	00000000-000000FF-00000000-00000002 [SL 00]
CPUID 0000000F  	00000000-00000040-000000FF-00000007 [SL 01]
CPUID 00000010  	00000000-00000002-00000000-00000000 [SL 00]
CPUID 00000010  	0000000F-00000000-00000004-0000000F [SL 01]
CPUID 80000000  	80000020-68747541-444D4163-69746E65 [AuthenticAMD]
CPUID 80000001  	008A0F00-10000000-75C237FF-2FD3FBFF
CPUID 80000002  	20444D41-657A7952-2033206E-30323337 [AMD Ryzen 3 7320]
CPUID 80000003  	69772055-52206874-6F656461-7247206E [U with Radeon Gr]
CPUID 80000004  	69687061-20207363-20202020-00202020 [aphics ]
CPUID 80000005  	FF40FF40-FF40FF40-20080140-20080140
CPUID 80000006  	48006400-68006400-02006140-00209140
CPUID 80000007  	00000000-0000001B-00000000-00006799
CPUID 80000008  	00003030-010CF657-00007007-00010000
CPUID 80000009  	00000000-00000000-00000000-00000000
CPUID 8000000A  	00000001-00008000-00000000-0013BCFF
CPUID 8000000B  	00000000-00000000-00000000-00000000
CPUID 8000000C  	00000000-00000000-00000000-00000000
CPUID 8000000D  	00000000-00000000-00000000-00000000
CPUID 8000000E  	00000000-00000000-00000000-00000000
CPUID 8000000F  	00000000-00000000-00000000-00000000
CPUID 80000010  	00000000-00000000-00000000-00000000
CPUID 80000011  	00000000-00000000-00000000-00000000
CPUID 80000012  	00000000-00000000-00000000-00000000
CPUID 80000013  	00000000-00000000-00000000-00000000
CPUID 80000014  	00000000-00000000-00000000-00000000
CPUID 80000015  	00000000-00000000-00000000-00000000
CPUID 80000016  	00000000-00000000-00000000-00000000
CPUID 80000017  	00000000-00000000-00000000-00000000
CPUID 80000018  	00000000-00000000-00000000-00000000
CPUID 80000019  	F040F040-00000000-00000000-00000000
CPUID 8000001A  	00000006-00000000-00000000-00000000
CPUID 8000001B  	000003FF-00000000-00000000-00000000
CPUID 8000001C  	00000000-00000000-00000000-00000000
CPUID 8000001D  	00004121-01C0003F-0000003F-00000000 [SL 00]
CPUID 8000001D  	00004122-01C0003F-0000003F-00000000 [SL 01]
CPUID 8000001D  	00004143-01C0003F-000003FF-00000002 [SL 02]
CPUID 8000001D  	0001C163-03C0003F-00000FFF-00000001 [SL 03]
CPUID 8000001E  	00000007-00000103-00000000-00000000
CPUID 8000001F  	0001000F-0000012F-0000000E-00000001
CPUID 80000020  	00000000-00000002-00000000-00000000
 
MSR Registers (CPU #0):
CPU Clock (Normal)  	485 MHz
CPU Clock (TSC)  	2395 MHz
CPU Multiplier  	4.8x
CPB PStates  	0
MSR 0000001B  	0000-0000-FEE0-0900
MSR 0000008B  	0000-0000-08A0-0006
MSR 000000E7  	0000-0050-3813-A060 [S200]
MSR 000000E7  	0000-0050-3D36-A200 [S200]
MSR 000000E7  	0000-0050-4732-B940
MSR 000000E8  	0000-006F-93B5-6073 [S200]
MSR 000000E8  	0000-006F-94F2-3A78 [S200]
MSR 000000E8  	0000-006F-A89E-8691
MSR C0010004  	0000-0000-0000-0000
MSR C0010005  	0000-0000-0000-0000
MSR C0010006  	0000-0000-0000-0000
MSR C0010007  	0000-0000-0000-0000
MSR C0010015  	0000-0001-C900-0011
MSR C001001F  	0000-0000-0000-0000
MSR C0010055  	0000-0000-0000-0000
MSR C0010058  	0000-0000-E000-0021
MSR C0010061  	0000-0000-0000-0020
MSR C0010062  	0000-0000-0000-0000
MSR C0010063  	0000-0000-0000-0000
MSR C0010064  	8000-0000-462F-C860 [88.00x] [0.3563 V] [ 2.40 A] [PState P0]
MSR C0010065  	8000-0000-42EA-D058 [11.00x] [0.4813 V] [ 1.10 A] [PState P1]
MSR C0010066  	8000-0000-4265-D251 [ 9.00x] [0.6062 V] [ 0.90 A] [PState P2]
MSR C0010067  	0000-0000-0000-0000
MSR C0010068  	0000-0000-0000-0000
MSR C0010069  	0000-0000-0000-0000
MSR C001006A  	0000-0000-0000-0000
MSR C001006B  	0000-0000-0000-0000
MSR C0010070  	< FAILED >
MSR C0010293  	0000-0000-014C-4230 [48.00x] [1.2437V]
MSR C0010293  	0000-0000-014C-4230 [48.00x] [1.2437V]
MSR C0010293  	0000-0000-014C-4230 [48.00x] [1.2437V]
MSR C0010293  	0000-0000-014C-4230 [48.00x] [1.2437V]
MSR C0010293  	0000-0000-014C-4230 [48.00x] [1.2437V]
MSR C0010140  	0000-0000-0000-0000
MSR C0010141  	0000-0000-0000-0000
MSR C0010290  	< FAILED >
MSR C0010292  	0000-0001-0400-4992
MSR C0010293  	0000-0000-014C-4230
MSR C0010294  	0FC2-6581-0000-4912
MSR C0010296  	0000-0000-0048-4848
MSR C0010299  	0000-0000-000A-1003
MSR C001029A  	0000-0000-00ED-9064 [S200]
MSR C001029A  	0000-0000-00ED-AF30 [S200]
MSR C001029A  	0000-0000-00ED-CF0A
MSR C001029B  	0000-0000-0668-F6DB [S200]
MSR C001029B  	0000-0000-0669-8576 [S200]
MSR C001029B  	0000-0000-066A-1B25
MSR C0011023  	0002-0000-0000-0020
 
MSR Registers (CPU #1):
CPU Clock (Normal)  	533 MHz
CPU Clock (TSC)  	2396 MHz
CPU Multiplier  	5.3x
CPB PStates  	0
MSR 0000001B  	0000-0000-FEE0-0900
MSR 0000008B  	0000-0000-08A0-0006
MSR 000000E7  	0000-0050-8FAB-20A8
MSR 000000E8  	0000-006F-FAD4-D3C9
MSR C0010004  	0000-0000-0000-0000
MSR C0010005  	0000-0000-0000-0000
MSR C0010006  	0000-0000-0000-0000
MSR C0010007  	0000-0000-0000-0000
MSR C0010015  	0000-0001-C900-0011
MSR C001001F  	0000-0000-0000-0000
MSR C0010055  	0000-0000-0000-0000
MSR C0010058  	0000-0000-E000-0021
MSR C0010061  	0000-0000-0000-0020
MSR C0010062  	0000-0000-0000-0000
MSR C0010063  	0000-0000-0000-0000
MSR C0010064  	8000-0000-462F-C860 [88.00x] [0.3563 V] [ 2.40 A] [PState P0]
MSR C0010065  	8000-0000-42EA-D058 [11.00x] [0.4813 V] [ 1.10 A] [PState P1]
MSR C0010066  	8000-0000-4265-D251 [ 9.00x] [0.6062 V] [ 0.90 A] [PState P2]
MSR C0010067  	0000-0000-0000-0000
MSR C0010068  	0000-0000-0000-0000
MSR C0010069  	0000-0000-0000-0000
MSR C001006A  	0000-0000-0000-0000
MSR C001006B  	0000-0000-0000-0000
MSR C0010070  	< FAILED >
MSR C0010293  	0000-0000-014E-4230 [48.00x] [1.1938V]
MSR C0010293  	0000-0000-034E-9230 [ 5.33x] [1.1875V]
MSR C0010293  	0000-0000-014C-4230 [48.00x] [1.2437V]
MSR C0010293  	0000-0000-014C-4230 [48.00x] [1.2437V]
MSR C0010293  	0000-0000-014C-4230 [48.00x] [1.2437V]
MSR C0010140  	0000-0000-0000-0000
MSR C0010141  	0000-0000-0000-0000
MSR C0010290  	< FAILED >
MSR C0010292  	0000-0001-0400-4992
MSR C0010293  	0000-0000-014C-4230
MSR C0010294  	0FC2-6581-0000-4912
MSR C0010296  	0000-0000-0048-4848
MSR C0010299  	0000-0000-000A-1003
MSR C001029A  	0000-0000-00EE-A752
MSR C001029B  	0000-0000-066C-130A
MSR C0011023  	0002-0000-0000-0020
 
MSR Registers (CPU #2):
CPU Clock (Normal)  	4797 MHz
CPU Clock (TSC)  	2396 MHz
CPU Multiplier  	48.0x
CPB PStates  	0
MSR 0000001B  	0000-0000-FEE0-0900
MSR 0000008B  	0000-0000-08A0-0006
MSR 000000E7  	0000-0050-AA73-1C48
MSR 000000E8  	0000-0070-21C2-12E4
MSR C0010004  	0000-0000-0000-0000
MSR C0010005  	0000-0000-0000-0000
MSR C0010006  	0000-0000-0000-0000
MSR C0010007  	0000-0000-0000-0000
MSR C0010015  	0000-0001-C900-0011
MSR C001001F  	0000-0000-0000-0000
MSR C0010055  	0000-0000-0000-0000
MSR C0010058  	0000-0000-E000-0021
MSR C0010061  	0000-0000-0000-0020
MSR C0010062  	0000-0000-0000-0000
MSR C0010063  	0000-0000-0000-0000
MSR C0010064  	8000-0000-462F-C860 [88.00x] [0.3563 V] [ 2.40 A] [PState P0]
MSR C0010065  	8000-0000-42EA-D058 [11.00x] [0.4813 V] [ 1.10 A] [PState P1]
MSR C0010066  	8000-0000-4265-D251 [ 9.00x] [0.6062 V] [ 0.90 A] [PState P2]
MSR C0010067  	0000-0000-0000-0000
MSR C0010068  	0000-0000-0000-0000
MSR C0010069  	0000-0000-0000-0000
MSR C001006A  	0000-0000-0000-0000
MSR C001006B  	0000-0000-0000-0000
MSR C0010070  	< FAILED >
MSR C0010293  	0000-0000-014C-4230 [48.00x] [1.2437V]
MSR C0010293  	0000-0000-014C-4230 [48.00x] [1.2437V]
MSR C0010293  	0000-0000-014C-4230 [48.00x] [1.2437V]
MSR C0010293  	0000-0000-014C-4230 [48.00x] [1.2437V]
MSR C0010293  	0000-0000-014C-4230 [48.00x] [1.2437V]
MSR C0010140  	0000-0000-0000-0000
MSR C0010141  	0000-0000-0000-0000
MSR C0010290  	< FAILED >
MSR C0010292  	0000-0001-0400-4992
MSR C0010293  	0000-0000-014C-4230
MSR C0010294  	0FC2-6581-0000-4912
MSR C0010296  	0000-0000-0048-4848
MSR C0010299  	0000-0000-000A-1003
MSR C001029A  	0000-0000-00EE-FDE0
MSR C001029B  	0000-0000-066D-AE61
MSR C0011023  	0002-0000-0000-0020
 
MSR Registers (CPU #3):
CPU Clock (Normal)  	4797 MHz
CPU Clock (TSC)  	2396 MHz
CPU Multiplier  	48.0x
CPB PStates  	0
MSR 0000001B  	0000-0000-FEE0-0900
MSR 0000008B  	0000-0000-08A0-0006
MSR 000000E7  	0000-0050-C0A4-3BA8
MSR 000000E8  	0000-0070-421E-A059
MSR C0010004  	0000-0000-0000-0000
MSR C0010005  	0000-0000-0000-0000
MSR C0010006  	0000-0000-0000-0000
MSR C0010007  	0000-0000-0000-0000
MSR C0010015  	0000-0001-C900-0011
MSR C001001F  	0000-0000-0000-0000
MSR C0010055  	0000-0000-0000-0000
MSR C0010058  	0000-0000-E000-0021
MSR C0010061  	0000-0000-0000-0020
MSR C0010062  	0000-0000-0000-0000
MSR C0010063  	0000-0000-0000-0000
MSR C0010064  	8000-0000-462F-C860 [88.00x] [0.3563 V] [ 2.40 A] [PState P0]
MSR C0010065  	8000-0000-42EA-D058 [11.00x] [0.4813 V] [ 1.10 A] [PState P1]
MSR C0010066  	8000-0000-4265-D251 [ 9.00x] [0.6062 V] [ 0.90 A] [PState P2]
MSR C0010067  	0000-0000-0000-0000
MSR C0010068  	0000-0000-0000-0000
MSR C0010069  	0000-0000-0000-0000
MSR C001006A  	0000-0000-0000-0000
MSR C001006B  	0000-0000-0000-0000
MSR C0010070  	< FAILED >
MSR C0010293  	0000-0000-014C-4230 [48.00x] [1.2437V]
MSR C0010293  	0000-0000-014C-4230 [48.00x] [1.2437V]
MSR C0010293  	0000-0000-034E-9230 [ 5.33x] [1.1875V]
MSR C0010293  	0000-0000-014C-4230 [48.00x] [1.2437V]
MSR C0010293  	0000-0000-014C-4230 [48.00x] [1.2437V]
MSR C0010140  	0000-0000-0000-0000
MSR C0010141  	0000-0000-0000-0000
MSR C0010290  	< FAILED >
MSR C0010292  	0000-0001-0400-4992
MSR C0010293  	0000-0000-014C-4230
MSR C0010294  	0FC2-6581-0000-4912
MSR C0010296  	0000-0000-0048-4848
MSR C0010299  	0000-0000-000A-1003
MSR C001029A  	0000-0000-00EF-393F
MSR C001029B  	0000-0000-066F-7647
MSR C0011023  	0002-0000-0000-0020
 
MSR Registers (CPU #4):
CPU Clock (Normal)  	4797 MHz
CPU Clock (TSC)  	2395 MHz
CPU Multiplier  	48.0x
CPB PStates  	0
MSR 0000001B  	0000-0000-FEE0-0900
MSR 0000008B  	0000-0000-08A0-0006
MSR 000000E7  	0000-0050-CEEE-4240
MSR 000000E8  	0000-0070-55C6-08F3
MSR C0010004  	0000-0000-0000-0000
MSR C0010005  	0000-0000-0000-0000
MSR C0010006  	0000-0000-0000-0000
MSR C0010007  	0000-0000-0000-0000
MSR C0010015  	0000-0001-C900-0011
MSR C001001F  	0000-0000-0000-0000
MSR C0010055  	0000-0000-0000-0000
MSR C0010058  	0000-0000-E000-0021
MSR C0010061  	0000-0000-0000-0020
MSR C0010062  	0000-0000-0000-0000
MSR C0010063  	0000-0000-0000-0000
MSR C0010064  	8000-0000-462F-C860 [88.00x] [0.3563 V] [ 2.40 A] [PState P0]
MSR C0010065  	8000-0000-42EA-D058 [11.00x] [0.4813 V] [ 1.10 A] [PState P1]
MSR C0010066  	8000-0000-4265-D251 [ 9.00x] [0.6062 V] [ 0.90 A] [PState P2]
MSR C0010067  	0000-0000-0000-0000
MSR C0010068  	0000-0000-0000-0000
MSR C0010069  	0000-0000-0000-0000
MSR C001006A  	0000-0000-0000-0000
MSR C001006B  	0000-0000-0000-0000
MSR C0010070  	< FAILED >
MSR C0010293  	0000-0000-014C-4230 [48.00x] [1.2437V]
MSR C0010293  	0000-0000-014C-4230 [48.00x] [1.2437V]
MSR C0010293  	0000-0000-02A2-6150 [ 4.85x] [0.6937V]
MSR C0010293  	0000-0000-02A2-6150 [ 4.85x] [0.6937V]
MSR C0010293  	0000-0000-02A2-6150 [ 4.85x] [0.6937V]
MSR C0010140  	0000-0000-0000-0000
MSR C0010141  	0000-0000-0000-0000
MSR C0010290  	< FAILED >
MSR C0010292  	0000-0001-0400-4992
MSR C0010293  	0000-0000-02A2-6150
MSR C0010294  	0FC2-6581-0000-4912
MSR C0010296  	0000-0000-0048-4848
MSR C0010299  	0000-0000-000A-1003
MSR C001029A  	0000-0000-00EF-522E
MSR C001029B  	0000-0000-066F-FFFD
MSR C0011023  	0002-0000-0000-0020
 
MSR Registers (CPU #5):
CPU Clock (Normal)  	485 MHz
CPU Clock (TSC)  	2396 MHz
CPU Multiplier  	4.8x
CPB PStates  	0
MSR 0000001B  	0000-0000-FEE0-0900
MSR 0000008B  	0000-0000-08A0-0006
MSR 000000E7  	0000-0050-D960-9828
MSR 000000E8  	0000-0070-63BB-756E
MSR C0010004  	0000-0000-0000-0000
MSR C0010005  	0000-0000-0000-0000
MSR C0010006  	0000-0000-0000-0000
MSR C0010007  	0000-0000-0000-0000
MSR C0010015  	0000-0001-C900-0011
MSR C001001F  	0000-0000-0000-0000
MSR C0010055  	0000-0000-0000-0000
MSR C0010058  	0000-0000-E000-0021
MSR C0010061  	0000-0000-0000-0020
MSR C0010062  	0000-0000-0000-0000
MSR C0010063  	0000-0000-0000-0000
MSR C0010064  	8000-0000-462F-C860 [88.00x] [0.3563 V] [ 2.40 A] [PState P0]
MSR C0010065  	8000-0000-42EA-D058 [11.00x] [0.4813 V] [ 1.10 A] [PState P1]
MSR C0010066  	8000-0000-4265-D251 [ 9.00x] [0.6062 V] [ 0.90 A] [PState P2]
MSR C0010067  	0000-0000-0000-0000
MSR C0010068  	0000-0000-0000-0000
MSR C0010069  	0000-0000-0000-0000
MSR C001006A  	0000-0000-0000-0000
MSR C001006B  	0000-0000-0000-0000
MSR C0010070  	< FAILED >
MSR C0010293  	0000-0000-014C-4230 [48.00x] [1.2437V]
MSR C0010293  	0000-0000-00A2-6150 [ 4.85x] [0.6937V]
MSR C0010293  	0000-0000-013E-4230 [48.00x] [-0.0063V]
MSR C0010293  	0000-0000-00A2-6150 [ 4.85x] [0.6937V]
MSR C0010293  	0000-0000-02D8-6150 [ 4.85x] [0.9437V]
MSR C0010140  	0000-0000-0000-0000
MSR C0010141  	0000-0000-0000-0000
MSR C0010290  	< FAILED >
MSR C0010292  	0000-0001-0400-4992
MSR C0010293  	0000-0000-02D8-6150
MSR C0010294  	0FC2-6581-0000-4912
MSR C0010296  	0000-0000-0048-4848
MSR C0010299  	0000-0000-000A-1003
MSR C001029A  	0000-0000-00EF-5799
MSR C001029B  	0000-0000-0670-196E
MSR C0011023  	0002-0000-0000-0020
 
MSR Registers (CPU #6):
CPU Clock (Normal)  	4797 MHz
CPU Clock (TSC)  	2395 MHz
CPU Multiplier  	48.0x
CPB PStates  	0
MSR 0000001B  	0000-0000-FEE0-0900
MSR 0000008B  	0000-0000-08A0-0006
MSR 000000E7  	0000-0050-DE60-3C28
MSR 000000E8  	0000-0070-6999-3170
MSR C0010004  	0000-0000-0000-0000
MSR C0010005  	0000-0000-0000-0000
MSR C0010006  	0000-0000-0000-0000
MSR C0010007  	0000-0000-0000-0000
MSR C0010015  	0000-0001-C900-0011
MSR C001001F  	0000-0000-0000-0000
MSR C0010055  	0000-0000-0000-0000
MSR C0010058  	0000-0000-E000-0021
MSR C0010061  	0000-0000-0000-0020
MSR C0010062  	0000-0000-0000-0000
MSR C0010063  	0000-0000-0000-0000
MSR C0010064  	8000-0000-462F-C860 [88.00x] [0.3563 V] [ 2.40 A] [PState P0]
MSR C0010065  	8000-0000-42EA-D058 [11.00x] [0.4813 V] [ 1.10 A] [PState P1]
MSR C0010066  	8000-0000-4265-D251 [ 9.00x] [0.6062 V] [ 0.90 A] [PState P2]
MSR C0010067  	0000-0000-0000-0000
MSR C0010068  	0000-0000-0000-0000
MSR C0010069  	0000-0000-0000-0000
MSR C001006A  	0000-0000-0000-0000
MSR C001006B  	0000-0000-0000-0000
MSR C0010070  	< FAILED >
MSR C0010293  	0000-0000-014C-4230 [48.00x] [1.2437V]
MSR C0010293  	0000-0000-013E-4230 [48.00x] [-0.0063V]
MSR C0010293  	0000-0000-00A2-6150 [ 4.85x] [0.6937V]
MSR C0010293  	0000-0000-00A2-6150 [ 4.85x] [0.6937V]
MSR C0010293  	0000-0000-02A2-6150 [ 4.85x] [0.6937V]
MSR C0010140  	0000-0000-0000-0000
MSR C0010141  	0000-0000-0000-0000
MSR C0010290  	< FAILED >
MSR C0010292  	0000-0001-0400-4992
MSR C0010293  	0000-0000-02A2-6150
MSR C0010294  	0FC2-6581-0000-4912
MSR C0010296  	0000-0000-0048-4848
MSR C0010299  	0000-0000-000A-1003
MSR C001029A  	0000-0000-00EF-6423
MSR C001029B  	0000-0000-0670-581A
MSR C0011023  	0002-0000-0000-0020
 
MSR Registers (CPU #7):
CPU Clock (Normal)  	485 MHz
CPU Clock (TSC)  	2396 MHz
CPU Multiplier  	4.8x
CPB PStates  	0
MSR 0000001B  	0000-0000-FEE0-0900
MSR 0000008B  	0000-0000-08A0-0006
MSR 000000E7  	0000-0050-E71A-0908
MSR 000000E8  	0000-0070-7282-BB3F
MSR C0010004  	0000-0000-0000-0000
MSR C0010005  	0000-0000-0000-0000
MSR C0010006  	0000-0000-0000-0000
MSR C0010007  	0000-0000-0000-0000
MSR C0010015  	0000-0001-C900-0011
MSR C001001F  	0000-0000-0000-0000
MSR C0010055  	0000-0000-0000-0000
MSR C0010058  	0000-0000-E000-0021
MSR C0010061  	0000-0000-0000-0020
MSR C0010062  	0000-0000-0000-0000
MSR C0010063  	0000-0000-0000-0000
MSR C0010064  	8000-0000-462F-C860 [88.00x] [0.3563 V] [ 2.40 A] [PState P0]
MSR C0010065  	8000-0000-42EA-D058 [11.00x] [0.4813 V] [ 1.10 A] [PState P1]
MSR C0010066  	8000-0000-4265-D251 [ 9.00x] [0.6062 V] [ 0.90 A] [PState P2]
MSR C0010067  	0000-0000-0000-0000
MSR C0010068  	0000-0000-0000-0000
MSR C0010069  	0000-0000-0000-0000
MSR C001006A  	0000-0000-0000-0000
MSR C001006B  	0000-0000-0000-0000
MSR C0010070  	< FAILED >
MSR C0010293  	0000-0000-014C-4230 [48.00x] [1.2437V]
MSR C0010293  	0000-0000-013E-4230 [48.00x] [-0.0063V]
MSR C0010293  	0000-0000-00A2-6150 [ 4.85x] [0.6937V]
MSR C0010293  	0000-0000-013E-4230 [48.00x] [-0.0063V]
MSR C0010293  	0000-0000-013E-4230 [48.00x] [-0.0063V]
MSR C0010140  	0000-0000-0000-0000
MSR C0010141  	0000-0000-0000-0000
MSR C0010290  	< FAILED >
MSR C0010292  	0000-0001-0400-4992
MSR C0010293  	0000-0000-013E-4230
MSR C0010294  	0FC2-6581-0000-4912
MSR C0010296  	0000-0000-0048-4848
MSR C0010299  	0000-0000-000A-1003
MSR C001029A  	0000-0000-00EF-6626
MSR C001029B  	0000-0000-0670-628E
MSR C0011023  	0002-0000-0000-0020
