------[ Versions ]------

Program Version : EVEREST v4.60.1628 Beta
BenchDLL Version: 2.4.257.0

------[ CPU Info ]------

CPU Type           : AMD Duron, 600 MHz (6 x 100)
CPU Alias          : Spitfire
CPU Platform       : Socket A
CPU Stepping       : A0
Instruction Set    : x86, MMX, 3DNow!
CPUID Manufacturer : AuthenticAMD
CPUID CPU Name     : AMD Duron(tm) processor
CPUID Revision     : 00000630h
Platform ID        : D1h  (Socket A)

------[ Logical CPU #0 ]------

allcpu: Valid

CPUID 00000000: 00000001-68747541-444D4163-69746E65
CPUID 00000001: 00000630-00000000-00000000-0183F9FF
CPUID 80000000: 80000006-68747541-444D4163-69746E65
CPUID 80000001: 00000730-00000000-00000000-C1C7F9FF
CPUID 80000002: 20444D41-6F727544-6D74286E-72702029
CPUID 80000003: 7365636F-00726F73-00000000-00000000
CPUID 80000004: 00000000-00000000-00000000-00000000
CPUID 80000005: 0408FF08-FF18FF10-40020140-40020140
CPUID 80000006: 00000000-41004100-00018140-00000000

------[ MSR Registers ]------

MSR 0000001B: 0000-0000-FEE0-0100
MSR C0010015: 0000-0000-0600-1008

PerformanceFrequency = 3579545

Tjmax Temperature = 0 Celsius
