CPUID 00000000: 00000001 68747541 444D4163 69746E65
CPUID 00000001: 00010FF0 00000800 00000000 078BFBFF
CPUID 80000000: 80000018 68747541 444D4163 69746E65
CPUID 80000001: 00010FF0 00000886 00000001 E3D3FBFF
CPUID 80000002: 20444D41 706D6553 286E6F72 20296D74
CPUID 80000003: 636F7250 6F737365 30332072 002B3030
CPUID 80000004: 00000000 00000000 00000000 00000000
CPUID 80000005: FF08FF08 FF20FF20 40020140 40020140
CPUID 80000006: 00000000 42004200 00808140 00000000
CPUID 80000007: 00000000 00000000 00000000 0000000F
CPUID 80000008: 00003028 00000000 00000000 00000000
CPUID 80000009: 00000000 00000000 00000000 00000000
CPUID 8000000A: 00000000 00000000 00000000 00000000
CPUID 8000000B: 00000000 00000000 00000000 00000000
CPUID 8000000C: 00000000 00000000 00000000 00000000
CPUID 8000000D: 00000000 00000000 00000000 00000000
CPUID 8000000E: 00000000 00000000 00000000 00000000
CPUID 8000000F: 00000000 00000000 00000000 00000000
CPUID 80000010: 00000000 00000000 00000000 00000000
CPUID 80000011: 00000000 00000000 00000000 00000000
CPUID 80000012: 00000000 00000000 00000000 00000000
CPUID 80000013: 00000000 00000000 00000000 00000000
CPUID 80000014: 00000000 00000000 00000000 00000000
CPUID 80000015: 00000000 00000000 00000000 00000000
CPUID 80000016: 00000000 00000000 00000000 00000000
CPUID 80000017: 00000000 00000000 00000000 00000000
CPUID 80000018: 00000000 00000000 00000000 00000000