------[ Versions ]------

Program Version : EVEREST v5.00.1686 Beta
BenchDLL Version: 2.4.258.0

------[ CPU Info ]------

CPU Type           : 2x QuadCore AMD Opteron 2378, 2400 MHz (12 x 200)
CPU Alias          : Shanghai
CPU Platform       : Socket Fr2/Fr4
CPU Stepping       : RB-C2
Instruction Set    : x86, x86-64, MMX, 3DNow!, SSE, SSE2, SSE3, SSE4A
CPUID Manufacturer : AuthenticAMD
CPUID CPU Name     : Quad-Core AMD Opteron(tm) Processor 2378
CPUID Revision     : 00100F42h
AMD K10 Brand ID   : 0CEFh  (Opteron 2378)
Platform ID        : D8h  (Socket Fr2/Fr4)

------[ Logical CPU #0 ]------

allcpu: Valid

CPUID 00000000: 00000005-68747541-444D4163-69746E65
CPUID 00000001: 00100F42-00040800-00802009-178BFBFF
CPUID 00000002: 00000000-00000000-00000000-00000000
CPUID 00000003: 00000000-00000000-00000000-00000000
CPUID 00000005: 00000040-00000040-00000003-00000000
CPUID 80000000: 8000001B-68747541-444D4163-69746E65
CPUID 80000001: 00100F42-00000CEF-000037FF-EFD3FBFF
CPUID 80000002: 64617551-726F432D-4D412065-704F2044
CPUID 80000003: 6F726574-6D74286E-72502029-7365636F
CPUID 80000004: 20726F73-38373332-00000000-00000000
CPUID 80000005: FF30FF10-FF30FF20-40020140-40020140
CPUID 80000006: 20800000-42004200-02008140-0030B140
CPUID 80000007: 00000000-00000000-00000000-000001F9
CPUID 80000008: 00003030-00000000-00002003-00000000
CPUID 80000009: 00000000-00000000-00000000-00000000
CPUID 8000000A: 00000001-00000040-00000000-0000000F
CPUID 8000000B: 00000000-00000000-00000000-00000000
CPUID 8000000C: 00000000-00000000-00000000-00000000
CPUID 8000000D: 00000000-00000000-00000000-00000000
CPUID 8000000E: 00000000-00000000-00000000-00000000
CPUID 8000000F: 00000000-00000000-00000000-00000000
CPUID 80000010: 00000000-00000000-00000000-00000000
CPUID 80000011: 00000000-00000000-00000000-00000000
CPUID 80000012: 00000000-00000000-00000000-00000000
CPUID 80000013: 00000000-00000000-00000000-00000000
CPUID 80000014: 00000000-00000000-00000000-00000000
CPUID 80000015: 00000000-00000000-00000000-00000000
CPUID 80000016: 00000000-00000000-00000000-00000000
CPUID 80000017: 00000000-00000000-00000000-00000000
CPUID 80000018: 00000000-00000000-00000000-00000000
CPUID 80000019: F0300000-60100000-00000000-00000000
CPUID 8000001A: 00000003-00000000-00000000-00000000
CPUID 8000001B: 0000001F-00000000-00000000-00000000
CPUID 8FFFFFFF: 00000000-00000000-00000000-00000000

------[ Logical CPU #1 ]------

allcpu: Valid

CPUID 00000000: 00000005-68747541-444D4163-69746E65
CPUID 00000001: 00100F42-01040800-00802009-178BFBFF
CPUID 00000002: 00000000-00000000-00000000-00000000
CPUID 00000003: 00000000-00000000-00000000-00000000
CPUID 00000005: 00000040-00000040-00000003-00000000
CPUID 80000000: 8000001B-68747541-444D4163-69746E65
CPUID 80000001: 00100F42-00000CEF-000037FF-EFD3FBFF
CPUID 80000002: 64617551-726F432D-4D412065-704F2044
CPUID 80000003: 6F726574-6D74286E-72502029-7365636F
CPUID 80000004: 20726F73-38373332-00000000-00000000
CPUID 80000005: FF30FF10-FF30FF20-40020140-40020140
CPUID 80000006: 20800000-42004200-02008140-0030B140
CPUID 80000007: 00000000-00000000-00000000-000001F9
CPUID 80000008: 00003030-00000000-00002003-00000000
CPUID 80000009: 00000000-00000000-00000000-00000000
CPUID 8000000A: 00000001-00000040-00000000-0000000F
CPUID 8000000B: 00000000-00000000-00000000-00000000
CPUID 8000000C: 00000000-00000000-00000000-00000000
CPUID 8000000D: 00000000-00000000-00000000-00000000
CPUID 8000000E: 00000000-00000000-00000000-00000000
CPUID 8000000F: 00000000-00000000-00000000-00000000
CPUID 80000010: 00000000-00000000-00000000-00000000
CPUID 80000011: 00000000-00000000-00000000-00000000
CPUID 80000012: 00000000-00000000-00000000-00000000
CPUID 80000013: 00000000-00000000-00000000-00000000
CPUID 80000014: 00000000-00000000-00000000-00000000
CPUID 80000015: 00000000-00000000-00000000-00000000
CPUID 80000016: 00000000-00000000-00000000-00000000
CPUID 80000017: 00000000-00000000-00000000-00000000
CPUID 80000018: 00000000-00000000-00000000-00000000
CPUID 80000019: F0300000-60100000-00000000-00000000
CPUID 8000001A: 00000003-00000000-00000000-00000000
CPUID 8000001B: 0000001F-00000000-00000000-00000000
CPUID 8FFFFFFF: 00000000-00000000-00000000-00000000

------[ Logical CPU #2 ]------

allcpu: Valid

CPUID 00000000: 00000005-68747541-444D4163-69746E65
CPUID 00000001: 00100F42-02040800-00802009-178BFBFF
CPUID 00000002: 00000000-00000000-00000000-00000000
CPUID 00000003: 00000000-00000000-00000000-00000000
CPUID 00000005: 00000040-00000040-00000003-00000000
CPUID 80000000: 8000001B-68747541-444D4163-69746E65
CPUID 80000001: 00100F42-00000CEF-000037FF-EFD3FBFF
CPUID 80000002: 64617551-726F432D-4D412065-704F2044
CPUID 80000003: 6F726574-6D74286E-72502029-7365636F
CPUID 80000004: 20726F73-38373332-00000000-00000000
CPUID 80000005: FF30FF10-FF30FF20-40020140-40020140
CPUID 80000006: 20800000-42004200-02008140-0030B140
CPUID 80000007: 00000000-00000000-00000000-000001F9
CPUID 80000008: 00003030-00000000-00002003-00000000
CPUID 80000009: 00000000-00000000-00000000-00000000
CPUID 8000000A: 00000001-00000040-00000000-0000000F
CPUID 8000000B: 00000000-00000000-00000000-00000000
CPUID 8000000C: 00000000-00000000-00000000-00000000
CPUID 8000000D: 00000000-00000000-00000000-00000000
CPUID 8000000E: 00000000-00000000-00000000-00000000
CPUID 8000000F: 00000000-00000000-00000000-00000000
CPUID 80000010: 00000000-00000000-00000000-00000000
CPUID 80000011: 00000000-00000000-00000000-00000000
CPUID 80000012: 00000000-00000000-00000000-00000000
CPUID 80000013: 00000000-00000000-00000000-00000000
CPUID 80000014: 00000000-00000000-00000000-00000000
CPUID 80000015: 00000000-00000000-00000000-00000000
CPUID 80000016: 00000000-00000000-00000000-00000000
CPUID 80000017: 00000000-00000000-00000000-00000000
CPUID 80000018: 00000000-00000000-00000000-00000000
CPUID 80000019: F0300000-60100000-00000000-00000000
CPUID 8000001A: 00000003-00000000-00000000-00000000
CPUID 8000001B: 0000001F-00000000-00000000-00000000
CPUID 8FFFFFFF: 00000000-00000000-00000000-00000000

------[ Logical CPU #3 ]------

allcpu: Valid

CPUID 00000000: 00000005-68747541-444D4163-69746E65
CPUID 00000001: 00100F42-03040800-00802009-178BFBFF
CPUID 00000002: 00000000-00000000-00000000-00000000
CPUID 00000003: 00000000-00000000-00000000-00000000
CPUID 00000005: 00000040-00000040-00000003-00000000
CPUID 80000000: 8000001B-68747541-444D4163-69746E65
CPUID 80000001: 00100F42-00000CEF-000037FF-EFD3FBFF
CPUID 80000002: 64617551-726F432D-4D412065-704F2044
CPUID 80000003: 6F726574-6D74286E-72502029-7365636F
CPUID 80000004: 20726F73-38373332-00000000-00000000
CPUID 80000005: FF30FF10-FF30FF20-40020140-40020140
CPUID 80000006: 20800000-42004200-02008140-0030B140
CPUID 80000007: 00000000-00000000-00000000-000001F9
CPUID 80000008: 00003030-00000000-00002003-00000000
CPUID 80000009: 00000000-00000000-00000000-00000000
CPUID 8000000A: 00000001-00000040-00000000-0000000F
CPUID 8000000B: 00000000-00000000-00000000-00000000
CPUID 8000000C: 00000000-00000000-00000000-00000000
CPUID 8000000D: 00000000-00000000-00000000-00000000
CPUID 8000000E: 00000000-00000000-00000000-00000000
CPUID 8000000F: 00000000-00000000-00000000-00000000
CPUID 80000010: 00000000-00000000-00000000-00000000
CPUID 80000011: 00000000-00000000-00000000-00000000
CPUID 80000012: 00000000-00000000-00000000-00000000
CPUID 80000013: 00000000-00000000-00000000-00000000
CPUID 80000014: 00000000-00000000-00000000-00000000
CPUID 80000015: 00000000-00000000-00000000-00000000
CPUID 80000016: 00000000-00000000-00000000-00000000
CPUID 80000017: 00000000-00000000-00000000-00000000
CPUID 80000018: 00000000-00000000-00000000-00000000
CPUID 80000019: F0300000-60100000-00000000-00000000
CPUID 8000001A: 00000003-00000000-00000000-00000000
CPUID 8000001B: 0000001F-00000000-00000000-00000000
CPUID 8FFFFFFF: 00000000-00000000-00000000-00000000

------[ Logical CPU #4 ]------

allcpu: Valid

CPUID 00000000: 00000005-68747541-444D4163-69746E65
CPUID 00000001: 00100F42-04040800-00802009-178BFBFF
CPUID 00000002: 00000000-00000000-00000000-00000000
CPUID 00000003: 00000000-00000000-00000000-00000000
CPUID 00000005: 00000040-00000040-00000003-00000000
CPUID 80000000: 8000001B-68747541-444D4163-69746E65
CPUID 80000001: 00100F42-00000CEF-000037FF-EFD3FBFF
CPUID 80000002: 64617551-726F432D-4D412065-704F2044
CPUID 80000003: 6F726574-6D74286E-72502029-7365636F
CPUID 80000004: 20726F73-38373332-00000000-00000000
CPUID 80000005: FF30FF10-FF30FF20-40020140-40020140
CPUID 80000006: 20800000-42004200-02008140-0030B140
CPUID 80000007: 00000000-00000000-00000000-000001F9
CPUID 80000008: 00003030-00000000-00002003-00000000
CPUID 80000009: 00000000-00000000-00000000-00000000
CPUID 8000000A: 00000001-00000040-00000000-0000000F
CPUID 8000000B: 00000000-00000000-00000000-00000000
CPUID 8000000C: 00000000-00000000-00000000-00000000
CPUID 8000000D: 00000000-00000000-00000000-00000000
CPUID 8000000E: 00000000-00000000-00000000-00000000
CPUID 8000000F: 00000000-00000000-00000000-00000000
CPUID 80000010: 00000000-00000000-00000000-00000000
CPUID 80000011: 00000000-00000000-00000000-00000000
CPUID 80000012: 00000000-00000000-00000000-00000000
CPUID 80000013: 00000000-00000000-00000000-00000000
CPUID 80000014: 00000000-00000000-00000000-00000000
CPUID 80000015: 00000000-00000000-00000000-00000000
CPUID 80000016: 00000000-00000000-00000000-00000000
CPUID 80000017: 00000000-00000000-00000000-00000000
CPUID 80000018: 00000000-00000000-00000000-00000000
CPUID 80000019: F0300000-60100000-00000000-00000000
CPUID 8000001A: 00000003-00000000-00000000-00000000
CPUID 8000001B: 0000001F-00000000-00000000-00000000
CPUID 8FFFFFFF: 00000000-00000000-00000000-00000000

------[ Logical CPU #5 ]------

allcpu: Valid

CPUID 00000000: 00000005-68747541-444D4163-69746E65
CPUID 00000001: 00100F42-05040800-00802009-178BFBFF
CPUID 00000002: 00000000-00000000-00000000-00000000
CPUID 00000003: 00000000-00000000-00000000-00000000
CPUID 00000005: 00000040-00000040-00000003-00000000
CPUID 80000000: 8000001B-68747541-444D4163-69746E65
CPUID 80000001: 00100F42-00000CEF-000037FF-EFD3FBFF
CPUID 80000002: 64617551-726F432D-4D412065-704F2044
CPUID 80000003: 6F726574-6D74286E-72502029-7365636F
CPUID 80000004: 20726F73-38373332-00000000-00000000
CPUID 80000005: FF30FF10-FF30FF20-40020140-40020140
CPUID 80000006: 20800000-42004200-02008140-0030B140
CPUID 80000007: 00000000-00000000-00000000-000001F9
CPUID 80000008: 00003030-00000000-00002003-00000000
CPUID 80000009: 00000000-00000000-00000000-00000000
CPUID 8000000A: 00000001-00000040-00000000-0000000F
CPUID 8000000B: 00000000-00000000-00000000-00000000
CPUID 8000000C: 00000000-00000000-00000000-00000000
CPUID 8000000D: 00000000-00000000-00000000-00000000
CPUID 8000000E: 00000000-00000000-00000000-00000000
CPUID 8000000F: 00000000-00000000-00000000-00000000
CPUID 80000010: 00000000-00000000-00000000-00000000
CPUID 80000011: 00000000-00000000-00000000-00000000
CPUID 80000012: 00000000-00000000-00000000-00000000
CPUID 80000013: 00000000-00000000-00000000-00000000
CPUID 80000014: 00000000-00000000-00000000-00000000
CPUID 80000015: 00000000-00000000-00000000-00000000
CPUID 80000016: 00000000-00000000-00000000-00000000
CPUID 80000017: 00000000-00000000-00000000-00000000
CPUID 80000018: 00000000-00000000-00000000-00000000
CPUID 80000019: F0300000-60100000-00000000-00000000
CPUID 8000001A: 00000003-00000000-00000000-00000000
CPUID 8000001B: 0000001F-00000000-00000000-00000000
CPUID 8FFFFFFF: 00000000-00000000-00000000-00000000

------[ Logical CPU #6 ]------

allcpu: Valid

CPUID 00000000: 00000005-68747541-444D4163-69746E65
CPUID 00000001: 00100F42-06040800-00802009-178BFBFF
CPUID 00000002: 00000000-00000000-00000000-00000000
CPUID 00000003: 00000000-00000000-00000000-00000000
CPUID 00000005: 00000040-00000040-00000003-00000000
CPUID 80000000: 8000001B-68747541-444D4163-69746E65
CPUID 80000001: 00100F42-00000CEF-000037FF-EFD3FBFF
CPUID 80000002: 64617551-726F432D-4D412065-704F2044
CPUID 80000003: 6F726574-6D74286E-72502029-7365636F
CPUID 80000004: 20726F73-38373332-00000000-00000000
CPUID 80000005: FF30FF10-FF30FF20-40020140-40020140
CPUID 80000006: 20800000-42004200-02008140-0030B140
CPUID 80000007: 00000000-00000000-00000000-000001F9
CPUID 80000008: 00003030-00000000-00002003-00000000
CPUID 80000009: 00000000-00000000-00000000-00000000
CPUID 8000000A: 00000001-00000040-00000000-0000000F
CPUID 8000000B: 00000000-00000000-00000000-00000000
CPUID 8000000C: 00000000-00000000-00000000-00000000
CPUID 8000000D: 00000000-00000000-00000000-00000000
CPUID 8000000E: 00000000-00000000-00000000-00000000
CPUID 8000000F: 00000000-00000000-00000000-00000000
CPUID 80000010: 00000000-00000000-00000000-00000000
CPUID 80000011: 00000000-00000000-00000000-00000000
CPUID 80000012: 00000000-00000000-00000000-00000000
CPUID 80000013: 00000000-00000000-00000000-00000000
CPUID 80000014: 00000000-00000000-00000000-00000000
CPUID 80000015: 00000000-00000000-00000000-00000000
CPUID 80000016: 00000000-00000000-00000000-00000000
CPUID 80000017: 00000000-00000000-00000000-00000000
CPUID 80000018: 00000000-00000000-00000000-00000000
CPUID 80000019: F0300000-60100000-00000000-00000000
CPUID 8000001A: 00000003-00000000-00000000-00000000
CPUID 8000001B: 0000001F-00000000-00000000-00000000
CPUID 8FFFFFFF: 00000000-00000000-00000000-00000000

------[ Logical CPU #7 ]------

allcpu: Valid

CPUID 00000000: 00000005-68747541-444D4163-69746E65
CPUID 00000001: 00100F42-07040800-00802009-178BFBFF
CPUID 00000002: 00000000-00000000-00000000-00000000
CPUID 00000003: 00000000-00000000-00000000-00000000
CPUID 00000005: 00000040-00000040-00000003-00000000
CPUID 80000000: 8000001B-68747541-444D4163-69746E65
CPUID 80000001: 00100F42-00000CEF-000037FF-EFD3FBFF
CPUID 80000002: 64617551-726F432D-4D412065-704F2044
CPUID 80000003: 6F726574-6D74286E-72502029-7365636F
CPUID 80000004: 20726F73-38373332-00000000-00000000
CPUID 80000005: FF30FF10-FF30FF20-40020140-40020140
CPUID 80000006: 20800000-42004200-02008140-0030B140
CPUID 80000007: 00000000-00000000-00000000-000001F9
CPUID 80000008: 00003030-00000000-00002003-00000000
CPUID 80000009: 00000000-00000000-00000000-00000000
CPUID 8000000A: 00000001-00000040-00000000-0000000F
CPUID 8000000B: 00000000-00000000-00000000-00000000
CPUID 8000000C: 00000000-00000000-00000000-00000000
CPUID 8000000D: 00000000-00000000-00000000-00000000
CPUID 8000000E: 00000000-00000000-00000000-00000000
CPUID 8000000F: 00000000-00000000-00000000-00000000
CPUID 80000010: 00000000-00000000-00000000-00000000
CPUID 80000011: 00000000-00000000-00000000-00000000
CPUID 80000012: 00000000-00000000-00000000-00000000
CPUID 80000013: 00000000-00000000-00000000-00000000
CPUID 80000014: 00000000-00000000-00000000-00000000
CPUID 80000015: 00000000-00000000-00000000-00000000
CPUID 80000016: 00000000-00000000-00000000-00000000
CPUID 80000017: 00000000-00000000-00000000-00000000
CPUID 80000018: 00000000-00000000-00000000-00000000
CPUID 80000019: F0300000-60100000-00000000-00000000
CPUID 8000001A: 00000003-00000000-00000000-00000000
CPUID 8000001B: 0000001F-00000000-00000000-00000000
CPUID 8FFFFFFF: 00000000-00000000-00000000-00000000

------[ MSR Registers ]------

CPU Clock (Normal): 2399 MHz
CPU Clock (TSC): 2399 MHz
CPU Multiplier: 12.0x
MSR 0000001B: 0000-0000-FEE0-0900
MSR C0010015: 0000-0000-0100-0011
MSR C001001F: 0040-4000-0000-0008
MSR C0010055: 0000-0000-0220-142E
MSR C0010058: 0000-0000-E000-0021
MSR C0010061: 0000-0000-0000-0030
MSR C0010062: 0000-0000-0000-0000
MSR C0010063: 0000-0000-0000-0000
MSR C0010064: 8000-01E1-3000-3008 [12.00x]
MSR C0010065: 8000-01C8-4000-4001 [8.50x]
MSR C0010066: 8000-01B6-4000-4048 [6.00x]
MSR C0010067: 8000-01A8-4000-4040 [4.00x]
MSR C0010068: 0000-0000-0000-0000
MSR C0010071: 30B0-00C3-3000-3008 [12.00x]
MSR C0010140: 0000-0000-0000-0001
MSR C0010141: 0000-0000-0000-0000
MSR C0011023: 0000-0000-1020-0020

PerformanceFrequency = 2400090000

Tjmax Temperature = 0 Celsius
