------[ CPUID Registers / Logical CPU #0 ]------

allcpu: Package 0 / Core 0 / Thread 0: Valid

CPUID 00000000: 00000010-68747541-444D4163-69746E65 [AuthenticAMD]
CPUID 00000001: 00890F10-00080800-7ED8320B-178BFBFF
CPUID 00000002: 00000000-00000000-00000000-00000000
CPUID 00000003: 00000000-00000000-00000000-00000000
CPUID 00000005: 00000040-00000040-00000003-00000011
CPUID 00000006: 00000004-00000000-00000001-00000000
CPUID 00000007: 00000000-219C91A9-00400004-00000000 [SL 00]
CPUID 00000008: 00000000-00000000-00000000-00000000
CPUID 00000009: 00000000-00000000-00000000-00000000
CPUID 0000000A: 00000000-00000000-00000000-00000000
CPUID 0000000B: 00000001-00000002-00000100-00000000 [SL 00]
CPUID 0000000B: 00000007-00000008-00000201-00000000 [SL 01]
CPUID 0000000C: 00000000-00000000-00000000-00000000
CPUID 0000000D: 00000207-00000340-00000380-00000000 [SL 00] [x87]
CPUID 0000000D: 0000000F-00000340-00000000-00000000 [SL 01] [SSE]
CPUID 0000000D: 00000100-00000240-00000000-00000000 [SL 02] [AVX]
CPUID 0000000D: 00000040-00000340-00000000-00000000 [SL 09] [PKRU]
CPUID 0000000E: 00000000-00000000-00000000-00000000
CPUID 0000000F: 00000000-000000FF-00000000-00000002 [SL 00]
CPUID 0000000F: 00000000-00000040-000000FF-00000007 [SL 01]
CPUID 00000010: 00000000-00000002-00000000-00000000 [SL 00]
CPUID 00000010: 0000000F-00000000-00000004-0000000F [SL 01]
CPUID 80000000: 80000020-68747541-444D4163-69746E65 [AuthenticAMD]
CPUID 80000001: 00890F10-30000000-75C237FF-2FD3FBFF
CPUID 80000002: 20444D41-74737543-41206D6F-30205550 [AMD Custom APU 0]
CPUID 80000003: 00323339-6D412020-78634364-66466856 [932  AmdCcxVhFf]
CPUID 80000004: 69655033-74696E49-746E4520-000A7972 [3PeiInit Entry]
CPUID 80000005: FF40FF40-FF40FF40-20080140-20080140 [L1D: 32 KB / L1I: 32 KB]
CPUID 80000006: 48006400-68006400-02006140-00209140 [L2: 512 KB] / L3: 4096 KB]
CPUID 80000007: 00000000-0000001B-00000000-00006799
CPUID 80000008: 00003030-090CF657-00007007-00010000
CPUID 80000009: 00000000-00000000-00000000-00000000
CPUID 8000000A: 00000001-00008000-00000000-0013BCFF
CPUID 8000000B: 00000000-00000000-00000000-00000000
CPUID 8000000C: 00000000-00000000-00000000-00000000
CPUID 8000000D: 00000000-00000000-00000000-00000000
CPUID 8000000E: 00000000-00000000-00000000-00000000
CPUID 8000000F: 00000000-00000000-00000000-00000000
CPUID 80000010: 00000000-00000000-00000000-00000000
CPUID 80000011: 00000000-00000000-00000000-00000000
CPUID 80000012: 00000000-00000000-00000000-00000000
CPUID 80000013: 00000000-00000000-00000000-00000000
CPUID 80000014: 00000000-00000000-00000000-00000000
CPUID 80000015: 00000000-00000000-00000000-00000000
CPUID 80000016: 00000000-00000000-00000000-00000000
CPUID 80000017: 00000000-00000000-00000000-00000000
CPUID 80000018: 00000000-00000000-00000000-00000000
CPUID 80000019: F040F040-00000000-00000000-00000000
CPUID 8000001A: 00000006-00000000-00000000-00000000
CPUID 8000001B: 000003FF-00000000-00000000-00000000
CPUID 8000001C: 00000000-00000000-00000000-00000000
CPUID 8000001D: 00004121-01C0003F-0000003F-00000000 [SL 00] [L1D: 32 KB]
CPUID 8000001D: 00004122-01C0003F-0000003F-00000000 [SL 01] [L1I: 32 KB]
CPUID 8000001D: 00004143-01C0003F-000003FF-00000002 [SL 02] [L2U: 512 KB]
CPUID 8000001D: 0001C163-03C0003F-00000FFF-00000001 [SL 03] [L3U: 4 MB]
CPUID 8000001E: 00000000-00000100-00000000-00000000
CPUID 8000001F: 0001000F-0000012F-0000000E-00000001
CPUID 80000020: 00000000-00000002-00000000-00000000 [SL 00]
CPUID 80000020: 0000000B-00000000-00000000-0000000F [SL 01]
CPUID 8FFFFFFF: 00000000-00000000-00000000-00000000

L1    Data Cache:    32 KB,  8-way Associative, 64-byte Line
L1  Instr. Cache:    32 KB,  8-way Associative, 64-byte Line
L2 Unified Cache:   512 KB,  8-way Associative, 64-byte Line
L3 Unified Cache:     4 MB, 16-way Associative, 64-byte Line

------[ CPUID Registers / Logical CPU #1 ]------

allcpu: Package 0 / Core 0 / Thread 1: Valid, Virtual

CPUID 00000000: 00000010-68747541-444D4163-69746E65 [AuthenticAMD]
CPUID 00000001: 00890F10-01080800-7ED8320B-178BFBFF
CPUID 00000002: 00000000-00000000-00000000-00000000
CPUID 00000003: 00000000-00000000-00000000-00000000
CPUID 00000005: 00000040-00000040-00000003-00000011
CPUID 00000006: 00000004-00000000-00000001-00000000
CPUID 00000007: 00000000-219C91A9-00400004-00000000 [SL 00]
CPUID 00000008: 00000000-00000000-00000000-00000000
CPUID 00000009: 00000000-00000000-00000000-00000000
CPUID 0000000A: 00000000-00000000-00000000-00000000
CPUID 0000000B: 00000001-00000002-00000100-00000001 [SL 00]
CPUID 0000000B: 00000007-00000008-00000201-00000001 [SL 01]
CPUID 0000000C: 00000000-00000000-00000000-00000000
CPUID 0000000D: 00000207-00000340-00000380-00000000 [SL 00] [x87]
CPUID 0000000D: 0000000F-00000340-00000000-00000000 [SL 01] [SSE]
CPUID 0000000D: 00000100-00000240-00000000-00000000 [SL 02] [AVX]
CPUID 0000000D: 00000040-00000340-00000000-00000000 [SL 09] [PKRU]
CPUID 0000000E: 00000000-00000000-00000000-00000000
CPUID 0000000F: 00000000-000000FF-00000000-00000002 [SL 00]
CPUID 0000000F: 00000000-00000040-000000FF-00000007 [SL 01]
CPUID 00000010: 00000000-00000002-00000000-00000000 [SL 00]
CPUID 00000010: 0000000F-00000000-00000004-0000000F [SL 01]
CPUID 80000000: 80000020-68747541-444D4163-69746E65 [AuthenticAMD]
CPUID 80000001: 00890F10-30000000-75C237FF-2FD3FBFF
CPUID 80000002: 20444D41-74737543-41206D6F-30205550 [AMD Custom APU 0]
CPUID 80000003: 00323339-6D412020-78634364-66466856 [932  AmdCcxVhFf]
CPUID 80000004: 69655033-74696E49-746E4520-000A7972 [3PeiInit Entry]
CPUID 80000005: FF40FF40-FF40FF40-20080140-20080140 [L1D: 32 KB / L1I: 32 KB]
CPUID 80000006: 48006400-68006400-02006140-00209140 [L2: 512 KB] / L3: 4096 KB]
CPUID 80000007: 00000000-0000001B-00000000-00006799
CPUID 80000008: 00003030-090CF657-00007007-00010000
CPUID 80000009: 00000000-00000000-00000000-00000000
CPUID 8000000A: 00000001-00008000-00000000-0013BCFF
CPUID 8000000B: 00000000-00000000-00000000-00000000
CPUID 8000000C: 00000000-00000000-00000000-00000000
CPUID 8000000D: 00000000-00000000-00000000-00000000
CPUID 8000000E: 00000000-00000000-00000000-00000000
CPUID 8000000F: 00000000-00000000-00000000-00000000
CPUID 80000010: 00000000-00000000-00000000-00000000
CPUID 80000011: 00000000-00000000-00000000-00000000
CPUID 80000012: 00000000-00000000-00000000-00000000
CPUID 80000013: 00000000-00000000-00000000-00000000
CPUID 80000014: 00000000-00000000-00000000-00000000
CPUID 80000015: 00000000-00000000-00000000-00000000
CPUID 80000016: 00000000-00000000-00000000-00000000
CPUID 80000017: 00000000-00000000-00000000-00000000
CPUID 80000018: 00000000-00000000-00000000-00000000
CPUID 80000019: F040F040-00000000-00000000-00000000
CPUID 8000001A: 00000006-00000000-00000000-00000000
CPUID 8000001B: 000003FF-00000000-00000000-00000000
CPUID 8000001C: 00000000-00000000-00000000-00000000
CPUID 8000001D: 00004121-01C0003F-0000003F-00000000 [SL 00] [L1D: 32 KB]
CPUID 8000001D: 00004122-01C0003F-0000003F-00000000 [SL 01] [L1I: 32 KB]
CPUID 8000001D: 00004143-01C0003F-000003FF-00000002 [SL 02] [L2U: 512 KB]
CPUID 8000001D: 0001C163-03C0003F-00000FFF-00000001 [SL 03] [L3U: 4 MB]
CPUID 8000001E: 00000001-00000100-00000000-00000000
CPUID 8000001F: 0001000F-0000012F-0000000E-00000001
CPUID 80000020: 00000000-00000002-00000000-00000000 [SL 00]
CPUID 80000020: 0000000B-00000000-00000000-0000000F [SL 01]
CPUID 8FFFFFFF: 00000000-00000000-00000000-00000000

L1    Data Cache:    32 KB,  8-way Associative, 64-byte Line
L1  Instr. Cache:    32 KB,  8-way Associative, 64-byte Line
L2 Unified Cache:   512 KB,  8-way Associative, 64-byte Line
L3 Unified Cache:     4 MB, 16-way Associative, 64-byte Line

------[ CPUID Registers / Logical CPU #2 ]------

allcpu: Package 0 / Core 1 / Thread 0: Valid

CPUID 00000000: 00000010-68747541-444D4163-69746E65 [AuthenticAMD]
CPUID 00000001: 00890F10-02080800-7ED8320B-178BFBFF
CPUID 00000002: 00000000-00000000-00000000-00000000
CPUID 00000003: 00000000-00000000-00000000-00000000
CPUID 00000005: 00000040-00000040-00000003-00000011
CPUID 00000006: 00000004-00000000-00000001-00000000
CPUID 00000007: 00000000-219C91A9-00400004-00000000 [SL 00]
CPUID 00000008: 00000000-00000000-00000000-00000000
CPUID 00000009: 00000000-00000000-00000000-00000000
CPUID 0000000A: 00000000-00000000-00000000-00000000
CPUID 0000000B: 00000001-00000002-00000100-00000002 [SL 00]
CPUID 0000000B: 00000007-00000008-00000201-00000002 [SL 01]
CPUID 0000000C: 00000000-00000000-00000000-00000000
CPUID 0000000D: 00000207-00000340-00000380-00000000 [SL 00] [x87]
CPUID 0000000D: 0000000F-00000340-00000000-00000000 [SL 01] [SSE]
CPUID 0000000D: 00000100-00000240-00000000-00000000 [SL 02] [AVX]
CPUID 0000000D: 00000040-00000340-00000000-00000000 [SL 09] [PKRU]
CPUID 0000000E: 00000000-00000000-00000000-00000000
CPUID 0000000F: 00000000-000000FF-00000000-00000002 [SL 00]
CPUID 0000000F: 00000000-00000040-000000FF-00000007 [SL 01]
CPUID 00000010: 00000000-00000002-00000000-00000000 [SL 00]
CPUID 00000010: 0000000F-00000000-00000004-0000000F [SL 01]
CPUID 80000000: 80000020-68747541-444D4163-69746E65 [AuthenticAMD]
CPUID 80000001: 00890F10-30000000-75C237FF-2FD3FBFF
CPUID 80000002: 20444D41-74737543-41206D6F-30205550 [AMD Custom APU 0]
CPUID 80000003: 00323339-6D412020-78634364-66466856 [932  AmdCcxVhFf]
CPUID 80000004: 69655033-74696E49-746E4520-000A7972 [3PeiInit Entry]
CPUID 80000005: FF40FF40-FF40FF40-20080140-20080140 [L1D: 32 KB / L1I: 32 KB]
CPUID 80000006: 48006400-68006400-02006140-00209140 [L2: 512 KB] / L3: 4096 KB]
CPUID 80000007: 00000000-0000001B-00000000-00006799
CPUID 80000008: 00003030-090CF657-00007007-00010000
CPUID 80000009: 00000000-00000000-00000000-00000000
CPUID 8000000A: 00000001-00008000-00000000-0013BCFF
CPUID 8000000B: 00000000-00000000-00000000-00000000
CPUID 8000000C: 00000000-00000000-00000000-00000000
CPUID 8000000D: 00000000-00000000-00000000-00000000
CPUID 8000000E: 00000000-00000000-00000000-00000000
CPUID 8000000F: 00000000-00000000-00000000-00000000
CPUID 80000010: 00000000-00000000-00000000-00000000
CPUID 80000011: 00000000-00000000-00000000-00000000
CPUID 80000012: 00000000-00000000-00000000-00000000
CPUID 80000013: 00000000-00000000-00000000-00000000
CPUID 80000014: 00000000-00000000-00000000-00000000
CPUID 80000015: 00000000-00000000-00000000-00000000
CPUID 80000016: 00000000-00000000-00000000-00000000
CPUID 80000017: 00000000-00000000-00000000-00000000
CPUID 80000018: 00000000-00000000-00000000-00000000
CPUID 80000019: F040F040-00000000-00000000-00000000
CPUID 8000001A: 00000006-00000000-00000000-00000000
CPUID 8000001B: 000003FF-00000000-00000000-00000000
CPUID 8000001C: 00000000-00000000-00000000-00000000
CPUID 8000001D: 00004121-01C0003F-0000003F-00000000 [SL 00] [L1D: 32 KB]
CPUID 8000001D: 00004122-01C0003F-0000003F-00000000 [SL 01] [L1I: 32 KB]
CPUID 8000001D: 00004143-01C0003F-000003FF-00000002 [SL 02] [L2U: 512 KB]
CPUID 8000001D: 0001C163-03C0003F-00000FFF-00000001 [SL 03] [L3U: 4 MB]
CPUID 8000001E: 00000002-00000101-00000000-00000000
CPUID 8000001F: 0001000F-0000012F-0000000E-00000001
CPUID 80000020: 00000000-00000002-00000000-00000000 [SL 00]
CPUID 80000020: 0000000B-00000000-00000000-0000000F [SL 01]
CPUID 8FFFFFFF: 00000000-00000000-00000000-00000000

L1    Data Cache:    32 KB,  8-way Associative, 64-byte Line
L1  Instr. Cache:    32 KB,  8-way Associative, 64-byte Line
L2 Unified Cache:   512 KB,  8-way Associative, 64-byte Line
L3 Unified Cache:     4 MB, 16-way Associative, 64-byte Line

------[ CPUID Registers / Logical CPU #3 ]------

allcpu: Package 0 / Core 1 / Thread 1: Valid, Virtual

CPUID 00000000: 00000010-68747541-444D4163-69746E65 [AuthenticAMD]
CPUID 00000001: 00890F10-03080800-7ED8320B-178BFBFF
CPUID 00000002: 00000000-00000000-00000000-00000000
CPUID 00000003: 00000000-00000000-00000000-00000000
CPUID 00000005: 00000040-00000040-00000003-00000011
CPUID 00000006: 00000004-00000000-00000001-00000000
CPUID 00000007: 00000000-219C91A9-00400004-00000000 [SL 00]
CPUID 00000008: 00000000-00000000-00000000-00000000
CPUID 00000009: 00000000-00000000-00000000-00000000
CPUID 0000000A: 00000000-00000000-00000000-00000000
CPUID 0000000B: 00000001-00000002-00000100-00000003 [SL 00]
CPUID 0000000B: 00000007-00000008-00000201-00000003 [SL 01]
CPUID 0000000C: 00000000-00000000-00000000-00000000
CPUID 0000000D: 00000207-00000340-00000380-00000000 [SL 00] [x87]
CPUID 0000000D: 0000000F-00000340-00000000-00000000 [SL 01] [SSE]
CPUID 0000000D: 00000100-00000240-00000000-00000000 [SL 02] [AVX]
CPUID 0000000D: 00000040-00000340-00000000-00000000 [SL 09] [PKRU]
CPUID 0000000E: 00000000-00000000-00000000-00000000
CPUID 0000000F: 00000000-000000FF-00000000-00000002 [SL 00]
CPUID 0000000F: 00000000-00000040-000000FF-00000007 [SL 01]
CPUID 00000010: 00000000-00000002-00000000-00000000 [SL 00]
CPUID 00000010: 0000000F-00000000-00000004-0000000F [SL 01]
CPUID 80000000: 80000020-68747541-444D4163-69746E65 [AuthenticAMD]
CPUID 80000001: 00890F10-30000000-75C237FF-2FD3FBFF
CPUID 80000002: 20444D41-74737543-41206D6F-30205550 [AMD Custom APU 0]
CPUID 80000003: 00323339-6D412020-78634364-66466856 [932  AmdCcxVhFf]
CPUID 80000004: 69655033-74696E49-746E4520-000A7972 [3PeiInit Entry]
CPUID 80000005: FF40FF40-FF40FF40-20080140-20080140 [L1D: 32 KB / L1I: 32 KB]
CPUID 80000006: 48006400-68006400-02006140-00209140 [L2: 512 KB] / L3: 4096 KB]
CPUID 80000007: 00000000-0000001B-00000000-00006799
CPUID 80000008: 00003030-090CF657-00007007-00010000
CPUID 80000009: 00000000-00000000-00000000-00000000
CPUID 8000000A: 00000001-00008000-00000000-0013BCFF
CPUID 8000000B: 00000000-00000000-00000000-00000000
CPUID 8000000C: 00000000-00000000-00000000-00000000
CPUID 8000000D: 00000000-00000000-00000000-00000000
CPUID 8000000E: 00000000-00000000-00000000-00000000
CPUID 8000000F: 00000000-00000000-00000000-00000000
CPUID 80000010: 00000000-00000000-00000000-00000000
CPUID 80000011: 00000000-00000000-00000000-00000000
CPUID 80000012: 00000000-00000000-00000000-00000000
CPUID 80000013: 00000000-00000000-00000000-00000000
CPUID 80000014: 00000000-00000000-00000000-00000000
CPUID 80000015: 00000000-00000000-00000000-00000000
CPUID 80000016: 00000000-00000000-00000000-00000000
CPUID 80000017: 00000000-00000000-00000000-00000000
CPUID 80000018: 00000000-00000000-00000000-00000000
CPUID 80000019: F040F040-00000000-00000000-00000000
CPUID 8000001A: 00000006-00000000-00000000-00000000
CPUID 8000001B: 000003FF-00000000-00000000-00000000
CPUID 8000001C: 00000000-00000000-00000000-00000000
CPUID 8000001D: 00004121-01C0003F-0000003F-00000000 [SL 00] [L1D: 32 KB]
CPUID 8000001D: 00004122-01C0003F-0000003F-00000000 [SL 01] [L1I: 32 KB]
CPUID 8000001D: 00004143-01C0003F-000003FF-00000002 [SL 02] [L2U: 512 KB]
CPUID 8000001D: 0001C163-03C0003F-00000FFF-00000001 [SL 03] [L3U: 4 MB]
CPUID 8000001E: 00000003-00000101-00000000-00000000
CPUID 8000001F: 0001000F-0000012F-0000000E-00000001
CPUID 80000020: 00000000-00000002-00000000-00000000 [SL 00]
CPUID 80000020: 0000000B-00000000-00000000-0000000F [SL 01]
CPUID 8FFFFFFF: 00000000-00000000-00000000-00000000

L1    Data Cache:    32 KB,  8-way Associative, 64-byte Line
L1  Instr. Cache:    32 KB,  8-way Associative, 64-byte Line
L2 Unified Cache:   512 KB,  8-way Associative, 64-byte Line
L3 Unified Cache:     4 MB, 16-way Associative, 64-byte Line

------[ CPUID Registers / Logical CPU #4 ]------

allcpu: Package 0 / Core 2 / Thread 0: Valid

CPUID 00000000: 00000010-68747541-444D4163-69746E65 [AuthenticAMD]
CPUID 00000001: 00890F10-04080800-7ED8320B-178BFBFF
CPUID 00000002: 00000000-00000000-00000000-00000000
CPUID 00000003: 00000000-00000000-00000000-00000000
CPUID 00000005: 00000040-00000040-00000003-00000011
CPUID 00000006: 00000004-00000000-00000001-00000000
CPUID 00000007: 00000000-219C91A9-00400004-00000000 [SL 00]
CPUID 00000008: 00000000-00000000-00000000-00000000
CPUID 00000009: 00000000-00000000-00000000-00000000
CPUID 0000000A: 00000000-00000000-00000000-00000000
CPUID 0000000B: 00000001-00000002-00000100-00000004 [SL 00]
CPUID 0000000B: 00000007-00000008-00000201-00000004 [SL 01]
CPUID 0000000C: 00000000-00000000-00000000-00000000
CPUID 0000000D: 00000207-00000340-00000380-00000000 [SL 00] [x87]
CPUID 0000000D: 0000000F-00000340-00000000-00000000 [SL 01] [SSE]
CPUID 0000000D: 00000100-00000240-00000000-00000000 [SL 02] [AVX]
CPUID 0000000D: 00000040-00000340-00000000-00000000 [SL 09] [PKRU]
CPUID 0000000E: 00000000-00000000-00000000-00000000
CPUID 0000000F: 00000000-000000FF-00000000-00000002 [SL 00]
CPUID 0000000F: 00000000-00000040-000000FF-00000007 [SL 01]
CPUID 00000010: 00000000-00000002-00000000-00000000 [SL 00]
CPUID 00000010: 0000000F-00000000-00000004-0000000F [SL 01]
CPUID 80000000: 80000020-68747541-444D4163-69746E65 [AuthenticAMD]
CPUID 80000001: 00890F10-30000000-75C237FF-2FD3FBFF
CPUID 80000002: 20444D41-74737543-41206D6F-30205550 [AMD Custom APU 0]
CPUID 80000003: 00323339-6D412020-78634364-66466856 [932  AmdCcxVhFf]
CPUID 80000004: 69655033-74696E49-746E4520-000A7972 [3PeiInit Entry]
CPUID 80000005: FF40FF40-FF40FF40-20080140-20080140 [L1D: 32 KB / L1I: 32 KB]
CPUID 80000006: 48006400-68006400-02006140-00209140 [L2: 512 KB] / L3: 4096 KB]
CPUID 80000007: 00000000-0000001B-00000000-00006799
CPUID 80000008: 00003030-090CF657-00007007-00010000
CPUID 80000009: 00000000-00000000-00000000-00000000
CPUID 8000000A: 00000001-00008000-00000000-0013BCFF
CPUID 8000000B: 00000000-00000000-00000000-00000000
CPUID 8000000C: 00000000-00000000-00000000-00000000
CPUID 8000000D: 00000000-00000000-00000000-00000000
CPUID 8000000E: 00000000-00000000-00000000-00000000
CPUID 8000000F: 00000000-00000000-00000000-00000000
CPUID 80000010: 00000000-00000000-00000000-00000000
CPUID 80000011: 00000000-00000000-00000000-00000000
CPUID 80000012: 00000000-00000000-00000000-00000000
CPUID 80000013: 00000000-00000000-00000000-00000000
CPUID 80000014: 00000000-00000000-00000000-00000000
CPUID 80000015: 00000000-00000000-00000000-00000000
CPUID 80000016: 00000000-00000000-00000000-00000000
CPUID 80000017: 00000000-00000000-00000000-00000000
CPUID 80000018: 00000000-00000000-00000000-00000000
CPUID 80000019: F040F040-00000000-00000000-00000000
CPUID 8000001A: 00000006-00000000-00000000-00000000
CPUID 8000001B: 000003FF-00000000-00000000-00000000
CPUID 8000001C: 00000000-00000000-00000000-00000000
CPUID 8000001D: 00004121-01C0003F-0000003F-00000000 [SL 00] [L1D: 32 KB]
CPUID 8000001D: 00004122-01C0003F-0000003F-00000000 [SL 01] [L1I: 32 KB]
CPUID 8000001D: 00004143-01C0003F-000003FF-00000002 [SL 02] [L2U: 512 KB]
CPUID 8000001D: 0001C163-03C0003F-00000FFF-00000001 [SL 03] [L3U: 4 MB]
CPUID 8000001E: 00000004-00000102-00000000-00000000
CPUID 8000001F: 0001000F-0000012F-0000000E-00000001
CPUID 80000020: 00000000-00000002-00000000-00000000 [SL 00]
CPUID 80000020: 0000000B-00000000-00000000-0000000F [SL 01]
CPUID 8FFFFFFF: 00000000-00000000-00000000-00000000

L1    Data Cache:    32 KB,  8-way Associative, 64-byte Line
L1  Instr. Cache:    32 KB,  8-way Associative, 64-byte Line
L2 Unified Cache:   512 KB,  8-way Associative, 64-byte Line
L3 Unified Cache:     4 MB, 16-way Associative, 64-byte Line

------[ CPUID Registers / Logical CPU #5 ]------

allcpu: Package 0 / Core 2 / Thread 1: Valid, Virtual

CPUID 00000000: 00000010-68747541-444D4163-69746E65 [AuthenticAMD]
CPUID 00000001: 00890F10-05080800-7ED8320B-178BFBFF
CPUID 00000002: 00000000-00000000-00000000-00000000
CPUID 00000003: 00000000-00000000-00000000-00000000
CPUID 00000005: 00000040-00000040-00000003-00000011
CPUID 00000006: 00000004-00000000-00000001-00000000
CPUID 00000007: 00000000-219C91A9-00400004-00000000 [SL 00]
CPUID 00000008: 00000000-00000000-00000000-00000000
CPUID 00000009: 00000000-00000000-00000000-00000000
CPUID 0000000A: 00000000-00000000-00000000-00000000
CPUID 0000000B: 00000001-00000002-00000100-00000005 [SL 00]
CPUID 0000000B: 00000007-00000008-00000201-00000005 [SL 01]
CPUID 0000000C: 00000000-00000000-00000000-00000000
CPUID 0000000D: 00000207-00000340-00000380-00000000 [SL 00] [x87]
CPUID 0000000D: 0000000F-00000340-00000000-00000000 [SL 01] [SSE]
CPUID 0000000D: 00000100-00000240-00000000-00000000 [SL 02] [AVX]
CPUID 0000000D: 00000040-00000340-00000000-00000000 [SL 09] [PKRU]
CPUID 0000000E: 00000000-00000000-00000000-00000000
CPUID 0000000F: 00000000-000000FF-00000000-00000002 [SL 00]
CPUID 0000000F: 00000000-00000040-000000FF-00000007 [SL 01]
CPUID 00000010: 00000000-00000002-00000000-00000000 [SL 00]
CPUID 00000010: 0000000F-00000000-00000004-0000000F [SL 01]
CPUID 80000000: 80000020-68747541-444D4163-69746E65 [AuthenticAMD]
CPUID 80000001: 00890F10-30000000-75C237FF-2FD3FBFF
CPUID 80000002: 20444D41-74737543-41206D6F-30205550 [AMD Custom APU 0]
CPUID 80000003: 00323339-6D412020-78634364-66466856 [932  AmdCcxVhFf]
CPUID 80000004: 69655033-74696E49-746E4520-000A7972 [3PeiInit Entry]
CPUID 80000005: FF40FF40-FF40FF40-20080140-20080140 [L1D: 32 KB / L1I: 32 KB]
CPUID 80000006: 48006400-68006400-02006140-00209140 [L2: 512 KB] / L3: 4096 KB]
CPUID 80000007: 00000000-0000001B-00000000-00006799
CPUID 80000008: 00003030-090CF657-00007007-00010000
CPUID 80000009: 00000000-00000000-00000000-00000000
CPUID 8000000A: 00000001-00008000-00000000-0013BCFF
CPUID 8000000B: 00000000-00000000-00000000-00000000
CPUID 8000000C: 00000000-00000000-00000000-00000000
CPUID 8000000D: 00000000-00000000-00000000-00000000
CPUID 8000000E: 00000000-00000000-00000000-00000000
CPUID 8000000F: 00000000-00000000-00000000-00000000
CPUID 80000010: 00000000-00000000-00000000-00000000
CPUID 80000011: 00000000-00000000-00000000-00000000
CPUID 80000012: 00000000-00000000-00000000-00000000
CPUID 80000013: 00000000-00000000-00000000-00000000
CPUID 80000014: 00000000-00000000-00000000-00000000
CPUID 80000015: 00000000-00000000-00000000-00000000
CPUID 80000016: 00000000-00000000-00000000-00000000
CPUID 80000017: 00000000-00000000-00000000-00000000
CPUID 80000018: 00000000-00000000-00000000-00000000
CPUID 80000019: F040F040-00000000-00000000-00000000
CPUID 8000001A: 00000006-00000000-00000000-00000000
CPUID 8000001B: 000003FF-00000000-00000000-00000000
CPUID 8000001C: 00000000-00000000-00000000-00000000
CPUID 8000001D: 00004121-01C0003F-0000003F-00000000 [SL 00] [L1D: 32 KB]
CPUID 8000001D: 00004122-01C0003F-0000003F-00000000 [SL 01] [L1I: 32 KB]
CPUID 8000001D: 00004143-01C0003F-000003FF-00000002 [SL 02] [L2U: 512 KB]
CPUID 8000001D: 0001C163-03C0003F-00000FFF-00000001 [SL 03] [L3U: 4 MB]
CPUID 8000001E: 00000005-00000102-00000000-00000000
CPUID 8000001F: 0001000F-0000012F-0000000E-00000001
CPUID 80000020: 00000000-00000002-00000000-00000000 [SL 00]
CPUID 80000020: 0000000B-00000000-00000000-0000000F [SL 01]
CPUID 8FFFFFFF: 00000000-00000000-00000000-00000000

L1    Data Cache:    32 KB,  8-way Associative, 64-byte Line
L1  Instr. Cache:    32 KB,  8-way Associative, 64-byte Line
L2 Unified Cache:   512 KB,  8-way Associative, 64-byte Line
L3 Unified Cache:     4 MB, 16-way Associative, 64-byte Line

------[ CPUID Registers / Logical CPU #6 ]------

allcpu: Package 0 / Core 3 / Thread 0: Valid

CPUID 00000000: 00000010-68747541-444D4163-69746E65 [AuthenticAMD]
CPUID 00000001: 00890F10-06080800-7ED8320B-178BFBFF
CPUID 00000002: 00000000-00000000-00000000-00000000
CPUID 00000003: 00000000-00000000-00000000-00000000
CPUID 00000005: 00000040-00000040-00000003-00000011
CPUID 00000006: 00000004-00000000-00000001-00000000
CPUID 00000007: 00000000-219C91A9-00400004-00000000 [SL 00]
CPUID 00000008: 00000000-00000000-00000000-00000000
CPUID 00000009: 00000000-00000000-00000000-00000000
CPUID 0000000A: 00000000-00000000-00000000-00000000
CPUID 0000000B: 00000001-00000002-00000100-00000006 [SL 00]
CPUID 0000000B: 00000007-00000008-00000201-00000006 [SL 01]
CPUID 0000000C: 00000000-00000000-00000000-00000000
CPUID 0000000D: 00000207-00000340-00000380-00000000 [SL 00] [x87]
CPUID 0000000D: 0000000F-00000340-00000000-00000000 [SL 01] [SSE]
CPUID 0000000D: 00000100-00000240-00000000-00000000 [SL 02] [AVX]
CPUID 0000000D: 00000040-00000340-00000000-00000000 [SL 09] [PKRU]
CPUID 0000000E: 00000000-00000000-00000000-00000000
CPUID 0000000F: 00000000-000000FF-00000000-00000002 [SL 00]
CPUID 0000000F: 00000000-00000040-000000FF-00000007 [SL 01]
CPUID 00000010: 00000000-00000002-00000000-00000000 [SL 00]
CPUID 00000010: 0000000F-00000000-00000004-0000000F [SL 01]
CPUID 80000000: 80000020-68747541-444D4163-69746E65 [AuthenticAMD]
CPUID 80000001: 00890F10-30000000-75C237FF-2FD3FBFF
CPUID 80000002: 20444D41-74737543-41206D6F-30205550 [AMD Custom APU 0]
CPUID 80000003: 00323339-6D412020-78634364-66466856 [932  AmdCcxVhFf]
CPUID 80000004: 69655033-74696E49-746E4520-000A7972 [3PeiInit Entry]
CPUID 80000005: FF40FF40-FF40FF40-20080140-20080140 [L1D: 32 KB / L1I: 32 KB]
CPUID 80000006: 48006400-68006400-02006140-00209140 [L2: 512 KB] / L3: 4096 KB]
CPUID 80000007: 00000000-0000001B-00000000-00006799
CPUID 80000008: 00003030-090CF657-00007007-00010000
CPUID 80000009: 00000000-00000000-00000000-00000000
CPUID 8000000A: 00000001-00008000-00000000-0013BCFF
CPUID 8000000B: 00000000-00000000-00000000-00000000
CPUID 8000000C: 00000000-00000000-00000000-00000000
CPUID 8000000D: 00000000-00000000-00000000-00000000
CPUID 8000000E: 00000000-00000000-00000000-00000000
CPUID 8000000F: 00000000-00000000-00000000-00000000
CPUID 80000010: 00000000-00000000-00000000-00000000
CPUID 80000011: 00000000-00000000-00000000-00000000
CPUID 80000012: 00000000-00000000-00000000-00000000
CPUID 80000013: 00000000-00000000-00000000-00000000
CPUID 80000014: 00000000-00000000-00000000-00000000
CPUID 80000015: 00000000-00000000-00000000-00000000
CPUID 80000016: 00000000-00000000-00000000-00000000
CPUID 80000017: 00000000-00000000-00000000-00000000
CPUID 80000018: 00000000-00000000-00000000-00000000
CPUID 80000019: F040F040-00000000-00000000-00000000
CPUID 8000001A: 00000006-00000000-00000000-00000000
CPUID 8000001B: 000003FF-00000000-00000000-00000000
CPUID 8000001C: 00000000-00000000-00000000-00000000
CPUID 8000001D: 00004121-01C0003F-0000003F-00000000 [SL 00] [L1D: 32 KB]
CPUID 8000001D: 00004122-01C0003F-0000003F-00000000 [SL 01] [L1I: 32 KB]
CPUID 8000001D: 00004143-01C0003F-000003FF-00000002 [SL 02] [L2U: 512 KB]
CPUID 8000001D: 0001C163-03C0003F-00000FFF-00000001 [SL 03] [L3U: 4 MB]
CPUID 8000001E: 00000006-00000103-00000000-00000000
CPUID 8000001F: 0001000F-0000012F-0000000E-00000001
CPUID 80000020: 00000000-00000002-00000000-00000000 [SL 00]
CPUID 80000020: 0000000B-00000000-00000000-0000000F [SL 01]
CPUID 8FFFFFFF: 00000000-00000000-00000000-00000000

L1    Data Cache:    32 KB,  8-way Associative, 64-byte Line
L1  Instr. Cache:    32 KB,  8-way Associative, 64-byte Line
L2 Unified Cache:   512 KB,  8-way Associative, 64-byte Line
L3 Unified Cache:     4 MB, 16-way Associative, 64-byte Line

------[ CPUID Registers / Logical CPU #7 ]------

allcpu: Package 0 / Core 3 / Thread 1: Valid, Virtual

CPUID 00000000: 00000010-68747541-444D4163-69746E65 [AuthenticAMD]
CPUID 00000001: 00890F10-07080800-7ED8320B-178BFBFF
CPUID 00000002: 00000000-00000000-00000000-00000000
CPUID 00000003: 00000000-00000000-00000000-00000000
CPUID 00000005: 00000040-00000040-00000003-00000011
CPUID 00000006: 00000004-00000000-00000001-00000000
CPUID 00000007: 00000000-219C91A9-00400004-00000000 [SL 00]
CPUID 00000008: 00000000-00000000-00000000-00000000
CPUID 00000009: 00000000-00000000-00000000-00000000
CPUID 0000000A: 00000000-00000000-00000000-00000000
CPUID 0000000B: 00000001-00000002-00000100-00000007 [SL 00]
CPUID 0000000B: 00000007-00000008-00000201-00000007 [SL 01]
CPUID 0000000C: 00000000-00000000-00000000-00000000
CPUID 0000000D: 00000207-00000340-00000380-00000000 [SL 00] [x87]
CPUID 0000000D: 0000000F-00000340-00000000-00000000 [SL 01] [SSE]
CPUID 0000000D: 00000100-00000240-00000000-00000000 [SL 02] [AVX]
CPUID 0000000D: 00000040-00000340-00000000-00000000 [SL 09] [PKRU]
CPUID 0000000E: 00000000-00000000-00000000-00000000
CPUID 0000000F: 00000000-000000FF-00000000-00000002 [SL 00]
CPUID 0000000F: 00000000-00000040-000000FF-00000007 [SL 01]
CPUID 00000010: 00000000-00000002-00000000-00000000 [SL 00]
CPUID 00000010: 0000000F-00000000-00000004-0000000F [SL 01]
CPUID 80000000: 80000020-68747541-444D4163-69746E65 [AuthenticAMD]
CPUID 80000001: 00890F10-30000000-75C237FF-2FD3FBFF
CPUID 80000002: 20444D41-74737543-41206D6F-30205550 [AMD Custom APU 0]
CPUID 80000003: 00323339-6D412020-78634364-66466856 [932  AmdCcxVhFf]
CPUID 80000004: 69655033-74696E49-746E4520-000A7972 [3PeiInit Entry]
CPUID 80000005: FF40FF40-FF40FF40-20080140-20080140 [L1D: 32 KB / L1I: 32 KB]
CPUID 80000006: 48006400-68006400-02006140-00209140 [L2: 512 KB] / L3: 4096 KB]
CPUID 80000007: 00000000-0000001B-00000000-00006799
CPUID 80000008: 00003030-090CF657-00007007-00010000
CPUID 80000009: 00000000-00000000-00000000-00000000
CPUID 8000000A: 00000001-00008000-00000000-0013BCFF
CPUID 8000000B: 00000000-00000000-00000000-00000000
CPUID 8000000C: 00000000-00000000-00000000-00000000
CPUID 8000000D: 00000000-00000000-00000000-00000000
CPUID 8000000E: 00000000-00000000-00000000-00000000
CPUID 8000000F: 00000000-00000000-00000000-00000000
CPUID 80000010: 00000000-00000000-00000000-00000000
CPUID 80000011: 00000000-00000000-00000000-00000000
CPUID 80000012: 00000000-00000000-00000000-00000000
CPUID 80000013: 00000000-00000000-00000000-00000000
CPUID 80000014: 00000000-00000000-00000000-00000000
CPUID 80000015: 00000000-00000000-00000000-00000000
CPUID 80000016: 00000000-00000000-00000000-00000000
CPUID 80000017: 00000000-00000000-00000000-00000000
CPUID 80000018: 00000000-00000000-00000000-00000000
CPUID 80000019: F040F040-00000000-00000000-00000000
CPUID 8000001A: 00000006-00000000-00000000-00000000
CPUID 8000001B: 000003FF-00000000-00000000-00000000
CPUID 8000001C: 00000000-00000000-00000000-00000000
CPUID 8000001D: 00004121-01C0003F-0000003F-00000000 [SL 00] [L1D: 32 KB]
CPUID 8000001D: 00004122-01C0003F-0000003F-00000000 [SL 01] [L1I: 32 KB]
CPUID 8000001D: 00004143-01C0003F-000003FF-00000002 [SL 02] [L2U: 512 KB]
CPUID 8000001D: 0001C163-03C0003F-00000FFF-00000001 [SL 03] [L3U: 4 MB]
CPUID 8000001E: 00000007-00000103-00000000-00000000
CPUID 8000001F: 0001000F-0000012F-0000000E-00000001
CPUID 80000020: 00000000-00000002-00000000-00000000 [SL 00]
CPUID 80000020: 0000000B-00000000-00000000-0000000F [SL 01]
CPUID 8FFFFFFF: 00000000-00000000-00000000-00000000

L1    Data Cache:    32 KB,  8-way Associative, 64-byte Line
L1  Instr. Cache:    32 KB,  8-way Associative, 64-byte Line
L2 Unified Cache:   512 KB,  8-way Associative, 64-byte Line
L3 Unified Cache:     4 MB, 16-way Associative, 64-byte Line

------[ All CPUs ]------

CPU   0: APICID    0 / Package 0 / Core   0 / Thread 0: Valid
CPU   1: APICID    1 / Package 0 / Core   0 / Thread 1: Valid, Virtual
CPU   2: APICID    2 / Package 0 / Core   1 / Thread 0: Valid
CPU   3: APICID    3 / Package 0 / Core   1 / Thread 1: Valid, Virtual
CPU   4: APICID    4 / Package 0 / Core   2 / Thread 0: Valid
CPU   5: APICID    5 / Package 0 / Core   2 / Thread 1: Valid, Virtual
CPU   6: APICID    6 / Package 0 / Core   3 / Thread 0: Valid
CPU   7: APICID    7 / Package 0 / Core   3 / Thread 1: Valid, Virtual

------[ MSR Registers / Logical CPU #0 ]------

CPU Clock (Normal): 2800 MHz
CPU Clock (TSC): 2800 MHz
CPU Multiplier: 28.0x
CPB PStates: 0
MSR 0000001B: 0000-0000-FEE0-0900
MSR 0000008B: 0000-0000-0890-1003
MSR 000000E7: 0000-019F-C49A-BAE4 [S200]
MSR 000000E7: 0000-019F-C889-21B8 [S200]
MSR 000000E7: 0000-019F-CDC4-69C8
MSR 000000E8: 0000-01E9-4D40-0329 [S200]
MSR 000000E8: 0000-01E9-552E-4D61 [S200]
MSR 000000E8: 0000-01E9-57D3-40EF
MSR C0010004: 0000-0000-0000-0000
MSR C0010005: 0000-0000-0000-0000
MSR C0010006: 0000-0000-0000-0000
MSR C0010007: 0000-0000-0000-0000
MSR C0010015: 0000-0001-8900-0011
MSR C001001F: 0000-0000-0000-0000
MSR C0010055: 0000-0000-0000-0000
MSR C0010058: 0000-0000-F800-0019
MSR C0010061: 0000-0000-0000-0020
MSR C0010062: 0000-0000-0000-0000
MSR C0010063: 0000-0000-0000-0001
MSR C0010064: 8000-0000-4728-4870 [28.00x] [0.5437 V] [ 2.80 A] [PState P0]
MSR C0010065: 8000-0000-461B-8860 [24.00x] [0.8625 V] [ 2.40 A] [PState P1]
MSR C0010066: 8000-0000-4459-4C66 [17.00x] [0.9187 V] [ 1.70 A] [PState P2]
MSR C0010067: 0000-0000-0000-0000
MSR C0010068: 0000-0000-0000-0000
MSR C0010069: 0000-0000-0000-0000
MSR C001006A: 0000-0000-0000-0000
MSR C001006B: 0000-0000-0000-0000
MSR C0010070: < FAILED >
MSR C0010293: 0000-0000-0060-0870 [28.00x] [0.7500V]
MSR C0010293: 0000-0000-005F-C870 [28.00x] [0.7562V]
MSR C0010293: 0000-0000-005E-C870 [28.00x] [0.7813V]
MSR C0010293: 0000-0000-005F-0870 [28.00x] [0.7750V]
MSR C0010293: 0000-0000-0042-0870 [28.00x] [1.5000V]
MSR C0010140: 0000-0000-0000-0000
MSR C0010141: 0000-0000-0000-0000
MSR C0010290: < FAILED >
MSR C0010292: 0000-0001-0411-B912
MSR C0010293: 0000-0000-0042-0870
MSR C0010294: 0F8E-8581-0000-8912
MSR C0010296: 0000-0000-0048-4848
MSR C0010299: 0000-0000-000A-1003
MSR C001029A: 0000-0000-0649-6205 [S200]
MSR C001029A: 0000-0000-0649-6A10 [S200]
MSR C001029A: 0000-0000-0649-6EA9
MSR C001029B: 0000-0000-253B-4222 [S200]
MSR C001029B: 0000-0000-253B-D47E [S200]
MSR C001029B: 0000-0000-253C-6702
MSR C0011023: 0002-0000-0000-0020

------[ MSR Registers / Logical CPU #1 ]------

CPU Clock (Normal): 2800 MHz
CPU Clock (TSC): 2800 MHz
CPU Multiplier: 28.0x
CPB PStates: 0
MSR 0000001B: 0000-0000-FEE0-0900
MSR 0000008B: 0000-0000-0890-1003
MSR 000000E7: 0000-01A0-0211-79A8
MSR 000000E8: 0000-01E9-82F8-95E4
MSR C0010004: 0000-0000-0000-0000
MSR C0010005: 0000-0000-0000-0000
MSR C0010006: 0000-0000-0000-0000
MSR C0010007: 0000-0000-0000-0000
MSR C0010015: 0000-0001-8900-0011
MSR C001001F: 0000-0000-0000-0000
MSR C0010055: 0000-0000-0000-0000
MSR C0010058: 0000-0000-F800-0019
MSR C0010061: 0000-0000-0000-0020
MSR C0010062: 0000-0000-0000-0000
MSR C0010063: 0000-0000-0000-0001
MSR C0010064: 8000-0000-4728-4870 [28.00x] [0.5437 V] [ 2.80 A] [PState P0]
MSR C0010065: 8000-0000-461B-8860 [24.00x] [0.8625 V] [ 2.40 A] [PState P1]
MSR C0010066: 8000-0000-4459-4C66 [17.00x] [0.9187 V] [ 1.70 A] [PState P2]
MSR C0010067: 0000-0000-0000-0000
MSR C0010068: 0000-0000-0000-0000
MSR C0010069: 0000-0000-0000-0000
MSR C001006A: 0000-0000-0000-0000
MSR C001006B: 0000-0000-0000-0000
MSR C0010070: < FAILED >
MSR C0010293: 0000-0000-005F-8870 [28.00x] [0.7625V]
MSR C0010293: 0000-0000-005F-C870 [28.00x] [0.7562V]
MSR C0010293: 0000-0000-005F-C870 [28.00x] [0.7562V]
MSR C0010293: 0000-0000-0060-0870 [28.00x] [0.7500V]
MSR C0010293: 0000-0000-005E-C870 [28.00x] [0.7813V]
MSR C0010140: 0000-0000-0000-0000
MSR C0010141: 0000-0000-0000-0000
MSR C0010290: < FAILED >
MSR C0010292: 0000-0001-0411-B912
MSR C0010293: 0000-0000-005E-C870
MSR C0010294: 0F8E-8581-0000-8912
MSR C0010296: 0000-0000-0048-4848
MSR C0010299: 0000-0000-000A-1003
MSR C001029A: 0000-0000-0649-9DE7
MSR C001029B: 0000-0000-253E-0339
MSR C0011023: 0002-0000-0000-0020

------[ MSR Registers / Logical CPU #2 ]------

CPU Clock (Normal): 2800 MHz
CPU Clock (TSC): 2800 MHz
CPU Multiplier: 28.0x
CPB PStates: 0
MSR 0000001B: 0000-0000-FEE0-0900
MSR 0000008B: 0000-0000-0890-1003
MSR 000000E7: 0000-01A0-1588-32F4
MSR 000000E8: 0000-01E9-966F-2C55
MSR C0010004: 0000-0000-0000-0000
MSR C0010005: 0000-0000-0000-0000
MSR C0010006: 0000-0000-0000-0000
MSR C0010007: 0000-0000-0000-0000
MSR C0010015: 0000-0001-8900-0011
MSR C001001F: 0000-0000-0000-0000
MSR C0010055: 0000-0000-0000-0000
MSR C0010058: 0000-0000-F800-0019
MSR C0010061: 0000-0000-0000-0020
MSR C0010062: 0000-0000-0000-0000
MSR C0010063: 0000-0000-0000-0001
MSR C0010064: 8000-0000-4728-4870 [28.00x] [0.5437 V] [ 2.80 A] [PState P0]
MSR C0010065: 8000-0000-461B-8860 [24.00x] [0.8625 V] [ 2.40 A] [PState P1]
MSR C0010066: 8000-0000-4459-4C66 [17.00x] [0.9187 V] [ 1.70 A] [PState P2]
MSR C0010067: 0000-0000-0000-0000
MSR C0010068: 0000-0000-0000-0000
MSR C0010069: 0000-0000-0000-0000
MSR C001006A: 0000-0000-0000-0000
MSR C001006B: 0000-0000-0000-0000
MSR C0010070: < FAILED >
MSR C0010293: 0000-0000-005F-C870 [28.00x] [0.7562V]
MSR C0010293: 0000-0000-005E-C870 [28.00x] [0.7813V]
MSR C0010293: 0000-0000-005E-C870 [28.00x] [0.7813V]
MSR C0010293: 0000-0000-005F-8870 [28.00x] [0.7625V]
MSR C0010293: 0000-0000-005E-C870 [28.00x] [0.7813V]
MSR C0010140: 0000-0000-0000-0000
MSR C0010141: 0000-0000-0000-0000
MSR C0010290: < FAILED >
MSR C0010292: 0000-0001-0411-B912
MSR C0010293: 0000-0000-005E-C870
MSR C0010294: 0F8E-8581-0000-8912
MSR C0010296: 0000-0000-0048-4848
MSR C0010299: 0000-0000-000A-1003
MSR C001029A: 0000-0000-0649-BB86
MSR C001029B: 0000-0000-253F-FEBB
MSR C0011023: 0002-0000-0000-0020

------[ MSR Registers / Logical CPU #3 ]------

CPU Clock (Normal): 2800 MHz
CPU Clock (TSC): 2800 MHz
CPU Multiplier: 28.0x
CPB PStates: 0
MSR 0000001B: 0000-0000-FEE0-0900
MSR 0000008B: 0000-0000-0890-1003
MSR 000000E7: 0000-01A0-2818-27C0
MSR 000000E8: 0000-01E9-A8FF-01E6
MSR C0010004: 0000-0000-0000-0000
MSR C0010005: 0000-0000-0000-0000
MSR C0010006: 0000-0000-0000-0000
MSR C0010007: 0000-0000-0000-0000
MSR C0010015: 0000-0001-8900-0011
MSR C001001F: 0000-0000-0000-0000
MSR C0010055: 0000-0000-0000-0000
MSR C0010058: 0000-0000-F800-0019
MSR C0010061: 0000-0000-0000-0020
MSR C0010062: 0000-0000-0000-0000
MSR C0010063: 0000-0000-0000-0001
MSR C0010064: 8000-0000-4728-4870 [28.00x] [0.5437 V] [ 2.80 A] [PState P0]
MSR C0010065: 8000-0000-461B-8860 [24.00x] [0.8625 V] [ 2.40 A] [PState P1]
MSR C0010066: 8000-0000-4459-4C66 [17.00x] [0.9187 V] [ 1.70 A] [PState P2]
MSR C0010067: 0000-0000-0000-0000
MSR C0010068: 0000-0000-0000-0000
MSR C0010069: 0000-0000-0000-0000
MSR C001006A: 0000-0000-0000-0000
MSR C001006B: 0000-0000-0000-0000
MSR C0010070: < FAILED >
MSR C0010293: 0000-0000-005F-C870 [28.00x] [0.7562V]
MSR C0010293: 0000-0000-0060-4870 [28.00x] [0.7438V]
MSR C0010293: 0000-0000-005E-C870 [28.00x] [0.7813V]
MSR C0010293: 0000-0000-0060-0870 [28.00x] [0.7500V]
MSR C0010293: 0000-0000-005F-C870 [28.00x] [0.7562V]
MSR C0010140: 0000-0000-0000-0000
MSR C0010141: 0000-0000-0000-0000
MSR C0010290: < FAILED >
MSR C0010292: 0000-0001-0411-B912
MSR C0010293: 0000-0000-005F-C870
MSR C0010294: 0F8E-8581-0000-8912
MSR C0010296: 0000-0000-0048-4848
MSR C0010299: 0000-0000-000A-1003
MSR C001029A: 0000-0000-0649-D6FA
MSR C001029B: 0000-0000-2541-9243
MSR C0011023: 0002-0000-0000-0020

------[ MSR Registers / Logical CPU #4 ]------

CPU Clock (Normal): 2800 MHz
CPU Clock (TSC): 2800 MHz
CPU Multiplier: 28.0x
CPB PStates: 0
MSR 0000001B: 0000-0000-FEE0-0900
MSR 0000008B: 0000-0000-0890-1003
MSR 000000E7: 0000-01A0-3A42-2EBC
MSR 000000E8: 0000-01E9-BB28-E110
MSR C0010004: 0000-0000-0000-0000
MSR C0010005: 0000-0000-0000-0000
MSR C0010006: 0000-0000-0000-0000
MSR C0010007: 0000-0000-0000-0000
MSR C0010015: 0000-0001-8900-0011
MSR C001001F: 0000-0000-0000-0000
MSR C0010055: 0000-0000-0000-0000
MSR C0010058: 0000-0000-F800-0019
MSR C0010061: 0000-0000-0000-0020
MSR C0010062: 0000-0000-0000-0000
MSR C0010063: 0000-0000-0000-0001
MSR C0010064: 8000-0000-4728-4870 [28.00x] [0.5437 V] [ 2.80 A] [PState P0]
MSR C0010065: 8000-0000-461B-8860 [24.00x] [0.8625 V] [ 2.40 A] [PState P1]
MSR C0010066: 8000-0000-4459-4C66 [17.00x] [0.9187 V] [ 1.70 A] [PState P2]
MSR C0010067: 0000-0000-0000-0000
MSR C0010068: 0000-0000-0000-0000
MSR C0010069: 0000-0000-0000-0000
MSR C001006A: 0000-0000-0000-0000
MSR C001006B: 0000-0000-0000-0000
MSR C0010070: < FAILED >
MSR C0010293: 0000-0000-005F-8870 [28.00x] [0.7625V]
MSR C0010293: 0000-0000-005F-8870 [28.00x] [0.7625V]
MSR C0010293: 0000-0000-005F-C870 [28.00x] [0.7562V]
MSR C0010293: 0000-0000-005F-8870 [28.00x] [0.7625V]
MSR C0010293: 0000-0000-005F-C870 [28.00x] [0.7562V]
MSR C0010140: 0000-0000-0000-0000
MSR C0010141: 0000-0000-0000-0000
MSR C0010290: < FAILED >
MSR C0010292: 0000-0001-0411-B912
MSR C0010293: 0000-0000-005F-C870
MSR C0010294: 0F8E-8581-0000-8912
MSR C0010296: 0000-0000-0048-4848
MSR C0010299: 0000-0000-000A-1003
MSR C001029A: 0000-0000-064A-00F1
MSR C001029B: 0000-0000-2543-C546
MSR C0011023: 0002-0000-0000-0020

------[ MSR Registers / Logical CPU #5 ]------

CPU Clock (Normal): 2800 MHz
CPU Clock (TSC): 2800 MHz
CPU Multiplier: 28.0x
CPB PStates: 0
MSR 0000001B: 0000-0000-FEE0-0900
MSR 0000008B: 0000-0000-0890-1003
MSR 000000E7: 0000-01A0-51E5-1D60
MSR 000000E8: 0000-01E9-D2CB-63E8
MSR C0010004: 0000-0000-0000-0000
MSR C0010005: 0000-0000-0000-0000
MSR C0010006: 0000-0000-0000-0000
MSR C0010007: 0000-0000-0000-0000
MSR C0010015: 0000-0001-8900-0011
MSR C001001F: 0000-0000-0000-0000
MSR C0010055: 0000-0000-0000-0000
MSR C0010058: 0000-0000-F800-0019
MSR C0010061: 0000-0000-0000-0020
MSR C0010062: 0000-0000-0000-0000
MSR C0010063: 0000-0000-0000-0001
MSR C0010064: 8000-0000-4728-4870 [28.00x] [0.5437 V] [ 2.80 A] [PState P0]
MSR C0010065: 8000-0000-461B-8860 [24.00x] [0.8625 V] [ 2.40 A] [PState P1]
MSR C0010066: 8000-0000-4459-4C66 [17.00x] [0.9187 V] [ 1.70 A] [PState P2]
MSR C0010067: 0000-0000-0000-0000
MSR C0010068: 0000-0000-0000-0000
MSR C0010069: 0000-0000-0000-0000
MSR C001006A: 0000-0000-0000-0000
MSR C001006B: 0000-0000-0000-0000
MSR C0010070: < FAILED >
MSR C0010293: 0000-0000-0060-0870 [28.00x] [0.7500V]
MSR C0010293: 0000-0000-005F-8870 [28.00x] [0.7625V]
MSR C0010293: 0000-0000-005F-8870 [28.00x] [0.7625V]
MSR C0010293: 0000-0000-005F-4870 [28.00x] [0.7688V]
MSR C0010293: 0000-0000-005F-8870 [28.00x] [0.7625V]
MSR C0010140: 0000-0000-0000-0000
MSR C0010141: 0000-0000-0000-0000
MSR C0010290: < FAILED >
MSR C0010292: 0000-0001-0411-B912
MSR C0010293: 0000-0000-005F-8870
MSR C0010294: 0F8E-8581-0000-8912
MSR C0010296: 0000-0000-0048-4848
MSR C0010299: 0000-0000-000A-1003
MSR C001029A: 0000-0000-064A-3606
MSR C001029B: 0000-0000-2546-3C71
MSR C0011023: 0002-0000-0000-0020

------[ MSR Registers / Logical CPU #6 ]------

CPU Clock (Normal): 2800 MHz
CPU Clock (TSC): 2800 MHz
CPU Multiplier: 28.0x
CPB PStates: 0
MSR 0000001B: 0000-0000-FEE0-0900
MSR 0000008B: 0000-0000-0890-1003
MSR 000000E7: 0000-01A0-70F0-A160
MSR 000000E8: 0000-01E9-F1D6-8EF4
MSR C0010004: 0000-0000-0000-0000
MSR C0010005: 0000-0000-0000-0000
MSR C0010006: 0000-0000-0000-0000
MSR C0010007: 0000-0000-0000-0000
MSR C0010015: 0000-0001-8900-0011
MSR C001001F: 0000-0000-0000-0000
MSR C0010055: 0000-0000-0000-0000
MSR C0010058: 0000-0000-F800-0019
MSR C0010061: 0000-0000-0000-0020
MSR C0010062: 0000-0000-0000-0000
MSR C0010063: 0000-0000-0000-0001
MSR C0010064: 8000-0000-4728-4870 [28.00x] [0.5437 V] [ 2.80 A] [PState P0]
MSR C0010065: 8000-0000-461B-8860 [24.00x] [0.8625 V] [ 2.40 A] [PState P1]
MSR C0010066: 8000-0000-4459-4C66 [17.00x] [0.9187 V] [ 1.70 A] [PState P2]
MSR C0010067: 0000-0000-0000-0000
MSR C0010068: 0000-0000-0000-0000
MSR C0010069: 0000-0000-0000-0000
MSR C001006A: 0000-0000-0000-0000
MSR C001006B: 0000-0000-0000-0000
MSR C0010070: < FAILED >
MSR C0010293: 0000-0000-005F-4870 [28.00x] [0.7688V]
MSR C0010293: 0000-0000-005F-4870 [28.00x] [0.7688V]
MSR C0010293: 0000-0000-00A2-0A7A [24.40x] [0.7000V]
MSR C0010293: 0000-0000-0029-C88C [35.00x] [0.5062V]
MSR C0010293: 0000-0000-0029-888C [35.00x] [0.5125V]
MSR C0010140: 0000-0000-0000-0000
MSR C0010141: 0000-0000-0000-0000
MSR C0010290: < FAILED >
MSR C0010292: 0000-0001-0411-B912
MSR C0010293: 0000-0000-0029-888C
MSR C0010294: 0F8E-8581-0000-8912
MSR C0010296: 0000-0000-0048-4848
MSR C0010299: 0000-0000-000A-1003
MSR C001029A: 0000-0000-064A-FD9C
MSR C001029B: 0000-0000-254B-7810
MSR C0011023: 0002-0000-0000-0020

------[ MSR Registers / Logical CPU #7 ]------

CPU Clock (Normal): 3500 MHz
CPU Clock (TSC): 2800 MHz
CPU Multiplier: 35.0x
CPB PStates: 0
MSR 0000001B: 0000-0000-FEE0-0900
MSR 0000008B: 0000-0000-0890-1003
MSR 000000E7: 0000-01A0-A46A-8504
MSR 000000E8: 0000-01EA-2EBE-AB9A
MSR C0010004: 0000-0000-0000-0000
MSR C0010005: 0000-0000-0000-0000
MSR C0010006: 0000-0000-0000-0000
MSR C0010007: 0000-0000-0000-0000
MSR C0010015: 0000-0001-8900-0011
MSR C001001F: 0000-0000-0000-0000
MSR C0010055: 0000-0000-0000-0000
MSR C0010058: 0000-0000-F800-0019
MSR C0010061: 0000-0000-0000-0020
MSR C0010062: 0000-0000-0000-0000
MSR C0010063: 0000-0000-0000-0000
MSR C0010064: 8000-0000-4728-4870 [28.00x] [0.5437 V] [ 2.80 A] [PState P0]
MSR C0010065: 8000-0000-461B-8860 [24.00x] [0.8625 V] [ 2.40 A] [PState P1]
MSR C0010066: 8000-0000-4459-4C66 [17.00x] [0.9187 V] [ 1.70 A] [PState P2]
MSR C0010067: 0000-0000-0000-0000
MSR C0010068: 0000-0000-0000-0000
MSR C0010069: 0000-0000-0000-0000
MSR C001006A: 0000-0000-0000-0000
MSR C001006B: 0000-0000-0000-0000
MSR C0010070: < FAILED >
MSR C0010293: 0000-0000-0029-888C [35.00x] [0.5125V]
MSR C0010293: 0000-0000-0029-C88C [35.00x] [0.5062V]
MSR C0010293: 0000-0000-0029-888C [35.00x] [0.5125V]
MSR C0010293: 0000-0000-0069-C88B [34.75x] [0.5062V]
MSR C0010293: 0000-0000-0069-CA8C [28.00x] [0.5062V]
MSR C0010140: 0000-0000-0000-0000
MSR C0010141: 0000-0000-0000-0000
MSR C0010290: < FAILED >
MSR C0010292: 0000-0001-0411-B912
MSR C0010293: 0000-0000-0069-CA8C
MSR C0010294: 0F8E-8581-0000-8912
MSR C0010296: 0000-0000-0048-4848
MSR C0010299: 0000-0000-000A-1003
MSR C001029A: 0000-0000-064B-C765
MSR C001029B: 0000-0000-2551-0091
MSR C0011023: 0002-0000-0000-0020
