------[ Versions ]------

Program Version : EVEREST v4.60.1629 Beta
BenchDLL Version: 2.4.257.0

------[ CPU Info ]------

CPU Type           : AMD Duron, 1600 MHz (12 x 133)
CPU Alias          : Applebred
CPU Platform       : Socket A
CPU Stepping       : B0
Instruction Set    : x86, MMX, 3DNow!, SSE
CPUID Manufacturer : AuthenticAMD
CPUID CPU Name     : AMD Duron(tm) processor
CPUID Revision     : 00000681h
Platform ID        : D1h  (Socket A)

------[ Logical CPU #0 ]------

allcpu: Valid

CPUID 00000000: 00000001-68747541-444D4163-69746E65
CPUID 00000001: 00000681-00000000-00000000-0383FBFF
CPUID 80000000: 80000008-68747541-444D4163-69746E65
CPUID 80000001: 00000781-00000000-00000000-C1C3FBFF
CPUID 80000002: 20444D41-6F727544-6D74286E-72702029
CPUID 80000003: 7365636F-00726F73-00000000-00000000
CPUID 80000004: 00000000-00000000-00000000-00000000
CPUID 80000005: 0408FF08-FF20FF10-40020140-40020140
CPUID 80000006: 00000000-41004100-00408140-00000000
CPUID 80000007: 00000000-00000000-00000000-00000001
CPUID 80000008: 00002022-00000000-00000000-00000000

------[ MSR Registers ]------

MSR 0000001B: 0000-0000-FEE0-0900
MSR C0010015: 0000-0000-0203-1008

PerformanceFrequency = 3579545

Tjmax Temperature = 0 Celsius
