------[ Versions ]------

Program Version : AIDA64 v2.60.2151 Beta
BenchDLL Version: 3.0.472-x64

------[ CPU Info ]------

CPU Type           : QuadCore AMD A10-5800K, 3800 MHz (38 x 100)
CPU Alias          : Trinity
CPU Platform       : Socket FM2
CPU Stepping       : TN-A1
Instruction Set    : x86, x86-64, MMX, SSE, SSE2, SSE3, SSSE3, SSE4.1, SSE4.2, SSE4A, XOP, AES, AVX, FMA, FMA4
CPUID Manufacturer : AuthenticAMD
CPUID CPU Name     : AMD A10-5800K APU with Radeon(tm) HD Graphics
CPUID Revision     : 00610F01h
Platform ID        : DEh  (Socket FM2)
HTT / CMP Units    : 0 / 4
Tjmax Temperature  : 0 Celsius

------[ Logical CPU #0 ]------

allcpu: Package 0 / Core 0 / Thread 0: Valid

CPUID 00000000: 0000000D-68747541-444D4163-69746E65 [AuthenticAMD]
CPUID 00000001: 00610F01-00040800-3E98320B-178BFBFF
CPUID 00000002: 00000000-00000000-00000000-00000000
CPUID 00000003: 00000000-00000000-00000000-00000000
CPUID 00000005: 00000040-00000040-00000003-00000000
CPUID 00000006: 00000000-00000000-00000001-00000000
CPUID 00000007: 00000000-00000008-00000000-00000000
CPUID 00000008: 00000000-00000000-00000000-00000000
CPUID 00000009: 00000000-00000000-00000000-00000000
CPUID 0000000A: 00000000-00000000-00000000-00000000
CPUID 0000000C: 00000000-00000000-00000000-00000000
CPUID 0000000D: 00000007-00000340-000003C0-40000000
CPUID 0000000D: 00000100-00000240-00000000-00000000
CPUID 80000000: 8000001E-68747541-444D4163-69746E65
CPUID 80000001: 00610F01-20000000-01EBBFFF-2FD3FBFF
CPUID 80000002: 20444D41-2D303141-30303835-5041204B [AMD A10-5800K AP]
CPUID 80000003: 69772055-52206874-6F656461-6D74286E [U with Radeon(tm]
CPUID 80000004: 44482029-61724720-63696870-00202073 [) HD Graphics  ]
CPUID 80000005: FF40FF18-FF40FF30-10040140-40020140
CPUID 80000006: 64006400-64004200-08008140-00000000
CPUID 80000007: 00000000-00000000-00000000-000007D9
CPUID 80000008: 00003030-00000000-00004003-00000000
CPUID 80000009: 00000000-00000000-00000000-00000000
CPUID 8000000A: 00000001-00010000-00000000-00001CFF
CPUID 8000000B: 00000000-00000000-00000000-00000000
CPUID 8000000C: 00000000-00000000-00000000-00000000
CPUID 8000000D: 00000000-00000000-00000000-00000000
CPUID 8000000E: 00000000-00000000-00000000-00000000
CPUID 8000000F: 00000000-00000000-00000000-00000000
CPUID 80000010: 00000000-00000000-00000000-00000000
CPUID 80000011: 00000000-00000000-00000000-00000000
CPUID 80000012: 00000000-00000000-00000000-00000000
CPUID 80000013: 00000000-00000000-00000000-00000000
CPUID 80000014: 00000000-00000000-00000000-00000000
CPUID 80000015: 00000000-00000000-00000000-00000000
CPUID 80000016: 00000000-00000000-00000000-00000000
CPUID 80000017: 00000000-00000000-00000000-00000000
CPUID 80000018: 00000000-00000000-00000000-00000000
CPUID 80000019: F040F018-64006400-00000000-00000000
CPUID 8000001A: 00000003-00000000-00000000-00000000
CPUID 8000001B: 000000FF-00000000-00000000-00000000
CPUID 8000001C: 00000000-80032013-00010200-8000000F
CPUID 8000001D: 00000121-00C0003F-0000003F-00000000
CPUID 8000001D: 00004122-0040003F-000001FF-00000000
CPUID 8000001D: 00004143-03C0003F-000007FF-00000001
CPUID 8000001E: 00000010-00000100-00000000-00000000
CPUID 8FFFFFFF: 00000000-00000000-00000000-00000000 []

L1    Data Cache:     16 KB,  4-way Associative, 64-byte Line
L1  Instr. Cache:     64 KB,  2-way Associative, 64-byte Line
L2 Unified Cache:   2048 KB, 16-way Associative, 64-byte Line

------[ Logical CPU #1 ]------

allcpu: Package 0 / Core 1 / Thread 0: Valid

CPUID 00000000: 0000000D-68747541-444D4163-69746E65 [AuthenticAMD]
CPUID 00000001: 00610F01-01040800-3E98320B-178BFBFF
CPUID 00000002: 00000000-00000000-00000000-00000000
CPUID 00000003: 00000000-00000000-00000000-00000000
CPUID 00000005: 00000040-00000040-00000003-00000000
CPUID 00000006: 00000000-00000000-00000001-00000000
CPUID 00000007: 00000000-00000008-00000000-00000000
CPUID 00000008: 00000000-00000000-00000000-00000000
CPUID 00000009: 00000000-00000000-00000000-00000000
CPUID 0000000A: 00000000-00000000-00000000-00000000
CPUID 0000000C: 00000000-00000000-00000000-00000000
CPUID 0000000D: 00000007-00000340-000003C0-40000000
CPUID 0000000D: 00000100-00000240-00000000-00000000
CPUID 80000000: 8000001E-68747541-444D4163-69746E65
CPUID 80000001: 00610F01-20000000-01EBBFFF-2FD3FBFF
CPUID 80000002: 20444D41-2D303141-30303835-5041204B [AMD A10-5800K AP]
CPUID 80000003: 69772055-52206874-6F656461-6D74286E [U with Radeon(tm]
CPUID 80000004: 44482029-61724720-63696870-00202073 [) HD Graphics  ]
CPUID 80000005: FF40FF18-FF40FF30-10040140-40020140
CPUID 80000006: 64006400-64004200-08008140-00000000
CPUID 80000007: 00000000-00000000-00000000-000007D9
CPUID 80000008: 00003030-00000000-00004003-00000000
CPUID 80000009: 00000000-00000000-00000000-00000000
CPUID 8000000A: 00000001-00010000-00000000-00001CFF
CPUID 8000000B: 00000000-00000000-00000000-00000000
CPUID 8000000C: 00000000-00000000-00000000-00000000
CPUID 8000000D: 00000000-00000000-00000000-00000000
CPUID 8000000E: 00000000-00000000-00000000-00000000
CPUID 8000000F: 00000000-00000000-00000000-00000000
CPUID 80000010: 00000000-00000000-00000000-00000000
CPUID 80000011: 00000000-00000000-00000000-00000000
CPUID 80000012: 00000000-00000000-00000000-00000000
CPUID 80000013: 00000000-00000000-00000000-00000000
CPUID 80000014: 00000000-00000000-00000000-00000000
CPUID 80000015: 00000000-00000000-00000000-00000000
CPUID 80000016: 00000000-00000000-00000000-00000000
CPUID 80000017: 00000000-00000000-00000000-00000000
CPUID 80000018: 00000000-00000000-00000000-00000000
CPUID 80000019: F040F018-64006400-00000000-00000000
CPUID 8000001A: 00000003-00000000-00000000-00000000
CPUID 8000001B: 000000FF-00000000-00000000-00000000
CPUID 8000001C: 00000000-80032013-00010200-8000000F
CPUID 8000001D: 00000121-00C0003F-0000003F-00000000
CPUID 8000001D: 00004122-0040003F-000001FF-00000000
CPUID 8000001D: 00004143-03C0003F-000007FF-00000001
CPUID 8000001E: 00000011-00000100-00000000-00000000
CPUID 8FFFFFFF: 00000000-00000000-00000000-00000000 []

L1    Data Cache:     16 KB,  4-way Associative, 64-byte Line
L1  Instr. Cache:     64 KB,  2-way Associative, 64-byte Line
L2 Unified Cache:   2048 KB, 16-way Associative, 64-byte Line

------[ Logical CPU #2 ]------

allcpu: Package 0 / Core 2 / Thread 0: Valid

CPUID 00000000: 0000000D-68747541-444D4163-69746E65 [AuthenticAMD]
CPUID 00000001: 00610F01-02040800-3E98320B-178BFBFF
CPUID 00000002: 00000000-00000000-00000000-00000000
CPUID 00000003: 00000000-00000000-00000000-00000000
CPUID 00000005: 00000040-00000040-00000003-00000000
CPUID 00000006: 00000000-00000000-00000001-00000000
CPUID 00000007: 00000000-00000008-00000000-00000000
CPUID 00000008: 00000000-00000000-00000000-00000000
CPUID 00000009: 00000000-00000000-00000000-00000000
CPUID 0000000A: 00000000-00000000-00000000-00000000
CPUID 0000000C: 00000000-00000000-00000000-00000000
CPUID 0000000D: 00000007-00000340-000003C0-40000000
CPUID 0000000D: 00000100-00000240-00000000-00000000
CPUID 80000000: 8000001E-68747541-444D4163-69746E65
CPUID 80000001: 00610F01-20000000-01EBBFFF-2FD3FBFF
CPUID 80000002: 20444D41-2D303141-30303835-5041204B [AMD A10-5800K AP]
CPUID 80000003: 69772055-52206874-6F656461-6D74286E [U with Radeon(tm]
CPUID 80000004: 44482029-61724720-63696870-00202073 [) HD Graphics  ]
CPUID 80000005: FF40FF18-FF40FF30-10040140-40020140
CPUID 80000006: 64006400-64004200-08008140-00000000
CPUID 80000007: 00000000-00000000-00000000-000007D9
CPUID 80000008: 00003030-00000000-00004003-00000000
CPUID 80000009: 00000000-00000000-00000000-00000000
CPUID 8000000A: 00000001-00010000-00000000-00001CFF
CPUID 8000000B: 00000000-00000000-00000000-00000000
CPUID 8000000C: 00000000-00000000-00000000-00000000
CPUID 8000000D: 00000000-00000000-00000000-00000000
CPUID 8000000E: 00000000-00000000-00000000-00000000
CPUID 8000000F: 00000000-00000000-00000000-00000000
CPUID 80000010: 00000000-00000000-00000000-00000000
CPUID 80000011: 00000000-00000000-00000000-00000000
CPUID 80000012: 00000000-00000000-00000000-00000000
CPUID 80000013: 00000000-00000000-00000000-00000000
CPUID 80000014: 00000000-00000000-00000000-00000000
CPUID 80000015: 00000000-00000000-00000000-00000000
CPUID 80000016: 00000000-00000000-00000000-00000000
CPUID 80000017: 00000000-00000000-00000000-00000000
CPUID 80000018: 00000000-00000000-00000000-00000000
CPUID 80000019: F040F018-64006400-00000000-00000000
CPUID 8000001A: 00000003-00000000-00000000-00000000
CPUID 8000001B: 000000FF-00000000-00000000-00000000
CPUID 8000001C: 00000000-80032013-00010200-8000000F
CPUID 8000001D: 00000121-00C0003F-0000003F-00000000
CPUID 8000001D: 00004122-0040003F-000001FF-00000000
CPUID 8000001D: 00004143-03C0003F-000007FF-00000001
CPUID 8000001E: 00000012-00000101-00000000-00000000
CPUID 8FFFFFFF: 00000000-00000000-00000000-00000000 []

L1    Data Cache:     16 KB,  4-way Associative, 64-byte Line
L1  Instr. Cache:     64 KB,  2-way Associative, 64-byte Line
L2 Unified Cache:   2048 KB, 16-way Associative, 64-byte Line

------[ Logical CPU #3 ]------

allcpu: Package 0 / Core 3 / Thread 0: Valid

CPUID 00000000: 0000000D-68747541-444D4163-69746E65 [AuthenticAMD]
CPUID 00000001: 00610F01-03040800-3E98320B-178BFBFF
CPUID 00000002: 00000000-00000000-00000000-00000000
CPUID 00000003: 00000000-00000000-00000000-00000000
CPUID 00000005: 00000040-00000040-00000003-00000000
CPUID 00000006: 00000000-00000000-00000001-00000000
CPUID 00000007: 00000000-00000008-00000000-00000000
CPUID 00000008: 00000000-00000000-00000000-00000000
CPUID 00000009: 00000000-00000000-00000000-00000000
CPUID 0000000A: 00000000-00000000-00000000-00000000
CPUID 0000000C: 00000000-00000000-00000000-00000000
CPUID 0000000D: 00000007-00000340-000003C0-40000000
CPUID 0000000D: 00000100-00000240-00000000-00000000
CPUID 80000000: 8000001E-68747541-444D4163-69746E65
CPUID 80000001: 00610F01-20000000-01EBBFFF-2FD3FBFF
CPUID 80000002: 20444D41-2D303141-30303835-5041204B [AMD A10-5800K AP]
CPUID 80000003: 69772055-52206874-6F656461-6D74286E [U with Radeon(tm]
CPUID 80000004: 44482029-61724720-63696870-00202073 [) HD Graphics  ]
CPUID 80000005: FF40FF18-FF40FF30-10040140-40020140
CPUID 80000006: 64006400-64004200-08008140-00000000
CPUID 80000007: 00000000-00000000-00000000-000007D9
CPUID 80000008: 00003030-00000000-00004003-00000000
CPUID 80000009: 00000000-00000000-00000000-00000000
CPUID 8000000A: 00000001-00010000-00000000-00001CFF
CPUID 8000000B: 00000000-00000000-00000000-00000000
CPUID 8000000C: 00000000-00000000-00000000-00000000
CPUID 8000000D: 00000000-00000000-00000000-00000000
CPUID 8000000E: 00000000-00000000-00000000-00000000
CPUID 8000000F: 00000000-00000000-00000000-00000000
CPUID 80000010: 00000000-00000000-00000000-00000000
CPUID 80000011: 00000000-00000000-00000000-00000000
CPUID 80000012: 00000000-00000000-00000000-00000000
CPUID 80000013: 00000000-00000000-00000000-00000000
CPUID 80000014: 00000000-00000000-00000000-00000000
CPUID 80000015: 00000000-00000000-00000000-00000000
CPUID 80000016: 00000000-00000000-00000000-00000000
CPUID 80000017: 00000000-00000000-00000000-00000000
CPUID 80000018: 00000000-00000000-00000000-00000000
CPUID 80000019: F040F018-64006400-00000000-00000000
CPUID 8000001A: 00000003-00000000-00000000-00000000
CPUID 8000001B: 000000FF-00000000-00000000-00000000
CPUID 8000001C: 00000000-80032013-00010200-8000000F
CPUID 8000001D: 00000121-00C0003F-0000003F-00000000
CPUID 8000001D: 00004122-0040003F-000001FF-00000000
CPUID 8000001D: 00004143-03C0003F-000007FF-00000001
CPUID 8000001E: 00000013-00000101-00000000-00000000
CPUID 8FFFFFFF: 00000000-00000000-00000000-00000000 []

L1    Data Cache:     16 KB,  4-way Associative, 64-byte Line
L1  Instr. Cache:     64 KB,  2-way Associative, 64-byte Line
L2 Unified Cache:   2048 KB, 16-way Associative, 64-byte Line

------[ All CPUs ]------

CPU   0: APICID   0 / Package 0 / Core  0 / Thread 0: Valid
CPU   1: APICID   1 / Package 0 / Core  1 / Thread 0: Valid
CPU   2: APICID   2 / Package 0 / Core  2 / Thread 0: Valid
CPU   3: APICID   3 / Package 0 / Core  3 / Thread 0: Valid

------[ MSR Registers ]------

CPU Clock (Normal): 3793 MHz
CPU Clock (TSC): 3793 MHz
CPU Multiplier: 38.0x
CPB PStates: 2
MSR 0000001B: 0000-0000-FEE0-0900
MSR 0000008B: 0000-0000-0600-1116
MSR C0010015: 0000-0000-0900-0011
MSR C001001F: 0040-4000-0081-0000
MSR C0010055: 0000-0000-0000-0000
MSR C0010058: 0000-0000-E000-0021
MSR C0010061: 0000-0000-0000-0050
MSR C0010062: 0000-0000-0000-0000
MSR C0010063: 0000-0000-0000-0000
MSR C0010064: 8000-01C4-0000-181A [42.00x] [1.4750 V] [19.60 A] [PState Pb0]
MSR C0010065: 8000-01D0-0000-2018 [40.00x] [1.4500 V] [20.80 A] [PState Pb1]
MSR C0010066: 8000-0198-0000-3C16 [38.00x] [1.3625 V] [15.20 A] [PState P0]
MSR C0010067: 8000-017C-0000-5412 [34.00x] [1.2875 V] [12.40 A] [PState P1]
MSR C0010068: 8000-0160-0000-700D [29.00x] [1.2000 V] [ 9.60 A] [PState P2]
MSR C0010069: 8000-0143-0000-9808 [24.00x] [1.0750 V] [ 6.70 A] [PState P3]
MSR C001006A: 8000-012D-0000-BC03 [19.00x] [0.9625 V] [ 4.50 A] [PState P4]
MSR C001006B: 8000-0121-0040-C84C [14.00x] [0.9250 V] [ 3.30 A] [PState P5]
MSR C0010070: 0000-0000-2C02-3C16
MSR C0010071: 0280-0006-3802-3C16 [38.00x] [1.3625V]
MSR C0010071: 0280-0006-3802-3C16 [38.00x] [1.3625V]
MSR C0010071: 0280-0006-3802-3C16 [38.00x] [1.3625V]
MSR C0010071: 0280-0006-3802-3C16 [38.00x] [1.3625V]
MSR C0010071: 0280-0006-3802-3C16 [38.00x] [1.3625V]
MSR C0010140: 0000-0000-0000-0004
MSR C0010141: 0000-0000-0000-0000
MSR C0011023: 8100-4000-0078-0220

PerformanceFrequency = 3704248

CPU Clock M.Method = 6  (APIC K10)
PM Timer Address   = 2056  (0808h)

APIC Clock = 99.82 MHz
APIC Clock = 99.82 MHz
APIC Clock = 99.82 MHz
APIC Clock = 99.81 MHz
APIC Clock = 99.82 MHz
