------[ Versions ]------

Program Version : EVEREST v5.02.1805 Beta
BenchDLL Version: 2.4.258.0

------[ CPU Info ]------

CPU Type           : AMD Athlon 64, 1800 MHz (9 x 200) 2800+
CPU Alias          : ClawHammer-512 S754
CPU Platform       : Socket 754
CPU Stepping       : SH-CG
Instruction Set    : x86, x86-64, MMX, 3DNow!, SSE, SSE2
CPUID Manufacturer : AuthenticAMD
CPUID CPU Name     : AMD Athlon(tm) 64 Processor 2800+
CPUID Revision     : 00000F4Ah
AMD Old Brand ID   : 0106h  (Athlon 64 2800+)
Platform ID        : D2h  (Socket 754)

------[ Logical CPU #0 ]------

allcpu: Valid

CPUID 00000000: 00000001-68747541-444D4163-69746E65
CPUID 00000001: 00000F4A-00000800-00000000-078BFBFF
CPUID 80000000: 80000018-68747541-444D4163-69746E65
CPUID 80000001: 00000F4A-00000106-00000000-E1D3FBFF
CPUID 80000002: 20444D41-6C687441-74286E6F-3620296D
CPUID 80000003: 72502034-7365636F-20726F73-30303832
CPUID 80000004: 0000002B-00000000-00000000-00000000
CPUID 80000005: FF08FF08-FF20FF20-40020140-40020140
CPUID 80000006: 00000000-42004200-02008140-00000000
CPUID 80000007: 00000000-00000000-00000000-0000000F
CPUID 80000008: 00003028-00000000-00000000-00000000
CPUID 80000009: 00000000-00000000-00000000-00000000
CPUID 8000000A: 00000000-00000000-00000000-00000000
CPUID 8000000B: 00000000-00000000-00000000-00000000
CPUID 8000000C: 00000000-00000000-00000000-00000000
CPUID 8000000D: 00000000-00000000-00000000-00000000
CPUID 8000000E: 00000000-00000000-00000000-00000000
CPUID 8000000F: 00000000-00000000-00000000-00000000
CPUID 80000010: 00000000-00000000-00000000-00000000
CPUID 80000011: 00000000-00000000-00000000-00000000
CPUID 80000012: 00000000-00000000-00000000-00000000
CPUID 80000013: 00000000-00000000-00000000-00000000
CPUID 80000014: 00000000-00000000-00000000-00000000
CPUID 80000015: 00000000-00000000-00000000-00000000
CPUID 80000016: 00000000-00000000-00000000-00000000
CPUID 80000017: 00000000-00000000-00000000-00000000
CPUID 80000018: 00000000-00000000-00000000-00000000
CPUID 8FFFFFFF: 53275449-4D414820-2052454D-454D4954

------[ MSR Registers ]------

MSR 0000001B: 0000-0000-FEE0-0900
MSR C0010015: 0000-0000-0A00-0000
MSR C0010042: 0000-0200-000A-0A0A

PerformanceFrequency = 3579545

Tjmax Temperature = 0 Celsius
