------[ CPUID Registers / Logical CPU #0 ]------

allcpu: Package 0 / Core 0 / Thread 0: Valid

CPUID 00000000: 00000010-68747541-444D4163-69746E65 [AuthenticAMD]
CPUID 00000001: 008A0F00-00080800-7EF8320B-178BFBFF
CPUID 00000002: 00000000-00000000-00000000-00000000
CPUID 00000003: 00000000-00000000-00000000-00000000
CPUID 00000005: 00000040-00000040-00000003-00000011
CPUID 00000006: 00000004-00000000-00000001-00000000
CPUID 00000007: 00000000-219C91A9-00400004-00000000 [SL 00]
CPUID 00000008: 00000000-00000000-00000000-00000000
CPUID 00000009: 00000000-00000000-00000000-00000000
CPUID 0000000A: 00000000-00000000-00000000-00000000
CPUID 0000000B: 00000001-00000002-00000100-00000000 [SL 00]
CPUID 0000000B: 00000007-00000008-00000201-00000000 [SL 01]
CPUID 0000000C: 00000000-00000000-00000000-00000000
CPUID 0000000D: 00000207-00000340-00000380-00000000 [SL 00] [x87]
CPUID 0000000D: 0000000F-00000340-00000000-00000000 [SL 01] [SSE]
CPUID 0000000D: 00000100-00000240-00000000-00000000 [SL 02] [AVX]
CPUID 0000000D: 00000040-00000340-00000000-00000000 [SL 09] [PKRU]
CPUID 0000000E: 00000000-00000000-00000000-00000000
CPUID 0000000F: 00000000-000000FF-00000000-00000002 [SL 00]
CPUID 0000000F: 00000000-00000040-000000FF-00000007 [SL 01]
CPUID 00000010: 00000000-00000002-00000000-00000000 [SL 00]
CPUID 00000010: 0000000F-00000000-00000004-0000000F [SL 01]
CPUID 80000000: 80000020-68747541-444D4163-69746E65 [AuthenticAMD]
CPUID 80000001: 008A0F00-10000000-75C237FF-2FD3FBFF
CPUID 80000002: 20444D41-657A7952-2033206E-30323337 [AMD Ryzen 3 7320]
CPUID 80000003: 69772055-52206874-6F656461-7247206E [U with Radeon Gr]
CPUID 80000004: 69687061-20207363-20202020-00202020 [aphics         ]
CPUID 80000005: FF40FF40-FF40FF40-20080140-20080140 [L1D: 32 KB / L1I: 32 KB]
CPUID 80000006: 48006400-68006400-02006140-00209140 [L2: 512 KB] / L3: 4096 KB]
CPUID 80000007: 00000000-0000001B-00000000-00006799
CPUID 80000008: 00003030-010CF657-00007007-00010000
CPUID 80000009: 00000000-00000000-00000000-00000000
CPUID 8000000A: 00000001-00008000-00000000-0013BCFF
CPUID 8000000B: 00000000-00000000-00000000-00000000
CPUID 8000000C: 00000000-00000000-00000000-00000000
CPUID 8000000D: 00000000-00000000-00000000-00000000
CPUID 8000000E: 00000000-00000000-00000000-00000000
CPUID 8000000F: 00000000-00000000-00000000-00000000
CPUID 80000010: 00000000-00000000-00000000-00000000
CPUID 80000011: 00000000-00000000-00000000-00000000
CPUID 80000012: 00000000-00000000-00000000-00000000
CPUID 80000013: 00000000-00000000-00000000-00000000
CPUID 80000014: 00000000-00000000-00000000-00000000
CPUID 80000015: 00000000-00000000-00000000-00000000
CPUID 80000016: 00000000-00000000-00000000-00000000
CPUID 80000017: 00000000-00000000-00000000-00000000
CPUID 80000018: 00000000-00000000-00000000-00000000
CPUID 80000019: F040F040-00000000-00000000-00000000
CPUID 8000001A: 00000006-00000000-00000000-00000000
CPUID 8000001B: 000003FF-00000000-00000000-00000000
CPUID 8000001C: 00000000-00000000-00000000-00000000
CPUID 8000001D: 00004121-01C0003F-0000003F-00000000 [SL 00] [L1D: 32 KB]
CPUID 8000001D: 00004122-01C0003F-0000003F-00000000 [SL 01] [L1I: 32 KB]
CPUID 8000001D: 00004143-01C0003F-000003FF-00000002 [SL 02] [L2U: 512 KB]
CPUID 8000001D: 0001C163-03C0003F-00000FFF-00000001 [SL 03] [L3U: 4 MB]
CPUID 8000001E: 00000000-00000100-00000000-00000000
CPUID 8000001F: 0001000F-0000012F-0000000E-00000001
CPUID 80000020: 00000000-00000002-00000000-00000000 [SL 00]
CPUID 80000020: 0000000B-00000000-00000000-0000000F [SL 01]
CPUID 80000020: 00000000-00000000-00000000-00000000 [SL 02]
CPUID 8FFFFFFF: 00000000-00000000-00000000-00000000

L1    Data Cache:    32 KB,  8-way Associative, 64-byte Line
L1  Instr. Cache:    32 KB,  8-way Associative, 64-byte Line
L2 Unified Cache:   512 KB,  8-way Associative, 64-byte Line
L3 Unified Cache:     4 MB, 16-way Associative, 64-byte Line

------[ CPUID Registers / Logical CPU #1 ]------

allcpu: Package 0 / Core 0 / Thread 1: Valid, Virtual

CPUID 00000000: 00000010-68747541-444D4163-69746E65 [AuthenticAMD]
CPUID 00000001: 008A0F00-01080800-7EF8320B-178BFBFF
CPUID 00000002: 00000000-00000000-00000000-00000000
CPUID 00000003: 00000000-00000000-00000000-00000000
CPUID 00000005: 00000040-00000040-00000003-00000011
CPUID 00000006: 00000004-00000000-00000001-00000000
CPUID 00000007: 00000000-219C91A9-00400004-00000000 [SL 00]
CPUID 00000008: 00000000-00000000-00000000-00000000
CPUID 00000009: 00000000-00000000-00000000-00000000
CPUID 0000000A: 00000000-00000000-00000000-00000000
CPUID 0000000B: 00000001-00000002-00000100-00000001 [SL 00]
CPUID 0000000B: 00000007-00000008-00000201-00000001 [SL 01]
CPUID 0000000C: 00000000-00000000-00000000-00000000
CPUID 0000000D: 00000207-00000340-00000380-00000000 [SL 00] [x87]
CPUID 0000000D: 0000000F-00000340-00000000-00000000 [SL 01] [SSE]
CPUID 0000000D: 00000100-00000240-00000000-00000000 [SL 02] [AVX]
CPUID 0000000D: 00000040-00000340-00000000-00000000 [SL 09] [PKRU]
CPUID 0000000E: 00000000-00000000-00000000-00000000
CPUID 0000000F: 00000000-000000FF-00000000-00000002 [SL 00]
CPUID 0000000F: 00000000-00000040-000000FF-00000007 [SL 01]
CPUID 00000010: 00000000-00000002-00000000-00000000 [SL 00]
CPUID 00000010: 0000000F-00000000-00000004-0000000F [SL 01]
CPUID 80000000: 80000020-68747541-444D4163-69746E65 [AuthenticAMD]
CPUID 80000001: 008A0F00-10000000-75C237FF-2FD3FBFF
CPUID 80000002: 20444D41-657A7952-2033206E-30323337 [AMD Ryzen 3 7320]
CPUID 80000003: 69772055-52206874-6F656461-7247206E [U with Radeon Gr]
CPUID 80000004: 69687061-20207363-20202020-00202020 [aphics         ]
CPUID 80000005: FF40FF40-FF40FF40-20080140-20080140 [L1D: 32 KB / L1I: 32 KB]
CPUID 80000006: 48006400-68006400-02006140-00209140 [L2: 512 KB] / L3: 4096 KB]
CPUID 80000007: 00000000-0000001B-00000000-00006799
CPUID 80000008: 00003030-010CF657-00007007-00010000
CPUID 80000009: 00000000-00000000-00000000-00000000
CPUID 8000000A: 00000001-00008000-00000000-0013BCFF
CPUID 8000000B: 00000000-00000000-00000000-00000000
CPUID 8000000C: 00000000-00000000-00000000-00000000
CPUID 8000000D: 00000000-00000000-00000000-00000000
CPUID 8000000E: 00000000-00000000-00000000-00000000
CPUID 8000000F: 00000000-00000000-00000000-00000000
CPUID 80000010: 00000000-00000000-00000000-00000000
CPUID 80000011: 00000000-00000000-00000000-00000000
CPUID 80000012: 00000000-00000000-00000000-00000000
CPUID 80000013: 00000000-00000000-00000000-00000000
CPUID 80000014: 00000000-00000000-00000000-00000000
CPUID 80000015: 00000000-00000000-00000000-00000000
CPUID 80000016: 00000000-00000000-00000000-00000000
CPUID 80000017: 00000000-00000000-00000000-00000000
CPUID 80000018: 00000000-00000000-00000000-00000000
CPUID 80000019: F040F040-00000000-00000000-00000000
CPUID 8000001A: 00000006-00000000-00000000-00000000
CPUID 8000001B: 000003FF-00000000-00000000-00000000
CPUID 8000001C: 00000000-00000000-00000000-00000000
CPUID 8000001D: 00004121-01C0003F-0000003F-00000000 [SL 00] [L1D: 32 KB]
CPUID 8000001D: 00004122-01C0003F-0000003F-00000000 [SL 01] [L1I: 32 KB]
CPUID 8000001D: 00004143-01C0003F-000003FF-00000002 [SL 02] [L2U: 512 KB]
CPUID 8000001D: 0001C163-03C0003F-00000FFF-00000001 [SL 03] [L3U: 4 MB]
CPUID 8000001E: 00000001-00000100-00000000-00000000
CPUID 8000001F: 0001000F-0000012F-0000000E-00000001
CPUID 80000020: 00000000-00000002-00000000-00000000 [SL 00]
CPUID 80000020: 0000000B-00000000-00000000-0000000F [SL 01]
CPUID 80000020: 00000000-00000000-00000000-00000000 [SL 02]
CPUID 8FFFFFFF: 00000000-00000000-00000000-00000000

L1    Data Cache:    32 KB,  8-way Associative, 64-byte Line
L1  Instr. Cache:    32 KB,  8-way Associative, 64-byte Line
L2 Unified Cache:   512 KB,  8-way Associative, 64-byte Line
L3 Unified Cache:     4 MB, 16-way Associative, 64-byte Line

------[ CPUID Registers / Logical CPU #2 ]------

allcpu: Package 0 / Core 1 / Thread 0: Valid

CPUID 00000000: 00000010-68747541-444D4163-69746E65 [AuthenticAMD]
CPUID 00000001: 008A0F00-02080800-7EF8320B-178BFBFF
CPUID 00000002: 00000000-00000000-00000000-00000000
CPUID 00000003: 00000000-00000000-00000000-00000000
CPUID 00000005: 00000040-00000040-00000003-00000011
CPUID 00000006: 00000004-00000000-00000001-00000000
CPUID 00000007: 00000000-219C91A9-00400004-00000000 [SL 00]
CPUID 00000008: 00000000-00000000-00000000-00000000
CPUID 00000009: 00000000-00000000-00000000-00000000
CPUID 0000000A: 00000000-00000000-00000000-00000000
CPUID 0000000B: 00000001-00000002-00000100-00000002 [SL 00]
CPUID 0000000B: 00000007-00000008-00000201-00000002 [SL 01]
CPUID 0000000C: 00000000-00000000-00000000-00000000
CPUID 0000000D: 00000207-00000340-00000380-00000000 [SL 00] [x87]
CPUID 0000000D: 0000000F-00000340-00000000-00000000 [SL 01] [SSE]
CPUID 0000000D: 00000100-00000240-00000000-00000000 [SL 02] [AVX]
CPUID 0000000D: 00000040-00000340-00000000-00000000 [SL 09] [PKRU]
CPUID 0000000E: 00000000-00000000-00000000-00000000
CPUID 0000000F: 00000000-000000FF-00000000-00000002 [SL 00]
CPUID 0000000F: 00000000-00000040-000000FF-00000007 [SL 01]
CPUID 00000010: 00000000-00000002-00000000-00000000 [SL 00]
CPUID 00000010: 0000000F-00000000-00000004-0000000F [SL 01]
CPUID 80000000: 80000020-68747541-444D4163-69746E65 [AuthenticAMD]
CPUID 80000001: 008A0F00-10000000-75C237FF-2FD3FBFF
CPUID 80000002: 20444D41-657A7952-2033206E-30323337 [AMD Ryzen 3 7320]
CPUID 80000003: 69772055-52206874-6F656461-7247206E [U with Radeon Gr]
CPUID 80000004: 69687061-20207363-20202020-00202020 [aphics         ]
CPUID 80000005: FF40FF40-FF40FF40-20080140-20080140 [L1D: 32 KB / L1I: 32 KB]
CPUID 80000006: 48006400-68006400-02006140-00209140 [L2: 512 KB] / L3: 4096 KB]
CPUID 80000007: 00000000-0000001B-00000000-00006799
CPUID 80000008: 00003030-010CF657-00007007-00010000
CPUID 80000009: 00000000-00000000-00000000-00000000
CPUID 8000000A: 00000001-00008000-00000000-0013BCFF
CPUID 8000000B: 00000000-00000000-00000000-00000000
CPUID 8000000C: 00000000-00000000-00000000-00000000
CPUID 8000000D: 00000000-00000000-00000000-00000000
CPUID 8000000E: 00000000-00000000-00000000-00000000
CPUID 8000000F: 00000000-00000000-00000000-00000000
CPUID 80000010: 00000000-00000000-00000000-00000000
CPUID 80000011: 00000000-00000000-00000000-00000000
CPUID 80000012: 00000000-00000000-00000000-00000000
CPUID 80000013: 00000000-00000000-00000000-00000000
CPUID 80000014: 00000000-00000000-00000000-00000000
CPUID 80000015: 00000000-00000000-00000000-00000000
CPUID 80000016: 00000000-00000000-00000000-00000000
CPUID 80000017: 00000000-00000000-00000000-00000000
CPUID 80000018: 00000000-00000000-00000000-00000000
CPUID 80000019: F040F040-00000000-00000000-00000000
CPUID 8000001A: 00000006-00000000-00000000-00000000
CPUID 8000001B: 000003FF-00000000-00000000-00000000
CPUID 8000001C: 00000000-00000000-00000000-00000000
CPUID 8000001D: 00004121-01C0003F-0000003F-00000000 [SL 00] [L1D: 32 KB]
CPUID 8000001D: 00004122-01C0003F-0000003F-00000000 [SL 01] [L1I: 32 KB]
CPUID 8000001D: 00004143-01C0003F-000003FF-00000002 [SL 02] [L2U: 512 KB]
CPUID 8000001D: 0001C163-03C0003F-00000FFF-00000001 [SL 03] [L3U: 4 MB]
CPUID 8000001E: 00000002-00000101-00000000-00000000
CPUID 8000001F: 0001000F-0000012F-0000000E-00000001
CPUID 80000020: 00000000-00000002-00000000-00000000 [SL 00]
CPUID 80000020: 0000000B-00000000-00000000-0000000F [SL 01]
CPUID 80000020: 00000000-00000000-00000000-00000000 [SL 02]
CPUID 8FFFFFFF: 00000000-00000000-00000000-00000000

L1    Data Cache:    32 KB,  8-way Associative, 64-byte Line
L1  Instr. Cache:    32 KB,  8-way Associative, 64-byte Line
L2 Unified Cache:   512 KB,  8-way Associative, 64-byte Line
L3 Unified Cache:     4 MB, 16-way Associative, 64-byte Line

------[ CPUID Registers / Logical CPU #3 ]------

allcpu: Package 0 / Core 1 / Thread 1: Valid, Virtual

CPUID 00000000: 00000010-68747541-444D4163-69746E65 [AuthenticAMD]
CPUID 00000001: 008A0F00-03080800-7EF8320B-178BFBFF
CPUID 00000002: 00000000-00000000-00000000-00000000
CPUID 00000003: 00000000-00000000-00000000-00000000
CPUID 00000005: 00000040-00000040-00000003-00000011
CPUID 00000006: 00000004-00000000-00000001-00000000
CPUID 00000007: 00000000-219C91A9-00400004-00000000 [SL 00]
CPUID 00000008: 00000000-00000000-00000000-00000000
CPUID 00000009: 00000000-00000000-00000000-00000000
CPUID 0000000A: 00000000-00000000-00000000-00000000
CPUID 0000000B: 00000001-00000002-00000100-00000003 [SL 00]
CPUID 0000000B: 00000007-00000008-00000201-00000003 [SL 01]
CPUID 0000000C: 00000000-00000000-00000000-00000000
CPUID 0000000D: 00000207-00000340-00000380-00000000 [SL 00] [x87]
CPUID 0000000D: 0000000F-00000340-00000000-00000000 [SL 01] [SSE]
CPUID 0000000D: 00000100-00000240-00000000-00000000 [SL 02] [AVX]
CPUID 0000000D: 00000040-00000340-00000000-00000000 [SL 09] [PKRU]
CPUID 0000000E: 00000000-00000000-00000000-00000000
CPUID 0000000F: 00000000-000000FF-00000000-00000002 [SL 00]
CPUID 0000000F: 00000000-00000040-000000FF-00000007 [SL 01]
CPUID 00000010: 00000000-00000002-00000000-00000000 [SL 00]
CPUID 00000010: 0000000F-00000000-00000004-0000000F [SL 01]
CPUID 80000000: 80000020-68747541-444D4163-69746E65 [AuthenticAMD]
CPUID 80000001: 008A0F00-10000000-75C237FF-2FD3FBFF
CPUID 80000002: 20444D41-657A7952-2033206E-30323337 [AMD Ryzen 3 7320]
CPUID 80000003: 69772055-52206874-6F656461-7247206E [U with Radeon Gr]
CPUID 80000004: 69687061-20207363-20202020-00202020 [aphics         ]
CPUID 80000005: FF40FF40-FF40FF40-20080140-20080140 [L1D: 32 KB / L1I: 32 KB]
CPUID 80000006: 48006400-68006400-02006140-00209140 [L2: 512 KB] / L3: 4096 KB]
CPUID 80000007: 00000000-0000001B-00000000-00006799
CPUID 80000008: 00003030-010CF657-00007007-00010000
CPUID 80000009: 00000000-00000000-00000000-00000000
CPUID 8000000A: 00000001-00008000-00000000-0013BCFF
CPUID 8000000B: 00000000-00000000-00000000-00000000
CPUID 8000000C: 00000000-00000000-00000000-00000000
CPUID 8000000D: 00000000-00000000-00000000-00000000
CPUID 8000000E: 00000000-00000000-00000000-00000000
CPUID 8000000F: 00000000-00000000-00000000-00000000
CPUID 80000010: 00000000-00000000-00000000-00000000
CPUID 80000011: 00000000-00000000-00000000-00000000
CPUID 80000012: 00000000-00000000-00000000-00000000
CPUID 80000013: 00000000-00000000-00000000-00000000
CPUID 80000014: 00000000-00000000-00000000-00000000
CPUID 80000015: 00000000-00000000-00000000-00000000
CPUID 80000016: 00000000-00000000-00000000-00000000
CPUID 80000017: 00000000-00000000-00000000-00000000
CPUID 80000018: 00000000-00000000-00000000-00000000
CPUID 80000019: F040F040-00000000-00000000-00000000
CPUID 8000001A: 00000006-00000000-00000000-00000000
CPUID 8000001B: 000003FF-00000000-00000000-00000000
CPUID 8000001C: 00000000-00000000-00000000-00000000
CPUID 8000001D: 00004121-01C0003F-0000003F-00000000 [SL 00] [L1D: 32 KB]
CPUID 8000001D: 00004122-01C0003F-0000003F-00000000 [SL 01] [L1I: 32 KB]
CPUID 8000001D: 00004143-01C0003F-000003FF-00000002 [SL 02] [L2U: 512 KB]
CPUID 8000001D: 0001C163-03C0003F-00000FFF-00000001 [SL 03] [L3U: 4 MB]
CPUID 8000001E: 00000003-00000101-00000000-00000000
CPUID 8000001F: 0001000F-0000012F-0000000E-00000001
CPUID 80000020: 00000000-00000002-00000000-00000000 [SL 00]
CPUID 80000020: 0000000B-00000000-00000000-0000000F [SL 01]
CPUID 80000020: 00000000-00000000-00000000-00000000 [SL 02]
CPUID 8FFFFFFF: 00000000-00000000-00000000-00000000

L1    Data Cache:    32 KB,  8-way Associative, 64-byte Line
L1  Instr. Cache:    32 KB,  8-way Associative, 64-byte Line
L2 Unified Cache:   512 KB,  8-way Associative, 64-byte Line
L3 Unified Cache:     4 MB, 16-way Associative, 64-byte Line

------[ CPUID Registers / Logical CPU #4 ]------

allcpu: Package 0 / Core 2 / Thread 0: Valid

CPUID 00000000: 00000010-68747541-444D4163-69746E65 [AuthenticAMD]
CPUID 00000001: 008A0F00-04080800-7EF8320B-178BFBFF
CPUID 00000002: 00000000-00000000-00000000-00000000
CPUID 00000003: 00000000-00000000-00000000-00000000
CPUID 00000005: 00000040-00000040-00000003-00000011
CPUID 00000006: 00000004-00000000-00000001-00000000
CPUID 00000007: 00000000-219C91A9-00400004-00000000 [SL 00]
CPUID 00000008: 00000000-00000000-00000000-00000000
CPUID 00000009: 00000000-00000000-00000000-00000000
CPUID 0000000A: 00000000-00000000-00000000-00000000
CPUID 0000000B: 00000001-00000002-00000100-00000004 [SL 00]
CPUID 0000000B: 00000007-00000008-00000201-00000004 [SL 01]
CPUID 0000000C: 00000000-00000000-00000000-00000000
CPUID 0000000D: 00000207-00000340-00000380-00000000 [SL 00] [x87]
CPUID 0000000D: 0000000F-00000340-00000000-00000000 [SL 01] [SSE]
CPUID 0000000D: 00000100-00000240-00000000-00000000 [SL 02] [AVX]
CPUID 0000000D: 00000040-00000340-00000000-00000000 [SL 09] [PKRU]
CPUID 0000000E: 00000000-00000000-00000000-00000000
CPUID 0000000F: 00000000-000000FF-00000000-00000002 [SL 00]
CPUID 0000000F: 00000000-00000040-000000FF-00000007 [SL 01]
CPUID 00000010: 00000000-00000002-00000000-00000000 [SL 00]
CPUID 00000010: 0000000F-00000000-00000004-0000000F [SL 01]
CPUID 80000000: 80000020-68747541-444D4163-69746E65 [AuthenticAMD]
CPUID 80000001: 008A0F00-10000000-75C237FF-2FD3FBFF
CPUID 80000002: 20444D41-657A7952-2033206E-30323337 [AMD Ryzen 3 7320]
CPUID 80000003: 69772055-52206874-6F656461-7247206E [U with Radeon Gr]
CPUID 80000004: 69687061-20207363-20202020-00202020 [aphics         ]
CPUID 80000005: FF40FF40-FF40FF40-20080140-20080140 [L1D: 32 KB / L1I: 32 KB]
CPUID 80000006: 48006400-68006400-02006140-00209140 [L2: 512 KB] / L3: 4096 KB]
CPUID 80000007: 00000000-0000001B-00000000-00006799
CPUID 80000008: 00003030-010CF657-00007007-00010000
CPUID 80000009: 00000000-00000000-00000000-00000000
CPUID 8000000A: 00000001-00008000-00000000-0013BCFF
CPUID 8000000B: 00000000-00000000-00000000-00000000
CPUID 8000000C: 00000000-00000000-00000000-00000000
CPUID 8000000D: 00000000-00000000-00000000-00000000
CPUID 8000000E: 00000000-00000000-00000000-00000000
CPUID 8000000F: 00000000-00000000-00000000-00000000
CPUID 80000010: 00000000-00000000-00000000-00000000
CPUID 80000011: 00000000-00000000-00000000-00000000
CPUID 80000012: 00000000-00000000-00000000-00000000
CPUID 80000013: 00000000-00000000-00000000-00000000
CPUID 80000014: 00000000-00000000-00000000-00000000
CPUID 80000015: 00000000-00000000-00000000-00000000
CPUID 80000016: 00000000-00000000-00000000-00000000
CPUID 80000017: 00000000-00000000-00000000-00000000
CPUID 80000018: 00000000-00000000-00000000-00000000
CPUID 80000019: F040F040-00000000-00000000-00000000
CPUID 8000001A: 00000006-00000000-00000000-00000000
CPUID 8000001B: 000003FF-00000000-00000000-00000000
CPUID 8000001C: 00000000-00000000-00000000-00000000
CPUID 8000001D: 00004121-01C0003F-0000003F-00000000 [SL 00] [L1D: 32 KB]
CPUID 8000001D: 00004122-01C0003F-0000003F-00000000 [SL 01] [L1I: 32 KB]
CPUID 8000001D: 00004143-01C0003F-000003FF-00000002 [SL 02] [L2U: 512 KB]
CPUID 8000001D: 0001C163-03C0003F-00000FFF-00000001 [SL 03] [L3U: 4 MB]
CPUID 8000001E: 00000004-00000102-00000000-00000000
CPUID 8000001F: 0001000F-0000012F-0000000E-00000001
CPUID 80000020: 00000000-00000002-00000000-00000000 [SL 00]
CPUID 80000020: 0000000B-00000000-00000000-0000000F [SL 01]
CPUID 80000020: 00000000-00000000-00000000-00000000 [SL 02]
CPUID 8FFFFFFF: 00000000-00000000-00000000-00000000

L1    Data Cache:    32 KB,  8-way Associative, 64-byte Line
L1  Instr. Cache:    32 KB,  8-way Associative, 64-byte Line
L2 Unified Cache:   512 KB,  8-way Associative, 64-byte Line
L3 Unified Cache:     4 MB, 16-way Associative, 64-byte Line

------[ CPUID Registers / Logical CPU #5 ]------

allcpu: Package 0 / Core 2 / Thread 1: Valid, Virtual

CPUID 00000000: 00000010-68747541-444D4163-69746E65 [AuthenticAMD]
CPUID 00000001: 008A0F00-05080800-7EF8320B-178BFBFF
CPUID 00000002: 00000000-00000000-00000000-00000000
CPUID 00000003: 00000000-00000000-00000000-00000000
CPUID 00000005: 00000040-00000040-00000003-00000011
CPUID 00000006: 00000004-00000000-00000001-00000000
CPUID 00000007: 00000000-219C91A9-00400004-00000000 [SL 00]
CPUID 00000008: 00000000-00000000-00000000-00000000
CPUID 00000009: 00000000-00000000-00000000-00000000
CPUID 0000000A: 00000000-00000000-00000000-00000000
CPUID 0000000B: 00000001-00000002-00000100-00000005 [SL 00]
CPUID 0000000B: 00000007-00000008-00000201-00000005 [SL 01]
CPUID 0000000C: 00000000-00000000-00000000-00000000
CPUID 0000000D: 00000207-00000340-00000380-00000000 [SL 00] [x87]
CPUID 0000000D: 0000000F-00000340-00000000-00000000 [SL 01] [SSE]
CPUID 0000000D: 00000100-00000240-00000000-00000000 [SL 02] [AVX]
CPUID 0000000D: 00000040-00000340-00000000-00000000 [SL 09] [PKRU]
CPUID 0000000E: 00000000-00000000-00000000-00000000
CPUID 0000000F: 00000000-000000FF-00000000-00000002 [SL 00]
CPUID 0000000F: 00000000-00000040-000000FF-00000007 [SL 01]
CPUID 00000010: 00000000-00000002-00000000-00000000 [SL 00]
CPUID 00000010: 0000000F-00000000-00000004-0000000F [SL 01]
CPUID 80000000: 80000020-68747541-444D4163-69746E65 [AuthenticAMD]
CPUID 80000001: 008A0F00-10000000-75C237FF-2FD3FBFF
CPUID 80000002: 20444D41-657A7952-2033206E-30323337 [AMD Ryzen 3 7320]
CPUID 80000003: 69772055-52206874-6F656461-7247206E [U with Radeon Gr]
CPUID 80000004: 69687061-20207363-20202020-00202020 [aphics         ]
CPUID 80000005: FF40FF40-FF40FF40-20080140-20080140 [L1D: 32 KB / L1I: 32 KB]
CPUID 80000006: 48006400-68006400-02006140-00209140 [L2: 512 KB] / L3: 4096 KB]
CPUID 80000007: 00000000-0000001B-00000000-00006799
CPUID 80000008: 00003030-010CF657-00007007-00010000
CPUID 80000009: 00000000-00000000-00000000-00000000
CPUID 8000000A: 00000001-00008000-00000000-0013BCFF
CPUID 8000000B: 00000000-00000000-00000000-00000000
CPUID 8000000C: 00000000-00000000-00000000-00000000
CPUID 8000000D: 00000000-00000000-00000000-00000000
CPUID 8000000E: 00000000-00000000-00000000-00000000
CPUID 8000000F: 00000000-00000000-00000000-00000000
CPUID 80000010: 00000000-00000000-00000000-00000000
CPUID 80000011: 00000000-00000000-00000000-00000000
CPUID 80000012: 00000000-00000000-00000000-00000000
CPUID 80000013: 00000000-00000000-00000000-00000000
CPUID 80000014: 00000000-00000000-00000000-00000000
CPUID 80000015: 00000000-00000000-00000000-00000000
CPUID 80000016: 00000000-00000000-00000000-00000000
CPUID 80000017: 00000000-00000000-00000000-00000000
CPUID 80000018: 00000000-00000000-00000000-00000000
CPUID 80000019: F040F040-00000000-00000000-00000000
CPUID 8000001A: 00000006-00000000-00000000-00000000
CPUID 8000001B: 000003FF-00000000-00000000-00000000
CPUID 8000001C: 00000000-00000000-00000000-00000000
CPUID 8000001D: 00004121-01C0003F-0000003F-00000000 [SL 00] [L1D: 32 KB]
CPUID 8000001D: 00004122-01C0003F-0000003F-00000000 [SL 01] [L1I: 32 KB]
CPUID 8000001D: 00004143-01C0003F-000003FF-00000002 [SL 02] [L2U: 512 KB]
CPUID 8000001D: 0001C163-03C0003F-00000FFF-00000001 [SL 03] [L3U: 4 MB]
CPUID 8000001E: 00000005-00000102-00000000-00000000
CPUID 8000001F: 0001000F-0000012F-0000000E-00000001
CPUID 80000020: 00000000-00000002-00000000-00000000 [SL 00]
CPUID 80000020: 0000000B-00000000-00000000-0000000F [SL 01]
CPUID 80000020: 00000000-00000000-00000000-00000000 [SL 02]
CPUID 8FFFFFFF: 00000000-00000000-00000000-00000000

L1    Data Cache:    32 KB,  8-way Associative, 64-byte Line
L1  Instr. Cache:    32 KB,  8-way Associative, 64-byte Line
L2 Unified Cache:   512 KB,  8-way Associative, 64-byte Line
L3 Unified Cache:     4 MB, 16-way Associative, 64-byte Line

------[ CPUID Registers / Logical CPU #6 ]------

allcpu: Package 0 / Core 3 / Thread 0: Valid

CPUID 00000000: 00000010-68747541-444D4163-69746E65 [AuthenticAMD]
CPUID 00000001: 008A0F00-06080800-7EF8320B-178BFBFF
CPUID 00000002: 00000000-00000000-00000000-00000000
CPUID 00000003: 00000000-00000000-00000000-00000000
CPUID 00000005: 00000040-00000040-00000003-00000011
CPUID 00000006: 00000004-00000000-00000001-00000000
CPUID 00000007: 00000000-219C91A9-00400004-00000000 [SL 00]
CPUID 00000008: 00000000-00000000-00000000-00000000
CPUID 00000009: 00000000-00000000-00000000-00000000
CPUID 0000000A: 00000000-00000000-00000000-00000000
CPUID 0000000B: 00000001-00000002-00000100-00000006 [SL 00]
CPUID 0000000B: 00000007-00000008-00000201-00000006 [SL 01]
CPUID 0000000C: 00000000-00000000-00000000-00000000
CPUID 0000000D: 00000207-00000340-00000380-00000000 [SL 00] [x87]
CPUID 0000000D: 0000000F-00000340-00000000-00000000 [SL 01] [SSE]
CPUID 0000000D: 00000100-00000240-00000000-00000000 [SL 02] [AVX]
CPUID 0000000D: 00000040-00000340-00000000-00000000 [SL 09] [PKRU]
CPUID 0000000E: 00000000-00000000-00000000-00000000
CPUID 0000000F: 00000000-000000FF-00000000-00000002 [SL 00]
CPUID 0000000F: 00000000-00000040-000000FF-00000007 [SL 01]
CPUID 00000010: 00000000-00000002-00000000-00000000 [SL 00]
CPUID 00000010: 0000000F-00000000-00000004-0000000F [SL 01]
CPUID 80000000: 80000020-68747541-444D4163-69746E65 [AuthenticAMD]
CPUID 80000001: 008A0F00-10000000-75C237FF-2FD3FBFF
CPUID 80000002: 20444D41-657A7952-2033206E-30323337 [AMD Ryzen 3 7320]
CPUID 80000003: 69772055-52206874-6F656461-7247206E [U with Radeon Gr]
CPUID 80000004: 69687061-20207363-20202020-00202020 [aphics         ]
CPUID 80000005: FF40FF40-FF40FF40-20080140-20080140 [L1D: 32 KB / L1I: 32 KB]
CPUID 80000006: 48006400-68006400-02006140-00209140 [L2: 512 KB] / L3: 4096 KB]
CPUID 80000007: 00000000-0000001B-00000000-00006799
CPUID 80000008: 00003030-010CF657-00007007-00010000
CPUID 80000009: 00000000-00000000-00000000-00000000
CPUID 8000000A: 00000001-00008000-00000000-0013BCFF
CPUID 8000000B: 00000000-00000000-00000000-00000000
CPUID 8000000C: 00000000-00000000-00000000-00000000
CPUID 8000000D: 00000000-00000000-00000000-00000000
CPUID 8000000E: 00000000-00000000-00000000-00000000
CPUID 8000000F: 00000000-00000000-00000000-00000000
CPUID 80000010: 00000000-00000000-00000000-00000000
CPUID 80000011: 00000000-00000000-00000000-00000000
CPUID 80000012: 00000000-00000000-00000000-00000000
CPUID 80000013: 00000000-00000000-00000000-00000000
CPUID 80000014: 00000000-00000000-00000000-00000000
CPUID 80000015: 00000000-00000000-00000000-00000000
CPUID 80000016: 00000000-00000000-00000000-00000000
CPUID 80000017: 00000000-00000000-00000000-00000000
CPUID 80000018: 00000000-00000000-00000000-00000000
CPUID 80000019: F040F040-00000000-00000000-00000000
CPUID 8000001A: 00000006-00000000-00000000-00000000
CPUID 8000001B: 000003FF-00000000-00000000-00000000
CPUID 8000001C: 00000000-00000000-00000000-00000000
CPUID 8000001D: 00004121-01C0003F-0000003F-00000000 [SL 00] [L1D: 32 KB]
CPUID 8000001D: 00004122-01C0003F-0000003F-00000000 [SL 01] [L1I: 32 KB]
CPUID 8000001D: 00004143-01C0003F-000003FF-00000002 [SL 02] [L2U: 512 KB]
CPUID 8000001D: 0001C163-03C0003F-00000FFF-00000001 [SL 03] [L3U: 4 MB]
CPUID 8000001E: 00000006-00000103-00000000-00000000
CPUID 8000001F: 0001000F-0000012F-0000000E-00000001
CPUID 80000020: 00000000-00000002-00000000-00000000 [SL 00]
CPUID 80000020: 0000000B-00000000-00000000-0000000F [SL 01]
CPUID 80000020: 00000000-00000000-00000000-00000000 [SL 02]
CPUID 8FFFFFFF: 00000000-00000000-00000000-00000000

L1    Data Cache:    32 KB,  8-way Associative, 64-byte Line
L1  Instr. Cache:    32 KB,  8-way Associative, 64-byte Line
L2 Unified Cache:   512 KB,  8-way Associative, 64-byte Line
L3 Unified Cache:     4 MB, 16-way Associative, 64-byte Line

------[ CPUID Registers / Logical CPU #7 ]------

allcpu: Package 0 / Core 3 / Thread 1: Valid, Virtual

CPUID 00000000: 00000010-68747541-444D4163-69746E65 [AuthenticAMD]
CPUID 00000001: 008A0F00-07080800-7EF8320B-178BFBFF
CPUID 00000002: 00000000-00000000-00000000-00000000
CPUID 00000003: 00000000-00000000-00000000-00000000
CPUID 00000005: 00000040-00000040-00000003-00000011
CPUID 00000006: 00000004-00000000-00000001-00000000
CPUID 00000007: 00000000-219C91A9-00400004-00000000 [SL 00]
CPUID 00000008: 00000000-00000000-00000000-00000000
CPUID 00000009: 00000000-00000000-00000000-00000000
CPUID 0000000A: 00000000-00000000-00000000-00000000
CPUID 0000000B: 00000001-00000002-00000100-00000007 [SL 00]
CPUID 0000000B: 00000007-00000008-00000201-00000007 [SL 01]
CPUID 0000000C: 00000000-00000000-00000000-00000000
CPUID 0000000D: 00000207-00000340-00000380-00000000 [SL 00] [x87]
CPUID 0000000D: 0000000F-00000340-00000000-00000000 [SL 01] [SSE]
CPUID 0000000D: 00000100-00000240-00000000-00000000 [SL 02] [AVX]
CPUID 0000000D: 00000040-00000340-00000000-00000000 [SL 09] [PKRU]
CPUID 0000000E: 00000000-00000000-00000000-00000000
CPUID 0000000F: 00000000-000000FF-00000000-00000002 [SL 00]
CPUID 0000000F: 00000000-00000040-000000FF-00000007 [SL 01]
CPUID 00000010: 00000000-00000002-00000000-00000000 [SL 00]
CPUID 00000010: 0000000F-00000000-00000004-0000000F [SL 01]
CPUID 80000000: 80000020-68747541-444D4163-69746E65 [AuthenticAMD]
CPUID 80000001: 008A0F00-10000000-75C237FF-2FD3FBFF
CPUID 80000002: 20444D41-657A7952-2033206E-30323337 [AMD Ryzen 3 7320]
CPUID 80000003: 69772055-52206874-6F656461-7247206E [U with Radeon Gr]
CPUID 80000004: 69687061-20207363-20202020-00202020 [aphics         ]
CPUID 80000005: FF40FF40-FF40FF40-20080140-20080140 [L1D: 32 KB / L1I: 32 KB]
CPUID 80000006: 48006400-68006400-02006140-00209140 [L2: 512 KB] / L3: 4096 KB]
CPUID 80000007: 00000000-0000001B-00000000-00006799
CPUID 80000008: 00003030-010CF657-00007007-00010000
CPUID 80000009: 00000000-00000000-00000000-00000000
CPUID 8000000A: 00000001-00008000-00000000-0013BCFF
CPUID 8000000B: 00000000-00000000-00000000-00000000
CPUID 8000000C: 00000000-00000000-00000000-00000000
CPUID 8000000D: 00000000-00000000-00000000-00000000
CPUID 8000000E: 00000000-00000000-00000000-00000000
CPUID 8000000F: 00000000-00000000-00000000-00000000
CPUID 80000010: 00000000-00000000-00000000-00000000
CPUID 80000011: 00000000-00000000-00000000-00000000
CPUID 80000012: 00000000-00000000-00000000-00000000
CPUID 80000013: 00000000-00000000-00000000-00000000
CPUID 80000014: 00000000-00000000-00000000-00000000
CPUID 80000015: 00000000-00000000-00000000-00000000
CPUID 80000016: 00000000-00000000-00000000-00000000
CPUID 80000017: 00000000-00000000-00000000-00000000
CPUID 80000018: 00000000-00000000-00000000-00000000
CPUID 80000019: F040F040-00000000-00000000-00000000
CPUID 8000001A: 00000006-00000000-00000000-00000000
CPUID 8000001B: 000003FF-00000000-00000000-00000000
CPUID 8000001C: 00000000-00000000-00000000-00000000
CPUID 8000001D: 00004121-01C0003F-0000003F-00000000 [SL 00] [L1D: 32 KB]
CPUID 8000001D: 00004122-01C0003F-0000003F-00000000 [SL 01] [L1I: 32 KB]
CPUID 8000001D: 00004143-01C0003F-000003FF-00000002 [SL 02] [L2U: 512 KB]
CPUID 8000001D: 0001C163-03C0003F-00000FFF-00000001 [SL 03] [L3U: 4 MB]
CPUID 8000001E: 00000007-00000103-00000000-00000000
CPUID 8000001F: 0001000F-0000012F-0000000E-00000001
CPUID 80000020: 00000000-00000002-00000000-00000000 [SL 00]
CPUID 80000020: 0000000B-00000000-00000000-0000000F [SL 01]
CPUID 80000020: 00000000-00000000-00000000-00000000 [SL 02]
CPUID 8FFFFFFF: 00000000-00000000-00000000-00000000

L1    Data Cache:    32 KB,  8-way Associative, 64-byte Line
L1  Instr. Cache:    32 KB,  8-way Associative, 64-byte Line
L2 Unified Cache:   512 KB,  8-way Associative, 64-byte Line
L3 Unified Cache:     4 MB, 16-way Associative, 64-byte Line

------[ All CPUs ]------

CPU   0: APICID    0 / Package 0 / Core   0 / Thread 0: Valid
CPU   1: APICID    1 / Package 0 / Core   0 / Thread 1: Valid, Virtual
CPU   2: APICID    2 / Package 0 / Core   1 / Thread 0: Valid
CPU   3: APICID    3 / Package 0 / Core   1 / Thread 1: Valid, Virtual
CPU   4: APICID    4 / Package 0 / Core   2 / Thread 0: Valid
CPU   5: APICID    5 / Package 0 / Core   2 / Thread 1: Valid, Virtual
CPU   6: APICID    6 / Package 0 / Core   3 / Thread 0: Valid
CPU   7: APICID    7 / Package 0 / Core   3 / Thread 1: Valid, Virtual

------[ MSR Registers / Logical CPU #0 ]------

CPU Clock (Normal): 1921 MHz
CPU Clock (TSC): 2395 MHz
CPU Multiplier: 19.2x
CPB PStates: 0
MSR 0000001B: 0000-0000-FEE0-0900
MSR 0000008B: 0000-0000-08A0-0006
MSR 000000E7: 0000-009D-CEA0-E6C0 [S200]
MSR 000000E7: 0000-009D-D1BE-68C0 [S200]
MSR 000000E7: 0000-009D-D258-2E00
MSR 000000E8: 0000-00EF-C30B-9151 [S200]
MSR 000000E8: 0000-00EF-C3A7-A6B9 [S200]
MSR 000000E8: 0000-00EF-C3E5-5F64
MSR C0010004: 0000-0000-0000-0000
MSR C0010005: 0000-0000-0000-0000
MSR C0010006: 0000-0000-0000-0000
MSR C0010007: 0000-0000-0000-0000
MSR C0010015: 0000-0001-4900-0010
MSR C001001F: 0000-0000-0000-0000
MSR C0010055: 0000-0000-0000-0000
MSR C0010058: 0000-0000-E000-0021
MSR C0010061: 0000-0000-0000-0020
MSR C0010062: 0000-0000-0000-0000
MSR C0010063: 0000-0000-0000-0001
MSR C0010064: 8000-0000-462F-C860 [24.00x] [0.3563 V] [ 2.40 A] [PState P0]
MSR C0010065: 8000-0000-42EA-D058 [11.00x] [0.4813 V] [ 1.10 A] [PState P1]
MSR C0010066: 8000-0000-4265-D251 [ 9.00x] [0.6062 V] [ 0.90 A] [PState P2]
MSR C0010067: 0000-0000-0000-0000
MSR C0010068: 0000-0000-0000-0000
MSR C0010069: 0000-0000-0000-0000
MSR C001006A: 0000-0000-0000-0000
MSR C001006B: 0000-0000-0000-0000
MSR C0010070: < FAILED >
MSR C0010293: 0000-0000-03D0-9294 [18.33x] [1.1375V]
MSR C0010293: 0000-0000-03D0-9294 [18.33x] [1.1375V]
MSR C0010293: 0000-0000-03D0-9294 [18.33x] [1.1375V]
MSR C0010293: 0000-0000-01CE-4294 [41.25x] [1.1938V]
MSR C0010293: 0000-0000-03D0-9294 [18.33x] [1.1375V]
MSR C0010140: 0000-0000-0000-0000
MSR C0010141: 0000-0000-0000-0000
MSR C0010290: < FAILED >
MSR C0010292: 0000-0001-0400-4992
MSR C0010293: 0000-0000-03D0-9294
MSR C0010294: 0F82-C581-0000-4912
MSR C0010296: 0000-0000-0048-4848
MSR C0010299: 0000-0000-000A-1003
MSR C001029A: 0000-0000-044A-1957 [S200]
MSR C001029A: 0000-0000-044A-1BF4 [S200]
MSR C001029A: 0000-0000-044A-1D1E
MSR C001029B: 0000-0000-1FF1-C97E [S200]
MSR C001029B: 0000-0000-1FF3-BFB2 [S200]
MSR C001029B: 0000-0000-1FF5-4D1F
MSR C0011023: 0002-0000-0000-0020

------[ MSR Registers / Logical CPU #1 ]------

CPU Clock (Normal): 1921 MHz
CPU Clock (TSC): 2395 MHz
CPU Multiplier: 19.2x
CPB PStates: 0
MSR 0000001B: 0000-0000-FEE0-0900
MSR 0000008B: 0000-0000-08A0-0006
MSR 000000E7: 0000-009D-E382-AB98
MSR 000000E8: 0000-00EF-DBF4-C3EA
MSR C0010004: 0000-0000-0000-0000
MSR C0010005: 0000-0000-0000-0000
MSR C0010006: 0000-0000-0000-0000
MSR C0010007: 0000-0000-0000-0000
MSR C0010015: 0000-0001-4900-0010
MSR C001001F: 0000-0000-0000-0000
MSR C0010055: 0000-0000-0000-0000
MSR C0010058: 0000-0000-E000-0021
MSR C0010061: 0000-0000-0000-0020
MSR C0010062: 0000-0000-0000-0000
MSR C0010063: 0000-0000-0000-0000
MSR C0010064: 8000-0000-462F-C860 [24.00x] [0.3563 V] [ 2.40 A] [PState P0]
MSR C0010065: 8000-0000-42EA-D058 [11.00x] [0.4813 V] [ 1.10 A] [PState P1]
MSR C0010066: 8000-0000-4265-D251 [ 9.00x] [0.6062 V] [ 0.90 A] [PState P2]
MSR C0010067: 0000-0000-0000-0000
MSR C0010068: 0000-0000-0000-0000
MSR C0010069: 0000-0000-0000-0000
MSR C001006A: 0000-0000-0000-0000
MSR C001006B: 0000-0000-0000-0000
MSR C0010070: < FAILED >
MSR C0010293: 0000-0000-01D4-4298 [41.50x] [1.0437V]
MSR C0010293: 0000-0000-00A2-5180 [19.20x] [0.6937V]
MSR C0010293: 0000-0000-02A2-5180 [19.20x] [0.6937V]
MSR C0010293: 0000-0000-02A2-5180 [19.20x] [0.6937V]
MSR C0010293: 0000-0000-02A2-5180 [19.20x] [0.6937V]
MSR C0010140: 0000-0000-0000-0000
MSR C0010141: 0000-0000-0000-0000
MSR C0010290: < FAILED >
MSR C0010292: 0000-0001-0400-4992
MSR C0010293: 0000-0000-02A2-5180
MSR C0010294: 0F82-C581-0000-4912
MSR C0010296: 0000-0000-0048-4848
MSR C0010299: 0000-0000-000A-1003
MSR C001029A: 0000-0000-044A-7A12
MSR C001029B: 0000-0000-1FF6-4442
MSR C0011023: 0002-0000-0000-0020

------[ MSR Registers / Logical CPU #2 ]------

CPU Clock (Normal): 1921 MHz
CPU Clock (TSC): 2395 MHz
CPU Multiplier: 19.2x
CPB PStates: 0
MSR 0000001B: 0000-0000-FEE0-0900
MSR 0000008B: 0000-0000-08A0-0006
MSR 000000E7: 0000-009D-E87B-EFF8
MSR 000000E8: 0000-00EF-E31C-FAE2
MSR C0010004: 0000-0000-0000-0000
MSR C0010005: 0000-0000-0000-0000
MSR C0010006: 0000-0000-0000-0000
MSR C0010007: 0000-0000-0000-0000
MSR C0010015: 0000-0001-4900-0010
MSR C001001F: 0000-0000-0000-0000
MSR C0010055: 0000-0000-0000-0000
MSR C0010058: 0000-0000-E000-0021
MSR C0010061: 0000-0000-0000-0020
MSR C0010062: 0000-0000-0000-0000
MSR C0010063: 0000-0000-0000-0000
MSR C0010064: 8000-0000-462F-C860 [24.00x] [0.3563 V] [ 2.40 A] [PState P0]
MSR C0010065: 8000-0000-42EA-D058 [11.00x] [0.4813 V] [ 1.10 A] [PState P1]
MSR C0010066: 8000-0000-4265-D251 [ 9.00x] [0.6062 V] [ 0.90 A] [PState P2]
MSR C0010067: 0000-0000-0000-0000
MSR C0010068: 0000-0000-0000-0000
MSR C0010069: 0000-0000-0000-0000
MSR C001006A: 0000-0000-0000-0000
MSR C001006B: 0000-0000-0000-0000
MSR C0010070: < FAILED >
MSR C0010293: 0000-0000-01D4-4298 [41.50x] [1.0437V]
MSR C0010293: 0000-0000-0236-5180 [19.20x] [0.1938V]
MSR C0010293: 0000-0000-02A2-5180 [19.20x] [0.6937V]
MSR C0010293: 0000-0000-02A2-5180 [19.20x] [0.6937V]
MSR C0010293: 0000-0000-02A2-5180 [19.20x] [0.6937V]
MSR C0010140: 0000-0000-0000-0000
MSR C0010141: 0000-0000-0000-0000
MSR C0010290: < FAILED >
MSR C0010292: 0000-0001-0400-4992
MSR C0010293: 0000-0000-02A2-5180
MSR C0010294: 0F82-C581-0000-4912
MSR C0010296: 0000-0000-0048-4848
MSR C0010299: 0000-0000-000A-1003
MSR C001029A: 0000-0000-044A-9A39
MSR C001029B: 0000-0000-1FF7-451A
MSR C0011023: 0002-0000-0000-0020

------[ MSR Registers / Logical CPU #3 ]------

CPU Clock (Normal): 1921 MHz
CPU Clock (TSC): 2395 MHz
CPU Multiplier: 19.2x
CPB PStates: 0
MSR 0000001B: 0000-0000-FEE0-0900
MSR 0000008B: 0000-0000-08A0-0006
MSR 000000E7: 0000-009D-EEFB-E030
MSR 000000E8: 0000-00EF-EB47-6F07
MSR C0010004: 0000-0000-0000-0000
MSR C0010005: 0000-0000-0000-0000
MSR C0010006: 0000-0000-0000-0000
MSR C0010007: 0000-0000-0000-0000
MSR C0010015: 0000-0001-4900-0010
MSR C001001F: 0000-0000-0000-0000
MSR C0010055: 0000-0000-0000-0000
MSR C0010058: 0000-0000-E000-0021
MSR C0010061: 0000-0000-0000-0020
MSR C0010062: 0000-0000-0000-0000
MSR C0010063: 0000-0000-0000-0000
MSR C0010064: 8000-0000-462F-C860 [24.00x] [0.3563 V] [ 2.40 A] [PState P0]
MSR C0010065: 8000-0000-42EA-D058 [11.00x] [0.4813 V] [ 1.10 A] [PState P1]
MSR C0010066: 8000-0000-4265-D251 [ 9.00x] [0.6062 V] [ 0.90 A] [PState P2]
MSR C0010067: 0000-0000-0000-0000
MSR C0010068: 0000-0000-0000-0000
MSR C0010069: 0000-0000-0000-0000
MSR C001006A: 0000-0000-0000-0000
MSR C001006B: 0000-0000-0000-0000
MSR C0010070: < FAILED >
MSR C0010293: 0000-0000-0158-4228 [34.50x] [0.9437V]
MSR C0010293: 0000-0000-02A2-5180 [19.20x] [0.6937V]
MSR C0010293: 0000-0000-02A2-5180 [19.20x] [0.6937V]
MSR C0010293: 0000-0000-02A2-5180 [19.20x] [0.6937V]
MSR C0010293: 0000-0000-02A2-5180 [19.20x] [0.6937V]
MSR C0010140: 0000-0000-0000-0000
MSR C0010141: 0000-0000-0000-0000
MSR C0010290: < FAILED >
MSR C0010292: 0000-0001-0400-4992
MSR C0010293: 0000-0000-02A2-5180
MSR C0010294: 0F82-C581-0000-4912
MSR C0010296: 0000-0000-0048-4848
MSR C0010299: 0000-0000-000A-1003
MSR C001029A: 0000-0000-044A-AA7B
MSR C001029B: 0000-0000-1FF8-1E2E
MSR C0011023: 0002-0000-0000-0020

------[ MSR Registers / Logical CPU #4 ]------

CPU Clock (Normal): 1921 MHz
CPU Clock (TSC): 2396 MHz
CPU Multiplier: 19.2x
CPB PStates: 0
MSR 0000001B: 0000-0000-FEE0-0900
MSR 0000008B: 0000-0000-08A0-0006
MSR 000000E7: 0000-009D-F38B-E1A0
MSR 000000E8: 0000-00EF-F0F0-5C07
MSR C0010004: 0000-0000-0000-0000
MSR C0010005: 0000-0000-0000-0000
MSR C0010006: 0000-0000-0000-0000
MSR C0010007: 0000-0000-0000-0000
MSR C0010015: 0000-0001-4900-0010
MSR C001001F: 0000-0000-0000-0000
MSR C0010055: 0000-0000-0000-0000
MSR C0010058: 0000-0000-E000-0021
MSR C0010061: 0000-0000-0000-0020
MSR C0010062: 0000-0000-0000-0000
MSR C0010063: 0000-0000-0000-0000
MSR C0010064: 8000-0000-462F-C860 [24.00x] [0.3563 V] [ 2.40 A] [PState P0]
MSR C0010065: 8000-0000-42EA-D058 [11.00x] [0.4813 V] [ 1.10 A] [PState P1]
MSR C0010066: 8000-0000-4265-D251 [ 9.00x] [0.6062 V] [ 0.90 A] [PState P2]
MSR C0010067: 0000-0000-0000-0000
MSR C0010068: 0000-0000-0000-0000
MSR C0010069: 0000-0000-0000-0000
MSR C001006A: 0000-0000-0000-0000
MSR C001006B: 0000-0000-0000-0000
MSR C0010070: < FAILED >
MSR C0010293: 0000-0000-0156-4228 [34.50x] [0.9938V]
MSR C0010293: 0000-0000-02A2-5180 [19.20x] [0.6937V]
MSR C0010293: 0000-0000-02A2-5180 [19.20x] [0.6937V]
MSR C0010293: 0000-0000-02A2-5180 [19.20x] [0.6937V]
MSR C0010293: 0000-0000-02A2-5180 [19.20x] [0.6937V]
MSR C0010140: 0000-0000-0000-0000
MSR C0010141: 0000-0000-0000-0000
MSR C0010290: < FAILED >
MSR C0010292: 0000-0001-0400-4992
MSR C0010293: 0000-0000-02A2-5180
MSR C0010294: 0F82-C581-0000-4912
MSR C0010296: 0000-0000-0048-4848
MSR C0010299: 0000-0000-000A-1003
MSR C001029A: 0000-0000-044A-B722
MSR C001029B: 0000-0000-1FF8-F681
MSR C0011023: 0002-0000-0000-0020

------[ MSR Registers / Logical CPU #5 ]------

CPU Clock (Normal): 1921 MHz
CPU Clock (TSC): 2395 MHz
CPU Multiplier: 19.2x
CPB PStates: 0
MSR 0000001B: 0000-0000-FEE0-0900
MSR 0000008B: 0000-0000-08A0-0006
MSR 000000E7: 0000-009D-F90C-33F8
MSR 000000E8: 0000-00EF-F7C2-EAF8
MSR C0010004: 0000-0000-0000-0000
MSR C0010005: 0000-0000-0000-0000
MSR C0010006: 0000-0000-0000-0000
MSR C0010007: 0000-0000-0000-0000
MSR C0010015: 0000-0001-4900-0010
MSR C001001F: 0000-0000-0000-0000
MSR C0010055: 0000-0000-0000-0000
MSR C0010058: 0000-0000-E000-0021
MSR C0010061: 0000-0000-0000-0020
MSR C0010062: 0000-0000-0000-0000
MSR C0010063: 0000-0000-0000-0000
MSR C0010064: 8000-0000-462F-C860 [24.00x] [0.3563 V] [ 2.40 A] [PState P0]
MSR C0010065: 8000-0000-42EA-D058 [11.00x] [0.4813 V] [ 1.10 A] [PState P1]
MSR C0010066: 8000-0000-4265-D251 [ 9.00x] [0.6062 V] [ 0.90 A] [PState P2]
MSR C0010067: 0000-0000-0000-0000
MSR C0010068: 0000-0000-0000-0000
MSR C0010069: 0000-0000-0000-0000
MSR C001006A: 0000-0000-0000-0000
MSR C001006B: 0000-0000-0000-0000
MSR C0010070: < FAILED >
MSR C0010293: 0000-0000-0156-4228 [34.50x] [0.9938V]
MSR C0010293: 0000-0000-02CE-5180 [19.20x] [1.1938V]
MSR C0010293: 0000-0000-02A2-5180 [19.20x] [0.6937V]
MSR C0010293: 0000-0000-02A2-5180 [19.20x] [0.6937V]
MSR C0010293: 0000-0000-00A2-5180 [19.20x] [0.6937V]
MSR C0010140: 0000-0000-0000-0000
MSR C0010141: 0000-0000-0000-0000
MSR C0010290: < FAILED >
MSR C0010292: 0000-0001-0400-4992
MSR C0010293: 0000-0000-00A2-5180
MSR C0010294: 0F82-C581-0000-4912
MSR C0010296: 0000-0000-0048-4848
MSR C0010299: 0000-0000-000A-1003
MSR C001029A: 0000-0000-044A-C6B6
MSR C001029B: 0000-0000-1FF9-CE33
MSR C0011023: 0002-0000-0000-0020

------[ MSR Registers / Logical CPU #6 ]------

CPU Clock (Normal): 1921 MHz
CPU Clock (TSC): 2396 MHz
CPU Multiplier: 19.2x
CPB PStates: 0
MSR 0000001B: 0000-0000-FEE0-0900
MSR 0000008B: 0000-0000-08A0-0006
MSR 000000E7: 0000-009D-FE26-EC38
MSR 000000E8: 0000-00EF-FE01-98D2
MSR C0010004: 0000-0000-0000-0000
MSR C0010005: 0000-0000-0000-0000
MSR C0010006: 0000-0000-0000-0000
MSR C0010007: 0000-0000-0000-0000
MSR C0010015: 0000-0001-4900-0010
MSR C001001F: 0000-0000-0000-0000
MSR C0010055: 0000-0000-0000-0000
MSR C0010058: 0000-0000-E000-0021
MSR C0010061: 0000-0000-0000-0020
MSR C0010062: 0000-0000-0000-0000
MSR C0010063: 0000-0000-0000-0000
MSR C0010064: 8000-0000-462F-C860 [24.00x] [0.3563 V] [ 2.40 A] [PState P0]
MSR C0010065: 8000-0000-42EA-D058 [11.00x] [0.4813 V] [ 1.10 A] [PState P1]
MSR C0010066: 8000-0000-4265-D251 [ 9.00x] [0.6062 V] [ 0.90 A] [PState P2]
MSR C0010067: 0000-0000-0000-0000
MSR C0010068: 0000-0000-0000-0000
MSR C0010069: 0000-0000-0000-0000
MSR C001006A: 0000-0000-0000-0000
MSR C001006B: 0000-0000-0000-0000
MSR C0010070: < FAILED >
MSR C0010293: 0000-0000-0156-4228 [34.50x] [0.9938V]
MSR C0010293: 0000-0000-00A2-5180 [19.20x] [0.6937V]
MSR C0010293: 0000-0000-02A2-5180 [19.20x] [0.6937V]
MSR C0010293: 0000-0000-02A2-5180 [19.20x] [0.6937V]
MSR C0010293: 0000-0000-02A2-5180 [19.20x] [0.6937V]
MSR C0010140: 0000-0000-0000-0000
MSR C0010141: 0000-0000-0000-0000
MSR C0010290: < FAILED >
MSR C0010292: 0000-0001-0400-4992
MSR C0010293: 0000-0000-02A2-5180
MSR C0010294: 0F82-C581-0000-4912
MSR C0010296: 0000-0000-0048-4848
MSR C0010299: 0000-0000-000A-1003
MSR C001029A: 0000-0000-044A-D5E2
MSR C001029B: 0000-0000-1FFA-9F61
MSR C0011023: 0002-0000-0000-0020

------[ MSR Registers / Logical CPU #7 ]------

CPU Clock (Normal): 3451 MHz
CPU Clock (TSC): 2396 MHz
CPU Multiplier: 34.5x
CPB PStates: 0
MSR 0000001B: 0000-0000-FEE0-0900
MSR 0000008B: 0000-0000-08A0-0006
MSR 000000E7: 0000-009E-03AE-D900
MSR 000000E8: 0000-00F0-0520-0D15
MSR C0010004: 0000-0000-0000-0000
MSR C0010005: 0000-0000-0000-0000
MSR C0010006: 0000-0000-0000-0000
MSR C0010007: 0000-0000-0000-0000
MSR C0010015: 0000-0001-4900-0010
MSR C001001F: 0000-0000-0000-0000
MSR C0010055: 0000-0000-0000-0000
MSR C0010058: 0000-0000-E000-0021
MSR C0010061: 0000-0000-0000-0020
MSR C0010062: 0000-0000-0000-0000
MSR C0010063: 0000-0000-0000-0000
MSR C0010064: 8000-0000-462F-C860 [24.00x] [0.3563 V] [ 2.40 A] [PState P0]
MSR C0010065: 8000-0000-42EA-D058 [11.00x] [0.4813 V] [ 1.10 A] [PState P1]
MSR C0010066: 8000-0000-4265-D251 [ 9.00x] [0.6062 V] [ 0.90 A] [PState P2]
MSR C0010067: 0000-0000-0000-0000
MSR C0010068: 0000-0000-0000-0000
MSR C0010069: 0000-0000-0000-0000
MSR C001006A: 0000-0000-0000-0000
MSR C001006B: 0000-0000-0000-0000
MSR C0010070: < FAILED >
MSR C0010293: 0000-0000-0156-4228 [34.50x] [0.9938V]
MSR C0010293: 0000-0000-02A2-5180 [19.20x] [0.6937V]
MSR C0010293: 0000-0000-00A2-5180 [19.20x] [0.6937V]
MSR C0010293: 0000-0000-02A2-5180 [19.20x] [0.6937V]
MSR C0010293: 0000-0000-00A2-5180 [19.20x] [0.6937V]
MSR C0010140: 0000-0000-0000-0000
MSR C0010141: 0000-0000-0000-0000
MSR C0010290: < FAILED >
MSR C0010292: 0000-0001-0400-4992
MSR C0010293: 0000-0000-00A2-5180
MSR C0010294: 0F82-C581-0000-4912
MSR C0010296: 0000-0000-0048-4848
MSR C0010299: 0000-0000-000A-1003
MSR C001029A: 0000-0000-044A-E42D
MSR C001029B: 0000-0000-1FFB-74AF
MSR C0011023: 0002-0000-0000-0020
