------[ Versions ]------

Program Version : EVEREST v4.60.1629 Beta
BenchDLL Version: 2.4.257.0

------[ CPU Info ]------

CPU Type           : AMD K6-III, 400 MHz (4 x 100)
CPU Alias          : Sharptooth, K6+ 3D, 6k86+ 3D
CPU Platform       : Socket 7
CPU Stepping       : B
Instruction Set    : x86, MMX, 3DNow!
CPUID Manufacturer : AuthenticAMD
CPUID CPU Name     : AMD-K6(tm) 3D+ Processor
CPUID Revision     : 00000591h
Platform ID        : CBh  (Socket 7)

------[ Logical CPU #0 ]------

allcpu: Valid

CPUID 00000000: 00000001-68747541-444D4163-69746E65
CPUID 00000001: 00000591-00000000-00000000-008021BF
CPUID 80000000: 80000006-00000000-00000000-00000000
CPUID 80000001: 00000691-00000000-00000000-808029BF
CPUID 80000002: 2D444D41-7428364B-3320296D-50202B44
CPUID 80000003: 65636F72-726F7373-00000000-00000000
CPUID 80000004: 00000000-00000000-00000000-00000000
CPUID 80000005: 00000000-02800140-20020220-20020220
CPUID 80000006: 00000000-00000000-01004220-00000000
CPUID 8FFFFFFF: 4778654E-72656E65-6F697461-444D416E

------[ MSR Registers ]------

MSR C0000087: 0000-0000-0000-0012

PerformanceFrequency = 1193182

Tjmax Temperature = 0 Celsius
