------[ Versions ]------

Program Version : EVEREST v4.60.1628 Beta
BenchDLL Version: 2.4.257.0

------[ CPU Info ]------

CPU Type           : AMD Sempron, 1600 MHz (8 x 200) 2600+
CPU Alias          : Palermo (Venice-128)
CPU Platform       : Socket 754
CPU Stepping       : DH-E6
Instruction Set    : x86, x86-64, MMX, 3DNow!, SSE, SSE2, SSE3
CPUID Manufacturer : AuthenticAMD
CPUID CPU Name     : AMD Sempron(tm) Processor 2600+
CPUID Revision     : 00020FC2h
AMD Old Brand ID   : 0982h  (Sempron 2600+)
Platform ID        : D2h  (Socket 754)

------[ Logical CPU #0 ]------

allcpu: Valid

CPUID 00000000: 00000001-68747541-444D4163-69746E65
CPUID 00000001: 00020FC2-00000800-00000001-078BFBFF
CPUID 80000000: 80000018-68747541-444D4163-69746E65
CPUID 80000001: 00020FC2-00000982-00000001-E3D3FBFF
CPUID 80000002: 20444D41-706D6553-286E6F72-20296D74
CPUID 80000003: 636F7250-6F737365-36322072-002B3030
CPUID 80000004: 00000000-00000000-00000000-00000000
CPUID 80000005: FF08FF08-FF20FF20-40020140-40020140
CPUID 80000006: 00000000-42004200-00808140-00000000
CPUID 80000007: 00000000-00000000-00000000-00000039
CPUID 80000008: 00003028-00000000-00000000-00000000
CPUID 80000009: 00000000-00000000-00000000-00000000
CPUID 8000000A: 00000000-00000000-00000000-00000000
CPUID 8000000B: 00000000-00000000-00000000-00000000
CPUID 8000000C: 00000000-00000000-00000000-00000000
CPUID 8000000D: 00000000-00000000-00000000-00000000
CPUID 8000000E: 00000000-00000000-00000000-00000000
CPUID 8000000F: 00000000-00000000-00000000-00000000
CPUID 80000010: 00000000-00000000-00000000-00000000
CPUID 80000011: 00000000-00000000-00000000-00000000
CPUID 80000012: 00000000-00000000-00000000-00000000
CPUID 80000013: 00000000-00000000-00000000-00000000
CPUID 80000014: 00000000-00000000-00000000-00000000
CPUID 80000015: 00000000-00000000-00000000-00000000
CPUID 80000016: 00000000-00000000-00000000-00000000
CPUID 80000017: 00000000-00000000-00000000-00000000
CPUID 80000018: 00000000-00000000-00000000-00000000
CPUID 8FFFFFFF: 53275449-4D414820-2052454D-454D4954

------[ MSR Registers ]------

MSR 0000001B: 0000-0000-FEE0-0900
MSR C0010015: 0000-0000-0800-0000

PerformanceFrequency = 3579545

Tjmax Temperature = 0 Celsius
