------[ Versions ]------

Program Version : EVEREST v5.50.2239 Beta
BenchDLL Version: 2.5.292.0

------[ CPU Info ]------

CPU Type           : HexaCore AMD Phenom II X6 1055T, 2800 MHz (14 x 200)
CPU Alias          : Thuban
CPU Platform       : Socket AM3
CPU Stepping       : PH-E0
Instruction Set    : x86, x86-64, MMX, 3DNow!, SSE, SSE2, SSE3, SSE4A
CPUID Manufacturer : AuthenticAMD
CPUID CPU Name     : AMD Phenom(tm) II X6 1055T Processor
CPUID Revision     : 00100FA0h
AMD K10 Brand ID   : 0050h  (Phenom II X6 1055T)
Platform ID        : D7h  (Socket AM3)

------[ Logical CPU #0 ]------

allcpu: Package 0 / Core 0 / Thread 0: Valid

CPUID 00000000: 00000006-68747541-444D4163-69746E65
CPUID 00000001: 00100FA0-00060800-00802009-178BFBFF
CPUID 00000002: 00000000-00000000-00000000-00000000
CPUID 00000003: 00000000-00000000-00000000-00000000
CPUID 00000005: 00000040-00000040-00000003-00000000
CPUID 00000006: 00000000-00000000-00000001-00000000
CPUID 80000000: 8000001B-68747541-444D4163-69746E65
CPUID 80000001: 00100FA0-10000050-000037FF-EFD3FBFF
CPUID 80000002: 20444D41-6E656850-74286D6F-4920296D
CPUID 80000003: 36582049-35303120-50205435-65636F72
CPUID 80000004: 726F7373-00000000-00000000-00000000
CPUID 80000005: FF30FF10-FF30FF20-40020140-40020140
CPUID 80000006: 20800000-42004200-02008140-0030B140
CPUID 80000007: 00000000-00000000-00000000-000003F9
CPUID 80000008: 00003030-00000000-00003005-00000000
CPUID 80000009: 00000000-00000000-00000000-00000000
CPUID 8000000A: 00000001-00000040-00000000-0000040F
CPUID 8000000B: 00000000-00000000-00000000-00000000
CPUID 8000000C: 00000000-00000000-00000000-00000000
CPUID 8000000D: 00000000-00000000-00000000-00000000
CPUID 8000000E: 00000000-00000000-00000000-00000000
CPUID 8000000F: 00000000-00000000-00000000-00000000
CPUID 80000010: 00000000-00000000-00000000-00000000
CPUID 80000011: 00000000-00000000-00000000-00000000
CPUID 80000012: 00000000-00000000-00000000-00000000
CPUID 80000013: 00000000-00000000-00000000-00000000
CPUID 80000014: 00000000-00000000-00000000-00000000
CPUID 80000015: 00000000-00000000-00000000-00000000
CPUID 80000016: 00000000-00000000-00000000-00000000
CPUID 80000017: 00000000-00000000-00000000-00000000
CPUID 80000018: 00000000-00000000-00000000-00000000
CPUID 80000019: F0300000-60100000-00000000-00000000
CPUID 8000001A: 00000003-00000000-00000000-00000000
CPUID 8000001B: 0000001F-00000000-00000000-00000000
CPUID 8FFFFFFF: 00000000-00000000-00000000-00000000

------[ Logical CPU #1 ]------

allcpu: Package 0 / Core 1 / Thread 0: Valid

CPUID 00000000: 00000006-68747541-444D4163-69746E65
CPUID 00000001: 00100FA0-01060800-00802009-178BFBFF
CPUID 00000002: 00000000-00000000-00000000-00000000
CPUID 00000003: 00000000-00000000-00000000-00000000
CPUID 00000005: 00000040-00000040-00000003-00000000
CPUID 00000006: 00000000-00000000-00000001-00000000
CPUID 80000000: 8000001B-68747541-444D4163-69746E65
CPUID 80000001: 00100FA0-10000050-000037FF-EFD3FBFF
CPUID 80000002: 20444D41-6E656850-74286D6F-4920296D
CPUID 80000003: 36582049-35303120-50205435-65636F72
CPUID 80000004: 726F7373-00000000-00000000-00000000
CPUID 80000005: FF30FF10-FF30FF20-40020140-40020140
CPUID 80000006: 20800000-42004200-02008140-0030B140
CPUID 80000007: 00000000-00000000-00000000-000003F9
CPUID 80000008: 00003030-00000000-00003005-00000000
CPUID 80000009: 00000000-00000000-00000000-00000000
CPUID 8000000A: 00000001-00000040-00000000-0000040F
CPUID 8000000B: 00000000-00000000-00000000-00000000
CPUID 8000000C: 00000000-00000000-00000000-00000000
CPUID 8000000D: 00000000-00000000-00000000-00000000
CPUID 8000000E: 00000000-00000000-00000000-00000000
CPUID 8000000F: 00000000-00000000-00000000-00000000
CPUID 80000010: 00000000-00000000-00000000-00000000
CPUID 80000011: 00000000-00000000-00000000-00000000
CPUID 80000012: 00000000-00000000-00000000-00000000
CPUID 80000013: 00000000-00000000-00000000-00000000
CPUID 80000014: 00000000-00000000-00000000-00000000
CPUID 80000015: 00000000-00000000-00000000-00000000
CPUID 80000016: 00000000-00000000-00000000-00000000
CPUID 80000017: 00000000-00000000-00000000-00000000
CPUID 80000018: 00000000-00000000-00000000-00000000
CPUID 80000019: F0300000-60100000-00000000-00000000
CPUID 8000001A: 00000003-00000000-00000000-00000000
CPUID 8000001B: 0000001F-00000000-00000000-00000000
CPUID 8FFFFFFF: 00000000-00000000-00000000-00000000

------[ Logical CPU #2 ]------

allcpu: Package 0 / Core 2 / Thread 0: Valid

CPUID 00000000: 00000006-68747541-444D4163-69746E65
CPUID 00000001: 00100FA0-03060800-00802009-178BFBFF
CPUID 00000002: 00000000-00000000-00000000-00000000
CPUID 00000003: 00000000-00000000-00000000-00000000
CPUID 00000005: 00000040-00000040-00000003-00000000
CPUID 00000006: 00000000-00000000-00000001-00000000
CPUID 80000000: 8000001B-68747541-444D4163-69746E65
CPUID 80000001: 00100FA0-10000050-000037FF-EFD3FBFF
CPUID 80000002: 20444D41-6E656850-74286D6F-4920296D
CPUID 80000003: 36582049-35303120-50205435-65636F72
CPUID 80000004: 726F7373-00000000-00000000-00000000
CPUID 80000005: FF30FF10-FF30FF20-40020140-40020140
CPUID 80000006: 20800000-42004200-02008140-0030B140
CPUID 80000007: 00000000-00000000-00000000-000003F9
CPUID 80000008: 00003030-00000000-00003005-00000000
CPUID 80000009: 00000000-00000000-00000000-00000000
CPUID 8000000A: 00000001-00000040-00000000-0000040F
CPUID 8000000B: 00000000-00000000-00000000-00000000
CPUID 8000000C: 00000000-00000000-00000000-00000000
CPUID 8000000D: 00000000-00000000-00000000-00000000
CPUID 8000000E: 00000000-00000000-00000000-00000000
CPUID 8000000F: 00000000-00000000-00000000-00000000
CPUID 80000010: 00000000-00000000-00000000-00000000
CPUID 80000011: 00000000-00000000-00000000-00000000
CPUID 80000012: 00000000-00000000-00000000-00000000
CPUID 80000013: 00000000-00000000-00000000-00000000
CPUID 80000014: 00000000-00000000-00000000-00000000
CPUID 80000015: 00000000-00000000-00000000-00000000
CPUID 80000016: 00000000-00000000-00000000-00000000
CPUID 80000017: 00000000-00000000-00000000-00000000
CPUID 80000018: 00000000-00000000-00000000-00000000
CPUID 80000019: F0300000-60100000-00000000-00000000
CPUID 8000001A: 00000003-00000000-00000000-00000000
CPUID 8000001B: 0000001F-00000000-00000000-00000000
CPUID 8FFFFFFF: 00000000-00000000-00000000-00000000

------[ Logical CPU #3 ]------

allcpu: Package 0 / Core 3 / Thread 0: Valid

CPUID 00000000: 00000006-68747541-444D4163-69746E65
CPUID 00000001: 00100FA0-05060800-00802009-178BFBFF
CPUID 00000002: 00000000-00000000-00000000-00000000
CPUID 00000003: 00000000-00000000-00000000-00000000
CPUID 00000005: 00000040-00000040-00000003-00000000
CPUID 00000006: 00000000-00000000-00000001-00000000
CPUID 80000000: 8000001B-68747541-444D4163-69746E65
CPUID 80000001: 00100FA0-10000050-000037FF-EFD3FBFF
CPUID 80000002: 20444D41-6E656850-74286D6F-4920296D
CPUID 80000003: 36582049-35303120-50205435-65636F72
CPUID 80000004: 726F7373-00000000-00000000-00000000
CPUID 80000005: FF30FF10-FF30FF20-40020140-40020140
CPUID 80000006: 20800000-42004200-02008140-0030B140
CPUID 80000007: 00000000-00000000-00000000-000003F9
CPUID 80000008: 00003030-00000000-00003005-00000000
CPUID 80000009: 00000000-00000000-00000000-00000000
CPUID 8000000A: 00000001-00000040-00000000-0000040F
CPUID 8000000B: 00000000-00000000-00000000-00000000
CPUID 8000000C: 00000000-00000000-00000000-00000000
CPUID 8000000D: 00000000-00000000-00000000-00000000
CPUID 8000000E: 00000000-00000000-00000000-00000000
CPUID 8000000F: 00000000-00000000-00000000-00000000
CPUID 80000010: 00000000-00000000-00000000-00000000
CPUID 80000011: 00000000-00000000-00000000-00000000
CPUID 80000012: 00000000-00000000-00000000-00000000
CPUID 80000013: 00000000-00000000-00000000-00000000
CPUID 80000014: 00000000-00000000-00000000-00000000
CPUID 80000015: 00000000-00000000-00000000-00000000
CPUID 80000016: 00000000-00000000-00000000-00000000
CPUID 80000017: 00000000-00000000-00000000-00000000
CPUID 80000018: 00000000-00000000-00000000-00000000
CPUID 80000019: F0300000-60100000-00000000-00000000
CPUID 8000001A: 00000003-00000000-00000000-00000000
CPUID 8000001B: 0000001F-00000000-00000000-00000000
CPUID 8FFFFFFF: 00000000-00000000-00000000-00000000

------[ Logical CPU #4 ]------

allcpu: Package 0 / Core 4 / Thread 0: Valid

CPUID 00000000: 00000006-68747541-444D4163-69746E65
CPUID 00000001: 00100FA0-02060800-00802009-178BFBFF
CPUID 00000002: 00000000-00000000-00000000-00000000
CPUID 00000003: 00000000-00000000-00000000-00000000
CPUID 00000005: 00000040-00000040-00000003-00000000
CPUID 00000006: 00000000-00000000-00000001-00000000
CPUID 80000000: 8000001B-68747541-444D4163-69746E65
CPUID 80000001: 00100FA0-10000050-000037FF-EFD3FBFF
CPUID 80000002: 20444D41-6E656850-74286D6F-4920296D
CPUID 80000003: 36582049-35303120-50205435-65636F72
CPUID 80000004: 726F7373-00000000-00000000-00000000
CPUID 80000005: FF30FF10-FF30FF20-40020140-40020140
CPUID 80000006: 20800000-42004200-02008140-0030B140
CPUID 80000007: 00000000-00000000-00000000-000003F9
CPUID 80000008: 00003030-00000000-00003005-00000000
CPUID 80000009: 00000000-00000000-00000000-00000000
CPUID 8000000A: 00000001-00000040-00000000-0000040F
CPUID 8000000B: 00000000-00000000-00000000-00000000
CPUID 8000000C: 00000000-00000000-00000000-00000000
CPUID 8000000D: 00000000-00000000-00000000-00000000
CPUID 8000000E: 00000000-00000000-00000000-00000000
CPUID 8000000F: 00000000-00000000-00000000-00000000
CPUID 80000010: 00000000-00000000-00000000-00000000
CPUID 80000011: 00000000-00000000-00000000-00000000
CPUID 80000012: 00000000-00000000-00000000-00000000
CPUID 80000013: 00000000-00000000-00000000-00000000
CPUID 80000014: 00000000-00000000-00000000-00000000
CPUID 80000015: 00000000-00000000-00000000-00000000
CPUID 80000016: 00000000-00000000-00000000-00000000
CPUID 80000017: 00000000-00000000-00000000-00000000
CPUID 80000018: 00000000-00000000-00000000-00000000
CPUID 80000019: F0300000-60100000-00000000-00000000
CPUID 8000001A: 00000003-00000000-00000000-00000000
CPUID 8000001B: 0000001F-00000000-00000000-00000000
CPUID 8FFFFFFF: 00000000-00000000-00000000-00000000

------[ Logical CPU #5 ]------

allcpu: Package 0 / Core 5 / Thread 0: Valid

CPUID 00000000: 00000006-68747541-444D4163-69746E65
CPUID 00000001: 00100FA0-04060800-00802009-178BFBFF
CPUID 00000002: 00000000-00000000-00000000-00000000
CPUID 00000003: 00000000-00000000-00000000-00000000
CPUID 00000005: 00000040-00000040-00000003-00000000
CPUID 00000006: 00000000-00000000-00000001-00000000
CPUID 80000000: 8000001B-68747541-444D4163-69746E65
CPUID 80000001: 00100FA0-10000050-000037FF-EFD3FBFF
CPUID 80000002: 20444D41-6E656850-74286D6F-4920296D
CPUID 80000003: 36582049-35303120-50205435-65636F72
CPUID 80000004: 726F7373-00000000-00000000-00000000
CPUID 80000005: FF30FF10-FF30FF20-40020140-40020140
CPUID 80000006: 20800000-42004200-02008140-0030B140
CPUID 80000007: 00000000-00000000-00000000-000003F9
CPUID 80000008: 00003030-00000000-00003005-00000000
CPUID 80000009: 00000000-00000000-00000000-00000000
CPUID 8000000A: 00000001-00000040-00000000-0000040F
CPUID 8000000B: 00000000-00000000-00000000-00000000
CPUID 8000000C: 00000000-00000000-00000000-00000000
CPUID 8000000D: 00000000-00000000-00000000-00000000
CPUID 8000000E: 00000000-00000000-00000000-00000000
CPUID 8000000F: 00000000-00000000-00000000-00000000
CPUID 80000010: 00000000-00000000-00000000-00000000
CPUID 80000011: 00000000-00000000-00000000-00000000
CPUID 80000012: 00000000-00000000-00000000-00000000
CPUID 80000013: 00000000-00000000-00000000-00000000
CPUID 80000014: 00000000-00000000-00000000-00000000
CPUID 80000015: 00000000-00000000-00000000-00000000
CPUID 80000016: 00000000-00000000-00000000-00000000
CPUID 80000017: 00000000-00000000-00000000-00000000
CPUID 80000018: 00000000-00000000-00000000-00000000
CPUID 80000019: F0300000-60100000-00000000-00000000
CPUID 8000001A: 00000003-00000000-00000000-00000000
CPUID 8000001B: 0000001F-00000000-00000000-00000000
CPUID 8FFFFFFF: 00000000-00000000-00000000-00000000

------[ All CPUs ]------

CPU   0: APICID   0 / Package 0 / Core  0 / Thread 0: Valid
CPU   1: APICID   1 / Package 0 / Core  1 / Thread 0: Valid
CPU   2: APICID   3 / Package 0 / Core  2 / Thread 0: Valid
CPU   3: APICID   5 / Package 0 / Core  3 / Thread 0: Valid
CPU   4: APICID   2 / Package 0 / Core  4 / Thread 0: Valid
CPU   5: APICID   4 / Package 0 / Core  5 / Thread 0: Valid

------[ MSR Registers ]------

CPU Clock (Normal): 2812 MHz
CPU Clock (TSC): 2812 MHz
CPU Multiplier: 14.0x
MSR 0000001B: 0000-0000-FEE0-0900
MSR C0010015: 0000-0000-0100-0010
MSR C001001F: 0058-4000-0000-0008
MSR C0010055: 0000-0000-0000-0000
MSR C0010058: 0000-0000-E000-0001
MSR C0010061: 0000-0000-0000-0030
MSR C0010062: 0000-0000-0000-0000
MSR C0010063: 0000-0000-0000-0000
MSR C0010064: 8000-019E-4000-0C11 [16.50x]
MSR C0010065: 8000-0196-4000-280C [14.00x]
MSR C0010066: 8000-0174-4000-2C06 [11.00x]
MSR C0010067: 8000-0155-4000-304E [7.50x]
MSR C0010068: 8000-0137-4000-3440 [4.00x]
MSR C0010071: 31C2-0031-4001-280C [14.00x]
MSR C0010140: 0000-0000-0000-0003
MSR C0010141: 0000-0000-0000-0004
MSR C0011023: 0000-0000-1020-0020

PerformanceFrequency = 2812000000

Tjmax Temperature = 0 Celsius
