------[ Versions ]------

Program Version : AIDA64 v4.00.2742 Beta
BenchDLL Version: 4.1.605-x64

------[ CPU Info ]------

CPU Type          : QuadCore AMD A4-5000, 1500 MHz (15 x 100)
CPU Alias         : Kabini
CPU Platform      : Socket FT3 BGA
CPU Stepping      : KB-A1
Instruction Set   : x86, x86-64, MMX, SSE, SSE2, SSE3, SSSE3, SSE4.1, SSE4.2, SSE4A, AVX, AES
CPUID Manufacturer: AuthenticAMD
CPUID CPU Name    : AMD A4-5000 APU with Radeon(TM) HD Graphics
CPUID Revision    : 00700F01h
Platform ID       : E6h  (Socket FT3 BGA)
HTT / CMP Units   : 0 / 4
Max. NUMA Node    : 0

Tjmax Temperature    : 0 Celsius
HTC Temperature Limit: 100 Celsius
CPU TDP              : 15.0 W

------[ Logical CPU #0 ]------

allcpu: Package 0 / Core 0 / Thread 0: Valid

CPUID 00000000: 0000000D-68747541-444D4163-69746E65 [AuthenticAMD]
CPUID 00000001: 00700F01-00040800-3ED8220B-178BFBFF
CPUID 00000002: 00000000-00000000-00000000-00000000
CPUID 00000003: 00000000-00000000-00000000-00000000
CPUID 00000005: 00000040-00000040-00000003-00000000
CPUID 00000006: 00000000-00000000-00000001-00000000
CPUID 00000007: 00000000-00000008-00000000-00000000
CPUID 00000008: 00000000-00000000-00000000-00000000
CPUID 00000009: 00000000-00000000-00000000-00000000
CPUID 0000000A: 00000000-00000000-00000000-00000000
CPUID 0000000C: 00000000-00000000-00000000-00000000
CPUID 0000000D: 00000007-00000340-00000340-00000000
CPUID 0000000D: 00000100-00000240-00000000-00000000
CPUID 80000000: 8000001E-68747541-444D4163-69746E65
CPUID 80000001: 00700F01-00000000-154037FF-2FD3FBFF
CPUID 80000002: 20444D41-352D3441-20303030-20555041 [AMD A4-5000 APU ]
CPUID 80000003: 68746977-64615220-286E6F65-20294D54 [with Radeon(TM) ]
CPUID 80000004: 47204448-68706172-20736369-00202020 [HD Graphics    ]
CPUID 80000005: FF08FF08-FF28FF20-20080140-20020140
CPUID 80000006: 21000000-42004200-08008140-00000000
CPUID 80000007: 0D6B0101-00000001-00000000-000009D9
CPUID 80000008: 00003028-00000000-00003003-00000000
CPUID 80000009: 00000000-00000000-00000000-00000000
CPUID 8000000A: 00000001-00000008-00000000-00001CDF
CPUID 8000000B: 00000000-00000000-00000000-00000000
CPUID 8000000C: 00000000-00000000-00000000-00000000
CPUID 8000000D: 00000000-00000000-00000000-00000000
CPUID 8000000E: 00000000-00000000-00000000-00000000
CPUID 8000000F: 00000000-00000000-00000000-00000000
CPUID 80000010: 00000000-00000000-00000000-00000000
CPUID 80000011: 00000000-00000000-00000000-00000000
CPUID 80000012: 00000000-00000000-00000000-00000000
CPUID 80000013: 00000000-00000000-00000000-00000000
CPUID 80000014: 00000000-00000000-00000000-00000000
CPUID 80000015: 00000000-00000000-00000000-00000000
CPUID 80000016: 00000000-00000000-00000000-00000000
CPUID 80000017: 00000000-00000000-00000000-00000000
CPUID 80000018: 00000000-00000000-00000000-00000000
CPUID 80000019: 00000000-00000000-00000000-00000000
CPUID 8000001A: 00000003-00000000-00000000-00000000
CPUID 8000001B: 000000FF-00000000-00000000-00000000
CPUID 8000001C: 00000000-00000000-00000000-00000000
CPUID 8000001D: 00000121-01C0003F-0000003F-00000000
CPUID 8000001D: 00000122-0040003F-000000FF-00000000
CPUID 8000001D: 0000C143-03C0003F-000007FF-00000002
CPUID 8000001E: 00000000-00000000-00000000-00000000
CPUID 8FFFFFFF: 4C4C4548-494B204F-21595454-5E2D5E20 [HELLO KITTY! ^-^]

L1    Data Cache:     32 KB,  8-way Associative, 64-byte Line
L1  Instr. Cache:     32 KB,  2-way Associative, 64-byte Line
L2 Unified Cache:   2048 KB, 16-way Associative, 64-byte Line

------[ Logical CPU #1 ]------

allcpu: Package 0 / Core 1 / Thread 0: Valid

CPUID 00000000: 0000000D-68747541-444D4163-69746E65 [AuthenticAMD]
CPUID 00000001: 00700F01-01040800-3ED8220B-178BFBFF
CPUID 00000002: 00000000-00000000-00000000-00000000
CPUID 00000003: 00000000-00000000-00000000-00000000
CPUID 00000005: 00000040-00000040-00000003-00000000
CPUID 00000006: 00000000-00000000-00000001-00000000
CPUID 00000007: 00000000-00000008-00000000-00000000
CPUID 00000008: 00000000-00000000-00000000-00000000
CPUID 00000009: 00000000-00000000-00000000-00000000
CPUID 0000000A: 00000000-00000000-00000000-00000000
CPUID 0000000C: 00000000-00000000-00000000-00000000
CPUID 0000000D: 00000007-00000340-00000340-00000000
CPUID 0000000D: 00000100-00000240-00000000-00000000
CPUID 80000000: 8000001E-68747541-444D4163-69746E65
CPUID 80000001: 00700F01-00000000-154037FF-2FD3FBFF
CPUID 80000002: 20444D41-352D3441-20303030-20555041 [AMD A4-5000 APU ]
CPUID 80000003: 68746977-64615220-286E6F65-20294D54 [with Radeon(TM) ]
CPUID 80000004: 47204448-68706172-20736369-00202020 [HD Graphics    ]
CPUID 80000005: FF08FF08-FF28FF20-20080140-20020140
CPUID 80000006: 21000000-42004200-08008140-00000000
CPUID 80000007: 0D6B0101-00000001-00000000-000009D9
CPUID 80000008: 00003028-00000000-00003003-00000000
CPUID 80000009: 00000000-00000000-00000000-00000000
CPUID 8000000A: 00000001-00000008-00000000-00001CDF
CPUID 8000000B: 00000000-00000000-00000000-00000000
CPUID 8000000C: 00000000-00000000-00000000-00000000
CPUID 8000000D: 00000000-00000000-00000000-00000000
CPUID 8000000E: 00000000-00000000-00000000-00000000
CPUID 8000000F: 00000000-00000000-00000000-00000000
CPUID 80000010: 00000000-00000000-00000000-00000000
CPUID 80000011: 00000000-00000000-00000000-00000000
CPUID 80000012: 00000000-00000000-00000000-00000000
CPUID 80000013: 00000000-00000000-00000000-00000000
CPUID 80000014: 00000000-00000000-00000000-00000000
CPUID 80000015: 00000000-00000000-00000000-00000000
CPUID 80000016: 00000000-00000000-00000000-00000000
CPUID 80000017: 00000000-00000000-00000000-00000000
CPUID 80000018: 00000000-00000000-00000000-00000000
CPUID 80000019: 00000000-00000000-00000000-00000000
CPUID 8000001A: 00000003-00000000-00000000-00000000
CPUID 8000001B: 000000FF-00000000-00000000-00000000
CPUID 8000001C: 00000000-00000000-00000000-00000000
CPUID 8000001D: 00000121-01C0003F-0000003F-00000000
CPUID 8000001D: 00000122-0040003F-000000FF-00000000
CPUID 8000001D: 0000C143-03C0003F-000007FF-00000002
CPUID 8000001E: 00000001-00000001-00000000-00000000
CPUID 8FFFFFFF: 4C4C4548-494B204F-21595454-5E2D5E20 [HELLO KITTY! ^-^]

L1    Data Cache:     32 KB,  8-way Associative, 64-byte Line
L1  Instr. Cache:     32 KB,  2-way Associative, 64-byte Line
L2 Unified Cache:   2048 KB, 16-way Associative, 64-byte Line

------[ Logical CPU #2 ]------

allcpu: Package 0 / Core 2 / Thread 0: Valid

CPUID 00000000: 0000000D-68747541-444D4163-69746E65 [AuthenticAMD]
CPUID 00000001: 00700F01-02040800-3ED8220B-178BFBFF
CPUID 00000002: 00000000-00000000-00000000-00000000
CPUID 00000003: 00000000-00000000-00000000-00000000
CPUID 00000005: 00000040-00000040-00000003-00000000
CPUID 00000006: 00000000-00000000-00000001-00000000
CPUID 00000007: 00000000-00000008-00000000-00000000
CPUID 00000008: 00000000-00000000-00000000-00000000
CPUID 00000009: 00000000-00000000-00000000-00000000
CPUID 0000000A: 00000000-00000000-00000000-00000000
CPUID 0000000C: 00000000-00000000-00000000-00000000
CPUID 0000000D: 00000007-00000340-00000340-00000000
CPUID 0000000D: 00000100-00000240-00000000-00000000
CPUID 80000000: 8000001E-68747541-444D4163-69746E65
CPUID 80000001: 00700F01-00000000-154037FF-2FD3FBFF
CPUID 80000002: 20444D41-352D3441-20303030-20555041 [AMD A4-5000 APU ]
CPUID 80000003: 68746977-64615220-286E6F65-20294D54 [with Radeon(TM) ]
CPUID 80000004: 47204448-68706172-20736369-00202020 [HD Graphics    ]
CPUID 80000005: FF08FF08-FF28FF20-20080140-20020140
CPUID 80000006: 21000000-42004200-08008140-00000000
CPUID 80000007: 0D6B0101-00000001-00000000-000009D9
CPUID 80000008: 00003028-00000000-00003003-00000000
CPUID 80000009: 00000000-00000000-00000000-00000000
CPUID 8000000A: 00000001-00000008-00000000-00001CDF
CPUID 8000000B: 00000000-00000000-00000000-00000000
CPUID 8000000C: 00000000-00000000-00000000-00000000
CPUID 8000000D: 00000000-00000000-00000000-00000000
CPUID 8000000E: 00000000-00000000-00000000-00000000
CPUID 8000000F: 00000000-00000000-00000000-00000000
CPUID 80000010: 00000000-00000000-00000000-00000000
CPUID 80000011: 00000000-00000000-00000000-00000000
CPUID 80000012: 00000000-00000000-00000000-00000000
CPUID 80000013: 00000000-00000000-00000000-00000000
CPUID 80000014: 00000000-00000000-00000000-00000000
CPUID 80000015: 00000000-00000000-00000000-00000000
CPUID 80000016: 00000000-00000000-00000000-00000000
CPUID 80000017: 00000000-00000000-00000000-00000000
CPUID 80000018: 00000000-00000000-00000000-00000000
CPUID 80000019: 00000000-00000000-00000000-00000000
CPUID 8000001A: 00000003-00000000-00000000-00000000
CPUID 8000001B: 000000FF-00000000-00000000-00000000
CPUID 8000001C: 00000000-00000000-00000000-00000000
CPUID 8000001D: 00000121-01C0003F-0000003F-00000000
CPUID 8000001D: 00000122-0040003F-000000FF-00000000
CPUID 8000001D: 0000C143-03C0003F-000007FF-00000002
CPUID 8000001E: 00000002-00000002-00000000-00000000
CPUID 8FFFFFFF: 4C4C4548-494B204F-21595454-5E2D5E20 [HELLO KITTY! ^-^]

L1    Data Cache:     32 KB,  8-way Associative, 64-byte Line
L1  Instr. Cache:     32 KB,  2-way Associative, 64-byte Line
L2 Unified Cache:   2048 KB, 16-way Associative, 64-byte Line

------[ Logical CPU #3 ]------

allcpu: Package 0 / Core 3 / Thread 0: Valid

CPUID 00000000: 0000000D-68747541-444D4163-69746E65 [AuthenticAMD]
CPUID 00000001: 00700F01-03040800-3ED8220B-178BFBFF
CPUID 00000002: 00000000-00000000-00000000-00000000
CPUID 00000003: 00000000-00000000-00000000-00000000
CPUID 00000005: 00000040-00000040-00000003-00000000
CPUID 00000006: 00000000-00000000-00000001-00000000
CPUID 00000007: 00000000-00000008-00000000-00000000
CPUID 00000008: 00000000-00000000-00000000-00000000
CPUID 00000009: 00000000-00000000-00000000-00000000
CPUID 0000000A: 00000000-00000000-00000000-00000000
CPUID 0000000C: 00000000-00000000-00000000-00000000
CPUID 0000000D: 00000007-00000340-00000340-00000000
CPUID 0000000D: 00000100-00000240-00000000-00000000
CPUID 80000000: 8000001E-68747541-444D4163-69746E65
CPUID 80000001: 00700F01-00000000-154037FF-2FD3FBFF
CPUID 80000002: 20444D41-352D3441-20303030-20555041 [AMD A4-5000 APU ]
CPUID 80000003: 68746977-64615220-286E6F65-20294D54 [with Radeon(TM) ]
CPUID 80000004: 47204448-68706172-20736369-00202020 [HD Graphics    ]
CPUID 80000005: FF08FF08-FF28FF20-20080140-20020140
CPUID 80000006: 21000000-42004200-08008140-00000000
CPUID 80000007: 0D6B0101-00000001-00000000-000009D9
CPUID 80000008: 00003028-00000000-00003003-00000000
CPUID 80000009: 00000000-00000000-00000000-00000000
CPUID 8000000A: 00000001-00000008-00000000-00001CDF
CPUID 8000000B: 00000000-00000000-00000000-00000000
CPUID 8000000C: 00000000-00000000-00000000-00000000
CPUID 8000000D: 00000000-00000000-00000000-00000000
CPUID 8000000E: 00000000-00000000-00000000-00000000
CPUID 8000000F: 00000000-00000000-00000000-00000000
CPUID 80000010: 00000000-00000000-00000000-00000000
CPUID 80000011: 00000000-00000000-00000000-00000000
CPUID 80000012: 00000000-00000000-00000000-00000000
CPUID 80000013: 00000000-00000000-00000000-00000000
CPUID 80000014: 00000000-00000000-00000000-00000000
CPUID 80000015: 00000000-00000000-00000000-00000000
CPUID 80000016: 00000000-00000000-00000000-00000000
CPUID 80000017: 00000000-00000000-00000000-00000000
CPUID 80000018: 00000000-00000000-00000000-00000000
CPUID 80000019: 00000000-00000000-00000000-00000000
CPUID 8000001A: 00000003-00000000-00000000-00000000
CPUID 8000001B: 000000FF-00000000-00000000-00000000
CPUID 8000001C: 00000000-00000000-00000000-00000000
CPUID 8000001D: 00000121-01C0003F-0000003F-00000000
CPUID 8000001D: 00000122-0040003F-000000FF-00000000
CPUID 8000001D: 0000C143-03C0003F-000007FF-00000002
CPUID 8000001E: 00000003-00000003-00000000-00000000
CPUID 8FFFFFFF: 4C4C4548-494B204F-21595454-5E2D5E20 [HELLO KITTY! ^-^]

L1    Data Cache:     32 KB,  8-way Associative, 64-byte Line
L1  Instr. Cache:     32 KB,  2-way Associative, 64-byte Line
L2 Unified Cache:   2048 KB, 16-way Associative, 64-byte Line

------[ All CPUs ]------

CPU   0: APICID   0 / Package 0 / Core  0 / Thread 0: Valid
CPU   1: APICID   1 / Package 0 / Core  1 / Thread 0: Valid
CPU   2: APICID   2 / Package 0 / Core  2 / Thread 0: Valid
CPU   3: APICID   3 / Package 0 / Core  3 / Thread 0: Valid

------[ MSR Registers ]------

CPU Clock (Normal): 1497 MHz
CPU Clock (TSC): 1497 MHz
CPU Multiplier: 15.0x
MSR 0000001B: 0000-0000-FEE0-0900
MSR 0000008B: 0000-0000-0700-010B
MSR 000000E7: 0000-0000-01D2-99A5
MSR 000000E8: 0000-0000-01D2-C8AA
MSR C0010004: 0000-0000-0000-0000
MSR C0010005: 0000-0000-0000-0000
MSR C0010006: 0000-0000-0000-0000
MSR C0010007: 0000-0000-0000-0000
MSR C0010015: 0000-0000-0100-0011
MSR C001001F: 40C8-4000-0081-0000
MSR C0010055: 0000-0000-0000-0000
MSR C0010058: 0000-0000-F800-0019
MSR C0010061: 0000-0000-0000-0040
MSR C0010062: 0000-0000-0000-0000
MSR C0010063: 0000-0000-0000-0000
MSR C0010064: 8000-02D0-0000-A84E [15.00x] [1.0250 V] [ 2.08 A] [PState P0]
MSR C0010065: 8000-02BC-0000-AC4A [13.00x] [1.0125 V] [ 1.88 A] [PState P1]
MSR C0010066: 8000-02A4-0000-B446 [11.00x] [0.9875 V] [ 1.64 A] [PState P2]
MSR C0010067: 8000-0292-0000-BC43 [ 9.50x] [0.9625 V] [ 1.46 A] [PState P3]
MSR C0010068: 8000-027D-0040-C840 [ 8.00x] [0.9250 V] [ 1.25 A] [PState P4]
MSR C0010069: 0000-0000-0001-FE00
MSR C001006A: 0000-0000-0001-FE00
MSR C001006B: 0000-0000-0001-FE00
MSR C0010070: 0000-0000-6E00-A84E
MSR C0010071: 409E-0003-6E40-A84E [15.00x] [1.0250V]
MSR C0010071: 409E-0003-6E40-A84E [15.00x] [1.0250V]
MSR C0010071: 409E-0003-6E40-A84E [15.00x] [1.0250V]
MSR C0010071: 409E-0003-6E40-A84E [15.00x] [1.0250V]
MSR C0010071: 409E-0003-6E40-A84E [15.00x] [1.0250V]
MSR C0010140: 0000-0000-0000-0000
MSR C0010141: 0000-0000-0000-0000
MSR C0011023: 0000-0000-0000-0000

PerformanceFrequency = 1462197

CPU Clock M.Method = 6  (APIC K10)
PM Timer Address   = 1032  (0408h)

APIC Clock = 99.82 MHz
APIC Clock = 99.81 MHz
APIC Clock = 99.81 MHz
APIC Clock = 99.81 MHz
APIC Clock = 99.81 MHz
