CPUID 00000000: 00000006-68747541-444D4163-69746E65
CPUID 00000001: 00500F01-00020800-00802209-178BFBFF
CPUID 00000002: 00000000-00000000-00000000-00000000
CPUID 00000003: 00000000-00000000-00000000-00000000
CPUID 00000004: 00000000-00000000-00000000-00000000
CPUID 00000005: 00000040-00000040-00000003-00000000
CPUID 00000006: 00000000-00000000-00000001-00000000
CPUID 80000000: 8000001B-68747541-444D4163-69746E65
CPUID 80000001: 00500F01-00000000-000035FF-2FD3FBFF
CPUID 80000002: 20444D41-69676E45-7265656E-20676E69
CPUID 80000003: 706D6153-0000656C-00000000-00000000
CPUID 80000004: 00000000-00000000-00000000-00000000
CPUID 80000005: FF08FF08-FF280000-20080140-20020140
CPUID 80000006: 00000000-42004200-02008140-00000000
CPUID 80000007: 00000000-00000000-00000000-000001F9
CPUID 80000008: 00003024-00000000-00001001-00000000
CPUID 80000009: 00000000-00000000-00000000-00000000
CPUID 8000000A: 00000001-00000008-00000000-0000060F
CPUID 8000000B: 00000000-00000000-00000000-00000000
CPUID 8000000C: 00000000-00000000-00000000-00000000
CPUID 8000000D: 00000000-00000000-00000000-00000000
CPUID 8000000E: 00000000-00000000-00000000-00000000
CPUID 8000000F: 00000000-00000000-00000000-00000000
CPUID 80000010: 00000000-00000000-00000000-00000000
CPUID 80000011: 00000000-00000000-00000000-00000000
CPUID 80000012: 00000000-00000000-00000000-00000000
CPUID 80000013: 00000000-00000000-00000000-00000000
CPUID 80000014: 00000000-00000000-00000000-00000000
CPUID 80000015: 00000000-00000000-00000000-00000000
CPUID 80000016: 00000000-00000000-00000000-00000000
CPUID 80000017: 00000000-00000000-00000000-00000000
CPUID 80000018: 00000000-00000000-00000000-00000000
CPUID 80000019: 00000000-00000000-00000000-00000000
CPUID 8000001A: 00000000-00000000-00000000-00000000
CPUID 8000001B: 000000FF-00000000-00000000-00000000

CPUID 00000000: 00000006-68747541-444D4163-69746E65
CPUID 00000001: 00500F01-01020800-00802209-178BFBFF
CPUID 00000002: 00000000-00000000-00000000-00000000
CPUID 00000003: 00000000-00000000-00000000-00000000
CPUID 00000004: 00000000-00000000-00000000-00000000
CPUID 00000005: 00000040-00000040-00000003-00000000
CPUID 00000006: 00000000-00000000-00000001-00000000
CPUID 80000000: 8000001B-68747541-444D4163-69746E65
CPUID 80000001: 00500F01-00000000-000035FF-2FD3FBFF
CPUID 80000002: 20444D41-69676E45-7265656E-20676E69
CPUID 80000003: 706D6153-0000656C-00000000-00000000
CPUID 80000004: 00000000-00000000-00000000-00000000
CPUID 80000005: FF08FF08-FF280000-20080140-20020140
CPUID 80000006: 00000000-42004200-02008140-00000000
CPUID 80000007: 00000000-00000000-00000000-000001F9
CPUID 80000008: 00003024-00000000-00001001-00000000
CPUID 80000009: 00000000-00000000-00000000-00000000
CPUID 8000000A: 00000001-00000008-00000000-0000060F
CPUID 8000000B: 00000000-00000000-00000000-00000000
CPUID 8000000C: 00000000-00000000-00000000-00000000
CPUID 8000000D: 00000000-00000000-00000000-00000000
CPUID 8000000E: 00000000-00000000-00000000-00000000
CPUID 8000000F: 00000000-00000000-00000000-00000000
CPUID 80000010: 00000000-00000000-00000000-00000000
CPUID 80000011: 00000000-00000000-00000000-00000000
CPUID 80000012: 00000000-00000000-00000000-00000000
CPUID 80000013: 00000000-00000000-00000000-00000000
CPUID 80000014: 00000000-00000000-00000000-00000000
CPUID 80000015: 00000000-00000000-00000000-00000000
CPUID 80000016: 00000000-00000000-00000000-00000000
CPUID 80000017: 00000000-00000000-00000000-00000000
CPUID 80000018: 00000000-00000000-00000000-00000000
CPUID 80000019: 00000000-00000000-00000000-00000000
CPUID 8000001A: 00000000-00000000-00000000-00000000
CPUID 8000001B: 000000FF-00000000-00000000-00000000