------[ Versions ]------

Program Version : AIDA64 Engineer v6.60.5923 Beta
BenchDLL Version: 4.5.867.8-x64
Windows Version : Microsoft Windows 10 Enterprise 10.0.19044.1566 (64-bit)
GetProductInfo  : 0x00000004

------[ CPU Info ]------

CPU Type          : Mobile QuadCore AMD A10 Pro-7350B, 3342 MHz (33 x 101)
CPU Alias         : Berlin
CPU Platform      : Socket FP3
CPU Stepping      : KV-A1
Instruction Set   : x86, x86-64, MMX, SSE, SSE2, SSE3, SSSE3, SSE4.1, SSE4.2, SSE4A, XOP, AVX, FMA, FMA4, AES
CPUID Manufacturer: AuthenticAMD
CPUID CPU Name    : AMD A10 PRO-7350B R6, 10 Compute Cores 4C+6G
CPUID Revision    : 00630F01h
Platform ID       : CCh  (Socket FP3)
HTT / CMP Units   : 0 / 4
Max. NUMA Node    : 0

Tjmax Temperature    : 0 Celsius
HTC Temperature Limit: 100 Celsius
CPU TDP              : 19.0 W

------[ Motherboard Info ]------

Motherboard ID      : <DMI>
Motherboard Model   : Hewlett-Packard HP EliteBook 745 G2
Motherboard Chipset : AMD A76M, AMD K15.3

DMI MB Manufacturer : Hewlett-Packard
DMI MB Product      : 221C
DMI MB Version      : KBC Version 63.19
DMI MB Serial       : PELKB001X6W013
DMI SYS Manufacturer: Hewlett-Packard
DMI SYS Product     : HP EliteBook 745 G2
DMI SYS Version     : A3009CD10002
DMI SYS Serial      : 5CG54318JZ
DMI BIOS Version    : M84 Ver. 01.48


------[ CPUID Registers / Logical CPU #0 ]------

allcpu: Package 0 / Core 0 / Thread 0: Valid

CPUID 00000000: 0000000D-68747541-444D4163-69746E65 [AuthenticAMD]
CPUID 00000001: 00630F01-00040800-3E98320B-178BFBFF
CPUID 00000002: 00000000-00000000-00000000-00000000
CPUID 00000003: 00000000-00000000-00000000-00000000
CPUID 00000005: 00000040-00000040-00000003-00000000
CPUID 00000006: 00000000-00000000-00000001-00000000
CPUID 00000007: 00000000-00000009-00000000-00000000 [SL 00]
CPUID 00000008: 00000000-00000000-00000000-00000000
CPUID 00000009: 00000000-00000000-00000000-00000000
CPUID 0000000A: 00000000-00000000-00000000-00000000
CPUID 0000000C: 00000000-00000000-00000000-00000000
CPUID 0000000D: 00000007-00000340-000003C0-40000000 [SL 00] [x87]
CPUID 0000000D: 00000001-00000000-00000000-00000000 [SL 01] [SSE]
CPUID 0000000D: 00000100-00000240-00000000-00000000 [SL 02] [AVX]
CPUID 0000000D: 00000080-00000340-00000000-00000000 [SL 3E]
CPUID 0000000D: 00000080-00000340-00000000-00000000 [SL 3E]
CPUID 80000000: 8000001E-68747541-444D4163-69746E65 [AuthenticAMD]
CPUID 80000001: 00630F01-00000000-0FABBFFF-2FD3FBFF
CPUID 80000002: 20444D41-20303141-2D4F5250-30353337 [AMD A10 PRO-7350]
CPUID 80000003: 36522042-3031202C-6D6F4320-65747570 [B R6, 10 Compute]
CPUID 80000004: 726F4320-34207365-47362B43-00202020 [ Cores 4C+6G   ]
CPUID 80000005: FF40FF18-FF40FF30-10040140-60030140 [L1D: 16 KB / L1I: 96 KB]
CPUID 80000006: 64006400-64004200-08008140-00000000 [L2: 2048 KB] / L3: 0 KB]
CPUID 80000007: 00000000-00000001-00000000-000027D9
CPUID 80000008: 00003030-00001000-00004003-00000000
CPUID 80000009: 00000000-00000000-00000000-00000000
CPUID 8000000A: 00000001-00010000-00000000-00001CFF
CPUID 8000000B: 00000000-00000000-00000000-00000000
CPUID 8000000C: 00000000-00000000-00000000-00000000
CPUID 8000000D: 00000000-00000000-00000000-00000000
CPUID 8000000E: 00000000-00000000-00000000-00000000
CPUID 8000000F: 00000000-00000000-00000000-00000000
CPUID 80000010: 00000000-00000000-00000000-00000000
CPUID 80000011: 00000000-00000000-00000000-00000000
CPUID 80000012: 00000000-00000000-00000000-00000000
CPUID 80000013: 00000000-00000000-00000000-00000000
CPUID 80000014: 00000000-00000000-00000000-00000000
CPUID 80000015: 00000000-00000000-00000000-00000000
CPUID 80000016: 00000000-00000000-00000000-00000000
CPUID 80000017: 00000000-00000000-00000000-00000000
CPUID 80000018: 00000000-00000000-00000000-00000000
CPUID 80000019: F040F018-64006400-00000000-00000000
CPUID 8000001A: 00000003-00000000-00000000-00000000
CPUID 8000001B: 000001FF-00000000-00000000-00000000
CPUID 8000001C: 00000000-80032013-00010200-E000000F
CPUID 8000001E: 00000010-00000100-00000000-00000000
CPUID 8FFFFFFF: 00000000-00000000-00000000-00000000

------[ CPUID Registers / Logical CPU #1 ]------

allcpu: Package 0 / Core 1 / Thread 0: Valid

CPUID 00000000: 0000000D-68747541-444D4163-69746E65 [AuthenticAMD]
CPUID 00000001: 00630F01-01040800-3E98320B-178BFBFF
CPUID 00000002: 00000000-00000000-00000000-00000000
CPUID 00000003: 00000000-00000000-00000000-00000000
CPUID 00000005: 00000040-00000040-00000003-00000000
CPUID 00000006: 00000000-00000000-00000001-00000000
CPUID 00000007: 00000000-00000009-00000000-00000000 [SL 00]
CPUID 00000008: 00000000-00000000-00000000-00000000
CPUID 00000009: 00000000-00000000-00000000-00000000
CPUID 0000000A: 00000000-00000000-00000000-00000000
CPUID 0000000C: 00000000-00000000-00000000-00000000
CPUID 0000000D: 00000007-00000340-000003C0-40000000 [SL 00] [x87]
CPUID 0000000D: 00000001-00000000-00000000-00000000 [SL 01] [SSE]
CPUID 0000000D: 00000100-00000240-00000000-00000000 [SL 02] [AVX]
CPUID 0000000D: 00000080-00000340-00000000-00000000 [SL 3E]
CPUID 0000000D: 00000080-00000340-00000000-00000000 [SL 3E]
CPUID 80000000: 8000001E-68747541-444D4163-69746E65 [AuthenticAMD]
CPUID 80000001: 00630F01-00000000-0FABBFFF-2FD3FBFF
CPUID 80000002: 20444D41-20303141-2D4F5250-30353337 [AMD A10 PRO-7350]
CPUID 80000003: 36522042-3031202C-6D6F4320-65747570 [B R6, 10 Compute]
CPUID 80000004: 726F4320-34207365-47362B43-00202020 [ Cores 4C+6G   ]
CPUID 80000005: FF40FF18-FF40FF30-10040140-60030140 [L1D: 16 KB / L1I: 96 KB]
CPUID 80000006: 64006400-64004200-08008140-00000000 [L2: 2048 KB] / L3: 0 KB]
CPUID 80000007: 00000000-00000001-00000000-000027D9
CPUID 80000008: 00003030-00001000-00004003-00000000
CPUID 80000009: 00000000-00000000-00000000-00000000
CPUID 8000000A: 00000001-00010000-00000000-00001CFF
CPUID 8000000B: 00000000-00000000-00000000-00000000
CPUID 8000000C: 00000000-00000000-00000000-00000000
CPUID 8000000D: 00000000-00000000-00000000-00000000
CPUID 8000000E: 00000000-00000000-00000000-00000000
CPUID 8000000F: 00000000-00000000-00000000-00000000
CPUID 80000010: 00000000-00000000-00000000-00000000
CPUID 80000011: 00000000-00000000-00000000-00000000
CPUID 80000012: 00000000-00000000-00000000-00000000
CPUID 80000013: 00000000-00000000-00000000-00000000
CPUID 80000014: 00000000-00000000-00000000-00000000
CPUID 80000015: 00000000-00000000-00000000-00000000
CPUID 80000016: 00000000-00000000-00000000-00000000
CPUID 80000017: 00000000-00000000-00000000-00000000
CPUID 80000018: 00000000-00000000-00000000-00000000
CPUID 80000019: F040F018-64006400-00000000-00000000
CPUID 8000001A: 00000003-00000000-00000000-00000000
CPUID 8000001B: 000001FF-00000000-00000000-00000000
CPUID 8000001C: 00000000-80032013-00010200-E000000F
CPUID 8000001E: 00000011-00000100-00000000-00000000
CPUID 8FFFFFFF: 00000000-00000000-00000000-00000000

------[ CPUID Registers / Logical CPU #2 ]------

allcpu: Package 0 / Core 2 / Thread 0: Valid

CPUID 00000000: 0000000D-68747541-444D4163-69746E65 [AuthenticAMD]
CPUID 00000001: 00630F01-02040800-3E98320B-178BFBFF
CPUID 00000002: 00000000-00000000-00000000-00000000
CPUID 00000003: 00000000-00000000-00000000-00000000
CPUID 00000005: 00000040-00000040-00000003-00000000
CPUID 00000006: 00000000-00000000-00000001-00000000
CPUID 00000007: 00000000-00000009-00000000-00000000 [SL 00]
CPUID 00000008: 00000000-00000000-00000000-00000000
CPUID 00000009: 00000000-00000000-00000000-00000000
CPUID 0000000A: 00000000-00000000-00000000-00000000
CPUID 0000000C: 00000000-00000000-00000000-00000000
CPUID 0000000D: 00000007-00000340-000003C0-40000000 [SL 00] [x87]
CPUID 0000000D: 00000001-00000000-00000000-00000000 [SL 01] [SSE]
CPUID 0000000D: 00000100-00000240-00000000-00000000 [SL 02] [AVX]
CPUID 0000000D: 00000080-00000340-00000000-00000000 [SL 3E]
CPUID 0000000D: 00000080-00000340-00000000-00000000 [SL 3E]
CPUID 80000000: 8000001E-68747541-444D4163-69746E65 [AuthenticAMD]
CPUID 80000001: 00630F01-00000000-0FABBFFF-2FD3FBFF
CPUID 80000002: 20444D41-20303141-2D4F5250-30353337 [AMD A10 PRO-7350]
CPUID 80000003: 36522042-3031202C-6D6F4320-65747570 [B R6, 10 Compute]
CPUID 80000004: 726F4320-34207365-47362B43-00202020 [ Cores 4C+6G   ]
CPUID 80000005: FF40FF18-FF40FF30-10040140-60030140 [L1D: 16 KB / L1I: 96 KB]
CPUID 80000006: 64006400-64004200-08008140-00000000 [L2: 2048 KB] / L3: 0 KB]
CPUID 80000007: 00000000-00000001-00000000-000027D9
CPUID 80000008: 00003030-00001000-00004003-00000000
CPUID 80000009: 00000000-00000000-00000000-00000000
CPUID 8000000A: 00000001-00010000-00000000-00001CFF
CPUID 8000000B: 00000000-00000000-00000000-00000000
CPUID 8000000C: 00000000-00000000-00000000-00000000
CPUID 8000000D: 00000000-00000000-00000000-00000000
CPUID 8000000E: 00000000-00000000-00000000-00000000
CPUID 8000000F: 00000000-00000000-00000000-00000000
CPUID 80000010: 00000000-00000000-00000000-00000000
CPUID 80000011: 00000000-00000000-00000000-00000000
CPUID 80000012: 00000000-00000000-00000000-00000000
CPUID 80000013: 00000000-00000000-00000000-00000000
CPUID 80000014: 00000000-00000000-00000000-00000000
CPUID 80000015: 00000000-00000000-00000000-00000000
CPUID 80000016: 00000000-00000000-00000000-00000000
CPUID 80000017: 00000000-00000000-00000000-00000000
CPUID 80000018: 00000000-00000000-00000000-00000000
CPUID 80000019: F040F018-64006400-00000000-00000000
CPUID 8000001A: 00000003-00000000-00000000-00000000
CPUID 8000001B: 000001FF-00000000-00000000-00000000
CPUID 8000001C: 00000000-80032013-00010200-E000000F
CPUID 8000001E: 00000012-00000101-00000000-00000000
CPUID 8FFFFFFF: 00000000-00000000-00000000-00000000

------[ CPUID Registers / Logical CPU #3 ]------

allcpu: Package 0 / Core 3 / Thread 0: Valid

CPUID 00000000: 0000000D-68747541-444D4163-69746E65 [AuthenticAMD]
CPUID 00000001: 00630F01-03040800-3E98320B-178BFBFF
CPUID 00000002: 00000000-00000000-00000000-00000000
CPUID 00000003: 00000000-00000000-00000000-00000000
CPUID 00000005: 00000040-00000040-00000003-00000000
CPUID 00000006: 00000000-00000000-00000001-00000000
CPUID 00000007: 00000000-00000009-00000000-00000000 [SL 00]
CPUID 00000008: 00000000-00000000-00000000-00000000
CPUID 00000009: 00000000-00000000-00000000-00000000
CPUID 0000000A: 00000000-00000000-00000000-00000000
CPUID 0000000C: 00000000-00000000-00000000-00000000
CPUID 0000000D: 00000007-00000340-000003C0-40000000 [SL 00] [x87]
CPUID 0000000D: 00000001-00000000-00000000-00000000 [SL 01] [SSE]
CPUID 0000000D: 00000100-00000240-00000000-00000000 [SL 02] [AVX]
CPUID 0000000D: 00000080-00000340-00000000-00000000 [SL 3E]
CPUID 0000000D: 00000080-00000340-00000000-00000000 [SL 3E]
CPUID 80000000: 8000001E-68747541-444D4163-69746E65 [AuthenticAMD]
CPUID 80000001: 00630F01-00000000-0FABBFFF-2FD3FBFF
CPUID 80000002: 20444D41-20303141-2D4F5250-30353337 [AMD A10 PRO-7350]
CPUID 80000003: 36522042-3031202C-6D6F4320-65747570 [B R6, 10 Compute]
CPUID 80000004: 726F4320-34207365-47362B43-00202020 [ Cores 4C+6G   ]
CPUID 80000005: FF40FF18-FF40FF30-10040140-60030140 [L1D: 16 KB / L1I: 96 KB]
CPUID 80000006: 64006400-64004200-08008140-00000000 [L2: 2048 KB] / L3: 0 KB]
CPUID 80000007: 00000000-00000001-00000000-000027D9
CPUID 80000008: 00003030-00001000-00004003-00000000
CPUID 80000009: 00000000-00000000-00000000-00000000
CPUID 8000000A: 00000001-00010000-00000000-00001CFF
CPUID 8000000B: 00000000-00000000-00000000-00000000
CPUID 8000000C: 00000000-00000000-00000000-00000000
CPUID 8000000D: 00000000-00000000-00000000-00000000
CPUID 8000000E: 00000000-00000000-00000000-00000000
CPUID 8000000F: 00000000-00000000-00000000-00000000
CPUID 80000010: 00000000-00000000-00000000-00000000
CPUID 80000011: 00000000-00000000-00000000-00000000
CPUID 80000012: 00000000-00000000-00000000-00000000
CPUID 80000013: 00000000-00000000-00000000-00000000
CPUID 80000014: 00000000-00000000-00000000-00000000
CPUID 80000015: 00000000-00000000-00000000-00000000
CPUID 80000016: 00000000-00000000-00000000-00000000
CPUID 80000017: 00000000-00000000-00000000-00000000
CPUID 80000018: 00000000-00000000-00000000-00000000
CPUID 80000019: F040F018-64006400-00000000-00000000
CPUID 8000001A: 00000003-00000000-00000000-00000000
CPUID 8000001B: 000001FF-00000000-00000000-00000000
CPUID 8000001C: 00000000-80032013-00010200-E000000F
CPUID 8000001E: 00000013-00000101-00000000-00000000
CPUID 8FFFFFFF: 00000000-00000000-00000000-00000000

------[ All CPUs ]------

CPU   0: APICID   16 / Package 0 / Core   0 / Thread 0: Valid
CPU   1: APICID   17 / Package 0 / Core   1 / Thread 0: Valid
CPU   2: APICID   18 / Package 0 / Core   2 / Thread 0: Valid
CPU   3: APICID   19 / Package 0 / Core   3 / Thread 0: Valid

------[ MSR Registers / Logical CPU #0 ]------

CPU Clock (Normal): 2127 MHz
CPU Clock (TSC): 2096 MHz
CPU Multiplier: 21.0x
CPB PStates: 3
MSR 0000001B: 0000-0000-FEE0-0900
MSR 0000008B: 0000-0000-0600-3109
MSR 000000E7: 0000-0000-01E7-FF60 [S200]
MSR 000000E7: 0000-0000-0003-AE48 [S200]
MSR 000000E7: 0000-0000-0002-1C70
MSR 000000E8: 0000-0000-0002-A666 [S200]
MSR 000000E8: 0000-0000-0004-09A3 [S200]
MSR 000000E8: 0000-0000-0002-1D15
MSR C0010004: 0000-0000-0F08-7E0E
MSR C0010005: 0000-0000-0000-0000
MSR C0010006: 0000-0000-0000-0000
MSR C0010007: 0000-0000-0000-0000
MSR C0010015: 0000-0000-0B00-0011
MSR C001001F: 0040-4000-0885-0000
MSR C0010055: 0000-0000-0000-0000
MSR C0010058: 0000-0000-E000-0021
MSR C0010061: 0000-0000-0000-0040
MSR C0010062: 0000-0000-0000-0000
MSR C0010063: 0000-0000-0000-0000
MSR C0010064: 8000-014D-0000-7411 [33.00x] [1.1875 V] [ 7.70 A] [PState Pb0]
MSR C0010065: 8000-015F-0000-A80C [28.00x] [1.0250 V] [ 9.50 A] [PState Pb1]
MSR C0010066: 8000-0152-0000-B009 [25.00x] [1.0000 V] [ 8.20 A] [PState Pb2]
MSR C0010067: 8000-0137-0000-C805 [21.00x] [0.9250 V] [ 5.50 A] [PState P0]
MSR C0010068: 8000-012F-0000-D056 [19.00x] [0.9000 V] [ 4.70 A] [PState P1]
MSR C0010069: 8000-0125-0000-E850 [16.00x] [0.8250 V] [ 3.70 A] [PState P2]
MSR C001006A: 8000-011C-0000-F04A [13.00x] [0.8000 V] [ 2.80 A] [PState P3]
MSR C001006B: 8000-02ED-0040-F846 [11.00x] [0.7750 V] [ 2.37 A] [PState P4]
MSR C0010070: 0000-0000-6803-C805
MSR C0010071: 6342-0006-6843-C805 [21.00x] [0.1250V]
MSR C0010071: 6342-0006-6843-C805 [21.00x] [0.1250V]
MSR C0010071: 6342-0006-6843-C805 [21.00x] [0.1250V]
MSR C0010071: 6342-0006-6843-C805 [21.00x] [0.1250V]
MSR C0010071: 6342-0006-6843-C805 [21.00x] [0.1250V]
MSR C0010140: 0000-0000-0000-0004
MSR C0010141: 0000-0000-0000-0000
MSR C0011023: 8102-4004-0078-1220

------[ MSR Registers / Logical CPU #1 ]------

CPU Clock (Normal): 2127 MHz
CPU Clock (TSC): 2096 MHz
CPU Multiplier: 21.0x
CPB PStates: 3
MSR 0000001B: 0000-0000-FEE0-0900
MSR 0000008B: 0000-0000-0600-3109
MSR 000000E7: 0000-0000-01E8-8374
MSR 000000E8: 0000-0000-01E8-A1A9
MSR C0010004: 0000-0000-0F08-7E0E
MSR C0010005: 0000-0000-0000-0000
MSR C0010006: 0000-0000-0000-0000
MSR C0010007: 0000-0000-0000-0000
MSR C0010015: 0000-0000-0B00-0011
MSR C001001F: 0040-4000-0885-0000
MSR C0010055: 0000-0000-0000-0000
MSR C0010058: 0000-0000-E000-0021
MSR C0010061: 0000-0000-0000-0040
MSR C0010062: 0000-0000-0000-0000
MSR C0010063: 0000-0000-0000-0000
MSR C0010064: 8000-014D-0000-7411 [33.00x] [1.1875 V] [ 7.70 A] [PState Pb0]
MSR C0010065: 8000-015F-0000-A80C [28.00x] [1.0250 V] [ 9.50 A] [PState Pb1]
MSR C0010066: 8000-0152-0000-B009 [25.00x] [1.0000 V] [ 8.20 A] [PState Pb2]
MSR C0010067: 8000-0137-0000-C805 [21.00x] [0.9250 V] [ 5.50 A] [PState P0]
MSR C0010068: 8000-012F-0000-D056 [19.00x] [0.9000 V] [ 4.70 A] [PState P1]
MSR C0010069: 8000-0125-0000-E850 [16.00x] [0.8250 V] [ 3.70 A] [PState P2]
MSR C001006A: 8000-011C-0000-F04A [13.00x] [0.8000 V] [ 2.80 A] [PState P3]
MSR C001006B: 8000-02ED-0040-F846 [11.00x] [0.7750 V] [ 2.37 A] [PState P4]
MSR C0010070: 0000-0000-6803-C805
MSR C0010071: 6342-0006-6843-C805 [21.00x] [0.1250V]
MSR C0010071: 6342-0006-6843-C805 [21.00x] [0.1250V]
MSR C0010071: 6342-0006-6843-C805 [21.00x] [0.1250V]
MSR C0010071: 6342-0006-6843-C805 [21.00x] [0.1250V]
MSR C0010071: 6342-0006-6843-C805 [21.00x] [0.1250V]
MSR C0010140: 0000-0000-0000-0004
MSR C0010141: 0000-0000-0000-0000
MSR C0011023: 8102-4004-0078-1220

------[ MSR Registers / Logical CPU #2 ]------

CPU Clock (Normal): 2127 MHz
CPU Clock (TSC): 2096 MHz
CPU Multiplier: 21.0x
CPB PStates: 3
MSR 0000001B: 0000-0000-FEE0-0900
MSR 0000008B: 0000-0000-0600-3109
MSR 000000E7: 0000-0000-01EB-AB7E
MSR 000000E8: 0000-0000-01EB-FD96
MSR C0010004: 0000-0000-0F08-7E0E
MSR C0010005: 0000-0000-0000-0000
MSR C0010006: 0000-0000-0000-0000
MSR C0010007: 0000-0000-0000-0000
MSR C0010015: 0000-0000-0B00-0011
MSR C001001F: 0040-4000-0885-0000
MSR C0010055: 0000-0000-0000-0000
MSR C0010058: 0000-0000-E000-0021
MSR C0010061: 0000-0000-0000-0040
MSR C0010062: 0000-0000-0000-0000
MSR C0010063: 0000-0000-0000-0000
MSR C0010064: 8000-014D-0000-7411 [33.00x] [1.1875 V] [ 7.70 A] [PState Pb0]
MSR C0010065: 8000-015F-0000-A80C [28.00x] [1.0250 V] [ 9.50 A] [PState Pb1]
MSR C0010066: 8000-0152-0000-B009 [25.00x] [1.0000 V] [ 8.20 A] [PState Pb2]
MSR C0010067: 8000-0137-0000-C805 [21.00x] [0.9250 V] [ 5.50 A] [PState P0]
MSR C0010068: 8000-012F-0000-D056 [19.00x] [0.9000 V] [ 4.70 A] [PState P1]
MSR C0010069: 8000-0125-0000-E850 [16.00x] [0.8250 V] [ 3.70 A] [PState P2]
MSR C001006A: 8000-011C-0000-F04A [13.00x] [0.8000 V] [ 2.80 A] [PState P3]
MSR C001006B: 8000-02ED-0040-F846 [11.00x] [0.7750 V] [ 2.37 A] [PState P4]
MSR C0010070: 0000-0000-6803-C805
MSR C0010071: 6342-0006-6843-C805 [21.00x] [0.1250V]
MSR C0010071: 6342-0006-6843-C805 [21.00x] [0.1250V]
MSR C0010071: 6342-0006-6843-C805 [21.00x] [0.1250V]
MSR C0010071: 6342-0006-6843-C805 [21.00x] [0.1250V]
MSR C0010071: 6342-0006-6843-C805 [21.00x] [0.1250V]
MSR C0010140: 0000-0000-0000-0004
MSR C0010141: 0000-0000-0000-0000
MSR C0011023: 8102-4004-0078-1220

------[ MSR Registers / Logical CPU #3 ]------

CPU Clock (Normal): 2127 MHz
CPU Clock (TSC): 2096 MHz
CPU Multiplier: 21.0x
CPB PStates: 3
MSR 0000001B: 0000-0000-FEE0-0900
MSR 0000008B: 0000-0000-0600-3109
MSR 000000E7: 0000-0000-01E9-82F7
MSR 000000E8: 0000-0000-01E9-DD39
MSR C0010004: 0000-0000-0F08-7E0E
MSR C0010005: 0000-0000-0000-0000
MSR C0010006: 0000-0000-0000-0000
MSR C0010007: 0000-0000-0000-0000
MSR C0010015: 0000-0000-0B00-0011
MSR C001001F: 0040-4000-0885-0000
MSR C0010055: 0000-0000-0000-0000
MSR C0010058: 0000-0000-E000-0021
MSR C0010061: 0000-0000-0000-0040
MSR C0010062: 0000-0000-0000-0000
MSR C0010063: 0000-0000-0000-0000
MSR C0010064: 8000-014D-0000-7411 [33.00x] [1.1875 V] [ 7.70 A] [PState Pb0]
MSR C0010065: 8000-015F-0000-A80C [28.00x] [1.0250 V] [ 9.50 A] [PState Pb1]
MSR C0010066: 8000-0152-0000-B009 [25.00x] [1.0000 V] [ 8.20 A] [PState Pb2]
MSR C0010067: 8000-0137-0000-C805 [21.00x] [0.9250 V] [ 5.50 A] [PState P0]
MSR C0010068: 8000-012F-0000-D056 [19.00x] [0.9000 V] [ 4.70 A] [PState P1]
MSR C0010069: 8000-0125-0000-E850 [16.00x] [0.8250 V] [ 3.70 A] [PState P2]
MSR C001006A: 8000-011C-0000-F04A [13.00x] [0.8000 V] [ 2.80 A] [PState P3]
MSR C001006B: 8000-02ED-0040-F846 [11.00x] [0.7750 V] [ 2.37 A] [PState P4]
MSR C0010070: 0000-0000-6803-C805
MSR C0010071: 6342-0006-6843-C805 [21.00x] [0.1250V]
MSR C0010071: 6342-0006-6843-C805 [21.00x] [0.1250V]
MSR C0010071: 6342-0006-6843-C805 [21.00x] [0.1250V]
MSR C0010071: 6342-0006-6843-C805 [21.00x] [0.1250V]
MSR C0010071: 6342-0006-6843-C805 [21.00x] [0.1250V]
MSR C0010140: 0000-0000-0000-0004
MSR C0010141: 0000-0000-0000-0000
MSR C0011023: 8102-4004-0078-1220

PerformanceFrequency = 10000000

CPU Clock M.Method = 6  (APIC K10)
PM Timer Address   = 1032  (0408h)

APIC Clock = 101.28 MHz  (AT = 53079 / TT = 15008 / try = 1 / SKL = 0.00 MHz)
APIC Clock = 101.28 MHz  (AT = 53079 / TT = 15008 / try = 1 / SKL = 0.00 MHz)
APIC Clock = 101.28 MHz  (AT = 53079 / TT = 15008 / try = 1 / SKL = 0.00 MHz)
APIC Clock = 101.28 MHz  (AT = 53079 / TT = 15008 / try = 1 / SKL = 0.00 MHz)
APIC Clock = 101.28 MHz  (AT = 53079 / TT = 15008 / try = 1 / SKL = 0.00 MHz)

CPU Clock = 2126.85 MHz / TSC Clock = 2096.10 MHz / CPU Mul = 21.00x
CPU Clock = 2126.85 MHz / TSC Clock = 2096.07 MHz / CPU Mul = 21.00x
CPU Clock = 2126.85 MHz / TSC Clock = 2096.10 MHz / CPU Mul = 21.00x
CPU Clock = 2126.85 MHz / TSC Clock = 2096.06 MHz / CPU Mul = 21.00x
CPU Clock = 2126.85 MHz / TSC Clock = 2096.07 MHz / CPU Mul = 21.00x

CPU Clock Max = 2126.85 MHz / TSC Clock = 2096.08 MHz / CPU Mul = 21.00x
CPU Clock Max = 2126.85 MHz / TSC Clock = 2096.08 MHz / CPU Mul = 21.00x
CPU Clock Max = 2126.85 MHz / TSC Clock = 2096.09 MHz / CPU Mul = 21.00x
CPU Clock Max = 2126.85 MHz / TSC Clock = 2096.07 MHz / CPU Mul = 21.00x
CPU Clock Max = 2126.85 MHz / TSC Clock = 2096.05 MHz / CPU Mul = 21.00x
