------[ Versions ]------

Program Version : EVEREST v5.30.1900
BenchDLL Version: 2.4.273.0

------[ CPU Info ]------

CPU Type           : AMD K6-2, 450 MHz (4.5 x 100)
CPU Alias          : Chomper Extended, K6-2-CXT
CPU Platform       : Socket 7
CPU Stepping       : CXT/A
Instruction Set    : x86, MMX, 3DNow!
CPUID Manufacturer : AuthenticAMD
CPUID CPU Name     : AMD-K6(tm) 3D processor
CPUID Revision     : 0000058Ch
Platform ID        : CBh  (Socket 7)

------[ Logical CPU #0 ]------

allcpu: Valid

CPUID 00000000: 00000001-68747541-444D4163-69746E65
CPUID 00000001: 0000058C-00000000-00000000-008021BF
CPUID 80000000: 80000005-00000000-00000000-00000000
CPUID 80000001: 0000068C-00000000-00000000-808029BF
CPUID 80000002: 2D444D41-7428364B-3320296D-72702044
CPUID 80000003: 7365636F-00726F73-00000000-00000000
CPUID 80000004: 00000000-00000000-00000000-00000000
CPUID 80000005: 00000000-02800140-20020220-20020220
CPUID 8FFFFFFF: 4778654E-72656E65-6F697461-444D416E

------[ MSR Registers ]------

MSR C0000087: 0000-0000-0000-01C0

PerformanceFrequency = 1193182

Tjmax Temperature = 0 Celsius
