CPU#000 AffMask: 0x0000000000000001 
CPUID 00000000: 0000000D-68747541-444D4163-69746E65 [AuthenticAMD]
CPUID 00000001: 00810F81-00040800-7ED8320B-178BFBFF 
CPUID 00000002: 00000000-00000000-00000000-00000000 
CPUID 00000003: 00000000-00000000-00000000-00000000 
CPUID 00000004: 00000000-00000000-00000000-00000000 [SL 00]
CPUID 00000005: 00000040-00000040-00000003-00000011 
CPUID 00000006: 00000004-00000000-00000001-00000000 
CPUID 00000007: 00000000-209C01A9-00000000-00000000 [SL 00]
CPUID 00000008: 00000000-00000000-00000000-00000000 
CPUID 00000009: 00000000-00000000-00000000-00000000 
CPUID 0000000A: 00000000-00000000-00000000-00000000 
CPUID 0000000B: 00000000-00000000-00000000-00000000 [SL 00]
CPUID 0000000C: 00000000-00000000-00000000-00000000 
CPUID 0000000D: 00000007-00000340-00000340-00000000 [SL 00]
CPUID 0000000D: 0000000F-00000340-00000000-00000000 [SL 01]
CPUID 0000000D: 00000000-00000000-00000000-00000000 [SL 02]
CPUID 80000000: 8000001F-68747541-444D4163-69746E65 
CPUID 80000001: 00810F81-20000000-35C233FF-2FD3FBFF 
CPUID 80000002: 20444D41-6C687441-50206E6F-33204F52 [AMD Athlon PRO 3]
CPUID 80000003: 45473030-202F7720-65646152-56206E6F [00GE w/ Radeon V]
CPUID 80000004: 20616765-70617247-73636968-00202020 [ega Graphics   ]
CPUID 80000005: FF40FF40-FF40FF40-20080140-40040140 
CPUID 80000006: 26006400-66006400-02006140-00208140 
CPUID 80000007: 00000000-0000001B-00000000-00006599 
CPUID 80000008: 00003030-00001007-00004003-00000000 
CPUID 80000009: 00000000-00000000-00000000-00000000 
CPUID 8000000A: 00000001-00008000-00000000-0001BCFF 
CPUID 8000000B: 00000000-00000000-00000000-00000000 
CPUID 8000000C: 00000000-00000000-00000000-00000000 
CPUID 8000000D: 00000000-00000000-00000000-00000000 
CPUID 8000000E: 00000000-00000000-00000000-00000000 
CPUID 8000000F: 00000000-00000000-00000000-00000000 
CPUID 80000010: 00000000-00000000-00000000-00000000 
CPUID 80000011: 00000000-00000000-00000000-00000000 
CPUID 80000012: 00000000-00000000-00000000-00000000 
CPUID 80000013: 00000000-00000000-00000000-00000000 
CPUID 80000014: 00000000-00000000-00000000-00000000 
CPUID 80000015: 00000000-00000000-00000000-00000000 
CPUID 80000016: 00000000-00000000-00000000-00000000 
CPUID 80000017: 00000000-00000000-00000000-00000000 
CPUID 80000018: 00000000-00000000-00000000-00000000 
CPUID 80000019: F040F040-00000000-00000000-00000000 
CPUID 8000001A: 00000003-00000000-00000000-00000000 
CPUID 8000001B: 000003FF-00000000-00000000-00000000 
CPUID 8000001C: 00000000-00000000-00000000-00000000 
CPUID 8000001D: 00004121-01C0003F-0000003F-00000000 [SL 00]
CPUID 8000001D: 00004122-00C0003F-000000FF-00000000 [SL 01]
CPUID 8000001D: 00004143-01C0003F-000003FF-00000002 [SL 02]
CPUID 8000001D: 0000C163-03C0003F-00000FFF-00000001 [SL 03]
CPUID 8000001E: 00000000-00000100-00000000-00000000 
CPUID 8000001F: 0000000F-0000016F-0000000F-00000000 

CPU#001 AffMask: 0x0000000000000002 
CPUID 00000000: 0000000D-68747541-444D4163-69746E65 [AuthenticAMD]
CPUID 00000001: 00810F81-01040800-7ED8320B-178BFBFF 
CPUID 00000002: 00000000-00000000-00000000-00000000 
CPUID 00000003: 00000000-00000000-00000000-00000000 
CPUID 00000004: 00000000-00000000-00000000-00000000 [SL 00]
CPUID 00000005: 00000040-00000040-00000003-00000011 
CPUID 00000006: 00000004-00000000-00000001-00000000 
CPUID 00000007: 00000000-209C01A9-00000000-00000000 [SL 00]
CPUID 00000008: 00000000-00000000-00000000-00000000 
CPUID 00000009: 00000000-00000000-00000000-00000000 
CPUID 0000000A: 00000000-00000000-00000000-00000000 
CPUID 0000000B: 00000000-00000000-00000000-00000000 [SL 00]
CPUID 0000000C: 00000000-00000000-00000000-00000000 
CPUID 0000000D: 00000007-00000340-00000340-00000000 [SL 00]
CPUID 0000000D: 0000000F-00000340-00000000-00000000 [SL 01]
CPUID 0000000D: 00000000-00000000-00000000-00000000 [SL 02]
CPUID 80000000: 8000001F-68747541-444D4163-69746E65 
CPUID 80000001: 00810F81-20000000-35C233FF-2FD3FBFF 
CPUID 80000002: 20444D41-6C687441-50206E6F-33204F52 [AMD Athlon PRO 3]
CPUID 80000003: 45473030-202F7720-65646152-56206E6F [00GE w/ Radeon V]
CPUID 80000004: 20616765-70617247-73636968-00202020 [ega Graphics   ]
CPUID 80000005: FF40FF40-FF40FF40-20080140-40040140 
CPUID 80000006: 26006400-66006400-02006140-00208140 
CPUID 80000007: 00000000-0000001B-00000000-00006599 
CPUID 80000008: 00003030-00001007-00004003-00000000 
CPUID 80000009: 00000000-00000000-00000000-00000000 
CPUID 8000000A: 00000001-00008000-00000000-0001BCFF 
CPUID 8000000B: 00000000-00000000-00000000-00000000 
CPUID 8000000C: 00000000-00000000-00000000-00000000 
CPUID 8000000D: 00000000-00000000-00000000-00000000 
CPUID 8000000E: 00000000-00000000-00000000-00000000 
CPUID 8000000F: 00000000-00000000-00000000-00000000 
CPUID 80000010: 00000000-00000000-00000000-00000000 
CPUID 80000011: 00000000-00000000-00000000-00000000 
CPUID 80000012: 00000000-00000000-00000000-00000000 
CPUID 80000013: 00000000-00000000-00000000-00000000 
CPUID 80000014: 00000000-00000000-00000000-00000000 
CPUID 80000015: 00000000-00000000-00000000-00000000 
CPUID 80000016: 00000000-00000000-00000000-00000000 
CPUID 80000017: 00000000-00000000-00000000-00000000 
CPUID 80000018: 00000000-00000000-00000000-00000000 
CPUID 80000019: F040F040-00000000-00000000-00000000 
CPUID 8000001A: 00000003-00000000-00000000-00000000 
CPUID 8000001B: 000003FF-00000000-00000000-00000000 
CPUID 8000001C: 00000000-00000000-00000000-00000000 
CPUID 8000001D: 00004121-01C0003F-0000003F-00000000 [SL 00]
CPUID 8000001D: 00004122-00C0003F-000000FF-00000000 [SL 01]
CPUID 8000001D: 00004143-01C0003F-000003FF-00000002 [SL 02]
CPUID 8000001D: 0000C163-03C0003F-00000FFF-00000001 [SL 03]
CPUID 8000001E: 00000001-00000100-00000000-00000000 
CPUID 8000001F: 0000000F-0000016F-0000000F-00000000 

CPU#002 AffMask: 0x0000000000000004 
CPUID 00000000: 0000000D-68747541-444D4163-69746E65 [AuthenticAMD]
CPUID 00000001: 00810F81-02040800-7ED8320B-178BFBFF 
CPUID 00000002: 00000000-00000000-00000000-00000000 
CPUID 00000003: 00000000-00000000-00000000-00000000 
CPUID 00000004: 00000000-00000000-00000000-00000000 [SL 00]
CPUID 00000005: 00000040-00000040-00000003-00000011 
CPUID 00000006: 00000004-00000000-00000001-00000000 
CPUID 00000007: 00000000-209C01A9-00000000-00000000 [SL 00]
CPUID 00000008: 00000000-00000000-00000000-00000000 
CPUID 00000009: 00000000-00000000-00000000-00000000 
CPUID 0000000A: 00000000-00000000-00000000-00000000 
CPUID 0000000B: 00000000-00000000-00000000-00000000 [SL 00]
CPUID 0000000C: 00000000-00000000-00000000-00000000 
CPUID 0000000D: 00000007-00000340-00000340-00000000 [SL 00]
CPUID 0000000D: 0000000F-00000340-00000000-00000000 [SL 01]
CPUID 0000000D: 00000000-00000000-00000000-00000000 [SL 02]
CPUID 80000000: 8000001F-68747541-444D4163-69746E65 
CPUID 80000001: 00810F81-20000000-35C233FF-2FD3FBFF 
CPUID 80000002: 20444D41-6C687441-50206E6F-33204F52 [AMD Athlon PRO 3]
CPUID 80000003: 45473030-202F7720-65646152-56206E6F [00GE w/ Radeon V]
CPUID 80000004: 20616765-70617247-73636968-00202020 [ega Graphics   ]
CPUID 80000005: FF40FF40-FF40FF40-20080140-40040140 
CPUID 80000006: 26006400-66006400-02006140-00208140 
CPUID 80000007: 00000000-0000001B-00000000-00006599 
CPUID 80000008: 00003030-00001007-00004003-00000000 
CPUID 80000009: 00000000-00000000-00000000-00000000 
CPUID 8000000A: 00000001-00008000-00000000-0001BCFF 
CPUID 8000000B: 00000000-00000000-00000000-00000000 
CPUID 8000000C: 00000000-00000000-00000000-00000000 
CPUID 8000000D: 00000000-00000000-00000000-00000000 
CPUID 8000000E: 00000000-00000000-00000000-00000000 
CPUID 8000000F: 00000000-00000000-00000000-00000000 
CPUID 80000010: 00000000-00000000-00000000-00000000 
CPUID 80000011: 00000000-00000000-00000000-00000000 
CPUID 80000012: 00000000-00000000-00000000-00000000 
CPUID 80000013: 00000000-00000000-00000000-00000000 
CPUID 80000014: 00000000-00000000-00000000-00000000 
CPUID 80000015: 00000000-00000000-00000000-00000000 
CPUID 80000016: 00000000-00000000-00000000-00000000 
CPUID 80000017: 00000000-00000000-00000000-00000000 
CPUID 80000018: 00000000-00000000-00000000-00000000 
CPUID 80000019: F040F040-00000000-00000000-00000000 
CPUID 8000001A: 00000003-00000000-00000000-00000000 
CPUID 8000001B: 000003FF-00000000-00000000-00000000 
CPUID 8000001C: 00000000-00000000-00000000-00000000 
CPUID 8000001D: 00004121-01C0003F-0000003F-00000000 [SL 00]
CPUID 8000001D: 00004122-00C0003F-000000FF-00000000 [SL 01]
CPUID 8000001D: 00004143-01C0003F-000003FF-00000002 [SL 02]
CPUID 8000001D: 0000C163-03C0003F-00000FFF-00000001 [SL 03]
CPUID 8000001E: 00000002-00000101-00000000-00000000 
CPUID 8000001F: 0000000F-0000016F-0000000F-00000000 

CPU#003 AffMask: 0x0000000000000008 
CPUID 00000000: 0000000D-68747541-444D4163-69746E65 [AuthenticAMD]
CPUID 00000001: 00810F81-03040800-7ED8320B-178BFBFF 
CPUID 00000002: 00000000-00000000-00000000-00000000 
CPUID 00000003: 00000000-00000000-00000000-00000000 
CPUID 00000004: 00000000-00000000-00000000-00000000 [SL 00]
CPUID 00000005: 00000040-00000040-00000003-00000011 
CPUID 00000006: 00000004-00000000-00000001-00000000 
CPUID 00000007: 00000000-209C01A9-00000000-00000000 [SL 00]
CPUID 00000008: 00000000-00000000-00000000-00000000 
CPUID 00000009: 00000000-00000000-00000000-00000000 
CPUID 0000000A: 00000000-00000000-00000000-00000000 
CPUID 0000000B: 00000000-00000000-00000000-00000000 [SL 00]
CPUID 0000000C: 00000000-00000000-00000000-00000000 
CPUID 0000000D: 00000007-00000340-00000340-00000000 [SL 00]
CPUID 0000000D: 0000000F-00000340-00000000-00000000 [SL 01]
CPUID 0000000D: 00000000-00000000-00000000-00000000 [SL 02]
CPUID 80000000: 8000001F-68747541-444D4163-69746E65 
CPUID 80000001: 00810F81-20000000-35C233FF-2FD3FBFF 
CPUID 80000002: 20444D41-6C687441-50206E6F-33204F52 [AMD Athlon PRO 3]
CPUID 80000003: 45473030-202F7720-65646152-56206E6F [00GE w/ Radeon V]
CPUID 80000004: 20616765-70617247-73636968-00202020 [ega Graphics   ]
CPUID 80000005: FF40FF40-FF40FF40-20080140-40040140 
CPUID 80000006: 26006400-66006400-02006140-00208140 
CPUID 80000007: 00000000-0000001B-00000000-00006599 
CPUID 80000008: 00003030-00001007-00004003-00000000 
CPUID 80000009: 00000000-00000000-00000000-00000000 
CPUID 8000000A: 00000001-00008000-00000000-0001BCFF 
CPUID 8000000B: 00000000-00000000-00000000-00000000 
CPUID 8000000C: 00000000-00000000-00000000-00000000 
CPUID 8000000D: 00000000-00000000-00000000-00000000 
CPUID 8000000E: 00000000-00000000-00000000-00000000 
CPUID 8000000F: 00000000-00000000-00000000-00000000 
CPUID 80000010: 00000000-00000000-00000000-00000000 
CPUID 80000011: 00000000-00000000-00000000-00000000 
CPUID 80000012: 00000000-00000000-00000000-00000000 
CPUID 80000013: 00000000-00000000-00000000-00000000 
CPUID 80000014: 00000000-00000000-00000000-00000000 
CPUID 80000015: 00000000-00000000-00000000-00000000 
CPUID 80000016: 00000000-00000000-00000000-00000000 
CPUID 80000017: 00000000-00000000-00000000-00000000 
CPUID 80000018: 00000000-00000000-00000000-00000000 
CPUID 80000019: F040F040-00000000-00000000-00000000 
CPUID 8000001A: 00000003-00000000-00000000-00000000 
CPUID 8000001B: 000003FF-00000000-00000000-00000000 
CPUID 8000001C: 00000000-00000000-00000000-00000000 
CPUID 8000001D: 00004121-01C0003F-0000003F-00000000 [SL 00]
CPUID 8000001D: 00004122-00C0003F-000000FF-00000000 [SL 01]
CPUID 8000001D: 00004143-01C0003F-000003FF-00000002 [SL 02]
CPUID 8000001D: 0000C163-03C0003F-00000FFF-00000001 [SL 03]
CPUID 8000001E: 00000003-00000101-00000000-00000000 
CPUID 8000001F: 0000000F-0000016F-0000000F-00000000 
