------[ CPUID Registers / Logical CPU #0 ]------

allcpu: Package 0 / Core 0 / Thread 0: Valid, AMD P-core

CPUID 00000000: 00000010-68747541-444D4163-69746E65 [AuthenticAMD]
CPUID 00000001: 00A60F12-00080800-7ED8320B-178BFBFF
CPUID 00000002: 00000000-00000000-00000000-00000000
CPUID 00000003: 00000000-00000000-00000000-00000000
CPUID 00000005: 00000040-00000040-00000003-00000011
CPUID 00000006: 00000004-00000000-00000001-00000000
CPUID 00000007: 00000001-F1BF97A9-00405FCE-10000010 [SL 00]
CPUID 00000007: 00000020-00000000-00000000-00000000 [SL 01]
CPUID 00000008: 00000000-00000000-00000000-00000000
CPUID 00000009: 00000000-00000000-00000000-00000000
CPUID 0000000A: 00000000-00000000-00000000-00000000
CPUID 0000000B: 00000001-00000002-00000100-00000000 [SL 00]
CPUID 0000000B: 00000003-00000008-00000201-00000000 [SL 01]
CPUID 0000000C: 00000000-00000000-00000000-00000000
CPUID 0000000D: 000002E7-00000980-00000988-00000000 [SL 00] [x87]
CPUID 0000000D: 0000000F-00000990-00001800-00000000 [SL 01] [SSE]
CPUID 0000000D: 00000100-00000240-00000000-00000000 [SL 02] [AVX]
CPUID 0000000D: 00000040-00000340-00000000-00000000 [SL 05] [AVX-512 Opmask]
CPUID 0000000D: 00000200-00000380-00000000-00000000 [SL 06] [AVX-512 Hi256]
CPUID 0000000D: 00000400-00000580-00000000-00000000 [SL 07] [AVX-512 Hi16]
CPUID 0000000D: 00000008-00000980-00000000-00000000 [SL 09] [PKRU]
CPUID 0000000D: 00000010-00000000-00000001-00000000 [SL 0B] [CET_U]
CPUID 0000000D: 00000018-00000000-00000001-00000000 [SL 0C] [CET_S]
CPUID 0000000E: 00000000-00000000-00000000-00000000
CPUID 0000000F: 00000000-000000FF-00000000-00000002 [SL 00]
CPUID 0000000F: 00000014-00000040-000000FF-00000007 [SL 01]
CPUID 00000010: 00000000-00000002-00000000-00000000 [SL 00]
CPUID 00000010: 0000000F-00000000-00000004-0000000F [SL 01]
CPUID 80000000: 80000028-68747541-444D4163-69746E65 [AuthenticAMD]
CPUID 80000001: 00A60F12-00000000-75C237FF-2FD3FBFF
CPUID 80000002: 20444D41-43595045-32313420-34205034 [AMD EPYC 4124P 4]
CPUID 80000003: 726F432D-72502065-7365636F-20726F73 [-Core Processor ]
CPUID 80000004: 20202020-20202020-20202020-00202020 [               ]
CPUID 80000005: FF48FF40-FF48FF40-20080140-20080140 [L1D: 32 KB / L1I: 32 KB]
CPUID 80000006: 5C002200-6C004200-04006140-00809140 [L2: 1024 KB / L3: 16384 KB]
CPUID 80000007: 00000000-0000003B-00000000-00006799
CPUID 80000008: 00003030-791EF257-00003007-00010000
CPUID 80000009: 00000000-00000000-00000000-00000000
CPUID 8000000A: 00000001-00008000-00000000-1EBFBCFF
CPUID 8000000B: 00000000-00000000-00000000-00000000
CPUID 8000000C: 00000000-00000000-00000000-00000000
CPUID 8000000D: 00000000-00000000-00000000-00000000
CPUID 8000000E: 00000000-00000000-00000000-00000000
CPUID 8000000F: 00000000-00000000-00000000-00000000
CPUID 80000010: 00000000-00000000-00000000-00000000
CPUID 80000011: 00000000-00000000-00000000-00000000
CPUID 80000012: 00000000-00000000-00000000-00000000
CPUID 80000013: 00000000-00000000-00000000-00000000
CPUID 80000014: 00000000-00000000-00000000-00000000
CPUID 80000015: 00000000-00000000-00000000-00000000
CPUID 80000016: 00000000-00000000-00000000-00000000
CPUID 80000017: 00000000-00000000-00000000-00000000
CPUID 80000018: 00000000-00000000-00000000-00000000
CPUID 80000019: F048F040-F0400000-00000000-00000000
CPUID 8000001A: 00000006-00000000-00000000-00000000
CPUID 8000001B: 00000BFF-00000000-00000000-00000000
CPUID 8000001C: 00000000-00000000-00000000-00000000
CPUID 8000001D: 00004121-01C0003F-0000003F-00000000 [SL 00] [L1D: 32 KB]
CPUID 8000001D: 00004122-01C0003F-0000003F-00000000 [SL 01] [L1I: 32 KB]
CPUID 8000001D: 00004143-01C0003F-000007FF-00000002 [SL 02] [L2U: 1 MB]
CPUID 8000001D: 0001C163-03C0003F-00003FFF-00000001 [SL 03] [L3U: 16 MB]
CPUID 8000001E: 00000000-00000100-00000000-00000000
CPUID 8000001F: 00000001-000000B3-00000000-00000000
CPUID 80000020: 00000000-0000001E-00000000-00000000 [SL 00]
CPUID 80000020: 0000000B-00000000-00000000-0000000F [SL 01]
CPUID 80000020: 0000000B-00000000-00000000-0000000F [SL 02]
CPUID 80000020: 00000000-00000002-0000007F-00000000 [SL 03]
CPUID 80000021: 00062FCF-0000015C-00000000-00000000
CPUID 80000022: 00000007-00084106-00000003-00000000
CPUID 80000023: 00000000-00000000-00000000-00000000
CPUID 80000024: 00000000-00000000-00000000-00000000
CPUID 80000025: 00000000-00000000-00000000-00000000
CPUID 80000026: 00000001-00000002-00000100-00000000 [SL 00] [P-core]
CPUID 80000026: 00000003-00000008-00000201-00000000 [SL 01]
CPUID 80000026: 00000003-00000008-00000302-00000000 [SL 02]
CPUID 80000026: 00000003-00000008-00000403-00000000 [SL 03]
CPUID 80000027: 00000000-00000000-00000000-00000000
CPUID 80000028: 00000000-00000000-00000000-00000000
CPUID 8FFFFFFF: 00000000-00000000-00000000-00000000

L1    Data Cache:    32 KB,  8-way Associative, 64-byte Line
L1  Instr. Cache:    32 KB,  8-way Associative, 64-byte Line
L2 Unified Cache:     1 MB,  8-way Associative, 64-byte Line
L3 Unified Cache:    16 MB, 16-way Associative, 64-byte Line

------[ CPUID Registers / Logical CPU #1 ]------

allcpu: Package 0 / Core 0 / Thread 1: Valid, Virtual, AMD P-core

CPUID 00000000: 00000010-68747541-444D4163-69746E65 [AuthenticAMD]
CPUID 00000001: 00A60F12-01080800-7ED8320B-178BFBFF
CPUID 00000002: 00000000-00000000-00000000-00000000
CPUID 00000003: 00000000-00000000-00000000-00000000
CPUID 00000005: 00000040-00000040-00000003-00000011
CPUID 00000006: 00000004-00000000-00000001-00000000
CPUID 00000007: 00000001-F1BF97A9-00405FCE-10000010 [SL 00]
CPUID 00000007: 00000020-00000000-00000000-00000000 [SL 01]
CPUID 00000008: 00000000-00000000-00000000-00000000
CPUID 00000009: 00000000-00000000-00000000-00000000
CPUID 0000000A: 00000000-00000000-00000000-00000000
CPUID 0000000B: 00000001-00000002-00000100-00000001 [SL 00]
CPUID 0000000B: 00000003-00000008-00000201-00000001 [SL 01]
CPUID 0000000C: 00000000-00000000-00000000-00000000
CPUID 0000000D: 000002E7-00000980-00000988-00000000 [SL 00] [x87]
CPUID 0000000D: 0000000F-00000990-00001800-00000000 [SL 01] [SSE]
CPUID 0000000D: 00000100-00000240-00000000-00000000 [SL 02] [AVX]
CPUID 0000000D: 00000040-00000340-00000000-00000000 [SL 05] [AVX-512 Opmask]
CPUID 0000000D: 00000200-00000380-00000000-00000000 [SL 06] [AVX-512 Hi256]
CPUID 0000000D: 00000400-00000580-00000000-00000000 [SL 07] [AVX-512 Hi16]
CPUID 0000000D: 00000008-00000980-00000000-00000000 [SL 09] [PKRU]
CPUID 0000000D: 00000010-00000000-00000001-00000000 [SL 0B] [CET_U]
CPUID 0000000D: 00000018-00000000-00000001-00000000 [SL 0C] [CET_S]
CPUID 0000000E: 00000000-00000000-00000000-00000000
CPUID 0000000F: 00000000-000000FF-00000000-00000002 [SL 00]
CPUID 0000000F: 00000014-00000040-000000FF-00000007 [SL 01]
CPUID 00000010: 00000000-00000002-00000000-00000000 [SL 00]
CPUID 00000010: 0000000F-00000000-00000004-0000000F [SL 01]
CPUID 80000000: 80000028-68747541-444D4163-69746E65 [AuthenticAMD]
CPUID 80000001: 00A60F12-00000000-75C237FF-2FD3FBFF
CPUID 80000002: 20444D41-43595045-32313420-34205034 [AMD EPYC 4124P 4]
CPUID 80000003: 726F432D-72502065-7365636F-20726F73 [-Core Processor ]
CPUID 80000004: 20202020-20202020-20202020-00202020 [               ]
CPUID 80000005: FF48FF40-FF48FF40-20080140-20080140 [L1D: 32 KB / L1I: 32 KB]
CPUID 80000006: 5C002200-6C004200-04006140-00809140 [L2: 1024 KB / L3: 16384 KB]
CPUID 80000007: 00000000-0000003B-00000000-00006799
CPUID 80000008: 00003030-791EF257-00003007-00010000
CPUID 80000009: 00000000-00000000-00000000-00000000
CPUID 8000000A: 00000001-00008000-00000000-1EBFBCFF
CPUID 8000000B: 00000000-00000000-00000000-00000000
CPUID 8000000C: 00000000-00000000-00000000-00000000
CPUID 8000000D: 00000000-00000000-00000000-00000000
CPUID 8000000E: 00000000-00000000-00000000-00000000
CPUID 8000000F: 00000000-00000000-00000000-00000000
CPUID 80000010: 00000000-00000000-00000000-00000000
CPUID 80000011: 00000000-00000000-00000000-00000000
CPUID 80000012: 00000000-00000000-00000000-00000000
CPUID 80000013: 00000000-00000000-00000000-00000000
CPUID 80000014: 00000000-00000000-00000000-00000000
CPUID 80000015: 00000000-00000000-00000000-00000000
CPUID 80000016: 00000000-00000000-00000000-00000000
CPUID 80000017: 00000000-00000000-00000000-00000000
CPUID 80000018: 00000000-00000000-00000000-00000000
CPUID 80000019: F048F040-F0400000-00000000-00000000
CPUID 8000001A: 00000006-00000000-00000000-00000000
CPUID 8000001B: 00000BFF-00000000-00000000-00000000
CPUID 8000001C: 00000000-00000000-00000000-00000000
CPUID 8000001D: 00004121-01C0003F-0000003F-00000000 [SL 00] [L1D: 32 KB]
CPUID 8000001D: 00004122-01C0003F-0000003F-00000000 [SL 01] [L1I: 32 KB]
CPUID 8000001D: 00004143-01C0003F-000007FF-00000002 [SL 02] [L2U: 1 MB]
CPUID 8000001D: 0001C163-03C0003F-00003FFF-00000001 [SL 03] [L3U: 16 MB]
CPUID 8000001E: 00000001-00000100-00000000-00000000
CPUID 8000001F: 00000001-000000B3-00000000-00000000
CPUID 80000020: 00000000-0000001E-00000000-00000000 [SL 00]
CPUID 80000020: 0000000B-00000000-00000000-0000000F [SL 01]
CPUID 80000020: 0000000B-00000000-00000000-0000000F [SL 02]
CPUID 80000020: 00000000-00000002-0000007F-00000000 [SL 03]
CPUID 80000021: 00062FCF-0000015C-00000000-00000000
CPUID 80000022: 00000007-00084106-00000003-00000000
CPUID 80000023: 00000000-00000000-00000000-00000000
CPUID 80000024: 00000000-00000000-00000000-00000000
CPUID 80000025: 00000000-00000000-00000000-00000000
CPUID 80000026: 00000001-00000002-00000100-00000001 [SL 00] [P-core]
CPUID 80000026: 00000003-00000008-00000201-00000001 [SL 01]
CPUID 80000026: 00000003-00000008-00000302-00000001 [SL 02]
CPUID 80000026: 00000003-00000008-00000403-00000001 [SL 03]
CPUID 80000027: 00000000-00000000-00000000-00000000
CPUID 80000028: 00000000-00000000-00000000-00000000
CPUID 8FFFFFFF: 00000000-00000000-00000000-00000000

L1    Data Cache:    32 KB,  8-way Associative, 64-byte Line
L1  Instr. Cache:    32 KB,  8-way Associative, 64-byte Line
L2 Unified Cache:     1 MB,  8-way Associative, 64-byte Line
L3 Unified Cache:    16 MB, 16-way Associative, 64-byte Line

------[ CPUID Registers / Logical CPU #2 ]------

allcpu: Package 0 / Core 1 / Thread 0: Valid, AMD P-core

CPUID 00000000: 00000010-68747541-444D4163-69746E65 [AuthenticAMD]
CPUID 00000001: 00A60F12-02080800-7ED8320B-178BFBFF
CPUID 00000002: 00000000-00000000-00000000-00000000
CPUID 00000003: 00000000-00000000-00000000-00000000
CPUID 00000005: 00000040-00000040-00000003-00000011
CPUID 00000006: 00000004-00000000-00000001-00000000
CPUID 00000007: 00000001-F1BF97A9-00405FCE-10000010 [SL 00]
CPUID 00000007: 00000020-00000000-00000000-00000000 [SL 01]
CPUID 00000008: 00000000-00000000-00000000-00000000
CPUID 00000009: 00000000-00000000-00000000-00000000
CPUID 0000000A: 00000000-00000000-00000000-00000000
CPUID 0000000B: 00000001-00000002-00000100-00000002 [SL 00]
CPUID 0000000B: 00000003-00000008-00000201-00000002 [SL 01]
CPUID 0000000C: 00000000-00000000-00000000-00000000
CPUID 0000000D: 000002E7-00000980-00000988-00000000 [SL 00] [x87]
CPUID 0000000D: 0000000F-00000990-00001800-00000000 [SL 01] [SSE]
CPUID 0000000D: 00000100-00000240-00000000-00000000 [SL 02] [AVX]
CPUID 0000000D: 00000040-00000340-00000000-00000000 [SL 05] [AVX-512 Opmask]
CPUID 0000000D: 00000200-00000380-00000000-00000000 [SL 06] [AVX-512 Hi256]
CPUID 0000000D: 00000400-00000580-00000000-00000000 [SL 07] [AVX-512 Hi16]
CPUID 0000000D: 00000008-00000980-00000000-00000000 [SL 09] [PKRU]
CPUID 0000000D: 00000010-00000000-00000001-00000000 [SL 0B] [CET_U]
CPUID 0000000D: 00000018-00000000-00000001-00000000 [SL 0C] [CET_S]
CPUID 0000000E: 00000000-00000000-00000000-00000000
CPUID 0000000F: 00000000-000000FF-00000000-00000002 [SL 00]
CPUID 0000000F: 00000014-00000040-000000FF-00000007 [SL 01]
CPUID 00000010: 00000000-00000002-00000000-00000000 [SL 00]
CPUID 00000010: 0000000F-00000000-00000004-0000000F [SL 01]
CPUID 80000000: 80000028-68747541-444D4163-69746E65 [AuthenticAMD]
CPUID 80000001: 00A60F12-00000000-75C237FF-2FD3FBFF
CPUID 80000002: 20444D41-43595045-32313420-34205034 [AMD EPYC 4124P 4]
CPUID 80000003: 726F432D-72502065-7365636F-20726F73 [-Core Processor ]
CPUID 80000004: 20202020-20202020-20202020-00202020 [               ]
CPUID 80000005: FF48FF40-FF48FF40-20080140-20080140 [L1D: 32 KB / L1I: 32 KB]
CPUID 80000006: 5C002200-6C004200-04006140-00809140 [L2: 1024 KB / L3: 16384 KB]
CPUID 80000007: 00000000-0000003B-00000000-00006799
CPUID 80000008: 00003030-791EF257-00003007-00010000
CPUID 80000009: 00000000-00000000-00000000-00000000
CPUID 8000000A: 00000001-00008000-00000000-1EBFBCFF
CPUID 8000000B: 00000000-00000000-00000000-00000000
CPUID 8000000C: 00000000-00000000-00000000-00000000
CPUID 8000000D: 00000000-00000000-00000000-00000000
CPUID 8000000E: 00000000-00000000-00000000-00000000
CPUID 8000000F: 00000000-00000000-00000000-00000000
CPUID 80000010: 00000000-00000000-00000000-00000000
CPUID 80000011: 00000000-00000000-00000000-00000000
CPUID 80000012: 00000000-00000000-00000000-00000000
CPUID 80000013: 00000000-00000000-00000000-00000000
CPUID 80000014: 00000000-00000000-00000000-00000000
CPUID 80000015: 00000000-00000000-00000000-00000000
CPUID 80000016: 00000000-00000000-00000000-00000000
CPUID 80000017: 00000000-00000000-00000000-00000000
CPUID 80000018: 00000000-00000000-00000000-00000000
CPUID 80000019: F048F040-F0400000-00000000-00000000
CPUID 8000001A: 00000006-00000000-00000000-00000000
CPUID 8000001B: 00000BFF-00000000-00000000-00000000
CPUID 8000001C: 00000000-00000000-00000000-00000000
CPUID 8000001D: 00004121-01C0003F-0000003F-00000000 [SL 00] [L1D: 32 KB]
CPUID 8000001D: 00004122-01C0003F-0000003F-00000000 [SL 01] [L1I: 32 KB]
CPUID 8000001D: 00004143-01C0003F-000007FF-00000002 [SL 02] [L2U: 1 MB]
CPUID 8000001D: 0001C163-03C0003F-00003FFF-00000001 [SL 03] [L3U: 16 MB]
CPUID 8000001E: 00000002-00000101-00000000-00000000
CPUID 8000001F: 00000001-000000B3-00000000-00000000
CPUID 80000020: 00000000-0000001E-00000000-00000000 [SL 00]
CPUID 80000020: 0000000B-00000000-00000000-0000000F [SL 01]
CPUID 80000020: 0000000B-00000000-00000000-0000000F [SL 02]
CPUID 80000020: 00000000-00000002-0000007F-00000000 [SL 03]
CPUID 80000021: 00062FCF-0000015C-00000000-00000000
CPUID 80000022: 00000007-00084106-00000003-00000000
CPUID 80000023: 00000000-00000000-00000000-00000000
CPUID 80000024: 00000000-00000000-00000000-00000000
CPUID 80000025: 00000000-00000000-00000000-00000000
CPUID 80000026: 00000001-00000002-00000100-00000002 [SL 00] [P-core]
CPUID 80000026: 00000003-00000008-00000201-00000002 [SL 01]
CPUID 80000026: 00000003-00000008-00000302-00000002 [SL 02]
CPUID 80000026: 00000003-00000008-00000403-00000002 [SL 03]
CPUID 80000027: 00000000-00000000-00000000-00000000
CPUID 80000028: 00000000-00000000-00000000-00000000
CPUID 8FFFFFFF: 00000000-00000000-00000000-00000000

L1    Data Cache:    32 KB,  8-way Associative, 64-byte Line
L1  Instr. Cache:    32 KB,  8-way Associative, 64-byte Line
L2 Unified Cache:     1 MB,  8-way Associative, 64-byte Line
L3 Unified Cache:    16 MB, 16-way Associative, 64-byte Line

------[ CPUID Registers / Logical CPU #3 ]------

allcpu: Package 0 / Core 1 / Thread 1: Valid, Virtual, AMD P-core

CPUID 00000000: 00000010-68747541-444D4163-69746E65 [AuthenticAMD]
CPUID 00000001: 00A60F12-03080800-7ED8320B-178BFBFF
CPUID 00000002: 00000000-00000000-00000000-00000000
CPUID 00000003: 00000000-00000000-00000000-00000000
CPUID 00000005: 00000040-00000040-00000003-00000011
CPUID 00000006: 00000004-00000000-00000001-00000000
CPUID 00000007: 00000001-F1BF97A9-00405FCE-10000010 [SL 00]
CPUID 00000007: 00000020-00000000-00000000-00000000 [SL 01]
CPUID 00000008: 00000000-00000000-00000000-00000000
CPUID 00000009: 00000000-00000000-00000000-00000000
CPUID 0000000A: 00000000-00000000-00000000-00000000
CPUID 0000000B: 00000001-00000002-00000100-00000003 [SL 00]
CPUID 0000000B: 00000003-00000008-00000201-00000003 [SL 01]
CPUID 0000000C: 00000000-00000000-00000000-00000000
CPUID 0000000D: 000002E7-00000980-00000988-00000000 [SL 00] [x87]
CPUID 0000000D: 0000000F-00000990-00001800-00000000 [SL 01] [SSE]
CPUID 0000000D: 00000100-00000240-00000000-00000000 [SL 02] [AVX]
CPUID 0000000D: 00000040-00000340-00000000-00000000 [SL 05] [AVX-512 Opmask]
CPUID 0000000D: 00000200-00000380-00000000-00000000 [SL 06] [AVX-512 Hi256]
CPUID 0000000D: 00000400-00000580-00000000-00000000 [SL 07] [AVX-512 Hi16]
CPUID 0000000D: 00000008-00000980-00000000-00000000 [SL 09] [PKRU]
CPUID 0000000D: 00000010-00000000-00000001-00000000 [SL 0B] [CET_U]
CPUID 0000000D: 00000018-00000000-00000001-00000000 [SL 0C] [CET_S]
CPUID 0000000E: 00000000-00000000-00000000-00000000
CPUID 0000000F: 00000000-000000FF-00000000-00000002 [SL 00]
CPUID 0000000F: 00000014-00000040-000000FF-00000007 [SL 01]
CPUID 00000010: 00000000-00000002-00000000-00000000 [SL 00]
CPUID 00000010: 0000000F-00000000-00000004-0000000F [SL 01]
CPUID 80000000: 80000028-68747541-444D4163-69746E65 [AuthenticAMD]
CPUID 80000001: 00A60F12-00000000-75C237FF-2FD3FBFF
CPUID 80000002: 20444D41-43595045-32313420-34205034 [AMD EPYC 4124P 4]
CPUID 80000003: 726F432D-72502065-7365636F-20726F73 [-Core Processor ]
CPUID 80000004: 20202020-20202020-20202020-00202020 [               ]
CPUID 80000005: FF48FF40-FF48FF40-20080140-20080140 [L1D: 32 KB / L1I: 32 KB]
CPUID 80000006: 5C002200-6C004200-04006140-00809140 [L2: 1024 KB / L3: 16384 KB]
CPUID 80000007: 00000000-0000003B-00000000-00006799
CPUID 80000008: 00003030-791EF257-00003007-00010000
CPUID 80000009: 00000000-00000000-00000000-00000000
CPUID 8000000A: 00000001-00008000-00000000-1EBFBCFF
CPUID 8000000B: 00000000-00000000-00000000-00000000
CPUID 8000000C: 00000000-00000000-00000000-00000000
CPUID 8000000D: 00000000-00000000-00000000-00000000
CPUID 8000000E: 00000000-00000000-00000000-00000000
CPUID 8000000F: 00000000-00000000-00000000-00000000
CPUID 80000010: 00000000-00000000-00000000-00000000
CPUID 80000011: 00000000-00000000-00000000-00000000
CPUID 80000012: 00000000-00000000-00000000-00000000
CPUID 80000013: 00000000-00000000-00000000-00000000
CPUID 80000014: 00000000-00000000-00000000-00000000
CPUID 80000015: 00000000-00000000-00000000-00000000
CPUID 80000016: 00000000-00000000-00000000-00000000
CPUID 80000017: 00000000-00000000-00000000-00000000
CPUID 80000018: 00000000-00000000-00000000-00000000
CPUID 80000019: F048F040-F0400000-00000000-00000000
CPUID 8000001A: 00000006-00000000-00000000-00000000
CPUID 8000001B: 00000BFF-00000000-00000000-00000000
CPUID 8000001C: 00000000-00000000-00000000-00000000
CPUID 8000001D: 00004121-01C0003F-0000003F-00000000 [SL 00] [L1D: 32 KB]
CPUID 8000001D: 00004122-01C0003F-0000003F-00000000 [SL 01] [L1I: 32 KB]
CPUID 8000001D: 00004143-01C0003F-000007FF-00000002 [SL 02] [L2U: 1 MB]
CPUID 8000001D: 0001C163-03C0003F-00003FFF-00000001 [SL 03] [L3U: 16 MB]
CPUID 8000001E: 00000003-00000101-00000000-00000000
CPUID 8000001F: 00000001-000000B3-00000000-00000000
CPUID 80000020: 00000000-0000001E-00000000-00000000 [SL 00]
CPUID 80000020: 0000000B-00000000-00000000-0000000F [SL 01]
CPUID 80000020: 0000000B-00000000-00000000-0000000F [SL 02]
CPUID 80000020: 00000000-00000002-0000007F-00000000 [SL 03]
CPUID 80000021: 00062FCF-0000015C-00000000-00000000
CPUID 80000022: 00000007-00084106-00000003-00000000
CPUID 80000023: 00000000-00000000-00000000-00000000
CPUID 80000024: 00000000-00000000-00000000-00000000
CPUID 80000025: 00000000-00000000-00000000-00000000
CPUID 80000026: 00000001-00000002-00000100-00000003 [SL 00] [P-core]
CPUID 80000026: 00000003-00000008-00000201-00000003 [SL 01]
CPUID 80000026: 00000003-00000008-00000302-00000003 [SL 02]
CPUID 80000026: 00000003-00000008-00000403-00000003 [SL 03]
CPUID 80000027: 00000000-00000000-00000000-00000000
CPUID 80000028: 00000000-00000000-00000000-00000000
CPUID 8FFFFFFF: 00000000-00000000-00000000-00000000

L1    Data Cache:    32 KB,  8-way Associative, 64-byte Line
L1  Instr. Cache:    32 KB,  8-way Associative, 64-byte Line
L2 Unified Cache:     1 MB,  8-way Associative, 64-byte Line
L3 Unified Cache:    16 MB, 16-way Associative, 64-byte Line

------[ CPUID Registers / Logical CPU #4 ]------

allcpu: Package 0 / Core 2 / Thread 0: Valid, AMD P-core

CPUID 00000000: 00000010-68747541-444D4163-69746E65 [AuthenticAMD]
CPUID 00000001: 00A60F12-04080800-7ED8320B-178BFBFF
CPUID 00000002: 00000000-00000000-00000000-00000000
CPUID 00000003: 00000000-00000000-00000000-00000000
CPUID 00000005: 00000040-00000040-00000003-00000011
CPUID 00000006: 00000004-00000000-00000001-00000000
CPUID 00000007: 00000001-F1BF97A9-00405FCE-10000010 [SL 00]
CPUID 00000007: 00000020-00000000-00000000-00000000 [SL 01]
CPUID 00000008: 00000000-00000000-00000000-00000000
CPUID 00000009: 00000000-00000000-00000000-00000000
CPUID 0000000A: 00000000-00000000-00000000-00000000
CPUID 0000000B: 00000001-00000002-00000100-00000004 [SL 00]
CPUID 0000000B: 00000003-00000008-00000201-00000004 [SL 01]
CPUID 0000000C: 00000000-00000000-00000000-00000000
CPUID 0000000D: 000002E7-00000980-00000988-00000000 [SL 00] [x87]
CPUID 0000000D: 0000000F-00000990-00001800-00000000 [SL 01] [SSE]
CPUID 0000000D: 00000100-00000240-00000000-00000000 [SL 02] [AVX]
CPUID 0000000D: 00000040-00000340-00000000-00000000 [SL 05] [AVX-512 Opmask]
CPUID 0000000D: 00000200-00000380-00000000-00000000 [SL 06] [AVX-512 Hi256]
CPUID 0000000D: 00000400-00000580-00000000-00000000 [SL 07] [AVX-512 Hi16]
CPUID 0000000D: 00000008-00000980-00000000-00000000 [SL 09] [PKRU]
CPUID 0000000D: 00000010-00000000-00000001-00000000 [SL 0B] [CET_U]
CPUID 0000000D: 00000018-00000000-00000001-00000000 [SL 0C] [CET_S]
CPUID 0000000E: 00000000-00000000-00000000-00000000
CPUID 0000000F: 00000000-000000FF-00000000-00000002 [SL 00]
CPUID 0000000F: 00000014-00000040-000000FF-00000007 [SL 01]
CPUID 00000010: 00000000-00000002-00000000-00000000 [SL 00]
CPUID 00000010: 0000000F-00000000-00000004-0000000F [SL 01]
CPUID 80000000: 80000028-68747541-444D4163-69746E65 [AuthenticAMD]
CPUID 80000001: 00A60F12-00000000-75C237FF-2FD3FBFF
CPUID 80000002: 20444D41-43595045-32313420-34205034 [AMD EPYC 4124P 4]
CPUID 80000003: 726F432D-72502065-7365636F-20726F73 [-Core Processor ]
CPUID 80000004: 20202020-20202020-20202020-00202020 [               ]
CPUID 80000005: FF48FF40-FF48FF40-20080140-20080140 [L1D: 32 KB / L1I: 32 KB]
CPUID 80000006: 5C002200-6C004200-04006140-00809140 [L2: 1024 KB / L3: 16384 KB]
CPUID 80000007: 00000000-0000003B-00000000-00006799
CPUID 80000008: 00003030-791EF257-00003007-00010000
CPUID 80000009: 00000000-00000000-00000000-00000000
CPUID 8000000A: 00000001-00008000-00000000-1EBFBCFF
CPUID 8000000B: 00000000-00000000-00000000-00000000
CPUID 8000000C: 00000000-00000000-00000000-00000000
CPUID 8000000D: 00000000-00000000-00000000-00000000
CPUID 8000000E: 00000000-00000000-00000000-00000000
CPUID 8000000F: 00000000-00000000-00000000-00000000
CPUID 80000010: 00000000-00000000-00000000-00000000
CPUID 80000011: 00000000-00000000-00000000-00000000
CPUID 80000012: 00000000-00000000-00000000-00000000
CPUID 80000013: 00000000-00000000-00000000-00000000
CPUID 80000014: 00000000-00000000-00000000-00000000
CPUID 80000015: 00000000-00000000-00000000-00000000
CPUID 80000016: 00000000-00000000-00000000-00000000
CPUID 80000017: 00000000-00000000-00000000-00000000
CPUID 80000018: 00000000-00000000-00000000-00000000
CPUID 80000019: F048F040-F0400000-00000000-00000000
CPUID 8000001A: 00000006-00000000-00000000-00000000
CPUID 8000001B: 00000BFF-00000000-00000000-00000000
CPUID 8000001C: 00000000-00000000-00000000-00000000
CPUID 8000001D: 00004121-01C0003F-0000003F-00000000 [SL 00] [L1D: 32 KB]
CPUID 8000001D: 00004122-01C0003F-0000003F-00000000 [SL 01] [L1I: 32 KB]
CPUID 8000001D: 00004143-01C0003F-000007FF-00000002 [SL 02] [L2U: 1 MB]
CPUID 8000001D: 0001C163-03C0003F-00003FFF-00000001 [SL 03] [L3U: 16 MB]
CPUID 8000001E: 00000004-00000102-00000000-00000000
CPUID 8000001F: 00000001-000000B3-00000000-00000000
CPUID 80000020: 00000000-0000001E-00000000-00000000 [SL 00]
CPUID 80000020: 0000000B-00000000-00000000-0000000F [SL 01]
CPUID 80000020: 0000000B-00000000-00000000-0000000F [SL 02]
CPUID 80000020: 00000000-00000002-0000007F-00000000 [SL 03]
CPUID 80000021: 00062FCF-0000015C-00000000-00000000
CPUID 80000022: 00000007-00084106-00000003-00000000
CPUID 80000023: 00000000-00000000-00000000-00000000
CPUID 80000024: 00000000-00000000-00000000-00000000
CPUID 80000025: 00000000-00000000-00000000-00000000
CPUID 80000026: 00000001-00000002-00000100-00000004 [SL 00] [P-core]
CPUID 80000026: 00000003-00000008-00000201-00000004 [SL 01]
CPUID 80000026: 00000003-00000008-00000302-00000004 [SL 02]
CPUID 80000026: 00000003-00000008-00000403-00000004 [SL 03]
CPUID 80000027: 00000000-00000000-00000000-00000000
CPUID 80000028: 00000000-00000000-00000000-00000000
CPUID 8FFFFFFF: 00000000-00000000-00000000-00000000

L1    Data Cache:    32 KB,  8-way Associative, 64-byte Line
L1  Instr. Cache:    32 KB,  8-way Associative, 64-byte Line
L2 Unified Cache:     1 MB,  8-way Associative, 64-byte Line
L3 Unified Cache:    16 MB, 16-way Associative, 64-byte Line

------[ CPUID Registers / Logical CPU #5 ]------

allcpu: Package 0 / Core 2 / Thread 1: Valid, Virtual, AMD P-core

CPUID 00000000: 00000010-68747541-444D4163-69746E65 [AuthenticAMD]
CPUID 00000001: 00A60F12-05080800-7ED8320B-178BFBFF
CPUID 00000002: 00000000-00000000-00000000-00000000
CPUID 00000003: 00000000-00000000-00000000-00000000
CPUID 00000005: 00000040-00000040-00000003-00000011
CPUID 00000006: 00000004-00000000-00000001-00000000
CPUID 00000007: 00000001-F1BF97A9-00405FCE-10000010 [SL 00]
CPUID 00000007: 00000020-00000000-00000000-00000000 [SL 01]
CPUID 00000008: 00000000-00000000-00000000-00000000
CPUID 00000009: 00000000-00000000-00000000-00000000
CPUID 0000000A: 00000000-00000000-00000000-00000000
CPUID 0000000B: 00000001-00000002-00000100-00000005 [SL 00]
CPUID 0000000B: 00000003-00000008-00000201-00000005 [SL 01]
CPUID 0000000C: 00000000-00000000-00000000-00000000
CPUID 0000000D: 000002E7-00000980-00000988-00000000 [SL 00] [x87]
CPUID 0000000D: 0000000F-00000990-00001800-00000000 [SL 01] [SSE]
CPUID 0000000D: 00000100-00000240-00000000-00000000 [SL 02] [AVX]
CPUID 0000000D: 00000040-00000340-00000000-00000000 [SL 05] [AVX-512 Opmask]
CPUID 0000000D: 00000200-00000380-00000000-00000000 [SL 06] [AVX-512 Hi256]
CPUID 0000000D: 00000400-00000580-00000000-00000000 [SL 07] [AVX-512 Hi16]
CPUID 0000000D: 00000008-00000980-00000000-00000000 [SL 09] [PKRU]
CPUID 0000000D: 00000010-00000000-00000001-00000000 [SL 0B] [CET_U]
CPUID 0000000D: 00000018-00000000-00000001-00000000 [SL 0C] [CET_S]
CPUID 0000000E: 00000000-00000000-00000000-00000000
CPUID 0000000F: 00000000-000000FF-00000000-00000002 [SL 00]
CPUID 0000000F: 00000014-00000040-000000FF-00000007 [SL 01]
CPUID 00000010: 00000000-00000002-00000000-00000000 [SL 00]
CPUID 00000010: 0000000F-00000000-00000004-0000000F [SL 01]
CPUID 80000000: 80000028-68747541-444D4163-69746E65 [AuthenticAMD]
CPUID 80000001: 00A60F12-00000000-75C237FF-2FD3FBFF
CPUID 80000002: 20444D41-43595045-32313420-34205034 [AMD EPYC 4124P 4]
CPUID 80000003: 726F432D-72502065-7365636F-20726F73 [-Core Processor ]
CPUID 80000004: 20202020-20202020-20202020-00202020 [               ]
CPUID 80000005: FF48FF40-FF48FF40-20080140-20080140 [L1D: 32 KB / L1I: 32 KB]
CPUID 80000006: 5C002200-6C004200-04006140-00809140 [L2: 1024 KB / L3: 16384 KB]
CPUID 80000007: 00000000-0000003B-00000000-00006799
CPUID 80000008: 00003030-791EF257-00003007-00010000
CPUID 80000009: 00000000-00000000-00000000-00000000
CPUID 8000000A: 00000001-00008000-00000000-1EBFBCFF
CPUID 8000000B: 00000000-00000000-00000000-00000000
CPUID 8000000C: 00000000-00000000-00000000-00000000
CPUID 8000000D: 00000000-00000000-00000000-00000000
CPUID 8000000E: 00000000-00000000-00000000-00000000
CPUID 8000000F: 00000000-00000000-00000000-00000000
CPUID 80000010: 00000000-00000000-00000000-00000000
CPUID 80000011: 00000000-00000000-00000000-00000000
CPUID 80000012: 00000000-00000000-00000000-00000000
CPUID 80000013: 00000000-00000000-00000000-00000000
CPUID 80000014: 00000000-00000000-00000000-00000000
CPUID 80000015: 00000000-00000000-00000000-00000000
CPUID 80000016: 00000000-00000000-00000000-00000000
CPUID 80000017: 00000000-00000000-00000000-00000000
CPUID 80000018: 00000000-00000000-00000000-00000000
CPUID 80000019: F048F040-F0400000-00000000-00000000
CPUID 8000001A: 00000006-00000000-00000000-00000000
CPUID 8000001B: 00000BFF-00000000-00000000-00000000
CPUID 8000001C: 00000000-00000000-00000000-00000000
CPUID 8000001D: 00004121-01C0003F-0000003F-00000000 [SL 00] [L1D: 32 KB]
CPUID 8000001D: 00004122-01C0003F-0000003F-00000000 [SL 01] [L1I: 32 KB]
CPUID 8000001D: 00004143-01C0003F-000007FF-00000002 [SL 02] [L2U: 1 MB]
CPUID 8000001D: 0001C163-03C0003F-00003FFF-00000001 [SL 03] [L3U: 16 MB]
CPUID 8000001E: 00000005-00000102-00000000-00000000
CPUID 8000001F: 00000001-000000B3-00000000-00000000
CPUID 80000020: 00000000-0000001E-00000000-00000000 [SL 00]
CPUID 80000020: 0000000B-00000000-00000000-0000000F [SL 01]
CPUID 80000020: 0000000B-00000000-00000000-0000000F [SL 02]
CPUID 80000020: 00000000-00000002-0000007F-00000000 [SL 03]
CPUID 80000021: 00062FCF-0000015C-00000000-00000000
CPUID 80000022: 00000007-00084106-00000003-00000000
CPUID 80000023: 00000000-00000000-00000000-00000000
CPUID 80000024: 00000000-00000000-00000000-00000000
CPUID 80000025: 00000000-00000000-00000000-00000000
CPUID 80000026: 00000001-00000002-00000100-00000005 [SL 00] [P-core]
CPUID 80000026: 00000003-00000008-00000201-00000005 [SL 01]
CPUID 80000026: 00000003-00000008-00000302-00000005 [SL 02]
CPUID 80000026: 00000003-00000008-00000403-00000005 [SL 03]
CPUID 80000027: 00000000-00000000-00000000-00000000
CPUID 80000028: 00000000-00000000-00000000-00000000
CPUID 8FFFFFFF: 00000000-00000000-00000000-00000000

L1    Data Cache:    32 KB,  8-way Associative, 64-byte Line
L1  Instr. Cache:    32 KB,  8-way Associative, 64-byte Line
L2 Unified Cache:     1 MB,  8-way Associative, 64-byte Line
L3 Unified Cache:    16 MB, 16-way Associative, 64-byte Line

------[ CPUID Registers / Logical CPU #6 ]------

allcpu: Package 0 / Core 3 / Thread 0: Valid, AMD P-core

CPUID 00000000: 00000010-68747541-444D4163-69746E65 [AuthenticAMD]
CPUID 00000001: 00A60F12-06080800-7ED8320B-178BFBFF
CPUID 00000002: 00000000-00000000-00000000-00000000
CPUID 00000003: 00000000-00000000-00000000-00000000
CPUID 00000005: 00000040-00000040-00000003-00000011
CPUID 00000006: 00000004-00000000-00000001-00000000
CPUID 00000007: 00000001-F1BF97A9-00405FCE-10000010 [SL 00]
CPUID 00000007: 00000020-00000000-00000000-00000000 [SL 01]
CPUID 00000008: 00000000-00000000-00000000-00000000
CPUID 00000009: 00000000-00000000-00000000-00000000
CPUID 0000000A: 00000000-00000000-00000000-00000000
CPUID 0000000B: 00000001-00000002-00000100-00000006 [SL 00]
CPUID 0000000B: 00000003-00000008-00000201-00000006 [SL 01]
CPUID 0000000C: 00000000-00000000-00000000-00000000
CPUID 0000000D: 000002E7-00000980-00000988-00000000 [SL 00] [x87]
CPUID 0000000D: 0000000F-00000990-00001800-00000000 [SL 01] [SSE]
CPUID 0000000D: 00000100-00000240-00000000-00000000 [SL 02] [AVX]
CPUID 0000000D: 00000040-00000340-00000000-00000000 [SL 05] [AVX-512 Opmask]
CPUID 0000000D: 00000200-00000380-00000000-00000000 [SL 06] [AVX-512 Hi256]
CPUID 0000000D: 00000400-00000580-00000000-00000000 [SL 07] [AVX-512 Hi16]
CPUID 0000000D: 00000008-00000980-00000000-00000000 [SL 09] [PKRU]
CPUID 0000000D: 00000010-00000000-00000001-00000000 [SL 0B] [CET_U]
CPUID 0000000D: 00000018-00000000-00000001-00000000 [SL 0C] [CET_S]
CPUID 0000000E: 00000000-00000000-00000000-00000000
CPUID 0000000F: 00000000-000000FF-00000000-00000002 [SL 00]
CPUID 0000000F: 00000014-00000040-000000FF-00000007 [SL 01]
CPUID 00000010: 00000000-00000002-00000000-00000000 [SL 00]
CPUID 00000010: 0000000F-00000000-00000004-0000000F [SL 01]
CPUID 80000000: 80000028-68747541-444D4163-69746E65 [AuthenticAMD]
CPUID 80000001: 00A60F12-00000000-75C237FF-2FD3FBFF
CPUID 80000002: 20444D41-43595045-32313420-34205034 [AMD EPYC 4124P 4]
CPUID 80000003: 726F432D-72502065-7365636F-20726F73 [-Core Processor ]
CPUID 80000004: 20202020-20202020-20202020-00202020 [               ]
CPUID 80000005: FF48FF40-FF48FF40-20080140-20080140 [L1D: 32 KB / L1I: 32 KB]
CPUID 80000006: 5C002200-6C004200-04006140-00809140 [L2: 1024 KB / L3: 16384 KB]
CPUID 80000007: 00000000-0000003B-00000000-00006799
CPUID 80000008: 00003030-791EF257-00003007-00010000
CPUID 80000009: 00000000-00000000-00000000-00000000
CPUID 8000000A: 00000001-00008000-00000000-1EBFBCFF
CPUID 8000000B: 00000000-00000000-00000000-00000000
CPUID 8000000C: 00000000-00000000-00000000-00000000
CPUID 8000000D: 00000000-00000000-00000000-00000000
CPUID 8000000E: 00000000-00000000-00000000-00000000
CPUID 8000000F: 00000000-00000000-00000000-00000000
CPUID 80000010: 00000000-00000000-00000000-00000000
CPUID 80000011: 00000000-00000000-00000000-00000000
CPUID 80000012: 00000000-00000000-00000000-00000000
CPUID 80000013: 00000000-00000000-00000000-00000000
CPUID 80000014: 00000000-00000000-00000000-00000000
CPUID 80000015: 00000000-00000000-00000000-00000000
CPUID 80000016: 00000000-00000000-00000000-00000000
CPUID 80000017: 00000000-00000000-00000000-00000000
CPUID 80000018: 00000000-00000000-00000000-00000000
CPUID 80000019: F048F040-F0400000-00000000-00000000
CPUID 8000001A: 00000006-00000000-00000000-00000000
CPUID 8000001B: 00000BFF-00000000-00000000-00000000
CPUID 8000001C: 00000000-00000000-00000000-00000000
CPUID 8000001D: 00004121-01C0003F-0000003F-00000000 [SL 00] [L1D: 32 KB]
CPUID 8000001D: 00004122-01C0003F-0000003F-00000000 [SL 01] [L1I: 32 KB]
CPUID 8000001D: 00004143-01C0003F-000007FF-00000002 [SL 02] [L2U: 1 MB]
CPUID 8000001D: 0001C163-03C0003F-00003FFF-00000001 [SL 03] [L3U: 16 MB]
CPUID 8000001E: 00000006-00000103-00000000-00000000
CPUID 8000001F: 00000001-000000B3-00000000-00000000
CPUID 80000020: 00000000-0000001E-00000000-00000000 [SL 00]
CPUID 80000020: 0000000B-00000000-00000000-0000000F [SL 01]
CPUID 80000020: 0000000B-00000000-00000000-0000000F [SL 02]
CPUID 80000020: 00000000-00000002-0000007F-00000000 [SL 03]
CPUID 80000021: 00062FCF-0000015C-00000000-00000000
CPUID 80000022: 00000007-00084106-00000003-00000000
CPUID 80000023: 00000000-00000000-00000000-00000000
CPUID 80000024: 00000000-00000000-00000000-00000000
CPUID 80000025: 00000000-00000000-00000000-00000000
CPUID 80000026: 00000001-00000002-00000100-00000006 [SL 00] [P-core]
CPUID 80000026: 00000003-00000008-00000201-00000006 [SL 01]
CPUID 80000026: 00000003-00000008-00000302-00000006 [SL 02]
CPUID 80000026: 00000003-00000008-00000403-00000006 [SL 03]
CPUID 80000027: 00000000-00000000-00000000-00000000
CPUID 80000028: 00000000-00000000-00000000-00000000
CPUID 8FFFFFFF: 00000000-00000000-00000000-00000000

L1    Data Cache:    32 KB,  8-way Associative, 64-byte Line
L1  Instr. Cache:    32 KB,  8-way Associative, 64-byte Line
L2 Unified Cache:     1 MB,  8-way Associative, 64-byte Line
L3 Unified Cache:    16 MB, 16-way Associative, 64-byte Line

------[ CPUID Registers / Logical CPU #7 ]------

allcpu: Package 0 / Core 3 / Thread 1: Valid, Virtual, AMD P-core

CPUID 00000000: 00000010-68747541-444D4163-69746E65 [AuthenticAMD]
CPUID 00000001: 00A60F12-07080800-7ED8320B-178BFBFF
CPUID 00000002: 00000000-00000000-00000000-00000000
CPUID 00000003: 00000000-00000000-00000000-00000000
CPUID 00000005: 00000040-00000040-00000003-00000011
CPUID 00000006: 00000004-00000000-00000001-00000000
CPUID 00000007: 00000001-F1BF97A9-00405FCE-10000010 [SL 00]
CPUID 00000007: 00000020-00000000-00000000-00000000 [SL 01]
CPUID 00000008: 00000000-00000000-00000000-00000000
CPUID 00000009: 00000000-00000000-00000000-00000000
CPUID 0000000A: 00000000-00000000-00000000-00000000
CPUID 0000000B: 00000001-00000002-00000100-00000007 [SL 00]
CPUID 0000000B: 00000003-00000008-00000201-00000007 [SL 01]
CPUID 0000000C: 00000000-00000000-00000000-00000000
CPUID 0000000D: 000002E7-00000980-00000988-00000000 [SL 00] [x87]
CPUID 0000000D: 0000000F-00000990-00001800-00000000 [SL 01] [SSE]
CPUID 0000000D: 00000100-00000240-00000000-00000000 [SL 02] [AVX]
CPUID 0000000D: 00000040-00000340-00000000-00000000 [SL 05] [AVX-512 Opmask]
CPUID 0000000D: 00000200-00000380-00000000-00000000 [SL 06] [AVX-512 Hi256]
CPUID 0000000D: 00000400-00000580-00000000-00000000 [SL 07] [AVX-512 Hi16]
CPUID 0000000D: 00000008-00000980-00000000-00000000 [SL 09] [PKRU]
CPUID 0000000D: 00000010-00000000-00000001-00000000 [SL 0B] [CET_U]
CPUID 0000000D: 00000018-00000000-00000001-00000000 [SL 0C] [CET_S]
CPUID 0000000E: 00000000-00000000-00000000-00000000
CPUID 0000000F: 00000000-000000FF-00000000-00000002 [SL 00]
CPUID 0000000F: 00000014-00000040-000000FF-00000007 [SL 01]
CPUID 00000010: 00000000-00000002-00000000-00000000 [SL 00]
CPUID 00000010: 0000000F-00000000-00000004-0000000F [SL 01]
CPUID 80000000: 80000028-68747541-444D4163-69746E65 [AuthenticAMD]
CPUID 80000001: 00A60F12-00000000-75C237FF-2FD3FBFF
CPUID 80000002: 20444D41-43595045-32313420-34205034 [AMD EPYC 4124P 4]
CPUID 80000003: 726F432D-72502065-7365636F-20726F73 [-Core Processor ]
CPUID 80000004: 20202020-20202020-20202020-00202020 [               ]
CPUID 80000005: FF48FF40-FF48FF40-20080140-20080140 [L1D: 32 KB / L1I: 32 KB]
CPUID 80000006: 5C002200-6C004200-04006140-00809140 [L2: 1024 KB / L3: 16384 KB]
CPUID 80000007: 00000000-0000003B-00000000-00006799
CPUID 80000008: 00003030-791EF257-00003007-00010000
CPUID 80000009: 00000000-00000000-00000000-00000000
CPUID 8000000A: 00000001-00008000-00000000-1EBFBCFF
CPUID 8000000B: 00000000-00000000-00000000-00000000
CPUID 8000000C: 00000000-00000000-00000000-00000000
CPUID 8000000D: 00000000-00000000-00000000-00000000
CPUID 8000000E: 00000000-00000000-00000000-00000000
CPUID 8000000F: 00000000-00000000-00000000-00000000
CPUID 80000010: 00000000-00000000-00000000-00000000
CPUID 80000011: 00000000-00000000-00000000-00000000
CPUID 80000012: 00000000-00000000-00000000-00000000
CPUID 80000013: 00000000-00000000-00000000-00000000
CPUID 80000014: 00000000-00000000-00000000-00000000
CPUID 80000015: 00000000-00000000-00000000-00000000
CPUID 80000016: 00000000-00000000-00000000-00000000
CPUID 80000017: 00000000-00000000-00000000-00000000
CPUID 80000018: 00000000-00000000-00000000-00000000
CPUID 80000019: F048F040-F0400000-00000000-00000000
CPUID 8000001A: 00000006-00000000-00000000-00000000
CPUID 8000001B: 00000BFF-00000000-00000000-00000000
CPUID 8000001C: 00000000-00000000-00000000-00000000
CPUID 8000001D: 00004121-01C0003F-0000003F-00000000 [SL 00] [L1D: 32 KB]
CPUID 8000001D: 00004122-01C0003F-0000003F-00000000 [SL 01] [L1I: 32 KB]
CPUID 8000001D: 00004143-01C0003F-000007FF-00000002 [SL 02] [L2U: 1 MB]
CPUID 8000001D: 0001C163-03C0003F-00003FFF-00000001 [SL 03] [L3U: 16 MB]
CPUID 8000001E: 00000007-00000103-00000000-00000000
CPUID 8000001F: 00000001-000000B3-00000000-00000000
CPUID 80000020: 00000000-0000001E-00000000-00000000 [SL 00]
CPUID 80000020: 0000000B-00000000-00000000-0000000F [SL 01]
CPUID 80000020: 0000000B-00000000-00000000-0000000F [SL 02]
CPUID 80000020: 00000000-00000002-0000007F-00000000 [SL 03]
CPUID 80000021: 00062FCF-0000015C-00000000-00000000
CPUID 80000022: 00000007-00084106-00000003-00000000
CPUID 80000023: 00000000-00000000-00000000-00000000
CPUID 80000024: 00000000-00000000-00000000-00000000
CPUID 80000025: 00000000-00000000-00000000-00000000
CPUID 80000026: 00000001-00000002-00000100-00000007 [SL 00] [P-core]
CPUID 80000026: 00000003-00000008-00000201-00000007 [SL 01]
CPUID 80000026: 00000003-00000008-00000302-00000007 [SL 02]
CPUID 80000026: 00000003-00000008-00000403-00000007 [SL 03]
CPUID 80000027: 00000000-00000000-00000000-00000000
CPUID 80000028: 00000000-00000000-00000000-00000000
CPUID 8FFFFFFF: 00000000-00000000-00000000-00000000

L1    Data Cache:    32 KB,  8-way Associative, 64-byte Line
L1  Instr. Cache:    32 KB,  8-way Associative, 64-byte Line
L2 Unified Cache:     1 MB,  8-way Associative, 64-byte Line
L3 Unified Cache:    16 MB, 16-way Associative, 64-byte Line

------[ All CPUs ]------

CPU   0: APICID    0 / Package 0 / Core   0 / Thread 0: Valid
CPU   1: APICID    1 / Package 0 / Core   0 / Thread 1: Valid, Virtual
CPU   2: APICID    2 / Package 0 / Core   1 / Thread 0: Valid
CPU   3: APICID    3 / Package 0 / Core   1 / Thread 1: Valid, Virtual
CPU   4: APICID    4 / Package 0 / Core   2 / Thread 0: Valid
CPU   5: APICID    5 / Package 0 / Core   2 / Thread 1: Valid, Virtual
CPU   6: APICID    6 / Package 0 / Core   3 / Thread 0: Valid
CPU   7: APICID    7 / Package 0 / Core   3 / Thread 1: Valid, Virtual

------[ MSR Registers / Logical CPU #0 ]------

CPU Clock (Normal): 2515 MHz
CPU Clock (TSC): 3793 MHz
CPU Multiplier: 25.2x
CPB PStates: 0
MSR 0000001B: 0000-0000-FEE0-0900
MSR 0000008B: 0000-0000-0A60-120C
MSR 000000E7: 0000-012C-67CB-4822 [S200]
MSR 000000E7: 0000-012C-67D1-0AB6 [S200]
MSR 000000E7: 0000-012C-67D6-A5CE
MSR 000000E8: 0000-012E-9292-5F68 [S200]
MSR 000000E8: 0000-012E-92B6-0A93 [S200]
MSR 000000E8: 0000-012E-92BA-999C
MSR 0000010B: < FAILED >
MSR C0010004: 0000-0000-0000-0000
MSR C0010005: 0000-0000-0000-0000
MSR C0010006: 0000-0000-0000-0000
MSR C0010007: 0000-0000-0000-0000
MSR C0010015: 0000-0001-8900-6011
MSR C001001F: 0000-0000-0000-0000
MSR C0010055: 0000-0000-0000-0000
MSR C0010058: 0000-0000-E000-0021
MSR C0010061: 0000-0000-0000-0010
MSR C0010062: 0000-0000-0000-0000
MSR C0010063: 0000-0000-0000-0001
MSR C0010064: 8000-0000-49B2-4898 [38.00x] [0.2937 V] [ 3.80 A] [PState P0]
MSR C0010065: 8000-0000-479E-4878 [94.00x] [0.7938 V] [ 3.00 A] [PState P1]
MSR C0010066: 0000-0000-0000-0000
MSR C0010067: 0000-0000-0000-0000
MSR C0010068: 0000-0000-0000-0000
MSR C0010069: 0000-0000-0000-0000
MSR C001006A: 0000-0000-0000-0000
MSR C001006B: 0000-0000-0000-0000
MSR C0010070: < FAILED >
MSR C0010293: 0000-0000-0058-0A94 [29.60x] [0.9500V]
MSR C0010293: 0000-0000-0058-0A94 [29.60x] [0.9500V]
MSR C0010293: 0000-0000-0058-0A94 [29.60x] [0.9500V]
MSR C0010293: 0000-0000-0058-0A94 [29.60x] [0.9500V]
MSR C0010293: 0000-0000-0055-8C97 [25.17x] [1.0125V]
MSR C0010140: 0000-0000-0000-0005
MSR C0010141: 0000-0000-0000-0000
MSR C0010290: < FAILED >
MSR C0010292: 0000-0001-0400-3789
MSR C0010293: 0000-0000-0055-8C97
MSR C0010294: 4F45-047F-0021-2192
MSR C0010296: 0000-0000-0048-4848
MSR C0010299: 0000-0000-000A-1000
MSR C001029A: 0000-0000-0AF9-7BD0 [S200]
MSR C001029A: 0000-0000-0AF9-7BDA [S200]
MSR C001029A: 0000-0000-0AF9-7BF3
MSR C001029B: 0000-0000-8DAB-8F72 [S200]
MSR C001029B: 0000-0000-8DAF-D65A [S200]
MSR C001029B: 0000-0000-8DB3-C71C
MSR C0011023: 0102-0000-0000-0000

------[ MSR Registers / Logical CPU #1 ]------

CPU Clock (Normal): 2958 MHz
CPU Clock (TSC): 3793 MHz
CPU Multiplier: 29.6x
CPB PStates: 0
MSR 0000001B: 0000-0000-FEE0-0900
MSR 0000008B: 0000-0000-0A60-120C
MSR 000000E7: 0000-012C-6C6A-2F9E
MSR 000000E8: 0000-012E-9621-E0ED
MSR 0000010B: < FAILED >
MSR C0010004: 0000-0000-0000-0000
MSR C0010005: 0000-0000-0000-0000
MSR C0010006: 0000-0000-0000-0000
MSR C0010007: 0000-0000-0000-0000
MSR C0010015: 0000-0001-8900-6011
MSR C001001F: 0000-0000-0000-0000
MSR C0010055: 0000-0000-0000-0000
MSR C0010058: 0000-0000-E000-0021
MSR C0010061: 0000-0000-0000-0010
MSR C0010062: 0000-0000-0000-0000
MSR C0010063: 0000-0000-0000-0001
MSR C0010064: 8000-0000-49B2-4898 [38.00x] [0.2937 V] [ 3.80 A] [PState P0]
MSR C0010065: 8000-0000-479E-4878 [94.00x] [0.7938 V] [ 3.00 A] [PState P1]
MSR C0010066: 0000-0000-0000-0000
MSR C0010067: 0000-0000-0000-0000
MSR C0010068: 0000-0000-0000-0000
MSR C0010069: 0000-0000-0000-0000
MSR C001006A: 0000-0000-0000-0000
MSR C001006B: 0000-0000-0000-0000
MSR C0010070: < FAILED >
MSR C0010293: 0000-0000-0059-0A94 [29.60x] [0.9250V]
MSR C0010293: 0000-0000-0058-0A94 [29.60x] [0.9500V]
MSR C0010293: 0000-0000-0058-0A94 [29.60x] [0.9500V]
MSR C0010293: 0000-0000-0058-0A94 [29.60x] [0.9500V]
MSR C0010293: 0000-0000-0058-0A94 [29.60x] [0.9500V]
MSR C0010140: 0000-0000-0000-0005
MSR C0010141: 0000-0000-0000-0000
MSR C0010290: < FAILED >
MSR C0010292: 0000-0001-0400-3789
MSR C0010293: 0000-0000-0058-0A94
MSR C0010294: 4F45-047F-0021-2192
MSR C0010296: 0000-0000-0048-4848
MSR C0010299: 0000-0000-000A-1000
MSR C001029A: 0000-0000-0AF9-8422
MSR C001029B: 0000-0000-8DBE-8100
MSR C0011023: 0102-0000-0000-0000

------[ MSR Registers / Logical CPU #2 ]------

CPU Clock (Normal): 2958 MHz
CPU Clock (TSC): 3793 MHz
CPU Multiplier: 29.6x
CPB PStates: 0
MSR 0000001B: 0000-0000-FEE0-0900
MSR 0000008B: 0000-0000-0A60-120C
MSR 000000E7: 0000-012C-7591-6FC6
MSR 000000E8: 0000-012E-9D43-196E
MSR 0000010B: < FAILED >
MSR C0010004: 0000-0000-0000-0000
MSR C0010005: 0000-0000-0000-0000
MSR C0010006: 0000-0000-0000-0000
MSR C0010007: 0000-0000-0000-0000
MSR C0010015: 0000-0001-8900-6011
MSR C001001F: 0000-0000-0000-0000
MSR C0010055: 0000-0000-0000-0000
MSR C0010058: 0000-0000-E000-0021
MSR C0010061: 0000-0000-0000-0010
MSR C0010062: 0000-0000-0000-0000
MSR C0010063: 0000-0000-0000-0001
MSR C0010064: 8000-0000-49B2-4898 [38.00x] [0.2937 V] [ 3.80 A] [PState P0]
MSR C0010065: 8000-0000-479E-4878 [94.00x] [0.7938 V] [ 3.00 A] [PState P1]
MSR C0010066: 0000-0000-0000-0000
MSR C0010067: 0000-0000-0000-0000
MSR C0010068: 0000-0000-0000-0000
MSR C0010069: 0000-0000-0000-0000
MSR C001006A: 0000-0000-0000-0000
MSR C001006B: 0000-0000-0000-0000
MSR C0010070: < FAILED >
MSR C0010293: 0000-0000-0059-0A94 [29.60x] [0.9250V]
MSR C0010293: 0000-0000-0058-0A94 [29.60x] [0.9500V]
MSR C0010293: 0000-0000-0059-0A94 [29.60x] [0.9250V]
MSR C0010293: 0000-0000-0058-0A94 [29.60x] [0.9500V]
MSR C0010293: 0000-0000-0058-0A94 [29.60x] [0.9500V]
MSR C0010140: 0000-0000-0000-0005
MSR C0010141: 0000-0000-0000-0000
MSR C0010290: < FAILED >
MSR C0010292: 0000-0001-0400-3789
MSR C0010293: 0000-0000-0058-0A94
MSR C0010294: 4F45-047F-0021-2192
MSR C0010296: 0000-0000-0048-4848
MSR C0010299: 0000-0000-000A-1000
MSR C001029A: 0000-0000-0AF9-8799
MSR C001029B: 0000-0000-8DC8-352C
MSR C0011023: 0102-0000-0000-0000

------[ MSR Registers / Logical CPU #3 ]------

CPU Clock (Normal): 2958 MHz
CPU Clock (TSC): 3793 MHz
CPU Multiplier: 29.6x
CPB PStates: 0
MSR 0000001B: 0000-0000-FEE0-0900
MSR 0000008B: 0000-0000-0A60-120C
MSR 000000E7: 0000-012C-79FA-4BD8
MSR 000000E8: 0000-012E-A0B2-571C
MSR 0000010B: < FAILED >
MSR C0010004: 0000-0000-0000-0000
MSR C0010005: 0000-0000-0000-0000
MSR C0010006: 0000-0000-0000-0000
MSR C0010007: 0000-0000-0000-0000
MSR C0010015: 0000-0001-8900-6011
MSR C001001F: 0000-0000-0000-0000
MSR C0010055: 0000-0000-0000-0000
MSR C0010058: 0000-0000-E000-0021
MSR C0010061: 0000-0000-0000-0010
MSR C0010062: 0000-0000-0000-0000
MSR C0010063: 0000-0000-0000-0001
MSR C0010064: 8000-0000-49B2-4898 [38.00x] [0.2937 V] [ 3.80 A] [PState P0]
MSR C0010065: 8000-0000-479E-4878 [94.00x] [0.7938 V] [ 3.00 A] [PState P1]
MSR C0010066: 0000-0000-0000-0000
MSR C0010067: 0000-0000-0000-0000
MSR C0010068: 0000-0000-0000-0000
MSR C0010069: 0000-0000-0000-0000
MSR C001006A: 0000-0000-0000-0000
MSR C001006B: 0000-0000-0000-0000
MSR C0010070: < FAILED >
MSR C0010293: 0000-0000-0059-0A94 [29.60x] [0.9250V]
MSR C0010293: 0000-0000-0058-0A94 [29.60x] [0.9500V]
MSR C0010293: 0000-0000-0058-0A94 [29.60x] [0.9500V]
MSR C0010293: 0000-0000-0058-0A94 [29.60x] [0.9500V]
MSR C0010293: 0000-0000-0058-0A94 [29.60x] [0.9500V]
MSR C0010140: 0000-0000-0000-0005
MSR C0010141: 0000-0000-0000-0000
MSR C0010290: < FAILED >
MSR C0010292: 0000-0001-0400-3789
MSR C0010293: 0000-0000-0058-0A94
MSR C0010294: 4F45-047F-0021-2192
MSR C0010296: 0000-0000-0048-4848
MSR C0010299: 0000-0000-000A-1000
MSR C001029A: 0000-0000-0AF9-8E15
MSR C001029B: 0000-0000-8DD2-C2F6
MSR C0011023: 0102-0000-0000-0000

------[ MSR Registers / Logical CPU #4 ]------

CPU Clock (Normal): 2958 MHz
CPU Clock (TSC): 3793 MHz
CPU Multiplier: 29.6x
CPB PStates: 0
MSR 0000001B: 0000-0000-FEE0-0900
MSR 0000008B: 0000-0000-0A60-120C
MSR 000000E7: 0000-012C-82DB-42B4
MSR 000000E8: 0000-012E-A79C-C39A
MSR 0000010B: < FAILED >
MSR C0010004: 0000-0000-0000-0000
MSR C0010005: 0000-0000-0000-0000
MSR C0010006: 0000-0000-0000-0000
MSR C0010007: 0000-0000-0000-0000
MSR C0010015: 0000-0001-8900-6011
MSR C001001F: 0000-0000-0000-0000
MSR C0010055: 0000-0000-0000-0000
MSR C0010058: 0000-0000-E000-0021
MSR C0010061: 0000-0000-0000-0010
MSR C0010062: 0000-0000-0000-0000
MSR C0010063: 0000-0000-0000-0001
MSR C0010064: 8000-0000-49B2-4898 [38.00x] [0.2937 V] [ 3.80 A] [PState P0]
MSR C0010065: 8000-0000-479E-4878 [94.00x] [0.7938 V] [ 3.00 A] [PState P1]
MSR C0010066: 0000-0000-0000-0000
MSR C0010067: 0000-0000-0000-0000
MSR C0010068: 0000-0000-0000-0000
MSR C0010069: 0000-0000-0000-0000
MSR C001006A: 0000-0000-0000-0000
MSR C001006B: 0000-0000-0000-0000
MSR C0010070: < FAILED >
MSR C0010293: 0000-0000-0059-0A94 [29.60x] [0.9250V]
MSR C0010293: 0000-0000-0058-0A94 [29.60x] [0.9500V]
MSR C0010293: 0000-0000-0058-0A94 [29.60x] [0.9500V]
MSR C0010293: 0000-0000-0058-0A94 [29.60x] [0.9500V]
MSR C0010293: 0000-0000-0058-0A94 [29.60x] [0.9500V]
MSR C0010140: 0000-0000-0000-0005
MSR C0010141: 0000-0000-0000-0000
MSR C0010290: < FAILED >
MSR C0010292: 0000-0001-0400-3789
MSR C0010293: 0000-0000-0058-0A94
MSR C0010294: 4F45-047F-0021-2192
MSR C0010296: 0000-0000-0048-4848
MSR C0010299: 0000-0000-000A-1000
MSR C001029A: 0000-0000-0AF9-9536
MSR C001029B: 0000-0000-8DDA-E583
MSR C0011023: 0102-0000-0000-0000

------[ MSR Registers / Logical CPU #5 ]------

CPU Clock (Normal): 2958 MHz
CPU Clock (TSC): 3793 MHz
CPU Multiplier: 29.6x
CPB PStates: 0
MSR 0000001B: 0000-0000-FEE0-0900
MSR 0000008B: 0000-0000-0A60-120C
MSR 000000E7: 0000-012C-8776-E526
MSR 000000E8: 0000-012E-AB33-9875
MSR 0000010B: < FAILED >
MSR C0010004: 0000-0000-0000-0000
MSR C0010005: 0000-0000-0000-0000
MSR C0010006: 0000-0000-0000-0000
MSR C0010007: 0000-0000-0000-0000
MSR C0010015: 0000-0001-8900-6011
MSR C001001F: 0000-0000-0000-0000
MSR C0010055: 0000-0000-0000-0000
MSR C0010058: 0000-0000-E000-0021
MSR C0010061: 0000-0000-0000-0010
MSR C0010062: 0000-0000-0000-0000
MSR C0010063: 0000-0000-0000-0001
MSR C0010064: 8000-0000-49B2-4898 [38.00x] [0.2937 V] [ 3.80 A] [PState P0]
MSR C0010065: 8000-0000-479E-4878 [94.00x] [0.7938 V] [ 3.00 A] [PState P1]
MSR C0010066: 0000-0000-0000-0000
MSR C0010067: 0000-0000-0000-0000
MSR C0010068: 0000-0000-0000-0000
MSR C0010069: 0000-0000-0000-0000
MSR C001006A: 0000-0000-0000-0000
MSR C001006B: 0000-0000-0000-0000
MSR C0010070: < FAILED >
MSR C0010293: 0000-0000-0059-0A94 [29.60x] [0.9250V]
MSR C0010293: 0000-0000-0058-0A94 [29.60x] [0.9500V]
MSR C0010293: 0000-0000-0058-0A94 [29.60x] [0.9500V]
MSR C0010293: 0000-0000-0058-0A94 [29.60x] [0.9500V]
MSR C0010293: 0000-0000-0058-0A94 [29.60x] [0.9500V]
MSR C0010140: 0000-0000-0000-0005
MSR C0010141: 0000-0000-0000-0000
MSR C0010290: < FAILED >
MSR C0010292: 0000-0001-0400-3789
MSR C0010293: 0000-0000-0058-0A94
MSR C0010294: 4F45-047F-0021-2192
MSR C0010296: 0000-0000-0048-4848
MSR C0010299: 0000-0000-000A-1000
MSR C001029A: 0000-0000-0AF9-9ED9
MSR C001029B: 0000-0000-8DE9-60BA
MSR C0011023: 0102-0000-0000-0000

------[ MSR Registers / Logical CPU #6 ]------

CPU Clock (Normal): 2958 MHz
CPU Clock (TSC): 3793 MHz
CPU Multiplier: 29.6x
CPB PStates: 0
MSR 0000001B: 0000-0000-FEE0-0900
MSR 0000008B: 0000-0000-0A60-120C
MSR 000000E7: 0000-012C-90ED-1A56
MSR 000000E8: 0000-012E-B291-BDFD
MSR 0000010B: < FAILED >
MSR C0010004: 0000-0000-0000-0000
MSR C0010005: 0000-0000-0000-0000
MSR C0010006: 0000-0000-0000-0000
MSR C0010007: 0000-0000-0000-0000
MSR C0010015: 0000-0001-8900-6011
MSR C001001F: 0000-0000-0000-0000
MSR C0010055: 0000-0000-0000-0000
MSR C0010058: 0000-0000-E000-0021
MSR C0010061: 0000-0000-0000-0010
MSR C0010062: 0000-0000-0000-0000
MSR C0010063: 0000-0000-0000-0001
MSR C0010064: 8000-0000-49B2-4898 [38.00x] [0.2937 V] [ 3.80 A] [PState P0]
MSR C0010065: 8000-0000-479E-4878 [94.00x] [0.7938 V] [ 3.00 A] [PState P1]
MSR C0010066: 0000-0000-0000-0000
MSR C0010067: 0000-0000-0000-0000
MSR C0010068: 0000-0000-0000-0000
MSR C0010069: 0000-0000-0000-0000
MSR C001006A: 0000-0000-0000-0000
MSR C001006B: 0000-0000-0000-0000
MSR C0010070: < FAILED >
MSR C0010293: 0000-0000-0059-4A94 [29.60x] [0.9188V]
MSR C0010293: 0000-0000-0058-0A94 [29.60x] [0.9500V]
MSR C0010293: 0000-0000-0058-0A94 [29.60x] [0.9500V]
MSR C0010293: 0000-0000-0058-0A94 [29.60x] [0.9500V]
MSR C0010293: 0000-0000-0058-0A94 [29.60x] [0.9500V]
MSR C0010140: 0000-0000-0000-0005
MSR C0010141: 0000-0000-0000-0000
MSR C0010290: < FAILED >
MSR C0010292: 0000-0001-0400-3789
MSR C0010293: 0000-0000-0058-0A94
MSR C0010294: 4F45-047F-0021-2192
MSR C0010296: 0000-0000-0048-4848
MSR C0010299: 0000-0000-000A-1000
MSR C001029A: 0000-0000-0AF9-A552
MSR C001029B: 0000-0000-8DF3-15C3
MSR C0011023: 0102-0000-0000-0000

------[ MSR Registers / Logical CPU #7 ]------

CPU Clock (Normal): 2958 MHz
CPU Clock (TSC): 3793 MHz
CPU Multiplier: 29.6x
CPB PStates: 0
MSR 0000001B: 0000-0000-FEE0-0900
MSR 0000008B: 0000-0000-0A60-120C
MSR 000000E7: 0000-012C-9547-0DEE
MSR 000000E8: 0000-012E-B5F5-6DCA
MSR 0000010B: < FAILED >
MSR C0010004: 0000-0000-0000-0000
MSR C0010005: 0000-0000-0000-0000
MSR C0010006: 0000-0000-0000-0000
MSR C0010007: 0000-0000-0000-0000
MSR C0010015: 0000-0001-8900-6011
MSR C001001F: 0000-0000-0000-0000
MSR C0010055: 0000-0000-0000-0000
MSR C0010058: 0000-0000-E000-0021
MSR C0010061: 0000-0000-0000-0010
MSR C0010062: 0000-0000-0000-0000
MSR C0010063: 0000-0000-0000-0001
MSR C0010064: 8000-0000-49B2-4898 [38.00x] [0.2937 V] [ 3.80 A] [PState P0]
MSR C0010065: 8000-0000-479E-4878 [94.00x] [0.7938 V] [ 3.00 A] [PState P1]
MSR C0010066: 0000-0000-0000-0000
MSR C0010067: 0000-0000-0000-0000
MSR C0010068: 0000-0000-0000-0000
MSR C0010069: 0000-0000-0000-0000
MSR C001006A: 0000-0000-0000-0000
MSR C001006B: 0000-0000-0000-0000
MSR C0010070: < FAILED >
MSR C0010293: 0000-0000-0059-0A94 [29.60x] [0.9250V]
MSR C0010293: 0000-0000-0059-0A94 [29.60x] [0.9250V]
MSR C0010293: 0000-0000-0058-0A94 [29.60x] [0.9500V]
MSR C0010293: 0000-0000-0058-0A94 [29.60x] [0.9500V]
MSR C0010293: 0000-0000-0058-0A94 [29.60x] [0.9500V]
MSR C0010140: 0000-0000-0000-0005
MSR C0010141: 0000-0000-0000-0000
MSR C0010290: < FAILED >
MSR C0010292: 0000-0001-0400-3789
MSR C0010293: 0000-0000-0058-0A94
MSR C0010294: 4F45-047F-0021-2192
MSR C0010296: 0000-0000-0048-4848
MSR C0010299: 0000-0000-000A-1000
MSR C001029A: 0000-0000-0AF9-AB3E
MSR C001029B: 0000-0000-8DFE-3A7F
MSR C0011023: 0102-0000-0000-0000
