------[ Versions ]------

Program Version : AIDA64 v2.80.2337 Beta
BenchDLL Version: 3.0.492-x64

------[ CPU Info ]------

CPU Type           : OctalCore AMD FX-8350, 4200 MHz (21 x 200)
CPU Alias          : Vishera
CPU Platform       : Socket AM3+
CPU Stepping       : OR-C0
Instruction Set    : x86, x86-64, MMX, SSE, SSE2, SSE3, SSSE3, SSE4.1, SSE4.2, SSE4A, XOP, AES, AVX, FMA, FMA4
CPUID Manufacturer : AuthenticAMD
CPUID CPU Name     : AMD FX(tm)-8350 Eight-Core Processor
CPUID Revision     : 00600F20h
Platform ID        : D8h  (Socket AM3+)
HTT / CMP Units    : 0 / 8
Tjmax Temperature  : 0 Celsius

------[ Logical CPU #0 ]------

allcpu: Package 0 / Core 0 / Thread 0: Valid

CPUID 00000000: 0000000D-68747541-444D4163-69746E65 [AuthenticAMD]
CPUID 00000001: 00600F20-00080800-3E98320B-178BFBFF
CPUID 00000002: 00000000-00000000-00000000-00000000
CPUID 00000003: 00000000-00000000-00000000-00000000
CPUID 00000005: 00000040-00000040-00000003-00000000
CPUID 00000006: 00000000-00000000-00000001-00000000
CPUID 00000007: 00000000-00000008-00000000-00000000
CPUID 00000008: 00000000-00000000-00000000-00000000
CPUID 00000009: 00000000-00000000-00000000-00000000
CPUID 0000000A: 00000000-00000000-00000000-00000000
CPUID 0000000C: 00000000-00000000-00000000-00000000
CPUID 0000000D: 00000007-00000340-000003C0-40000000
CPUID 0000000D: 00000100-00000240-00000000-00000000
CPUID 80000000: 8000001E-68747541-444D4163-69746E65
CPUID 80000001: 00600F20-10000000-01EBBFFF-2FD3FBFF
CPUID 80000002: 20444D41-74285846-382D296D-20303533 [AMD FX(tm)-8350 ]
CPUID 80000003: 68676945-6F432D74-50206572-65636F72 [Eight-Core Proce]
CPUID 80000004: 726F7373-20202020-20202020-00202020 [ssor           ]
CPUID 80000005: FF40FF18-FF40FF30-10040140-40020140
CPUID 80000006: 64006400-64004200-08008140-0040C140
CPUID 80000007: 00000000-00000000-00000000-000007D9
CPUID 80000008: 00003030-00000000-00004007-00000000
CPUID 80000009: 00000000-00000000-00000000-00000000
CPUID 8000000A: 00000001-00010000-00000000-00001CFF
CPUID 8000000B: 00000000-00000000-00000000-00000000
CPUID 8000000C: 00000000-00000000-00000000-00000000
CPUID 8000000D: 00000000-00000000-00000000-00000000
CPUID 8000000E: 00000000-00000000-00000000-00000000
CPUID 8000000F: 00000000-00000000-00000000-00000000
CPUID 80000010: 00000000-00000000-00000000-00000000
CPUID 80000011: 00000000-00000000-00000000-00000000
CPUID 80000012: 00000000-00000000-00000000-00000000
CPUID 80000013: 00000000-00000000-00000000-00000000
CPUID 80000014: 00000000-00000000-00000000-00000000
CPUID 80000015: 00000000-00000000-00000000-00000000
CPUID 80000016: 00000000-00000000-00000000-00000000
CPUID 80000017: 00000000-00000000-00000000-00000000
CPUID 80000018: 00000000-00000000-00000000-00000000
CPUID 80000019: F040F018-64006400-00000000-00000000
CPUID 8000001A: 00000003-00000000-00000000-00000000
CPUID 8000001B: 000000FF-00000000-00000000-00000000
CPUID 8000001C: 00000000-80032013-00010200-8000000F
CPUID 8000001D: 00000121-00C0003F-0000003F-00000000
CPUID 8000001D: 00004122-0040003F-000001FF-00000000
CPUID 8000001D: 00004143-03C0003F-000007FF-00000001
CPUID 8000001D: 0001C163-0FC0003F-000007FF-00000001
CPUID 8000001E: 00000010-00000100-00000000-00000000
CPUID 8FFFFFFF: 00000000-00000000-00000000-00000000 []

L1    Data Cache:     16 KB,  4-way Associative, 64-byte Line
L1  Instr. Cache:     64 KB,  2-way Associative, 64-byte Line
L2 Unified Cache:   2048 KB, 16-way Associative, 64-byte Line
L3 Unified Cache:   8192 KB, 64-way Associative, 64-byte Line

------[ Logical CPU #1 ]------

allcpu: Package 0 / Core 1 / Thread 0: Valid

CPUID 00000000: 0000000D-68747541-444D4163-69746E65 [AuthenticAMD]
CPUID 00000001: 00600F20-01080800-3E98320B-178BFBFF
CPUID 00000002: 00000000-00000000-00000000-00000000
CPUID 00000003: 00000000-00000000-00000000-00000000
CPUID 00000005: 00000040-00000040-00000003-00000000
CPUID 00000006: 00000000-00000000-00000001-00000000
CPUID 00000007: 00000000-00000008-00000000-00000000
CPUID 00000008: 00000000-00000000-00000000-00000000
CPUID 00000009: 00000000-00000000-00000000-00000000
CPUID 0000000A: 00000000-00000000-00000000-00000000
CPUID 0000000C: 00000000-00000000-00000000-00000000
CPUID 0000000D: 00000007-00000340-000003C0-40000000
CPUID 0000000D: 00000100-00000240-00000000-00000000
CPUID 80000000: 8000001E-68747541-444D4163-69746E65
CPUID 80000001: 00600F20-10000000-01EBBFFF-2FD3FBFF
CPUID 80000002: 20444D41-74285846-382D296D-20303533 [AMD FX(tm)-8350 ]
CPUID 80000003: 68676945-6F432D74-50206572-65636F72 [Eight-Core Proce]
CPUID 80000004: 726F7373-20202020-20202020-00202020 [ssor           ]
CPUID 80000005: FF40FF18-FF40FF30-10040140-40020140
CPUID 80000006: 64006400-64004200-08008140-0040C140
CPUID 80000007: 00000000-00000000-00000000-000007D9
CPUID 80000008: 00003030-00000000-00004007-00000000
CPUID 80000009: 00000000-00000000-00000000-00000000
CPUID 8000000A: 00000001-00010000-00000000-00001CFF
CPUID 8000000B: 00000000-00000000-00000000-00000000
CPUID 8000000C: 00000000-00000000-00000000-00000000
CPUID 8000000D: 00000000-00000000-00000000-00000000
CPUID 8000000E: 00000000-00000000-00000000-00000000
CPUID 8000000F: 00000000-00000000-00000000-00000000
CPUID 80000010: 00000000-00000000-00000000-00000000
CPUID 80000011: 00000000-00000000-00000000-00000000
CPUID 80000012: 00000000-00000000-00000000-00000000
CPUID 80000013: 00000000-00000000-00000000-00000000
CPUID 80000014: 00000000-00000000-00000000-00000000
CPUID 80000015: 00000000-00000000-00000000-00000000
CPUID 80000016: 00000000-00000000-00000000-00000000
CPUID 80000017: 00000000-00000000-00000000-00000000
CPUID 80000018: 00000000-00000000-00000000-00000000
CPUID 80000019: F040F018-64006400-00000000-00000000
CPUID 8000001A: 00000003-00000000-00000000-00000000
CPUID 8000001B: 000000FF-00000000-00000000-00000000
CPUID 8000001C: 00000000-80032013-00010200-8000000F
CPUID 8000001D: 00000121-00C0003F-0000003F-00000000
CPUID 8000001D: 00004122-0040003F-000001FF-00000000
CPUID 8000001D: 00004143-03C0003F-000007FF-00000001
CPUID 8000001D: 0001C163-0FC0003F-000007FF-00000001
CPUID 8000001E: 00000011-00000100-00000000-00000000
CPUID 8FFFFFFF: 00000000-00000000-00000000-00000000 []

L1    Data Cache:     16 KB,  4-way Associative, 64-byte Line
L1  Instr. Cache:     64 KB,  2-way Associative, 64-byte Line
L2 Unified Cache:   2048 KB, 16-way Associative, 64-byte Line
L3 Unified Cache:   8192 KB, 64-way Associative, 64-byte Line

------[ Logical CPU #2 ]------

allcpu: Package 0 / Core 2 / Thread 0: Valid

CPUID 00000000: 0000000D-68747541-444D4163-69746E65 [AuthenticAMD]
CPUID 00000001: 00600F20-02080800-3E98320B-178BFBFF
CPUID 00000002: 00000000-00000000-00000000-00000000
CPUID 00000003: 00000000-00000000-00000000-00000000
CPUID 00000005: 00000040-00000040-00000003-00000000
CPUID 00000006: 00000000-00000000-00000001-00000000
CPUID 00000007: 00000000-00000008-00000000-00000000
CPUID 00000008: 00000000-00000000-00000000-00000000
CPUID 00000009: 00000000-00000000-00000000-00000000
CPUID 0000000A: 00000000-00000000-00000000-00000000
CPUID 0000000C: 00000000-00000000-00000000-00000000
CPUID 0000000D: 00000007-00000340-000003C0-40000000
CPUID 0000000D: 00000100-00000240-00000000-00000000
CPUID 80000000: 8000001E-68747541-444D4163-69746E65
CPUID 80000001: 00600F20-10000000-01EBBFFF-2FD3FBFF
CPUID 80000002: 20444D41-74285846-382D296D-20303533 [AMD FX(tm)-8350 ]
CPUID 80000003: 68676945-6F432D74-50206572-65636F72 [Eight-Core Proce]
CPUID 80000004: 726F7373-20202020-20202020-00202020 [ssor           ]
CPUID 80000005: FF40FF18-FF40FF30-10040140-40020140
CPUID 80000006: 64006400-64004200-08008140-0040C140
CPUID 80000007: 00000000-00000000-00000000-000007D9
CPUID 80000008: 00003030-00000000-00004007-00000000
CPUID 80000009: 00000000-00000000-00000000-00000000
CPUID 8000000A: 00000001-00010000-00000000-00001CFF
CPUID 8000000B: 00000000-00000000-00000000-00000000
CPUID 8000000C: 00000000-00000000-00000000-00000000
CPUID 8000000D: 00000000-00000000-00000000-00000000
CPUID 8000000E: 00000000-00000000-00000000-00000000
CPUID 8000000F: 00000000-00000000-00000000-00000000
CPUID 80000010: 00000000-00000000-00000000-00000000
CPUID 80000011: 00000000-00000000-00000000-00000000
CPUID 80000012: 00000000-00000000-00000000-00000000
CPUID 80000013: 00000000-00000000-00000000-00000000
CPUID 80000014: 00000000-00000000-00000000-00000000
CPUID 80000015: 00000000-00000000-00000000-00000000
CPUID 80000016: 00000000-00000000-00000000-00000000
CPUID 80000017: 00000000-00000000-00000000-00000000
CPUID 80000018: 00000000-00000000-00000000-00000000
CPUID 80000019: F040F018-64006400-00000000-00000000
CPUID 8000001A: 00000003-00000000-00000000-00000000
CPUID 8000001B: 000000FF-00000000-00000000-00000000
CPUID 8000001C: 00000000-80032013-00010200-8000000F
CPUID 8000001D: 00000121-00C0003F-0000003F-00000000
CPUID 8000001D: 00004122-0040003F-000001FF-00000000
CPUID 8000001D: 00004143-03C0003F-000007FF-00000001
CPUID 8000001D: 0001C163-0FC0003F-000007FF-00000001
CPUID 8000001E: 00000012-00000101-00000000-00000000
CPUID 8FFFFFFF: 00000000-00000000-00000000-00000000 []

L1    Data Cache:     16 KB,  4-way Associative, 64-byte Line
L1  Instr. Cache:     64 KB,  2-way Associative, 64-byte Line
L2 Unified Cache:   2048 KB, 16-way Associative, 64-byte Line
L3 Unified Cache:   8192 KB, 64-way Associative, 64-byte Line

------[ Logical CPU #3 ]------

allcpu: Package 0 / Core 3 / Thread 0: Valid

CPUID 00000000: 0000000D-68747541-444D4163-69746E65 [AuthenticAMD]
CPUID 00000001: 00600F20-03080800-3E98320B-178BFBFF
CPUID 00000002: 00000000-00000000-00000000-00000000
CPUID 00000003: 00000000-00000000-00000000-00000000
CPUID 00000005: 00000040-00000040-00000003-00000000
CPUID 00000006: 00000000-00000000-00000001-00000000
CPUID 00000007: 00000000-00000008-00000000-00000000
CPUID 00000008: 00000000-00000000-00000000-00000000
CPUID 00000009: 00000000-00000000-00000000-00000000
CPUID 0000000A: 00000000-00000000-00000000-00000000
CPUID 0000000C: 00000000-00000000-00000000-00000000
CPUID 0000000D: 00000007-00000340-000003C0-40000000
CPUID 0000000D: 00000100-00000240-00000000-00000000
CPUID 80000000: 8000001E-68747541-444D4163-69746E65
CPUID 80000001: 00600F20-10000000-01EBBFFF-2FD3FBFF
CPUID 80000002: 20444D41-74285846-382D296D-20303533 [AMD FX(tm)-8350 ]
CPUID 80000003: 68676945-6F432D74-50206572-65636F72 [Eight-Core Proce]
CPUID 80000004: 726F7373-20202020-20202020-00202020 [ssor           ]
CPUID 80000005: FF40FF18-FF40FF30-10040140-40020140
CPUID 80000006: 64006400-64004200-08008140-0040C140
CPUID 80000007: 00000000-00000000-00000000-000007D9
CPUID 80000008: 00003030-00000000-00004007-00000000
CPUID 80000009: 00000000-00000000-00000000-00000000
CPUID 8000000A: 00000001-00010000-00000000-00001CFF
CPUID 8000000B: 00000000-00000000-00000000-00000000
CPUID 8000000C: 00000000-00000000-00000000-00000000
CPUID 8000000D: 00000000-00000000-00000000-00000000
CPUID 8000000E: 00000000-00000000-00000000-00000000
CPUID 8000000F: 00000000-00000000-00000000-00000000
CPUID 80000010: 00000000-00000000-00000000-00000000
CPUID 80000011: 00000000-00000000-00000000-00000000
CPUID 80000012: 00000000-00000000-00000000-00000000
CPUID 80000013: 00000000-00000000-00000000-00000000
CPUID 80000014: 00000000-00000000-00000000-00000000
CPUID 80000015: 00000000-00000000-00000000-00000000
CPUID 80000016: 00000000-00000000-00000000-00000000
CPUID 80000017: 00000000-00000000-00000000-00000000
CPUID 80000018: 00000000-00000000-00000000-00000000
CPUID 80000019: F040F018-64006400-00000000-00000000
CPUID 8000001A: 00000003-00000000-00000000-00000000
CPUID 8000001B: 000000FF-00000000-00000000-00000000
CPUID 8000001C: 00000000-80032013-00010200-8000000F
CPUID 8000001D: 00000121-00C0003F-0000003F-00000000
CPUID 8000001D: 00004122-0040003F-000001FF-00000000
CPUID 8000001D: 00004143-03C0003F-000007FF-00000001
CPUID 8000001D: 0001C163-0FC0003F-000007FF-00000001
CPUID 8000001E: 00000013-00000101-00000000-00000000
CPUID 8FFFFFFF: 00000000-00000000-00000000-00000000 []

L1    Data Cache:     16 KB,  4-way Associative, 64-byte Line
L1  Instr. Cache:     64 KB,  2-way Associative, 64-byte Line
L2 Unified Cache:   2048 KB, 16-way Associative, 64-byte Line
L3 Unified Cache:   8192 KB, 64-way Associative, 64-byte Line

------[ Logical CPU #4 ]------

allcpu: Package 0 / Core 4 / Thread 0: Valid

CPUID 00000000: 0000000D-68747541-444D4163-69746E65 [AuthenticAMD]
CPUID 00000001: 00600F20-04080800-3E98320B-178BFBFF
CPUID 00000002: 00000000-00000000-00000000-00000000
CPUID 00000003: 00000000-00000000-00000000-00000000
CPUID 00000005: 00000040-00000040-00000003-00000000
CPUID 00000006: 00000000-00000000-00000001-00000000
CPUID 00000007: 00000000-00000008-00000000-00000000
CPUID 00000008: 00000000-00000000-00000000-00000000
CPUID 00000009: 00000000-00000000-00000000-00000000
CPUID 0000000A: 00000000-00000000-00000000-00000000
CPUID 0000000C: 00000000-00000000-00000000-00000000
CPUID 0000000D: 00000007-00000340-000003C0-40000000
CPUID 0000000D: 00000100-00000240-00000000-00000000
CPUID 80000000: 8000001E-68747541-444D4163-69746E65
CPUID 80000001: 00600F20-10000000-01EBBFFF-2FD3FBFF
CPUID 80000002: 20444D41-74285846-382D296D-20303533 [AMD FX(tm)-8350 ]
CPUID 80000003: 68676945-6F432D74-50206572-65636F72 [Eight-Core Proce]
CPUID 80000004: 726F7373-20202020-20202020-00202020 [ssor           ]
CPUID 80000005: FF40FF18-FF40FF30-10040140-40020140
CPUID 80000006: 64006400-64004200-08008140-0040C140
CPUID 80000007: 00000000-00000000-00000000-000007D9
CPUID 80000008: 00003030-00000000-00004007-00000000
CPUID 80000009: 00000000-00000000-00000000-00000000
CPUID 8000000A: 00000001-00010000-00000000-00001CFF
CPUID 8000000B: 00000000-00000000-00000000-00000000
CPUID 8000000C: 00000000-00000000-00000000-00000000
CPUID 8000000D: 00000000-00000000-00000000-00000000
CPUID 8000000E: 00000000-00000000-00000000-00000000
CPUID 8000000F: 00000000-00000000-00000000-00000000
CPUID 80000010: 00000000-00000000-00000000-00000000
CPUID 80000011: 00000000-00000000-00000000-00000000
CPUID 80000012: 00000000-00000000-00000000-00000000
CPUID 80000013: 00000000-00000000-00000000-00000000
CPUID 80000014: 00000000-00000000-00000000-00000000
CPUID 80000015: 00000000-00000000-00000000-00000000
CPUID 80000016: 00000000-00000000-00000000-00000000
CPUID 80000017: 00000000-00000000-00000000-00000000
CPUID 80000018: 00000000-00000000-00000000-00000000
CPUID 80000019: F040F018-64006400-00000000-00000000
CPUID 8000001A: 00000003-00000000-00000000-00000000
CPUID 8000001B: 000000FF-00000000-00000000-00000000
CPUID 8000001C: 00000000-80032013-00010200-8000000F
CPUID 8000001D: 00000121-00C0003F-0000003F-00000000
CPUID 8000001D: 00004122-0040003F-000001FF-00000000
CPUID 8000001D: 00004143-03C0003F-000007FF-00000001
CPUID 8000001D: 0001C163-0FC0003F-000007FF-00000001
CPUID 8000001E: 00000014-00000102-00000000-00000000
CPUID 8FFFFFFF: 00000000-00000000-00000000-00000000 []

L1    Data Cache:     16 KB,  4-way Associative, 64-byte Line
L1  Instr. Cache:     64 KB,  2-way Associative, 64-byte Line
L2 Unified Cache:   2048 KB, 16-way Associative, 64-byte Line
L3 Unified Cache:   8192 KB, 64-way Associative, 64-byte Line

------[ Logical CPU #5 ]------

allcpu: Package 0 / Core 5 / Thread 0: Valid

CPUID 00000000: 0000000D-68747541-444D4163-69746E65 [AuthenticAMD]
CPUID 00000001: 00600F20-05080800-3E98320B-178BFBFF
CPUID 00000002: 00000000-00000000-00000000-00000000
CPUID 00000003: 00000000-00000000-00000000-00000000
CPUID 00000005: 00000040-00000040-00000003-00000000
CPUID 00000006: 00000000-00000000-00000001-00000000
CPUID 00000007: 00000000-00000008-00000000-00000000
CPUID 00000008: 00000000-00000000-00000000-00000000
CPUID 00000009: 00000000-00000000-00000000-00000000
CPUID 0000000A: 00000000-00000000-00000000-00000000
CPUID 0000000C: 00000000-00000000-00000000-00000000
CPUID 0000000D: 00000007-00000340-000003C0-40000000
CPUID 0000000D: 00000100-00000240-00000000-00000000
CPUID 80000000: 8000001E-68747541-444D4163-69746E65
CPUID 80000001: 00600F20-10000000-01EBBFFF-2FD3FBFF
CPUID 80000002: 20444D41-74285846-382D296D-20303533 [AMD FX(tm)-8350 ]
CPUID 80000003: 68676945-6F432D74-50206572-65636F72 [Eight-Core Proce]
CPUID 80000004: 726F7373-20202020-20202020-00202020 [ssor           ]
CPUID 80000005: FF40FF18-FF40FF30-10040140-40020140
CPUID 80000006: 64006400-64004200-08008140-0040C140
CPUID 80000007: 00000000-00000000-00000000-000007D9
CPUID 80000008: 00003030-00000000-00004007-00000000
CPUID 80000009: 00000000-00000000-00000000-00000000
CPUID 8000000A: 00000001-00010000-00000000-00001CFF
CPUID 8000000B: 00000000-00000000-00000000-00000000
CPUID 8000000C: 00000000-00000000-00000000-00000000
CPUID 8000000D: 00000000-00000000-00000000-00000000
CPUID 8000000E: 00000000-00000000-00000000-00000000
CPUID 8000000F: 00000000-00000000-00000000-00000000
CPUID 80000010: 00000000-00000000-00000000-00000000
CPUID 80000011: 00000000-00000000-00000000-00000000
CPUID 80000012: 00000000-00000000-00000000-00000000
CPUID 80000013: 00000000-00000000-00000000-00000000
CPUID 80000014: 00000000-00000000-00000000-00000000
CPUID 80000015: 00000000-00000000-00000000-00000000
CPUID 80000016: 00000000-00000000-00000000-00000000
CPUID 80000017: 00000000-00000000-00000000-00000000
CPUID 80000018: 00000000-00000000-00000000-00000000
CPUID 80000019: F040F018-64006400-00000000-00000000
CPUID 8000001A: 00000003-00000000-00000000-00000000
CPUID 8000001B: 000000FF-00000000-00000000-00000000
CPUID 8000001C: 00000000-80032013-00010200-8000000F
CPUID 8000001D: 00000121-00C0003F-0000003F-00000000
CPUID 8000001D: 00004122-0040003F-000001FF-00000000
CPUID 8000001D: 00004143-03C0003F-000007FF-00000001
CPUID 8000001D: 0001C163-0FC0003F-000007FF-00000001
CPUID 8000001E: 00000015-00000102-00000000-00000000
CPUID 8FFFFFFF: 00000000-00000000-00000000-00000000 []

L1    Data Cache:     16 KB,  4-way Associative, 64-byte Line
L1  Instr. Cache:     64 KB,  2-way Associative, 64-byte Line
L2 Unified Cache:   2048 KB, 16-way Associative, 64-byte Line
L3 Unified Cache:   8192 KB, 64-way Associative, 64-byte Line

------[ Logical CPU #6 ]------

allcpu: Package 0 / Core 6 / Thread 0: Valid

CPUID 00000000: 0000000D-68747541-444D4163-69746E65 [AuthenticAMD]
CPUID 00000001: 00600F20-06080800-3E98320B-178BFBFF
CPUID 00000002: 00000000-00000000-00000000-00000000
CPUID 00000003: 00000000-00000000-00000000-00000000
CPUID 00000005: 00000040-00000040-00000003-00000000
CPUID 00000006: 00000000-00000000-00000001-00000000
CPUID 00000007: 00000000-00000008-00000000-00000000
CPUID 00000008: 00000000-00000000-00000000-00000000
CPUID 00000009: 00000000-00000000-00000000-00000000
CPUID 0000000A: 00000000-00000000-00000000-00000000
CPUID 0000000C: 00000000-00000000-00000000-00000000
CPUID 0000000D: 00000007-00000340-000003C0-40000000
CPUID 0000000D: 00000100-00000240-00000000-00000000
CPUID 80000000: 8000001E-68747541-444D4163-69746E65
CPUID 80000001: 00600F20-10000000-01EBBFFF-2FD3FBFF
CPUID 80000002: 20444D41-74285846-382D296D-20303533 [AMD FX(tm)-8350 ]
CPUID 80000003: 68676945-6F432D74-50206572-65636F72 [Eight-Core Proce]
CPUID 80000004: 726F7373-20202020-20202020-00202020 [ssor           ]
CPUID 80000005: FF40FF18-FF40FF30-10040140-40020140
CPUID 80000006: 64006400-64004200-08008140-0040C140
CPUID 80000007: 00000000-00000000-00000000-000007D9
CPUID 80000008: 00003030-00000000-00004007-00000000
CPUID 80000009: 00000000-00000000-00000000-00000000
CPUID 8000000A: 00000001-00010000-00000000-00001CFF
CPUID 8000000B: 00000000-00000000-00000000-00000000
CPUID 8000000C: 00000000-00000000-00000000-00000000
CPUID 8000000D: 00000000-00000000-00000000-00000000
CPUID 8000000E: 00000000-00000000-00000000-00000000
CPUID 8000000F: 00000000-00000000-00000000-00000000
CPUID 80000010: 00000000-00000000-00000000-00000000
CPUID 80000011: 00000000-00000000-00000000-00000000
CPUID 80000012: 00000000-00000000-00000000-00000000
CPUID 80000013: 00000000-00000000-00000000-00000000
CPUID 80000014: 00000000-00000000-00000000-00000000
CPUID 80000015: 00000000-00000000-00000000-00000000
CPUID 80000016: 00000000-00000000-00000000-00000000
CPUID 80000017: 00000000-00000000-00000000-00000000
CPUID 80000018: 00000000-00000000-00000000-00000000
CPUID 80000019: F040F018-64006400-00000000-00000000
CPUID 8000001A: 00000003-00000000-00000000-00000000
CPUID 8000001B: 000000FF-00000000-00000000-00000000
CPUID 8000001C: 00000000-80032013-00010200-8000000F
CPUID 8000001D: 00000121-00C0003F-0000003F-00000000
CPUID 8000001D: 00004122-0040003F-000001FF-00000000
CPUID 8000001D: 00004143-03C0003F-000007FF-00000001
CPUID 8000001D: 0001C163-0FC0003F-000007FF-00000001
CPUID 8000001E: 00000016-00000103-00000000-00000000
CPUID 8FFFFFFF: 00000000-00000000-00000000-00000000 []

L1    Data Cache:     16 KB,  4-way Associative, 64-byte Line
L1  Instr. Cache:     64 KB,  2-way Associative, 64-byte Line
L2 Unified Cache:   2048 KB, 16-way Associative, 64-byte Line
L3 Unified Cache:   8192 KB, 64-way Associative, 64-byte Line

------[ Logical CPU #7 ]------

allcpu: Package 0 / Core 7 / Thread 0: Valid

CPUID 00000000: 0000000D-68747541-444D4163-69746E65 [AuthenticAMD]
CPUID 00000001: 00600F20-07080800-3E98320B-178BFBFF
CPUID 00000002: 00000000-00000000-00000000-00000000
CPUID 00000003: 00000000-00000000-00000000-00000000
CPUID 00000005: 00000040-00000040-00000003-00000000
CPUID 00000006: 00000000-00000000-00000001-00000000
CPUID 00000007: 00000000-00000008-00000000-00000000
CPUID 00000008: 00000000-00000000-00000000-00000000
CPUID 00000009: 00000000-00000000-00000000-00000000
CPUID 0000000A: 00000000-00000000-00000000-00000000
CPUID 0000000C: 00000000-00000000-00000000-00000000
CPUID 0000000D: 00000007-00000340-000003C0-40000000
CPUID 0000000D: 00000100-00000240-00000000-00000000
CPUID 80000000: 8000001E-68747541-444D4163-69746E65
CPUID 80000001: 00600F20-10000000-01EBBFFF-2FD3FBFF
CPUID 80000002: 20444D41-74285846-382D296D-20303533 [AMD FX(tm)-8350 ]
CPUID 80000003: 68676945-6F432D74-50206572-65636F72 [Eight-Core Proce]
CPUID 80000004: 726F7373-20202020-20202020-00202020 [ssor           ]
CPUID 80000005: FF40FF18-FF40FF30-10040140-40020140
CPUID 80000006: 64006400-64004200-08008140-0040C140
CPUID 80000007: 00000000-00000000-00000000-000007D9
CPUID 80000008: 00003030-00000000-00004007-00000000
CPUID 80000009: 00000000-00000000-00000000-00000000
CPUID 8000000A: 00000001-00010000-00000000-00001CFF
CPUID 8000000B: 00000000-00000000-00000000-00000000
CPUID 8000000C: 00000000-00000000-00000000-00000000
CPUID 8000000D: 00000000-00000000-00000000-00000000
CPUID 8000000E: 00000000-00000000-00000000-00000000
CPUID 8000000F: 00000000-00000000-00000000-00000000
CPUID 80000010: 00000000-00000000-00000000-00000000
CPUID 80000011: 00000000-00000000-00000000-00000000
CPUID 80000012: 00000000-00000000-00000000-00000000
CPUID 80000013: 00000000-00000000-00000000-00000000
CPUID 80000014: 00000000-00000000-00000000-00000000
CPUID 80000015: 00000000-00000000-00000000-00000000
CPUID 80000016: 00000000-00000000-00000000-00000000
CPUID 80000017: 00000000-00000000-00000000-00000000
CPUID 80000018: 00000000-00000000-00000000-00000000
CPUID 80000019: F040F018-64006400-00000000-00000000
CPUID 8000001A: 00000003-00000000-00000000-00000000
CPUID 8000001B: 000000FF-00000000-00000000-00000000
CPUID 8000001C: 00000000-80032013-00010200-8000000F
CPUID 8000001D: 00000121-00C0003F-0000003F-00000000
CPUID 8000001D: 00004122-0040003F-000001FF-00000000
CPUID 8000001D: 00004143-03C0003F-000007FF-00000001
CPUID 8000001D: 0001C163-0FC0003F-000007FF-00000001
CPUID 8000001E: 00000017-00000103-00000000-00000000
CPUID 8FFFFFFF: 00000000-00000000-00000000-00000000 []

L1    Data Cache:     16 KB,  4-way Associative, 64-byte Line
L1  Instr. Cache:     64 KB,  2-way Associative, 64-byte Line
L2 Unified Cache:   2048 KB, 16-way Associative, 64-byte Line
L3 Unified Cache:   8192 KB, 64-way Associative, 64-byte Line

------[ All CPUs ]------

CPU   0: APICID   0 / Package 0 / Core  0 / Thread 0: Valid
CPU   1: APICID   1 / Package 0 / Core  1 / Thread 0: Valid
CPU   2: APICID   2 / Package 0 / Core  2 / Thread 0: Valid
CPU   3: APICID   3 / Package 0 / Core  3 / Thread 0: Valid
CPU   4: APICID   4 / Package 0 / Core  4 / Thread 0: Valid
CPU   5: APICID   5 / Package 0 / Core  5 / Thread 0: Valid
CPU   6: APICID   6 / Package 0 / Core  6 / Thread 0: Valid
CPU   7: APICID   7 / Package 0 / Core  7 / Thread 0: Valid

------[ MSR Registers ]------

CPU Clock (Normal): 1405 MHz
CPU Clock (TSC): 4014 MHz
CPU Multiplier: 7.0x
CPB PStates: 2
MSR 0000001B: 0000-0000-FEE0-0900
MSR 0000008B: 0000-0000-0600-081F
MSR 000000E7: 0000-0000-04B2-4EEA
MSR 000000E8: 0000-0000-04D0-0292
MSR C0010015: 0000-0000-0900-1011
MSR C001001F: 0040-4000-0081-0008
MSR C0010055: 0000-0000-2000-0800
MSR C0010058: 0000-0000-E000-0021
MSR C0010061: 0000-0000-0000-0040
MSR C0010062: 0000-0000-0000-0000
MSR C0010063: 0000-0000-0000-0000
MSR C0010064: 8000-0186-0000-161A [21.00x] [1.4125 V] [13.40 A] [PState Pb0]
MSR C0010065: 8000-0186-0000-1619 [20.50x] [1.4125 V] [13.40 A] [PState Pb1]
MSR C0010066: 8000-0177-0000-1A18 [20.00x] [1.3875 V] [11.90 A] [PState P0]
MSR C0010067: 8000-015F-0000-2A12 [17.00x] [1.2875 V] [ 9.50 A] [PState P1]
MSR C0010068: 8000-014B-0000-3A0C [14.00x] [1.1875 V] [ 7.50 A] [PState P2]
MSR C0010069: 8000-0136-0000-4E05 [10.50x] [1.0625 V] [ 5.40 A] [PState P3]
MSR C001006A: 8000-0124-0000-624C [ 7.00x] [0.9375 V] [ 3.60 A] [PState P4]
MSR C001006B: 0000-0000-0000-0000
MSR C0010070: 0000-0000-1C01-1619
MSR C0010071: 0100-0006-3A01-1619 [20.50x] [1.4125V]
MSR C0010071: 0100-0006-3A01-1619 [20.50x] [1.4125V]
MSR C0010071: 0100-0006-3A06-164C [ 7.00x] [1.4125V]
MSR C0010071: 0100-0006-3A06-164C [ 7.00x] [1.4125V]
MSR C0010071: 0100-0006-3A06-164C [ 7.00x] [1.4125V]
MSR C0010140: 0000-0000-0000-0005
MSR C0010141: 0000-0000-0000-0010
MSR C0011023: 8100-4000-0078-0220

PerformanceFrequency = 3919628

CPU Clock M.Method = 6  (APIC K10)
PM Timer Address   = 2056  (0808h)

APIC Clock = 200.67 MHz
APIC Clock = 200.68 MHz
APIC Clock = 200.68 MHz
APIC Clock = 200.68 MHz
APIC Clock = 200.69 MHz
