------[ Versions ]------

Program Version : AIDA64 v4.30.2931 Beta
BenchDLL Version: 4.1.611-x64

------[ CPU Info ]------

CPU Type          : QuadCore AMD Athlon 5350, 2046 MHz (20.5 x 100)
CPU Alias         : Kabini
CPU Platform      : Socket AM1 (FS1b)
CPU Stepping      : KB-A1
Instruction Set   : x86, x86-64, MMX, SSE, SSE2, SSE3, SSSE3, SSE4.1, SSE4.2, SSE4A, AVX, AES
CPUID Manufacturer: AuthenticAMD
CPUID CPU Name    : AMD Athlon(tm) 5350 APU with Radeon(tm) R3
CPUID Revision    : 00700F01h
Platform ID       : E2h  (Socket AM1 (FS1b))
HTT / CMP Units   : 0 / 4
Max. NUMA Node    : 0

Tjmax Temperature    : 0 Celsius
HTC Temperature Limit: 70 Celsius
CPU TDP              : 25 W

------[ Logical CPU #0 ]------

allcpu: Package 0 / Core 0 / Thread 0: Valid

CPUID 00000000: 0000000D-68747541-444D4163-69746E65 [AuthenticAMD]
CPUID 00000001: 00700F01-00040800-3ED8220B-178BFBFF
CPUID 00000002: 00000000-00000000-00000000-00000000
CPUID 00000003: 00000000-00000000-00000000-00000000
CPUID 00000005: 00000040-00000040-00000003-00000000
CPUID 00000006: 00000000-00000000-00000001-00000000
CPUID 00000007: 00000000-00000008-00000000-00000000
CPUID 00000008: 00000000-00000000-00000000-00000000
CPUID 00000009: 00000000-00000000-00000000-00000000
CPUID 0000000A: 00000000-00000000-00000000-00000000
CPUID 0000000C: 00000000-00000000-00000000-00000000
CPUID 0000000D: 00000007-00000340-00000340-00000000 [SL 00]
CPUID 0000000D: 00000001-00000000-00000000-00000000 [SL 01]
CPUID 0000000D: 00000100-00000240-00000000-00000000 [SL 02]
CPUID 80000000: 8000001E-68747541-444D4163-69746E65 [AuthenticAMD]
CPUID 80000001: 00700F01-10000000-154037FF-2FD3FBFF
CPUID 80000002: 20444D41-6C687441-74286E6F-3520296D [AMD Athlon(tm) 5]
CPUID 80000003: 20303533-20555041-68746977-64615220 [350 APU with Rad]
CPUID 80000004: 286E6F65-20296D74-20203352-00202020 [eon(tm) R3     ]
CPUID 80000005: FF08FF08-FF28FF20-20080140-20020140
CPUID 80000006: 21000000-42004200-08008140-00000000
CPUID 80000007: 0D6B0101-00000001-00000000-000009D9
CPUID 80000008: 00003028-00000000-00003003-00000000
CPUID 80000009: 00000000-00000000-00000000-00000000
CPUID 8000000A: 00000001-00000008-00000000-00001CDF
CPUID 8000000B: 00000000-00000000-00000000-00000000
CPUID 8000000C: 00000000-00000000-00000000-00000000
CPUID 8000000D: 00000000-00000000-00000000-00000000
CPUID 8000000E: 00000000-00000000-00000000-00000000
CPUID 8000000F: 00000000-00000000-00000000-00000000
CPUID 80000010: 00000000-00000000-00000000-00000000
CPUID 80000011: 00000000-00000000-00000000-00000000
CPUID 80000012: 00000000-00000000-00000000-00000000
CPUID 80000013: 00000000-00000000-00000000-00000000
CPUID 80000014: 00000000-00000000-00000000-00000000
CPUID 80000015: 00000000-00000000-00000000-00000000
CPUID 80000016: 00000000-00000000-00000000-00000000
CPUID 80000017: 00000000-00000000-00000000-00000000
CPUID 80000018: 00000000-00000000-00000000-00000000
CPUID 80000019: 00000000-00000000-00000000-00000000
CPUID 8000001A: 00000003-00000000-00000000-00000000
CPUID 8000001B: 000000FF-00000000-00000000-00000000
CPUID 8000001C: 00000000-00000000-00000000-00000000
CPUID 8000001D: 00000121-01C0003F-0000003F-00000000 [SL 00]
CPUID 8000001D: 00000122-0040003F-000000FF-00000000 [SL 01]
CPUID 8000001D: 0000C143-03C0003F-000007FF-00000002 [SL 02]
CPUID 8000001E: 00000000-00000000-00000000-00000000
CPUID 8FFFFFFF: 4C4C4548-494B204F-21595454-5E2D5E20 [HELLO KITTY! ^-^]

L1    Data Cache:    32 KB,  8-way Associative, 64-byte Line
L1  Instr. Cache:    32 KB,  2-way Associative, 64-byte Line
L2 Unified Cache:     2 MB, 16-way Associative, 64-byte Line

------[ Logical CPU #1 ]------

allcpu: Package 0 / Core 1 / Thread 0: Valid

CPUID 00000000: 0000000D-68747541-444D4163-69746E65 [AuthenticAMD]
CPUID 00000001: 00700F01-01040800-3ED8220B-178BFBFF
CPUID 00000002: 00000000-00000000-00000000-00000000
CPUID 00000003: 00000000-00000000-00000000-00000000
CPUID 00000005: 00000040-00000040-00000003-00000000
CPUID 00000006: 00000000-00000000-00000001-00000000
CPUID 00000007: 00000000-00000008-00000000-00000000
CPUID 00000008: 00000000-00000000-00000000-00000000
CPUID 00000009: 00000000-00000000-00000000-00000000
CPUID 0000000A: 00000000-00000000-00000000-00000000
CPUID 0000000C: 00000000-00000000-00000000-00000000
CPUID 0000000D: 00000007-00000340-00000340-00000000 [SL 00]
CPUID 0000000D: 00000001-00000000-00000000-00000000 [SL 01]
CPUID 0000000D: 00000100-00000240-00000000-00000000 [SL 02]
CPUID 80000000: 8000001E-68747541-444D4163-69746E65 [AuthenticAMD]
CPUID 80000001: 00700F01-10000000-154037FF-2FD3FBFF
CPUID 80000002: 20444D41-6C687441-74286E6F-3520296D [AMD Athlon(tm) 5]
CPUID 80000003: 20303533-20555041-68746977-64615220 [350 APU with Rad]
CPUID 80000004: 286E6F65-20296D74-20203352-00202020 [eon(tm) R3     ]
CPUID 80000005: FF08FF08-FF28FF20-20080140-20020140
CPUID 80000006: 21000000-42004200-08008140-00000000
CPUID 80000007: 0D6B0101-00000001-00000000-000009D9
CPUID 80000008: 00003028-00000000-00003003-00000000
CPUID 80000009: 00000000-00000000-00000000-00000000
CPUID 8000000A: 00000001-00000008-00000000-00001CDF
CPUID 8000000B: 00000000-00000000-00000000-00000000
CPUID 8000000C: 00000000-00000000-00000000-00000000
CPUID 8000000D: 00000000-00000000-00000000-00000000
CPUID 8000000E: 00000000-00000000-00000000-00000000
CPUID 8000000F: 00000000-00000000-00000000-00000000
CPUID 80000010: 00000000-00000000-00000000-00000000
CPUID 80000011: 00000000-00000000-00000000-00000000
CPUID 80000012: 00000000-00000000-00000000-00000000
CPUID 80000013: 00000000-00000000-00000000-00000000
CPUID 80000014: 00000000-00000000-00000000-00000000
CPUID 80000015: 00000000-00000000-00000000-00000000
CPUID 80000016: 00000000-00000000-00000000-00000000
CPUID 80000017: 00000000-00000000-00000000-00000000
CPUID 80000018: 00000000-00000000-00000000-00000000
CPUID 80000019: 00000000-00000000-00000000-00000000
CPUID 8000001A: 00000003-00000000-00000000-00000000
CPUID 8000001B: 000000FF-00000000-00000000-00000000
CPUID 8000001C: 00000000-00000000-00000000-00000000
CPUID 8000001D: 00000121-01C0003F-0000003F-00000000 [SL 00]
CPUID 8000001D: 00000122-0040003F-000000FF-00000000 [SL 01]
CPUID 8000001D: 0000C143-03C0003F-000007FF-00000002 [SL 02]
CPUID 8000001E: 00000001-00000001-00000000-00000000
CPUID 8FFFFFFF: 4C4C4548-494B204F-21595454-5E2D5E20 [HELLO KITTY! ^-^]

L1    Data Cache:    32 KB,  8-way Associative, 64-byte Line
L1  Instr. Cache:    32 KB,  2-way Associative, 64-byte Line
L2 Unified Cache:     2 MB, 16-way Associative, 64-byte Line

------[ Logical CPU #2 ]------

allcpu: Package 0 / Core 2 / Thread 0: Valid

CPUID 00000000: 0000000D-68747541-444D4163-69746E65 [AuthenticAMD]
CPUID 00000001: 00700F01-02040800-3ED8220B-178BFBFF
CPUID 00000002: 00000000-00000000-00000000-00000000
CPUID 00000003: 00000000-00000000-00000000-00000000
CPUID 00000005: 00000040-00000040-00000003-00000000
CPUID 00000006: 00000000-00000000-00000001-00000000
CPUID 00000007: 00000000-00000008-00000000-00000000
CPUID 00000008: 00000000-00000000-00000000-00000000
CPUID 00000009: 00000000-00000000-00000000-00000000
CPUID 0000000A: 00000000-00000000-00000000-00000000
CPUID 0000000C: 00000000-00000000-00000000-00000000
CPUID 0000000D: 00000007-00000340-00000340-00000000 [SL 00]
CPUID 0000000D: 00000001-00000000-00000000-00000000 [SL 01]
CPUID 0000000D: 00000100-00000240-00000000-00000000 [SL 02]
CPUID 80000000: 8000001E-68747541-444D4163-69746E65 [AuthenticAMD]
CPUID 80000001: 00700F01-10000000-154037FF-2FD3FBFF
CPUID 80000002: 20444D41-6C687441-74286E6F-3520296D [AMD Athlon(tm) 5]
CPUID 80000003: 20303533-20555041-68746977-64615220 [350 APU with Rad]
CPUID 80000004: 286E6F65-20296D74-20203352-00202020 [eon(tm) R3     ]
CPUID 80000005: FF08FF08-FF28FF20-20080140-20020140
CPUID 80000006: 21000000-42004200-08008140-00000000
CPUID 80000007: 0D6B0101-00000001-00000000-000009D9
CPUID 80000008: 00003028-00000000-00003003-00000000
CPUID 80000009: 00000000-00000000-00000000-00000000
CPUID 8000000A: 00000001-00000008-00000000-00001CDF
CPUID 8000000B: 00000000-00000000-00000000-00000000
CPUID 8000000C: 00000000-00000000-00000000-00000000
CPUID 8000000D: 00000000-00000000-00000000-00000000
CPUID 8000000E: 00000000-00000000-00000000-00000000
CPUID 8000000F: 00000000-00000000-00000000-00000000
CPUID 80000010: 00000000-00000000-00000000-00000000
CPUID 80000011: 00000000-00000000-00000000-00000000
CPUID 80000012: 00000000-00000000-00000000-00000000
CPUID 80000013: 00000000-00000000-00000000-00000000
CPUID 80000014: 00000000-00000000-00000000-00000000
CPUID 80000015: 00000000-00000000-00000000-00000000
CPUID 80000016: 00000000-00000000-00000000-00000000
CPUID 80000017: 00000000-00000000-00000000-00000000
CPUID 80000018: 00000000-00000000-00000000-00000000
CPUID 80000019: 00000000-00000000-00000000-00000000
CPUID 8000001A: 00000003-00000000-00000000-00000000
CPUID 8000001B: 000000FF-00000000-00000000-00000000
CPUID 8000001C: 00000000-00000000-00000000-00000000
CPUID 8000001D: 00000121-01C0003F-0000003F-00000000 [SL 00]
CPUID 8000001D: 00000122-0040003F-000000FF-00000000 [SL 01]
CPUID 8000001D: 0000C143-03C0003F-000007FF-00000002 [SL 02]
CPUID 8000001E: 00000002-00000002-00000000-00000000
CPUID 8FFFFFFF: 4C4C4548-494B204F-21595454-5E2D5E20 [HELLO KITTY! ^-^]

L1    Data Cache:    32 KB,  8-way Associative, 64-byte Line
L1  Instr. Cache:    32 KB,  2-way Associative, 64-byte Line
L2 Unified Cache:     2 MB, 16-way Associative, 64-byte Line

------[ Logical CPU #3 ]------

allcpu: Package 0 / Core 3 / Thread 0: Valid

CPUID 00000000: 0000000D-68747541-444D4163-69746E65 [AuthenticAMD]
CPUID 00000001: 00700F01-03040800-3ED8220B-178BFBFF
CPUID 00000002: 00000000-00000000-00000000-00000000
CPUID 00000003: 00000000-00000000-00000000-00000000
CPUID 00000005: 00000040-00000040-00000003-00000000
CPUID 00000006: 00000000-00000000-00000001-00000000
CPUID 00000007: 00000000-00000008-00000000-00000000
CPUID 00000008: 00000000-00000000-00000000-00000000
CPUID 00000009: 00000000-00000000-00000000-00000000
CPUID 0000000A: 00000000-00000000-00000000-00000000
CPUID 0000000C: 00000000-00000000-00000000-00000000
CPUID 0000000D: 00000007-00000340-00000340-00000000 [SL 00]
CPUID 0000000D: 00000001-00000000-00000000-00000000 [SL 01]
CPUID 0000000D: 00000100-00000240-00000000-00000000 [SL 02]
CPUID 80000000: 8000001E-68747541-444D4163-69746E65 [AuthenticAMD]
CPUID 80000001: 00700F01-10000000-154037FF-2FD3FBFF
CPUID 80000002: 20444D41-6C687441-74286E6F-3520296D [AMD Athlon(tm) 5]
CPUID 80000003: 20303533-20555041-68746977-64615220 [350 APU with Rad]
CPUID 80000004: 286E6F65-20296D74-20203352-00202020 [eon(tm) R3     ]
CPUID 80000005: FF08FF08-FF28FF20-20080140-20020140
CPUID 80000006: 21000000-42004200-08008140-00000000
CPUID 80000007: 0D6B0101-00000001-00000000-000009D9
CPUID 80000008: 00003028-00000000-00003003-00000000
CPUID 80000009: 00000000-00000000-00000000-00000000
CPUID 8000000A: 00000001-00000008-00000000-00001CDF
CPUID 8000000B: 00000000-00000000-00000000-00000000
CPUID 8000000C: 00000000-00000000-00000000-00000000
CPUID 8000000D: 00000000-00000000-00000000-00000000
CPUID 8000000E: 00000000-00000000-00000000-00000000
CPUID 8000000F: 00000000-00000000-00000000-00000000
CPUID 80000010: 00000000-00000000-00000000-00000000
CPUID 80000011: 00000000-00000000-00000000-00000000
CPUID 80000012: 00000000-00000000-00000000-00000000
CPUID 80000013: 00000000-00000000-00000000-00000000
CPUID 80000014: 00000000-00000000-00000000-00000000
CPUID 80000015: 00000000-00000000-00000000-00000000
CPUID 80000016: 00000000-00000000-00000000-00000000
CPUID 80000017: 00000000-00000000-00000000-00000000
CPUID 80000018: 00000000-00000000-00000000-00000000
CPUID 80000019: 00000000-00000000-00000000-00000000
CPUID 8000001A: 00000003-00000000-00000000-00000000
CPUID 8000001B: 000000FF-00000000-00000000-00000000
CPUID 8000001C: 00000000-00000000-00000000-00000000
CPUID 8000001D: 00000121-01C0003F-0000003F-00000000 [SL 00]
CPUID 8000001D: 00000122-0040003F-000000FF-00000000 [SL 01]
CPUID 8000001D: 0000C143-03C0003F-000007FF-00000002 [SL 02]
CPUID 8000001E: 00000003-00000003-00000000-00000000
CPUID 8FFFFFFF: 4C4C4548-494B204F-21595454-5E2D5E20 [HELLO KITTY! ^-^]

L1    Data Cache:    32 KB,  8-way Associative, 64-byte Line
L1  Instr. Cache:    32 KB,  2-way Associative, 64-byte Line
L2 Unified Cache:     2 MB, 16-way Associative, 64-byte Line

------[ All CPUs ]------

CPU   0: APICID   0 / Package 0 / Core  0 / Thread 0: Valid
CPU   1: APICID   1 / Package 0 / Core  1 / Thread 0: Valid
CPU   2: APICID   2 / Package 0 / Core  2 / Thread 0: Valid
CPU   3: APICID   3 / Package 0 / Core  3 / Thread 0: Valid

------[ MSR Registers ]------

CPU Clock (Normal): 2046 MHz
CPU Clock (TSC): 2046 MHz
CPU Multiplier: 20.5x
MSR 0000001B: 0000-0000-FEE0-0900
MSR 0000008B: 0000-0000-0700-010B
MSR 000000E7: 0000-0000-0262-E0F7
MSR 000000E8: 0000-0000-0263-0D79
MSR C0010004: 0000-0000-0000-0000
MSR C0010005: 0000-0000-0000-0000
MSR C0010006: 0000-0000-0000-0000
MSR C0010007: 0000-0000-0000-0000
MSR C0010015: 0000-0000-0100-0011
MSR C001001F: 40C8-4000-0081-0000
MSR C0010055: 0000-0000-0000-0000
MSR C0010058: 0000-0000-E000-0021
MSR C0010061: 0000-0000-0000-0060
MSR C0010062: 0000-0000-0000-0000
MSR C0010063: 0000-0000-0000-0000
MSR C0010064: 8000-0127-0000-5859 [20.50x] [1.2750 V] [ 3.90 A] [PState P0]
MSR C0010065: 8000-0124-0000-5C55 [18.50x] [1.2625 V] [ 3.60 A] [PState P1]
MSR C0010066: 8000-011E-0000-6C51 [16.50x] [1.2125 V] [ 3.00 A] [PState P2]
MSR C0010067: 8000-0119-0000-7C4C [14.00x] [1.1625 V] [ 2.50 A] [PState P3]
MSR C0010068: 8000-02CE-0000-9448 [12.00x] [1.0875 V] [ 2.06 A] [PState P4]
MSR C0010069: 8000-02B1-0000-A044 [10.00x] [1.0500 V] [ 1.77 A] [PState P5]
MSR C001006A: 8000-0295-0040-AC40 [ 8.00x] [1.0125 V] [ 1.49 A] [PState P6]
MSR C001006B: 0000-0000-0001-FE00
MSR C0010070: 0000-0000-6000-5859
MSR C0010071: 40AA-0005-6440-5859 [20.50x] [1.2750V]
MSR C0010071: 40AA-0005-6446-AC40 [ 8.00x] [1.0125V]
MSR C0010071: 40AA-0005-6446-AC40 [ 8.00x] [1.0125V]
MSR C0010071: 40AA-0005-6446-AC40 [ 8.00x] [1.0125V]
MSR C0010071: 40AA-0005-6446-AC40 [ 8.00x] [1.0125V]
MSR C0010140: 0000-0000-0000-0000
MSR C0010141: 0000-0000-0000-0000
MSR C0011023: 0000-0000-0000-0000

PerformanceFrequency = 1998281

CPU Clock M.Method = 6  (APIC K10)
PM Timer Address   = 2056  (0808h)

APIC Clock = 99.82 MHz
APIC Clock = 99.81 MHz
APIC Clock = 99.81 MHz
APIC Clock = 99.81 MHz
APIC Clock = 99.82 MHz

------[ APIC Base at 00000000-FEE00000 ]------

  0000  00 00 00 00 00 00 00 00 00 00 00 00 00 00 00 00 
  0010  00 00 00 00 00 00 00 00 00 00 00 00 00 00 00 00 
  0020  00 00 00 00 00 00 00 00 00 00 00 00 00 00 00 00 
  0030  10 00 05 80 00 00 00 00 10 00 05 80 00 00 00 00 
  0040  00 00 00 00 00 00 00 00 00 00 00 00 00 00 00 00 
  0050  00 00 00 00 00 00 00 00 00 00 00 00 00 00 00 00 
  0060  00 00 00 00 00 00 00 00 00 00 00 00 00 00 00 00 
  0070  00 00 00 00 00 00 00 00 00 00 00 00 00 00 00 00 
  0080  00 00 00 00 00 00 00 00 00 00 00 00 00 00 00 00 
  0090  00 00 00 00 00 00 00 00 00 00 00 00 00 00 00 00 
  00A0  00 00 00 00 00 00 00 00 00 00 00 00 00 00 00 00 
  00B0  00 00 00 00 00 00 00 00 00 00 00 00 00 00 00 00 
  00C0  AD 00 DE 00 00 00 00 00 AD 00 DE 00 00 00 00 00 
  00D0  00 00 00 01 00 00 00 00 00 00 00 01 00 00 00 00 
  00E0  FF FF FF FF 00 00 00 00 FF FF FF FF 00 00 00 00 
  00F0  3F 01 00 00 00 00 00 00 3F 01 00 00 00 00 00 00 
  0100  00 00 00 00 00 00 00 00 00 00 00 00 00 00 00 00 
  0110  00 00 00 00 00 00 00 00 00 00 00 00 00 00 00 00 
  0120  00 00 00 00 00 00 00 00 00 00 00 00 00 00 00 00 
  0130  00 00 00 00 00 00 00 00 00 00 00 00 00 00 00 00 
  0140  00 00 00 00 00 00 00 00 00 00 00 00 00 00 00 00 
  0150  00 00 00 00 00 00 00 00 00 00 00 00 00 00 00 00 
  0160  00 00 00 00 00 00 00 00 00 00 00 00 00 00 00 00 
  0170  00 00 00 00 00 00 00 00 00 00 00 00 00 00 00 00 
  0180  00 00 00 00 00 00 00 00 00 00 00 00 00 00 00 00 
  0190  00 00 00 00 00 00 00 00 00 00 00 00 00 00 00 00 
  01A0  00 00 00 00 00 00 00 00 00 00 00 00 00 00 00 00 
  01B0  08 00 0C 00 00 00 00 00 08 00 0C 00 00 00 00 00 
  01C0  0C 00 00 00 00 00 00 00 0C 00 00 00 00 00 00 00 
  01D0  00 00 02 00 00 00 00 00 00 00 02 00 00 00 00 00 
  01E0  00 00 00 00 00 00 00 00 00 00 00 00 00 00 00 00 
  01F0  00 00 00 00 00 00 00 00 00 00 00 00 00 00 00 00 
  0200  00 00 00 00 00 00 00 00 00 00 00 00 00 00 00 00 
  0210  00 00 00 00 00 00 00 00 00 00 00 00 00 00 00 00 
  0220  00 00 00 00 00 00 00 00 00 00 00 00 00 00 00 00 
  0230  00 00 00 00 00 00 00 00 00 00 00 00 00 00 00 00 
  0240  00 00 00 00 00 00 00 00 00 00 00 00 00 00 00 00 
  0250  00 00 00 00 00 00 00 00 00 00 00 00 00 00 00 00 
  0260  00 00 00 00 00 00 00 00 00 00 00 00 00 00 00 00 
  0270  00 00 00 00 00 00 00 00 00 00 00 00 00 00 00 00 
  0280  80 00 00 00 00 00 00 00 80 00 00 00 00 00 00 00 
  0290  00 00 00 00 00 00 00 00 00 00 00 00 00 00 00 00 
  02A0  00 00 00 00 00 00 00 00 00 00 00 00 00 00 00 00 
  02B0  00 00 00 00 00 00 00 00 00 00 00 00 00 00 00 00 
  02C0  00 00 00 00 00 00 00 00 00 00 00 00 00 00 00 00 
  02D0  00 00 00 00 00 00 00 00 00 00 00 00 00 00 00 00 
  02E0  00 00 00 00 00 00 00 00 00 00 00 00 00 00 00 00 
  02F0  00 00 00 00 00 00 00 00 00 00 00 00 00 00 00 00 
  0300  2F 00 02 00 00 00 00 00 2F 00 02 00 00 00 00 00 
  0310  00 00 00 01 00 00 00 00 00 00 00 01 00 00 00 00 
  0320  FD 00 03 00 00 00 00 00 FD 00 03 00 00 00 00 00 
  0330  00 00 01 00 00 00 00 00 00 00 01 00 00 00 00 00 
  0340  FE 00 00 00 00 00 00 00 FE 00 00 00 00 00 00 00 
  0350  3F 00 01 00 00 00 00 00 3F 00 01 00 00 00 00 00 
  0360  FF 04 00 00 00 00 00 00 FF 04 00 00 00 00 00 00 
  0370  E3 00 00 00 00 00 00 00 E3 00 00 00 00 00 00 00 
  0380  00 00 00 00 00 00 00 00 00 00 00 00 00 00 00 00 
  0390  00 00 00 00 00 00 00 00 00 00 00 00 00 00 00 00 
  03A0  00 00 00 00 00 00 00 00 00 00 00 00 00 00 00 00 
  03B0  00 00 00 00 00 00 00 00 00 00 00 00 00 00 00 00 
  03C0  00 00 00 00 00 00 00 00 00 00 00 00 00 00 00 00 
  03D0  00 00 00 00 00 00 00 00 00 00 00 00 00 00 00 00 
  03E0  0B 00 00 00 00 00 00 00 0B 00 00 00 00 00 00 00 
  03F0  00 00 00 00 00 00 00 00 00 00 00 00 00 00 00 00 
