------[ Versions ]------

Program Version : EVEREST v4.60.1628 Beta
BenchDLL Version: 2.4.257.0

------[ CPU Info ]------

CPU Type           : AMD Opteron 248, 2200 MHz (11 x 200)
CPU Alias          : SledgeHammer
CPU Platform       : Socket 940
CPU Stepping       : SH-CG
Instruction Set    : x86, x86-64, MMX, 3DNow!, SSE, SSE2
CPUID Manufacturer : AuthenticAMD
CPUID CPU Name     : AMD Opteron(tm) Processor 248
CPUID Revision     : 00000F5Ah
AMD Old Brand ID   : 0405h  (Opteron 248)
Platform ID        : D4h  (Socket 940)

------[ Logical CPU #0 ]------

allcpu: Valid

CPUID 00000000: 00000001-68747541-444D4163-69746E65
CPUID 00000001: 00000F5A-00000800-00000000-078BFBFF
CPUID 80000000: 80000018-68747541-444D4163-69746E65
CPUID 80000001: 00000F5A-00000405-00000000-E1D3FBFF
CPUID 80000002: 20444D41-6574704F-286E6F72-20296D74
CPUID 80000003: 636F7250-6F737365-34322072-00000038
CPUID 80000004: 00000000-00000000-00000000-00000000
CPUID 80000005: FF08FF08-FF20FF20-40020140-40020140
CPUID 80000006: 00000000-42004200-04008140-00000000
CPUID 80000007: 00000000-00000000-00000000-0000000F
CPUID 80000008: 00003028-00000000-00000000-00000000
CPUID 80000009: 00000000-00000000-00000000-00000000
CPUID 8000000A: 00000000-00000000-00000000-00000000
CPUID 8000000B: 00000000-00000000-00000000-00000000
CPUID 8000000C: 00000000-00000000-00000000-00000000
CPUID 8000000D: 00000000-00000000-00000000-00000000
CPUID 8000000E: 00000000-00000000-00000000-00000000
CPUID 8000000F: 00000000-00000000-00000000-00000000
CPUID 80000010: 00000000-00000000-00000000-00000000
CPUID 80000011: 00000000-00000000-00000000-00000000
CPUID 80000012: 00000000-00000000-00000000-00000000
CPUID 80000013: 00000000-00000000-00000000-00000000
CPUID 80000014: 00000000-00000000-00000000-00000000
CPUID 80000015: 00000000-00000000-00000000-00000000
CPUID 80000016: 00000000-00000000-00000000-00000000
CPUID 80000017: 00000000-00000000-00000000-00000000
CPUID 80000018: 00000000-00000000-00000000-00000000
CPUID 8FFFFFFF: 53275449-4D414820-2052454D-454D4954

------[ MSR Registers ]------

MSR 0000001B: 0000-0000-FEE0-0900
MSR C0010015: 0000-0000-0E00-0000
MSR C0010042: 0000-0202-000E-0E0E

PerformanceFrequency = 3579545

Tjmax Temperature = 0 Celsius
