CPUID Registers (CPU #0):
CPUID 00000000  	00000010-68747541-444D4163-69746E65 [AuthenticAMD]
CPUID 00000001  	008A0F00-00080800-7EF8320B-178BFBFF
CPUID 00000002  	00000000-00000000-00000000-00000000
CPUID 00000003  	00000000-00000000-00000000-00000000
CPUID 00000005  	00000040-00000040-00000003-00000011
CPUID 00000006  	00000004-00000000-00000001-00000000
CPUID 00000007  	00000000-219C91A9-00400004-00000000 [SL 00]
CPUID 00000008  	00000000-00000000-00000000-00000000
CPUID 00000009  	00000000-00000000-00000000-00000000
CPUID 0000000A  	00000000-00000000-00000000-00000000
CPUID 0000000B  	00000001-00000002-00000100-00000000 [SL 00]
CPUID 0000000B  	00000007-00000008-00000201-00000000 [SL 01]
CPUID 0000000C  	00000000-00000000-00000000-00000000
CPUID 0000000D  	00000207-00000340-00000380-00000000 [SL 00]
CPUID 0000000D  	0000000F-00000340-00000000-00000000 [SL 01]
CPUID 0000000D  	00000100-00000240-00000000-00000000 [SL 02]
CPUID 0000000D  	00000040-00000340-00000000-00000000 [SL 09]
CPUID 0000000E  	00000000-00000000-00000000-00000000
CPUID 0000000F  	00000000-000000FF-00000000-00000002 [SL 00]
CPUID 0000000F  	00000000-00000040-000000FF-00000007 [SL 01]
CPUID 00000010  	00000000-00000002-00000000-00000000 [SL 00]
CPUID 00000010  	0000000F-00000000-00000004-0000000F [SL 01]
CPUID 80000000  	80000020-68747541-444D4163-69746E65 [AuthenticAMD]
CPUID 80000001  	008A0F00-10000000-75C237FF-2FD3FBFF
CPUID 80000002  	20444D41-657A7952-2035206E-30323537 [AMD Ryzen 5 7520]
CPUID 80000003  	69772055-52206874-6F656461-7247206E [U with Radeon Gr]
CPUID 80000004  	69687061-20207363-20202020-00202020 [aphics ]
CPUID 80000005  	FF40FF40-FF40FF40-20080140-20080140
CPUID 80000006  	48006400-68006400-02006140-00209140
CPUID 80000007  	00000000-0000001B-00000000-00006799
CPUID 80000008  	00003030-010CF657-00007007-00010000
CPUID 80000009  	00000000-00000000-00000000-00000000
CPUID 8000000A  	00000001-00008000-00000000-0013BCFF
CPUID 8000000B  	00000000-00000000-00000000-00000000
CPUID 8000000C  	00000000-00000000-00000000-00000000
CPUID 8000000D  	00000000-00000000-00000000-00000000
CPUID 8000000E  	00000000-00000000-00000000-00000000
CPUID 8000000F  	00000000-00000000-00000000-00000000
CPUID 80000010  	00000000-00000000-00000000-00000000
CPUID 80000011  	00000000-00000000-00000000-00000000
CPUID 80000012  	00000000-00000000-00000000-00000000
CPUID 80000013  	00000000-00000000-00000000-00000000
CPUID 80000014  	00000000-00000000-00000000-00000000
CPUID 80000015  	00000000-00000000-00000000-00000000
CPUID 80000016  	00000000-00000000-00000000-00000000
CPUID 80000017  	00000000-00000000-00000000-00000000
CPUID 80000018  	00000000-00000000-00000000-00000000
CPUID 80000019  	F040F040-00000000-00000000-00000000
CPUID 8000001A  	00000006-00000000-00000000-00000000
CPUID 8000001B  	000003FF-00000000-00000000-00000000
CPUID 8000001C  	00000000-00000000-00000000-00000000
CPUID 8000001D  	00004121-01C0003F-0000003F-00000000 [SL 00]
CPUID 8000001D  	00004122-01C0003F-0000003F-00000000 [SL 01]
CPUID 8000001D  	00004143-01C0003F-000003FF-00000002 [SL 02]
CPUID 8000001D  	0001C163-03C0003F-00000FFF-00000001 [SL 03]
CPUID 8000001E  	00000000-00000100-00000000-00000000
CPUID 8000001F  	0001000F-0000012F-0000000E-00000001
CPUID 80000020  	00000000-00000002-00000000-00000000
 
CPUID Registers (CPU #1 Virtual):
CPUID 00000000  	00000010-68747541-444D4163-69746E65 [AuthenticAMD]
CPUID 00000001  	008A0F00-01080800-7EF8320B-178BFBFF
CPUID 00000002  	00000000-00000000-00000000-00000000
CPUID 00000003  	00000000-00000000-00000000-00000000
CPUID 00000005  	00000040-00000040-00000003-00000011
CPUID 00000006  	00000004-00000000-00000001-00000000
CPUID 00000007  	00000000-219C91A9-00400004-00000000 [SL 00]
CPUID 00000008  	00000000-00000000-00000000-00000000
CPUID 00000009  	00000000-00000000-00000000-00000000
CPUID 0000000A  	00000000-00000000-00000000-00000000
CPUID 0000000B  	00000001-00000002-00000100-00000001 [SL 00]
CPUID 0000000B  	00000007-00000008-00000201-00000001 [SL 01]
CPUID 0000000C  	00000000-00000000-00000000-00000000
CPUID 0000000D  	00000207-00000340-00000380-00000000 [SL 00]
CPUID 0000000D  	0000000F-00000340-00000000-00000000 [SL 01]
CPUID 0000000D  	00000100-00000240-00000000-00000000 [SL 02]
CPUID 0000000D  	00000040-00000340-00000000-00000000 [SL 09]
CPUID 0000000E  	00000000-00000000-00000000-00000000
CPUID 0000000F  	00000000-000000FF-00000000-00000002 [SL 00]
CPUID 0000000F  	00000000-00000040-000000FF-00000007 [SL 01]
CPUID 00000010  	00000000-00000002-00000000-00000000 [SL 00]
CPUID 00000010  	0000000F-00000000-00000004-0000000F [SL 01]
CPUID 80000000  	80000020-68747541-444D4163-69746E65 [AuthenticAMD]
CPUID 80000001  	008A0F00-10000000-75C237FF-2FD3FBFF
CPUID 80000002  	20444D41-657A7952-2035206E-30323537 [AMD Ryzen 5 7520]
CPUID 80000003  	69772055-52206874-6F656461-7247206E [U with Radeon Gr]
CPUID 80000004  	69687061-20207363-20202020-00202020 [aphics ]
CPUID 80000005  	FF40FF40-FF40FF40-20080140-20080140
CPUID 80000006  	48006400-68006400-02006140-00209140
CPUID 80000007  	00000000-0000001B-00000000-00006799
CPUID 80000008  	00003030-010CF657-00007007-00010000
CPUID 80000009  	00000000-00000000-00000000-00000000
CPUID 8000000A  	00000001-00008000-00000000-0013BCFF
CPUID 8000000B  	00000000-00000000-00000000-00000000
CPUID 8000000C  	00000000-00000000-00000000-00000000
CPUID 8000000D  	00000000-00000000-00000000-00000000
CPUID 8000000E  	00000000-00000000-00000000-00000000
CPUID 8000000F  	00000000-00000000-00000000-00000000
CPUID 80000010  	00000000-00000000-00000000-00000000
CPUID 80000011  	00000000-00000000-00000000-00000000
CPUID 80000012  	00000000-00000000-00000000-00000000
CPUID 80000013  	00000000-00000000-00000000-00000000
CPUID 80000014  	00000000-00000000-00000000-00000000
CPUID 80000015  	00000000-00000000-00000000-00000000
CPUID 80000016  	00000000-00000000-00000000-00000000
CPUID 80000017  	00000000-00000000-00000000-00000000
CPUID 80000018  	00000000-00000000-00000000-00000000
CPUID 80000019  	F040F040-00000000-00000000-00000000
CPUID 8000001A  	00000006-00000000-00000000-00000000
CPUID 8000001B  	000003FF-00000000-00000000-00000000
CPUID 8000001C  	00000000-00000000-00000000-00000000
CPUID 8000001D  	00004121-01C0003F-0000003F-00000000 [SL 00]
CPUID 8000001D  	00004122-01C0003F-0000003F-00000000 [SL 01]
CPUID 8000001D  	00004143-01C0003F-000003FF-00000002 [SL 02]
CPUID 8000001D  	0001C163-03C0003F-00000FFF-00000001 [SL 03]
CPUID 8000001E  	00000001-00000100-00000000-00000000
CPUID 8000001F  	0001000F-0000012F-0000000E-00000001
CPUID 80000020  	00000000-00000002-00000000-00000000
 
CPUID Registers (CPU #2):
CPUID 00000000  	00000010-68747541-444D4163-69746E65 [AuthenticAMD]
CPUID 00000001  	008A0F00-02080800-7EF8320B-178BFBFF
CPUID 00000002  	00000000-00000000-00000000-00000000
CPUID 00000003  	00000000-00000000-00000000-00000000
CPUID 00000005  	00000040-00000040-00000003-00000011
CPUID 00000006  	00000004-00000000-00000001-00000000
CPUID 00000007  	00000000-219C91A9-00400004-00000000 [SL 00]
CPUID 00000008  	00000000-00000000-00000000-00000000
CPUID 00000009  	00000000-00000000-00000000-00000000
CPUID 0000000A  	00000000-00000000-00000000-00000000
CPUID 0000000B  	00000001-00000002-00000100-00000002 [SL 00]
CPUID 0000000B  	00000007-00000008-00000201-00000002 [SL 01]
CPUID 0000000C  	00000000-00000000-00000000-00000000
CPUID 0000000D  	00000207-00000340-00000380-00000000 [SL 00]
CPUID 0000000D  	0000000F-00000340-00000000-00000000 [SL 01]
CPUID 0000000D  	00000100-00000240-00000000-00000000 [SL 02]
CPUID 0000000D  	00000040-00000340-00000000-00000000 [SL 09]
CPUID 0000000E  	00000000-00000000-00000000-00000000
CPUID 0000000F  	00000000-000000FF-00000000-00000002 [SL 00]
CPUID 0000000F  	00000000-00000040-000000FF-00000007 [SL 01]
CPUID 00000010  	00000000-00000002-00000000-00000000 [SL 00]
CPUID 00000010  	0000000F-00000000-00000004-0000000F [SL 01]
CPUID 80000000  	80000020-68747541-444D4163-69746E65 [AuthenticAMD]
CPUID 80000001  	008A0F00-10000000-75C237FF-2FD3FBFF
CPUID 80000002  	20444D41-657A7952-2035206E-30323537 [AMD Ryzen 5 7520]
CPUID 80000003  	69772055-52206874-6F656461-7247206E [U with Radeon Gr]
CPUID 80000004  	69687061-20207363-20202020-00202020 [aphics ]
CPUID 80000005  	FF40FF40-FF40FF40-20080140-20080140
CPUID 80000006  	48006400-68006400-02006140-00209140
CPUID 80000007  	00000000-0000001B-00000000-00006799
CPUID 80000008  	00003030-010CF657-00007007-00010000
CPUID 80000009  	00000000-00000000-00000000-00000000
CPUID 8000000A  	00000001-00008000-00000000-0013BCFF
CPUID 8000000B  	00000000-00000000-00000000-00000000
CPUID 8000000C  	00000000-00000000-00000000-00000000
CPUID 8000000D  	00000000-00000000-00000000-00000000
CPUID 8000000E  	00000000-00000000-00000000-00000000
CPUID 8000000F  	00000000-00000000-00000000-00000000
CPUID 80000010  	00000000-00000000-00000000-00000000
CPUID 80000011  	00000000-00000000-00000000-00000000
CPUID 80000012  	00000000-00000000-00000000-00000000
CPUID 80000013  	00000000-00000000-00000000-00000000
CPUID 80000014  	00000000-00000000-00000000-00000000
CPUID 80000015  	00000000-00000000-00000000-00000000
CPUID 80000016  	00000000-00000000-00000000-00000000
CPUID 80000017  	00000000-00000000-00000000-00000000
CPUID 80000018  	00000000-00000000-00000000-00000000
CPUID 80000019  	F040F040-00000000-00000000-00000000
CPUID 8000001A  	00000006-00000000-00000000-00000000
CPUID 8000001B  	000003FF-00000000-00000000-00000000
CPUID 8000001C  	00000000-00000000-00000000-00000000
CPUID 8000001D  	00004121-01C0003F-0000003F-00000000 [SL 00]
CPUID 8000001D  	00004122-01C0003F-0000003F-00000000 [SL 01]
CPUID 8000001D  	00004143-01C0003F-000003FF-00000002 [SL 02]
CPUID 8000001D  	0001C163-03C0003F-00000FFF-00000001 [SL 03]
CPUID 8000001E  	00000002-00000101-00000000-00000000
CPUID 8000001F  	0001000F-0000012F-0000000E-00000001
CPUID 80000020  	00000000-00000002-00000000-00000000
 
CPUID Registers (CPU #3 Virtual):
CPUID 00000000  	00000010-68747541-444D4163-69746E65 [AuthenticAMD]
CPUID 00000001  	008A0F00-03080800-7EF8320B-178BFBFF
CPUID 00000002  	00000000-00000000-00000000-00000000
CPUID 00000003  	00000000-00000000-00000000-00000000
CPUID 00000005  	00000040-00000040-00000003-00000011
CPUID 00000006  	00000004-00000000-00000001-00000000
CPUID 00000007  	00000000-219C91A9-00400004-00000000 [SL 00]
CPUID 00000008  	00000000-00000000-00000000-00000000
CPUID 00000009  	00000000-00000000-00000000-00000000
CPUID 0000000A  	00000000-00000000-00000000-00000000
CPUID 0000000B  	00000001-00000002-00000100-00000003 [SL 00]
CPUID 0000000B  	00000007-00000008-00000201-00000003 [SL 01]
CPUID 0000000C  	00000000-00000000-00000000-00000000
CPUID 0000000D  	00000207-00000340-00000380-00000000 [SL 00]
CPUID 0000000D  	0000000F-00000340-00000000-00000000 [SL 01]
CPUID 0000000D  	00000100-00000240-00000000-00000000 [SL 02]
CPUID 0000000D  	00000040-00000340-00000000-00000000 [SL 09]
CPUID 0000000E  	00000000-00000000-00000000-00000000
CPUID 0000000F  	00000000-000000FF-00000000-00000002 [SL 00]
CPUID 0000000F  	00000000-00000040-000000FF-00000007 [SL 01]
CPUID 00000010  	00000000-00000002-00000000-00000000 [SL 00]
CPUID 00000010  	0000000F-00000000-00000004-0000000F [SL 01]
CPUID 80000000  	80000020-68747541-444D4163-69746E65 [AuthenticAMD]
CPUID 80000001  	008A0F00-10000000-75C237FF-2FD3FBFF
CPUID 80000002  	20444D41-657A7952-2035206E-30323537 [AMD Ryzen 5 7520]
CPUID 80000003  	69772055-52206874-6F656461-7247206E [U with Radeon Gr]
CPUID 80000004  	69687061-20207363-20202020-00202020 [aphics ]
CPUID 80000005  	FF40FF40-FF40FF40-20080140-20080140
CPUID 80000006  	48006400-68006400-02006140-00209140
CPUID 80000007  	00000000-0000001B-00000000-00006799
CPUID 80000008  	00003030-010CF657-00007007-00010000
CPUID 80000009  	00000000-00000000-00000000-00000000
CPUID 8000000A  	00000001-00008000-00000000-0013BCFF
CPUID 8000000B  	00000000-00000000-00000000-00000000
CPUID 8000000C  	00000000-00000000-00000000-00000000
CPUID 8000000D  	00000000-00000000-00000000-00000000
CPUID 8000000E  	00000000-00000000-00000000-00000000
CPUID 8000000F  	00000000-00000000-00000000-00000000
CPUID 80000010  	00000000-00000000-00000000-00000000
CPUID 80000011  	00000000-00000000-00000000-00000000
CPUID 80000012  	00000000-00000000-00000000-00000000
CPUID 80000013  	00000000-00000000-00000000-00000000
CPUID 80000014  	00000000-00000000-00000000-00000000
CPUID 80000015  	00000000-00000000-00000000-00000000
CPUID 80000016  	00000000-00000000-00000000-00000000
CPUID 80000017  	00000000-00000000-00000000-00000000
CPUID 80000018  	00000000-00000000-00000000-00000000
CPUID 80000019  	F040F040-00000000-00000000-00000000
CPUID 8000001A  	00000006-00000000-00000000-00000000
CPUID 8000001B  	000003FF-00000000-00000000-00000000
CPUID 8000001C  	00000000-00000000-00000000-00000000
CPUID 8000001D  	00004121-01C0003F-0000003F-00000000 [SL 00]
CPUID 8000001D  	00004122-01C0003F-0000003F-00000000 [SL 01]
CPUID 8000001D  	00004143-01C0003F-000003FF-00000002 [SL 02]
CPUID 8000001D  	0001C163-03C0003F-00000FFF-00000001 [SL 03]
CPUID 8000001E  	00000003-00000101-00000000-00000000
CPUID 8000001F  	0001000F-0000012F-0000000E-00000001
CPUID 80000020  	00000000-00000002-00000000-00000000
 
CPUID Registers (CPU #4):
CPUID 00000000  	00000010-68747541-444D4163-69746E65 [AuthenticAMD]
CPUID 00000001  	008A0F00-04080800-7EF8320B-178BFBFF
CPUID 00000002  	00000000-00000000-00000000-00000000
CPUID 00000003  	00000000-00000000-00000000-00000000
CPUID 00000005  	00000040-00000040-00000003-00000011
CPUID 00000006  	00000004-00000000-00000001-00000000
CPUID 00000007  	00000000-219C91A9-00400004-00000000 [SL 00]
CPUID 00000008  	00000000-00000000-00000000-00000000
CPUID 00000009  	00000000-00000000-00000000-00000000
CPUID 0000000A  	00000000-00000000-00000000-00000000
CPUID 0000000B  	00000001-00000002-00000100-00000004 [SL 00]
CPUID 0000000B  	00000007-00000008-00000201-00000004 [SL 01]
CPUID 0000000C  	00000000-00000000-00000000-00000000
CPUID 0000000D  	00000207-00000340-00000380-00000000 [SL 00]
CPUID 0000000D  	0000000F-00000340-00000000-00000000 [SL 01]
CPUID 0000000D  	00000100-00000240-00000000-00000000 [SL 02]
CPUID 0000000D  	00000040-00000340-00000000-00000000 [SL 09]
CPUID 0000000E  	00000000-00000000-00000000-00000000
CPUID 0000000F  	00000000-000000FF-00000000-00000002 [SL 00]
CPUID 0000000F  	00000000-00000040-000000FF-00000007 [SL 01]
CPUID 00000010  	00000000-00000002-00000000-00000000 [SL 00]
CPUID 00000010  	0000000F-00000000-00000004-0000000F [SL 01]
CPUID 80000000  	80000020-68747541-444D4163-69746E65 [AuthenticAMD]
CPUID 80000001  	008A0F00-10000000-75C237FF-2FD3FBFF
CPUID 80000002  	20444D41-657A7952-2035206E-30323537 [AMD Ryzen 5 7520]
CPUID 80000003  	69772055-52206874-6F656461-7247206E [U with Radeon Gr]
CPUID 80000004  	69687061-20207363-20202020-00202020 [aphics ]
CPUID 80000005  	FF40FF40-FF40FF40-20080140-20080140
CPUID 80000006  	48006400-68006400-02006140-00209140
CPUID 80000007  	00000000-0000001B-00000000-00006799
CPUID 80000008  	00003030-010CF657-00007007-00010000
CPUID 80000009  	00000000-00000000-00000000-00000000
CPUID 8000000A  	00000001-00008000-00000000-0013BCFF
CPUID 8000000B  	00000000-00000000-00000000-00000000
CPUID 8000000C  	00000000-00000000-00000000-00000000
CPUID 8000000D  	00000000-00000000-00000000-00000000
CPUID 8000000E  	00000000-00000000-00000000-00000000
CPUID 8000000F  	00000000-00000000-00000000-00000000
CPUID 80000010  	00000000-00000000-00000000-00000000
CPUID 80000011  	00000000-00000000-00000000-00000000
CPUID 80000012  	00000000-00000000-00000000-00000000
CPUID 80000013  	00000000-00000000-00000000-00000000
CPUID 80000014  	00000000-00000000-00000000-00000000
CPUID 80000015  	00000000-00000000-00000000-00000000
CPUID 80000016  	00000000-00000000-00000000-00000000
CPUID 80000017  	00000000-00000000-00000000-00000000
CPUID 80000018  	00000000-00000000-00000000-00000000
CPUID 80000019  	F040F040-00000000-00000000-00000000
CPUID 8000001A  	00000006-00000000-00000000-00000000
CPUID 8000001B  	000003FF-00000000-00000000-00000000
CPUID 8000001C  	00000000-00000000-00000000-00000000
CPUID 8000001D  	00004121-01C0003F-0000003F-00000000 [SL 00]
CPUID 8000001D  	00004122-01C0003F-0000003F-00000000 [SL 01]
CPUID 8000001D  	00004143-01C0003F-000003FF-00000002 [SL 02]
CPUID 8000001D  	0001C163-03C0003F-00000FFF-00000001 [SL 03]
CPUID 8000001E  	00000004-00000102-00000000-00000000
CPUID 8000001F  	0001000F-0000012F-0000000E-00000001
CPUID 80000020  	00000000-00000002-00000000-00000000
 
CPUID Registers (CPU #5 Virtual):
CPUID 00000000  	00000010-68747541-444D4163-69746E65 [AuthenticAMD]
CPUID 00000001  	008A0F00-05080800-7EF8320B-178BFBFF
CPUID 00000002  	00000000-00000000-00000000-00000000
CPUID 00000003  	00000000-00000000-00000000-00000000
CPUID 00000005  	00000040-00000040-00000003-00000011
CPUID 00000006  	00000004-00000000-00000001-00000000
CPUID 00000007  	00000000-219C91A9-00400004-00000000 [SL 00]
CPUID 00000008  	00000000-00000000-00000000-00000000
CPUID 00000009  	00000000-00000000-00000000-00000000
CPUID 0000000A  	00000000-00000000-00000000-00000000
CPUID 0000000B  	00000001-00000002-00000100-00000005 [SL 00]
CPUID 0000000B  	00000007-00000008-00000201-00000005 [SL 01]
CPUID 0000000C  	00000000-00000000-00000000-00000000
CPUID 0000000D  	00000207-00000340-00000380-00000000 [SL 00]
CPUID 0000000D  	0000000F-00000340-00000000-00000000 [SL 01]
CPUID 0000000D  	00000100-00000240-00000000-00000000 [SL 02]
CPUID 0000000D  	00000040-00000340-00000000-00000000 [SL 09]
CPUID 0000000E  	00000000-00000000-00000000-00000000
CPUID 0000000F  	00000000-000000FF-00000000-00000002 [SL 00]
CPUID 0000000F  	00000000-00000040-000000FF-00000007 [SL 01]
CPUID 00000010  	00000000-00000002-00000000-00000000 [SL 00]
CPUID 00000010  	0000000F-00000000-00000004-0000000F [SL 01]
CPUID 80000000  	80000020-68747541-444D4163-69746E65 [AuthenticAMD]
CPUID 80000001  	008A0F00-10000000-75C237FF-2FD3FBFF
CPUID 80000002  	20444D41-657A7952-2035206E-30323537 [AMD Ryzen 5 7520]
CPUID 80000003  	69772055-52206874-6F656461-7247206E [U with Radeon Gr]
CPUID 80000004  	69687061-20207363-20202020-00202020 [aphics ]
CPUID 80000005  	FF40FF40-FF40FF40-20080140-20080140
CPUID 80000006  	48006400-68006400-02006140-00209140
CPUID 80000007  	00000000-0000001B-00000000-00006799
CPUID 80000008  	00003030-010CF657-00007007-00010000
CPUID 80000009  	00000000-00000000-00000000-00000000
CPUID 8000000A  	00000001-00008000-00000000-0013BCFF
CPUID 8000000B  	00000000-00000000-00000000-00000000
CPUID 8000000C  	00000000-00000000-00000000-00000000
CPUID 8000000D  	00000000-00000000-00000000-00000000
CPUID 8000000E  	00000000-00000000-00000000-00000000
CPUID 8000000F  	00000000-00000000-00000000-00000000
CPUID 80000010  	00000000-00000000-00000000-00000000
CPUID 80000011  	00000000-00000000-00000000-00000000
CPUID 80000012  	00000000-00000000-00000000-00000000
CPUID 80000013  	00000000-00000000-00000000-00000000
CPUID 80000014  	00000000-00000000-00000000-00000000
CPUID 80000015  	00000000-00000000-00000000-00000000
CPUID 80000016  	00000000-00000000-00000000-00000000
CPUID 80000017  	00000000-00000000-00000000-00000000
CPUID 80000018  	00000000-00000000-00000000-00000000
CPUID 80000019  	F040F040-00000000-00000000-00000000
CPUID 8000001A  	00000006-00000000-00000000-00000000
CPUID 8000001B  	000003FF-00000000-00000000-00000000
CPUID 8000001C  	00000000-00000000-00000000-00000000
CPUID 8000001D  	00004121-01C0003F-0000003F-00000000 [SL 00]
CPUID 8000001D  	00004122-01C0003F-0000003F-00000000 [SL 01]
CPUID 8000001D  	00004143-01C0003F-000003FF-00000002 [SL 02]
CPUID 8000001D  	0001C163-03C0003F-00000FFF-00000001 [SL 03]
CPUID 8000001E  	00000005-00000102-00000000-00000000
CPUID 8000001F  	0001000F-0000012F-0000000E-00000001
CPUID 80000020  	00000000-00000002-00000000-00000000
 
CPUID Registers (CPU #6):
CPUID 00000000  	00000010-68747541-444D4163-69746E65 [AuthenticAMD]
CPUID 00000001  	008A0F00-06080800-7EF8320B-178BFBFF
CPUID 00000002  	00000000-00000000-00000000-00000000
CPUID 00000003  	00000000-00000000-00000000-00000000
CPUID 00000005  	00000040-00000040-00000003-00000011
CPUID 00000006  	00000004-00000000-00000001-00000000
CPUID 00000007  	00000000-219C91A9-00400004-00000000 [SL 00]
CPUID 00000008  	00000000-00000000-00000000-00000000
CPUID 00000009  	00000000-00000000-00000000-00000000
CPUID 0000000A  	00000000-00000000-00000000-00000000
CPUID 0000000B  	00000001-00000002-00000100-00000006 [SL 00]
CPUID 0000000B  	00000007-00000008-00000201-00000006 [SL 01]
CPUID 0000000C  	00000000-00000000-00000000-00000000
CPUID 0000000D  	00000207-00000340-00000380-00000000 [SL 00]
CPUID 0000000D  	0000000F-00000340-00000000-00000000 [SL 01]
CPUID 0000000D  	00000100-00000240-00000000-00000000 [SL 02]
CPUID 0000000D  	00000040-00000340-00000000-00000000 [SL 09]
CPUID 0000000E  	00000000-00000000-00000000-00000000
CPUID 0000000F  	00000000-000000FF-00000000-00000002 [SL 00]
CPUID 0000000F  	00000000-00000040-000000FF-00000007 [SL 01]
CPUID 00000010  	00000000-00000002-00000000-00000000 [SL 00]
CPUID 00000010  	0000000F-00000000-00000004-0000000F [SL 01]
CPUID 80000000  	80000020-68747541-444D4163-69746E65 [AuthenticAMD]
CPUID 80000001  	008A0F00-10000000-75C237FF-2FD3FBFF
CPUID 80000002  	20444D41-657A7952-2035206E-30323537 [AMD Ryzen 5 7520]
CPUID 80000003  	69772055-52206874-6F656461-7247206E [U with Radeon Gr]
CPUID 80000004  	69687061-20207363-20202020-00202020 [aphics ]
CPUID 80000005  	FF40FF40-FF40FF40-20080140-20080140
CPUID 80000006  	48006400-68006400-02006140-00209140
CPUID 80000007  	00000000-0000001B-00000000-00006799
CPUID 80000008  	00003030-010CF657-00007007-00010000
CPUID 80000009  	00000000-00000000-00000000-00000000
CPUID 8000000A  	00000001-00008000-00000000-0013BCFF
CPUID 8000000B  	00000000-00000000-00000000-00000000
CPUID 8000000C  	00000000-00000000-00000000-00000000
CPUID 8000000D  	00000000-00000000-00000000-00000000
CPUID 8000000E  	00000000-00000000-00000000-00000000
CPUID 8000000F  	00000000-00000000-00000000-00000000
CPUID 80000010  	00000000-00000000-00000000-00000000
CPUID 80000011  	00000000-00000000-00000000-00000000
CPUID 80000012  	00000000-00000000-00000000-00000000
CPUID 80000013  	00000000-00000000-00000000-00000000
CPUID 80000014  	00000000-00000000-00000000-00000000
CPUID 80000015  	00000000-00000000-00000000-00000000
CPUID 80000016  	00000000-00000000-00000000-00000000
CPUID 80000017  	00000000-00000000-00000000-00000000
CPUID 80000018  	00000000-00000000-00000000-00000000
CPUID 80000019  	F040F040-00000000-00000000-00000000
CPUID 8000001A  	00000006-00000000-00000000-00000000
CPUID 8000001B  	000003FF-00000000-00000000-00000000
CPUID 8000001C  	00000000-00000000-00000000-00000000
CPUID 8000001D  	00004121-01C0003F-0000003F-00000000 [SL 00]
CPUID 8000001D  	00004122-01C0003F-0000003F-00000000 [SL 01]
CPUID 8000001D  	00004143-01C0003F-000003FF-00000002 [SL 02]
CPUID 8000001D  	0001C163-03C0003F-00000FFF-00000001 [SL 03]
CPUID 8000001E  	00000006-00000103-00000000-00000000
CPUID 8000001F  	0001000F-0000012F-0000000E-00000001
CPUID 80000020  	00000000-00000002-00000000-00000000
 
CPUID Registers (CPU #7 Virtual):
CPUID 00000000  	00000010-68747541-444D4163-69746E65 [AuthenticAMD]
CPUID 00000001  	008A0F00-07080800-7EF8320B-178BFBFF
CPUID 00000002  	00000000-00000000-00000000-00000000
CPUID 00000003  	00000000-00000000-00000000-00000000
CPUID 00000005  	00000040-00000040-00000003-00000011
CPUID 00000006  	00000004-00000000-00000001-00000000
CPUID 00000007  	00000000-219C91A9-00400004-00000000 [SL 00]
CPUID 00000008  	00000000-00000000-00000000-00000000
CPUID 00000009  	00000000-00000000-00000000-00000000
CPUID 0000000A  	00000000-00000000-00000000-00000000
CPUID 0000000B  	00000001-00000002-00000100-00000007 [SL 00]
CPUID 0000000B  	00000007-00000008-00000201-00000007 [SL 01]
CPUID 0000000C  	00000000-00000000-00000000-00000000
CPUID 0000000D  	00000207-00000340-00000380-00000000 [SL 00]
CPUID 0000000D  	0000000F-00000340-00000000-00000000 [SL 01]
CPUID 0000000D  	00000100-00000240-00000000-00000000 [SL 02]
CPUID 0000000D  	00000040-00000340-00000000-00000000 [SL 09]
CPUID 0000000E  	00000000-00000000-00000000-00000000
CPUID 0000000F  	00000000-000000FF-00000000-00000002 [SL 00]
CPUID 0000000F  	00000000-00000040-000000FF-00000007 [SL 01]
CPUID 00000010  	00000000-00000002-00000000-00000000 [SL 00]
CPUID 00000010  	0000000F-00000000-00000004-0000000F [SL 01]
CPUID 80000000  	80000020-68747541-444D4163-69746E65 [AuthenticAMD]
CPUID 80000001  	008A0F00-10000000-75C237FF-2FD3FBFF
CPUID 80000002  	20444D41-657A7952-2035206E-30323537 [AMD Ryzen 5 7520]
CPUID 80000003  	69772055-52206874-6F656461-7247206E [U with Radeon Gr]
CPUID 80000004  	69687061-20207363-20202020-00202020 [aphics ]
CPUID 80000005  	FF40FF40-FF40FF40-20080140-20080140
CPUID 80000006  	48006400-68006400-02006140-00209140
CPUID 80000007  	00000000-0000001B-00000000-00006799
CPUID 80000008  	00003030-010CF657-00007007-00010000
CPUID 80000009  	00000000-00000000-00000000-00000000
CPUID 8000000A  	00000001-00008000-00000000-0013BCFF
CPUID 8000000B  	00000000-00000000-00000000-00000000
CPUID 8000000C  	00000000-00000000-00000000-00000000
CPUID 8000000D  	00000000-00000000-00000000-00000000
CPUID 8000000E  	00000000-00000000-00000000-00000000
CPUID 8000000F  	00000000-00000000-00000000-00000000
CPUID 80000010  	00000000-00000000-00000000-00000000
CPUID 80000011  	00000000-00000000-00000000-00000000
CPUID 80000012  	00000000-00000000-00000000-00000000
CPUID 80000013  	00000000-00000000-00000000-00000000
CPUID 80000014  	00000000-00000000-00000000-00000000
CPUID 80000015  	00000000-00000000-00000000-00000000
CPUID 80000016  	00000000-00000000-00000000-00000000
CPUID 80000017  	00000000-00000000-00000000-00000000
CPUID 80000018  	00000000-00000000-00000000-00000000
CPUID 80000019  	F040F040-00000000-00000000-00000000
CPUID 8000001A  	00000006-00000000-00000000-00000000
CPUID 8000001B  	000003FF-00000000-00000000-00000000
CPUID 8000001C  	00000000-00000000-00000000-00000000
CPUID 8000001D  	00004121-01C0003F-0000003F-00000000 [SL 00]
CPUID 8000001D  	00004122-01C0003F-0000003F-00000000 [SL 01]
CPUID 8000001D  	00004143-01C0003F-000003FF-00000002 [SL 02]
CPUID 8000001D  	0001C163-03C0003F-00000FFF-00000001 [SL 03]
CPUID 8000001E  	00000007-00000103-00000000-00000000
CPUID 8000001F  	0001000F-0000012F-0000000E-00000001
CPUID 80000020  	00000000-00000002-00000000-00000000
 
MSR Registers (CPU #0):
CPU Clock (Normal)  	4399 MHz
CPU Clock (TSC)  	2795 MHz
CPU Multiplier  	44.0x
CPB PStates  	0
MSR 0000001B  	0000-0000-FEE0-0900
MSR 0000008B  	0000-0000-08A0-0006
MSR 000000E7  	0000-00AB-6340-06A4 [S200]
MSR 000000E7  	0000-00AB-681A-6778 [S200]
MSR 000000E7  	0000-00AB-6BDB-8B70
MSR 000000E8  	0000-00D0-E7D9-E295 [S200]
MSR 000000E8  	0000-00D0-E885-1F0F [S200]
MSR 000000E8  	0000-00D0-E8D4-374A
MSR C0010004  	0000-0000-0000-0000
MSR C0010005  	0000-0000-0000-0000
MSR C0010006  	0000-0000-0000-0000
MSR C0010007  	0000-0000-0000-0000
MSR C0010015  	0000-0001-C900-0011
MSR C001001F  	0000-0000-0000-0000
MSR C0010055  	0000-0000-0000-0000
MSR C0010058  	0000-0000-E000-0021
MSR C0010061  	0000-0000-0000-0020
MSR C0010062  	0000-0000-0000-0000
MSR C0010063  	0000-0000-0000-0001
MSR C0010064  	8000-0000-472F-C870 [92.00x] [0.3563 V] [ 2.80 A] [PState P0]
MSR C0010065  	8000-0000-42EA-D058 [11.00x] [0.4813 V] [ 1.10 A] [PState P1]
MSR C0010066  	8000-0000-4265-D251 [ 9.00x] [0.6062 V] [ 0.90 A] [PState P2]
MSR C0010067  	0000-0000-0000-0000
MSR C0010068  	0000-0000-0000-0000
MSR C0010069  	0000-0000-0000-0000
MSR C001006A  	0000-0000-0000-0000
MSR C001006B  	0000-0000-0000-0000
MSR C0010070  	< FAILED >
MSR C0010293  	0000-0000-02A2-6150 [ 4.85x] [0.6937V]
MSR C0010293  	0000-0000-02A2-6150 [ 4.85x] [0.6937V]
MSR C0010293  	0000-0000-02A2-6150 [ 4.85x] [0.6937V]
MSR C0010293  	0000-0000-0128-422C [44.00x] [0.5437V]
MSR C0010293  	0000-0000-0128-422C [44.00x] [0.5437V]
MSR C0010140  	0000-0000-0000-0000
MSR C0010141  	0000-0000-0000-0000
MSR C0010290  	< FAILED >
MSR C0010292  	0000-0001-0400-4992
MSR C0010293  	0000-0000-0128-422C
MSR C0010294  	0FC2-6581-0000-4912
MSR C0010296  	0000-0000-0048-4848
MSR C0010299  	0000-0000-000A-1003
MSR C001029A  	0000-0000-028A-90DA [S200]
MSR C001029A  	0000-0000-028A-940E [S200]
MSR C001029A  	0000-0000-028A-A312
MSR C001029B  	0000-0000-1464-F390 [S200]
MSR C001029B  	0000-0000-1465-03D3 [S200]
MSR C001029B  	0000-0000-1465-1309
MSR C0011023  	0002-0000-0000-0020
 
MSR Registers (CPU #1):
CPU Clock (Normal)  	485 MHz
CPU Clock (TSC)  	2795 MHz
CPU Multiplier  	4.8x
CPB PStates  	0
MSR 0000001B  	0000-0000-FEE0-0900
MSR 0000008B  	0000-0000-08A0-0006
MSR 000000E7  	0000-00AB-80A3-1198
MSR 000000E8  	0000-00D0-FA7D-F1C7
MSR C0010004  	0000-0000-0000-0000
MSR C0010005  	0000-0000-0000-0000
MSR C0010006  	0000-0000-0000-0000
MSR C0010007  	0000-0000-0000-0000
MSR C0010015  	0000-0001-C900-0011
MSR C001001F  	0000-0000-0000-0000
MSR C0010055  	0000-0000-0000-0000
MSR C0010058  	0000-0000-E000-0021
MSR C0010061  	0000-0000-0000-0020
MSR C0010062  	0000-0000-0000-0000
MSR C0010063  	0000-0000-0000-0000
MSR C0010064  	8000-0000-472F-C870 [92.00x] [0.3563 V] [ 2.80 A] [PState P0]
MSR C0010065  	8000-0000-42EA-D058 [11.00x] [0.4813 V] [ 1.10 A] [PState P1]
MSR C0010066  	8000-0000-4265-D251 [ 9.00x] [0.6062 V] [ 0.90 A] [PState P2]
MSR C0010067  	0000-0000-0000-0000
MSR C0010068  	0000-0000-0000-0000
MSR C0010069  	0000-0000-0000-0000
MSR C001006A  	0000-0000-0000-0000
MSR C001006B  	0000-0000-0000-0000
MSR C0010070  	< FAILED >
MSR C0010293  	0000-0000-0136-422C [44.00x] [0.1938V]
MSR C0010293  	0000-0000-0128-422C [44.00x] [0.5437V]
MSR C0010293  	0000-0000-02A2-6150 [ 4.85x] [0.6937V]
MSR C0010293  	0000-0000-00A2-6150 [ 4.85x] [0.6937V]
MSR C0010293  	0000-0000-0128-422C [44.00x] [0.5437V]
MSR C0010140  	0000-0000-0000-0000
MSR C0010141  	0000-0000-0000-0000
MSR C0010290  	< FAILED >
MSR C0010292  	0000-0001-0400-4992
MSR C0010293  	0000-0000-0128-422C
MSR C0010294  	0FC2-6581-0000-4912
MSR C0010296  	0000-0000-0048-4848
MSR C0010299  	0000-0000-000A-1003
MSR C001029A  	0000-0000-028A-B39D
MSR C001029B  	0000-0000-1465-399F
MSR C0011023  	0002-0000-0000-0020
 
MSR Registers (CPU #2):
CPU Clock (Normal)  	4399 MHz
CPU Clock (TSC)  	2795 MHz
CPU Multiplier  	44.0x
CPB PStates  	0
MSR 0000001B  	0000-0000-FEE0-0900
MSR 0000008B  	0000-0000-08A0-0006
MSR 000000E7  	0000-00AB-87A8-0A10
MSR 000000E8  	0000-00D1-025E-3AC9
MSR C0010004  	0000-0000-0000-0000
MSR C0010005  	0000-0000-0000-0000
MSR C0010006  	0000-0000-0000-0000
MSR C0010007  	0000-0000-0000-0000
MSR C0010015  	0000-0001-C900-0011
MSR C001001F  	0000-0000-0000-0000
MSR C0010055  	0000-0000-0000-0000
MSR C0010058  	0000-0000-E000-0021
MSR C0010061  	0000-0000-0000-0020
MSR C0010062  	0000-0000-0000-0000
MSR C0010063  	0000-0000-0000-0000
MSR C0010064  	8000-0000-472F-C870 [92.00x] [0.3563 V] [ 2.80 A] [PState P0]
MSR C0010065  	8000-0000-42EA-D058 [11.00x] [0.4813 V] [ 1.10 A] [PState P1]
MSR C0010066  	8000-0000-4265-D251 [ 9.00x] [0.6062 V] [ 0.90 A] [PState P2]
MSR C0010067  	0000-0000-0000-0000
MSR C0010068  	0000-0000-0000-0000
MSR C0010069  	0000-0000-0000-0000
MSR C001006A  	0000-0000-0000-0000
MSR C001006B  	0000-0000-0000-0000
MSR C0010070  	< FAILED >
MSR C0010293  	0000-0000-0136-422C [44.00x] [0.1938V]
MSR C0010293  	0000-0000-0128-422C [44.00x] [0.5437V]
MSR C0010293  	0000-0000-0128-422C [44.00x] [0.5437V]
MSR C0010293  	0000-0000-00A2-6150 [ 4.85x] [0.6937V]
MSR C0010293  	0000-0000-0128-422C [44.00x] [0.5437V]
MSR C0010140  	0000-0000-0000-0000
MSR C0010141  	0000-0000-0000-0000
MSR C0010290  	< FAILED >
MSR C0010292  	0000-0001-0400-4992
MSR C0010293  	0000-0000-0128-422C
MSR C0010294  	0FC2-6581-0000-4912
MSR C0010296  	0000-0000-0048-4848
MSR C0010299  	0000-0000-000A-1003
MSR C001029A  	0000-0000-028A-BAE6
MSR C001029B  	0000-0000-1465-5254
MSR C0011023  	0002-0000-0000-0020
 
MSR Registers (CPU #3):
CPU Clock (Normal)  	485 MHz
CPU Clock (TSC)  	2795 MHz
CPU Multiplier  	4.8x
CPB PStates  	0
MSR 0000001B  	0000-0000-FEE0-0900
MSR 0000008B  	0000-0000-08A0-0006
MSR 000000E7  	0000-00AB-9006-7498
MSR 000000E8  	0000-00D1-0B45-2451
MSR C0010004  	0000-0000-0000-0000
MSR C0010005  	0000-0000-0000-0000
MSR C0010006  	0000-0000-0000-0000
MSR C0010007  	0000-0000-0000-0000
MSR C0010015  	0000-0001-C900-0011
MSR C001001F  	0000-0000-0000-0000
MSR C0010055  	0000-0000-0000-0000
MSR C0010058  	0000-0000-E000-0021
MSR C0010061  	0000-0000-0000-0020
MSR C0010062  	0000-0000-0000-0000
MSR C0010063  	0000-0000-0000-0000
MSR C0010064  	8000-0000-472F-C870 [92.00x] [0.3563 V] [ 2.80 A] [PState P0]
MSR C0010065  	8000-0000-42EA-D058 [11.00x] [0.4813 V] [ 1.10 A] [PState P1]
MSR C0010066  	8000-0000-4265-D251 [ 9.00x] [0.6062 V] [ 0.90 A] [PState P2]
MSR C0010067  	0000-0000-0000-0000
MSR C0010068  	0000-0000-0000-0000
MSR C0010069  	0000-0000-0000-0000
MSR C001006A  	0000-0000-0000-0000
MSR C001006B  	0000-0000-0000-0000
MSR C0010070  	< FAILED >
MSR C0010293  	0000-0000-0136-422C [44.00x] [0.1938V]
MSR C0010293  	0000-0000-00A2-6150 [ 4.85x] [0.6937V]
MSR C0010293  	0000-0000-02D8-6150 [ 4.85x] [0.9437V]
MSR C0010293  	0000-0000-02A2-6150 [ 4.85x] [0.6937V]
MSR C0010293  	0000-0000-0328-422C [44.00x] [0.5437V]
MSR C0010140  	0000-0000-0000-0000
MSR C0010141  	0000-0000-0000-0000
MSR C0010290  	< FAILED >
MSR C0010292  	0000-0001-0400-4992
MSR C0010293  	0000-0000-0328-422C
MSR C0010294  	0FC2-6581-0000-4912
MSR C0010296  	0000-0000-0048-4848
MSR C0010299  	0000-0000-000A-1003
MSR C001029A  	0000-0000-028A-C7F8
MSR C001029B  	0000-0000-1465-919C
MSR C0011023  	0002-0000-0000-0020
 
MSR Registers (CPU #4):
CPU Clock (Normal)  	4399 MHz
CPU Clock (TSC)  	2795 MHz
CPU Multiplier  	44.0x
CPB PStates  	0
MSR 0000001B  	0000-0000-FEE0-0900
MSR 0000008B  	0000-0000-08A0-0006
MSR 000000E7  	0000-00AB-9BA1-9BE4
MSR 000000E8  	0000-00D1-1627-BA41
MSR C0010004  	0000-0000-0000-0000
MSR C0010005  	0000-0000-0000-0000
MSR C0010006  	0000-0000-0000-0000
MSR C0010007  	0000-0000-0000-0000
MSR C0010015  	0000-0001-C900-0011
MSR C001001F  	0000-0000-0000-0000
MSR C0010055  	0000-0000-0000-0000
MSR C0010058  	0000-0000-E000-0021
MSR C0010061  	0000-0000-0000-0020
MSR C0010062  	0000-0000-0000-0000
MSR C0010063  	0000-0000-0000-0000
MSR C0010064  	8000-0000-472F-C870 [92.00x] [0.3563 V] [ 2.80 A] [PState P0]
MSR C0010065  	8000-0000-42EA-D058 [11.00x] [0.4813 V] [ 1.10 A] [PState P1]
MSR C0010066  	8000-0000-4265-D251 [ 9.00x] [0.6062 V] [ 0.90 A] [PState P2]
MSR C0010067  	0000-0000-0000-0000
MSR C0010068  	0000-0000-0000-0000
MSR C0010069  	0000-0000-0000-0000
MSR C001006A  	0000-0000-0000-0000
MSR C001006B  	0000-0000-0000-0000
MSR C0010070  	< FAILED >
MSR C0010293  	0000-0000-0136-422C [44.00x] [0.1938V]
MSR C0010293  	0000-0000-0128-422C [44.00x] [0.5437V]
MSR C0010293  	0000-0000-00A2-6150 [ 4.85x] [0.6937V]
MSR C0010293  	0000-0000-0128-422C [44.00x] [0.5437V]
MSR C0010293  	0000-0000-0128-422C [44.00x] [0.5437V]
MSR C0010140  	0000-0000-0000-0000
MSR C0010141  	0000-0000-0000-0000
MSR C0010290  	< FAILED >
MSR C0010292  	0000-0001-0400-4992
MSR C0010293  	0000-0000-0128-422C
MSR C0010294  	0FC2-6581-0000-4912
MSR C0010296  	0000-0000-0048-4848
MSR C0010299  	0000-0000-000A-1003
MSR C001029A  	0000-0000-028A-D49D
MSR C001029B  	0000-0000-1465-BC0E
MSR C0011023  	0002-0000-0000-0020
 
MSR Registers (CPU #5):
CPU Clock (Normal)  	4399 MHz
CPU Clock (TSC)  	2795 MHz
CPU Multiplier  	44.0x
CPB PStates  	0
MSR 0000001B  	0000-0000-FEE0-0900
MSR 0000008B  	0000-0000-08A0-0006
MSR 000000E7  	0000-00AB-A25B-65F8
MSR 000000E8  	0000-00D1-1E59-638A
MSR C0010004  	0000-0000-0000-0000
MSR C0010005  	0000-0000-0000-0000
MSR C0010006  	0000-0000-0000-0000
MSR C0010007  	0000-0000-0000-0000
MSR C0010015  	0000-0001-C900-0011
MSR C001001F  	0000-0000-0000-0000
MSR C0010055  	0000-0000-0000-0000
MSR C0010058  	0000-0000-E000-0021
MSR C0010061  	0000-0000-0000-0020
MSR C0010062  	0000-0000-0000-0000
MSR C0010063  	0000-0000-0000-0000
MSR C0010064  	8000-0000-472F-C870 [92.00x] [0.3563 V] [ 2.80 A] [PState P0]
MSR C0010065  	8000-0000-42EA-D058 [11.00x] [0.4813 V] [ 1.10 A] [PState P1]
MSR C0010066  	8000-0000-4265-D251 [ 9.00x] [0.6062 V] [ 0.90 A] [PState P2]
MSR C0010067  	0000-0000-0000-0000
MSR C0010068  	0000-0000-0000-0000
MSR C0010069  	0000-0000-0000-0000
MSR C001006A  	0000-0000-0000-0000
MSR C001006B  	0000-0000-0000-0000
MSR C0010070  	< FAILED >
MSR C0010293  	0000-0000-0136-422C [44.00x] [0.1938V]
MSR C0010293  	0000-0000-0128-422C [44.00x] [0.5437V]
MSR C0010293  	0000-0000-00A2-6150 [ 4.85x] [0.6937V]
MSR C0010293  	0000-0000-02A2-6150 [ 4.85x] [0.6937V]
MSR C0010293  	0000-0000-02D8-6150 [ 4.85x] [0.9437V]
MSR C0010140  	0000-0000-0000-0000
MSR C0010141  	0000-0000-0000-0000
MSR C0010290  	< FAILED >
MSR C0010292  	0000-0001-0400-4992
MSR C0010293  	0000-0000-02D8-6150
MSR C0010294  	0FC2-6581-0000-4912
MSR C0010296  	0000-0000-0048-4848
MSR C0010299  	0000-0000-000A-1003
MSR C001029A  	0000-0000-028A-E81E
MSR C001029B  	0000-0000-1466-190D
MSR C0011023  	0002-0000-0000-0020
 
MSR Registers (CPU #6):
CPU Clock (Normal)  	4399 MHz
CPU Clock (TSC)  	2795 MHz
CPU Multiplier  	44.0x
CPB PStates  	0
MSR 0000001B  	0000-0000-FEE0-0900
MSR 0000008B  	0000-0000-08A0-0006
MSR 000000E7  	0000-00AB-AD05-9F48
MSR 000000E8  	0000-00D1-28ED-E6B3
MSR C0010004  	0000-0000-0000-0000
MSR C0010005  	0000-0000-0000-0000
MSR C0010006  	0000-0000-0000-0000
MSR C0010007  	0000-0000-0000-0000
MSR C0010015  	0000-0001-C900-0011
MSR C001001F  	0000-0000-0000-0000
MSR C0010055  	0000-0000-0000-0000
MSR C0010058  	0000-0000-E000-0021
MSR C0010061  	0000-0000-0000-0020
MSR C0010062  	0000-0000-0000-0000
MSR C0010063  	0000-0000-0000-0000
MSR C0010064  	8000-0000-472F-C870 [92.00x] [0.3563 V] [ 2.80 A] [PState P0]
MSR C0010065  	8000-0000-42EA-D058 [11.00x] [0.4813 V] [ 1.10 A] [PState P1]
MSR C0010066  	8000-0000-4265-D251 [ 9.00x] [0.6062 V] [ 0.90 A] [PState P2]
MSR C0010067  	0000-0000-0000-0000
MSR C0010068  	0000-0000-0000-0000
MSR C0010069  	0000-0000-0000-0000
MSR C001006A  	0000-0000-0000-0000
MSR C001006B  	0000-0000-0000-0000
MSR C0010070  	< FAILED >
MSR C0010293  	0000-0000-0136-422C [44.00x] [0.1938V]
MSR C0010293  	0000-0000-02D8-6150 [ 4.85x] [0.9437V]
MSR C0010293  	0000-0000-02A2-6150 [ 4.85x] [0.6937V]
MSR C0010293  	0000-0000-0136-422C [44.00x] [0.1938V]
MSR C0010293  	0000-0000-0128-422C [44.00x] [0.5437V]
MSR C0010140  	0000-0000-0000-0000
MSR C0010141  	0000-0000-0000-0000
MSR C0010290  	< FAILED >
MSR C0010292  	0000-0001-0400-4992
MSR C0010293  	0000-0000-0128-422C
MSR C0010294  	0FC2-6581-0000-4912
MSR C0010296  	0000-0000-0048-4848
MSR C0010299  	0000-0000-000A-1003
MSR C001029A  	0000-0000-028A-F2E3
MSR C001029B  	0000-0000-1466-4AD0
MSR C0011023  	0002-0000-0000-0020
 
MSR Registers (CPU #7):
CPU Clock (Normal)  	485 MHz
CPU Clock (TSC)  	2795 MHz
CPU Multiplier  	4.8x
CPB PStates  	0
MSR 0000001B  	0000-0000-FEE0-0900
MSR 0000008B  	0000-0000-08A0-0006
MSR 000000E7  	0000-00AB-B5C9-5048
MSR 000000E8  	0000-00D1-3099-1A8A
MSR C0010004  	0000-0000-0000-0000
MSR C0010005  	0000-0000-0000-0000
MSR C0010006  	0000-0000-0000-0000
MSR C0010007  	0000-0000-0000-0000
MSR C0010015  	0000-0001-C900-0011
MSR C001001F  	0000-0000-0000-0000
MSR C0010055  	0000-0000-0000-0000
MSR C0010058  	0000-0000-E000-0021
MSR C0010061  	0000-0000-0000-0020
MSR C0010062  	0000-0000-0000-0000
MSR C0010063  	0000-0000-0000-0000
MSR C0010064  	8000-0000-472F-C870 [92.00x] [0.3563 V] [ 2.80 A] [PState P0]
MSR C0010065  	8000-0000-42EA-D058 [11.00x] [0.4813 V] [ 1.10 A] [PState P1]
MSR C0010066  	8000-0000-4265-D251 [ 9.00x] [0.6062 V] [ 0.90 A] [PState P2]
MSR C0010067  	0000-0000-0000-0000
MSR C0010068  	0000-0000-0000-0000
MSR C0010069  	0000-0000-0000-0000
MSR C001006A  	0000-0000-0000-0000
MSR C001006B  	0000-0000-0000-0000
MSR C0010070  	< FAILED >
MSR C0010293  	0000-0000-0136-422C [44.00x] [0.1938V]
MSR C0010293  	0000-0000-0128-422C [44.00x] [0.5437V]
MSR C0010293  	0000-0000-0128-422C [44.00x] [0.5437V]
MSR C0010293  	0000-0000-0128-422C [44.00x] [0.5437V]
MSR C0010293  	0000-0000-0128-422C [44.00x] [0.5437V]
MSR C0010140  	0000-0000-0000-0000
MSR C0010141  	0000-0000-0000-0000
MSR C0010290  	< FAILED >
MSR C0010292  	0000-0001-0400-4992
MSR C0010293  	0000-0000-0128-422C
MSR C0010294  	0FC2-6581-0000-4912
MSR C0010296  	0000-0000-0048-4848
MSR C0010299  	0000-0000-000A-1003
MSR C001029A  	0000-0000-028A-F678
MSR C001029B  	0000-0000-1466-561F
MSR C0011023  	0002-0000-0000-0020
