------[ CPUID Registers / Logical CPU #0 ]------

allcpu: Package 0 / Core 0 / Thread 0: Valid

CPUID 00000000: 0000000D-68747541-444D4163-69746E65 [AuthenticAMD]
CPUID 00000001: 00630F01-00040800-3E98320B-178BFBFF
CPUID 00000002: 00000000-00000000-00000000-00000000
CPUID 00000003: 00000000-00000000-00000000-00000000
CPUID 00000005: 00000040-00000040-00000003-00000000
CPUID 00000006: 00000000-00000000-00000001-00000000
CPUID 00000007: 00000000-00000009-00000000-00000000
CPUID 00000008: 00000000-00000000-00000000-00000000
CPUID 00000009: 00000000-00000000-00000000-00000000
CPUID 0000000A: 00000000-00000000-00000000-00000000
CPUID 0000000C: 00000000-00000000-00000000-00000000
CPUID 0000000D: 00000007-00000340-000003C0-40000000 [SL 00] [x87]
CPUID 0000000D: 00000001-00000000-00000000-00000000 [SL 01] [SSE]
CPUID 0000000D: 00000100-00000240-00000000-00000000 [SL 02] [AVX]
CPUID 0000000D: 00000080-00000340-00000000-00000000 [SL 3E]
CPUID 80000000: 8000001E-68747541-444D4163-69746E65 [AuthenticAMD]
CPUID 80000001: 00630F01-00000000-0FABBFFF-2FD3FBFF
CPUID 80000002: 20444D41-342D5852-42423732-74697720 [AMD RX-427BB wit]
CPUID 80000003: 4D412068-61522044-6E6F6564-296D7428 [h AMD Radeon(tm)]
CPUID 80000004: 20375220-70617247-73636968-00202020 [ R7 Graphics   ]
CPUID 80000005: FF40FF18-FF40FF30-10040140-60030140 [L1D: 16 KB / L1I: 96 KB]
CPUID 80000006: 64006400-64004200-08008140-00000000 [L2: 2048 KB] / L3: 0 KB]
CPUID 80000007: 00000000-00000001-00000000-000027D9
CPUID 80000008: 00003030-00000000-00004003-00000000
CPUID 80000009: 00000000-00000000-00000000-00000000
CPUID 8000000A: 00000001-00010000-00000000-00001CFF
CPUID 8000000B: 00000000-00000000-00000000-00000000
CPUID 8000000C: 00000000-00000000-00000000-00000000
CPUID 8000000D: 00000000-00000000-00000000-00000000
CPUID 8000000E: 00000000-00000000-00000000-00000000
CPUID 8000000F: 00000000-00000000-00000000-00000000
CPUID 80000010: 00000000-00000000-00000000-00000000
CPUID 80000011: 00000000-00000000-00000000-00000000
CPUID 80000012: 00000000-00000000-00000000-00000000
CPUID 80000013: 00000000-00000000-00000000-00000000
CPUID 80000014: 00000000-00000000-00000000-00000000
CPUID 80000015: 00000000-00000000-00000000-00000000
CPUID 80000016: 00000000-00000000-00000000-00000000
CPUID 80000017: 00000000-00000000-00000000-00000000
CPUID 80000018: 00000000-00000000-00000000-00000000
CPUID 80000019: F040F018-64006400-00000000-00000000
CPUID 8000001A: 00000003-00000000-00000000-00000000
CPUID 8000001B: 000001FF-00000000-00000000-00000000
CPUID 8000001C: 00000000-80032013-00010200-E000000F
CPUID 8000001E: 00000010-00000100-00000000-00000000
CPUID 8FFFFFFF: 00000000-00000000-00000000-00000000

------[ CPUID Registers / Logical CPU #1 ]------

allcpu: Package 0 / Core 1 / Thread 0: Valid

CPUID 00000000: 0000000D-68747541-444D4163-69746E65 [AuthenticAMD]
CPUID 00000001: 00630F01-01040800-3E98320B-178BFBFF
CPUID 00000002: 00000000-00000000-00000000-00000000
CPUID 00000003: 00000000-00000000-00000000-00000000
CPUID 00000005: 00000040-00000040-00000003-00000000
CPUID 00000006: 00000000-00000000-00000001-00000000
CPUID 00000007: 00000000-00000009-00000000-00000000
CPUID 00000008: 00000000-00000000-00000000-00000000
CPUID 00000009: 00000000-00000000-00000000-00000000
CPUID 0000000A: 00000000-00000000-00000000-00000000
CPUID 0000000C: 00000000-00000000-00000000-00000000
CPUID 0000000D: 00000007-00000340-000003C0-40000000 [SL 00] [x87]
CPUID 0000000D: 00000001-00000000-00000000-00000000 [SL 01] [SSE]
CPUID 0000000D: 00000100-00000240-00000000-00000000 [SL 02] [AVX]
CPUID 0000000D: 00000080-00000340-00000000-00000000 [SL 3E]
CPUID 80000000: 8000001E-68747541-444D4163-69746E65 [AuthenticAMD]
CPUID 80000001: 00630F01-00000000-0FABBFFF-2FD3FBFF
CPUID 80000002: 20444D41-342D5852-42423732-74697720 [AMD RX-427BB wit]
CPUID 80000003: 4D412068-61522044-6E6F6564-296D7428 [h AMD Radeon(tm)]
CPUID 80000004: 20375220-70617247-73636968-00202020 [ R7 Graphics   ]
CPUID 80000005: FF40FF18-FF40FF30-10040140-60030140 [L1D: 16 KB / L1I: 96 KB]
CPUID 80000006: 64006400-64004200-08008140-00000000 [L2: 2048 KB] / L3: 0 KB]
CPUID 80000007: 00000000-00000001-00000000-000027D9
CPUID 80000008: 00003030-00000000-00004003-00000000
CPUID 80000009: 00000000-00000000-00000000-00000000
CPUID 8000000A: 00000001-00010000-00000000-00001CFF
CPUID 8000000B: 00000000-00000000-00000000-00000000
CPUID 8000000C: 00000000-00000000-00000000-00000000
CPUID 8000000D: 00000000-00000000-00000000-00000000
CPUID 8000000E: 00000000-00000000-00000000-00000000
CPUID 8000000F: 00000000-00000000-00000000-00000000
CPUID 80000010: 00000000-00000000-00000000-00000000
CPUID 80000011: 00000000-00000000-00000000-00000000
CPUID 80000012: 00000000-00000000-00000000-00000000
CPUID 80000013: 00000000-00000000-00000000-00000000
CPUID 80000014: 00000000-00000000-00000000-00000000
CPUID 80000015: 00000000-00000000-00000000-00000000
CPUID 80000016: 00000000-00000000-00000000-00000000
CPUID 80000017: 00000000-00000000-00000000-00000000
CPUID 80000018: 00000000-00000000-00000000-00000000
CPUID 80000019: F040F018-64006400-00000000-00000000
CPUID 8000001A: 00000003-00000000-00000000-00000000
CPUID 8000001B: 000001FF-00000000-00000000-00000000
CPUID 8000001C: 00000000-80032013-00010200-E000000F
CPUID 8000001E: 00000011-00000100-00000000-00000000
CPUID 8FFFFFFF: 00000000-00000000-00000000-00000000

------[ CPUID Registers / Logical CPU #2 ]------

allcpu: Package 0 / Core 2 / Thread 0: Valid

CPUID 00000000: 0000000D-68747541-444D4163-69746E65 [AuthenticAMD]
CPUID 00000001: 00630F01-02040800-3E98320B-178BFBFF
CPUID 00000002: 00000000-00000000-00000000-00000000
CPUID 00000003: 00000000-00000000-00000000-00000000
CPUID 00000005: 00000040-00000040-00000003-00000000
CPUID 00000006: 00000000-00000000-00000001-00000000
CPUID 00000007: 00000000-00000009-00000000-00000000
CPUID 00000008: 00000000-00000000-00000000-00000000
CPUID 00000009: 00000000-00000000-00000000-00000000
CPUID 0000000A: 00000000-00000000-00000000-00000000
CPUID 0000000C: 00000000-00000000-00000000-00000000
CPUID 0000000D: 00000007-00000340-000003C0-40000000 [SL 00] [x87]
CPUID 0000000D: 00000001-00000000-00000000-00000000 [SL 01] [SSE]
CPUID 0000000D: 00000100-00000240-00000000-00000000 [SL 02] [AVX]
CPUID 0000000D: 00000080-00000340-00000000-00000000 [SL 3E]
CPUID 80000000: 8000001E-68747541-444D4163-69746E65 [AuthenticAMD]
CPUID 80000001: 00630F01-00000000-0FABBFFF-2FD3FBFF
CPUID 80000002: 20444D41-342D5852-42423732-74697720 [AMD RX-427BB wit]
CPUID 80000003: 4D412068-61522044-6E6F6564-296D7428 [h AMD Radeon(tm)]
CPUID 80000004: 20375220-70617247-73636968-00202020 [ R7 Graphics   ]
CPUID 80000005: FF40FF18-FF40FF30-10040140-60030140 [L1D: 16 KB / L1I: 96 KB]
CPUID 80000006: 64006400-64004200-08008140-00000000 [L2: 2048 KB] / L3: 0 KB]
CPUID 80000007: 00000000-00000001-00000000-000027D9
CPUID 80000008: 00003030-00000000-00004003-00000000
CPUID 80000009: 00000000-00000000-00000000-00000000
CPUID 8000000A: 00000001-00010000-00000000-00001CFF
CPUID 8000000B: 00000000-00000000-00000000-00000000
CPUID 8000000C: 00000000-00000000-00000000-00000000
CPUID 8000000D: 00000000-00000000-00000000-00000000
CPUID 8000000E: 00000000-00000000-00000000-00000000
CPUID 8000000F: 00000000-00000000-00000000-00000000
CPUID 80000010: 00000000-00000000-00000000-00000000
CPUID 80000011: 00000000-00000000-00000000-00000000
CPUID 80000012: 00000000-00000000-00000000-00000000
CPUID 80000013: 00000000-00000000-00000000-00000000
CPUID 80000014: 00000000-00000000-00000000-00000000
CPUID 80000015: 00000000-00000000-00000000-00000000
CPUID 80000016: 00000000-00000000-00000000-00000000
CPUID 80000017: 00000000-00000000-00000000-00000000
CPUID 80000018: 00000000-00000000-00000000-00000000
CPUID 80000019: F040F018-64006400-00000000-00000000
CPUID 8000001A: 00000003-00000000-00000000-00000000
CPUID 8000001B: 000001FF-00000000-00000000-00000000
CPUID 8000001C: 00000000-80032013-00010200-E000000F
CPUID 8000001E: 00000012-00000101-00000000-00000000
CPUID 8FFFFFFF: 00000000-00000000-00000000-00000000

------[ CPUID Registers / Logical CPU #3 ]------

allcpu: Package 0 / Core 3 / Thread 0: Valid

CPUID 00000000: 0000000D-68747541-444D4163-69746E65 [AuthenticAMD]
CPUID 00000001: 00630F01-03040800-3E98320B-178BFBFF
CPUID 00000002: 00000000-00000000-00000000-00000000
CPUID 00000003: 00000000-00000000-00000000-00000000
CPUID 00000005: 00000040-00000040-00000003-00000000
CPUID 00000006: 00000000-00000000-00000001-00000000
CPUID 00000007: 00000000-00000009-00000000-00000000
CPUID 00000008: 00000000-00000000-00000000-00000000
CPUID 00000009: 00000000-00000000-00000000-00000000
CPUID 0000000A: 00000000-00000000-00000000-00000000
CPUID 0000000C: 00000000-00000000-00000000-00000000
CPUID 0000000D: 00000007-00000340-000003C0-40000000 [SL 00] [x87]
CPUID 0000000D: 00000001-00000000-00000000-00000000 [SL 01] [SSE]
CPUID 0000000D: 00000100-00000240-00000000-00000000 [SL 02] [AVX]
CPUID 0000000D: 00000080-00000340-00000000-00000000 [SL 3E]
CPUID 80000000: 8000001E-68747541-444D4163-69746E65 [AuthenticAMD]
CPUID 80000001: 00630F01-00000000-0FABBFFF-2FD3FBFF
CPUID 80000002: 20444D41-342D5852-42423732-74697720 [AMD RX-427BB wit]
CPUID 80000003: 4D412068-61522044-6E6F6564-296D7428 [h AMD Radeon(tm)]
CPUID 80000004: 20375220-70617247-73636968-00202020 [ R7 Graphics   ]
CPUID 80000005: FF40FF18-FF40FF30-10040140-60030140 [L1D: 16 KB / L1I: 96 KB]
CPUID 80000006: 64006400-64004200-08008140-00000000 [L2: 2048 KB] / L3: 0 KB]
CPUID 80000007: 00000000-00000001-00000000-000027D9
CPUID 80000008: 00003030-00000000-00004003-00000000
CPUID 80000009: 00000000-00000000-00000000-00000000
CPUID 8000000A: 00000001-00010000-00000000-00001CFF
CPUID 8000000B: 00000000-00000000-00000000-00000000
CPUID 8000000C: 00000000-00000000-00000000-00000000
CPUID 8000000D: 00000000-00000000-00000000-00000000
CPUID 8000000E: 00000000-00000000-00000000-00000000
CPUID 8000000F: 00000000-00000000-00000000-00000000
CPUID 80000010: 00000000-00000000-00000000-00000000
CPUID 80000011: 00000000-00000000-00000000-00000000
CPUID 80000012: 00000000-00000000-00000000-00000000
CPUID 80000013: 00000000-00000000-00000000-00000000
CPUID 80000014: 00000000-00000000-00000000-00000000
CPUID 80000015: 00000000-00000000-00000000-00000000
CPUID 80000016: 00000000-00000000-00000000-00000000
CPUID 80000017: 00000000-00000000-00000000-00000000
CPUID 80000018: 00000000-00000000-00000000-00000000
CPUID 80000019: F040F018-64006400-00000000-00000000
CPUID 8000001A: 00000003-00000000-00000000-00000000
CPUID 8000001B: 000001FF-00000000-00000000-00000000
CPUID 8000001C: 00000000-80032013-00010200-E000000F
CPUID 8000001E: 00000013-00000101-00000000-00000000
CPUID 8FFFFFFF: 00000000-00000000-00000000-00000000

------[ All CPUs ]------

CPU   0: APICID   16 / Package 0 / Core   0 / Thread 0: Valid
CPU   1: APICID   17 / Package 0 / Core   1 / Thread 0: Valid
CPU   2: APICID   18 / Package 0 / Core   2 / Thread 0: Valid
CPU   3: APICID   19 / Package 0 / Core   3 / Thread 0: Valid

------[ MSR Registers / Logical CPU #0 ]------

CPU Clock (Normal): 2496 MHz
CPU Clock (TSC): 2695 MHz
CPU Multiplier: 25.0x
CPB PStates: 3
MSR 0000001B: 0000-0000-FEE0-0900
MSR 0000008B: 0000-0000-0600-3106
MSR 000000E7: 0000-0000-021E-93FD [S200]
MSR 000000E7: 0000-0000-0002-0DC8 [S200]
MSR 000000E7: 0000-0000-0004-59FB
MSR 000000E8: 0000-0000-0004-9BE0 [S200]
MSR 000000E8: 0000-0000-0001-F663 [S200]
MSR 000000E8: 0000-0000-0004-F69A
MSR C0010004: 0000-FFFF-FFFB-0DAF
MSR C0010005: 0000-0000-0000-0000
MSR C0010006: 0000-0000-0000-0000
MSR C0010007: 0000-0000-0000-0000
MSR C0010015: 0000-0000-0900-1011
MSR C001001F: 0040-4000-0885-0000
MSR C0010055: 0000-0000-0000-0000
MSR C0010058: 0000-0000-E000-0021
MSR C0010061: 0000-0000-0000-0040
MSR C0010062: 0000-0000-0000-0001
MSR C0010063: 0000-0000-0000-0001
MSR C0010064: 8000-0164-0000-5014 [36.00x] [1.3000 V] [10.00 A] [PState Pb0]
MSR C0010065: 8000-017F-0000-7C10 [32.00x] [1.1625 V] [12.70 A] [PState Pb1]
MSR C0010066: 8000-0170-0000-900E [30.00x] [1.1000 V] [11.20 A] [PState Pb2]
MSR C0010067: 8000-0150-0000-9C0B [27.00x] [1.0625 V] [ 8.00 A] [PState P0]
MSR C0010068: 8000-0148-0000-A809 [25.00x] [1.0250 V] [ 7.20 A] [PState P1]
MSR C0010069: 8000-013E-0000-B806 [22.00x] [0.9750 V] [ 6.20 A] [PState P2]
MSR C001006A: 8000-012F-0000-CC54 [18.00x] [0.9125 V] [ 4.70 A] [PState P3]
MSR C001006B: 8000-0123-0040-E44C [14.00x] [0.8375 V] [ 3.50 A] [PState P4]
MSR C0010070: 0000-0000-5A04-A809
MSR C0010071: 7948-0006-5644-A809 [25.00x] [1.0250V]
MSR C0010071: 7948-0006-5044-A809 [25.00x] [1.0250V]
MSR C0010071: 7948-0006-5044-A809 [25.00x] [1.0250V]
MSR C0010071: 7948-0006-5044-A809 [25.00x] [1.0250V]
MSR C0010071: 7948-0006-5044-A809 [25.00x] [1.0250V]
MSR C0010140: 0000-0000-0000-0004
MSR C0010141: 0000-0000-0000-0000
MSR C0011023: 8102-4004-0078-1220

------[ MSR Registers / Logical CPU #1 ]------

CPU Clock (Normal): 2496 MHz
CPU Clock (TSC): 2695 MHz
CPU Multiplier: 25.0x
CPB PStates: 3
MSR 0000001B: 0000-0000-FEE0-0900
MSR 0000008B: 0000-0000-0600-3106
MSR 000000E7: 0000-0000-02BC-3DDE
MSR 000000E8: 0000-0000-0288-944F
MSR C0010004: 0000-FFFF-FFFB-0DAF
MSR C0010005: 0000-0000-0000-0000
MSR C0010006: 0000-0000-0000-0000
MSR C0010007: 0000-0000-0000-0000
MSR C0010015: 0000-0000-0900-1011
MSR C001001F: 0040-4000-0885-0000
MSR C0010055: 0000-0000-0000-0000
MSR C0010058: 0000-0000-E000-0021
MSR C0010061: 0000-0000-0000-0040
MSR C0010062: 0000-0000-0000-0001
MSR C0010063: 0000-0000-0000-0001
MSR C0010064: 8000-0164-0000-5014 [36.00x] [1.3000 V] [10.00 A] [PState Pb0]
MSR C0010065: 8000-017F-0000-7C10 [32.00x] [1.1625 V] [12.70 A] [PState Pb1]
MSR C0010066: 8000-0170-0000-900E [30.00x] [1.1000 V] [11.20 A] [PState Pb2]
MSR C0010067: 8000-0150-0000-9C0B [27.00x] [1.0625 V] [ 8.00 A] [PState P0]
MSR C0010068: 8000-0148-0000-A809 [25.00x] [1.0250 V] [ 7.20 A] [PState P1]
MSR C0010069: 8000-013E-0000-B806 [22.00x] [0.9750 V] [ 6.20 A] [PState P2]
MSR C001006A: 8000-012F-0000-CC54 [18.00x] [0.9125 V] [ 4.70 A] [PState P3]
MSR C001006B: 8000-0123-0040-E44C [14.00x] [0.8375 V] [ 3.50 A] [PState P4]
MSR C0010070: 0000-0000-5A04-A809
MSR C0010071: 7948-0006-5044-A809 [25.00x] [1.0250V]
MSR C0010071: 7948-0006-5044-A809 [25.00x] [1.0250V]
MSR C0010071: 7948-0006-5044-A809 [25.00x] [1.0250V]
MSR C0010071: 7948-0006-5644-A809 [25.00x] [1.0250V]
MSR C0010071: 7948-0006-4444-A809 [25.00x] [1.0250V]
MSR C0010140: 0000-0000-0000-0004
MSR C0010141: 0000-0000-0000-0000
MSR C0011023: 8102-4004-0078-1220

------[ MSR Registers / Logical CPU #2 ]------

CPU Clock (Normal): 2496 MHz
CPU Clock (TSC): 2695 MHz
CPU Multiplier: 25.0x
CPB PStates: 3
MSR 0000001B: 0000-0000-FEE0-0900
MSR 0000008B: 0000-0000-0600-3106
MSR 000000E7: 0000-0000-00AE-7FD6
MSR 000000E8: 0000-0000-00A1-EC21
MSR C0010004: 0000-FFFF-FFFB-0DAF
MSR C0010005: 0000-0000-0000-0000
MSR C0010006: 0000-0000-0000-0000
MSR C0010007: 0000-0000-0000-0000
MSR C0010015: 0000-0000-0900-1011
MSR C001001F: 0040-4000-0885-0000
MSR C0010055: 0000-0000-0000-0000
MSR C0010058: 0000-0000-E000-0021
MSR C0010061: 0000-0000-0000-0040
MSR C0010062: 0000-0000-0000-0001
MSR C0010063: 0000-0000-0000-0001
MSR C0010064: 8000-0164-0000-5014 [36.00x] [1.3000 V] [10.00 A] [PState Pb0]
MSR C0010065: 8000-017F-0000-7C10 [32.00x] [1.1625 V] [12.70 A] [PState Pb1]
MSR C0010066: 8000-0170-0000-900E [30.00x] [1.1000 V] [11.20 A] [PState Pb2]
MSR C0010067: 8000-0150-0000-9C0B [27.00x] [1.0625 V] [ 8.00 A] [PState P0]
MSR C0010068: 8000-0148-0000-A809 [25.00x] [1.0250 V] [ 7.20 A] [PState P1]
MSR C0010069: 8000-013E-0000-B806 [22.00x] [0.9750 V] [ 6.20 A] [PState P2]
MSR C001006A: 8000-012F-0000-CC54 [18.00x] [0.9125 V] [ 4.70 A] [PState P3]
MSR C001006B: 8000-0123-0040-E44C [14.00x] [0.8375 V] [ 3.50 A] [PState P4]
MSR C0010070: 0000-0000-5A04-A809
MSR C0010071: 7948-0006-5044-A809 [25.00x] [1.0250V]
MSR C0010071: 7948-0006-5044-A809 [25.00x] [1.0250V]
MSR C0010071: 7948-0006-5044-A809 [25.00x] [1.0250V]
MSR C0010071: 7948-0006-5044-A809 [25.00x] [1.0250V]
MSR C0010071: 7948-0006-5044-A809 [25.00x] [1.0250V]
MSR C0010140: 0000-0000-0000-0004
MSR C0010141: 0000-0000-0000-0000
MSR C0011023: 8102-4004-0078-1220

------[ MSR Registers / Logical CPU #3 ]------

CPU Clock (Normal): 2496 MHz
CPU Clock (TSC): 2695 MHz
CPU Multiplier: 25.0x
CPB PStates: 3
MSR 0000001B: 0000-0000-FEE0-0900
MSR 0000008B: 0000-0000-0600-3106
MSR 000000E7: 0000-0000-01A4-F370
MSR 000000E8: 0000-0000-0185-F995
MSR C0010004: 0000-FFFF-FFFB-0DAF
MSR C0010005: 0000-0000-0000-0000
MSR C0010006: 0000-0000-0000-0000
MSR C0010007: 0000-0000-0000-0000
MSR C0010015: 0000-0000-0900-1011
MSR C001001F: 0040-4000-0885-0000
MSR C0010055: 0000-0000-0000-0000
MSR C0010058: 0000-0000-E000-0021
MSR C0010061: 0000-0000-0000-0040
MSR C0010062: 0000-0000-0000-0001
MSR C0010063: 0000-0000-0000-0001
MSR C0010064: 8000-0164-0000-5014 [36.00x] [1.3000 V] [10.00 A] [PState Pb0]
MSR C0010065: 8000-017F-0000-7C10 [32.00x] [1.1625 V] [12.70 A] [PState Pb1]
MSR C0010066: 8000-0170-0000-900E [30.00x] [1.1000 V] [11.20 A] [PState Pb2]
MSR C0010067: 8000-0150-0000-9C0B [27.00x] [1.0625 V] [ 8.00 A] [PState P0]
MSR C0010068: 8000-0148-0000-A809 [25.00x] [1.0250 V] [ 7.20 A] [PState P1]
MSR C0010069: 8000-013E-0000-B806 [22.00x] [0.9750 V] [ 6.20 A] [PState P2]
MSR C001006A: 8000-012F-0000-CC54 [18.00x] [0.9125 V] [ 4.70 A] [PState P3]
MSR C001006B: 8000-0123-0040-E44C [14.00x] [0.8375 V] [ 3.50 A] [PState P4]
MSR C0010070: 0000-0000-5A04-A809
MSR C0010071: 7948-0006-5044-A809 [25.00x] [1.0250V]
MSR C0010071: 7948-0006-5044-A809 [25.00x] [1.0250V]
MSR C0010071: 7948-0006-5044-A809 [25.00x] [1.0250V]
MSR C0010071: 7948-0006-5044-A809 [25.00x] [1.0250V]
MSR C0010071: 7948-0006-5044-A809 [25.00x] [1.0250V]
MSR C0010140: 0000-0000-0000-0004
MSR C0010141: 0000-0000-0000-0000
MSR C0011023: 8102-4004-0078-1220
