------[ CPUID Registers / Logical CPU #0 ]------

allcpu: Package 0 / Core 0 / Thread 0: Valid, AMD P-core

CPUID 00000000: 00000010-68747541-444D4163-69746E65 [AuthenticAMD]
CPUID 00000001: 00B60F80-00080800-7ED8320B-178BFBFF
CPUID 00000002: 00000000-00000000-00000000-00000000
CPUID 00000003: 00000000-00000000-00000000-00000000
CPUID 00000005: 00000040-00000040-00000003-00000021
CPUID 00000006: 00000004-00000000-00000001-00000000
CPUID 00000007: 00000001-F1BF97AB-19405FCE-10000110 [SL 00]
CPUID 00000007: 00000030-00000000-00000000-00000000 [SL 01]
CPUID 00000008: 00000000-00000000-00000000-00000000
CPUID 00000009: 00000000-00000000-00000000-00000000
CPUID 0000000A: 00000000-00000000-00000000-00000000
CPUID 0000000B: 00000001-00000002-00000100-00000000 [SL 00]
CPUID 0000000B: 00000004-00000008-00000201-00000000 [SL 01]
CPUID 0000000C: 00000000-00000000-00000000-00000000
CPUID 0000000D: 000002E7-00000980-00000988-00000000 [SL 00] [x87]
CPUID 0000000D: 0000000F-00000990-00001800-00000000 [SL 01] [SSE]
CPUID 0000000D: 00000100-00000240-00000000-00000000 [SL 02] [AVX]
CPUID 0000000D: 00000040-00000340-00000000-00000000 [SL 05] [AVX-512 Opmask]
CPUID 0000000D: 00000200-00000380-00000000-00000000 [SL 06] [AVX-512 Hi256]
CPUID 0000000D: 00000400-00000580-00000000-00000000 [SL 07] [AVX-512 Hi16]
CPUID 0000000D: 00000008-00000980-00000000-00000000 [SL 09] [PKRU]
CPUID 0000000D: 00000010-00000000-00000001-00000000 [SL 0B] [CET_U]
CPUID 0000000D: 00000018-00000000-00000001-00000000 [SL 0C] [CET_S]
CPUID 0000000E: 00000000-00000000-00000000-00000000
CPUID 0000000F: 00000000-00000FFF-00000000-00000002 [SL 00]
CPUID 0000000F: 00000014-00000040-00000FFF-00000007 [SL 01]
CPUID 00000010: 00000000-00000002-00000000-00000000 [SL 00]
CPUID 00000010: 0000000F-00000000-00000004-0000000F [SL 01]
CPUID 80000000: 80000028-68747541-444D4163-69746E65 [AuthenticAMD]
CPUID 80000001: 00B60F80-10000000-75C237FF-2FD3FBFF
CPUID 80000002: 20444D41-657A7952-4941206E-34203520 [AMD Ryzen AI 5 4]
CPUID 80000003: 77203033-6152202F-6E6F6564-30343820 [30 w/ Radeon 840]
CPUID 80000004: 0000004D-00000000-00000000-00000000 [M]
CPUID 80000005: FF60FF40-FF60FF40-300C0140-20080140 [L1D: 48 KB / L1I: 32 KB]
CPUID 80000006: 40802040-60804040-04008140-00409140 [L2: 1024 KB / L3: 8192 KB]
CPUID 80000007: 00000000-0000003B-00000000-00006799
CPUID 80000008: 00003030-791EF257-00004007-00010000
CPUID 80000009: 00000000-00000000-00000000-00000000
CPUID 8000000A: 00000001-00008000-00000000-FEBFBDFF
CPUID 8000000B: 00000000-00000000-00000000-00000000
CPUID 8000000C: 00000000-00000000-00000000-00000000
CPUID 8000000D: 00000000-00000000-00000000-00000000
CPUID 8000000E: 00000000-00000000-00000000-00000000
CPUID 8000000F: 00000000-00000000-00000000-00000000
CPUID 80000010: 00000000-00000000-00000000-00000000
CPUID 80000011: 00000000-00000000-00000000-00000000
CPUID 80000012: 00000000-00000000-00000000-00000000
CPUID 80000013: 00000000-00000000-00000000-00000000
CPUID 80000014: 00000000-00000000-00000000-00000000
CPUID 80000015: 00000000-00000000-00000000-00000000
CPUID 80000016: 00000000-00000000-00000000-00000000
CPUID 80000017: 00000000-00000000-00000000-00000000
CPUID 80000018: 00000000-00000000-00000000-00000000
CPUID 80000019: F060F040-40200000-00000000-00000000
CPUID 8000001A: 00000006-00000000-00000000-00000000
CPUID 8000001B: 00081BFF-00000000-00000000-00000000
CPUID 8000001C: 00000000-00000000-00000000-00000000
CPUID 8000001D: 00004121-02C0003F-0000003F-00000000 [SL 00] [L1D: 48 KB]
CPUID 8000001D: 00004122-01C0003F-0000003F-00000000 [SL 01] [L1I: 32 KB]
CPUID 8000001D: 00004143-03C0003F-000003FF-00000002 [SL 02] [L2U: 1 MB]
CPUID 8000001D: 0001C163-03C0003F-00001FFF-00000001 [SL 03] [L3U: 8 MB]
CPUID 8000001E: 00000000-00000100-00000000-00000000
CPUID 8000001F: 00000001-000000B3-00000000-00000000
CPUID 80000020: 00000000-0000007E-00000000-00000000 [SL 00]
CPUID 80000020: 0000000C-00000000-00000000-0000000F [SL 01]
CPUID 80000020: 0000000C-00000000-00000000-0000000F [SL 02]
CPUID 80000020: 00000000-00000002-0000007F-00000000 [SL 03]
CPUID 80000020: 00000014-0000001F-00000001-00000000 [SL 05]
CPUID 80000021: 597FFFCF-00080382-00000000-00000000
CPUID 80000022: 00000007-00104106-0000000F-00000000
CPUID 80000023: 00000000-00000000-00000000-00000000
CPUID 80000024: 00000000-00000000-00000000-00000000
CPUID 80000025: 00000000-00000000-00000000-00000000
CPUID 80000026: 60000001-00000002-00000100-00000000 [SL 00] [P-core]
CPUID 80000026: 40000004-00000008-00000201-00000000 [SL 01]
CPUID 80000026: 40000004-00000008-00000302-00000000 [SL 02]
CPUID 80000026: 00000004-00000008-00000403-00000000 [SL 03]
CPUID 80000027: 00000003-00000000-00000000-00000000
CPUID 80000028: 00000000-00000000-00000000-00000000
CPUID 8FFFFFFF: 00000000-00000000-00000000-00000000

L1    Data Cache:    48 KB, 12-way Associative, 64-byte Line
L1  Instr. Cache:    32 KB,  8-way Associative, 64-byte Line
L2 Unified Cache:     1 MB, 16-way Associative, 64-byte Line
L3 Unified Cache:     8 MB, 16-way Associative, 64-byte Line

------[ CPUID Registers / Logical CPU #1 ]------

allcpu: Package 0 / Core 0 / Thread 1: Valid, Virtual, AMD P-core

CPUID 00000000: 00000010-68747541-444D4163-69746E65 [AuthenticAMD]
CPUID 00000001: 00B60F80-01080800-7ED8320B-178BFBFF
CPUID 00000002: 00000000-00000000-00000000-00000000
CPUID 00000003: 00000000-00000000-00000000-00000000
CPUID 00000005: 00000040-00000040-00000003-00000021
CPUID 00000006: 00000004-00000000-00000001-00000000
CPUID 00000007: 00000001-F1BF97AB-19405FCE-10000110 [SL 00]
CPUID 00000007: 00000030-00000000-00000000-00000000 [SL 01]
CPUID 00000008: 00000000-00000000-00000000-00000000
CPUID 00000009: 00000000-00000000-00000000-00000000
CPUID 0000000A: 00000000-00000000-00000000-00000000
CPUID 0000000B: 00000001-00000002-00000100-00000001 [SL 00]
CPUID 0000000B: 00000004-00000008-00000201-00000001 [SL 01]
CPUID 0000000C: 00000000-00000000-00000000-00000000
CPUID 0000000D: 000002E7-00000980-00000988-00000000 [SL 00] [x87]
CPUID 0000000D: 0000000F-00000990-00001800-00000000 [SL 01] [SSE]
CPUID 0000000D: 00000100-00000240-00000000-00000000 [SL 02] [AVX]
CPUID 0000000D: 00000040-00000340-00000000-00000000 [SL 05] [AVX-512 Opmask]
CPUID 0000000D: 00000200-00000380-00000000-00000000 [SL 06] [AVX-512 Hi256]
CPUID 0000000D: 00000400-00000580-00000000-00000000 [SL 07] [AVX-512 Hi16]
CPUID 0000000D: 00000008-00000980-00000000-00000000 [SL 09] [PKRU]
CPUID 0000000D: 00000010-00000000-00000001-00000000 [SL 0B] [CET_U]
CPUID 0000000D: 00000018-00000000-00000001-00000000 [SL 0C] [CET_S]
CPUID 0000000E: 00000000-00000000-00000000-00000000
CPUID 0000000F: 00000000-00000FFF-00000000-00000002 [SL 00]
CPUID 0000000F: 00000014-00000040-00000FFF-00000007 [SL 01]
CPUID 00000010: 00000000-00000002-00000000-00000000 [SL 00]
CPUID 00000010: 0000000F-00000000-00000004-0000000F [SL 01]
CPUID 80000000: 80000028-68747541-444D4163-69746E65 [AuthenticAMD]
CPUID 80000001: 00B60F80-10000000-75C237FF-2FD3FBFF
CPUID 80000002: 20444D41-657A7952-4941206E-34203520 [AMD Ryzen AI 5 4]
CPUID 80000003: 77203033-6152202F-6E6F6564-30343820 [30 w/ Radeon 840]
CPUID 80000004: 0000004D-00000000-00000000-00000000 [M]
CPUID 80000005: FF60FF40-FF60FF40-300C0140-20080140 [L1D: 48 KB / L1I: 32 KB]
CPUID 80000006: 40802040-60804040-04008140-00409140 [L2: 1024 KB / L3: 8192 KB]
CPUID 80000007: 00000000-0000003B-00000000-00006799
CPUID 80000008: 00003030-791EF257-00004007-00010000
CPUID 80000009: 00000000-00000000-00000000-00000000
CPUID 8000000A: 00000001-00008000-00000000-FEBFBDFF
CPUID 8000000B: 00000000-00000000-00000000-00000000
CPUID 8000000C: 00000000-00000000-00000000-00000000
CPUID 8000000D: 00000000-00000000-00000000-00000000
CPUID 8000000E: 00000000-00000000-00000000-00000000
CPUID 8000000F: 00000000-00000000-00000000-00000000
CPUID 80000010: 00000000-00000000-00000000-00000000
CPUID 80000011: 00000000-00000000-00000000-00000000
CPUID 80000012: 00000000-00000000-00000000-00000000
CPUID 80000013: 00000000-00000000-00000000-00000000
CPUID 80000014: 00000000-00000000-00000000-00000000
CPUID 80000015: 00000000-00000000-00000000-00000000
CPUID 80000016: 00000000-00000000-00000000-00000000
CPUID 80000017: 00000000-00000000-00000000-00000000
CPUID 80000018: 00000000-00000000-00000000-00000000
CPUID 80000019: F060F040-40200000-00000000-00000000
CPUID 8000001A: 00000006-00000000-00000000-00000000
CPUID 8000001B: 00081BFF-00000000-00000000-00000000
CPUID 8000001C: 00000000-00000000-00000000-00000000
CPUID 8000001D: 00004121-02C0003F-0000003F-00000000 [SL 00] [L1D: 48 KB]
CPUID 8000001D: 00004122-01C0003F-0000003F-00000000 [SL 01] [L1I: 32 KB]
CPUID 8000001D: 00004143-03C0003F-000003FF-00000002 [SL 02] [L2U: 1 MB]
CPUID 8000001D: 0001C163-03C0003F-00001FFF-00000001 [SL 03] [L3U: 8 MB]
CPUID 8000001E: 00000001-00000100-00000000-00000000
CPUID 8000001F: 00000001-000000B3-00000000-00000000
CPUID 80000020: 00000000-0000007E-00000000-00000000 [SL 00]
CPUID 80000020: 0000000C-00000000-00000000-0000000F [SL 01]
CPUID 80000020: 0000000C-00000000-00000000-0000000F [SL 02]
CPUID 80000020: 00000000-00000002-0000007F-00000000 [SL 03]
CPUID 80000020: 00000014-0000001F-00000001-00000000 [SL 05]
CPUID 80000021: 597FFFCF-00080382-00000000-00000000
CPUID 80000022: 00000007-00104106-0000000F-00000000
CPUID 80000023: 00000000-00000000-00000000-00000000
CPUID 80000024: 00000000-00000000-00000000-00000000
CPUID 80000025: 00000000-00000000-00000000-00000000
CPUID 80000026: 60000001-00000002-00000100-00000001 [SL 00] [P-core]
CPUID 80000026: 40000004-00000008-00000201-00000001 [SL 01]
CPUID 80000026: 40000004-00000008-00000302-00000001 [SL 02]
CPUID 80000026: 00000004-00000008-00000403-00000001 [SL 03]
CPUID 80000027: 00000003-00000000-00000000-00000000
CPUID 80000028: 00000000-00000000-00000000-00000000
CPUID 8FFFFFFF: 00000000-00000000-00000000-00000000

L1    Data Cache:    48 KB, 12-way Associative, 64-byte Line
L1  Instr. Cache:    32 KB,  8-way Associative, 64-byte Line
L2 Unified Cache:     1 MB, 16-way Associative, 64-byte Line
L3 Unified Cache:     8 MB, 16-way Associative, 64-byte Line

------[ CPUID Registers / Logical CPU #2 ]------

allcpu: Package 0 / Core 1 / Thread 0: Valid, AMD E-core

CPUID 00000000: 00000010-68747541-444D4163-69746E65 [AuthenticAMD]
CPUID 00000001: 00B60F80-02080800-7ED8320B-178BFBFF
CPUID 00000002: 00000000-00000000-00000000-00000000
CPUID 00000003: 00000000-00000000-00000000-00000000
CPUID 00000005: 00000040-00000040-00000003-00000021
CPUID 00000006: 00000004-00000000-00000001-00000000
CPUID 00000007: 00000001-F1BF97AB-19405FCE-10000110 [SL 00]
CPUID 00000007: 00000030-00000000-00000000-00000000 [SL 01]
CPUID 00000008: 00000000-00000000-00000000-00000000
CPUID 00000009: 00000000-00000000-00000000-00000000
CPUID 0000000A: 00000000-00000000-00000000-00000000
CPUID 0000000B: 00000001-00000002-00000100-00000002 [SL 00]
CPUID 0000000B: 00000004-00000008-00000201-00000002 [SL 01]
CPUID 0000000C: 00000000-00000000-00000000-00000000
CPUID 0000000D: 000002E7-00000980-00000988-00000000 [SL 00] [x87]
CPUID 0000000D: 0000000F-00000990-00001800-00000000 [SL 01] [SSE]
CPUID 0000000D: 00000100-00000240-00000000-00000000 [SL 02] [AVX]
CPUID 0000000D: 00000040-00000340-00000000-00000000 [SL 05] [AVX-512 Opmask]
CPUID 0000000D: 00000200-00000380-00000000-00000000 [SL 06] [AVX-512 Hi256]
CPUID 0000000D: 00000400-00000580-00000000-00000000 [SL 07] [AVX-512 Hi16]
CPUID 0000000D: 00000008-00000980-00000000-00000000 [SL 09] [PKRU]
CPUID 0000000D: 00000010-00000000-00000001-00000000 [SL 0B] [CET_U]
CPUID 0000000D: 00000018-00000000-00000001-00000000 [SL 0C] [CET_S]
CPUID 0000000E: 00000000-00000000-00000000-00000000
CPUID 0000000F: 00000000-00000FFF-00000000-00000002 [SL 00]
CPUID 0000000F: 00000014-00000040-00000FFF-00000007 [SL 01]
CPUID 00000010: 00000000-00000002-00000000-00000000 [SL 00]
CPUID 00000010: 0000000F-00000000-00000004-0000000F [SL 01]
CPUID 80000000: 80000028-68747541-444D4163-69746E65 [AuthenticAMD]
CPUID 80000001: 00B60F80-10000000-75C237FF-2FD3FBFF
CPUID 80000002: 20444D41-657A7952-4941206E-34203520 [AMD Ryzen AI 5 4]
CPUID 80000003: 77203033-6152202F-6E6F6564-30343820 [30 w/ Radeon 840]
CPUID 80000004: 0000004D-00000000-00000000-00000000 [M]
CPUID 80000005: FF60FF40-FF60FF40-300C0140-20080140 [L1D: 48 KB / L1I: 32 KB]
CPUID 80000006: 40802040-60804040-04008140-00409140 [L2: 1024 KB / L3: 8192 KB]
CPUID 80000007: 00000000-0000003B-00000000-00006799
CPUID 80000008: 00003030-791EF257-00004007-00010000
CPUID 80000009: 00000000-00000000-00000000-00000000
CPUID 8000000A: 00000001-00008000-00000000-FEBFBDFF
CPUID 8000000B: 00000000-00000000-00000000-00000000
CPUID 8000000C: 00000000-00000000-00000000-00000000
CPUID 8000000D: 00000000-00000000-00000000-00000000
CPUID 8000000E: 00000000-00000000-00000000-00000000
CPUID 8000000F: 00000000-00000000-00000000-00000000
CPUID 80000010: 00000000-00000000-00000000-00000000
CPUID 80000011: 00000000-00000000-00000000-00000000
CPUID 80000012: 00000000-00000000-00000000-00000000
CPUID 80000013: 00000000-00000000-00000000-00000000
CPUID 80000014: 00000000-00000000-00000000-00000000
CPUID 80000015: 00000000-00000000-00000000-00000000
CPUID 80000016: 00000000-00000000-00000000-00000000
CPUID 80000017: 00000000-00000000-00000000-00000000
CPUID 80000018: 00000000-00000000-00000000-00000000
CPUID 80000019: F060F040-40200000-00000000-00000000
CPUID 8000001A: 00000006-00000000-00000000-00000000
CPUID 8000001B: 00081BFF-00000000-00000000-00000000
CPUID 8000001C: 00000000-00000000-00000000-00000000
CPUID 8000001D: 00004121-02C0003F-0000003F-00000000 [SL 00] [L1D: 48 KB]
CPUID 8000001D: 00004122-01C0003F-0000003F-00000000 [SL 01] [L1I: 32 KB]
CPUID 8000001D: 00004143-03C0003F-000003FF-00000002 [SL 02] [L2U: 1 MB]
CPUID 8000001D: 0001C163-03C0003F-00001FFF-00000001 [SL 03] [L3U: 8 MB]
CPUID 8000001E: 00000002-00000101-00000000-00000000
CPUID 8000001F: 00000001-000000B3-00000000-00000000
CPUID 80000020: 00000000-0000007E-00000000-00000000 [SL 00]
CPUID 80000020: 0000000C-00000000-00000000-0000000F [SL 01]
CPUID 80000020: 0000000C-00000000-00000000-0000000F [SL 02]
CPUID 80000020: 00000000-00000002-0000007F-00000000 [SL 03]
CPUID 80000020: 00000014-0000001F-00000001-00000000 [SL 05]
CPUID 80000021: 597FFFCF-00080382-00000000-00000000
CPUID 80000022: 00000007-00104106-0000000F-00000000
CPUID 80000023: 00000000-00000000-00000000-00000000
CPUID 80000024: 00000000-00000000-00000000-00000000
CPUID 80000025: 00000000-00000000-00000000-00000000
CPUID 80000026: 60000001-10000002-00000100-00000002 [SL 00] [E-core]
CPUID 80000026: 40000004-00000008-00000201-00000002 [SL 01]
CPUID 80000026: 40000004-00000008-00000302-00000002 [SL 02]
CPUID 80000026: 00000004-00000008-00000403-00000002 [SL 03]
CPUID 80000027: 00000003-00000000-00000000-00000000
CPUID 80000028: 00000000-00000000-00000000-00000000
CPUID 8FFFFFFF: 00000000-00000000-00000000-00000000

L1    Data Cache:    48 KB, 12-way Associative, 64-byte Line
L1  Instr. Cache:    32 KB,  8-way Associative, 64-byte Line
L2 Unified Cache:     1 MB, 16-way Associative, 64-byte Line
L3 Unified Cache:     8 MB, 16-way Associative, 64-byte Line

------[ CPUID Registers / Logical CPU #3 ]------

allcpu: Package 0 / Core 1 / Thread 1: Valid, Virtual, AMD E-core

CPUID 00000000: 00000010-68747541-444D4163-69746E65 [AuthenticAMD]
CPUID 00000001: 00B60F80-03080800-7ED8320B-178BFBFF
CPUID 00000002: 00000000-00000000-00000000-00000000
CPUID 00000003: 00000000-00000000-00000000-00000000
CPUID 00000005: 00000040-00000040-00000003-00000021
CPUID 00000006: 00000004-00000000-00000001-00000000
CPUID 00000007: 00000001-F1BF97AB-19405FCE-10000110 [SL 00]
CPUID 00000007: 00000030-00000000-00000000-00000000 [SL 01]
CPUID 00000008: 00000000-00000000-00000000-00000000
CPUID 00000009: 00000000-00000000-00000000-00000000
CPUID 0000000A: 00000000-00000000-00000000-00000000
CPUID 0000000B: 00000001-00000002-00000100-00000003 [SL 00]
CPUID 0000000B: 00000004-00000008-00000201-00000003 [SL 01]
CPUID 0000000C: 00000000-00000000-00000000-00000000
CPUID 0000000D: 000002E7-00000980-00000988-00000000 [SL 00] [x87]
CPUID 0000000D: 0000000F-00000990-00001800-00000000 [SL 01] [SSE]
CPUID 0000000D: 00000100-00000240-00000000-00000000 [SL 02] [AVX]
CPUID 0000000D: 00000040-00000340-00000000-00000000 [SL 05] [AVX-512 Opmask]
CPUID 0000000D: 00000200-00000380-00000000-00000000 [SL 06] [AVX-512 Hi256]
CPUID 0000000D: 00000400-00000580-00000000-00000000 [SL 07] [AVX-512 Hi16]
CPUID 0000000D: 00000008-00000980-00000000-00000000 [SL 09] [PKRU]
CPUID 0000000D: 00000010-00000000-00000001-00000000 [SL 0B] [CET_U]
CPUID 0000000D: 00000018-00000000-00000001-00000000 [SL 0C] [CET_S]
CPUID 0000000E: 00000000-00000000-00000000-00000000
CPUID 0000000F: 00000000-00000FFF-00000000-00000002 [SL 00]
CPUID 0000000F: 00000014-00000040-00000FFF-00000007 [SL 01]
CPUID 00000010: 00000000-00000002-00000000-00000000 [SL 00]
CPUID 00000010: 0000000F-00000000-00000004-0000000F [SL 01]
CPUID 80000000: 80000028-68747541-444D4163-69746E65 [AuthenticAMD]
CPUID 80000001: 00B60F80-10000000-75C237FF-2FD3FBFF
CPUID 80000002: 20444D41-657A7952-4941206E-34203520 [AMD Ryzen AI 5 4]
CPUID 80000003: 77203033-6152202F-6E6F6564-30343820 [30 w/ Radeon 840]
CPUID 80000004: 0000004D-00000000-00000000-00000000 [M]
CPUID 80000005: FF60FF40-FF60FF40-300C0140-20080140 [L1D: 48 KB / L1I: 32 KB]
CPUID 80000006: 40802040-60804040-04008140-00409140 [L2: 1024 KB / L3: 8192 KB]
CPUID 80000007: 00000000-0000003B-00000000-00006799
CPUID 80000008: 00003030-791EF257-00004007-00010000
CPUID 80000009: 00000000-00000000-00000000-00000000
CPUID 8000000A: 00000001-00008000-00000000-FEBFBDFF
CPUID 8000000B: 00000000-00000000-00000000-00000000
CPUID 8000000C: 00000000-00000000-00000000-00000000
CPUID 8000000D: 00000000-00000000-00000000-00000000
CPUID 8000000E: 00000000-00000000-00000000-00000000
CPUID 8000000F: 00000000-00000000-00000000-00000000
CPUID 80000010: 00000000-00000000-00000000-00000000
CPUID 80000011: 00000000-00000000-00000000-00000000
CPUID 80000012: 00000000-00000000-00000000-00000000
CPUID 80000013: 00000000-00000000-00000000-00000000
CPUID 80000014: 00000000-00000000-00000000-00000000
CPUID 80000015: 00000000-00000000-00000000-00000000
CPUID 80000016: 00000000-00000000-00000000-00000000
CPUID 80000017: 00000000-00000000-00000000-00000000
CPUID 80000018: 00000000-00000000-00000000-00000000
CPUID 80000019: F060F040-40200000-00000000-00000000
CPUID 8000001A: 00000006-00000000-00000000-00000000
CPUID 8000001B: 00081BFF-00000000-00000000-00000000
CPUID 8000001C: 00000000-00000000-00000000-00000000
CPUID 8000001D: 00004121-02C0003F-0000003F-00000000 [SL 00] [L1D: 48 KB]
CPUID 8000001D: 00004122-01C0003F-0000003F-00000000 [SL 01] [L1I: 32 KB]
CPUID 8000001D: 00004143-03C0003F-000003FF-00000002 [SL 02] [L2U: 1 MB]
CPUID 8000001D: 0001C163-03C0003F-00001FFF-00000001 [SL 03] [L3U: 8 MB]
CPUID 8000001E: 00000003-00000101-00000000-00000000
CPUID 8000001F: 00000001-000000B3-00000000-00000000
CPUID 80000020: 00000000-0000007E-00000000-00000000 [SL 00]
CPUID 80000020: 0000000C-00000000-00000000-0000000F [SL 01]
CPUID 80000020: 0000000C-00000000-00000000-0000000F [SL 02]
CPUID 80000020: 00000000-00000002-0000007F-00000000 [SL 03]
CPUID 80000020: 00000014-0000001F-00000001-00000000 [SL 05]
CPUID 80000021: 597FFFCF-00080382-00000000-00000000
CPUID 80000022: 00000007-00104106-0000000F-00000000
CPUID 80000023: 00000000-00000000-00000000-00000000
CPUID 80000024: 00000000-00000000-00000000-00000000
CPUID 80000025: 00000000-00000000-00000000-00000000
CPUID 80000026: 60000001-10000002-00000100-00000003 [SL 00] [E-core]
CPUID 80000026: 40000004-00000008-00000201-00000003 [SL 01]
CPUID 80000026: 40000004-00000008-00000302-00000003 [SL 02]
CPUID 80000026: 00000004-00000008-00000403-00000003 [SL 03]
CPUID 80000027: 00000003-00000000-00000000-00000000
CPUID 80000028: 00000000-00000000-00000000-00000000
CPUID 8FFFFFFF: 00000000-00000000-00000000-00000000

L1    Data Cache:    48 KB, 12-way Associative, 64-byte Line
L1  Instr. Cache:    32 KB,  8-way Associative, 64-byte Line
L2 Unified Cache:     1 MB, 16-way Associative, 64-byte Line
L3 Unified Cache:     8 MB, 16-way Associative, 64-byte Line

------[ CPUID Registers / Logical CPU #4 ]------

allcpu: Package 0 / Core 2 / Thread 0: Valid, AMD E-core

CPUID 00000000: 00000010-68747541-444D4163-69746E65 [AuthenticAMD]
CPUID 00000001: 00B60F80-04080800-7ED8320B-178BFBFF
CPUID 00000002: 00000000-00000000-00000000-00000000
CPUID 00000003: 00000000-00000000-00000000-00000000
CPUID 00000005: 00000040-00000040-00000003-00000021
CPUID 00000006: 00000004-00000000-00000001-00000000
CPUID 00000007: 00000001-F1BF97AB-19405FCE-10000110 [SL 00]
CPUID 00000007: 00000030-00000000-00000000-00000000 [SL 01]
CPUID 00000008: 00000000-00000000-00000000-00000000
CPUID 00000009: 00000000-00000000-00000000-00000000
CPUID 0000000A: 00000000-00000000-00000000-00000000
CPUID 0000000B: 00000001-00000002-00000100-00000004 [SL 00]
CPUID 0000000B: 00000004-00000008-00000201-00000004 [SL 01]
CPUID 0000000C: 00000000-00000000-00000000-00000000
CPUID 0000000D: 000002E7-00000980-00000988-00000000 [SL 00] [x87]
CPUID 0000000D: 0000000F-00000990-00001800-00000000 [SL 01] [SSE]
CPUID 0000000D: 00000100-00000240-00000000-00000000 [SL 02] [AVX]
CPUID 0000000D: 00000040-00000340-00000000-00000000 [SL 05] [AVX-512 Opmask]
CPUID 0000000D: 00000200-00000380-00000000-00000000 [SL 06] [AVX-512 Hi256]
CPUID 0000000D: 00000400-00000580-00000000-00000000 [SL 07] [AVX-512 Hi16]
CPUID 0000000D: 00000008-00000980-00000000-00000000 [SL 09] [PKRU]
CPUID 0000000D: 00000010-00000000-00000001-00000000 [SL 0B] [CET_U]
CPUID 0000000D: 00000018-00000000-00000001-00000000 [SL 0C] [CET_S]
CPUID 0000000E: 00000000-00000000-00000000-00000000
CPUID 0000000F: 00000000-00000FFF-00000000-00000002 [SL 00]
CPUID 0000000F: 00000014-00000040-00000FFF-00000007 [SL 01]
CPUID 00000010: 00000000-00000002-00000000-00000000 [SL 00]
CPUID 00000010: 0000000F-00000000-00000004-0000000F [SL 01]
CPUID 80000000: 80000028-68747541-444D4163-69746E65 [AuthenticAMD]
CPUID 80000001: 00B60F80-10000000-75C237FF-2FD3FBFF
CPUID 80000002: 20444D41-657A7952-4941206E-34203520 [AMD Ryzen AI 5 4]
CPUID 80000003: 77203033-6152202F-6E6F6564-30343820 [30 w/ Radeon 840]
CPUID 80000004: 0000004D-00000000-00000000-00000000 [M]
CPUID 80000005: FF60FF40-FF60FF40-300C0140-20080140 [L1D: 48 KB / L1I: 32 KB]
CPUID 80000006: 40802040-60804040-04008140-00409140 [L2: 1024 KB / L3: 8192 KB]
CPUID 80000007: 00000000-0000003B-00000000-00006799
CPUID 80000008: 00003030-791EF257-00004007-00010000
CPUID 80000009: 00000000-00000000-00000000-00000000
CPUID 8000000A: 00000001-00008000-00000000-FEBFBDFF
CPUID 8000000B: 00000000-00000000-00000000-00000000
CPUID 8000000C: 00000000-00000000-00000000-00000000
CPUID 8000000D: 00000000-00000000-00000000-00000000
CPUID 8000000E: 00000000-00000000-00000000-00000000
CPUID 8000000F: 00000000-00000000-00000000-00000000
CPUID 80000010: 00000000-00000000-00000000-00000000
CPUID 80000011: 00000000-00000000-00000000-00000000
CPUID 80000012: 00000000-00000000-00000000-00000000
CPUID 80000013: 00000000-00000000-00000000-00000000
CPUID 80000014: 00000000-00000000-00000000-00000000
CPUID 80000015: 00000000-00000000-00000000-00000000
CPUID 80000016: 00000000-00000000-00000000-00000000
CPUID 80000017: 00000000-00000000-00000000-00000000
CPUID 80000018: 00000000-00000000-00000000-00000000
CPUID 80000019: F060F040-40200000-00000000-00000000
CPUID 8000001A: 00000006-00000000-00000000-00000000
CPUID 8000001B: 00081BFF-00000000-00000000-00000000
CPUID 8000001C: 00000000-00000000-00000000-00000000
CPUID 8000001D: 00004121-02C0003F-0000003F-00000000 [SL 00] [L1D: 48 KB]
CPUID 8000001D: 00004122-01C0003F-0000003F-00000000 [SL 01] [L1I: 32 KB]
CPUID 8000001D: 00004143-03C0003F-000003FF-00000002 [SL 02] [L2U: 1 MB]
CPUID 8000001D: 0001C163-03C0003F-00001FFF-00000001 [SL 03] [L3U: 8 MB]
CPUID 8000001E: 00000004-00000102-00000000-00000000
CPUID 8000001F: 00000001-000000B3-00000000-00000000
CPUID 80000020: 00000000-0000007E-00000000-00000000 [SL 00]
CPUID 80000020: 0000000C-00000000-00000000-0000000F [SL 01]
CPUID 80000020: 0000000C-00000000-00000000-0000000F [SL 02]
CPUID 80000020: 00000000-00000002-0000007F-00000000 [SL 03]
CPUID 80000020: 00000014-0000001F-00000001-00000000 [SL 05]
CPUID 80000021: 597FFFCF-00080382-00000000-00000000
CPUID 80000022: 00000007-00104106-0000000F-00000000
CPUID 80000023: 00000000-00000000-00000000-00000000
CPUID 80000024: 00000000-00000000-00000000-00000000
CPUID 80000025: 00000000-00000000-00000000-00000000
CPUID 80000026: 60000001-10000002-00000100-00000004 [SL 00] [E-core]
CPUID 80000026: 40000004-00000008-00000201-00000004 [SL 01]
CPUID 80000026: 40000004-00000008-00000302-00000004 [SL 02]
CPUID 80000026: 00000004-00000008-00000403-00000004 [SL 03]
CPUID 80000027: 00000003-00000000-00000000-00000000
CPUID 80000028: 00000000-00000000-00000000-00000000
CPUID 8FFFFFFF: 00000000-00000000-00000000-00000000

L1    Data Cache:    48 KB, 12-way Associative, 64-byte Line
L1  Instr. Cache:    32 KB,  8-way Associative, 64-byte Line
L2 Unified Cache:     1 MB, 16-way Associative, 64-byte Line
L3 Unified Cache:     8 MB, 16-way Associative, 64-byte Line

------[ CPUID Registers / Logical CPU #5 ]------

allcpu: Package 0 / Core 2 / Thread 1: Valid, Virtual, AMD E-core

CPUID 00000000: 00000010-68747541-444D4163-69746E65 [AuthenticAMD]
CPUID 00000001: 00B60F80-05080800-7ED8320B-178BFBFF
CPUID 00000002: 00000000-00000000-00000000-00000000
CPUID 00000003: 00000000-00000000-00000000-00000000
CPUID 00000005: 00000040-00000040-00000003-00000021
CPUID 00000006: 00000004-00000000-00000001-00000000
CPUID 00000007: 00000001-F1BF97AB-19405FCE-10000110 [SL 00]
CPUID 00000007: 00000030-00000000-00000000-00000000 [SL 01]
CPUID 00000008: 00000000-00000000-00000000-00000000
CPUID 00000009: 00000000-00000000-00000000-00000000
CPUID 0000000A: 00000000-00000000-00000000-00000000
CPUID 0000000B: 00000001-00000002-00000100-00000005 [SL 00]
CPUID 0000000B: 00000004-00000008-00000201-00000005 [SL 01]
CPUID 0000000C: 00000000-00000000-00000000-00000000
CPUID 0000000D: 000002E7-00000980-00000988-00000000 [SL 00] [x87]
CPUID 0000000D: 0000000F-00000990-00001800-00000000 [SL 01] [SSE]
CPUID 0000000D: 00000100-00000240-00000000-00000000 [SL 02] [AVX]
CPUID 0000000D: 00000040-00000340-00000000-00000000 [SL 05] [AVX-512 Opmask]
CPUID 0000000D: 00000200-00000380-00000000-00000000 [SL 06] [AVX-512 Hi256]
CPUID 0000000D: 00000400-00000580-00000000-00000000 [SL 07] [AVX-512 Hi16]
CPUID 0000000D: 00000008-00000980-00000000-00000000 [SL 09] [PKRU]
CPUID 0000000D: 00000010-00000000-00000001-00000000 [SL 0B] [CET_U]
CPUID 0000000D: 00000018-00000000-00000001-00000000 [SL 0C] [CET_S]
CPUID 0000000E: 00000000-00000000-00000000-00000000
CPUID 0000000F: 00000000-00000FFF-00000000-00000002 [SL 00]
CPUID 0000000F: 00000014-00000040-00000FFF-00000007 [SL 01]
CPUID 00000010: 00000000-00000002-00000000-00000000 [SL 00]
CPUID 00000010: 0000000F-00000000-00000004-0000000F [SL 01]
CPUID 80000000: 80000028-68747541-444D4163-69746E65 [AuthenticAMD]
CPUID 80000001: 00B60F80-10000000-75C237FF-2FD3FBFF
CPUID 80000002: 20444D41-657A7952-4941206E-34203520 [AMD Ryzen AI 5 4]
CPUID 80000003: 77203033-6152202F-6E6F6564-30343820 [30 w/ Radeon 840]
CPUID 80000004: 0000004D-00000000-00000000-00000000 [M]
CPUID 80000005: FF60FF40-FF60FF40-300C0140-20080140 [L1D: 48 KB / L1I: 32 KB]
CPUID 80000006: 40802040-60804040-04008140-00409140 [L2: 1024 KB / L3: 8192 KB]
CPUID 80000007: 00000000-0000003B-00000000-00006799
CPUID 80000008: 00003030-791EF257-00004007-00010000
CPUID 80000009: 00000000-00000000-00000000-00000000
CPUID 8000000A: 00000001-00008000-00000000-FEBFBDFF
CPUID 8000000B: 00000000-00000000-00000000-00000000
CPUID 8000000C: 00000000-00000000-00000000-00000000
CPUID 8000000D: 00000000-00000000-00000000-00000000
CPUID 8000000E: 00000000-00000000-00000000-00000000
CPUID 8000000F: 00000000-00000000-00000000-00000000
CPUID 80000010: 00000000-00000000-00000000-00000000
CPUID 80000011: 00000000-00000000-00000000-00000000
CPUID 80000012: 00000000-00000000-00000000-00000000
CPUID 80000013: 00000000-00000000-00000000-00000000
CPUID 80000014: 00000000-00000000-00000000-00000000
CPUID 80000015: 00000000-00000000-00000000-00000000
CPUID 80000016: 00000000-00000000-00000000-00000000
CPUID 80000017: 00000000-00000000-00000000-00000000
CPUID 80000018: 00000000-00000000-00000000-00000000
CPUID 80000019: F060F040-40200000-00000000-00000000
CPUID 8000001A: 00000006-00000000-00000000-00000000
CPUID 8000001B: 00081BFF-00000000-00000000-00000000
CPUID 8000001C: 00000000-00000000-00000000-00000000
CPUID 8000001D: 00004121-02C0003F-0000003F-00000000 [SL 00] [L1D: 48 KB]
CPUID 8000001D: 00004122-01C0003F-0000003F-00000000 [SL 01] [L1I: 32 KB]
CPUID 8000001D: 00004143-03C0003F-000003FF-00000002 [SL 02] [L2U: 1 MB]
CPUID 8000001D: 0001C163-03C0003F-00001FFF-00000001 [SL 03] [L3U: 8 MB]
CPUID 8000001E: 00000005-00000102-00000000-00000000
CPUID 8000001F: 00000001-000000B3-00000000-00000000
CPUID 80000020: 00000000-0000007E-00000000-00000000 [SL 00]
CPUID 80000020: 0000000C-00000000-00000000-0000000F [SL 01]
CPUID 80000020: 0000000C-00000000-00000000-0000000F [SL 02]
CPUID 80000020: 00000000-00000002-0000007F-00000000 [SL 03]
CPUID 80000020: 00000014-0000001F-00000001-00000000 [SL 05]
CPUID 80000021: 597FFFCF-00080382-00000000-00000000
CPUID 80000022: 00000007-00104106-0000000F-00000000
CPUID 80000023: 00000000-00000000-00000000-00000000
CPUID 80000024: 00000000-00000000-00000000-00000000
CPUID 80000025: 00000000-00000000-00000000-00000000
CPUID 80000026: 60000001-10000002-00000100-00000005 [SL 00] [E-core]
CPUID 80000026: 40000004-00000008-00000201-00000005 [SL 01]
CPUID 80000026: 40000004-00000008-00000302-00000005 [SL 02]
CPUID 80000026: 00000004-00000008-00000403-00000005 [SL 03]
CPUID 80000027: 00000003-00000000-00000000-00000000
CPUID 80000028: 00000000-00000000-00000000-00000000
CPUID 8FFFFFFF: 00000000-00000000-00000000-00000000

L1    Data Cache:    48 KB, 12-way Associative, 64-byte Line
L1  Instr. Cache:    32 KB,  8-way Associative, 64-byte Line
L2 Unified Cache:     1 MB, 16-way Associative, 64-byte Line
L3 Unified Cache:     8 MB, 16-way Associative, 64-byte Line

------[ CPUID Registers / Logical CPU #6 ]------

allcpu: Package 0 / Core 3 / Thread 0: Valid, AMD E-core

CPUID 00000000: 00000010-68747541-444D4163-69746E65 [AuthenticAMD]
CPUID 00000001: 00B60F80-06080800-7ED8320B-178BFBFF
CPUID 00000002: 00000000-00000000-00000000-00000000
CPUID 00000003: 00000000-00000000-00000000-00000000
CPUID 00000005: 00000040-00000040-00000003-00000021
CPUID 00000006: 00000004-00000000-00000001-00000000
CPUID 00000007: 00000001-F1BF97AB-19405FCE-10000110 [SL 00]
CPUID 00000007: 00000030-00000000-00000000-00000000 [SL 01]
CPUID 00000008: 00000000-00000000-00000000-00000000
CPUID 00000009: 00000000-00000000-00000000-00000000
CPUID 0000000A: 00000000-00000000-00000000-00000000
CPUID 0000000B: 00000001-00000002-00000100-00000006 [SL 00]
CPUID 0000000B: 00000004-00000008-00000201-00000006 [SL 01]
CPUID 0000000C: 00000000-00000000-00000000-00000000
CPUID 0000000D: 000002E7-00000980-00000988-00000000 [SL 00] [x87]
CPUID 0000000D: 0000000F-00000990-00001800-00000000 [SL 01] [SSE]
CPUID 0000000D: 00000100-00000240-00000000-00000000 [SL 02] [AVX]
CPUID 0000000D: 00000040-00000340-00000000-00000000 [SL 05] [AVX-512 Opmask]
CPUID 0000000D: 00000200-00000380-00000000-00000000 [SL 06] [AVX-512 Hi256]
CPUID 0000000D: 00000400-00000580-00000000-00000000 [SL 07] [AVX-512 Hi16]
CPUID 0000000D: 00000008-00000980-00000000-00000000 [SL 09] [PKRU]
CPUID 0000000D: 00000010-00000000-00000001-00000000 [SL 0B] [CET_U]
CPUID 0000000D: 00000018-00000000-00000001-00000000 [SL 0C] [CET_S]
CPUID 0000000E: 00000000-00000000-00000000-00000000
CPUID 0000000F: 00000000-00000FFF-00000000-00000002 [SL 00]
CPUID 0000000F: 00000014-00000040-00000FFF-00000007 [SL 01]
CPUID 00000010: 00000000-00000002-00000000-00000000 [SL 00]
CPUID 00000010: 0000000F-00000000-00000004-0000000F [SL 01]
CPUID 80000000: 80000028-68747541-444D4163-69746E65 [AuthenticAMD]
CPUID 80000001: 00B60F80-10000000-75C237FF-2FD3FBFF
CPUID 80000002: 20444D41-657A7952-4941206E-34203520 [AMD Ryzen AI 5 4]
CPUID 80000003: 77203033-6152202F-6E6F6564-30343820 [30 w/ Radeon 840]
CPUID 80000004: 0000004D-00000000-00000000-00000000 [M]
CPUID 80000005: FF60FF40-FF60FF40-300C0140-20080140 [L1D: 48 KB / L1I: 32 KB]
CPUID 80000006: 40802040-60804040-04008140-00409140 [L2: 1024 KB / L3: 8192 KB]
CPUID 80000007: 00000000-0000003B-00000000-00006799
CPUID 80000008: 00003030-791EF257-00004007-00010000
CPUID 80000009: 00000000-00000000-00000000-00000000
CPUID 8000000A: 00000001-00008000-00000000-FEBFBDFF
CPUID 8000000B: 00000000-00000000-00000000-00000000
CPUID 8000000C: 00000000-00000000-00000000-00000000
CPUID 8000000D: 00000000-00000000-00000000-00000000
CPUID 8000000E: 00000000-00000000-00000000-00000000
CPUID 8000000F: 00000000-00000000-00000000-00000000
CPUID 80000010: 00000000-00000000-00000000-00000000
CPUID 80000011: 00000000-00000000-00000000-00000000
CPUID 80000012: 00000000-00000000-00000000-00000000
CPUID 80000013: 00000000-00000000-00000000-00000000
CPUID 80000014: 00000000-00000000-00000000-00000000
CPUID 80000015: 00000000-00000000-00000000-00000000
CPUID 80000016: 00000000-00000000-00000000-00000000
CPUID 80000017: 00000000-00000000-00000000-00000000
CPUID 80000018: 00000000-00000000-00000000-00000000
CPUID 80000019: F060F040-40200000-00000000-00000000
CPUID 8000001A: 00000006-00000000-00000000-00000000
CPUID 8000001B: 00081BFF-00000000-00000000-00000000
CPUID 8000001C: 00000000-00000000-00000000-00000000
CPUID 8000001D: 00004121-02C0003F-0000003F-00000000 [SL 00] [L1D: 48 KB]
CPUID 8000001D: 00004122-01C0003F-0000003F-00000000 [SL 01] [L1I: 32 KB]
CPUID 8000001D: 00004143-03C0003F-000003FF-00000002 [SL 02] [L2U: 1 MB]
CPUID 8000001D: 0001C163-03C0003F-00001FFF-00000001 [SL 03] [L3U: 8 MB]
CPUID 8000001E: 00000006-00000103-00000000-00000000
CPUID 8000001F: 00000001-000000B3-00000000-00000000
CPUID 80000020: 00000000-0000007E-00000000-00000000 [SL 00]
CPUID 80000020: 0000000C-00000000-00000000-0000000F [SL 01]
CPUID 80000020: 0000000C-00000000-00000000-0000000F [SL 02]
CPUID 80000020: 00000000-00000002-0000007F-00000000 [SL 03]
CPUID 80000020: 00000014-0000001F-00000001-00000000 [SL 05]
CPUID 80000021: 597FFFCF-00080382-00000000-00000000
CPUID 80000022: 00000007-00104106-0000000F-00000000
CPUID 80000023: 00000000-00000000-00000000-00000000
CPUID 80000024: 00000000-00000000-00000000-00000000
CPUID 80000025: 00000000-00000000-00000000-00000000
CPUID 80000026: 60000001-10000002-00000100-00000006 [SL 00] [E-core]
CPUID 80000026: 40000004-00000008-00000201-00000006 [SL 01]
CPUID 80000026: 40000004-00000008-00000302-00000006 [SL 02]
CPUID 80000026: 00000004-00000008-00000403-00000006 [SL 03]
CPUID 80000027: 00000003-00000000-00000000-00000000
CPUID 80000028: 00000000-00000000-00000000-00000000
CPUID 8FFFFFFF: 00000000-00000000-00000000-00000000

L1    Data Cache:    48 KB, 12-way Associative, 64-byte Line
L1  Instr. Cache:    32 KB,  8-way Associative, 64-byte Line
L2 Unified Cache:     1 MB, 16-way Associative, 64-byte Line
L3 Unified Cache:     8 MB, 16-way Associative, 64-byte Line

------[ CPUID Registers / Logical CPU #7 ]------

allcpu: Package 0 / Core 3 / Thread 1: Valid, Virtual, AMD E-core

CPUID 00000000: 00000010-68747541-444D4163-69746E65 [AuthenticAMD]
CPUID 00000001: 00B60F80-07080800-7ED8320B-178BFBFF
CPUID 00000002: 00000000-00000000-00000000-00000000
CPUID 00000003: 00000000-00000000-00000000-00000000
CPUID 00000005: 00000040-00000040-00000003-00000021
CPUID 00000006: 00000004-00000000-00000001-00000000
CPUID 00000007: 00000001-F1BF97AB-19405FCE-10000110 [SL 00]
CPUID 00000007: 00000030-00000000-00000000-00000000 [SL 01]
CPUID 00000008: 00000000-00000000-00000000-00000000
CPUID 00000009: 00000000-00000000-00000000-00000000
CPUID 0000000A: 00000000-00000000-00000000-00000000
CPUID 0000000B: 00000001-00000002-00000100-00000007 [SL 00]
CPUID 0000000B: 00000004-00000008-00000201-00000007 [SL 01]
CPUID 0000000C: 00000000-00000000-00000000-00000000
CPUID 0000000D: 000002E7-00000980-00000988-00000000 [SL 00] [x87]
CPUID 0000000D: 0000000F-00000990-00001800-00000000 [SL 01] [SSE]
CPUID 0000000D: 00000100-00000240-00000000-00000000 [SL 02] [AVX]
CPUID 0000000D: 00000040-00000340-00000000-00000000 [SL 05] [AVX-512 Opmask]
CPUID 0000000D: 00000200-00000380-00000000-00000000 [SL 06] [AVX-512 Hi256]
CPUID 0000000D: 00000400-00000580-00000000-00000000 [SL 07] [AVX-512 Hi16]
CPUID 0000000D: 00000008-00000980-00000000-00000000 [SL 09] [PKRU]
CPUID 0000000D: 00000010-00000000-00000001-00000000 [SL 0B] [CET_U]
CPUID 0000000D: 00000018-00000000-00000001-00000000 [SL 0C] [CET_S]
CPUID 0000000E: 00000000-00000000-00000000-00000000
CPUID 0000000F: 00000000-00000FFF-00000000-00000002 [SL 00]
CPUID 0000000F: 00000014-00000040-00000FFF-00000007 [SL 01]
CPUID 00000010: 00000000-00000002-00000000-00000000 [SL 00]
CPUID 00000010: 0000000F-00000000-00000004-0000000F [SL 01]
CPUID 80000000: 80000028-68747541-444D4163-69746E65 [AuthenticAMD]
CPUID 80000001: 00B60F80-10000000-75C237FF-2FD3FBFF
CPUID 80000002: 20444D41-657A7952-4941206E-34203520 [AMD Ryzen AI 5 4]
CPUID 80000003: 77203033-6152202F-6E6F6564-30343820 [30 w/ Radeon 840]
CPUID 80000004: 0000004D-00000000-00000000-00000000 [M]
CPUID 80000005: FF60FF40-FF60FF40-300C0140-20080140 [L1D: 48 KB / L1I: 32 KB]
CPUID 80000006: 40802040-60804040-04008140-00409140 [L2: 1024 KB / L3: 8192 KB]
CPUID 80000007: 00000000-0000003B-00000000-00006799
CPUID 80000008: 00003030-791EF257-00004007-00010000
CPUID 80000009: 00000000-00000000-00000000-00000000
CPUID 8000000A: 00000001-00008000-00000000-FEBFBDFF
CPUID 8000000B: 00000000-00000000-00000000-00000000
CPUID 8000000C: 00000000-00000000-00000000-00000000
CPUID 8000000D: 00000000-00000000-00000000-00000000
CPUID 8000000E: 00000000-00000000-00000000-00000000
CPUID 8000000F: 00000000-00000000-00000000-00000000
CPUID 80000010: 00000000-00000000-00000000-00000000
CPUID 80000011: 00000000-00000000-00000000-00000000
CPUID 80000012: 00000000-00000000-00000000-00000000
CPUID 80000013: 00000000-00000000-00000000-00000000
CPUID 80000014: 00000000-00000000-00000000-00000000
CPUID 80000015: 00000000-00000000-00000000-00000000
CPUID 80000016: 00000000-00000000-00000000-00000000
CPUID 80000017: 00000000-00000000-00000000-00000000
CPUID 80000018: 00000000-00000000-00000000-00000000
CPUID 80000019: F060F040-40200000-00000000-00000000
CPUID 8000001A: 00000006-00000000-00000000-00000000
CPUID 8000001B: 00081BFF-00000000-00000000-00000000
CPUID 8000001C: 00000000-00000000-00000000-00000000
CPUID 8000001D: 00004121-02C0003F-0000003F-00000000 [SL 00] [L1D: 48 KB]
CPUID 8000001D: 00004122-01C0003F-0000003F-00000000 [SL 01] [L1I: 32 KB]
CPUID 8000001D: 00004143-03C0003F-000003FF-00000002 [SL 02] [L2U: 1 MB]
CPUID 8000001D: 0001C163-03C0003F-00001FFF-00000001 [SL 03] [L3U: 8 MB]
CPUID 8000001E: 00000007-00000103-00000000-00000000
CPUID 8000001F: 00000001-000000B3-00000000-00000000
CPUID 80000020: 00000000-0000007E-00000000-00000000 [SL 00]
CPUID 80000020: 0000000C-00000000-00000000-0000000F [SL 01]
CPUID 80000020: 0000000C-00000000-00000000-0000000F [SL 02]
CPUID 80000020: 00000000-00000002-0000007F-00000000 [SL 03]
CPUID 80000020: 00000014-0000001F-00000001-00000000 [SL 05]
CPUID 80000021: 597FFFCF-00080382-00000000-00000000
CPUID 80000022: 00000007-00104106-0000000F-00000000
CPUID 80000023: 00000000-00000000-00000000-00000000
CPUID 80000024: 00000000-00000000-00000000-00000000
CPUID 80000025: 00000000-00000000-00000000-00000000
CPUID 80000026: 60000001-10000002-00000100-00000007 [SL 00] [E-core]
CPUID 80000026: 40000004-00000008-00000201-00000007 [SL 01]
CPUID 80000026: 40000004-00000008-00000302-00000007 [SL 02]
CPUID 80000026: 00000004-00000008-00000403-00000007 [SL 03]
CPUID 80000027: 00000003-00000000-00000000-00000000
CPUID 80000028: 00000000-00000000-00000000-00000000
CPUID 8FFFFFFF: 00000000-00000000-00000000-00000000

L1    Data Cache:    48 KB, 12-way Associative, 64-byte Line
L1  Instr. Cache:    32 KB,  8-way Associative, 64-byte Line
L2 Unified Cache:     1 MB, 16-way Associative, 64-byte Line
L3 Unified Cache:     8 MB, 16-way Associative, 64-byte Line

------[ All CPUs ]------

CPU   0: APICID    0 / Package 0 / Core   0 / Thread 0: Valid
CPU   1: APICID    1 / Package 0 / Core   0 / Thread 1: Valid, Virtual
CPU   2: APICID    2 / Package 0 / Core   1 / Thread 0: Valid
CPU   3: APICID    3 / Package 0 / Core   1 / Thread 1: Valid, Virtual
CPU   4: APICID    4 / Package 0 / Core   2 / Thread 0: Valid
CPU   5: APICID    5 / Package 0 / Core   2 / Thread 1: Valid, Virtual
CPU   6: APICID    6 / Package 0 / Core   3 / Thread 0: Valid
CPU   7: APICID    7 / Package 0 / Core   3 / Thread 1: Valid, Virtual

------[ MSR Registers / Logical CPU #0 ]------

CPU Clock (Normal): 2006 MHz
CPU Clock (TSC): 1996 MHz
CPU Multiplier: 20.0x
CPB PStates: 0
MSR 0000001B: 0000-0000-FEE0-0900
MSR 0000008B: 0000-0000-0B60-8038
MSR 000000E7: 0000-0031-A927-394C [S200]
MSR 000000E7: 0000-0031-AA4A-4828 [S200]
MSR 000000E7: 0000-0031-AAB7-73A8
MSR 000000E8: 0000-0066-E94F-CD85 [S200]
MSR 000000E8: 0000-0066-E968-8699 [S200]
MSR 000000E8: 0000-0066-EB17-B020
MSR 0000010B: < FAILED >
MSR C0010004: 0000-0000-0000-0000
MSR C0010005: 0000-0000-0000-0000
MSR C0010006: 0000-0000-0000-0000
MSR C0010007: 0000-0000-0000-0000
MSR C0010015: 0000-0001-C900-6011
MSR C001001F: 0000-0000-0000-0000
MSR C0010055: 0000-0000-0000-0000
MSR C0010058: 0000-0000-E000-0021
MSR C0010061: 0000-0000-0000-0020
MSR C0010062: 0000-0000-0000-0000
MSR C0010063: 0000-0000-0000-0000
MSR C0010064: 8000-0000-452F-C190 [20.00x] [0.3562 V] [ 2.00 A] [PState P0]
MSR C0010065: 8000-0000-44AA-C168 [18.00x] [0.4813 V] [ 1.80 A] [PState P1]
MSR C0010066: 8000-0000-43E5-C140 [16.00x] [0.6063 V] [ 1.50 A] [PState P2]
MSR C0010067: 0000-0000-0000-0000
MSR C0010068: 0000-0000-0000-0000
MSR C0010069: 0000-0000-0000-0000
MSR C001006A: 0000-0000-0000-0000
MSR C001006B: 0000-0000-0000-0000
MSR C0010070: < FAILED >
MSR C0010293: 0000-0040-0000-C190 [20.00x] [1.5313V]
MSR C0010293: 0000-0040-0001-8190 [20.00x] [1.5125V]
MSR C0010293: 0000-0040-0000-0190 [20.00x]
MSR C0010293: 0000-0040-0000-0190 [20.00x]
MSR C0010293: 0000-0040-0001-4190 [20.00x] [1.5188V]
MSR C0010140: 0000-0000-0000-0000
MSR C0010141: 0000-0000-0000-0000
MSR C0010290: < FAILED >
MSR C0010292: 0000-0001-0400-4B92
MSR C0010293: 0000-0040-0001-4190
MSR C0010294: 4F82-C581-02A0-8912
MSR C0010296: 0000-0000-0848-4848
MSR C0010299: 0000-0000-000A-1000
MSR C001029A: 0000-0000-0319-875F [S200]
MSR C001029A: 0000-0000-0319-875F [S200]
MSR C001029A: 0000-0000-0319-875F
MSR C001029B: 0000-0000-0E01-9F24 [S200]
MSR C001029B: 0000-0000-0E02-3809 [S200]
MSR C001029B: 0000-0000-0E02-B9E2
MSR C0011023: 0102-06D0-0000-0000

------[ MSR Registers / Logical CPU #1 ]------

CPU Clock (Normal): 4053 MHz
CPU Clock (TSC): 1996 MHz
CPU Multiplier: 40.4x
CPB PStates: 0
MSR 0000001B: 0000-0000-FEE0-0900
MSR 0000008B: 0000-0000-0B60-8038
MSR 000000E7: 0000-0031-B1EC-8834
MSR 000000E8: 0000-0066-F60E-757B
MSR 0000010B: < FAILED >
MSR C0010004: 0000-0000-0000-0000
MSR C0010005: 0000-0000-0000-0000
MSR C0010006: 0000-0000-0000-0000
MSR C0010007: 0000-0000-0000-0000
MSR C0010015: 0000-0001-C900-6011
MSR C001001F: 0000-0000-0000-0000
MSR C0010055: 0000-0000-0000-0000
MSR C0010058: 0000-0000-E000-0021
MSR C0010061: 0000-0000-0000-0020
MSR C0010062: 0000-0000-0000-0000
MSR C0010063: 0000-0000-0000-0000
MSR C0010064: 8000-0000-452F-C190 [20.00x] [0.3562 V] [ 2.00 A] [PState P0]
MSR C0010065: 8000-0000-44AA-C168 [18.00x] [0.4813 V] [ 1.80 A] [PState P1]
MSR C0010066: 8000-0000-43E5-C140 [16.00x] [0.6063 V] [ 1.50 A] [PState P2]
MSR C0010067: 0000-0000-0000-0000
MSR C0010068: 0000-0000-0000-0000
MSR C0010069: 0000-0000-0000-0000
MSR C001006A: 0000-0000-0000-0000
MSR C001006B: 0000-0000-0000-0000
MSR C0010070: < FAILED >
MSR C0010293: 0000-0040-0026-4328 [40.40x] [0.5938V]
MSR C0010293: 0000-0080-00A0-8274 [15.70x] [0.7375V]
MSR C0010293: 0000-0040-0001-C190 [20.00x] [1.5063V]
MSR C0010293: 0000-0040-0000-0190 [20.00x]
MSR C0010293: 0000-0040-0005-C190 [20.00x] [1.4063V]
MSR C0010140: 0000-0000-0000-0000
MSR C0010141: 0000-0000-0000-0000
MSR C0010290: < FAILED >
MSR C0010292: 0000-0001-0400-4B92
MSR C0010293: 0000-0040-0005-C190
MSR C0010294: 4F82-C581-02A0-8912
MSR C0010296: 0000-0000-0848-4848
MSR C0010299: 0000-0000-000A-1000
MSR C001029A: 0000-0000-0319-B4E9
MSR C001029B: 0000-0000-0E04-D0B2
MSR C0011023: 0102-06D0-0000-0000

------[ MSR Registers / Logical CPU #2 ]------

CPU Clock (Normal): 4053 MHz
CPU Clock (TSC): 1996 MHz
CPU Multiplier: 40.4x
CPB PStates: 0
MSR 0000001B: 0000-0000-FEE0-0900
MSR 0000008B: 0000-0000-0B60-8038
MSR 000000E7: 0000-0031-B992-A848
MSR 000000E8: 0000-0067-044C-C866
MSR 0000010B: < FAILED >
MSR C0010004: 0000-0000-0000-0000
MSR C0010005: 0000-0000-0000-0000
MSR C0010006: 0000-0000-0000-0000
MSR C0010007: 0000-0000-0000-0000
MSR C0010015: 0000-0001-C900-6011
MSR C001001F: 0000-0000-0000-0000
MSR C0010055: 0000-0000-0000-0000
MSR C0010058: 0000-0000-E000-0021
MSR C0010061: 0000-0000-0000-0020
MSR C0010062: 0000-0000-0000-0000
MSR C0010063: 0000-0000-0000-0000
MSR C0010064: 8000-0000-452F-C190 [20.00x] [0.3562 V] [ 2.00 A] [PState P0]
MSR C0010065: 8000-0000-44AA-C168 [18.00x] [0.4813 V] [ 1.80 A] [PState P1]
MSR C0010066: 8000-0000-43E5-C140 [16.00x] [0.6063 V] [ 1.50 A] [PState P2]
MSR C0010067: 0000-0000-0000-0000
MSR C0010068: 0000-0000-0000-0000
MSR C0010069: 0000-0000-0000-0000
MSR C001006A: 0000-0000-0000-0000
MSR C001006B: 0000-0000-0000-0000
MSR C0010070: < FAILED >
MSR C0010293: 0000-0040-0025-4328 [40.40x] [0.6188V]
MSR C0010293: 0000-0040-0000-4190 [20.00x] [1.5438V]
MSR C0010293: 0000-0040-0001-0190 [20.00x] [1.5250V]
MSR C0010293: 0000-0040-0000-4190 [20.00x] [1.5438V]
MSR C0010293: 0000-0080-0086-4274 [15.70x] [1.3938V]
MSR C0010140: 0000-0000-0000-0000
MSR C0010141: 0000-0000-0000-0000
MSR C0010290: < FAILED >
MSR C0010292: 0000-0001-0400-4B92
MSR C0010293: 0000-0080-009A-C328
MSR C0010294: 4F82-C581-02A0-8912
MSR C0010296: 0000-0000-0848-4848
MSR C0010299: 0000-0000-000A-1000
MSR C001029A: 0000-0000-0319-C339
MSR C001029B: 0000-0000-0E06-7FD2
MSR C0011023: 0102-06D0-0000-0000

------[ MSR Registers / Logical CPU #3 ]------

CPU Clock (Normal): 2006 MHz
CPU Clock (TSC): 1996 MHz
CPU Multiplier: 20.0x
CPB PStates: 0
MSR 0000001B: 0000-0000-FEE0-0900
MSR 0000008B: 0000-0000-0B60-8038
MSR 000000E7: 0000-0031-BEDC-FB78
MSR 000000E8: 0000-0067-0E13-B1FA
MSR 0000010B: < FAILED >
MSR C0010004: 0000-0000-0000-0000
MSR C0010005: 0000-0000-0000-0000
MSR C0010006: 0000-0000-0000-0000
MSR C0010007: 0000-0000-0000-0000
MSR C0010015: 0000-0001-C900-6011
MSR C001001F: 0000-0000-0000-0000
MSR C0010055: 0000-0000-0000-0000
MSR C0010058: 0000-0000-E000-0021
MSR C0010061: 0000-0000-0000-0020
MSR C0010062: 0000-0000-0000-0000
MSR C0010063: 0000-0000-0000-0000
MSR C0010064: 8000-0000-452F-C190 [20.00x] [0.3562 V] [ 2.00 A] [PState P0]
MSR C0010065: 8000-0000-44AA-C168 [18.00x] [0.4813 V] [ 1.80 A] [PState P1]
MSR C0010066: 8000-0000-43E5-C140 [16.00x] [0.6063 V] [ 1.50 A] [PState P2]
MSR C0010067: 0000-0000-0000-0000
MSR C0010068: 0000-0000-0000-0000
MSR C0010069: 0000-0000-0000-0000
MSR C001006A: 0000-0000-0000-0000
MSR C001006B: 0000-0000-0000-0000
MSR C0010070: < FAILED >
MSR C0010293: 0000-0040-0025-4328 [40.40x] [0.6188V]
MSR C0010293: 0000-0040-0013-4190 [20.00x] [1.0688V]
MSR C0010293: 0000-0040-0000-0190 [20.00x]
MSR C0010293: 0000-0040-0000-0190 [20.00x]
MSR C0010293: 0000-0040-0008-0190 [20.00x] [1.3500V]
MSR C0010140: 0000-0000-0000-0000
MSR C0010141: 0000-0000-0000-0000
MSR C0010290: < FAILED >
MSR C0010292: 0000-0001-0400-4B92
MSR C0010293: 0000-0040-0008-0190
MSR C0010294: 4F82-C581-02A0-8912
MSR C0010296: 0000-0000-0848-4848
MSR C0010299: 0000-0000-000A-1000
MSR C001029A: 0000-0000-0319-CBA4
MSR C001029B: 0000-0000-0E07-EACB
MSR C0011023: 0102-06D0-0000-0000

------[ MSR Registers / Logical CPU #4 ]------

CPU Clock (Normal): 2006 MHz
CPU Clock (TSC): 1996 MHz
CPU Multiplier: 20.0x
CPB PStates: 0
MSR 0000001B: 0000-0000-FEE0-0900
MSR 0000008B: 0000-0000-0B60-8038
MSR 000000E7: 0000-0031-C250-C80C
MSR 000000E8: 0000-0067-13BA-33CB
MSR 0000010B: < FAILED >
MSR C0010004: 0000-0000-0000-0000
MSR C0010005: 0000-0000-0000-0000
MSR C0010006: 0000-0000-0000-0000
MSR C0010007: 0000-0000-0000-0000
MSR C0010015: 0000-0001-C900-6011
MSR C001001F: 0000-0000-0000-0000
MSR C0010055: 0000-0000-0000-0000
MSR C0010058: 0000-0000-E000-0021
MSR C0010061: 0000-0000-0000-0020
MSR C0010062: 0000-0000-0000-0000
MSR C0010063: 0000-0000-0000-0000
MSR C0010064: 8000-0000-452F-C190 [20.00x] [0.3562 V] [ 2.00 A] [PState P0]
MSR C0010065: 8000-0000-44AA-C168 [18.00x] [0.4813 V] [ 1.80 A] [PState P1]
MSR C0010066: 8000-0000-43E5-C140 [16.00x] [0.6063 V] [ 1.50 A] [PState P2]
MSR C0010067: 0000-0000-0000-0000
MSR C0010068: 0000-0000-0000-0000
MSR C0010069: 0000-0000-0000-0000
MSR C001006A: 0000-0000-0000-0000
MSR C001006B: 0000-0000-0000-0000
MSR C0010070: < FAILED >
MSR C0010293: 0000-0040-0025-4328 [40.40x] [0.6188V]
MSR C0010293: 0000-0040-0001-8190 [20.00x] [1.5125V]
MSR C0010293: 0000-0040-0013-4190 [20.00x] [1.0688V]
MSR C0010293: 0000-0040-0013-C190 [20.00x] [1.0562V]
MSR C0010293: 0000-0040-0003-4190 [20.00x] [1.4688V]
MSR C0010140: 0000-0000-0000-0000
MSR C0010141: 0000-0000-0000-0000
MSR C0010290: < FAILED >
MSR C0010292: 0000-0001-0400-4B92
MSR C0010293: 0000-0040-0003-4190
MSR C0010294: 4F82-C581-02A0-8912
MSR C0010296: 0000-0000-0848-4848
MSR C0010299: 0000-0000-000A-1000
MSR C001029A: 0000-0000-0319-D862
MSR C001029B: 0000-0000-0E09-837D
MSR C0011023: 0102-06D0-0000-0000

------[ MSR Registers / Logical CPU #5 ]------

CPU Clock (Normal): 2006 MHz
CPU Clock (TSC): 1996 MHz
CPU Multiplier: 20.0x
CPB PStates: 0
MSR 0000001B: 0000-0000-FEE0-0900
MSR 0000008B: 0000-0000-0B60-8038
MSR 000000E7: 0000-0031-C71C-36B4
MSR 000000E8: 0000-0067-1BBB-2E74
MSR 0000010B: < FAILED >
MSR C0010004: 0000-0000-0000-0000
MSR C0010005: 0000-0000-0000-0000
MSR C0010006: 0000-0000-0000-0000
MSR C0010007: 0000-0000-0000-0000
MSR C0010015: 0000-0001-C900-6011
MSR C001001F: 0000-0000-0000-0000
MSR C0010055: 0000-0000-0000-0000
MSR C0010058: 0000-0000-E000-0021
MSR C0010061: 0000-0000-0000-0020
MSR C0010062: 0000-0000-0000-0000
MSR C0010063: 0000-0000-0000-0000
MSR C0010064: 8000-0000-452F-C190 [20.00x] [0.3562 V] [ 2.00 A] [PState P0]
MSR C0010065: 8000-0000-44AA-C168 [18.00x] [0.4813 V] [ 1.80 A] [PState P1]
MSR C0010066: 8000-0000-43E5-C140 [16.00x] [0.6063 V] [ 1.50 A] [PState P2]
MSR C0010067: 0000-0000-0000-0000
MSR C0010068: 0000-0000-0000-0000
MSR C0010069: 0000-0000-0000-0000
MSR C001006A: 0000-0000-0000-0000
MSR C001006B: 0000-0000-0000-0000
MSR C0010070: < FAILED >
MSR C0010293: 0000-0040-0025-4328 [40.40x] [0.6188V]
MSR C0010293: 0000-0040-0013-4190 [20.00x] [1.0688V]
MSR C0010293: 0000-0040-0000-C190 [20.00x] [1.5313V]
MSR C0010293: 0000-0040-0007-8190 [20.00x] [1.3625V]
MSR C0010293: 0000-0040-001D-C328 [40.40x] [0.8063V]
MSR C0010140: 0000-0000-0000-0000
MSR C0010141: 0000-0000-0000-0000
MSR C0010290: < FAILED >
MSR C0010292: 0000-0001-0400-4B92
MSR C0010293: 0000-0040-001D-C328
MSR C0010294: 4F82-C581-02A0-8912
MSR C0010296: 0000-0000-0848-4848
MSR C0010299: 0000-0000-000A-1000
MSR C001029A: 0000-0000-0319-E168
MSR C001029B: 0000-0000-0E0A-F683
MSR C0011023: 0102-06D0-0000-0000

------[ MSR Registers / Logical CPU #6 ]------

CPU Clock (Normal): 2006 MHz
CPU Clock (TSC): 1996 MHz
CPU Multiplier: 20.0x
CPB PStates: 0
MSR 0000001B: 0000-0000-FEE0-0900
MSR 0000008B: 0000-0000-0B60-8038
MSR 000000E7: 0000-0031-CAA6-0DA0
MSR 000000E8: 0000-0067-21D4-A355
MSR 0000010B: < FAILED >
MSR C0010004: 0000-0000-0000-0000
MSR C0010005: 0000-0000-0000-0000
MSR C0010006: 0000-0000-0000-0000
MSR C0010007: 0000-0000-0000-0000
MSR C0010015: 0000-0001-C900-6011
MSR C001001F: 0000-0000-0000-0000
MSR C0010055: 0000-0000-0000-0000
MSR C0010058: 0000-0000-E000-0021
MSR C0010061: 0000-0000-0000-0020
MSR C0010062: 0000-0000-0000-0000
MSR C0010063: 0000-0000-0000-0000
MSR C0010064: 8000-0000-452F-C190 [20.00x] [0.3562 V] [ 2.00 A] [PState P0]
MSR C0010065: 8000-0000-44AA-C168 [18.00x] [0.4813 V] [ 1.80 A] [PState P1]
MSR C0010066: 8000-0000-43E5-C140 [16.00x] [0.6063 V] [ 1.50 A] [PState P2]
MSR C0010067: 0000-0000-0000-0000
MSR C0010068: 0000-0000-0000-0000
MSR C0010069: 0000-0000-0000-0000
MSR C001006A: 0000-0000-0000-0000
MSR C001006B: 0000-0000-0000-0000
MSR C0010070: < FAILED >
MSR C0010293: 0000-0040-0025-4328 [40.40x] [0.6188V]
MSR C0010293: 0000-0040-0007-8190 [20.00x] [1.3625V]
MSR C0010293: 0000-0040-0001-4190 [20.00x] [1.5188V]
MSR C0010293: 0000-0080-00A0-8274 [15.70x] [0.7375V]
MSR C0010293: 0000-0040-0007-C190 [20.00x] [1.3563V]
MSR C0010140: 0000-0000-0000-0000
MSR C0010141: 0000-0000-0000-0000
MSR C0010290: < FAILED >
MSR C0010292: 0000-0001-0400-4B92
MSR C0010293: 0000-0040-0007-C190
MSR C0010294: 4F82-C581-02A0-8912
MSR C0010296: 0000-0000-0848-4848
MSR C0010299: 0000-0000-000A-1000
MSR C001029A: 0000-0000-0319-EC8C
MSR C001029B: 0000-0000-0E0C-9B9D
MSR C0011023: 0102-06D0-0000-0000

------[ MSR Registers / Logical CPU #7 ]------

CPU Clock (Normal): 2006 MHz
CPU Clock (TSC): 1996 MHz
CPU Multiplier: 20.0x
CPB PStates: 0
MSR 0000001B: 0000-0000-FEE0-0900
MSR 0000008B: 0000-0000-0B60-8038
MSR 000000E7: 0000-0031-CE51-3E84
MSR 000000E8: 0000-0067-27E1-DAAA
MSR 0000010B: < FAILED >
MSR C0010004: 0000-0000-0000-0000
MSR C0010005: 0000-0000-0000-0000
MSR C0010006: 0000-0000-0000-0000
MSR C0010007: 0000-0000-0000-0000
MSR C0010015: 0000-0001-C900-6011
MSR C001001F: 0000-0000-0000-0000
MSR C0010055: 0000-0000-0000-0000
MSR C0010058: 0000-0000-E000-0021
MSR C0010061: 0000-0000-0000-0020
MSR C0010062: 0000-0000-0000-0000
MSR C0010063: 0000-0000-0000-0000
MSR C0010064: 8000-0000-452F-C190 [20.00x] [0.3562 V] [ 2.00 A] [PState P0]
MSR C0010065: 8000-0000-44AA-C168 [18.00x] [0.4813 V] [ 1.80 A] [PState P1]
MSR C0010066: 8000-0000-43E5-C140 [16.00x] [0.6063 V] [ 1.50 A] [PState P2]
MSR C0010067: 0000-0000-0000-0000
MSR C0010068: 0000-0000-0000-0000
MSR C0010069: 0000-0000-0000-0000
MSR C001006A: 0000-0000-0000-0000
MSR C001006B: 0000-0000-0000-0000
MSR C0010070: < FAILED >
MSR C0010293: 0000-0040-0025-4328 [40.40x] [0.6188V]
MSR C0010293: 0000-0040-001F-C190 [20.00x] [0.7563V]
MSR C0010293: 0000-0040-000B-C190 [20.00x] [1.2563V]
MSR C0010293: 0000-0040-0000-0190 [20.00x]
MSR C0010293: 0000-0040-0003-0190 [20.00x] [1.4750V]
MSR C0010140: 0000-0000-0000-0000
MSR C0010141: 0000-0000-0000-0000
MSR C0010290: < FAILED >
MSR C0010292: 0000-0001-0400-4B92
MSR C0010293: 0000-0040-0003-0190
MSR C0010294: 4F82-C581-02A0-8912
MSR C0010296: 0000-0000-0848-4848
MSR C0010299: 0000-0000-000A-1000
MSR C001029A: 0000-0000-0319-F445
MSR C001029B: 0000-0000-0E0E-0185
MSR C0011023: 0102-06D0-0000-0000
