------[ Versions ]------

Program Version : AIDA64 Engineer v5.99.4917 Beta
BenchDLL Version: 4.3.793-x64
Windows Version : Microsoft Windows 7 Ultimate 6.1.7601.18741 Service Pack 1 (64-bit)

------[ CPU Info ]------

CPU Type          : QuadCore AMD A10-7850K, 4000 MHz (40 x 100)
CPU Alias         : Kaveri
CPU Platform      : Socket FM2+
CPU Stepping      : KV-A1
Instruction Set   : x86, x86-64, MMX, SSE, SSE2, SSE3, SSSE3, SSE4.1, SSE4.2, SSE4A, XOP, AVX, FMA, FMA4, AES
CPUID Manufacturer: AuthenticAMD
CPUID CPU Name    : AMD A10-7850K Radeon R7, 12 Compute Cores 4C+8G
CPUID Revision    : 00630F01h
Platform ID       : D1h  (Socket FM2+)
HTT / CMP Units   : 0 / 4
Max. NUMA Node    : 0

Tjmax Temperature    : 0 Celsius
HTC Temperature Limit: 80 Celsius
CPU TDP              : 95.1 W

------[ Motherboard Info ]------

Motherboard ID      : 63-0100-000001-00101111-041312-Chipset$F2A88XM-D3H_BIOS DATE: 04/09/15 13:55:54 VER: 04.06.05
Motherboard Model   : Gigabyte GA-F2A88XM-D3H
Motherboard Chipset : AMD A88X, AMD K15.3

DMI MB Manufacturer : Gigabyte Technology Co., Ltd.
DMI MB Product      : F2A88XM-D3H
DMI MB Version      : x.x
DMI MB Serial       : To be filled by O.E.M.
DMI SYS Manufacturer: Gigabyte Technology Co., Ltd.
DMI SYS Product     : To be filled by O.E.M.
DMI SYS Version     : To be filled by O.E.M.
DMI SYS Serial      : To be filled by O.E.M.
DMI BIOS Version    : F8


------[ Logical CPU #0 ]------

allcpu: Package 0 / Core 0 / Thread 0: Valid

CPUID 00000000: 0000000D-68747541-444D4163-69746E65 [AuthenticAMD]
CPUID 00000001: 00630F01-00040800-3E98320B-178BFBFF
CPUID 00000002: 00000000-00000000-00000000-00000000
CPUID 00000003: 00000000-00000000-00000000-00000000
CPUID 00000005: 00000040-00000040-00000003-00000000
CPUID 00000006: 00000000-00000000-00000001-00000000
CPUID 00000007: 00000000-00000009-00000000-00000000
CPUID 00000008: 00000000-00000000-00000000-00000000
CPUID 00000009: 00000000-00000000-00000000-00000000
CPUID 0000000A: 00000000-00000000-00000000-00000000
CPUID 0000000C: 00000000-00000000-00000000-00000000
CPUID 0000000D: 00000007-00000340-000003C0-40000000 [SL 00] [x87]
CPUID 0000000D: 00000001-00000000-00000000-00000000 [SL 01] [SSE]
CPUID 0000000D: 00000100-00000240-00000000-00000000 [SL 02] [AVX]
CPUID 0000000D: 00000080-00000340-00000000-00000000 [SL 3E]
CPUID 80000000: 8000001E-68747541-444D4163-69746E65 [AuthenticAMD]
CPUID 80000001: 00630F01-10000000-0FEBBFFF-2FD3FBFF
CPUID 80000002: 20444D41-2D303141-30353837-6152204B [AMD A10-7850K Ra]
CPUID 80000003: 6E6F6564-2C375220-20323120-706D6F43 [deon R7, 12 Comp]
CPUID 80000004: 20657475-65726F43-43342073-0047382B [ute Cores 4C+8G]
CPUID 80000005: FF40FF18-FF40FF30-10040140-60030140
CPUID 80000006: 64006400-64004200-08008140-00000000
CPUID 80000007: 00000000-00000001-00000000-000027D9
CPUID 80000008: 00003030-00000000-00004003-00000000
CPUID 80000009: 00000000-00000000-00000000-00000000
CPUID 8000000A: 00000001-00010000-00000000-00001CFF
CPUID 8000000B: 00000000-00000000-00000000-00000000
CPUID 8000000C: 00000000-00000000-00000000-00000000
CPUID 8000000D: 00000000-00000000-00000000-00000000
CPUID 8000000E: 00000000-00000000-00000000-00000000
CPUID 8000000F: 00000000-00000000-00000000-00000000
CPUID 80000010: 00000000-00000000-00000000-00000000
CPUID 80000011: 00000000-00000000-00000000-00000000
CPUID 80000012: 00000000-00000000-00000000-00000000
CPUID 80000013: 00000000-00000000-00000000-00000000
CPUID 80000014: 00000000-00000000-00000000-00000000
CPUID 80000015: 00000000-00000000-00000000-00000000
CPUID 80000016: 00000000-00000000-00000000-00000000
CPUID 80000017: 00000000-00000000-00000000-00000000
CPUID 80000018: 00000000-00000000-00000000-00000000
CPUID 80000019: F040F018-64006400-00000000-00000000
CPUID 8000001A: 00000003-00000000-00000000-00000000
CPUID 8000001B: 000001FF-00000000-00000000-00000000
CPUID 8000001C: 00000000-80032013-00010200-E000000F
CPUID 8000001D: 00000121-00C0003F-0000003F-00000000 [SL 00]
CPUID 8000001D: 00004122-0080003F-000001FF-00000000 [SL 01]
CPUID 8000001D: 00004143-03C0003F-000007FF-00000001 [SL 02]
CPUID 8000001E: 00000010-00000100-00000000-00000000
CPUID 8FFFFFFF: 00000000-00000000-00000000-00000000

L1    Data Cache:    16 KB,  4-way Associative, 64-byte Line
L1  Instr. Cache:    96 KB,  3-way Associative, 64-byte Line
L2 Unified Cache:     2 MB, 16-way Associative, 64-byte Line

------[ Logical CPU #1 ]------

allcpu: Package 0 / Core 1 / Thread 0: Valid

CPUID 00000000: 0000000D-68747541-444D4163-69746E65 [AuthenticAMD]
CPUID 00000001: 00630F01-01040800-3E98320B-178BFBFF
CPUID 00000002: 00000000-00000000-00000000-00000000
CPUID 00000003: 00000000-00000000-00000000-00000000
CPUID 00000005: 00000040-00000040-00000003-00000000
CPUID 00000006: 00000000-00000000-00000001-00000000
CPUID 00000007: 00000000-00000009-00000000-00000000
CPUID 00000008: 00000000-00000000-00000000-00000000
CPUID 00000009: 00000000-00000000-00000000-00000000
CPUID 0000000A: 00000000-00000000-00000000-00000000
CPUID 0000000C: 00000000-00000000-00000000-00000000
CPUID 0000000D: 00000007-00000340-000003C0-40000000 [SL 00] [x87]
CPUID 0000000D: 00000001-00000000-00000000-00000000 [SL 01] [SSE]
CPUID 0000000D: 00000100-00000240-00000000-00000000 [SL 02] [AVX]
CPUID 0000000D: 00000080-00000340-00000000-00000000 [SL 3E]
CPUID 80000000: 8000001E-68747541-444D4163-69746E65 [AuthenticAMD]
CPUID 80000001: 00630F01-10000000-0FEBBFFF-2FD3FBFF
CPUID 80000002: 20444D41-2D303141-30353837-6152204B [AMD A10-7850K Ra]
CPUID 80000003: 6E6F6564-2C375220-20323120-706D6F43 [deon R7, 12 Comp]
CPUID 80000004: 20657475-65726F43-43342073-0047382B [ute Cores 4C+8G]
CPUID 80000005: FF40FF18-FF40FF30-10040140-60030140
CPUID 80000006: 64006400-64004200-08008140-00000000
CPUID 80000007: 00000000-00000001-00000000-000027D9
CPUID 80000008: 00003030-00000000-00004003-00000000
CPUID 80000009: 00000000-00000000-00000000-00000000
CPUID 8000000A: 00000001-00010000-00000000-00001CFF
CPUID 8000000B: 00000000-00000000-00000000-00000000
CPUID 8000000C: 00000000-00000000-00000000-00000000
CPUID 8000000D: 00000000-00000000-00000000-00000000
CPUID 8000000E: 00000000-00000000-00000000-00000000
CPUID 8000000F: 00000000-00000000-00000000-00000000
CPUID 80000010: 00000000-00000000-00000000-00000000
CPUID 80000011: 00000000-00000000-00000000-00000000
CPUID 80000012: 00000000-00000000-00000000-00000000
CPUID 80000013: 00000000-00000000-00000000-00000000
CPUID 80000014: 00000000-00000000-00000000-00000000
CPUID 80000015: 00000000-00000000-00000000-00000000
CPUID 80000016: 00000000-00000000-00000000-00000000
CPUID 80000017: 00000000-00000000-00000000-00000000
CPUID 80000018: 00000000-00000000-00000000-00000000
CPUID 80000019: F040F018-64006400-00000000-00000000
CPUID 8000001A: 00000003-00000000-00000000-00000000
CPUID 8000001B: 000001FF-00000000-00000000-00000000
CPUID 8000001C: 00000000-80032013-00010200-E000000F
CPUID 8000001D: 00000121-00C0003F-0000003F-00000000 [SL 00]
CPUID 8000001D: 00004122-0080003F-000001FF-00000000 [SL 01]
CPUID 8000001D: 00004143-03C0003F-000007FF-00000001 [SL 02]
CPUID 8000001E: 00000011-00000100-00000000-00000000
CPUID 8FFFFFFF: 00000000-00000000-00000000-00000000

L1    Data Cache:    16 KB,  4-way Associative, 64-byte Line
L1  Instr. Cache:    96 KB,  3-way Associative, 64-byte Line
L2 Unified Cache:     2 MB, 16-way Associative, 64-byte Line

------[ Logical CPU #2 ]------

allcpu: Package 0 / Core 2 / Thread 0: Valid

CPUID 00000000: 0000000D-68747541-444D4163-69746E65 [AuthenticAMD]
CPUID 00000001: 00630F01-02040800-3E98320B-178BFBFF
CPUID 00000002: 00000000-00000000-00000000-00000000
CPUID 00000003: 00000000-00000000-00000000-00000000
CPUID 00000005: 00000040-00000040-00000003-00000000
CPUID 00000006: 00000000-00000000-00000001-00000000
CPUID 00000007: 00000000-00000009-00000000-00000000
CPUID 00000008: 00000000-00000000-00000000-00000000
CPUID 00000009: 00000000-00000000-00000000-00000000
CPUID 0000000A: 00000000-00000000-00000000-00000000
CPUID 0000000C: 00000000-00000000-00000000-00000000
CPUID 0000000D: 00000007-00000340-000003C0-40000000 [SL 00] [x87]
CPUID 0000000D: 00000001-00000000-00000000-00000000 [SL 01] [SSE]
CPUID 0000000D: 00000100-00000240-00000000-00000000 [SL 02] [AVX]
CPUID 0000000D: 00000080-00000340-00000000-00000000 [SL 3E]
CPUID 80000000: 8000001E-68747541-444D4163-69746E65 [AuthenticAMD]
CPUID 80000001: 00630F01-10000000-0FEBBFFF-2FD3FBFF
CPUID 80000002: 20444D41-2D303141-30353837-6152204B [AMD A10-7850K Ra]
CPUID 80000003: 6E6F6564-2C375220-20323120-706D6F43 [deon R7, 12 Comp]
CPUID 80000004: 20657475-65726F43-43342073-0047382B [ute Cores 4C+8G]
CPUID 80000005: FF40FF18-FF40FF30-10040140-60030140
CPUID 80000006: 64006400-64004200-08008140-00000000
CPUID 80000007: 00000000-00000001-00000000-000027D9
CPUID 80000008: 00003030-00000000-00004003-00000000
CPUID 80000009: 00000000-00000000-00000000-00000000
CPUID 8000000A: 00000001-00010000-00000000-00001CFF
CPUID 8000000B: 00000000-00000000-00000000-00000000
CPUID 8000000C: 00000000-00000000-00000000-00000000
CPUID 8000000D: 00000000-00000000-00000000-00000000
CPUID 8000000E: 00000000-00000000-00000000-00000000
CPUID 8000000F: 00000000-00000000-00000000-00000000
CPUID 80000010: 00000000-00000000-00000000-00000000
CPUID 80000011: 00000000-00000000-00000000-00000000
CPUID 80000012: 00000000-00000000-00000000-00000000
CPUID 80000013: 00000000-00000000-00000000-00000000
CPUID 80000014: 00000000-00000000-00000000-00000000
CPUID 80000015: 00000000-00000000-00000000-00000000
CPUID 80000016: 00000000-00000000-00000000-00000000
CPUID 80000017: 00000000-00000000-00000000-00000000
CPUID 80000018: 00000000-00000000-00000000-00000000
CPUID 80000019: F040F018-64006400-00000000-00000000
CPUID 8000001A: 00000003-00000000-00000000-00000000
CPUID 8000001B: 000001FF-00000000-00000000-00000000
CPUID 8000001C: 00000000-80032013-00010200-E000000F
CPUID 8000001D: 00000121-00C0003F-0000003F-00000000 [SL 00]
CPUID 8000001D: 00004122-0080003F-000001FF-00000000 [SL 01]
CPUID 8000001D: 00004143-03C0003F-000007FF-00000001 [SL 02]
CPUID 8000001E: 00000012-00000101-00000000-00000000
CPUID 8FFFFFFF: 00000000-00000000-00000000-00000000

L1    Data Cache:    16 KB,  4-way Associative, 64-byte Line
L1  Instr. Cache:    96 KB,  3-way Associative, 64-byte Line
L2 Unified Cache:     2 MB, 16-way Associative, 64-byte Line

------[ Logical CPU #3 ]------

allcpu: Package 0 / Core 3 / Thread 0: Valid

CPUID 00000000: 0000000D-68747541-444D4163-69746E65 [AuthenticAMD]
CPUID 00000001: 00630F01-03040800-3E98320B-178BFBFF
CPUID 00000002: 00000000-00000000-00000000-00000000
CPUID 00000003: 00000000-00000000-00000000-00000000
CPUID 00000005: 00000040-00000040-00000003-00000000
CPUID 00000006: 00000000-00000000-00000001-00000000
CPUID 00000007: 00000000-00000009-00000000-00000000
CPUID 00000008: 00000000-00000000-00000000-00000000
CPUID 00000009: 00000000-00000000-00000000-00000000
CPUID 0000000A: 00000000-00000000-00000000-00000000
CPUID 0000000C: 00000000-00000000-00000000-00000000
CPUID 0000000D: 00000007-00000340-000003C0-40000000 [SL 00] [x87]
CPUID 0000000D: 00000001-00000000-00000000-00000000 [SL 01] [SSE]
CPUID 0000000D: 00000100-00000240-00000000-00000000 [SL 02] [AVX]
CPUID 0000000D: 00000080-00000340-00000000-00000000 [SL 3E]
CPUID 80000000: 8000001E-68747541-444D4163-69746E65 [AuthenticAMD]
CPUID 80000001: 00630F01-10000000-0FEBBFFF-2FD3FBFF
CPUID 80000002: 20444D41-2D303141-30353837-6152204B [AMD A10-7850K Ra]
CPUID 80000003: 6E6F6564-2C375220-20323120-706D6F43 [deon R7, 12 Comp]
CPUID 80000004: 20657475-65726F43-43342073-0047382B [ute Cores 4C+8G]
CPUID 80000005: FF40FF18-FF40FF30-10040140-60030140
CPUID 80000006: 64006400-64004200-08008140-00000000
CPUID 80000007: 00000000-00000001-00000000-000027D9
CPUID 80000008: 00003030-00000000-00004003-00000000
CPUID 80000009: 00000000-00000000-00000000-00000000
CPUID 8000000A: 00000001-00010000-00000000-00001CFF
CPUID 8000000B: 00000000-00000000-00000000-00000000
CPUID 8000000C: 00000000-00000000-00000000-00000000
CPUID 8000000D: 00000000-00000000-00000000-00000000
CPUID 8000000E: 00000000-00000000-00000000-00000000
CPUID 8000000F: 00000000-00000000-00000000-00000000
CPUID 80000010: 00000000-00000000-00000000-00000000
CPUID 80000011: 00000000-00000000-00000000-00000000
CPUID 80000012: 00000000-00000000-00000000-00000000
CPUID 80000013: 00000000-00000000-00000000-00000000
CPUID 80000014: 00000000-00000000-00000000-00000000
CPUID 80000015: 00000000-00000000-00000000-00000000
CPUID 80000016: 00000000-00000000-00000000-00000000
CPUID 80000017: 00000000-00000000-00000000-00000000
CPUID 80000018: 00000000-00000000-00000000-00000000
CPUID 80000019: F040F018-64006400-00000000-00000000
CPUID 8000001A: 00000003-00000000-00000000-00000000
CPUID 8000001B: 000001FF-00000000-00000000-00000000
CPUID 8000001C: 00000000-80032013-00010200-E000000F
CPUID 8000001D: 00000121-00C0003F-0000003F-00000000 [SL 00]
CPUID 8000001D: 00004122-0080003F-000001FF-00000000 [SL 01]
CPUID 8000001D: 00004143-03C0003F-000007FF-00000001 [SL 02]
CPUID 8000001E: 00000013-00000101-00000000-00000000
CPUID 8FFFFFFF: 00000000-00000000-00000000-00000000

L1    Data Cache:    16 KB,  4-way Associative, 64-byte Line
L1  Instr. Cache:    96 KB,  3-way Associative, 64-byte Line
L2 Unified Cache:     2 MB, 16-way Associative, 64-byte Line

------[ All CPUs ]------

CPU   0: APICID   16 / Package 0 / Core   0 / Thread 0: Valid
CPU   1: APICID   17 / Package 0 / Core   1 / Thread 0: Valid
CPU   2: APICID   18 / Package 0 / Core   2 / Thread 0: Valid
CPU   3: APICID   19 / Package 0 / Core   3 / Thread 0: Valid

------[ MSR Registers ]------

CPU Clock (Normal): 1708 MHz
CPU Clock (TSC): 3685 MHz
CPU Multiplier: 17.0x
CPB PStates: 3
MSR 0000001B: 0000-0000-FEE0-0900
MSR 0000008B: 0000-0000-0600-3106
MSR 000000E7: 0000-0000-039C-A8EC [S200]
MSR 000000E7: 0000-0000-0007-4304 [S200]
MSR 000000E7: 0000-0000-0019-CF6D
MSR 000000E8: 0000-0000-000C-2C4A [S200]
MSR 000000E8: 0000-0000-0006-C00B [S200]
MSR 000000E8: 0000-0000-0003-1AED
MSR C0010004: 0000-0000-0000-0000
MSR C0010005: 0000-0000-0000-0000
MSR C0010006: 0000-0000-0000-0000
MSR C0010007: 0000-0000-0000-0000
MSR C0010015: 0000-0000-0900-1011
MSR C001001F: 0040-4000-0885-0000
MSR C0010055: 0000-0000-0000-0000
MSR C0010058: 0000-0000-E000-0021
MSR C0010061: 0000-0000-0000-0040
MSR C0010062: 0000-0000-0000-0000
MSR C0010063: 0000-0000-0000-0000
MSR C0010064: 8000-01A2-0000-3418 [40.00x] [1.3875 V] [16.20 A] [PState Pb0]
MSR C0010065: 8000-001A-0000-3817 [39.00x] [1.3750 V] [26.00 A] [PState Pb1]
MSR C0010066: 8000-01F5-0000-3C16 [38.00x] [1.3625 V] [24.50 A] [PState Pb2]
MSR C0010067: 8000-01C3-0000-4C15 [37.00x] [1.3125 V] [19.50 A] [PState P0]
MSR C0010068: 8000-01AA-0000-5813 [35.00x] [1.2750 V] [17.00 A] [PState P1]
MSR C0010069: 8000-017D-0000-8C0E [30.00x] [1.1125 V] [12.50 A] [PState P2]
MSR C001006A: 8000-0152-0000-AC08 [24.00x] [1.0125 V] [ 8.20 A] [PState P3]
MSR C001006B: 8000-0139-0000-C852 [17.00x] [0.9250 V] [ 5.70 A] [PState P4]
MSR C0010070: 0000-0000-3600-3418
MSR C0010071: 0000-0006-4240-3418 [40.00x] [1.3875V]
MSR C0010071: 0100-0006-4247-C852 [17.00x] [0.1250V]
MSR C0010071: 0000-0006-4247-C852 [17.00x] [0.1250V]
MSR C0010071: 0100-0006-4247-C852 [17.00x] [0.1250V]
MSR C0010071: 0100-0006-4247-C852 [17.00x] [0.1250V]
MSR C0010140: 0000-0000-0000-0004
MSR C0010141: 0000-0000-0000-0000
MSR C0011023: 8102-4004-0078-1220

PerformanceFrequency = 3606767

CPU Clock M.Method = 6  (APIC K10)
PM Timer Address   = 2056  (0808h)

APIC Clock = 100.54 MHz  (AT = 52679 / TT = 15004 / try = 1 / SKL = 0.00 MHz)
APIC Clock =  99.83 MHz  (AT = 52307 / TT = 15005 / try = 1 / SKL = 0.00 MHz)
APIC Clock = 100.54 MHz  (AT = 52685 / TT = 15006 / try = 1 / SKL = 0.00 MHz)
APIC Clock =  99.83 MHz  (AT = 52318 / TT = 15007 / try = 1 / SKL = 0.00 MHz)
APIC Clock =  99.82 MHz  (AT = 52310 / TT = 15006 / try = 1 / SKL = 0.00 MHz)

CPU Clock = 1709.12 MHz / TSC Clock = 3693.32 MHz / CPU Mul = 17.00x
CPU Clock = 1709.17 MHz / TSC Clock = 3693.29 MHz / CPU Mul = 17.00x
CPU Clock = 1709.15 MHz / TSC Clock = 3693.31 MHz / CPU Mul = 17.00x
CPU Clock = 1709.18 MHz / TSC Clock = 3693.31 MHz / CPU Mul = 17.00x
CPU Clock = 1709.18 MHz / TSC Clock = 3693.25 MHz / CPU Mul = 17.00x

CPU Clock Max = 4051.16 MHz / TSC Clock = 3693.29 MHz / CPU Mul = 40.00x
CPU Clock Max = 4051.19 MHz / TSC Clock = 3693.30 MHz / CPU Mul = 40.00x
CPU Clock Max = 4004.66 MHz / TSC Clock = 3693.27 MHz / CPU Mul = 40.00x
CPU Clock Max = 4021.23 MHz / TSC Clock = 3693.27 MHz / CPU Mul = 40.00x
CPU Clock Max = 3993.10 MHz / TSC Clock = 3693.28 MHz / CPU Mul = 40.00x
