------[ CPUID Registers / Logical CPU #0 ]------

allcpu: Package 0 / Core 0 / Thread 0: Valid

CPUID 00000000: 00000003-74726F56-436F5320-36387865 [Vortex86 SoC]
CPUID 00000001: 00000611-00000000-00000000-0380AB39
CPUID 00000002: 00000001-00000042-02500008-0403000C
CPUID 00000003: 00000000-00000000-00000000-00000000
CPUID 80000000: 80000004-00000000-00000000-00000000
CPUID 80000001: 00000000-00000000-00000000-00000000
CPUID 80000002: 74726F56-36387865-20335844-20202020 [Vortex86DX3     ]
CPUID 80000003: 20202020-20202020-20202020-20202020 [                ]
CPUID 80000004: 20202020-20202020-20202020-20202020 [                ]

------[ CPUID Registers / Logical CPU #1 ]------

allcpu: Package 0 / Core 0 / Thread 0: Valid

CPUID 00000000: 00000003-74726F56-436F5320-36387865 [Vortex86 SoC]
CPUID 00000001: 00000611-01000000-00000000-0380AB39
CPUID 00000002: 00000001-00000042-02500008-0403000C
CPUID 00000003: 00000000-00000000-00000000-00000000
CPUID 80000000: 80000004-00000000-00000000-00000000
CPUID 80000001: 00000000-00000000-00000000-00000000
CPUID 80000002: 74726F56-36387865-20335844-20202020 [Vortex86DX3     ]
CPUID 80000003: 20202020-20202020-20202020-20202020 [                ]
CPUID 80000004: 20202020-20202020-20202020-20202020 [                ]

------[ All CPUs ]------

CPU   0: APICID    0 / Package 0 / Core   0 / Thread 0: Valid
CPU   1: APICID    1 / Package 0 / Core   0 / Thread 0: Valid

------[ MSR Registers / Logical CPU #0 ]------


------[ MSR Registers / Logical CPU #1 ]------

